,날짜,기사 제목,기사 링크,기사 출처,기사 내용
59,2011-02-13,초중고생 `오래달리기' 9년전比 50초↓,https://news.naver.com/main/read.nhn?mode=LSD&mid=shm&sid1=103&oid=001&aid=0004908789,연합뉴스,"""윗몸일으키기..아 힘들다"" (자료사진)`윗몸일으키기' 등 체력항목 하향추세(서울=연합뉴스) 이준삼 기자 = 서울지역 초·중·고등학생의 2009년도 `오래달리기' 성적이 2000년도 학생들의 기록과 비교해 최대 50초가량 떨어진 것으로 나타났다.`윗몸일으키기', `제자리멀리뛰기' 등 대부분의 측정항목도 하향추세가 뚜렷해 학생들의 체력저하 현상이 갈수록 심각해지고 있음을 반영했다.13일 연합뉴스가 서울시교육청의 `2000~2009학년도 서울교육통계연보'에서 초5, 중2, 고2 학생의 체력·체격 변화를 분석한 결과에 따르면 학생들의 신장은 9년 전과 비교해 2~3㎝, 몸무게는 2~3㎏ 증가했다.키는 남학생은 초5 144.5㎝(2.2㎝ 증가), 중2 165㎝(1.7㎝ 증가), 고2 165.2㎝ (0.4㎝ 증가)였고, 여학생도 학교급 별로 1~2㎝가량 커졌다.남학생 몸무게는 초5 41.5㎏, 중2 58.6㎏, 고2 67.2㎏ 등으로 9년 전보다 각각 2.9㎏, 3.1㎏, 2.5㎏ 늘었다. 여학생은 초5, 중2가 2~3㎏가량 늘어난 반면 고2는 거의 변화가 없었다.학생들의 체력은 거의 모든 측정항목에서 하향세가 뚜렷했다.남학생 `오래달리기'(초 1000ｍ, 중·고 1600ｍ)의 경우 2000년도 초5 6분11초, 중2 8분44초, 고2 7분49초 등이었지만 2009년도에는 각각 6분31초, 9분23초, 8분25초 등으로 최대 40초 가량 기록이 떨어졌다.여학생도 각각 6분55초, 8분39초, 8분11초 등으로 9년 전과 비교해 평균기록이 최대 50초가량 늦춰졌다. 중·고 여학생 대상 `오래달리기' 측정거리는 1천200ｍ다.`제자리멀리뛰기'는 초5(148.6→151.7㎝)를 제외한 중2(210.7→195.3㎝), 고2 (236→216㎝) 기록이 크게 떨어졌고 `윗몸 일으키기'도 남여학생 모두 2~3개 정도 줄었다.이밖에도 신체 유연성을 측정하는 `앉아 윗몸 앞으로 굽히기'에서 남학생은 5학년을 제외한 중2, 중3의 기록이 과거보다 3㎝정도 줄었다. 여학생은 대체로 상승세를 보였다.시교육청 관계자는 ""측정결과가 학생들의 체력저하 현상을 반영한다고 볼 수도 있지만, 평가가 성적에 반영되지 않다 보니 학생들이 적극적으로 참여하지 않아 기록이 잘 나오지 않은 측면도 있는 것 같다""고 말했다.시교육청은 ""작년 2학기부터 비만도, 지구력 등 학생들의 전반적인 체력상태를 학부모가 손쉽게 파악하고 맞춤형 처방을 제공받을 수 있는 새로운 체력평가 프로그램을 도입했다""며 ""앞으로 상황은 크게 개선될 것""이라고 말했다.한편, 한국교육개발원에 따르면 전국 초·중·고의 학생 1인당 체육장 면적은 초·중학생의 경우 매년 증가한 반면 일반고교는 30년 전보다 오히려 줄어든 것으로 나타났다.구체적으로 보면 2010년 초·중학교의 1인당 체육장 면적은 각각 14.4㎡, 12.6㎡로 30년 전인 1980년의 10㎡, 8.6㎡에 비해 증가했지만 일반고교는 1980년(10.8㎡)보다 줄어든 10.5㎡에 불과했다.이는 입시교육 풍토에서 일선 고교들이 교과학습 위주로 시설을 늘린 데 따라 빚어진 현상으로 추정된다.jslee@yna.co.kr<뉴스의 새 시대, 연합뉴스 Live><모바일 애플리케이션><포토 매거진><저작권자(c)연합뉴스. 무단전재-재배포금지.>"
60,2011-02-13,가파른 자취·하숙비…'일시불'까지 등장,https://news.naver.com/main/read.nhn?mode=LSD&mid=shm&sid1=102&oid=001&aid=0004908793,연합뉴스,"취업도 안되는데 방값까지 오르고.. (자료사진)'전세 없고 월세도 목돈 요구' 학생 불만 고조'자취난민 신세' 방값에 쫓겨 산동네 이사도(서울=연합뉴스) 사건팀 = 서울지역 대학가에 올해 들어 '일시불 하숙비'라는 신조어가 등장하며 주거 비용이 크게 올라 새 학기를 앞두고 집을 구하려는 학생들의 불만이 커지고 있다.일시불제란 하숙집 주인들이 제때 학생을 구하기 어렵다는 이유와 현금 융통성 등을 들어 최소 6개월에서 길게는 1년치 하숙비를 현금으로 미리 받는 것을 말한다.13일 서울 주요 대학가의 하숙집 주인과 하숙생, 부동산중개업소에 따르면 일시불을 요구하는 하숙집이 동국대, 숙명여대 등 도심 대학가를 중심으로 눈에 띄게 늘고 있다.보증금 부담이 없고 초반 비용 부담이 상대적으로 덜한 하숙의 장점마저 사라지는 셈이다.숙명여대 4학년 윤모(25)씨는 ""오래 살지 않아 하숙비 변동은 없지만 처음 집에 들어올 때 최소 6개월치는 일시금으로 내야 한다고 들었다""며 ""주인의 말에 황당해할 수 밖에 없었다""고 말했다.서울지역 다른 대학에 다니는 친구들도 6개월~1년치 방값을 한 번에 모두 지급한 경우가 간혹 있다고 윤씨는 전했다.제대 후 서울 중구에서 살 집을 찾는 동국대생 권모(25)씨 형제도 비슷한 경험을 했다.보증금 부담 탓에 하숙집을 알아보려고 대여섯 곳을 들렀지만 마음에 드는 곳을 찾기란 쉽지 않았다 .한 곳에서는 매달 45만원인 하숙비 1년치를 한꺼번에 현찰로 내면 50만원을 할인해 주겠다는 제안을 받았다. 당연히 카드 결제는 안 된다는 설명이 뒤따랐다.권씨는 ""1960~1970년대 지어진 것 같은 하숙집이었는데 다른 집과 비용은 비슷했다""고 말했다.서울시내에서 하숙하는 대학생 김모(21·여)씨도 ""요즘 전세대란 탓에 보증금과 월세 모두 비싸졌다""며 ""하숙을 해야 할 것 같은데 친구 중에는 하숙집 아줌마의 잔소리가 너무 심해 울분을 토하며 운 친구도 있다""고 했다.반면 해마다 치솟는 월세 부담을 줄이고자 부모의 지원을 받아 목돈으로 집을 구하려는 학생들은 전세대란의 여파로 전셋집 자체를 구하는 일이 '하늘의 별 따기'가 됐다.신축 건물을 빼고 대학가에서 전세는 거의 나오지 않기 때문이다. 그나마 2007년부터 전셋값이 꾸준히 올라 2천500만원 정도 거래되던 전세가 지금은 7천만원을 호가하는 곳도 있다.지난해 한양대 주변 1인용 고급 원룸으로 전세 6천만원 안팎의 방이 나오긴 했으나 현재는 아예 물량을 찾아볼 수 없다.성균관대 인근 전세가는 작년과 비교해 대략 500만~1천만원, 10~15% 정도 뛰었다.성대 인근에서 중개업을 하는 이모(48)씨는 ""학교 주변엔 전세가 거의 없다. 금리가 낮아 집주인이 전세를 내놓을 이유도 없고, 방 수요도 높은 지역이라 월세로 놓는 게 이득이다""고 말했다.경희대 주변에는 2천만원 안팎의 전셋방이 극소수 나오긴 하지만 대부분 옥탑방에 외부 화장실 등 시설이 낡고 불편하다. 일부 대학가의 7천만~1억원 정도 전세는 학생들에게는 `그림의 떡'이다.하숙비와 자취비가 가파르게 오르면서 학생 부담도 커지고 있다.대학가마다 다르지만 통상 40만~50만원을 내야 하는 하숙·자취비는 매년 2만~5만원씩 오르고 있다고 한다.10평 내외 원룸을 기준으로 10년 전만 해도 보증금 없이 매달 20여만원을 내면 충분했지만 지금은 월세로 45만~50만원이 기본이다.개조했거나 신축 건물의 원룸이면 월세 50만원에 별도의 보증금 1천만원을 부르는 방이 많다.이 때문에 요즘은 대학에서 다소 떨어진 곳에 집을 구하거나 2~5평 크기의 고시원으로 옮기기도 하고 40만원 이상의 월세를 감당하기 어려워 아르바이트 전선에 뛰어드는 학생도 많다.한국외대 근처에서 자취한다는 3학년생 김모씨는 ""처음에는 부모님이 방값을 내주셨는데 점점 오르니까 손 벌리기 죄송했다. 아르바이트를 열심히 하고 나서야 방값을 별 부담 없이 낼 수 있었다""고 말했다.신림동 고시촌에서 사법고시를 준비하는 임모(27)씨도 ""부모님이 매달 돈을 보내주시지만 빠듯한 게 느껴진다. 방값이 계속 올라 점점 산 쪽으로 이사하고 있다""고 말했다.[관련기사]▶ <연합시론> 전세대책, 공급 확대에 더 치중해야▶ <대학가 방 구하기 겁난다..기숙사도 '바늘구멍'>▶ ""싼방 없나요""..경기 대학가 전세난 심화<뉴스의 새 시대, 연합뉴스 Live><모바일 애플리케이션><포토 매거진><저작권자(c)연합뉴스. 무단전재-재배포금지.>"
61,2011-02-13,[주간부동산]`1.13대책 한달` 전셋값은 계속 오른다,https://news.naver.com/main/read.nhn?mode=LSD&mid=shm&sid1=101&oid=018&aid=0002386179,이데일리,"- 매매..서울 0.02%↑·신도시 0.03%↑·수도권 0.04%↑- 전세..서울 0.10%↑·신도시 0.28%↑·수도권 0.24%↑[이데일리 이태호 기자] `1.13 전월세 시장 안정화 방안`이 발표된 지 한 달이 지났지만 여전히 주요 지역 아파트의 전셋값 상승세가 지속됐다.또 일부 지역에서 전세에서 매매로 갈아타는 실수요자들의 움직임이 꾸준히 이어졌다. 덕분에 전국 아파트 매매가격도 미미한 오름세를 지속했다.12일 부동산정보업체 부동산114에 따르면 설 연휴가 포함된 지난 2주(1월28일 이후) 동안 아파트 매매시장은 ▲서울(0.02%) ▲신도시(0.03%) ▲수도권(0.04%)에서 모두 소폭의 상승세를 나타냈다.전셋값 역시 ▲서울(0.10%) ▲신도시(0.28%) ▲수도권(0.24%) 모두 올랐다.◇ 재건축단지가 매매가격 상승 주도서울 자치구별 매매시장은 ▲송파(0.06%) ▲강동(0.04%) ▲중구(0.04%) ▲노원(0.03%) ▲동작(0.03%) ▲서초(0.03%) ▲강남(0.01%) 순으로 올랐다.송파와 강동구는 재건축 단지가 상승세를 주도했다. 송파는 가락동 가락시영 1, 2차가 재건축 진행 기대감에 500만~1000만원 정도 올랐다. 강동은 상일동 고덕주공 5, 6단지가 연내 이주 기대감으로 500만~1000만원 가량 상승했다.신도시는 ▲분당(0.02) ▲평촌(0.09%) ▲산본(0.09%) ▲중동(0.01%) 등이 올랐고 일산은 변동이 없었다.평촌은 전세 부족이 이어지면서 중소형 중심으로 실수요자 거래가 이어졌고 일부 중대형으로 확산되는 모습을 보였다. 호계동 샘쌍용, 샘임광, 샘한양 등지의 중대형 면적이 500만~1000만원 정도 상승했다.수도권은 경기 남부지역이 실수요자 중심의 소형 저가 매수세로 오름세를 보였다. 광명(0.14%) ▲수원(0.12%) ▲평택(0.11%) ▲성남(0.10%) ▲양주(0.10%) ▲하남(0.07%) ▲용인(0.06%) ▲이천(0.06%) 순으로 상승했다.광명은 상대적으로 저렴한 중소형 주공단지 매매가격이 실수요자에 힘입어 올랐다. 철산동 주공 12단지, 하안동 주공 9단지 등 중소형 면적이 750만~1000만원 올랐다. 수원 역시 전셋값 상승으로 저가 중소형 거래가 나타났다.◇ `설 끝났다` 신혼부부 전세수요 몰려서울 자치구별 전세시장은 설 이후 수요가 크게 늘지는 않았으나 신혼부부 등 신규 수요가 꾸준히 이어지면서 ▲마포(0.23%) ▲강동(0.22%) ▲영등포(0.22%) ▲관악(0.20%) ▲금천(0.20%) ▲서대문(0.20%) 순으로 올랐다.마포는 여의도와 시청, 광화문 업무시설 접근이 용이한 신공덕동 메트로디오빌와 신수동 대원칸타빌 등의 중소형 면적이 1000만원 정도 올랐다. 강동은 새 아파트에 대한 수요가 이어지면서 강일동 강일리버파크 1~4단지와 고덕동 고덕1단지아이파크 등 중소형 면적이 500만~1500만원 가량 상승했다.신도시는 신혼부부 수요와 싼 전세를 찾아 나온 서울 수요로 비교적 높은 오름세를 지속했다. ▲분당(0.30%) ▲일산(0.29%) ▲평촌(0.24%) ▲산본(0.44%) ▲중동(0.12%) 등지가 모두 상승했다.산본동 세종주공 6단지, 목련우방, 한국공영 등 중소형 면적이 500만원 정도 상승했다. 분당은 중소형은 물론, 중대형 면적도 올랐다. 구미동 무지개동아, 수내동 양지금호 등 중대형 면적이 1000만~2000만원 상승했다.수도권 전세시장 역시 물건 부족 속에 경기 남부 지역 중심으로 올랐다. ▲용인(0.53%) ▲고양(0.47%) ▲수원(0.43%) ▲성남(0.38%) ▲광명(0.37%) ▲구리(0.31%) ▲하남(0.23%) ▲화성(0.23%) 순으로 상승했다.신봉동 신봉센트레빌(1-1B) 중대형 면적이 1500만~2000만원 올랐고 상현동 용인상현힐스테이트 대형도 500만~1500만원 상승했다. 고양은 풍동 성원, 행신동 소만신안 등 중소형 면적이 750만원 정도 올랐다.▶ 찌라시는 가라!..스마트브리프하루 두번 무료로 만나보세요.▶ 이데일리ON, 문자로 시세,추천,진단,상담정보 -#2200▶ 이데일리 모바일ㆍ실시간 해외지수/SMS<3993+show/nate/ez-i>▶ 가장 빠른 글로벌 경제뉴스ㆍ금융정보 터미널,이데일리 MARKETPOINT＜ⓒ종합 경제정보 미디어 이데일리 - 무단전재&재배포 금지＞＜안방에서 만나는 가장 빠른 경제뉴스ㆍ돈이 되는 재테크정보 -이데일리TV＞이태호  (thlee@)"
62,2011-02-13,불어난 가계빚..뛰는 금리에 `비상',https://news.naver.com/main/read.nhn?mode=LSD&mid=shm&sid1=101&oid=001&aid=0004908822,연합뉴스,"<그래픽> 가계.주택담보.신용대출 추이    (서울=연합뉴스) 김토일 기자 = 본격적인 금리 상승기에 접어들면서 가계의 빚부담이 날로 커지고 있다.    이에 따라 금융당국은 가계부채의 연착륙을 위해 세제 지원책을 검토하는 한편 서민금융 활성화 등 취약계층에 대한 금융지원책도 마련할 계획이다.    kmtoil@yna.co.kr    @yonhap_graphics(트위터)(서울=연합뉴스) 윤선희 류지복 홍정규 기자 = 본격적인 금리 상승기에 접어들면서 가계의 빚부담이 날로 커지고 있다.금리 인상과 가계부채 증가세가 맞물려 돌아가면 경제성장의 발목을 잡을 수 있다는 경고도 적지 않게 나오고 있다. 초저금리에 빚을 낸 대출자들이 금리 인상에 불어난 이자 갚기에 허덕이다 파산하면 금융기관 도산, 경기 침체 등으로 이어질 수 있기 때문이다.이에 따라 금융당국은 가계부채의 연착륙을 위해 세제 지원책을 검토하는 한편 서민금융 활성화 등 취약계층에 대한 금융지원책도 마련할 계획이다.◇대출금리 급등..가계 이자부담에 허덕13일 금융권에 따르면 회사원 김모(47)씨는 인천 주안동 소재 아파트 구입을 위해 2009년초 3개월 변동 금리로 은행에서 1억3천만원을 대출받았다. 그러나 대출 금리가 당시 연 4.4%에서 현재 5.4%로 높아지는 바람에 김씨가 상환해야 하는 월 이자액은 45만5천원에서 58만3천원으로 12만8천원이나 늘어나 연간 추가 이자부담액이 153만6천원이나 증가했다. 김씨는 2명의 자녀 사교육비와 함께 이자갚기에도 빠듯한 실정이라고 하소연했다.대출 금리 산정의 기준이 되는 양도성예금증서(CD) 금리가 작년말 연 2.80%에서 1개월 보름도 안 돼 연 3.12%까지 0.32%포인트나 뛰자 각종 대출 금리도 급등했다. 이에 따라 시중은행의 CD 연동 주택담보대출 금리는 최고 6% 중반까지, 신용대출 최고 금리는 연 10% 중반까지 치솟았다.하나은행의 CD 연동 주택대출 금리는 오는 14일 연 5.00∼6.50%로 작년말의 연 4.68∼6.18%보다 0.32%포인트 오른다.우리은행도 CD 연동 주택대출 금리를 14일 연 4.51∼5.83%로 지난 주말보다 0.01%포인트 올리기로 했다.국민은행의 CD 연동 신용대출 금리는 이번주 연 6.36∼10.55%로 작년말보다 0.56%포인트 급등했다. 코픽스 연동 신용대출 금리도 하나은행은 작년말 연 5.66∼8.09%에서 최근 연 5.89∼8.32%로 올랐다.삼성경제연구소는 작년 3분기말 가계부채를 기준으로 대출금리가 2%포인트 오르면 가계의 이자부담은 분기당 11조7천억원에서 16조1천억원으로 4조5천억원 늘어날 것으로 추정했다.더구나 기준금리는 내달에도 추가 인상될 가능성이 커 대출자들의 이자부담은 더욱 확대될 것으로 전문가들은 관측하고 있다.◇서민 대출 비중↑..대출 부실 '경고등'또 금융기관의 가계대출과 개인 금융부채는 이르면 올해 상반기 내에 각각 600조원과 1천조원 돌파를 눈앞에 두고 있다.은행 및 비은행의 가계대출은 작년 11월말 현재 590조2천억원에서 올해 상반기 내에 600조원을 넘어설 가능성이 크다.제2금융권 대출과 신용카드 사용액 등을 추가한 가계신용과 개인부문(영세기업 포함) 금융부채는 작년 3분기말 각각 770조원과 955조9천억원에서 분기마다 각각 14조3천억원과 15조3천억원씩 늘어나 늦어도 올해 3분기에 각각 800조원과 1천조원을 넘어설 것으로 관측된다.삼성경제연구소 이은미 수석연구원은 ""금리는 오르는 반면 증시의 변동성은 커져 가계부채를 둘러싼 여건은 나빠질 것""이라며 ""가파른 대출 증가에 금리인상 속도가 가속화하면서 신용등급이 낮은 서민층 대출자들의 부담은 더욱 불어날 것""이라고 말했다.코리아크레디트뷰로(KCB)에 따르면 신용등급별 가계대출 비중은 상위권인 1∼3등급은 ▲2008년말 35.7% ▲2009년말 34.9% ▲2010년말 33.7% 등으로 낮아진 반면 서민과 중산층으로 분류되는 4∼7등급은 같은 기간 ▲54.6% ▲55.8% ▲57.8% 등으로 높아져 부실 위험이 커진 것으로 분석됐다.실제 대출의 부실화는 비교적 빠른 속도로 진행되고 있다. 가계여신의 부실채권비율은 2009년말 0.49%에서 작년말 0.56%로 뛰었고 2008년말 0.42%이던 주택담보대출 부실채권비율은 작년말 0.49%로 높아졌다.◇정부, 장기.고정금리 대출 활성화 유인책 검토정부는 우선 올해 가계부채를 중점 정책 대상의 하나로 정할 만큼 가계부채의 안정적 관리에 신경을 쓰고 있다.무엇보다 주택담보대출의 구조개선에 정책의 역점을 둘 계획이다. 높은 가계부채는 금리 상승시 가계의 부담 증가로 이어지고 결국 금융회사까지 동반 부실화하는 요인으로 작용할 수 있다는 인식 때문이다.정부는 주택담보대출의 장기.고정금리를 활성화하기 위해 금리를 우대하고 연말정산시 혜택을 주는 세제 지원책을 검토하고 있다. 분할상환 대출을 확대하고 거치기간 연장 관행을 축소하는 방안도 추진한다.금리 인상으로 서민층의 부담이 커질 수 있다고 보고 서민금융 활성화 등 취약계층에 대한 금융지원책도 마련할 계획이다.이 수석연구원은 ""기존 가계대출은 만기를 장기화하고 고정금리 대출 비중을 확대해 위험을 줄여야 한다""며 ""원금 분할상환 대출의 거치기간을 지나치게 늘리는 관행도 고쳐야 한다""고 말했다.indigo@yna.co.krjbryoo@yna.co.krzheng@yna.co.kr[관련기사]▶ 가계빚 규모.금리.신용위험 동반상승▶ <표> 가계대출.주택담보.신용대출 추이▶ 삼성硏 ""가계부채 부실위험 커질 것""▶ 10% 넘는 고금리 은행대출 13조원 육박▶ 올해 은행 가계대출 460조 예상..7.2%↑<뉴스의 새 시대, 연합뉴스 Live><모바일 애플리케이션><포토 매거진><저작권자(c)연합뉴스. 무단전재-재배포금지.>"
63,2011-02-13,"애플, 소니 제치고 삼성 최대고객 등극",https://news.naver.com/main/read.nhn?mode=LSD&mid=shm&sid1=101&oid=001&aid=0004908826,연합뉴스,"올해 삼성전자서 78억弗 규모 부품 구매(서울=연합뉴스) 정 열 기자 = 애플이 소니를 제치고 삼성전자의 최대 고객으로 등극할 전망이다.13일 업계에 따르면 애플은 올해 삼성전자로부터 약 78억 달러(약 8조6천억원) 상당의 부품을 사들여 처음으로 소니를 제치고 삼성전자의 최대 고객으로 부상할 것으로 보인다.애플의 이 같은 구매액은 작년보다 50% 이상 대폭 늘어나는 것이다.지난해까지는 약 53억 달러(약 6조원) 어치의 부품을 삼성전자로부터 구매한 소니가 50억 달러(약 5조7천억원) 안팎의 부품을 사들인 애플을 근소한 차이로 앞섰다.소니는 올해 삼성전자로부터 지난해보다 소폭 늘어난 60억 달러 안팎의 부품을 구매할 것으로 관측되고 있다.소니는 오랫동안 세계 TV 시장 1위 업체라는 막대한 구매력을 앞세워 삼성전자의 최대 고객으로 군림해왔으나, 2006년 이후 삼성전자에 TV 시장 1위 자리를 내주는 등 내리막길을 걸으면서 마침내 IT 업계의 새로운 거인인 애플에 자리를 내주게 됐다.애플은 지난해 발표한 아이패드와 아이폰4 등이 세계적으로 큰 인기를 끌면서 이들 기기에 들어가는 A4 프로세서와 낸드플래시, D램 반도체, 액정표시장치(LCD) 패널 등의 부품을 삼성전자로부터 구매했다.시장조사기관들은 애플의 성장세가 올해는 더욱 가팔라질 것으로 내다보고 있다.애플이 선도한 프리미엄 스마트폰과 태블릿PC 시장이 올해는 본격적인 확장기에 접어들면서 폭발적인 성장세가 예상되기 때문이다.시장조사기관인 아이서플라이에 따르면 애플은 지난해 4천700만대의 아이폰과 1천480만대의 아이패드를 판매했는데, 올해는 이보다 60~150%가량 늘어난 7천500만대의 아이폰과 3천650만대의 아이패드를 판매할 것으로 관측된다.주력 제품의 판매량이 많이 늘어나면 부품 구매액도 그에 상응해 대폭 상승할 것으로 전망된다.특히 올 상반기 중 출시될 것으로 알려진 아이패드2와 아이폰5에 삼성전자가 새로 개발한 첨단 LCD 패널과 모바일용 '엑시노스(Exynos)' AP가 탑재되면 삼성전자로부터 부품 구매 비중은 한층 높아질 것으로 예상된다.삼성전자가 최근 잇따라 선보인 '슈퍼 PLS(Plane to Line Switching)' LCD와 '엑시노스' 프로세서는 사실상 애플로의 납품을 겨냥한 제품으로 업계는 보고 있다.업계 관계자는 ""신성장동력 발굴에 어려움을 겪는 소니의 성장세가 둔화한 반면 애플은 신제품이 잇따라 히트를 치면서 폭발적인 성장세를 기록 중이어서 명암이 엇갈리고 있다""며 ""소니가 애플에 삼성전자 최대 고객 자리를 내주게 된 것도 하나의 상징적인 사건""이라고 말했다.passion@yna.co.kr<뉴스의 새 시대, 연합뉴스 Live><모바일 애플리케이션><포토 매거진><저작권자(c)연합뉴스. 무단전재-재배포금지.>"
