,날짜,기사 제목,기사 링크,기사 출처,기사 내용
21,2011-02-13,생명의 '베이비 박스'…버려진 아기 6명 품었다,https://news.naver.com/main/read.nhn?mode=LSD&mid=shm&sid1=102&oid=055&aid=0000199024,SBS,"<8뉴스><앵커>'베이비 박스'라고 들어 보셨나요? 버려지는 아이를 안전하게 두고 갈 수 있도록 만든 작은 상자입니다. 1년 전 국내에 첫 등장한 이 상자에 버려진 아이가 벌써 6명이 됐습니다.김범주 기자입니다.<기자>주택가 좁은 골목 안 건물 외벽에 작은 문이 달려있습니다.문을 열자 바닥에 두툼한 수건이 깔려 있고, 난방장치와 조명이 설치된 작은 공간이 나옵니다.이른바 '베이비 박스'입니다.너무 큰 아이들은 넣지 못하게 딱 신생아 한 명에게 맞는 공간만 만들었습니다.장애아보호시설을 운영하는 한 목사가 아무 데나 버려져서 생명을 잃는 아이들을 불쌍하게 생각해 외국 사례를 듣고 고안해낸 것입니다.[이종락/베이비박스 설치 목사 : 정말 바깥에 버려지는 아이들, 정말 쓰레기통에 갈 아이들, 그 아이들이 안전하게 보호받을 수 있잖아요.]베이비 박스를 처음 만든 건 지난 2009년 12월.그 동안 벌써 여섯 명의 아이가 베이비 박스를 통해 보호시설로 들어왔습니다.[이종락/베이비박스 설치 목사 : 얘는 은총이, 얘는 반석이, 쟤는 생명이.]지난해 3월, 버려진 아이가 처음으로 베이비 박스에 들어왔을 때 목사 부부는 한참을 울었습니다.[정병옥/이종락 목사 부인 : 너무너무 눈물이 쏟아져서 우리 막 통곡을 하고 울었어요. 키울 수 있는 아이들도 내다놓으니까 그게 제일 안쓰러워요.]베이비 박스를 통해 어린 생명을 구하고는 있지만, 자식을 버리는 부모가 줄어 베이비박스 문이 굳게 닫혔으면 하는 게 목사 부부의 바람입니다.[이종락/베이비박스 설치 목사 : 약한 자들이 보호받아서 정말 이 베이비박스가 필요없는 나라가 됐으면 좋겠습니다. 오늘도 안 들어오게 해주십시오.](영상취재 : 유동혁, 영상편집 : 박정삼)김범주news4u@sbs.co.kr관/련/정/보◆ 남매를 여관에 버렸던 어느 20대 부부에게◆ '베이비박스'로 건진 생명 돌보는 부부◆ '사생활 보호' 가족관계 일부증명서 신설[SBS기자들의 생생한 취재현장 뒷이야기 '취재파일']저작권자 SBS&SBS콘텐츠허브 무단복제-재배포 금지"
22,2011-02-13,"기독교인, 이번엔 조계사 난입해 '땅밟기'…논란",https://news.naver.com/main/read.nhn?mode=LSD&mid=shm&sid1=100&oid=055&aid=0000199019,SBS,"<8뉴스><앵커>일부 기독교인들의 이른바 '땅밟기'가 봉은사에 이어서 이번엔 조계사에서도 벌어졌습니다. 다른 종교에 대한 지나친 모독행위라는 비난이 뜨겁습니다.김정인 기자입니다.<기자>지난해 10월 일부 기독교도들이 서울 봉은사 경내에 마구 들어가 기독교 행사를 강행한 이른바 '땅밟기'로 큰 물의를 빚었습니다.이번에는 자신들을 목사와 장로, 선교사라고 소개한 4명이 그제 조계종의 본산인 조계사에 난입했습니다.대웅전앞에서 확성기를 들고 불교 신자들을 비난합니다.[이00/목사 : 부처가 비를 줘? 비가 와야 사는거야. 비가 와야 농사 짓고 밥 먹고 사는 거야. 그것도 모르면서 밥 먹으면 돼?]경내에서 쫓겨나자 이념 시비를 벌입니다.[이00/목사 : 공산당에는 하나님이 없다고 그래. 북한에는. 당신 공산당이야?]이들이 경찰에 연행돼 퇴거불응죄로 불구속 입건되면서 소동은 끝났지만, 인터넷에선 기독교의 지나친 배타성을 놓고 논란이 계속되고 있습니다.(영상편집 : )김정인europa@sbs.co.kr관/련/정/보◆ 봉은사-총무원, 명진스님 후임놓고 막판 갈등◆ '봉은사 땅밟기' 관련자, 봉은사 찾아 사과[SBS기자들의 생생한 취재현장 뒷이야기 '취재파일']저작권자 SBS&SBS콘텐츠허브 무단복제-재배포 금지"
23,2011-02-13,"[단독] 국립 종자원, 불량 '밀 종자' 대량 공급",https://news.naver.com/main/read.nhn?mode=LSD&mid=shm&sid1=100&oid=055&aid=0000199023,SBS,"<8뉴스><앵커>농민들에게 우량 품종을 공급하기 위해 '국립 종자원'이란 기관이 있습니다. 좋은 씨앗을 공급해야 할 이곳에서 오히려 불량 밀종자를 대량 공급한 사실이 드러났습니다.하대석 기자가 단독 취재했습니다.<기자>대표적 우리밀 산지인 경남 합천군.지난해 10월 파종해 한창 푸른 싹이 터 있어야 할 밀밭이 맨 땅만 드러내고 있습니다.[전학자/경남 합천군 우리밀 농민 : 이리 나선 안 돼. 여기 막 총총 나야 되지. 이래 나선 안 됩니다. (일찍 뿌렸는데 왜 안 났어요?) 밀 씨가 더러워서 그렇지.]흙을 파헤치자 썩은 씨앗들이 드러납니다.우량 품종을 개발한다는 국립 종자원에서 공급한 종자입니다.다른 씨앗을 심은 밀밭은 멀쩡한데, 유독 종자원 씨앗만 발아가 안 된 겁니다.문제의 씨앗은 합천, 사천, 밀양 등 5개 지역에 30톤이 팔렸는데, 제대로 자랐다면 수확량이 1천 톤에 이를 양입니다.불량 씨앗 공급은 지난 74년 종자원 설립 이래 처음 있는 일입니다.일찍 보상을 요구한 농민들은 지난해 11월 새 씨앗을 받아 심었지만, 시기를 놓친 농민들은 속만 태우고 있습니다.[이동권/경남 합천군 우리밀 농민 : 정부에서 밀 씨 줘서 심었는데 이게 뭐에요, 이게.]농협 종자도 말썽입니다.경남 진주와 김천 등지에서는 농협이 공급한 밀 종자 46톤이 제대로 자라지 않았습니다.[구장복/경남 진주시 우리밀 농민 : (농협 우리밀 종자) 발아율이 20% 정도 밖에 안 되니까 올해는 수확을 포기해야 된다.]종자원과 농협측은 씨앗 보관 과정에서 수분과 온도 조절에 문제가 생겼다고 해명했습니다.이상 기온에다 초유의 불량종자 사태까지 겹치면서 올해 밀수확량은 목표치 6만 톤의 절반에 그칠 것이란 우려도 나오고 있습니다.이에 따라 현재 1.5%에 불과한 밀 자급률 확대 정책에도 비상이 걸렸습니다.(영상취재 : 강동철, 영상편집 : 최은진)하대석bigstone@naver.com관/련/정/보◆ [단독] 끔찍했던 123일…""선원, 해적질에도 동원""◆ [단독] 국세 전산망도 뚫렸다! '해킹' 정황 포착◆ [단독] 가축매몰지 지하수 오염 심각…붕괴 위험도◆ [단독] ""XXX 왕따시켜라""…간부가 가혹행위 조장◆ [단독] 북, 상륙정 해군기지 건설…기습 침투용?[SBS기자들의 생생한 취재현장 뒷이야기 '취재파일']저작권자 SBS&SBS콘텐츠허브 무단복제-재배포 금지"
24,2011-02-13,"베이비붐세대 97% ""자녀에 의존안해""",https://news.naver.com/main/read.nhn?mode=LSD&mid=shm&sid1=101&oid=009&aid=0002408558,매일경제,"올해 들어 본격적인 은퇴가 시작된 베이비 붐 세대(베이비 부머)는 가치관과 현실 간 괴리로 노후생활에 경제적 어려움을 겪을 가능성이 높은 것으로 나타났다.이들은 노부모와 자녀 부양 의무에 대해 강박 관념을 갖고 있는 반면 자신들 노후에 대해서는 자녀들 지원을 거의 기대하지 않고 있었다. 더구나 퇴직연금이나 개인연금 가입 등 자발적인 노후 대비도 부진해 은퇴 후 자금 지출과 수입 간 '불일치'가 심각할 것으로 예상된다.이러한 사실은 한국보건사회연구원이 매일경제신문과 공동으로 기획한 '베이비 붐 세대 설문조사 분석'에서 드러났다.이번 조사는 전국에서 추출된 표본 4000여 명을 대상으로 이뤄진 것으로 베이비 부머에 대한 전국 단위 설문조사는 이번이 처음이다.조사에 따르면 베이비 부머들은 노부모 부양 책임이 자신을 비롯한 가족에게 있다고 생각하는 비중이 69.0%에 달했지만, 본인 노후 생활비를 자녀에게 의존할 수 있을 것이라고 응답한 비율은 3.3%에 그쳤다.그러면서도 자녀 양육에 대해서는 지나칠 정도로 강한 의무감을 갖고 있다. 자녀가 성인이 되는 만 20세까지 부양하면 된다고 보는 비중은 3.2%에 불과한 반면 결혼할 때까지(41.5%), 학업을 마칠 때까지(29.6%), 직장이 생길 때까지(23.9%) 부양해야 한다는 비중은 훨씬 높게 나타났다.노부모와 자녀에 대해서는 앞으로도 계속 자금이 들어갈 것으로 예상되는 반면 자녀에게 기댈 수 있는 가능성은 거의 보이지 않는 셈이다.이는 베이비 붐 세대가 노부모 부양과 자녀 양육에 대해서는 전통적인 가치관을 고수하고 있는 반면 자녀 세대에게 도움을 받는 것에 대해서는 서구적 시각을 갖기 때문에 나타난 현상이다. 특히 자녀 세대에게 경제적 지원을 받는 게 갈수록 어려워질 것이라는 현실론도 이러한 이중적 가치관 형성에 기여하고 있다.따라서 자녀 도움 없이 안정적인 노후생활을 유지하기 위해 보험이나 연금을 통한 수입 확보가 중요하다. 그러나 현실은 전혀 그렇지 않은 것으로 나타났다.베이비 부머가 질병 관련 민간 보험에 가입한 비중(본인 기준)은 84.1%로 비교적 높았지만 목돈 마련 저축(44.1%)이나 사망에 대비한 종신보험(35.9%), 개인연금이나 퇴직연금(24.0%) 가입 비중은 상대적으로 크게 떨어졌다.이 때문에 베이비 부머가 자녀에게 쏟아 붓는 지출을 합리적으로 조정하지 않으면 노후에 생활비 부족 등 경제적 어려움에 시달릴 가능성이 높다는 지적이다.김용하 한국보건사회연구원장은 ""우리나라 전통적 노후 대책인 자녀가 부모를 부양하는 체계가 베이비 붐 세대부터는 완전히 무너질 것이라는 사실이 이번 조사에서 명확하게 드러났다""며 ""베이비 부머는 경제적 자원을 보다 합리적으로 배분해야 하며, 정부는 공적 노후 보장 시스템을 잘 갖춰 나가야 할 것""이라고 말했다.■ <용어설명>베이비 붐 세대 = 6ㆍ25전쟁 직후인 1955년부터 1963년 사이에 태어난 712만명 인구를 일컫는 말이다. 전체 인구에서 차지하는 비중이 14.6%로 매우 높은 세대다. 현재 48~56세인 이들 나이는 2020년에 57~65세로 올라가면서 본격적인 노후 세대로 분류될 것으로 보인다.[정혁훈 기자][ⓒ 매일경제 & mk.co.kr, 무단전재 및 재배포 금지]MBA도 모바일로 공부한다."
25,2011-02-13,‘출퇴근 짜증’ 지하철 역 이동공간 넓힌다,https://news.naver.com/main/read.nhn?mode=LSD&mid=shm&sid1=102&oid=032&aid=0002112014,경향신문,"ㆍ서울 신도림역 등 8곳 2014년까지 구조개선시청역·서울역·강남역·교대역·신도림역….출퇴근 시간이면 둥둥 떠다닐 정도로 혼잡하고 위험한 서울시내 지하철역들이다.서울시는 이렇게 혼잡한 8개 지하철 역사의 구조개선사업을 2014년까지 완료할 방침이라고 13일 밝혔다. 서울시는 또 인근 상가 등으로 공사가 어려운 역사에 대해서는 개선대책을 강구할 것이라고 덧붙였다.공사가 진행될 역사는 2호선 신도림역과 강남역, 1·2호선 시청역, 1·4호선 서울역, 2·3호선 교대역이다. 사업비는 총 1277억원이다.이 역들은 서울시의 분석결과 1인당 점유면적을 따졌을 때 ‘타인에게 떠밀려 움직이는 수준’이거나 ‘보행속도를 임의대로 선택할 수 없는 수준’으로 평가됐다.이 중 신도림역이 가장 먼저 개선사업을 시작했다. 모두 460억원을 들여 폭 2.4m의 좁은 승강장을 최대 14.4m로 확장하고 엘리베이터·에스컬레이터 등을 확충하는 공사가 진행되고 있다. 지난해부터는 시청역과 강남역, 올해부터는 서울역과 교대역에 대해 승강장 및 환승통로 폭 확대, 출입구 신설, 승강시설 확충 등 공사를 벌이고 있다.또 신분당선 건설공사와 함께 승강장 확장 공사가 이뤄지고 있는 강남역의 경우에는 올해 말 공사가 마무리될 예정이다. 서울시는 주변 여건상 승강장 확장 등이 어려운 1·3호선 종로 3가역, 2호선 역삼역, 4호선 사당역, 2호선 을지로 3가역, 1호선 종각역, 2·4호선 동대문역사문화공원역, 3호선 고속터미널역 등 9개 역사에 대해서는 연구용역 등을 통해 혼잡도 개선방안을 마련할 계획이다.서울시는 혼잡역사 개선사업이 마무리되면 이용승객의 대기공간이나 보행공간이 넓어져 지하공간이 쾌적해지는 동시에 배차간격 및 환승시간 등이 단축되는 효과도 거둘 것으로 전망했다.<문주영 기자>경향신문 ‘오늘의 핫뉴스’▶ ‘만추’ 탕웨이 “감정엔 국경이 없죠… 상대역 현빈 어른스러워요”▶ 한나라 내 친이계 “DJ 배우자” 열공…이유는▶ 北 마약에 취한 판사가 “마약사범 사형” 판결▶ 에쿠스 판매 늘었지만…美 시장 벽 여전▶ 구자철, 분데스리가 데뷔전 ‘성공’▶ [화보] ‘만추’ 탕웨이, 매혹적인 그녀공식 SNS 계정[경향 트위터][미투데이][페이스북][세상과 경향의 소통 Khross]- ⓒ 경향신문 & 경향닷컴(www.khan.co.kr), 무단전재 및 재배포 금지〈경향닷컴은 한국온라인신문협회(www.kona.or.kr)의 디지털뉴스이용규칙에 따른 저작권을 행사합니다.〉"
26,2011-02-13,"이집트 경찰 ""우린 시민편""..`참회' 시위",https://news.naver.com/main/read.nhn?mode=LSD&mid=shm&sid1=100&oid=001&aid=0004909811,연합뉴스,"前내무장관 처벌.월급인상 등 요구..시민들 박수(카이로=연합뉴스) 김홍태 고웅석 특파원 = 호스니 무바라크 대통령을 몰아낸 이집트 시민혁명 이틀째인 13일 카이로 도심의 타흐리르 광장에서는 검은 제복 차림의 경찰 수백 명이 요란하게 시위를 하는 진풍경이 펼쳐졌다.이집트에서 지난달 25일 민주화 시위가 처음 벌어졌을 때만 해도 시위대를 유혈 진압해 국민의 원성을 샀던 경찰관들이 ""우리도 시민의 편""이라며 참회성 시위에 나선 것이다.동료 경찰들의 무등을 탄 젊은 중간 간부들은 시위대를 폭력적으로 진압하도록 지시한 인물로 하비브 알-아들리 전 내무장관을 지목하며 그의 처벌을 요구했다.이와 관련, 이집트에서는 이번 민주화 시위 과정에서 경찰의 진압으로 300여 명의 시민이 목숨을 잃었고, 5천 명이 넘는 사람이 다친 것으로 파악되고 있다. 이 때문에 이집트 검찰은 알-아들리 전 장관과 부정부패 혐의를 받고 있는 다른 각료 2명에 대해 출국금지 조치를 내리고 수사를 벌이고 있다.이들 경찰은 이날 오전 카이로 도키 지역의 한 경찰서 앞 로터리를 돌며 다른 경찰의 참여를 독려하는 시위를 벌인 뒤 카스르 알-나일 다리를 건너 ""경찰과 시민은 하나다""라는 구호를 외치며 1㎞가량 거리행진을 벌여 타흐리르 광장에 도착했다.지난 시위 때 타흐리르 광장에 설치됐던 텐트와 비닐 천막 등을 철거하며 거리 청소에 나선 시민들은 이들 경찰의 갑작스러운 출현에 처음에는 어리둥절해하다가 곧 따뜻한 화해의 박수를 건넸다.경찰관들은 타흐리르 광장에서 ""경찰 복지로 할당된 예산이 다 어디로 갔느냐""라면서 구체제 경찰 고위 간부들의 횡령 의혹도 제기했고, 박봉의 월급을 인상해달라는 요구도 제기했다.시위 장소에서 만난 사복경찰관 살라 하산 압둘 마수드 씨는 ""우리가 시위를 진압한 것은 고위층의 지시에 의한 것""이라며 ""우리도 구체제의 희생양""이라고 말했다.그는 ""이집트 경찰관에 대한 정부의 복지 지원은 매우 열악하다""며 ""부정을 저지르지 않으면 지금 월급으로는 생계를 이어가기가 곤란한 지경""이라고 덧붙였다.실제로, 이집트 하위직 경찰의 월 급여는 한국 돈으로 20만 원이 채 안 되며, 이런 탓에 각종 비리에 연루되는 일이 비일비재해 국민의 사랑을 받지 못해왔다.타흐리르 광장의 청소 작업을 위해 부인과 자녀를 데리고 온 가불 알-하비니(42.무역업) 씨는 ""그동안 경찰이 미웠지만, 저런 모습을 보니 마음이 누그러진다""며 ""경찰의 참회 시위를 환영한다""고 말했다.`내 조국 이집트를 사랑한다', `우리는 자유를 원한다'라는 글귀를 펜으로 써넣은 이집트 국기를 자랑스럽게 든 알-하비니 씨는 ""우리는 독재자 무바라크를 몰아냈고, 우리는 몇 달 뒤면 새 정부, 새 대통령을 선택할 것""이라며 ""경찰도 예전과는 달라질 것""이라고 덧붙였다.freemong@yna.co.kr<뉴스의 새 시대, 연합뉴스 Live><모바일 애플리케이션><포토 매거진><저작권자(c)연합뉴스. 무단전재-재배포금지.>"
27,2011-02-13,美 충격의 28시간 흉기난동…'묻지마' 범행,https://news.naver.com/main/read.nhn?mode=LSD&mid=shm&sid1=104&oid=003&aid=0003687684,뉴시스,"【뉴욕=AP/뉴시스】박준형 기자 = 미국에서 28시간여에 걸친 흉기 난동 사건이 발생해 충격을 주고 있다.13일 미국 뉴욕 경찰에 따르면 우크라이나 태생의 그래피티 화가 막심 겔먼(23)은 지난 11일 오전 5시께 뉴욕 브루클린 인근에 있는 자신의 집에서 어머니와 말다툼을 벌였다.겔먼은 어머니가 차량을 사용하겠다는 자신을 막자 화를 냈고 이 과정에서 양아버지 알렉산드르 쿠즈네초프(54)가 개입하자 흉기로 찔러 살해했다.양아버지를 살해한 뒤 어머니의 차량을 훔친 겔먼은 오전 10시30분께 전 여자친구 옐레나 불첸코(20·여)의 집에 침입했다. 겔먼은 흉기로 전 여자친구의 어머니 안나 불첸코(56·여)를 찔러 숨지게 했다.이어 오후 4시께 전 여자친구가 귀가한 뒤 어머니의 시신을 발견하고 경찰에 신고하자, 숨어 있던 겔먼은 전 여자친구마저 흉기로 찔러 살해했다.어머니의 차량을 타고 달아나던 겔먼은 신원이 밝혀지지 않은 62살 남성이 운전하던 차량을 들이받은 뒤 이 남성의 가슴을 흉기로 찌르고 차량을 빼앗아 도주했다. 다행히 이 남성은 생명에는 지장이 없는 것으로 전해졌다.겔먼은 다음날인 12일 오전 1시께는 신원이 밝혀지지 않은 또 다른 차량 운전자를 흉기로 찌른 뒤 차량을 빼앗았다.이후 이날 오전 8시께 뉴욕 맨해튼 타임스퀘어 지하철역에 나타난 겔먼은 신문에 난 자신의 사진을 본 승객 1명을 뒤쫓아 흉기로 찔렀다. 이 승객은 인근 병원으로 옮겨졌으나 결국 숨진 것으로 전해졌다.경찰은 결국 오전 9시께 겔먼을 체포했다. 겔먼이 처음 양아버지를 살해한 뒤 28시간여가 지난 후다.경찰 조사 결과 겔먼은 마약 소지 혐의로 총 10차례에 걸쳐 체포된 적 있는 것으로 드러났다.경찰에서 겔먼은 앞뒤가 맞지 않는 진술을 하고 있는 것으로 나타났다.경찰 관계자는 ""겔먼이 횡설수설하고 있다""며 ""'그녀는 죽어야 한다'고 언급했지만 그녀가 전 여자친구인지는 명확하지 않다""고 말했다.경찰은 겔먼을 상대로 정확한 범행 동기와 여죄 여부 등을 조사하고 있다.jun@newsis.com[뉴시스 이시간 핫 뉴스]ㆍ 40대 노총각 울린 결혼업체 대표 실형ㆍ 학생들과 성관계 즐긴 美 40대 女교사 ´덜미´ㆍ ´뮤지컬배우 망치폭행´ 제작사 간부 실형ㆍ 뉴라이프론, 서민대출시장의 대안 될까ㆍ 첫키스의 충격?…첫 키스 후 돌연사한 英 18살 여대생★ 손 안에서 보는 세상, 모바일 뉴시스<저작권자ⓒ '한국언론 뉴스허브' 뉴시스통신사. 무단전재-재배포 금지.>"
28,2011-02-13,'단돈 39만 원에…' 20대 여성 살해한 뒤 야산에 유기,https://news.naver.com/main/read.nhn?mode=LSD&mid=shm&sid1=102&oid=019&aid=0002161476,MBN,"【 앵커멘트 】귀가 중이던 20대 여성을 살해한 뒤 시신을 인근 야산에 버린 일당이 경찰에 붙잡혔습니다.수천만 원의 빚을 갚으려고 여성을 납치했다고 하는데, 이들이 여성을 죽이고 챙긴 돈은 겨우 39만 원이었습니다.엄민재 기자가 보도합니다.【 기자 】충북 충주시에 있는 한 야산.겨울 날씨에 얼어붙은 흙을 부수고 파내자, 백골 상태의 시신이 나옵니다.지난해 7월, 23살 박 모 씨 등 2명은 귀가 중이던 회사원 25살 여성 이 모 씨의 목을 졸라 살해했습니다.▶ 스탠딩 : 엄민재 / 기자- ""박 씨 등은 살해한 이 씨의 시신을 이곳 배수로에 그대로 버려뒀지만, 주변에 인적이 드문 탓에 주민들은 쉽게 알아채지 못했습니다.""▶ 인터뷰 : 신동석 / 경기 이천경찰서 강력3팀장- ""평소 사람이 다니지 않는 곳이고 평상시에는 사람들의 키보다 높은 갈대가 자라고 있어서 쉽게 알아채지 못한….""범행 당시 2천7백여만 원의 빚을 지고 있던 박 씨는 고등학교 동창인 이 모 씨와 범행을 공모한 것으로 드러났습니다.하지만, 이들이 이 씨를 살해하고 챙긴 돈은 단돈 39만 원.▶ 인터뷰 : 윤명도 / 경기 이천경찰서 형사계장- ""실제로 뺏은 금액은 얼마 되지 않습니다. 그런데 피해자가 얼굴을 봤고, 자신의 범행한 사실을 은폐하려고 피해자를 살해….""경찰은 범행장소에서 사용한 휴대전화 사용내역을 추적한 끝에 사건 발생 7개월 만에 피의자를 잡았습니다.경찰은 박 씨 등 2명에 대해 강도살인 및 사체유기 혐의로 구속영장을 신청했습니다.MBN뉴스 엄민재입니다. [ happymj@mbn.co.kr ]▶화장실서 여교사 협박해 성추행한 고교생 결국엔…▶""심장을 바꿨다""…'프레스티지 K7' 출시▶[화보]소녀시대 공항에서 `아찔한 빨강 구두의 유혹~`▶지하철 성희롱 동영상! '묻지 마'식 성토 문제사회▶美 앵커가 누드로 뉴스했던…`네이키드 뉴스`의 요리 버전 탄생?▶ MBN 뉴스 더보기 Click !!!▶ 매일매일 팡팡! 대박 세일! 소셜커머스 '엠팡(mpang.mbn.co.kr)' 오픈▶ <코스피 2500p 향하여>상상 그 이상의 수익률, 눈으로 직접 확인하세요! 'MBN리치'< Copyright ⓒmbn(mbn.co.kr)무단전재 및 재배포 금지 >"
