,날짜,기사 제목,기사 링크,기사 출처,기사 내용
40,2011-02-13,"靑 ""영수회담 무산 책임전가 유감""(종합)",https://news.naver.com/main/read.nhn?mode=LSD&mid=shm&sid1=100&oid=001&aid=0004909346,연합뉴스,"정진석 정무수석 ""손학규, 스스로 가로막은 것""(서울=연합뉴스) 안용수 기자 = 청와대는 13일 민주당 손학규 대표가 이명박 대통령과의 영수회담이 무산된 책임을 청와대에 전가하는 데 유감을 표명했다.청와대 고위관계자는 연합뉴스와 통화에서 ""손 대표가 회동이 성사되지 않은 책임을 청와대에 전가하는 것을 유감스럽게 생각한다""면서 ""청와대 회동은 어떠한 경우에도 정략적 이용의 대상이 돼서는 안된다""고 말했다.이 관계자는 또 ""청와대는 애초부터 대통령과 야당 대표의 회동을 국회 등원과 연계시켜서는 안된다는 입장을 견지해 왔다""면서 ""야당의 국회 등원은 정치협상의 대상이 아니라 책임 있는 정당으로서 당연한 책무""라고 밝혔다.이와 관련, 정진석 정무수석은 기자들과 만나 ""청와대 회동을 통해 누가 이익을 얻기보다는 여야가 대화하고 머리를 맞대는 모습을 보이려고 했던 것""이라면서 ""국민께 선물을 드리려는 생각이 강했는데 아쉽게 됐다""고 설명했다.정 수석은 ""지난해 말부터 손 대표와 회동을 하려고 부단히 애썼다""면서 ""그러나 민주당이 연말 국회에서 예산안 처리에 대한 대통령의 사과와 등원 전 청와대 회동 성사라는 조건을 걸어 오늘로 이어졌다""고 지적했다.이어 정 수석은 ""청와대 회동은 회동대로 해야지 정략적으로, 정치적 입지를 고려해서 이용하려 하듯 하면 안된다""면서 ""(손 대표가) 논의의 진전을 스스로 가로 막은 것 아니냐""고 주장했다.정 수석은 앞으로 영수회담 성사 가능성에 대해서는 ""순수한 만남은 순수하게 가져가야 한다""면서 ""기회가 완전히 봉쇄됐다고 보지는 않고, 대통령께서 각 분야의 지도자들로부터 의견을 청취하고 대화를 갖는 기회는 언제든 열려 있다""고 말했다.그는 또 ""민생 현안이 산적됐는데 국회 정상화가 곧 이뤄진다고 해서 다행스럽게 생각한다""면서 ""산적한 민생현안이 밀도 있게 논의됐으면 좋겠다""고 밝혔다.aayyss@yna.co.kr<뉴스의 새 시대, 연합뉴스 Live><모바일 애플리케이션><포토 매거진><저작권자(c)연합뉴스. 무단전재-재배포금지.>"
41,2011-02-13,"<르포> ""간신히 토끼길 냈는데 또 눈 온다고?""",https://news.naver.com/main/read.nhn?mode=LSD&mid=shm&sid1=102&oid=001&aid=0004909436,연합뉴스,"눈밭을 뚫고 큰 길까지 (삼척=연합뉴스) 배연호 기자 = 100년 만의 폭설이 내린 강원 삼척지역 주민이 13일 큰 길까지 길을 내기 위해 삽으로 눈을 치우고 있다. 2011.2.13byh@yna.co.kr'눈 사막' 삼척..김진범 할아버지, 원망스런 눈길로 하늘만(삼척=연합뉴스) 배연호 기자 = 1ｍ가 넘는 눈 폭탄에 거대한 설원으로 변한 강원 삼척지역은 13일 날이 밝으면서 '생명선'이 하나둘씩 생겨나고 있었다.그 생명선은 '눈 사막'에 갇힌 주민들이 허리춤까지 빠지는 눈밭을 뚫고 지난 12일 밤 임시제설작업이 끝난 도로까지 연결한 '토끼길'들이었다.그러나 토끼길들이 생명의 동맥인 큰길까지 모두 이어지기에는 인간의 힘으로 뚫고 지나가야 할 설원이 너무 깊고 광활했다.'집 무너지면 안 되지'(삼척=연합뉴스) 배연호 기자 = 100년 만의 폭설이 내린 강원 삼척지역 주민이 13일 지붕 위에 쌓인 눈을 치우고 있다. 2011.2.13byh@yna.co.kr폭설이 쏟아지던 지난 12일 오전 사륜구동차들도 운행하지 못했던 태백에서 삼척 신리를 거쳐 삼척 근덕면으로 이어지는 지방도 427호선은 13일 아침 눈 더미 사이로 승용차 한 대가 지나갈 수 있는 오솔길이 뚫려 있었다.문의재를 넘어 삼척 노곡면에 들어서자 광활한 '눈 사막'이 한눈에 들어왔다.근덕면 동막리 지방도 427호선 바로 옆에서 삽으로 길을 내던 김형태(76) 할아버지는 ""집에서 도로까지 10여ｍ 눈을 치우는데 어제 오후부터 오늘 아침까지 걸렸다""라며 가쁜 숨을 몰아 쉬고 있었다.김 할아버지는 ""그래도 나는 괜찮다""라며 집앞 마읍천 건너 산 중턱에 혼자 사는 마을 친구를 걱정했다.동막리 앞에서 마읍천을 건너면 이번 눈 폭탄이 가장 집중적으로 쏟아졌던 노곡면 상마읍리다.눈밭을 뚫고 큰 길까지 (삼척=연합뉴스) 배연호 기자 = 100년 만의 폭설이 내린 강원 삼척지역 주민이 13일 큰 길까지 길을 내기 위해 삽으로 눈을 치우고 있다. 2011.2.13byh@yna.co.kr김 할아버지는 ""노곡면 상마읍리에 사는 친구에게 전화를 하니 '집에서 마읍천까지 길을 내는데 며칠이 더 걸릴 것 같지만, 전기도 들어오고 물도 나와 지내는 데는 괜찮다'며 걱정하지 말라고 말했다""고 전했다.하지만, '농촌 젊은이들(?)'의 마을 어르신 걱정은 태산이다.겨우 뚫린 큰길 인근 농가를 제외하고 상마읍리처럼 삼척, 동해, 강릉 등 동해안 외딴 지역은 사실상 눈 속에 파묻힌 상황이기 때문이다.주민들은 눈 속에 파묻혀 형태만 보이는 비닐하우스, 농기계, 차량 등은 손을 보지도 못하고 집에서 큰길까지 길을 내는데 사투를 벌였다.마을에서 젊은 층에 속한다는 박한규(58) 씨는 ""어르신들과 전화통화로 안부를 확인하고 있지만, 하루빨리 얼굴을 뵈어야 마음이 놓일텐데..""라며 제설용 삽을 단 트랙터를 몰고 아직 눈을 치우지 못한 마을 어르신 집으로 발길을 서둘렀다.폭설 뒤에 고드름(삼척=연합뉴스) 배연호 기자 = 1ｍ가 넘는 폭설로 내린 강원 삼척지역 한 농가에 고드름이 추위 속에서 엄청나게 쌓인 눈을 치워야 할 주민들의 수고를 대변하고 있다. 2011.2.13byh@yna.co.kr이처럼 마을 젊은이들의 도움을 받을 수 있는 어르신들은 그나마 다행이다.자식을 모두 도회지로 떠나보내고 홀로 남으신 어르신들에게 '100년 만의 폭설'의 무게는 더욱 감당하기 힘겨워 보였다.집에서 큰길까지 한 사람이 다닐 길을 낸 김효윤(62) 할아버지는 ""정말 허리가 아플 정도로 3일 내내 눈을 치웠다""라며 ""설도 지났는데 웬 눈이 이렇게 많이 오는지 모르겠다""라고 혀를 찼다.이같이 폭설에 갇힌 동해안 마을에서는 생존을 위한 '어르신들의 고군분투'가 계속되고 있는 사이 기상청은 ""영동지방은 오늘 밤부터 내일(14일)까지 10∼20㎝, 많은 곳은 30㎝ 이상의 눈이 오겠다""며  동해안 대부분 지역에 대설예비 특보를 발령했다.삼척시 가곡면 기곡리 김진범(67) 할아버지는 ""오늘 아침 간신히 큰길까지 길을 냈는데 또 눈이 온다고, 허 참 무슨 조화인지 모르겠다""라며 눈을 치우다 말고 원망스러운 눈길로 하늘을 쳐다봤다.byh@yna.co.kr<뉴스의 새 시대, 연합뉴스 Live><모바일 애플리케이션><포토 매거진><저작권자(c)연합뉴스. 무단전재-재배포금지.>"
42,2011-02-13,"주행거리 많은 차, 車보험료도 더 낼까",https://news.naver.com/main/read.nhn?mode=LSD&mid=shm&sid1=101&oid=018&aid=0002386406,이데일리,"- 금감원, 마일리지 보험 도입여부 검토..데이터 수집중- 생계형 사업자 역차별 우려[이데일리 이진우 기자] 연간 주행거리가 많으면 보험료를 많이 내는 이른바 `마일리지 보험`을 내년부터 도입하는 방안이 검토되고 있다.금융감독원 관계자는 13일 ""요일제 자동차 보험에 이어 주행거리에 비례해서 보험료를 내는 자동차 보험도 도입을 검토하고 있다""면서 ""구체적인 방안이 도출된 것은 아니고 우선 데이터 수집을 진행중""이라고 말했다.마일리지 보험이 도입되기 위해서는 주행거리가 많은 자동차가 사고 횟수가 얼마나 더 많은지 실제 데이터로 입증되어야 한다. 그래야 보험료를 얼마나 더 높이거나 낮출지 정할 수 있기 때문.금감원은 요일제 할인을 선택한 자동차 보유자들이 차량에 달고 있는 차량운행정보 확인장치(OBD)를 활용해 이 데이터를 수집한다는 계획이다. 금감원 관계자는 ""약 1만대 가량의 차량에 달려있는 OBD를 통해 1년 정도 운행거리와 사고횟수에 대한 데이터를 수집하면 마일리지 보험의 보험료 산정을 위한 자료가 확보될 수 있을 것""이라며 올 한 해동안 데이터를 모아 내년쯤 도입 여부를 결정할 계획이라고 밝혔다.지금은 자동차의 주행거리와 무관하게 보험료가 산정되고 있다. 다만 주행거리가 긴 자동차의 경우 사고 횟수가 많다면 그에 따른 할증만 보험료에 적용된다.앞으로 마일리지 보험이 도입되면 차량 운행을 적게 하는 운전자들은 보험료를 할인받게 될 가능성이 있다.문제는 영세 사업자 등 생계수단으로 자동차를 운행하는 경우 보험료 부담이 커질 수 있다는 점. 주행거리가 길면 운전의 숙련도가 높아져 사고 확률이 오히려 줄어들 수도 있고, 주행거리와 사고확률이 비례하더라도 사고로 인한 보험료 할증과 주행거리로 인한 할증이 동시에 부과될 경우 형평성의 문제도 제기될 수 있다.금감원 관계자는 ""이 제도를 도입하기 위해서는 주행거리가 길면 사고확률이 높다는 점도 실제 통계로 입증되어야 하지만 영세한 개인사업자들의 부담 문제도 논란이 될 수 있을 것""이라면서 ""구체적인 방안이 마련되기까지는 시간이 좀 걸릴 것 같다""고 말했다.▶ 찌라시는 가라!..스마트브리프하루 두번 무료로 만나보세요.▶ 이데일리ON, 문자로 시세,추천,진단,상담정보 -#2200▶ 이데일리 모바일ㆍ실시간 해외지수/SMS<3993+show/nate/ez-i>▶ 가장 빠른 글로벌 경제뉴스ㆍ금융정보 터미널,이데일리 MARKETPOINT＜ⓒ종합 경제정보 미디어 이데일리 - 무단전재&재배포 금지＞＜안방에서 만나는 가장 빠른 경제뉴스ㆍ돈이 되는 재테크정보 -이데일리TV＞이진우  (voice@)"
43,2011-02-13,이집트 혁명 일등공신은 시민의 말(言),https://news.naver.com/main/read.nhn?mode=LSD&mid=shm&sid1=102&oid=001&aid=0004909477,연합뉴스,"젊은 세대 주축..독창적 표현 창조해 요구 전달트위터.페이스북 등 SNS도 큰 기여(서울=연합뉴스) 임기창 기자 = 시민은 무기를 들지 않았다. 그들의 무기는 말(言)이면 족했다.뉴욕타임스(NYT) 인터넷판은 호스니 무바라크 대통령의 하야를 이끌어낸 시민의 힘이 말과 글을 매개로 결집했다고 13일(현지시각) 평가했다.반(反)정부 시위 기간 시위대는 무바라크 대통령에게 자신들의 뜻이 절실함을 알리고자 방언과 외국어 등 온갖 도구를 동원해 창의적 구호들을 쏟아냈다.시위대가 가장 많이 사용한 단어 가운데 하나인 `이르할(irhalㆍ`떠나라'는 뜻)'을 비틀어 쓴 방식만 봐도 이들의 독창성이 물씬 묻어난다.시위 기간 타흐리르(해방) 광장 등 시위현장에 모인 시민들은 이 단어를 이집트 상형문자로 바꿔 썼다. 21세기에 고대 이집트 군주 파라오처럼 군림하는 무바라크 대통령이 시민의 요구를 당최 이해하지 못하니 고대 문자로 쓰면 알아듣겠느냐는 재치가 담긴 말이다.시민들은 또 구호 속에 아랍어 경어체와 평어체를 뒤섞어 `이르할'이 `꺼져라'를 뜻하는 단어 `이므쉬(imshi)'임을 교묘히 드러내기도 했다.국제 감각으로 무장한 젊은 시위대의 무기는 모국어를 넘어 외국어까지 자유자재로 넘나들었다.심지어 시위현장에는 중국어로 쓰인 표어까지 등장했다. 시민이 아랍어로 말하면 우둔한 무바라크가 알아듣질 못하니 혹 중국어로 쓰면 자신들의 요구가 전달되지 않을까 하는 빈정거림이 느껴진다.젊은 인터넷 세대가 시위의 주축이 됐음을 새삼 느끼게 하는 구호들도 있었다. `무바라크는 지금 오프라인' `무바라크 실행 실패(fail)' `무바라크 삭제(delete)' 등 독특한 표현들이 윈도 바탕화면의 `휴지통' 아이콘과 함께 등장했다.카이로에서 연구활동을 하는 영국 옥스퍼드대 월터 암허스트 중동학과 교수는 ""뉴미디어 활용은 이번 혁명의 정체성 가운데 일부""라며 ""젊은 층은 나이 든 세대가 완전히 이해할 수 없는 표현 수단에 통달했다""고 말했다.트위터와 페이스북 등 소셜네트워킹 서비스(SNS)도 시민들의 주요 무기로 빼놓을 수 없다.탄생한 지 다음 달로 5년째인 트위터는 2009년 이란 대선 반대시위와 지난달 튀니지 시민혁명에 이어 이집트에서도 시민이 시위를 조직하고 의견을 나누는 주요 매개체였다. 영국 일간 가디언 인터넷판은 13일 이같은 현상에 대해 ""혁명이 트위터화(twitterise)하고 있다""고 평가했다.이번 시위에서 일약 영웅으로 떠오른 구글 임원 와엘 그호님도 인권운동가 폭행치사 사건에 항의하는 페이지를 페이스북에 개설, 시위를 주도하는 등 페이스북의 영향력 역시 이집트 혁명을 통해 거듭 증명됐다.물론 SNS가 민주화에 늘 도움만 되는 것은 아니라는 경계의 목소리도 있다.인터넷의 어두운 면을 탐구한 저널리스트 예프게니 모로조프는 시위 참가자 가운데 인터넷이나 SNS를 쓸 줄 모르는 이들도 상당수였던 만큼 인터넷 덕에 시위가 성공했다고 보기는 무리라고 분석했다.그는 ""이집트에서 시위 규모가 가장 컸을 때는 정부가 인터넷을 차단했을 때""라고 지적하고, 트위터 등 외국 SNS를 차단한 중국 등의 상황을 보더라도 인터넷은 정권이 시민을 감시하는 도구로 언제든 전락할 수 있다고 우려했다.pulse@yna.co.kr<뉴스의 새 시대, 연합뉴스 Live><모바일 애플리케이션><포토 매거진><저작권자(c)연합뉴스. 무단전재-재배포금지.>"
44,2011-02-13,北특수전부대 혹독한 '지옥훈련'으로 무장,https://news.naver.com/main/read.nhn?mode=LSD&mid=shm&sid1=100&oid=001&aid=0004909084,연합뉴스,"열차위에서 훈련중인 북한 특수부대원(자료)""35㎏ 군장꾸려 40㎞ 12시간 주파 훈련""""3일연속 천리행군..부대원 특공무술 시합""(서울=연합뉴스) 김귀근 기자 = 서북도서 및 군사분계선(MDL) 일대로 기습 침투해 후방을 교란하는 목적의 북한 특수전부대(경보병부대)는 우리 특전부대에 못지않은 혹독한 지옥훈련을 받는 것으로 알려졌다.13일 군당국에 따르면 북한 특수전부대는 경보병부대 14만명과 11군단(폭풍군단) 및 인민군 정찰총국 예하 특수작전 전문 병력 6만여명 등 20만여명으로 구성됐다.14만명은 전방사단의 경보병연대 병력들이며, 11군단 예하 5만여명과 정찰총국 예하 1만여명 등 6만여명은 '인간 병기'로 불리며 특수작전을 전문으로 한다.11군단 예하에는 4개의 경보병여단과 3개의 해상저격여단, 3개의 항공육전단 등이 편성됐고 항공육전단 내에는 여군으로만 구성된 여성정찰중대가 있는 것으로 알려졌다. 과거 여군만의 '목련꽃 소대'가 있었으나 여성정찰중대로 개편됐다고 한다. 공군저격여단과 해상정찰대대도 편성되어 있다.북한 특수전부대는 하계(6월 중순~8월 초), 동계(12월~2월 중순)로 나눠 훈련을 하는 것으로 알려졌다.훈련은 김정일 최고사령관 명령으로 시작되며, 한 달은 전투정치훈련을 받게 된다. 오전에는 사상교육을 집중적으로 받고 오후에는 소규모 진지 구축 훈련을 하는 것으로 전해졌다.훈련 시작 한 달 동안 전투정치훈련을 하고 나면 다음 달부터는 본격적으로 지상군, 해군, 공군 합동훈련에 돌입한다.경보병부대 요원들은 훈련 기간에 매일 35㎏ 전후의 군장을 꾸려 10시간에 걸쳐 20㎞를 행군한다. 주로 산악지역으로 행군하는 과정에서 습격, 매복, 침투, 야영 훈련을 하며, 집결지에 모이면 중대별로 실제 격술(특공무술) 시합을 벌여 실전감각을 익힌다고 한다.하계 및 동계훈련 기간 매일 20㎞ 행군을 하지만 매주 토요일에는 지옥의 야.주간 행군이 시작된다.매주 토요일 오후 10시부터 다음날 정오까지 14시간 동안 40㎞ 거리를 행군한다.<그래픽> 남.북 군사력 비교    (서울=연합뉴스) 박영석 기자 = 북한의 대표적인 비대칭전력인 특수전 병력이 20만명에 달하는 것으로 평가됐다.    30일 국방부가 발간한 국방백서에 따르면 북한은 경보병사단을 전방군단에 편성했고, 전방사단에 경보병연대를 추가 편성하는 등 특수전 능력을 지속적으로 강화하고 있다.    zeroground@yna.co.kr    @yonhap_graphics(트위터)35㎏의 군장을 꾸려 행군하는데 최근에는 12시간 내에 주파하는 훈련으로 바뀌었다고 한다. 고속으로 달리는 열차의 지붕 위를 뛰면서 사격하는 훈련도 하고 있다.특히 북한군은 ""김일성 주석이 천리행군을 하며 일본군을 무찔렀다""면서 경보병부대에 3일간 쉬지 않고 걷는 천리행군도 훈련기간에 한 차례씩 하도록 독려하고 있다고 군 소식통은 전했다.소식통은 ""경보병부대원들의 훈련 강도가 우리 군 특수전부대에 못지않다""면서 ""그러나 정찰총국 예하 특수작전 요원 1만여명은 해군 특수전여단(UDT/SEAL)처럼 인간의 한계를 넘어서는 고난도 훈련을 받는다""고 말했다.북한의 특수전부대는 MDL 인근 땅굴과 AN-2기 등을 이용해 우리의 후방 지역으로 침투해 주요 목표 타격, 요인 암살, 후방 교란 등의 작전을 수행할 것으로 군은 판단하고 있다.북한의 특수전부대에 대응하는 우리 군 특수부대는 특전사 1만여명을 비롯한 해군 UDT/SEAL, 해병 특수수색대 등을 포함해 2만명에 훨씬 못 미치는 규모다. 병력 규모로는 북한에 비해 10대1 이상의 열세인 셈이다.우리 군 당국은 특수전 병력의 열세를 만회하기 위해 특수전부대원에 저격용 소총 등 첨단장비 보강을 서두르고 있다.threek@yna.co.kr[관련기사]▶ 샤프 ""북한군 특수부대 20만명 규모""▶ <UDT 혹한기훈련 참가 장군들 ""강한 해군 만들터"">▶ ""북한의 실질군사비 발표치 13~15배""▶ <국방백서로 본 北 위협과 軍 대비태세>▶ 北 특수전 병력 20만명..전차 4천100대(종합)<뉴스의 새 시대, 연합뉴스 Live><모바일 애플리케이션><포토 매거진><저작권자(c)연합뉴스. 무단전재-재배포금지.>"
45,2011-02-13,KTX 모든 구간 운행 '정상'… 사고 구간 40km 서행,https://news.naver.com/main/read.nhn?mode=LSD&mid=shm&sid1=102&oid=143&aid=0002026758,쿠키뉴스,"[쿠키 사회] 고속철도 광명역에서 발생한 탈선사고로 차질을 빚었던 KTX 열차의 운행이 13일 대부분 정상화됐다.코레일에 따르면 전날 오후 8시쯤부터 궤도이탈 구간에서 KTX 운행을 재개했다. 평상시 주말 운행 편수(217회)의 98.2%인 213회를 투입돼 사실상 정상 운행이 되고 있는 셈이다.다만 현재도 사고 선로구간의 안전점검 등을 위해 이 구간에서는 KTX가 시속 40km로 서행하고 있어 전체적으로 KTX의 운행시간이 3분 안팎씩 지연되고 있다.전날까지 코레일은 KTX의 운행 편수를 평상시보다 32회(86%) 줄여 운행했으며, 새마을호 등 일반열차가 이용하는 일반선로로 우회하다보니 KTX 승객들이 큰 불편을 겪었다.코레일은 전날 오후 사고지점인 일직터널에서 탈선해 있던 차량 6량을 끌어내고 선로와 전차선의 구조물, 신호설비 등의 응급 복구를 마쳤으며 정확한 사고 원인 등을 조사하고 있다.현재까지 조사에서는 '선로전환기'의 오작동 때문으로 발생한 사고로 보고있다. 하지만 KTX-산천의 구조적 결함이나 시스템 오류 등의 가능성도 완전 배제하지 않았다.아울러 이번 탈선사고로 선로 시설물 피해, 지연반환금, 예약 및 운행 차질 등 영업 손실도 수십억원대에 이를 것으로 코레일측은 예상하고 있다.지난 11일 오후 1시5분쯤 경기도 광명시 일직동 광명역 상행선 인근 터널에서 부산에서 광명으로 향하던 KTX-산천 열차가 탈선해 이 구간 상하행 열차의 운행이 30여시간 전면 중단됐다.국민일보 쿠키뉴스팀<갓 구워낸 바삭바삭한 뉴스 ⓒ 국민일보 쿠키뉴스(www.kukinews.com), 무단전재 및 재배포금지>"
