,날짜,기사 제목,기사 링크,기사 출처,기사 내용
0,2011-02-13,<르포> 강릉 농촌마을 화이트초콜릿같은 지붕들만,https://news.naver.com/main/read.nhn?mode=LSD&mid=shm&sid1=102&oid=001&aid=0004909832,연합뉴스,"눈속에 파묻힌 농촌마을    (강릉=연합뉴스) 이해용 기자 = 최근 강원 동해안 지역에 폭설이 내린 가운데 13일 강릉시 외곽의 한농촌마을이 폭설에 파묻혀 있다.2011.2.13    dmz@yna.co.kr    http://blog.yonhapnews.co.kr/dmzlife하늘에서 내려다본 동해안 '눈폭탄' 현장..'북극인가?'(강릉=연합뉴스) 이해용 기자 = 눈폭탄이 쏟아진 강원 동해안은 거대한 눈 바다였다.13일 헬기가 대관령에 가까워지면서 백두대간 산기슭의 소나무들은 눈이불을 덮은 듯한 이색적인 모습을 드러냈다.대관령 옛 길은 폭설에 파묻혀 희미한 윤곽만 드러냈으며 눈 없는 고속도로를 힘차게 달려왔던 차량들은 설국의 세계에 진입하자 급히 속도를 줄였다.`눈 바다'    (동해=연합뉴스) 이해용 기자 = 최근 강원 동해안 지역에 내린 기록적인 폭설로 13일 동해시 묵호항 일대에 눈바다가 펼쳐지고 있다.<<지방기사 참조>> 2011.2.13    dmz@yna.co.kr    http://blog.yonhapnews.co.kr/dmzlife강릉시 외곽의 농촌마을은 직사각형 모양의 하얀 지붕들만 남아 마치 화이트 초콜릿을 연상케 했다.비닐하우스를 지탱하던 철주는 엿가락처럼 휘어져 주저앉아 폭설에 무너진 농심을 대변했다.일부 주민들은 비닐하우스와 창고 위에 쌓인 눈을 삽으로 치우고 있었지만 힘에 겨운듯 연신 허리를 펴고 하늘을 쳐다봤다.강릉 시민의 젖줄 남대천을 따라 들어선 개인 주택과 아파트 단지들도 여전히 두터운 눈을 뒤집어 쓰고 있었다.큰 길은 제설작업이 상당 부분 진척돼 차량들이 오고 갔지만 외곽으로 나가는 마을길은 제설작업의 손길이 미치지 못해 인적은 끊어져 적막감을 더했다.눈 폭탄..눈속에 고립된 산골마을    (강릉=연합뉴스) 이해용 기자 = 강원 동해안 지역에 내린 기록적인 폭설로 13일 강릉시 외곽의 산간마을이 눈속에 고립돼 있다.<<지방기사 참조>> 2011.2.13    dmz@yna.co.kr    http://blog.yonhapnews.co.kr/dmzlife헬기가 기수를 남쪽으로 돌리자 바다와 접하고 있는 해안가에는 마치 북극을 연상케 하는 거대한 눈바다가 펼쳐졌다.동해시의 한 바닷가 기슭에는 눈 무게에 잔뜩 눌린 주택들이 판자집처럼 어깨를 맞대고 누워 있었으며 인근 항포구에서는 그물 대신 눈이 잔뜩 담긴 배들이 출하를 포기한 채 발이 묶여 있었다.250여대의 차량과 450여명의 운전자들이 고립됐던 삼척 7번 국도는 이날 오전 양방향이 모두 소통됐지만 도로는 아직도 스키장 슬로프와 비슷해 실제 차량은 많지 않았으며 도로 변에는 운행을 포기한 차량들이 아직도 일부 방치돼 있었다.대로변에는 아직도 내린 눈이 그대로 쌓여 있어 대다수 주민들은 인도를 포기하고 도로로 걸어다녀야 했다.주민들이 엄두를 내지 못하는 지역에는 중장비가 투입돼 길을 뚫었고 이어 군장병들이 찾아와 제설작업에 가세했다.고립지역 투입되는 특공대원(강릉=연합뉴스) 이종건 기자 = 기록적인 폭설로 영동지방 주민불편이 이어지는 가운데 13일 오후 육군 8군단 특공부대원들이 강릉시 안현동 고립지역에서 발생한 환자 수송을 위해 헬기로 투입되고 있다. 2011.2.13    momo@yna.co.kr강원 경찰도 기성경찰관과 전의경 등 2천여명을 삼척시와 동해시 등 눈폭탄이 떨어진 동해안 일원에 배치해 제설작업을 지원했다.그러나 동해시 삼화동 시멘트 공장의 굴뚝에서는 건설현장의 밑거름인 시멘트를 생산하느라 은빛 설원 사이로 힘차게 연기를 토해내고 묵호항 주변에는 시멘트를 싣고갈 화물선들이 몰려와 물고기떼처럼 떠 있었다.헬기가 다시 북상해 강릉시를 벗어날 때 강릉 앞바다와 황병산에서는 다시 습기를 머금은 눈구름이 서서히 시야를 가리기 시작했다.강원경찰청 항공대 변태식 경감은 ""이런 눈은 평생 처음 본다. 눈구름이 몰려오면 백두대간을 넘어가기 힘들 수도 있다""면서 ""이렇게 눈이 많이 내렸는데 또 폭설예보가 있어 걱정""이라며 조종간을 힘껏 잡았다.dmz@yna.co.krhttp://blog.yonhapnews.co.kr/dmzlife<뉴스의 새 시대, 연합뉴스 Live><모바일 애플리케이션><포토 매거진><저작권자(c)연합뉴스. 무단전재-재배포금지.>"
1,2011-02-13,"""둘리는 어디 사나?""  치열한 문화콘텐츠 경쟁",https://news.naver.com/main/read.nhn?mode=LSD&mid=shm&sid1=102&oid=214&aid=0000169157,MBC,"[뉴스데스크]◀ＡＮＣ▶자치단체들의 치열한 문화콘텐츠 사업 얘기입니다.한국 최고의 만화 캐릭터 둘리 아시죠?그런데 둘리가 부천시에서 최근에 서울 쌍문동으로 이사 갔답니다.어른들이 둘리를 어디로 이사 보내든 둘리는 아이들의 꿈속에 살 겁니다.박소희 기자입니다.◀ＶＣＲ▶우리나라를 대표하는만화 캐릭터아기공룡 둘리.1억만년 전 빙하에 갇혔던 둘리는바다를 거쳐 한강까지 흘러옵니다.그런 둘리를 최근 서울 도봉구가명예구민으로 선정했습니다.만화의 배경이 된 쌍문동에무려 130억 원의 예산을 들여,구 전체를 둘리테마파크로 꾸민다는야심찬 사업계획도 발표했습니다.◀ＩＮＴ▶ 이동진 도봉구청장""도봉구가 문화관광도시로서의입지를 굳히는데 매우 중요한역할을 하리라고...""구청에 가 보면1억만년 전에 태어난 둘리가쌍문동에 정착했다는가족관계등록부까지 마련해 놨습니다.그런데 둘리는 이미 지난 2003년부천시 명예시민으로 선정된 바있습니다.부천시가 둘리의 생일로 정한매년 4월 22일에 축제를 열면서문화콘텐츠사업을 벌여온 겁니다.이렇게 각 지자체들이 경쟁적으로문화콘텐츠 산업에 뛰어드는 것은지역상권을 활성화시켜 지자체 재정에도움을 주려는 목적 때문입니다.그러다보니 같은 캐릭터를 놓고갈등을 벌이는 경우가 속출해 왔습니다.'홍길동'을 놓고강릉시와 전남 장성군이소송까지 벌였고,원래 고향이 황해도 황주인'심청이'의 경우엔전남 곡성과 충남 예산이 때 아닌원조경쟁을 벌이기도 했었습니다.지자체들의 치열한 노력 끝에함평 나비축제처럼세계적 행사로 성장한 경우도 있지만용두사미식으로 실패하는 게 대부분.둘리를 소재로 사업을 벌였던부천시의 경우도둘리를 형상화한 조형물을유흥가에 설치만 해놓고지속적인 콘텐츠 개발을 소홀히 해결국 2008년에 '둘리의 거리'를중단하고 말았습니다.◀ＩＮＴ▶ 김수정/둘리 원작자""처음에는 꿈의 거리가 뭔가유흥거리 같은 걸로 변질이 되어버렸어요.""지자체의 재정난 타개책으로시간을 거슬러 다시 태어난둘리와 홍길동과 심청이.역사적인 콘텐츠로확실하게 정착되기 위해선끊임없는 스토리와 아이디어 개발이뒤따라야한다는 지적입니다.MBC뉴스 박소희입니다.(박소희 기자 so2@mbc.co.kr)[저작권자(c) MBC (www.imnews.com) 무단복제-재배포 금지]"
2,2011-02-13,"""어설프다 했더니""‥종업원과 짜고 강도 자작극",https://news.naver.com/main/read.nhn?mode=LSD&mid=shm&sid1=102&oid=214&aid=0000169160,MBC,"[뉴스데스크]◀ＡＮＣ▶광주광역시의 한 편의점에 강도가 들었는데 알고 보니 종업원과 강도가 짜고 벌인 자작극이었습니다.범행 한 시간 만에 들통 난 어설픈 이들의 연기 함께 보시죠.박용필 기자입니다.◀ＶＣＲ▶늦은 밤 편의점에점퍼를 뒤집어 쓴 남자가들어옵니다.계산대로 다가가종업원의 멱살을 잡았다가 놓습니다.종업원은 기다렸다는 듯이바로 앞 계산대는 물론옆에 있던 계산대까지 열어현금을 모아 건네줍니다.오히려 강도가 긴장한 듯점포로 얼굴가리기에 급급하고종업원을 의식하지도 않습니다.종업원은 강도를 당한 후에도당황한 기색은 전혀 보이지 않습니다.강도범은 편의점에서 아르바이트를 했던18살 김 모 군으로 종업원과 짜고강도 자작극을 벌인 겁니다.◀ＩＮＴ▶ 박 모 군""자기가 (김 군이) 편의점을 털겠다고했어요. 칼을 들고 들어가면 돈을 주면된다고...""자작극은 곧 들통이 나고 말았습니다.CCTV에 찍힌 범행 영상이어설프다는 점을 의심한 경찰의 추궁에공모 사실을 털어놓은 겁니다.◀ＩＮＴ▶ 강동준 팀장/광주 광산경찰서 강력 5팀""피해자를 위협하는 장면이 형식적이었고이런 점 등으로 봐서 내부 공모에 의한범행으로 확인됐습니다.""경찰은 편의점 종업원 박 모 군을특수절도혐의로 입건하고강도 행각을 벌인 김 군을쫓고 있습니다.MBC뉴스 박용필입니다.(박용필 기자)[저작권자(c) MBC (www.imnews.com) 무단복제-재배포 금지]"
3,2011-02-13,몸빼바지 입고 흔들흔들…'할머니의 막춤' 무대로,https://news.naver.com/main/read.nhn?mode=LSD&mid=shm&sid1=103&oid=055&aid=0000199027,SBS,"<8뉴스><앵커>우리 어르신들이 관광버스에서 많이 즐기신다는 일명 '막춤', 할머니들의 춤이 현대무용 공연으로 다시 태어났습니다.김수현 기자가 소개합니다.<기자>우리 할머니들의 춤은 비슷해 보이지만 또 조금씩 다릅니다.마음 가는 대로 몸을 움직이며 흥을 돋우고 한을 풉니다.무용가 안은미 씨는 전국을 돌면서 춤추는 할머니 160여 명을 영상으로 기록했습니다.[안은미/무용가 : 20세기를 살았던 저희 할머니, 지금은 사실 저희들의 어머니죠. 그 분들의 몸에 대한 움직임에 대한 기록이 없었다는 생각이 문득 들어서 '아, 춤추는 할머니들을 찍으러 다녀야 되겠다, 전국의.']울긋불긋 화려한 티셔츠에 '몸빼'로 불리는 헐렁한 바지, '할머니 패션'의 무용수들이 막춤, 관광버스춤으로도 불리는 할머니춤의 재구성을 보여줍니다.안은미 씨가 안무한 이 작품에는  할머니들도 무대에 올라 젊은 무용수들과 함께 춤을 출 예정입니다.형식 없는 형식, 즉흥과 생동하는 에너지가 중요한 무대입니다.[김혜경/안은미 무용단원 : 저희는 '이거다'라고 교육을 받잖아요. 그런데 할머니들은 그냥 정말 자연스럽게 진짜 자기가 추고 싶은 춤을 추세요. 완전 기대되죠.][안은미/무용가 : 우리나라 춤의 원형들, 그러니까 일반 사람들의 춤의 원형들이 어떻게 전수되고 있는가를 볼 수 있을 것 같아요.]무대에 오르는 할머니춤은 평범한 이들의 삶의 애환이 아로새겨진 몸짓이 예술이 될 수 있고, 역사가 될 수 있다고 말합니다.(영상취재 : 공진구, VJ : 오세관)김수현shkim@sbs.co.kr관/련/정/보◆ ""해도 너무하네"" 관객 혹평에 뮤지컬 '미션' 리콜◆ 이선희, 카네기홀 무대 섰다…한국가수로 4번째◆ 영국배우의 '방귀 연기'…언어 달라도 문화 소통◆ 재즈 1세대, 관록의 무대…""숨 멎을때까지 연주""◆ '한국판 폴포츠' 일본 공연…휘진에 뜨거운 관심[SBS기자들의 생생한 취재현장 뒷이야기 '취재파일']저작권자 SBS&SBS콘텐츠허브 무단복제-재배포 금지"
4,2011-02-13,하얀 유령도시로 변한 동해안…제설 '산넘어 산',https://news.naver.com/main/read.nhn?mode=LSD&mid=shm&sid1=102&oid=055&aid=0000199014,SBS,"<8뉴스><앵커>도시에도 사정은 마찬가지입니다. 도심기능은 이틀째 마비됐습니다. 중장비가 동원됐지만 제설작업은 산넘어 산입니다.조기호 기자입니다.<기자>날이 밝으면서 동해안의 지방자치단체들은 인력과 장비를 총동원해 제설작업을 벌였습니다.하지만 100년만의 폭설에 뒤덮인 도시의 눈을 걷어내기엔 역부족입니다.인도는 눈에 파묻혀 분간조차 되지 않습니다.버스 정류장도 눈더미에 갇혀 시내버스도 사람들의 발길은 끊겼습니다.아파트 단지에선 눈을 치우기 위해 중장비까지 동원됐습니다.[김유남/강릉시 교1동 : 내가 여기서 산지 10년째인데, 처음이지. 뭐, 장비도 없고… 장비가 있어도 눈을 갖 다 버릴 데가 없어요.]차량을 덮은 눈을 치우더라도 앞뒤에 있는 또다른 눈 때문에 당분간 이동이 불가능한 상황입니다.왕복 4차선 도로 위로 두 마을을 잇는 육교는 오늘(13일) 오후에서야 제설 작업이 시작됐습니다.[김소영 : 이렇게 한꺼번에 많은 양의 눈이 내리는 건 너무 힘든 거 같아요. 사무실도 치워야 되고, 집도 치워야 하고 허리도 아프고 너무 힘들어요. 이제 그만좀 내렸으면 좋겠어요.]눈더미에 깔려 몸을 다친 고라니도 시청 뒷마당까지 휩쓸려 내려왔습니다.왠만한 눈엔 끄덕없던 동해안의 도시들은 사람과 차량의 통행마저 사실상 끊겨 하얀 유령도시로 변해버렸습니다.(영상취재 : 황인석, 박현철, 영상편집 : 위원양)조기호cjkh@sbs.co.kr관/련/정/보◆ 손 쓸 겨를도 없이 쑥대밭으로…농가 피해 심각◆ '7번 국도' 겨우 뚫렸지만…버려진 차량 곳곳 방치◆ 폭설과의 사투…치우면 치울수록 피해 '눈덩이'◆ 강원도 폭설, 밤사이 그쳤지만…제설 작업 '걱정'◆ 동해안폭설 이재민 640가구…제설.복구 '안간힘'[SBS기자들의 생생한 취재현장 뒷이야기 '취재파일']저작권자 SBS&SBS콘텐츠허브 무단복제-재배포 금지"
5,2011-02-13,"""눈밭 기어 퇴근을…"" 폭설 직찍 '상상 초월'",https://news.naver.com/main/read.nhn?mode=LSD&mid=shm&sid1=102&oid=143&aid=0002026766,쿠키뉴스,"[쿠키 사회] 11일 강원 동해안에 쏟아진 유례없는 폭설로 강릉과 동해, 삼척 등지가 거대한 눈 덩이에 갇혔다. 해당 지역에 살고 있는 네티즌들은 자고 일어나 눈앞에 펼쳐진 어이없는 현실에 황당함을 드러내며 당시 상황을 담은 '직찍(직접 촬영한 사진을 일컫는 말)'을 올리고 있다.미디어다음의 '아고라' 게시판에는 12일부터 올라온 인증사진이 수두룩하게 쌓여있다. 입이 다물어지지 않는 진귀한 장면은 물론 재치 있는 후일담으로 영동지역의 상황을 짐작하게 된다.'아이디미정'이란 닉네임의 네티즌은 직장 동료의 '열혈 퇴근기'를 올렸다. 강원도 한적한 어느 마을에 위치한 한 공장에서 야근을 마치고 집으로 향하는 직장인의 뒷모습은 한 편의 탐험기를 방불케 했다. 오전 10시 '아이디미정'의 동료는 우주복과 비슷한 흰색 방진복을 착용하고 퇴근길에 나섰다. 손에는 세숫대야와 같은 커다란 통과 삽자루를 쥐었다. 동료는 쉴 새 없는 눈을 퍼내며 길을 냈다. '집에 가야겠다는 신념과 지금 못가면 남아서 회사에 쌓인 눈을 치워야 한다는 집념'으로 동료는 전진했다. 언덕을 오르다가 중턱에 누워 쉬기도 했고, 눈밭을 거의 기다시피 올라가기도 했다. 젖 먹던 힘을 다해 언덕 끝까지 오르면서 퇴근기는 끝이 난다.하지만 난관은 한번 더 있었다. '아이디미정'은 ""저 직원, 결국 버스가 끊겨서 지나가는 공무원의 차를 얻어 타고 갔다는군요""라는 후일담을 남겼다.이를 접한 네티즌들은 ""리얼 버라이어티, 야생 다큐멘터리가 따로 없다"" ""인간 승리다"" 등의 의견을 남겼다.닉네임 '아름다운삶'은 동해시의 한 산골마을의 적설량을 인증해 큰 관심을 받았다. ""평생 이렇게 많은 눈은 처음 본다""며 올린 사진에는 150cm 육박한 눈이 쌓여있었다. 그는 바닥부터 눈을 파서 길을 낸 뒤 높이를 쟀다. 한옥집을 촬영한 사진에는 바닥에 쌓인 눈이 처마와 닿을 듯 쌓여 있었다.집 앞에 쌓인 눈을 치우는 장면을 올린 네티즌도 있었다. 닉네임 '큰성전'은 4시간 30분 동안 집 앞 골목길부터 공원 주차장까지 눈을 치운 과정을 촬영해 올렸다. 쌓인 눈은 골목길을 아예 집어삼켰다. 네티즌은 동굴을 뚫듯 길을 텄다.닉네임 '유해성'은 눈 폭탄 맞은 거리의 모습을 중계했다. 강릉시 남포동의 모습을 촬영했다. 주차해 둔 차는 아예 자취를 감췄다. 눈 쌓인 차들은 커다란 무덤처럼 보였다. 몇몇 차들은 와이퍼가 세워져 있어 더듬이를 연상케 했다.대설 소식을 전한 뉴스 장면도 온라인에서 화제를 모았다. 12일 MBC 뉴스데스크는 강원도 폭설 소식을 전하며 한 여성 기자가 강릉의 한 산골마을에서 눈밭에 파묻힌 장면을 연출했다.기자는 상반신만 내놓은 채 상황을 전하고 직접 눈길을 헤치며 걸어 강원에 쏟아진 '눈 폭탄'의 상황을 가감없이 전했다. 국민일보 쿠키뉴스 신은정 기자<갓 구워낸 바삭바삭한 뉴스 ⓒ 국민일보 쿠키뉴스(www.kukinews.com), 무단전재 및 재배포금지>"
6,2011-02-13,[MD포토] 새로 선보인 갤럭시S2와 갤럭시탭,https://news.naver.com/main/read.nhn?mode=LSD&mid=shm&sid1=105&oid=117&aid=0002121704,마이데일리,"[마이데일리 = 김용우 기자] 삼성전자가 14일(한국시각) 스페인 바르셀로나에서 시작되는 'MWC(Mobile World Congress) 2011'에 앞서 벌어진 '삼성 모바일 언팩' 행사서 갤럭시S 후속작인 '갤럭시S Ⅱ'와 '갤럭시 탭 10.1'을 공개했다.'갤럭시S Ⅱ'는 텐밀리언셀러 스마트폰 갤럭시S의 후속작으로 4.3인치 슈퍼아몰레드 플러스, 1GHz 듀얼코어 애플리케이션 프로세서 등 첨단 기술이 집약됐다.구글의 최신 안드로이드 OS 진저브래드에 1GHz 듀얼코어 애플리케이션 프로세서를 탑재해 인터넷, 3D게임, 고화질 동영상 등에서 경험해보지 못한 초고속 사용환경을 제공한다.'갤럭시 탭 10.1'는 최신 안드로이드 OS인 허니콤 기반의 태블릿으로 10.1형 (1280X800) 디스플레이, 1GHz 듀얼코어 애플리케이션 프로세서, 800만 화소카메라, 풀HD급 동영상 촬영·재생, 듀얼 서라 운드 스피커 지원을 통해 최고의 멀티미디어 환경을 제공하면서도 더욱 얇고 가벼운 디자인으로 이동성도 극대화한 제품이다.[사진제공 = 삼성전자](김용우 기자 hiljus@mydaily.co.kr)기사 제보 및 보도자료press@mydaily.co.kr- NO.1 뉴미디어 실시간 뉴스 마이데일리(www.mydaily.co.kr) 저작권자 ⓒ 마이데일리. 무단전재&재배포 금지 -"
7,2011-02-13,삼성전자 NFC 탑재 스마트폰 `웨이브 578',https://news.naver.com/main/read.nhn?mode=LSD&mid=shm&sid1=101&oid=001&aid=0004909155,연합뉴스,"(바르셀로나 삼성전자=연합뉴스) 삼성전자는 14일 스페인 바르셀로나에서 열리는 '모바이월드콩그레스 2011'에서 바다 모바일 플랫폼에 근거리 무선통신기술인 NFC(Near Field Communication)가 탑재된 스마트폰 '웨이브 578'을 공개한다.'웨이브 578'은 바다 플랫폼 탑재폰으로는 처음으로 근거리 무선통신기술(NFC)을 적용하여 각종 모바일 결재와 정보 공유가 쉬워져 소비자에게 새로운 라이프 스타일을 제공할 수 있다.근거리 무선통신기술(Near Field Communication)은 기기들간  데이터 통신을 제공하는 RFID의 일종으로 읽기 뿐만 아니라 쓰기 기능도 가능하다는 점이 특징이다.휴대폰에 적용될 경우 교통카드 기능, 레스토랑, 주차비 정산 등 모바일 결제 서비스는 물론 도어락 제어, 도서대출, 주차위치 저장 등 다양한 서비스를 이용할 수 있다. 2011.2.13photo@yna.co.kr<뉴스의 새 시대, 연합뉴스 Live><모바일 애플리케이션><포토 매거진><저작권자(c)연합뉴스. 무단전재-재배포금지.>"
