,날짜,기사 제목,기사 링크,기사 출처,기사 내용
111,2016-02-04,6살배기 아들 살해한 비정한 母 항소심도 징역 5년,https://news.naver.com/main/read.nhn?mode=LSD&mid=shm&sid1=102&oid=003&aid=0007026336,뉴시스,"【청주=뉴시스】김재광 기자 = 가정불화 등을 이유로 6살배기 아들을 살해한 어머니가 항소심에서도 징역 5년의 중형을 선고받았다.대전고법 청주 제1형사부(부장판사 김승표)는 4일 아들을 목 졸라 살해한 혐의(살인)로 구속기소 된 양모(34)씨의 항소심에서 검사의 항소를 기각하고 징역 5년을 선고한 원심을 확정했다고 밝혔다.이 여성은 1심에서 국민참여재판을 신청했지만, 배심원 9명은 만장일치로 유죄를 평결했다.양씨는 지난해 7월 19일 오후 자신이 거주하는 청주시 한 아파트에서 이불로 6살 아들의 목 부위를 압박해 살해한 혐의로 구속기소 됐다.재판부는 ""피고인이 어머니로서 생명을 보호하고 양육할 책임이 있음에도 만 6세의 아들을 살해한 점은 엄히 처벌해야 마땅하지만 심한 우울증 증세를 보이던 중 남편에게 버림받은 것으로 생각해 아들을 살해한 것으로 보인다""고 판시했다.이어 ""피고인이 범행을 진심으로 반성하고 있는 점, 남편이 선처를 탄원하고 있는 점, 국민참여재판을 거쳐 배심원들이 권고형량을 정한 점 등을 고려했다""고 항소 기각 이유를 설명했다.kipoi@newsis.com★ 세상에 이런일이 -  김부선 출마선언…지지자들 ""무조건 봉사하겠다""★ 오늘의 핫 포토 -  ´포미닛´ 현아, 화끈한 퍼포먼스★ 뉴시스 뉴스, 이젠 네이버 뉴스 스탠드에서도 만나세요★ 손 안에서 보는 세상, 모바일 뉴시스<저작권자ⓒ 공감언론 뉴시스통신사. 무단전재-재배포 금지.>"
112,2016-02-04,드디어 '원샷법' 국회 본회의 통과..,https://news.naver.com/main/read.nhn?mode=LSD&mid=shm&sid1=100&oid=421&aid=0001876316,뉴스1,"25일 서울 여의도 국회에서 열린 산업통상자원위원회 전체회의에서 위원장 직무대리를 맡고 있는 홍영표 의원과 여야 의원들이 기업활력제고특별법(원샷법)을 의결하고 있다. 2016.1.25/뉴스1 © News1 오대일 기자기업 합병 기간 줄이고 세제 혜택 등 기업 사업재편 쉬워져'대기업 위한 법' 野 문제제기 반영한 수정안 가결(서울=뉴스1) 조소영 기자 = 여야가 길고 긴 줄다리기 끝에 4일 경제활성화 2법(기업활력제고특별법·서비스산업발전기본법) 중 '원샷법'으로 불리는 기업활력제고특별법을 국회 본회의에서 통과시켰다.이현재 새누리당 의원이 지난해 7월9일 대표 발의한 지 7개월만이다.국회는 이날 본회의에 원샷법을 상정해 재석의원 223명 중 찬성 174명, 반대 24명, 기권 25명으로 가결했다.원샷법은 기업간 인수합병과 관련한 상법·세법·공정거래법 등의 규제를 한꺼번에 풀어 기업의 사업재편을 쉽게 하자는 취지의 법이다. 1999년 일본이 제정한 '산업활력재생특별조치법'이 모델이다.원샷법이 적용되면서 향후 기업들은 합병시 주주총회 소집절차 간소화 등으로 120일 걸리는 합병 기간을 45일까지 줄일 수 있고, 합병 후 신설법인의 등록면허세를 삭감받는 등 세제 혜택도 받을 수 있을 것으로 보인다.원샷법은 지난달 23일 여야 원내대표·원내수석부대표·정책위부의장이 회동을 갖고 29일 오후 2시 본회의를 열어 통과시키기로 합의하면서 처리에 급물살을 탔었다.그러나 본회의가 열리기로 한 당일, 선거구획정을 담고 있는 공직선거법을 놓고 여야간 이견을 보이면서 원샷법 처리가 무산됐다.이후에도 여야가 평행선을 달리자 정의화 국회의장은 결국 원샷법을 포함해 법제사법위원회를 통과한 40여개 법안을 처리하기 위해 4일 본회의를 열겠다는 방침을 밝혔다.한편 국회 산업통상자원위원회는 지난달 25일 법안심사소위원회와 전체회의를 잇따라 열어 원샷법을 통과시켰다. 당시 대기업의 이해관계만을 반영하고 있다는 야당의 문제제기를 반영해 원안을 일부 수정한 법안이 통과됐다.산업위는 Δ경영권 승계·지배구조 강화와 같은 목적으로 사업재편시 지원금의 3배에 달하는 과징금 부과 Δ상호출자제한기업집단 내 부채비율이 200%를 초과하는 계열사의 경우, 사업재편 승인을 받더라도 지원 혜택 배제 Δ소수주주 보호를 위해 소규모 분할 횟수는 사업재편 기간 동안 1회로 제한 Δ간이합병 인정 범위를 원안(발행주식 총수의 3분의2 이상)에서 '100분의 80이상'으로 조정 Δ사업재편계획심의위원회에 국회 추천 전문가 4인 포함 등의 조항을 신설해 수정안을 통과시켰다. 아울러 법의 부작용을 우려해 법의 유효기간을 5년에서 3년으로 단축시켰다.cho11757@▶ 뉴스1 100% 무료 만화 서비스 오픈!![© 뉴스1코리아(news1.kr), 무단 전재 및 재배포 금지]"
113,2016-02-04,3당 공관위원장 선임 완료 …공천작업 본격화,https://news.naver.com/main/read.nhn?mode=LSD&mid=shm&sid1=100&oid=008&aid=0003625728,머니투데이,"[머니투데이 정영일 배소진  기자] [[the300]새누리 이한구·더민주 홍창선·국민의당 전윤철]왼쪽부터 이한구 새누리당 공관위원장, 홍창선 더불어민주당 공관위원장, 전윤철 국민의당 공관위원장/사진=뉴스1여야 3당이 공직후보추천관리위원회(이하 공천관리위) 위원장 선임을 마무리하고 공천작업에 본격 돌입했다.새누리당은 4·13 총선 공천관리위 위원장에 4선의 이한구 의원을 확정했다고 4일 밝혔다. 부위원장 겸 간사에는 황진하 사무총장을 임명했다. 공천관리 위원으로는 홍문표 제1사무부총장, 박종희 제2사무부총장, 김회선 클린공천지원단장이 확정됐다.위원장직을 맡게 된 이 의원과 김회선 위원은 20대 총선 불출마를 선언했다. 김무성 새누리당 대표는 ""위원 전체 명단은 아직 확정짓지 못했지만 공천작업에 빨리 착수하기 위해 1차 확정된 위원부터 발표하는 것""이라고 설명했다.나머지 위원 선임은 늦어도 이번주말 안에 마련할 예정이다. 모두 외부인사로 구성한다는 입장이다. 공관위 총 위원은 12~13명 선에서 정해질 것으로 관측된다.더불어민주당은 이날 홍창선 전 과학기술원(KAIST) 총장을 공천관리위 위원장에 임명했다.홍 신임 공관리위원장은 17대 국회 당시 열린우리당과 통합민주당의 비례대표 국회의원을 지냈다. 연세대 기계공학과를 졸업하고 미국 펜실베니아주립대학에서 응용역학 박사를 취득했다. 1996년에는 한국항공우주학회 회장을 역임한 바 있다.김종인 비대위원장은 홍창선 공천관리위원장 임명 배경에 대해 ""개혁적이며 올곧고 학계에서 두루 덕망을 쌓으신 분""이라며 ""17대 국회의원을 지내 정치 현실을 잘 이해하고 있다는 점을 높이 평가했다""고 말했다.국민의당은 전윤철 전 감사원장을 공직후보자격심사위원장 겸 윤리위원장에 임명했다.안철수 국민의당 상임공동대표는 전 전 원장에 대해 ""곧고 원칙을 중시하는 성품으로 제19대, 20대 감사원장을 역임하는 등 강력한 추진력과 리더십을 갖춘 인물로 유명하다""고 소개했다.전 전 원장은 심사위원장으로서 총선 후보자 자격에 대해 ""기본적으로 의회주의에 충실하고 계파정치에 함몰되지 않아야 한다""며 ""인기에 영합하지 않으면서 국민의 눈높이에서 정치를 할 수 있는 인물이어야 한다""고 강조했다.['생존 재테크' 백과사전 ""재테크를 부탁해"" ][부자들에게 배우는 성공 노하우 '줄리아 투자노트'  ][내 삶을 바꾸는 정치뉴스 'the 300'][오늘 나의 운세는? '머니투데이운세' ][아찔한 girl~ 레이싱모델 핫포토 ]정영일 배소진  기자 bawu@mt.co.kr<저작권자 ⓒ '돈이 보이는 리얼타임 뉴스' 머니투데이, 무단전재 및 재배포 금지>"
114,2016-02-04,"KDI ""일부 경기지표 부진, 경제성장세 둔화 시사하고 있어""",https://news.naver.com/main/read.nhn?mode=LSD&mid=shm&sid1=101&oid=366&aid=0000314946,조선비즈,"정부의 싱크탱크인 KDI(한국개발연구원)이 4일 “최근 일부 경제 지표의 부진이 지속되면서 우리 경제의 성장세가 점차 둔화될 가능성을 시사하고 있다”고 진단했다.KDI는 이날 발간한 ’KDI 경제동향 2월호’에서 “내수 회복세가 민간 소비를 중심으로 다소 완만해지고 있으며, 수출은 감소세가 확대되면서 부진이 심화되고 있다”면서 이같이 밝혔다.KDI는 내수 회복을 이끌었던 소비 증가세가 주춤해지고 있는 것을 우려스럽게 바라봤다. KDI는 “민간소비의 완만한 개선 추세는 유지되고 있으나 금년 들어 소비활성화 대책의 효과가 빠르게 소멸되고 있는 것으로 판단된다”면서 “12월 소매판매액지수가 비교적 양호한 증가율(전년동월비 3.5%)을 기록했으나, 향후에는 정책효과가 소멸되면서 소매판매의 회복세가 약화될 것으로 추정된다”고 분석했다.소비 심리가 위축되고 있는 것도 우려했다. KDI는 “1월 중 소비자심리지수는 전월보다 2포인트 하락한 100을 기록해 소비심리가 지속적으로 위축되고 있다”면서 “구성항목별로 현재경기판단(-7포인트)과 향후경기전망(-6포인트)이 큰 폭으로 하락해 소비자심리지수 하락을 주도하고 있다”고 분석했다.전반적인 경기흐름에 대해 KDI는 “서비스업생산 증가세가 대체로 유지되고 있으나, 광공업생산과 출하의 부진이 심화되면서 경기회복세가 제약되고 있다”면서 “자동차(0.8%→-3.3%), ICT(5.6%→1.3%) 등 주요 업종 중심으로 생산 부진이 심화되고 있다”고 진단했다.수출에 대해서 KDI는 “중국 등 신흥국의 성장세 둔화 및 유가하락으로 인해 대부분의 품목에서 큰 폭으로 감소해 부진이 심화되고 있다”고 우려했다. 특히 1월 수출이 전년동월대비 18.5% 급감한 것에 대해서는 “주요국 경기둔화가 지속되고 있고 유가가 하락한 가운데 조업 일수가 감소한 것에 따른 것”이라며 “일 평균 수출액이 전월(-14.1%)에 이어 큰 폭(-15.4%)으로 감소한 것은 조업일수의 영향을 제외하더라도 수출이 부진한 상황이라는 점을 시사하고 있다”고 진단했다.또 KDI는 투자 동향에 대해서도 “건설투자가 비교적 양호한 회복세를 유지하고 있으나, 설비투자는 기계류를 중심으로 감소세를 지속하면서 부진한 상황”이라고 우려했다.KDI는 향후 경기 흐름에 대해 “서비스업 생산은 금융-보험업, 보건-사회복지 등을 중심으로 아직까지는 최근의 증가세를 유지하면서 경제 전반의 성장세를 뒷받침하고 있다”면서도 “그러나 광공업 생산 및 출하는 수출 부진이 지속되는 가운데 내수 회복세도 둔화된 데 기인해 감소폭이 확대될 것”이라고 전망했다.한편, KDI는 이날 보고서에서 올해 1분기 전문가 상대로 2016년 GDP 성장률 등을 설문조사한 결과를 소개했다. 전문가들은 올해 우리 경제가 2.7% 성장할 것으로 전망했다. 올해 경제성장률에 대한 전망치는 전년동기대비 기준 작년 2분기 3.3%, 3분기 3.1%, 4분기 2.8%로 계속 낮아지고 있다.이같은 성장률 전망치 하향에도 불구하고 설문조사에 응답한 다수 전문가들은 현재의 기준금리가 2016년 하반기까지 유지될 것으로 전망하고 있다고 KDI는 밝혔다.[정원석 기자lllp@chosunbiz.com][조선비즈 바로가기] [위클리비즈] [페이스북] [카카오스토리]chosunbiz.com"
115,2016-02-04,기가헤르츠보다 100만배 빠른 페타헤르츠 시대 연다,https://news.naver.com/main/read.nhn?mode=LSD&mid=shm&sid1=105&oid=001&aid=0008168940,연합뉴스,"이재동 DGIST 교수    (대구=연합뉴스) DGIST 연구팀이 빛의 파동성을 이용한 극고속 페타헤르츠(PHz) 전자소자의 양자역학적 원천 개념을 처음으로 학계에 제시했다. 사진은 이재동 DGIST 신물질과학전공 교수.  <>DGIST 연구팀 페타헤르츠 전자소자의 양자역학적 원천 개념 제안(대구=연합뉴스) 한무선 기자 = DGIST 연구팀이 기존 기가헤르츠(GHz) 속도 반도체전자공학보다 100만배 빠른 페타헤르츠(PHz) 부도체전자공학 시대를 열 새로운 이론을 내놨다.DGIST는 신물질과학전공 이재동 교수 연구팀이 빛의 파동성을 이용한 극고속 페타헤르츠 전자소자의 양자역학적 원천 개념을 세계 최초로 학계에 제안했다고 4일 밝혔다.연구에는 윤원석 박사, 박노정 UNIST 교수가 참여했다.부도체에 고강도 레이저 펄스를 가할 때 흐르는 전류는 빛의 파동성에 의해 페타헤르츠 시간 스케일의 전기장 진동을 그대로 따라간다.이는 기존 기가헤르츠 반도체전자공학보다 100만배 정도 빠르다고 알려졌다.하지만 극고속으로 움직이는 부도체 내 페타헤르츠 전류를 정보 전달과 신호 처리에 활용할 수 있는 소자로 개발하는 연구는 지금까지 진행되지 않았다.연구팀은 반도체전자공학에서 P형 반도체와 N형 반도체를 결합한 소자와 비슷한 개념의 LHM 부도체(Low-Hole-Mass, 홀의 질량이 전자의 질량보다 가벼운 부도체)와 LEM 부도체(Low-Electron-Mass, 전자의 질량이 홀의 질량보다 가벼운 부도체)를 이종접합한 구조체로 이뤄진 새로운 개념의 전자소자를 제안했다.LHM-LEM 전자소자가 빛의 파동성에 의한 페타헤르츠 전류를 이용해 정보 전달과 신호 처리를 하는 것이 가능해져 극고속 페타헤르츠 전자공학을 여는 양자역학적 원천 개념을 창안할 수 있었다.이 교수는 ""이번 연구는 기존 반도체전자공학보다 100만배 이상 빠른 극고속 페타헤르츠 부도체전자공학을 가능하게 하는 최초의 원천 연구다""며 ""컴퓨터, 휴대전화, 디스플레이 등 IT 기기 성능을 획기적으로 향상시킬 단초를 제공할 것으로 기대한다""고 말했다.이번 연구 결과는 미국 물리학회가 발행하는 물리학 분야 세계 최고의 권위지 피지컬 리뷰 레터스(Physical Review Letters) 3일자 온라인판에 실렸다.mshan@yna.co.kr▶ [현장영상] ""강아지들이 축구시합을?""…견공들의 슈퍼볼 대회▶ [오늘의 핫 화보] ""베일 속 푸틴 큰딸은 '호화생활' 의대생""…사진 첫 공개"
116,2016-02-04,"산업부 ""TPP, 한·미 FTA 와 유사한 수준""",https://news.naver.com/main/read.nhn?mode=LSD&mid=shm&sid1=101&oid=003&aid=0007026257,뉴시스,"""일본 멕시코 베트남 말레이시아 브루나이, TPP 국가에 서비스·투자 시장 추가 개방""【세종=뉴시스】이인준 기자 = 산업통상자원부는 4일 TPP(환태평양경제동반자협정)을 분석한 결과 ""규범과 시장접근 분야 모두 전반적으로 한·미 FTA(자유무역협정)과 유사한 수준""이라고 밝혔다.산업부는 ""TPP 협정문은 약 9000페이지에 이르는 등 방대하고 구조가 매우 복잡하다""면서도 ""한·미 FTA를 근간으로 해 협상이 이뤄졌기 때문""이라고 설명했다. TPP 협정문은 총 30개 챕터, 한·미 FTA 24개 챕터로 구성된다.이어 ""TPP 협정문의 규범은 역내 높은 수준의 단일규범을 적용해 규제 선진화, 비관세장벽 완화, 행정비용 감소 등을 통해 역내 시장의 효율성과 투명성을 강화하고 교역 및 투자를 촉진할 것""이라고 평가했다.또 ""한·미 FTA 대비 새로 도입된 조항들은 최근의 국제적 논의동향을 반영해 한·미 FTA 규범을 확대·발전시켰다""면서 ""하지만 아직 법적 정의 등이 불명화하고 국가간 해석이 상의한 경우가 많아 각국별 협정 발효 후 이행 과정에서 명확해질 것""이라고 판단했다.산업부는 ""상품 시장접근도 한·미 FTA 등 우리의 기 체결 FTA와 유사한 수준""이라며 ""TPP는 품목수 기준 약 95~100%의 높은 수준의 포괄적 자유화를 달성한 것으로 보인다""고 밝혔다.이어 ""서비스·투자 시장 개방도 한·미 FTA와 유사한 수준""이라며 ""다만 일본, 멕시코와 베트남, 말레이시아, 브루나이의 경우 TPP 국가들에게 서비스·투자 시장을 추가 개방했다""고 설명했다.또 ""정부조달 시장은 우리가 가입한 WTO(세계무역기구) 개정 정부조달협정(GPA) 수준으로 개방된 것을 확인했다""며 ""GPA 미가입국인 멕시코, 말레이시아, 베트남, 블나이 등이 TPP 국가에 정부조달 시장을 점진 개방할 것으로 보인다""고 밝혔다.산업부는 ""이번 분석 결과를 토대로 향후 주요국과의 기술협의 등을 통해 협정문을 추가로 검토해나가고, 산업경쟁력 강화와 국내제도 선진화 차원에서 대책을 마련할 것""이라고 말했다.또 ""규범수용이 필요한 부분은 적극 대응해나갈 예정""이라며 ""국내 다양한 이해관계자 의견을 수렴해 국익을 극대화하는 방향으로 정부 입장을 최종 확정할 계획""이라고 밝혔다.한편 정부는 지난해 10월5일 TPP 타결 이후 TPP 협정문 분석 태스크포스를 중심으로 협정문 분석을 진행해왔다. 그동안 민관 검토회의 30여 회, 뉴질랜드·베트남 등 당사국과 기술협의 2회 등을 추진해왔다.TPP 협정문은 이날 오전(현지시간) 뉴질랜드를 시작으로 각국별 서명을 시작으로, 국별 비준 절차에 착수했다. 우리 정부도 향후 공청회, 국회보고 등 통상절차법에 따른 절차를 거쳐 TPP 가입 여부를 결정할 계획이다.ijoinon@newsis.com★ 세상에 이런일이 -  김부선 출마선언…지지자들 ""무조건 봉사하겠다""★ 오늘의 핫 포토 -  ´포미닛´ 현아, 화끈한 퍼포먼스★ 뉴시스 뉴스, 이젠 네이버 뉴스 스탠드에서도 만나세요★ 손 안에서 보는 세상, 모바일 뉴시스<저작권자ⓒ 공감언론 뉴시스통신사. 무단전재-재배포 금지.>"
117,2016-02-04,'딸 5시간 폭행' 친부·계모 아동학대치사 영장,https://news.naver.com/main/read.nhn?mode=LSD&mid=shm&sid1=102&oid=001&aid=0008168793,연합뉴스,"""훈계 목적 넘어선 심각한 폭력""…계모 여동생도 아동학대 혐의 적용송치 단계서 아동학대치사죄 → 살인죄 적용 가능성(부천=연합뉴스) 신민재 기자 = 중학생 딸을 5시간 동안 때려 숨지게 한 부모에게 경찰이 아동학대치사 혐의로 구속영장을 신청하기로 했다.경기 부천 소사경찰서는 지난해 3월 숨진 여중생의 아버지인 목사 A(47)씨와 계모 B(40)씨에 대해 4일 오후 늦게 아동학대치사 혐의로 구속영장을 신청할 예정이라고 밝혔다.이 부부는 지난해 3월 17일 오전 7시부터 정오까지 부천의 자택 거실에서 가출했다가 돌아온 딸 C(지난해 사망 당시 13세)양을 5시간에 걸쳐 폭행했다고 자백했다.아버지 A씨는 경찰에서 ""나무막대로 손바닥과 종아리, 무릎 위쪽을 여러 차례 때렸다""고 시인했고, 계모 B씨는 ""남편과 함께 나무막대와 빗자루로 팔과 허벅지를 여러 차례 때렸다""고 진술했다.경찰은 이 부부의 폭행이 훈계 목적을 넘어선 심각한 폭력이었던 것으로 보고 있다.이 부부는 딸이 숨지기 전에도 딸의 도벽과 가출에 대해 훈계한다며 폭력을 휘두른 것으로 드러났다.계모 B씨는 딸이 숨지기 6일 전인 지난해 3월 11일 저녁 여동생(39·C양의 이모) 집에서 나무막대와 손바닥으로 딸의 종아리를 때렸고, 이모 역시 같은 날 회초리로 조카의 손바닥을 때린 것으로 조사됐다.아버지 A씨는 딸이 숨진 날인 지난해 3월 17일 오전 1시에도 플라스틱 막대로 딸의 손바닥과 종아리를 때린 사실을 경찰 조사에서 털어놨다.C양의 시신을 부검한 국립과학수사연구원은 이날 통보한 1차 구두소견에서 ""대퇴부에서 비교적 선명한 출혈이 관찰됐다""면서 ""CT(컴퓨터단층촬영)와 엑스레이 검사에서는 골절이나 복강내 출혈은 없는 것으로 나타났다""고 밝혔다.국과수는 ""현미경 검사 등 정밀감정을 거쳐야 하는 탓에 현 단계에서는 정확한 사인을 알 수 없다""면서도 ""외상성 쇼크사의 가능성을 배제할 수 없다""고 덧붙여 C양이 누군가에게 심하게 맞아 숨졌을 가능성을 지적했다.국과수는 C양의 사망 원인 등 정확한 부검 결과를 다음주에 통보할 예정이다.딸의 시신을 11개월간 집안에 보관해온 A씨 부부는 사망 사실을 경찰에 알리지 않은 이유에 대해 ""주님이 살려 줄 것이라는 종교적 신념으로 딸의 시신을 방치했다""고 주장했다.딸이 숨진 뒤 보름이 지나 가출신고한 것에 대해서는 ""담임교사로부터 2차례 '경찰에 신고해야 되지 않느냐'는 전화를 받은 뒤 문제가 될 것 같았고 사망 사실이 들통날까 두려워 신고했다""고 진술했다.경찰은 C양의 이모에 대해서도 아동학대 혐의로 구속영장을 신청하기로 했다.A씨 부부는 경찰 조사에서 ""딸을 폭행한 것은 맞지만 살해할 고의는 없었다""며 살인 혐의는 부인하는 것으로 알려졌다.경찰은 A씨 부부를 일단 아동학대치사 혐의로 구속한 뒤 보강 수사를 통해 검찰 송치 단계에서 살인죄를 적용하는 방안을 검토 중이다.경찰 관계자는 ""현재까지 진술 내용과 부검 1차 소견을 토대로 A씨 부부에게 상해치사(3년 이상 징역)의 가중처벌 규정인 아동학대치사죄로 구속영장을 신청할 방침""이라며 ""살인죄(사형·무기징역 또는 5년 이상 징역) 적용이 가능한지 법률지원팀이 검토하고 있다""고 말했다.2014년 신설된 '아동학대범죄의 처벌 등에 관한 특례법'상 아동학대치사죄는 학대로 발생한 아동 사망 사건에서 고의·과실을 따지지 않고 폭넓게 적용해 무기징역 또는 5년 이상 징역에 처한다.경찰은 프로파일러(범죄심리분석관)들을 투입해 A씨 부부를 상대로 사이코패스 성향 여부 등 범죄행동분석도 하고 있다.smj@yna.co.kr▶ [현장영상] ""강아지들이 축구시합을?""…견공들의 슈퍼볼 대회▶ [오늘의 핫 화보] ""베일 속 푸틴 큰딸은 '호화생활' 의대생""…사진 첫 공개"
