,날짜,기사 제목,기사 링크,기사 출처,기사 내용
171,2016-02-04,한강유람선 침몰은 우측선미에 난 17cm짜리 구멍 때문,https://news.naver.com/main/read.nhn?mode=LSD&mid=shm&sid1=102&oid=022&aid=0003009992,세계일보,"지난달 26일 일어난 한강 유람선 '코코몽호' 침몰 원인이 당초 알려진 스크루 고무 패킹 때문이 아니라 선미에 난 구멍인 것으로 밝혀졌다.4일 서울지방경찰청 한강유람선 침몰사건 특별 수사전담팀은 서울 성동경찰서에서 중간 수사 결과를 발표했다.경찰에 따르면 코코몽호에는 선미 우측에 길이 120㎝, 폭 17㎝의 깨진 구멍이 난 것 외에는 다른 손상 부위가 없는 것으로 조사됐다.경찰은 ""사고 직후 일부 언론이 스크루의 스턴튜브(고무 패킹)가 빠져 침몰이 시작됐다고 보도했으나 스턴튜브에는 이상이 없는 것으로 확인됐다""고 했다.이어 ""국립과학수사연구원 등과 함께 사고 유람선에 파공(무언가 깨져서 생긴 구멍)이 난 원인을 알아내려고 다각적인 감식과 실험을 하고 있다""고 전했다.수사전담팀은 1일부터 국립과학수사연구원, 해양수산부, 인천지방해양수산청과 코코몽호 정밀 합동 감식을 벌여왔다.이랜드크루즈사가 소유주인 코코몽호는 지난달 26일 오후 승객 6명과 승무원 5명 등 11명을 태우고 잠실 선착장을 떠났다가 성수대교 인근에서 침몰했으나 11명 모두 무사히 구조됐다.박태훈 기자buckbak@segye.com[연구] 암을 자가 진단 할 수 있는 10가지 증상[별별] 남자가 바람 피우는 진짜 이유?ⓒ 세상을 보는 눈, 글로벌 미디어세계일보"
172,2016-02-04,"""독도 해양조사도 일본 허가 받으라고?""…日 'EEZ 법안'..",https://news.naver.com/main/read.nhn?mode=LSD&mid=shm&sid1=100&oid=001&aid=0008167095,연합뉴스,"<<독도울릉경비대 제공>>자국 EEZ내 시설물 설치·해양조사 사전허가 명문화 추진독도·센카쿠 등 한일·중일 EEZ 중첩 구역서 분쟁 유발할 듯(도쿄=연합뉴스) 최이락 특파원 = 일본 여권이 자국의 배타적경제수역(EEZ)에서 외국인이 해양조사를 하거나 인공섬을 만들 경우 사전 허가를 받도록 하고 이를 위반하면 현장조사에 나서도록 하는 방안을 추진하는 것으로 전해졌다.이는 중국이 동중국해와 남중국해 등에 대한 영유권을 강화하기 위해 해양진출에 속도를 내는데 대한 견제 차원으로 일본 언론은 보고 있다.그러나 우리나라와 일본도 독도 주변 해역의 EEZ에 대해 주장이 엇갈리는 만큼 일본 여권의 이런 움직임은 앞으로 한일, 중일간 새로운 갈등 요인으로 부상할 수 있어 추이가 주목된다.4일 산케이신문에 따르면 집권 자민당이 추진하는 새 법은 외국인이 일본 정부 허가 없이 EEZ 내에서 인공섬을 조성하거나 시설물을 설치하는 것을 금지하고 있다.또 일본 정부 허가 없이 시설물 설치 등에 나설 경우 현장 조사를 실시할 수 있도록 규정했다.외국인에 의한 EEZ내 해양조사도 사전 허가를 받도록 했다. 또 적법 절차를 거쳐 해양조사를 하더라도 허가 내용을 벗어난 활동을 할 경우엔 조사를 중단시키거나 종료시킬 수 있도록 했다.<그래픽> 중일, 센카쿠 영해 주장문제는 한 나라의 주권이 미치는 영해(기점에서 12해리)와 달리 자국 연안에서 200해리 수역에 대해 천연자원 등에 대한 독점적 권리를 인정하는 EEZ의 경우 인접 국가와 겹치는 경우가 적지 않다는 점이다.한일간에는 독도 주변 해역을 놓고 EEZ 경계 논란이 있으며, 중일간에는 센카쿠(尖閣·중국명 댜오위다오<釣魚島>)열도에서 역시 EEZ 경계를 놓고 양국간 주장이 엇갈린다.자민당이 추진하는 법안이 예정대로 통과될 경우 일본 정부는 독도 주변에서 우리나라가 하는 해양조사에 대해 '일본 EEZ에서의 조사'라고 주장하며 허가를 받을 것을 요구하는 상황까지 상정할 수 있다.마찬가지로 일본이 실효지배하고 있는 센카쿠 열도 주변에서 중국이 '영유권'을 주장하며 해양조사를 실시할 경우도 일본이 자국 법을 근거로 조사 중지를 요구하면서 마찰이 발생하는 상황도 배제할 수 없다.자민당측은 표면적으로는 자국 기업의 해양자원 개발을 뒷받침하기 위한 것이라고 주장하고 있다. 아베 신조(安倍晋三) 총리도 법안 마련을 지지하는 것으로 전해졌다.자민당은 이날 열리는 '배타적경제수역에 관한 법정비추진 실무회의'에서 이런 초안을 제시하고 의견 수렴에 착수할 계획으로 전해졌다.자민당은 공동여당인 공명당은 물론 제1야당인 민주당 의원들도 참가하는 연구모임 '해양기본법전략연구회'를 통해 초당적인 법안 추진을 요구할 계획이어서 추이가 주목된다.choinal@yna.co.kr▶ [현장영상] 이별 통보에 승용차 몰고 식당 돌진…'데이트 폭력'▶ [오늘의 핫 화보] '메시-수아레스 7골 합작' 바르셀로나, 발렌시아 대파"
173,2016-02-04,"靑 ""北, 그동안 받은 제재보다..""",https://news.naver.com/main/read.nhn?mode=LSD&mid=shm&sid1=100&oid=001&aid=0008166797,연합뉴스,"(서울=연합뉴스) 정윤섭 기자 = 청와대는 4일 ""북한이 장거리 미사일을 발사하면 유엔 안전보장이사회 결의의 명백한 위반이기 때문에 그동안 받은 제재보다 더 강한 제재를 국제사회로부터 받게 될 것""이라고 밝혔다.정연국 대변인은 이날 춘추관에서 기자들과 만나 북한의 장거리 미사일 발사 준비와 관련한 정부의 대응조치를 묻는 질문에 이같이 말했다.정 대변인은 이어 ""국가안전보장회의(NSC) 상임위는 수시로 열리고 있고, 알려드릴 사항이 있으면 알려 드리겠다""고 말했다.정 대변인은 일부 언론이 익명을 요구한 고위당국자를 인용해 ""지난주 김관진 청와대 국가안보실장 주재로 열린 회의에서 '북한이 연내에 남북관계를 개선할 의지가 없다'는 결론을 내렸다""고 보도한데 대해 ""고위당국자 발언을 인용했는데 인용 내용은 사실과 다르다""고 답변했다.jamin74@yna.co.kr▶ [영상] '여중생 딸 시신에 방향제' 11개월 방치한 목사 부부▶ [오늘의 핫 화보] 北 ""8∼25일 위성발사"" 통보…韓中 ""혹독한 대가"" ""엄중 우려"" 경고"
174,2016-02-04,"""만원 이하는 현금만"" vs ""카드 쓰랄땐 언제고?""",https://news.naver.com/main/read.nhn?mode=LSD&mid=shm&sid1=101&oid=079&aid=0002796381,노컷뉴스,"<카드 소액결제 제한해야>-결제시 VAN 수수료로 역마진 발생-가맹점 수수료 낮춰 카드사 부담 커-카드는 공공재, 마진 보장해 줘야<카드 소액결제 허용해야>-정액제 수수료, 정률제로 바꾸면 돼-혜택받은 카드사, 소비자에게 책임전가-결제수단 늘어나면서 위기감 느낀듯■ 방송 : CBS 라디오 <김현정의 뉴스쇼> FM 98.1 (07:30~09:00)■ 진행 : 김현정 앵커■ 대담 : 이명식 (한국신용카드학회장), 조연행 (한국금융소비자연맹 상임대표)여러분 편의점에서 4000원짜리 도시락을 사먹는다 하면 카드를 내시나요? 현금을 내시나요? 요즘은 1000원, 2000원짜리 구입하면서도 신용카드 내는 분들이 많습니다. 소액결제가 그만큼 보편화가 되어 있는 실정인데. 상황이 이렇게 되자 신용카드 업계에서는 소액결제로 인한 피해가 막심하니 가맹점들이 소액결제를 거부할 수 있게 해달라, 이런 목소리가 나오고 있습니다.이런 주장에 물론 고개를 끄덕이는 소비자들도 있습니다마는. 일각에서는 ‘그게 무슨 말이냐? 언제는 카드 한 장이면 다 되는 것처럼 홍보를 해 놓고 이제 와서 카드사용이 일상화되니 소액은 안 받겠다는 건 너무하다.’ 이런 비판도 나오는데요. 양쪽 다 나름의 논리가 분명합니다. 오늘 듣고 판단해 보시죠. 먼저 한국신용카드학회 회장이세요. 상명대학교 경영학과 이명식 교수 연결해 보겠습니다. 교수님, 안녕하세요.◆ 이명식> 안녕하세요.◇ 김현정> '소액결제는 신용카드로 하지 말아달라'라고 할 때, 그 소액결제 기준은 얼마입니까?◆ 이명식> 보통 카드업계에서 봤을 때는 1만원 이하 정도가 소액결제가 아닌가 이렇게 보는 거죠. 일부에서는 그 정도의 계산 방식에 따라서 건당 1만 5000원에서 2만 5000원 이하 매출이라도 손실이 나올 수 있다라고 얘기를 하기는 합니다.◇ 김현정> 2만 5000원도 얘기하는 사람도 있지만 대체적으로는 1만원 아래를, 소액결제로 본다?◆ 이명식> 소액이라고 보는 거죠.◇ 김현정> 왜 지금 신용카드 업계에서 소액결제를 금지해야 된다는 이런 얘기가 나오는 걸까요?◆ 이명식> 역시 비용의 문제죠. 그러니까 국내 신용카드 사용자에 소액결제가 확산되고 대중화됨에 따라서 비용이 증가하고 있다고 보는데요. 그런데 비용 증가했을 때 가장 크게 걸리는 부분이 이제 밴(VAN) 수수료 체계다.◇ 김현정> 이 지점에서 카드결제 시스템부터 우리가 알아야 될 것 같은데. 우리가 카드를 내면 그 카드를 받는 가계에 가맹점이 있는 거고, 그 가맹점은 카드사에다 수수료를 내죠. 그리고 그 가맹점과 카드사 사이를 연결해 주는 역할 즉 네트워크를 담당하는 게 바로 밴(VAN)사?◆ 이명식> 그렇죠.◇ 김현정> 카드사는 밴사에게 수수료를 얼마쯤 내는 거군요.?◆ 이명식> 그렇죠. 그러니까 우리나라 카드산업은 일부 국가에서 채택하고 있는 4자 구조와 달리, 조금 전에 말씀하신 것처럼 시장 내 주요 참여자가 고객, 카드사, 가맹점, 3자 구조를 채택하고 있습니다. 3자 구조에서는 신용카드 가맹점이 복수의 신용카드사와 계약을 맺지만, 4자 구조는 가맹점이 특정 매입사와 단독 계약을 체곌하는게 특징이거든요. 그래서 우리나라는 여기에 완충하는 작용을 하는 게 밴(VAN)사죠.◇ 김현정> 그러니까 이 말씀을 좀 쉽게 풀어보자면 어떤 가게는 마스터 카드만 받고 어떤 카드는 비자카드만 받고 미국은 이런 식이라면, 우리나라는 가게에서 이 카드, 저 카드 다 받다 보니까 결국 그 중간 역할을 하는 밴(VAN)사라는 게 필요한 거군요.◆ 이명식> 필요한 거죠.(사진=스마트이미지 제공)◇ 김현정> 그러면 이 밴(VAN)사에 내는 수수료가, 신용카드 회사에서 나는 수수료가 건당 얼마쯤 합니까?◆ 이명식> 지금까지는 보통 건당, 결제건당 100원에서 130원 정도. 적립제로 받았어요. 그러니까 소비자가 100원을 결제해도 100원 내고 100만원 결제해도 100원 내고 이런 식이죠. 수수료가 동일한 거죠. 이런 상황에서 수수료가 급증하다 보니까 역마진이 나오는 상황이 된 거죠.◇ 김현정> 그러니까 500원짜리 음료수를 산 사람도 카드로 긁는다? 그러면 신용카드 회사에서 밴사한테 100원을 줘야 하고.◆ 이명식> 네. 100원에서 130원 정도의 정해진 금액을 주게 되어 있는 거죠.◇ 김현정> 지금까지는 그러면 그렇게 역마진 감당하고도 다 낸 거였어요? 신용카드 회사가?◆ 이명식> 그렇죠. 왜냐하면 지금까지는 그렇게 따지더라도, 대규모 거래도 많고 이러다 보니까 정확한 수치는 파악하기 힘들지만. 그렇다 보니까 참고 견뎠는데.◇ 김현정> 상쇄가 됐군요, 지금까지는.◆ 이명식> 최근에 영세가맹점의 수수료가 1.5%에서, 0.8%를 내렸지 않습니까?◇ 김현정> 그랬죠.◆ 이명식> 그리고 중소 가맹점도 올리는 거를 거부하고 이러다 보니까, 어떤 형태든지 비용을 감소시켜야 되는 그런 상황에 처해 있는 거죠.◇ 김현정> 소액결제 자체도 많아지고. 게다가 이제 가맹점들, 가게가 신용카드사에 내는 수수료율도 떨어지고. 그러니까 이제 신용카드사들도 ‘우리도 그러면 밴사에다가 수수료 내고 있는데 소액결제라도 좀 안 하게 해달라.’ 이렇게 하소연을 하기 시작한 거군요.◆ 이명식> 네. 그런 식이죠. 실질적으로 보게 되면 1회당 결제하는 금액 건수를 보게 되면 개인카드인 경우에는 2014년도 보게 되면 4만 1000원 정도 했던 것이 2015년도에는 3만 8000원, 이런 쪽으로 자꾸 떨어지고 있거든요.◇ 김현정> 그래요, 그 말씀은 점점 사람들이 적은 돈을 결제하고 있다, 이 말씀.◆ 이명식> 그렇죠.◇ 김현정> 하지만 소비자들 입장에서는 불만의 소리가 나옵니다. 왜냐하면 카드사 수익 때문에 왜 소비자가 불편을 안고 가야 하느냐. 예전에는 '카드 한 장이 다 된다' 이렇게 홍보를 막 해서 카드를 쓰게 하더니 이제 와서 9900원도 카드가 안 됩니다라고 하는 건 이건 너무 하다는 주장 어떻게 생각하세요.◆ 이명식> 카드가 결제 시스템이잖아요. 그러니까 어떤 면에서는 정부의 역할을 위탁받은 그런 형국이거든요. 그렇기 때문에 카드는 공공성과 상업성을 같이 갖고 있습니다. 그러니까 결제 시스템이라는 측면에서는 공공성을 갖고 있고요. 또 민간에서 한다는 측면에서는 상업성을 갖고 있거든요. 어쨌든 공공재로서 역할을 할 수 있도록 해 줘야 하는데 그러기 위해서는 일정 수준의 마진이 필요한 거죠.◇ 김현정> 공공재로써 역할을 한다는 얘기는, 현금이 없는 사람들한테 마치 금융기관처럼 결제를 하게 해 주는 그게 공공적인 역할, 공익의 역할을 한다 이렇게 보시는 거군요?◆ 이명식> 네.◇ 김현정> 외국의 경우는 어떻습니까?◆ 이명식> 미국 같은 경우에는 이미 2010년에 가맹점 업주가 10불 이하의 카드 결제를 거부할 수 있도록 법을 개정했습니다.◇ 김현정> 10불이면 한화로 지금 환율로 1만 2000원 정도는 못하도록 하는 법이 있군요. 알겠습니다. 여기까지 오늘 말씀 듣도록 하죠. 교수님, 고맙습니다.◆ 이명식> 네.◇ 김현정> 소액결제에 대해서는 신용카드 사용 금지하는 게 맞다라는 입장 상명대학교 경영학과 이명식 교수, 한국신용카드학회 회장의 이야기를 먼저 들었습니다. 이어서 ‘소액결제를 규제하는 건 이건 말이 안 된다.’ 반대하는 분의 입장 들어보죠. 한국금융소비자연맹 조연행 상임대표 연결이 돼 있습니다. 대표님, 안녕하세요.◆ 조연행> 안녕하십니까? 조연행입니다.◇ 김현정> 그러니까 카드 업계에서는 '비자가 1000원짜리 사고 카드 긁을 때 우리한테 떨어지는 그 이익보다, 우리가 밴사에 내는 수수료가 더 크다, 즉 1만원 이하 물건을 팔면 팔 때마다 적자인데 어쩌라는 말이냐?' 얘기거든요. 어떻게 생각하세요.◆ 조연행> 그것은 지금 밴사와 카드사간에 수수료 책임 문제지, 것을 소비자한테 전가하는 건 잘못됐다는 것이 소비자들의 생각이고요. 지금 정액제이기 때문에 이것을 정률제로 바꾼다든지 계약을 다시 바꿔가지고 체결하게 되면 충분히 풀 수 있는 문제라고 생각합니다.◇ 김현정> 그러니까 그거는 밴사와 카드사가 계약을 바꿔서 알아서 해결하라?◆ 조연행> 네, 그렇습니다.(사진=자료사진)◇ 김현정> 그러면 밴사 입장에서는 우리는 이 정도는 받아야지 유지가 된다, 이런 얘기 아닐까요?◆ 조연행> 반대로 생각하면, 고액 결제 같은 경우는 오히려 많은 마진을 남기는 거 아닙니까? 그런 것은 감안하지 않고 단순히 소액결제에서 손해가 난다고 얘기하는 그 부분만 가지고 주장을 하는 것이죠. 전체적인 결제 구조를 보고 해야 되지, 이것만 가지고 손실난다고 주장하는 것은 무리라고 생각됩니다. 소비자들한테 편익을 더 확대하는 것이 아니라 축소하는 것이 가장 큰 문제라고 생각이 됩니다.◇ 김현정> 소비자의 소비권리를 제한한다는 말씀을 하고 계신 건데. 그런데 외국 같은 경우를 봐도 미국, 캐나다 이런 데는 2010년부터는 10달러, 그러니까 1만 2000원 정도 이하의 카드결제는 이미 거부하도록 법으로 보호를 해 주고 있다, 이런 얘기도 하더라고요?◆ 조연행> 우리나라와는 시장이 완전히 다르다고 생각이 듭니다. 우리나라는 카드결제 비율이 세계 최고로 높은 나라입니다. 외국과 달리 정부가 소비진작을 위해서 유도를 했고, 또 자영업자의 납세자료를 투명하게 하기 위해서 신용카드 사용에 대해서 소득공제를 해 준다든지 영수자료에 대한 복권 사업도 했고요. 그 다음에 의무화시켰고요.그래서 국가가 공공재적 성격으로 해서 카드 사용을 적극적으로 권장해서 세계 최고로 사용률이 높은 나라로 만들어서 모든 혜택을 카드사들이 받았는데. 이제 와서 약간의 수수료 수입이 줄어든다고 소비자들한테 이것을 전가시키는 것은 잘못된 거라고 생각이 듭니다.◇ 김현정> 여태까지 써라, 써라 홍보하고 혜택 주고 해 놓고 그것도 나라가 나서서 해 놓고 이제 와서 카드사가 조금 어려워지니까 쓰지 말아라. 습관을 바꿔라 이런건 이율배반적이란 말씀이세요.◆ 조연행> 맞습니다.◇ 김현정> 카드사들이 지금 살림이 어려운 게 맞기는 맞습니까?◆ 조연행> 카드사들이 지난해 상반기 6개월 동안 단기순이익이 1조 877억원을 냈고요. 이중 가맹점 수수료 수익이 연간 8000억 정도가 됩니다. 그러니까 40% 정도 차지를 하고 있는데요. 카드사들은 이 이외에도 보험대리나 여행알선 또는 통신판매 부대사업으로도 연간 3조원 넘게 수익을 올리고 있습니다.그런데 문제는 카드사들이 이지페이나 다른 결제수단이 증가하면서 경영에 위기감이 생겼다고 생각이 됩니다. 그래서 이것을 타계하기 위해서 는 소비자들한테 지금 수수료 이런 것으로 수입을 늘리려고 하는 것 같은데. 이렇게 할 것이 아니라 경영합리화라든지 다른 수단으로 이익을 창출해 내야 되지 않나 생각이 됩니다.◇ 김현정> 다른 결제수단이 등장하면서 카드사가 전같지 않은 건 사실이지만. 그러면 그 경영의 어려움을 다른 방법으로 타개해야지 이런 식으로 소액결제를 규제하는, 이런 소비를 제한하는 방법으로 하면 안 된다라는 말씀이세요.◆ 조연행> 네.◇ 김현정> 알겠습니다. 이 수수료 수치는 누가 정하는 건가요? 밴사는 얼마 가져가라, 가맹점하고 카드사는 이렇게 나눠라, 이거는 누가 정하는 거예요.◆ 조연행> 일반 가맹점 수수료는 카드사와 가맹점간에 협상에 의해서 정해지는데요. 연매출 2억원 이하의 영세가맹점이나 연매출 2억원에서 3억원까지 중소가맹점의 우대 수수료는 금융위원회가 3년마다 정책적으로 정하고 있습니다.◇ 김현정> 이번에 가맹점들의 수수료를 대폭 깎으라고 나라가 얘기를 하면서 그것 때문에 카드사 손실이 커졌다, 그것도 고려해 달라 이런 것도 얘기하던데요.◆ 조연행> 지금 카드를 쓰게 되면 카드사들이 판촉비를 굉장히 많이 쓰고 있거든요.◇ 김현정> 마케팅비요.◆ 조연행> 할인 혜택이 많은 카드를 발행하고 있고. 카드를 많이 사용하는 소비자들한테는 부가서비스 혜택을 많이 주고 있거든요. 이런 것들을 절감해가지고 하게 되면, 충분히 이런 것을 경영합리화로 커버할 수 있지 않나 생각이 됩니다.◇ 김현정> 알겠습니다. 아직 확정이 된 건 아닙니다. 움직임이 있는 정도이기 때문에 우리가 이렇게 미리 논의하고 생각하고 중지를 좀 모아야 할 게 아닌가 싶어서 오늘 이 주제로 이야기를 좀 나눠봤습니다. 조연행 대표님, 고맙습니다.◆ 조연행> 네, 감사합니다.◇ 김현정> 소액결제에 대해서는 신용카드를 해달라는 카드 업계의 목소리, 소비자들의 반대 목소리까지 차례로 들어봤습니다. 한국금융소비자연맹의 조연행 상임대표까지 들으셨습니다.[김현정의 뉴스쇼 프로그램 홈 바로가기]저작권자 © CBS 노컷뉴스(www.nocutnews.co.kr) 무단전재 및 재배포 금지"
175,2016-02-04,"미라 상태 여중생 ""대퇴부에 선명한 출혈 관찰"" ",https://news.naver.com/main/read.nhn?mode=LSD&mid=shm&sid1=102&oid=001&aid=0008167098,연합뉴스,"국과수, 1차 구두소견 통보…""외상성 쇼크사 가능성""(부천=연합뉴스) 신민재 기자 = 부모에게 5시간 가량 맞아 숨진 뒤 11개월 만에 미라 상태로 발견된 경기도 부천 여중생(지난해 사망 당시 13세)의 대퇴부에서 출혈이 발견됐다.4일 부천 소사경찰서에 따르면 숨진 여중생의 시신을 부검한 국립과학수사연구원은 이날 통보한 구두소견에서 ""대퇴부에서 비교적 선명한 출혈이 관찰됐다""면서 ""CT와 엑스레이 검사에서는 골절이나 복강내 출혈은 없는 것으로 나타났다""고 밝혔다.국과수는 ""현미경 검사 등 정밀감정을 거쳐야 하는 탓에 현 단계에서는 정확한 사인을 알 수 없다""면서도 ""외상성 쇼크사의 가능성을 배제할 수 없다""고 덧붙였다.국과수는 여중생의 사망 원인 등 정확한 부검 결과를 다음주에 통보할 예정이다.경찰은 이날 오후 늦게 여중생의 아버지인 목사 A(47)씨와 계모 B(40)씨에 대해 아동학대치사 또는 살인 혐의로 구속영장을 신청할 방침이다.smj@yna.co.kr▶ [현장영상] 이별 통보에 승용차 몰고 식당 돌진…'데이트 폭력'▶ [오늘의 핫 화보] 슈퍼볼 최고 하프타임 쇼는 '마이클잭슨'"
