,날짜,기사 제목,기사 링크,기사 출처,기사 내용
52,2016-02-04,"정부, 잇단 로또 실적 홍보… 판매 부추기나",https://news.naver.com/main/read.nhn?mode=LSD&mid=shm&sid1=101&oid=005&aid=0000868263,국민일보,"최근 정부는 복권이 있어 좋다는 사람이 10명 중 7명이라고 밝혔다. 복권을 판매해서 생긴 복권기금 1조4399억원은 전액 저소득·소외계층 지원에 사용했다는 자료도 내놨다. 복권에 대한 사람들의 인식이 긍정적으로 개선되고 있다는 분석도 덧붙였다.기획재정부 복권위원회는 4일 지난해 3조5551억원의 복권을 판매해 전년 대비 2724억원 증가했다고 전했다. 얼마 전 발표한 ‘2015년도 복권에 대한 인식 조사’에서는 ‘복권이 있어 좋다’고 답변한 사람이 68.1%로 전년 대비 5.2% 포인트 상승했다고 했다.복권위원회는 복권 판매량 증가의 이유로 복권판매점 432개를 신규 개설한 데다 복권에 대한 인식이 긍정적으로 개선됐고 2014년 세월호 사고 이후 기저효과가 나타난 점 등을 들었다.그러나 경제전문가들의 인식은 달랐다. 담배, 소주와 함께 대표적인 불황 상품답게 복권판매율이 증가했다는 것이다. 지난해 대내외 경제 여건은 중국의 침체와 저유가로 좋지 않았다. 올해는 분위기가 더 엉망이다. 올 1월 수출액은 6년5개월 만에 최저치로 떨어졌다. 이날 KDI는 경제동향에서 수출 등 일부 지표의 부진이 지속되면서 우리 경제의 성장세가 점차 둔화될 수 있다고 했다. 소비심리지수도 지난해 중동호흡기증후군(메르스) 사태 이후 가장 낮은 100이었다.이 와중에 불황을 모른 곳이 로또 시장이었다. 복권위원회에 따르면 로또 판매량은 3조2571억원으로 전년에 비해 6.8%나 증가했다. 2004년 3조2984억원 이후 가장 높은 매출액이다.한 경제 전문가는 정부가 최근 로또 홍보 자료를 계속 내는 데 대해 “살기 팍팍한 국민들에게 대박의 꿈을 조장하는 것 아닌지 모르겠다”고 지적했다.세종=서윤경 기자y27k@kmib.co.krGoodNews paper ⓒ 국민일보(www.kmib.co.kr), 무단전재 및 재배포금지[뉴스 미란다 원칙] 취재원과 독자에게는 국민일보에 자유로이 접근할 권리와 반론·정정·추후 보도를 청구할 권리가 있습니다. 고충처리인(gochung@kmib.co.kr)/전화:02-781-9711"
53,2016-02-04,기업 구조조정-사업재편 물꼬 트나,https://news.naver.com/main/read.nhn?mode=LSD&mid=shm&sid1=101&oid=056&aid=0010282342,KBS,"<앵커 멘트>이른바 원샷법은 여.야의 오랜 줄다리기 끝에 통과됐는데요, 이제 관심은 기업의 구조조정과 사업재편에 과연 물꼬가 트일까 하는 겁니다.원샷법의 구체적인 내용과 향후 전망을 김현경 기자가 보도합니다.<리포트>워크 아웃에 들어간  동부제철입니다.1년 반 넘게 인수하겠단 기업이 없습니다.인수 절차가 까다로운 것이 한 이윱니다.임직원들은 불안한 마음을 숨기지 못합니다.<녹취> 공장관계자(음성변조) : ""안한 건 있죠. 관리직은 이제 주인이 바뀌면 다른 분들이 와야 되고….""앞으로는 기업활력제고특별법에 따라 합병에 반대하는 주주들이 시간을 끌 수 없게 돼 기업 간 합병속도가 빨라집니다.주주총회소집에 필요한 기간도 단축됩니다.기업에게 있어서 시간은 돈입니다.시간을 단축한다는 것은 합병에 따른 비용을 줄일 수 있는 장점이 있습니다.<인터뷰> 양희동(이화여대 경영학과 교수) : ""규제에 들어가는 비용이라든가 절차라든가 이와 같은 문제들이 간소화됨으로써 보다 빠르게 움직일 수 있는 기회를 맞이하게 된 겁니다.""대상은 공급 과잉으로 업황이 안 좋은 업종이 우선 거론됩니다.철강과 조선·해운 업계 같은 곳입니다.다만 어떤 상태가 구조조정이 필요할 정도로 공급과잉이냐에 대해서는 분명한 기준이 없습니다.결국 앞으로의 쟁점은 원샷법의 대상이 되는 공급과잉이란 다소 애매한 기준이 시행령에서 어떻게 구체화될지에 달려있단 지적입니다.KBS 뉴스 김현경입니다.김현경기자 (hkkim@kbs.co.kr)▶[취재후] 방송에서 못한 현장 이야기▶ KBS뉴스 SNS[트위터][페이스북][카카오][저작권자ⓒ KBS 무단복제-재배포 금지]▶[취재후] 방송에서 못한 현장 이야기▶ KBS뉴스 SNS[트위터][페이스북][카카오][저작권자ⓒ KBS 무단복제-재배포 금지]"
54,2016-02-04,금리·물가·성장률·폐업·감원… '마이너스'의 시대,https://news.naver.com/main/read.nhn?mode=LSD&mid=shm&sid1=101&oid=022&aid=0003010362,세계일보,"일본 국채금리 0.044 사상 최저… 마이너스 금리국가 GDP 비중 23%/ 물가상승률 97개국 중 19개국 ‘-’/ 야후·셰브론 등 구조조정 본격화 …침체 징후 선진국서 먼저 나타나세계 경제가 부진의 늪을 벗어나지 못하면서 마이너스 경제지표가 속출하고 있다. 경기 둔화의 여파로 마이너스 금리를 도입한 나라에 이어 물가상승률과 경제성장률까지 마이너스를 기록한 나라가 등장하고 있다. 세계 무대에서 활동하는 글로벌 기업의 구조조정이 거세지는 등 경기 침체로 인한 고통도 가중되고 있다.4일 블룸버그에 따르면 유로존, 덴마크, 스위스, 스웨덴, 일본 등 마이너스 기준금리를 택한 나라의 국내총생산(GDP)은 전체의 23.1%를 차지한다. 이로 인한 각국 국채금리도 줄줄이 하락하고 있다. 돈을 맡기면 이제 이자를 받는 게 아니라 수수료를 내야 하는 상품이 늘어난 것이다.일본의 10년물 국채금리는 3일 사상 최저치인 0.044%를 기록했다. 2년물과 5년물 국채금리도 역대 최저치 -0.189%, -0.148%까지 떨어졌다. 미국의 10년물 국채금리도 1.845%까지 하락하며 9개월 만에 가장 낮았다. JP모건의 국채지수에 편입된 지수 중 25%는 현재 마이너스 상태다.금리뿐만 아니라 물가와 성장률이 마이너스를 기록한 나라도 늘고 있다. 블룸버그에 따르면 전 세계 97개국 중 지난해 국내총생산(GDP) 증가율이 전년보다 낮아진 나라는 47%(46개국)를 차지했다. 이 중 지난해 성장률이 마이너스를 기록한 나라도 6개에 이른다.블룸버그는 97개국 중 19개국의 지난해 물가상승률이 마이너스를 기록할 것으로 전망했다. 글로벌 금융위기가 시작된 2008년 이후 역대 최대다. 물가상승률이 마이너스대로 떨어지면 상품과 서비스 가격이 지속적으로 하락하는 디플레이션이 발생하게 된다.경기 침체의 징후는 글로벌 기업의 구조조정으로도 나타나고 있다. 올해 들어 야후, 셰브론, 바클레이스, 월마트 등 다국적기업의 감원 계획이 줄줄이 이어지고 있다. 지난달 미국 유통업체 월마트는 269곳의 점포 폐쇄와 1만6000명의 감원을 발표하며 시장에 충격을 줬다. 영국계 대형 투자은행 바클레이스도 지난달 1200명의 아시아 직원을 내보냈다.중국 경기둔화와 저유가의 직격탄을 맞은 원유업계의 사정은 더욱 심각하다. 미국 2위 원유생산업체 셰브론은 13년 만에 처음으로 적자를 내고 지난해 3200명에 이어 올해 4000명의 추가 감원을 고려하고 있다. 브라질 최대 기업인 국영에너지회사 페트로브라스도 관리직의 30%를 줄이는 방안을 발표할 예정이다. 노르웨이의 원유 시추업체 ‘송가 오프쇼어’에서도 200명이 짐을 싸게 됐다.지난해 금리인상에 나설 정도로 경기 호조세를 보였던 미국조차 최근 경제 지표가 악화하는 등 향후 전망이 어둡다는 점에서 경제 주체들의 고통은 가중될 전망이다. 도이체방크의 피터 후퍼 수석 이코노미스트는 “마이너스 금리 등 각종 지표의 약세를 감안하면 경기침체 위험이 커졌다는 데 의문의 여지가 없다”고 말했다.이현미 기자 engine@segye.com[연구] 암을 자가 진단 할 수 있는 10가지 증상[별별] 남자가 바람 피우는 진짜 이유?ⓒ 세상을 보는 눈, 글로벌 미디어세계일보"
55,2016-02-04,설 앞두고 조금 추워져…미세먼지 '보통',https://news.naver.com/main/read.nhn?mode=LSD&mid=shm&sid1=103&oid=057&aid=0000904627,MBN,"<1>오늘은 봄의 시작을 알리는 입춘이었습니다. 절기에 걸맞게 추위도 많이 누그러졌는데요, 설 연휴를 앞두고 내일부터는 다시 조금 추워질 것으로 예상됩니다. 내일 서울의 아침 기온 영하 6도에서 출발하겠고요, 모레 아침에는 영하 7도에서 시작하겠습니다. 다행히 낮에는 영상권으로 오르겠고요, 한파처럼 혹독한 추위는 아니겠습니다. 아침, 저녁으로만 특별히 추위에 대한 대비 하셔야겠습니다.<2>추위가 좀 풀리면서 연일 미세먼지가 말썽이었는데요, 내일은 다행히 대기 상태를 회복하겠고요, 전국의 미세먼지 농도도 '보통'단계가 예상됩니다.<해상>바다의 물결은 0.5에서 최고 3미터로 일겠습니다.<중부>내일 한낮기온 오늘보다 조금 내려가겠는데요, 춘천의 낮기온은 3도, 청주 4도, 대전도 4도가 예상됩니다.<남부>전주의 낮 최고기온 4도, 광주 6도, 부산은 7도까지 오르며 낮동안에 큰 추위는 없겠습니다.<동해안>계속해서 동해안과 영남지역엔 건조한 대기에 주의하셔야겠습니다.<주간>설 당일에는 수도권과 강원영서를 중심으로 눈이 내리겠고요, 연휴 마지막 날인 수요일에는 낮기온이 10도까지 오르면서 평년기온을 웃도는 봄 날씨가 예상됩니다. 날씨였습니다.(전소영 기상캐스터)▶ 네이버 뉴스스탠드에서 MBN 뉴스를 바로 만나보세요< Copyright ⓒ MBN(www.mbn.co.kr) 무단전재 및 재배포 금지 >"
56,2016-02-04,"북한 ""南 '이산가족 문제' 운운은 철면피의 극치"" 비난",https://news.naver.com/main/read.nhn?mode=LSD&mid=shm&sid1=100&oid=001&aid=0008170252,연합뉴스,"(서울=연합뉴스) 이상현 기자 = 북한은 4일 홍용표 통일부 장관이 최근 이산가족 문제 해결을 위해 지속적으로 노력하겠다는 의지를 밝힌 것과 관련해 ""철면피의 극치""라고 비난했다.북한 대외용 선전매체 '우리 민족끼리'는 이날 '절호의 기회마저 차버리고도 할 말이 있는가'라는 글에서 ""조미(북미)관계 문제인 핵문제에까지 코를 들이밀고는 광란적인 동족대결소동으로 북남관계를 파탄시킨 괴뢰패당이 그 무슨 '이산가족' 문제에 대해 운운하는 것이야말로 철면피의 극치가 아닐 수 없다""라고 주장했다.이 매체는 ""우리는 지난해 12월 북남당국회담에서 친척상봉 문제와 금강산관광재개 문제를 동시 추진, 동시 이행의 원칙에서 풀어나갈데 대한 제안을 내놓았다""면서 ""그러나 괴뢰패당은 우리의 제안을 거부하고 흩어진 가족, 친척 상봉 문제를 해결할 수 있는 절호의 기회마저 차던졌다""고 덧붙였다.이어 ""괴뢰패당이 흩어진 가족, 친척들의 아픔을 해결하는데 관심이라도 있는 듯이 요사스럽게 노는 것은 책임을 회피하기 위한 하나의 여론기만극에 불과하다""고 비판했다.앞서 홍 장관은 지난 3일 일천만이산가족위원회 임원진과의 간담회에서 ""핵실험 등으로 엄중한 남북관계 상황 속에서도 이산가족들의 마음을 위로하고 문제를 해결하기 위한 노력은 지속 추진해 나갈 것""이라고 말했다.hapyry@yna.co.kr▶ [현장영상] 임우재 직접 항소장 제출 ""가정과 아이 지키고 싶다""▶ [오늘의 핫 화보] 임우재 ""제 아버지가 친손자 9살때까지 못봤다"""
57,2016-02-04,"""너울성 파도로 동해안 18% 유실""…6개 시·군, 정부에..",https://news.naver.com/main/read.nhn?mode=LSD&mid=shm&sid1=102&oid=028&aid=0002306258,한겨레,"[한겨레]강릉·동해·속초·삼척·고성·양양해양수산부에 건의문“방파제·백사장·도로 붕괴지자체 예산으로는 대책 한계”지난 1월21일 강원 강릉시 강동면 정동진 해변의 모습. 너울성 파도 때문에 해변에 쌓여 있던 모래가 유실되면서 옹벽이 무너져 레일바이크 철길이 파손됐다.최근 너울성 파도로 피해가 잇따르자 강원 동해안 6개 시·군이 정부에 근본적인 대책 마련과 국비 지원을 요청하고 나섰다.강릉과 동해 등 강원도 동해안 6개 시·군이 꾸린 ‘동해안권 상생발전협의회’는 ‘너울성 파도 피해에 따른 건의문’을 채택해 해양수산부에 발송했다고 4일 밝혔다. 강릉, 동해, 속초, 삼척, 고성, 양양 등 동해안 6개 시·군은 해안침식과 산림피해 예방 등 10개 현안에 공동 대응하려고 지난해 12월 동해안권 상생발전협의회를 꾸렸다.지난해 11월26일 강원 양양군 현남면 광진리 해변 주택가 모습. 주민들이 살고 있는 집 앞 도로가 너울성 파도에 파손됐다. 강원도 동해안권 상생발전협의회 제공협의회는 건의문에서 “너울성 파도로 동해안 223㎞ 가운데 41㎞가 유실되는 심각한 상황에 이르렀다. 방파제와 해안도로가 붕괴되고 어선이 부서지는 등 인명과 재산 피해가 매년 눈덩이처럼 불어나고 있다. 백사장 유실로 완충지대를 잃은 바닷가 상인과 주민 등은 생존까지 위협받고 있다”고 주장했다.이들은 또 “동해안 백사장은 강원도민뿐 아니라 국민들이 가장 선호하는 대표 관광지다. 해안침식에 대한 항구적인 대책 마련은 열악한 지자체의 예산으로는 한계가 있다. 국토 관리 차원에서 중앙정부가 나서 연구와 대책을 마련하고, 해안침식 방지 사업에 대해 국비를 지원해야 한다”고 밝혔다. 지금은 사업비 200억원 미만이면 지자체에서 해안침식 방지 사업을 시행하도록 돼 있다.너울성 파도로 인한 강원 동해안 6개 시·군 피해 현황(2015년 11월~2016년 1월)최근 너울성 파도로 강릉 정동진역의 레일바이크 선로가 유실되고 속초해변의 모래와 나무데크가 유실되는 등 크고 작은 피해가 잇따르고 있다. 협의회는 너울성 파도로 지난해 11월부터 세 달 동안 51억7400만원의 피해를 입은 것으로 파악하고 있다.최명희 강원도 동해안권 상생발전협의회장은 “해안침식은 단순히 모래 유실의 문제가 아니라 연안 생태계를 파괴하고 쉼터 공간인 국토를 잠식함으로써 사회·경제적 피해를 주는 심각한 사안이다. 백사장 유실을 막는다는 것은 자연재해 예방 차원뿐 아니라 지역경제의 손실을 막는다는 입장에서도 매우 중요하다”고 말했다.한편, 강원도는 사업비 10억원을 들여 올해부터 2019년까지 동해안 연안 침식을 막기 위한 실태조사를 진행하고 있다.박수혁 기자 psh@hani.co.kr공식 SNS[페이스북][트위터]|[인기화보][인기만화][핫이슈]Copyrights ⓒ 한겨레신문사, 무단전재 및 재배포 금지<한겨레는 한국온라인신문협회(www.kona.or.kr)의 디지털뉴스이용규칙에 따른 저작권을 행사합니다.>"
58,2016-02-04,독감에 노로바이러스까지…설 연휴 감염병 주의해야,https://news.naver.com/main/read.nhn?mode=LSD&mid=shm&sid1=103&oid=437&aid=0000107859,JTBC,"[앵커]요즘 독감이 한창 유행하고 있지요. 설날 연휴인 다음주에 정점을 찍을 걸로 보입니다. 지카 바이러스, 그리고 식중독을 일으키는 노로 바이러스도 유행이라 이번 연휴, 감염병 예방에 특히 주의하셔야겠습니다.구혜진 기자입니다.[기자]4살 승찬이는 지난해 말 독감에 걸렸다가 퇴원했지만 다시 고열이 나 입원했습니다.합병증으로 폐렴에 걸린 겁니다.인플루엔자성 독감은 이처럼 영유아와 노인 등 고위험군에겐 치명적인 합병증을 유발할 수 있습니다.특히 이번 독감은 나은 듯 하다가도 재발하고 유난히 오래가는 특성이 있습니다.인플루엔자 환자 수는 지난달 둘째 주에 내원환자 1000명 당 12.1명으로 기준을 넘어 경보가 발령됐고 넷째 주엔 20.7명으로 급증했습니다.사람들의 이동과 접촉이 활발한 설 연휴기간엔 정점에 이를 전망입니다.[김창근 센터장/상계백병원 천식알러지센터 : 독감에 걸린 사람의 물건. 예를 들면 스마트폰 같은 건 여러 사람이 만지지 않도록 따로 관리하는 것이 좋겠습니다.]겨울철 식중독을 일으키는 노로 바이러스도 이번 겨울 평년보다 유행중입니다.미리 준비한 명절음식도 다시 한 번 익혀 먹고 손을 자주 씻는 등 기본적 위생관리가 중요하다고 방역당국은 당부합니다.구혜진▶ JTBC 뉴스 공식 SNS[트위터][페이스북][카카오스토리][유튜브]▶ JTBC 뉴스는 여러분의 생생한 제보를 기다립니다.Copyright by JTBC, DramaHouse & JcontentHub Co., Ltd. All Rights Reserved. 무단 전재 및 재배포 금지"
59,2016-02-04,'보육대란' 설 前 가까스로 봉합,https://news.naver.com/main/read.nhn?mode=LSD&mid=shm&sid1=102&oid=001&aid=0008169794,연합뉴스,"어린이집 보조교사 대량해고 우려…유치원도 불씨 남아(세종=연합뉴스) 황희경 기자 = 광주와 전남, 경기에 이어 서울시의회도 유치원 누리과정(만 3∼5세 무상보육) 4.8개월분 예산을 편성하기로 결정해 이들 지역의 유치원 '보육대란'은 마무리되는 분위기다.이에 따라 설 연휴를 앞두고 유치원 교사 임금지급 문제 등이 일시적으로나마 해결될 수 있는 발판을 마련했다.그러나 이들 지역에 편성된 유치원 누리과정 예산이 4∼5개월분에 그쳐 근본 대책이 마련되지 않으면 몇 개월 후 똑같은 상황이 되풀이될 것으로 보인다.◇ '급한 불' 끈 유치원…몇달 후 또 혼란 우려서울시의회 다수당인 더불어민주당이 4일 의원총회에서 의결한대로 유치원 누리과정 4.8개월분 추경 편성안이 확정될 경우 전국 17개 시도 모두에서 유치원 누리과정 예산이 적게는 3개월부터 많게는 전액 편성되게 된다.교육청이 편성한 유치원 예산을 지방의회에서 어린이집과의 형평성을 들어 전액 삭감했던 서울과 경기, 전남, 광주 4개 지역 중 광주는 지난달 27일 유치원 누리과정 예산 3개월분 176억원이 시의회에서 편성됐다.경기도 지난달 28일 4개월분 유치원 예산 1천464억원이 편성됐고, 전남도 전날 유치원과 어린이집 누리과정 각 5개월분 600억원을 반영한 추경예산안이 도의회에서 가결됐다.마지막까지 진통을 거듭하던 서울시의회도 결국 일부나마 예산을 편성하기로 했다.이들 4곳을 제외하고 나머지 13개 교육청은 유치원 예산은 12개월분 전액 편성했거나 추경을 통해 편성하겠다는 계획을 이미 밝혔다.그러나 말 그대로 '급한 불'만 껐을 뿐 근본적인 해법이 제시되지 않으면 일부 지역에서 똑같은 상황이 벌어질 불씨는 남아 있다.◇ 한 달 후엔 어린이집 보육대란 시작유치원은 한숨 돌렸지만 진짜 문제는 어린이집이다. 교육청들이 어린이집은 애초부터 보건복지부 소관의 '보육기관'이라는 점을 들어 재정 부담을 떠안기 어렵다는 점을 분명히 해왔기 때문이다.특히 서울과 전북, 광주, 강원, 경기는 어린이집 예산이 교육청 차원에서 전액 미편성됐다. 유치원 보육대란 때와 비슷한 상황이다.어린이집 문제는 교육감들이 한층 강경한 입장이라 문제 해결이 더 쉽지 않을 전망이다.다만 광주는 시에서 3개월치 180억원을, 강원은 1~2월 운영비(원아 1인당 7만원)를 도에서 각각 지원하기로 했다.어린이집 <<연합뉴스TV 캡처>>경기 역시 도에서 2개월분 어린이집 예산 910억원을 준예산으로 집행했다.서울의 경우 시의회 더민주당이 이날 의총에서 유치원과 마찬가지로 4.8개월분 편성을 교육청에 요청하기로 했지만 교육청이 이를 받아들일지는 미지수다.교육청을 거쳐 관내 유치원으로 바로 지원금이 입금되는 유치원과는 달리 어린이집은 먼저 학부모들이 '아이행복카드'로 보육료를 결제하는 방식이다.어린이집 지원금은 원아 1인당 교육비 22만원과 운영비 7만원 등 총 29만원이다. 교육비 22만원은 학부모들이 매달 15일께 아이행복카드로 결제하면 해당 카드사가 먼저 대납한 뒤 다음달 20일 이후 복지부 산하 사회보장정보원으로부터 받는 식으로 지원된다.사회보장정보원은 이 돈을 지방자치단체에서 받고, 다시 지자체는 해당 교육청에서 대금을 받는 구조다.원래대로라면 1월15일께 결제된 1월분 보육료가 이달 20일 이후 카드사로 지급돼야 한다. 그러나 예산 편성에 문제가 있을 때는 카드사가 2개월간의 보육료를 대납할 수 있도록 협약이 체결돼 있어 2월분 대금 지급시기가 돌아오는 3월20일께까지는 여유가 있는 상황이다.이 때문에 당장 학부모들이 보육료를 추가 부담하는 일은 없을 것으로 보인다.그러나 각 지자체가 교육청으로부터 돈을 받아 어린이집에 직접 지원하던 어린이집 운영비 7만원은 바로 지원이 중단된다.운영비에는 담임 보육교사 수당과 교재·교구비, 급식·간식비, 보조교사 인건비가 포함돼 있다.운영비 지원이 끊기면 교사들은 담임 수당을 받을 수 없게 되지만 더 큰 문제는 보조교사들의 인건비 지원도 중단된다는 점이다. 어린이집 보조교사는 지난해 기준 약 6천500명 수준이다. 이들은 일 4시간 기준, 월 78만원의 월급을 받는다.이미 지난달분 운영비가 지원되지 않으면서 영세한 어린이집에서는 보조교사 인건비를 감당하기 어렵다는 호소가 나오고 있다.실제로 일부 어린이집에서는 이미 원장이 보조교사에게 ""일을 그만둬야 할 수도 있다""는 예고를 한 것으로 알려졌다.강원은 이런 사태를 우려해 도에서 1∼2월분 운영비 27억원을 도비로 우선 집행했다.그러나 나머지 지역들은 운영비 지원이 계속 끊기면 영세한 어린이집의 운영 실태를 고려할 때 보조교사 대량 해고 사태가 우려된다.zitrone@yna.co.kr▶ [현장영상] 임우재 직접 항소장 제출 ""가정과 아이 지키고 싶다""▶ [오늘의 핫 화보] ""베일 속 푸틴 큰딸은 '호화생활' 의대생""…사진 첫 공개"
