,날짜,기사 제목,기사 링크,기사 출처,기사 내용
39,2016-02-17,"""전세 수요 어디갔지?""…방학특수 실종된 전세시장",https://news.naver.com/main/read.nhn?mode=LSD&mid=shm&sid1=101&oid=001&aid=0008190482,연합뉴스,"<<연합뉴스자료사진>>대치·잠원·잠실·목동 등 전세 쌓여 수천만원 가격 하락'이사 가면 손해' 보증금 인상분 월세 전환후 준전세로 재계약1월 전세거래 작년보다 감소…가격 상승률 3년 만에 최저(서울=연합뉴스) 서미숙 박인영 기자 = ""전세 시장이 예년과는 좀 다르네요. 방학 이사철인데 너무 조용합니다""서울 강남구 대치동의 한 중개업소 대표의 말이다.이달부터 수도권의 주택담보대출 여신심사 강화 조치 등이 시행되며 주택시장이 관망세에 접어든 가운데 전세시장도 '의외로' 잠잠하다.재건축 이주지역 등 국지적 전세난은 여전하지만 예년에 비해 전세 계약이 훨씬 수월한 곳이 많다는 게 중개업소의 전언이다.학군 인기지역으로 분류되는 강남 대치동, 양천구 목동, 노원구 중계동 일대는 '학군특수'가 거의 실종됐다.연초 매매 거래가 감소함에 따라 전세 거래가 늘고 가격도 강세를 보일 것이라는 당초 전문가들의 예상과는 다른 행보다.◇ 1월 전셋값 상승률 3년 만에 최저…""한달 째 전세 안나가""17일 부동산114 조사에 따르면 지난달 전국의 아파트 전셋값은 전월에 비해 0.18% 상승했다.이는 지난해 1월 0.55%, 2014년 1월 0.29%가 각각 오른 것에 비해 오름폭이 크게 둔화된 것이고 2013년 1월(0.17%) 이후 3년 만에 최저 상승률이다.특히 지난해 전셋값이 급등했던 서울은 지난달 0.44% 올라 작년 동월(1.06%)의 절반에 못미쳤고 2014년 상승률(0.67%)보다도 낮다.서울부동산정보광장 집계로 지난달 서울 아파트와 다세대·연립, 단독주택 전월세 거래량은 총 3만42건으로 작년 1월(3만2천605건)에 비해 7.86% 감소했다.지난달 대구(-0.17%), 광주광역시(-0.04%), 전남(-0.17%), 충남(-0.11%) 등 지방 일부지역은 통계상으로 전셋값이 하락하기도 했다.실제 현장에서는 설 연휴가 끝났는데도 전세를 찾는 사람이 예년보다 줄었다고 말한다.서울 강남 사교육 1번지인 대치동의 경우 지난해 말 반짝 전세 거래가 늘어나는가 싶더니 올해 들어 전세를 수요가 감소해 전세 물건이 나와도 제때 소진되지 않고 있다.전세가 없어 부르는 게 값이던 작년과는 사뭇 다른 양상이다. 이렇다보니 실계약은 시세보다 낮은 가격에 거래가 이뤄지고 있다.서울부동산정보광장에 따르면 대치동 은마아파트 전용면적 94.76㎡의 경우 지난달 초 4억3천만원 안팎이던 것이 이달에는 3억8천만∼4억1천만원에 전세 계약이 신고됐다.지난해 10∼12월에는 4억5천만∼4억7천만원에도 전세 거래가 이뤄졌던 것에 비하면 6천만∼8천만원 가량 빠진 것이다.또 대치 선경1차 전용 94.89㎡는 작년 11월 7억5천만∼8억원에 계약됐으나 이달에는 7억원으로 내려왔다.대치동 S공인 대표는 ""예년엔 대학수학능력 시험이 어렵게 나오면 학원·학군 수요들로 이 일대 전세가 동이 났는데 요즘은 그런 특수도 별로 없다""며 ""전세가 잘 안나가다 보니 가격을 낮춰 계약할 수밖에 없다""고 말했다.재건축 사업이 한창인 서초구 반포·잠원동 일대 아파트의 전셋값도 최근 약세로 돌아섰다.전세 물건이 나와도 한 달 이상 새로운 세입자를 찾지 못해 물건이 쌓이면서 계약 만기가 임박한 상황에서 계약이 이뤄지는 경우도 많다는 것이 현지 중개업소의 설명이다.잠원동 Y공인 대표는 ""지난달에도 전세 거래가 많이 줄었는데 이달 들어선 사실상 개점휴업 상태""라며 ""전세가격도 지난 가을에 비해 수천만원씩 빠지고 있다""고 말했다.실제 잠원 훼미리아파트 112㎡는 지난해 11월 7억원에서 현재 6억5천만원으로 5천만원 내렸고, 반포 자이 116㎡는 11억5천만∼12억원까지 거래됐으나 최근 10억7천만원짜리 급전세도 나왔다.또 지난해 말 잠원동 한신 18차 아파트 이주가 끝난 이후 올해 들어 한신 17차 162㎡는 지난해 11월 전셋값이 9억원까지 거래됐으나 현재 1억원 이상 낮은 7억5천만∼8억원에 전세 계약이 이뤄지고 있다.송파구 잠실동 잠실 엘스도 109㎡ 전세가 지난해 11월 최고 8억5천만원에 거래됐으나 현재 8억2천만원으로 3천만원 가량 떨어졌다.잠실 J공인 대표는 ""통상 1∼2월에 전세 거래가 많은 곳인데 올해는 수요가 예년같지 않다""며 ""위례신도시 입주 등으로 수요가 많이 분산된 것 같다""고 말했다.강서권의 대표적인 학군 인기지역이던 양천구 목동 신사가지 단지도 전세 물건이 제때 소화되지 않으면서 전셋값이 하락하고 있다.신시가지 7단지 89㎡의 경우 지난해 가을 전셋값이 4억7천만∼4억8천만원이었으나 현재 4억4천만∼4억5천만원으로 3천만원 떨어졌다.74㎡도 3억7천만원에서 3억5천만원으로 하락했다.목동 W공인 관계자는 ""1월 방학 특수도 없더니 설 연휴가 지났는데도 거래·문의 모두 올스톱된 상황""이라며 ""대부분 재계약을 하고 이사도 잘 가지 않아서 신규 거래가 더 없다""고 말했다.강북의 학원 인기지역인 노원구 중계동도 마찬가지다.중계동 E공인 대표는 ""지난해보다 확실히 전세 수요가 줄었다""며 ""계약 만기가 된 가구들이 재계약을 많이 하면서 시장에 나오는 전세 물건이 별로 없지만 수요자도 거의 없다""고 말했다.◇ 재계약 늘고 '대체주택' 증가, 학군수요도 시들…신혼부부·이주수요 관건이처럼 전세시장이 예상보다 조용한 것은 살던 집을 떠나지 않고 재계약을 하는 경우가 많은데다 이 경우 2년치 보증금 인상분을 월세로 전환하는 '준전세' 형태의 전세계약이 일반화된 영향이 크다.양천 목동 P공인 대표는 ""집주인들이 보증금을 올려주는 대신 월세를 요구하는데 과거엔 이에 대한 세입자들의 저항감이 컸지만 지금은 대세로 받아들이는 분위기""라며 ""다른데 이사 가봤자 보증금을 올려줘야 하고 이사비용, 중개수수료 등 부대비용 제외하면 오히려 손해라고 생각해 적당히 가격을 맞춰 재계약 하는 경우가 많다""고 말했다.수도권 신도시 입주 영향도 크다. 서울 강동·송파구 일대는 위례신도시 아파트 입주가 본격화되면서 과거 다락같이 오르던 전셋값이 안정세를 보이고 있다.강동구 상일동 S공인 대표는 ""위례신도시에 입주하는 사람들이 잔금 때문에 살던 집의 전세를 싸게 내놓고 가는 경우가 많다""며 ""화성 동탄2신도시나 수원 광교, 김포 한강신도시 등의 입주로 싼 전세가 늘면서 전세 수요 분산가 많이 분산됐다""고 말했다.특히 다세대·연립·다가구 주택 등 기존 아파트를 대신할 '대체주택'이 늘어난 것도 원인이다.국토교통부에 따르면 지난해 연립·다세대·다가구·단독주택 등 아파트 이외 주택 인허가 물량은 총 23만397가구로 2014년 대비 37.5%, 최근 3년 평균에 비해 28% 증가했다.지난해 착공과 준공 물량도 각각 21만9천271가구, 17만5천373가구로 각각 전년 대비 34%, 14.1% 늘었다.입시제도 변화로 '학군수요'도 크게 감소하면서 방학 기간마다 나타났던 학군 특수가 시들해졌고, 과거 짝수해마다 전셋값이 오르던 패턴이 2008년 글로벌 경제위기 이후 '홀수해'로 바뀐 것도 연초 전세 수요 감소의 원인중 하나로 꼽힌다.최근 이달 주택담보대출 여신심사 강화로 매매 가격이 약보합세로 돌아선 것과  유가 폭락, 중국·일본·유럽 등 글로벌 증시·환율 불안 등 대내외 악재가 잇따르면서 부동산 시장 전반에 걸쳐 관망 심리가 퍼져 있는 영향도 있다.전문가들은 그러나 올 한해 전세시장의 불안 요인은 여전히 남아 있다고 말한다.3월 이후 신혼부부 수요가 움직이면서 가격을 끌어올릴 가능성이 있고 강남 개포 주공 4단지 등 재건축 단지 이주도 변수다.부동산114 조사 결과 현재 이주가 임박한 재개발·재건축 단지는 서울 2만2천173가구 등 수도권에서 총 3만8천500여가구에 달한다.국민은행 박원갑 수석부동산전문위원은 ""새 아파트 선호현상까지 강해지면서 기존 낡은 아파트는 수요가 줄어 전셋값이 약세를 보이는 영향도 있다""며 ""3∼4월 금리 인하로 주택시장이 회복되면 움츠러든 전세 움직임도 활발해질 수 있다""고 말했다.sms@yna.co.kr▶ [현장영상] '트랜스젠더까지' 태국인 성매매 알선 브로커 구속▶ [오늘의 핫 화보] ""北도발 굴복해 퍼주기식 지원 안돼""…박 대통령 국회 연설"
40,2016-02-17,"北 모란봉악단, '미사일 찬양' 전위대로 복귀",https://news.naver.com/main/read.nhn?mode=LSD&mid=shm&sid1=100&oid=056&aid=0010286150,KBS,"<앵커 멘트>지난해 말 베이징 공연을 돌연 취소하고 귀국길에 올랐던 북한 모란봉 악단이 미사일 발사 축하공연으로 무대에 복귀했습니다.김정은 부부가  직접 지켜보는 가운데, 새로운 찬양곡도 대거 선보였는데요.체제 전위대로서 선전전을 이끌 거란 전망입니다.허효진 기자입니다.<리포트>장거리 미사일 발사 장면을 배경으로 모란봉 악단의 현란한 공연이 시작됩니다.무대 한편에는 광명성호의 대형모형이 세워져있고, 대형스크린에는 연신 김정은의 최종 명령서 모습과  현지 지도 영상이 펼쳐집니다.<녹취> '보란듯이' : ""이 세상에 둘도 없는 사회주의 내 나라~""미사일 발사를 자축하며  김정은이 개최한 공연.베이징 공연 철수 이후 두 달 만에 모습을 드러낸 모란봉 악단은  3곡의 신곡을 포함해  1시간 내내 찬양가를 쏟아냈습니다.<녹취>  '김정은 장군께 영광을' : ""영광을 드립니다, 우리 장군께. 영광을 드립니다, 김정은 장군께.""김정은도 만족스러운 듯 부인 리설주와 함께 노래를 따라부르는 모습도  포착됐습니다.모란봉악단이 체제 전위대로서 선전전의 전면에 나설 것임을  예고했다는 평갑니다.김정일의 생일, 광명성절을 맞아 개최된 꽃전시회 등  평양 시내 곳곳에도  미사일 모형이 등장했습니다.북한은 오늘(16일)밤 또 다시  대규모 불꽃놀이를 여는 등  김정은에 대한 충성 다짐과 체제 결속 분위기를 최고조로 끌어올리고 있습니다.KBS 뉴스 허효진입니다.허효진기자 (her@kbs.co.kr)▶[취재후] 방송에서 못한 현장 이야기▶ KBS뉴스 SNS[트위터][페이스북][카카오][저작권자ⓒ KBS 무단복제-재배포 금지]"
41,2016-02-17,불 꺼진 개성공단 첫 포착 '암흑천지',https://news.naver.com/main/read.nhn?mode=LSD&mid=shm&sid1=100&oid=056&aid=0010286144,KBS,"<앵커 멘트>개성공단 폐쇄 이후 처음으로  어둠에 휩싸인 개성공단의 밤 모습이 KBS 카메라에  포착됐습니다.전기 공급이 끊겨  불꺼진 개성공단은  그야말로 암흑천지입니다.고은희 기자가 보도합니다.<리포트>북녘 하늘에  땅거미가 내려앉자...도라산 북쪽의  개성공단 일대가  어둠에 휩싸이기 시작합니다.잠시 뒤, 개성공단으로 가는 관문인  통일대교와, 도라산 출입사무소의 가로등 불빛만 남은 채, 개성공단이 온통 암흑천지로 바뀝니다.정상 가동 당시 환하게 불을 밝힌 채  활기가 돌았던  공단의 모습과 비교하면 지금은 아무런 인기척도 없이 컴컴한 어둠만이 짙게 드리워져 있습니다.닷새 전  개성공단이 폐쇄된 직후 우리 측에서 보내온 전기가 모두 끊겼기 때문입니다.남북을 연결하는 다리도 발길이 뚝 끊긴 채  가로등 불빛만 깜빡이고, 임진각 놀이동산의 조명만 어둠을 밝힙니다.낮에도  사람의 자취는 찾을 수 없고,  빈 건물만 덩그러니 남은 상황...밤이 되면  건물의 흔적조차 사라져 버립니다.<인터뷰> 유창근(개성공단 기업협회 부회장) : ""대부분 기업들이 주야 교대 근무를 해서 항상 밤에 불야성을 이루고 있었어요. 정말 자부심을 느끼고 있었던 그런 곳이 이제 암흑으로 갔네요.""북한의 거듭된 도발로  13년 만에 끝내 문을 닫은 개성공단은  강대강의 남북 대치 국면을 상징하듯 어둠 속에 적막감만 감돌고 있습니다.KBS 뉴스 고은희입니다.고은희기자 (ginger@kbs.co.kr)▶[취재후] 방송에서 못한 현장 이야기▶ KBS뉴스 SNS[트위터][페이스북][카카오][저작권자ⓒ KBS 무단복제-재배포 금지]"
42,2016-02-17,"경제난 베네수엘라 지카대응 '총체적 난국'""약도 의사도 없어""",https://news.naver.com/main/read.nhn?mode=LSD&mid=shm&sid1=104&oid=001&aid=0008188982,연합뉴스,"베네수엘라 카라카스의 방역 장면(AP=연합뉴스 자료사진)전문가들 ""감염자 50만명 넘어""…불통행정·의료붕괴·경제파탄 '삼중고'(서울=연합뉴스) 김지헌 기자 = 소통 없는 정부, 낙후한 의료 시스템, 경제 위기의 '삼중고'에 시달리는 베네수엘라가 지카 바이러스 대응에 철저히 실패하고 있다.환자 집계가 엉망인 데다가 환자가 와도 제대로 치료할 시설과 인력이 없으며 국가 재정은 파탄 직전이라 제대로 된 대처가 거의 이뤄지지 않고 있는 것이다.전문가들은 이대로 가면 베네수엘라가 최악의 상황을 맞을 것이라고 한목소리로 15일(현지시간) 경고했다.◇ 소통 없는 정부…지카 감염자 숫자 '5천 명 vs 50만 명'베네수엘라 정부의 지카 바이러스 공식 통계에 따르면 감염자는 5천 명 선이다.그러나 독자적으로 활동하는 전문가들은 베네수엘라의 감염자가 50만 명을 넘는 것으로 본다고 미국 워싱턴포스트(WP)는 지적했다.호세 펠릭스 올레타 전 보건장관은 ""지카 바이러스는 여전히 상승 국면""이라며 ""베네수엘라는 '아무것도 하지 않기'를 완벽하게 보여주고 있다. 제대로 소통하지 않으면 전염병이 아닌 공포와 두려움이 자라난다""고 강조했다.올레타 전 장관이 소속돼 활동하는 민간 의료 단체는 지카 감염자를 41만2천 명으로 추산했다.지카 바이러스가 유발하는 것으로 알려진 마비 질환 길랭 바레 증후군도 크게 늘고 있지만 정부와 전문가들은 엇박자를 내고 있다.베네수엘라의 한 의사는 ""매일 새로운 길랭 바레 증후군 환자가 들어온다""고 전했다. 그는 처벌 우려 때문에 익명으로 WP와 인터뷰했다.베네수엘라 카라카스의 한 병원에서 길랭 바레 증후군 환자와 보호자가 포옹하고 있다(AP=연합뉴스 자료사진)라파엘 오리우엘라 전 보건장관은 ""길랭 바레 증후군 환자는 3천 명에 이를 수 있는데 베네수엘라는 집중치료 병상이 300개 밖에 없다""고 우려했다.베네수엘라 정부의 길랭 바레 증후군 환자 집계는 255명에 멈춰 있다.◇ 붕괴한 의료 시스템…약품도 의사도 없다WP는 베네수엘라 수도 카라카스의 바르가스 병원의 특징은 쓰레기가 들어찬 병동, 건물 주변을 배회하는 유기견, 봉합용 실과 거즈 없이 수술하는 의사들이라고 짚었다.길랭 바레 증후군 환자 리세스 살라스는 처음에 다른 병원으로 갔다가 신경과 전문의가 없다는 말에 마비된 몸을 끌고 이 병원으로 와야 했다.그러나 바르가스 병원에도 길랭 바레 증후군 치료를 위한 면역 글로불린 항체는 없었다.이 병원 내과의사 사브리나 말데라는 ""1년 내내 면역 글로불린 항체가 전혀 없었다""며 ""손발이 묶인 채 환자를 돌본다""고 털어놨다.소두증과 길랭 바레 증후군을 유발한다고는 해도 지카 바이러스는 대체로 발진, 고열, 관절통 등 가벼운 증상만 보이고 사라지는 경우가 많다.하지만 베네수엘라 병원이나 약국에선 진통제와 모기약은 물론 소두증을 우려하는 사람들을 위한 피임약이나 콘돔도 찾기 쉽지 않다.베네수엘라 제약협회의 프레디 세바요스 회장은 ""약국의 약품 보유량은 평소의 20% 수준""이라고 전했다.이제는 의사들도 베네수엘라를 등지고 있다. WP는 더 나은 대우를 찾아 외국으로 나간 의사들이 수천 명에 달한다고 전했다.한 의사는 월급으로 3만2천 볼리바르화를 받았는데 이는 암시장 환율로 30달러(약 3만6천 원)라고 했다.베네수엘라 방역 장면(AFP=연합뉴스 자료사진)이 의사는 ""어떤 형태의 응급상황에도 대처할 수 없다. 평범한 의료 처치도 못 한다""며 ""진정한 제3세계의 모습""이라고 말했다.◇ 끝없는 경제 위기가 노출한 베네수엘라 사회 민낯베네수엘라 수출 소득의 96%를 차지하는 석유 가격이 곤두박질치면서 경제 위기는 가중되고 지카 바이러스 대응은 더욱 늦어지고 있다.석유 부국 베네수엘라는 지난해 경제 성장률 마이너스 10%를 기록했다.올해 경제 성장률은 마이너스 8%, 물가 상승률은 700%에 달할 것으로 예상된다.베네수엘라는 1990년대부터 킴비오텍이라는 회사를 설립해 면역 글로불린 항체를 자체 생산할 정도로 의료 수준이 낮지 않았다.하지만 경제 위기 악화로 지난해 킴비오텍이 생산을 중단하면서 면역 글로불린 항체를 수입해야 하는 상황이 됐다.공식 환율인 달러당 6.3볼리바르와 별개로 암시장에서 달러당 1천 볼리바르 이상에 거래되는 베네수엘라 화폐로는 필요한 만큼의 수입이 불가능하다.경제 위기에 더해진 지카 바이러스 사태는 잘못된 정보, 물자 부족, 정부 관리 실패 등 베네수엘라 사회 전반에 걸쳐 나타나는 현상을 압축적으로 보여준다고 WP는 지적했다.베네수엘라를 연구해온 미국 루이지애나 주 툴레인대학 사회학과의 데이비드 스밀드 교수는 ""지카 사태는 나라 전체의 축소판""이라며 ""투명성을 경시하는 정부와 의료 체계 붕괴가 뒤섞여 최악의 시나리오를 만들고 있다""고 말했다.jk@yna.co.kr▶ [짧뉴스] '640억 빚더미' 카니예웨스트 ""저커버그 도와줘!""▶ [오늘의 핫 화보] 노래하는 별들의 축제…미국 '그래미 어워드' 레드카펫"
43,2016-02-17,안전핀 뽑자 '펑'아군 잡는 '불량 수류탄',https://news.naver.com/main/read.nhn?mode=LSD&mid=shm&sid1=100&oid=055&aid=0000378565,SBS,"<앵커>수류탄은 안전핀을 뽑으면 안전 손잡이가 떨어지며 뇌관이 지연제를 점화하고 지연제가 4~5초간 타다가 기폭약과 작약으로 불을 옮기면서 이렇게 터지는겁니다. 그런데 지난해 군 훈련소에서 안전핀을 뽑자마자 수류탄이 터져버리는 사고가 있었죠. 군이 조사에 나섰는데 이 비슷한 이상 폭발이 4건이나 확인됐습니다.김태훈 기자가 취재했습니다.<기자>지난해 9월 대구 육군 신병훈련소에서 훈련병이 수류탄 안전핀을 뽑자마자 수류탄이 폭발했습니다.부사관 1명이 숨지고 훈련병과 또 다른 부사관이 다쳤습니다.군은 사고 수류탄과 같은 종류의 수류탄 320만 발 전량을 사용 중지하고, 같은 기간 같은 라인에서 생산된 5만 5천 발을 수거해 3만 5천 발을 조사했습니다.[문상균/국방부 대변인 : 경량화 수류탄의 이상 폭발 원인을 과학적, 객관적으로 규명해서 장병들의 안전에 위험 요소가 없는 가운데 훈련에 임할 수 있도록 하겠습니다.]이 가운데 4발이 안전 손잡이가 분리되기도 전에 폭발했습니다.2발은 안전핀을 제거하자마자, 또 2발은 안전핀을 뽑는 중에 터졌습니다.안전 손잡이가 그대로 있는데 지연제를 뛰어넘어 기폭약에 불이 붙은 겁니다.군 관계자는 이 4발의 비정상적인 폭발은 안전손잡이와 뇌관, 지연제의 불량일 수도 있고 시험 장비와 환경 요인 때문일 수도 있다고 말했습니다.군은 정확한 원인 규명을 위해 4월 말까지 조사를 계속하기로 했습니다.(영상취재 : 김균종, 영상편집 : 우기정, CG : 박정준)김태훈 기자(oneway@sbs.co.kr)☞ '4.13 총선 당신의 선택을 응원합니다' 특집 바로가기※ ⓒ SBS & SBS콘텐츠허브 : 무단복제 및 재배포 금지"
44,2016-02-17,안전핀 뽑자 '펑'아군 잡는 '불량 수류탄',https://news.naver.com/main/read.nhn?mode=LSD&mid=shm&sid1=100&oid=055&aid=0000378565,SBS,"<앵커>수류탄은 안전핀을 뽑으면 안전 손잡이가 떨어지며 뇌관이 지연제를 점화하고 지연제가 4~5초간 타다가 기폭약과 작약으로 불을 옮기면서 이렇게 터지는겁니다. 그런데 지난해 군 훈련소에서 안전핀을 뽑자마자 수류탄이 터져버리는 사고가 있었죠. 군이 조사에 나섰는데 이 비슷한 이상 폭발이 4건이나 확인됐습니다.김태훈 기자가 취재했습니다.<기자>지난해 9월 대구 육군 신병훈련소에서 훈련병이 수류탄 안전핀을 뽑자마자 수류탄이 폭발했습니다.부사관 1명이 숨지고 훈련병과 또 다른 부사관이 다쳤습니다.군은 사고 수류탄과 같은 종류의 수류탄 320만 발 전량을 사용 중지하고, 같은 기간 같은 라인에서 생산된 5만 5천 발을 수거해 3만 5천 발을 조사했습니다.[문상균/국방부 대변인 : 경량화 수류탄의 이상 폭발 원인을 과학적, 객관적으로 규명해서 장병들의 안전에 위험 요소가 없는 가운데 훈련에 임할 수 있도록 하겠습니다.]이 가운데 4발이 안전 손잡이가 분리되기도 전에 폭발했습니다.2발은 안전핀을 제거하자마자, 또 2발은 안전핀을 뽑는 중에 터졌습니다.안전 손잡이가 그대로 있는데 지연제를 뛰어넘어 기폭약에 불이 붙은 겁니다.군 관계자는 이 4발의 비정상적인 폭발은 안전손잡이와 뇌관, 지연제의 불량일 수도 있고 시험 장비와 환경 요인 때문일 수도 있다고 말했습니다.군은 정확한 원인 규명을 위해 4월 말까지 조사를 계속하기로 했습니다.(영상취재 : 김균종, 영상편집 : 우기정, CG : 박정준)김태훈 기자(oneway@sbs.co.kr)☞ '4.13 총선 당신의 선택을 응원합니다' 특집 바로가기※ ⓒ SBS & SBS콘텐츠허브 : 무단복제 및 재배포 금지"
45,2016-02-17,中 세계최대 전파망원경 건립 위해9천명 이주키로,https://news.naver.com/main/read.nhn?mode=LSD&mid=shm&sid1=104&oid=001&aid=0008190212,연합뉴스,"세계 최대 전파망원경 프로젝트(중국 환구망 캡쳐)(베이징=연합뉴스) 홍제성 특파원 = 중국이 오는 9월께 완공되는 세계 최대의 전파망원경 프로젝트 추진 과정에서 주민 9천여명을 이주시키기로 했다고 관영 신화통신이 16일 보도했다.구이저우(貴州)성 정부는 '구경 500ｍ 구형 전파망원경'(FAST)이 들어설 첸난(黔南)주 핑탕(平塘)현 산림지대 반경 5㎞ 내에 거주하는 주민 9천110명을 다른 지역으로 이주시킬 계획이라고 밝혔다.주민들에게는 1인당 1만2천 위안(약 224만원)의 보상금이 지급되며 주택확보에 어려움을 겪는 소수민족 가정에는 1만위안 상당의 보상금이 추가로 지급된다.중국은 지난 2011년 3월 '톈옌'(天眼)으로 불리는 세계 최대 전파망원경 프로젝트에 착수했다. 총 12억 위안(약 2천240억원)이 투입된 이 프로젝트는 오는 9월 완공될 예정이다.우주에서 지구와 비슷한 환경의 행성과 외계 생명체의 흔적을 찾고자 건립되는 이 전파망원경은 푸에르토리코에 있는 지름 300ｍ 규모의 미국 아레시보 천문대의 망원경보다 두 배가량 크며 수신 감도도 2.25배 높다.지름 500ｍ 규모의 이 망원경은 축구장 30개를 합한 25만㎡의 면적을 총 46만개의 반사 디스크로 덮어야 한다.jsa@yna.co.kr▶ [현장영상] '트랜스젠더까지' 태국인 성매매 알선 브로커 구속▶ [오늘의 핫 화보] ""北도발 굴복해 퍼주기식 지원 안돼""…박 대통령 국회 연설"
