,날짜,기사 제목,기사 링크,기사 출처,기사 내용
0,2016-02-04,5년째 내전으로 '폐허'드론이 찍은 '쑥대밭 시리아',https://news.naver.com/main/read.nhn?mode=LSD&mid=shm&sid1=104&oid=437&aid=0000107866,JTBC,"[앵커]2011년 '아랍의 봄' 당시 시리아 홈스는 아사드 부자의 41년 독재에 항거하면서, 혁명의 수도로 불렸었지요. 이후 5년째 이어진 내전과 공습으로, 기괴하게 변한 지금의 모습이 공개됐습니다.박상욱 기자입니다.[기자]짙은 먹구름 아래 가도 가도 끝이 없는 폐허들.방송국과 이슬람 사원은 형체만 남았습니다.간혹 보이는 사람과 차량이 이곳이 고대 유적지가 아닌 현실임을 보여줍니다.시리아의 3대 도시 홈스.러시아 방송 RT와 드론 촬영업체 '러시아웍스'가 공개한 홈스는 참혹함 그 자체입니다.2011년 3월, 알 아사드 정권의 독재에 맞선 뒤 시작된 내전은 올해로 5년째.2년 넘게 이어진 정부군의 포위와 보급 차단으로 반군은 뿔뿔이 흩어졌고 주민들의 삶은 피폐해졌습니다.내전을 틈타 IS까지 세력을 뻗치면서 IS의 폭탄테러는 아직도 홈스의 일상입니다.내전종식을 위해 유엔과 시리아 정부, 반정부군이 지난 1일 평화협상에 나섰지만 러시아가 반군을 겨냥한 홈스 공습을 이어가면서 파행됐습니다.[스테판 데 미스투라/유엔 시리아 담당 특사 : 시리아 평화협상을 일시적으로 중단하기로 결정했습니다. 일시적으로요.]협상은 오는 25일 재개되지만, 폐허가 된 홈스에서 집집마다 밥짓는 냄새가 언제 다시 피어오를지는 미지수입니다.박상욱▶ JTBC 뉴스 공식 SNS[트위터][페이스북][카카오스토리][유튜브]▶ JTBC 뉴스는 여러분의 생생한 제보를 기다립니다.Copyright by JTBC, DramaHouse & JcontentHub Co., Ltd. All Rights Reserved. 무단 전재 및 재배포 금지"
1,2016-02-04,5년째 내전으로 '폐허'…드론이 찍은 '쑥대밭 시리아',https://news.naver.com/main/read.nhn?mode=LSD&mid=shm&sid1=104&oid=437&aid=0000107866,JTBC,"[앵커]2011년 '아랍의 봄' 당시 시리아 홈스는 아사드 부자의 41년 독재에 항거하면서, 혁명의 수도로 불렸었지요. 이후 5년째 이어진 내전과 공습으로, 기괴하게 변한 지금의 모습이 공개됐습니다.박상욱 기자입니다.[기자]짙은 먹구름 아래 가도 가도 끝이 없는 폐허들.방송국과 이슬람 사원은 형체만 남았습니다.간혹 보이는 사람과 차량이 이곳이 고대 유적지가 아닌 현실임을 보여줍니다.시리아의 3대 도시 홈스.러시아 방송 RT와 드론 촬영업체 '러시아웍스'가 공개한 홈스는 참혹함 그 자체입니다.2011년 3월, 알 아사드 정권의 독재에 맞선 뒤 시작된 내전은 올해로 5년째.2년 넘게 이어진 정부군의 포위와 보급 차단으로 반군은 뿔뿔이 흩어졌고 주민들의 삶은 피폐해졌습니다.내전을 틈타 IS까지 세력을 뻗치면서 IS의 폭탄테러는 아직도 홈스의 일상입니다.내전종식을 위해 유엔과 시리아 정부, 반정부군이 지난 1일 평화협상에 나섰지만 러시아가 반군을 겨냥한 홈스 공습을 이어가면서 파행됐습니다.[스테판 데 미스투라/유엔 시리아 담당 특사 : 시리아 평화협상을 일시적으로 중단하기로 결정했습니다. 일시적으로요.]협상은 오는 25일 재개되지만, 폐허가 된 홈스에서 집집마다 밥짓는 냄새가 언제 다시 피어오를지는 미지수입니다.박상욱▶ JTBC 뉴스 공식 SNS[트위터][페이스북][카카오스토리][유튜브]▶ JTBC 뉴스는 여러분의 생생한 제보를 기다립니다.Copyright by JTBC, DramaHouse & JcontentHub Co., Ltd. All Rights Reserved. 무단 전재 및 재배포 금지"
2,2016-02-04,포대 안 제각각인 고추 색깔…설 노린 신종 밀수,https://news.naver.com/main/read.nhn?mode=LSD&mid=shm&sid1=102&oid=055&aid=0000374888,SBS,"<앵커>설 연휴를 앞두고 앞서 집조심, 차 조심 뉴스가 있었는데 이번에는 먹거리입니다. 설 특수를 노린 먹거리 밀수가 기승을 부리고 있고 세관 단속을 피하기 위한 꼼수도 상상을 초월합니다.이호건 기자가 그 현장을 보여드리겠습니다.<기자>세관 직원들이 컨테이너 문을 따고 열자 포대가 가득 쌓여 있습니다.포대 안에 들어 있는 내용물은 다름 아닌 중국산 고추.그런데 자세히 보니 고추 색깔이 두 가지입니다.중국산 건고추를 밀수하면서 마치 값싼 냉동고추를 수입하는 것처럼 속이기 위해 건고추와 냉동고추를 3 대 7 비율로 섞은 겁니다.중국산 건고추는 관세가 270%나 붙는 반면, 냉동고추는 27%라서 냉동고추로 속일 경우 이익을 더 많이 남길 수 있습니다.[송종호/인천본부세관 관세행정관 : 관세 부과함으로써 국내시장에서 국산품과 중국산 조건을 대등하게 유지하기 위한 목적입니다. 그거를 피해 들어오면 그만큼 중국산이 더 판치게 되고, 국내 고추 농가들이 피해를 입게 되는 거죠.]밀수업자들의 수법은 갈수록 다양해지고 있습니다.컨테이너 안쪽에 건고추를 숨기고 입구 쪽에 냉동고추를 적재해 가리는 이른바 '커튼 치기' 수법을 쓰기도 하고, 컨테이너 바닥 쪽에 건고추를 숨기는 '알박기' 수법도 사용합니다.이런 수법들이 세관의 엑스레이 검색과정에 적발되자 두 고추를 섞는 꼼수까지 등장한 겁니다.관세청은 설 명절을 앞두고 먹거리 밀수를 특별단속해 지난 두 달간 중국산 건고추 87톤, 7억 6천만 원어치를 적발했습니다.(영상취재 : 김현상, 영상편집 : 최진화)이호건 기자(hogeni@sbs.co.kr)☞ SBS 뉴스 바로가기※ ⓒ SBS & SBS콘텐츠허브 : 무단복제 및 재배포 금지"
3,2016-02-04,"美 '요인 암살부대' 왔다, 한반도 대규모 해상훈련",https://news.naver.com/main/read.nhn?mode=LSD&mid=shm&sid1=100&oid=214&aid=0000587392,MBC,"[뉴스데스크]◀ 앵커 ▶유사시 적 요인 암살 임무를 수행하는 미국 최정예 특수부대가 우리나라에서 한반도 지형 숙달 훈련에 돌입했습니다.강력한 대북 경고 메시지라는 분석인데, 우리 군도 대규모 해상훈련을 벌였습니다.김재홍 기자가 보도합니다.◀ 리포트 ▶이라크와 아프가니스탄 전투에서 적의 핵심 요인을 암살하는 이른바 '참수작전'을 수행했던 미군 제75레인저 연대입니다.미군 특수부대 중에서도 상위 2% 내 최정예로, 최근 미국 1공수 특전단과 함께 우리나라에 배치돼 연합훈련에 돌입했습니다.유사시 레인저의 임무는 북한의 핵과 미사일 시설 파괴, 그리고 지휘부 제거입니다.국제사회의 우려에도 도발 수위를 높여온 북한 지도부에 대한 강력한 경고 의미가 담긴 배치입니다.서북도서 인근에서는 북한 특수부대원의 침투를 가상한 K-9 자주포 훈련이 펼쳐졌습니다.북한의 공기부양정과 고속상륙정을 향해 발칸포 등 직사화기가 불을 뿜고, 고속단정을 탄 해병대원들은 해안가로 접근해 온 적 병력을 섬멸합니다.북한군이 최근 서해 NLL 인근 무인도 갈도에 122mm 방사포를 배치했지만 우리 포병 화력에 고스란히 노출됐습니다.[김태성/해병대 6여단장]""적이 도발한다면 도발의 결과가 얼마나 혹독하고 처절한지 느끼도록 하겠습니다.""동해와 서해 NLL 인근에선 해군 1, 2함대가 광개토대왕함 등 함정 20여 척과 잠수함, P-3 해상초계기 등을 투입해 북한의 잠수함 격멸 훈련도 실시했습니다.MBC뉴스 김재홍입니다.(김재홍)[저작권자(c) MBC (www.imnews.com) 무단복제-재배포 금지]"
4,2016-02-04,돈 주고 꽃 안 산다? 졸업 특수도 '무색',https://news.naver.com/main/read.nhn?mode=LSD&mid=shm&sid1=101&oid=214&aid=0000587409,MBC,"[뉴스데스크]◀ 앵커 ▶오늘 입춘이었죠.저희 스튜디오도 꽃으로 장식해 봤는데요.봄기운이 좀 느껴지십니까.◀ 앵커 ▶추위가 싹 가시는 듯 화사해 보이죠.이런 게 바로 꽃이 가진 힘 아닐까요?◀ 앵커 ▶그런데 여러분, 최근에 꽃 사 본 적 있으십니까?요즘 한창 초중고 졸업시즌인데 졸업 특수, 연중 최대 대목이라는 말이 무색하다고 합니다.먼저 나세웅 기자입니다.◀ 리포트 ▶함박웃음을 짓는 졸업생들과 그 모습을 카메라에 담는 풍경은 예년 졸업식 그대로입니다.사라진 건 교문 앞 북새통을 이뤘던 꽃다발 상인들입니다.[백정옥/학부모]""아침에 학교에 왔더니 꽃집이, 꽃 파는 아저씨들이 하나도 없는 거예요.""중고등학교 졸업식에선 아예 꽃 대신 다른 선물을 주고받은 가족들이 많습니다.[이민혁/졸업생]""꽃이 좀 비싸기도 하고 이게(사탕 꽃다발) 싼데 괜찮고...""그나마 대목이라고 졸업시즌 기다려 온 상인들은 울상입니다.[김선희]""졸업식 하면 상징이 꽃이잖아요. 지금은 좀 많이 준 것 같아요.""[조민술]""요즘은 대목이 없어요. 꽃이 대목이 안 돼요, 요즘에는.""◀ 앵커 ▶그러고 보니 요즘 경조사 아니면 꽃구경 어려워진 것 같은데요.기념일, 생일에도 꽃 대신 다른 선물 하는 분들이 많습니다.◀ 앵커 ▶실제로 꽃 사는 데 쓰는 돈, 10여 년 전에 비해 30% 넘게 줄었습니다.국민 한 명이 1년에 1만 3천 원 정도, 그러니까 꽃 한 다발도 안 산다는 겁니다.그럼 꽃 사는 사람들 왜 이렇게 줄었을까요?'돈 주고 사기 아깝다'는 답이 3명 중 1명꼴이었습니다.비싸다는 거죠.정말 그럴까요?꽃 가격이 어떻게 정해지는지, 유통과정을 따라가 봤습니다.조윤미 기자입니다.◀ 리포트 ▶한 해 장미 200만 송이를 재배하는 경기도의 농가입니다.키우는 데 여섯 달이 걸리는데 겨울엔 온도와 일조량을 맞추다 보니 생산원가가 여름의 3배로 뜁니다.[고광민/장미농가 운영]""난방도 해야 되고 겨울철에는 빛이 부족해서 보광등도 설치하고 금액이 한 40~45만 원, 평당.""저녁 8시, 전국 주요 재배지에서 생산된 꽃들이 화훼공판장으로 모여듭니다.""양주에서 왔어요.""""대구에서 왔어요.""중간도매 상인들이 꽃들을 꼼꼼히 살펴보며 상품을 고릅니다.[이상덕/꽃 판매상]""밑이 일정해요. 이 정도면 최상품이라고 할 수 있죠.""◀ 앵커 ▶이렇게 전국 각지에서 생산된 장미는 산지 인근 시장으로 절반, 서울로 절반 정도가 이동합니다.좀 전에 보신 화훼 공판장이 전국 최대 공영 도매시장인데, 여기서 경매로 도매가격이 결정됩니다.가격 어떻게 매겨지는지 이어서 보시죠.◀ 리포트 ▶경매가 시작된 시각은 밤 12시.이날 하루 9억 원어치 꽃이 팔려나갔습니다.10송이 장미 한 단에 8천500원의 값이 매겨졌습니다.소매상인 꽃집은 도매상에게서 한 단 1만 3천 원에 사 왔습니다.상품성 떨어지는 걸 빼고 나면 남는 건 6-7송이.손님에게 파는 가격은 1송이 4천 원입니다.다른 꽃을 섞어 포장한 꽃다발은 인건비와 마진이 붙어 값이 더 뜁니다.[신희숙/꽃집 운영]""디자인비, 그다음에 원가, 관리비, 이런 게 다 포함이 되면 정말 2만 원짜리 (꽃다발) 만들기가 너무 힘든 거예요.""◀ 앵커 ▶유통단계마다 파는 장미 크기와 품종이 달라서 일률적으로 말하긴 어렵지만 얼핏 봐도 중도매상에서 소비자까지 5배 가까이 값이 뛰었는데요.꽃은 단시간에 상품 가치가 떨어지고 상하기도 쉽죠.또 포장해서 파는 경우가 많다 보니까 인건비 등이 더해져서 소비자 입장에선 비싸다고 느낄 수 있는 겁니다.그나마 공영시장이 아니라면 유통단계나 가격구조도 파악이 어렵습니다.◀ 앵커 ▶그런데 꽃값 못 믿겠다는 소비자들 많은 이유, 또 있습니다.'꽃 성형'이라고 들어보셨습니까?조재영 기자 설명을 들어보시죠.◀ 리포트 ▶일부 꽃시장에서 이뤄진다는 '스프레이 꽃 성형'.시든 꽃에 래커칠을 하거나 향수를 뿌려 색과 향기를 덧입히는 겁니다.[판매 상인]""색깔이 고급이에요. 깔끔하게 나와요. 시커먼 게 가려지니까. 시들면 시커메지잖아. 안개꽃에 많이 뿌리죠. 장미에 뿌리고...""버려지기 직전이었던 꽃도 성형 작업을 마치면 제값 이상으로 가격이 뛴다는 게 상인들 얘기입니다.[판매 상인]""다른 게 1만 원씩 가니까 5천 원이면 이게 싸거든. 그래서 갖다가 이제 쓰는 거야. 여름 같으면 이거 500원도 안 가. 비싸지. 비싸게 제값 다 받아먹는 거지.""비슷해 보이는 붉은 장미도 상태 등에 따라 부르는 값은 제각각입니다.(장미꽃은 한 단에 얼마나 해요?)""8천5백 원""""1만 2천 원""""7천 원이요.""꽃 종류나 품종은 써 붙여놔도 가격표는 따로 없습니다.[김예지]""이게 가격이 다 안 붙어 있고 다 물어봐야 되니까, 가격을...""◀ 앵커 ▶화훼업계가 많이 어렵습니다.소비는 줄고 수출길도 녹록지 않습니다.그런데 꽃송이가 크고 화려한 콜롬비아 장미는 다소 비싸도 잘 팔리고, 가격이 국산의 절반 수준인 베트남산 소국도 수입이 계속해서 늘고 있습니다.화훼업계, 이 위기를 어떻게 이겨내야 할지 그 답은 소비자들이 갖고 있는 것 아닐까요.[앵커의 눈]이었습니다.()[저작권자(c) MBC (www.imnews.com) 무단복제-재배포 금지]"
5,2016-02-04,"TPP, 세계경제지도 40% 차지장기적으로 韓에 불리",https://news.naver.com/main/read.nhn?mode=LSD&mid=shm&sid1=101&oid=421&aid=0001876997,뉴스1,"© News1 최진모 디자이너산업부, TPP 협정문 분석…관세철폐율 77~100%(세종=뉴스1) 이훈철 기자 = 세계경제지도의 40%(TPP 참가국의 경제규모 합산)를 차지하는 미국, 일본 등 12개국이 4일(현지시간) 환태평양경제동반자협정(TPP) 협정문에 공식 서명한 가운데 상품개방, 관세율 등에서 우리에게도 적잖은 영향을 미칠 것으로 분석됐다.◇TPP 일부 회원국, 우리나라 FTA보다 시장개방 활짝이날 산업통상자원부가 발표한 TPP 협정문 분석결과에 따르면 TPP는 품목수 기준으로 볼때 약 95~100%의 높은 수준의 포괄적 자유화율을 나타냈다.품목당 10개 상품 중에 9개 내지는 전부 개방하기로 한 것이다. 이같은 TPP 자유화율은 한·미FTA 등 우리나라가 각국과 체결한 FTA 수준과 대체로 비슷하다는 평가다.하지만 베트남과 말레이시아의 경우 약 98~99%의 시장개방률을 보이며 한·베트남, 한·아세안FTA의 89~90%보다 높은 수준이다.자동차, 철강, 가전 등 우리의 주요 수출 품목에 대해 TPP회원국에 문을 활짝 열어 베트남, 말레이시아 시장에서 우리 기업의 경쟁력이 다소 떨어질 전망이다.TPP는 투자와 서비스 무역면에서 우리 FTA와 달리 네거티브 방식을 채택했다.네거티브는 개방 분야만 열거하는 포지티브와 달리 원칙적으로 시장을 개방하되 제한·금지 품목을 따로 정하게 된다. 때문에 네거티브 방식을 채택한 TPP가 포지티브 방식인 양자간 FTA보다 시장 개방 범위가 넓게 되는 것이다.김학도 산업부 통상교섭실장은 ""TPP가 네거티브 방식을 채택하면서 (투자, 서비스)시장을 더 개방한 측면이 있다""며 ""TPP에 가입하지 않을 경우 우리가 그 시장을 놓치는 경우가 발생할 수 있다""고 말했다.◇TPP 관세철폐율, 시간 지날수록 우리에게 불리특히 TPP의 관세철폐율은 시간이 지날수록 높아지면서 비회원국인 우리에게 불리하게 작용할 전망이다.현재 우리나라는 TPP회원국 중 일본, 멕시코를 제외한 10개국과 FTA를 체결해 2018년 1월1일이 되면 약 82~100%의 관세가 없어지게 된다.이는 TPP가 2018년 발효된다고 가정할 경우 약 77~100% 수준으로 관세가 즉시 철폐되는 것보다 높은 수준이다.각국별로 비교해도 미국의 경우 한·미FTA에 따라 2018년 93.7%의 관세가 철폐되지만 TPP는 약 79~96% 수준에 머물게 된다. 베트남은 한·베트남FTA로 88%의 관세가 사라지는 반면, TPP는 약 65%의 관세철폐율이 적용돼 우리에게 유리하다.문제는 일부 국가의 경우 장기적으로 갈수록 상황이 역전된다는 점이다. TPP회원국의 관세철폐율은 최종적으로 평균 95~100% 수준으로 증가하게 되는 것으로 예상됐다.TPP대책단 관계자는 ""2018년까지는 우리의 관세철폐율이 높지만 시간이 지날수록 TPP에서 관세철폐되는 비율이 높아져서 (우리와) 비슷하거나 우리보다 높아지게 된다""며 ""베트남의 경우 65% 수준에서 궁극적으로 98~99%까지 올라가게 된다""고 경고했다.여기에 베트남·말레이시아의 경우 기존에 높은 수준을 유지하고 있던 자동차, 철강 등의 관세를 TPP를 통해 11~13년에 걸쳐 철폐하기로 해 수출경쟁력 면에서 우리 기업에 불리하게 작용할 것으로 보인다.우리 기업이 베트남 등에 승용차를 판매할 경우 70%의 관세율을 적용받는 반면 TPP회원국들은 무관세 효과를 누리기 때문이다.다만 TPP의 관세철폐율이 우리 FTA보다 높이지는 데는 10년 이상의 시간이 걸린다는 분석이다. 또 베트남, 말레이시아를 제외한 나머지 국가에서는 우리의 관세철폐율도 향후 TPP와 비슷한 수준에 도달하는 것으로 조사됐다.이밖에 TPP에는 한·미FTA에 없는 국영기업, 전자상거래, 환경, 지식재산권 등 관련된 챕터가 새롭게 신설됐다.다만 새롭게 도입된 조항의 경우 법적 정의 등이 불명확하고 국가간 해석에서 차이를 보일 수 있다는 분석이다.또 원산지 규정의 경우 메가FTA의 특성을 반영해 12개 회원국에 공통의 단일 원산지 기준이 적용됐으며 규범은 전반적으로 TPP 역내에 높은 수준의 단일규범이 적용됐다.김 실장은 ""TPP 비회원국이 TPP 국가와 교역이나 투자시에는 결국 TPP규범의 영향을 받을 것으로 관측된다""며 ""추후 회원국이 확대될 경우 영향력은 더 커질 것""이라고 말했다.그는 이어 ""이번 분석결과를 토대로 향후 TPP회원국과의 기술협의 등을 통해 협정문 중 불명확한 부분을 추가로 검토할 것""이라고 덧붙였다.TPP는 아시아·태평양 지역 국가 간의 무역·투자 자유화와 서비스 및 지적재산권 규칙 등을 담은 포괄적 경제협력에 관한 협정으로서 현재 미국과 일본, 캐나다, 호주, 멕시코, 칠레, 페루, 싱가포르, 말레이시아, 베트남, 뉴질랜드, 브루나이 등 12개 나라가 참여하고 있다.12개 회원국들은 지난해 10월 TPP 협정문의 잠정 합의안을 마련한 데 이어 이날 오클랜드 시티컨벤션센터에서 열린 TPP 서명식에 참석, 협정문에 차례로 서명했다.boazhoon@news1.kr▶ 뉴스1 100% 무료 만화 서비스 오픈!![© 뉴스1코리아(news1.kr), 무단 전재 및 재배포 금지]"
6,2016-02-04,"깁스 환자, 한 시간뒤 멀쩡?…'몰카'에 딱 걸렸다",https://news.naver.com/main/read.nhn?mode=LSD&mid=shm&sid1=102&oid=055&aid=0000374882,SBS,"<앵커>교통사고 피해자와 짜고 허위 진단서로 거액의 보험금을 받아낸 뒤 수수료를 챙기는 브로커가 있습니다. 보험 사기꾼과 이를 적발해 내기 위한 보험사 간의 대결이 마치 영화 같습니다.김정우 기자가 취재했습니다.<기자>오른손에 깁스를 한 남성이 편의점에서 지갑에 있는 돈을 힘겹게 꺼내 계산합니다.그런데 한 시간 반 뒤 나타난 카페에서는 깁스는 풀어버리고, 자유롭게 포크도 쓰고 휴대전화 문자도 보냅니다.오른손을 못 쓴다며 허위진단서를 받아낸 강 모 씨를 보험사 직원이 몰래 촬영한 화면입니다.오토바이 사고로 입원한 강 씨에게 보험사기 브로커 43살 이 모 씨가 접근한 건 지난 2013년 5월입니다.이 씨는 '후유장해 진단서'를 발급받아 거액의 보험금을 받을 수 있게 해주겠다며 강 씨에게 꾀병 연기를 시켰습니다.[강 모 씨/피의자 : 관절검사든 뭐든 할 때 아예 움직이지 말아라. 범위에 어긋나는 동작을 시키려고 하면 아프다고 이야기해라. 그렇게 지시를….][박형채/동부화재 보험범죄조사팀 : 저희가 만났을 때는 강 모 씨는 오른손을 전혀 사용할 수 없다며 왼손으로 모든 글씨를 썼습니다.]병원 측도 진료비를 챙기기 위해 이들의 범행을 눈감아줬습니다.강 씨는 허위 진단서로 8천여만 원의 보험금을 받아내는 데 성공했고, 이 씨는 1천 4백여 만 원의 수수료를 챙겼습니다.하지만 강 씨의 꾀병 연기가 스마트폰에 찍히면서 사기행각이 적발됐습니다.경찰은 브로커 이 씨를 사기 혐의로 구속하고, 강 씨와 의사 등 6명을 불구속 입건했습니다.(영상취재 : 양두원, 영상편집 : 이홍명)김정우 기자(fact@sbs.co.kr)☞ SBS 뉴스 바로가기※ ⓒ SBS & SBS콘텐츠허브 : 무단복제 및 재배포 금지"
