,날짜,기사 제목,기사 링크,기사 출처,기사 내용
83,2016-02-17,빈 방·세워둔 車 활용 '공유경제' 대세,https://news.naver.com/main/read.nhn?mode=LSD&mid=shm&sid1=101&oid=003&aid=0007045064,뉴시스,"신뢰 깨지면 공유경제 바람, 급속도로 위축될 것기존 산업, 혁신 누르기보단 윈윈 전략 써야【세종=뉴시스】이예슬 기자 = 렌트카업체 허츠(Hertz)의 기업가치를 넘어선 우버(Uber)와 세계 최대 호텔체인의 아성을 위협하는 에어비앤비(AirBnB). 두 업체의 공통점은 글로벌 트렌드로 떠오른 '공유경제'의 선두주자라는 점이다.두 기업은 지난해 9월 기준 각각 기업가치 510억 달러, 255억 달러로 세계 주요 스타트업 중 2, 3위를 차지하고 있다. 온라인 플랫폼을 통해 자산이나 자원을 가진 공급자와 수요자들이 만나 폭발적 반응을 이끌어낸 것이다.이 같은 공유경제의 현실화는 기존 경제 패러다임에 큰 충격을 주고 있다. 기존 산업의 한계를 넘어선 신성장 동력을 부여할 수 있다는 점에서 긍정적 역할이 부각되지만 반대로 시너지 효과가 아니라 이미 구축된 산업을 무너뜨리면서 성장할 수 있다는 우려도 공존한다.결과야 어쨌건 합리적 소비문화의 확산과 높은 스마트폰 보급률로 이제 공유경제는 거스를 수 없는 추세가 됐다. 우리 정부가 숙박공유와 차량공유 등 공유경제를 제도권 내로 편입하려는 이유도 여기에 있다. 새로운 서비스시장을 개척해 투자와 일자리 창출을 늘리겠다는 것이다.17일 대통령이 주재한 제9차 무역투자진흥회의에서는 공유경제 활성화를 비롯한 투자활성화 대책들이 확정됐다. 에어비앤비 등 모바일 플랫폼을 통해 주택을 제공하는 숙박 공유 서비스를 가능하게 하기 위해 '공유민박업'을 신설하고 차량공유업체에 공영주차장 제공 등을 용이하게 할 방침이다.◇가진 것 나눠 새로운 부(富) 창출공유경제는 '소유'하고 있지만 효율적으로 사용되고 있지 못하는 자원을 활용한다는 측면에서 새로운 부와 일자리를 만들어낼 수 있다.예를 들어 학교 근처에 집을 마련했지만 방학때면 고향으로 돌아가는 학생들이나 자녀가 출가해 두 사람이 살기엔 지나치게 큰 집을 가지고 있는 노부부를 가정해 보자.쓰이지 않는 공간을 여행객에게 제공함으로써 이들은 부업을 가질 수 있게 된다. 전문숙박업자는 아니지만 일종의 일자리 창출이 가능한 것이다.가외 소득을 버는 공급자에게도, 호텔 등 숙박업체보다 저렴한 가격에(혹은 다양한 선택권을 가질 수 있는) 수요자에게도 윈윈이다.공유경제를 기반으로 한 스타트업 창업이 많아지면 우리 사회 큰 화두인 고용 문제에도 어느 정도 기여할 수 있다. 이들 기업이 일자리를 만들어내는 것은 물론 청년들이 기존 기업에 취업하는 것만을 목표로 하지 않고 훌륭한 아이디어가 있다면 창업에 도전할 수 있는 밑바탕이 다져질 수 있다.◇범죄 악용 등은 풀어야 할 숙제세계 최대 차량공유 업체인 우버는 최근 범죄 문제로 골머리를 앓고 있다. 대표적인 예가 2014년 말 인도 뉴델리에서 벌어진 사건이다. 우버택시 기사가 여성 승객을 납치·성폭행한 사건이다.우버 택시는 어플리케이션을 매개로 운전기사와 승객이 직접 접촉하는 모델을 내놓으면서 전세계적으로 각광을 받았다. 그러나 범죄와 운전경력 등을 제대로 조회하지 못한다는 측면에서 범죄자들의 수단으로 악용될 수 있다는 지적이 끊임없이 제기됐다.우버는 운전자와 승객을 연결해 주지만 운전자에 대한 신원조회는 미흡하다. 살인이나 성범죄 등 강력 범죄 전과자가 우버 택시 기사로 일해도 걸러낼 방법이 없는 것이다.설사 우버 앱에 등록할 때는 법적, 서류상 아무 문제가 없더라도 등록된 인물과 실제 운전기사가 같은 인물이라고 장담할 수 없다.숙박공유 서비스의 경우에도 고객이 일반 가정집에 묵다가 범죄를 당하면 배상 책임의 주체가 불문명하고 호스트가 범죄 이력을 가진 인물일 가능성을 배제할 수 없다.공유경제는 기본적으로 '신뢰'를 바탕으로 이뤄지는 비즈니스인 만큼 사회 신뢰가 낮은 국가일수록 이러한 신뢰 리스크는 시장을 근본적으로 위축시키는 요인이 된다. 공공의 안전을 위한 적절한 보호 조치가 전제돼야만 신산업으로서의 가치가 인정되는 것이다.◇호텔·택시업계 등 기존 사업자들은 뿔났다!기존 사업자들 간 이해관계를 어떻게 조율해야 할 것이냐도 큰 문제다. 예를 들어 택시면허가 없는 우버 기사들이 승용차를 택시처럼 운영해 수익을 낸다면 기존 택시 운전사들은 생업에 지장이 있을 수밖에 없다.이 때문에 우리나라에선 개인 소유의 자가용과 승객을 연결하는 '우버 엑스'는 아직 불법의 영역에 남아있고 택시 기사가 운행을 담당하는 '우버 블랙' 서비스만 합법이다.에쿠스, K9 등 고급 세단을 이용한 일종의 모범 택시 서비스인데 택시업계와의 협업을 통해 5년 이상의 무사고 경력을 갖추거나 1년 이상 무사고 모범택시 운전을 한 기존의 택시 기사에게만 운행 자격을 준다.업계의 반발로 정부에서 규제를 개선하는 분야는 쏘카, 그린카 등으로 대표되는 무인대여 방식의 렌트카 분야다.기재부 관계자는 ""쏘카나 그린카와 같은 차량공유가 공유경제에 부합하느냐에 대한 의문은 있지만 공유 경제의 초기 단계라고 볼 수 있을 것""이라며 ""우버 엑스처럼 승차공유 형태가 공유경제의 취지에 좀 더 부합하겠지만 일단은 차량공유 활성화 이후 논의할 문제""라고 말했다.정부가 에어비앤비 영업을 120일로 제한한 것도 기존 숙박업체들을 고려했기 때문이다. 도시지역(전용주거지역 제외)에서 내·외국인을 대상으로 연간 최대 120일간만 주택을 제공할 수 있는데 기존 산업과의 이해상충을 완화하기 위한 방안이다.차영환 기재부 성장전략정책관은 ""공유경제의 가장 큰 쟁점은 기존 산업과 갈등의 소지가 있다는 점""이라며 ""상시 숙박서비스를 제공하면 공유경제가 아니라 숙박업이 된다는 측면에서 제한을 뒀다""고 밝혔다.그러나 좀 더 근본적으로는 기존 사업자들이 정부에 규제에 기대 자신들의 '밥그릇'을 빼앗는 공유경제의 성장을 막는 것만이 바람직한 처사가 아니라는 얘기가 나온다.조용수 LG경제연구원 연구위원은 ""기존 기업이 아무리 막더라도 혁신을 갈구하는 소비자와 시장의 압력을 이길 수는 없다""며 ""이런 관점에서 자신의 비즈니스 영역에 출현한 새로운 혁신 흐름을 기존 경쟁자보다 더 빨리 수용하고 공유경제 참여자들과 윈윈하는 방법을 찾을 필요가 있다""고 지적했다.에어비앤비는 기존 숙박업자들이 자신들의 플랫폼을 이용하는 것을 막지 않기 때문에 실제로 글로벌 호텔체인을 비롯한 많은 숙박업체들은 에어비앤비에 객실을 올리고 있다.숙박업은 일정 시간에 그 공간을 점유하는 고객에게 돈을 받는 사업이기 때문에 공실을 최대한 적게 유지하는 것이 영업의 키 포인트인 만큼 기존 호텔예약사이트를 통해 고객을 유치하는것처럼 에어비앤비와 손을 잡을 수 있는 여지가 있는 것이다.ashley85@newsis.com★ 세상에 이런일이 -  ""남친 왜 체포해""…경찰관 꼬집고 할퀸 20대女 집유★ 오늘의 핫 포토 -  ´어벤져스´ 수현, 가슴골 노출 의상★ 뉴시스 뉴스, 이젠 네이버 뉴스 스탠드에서도 만나세요★ 손 안에서 보는 세상, 모바일 뉴시스<저작권자ⓒ 공감언론 뉴시스통신사. 무단전재-재배포 금지.>"
84,2016-02-17,"'유죄' 포천시장 ""상고할 것""… 시민단체 '부글부글'",https://news.naver.com/main/read.nhn?mode=LSD&mid=shm&sid1=102&oid=003&aid=0007045686,뉴시스,"【포천=뉴시스】이종구 기자 = 성추행과 금품 무마 혐의로 복역하다 1심 형기를 다 마치고 지난 13일 출소한 서장원(58·새누리당) 경기 포천시장이 출소 사흘만인 16일 오전 7시50분께 시청 집무실로 출근하고 있다. 2015.11.16 (사진=뉴스플러스 제공)   leejg@newsis.com【포천=뉴시스】이종구 기자 = 강제추행과 무고 등의 혐의로 기소돼 항소심에서도 시장직 상실형인 집행유예를 선고받은 서장원(58) 경기 포천시장이 대법원에 상고할 뜻을 밝혔다.서 시장은 17일 항소심 재판부가 자신에 대해 징역 10월에 집행유예 2년을 선고한 직후 사과문을 통해 “재판부의 판결을 존중한다”면서 “판결에 억울한 부분도 없지 않아 공정한 법의 판단을 받을 수 있도록 대법원에 호소하겠다”고 밝혔다.그는 또 “집권여당의 당적을 갖고 있는 사람으로서, 오해의 소지가 없도록 탈당하겠다”고 덧붙였다.이어 “불미스러운 일로 인해 상처를 입으신 16만 시민 여러분께 깊은 사죄의 말씀을 드린다”고 말했다.서 시장이 1에 이어 2심에서 유죄를 선고 받았음에도 사퇴하지 않고 대법원에 상고할 방침을 밝히자 포천시민단체는 서 시장의 출근저지 시위에 돌입하는 등 반발하고 있다.포천시민연대 현수민 사무국장은“시정공백이 해를 넘기는 상황에서 사퇴는커녕 자신의 입장표명 수준의 사과문을 발표하는 것은 주민을 또 다시 무시한 행동”이라며 “내일부터 시청 앞에서 서 시장 차량 진입을 막고, 출근도 저지하겠다”고 반발했다.의정부지법 형사3부(허경호 부장판사)는 이날 서 시장에 대한 항소심에서 징역 10월에 집행유예 2년을 선고했다.서 시장은 지난 2014년 9월  집무실에서 박모(53·여)씨를 성추행하고, 비서실장을 통해 이를 무마하려 경찰에 거짓진술을 시킨 혐의(무고·강제추행) 등으로 지난해 2월 재판에 넘겨졌다.1심 재판부는 지난해 6월 서 시장에게 징역 10월을 선고하고 성폭력 치료 프로그램 40시간 이수를 명령했다.이후 서 시장은 지난해 11월 13일 만기 출소해 논란 끝에 직무에 복귀했다.leejg@newsis.com★ 세상에 이런일이 -  ""남친 왜 체포해""…경찰관 꼬집고 할퀸 20대女 집유★ 오늘의 핫 포토 -  ´어벤져스´ 수현, 가슴골 노출 의상★ 뉴시스 뉴스, 이젠 네이버 뉴스 스탠드에서도 만나세요★ 손 안에서 보는 세상, 모바일 뉴시스<저작권자ⓒ 공감언론 뉴시스통신사. 무단전재-재배포 금지.>"
85,2016-02-17,"오바마 ""시리아, 나와 푸틴 간 대결의 장 아니다""",https://news.naver.com/main/read.nhn?mode=LSD&mid=shm&sid1=104&oid=421&aid=0001894238,뉴스1,"버락 오바마 미국 대통령 © AFP=뉴스1오바마 ""시리아 내전, 러시아 수렁에 몰아넣을 것"" 경고(서울=뉴스1) 배상은 기자 = 버락 오바마 미국 대통령이 16일(현지시간) ""시리아 내전은 나와 (블라디미르) 푸틴 러시아 대통령 간 대결의 장이 아니다""며  ""시리아 내전은 오히려 러시아를 수렁에 몰아넣게 될 것""이라고 경고했다.AFP통신에 따르면 오바마 대통령은 이날  미·아세안 정상회의가 끝난 캘리포니아 서니랜즈에서 가진 회견에서 ""푸틴은 (시리아 내전을) 러시아 군의 시리아 영구 점령을 위한 준비 작업으로 생각할지 모르나 그것은 러시아에 엄청난 손실을 초래할 것""이라며 이같이 말했다.오바마 대통령은 ""우리가 던져야할 진짜 질문은 도대체 러시아가 내전으로 파괴된 시리아에서 무엇을 얻으려고 하는가""라며 ""과연 지금이 우방(아사드 정권)을 지탱시키려 수십억 달러를 사용해야만 할 때인가""고 목소리를 높였다.이어  휴전을 위한 시리아 평화 협정 체결이 러시아의 반대로 난항을 겪고 있는 현 상황을 언급하면서 ""이미 너무 많은 희생이 있어왔기 때문에 합의를 도출해내기가 쉽지 않다""고 실토했다.오바마 대통령은 ""만약 러시아가  그간 우리가 목격해온 방식의 무차별 공습을 계속한다면, 어떤 결과가 초래될 지는 자신들(러시아)도 알지 못할 것""이라며 러시아에 시리아 공습을 중단하라고 재차 촉구했다.baebae@▶ [뉴스1글로벌] 가장 빠른 세계 경제 서비스 오픈!!▶ 뉴스1 100% 무료 만화 서비스 오픈!![© 뉴스1코리아(news1.kr), 무단 전재 및 재배포 금지]"
86,2016-02-17,초중고생 1.8%가 영재교육… 수학·과학에 집중,https://news.naver.com/main/read.nhn?mode=LSD&mid=shm&sid1=102&oid=011&aid=0002800552,서울경제,"전국 초·중·고생의 1.8%가량이 영재교육을 받고 있으며 주로 수학과 과학 분야에서 영재교육이 이뤄지는 것으로 나타났다.17일 교육부에 따르면 지난해 영재교육 대상자는 11만53명으로 전체 초·중·고생 608만8,827명의 1.81%를 차지한 것으로 조사됐다. 영재교육 대상자는 지난 2008년 0.77%에서 꾸준히 증가 추세를 보이고 있다.학생별로 살펴보면 초등학생은 전체 학생의 2.13%, 중학생은 2.35%, 고등학생은 0.84%가 영재교육을 받는 것으로 나타났다. 영재교육은 절반 이상인 55.9%가량 학교에서 이뤄지는 것으로 조사됐다. 교육청 영재교육원은 29.7%로 뒤를 이었으며 대학 영재교육원은 8.9%에 머물렀다.영재교육 대상자 가운데 81.2%인 8만9,372명은 수학과 과학에서 영재교육을 받는 것으로 나타났다. 발명(4.0%), 인문사회(3.5%), 정보(2.9%), 외국어(2.3%) 등은 영재교육 비중이 매우 낮았다.교육부 관계자는 ""지금까지 수학과 과학 중심으로 영재를 육성했는데 앞으로는 언어 영역과 정보 영역 등으로 영재 교육 영역을 다양화할 계획""이라고 밝혔다.강동효기자 kdhyo@sed.co.kr▶ 돈이 보이는 뉴스 '서울경제 페이스북' ""좋아요 클릭클릭~""▶ '썸 타는' 특별한 뉴스~ '서울경제썸 페이스북' 바로가기~[ⓒ 서울경제, 무단 전재 및 재배포 금지]"
87,2016-02-17,"신해철법 통과…중대 의료사고, 병원 동의없이 조정한다",https://news.naver.com/main/read.nhn?mode=LSD&mid=shm&sid1=102&oid=009&aid=0003683254,매일경제,"일명 ‘신해철법’으로 불리는 ‘의료사고 피해구제 및 의료분쟁 조정법’ 개정안이 17일 국회 보건복지위원회를 통과했다. 사망·중증상해 이상의 의료사고 피해를 당한 환자측이 의료분쟁조정중재원에 조정 신청을 하면 의사와 병원의 동의 여부와 상관없이 조정이 시작된다는 내용이 골자다. 환자 입장에선 소송을 통한 구제보다 시간과 비용을 크게 절약할 수 있다.복지위는 이날 법안심사 소위원회와 전체회의를 열고 이 같은 내용을 골자로 한 ‘의료사고 피해구제 및 의료분쟁 조정법’ 개정안을 처리했다.  이날 통과된 법안은 김정록, 문정림, 오제세 의원 등이 각각 대표발의한 4건의 ‘의료사고 피해구제 및 의료분쟁 조정 등에 관한 법률 일부개정법률안’을 통합조정해 마련된 대안이다. 2014년 사망한 가수 신해철씨 유가족이 의료분쟁 조정을 신청했으나 병원의 거부로 조정이 이뤄어지지 않으면서 법안 개정의 필요성이 제기됐다. 이 법이 일명 ‘신해철법’으로 불리는 이유다. 지난 12일에는 신해철씨의 동료와 팬들을 중심으로 신해철법 통과를 촉구하는 콘서트가 국회에서 열리기도 했다.하지만 이 법안의 핵심 쟁점인 중상해의 범위와 기준은 대통령령으로 정하기로 해 이를 둘러싼 논란이 지속될 것으로 보인다.당장 병원과 의사 단체가 반발하고 있다. 대한의사협회는 이날 공식 성명을 내고 “이번 개정안은 의료전문가단체의 의견을 배제한 졸속심의”라고 주장했다. 의협 강청희 상근부회장은 “중상해의 기준이 모호한 상황에서 이에 대한 법리적인 검토를 한 후 통과시켰는지 의문”이라며 “복지부가 중상해 기준에 대한 가안을 마련해 국회에 제출했지만 정작 의협은 그 어떤 자료도 받지 못했다”고 비판했다.이와 관련 보건복지부는 “향후 의사 등 전문가 단체 등의 의견을 충분히 수렴한 뒤 명확한 중상해 기준을 대통령령에 담도록 하겠다”고 밝혔다.이날 통과된 개정안에 따르면 보다 원할하고 합리적인 조정중재 제도 운영을 위해서 의료분쟁조쟁중재원의 조정위원과 감정위원의 수를 기존 50~100명에서 100~300명으로 확대하고, 대리인의 범위도 보다 넓히도록 했다.또 환자 측이 병원에서 난동을 부리거나 업무방해 등 신뢰를 저해하는 행위를 한 경우에는 중재원장이 조정신청을 각하할 수 있도록 했다. 조정절차 개시에 대해 부당사유가 있다고 판단한 의사와 병원은 이의신청을 할 수 있도록 했고, 이의신청의 이유가 있으면 중재원장은 조정신청을 각하할 수 있도록 했다.[김기철 기자][ⓒ 매일경제 & mk.co.kr, 무단전재 및 재배포 금지]"
88,2016-02-17,"이한구 ""과거 당대표에 공천 안 준 적도 있어""",https://news.naver.com/main/read.nhn?mode=LSD&mid=shm&sid1=100&oid=001&aid=0008192727,연합뉴스,"김무성 비난에 ""당 대표가 공천룰 개입해선 안돼"" 반박""자꾸 이런 식이면 대표가 물러나든 내가 물러나든 해야""경선 앞두고 '강대강' 대치…'공천 내전' 격화(서울=연합뉴스) 류미나 현혜란 기자 = 새누리당 이한구 공천관리위원장은 17일 자신이 전날 발표한 20대 총선 공천룰에 대한 김무성 대표의 비판에 대해 ""당 대표는 (공천에서) 아무런 권한이 없다""고 반박했다.이 위원장은 이날 국회 의원회관에서 기자들과 만나 ""(당 대표를 포함한) 최고위원회가 관여할 수 있는 (공천 관련) 아이템이 몇 개로 정해져 있다. 그렇지 않으면 공천 관리가 되지 않는다""면서 이같이 밝혔다.그는 특히 ""과거에 당 대표에게도 공천을 주지 않은 적도 있다. 안 그러면 그게(공천 관리가) 안 된다""며 공천관리위의 '독립적 지위'를 고수하겠다는 의지를 재확인하는 동시에 김 대표를 직접 겨냥했다.또 일각에서 위원장직 사퇴 가능성까지 제기하는 데 대해서는 ""자꾸 그렇게 말하면 당헌·당규에 따라 당 대표가 물러나든지 내가 물러나든지 해야 하지 않겠느냐""며 ""당헌·당규를 열심히 지키는 사람에게 자꾸 그런 질문을 주면 안 된다""고 말했다.이어 이 위원장은 ▲광역시도별 1~3개 우선추천지 선정 ▲후보간 여론조사 경선 방식 미합의시 100% 국민경선 실시 등을 골자로 한 전날 공천룰 관련 브리핑 내용에 대해 ""틀린 내용은 없다""고 잘라 말했다.그러면서 김 대표가 '공천관리위 내부에서조차 합의가 이뤄지지 않았다'고 지적한 데 대해서도 ""(공천관리위 회의에서) 안건이 나오면 설명하고 토론한 뒤 이의 없으면 다른 안건으로 넘어가는데, 이는 이미 합의한 것으로 간주하는 것""이라며 ""하나하나 찬성, 반대를 정하는 게 아니다""라고 지적했다.이 위원장은 다만 ""공관위 활동과 관련해 혼선된 보도가 나간 데 대해서는 유감스럽게 생각한다""며 ""앞으로 회의 결과를 발표할 때는 위원 전원이 충분히 알 수 있도록 논의한 뒤에 발표하겠다""고 말했다.특히 여론조사 경선 방식과 관련해서는 ""(당원-국민 여론조사 비율을) 3대 7을 기본으로 하고 후보자간 합의가 안될 경우 공천관리위에서 결정할 것""이라면서 ""결정 기준은 소위 위원장들이 다시 마련해서 전체회의에서 토론을 거쳐 결정할 것""이라고 말했다.다만 전날 브리핑에서 후보간 여론조사 경선방식에 합의되지 않을 경우 100% 국민경선을 실시하겠다고 밝힌 데 대해서는 ""(공천관리위가 아니라) 내가 그렇게 하겠다고 말한 것""이라며 공천관리위에서 추후 논의하겠다는 입장을 밝혔다.이 위원장은 앞서 연합뉴스와의 통화에서도 전날 브리핑 내용에 대해 ""이미 결론난 사안으로, 바꿀 이유는 전혀 없다""고 확인했다.그는 ""저쪽(김 대표측)에서는 공천룰의 원칙을 벗어났다고 하는데 도대체 벗어난 게 무엇이냐""며 ""우리는 현행 당헌·당규 내에서 논의를 했을 뿐인데 이를 놓고 반발하고 흥분하는 이유를 모르겠다""고 적극 반박했다.이에 앞서 김 대표는 이날 오전 국회에서 열린 비공개 최고위원중진연석회의에서 이 위원장의 전날 브리핑에 대해 ""선거를 하지 않는 한이 있더라도, 지는 한이 있더라도 받아들일 수 없다""고 말한 것으로 알려졌다.새누리당이  전날 20대 총선 후보공천 신청 접수를 마감, 공천심사 및 경선 절차에 본격 들어간 가운데 김 대표와 이 위원장이 이처럼 '강대강'으로 대치함에 따라 향후 공천을 둘러싼 내홍이 격화할 것으로 전망된다.더욱이 당내 양대 계파인 친박(친박근혜)계와 비박(비박근혜)계의 주도권 싸움과 맞물리면서 자칫 총선을 앞두고 '적전 분열'이 표면화하는 게 아니냐는 우려의 목소리도 나오고 있다.humane@yna.co.kr▶ [현장영상] 중년 남성과 결혼하는 12살 신부를 목격한다면?▶ [오늘의 핫 화보] 태권도 명예 3단 된 '코난 오브라이언'…한국 문화 섭렵"
89,2016-02-17,갤S7·G5 실물 유출?…삼성·LG 해명 못하는 이유,https://news.naver.com/main/read.nhn?mode=LSD&mid=shm&sid1=101&oid=001&aid=0008192401,연합뉴스,"인터넷에 실물 주장 사진들 급속 확산(서울=연합뉴스) 고상민 기자 = 오는 21일(현지시간) 스페인 바르셀로나에서 베일을 벗는 삼성전자와 LG전자의 전략 스마트폰 갤럭시S7과 G5의 실물로 추정되는 사진이 인터넷에 공개돼 논란이 일고 있다.17일 업계에 따르면 갤럭시S7과 G5로 추정되는 스마트폰 사진이 최근 아랍에미리트 두바이의 온라인 벼룩시장 사이트 '두비즐(Dubizzle)'에 나란히 올라왔다. 이 두 사진은 개인 블로그 등을 타고 온라인상에서 급속도로 퍼지고 있다.삼성이나 애플 등 주요 스마트폰 제조사들의 신규 모델 출시를 앞두고는 늘 실물 사진이라고 주장하는 사진이나 이미지들이 뿌려지지만 대부분 실제 제품과는 달랐던 것이 사실이다.그러나 이번엔 상황이 다르다는 게 업계의 공통적인 의견이다. 사진에는 해당 스마트폰 앞뒷면뿐만 아니라 충전기와 UBS 케이블 등 패키지 구성품도 함께 담겼기 때문이다. 스마트폰 일련번호도 찍혔다.폰아레나 등 권위 있는 IT 전문매체들도 해당 사진이 두 모델의 실제 모습일 가능성에 무게를 두고 있다.업계 관계자는 ""스마트폰 공개를 앞두고 간혹 이동통신사 쪽에서 실물 사진이 유출되는 경우가 있다""면서 ""이번 갤럭시S7과 G5 사진의 경우 90% 이상 실물과 비슷할 가능성이 크다""고 말했다.다만, 제조사들이 간혹 이동통신사와의 협의 끝에 제품 공개를 얼마 남기지 않고 디자인을 다소 수정하는 경우도 있는 만큼 두 사진이 MWC에서 공개될 실물과 똑같다고 단정하기는 어렵다는 시각도 있다.이에 대해 삼성전자와 LG전자는 이렇다 할 공식 입장을 내놓지 않고 있다.gorious@yna.co.kr▶ [현장영상] 중년 남성과 결혼하는 12살 신부를 목격한다면?▶ [오늘의 핫 화보] 세계 최강 美 전투기 F-22의 위용"
