,날짜,기사 제목,기사 링크,기사 출처,기사 내용
0,2013-07-25,"스마트폰·밤 문화…뇌는 말한다 “좀, 쉬자고”",https://news.naver.com/main/read.nhn?mode=LSD&mid=shm&sid1=103&oid=032&aid=0002364039,경향신문,"수면장애 무엇이 문제인가-①수면장애 원인· 종류장마와 폭염, 열대야가 기승을 부리는 여름이다. 특히 온도와 습도가 높은 열대야에는 많은 사람들이 잠을 설치기 쉽다. 열대야는 기온이 30℃이상인 한 여름에 밤 온도가 25℃이하로 떨어지지 않을 때를 말한다. 일반적으로 사람들은 잠을 잘 때 체온이 1도정도 떨어진다. 하지만 열대야 때는 주변이 더워 열 발산이 원활히 이뤄지지 않아 체온이 잘 떨어지지 않는다. 이에 잠들기가 어려워 수면부족과 피곤함을 느끼게 되는 것이다.수면장애 ‘사시사철’발생하는 질환사람들은 이런 이유로 여름철에 수면장애가 더 많다고 여기지만 이는 일시적인 장애일 뿐 수면장애는 계절과 특정시기와 관계없이 언제든지 발생하는 질환이다. 특히, 해마다 수면장애 환자가 급증하고 있어 개인은 물론 사회적으로 많은 관심을 가질 필요가 있다.수면장애란 수면 전체의 양과 수면의 질, 수면 유지에 문제가 있어 깊은 잠에 들지 못하고 주간 활동에 지장을 받을 정도의 상태를 뜻한다. 수면장애라 하면 대다수의 사람들은 잠에 오랫동안 들지 못하는 불면증 현상만 떠올리지만 수면장애는 잠들지 못하는 것을 포함해 일찍 깨는 현상, 잠꼬대, 수면 중 불쾌감, 참을 수 없는 졸음 등 다양한 양상을 보인다. 수면장애는 주로 다섯 가지 질환으로 구분되는데 불면증, 기면증, 수면무호흡증, 렘수면행동장애, 하지불안증후군이 대표적이다.호르몬변화·스트레스 예민한 여성이 남성보다 많아건강보험심평원에 따르면 2012년 수면장애로 내원한 환자 수는 약 62만 명에 달하고 있고 이 중 여성은 약 37만 명, 남성은 약 25만 명 정도로 집계됐다. 2008년 통계의 내원환자 수가 약 38만 명이었던 것에 비하면 5년 동안 환자 수는 약 24만 명이 늘었고 매년 평균 약 12%씩 증가했다.특히 수면장애 환자는 여성이 남성보다 1.5~2배정도 더 많다. 정확한 이유는 밝혀진 바 없으나 학계에서는 여성이 남성보다 호르몬 변화를 많이 겪고 스트레스에 민감해 수면장애 환자가 상대적으로 많을 것으로 추정하고 있다.건국대학교병원 정신건강의학과 박두흠 교수는 “여성들이 남성들에 비해 호르몬 변화를 많이 겪어 상대적으로 입면과정이 편안하지 못하다”며 “정신학적으로 여성이 남성보다 생각이 복잡해 여러 가지 걱정들로 인한 사소한 스트레스가 높은 것도 원인”이라고 설명했다.사람은 인생의 3분의 1을 잠으로 보낸다 할 만큼 수면은 삶의 큰 비중을 차지하고 있다. 잠은 몸의 휴식과 면역 등 생명유지기능과 하루 동안의 생각과 기억을 정리해 기억력을 높여주고 감정을 조절해주는 역할을 한다. 이런 수면에 문제가 생기면 건강은 물론 이로 인한 사회적 비용이 유발되기 때문에 문제의 심각성을 인지해야 한다.수면장애…암·비만 이끄는 무서운 병잠이 부족할 경우 피로회복이 잘 안되고 기억력과 집중력, 판단력 등이 감소할 수밖에 없다. 업무능력과 학업능력 저하는 물론 정서장애, 산업재해 등의 원인이 된다. 무엇보다 수면장애는 각종 암, 심혈관질환을 더 큰 질환을 유발해 건강상의 위협이 되고 식욕도 증가해 살찌게 한다. 또 최근 사회적 문제가 되고 있는 졸음운전도 수면장애로 인한 후유증이라 볼 수 있다.분당서울대학교병원 신경과 윤창호 교수는 “수면장애는 고혈압, 당뇨, 심혈관질환 등 각종 질환들을 유발하는 무서운 병”이라며 “특히 우리나라 청소년들의 수면부족 문제는 외국 수면장애 관련 학회에서 항상 예로 언급될 정도로 심각하다”고 지적했다.코모키수면의원 신홍범 박사는“체르노빌원전 사고도 졸음으로 발생한 사건 중 하나로 큰 사건의 상당수가 수면장애로 인해 업무능력과 집중력이 저하돼 발생했다”며 “수면장애는 사회적 피해와 비용손실을 가져오기 때문에 주의를 기울여야할 큰 질환”이라고 설명했다.수면장애 극복을 위해서는 우선 병원을 찾는 것이 가장 중요하다. 적정시간을 잤어도 낮에 유독 피곤함을 느끼거나 업무능력과 집중력 등이 떨어진다면 이는 수면과정 중 수면의 질에 문제가 있을 가능성이 크다. 또 일반적으로 사람들은 잠을 잘 못 자도 단순히 잠이 부족하다고만 생각할 뿐 건강을 크게 해친다고는 인지하지 못해 병원을 잘 찾지 않는다.스마트폰·밤 문화…수면장애 부축수면장애 진단과 치료는 수면다원검사를 통해 이뤄진다. 수면다원검사는 몸에 각종 센서를 부착하고 하룻밤을 잔 후 수면의 양과 질 등을 검사하며 자는 동안 일어나는 각종 문제를 측정해 수면장애의 원인을 진단한다. 진단 결과에 따라 약물치료, 수술, 인지행동치료 등 질환에 맞는 치료법을 적용해 정상적인 수면이 가능하도록 돕는다.사람마다 적정수면시간은 차이가 있지만 성인의 일반적인 적정수면시간은 보통 7~8시간정도다. 어릴수록 더 많이 자는 것이 바람직하며 어린이는 보통 9~10시간정도가 적당하다. 하지만 우리나라의 평균 수면시간은 6시간 40~50분으로 다른 나라의 평균 수면시간보다 약 1시간가량 적은 것이 현실이다.가뜩이나 부족한 수면시간이 스마트폰 등 전자기기 보급과 밤 문화 성행으로 단축되고 있다. 잠들기 전에 뇌의 활동을 멈춰야 하는데 스마트폰 등 전자기기를 잠들기 까지 사용해 뇌가 수면상태에 들지 못하는 것이다.가톨릭 의정부성모병원 정신건강의학과 이해국 교수는 “낮 동안 생활이 편안해야 밤이 편안하다”며 “현대인들은 스트레스, 긴장 등으로 인해 정신적 이완이 잘 이뤄지지 않고 사회문화적으로도 밤에 할 수 있는 것들이 많아져 수면을 방해받고 있다”고 지적했다.코모키수면의원 신홍범 박사는 “사람들은 건강검진에는 신경 쓰지만 정작 건강을 좌우하는 수면에는 신경 쓰지 않는 것이 사실”이라며 “만약 수면의 질과 상태에 문제가 있다고 생각되면 수면클리닉을 방문해 반드시 상담을 받아야 한다”고 권고했다.<헬스경향 주혜진 기자 masooki@k-health.com>경향신문 [오늘의 인기뉴스]▶ [단독]“조현오씨가 ‘盧 차명계좌’ 증인신청…”▶ “댓글이 삭제되는데 잠이 오나?” CCTV 영상▶ [단독]배우 연정훈 3억 포르쉐 뺏겼다…왜?▶ [뉴스 플러스]248개 시민단체 “국정원…”▶ 상추·세븐 중징계, 영창 뒤 최전방…모바일 경향 [경향 뉴스진|경향신문 앱|모바일웹] | 공식 SNS 계정[경향 트위터][미투데이][페이스북][세상과 경향의 소통 커뮤니티]- ⓒ 경향신문(www.khan.co.kr), 무단전재 및 재배포 금지〈경향신문은 한국온라인신문협회(www.kona.or.kr)의 디지털뉴스이용규칙에 따른 저작권을 행사합니다.〉"
1,2013-07-25,[이슈&뉴스] 신형 그랜저·뉴카렌스도 ‘누수 현상’,https://news.naver.com/main/read.nhn?mode=LSD&mid=shm&sid1=102&oid=056&aid=0000007626,KBS,"<기자 멘트>현대차의 신형 산타페입니다.최근 차 안으로 빗물이 스며드는 '누수 현상'이 발견됐죠.현대차 측은  이 '누수 현상'이 산타페 차량 일부에만 나타나고 있고 안전에도 문제가 없다고 밝혔습니다.그런데 KBS의 취재 결과  신형 그랜저 등 다른 차종에서도 비슷한 누수 현상이 확인됐습니다.김성주 기자가 보도합니다.<리포트>2년 전에 신형 그랜저를 산  이 운전자는 최근 차를 살펴보다  트렁크 바닥이  흥건하게 젖어있는 걸 발견했습니다.비가 올 때 물이 스며든 겁니다.실제로 물을 뿌려보니 1분도 안 돼 차 안으로 물이 흘러듭니다.<인터뷰> 전이열(그랜저 HG운전자) : ""제가 한 번 까보니까 물이...처음 봤을 때는 이 정도까지 찼었는데""출시한 지 넉 달 된 뉴카렌스.이 차에서도 트렁크 아래에 물이 차는 현상이 발견됩니다.<인터뷰> 변호정(신형 카렌스 운전자) : ""4살된 딸아이랑 두달된 아이가 있는데 함께 어디 가려고 차를 열면 꿉꿉한 기운이 확 오더라고요""장마철에 접어들어  이런 누수 현상을 호소하는 글이 자동차 동호회 사이트 등에 잇따르고 있습니다.무상 수리를 받은 후에도  또 물이 샌다거나 회사측이 보기 흉하게 수리를 해 차량 가치를 떨어뜨린다는  불만까지 있습니다.<인터뷰> 정동준(산타페 운전자) : ""저희가 나중에 팔 때는 저렇게 떡칠돼 있는 부분에 대해서 사람들이 사고차라고 생각할수도 있구요.""이에 대해 현대차는 안전에 직접적 영향을 주지 않을 경우  무상 수리를 실시하고 있으며,  동일한 누수문제가 발생하면  무상수리 기간을 연장하겠다고 밝혔습니다.<기자 멘트>이런 자동차 한 대에 들어가는  부품은 2만여 개 정돕니다.엔진만 해도  20여 가지 주요 부품들로 구성됩니다.이렇게 복잡하다 보니 생산단계에서 결함이 있어도 소비자들은 원인은 물론 결함 자체를  아예 모르는 경우가 많습니다.자동차 회사가  결함을 고쳐주는 방법은 리콜과 무상수리,  크게 2가지가 있습니다.리콜은 차를 산 소비자에게 직접 알려주고 일간지에 공고까지 내야 합니다.반면 무상수리는 이런 의무가 없습니다.자동차 회사가 소비자에게 직접 알려줄 필요가 없어  교통안전공단 홈페이지 등에 결함 내용을 게시하는 정도에 그칩니다.교통안전공단 홈페이지에 올라온 한 차종의 무상수리 권고 글입니다.무슨 말인지 와닿지가 않죠, 쉽게 말해  '자동차 뒷바퀴 부분의 부식'이란 뜻입니다.내용을 이해할 수 없으니 차에 어떤 결함이 있다는 건지 알아채기 어렵습니다.그래서인지  수리가 필요한 19만 8 천대 가운데  40% 정도만 무상수리를 받았습니다.모르면 수리를 못 받고 무상수리 기간이 지나면  무상혜택도 못 받는 경우도  적지 않습니다.이런데도 자동차 회사는 여전히 무상수리를 선호합니다.실제로 지난 2011년 1월부터 열 달 동안  완성차업체 5곳을 조사해보니까 무상 수리 대수가  리콜보다 3배나 많았습니다.외국은 소비자에 대한 서비스를 어떤 식으로 풀어가고 있을까요?해법을 알아봤습니다.<리포트>지난 2009년 미국에선  렉서스 승용차의 바닥 매트가  가속 페달에 끼어  일가족이 사망하는 사고가 났습니다.도요타는 이 사건을 계기로  집단소송 합의금 등으로  1조 8천억 원을 물어주고 회장이 직접 나서 사과까지 해야 했습니다.도요타는 이후  창문 스위치 결함 가능성으로 743만 대 등  잇따라 대대적 리콜을 실시했습니다.미국에선 지난해 전체 자동차  생산량의 68%에 해당하는  6백 8십여 만대가  자발적 리콜서비스를 받았습니다.같은 기간  생산량의 2% 규모만 자발적 리콜됐던  우리나라와는 대조적입니다.특히  사소한 결함이라도 사고로 이어지면  막대한 보상금을 물리는 제도가  적극적 리콜을 유도하고 있다는 분석입니다.<인터뷰> 김필수(대림대학교 자동차학과 교수) : ""피해 사례로 인해서 생기는 후유증에 대한 부분들 정신적 피해라든지,감가상각에 대한 보상도 해주는 부분이 많다는 거죠""우리나라는  결함이 많은 차량에서 발생하고  안전운전에 지장을 줄 때  리콜을 해야 한다는 규정만 있어  자동차 회사가 리콜을  피해가기 쉽도록 해놨다는 지적입니다.<인터뷰> 교통안전 연구원 : ""조사에 착수를 했다 그렇게 보면 미국같은 경우는 제작사들이 자발적 리콜로 가는 비율이 높고요. 우리나라는 무상수리로...""한국소비자원이 지난해  실시한 설문조사에서  리콜이 강력하게 시행돼야 할 품목으로  소비자 10명 가운데 6명이  자동차를 지목했습니다.KBS 뉴스 지형철입니다.지형철,김성주[관련기사]▶ 숨은 한류 주역 안무가 처우는 ‘열악’▶ 홍명보호 실험 끝! 한·일전 승리 준비 끝!▶ 백혈병 아동에 용기주려 美 전직 대통령 ‘삭발’▶ [이슈뉴스] 신형 그랜저·뉴카렌스도 ‘누수 현상’▶ 우규민, 기아 잡고 8승…윤석민 완투패▶  KBS뉴스 SNS -[트위터][페이스북][미투데이][저작권자ⓒ KBS(www.kbsnews.com) 무단복제-재배포 금지]"
2,2013-07-25,유통기한 지난 고기 '가득'…축산물 위생 엉망,https://news.naver.com/main/read.nhn?mode=LSD&mid=shm&sid1=102&oid=055&aid=0000257667,SBS,"<앵커>도축장 위생이 엉망이라는 저희 SBS 보도에 따라서 정부가 도축장뿐 아니라 축산물에 대한 종합적인 단속을 벌였습니다. 조사 대상 업체 다섯 곳 중의 한 곳이 비위생적으로 고기를 다루고 있었습니다.김태훈 기자가 취재했습니다.<기자>충북 청원의 오리 가공 공장입니다.유통 기한이 지난 냉장 오리를 팔기 위해 냉동실에 쌓아 놨습니다.[불량식품 단속반 : 생산이 2010년 10월 1일. 근데 (유통기한이) 2년짜리, 2012년 10월 1일이면 (유통기한) 끝났네.]유통기한 표시가 아예 없는 오리 고기도 있습니다.돼지고기 부산물 판매 허가를 받아 놓고는 족발을 가공해서 파는 불법업소도 적발됐습니다.식약처 등 11개 정부 부처와 자치단체로 구성된 불량식품 근절추진단은 지난 한 달 동안 도축에서 판매까지 축산물을 다루는 업체 1천 300여 곳을 조사했습니다.그 결과 20%가 넘는 270곳이 축산물 위생 관리법을 위반한 것으로 드러났습니다.[김유미/식약처 불량식품근절추진단 팀장 : 적발된 주요 내용으로는 유통기한을 변조하거나 연장한 행위 등의 표시위반과 유통기한 경과제품의 보관행위 등이 있었습니다.]식약처는 지금까지 소고기에만 적용하던 생산 이력제를 돼지고기에도 도입하기로 했습니다.돼지고기에 문제가 생길 경우 생산이나 유통단계 등을 추적해 원인을 밝히기 위해서입니다.또 소의 간이나 천엽 등 주로 날로 먹는 부산물을 유통할 때는 포장과 표시를 의무화할 방침입니다.(영상취재 : 조창현, 영상편집 : 신호식)김태훈 기자oneway@sbs.co.kr관/련/정/보◆ 추석 '최대 9일 황금 연휴'…비행기표 동났다◆ 환자가 갑자기 의사에 흉기 공격…진료실 아수라장◆ 추억의 영도다리, 47년 만에 고개 들다…장관◆ 北 대표단, 기자실 몰려와 돌발 행동 ""개성공단 파탄나면…""◆ 전 프로축구 선수, 사촌 형과 함께 여친 성폭행☞[SBS기자들의 생생한 취재현장 뒷이야기 '취재파일']☞ SBS뉴스 공식 SNS [SBS8News 트위터] [페이스북] [미투데이] [요즘]저작권자 SBS&SBS콘텐츠허브 무단복제-재배포 금지"
3,2013-07-25,"'백혈병 아기 위해…' 아버지 부시, 삭발 응원",https://news.naver.com/main/read.nhn?mode=LSD&mid=shm&sid1=104&oid=055&aid=0000257653,SBS,"<앵커>삭발을 한 전 미국 대통령의 모습이 공개됐습니다. 아버지 부시 전 미국 대통령이 백혈병을 앓고 있는 어린이를 위해서 아름다운 응원에 나선 겁니다.최고운 기자입니다.<기자>삭발을 한 낯선 모습으로 휠체어에 앉아 있는 사람은 조지 H.W. 부시 전 미국 대통령입니다.열흘 전 백악관에서 열린 자신이 만든 자원봉사 공로상 시상식에 참석했을 때와는 전혀 다른 모습입니다.[CNN 앵커 : 이 사진 한 번 보실까요. 조지 H.W. 부시 대통령의 이런 모습 처음이시죠?]부시 전 대통령 무릎에 앉은 아이는 올해 두 살인 패트릭, 부시의 경호원 아들입니다.패트릭은 올봄 백혈병 진단을 받았습니다.60년 전 부시 전 대통령은 4살 난 딸을 백혈병으로 먼저 떠나보냈습니다.이런 아픈 기억을 갖고 있는 부시 전 대통령이 패트릭의 투병 사실을 듣고 머리카락이 모두 빠진 아이를 응원하는 마음으로 스스로 머리를 민 겁니다.전직 대통령의 삭발 응원에 아버지의 동료 26명도 모두 삭발에 동참했습니다.'패트릭의 친구들'이라는 인터넷 사이트를 열고 치료비 모금 활동도 시작했습니다.퇴임 후 꾸준한 봉사 활동으로 미국인들의 박수를 받아온 부시 대통령, 이번에는 인간미 넘치는 삭발 응원으로 아름다운 전직 대통령의 모습을 보여주고 있습니다.(영상편집 : 신호식)최고운 기자gowoon@sbs.co.kr관/련/정/보◆ 추석 '최대 9일 황금 연휴'…비행기표 동났다◆ 환자가 갑자기 의사에 흉기 공격…진료실 아수라장◆ 추억의 영도다리, 47년 만에 고개 들다…장관◆ 北 대표단, 기자실 몰려와 돌발 행동 ""개성공단 파탄나면…""◆ 전 프로축구 선수, 사촌 형과 함께 여친 성폭행☞[SBS기자들의 생생한 취재현장 뒷이야기 '취재파일']☞ SBS뉴스 공식 SNS [SBS8News 트위터] [페이스북] [미투데이] [요즘]저작권자 SBS&SBS콘텐츠허브 무단복제-재배포 금지"
4,2013-07-25,'진료 불만' 의사에게 흉기 휘둘러…자꾸 왜?,https://news.naver.com/main/read.nhn?mode=LSD&mid=shm&sid1=102&oid=055&aid=0000257662,SBS,"<앵커>진료에 불만을 품은 환자가 의사를 공격하는 사건이 또 발생했습니다. 예방을 위해서는 법적장치도 중요하지만 환자와 의사가 서로를 배려하는 자세가 더 필요해 보입니다.조동찬 의학전문기자입니다.<기자>지난 18일 한 의원, 의사가 컴퓨터를 보는 사이 환자가 갑자기 의사를 흉기로 공격합니다.의사는 중상을 입었고, 주변은 아수라장이 됐습니다.[피해의사 : 옆구리가 따끔하고 뻐근하면서 두 번 뜨끔뜨끔 한 거예요. 깜짝 놀라서 돌아보니까 일어서서 저를 겨누고 있어요.]2008년엔 비뇨기과 의사가, 2011년엔 치과의사가 환자가 휘두른 흉기에 목숨을 잃었습니다.진료에 불만을 품은 환자들의 보복 행위였습니다.[진료실 폭력 경험 간호사 : 사람들 살리려고 간호사를 하는데 왜 그런 말을 들어야 하나, 출근하기도 무섭고 사람들이 가까이 오는 것 자체가 무서워요.]하지만 극도로 예민해진 환자나 그 가족들을 진료할 땐 의사 입장에서도 배려가 필요합니다.[현명호/중앙대학교 심리학과 교수 : 아프면 사람들이 일단 불안해집니다. 그 병이 어떤 것인지 작은 병에 걸려도 우리는 거기에 굉장히 예민하게 반응하게 되거든요.]그렇더라도 의료인이 위협을 당해 판단력이 흐려진다면 손해는 환자들 몫입니다.[송형곤/대한의사협회 응급의학과 전문의 : 정신은 딴 데 가 있고 환자는 눈으로만 보고 손으로만 보는 그런 일이 생깁니다. 그렇게 되면, 피해는 환자들한테 가는 거죠.]현재 의료계에선 폭력을 막을 수 있는 법적 보호장치와, 진료실 보안요원 지원을 요구하고 있습니다.하지만 보다 근본적인 대책은 의료인과 환자 간의 신뢰 형성입니다.(영상취재 : 김태훈, 영상편집 : 김형석)조동찬 기자dongcharn@sbs.co.kr관/련/정/보◆ 추석 '최대 9일 황금 연휴'…비행기표 동났다◆ 환자가 갑자기 의사에 흉기 공격…진료실 아수라장◆ 추억의 영도다리, 47년 만에 고개 들다…장관◆ 北 대표단, 기자실 몰려와 돌발 행동 ""개성공단 파탄나면…""◆ 전 프로축구 선수, 사촌 형과 함께 여친 성폭행☞[SBS기자들의 생생한 취재현장 뒷이야기 '취재파일']☞ SBS뉴스 공식 SNS [SBS8News 트위터] [페이스북] [미투데이] [요즘]저작권자 SBS&SBS콘텐츠허브 무단복제-재배포 금지"
5,2013-07-25,장마철 피부 관리 시작은 침구류·화장 도구 ‘청결’,https://news.naver.com/main/read.nhn?mode=LSD&mid=shm&sid1=103&oid=022&aid=0002557151,세계일보,"주 1∼2회 각질 제거하고생기 잃은 얼굴엔 양배추팩, 모공 관리엔 흑설탕팩 좋아장마철 피부 관리는 빨래 건조만큼 어렵다. 땀과 피지로 얼룩진 피부에 공기 중 먼지가 달라붙어 오염되기 쉽고 냉방에 노출돼 건조해진다. 끈적끈적한 상태와 건조함이 반복되면 피부 노화가 촉진된다. 눅눅한 장마철, 뽀송뽀송한 피부를 유지하기 위한 관리법을 소개한다.침구류·화장 도구 관리, 깨끗한 세안, 피부 영양을 위한 팩 관리 등을 하면 장마철 피부 이상을 예방할 수 있다.강한피부과 제공여름철 피부 관리는 침구류 관리부터 시작된다. 습기로 눅눅해진 침구에는 세균이 쉽게 번식한다. 자는 동안 땀을 흘리면 침구류가 오염돼 여드름·뾰루지 등 피부 이상의 원인이 된다. 제습기나 제습제를 이용해 습기를 제거하고 비가 오지 않는 날에는 햇볕에 말려야 한다.화장 도구 관리도 중요하다. 이물질이 묻은 눅눅한 솜과 화장붓 등은 피부에 문제를 일으키기 쉽다. 도구에 묻은 화장품을 꼼꼼히 털어내고 수시로 건조 상태를 확인한다.피부 관리의 핵심은 무엇보다 깔끔한 세안에 있다. 과다 분비된 땀과 노폐물을 깨끗이 씻어내지 않으면 모공을 막아 피부 이상을 일으킨다. 주 1∼2회 피부자극이 적은 필링 제품을 이용해 각질을 제거해야 한다. 습한 날씨와 냉방으로 지친 피부에 팩을 붙이는 것도 도움이 된다.모공 관리에 효과적인 천연 팩에는 흑설탕팩(흑설탕 3큰술, 꿀 1과 2분의 1큰술, 요구르트 2분의 1큰술), 율피가루팩(율피가루와 같은 비율로 우유 섞기), 토마토팩(믹서에 간 토마토와 약간의 꿀), 요구르트팩(플레인 요구르트와 오트밀 가루 같은 비율로 섞기) 등이 있다.끈적끈적하고 생기 잃은 피부에는 양배추팩(간 양배추 2스푼, 밀가루 적당량)이 효과적이다. 무기질과 다양한 비타민을 함유하고 있는 양배추는 피부에 생기를 불어 넣어준다. 걸쭉하게 만들어 피부에 펴바르고 15∼20분 뒤 미온수로 씻으면 피부가 뽀송뽀송해진 것을 느낄 수 있다.최근 유행하고 있는 피부 디톡스(독소 제거)에 좋은 팩도 있다. 녹두가루팩(녹두가루 2스푼, 플레인 요구르트 2스푼)은 피부에 쌓인 독소를 해독해주고 노폐물을 제거해준다. 얼굴에 바른 뒤 10∼15분 뒤 씻어내면 된다.몸에 좋은 재료는 피부에도 좋지만 팩 잔여물은 되레 독이 될 수 있다. 재료가 모공 사이에 끼지 않도록 마스크 시트나 마른 티슈를 사용하고 얼굴에 직접 도포할 경우 완벽하게 닦아야 한다. 세안 후 기초 화장품을 듬뿍 바른 화장솜으로 닦아내면 미세한 잔여물까지 제거할 수 있다.이현미 기자 engine@segye.com▶ 세계일보 뉴스스탠드, 지금 바로 만나보세요!이 시각 인기뉴스◆ 故김종학 PD, 유서 공개…검찰 '비판'◆ 담임이 여고생 임신시키고 낙태…아버지는 자살◆ 방송 중 女 팬티 내려 '엉덩이 노출'◆ 아무리 먹어도 살 안찌는 체질만들기?◆ ""입던 속옷 1장에 5만원"" 20대女, 카페서 버젓이…▶ 바로가기[모바일로 만나는 HOT포토] [지구촌 별별뉴스][세계일보 모바일웹] [무기이야기-밀리터리S]ⓒ 세상을 보는 눈, 글로벌 미디어세계일보 & Segye.com"
