,날짜,기사 제목,기사 링크,기사 출처,기사 내용
61,2013-07-07,"외교부 ""한국인 승객 77명 중 44명, 병원서 치료 중""",https://news.naver.com/main/read.nhn?mode=LSD&mid=shm&sid1=102&oid=047&aid=0002028797,오마이뉴스,"[오마이뉴스 김도균 기자]▲미국 교통안전위원회가 8일 트위터(@NTSB)를 통해 공개한 미국 샌프란시스코 공항에 착륙 도중 충돌 사고를 일으킨 아시아나기 내부 사진.ⓒ 미국 교통안전위원회[4신 : 7일 오후 6시 35분]외교부 ""한국인 승객 77명 중 44명, 병원에서 치료받고 있어""아시아나항공 여객기(OZ 214편)에 탑승했던 한국인 승객 77명 중 44명이 현재 병원에서 치료를 받고 있다고 외교부가 밝혔다.외교부 고위 당국자는 7일 ""현재 부상자는 공항에서 30분 이내 거리에 위치한 10개 병원에 분산돼 있다""며 ""한국인 승객 77명 중 44명이 오후 1시(한국시각) 현재 병원에 있는 것으로 확인했다""고 말했다.이 당국자는 ""대부분 상태가 양호한 것으로 보이나 극소수 중환자도 있다""며 ""몇 명 정도가 수술을 요하는 상태""라고 덧붙였다.그는 ""부상자의 신원을 파악하는 일에 모든 인력을 총동원할 것""이라며 ""신원이 확인되는 대로 가족에게 연락하는 한편 현지 방문을 희망하는 가족이 있으면 필요한 지원을 하겠다""고 밝혔다.이 당국자는 2명의 중국인 사망자와 관련 ""사고 발생시 비행기 후미가 활주로에 먼저 닿으면서 기체 꼬리 부분이 크게 훼손됐고, 이 과정에서 승객 몇 명이 밖으로 튕겨 나간 것 같다""면서 ""사망자는 튕겨 나간 사람 중 2명 같다""고 전했다.그는 또 사고 비행기에 중국인 탑승객이 많은 이유에 대해 ""샌프란시스코에는 중국인이 많이 거주한다""며 ""사고 비행기는 중국 상하이에서 샌프란시스코로 연결 비행편인 것으로 안다""고 설명했다.외교부는 현지 공관을 통해 병원에 수용된 한국인 승객 상당수의 신원을 파악하고 추가 확인을 하는 것으로 알려졌다.[3신 : 7일 오후 4시 10분]아시아나항공 기자회견... ""엔진 이상이나 조종 미숙 사고는 아닌 듯""윤영두 아시아나항공 사장은 미국 샌프란시스코 공항에서 발생한 아시아나 여객기 사고와 관련, ""탑승자 가족과 국민들께 심려를 끼쳐 송구하다""며 ""조속한 사고 수습을 위해 최선을 다하고 있다""고 말했다.윤 사장은 이날 오후 3시30분 서울 강서구 오쇠동 아시아나항공 본사에서 긴급 기자회견을 열고 ""사망한 것으로 확인된 중국 여성 2명은 기체 뒤편에 탑승하고 있었다""며 ""두 명의 승객은 각각 1996년생과 1997년 생인 것으로 파악됐다""고 전했다.또한 윤 사장은 ""사고 조사단을 미국 샌프란시스코 현지에 급파했다""며 ""미국 교통안전위원회(NTSB)를 통해 사고 원인과 분석이 가능하기 때문에 철저하고 정확한 사고 원인을 규명하겠다""고 말했다. 그는 사고기가 ""2006년 3월에 구매해서 들어온 보잉 777-200기종으로 기체나 엔진으로 인한 이상은 아닌 것으로 파악하고 있다""고 말했다.그는 ""샌프란시스코행 OZ214편에 탑승한 조종사 4명 중 3명은 운항 1만 시간을 넘긴 베테랑""이라며 ""나머지 한 명도 1만 시간에 육박한 조종사로, 조작 미숙에 의한 사고는 아닐 것""이라고 추정했다.이어 윤 사장은 ""개인정보 보호 차원에서 승객명단을 공개할 수는 없다""며 ""가족들의 연락이 오면 확인해 드리고 있다""면서 ""탑승객 가족이 원하면 미국행 편의를 제공하겠다""고 말했다.한국인 승객 5명의 상태가 좋지 않은 것으로 알려지고 있다는 질문에 윤 사장은 ""병원으로 연락하는 것이 금지돼 있어 파악할 수가 없다""고 설명했다.또 비상착륙이 매뉴얼대로 이뤄졌냐는 질문과 관제탑과의 교신이 착륙전에 이뤄졌느냐는 질문에 대해서는 ""확인할 수 없고 조사후에야 할 수 있을 것""이라고 말했다. 비상착륙한 활주로가 현재 이용이 금지된 곳이 아니냐는 질문에 대해서는 ""정상적으로 이용되고 있는 곳""이라고 답했다.그는 또 착륙직전 비상 안내 방송은 없었다고 답변했다.[2신 : 7일 오후 2시 50분]사망자 2명 모두 중국 국적 여성아시아나항공 여객기 착륙사고로 사망한 2명이 모두 중국 국적의 여성인 것으로 확인됐다.국토교통부 최정호 항공교통실장은 7일 오후 ""외교부를 통해 사망자 2명 모두 중국인이며 둘 다 여성이라는 사실을 확인했다""고 밝혔다.주 샌프란시스코 한국총영사관은 이번 사고의 사망자가 안치된 현장에서 검시관 등을 통해 비공식적으로 사망자의 국적을 확인한 것으로 알려졌다.한국인 부상자 5명의 상태도 위중한 것으로 드러났다.아시아나항공 관계자는 ""한국인 중상자는 10명인 가운데 5명은 상태가 매우 심각해 인명 피해가 더 늘어날 것으로 우려되고 있다. 5명은 경상으로 파악됐다""고 밝혔다.현재 한국인 탑승자 77명 중 34명이 샌프란시스코 공항에서 15분 정도 거리에 있는 병원으로 이송된 것으로 확인됐다.[1신 : 오후 12시 35분]아시아나기 추락 사고...2명 사망·181명 병원▲미국 샌프란시스코 공항의 아시아나 항공 착륙 사고를 전하는 <허핑턴포스트>ⓒ 허핑턴포스트미국 샌프란시스코 국제공항에서 6일(현지시간) 아시아나항공 OZ 214편 여객기가 착륙 과정에서 충돌사고를 일으켰다.이 사고로 탑승자 307명 가운데 2명이 사망하고 181명이 다쳐 병원으로 옮겨졌다고 현지 소방 당국 등이 밝혔다.아시아나항공에 따르면 사고기에는 한국인 77명을 포함해 승객 291명과 승무원 16명 등 모두 307명이 타고 있었다. 사망자의 신원은 확인되지 않고 있지만 사망자 중 여성 1명은 중국 여권을 소지하고 있는 것으로 알려졌다.조앤 헤이즈 화이트 샌프란시스코 소방 당국 책임자는 사고 이후 기자회견에서 ""현재까지 이번 사고로 2명이 사망하고 130명이 부상했다""고 발표했다. 그는 또 ""사고 직후 비행기에 타고 있던 48명이 사고 현장 인근의 병원으로 이송됐고 이후 다른 82명도 병원으로 옮겨졌다""고 말했다.2명 사망, 181명 병원 옮겨져샌프란시스코 공항 측과 미 항공당국은 착륙 직전 여객기가 중심을 잃고 흔들리기 시작한 뒤 충돌했다고 밝혔다. 실제로 사고 현장에서 꼬리날개는 비행기 동체와 멀리 떨어져 활주로 초입 부분에 떨어져 있는 것으로 확인됐다. 이 때문에 기체의 중심을 잡아주는 꼬리날개 결함 때문 아니냐는 분석이 나오고 있다.목격자들은 214편의 꼬리날개가 먼저 떨어져나갔다는 진술을 내놨고, 탑승했던 승객들 역시 기체가 갑자기 기울었고, 3분에서 5분 정도 지난 뒤 충돌했다고 증언했다.그런가 하면, 아시아나 보잉777 항공기가 샌프란시스코 공항 착륙 때 꼬리 부분이 방파제 구조물과 부딪힌 게 유력한 직접적인 원인이 된 것으로 보인다는 주장도 나왔다.미 MSNBC 방송은 해안과 맞닿은 활주로 방파제 구조물과 부딛친 흔적과 비행기 잔해들, 활주로에 깊게 그려진 항공기 타이어 자국 등을 감안할 때 기체 꼬리 부분이 방파제 구조물과 닿으면서 균형을 잃었다고 보도했다.CNN이 공개한 조종사와 관제탑 사이에 오간 교신 녹음에 따르면 사고 여객기 기장은 착륙에 앞서 관제탑과 교신에서 ""음급차가 필요하다""고 말해 착륙 이전에 항공기에 문제가 발생했을 가능성도 있다.착륙 직전 중심 잃고 흔들리기 시작한 뒤 충돌사고가 난 아시아나항공 B777-200ER 여객기는 비교적 새 비행기인 것으로 알려졌다. 사고기는 2006년 2월 제작됐고 같은 해 3월 국토해양부에 등록됐다.일반적으로 비행기가 운항 10년이 넘기 전에는 새 비행기로 여겨지는 것을 고려하면 비교적 새 비행기인 데다, 이 기종은 항공업계에서는 안전하다는 평가를 받는 기종이다.1995년부터 세계 주요 항공사들이 도입한 B777-200ER은 장거리용으로 동체 길이는 62.7ｍ, 높이는 18.4ｍ, 날개 폭은 60.9ｍ이다. 최대 이륙중량은 286.9t, 최대 운항거리는 1만2408㎞, 최대 운항시간은 14시간 50분으로 인천국제공항에서 미국 서부나 유럽을 직항으로 갈 수 있다.오마이뉴스 아이폰 앱 출시! 지금 다운받으세요.[관련기사]KBS, 뭘 잘했다고 수신료 인상 논하나어린이집 원장 비리고발 그후 그곳에서는...박 대통령, 아무것도 모른 척 하지 마라아, 이래서 결혼준비 하다가 싸우는 거구나!""조선인을 쫓아내라!"" 당신은 어떤가요?"
62,2013-07-07,오늘 전국 곳곳 돌풍·벼락 동반 장맛비,https://news.naver.com/main/read.nhn?mode=LSD&mid=shm&sid1=103&oid=052&aid=0000464481,YTN,"서울에도 빗방울이 떨어지기 시작했습니다.장마전선이 서서히 중부지방을 향하고 있기 때문인데요.현재는 전남 일부에 호우특보가 내려진 가운데 이 지역에는 시간당 20mm 안팎의 강한 비가 쏟아지는 곳이 있습니다.그 밖의 충청과 남부 곳곳에도 장맛비가 내리고 있습니다.점차 그 밖의 전국 곳곳으로 비가 확대되겠습니다.특히 비가 집중되는 시기는 남부지방은 오후까지, 중부지방은 낮부터 내일 새벽 사이 돌풍과 벼락을 동반한 국지성 호우가 예상됩니다.따라서 두 세시간안에 충청 이남 서해안에 호우특보가 발효될 것으로 보입니다.오늘 이미 전남과 경남에는 100mm 가까이 많은 비가 내렸습니다.내일까지 중부지방과 전북 서해안에는 100mm 이상의 폭우가 쏟아지겠습니다.그 밖의 남부 곳곳과 강원 동해안에는 10~50mm의 비가 내리겠습니다.시설물 점검 다시 한번 철저히 하시기 바랍니다.오늘 본격적으로 비가 내리기 전에 중북부 지방을 중심으로 무덥겠습니다.서울 30도, 청주 28도, 전주 27도, 창원 25도로 예상됩니다.내일 낮에는 장마전선이 북한 지방으로 북상하면서 비가 대부분 그치겠지만, 중북부 지방은 밤부터 다시 비가 시작돼 화요일까지 이어지겠고, 이후에는 폭염이 기승을 부릴 것으로 보입니다.하지만 주 후반에 또 한 차례 전국에 장맛비 예보가 나와 있습니다.날씨정보였습니다.☞ 네이버 뉴스스탠드에서 YTN 뉴스를 만나 보세요.☞ 언제 어디서나 뉴스가 궁금할 땐 'YTN 뉴스 앱'[아이폰 APP 다운로드↓][안드로이드 APP 다운로드↓][저작권자(c) YTN & Digital YTN. 무단 전재-재배포 금지]"
63,2013-07-07,"""아시아나 사고機, 착륙 직전까지 이상 없었던 듯""",https://news.naver.com/main/read.nhn?mode=LSD&mid=shm&sid1=102&oid=001&aid=0006357500,연합뉴스,"아시아나기 충돌·화재사고    (AP/베이 에어리어 뉴스 그룹=연합뉴스) 6일(현지시간) 오전 미국 샌프란시스코 공항에 착륙하던 중 충돌사고와 함께 불이 난 아시아나항공 214편 B777-200 여객기에서 연기가 치솟고 있다.    bulls@yna.co.kr관제탑 교신할 틈 없이 사고 추정(서울=연합뉴스) 김윤구 기자 = 7일(한국시간) 샌프란시스코공항에서 착륙 사고가 난 아시아나항공 여객기가 착륙하기 전까지 기체에 이상이 없었던 것으로 보이는 정황이 나오고 있다.이는 사고 비행기가 착륙 전부터 문제가 있어서 관제탑을 호출하고 응급차량을 요청한 것처럼 알려진 외신 보도와는 다른 것이다.국토교통부와 아시아나항공에 따르면 이 여객기는 비행 중 특이사항이나 고장 메시지를 보낸 것이 없었다.<아시아나 사고> 사고소식    (영종도=연합뉴스) 서명곤 기자 = 아시아나항공 OZ 214편 여객기가 미국 샌프란시스코 국제공항에서 착륙 중 충돌사고를 일으킨 7일, 인천공항 로비에 마련된 TV에서 관련 소식이 전해지고 있다. 2013.7.7    xyz@yna.co.kr기체에 이상이 있으면 아시아나항공 통제센터에 자동으로 메시지가 뜨게된다.또 사고기는 기장이 착륙 안내 방송도 정상적으로 했다.게다가 미국 언론 보도와 달리 사고기에서 공항 관제탑으로 구급차량을 부르지도 않은 것으로 확인됐다.CNN 등은 여객기 기장과 관제탑의 교신 내용이라면서 한국시각 이날 오전 3시 22분 27초에 항공기에서 관제탑을 호출하고 3초 뒤에 관제탑에서 ""214 항공기, 응급차량 준비됐습니다""라고 말한 것으로 보도했다.하지만 국토부 관계자는 ""사고 여객기에서 구급차를 요청하지 않았다""고 말했다.<아시아나 사고> 사고조사단 출국    (영종도=연합뉴스) 서명곤 기자 = 아시아나항공 OZ 214편 여객기가 미국 샌프란시스코 국제공항에서 착륙 중 충돌사고를 일으킨 7일, 박정권 항공철도사고조사위원장(오른쪽 둘째) 등 사고조사 관계자들이 현지조사를 위해 인천공항을 통해 출국하고 있다. 2013.7.7    xyz@yna.co.kr다른 항공 관계자도 ""내리고 나서 관제탑과 교신한 것으로 안다""면서 ""내리기 전에 문제가 있었다면 관제탑과 교신이 있었을 텐데 그럴 새 없이 갑자기 무슨 일이 일어난 것 같다""고 추측했다.아시아나항공은 이날 사고가 한국시각 오전 3시27분 발생했다고 밝혔다. 그러나 국토부 관계자는 정확한 사고 시각이 불분명하다면서 ""정황상 교신 내용은 지상에서 있었던 것으로 보인다. 비행 중이라면 문제가 있을 때 몇 분 내에 구급차를 부르고 할 수 없다""고 말했다.국토교통부는 항공기가 착륙하다 활주로에 동체 후미가 충돌해 활주로 왼쪽으로 이탈하면서 사고가 난 것으로 추정하고 있다.kimyg@yna.co.kr[이 시각 많이 본 기사]☞아시아나 여객기, 샌프란시스코 공항 착륙중 충돌(3보)☞'너목들' 김가은 ""아이돌 출신이란 오해, 기분좋죠""☞""승객들, 비상슬라이드 이용해 탈출 시도""(속보)☞< U20월드컵> 이광종 감독 ""한 골 싸움…집중력 살려야""☞사고 아시아나機에 한국인 77명·중국인 141명 탑승▶ 연합뉴스 모바일앱 다운받기▶ 인터랙티브뉴스<저작권자(c)연합뉴스. 무단전재-재배포금지.>"
64,2013-07-07,5공 때 강제해직된 예비군 중대장들 명예회복 나섰다,https://news.naver.com/main/read.nhn?mode=LSD&mid=shm&sid1=102&oid=001&aid=0006356921,연합뉴스,"괴산 해직자 모임, 관련법 제정 청원(괴산=연합뉴스) 변우열 기자 = ""5공화국 때 강제로 해직된 지 30년이 지났지만, 보상은 고사하고 명예회복도 못 했습니다""이호훈(69·충북 괴산군 감물면)씨는 예비군 중대장으로 근무하던 1982년 이유도 모른 채 강제 해직당한 걸 생각하면 지금도 억울하기만 하다.이씨는 그 뒤 운이 좋아 공무원 채용시험에 합격해 공무원 생활을 했지만, 다른 해직자들은 일자리를 찾지 못해 곤궁한 생활을 했다.당시 정부는 전국적으로 예비군 중대장을 대위 이상으로 교체하면서 이씨처럼 예비훈련 간부후보생 교육을 통해 배출된 예비군 중대장들을 대부분 강제 해직한 것으로 알려졌다.당시 괴산에서 20여명이 해직됐고, 전국적으로 3천여명이 예비군 중대장 자리에서 쫓겨난 것으로 전해졌다.괴산군 예비군 중대장 해직자 단체인 괴산전우회는 최근 명예회복에 나서기로 뜻을 모았다.이들은 지역구 국회의원인 경대수 의원에게 관련법 제정을 요구하는 청원서를 제출했다.이들은 청원서에서 ""정부가 강제 해직한 뒤 퇴직금이나 위로금조차 지급하지 않았다""며 ""퇴직 후 다른 직장에서 중대장으로 일한 경력을 인정받지 못했다""고 주장했다.그러면서 ""지금이라도 국회 차원에서 관련법을 제정, 해직자들의 명예를 회복시켜 달라""고 요구했다.이들은 경 의원의 입법활동을 지켜보면서 다른 지역 해직자들과 연대하는 방안을 모색할 계획이다.이들의 문제는 1993년에도 불거져 '명예회복 및 보상 특별조치법안' 입법이 추진됐으나 법률이 제정되지는 않았다.bwy@yna.co.kr[이 시각 많이 본 기사]☞아시아나 여객기, 샌프란시스코 공항 착륙중 충돌(3보)☞'국정원·NLL 발언 규탄' 진보·보수 집회 열려(종합)☞-프로야구- 두산, 이틀연속 삼성 제압…'4강 보인다'(종합2보)☞""승객들, 비상슬라이드 이용해 탈출 시도""(속보)▶ 연합뉴스 모바일앱 다운받기▶ 인터랙티브뉴스<저작권자(c)연합뉴스. 무단전재-재배포금지.>"
65,2013-07-07,"아시아나항공 ""한국인 부상자 5명 상태 심각""",https://news.naver.com/main/read.nhn?mode=LSD&mid=shm&sid1=101&oid=052&aid=0000464479,YTN,"[앵커멘트]아시아나항공은 사고대책본부를 마련해 사고 원인과 인명 피해를 확인하는 한편, 특별기와 정기편을 통해 인력을 미국에 급파할 예정입니다.현재 한국인 부상자 5명의 상태가 심각해 인명 피해가 더욱 늘어날 것이란 우려가 나오고있습니다.아시아나 본사에 나가 있는 취재기자를 연결합니다. 이승윤 기자!현재까지의 상황 전해주시죠.[중계 리포트]현재 한국인 탑승자 77명 중 34명이 샌프란시스코 공항에서 15분 정도 거리에 있는 병원인 General Hospital로 이송된 것으로 확인됐습니다.한국인 중상자는 10명인데 이 가운데 5명은 상태가 매우 심각해 인명 피해가 더 늘어날 것으로 우려되고 있고, 5명은 경상으로 파악됐습니다.아시아나항공은 사용 금지 활주로에 사고 비행기가 착륙했다는 보도는 사실이 아니라고 해명했습니다.항공기가 착륙한 28L 활주로는 비상 활주로가 아니고 관제탑에서 착륙을 허용하며 내린 지시에 따라 이 활주로에 착륙했다는 겁니다.아시아나항공 관계자는 이번 사고 원인이 랜딩 기어에 문제가 생겼기 때문인 것으로 파악됐다고 주장했습니다.기장이 관제탑과의 교신에서 착륙 전에 비상 착륙 사실을 미리 알리고 소방차 등을 준비시킨 점으로 미뤄 착륙 과정에서 이상이 발생한 것으로 추정됩니다.아시아나항공은 오늘 오후 2시 이후에 공식 브리핑을 통해 입장을 밝힐 예정입니다.아시아나 항공은 또 탑승자 관련 문의 전화는 2669-4015번으로 받고 있다고 밝혔습니다.오늘 낮 1시엔 아시아나항공 지원팀 20~30명과 국토부 사고 조사단, 탑승자 가족들, 취재진 등이 아시아나 항공 특별기 편으로 출발합니다.아시아나 항공 OZ 214편은 어제 오후 4시 35분쯤 인천을 출발해 오늘 새벽 3시 28분에 샌프란시스코 공항 28번 활주로에서 착륙 중에 사고를 당했습니다.이번 사고가 발생한 샌프란시스코 공항은 2011년까지 지난 5년 동안의 55건의 안전 사고가 발생해 미국에서 네번째로 위험한 공항으로 지목된 곳입니다.아시아나항공은 본사 종합통제센터에 사고대책본부를 마련하고 국토교통부, 샌프란시스코 현지공항당국과 함께 사고 원인을 조사하고 있습니다.승객 291명 가운데 비즈니스 클래스는 19명, 일반석은 272명입니다.승무원은 모두 16명 탑승했으며 이 가운데 운항 요원은 이정민 기장과 이종주, 이강국, 방동원 씨 등 모두 4명입니다.객실 담당 승무원은 이윤혜 씨를 포함한 12명이며 2명은 태국인입니다.지금까지 아시아나항공 본사에서 YTN 이승윤[risungyoon@ytn.co.kr]입니다.☞ 네이버 뉴스스탠드에서 YTN 뉴스를 만나 보세요.☞ 언제 어디서나 뉴스가 궁금할 땐 'YTN 뉴스 앱'[아이폰 APP 다운로드↓][안드로이드 APP 다운로드↓][저작권자(c) YTN & Digital YTN. 무단 전재-재배포 금지]"
66,2013-07-07,2015학년도 의·치대 입학정원 1천명 이상 늘어난다,https://news.naver.com/main/read.nhn?mode=LSD&mid=shm&sid1=102&oid=001&aid=0006356721,연합뉴스,"(서울=연합뉴스) 구정모 기자 = 지금 고교 2학년이 대학에 진학하는 2015학년도부터 의·치대 학부 신입생 정원이 1천명 넘게 늘어나 자연계열 상위권 수험생들의 대입지원에 영향을 미칠 전망이다.7일 교육부에 따르면 2015학년도 의·치대 학부 정원은 2천937명으로 전년도(1천770명)보다 65.9%(1천167명)나 늘어난다.이는 2017학년도부터 의·치의학전문대학원을 의·치과 대학으로 학제를 변경하는 대학이 2015학년도부터 학부 과정에서 신입생을 선발하기 때문이다.정원 증가 규모를 보면 의대가 10개교에 689명, 치대는 4개교에 182명이다. 2015학년도에 전환하는 대학도 정원이 296명 늘어난다.2015학년도에 새로 학부생을 선발하는 의대는 경북대(77명), 경상대(53명), 충남대(77명), 가톨릭대(65명), 경희대(77명), 이화여대(53명), 인하대(34명), 조선대(88명), 부산대(88명), 전북대(77명) 등이다.치대로는 경북대(42명), 경희대(56명), 조선대(56명), 전북대(28명)가 있다.지난 정부의 교육과학기술부가 2010년 대학이 자율적으로 의·치의학 교육학제를 선택할 수 있게 하는 '의·치의학 교육제도 개선계획'을 발표함에 따라 의·치대와 의·치전원을 병행하는 대학은 2015학년도부터, 의·치전원으로 완전히 전환한 대학은 2017학년도부터 종전 학제인 의·치대로의 전환을 추진하고 있다.현재 고등학교 2학년 이하 학생들은 진학을 고민할 때 늘어나는 의·치대 정원을 염두에 둬야 한다고 입시전문가들은 충고하고 있다. 현재 고 3인 학생도 재수 때 의·치대 진학을 고려 대상으로 삼아야 한다.오종운 이투스청솔 평가이사는 ""현재 고2 학생은 앞으로 8월에 발표될 예정인 2015학년도 대입 전형 계획의 내용을 잘 살펴서 학습 및 지원 계획을 세워야 할 것""이라며 ""특히 상위권 수험생은 의학계열의 대폭적인 정원 확대에 대비해야 한다""고 말했다.pseudojm@yna.co.kr[이 시각 많이 본 기사]☞<아시아나기 사고> ""사고직전 항속 157㎞에 불과""☞소녀시대, 류현진·추신수 맞대결서 애국가 제창☞與정문헌·이철우 '국정원 국조' 특위위원 전격사퇴(종합)☞박인비 캐나다서 4개 대회 연속 우승 도전☞이집트軍 무르시 지지파 발포…70명 사망ㆍ500명 부상(종합3보)▶ 연합뉴스 모바일앱 다운받기▶ 인터랙티브뉴스<저작권자(c)연합뉴스. 무단전재-재배포금지.>"
