,날짜,기사 제목,기사 링크,기사 출처,기사 내용
42,2013-07-23,[현장 리포트 2013 - 학교를 떠난 영어](3) 0세부터 중2까지 사교육 1위 영어,https://news.naver.com/main/read.nhn?mode=LSD&mid=shm&sid1=102&oid=032&aid=0002363072,경향신문,"지난 21일 서울 교보문고 광화문점 어린이 영어책·교재 코너에서 한 아이가 영어책을 가슴에 안고 있다. | 홍도은 기자  hongdo@kyunghyang.comㆍ하루라도, 남보다 더 빨리… 한 살부터 사교육 시장 내몰려 ‘영어 경쟁’“영어가 싫다”는 일곱 살 아이의 말을 듣고 학부모 ㄱ씨는 요즘 걱정이 많아졌다. 아이를 영어유치원도 아닌 일반유치원에 보냈지만 유치원에서 영어수업을 들으면서 싫증을 내기 시작한 것이다. 아이는 영어책을 보는 것도, 영어테이프를 틀어놓는 것도 싫다고 했다.학부모 ㄴ씨도 비슷한 상황에 부딪혀 있다. 여덟 살 아이는 서너 살 때부터 영어동화 CD, 영어책부터 학습지, 학원 수강까지 안 해본 게 없을 정도로 영어 사교육을 받았다. 현재는 영어 말하기대회에 나가거나 영어연극에도 참여할 수 있는 수준이 됐다. 하지만 문제는 아이가 별로 즐거워하지 않는 것이다. 아이는 단어나 문장을 외우는 것은 잘하지만 지루해하면서 “하기 싫다”고 떼를 쓰기 일쑤다. “어려서부터 영어 사교육을 해와서 돈은 돈대로 들었기 때문에 여기서 끊을 수도 없다”는 게 ㄴ씨의 말이다.한국에서 영·유아들의 영어 경쟁은 한 살 때부터 시작되고 있다. 학부모들은 ‘알파벳을 빨리 떼는 것’을 기준으로 아이의 영어능력을 판단하고 있다. “하루라도, 남보다 더 빨리 해야 한다”는 욕심과 강박관념, “다른 아이들은 다 하는데 우리 아이만 뒤처질 것 같다”는 불안감이 아직 한글도 떼지 못한 아이들을 영어 사교육 시장으로 내몰고 있는 것이다.갓난아기 때부터 영어노래, 영어동화 비디오나 테이프를 틀어주는 것은 기본이다. 백화점이나 지역 문화센터의 영·유아 대상 영어수업도 열릴 때마다 신청자가 꽉 찬다. 한 대형마트에서는 20~30개월 영아와 엄마가 놀이를 통해 영어를 익히는 ‘영어 베이비리그’ 프로그램을 운영하고 있다. 16~30개월 영아를 대상으로는 ‘영어까꿍놀이’ 수업이 개설됐다. 영어동화 수업에서는 줄거리를 따라 미술이나 요리 활동을 하면서 영어를 익히고, 영어발레 수업에서는 영어노래를 따라 부르면서 발레의 스트레칭 동작을 배운다. 영어태권도(태글리쉬)나 영어체육(짐글리쉬)도 있다.대부분의 어린이집·유치원들은 특별활동으로 영어수업을 하고 있다. 안순아 사교육걱정없는세상 상담위원은 “유치원이 어학원 허가를 같이 받아 유치원 특별활동으로 편성하면 5만원 정도의 영어수업을 편법적으로 학원에서 하면서 15만원을 받는 곳도 있다”고 말했다.영어유치원의 부작용이 꾸준히 지적됐음에도 고액 영어유치원(유아 대상 영어학원)도 여전히 성행 중이다. 사교육걱정없는세상의 자료를 보면 영어유치원은 전국에 225개가 존재하고 서울 강남지역의 평균 수강료는 183만원에 달했다. 영어 단어·문장 받아쓰기, 영어로 말하기, 영어 문법 등을 기반으로 수학·과학 같은 과목도 영어 교재를 사용해 수업한다. 전 과목을 영어 몰입수업으로 진행하는 한 영어유치원은 “초등학교 3·4학년 과정에서 고등학교 3학년의 영어능력을 취득할 수 있는 것, 청심·영훈·대원 등 국제중학교와 국내외 외국인학교 및 국제학교에 입학하는 것을 목표로 한다”고 밝히고 있다. 안순아 상담위원은 “영·유아 시기의 아이에게는 본인의 호기심에 맞게 환경을 설정해줘야 하는데 영어유치원에서는 단지 영어와 관련된 교구들만 늘어놓고 고르는 것으로 제한돼 정서적 상호작용을 저해하는 측면이 있다”고 말했다. 영어놀이학교나 한글과 영어를 같이 쓰는 이중언어학교 등도 생겨났다.경기도에 사는 학부모 ㄷ씨는 “초등학교 1학년 때 학교에서 영어를 안 배우니까 사교육을 하지 말아야겠다는 생각이 드는 게 아니라 더 조급한 마음이 든다”며 “유치원에서 준비과정을 거치고 1학년 때 영어를 하는 게 적정 시기처럼 돼 버렸다”고 말했다.<이혜리 기자 lhr@kyunghyang.com>[관련기사]▶ 사교육 시킨 부모는 쉬워서, 안 시킨 부모는 어려워서 ‘불만족’▶ 작년 사교육비 19조 중 영어가 6조원으로 최다… 수학·국어 순 지출▶ 서울대 박사과정 텝스 기준은 700점, 유명 사립대 신입생 되려면 900점▶ 학부모 55.8% “영어 때문에 아이와 다툰 적 있다”모바일 경향 [경향 뉴스진|경향신문 앱|모바일웹] | 공식 SNS 계정[경향 트위터][미투데이][페이스북][세상과 경향의 소통 커뮤니티]- ⓒ 경향신문(www.khan.co.kr), 무단전재 및 재배포 금지〈경향신문은 한국온라인신문협회(www.kona.or.kr)의 디지털뉴스이용규칙에 따른 저작권을 행사합니다.〉"
43,2013-07-23,해외 여행 할 때 '원화 결제' 하지 마세요!,https://news.naver.com/main/read.nhn?mode=LSD&mid=shm&sid1=103&oid=055&aid=0000257490,SBS,"- 공항에서 환전하면 손해 -<앵커>상반기 해외 관광객이 700만 명을 돌파해서 사상 최대를 기록했습니다. 이번 여름 휴가철에도 해외 나들이 계획 세운 분들 많겠지요.현금을 환전하거나 해외에서 카드를 쓸 때 손해 보지 않는 법 송욱 기자가 알려드리겠습니다.<기자>여름 휴가철 해외로 나가는 여행객들.공항 환전 수수료가 비싸단 건 알지만 차이가 얼마나 되는진 잘 모릅니다.[박대진/경기도 성남시 : 조금 차이가 난다는 건 알고 있는데 비싸다는 생각은 들지만 급하니까 어쩔 수 없고…]공항에서 환전을 해봤습니다.[공항 환전소 : (1천 달러하고 5천 위안 바꾸려고 하는데요.) 1천 달러는 115만 5천 300원이고요, 5천 위안은 99만 8천 원입니다.]같은 시각 똑같은 금액을 시내 은행에서 바꿔 봤습니다.[시내 은행 : 1천 달러는 원화로 113만 5천 원이고요, 5천 위안은 94만 5천 원 정도 됩니다.]달러는 2만 원, 위안화는 5만 원 차이가 나는데 수수료를 더 깎아주는 인터넷으로 환전하면 차이는 더 벌어집니다.비용을 더 아끼겠다면 일부 금액을 동전으로 환전하는 것도 방법입니다.지폐보다 30% 저렴하기 때문인데, 10달러 지폐를 바꿀 돈으로 13달러어치의 동전을 받을 수 있습니다.[최현호/외환은행 외환업무부 차장 : 싸게 사서 싸게 파는 구조입니다. 영업점에 재고가 한정되어 있기 때문에 사전에 연락을 하셔서 재고를 파악하시고…]해외에서 카드를 사용할 땐 '원화로 결제하겠냐'는 질문에 무심코 동의해선 안 됩니다.'원화결제 서비스'는 3~8%의 수수료가 붙기 때문입니다.[정상구/여행 작가 : 중국이나 동남아 쪽에서 그런 경우가 많았는데요, 원화 결제를 요청하지 않았는데도 자동으로 원화 결제를 해버리는 경우도 있고요.]또 카드사마다 받는 해외 사용 수수료는 신용카드보다 체크카드가 더 높다는 사실도 유념할 필요가 있습니다.(영상취재 : 주 범·김태훈, 영상편집 : 남 일)송욱 기자songxu@sbs.co.kr관/련/정/보◆ '총리 사인 위조' 망신…시장님의 황당 답변◆ 김종학 PD 검찰 수사받았다…영장실질심사 앞두고 숨진 채 발견◆ 뉴욕서 보잉 737기 동체착륙…승객 다쳐◆ 류현진 ""한인 팬들 응원 좋았지만 야유 때는…""◆ 청정 독도? 바닷속에 거대한 쓰레기 산이…☞[SBS기자들의 생생한 취재현장 뒷이야기 '취재파일']☞ SBS뉴스 공식 SNS [SBS8News 트위터] [페이스북] [미투데이] [요즘]저작권자 SBS&SBS콘텐츠허브 무단복제-재배포 금지"
44,2013-07-23,넘겼나 없앴나… ‘노무현 임기말’ 석 달의 진실,https://news.naver.com/main/read.nhn?mode=LSD&mid=shm&sid1=100&oid=032&aid=0002363041,경향신문,"ㆍ“원본·사본 분명히 이관” 참여정부 인사들 주장ㆍ“노 대통령이 폐기 지시” 검찰쪽 주장에 정면 반박2007년 남북정상회담 회의록이 국가기록원에 존재하지 않는 것으로 결론나면서 노무현 정부 임기말 청와대에 이목이 쏠리고 있다. 도대체 회의록은 넘긴 것인가, 폐기한 것인가. 회의록에 무슨 일이 있었는지, 노무현 전 대통령 퇴임 직전 석 달에 진실이 숨어 있다.■ 회의록 생산은 확실2007년 10월3일, 조명균 당시 청와대 안보정책비서관은 평양에서 열린 남북정상회담에 배석했다. 조 비서관은 디지털 녹음기로 회담 전체를 녹음했다. 회담 후 확인해보니 녹음 상태가 좋지 않았다. 청와대는 녹음 복원을 위해 특수장비가 있는 국가정보원에 녹음기를 보냈다.국정원은 일주일 만에 녹취록을 만들었다. 정상회담 회의록 초안 2부를 작성했고 종이문서로 된 1부를 청와대로 보냈다.조 비서관은 이를 토대로 자신이 받아 쓴 메모와 각종 자료를 취합해 최종본을 전자문서로 만들었다. 대통령기록물관리법상 대통령기록물은 전자문서로 생산하도록 의무화돼 있다. 이때가 2007년 12월쯤이다. 김만복 전 국정원장도 회의록 작성 과정에 관여했다.조 비서관은 회의록 최종본을 청와대 전자업무관리시스템인 e지원에 올렸다. 상급자인 백종천 외교안보실장을 거쳐 노 전 대통령에게 보고됐다. 청와대는 국정원에서 받은 초안은 폐기했다.이 같은 생산과 보고 과정은 새누리당도 이견이 없는 부분이다.■ 그 이후 이관이냐 폐기냐 엇갈려노 전 대통령에게 최종 보고된 후 회의록의 행방은 여야 간 주장이 정반대로 갈린다.친노 인사들은 대통령기록관으로 정상적으로 넘겼다는 주장을 굽히지 않고 있다. 노 전 대통령에게 보고한 후 청와대 제1부속실 이창우 행정관은 회의록을 직접 대통령지정기록물로 지정했다고 한다. 이후 이관 작업은 김정호 기록관리비서관이 지휘했다. 기록관리비서관실은 2008년 1~2월 사이에 회의록을 대통령기록관으로 이관했다는 것이다.참여정부 인사들의 말에 따르면 이관 과정은 뚜렷하다. 먼저 e지원시스템상의 대통령지정기록물을 문서변환시스템인 알엠에스(RMS)를 통해 이동형 외장 하드디스크에 담았다. 기록관 측은 이 하드디스크를 대통령기록 보관시스템인 팜스(PAMS)에 업로드했다. 이것이 여야가 찾으려고 했던 회의록 ‘원본’이다. 청와대는 팜스 변환 과정에서 오류가 날 가능성을 우려해 e지원시스템 사본도 하나 더 기록관에 이관했다고 한다.문제는 회의록이 발견되지 않은 점이다. 새누리당은 애초 청와대가 이관하지 않고 폐기했을 것으로 보고 있다. 폐기설은 검찰 쪽에서도 흘러나오고 있다. 노 전 대통령의 지시로 조명균 비서관이 e지원시스템에서 회의록을 삭제했다는 주장이다. 조 비서관이 올해 1월 서해 북방한계선(NLL) 관련 고소·고발 사건에 참고인 자격으로 검찰에 출석해 이런 진술을 했다는 것이다. 회의록이 대통령기록물로 지정되면 후임 대통령이 마음대로 보기 어렵기 때문에 국정원 회의록 1부만 보관하고, 청와대본은 삭제토록 했다는 게 이유다.이를 놓고서는 e지원상에서 삭제가 가능한지부터 엇갈리고 있다. 새누리당에서는 “2008년 1월 외부 용역을 통해 삭제 기능을 추가했다”고 주장한 반면 참여정부 인사들은 “e지원 문서관리 카드는 삭제가 불가능하다”고 말하고 있다. 노무현재단은 이날 보도자료를 내고 “조 비서관이 노무현재단에 밝힌 바에 따르면 대통령으로부터 e지원 보고서를 폐기하라는 어떠한 지시도 받은 바 없고 검찰에서 그런 내용의 진술을 한 바도 없다고 한다”고 밝혔다. 향후 검찰 수사가 이뤄지면 1차적으로 규명돼야 할 부분이다.<강병한 기자 silverman@kyunghyang.com>[관련기사]▶ 문재인의 고육지책 “국민들은 피곤하다… 국정원 국정조사에 집중하자”▶ 여 “검찰 수사로 진실 규명” 야 “부속 자료 열람을”▶ 문재인 “회담 전후 문건 열람해 논란 끝내자”▶ ‘NLL 논란’의 시작과 끝은 국정원▶ ‘원본 행방’ 알고 있을 두 사람, 입 닫고 있다모바일 경향 [경향 뉴스진|경향신문 앱|모바일웹] | 공식 SNS 계정[경향 트위터][미투데이][페이스북][세상과 경향의 소통 커뮤니티]- ⓒ 경향신문(www.khan.co.kr), 무단전재 및 재배포 금지〈경향신문은 한국온라인신문협회(www.kona.or.kr)의 디지털뉴스이용규칙에 따른 저작권을 행사합니다.〉"
45,2013-07-23,“비 오는 날 회 안 먹는 것은 잘못된 상식”,https://news.naver.com/main/read.nhn?mode=LSD&mid=shm&sid1=102&oid=056&aid=0000007385,KBS,"<앵커 멘트>비 오는 날에  생선회를 먹으면  탈이 날 수 있다는 속설 때문에 요즘같은  장마철만 되면  횟집들은 울상인데요.비올 때 회 먹지 말라는 건 다 근거 없는 낭설이라고 합니다.김영은 기자가 전문가의 의견을 들어봤습니다.<리포트>여름 휴가철을 맞아  손님들로 한창 붐벼야할 횟집거리지만 이곳을 찾는 발길은 뚝 끊겼습니다.다른 곳도 사정은 비슷합니다.점심 시간인데도 음식점이 텅 비었습니다.비가 내리는 날에  회를 먹으면 자칫 탈이 난다는  속설 탓이 큽니다.<인터뷰> 함창원(경기 의정부시 호원동) : ""비브리오균이라든가 뭐 그런 거라던데, 아무래도 여론이 그러니까 안 먹게 되죠.""성수기인데도  지루한 장마에 궂은 날씨가 이어지면서  이달 강원 동해안 횟집 매출은   급감했습니다.<인터뷰> 한인선(횟집 운영) : ""(매출이) 반 정도 줄었어요. 원래 이 때 손님이 많을 시기인데 비온다고 예약도 취소되고….""오래전부터 입에 입을 건너 전해진, 궂은 날에 생선회를 먹지 말아야  한다는 것은  속설이라고 전문가는 말합니다.<인터뷰> 남명모(국립수산과학원 동해수산연구소 박사) : ""살아있는 활어의 위생상태는 장마철의 습한 기후에도 영향을 받지 않기 때문에 드셔도 이상이 없습니다.""전문가들은  흔히 생선회의 위험성을 이야기할 때 언급되는 비브리오 균의 경우  생선 표면에 기생하기 때문에  위생적인 도구로 회를 떴다면 안심하고 먹어도 좋다고 강조합니다.KBS 뉴스 김영은입니다.김영은[관련기사]▶ ‘중복’ 대형마트 닭 세일…양계농가 눈물▶ 홍명보호 첫골! 첫승! 사냥 ‘공한증 깨운다’▶ 북한도 수해로 타격…“안주시 80% 침수”▶ “비 오는 날 회 안 먹는 것은 잘못된 상식”▶ 암 이긴 한수지 ‘공격하는 세터’로 변신▶  KBS뉴스 SNS -[트위터][페이스북][미투데이][저작권자ⓒ KBS(www.kbsnews.com) 무단복제-재배포 금지]"
46,2013-07-23,6천 원짜리 약재가 600만 원? 노인 등쳤다,https://news.naver.com/main/read.nhn?mode=LSD&mid=shm&sid1=102&oid=055&aid=0000257493,SBS,"<앵커>중국산 약재를 특효약으로 속여 사기를 친 일당이 붙잡혔습니다. 노인분들에게 6천 원짜리 값싼 약재를 1천 배 부플린 600만 원에 팔았습니다.김학휘 기자입니다.<기자>한 남성이 은행 창구로 할머니를 데려옵니다.할머니는 600만 원을 찾아 남성에게 건넵니다.관절에 특효가 있는 희귀 약재라며 600만 원을 받아 챙겼지만, 사실은 시중에서 6천 원이면 살 수 있는 중국산 '구척'이라는 약재입니다.[김 모 씨/피해자 : 신호등에 길을 건너려고 섰는데요. 쓰러진 사람이 못 일어났을 때 그 약을 달여먹으면 한 달 후에 통증이 가라앉는다고 (하면서 접근했어요.)]63살 김 모 씨 등 2명은 이런 수법으로 노인 5명에게 1천 100여만 원을 받아 챙겼습니다.[김 모 씨/피의자 : 300그램에 1만 원인데 300만 원에 팔았습니다. 생활이 여의치 않아서 한 번만 하려다가 이렇게 됐습니다.]대부분 약재상에서 값싸게 파는 중국산 약재입니다.[약재상 : 쉽게 살 수 있는 겁니다. 그렇게 비싼 약재가 아니고.(한 봉지에 얼마라고요?) 6천 원이라고 말씀드렸잖아요.]경찰은 김 씨 등 2명을 구속하고 또 다른 피해자가 있는지 수사하고 있습니다.(영상취재 : 박동률·설치환, 영상편집 : 박춘배)김학휘 기자hwi@sbs.co.kr관/련/정/보◆ '총리 사인 위조' 망신…시장님의 황당 답변◆ 김종학 PD 검찰 수사받았다…영장실질심사 앞두고 숨진 채 발견◆ 뉴욕서 보잉 737기 동체착륙…승객 다쳐◆ 류현진 ""한인 팬들 응원 좋았지만 야유 때는…""◆ 청정 독도? 바닷속에 거대한 쓰레기 산이…☞[SBS기자들의 생생한 취재현장 뒷이야기 '취재파일']☞ SBS뉴스 공식 SNS [SBS8News 트위터] [페이스북] [미투데이] [요즘]저작권자 SBS&SBS콘텐츠허브 무단복제-재배포 금지"
47,2013-07-23,[앵커&리포트] ‘증거 없이 은밀하게’ 학교폭력의 진화,https://news.naver.com/main/read.nhn?mode=LSD&mid=shm&sid1=102&oid=056&aid=0000007373,KBS,"<앵커 멘트>정부가 학교폭력  종합대책을 내놨습니다.가해자를 찾아내고  피해자를 보살피는 데서 예방으로 관심을 옮긴게  특징입니다.학생들은 역할극이나  음악 미술을 통해서 학교폭력 예방프로그램인 어울림에 참여해야합니다.정규 교과과정에  학교폭력 예방교육을  넣겠다는 겁니다.이렇게 학교폭력 대책의  큰 방향을 튼 이유 아마도 학교폭력을 강제적으로 근절시키기  어렵다고 보기때문일겁니다.학교폭력의 변화, 그 실태를 이승준 기자가 보도합니다.<리포트>은 모 씨는 지난 연말 고3이던 딸을 잃었습니다.'새 사람을 만나기가 두렵다'는 유서를 남기고 투신한 겁니다.집단욕설이 시작된 중2때 이미 학교와 경찰에 알렸지만 소용이 없었습니다.증거를 찾기 힘들었다고 합니다.<녹취> 은 모 씨(학폭 피해자) : ""아버지 선생님들은 아무 조치가 없었어요. 그 때부터도 이어진거죠. 가해학생들은 자기한테 처벌이나 이런게 없으니까...""김 모군 역시  2년 동안 친구의 협박을 받아오다 지난해 학교를 그만뒀습니다.가해자들 상당수는 아직 학교를 다니고 있습니다.<녹취> 피해 학생 : ""차라리 드러내고 이렇게 맞고 그랬으면 일이 빨리 끝났을텐데 안드러내고 이렇게 맞았단 증거도 없고...""지난 일년 동안 학교 폭력으로 검거된 학생은  40% 정도 줄었습니다.하지만 폭행 등은 줄어든데 반해 협박은 30%, 욕설은 3배 가까이 늘었습니다.온라인 상의 폭력은 5배나 늘었습니다.<인터뷰> 전문가 : ""가해자가 가책이 적고, 가해가 지속적으로 이뤄질 수 있다는 측면에서 피해자 입장에서는 훨씬 고통이 심할 수 있는 폭력..""정부는 그래서 '교우관계 회복기간제' 같은 대책을 내놨습니다.전보다 구체적이다!, 아니다 기존대책의 재탕일 뿐이라는 반응이 함께 나옵니다.만연한 무형의 학교폭력을 저지하는데 효과를 보일지,아직은 미지숩니다.KBS 뉴스 이승준입니다.이승준[관련기사]▶ ‘중복’ 대형마트 닭 세일…양계농가 눈물▶ 홍명보호 첫골! 첫승! 사냥 ‘공한증 깨운다’▶ 북한도 수해로 타격…“안주시 80% 침수”▶ “비 오는 날 회 안 먹는 것은 잘못된 상식”▶ 암 이긴 한수지 ‘공격하는 세터’로 변신▶  KBS뉴스 SNS -[트위터][페이스북][미투데이][저작권자ⓒ KBS(www.kbsnews.com) 무단복제-재배포 금지]"
48,2013-07-23,‘중복’ 대형마트 닭 세일…양계농가 눈물,https://news.naver.com/main/read.nhn?mode=LSD&mid=shm&sid1=101&oid=056&aid=0000007383,KBS,"<앵커 멘트>오늘이 중복인데 삼계탕 많이들  드셨습니까?대형 마트에서도 닭을 많이 팔고 있어 양계 농가로서는  요즘이 소득을 가장  많이 올릴 수 있는  시기입니다.그렇다면  양계 농가들이 당연히  신이나야 할 텐데, 현실은 그렇지 않다고 합니다.뭐가 문젤까요?홍혜림 기자가  취재했습니다.<리포트>대형 마트 식품 매장에 사람들이 몰려 있습니다.다른 마트에서는 만 2, 3천원 하는 토종닭을 이곳에선 절반 가격에 팔고 있습니다.<인터뷰> 한관섭(서울 문래동) : ""굉장히 저렴하네요.보통 토종닭이 만 원 이상 하거든요. 6천 9백 원이면  저렴한 편이죠.""닭이 이렇게 싼 이유는 마트가 농가측으로부터  마리당 6천 5백 원에 닭을 납품받았기 때문입니다.농가측은  다른 마트나 재래시장에 납품할 경우 8천 원을 받습니다.천5백 원이나 싸게 납품을 하고 있는 겁니다.마트측 요구로  싼 가격에 납품하고 있지만, 거래를 계속하기 위해서는  어쩔 수 없다고 농가측은 주장합니다.<녹취> 양계 농가측 관계자(음성변조) : ""이번 상황이 뒤틀리면 계속 연중으로  이어지니까 울며 겨자먹기로 하는게 많죠""농가측은 생산 원가를 밑도는 가격으로, 이달 내내 납품하다 보니 손해가 크다고 주장합니다.납품할수록 손해다 보니 생산을 포기한 농가까지  나오고 있다고 하소연합니다.<인터뷰> 유승림(양계 농가) : ""수지타산을 못 맞추다 보니까 저희는 복중에 놀게 되고 그런 악순환이 계속 되고 있는 것 같아요.""마트측은 닭소비가 많은 삼복을 앞두고  농가와 미리 계약해  단가를 낮췄을 뿐, 낮은 가격을  강요하지 않았다고 주장합니다.<녹취> 마트관계자(음성변조) : ""마진을 낮춰가면서 고객을 오게끔하는 마케팅 노력같은 것들이 있는 거죠.""공정거래위원회는  해당 마트를 포함한  대형 유통업체를 상대로 이런 판촉행사에 저가 납품을  강요했는지 조사하겠다고 밝혔습니다.KBS 뉴스 홍혜림입니다.홍혜림[관련기사]▶ ‘중복’ 대형마트 닭 세일…양계농가 눈물▶ 홍명보호 첫골! 첫승! 사냥 ‘공한증 깨운다’▶ 북한도 수해로 타격…“안주시 80% 침수”▶ “비 오는 날 회 안 먹는 것은 잘못된 상식”▶ 암 이긴 한수지 ‘공격하는 세터’로 변신▶  KBS뉴스 SNS -[트위터][페이스북][미투데이][저작권자ⓒ KBS(www.kbsnews.com) 무단복제-재배포 금지]"
