,날짜,기사 제목,기사 링크,기사 출처,기사 내용
81,2013-07-08,어른들은 밥먹다 스마트폰 하면 왜 화낼까?,https://news.naver.com/main/read.nhn?mode=LSD&mid=shm&sid1=105&oid=031&aid=0000296180,아이뉴스24,"<아이뉴스24>[김익현기자] ""어른들은 왜 식사 중 스마트폰을 사용하면 무례하다고 생각할까?""스마트폰 사용 문제는 어느 가정에서나 골치덩이다. 시도 때도 없이 스마트폰 화면을 들여다보는 자녀들을 못마땅하게 생각하는 부모들이 적지 않다. 특히 식사 시간이나 대화 중에 스마트폰을 들여다볼 경우 예의가 없다고 생각하기도 한다.왜 이런 세대 차이가 생기는 걸까?비즈니스인사이더는 6일(현지 시간) 서베이 멍키 조사 자료를 토대로 중년들은 여전히 유선 전화 시대의 에티켓을 표준으로 생각하고 있기 때문이라고 전했다. 서베이 멍키는 45세~60세 사이 미국인 168명을 대상으로 조사한 결과 이 같은 결론에 도달했다고 밝혔다.◆페이스북-문자 이용에 특히 부정적우선 식사 중 전화 통화. 이번 조사에 응한 중년들 중 35.12%는 '식사 중 전화 통화는 절대 용납할 수 없다""고 응답했다. 세 명 중 한 명 정도가 식사 중엔 전화 통화를 절대 해선 안 된다고 생각하고 있는 셈이다.반면 서베이 멍키가 18~29세 연령층을 대상으로 조사한 결과에선 '식사 중 통화는 안 된다'는 비율이 15.32%에 불과했다. 반면 18~29세 연령층 절반 이상(54.95%)은 '식사 중 전화 통화는 어느 정도 용납할 수 있다'고 응답했다.중년층들이 특히 반감을 갖고 있는 것은 식사 중 페이스북을 확인하거나 문자 메시지를 보내는 행위였다. 이번 조사 결과 45세 이상 연령층 중 83.93%는 '식사 중 페이스북 확인은 절대 용납할 수 없다'고 응답했다. 절대 다수가 식사 중 페이스북을 하는 행위를 받아들일 수 없다고 응답한 셈이다.문자 메시지도 마찬가지였다. 45세 이상 중년층 중 식사 시간에 문자 메시지 읽는 것을 용납할 수 없다고 응답한 비율은 65.48%에 달했다. 페이스북 만큼은 아니지만 문자 메시지를 읽는 행위에 대해서도 부정적인 입장을 견지하고 있는 셈이다.또 데이트 상대와 식사 중 개인적인 통화를 하는 걸 용납할 수 없다는 응답도 60%가 넘었다. 심지어 데이트 상대와 식사 중일 경우엔 업무상 통화도 해선 안 된다고 생각하는 비율이 43.45%에 달했다.그럼 데이트 중 페이스북을 하는 것에 대해선 어떻게 생각할까? 역시 중년들의 반응은 싸늘했다. 이번 조사 결과 '절대 용납할 수 없다'고 답변한 사람이 57.14%에 달했다. 문제는 용납할 수 있다고 한 답변이다. 이 중 35.12%는 '데이트 상대가 화장실에 있을 경우에 한해' 페이스북 사용을 용납할 수 있다고 응답했다.사실상 90% 이상이 데이트를 할 때는 페이스북 할 엄두조차 내선 안 된다는 생각을 갖고 있는 셈이다. 중년들은 문자 메시지에 대해서도 비슷한 생각을 갖고 있는 것으로 나타났다.◆20대는 상대적으로 너그러운 편반면 서베이 멍키가 이전에 18~29세를 대상으로 조사한 결과는 사뭇 다르다. 식사 중에 페이스북을 확인하거나 문자 메시지를 읽는 등의 행위에 대해 절대 용납할 수 없다는 답변이 45%, 23%에 불과했다.18~29세 그룹에서도 데이트 중 개인적인 통화를 하는 걸 용납할 수 없다고 응답한 비율은 60% 정도로 높은 편이었다. 하지만 데이트 중 페이스북 하는 걸 용납할 수 없다는 응답은 28.83%로 뚝 떨어진다.이번 조사 결과 신세대와 중년들은 특히 식사나 데이트 중 SNS 허용 여부에 대해 극명하게 다른 생각을 갖고 있는 것으로 나타났다. 서베이 멍키가 지적한 것처럼 45세 이상 중년층은 여전히 유선 전화 시대의 에티켓을 중요하게 받아들이고 있는 셈이다.이번 조사 결과 45세 이상 중년층과 29세 이하 신세대는 특히 SNS 사용 문제에 대해선 '화성 남자, 금성 여자' 정도 생각 차이를 갖고 있는 것으로 나타났다. 그러니 부모들이 자녀들을 무례하다고 생각하는 것도 무리는 아닌 것 같다./김익현기자sini@inews24.com[관련기사]▶스마트폰 시장 침체되니 중고 거래도 뜸하네"
82,2013-07-08,중부 내일까지 100mm 비 더 온다…피해 우려,https://news.naver.com/main/read.nhn?mode=LSD&mid=shm&sid1=115&oid=055&aid=0000256370,SBS,"<앵커>장마전선이 북상하면서 중부지방 곳곳에 강한 비가 이어지고 있습니다. 서울 등 중서부지방에는 내일(9일)까지 100mm가 넘는 국지성 호우가 예상돼 피해가 우려됩니다.보도에 공항진 기자입니다.<기자>중부지방까지 북상한 장마전선을 따라 발달한 비구름이 계속 다가서면서 많은 비를 뿌리고 있습니다.경기 북부와 강원영서 북부에 호우주의보가 발효 중인 가운데 서울 경기와 충남 서해안에는 천둥 번개를 동반한 시간당 20mm 안팎의 강한 비가 이어지고 있습니다.지금까지 김포에는 140mm가 넘는 폭우가 쏟아졌고, 문산과 강화 등에도 100mm 안팎의 많은 비가 내렸습니다.오늘 중북부지방은 장마전선의 영향을 계속 받아 낮까지 강한 비가 이어질 것으로 전망됩니다.서울 경기와 강원영서지방에는 30에서 70mm가량의 비가 더 오겠고 100mm가 넘는 집중호우가 쏟아지는 곳도 있겠습니다.기상청은 그동안 내린 많은 비로 지반이 약해진 상태여서 산사태나 축대 붕괴 등 피해가 우려된다며 철저한 대비를 당부했습니다.중부지방의 비는 늦은 오후에 잠시 주춤했다가 밤부터 내일 오전까지 다시 강하게 이어질 것으로 전망됩니다.그러나 남부지방은 당분간 장마전선의 영향권에서 벗어날 것으로 보여 낮 기온이 30도를 웃도는 무더운 날씨가 계속되겠습니다.영남 내륙과 동해안에는 폭염주의보가 내려졌습니다.공항진 기자zero@sbs.co.kr관/련/정/보◆ ""숨진 中 여고생, 구조차량에 치였을 가능성""◆ [영상] 아시아나기 충돌 '공포의 10초' 첫 공개◆ ""그녀는 영웅이었다"" 사고기 女승무원 극찬◆ ""사고 직전 비행 속도 느렸다…다시 기수 상승""◆ 김무열 측 ""소송 목적, 복무 취소 아니다…항소 없다""☞[SBS기자들의 생생한 취재현장 뒷이야기 '취재파일']☞ SBS뉴스 공식 SNS [SBS8News 트위터] [페이스북] [미투데이] [요즘]저작권자 SBS&SBS콘텐츠허브 무단복제-재배포 금지"
83,2013-07-08,"미군병사, 택시비 승강이 기사 폭행",https://news.naver.com/main/read.nhn?mode=LSD&mid=shm&sid1=100&oid=001&aid=0006358868,연합뉴스,"(서울=연합뉴스) 김연숙 기자 = 서울 마포경찰서는 택시비 문제로 승강이를 벌이다 기사를 때린 혐의(폭행)로 미군 D이병(20)을 불구속 입건했다고 8일 밝혔다.경찰에 따르면 주한미군 군산기지 소속 D이병은 지난 7일 0시 30분께 서울 서교동 도로에서 택시기사 이모(50)씨와 요금 문제로 다투다 이씨의 목을 두 차례 친 혐의를 받고 있다.D이병은 일행 한 명과 함께 강남 논현동에서 택시를 타고 홍익대 정문 근처에 도착, 택시비 1만8천500원을 내지 않고 내린 것으로 조사됐다.인근 지역에 택시를 세우고 D이병 일행을 쫓아간 이씨는 5∼10분 후 D이병과 마주쳤다.이씨는 D이병의 허리춤을 잡고 택시비를 요구했으며 이 과정에서 몸싸움이 벌어졌다. D이병은 술은 마시지 않은 것으로 확인됐다.경찰 관계자는 ""D이병은 '현금이 없으니 현금자동입출금기(ATM)에서 돈을 뽑아 택시비로 주려했다'고 주장했다""며 ""이씨와 의사소통과정에서 불거진 문제로 보인다""고 말했다.경찰은 조사를 마친 뒤 한미 주둔군지위협정(SOFA)에 따라 D이병의 신병을 미군 헌병대에 인계했다.nomad@yna.co.kr[이 시각 많이 본 기사]☞<인터뷰> 아시아나 승무원 ""승객대피 생각에 생명위협 못느껴""☞박은혜, SBS 아침극 '두 여자의 방' 주연☞<아시아나기 사고> 기장, B777 운항경력 9차례·43시간☞<축구협회 기성용 징계 여부 놓고 '신중모드'>☞국토부 ""아시아나 동체 꼬리 방파제 턱 충돌 확인""▶ 연합뉴스 모바일앱 다운받기▶ 인터랙티브뉴스<저작권자(c)연합뉴스. 무단전재-재배포금지.>"
84,2013-07-08,"""태풍땐 유리창에 신문지보다 창틀에 테이프가 효과""",https://news.naver.com/main/read.nhn?mode=LSD&mid=shm&sid1=103&oid=001&aid=0006358918,연합뉴스,"국립재난안전연구원 실험결과…""창틀과 유리 사이 벌어지지 않게""(서울=연합뉴스) 이 율 기자 = 태풍이 올 때 유리창 파손을 방지하려면 테이프를 창틀에 붙이는 게 효과적이라는 실험결과가 나왔다.국립재난안전연구원은 8일 큰 태풍과 맞먹는 초속 50m의 강풍기를 이용해 유리창 파손 실험을 한 결과, 유리창에 젖은 신문지를 붙이거나 테이프를 엑스(X)자로 붙이는 것보다 유리와 창틀 이음매에 테이프를 붙이는 게 더 효과적인 것으로 나타났다고 밝혔다.박병철 연구관은 ""강풍에 의한 유리창 파손은 창틀과 유리 사이가 벌어져 유리창이 흔들리면서 발생하는 것으로 유리 자체보다는 창틀에 크게 좌우되는 것으로 나타났다""고 지적했다.젖은 신문지는 마르지 않도록 물을 계속 뿌려줘야 하고, 테이프를 유리창에 엑스자 형태로 붙이는 것도 큰 효과는 없었다고 연구원은 설명했다.특히 유리창틀 자체의 강도가 약하거나 창틀과 유리창 사이가 벌어져 있는 경우 기존 예방법에 의한 파손예방 효과는 미미한 것으로 분석됐다.박 연구관은 ""가장 효과적인 예방법은 비규격, 노후 창틀은 즉시 교체하거나 창문을 창틀에 단단하게 고정해 벌어지지 않도록 하는 것""이라며 ""특히 실리콘이 벗겨진 창틀은 테이프로 고정하는 게 좋다""고 강조했다.연구원은 또 유리창이 깨지면서 생긴 파편에 의한 인명·재산피해를 방지하기 위해 유리창에 안전필름을 부착하는 것도 고려해야 한다고 덧붙였다.yulsid@yna.co.kr[이 시각 많이 본 기사]☞<아시아나기 사고> ""공항 착륙유도장치 꺼져있었다""☞MBC '금 나와라 뚝딱' 시청률 20% 돌파☞<아시아나기 사고> ""조종사 과실 가능성에 초점""☞-U20월드컵- 한국 축구, U-20 월드컵 4강행 좌절(종합)☞<아시아나기 사고> ""공항 착륙유도장치 꺼져있었다""(종합)▶ 연합뉴스 모바일앱 다운받기▶ 인터랙티브뉴스<저작권자(c)연합뉴스. 무단전재-재배포금지.>"
85,2013-07-08,"원세훈측 ""선거법위반 전제부터 인정 못해""",https://news.naver.com/main/read.nhn?mode=LSD&mid=shm&sid1=102&oid=001&aid=0006358964,연합뉴스,"원세훈전 국정원장 (자료사진)재판부, 공소장 변경 검토 요청…국정조사 고려해 공판 늦추기로(서울=연합뉴스) 김계연 기자 = 직원들에게 선거개입을 지시한 혐의로 기소된 원세훈 전 국가정보원장이 혐의를 전면 부인하면서 치열한 법정공방을 예고했다.8일 서울중앙지법 형사합의21부(이범균 부장판사) 심리로 열린 첫 공판준비기일에서 원 전 원장 측 변호인은 ""공소사실을 모두 부인한다""면서 공소장에 범죄사실의 기본전제로 포함된 이른바 '국가정보원 운영방침'에 대해서도 동의할 수 없다고 밝혔다.검찰은 공소장에 '원 전 원장이 행정안전부 장관 시절 촛불 사태에 제대로 대처하지 못해 반 대한민국 세력에 맞서는 사이버 활동이 필요하다고 판단했다'거나 '직원들에게 국정원의 직무를 넘어 사이버 공간에서까지 정치적 활동을 하는 것이 가능하다는 그릇된 인식을 심어줬다'는 취지의 '국가정보원 운영방침'을 공소사실의 기본전제로 적시했다.변호인은 ""공소사실 가운데 불법 선거운동과 정치활동 관여 행위의 시기와 내용이 달라 상상적 경합으로 볼 수 있는지 의문""이라고 밝혀 양측이 법리를 둘러싸고도 팽팽하게 맞설 것으로 전망된다.재판부도 변호인의 의견을 받아들여 검찰에 공소장 변경을 검토해달라고 요청했다.이와 관련, 검찰은 원 전 원장의 불법 행위가 여러 범죄 구성요건을 이루는 '상상적 경합'에 해당한다고 보고 선거법 위반과 국정원법 위반 혐의를 동시에 적용한 바 있다.상상적 경합이란 하나의 행위가 여러 범죄에 해당하는 경우를 가리킨다. 이런 경우 '행위의 동일성·단일성'이 인정돼야 한다.재판부는 국정원의 정치개입 사건에 대한 국회의 국정조사가 진행중인 점을 고려해 본격적인 재판을 다소 늦추는 방안을 검토하겠다고 밝혔다.이에 따라 원 전 원장이 피고인 신분으로 법정에 출석하는 첫 재판은 8월 중순 이후에 열릴 것으로 전망된다.재판부는 오는 22일 오전 11시 두 번째 공판준비기일을 열어 쟁점을 구체적으로 정리하고 증인신문 계획을 세울 예정이다.dada@yna.co.kr[이 시각 많이 본 기사]☞<아시아나기 사고> ""공항 착륙유도장치 꺼져있었다""☞MBC '금 나와라 뚝딱' 시청률 20% 돌파☞<아시아나기 사고> ""조종사 과실 가능성에 초점""☞-U20월드컵- 한국 축구, U-20 월드컵 4강행 좌절(종합)☞<아시아나기 사고> ""공항 착륙유도장치 꺼져있었다""(종합)▶ 연합뉴스 모바일앱 다운받기▶ 인터랙티브뉴스<저작권자(c)연합뉴스. 무단전재-재배포금지.>"
86,2013-07-08,"법원 ""혼자 서 있다가 넘어져도 업무상 재해""",https://news.naver.com/main/read.nhn?mode=LSD&mid=shm&sid1=102&oid=001&aid=0006358932,연합뉴스,"서울행정법원<<연합뉴스DB>>(서울=연합뉴스) 한지훈 기자 = 혼자 서 있다가 갑자기 중심을 잃고 넘어져 뇌출혈로 사망했더라도 근무시간 중에 업무공간에서 벌어진 일이라면 업무상 재해로 봐야 한다고 법원이 판결했다.서울행정법원 행정4부(최주영 부장판사)는 경비원 임모씨의 부인 김모씨가 ""유족급여와 장의비를 지급하지 않기로 한 처분을 취소하라""며 근로복지공단을 상대로 낸 소송에서 원고 승소로 판결했다고 8일 밝혔다.서울 마포자원회수시설에서 경비원으로 근무하던 임씨는 2011년 9월 어느 날 퇴근을 앞두고 경비실과 복도 사이에 있는 2개짜리 계단에서 뒤로 넘어져 다친 뒤 3개월 동안 치료를 받았으나 사망했다.부인 김씨는 근로복지공단이 혼자 서 있다가 넘어진 사고는 업무 관련성이 없고 사고 당시 시설물에 결함도 없었다며 유족급여 및 장의비 청구를 받아들이지 않자 소송을 냈다.재판부는 ""임씨의 과실이 있었다고 하더라도 이 사건의 사고는 사용자의 지배에 따라 임씨가 업무수행을 하면서 통상적으로 활동하던 중에 발생한 것이었다""며 김씨 손을 들어줬다.hanjh@yna.co.kr[이 시각 많이 본 기사]☞<아시아나기 사고> ""공항 착륙유도장치 꺼져있었다""(종합)☞배우 유호린, 동갑내기 회사원과 10월 결혼☞<아시아나기 사고> 기장, B777 운항경력 9차례·43시간☞-U20월드컵- 한국, 이라크에 막혀 U-20 월드컵 4강 좌절(종합2보)☞국토부 ""아시아나 동체 꼬리 방파제 턱 충돌 확인""▶ 연합뉴스 모바일앱 다운받기▶ 인터랙티브뉴스<저작권자(c)연합뉴스. 무단전재-재배포금지.>"
87,2013-07-08,호우특보... 중부지방 돌풍·천둥·번개 동반한 강한 비,https://news.naver.com/main/read.nhn?mode=LSD&mid=shm&sid1=103&oid=008&aid=0003078697,머니투데이,"[머니투데이 이슈팀 정소라 기자]특보 / 사진=기상청8일 오전10시 기준으로 경기북부, 강원영서에 호우특보가 발효 중인 가운데 서울경기와 강원영서내륙, 충남지역에 비가 오고 있다. 경기 및 충남서해안에는 시간당 20mm 내외의 강한 비가 내리는 곳도 있다.서해상에서 발달한 비구름대가 빠르게 북동진하고 있어, 8일 오전부터 낮 사이에는 중부지방에 돌풍, 천둥, 번개를 동반한 시간당 30mm 이상의 강한 비와 함께 국지적으로 많은 비가 오는 곳이 있겠다.7호 태풍 솔릭 예상 이동 경로 / 사진=기상청한편, 8일 오전9시 괌 북쪽 약 640km 부근 해상에서 발생한 제 7호 태풍 솔릭은 현재 소형태풍으로 서쪽방향으로 진행 중이다.중심기압 1000hPa, 최대풍속 65km/h인 이 태풍은 10일 일본 오키나와 남동쪽 약 950km 부근 해상을 지나 11일 타이완 타이베이 동남동쪽 약 960km 부근 해상으로 이동하면서 중형태풍으로 발달할 것으로 예상된다.[머니투데이 핫뉴스]☞해나, 오늘 새벽 사망...PD ""해나는 자유가 됐습니다""☞고준희 2년 전, 노출 화보에서 섹시미 뽐내 '눈길'☞탑승객 ""눈물범벅 소녀같은 승무원이 등에업고…""☞이혁재 사업실패 고백, ""아내에게 미안"" 눈물☞정현, 오늘 밤 韓선수 최초 윔블던 주니어 우승 도전[오늘의 HOT포토][스페셜 포토][손안의 경제뉴스 머니투데이 모바일웹]이슈팀 정소라기자 sorahanel@<저작권자 ⓒ '돈이 보이는 리얼타임 뉴스' 머니투데이, 무단전재 및 재배포 금지>"
88,2013-07-08,'밀어내기' 남양유업에 '철퇴'…과징금 123억원,https://news.naver.com/main/read.nhn?mode=LSD&mid=shm&sid1=101&oid=031&aid=0000296173,아이뉴스24,"<아이뉴스24>[유주영기자] 지난 5월 '불법 밀어내기' 등의 파문으로 우리 사회에 '갑을 논란'을 불러왔던 남양유업에 대해 공정거래위원회가 '철퇴'를 가했다.공정거래위원회(위원장 노대래)는 우월적 지위를 남용해 대리점에 제품 구입을 강제하고 대형 유통업체에 파견한 자사 직원의 임금마저 전가한 남양유업에 대해 시정 명령을 내리는 한편 총 123억 원의 과징금을 부과하기로 했다고 8일 발표했다.공정위는 특히 위원회 심의를 거쳐 남양의 불법 사례를 검찰에 추가 고발하기로 했다.이날 공정위에 따르면, 남양유업은 2007년부터 2013년 5월까지 1천849개 대리점 대부분에 유통기한이 임박한 제품이나 대리점이 주문하지 않거나 취급하지 않는 제품 등을 강제로 할당하고 임의로 공급하는 등 '부당한 밀어내기' 관련 법을 위반했다.이렇게 밀어낸 물량은 전체 대리점 공급량 대비 20~35% 수준인 것으로 나타났다.예를 들어 떠먹는 불가리스 유기농의 경우 매주 최소 1천600박스씩 생산됐으나 대리점의 일 평균주문량은 130박스에 불과해 밀어내기 수준을 짐작케 했다.남양유업은 대리점 주문 마감 후 영업사원이 주문량을 임의 수정하는 방식을 쓰거나 본사→지점→대리점으로 연결되는 판매목표 설정 및 주문량 할당 등의 방식으로 밀어내기를 시도했다.특히 2010년 9월부터 대리점이 접속하는 주문시스템(PAMS21)을 변경해 대리점의 최초 주문량 등을 검색할 수 없도록 한 것으로 나타났다. 이를 통해 회사 주문담당자가 대리점의 최종 주문량을 손쉽게 임의로 수정했다는 것이 공정위의 설명이다.남양유업은 게다가 엄격한 반품 제한 정책을 펼쳐고 대리점들은 밀어내기로 떠안은 물량을 반품하지 못해 지인판매·덤핑·폐기처분 등으로 소화한 것으로 알려졌다.불가리스 키즈·저지방우유 등 대리점 취급기피 및 비인기 품목, 유통기한이 임박한 제품, 이오·프렌치카페 등 신규출시 후 매출주력품목 등 26개 품목에 대해 밀어내기가 발생했다.남양유업은 특히 법률 자문과 내부 검토 등을 통해 대리점에 대한 임의적 주문 할당이 위법한 구입강제에 해당됨을 인식했으면서도 이를 개선하지 않았다고 공정위는 설명했다.남양유업은 또 이마트 등 대형 유통업체에 파견한 진열 판촉 사원의 임금을 대리점과 사전 합의 없이 50% 이상 전가해 '부당한 이익제공강요' 행위도 서슴지 않았다.2012년의 경우 대형 유통업체에 총 397명의 진열 판촉 사원이 파견되었고 대리점이 진열 판촉 사원 급여의 평균 63%를 부담하게 했다. 2012년 남양유업의 급여분담율은 33~41%(대리점은 59~67%)로 진열판촉사원의 급여 분담율은 점포 매출과 연동하여 변동했다.이번 공정위의 조치는 공정거래법 제23조 제1항 제4호를 적용한 것으로, 거래상대방에게 구입의사 없는 상품의 구입을 강제하는 행위 및 자신이 부담하여야 할 비용을 전가하는 행위는 거래상지위남용행위 중 가목(구입강제)과 나목(이익제공강요)에 해당한다.공정위는 시정명령을 통해 밀어내기 및 진열판촉사원 임금 전가행위를 금지하도록 했다. 또 대리점 최초 주문기록, 변경주문기록 및 사유, 최종주문량 등이 나타나도록 주문시스템을 변경하고 주문기록 등은 5년 간 보존토록했다. 특히 90일 내 변경 후 공정위에 보고하도록 했다.또 대리점에 공급한 물품대금 결제시 제품 주문량·공급량 및 대금 산정근거 등을 대리점이 확인·승인한 후 대금 지급이 이루어지도록 결제방식을 변경하고 그 내용을 공정위 보고하고 진열판촉사원 임금 분담 시에는 분담비율 등을 대리점과 사전협의 후 계약서에 명기하도록 했다.한편 공정위는 남양유업 관련 임직원에 대해서는 검찰의 수사결과 및 고발요청 등의 내용을 검토하고, 위원회 내부의 심의를 거쳐 추가 검찰고발 예정이다.공정위는 ""이번 사건은 갑을 관계에서의 불공정 관행에 대한 개선이 사회적 이슈가 되고 있는 상황에서 신속한 조사를 통해 엄중한 법 집행이 이루어졌다는 점에 의의가 있다""고 말했다./유주영기자boa@inews24.com[관련기사]▶남양유업, 5월 욕설사태 이후 6월 매출 '뚝'"
