,날짜,기사 제목,기사 링크,기사 출처,기사 내용
0,2013-07-07,갈비뼈 부러진 채 50명 대피시킨 남성 '감동',https://news.naver.com/main/read.nhn?mode=LSD&mid=shm&sid1=104&oid=055&aid=0000256317,SBS,"<앵커>탑승객 중에는 갈비뼈가 부러지는 부상을 입고도 50명이 넘는 사람들의 대피를 도운 남성이 있습니다.정윤식 기자가 보도합니다.<기자>사고 비행기에 타고 있던 39살 벤자민 레비라는 남성이 자신의 트위터에 올린 사진입니다.침대에 누운 모습이 영락없는 환지지만 다른 사진에서는 엄지를 치켜올리고 웃고 있습니다.미국 CNN 방송 등은 레비 씨가 사고 직후 비상구 출입문을 열어 50명이 넘는 사람들의 탈출을 도왔다고 전했습니다.레비 씨는 탈출구와 가까운 자리인 날개 뒤편 좌석에 앉아 있었지만 오히려 다른 승객들을 진정시킨 뒤 먼저 대피시켰다고 현지 언론들은 전했습니다.[벤벤자민 레비/탑승객 : 나는 조종사가 다시 착륙을 시도하기 위해 위로 올라갈 거라고 생각했습니다. 그런데 올라가지 않았고 충돌했어요. 만약 비행기가 뒤집어졌다면 우리 중 누구도 살아 남지 못했을 겁니다.]미국 실리콘밸리에서 근무하고 있는 레비 씨는 비행기에서 탈출한 뒤에는 사고 현장의 모습을 촬영해 트위터에 올리기도 했습니다.레비 씨는 자신의 트위터에 다른 누구라도 자기와 같은 행동을 했을 것이라며 다른 승객들도 무사히 가족을 만나길 바란다고 말했습니다.(영상취재 : 주 범, 영상편집 : 박진훈)[SBS 시청자 제보] 아시아나 항공기 사고 관련 제보 받습니다.정윤식 기자jys@sbs.co.kr관/련/정/보◆ [단독] 사고 여객기, 한 달 전 같은 공항서 '엔진 이상'◆ ""사고기 앞부분 들려있었다""…왜 기수 올렸나◆ 충돌 직전까지 몰랐다?…긴박한 교신 내용 공개◆ 불꽃 일면서 폭발음…생사 가른 공포의 순간◆ 찢긴 꼬리 날개·타버린 동체…처참한 사고 현장☞[SBS기자들의 생생한 취재현장 뒷이야기 '취재파일']☞ SBS뉴스 공식 SNS [SBS8News 트위터] [페이스북] [미투데이] [요즘]저작권자 SBS&SBS콘텐츠허브 무단복제-재배포 금지"
1,2013-07-07,아시아나 美사고..'신속한 탈출'이 대형 참사 막았다,https://news.naver.com/main/read.nhn?mode=LSD&mid=shm&sid1=102&oid=008&aid=0003078328,머니투데이,"[머니투데이 세종=김지산,김태은,최종일 기자][[아시아나 美사고] 기체전파 속에서도 대형 사망사고 피해..승무원, 승객 ""침착한 대응""]아시아나 충돌사고307명을 태운 아시아나항공 보잉 777기 OZ214편이 7일 오전 3시27분경 미국 샌프란시스코 공항에 착륙하던 중 활주로에 충돌, 2명이 죽고 49명이 중상을 입었다. 그러나 기체가 충돌·화재로 전파되는 상황속에서도 승무원의 신속한 승객대피와 승객들의 도움으로 최악의 참사는 피했다는 평가다.7일 국토교통부, 아시아나항공, 외신보도를 종합하면 사고 항공기는 샌프란시스코 공항에 착륙하던 중 활주로(RWY 28L)에 동체 후미가 충돌하며 활주로 왼쪽으로 이탈했다. 이로 인해 비행기 꼬리 부분이 완파되고 동체 앞쪽과 천정이 화재로 소실됐다. 사고여객기는 착륙할 때까지도 이상징후를 못느낀 것으로 알려졌다.충돌한 후에 기장이 관제탑이 ""응급상황""을 타전하고 구조를 요청한 것으로 확인됐다. 윤영두 아시아나항공 사장은 이날 긴급 기자회견을 갖고 사고원인과 관련 ""777-200이나 엔진으로 인한 이상은 없는 것으로 파악하고 있다""며 ""착륙 전까지 이상신호가 감지된 것은 없었다""고 말했다.문제의 사고 항공기는 승객 291명과 승무원 16명 등 모두 307명을 싣고 중국 상하이를 떠나 인천을 거쳐 샌프란시스코로 가던중이었다. 이 때문에 탑승객중 중국인이 141명으로 가장 많았고 한국인 77명, 미국인 61명도 탑승했다.사망자는 중국 국적의 여성 예멍위엔(16)과 왕린지아(17)두 명으로 확인됐다. 국토부에 따르면 현재 한국인 44명을 포함해 모두 181명의 승객들이 9개 병원으로 이송돼 치료를 받고 있다. 이중 5명은 생명이 위독하며 49명은 중상인 것으로 알려졌다.미국 교통전문가들은 사고의 원인이 기체결함인지, 조종사 실수인지 정밀조사후에나 밝혀질 전망이다.  국토교통부는 사고 발생 직후 사고수습본부를 설치하고 사고조사지원반 6명을 현지에 급파했다. 항공기 꼬리가 파괴되며 분리돼 나간 것은 이례적인 것으로 꼽힌다. 항공안전전문가인 케빈 다시 전 보잉안전수사국장은 ""이번과 같은 일은 오랫동안 본 적이 없다""며 ""항공기 꼬리 부분이 착륙할 때 파손됐던 사례는 (지난 1980년대까지 운행됐던) 'DC-9'의 시험 운행할 때가 마지막이었다""고 전했다.그러나 최악의 기체사고라 할만한 상황속에서도 의외로 사망자가 적었다는 점이 한미양국에서 주목을 받았다. 이와 관련 충돌후 화재가 발생하기 직전 승객들이 신속하게 탈출하는 데 성공했기 때문이란 분석이 나왔다.국토부 관계자는 ""객실 승무원들을 조사해봐야 알겠지만 대피 시간이 짧았던 것으로 미뤄 승무원들이 위기상황에서 최대한 메뉴얼에 맞춰 대응한 것으로 추정하고 있다""고 말했다. 이날 USA투데이는 ""항공기에 비상상황이 발생하면 90초안에 승객이 탈출할 수 있는지가 관건""이라며 승무원과 승객의 신속한 대응노력 가능성을 제기했다.CNN도 보도를 통해 ""이번 사고에서 희생자가 극히 적었다는 점은 승무원 훈련이 제대로 수행되고 탑승객들이 비상 상황에서 무엇을 해야 하는지를 인지하고 있다면 대형 참사를 피할 수 있다는 점을 잘 보여준다""고 지적했다.  CNN은 이어 ""B777은 비상구 절반이 열리지 않는다고 해도 탑승객 전원이 90초 이내에 기체를 탈출할 수 있도록 설계돼 있다""며 ""중요한 점은 승객들이 비상구 위치를 인지하고 자신의 짐을 챙기려고 시간을 허비하지 않으며, 승무원들의 지시를 따르는 것""이라고 지적했다.이는 탑승객 증언과 일치한다. 월스트리트저널(WSJ)은 힙합 콘서트 프로듀서인 유진 앤서니 라씨의 증언을 인용, ""체구가 작은 소녀 같은 여성승무원이 눈물이 범벅된채 사방으로 뛰며 무척이나 침착하게 사람들을 도왔다""고 전했다.승객들의 침착한 대응도 한몫한 정황도 나왔다. 한국인 아내와 함께 샌프란시스코에서 살고 있는 것으로 알려진 벤자민 레비(39)는 갈비뼈가 부러진 상태에서 사고기의 비상 탈출구를 직접 열고 수십명 탑승객들의 빠른 탈출을 도왔다고 현지 방송은 전했다.[머니투데이 핫뉴스]☞탤런트 송서연, 5년전 이혼설...소속사 공식입장無☞""어딜 감히"" 北연락관, 南기자에 '버럭'☞'나혼자' 구자명, 15kg 체중 감량 후 '훈남' 변신☞해나, 오늘 새벽 사망...PD ""해나는 자유가 됐습니다""☞로또 553회, 1등 6명 22.4억씩… 당첨번호는?[오늘의 HOT포토][스페셜 포토][손안의 경제뉴스 머니투데이 모바일웹]세종=김지산,김태은,최종일기자 san@,taien@,allday33@<저작권자 ⓒ '돈이 보이는 리얼타임 뉴스' 머니투데이, 무단전재 및 재배포 금지>"
2,2013-07-07,외딴섬 논바닥을 사파리로… 3선 도지사의 ‘삽질’,https://news.naver.com/main/read.nhn?mode=LSD&mid=shm&sid1=102&oid=028&aid=0002194694,한겨레,"[한겨레]목포서 뱃길로 50분 도초도에 1324억 투자전남 목포항에서 43㎞, 쾌속선으로 50분쯤 떨어진 신안군 도초도 화도항에서 15분쯤 걸으면 ‘사파리 아일랜드 조성 예정 지구’라고 한 글자씩 큼지막하게 써넣은 간판들이 눈에 확 들어온다.이곳 도초면 월포리에서 지난달 25일 만난 이장 조안배(60)씨는 전남도가 추진하는 ‘사파리’ 조성 터를 가리키며 뒤숭숭한 속내를 털어놨다. 마을 뒷산 오봉산 자락에서 시작해 월포제·발매제 등 저수지 2곳을 감싸안고 들판 건너 앞산까지 이어진 분지였다.“이장단 총무로서 동물의 섬 사업에 힘을 보탰지만 정작 우리 마을로 올지는 몰랐습니다. 동물 수천 마리가 도로 하나 건너 들어온다는데, 울부짖는 소리를 들으며 계속 살아야 할지 아직 모르겠네요.”조씨는 5년 넘게 말만 무성하고 지루하기만 했던 사업 진행에 적잖이 지친 듯했다. 20년 전 서울에서 귀향한 그는 “2년 전엔 안 한다더니 두 달 전에 입간판을 세우더라”며 고향의 정겨운 모습과 순박한 인심이 달라질 것을 우려했다.경운기를 몰고 지나던 마을 주민 박복암(55)씨는 “토질이 좋아 시금치 등 안 되는 작물이 없다. 이제 농사를 못 지으면 어디 가서 땅을 부치냐”고 아쉬워했다. 들판에서 만난 농민 김해찬(50)씨도 “주민들은 호랑이를 키운다더라는 정도만 알고 있다. 울음소리나 배설물, 쓰레기 등 신경 쓰이는 게 한두가지가 아니다”라고 거들었다. 조성 터에 맞닿은 이웃 마을 발매리 이장 박길석(50)씨는 “아직 눈에 보이는 변화는 없다. 대체로 나이든 주민은 반대하고, 50대 이하는 찬성하는 분위기”라고 전했다.1㎞쯤 떨어진 면소재지 수항리 주민들한테선 개발에 대한 기대심리를 엿볼 수 있었다. 주민 박아무개씨는 “논 한 마지기(660㎡)에 400만원이 나왔다더라. 보상 뒤 주변 논값이 500만원으로 뛰어 땅 내놓는 이들이 없다”고 말했다. 그는 “감사원이 사파리를 재검토하라고 했다는데, 앞으로 사업을 하는 거냐 마는 거냐”며 궁금해했다.사파리 아일랜드 사업은 박준영 전남지사의 선거공약이다. 2004년 6월 보궐선거로 당선한 박 지사는 내리 3선을 하는 동안 전남이 비교우위를 지닌 섬들을 관광자원으로 개발하는 데 의욕을 보였다. 이듬해 전남 섬의 관광자원 개발계획을 수립하면서 도초도에 산양·여우 같은 멸종위기종 야생동물을 복원하는 ‘동물의 섬’ 밑그림을 그렸다. 이 계획은 2009년 ‘상업형 사파리’로 바뀌더니, 2011년엔 ‘사파리 아일랜드’로 거창해졌다. 사파리는 동물을 가둬놓지 않고 자연 상태로 풀어놓고는 사람이 차량·보트·도보로 관람하는 방식을 이른다.전남도는 2011년 7억원을 들여 사파리 아일랜드 조성 사업 용역을 맡겼다. 도초도 서북쪽 118만㎡(36만평)에 공공자본 510억원, 민간자본 814억원 등 1324억원을 투입해 동물 97종 2110여마리를 입식한다는 계획이었다. 사파리 방문객은 2020년 16만명, 2028년 55만명으로 추정했다. 도초도(都草島)를 선정한 것은 관광객이 몰리는 홍도·흑산도·가거도 항로의 중간 기항지이고, 연평균 기온 14도, 연 강수량 1000㎜로 수목이 많아 옛 문헌에 말을 키웠다는 기록이 있을 만큼 동물 생육 조건이 좋다는 점을 들었다. 이승옥 전남도 관광문화국장은 “중국인을 끌어들이려면 내륙관광이 아니라 해양관광으로 승부해야 한다. 일본의 후지 사파리, 싱가포르의 나이트 사파리 등 선진 사례도 들여다봤다. 국내 최고, 최대의 사파리를 조성해 체류형 관광지를 만들겠다”고 말했다.하지만 이 사업은 지난달 4일 감사원이 ‘사파리 조성을 위한 용역 과정에서 전남도의 지시로 사업성이 부풀려졌다’는 감사 결과를 발표하면서 중대 고비를 맞았다. 감사원은 “이 사업의 추진 여부를 재검토하고, 구체적인 민자 유치 방안 없이 사업 터를 매입하지 않도록 하라”고 권고했다.감사원은 용역업체 ㈜한국종합기술 등의 민간 측면 사업성 분석 결과가 6개월 만에 ‘낮다’에서 ‘양호’로 뒤집힌 이유를 정면으로 겨냥했다. 용역업체는 2011년 6월 중간보고 때, 비용 대비 편익 비율이 0.73, 순현재가치는 284억원 적자로 사업성이 낮다고 했다. 그런데 같은해 12월 최종보고 때는 비용 대비 편익 비율은 1.08, 순현재가치는 116억원 흑자로 사업성이 양호하다고 번복했다. 감사원 감사 결과, 수입은 물가상승률(연 3%)을 반영해 늘리고, 비용은 물가상승률을 반영하지 않아 낮추는 것이 이런 마술을 가능하게 만들었다. 감사원이 비용까지 물가상승률을 반영해 재분석했더니 비용 대비 편익 비율은 0.70, 순현재가치는 369억원 적자 등 사업성이 없다는 결과가 나왔다.엇갈린 사업성 분석 결과를 두고, 전남도 쪽은 “감사원의 재분석이 틀렸다고 보지 않는다”고 사실상 인정했다. 그러면서도 전남도는 “사업성을 부풀리라고 지시한 적이 없다”고 했으나, 감사원은 “용역업체가 비용 대비 편익 비율이 1보다 높게 나오도록 매출·예상수요 등을 전남도와 협의해 적용했다”고 지적했다.전남도는 용역 결과를 제출받자 사업을 밀어붙이기 시작했다. 토지를 미리 확보해야 투자 유치가 용이하다며, 지난해 10월부터 조성 터 매입에 나섰다. 앞서 7개월 전 재정투융자 심사에서 행정안전부가 ‘민자 유치 방안을 마련한 뒤 예산을 반영하라’는 조건을 걸어 승인했는데도 아랑곳하지 않았다. 전남도는 85억원을 들여 올해 안에 조성 터를 모두 확보하겠다며 현재 65만㎡(55%)를 사들였다. 전남도는 “민간 투자자의 조성 터 매입에 어려움이 예상돼 전남도의회의 승인을 받아 예산을 투입했다. 매입비는 사업에 들어갈 공공자본의 일부”라고 밝혔다. 터 매입에 대해 감사원은 사업 추진을 명분삼아, 정부의 재정투자 승인 조건을 무시한 조처라는 의견을 냈다.이를 두고 전남진보연대는 성명을 내어 “적자로 나온 사업성을 흑자로 둔갑시키는 것은 도민을 우롱하는 범죄행위이다. 박 지사는 이 사업을 전면 백지화하고 도민 앞에 사죄하라”고 촉구했다.도초도의 접근성도 논란거리다. 한해 30일가량은 풍랑과 안개의 영향으로 배가 뜰 수 없다. 목포~도초는 쾌속선으로 50분, 일반선으로 2시간30분 걸린다.육로로는 서울에서 400㎞ 떨어져 있다. 2018년 압해도~암태도를 잇는 새천년대교와 2028년에 암태도~비금도 연도교가 놓이면 비로소 뭍에서 차량만으로 접근할 수 있게 된다. 2016년 흑산도에 소형 공항이 건설되면 서울에서 오는 시간이 2시간으로 단축될 수 있다.그런데도 전남도는 사업을 강행하겠다는 의지를 굽히지 않고 있다. 문화체육관광부와 국토교통부의 투자유치 지원 사업에 잇따라 선정됐고, 국내 3개 업체가 관심을 보이는 등 전망이 밝다는 태도다. 민간투자자만 선정되면 급물살을 타 2020년 사파리를 개장할 수 있을 것이라고 낙관한다.반면 내년 지방선거에서 이 사업의 존폐가 쟁점이 될 것이란 관측도 엄존한다. 예산이 눈덩이처럼 불어나며 ‘세금 먹는 애물단지’로 전락한 코리아 그랑프리(F1)의 전철을 밟을 것이라는 비판도 거세다. 안주용 전남도의회 의원은 “박 지사가 퇴임을 한해 앞두고 무리하게 사업을 서두르는 이유를 알 수 없다. 현재로선 민자 유치가 불투명한 만큼 사업 추진을 전면 재검토해야 한다. 사업이 일몰될 가능성에 대비해야 한다”고 강조했다.수의사 최종욱씨는 “무인도를 배경으로 한 영화 <쥬라기공원>의 환상에 빠져서는 안 된다. 대부분의 야생동물은 연평균 25도 이상인 열대의 조건에서 살아 비용도 예상보다 많이 들어간다. 세계적으로 흑자 나는 동물원은 거의 없다는 점도 고려해야 한다”고 말했다.신안 도초도/글·사진 안관옥 기자okahn@hani.co.kr<한겨레 인기기사>■“아쉽다! 한국 축구”…명승부 펼쳤으나 승부차기 끝에 4강 좌절■[단독] 안도현 시인 절필 선언, 왜?■[화보] 시민들이 SNS에 기록한 ‘국정원 규탄’ 촛불집회■대활약…갈비뼈 다친 승객이 비상구 열어 53명 구출 도와■[화보] 아시아나 항공기 샌프란시스코 공항 착륙 사고 현장공식 SNS[통하니][트위터][미투데이]| 구독신청[한겨레신문][한겨레21]Copyrights ⓒ 한겨레신문사, 무단전재 및 재배포 금지<한겨레는 한국온라인신문협회(www.kona.or.kr)의 디지털뉴스이용규칙에 따른 저작권을 행사합니다.>"
