,날짜,기사 제목,기사 링크,기사 출처,기사 내용
110,2013-07-25,외환은행 대출금리 조작해 고객이자 303억 챙겼다,https://news.naver.com/main/read.nhn?mode=LSD&mid=shm&sid1=101&oid=001&aid=0006392526,연합뉴스,"서울중구 을지로 외환은행 본점 <<연합뉴스DB>>檢, 전현직 임직원 7명 '컴퓨터 사기' 기소…""갑 지위 이용한 불법행위""(서울=연합뉴스) 임주영 김동호 기자 = 외환은행 임직원들이 대출금리를 무단으로 조작해 고객의 이자 303억원을 불법으로 더 받아 챙긴 혐의로 25일 재판에 넘겨졌다.서울중앙지검 금융조세조사1부(강남일 부장검사)는 2007년부터 지난해까지 전국 영업점에서 대출 가산금리를 무단 인상해 이자 303억원을 불법 수취한 혐의(컴퓨터 등 사용사기)로 외환은행 전 부행장 권모씨 등 전·현직 임직원 7명을 불구속 기소했다.기소 대상에는 기업사업본부장(상무 및 부행장)을 지내고 퇴직한 권씨를 비롯해 기업마케팅부장을 지낸 박모씨(퇴직), 현 영업본부장 강모씨, 일선 영업점장 이모씨 등이 포함됐다.검찰은 또 미국에 체류 중인 전 은행장 L씨에 대해 체포영장을 발부받아 기소중지했으며 범죄인 인도청구 절차를 밟기로 했다.검찰에 따르면 영업점 321곳, 영업점장 675명이 총 1만1천380건의 대출금리 조작에 가담했으며 피해 고객은 4천861명에 달한다.형법상 컴퓨터 등 사용사기 혐의는 컴퓨터 등 정보처리장치에 허위 정보나 부정한 명령을 입력하거나 권한 없이 정보를 입력·변경해 직접 또는 제3자가 재산상 이익을 취한 경우에 적용된다. 10년 이하의 징역이나 2천만원 이하의 벌금에 처해진다.검찰은 ""원칙적으로 고객과 약정한 대출기간 중에는 가산금리를 임의로 변경할 수 없음에도 불구하고 '대출기간 중 여신(빌려준 돈)'에 대해 은행 본점이 무리하게 금리인상 정책을 실시한 데 따른 전국적 범행으로 확인됐다""고 말했다.특히 외환은행은 금융기관의 우월적인 지위를 악용해 소기업과 개인 사업자 고객에 대한 대출금리를 올려 불법 이익을 챙겼으며 은행 내부적으로도 본점이 영업점을 압박하는 '연쇄 범행'이 일어났다고 검찰은 밝혔다.검찰은 기소 대상이 아닌 영업점장 등 은행 직원들에 대해서는 금융감독 당국에 징계 등 조치를 의뢰했다. 불법으로 챙긴 이자는 모두 피해자들에게 반환하도록 은행과 감독 당국에 요청했다.검찰은 영업점장 수백명이 범행에 관여했지만 가담 경위, 위반 건수, 금액 및 동종사건 처리 전례 등을 고려해 처벌 대상자를 선정했다.은행 측은 수사 과정에서 고객의 금리 확인이 곤란했던 금리 체계를 개편했다. 또 전산 시스템상 무단 금리 변경을 방지하고 금리를 변경할 때 대출자로부터 약정서를 받았는지 점검하는 시스템을 구축하는 등 제도를 개선했다고 검찰은 전했다.강남일 서울중앙지검 금조1부장은 ""앞으로 금리 변경 등 고객에게 중요한 사안을 은행이 구체적으로 설명해 주는 의무를 실질적으로 이행하고 그럴 경우 반드시 대출고객의 서면 동의가 이뤄지는 관행이 정착되기를 기대한다""고 말했다.zoo@yna.co.krdk@yna.co.kr[이 시각 많이 본 기사]☞檢 '전두환 금고' 7개 압수…재용씨 빌라들 압류(종합3보)☞<""일에 빠져있던 분인데…"" 김종학 PD 추모 이어져>(종합)☞엔저에 참치 매출 급증…횟감순위 바뀌었다☞<동아시안컵축구> 홍명보 ""첫 골·첫 승리보다 준비가 중요""☞<특집:전두환 추징> ⑦ 전재용-이창석 '은밀한 커넥션'▶ 연합뉴스 모바일앱 다운받기▶ 인터랙티브뉴스<저작권자(c)연합뉴스. 무단전재-재배포금지.>"
111,2013-07-25,"지하철 1호선 고장 복구, 서울방면 운행 정상화",https://news.naver.com/main/read.nhn?mode=LSD&mid=shm&sid1=103&oid=008&aid=0003088535,머니투데이,"[머니투데이 이슈팀 김민우 기자](서울=뉴스1) 이명근 기자 = 7일 오전 8시 11분께 서울 지하철 1호선 종로 5가역에서 동두천행 전동차가 고장으로 갑자기 멈춰 청량리, 성북 방향 열차의 운행이 지연돼 출근길 시민들이 불편을 겪고 있다. 2012.11.7/뉴스1고장으로 멈춰 섰던 지하철 1호선 서울방면 운행이 정상화됐다.25일 오전 8시30분께 서울 지하철 1호선 오류동역에서 전동열차 고장으로 운행이 중단됐던 서울 방면 열차가 30여분 만에 정상화됐다.코레일은 ""고장난 차량은 8시 57분부로 응급조치 후 정비를 위해 기지로 회송을 했으며 이로 인해 후속 열차가 지연운행되고 있다""고 밝혔다.[머니투데이 핫뉴스]☞故김종학 조문, 촬영하다 달려온 女배우도…☞아이유 ""은혁과 찍은 사진 실수 맞아..미안하다""☞김희선, 15년 전 생방송 도중 컵라면을?...""대단해""☞[단독]최불암, 대만行 '꽃할배' 깜짝 배웅 ""잘 다녀와""☞김희선, '화신' 녹화 후 故김종학PD 빈소 조문[오늘의 HOT포토][스페셜 포토][손안의 경제뉴스 머니투데이 모바일웹]이슈팀 김민우기자 insailoo@<저작권자 ⓒ '돈이 보이는 리얼타임 뉴스' 머니투데이, 무단전재 및 재배포 금지>"
112,2013-07-25,8월말 북극항로 시범운항…북극종합정책 수립,https://news.naver.com/main/read.nhn?mode=LSD&mid=shm&sid1=101&oid=001&aid=0006392412,연합뉴스,"8월말 북극항로 시범운항…북극종합정책 수립     (세종=연합뉴스) 해양수산부는 8월 말 국적 선사인 현대글로비스가 북극해 운항 전문선사인 스웨덴 스테나 해운의 내빙(耐氷) 유조선을 빌려 북극항로를 통해 유럽에서 한국으로 원유를 수송할 계획이라고 25일 밝혔다. 사진은 북극 과학연구활동 모습. 2013.7.25 << 해수부 제공 >>    photo@yna.co.kr현대글로비스, 스웨덴 유조선으로 원유 수송(세종=연합뉴스) 김승욱 기자 = 다음 달 말 한국 국적 선사가 북극해 시범 운항에 나선다.해양수산부는 8월 말 국적 선사인 현대글로비스가 북극해 운항 전문선사인 스웨덴 스테나 해운의 내빙(耐氷) 유조선을 빌려 북극항로를 통해 유럽에서 한국으로 원유를 수송할 계획이라고 25일 밝혔다.해수부에 따르면 현대상선과 한진해운도 북극항로를 통해 기자재, 해상플랜트, 철광석 등 벌크화물(포장하지 않은 화물)을 수송하는 방안을 검토 중이다.윤진숙 해수부 장관은 ""북극항로 상용화에 대비해 8월 중 시범 운항을 하기로 했다""며 ""북극항로 운항 경험을 쌓고 경제성을 검증할 기회가 될 것""이라고 의미를 부여했다.해수부는 시범 운항 선박에 국내 해기사와 북극 연구 전문가를 승선시켜 북극해 운항절차와 노하우를 익히도록 하고 국제해사기구(IMO)의 극지 선박 안전기준(Polar code) 제정에 대비할 계획이다.<그래픽> 북극해 영유권 주장 지역    (서울=연합뉴스) 장예진 기자 = 해양수산부가 25일 관계 부처와 합동으로 수립한 '북극 종합정책 추진계획'에 따르면 다음 달 말이면 현대글로비스가 우리 선사로는 처음으로 북극항로를 통해 유럽에서 한국으로 원유를 수송하게 된다.    jin34@yna.co.kr    @yonhap_graphics(트위터)시범 운항 선사를 지원하기 위해 다음 달 중 러시아와 해운협력회의를 열어 북극해 운항허가 및 통관절차 간소화, 러시아 쇄빙선에 지급해야 하는 에스코트 비용 할인 등을 요청할 방침이다.또 러시아 교육기관에 국내 해기사를 파견해 극지 운항 교육을 받게 하는 등 북극해 항행 전문인력을 양성하고, 북극항로 운항 선박에 국내 항만사용료를 감면해주는 등 북극항로 활성화 방안도 마련하기로 했다.북극항로는 러시아 서쪽의 무르만스크에서 동쪽의 베링 해협을 연결하는 북동항로와 캐나다 북부 해안을 따라 대서양에서 태평양에 이르는 북서항로로 나뉜다.부산항을 출발해 수에즈 운하를 거쳐 네덜란드 로테르담으로 향하는 기존 항로의 거리는 약 2만2천㎞에 달하지만, 북동항로를 이용하면 1만5천㎞로 단축된다.파나마 운하를 통과해 미국 동부해안으로 향하는 미국항로 역시 북서항로를 이용하면 항해 시간이 약 30%가량 줄어든다.북극항로는 현재 약 4개월가량 경제적 운항이 가능하나 지구 온난화의 영향으로 2020년에는 6개월, 2030년에는 연중 일반 항해가 가능할 전망이다.북극항로가 상용화하면 현재 동남아시아를 거치는 항로의 길목에 자리 잡은 홍콩과 싱가포르는 쇠퇴할 공산이 크지만, 북극항로의 길목에 있는 부산항과 일본 서부지역 항만은 지금보다 더 성장할 가능성이 크다.<그래픽> 북극해 북극항로 현황    (서울=연합뉴스) 장예진 기자 = 해양수산부가 25일 관계 부처와 합동으로 수립한 '북극 종합정책 추진계획'에 따르면 다음 달 말이면 현대글로비스가 우리 선사로는 처음으로 북극항로를 통해 유럽에서 한국으로 원유를 수송하게 된다.    jin34@yna.co.kr    @yonhap_graphics(트위터)해수부는 북극항로 상용화에 대비해 동·남해 항만의 시설을 정비·확충하기로 하고 2015년 항만기본계획에 반영할 방침이다.또 올해 안으로 러시아와 한·러 항만개발협력 양해각서(MOU)를 체결해 러시아 내 북극 거점 항만 개발에 참여할 계획이다.한편, 해수부는 이날 국제사회의 북극 활동에 동참하고 국익을 확보하기 위해 외교부·산업통상자원부·미래창조과학부·국토교통부·환경부 등과 함께 `북극 종합정책 추진계획'을 발표했다.해수부는 지난 5월 북극이사회 정식 옵서버 진출을 계기로 북극이사회 및 워킹그룹 활동을 강화하고, IMO의 극지선박 안전기준 제정 작업에 참여한다는 계획을 세웠다.또 북극 과학연구활동 강화를 위해 현재 약 230㎡에 불과한 북극 다산기지의 규모를 확대하고 아라온호에 이은 제2 쇄빙선 건조를 검토하기로 했다.아울러 해수부에 극지 전담부서를 신설하는 등 올해 안으로 극지 연구 및 활동과 관련한 법률을 정비하기로 했다.kind3@yna.co.kr[이 시각 많이 본 기사]☞檢 '전두환 금고' 7개 압수…재용씨 빌라들 압류(종합3보)☞<""일에 빠져있던 분인데…"" 김종학 PD 추모 이어져>(종합)☞엔저에 참치 매출 급증…횟감순위 바뀌었다☞<동아시안컵축구> 홍명보 ""첫 골·첫 승리보다 준비가 중요""☞<특집:전두환 추징> ⑦ 전재용-이창석 '은밀한 커넥션'▶ 연합뉴스 모바일앱 다운받기▶ 인터랙티브뉴스<저작권자(c)연합뉴스. 무단전재-재배포금지.>"
113,2013-07-25,"""과다노출 처벌기준은 불쾌감""…경범죄처벌 기준 제시",https://news.naver.com/main/read.nhn?mode=LSD&mid=shm&sid1=102&oid=001&aid=0006392523,연합뉴스,"경찰, 3월 시행 경범죄처벌법 적용 혼란 일자 해설서 제작""분명히 'NO'해야 스토킹…통행지장 구걸은 처벌""(서울=연합뉴스) 임기창 기자 = ""어두운 골목에서 신원을 알 수 없는 남자가 계속 쫓아왔습니다. 이러면 스토킹으로 처벌할 수 있나요?""스토킹 등의 처벌을 포함한 개정 경범죄처벌법이 지난 3월 시행됐지만, 일선 경찰과 시민들은 일부 조항에 대한 법 적용을 놓고 여전히 혼란을 겪고 있다.이에 경찰청은 일선의 어려움을 줄이고 법 적용 기준의 일관성을 확보하고자 '개정 경범죄처벌법 해설서'를 제작했다.해설서는 경범죄처벌법의 의의와 성격, 특징, 형법 등 다른 법과의 관계, 조문별 해설과 법 적용 사례, 판단이 어려운 상황에 대한 질의응답 등으로 구성됐다.경찰청 관계자는 25일 ""현장에서 일어나는 개별 상황 하나하나를 모두 해설서에 담을 수 없기 때문에 일선 경찰관의 판단이 중요하다""며 ""법 적용에 대한 기본적인 기준을 제시하려는 취지""라고 말했다.◇ ""스토킹, 명시적 거부 의사 밝혀야""스토킹은 상대방의 명시적 의사에 반해 지속적으로 접근을 시도, 교제 등을 요구하거나 지켜보기, 따라다니기, 잠복해 기다리기 등으로 정신·육체적 피해를 주는 행위다.헤어진 애인에게 지속적으로 다시 만나달라고 요구하거나 '첫눈에 반했다'라며 여러 차례 집앞에서 기다리는 행위 등이 해당한다.이런 행위를 처벌하려면 일단 피해자가 상대방에게 전화나 구두, 서면 등으로 거절 의사를 뚜렷하게 밝혀야 한다. 대꾸하지 않는 등 묵시적 거부는 효력이 없다.다만, 전화나 문자메시지 등을 이용해 공포심이나 불안감을 여러 차례 유발한 행위는 경범죄처벌법이 아닌 정보통신망법을 적용해 처벌할 수 있다.제3자를 통해 근황을 묻거나 소셜네트워킹서비스(SNS)로 사생활을 확인하는 행위 등은 처벌 대상이 아니다.피해자가 심하게 겁을 먹을 정도로 행위의 강도가 세더라도 상대방의 신원이 명확하면 현행범으로 체포할 수 없다. 이 경우 신변보호제도를 활용할 수 있다.어두운 골목에서 신원을 알 수 없는 남성이 피해자를 계속 쫓아오더라도 '명시적 반대 의사'와 '행위의 반복성'이 없으면 경범죄처벌법으로 처벌이 불가능하다. 다만 상황에 따라 경범죄처벌법상 '불안감 조성' 조항을 적용할 수 있다.경찰은 처벌 수위가 낮다는 지적에 ""15대 국회부터 발의된 스토킹 관련 특별법이 제정되지 못하는 상황에서 최소한의 스토킹이라도 처벌하자는 취지""라고 말했다.◇ ""관공서 주취소란, 만취 아니어도 적용 가능""관공서 주취소란은 술에 취한 상태에서 정상적 공무수행을 방해하거나 다른 민원인에게 해를 끼칠 정도로 거친 말과 행동을 한 경우를 일컫는다.꼭 만취 상태가 아니어도 일반적인 기준으로 행동이나 상태가 술에 취했음을 알아볼 수 있는 정도면 법 적용이 가능하다.행위자가 초범이고 기물 파손, 공무원 폭행 등의 피해가 없는 단순 소란이면 공무집행방해 혐의로 입건하지 않고 이 조항을 적용할 수 있다.일시적으로 흥분해 큰 소리로 떠든 경우는 처벌 대상이 아니다. 그러나 공무원이 자제를 요청했음에도 지속적으로 소란을 피우면 법에 저촉된다.하지만, 울타리가 있는 관공서의 마당에서 소란을 피우는 행위는 공무집행을 현저히 방해하는 처벌 대상 행위로 보기 어렵다는 게 경찰청의 해석이다.◇ ""'과다노출' 기준은 성적 수치심·불쾌감""법 개정 당시 논란의 중심이 됐던 과다노출 조항은 드러난 부위가 어디인지, 신체 노출 결과 상대방이 성적 수치심이나 불쾌감을 느꼈는지가 관건이다.'사회 통념상'이라는 다소 모호한 전제가 있기는 하나 일단 공공장소에서 '가려야 할' 부위는 성기와 엉덩이, 여성의 가슴 등이다.배꼽티나 미니스커트 착용 등은 법 적용 대상에 포함되지 않는다.그러나 같은 노출이라도 맥락에 따라 처벌 여부가 달라진다. 일례로 여성이 아기에게 젖을 먹이려고 가슴을 드러내는 행위는 처벌 대상이 아니다.◇ ""구걸행위만으로는 처벌 안 해""인권침해 논란이 인 구걸행위 등에 대한 처벌 조항은 공공장소에서 구걸하면서 사람들의 통행을 방해하거나 귀찮게 한 때에만 적용된다.길을 막아서거나 옷을 붙잡으며 구걸하는 행위 등이 해당한다.흔히 볼 수 있는 지하철 등의 역사 내 계단 한쪽에서 바구니를 놓은 채 구걸하는 행위는 처벌 대상이 아니다.그러나 인권단체들은 ""법 개정 이전에는 구걸행위를 시키는 사람만 처벌했으나 구걸하는 사람까지 처벌 대상에 포함한 것은 지나치다""며 반발하고 있다.◇""'행운의 편지' 계속 보내도 처벌 대상""정당한 이유 없이 전화·문자메시지·편지·이메일 등을 계속 보내 상대방을 괴롭히면 경범죄처벌법상 '장난전화 등' 조항에 저촉된다.이른바 '행운의 편지'를 보내거나, 상대방의 거절에도 '사귀자'는 문자메시지를 지속적으로 전송하는 행위 등도 여기에 포함된다.119나 112로 전화를 걸어 그냥 끊는 행위를 여러 차례 반복해도 처벌 대상이 된다. 허위신고를 하면 벌금액이 더 높은 '거짓신고' 조항이 적용된다.pulse@yna.co.kr[이 시각 많이 본 기사]☞檢 '전두환 금고' 7개 압수…재용씨 빌라들 압류(종합3보)☞<""일에 빠져있던 분인데…"" 김종학 PD 추모 이어져>(종합)☞엔저에 참치 매출 급증…횟감순위 바뀌었다☞<동아시안컵축구> 홍명보 ""첫 골·첫 승리보다 준비가 중요""☞<특집:전두환 추징> ⑦ 전재용-이창석 '은밀한 커넥션'▶ 연합뉴스 모바일앱 다운받기▶ 인터랙티브뉴스<저작권자(c)연합뉴스. 무단전재-재배포금지.>"
114,2013-07-25,"서울시, 택시 내 블랙박스 의무화…위반 때 영업정지",https://news.naver.com/main/read.nhn?mode=LSD&mid=shm&sid1=103&oid=001&aid=0006392554,연합뉴스,"서울역택시승강장에 영업 중인 택시들이 줄을 서 있다. <<연합뉴스DB>>승객 없어도 금연…운행 중 DMB 시청 금지(서울=연합뉴스) 이정현 기자 = 서울시가 내년부터 택시 내 블랙박스 설치를 의무화하고 이를 위반하면 과징금을 부과하거나 일정 기간 사업정지 명령을 내리기로 했다.서울시는 25일 이런 내용의 '여객자동차운송사업 개선명령 및 준수사항 공고'를 냈다.이 공고에 따라 택시 내에 블랙박스를 설치하되 촬영 방향은 기사를 향해야 하며 녹음 기능은 설치할 수 없다.이를 어기면 운송사업자에게 120만원의 과징금이 부과된다. 한차례 위반에는 20일의 영업정지 명령이 내려지며 두 차례에는 40일, 세 차례에는 60일로 늘어난다.일각에선 택시 내 블랙박스 설치가 자칫 사생활 침해로 이어질 수 있다는 지적도 나온다.민수홍 서울시 택시정책팀장은 ""주취 승객의 폭력이나 일부 기사의 범죄로부터 시민을 보호하려는 게 택시 블랙박스 의무화의 취지""라고 설명했다.공고에 따르면 승객이 타든 안 타든 택시운전사는 차량 내에서 금연해야 하며 신호대기와 승객 승·하차 때를 포함해 차량을 운행할 때는 DMB를 시청할 수 없다.서울시는 택시운전사가 승객이 없을 때 흡연하더라도 담배 냄새가 차에 밸 수 있어 금연을 엄격히 적용했다고 밝혔다.아울러 택시 운전사는 영업 시작 전 카드결제 단말기에 택시운전자격번호를 입력해 서울택시정보시스템에서 택시운전자가 누구인지 확인할 수 있도록 해야 한다. 일부 사업자가 무자격 기사에게 싼 임금에 도급 택시를 운행하게 하는 사례를 방지하기 위해서다.또 카드결제기는 8월 말까지 마그네틱 카드 인식 장비는 조수석 앞 왼쪽, IC카드 인식 터치패드는 운전자와 조수석 사이 콘솔박스 위에 붙이도록 의무화했다.승차거부·부당요금 등으로 적발된 경우 16시간 교육을 이수하지 않으면 운행할 수 없게 하는 조항도 신설됐으며, 택시운전자격증명은 기존에 부착했던 조수석 앞 선반 위와 함께 조수석 뒷면에도 붙이게 했다.모든 조항에는 위반 시 과징금 부과나 사업 정지 명령이 포함됐다. 블랙박스 설치(내년부터)와 카드결제기 위치 설정(9월부터)을 제외하고는 모두 다음 달부터 적용된다.lisa@yna.co.kr[이 시각 많이 본 기사]☞檢 '전두환 금고' 7개 압수…재용씨 빌라들 압류(종합3보)☞<""일에 빠져있던 분인데…"" 김종학 PD 추모 이어져>(종합)☞엔저에 참치 매출 급증…횟감순위 바뀌었다☞<동아시안컵축구> 홍명보 ""첫 골·첫 승리보다 준비가 중요""☞<특집:전두환 추징> ⑦ 전재용-이창석 '은밀한 커넥션'▶ 연합뉴스 모바일앱 다운받기▶ 인터랙티브뉴스<저작권자(c)연합뉴스. 무단전재-재배포금지.>"
115,2013-07-25,6차 회담 시작...'개성공단 사태 중대 기로',https://news.naver.com/main/read.nhn?mode=LSD&mid=shm&sid1=100&oid=052&aid=0000467662,YTN,"[앵커멘트]개성공단 정상화 방안을 논의하기 위한 남북 당국간 6차 실무회담이 오늘 개성에서 열립니다.오늘 회담이 개성공단 사태의 중대 기로가 될 것이라는 관측이 많습니다.서울 삼청동 남북회담본부에 나가 있는 취재기자 연결합니다. 김준영 기자!회담이 시작됐습니까?[중계 리포트]아직 현지에서 소식이 전해지지 않았지만 지금쯤 회담이 시작된 것으로 보입니다.예정대로라면 현재 개성공단 종합지원센터에서 전체회의가 진행되고 있는 것으로 보입니다.전체회의가 끝나면 수석대표와 대표 접촉이 이어질 것으로 전망됩니다.우리 측 김기웅 수석대표는 오늘 개성으로 출발하기에 앞서 취재진에게 이번과 같은 공단 가동 중단 사태가 되풀이되지 않도록 대책을 마련하는데 주력하겠다는 뜻을 내비쳤습니다.직접 들어보겠습니다.[녹취:김기웅, 우리 측 수석대표]""개성공단과 관련해서 국민들께서 크게 걱정하실 일이 또다시 있어서는 안 된다는 그런 마음과 자세로 회담에 임하겠습니다.""오늘 회담에서 남과 북이 개성공단 정상화 방안에 이전보다 진전될 입장을 내놓을지 관심이 쏠리고 있습니다.우리 측은 현재 개성공단 가동 중단 사태와 관련해 북측의 책임 있는 입장 표명과 재발 방지 약속을 요구하고 있습니다.하지만 북측은 이번 사태의 책임을 우리 측에 돌리면서 공단부터 다시 가동하자고 주장하고 있습니다.양측이 이처럼 견해차를 좁히지 못하면서 지난 5차 회담까지 큰 진전을 보지 못했습니다.오늘 회담이 개성공단 사태의 중대 기로가 될 것이라고 보는 관측이 많습니다.북한이 예고한 대로 모레 6·25전쟁 정전협정 체결 60주년, 이른바 '전승절'을 맞아 대규모 열병식을 진행하고, 다음 달 한·미 연례 군사훈련인 '을지프리덤가디언 연습' 때 북측이 반발하고 나서면 회담이 이어지기 어렵기 때문입니다.물론 양측 모두 개성공단 정상화를 얘기하고 있고, 더 시간을 끌다가는 입주업체가 모두 도산할 수 있기 때문에 양측이 오늘 사태 해결을 위한 접점을 찾을 수 있을 것이라는 기대 섞인 관측도 나오고 있습니다.지금까지 남북회담본부에서 YTN 김준영입니다.[관련이슈]▶ 개성공단, 고통과 기다림의 석 달▶ 이번에는 '급' 문제 없나?▶ 개성공단 남북관계 전환점 맞나?▶ 북한, 개성공단 방북 허용...배경은? [홍현익, 세종연구소 연구위원]▶ 오늘 남북 6차 회담...'개성공단 사태 중대 기로'☞ 네이버 뉴스스탠드에서 YTN 뉴스를 만나 보세요.☞ 언제 어디서나 뉴스가 궁금할 땐 'YTN 뉴스 앱'[아이폰 APP 다운로드↓][안드로이드 APP 다운로드↓][저작권자(c) YTN & Digital YTN. 무단 전재-재배포 금지]"
