,날짜,기사 제목,기사 링크,기사 출처,기사 내용
113,2013-07-23,"朴대통령 ""경제부총리, 잘하고 있다"" 경제팀 지원사격",https://news.naver.com/main/read.nhn?mode=LSD&mid=shm&sid1=100&oid=277&aid=0003050258,아시아경제,"[아시아경제 신범수 기자]박근혜 대통령은 현오석 경제부총리 겸 기획재정부 장관에 대해 ""일할 시간이 4개월도 채 되지 않았지만 열심히 해왔다고 본다. 앞으로도 경제 컨트롤타워 역할을 더욱 열심히 해주기 바란다""고 말했다.박 대통령은 23일 오전 청와대에서 국무회의를 주재하고 모두발언을 통해 ""경제 컨트롤타워로서 협업과 조율의 문제에 대해 제가 지적한 적이 있지만, 두 차례에 걸친 회의에서 볼 수 있듯 경제부총리께서 여러 부처에 걸쳐 있는 정책들을 잘 조율해서 투자를 활성화 할 수 있는 인프라를 깔 수 있었다""며 이같이 말했다.이어 ""모든 부처가 일자리 창출을 최우선에 두고 정책을 수립해야 한다""며 ""각 부처는 그 성과를 경제부총리께 보고하고 경제부총리는 그 결과를 저에게 정기적으로 보고해 달라""고 당부했다.박 대통령은 또 ""하반기에는 국민들이 성과를 체감할 수 있도록 경제 컨트롤타워 역할을 더욱 열심히 해주시기 바란다""며 정치권으로부터 제기된 리더십 부재 비판과 조기경질설을 일축했다.신범수 기자 answer@<ⓒ세계를 보는 창 경제를 보는 눈, 아시아경제(www.asiae.co.kr) 무단전재 배포금지>[관련기사]전두환 며느리 '박상아' 기소한 검사 돌연…'이럴수가''이민정' 돈 많은 이병헌과 결혼한다더니만 끝내 이런 일이…'노현정' 재벌가 며느리 되고 잘 사나했는데 충격적 사건이…'장윤정 가족사' 어쩐지 이상하다 했더니 '충격 반전''신성우-박은지' 서로 친해보이더니만 이런 일이…'충격'"
114,2013-07-23,서민생활침해사범과 전쟁…석달간 2만7천명 입건,https://news.naver.com/main/read.nhn?mode=LSD&mid=shm&sid1=101&oid=001&aid=0006388067,연합뉴스,"서민생활침해사범합동수사본부장 박민표 대검 형사부장 <<연합뉴스DB>>합동수사본부 3개월 집중 단속활동 결과 발표(서울=연합뉴스) 박대한 기자 = 서민생활침해사범을 뿌리 뽑기 위해 출범한 범정부 합동수사본부가 지난 석달간 관련 사범 2만7천명을 입건하고 905명을 구속하는 성과를 거뒀다.아울러 대부업체에 대한 세무조사를 통해 373억원의 탈세액을 추징하고, 인터넷 도박사이트 등을 단속해 326억원의 범죄수익을 환수했다.서민생활침해사범 합동수사본부(본부장 박민표 대검 형사부장)는 23일 서울 서초구 대검찰청에서 지난 3∼6월 추진한 서민생활침해사범 집중 단속활동 중간결과를 발표했다.합동수사본부는 지난 3월 서민생활침해사범 근절을 위해 검찰과 경찰청, 국세청, 안전행정부, 금융위원회, 미래창조과학부 등 유관기관이 참여한 가운데 대검에 꾸려졌다.합동수사본부는 출범 이후 지난달까지 3개월간 2만6천707명을 적발해 905명을 구속했다.범죄유형별 입건자(구속자)는 불법 사금융·채권추심행위 1천759명(25명), 불법 다단계·유사수신행위 5천576(218명), 보이스피싱 1천776명(117명), 서민상대 갈취사범 1만1천220명(199명), 불법사행행위 6천386명(346명) 등으로 집계됐다.특히 대부업체 134명에 대한 세무조사를 실시해 373억원의 탈세액을 추징했고, 인터넷 도박사이트 등 기업형 사행사범 단속에 나서 범죄수익 326억원을 환수했다.안전행정부 및 지방자치단체는 등록대부업체 4천22개소를 일제 점검, 1천666건의 법 위반 사항을 적발해 등록취소 등의 행정조치를 취했다.미래부는 공공·금융기관 전화번호를 사칭해 문자를 보낸 조작 전화번호 12만26건을 차단했다. 또 이 같은 보이스피싱을 방지하기 위해 국제전화 식별번호가 인터넷전화기에도 표시되도록 확대 적용했다.이에 따라 전화금융사기는 지난해 3∼6월 2천730건에서 올해 같은 기간 1천541건으로 43.6% 감소한 것으로 나타났다.금융위원회와 금융감독원은 전화금융사기 피해금 환급 절차를 통해 총 5천183개 계좌 40억원을 피해자들에게 환급해줬다.금융회사와 대부업체 장기연체 채무자 12만7천568명의 채무조정 신청을 접수해 이중 9만8천678명에 대한 지원 절차를 진행하고 있다.합동수사본부 관계자는 ""1차 단속 과정에서 나타난 미흡한 점을 보완해 지속적인 단속활동을 전개할 예정""이라며 ""서민 피해자를 보호하고 불법수익, 탈루세액 환수 및 징수에 박차를 가하겠다""고 밝혔다.<표> 서민생활침해사범 단속 중간결과┌─────┬─────┬─────┬─────┬───────┬─────┐│   실적   │ 수사성과 │ 행정조치 │범죄수익환│ 피해자 지원  │   기타   ││ 범죄유형 │          │          │   수ㆍ   │              │          ││          │          │          │탈세 추징 │              │          │├─────┼─────┼─────┼─────┼───────┼─────┤│불법 사금 │총 1,759명│총 1,666건│ 과세자료 │   수사의뢰   │장기연체자││  융 ㆍ   │   적발   │   적발   │총 3,697건│  총 838건,   │ 98,678명 ││채권추심행│ (구속 25 │ 등록취소 │   통보   │금융ㆍ법률지원│국민행복기││    위    │   명)    │    등    │소득세 등 │  총 4,675건  │ 금 통해  ││          │          │ 총 390건 │합계 373억│              │ 채무조정 ││          │          │   조치   │ 원 추징  │              │          ││          │          │          │          │              │          ││          │          │          │          │              │          │├─────┼─────┼─────┼─────┼───────┼─────┤│불법다단계│총 5,576명│          │          │              │          ││    ㆍ    │   적발   │          │          │              │          ││유사수신행│(구속 218 │          │          │              │          ││    위    │   명)    │          │          │              │          ││          │          │          │          │              │          │├─────┼─────┼─────┼─────┼───────┼─────┤│보이스피싱│총 1,766명│공공ㆍ금융│          │ 전화금융사기 │합동경보제││          │   적발   │   기관   │          │ 피해금 환급  │    로    ││          │(구속 117 │사칭 보이 │          │ 총5,183계좌  │ 피해건수 ││          │   명)    │  스피싱  │          │ 합계  40억원 │43.6% 감소││          │          │총120,026 │          │              │          ││          │          │ 건 차단  │          │              │          │├─────┼─────┼─────┼─────┼───────┼─────┤│서민 상대 │총 11,220 │          │          │              │          ││ 갈취사범 │ 명 적발  │          │          │              │          ││          │(구속 199 │          │          │              │          ││          │   명)    │          │          │              │          ││          │          │          │          │              │          │├─────┼─────┼─────┼─────┼───────┼─────┤│불법사행행│총 6,386명│          │합계 326억│              │          ││    위    │   적발   │          │    원    │              │          ││          │(구속 346 │          │범죄수익환│              │          ││          │   명)    │          │    수    │              │          ││          │          │          │          │              │          │└─────┴─────┴─────┴─────┴───────┴─────┘pdhis959@yna.co.kr[이 시각 많이 본 기사]☞<특집:전두환 추징> ④ 2천205억 완납까지 '멀고도 험난'☞김현중 ""성숙한 이미지 시도..한국적 미 살렸죠""☞이집트 무르시 찬반세력 충돌로 30여명 사상(종합2보)☞히딩크, 러시아 안지 감독직 사임☞5년간 안찾아간 로또 당첨금 1천780억원▶ 연합뉴스 모바일앱 다운받기▶ 인터랙티브뉴스<저작권자(c)연합뉴스. 무단전재-재배포금지.>"
115,2013-07-23,'교도소 가려고' 식당서 흉기위협 40대 영장,https://news.naver.com/main/read.nhn?mode=LSD&mid=shm&sid1=102&oid=001&aid=0006388162,연합뉴스,"(정선=연합뉴스) 이재현 기자 = 강원 정선경찰서는 23일 음식점 종업원을 흉기로 위협하고 편의점에 들어가 물건을 강탈한 혐의(특수강도)로 박모(40)씨에 대해 구속영장을 신청했다.박씨는 지난 21일 오후 4시 33분께 정선군 고한읍의 한 식당에서 술을 마신 뒤 종업원 A(62·여)씨를 흉기로 위협해 식대를 내지 않고 달아난 데 이어 옆에 있는 편의점에 들어가 흉기로 위협해 담배를 강탈한 혐의를 받고 있다.신고를 받고 출동한 경찰은 테이저 총으로 흉기를 든 박씨에게 투항을 유도해 현행범으로 박씨를 붙잡았다.조사결과 박씨는 최근 가지고 있던 100여만 원을 사기당해 자포자기 상태에서 교도소에 가려고 이 같은 범행을 저질렀다고 경찰은 밝혔다.jlee@yna.co.kr[이 시각 많이 본 기사]☞<특집:전두환 추징> ④ 2천205억 완납까지 '멀고도 험난'☞김현중 ""성숙한 이미지 시도..한국적 미 살렸죠""☞이집트 무르시 찬반세력 충돌로 30여명 사상(종합2보)☞히딩크, 러시아 안지 감독직 사임☞5년간 안찾아간 로또 당첨금 1천780억원▶ 연합뉴스 모바일앱 다운받기▶ 인터랙티브뉴스<저작권자(c)연합뉴스. 무단전재-재배포금지.>"
116,2013-07-23,"조현오 ""이인규 전 중수부장이 盧 차명계좌 안다""",https://news.naver.com/main/read.nhn?mode=LSD&mid=shm&sid1=102&oid=001&aid=0006388090,연합뉴스,"조현오전 경찰청장 <<연합뉴스DB>>재판부, 증인신청 기각…내달 27일 결심 예정(서울=연합뉴스) 한지훈 기자 = 조현오 전 경찰청장이 23일 이인규 전 대검 중수부장을 증인으로 신청했으나 재판부가 기각했다.조 전 청장은 이 전 중수부장이 노무현 전 대통령의 차명계좌 존재를 알고 있다는 주장을 되풀이했다.서울중앙지법 형사항소1부(전주혜 부장판사) 심리로 이날 열린 공판에서 조 전 청장 변호인은 ""차명계좌가 있다는 피고인 진술의 신빙성을 뒷받침하고자 한다""며 이 전 중수부장을 증인으로 신청했다.변호인은 ""이 전 중수부장은 노 전 대통령 서거 직전까지 수사를 총괄했다""며 ""차명계좌 존재를 아는 그에게 수사 내용을 묻겠다""고 했다.하지만 재판부는 ""노 전 대통령 서거에 책임을 지고 물러난 수사 책임자가 법정에 나와 당시 상황을 얘기하는 것은 부적절한 것으로 보인다. 사회적 논란을 야기할 수 있다""며 증인신청을 기각했다.앞서 이 전 중수부장은 언론매체 인터뷰를 통해 조 전 청장이 제기한 차명계좌 의혹이 사실이 아니라는 입장을 수차례 밝힌 바 있다.재판부는 다만, 대검 중수부 수사팀에서 계좌추적을 담당한 이모 당시 수사관을 증인으로 채택했다.이씨는 경찰 정보관을 통해 청와대 행정관 명의로 된 차명계좌 존재에 관해 전해 들었다며 조 전 청장이 지목한 사람이다.다음 재판은 내달 27일 오전 10시에 열린다. 재판부는 특별한 사정이 없으면 다음 재판에서 모든 절차를 마치고 심리를 종결할 예정이다.경찰 강연에서 노 전 대통령의 차명계좌 의혹을 제기해 사자 명예훼손 혐의로 기소된 조 전 청장은 1심에서 징역 10월을 받았다.1심 선고와 함께 법정구속된 조 전 청장은 발언 출처를 밝히겠다고 해 구속 8일 만에 풀려난 뒤 항소심 재판을 받고 있다.hanjh@yna.co.kr[이 시각 많이 본 기사]☞<특집:전두환 추징> ④ 2천205억 완납까지 '멀고도 험난'☞김현중 ""성숙한 이미지 시도..한국적 미 살렸죠""☞이집트 무르시 찬반세력 충돌로 30여명 사상(종합2보)☞히딩크, 러시아 안지 감독직 사임☞5년간 안찾아간 로또 당첨금 1천780억원▶ 연합뉴스 모바일앱 다운받기▶ 인터랙티브뉴스<저작권자(c)연합뉴스. 무단전재-재배포금지.>"
117,2013-07-23,'史草실종' 후폭풍…여야 동상이몽 속 '네탓공방',https://news.naver.com/main/read.nhn?mode=LSD&mid=shm&sid1=100&oid=001&aid=0006388085,연합뉴스,"모두발언하는 최경환 원내대표    (서울=연합뉴스) 배정현 기자 = 최경환 새누리당 원내대표(가운데)가 23일 오전 국회 원내대표실에서 열린 원내대책회의에서 모두발언을 하고 있다. 2013.7.23    doobigi@yna.co.kr與 ""문재인, 입장 밝혀야""…검찰 수사 촉구野, 국회 제출 정상회담 문건 단독열람 시도(서울=연합뉴스) 강영두 이유미 기자 = 국회가 ""2007년 남북정상회담의 대화록 원본을 국가기록원이 보유하고 있지 않다""는 결론을 내리면서 '사초(史草) 실종' 후폭풍이 정국을 강타하고 있다.여야는 23일 '대화록 증발'의 진상규명을 위해 사법기관의 수사가 필요하다고 주장하면서도 책임 소재에 대해서는 상대를 향해 '손가락질'을 하며 거친 입씨름을 벌였다.새누리당은 검찰 수사를 통한 원인규명을 거듭 촉구했다.최경환 원내대표는 이날 당 원내대책회의에서 ""누가, 어떻게, 왜 역사를 지우려 했는지 대화록이 사라진 경위를 명명백백히 밝히고 전대미문의 사초 실종에 대한 책임 소재를 분명히 가려야 한다""며 ""사초가 없어진 것이 확인된 만큼 검찰 수사를 통해 진실을 규명해야 한다""고 말했다.최 원내대표는 특히 고(故) 노무현 전 대통령의 비서실장이자 남북정상회담 준비위원장을 지냈던 민주당 문재인 의원을 겨냥, ""회담록 작성·보관·이관에 대해 누구보다도 잘 알 수 있는 위치에 있었는데 왜 이번 사태에 대해 말이 없느냐""라며 ""당당하지 못한 자세""라고 입장 표명을 요구했다.윤상현 원내수석부대표는 ""청와대에 존재했던 대화록이 2008년 초를 전후한 어느 시점에 감쪽같이 사라졌다""며 '노무현 정부' 인사들을 겨냥했다.이에 대해 민주당 정성호 원내수석부대표는 연합뉴스와의 통화에서 ""수사를 하든 특검을 하든 결판을 지어야 한다""고 수사 필요성에는 공감을 나타냈다.전병헌 ""국회제출 문건 열람으로 NLL 논란 해소해야""    (서울=연합뉴스) 배재만 기자 = 전병헌 민주당 원내대표가 23일 오전 국회 원내대표실에서 열린 원내대책회의에서 ""진실규명과 소모적 논란 해소를 위해 오늘부터 국회에 제출된 정상회담 사전.사후 문건 열람을 시작할 것""이라고 말하고 있다. 2013.7.23    scoop@yna.co.kr대화록 열람위원인 박민수 의원은 ""대화록 열람 사태의 원인 제공자는 새누리당""이라며 ""새누리당은 지난 대선 때 대화록을 흔들면서 충분히 재미를 봤다고 누구나 인식하고 있다""고 비판했다.민주당은 이날 국회 운영위원회에 제출된 남북정상회담 사전·사후 문건에 대한 단독 열람에 나섰다.이번 기회에 'NLL(북방한계선) 포기' 논란을 완전히 해소하겠다는 취지에서다.전병헌 원내대표는 ""대통령기록물 열람을 여야가 의결한 것은 진실 규명과 소모적 논란 해소를 위해서였다""며 ""이미 국회에 제출된 남북정상회담 사전 준비문건, 사후 이행문건의 열람만으로도 NLL 포기 의사가 있었는지 아닌지 충분히 확인할 수 있다""고 말했다.그러나 대화록 실종의 책임이 노무현 정부에 있는지, 아니면 이명박 정부에 있는지를 국회 차원에서 밝혀내지 못한 여야가 이처럼 이전투구식 정치 공방을 장기화시키는데 대해 비판여론이 점증할 것으로 전망된다.여야 정치권에서는 이 같은 여론을 감안해 여야가 조만간 '대화록 정국'의 출구를 모색하지 않겠느냐는 관측도 조심스럽게 제기되고 있다.k0279@yna.co.krgatsby@yna.co.kr[이 시각 많이 본 기사]☞<특집:전두환 추징> ④ 2천205억 완납까지 '멀고도 험난'☞김현중 ""성숙한 이미지 시도..한국적 미 살렸죠""☞윤상현 ""부속자료 野 단독열람은 합의위반""☞히딩크, 러시아 안지 감독직 사임☞'전두환 외동딸'은 대학 조교수…연희동 빌라 거주▶ 연합뉴스 모바일앱 다운받기▶ 인터랙티브뉴스<저작권자(c)연합뉴스. 무단전재-재배포금지.>"
118,2013-07-23,'더위 절정' 8월초 예년보다 더 덥다,https://news.naver.com/main/read.nhn?mode=LSD&mid=shm&sid1=103&oid=001&aid=0006388019,연합뉴스,"폭포를맞으며 더위를 식히고 있는 사람 <<연합뉴스DB>>(서울=연합뉴스) 이슬기 기자 = 연중 가장 더운 시기인 8월 초순부터 중순까지 예년보다 더 덥고 하순부터는 예년과 비슷한 수준의 더운 날씨를 보일 것으로 전망된다.본격적으로 시작된 올해 무더위는 9월 초까지 계속될 것으로 보인다.기상청은 23일 발표한 '3개월 기상 전망'에서 올해 여름 날씨를 이같이 예측했다.8월 초순에는 기온이 평년(23∼26도)보다 높아 더위가 절정에 달할 것으로 전망된다. 대기가 불안정해져 국지적으로 많은 비가 올 때도 있겠지만 강수량은 평년(47∼139㎜)과 비슷하겠다.중순과 하순에도 북태평양고기압의 영향을 받아 무더위가 계속되겠고 저기압의 영향으로 국지적으로 많은 비가 올 전망이다. 기온은 평년과 비슷하겠으며 강수량은 평년보다 많겠다.9월 우리나라는 덥고 습한 북태평양고기압의 영향을 받다가 이동성 고기압의 영향을 주기적으로 받으면서 맑고 건조한 날이 많겠다. 기온은 평년(18∼22도)보다 높고 강수량은 평년(132∼244㎜)보다 적겠다.10월은 이동성 고기압과 저기압의 영향을 주로 받아 기온의 변화가 크고 맑은 날이 많을 전망이다.wise@yna.co.kr[이 시각 많이 본 기사]☞<특집:전두환 추징> ④ 2천205억 완납까지 '멀고도 험난'☞김현중 ""성숙한 이미지 시도..한국적 미 살렸죠""☞이집트 무르시 찬반세력 충돌로 30여명 사상(종합2보)☞히딩크, 러시아 안지 감독직 사임☞5년간 안찾아간 로또 당첨금 1천780억원▶ 연합뉴스 모바일앱 다운받기▶ 인터랙티브뉴스<저작권자(c)연합뉴스. 무단전재-재배포금지.>"
119,2013-07-23,"해커, 한국 외교문서 노린다…외교부 사이버침해 급증",https://news.naver.com/main/read.nhn?mode=LSD&mid=shm&sid1=100&oid=001&aid=0006387889,연합뉴스,"5년새 3배가량 늘어…외교부·재외공관 홈페이지 표적(서울=연합뉴스) 강병철 기자 = 외교부와 재외공관을 대상으로 한 해킹 시도가 5년새 3배가량 급증한 것으로 나타났다.23일 외교부에 따르면 올해 외교부와 재외공관 인터넷 홈페이지를 대상으로 한 사이버 침해 시도는 1분기만 1천27건에 이른다. 월별 추세로 보면 연말까지 4천108건에 이를 것으로 전망된다. 이는 지난해보다 72%나 증가한 것이다.연도별 사이버 침해 시도는 2009년 1천309건에서 2010년 1천941건, 2011년 2천686건, 지난해 2천381건, 올해 전망되는 4천108건 등으로 급증하는 추세다.지난 2009년과 올해만 비교하면 5년새 3배가량 증가했다.사이버 침해는 인터넷 홈페이지를 대상으로 해킹 시도를 하는 것을 의미한다. 사이버 침해의 증가는 기본적으로 국내외 해커들이 우리나라의 외교문서를 훔치려는 의도에 따른 것이다.하지만 외교부는 인터넷과 외교전산망을 분리해 운영하기 때문에 해커들이 기밀문서를 빼가는 것은 거의 불가능하다고 설명하고 있다.군사기밀 문서가 많은 국방부도 외교부와 마찬가지로 인터넷과 국방전산망을 분리해 운영하고 있다.외교부의 한 관계자는 ""외교문서를 주고받는 외교전산망은 폐쇄적으로 운영되기 때문에 인터넷 홈페이지를 대상으로 한 사이버 침해와는 무관하다""고 말했다.사이버 침해와는 별도로 외교부 직원들이 받는 악성메일도 크게 늘고 있다. 2009년 24건에 불과했던 악성 메일은 올해에는 576건(1분기 144건)을 기록할 것으로 전망된다.한편 외교부는 직원들이 가지고 있는 스마트폰을 이용한 원격 도청을 원천적으로 차단하기 위해 장관 주재 실·국장회의 등을 할 때 스마트폰을 회의장 밖에 두도록 하고 있다.soleco@yna.co.kr[이 시각 많이 본 기사]☞<특집:전두환 추징> ④ 2천205억 완납까지 '멀고도 험난'☞김현중 ""성숙한 이미지 시도..한국적 미 살렸죠""☞미국 뉴욕서 보잉기 또 착륙사고…""8명 부상""☞-美야구- 류현진, 후반기 첫 등판서 5⅓이닝 4실점…시즌 8승(종합)☞朴대통령 ""설립목적 위배 국제중, 지위서 배제해야""▶ 연합뉴스 모바일앱 다운받기▶ 인터랙티브뉴스<저작권자(c)연합뉴스. 무단전재-재배포금지.>"
