,날짜,기사 제목,기사 링크,기사 출처,기사 내용
112,2013-07-08,비워도 밥 먹어도 쓰린 위장 속… 건강 적신호,https://news.naver.com/main/read.nhn?mode=LSD&mid=shm&sid1=102&oid=081&aid=0002346905,서울신문,"[서울신문]‘빈속일 때 쓰린 속이 밥을 먹어도 쓰리다. 내 위에서 무슨 일이 벌어지고 있는 것일까.’흔히 속이 쓰리면 위가 비어서라고 생각해 뭐든 먹어서 위를 채우려고 한다. 더러는 그러면 증상이 나아지기도 한다. 빈속에 위산이 과다 분비되면 위벽을 자극해 속이 쓰린 것이라고 여기는 것인데, 그런 속쓰림 증상이 반드시 공복에만 나타나는 것은 아니다.식후에 속쓰림이 더 심해진다면 ‘위궤양’을 의심해 봐야 한다. 위궤양은 위점막이 헐어 점막뿐 아니라 점막근층까지 움푹 파인 상태를 말한다. 주로 50~60대에 많이 발생하며, 위에 기생하는 헬리코박터 파일로리균 감염과 일상적인 소염진통제 복용이 주요 원인이다. 이 밖에도 술과 담배, 맵고 짠 음식을 먹는 등 좋지 않은 습관이 원인이기도 하다.이런 위궤양은 속쓰림과 복부 통증을 동반하는 것이 특징이다. 또 밥을 먹으면 통증이 더욱 심해져 식욕부진을 호소하는 환자도 있다. 약만 잘 복용하면 대부분 완치되지만 원인이 헬리코박터 감염이라면 제균 치료를 반드시 병행해야 치료 효과가 좋아진다. 만약 소염진통제를 자주 복용해야 한다면 위산분비 억제제를 함께 복용하는 것이 좋다.이와 달리 공복에 속쓰림이 심하다면 ‘십이지장궤양’일 가능성이 높다. 이는 위장과 바로 이어진 십이지장의 점막이 염증에 의해 손상된 상태로, 위궤양과 마찬가지로 헬리코박터 파일로리균 감염이나 소염진통제 과다 사용 등이 주요 원인이다. 하지만 위궤양과 달리 20~40대에 많이 발생하며, 공복 상태에서 통증이 더욱 심하게 느껴진다. 이때 제산제나 음식을 먹으면 증상이 다소 호전되는 느낌이 든다. 치료는 위궤양과 비슷하다.위궤양과 십이지장궤양은 증상부터 치료까지 비슷한 양상을 보이기 때문에 같은 질환으로 아는 경우가 많다. 하지만 둘은 엄연히 다른 질환이다. 흔히 속쓰림이 생기면 위산 과다라고 생각하기 쉽지만, 위산이 부족해도 같은 증상이 나타날 수 있다. 장영운 경희의료원 소화기내과 교수는 “위궤양은 위산 과다뿐 아니라 위산이 부족한 경우에도 발생하기 때문에 음식을 먹은 뒤에도 속이 쓰릴 수 있다”면서 “이와 달리 십이지장궤양은 위산 과다로 인해 통증이 생기기 때문에 음식물이 들어가면 증상이 호전되는 것처럼 느껴진다”고 설명했다.위궤양과 십이지장궤양에는 전문의의 정확한 진단과 적절한 약물치료가 중요하다. 이 과정에서 섣부르게 자가진단을 하는 경우 오히려 증상을 악화시킬 수 있음을 알아야 한다. 흡연과 음주는 위산에 대항하는 능력을 크게 떨어뜨리므로 금연·금주가 필요하다. 불규칙적으로 식사를 하거나 맵고 짠 음식을 즐기는 식습관도 개선해야 한다. 장 교수는 “위궤양이 잘 낫지 않고 자주 재발하면 악성 위궤양일 가능성이 높으므로 전문적인 치료를 받는 게 현명하다”고 조언했다. 심재억 전문기자 jeshim@seoul.co.kr■도움말장영운 경희의료원 소화기내과 교수[서울신문 다른기사 보러가기]☞ 한끼 최대 4676원 差… ‘식판의 차별’☞ [MLB] 투구폼 살짝 바꿨을 뿐인데… 더 무서워진 괴물☞ [아시아나機 美서 사고] “착륙전 해수면 기울어져 보여… 지진 난 것 같았다”☞ 황금알의 ‘김오곤 원장 다이어트’ 알고보니...☞ 메이저리그도 놀란 신수지 시구‘맛있는 정보! 신선한 뉴스!’ 서울신문(www.seoul.co.kr) [신문 구독신청]- Copyrights ⓒ서울신문사. 무단 전재 및 재배포 금지 -"
113,2013-07-08,[날씨] 중부지방 장맛비…중북부 최고 100mm 이상,https://news.naver.com/main/read.nhn?mode=LSD&mid=shm&sid1=103&oid=422&aid=0000017667,연합뉴스TV,"[날씨] 중부지방 장맛비…중북부 최고 100mm 이상[앵커]수도권을 비롯한 중부지방에 장맛비가 내리고 있습니다.기상센터 연결해 현재 상황 알아봅니다. 하창수 캐스터.[캐스터]네, 현재 경기북부와 강원북부에 비가 오고 있고요.일부 지역은 시간당 40밀리미터 안팎이 쏟아지면서 방금 전 경기 양주와 파주의 호우특보가 경보로 격상됐습니다.월요일 출근길, 평소보다 조금 더 서둘러 주셔야겠습니다.지금 같은 강한 비는 오늘 낮까지입니다.오후에는 잠시 그치기도 하겠지만, 중부지방은 종일 장맛비가 오락가락하겠고요.반면 남부지방은 무더운 가운데 낮부터 소나기가 지나겠습니다.예상되는 비의 양은 서울경기와 영서 30에서 70, 이 중 많은 곳은 최고 100밀리미터 이상입니다.특히 새벽과 오전 중 수도권과 그 북쪽지역에 집중호우가 쏟아질 것으로 보입니다.날씨였습니다.(하창수 기상캐스터)(끝)[이 시각 많이 본 기사]☞<아시아나기 사고> 관제탑 교신내용 시점 놓고 혼선☞<아시아나기 사고> 방송사 뉴스특보..가요 프로 결방☞<아시아나기 사고> ""공항 착륙유도장치 꺼져있었다""☞-U20월드컵- 한국 축구, U-20 월드컵 4강행 좌절(종합)☞<아시아나기 사고> 긴박했던 '착륙순간' 전후(종합)▶ 연합뉴스 모바일앱 다운받기▶ 인터랙티브뉴스<저작권자(c)연합뉴스. 무단전재-재배포금지.>"
114,2013-07-08,경기 북부 호우특보...100mm↑ 호우,https://news.naver.com/main/read.nhn?mode=LSD&mid=shm&sid1=103&oid=052&aid=0000464577,YTN,"[앵커멘트]경기북부에 호우특보가 발효중인 가운데 장대비가 쏟아지고 있습니다.오늘은 장마전선의 영향으로 서울 등 중북부지방에 100mm이상의 많은 비가 내릴 것으로 보입니다.YTN 중계차 연결해 장맛비 상황 알아보겠습니다. 차현주 캐스터!지금 서울은 비가 얼마나 내리고 있나요?[중계 리포트]그럼 자세한 오늘 날씨 전해드릴게요.현재 서울을 비롯한 중북부지방에 장맛비가 내리고 있습니다.특히 경기 북부에는 호우특보가 발효중인 가운데, 시간당 30mm 안팎의 강한 비가 집중되고 있는데요.밤 사이 경기도 김포시에 130.5mm, 고양시 능곡에 125.5mm, 인천 금곡엔 105mm의 많은 비가 내렸습니다.오늘 낮까지 중북부지방에는 벼락과 돌풍을 동반한 국지성 호우가 이어질 것으로 보여 피해 없도록 주의하셔야겠습니다.예상되는 비의 양은 내일까지 서울을 비롯한 중북부지방에 30~70mm, 많은 곳에는 100mm 이상입니다.중부지방의 비는 오늘 오후에 소강상태를 보이는 곳이 있겠습니다.한편, 남부지방은 무더위가 기승을 부립니다.호남과 경남을 중심으로 열대야가 나타난 가운데 낮 동안에도 전주가 30도, 대구가 33도까지 오르는 등 찜통더위가 이어지겠습니다.그나마 오후 한때 소나기가 내리면서 더위를 잠시 식혀주겠습니다.장마전선은 내일 오전까지 중북부지방에 영향을 주다가 이후엔 북한지방으로 올라가겠습니다.하지만 장마전선이 다시 남하하면서 금요일에는 중부지방에, 토요일에는 전국에 비가 내릴 것으로 보입니다.지금까지 숭례문에서 YTN 차현주입니다.☞ 네이버 뉴스스탠드에서 YTN 뉴스를 만나 보세요.☞ 언제 어디서나 뉴스가 궁금할 땐 'YTN 뉴스 앱'[아이폰 APP 다운로드↓][안드로이드 APP 다운로드↓][저작권자(c) YTN & Digital YTN. 무단 전재-재배포 금지]"
115,2013-07-08,퇴근 후에도 문 여는 은행 점포 늘어난다,https://news.naver.com/main/read.nhn?mode=LSD&mid=shm&sid1=101&oid=008&aid=0003078349,머니투데이,"[머니투데이 배규민 기자][-우리銀 3시간 연장 영업 '9 to 7 브랜치'·국민銀 pm 7 or 9시까지 '애프터뱅크']은행의 정상 영업시간 외에도 문을 여는 이른바 '애프터 뱅킹 영업점'이 늘어나고 있다. 지역 성격에 맞게 운영 시간을 탄력적으로 조정해 효율성과 수익성을 높이겠다는 취지다.예를 들어 직장인 밀접 지역의 경우 오전에는 은행 방문 고객이 많지 않고 오후 4시 이후엔 문을 닫아 직장인들의 이용이 쉽지 않기 때문이다.7일 은행권에 따르면 우리은행은 8일부터 '선릉중앙지점'의 영업시간을 오전 9시부터 오후 7시까지로 연장한다. 즉 기존 보다 영업시간이 3시간 늘어난다. 우리은행이 환전소가 아닌 일반 점포를 연장 영업하는 것은 이번이 처음이다.우리은행은 향후 6개월 동안 시범 운영한 후 고객들의 반응이 좋으면 확대 적용키로 했다. 이른바 직장인 특화 점포인 '9 to 7 branch(nine to seven branch)'를 늘려나간다는 계획이다.선릉중앙지점의 경우 직장인 등 개인 고객 뿐 아니라 영업점 주변에 포스코 등 기업 고객들도 몰려 있어 오픈 시간은 기존과 같은 오전 9시로 했다.오후 4시 이후에는 책임자 2명이 근무하면서 재테크와 펀드 등 상담을 집중적으로 도와준다. 직장인들은 점심시간을 이용해 주로 은행을 방문하는 데 시간이 짧아 제대로 된 상담을 받지 못하는 경우가 많기 때문이다.상담 외에도 예·적금 가입과 대출 상담 등 기본적인 업무도 모두 가능하다. 대출과 펀드 가입은 서류를 작성해 놓으면 다시 방문하지 않아도 예정된 날짜에 실행된다.직장인 밀집 지역 이외에 주거단지 밀집 지역도 고객들의 방문 패턴을 파악해 영업시간을 조정하는 방안도 검토한다는 계획이다.국민은행 앞서 지난해부터 직장인 특화점포(after bank)를 운영해 오고 있다. 올 5월 문을 연 강남역 지점을 포함해 테헤란로, 가산디지털단지역 등 총 3곳을 두고 있다. 이들 영업점의 운영 시간은 낮 12시부터 오후 7시까지다. 입금, 여신, 외환 등 일반 점포와 동일한 서비스를 받을 수 있다.서울 우면동 지점은 오후 2시부터 오후 9시까지 문을 연다. 주거 밀접지역이라 오전에 손님이 많지 않고 또 퇴근하고 돌아오는 맞벌이 부부들을 위해 영업시간을 밤 9시까지로 조정했다.신한은행도 애프터 뱅킹 영업점 운영 여부를 검토하고 있다. 다만 아직 시행 시기는 정해지지 않았다고 은행측은 밝혔다.[머니투데이 핫뉴스]☞해나, 오늘 새벽 사망...PD ""해나는 자유가 됐습니다""☞고준희 2년 전, 노출 화보에서 섹시미 뽐내 '눈길'☞정현, 오늘 밤 韓선수 최초 윔블던 주니어 우승 도전☞이다희 초근접 셀카, 무결점 미모에 '세련미 물씬'☞이혁재 사업실패 고백, ""아내에게 미안"" 눈물[오늘의 HOT포토][스페셜 포토][손안의 경제뉴스 머니투데이 모바일웹]배규민기자 bkm@<저작권자 ⓒ '돈이 보이는 리얼타임 뉴스' 머니투데이, 무단전재 및 재배포 금지>"
116,2013-07-08,"[단독]檢, ""'박원순 제압문건' 국정원 것 아니다"" 잠정결론",https://news.naver.com/main/read.nhn?mode=LSD&mid=shm&sid1=102&oid=079&aid=0002488585,노컷뉴스,"글자 폰트 등 불일치...""구체적인 문서내용 진위 밝혀야"" 지적도[CBS노컷뉴스 정영철 기자·김수영 기자]민주당이 지난 5월 폭로한 '반값등록금 운동 차단'·'박원순 서울시장 제압' 의혹 문건에 대해 검찰이 문제의 문건이 국가정보원의 문건과 형식(폰트)이 다르다고 잠정 결론 내렸다.이번 사건을 수사해온 서울중앙지검 특별수사팀(팀장 윤석열 여주지청장)이 국정원 문건이 아닌 것으로 가닥을 잡은 것은 민주당이 제보 받은 문건에서 국정원 문서 고유의 폰트(글자 크기와 서체)가 발견되지 않았기 때문이다.수사팀은 민주당이 검찰에 제출한 문건과 사실조회 등을 통해 국정원으로부터 넘겨받은 문서 양식을 대검찰청 문서감정반에 보냈고, 검찰은 폰트와 편집 형태 등을 바탕으로 문제의 문건이 국정원이 생산하는 문서 양식에 맞지 않는다고 판단했다.국정원이 ‘문제의 문건은 국정원이 작성한 문서가 아니’라며 해당 문건의 작성자로 지목된 직원에 대한 소환조사에 반대하고 있어, 검찰은 문건 작성 의심을 받고 있는 직원에 대한 조사도 하지 못하고 있는 것으로 알려졌다.이에 따라 검찰이 해당 문건에 대한 실질적인 수사에 나설지 여부를 두고 중대한 기로에 서게 됐다.검찰이 국정원 직원에 대한 조사 없이 문서 형식 등을 이유로 해당 문건이 국정원에서 작성된 것이 아니라는 결론을 내리고, 문건 내용에 대한 조사를 하지 않으면 이번에 고발된 국정원 직원 등은 무혐의 처리될 공산이 크다.이에 대해 검찰 관계자는 ""국정원 문건이 아니면 내용에 대한 수사를 계속해야할지 검토해야 한다""고 말했다.하지만 민주당이 폭로한 문건 중 일부에는 국정원 직원의 실명과 전화번호까지 구체적으로 나온 상황에서 실체를 밝히기 위한 검찰 조사가 이뤄져야 한다는 주장도 나오고 있다.이들 두 문서의 내용이 매우 구체적일 뿐만 아니라 앞선 검찰조사를 통해 드러난 국정원의 광범위한 정치·선거 개입의 일환으로 문제의 문서가 만들어 졌을 개연성이 매우 크다는 것이 그 이유다.특히 국정원 문서를 복사해 밖으로 유출할 때는 고유의 폰트가 변형되는 것으로 전해지고 있어, 민주당이 제출한 문건이 '가짜'라고 단정하고도 어렵다는 지적도 나온다.민주당이 폭로한 문건은 원본이 아닌 복사본이었다.이와 관련해 국정원에 정통한 관계자는 ""국정원에서 사용하는 용지로는 내부문서를 복사할 수 없고, 외부의 일반 용지를 가져가서 복사해야 한다""며 ""하지만 그럴 경우 고유의 폰트대로 복사가 이뤄지지 않아 글의 서체 등이 달라진다""고 설명했다.일각에서는 원세훈 전 국정원장을 정치·선거개입 혐의로 기소한 검찰이 또다시 정치적 사건으로 국정원에 대한 조사를 진행하기 부담스럽다는 이유로 수사를 꺼리는 게 아니냐는 분석도 나오고 있다.steel@cbs.co.kr·sykim@cbs.co.kr[관련기사]●세종문화회관 사장 사상 초유 '퇴출 위기'●노회찬 ""국정원은 '국가걱정원'…최고 걱정거리""●박원순 ""무상보육, 지자체 울며 겨자 먹기로…""●박원순, 국무회의서 추경 없는 무상보육 지원 요청●""박원순, 안철수에게 빚 있다고 하지 마라""(대한민국 중심언론 CBS  뉴스FM98.1 / 음악FM93.9 / TV CH 412)<저작권자 ⓒ CBS 노컷뉴스(www.nocutnews.co.kr) 무단전재 및 재배포 금지>[노컷뉴스 모바일웹][스마트한 영상뉴스 '노컷V'][뉴스 속 속사정, 'Why뉴스']"
117,2013-07-08,“아시아나기 중상자 15~16명 여전히 의식불명”,https://news.naver.com/main/read.nhn?mode=LSD&mid=shm&sid1=102&oid=005&aid=0000566543,국민일보,"[쿠키 지구촌] 6일(현지시간) 미국 샌프란시스코 국제공항에서 착륙 사고를 낸 아시아나항공 여객기의 탑승객 일부가 심각한 부상으로 여전히 의식을 되찾지 못하는 것으로 조사됐다. 이번 사고로 중국 국적의 여고생 2명이 숨지고 중상 40여명을 포함해 182명이 부상해 입원 치료를 받고 있다.7일 외신에 따르면 중상자가 다수 수용된 샌프란시스코 종합병원의 마거릿 넛슨 외과장은 이날 기자회견에서 “의료진의 소견을 종합한 결과 복부 손상, 척추 골절 등이 많고 일부는 마비, 머리 외상 등의 증상도 보이고 있다”며 “환자 2명은 활주로에서 항공기에 의해 끌렸는지 도로에서 굴렀을 때 입는 상처가 있다. 이들이 여객기 바깥에 있었는지는 확실치 않지만 어쨌든 둘 다 살아 있다”고 말했다.넛슨 과장은 말을 할 수 있는 환자는 모두 의료진에 여객기 뒤쪽 좌석에 앉아 있었다고 전했다고 설명했다. 기체 동체의 꼬리날개 쪽이 지상에 부딪히면서 사고가 일어나 뒤쪽 좌석에 있던 탑승객들에게 피해가 집중됐음을 뒷받침하는 것이다.넛슨 과장은 일부 환자는 의식불명 상태라고 덧붙였다. 그는 “환자 가운데 머리 외상이나 복부 출혈 등 심각한 부상을 입은 15∼16명이 여전히 의식 불명”이라며 “환자 일부는 이미 두 차례 수술을 받은 경우도 있고 아직 많은 외과 수술을 해야 한다”고 전했다. 기체 화재로 인한 화상은 발견되지 않은 것으로 알려졌다.국민일보 쿠키뉴스 김상기 기자 kitting@kmib.co.kr[관련기사]▶ [U20월드컵] 기적의 동점골 → 통한의 승부차기… 한국 4강행 무산▶“일촉즉발 상황에 짐 들고 대피하다니…” 아시아나 사고 일부 탑승객에 인터넷 성토▶ 서울발 아시아나 여객기, 샌프란시스코 공항서 충돌…“2명 사망”▶ 브라질월드컵에서 기성용 포기하나…비밀 페이스북 징계 검토▶ 학교옆에서 10년 넘게 영업 강남 성매매업소 결국 철거<갓 구워낸 바삭바삭한 뉴스 ⓒ 국민일보 쿠키뉴스(www.kukinews.com), 무단전재 및 재배포금지>"
118,2013-07-08,20년간 짝퉁 루이뷔통 제작…민형사 소송 연패,https://news.naver.com/main/read.nhn?mode=LSD&mid=shm&sid1=102&oid=001&aid=0006358123,연합뉴스,"(서울=연합뉴스) 김계연 기자 = 20년 동안 여러 차례 송사에 휘말리면서도 짝퉁 루이뷔통 가방을 꿋꿋이 만들어 팔아온 부부가 민사소송에서 또 패소했다.박모씨 부부의 짝퉁 제작은 1994년으로 거슬러 올라간다. 부부는 루이뷔통이 가방에 사용하는 도형들을 조금씩 변형해 상표 등록까지 했다.그러나 부부는 곧바로 이어진 소송전에서 한 번도 이기지 못했다.박씨는 1994년 상표법 위반 혐의로 기소돼 서울지법 동부지원에서 벌금 1천500만원을 선고받았다. 2010년에는 서울서부지법에서 징역 1년6월에 집행유예 3년형을 받았다.민사소송도 잇따랐다. 루이뷔통은 1997년께 손해배상 소송을 제기했다가 5천만원을 받고 화해했다.그런데도 부부가 짝퉁 가방을 계속 만들자 2008년에는 가방의 생산·판매를 금지해달라며 소송을 내 승소했다.송사가 이어지는 사이 박씨 부부는 가방에 인쇄할 도형의 상표를 추가로 등록하는 '의지'를 보였다. 결국 루이뷔통은 2011년 재산상 손해에 손상된 브랜드 이미지까지 보상하라며 소송을 냈다.서울고법 민사4부(이균용 부장판사)는 ""루이뷔통에 8천만원을 배상하고 짝퉁 가방을 더이상 생산·판매하지 말라""며 원고 일부 승소로 판결했다고 8일 밝혔다.재판부는 ""알파벳 'L'과 'V'를 겹친 도형의 경우 형태가 일부 다르더라도 전체 문양의 중심이 되는 부분이어서 수요자나 거래자들이 이른바 '엘브이 모노그램'으로 생각해 출처를 오인·혼동할 염려가 있다""고 설명했다.박씨 부부는 개별적인 도형들을 상표로 등록했지만, 전체적인 구성이 비슷하다면 상표권 침해에 해당한다는 것이 대법원 판례다.재판부도 ""여러 도형이 반복적으로 배열된 상표의 경우 전체가 주는 인상으로 출처를 식별하는 경우가 적지 않다""며 ""기억이나 연상을 일으키게 하는 부분은 개별 도형들의 구체적인 모양보다는 전체적 구성, 배열 형태 및 표현방법""이라고 판시했다.재판부는 ""과거에도 상표권 침해에 관한 분쟁이 있었는데도 문양만 조금씩 변경하면서 이번 사건의 변론이 종결될 때까지 여전히 제품을 생산·판매하고 있다""고 지적하며 이미지 훼손으로 인한 루이뷔통의 손해도 배상하라고 판결했다.dada@yna.co.kr[이 시각 많이 본 기사]☞아시아나 사장 ""관제탑 교신내용은 착륙후 이뤄진 것""(종합)☞<아시아나기 사고> 방송사 뉴스특보..가요 프로 결방☞<아시아나기 사고> 관제탑 교신내용 시점 놓고 혼선☞-U20월드컵- 한국 축구, U-20 월드컵 4강행 좌절(종합)☞외교부 ""한국인 승객 44명 현재 병원 치료중""(종합)▶ 연합뉴스 모바일앱 다운받기▶ 인터랙티브뉴스<저작권자(c)연합뉴스. 무단전재-재배포금지.>"
