,날짜,기사 제목,기사 링크,기사 출처,기사 내용
79,2013-07-23,사립탐정 등 우리나라에 없던 직업 100개 육성된다,https://news.naver.com/main/read.nhn?mode=LSD&mid=shm&sid1=102&oid=003&aid=0005279379,뉴시스,"【서울=뉴시스】한정선 기자 = 사립탐정과 문신아티스트 등 현재 우리나라에 없는 직업 100여개가 발굴·육성된다.고용노동부는 23일 오전 청와대 세종실에서 열린 국무회의에서 지난 4월부터 한국고용정보원과 주요 선진국의 직업과 우리나라 직업을 비교·분석하는 연구 끝에 검토가 필요한 직업들을 보고했다고 밝혔다.이번에 보고된 새 직업들은 미국과 일본, 영국, 호주 등의 직업 조사결과 우리나라에 없는 외국 직업 650여개 중 도입검토가 가능한 100여개를 선별한 것이다.새로운 직업들 중에는 고인이 생전에 인터넷에 남긴 흔적들을 청소하는 '디지털 장의사' 등 직종 간 융합을 통한 새 직업과 경력단절여성 등의 시간제 일자리로 적합한 '자살예방상담자'와 '노년플래너' 등이 포함됐다.새 직업 육성은 1단계 '외국직업 비교·분석'에 이어 2단계 '새 직업 발굴·육성 방안 마련', '새로운 일자리 창출로 연계'하는 3단계로 진행된다.이를 위해 고용부는 차관을 단장으로 관계부처 협의체인 '미래 유망직업 발굴·육성 추진단'을 구성해 추진해 나갈 계획이다.한편 박근혜 대통령은 지난 3월16일 청와대 수석비서관 회의에서 '선진국에 있는데 우리에게 없는 잠재적 직업을 발굴해 일자리 창출하라'고 언급한 바 있다.jsh@newsis.com[뉴시스 이시간 핫 뉴스]ㆍ ´모래시계´ 김종학 PD 자살…""가족에 미안""ㆍ [단독]고교 교사가 女제자와 성관계…임신·낙태까지ㆍ 화장실에 영아 유기해 죽게한 30대女 집유ㆍ 7년간 女에어로빅 강사 스토킹한 40대女ㆍ 주택 옥상서 나체 난동 40대男, 이유가…★ 뉴시스 뉴스, 이젠 네이버 뉴스 스탠드에서도 만나세요★ 손 안에서 보는 세상, 모바일 뉴시스<저작권자ⓒ 공감언론 뉴시스통신사. 무단전재-재배포 금지.>"
80,2013-07-23,금융·학원에도 부가세 과세…소득세 면세자 축소,https://news.naver.com/main/read.nhn?mode=LSD&mid=shm&sid1=101&oid=001&aid=0006389006,연합뉴스,"부가·소득세 면세 분야 중장기적으로 과세 전환양도세 중과 폐지, 법인세 인하…조세硏, 중장기방향 제시(세종=연합뉴스) 박용주 차지연 박수윤 기자 = 기존에 세금을 부과하지 않던 금융·학원 등 부가가치세 면세 영역이 중장기적으로 과대 대상으로 전환될 것으로 보인다.500만명에 달하는 소득세 면세자를 줄이고 양도세 중과제도는 폐지하는 것이 바람직하다는 방향성이 제시됐다.새 정부가 설정한 국정 과제인 복지 확충을 위해 증세나 지출 축소 등에 대한 국민적 합의가 도출될 필요가 있다는 지적도 제기됐다.국책 연구기관인 조세연구원은 23일 조세정책 방향 공청회에서 이런 내용 등을 담은 중장기 개편 방향을 발표했다.기획재정부는 이 보고서를 토대로 정부의 중장기 조세정책 방향을 확정해 8월 세제개편안과 함께 발표할 예정이다.정부는 매년 세제 개편안을 발표할 때 정책의 일관성과 합리성을 유지하자는 차원에서 중장기 개편 방향을 올해부터 처음으로 설정하기로 했다.연구원은 발표 자료에서 복지 지출 증가에 따른 재정 수요 충족 차원에서 부가세 면세·감면을 줄여야 한다고 제안했다. 이는 기존에 부가세 면세 영역이었던 금융과 의료영역, 학원 등을 과세 범위에 집어넣자는 의미다.이 경우 수익증권 판매 대행 등 수수료가 발생하는 금융사의 부가서비스, 성인 대상의 학원 서비스 등이 과세 영역으로 들어오게 된다.쌍커플·코성형·지방흡입 등을 제외한 성형수술, 침사(鍼士)와 안마사 임상병리사, 물리치료사, 치과위생사 등이 제공하는 서비스나 장의사의 장례서비스도 중장기적으로 과세 영역이 돼 가격 인상 요인으로 작용하게 된다.개별소비세는 환경세 등을 강화하면서 고가 사치재를 중심으로 개편해야 한다고 제안했다.소득세와 사회보장기여금 수입은 면세자(2011년 근로자 기준 36.1%)를 줄이고 과표를 양성화하는 방식을 통해 늘려야 한다고 지적했다.비과세 소득을 과세로 전환하고 소득공제 중 일부를 세액공제로 전환하며 금융소득에 대한 과세 범위를 늘리는 방안 등을 대안으로 제시했다.재산세의 경우 양도세 중과를 폐지하고 종합부동산세는 부담을 현실화하면서 지방세로 전환하는 방안을 검토해야 한다고 설명했다.조세연구원은 국제적으로 인하 경쟁이 붙은 법인세에 대해선 부담을 완화하는 것이 바람직하다고 제안했다.상속·증여세는 일정 부분 누진성을 유지하되 투자·성장을 유발할 수 있도록 적정 수준으로 낮춰야 한다고 지적했다.연구원은 '증세없는 복지'라는 새 정부의 국정 기조 중 일부를 국민적인 합의로 수정해야 할 필요성을 우회적으로 제기하기도 했다.연구원은 한국의 조세부담률이 선진국에 비해 낮다고 분석하면서 잠재성장률 하락 상황에서 고령화로 재정수요는 급증하고 있으며 통일을 대비해 재정 여력을 확보할 필요가 있다고 지적했다.이어 새 정부가 세율 인상이나 세목 조정 등 직접적 증세보다 비과세·감면 축소, 지하경제 양성화, 금융소득 과세 강화에 초점을 맞추는 것을 긍정적으로 평가하면서도 이를 통해 복지 재원을 충분히 마련하지 못하면 증세나 지출 축소 등에 대해 국민적인 합의를 도출해야 한다고 제안했다.안종석 선임연구위원은 ""세금을 얼마나 거둬들일지는 복지 수준을 어느 정도로 가져갈지에 따라 결정된다""면서 ""지하경제양성화 등을 통해 마련하는 자금이 부족하다면 복지를 더는 안 할 것인지 세금을 올릴 것일지는 사회적 합의로 결정해야 한다""고 말했다.speed@yna.co.krcharge@yna.co.krclap@yna.co.kr[이 시각 많이 본 기사]☞<특집:전두환 추징> ④ 2천205억 완납까지 '멀고도 험난'☞김현중 ""성숙한 이미지 시도..한국적 미 살렸죠""☞朴대통령 ""설립목적 위배 국제중, 지위서 배제해야""☞-美야구- 류현진, 후반기 첫 등판서 5⅓이닝 4실점…시즌 8승(종합)☞미국 뉴욕서 보잉기 또 착륙사고…""8명 부상""▶ 연합뉴스 모바일앱 다운받기▶ 인터랙티브뉴스<저작권자(c)연합뉴스. 무단전재-재배포금지.>"
81,2013-07-23,[태안참사속보]‘프로파일러·화학자·군인…’ 끝내 피지 못한 5명의 ‘꿈’,https://news.naver.com/main/read.nhn?mode=LSD&mid=shm&sid1=102&oid=032&aid=0002362868,경향신문,"사설 해병대 캠프에 참여했다가 사고를 당한  5명의 합동분양소가 마련된 공주사대부고.  공주｜정혁수 기자태안 앞바다에서 숨진 공주사대부고 학생 5명의 장례식을 하루 앞둔 23일 아침. 이들이 안치돼 있는 충남 공주장례식장과 합동분양소가 차려져 있는 공주사대부고는 차분히 가라 앉아 있었다. 이른 아침부터 내리기 시작한 비는 시간이 가면서 더욱 굵은 빗방울로 변해 마치 학생들의 영혼을 달래는 듯 했다.이들 5명 모두는 어디 한군데 나무랄데가 없는 아이들 이었다. 집안의 기대를 한 몸에 받고 있는 기대주였고, 학교의 자랑이었다. 전국단위로 학생을 모집하는 공주사대부고에 지원하는 중학생들은 대부분 각 학교 상위 1% 이내에 들만큼 성적도 뛰어났다. 이들도 마찬가지였다.지난 18일 사고당시 바닷물에 빠진 친구를 구하고 자신은 파도에 휩쓸려간 이병학군은 범죄자들의 심리상태를 연구하는 ‘프로파일러’를 꿈꾸던 학생이었다. 이 군은 이를 위해 경찰대학교 진학이라는 목표도 세워 두었다. 위기에 빠진 친구를 구하기 위해 한순간의 망설임도 없이 자신의 목숨을 던질만큼 담대했지만, 평소 그의 모습은 예의바르고 애교도 많았던 것으로 알려졌다.이 군 어머니는 “하나밖에 없는 누나라서 그런지 우애가 좋았다. 항상 누나에게 깍뜻하게 대했고, 심성이 그렇게 착할 수 없었다”고 말했다. 기숙사에서 생활하다 집에 오는 날이면 엄마에게 늘 손톱을 깍아 달라고 졸라대던 아들의 해맑은 표정을 잊지 못했다. 어머니는 “캠프 떠나기 전에 손톱을 깍아주니까‘엄마, 저 캠프 잘 다녀올께요. 건강히 잘 다녀올테니까 걱정마세요’라고 말했던 애인데 그게 마지막이 될 줄이야···”라며 가슴을 쓸어 내렸다.김동환군의 꿈은 훌륭한 화학자 였다. 난치병 치료제를 개발해 병석에 누워있는 수많은 이들에게 도움을 주겠다는 목표가 있었다. 스스로 공부하기를 즐겨해 부모가 이제껏‘공부하라’ 채근한 적이 없었다고 했다. 동환군 어머니는 “듬직한 장남이었다. 학교생활 등 이런저런 얘기를 언제나 스스럼없이 부모와 얘기했고, 주변에서 ‘요즘 아이같지 않다’는 칭찬을 늘 듣고 살았다”고 말했다. 또 “동환이에게 여태껏 한번도 공부하라고 말을 한적이 없다. 성적이 잘 나오지 않으면 동환이가 먼저 ‘이번에는 성적이 생각보다 좀 안나왔는 데 다음에는 더 잘할 수 있어요’라며 자신을 담금질 했다”고 회고했다.진우석 군은 육군사관학교에 진학해 우리나라를 지키는 ‘호국간성(護國干城)’이 되고자 했다. 우석군은 어릴적 기자가 되고 싶어할 만큼 주변 사물과 사회현상에 대해 남다른 관심을 보였던 아이였다. 고등학교 진학후 어머니의 권유로 육군사관학교로 진로를 바꾼 뒤로는 매일 밤 농구를 하며 체력을 단력할 만큼 철저한 자기관리를 해 왔다.우석군 어머니는 “우석이는 어떤 일이든 부모가 하지 말라면 절대 하지 않는 착한 아들이었다”며 “어른들 말씀을 잘듣고 예의있게 행동해 어른들의 칭찬을 많이 받았다”고 말했다. 그는 “아이가 농구를 즐겨해 이번에 선물로 줄려고 새 농구복을 샀는데 입혀 보지도 못하게 됐다”며 말을 잇지 못한채 끝내 울음을 터뜨렸다.이들의 죽음을 슬퍼하는 추모열기도 확산되고 있다. 직접 분향소를 찾아오는 조문행렬도 계속 되고 있는데다, 인터넷 추모의 글도 잇따르고 있다. 특히 이들과 지난 2년을 같이 생활한 공주사대부고 57기 동기들이 제작한 추모 동영상이 유투브(Youtube)에서 많은 이들의 관심을 모으고 있다. ‘5명의 친구를 잃은 공주사대부고 친구들의 추모영상’이라는 제목의 이 동영상에서 이들은 “우리는 여러분을 잊지 않겠습니다. 영원히 가슴 속에 새기겠습니다. 얘들아 잘가···친구들아 지켜주지 못해 미안해”라며 숨진 5명의 친구들을 추모했다.사설 해병대 캠프에 참여했다가 사고를 당한  5명의 빈소가 마련된 충남 공주장례식장에 조문객이 이어지고 있다.  공주｜정혁수 기자<공주|정혁수 기자 overall@kyunghyang.com>경향신문 [오늘의 인기뉴스]▶ [속보]김종학 PD, 숨진 채 발견…여명의 눈동자, 모래시계 등 연출▶ MB는 “NLL 회의록 봤다”는데…▶ ‘패륜아들’ 부모 눈물에 재판부…결국▶ “후쿠시마 원전 오염수 바다로 흘렀다”▶ 류현진, 후반기 첫 등판서 시즌 8승모바일 경향 [경향 뉴스진|경향신문 앱|모바일웹] | 공식 SNS 계정[경향 트위터][미투데이][페이스북][세상과 경향의 소통 커뮤니티]- ⓒ 경향신문(www.khan.co.kr), 무단전재 및 재배포 금지〈경향신문은 한국온라인신문협회(www.kona.or.kr)의 디지털뉴스이용규칙에 따른 저작권을 행사합니다.〉"
82,2013-07-23,에너지효율 낮은 자동차 만들면 과징금(종합),https://news.naver.com/main/read.nhn?mode=LSD&mid=shm&sid1=101&oid=001&aid=0006388958,연합뉴스,"서울강변북로가 출근 차량들로 붐비고 있다. <<연합뉴스DB>>에너지이용 합리화법 개정안 국무회의서 공포(서울=연합뉴스) 강건택 기자 = 앞으로 에너지 효율이 떨어지는 자동차를 만들거나 수입하면 과징금을 내야 한다.정부는 23일 청와대에서 박근혜 대통령 주재로 국무회의를 열어 이 같은 내용을 담은 '에너지이용 합리화법' 개정안을 공포했다.공포안에는 자동차 제조업자나 수입업자가 평균 에너지 소비효율기준을 지키지 못한 경우 과징금을 부과할 수 있도록 하는 조항이 신설됐다. 지금까지는 소비효율기준을 어겨도 제재할 수 있는 법적 근거가 없었다.에어컨처럼 직접 에너지를 소모하지 않더라도 창세트(창틀과 유리를 결합한 제품), 타이어 등 에너지 절약과 관련 물품을 고효율에너지인증 대상 기자재로 지정함으로써 인센티브를 주는 방안도 시행된다.'정부 3.0' 추진계획에 따라 공공기관 행정정보 개방을 확대하는 내용의 '공공데이터의 제공 및 이용 활성화에 관한 법률' 개정안과 불량식품 제조·판매 업자 등을 대상으로 부당이득 환수제를 도입하는 내용의 '식품위생법' 개정안도 이날 함께 공포됐다.정부는 이외에도 고엽제 후유증 환자, 독립유공자, 참전 유공자에게 지급하는 수당과 급여를 보호하기 위해 일정 액수 이하의 압류를 금지하는 내용의 '독립유공자예우에 관한 법률안' 등 5개 법률 개정안을 심의·의결했다.이들 개정안에는 고엽제 후유증 환자와 각종 유공자에 대한 지원을 장애등급, 생활수준 등에 따라 조정하는 내용도 포함됐다.국무회의에서는 법률공포안 46건, 법률안 7건, 대통령령안 4건, 일반안건 1건 등을 심의·의결했다.firstcircle@yna.co.kr[이 시각 많이 본 기사]☞<특집:전두환 추징> ④ 2천205억 완납까지 '멀고도 험난'☞김현중 ""성숙한 이미지 시도..한국적 미 살렸죠""☞朴대통령 ""설립목적 위배 국제중, 지위서 배제해야""☞-美야구- 류현진, 후반기 첫 등판서 5⅓이닝 4실점…시즌 8승(종합)☞미국 뉴욕서 보잉기 또 착륙사고…""8명 부상""▶ 연합뉴스 모바일앱 다운받기▶ 인터랙티브뉴스<저작권자(c)연합뉴스. 무단전재-재배포금지.>"
83,2013-07-23,'휴가철 얌체운전 꼼짝마'…고속道 무인비행선 뜬다,https://news.naver.com/main/read.nhn?mode=LSD&mid=shm&sid1=103&oid=003&aid=0005279046,뉴시스,"경부·영동선 상공 30~50m서 단속갓길차로, 버스전용차로 단속【서울=뉴시스】양길모 기자 = 휴가철 고속도로 상공에 무인비행선이 떠 버스전용차로, 갓길차로 등 얌체운전을 단속한다.한국도로공사는 경찰청과 함께 여름 휴가철 기간 동안 고속도로 상공에 무인비행선을 띄워 안전운전을 계도하고 법규위반 차량 단속에 나선다고 23일 밝혔다.단속에 투입되는 무인비행선은 길이 12m, 무게 50㎏으로, 고속도로 위 30~50m 상공에서 촬영이 가능한 3630만 화소의 고성능 카메라를 장착돼 고속도로 양방향의 차량번호판 식별이 가능하다.지상에 있는 차량이 제어기를 통해 최대 1㎞ 떨어진 곳까지 원격 조종할 수 있으며, 연속비행은 2시간까지 가능하다.무인비행선은 24일 오후 2시에 서울요금소 하이패스센터에서 시험비행을 마친 후 25일까지 경부고속도로에서 1차 위반차량 단속에 실시, 30일~8월4일 경부와 영동고속도로에서 2차 단속에 나선다.단속대상은 지정차로, 갓길차로, 버스전용차로 위반 등의 행위다.도로공사 관계자는 ""무인비행선은 단속보다는 멀리서 비행선에 적힌 '위반차량 단속 중""과 ""안전띠 착용 캠페인' 문구를 통해 교통법규를 준수하도록 하는 효과에 더 무게를 두고 있다""며 ""이번 단속활동 효과를 분석해 향후 확대적용 여부를 결정할 계획""이라고 밝혔다.dios102@newsis.com[뉴시스 이시간 핫 뉴스]ㆍ ´모래시계´ 김종학 PD 자살…""가족에 미안""ㆍ [단독]고교 교사가 女제자와 성관계…임신·낙태까지ㆍ 화장실에 영아 유기해 죽게한 30대女 집유ㆍ 7년간 女에어로빅 강사 스토킹한 40대女ㆍ 주택 옥상서 나체 난동 40대男, 이유가…★ 뉴시스 뉴스, 이젠 네이버 뉴스 스탠드에서도 만나세요★ 손 안에서 보는 세상, 모바일 뉴시스<저작권자ⓒ 공감언론 뉴시스통신사. 무단전재-재배포 금지.>"
84,2013-07-23,"문재인 ""논란 중단돼야…새누리, NLL 충분히 활용""",https://news.naver.com/main/read.nhn?mode=LSD&mid=shm&sid1=100&oid=003&aid=0005279303,뉴시스,"【서울=뉴시스】추인영 기자 = 민주당 문재인 의원은 23일 2007년도 남북정상회담 회의록 실종과 관련, ""논란을 끝내야 한다""고 주장했다.문 의원은 이날 성명서를 통해 ""대화록 유무 논란으로 인해, 문제의 본질이 가려져서는 안 된다. 국회가 국가기록원의 기록을 열람하려한 목적은 NLL논란을 조기에 종결하기 위한 것이었다""며 이같이 말했다.그는 ""국정원이 공개한 대화록에 의하더라도 NLL포기가 아니라는 것이 다수 국민의 의견""이라며 ""거기에, 열람 가능한 기록물까지 살펴보면 진실이 명확하게 드러난다""고 주장했다.그는 ""대화록이 없더라도 정상회담 전후의 기록들만으로도 진실을 규명하기에 충분하다""며 ""새누리당은 이미 NLL을 충분히 활용했다. 선거에 이용했고, 국정원 대선개입을 가렸다. 그 정도 했으면 NLL 논란을 끝내야 하지 않겠나""라고 말했다.iinyoung85@newsis.com[뉴시스 이시간 핫 뉴스]ㆍ ´모래시계´ 김종학 PD 자살…""가족에 미안""ㆍ [단독]고교 교사가 女제자와 성관계…임신·낙태까지ㆍ 화장실에 영아 유기해 죽게한 30대女 집유ㆍ 7년간 女에어로빅 강사 스토킹한 40대女ㆍ 주택 옥상서 나체 난동 40대男, 이유가…★ 뉴시스 뉴스, 이젠 네이버 뉴스 스탠드에서도 만나세요★ 손 안에서 보는 세상, 모바일 뉴시스<저작권자ⓒ 공감언론 뉴시스통신사. 무단전재-재배포 금지.>"
