,날짜,기사 제목,기사 링크,기사 출처,기사 내용
42,2013-07-08,"OECD ""선진국 경제 회복세…신흥국 주춤""",https://news.naver.com/main/read.nhn?mode=LSD&mid=shm&sid1=101&oid=001&aid=0006360013,연합뉴스,"(파리=연합뉴스) 김홍태 특파원 = 경제협력개발기구(OECD)는 8일 선진국들의 경제는 회복세에 있지만 신흥국들은 정체되거나 둔화세를 보이고 있다고 분석했다.OECD는 이날 발표한 월간 세계 경제전망 보고서를 통해 지난달 미국과 일본의 경기선행지수(CLI)가 지속적인 개선 흐름을 보이면서 OECD 회원국 전체적으로 상승세를 보인 것으로 평가됐다고 말했다.보고서에 따르면 미국은 5월 CLI가 4월과 같은 101.1로 지속적인 회복세를 보였으며 일본은 101.1에서 101.3으로 더욱 개선됐다.유로존(유로화 사용 17개국)의 경우 프랑스의 경기선행지수가 99.5로 상대적인 정체를 보였지만 전체적으로는 100.3을 기록, 4월의 100.1보다 개선된 흐름을 나타냈다.G5(주요 5개국)과 G7(주요 7개국)의 CLI도 호전된 모습을 보였다.이처럼 OECD 회원국은 전체적으로 CLI가 개선됐으나, 신흥국에서는 정체를 보이거나 둔화세를 나타냈다.러시아(99.2→98.9)·브라질(99.3→99.1)·중국(99.6→99.5)은 CLI가 둔화하는 흐름이었으며, 그동안 뒤처졌던 인도만이 97.5에서 97.6으로 신흥국 가운데 유일하게 소폭 상승세를 보였다.hongtae@yna.co.kr[이 시각 많이 본 기사]☞<아시아나기 사고> 교관도 첫 교육비행☞<아시아나기 사고> '참사 속 영웅' 떠오른 이윤혜 승무원☞윔블던 준우승 정현 ""이형택 뛰어넘는 선수 될래요""(종합)☞<아시아나기 사고> ""사고직전 항속 157㎞에 불과""▶ 연합뉴스 모바일앱 다운받기▶ 인터랙티브뉴스<저작권자(c)연합뉴스. 무단전재-재배포금지.>"
43,2013-07-08,국지성 호우 잦아 계곡 물놀이 사망 늘어,https://news.naver.com/main/read.nhn?mode=LSD&mid=shm&sid1=102&oid=056&aid=0000005709,KBS,"<앵커 멘트>최근 들어 국지성  집중호우가 자주 내리면서  갑자기 불어난 물로 예기치 못한 피해가 발생하고 있습니다.특히, 산간계곡 하류의 주민이나 피서객들은 상류에 갑자기 큰 비가  내리면 대비할 틈도 없이 화를 당하는 경우가 많으니까 조심하시기 바랍니다.송승룡 기자가 보도합니다.<리포트>강원도 평창의 금당계곡,  지난달 25일 밤, 동네 친구들과 낚시를 즐기던 50대 마을 주민이 갑자기 불어난 물에 휩쓸려 목숨을 잃었습니다.낚시를 하던 곳에는 비가 내리지 않았지만  상류엔 많은 비가 내렸기 때문입니다.<인터뷰> 김진호(목격자/평창군 대화면) : ""비는 전혀 안 왔고, 고기 망태기가 물에 둥둥 뜨길래, 낚싯대도 떠내려가고 깜짝 놀라 일어나 보니까.""사고 당일,  평창의 공식 강우량은 0밀리미텁니다.하지만, 사고가 난 계곡 상류엔 불과 세 시간여 만에  50mm가 넘는  집중호우가 쏟아졌습니다.불어난 물은 삽시간에  하류의 하천으로 몰려들었습니다.""목격자들은 이 하천의 경우에도, 평소에는 발목도 안 차던 물이, 사고 당시에는 1미터 가까이 차올랐다고 증언하고 있습니다.""지난해 피서철인 7월과 8월  강원도의 계곡에서 수난사고로 숨진 사람은 14명.2010년에 3명, 2011년에 한 명도 없었던데 비해 급증했습니다.<인터뷰> 이기중(강원도소방본부 상황총괄담당) : ""바다에서의 사고는 예년과 비슷하게 발생하고 있습니다. 그러나, 산간계곡에서의 사고는 늘고 있는 추세입니다. 갑작스런 국지성 호우로 인해.""2010년대 들어  전국에서 발생한 시간당 30밀리미터 이상의 국지성 집중호우는 연평균 113.5회로 1980년대의 56회보다 배 이상 늘었습니다.KBS 뉴스 송승룡입니다.송승룡[관련기사]▶ 블랙박스 분석…“1.5초 전 재상승 시도”▶ 11일 동亞컵 엔트리 발표, 홍心 어디로?▶ 아시아나 여객기 착륙사고 당시 영상 공개▶ 샌프란시스코 공항은 ‘가장 위험한 공항’▶ LG, 올스타전 싹쓸이…봉중근 최다득표▶  KBS뉴스 SNS -[트위터][페이스북][미투데이][저작권자ⓒ KBS(www.kbsnews.com) 무단복제-재배포 금지]"
44,2013-07-08,교통사고로 부인 사망…“사고 아닌 살인사건”,https://news.naver.com/main/read.nhn?mode=LSD&mid=shm&sid1=102&oid=056&aid=0000005704,KBS,"<앵커 멘트>2년 전 인천에서 부부가 탄 승용차가  도로변 표지석을  들이받아 부인이  숨지는 사고가  있었습니다.단순 교통 사고사로 묻힐뻔했는데 검찰이 끈질긴  수사 끝에 남편의 무서운 음모를 밝혀냈습니다.임종빈 기자가  보도합니다.<리포트>지난 2011년 8월 28일 새벽 0시쯤,    승용차가 4차선  도로변에 있는 표지석을 들이받아  조수석에 타고 있던  42살 이 모씨가 숨졌습니다.운전자였던 남편  46살 김 모씨는 경찰 조사에서 중앙선을 넘어 마주 오던 차량을 피하기 위해  오른쪽으로 방향을 급하게 틀다  사고가 났다고 진술했습니다.경찰은 김씨가 사고 직후 4천만 원의 보험금을 탄 사실에 주목하고 수사를 벌였지만 증거가 부족해  단순 교통사고로 처리했습니다.     그러나 검찰의 결론은 달랐습니다.김 씨의 진술을 토대로  3D 모의실험을 하면  1차로에서 오른쪽으로 방향을 틀어  표지석과 충돌하면 표지석 모서리에 부딪힐 수밖에 없어  사고 차량 앞범퍼에는  뾰족하게 패인 자국이 남아야 합니다.하지만, 김 씨 차량의 앞범퍼에는 넓적한 면에 걸쳐 찍힌 자국이 있었는데 모의실험 결과 이 자국은  직진하던 차량이 표지석을 정면으로 충돌할 때 생기는 것으로 결론을 얻었습니다.<녹취> 강신엽(인천지검 형사2부장) : ""직진 주행을 하면서 들이받아야 자기 안전은 확실하게 보장받고, 부인 쪽인 조수석을 들이받을 수 (있으니까요.)""사고 한 달 전에는 조수석에 에어백이 없는 모델의  차량으로 교체했다는 사실도 밝혀낸 검찰은  김씨를 살인 혐의로 구속했습니다.KBS 뉴스 임종빈입니다.임종빈[관련기사]▶ 블랙박스 분석…“1.5초 전 재상승 시도”▶ 11일 동亞컵 엔트리 발표, 홍心 어디로?▶ 아시아나 여객기 착륙사고 당시 영상 공개▶ 샌프란시스코 공항은 ‘가장 위험한 공항’▶ LG, 올스타전 싹쓸이…봉중근 최다득표▶  KBS뉴스 SNS -[트위터][페이스북][미투데이][저작권자ⓒ KBS(www.kbsnews.com) 무단복제-재배포 금지]"
45,2013-07-08,짐 들고 대피 ‘금물’…90초 안에 탈출해야,https://news.naver.com/main/read.nhn?mode=LSD&mid=shm&sid1=102&oid=056&aid=0000005714,KBS,"<앵커 멘트>이번 사고 때도 일부 승객들은 바리바리 짐을 들고  대피를 했습니다.승객 수백 명의  생사를 가르는 순간에  이런 행동은 매우  위험하다고 하는데요.항공기 사고가  났을 때 어떻게 행동해야 하는지, 조빛나 기자가  취재했습니다.<리포트>사고 직후, 펼쳐진   비상용 미끄럼틀로 탈출을 하는 순간,   자세히 보니 가방까지  챙겨 나온 이들이 보입니다.가벼운 손가방은 물론이고 끌고 가는 짐가방까지  갖고 나왔습니다.불과 얼마 후 비행기는 폭발했습니다.더 많은 승객들이  가방을 챙기려 지체했다면 참담한 결과가 될 수  있었다는 얘기입니다.실제로 짐을 챙길 때와  그냥 탈출할 때를 비교해 봤습니다.<녹취> ""벨트풀어! 이쪽으로 ! 내려!""불이 꺼져 어두운 기내,   머리 위 선반에서  짐을 꺼내려는 승객과 탈출하려는 승객이 뒤엉켜 대피가 쉽지 않습니다.비상 미끄럼틀을  내려올 때도 무거운 짐을  서로 먼저 던지는 바람에  시간이 지체됩니다.이렇게 성인 14명이 대피할 때, 짐이 있으면 시간이 15초나 더 걸렸습니다.다섯 명이 더 대피 할 수 있는 시간입니다.짐 외에도 하이힐이나 볼펜, 귀고리등 날카로운 물건도 금물입니다.유일한 생명통로격인  비상 미끄럼틀이 찢어질 수 있기 때문입니다.항공기 사고 때 생사를 가르는 시간은 불과 90초.<인터뷰> 정영미(서울호서직업전문학교 항공서비스과 교수) : ""현재로는 아무런 이상이 없다해도 비행기에 화재가 발생하거나 유독가스로 상해를입을 수 있기 때문에...""따라서 항공기 사고 때에는 90초 이내 탈출이 완료되도록  모든 승객들이 협조하는 게  우선입니다.KBS 뉴스 조빛나입니다.조빛나[관련기사]▶ 블랙박스 분석…“1.5초 전 재상승 시도”▶ 11일 동亞컵 엔트리 발표, 홍心 어디로?▶ 아시아나 여객기 착륙사고 당시 영상 공개▶ 샌프란시스코 공항은 ‘가장 위험한 공항’▶ LG, 올스타전 싹쓸이…봉중근 최다득표▶  KBS뉴스 SNS -[트위터][페이스북][미투데이][저작권자ⓒ KBS(www.kbsnews.com) 무단복제-재배포 금지]"
46,2013-07-08,불법브로커 통해 환자 유치한 성형외과 압수수색,https://news.naver.com/main/read.nhn?mode=LSD&mid=shm&sid1=102&oid=001&aid=0006360006,연합뉴스,"(서울=연합뉴스) 김아람 기자 = 서울 강남경찰서는 불법 브로커를 통해 환자를 유치한 혐의(의료법 위반 등)로 강남 지역 성형외과 10여곳을 지난달 압수수색했다고 8일 밝혔다.경찰에 따르면 이들 병원은 정부에 환자 유치업체로 등록되지 않은 불법 브로커와 계약하고 환자 수술비의 일정금액을 수수료 명목으로 주며 중국 등지에서 환자를 모집한 혐의를 받고 있다.중국 현지 브로커와 한국에서 활동하는 브로커 등 여러 명이 중간에 수수료를 챙기면서 수술비가 많게는 5배까지 올라간 것으로 알려졌다.경찰은 이들 병원이 정식 환자 유치업체를 통한 환자 유치에 어려움을 겪자 불법 브로커와 계약한 것으로 보고 있다.경찰은 불법 브로커를 통해 환자를 유치한 성형외과가 더 있을 것으로 보고 수사를 계속하고 있다.rice@yna.co.kr[이 시각 많이 본 기사]☞<인터뷰> 아시아나 승무원 ""승객대피 생각에 생명위협 못느껴""☞박은혜, SBS 아침극 '두 여자의 방' 주연☞<아시아나기 사고> 기장, B777 운항경력 9차례·43시간☞<축구협회 기성용 징계 여부 놓고 '신중모드'>☞국토부 ""아시아나 동체 꼬리 방파제 턱 충돌 확인""▶ 연합뉴스 모바일앱 다운받기▶ 인터랙티브뉴스<저작권자(c)연합뉴스. 무단전재-재배포금지.>"
47,2013-07-08,"""미 경찰, 윤창중 기소 중지 가능성 """,https://news.naver.com/main/read.nhn?mode=LSD&mid=shm&sid1=100&oid=079&aid=0002488993,노컷뉴스,"""檢, 미국 수사만 지켜보고 있어 실망 ""[CBS 시사자키 제작진][CBS 라디오 '시사자키 정관용입니다']■ 방 송 : FM 98.1 (18:00~20:00)■ 방송일 : 2013년 7월 8일 (월) 오후 7시■ 진 행 : 정관용 (한림국제대학원대학교 교수)■ 출 연 : 유선희 통합진보당 최고위원◇ 정관용> 윤창중 전 청와대 대변인, 나라 망신시켰던 일. 여러분 기억하시죠? 하지만 이제 기억도 가물가물해질 정도로 벌써 한 두 달이 지금 됐습니다. 오늘로 딱 두 달이 되는 그런 날이기도 했네요. 이거 이대로 잊혀져서는 안 된다고 그러면서 벌써 한 달 전에 한국 검찰 측에 윤창중 전 대변인을 고발한 분들이 있습니다. 통합진보당 유선희 최고위원 연결해 보죠. 안녕하세요?◆ 유선희> 네, 안녕하세요?◇ 정관용> 한국 검찰에 고발하신 거죠?◆ 유선희> 네.◇ 정관용> 어떤 혐의로 고발한 겁니까?◆ 유선희> 지금 피해 여성에 대한 성추행 혐의가 있다는 것이 기본 내용이고요. 그리고 5월 11일날 진행한 대국민 기자회견. 성추행이 전혀 없었고 피해 여성을 격려하는 차원에서 허리 한번 툭 쳤다는 그 기자회견의 내용이 허위사실 적시에 의한 명예훼손이었다라는 내용으로 고발하였습니다.◇ 정관용> 성추행하고 명예훼손, 두 가지로군요.◆ 유선희> 네.◇ 정관용> 우리 유선희 최고위원 혼자하신 건가요? 아니면 어떤 분들이 같이 하셨나요?◆ 유선희> 전국 여성연대 소속의 전국 여성단체 회원들하고요. 통합진보당 여성 당원들이 천인공노할 윤창중을 고발한다는 내용으로 1000명의 여성 고발인단을 모집하였습니다. 그래서 고발하게 되었습니다.◇ 정관용> 1000명?◆ 유선희> 네.◇ 정관용> 그런데 우리나라 법상 지금 성추행의 경우에는 친고죄예요. 즉 피해를 입은 사람이 고소해야 되는 거고요. 또 허위사실 적시에 의한 명예훼손죄는 이른바 반의사불벌죄라고 해서 이것 역시 명예훼손을 당한 사람이 이거 처벌해 달라라고 하는 의사를 보이지 않으면 처벌하지 않는 이런 걸로 되어 있거든요.◆ 유선희> 네.◇ 정관용> 그런데 지금 우리 여성단체에서 모으신 1000명은 직접 피해자는 아니시지 않나요?◆ 유선희> 네. 직접 피해자는 아니지만 저희들도 여러 가지로 이 사건으로 피해와 정신적 고통을 받았고요. 그리고 충분히 고소는 하지 못해도 고발은 할 수 있습니다.◇ 정관용> 이 얘기가 고소와 고발의 차이죠, 맞아요.◆ 유선희> 그래서 저희들이 미국에서 이 사건을 다루고 있지만 경범죄로 다루고 있고요. 또 윤창중 씨를 소환수사를 하지 않을 수 있다는 그런 소식도 듣고 있는 상황이었고. 또 이건 단순한 성추행 사건이 아니라고 저희는 보고 있습니다. 고위공직자가 나라와 국민의 명예를 너무 심각하게 실추시킨 이런 사건인데. 한국 검찰에서 반드시 수사하고 진상을 밝히고 그에 응당한 처벌을 해야 한다고 생각해서 고발하게 되었습니다.◇ 정관용> 이게 고소와 고발의 차이점입니다. 중요한 것 지적해 주셨고. 그래서 고소는 못했지만 고발을 한 것이다.◆ 유선희> 네, 고발을 하면 당연히 수사를 하게 돼 있고요. 기소여부에 대해서는 피해 여성의 동의 여부나 여러 가지 정황을 고려해야 되겠지만 기본적으로 기본 수사는 하게 되어 있습니다.◇ 정관용> 검찰은 지금 어떤 입장을 밝히고 있습니까? 고발한 것에 대해서.◆ 유선희> 제가 한 달이 지났는데도 고발인인 저도 부르지 않고 그래서 직접 검찰청에 전화해 봤더니 하여튼 미국 수사를, 수사 상황을 지켜보고 있고 그 결과가 나와야 판단할 수 있다. 그리고 피해 여성의 의사도 확인되지 않는 조건에서 수사하기가 어렵다. 그래서 최소한의 윤창중 씨에 대한 주소지, 출국 상황 이런 기본 조사만 하고 있다. 이런 말씀을 들었고요. 저희는 미국 수사와 상관없이 검찰에서 기본적인 사실 관계에 대한 수사라도 적극적으로 해 달라라고 고발을 한 것인데 미국 수사만 지켜보고 있다고 해서 참으로 실망스럽지 않을 수 없었습니다.◇ 정관용> 지금 미국 수사는 어떻게 진행되고 있답니까? 혹시 관련 정보를 가지고 계신가요?◆ 유선희> 지금 성폭력에 관한 경범죄로 분류돼서 수사하고 있다고 알고 있고요. 또 최근 피해 여성과 면담도 진행하면서 수사를 진행하고 있는 것으로 알고 있습니다. 그러나 경범죄이기 때문에 강제적으로 윤창중을 소환할 수도 없고. 또 윤창중 씨가 소환에 응할 가능성도 없고. 또 외교 문제도 있어서 기소중지를 내릴 가능성도 있다는 소식을 좀 듣고 있습니다.◇ 정관용> 이걸 경범죄로 분류한 이유는 뭘까요?◆ 유선희> 미국에서는 살인이나 아주 중한 범죄가 아니면 경범죄로 분류해서 수사를 하고 있다고 저는 알고 있습니다.◇ 정관용> 그렇게 되면 강제 소환을 못하는 건가요? 경범죄의 피의자의 경우에는.◆ 유선희> 네. 그리고 범죄인도 해야 될 대상이 되어 있지 않기 때문에 강제적으로 소환하기도 어렵다고 합니다.◇ 정관용> 다시 정리하면 경범죄로 분류가 됐다, 때문에 범죄인 인도 대상도 아니다.◆ 유선희> 네.◇ 정관용> 그래서 강제 소환을 한국정부에 요청하기도 어렵다. 이런 얘기로군요.◆ 유선희> 그렇죠. 그리고 윤창중 씨가 수사에 응할 가능성도 전혀 없는 이런 상황이기 때문에 이건 이 사건을 더 이상 진척하기 어렵다고 하는 그런 판단에서 기소중지를 내릴 가능성이 있다는 그런 것이죠.◇ 정관용> 그렇게 되면 지금까지 파악한 상황으로만 본다면 윤창중 씨는 아무런 처벌을 받지 않게 되겠네요?◆ 유선희> 그럴 가능성이 굉장히 높다고 생각하고 있습니다. 지금 한국 검찰 측에서도 우리 국민들은 지금 이 사건에 대해서 진실을 알고 싶어 하시고. 그리고 또 그에 응당한 처벌을 받아야 된다고 지금 생각하는 것이 국내 정서고 요구라고 저는 생각하고 있거든요. 그렇지만 한국 검찰은 미국의 수사 상황을 지켜보고 그리고 피해 여성의 입장이 이러니 결국은 수사할 수 없다는 입장으로 갈 것 같습니다.◇ 정관용> 그러면 우리 유선희 최고위원 같으신 분들께서는. 물론 조심스럽기는 합니다만 피해 여성 측과 접촉을 해서 피해 여성이 강력히 처벌을 원하니 한국 검찰에게 고소해야 되겠다. 이렇게 하실 수 없을까요? 지금 미국 조사 상황으로 봐서는 아무런 처벌도 안 받게 될 것 같으니까 여쭤보는 건데요.◆ 유선희> 하여튼 우리 한국에서는 성폭력, 성추행 사건이 참으로 끊이지 않고 벌어지고 있고. 또 고위 공직자의 성추행 문제는 아주 심각한 문제이기도 하고. 그래서 반드시 수사하고 다시는 이런 일이 벌어지지 않도록 대책을 수립해야 한다는 차원에서 피해 여성에게 적극적으로 수사와 처벌에 동의해 달라고 부탁을 하고 싶은 심정인데요. 지금 피해 여성이 극도로 상상할 수 없는 모욕과 수치심을 당한 피해 여성의 입장에서 언론 노출도 꺼리고 있고 또 사건이 확대되는 것에 대한 부담도 갖고 있다는 이야기가 간간이 들리고 있어서요. 저희들도 피해 여성의 입장을 존중하는 입장에서 좀 조심스러운 상황입니다.◇ 정관용> 그래요. 그러면 어찌 보면 이대로 끝나버릴 가능성이 제일 높아 보이는데요. 상식적으로 지금까지의 상황으로 봐서는.◆ 유선희> 그렇게 돼서는 절대 안 되죠.◇ 정관용> 촉구의 의미로 지금 검찰에 고발하고 정부의 자세 변화를 요구한다. 이 말씀이시네요.◆ 유선희> 한국 검찰이 적극적으로 수사에 나서야 된다는 생각이 들고.◇ 정관용> 알겠습니다.◆ 유선희> 우리 국민들이 여론을 모아주어야 된다고 생각합니다.◇ 정관용> 여기까지 듣죠. 고맙습니다.◆ 유선희> 네, 감사합니다.◇ 정관용> 통합진보당 유선희 최고위원이었습니다.jcn2000@hanmail.net[관련기사]●'윤창중 학습효과'?…인턴은 男, 건배는 주스●""연주회때 팬티 하얀색…""●윤창중 피해여성 父 ""엉덩이만 쳤다고 경찰에 신고했겠나""●윤창중은 어디에●박 대통령 ""그런 사람이었나""…윤창중에 강한 실망감(대한민국 중심언론 CBS  뉴스FM98.1 / 음악FM93.9 / TV CH 412)<저작권자 ⓒ CBS 노컷뉴스(www.nocutnews.co.kr) 무단전재 및 재배포 금지>[노컷뉴스 모바일웹][스마트한 영상뉴스 '노컷V'][뉴스 속 속사정, 'Why뉴스']"
48,2013-07-08,南인원 25명 내일 개성공단 방북…철수 67일만에 처음,https://news.naver.com/main/read.nhn?mode=LSD&mid=shm&sid1=100&oid=001&aid=0006359993,연합뉴스,"개성공단 재가동, 10일 후속회담 결과에 달려    (서울=연합뉴스) 백승렬 기자 = 김형석 통일부 대변인이 10일 정부서울청사에서 정례브리핑을 통해 지난 7일 실무회담에서 개성공단 문제 해결을 위한 첫 걸음을 내디뎠지만 공단의 재가동 여부는 오는 10일 열리는 후속회담의 결과에 달려있다고 발언하고 있다.   2013.7.8    srbaek@yna.co.kr(서울=연합뉴스) 홍지인 기자 = 통일부는 8일 우리측 인원 25명이 9일 개성공단에 입경하기로 했다고 밝혔다.우리 쪽 인원이 개성공단에 발을 들이는 것은 홍양호 개성공단관리위원장 등 7명이 북한 노동자 미지급금에 대한 협상을 마치고 마지막으로 귀환한 지난 5월3일 이후 67일 만이다.이번 방북은 오는 10일 열리는 당국간 실무회담과 시설점검, 물자 반출을 위해 하루 먼저 올라가 사전 준비를 위한 차원이다.남북은 이날 판문점 남북 연락관 접촉에서 9일 오전 우리 쪽 인원의 개성공단 방문에 합의했다.사전 선발대는 당국자 8명과 개성공단관리위·KT·한국전력 등 유관 기관 관계자 17명 등으로 이뤄졌다.ljungberg@yna.co.kr[이 시각 많이 본 기사]☞<인터뷰> 아시아나 승무원 ""승객대피 생각에 생명위협 못느껴""☞박은혜, SBS 아침극 '두 여자의 방' 주연☞<아시아나기 사고> 기장, B777 운항경력 9차례·43시간☞<축구협회 기성용 징계 여부 놓고 '신중모드'>☞국토부 ""아시아나 동체 꼬리 방파제 턱 충돌 확인""▶ 연합뉴스 모바일앱 다운받기▶ 인터랙티브뉴스<저작권자(c)연합뉴스. 무단전재-재배포금지.>"
