,날짜,기사 제목,기사 링크,기사 출처,기사 내용
76,2013-07-25,포스코 2분기 영업이익 9천30억원…30.5%↓(종합),https://news.naver.com/main/read.nhn?mode=LSD&mid=shm&sid1=101&oid=001&aid=0006393748,연합뉴스,"직전 분기보다는 실적 개선…3분기엔 기대(서울=연합뉴스) 옥철 기자 = 포스코는 올해 2분기 연결 제무제표 기준 매출액이 15조6천30억원, 영업이익이 9천30억원이라고 25일 공시했다.포스코는 이날 콘퍼런스콜(전화회의) 방식으로 기업설명회(IR)를 열어 2분기 실적을 이같이 발표했다.2분기 영업이익은 직전 분기(1분기)의 7천170억원보다는 25.9% 늘어났으나 작년 같은 분기(1조3천억원)보다는 30.5% 감소했다.올 상반기 영업이익은 1조6천195억원으로 작년 상반기(2조519억원)보다 21.1% 줄었다.2분기 매출액은 1분기(15조6천30억원)보다 7.0% 늘었으나 작년 2분기(16조4천880억원)보다는 5.4% 줄었다.2분기 순이익은 2천410억원을 기록했다.포스코 단독 기준으로는 2분기 매출액이 7조7천400억원, 영업이익은 7천30억원이다.포스코의 2분기 조강생산량은 885만t, 제품판매량은 841만t이다.포스코는 이어 전망공시에서 올해 조강생산량을 3천700만t, 판매량을 3천500만t으로 내다봤다. 매출액은 연결기준으로는 64조원, 단독기준으로는 32조원으로 전망했다.올해 투자비는 연결기준 7조∼8조원, 단독기준으로는 3조5천억원∼4조원으로 점쳤다.포스코는 전반적으로 세계 철강 수요 감소와 제품 판매가격 하락에 따라 2분기에도 영업이익 증가세를 견인하지는 못했다. 그러나 직전 분기보다는 실적이 다소 개선됐다.세계 철강 경기는 3분기를 저점으로 점차 회복할 것으로 기대되고 있다.포스코는 ""철강 부문 실적 개선과 건설·에너지·ICT 부문 영업이익 기여도 증가로 지난 분기보다는 실적이 개선됐다""며 ""광양 고로 개보수의 영향으로 전체 판매량은 소폭 줄었지만 매출액은 늘었다""고 설명했다.포스코는 엔저 영향에도 주요 경쟁지역인 중국·동남아에서는 올 상반기 155만t, 185만t의 제품 판매량을 기록함으로써 작년 동기보다 실적이 14.3%, 12.3% 각각 늘었다고 전했다.포스코는 상반기 누적 원가절감액이 3천248억원으로 집계됐다면서 지난달 내용적 6천㎥의 세계 최대 고로로 재탄생한 광양 1고로의 가동에 따라 용선 제조원가 절감액이 1천억원에 이를 것으로 전망했다.oakchul@yna.co.kr[이 시각 많이 본 기사]☞검찰 '전두환 재산 추징' 관련 삼성생명 압수수색☞<""저 세상에서 모래시계 2편을…"" 김종학 PD 영결식>☞엔저에 참치 매출 급증…횟감순위 바뀌었다☞<동아시안컵축구> '실험 끝낸' 홍명보號, 일본전에 승부수☞<특집:전두환 추징> ⑦ 전재용-이창석 '은밀한 커넥션'▶ 연합뉴스 모바일앱 다운받기▶ 인터랙티브뉴스<저작권자(c)연합뉴스. 무단전재-재배포금지.>"
77,2013-07-25,민주당 기초선거 정당공천 폐지 방침에 반응 엇갈려,https://news.naver.com/main/read.nhn?mode=LSD&mid=shm&sid1=100&oid=003&aid=0005284113,뉴시스,"【서울=뉴시스】박대로 김동현 기자 = 민주당이 25일 전체 당원 대상 투표 후 시군구 기초의원과 기초자치단체장 선거에 관한 정당공천제도 폐지 방침을 당론으로 확정하자, 새누리당을 비롯해 정치권 안팎에서 반응이 엇갈렸다.새누리당 민현주 대변인은 ""민주당의 결정에 환영을 표한다""면서 ""새누리당은 지난해 대선 때 기초단체장과 기초의원 후보에 대한 정당 공천을 폐지하는 정치쇄신을 약속했으며 그 실천의 일환으로 이미 4·24재보궐선거에서 기초단체장과 기초의원에 대한 무공천을 실시한 바 있다""고 밝혔다.민 대변인은 ""당 정치쇄신특별위원회는 지난 4일 기초단체장과 기초의회 선거의 점진적인 정당공천제 폐지를 골자로 한 공천제도 개혁안을 발표했으며 의원총회, 당협위원장 회의 등 당내 의견 수렴과 논의과정을 거쳐 최선의 방안을 모색할 것""이라고 당내 논의 상황을 전했다.그는 ""새누리당은 향후 국회 정치쇄신개혁특위에서 민주당과 함께 발전적인 논의를 통해 진정한 풀뿌리 민주주의가 정착되도록 노력하겠다""고 향후 방침을 밝혔다.기초선거 정당공천 폐지를 요구해왔던 민주당 유성엽 의원도 성명서에서 ""민주당의 기초자치단체선거 정당공천제 폐지 결정은 실질적 지방자치의 토대를 마련해줄 정말 필요한 결정이다. 많은 논란이 있긴 했지만 약속을 지킴으로써 국민의 신뢰를 되찾는 초석이 됐다""고 평했다.전국시군자치구의회의장협의회도 성명서에서 ""민주당의 기초지방선거 정당공천제 폐지 당론 결정은 세계적 추세인 풀뿌리 민주주의 지방자치 발전을 위한 당연한 조치""라며 환영의사를 밝혔다.협의회는 ""이제 여당인 새누리당의 조속한 정당공천폐지 당론 결정을 촉구한다""며 ""여야가 적극 협력해 10개월 앞으로 다가온 6·4 지방선거에 대비해 관련법 개정에 나서 달라""고 했다.반면 민주당의 기초선거 정당공천 폐지 방침에 반발하는 목소리도 나왔다.민주당 전국여성위원장인 유승희 의원은 전당원투표 결과 발표 후 성명서를 내고 ""향후 초래될 여성의 정치 진출 약화 현상을 심각하게 우려한다. 정당의 책임정치 실종, 그리고 소수의 재력가와 권력자에 의한 부패 또한 걱정하지 않을 수 없다""고 말했다.노동당 박은지 대변인도 논평에서 ""당원을 방패막이 삼아 정당공천 폐지를 밀어붙인 것을 두고 '정당민주주의 발전'이나 '정치실험'을 운운하니 기가 찰 일""이라며 민주당을 비난했다. ""부당한 '찬반의 방'에 당원을 가두고 공약이행의 답을 받아낸 민주당 지도부의 자화자찬이 참으로 가관""이라고도 지적했다.박 대변인은 ""민주당의 이번 당원투표는 정당공천 폐지라는 정당의 기능과 당원의 권리를 포기하는 행위를 당원의 손으로 결정하게 한 한바탕 쇼에 불과하다""면서 ""이는 내년 지방선거에서 안철수 신당 등 변수로 민주당 간판으로는 도저히 살아날 방법이 보이지 않자 민주당 지도부가 내놓은 꼼수 이상도 이하도 아니다""라고 꼬집었다.그러면서 그는 ""기초지방선거 정당공천제가 폐지되는 순간 헌법소원을 비롯한 모든 수단을 동원해 정치의 원칙을 지켜나가겠다""고 향후 대응방침을 밝혔다.daero@newsis.com[뉴시스 이시간 핫 뉴스]ㆍ 교도소에서 남성 재소자간 ´성폭행´ㆍ 인기 걸그룹 나인뮤지스 추돌사고 5명 부상ㆍ 여성민원인 치마 속 몰카 공무원 검거ㆍ ""입던 속옷·대소변 팔아요""…20대 여성 덜미ㆍ 도박에 방화까지…막가는 경찰들★ 뉴시스 뉴스, 이젠 네이버 뉴스 스탠드에서도 만나세요★ 손 안에서 보는 세상, 모바일 뉴시스<저작권자ⓒ 공감언론 뉴시스통신사. 무단전재-재배포 금지.>"
78,2013-07-25,"朴대통령 ""정치, 민생고 해소하고 국민통합 앞장서야""(종합2보)",https://news.naver.com/main/read.nhn?mode=LSD&mid=shm&sid1=100&oid=001&aid=0006393849,연합뉴스,"자승 스님과 인사하는 박근혜 대통령    (서울=연합뉴스) 안정원 기자 = 박근혜 대통령이 25일 청와대에서 열린 불교 지도자 오찬에서 대한불교조계종 총무원장인 자승 스님과 인사하고 있다. 2013. 7.25    jeong@yna.co.kr불교지도자 오찬서 여야에 '정쟁중단' 주문""국사 평가기준에 넣어 바른시민 육성…국민행복外 모두 번뇌""(서울=연합뉴스) 김남권 기자 = 박근혜 대통령은 25일 정치권을 향해 민생의 어려움을 해소하고 국민을 통합하는 길에 나서달라고 주문했다.박 대통령은 이날 낮 불교계 지도자들을 청와대로 초청해 오찬을 한 자리에서 인사말을 통해 ""최근 우리 사회의 모습을 보면서 자신의 소중함을 아는 사람은 다른 사람을 해쳐서는 안 된다는 부처님의 말씀을 다시 한 번 떠올린다""고 말했다.불교 지도자 오찬 참석한 박근혜 대통령    (서울=연합뉴스) 안정원 기자 = 박근혜 대통령이 25일 청와대에서 열린 불교 지도자 오찬에서 인사말을 하고 있다. 2013. 7.25    jeong@yna.co.kr그러면서 ""우리 정치가 자타불이(自他不二. 너와 내가 다르지 않다는 뜻)의 부처님 마음을 회복해 민생의 어려움을 해소하고 국민 통합의 길에 앞장설 수 있었으면 하는 바람""이라고 덧붙였다.박 대통령의 이 같은 언급은 여야 정치권에 2007년 남북정상회담 대화록 실종 사태와 서해 북방한계선(NLL) 논란 등을 둘러싼 정쟁을 중단하고 민생 살리기를 통한 국민통합에 앞장설 것을 주문한 것으로 풀이된다.조계종 총무원장인 자승 스님은 참석자를 대표해 한 인사말에서 ""궁극적으로 불교계가 추구하는 것이 현 정부가 원하는 국민행복과 다르지 않기에 불교계는 현 정부의 국민중심적인 비전을 적극 지지하고 부응할 것""이라고 화답했다.박 대통령은 마무리 발언에서 국사 교육에 언급, ""국사는 반드시 가르쳐야 되고 또 제대로 가르쳐야 한다. 국민이 보편적으로 인정하고 학계가 인정하는 것을 가르쳐야지 편파적으로 가르치면 학생에게 해를 줄 수 있다""면서 ""(국사) 그것을 평가기준에 넣어 학생들이 배우면서 바른 시민으로 자랄 수 있도록 많이 노력하겠다""고 강조했다.그러면서 ""우리가 얼마나 풍부한 문화유산이 있는 문화 민족인데 문화를 안 가르치면 안 된다는 문화융성위원들의 말씀이 있었는데 굉장히 공감했다""면서 ""학생들이 자라나면서 전통문화를 배운 교양인으로 자라날 수 있도록 제가 좀 많이 노력을 기울여야겠다 그런 생각을 했다""고 덧붙였다.불교 지도자 오찬 참석한 박근혜 대통령    (서울=연합뉴스) 안정원 기자 = 박근혜 대통령이 25일 청와대에서 열린 불교 지도자 오찬에서 인사말을 하고 있다. 2013. 7.25    jeong@yna.co.kr앞서 박 대통령은 지난 10일 언론사 논설실장ㆍ해설위원 초청 오찬에서도 ""역사 과목은 (학력) 평가기준에 넣어 어떻게 해서든지 (성적에) 반영시켜야 한다고 생각한다""고 언급한 바 있다.한편 박 대통령은 오찬 중 ""불교에서는 진리를 탐구하고자 하는 생각 외에는 전부 번뇌로 규정한다 이런 이야기를 읽은 적이 있다""면서 ""국민행복 희망의 새 시대를 열어야 되는데 저도 그것을 본으로 삼아 국민행복을 위해서 고민하고 생각하는 그 외에는 모두 번뇌로 규정하고 있다""고 언급했다고 청와대는 전했다.오찬이 끝난 뒤 자승 스님은 보물 120호인 용주사 범종 모형을 박 대통령에게 전달했다. 자승 스님은 ""막중한 국정운영 속에서 많은 스트레스를 받으실텐데 저녁에 맑은 종소리를 들으면서 번뇌를 소멸하고 새로운 밝은 지혜를 얻으시라는 뜻""이라고 말했다.이날 오찬에는 자승 대한불교조계종 총무원장, 인공 한국불교태고종 총무원장, 도정 대한불교천태종 총무원장, 회정 대한불교진각종 통리원장 등 불교 주요종단 총무원장과 총무부장, 성문 동화사 주지를 비롯한 조계종 19개 교구본사 주지 등 28명이 참석했다.south@yna.co.kr[이 시각 많이 본 기사]☞검찰 '전두환 재산 추징' 관련 삼성생명 압수수색☞<""저 세상에서 모래시계 2편을…"" 김종학 PD 영결식>☞엔저에 참치 매출 급증…횟감순위 바뀌었다☞<동아시안컵축구> '실험 끝낸' 홍명보號, 일본전에 승부수☞<특집:전두환 추징> ⑦ 전재용-이창석 '은밀한 커넥션'▶ 연합뉴스 모바일앱 다운받기▶ 인터랙티브뉴스<저작권자(c)연합뉴스. 무단전재-재배포금지.>"
79,2013-07-25,남부지역 2주째 폭염…3명 사망·339명 치료,https://news.naver.com/main/read.nhn?mode=LSD&mid=shm&sid1=103&oid=001&aid=0006393751,연합뉴스,"잠못드는부산…'야간 피서'<<연합뉴스DB>>닭 폐사·병충해 기승 등 농가 피해 잇따라(전국종합=연합뉴스) 폭염이 2주째 계속되며 남부지방 곳곳에서 인명·농가피해가 늘어나고 있다.찜통더위로 영남권에서는 40대 남성 3명이 숨지고, 전국에서 339명이 무더위에 쓰러져 응급실을 찾았다.경북에서는 닭 2만여마리가 폐사하고, 제주도는 가뭄으로 농민들이 어려움을 겪고 있다.◇ ""더워 죽겠네""…3명 사망, 339명 응급실행25일 질병관리본부에 따르면 올여름 폭염으로 응급의료기관을 찾은 환자는 339명으로 집계됐다.지난해 같은 기간(6월 2일∼7월 22일)의 113명에 비해 3배 늘어난 수치다.지난 22일 부산의 길에서 쓰러진 채 발견된 A(44)씨와 지난달 5일 경북 고령군 한 승용차에서 발견된 B(42)씨는 병원으로 옮겨졌지만 숨졌다.가뭄에급수하는 소방차 <<연합뉴스DB>>지난 10일 대구의 공사현장에서 일하던 근로자(47)는 폭염 속에 작업을 하다가 현장에서 쓰러져 숨졌다.온열 질환자 가운데 60대 이상 환자가 85명(24.9%)으로 가장 많았고 50대 81명(23.8%), 40대 66명(19.4%) 순으로 나타났다.환자의 80.1%는 실외에서 농사 또는 작업을 하다가 쓰러졌다.부산의 한 달동네 노인들은 한낱 뙤약볕에 집온도가 50도까지 오르는 고온에 시달리고 있다.부산 기초단체들이 노인복지관과 경로당 등에 무더위 쉼터 100여곳을 운영하고 있지만 노인들이 몰리면서 시설이용에 불편을 겪고 있다.열대야로 잠을 이루지 못한 주민들이 야간에 해운대 해수욕장 등으로 몰리며 해경과 소방본부가 야간 안전관리에 긴장하고 있다.◇ 축산 농가 잇단 피해경북에서는 폭염으로 닭 2만3천마리가 폐사했다.지난 19∼22일 김천에서 닭 6천800마리, 지난 22∼24일 예천에서 닭 4천마리가 각각 폐사하는 등 축산농가의 피해가 잇따르고 있다.더위도반가운 아이들 <<연합뉴스 DB>>전북도의 경우 폭염으로 인한 큰 피해는 접수되지 않았지만 축산농가는 닭과 돼지 등 가축 피해 대비에 바쁜 일상을 보내고 있다.김제에서 양계장을 운영하는 김모(42)씨는 ""날씨가 더워 양계장 천장에 매일 물을 뿌려주고 있다""며 ""그럼에도 무더위에 매일 닭이 10여마리씩 폐사한다""고 말했다.제주는 이번 장마철에 비가 거의 내리지 않아 가뭄 현상을 보이고 있다.제주시 애월읍 신엄리와 한림읍 동명리는 매우 건조한 상태를 보여 일부 농지가 거북등껍데기처럼 갈라지기 시작했다.이달에 파종한 콩, 양배추 등 농작물이 제대로 자라지 못하고, 식수원인 지하수 수위도 점차 낮아지고 있다.지난달 21일부터 현재까지 강수량은 제주 85㎜, 서귀포 63.6㎜로 평년보다 제주 154.1㎜, 서귀포 278.3㎜ 적게 내렸다.이에 제주도는 지난 19일부터 농작물 가뭄대책 종합상황실을 운영하고 있다.◇ 무더위에 병충해 기승경남도 농업기술원에 따르면 서부경남권에 없던 미국 선녀벌레가 최근 진주의 한 단감 과수원에서 발견됐다.""소도더워요"" <<연합뉴스DB>>미국 선녀벌레는 과수원 인근 아카시아 나무의 새 가지에서 발생한 것으로 나무 즙액을 빨아 먹어 생육에 지장을 주며 수확기에 배설물로 그을음병을 유발한다.또 사천의 한 블루베리 과수원에서는 지난달 외래 해충인 갈색여치가 발견됐다.갈색여치는 농작물은 물론 동족까지 잡아먹을 정도로 식성이 좋아 피해가 우려되고 있다.함양 일대 가죽재배단지에서는 중국에서 유입된 것으로 보이는 꽃매미가 확산, 포도·머루·가죽나무의 수액을 빨아먹어 과실의 품질을 떨어뜨리고 있다.경남도 농업기술원 한 관계자는 ""과수원과 주변 잡목을 수시로 살피고 약제를 살포해 외래 해충이 인근 지역으로 확산하는 것을 막아야 한다""고 지도했다.(김근주·김선형·김진방·전지혜·차근호·황봉규)sunhyung@yna.co.kr[이 시각 많이 본 기사]☞검찰 '전두환 재산 추징' 관련 삼성생명 압수수색☞<""저 세상에서 모래시계 2편을…"" 김종학 PD 영결식>☞엔저에 참치 매출 급증…횟감순위 바뀌었다☞<동아시안컵축구> '실험 끝낸' 홍명보號, 일본전에 승부수☞<특집:전두환 추징> ⑦ 전재용-이창석 '은밀한 커넥션'▶ 연합뉴스 모바일앱 다운받기▶ 인터랙티브뉴스<저작권자(c)연합뉴스. 무단전재-재배포금지.>"
80,2013-07-25,내년부터 5년간 국방비 214조원…연평균 7.2% 증가,https://news.naver.com/main/read.nhn?mode=LSD&mid=shm&sid1=100&oid=001&aid=0006393162,연합뉴스,"경기도포천시 이동면 육군 제8기계화보병사단에서 장병이 K-1 전차 탄약 적재 훈련을 하고 있다. <<연합뉴스DB>>'14-18 국방중기계획'…킬 체인·KAMD 구축에 9조6천억원 투자(서울=연합뉴스) 김호준 기자 = 국방부는 25일 내년부터 5년간 전력운영과 방위력개선 분야에 투입할 계획인 국방예산 214조5천억원을 국회에 보고했다고 밝혔다.올해 마련된 '2014~2018년 국방중기계획' 예산은 지난해 '2013~2017년 국방중기계획'에 비해 15조원 증가했다. 중기계획은 5년 단위로 편성된다.전력운영비는 144조3천억원으로 8조8천억원 증가했고 방위력개선비는 70조2천억원으로 6조1천억원 늘었다.이 기간 국방예산의 연평균 증가율도 6.0%에서 7.2%로 1.2%포인트 증가했다.전력운영 분야는 '정예화된 전투형 군대 육성과 군의 사기·복지 증진'에, 방위력개선 분야는 '북한의 핵 ·미사일 등 비대칭 위협 대비능력 강화와 현존전력 보강 등에 중점을 두고 재원을 각각 배분했다고 국방부는 설명했다.국방부의 한 관계자는 ""전체 국방비 중 방위력개선비가 차지하는 비중이 올해 29.5%에서 2018년에는 34.6%로 늘어나도록 한 것이 이번 중기계획의 특징""이라고 설명했다.방위력개선 분야 중에서도 북한의 핵·미사일 등의 위협에 대비한 '킬 체인(Kill Chain)'과 '한국형 미사일 방어체계(KAMD)' 구축에 내년부터 5년간 9조6천억원이 투입된다.북한 미사일을 발사 이전에 탐지, 타격하는 킬 체인 구축에 7조8천억원이 사용되고 발사된 미사일이 지상에 도달하기 이전에 요격하는 KAMD 구축에 1조8천억원이 소요된다.감시·결심·타격 전력 간 실시간 정보공유가 이루어지도록 하는 전술정보 통신체계와 합동전술 데이터링크 등 지휘통제·통신체계도 구축하기로 했다.K-2 전차와 차기다연장, 대형 공격헬기 등 작전지역 내 신속한 기동 및 정밀타격이 가능한 전력도 확보하기로 했다.<그래픽> 국방예산 추이    (서울=연합뉴스) 반종빈 기자 = 국방부는 25일 내년부터 5년간 전력운영과 방위력개선 분야에 투입할 계획인 국방예산 214조5천억원을 국회에 보고했다고 밝혔다.    bjbin@yna.co.kr    @yonhap_graphics(트위터)해상 전력으로는 한국형 차기구축함(KDDX·5천t급)과 장보고-Ⅱ급 잠수함(1천800t급), 차기상륙함 등이, 공중 전력으로는 차기전투기(F-X), 공중급유기, 대형수송기 등이 도입될 예정이다.북한의 국지도발을 적극적으로 억제하고 도발시 응징할 수 있는 전력으로는 원격사격 통제체계와 신형 대포병 탐지레이더, 2.75인치 유도로켓 등의 장비가 도입된다.F-16 전투기와 105㎜ 곡사포, 구축함용 어뢰음향 대응장비, 합동지휘통제체계(KJCCS) 등 기존 전력의 성능개량도 이뤄진다.또 '창조형 국방 연구개발(R&D) 구현과 방위산업 활성화'를 위해 국방비 대비 국방 R&D 투자를 올해 7.1%에서 2018년 8.5%로 확대하고 국방과학연구소(ADD) 인력 충원과 연구인프라 보강에 1조1천억원을 투자하기로 했다.전력운용 분야에선 전방소초 등 접적지역 작전 및 경계시설 보강에 1조1천억원, 신규 도입 고성능 핵심전력 장비유지에 1조3천억원, 정비·보급시설 개선에 1조5천억원이 투입된다.신규 바이러스 유입 방지와 정보체계 실시간 모니터링 등 사이버 공격 대응 예산으로는 1천360억원이 책정됐다.병사 봉급은 지난해 상병 기준 월 9만7천500원에서 2017년 19만5천800원으로 2배 수준으로 인상된다.간부 노후숙소 개선에 9천900억원, 낡은 침상형 병영생활관 개선에는 2천616억원이 투입된다.내년부터 5년간 병사는 44만6천명에서 41만6천명으로 3만명 감소하지만 장교와 부사관 등 간부는 18만7천명에서 20만2천명으로 늘어난다.hojun@yna.co.kr[이 시각 많이 본 기사]☞검찰 '전두환 재산 추징' 관련 삼성생명 압수수색☞<""저 세상에서 모래시계 2편을…"" 김종학 PD 영결식>☞<특집:전두환 추징> ⑦ 전재용-이창석 '은밀한 커넥션'☞<동아시안컵축구> '실험 끝낸' 홍명보號, 일본전에 승부수☞엔저에 참치 매출 급증…횟감순위 바뀌었다▶ 연합뉴스 모바일앱 다운받기▶ 인터랙티브뉴스<저작권자(c)연합뉴스. 무단전재-재배포금지.>"
81,2013-07-25,'100억원 변조수표 사기' 위조책 추가 검거,https://news.naver.com/main/read.nhn?mode=LSD&mid=shm&sid1=102&oid=001&aid=0006393661,연합뉴스,"(수원=연합뉴스) 최해민 기자 = 100억원짜리 변조수표 사기사건의 위조책이 경찰에 추가로 붙잡혔다.경기지방경찰청 전담수사팀은 앞서 구속한 주범 나경술(51) 등과 공모, 자기앞수표를 변조해 현금으로 인출한 혐의(부정수표단속법 위반)로 강모(58)씨에 대해 구속영장을 신청했다고 25일 밝혔다.강씨는 1억110만원짜리 자기앞수표를 100억원짜리로 액면가와 발행번호를 변조한 것으로 드러났다.앞서 구속된 공범은 강씨에게서 넘겨받은 변조 수표를 은행에 제시, 100억원을 모두 현금으로 인출해 달아났다.경찰 관계자는 ""강씨는 수표 위·변조와 관련한 동종 전과가 1건 있는 것으로 확인됐다""며 ""구체적인 경위와 공범이 더 있는지 조사하고 있다""고 말했다.goals@yna.co.kr[이 시각 많이 본 기사]☞검찰 '전두환 재산 추징' 관련 삼성생명 압수수색☞<""저 세상에서 모래시계 2편을…"" 김종학 PD 영결식>☞<특집:전두환 추징> ⑦ 전재용-이창석 '은밀한 커넥션'☞<동아시안컵축구> '실험 끝낸' 홍명보號, 일본전에 승부수☞엔저에 참치 매출 급증…횟감순위 바뀌었다▶ 연합뉴스 모바일앱 다운받기▶ 인터랙티브뉴스<저작권자(c)연합뉴스. 무단전재-재배포금지.>"
