,날짜,기사 제목,기사 링크,기사 출처,기사 내용
97,2013-07-07,"""월급쟁이 가구가 자영업자보다 부도 확률 높다""",https://news.naver.com/main/read.nhn?mode=LSD&mid=shm&sid1=101&oid=001&aid=0006356766,연합뉴스,"시민들이서울 광화문 네거리에서 출근을 위한 발걸음을 재촉하고 있다. <<연합뉴스DB>>KDI 박사, 금융 스트레스 테스트 논문서 주장(서울=연합뉴스) 경수현 기자 = 월급쟁이 가구가 가계부채 문제의 취약계층으로 지목돼온 자영업자보다 오히려 부실 위험 가능성이 높다는 분석이 나왔다.한국개발연구원(KDI)의 김영일 연구위원과 유주희 전문연구원은 5일 '가계부채 부실위험에 대한 스트레스 테스트' 논문에서 이런 분석 결과를 제시했다.이 분석은 통계청의 2012년 가계금융·복지조사 통계를 토대로 한 것으로, 부실 위험 부채가구는  소득보다 대출이자를 포함한 지출이 더 많으면서 과다 부채로 순자산이 마이너스인 가구를 지칭한다.분석 결과 가구주가 임금근로자인 부실위험 부채가구 비율은 자산회수율(80∼100%)에 따라 2.87∼3.66%의 비율을 보였다.1만명 가운데 287∼366명 꼴로 빚 때문에 채무 불이행자가 될 확률이 있다는 의미다.이에 비해 가구주가 자영업자인 부실위험 부채가구 비율은 1.84∼2.23%로 상대적으로 낮았다.가구주가 실업자 등 기타에 속한 가구는 4.31∼6.11%였다.김영일 연구위원은 ""임금 근로자에는 정규직뿐만 아니라 저소득 비정규직도 포함된다""고 설명했다.그러나 자영업자의 부채 중 채무불이행 위험이 큰 부채의 비중(EAD)은 3.33∼6.00%로 임금 근로자(1.71∼2.60%)나 기타 가구주(2.10∼5.61%)보다 훨씬 높았다.자영업자는 채무 불이행에 일단 빠지면 부도 위험에 노출되는 빚 규모 비중이 임금 근로자보다 크다는 얘기다.글로벌 금융위기 수준의 거시 경제 충격이 닥쳤을 때의 부실 위험 부채가구 비율은 임금 근로자 가구가 3.21∼4.13%, 자영업자 가구가 2.12∼2.79%인 것으로 추정됐다.대출 유형별로는 은행과 비은행권 빚을 함께 진 가구의 부실위험 부채가구 비율(6.14∼8.50%)과 EAD(6.46∼10.05%)가 은행 대출만 있는 가구의 부실위험 부채가구 비율(1.33∼1.80%)과 EAD(1.13∼2.83%)보다 훨씬 높았다.논문은 스트레스 테스트 결과 금융위기 수준의 경제 충격이 오더라도 은행권의 현 자본여력 등을 고려할 때 건전성에 대한 영향은 제한적인데 비해 비은행권은 상대적으로 부정적 영향이 클 것으로 예상된다고 밝혔다.이 논문은 한국은행의 계간 '경제분석' 최근호에 실렸다.evan@yna.co.kr[이 시각 많이 본 기사]☞아시아나 여객기, 샌프란시스코 공항 착륙중 충돌(3보)☞'국정원·NLL 발언 규탄' 진보·보수 집회 열려(종합)☞-프로야구- 두산, 이틀연속 삼성 제압…'4강 보인다'(종합2보)☞""승객들, 비상슬라이드 이용해 탈출 시도""(속보)▶ 연합뉴스 모바일앱 다운받기▶ 인터랙티브뉴스<저작권자(c)연합뉴스. 무단전재-재배포금지.>"
98,2013-07-07,'단속 예고했는데'…3시간만에 음주운전 1천명 적발,https://news.naver.com/main/read.nhn?mode=LSD&mid=shm&sid1=102&oid=001&aid=0006356718,연합뉴스,"'음주운전 하지마세요'    (서울=연합뉴스) 이지은 기자 = 여름 휴가철을 앞두고 경찰들이 5일 오후 서울 서대문구 홍제동에서 음주운전 특별단속을 하고 있다. 경찰은 7∼8월을 휴가철 음주운전 특별단속 기간으로 정하고 매주 금·토요일 오후 10시∼이튿날 오전 1시 휴양지와 유흥가 등을 중심으로 전국에서 음주운전 단속을 벌일 계획이다. 2013.7.5    jieunlee@yna.co.kr(서울=연합뉴스) 임기창 기자 = 경찰이 여름 휴가철을 앞두고 대대적인 음주운전 단속을 예고했음에도 불과 3시간 만에 전국에서 1천명 이상이 음주운전을 하다 적발된 것으로 나타났다.7일 경찰청에 따르면 지난 5일 오후 10시부터 6일 오전 1시까지 실시한 전국 일제 음주운전 특별단속 결과 1천86명이 적발됐다. 올해 하루 평균 단속 인원 707명보다 379명(53.6%) 많은 숫자다.적발된 이들 가운데 혈중알코올농도 0.05~0.09%로 면허정지 처분을 받은 사람이 482명, 0.1%를 넘어 면허가 취소된 사람은 586명이었다. 18명은 측정을 거부했다.경찰은 이번 단속에 전국 교통경찰, 파출소·지구대 등 지역경찰, 기동대원 등 3천672명과 순찰차, 사이드카 등 장비 1천745대를 투입했다.경찰, 휴가철 전국 음주운전 일제단속    (서울=연합뉴스) 이지은 기자 = 여름 휴가철을 앞두고 경찰들이 5일 오후 서울 서대문구 홍제동에서 음주운전 특별단속을 하고 있다. 경찰은 7∼8월을 휴가철 음주운전 특별단속 기간으로 정하고 매주 금·토요일 오후 10시∼이튿날 오전 1시 휴양지와 유흥가 등을 중심으로 전국에서 음주운전 단속을 벌일 계획이다. 2013.7.5    jieunlee@yna.co.kr경찰 관계자는 ""사전에 특별단속을 예고했음에도 1천명 이상 적발됐다는 것은 음주운전이 여전히 만연하다는 뜻""이라며 ""지속적으로 음주운전 단속을 강화할 필요가 있다""고 말했다.경찰은 휴가철인 7~8월 두 달간 매주 금·토요일 전국에서 일제 음주운전 단속을 벌이는 한편 휴양지, 유흥가 등 음주운전 취약지에서 주·야간 관계없이 상시 단속 체제를 유지할 방침이다.pulse@yna.co.kr[이 시각 많이 본 기사]☞아시아나 여객기, 샌프란시스코 공항 착륙중 충돌(3보)☞'국정원·NLL 발언 규탄' 진보·보수 집회 열려(종합)☞-프로야구- 두산, 이틀연속 삼성 제압…'4강 보인다'(종합2보)☞""승객들, 비상슬라이드 이용해 탈출 시도""(속보)▶ 연합뉴스 모바일앱 다운받기▶ 인터랙티브뉴스<저작권자(c)연합뉴스. 무단전재-재배포금지.>"
99,2013-07-07,고교생 한국사 두 학기에 배운다…집중이수제 제외,https://news.naver.com/main/read.nhn?mode=LSD&mid=shm&sid1=102&oid=001&aid=0006356714,연합뉴스,"서울시내한 고등학교에서 시험을 치르는 학생들 <<연합뉴스DB>>교육부, 국사 6단위로 늘려 편성하도록 사실상 의무화""역사교육 강화…수능 필수여부는 대입제도와 연계해 신중검토""(서울=연합뉴스) 구정모 기자 = 내년부터 우리나라 고등학생들은 한국사를 두 학기에 걸쳐 지금보다 더 많은 시간 배우게 된다.한국사를 한 학기에 몰아서 배우는 것은 금지돼 한국사는 집중이수제에서 사실상 제외된다.교육부는 우리 학생들의 역사 인식 부족과 일본의 역사 왜곡에 대한 우려가 커짐에 따라 한국사 이수단위를 현행 5단위(1단위는 주당 1시간 운영)에서 6단위로 늘려 2개 학기에 걸쳐 운영토록 하는 한국사교육 강화방안을 마련하고 있다고 7일 밝혔다.교육부는 교육과정의 틀을 유지하면서 한국사교육을 강화하려면 학교장이 자율로 수업시수를 20% 범위에서 증감할 수 있는 규정을 적용, 한국사를 5단위에서 6단위로 늘리는 것이 현실적인 방법이라고 결론냈다고 설명했다.교육부는 방학기간 일선 학교의 의견을 최종 수렴해 9월 새 학기에 이 같은 내용의 공문을 시도교육청에 전달, 일선학교가 이를 반영해 내년도 교육과정 운영계획을 짜게 할 계획이다.현행 2009교육과정은 원칙적으로 전 과목이 선택과목이지만 교육부는 한국사는 예외로 5단위 이상 필수로 배우도록 하는 역사교육 강화방안을 지난 2011년 발표하고 2012년부터 적용하고 있다.하지만 상당수 고교에서 집중이수제를 활용해 한국사를 한 학기에 몰아서 가르치고 있어 고조선부터 근현대에 이르는 방대한 내용을 한학기에 가르치고 소화하기는 교사와 학생에게 모두 무리라는 지적이 많았다.교육부 관계자는 ""한국사가 5단위에서 6단위로 늘어나면 집중이수제 적용이 '물리적으로' 어려워진다""며 ""6단위를 한 학기에 편성하려면 주5일 중 어느 날은 한국사 수업을 하루에 2시간 해야 하기 때문""이라고 설명했다.교육부는 수업 단위 확대에 따른 교사 충원 수요는 많지 않을 것으로 보고 있다. 필요하면 강사를 배치하는 것을 검토하고 있다.교육부는 이와 함께 학생들이 한국사에 흥미를 느끼고 공부할 수 있도록 다양한 형태의 교수·학습자료를 개발·보급하기로 했다. 자료 개발이 완료되면 국사 교사를 대상으로 연수를 시행할 예정이다.또 최근 열린 전국 시·도교육감협의회에서 건의된 내용을 수용해 국경일이나 국가기념일에 진행되는 계기교육 때 활용할 수 있는 자료를 제작해 보급할 계획이다.한편 일부 국회의원과 한국교총, 시민단체 등이 주장하는 한국사의 대학수학능력시험 필수 과목 지정과 관련해서는 대입제도와 교육과정의 큰 틀에서 검토해야한다는 입장이다.교육부는 대입제도 간소화와 A/B형 수능, 국가영어능력평가시험(NEAT) 존치여부 등을 8월 일괄 발표하겠다고 예고한 바 있다.교육부 관계자는 ""국어, 수학, 영어 등 이른바 '주요 영역'을 포함해 탐구 영역까지 모든 영역이 선택인 수능에서 한국사를 필수로 한다는 것은 현행 수능 체제에서는 맞지 않으며 다른 사회과 과목과의 형평성 문제도 제기될 수 있어 신중하게 접근하고 있다""고 설명했다.이어 ""수능 필수과목 지정, 통과·불합격(pass/fail) 시험 도입 등 국회와 언론에서 거론된 방안을 포괄적으로 검토해보겠다""고 말했다.pseudojm@yna.co.kr[이 시각 많이 본 기사]☞<아시아나기 사고> ""공항 착륙유도장치 꺼져있었다""☞<아시아나기 사고> 방송사 뉴스특보..가요 프로 결방☞<아시아나기 사고> 관제탑 교신내용 시점 놓고 혼선☞-U20월드컵- 한국 축구, U-20 월드컵 4강행 좌절(종합)☞<아시아나기 사고> 긴박했던 '착륙순간' 전후(종합)▶ 연합뉴스 모바일앱 다운받기▶ 인터랙티브뉴스<저작권자(c)연합뉴스. 무단전재-재배포금지.>"
100,2013-07-07,"美 소방당국 “2명 사망, 80여명 병원이송”",https://news.naver.com/main/read.nhn?mode=LSD&mid=shm&sid1=101&oid=009&aid=0002990070,매일경제,"아시아나항공 소속 보잉777 여객기 OZ214편이 6일(현지시각) 미국 샌프란시스코 공항에 불시착하는 사고가 일어났다.미국 소방당국은 공식브리핑을 통해 “현재 2명이 사망했고, 80여명은 병원이송돼 치료를 받고 있다”며 “일부 상태가 심각한 승객이 있어 사망자는 늘어날 수도 있다”고 밝혔다.이에 앞서 애드윈 리 샌프란시스코 시장은 “미 교통안전국에서 조사단을 파견했고, 한국 당국과도 통화해 애도를 전달했다. 부상자와 피해자들에게 지원 계속할 것”이라고 밝혔다.또 홍성욱 샌프란시스코 총영사관 부총영사는 “현재 총영사가 병원에 가 상황을 예의주시하고 있다”고 말했다.한편, 아시아나항공은 측은 해당 여객기는 인천발 샌프란시스코행 등록기호 HL7742의 여객기이며,  7월 6일 16시 35분 인천공항을 출발했고, 2013년 7월 7일 오전 3시 28분(한국시각, 현지 시각 11시 28분)에 샌프란시스코공항 28번 활주로에서 착륙 중 사고가 발생했다고 밝혔다.해당 여객기에는 승객 291명으로, 비즈니스클래스 19명, 일반석 272명이었으며, 승무원은 운항승무원 4명, 캐빈승무원 12명 등 16명이 탑승해 총 307명이 탑승했다. 아울러 승객 국적은 한국인 77명, 중국인 141명, 미국인 61명, 일본인 1명 등 총 291명으로 집계됐다.아시아나항공 관계자는 “인명피해 및 정확한 사고 원인에 대해서는 파악 중”이라며 “아시아나항공은 이번 사고의 파악 및 수습에 대해 관련부서 및 유관기관과 협조해 나갈 것이고, 현재 사고대책본부를 마련했다. 이 외에 추가 확인된 사항은 없으며 가능한 한 빨리 모든 추가적인 사항을 공표하겠다”고 밝혔다.아시아나항공은 현재 서울 강서구 오쇠동 아시아나타운에 사고대책본부를 꾸린 상황이다.[매경닷컴 장주영 기자semiangel@mk.co.kr/ 사진=한희재 MK스포츠 특파원]매경닷컴 여행/레저 트위터_mktourworld[ⓒ 매일경제 & mk.co.kr, 무단전재 및 재배포 금지]"
101,2013-07-07,기초연금 '빈곤층에만' vs '70∼80%는 줘야',https://news.naver.com/main/read.nhn?mode=LSD&mid=shm&sid1=101&oid=001&aid=0006356770,연합뉴스,"김동만(오른쪽)한국노총 부위원장 <<연합뉴스DB>>(서울=연합뉴스) 하채림 기자 = 박근혜 대통령의 핵심공약인 기초연금의 정부안 마련에 앞서 사회적 합의를 도출하기 위해 구성된 국민행복연금위원회의 논의가 막바지에 접어들었다. 행복연금위원회는 11일 7차 회의를 열어 합의를 시도한다. 그러나 이미 국민연금 가입자의 주요한 축인 노동계와 농민 대표단체가 탈퇴를 선언한 터라 합의한이 도출된다고 하도 '반쪽짜리' 합의안에 그칠 전망이다.김동만 한국노총 부위원장은 7일 연합뉴스와 통화에서 ""정부가 원하는 방안은 박 대통령의 공약과는 너무 동떨어져 있고 기초연금으로 보기도 어려운 것이라 수용하기 어렵다""며 ""현재로서는 행복연금위원회에 복귀할 계획이 전혀 없다""고 말했다.◇ 현재보다 수급자 줄이고 싶은 정부현재 기초연금 도입 방안의 최대 쟁점은 지급 대상을 빈곤층에 한정할 것인지 아니면 노인 70∼80%까지 지급할 것인지다.보건복지부는 기초노령연금 도입 이후 줄곧 이 제도를 빈곤 노인으로 축소하는 것이 우리 실정에 맞다는 입장이었다.한국보건사회연구원 연금연구센터장인 윤석명 박사는 ""소득하위 70%로 못박아 둔 기초노령연금 지급 대상을 형편이 어려운 노인으로 축소 조정해야 한다는 게 복지부의 일관된 생각""이라고 전했다.행복연금위원회에서도 '소득이 최저생계비 150% 이하'인 노인에게만 지급하는 방식을 복수안으로 유력하게 논의하고 있다.이 안에 따르면 베이비부머(1955∼1963년생) 세대가 기초연금을 받게 되는 2030년에는 수급자가 51% 수준으로 줄고 2050년에는 더 떨어져 38%만 적용을 받게 된다.이름은 기초연금이어도 실제 기초연금의 정의에서 벗어나 공공부조 제도가 되는 것이다. 공공부조란 저소득층만을 대상으로 하는 복지제도를 가리키는 용어다.국민연금 가입기간이 길수록 기초연금 지급액을 줄이는 방안도 유력하게 검토하는 안 중 하나다. 시간이 흐를수록 지급 대상이 축소된다는 점은 '최저생계비 150% 이하 지급'과 유사하다. 이 안은 청와대와 정부 일각에서 선호하는 방식으로 알려졌지만, 국민연금 가입자에게 매우 불리해 큰 반발이 예상된다.이 안은 국민연금 계산식을 구성하는 두 요소 중 가입기간에 따라 길어지는 A부분이 20만원 이하인 가입자에게 20만원을 채워주는 방식이다. 평균 가입기간이 약 15년인 현재 국민연금 수급자는 평균 2만원을 손에 쥐게 된다. 국민연금이 안정된 2030년 이후 국민연금 가입자의 평균가입기간은 약 24년으로 A값이 30만원에 육박하기 때문에 국민연금 수급자 대부분은 기초연금을 못 받게 될 가능성이 크다.'빈곤층에만 지급하는 기초연금'의 최대 장점은 돈이 적게 든단 것이다. 최저생계비의 150% 이하 소득 계층에만 지급하면 2060년 소요 재정은 43조원(불변가격 기준)이다. 노동계에서 주장하는 방식에 비해 절반이나 그 이하로 소요된다.국민연금 가입기간에 반비례해서 주는 기초연금은 더 적게 든다. 초기 제도를 모든 노인을 대상으로 시작해도 2060년에 40조원이 들고, 소득 하위 70%에서 시작하면 28조가 필요하다.윤석명 박사는 ""한국은 고령화가 급격하게 일어난다""며 ""기초연금이 미래 세대의 어깨를 짓누르는 제도가 돼서는 안 된다""고 강조했다.◇ 수급자 비중 축소는 안 된다는 시민사회단체정부가 선호하는 방식은 기초연금과 국민연금 둘 다 받는 노인이 소수에 그쳐 저소득층의 노후빈곤을 해소하기 어렵다는 게 최대 약점이다.또 '모든 노인에게 기초연금 20만원'으로 알려진 박대통령의 공약에는 역행하는 제도라는 비판을 감수해야 한다.노동계와 시민단체 등은 논의 초기 공약 이행을 촉구했으나 현재는 소득 하위 70∼80%로 제한하는 방안은 수용 가능하다는 데까지 주장을 굽혔다. 그렇다고 해도 현재보다 수급자 비중을 줄이고 저소득층 대상 제도로 전환은 결코 받아들일 수 없다는 태세다.야당이 지지하는 방식은 장기적으로 중간 계층까지 노후보장에 크게 도움이 되고 저소득 국민연금 가입자의 유·불리 논란도 덜하다는 점에서 바람직하다.반면 장기적으로 막대한 재정이 소요되고, 조기에 증세를 하지 않는 한 부담은 후세대에 전가된다.소득하위 70%에 똑같이 20만원을 지급하려면 2060년에는 국내총생산(GDP)의 2.8%인 82조원이 필요하다. 국민연금과 기초연금을 합친 비용은 GDP의 9.7%에 이른다.시민사회단체는 우리나라가 그 정도는 감당할 수 있다고 본다.참여연대 상임집행위원장을 지낸 바 있는 김연명 중앙대 교수(사회복지)는 최근 기초연금 관련 토론회에서 ""유럽연합은 노인인구가 10% 초반일 때 GDP의 10%를 공적 연금에 썼다""며 ""2060년에 노인인구가 40%가 되는 한국이 GDP의 10%를 쓰는 것은 최소한의 수준이고 충분히 재정으로 감당할 수 있다""고 주장했다.◇ 국민연금에 미칠 영향도 변수수급자 비중과 재정 소요 외에 기초연금 도입 논의에 중요하게 작용하는 요소가 국민연금 신뢰도에 미칠 영향이다.지난 3월말 기준 국민연금 지역가입자 380만명 가운데 120만명은 사업자등록이나 소득자료가 전혀 없고, 45만명은 사업자등록은 있지만, 과세자료가 전혀 없다. 이들 165만명은 국민연금공단에 소득금액을 신고하고 연금보험료를 내고 있지만, 연금공단에 보험료 부과 근거가 없으므로, 실익을 따져 언제든 국민연금에서 이탈할 수 있는 사실상의 임의가입자에 해당한다.국민연금 가입기간이 길수록 기초연금 액수를 줄이는 제도가 도입되면 이들의 이탈은 불 보듯 뻔하다는 게 전문가들의 견해다.인수위원회도 한때 이 안을 검토했다가 반대 여론이 터져 나오자 폐기하고 국민연금 가입기간이 길수록 더 주는 방식으로 전환했다.노동계는 국민연금 가입기간에 연계 자체에 거부감을 나타냈다.김동만 한국노총 부위원장은 ""인수위 방식이 국민연금 가입자에 좀 더 유리한 것은 맞지만, 국민연금과 기초연금을 어떤 식으로든 연계하는 데 부정적""이라며 ""국민연금 가입자에 유리한 방식으로 도입된다고 해도 두 제도를 연계하면 국민연금 기금을 끌어다 쓸 수 있는 여지가 있기에 반대한다""고 말했다.tree@yna.co.kr[이 시각 많이 본 기사]☞아시아나 여객기, 샌프란시스코 공항 착륙중 충돌(3보)☞아시아나기 샌프란서 착륙사고, 사상자 확인안돼(종합)☞-프로야구- 두산, 이틀연속 삼성 제압…'4강 보인다'(종합2보)☞""승객들, 비상슬라이드 이용해 탈출 시도""(속보)▶ 연합뉴스 모바일앱 다운받기▶ 인터랙티브뉴스<저작권자(c)연합뉴스. 무단전재-재배포금지.>"
