,날짜,기사 제목,기사 링크,기사 출처,기사 내용
37,2013-07-25,87년 전재용 축의금 수천에서 1억까지 받아,https://news.naver.com/main/read.nhn?mode=LSD&mid=shm&sid1=100&oid=056&aid=0000007639,KBS,"<앵커 멘트>전두환 전  대통령의 둘째 아들  재용 씨가 지난  1987년 결혼 당시 하객 1인당 수천만 원에서  1억 원씩의 축의금을  받은 것으로  드러났습니다.일반인들은 상상도 하기 힘든  액수인데, 재용 씨가  지난 2004년  재판 당시  스스로 제출한  자료에 들어있는 내용입니다.김준범 기자가 보도합니다.<리포트>1987년 12월 청와대에서 열린 당시 전두환 대통령의 차남,  전재용 씨의 결혼식.상대는 박태준 당시 포항제철 회장의 딸 박모 씨였습니다.축의금은 안 받은 것으로 당시 알려졌습니다.그러나 전재용 씨가  스스로 밝힌 내역은 전혀 달랐습니다.드러난 33명이 낸 총액만  13억 5천여만 원.외할아버지가  가장 많은 1억 7천만 원, '비자금 관리인'으로 알려진 외삼촌 이창석 씨가 5천만 원을 냈습니다.청와대 비서실도 2천만 원 보탰습니다.당시 풍산금속 회장과  사돈관계에 있는 김 모씨가 각각 1억 원,  금복주 회장이 7천만 원, 동국제강 사장이 2 천만원을 냈습니다.눈에 띄는 건 대구 지역의 기업인들,  2천만 원에서  많게는 5천만 원까지 냈는데 대부분 결혼식에는  참석하지 않은 것으로 알려졌습니다.<녹취> 대구 지역 기업인 : ""어른 보고 냈지. 아들은 이름만 알았지. 청와대 재직 때니까 우리는 감히 거기 가지도 못했고.""하객들의 숫자를 감안하면   드러나지 않은 축의금이 훨씬 더 될 수 있다는 겁니다.해당 축의금 내역은 지난 2004년 전재용 씨가 '전두환 비자금' 167억여 원을 받아 재산을 불렸다는 혐의로 기소되자, 자신의 재산 밑천은 결혼식 축의금이었다고 항변하며 법원에 제출한 자료입니다.셋째 아들, 재만 씨도 결혼식 축의금으로 백60억 원을 받은 것으로 알려졌습니다.KBS 뉴스 김준범입니다.김준범[관련기사]▶ 숨은 한류 주역 안무가 처우는 ‘열악’▶ 홍명보호 실험 끝! 한·일전 승리 준비 끝!▶ 백혈병 아동에 용기주려 美 전직 대통령 ‘삭발’▶ [이슈뉴스] 신형 그랜저·뉴카렌스도 ‘누수 현상’▶ 우규민, 기아 잡고 8승…윤석민 완투패▶  KBS뉴스 SNS -[트위터][페이스북][미투데이][저작권자ⓒ KBS(www.kbsnews.com) 무단복제-재배포 금지]"
38,2013-07-25,산성비 더 강해졌다…'오렌지 주스' 농도,https://news.naver.com/main/read.nhn?mode=LSD&mid=shm&sid1=103&oid=055&aid=0000257672,SBS,"- 대기오염물질양 계속 증가 -<앵커>우리나라 빗물 산성도가 점점 강해지고 있는 것으로 나타났습니다. 대기 오염이 그만큼 심하다는 뜻입니다.안영인 기지입니다.<기자>연일 이어지는 장맛비 속에서도 차량들은 오염물질이 들어 있는 먼지를 뒤집어쓰고 있습니다.국립환경과학원이 지난 99년부터 전국 40개 지점에서 빗물의 산성도를 측정한 결과 도시와 서해안 지역 빗물의 산성도가 점점 강해진 것으로 나타났습니다.지난 1999년 5를 크게 웃돌았던 빗물의 수소이온농도 지수 즉, pH는 최근에는 4.5까지 떨어졌습니다.특히 지난해 1월 태안과 강화도의 pH는 오렌지 주스의 pH와 비슷한 3.9를 기록했습니다.서울 불광동을 비롯한 12개 지역에서는 지난해 12달 내내 산성비가 내렸습니다.[홍유덕/국립환경과학원 기후대기연구부 박사 : 공장이라든지 또는 발전소, 자동차에서 사용되는 화석연료에서 배출되는 황산염이나 질산염 때문에 이러한 산성도가 강해지지 않을까…]실제로 빗물 속의 오염물질인 황산염과 질산염의 양은 지속적으로 증가하는 추세입니다.특히 산성비 등으로 경기 동부지역에 떨어지는 황의 양은 토양이나 산림이 버틸 수 있는 임계치를 초과하는 것으로 처음 확인됐습니다.[이상덕/국립환경과학원 기후대기연구부 박사: 수도권에서 자체적으로 발생하는 오염물질과 중국에서 넘어오는 오염물질이 합해지면서 수도권 풍하지역인 동부지역에 쌓이는 것이 아닌가 추정하고 있습니다.]산성비에 노출됐다고 해서 당장 문제가 되는 것은 없습니다.하지만 장기간 노출될 경우 토양이나 강물, 호숫물이 산성화되고 산림이 고사할 수 있습니다.(영상취재 : 정성화·이재영, 영상편집 : 최은진)안영인 기자youngin@sbs.co.kr관/련/정/보◆ 추석 '최대 9일 황금 연휴'…비행기표 동났다◆ 환자가 갑자기 의사에 흉기 공격…진료실 아수라장◆ 추억의 영도다리, 47년 만에 고개 들다…장관◆ 北 대표단, 기자실 몰려와 돌발 행동 ""개성공단 파탄나면…""◆ 전 프로축구 선수, 사촌 형과 함께 여친 성폭행☞[SBS기자들의 생생한 취재현장 뒷이야기 '취재파일']☞ SBS뉴스 공식 SNS [SBS8News 트위터] [페이스북] [미투데이] [요즘]저작권자 SBS&SBS콘텐츠허브 무단복제-재배포 금지"
39,2013-07-25,"삼성電 ""화성공장 암모니아 검출 안돼""",https://news.naver.com/main/read.nhn?mode=LSD&mid=shm&sid1=101&oid=277&aid=0003052603,아시아경제,"[아시아경제 지연진 기자]25일 오후 삼성전자 화성반도체 공장에서 발생한 암모니아 유출 의혹과 관련, 소방당국의 조사 결과 암모니아가 검출되지 않았다고 삼성전자 측이 밝혔다.삼성전자에 따르면 이날 오후 3시55분께 암모니아로 추정되는 냄새가 난다는 신고를 받고 경기 지역 소방서와 경찰서, 가스안전공사 등이 화성사업장내 10.11라인에 들어가 암모니아 유출 여부를 조사한 결과 검출 수치가 '0ppm'으로 나타났다.삼성전자는 또 이날 사업장내 장비반입구에서 암모니아 냄새를 맡았다는 협력사 직원 4명에 대해 사내에서 건강검진을 실시했지만, 건강에는 이상이 없다고 밝혔다. 이들 직원 중 1명은 최근 심근경색 등의 병력이 있어 정밀검진을 받기 위해 외부 병원으로 이송됐다.삼성전자는 이같은 조치를 마친 뒤 오후 5시 30분께 노동부에 신고했다.화성반도체 공장 10·11라인(한 건물 내에 있음)의 장비 반입구에서 작업하던 협력사 직원 4명은 암모니아 냄새로 추정되는 냄새가 난다고 신고했다. 냄새의 근원지는 전일 교체작업을 했던 진공펌프로 추정되고 있다.지연진 기자 gyj@<ⓒ세계를 보는 창 경제를 보는 눈, 아시아경제(www.asiae.co.kr) 무단전재 배포금지>[관련기사]전두환 며느리 '박상아' 기소한 검사 돌연…'이럴수가''이민정' 돈 많은 이병헌과 결혼한다더니만 끝내 이런 일이…'장윤정 가족사' 어쩐지 이상하다 했더니 '충격 반전''노현정' 재벌가 며느리 되고 잘 사나했는데 충격적 사건이…'신성우-박은지' 서로 친해보이더니만 이런 일이…'충격'"
40,2013-07-25,세계 수영선수권 유치위 압수영장 발부(종합),https://news.naver.com/main/read.nhn?mode=LSD&mid=shm&sid1=100&oid=001&aid=0006394396,연합뉴스,"노태강문화체육관광부 체육국장이 지난 22일 종로구 문화체육관광부 기자실에서 열린 '2019 세계수영선수권대회 광주 유치 및 정부 보증서 조작 관련' 입장 발표에서 취재진의 질문에 답하고 있다. 오른쪽은 위조된 정부의 재정지원 보증 서류. <<연합뉴스DB>>(광주=연합뉴스) 손상원 기자 = 2019 세계 수영선수권 대회 공문서 위조 사건을 수사 중인 검찰이 유치위원회 사무실과 광주시청 등에 대한 압수수색 영장을 발부받은 것으로 25일 확인됐다.광주지법은 이 수사와 관련해 광주시청 체육진흥과장실과 부속실, 유치위 사무총장실·기획총괄팀·사무국장실, 유치활동 컨설팅 업체 사무실, 광주시 공무원들의 인터넷 계정 등에 대해 검찰이 청구한 압수수색 영장을 발부했다.이에 따라 검찰은 26일 압수수색을 할 것으로 보인다.검찰은 22일 문화체육관광부로부터 수사 의뢰를 접수한 뒤 23일 사건 배당, 24일 공무원 2명 소환 조사에 이어 압수수색 영장을 발부받는 등 수사의 속도를 내고 있다.sangwon700@yna.co.kr[이 시각 많이 본 기사]☞개성공단 회담 결렬…北 ""공단 파탄나면 다시 軍주둔""(종합)☞김기덕 '뫼비우스', 베니스국제영화제 비경쟁 진출☞""김우중 아들 600억대 베트남 골프장 보유""<뉴스타파>(종합2보)☞<동아시안컵축구> 홍명보號 일본전 대비 '상황 대처 훈련'☞남북 개성공단 회담 끝내 결렬…공단 장기폐쇄 우려(종합3보)▶ 연합뉴스 모바일앱 다운받기▶ 인터랙티브뉴스<저작권자(c)연합뉴스. 무단전재-재배포금지.>"
41,2013-07-25,"[집중취재] ""적조에 황토 쓰지 마라""…금지 지시에 전남 '시끌'",https://news.naver.com/main/read.nhn?mode=LSD&mid=shm&sid1=102&oid=214&aid=0000259077,MBC,"[뉴스데스크]◀ＡＮＣ▶남해안은 지금 적조 비상이 걸렸는데요.전라남도가 적조방제용 황토살포를 전격 금지시켰습니다.그러자 해양수산부는 피해를 모두 책임져야 할 거라며 반발하고 나섰습니다.권남기 기자입니다.◀ＶＣＲ▶계속되는 폭염에 바닷물 온도가 급속히 오르면서 경남 통영에서 올해 첫 적조 피해가 발생한데 이어 전남지역도 비상이 걸렸습니다. 갑판에는 죽은 물고기가 가득합니다.지난해 적조로 20억 원이 넘는 피해를 입었던 전남의 지자체들은 적조 제거를 위해 해안과 섬 곳곳에 황토 12만 5천톤을 준비해놨습니다.제 뒤로 황토 적치장이 보이는데요.산더미 같이 쌓아놨지만 올해 이 황토를 사용하긴 힘들게 됐습니다.박준영 전남도지사가 황토 살포에 제동을 걸고 나섰기 때문입니다.박지사는 지난 21일 ""황토의 적조 방제효과가 없고 2차 환경오염도 우려된다""며 전남지역의 황토살포를 금지했습니다.CG]주무부처인 해양수산부는 ""황토를 안 쓰다 발생한 모든 책임은 전남도가 져야 한다""는 공문까지 보내며 반발하고 나섰습니다.◀ＳＹＮ▶ 해양수산부 관계자""적조경보가 발령되면 (해양수산부) 훈령에서는 황토를 살포하도록 지도하고 있습니다. 지자체에서는 이 기준에 따라야 된다고 봅니다.""국립수산과학원도 황토가 적조를 50%까지 없앤다는 연구결과가 이미 나와 있고, 황토가 해양 환경에 미치는 영향도 적다며 박지사의 조치를 이해할 수 없다는 반응입니다.발등에 불이 떨어진 어민들은 쌓인 황토를 바라보며 애만 태우고 있습니다.◀ＩＮＴ▶ 김정숙/양식 어민""전혀 사용을 못하게 되면 아무리 못하게 해도 우리한테 재산의 피해가 있는데 우리는 사용을 해야 되지 않겠어요.""현재 남해안에는 기준치의 최고 25배에 이르는 유해성 적조가 나타나 적조 경보가 내려진 상태입니다.MBC뉴스 권남기입니다. (권남기 기자)[저작권자(c) MBC (www.imnews.com) 무단복제-재배포 금지][관련기사]▶ 檢, 전두환 일가 '출국금지'…미술품 구입자금 추적▶ 국방부, 연예병사 제도 17년만에 폐지…병사 8명 징계▶ 국민 들끓게 한 전두환의 말말말…'정치는 언행일치'▶ 류현진, LA다저스 선정 전반기 '최고 신인'▶ 만취 택시 '광란의 질주'…경찰과 추격전 끝 검거"
42,2013-07-25,일본 여성 평균수명 세계 1위 복귀,https://news.naver.com/main/read.nhn?mode=LSD&mid=shm&sid1=102&oid=001&aid=0006394336,연합뉴스,"(도쿄=연합뉴스) 이충원 특파원 = 일본이 동일본대지진의 영향으로 홍콩에 내줬던 여성 평균수명 1위의 자리를 2년만에 되찾았다.일본 후생노동성은 2012년 일본 여성의 평균 수명이 86.41세로 세계에서 가장 긴 것으로 나타났다고 25일 밝혔다. 2위인 홍콩은 86.3세였다.일본 여성의 평균 수명은 1985년부터 26년간 부동의 세계 1위였지만, 2011년 홍콩에 이어 2위로 밀려났다. 동일본대지진으로 약 1만5천명이 숨지거나 실종된 영향이 컸다. 하지만 지난해에는 자살자 감소 등 덕분에 여성의 평균수명이 0.51세 늘어나 1위에 복귀했다.일본 남성의 2012년 평균 수명은 79.94세로 세계 5위였다. 남성 평균수명 세계 1위는 아이슬란드(80.8세)였다.평균수명은 그해에 태어난 아기가 앞으로 몇 년 살 수 있을지 예측한 수치다. 유엔인구기금(UNFPA) 2012 세계인구현황보고서에 따르면 한국 남성의 평균 수명은 77.3세, 여성의 평균 수명은 84세였다.chungwon@yna.co.kr[이 시각 많이 본 기사]☞검찰 '전두환 재산 추징' 관련 삼성생명 압수수색☞<""저 세상에서 모래시계 2편을…"" 김종학 PD 영결식>☞<김종학PD 자살처리 분당경찰, 검찰 눈치보기 '급급'>☞<동아시안컵축구> '실험 끝낸' 홍명보號, 일본전에 승부수☞""김우중 아들 600억대 베트남 골프장 보유""<뉴스타파>▶ 연합뉴스 모바일앱 다운받기▶ 인터랙티브뉴스<저작권자(c)연합뉴스. 무단전재-재배포금지.>"
43,2013-07-25,아내 잔혹 살해 75세 노인에 100세까지 징역형,https://news.naver.com/main/read.nhn?mode=LSD&mid=shm&sid1=102&oid=001&aid=0006394196,연합뉴스,"(광주=연합뉴스) 손상원 기자 = 광주지법 형사 11부(홍진호 부장판사)는 25일 아내를 살해해 시신을 토막낸 혐의(살인 등)로 기소된 A(75)씨에 대해 징역 25년을 선고했다.재판부는 ""아내를 농기구로 수차례 내리쳐 잔혹하게 살해한 것도 모자라 시신을 훼손한 죄질이 매우 좋지 않다""며 ""지적 장애 3급인 A씨가 우발적으로 범행했고 피해자의 아들이 처벌을 원하지 않는다는 의사를 밝힌 점 등은 참작했다""고 밝혔다.A씨는 지난 4월 29일 오후 7시께 화순군 자신의 집 앞마당에서 아내(70)를 농기구 등으로 때려 숨지게 한 혐의로 기소됐다.A씨는 시신을 토막낸 뒤 비료 포대에 나눠 담아 냉장고, 밭둑, 정화조에 보관하거나 유기한 것으로 조사됐다.A씨는 평소 아내가 무시하고 폭력을 행사했으며 범행 당시에도 밭일을 제대로 하지 않았다고 때리려 해 살해했다고 수사 과정에서 진술했다.sangwon700@yna.co.kr[이 시각 많이 본 기사]☞검찰 '전두환 재산 추징' 관련 삼성생명 압수수색☞<""저 세상에서 모래시계 2편을…"" 김종학 PD 영결식>☞엔저에 참치 매출 급증…횟감순위 바뀌었다☞<동아시안컵축구> '실험 끝낸' 홍명보號, 일본전에 승부수☞<특집:전두환 추징> ⑦ 전재용-이창석 '은밀한 커넥션'▶ 연합뉴스 모바일앱 다운받기▶ 인터랙티브뉴스<저작권자(c)연합뉴스. 무단전재-재배포금지.>"
44,2013-07-25,'사망자 중국인이라서 다행' 채널A에 중징계,https://news.naver.com/main/read.nhn?mode=LSD&mid=shm&sid1=102&oid=001&aid=0006394348,연합뉴스,"(서울=연합뉴스) 최인영 기자 = 아시아나 여객기 착륙 사고 내용을 보도하면서 타국 국민의 사망에 대해 '다행'이라고 표현한 채널A의 '뉴스특보'가 25일 방송통신심의위원회로부터 중징계를 받았다.채널A 뉴스특보는 지난 7일 새벽 발생한 아시아나 여객기 착륙 사고의 경위와 사상자 등에 대한 소식을 전하면서 사망자의 신원이 중국인으로 파악됐다며 ""우리 입장에서는 다행이라고 말할 수도 있을 것 같은데요""라고 말해 물의를 빚었다.방통심의위는 ""생명은 국적에 상관없이 소중한 가치를 지니는 것인데도 인명사고에 대해 우리나라 국민이 아니면 다행이라고 표현한 것은 생방송 중의 단순 말실수라고 하기엔 심의규정 위반 정도가 매우 중하다""고 판단하고, '해당 방송 프로그램 관계자에 대한 징계'와 '경고'를 결정했다.심의위는 RTV의 '백년전쟁 - 두 얼굴의 이승만', '백년전쟁 - 프레이저 보고서(제1부)'에 대해서도 특정 자료만을 근거로 역사를 편향적으로 해석해 방송했다고 보고 '해당 방송 프로그램 관계자에 대한 징계'와 '경고' 처분을 내렸다.SBS의 '너의 목소리가 들려'는 비록 효과음 처리를 했지만 등장인물이 욕설하는 장면을 수차례 방송해 '주의' 처분을 받았다.abbie@yna.co.kr[이 시각 많이 본 기사]☞남북 개성공단 회담 끝내 결렬…공단 장기폐쇄 우려(종합3보)☞<논란 후 ""이 가수 누구야?""..노이즈 효과 '톡톡'>☞정부 ""개성공단에 北 진정성 안 보이면 중대 결심""(종합)☞-日야구- 이대호, 4안타에 17호 홈런까지 폭발(종합)☞<회담 결렬 후 개성공단 운명은…폐쇄절차 가능성>▶ 연합뉴스 모바일앱 다운받기▶ 인터랙티브뉴스<저작권자(c)연합뉴스. 무단전재-재배포금지.>"
45,2013-07-25,헌재 판결에 따라 이동전화 '010 번호통합 계획' 탄력,https://news.naver.com/main/read.nhn?mode=LSD&mid=shm&sid1=105&oid=079&aid=0002495035,노컷뉴스,"[CBS노컷뉴스 임기상 기자]'01X' 번호를 '010'으로 강제 통합하는 것이 위헌이라며 청구한 헌법소원 사건에 대해 헌법재판소가 각하 혹은 기각 결정을 내림에 따라 정부의 번호통합 계획이 힘을 받게 됐다.'01X 한시적 번호이동 제도'는 정부가 휴대전화 번호 앞자리를 '010'으로 통합하기로 하면서 스마트폰 보급을 활성화하고자 한시적으로 3G·LTE 가입자의 기존 '01X' 번호 사용을 허가한 것으로, 올해 말까지가 시행 기간이다.헌재의 결정으로 미래창조과학부의 010 번호 통합 계획은 예정대로 차질없이 진행될 수 있을 것으로 보인다.미래부는 01X 번호로 3G나 LTE 서비스를 이용하는 가입자들은 내년 1월 1일부터 3G·LTE 서비스 가입 당시 미리 부여받은 010 번호만을 사용할 수 있도록 할 계획이다.가입자들은 이동통신사의 대리점이나 홈페이지에서 01X 번호를 010 번호로 바꿔야 한다.만약 010으로 번호를 변경하지 않으면 내년부터 자동으로 번호가 010으로 바뀐다.현재 01X 번호로 3G나 LTE를 이용하는 가입자는 SK텔레콤 94만명, KT 38만명, LG유플러스 12만명 등 144만명에 이른다.단 01X 번호를 사용자더라도 2G 서비스를 이용하는 272만명은 현재 번호를 그대로 사용할 수 있다.이용자들이 정부의 '010 번호 통합' 계획에 반발하는 것은 오랜 기간 자신의 고유번호처럼 사용되던 휴대전화 번호에 대한 애착 때문이다.01X 번호를 사용하는 일부 자영업자 중 단골 혹은 잠재 고객에게 자신의 01X 번호를 홍보해온 사람들은 영업에서 실질적인 피해를 볼 수 있다.번호가 바뀌게 되면 한동안 통화하지 않았던 사람에게 혹시 걸려올지 모를 전화를 못 받게 되기도 한다.미래부는 이런 사용자들의 불편을 줄여주기 위해 올해 안에 01X 번호를 010으로 변경한 가입자에게 3년간 발신번호를 기존 01X 번호로 표시해주는 '01X 번호 표시 서비스'를 무료로 이용하게 할 계획이다.kisanglim@hotmail.com[네티즌 많이 본 기사]●이상한 ATM녀? 더 이상한 '심야 냉방'●[인터뷰] 송강호 ""설국열차는 또다른 괴물과 싸우는 사람들 얘기""●죽음 부른 먹튀 드라마 제작시스템, 놔둘건가?●전재국 씨가 빼돌린 돈은 '전두환 비자금?'●'호날두 프리킥에 11살 소년 손목 부러져…'(대한민국 중심언론 CBS  뉴스FM98.1 / 음악FM93.9 / TV CH 412)<저작권자 ⓒ CBS 노컷뉴스(www.nocutnews.co.kr) 무단전재 및 재배포 금지>[노컷뉴스 모바일웹][스마트한 영상뉴스 '노컷V'][뉴스 속 속사정, 'Why뉴스']"
46,2013-07-25,최저시급마저 깎는 ‘알바 수습임금’ 아세요?,https://news.naver.com/main/read.nhn?mode=LSD&mid=shm&sid1=102&oid=028&aid=0002197027,한겨레,"[한겨레]1년 이상 ‘수습’ 명목 10%씩 떼여실제 시간당 4500원…360원 덜 받아‘알바 지킴이’ 고교생들 개선 요구올해 최저임금은 시간당 4860원이다. 그런데 최저임금을 주지 않아도 되게 하는 것이 최저임금법 때문이라면? 대전 고교생들이 이런 문제점을 제기하며 개선을 촉구하고 나섰다.대전고 박상표(17·1년)·송민섭(˝)군, 대전중앙고 이영재(˝)군, 대전여고 2학년 현지수(18)양 등 6명이 꾸린 ‘티티티(TTT) 알바 지킴이’ 팀은 25일 오후 대전 서구 둔산동 갤러리아 타임월드 광장에서 ‘유명무실한 최저시급제의 실태’를 알리는 기자회견을 했다.이들은 “올해 최저임금법 시행령에 최저시급은 4860원으로 규정돼 있다. 하지만 편의점, 식당 등에 고용된 아르바이트생들을 조사해보니 실제 시급은 대부분 4500원이었다. 그런데도 고용노동청도 법 위반으로 고용주를 단속하지 못하는 게 현실”이라고 말했다. 최저임금법에 ‘고용주가 1년 이상 고용할 경우 수습기간 동안 수습직원에게 최저시급에서 10% 적은 임금을 지급할 수 있다’는 규정을 악용하기 때문이라고 학생들은 지적했다.청소년들이 아르바이트를 할 경우 시급으로 적어도 4860원을 받아야 하지만 실제로는 잘 받아야 4500원인데, 고용주가 최저임금법에 규정된 수습임금 규정을 적용하기 때문이라는 것이다.“1년 이상 근무할 곳이 아니라 1~3달 알바해도 시급은 4500원입니다. 고용주는 근무 기간에 상관없이 근로계약서에 근무 시작일만 적어놓는 거죠. 문제 되면 ‘난 1년 이상 근무할 직원을 뽑은 것’이라고 변명하며 빠져나갑니다.”대전 괴정고 박민서(18·2년)양은 “최저임금은 물가수준 등을 따져 생계 유지가 가능한 수준에서 정한 것으로 아는데, 최저임금법 규정을 악용해 4860원을 주지 않는 것은 문제”라고 지적했다.학생들은 지난 5월 고용노동청의 청소년 알바 지킴이 공모에 선발돼 청소년 알바 권리를 지키는 활동을 하다, 최저시급이 지켜지지 않는 현실을 알고 대전고용노동청에 질의하는 과정에서 최저임금법을 악용하는 실태를 알게 됐다고 했다. 팀 이름인 ‘티티티’(TTT)는 팔 벌리고 선 사람들을 표현한 그림인데 문자로 표현하기 어려워 알파벳 대문자 T를 세 번 겹쳐 썼단다. 이들은 기자회견 뒤 이날 학생 무료 입장 행사가 있는 대전 한밭운동장 야구장에서 청소년 알바 권리찾기 홍보를 벌였다.“다음달에 변호사님과 국회의원님들께 법을 고치려면 어떻게 해야 하는지 여쭈어볼 작정입니다. 우리의 의견이 널리 알려져 양심적으로 아르바이트생들을 대하는 문화가 자리잡아 청소년 아르바이트가 건강한 노동의 상징이 됐으면 좋겠어요.” 팀장인 대전 중앙고 여인규(17·1년)군의 바람이다.대전/글·사진 송인걸 기자igsong@hani.co.kr<한겨레 인기기사>■[동영상] 국정원 수사 경찰 “지금 댓글이 삭제되고 있는 판에 잠이 와?”■“사내 자식이…너 XX 있냐?”…막말·체벌 교장, 결국 인권위로■여주 남한강 ‘전북교’ 교각 유실…“4대강 준설 탓”■87년 여름처럼…‘풀뿌리 시국선언’ 전국서 잇따른다■[화보] ‘로열 베이비’의 이름은 조지 알렉산더 루이스공식 SNS[통하니][트위터][미투데이]| 구독신청[한겨레신문][한겨레21]Copyrights ⓒ 한겨레신문사, 무단전재 및 재배포 금지<한겨레는 한국온라인신문협회(www.kona.or.kr)의 디지털뉴스이용규칙에 따른 저작권을 행사합니다.>"
