,날짜,기사 제목,기사 링크,기사 출처,기사 내용
62,2013-11-10,울산 앞바다 원유이송 중 기름 유출…해경 수사(종합3보),https://news.naver.com/main/read.nhn?mode=LSD&mid=shm&sid1=102&oid=001&aid=0006588465,연합뉴스,"울산 앞바다 기름오염     (울산=연합뉴스) 이상현 기자 = 10일 울산시 울주군 온산앞바다에서 발생한 원유이송관 파손 사고로 기름이 유출됐다. 사고 선박인 16만t급 대형 유조선 옆에서 작업선이 파손된 이송관 보수작업을 펴고 있다. 2013.11.10 leeyoo@yna.co.kr유조선→부이 원유 이송작업 중 관로 균열…방제 마무리(울산=연합뉴스) 이상현 허광무 기자 = 10일 오전 울산 앞바다에서 대형 유조선이 해상에서 원유를 이송하던 도중 기름 유출 사고가 일어났다.다행히 원유 유출량이 많지 않아 큰 오염사고로 이어지지 않았지만 자칫했으면 대형 해상오염 사고가 날 뻔했다.◇사고 발생10일 오전 4시 45분께 울산시 울주군 온산앞바다에서 파나마선적 16만t급 대형 유조선 'C.이터니티'호가 해상 원유이송시설인 '부이'(Buoy)로 원유를 이송하던 도중 원유 이송관에 균열이 발생하면서 원유가 바다로 유출됐다.균열이 난 곳은 유조선과 부이를 연결한 길이 200ｍ가량, 지름 61㎝ 규모의 이송관이다.해상원유이송시설인 부이는 SK에너지 소유로 유조선이 이송관을 통해 원유를 부이로 보내면 펌핑기능이 부착된 부이가 해저에 설치된 송유관을 통해 원유를 다시 육지로 보내는 장치다.지름 12.5ｍ, 높이 4.3ｍ 규모의 원통형인 부이는 육지에서 4㎞가량 떨어진 해상에 설치돼 있다.울산 앞바다 기름오염 방제작업    (울산=연합뉴스) 이상현 기자 = 10일 울산시 울주군 온산앞바다에서 발생한 원유이송관 파손 사고로 기름이 유출되자 해경 방제선 등이 방제작업을 펼치고 있다. 사고 선박인 16만t급 대형 유조선 '씨 이터너티' 옆에서 작업선이 파손된 이송관이 보수작업을 펴고 있다. 오른쪽은 해경 방제선들이 방제하는 모습. 2013.11.10    leeyoo@yna.co.kr울산항의 경우 대형 유조선이 수심이 얕고 해류가 심한 부두에 접안할 수 없어 해상에 항상 떠 있는 부이를 통해 원유를 하역한다.◇유출된 기름량해경은 유조선이 사고 전날 오전부터 부이에 접안해 해상 이송관을 통해 196만 배럴(1배럴은 158.9ℓ)의 원유를 부이로 이송하던 도중 10일 오전 2시께 사고가 난 것으로 보고 있다.기름은 사고 부이 주변 1곳, 북동 방향으로 2∼3㎞ 지점 2곳 등 총 3곳에 길이 700ｍ, 너비 30∼40ｍ 규모의 유막을 형성했다.이에 따라 해경은 유출된 기름이 그리 많지 않을 것으로 추정하고 있다.해경은 유조선에 남아 있는 원유와 부이로 이송된 원유 등을 비교하는 방법으로 기름 유출량을 산출해야 하기 때문에 다소 시일이 걸릴 것이라고 설명했다.◇방제 작업울산해경은 사고가 나자 이날 새벽부터 경비정과 방제정 등 9척을 동원해 소화포를 쏘는 동시에 스크루로 기름을 흩어버리는 방식으로 방제작업을 벌였다. 사고 부이 소유주인 SK에너지와 해양환경관리공단도 9척의 선박을 동원해 방제작업을 했다.해경은 이날 오후 2시께 유조선과 부이 주변에 퍼진 유막과 사고 지점에서 북동쪽으로 2∼3㎞ 떨어진 지점까지 흘러간 기름 등에 대한 방제작업을 모두 마무리했다.<그래픽> 울산 앞바다 원유이송관 파손 사고    (서울=연합뉴스) 이재윤 기자 = 10일 오전 4시 45분께 울산시 울주군 온산앞바다에서 파나마선적 16만t급 대형 유조선 'C.이터니티'호가 해상 원유이송시설인 '부이'(Buoy)로 원유를 이송하던 도중 원유 이송관에 균열이 발생하면서 원유가 바다로 유출됐다.    yoon2@yna.co.kr    @yonhap_graphics(트위터)그러나 울산해경은 추가로 유출된 기름이 있는지 사고 해역 일대를 돌아보고 있다.김종욱 울산해경 서장은 ""사고해역에 파랑이 심하게 일어 이 파랑이 유막을 흩어버리는 '자연방제' 역할을 한 덕분에 방제작업이 수월하게 진행됐다""면서 ""기름 유출 즉시 이송작업을 중단하는 등 초동조처를 잘해 해상오염 피해는 심각하지 않은 것으로 파악하고 있다""고 밝혔다.◇해경 수사울산해경은 사고현장이 수습되는 대로 SK에너지와 유조선 관계자 등을 불러 사고 경위와 과실 여부 등을 조사할 예정이다.해경은 이송관의 기름 유출부위 등을 조사하는 등 사고 원인 파악에 나섰다.해경은 이와 함께 정확한 기름 유출량이 산정되면 관계자들을 해양환경관리법 위반 혐의로 입건할 방침이다.해양환경관리법은 선박 및 해양시설로부터 유해액체물질 등을 배출하면 3년 이하 징역이나 3천만원 이하 벌금을 물리도록 정하고 있다.leeyoo@yna.co.krhkm@yna.co.kr▶연합뉴스앱▶인터랙티브뉴스▶화보<저작권자(c)연합뉴스 무단전재-재배포금지>"
63,2013-11-10,내일 첫 '한파주의보'...서울 영하 1도,https://news.naver.com/main/read.nhn?mode=LSD&mid=shm&sid1=103&oid=079&aid=0002530305,노컷뉴스,"[ CBS노컷뉴스 곽영식 기자]11일 서울을 비롯한 중부 내륙지역의 아침기온이 영하권으로 떨어지고 바람도 강하게 불어 매우 추운 날씨가 되겠다.기상청은 11일 아침에는 기온이 큰 폭으로 떨어지면서 중부내륙과 일부 남부내륙에는 기온이 영하로 떨어지는 곳이 많겠고, 바람도 강하게 불면서 체감온도는 더욱 낮아질 것으로 예보했다.특히 새벽 3시를 기해 강원도와 충청북도, 경북 내륙 일부지역에 올 가을들어 첫 한파주의보가 발효된다.아침 대관령과 철원의 기온이 -6도, 춘천 -4도, 충주 -3도, 서울 -1도, 전주 2도, 대구 3도로 5도에서 10도 정도 떨어질 것으로 보인다.기상청은 또 새벽에서 아침 사이 중부내륙과 일부 남부내륙지역에 서리가 내리고 얼음이 어는 곳이 많을 것으로 보인다며 농작물 관리에 유의해 줄 것을 당부했다.이번 추위는 당분간 이어지겠고, 13일 낮부터 점차 기온이 오르면서 14일부터 평년기온을 회복할 것으로 보인다.kys@cbs.co.kr저작권자 ⓒ CBS 노컷뉴스(www.nocutnews.co.kr) 무단전재 및 재배포 금지"
64,2013-11-10,"순방 다녀온 朴대통령, 대치정국 '처방전'은",https://news.naver.com/main/read.nhn?mode=LSD&mid=shm&sid1=100&oid=001&aid=0006588172,연합뉴스,"서유럽 순방 마친 박근혜 대통령 박근혜 대통령이 6박8일간의 프랑스.영국.벨기에 유럽연합 등 서유럽 순방을 마치고 지난 9일 경기도 성남시 서울공항에 도착, 취재진에 손을 흔들어 인사하고 있다. <<연합뉴스 DB>>국내 부재중 여야 관계 경색…정기국회 험로 예고원칙론 고수냐, 신축대응이냐…국회 시정연설 주목(서울=연합뉴스) 박성민 기자 = 여드레간의 서유럽 순방을 마치고 9일 귀국한 박근혜 대통령이 꼬일대로 꼬여있는 국내 대치정국에 어떻게 대처할지 주목된다.국정감사에 집중하며 한동안 원내 활동에 주력했던 민주당이 박 대통령의 귀국에 맞춰 국정원 선거개입 의혹 등에 대한 검찰수사를 믿을 수 없다며 8일 국회 일정을 전면 보이콧하며 특검도입을 주장하는 등 정국 긴장도가 한층 높아진 상황과 맞딱뜨리게 돼서다.박 대통령의 순방기간 정국은 더욱 복잡해진 형국이다. 지난 6일 박 대통령의 대선 라이벌이던 민주당 문재인 의원이 2007년 남북정상회담 회의록 미(未)이관 수사와 관련해 참고인 신분으로 검찰에 출석한 것이 계기가 됐다.이 수사와 관련해 문 의원은 소환된데 반해 새누리당 김무성 의원과 권영세 주중대사에 대해서는 검찰이 서면조사 방침을 정한 것으로 확인되자 민주당은 '편파수사'를 주장하며 정기국회 일정을 '보이콧'한 뒤 대검을 항의방문하고 장외집회를 벌였다.나아가 민주당은 검찰 수사를 믿을 수 없다며 대선 관련 의혹 전반에 대한 '원샷 특검'을 요구했다. 하지만 새누리당은 특검 불용 및 단독 국회 불사 방침을 밝히면서 양측의 대치는 한층 심화된 양상이다.박 대통령이 순방 직전인 지난달 31일 청와대 수석비서관회의에서 국가기관의 대선개입 의혹에 대한 철저한 수사와 책임자 처벌, 재발방지책 마련 등을 거듭 약속하며 '공세 털기'를 시도했지만 순방 외교에 집중하는 사이 사태는 더욱 풀기 어렵게된 셈이다.문제는 민주당 지도부가 특검 도입과 정기국회에서의 법안 및 예산안 처리를 연계할 수 있다는 가능성을 시사한 점이다. 야당이 법안과 예산안을 지렛대 삼아 특검을 관철하려들 경우 청와대로서는 곤혹스러운 처지에 빠질 수밖에 없어 보인다.    박 대통령 집권 원년의 성패가 각종 민생관련 법안과 새해 예산안 처리로  갈리수 있기 때문이다.박 대통령은 귀국 다음날인 10일 청와대 관저에 머물면서 부재기간 쌓인 각종 국정 현안에 대해 보고를 받은 것으로 알려졌다. 11일과 12일에도 수석비서관 회의 등의 특별한 일정을 잡지 않고 13일로 예정된 블라디미르 푸틴 러시아 대통령과의 정상회담에 대비할 것으로 알려졌다.이후에는 18일로 예정된 국회 시정연설 준비에 진력할 전망이어서 이번 주에는 정치 현안에 대해 공개적으로 언급할 기회가 사실상 없어 보인다.이 때문에 박 대통령이 시정연설에서 내년도 예산안과 기금운영계획안에 대한 설명과는 별도로 민주당의 특검요구 등 정국 현안에 대해 어떤 입장을 내놓을지가 주목된다.박 대통령이 그동안 국가기관 대선개입 의혹은 자신과 무관하고 대선시 어떠한 도움도 받지 않았으며 검찰 수사를 기다려보자는 입장을 고수해온 만큼 이런 기조를 유지할 것이라는 관측이 우세하게 제기된다.다만 그럴 경우 야당의 반발이 더욱 거세지고 정기국회가 공전과 파행을 거듭할 가능성이 커 일각에서는 박 대통령이 한 발짝 물러나 야권의 반발이나 공세를 누그러뜨릴 수 있는 메시지를 던질 가능성이 있다는 분석도 나온다.min22@yna.co.kr▶연합뉴스앱▶인터랙티브뉴스▶화보<저작권자(c)연합뉴스 무단전재-재배포금지>"
65,2013-11-10,"경찰, 물대포 발사…민주노총, 거리 점거 대치(2보)",https://news.naver.com/main/read.nhn?mode=LSD&mid=shm&sid1=102&oid=079&aid=0002530306,노컷뉴스,"[CBS노컷뉴스 김민재 기자]전국민주노동조합총연맹이 10일 오후 2시 진행된 노동자대회를 마치고 행진하던 중 경로를 이탈해 거리를 점거하자 경찰이 물대포를 쏘며 진압에 나섰다.집회 측 추산 5만명, 경찰측 추산 1만 7000명의 집회참여 인원 중 경찰 추산 만 3천여명이 오후 4시 55분쯤 대오 일부가 경로를 바꿔 거리점거 행진을 벌였다.경찰은 오후 5시 10분부터 동대문 역사문화공원 앞 사거리애서 거리 점거 인원과 대치를 벌이던 중 5시 40분쯤 경고방송과 함께 물대포를 살수했다.ten@cbs.co.kr저작권자 ⓒ CBS 노컷뉴스(www.nocutnews.co.kr) 무단전재 및 재배포 금지"
66,2013-11-10,후쿠시마원전서 오염된 빗물 유출…기준치 14배,https://news.naver.com/main/read.nhn?mode=LSD&mid=shm&sid1=101&oid=001&aid=0006587815,연합뉴스,도쿄전력의한 직원이 지난 7일(현지시간) 방사능 오염수가 누출된 후쿠시마 제1원전 H4 구역에서 기자들에게 사후 처리 상황에 대해 설명하고 있다.(AP=연합뉴스DB)(도쿄=연합뉴스) 이세원 특파원 = 일본 후쿠시마(福島) 제1원자력 발전소의 오염수 탱크 둘레에 설치된 보에서 방사성 물질을 포함한 빗물이 샜다고 도쿄전력이 밝혔다.H6 구역 탱크에 둘레에 설치된 보의 배수구 주변에서 물이 샌 것으로 보이는 약 0.8㎡ 크기의 흔적이 9일 발견됐다.배수구는 닫혀 있었고 배수관이 설치된 부위가 샌 것으로 추정된다.보 내부에 남은 물은 분석한 결과 1ℓ당 방사성 물질 스트론튬 90이 140㏃(베크렐) 포함돼 있었다.이는 보에서 빗물을 방출할 수 있는 한계 농도(10㏃/ℓ)의 14배에 해당한다고 아사히(朝日)신문이 10일 전했다.sewonlee@yna.co.kr▶연합뉴스앱▶인터랙티브뉴스▶화보<저작권자(c)연합뉴스 무단전재-재배포금지>
67,2013-11-10,서울 출근길 영하권까지 떨어진다..겨울 추위 시작,https://news.naver.com/main/read.nhn?mode=LSD&mid=shm&sid1=103&oid=018&aid=0002877698,이데일리,"[이데일리 김정민 기자]서울지역 기온이 올 들어 처음 영하권으로 떨어지는 등 겨울의 시작을 알리는 추위가 찾아왔다.기상청은 11일 북서쪽에서 확장하는 대륙 고기압의 영향으로 전국이 대체로 맑겠지만, 기온이 큰 폭으로 떨어져 서울지역이 올 들어 처음 아침기온이 영하권을 기록할 것이라고 10일 예보했다. 중부내륙과 일부 남부내륙에는 서리가 내리고 얼음이 어는 곳도 있겠다. 아침 최저기온은 영하 6도에서 7도, 낮 최고 기온은 5도에서 12도가 되겠다.지역별로 서울은 아침 최저기온이 영하 1도, 낮 최고기온이 6도를 기록하겠다. 인천은 2~7도, 강릉은 1~8도, 대전은 2~8도를 오가는 등 전국 대부분 지역이 한낮에도 예년 기온을 크게 밑돌겠다. 일부지역은 바람까지 거세 체감온도가 0도 가까이 떨어지는 등 한겨울 날씨가 무색할 전망이다.기상청은 11일 오전 3시부로 서해5도와 충청남도(태안군, 서산시, 보령시), 전라남도(무안군, 목포시), 흑산도·홍도, 울릉도·독도에 강풍 주의보를 발령했다.또 강릉시와 동해시 산간지역 등 강원도 일대와 청주시와 영동군을 제외한 충청북도 전역, 경상북도 일부 지역에는 한파주의보를 내렸다. 이번 추위는 화요일(12일) 아침을 고비로 수요일 낮부터 점차 누그러져 주말께에는 예년 기온을 되찾을 것으로 보인다.김정민 (jmkim@edaily.co.kr)[이데일리 뉴스 앱][이데일리 TV][이데일리 ON][MP트래블러][마켓포인트]＜ⓒ종합 경제정보 미디어 이데일리 - 무단전재 & 재배포 금지＞"
68,2013-11-10,"[취재파일] '지하철 노인 무임 승차', '노인'을 바꾸거나 '무임'을 바꿔달라는데…",https://news.naver.com/main/read.nhn?mode=LSD&mid=shm&sid1=102&oid=096&aid=0000270705,SBS(text),"1989년 발표된 김현철 1집엔 버릴 노래가 하나도 없지만 한 곡만 꼽아보라면 내겐 아무래도 '춘천 가는 기차'다.""조금은 지쳐 있었나봐 쫓기는 듯한 내 생활...""로 시작해 ""..초라한 내 모습만 이 길을 따라가네 그리운 사람...""까지. '춘천 가는 기차'를 들으며 춘천으로 향하던 추억의 경춘선. 많은 이들이 청춘의 한 상징으로 추억하는 그 경춘선 열차 노선은 2010년 폐지됐다. 이제는 '춘천 가는 전철'이다.한국 최초의 지하철은 1974년 서울역에서 청량리를 잇는 1호선인데 지금은 1~9호선에 분당선, 신분당선, 중앙선, 경의선 등등이 줄줄이 개통했다. 수도권 전철이라지만 실제로는 춘천과 천안까지, 강원도 영서내륙과 충남까지 연결하는 광역 노선이다. 또 인천, 부산, 대구, 대전, 광주 5개 광역시에도 도시철도가 운영되고 있다.65세 이상이면, 이 모든 도시철도를 무료로 이용할 수 있다. 1981년부터 시행된 노인복지법 26조 경로우대 조항 덕분이다. 이 조항은 ""국가 또는 지자체는 65세 이상의 자에 대해 국가나 지자체의 수송시설을 무료나 할인해 이용하게 할 수 있다""고 규정하고 있다. 시행령에서 그 할인율을 100%로 정했다.아무도 문제 삼지 않던 이 노인 무임승차를 조정해야 한다는 주장이 불거지게 된 건 역시 노인이 너무 많아져서다.1980년대만 해도 한국은 대단히 ?은 나라로, 65세 이상 노인인구 비율은 4% 남짓에 불과했다. 당시 전두환 대통령이 대한노인회 건의를 받아 노인복지법을 만들었다는데 그럴 만하기도 했고 부담도 감당할 만한 수준이었던 것이다. 올해 전국의 노인 비율은 12.2%, 7% 이상이면 고령화 사회, 14% 이상은 고령 사회라고 한다는데 고령 사회 직전이다.전국의 도시철도 운영기관들이 추산한 2012년 무임승차로 인한 손실은 6개 도시를 합쳐 4,129억 원이다. 전체 손실 8천억 원의 51.6%에 해당한다.(여기에는 장애인 등 다른 무임승차도 포함되지만 대부분은 노인 무임승차) 2012년 무임 승차 인원은, 서울 메트로와 서울 도시철도공사만 합쳐도 2억 3천 5백만 명(누적 인원), 서울 노인 인구를 110만 명 정도로 봤을 때 1명당 214회 정도 이용했다는 계산이 나온다.(정확한 계산은 아닌 게 여기엔 다른 무임승차가 포함돼 있고, 또 경기도에서 이용하는 노인은 제외돼 있다. 다만 철도공사에서의 무임 승차 인원은 누락돼 있으니 더하고 빼면 크게 차이나진 않을 것 같다.)서울시의 경우 65세 이상 노인에게는 '시니어 패스'라는 무료 교통카드를 발급해준다. 지하철은 무료 이용이 가능하고 버스는 티머니를 충전해 이용하면 된다. 노인 유동인구가 가장 많다는 종로 3가 역에 가보면 지상에서 연결되는 종묘 앞 공원에도 노인들이 많지만 날이 쌀쌀하거나 너무 더울 때는 역사 내에도 노인들이 많다. 여기서 만나본 노인들은 지하철 이용에 부담이 없기 때문에 마음껏 나들이 다닐 수 있어 아주 좋다는 반응이었다. 그러나 만성적인 경영 적자 때문에 늘 고민인 운영기관 입장에선 제도 개선이 필요하다는 주장을 할 수밖에 없는 상황이다.그래서 10월 말, 기관들은 공동으로 관계부처(기재부, 국토부, 복지부)에 제도 개선을 건의했다. 노인복지법의 경로우대 연령을 65세에서 70세로 상향조정하는 안, 무임승차 손실을 보전해달라는 안이다. 보전액으로 요구하는 돈은 한해 3,315억 원 정도다. 서울시 도시철도공사는 이와 별도로 무임제도를 소득에 따라 차등 할인하거나 현재 100% 무임에서 50% 할인으로 바꾸는 안을 건의했다.경로우대 연령을 상향조정하는 안은 이미 여러 차례 거론됐고 일부에선 시행 중인 내용이다. 2012년 9월 기획재정부가 발표한 '2060년 미래 한국을 위한 중장기 적정인구 관리방안'에서는 정년 연장과 함께 65세인 노인 기준을 70세나 75세로 높이는 안을 검토하기로 했다. 소득세법에선 이미 경로 우대 추가 공제를 70세 이상부터 적용하고 있다. 65세 이상이라고 해도 스스로를 노인으로 여기지 않는 이들이 많다는 것도 그렇다. 무임승차 할인율을 조정하는 안은, 미국, 영국, 프랑스 등 여러 나라에서 이미 그렇게 시행하고 있다는 점에서 설득력을 얻는다.제도 개선이 필요하다는 데에는 대체로 공감하는 분위기지만, 이를 본격 거론하기엔 부담이 크다. 2010년 10월 김황식 당시 총리가 노인 무임승차를 폐지할 필요가 있다는 발언을 했는데 대한노인회 등에서 강하게 반발하면서 공식 사과하기도 했다. 당장 내년 6월 지방선거를 앞둔 상황이기 때문에, 경로 우대 연령을 조정하거나 할인율을 낮추는 안을 정부든 국회든 섣불리 거론하기 힘든 이유는 노인층 반발을 우려해서다.도시철도 운영기관 측에서도, 이 때문인지 제도 개선보다는 비용 지원을 더 기대하고 있다. 무임승차 손실을 국고로 지원해달라는 건의를 이미 서울 메트로는 1992년부터 21차례나 건의했고, 도시철도 운영기관들은 2003년 협의회를 구성한 이래 5차례, 전국 시도지사 협의회에서도 3차례 등 숱하게 요구해왔다. 이들은 또 철도공사(코레일)의 무임승차 손실은 철도사업법에 근거해 국고로 지원받고 있지만 도시철도는 지원받고 못하고 있다는 형평성 문제도 제기하고 있다. 현재 국회에도 도시철도법이나 노인복지법 등 관련 법 개정안이 발의돼 있는 상태다.(17대부터 발의됐지만 개정되지 못한 채 자동 폐기됐고 19대 국회 들어 다시 발의.)적자의 절반 정도가 무임 승차에서 비롯되고 제도를 고쳐야 한다는 데 대다수가 공감하고 있는데도 개선은 놔두고 비용만 국고로 지원한다면... '세금 낭비'라고 부를 수 있겠다. 6월 선거 이후에라도 개선됐으면 하는 바람이다.심영구 기자so5what@sbs.co.kr☞[SBS기자들의 생생한 취재현장 뒷이야기 '취재파일']☞ SBS뉴스 공식 SNS [SBS8News 트위터] [페이스북] [미투데이] [요즘]저작권자 SBS&SBS콘텐츠허브 무단복제-재배포 금지"
