,날짜,기사 제목,기사 링크,기사 출처,기사 내용
88,2013-11-19,<전기요금 왜 올렸나…전력다소비 구조 대수술 필요>(종합),https://news.naver.com/main/read.nhn?mode=LSD&mid=shm&sid1=101&oid=001&aid=0006605694,연합뉴스,"정부 전기요금 인상안 발표    (서울=연합뉴스) 백승렬 기자 = 한진현 산업부 2차관과 이석준 기획재정부 2차관이 19일 정부서울청사에서 전기요금 인상안에 대해 발표하고 있다.    2013.11.19    srbaek@yna.co.kr'수요예측 실패해놓고 국민에 부담 떠안기기' 비판도요금 지속인상 가능성…송전선로 등 사회적 비용도 반영(서울=연합뉴스) 옥철 기자 = 정부가 19일 발표한 전기요금 인상 및 에너지가격 체계 개편안은 매년 여름·겨울철에 되풀이되는 전력난을 근본적으로 해결하기 위해 메스를 들이댄 것으로 해석된다.우리나라의 전기 소비 수준이 주요 경쟁국보다 높을 뿐만 아니라 전력 소비 증가 속도가 예측치를 훨씬 초과해 급증하고 있기 때문이다.지난 2011년 9·15 대정전(순환정전)을 경험한 이후 전력당국이 매년 설비증설과 수요관리에 나서고 있지만, 올해도 지난 8월 12~14일 사상 최악의 전력대란이 우려되는 등 일촉즉발의 위기가 잇따랐다.그러나 전력당국은 거듭된 수요예측 실패와 원전 비리로 인한 설비 가동 중단사태로 전력난을 초래해 놓고도 결국 전력 소비자인 국민에게 부담을 떠안기는 방식으로 문제의 해법을 찾는다는 비판을 피하기 어렵게 됐다.여기다 용도별 요금 중 산업용을 6.4%로 가장 많이 올려 산업계에서는 경쟁력 저하와 경영난 가중 등 극도의 불만을 쏟아내고 있다. 산업계에서는 절전대책에 따른 여름철 조업 차질에다 요금 인상이 겹쳐 인내의 한계를 넘어섰다는 말도 나온다.그러나 한진현 산업통상자원부 2차관은 ""전경련에서 주장하듯이 산업용 전기요금 원가회수율이 100%를 이미 넘어갔다는 것은 사실이 아니다""면서 ""산업용 원가회수율은 90%대 중반이며, 인상을 통해 원가회수율이 높아지지만 사회적 비용을 고려하면 100%에는 미치지 못한다""고 반박했다.특히 정부는 앞으로도 지속적으로 에너지 상대가격 조정이 필요하다고 밝혀 전기요금은 향후 추가 인상될 가능성도 있다.전력당국 입장에서는 밀양 송전탑 사태 등에서 보듯이 원전이나 송전선로의 주민 수용성 확보가 점점 더 어려워진다는 점도 설비증설만으로 전력문제를 극복하기 어렵다는 판단에 도달하게 했다.또 연결재무제표 기준으로 100조원이 넘은 한국전력과 발전사의 천문학적인 부채를 해결하기 위해 전기요금 인상이 불가피했다는 측면도 있다.그러나 최근 3년간 무려 5차례나 전기요금을 조정한 데다 그중에서도 이번에 조정한 인상률이 가장 높아 올여름 기록적인 무더위 속에서 절전에 동참하느라 가뜩이나 지친 국민의 '전력 소비 피로감'을 가중시켰다는 지적도 나온다.◇ 전기 소비추세 뭐가 문제인가우리나라의 GDP 대비 전기 소비 수준은 1달러당 497Wh(2011년 기준)로 경제협력개발기구 평균(1달러당 267Wh)보다 70% 이상 높다.전기 소비 증가율은 2008년 4.5%, 2009년 2.4%, 2010년 10.1%, 2011년 4.8%, 2012년 2.5%에 달했다. 누적 증가율은 19.3%다.애초 2006년에 25년 후인 2030년 전체 에너지에서 전기의 비중을 21%로 예측했으나 2012년에 이미 19%에 도달했다. 20년 가까이 빠른 증가세다.<그래픽> OECD 주요국 전기요금    (서울=연합뉴스) 김토일 기자 = 산업통상자원부는 19일 한국전력공사가 제출한 전기공급약관변경안을 인가해 전기요금을 이같이 인상하는 것으로 조정했다고 발표했다.    산업용 전기요금은 6.4% 인상돼 용도별 요금 중 가장 많이 오른다.    kmtoil@yna.co.kr    @yonhap_graphics(트위터)반면 주요 선진국의 5년간 전기 소비 증가율은 일본 -4.6%, 미국 -1.9%, 독일 -2.7% 등으로 오히려 줄어드는 추세다.2000년대 후반부터 다른 에너지 가격에 비해 상대적으로 전기요금을 최소 수준 인상으로 유지하면서 유류·가스 소비가 전기로 옮겨가는 추세도 나타났다.2005~2012년 전기 가격 증가율은 33%인데 등유, 도시가스는 각각 60%, 75% 올랐다. 반면 같은 기간 소비 증가율은 전기가 40%인데 비해 등유는 오히려 44% 줄었고, 도시가스는 7% 증가에 그쳤다.중앙집중식으로 가스냉방을 하던 대형건물이 에어컨을 설치하고 전기냉방으로 바꾸고 면세유를 쓰던 비닐하우스 난방을 전기보일러로 교체하는 사례가 잇따랐다. 웬만한 규모로는 유류 자가발전시설보다는 전력회사에서 전기를 직접 공급받는 게 싸다는 중소기업들의 분석도 있다.◇ 요금인상·세율조정 만으론 한계…수요관리 시장 열려야전기와 다른 에너지(LNG·등유)와의 상대가격 차이를 좁히기 위해 발전용 유연탄에 ㎏당 21원(탄력세율 적용)의 세율을 적용하는 등 에너지 상대가격 체계를 개편했다.전기에만 과도하게 집중되는 소비 추이를 세금 해법을 통해 방향 전환하겠다는 시도다.대규모 사업장의 피크시간대 요금을 경부하시간대(야간시간대)의 5배로 높이는 등 선택형 요금제를 확대한 것도 같은 맥락이다.한 차관은 ""전기와 다른 에너지의 상대가격은 상당히 왜곡돼 있다. 향후 상대가격 조정은 지속적으로 필요하다""고 말했다.송전선로 건설이나 원전 안전성 강화, 온실가스 감축에 따른 사회적 비용도 합리적으로 반영해야 한다는 게 요금 인상의 배경이다.그러나 요금인상과 세율조정만으로는 전력다소비 문제를 근본적으로 해결하기에 한계가 있다는 지적이 나온다.전력업계와 학계에서는 ICT(정보통신기술)를 활용한 ESS(에너지저장장치)의 혁신 등으로 본격적인 전력수요관리 시장이 열려야 전력난 해소가 가능할 것으로 보고 있다.ESS와 스마트그리드(지능형전력망) 등 전력 관련 ICT 산업은 정부의 기대만큼 성장 속도가 빠르지 않다는 게 전력업계의 평가다.신재생에너지 등 다른 발전 공급원이 괄목할 만한 성장을 하지 못하는 현실에서 대기업들로부터 ESS나 EMS(에너지관리시스템) 등에 대한 대대적인 투자를 이끌어내려면 수요자원시장에서 투자를 회수할 수 있도록 획기적인 유인책이 필요하다는 말도 나온다.한 차관은 ""요금체계 개편에 따른 투자효과를 계량화할 수는 없지만 시장 메커니즘에 의해 (수요관리 시스템을) 돌릴 수 있는 체계를 만들었다""고 평가했다.oakchul@yna.co.kr▶연합뉴스앱▶인터랙티브뉴스▶화보<저작권자(c)연합뉴스 무단전재-재배포금지>"
89,2013-11-19,"대정부질문, '野의원·靑경호팀 충돌' 설전끝 파행",https://news.naver.com/main/read.nhn?mode=LSD&mid=shm&sid1=100&oid=001&aid=0006605711,연합뉴스,"민주당의 빈자리    (서울=연합뉴스) 배정현 기자 = 19일 국회 본회의 대정부질문에서 민주당 의원들이 새누리당 이우현 의원의 '강기정 의원 관련 의사진행 발언'에 반발해 전원 퇴장, 의석이 텅 비어있다. 2013.11.19    doobigi@yna.co.kr오전 지각 개의…오후 본회의 재개 1시간만에 중단방청온 키르기스 대통령…여야 공방, 정회 지켜봐(서울=연합뉴스) 이준서 임형섭 기자 = 국회의 19일 대정부질문에서는 박근혜 대통령의 전날 시정연설 직후 발생한 민주당 강기정 의원과 청와대 경호지원요원 간 충돌을 놓고 여야 의원들간 고성과 야유가 오가는 볼썽사나운 광경이 연출됐다.전날 청와대가 강 의원에 대한 법적조치를 거론하고 민주당이 청와대를 강력히 비판하면서 불거진 '감정싸움'이 국회 본회의장으로 번진 것이다.의사진행발언하는 최재성 의원    (서울=연합뉴스) 최재구 기자 = 최재성 민주당 의원이 19일 국회에서 열린 본회의에서 대정부질문에 앞서 의사진행발언을 하고 있다. 2013.11.19    jjaeck9@yna.co.kr이날 정치 분야 대정부질문은 오전 시작할 때부터 진통을 겪었다.민주당 의원들은 오전 의원총회에서 대책을 논의한 뒤 강창희 국회의장을 항의 방문했고, 이로 인해 대정부질문이 예정 시각을 1시간 이상 넘겨 시작됐다.강 의장은 오후 본회의를 재개하면서 ""국회의장으로서 깊은 유감의 뜻을 밝힌다""고 이번 사태에 대해 언급했다.강 의장은 청와대에 대해 ""사태의 경위를 정확히 파악해 적절한 조처를 해주기 바란다""고 요청했고, 여야 의원들에게도 ""다시는 이런 불미스러운 일들이 발생하지 않도록 주의를 촉구한다""고 당부했다.그러나 여야 의원들의 잇단 의사진행발언으로 본격적으로 '설전'이 시작되면서 오후 본회의는 개의 1시간만에 정회됐다.의사진행발언하는 이우현 의원    (서울=연합뉴스) 최재구 기자 = 이우현 새누리당 의원이 19일 국회에서 열린 본회의에서 대정부질문에 앞서 의사진행발언을 하고 있다. 2013.11.19    jjaeck9@yna.co.kr먼저 의사진행발언에 나선 민주당 최재성 의원은 ""경호팀 구성원이 차량에서 무조건 뛰어내려 강 의원의 앞목을 치고 뒷덜미를 잡고 끌었음에도 청와대 경호실은 강 의원에 대해 법적 책임을 묻겠다고 한다""면서 ""적반하장""이라고 비판했다.최 의원은 ""경호 관련자들을 반드시 해임해야 한다""면서 ""여야를 뛰어넘어 민의의 전당인 국회에서 청와대 경호실 직원이 가한 폭력에 대해 공동 대처하자""고 촉구했다.그러나 새누리당 이우현 의원은 ""강 의원은 2010년에도 국회의원을 폭행해 벌금을 받은 적 있다""며 ""강 의원이 순경의 멱살을 잡고 구타한 것 아니냐""고 반박했다.이 의원은 특히 ""경호실 운전담당 순경은 차를 미처 빼지 못한 상태에서 강 의원이 차량을 발로 2~3차례 차니까 항의한 것""이라고 말했다.의석에 있던 민주당 의원들은 이 의원의 이 같은 비판에 ""현장을 못봤으면 말을 하지 마"", ""그만 내려와!"" 라고 소리치며 들고 일어났다.국회의장과 양당 원내대표    (서울=연합뉴스) 최재구 기자 = 강창희 국회의장과 최경환 새누리당 원내대표, 전병헌 민주당 원내대표가 19일 국회에서 열린 본회의에서 민주당의 퇴장 후 의견을 조율하고 있다. 2013.11.19    jjaeck9@yna.co.kr최재성 정성호 서영교 의원 등 일부 민주당 의원은 본회의장 발언대 앞까지 나와 항의하는 등 격앙된 반응을 보였다.강 의장이 ""발언을 잠깐 중지해달라"", ""이제 빨리 들어가라""며 상황 수습에 나섰으나 이 의원은 발언을 멈추지 않았고, 민주당 의원들은 항의의 표시로 본회의장에서 단체 퇴장했다.방한 중 국회 본회의장을 찾은 알마즈벡 아탐바예프 키르기스공화국 대통령이 이 장면을 지켜봤다.  아탐바예프 대통령은 박근혜 대통령과의 정상회담에서 ""한국민을 모범 삼아 자유를 향해 걸어가고 있다. 민주주의가 중요하다""고 말했다.강 의장은 정회를 선포하고 여야 원내지도부간 조율을 주문했다.jun@yna.co.kr▶연합뉴스앱▶인터랙티브뉴스▶화보<저작권자(c)연합뉴스 무단전재-재배포금지>"
90,2013-11-19,행정고시도 '여풍'…여성 일반직 합격자 56%,https://news.naver.com/main/read.nhn?mode=LSD&mid=shm&sid1=102&oid=422&aid=0000036017,연합뉴스TV,"행정고시도 '여풍'…여성 일반직 합격자 56%올해 5급 국가공무원 공개경쟁채용시험 합격자 중 여성 비율이 일반행정직의 경우 56%로 절반을 넘어섰습니다.전체 합격자 중 여성비율도 46%로 지난해보다 늘었습니다.안전행정부가 올해 5급 국가공무원 공개경쟁채용시험 최종 합격자 272명의 명단을 발표한 결과  9천200여 명이 응시해 전국모집 245명, 지역모집 27명 등 모두 272명이 최종 합격했습니다.여성은 직렬별로는 국제통상 최종합격자의 73%, 일반행정의 56%를 각각 차지해 강세를 보였습니다.(끝)▶연합뉴스앱▶인터랙티브뉴스▶화보<저작권자(c)연합뉴스 무단전재-재배포금지>"
91,2013-11-19,“50시간 걸어야 1시간 힘든 운동한 효과”<호주 연구팀>,https://news.naver.com/main/read.nhn?mode=LSD&mid=shm&sid1=103&oid=081&aid=0002377029,서울신문,"[서울신문 나우뉴스]“50시간 걷겠습니까? 아니면 1시간 ‘힘들게’ 운동하겠습니까?”무려 50시간을 걸어야 1시간 힘들게 운동한 효과를 볼 수 있다는 연구 결과가 나왔다.18일(현지시간) 영국 일간 데일리메일에 따르면 호주 플린더즈대학과 사우스오스트레일리아대학 공동 연구팀이 격렬한 고강도 운동과 일반적인 중강도 운동의 효과가 어떻게 차이 나는지 비교하는 연구를 수행했다.연구팀은 유산소 운동능력이 체지방과 체중, 콜레스테롤, 엉덩이 및 허리둘레와 같은 4가지 질병 위험인자에 어떤 영향을 미치는지 조사했다.이들은 성인 620명을 대상으로 6주간 다양한 운동 프로그램을 비교하는 실험을 시행했다.두 그룹으로 나뉜 실험 참가자들은 각각 서킷트레이닝(여러 운동을 쉬지 않고 하는 순환 운동)이나 스텝 에어로빅을 하는 스텝반 등과 같은 고강도 운동을 주 3회 1시간씩 수행하거나, 걷는 운동을 매일 30분씩 수행했다.그 결과 걷기와 같은 보통 운동을 한 그룹은 건강에 약간 도움이 되는 경험을 했지만 격렬한 고강도 운동을 한 그룹은 훨씬 더 건강에 도움이 되는 결과를 얻었다.연구를 이끈 플린더즈대학의 린더 노턴 박사는 “대부분 신체 활동에 관한 지침은 매일 30분씩 걷는 것을 추천하고 있지만, 이를 50시간 동안 해야만 겨우 1시간 동안 에어로빅 등의 격렬한 운동을 한 효과와 비슷한 것으로 나타났다”고 말했다.이와 함께 노턴 박사는 “콜레스테롤 면에서도 걷기를 5시간 해야 고강도 운동을 1시간 한 효과와 같았으며 체질량지수(BMI) 면에서는 무려 8시간을 걸어야 같은 효과를 볼 수 있었다”고 덧붙였다.하지만 연구팀은 이 같은 고강도 운동이 걷기 운동보다 얼마나 더 좋은지 아직 자세히 알지 못한다고 말한다.노턴 박사는 “우린 이제 당신이 해병대 캠프나 스피닝 운동(실제 자전거 운동)과 같은 격렬한 운동이 가만히 있는 것보다 얼마나 신진대사나 운동능력 측면에 영향을 미치는지 알아볼 것”이라고 말했다.끝으로 그 박사는 “신체 활동은 어떤 형태로든 아무것도 하지 않는 것보다 더 좋지만 당신이 강도를 높이면 당신이 들인 노력보다 큰 효과를 얻게 될 것”이라면서 “이는 오늘날 생활방식에서 사람들이 운동할 시간이 없다고 말하는 일반적인 이유와도 관련된다”고 말했다.윤태희 기자 th20022@seoul.co.kr별난 세상 별난 뉴스(nownews.seoul.co.kr)- Copyrights ⓒ서울신문사. 무단 전재 및 재배포 금지 -"
92,2013-11-19,독립운동·강제동원 규명 및 피해자 지원에 '햇살',https://news.naver.com/main/read.nhn?mode=LSD&mid=shm&sid1=102&oid=001&aid=0006605478,연합뉴스,"일정(日政)시피징용(징병)자 명부    (서울=연합뉴스) 한국 정부가 1953년 전국적으로 조사한 3·1운동과 일본 관동(關東·간토)대지진 피살자 명부가 사상 처음으로 발견, 공개됐다.    국가기록원은 19일 정부서울청사에서 브리핑을 열고, 1953년 이승만 정부가 작성한 '3·1운동시 피살자 명부(1권·630명)', '일본 진재(震災)시 피살자 명부(1권·290명)', '일정(日政)시 피징용(징병)자 명부(65권·22만9천781명)' 등 67권에 대한 분석결과를 공개했다. 사진은 일정(日政)시 피징용(징병)자 명부. 2013.11.19 << 국가기록원 제공 >>    photo@yna.co.kr과거 기록물 관리에 '구멍' 노출…시스템 정비 시급(도쿄=연합뉴스) 조준형 특파원 = 안전행정부 산하 국가기록원이 주일대사관에서 이관받아 19일 공개한 일제강점기 피해 관련 문서는 우리 민족의 저항과 박해의 역사를 규명하고 피해자를 지원하는데 큰 도움이 되는 자료인 것으로 밝혀졌다.다만 이처럼 중요한 자료를 주일대사관과 정부 당국이 오랜기간 방치한 것으로 드러났다는 점에서 정부의 기록물 관리 시스템을 정비해야 한다는 목소리가 커지게 됐다.◇어떤 자료 나왔나공개된 자료는 1953년 이승만 정부가 작성한 '3·1 운동시 피살자 명부(217쪽 짜리 1권·630명)'와  '일본 진재(震災·간토대지진을 지칭)시 피살자 명부(109쪽짜리 1권·290명)', '일정(日政)시 피징용(징병)자 명부(65권·22만9천781명)' 등 총 67권이다. 한국전쟁 와중인 1952년 12월15일 국무회의에서 이승만 당시 대통령의 지시로 내무부에서 전국적인 조사를 통해 작성한 명부다.이들 자료는 일본과의 식민지 배상 협상때 사용키 위해 작성, 주일대사관으로 이관한 것으로 보인다.  시기적으로 1952년 2월 제1차 한일회담 결렬 후 1953년 4월의 제2차 한일회담을 준비하는 과정에서 작성된 것으로 추정된다고 국가기록원은 밝혔다.◇최초의 3·1운동 순국자 명단…유공자 입증에 기여할듯3·1운동 피살자 명부는 총 630명의 명단을 담고 있어 박은식의 '독립운동지혈사'에 적시된 피살자 수(7천509명)의 10분의 1에도 못미치는 숫자지만 국내외 통틀어 최초 발견된 피살자 명부라는 점에서 의미가 크다고 국가기록원은 전했다.특히 일부지역의 경우 이름, 나이, 주소, 순국일시, 순국장소, 순국상황 등이 자세히 기록되어 있어 사료적 가치가 클 뿐만 아니라, 향후 독립유공자 선정에도 도움이 될 전망이다. 현재까지 3·1운동 순국자 중에서 독립운동 유공자로 인정된 숫자는 총 391명에 불과했기에 추가로 유공자로 인정받는 이들이 잇따를 전망이다.3·1운동피살자 명부    (서울=연합뉴스) 한국 정부가 1953년 전국적으로 조사한 3·1운동과 일본 관동(關東·간토)대지진 피살자 명부가 사상 처음으로 발견, 공개됐다.    국가기록원은 19일 정부서울청사에서 브리핑을 열고, 1953년 이승만 정부가 작성한 '3·1운동시 피살자 명부(1권·630명)', '일본 진재(震災)시 피살자 명부(1권·290명)', '일정(日政)시 피징용(징병)자 명부(65권·22만9천781명)' 등 67권에 대한 분석결과를 공개했다. 사진은 3·1운동 피살자 명부. 2013.11.19 << 국가기록원 제공 >>    photo@yna.co.kr예를 들어 이번 명부에 포함된 3·1운동 피살자 중 경기도 거주자가 169명인데 이들 중 이제까지 독립유공자 인정을 받은 사람은 53명에 불과했고, 포상이 보류된 경우가 8명이었다. 결국 이번 자료를 통해 100여명의 피살자들이 새 증빙자료를 확보하게 됐다.◇간토대지진 피살자 일부 신원 최초 공개아울러 간토(關東)대지진 피살자 명부는 최초로 확인된  관련 문서라는 점에 더해 자료의 상세함 때문에 사료적 가치가 크다고 국가기록원은 평가했다.1923년 9월1일 발발한 간토 대지진(규모 7.9)을 계기로 일본 군대와 경찰, 자경단이 '조선인이 우물에 독을 풀었다'는 등 유언비어를 유포하며 재일 조선인을 학살한 이 사건과 관련, 당시 우리 임시정부는 사망자 수를 6천명 정도로 추정한 점에 비춰 이번에 발견된 290명은 숫자면에서 미미하다. 일본에서 벌어진 사건을 한국에서 조사한데 따른 한계가 있었던 것으로 추정된다.하지만 사망자의 신상명세 외에 피살 일시, 장소, 상황 등에다 학살방식까지 자세히 기록돼 있다는 점에서 향후 관련 연구에 중요한 단초를 제공할 것으로 기대된다. 살해된 형태의 경우 '피살', '타살', '총살', '경찰서 유치장에서 순국' 등과 같은 다양한 표현으로 기재됐다. 피살이 아닌 '지진으로 사망'한 사례도 일부 포함됐다.피해 사례 중 경남 합천군 이씨 집안 일가족 4명 학살 사례는 당시의 잔학상을 잘 보여주는 것으로 평가되며, '일본 헌병에 의한 총살' 사례는 일본 공권력이 학살에 개입했음을 명백히 보여주는 자료로 해석된다.◇국내에서 작성된 最古 강제동원 명부 발견…새로운 이름 '수두룩'가장 분량이 많은 일정시 피징용(징병 포함)자 명부는 한국 정부가 1953년에 작성한 것으로, 피징용자 명부 중 가장 오래된 원본 기록으로 추정된다. 당시 복사기술 등이 여의치 않은 상황에서 대일 협상을 위해 원본 통째로 주일대사관에 옮긴 셈이다.이 자료는 그간 입증되지 않는다는 이유로 정부 지원을 받지 못한 강제동원 피해자들에게 결정적인 도움이 될 전망이다.정부가 1957년 만든 '왜정시피징용자명부'가 있고 여기에 이번에 발견된 숫자보다 많은 28만5천771명이 등재돼 있지만 명부에 생년월일, 주소 등이 기재돼 있지 않은 탓에 정부가 현재까지 공식적으로 피징용·징병자로 인정한 숫자는 약 16만명에 그쳤다.3·1운동·日관동대지진피살자 명부 최초 발견·공개    (서울=연합뉴스) 백승렬 기자 = 박경국 국가기록원장과 직원들이 19일 정부서울청사에서 한국 정부가 1953년에 전국적으로 조사한 3·1운동과 일본 관동(關東·간토)대지진 피살자 명부를 공개하고 있다.  2013.11.19    srbaek@yna.co.kr그런 만큼 종전 명부에서 확인할 수 없었던 생년월일, 주소 등이 포함돼 있는 이번 자료는 피해자 보상심의를 위한 사실관계 확인에 큰 도움이 될 것으로 보인다.또 이번에 발견된 명부 중 경북 경산 지역의 피징용·징병자 명단에는 기존 명부에 없는 새로운 이름 1천여명이 나왔다. 세부 분석을 거치면 상당수 징용 피해자가 추가로 확인될 전망이다.◇한계와 향후 과제국가기록원은 관련 자료를 국가보훈처 등에 제공, 독립유공자 선정과 과거사 증빙자료로 적극 활용할 방침이다.그러나 이번 자료는 한국 정부가 전쟁 와중에 주민들의 자진신고나 진술을 토대로 작성한 것이라는 점에서 사실확인 및 검증이 필요해 보인다.또 새로운 강제동원 및 독립운동 관련 증빙 자료가 발견된 만큼 기존에 입증을 못해 정부 지원을 못받은 피해자 및 유족들이 지원받을 수 있도록 하기 위해 법률정비를 서둘러야할 것으로 보인다.노무현 정부 시절 제정된 '대일항쟁기 강제동원 피해조사 및 국외강제동원 희생자 등 지원에 관한 특별법(이하 특별법)'에 따라 총리실 산하에 설치된 조사 및 지원 위원회는 올해말이면 활동시한이 만료된다. 결국 시급히 여야 합의로 법을 개정, 활동시한을 늘리거나 새로운 지원 법률을 만들어야 할 상황이다.더불어 전쟁통에 조사 및 문서이관이 이뤄졌다는 점을 참작하더라도 수십년 간 한국 정부와 주일대사관이 자료의 존재를 잊고 있었던 것으로 파악된 만큼 과거 문서에 대한 대대적인 점검과 정부의 문서관리 체제 정비도 과제로 떠올랐다.jhcho@yna.co.kr▶연합뉴스앱▶인터랙티브뉴스▶화보<저작권자(c)연합뉴스 무단전재-재배포금지>"
