,날짜,기사 제목,기사 링크,기사 출처,기사 내용
94,2013-11-10,"금융당국, 국민銀 거액 비자금 조성 정황 포착(종합)",https://news.naver.com/main/read.nhn?mode=LSD&mid=shm&sid1=101&oid=001&aid=0006587643,연합뉴스,"사진은KB금융지주 사옥 로비.<<연합뉴스 DB>>도쿄지점 검사서 국내 유입 뭉칫돈 발견…은행 해외점포 감시 강화(서울=연합뉴스) 심재훈 고유선 기자 = 국민은행 도쿄지점에서 거액의 비자금을 조성한 정황이 금융당국에 포착됐다.일본에서 국내로 밀반입된 자금만 20억원 이상 규모다.금융당국은 일본 금융청과의 협력 및 계좌 추적 강화로 비자금 행방을 철저히 규명할 방침이다.시중은행도 이와 유사한 형태로 뭉칫돈을 조성했을 가능성이 있어 당국은 해외점포에 대한 고강도 감시에 나선다.10일 금융권에 따르면 금감원은 최근 국민은행 도쿄지점을 검사하는 과정에서 도쿄지점 직원들이 부당대출을 해주며 거액의 수수료를 챙긴 것을 확인한 것으로 알려졌다.이 수수료 중 20억원 이상이 국내로 반입됐다.이에 따라 금감원은 이 돈이 당시 경영진과 관련 있는지를 포함해 계좌 추적 등 조사 중이다.이런 사실은 문제의 도쿄지점장이 승진을 위한 공적 조서를 작성한 서류에서 적발됐다.KB금융 경영진은 수차례 도쿄를 방문한 뒤 해당 지점장의 승진을 지시한 것으로 알려졌다. 시중은행에서 해외 지점장이 승진하는 사례는 극히 드물다.앞서 일본 금융청은 최근 금감원을 방문해 국민은행 도쿄지점의 자금세탁 조사 경과를 설명하면서 심각성을 경고했다. 금융청 당국자가 금감원까지 직접 찾아온 것은 이번이 처음이다.국민은행 도쿄지점은 한도를 초과해 대출해주기 위해 다른 사람 명의를 내세우는 방식으로 수천억원대의 부당 대출을 한 혐의로 금융청의 조사를 받았다. 국민은행은 도쿄지점에 대해 두 차례나 내부 감사를 했는데도 문제를 적발하지 못해 내부 통제에 심각한 문제점도 드러냈다.금감원은 이번 사건의 조속한 해결을 위해 일본 금융청과 협력, 수사에 속도를 낼 계획이다.금융권 고위 관계자는 ""금감원이 최근 국민은행 도쿄지점 검사 과정에서 수상한 뭉칫돈이 국내로 흘러든 것을 발견했다""면서 ""금액만 20억원 이상의 거액으로 비자금 조성 성격이 강한 것으로 알고 있다""고 밝혔다.그는 ""KB 경영진이 도쿄지점장을 승진 대상자에 넣었고 공적 조서를 작성하는 과정에서 비자금 조성 사실이 들통났다""면서 ""경영진의 내부통제 미흡, 내부 감사 실패가 얽힌 사건""이라고 말했다.이에 대해 금감원 고위 관계자는 ""현재 검사가 진행 중인 사안이라 일절 확인해줄 수 없다""고 말했다.그러나 금감원은 부당 대출을 통한 의혹이 다른 시중은행 해외 점포에도 있을 것으로 보고 해외 점포에 대한 감시를 강화할 방침이다.해외지점의 이상 징후를 조기에 포착할 수 있도록 모니터링 지표와 여신 규모 등 상시감시 지표도 강화할 계획이다.국민은행, 산업은행 등 11개 은행이 해외에서 운영 중인 현지법인과 지점은 145개다.금융권 고위 관계자는 ""국민은행 도쿄지점 사건을 계기로 금감원이 시중은행 해외 점포에 대한 감시를 강화하는 것으로 알고 있다""고 전했다.외환은행 도쿄 및 오사카지점은 지난 2006년 자금세탁 혐의로 3개월만 영업 정지를 당했고 금감원은 이를 문제 삼아 2010년 외환은행에 기관경고 징계를 내린 바 있다.president21@yna.co.kr cindy@yna.co.kr▶연합뉴스앱▶인터랙티브뉴스▶화보<저작권자(c)연합뉴스 무단전재-재배포금지>"
95,2013-11-10,돼지한마리에 500만원이면 매월 4% 수익이?,https://news.naver.com/main/read.nhn?mode=LSD&mid=shm&sid1=102&oid=008&aid=0003147625,머니투데이,"[머니투데이 김훈남 기자][서민생활침해사범 합동수사부, 2400억대 유사수신 양돈업체 등 351명 적발]""모돈(어미돼지) 한 마리에 500만원 투자하면 매월 4%수익에 14개월 후 원금을 보장합니다.""국내 3위의 양돈업체 A사가 내걸은 '달콤한' 제안이다. A사는 이 같은 방법으로 농민들로부터 2400억원을 모았다. 그러나 실상은 모든 투자자들에게 분양할 만큼 돼지를 보유하지 않았고 일부 돼지도 대출담보로 제공한 상태다. 결국 나중에 들어온 투자금으로 앞선 투자자들의 수익금을 지급하는 일명 '폰지사기'를 하다 검찰에 적발됐다.은행이자보다 높은 고수익을 보장한다, 대출 이자를 낮춰주겠다는 등 거짓말로 서민을 울린 서민침해사범 300여명이 검찰에 적발됐다.서울중앙지검 서민침해사범 합동수사부(부장 윤갑근 차장검사)는 지난 3월 출범한 이래 8개월여 동안 활동한 결과 총 126건을 수사해 45명을 구속기소하고 306명을 불구속기소했다고 10일 밝혔다.서울중앙지검에 설치된 합수부는 불법 사금융 및 유사수신행위, 다단계판매, 보이스 피싱 등 서민을 대상으로 한 범죄를 중점적으로 수사하며 형사3·4부(불법사행행위, 불법금융), 강력부(서민갈취범죄), 첨단범죄수사2부(인터넷·보이스피싱) 등이 참여했다.합수부가 적발한 서민침해사건 126건 중 48건이 불법사행행위로 집계됐다. 보이스피싱(45건)과 불법사금융·채권추심행위(23건)가 그 뒤를 이었다.구체적인 침해사범으로는 △양돈위탁사업을 가장해 2400억원대 투자금을 받은 유사수신행위 △말레이시아 기업을 내세워 SNS(소셜네트워크서비스) 광고투자비 70억원 모집 △제1금융권 대출 전환대가로 고액의 수수료 갈취 △명의도용 대출 △502억원대 불법 경마도박장 운영 등이 포함됐다.검찰은 집중단속 결과 이들 서민침해사범을 적발하고 관련자를 사법처리했다. 또 무등록 대부업체가 포함된 68건을 관할 세무서에 통보, 은닉한 소득에 대해 세금을 부과토록 했다.[오늘의 HOT포토][스페셜 포토][손안의 경제뉴스 머니투데이 모바일웹]김훈남기자 hoo13@<저작권자 ⓒ '돈이 보이는 리얼타임 뉴스' 머니투데이, 무단전재 및 재배포 금지>"
96,2013-11-10,채팅앱 이용해 청소년 알몸사진 수집한 몰지각한 어른들,https://news.naver.com/main/read.nhn?mode=LSD&mid=shm&sid1=102&oid=003&aid=0005490010,뉴시스,"【서울=뉴시스】안호균 기자 = 서울경찰청 사이버범죄수사대는 스마트폰 채팅 앱으로 청소년들에게 접근, 신체 일부분을 촬영한 사진을 전송하게 한 이모(45·자영업)씨 등 24명을 아동청소년의 성보호에 관한 법률 위반 혐의로 붙잡아 조사 중이다.이씨 등은 지난 4월 27일부터 5월 6일까지 스마트폰 랜덤 채팅 앱으로 초·중·고등학교 여학생들에게 대화를 신청한 뒤 특정 신체부위를 촬영한 사진을 보내도록 유도해 전송받는 수법으로 청소년 음란물을 소지한 혐의를 받고 있다.경찰 조사결과 이들은 자신의 성기 사진 등을 보내주면서 청소년들의 호기심을 자극한 뒤 사진 전송을 요구한 것으로 드러났다.음란물을 소지한 이들 중에는 공무원 신분인 특별사법경찰관 1명도 있었다. 다른 피의자들의 직업은 자영업자 3명, 회사원 8명, 대학생 4명, 현역 군인 1명 등으로 다양했다. 특히 이들 중 7명은 자녀를 두고 있는 평범한 가정의 40~50대 가장인 것으로 확인됐다.경찰 관계자는 ""청소년의 알몸 사진을 찍어 보내도록 유도하는 행위는 청소년에 대한 '사이버 성학대'""라며 ""더 큰 성범죄나 2차 범죄로 발전할 위험성도 있다""고 말했다.ahk@newsis.com★ 뉴시스 뉴스, 이젠 네이버 뉴스 스탠드에서도 만나세요★ 손 안에서 보는 세상, 모바일 뉴시스<저작권자ⓒ 공감언론 뉴시스통신사. 무단전재-재배포 금지.>"
97,2013-11-10,"""올해 알뜰폰 가입자 250만·시장규모 3천억 달성""",https://news.naver.com/main/read.nhn?mode=LSD&mid=shm&sid1=105&oid=001&aid=0006587490,연합뉴스,"서울광화문우체국 알뜰폰 판매 전용 창구에서 직원들이 다양한 알뜰폰을 소개하고 있다. <<연합뉴스 DB>>KT경제경영연구소 전망…""대기업 계열 사업자가 시장 확대 이끌어""(서울=연합뉴스) 김병규 기자 = 올해 알뜰폰(MVNO) 가입자가 연말까지 250만명까지 늘어날 것이라는 전망이 나왔다.KT경제경영연구소는 10일 '2013년 알뜰폰 시장 이슈 및 전망' 보고서를 통해 이 같이 전망했다.알뜰폰 가입자는 지난 2011년 58만명이었지만 작년 연말 127만6천명으로 2배 이상 늘었고 올해 다시한번 2배 가까이 증가할 것으로 예상된다.전체 이동통신 가입자 중 알뜰폰이 차지하는 비중은 2011년 1.1%에서 작년 2.3%로 늘었고 올해 다시 갑절인 4.6%로 뛸 것으로 예측된다. 알뜰폰 시장의 규모는 가입자 증가세보다 더 빠르게 확대되는 추세를 보였다.KT경영경제연구소는 올해 알뜰폰 시장 규모가 3천억원으로 작년 추정치인 1천267억원보다 2.4배 가량 늘어날 것으로 예상했다.    알뜰폰 시장의 규모는 2011년에는 333억원었는데 불과 2년사이 9배가량 커진 것이다.알뜰폰은 기존 이동통신사의 통신망을 빌려 30~40% 저렴한 요금에 제공하는 이동통신 서비스로, 지난 2011년 7월 처음 도입됐다.보고서는 최근의 알뜰폰 시장 확대는 CJ헬로비전, SK텔링크 등 대기업 계열 회사들의 선전이 견인했다고 분석했다.CJ헬로비전의 알뜰폰 가입자는 작년 1분기 3만명에서 지난 2분기 41만명으로 늘었다. 작년 2분기 4천명의 가입자로 시작한 SK텔링크의 지난 2분기 가입자는 22만7천명이나 된다.보고서는 ""CJ헬로비전과 SK텔링크는 기존 알뜰폰 사업자보다 기업 인지도가 크다는 장점이 있다""며 ""CJ헬로비전의 경우 방송, 영화, 푸드 등 CJ그룹의 자산을 활용한 가입자 확보가 효과를 보고 있다""고 분석했다.홈플러스, 이마트 등 할인마트나 우체국이 오프라인에서 알뜰폰 판매를 시작한 것도 알뜰폰 시장 활성화에 긍정적인 요인이 됐다.보고서는 ""우체국과 할인마트의 알뜰폰 판매는 주로 온라인이었던 알뜰폰의 유통 채널을 오프라인으로 넓혔다는 점에서 의미가 있다""며 ""특히 우체국 판매는 알뜰폰의 홍보와 신뢰도 상승에 큰 도움이 되고 있다""고 설명했다.bkkim@yna.co.kr▶연합뉴스앱▶인터랙티브뉴스▶화보<저작권자(c)연합뉴스 무단전재-재배포금지>"
98,2013-11-10,"""맞벌이·외벌이부부 어린이집 보육료 차등지원 필요""",https://news.naver.com/main/read.nhn?mode=LSD&mid=shm&sid1=100&oid=001&aid=0006587497,연합뉴스,"어린이집원생들이 수업을 받고 있는 모습. <<연합뉴스 DB>>국회 예산정책처 ""맞벌이 가정이 1시간30분 더 이용…영아는 아동수당 지원해야""(서울=연합뉴스) 김경윤 기자 = 부모가 맞벌이인지 여부와 어린이집·유치원 이용시간에 따라 영유아의 보육료·유아학비를 다르게 지급해야 한다는 지적이 나왔다.10일 국회 예산정책처는 '2014년도 정부 성과계획 평가' 보고서를 통해 어머니의 취업 여부와 어린이집·유치원 이용시간, 소득수준 등 다양한 보육 수요를 고려해 보육료와 유아학비를 차등적으로 지원할 필요가 있다고 제안했다.만 0~1세 영아를 둔 부모에게는 보육시설 이용에 따라 보육료나 양육수당을 주는 대신 기본적으로 '아동수당'을 지원하고, 시설보육이 필요한 경우에만 보육비의 일부를 차등지급하는 방안을 제시했다.현재 보건복지부와 교육부는 만 0~5세 영유아를 둔 모든 가정에 부모의 소득수준에 상관없이 어린이집 보육료, 유치원 유아학비, 가정양육수당을 지급하고 있다.어린이집은 12시간, 유아학비는 5시간 이용을 기준으로 일괄적인 비용을 지원하고 있지만 지원 시간과 실제 이용시간 사이에는 괴리가 있는 것으로 나타났다.우선 어린이집 평균 이용시간은 7시간34분으로 보육료 지원 기준시간인 12시간에 한참 못 미쳤고, 유치원 이용시간은 7시간12분으로 지원시간인 5시간을 초과했다.어린이집의 이용시간에 영향을 미치는 주요 요인은 부모의 취업 여부였다. 취업모의 자녀는 하루 평균 8시간23분 어린이집을 이용하지만 미취업모의 자녀는 평균 6시간51분 아이를 맡겨, 일하는 어머니를 둔 아이가 어린이집을 약 1시간33분 더 이용했다.특히 만 0세 영아의 경우 취업모는 하루 평균 9시간9분, 미취업모는 5시간51분간 어린이집에 아이를 맡겨 가장 큰 차이를 보였다.이처럼 맞벌이 여부에 따라 자녀의 어린이집 이용시간이 다른 만큼 보육료 지원 규모도 수요에 맞춰 달리 지급해야 한다고 예산정책처는 조언했다.영아의 경우에도 일괄적으로 아동수당을 주고 맞벌이, 이용시간 등을 고려해 보육료를 다르게 지급해야 한다고 주장했다.지난해 모든 소득계층의 만0~2세 영아를 대상으로 보육료를 지원하면서 만 0세의 경우 17만5천352명, 만 1세는 32만3명이 어린이집을 다녔지만, 올해부터 영아에게 양육수당을 지급하면서 어린이집을 이용하는 만 0세는 12만286명(지방교육재정교부금 확정교부 기준), 만1세는 31만474명으로 각각 31.4%, 3% 감소했다.영아를 둔 가정에서는 어린이집 보육보다는 가정양육을 원하는 수요가 많은 것이다.국회 예산정책처는 ""영아의 경우 양육수당 선호 경향을 고려해 정액의 아동수당을 지원하고 시설보육이 필요한 경우 부모의 맞벌이 여부, 이용시간, 소득에 따라 비용 일부를 차등 지급하는 방안을 검토할 필요가 있다""고 지적했다.한편, 무상보육의 재원 가운데 하나인 지방교육재정교부금이 감소할 가능성이 있어 보육료·유아학비 지원에 차질을 빚을 수도 있다는 지적도 제기됐다.보육료와 유아학비, 양육수당은 보건복지부의 일반회계 재원과 지자체의 지방비, 교육부에서 관할하는 지방교육재정교부금으로 지원한다.지난해에는 만 3~5세 유아학비와 만 5세 보육료만 지방교육재정교부금에서 지출됐지만, 올해는 여기에 소득 상위 30% 가구의 만 3~4세 보육료가 추가됐으며 내년에는 만 4세 보육료도 교육재정교부금에서 지출된다.이처럼 교육재정교부금의 지출규모는 매년 커져 내년에는 3조3천762억9천100만원이 투입될 예정이지만, 세수결손이나 지방세제 개편에 따라 지방교육재정교부금의 전체 규모는 감소할 것으로 보인다.국회 예산정책처는 ""지방교육재정교부금이 감소하고 제대로 충당되지 않으면 보육료·유아학비는 물론 초·중·고교에 대한 지원도 차질을 빚는다""며 ""매년 국고보조금, 지방비, 지방교육재정교부금의 결산내역과 재원조달계획을 국회에 제출해야 한다""고 주장했다.heeva@yna.co.kr▶연합뉴스앱▶인터랙티브뉴스▶화보<저작권자(c)연합뉴스 무단전재-재배포금지>"
99,2013-11-10,수렵철 전국서 잇단 총기사고…지역 주민 불안,https://news.naver.com/main/read.nhn?mode=LSD&mid=shm&sid1=102&oid=001&aid=0006587568,연합뉴스,"순환수렵장 개장 일주일 만에 4명 다치거나 숨져'실기 평가' 없는 수렵면허시험이 문제…까다롭게 바꿔야(전국종합=연합뉴스) 이달 1일부터 전국 22개 시·군 순환수렵장이 개장한 가운데 총기 사고가 잇따라 주민들이 불안을 호소하고 있다.밀렵으로 말미암은 피해를 막고 멧돼지 등 농작물에 피해를 주는 유해 야생동물의 개체 수를 줄이고자 마련한 순환수렵장 제도이지만, 해마다 반복되는 안전사고에 대한 대책이 시급하다는 지적이다.◇ 일주일 만에 4명 사상…수렵장 총기사고 '반복'지난 5일 경북 청송군 부남면 감연리 야산에서 더덕을 캐던 주민 이모(46)씨가 수렵꾼이 쏜 것으로 추정되는 총탄에 맞아 임시매장 상태로 숨진 채 발견됐다.발견 당시 이씨의 시신은 누군가가 연장을 사용해 판 것으로 보이는 깊이 약 50㎝가량의 구덩이에 비스듬히 놓여 있었고 흙과 낙엽 등으로 덮인 상태였다.경찰은 이씨의 시신 오른쪽 옆구리 부분에서 산탄 자국이 발견된 점 등으로 미뤄 수렵꾼이 오인사격을 한 뒤 시신을 임시로 매장하고 달아난 것으로 추정하고 있다.이에 앞서 수렵장 개장 첫날인 지난 1일에도 경북 성주군 금수면 후평리 야산에서 멧돼지를 사냥 중이던 김모(59)씨의 엽총에서 발사된 탄환에 동료 엽사 이모(51)씨가 맞아 숨지는 사고가 발생했다.수렵을 위해 이날 이곳에 온 김씨와 이씨는 멧돼지를 발견하고 함께 뒤쫓던 중 김씨가 비탈에서 미끄러지면서 탄환이 발사돼 변이 일어난 것으로 전해졌다.같은 날 강원 양구군 남면 황강리에서도 송모(63)씨가 쏜 엽총 산탄에 100여ｍ 떨어진 하천 둑에서 민들레 씨앗을 채집하던 박모(58·여)씨가 맞아 어깨와 손가락 등을 다쳤고, 이튿날인 2일에는 강원 횡성군 횡성읍에서 밭일하던 김모(79)씨가 50여ｍ 떨어진 순환수렵장에서 날아온 엽총 산탄에 맞아 크게 다치는 사고가 발생했다.이러한 총기 사고는 매년 겨울 수렵철마다 반복되고 있다.경찰청에 따르면 최근 5년간 11건의 수렵장 총기 오발사고가 발생해 3명이 사망하고, 8명이 부상했다. 올해도 개장 일주일 만에 벌써 4명의 사상자가 발생했다.이병호 경북지방경찰청 생활질서계장은 ""수렵기간 총기사고는 대부분 수렵장 개장 초기에 발생하며 사람을 야생동물로 오인해 엽총을 발사하거나 총기 부주의로 말미암은 과실이 대부분""이라고 설명했다.◇ ""공포의 총소리…불안해서 못 나가""안전사고가 잇따르자 불안한 건 수렵장 인근 주민들이다.시도 때도 없이 들리는 총성에 하루에도 몇 번씩 놀란 가슴을 쓸어내린다.자신이 거주하는 마을이나 직장 주변에 순환 수렵장이 있는지조차 모르는 경우가 많다.특히 농민들은 아직 과수원이나 밭에서 감 따기, 고구마 캐기 등 수확이 끝나지 않았는데도 수렵이 시작됐다며 불안감을 호소한다.경남 진주시 반성면에서 농사를 짓는 박모(62)씨는 ""한창 가을걷이를 하는데 인근 야산에서 총성이 들리면 총탄이 어디서 날아올지 불안하다""고 말했다.야생동물로 말미암은 농작물 피해를 줄이고자 시행하는 수렵장 제도가 오히려 주민들에게 공포의 대상이 됐다고 설명한다.강원 횡성군 청일면에서 한우 50마리를 사육하는 이모(53)씨는 ""저 멀리 산에서 '뻥뻥' 소리가 울리면 가만있던 소들이 놀라서 자빠진다""면서 ""수렵장 주변 마을 사람들은 낮이고 밤이고 무서워서 나가지도 못한다""고 불만을 토로했다.사고가 잇따르자 해당 지역 지자체와 경찰은 엽사와 주민들을 상대로 총기 사고 예방 교육을 강화하고 있지만, 이번 수렵기간 동안 전국 경찰서에서 풀려나간 엽총은 이미 1만정이 넘는 상태다.◇ 면허 취득·갱신 과정 '사격 실기' 포함해야전문가들은 수렵면허 시험과 면허증 갱신 체계를 개선하지 않는 상태에서는 사고 예방 교육도 소용없다고 지적한다.현재 수렵면허 시험은 수렵에 관한 법령과 수렵의 절차, 야생동물의 보호·관리에 관한 사항 등 총 4과목 40문항으로 이뤄져 있으며, 합격기준은 매 과목 40점 이상, 전 과목 평균 60점 이상이다.이후 4시간의 소양 교육을 받으면 사격술 실기시험이 없이 면허증을 받고 수렵활동을 할 수 있다.5년마다 면허 갱신을 하게 돼 있지만, 재교육이나 실기 점검은 안 받아도 된다.김철훈 야생생물관리협회 부회장은 ""현행 수렵면허 시험제도는 '도로 주행 과정 없는 운전면허 시험'과 같다""면서 ""사격술의 기본도 제대로 익히지 않은 엽사들이 수렵활동을 하다 보니 사고가 날 수밖에 없다""고 지적했다.그는 이어 ""일본에서 수렵면허를 유지하려면 평생 3년마다 교육을 받아야 하고, 미국도 5년마다 2박3일 출·퇴근하며 받는 교육을 3차례 이수해야 한다""면서 ""사고를 막으려면 교육을 강화하고 면허 취득·갱신 과정에 실기평가를 반드시 넣어야 더 까다롭게 만들어야 한다""고 강조했다.한편, 지난 1일부터 문을 연 올해 순환수렵장은 내년 2월 28일까지 4개월간 전국 6개도 22개 시·군에서 운영된다. 지정된 수렵장에 한해서 일출부터 일몰 전까지 멧돼지, 고라니, 꿩, 까치, 까마귀 등 야생동물 16종을 포획할 수 있다.(최해민·손현규·허광무·김준호·이덕기·황봉규·강은나래)rae@yna.co.kr▶연합뉴스앱▶인터랙티브뉴스▶화보<저작권자(c)연합뉴스 무단전재-재배포금지>"
