,날짜,기사 제목,기사 링크,기사 출처,기사 내용
22,2013-11-10,쌓인 낙엽에 도로 경계선 그린 게으른(?) 미 공무원들,https://news.naver.com/main/read.nhn?mode=LSD&mid=shm&sid1=104&oid=003&aid=0005489882,뉴시스,"【서울=뉴시스】미국 테네시주(州) 멤피스 밸리오크 드라이브 인근 크럼플러 도로에서 실시된 경계선 긋기 재작업 모습. 이 지역 시정부 공무원들이 도로에 경계선을 그리기 전 낙엽과 나뭇가지를 치우지도 않을 정도로 너무 게으르게 일한 사진들이 공개되어 논란이 되고 있다고 현지 TV 방송사 액션 뉴스 5가 7일(현지시간) 보도했다.  (사진 출처: 액션 뉴스 5 인터넷판) 2013.11.10【서울=뉴시스】이수지 기자 = 미국 시정부 공무원들이 도로에 경계선을 그리기 전 낙엽과 나뭇가지를 치우지도  않을 정도로 너무 게으르게 일한 사진들이 공개되어 논란이 되고 있다고 현지 TV 방송사 액션 뉴스 5가 7일(현지시간) 보도했다.미국 테네시주(州) 멤피스 밸리오크 드라이브 인근 크럼플러 도로의 경계선 긋기 재작업이 실시됐다. 대부분 경계선 긋기 작업이 아스팔트에 제대로 이뤄졌지만, 일부 낙엽과 나뭇가지들이 쌓인 곳에도 선이 그어졌다.일부 주민들은 이 곳을 청소하고 경계선을 또 그어야 하기 때문에 세금 낭비라고 비난하자 시당국은 웃을 수 밖에 없는 실수로 보이는 이 일이 나름 이유가 있다고 설명했다고 현지 언론이 보도했다.현지 주민인 프레이 로이는 액션 뉴스 5에 공무원들이 작업할 때 누군가 낙엽을 치우게 해야 한다며 시정부에 선을 다시 그으라고 요구했다.출퇴근하는 사람들과 인근 주민이 이 현장을 사진으로 찍어 액션 뉴스 5 뉴스룸에 사진과 함께 이메일로 제보했다.페이스북에 이날 이 작업에 대해 ‘내가 낸 세금이 정말 잘못 쓰이고 있다’, ‘일부 일 잘하는 공무원들이 있는 것으로 알고 있지만, 멤피스 시정부 내 공무원들이 전반적으로 무성의하고 나태한 태도는 한심하다'는 의견이 올라왔다.액션 뉴스 5는 이날 추가 작업이 이뤄졌다고 전했다.시정부 관계자는 이날 액션 뉴스 5에 “약 1210㎞ 거리의 도로에 선 긋기 작업을 3년을 주기로 하고 있다”며 “약 300m 거리에 달하는 차량 3대로 구성된 행렬이 도로를 따라 선 긋기 작업을 한다”고 설명했다.그는 “대규모 행렬이 롤링작업을 할 때 계속 롤링작업을 하는 것이 가장 안전하고 효율적”이라며 “혼잡한 도로에서 행렬을 멈출 수 없다”고 말했다.대신 낙엽이 쌓인 상황을 처리하는 특별지침이 있다.그는 “감독관이 이를 지적하면 공무원들이 소규모 작업반을 데리고 현장에 다시 가서 선을 긋는다”고 밝혔다.즉 게으른 작업으로 보인 이 상황은 결국 안전을 위한 것이라는 게 시정부의 설명이다.시정부 관계자는 “공무원들도 경계선 긋기 작업 기간에 열심히 일하고 있으며 안전하게 작업하기 위해 노력하고 있다”고 밝혔다.그리고 그는 1가지 작은 실수가 있었다는 점은 인정했다. 페인트가 나오는 것을 잠시 중단했다가 낙엽을 지나가면 다시 페인트가 나오게 하는 것이다. 이는 차량행렬을 멈추는 것과는 상관없다.그는 작업하는 공무원들에게 이 점에 주의를 주고 있다고 말했다.suejeeq@newsis.com★ 뉴시스 뉴스, 이젠 네이버 뉴스 스탠드에서도 만나세요★ 손 안에서 보는 세상, 모바일 뉴시스<저작권자ⓒ 공감언론 뉴시스통신사. 무단전재-재배포 금지.>"
23,2013-11-10,새 국립발레단장에 발레리나 강수진 유력,https://news.naver.com/main/read.nhn?mode=LSD&mid=shm&sid1=103&oid=001&aid=0006587537,연합뉴스,"""검증 절차 진행 중""(서울=연합뉴스) 임수정 기자 = 새 국립발레단장에 발레리나 강수진(46) 씨가 유력한 것으로 10일 전해졌다.정부 고위 관계자는 ""국립발레단 새 수장으로 강씨를 유력하게 검토 중""이라며 ""통상적인 검증 절차 정도만 남아있다""고 말했다.문화체육관광부 관계자는 ""아직 확정된 것은 없다""면서도 ""강씨가 검토 중인 복수의 후보자 중 한 사람인 것은 맞다""고 전했다.문체부가 올해 임기가 끝나는 최태지 현 국립발레단장의 후임을 물색하는 과정 중 공연예술계에서 강씨에 대한 추천이 많았던 것으로 알려졌다.강씨는 지난달 연합뉴스와의 전화 인터뷰에서 ""안무 쪽에는 재능이 없고 예술감독 등을 맡을 순 있다""며 ""시기를 특정할 순 없지만 한국 발레를 위해 헌신하고자 하는 마음은 항상 갖고 있다""고 밝힌 바 있다.국립발레단장은 검증 과정을 거쳐 문체부 장관이 임명하게 된다.한국을 대표하는 세계적인 발레리나 강씨는 1986년 독일 슈투트가르트발레단에 만 18세의 나이로 최연소 입단한 이후 지금까지도 현역으로 왕성한 활동을 펼치고 있다.그는 1999년 '무용계의 아카데미상'으로 불리는 '브누아 드 라 당스' 최고 여성무용수에 선정됐고 2007년 최고 장인 예술가에게 수여되는 독일 '캄머탠저린(궁정무용가)' 칭호를 받았다.무용계에서는 이런 강씨가 국립발레단의 새 수장이 될 경우 그가 세계무대에서 쌓은 지식과 경험, 인적 네트워크 등을 한국 발레계가 흡수할 좋은 기회가 될 것으로 기대하고 있다.강씨는 여전히 슈투트가르트의 수석 무용수로서 활동 중이다. 내년과 내후년 내한 공연 일정이 잡혀 있는 상황이지만, 스케줄 조정과 계약 조건 수정 등을 통해 단장직을 맡는 데에는 문제가 없는 것으로 알려졌다.sj9974@yna.co.kr▶연합뉴스앱▶인터랙티브뉴스▶화보<저작권자(c)연합뉴스 무단전재-재배포금지>"
24,2013-11-10,"황금빛 가을, 사진 잘 나오는 여행지",https://news.naver.com/main/read.nhn?mode=LSD&mid=shm&sid1=103&oid=001&aid=0006587507,연합뉴스,"황금빛 가을, 출사 여행지 - 우포늪    (서울=연합뉴스) 태고의 신비를 간직하고 있는 경남 창녕군 우포늪 특히 물빛이 황금빛으로 물드는 장면이 압권이다.2013. 11.10 << 한국관광공사 신현철 >>    polpori@yna.co.kr(서울=연합뉴스) 성연재 기자 = 황금빛 찬란한 계절 가을, 아름다운 장면을 한장의 사진으로 영원히 간직하고 싶은 것은 남녀노소 누구나 같은 마음이다. 사진을 촬영을 목표로 한 여행을 출사 여행이라고 한다.황금빛 가을, 출사 여행지 - 순천만    (서울=연합뉴스) 한껏 여문 누런 들판과 황금빛 바다. 이 모든 것을 잡을 수 있는 곳이 바로 전남 순천만이다.2013. 11.10 << 한국관광공사 김교남 >>    polpori@yna.co.kr여행 고수들만 아는, 사진기를 갖다 대기만 해도 작품이 되는 여행지를 소개한다.황금빛 가을, 출사 여행지 - 산굼부리    (서울=연합뉴스)  제주도 산굼부리 억새는  오름 전체가 억새로 덮인 장관을 이루는 장면을 볼 수 있다. .2013. 11.10 << 한국관광공사 이범수 >>    polpori@yna.co.kr◇ 수도권 = 의외의 가을 출사지는 바로 용인 민속촌이다. 가족들과 외국인 관광객들이 주로 찾는 단골 장소지만 가을만 되면 황금빛 물결 일렁이는 출사지로 변모한다. 특히 은행잎은 초가 위로, 또 담벼락 위로 끊임없이 쏟아져 쌓인다.황금빛 가을, 출사 여행지 - 산굼부리    (서울=연합뉴스)  제주도 산굼부리 억새는  오름 전체가 억새로 덮인 장관을 이루는 장면을 볼 수 있다. .2013. 11.10 << 한국관광공사 이범수 >>    polpori@yna.co.kr◇ 충청권 = 충북 괴산의 문광저수지는 아직 많이 알려지지 않은 숨겨진 보물 같은 곳이다. 저수지 한쪽에 은행나무 가로수가 줄지어 노란 색으로 물들어 있다. 때가 맞으면 물에 반영된 아름다운 은행나무들의 모습을 촬영할 수 있다.용인 한국민속촌 용마름과 이엉엮기 (신영근 기자)◇ 영남권 = 태고의 신비를 간직하고 있는 경남 창녕군 우포늪은 물안개 피는 늪의 모습을 촬영할 수 있다. 특히 일출 시 물빛이 황금빛으로 물드는 장면이 압권이다.은행나무숲, 사진은 홍천임 <자료>◇ 호남권 = 한껏 여문 누런 들판과 황금빛 바다. 이 모든 것을 잡을 수 있는 곳이 바로 전남 순천만이다. 특히 늦가을 투명하고 맑은 공기 덕분에 석양이 깔끔하게 찍힌다. 용산전망대에서는 거창한 카메라가 아닌, 휴대전화 카메라로도 훌륭한 사진을 찍을 수 있다.◇ 제주권 = 제주도 산굼부리 억새는 규모면에서 남다르다. 오름 전체가 억새로 덮인 장관을 이루는 장면을 볼 수 있다. 군데군데 샛길도 나 있어 마치 억새 미로 속을 달리는 기분이 든다.polpori@yna.co.kr▶연합뉴스앱▶인터랙티브뉴스▶화보<저작권자(c)연합뉴스 무단전재-재배포금지>"
25,2013-11-10,"이마트, 유통업계 최초 자체개발 피처폰 출시",https://news.naver.com/main/read.nhn?mode=LSD&mid=shm&sid1=105&oid=001&aid=0006587478,연합뉴스,"(서울=연합뉴스) 설승은 기자 = 지난달 알뜰폰 사업에 뛰어든 이마트가 이번엔 자체 개발한 피처폰을 내놨다.이마트는 업계 최초로 자체 개발한 피처폰 '지오리드(GEOLID SK76G1)'를 11일부터 전국 이마트 알뜰폰 매장과 온라인(mobile.emart.com)에서 판매한다고 10일 밝혔다.판매가격은 7만9천원(부가가치세 포함·유심 별도)이다. 이마트 알뜰폰 표준 요금제(월 기본료 9천원) 24개월 약정하면 무료다.이마트가 기획하고 SK의 중국 자회사 에스케이엠텍(SKMtek)이 생산했다. 단말기 사후 서비스(AS)는 TG삼보가 담당한다.WCDMA(3G)와 GMS(2G)의 두 가지 심(SIM)을 지원해 해외에서는 현지 심 카드를 장착하면 국내번호와 함께 동시 사용할 수 있다.이마트는 이 제품이 중장년층용 '효도폰', 청소년 '안심폰', 업무용 '세컨드폰' 수요를 맞출 수 있을 것으로 기대했다.한편 이마트는 갤럭시노트3와 베가시크릿노트 등 LTE폰 5종과 3G 스마트폰 1종, 3G 피처폰 3종을 판매하고 있다. 이달 중 갤럭시 그랜드와 옵티머스 G프로도 들여오는 등 최신 단말기도 확대한다.한우석 이마트 브랜드전략팀장은 ""가계 통신비를 줄이기 위해 지난달 선보인 알뜰폰이 최근 시장 1·2위를 다투고 있다""며 ""단말기 부담도 낮추고자 자체 개발한 피처폰도 선보이게 됐다""고 말했다.ses@yna.co.kr▶연합뉴스앱▶인터랙티브뉴스▶화보<저작권자(c)연합뉴스 무단전재-재배포금지>"
26,2013-11-10,"슈퍼 태풍 하이옌 필리핀 강타...'1,200명 사망'",https://news.naver.com/main/read.nhn?mode=LSD&mid=shm&sid1=104&oid=052&aid=0000485291,YTN,"[앵커]초대형 태풍 하이옌이 강타한 필리핀에서는 피해가 속출했습니다.마을 수십 곳이 물에 잠겨 폐허가 됐고, 숨진 사람이 천 명이 넘는 것으로 추정됩니다.홍선기 기자가 보도합니다.[기자]강풍에 건물 지붕이 속절없이 뜯겨져 나갑니다.지붕에 매달린 사람들은 언제 날아갈지 몰라 위태롭기만 합니다.태풍이 휩쓸고 간 마을은 쑥대밭이 됐습니다.[인터뷰:태풍 피해 지역 주민]""바람이 정말 끔찍했어요. 저희 집은 완전히 새로 지어야 해요. 이건 정말 비극입니다.""인명피해도 속출했습니다.필리핀 적십자사는 태풍 하이옌으로 인한 사망자가 천 명이 넘는다고 밝혔습니다.[인터뷰:제사 발렌시아, 태풍 피해 주민]""할머니와 부모님 그리고 아이를 찾고 있어요. 태풍이 몰아칠 때 잃어버렸어요.""저지대 마을 수십 곳은 물에 잠겼고, 도로도 침수돼 차량 통행이 중단됐습니다.현지 언론들은 침수 지역에서는 물 위로 시신이 떠다니는 모습이 쉽게 눈에 띈다고 전했습니다.침수 지역에 물이 빠지고 복구 작업이 시작되면 사망자 수는 더 늘어날 것으로 보입니다.YTN 홍선기입니다.[저작권자(c) YTN & Digital YTN. 무단 전재-재배포 금지]"
27,2013-11-10,"시설, 그 자체가 인권침해다",https://news.naver.com/main/read.nhn?mode=LSD&mid=shm&sid1=102&oid=028&aid=0002209051,한겨레,"형제복지원은 군대식 조직이었다. 수용자들은 소대에서 집단생활을 했고 소대마다 소대장이 있었다. 소대 안에는 양쪽으로 2층 침대가 있었고 사람이 많을 때는 바닥에서 자기도 했다. 엄격한 위계질서 속에서 폭력은 일상화됐다. 사진은 1987년 초 형제복지원의 내부 모습이다. 김용원 변호사 제공[한겨레][토요판]커버스토리인권운동가의 시선2011년 공지영의 소설 <도가니>가 영화로 제작되어 공개되었을 때 여론이 들끓었다. 청각장애인 시설에서 실제로 있었던 일을 다루었던 소설과 영화는 충격적으로 장애인 사회복지시설의 문제를 드러냈다. 그 덕분에 사회복지사업법의 일부를 개정할 수 있었다. 그해 개정된 사회복지사업법에 따르면, 법인 이사회의 3분의 1을 사회복지위원회, 지역사회복지협의체의 추천을 받아 구성하고, 친인척 등 특수 관계에 있는 사람들이 이사 현원의 5분의 1을 초과할 수 없도록 제한하는 내용이었다. 족벌체제로 운영되던 사회복지법인을 투명하게 운영할 수 있는 계기를 마련했다는 점에서 진일보한 법 개정이 아닐 수 없다. 사회복지시설을 설립하고 운영하는 주체들이 시설들을 돈벌이 수단으로 여기고 사유화하는 데서 발생했던 수많은 인권유린 문제들을 해결할 수 있는 단초가 마련되었기 때문이다.우리 사회에선 <도가니>에 나오는 사회복지시설의 충격적인 사건들이 매년 몇 건씩은 언론을 통해 알려지고는 한다. 대체로 사회복지시설에서 일어나는 인권침해 사건들은 강제 노동, 폭행과 체벌, 장애수당의 갈취, 종교 강요, 성폭력 등이다. 이곳에 주거하는 생활인들을 폭력으로 규제한다는 의미다. 이런 폭력에 저항하는 이들에게는 신경안정제와 같은 약물을 과다로 강제 투여하는 일도 있고, 폭행으로 사망시키는 일들도 있었다. 심지어는 사망한 이들을 암매장하기도 했다. 그리고 사회복지시설에서는 자기결정권은 보장될 수 없다. 시설에서는 집단생활을 해야 하기 때문이다. 정치적 권리도 종종 무시된다.의사표현을 잘할 수 없고 저항할 힘도 없으며 사회적으로 고립되어 있는 약자들을 수용하여 정부지원금과 각종 후원금을 착복하고, 장애인 수당까지 갈취하는 자들이 있다. 그 비리의 복마전 결과가 인권유린으로 이어지게 된다. 우리 사회의 사회복지시설은 대개 민간에서 설립하였기 때문에 ‘내 시설’이라는 인식이 강하다. 정부가 해야 할 일을 대신한다는 명분 또한 그렇다. 자기 재산을 출연하여 사회복지시설을 만들었지만, 시설은 공공재의 성격을 갖는다. 그러나 시설을 이용해서 돈벌이를 하려고 족벌체제를 형성하고, 유령 직원, 유령 원생들을 만들어서 지원금을 더 타내는 방식이 비일비재했다. 또한 시설의 증개축을 명분으로 지원금을 더 확보하는 게 유능한 시설장으로 인식되어 왔다. 이러한 그간의 사정이 사회복지시설의 인권문제 근절을 막아왔다. 관리감독기관의 공무원들은 시설과 유착되어 관리감독 의무를 방기해왔다. 이는 인권유린을 저지른 시설장들에 대한 솜방망이 처벌로 이어졌다. 형제복지원 등 문제의 시설 운영자들은 광범위하게 돈 봉투를 뿌려서 공무원들과 공범 관계를 형성해온 것이다. 언론조차 여기서 자유롭지 않다.‘도가니’ 같은 충격적 사건이매년 몇 건씩 세상에 알려진다관리감독 부실·솜방망이 처벌은반복되는 강제노동, 폭행 등시설 내 인권침해를 낳았다꼭 그들을 가둬야만 하는가박래군/‘형제복지원 사건 진상규명을 위한 대책위원회’ 공동대표·인권중심 사람 소장중증장애인이라 하여 시설에서‘사육’되도록 둘 게 아니라지역사람들과 다양한 관계 아래자기결정권 실현하도록 도와야어떻게 사회복지시설에서 이런 일들이 일어날 수 있을까. 먼저 사람들의 의식 때문이다. 대개 사회복지시설에 장애인들이나 사회적 약자들이 수용되어 생활하는 것을 당연히 여긴다. 가족 중에 장애인이 있고, 가족들이 돌볼 여력이 없는 경우에는 당연히 시설을 생각하고 그곳으로 보내는 것을 이상하게 여기지 않는다. 그래서 시설에 대한 요구는 줄지 않는다. 바로 그런 요구를 이용해서 돈벌이를 하려는 이들이 사회복지라는 그럴듯한 명분을 걸고 사회복지사업에 뛰어들게 된다.물론 열악한 조건에서도 진정으로 사회복지의 목적에 맞게 운영되는 시설들도 많을 것이다. 지금까지 조사된 바에 따르면 집단적인 생활시설들은 그 자체로 문제가 있다. 그러기 때문에 서구에서는 진즉부터 주거시설들을 해체하고, 지역사회에서 생활할 수 있도록 정책 전환을 해왔다. 우리나라에서도 시설의 인권유린 문제를 넘어서 탈시설의 방향을 설정하고 지역사회에서 통합적으로 사회복지서비스를 받는 방향으로 정책이 전화되고 있다. 특히 서울시가 올해 세운 인권기본계획에 따른 ‘탈시설 로드맵’은 중요한 시사점이다. 탈시설하는 장애인들의 임시 주거를 마련하는 등 지역사회 정착을 위한 정책을 마련중이기 때문이다.사회와 격리된 채 평생을 수동적으로 보호를 받는 입장에 있다고 한다면 그건 사람의 인생이라고 할 수 없다. 아무리 좋은 질의 사회복지 서비스를 제공한다고 해도 시설 내에서 한정된 서비스는 인간의 사고와 행동을 제한하게 된다. 집단적인 생활을 위해서는 어떻든 집단적인 규율을 강요할 수밖에 없다. 수동화된 인격은 보호에 사람을 길들여지게 만들고, 그에 따라서 자아를 상실하게 만든다. 장애인 운동을 하는 이들은 “시설에서 사육된다”는 표현을 종종 쓴다. 중증장애인이라고 해서 시설에서 ‘사육’되도록 둘 게 아니라 지역사회에서 다양한 사람들과 관계를 맺으면서 자기결정권을 실현할 수 있도록 도와야 한다. 그곳에 존중받아야 할 사람들이 살고 있다는 관점으로 이동해야 사회복지시설의 문제가 제대로 보일 수 있다.합법적인 법인 시설에서 생활하는 장애인만 약 3만명이다. 그밖에 다른 시설, 미신고 시설까지 합치면 대략 20만명 정도의 사람들이 아직도 시설에 갇혀 있다. 이것 자체가 인권침해라는 인식으로 전환되는 것이 필요하다. 대형 시설부터 해체해 가야 한다. 지나친 민영기관과 시장 의존을 벗어나서 공공의 책임을 강화하고, 분명한 탈시설의 방향으로 정책 전환를 해가야 한다. 주거시설에서 생활하는 이들이나 지역사회로 돌아온 이들이 마을의 주민으로 살아가도록 그에 맞는 프로그램을 개발해야 한다.갇힌 사람들은 감옥에만 있는 게 아니다. 형기 없는 감옥에 갇혀 있는 장애인을 비롯한 사회적 약자들을 비정상적인 감옥에서 꺼내줘야 한다. 중증 장애인이라도 우리와 함께 우리 지역에서 같이 살아야 하는 소중한 사람이라는 인식이 상식으로 자리잡혀갈 때 사회복지시설의 문제들은 서서히 해소될 것이다.박래군/‘형제복지원 사건 진상규명을 위한 대책위원회’ 공동대표·인권중심 사람 소장공식 SNS[통하니][트위터][미투데이]| 구독신청[한겨레신문][한겨레21]Copyrights ⓒ 한겨레신문사, 무단전재 및 재배포 금지<한겨레는 한국온라인신문협회(www.kona.or.kr)의 디지털뉴스이용규칙에 따른 저작권을 행사합니다.>"
28,2013-11-10,촛불든 김한길 대표,https://news.naver.com/main/read.nhn?mode=LSD&mid=shm&sid1=100&oid=421&aid=0000545683,뉴스1,"(서울=뉴스1) 손형주 기자 = 9일 오후 서울시청광장에서 민주당 주최로 열린 국가기관 총체적 대선개입 규탄 및 국정원 개혁 9차 국민결의대회에서 김한길 민주당 대표를 비롯한 참석자들이 촛불을 들고 구호를 외치고 있다. 2013.11.9/뉴스1(서울=뉴스1) 손형주 기자저작권자 ⓒ 뉴스1코리아, 무단전재 및 재배포 금지"
29,2013-11-10,도서관에 현금인출기까지…공중전화 부스의 재탄생,https://news.naver.com/main/read.nhn?mode=LSD&mid=shm&sid1=101&oid=437&aid=0000013654,JTBC,"[앵커]휴대전화가 널리 보급되면서 공중전화 부스엔 발걸음이 끊긴 지 오래인데요. 조금이라도 쓰임새를 찾으려고 공중전화 부스가 변신을 거듭하고 있습니다.위문희 기자입니다.[기자]도서관 열람실 문 앞에 공중전화 부스가 놓여 있습니다.공부하다 전화통화를 하려는 열람생을 위해 방음 공간으로 꾸며 제공한 것입니다.[손수빈/경기도 과천시 부림동 : 이게 있으니깐 바로 앞에서 통화하고 (공부하러) 들어갈 수 있어서 좋더라고요.][남유리/경기도립과천도서관 직원 : 공부하시는데 시간도 단축되고 주위에 시끄럽다는 민원도 들어오지 않고요.]전국 7만 4000여 대 공중전화 중 한 달에 한 번도 이용자가 없는 것만 200여 대.필요 없는 것은 없애고 있지만 저소득층을 위한 보편적 서비스 차원에서 유지할 필요도 있어 다양한 쓰임새를 찾는 노력이 계속 이어지고 있습니다.아파트 단지 안 공중전화 부스, 주민 편의를 위해 현금자동인출기를 함께 놓아 뒀습니다.버스정류장 뒷편에 설치된 공중전화 부스 안엔 책이 가득합니다.버스를 기다리는 동안에 지루함을 달랠 수 있도록 공중전화 부스가 작은 도서관으로 재탄생했습니다.[강숙선/서울 잠실동 : 책장에서 책을 꺼내면서 공중전화 부스에서 통화하는 느낌을 받아요.]정부는 20%인 공중전화 부스 재활용률을 끌어올리는 방안을 마련할 계획입니다.위문희Copyright by JTBC & Jcube Interactive. All Rights Reserved."
30,2013-11-10,"""아빠는 다 잃었다"" 생이별 4년, 기러기 아빠의 죽음",https://news.naver.com/main/read.nhn?mode=LSD&mid=shm&sid1=102&oid=437&aid=0000013653,JTBC,"[앵커]자식을 외국에 유학 보내고 가족과 떨어져 혼자 살던 50대 남성이 스스로 목숨을 끊었습니다.이유가 뭔지, 최종혁 기자가 취재했습니다.[기자]인천시 계양구의 한 빌라, 어젯밤 9시 40분쯤 이곳에서 53살 이 모 씨가 스스로 목숨을 끊은 채 발견됐습니다.이 씨는 2009년 아내와 아들 둘을 미국으로 유학을 보내고 혼자 살아온 '기러기 아빠'였습니다.[이웃 주민 : 아저씨가 워낙 조용하셔서 시끄럽거나 그런 분이 아니시라… 원래 말을 잘 안 해요. 편의점에 혼자 앉아서 술 드실 때도 있고….]전기 기사로 일해온 이 씨는 최근 일감이 없어 형편이 넉넉하지 못했습니다.비싼 비행기값을 아끼려 지난 4년 동안 단 한 번도 미국으로 가지 못했고, 아들 유학비용도 대부분 아내가 부담해온 것으로 전해졌습니다.[유가족 : 굉장히 외롭다고 했어요. 괴롭다 외롭다. 애들 보고싶다. 한번 갔다 오면 돈이 삼사백(만원)이 들어간다고….]이 씨는 휴대전화가 꺼져있는 걸 이상하게 여긴 친구가 경찰에 신고해 발견됐습니다.이 씨 집에서는 연탄불을 피운 흔적과 유서가 발견됐습니다.유서에는 ""아빠는 몸 건강, 정신 건강 모두 잃었다. 가족과 모든 분들께 죄송하다""는 내용이 담겨 있었습니다.경찰은 이 씨가 처지를 비관해 스스로 목숨을 끊은 것으로 보고 정확한 사인을 조사하고 있습니다.최종혁Copyright by JTBC & Jcube Interactive. All Rights Reserved."
