,날짜,기사 제목,기사 링크,기사 출처,기사 내용
65,2009-12-24,30대 대기업 60% 새해도 `비상경영 모드',https://news.naver.com/main/read.nhn?mode=LSD&mid=shm&sid1=101&oid=001&aid=0003040806,연합뉴스,"<그래픽> 국내 기업 '새해 경기.사업 전망'    (서울=연합뉴스) 김토일 기자 = 30대 그룹 10곳 중 6곳은 내년에도 올해 수준 또는 그 이상의 비상경영 체제를 유지할 계획인 것으로 나타났다.    이는 연합뉴스가 최근 삼성, 현대기아차, SK, LG 등 30대 기업(공정위 자산기준)을 대상으로 새해  경기 및 사업 전망을 주제로 벌인 설문조사에서 확인됐다.연합뉴스 설문조사..60% ""출구전략 시행은 내년 하반기 이후""세종시 관련 63% ""상황 지켜보고 결정""(서울=연합뉴스) 이동경 홍지인 기자 = 30대 그룹 10곳 중 6곳은 내년에도 올해 수준 또는 그 이상의 비상경영 체제를 유지할 계획인 것으로 나타났다.이는 연합뉴스가 최근 삼성, 현대기아차, SK, LG 등 30대 기업(공정위 자산기준)을 대상으로 새해  경기 및 사업 전망을 주제로 벌인 설문조사에서 확인됐다.24일 조사결과에 따르면 올해의 비상경영 체제를 내년에도 이어갈지를 묻는 말에 56.7%(17곳)가 `올해와 비슷한 기조를 유지하겠다'고 답했고, 특히 1곳은 비상경영 체제를 더 강화하겠다고 밝혔다.이에 비해 `유동적'이라는 답변은 23.3%(7곳)였고, `확장.공격 경영을 하겠다'는 응답은 16.7%(5곳)로 조사됐다.대다수 기업이 미국발 금융위기의 후유증을 겪은 올해처럼 새해에도 비상경영을 유지하려는 것은 환율 등 잠재적인 불안요소를 염두에 두기 때문으로 분석된다.실제로 내년에 우리 경제를 위협할 가장 큰 변수로 43.3%(13곳)와 30.0%(9곳)가 각각 `환율불안'과 `국제경기 침체'를 꼽았고, 13.3%(4곳)는 국제유가를 지적했다.이밖에 남북 관계를 비롯해 가계부채 증가, 지방선거 이후의 국정 혼란, 고용불안, 내수 경기 침체를 위협요인으로 든 소수의견이 있었다.내년도 투자 계획으로는 `확대'와 `현상 유지' 의견이 백중세를 보였다.내년 투자를 `올해 수준으로 유지한다'는 응답이 43.3%(13곳)인 반면, `10% 이상 확대'는 16.7%(5곳), `5∼10% 미만'은 23.3%(7곳)로 나타났다.투자를 축소할 것이라는 기업은 없었으나 13.3%(4곳)는 `불확실한 여건으로 미정'이라는 대답을 내놓았다.채용 계획과 관련해서는 56.7%(17곳)가 올해 수준을 유지하겠다고 했고 23.3%(7곳)는 `5∼10% 미만으로 확대하겠다'고 밝혔다.이에 비해 16.7%(5곳)는 `여건이 불확실해 미정'이라고 답했다.바람직한 출구 전략 시행 시기로는 60.0%(18곳)가 `내년 하반기'를 지목했고, `내후년(2011년) 이후'라는 응답도 33.3%(10곳)나 돼 대부분 기업은 정부의 경기부양 정책이 최소한 내년 상반기까지는 이어져야 한다는 쪽에 무게를 두고 있는 것으로 분석됐다.내년도 우리 경제의 성장률에 대해서는 60.0%(18곳)가 `4∼5% 미만'을 예상했고, 36.7%(11곳)는 `2∼4% 미만'을 점쳤다. `5% 이상' 성장할 것이라는 답변은 없었다.원.달러 환율은 43.3%(13곳)가 `1,100∼1,150원선'을 예상했고, 40.0%(12곳)는 `1,050∼1,100선'을 전망했다.이는 대다수 기업이 내년 환율이 `1,050~1,150원' 구간에서 움직일 것으로 보고 사업계획을 짰음을 시사한다.내년도 국제유가에 대해서는 76.7%(23곳)가 `76∼85달러'를 전망한 가운데 13.3%(4곳)는 `66∼75달러', 10.0%(3곳)는 `86∼95달러'를 예상했다.세종시에 대한 입장으로 63.3%(20곳)가 `앞으로 상황을 지켜보고 결정할 계획'이라며 신중한 반응을 나타냈다. 33.3%(10곳)는 `메리트가 없어 이전 계획이 없다'고 했으며, `본사나 계열사 이전을 고려한다'는 응답은 아예 없었다.hopema@yna.co.krljungberg@yna.co.kr[관련기사]▶ <대기업 내년 경영기조 모험보다 안정에 무게>▶ <표> 30대 그룹 설문조사 결과<뉴스의 새 시대, 연합뉴스 Live><연합뉴스폰><포토 매거진><저작권자(c)연합뉴스. 무단전재-재배포금지.>"
66,2009-12-24,불안한 그들만의 거래,https://news.naver.com/main/read.nhn?mode=LSD&mid=shm&sid1=101&oid=081&aid=0002053608,서울신문,"온라인 소액대출 연결 사이트 잇따라 등장[서울신문]미소금융 출범 등 저신용자에 대한 금융지원의 필요성이 사회적으로 부각되고 있는 가운데 인터넷을 통해 개인간 대출을 연결해주는 온라인 대출직거래 사이트들이 활기를 띠고 있다. 은행 문턱이 높은 저신용자들을 위한 대안금융의 하나로 주목받고 있는 실정이다. 하지만 개인투자자 보호가 되지 않고 악용 가능성도 크다는 지적도 잇따른다. 금융감독의 필요성도 제기되고 있다.23일 대부업체인 머니옥션은 기존의 온라인 대출직거래 서비스를 강화한 ‘미소펀드’ 서비스를 시작한다고 밝혔다. 온라인 대출 직거래란 돈이 필요한 사람과 돈을 빌려줄 사람을 만나게 해주는 인터넷 사이트를 말한다. 저신용자가 이용하는 대부시장에 ‘역경매 방식’을 도입한 형식인데, 빌려주겠다는 사람이 늘어나면 금리가 낮아진다는 논리다.머니옥션 관계자는 “저신용자가 대부업체를 찾으면 무조건 연 49%의 이자로 돈을 빌리지만 대출직거래 사이트 등을 통하면 20~30%대의 대출도 가능하다.”고 말했다. 돈이 필요한 사람이 온라인에 돈이 필요한 이유와 액수, 희망이자율, 상환 계획 등을 올리면 이를 확인한 개인들이 돈을 빌려준다. 대출참여자에 대한 제한이 없어 일반인은 물론 대부업자도 회원으로 활동하면서 돈을 빌려주는 게 특징이다.대출서비스업체인 팝펀딩은 이번 주 들어 자투리 포인트를 모아서 저신용자 대출에 투자할 수 있는 서비스를 시작했다. 개인이 알게 모르게 적립한 카드 포인트 등을 현금화해 이를 금융소외계층이나 저신용자를 위한 대출에 쓰겠다는 취지다. 역시 온라인 상에서 회원들이 돈을 빌리는 사람의 사연과 상환계획, 이자율 등을 심사하고 투자를 결정한다. 최소 1000원부터 투자가 가능하다. 시스템상 일반 대부업자는 투자자에서 배제된다.팝펀딩 측은 “자고 있는 포인트로 투자를 할 수 있는 것이 특이한 점”이라면서 “연체 등을 고려해도 개인들에게 연 14% 수익이 돌아갈 수 있다.”고 설명했다.하지만 이같은 온라인 대출직거래 사이트들은 ‘제대로 운용하면 사회의 약이지만 악용되면 독이 될 수 있다.’는 지적이 있다. 제도권이 외면하는 저신용자들을 돕는 ‘현대판 품앗이’라는 호평을 받기도 하지만 투자자에 대한 보호장치가 부족하다는 것이다.대출직거래 업체의 한 관계자는 “스스로 판단하는 일종의 투자인 탓에 원금은 전혀 보장할 수 없는 구조”라고 말한다.또한 대출직거래 사이트들은 다수 투자자의 돈이 대출자로 바로 흘러들어가는 자금흐름을 지니고 있다. 때문에 대출과정에서 문제가 생기면 회사가 아닌 다수 일반인들이 피해자가 될 수 있다.여기에다 영업형태가 모호해 감독 책임이 불분명하다.금융당국의 한 관계자는 “일반 대부업체와 달리 투자자가 다수의 일반인이지만 대부분 대부업으로 분류돼 지방자치단체에 감독권이 있다.”면서 “하지만 실제로 자치단체들이 업체에 대한 관리 감독을 얼마나 하고 있는지는 의문”이라고 지적했다.유영규기자 whoami@seoul.co.kr[서울신문 다른기사 보러가기]☞ 메시·아게로 빼니 아르헨 수비 구멍☞ 내년 공무원선발인원 놓고 엇갈린 예상☞ [되돌아본 2009년 산업계] ① 인물로 본 재계☞ “2PM 택연 뿔났다!” 일촌공개 사진 인터넷 퍼져☞ 달아오르는 한반도… 사라지는 눈꽃축제☞ MB “지도층비리 철저수사”☞ 日, 징용 연금수당 1280원 지급☞ 잘린 손목 철도여행?☞ 곽씨로비 촉수 정세균까지?‘맛있는 정보! 신선한 뉴스!’ 서울신문(www.seoul.co.kr)[☞ 서울신문 구독신청] [☞ 나우뉴스 바로가기] [☞ 나우뉴스TV 바로가기]- Copyrights ⓒ서울신문사. 무단 전재 및 재배포 금지 -"
67,2009-12-24,"공기업, 반강제 정치후원금 파문 확산",https://news.naver.com/main/read.nhn?mode=LSD&mid=shm&sid1=102&oid=079&aid=0002117617,노컷뉴스,"수자원 공사 로비 의혹, 4대강 사업 추진과 맞물려…선관위 조사 불가피[CBS사회부 최인수 기자]수자원공사를 비롯해 각 공기업들이 보험들기식 정치로비를 위해 매년 관행적으로 국회의원들에게 정치후원금을 제공해온 것으로 드러났다.특히, 수자원공사의 경우 올해 4대강사업 추진과 맞물려 있어서 정치자금법 위반과 관련한 선관위 차원의 전반적인 조사가 불가피할 것으로 보인다.공기업들의 정치후원금 로비 의혹은 일종의 연말행사처럼 되풀이되고 있다. 특히 새정부 출범이나 총선 이후, 조직의 통폐합이나 축소설이 나돌 때마다 공기업들의 ‘보험들기’식 후원금 논란은 거듭됐다.이번 수자원공사의 로비 의혹도 4대강 예산을 둘러싸고 여야가 첨예한 대립각을 세우고 있는 민감한 시점에서 터져 나왔다.현재 여야는 내년도 수자원공사의 4대강 사업비 3조 2천억원과 이자비용 8백억원 삭감을 둘러싸고 격돌하고 있어 후원금 납부 지시가 사실상 '로비'로 해석될 수 있다는 분석이 나오는 것도 이 때문이다.한 수자원공사 직원은 “수년째 정치후원금을 납부하라는 연락을 공사측으로부터 받고 세액 공제를 받을 수 있는 10만원 이내에서 후원금을 납부해왔다”고 말했다.이에 대해 수자원공사 관계자는 “정치후원금 제도를 안내하는 차원에서 매년 관행적으로 직원들에게 알리고 있다”며 독려 사실을 사실상 시인했다.특히 올해 이메일을 통해 발송된 문건에는 ""한 의원 당 후원한도 금액인 1억 5천만원을 초과할 경우 연락을 해주면 다른 방법을 강구하겠다""고 명시해 4대강사업 예산을 둘러싼 불법 로비 의혹까지 불거져 나오고 있다.지난해에는 건강보험심사평가원이 국민건강보험공단과의 통폐합설이 끊이지 않고 있는 상황에서 국회 보건복지가족상임위 소속 의원들에 후원금 자율 납부를 권유했다가 물의를 빚었다.또 한국토지공사는 지난 2007년 당시 대한주택공사와의 통폐합 논의가 나오고 있던 시점에서 국토해양위원회 소속 국회의원들에게 정치후원금 로비에 나섰다는 의혹을 사기도 했다.참여연대 이지현 의정감시팀장은 “해마다 반복되고 있는 후원금 논란에 대해 제동을 걸 수 있는 제도적 장치가 마련돼야 한다”며 “수자원공사의 후원금 로비 의혹과 관련해 개인의 정치적 자유를 침해했는지 등을 따져 국가인권위원회에 제소하거나 고소·고발 등 법적 대응 을 검토하고 있다”고 밝혔다. 4대강사업저지범대위도 법적 대응을 할 방침이다.이와 함께 중앙선거관리위원회도 특정인에게 몰아주기나 사측의 강요에 의한 정치자금 후원은 문제가 있다는 입장이다.중앙선관위 지도 2과 관계자는 “정치자금법 상 일반적으로 후원금 제도가 있다고 안내하는 차원은 괜찮지만 특정인을 위해 강제적으로 후원금 납부를 독려하거나 업무적으로 관련이 있다면 문제의 소지가 있다""고 말했다.경찰청 특수수사과도 수자원공사 정치후원금 파문에 대한 구체적인 자료를 건네받은 뒤 본격적인 수사착수를 검토하기로 했다.앞서 경찰청 특수수사과는 지난 8월 참여정부 시절 국회 국토해양위 소속 의원들에게 정치후원금 3천 400여만원을 하도록 직원들에게 강요한 혐의 등으로 공적 법인인 한국선급 회장 오 모 씨를 구속한 바 있다.apple@cbs.co.kr[관련기사]●'4대강 말고 밥'●[단독]수공 ""국토위 의원들에 후원금 내라"" 임직원 독려 파문●이강래 ""4대강 국토부 예산, 얼마든 협상할 수 있다""●조정식 ""4대강 공사현장, 흙탕물 농도 20배 이상 증가""●'4대강 예산' 둘러싸고 여야 사흘째 대치(대한민국 중심언론 CBS  뉴스FM98.1 / 음악FM93.9 / TV CH 412)<저작권자 ⓒ CBS 노컷뉴스(www.nocutnews.co.kr) 무단전재 및 재배포 금지 >"
68,2009-12-24,신종플루가 집단 전염병 줄였나?,https://news.naver.com/main/read.nhn?mode=LSD&mid=shm&sid1=102&oid=001&aid=0003040786,연합뉴스,"개인위생 청결해져 눈병.식중독 환자 '뚝'(울산=연합뉴스) 이상현 기자 = 올해 울산 지역에서 신종인플루엔자 때문에 개인위생이 청결해지고 야외활동이 위축되면서 집단 전염병이 크게 줄어든 것으로 나타났다.24일 울산시와 시교육청, 5개 구.군 보건소에 따르면 올해 눈병과 식중독, 쓰쓰가무시병 환자가 지난해보다 급감했다.유행성 결막염은 환자가 지난해 425명에서 올해 57명으로 86.6%가 줄었다.식중독은 지난해 27건 827명에서 올해 5건 284명으로 건수는 81.5%, 감염자 수는 65.7% 감소했다.또 가을철 야외활동 때 많이 발생하는 쓰쓰가무시병은 지난해 275명에서 올해 200명으로 27% 감소했고, 역시 야외활동 때 주로 걸리는 유행성출혈열은 지난해 9명에서 올해 2명으로 줄었다.황병훈 울산남구보건소장(의사)은 ""식중독과 유행성 결막염은 손 씻기만 잘해도 크게 줄일 수 있다""며 ""신종플루로 개인위생에 관심이 높아지고 바깥 활동을 삼가면서 전염성 질환이 매우 줄어든 것으로 보인다""고 말했다.leeyoo@yna.co.kr[관련기사]▶ <부산 고령자 다음달 신종플루 백신접종..초비상>▶ WHO ""신종플루, 저연령대에 치명적""▶ `신종플루 휴업' 유치원 1곳…진정세 확연▶ <의학>아동 신종플루 백신 1회 접종으로 충분▶ ""신종플루 뉴스 정부 의존도 높았다""<뉴스의 새 시대, 연합뉴스 Live><연합뉴스폰><포토 매거진><저작권자(c)연합뉴스. 무단전재-재배포금지.>"
69,2009-12-24,직장인 연말휴가 ‘희비 쌍곡선’,https://news.naver.com/main/read.nhn?mode=LSD&mid=shm&sid1=102&oid=081&aid=0002053631,서울신문,"[서울신문]#1. 삼성전자 수원사업장에서 근무하는 이모(32) 대리는 얼마 전 태어난 딸과 함께 연말을 쭉 보낼 수 있다는 생각에 싱글벙글이다. 평소에는 야근이나 휴일 근무로 시간을 낼 수 없었지만 올해는 크리스마스부터 신정까지 열흘의 ‘집단휴가’를 쓸 수 있기 때문이다. 이 대리는 “기분이 들뜨기 마련인 연말에는 차라리 가족과 함께 휴가를 즐기는 게 능률을 높일 수 있을 것”이라고 말했다.#2. 경기 파주 LG디스플레이 사업장에 다니는 김모(36) 과장은 연말을 회사에서 보낼 판이다. 크리스마스 날에도 회사를 나오고 신정 당일에야 하루 겨우 쉴 듯하다.그가 ‘주 7일 근무’를 한 지도 벌써 몇 달째다. 김 과장은 “구조조정으로 동료들이 떠났던 걸 생각하면 일감이 밀려 쉬지 못하는 것을 감사해야 할 상황”이라면서 “다만 초등학교 1학년인 아들이 아빠 얼굴을 까먹지 않을까 걱정하는 처지”라며 씁쓸히 웃었다.직장인들의 연월차 휴가는 ‘있어도 못쓰고, 쓰고 싶어도 눈치 보이는 휴가’다. 이번 연말에는 기업별로 분위기가 다르다.23일 재계에 따르면 삼성전자는 25일부터 내년 1월3일까지 열흘의 ‘권장 휴무’에 들어간다. 크리스마스와 신정 연휴 사이인 28~31일에 직원들에게 반강제적으로 쉬도록 조치했기 때문이다.특히 삼성전자 수원사업장은 이 기간에 통근버스도 운행하지 않고, 회사 식당도 문을 닫는다. 다른 삼성 계열사들도 분위기는 비슷하다. 제일모직은 아예 이번 연말 휴가를 ‘패밀리데이’로 이름을 붙였다. 다만 연말에 더 바쁜 에버랜드 리조트 업무 종사자들이나 삼성전자 반도체와 LCD 생산라인은 연말까지 휴무 없이 출근해야 한다.LG그룹의 중추인 LG전자 역시 연말 휴가를 많이 가는 분위기다. LG전자 관계자는 “삼성과 달리 직원들 자율에 맡겼지만 업무 자체가 거의 마무리가 된 상황이라 대부분 열흘 연휴를 즐길 것”이라고 말했다. 그러나 LG디스플레이 등 직원들은 휴일도 반납할 분위기다.KT와 롯데그룹은 올해부터 연월차 사용을 장려, 많은 직원들이 연말 휴가를 즐길 수 있게 됐다. 특히 롯데마트는 연차를 휴가처럼 5일씩 붙여 사용할 수 있는 ‘가족사랑 휴가제도’를 진행하고 있다. 롯데백화점은 연차를 쓰면 콘도 사용 요금이나 선물 등을 준다.1인당 1500만원 정도의 성과급을 받게 될 현대자동차 직원들에게 ‘휴가 대박’이라는 겹경사는 터지지 않을 모양이다. 현대차는 연말에 ‘빨간 날’만 쉬는 것으로 했다. 다만 오는 29일은 현대차 노조 창립 기념일이어서 모든 공장의 문을 닫는다. 반면 기아차 노사는 내년 1월1~4일까지 나흘간 쉬기로 했다. SK, 두산, 한화, 포스코 등 다른 그룹들 역시 공휴일만 휴식을 취한다.건설업계는 전통적으로 겨울에는 공사 현장을 잘 가동하지 않는 탓에 연말 연시에 되도록 긴 휴식을 취해왔다.GS건설과 SK건설은 29일 종무식을 하고 30일부터 1월3일까지 5일 휴무에 들어간다. 다만 삼성물산은 연말 조직개편과 맞물려 1월1~3일만 쉰다. 고객들을 계속 상대해야 하는 은행, 카드사 등 금융업종도 연말 휴가는 꿈도 꾸지 못한다.이두걸기자·산업부 종합 douzirl@seoul.co.kr[서울신문 다른기사 보러가기]☞ 메시·아게로 빼니 아르헨 수비 구멍☞ 내년 공무원선발인원 놓고 엇갈린 예상☞ [되돌아본 2009년 산업계] ① 인물로 본 재계☞ “2PM 택연 뿔났다!” 일촌공개 사진 인터넷 퍼져☞ 달아오르는 한반도… 사라지는 눈꽃축제☞ MB “지도층비리 철저수사”☞ 日, 징용 연금수당 1280원 지급☞ 잘린 손목 철도여행?☞ 곽씨로비 촉수 정세균까지?‘맛있는 정보! 신선한 뉴스!’ 서울신문(www.seoul.co.kr)[☞ 서울신문 구독신청] [☞ 나우뉴스 바로가기] [☞ 나우뉴스TV 바로가기]- Copyrights ⓒ서울신문사. 무단 전재 및 재배포 금지 -"
70,2009-12-24,한국인 기대수명 79.4세..OECD 중하위권,https://news.naver.com/main/read.nhn?mode=LSD&mid=shm&sid1=101&oid=001&aid=0003040826,연합뉴스,"<그래픽> 2007년 OECD 회원국 기대수명    (서울=연합뉴스) 전승엽 기자 = OECD는 최근 '2009 건강백서'에서 2007년 OECD 회원국의 평균 기대 수명이 79.1세며 한국은 79.4세로 룩셈부르크와 함께 공동 20위를 기록했다고 밝혔다.    kirin@yna.co.kr기대 수명 증가 폭은 최고 수준(서울=연합뉴스) 심재훈 기자 = 2007년 한국인의 기대수명은 평균 79.4세로 경제협력개발기구(OECD) 회원국 가운데 중하위권인 것으로 24일 나타났다.그러나 기대 수명 증가 폭은 회원국 중 최고 수준인 것으로 파악됐다.OECD는 최근 '2009 건강백서'에서 2007년 OECD 회원국의 평균 기대 수명이 79.1세며 한국은 79.4세로 룩셈부르크와 함께 공동 20위를 기록했다고 밝혔다.기대 수명이 가장 높은 국가는 일본으로 82.6세였으며 스위스(81.9세), 호주.이탈리아(81.4세), 아이슬란드(81.2세), 스페인.프랑스.스웨덴(81.0세), 캐나다(80.7세), 노르웨이(80.6세), 뉴질랜드.네덜란드(80.2세), 오스트리아(80.1세), 독일(80.0세) 순이었다.한국과 기대 수명이 비슷한 국가는 핀란드, 영국, 그리스로 모두 79.5세였다.기대 수명이 한국보다 떨어지는 국가는 포르투갈(79.1세), 덴마크(78.4세), 미국(78.1세), 체코(77.0세), 폴란드(75.4세), 멕시코(75.0세), 슬로바키아(74.3세), 헝가리(73.3세), 터키(73.2세)였다.성별로 살펴보면 한국 남자의 기대 수명은 76.1세로 OECD 회원국 중 덴마크(76.2세)에 이어 21위였다. 스위스는 79.5세로 남자 기대 수명이 가장 높았다.여자의 기대 수명은 일본이 86.0세로 최고인 가운데 한국은 독일과 함께 82.7세로 공동 13위를 기록했다.특히 OECD는 1960년과 2007년의 기대 수명 변화 분석에서 한국과 터키가 이 기간에 25세가량 급증해 가장 많이 늘어난 회원국으로 평가했다.이같은 통계는 한국 사회가 1960년대에서 2000년대로 넘어오면서 급격히 고령화 사회로 접어들었으나 아직 기대수명이 OECD 중하위권에 머물고 있어 향후 더욱 노령화가 진행될 가능성이 있음을 시사하고 있다.기획재정부 관계자는 ""각종 국내외 기관의 통계치를 볼 때 우리 사회의 급속한 고령화는 불가피한 측면이 있어 노인 복지 확충과 더불어 저출산 대책에 정책의 주안점을 두고 있다""고 말했다.president21@yna.co.kr[관련기사]▶ <여가활동 OECD 최하위권..타인신뢰도 낮아>▶ <1인가구.여성가구주.조손가구 급증>▶ 출생아 기대수명 80세 첫 돌파▶ <표>OECD 국가의 성별 기대수명<뉴스의 새 시대, 연합뉴스 Live><연합뉴스폰><포토 매거진><저작권자(c)연합뉴스. 무단전재-재배포금지.>"
