,날짜,기사 제목,기사 링크,기사 출처,기사 내용
89,2012-12-05,'재벌빵집' 논란 1년…재벌끼리 '빵집 넘기기',https://news.naver.com/main/read.nhn?mode=LSD&mid=shm&sid1=101&oid=366&aid=0000094967,조선비즈,"올해초 터진 ‘재벌빵집’ 논란이 해가 저물도록 불씨가 꺼지지 않고 있다. 주요 대기업들은 골목상권 침해 비판을 받으며 베이커리 사업에서 손을 뗐지만 중소기업이라 보기 어려운 곳에 매각한 경우가 많다. 또 한편에서는 대기업이 매물로 내놓은 베이커리 사업을 다른 대기업이 인수하려는 모습도 보인다. 매각 방침만 밝히고 여론의 눈치만 보는 곳도 있다. 이달말 중소기업적합업종에 ‘빵집’이 포함될 경우 ‘재벌빵집’에 대한 논란은 더욱 커질 것으로 보인다.5일 재계와 유통업계에 따르면 올해 초 논란이 된 주요 대기업의 베이커리 사업은 매각의 과정을 통해 대부분 철수한 상황이다.‘포숑’ 베이커리 사업했던 롯데그룹 계열사인 블리스는 지난 5월 영유통과매일유업(005990), 개인 투자자에 각각 지분 50%, 30%, 20%를 매각했다. 블리스는 신격호 롯데그룹 총괄회장의 외손녀인 장선윤씨가 대표로 맡았던 곳이다.삼성 계열사인호텔신라(008770)가 운영한 ‘아띠제’ 역시대한제분(001130)에 매각됐고, 두산 계열사인 SRS코리아도 커피전문점인 ‘페스티나 렌떼’ 사업을 철수했고, 패스트푸드 전문점 ‘버커킹’을 매각했다.현대자동차(005380)그룹 계열사인 해비치호텔앤드리조트도 ‘오젠’ 사업을 중단했다.이명희신세계(004170)그룹 회장의 딸 정유경 신세계 부사장이 40% 지분을 보유했던 신세계SVN은 데이앤데이·달로와요·원컵케익·베키아에누보·페이야드 브랜드로 베이커리 사업하고 있다. 정 부사장은 지난 10월 신세계SVN의 지분을 정리한 상태다.다만 여전히 ‘골목 상권과 상관이 없다’거나 우회적인 방법으로 베이커리 사업에 대해 집착을 보이는 곳이 적지 않다.롯데쇼핑이 지분 90.5%를 보유한 식품업체 롯데브랑제리는 롯데백화점과 롯데마트에 베이커리 전문점인 보네스페를 직영으로 운영되고 있다. 이 때문에 롯데그룹 차원의 부당지원 가능성도 꾸준히 제기되는 상황이다.신세계그룹 역시 여전히 신세계백화점과이마트(139480)등을 중심으로 신세계SVN의 각 베이커리 사업이 부당지원되고 있다는 논란에서 벗어나지 못하고 있는 상황이다.한화(000880)그룹의 계열사인 한화갤러리아도 델리 카페 ‘빈즈앤베리즈’를 운영 중이며 또 다른 계열사인 한화호텔앤드리조트는 프랑스 베이커리 전문점 ‘에릭케제르’로 베이커리 사업하고 있다. 한화 측은 1년여간 “내부적으로 고민 중”이라는 입장만 되풀이하고 있다.코오롱그룹은 계열사 스위트밀을 통해 베이커리 전문점 ‘비어드파파’를 운영하고 있다. 코오롱 측은 “과거 사내 벤처 기업으로 출발했고, 대형마트 등에서 영업하고 있기 때문에 큰 문제가 없다고 판단하고 있다”고 말했다.대기업끼리 빵집 사업을 주고받고 있다는 지적도 나오고 있다.현대백화점(069960)그룹은 계열사인현대그린푸드(005440)를 통해 운영하는 베이커리 전문점 ‘베즐리’ 매각을 추진 중이다. 하지만 매각 과정에CJ(001040)그룹의 계열사인 CJ푸드빌이 인수제안서를 제출해 재벌과 재벌간 빵집 넘기기 수준이 아니냐는 비판을 받고 있다. CJ푸드빌은 프랜차이즈 베이커리 전문점 ‘뚜레쥬르’를 운영하고 있다.아울러 호텔신라가 아티제를 판 대한제분과 포숑을 운영한 블리스의 일부 지분을 인수한 매일유업 역시 대기업에 해당해 대기업끼리 빵집 사업을 주고받고 있다는 논란도 제기되고 있다.한 재계 관계자는 “주요 대기업이 상생 방안을 기조로 베이커리 사업을 매각하고 있지만, 마땅히 인수할 기업이 없다는 게 이들 기업의 입장”이라며 “이렇다 보니 대기업간 사업을 주고받는 모습으로 보여지고 있어 안타깝다”고 말했다.한편 ‘재벌 빵집’에 대한 시각에서 프랜차이즈 베이커리 양대 산맥인 SPC그룹의 파리크라상이 운영하는 ‘파리바게뜨’와 CJ그룹의 CJ푸드빌이 운영 중인 ‘뚜레쥬르’에 대한 비판 여론도 나오고 있다.이들은 중소 상인이 장사하는 프랜차이즈 형태의 베이커리 사업이라는 점에서 ‘재벌 빵집’ 논란을 피했다. 하지만 일각에선 점포간 거리를 무시한 출점, 무분별한 확장 등 부도덕한 불공정 행위로 이들 업체가 오히려 동네 빵집을 파괴하고 있다는 주장을 펼치고 있다.대한제과협회 측은 “이들 베이커리 브랜드로 인해 수많은 동네 빵집이 문을 닫거나 심각한 손해를 입었다”고 설명했다. 협회 측은 제과 업종의 중소기업 적합업종 지정을 강조하고 있다.[박지환 기자daebak@chosun.com][이재설 기자record@chosun.com]조선비즈 핫 뉴스 Bestㆍ된장녀라고? 카드결제 목록 살펴보니 깜짝!ㆍ삼성과 진짜 결별준비 나섰다…작심한 애플ㆍ승승장구 삼성 이서현, 승진 제외…오빠 때문?ㆍ당신만 모르면 손해! ""2013년 돈이 몰리는 곳""ㆍ입 떡 벌어지는 할인…車 구매, 12월이 기회!chosunbiz.com"
90,2012-12-05,"安측, 文지원방식 발표 취소…""오늘 지원활동 無""",https://news.naver.com/main/read.nhn?mode=LSD&mid=shm&sid1=100&oid=003&aid=0004863926,뉴시스,"【서울=뉴시스】박대로 기자 = 무소속 안철수 전 대선후보 측이 5일 예정됐던 기자회견을 전격 취소하고 민주통합당 문재인 후보 지원방안 발표 시점을 늦췄다.안 전 후보 측 한형민 공보실장은 이날 오후 3시께 서울 종로구 공평동 캠프에서 취재진과 만나 ""브리핑 계획이 없어졌다. 유민영 대변인한테 통보 받았다""며 ""이유는 전해 듣지 못했다""고 말했다.또 ""(대변인이 와서 문 후보 지원방법)브리핑이 아닌 상황에 대한 정리(설명)를 하려고 했는데 (계획이)없어졌다""고 설명했다.기자회견이 취소된 데 이어 안 전 후보의 문 후보 공식지원 활동도 잠정 연기됐다.문 후보 지원활동 여부를 묻는 질문에 한 실장은 ""오늘은 없다""면서도 ""향후에도 없는지는 알 수 없다""고 답했다.또 다른 관계자는 기자회견 내용과 관련, ""오전 언론보도가 사실이 아니라는 것을 대변인이 간단하게 설명하려던 것""이라며 ""지원을 안 한다는 게 아니다""고 설명했다.그러면서 ""시간이 없다는 것은 서로 다 알고 있다""며 ""조만간 (지원)하실 것""이라고 말했다.daero@newsis.com[뉴시스 이시간 핫 뉴스]ㆍ 은행서 돈 빌렸는데…대부업체에 시달리는 서민들ㆍ 뉴욕 지하철역서 한인 고의로 떠밀려 사망ㆍ ´연예계 성상납´ 실태, 영화로 나온다ㆍ ""대소변 못가린다"" 3살 아들 때려 숨지게한 부모ㆍ 양의 탈을 쓴 파렴치한 ´이웃 아저씨´ 구속★ 손 안에서 보는 세상, 모바일 뉴시스★ “우리 결혼합니다” 뉴시스 웨딩알리미 ‘두리’<저작권자ⓒ 공감언론 뉴시스통신사. 무단전재-재배포 금지.>"
91,2012-12-05,세계 최고령 116살 여성 사망,https://news.naver.com/main/read.nhn?mode=LSD&mid=shm&sid1=104&oid=008&aid=0002959701,머니투데이,"[머니투데이 이슈팀 이민아 기자]▲ 베시 쿠퍼 ⓒAFP공식적으로 세계 최고령인 116세 미국 여성이 사망했다.5일(이하 현지시간) CNN 등 외신에 따르면 세계 최고령인 베시 쿠퍼씨가 지난 4일 미국 조지아주 먼로의 한 요양원에서 향년 116세의 나이로 숨을 거뒀다.쿠퍼씨의 아들 시드니 쿠퍼(77)는 어머니가 최근 위장병을 앓았으며 머리를 손질한 뒤 크리스마스 비디오를 보다 호흡이 가빠져 오후 2시경 영면했다고 전했다. 그는 ""머리를 고치는 어머니의 모습이 마치 어딘가를 가려고 준비하는 것 같았다""고 덧붙였다.1896년 8월 26일 미국 테네시주 설리번카운티에서 태어난 쿠퍼씨는 2011년 1월 최고령 인물로 기네스북에 이름을 올렸다. 쿠퍼씨는 올해 초 인터뷰에서 ""나는 내 일에만 신경을 쓰고 패스트푸드를 먹지 않는다""고 장수 비결을 밝히기도 했다.쿠퍼씨의 사망으로 세계 최고령 타이틀은 미국 아이오와주에 사는 115살의 디나 맨프레디니씨가 이어 받게 됐다. 공식적으로 역사상 가장 오래 산 사람은 1997년 122세의 나이로 사망한 프랑스의 잔 루이즈 칼망씨다.[머니투데이 핫뉴스]☞BMW에 '모태녹차'낙서 후, 망치질까지 '경악'☞9억 집·이자 月 140만원, 하우스푸어 지원?☞박정희 사저 관리인 ""박근혜 20대 모습은…""☞'발인식' 박근혜, 처음으로 눈물 흘리며…☞""아파트값 1억 올랐다"" 신난 주민들, 왜?[스몰캡 리포트]숨어있는 중소형주 발굴!이슈팀 이민아기자<저작권자 ⓒ '돈이 보이는 리얼타임 뉴스' 머니투데이, 무단전재 및 재배포 금지>"
92,2012-12-05,北 로켓 발사 임박…10~12일 기상조건 `양호',https://news.naver.com/main/read.nhn?mode=LSD&mid=shm&sid1=100&oid=001&aid=0005972378,연합뉴스,"北 로켓발사장서 연료주입 추정 트럭 발견(서울=연합뉴스) 미국의 위성사진 업체 ‘지오아이(Geoeye Satellite Image)’가 지난 4일 촬영한 북한 평안북도 철산군 동창리 발사장 모습. 발사장에 트럭 몇 대가 주차돼 있는 모습이 보인다.  미국의 자유아시아방송(RFA)은 5일 위성사진 전문가 커티스 멜빈씨의 분석을 인용해 이들 차량이 연료 주입 또는 정비를 위한 트럭일 가능성이 크다고 전했다. 2012. 12. 5 <<사진출처 자유아시아방송 . 북한부기사참조>>구름 끼지만 눈·비 없을 듯…전문가 ""낙뢰만 없으면 발사 가능""(서울=연합뉴스) 이준삼 기자 = 북한이 발표한 장거리 로켓 발사예정기간(10∼22일)의 초반에 해당하는 이달 10∼12일의 기상조건은 로켓 발사에 지장을 주지 않을 것으로 전망된다.북한은 3단으로 이뤄진 장거리 로켓을 발사대에 장착하는 작업을 5일 모두 완료한 것으로 알려져 정치적 요인 등 외부 변수가 없다면 주말께에는 연료를 주입하고 이달 10∼12일 발사할 가능성이 큰 것으로 관측되고 있다.5일 기상청의 `북한주간예보'에 따르면 오는 10∼12일 북한 전역에 구름이 낀 날씨가 이어지겠지만, 눈과 비는 내리지 않을 것으로 보인다.기상청은 로켓 발사장이 위치한 평안북도에 대해서도 10∼11일 구름이 조금 끼고, 12일에는 구름이 많이 끼겠다고 예보했다.구름은 종류에 따라 낙뢰 등을 일으켜 로켓의 전기장치 등에 영향을 줄 가능성이 있지만 구름 낀 날씨 자체가 로켓 발사를 결정하는 데 큰 변수로 작용하지는 않는 것으로 알려졌다.조광래 항우연 나로호발사추진단장은 ""낙뢰 등을 일으키는 구름이 아니라면 구름 낀 날씨는 로켓 발사에 문제가 되지 않는다""고 말했다.발사장이 위치한 철산군에서 비교적 가까운 곳에 있는 신의주의 아침 최저기온과 낮 최고기온은 10일 영하 13도·영하 4도, 11일 영하 12도·영하 4도, 12일 영하 11도·영하 2도 등이 될 것으로 기상청이 전망했다.바람의 세기는 10일 초속 5∼8m, 11∼12일 초속 3∼6m가 될 것으로 보인다.<그래픽> 북 장거리 로켓 발사 과정    (서울=연합뉴스) 장예진 기자 = 북한은 3단으로 이뤄진 장거리 로켓을 발사대에 장착하는 작업을 5일 모두 완료한 것으로 알려져 정치적 요인 등 외부 변수가 없다면 주말께에는 연료를 주입하고 이달 10∼12일 발사할 가능성이 큰 것으로 관측되고 있다.     jin34@yna.co.kr    @yonhap_graphics(트위터)조 단장은 ""비가 와도 로켓에 방수처리가 돼 있으면 괜찮다. 천둥번개가 치거나 폭설이 내리지만 않는다면 기상은 로켓 발사에서 큰 고려 요인이 아니다""며 ""(기상청이 예보한) 그 정도면 로켓을 쏘는 데는 지장 없을 것""이라고 말했다.한편 교육과학기술부와 항공우주연구원은 `기온은 영하 10도∼영상 35도', `비행궤적 20㎞ 이내에 낙뢰가 없을 것', `발사장 및 인근 50㎞ 이내에 비가 내리지 않을 것' 등을 나로호 발사를 위한 날씨 조건으로 정해놓고 있다.jslee@yna.co.kr[이 시각 많이 본 기사]☞전국 강추위 속 낮부터 최고 10㎝ 많은 눈☞김수현, '해를 품은 달' 홍보차 일본행☞유시민 ""안철수, 지금은 뭉개고 있을 때 아니다""☞<'코리안 드림' 이어 PGA 투어서도 꿈 이룬 존 허>☞헌정 사상 첫 재외국민 대선 투표 시작<연합뉴스 모바일앱 다운받기><포토 매거진><저작권자(c)연합뉴스. 무단전재-재배포금지.>"
93,2012-12-05,전국 대설…도로ㆍ해상ㆍ경전철 등 잇단 통제,https://news.naver.com/main/read.nhn?mode=LSD&mid=shm&sid1=103&oid=001&aid=0005972613,연합뉴스,"(서울=연합뉴스) 이 율 기자 = 5일 서울과 인천, 경기지역은 물론, 충청남도와 강원도까지 많은 눈이 내리면서 도로와 해상, 경전철 등의 교통 통제가 잇따랐다.중앙재난안전대책본부에 따르면 이날 오후 2시 현재 서울시내 인왕산길 등 3개 도로와 인천시내 고비고개 등 3개 도로가 통제됐다.경기 의정부 경전철도 전기선로 장애로 이날 오후 1시 40분을 기해 전 구간 통제됐다.해상에서는 인천~백령ㆍ연포와 목포~홍도를 오가는 여객선 12개 항로 17척의 운항이 중단됐다.중대본은 이날 오전 6시를 기해 1단계 비상근무에 돌입했다. 경기도 등 각 지방자치단체에서는 1천633명이 비상근무 중이다.이날 오후 2시 현재 백령도 10.6cm, 인천 7.5cm, 수원 7.0cm, 서울 4.5cm, 동두천 3.0cm, 철원 2.5cm, 서산 1.8cm, 천안 1.5cm의 적설량을 기록했다. 6일까지 강원내륙과 산간에는 15cm이상, 서울과 경기, 강원과 경북 북부 지역에는 3~10cm, 강원동해안과 전라도는 2~7cm, 전남 남해안과 제주 산간ㆍ경상남도와 울릉도 독도에는 1~5cm의 눈이 내릴 것으로 예상되고 있다.현재까지 대설주의보가 발령된 지역은 서울, 인천, 경기, 서해5도, 충남, 강원 지역이다.맹형규 중앙재난안전대책본부장(행정안전부 장관)은 이날 소집한 회의에서 ""민ㆍ관ㆍ군 공조체제를 강화해 국민불편을 최소화할 수 있도록 노력해주기 바란다""면서 ""특히 교통소통이 문제이니 국토해양부와 지방자치단체, 도로공사가 차량 소통에 문제가 없도록 최선을 다해야 할 것""이라고 말했다.yulsid@yna.co.kr[이 시각 많이 본 기사]☞전국 강추위 속 낮부터 최고 10㎝ 많은 눈☞김수현, '해를 품은 달' 홍보차 일본행☞유시민 ""안철수, 지금은 뭉개고 있을 때 아니다""☞<'코리안 드림' 이어 PGA 투어서도 꿈 이룬 존 허>☞헌정 사상 첫 재외국민 대선 투표 시작<연합뉴스 모바일앱 다운받기><포토 매거진><저작권자(c)연합뉴스. 무단전재-재배포금지.>"
94,2012-12-05,경기도 '교통대란' 현실화되나?···13개구간·29.3Km 통제(종합),https://news.naver.com/main/read.nhn?mode=LSD&mid=shm&sid1=103&oid=277&aid=0002891270,아시아경제,"【수원=이영규 기자】경기도 내 전역이 5일 낮 12시10분을 기해 '대설주의보'가 내려진 가운데 오후 3시 기준 도내 13개 구간 총 29.3Km에서 차량 통행이 중단되고 있다. 경기지방경찰청은 눈이 계속 내리고 있어 교통통제 구간은 급격히 늘어날 것으로 내다보고 있다.경기경찰청에 따르면 현재 도내 13개 구간 29.3Km에서 교통이 통제되고 있다.우선 성남의 경우 지방도 338호선 이배재고개 편도2차로 1.5Km 구간과 '성남~장호원' 임시개통구간 2Km가 부분 통제되고 있다. 또 남한산성로 '변전소3R~산성터널' 구간 3.4Km와 남한산성 순환로 '민영맨션~양지공원' 고개길 400m도 통제 중이다.분당은 하오개로 '한국중앙연구원~의왕'구간 3Km가, 용인지역은 '한성CC~보정도 한화아파트' 구간 2Km가 각각 부분 통제되고 있다.포천지역은 수원산고개(국지도 56호선) 3Km와 낭유리고개(지방도 387호선) 3Km가 통제되고 있다. 이외에도 가평 불기고개(지방도 387호선) 3km와 남양주 차산리고개(지방도 86호선) 1.5Km, 비금리고개(지방도 387호선) 3Km도 차량통행이 중단된 상태다.광주지역은 이배재고개 편도1차로 1.5Km와 남한산성로 편도1차로 2Km 구간이 추가로 교통 통제됐다.경기경찰청 관계자는 ""앞으로 눈이 더 많이 올 것으로 보여 도내 국도 및 지방도 교통통제는 크게 늘어날 가능성이 높다""고 말했다.한편, 경기도는 이날 오후 1시 공무원 4062명, 도로관리요원 363명 등 4954명의 인력과 제설차 68대 등 1842대의 장비를 동원, 주요간선도로 등 도내 경기도 중점관리도로 360개 노선과 고속도로 진입도로 12개 노선 등에 대해 제설작업을 실시하고 있다.도는 오후 1시부터 4시까지 눈이 집중될 것이라는 예보에 따라 퇴근길 통행불편을 최소화 할 수 있도록 주간선도로에 대해 우선적으로 제설작업을 실시할 계획이다.도내 평균 적설량은 오후 1시 기준 2.7cm로 화성과 시흥시 7cm, 의왕시 6cm, 부천시 5.5cm 등이다.이영규 기자 fortune@<ⓒ세계를 보는 창 경제를 보는 눈, 아시아경제(www.asiae.co.kr) 무단전재 배포금지>[관련기사]KBS 떠난 '나영석' 누구 때문인가 했더니…'충격'""군대커플 '유인나-지현우' 오래 간다했더니""""한 방에 뜬 '싸이' 잘 나간다 싶더니만 결국""""원더걸스 '소희' 직접 봤는데…"" 충격 증언돈가스 사업 '정형돈' 결혼한 하하 준 돈이…'충격'"
95,2012-12-05,서울 폭설에 도로 '주차장'…시민 '발동동',https://news.naver.com/main/read.nhn?mode=LSD&mid=shm&sid1=103&oid=001&aid=0005972688,연합뉴스,"중부지방 폭설    (서울=연합뉴스) 전수영 기자 = 중부지방을 중심으로 전국에 최고 10㎝의 많은 눈이 내릴것으로 예보된 10일 오후 서울 마포대교 밑 강변북로를 가득메운 차들이 서행하고 있다.   2012.12.5    swimer@yna.co.kr경사차로 5개구간 통제…곳곳 접촉사고 잇따라(서울=연합뉴스) 사건팀 = 5일 서울지역에 대설주의보가 발령될 정도로 많은 눈이 내리면서 시내 곳곳 도로가 주차장을 방불케 하고 있다.기상청에 따르면 서울에는 오전 11시 이후 눈발이 날리기 시작해 오후 3시까지 5.5㎝의 눈이 쌓였다. 이날 밤까지 적설량은 최고 10㎝에 이를 전망이다.짧은 시간 동안 많은 눈이 내리면서 도심과 시내·외곽 주요 간선도로 일부 구간 등에서 차량이 제 속도를 내지 못하는 상태다.이날 오후 상습 정체구간인 시청 주변과 동소문로, 율곡로, 서초역 일대, 역삼역 일대 등 도심 곳곳에서 차량이 거북이 운행을 했다.동부간선도로 월릉교→군자교, 올림픽대로 탄천길→한남대교, 강변북로 양화로→동작대교 구간을 비롯해 남부순환로, 서부간선도로 등 주요 간선도로에서도 심한 정체가 빚어지고 있다.서울지방경찰청은 대설주의보가 내려지자 이날 오후 1시를 기해 교통 '병호' 비상을 발령하고 2천여명을 투입, 교통 관리에 나섰다.경찰은 오후 3시 현재 개운산길(고대 교우회관~개운사), 인왕산길(사직공원~창의문), 북악산길(북악골프장~창의문), 삼청동길(감사원 입구~삼청각, 감사원 입구~성균관대 후문) 등 5곳의 양방향 차량 통행을 통제하고 있다.눈이 오면서 경사로를 오르지 못한 차량 등이 도로에서 옴짝달싹 못하거나 미끄러지는 사고도 잇따랐다.낮 12시50분께 노원구 월계동 주공2단지 아파트 입구 경사로에서 버스와 승용차 등 6~7대가 눈길을 오르지 못하고 고립돼 소방당국이 출동, 제설작업을 벌였다.오후 2시께 관악구 봉천동 현대시장에서 국사봉 터널로 가는 오르막 차로에서는 차량 2대가 눈길에 미끄러져 부딪혔다. 인명피해는 없었다.오후 2시23분에는 강서구 화곡동 한 골목에서 택배 운송트럭이 미끄러지는 바람에 건물과 전봇대 사이에 끼었다가 구조되기도 했다.소방당국은 이날 오후 3시 현재까지 서울 종로구, 성북구, 용산구, 강서구 등 곳곳에서 30건의 신고를 받고 인력을 투입, 눈 쌓인 도로에 염화칼슘을 뿌리는 등 제설작업을 했다.눈이 많이 올 줄 모르고 출근길에 자가용을 타고 나온 시민들은 퇴근길 꽉 막힌 도로를 지날 생각에 걱정이 앞서는 분위기다.직장인 하태경(29)씨는 ""눈이 온다는 뉴스를 봤지만 아침에 늦잠 자는 바람에 차를 끌고 출근했다""며 ""후륜구동이라 눈길에 약해 퇴근할 때는 회사 주차장에 세워두고 지하철을 이용해야겠다""고 밝혔다.회사원 박모(27)씨는 ""눈이 온다는 예보는 들었지만 이렇게 많이 쏟아질 줄은 몰랐다""며 ""차를 가지고 출근했는데 사고가 날까 걱정돼 아무래도 차를 두고 가야 할 것 같다""고 말했다.조해인(31·여)씨는 ""오후에 안국동에서 약속이 있어서 합정에서 택시를 탔는데 얼마 못 가 운전사가 '지하철로 갈아타는 쪽이 낫겠다'고 해 갈아탔다""며 ""급한 마음에 가는 길인데 약속 시간에 늦었다""며 발을 동동 굴렀다.회사원 박모(29·여)씨는 ""오늘 회사에서 회식하기로 했는데 연기됐다. 가뜩이나 늦은 밤 택시잡기 어려운 연말인데 오늘 밤은 귀가전쟁이 훨씬 치열할 것 같아서라고 한다""고 말했다.경찰 관계자는 ""퇴근 시간대까지 눈이 더 쌓이고 기온이 영하로 떨어져 도로가 얼어붙을 것으로 예상되니 가능한 한 대중교통을 이용해 달라""고 당부했다.[이 시각 많이 본 기사]☞전국 강추위 속 낮부터 최고 10㎝ 많은 눈☞김수현, '해를 품은 달' 홍보차 일본행☞유시민 ""안철수, 지금은 뭉개고 있을 때 아니다""☞<'코리안 드림' 이어 PGA 투어서도 꿈 이룬 존 허>☞헌정 사상 첫 재외국민 대선 투표 시작<연합뉴스 모바일앱 다운받기><포토 매거진><저작권자(c)연합뉴스. 무단전재-재배포금지.>"
96,2012-12-05,"[대선 D-14] 安, 5일 文 지원방안 발표 취소",https://news.naver.com/main/read.nhn?mode=LSD&mid=shm&sid1=100&oid=018&aid=0002697232,이데일리,"[이데일리 나원식 기자] 안철수 전 무소속 대선후보가 5일 오후로 예정된 문재인 민주통합당 대선후보에 대한 지원 방안 발표를 취소했다.안 전 후보 측 유민영 전 대변인은 이날 오후 2시 브리핑을 예고했으나, 한 차례 연기한 뒤 결국 브리핑을 취소한 것이다.이에 따라 이르면 오늘부터 시작할 것으로 예상됐던 안 전 후보의 문 후보 지원 행보도 이날 중엔 이뤄지지 않을 것으로 알려졌다.안 전 후보 측의 다른 관계자는 “브리핑을 취소한 이유는 현재는 알 수 없다”며 “문 후보를 지원하지 않겠다는 것은 아니다”라고 설명했다.나원식 (setisoul@edaily.co.kr)▶ 당신의 생활 속 언제 어디서나 이데일리 ‘신문 PDF바로보기‘▶ 스마트 경제종합방송이데일리 TV▶ 실시간 뉴스와 증권거래, 내 손안의 금융시장 ‘이데일리 모바일 서비스’＜ⓒ종합 경제정보 미디어 이데일리 - 무단전재 & 재배포 금지＞"
