,날짜,기사 제목,기사 링크,기사 출처,기사 내용
50,2012-12-05,<서울 폭설에 도로 빙판…퇴근길 지하철 '북새통'>(종합),https://news.naver.com/main/read.nhn?mode=LSD&mid=shm&sid1=103&oid=001&aid=0005973569,연합뉴스,"중부지방 폭설    (서울=연합뉴스) 전수영 기자 = 중부지방을 중심으로 전국에 최고 10㎝의 많은 눈이 내릴것으로 예보된 10일 오후 서울 마포대교 밑 강변북로를 가득메운 차들이 서행하고 있다.   2012.12.5    swimer@yna.co.kr곳곳서 정체·거북이 운행…눈길 사고도 잇따라(서울=연합뉴스) 사건팀 = 5일 서울지역에 대설주의보가 발령될 정도로 많은 눈이 내리면서 시내 일부 도로에서 차량 정체가 빚어졌다.그러나 퇴근길에 많은 시민이 승용차를 놓고 대중교통을 이용하면서 도심 일부 도로는 평소보다 한산한 반면 이용객이 몰린 지하철역 대부분은 북새통을 이뤘다.기상청에 따르면 서울에는 오전 11시 이후 눈발이 날리기 시작해 오후 5시까지 7.8㎝의 눈이 쌓였다.추운 날씨에 짧은 시간 동안 많은 눈이 내리면서 도로가 얼어붙어 도심과 시내·외곽 주요 간선도로 일부 구간에서 차량이 제 속도를 내지 못했다.폭설 내린 서울    (서울=연합뉴스) 진성철 기자 = 폭설이 내린 5일 서울 광화문 거리에서 사람들이 눈을 맞으며 버스를 기다리고 있다.   2012.12.5    zjin@yna.co.kr퇴근시간대 을지로, 남대문로, 동소문로, 율곡로, 신사·학동·신논현·강남구청역 일대 등 시내 곳곳에서 차량이 거북이 운행을 했다.강변북로 일부 구간은 평균 시속이 10~20㎞대에 불과했고 올림픽대로와 북부간선도로, 내부순환로 등 주요 간선도로에도 정체 구간이 속출했다. 강변북로 진출입구 등 일부 구간은 내린 눈이 얼어붙으면서 빙판길이 돼 차들이 엉금엉금 기었다.서울지방경찰청은 이날 대설주의보가 내려지자 오후 1시를 기해 교통 '병호' 비상을 발령하고 방범순찰대원 등 2천여명을 투입, 교통 관리에 나섰다.경찰은 광화문, 대한문 등 시민 통행이 많은 지점과 지하철역 출입로, 인도 등에서 제설작업도 진행했다.경찰은 오후 7시 현재 북악산길(북악골프장~창의문)의 양방향 차량 통행을 통제하고 있다.눈이 오면서 경사로를 오르지 못한 차량 등이 도로에서 옴짝달싹 못하거나 미끄러지는 사고도 잇따랐다.'엉금엉금' 퇴근길    (춘천=연합뉴스) 강은나래 기자 = 많은 눈이 내린 5일 오후 강원 춘천시 도심에서 퇴근길 차들이 거북이 운행을 하고 있다. 2012.12.5    rae@yna.co.kr낮 12시50분께 노원구 월계동 주공2단지 아파트 입구 경사로에서 버스와 승용차 등 6~7대가 눈길을 오르지 못하고 고립돼 소방당국이 출동, 제설작업을 벌였다.오후 2시께 관악구 봉천동 현대시장에서 국사봉 터널로 가는 오르막 차로에서는 차량 2대가 눈길에 미끄러져 부딪혔다. 인명피해는 없었다.오후 2시23분에는 강서구 화곡동 한 골목에서 택배 운송트럭이 미끄러지는 바람에 건물과 전봇대 사이에 끼었다가 구조되기도 했다.소방당국은 이날 오후 3시 현재까지 서울 종로구, 성북구, 용산구, 강서구 등 곳곳에서 50여건의 신고를 받고 인력을 투입, 눈 쌓인 도로에 염화칼슘을 뿌리는 등 제설작업을 벌였다.눈이 많이 올 줄 모르고 출근길에 자가용을 타고 나온 시민들은 퇴근길 도로 정체가 심할 것으로 예상되자 차량을 두고 앞다퉈 전철역으로 향했다.주변에 기업체가 많은 여의도역, 삼성역 등 일부 전철역은 몰려든 시민들로 북새통을 이뤘다. 역사 내 이동통로는 사람으로 들어차 움직이기 어려울 정도였다.<그래픽> 중부지방 폭설 원인    (서울=연합뉴스) 장예진 기자 = 5일 서울을 비롯한 중부지방을 중심으로 쏟아진 많은 눈은 눈은 밤에 대부분 그치겠으며 6일 아침에는 올겨울 들어 가장 강력한 추위가 몰려올 전망이다.    jin34@yna.co.kr    @yonhap_graphics(트위터)종로3가역에서 근무하는 한 역무원은 ""대합실과 승강장을 둘러보니 평소보다 10~15% 정도는 승객이 많은 것 같다""며 ""아직 본격적인 퇴근 시간이 아님에도 벌써 승객이 꽉 들어찬 차량도 있었다""고 전했다.이 역에서 3호선 열차를 기다리던 회사원 박세원(46)씨는 ""제설작업을 한다는 뉴스를 봤지만 차는 회사에 두고 지하철을 타러 왔다""며 ""내일 아침에도 도로 사정이 썩 좋지 않을 것 같아 지하철로 출근할 예정""이라고 말했다.장경호(31·회사원)씨는 ""아침에 출근하면서 차를 가져왔는데 저녁에는 온도가 내려가면서 길이 더 얼어붙어 위험해질 것 같다""며 ""차를 두고 지하철을 타는데 평소에 차로 30분 걸릴 퇴근이 훨씬 길어졌다""고 푸념했다.삼성역에서 만난 회사원 이모(32)씨는 ""여자친구 생일인데 차를 못 갖고 나와 계획했던 데이트 코스에 차질이 빚어져 속상하다""면서 ""예약한 식당에 대중교통을 이용해 가야 하는데 한참 걸어야 해 걱정이다""며 급히 걸음을 옮겼다.직장인 김태희(25·여)씨는 ""평소 택시로 퇴근하는데 차가 밀릴 것 같아 지하철을 타기로 했다""며 ""직장 동료 한 명은 퇴근길이 걱정된다며 아예 자발적으로 야근하고 늦게 퇴근하겠다고 했다""고 전했다.서울시는 시민들의 지하철 이용이 늘어남에 따라 이날 종착역 기준으로 막차시간을 6일 오전 1시에서 1시30분으로 연장하고, 출근길 집중 배차시간대도 오전 7시~9시30분으로 평소보다 30분 늘리기로 했다.<그래픽> 지역별 최심 신적설량 현황    (서울=연합뉴스) 장예진 기자 = 기상청에 따르면 이날 오전 서해안 지방부터 눈이 내리기 시작해 오후 8시까지 서울 7.8㎝, 인천 11.3㎝, 수원ㆍ충주 10.5㎝, 춘천 8.5㎝, 대관령 8.0㎝, 청주 5.5㎝, 대전 2.5㎝, 추풍령 3.5㎝, 안동 1.5㎝ 등의 최심 신적설량을 기록했다.    jin34@yna.co.kr    @yonhap_graphics(트위터)영하권에 들어선 추운 날씨에 눈까지 내리자 이날 배달 음식점에는 주문이 폭주했다. 음식점들은 눈길 배달이 위험한 탓에 마냥 웃지만은 못했다.영등포구 한 중국음식점 사장 박모(49)씨는 ""평소보다 주문량이 한 10% 이상 많은 것 같다. 눈이나 비가 오면 배달 손님이 많다""며 ""눈길인 데다 주문이 많아져 평소보다 배달 시간이 20~30분가량 늦어졌다""고 밝혔다.서대문구의 한 치킨집 사장은 ""평소와 주문량이 크게 차이 나지는 않았는데 눈길이라 배달이 어려워 많이 밀렸다""며 ""주문이 들어오면 손님들에게 평소보다 늦어진다고 미리 양해를 구하고 있다""고 말했다.[이 시각 많이 본 기사]☞유시민 ""안철수, 지금은 뭉개고 있을 때 아니다""☞빅뱅 대성, 내년 2월 일본 첫 솔로 앨범 발표☞文측 ""새누리 부산저축銀 소송대리 주장 사실 아니다""☞-프로배구- 현대건설, 도로공사 6연승 저지☞중부지방 폭설에 `엉금엉금'…항공기·여객선 결항도<연합뉴스 모바일앱 다운받기><포토 매거진><저작권자(c)연합뉴스. 무단전재-재배포금지.>"
51,2012-12-05,갈라선 동교동계..대선 국면서 `결별',https://news.naver.com/main/read.nhn?mode=LSD&mid=shm&sid1=100&oid=001&aid=0005973523,연합뉴스,"한화갑 내일 박근혜 지지선언..김옥두, 韓에 서한 ""DJ 통곡할것""(서울=연합뉴스) 송수경 기자 = 한국 현대 정치사에서 고(故) 김대중(DJ) 전 대통령과 영욕을 함께 해온 동교동계가 대선의 길목에서 갈라서게 된 모습이다.한광옥 전 민주당 대표가 지난 10월 새누리당 국민대통합위원회 수석부위원장으로 자리를 옮긴데 이어 한화갑 전 민주당 대표도  6일 박근혜 대선 후보 지지를 공식 선언하는 등 동교동계의 상징적 인물들이 연이어 박 후보 캠프로 합류하면서다.이들 이외에도 이윤수, 안동선 전 의원 등 일부 범동교동계 인사들이 이미 박 후보 캠프에 둥지를 틀었고, 김경재 전 의원은 새누리당 국민대통합위원회 기획담당특보로 활동하고 있다.동교동계는 DJ의 비서출신 인사들이 주축을 이룬 가신그룹으로, 한때 김영삼(YS) 전 대통령의 상도동계와 함께 한국 야당사의 양대 산맥을 이뤄왔다.한광옥, 한화갑 두 전직 민주당 대표의 박 후보 캠프행을 놓고 동교동계는 어수선한 분위기이다.DJ 비서 출신인 김옥두 전 의원은 5일 한화갑 전 대표에게 `동지이자 친구 화갑이, 도대체 어디갔나'라는 제목의 공개서한을 통해 ""현충원에 있는 DJ가 통곡하고 광주 5ㆍ18 묘역의 민주 영령들이 통탄할 것""이라고 착잡한 심경을 쏟아냈다.김 전 의원은 ""우리는 1965년 박정희 정권의 서슬이 퍼렇던 시절에 동교동에 들어와 45년간 한솥밥을 먹어온 사이""라며 ""민주당을 중심으로 뭉쳐 행동하는 양심으로 정권교체를 이루라는 DJ의 유언을 벌써 잊었는가""라고 말했다.그는 ""(민주)당에 대해 서운한 점이 많은 것도 모르는 바는 아니지만 평생 쌓아온 모든 것을 저버리고 갈 수는 없다. 하늘이 두 쪽 나도 박 후보에게는 가지 않겠다고 공언하지 않았느냐""며 ""친구, 이러면 안되지 않는가. 나중에 저 세상에서 무슨 낯으로 대통령님을 뵙겠는가""라고 되물었다.이어 ""정녕 발길을 돌릴 수 없다면 더이상 DJ를 거론하지 말아달라""고 했다.동교동계 좌장격인 민주당 권노갑 상임고문도 전날 DJ의 노벨평화상 수상 12주년 기념행사에서 ""DJ의 뜻에 반하는 길로, DJ가 살아있으면 얼마나 마음 아파했겠느냐""며 ""이희호 여사도 통탄을 금치 못하고 분통해하고 있다""고 전했다.동교동계 인사들은 2009년 8월 DJ의 서거 이후 매주 화요일마다 동작동 국립현충원내 DJ 묘역을 참배해왔으나 한광옥, 한화갑 전 대표의 경우 최근 들어서는 이 `회합'에 불참하고 있는 것으로 전해졌다.민주당은 이들 인사가 이미 탈당하는 등 한차례 동교동을 '배신'했던 인사들이란 점을 들어 동교동계의 대표성이 없는 만큼 이들의 행보에 대한 확대해석을 경계하고 있다.한광옥, 한화갑 전 대표는 지난 4ㆍ11 총선에서 재기를 모색했으나 한광옥 전 대표의 경우 공천을 받지 못한 뒤 정통민주당을 창당했으며, 2010년에 평화민주당을 창당했었던 한화갑 전 대표는 무소속으로 전남 무안ㆍ신안에 출마했지만 모두 낙선했다.동교동계 일각에선 ""친노 당권파의 홀대가 현 상황을 부추겼다""는 불만섞인 목소리도 내놓고 있다. 한 동교동계 인사는 ""가슴이 아프고 참담하다""고 했다.hanksong@yna.co.kr[이 시각 많이 본 기사]☞유시민 ""안철수, 지금은 뭉개고 있을 때 아니다""☞김수현, '해를 품은 달' 홍보차 일본행☞전국 강추위 속 낮부터 최고 10㎝ 많은 눈☞<'코리안 드림' 이어 PGA 투어서도 꿈 이룬 존 허>☞""구속이나 되자"" 선거벽보 훼손한 30대男 검거<연합뉴스 모바일앱 다운받기><포토 매거진><저작권자(c)연합뉴스. 무단전재-재배포금지.>"
52,2012-12-05,"KB금융, ING생명 한국법인 인수 결론 못내",https://news.naver.com/main/read.nhn?mode=LSD&mid=shm&sid1=101&oid=001&aid=0005973530,연합뉴스,"(서울=연합뉴스) 고유선 기자 = KB금융지주가 5일 임시이사회를 열고 ING생명 한국법인 인수안을 논의했으나 결론을 내지 못하고 18일에 이사회를 속개하기로 했다.cindy@yna.co.kr[이 시각 많이 본 기사]☞유시민 ""안철수, 지금은 뭉개고 있을 때 아니다""☞김수현, '해를 품은 달' 홍보차 일본행☞전국 강추위 속 낮부터 최고 10㎝ 많은 눈☞<'코리안 드림' 이어 PGA 투어서도 꿈 이룬 존 허>☞""구속이나 되자"" 선거벽보 훼손한 30대男 검거<연합뉴스 모바일앱 다운받기><포토 매거진><저작권자(c)연합뉴스. 무단전재-재배포금지.>"
53,2012-12-05,"큰 눈 내린 서울시내 도로 온통 '빨간색'…시민들 ""내일이 더 걱정""",https://news.naver.com/main/read.nhn?mode=LSD&mid=shm&sid1=103&oid=079&aid=0002421029,노컷뉴스,"7.8cm 폭설에 서울시내 퇴근길 큰 혼잡…시민들 지하철 등 대중교통으로 몰려[CBS 장규석 기자]5일 저녁, 오후시간대에 7.8cm의 눈이 집중된 서울시내의 교통상황을 한 눈에 보여주는 교통상황판은 대부분 '빨간색' 일색이었다. 눈은 오후 5시쯤 그쳤지만 본격적인 퇴근시간에 접어들면서 저녁 6시부터 서울 시내 도로 곳곳이 큰 혼잡을 빚고 있다.올림픽대로와 강변북로는 양방향이 크게 붐비고 있고, 내부간선도로와 동부간선도로도 평소보다 차량 진행이 늦어지면서 몸살을 앓고 있다. 게다가 오후 5시 들어 올림픽대로와 서울외곽순환도로 등에서 눈길에 미끄러진 추돌사고가 잇따라 혼잡을 더했다.서울에는 이날 정오부터 오후 늦게까지 불과 대여섯 시간만에 7.8cm의 눈이 집중됐다. 곳곳에 눈이 쌓였지만 그나마 간선도로는 지자체의 긴급 제설작업으로 대부분 눈이 녹은 상태다. 하지만 이면도로와 동네 좁은 도로 등은 아직 얼어붙은 곳이 많아 운행에 주의가 요구된다.또 쌓인 눈으로 북악산길 자하문에서 스카이웨이 교차로 구간, 인왕산길 자하문에서 사직공원 입구, 그리고 감사원길 감사원 앞에서 성균관대 후문 구간 등 3곳의 통행이 통제 되고 있다.앞서 서울외곽순환도로 중동나들목과 장수나들목도 긴급 제설작업으로 이날 오후 한때 교통이 통제됐으나 지금은 진입이 가능해진 상태다.한편, 경찰은 낮 1시부터 교통 병호 비상령을 내리고 퇴근길 교통관리에 나섰다. 이날 저녁 서울경찰청 소속 교통경찰관과 교통기동대, 방순대 등 경력 2천 명이 동원돼 교통안전 활동에 나섰다.◈ 차 놓고 온 시민들, 대중교통으로 몰려…지하철 증편운행폭설로 시내 도로가 혼잡을 빚자, 퇴근길 시민들은 교통 정체를 피해 지하철 등 대중교통 수단으로 몰렸다. 이날 저녁 6시 취재기자가 나간 종로구 안국역은 서둘러 퇴근길에 나선 시민들로 크게 붐볐다.평소 자가용을 이용해 영업을 한다는 윤 모(33)씨는 붐비는 지하철을 보면서 ""폭설 소식에 지하철을 타고 출근했는데 출근시간에도 평소보다 사람 많아서 시간이 더 걸렸다""며 ""퇴근시간은 더 복잡할 것 같다""고 말했다.이에따라 서울시는 서울지하철(1~9호선)과 신분당선을 퇴근 시간에 증편(오후 6시~8시) 운행하고 새벽 2시까지 심야 연장 운행을 결정했다인근 버스정류장에도 긴 줄이 늘어섰다. 버스정류장에서 찬바람에 발을 동동 구르던 한 시민은 ""도로가 혼잡해서 버스도 체증을 빚을 것 같다""며 걱정스런 표정을 지었다.일찌감치 퇴근길에 나선 시민들은 하얗게 빙판길이 된 거리 위로 종종걸음을 치면서도, 행여나 넘어지지 않을까 조심스럽게 발걸음을 옮겼다.강추위가 예고된 다음날이 더 걱정인 시민들도 많았다. 회사원 김 모(28)씨는 ""내일 영하 10도로 떨어지는 강추위가 온다는데 길이 얼어붙으면 더 큰 일""이라며 ""내일 볼일까지 오늘 일 마치고 빨리 마치고 깜깜하기 전에 들어가야 할 것 같다""고 퇴근길을 재촉했다.서울시는 ""6일 강추위가 예상돼 눈길이 빙판길로 변할 것으로 보인다""며, ""가급적 대중교통을 이용하고, 집 앞의 눈을 쓸어달라""고 당부했다.hahoi@cbs.co.kr[관련기사]●인천 도로 곳곳 통제…제설작업 총력●서울·중부 눈폭탄 ""집에 어떻게 가나""…발 동동 구르는 시민들●경찰, 폭설에 교통병호 비상 발령…북악산길 교통통제●서울 눈 '펑펑' 대설주의보…최대 10cm 내릴 듯(대한민국 중심언론 CBS  뉴스FM98.1 / 음악FM93.9 / TV CH 412)<저작권자 ⓒ CBS 노컷뉴스(www.nocutnews.co.kr) 무단전재 및 재배포 금지>스마트 뉴스앱의 최강자! 노컷뉴스 APP 다운로드 받기↓"
54,2012-12-05,대설주의보 해제..도로는 빙판길 '거북이 걸음',https://news.naver.com/main/read.nhn?mode=LSD&mid=shm&sid1=103&oid=018&aid=0002697379,이데일리,"[이데일리 이지현 기자]서울과 경기 등 중부지방에 내려졌던 대설주의보가 5일 오후 5시30분을 기해 대부분 해제됐다. 눈구름대는 남부지방으로 이동했다.눈은 그쳤지만 7.8㎝의 기록적인 눈이 쏟아진 서울과 수도권에는 출퇴근길 대란 조짐이 나타나고 있다. 치워도 계속 쌓이는 눈이 도로 전체를 덮으며 버스와 택시 등 차량은 거북이 운전으로 겨우 이동하고 있다. 이 때문에 지하철을 이용하려는 사람들이 한꺼번에 몰리면서 큰 혼잡을 빚고 있다.서울시는 서울지하철(1~9호선)과 신분당선을 퇴근 시간에 증편(오후 6시~8시) 운행하고 새벽 2시까지 심야 연장 운행을 결정했다. 오후 6시~8시 퇴근객이 한꺼번에 몰리더라도 원활하게 수송할 수 있도록 한 것.하지만, 이번 폭설은 6일 아침 출근길에도 영향을 줄 것으로 보인다. 기상청은 이날 밤사이 기온이 큰 폭으로 떨어져 눈이 치워지지 않은 곳은 대부분 빙판으로 바뀔 것이라고 내다봤다.장현식 기상청 통보관은 “도로가 결빙되어 미끄러운 곳이 많을 것”이라며 “차량운행과 보행자 안전에 각별한 주의가 필요하다”고 강조했다.5일 강원 춘천에 기록적인 눈이 쏟아지며 차량들이 거북이 운행을 하고 있다. (뉴시스)"
55,2012-12-05,서울지하철 오늘 30분 연장…내일 출근길 집중배차,https://news.naver.com/main/read.nhn?mode=LSD&mid=shm&sid1=102&oid=001&aid=0005973472,연합뉴스,"(서울=연합뉴스) 이슬기 기자 = 서울시는 5일 내린 폭설로 퇴근길 시민들의 지하철 이용이 늘 것으로 예상됨에 따라 이날 시내 지하철을 30분 연장 운행한다고 밝혔다.시는 종착역 기준으로 막차시간을 6일 오전 1시에서 1시30분으로 연장해 총 46회 증회 운행하기로 했다.평소 오후 6∼8시인 퇴근시간 지하철 집중배차 시간대도 이날 오후 8시30분까지로 30분 늘린다.시는 이어 6일 출근시간 집중배차 시간대도 오전 7시~9시30분으로 평소보다 30분 늘릴 예정이다.시는 6일 기온이 영하권을 유지한다는 기상청의 예보에 따라 삼청동길, 북악산길, 감사원길, 아리랑고개, 미아리고개, 금화터널, 봉천고개, 장춘단 고개, 남산공원길, 만리동고개, 무악재, 북악터널 등 상습결빙구간은 운행하지 말라고 당부했다.시는 또 오르막이나 그늘이 있는 도로는 결빙 구간이 남아있을 수 있으니 통행을 자제하고, 승객 안전상 시내버스 운행경로가 바뀔 수 있는 만큼 120다산콜센터나 트위터(@seoulgyotong) 등을 통해 정보를 확인하라고 덧붙였다.wise@yna.co.kr[이 시각 많이 본 기사]☞전국 강추위 속 낮부터 최고 10㎝ 많은 눈☞김수현, '해를 품은 달' 홍보차 일본행☞유시민 ""안철수, 지금은 뭉개고 있을 때 아니다""☞<'코리안 드림' 이어 PGA 투어서도 꿈 이룬 존 허>☞""구속이나 되자"" 선거벽보 훼손한 30대男 검거<연합뉴스 모바일앱 다운받기><포토 매거진><저작권자(c)연합뉴스. 무단전재-재배포금지.>"
56,2012-12-05,'폭설'에 서울 지하철 막차 1시30분까지 30분 연장,https://news.naver.com/main/read.nhn?mode=LSD&mid=shm&sid1=103&oid=008&aid=0002959900,머니투데이,"[머니투데이 기성훈 기자]서울시는 5일 오후부터 내린 눈으로 인해 퇴근길 많은 시민들이 지하철을 이용할 것으로 예상돼 지하철 막차 운행을 30분 연장키로 했다고 밝혔다.이에 따라 이날 막차시간은 종착역을 기준으로 새벽 1시에서 1시 30분으로 변경된다. 다만 지하철역별로 막차 시간은 다르다.시는 아울러 이날 오후 6~8시, 다음날(6일) 오전 7~9시로 설정된 지하철 출퇴근 시간대를 각각 30분 연장토록 했다.한편 서울시 재난안전대책본부는 이날 오후 5시 현재 제설대책 2단계 비상근무에 돌입, 제설작업을 하고 있다.시는 현재 공무원 6500명과 제설장비 1060대를 동원해 총 5945톤의 소금과 염화칼슘을 도로에 뿌리고 있다. 시는 또 폭설에 대비해 낮 12시 45분부터 북악산실과 인왕산길을 통제하고 있다.[머니투데이 핫뉴스]☞박정희 사저 관리인 ""박근혜 20대 모습은…""☞BMW에 '모태녹차'낙서 후, 망치질까지 '경악'☞""아파트값 1억 올랐다"" 신난 주민들, 왜?☞'발인식' 박근혜, 처음으로 눈물 흘리며…☞'이건희 아들' 부회장 승진…이재용은 누구?[스몰캡 리포트]숨어있는 중소형주 발굴!기성훈기자 ki0301@<저작권자 ⓒ '돈이 보이는 리얼타임 뉴스' 머니투데이, 무단전재 및 재배포 금지>"
