,날짜,기사 제목,기사 링크,기사 출처,기사 내용
0,2012-12-05,공공기관·대형건물 실내 난방온도 20도로 제한… “손·발 시려요” 덜덜 떠는 직장인들,https://news.naver.com/main/read.nhn?mode=LSD&mid=shm&sid1=102&oid=005&aid=0000535233,국민일보,"대기업에 근무하는 정모(26·여)씨는 5일 자신의 사무실에서 쓸 미니 온풍기와 1인용 전기 매트를 구입했다. 집에서 가져온 무릎담요와 실내용 털신으로 추위를 피해 보려 했지만 한기가 느껴져 도저히 일에 집중할 수 없었기 때문이다. 정씨는 “컴퓨터로 보고서를 작성하는데 손이 시리다”며 “에너지 절약도 좋지만 추위에 떠느라 업무에 방해가 될 정도”라고 말했다.공공기관에 근무하는 김모(26·여)씨는 일찌감치 USB로 연결해 사용하는 미니 온열기기를 구입했다. 김씨는 “에너지 사용 제한이 시작된 지난해 추위와 싸웠던 기억이 있어 미리 온열기기를 준비했다”며 “전력난 때문에 별도 온열기기 사용도 금지하고 있어 컴퓨터에 USB를 몰래 연결해 놓고 사용한다”고 말했다.정부가 3일부터 겨울철 에너지 사용 제한 정책을 시행하면서 사무실에 근무하는 직장인들이 추위와 싸우고 있다. 이들은 담요나 핫팩으로도 추위를 쫓을 수 없다며 개인용 온열기기까지 구매해 사용하고 있다.정부는 지난 3일부터 내년 2월 22일까지 겨울 에너지 사용 제한 정책을 실시해 대기업, 백화점, 대형마트, 공공기관 건물의 난방 온도를 20도 이하로 제한하고 있다. 계도기간을 거쳐 내년 1월 7일부터는 위반 시 최대 300만원의 과태료가 부과된다.온열기를 쓰는 직장인이 늘면서 1인용 온열기기 판매량은 지난해에 비해 크게 늘었다. 온라인몰 11번가는 지난달 개인용 보온 제품 매출이 전년 같은 기간 대비 30%, 전월(10월) 대비 200% 상승했다고 밝혔다. 소셜커머스 사이트 티몬도 1인용 온열기기 매출이 전년 같은 기간보다 2배 이상 증가했다고 말했다.그러나 전력 부족으로 에너지 사용 제한 정책은 앞으로도 계속될 수밖에 없어 가정이나 직장에서 속옷을 따뜻하게 입는 습관을 들여야 한다는 목소리가 높아지고 있다. 온(溫)맵시 내복입기운동을 펼치고 있는 새마을운동중앙회 조재범 국민운동부장은 “에너지를 많이 사용해 블랙아웃이 될 때마다 피해액이 11조원이나 된다”며 “내복을 입으면 체감온도가 3도 상승하고 난방 에너지의 20%를 절약할 수 있기 때문에 내복이나 조끼, 덧신, 무릎담요 등을 사용하는 방향으로 의식을 바꿔야 할 것”이라고 말했다.김미나 김유나 기자 mina@kmib.co.kr<GoodNews paper ⓒ국민일보. 무단전재 및 재배포금지>"
1,2012-12-05,"[대풍수]지성-김소연, 러브라인 형성 ‘달달한 모습’",https://news.naver.com/main/read.nhn?mode=LSD&mid=shm&sid1=115&oid=416&aid=0000008294,SBS funE,"[SBS E! 연예뉴스 | 조성필 기자]해인이 지상을 껴안으며 적극적인 애정표현에 나섰다.5일 밤 방송된 SBS 수목극 ‘대풍수’(극본 박상희 남선년, 연출 이용석) 17회에서 과부촌에서 보쌈을 당할 위기에 처한 지상(지성 분)의 모습이 그려졌다. 지상은 과부촌에 음기가 강해진 원인을 찾기 위해 당산나무로 갔다.지상은 “얼어 죽을 지경이요”라며 한기에 몸을 떨었다. 이에 해인은 “이렇게 하면 얼어 죽지 않는다고 말하지 않았소”라며 “체온을 나누니 좀 따뜻하지 않소”라며 추위에 떠는 지상을 껴안았다.지상은 “이거 빨리 음기를 없애는 방법을 찾아야지 해인한테 무슨 일을 당할지 모르겠소”라며 해인을 경계했다. 이에 해인은 지상의 볼에 뽀뽀를 하며 적극적인 애정표현을 했다.[관련기사]▶ '대풍수' 이윤지-송창의, 이렇게 친했나? 화기애애한 촬영장▶ ''대풍수' 이성계, 이 시대가 필요로하는 리더십 보여줄 것'▶ '대풍수' 지성-김소연, 본격 멜로 시작..두근두근 스틸 공개▶ '대풍수' 유하준, 안길강과 백허그 '반전 친분'▶ 지성, '대풍수' 촬영장서 '나의 PS 파트너' 깨알 홍보저작권자 SBS E! & SBS콘텐츠허브 무단복제-재배포 금지"
2,2012-12-05,경찰관의 조용한 선행…뒤늦게 밝혀져 감동,https://news.naver.com/main/read.nhn?mode=LSD&mid=shm&sid1=102&oid=079&aid=0002421068,노컷뉴스,"[포항CBS 김대기 기자]포항 지역 한 경찰관이 아버지의 구속으로 홀로 남겨진 여고생을 보살펴 온 사실이 뒤늦게 알려져 감동을 주고 있다.최근 김기용 경찰청장 앞으로 여고생의 따뜻한 편지 한통이 배달됐다.편지에는 포항북부경찰서 청하파출소 김관해(경위. 현 포항북부경찰서 경무 계장) 소장의 도움에 감사하는 내용이 담겨 있었다.이 편지에 따르면 다수의 전과경력이 있어 막노동 일자리도 구하지 못하던 여고생의 아버지는 지난 해 12월 폭력으로 구속됐고, 홀로 남겨진 여고생(부모 이혼)은 보일러가 작동되지 않고 비가 새는 집에서 먹을 것도 없이 지내야 했다.이같은 사실을 알게된 청하파출소 김관해 소장은 자율방범대와 마을주민과 협력해 보일러를 교체하는 집을 수리해주고, 경찰서 직원 모두가 동참하는 모금운동으로 생필품을 지원했다.김 소장은 이후 교도소에서 출감한 여고생의 아버지를 한 건설업체에서 일할 수 있게 도와주며 부녀가 새로운 삶과 행복의 길을 열어줬다.이같은 사실은 여고생이 “아무것도 할 수 없는 저 대신 파출소장님께 작은 선물을 안겨주세요”라는 편지를 경찰청장에게 보내며 알려지게 됐다.오동석 포항북부경찰서장은 “연말연시를 맞아 어려운 환경에서 생활하는 아이들과 주민들을 한 번 더 생각하는 계기가 됐다”며 “앞으로도 이같은 어려움 속에 살아가는 청소년들이 건전한 사회인으로 자라날 때까지 전 직원들과 함께 지속적으로 돕겠다”고 말했다.kdk@cbs.co.kr[관련기사]●얼굴없는 천사...자선냄비 1억원 기부●가난하지만…'마음 부자'들의 넘치는 온정●청소부들의 이웃사랑●자신의 간 떼어내 아버지 살린 여대생(대한민국 중심언론 CBS  뉴스FM98.1 / 음악FM93.9 / TV CH 412)<저작권자 ⓒ CBS 노컷뉴스(www.nocutnews.co.kr) 무단전재 및 재배포 금지>스마트 뉴스앱의 최강자! 노컷뉴스 APP 다운로드 받기↓"
3,2012-12-05,들이고 싶은 유럽 인테리어 스타일,https://news.naver.com/main/read.nhn?mode=LSD&mid=shm&sid1=103&oid=145&aid=0000010304,레이디경향,"버리기보다 고치는 것을, 새것보다 오래된 것에 가치를 두고 매력을 느끼는 유럽인들. 자연과 함께할 줄 알며 특유의 색채 감각과 디자인 감성을 갖춘 유러피언들이 살고 있는 집을 세 권의 책을 통해 구경해보자. 그들처럼 꾸준히 다듬고 꾸미면 우리 집도 유럽 스타일이 될 수 있다.Style 1 Vintage환경 의식이 강하며, 부모가 물려준 가구나 벼룩시장에서 구입한 고미술품 등을 헌 것이라기보다 자신의 취향을 잘 드러내주는 오브제로 여기는 유럽인들에게 빈티지 컨셉트는 오래전부터 클래식이라는 스타일로 전해져왔다. 최근에는 예술가나 디자이너들이 재활용품을 이용한 건축과 가구들을 선보이며 빈티지풍이 다시금 주목받고 있다. 추억을 함께해온 물건을 활용해 재기발랄한 아이디어로 독특한 빈티지 스타일을 선보인 사례를 소개한다.1 오래된 것의 ‘멋’이 살아 있는 거실파리의 패브릭 디자이너인 집주인이 버려진 건축자재로 꾸민 거실 겸 작업공간. 마치 폐품으로 만든 집처럼 집 안에 있는 가구는 조부모에게 물려받거나 오래된 병원에서 가지고 온 것들로, 모두 새것이 아니다. 남성 특유의 거칠지만 견고하고 구조적인 멋이 돋보이는 공간.2 버려진 것을 재활용한 독특한 분위기의 다이닝룸영화 크레디트 제작 디자이너의 다이닝룸으로, 낡고 밋밋한 아파트 주방에 흔한 샹들리에 대신 특수 조명을 설치해 독특한 분위기를 완성했다. 공사장에서 주운 나무판자 등의 목재로 식탁을 만든 뒤 시골 별장에서 구해온 1인용 의자와 기다란 벤치를 더해 각각의 개성이 돋보이면서도 조화를 이룬 공간을 연출했다.3 멋과 실용성 두 마리 토끼를 잡은 주방1970년대 원단 가게에서 원단 뭉치를 올려놓고 자르던 작업대를 집에 들여와 오븐과 가스레인지를 빌트인했다. 작업대 안의 빈 공간에는 선반을 설치하고 그릇 등의 주방용품을 정리해 멋과 실용성을 동시에 챙긴 것 또한 훌륭한 아이디어.Style 2 Natural자연과 함께하는 마인드가 강한 유럽인들은 건축자재나 가구를 선택할 때 나무를 비롯한 자연 재료에 강한 애착을 보이는 편이다. 낮은 층과 군더더기 없는 단출한 구조, 자연스러운 나무 색감 등은 자연을 거스르는 현대 건축물에서는 느낄 수 없는 안락함과 여유를 준다.1 절제의 미를 표현한 거실천연 목재는 매우 핀란드적인 소재라 할 수 있다. 유럽에서 나무를 가장 많이 생산하는 나라가 핀란드이기 때문. 핀란드의 한 가정집 안에서 유일하게 다른 소재는 검은색 슬레이트 벽난로와 그 주변 바닥, 계단뿐이다. 나무의 컬러와 블랙이 이루는 뚜렷한 대조와 공간을 활용하기 위해 설치한 붙박이장 또한 돋보인다.2 액자 같은 두 개의 창문이 자연의 아름다움을 전하는 침실스웨덴의 오두막집으로 침실의 창을 옆으로 길게, 창틀은 깊숙하게 만들어 책장으로도 사용할 수 있도록 했다. 두 개의 창은 집 주변의 아름다운 풍광을 다양한 각도에서 감상할 수 있도록 한 배려다.3 색다른 공간 해석을 적용한 주방과 베란다젊은 셰프 부부의 집으로 주방을 베란다와 가까이 배치해 요리와 식사 시간을 좀 더 특별하게 만들었다. 높은 천장과 독특한 구조 때문에 집주인을 쉽사리 찾지 못했던 공간은 부부의 자유로운 공간 배치와 수납 방식으로 효율성을 갖추게 됐다.4 오두막집에 놀러온 듯한 기분을 선사하는 아이 방아이들의 로망인 이층 침대를 프로방스풍의 다락방 구조로 실현했다. 침실뿐 아니라 놀이공간, 공부방으로 다양하게 활용할 수 있다. 다락에 오르면 특유의 안락함이 느껴지며 프라이버시도 보장된다.Style 3 Colorful북유럽은 겨울이 유난히 길고 춥기 때문에 이곳 사람들은 예부터 집에서 생활하는 시간이 길어 다양한 색감으로 집 안에 생동감을 불어넣는 것을 즐겼다. 그러한 조상들의 지혜는 현대까지 이어져 전 세계인의 ‘It Style’이 됐다.대비되는 컬러를 마주하고 여러 가지 패턴을 자유롭게 매치하는 것이 북유럽인들의 컬러 활용법이다.1 실용성과 장식미를 동시에 구현해낸 코너 공간이미지 작업을 해야 하는 콘텐츠 기획자인 집주인의 아이디어가 빛나는 공간으로, 사진을 돋보이게 장식할 수 있는 보색 대비 벽을 설치했다. 사진은 마스킹테이프를 이용하거나 리본으로 연결하면 쉽게 떼고 붙일 수 있어 편리하다.2 작품 세계와 인생관을 드러낸 주방화가인 집주인의 전시공간이자 작업공간인 주방. 예술 작품을, 그것도 자신이 만든 작품을 주방에 들여놓을 수 있는 사람이 몇이나 될까? 여기에 생명력을 상징하는 레드 컬러 싱크대로 강렬함을 더했다. “주방은 한 가정의 심장이다”라는 것이 집주인의 생각이다.3 가장 ‘스웨덴다운’ 다이닝룸과 거실스웨덴의 유명 건축가가 집을 짓고 유명한 디자이너들이 인테리어에 참여했다는 집. 그래서인지 가장 스웨덴적인 컬러와 구조가 돋보인다. 모든 가구와 소품은 스웨덴 작가와 디자이너가 만든 것으로, 나무와 화이트 컬러에 정점을 찍는 레드와 그린 포인트가 강한 인상을 준다.4 컬러 수납장으로 경쾌해진 주방과 거실 사이주방과 거실 사이에 장식장을 설치해 공간을 분할하는 동시에 수납공간을 확보했다. 특히 몬드리안의 그림을 연상시키는 수납장이 집 안 분위기를 한결 밝고 생동감 있게 표현해준다.유럽 인테리어를 친절하고 재미있게 알려주는 세 권의 책살고 싶은 북유럽의 집소박하면서도 우아하고, 실용적인 스칸디나비아 스타일로 꾸민 핀란드, 덴마크, 스웨덴, 노르웨이의 집을 소개하며 그 집의 건축 과정과 배경까지 다뤘다.사라 노르만 외 저, 유지연 옮김, 1만8천원, 북하우스앤.파리지엥의 주방깔끔한 주방을 가진 프랑스인 시어머니 곁에서 한국인 며느리인 저자가 프랑스 주방 문화를 10년 이상 관찰하며 나만의 주방을 직접 만든 사람들의 공간을 찾아갔다. 오윤경 저, 1만6천8백원, 동녘라이프.행복한 집짓기어릴 적부터 인형 옷을 만들기보다 인형이 사는 집을 만드는 데 더 흥미를 느낀 저자가 직접 프로방스와 독일식 집을 시공하고 꾸민 실제 사례를 소개한다. 정혜정 저, 1만2천8백원, 나무수.＜■진행 / 김성실(객원기자) ■자료&사진 제공 / 나무수(02-3443-0311), 동녘라이프(031-955-3004), 북하우스앤(02-3144-3123)＞"
4,2012-12-05,‘윈도우8’이 숨겨둔 유용한 기능 4가지,https://news.naver.com/main/read.nhn?mode=LSD&mid=shm&sid1=105&oid=293&aid=0000010707,블로터,"윈도우 운영체제(OS)의 기본 응용프로그램은 유용하면서도 자주 쓰이는 것만 있는 건 아니다. 잘 쓰지 않는 통에 평소 있는지도 모르고 지나치는 응용프로그램도 적잖다. 자주 찾지 않으니 어디 있는지도 모르고, 어디 있는지 몰라서 필요할 때 손해 보는 그런 응용프로그램 말이다.사용설명서에 나와 있다면 좋겠지만, 방대한 윈도우 OS의 A부터 Z까지 모두 섭렵할 수는 없는 노릇. 잘 쓰이지는 않지만, 알아두면 언젠가는 꼭 도움되는 기능들. 마이크로소프트가 새로 출시한 '윈도우8'엔 어떤 기능이 감춰져 있을까. 사용설명서에는 없는 윈도우8의 알찬 기능을 찾아보자.디스플레이 색 보정색깔이 예뻐 보여 인터넷으로 옷 한 벌 구입했더니 막상 집에 도착한 옷 색깔을 보고 실망했던 경험은 흔하다. 디카로 친구 사진을 찍은 후 나름대로 예쁘게 만들어 주고 싶어 포토샵으로 색상을 보정해 e메일로 전송했는데, 얼굴색이 이게 뭐냐며 핀잔을 들었을 사용자도 있겠다. 다른 모니터로 보는 색깔과 내 모니터로 보는 색깔이 다르기 때문에 겪는 일이다. 이때는 윈도우8의 기본 기능 중 하나인 '디스플레이 색 보정' 기능을 이용해보자.윈도우8 홈 화면(윈도우8스타일UI)에서 오른쪽 '참' 메뉴를 열어 '검색' 기능을 실행한다. 검색 분야를 '설정'으로 선택하고, 우리말로 '디스플레이 색 교정'이라고 검색하거나 영문으로 'calibration'이라고 입력하면 된다. 한 가지 팁이 있다면, 윈도우8 홈 화면에서는 글자를 입력하면 바로 검색 기능이 실행된다. 편리한 방법으로 검색하면 된다.디스플레이 색 보정 기능으로 손볼 수 있는 항목은 크게 5가지다. 감마값 조절과 밝기, 대비, 색 밸런스, 그리고 문자의 클리어타입 설정 등이다. 예를 들어 모니터 감마값은 화면에 전송되는 빛의 삼원색, 즉 빨강과 파랑, 녹색이 어우러져 최종적으로 모니터의 빛의 양을 결정하는 값을 뜻한다. 공장에서 막 생산돼 사용자 손에 전달된 제품은 일반적으로 적당한 값으로 설정돼 있는 것이 일반적이지만, 모니터 설정 값이 뒤틀려 있는 경우도 종종 있다. 디스플레이 색 보정 기능은 이때 쓰면 좋다.디스플레이 색 보정 기능은 특히, 사진이나 동영상 등 이미지를 자주 다루는 사용자에게 도움되는 윈도우8의 기본 기능이다. 사진이 업인 전문 사용자는 모니터 캘리브레이션 전용 도구를 따로 구입해 이용할 정도다. 카메라로 찍은 물체의 색깔을 모니터로 정확하게 파악해야 하기 때문이다. 이미지 작업과 관련이 없는 일반 사용자도 모니터 색상 표현 설정을 점검하는 게 좋다. 인터넷에 있는 사진 색깔을 최대한 사실에 가깝게 구분해야 하는 것은 전문 사용자만 필요한 기능은 아니다.△디스플레이 색 보정 기능팬 또는 터치식 입력에 대해 화면 보정윈도우8이 기존 윈도우 OS와 비교해 가장 크게 달라진 점이 바로 터치 디스플레이를 지원하도록 디자인됐다는 점이다. 윈도우8에서 만큼은 터치 입력이 키보드나 마우스를 이용한 입력만큼 중요하다. 터치 입력이 제대로 작동하지 않으면 윈도우8을 이용할 때 불편하다. 이때는 '팬 또는 터치식 입력에 대해 화면 보정' 기능을 이용해보자. 터치한 지점이 제대로 선택되지 않고, 입력이 다른 부분으로 어긋나는 문제가 있을 때 꼭 필요한 보정 기능이다.기능을 찾아가는 방법은 디스플레이 색 보정 기능과 똑같다. 홈 화면의 참 메뉴에서 검색 기능을 실행하고, 검색 영역을 '설정'으로 선택한다. '펜 또는 터치식 입력에 관한 화면 보정'을 찾아 들어가면 된다. 펜 또는 터치식 입력에 관한 화면 보정 메뉴를 선택하면, 데스크톱 모드에서 '태블릿 PC' 설정 대화창이 나타난다. 펜이나 터치 입력 중 어떤 부분을 수정할 것인지 선택한 후 '보정' 버튼을 누르면 된다.터치 입력에 관한 화면 보정 과정은 무척 단순하다. 화면 구석에 나타난 십자 표시를 손가락이나 펜으로 터치하면 된다. 화면에 표시된 지점을 사용자가 정확하게 입력하는지 판단하는 과정이다. 총 16개의 십자 표시를 정확하게 누르면 터치 포인트 보정 과정이 끝난다.터치 포인트 기본값은 일반적으로 사용자가 윈도우8을 쓰다가 뒤틀리는 일은 드물다. 팬 또는 터치식 입력에 대해 화면 보정 기능은 새 터치형 모니터를 연결했을 때 쓰면 도움이 된다. 물론, 터치 입력에 관한 보정 기능이니 일반 데스크톱 환경에 윈도우8을 설치한 사용자는 쓸 필요가 없다. 터치 디스플레이가 적용된 윈도우8 하이브리드 노트북 사용자나 터치형 모니터를 갖춘 사용자를 위한 기능이다.△터치 입력 보정 기능단계 레코더윈도우8이나 특정 응용프로그램을 이용하는 방법을 사진으로 기록하려는 블로거, 혹은 다른 이에게 캡처 화면을 통해 특정 기능을 알려주려는 사용자가 쓰면 좋은 기능이 윈도우8에 추가됐다. '단계 레코더'는 윈도우를 이용하는 과정에서 마주치는 대화형 팝업창을 단계마다 사진으로 기록해 주는 도구다. 그동안 모든 대화창의 진행 과정을 일일이 캡처해 말로 설명하던 사용자나 ""확인 버튼을 계속 누르세요""라는 설명으로 대신했던 사용자가 특히 반길만한 기능이다.홈 화면 참 메뉴의 검색 기능을 실행하고, 검색 영역을 '앱'으로 설정한다. 검색어는 '단계 레코더'다. 단계 레코드를 실행하면, 작은 캡처 응용프로그램이 실행된다. 메뉴도 단순해 이용하기 쉽다. '녹화 시작'과 '녹화 중지', '설명 추가'가 단계 레코더의 기능 전부다.'녹화 시작' 버튼을 누르면, 사용자가 앞으로 실행하는 모든 화면을 단계별로 캡처해준다. 어떤 영역에서 사용자가 어떤 버튼을 클릭했는지까지 별도의 영역으로 지정해 표시해준다. 초록색 네모 칸으로 클릭한 부분의 영역을 알려주는 식이다.예를 들어 어떤 응용프로그램을 설치하는 과정을 설명하려면, 설치파일을 실행하기 전 단계 레코더의 녹화 시작 버튼을 누른다. 설치 파일을 실행하고, 대화창의 '다음' 버튼이나 체크박스 버튼, '동의', '확인' 버튼 등을 누르면 된다. 대화창에 입력하는 동안 사용자는 그림이 어떻게 캡처 되고 있는지 신경 쓰지 않아도 된다.캡처 화면으로 기록하고자 하는 과정이 끝나면 녹화 중지 버튼을 누르면 그만이다. 저장하면, 압축파일(zip)로 모든 그림을 저장해준다. 압축파일로 저장한 캡처 기록을 공유해도 되고, 바로 e메일로 전송할 수 있어 편리하다.△단계 레코더화면 구석에서 마우스 오른쪽 클릭화면 구석에서 마우스 오른쪽 클릭으로 실행할 수 있는 기능은 따로 구현된 응용프로그램은 아니다. 눈에 보이지 않는 윈도우8의 기능이라고 설명하는 편이 옳다.홈 화면이나 데스크톱 모드에서 마우스 커서를 화면 왼쪽 구석에 가져간 후 오른쪽 클릭을 해보자. 옛 윈도우 OS에서 볼 수 있었던 '시작 버튼'과 비슷한 기능을 하는 대화창이 나타나는 것을 확인할 수 있다. '제어판' 기능은 물론 '장치 관리자'나 '디스크 관리자' 등 제어판 속에서 일일이 찾아 들어가야 볼 수 있는 메뉴까지 한 번에 이용할 수 있다.'프로그램 및 기능'을 누르면 사실상 옛 윈도우의 '시작 버튼'을 쓰는 것과 똑같은 기능을 쓸 수 있다. 이밖에 '탐색기'나 '실행' 등 친숙한 기능이 옹기종기 모여 있으니 아직 윈도우8의 홈 화면 사용이 어색한 사용자가 쓰면 좋다.반대로 화면 오른쪽 밑 구석에서 마우스 오른쪽 버튼을 누르면 바탕화면으로 바로 빠져나갈 수 있는 '바탕화면 보기' 기능을 활성화할 수 있다.화면 구석에서 마우스 오른쪽 클릭으로 동작한다는 점에서 이 기능은 터치형 기기에서 윈도우8을 쓰는 사용자에게 어울리는 기능은 아니다. 기존 데스크톱 환경에서 윈도우8을 쓰는 사용자에게 도움이 된다.△화면 왼쪽, 오른쪽 밑 구석에 마우스 커서를 가져간 후 오른쪽 클릭오원석 기자 sideway@bloter.net"
