,날짜,기사 제목,기사 링크,기사 출처,기사 내용
131,2012-12-05,치료재료 단가 부풀려 건보요양급여 수십억 챙긴 병원장 적발,https://news.naver.com/main/read.nhn?mode=LSD&mid=shm&sid1=102&oid=003&aid=0004862867,뉴시스,"【서울=뉴시스】박성환 기자 = 서울경찰청 광역수사대는 5일 치료재료의 가격을 부풀리는 수법으로 국민건강보험 요양급여를 과다 청구해 수십억원의 부당이득을 챙긴 병원장 변모(50)씨 등 4개 병원 관계자 20명을 사기 등 혐의로 불구속 입건했다.변씨 등은 지난 2010년 1월부터 지난해 9월까지 납품업체로부터 10만~33만원에 구입한 요실금 치료재료를 서류상으로만 존재하는 이른바 '페이퍼컴퍼니'를 통해 57만원에 구입한 것처럼 서류를 꾸며 요양급여를 청구해 18억3000만원 상당의 부당이득을 챙긴 혐의를 받고 있다.경찰 조사결과 이들은 친인척 명의의 페이퍼컴퍼니 9개를 설립한 뒤 여러 유통 단계를 거쳐 치료재료를 구입한 것으로 서류를 꾸며 국민건강보험 청구 상한액인 57만2000원에 구입한 것으로 세금계산서 등을 허위로 작성한 것으로 드러났다.경찰 관계자는 ""이들이 페이퍼컴퍼니를 이용해 공단 보험금을 높게 신청해 부당이득을 챙겼다""며 ""공단이 병원에서 구입한 치료재료의 단가만을 확인한다는 사실을 알고 이를 악용했다""고 말했다.경찰은 국민건강보험공단에 허위 보험금 청구 사실을 통보하는 한편 요양급여 비용청구 상한액을 하향 조정할 방침이다.sky0322@newsis.com[뉴시스 이시간 핫 뉴스]ㆍ ´일본해´ 논란, 우체국·아시아나·하이마트도?ㆍ 뉴욕 지하철역서 한인 고의로 떠밀려 사망ㆍ 보라스 ""류현진, 日에서 뛸 수도 있다""ㆍ 수술비 걱정하던 30대 가장 아파트서 투신ㆍ ´氣치료´ 빙자 신도 딸 성폭행한 승려 구속★ 손 안에서 보는 세상, 모바일 뉴시스★ “우리 결혼합니다” 뉴시스 웨딩알리미 ‘두리’<저작권자ⓒ 공감언론 뉴시스통신사. 무단전재-재배포 금지.>"
132,2012-12-05,다크서클은 ‘눈그늘’ 웹진은 ’누리잡지’…킬힐은?,https://news.naver.com/main/read.nhn?mode=LSD&mid=shm&sid1=103&oid=032&aid=0002280203,경향신문,"국립국어원 말다듬기위원회는 ‘웹진’(webzine)의 순화어로 ‘누리잡지’를 선정했다고 5일 밝혔다.웹진은 영어 ‘월드 와이드 웹(world wide web)’과 ‘잡지(magazine)’의 합성어로 종이책으로 출판하지 않고 인터넷상으로만 발간하는 잡지를 일컫는다. 국립국어원은 말터 누리집(http://www.korean.go.kr)을 통해 일상에서 흔히 쓰는 외국어를 대신할 순화어를 일반인을 대상으로 공모하고 있다.순화어로 최종 선정된 말을 최초로 제안한 사람 등에게는 상품권을 준다. 현재 ‘워킹푸어(working poor)’와 ‘하우스푸어(house poor)’를 대신할 순화어를 각각 공모하고 있다. 그동안 ‘가십거리’는 ‘입방아거리’, ‘갈라쇼’는 ‘뒤풀이공연’ 등으로 각각 다듬어졌다.‘다크서클’은 ‘눈그늘’, ‘더치페이’는 ‘각자내기’, ‘러브콜’은 ‘부름공세’, ‘멘토’는 ‘(인생)길잡이’, ‘비트박스’는 ‘입소리손장단’, ‘샘플러’는 ‘맛보기묶음’, ‘소셜네트워크서비스(SNS)’는 ‘누리소통망(서비스)’, ‘스팸메일’은 ‘쓰레기편지’, ‘스펙업’은 ‘깜냥쌓기’, ‘아이쇼핑’은 ‘눈길장보기’, ‘엑스파일’은 ‘안개문서’, ‘치킨게임’은 ‘끝장승부’, ‘킬힐’은 ‘까치발구두’, ‘풀옵션’은 ‘모두갖춤’, ‘헤드셋’은 ‘통신머리띠’, ‘후카시’는 ‘폼재기’, ‘히키코모리’는 ‘폐쇄은둔족’이 각각 순화어로 선정됐다.2004년부터 현재까지 다듬은 말들은 말터 누리집과 국립국어원 누리집(www.korean.go.kr)에서 찾아볼 수 있다.<김향미 기자 sokhm@kyunghyang.com>경향신문 ‘오늘의 핫뉴스’▶ 서울 강남 대로변 극장 앞 살인…조폭두목, 결국▶ 안철수 “나는 합리보수, 온건진보 아우르는 입장”▶ 법무부, 대검 차장·중수부장 전격 교체▶ 일본 극우 말뚝테러범, 이번엔 문재인에게 말뚝 보내▶ [화보]소녀시대 ‘뭘 입어도 패셔니스타’모바일 경향 [경향신문|경향뉴스진] | 공식 SNS 계정[경향 트위터][미투데이][페이스북][세상과 경향의 소통 Khross]- ⓒ 경향신문(www.khan.co.kr), 무단전재 및 재배포 금지〈경향신문은 한국온라인신문협회(www.kona.or.kr)의 디지털뉴스이용규칙에 따른 저작권을 행사합니다.〉"
133,2012-12-05,<'이유있는 매진대박'…홈쇼핑도 '가치소비'>(종합),https://news.naver.com/main/read.nhn?mode=LSD&mid=shm&sid1=101&oid=001&aid=0005971632,연합뉴스,"불황에도 예상밖 조기매진 상품 찾아보니…(서울=연합뉴스) 정주호 설승은 기자 = 홈쇼핑업체에는 시간이 곧 돈이다. 물리적 판매공간이 없으니 고객의 시청대 시간을 살펴 24시간이라는 한정된 판매시간을 얼마나 효과적으로 활용하느냐가 실적의 관건이 된다.상품마다 주어진 방송시간 내에 준비된 수량을 조기에 모두 판매하게 되면 절약된 방송시간에 또다른 상품을 판매해 새로운 실적을 내는 것이 가능해진다.5일 홈쇼핑업계에 따르면 불경기에 소비자들이 선뜻 지갑을 열기 어려운 고가의 프리미엄 제품임에도 단시간에 매진되는 '예상밖 대박 행진'이 잇따르고 있다.불황기를 맞은 유통업계에서 홈쇼핑이 상대적으로 승승장구하는 이유이기도 하다.업체들의 상품기획력이 뛰어난 것도 있지만 홈쇼핑의 소비트렌드에 '가치소비'가 자리잡았기 때문인 것으로 업계는 분석하고 있다.가치소비란 질 좋은 제품을 보다 합리적인 가격에 구매하려는 꼼꼼한 소비 행태를 말한다. 가치가 있다고 생각되면 다소 비싸다고 해도 과감히 돈을 투자한다.◇고가 제품도 '척척' = 최근 홈쇼핑에서 수십만원대 화장품이나 100만원이 훌쩍 넘는 밍크코트 같은 고가 상품이 방송이 끝나기도 전에 다 팔리는 모습은 어렵지 않게 찾아볼 수 있다.불황이라며 어려움을 호소하는 백화점과 비교되는 장면이다.CJ오쇼핑은 지난달 13일 30만원대 100% 캐비아 성분 화장품 '르페르'를 판매, 방송시간을 20분 남겨두고 매진을 시켰다. 이날 매출은 7억원을 넘겼다.이 회사가 판매하는 화장품 중 최고가지만 제품 성분에 신뢰감을 느낀 소비자들이 구매를 많이 한 것으로 분석된다.3월에는 패브릭 디자이너 장응복의 침구 브랜드 '복'을 편성, 타제품보다 3~4배 비싼 40만원대지만 방송 35분만에 매진시켰다.'홈쇼핑 고객은 보수적일 것'이라는 고정관념을 넘어 세련된 제품을 과감히 선보인 것이 '대박 요인'으로 꼽힌다.조기 매진으로 남은 방송시간에 틈새상품을 팔아 올리는 매출도 짭짤하다.CJ오쇼핑은 상품이 매진되면 계절과 고객 나이에 구애받지 않는 쌀 등 곡물을 편성, 수천만원의 추가 매출액을 덤으로 올리고 있다.CJ오쇼핑의 한 관계자는 ""구매력 있는 고객들에게 제품의 품질을 강조해 구매를 이끌어내고 있다""며 ""홈쇼핑 충성도가 높은 중장년의 구매력은 위축되지 않아 이들을 겨냥한 제품이 늘고 있다""고 말했다.◇'가치 소비자'들 지갑 열어 = 불황이지만 가격과 만족도를 꼼꼼하게 따지는 가치소비족들의 소비 행태는 두드러진다.GS홈쇼핑은 10월 홈쇼핑에서 보기 드문 고가 침구 세트를 판매해 히트를 쳤다.이날 판매된 '헝가리산 거위털 침구 풀세트'는 킹사이즈 109만원, 퀸사이즈 99만원 이었지만 목표치의 2배에 달하는 10억원의 매출을 기록했다.'민음사 세계문학전집 300권'은 149만9천원이었지만 방송 중 매진됐다.이들 제품은 100만원대지만 시중 판매가의 절반 수준에 판매했다는 공통점이 있다.안선영 GS샵 침구 담당 과장은 ""불황에 100만원대 제품이 과연 팔릴까 의구심이 들었던게 사실""이라며 ""가격 거품을 줄이고 기능을 강화한 프리미엄 상품에는 소비자들이 기꺼이 지갑을 열었다""고 전했다.롯데홈쇼핑이 이달 3일 백화점 가격보다 저렴한 값(159만원)에 내놓은 진도 밍크코트는 방송 30분만에 동났다.현대홈쇼핑은 지난달 명품 전문 '클럽 노블레스' 특집방송에서 20~22일 3일동안 28억5천만원 어치를 판매하는데 성공했다.특히 10만~30만원대 '펜디'와 '에트로' 가방, 30만원대 오일릴리 패딩, 100만원대 에트로 의류 등이 매진 행렬을 이었다. 프라다와 버버리 등 신상품을 10~20% 할인해 선보인 방송도 호응이 좋았다.김정훈 현대홈쇼핑 명품 상품기획자(MD)는 ""경기 불황에 명품을 홈쇼핑에서 실속있는 가격에 구입하려는 고객들이 많아졌다""고 말했다.◇최신 트렌드에 맞추니 '불티' = 최신 트렌드를 반영한 상품을 발빠르게 선보이자 역시 인기몰이를 하고 있다.배우 고소영이 신혼여행에서 돌아오면서 신어 유명해진 신발 '아쉬'는 40만원에 육박하는 가격에도 이달 10일 분당 최고매출 7천만원을 기록하며 28분만에 모든 물량이 팔렸다.롯데홈쇼핑은 가두 매장에서 인기를 끌고 있는 디자이너 패션·잡화 브랜드 '나무하나'를 지난달 21일 처음 선보였다.제품 가격은 10만~20만원이지만 첫 방송에만 9억4천만원의 매출을 달성하며 히트상품 대열에 합류했다.고가지만 유행에 민감한 소비자들의 욕구를 빠르게 파악한 것이 주효한 것으로 보인다.싱글족의 라이프스타일을 겨냥한 제품도 인기다.현대홈쇼핑이 판매한 '빅마마 이혜정의 깜짝 스프'는 지난달 16일부터 세 번에 걸친 방송 모두 매진이었다.물만 부으면 되는 즉석 조리 식품으로 요리연구가 이혜정 씨를 앞세워 몸에 좋은 영양소를 담아 한끼 식사가 가능하다고 강조, 지금까지 9억6천만원의 매출을 올렸다.이 회사는 앞서 국민 간식인 돈가스 '도니도니 돈까스'를 기획, 15회에 걸쳐 매진 사례를 기록했다.박경호 현대홈쇼핑 식품 MD는 ""치열한 홈쇼핑 시장에서는 고객의 수요를 빨리 발견하고 최신 트렌드와 가치를 잘 반영한 제품만이 살아남는다""고 말했다.◇올해 히트 상품은 '실속' = 한편 각 홈쇼핑은 이날 올해 가장 많이 팔린 상품 10개를 선정해 발표했다.여기에는 10만원 내외의 실속형 뷰티·패션상품이 대부분을 차지했다.GS샵에서는 해외 패션잡화 브랜드 모르간이 약 50만개를 판매하며 1위를 차지한 것으로 집계됐다. 이 제품은 작년에는 2위에 올랐었다.바지와 레깅스 3~4종을 묶어 7만~9만원대에 팔았던 뱅뱅바지가 2위, 셀프 염색약 버블비가 3위에 올랐다. 아이디어 상품인 한경희 진동파운데이션은 26만개가 팔려 6위로 조사됐다.CJ오쇼핑은 올해 히트상품 키워드로 F4(여성·패션·편리성·기능성)를 선정했다. 특히 하반기에 패션상품이 약진해 10개 중 7개가 의류였다.입큰 진동파운데이션(54만개)이 1위, 피델리아 속옷(41만개)이 2위, 아이오페 에어쿠션(39만개)이 3위를 차례로 차지했다.'지오송지오'(5위), '엣지'(7위), '끌로엘제이'(8위) 등 디자이너 패션 브랜드도 많이 판매됐다.롯데홈쇼핑에서는 실속형 생활용품이 인기를 끌었다.30만개가 팔린 세탁세제 '퍼실'이 1위에 올랐다. 여성용품 바디피트(12만5천개·8위), 샴푸 려(11만5천개·9위)를 비롯, 생활용품은 3품목이나 10위안에 들었다.현대홈쇼핑에서는 연예인과 합작한 제품이 많이 팔렸다.의류인 '김성은의 라뽄떼'는 66만2천개가 팔려 1위에 올랐다. '하유미의 셀더마 마스크팩'과 '정형돈의 도니도니돈까스'가 2, 3위로 각각 집계됐다.이밖에 의류인 '현영의 에스라린'(5위)과 '변정수의 엘라호야'(7위)도 좋은 성적을 거뒀다.jooho@yna.co.krses@yna.co.kr[이 시각 많이 본 기사]☞<이정희 ""박근혜 떨어뜨리려 출마""..시종 맹폭>☞한상진 ""이번엔 왕이라기에 농담인줄 알았죠""☞헌정 사상 첫 재외국민 대선 투표 시작☞존 허, 아시아 최초로 PGA 투어 신인왕 수상☞<대선후보 첫 TV토론 전문가 반응><연합뉴스 모바일앱 다운받기><포토 매거진><저작권자(c)연합뉴스. 무단전재-재배포금지.>"
134,2012-12-05,삼성전자 이재용 사장 부회장으로 승진 (종합),https://news.naver.com/main/read.nhn?mode=LSD&mid=shm&sid1=101&oid=079&aid=0002420718,노컷뉴스,"[CBS 신동진 기자]삼성은 5일 부회장 승진 2명, 사장 승진 7명, 이동·위촉업무 변경 8명 등 총 17명 규모의 2013년 정기 사장단 인사를 내정, 발표했다.이번 사장단 인사 배경을 살펴보면, 이재용 삼성전자 부회장은 글로벌 경영감각과 네트워크를 갖춘 경영자로서 경쟁사와의 경쟁과 협력관계 조정, 고객사와의 유대관계 강화 등을 통해 스마트폰·TV·반도체·디스플레이 사업이 글로벌 1위를 공고히 하는 데 큰 기여를 했다.특히 이재용 부회장은 글로벌 경쟁사들이 심각한 경영난을 겪는 어려운 환경 속에서도 최전선에서 삼성전자의 경영 전반을 지원, 창립 이래 최대 경영성과를 올리는 데 기여했다. 이재용 부회장은 앞으로 삼성전자의 사업 전반을 현장에서 더욱 강하게 지원한다는 계획이다.박근희 삼성생명 대표이사 부회장은 2011년 삼성생명 대표이사 사장으로 부임한 후 사업전반에 대한 폭넓은 경영안목과 추진력으로 공격적인 영업을 전개, 시장지배력을 확대함으로써 제 2의 도약을 이끌어 왔다.이돈주 삼성전자 무선사업부 전략마케팅담당 사장은 가전, IT 등 다양한 전자제품의 해외영업을 담당한 영업통으로, 갤럭시 시리즈를 비롯한 혁신제품과 차별화된 마케팅을 통해 휴대폰과 스마트폰 사업을 글로벌 1위에 올려 놨다.홍원표 삼성전자 미디어 솔루션센터장 사장은 2009년 무선사업부 상품전략팀장으로 부임한 후 통신과 모바일 산업에 대한 전문성과 폭넓은 안목으로 차별화된 상품전략을 적극 전개, 휴대폰 사업 일류화에 기여했다.박원규 삼성코닝정밀소재 대표이사 사장은 지속적인 기술혁신을 통한 대면적 박판화로 LCD용 기판유리의 고부가화를 주도했고, OLED용 기판유리 양산에도 성공한 세계 최고의 유리성형 제조 전문가다. 박원규 사장은 차별화된 기술력으로 기판유리 사업의 고도화는 물론, 신사업 추진을 가속화할 적임자로 평가되고 있다.박대영 삼성중공업 대표이사 사장은 2010년 조선소장으로 부임한 후 조선과 해양플랜트 분야에서 끊임없는 공법혁신을 통해 조선소를 해양설비와 특수선박 등 고부가제품 중심의 생산체제로 변모시켰다.윤용암 삼성자산운용 대표이사 사장은 2011년부터 삼성생명 자산운용본부장을 맡아 글로벌 금융위기 속에서도 성과를 일궈 냈다.  윤용암 사장은 금융업 전반에 대한 폭넓은 경험과 전문성을 바탕으로 삼성자산운용을 초우량 자산운용사로 도약시킬 적임자로 평가된다.임대기 제일기획 대표이사 사장은 제일기획 광고팀장, 국내광고부문장 등을 거치며 종합 광고대행사로의 성장에 견인차 역할을 담당했다. 임대기 사장은 2009년 삼성미래전략실 홍보담당으로 부임한 후 체계적인 기업광고·브랜드 전략을 통해 그룹의 광고역량을 배가시켰다는 평가를 받고 있다. 임대기 사장은 제일기획을 글로벌 광고회사로 도약시키는 데 주력한다는 방침이다.이인용 삼성미래전략실 커뮤니케이션팀장 사장은 언론계 출신으로, 2005년 삼성전자 홍보팀장으로 입사한 후 새로운 커뮤니케이션 전략으로 기업홍보의 새로운 장을 열었다는 평가를 받고 있다. 이인용 사장은 2009년부터 삼성미래전략실 커뮤니케이션팀장을 맡아 사내·외 소통강화와 그룹 이미지를 제고해 왔는데, 앞으로 사내·외 커뮤니케이션을 더욱 강화하는 등 소통 혁신을 지속적으로 추진할 계획이다.한편, 사장단 중 이동 및 위촉업무변경 내정자를 보면, 삼성전자 반도체연구소장, 종합기술원장을 역임한 김기남 사장을 삼성디스플레이 대표이사로 내정했다.삼성전자 메모리사업부장, 삼성디스플레이 OLED사업부장을 지낸 조수인 사장을 삼성전자 의료기기사업부장에 내정했고, 삼성전자 DMC부문 경영지원실장 윤주화 사장을 제일모직 패션부문장 대표이사 사장으로 내정했다. 또 삼성미래전략실 이상훈 전략1팀장 사장을 삼성전자 DMC부문 경영지원실장으로, 삼성정밀화학 대표이사, 삼성전자 DS부문 경영지원실장을 역임한 김종중 사장을 삼성미래전략실 전략1팀장에 각각 내정했다.에스원 대표이사, 삼성중공업 대표이사를 역임한 노인식 사장을 삼성경제연구소 인적자원개발담당 사장으로 위촉했으며, 삼성생명 자산운용부문장, 삼성증권 대표이사를 거쳐 2012년 삼성자산운용 대표이사로 부임한 박준현 사장을 삼성경제연구소 금융산업담당 사장으로 위촉했다. 삼성은 부사장 이하 2013년 정기 임원인사는 각 회사별로 마무리하는 대로 발표할 예정이다.2013년 삼성 사장단 인사 내정자 발표 전문▲ 승진 내정자o 부회장 승진 내정- 삼성생명 박근희 대표이사 사장 → 삼성생명 대표이사- 부회장삼성전자 이재용 사장  → 삼성전자 부회장o 사장 승진 내정- 삼성전자 이돈주 부사장 → 삼성전자 무선사업부  전략마케팅담당 사장- 삼성전자 홍원표 부사장 → 삼성전자  Media Solution센터장 사장- 삼성코닝정밀소재 박원규 부사장 → 삼성코닝정밀소재 대표이사 사장- 삼성중공업 박대영 부사장  → 삼성중공업 대표이사 사장- 삼성생명 윤용암 부사장 → 삼성자산운용 대표이사 사장- 삼성미래전략실 임대기 부사장→ 제일기획 대표이사 사장- 삼성미래전략실 이인용 부사장 → 삼성미래전략실 커뮤니케이션팀장 사장▲ 이동·위촉업무 변경 내정자- 삼성전자 권오현 대표이사 부회장 겸 · DS부문장 겸 · 삼성디스플레이 대표이사 부회장 → 삼성전자 대표이사 부회장  겸 · DS부문장 겸 · 종합기술원장- 삼성전자 김기남 종합기술원장 사장  → 삼성디스플레이 대표이사 사장 겸 · OLED사업부장- 삼성디스플레이 조수인 OLED사업부장 사장  → 삼성전자 의료기기사업부장 사장- 삼성전자 윤주화 DMC부문 경영지원실장 사장 겸 · 전사 경영지원실장 → 제일모직 패션부문장 대표이사 사장- 삼성미래전략실 이상훈 전략1팀장 사장 → 삼성전자 DMC부문 경영지원실장 사장 겸)전사 경영지원실장- 삼성전자 김종중 DS부문 경영지원실장 사장  → 삼성미래전략실 전략1팀장 사장- 삼성중공업 노인식 대표이사 사장 → 삼성경제연구소  인적자원개발담당 사장- 삼성자산운용 박준현 대표이사 사장  → 삼성경제연구소  금융산업담당 사장sdjinny@cbs.co.kr[네티즌 많이 본 기사]●흡연자들 7일까지만 담배 실컷 피우세요!●호남민심 요동?, 安지지자들 朴지지선언●첫 TV토론…이정희 ""박근혜 떨어뜨리려 나왔다""●마이크 타이슨 ""브래드 피트와 내 아내의 동침 목격했다"" 폭로●새누리 ""준비된 리더십""…文 ""존재감無"", 李 ""예의無""(대한민국 중심언론 CBS  뉴스FM98.1 / 음악FM93.9 / TV CH 412)<저작권자 ⓒ CBS 노컷뉴스(www.nocutnews.co.kr) 무단전재 및 재배포 금지>스마트 뉴스앱의 최강자! 노컷뉴스 APP 다운로드 받기↓"
135,2012-12-05,전국 강추위 속 낮부터 최고 10㎝ 많은 눈,https://news.naver.com/main/read.nhn?mode=LSD&mid=shm&sid1=103&oid=001&aid=0005971580,연합뉴스,"지난3일 많은 눈이 내렸던 강원도 춘천(자료사진)백령도 7㎝ 쌓여…서울 오전 11시께부터 내릴듯(서울=연합뉴스) 김계연 기자 = 5일 아침 전국 대부분 지방의 수은주가 영하권에 머물며 강추위가 이어진 가운데 낮부터는 최고 10㎝의 많은 눈이 내릴 전망이다.기상청에 따르면 이날 아침 최저기온은 서울 -5.1도를 비롯해 철원 -12.1도, 춘천 -11.9도, 대관령ㆍ문산 -9.7도, 충주 -7.0도 등 중부 내륙지방을 중심으로 -10도 안팎까지 떨어졌다.남부지방도 진주 -2.9도, 전주 -2.0도, 광주ㆍ울산 -0.8도 등 제주도와 남해안 일부 지역을 제외한 전역이 0도를 밑돌았다.기상청은 이날 낮에도 서울의 최고기온이 0도를 기록하는 등 추위가 이어지는 가운데 전국에 눈이나 비가 내릴 것으로 내다봤다.눈구름대는 이날 오전 9시 현재 경기 서해안 지역에 근접해 있다.서해5도에 대설주의보가 내려진 가운데 백령도는 이미 7㎝의 적설량을 기록했다.기상청은 눈구름대가 시간당 40㎞의 속도로 동진하고 있어 오전 10시께 경기 서해안, 11시께는 서울과 경기 내륙에 눈이 내리기 시작할 것으로 보고 있다.예상 적설량은 강원 동해안을 제외한 중부지방과 경북 북부 3∼10㎝, 전남 남해안을 제외한 호남과 강원 동해안 2∼7㎝, 전남 남해안과 영남, 제주 산간, 울릉도ㆍ독도 1∼5㎝다.강원 산간과 내륙에는 15㎝ 이상 쌓이는 곳도 있겠다.기상청 관계자는 ""전국에 대설특보가 내려질 가능성이 크다""며 ""낮부터 눈이 쌓이고 밤에는 기온이 내려가 빙판길이 되는 곳이 많겠으니 운전할 때 조심해야 한다""고 말했다.tele@yna.co.kr[이 시각 많이 본 기사]☞<이정희 ""박근혜 떨어뜨리려 출마""..시종 맹폭>☞한상진 ""이번엔 왕이라기에 농담인줄 알았죠""☞헌정 사상 첫 재외국민 대선 투표 시작☞존 허, 아시아 최초로 PGA 투어 신인왕 수상☞<대선후보 첫 TV토론 전문가 반응><연합뉴스 모바일앱 다운받기><포토 매거진><저작권자(c)연합뉴스. 무단전재-재배포금지.>"
136,2012-12-05,농약 섞은 콜라 배달한 30대 검거…경찰관 등 2명 중태,https://news.naver.com/main/read.nhn?mode=LSD&mid=shm&sid1=102&oid=003&aid=0004862860,뉴시스,"【서울=뉴시스】최성욱 기자 = 서울 송파경찰서는 5일 농약을 섞은 음료수를 배달시킨 문모(37)씨에 대해 살인미수 혐의로 구속영장을 신청할 예정이라고 밝혔다.문씨는 지난달 27일 오후 7시30분께 서울 송파구 신천동 권모(44)씨의 부동산에 피자와 함께 농약을 넣은 콜라를 배달시키는 등 이같은 수법으로 최근까지 6차례에 걸쳐 4명을 살해하려 한 혐의를 받고 있다.부동산에 있던 권씨와 인근 파출소 소속 김모(52) 경위는 아무런 의심없이 콜라를 나눠 마셨다가 쓰러져 현재 생명이 위독한 상태인 것으로 알려졌다.문씨가 음료수에 넣은 농약 그라목손은 제초제의 일종으로 독성이 매우 강해 미국, 유럽뿐만 아니라 국내에서도 지난달부터 법적으로 판매가 금지됐다.경찰 조사결과 문씨는 전세계약 문제로 권씨가 자신의 집을 다녀가면서 물건을 훔쳐갔고 이후 자신을 미행하는 사람이 있다는 망상으로 범행을 계획한 것으로 드러났다.경찰은 문씨를 상대로 여죄를 수사 중이다secret@newsis.com[뉴시스 이시간 핫 뉴스]ㆍ ´일본해´ 논란, 우체국·아시아나·하이마트도?ㆍ 뉴욕 지하철역서 한인 고의로 떠밀려 사망ㆍ 보라스 ""류현진, 日에서 뛸 수도 있다""ㆍ 수술비 걱정하던 30대 가장 아파트서 투신ㆍ ´氣치료´ 빙자 신도 딸 성폭행한 승려 구속★ 손 안에서 보는 세상, 모바일 뉴시스★ “우리 결혼합니다” 뉴시스 웨딩알리미 ‘두리’<저작권자ⓒ 공감언론 뉴시스통신사. 무단전재-재배포 금지.>"
