,날짜,기사 제목,기사 링크,기사 출처,기사 내용
143,2016-08-12,코스피 9개월만에 2050선 돌파… 외인·기관..,https://news.naver.com/main/read.nhn?mode=LSD&mid=shm&sid1=101&oid=008&aid=0003726308,머니투데이,"[머니투데이 송선옥 기자] [한때 2060선 터치후 약보합... 한국전력 전일에 이어 약세 ]코스피 지수가 12일 외국인과 기관 순매수에 힘입어 2050선을 돌파했다. 코스피 지수가 종가기준으로 2050선을 돌파한 것은 지난해 11월4일 2052.77 이후 처음이다.코스피 지수는 국제유가 급등과 미국 뉴욕증시의 사상최고치 경신으로 장중 2060.84를 터치하기도 했으나 잇단 연고점 경신에 대한 부담과 이날 발표된 중국 경기지표의 부진으로 약보합 전환하기도 했다.이경민 대신증권 연구원은 “최근 원달러 환율 등락에 민감을 보이던 IT(정보기술) 업종이 이날 원달러 환율 1100원 돌파에도 불구하고 약세를 기록했는데 이는 외국인이 가격, 밸류에이션 부담 등으로 이들 종목을 매도 했기 때문”이라며 “코스피 2050대에서 외국인은 종목별로 차별화된 매매패턴을 보일 것으로 예상되기에 가격 부담이 큰 IT 조선 기계 등에서 차익매물을 경계해야 할 필요가 있다”고 말했다.◇한국전력, 수익 우려에 이틀째 하락=코스피 지수는 전일대비 1.67포인트(0.08%) 상승한 2050.47로 장을 마쳤다. 7거래일 연속 상승이나 거래량은 전일에 이어 3억주대에 불과했다.유가증권시장에서는 외국인과 기관이 각각 615억원, 993억원 순매수이나 개인이 1801억원 순매도다. 기관 중에서는 금융투자가 2407억원 순매수였으나 투신과 연기금이 각각 433억원, 812억원 순매도했다.지수선물 시장에서는 외국인과 개인이 각각 865계약, 1866계약 순매수인 반면 기관이 2900계약 순매도다.프로그램 매매는 차익거래 140억원 순매도, 비차익거래 818억원 순매수 등 전체 678억원 매수 우위다.상당수 업종이 상승했다. 의료정밀이 2.45% 올랐으며 종이목재 의약품 철강금속 운송장비 건설업 운수창고 은행 증권 등이 상승 마감했다. 전기가스업이 1.97% 내렸으며 전기전자 보험 통신업 등이 내렸다.시가총액 상위종목 중에서는 삼성전자가 0.90% 내린 154만5000원으로 마감했다.한국전력이 누진제 완화에 따른 수익성 우려로 2.31% 밀려 5만9200원을 기록했다. 한국전력은 전일에도 3.19% 하락 마감했다. 산업통산자원부는 올 7~9월 주택용 전기요금 누진제 경감방안을 시행하기로 전일 밤 결정했다. 양지혜 삼성증권 연구원은 “이번 결정으로 올 매출액과 영업이익이 4200억원 감소할 것”이라며 목표주가를 8만5000원에서 8만원으로 하향조정했다.삼성생명이 2.43% 내렸으며 SK하이닉스 아모레퍼시픽 등이 1%대 하락으로 장을 마쳤다.POSCO가 2.55%  상승했으며 현대차 기아차가 각각 1.12%, 1.68% 올랐다.  삼성물산 아모레퍼시픽 SK텔레콤 등이 하락했다.이재현 CJ그룹 회장이 광복절 특사에 포함되면서 CJ가 0.50% 상승, 5거래일 연속 오름세를 이어갔다. CJ프레시웨이가 1.90% 상승으로 나흘째 상승세인 반면 CJ제일제당 CJ씨푸드 CJ CGV등은 차익실현 매물 출현으로 약세다.김승연 한화그룹이 이번 사면에서 제외된 가운데 한화는 0.42% 올라 나흘 연속상승마감했다. 한화생명이 2분기 실적호조로 1.74% 올랐다.선도전기가 백지공시에 6.07% 상승했다. 선도공시는 전일 디스플레이 건설 설비 공급계약을 체결했다고 계약 상대방의 경영상 비밀유지 요청으로 계약금액 등은 공시 유보한다고 밝혔다.아비스타가 JYP엔터테인먼트와의 공동사업 진행 소식에 1.66% 상승했다.한국공항이 2분기 호실적 소식에 10.71% 급등했다. 한국공항은 전날 장 마감후 2분기 연결기준 잠정 영업이익이 75억원으로 지난해 같은 기간보다 367% 증가했다고 공시했다.사조씨푸드가 2조8000억원 규모의 잠실개발 기대감으로 4.92% 올랐다. 나흘째 상승이다. 서울시는 전일 제11차 도시건축공동위원회에서 서울 동남권 국제교류 복합지구 지구단위계획을 최종 수정가결했다. 수정가결안은 잠실운동장 일대에 주경기장, 야구장, 실내체육관 등 기존 체육시설 뿐만 아니라 전시장, 컨벤션센터 등 다양한 업무시설과 판매시설이 들어설 수 있도록 했다. 사조씨푸드는 현대차그룹이 인수한 한전부지에 ‘사조빌딩’을 보유하고 있다.지난 9일 분할상장한 샘표식품이 상한가로 장을 마쳤으며 지주사 부문인 샘표가 20.63% 급등했다.동양물산 등 3개 종목이 상한가로 519개 종목이 상승, 284개 종목이 하락했다.◇원달러 환율 1100원대 재진입=코스닥 지수는 1.85포인트(0.26%) 오른 705.18로 장을 마쳤다.외국인과 개인이 각각 122억원, 206억원 순매수인데 반해 기관이 301억원 순매도다.업종별로는 등락이 엇갈렸다. 통신서비스가 2.14% 올랐으며 IT부품 컴퓨터서비스 반도체 등이 올랐다. 인터넷 디지털컨텐츠 방송서비스 출판매체복제 등이 내렸다.시총 상위종목 중에서는 카카오가 부진한 2분기 실적으로 1.97% 내렸다. 카카오의 2분기 매출은 로엔을 제외할 경우 2661억원으로 추정치 2702억원을 하회했고 영업이익은 로엔실적과 일회성 비용을 제외할 경우 147억원으로 추정치 266억원에 크게 못 미쳤다.메디톡스 CJ E&M 로엔 바이로메드 컴투스 케어젠 등이 하락한 반면 코미팜 SK머티리얼즈 이오테크닉스 등이 올랐다.인터플렉스가 3분기 턴어라운드 분석에 15.87% 상승했다. IBK투자증권은 인터플렉스가 올 3분기 영업이익 흑자전환에 성공할 것이라고 평가했다.대구공항 이전 가시화로 홈센타가 11.01% 급등했으며 윈하이텍이 11.86% 상승했다. 정부는 전날 ‘대구공항 통합이전 TF 3차 회의’를 열고 통합이전 사업의 추진방식과 추진일정을 확정했다. 대구시가 제출한 이전건의서의 타당성을 평가해 이달 안으로 예비이전 후보지에 대한 조사용역에 착수한다. 홈센타는 본사가 대구에 위치해 있으며 윈하이텍은 인천국제공항 건설 당시 데크플레이트 납품과 단열재 시공 등을 담당했다.에스와이패널이 혼자 상한가로 상승 하락 종목은 각각 606개, 448개다.한편 원달러 환율은 서울 외국환시장에서 3.8원 오른 1103.3원으로 마감했다. 코스피200 지수선물 9월물은 0.20포인트(0.08%) 상승한 256.25으로 장을 마쳤다.[이코노미스트들의 깊이있는 투자정보 'TOM칼럼'][부자들에게 배우는 성공 노하우 '줄리아 투자노트'  ][내 삶을 바꾸는 정치뉴스 'the 300']송선옥 기자 oops@mt.co.kr<저작권자 ⓒ '돈이 보이는 리얼타임 뉴스' 머니투데이, 무단전재 및 재배포 금지>"
144,2016-08-12,코스피 9개월만에 2050선 돌파… 외인·기관 '사자',https://news.naver.com/main/read.nhn?mode=LSD&mid=shm&sid1=101&oid=008&aid=0003726308,머니투데이,"[머니투데이 송선옥 기자] [한때 2060선 터치후 약보합... 한국전력 전일에 이어 약세 ]코스피 지수가 12일 외국인과 기관 순매수에 힘입어 2050선을 돌파했다. 코스피 지수가 종가기준으로 2050선을 돌파한 것은 지난해 11월4일 2052.77 이후 처음이다.코스피 지수는 국제유가 급등과 미국 뉴욕증시의 사상최고치 경신으로 장중 2060.84를 터치하기도 했으나 잇단 연고점 경신에 대한 부담과 이날 발표된 중국 경기지표의 부진으로 약보합 전환하기도 했다.이경민 대신증권 연구원은 “최근 원달러 환율 등락에 민감을 보이던 IT(정보기술) 업종이 이날 원달러 환율 1100원 돌파에도 불구하고 약세를 기록했는데 이는 외국인이 가격, 밸류에이션 부담 등으로 이들 종목을 매도 했기 때문”이라며 “코스피 2050대에서 외국인은 종목별로 차별화된 매매패턴을 보일 것으로 예상되기에 가격 부담이 큰 IT 조선 기계 등에서 차익매물을 경계해야 할 필요가 있다”고 말했다.◇한국전력, 수익 우려에 이틀째 하락=코스피 지수는 전일대비 1.67포인트(0.08%) 상승한 2050.47로 장을 마쳤다. 7거래일 연속 상승이나 거래량은 전일에 이어 3억주대에 불과했다.유가증권시장에서는 외국인과 기관이 각각 615억원, 993억원 순매수이나 개인이 1801억원 순매도다. 기관 중에서는 금융투자가 2407억원 순매수였으나 투신과 연기금이 각각 433억원, 812억원 순매도했다.지수선물 시장에서는 외국인과 개인이 각각 865계약, 1866계약 순매수인 반면 기관이 2900계약 순매도다.프로그램 매매는 차익거래 140억원 순매도, 비차익거래 818억원 순매수 등 전체 678억원 매수 우위다.상당수 업종이 상승했다. 의료정밀이 2.45% 올랐으며 종이목재 의약품 철강금속 운송장비 건설업 운수창고 은행 증권 등이 상승 마감했다. 전기가스업이 1.97% 내렸으며 전기전자 보험 통신업 등이 내렸다.시가총액 상위종목 중에서는 삼성전자가 0.90% 내린 154만5000원으로 마감했다.한국전력이 누진제 완화에 따른 수익성 우려로 2.31% 밀려 5만9200원을 기록했다. 한국전력은 전일에도 3.19% 하락 마감했다. 산업통산자원부는 올 7~9월 주택용 전기요금 누진제 경감방안을 시행하기로 전일 밤 결정했다. 양지혜 삼성증권 연구원은 “이번 결정으로 올 매출액과 영업이익이 4200억원 감소할 것”이라며 목표주가를 8만5000원에서 8만원으로 하향조정했다.삼성생명이 2.43% 내렸으며 SK하이닉스 아모레퍼시픽 등이 1%대 하락으로 장을 마쳤다.POSCO가 2.55%  상승했으며 현대차 기아차가 각각 1.12%, 1.68% 올랐다.  삼성물산 아모레퍼시픽 SK텔레콤 등이 하락했다.이재현 CJ그룹 회장이 광복절 특사에 포함되면서 CJ가 0.50% 상승, 5거래일 연속 오름세를 이어갔다. CJ프레시웨이가 1.90% 상승으로 나흘째 상승세인 반면 CJ제일제당 CJ씨푸드 CJ CGV등은 차익실현 매물 출현으로 약세다.김승연 한화그룹이 이번 사면에서 제외된 가운데 한화는 0.42% 올라 나흘 연속상승마감했다. 한화생명이 2분기 실적호조로 1.74% 올랐다.선도전기가 백지공시에 6.07% 상승했다. 선도공시는 전일 디스플레이 건설 설비 공급계약을 체결했다고 계약 상대방의 경영상 비밀유지 요청으로 계약금액 등은 공시 유보한다고 밝혔다.아비스타가 JYP엔터테인먼트와의 공동사업 진행 소식에 1.66% 상승했다.한국공항이 2분기 호실적 소식에 10.71% 급등했다. 한국공항은 전날 장 마감후 2분기 연결기준 잠정 영업이익이 75억원으로 지난해 같은 기간보다 367% 증가했다고 공시했다.사조씨푸드가 2조8000억원 규모의 잠실개발 기대감으로 4.92% 올랐다. 나흘째 상승이다. 서울시는 전일 제11차 도시건축공동위원회에서 서울 동남권 국제교류 복합지구 지구단위계획을 최종 수정가결했다. 수정가결안은 잠실운동장 일대에 주경기장, 야구장, 실내체육관 등 기존 체육시설 뿐만 아니라 전시장, 컨벤션센터 등 다양한 업무시설과 판매시설이 들어설 수 있도록 했다. 사조씨푸드는 현대차그룹이 인수한 한전부지에 ‘사조빌딩’을 보유하고 있다.지난 9일 분할상장한 샘표식품이 상한가로 장을 마쳤으며 지주사 부문인 샘표가 20.63% 급등했다.동양물산 등 3개 종목이 상한가로 519개 종목이 상승, 284개 종목이 하락했다.◇원달러 환율 1100원대 재진입=코스닥 지수는 1.85포인트(0.26%) 오른 705.18로 장을 마쳤다.외국인과 개인이 각각 122억원, 206억원 순매수인데 반해 기관이 301억원 순매도다.업종별로는 등락이 엇갈렸다. 통신서비스가 2.14% 올랐으며 IT부품 컴퓨터서비스 반도체 등이 올랐다. 인터넷 디지털컨텐츠 방송서비스 출판매체복제 등이 내렸다.시총 상위종목 중에서는 카카오가 부진한 2분기 실적으로 1.97% 내렸다. 카카오의 2분기 매출은 로엔을 제외할 경우 2661억원으로 추정치 2702억원을 하회했고 영업이익은 로엔실적과 일회성 비용을 제외할 경우 147억원으로 추정치 266억원에 크게 못 미쳤다.메디톡스 CJ E&M 로엔 바이로메드 컴투스 케어젠 등이 하락한 반면 코미팜 SK머티리얼즈 이오테크닉스 등이 올랐다.인터플렉스가 3분기 턴어라운드 분석에 15.87% 상승했다. IBK투자증권은 인터플렉스가 올 3분기 영업이익 흑자전환에 성공할 것이라고 평가했다.대구공항 이전 가시화로 홈센타가 11.01% 급등했으며 윈하이텍이 11.86% 상승했다. 정부는 전날 ‘대구공항 통합이전 TF 3차 회의’를 열고 통합이전 사업의 추진방식과 추진일정을 확정했다. 대구시가 제출한 이전건의서의 타당성을 평가해 이달 안으로 예비이전 후보지에 대한 조사용역에 착수한다. 홈센타는 본사가 대구에 위치해 있으며 윈하이텍은 인천국제공항 건설 당시 데크플레이트 납품과 단열재 시공 등을 담당했다.에스와이패널이 혼자 상한가로 상승 하락 종목은 각각 606개, 448개다.한편 원달러 환율은 서울 외국환시장에서 3.8원 오른 1103.3원으로 마감했다. 코스피200 지수선물 9월물은 0.20포인트(0.08%) 상승한 256.25으로 장을 마쳤다.[이코노미스트들의 깊이있는 투자정보 'TOM칼럼'][부자들에게 배우는 성공 노하우 '줄리아 투자노트'  ][내 삶을 바꾸는 정치뉴스 'the 300']송선옥 기자 oops@mt.co.kr<저작권자 ⓒ '돈이 보이는 리얼타임 뉴스' 머니투데이, 무단전재 및 재배포 금지>"
145,2016-08-12,"""국민눈높이 사면"" vs ""유감"" vs ""긍정적""…광복절특사..",https://news.naver.com/main/read.nhn?mode=LSD&mid=shm&sid1=100&oid=421&aid=0002220683,뉴스1,"정부는 12일 광복 71주년을 맞아 이재현 CJ그룹 회장을 포함한 중소·영세 상공인, 서민 생계형 형사범, 불우 수형자 등 4876명에 대한 특별사면을 단행했다. 2016.8.12/뉴스1 © News1 추연화 기자(서울=뉴스1) 김현 기자 = 여야 정치권은 12일 정부가 광복 71주년을 맞아 이재현 CJ그룹 회장 등 4876명에 대한 특별 사면 및 행정제재 대상자 142만여명에 대한 특별 감면 조치를 단행한 것과 관련해 엇갈린 반응을 보였다.김명연 새누리당 원내수석대변인은 이날 현안브리핑을 통해 ""이번 사면을 서민과 중소기업인 등 서민생활과 밀접한 생계형 사범 위주의 사면으로 보고, 경제 살리기와 국민 대통합 의지를 적극 반영한 '생활밀착형 사면', '국민눈높이 사면'이라 평가한다""고 밝혔다.김 대변인은 또 ""그동안 박근혜정부가 공약했던 사면의 남발은 최소화하되, 그 대상은 엄격히 제한한다는 대원칙 아래 정치인과 경제인에 대한 사면은 최소화해 국민의 법감정을 고려하고, 정부가 사면 전에 제시했던 '국민적 역량 결집'과 '재기 기회 부여'라는 두 가지 취지도 충실히 반영한 사면""이라고 평가했다.김 대변인은 ""주요 산업의 구조조정과 청년실업, 수출부진과 내수 침체 등 대내외적으로 어려움이 많은 시기이고, 북한의 핵위협 속에 사드배치가 절실함에도 아직까지 국론도 일치되지 못하고 있는 안타까운 상황""이라면서 ""이번 특사가 국민에게 희망의 메시지를 전하는 전기가 되길 기대한다""고 말했다.이와 달리 송옥주 더불어민주당 대변인은 서면브리핑에서 이 회장 특사를 언급, ""이 회장은 지병악화로 형 집행이 어렵다는 사유를 들었지만, 복권까지 한 것은 경제인에 대한 온정주의적 사면으로 간주하지 않을 수 없다""며 ""박 대통령은 지난 대선 당시 대기업 지배주주와 경영자의 중대범죄에 대해서는 사면을 제한하겠다고 약속한 바 있다는 점에서 유감스럽다""고 비판했다.송 대변인은 ""경제인에 대한 온정주의적 태도는 법치주의의 근간을 훼손하는 것으로 더 이상 이러한 일은 없어야 한다""면서 ""기업인에 대한 사면보다 더 중요한 것은 폭염에 고생하는 민생을 보살피는 것""이라고 강조했다.국민의당은 더민주와는 온도차를 보였다.고연호 국민의당 대변인은 현안브리핑에서 ""국민의당은 특별사면 대상에 중소·영세 상공인 및 서민이 포함된 것을 긍정적으로 평가한다""며 ""특히 생계형 범죄의 경우 그 원인이 개인의 일탈만이 아닌 이웃을 제대로 돌보지 못한 우리 사회에도 큰 책임이 있다""고 밝혔다.고 대변인은 ""국민의당은 앞으로도 생계형 범죄자들이 사회에 복귀하고 자립할 수 있도록 최대한 도움의 손을 아끼지 않을 것""이라고 덧붙였다.gayunlove@▶ 리우올림픽의 실시간 경기 현황 보기▶ 매일 업데이트 최신 만화 100% 무료[© 뉴스1코리아(news1.kr), 무단 전재 및 재배포 금지]"
146,2016-08-12,"""국민눈높이 사면"" vs ""유감"" vs ""긍정적""…광복절특사 3당 평가",https://news.naver.com/main/read.nhn?mode=LSD&mid=shm&sid1=100&oid=421&aid=0002220683,뉴스1,"정부는 12일 광복 71주년을 맞아 이재현 CJ그룹 회장을 포함한 중소·영세 상공인, 서민 생계형 형사범, 불우 수형자 등 4876명에 대한 특별사면을 단행했다. 2016.8.12/뉴스1 © News1 추연화 기자(서울=뉴스1) 김현 기자 = 여야 정치권은 12일 정부가 광복 71주년을 맞아 이재현 CJ그룹 회장 등 4876명에 대한 특별 사면 및 행정제재 대상자 142만여명에 대한 특별 감면 조치를 단행한 것과 관련해 엇갈린 반응을 보였다.김명연 새누리당 원내수석대변인은 이날 현안브리핑을 통해 ""이번 사면을 서민과 중소기업인 등 서민생활과 밀접한 생계형 사범 위주의 사면으로 보고, 경제 살리기와 국민 대통합 의지를 적극 반영한 '생활밀착형 사면', '국민눈높이 사면'이라 평가한다""고 밝혔다.김 대변인은 또 ""그동안 박근혜정부가 공약했던 사면의 남발은 최소화하되, 그 대상은 엄격히 제한한다는 대원칙 아래 정치인과 경제인에 대한 사면은 최소화해 국민의 법감정을 고려하고, 정부가 사면 전에 제시했던 '국민적 역량 결집'과 '재기 기회 부여'라는 두 가지 취지도 충실히 반영한 사면""이라고 평가했다.김 대변인은 ""주요 산업의 구조조정과 청년실업, 수출부진과 내수 침체 등 대내외적으로 어려움이 많은 시기이고, 북한의 핵위협 속에 사드배치가 절실함에도 아직까지 국론도 일치되지 못하고 있는 안타까운 상황""이라면서 ""이번 특사가 국민에게 희망의 메시지를 전하는 전기가 되길 기대한다""고 말했다.이와 달리 송옥주 더불어민주당 대변인은 서면브리핑에서 이 회장 특사를 언급, ""이 회장은 지병악화로 형 집행이 어렵다는 사유를 들었지만, 복권까지 한 것은 경제인에 대한 온정주의적 사면으로 간주하지 않을 수 없다""며 ""박 대통령은 지난 대선 당시 대기업 지배주주와 경영자의 중대범죄에 대해서는 사면을 제한하겠다고 약속한 바 있다는 점에서 유감스럽다""고 비판했다.송 대변인은 ""경제인에 대한 온정주의적 태도는 법치주의의 근간을 훼손하는 것으로 더 이상 이러한 일은 없어야 한다""면서 ""기업인에 대한 사면보다 더 중요한 것은 폭염에 고생하는 민생을 보살피는 것""이라고 강조했다.국민의당은 더민주와는 온도차를 보였다.고연호 국민의당 대변인은 현안브리핑에서 ""국민의당은 특별사면 대상에 중소·영세 상공인 및 서민이 포함된 것을 긍정적으로 평가한다""며 ""특히 생계형 범죄의 경우 그 원인이 개인의 일탈만이 아닌 이웃을 제대로 돌보지 못한 우리 사회에도 큰 책임이 있다""고 밝혔다.고 대변인은 ""국민의당은 앞으로도 생계형 범죄자들이 사회에 복귀하고 자립할 수 있도록 최대한 도움의 손을 아끼지 않을 것""이라고 덧붙였다.gayunlove@▶ 리우올림픽의 실시간 경기 현황 보기▶ 매일 업데이트 최신 만화 100% 무료[© 뉴스1코리아(news1.kr), 무단 전재 및 재배포 금지]"
147,2016-08-12,경북 경산시 하양읍 사상 최고 40.3℃,https://news.naver.com/main/read.nhn?mode=LSD&mid=shm&sid1=103&oid=052&aid=0000887922,YTN,"경북 경산시 하양읍 기온이 40.3도까지 올라 기상 관측 사상 최고 기온을 기록했습니다.기상청은 경산시 하양읍 기온이 비공식 기록이지만 40.3도까지 올라 1942년 대구의 40도를 넘는 가장 높은 기온을 기록했다고 밝혔습니다.공식 기록으로는 경북 경주가 39.4도로 올해 전국 최고 기온을 보였고, 영천 39.3도, 서울도 35.9도까지 올랐습니다.이번 폭염은 일요일까지 이어진 뒤 광복절인 다음 주 월요일부터 누그러들 전망입니다.김진두[jdkim@ytn.co.kr]▶ [원포인트생활상식] 생활 속 아이디어 공모전▶ 뉴스 덕후들의 YTN페이스북▶ 내가 만드는 뉴스! YTN제보[저작권자(c) YTN(Yes! Top News) 무단전재 및 재배포 금지]"
