,날짜,기사 제목,기사 링크,기사 출처,기사 내용
205,2016-08-12,"""12년 만에 가장 많은 유성우, 1시간에 150개 이상 관측""",https://news.naver.com/main/read.nhn?mode=LSD&mid=shm&sid1=105&oid=056&aid=0010350227,KBS,"□  방송일시 : 2016년 8월 12일(금요일)□ 출연자 : 이태형 소장 (한국 우주환경과학 연구소)“12년 만에 가장 많은 유성우, 1시간에 150개 이상 관측”[홍지명] 별똥별을 보면서 소원을 빌면 그 바람이 성취된다, 이런 말도 있습니다만 오늘 밤, 밤 하늘 바라보면서 소원 한 가지씩 빌어보면 어떨까요? 왜냐하면 오늘 밤에는 12년 만에 가장 많은 별똥별, 즉 유성우를 관측할 수 있기 때문입니다. 별 박사라는 애칭을 가지고 있는 한국우주환경과학 연구소 이태형 소장과 함께 자세한 내용 알아봅니다. 안녕하십니까?[이태형] 네, 안녕하십니까?[홍지명] 별똥별이라는 건 어떤 별인지, 또 어떻게 만들어지는 겁니까?[이태형] 네, 기본적으로 유성우 같은 경우는 혜성이라고 들어보신적 있죠? 먼지라든가 물, 가스 같은 것들이 얼어있는 지저분한 얼음 덩어리인데요. 이런 얼음 덩어리가 태양이 가까이 오면 녹아서 길게 꼬리가 만들어집니다. 그리고 이 혜성이 지나가게 되면 그 궤도를 따라서 많은 부스러기들이 남아있겠죠. 이 궤도를 지구가 통과하게 되면 그 때 그 부스러기들이 지구 대기권으로 들어오면서 타서 굉장히 많은 별똥별이 생기게 되는 거계요. 한 마디로 유성이라고 하는 것은 우주를 떠다니는 먼지라든가 작은 물체들이 지구의 대기권으로 들어오면서 타는 현상인데. 그런데 이런 것들이 많이 떨어지기 때문에 유성이 비처럼 떨어진다 해서 유성우다 라고 얘기하는데요. 그래서 이렇게 별똥별, 유성우를 만드는 혜성을 어머니 혜성이다 해서 모혜성 이렇게 부릅니다.[홍지명] 그러니까 혜성에서 떨어져 나오는 부스러기들이 지구에 떨어지는 현상이 유성우다 이렇게 보면 되겠군요.[이태형] 네, 맞습니다.[홍지명] 그러면 오늘 볼 수 있는 유성우에도 모혜성이 있겠네요?[이태형] 그렇죠. 어머니 혜성이 있는데요. 1862년에 발견된 스위프트-터틀 이라는 혜성인데요. 스위프트라는 사람과 터틀이라는 사람이 발견한 건데 지름이 한 26km 정도 되고 130년 정도마다 한 번씩 지구에 다가오는 그런 혜성입니다.[홍지명] 우리가 가장 많이 알고 있는 혜성은 헬리 혜성인데. 이 스위프트-터틀 혜성. 이거 혹시 지구하고 충돌할 걱정은 안해도 됩니까?[이태형] 네, 그러니까 헬리 혜성 보다 큰 건데요. 주기적으로 지구에 접근하는 혜성 중에서 가장 큰 겁니다. 그래서 만약에 이것이 충돌하게 된다면 6500만 년 전에 공룡이 멸망했던 그 충돌보다도 몇 십 배나 큰 충격을 가져올 건데요. 그래서 가장 위험한 것 중에 하나지만 충돌 위험은 뭐 0.000000, 한 여섯 개 정도 넘어갈 정도로 위험하기는 하지만 거의 충돌할 가능성은 없다. 그리고 130년 정도 지난 다음에 오는 건데요. 계속. 다음에 오는 것이 2100년 이후인데 그때도 몇 천만 km 정도 멀리 있기 때문에 크게 걱정할 필요 없습니다.[홍지명] 오늘 볼 수 있는 이 별똥별의 무슨 이름이 붙어있습니까?[이태형] 유성우라는 것이 비처럼 쏟아진다고 말씀드렸잖아요? 페르세우스 자리 유성우라고 불리는데요. 페르세우스라는 별자리가 있어요. 밤 하늘에 별자리들이 많이 있을 거잖아요. 그 중에 하나가 페르세우스라는 별자리인데요. 왜 이 별자리 이름이 붙어있냐하면 지구가 아까 말씀드린대로 혜성의 궤도와 만난다고 했잖아요? 그럼 하늘 어느 그 지점에서 만나겠죠. 그 지점이 바로 페르세우스라는 별자리거든요. 그러니까 페르세우스라는 별자리와 특별히 상관이 없는데, 그 방향에서 지구와 혜성의 궤도가 만난다. 그래서 이름이 그 별자리를 중심으로 별똥별이 많이 튀기 때문에 붙은 이름이에요.[홍지명] 그러면 오늘 이 유성우를 보기 위해서는 페르세우스 별자리쪽을 주로 쳐다봐야 되겠군요?[이태형] 아, 그런 건 아니에요. 우리가 비가 올 때는 사방에서 비가 들어오잖아요? 혜성이 궤도를 통과하게 될 때는 사방에서 들어오거든요. 물론 앞 쪽에서 가장 많이 들어오기 때문에, 이 앞쪽이라는 게 페르세우스 자리가 있는 쪽이긴 하지만 사방에 다 튀긴 하거든요. 그래서 기본적으로 사방을 보시면 되거든요.[홍지명] 12년 만에 가장 많은 유성우를 볼 수 있다는 건 왜 그렇습니까?[이태형] 시간 당 150개 정도 볼 수 있다고 하는데요. 혜성이 지나간 궤도 근처를 목성이 지나갔어요. 목성이 제일 큰 행성이잖아요. 목성의 중력 때문에 그 부스러기들이 지구 쪽으로 당겨졌습니다. 그래서 12년 마다 목성이 태양을 도는데 12년 마다 한 번씩 목성의 중력 때문에 유성이 굉장히 많이, 평소에는 보통 이 때 한 100개 미만의 유성이 떨어지는데 시간 당. 이번에는 두 배 가까운 150개에서 그 이상도 떨어질 수 있다. 이런 예보를 하고 있는 겁니다.[홍지명] 이번 유성우를 보기 좋은 시간대라든지 최적의 장소, 무슨 조건 이런 것도 있습니까?[이태형] 아까 말씀드린대로 혜성의 궤도가 통과하는 예측되는 시간은 우리나라 시간으로 오늘 밤 10시부터 내일 새벽 12시 반 정도까지 거든요. 그때가 가장 좋은 시간이라고 얘기하지만 어쨌든 간에 넓게 분포되어 있기 때문에 오늘 밤 한 12시 반 정도 넘으면 달이 지거든요. 달이 너무 밝으면 또 잘 안보이는 경우가 있으니까요. 기본적으로 저녁 하늘에는 달 반대쪽을 좀 보시고요. 저녁 넘어서는 혜성이 궤도를 통과할 때는 사방에 터지기 때문에 어느 쪽을 본다 이게 어렵거든요. 그래서 매직 아이 보듯이 하늘을 향해서 초점을 좀 흐린 상태로 보시면 되겠고요. 자세가 중요한데 목이 아프잖아요. 누워서 보시거나 아니면 의자에 등을 좀 기댄 상태로 보시면 많이 볼 수 있을 것 같습니다.[홍지명] 그러니까 너무 초점을 또렷하게 해서 눈에다 힘 주지 말고 멍 때리듯이 하늘 쳐다보고 있으면 보인다는 얘기군요.[이태형] 그렇죠. 페르세우스자리 찾을 필요 없고요. 사방에서 비 속을 통과하는 것처럼 사방에서 떨어지기 때문에.[홍지명] 맨 눈으로도 볼 수 있는 거죠?[이태형] 망원경으로는 오히려 안보입니다. 별똥별이 빨리 지나가기 때문에 눈으로만 볼 수 있습니다.[홍지명] 오늘 대전천문대를 비롯해서 전국에서 유성우 관측을 위한 이벤트들이 벌어지는 모양이던데. 요즘 여름 밤에 아무래도 별자리 관측하기 좋은 때 아닙니까? 어떻습니까?[이태형] 특히 오늘이 굉장히 아름다운 밤 하늘이 될 것 같은데요. 저녁 때 한 9시쯤 되면 해도 지고 별이 보이잖아요. 오늘이 정말 중요한 날입니다. 서쪽 보면 달이 반달이거든요. 반달 바로 밑에 제일 밝은 별들이 삼각형으로 보여요. 바로 달 밑에 있는 것이 토성이고요. 목성,  토성 할 때 토성이요. 그리고 그 오른쪽으로 제일 밝게 보이는 게 화성, 그 다음에 그 삼각형으로 있는 것이 전갈자리 으뜸별 안타레스라는 별이거든요. 저녁 때 해 지고 보시면 그냥 보더라도 달 밑으로 세 개 밝은 별이 나란히 같이 있거든요. 삼각형으로요. 그 중에 제일 밝은 게 화상, 달 바로 밑에 있는 것이 토성 이렇게 이해하시면 되고요. 머리 위에 제일 밝은 것이 직녀예요. 얼마 전 칠석이었잖아요? 머리 위에 제일 밝게 보이는 게 직녀고요. 직녀가 있으면 견우가 있겠죠. 직녀의 남쪽, 남남북녀라는 말이 있잖아요. 머리 위 제일 밝은 게 직녀, 그 남쪽이 견우. 이렇게 길잡이만 찾으면 나머지는 그렇게 어렵지 않아요. 밝은 별들, 지금 말씀드린 것은 도시에서도 보이니까 오늘 밤 멋진 밤 하늘 꼭 보시기 바랍니다.[홍지명] 저는 북두칠성과 오리온 자리는 확실히 찾겠는데 다른 것은 좀. 그런데 요즘 어렸을 때는 밤 하늘에 정말 별이 많았는데 요즘은 왜 잘 안보이는 거죠?[이태형] 기본적으로 도시에 불빛이 많기 때문이기도 하고요. 그리고 사람들이 너무 바빠요. 하늘 쳐다보지 않고 주로 가로등 빛이라든가 건물 사이를 지나다니다보니까 하늘 볼 여유도 없고. 물론 약간 공해도 심해지긴 했지만요. 우리가 여유를 찾고 지금도 시골 가시면 별 많이 보입니다.[홍지명] 알겠습니다. 오늘 자세한 설명 말씀 감사합니다.[이태형] 네, 고맙습니다.[홍지명] 한국 우주환경과학 연구소 이태형 소장이었습니다.KBS▶ [저작권자ⓒ KBS 무단복제-재배포 금지]"
206,2016-08-12,환율·유가하락에 수출입물가 3개월만 하락,https://news.naver.com/main/read.nhn?mode=LSD&mid=shm&sid1=101&oid=008&aid=0003725919,머니투데이,"[머니투데이 유엄식 기자] [7월 수출물가 2.2%, 수입물가 2.8% 전월대비 각각 하락]원/달러 환율, 국제유가가 동반 하락하면서 수출입물가가 3개월만에 하락세로 돌아섰다.12일 한국은행에 따르면 2016년 7월 수출물가지수는 78.80(2010년 100기준)으로 전월대비 2.2%, 전년동월대비 7.5% 각각 하락했다.지난 4월 이후 두 달 연속 상승세였다가 3개월만에 하락한 것이다.수출물가 하락은 원화 강세에 따른 원/달러 환율 하락했고 오름세였던 국제유가가 다시 떨어진 영향이 컸다. 국제유가가 하락하면 이를 원재료로 하는 석탄 및 석유제품 생산단가를 낮춘다. 원화가 강세일수록 달러화 환산시 원화 기준 제품단가가 하락한다.7월 원/달러 환율은 평균 1144.09원으로 전월대비 2.3% 하락했다. 국제유가는 두바이유 기준 배럴당 42.53달러로 전월대비 8.1% 하락했다.전월대비 품목별 수출물가지수는 경유(-8.8%), 제트유(-9.7%), 휘발유(-14.5%), 나프타(-10.1%), D램(-2.6%), 인쇄회로기판(-7.6%), 시스템반도체(-3.2%) 등은 하락한 반면, 은괴(11.4%), 금괴(2.5%) 등 제1차금속제품은 상승했다.7월 수입물가지수는 75.85로 전월대비 2.8%, 전년동월대비 7.1% 각각 하락했다.원재료 수입물가는 광산품을 중심으로 전월대비 4.3% 상승했고 중간재도 석탄 및 석유제품 중심으로 전월대비 2.5% 하락했다. 자본재 수입물가지수는 94.10, 소비재 수입물가지수는 96.49로 전월대비 각각 1.8%, 2.1% 하락했다.전월대비 수입물가지수는 옥수수(-5.7%), 원유(-10.2%), 경유(-7.4%), 웨이퍼가공장비(-2.1%), 의료용기기(-1.0%), 그래픽카드(-3.4%), 니켈1차제품(-4.9%), 알루미늄정련품(-1.6%) 등 대부분의 품목이 하락했다.[이코노미스트들의 깊이있는 투자정보 'TOM칼럼'][부자들에게 배우는 성공 노하우 '줄리아 투자노트'  ][내 삶을 바꾸는 정치뉴스 'the 300']유엄식 기자 usyoo@<저작권자 ⓒ '돈이 보이는 리얼타임 뉴스' 머니투데이, 무단전재 및 재배포 금지>"
207,2016-08-12,독일 '위험한 난민 솎아내기' 박차 가한다,https://news.naver.com/main/read.nhn?mode=LSD&mid=shm&sid1=104&oid=001&aid=0008607875,연합뉴스,"난민 포용정책 고수하며 통제 강화하기로 한 독일의 앙겔라 메르켈 총리[AP=연합뉴스 자료사진]범법 외국인 즉각추방…IS가담 이중국적자 독일국적 박탈(서울=연합뉴스) 장재은 기자 = 최근 잇따른 극단주의 테러에 노출된 독일이 난민 신청으로 유입된 이주민들에 대한 경계를 대폭 강화하기로 했다.영국 파이낸셜타임스(FT)에 따르면 토마스 데메지에르 독일 내무부 장관은 이주민들의 추방에 대한 절차를 간소화하는 등의 내용을 담은 대테러 종합대책을 11일(현지시간) 발표했다.골자는 이슬람국가(IS)와 같은 극단주의 무장세력과 연계된 난민 등 공공안전을 위협하는 이주민들을 더 빠르고 광범위하게 솎아낸다는 것이다.이번 대책에 따라 독일 실정법을 위반하거나 극단주의를 추종하는 난민 신청자들을 지금보다 훨씬 신속하게 추방할 사법 절차가 마련된다.외국인 범죄자나 잠재적 테러리스트와 같은 공공안전을 위협하는 인물을 누구나 추방할 수 있도록 하는 권한을 당국에 부여하는 방안도 추진된다.데메지에르 장관은 난민 신청이 거부된 뒤 임시로 머무는 이주자들, 특히 가짜 신원정보를 제시했다가 발각된 이들에 대한 단속도 강화하기로 했다고 밝혔다.IS처럼 해외에서 전투를 벌이는 무장세력에 가담하는 이중국적자들에 대해서는 독일 국적을 박탈하기로 했다.[EPA=연합뉴스 자료사진 ]극단주의자를 골라내기 위해 네덜란드, 노르웨이, 스웨덴처럼 이주민들의 소셜미디어 활동을 검열하는 방안도 안보대책의 하나로 도입하기로 했다.독일의 이 같은 긴급대책은 최근 극단주의를 추종한 난민 신청자들이 잇따라 잔혹행위를 저지르면서 입안됐다.지난달 독일에서는 아프가니스탄 출신 이주자가 통근열차에서 도끼를 마구 휘둘렀고 시리아 출신 이주자는 음악축제장 근처에서 자살폭탄을 터뜨렸다.이들 사건 모두 IS가 배후를 자처해 독일도 극단주의 테러의 예외가 아니라는 점이 확인됐다.데메지에르 장관은 ""누구도 절대적인 안전을 보장할 수 없지만 우리가 할 수 있는 부분은 해야 한다""며 대책의 의미를 설명했다.이주자들의 최근 테러는 난민을 포용하는 정책을 펼쳐온 앙겔라 메르켈 독일 총리에게 정치적 타격으로 작용하고 있다.포용정책을 고수하고 있는 메르켈 총리의 지지율은 이들 테러를 기점으로 12％ 포인트나 깎였다.메르켈 총리가 이끄는 집권 다수당인 기독민주당(CDU)은 테러 여파로 내년 연방의회 선거를 앞두고 발등에 불이 떨어진 상황이다.한편 무슬림 여성의 얼굴을 가리는 부르카 착용를 금지하거나 이중국적 제도를 전면 폐기하자는 제안은 이번 종합대책에서 제외됐다.jangje@yna.co.kr"
208,2016-08-12,"""北, 올들어 60여명 공개처형…김정은식 공포정치 확산""",https://news.naver.com/main/read.nhn?mode=LSD&mid=shm&sid1=100&oid=001&aid=0008607564,연합뉴스,"김정은,현영철 장성택 둘다 불경죄로 처형 [연합뉴스 자료 사진]대북소식통 ""주민단속기구 '3·12 상무' 재가동""""탈북민 가족 및 탈북 브로커 수시로 공개처형""(서울=연합뉴스) 김호준 기자 = 북한 당국이 올해 들어 주민들에 대한 공개처형을 대폭 늘리고, 김정은 노동당 위원장의 지시로 공안기구 중심의 주민 단속기구인 '3·12 상무'를 재가동하는 등 '김정은식 공포정치'가 북한 사회 전반으로 퍼져나가고 있는 것으로 12일 알려졌다.북한 사정에 밝은 대북소식통은 ""올해 8월 현재 북한 당국은 약 60여명의 주민들을 공개 처형한 것으로 알려졌다""며 ""이는 김정은 집권 이후 연평균 처형자수(30여명) 보다 2배 이상 많은 수준""이라고 말했다.이 소식통은 ""이처럼 북한이 주민 대상 공개처형을 확대하고 있는 것은 대북제재 여파로 경제난이 계속되면서 연이은 전투(70일ㆍ200일 전투)와 무리한 상납금 강요로 주민들의 불만이 증대되자, 공개처형을 주민통제 수단으로 활용하고 있기 때문""이라고 설명했다.특히 북한은 탈북민을 체제 위험요소로 인식하고, 탈북민 재북(在北) 가족과 탈북브로커들을 수시로 공개 처형하는 것으로 알려졌다.북한 내부소식통에 따르면 올해 2월 초 보위성은 탈북민 재북 가족과 송금브로커 수십 명을 체포해 '간첩' 혐의로 처형했고, 4월에는 양강도 혜산에서 돈을 받고 주민들의 탈북을 지원해준 브로커 10여 명을 체포해 총살했다.이 소식통은 ""4월 초 양강도 혜산에서 한국영화, 드라마 등을 시청한 주민 수명을 총살했으며, 7월에는 강원 원산, 평북 운산 등에서 마약을 흡입하거나, 유통한 마약사범 10여 명을 처형했다""며 ""북한 주민들 사이에선 '영상물 시청 같은 일반 범죄자까지 처형하는 것은 너무하다', '김정은의 공포정치 때문에 무서워서 못 살겠다'는 불만이 확산하고 있다""고 말했다.김정은 북한 노동당 위원장은 올해 3월 보위기관에 ""주민들에게 자유시간을 주면 개인 돈벌이 생각과 사회 불평만 늘고 종파음모도 커지기 때문에 통제를 강화하라""고 지시한 것으로 알려졌다.이에 따라 북한은 6월 1일부터 12월 17일까지인 '200일 전투'를 강행하면서 주거지 이탈 주민들을 대대적으로 체포해 강제노동에 투입하고 있는 것으로 전해졌다.또 다른 대북 소식통은 ""김정은은 200일 전투가 시작되기 직전인 5월 말 보위기관에 지시를 내려 '200일 전투는 사상전이므로 사상전에서 누락된 주민들은 이 땅에서 살 자격이 없다. 3·12상무가 전국적 범위에서 활동을 재개해 무직자들을 모두 잡아들이라'고 지시했다""고 밝혔다.김 위원장은 ""직장 무단 이탈자들이 당과 군대, 국가의 주요 비밀을 중국과 한국 등에 빼돌리는 주요 범죄자이며 이들을 제압하는 것이 북한을 보위하는 중요한 사업""이라고 강조했다고 이 소식통은 전했다.3·12 상무는 노동당 조직지도부가 중심이 돼 '거주지를 이탈해 불법 행위를 일삼는 자들을 강력하게 단속할 데 대하여'라는 제안서를 김정은으로부터 비준받아 조직한 주민 단속기구다. 3·12 상무라는 명칭이 붙은 것은 2014년 3월 12일에 결성된 조직이기 때문이다.이 기구는 당 조직지도부 부부장, 국가보위성 부부장, 인민보안성 부부장, 중앙검찰소, 중앙재판소 부소장 등이 각 기관 책임자가 참여해 주민등록상 거주지를 이탈한 주민을 단속하고 있다.최근 들어 3·12 상무는 200일 전투를 위한 강제노역에 앞장서고 있으며, 이는 북한이 대북제재에 따른 외부지원 급감과 내부재원 고갈로 노동력 외에 가용 수단이 없어지자 직장 및 거주지 이탈자를 잡아다가 강제노동에 투입하는 활동을 재개한 것으로 분석된다.hojun@yna.co.kr"
209,2016-08-12,학교도 '전기료 폭탄'…산업용보다 21% 비싸,https://news.naver.com/main/read.nhn?mode=LSD&mid=shm&sid1=102&oid=001&aid=0008607493,연합뉴스,"안민석 의원 ""정부 교육용 전기요금 체계 개선에 적극 나서야""(세종=연합뉴스) 황희경 기자 = 초·중·고등학교에 적용되는 교육용 전기요금이 표면적으로는 산업용, 일반용 전기요금보다 낮게 책정됐지만 요금 체계 산정상의 문제로 실제 적용되는 요금 단가는 가장 높은 수준인 것으로 나타났다.12일 교육부가 국회 교육문화체육관광위원회 안민석 의원(더불어민주당)에게 제출한 자료에 따르면 2014년 기준 초·중등학교의 전력사용량은 32억7천400만kWh로 국가 전체 전력사용량 4천775억8천900만kWh의 0.6% 수준이었다.당시 한국전력에서 책정한 초·중등학교 교육용 전기요금 단가는 kWh당 평균 76.6원이었지만 실제 초·중·고등학교에서 납부한 전기요금은 4천226억원으로 부담단가가 kWh당 129.1원이었던 것으로 나타났다.이는 누진제가 적용되는 가정용 전기요금의 실제 부담단가 125.1원/kWh보다도 높은 수준이며 실제 부담단가가 129.7원으로 가장 높은 유통·금융 등 서비스 업종에 적용되는 일반용 전기요금과 거의 같은 수준이다. 산업용 전기요금의 실제 부담단가 106.8원과 비교하면 약 21% 높은 수준이다.이같은 현상이 생기는 것은 1년 중 가장 많은 전력을 사용한 날의 전력량 요율인 피크전력 사용량을 기준으로 기본요금을 정하는 교육용 전기요금의 산정 체계 때문이다.안 의원은 ""피크전력 사용량 기준으로 기본요금을 산정하는 방식 때문에 교육용 전기요금이 산업용보다 약 21% 과다 부과되고 있고 기본요금 비중도 산업용 대비 약 109% 높아 전기요금 부담이 크다""고 지적했다.안 의원은 ""교육부가 전기요금 산정방식과 법 개정을 통한 학교 전기요금 제도 개선보다는 전기를 효율적으로 사용해 전기요금을 줄이려는 학교 현장 지도에 집중하고 있어 안타깝다""면서 ""정부가 법 개정 및 제도 개선을 적극적으로 추진해야 한다""고 말했다.zitrone@yna.co.kr"
