,날짜,기사 제목,기사 링크,기사 출처,기사 내용
19,2010-04-06,'칠성파 두목' 이강환 검거…자수하러 가는 길?,https://news.naver.com/main/read.nhn?mode=LSD&mid=shm&sid1=102&oid=055&aid=0000180008,SBS,"<8뉴스><앵커>전국 최대의 폭력조직인 칠성파의 두목 이강환 씨가 공개수배 1달여 만에 경찰에 붙잡혔습니다. 건설업체 대표를 위협해서 수 억 원을 강탈한 혐의를 받고 있습니다.KNN, 장현주 기자가 보도합니다.<기자>칠성파 두목 67살 이강환이 초췌한 모습으로 휠체어를 탄 채 경찰에 호송됐습니다.이 씨는 담담한 표정이었지만 몸이 불편한 듯 부자연스러운 움직임을 보였습니다.이강환은 이곳 현장에서 차를 옮겨타려다 신고를 받고 출동한 경찰에 붙잡혔습니다.이 씨는 변호사와 조직원으로보이는 남성 2명과도 함께 있었습니다.[손민호/부산 부암지구대 경위 : 변호사가 같이 ""우리 이강환 회장이 맞습니다. 수배 간 사이에 자수의사를 밝히고 지금 가려고 하는 중 입니다."" 그렇지만 우리는 일단 신고를 받고 왔기 때문에 일단 확인할 건 해야되겠다….]이 씨는 지난 2005년부터 2년 동안 모 건설업자 대표를 위협해 4억 원 상당의 금품을 빼앗은 혐의로 경찰에 수배를 받아왔습니다.경찰은 이 씨를 상대로 구체적인 혐의사실과 도피과정 등에 대해 조사를 벌이고 있습니다.[이승덕/부산 연제경찰서 형사과장 : 시행사 대표를 협박해서 금품을 갈취한 것이 주 혐의내용이 되겠습니다.]경찰은 지난 2월 법원으로 부터 체포영장을 발부받아 검거에 나섰다가 실패한 뒤 이 씨를 전국에 공개수배했습니다.이 씨는 지난 1991년 조직폭력과의 전쟁 때 검거돼 8년간 복역하는 등 지금까지 전국 최대 폭력조직 칠성파 두목으로 활동해 왔습니다.(영상취재 : 하호영(KNN))관/련/정/보◆ 부산 폭력조직 '칠성파' 두목 이강환은 누구?◆ [생생영상] 국내최대 '칠성파' 두목 검거◆ '전국 최대' 칠성파 두목 이강환, 안 잡나 못 잡나?◆ 칠성파 두목 '이강환 검거작전' 어디서 샜나[SBS기자들의 생생한 취재현장 뒷이야기 '취재파일']저작권자 SBS&SBS콘텐츠허브 무단복제-재배포 금지"
20,2010-04-06,어린이집 보육교사 '원아 상습폭행' 영상 공개,https://news.naver.com/main/read.nhn?mode=LSD&mid=shm&sid1=102&oid=214&aid=0000138721,MBC,"[뉴스데스크]◀ＡＮＣ▶전남 목포에 있는 한 어린이집에서 보육교사가 아이들을 폭행하는 장면이 카메라에 잡혔습니다.너무 지나치다고 느낀 동료교사가 폭행현장을 촬영해 공개했습니다.양현승 기자입니다.◀ＶＣＲ▶점심시간,보육교사가 손바닥으로20개월을 갓 넘은 아이의뺨을 때립니다.울음을 터뜨리자폭행이 더 심해집니다.옆에 있다 놀란 아이가 울자이 아이도 뺨을 주먹으로 때리고위협합니다.◀ＳＹＮ▶""고집 피우지 마세요.고집 피우지 마세요.대답해.""보다 못한 동료교사가현장을 촬영했습니다.◀ＳＹＮ▶ 동료교사""그 선생님이 애들을 때렸다고제가 먼저 원장님한테 말했어요.그런데 물증이 없으니까뭘 자기도 어떻게 할 수가 없대요.""그동안 어린이집 측은폭행으로 생긴 멍을아이들이 울며 떼쓰다 난 상처라고감춰왔습니다.부모들은 해당 교사를고발하기로 했습니다.◀ＳＹＮ▶ 학부모""전혀 믿음이 생기지 않고맡기고 싶지도 않아요.제가 둘째를 가지고 있어도 그냥집에 데리고 있고 싶어요.""간식거리도 부실했습니다.식단표에우유가 나오기로 돼있는 날에어린이집에서는 이처럼자판기용 탈지분유를 물에 섞어서아이들에게 먹였습니다.◀ＳＹＮ▶ 어린이집 조리사""한 15일 정도된장국만 끓인 적도 있었어요.그리고 저는 (원장이)사다준 대로 할 뿐입니다.(우유를 먹일 때(탈지분유) 타서 먹여라?)그렇죠.""목포시는 뒤늦게진상조사에 착수했습니다.MBC뉴스 양현승입니다.(양현승 기자)[저작권자(c) MBC (www.imnews.com) 무단복제-재배포 금지]"
21,2010-04-06,"軍, 9시15분 상황일지 간접시인",https://news.naver.com/main/read.nhn?mode=LSD&mid=shm&sid1=102&oid=008&aid=0002308743,머니투데이,"[머니투데이 김성현 기자]군이 6일 천안함 침몰사고 당일 최초 상황보고를 받은 시각이 군 발표와 달리 9시15분이었다는 일부 언론 보도를 간접 인정했다.국방부 원태재 대변인은 정례 브리핑에서 ""각 제대별로 자기들이 판단하고 추정하고 있는 시간을 제출받아서 모은 적이 있다""며 ""그 중에 9시15분이 아마 거론된 것으로 알고 있다""고 밝혔다.원 대변인은 다만 ""이 사건을 해결하고 발발시간을 해명하는 데는 9시15분이 별로 의미는 없다""고 주장했다.[관련기사]☞李대통령 ""천안함 합조단 책임자 민간이 맡아야""☞천안함 실종자 어머니 ""아들이 찬 바다에…""☞천안함 침몰 '김 소령 양심선언' 가짜였다☞鄭총리 ""4대강 도움을"", 鄭추기경 ""그보다 천안함이…""▶ (머니마켓) 성공투자의 지름길 '오늘의 추천주'▶ (머니마켓) 오늘의 증권정보 '재야고수 종목 엿보기'김성현기자 sean@<저작권자 ⓒ '돈이 보이는 리얼타임 뉴스' 머니투데이, 무단전재 및 재배포 금지>"
22,2010-04-06,"국정원, 천안함 침몰 北연루설에 신중",https://news.naver.com/main/read.nhn?mode=LSD&mid=shm&sid1=100&oid=001&aid=0003210118,연합뉴스,"정보위, 천안함 침몰 국정원 보고 청취     (서울=연합뉴스) 이정훈 기자 = 6일 오후 국회 정보위원회에서 열린 전체회의에 출석한 원세훈 국정원장이 개회에 앞서 자리에서 대기하고 있다.   2010.4.6   uwg806@yna.co.kr(서울=연합뉴스) 김범현 안용수 기자 = 국가정보원은 6일 천안함 침몰사고를 전후해 북한의 특이동향은 없었다며 `북한 연루설'에 조심스러운 입장을 나타냈다.원세훈 국정원장은 이날 국회 정보위 전체회의에 출석해 지난달 26일밤 서해상의 해군 천안함 침몰을 전후한 북한의 동향과 김정일 국방위원장의 중국 방문 가능성에 대해 보고했다.원 원장은 ""이 사고를 전후해서 북한의 특이동향이 없었다""며 ""현재로서는 북한의 연관성 유무를 단정할 수 없다""고 말했다고 한나라당 간사인 정진섭 의원이 전체회의 직후 브리핑에서 밝혔다.원 원장은 또 ""북한 동향 관련 정보가 아닌 군 내부 정보에 대해 국정원은 보고를 받지 않는다""며 ""파편 등의 물증이 나와야 북한이 연루됐는지 알 수 있다""고 보고한 것으로 다른 참석 의원이 전했다.이는 침몰사고와 북한의 연관 가능성에 대해 신중론을 피력한 것으로 해석되는 대목이다. 또 객관적 증거가 없는 상태에서 섣불리 예단해서는 안된다는 이명박 대통령의 입장과 같은 흐름으로도 볼수 있다.원 원장은 또 ""국정원이나 미국 CIA가 교신기록 등의 정보가 있으면 있다고 보고를 하는데 이번에는 그런 보고가 없었다""고 밝힌 뒤, 군 강경파의 단독 행동에 가능성에 대해서는 ""북한이 연루됐다면 해군부대나 정찰국 차원에서 김정일 국방위원장의 지시없이 단독으로는 하기는 어렵다""고 낮게 평가했던 것으로 알려졌다.회의에서 원 원장이 `국정원은 군 내부의 정보를 보고받지 않는다'는 점을 들어 사고발생 단서에 대해 자세한 언급을 하지 않자 민주당 의원들을 중심으로 국정원의 정보력 부재를 질타하는 목소리가 이어졌던 것으로 전해졌다.민주당 간사인 박영선 의원은 ""국정원이 군사 정보와 관련해서는 보고를 받지 않는다는데 대해 논쟁이 많았다""며 ""여러 신호정보 전체를 분석해서 종합적인 결론을 내리는게 국정원 역할 중 하나인데 보고받지 않았다는 것은 직무유기""라고 말했다.반면 한나라당 간사인 정진섭 의원은 ""북한의 동향은 공유하는 것이고, 그와 관련되지 않는 것은 보고받지 않는다고 이해를 하면 된다""고 말했다.원 원장은 ""(정보를 공개하면) 당장 국민과 언론의 궁금증을 해소할 수 있을지 모르나 우리에 대한 신뢰가 떨어진다""며 ""미국과의 정보 공유 등에도 어려움이 생길 수 있다""고 토로한 것으로 한 참석 의원이 전했다.원 원장은 또 함미를 일반 어선이 발견한 데 대해 ""함미는 사고현장에서 300m 떨어진 곳에서 해군 소해함이 발견한 것""이라고 설명한 것으로 알려졌다.속초함의 발포명령과 관련해서는 ""평택 제2함대사령관이 지시를 한 것""이라고 말했다.kbeomh@yna.co.kraayyss@yna.co.kr[관련기사]▶ 국정원장 ""천안함침몰, 北관련 단정 어려워""(종합)▶ 국정원 ""김정일, 25일께 중국 방문 가능성""▶ <李대통령, `단호한 입장' 강조 의미는>▶ MB ""침몰사고, 정치적 이용 안돼""(종합)▶ <생존장병 미니홈피에 '무사귀환' 기원 글 남겨><뉴스의 새 시대, 연합뉴스 Live><모바일 애플리케이션><포토 매거진><저작권자(c)연합뉴스. 무단전재-재배포금지.>"
23,2010-04-06,"해외서 산 명품백, 교환은 본인이 알아서 해라?",https://news.naver.com/main/read.nhn?mode=LSD&mid=shm&sid1=101&oid=055&aid=0000180017,SBS,"<8뉴스><앵커>요즘 해외여행을 가서나, 인터넷 등으로 외국상품 구입하는 분들 많은데요. 물건을 제 때 전달받지 못 하는 등, 피해 사례가 급증하고 있습니다.권란 기자입니다.<기자>주부 박 모 씨는 지난 1월 남편으로부터 명품가방을 선물 받았습니다.150만 원을 주고 외국 면세점에서 구입한 새 제품인데도 여기저기 흠집이 있어서 교환하려 했지만 바꿀 수가 없었습니다.[박 모 씨/피해 소비자 : (한국 지사는) 유통경로가 다르고, 면세점과 전혀 다르기 때문에 교환이 안된다고 하더라고요. 본인이 스스로 직접 산 곳 면세점과 전화통화를 하거나 본인이 해결을 해야된다고 해서…]김 모 씨도 지난해 말 미국 출판사 사이트에서 67달러 어치, 책 10권을 주문했는데, 엉뚱하게도 영수증만 전달받고 책은 몇 차례 항의 끝에 두 달 가까이 돼서야 도착했습니다.이렇게 국제 거래에서 피해를 봤다며 지난해 소비자원에 접수된 사례가 550여 건으로 3년 전보다 4배나 늘었습니다.절반 정도는 외국산 제품 구매를 대행해주는 인터넷 사이트에서 피해를 입었고, 해외에 나가 직접 사거나, 외국 인터넷 사이트에서 구매한 경우도 있습니다.하지만, 사업자가 외국에 있고, 나라마다 환불이나 교환 규정이 달라서 분쟁 해결은 쉽지 않습니다.[구경태/한국소비자원 국제협력팀 과장 : 가급적 신용카드로 하는 것이 위험을 예방하는 측면이 있습니다. 왜냐하면 신용카드는 현지에 있는 가맹점 또는 판매점을 상대로 개입할 수 있는 여지가 있고요.]소비자원은 외국 제품을 구매할 땐 제품 상태와 사업자 정보, 또 환불과 보상 규정을 꼼꼼히 살피는 게 피해를 줄이는 지름길이라고 당부했습니다.(영상취재 : 유동혁)권란harasho@sbs.co.kr관/련/정/보◆ 와인, 막걸리에 '휘청'…""90% 할인"" 폭탄 세일◆ 생수보다 맛있는 '수돗물'…""불안해서 안 마셔""◆ ""'값비싼' 휴대전화, 안 쓰는 기능 왜이리 많나""◆ 공짜폰, 알고보니 공갈폰?…별정 통신사 '주의'◆ 정신과 진료 받으면 '가입 거부'…황당 보험사[SBS기자들의 생생한 취재현장 뒷이야기 '취재파일']저작권자 SBS&SBS콘텐츠허브 무단복제-재배포 금지"
24,2010-04-06,"해적선 따라잡은 이순신함…""선원들 무사 확인""",https://news.naver.com/main/read.nhn?mode=LSD&mid=shm&sid1=100&oid=055&aid=0000179996,SBS,"<8뉴스><앵커>여러분 안녕하십니까? 소말리아 해적들에게 납치당한 유조선 삼호드림호를 쫓고 있는 충무공 이순신함이 유조선과 50km 거리까지 접근했습니다. 선원들은 모두 무사한 것 같다고 전해왔습니다.먼저, 김지성 기자가 보도합니다.<기자>오늘(6일) 오후 5시쯤, SBS가 청해부대 충무공 이순신함과의 교신에 성공했습니다.[청해부대 000 입니다.]피랍된 삼호드림호에 있는 우리 선원 5명이 안전한 것으로 판단된다고 전했습니다.[(우리 선원 5명의 안전이 확인됐는지?) 저희는 안전한 것으로 다 판단하고 있습니다.]구축함인 충무공 이순신함이 삼호드림호를 끌고가는 해적선을 따라잡은 것은 오늘 새벽 1시 20분, 오만의 살랄라항을 출발한 지 만 하룻만입니다.삼호드림호에는 현재 해적 수십 명이 승선해, 소말리아 본거지인 호비요로 향하고 있는 것으로 알려졌습니다.현 속도대로라면 현재 위치에서 해적 본거지까지는 약 11시간 정도 남아 있습니다.충무공 이순신함은 삼호드림호와 50km 정도 거리를 유지하면서 해적들의 숫자와 무장 상태를 살피고 있습니다.현재 삼호드림호 주변에는 미 해군 등 연합 함대 없이 충무공 이순신함 혼자 작전을 수행 중인 것으로 알려졌습니다.[(50km 거리 유지하면서 관망하고 있는 건가요?) 네. (교전이 발생한 것은 아니죠?) 그런 것은 아직 아닙니다.]해적들은 삼호드림호 납치 이후 삼호해운 측에 한 차례 연락을 시도해 왔지만, 요구사항에 대해서는 밝히지 않은 것으로 전해졌습니다.(영상편집 : 김진원)김지성jisung@sbs.co.kr관/련/정/보◆ 삼호드림호에 접근 성공…소말리아 연안 이동중◆ 삼호드림호 선사 ""해적과 협상 착수설 사실무근""◆ ""해적 올라탔다"" 구조요청 뒤…한국인 5명 피랍◆ '해적의 계절' 돌아왔다…10대 소년들도 해적질◆ 반복되는 피랍…해적 활동 무대도 확대[SBS기자들의 생생한 취재현장 뒷이야기 '취재파일']저작권자 SBS&SBS콘텐츠허브 무단복제-재배포 금지"
25,2010-04-06,합동참모본부 그날 밤 뭐했나… 사고 직후 곳곳 허점,https://news.naver.com/main/read.nhn?mode=LSD&mid=shm&sid1=100&oid=032&aid=0002059737,경향신문,"ㆍ합참의장 역할 논란천안함 침몰 직후 군 최고작전기관인 합동참모본부의 군사 대응이 곳곳에서 허점을 드러낸 정황이 포착되고 있다. 상황 발생 당시 이상의 합참의장의 대응과 역할이 적절했는지에 대한 논란도 일고 있다.가장 먼저 제기되는 의문은 이 의장이 천안함 침몰 보고를 언제 처음 받았는지, 해군에 격파사격 승인을 했는지 여부다. 그러나 합참은 6일까지 ‘군사 상황’이라는 이유로 이 의장의 대응 내용에 대해 밝히지 않고 있다. 북한 핵실험 등 대형 사건이 벌어지면 군 수뇌부의 대응 태세를 공개해오던 것과는 상반되는 태도여서 의혹을 자초하고 있다는 지적이다.합참이 앞뒤가 맞지 않는 경계태세 강화지시를 내렸다는 의혹도 제기됐다. 합참은 천안함이 북한 함정의 공격으로 침몰했다고 초기 판단했을 당시에는 ‘전군경계태세 강화 지시’를 내리지 않았다. 그러다 ‘북한군의 특이동향이 없다’고 밝힌 다음날에야 뒤늦게 내려 선후가 뒤바뀌었다는 비판이 제기되고 있다.합참의 긴급대응반·초기대응반·위기관리반 비상소집 명령도 상황 접수 45분 이후에야 내린 것이어서 뒷북 대응이라는 지적이다. 게다가 상당수 비상소집 대상자들은 정해진 소집시간에 정위치하지 못한 것으로 알려졌지만 합참은 비상소집 발령시간에 대해서조차 “답변할 수 없다”고 말했다.또 해군 2함대 속초함의 격파사격 요청을 승인한 지휘관은 군 작전지휘라인의 최고책임자인 이 의장이 아닌 김태영 국방장관인 것으로 밝혀지고 있다. 당시 이 의장은 대전 육군교육사령부에서 합참이 주관한 합동성 강화 대토론회가 끝난 후 서울로 향해 국방부·합참의 지휘통제실에 이날 오후 10시45분에 도착했다. 그러나 이 의장이 타고온 KTX에서는 통신이 얼마든지 가능한데도 군 작전 최고지휘관인 그가 위중한 사안인 함포 사격을 통제하지 못했다는 논란에 휩싸인 것은 문제라는 지적이다. 김 장관의 승인에 따라 속초함은 당일 오후 11시부터 5분간 76㎜ 함포로 사격했다. 합참은 이에 대한 사실 확인을 거부했다.천안함 침몰 직후 해군은 북한의 공격 가능성이 높은 것으로 판단, 서해상 적의 도발 위기에 대비해 해군 작전 예규상 명시돼 있는 가장 강도 높은 단계의 대비 태세인 ‘서풍 1’을 발령했다. 초기 상황이 긴박하게 돌아가면서 이명박 대통령은 이날 오후 10시쯤 긴급 안보관계 장관회의를 소집했지만 정작 공군 F-16 전투기에 서해상을 향한 긴급발진 명령이 내려진 시각은 이날 오후 10시43분이었다.합참이 초동조치가 마무리된 후인 다음날 오전 1시50분쯤 육군 제3야전군사령부에 군사대비태세 강화 지시를 내린 것도 의문이다. 이때는 이미 속초함이 격파사격을 실시한 대상이 새떼란 결론을 내린 이후였다. 천안함이 침몰하자 해경은 경찰이 비상사태에 대비해 내리는 가장 높은 수위의 대응태세인 ‘갑(甲)호’ 비상, 육상 경찰은 갑호 아래의 ‘을(乙)호’ 비상을 걸었다. 정작 당사자인 군보다 훨씬 앞서 경계를 강화한 것이다.<박성진 기자 longriver@kyunghyang.com>[관련기사]▶ “침몰 후 10일 지나도 아무것도 모른다는 것이 더 큰 문제”▶ 국정원장 “사고 전후 북 특이동향 없었다”▶ “물증 없이 단언 어렵다”… 국정원도 ‘북 연관설’ 신중▶ 위기대응 뒤죽박죽, 여권 나사 풀렸다- 대한민국 희망언론! 경향신문, 아이폰 애플리케이션 출시 -ⓒ 경향신문 & 경향닷컴(www.khan.co.kr), 무단전재 및 재배포 금지〈경향닷컴은 한국온라인신문협회(www.kona.or.kr)의 디지털뉴스이용규칙에 따른 저작권을 행사합니다.〉"
26,2010-04-06,주민센터에 또 도둑…주민등록·인감 위조 비상,https://news.naver.com/main/read.nhn?mode=LSD&mid=shm&sid1=102&oid=055&aid=0000180009,SBS,"<8뉴스><앵커>대전의 한 주민센터가 일주일새 두 번이나 도둑을 맞았습니다. 그런데 도둑맞은 물건이 예사롭지가 않습니다.TJB, 이한주 기자가 취재했습니다.<기자>오늘(6일) 새벽 3시쯤 대전의 한 주민센터에 도둑이 들었습니다.창문을 깨고 침입했는데 경비업체가 현장에 왔을 땐 이미 범인은 사라진 뒤였습니다.[주민센터 관계자 : 8분. (3시 16분에 경보가 울렸고, 26분에 출동했는데 사라졌더라?) 네 그렇죠. 감쪽같이.]도둑이 든 주민센터는 일주일전 이미 한 차례 도둑이 들어 컴퓨터와 민원발급용지를 도난당한 곳입니다.이번엔 증명서류 발급을 확인하는 인증기가 사라졌습니다.동일범의 소행으로 짐작되는 데 주민등록등초본부터 인감증명까지 위조가 가능해 진 겁니다.두 번씩이나 당한 행정기관의 보안의식도 문제입니다.방범창이나 CCTV도 설치하지 않았고 금고에 보관해야할 서류는 책상 위에 방치했습니다.[대전시청 관계자 : 방범창 설치를 빨리해야죠. 시에서는 이것 때문에 CCTV 설치도 검토하고 있습니다.]행정기관의 허술한 보안의식 때문에 증명위조 등을 통한 제2, 제3의 범죄피해가 우려되고 있습니다.(영상취재 : 성낙중, 김경한(TJB))관/련/정/보◆ ""유흥비 위해서라면···"" 닥치는대로 강.절도◆ 보이스피싱 수법 '역이용'…은행원이 돈 가로채◆ '변태 무속인' 수년간 남자 아이들 성추행◆ `세상물정 어둡다고…' 수녀원 등친 악덕업자◆ 갱단 소속 '살인용의자'가 영어강사 ""오마이갓!""[SBS기자들의 생생한 취재현장 뒷이야기 '취재파일']저작권자 SBS&SBS콘텐츠허브 무단복제-재배포 금지"
27,2010-04-06,"李대통령 ""합조단 책임자 민간이 맡아야""(종합)",https://news.naver.com/main/read.nhn?mode=LSD&mid=shm&sid1=100&oid=001&aid=0003210152,연합뉴스,"국무회의 참석한 이 대통령    (서울=연합뉴스) 조보희 기자 = 이명박 대통령이 6일 오후 청와대에서 열린 국무회의에서 상정 안건을 심의하고 있다.  왼쪽 세번째가 김태영 국방장관. 2010.4.6    jobo@yna.co.kr국무회의서 김태영 국방장관에 지시(서울=연합뉴스) 이승우 기자 = 이명박 대통령은 6일 천안함 침몰사고 조사와 관련해 ""현재 군이 맡고 있는 민.군 합동조사단의 책임자를 누구나 신뢰할 수 있는 민간 전문 인사가 맡도록 해야 한다""고 말했다.이 대통령은 이날 오후 청와대에서 국무회의를 주재하면서 김태영 국방장관에게 이같이 말했다고 박선규 청와대 대변인이 전했다.이 대통령은 ""국방부는 적극 검토하도록 하라. 그래야 신뢰를 얻을 수 있다""면서 ""그렇게 결론이 나야 우리 정부도 단호한 입장을 취할 수 있다""고 강조했다.이는 현재 천안함 침몰 민.군 합동조사단장인 박정이 육군 중장 대신 민간에 단장을 맡기거나, 박 중장과 민간 인사가 공동 단장을 맡아야 한다는 뜻이라는 게 청와대측의 설명이다.또 일각에서 군이 사고 원인을 숨기려는 게 아니냐는 의혹이 일고 있는 점을 감안, 국민은 물론 국제사회로부터도 완벽한 신뢰를 얻을 수 있는 투명하고 객관적인 조사 결과를 내놓겠다는 의지의 표현으로 보인다.이 대통령은 ""천안함 침몰 원인을 규명하는 것은 우리만의 문제가 아니다. G20 (주요 20개국) 회원국과 6자회담 회원국 등 국제 사회가 주목하는 초미의 관심사""라며 ""그래서 무엇보다 신뢰가 중요하다. 철저하고 과학적인 조사를 통해 국제 사회의 인정을 받아야 한다""고 거듭 강조했다.이 대통령은 ""그래서 국제 전문가들의 도움도 청한 것""이라며 ""국제적인 전문가들이 단순히 보조 역할에 머물지 않도록 해야 한다. 명실상부한 공동조사를 해야 하고, 그 조사를 통해 공동 보고서를 내야 한다""고 지시했다.박선규 대변인은 ""너무나 중차대한 사안이어서 우리만의 결론을 국제사회가 신뢰하지 않을 수 있는 만큼 더욱 철저하게 객관적으로 조사하자는 의지를 내보인 것""이라며 ""그만큼 대통령이 이번 사안을 중히 여기고 이번 조사를 통해 국제사회 신뢰를 더 얻는 계기로 삼으려 하고 있다는 의미""라고 설명했다.청와대 관계자는 ""투명하고 믿을만한 결론이 나와야 우리 정부가 단호한 입장을 취할 수 있다는 점을 강조한 측면도 크다""고 말했다.leslie@yna.co.kr[관련기사]▶ 천안함 실종자가족-생존자 만남 연기▶ 국회,'천안함 침몰' 北개입설 등 격론 예고▶ 국정원 ""천안함침몰, 北관련 단정어려워""(종합2보)▶ 천안함 간부 3명, 사고 후 수색작업 참여▶ <국정원, `北 특이동향 없다' 근거는><뉴스의 새 시대, 연합뉴스 Live><모바일 애플리케이션><포토 매거진><저작권자(c)연합뉴스. 무단전재-재배포금지.>"
