,날짜,기사 제목,기사 링크,기사 출처,기사 내용
0,2010-04-06,스케이트 대신 책‥학교 찾은 '여왕' 김연아,https://news.naver.com/main/read.nhn?mode=LSD&mid=shm&sid1=102&oid=214&aid=0000138723,MBC,"[뉴스데스크]◀ＡＮＣ▶한국으로 돌아와서 모처럼 달콤한 휴식을 즐기고 있는 김연아 선수가 올 들어 처음으로 재학 중인 고려대를 찾았습니다.스케이트 대신 책을 손에 든 김연아, 표정이 궁금하시죠?박선영 기자입니다.◀ＶＣＲ▶국가대표 선수로서의부담을 내려놓고모처럼 학교를 찾은김연아.면 티와 하늘색 재킷,하얀색 스키니 바지의산뜻한 차림에봄이 느껴집니다.올림픽 챔피언이라는 일생의 꿈을 이룬만 스무 살 대학 2학년생 김연아에게이 총장은 이제는 대학생활을 즐기라고권했습니다.◀ＩＮＴ▶ 이기수 고려대 총장""이제 자네 나이에서 할 수 있는제일 좋은 게 학교생활이다.그렇지?""체육교육학과에 재학 중인 연아에게류태호 사범대 체육학과장은파머 교수의 '가르칠 수 있는 용기'라는 제목의원서와 번역서를 전달했습니다.류 교수는 미국이 낳은 피겨 스타미셸 콴과 나눈 대화도 들려줬습니다.◀ＩＮＴ▶ 류태호 사범대 체육학과장""미셸 콴이 서른이니까,'(연아가) 서른 정도 되면아마 나보다 훨씬 더 멋있게자랐을 거 아니냐'그런 얘기를 하더라고.""4월1일 만우절에 발행된 교내 학보에는도서관에서 책을 대출한 뒤 반납하지 않은김연아에 대한 만우절 기사가 실렸는데,연아의 얼굴에는 웃음이 번졌습니다.◀ＩＮＴ▶ 김연아""'아무리 김연아 선수라도연체했으면 도서관에못 들어오는 것이 당연하다며,그렇다고 꼭 오지 말라는 얘기는아니다'고 전했다.""이달 말 소속사와의계약 만료를 앞둔 김연아.은퇴설도 나오고 있는 터여서오늘 고려대 방문이 더욱관심을 끌고 있습니다.MBC뉴스 박선영입니다.(박선영 기자 sypark@imbc.com)[저작권자(c) MBC (www.imnews.com) 무단복제-재배포 금지]"
1,2010-04-06,"법정, 그는 ‘개혁가’였다",https://news.naver.com/main/read.nhn?mode=LSD&mid=shm&sid1=103&oid=028&aid=0002038077,한겨레,"[한겨레]세상과 불교 바꾸려 ‘현실참여’인혁당 사건 ‘충격’ 불일암으로법정 스님은 대중들에게 당대 최고의 수필가로 잘 알려져 있을 뿐, 그의 개혁가적 면모는 사실 그동안 거의 알려지지 않았다. 하지만 한국 불교가 내부 문제에만 침잠해 있을 때 그는 세상과 불교를 바꾸려고 애쓰던 선구자였다.법정 스님은 1973년 조계종 기관지인 <불교신문> 논설위원과 주필을 지낼 당시 함석헌, 장준하 등과 함께 민주수호국민협의회를 결성해 유신철폐 개헌 서명운동에 참여했고, 당시 민주화운동의 횃불 노릇을 했던 <씨알의 소리> 편집위원으로 활동했다.하지만 법정 스님은 인혁당 재건위 사건으로 8명의 젊은이가 생목숨을 잃은 데 대한 충격으로 서울에서의 모든 활동을 접고 1975년 10월 홀연히 전남 순천 조계산 송광사 불일암으로 들어가 독살이를 시작했다. 그가 송광사로 내려가자 사복형사 너덧 명이 사찰에 상주하다시피 하면서 그를 감시한 것으로 알려졌다. 하지만 법정 스님은 불일암으로 간 이후에도 남모르게 저항정신을 갖고 글을 쓴 사실이 최근 밝혀졌다.법정 스님의 속가 조카뻘인 현장(보성 대원사 주지) 스님은 “(법정) 스님은 불일암에 들어간 뒤에도 경복궁 옆 법련사(송광사 서울 분원)에 방 하나를 두고, 매월 법문을 하러 올라올 때마다 기거했는데, 어느 날 스님이 없던 그 방에 들어가서 스님이 지은 시들을 스크랩해둔 책자를 보았다”며 “자신의 심정을 담은 시들에는 독재에 대한 분노와 저항이 담겨 있었다”고 말했다. 현장 스님은 “그 스크랩들을 스님 몰래 복사해 두려다 실패한 적이 있는데, 긴급조치 위반으로 구류도 산 적이 있는 스님이 그런 글들이 외부에 유출될 위험을 경계한 때문인지, 어느 날 아궁이에서 직접 그 스크랩을 모두 태웠다”고 덧붙였다. 현장 스님은 법정 스님이 자신에 대한 감시를 피해 <불교신문> 등에 ‘형운’이란 가명으로 민주화에 대한 열망과 개혁을 담은 글들을 쓴 사실도 공개했다.현장 스님은 또 세상뿐 아니라 불교계 개혁을 열망한 법정 스님의 초기 글인 ‘부처님 전 상서’를 소개했다. 법정 스님이 세상에 내놓은 최초의 글인 ‘부처님 전 상서’는 그가 32살 때인 1964년 9월 <불교신문>에 기고한 3편의 글이다.민주화 열망 글 ‘가명기고’도글 ‘부처님…’ 불교 독선 질타‘심산에 수목처럼 덤덤히 서서 한세상 없는 듯이 살려고 했는데, 무심한 바위라도 되어 벙어리처럼 묵묵히 지내려 했는데, 이 울적한 심정을 당신에게라도 목소리하지 않고는 답답해 배기어 낼 수 없다’로 시작하는 ‘부처님 전 상서’에는 불교계 개혁가다운 그의 면모가 잘 드러나 있다.조계종 교육의 문제를 지적한 1편 ‘교육의 장’이란 글에선 ‘강원이나 선방이 눈밝은 인재를 양성하기 위해서라기보다는 실로 교육이라는 말조차 무색하리만큼 전근대적인 유물로서 박물관 진열장으로나 들어가야 할 쓸모없는 몸짓에 지나지 않을 만큼 타당한 방법론과 구체적인 계획성이 부재함’을 통렬하게 비판했다.법정 스님은 “참선자가 선에 참하기보다는 선에 착(집착)하기 일쑤고, 종교인으로서는 상상조차 할 수 없는 배타적이고 독선적인 벽 속에 스스로를 가두면서도, 그것으로서 오히려 자락을 삼는 것은 모두 이런 결함에 그 중요한 원인이 있다”고 선가의 실상에 대해서도 적나라하게 비판했다. 이어 “기본재산이 좀 여유있거나 수목이 우거진 절은 서로가 차지하려고 눈에 불을 켜고 날뛰는 꼴을 많이 본다”며 감투싸움과 사찰 뺏기 싸움에 대한 분노도 나타냈다.또 법정 스님은 “오늘날 한국불교가 종교로서의 사명을 다하지 못하고 있다는 점은 숨길 수 없는 사실이고 현대와 사회에 이바지할 수 없는 종교라면 그것은 하등의 존재가치도 없다”며 현실을 나 몰라라 하는 불교계 안팎의 무관심을 ‘죄악’이라고 꼬집었다.글은 “과감한 일대 개혁이 없이는 당신의 가르침이 이 땅에서는 영영 질식하고 말 것이라는 것을 우리는 똑똑히 알고 있다”며 “좀 지나치리만큼 무차별한 사격을 가한 것은 우리들이 당면한 오늘의 현실을 직시하자는 뜻에서였고, 또 하나는 그 누구도 아닌 제 자신의 아픈 곳을 향해 사격을 가한 것에 지나지 않는다”고 끝을 맺고 있다.글·사진 조현 종교전문기자cho@hani.co.kr세상을 보는 정직한 눈 <한겨레>  [한겨레신문 구독|한겨레21 구독]공식 SNS 계정: 트위터www.twitter.com/hanitweet/ 미투데이http://me2day.net/hankyorehⓒ 한겨레신문사, 무단전재 및 재배포 금지<한겨레는 한국온라인신문협회(www.kona.or.kr)의 디지털뉴스이용규칙에 따른 저작권을 행사합니다.>"
2,2010-04-06,[Health & Life] 최고의 치료제 `숲`,https://news.naver.com/main/read.nhn?mode=LSD&mid=shm&sid1=103&oid=009&aid=0002242588,매일경제,"맑고 포근한 봄을 맞아 산을 찾는 상춘객(賞春客)이 늘고 있다.나무 사이로 불어오는 봄바람과 산새들이 지저귀는 상쾌한 소리가 마음을 한결 가볍고 편안하게 해준다. 시냇물 소리에 취하다 보면 지치고 병든 몸과 마음이 어느 새 치유되는 듯하다. 숲에서 몸과 마음을 치유하는 사람이 늘고 있다. 인체가 가지고 있는 스스로의 면역력을 통해 질병을 이겨내고 새로운 삶을 위한 에너지를 재충전하는 것이다.프랑스 사상가 루소는 문명으로 더러워진 사회와 사람을 구하기 위해 '자연으로 돌아가라'고 주장했다.이 말은 몸과 마음이 온전하지 못한 현대인들에게 시사하는 바가 적지 않다. '자연으로 몸을 고친다'는 자연의학이 21세기의 새로운 의학으로 주목받고 있다.이시형 신경전문의 박사(산림치유포럼 회장)는 ""대표적인 자연의학인 산림욕 효과는 신선한 숲향기(냄새), 산소 농도가 높은 공기의 흐름(바람), 음이온, 기압, 적당한 습도를 느낄 수 있는 기온 등이 합세해 사람의 오감을 자극하여 자기치유 능력을 높여준다""고 설명한다.◆ 숲에서 걷는 것만으로 면역력 높아져= 5년 전 간암 판정을 받은 박상돈 씨(가명ㆍ53). 그는 지금 산에서 살고 있다. 박씨는 수술과 항암치료를 거치며 쇠약해진 몸을 이끌고 가족의 만류에도 불구하고 무작정 산으로 들어갔다. 맑은 공기와 숲의 짙은 향취를 맡으며 건강을 회복해가고 있는 느낌을 받고 있다. 매일 아침 배낭을 메고 산에 올라 직접 채취한 약초를 가져다가 달여 먹고 밥도 짓는다.산사람이 다 된 박씨는 ""거무튀튀하던 얼굴빛도 맑아지고 몸도 가볍고 건강해지고 있다는 느낌을 체감하고 있다""고 말한다.과연 숲에서 질병이 낫는 '산림 치유'는 어느 정도 근거가 있는 것일까?숲에서 발생되는 피톤치드(phytoncide)는 공기를 맑게 하고 살균 작용을 할 뿐만 아니라 인체 면역 기능을 높인다.인체의 가장 강한 면역세포 중 하나인 NK세포를 활성하기 때문이다. NK세포(Natural killer Cell)는 인간의 혈액 중에 있는 림프구 중 약 20%를 차지하고 있으며 암세포와 같은 이상세포를 발견해 죽이기 때문에 우리 몸이 건강한 상태를 유지할 수 있다. 피톤치드는 또한 혈압을 낮추고 스트레스 호르몬 농도를 낮추게 함으로써 긍정적인 심리 상태가 된다.특히 뇌의 전두엽 활동을 활성화시키기 때문에 두뇌에도 적지 않은 영향을 미친다.피톤치드는 나무가 스스로 보호하기 위해 분비하는 물질로 해충, 곰팡이, 병원균을 없애는 작용을 하며 인간에게는 신경계에 영향을 줘 정신적인 안정감을 준다.우종민 서울백병원 신경정신과 교수는 ""㎢당 2㏊의 숲이 있으면 연간 5~7명의 사망률을 낮추고 동시에 입원 치료 4~6명을 감소시킨다는 연구결과가 있다""며 ""산림 치유는 스트레스성 정신장애에 대한 치료 효과도 기대할 수 있다""고 설명한다.◆ 산림욕 언제, 어디서, 어떻게 해야 좋나= 산림욕 장소는 기본적으로 경관이 아름답고 공기가 맑은 곳이어야 하지만 가장 중요한 것은 스스로 마음에 들어야 한다. 시간이 다소 걸리더라도 주변에 가까운 숲을 찾아 자기만의 산림욕장을 만들어보는 것이 좋다.주변에 숲이 없는 사람들은 집이나 직장 주변에 있는 작은 공원, 길게 늘어선 가로수길, 화분이 정성스럽게 놓여진 베란다를 이용해도 괜찮다. 산림욕은 일상에서 잠깐이라도 매일 하는 것이 바람직하다.지형적으로는 산밑이나 산꼭대기보다는 바람의 영향을 적게 받는 산 중턱이 산림욕을 즐기기에 좋다. 계곡도 피톤치드가 많이 모이는 곳이다. 산 위에서 부는 바람은 산꼭대기부터 나뭇잎들을 간질이며 피톤치드가 더 많이 나오도록 부추기고 다량의 피톤치드를 계곡으로 몰고 내려온다.피톤치드는 나무와 식물이 햇볕을 받아 광합성 작용을 할 때 가장 많이 발생하기 때문에 숲이 본격 성장하는 5~6월, 햇볕을 가장 많이 받는 한여름에 피톤치드가 많이 생성된다.하지만 꽃이 피고 새싹이 돋아나는 봄에도 나무들은 여전히 호흡을 하면서 피톤치드를 많이 뿜어낸다.하루 중 피톤치드의 발산량이 가장 많은 때는 해뜰 무렵인 새벽 6시와 오전 11~12시 사이다. 새벽에 숲속을 거닐 때 다른 때보다 훨씬 상쾌한 기분이 드는 이유가 바로 새벽에 피톤치드 함량이 높기 때문이다.숲속에서 걸을 때는 바른 자세로 경쾌하게 걷는 것이 좋다. 또 걷는 속도를 자유롭게 조절하되 지나치게 천천히 흐느적거리며 걷지 않도록 한다. 이와 함께 팔을 자연스럽게 앞뒤로 흔들면서 걷는 것이 좋다. 운동의 강도는 심장박동수가 최대 심장박동수의 40~60%가 되는 상태가 좋다. 최대 심장박동수는 220에서 자기 나이를 빼면 된다.※참고＝산림치유(한국산림치유포럼 번역ㆍ전나무숲 출간), 내몸이 좋아하는 산림욕(박범진 지음, 넥서스북스 출간)◆  덴마크ㆍ독일 등은 숲을 의학적으로 접근= 독일 바이에른주 남부 660ｍ 고원에 위치한 '바트 뵈리스호펜'은 숲속 요양마을이다. 인구 1만5000명이던 작은 마을이 숲 치유 프로그램의 유명세로 매년 10만명이 방문하고 있다. 환자들이 요양 목적으로 그곳을 찾고 있지만 대부분 휴식이나 휴양을 통한 회복이 목적인 사람들이 많다.독일은 3년에 한 번씩 건강을 증진하기 위한 목적으로 13일 동안 요양휴가를 가는 것이 법으로 정해져 있다. 휴가지는 산림휴양지로 보험회사를 통해 알선을 받거나 개인이 직접 선택할 수 있다. 독일에서 삼림욕은 건강보험에서도 인정하는 예방의학의 치료행위로 간주되고 있는 것이다.이처럼 산림치유는 국내보다 외국에서 먼저 그 탁월한 효과를 인정받고 있다.덴마크에서는 1960년대부터 '숲속 유치원'이 생겨났다. 이곳에서 아이들은 1년 내내 일반 보육 프로그램은 물론 마음껏 뛰어놀 수 있는 환경적 조건을 제공받는다. 현재 덴마크에는 60여 곳, 독일에는 무려 220곳이 있다. 그만큼 숲에서 생활하는 것이 건강에 좋기 때문이다.일본은 '숲속에서 지친 몸과 마음을 씻어낸다'는 의미에서 삼림욕을 권하고 있으며 삼림욕이 주는 건강증진 효과를 과학적으로 증명하기 위해 다양한 실험을 하고 있다. 숲이 주는 건강효과를 상품으로 개발해 다양하게 판매하기도 한다.일본은 2005년부터 '삼림세러피' 인증제도를 실시하며 관련자를 양성하고 있다. 이들은 '메디컬 트레이너'라는 명칭으로도 불리며 숲에서 치유효과를 높이기 위한 안내를 한다.[이병문 의료전문 기자][ⓒ 매일경제 & mk.co.kr, 무단전재 및 재배포 금지]MBA도 모바일로 공부한다."
3,2010-04-06,"""전 국민이 응원합니다""..초등생이 편지 전달",https://news.naver.com/main/read.nhn?mode=LSD&mid=shm&sid1=100&oid=001&aid=0003209926,연합뉴스,"초등학생이 보낸 실종자 가족을 위한 위문편지    (평택=연합뉴스) 신영근 기자 = 6일 오후 경기도 평택 해군2함대사령부에서 천안함 실종 장병 구조작업 중단 요청 후 처음으로 기자회견을 연 실종 장병 어머니들이 평택의 한 초등학교 어린이들이 보낸 위로 편지를 읽고 있다. 2010.4.6    drops@yna.co.kr    http://blog.yonhapnews.co.kr/geenang평택도곡초교 4~6년 학생 51명, 실종자 가족에 편지(평택=연합뉴스) 이우성 기자 = ""실종자 가족님들은 뜬눈으로 밤을 보내고 있을텐데..전 국민이 응원합니다""6일 오후 평택2함대 사령부 내 천안함 실종자 가족들에게 초등학교 어린이들이 '고사리 손'으로 꼬불꼬불, 삐뚤빼뚤한 글씨로 빼곡히 쓴 편지 51통이 전달됐다.2함대 인근 평택 포승공단 안에 있는 평택도곡초등학교 4~6학년 어린이 51명이 실종자 가족들과 아픔을 나누겠다며 자발적으로 편지를 쓴 것이다.2006년 9월 개교한 평택도곡초교 4~6학년 학생 중 일부는 2함대 군인 자녀들이 다니는 원정초교에서 1~2학년을 마치고 전학을 온 터라 이 학생들에게 천안함 침몰소식은 더욱 아팠다고 했다.이 학교 4~6학년 27명으로 구성된 전교 어린회(회장 안효수.여.6년)는 지난 2일 회의를 열어 힘들어하는 실종자 가족들에게 조금이라도 힘이 되는 편지를 쓰자고 결정했다.전교 어린이회 학생들은 곧바로 각자 교실로 돌아가 이같은 내용을 같은 반 친구들에게 알렸다. 이렇게 해서 5일까지 모인 편지가 51통.전교 어린이회장단 학생 3명은 전날까지 모인 편지를 가지고 인문사회담당 홍지민(33.여) 부장교사와 함께 이날 오후 실종자 가족들에게 전달했다.한 학생은 만화캐릭터가 그려져 있는 노란색 편지지에 ""서해안 바다에서 침몰한 천안함 사건 들었습니다. 매일 뉴스를 봅니다. 저희도 희망을 바라는 마음으로 뉴스를 보고 있습니다""라며 실종자들 생환에 대한 희망을 버리지 않았다.이 학생은 이어 ""실종자 가족님들을 볼때마다 가슴이 매우 아프고 안타까워 (뉴스를) 보지 못할때도 있다""며 ""저는 실종자 가족님들이 뜬눈으로 밤을 보내고 있을텐데라고 생각하고 잠을 자고 아침에도 생각한다""고 안타까워 했다.또 ""저희를 위해 고생하신 군인 여러분 매우매우 자랑스럽습니다""라며 ""전 국민이 실종자 가족님들의 마음을 알지 못하지만 슬프다는 걸 알 수 있습니다. 희망을 잃지 마세요. 전국민이 응원합니다""라며 글을 맺었다.편지를 전달한 전교 어린이회장은 ""원정초등학교에서 1~2학년을 마치고 전학을 와 아직도 (원정초교에) 친구들이 많다""며 ""혹시라도 친구들한테 그런 일이 생겼다면 이 편지들이 힘을 내는데 도움됐으면 좋겠다""고 했다.이 편지 내용을 찬찬히 읽어 내려가던 가족들은 누구라고 할 것도 없이 모두 서로 부둥켜 안고 다시한번 오열해 주위를 안타깝게 했다.홍기인 교사는 ""연평해전 당시 제 동생도 2함대에서 하사로 지상근무해 간접적으로라도 이런 아픔을 경험했는데 너무 속상했다""며 ""힘들어 하시는 실종자 가족들에게 조금이라도 도움이 되려 하는 아이들 마음이 이쁘고 너무 감사하다""고 말했다.gaonnuri@yna.co.kr[관련기사]▶ <李대통령, `단호한 입장' 강조 의미는>▶ <국정원, 천안함 침몰 北연루설에 신중>▶ MB ""침몰사고, 정치적 이용 안돼""(종합)▶ <천안함 침몰당시 합참의장 역할 논란>(종합)▶ <생존장병 미니홈피에 '무사귀환' 기원 글 남겨><뉴스의 새 시대, 연합뉴스 Live><모바일 애플리케이션><포토 매거진><저작권자(c)연합뉴스. 무단전재-재배포금지.>"
4,2010-04-06,“일본 옛 1만엔권 조심하세요”,https://news.naver.com/main/read.nhn?mode=LSD&mid=shm&sid1=102&oid=032&aid=0002059721,경향신문,"서울지방경찰청 외사과 국제범죄수사대가 6일 남대문 환전상들 사이에 유통된 일본의 1만엔권 위조지폐를 압수해 공개하고 있다. | 강윤중 기자ㆍ위폐 100장 밀반입·유통 1명 구속·1명 입건발권이 중단된 일본의 희귀 1만엔권 위폐를 몰래 국내로 들여와 유통시킨 일당이 경찰에 붙잡혔다.서울지방경찰청은 7일 중국에서 일본의 옛 위폐 수백장을 밀반입해 판 혐의(위조통화취득 및 유통)로 조모씨(41)를 구속하고 정모씨(53)를 불구속 입건했다. 중국에 있는 자금모집책 박모씨(58) 등 2명은 체포영장을 발부받아 추적 중이다.경찰에 따르면 조씨 등은 지난달 13일 중국에서 위조된 옛 1만엔권 일본지폐 100장을 700만원에 구입해 밀반입한 뒤 남대문시장의 수집·환전상들에게 1200만원에 판 혐의를 받고 있다. 이들은 지난달 23일에도 같은 방법으로 중국에서 위폐 200장을 구입, 여행용 가방에 넣어 인천공항을 통해 입국하려다 공항에 잠복해 있던 경찰에 검거됐다.이 위폐들은 ‘일본국 은행’에서 1958년부터 72년 사이 발행했으나 위폐 문제가 심각해지자 발행을 중단한 1만엔권을 모방해 위조한 것이다. 1만엔권은 희소가치가 높아 진폐일 경우 수집가들 사이에서 장당 20만~200만원에 거래되는 것으로 알려졌다.경찰 관계자는 “정씨 등이 구권화폐가 고가에 거래되고 위폐감별기가 현재 통용되는 신권 위주로 설치돼 있는 점을 노렸다”며 “직인과 일련번호까지 정교하게 위조돼 수십년 경력의 남대문 환전상들도 속아 넘어갈 정도였다”고 전했다.경찰은 아직 검거되지 않은 김씨 등이 중국에서 총책으로 활동하며 중국 현지의 전문 위조단과 조직적으로 위폐를 제작한 것으로 보고 수사를 확대할 방침이다.<유정인 기자>- 대한민국 희망언론! 경향신문, 아이폰 애플리케이션 출시 -ⓒ 경향신문 & 경향닷컴(www.khan.co.kr), 무단전재 및 재배포 금지〈경향닷컴은 한국온라인신문협회(www.kona.or.kr)의 디지털뉴스이용규칙에 따른 저작권을 행사합니다.〉"
5,2010-04-06,[포토뉴스] 입술 튼 국방장관과 눈 충혈된 국정원장,https://news.naver.com/main/read.nhn?mode=LSD&mid=shm&sid1=100&oid=047&aid=0001966670,오마이뉴스,"[오마이뉴스 남소연 기자]▲ 입술 튼 국방장관과 눈 충혈된 국정원장ⓒ 남소연김태영 국방장관과 원세훈 국정원장이 '천안함 침몰' 12일째인 6일 국회에 각각 출석하면서 입술이 트고 눈이 충혈된 모습으로 나타났다. 김태영 국방장관은 오전 열린 본회의에서 입술 보호제를 꺼내 발랐고, 오후 정보위에 출석한 원세훈 국정원장은 오른쪽 눈이 심하게 충혈된 모습이었다.▲원세훈 국가정보원장이 천안함 침몰사고 등과 관련해 6일 오후 국회에서 열린 정보위원회 전체회의에 출석, 개회를 기다리고 있다.ⓒ 남소연▲6일 오전 국회 본회의에 출석한 김태영 국방부장관이 주호영 특임장관과 얘기를 나누고 있다.ⓒ 남소연[최근 주요기사]☞ ""북측 잠수함의 어뢰?로또 확률보다 낮다""☞ 대원 21억 찬조금? 청소비 뜯어갈 때 '잡았어야지'☞ 군의 과잉기밀주의... ""천안함 절단면 공개할 계획 없어""☞ 7년7개월 기다린 후 식물인간 아내와 이혼☞ 1960년 마산, 그곳엔 '누나'와 악질 손현주가 있었다☞ [엄지뉴스 공모] 우리집 교육방침은 '방목'☞ [E노트] ""천안함 격실에 환풍기가?"" 가족들 울분[☞ 오마이 블로그][☞ 오마이뉴스E 바로가기]- Copyrights ⓒ 오마이뉴스, 무단 전재 및 재배포 금지 -"
