,날짜,기사 제목,기사 링크,기사 출처,기사 내용
68,2010-04-06,강풍.높은 파도로 천안함 인양작업 중단,https://news.naver.com/main/read.nhn?mode=LSD&mid=shm&sid1=100&oid=001&aid=0003208336,연합뉴스,"강풍.높은 파도로 천안함 인양작업 중단    (백령도=연합뉴스) 김주성 기자 = 천안함 침몰사고 12일째인 6일 백령도 앞 사고 해역에서는 강한 바람과 높은 파고 등 기상악화로 인양작업에 난항을 겪고 있다. 사진은 높은 파도 뒤로 보이는 함미 침몰 해역 2200t급 해상크레인. 2010.4.6    utzza@yna.co.kr민간 인양업체 바지선.크레인 대청도로 피항(백령도=연합뉴스) 김남권 송진원 기자 = 천안함 침몰사고 12일째인 6일 백령도 앞 사고 해역에서는 강한 바람과 높은 파고 등 기상악화로 인양작업에 난항을 겪고 있다.조수 간만의 차가 적은 `조금'을 맞아 인양작업을 가속화하려던 군과 업체의 계획이 기상악화로 차질을 빚을 전망이다.백령도에 짙게 낀 안개는 이날 오전 7시께 걷히기 시작했으나 시정은 3km에 불과하다.안개가 걷혔지만 새벽에 초속 2∼3m로 불던 바람이 다소 강해져 초속 4.2m의 북서풍이 불고 있다.이 때문에 함체의 함미와 함수가 발견된 해역에서 작업 중이던 민간 인양업체의 소형 크레인과 바지선은 대청도로 피항했다.`함미 해역'의 작업을 맡은 88수중개발 측은 이날 새벽 바다 속에 고정된 바지선의 앵커 4개를 걷고 백령도 사고해역을 떠났다.88수중개발 관계자는 ""바람이 너무 강하게 불고 파도도 2m 이상 높게 일어 작업이 불가능하다고 판단해 사고 해역에서 일단 나가고 있다""라고 말했다.함미가 발견된 해역에는 4묘박(4개의 닻을 내림)으로 해저에 고정된 대형 해상크레인 `삼아 2200호'만이 남아 있다.함수 쪽 인양작업을 하는 해양개발공사도 궂은 날씨 탓에 인양 작업을 못하고 오전 4시30분께 바지선과 크레인 등을 대청도로 이동시켰다.해양개발공사 관계자도 ""당장 기상이 안좋아 대청도로 피항했지만 기상이 좋아지는대로 사고 해역으로 복귀, 인양작업을 할 것""이라고 말했다.kong79@yna.co.krsan@yna.co.kr[관련기사]▶ <민간 인양업체, 철야 수중탐색 계속>▶ 생존자들 ""순간 정신잃어..비상 아니었다""(종합)▶ <중앙119구조대 '함미 수색기'..얼음장 암흑천지>▶ 백령도 짙은 안개·강한 바람·높은 파도▶ <천안함 실종자 수색장병에 지원 잇따라>(종합)<뉴스의 새 시대, 연합뉴스 Live><모바일 애플리케이션><포토 매거진><저작권자(c)연합뉴스. 무단전재-재배포금지.>"
69,2010-04-06,"""여성 10명 중 4명 저임금 근로자""",https://news.naver.com/main/read.nhn?mode=LSD&mid=shm&sid1=102&oid=001&aid=0003208337,연합뉴스,"저임금 근로자 女 37.6%-男 18.3%고임금은 男 41.3%-女 14.9%(서울=연합뉴스) 국기헌 기자 = 상용직 여성 10명 중 4명이 저임금 근로자인 것으로 나타났다.6일 권혜자 한국고용정보원 부연구위원과 박선영 한국여성정책연구원 연구위원이 발표한 '남녀고용평등법 20년, 여성 노동시장 변화와 정책과제' 보고서에 따르면 노동부의 임금구조 기본통계조사를 분석한 결과, 2008년 말 현재 상용직 고임금 근로자 비율은 남성이 41.3%에 달했지만 여성은 14.9%에 불과했다.상용직 저임금 근로자는 여성이 37.6%, 남성은 18.3%였다.이들은 유럽연합(EU)의 정의에 따라 전체 근로자 평균 임금의 3분의 2 미만은 저임금, 3분의 2 이상은 고임금층으로 구분했다.상용직 여성 근로자 10명 중 4명가량이 저임금을 받는 반면 고임금은 1.5명 정도에 그쳤다는 것이다.남성 저임금 근로자도 1980년 10.3%, 1990년 8.1%, 2000년 10.5% 등으로 30여년간 10% 안팎을 유지해오다 세계적인 경제위기 여파로 2008년 부쩍 높아졌다.두 연구위원은 ""상용직 여성의 저임금 근로자 비율이 1980년 59.5%에 달했으나 노동조합이 활성화됐던 1990년 44.1%까지 감소하는 등 꾸준히 개선됐지만 여전히 남성보다 높다""며 ""여성들이 임신 및 출산으로 노동시장을 이탈했다가 재취업할 때 저임금 직종에 취업한 때문""이라고 분석했다.여성이 많이 종사하는 직종과 남성이 많이 일하는 직종 간에 임금 차이가 나는 이른바 성별 직업분리 현상도 여전한 것으로 나타났다.고용정보원의 산업 및 직업별 고용구조 조사 결과를 보면 2006년 기준으로 남성 직종의 월평균 임금은 237만원인데 비해 여성직종은 123만원으로 절반 수준에 불과했다.또 여성직종에는 남성의 3.7%, 여성의 46.1%가 종사하고 남성 직종에는 남성의 82.9%, 여성의 15.8%가 근무하는 것으로 조사됐다.이들은 ""과거보다 여성 고임금 근로자가 증가했지만 여전히 저임금 근로자는 여성에 집중돼 있다""면서 ""남성보다 상대적으로 여성 비정규직이 많은 데다 출산이나 육아에 따른 경력단절과 직업분리 현상이 중첩돼 나타난 결과""라고 진단했다.따라서 남녀고용평등법 등 여성 노동 관련 법과 제도의 실효성을 높일 수 있는 정책적 수단을 고민할 필요가 있다고 제언했다.이들은 노동부가 이날 오후 서울지방노동청에서 주최하는 고용평등정책 세미나에서 이런 내용의 주제발표를 할 예정이다.penpia21@yna.co.kr[관련기사]▶ 한국 남녀 임금격차 OECD 최대‥38% 벌어져▶ ""국민 81.3%, 직장 성차별 개선중""▶ ""각국 기업, 여성 재능 활용 못해""<WEF>▶ ""여성 활용이 국가 경쟁력의 밑거름""<뉴스의 새 시대, 연합뉴스 Live><모바일 애플리케이션><포토 매거진><저작권자(c)연합뉴스. 무단전재-재배포금지.>"
70,2010-04-06,삼성전자 1분기 영업익 4조3천억..사상 최고(종합),https://news.naver.com/main/read.nhn?mode=LSD&mid=shm&sid1=101&oid=001&aid=0003208333,연합뉴스,"<그래픽> 삼성전자 분기별 실적 추이    (서울=연합뉴스) 전승엽 기자 = 삼성전자가 올 1분기(1~3월)에 영업이익에서 사상 최고치의 잠정 실적을 내놓았다. 삼성전자는 국제회계기준(IFRS)을 처음으로 적용한 올 1분기 실적이 국내외 사업장을 합한 연결 기준으로 매출은 34조원, 영업이익은 4조3천억원인 것으로 잠정 집계됐다고 6일 밝혔다.    kirin@yna.co.kr작년 동기比 7.3배로 급증..매출은 34조로 18.6%↑(서울=연합뉴스) 박세진 기자 = 삼성전자가 올 1분기(1~3월)에 영업이익에서 사상 최고치의 잠정 실적을 내놓았다.삼성전자는 국제회계기준(IFRS)을 처음으로 적용한 올 1분기 실적이 국내외 사업장을 합한 연결 기준으로 매출은 34조원, 영업이익은 4조3천억원인 것으로 잠정 집계됐다고 6일 밝혔다.매출 전망치는 글로벌 금융위기의 여파가 강했던 작년 1분기(28조6천700억원)에 비해서는 18.6% 늘어났으나 분기별 최고 실적이었던 작년 4분기(39조2천500억원)보다는 13.4% 줄었다.그러나 영업이익은 작년 동기(IFRS 적용 5천900억원 기준) 대비 7.3배로 급증하면서 그동안 최고였던 작년 3분기(4조2천300억원) 실적을 갈아치우게 됐다.1분기 영업이익은 전분기(3조4천400억원) 대비 25% 증가했다.통상 1분기는 반도체, LCD, 휴대폰, 디지털 미디어 등이 모두 계절적인 비수기를 맞아 삼성전자의 실적이 상대적으로 부진한 시기인 점을 고려할 때 이날 공개된 1분기 실적 전망치는 금융위기를 거치면서 글로벌 시장 지배력을 강화한 삼성전자의 저력을 보여준 것으로 평가된다.지금까지 삼성전자가 1분기에 4조원이 넘는 영업이익을 올린 것은 연간 기준으로 반도체 부문에서만 7조7천700억원에 달하는 사상 최고의 영업이익을 냈던 2004년이 처음이자 마지막이었다.삼성전자는 이날 올 1분기의 부문별 실적 예상치를 공개하지 않았지만 반도체 가격의 급등에 따른 반도체 부문의 선전이 전체적인 실적을 견인한 것으로 분석되고 있다.삼성전자가 생산하는 주력 반도체 제품의 하나인 1기가 DDR3의 D램 현물 가격은 3.06달러 수준으로, 작년 5월(1.4달러)에 비해 두 배 수준으로 뛴 상태다.업계에서는 메모리 반도체 가격의 상승세가 이어지고 애플의 아이패드에 삼성전자의 낸드 플래시가 채용된 것이 향후 실적에 긍정적으로 작용할 것으로 예상하고 있다.증권업계는 삼성전자의 1분기 부문별 영업이익이 반도체 2조900억원, LCD 5천800억원, 정보통신(휴대전화) 1조900억원, 디지털미디어(TV 등 가전) 4천억원대로 추정하고 있다.삼성전자 관계자는 ""메모리 반도체 가격의 강세와 마케팅 비용의 계절적 감소 등으로 전분기 대비 영업실적이 개선됐다""며 ""주력사업의 원가경쟁력과 시장지배력 강화로 올해 전체적으로 작년 대비 두자릿수 성장을 목표로 하고 있다""고 말했다.parksj@yna.co.kr[관련기사]▶ <삼성電 사상 최대 실적 시장에 '긍정적'>▶ <표> 삼성전자 최근 5년간 1분기 영업실적▶ <코스피> 삼성전자 상승세 출발▶ <표> 삼성전자 최근 2년간 영업실적<뉴스의 새 시대, 연합뉴스 Live><모바일 애플리케이션><포토 매거진><저작권자(c)연합뉴스. 무단전재-재배포금지.>"
71,2010-04-06,"""충무공이순신함, 피랍 삼호드림호 추적성공""",https://news.naver.com/main/read.nhn?mode=LSD&mid=shm&sid1=100&oid=001&aid=0003208287,연합뉴스,"소말리아 해적 피랍 삼호드림호(부산=연합뉴스) 오수희 기자 = 4일 오후 인도양에서 소말리아 해적에게 피랍된 '삼호 드림호'. 2010.4.5osh9981@yna.co.kr""오전 1시20분, 삼호드림호 이동 해역 도착""(서울=연합뉴스) 유현민 기자 = 청해부대 충무공이순신함이 소말리아 해적에게 납치된 삼호드림호 추적에 성공한 것으로 알려졌다.외교부 관계자는 6일 ""충무공이순신함이 오늘 오전 1시20분께(한국시각) 삼호드림호가 이동 중인 해역에 도착해 삼호드림호 인근에서 기동 중""이라며 ""납치된 삼호드림호는 소말리아 연안을 향해 이동 중인 것으로 파악됐다""고 밝혔다.항해중인 충무공이순신함 (자료사진)hyunmin623@yna.co.kr[관련기사]▶ <충무공 이순신함 해적 추적..성과 주목>(종합)▶ <인도양 한복판도 '해적 안전지대' 아니다><그래픽> 청해부대 피랍 유조선 추적 상황    (서울=연합뉴스) 반종빈 기자 = 청해부대 충무공이순신함(4천500t급)이 소말리아 해적에게 납치된 삼호드림호 추적에 성공, 50여㎞ 이내에서 근접 기동 중인 것으로 알려졌다.    bjbin@yna.co.kr▶ <소말리아 해적피랍 재발..근본대책 없나>▶ ""청해부대, 소말리아 해적 입항전 차단 시도""▶ 외교부 ""소말리아 해적, 아직 연락없어""<뉴스의 새 시대, 연합뉴스 Live><모바일 애플리케이션><포토 매거진><저작권자(c)연합뉴스. 무단전재-재배포금지.>"
72,2010-04-06,[천안함 침몰]軍 “함체 건지면 가림막 치고 조사” 억측 차단? 증거 독점?,https://news.naver.com/main/read.nhn?mode=LSD&mid=shm&sid1=102&oid=020&aid=0002127101,동아일보,"[동아일보]■ 인양 어떻게 진행언론 공개 제한“시신 보이게 하면 결례”바지선 취재 봉쇄방침또다른 비밀주의 논란민간업체 작업 본격화하루 두번 4시간 작업호스로 산소 공급해심해잠수 시간 연장해군이 5일 백령도 해상의 독도함에서 실종자 가족과 기자들에게 인양 계획을 설명하면서 사건 원인을 파악할 수 있는 함수와 함미의 절단면을 공개하지 않겠다는 방침을 밝혀 논란이 될 것으로 보인다. 군은 “억측이 생기는 것을 방지하기 위해 취한 조치”라고 설명했지만 인양된 선체를 내려놓을 바지선에 향후 바리케이드까지 칠 것으로 알려지면서 절단면을 더는 외부에 노출시키지 않으려는 움직임을 보이고 있다.○ 절단면 못 보게 바리케이드 설치해군은 이날 기자들에게 함체 인양과 관련해 설명하는 자리에서 절단면 비공개 방침을 분명히 했다.군 관계자는 “기자들은 인양 바지선에 못 들어간다. 선박이 인양됐을 때 부유물 등으로 위험하기 때문이다. 또 함수는 앞쪽, 함미는 끝쪽만 촬영이 가능하고 함수, 함미 절단면은 촬영 불가”라고 말했다. 그는 “사고 원인 파악에 중요한 절단면을 왜 안 보여주느냐”고 기자들이 묻자 “국방부 최종 발표 시까지 절단면을 보고 언론의 온갖 억측과 의혹들이 보도되는 것을 막기 위한 것”이라고 설명했다.군은 함체를 끌어낼 때까지만 언론에 작업 과정을 공개하고 물 위로 올라오면 바지선에 바리케이드를 쳐 안에서 이뤄지는 작업을 원천적으로 폐쇄하겠다는 입장이다. 해군 측은 “작업 과정에서 혹시 천안함 실종자들의 시신이 보일지도 모르는데 이는 고인에 대한 예의가 아니라 이같이 결정했다”고 말했다. 하지만 이 같은 절단면 비공개 방침은 해외 전문가들까지 참여시켜 투명하게 원인규명을 하겠다는 군 방침과 다른 것이다.김학송 국회 국방위원장은 5일 기자간담회에서 천안함의 절단면에 대한 군의 보고를 전하며 피로파괴(함체 노후화로 갑작스레 절단되는 현상) 가능성을 배제했다.김 위원장은 이날 “(천안함은) 10도 정도 기울어지게 절단됐다. 아래쪽은 용접 부분이 떨어져 나갔고 위쪽은 철판이 찢어진 모양새”라며 “이 정도는 어뢰 또는 기뢰에 의한 것이며 피로파괴에 의한 것으로 볼 수 없다는 게 군의 설명”이라고 전했다.○ 향후 인양작업은앞으로 민간 업체의 수중 인양 작업도 본격화할 예정이다. 천안함 인양을 위해 잠수에 나설 민간 잠수요원들의 수중작업 가능 예상시간은 하루 두 번으로 낮 12시에서 오후 2시, 오후 6시에서 8시가 될 것으로 보인다.이들은 5일 6명이 3개 조로 바다에 들어가 침몰한 천안함의 상태를 조사했다. 특히 해군 잠수요원들은 최대 입수시간이 5분이었던 반면 이들 민간 잠수사는 컴프레서를 이용해 최대 20분까지 잠수할 수 있었다.해군 관계자는 “천안함이 1200t급인데 반으로 갈라졌으니 함미, 함수 모두 600∼700t급이 될 것”이라며 “인양에 참여한 대우조선해양이 천안함 설계도면을 가지고 조사한 결과 함수에 물이 차면 4배인 2500t에 이를 정도”라고 말했다. 따라서 3000t급 바지선이면 충분하다는 설명이다.작업이 진행되는 동안 해난구조대(SSU) 대원 6개 팀이 시신이 유실되지 않게 대기할 계획이다. 군 관계자는 “원래 그물을 사용하려 했으나 유속이 강해 그 방법은 쓸 수 없다”며 “사람은 무조건 떠올라 SSU를 동원해 감시하는 것”이라고 말했다.배는 90mm 로프 4개로 끌어올린다. 수면까지는 중력이 낮은 상태라 올리기 쉽지만 수면을 넘어서면 중력 때문에 훨씬 무거워진다. 그래서 1cm씩 조금씩 올리면서 물을 빼고, 또 조금 올리는 식으로 작업을 진행할 예정이다. 해군 측은 “격실 중에 물이 빠지지 않는 곳은 민간 잠수원이 직접 들어가 작업할 것”이라고 말했다.○ 민간업체 장비 뭐가 다르나백령도 해역과 같은 기상 조건에서 30m 이상 잠수할 경우는 우주복과 유사한 심해잠수특수장비인 ‘표면공급잠수장비(SSDS)’가 필수적이다. 해군은 이 장비를 갖고 있지만 준비작업에만 3, 4일이 걸려 사용을 꺼렸다.인양작업에 참여한 유성수중개발, 88수중개발, 해양개발공사 등 3개의 민간업체 중에 이 장비를 구비한 곳은 없다. 공우영 유성수중개발공사 사장(55)은 “민간업체들은 후카(Hookah·수면 위에 있는 컴프레서에서 압력조절된 공기를 호스를 통해 수중에 있는 잠수사에게 직접 공급하는 장비)로 심해 잠수를 충분히 할 수 있다”고 말했다. 후카는 산업잠수에서 널리 이용되는 장비로 SSDS가 없는 회사에서 많이 쓰이고 있다.4인용인 감압체임버를 갖춘 민간업체의 경우 2인용 감압체임버를 썼던 군보다 잠수 인원을 2배로 투입할 수 있어 작업 속도를 높일 수 있다. 전중선 해양개발공사 사장(55)은 “수중에서 통화를 하면서 잠수 작업을 할 수 있는 마스크 장비도 가져와 정보 교환도 빠를 것 같다”고 말했다.평택=박재명 기자 jmpark@donga.com백령도=유성열 기자 ryu@donga.com▶동아닷컴 인기화보▷  멕시코, 규모 7.2 강진 발생…최소 1명 사망▷ 섹시 이파니, 이파니의 자신감 넘치는 포즈▷ 세계 최대 산호초 지대 훼손될 위기▷ 우유빛깔 황정음, ‘민낯 미인 1위?’[천안함 침몰]파편, 해저 10곳 이상서 확인[천안함 침몰]“北 상어급 잠수함이 움직였다”[천안함 침몰]상어급 잠수함 중어뢰 장착… ‘격침’이라면 지진파 발생 충분[천안함 침몰]승조원 일부 9시 15분~22분 휴대전화 통화[천안함 침몰]軍 “이제 군사기밀 공개 안한다”[천안함 침몰]美폭발분석 노하우 활용 원인규명 신뢰도 높인다[천안함 침몰]李대통령 “원인규명, 속도보다 정확성이 중요”[천안함 침몰]“선체 인양후 실종자 추가수색 요청 않겠다”[천안함 침몰]金국방 답변 조절 靑메모 논란[천안함 침몰]천안함 폭뢰-어뢰 18기는 어디에[천안함 침몰]UDT예비역 “상설구조단 조직”[천안함 침몰]천안함뉴스 시청률 최고 23.1%"
73,2010-04-06,대출알선 백태…수수료에 상조회 가입까지,https://news.naver.com/main/read.nhn?mode=LSD&mid=shm&sid1=102&oid=001&aid=0003208249,연합뉴스,"서울시 ""불법 대출 중개 주의""(서울=연합뉴스) 이지헌 기자 = 서울 도봉구에 사는 40대 직장인 김모씨는 2월 A대부중개업체로부터 600만원의 대출을 소개받는 조건으로 B상조업체 회원으로 가입할 것을 요구받았다.돈이 급히 필요했던 김씨는 중개업체의 요구에 따라 '울며 겨자먹기' 식으로 상조업체에 대출금액의 24%인 144만원을 가입비로 송금했다.이 같은 요구가 부당하다고 생각한 김씨는 얼마 뒤 서울시에 피해구제를 신청했고, 불법행위에 대한 서울시의 조치로 상조가입비 전액을 돌려받을 수 있었다.서울시는 6일 급전이 필요한 서민에게 불법으로 대출을 중개하고 수수료를 받는 업체들이 기승을 부리고 있다며 주의를 당부했다.서울시에 따르면 일부 대부중개업체는 대출을 알선해 주는 조건으로 일정비율의 수수료를 요구하거나 신용등급을 올려주겠다고 속여 수고비 명목으로 수수료를 요구하기도 했다.또 불특정 다수에게 휴대전화 메시지를 보내 대출광고를 한 뒤 이를 보고 연락한 대출 신청자에게 수수료만 받아 챙기고 잠적하는 경우도 있었다.김씨의 사례와 같이 대출 신청자에게 상조회원으로 가입하도록 하고 상조회사로부터 우회적으로 수수료를 받는 신종수법도 신고되고 있다고 시는 설명했다.현재 대부업법은 대부중개업자가 대출 신청자로부터 중개수수료를 받는 행위를 금지하고 있다.서울시 관계자는 ""일부 대부중개업체가 대출이 급한 시민들의 약점을 이용해 관행이라는 명목으로 부당하게 여러 형태로 수수료를 편취하는 사례가 끊이지 않고 있다""며 ""이 같은 피해가 발생했을 때는 서울시나 관련기관에 신고해 주길 바란다""고 말했다.서울시는 대부업체가 대부업법에 규정된 이자율 제한(연 환산 49%)을 초과해 대출한 사례를 발견했을 때에도 신고해 달라고 당부했다.신고는 서울시 다산콜센터(☎ 120)나 금융감독원 신고센터(☎ 02-3145-8530), 한국대부금융협회 신고센터(☎ 02-3487-5800)로 할 수 있다.pan@yna.co.kr[관련기사]▶ ""대출미끼 상조회원 가입요구 주의""▶ 저신용자 신용대출 받기 쉬워진다(종합)▶ 대부업체, 조직폭력배 고용하면 영업정지▶ 사금융 기승..작년 피해상담 역대 최대▶ <서민 빚 급증…이자 부담에 비명><뉴스의 새 시대, 연합뉴스 Live><모바일 애플리케이션><포토 매거진><저작권자(c)연합뉴스. 무단전재-재배포금지.>"
74,2010-04-06,국내UCC도 본인확인제 반발 대열로,https://news.naver.com/main/read.nhn?mode=LSD&mid=shm&sid1=105&oid=001&aid=0003208216,연합뉴스,"판도라TV, 방통위.문화부에 공개질의서 제출(서울=연합뉴스) 이광빈 기자 = IT업계에서 대표적인 인터넷 규제로 꼽히는 본인확인제 등에 대한 반발이 꼬리를 물고 있다.국내 대표적인 동영상 UCC서비스인 판도라TV는 6일 방송통신위원회에 해외 서비스에 대한 국내 서비스의 역차별 문제에 대해 방통위와 문화체육관광부에 공개질의서를 제출한다고 밝혔다.판도라TV는 방통위에는 본인확인제와 관련한 공개질의서를, 문화체육관광부에는 저작권법과 관련한 공개질의서를 제출한다.공개질의서에는 유튜브 등 해외 서비스는 본인확인제에 적용을 받지 않는데다 불법 저작물이 사실상 자유롭게 유통되는 등 저작권법의 치외법권 지대가 되는 상황에서, 이들 규제를 준수하는 국내 서비스의 경쟁력이 약화되고 있다는 위기의식을 담고 있다.본인확인제와 관련해 판도라TV 관계자는 ""판도라TV에 동영상을 올리거나 댓글을 달려면 누리꾼 입장에서 절차가 복잡하나, 유튜브에서는 간단하다""면서 ""이는 불공정 경쟁""이라고 말했다.저작권법과 관련해서는 유튜브에 방송사의 콘텐츠가 불법으로 올려져 유통되고 있는데도, 콘텐츠 삭제 등의 필터링이 제대로 이뤄지지 않는 점을 가장 큰 문제점으로 꼽았다.판도라TV 관계자는 ""현실적으로 방송사 등 국내 콘텐츠 제공사들이 유튜브에 올라오는 자사 불법 콘텐츠를 감시하는 것은 쉽지 않고 시정조치를 하기도 어렵다""면서 ""불법 콘텐츠에 대한 누리꾼들의 수요는 상당하기 때문에 유튜브의 경쟁력이 되고 있다""고 말했다.이와 관련해 글로벌 서비스인 유튜브가 콘텐츠 경쟁력이 우수한 탓도 국내에서 유튜브의 성공 가도를 이끌고 있지만, 인터넷 규제로 인한 역차별도 주요한 요인이라는 게 전문가들의 시각이다.실제 다음디렉토리 검색결과에 따르면 유튜브는 국내에서 유튜브의 본인확인제 거부 논란이 빚어진 지난해 4월부터 페이지뷰(PV)가 급상승하기 시작해 7월에는 판도라TV를 제쳤다.반면 판도라TV는 지난 3월까지 PV가 상승곡선을 그렸다가 4월부터 감소 추세를 나타내고 있다.더구나 유튜브의 공세에도 수년간 국내 시장을 지켰던 동영상 UCC 서비스들은 지난해부터 구조조정 바람이 몰아치고 있는 실정이다.지난해 초에는 KT가 서비스해온 '올팟'이 중단된 데 이어 엠엔캐스트가 문을 닫았다.올해에도 지난 2월에는 NHN이 네이버 비디오 서비스를 종료했고, 비슷한 시기에 하나포스닷컴도 대표적인 서비스인 앤유라이브를 접었다.특히 본인확인제는 최근 인터넷 서비스 기업들이 잇따라 문제를 제기하고 있고, 방통위도 대안 찾기에 나서는 등 논란이 불거지고 있다.최근에는 인터넷 IT전문지인 블로터닷넷이 본인확인제 대상에 포함되자, 적용을 받지 않기 위해 댓글 게시판을 닫고 소셜네트워킹서비스를 통한 독자와의 소통 기능을 모색하고 있다.판도라TV 관계자는 ""정부가 적절한 조치를 취하지 않는다면, 국내법을 준수하는 동영상 사업자는 문을 닫을 판""이라며 ""공정한 경쟁구도가 이뤄지지 않는 것을 방치해서는 안된다고 생각한다""고 강조했다.lkbin@yna.co.kr[관련기사]▶ <인터넷실명제 '철옹성' 깨질까>▶ 개인정보 유출 촉발하는 본인확인제도▶ '유튜브 올리기' 실명제 위반 논란(종합)<뉴스의 새 시대, 연합뉴스 Live><모바일 애플리케이션><포토 매거진><저작권자(c)연합뉴스. 무단전재-재배포금지.>"
