,날짜,기사 제목,기사 링크,기사 출처,기사 내용
43,2010-04-06,美 탄광 폭발사고로 25명 사망(종합),https://news.naver.com/main/read.nhn?mode=LSD&mid=shm&sid1=102&oid=001&aid=0003209548,연합뉴스,"""숨진 광부 유가족을 위해 기도를""(AFP=연합뉴스)미국 웨스트버지니아주에서 5일 발생한 폭발사고로 숨진 광부들의 유가족들을 위한 기도를 촉구하는 팻말이 웨스트버지니아주 화이츠빌에 서 있다.1984년 이후 최악참사..2명 부상.4명 실종(워싱턴=연합뉴스) 황재훈 특파원 = 미국 웨스트버지니아 주(州)의 한 탄광에서 5일 폭발사고가 일어나 25명이 숨지고 2명이 다쳤다고 미 언론들이 전했다.또 6일 오전 현재까지 최소 4명이 실종된 상태로 파악되고 있으며 탄광 안에 메탄가스가 들어차 2차 폭발이 우려돼 구조작업도 잠정 중단된 상태다.이번 사고는 지난 5일 오후 3시께 찰스턴 남쪽 롤리 카운티에 있는 메이시에너지 소유 어퍼 빅 브랜치 탄광에서 일어났다.미 탄광안전위생관리청(MSHA)의 케빈 스트리클린은 정확한 폭발 원인은 아직 알 수 없다면서 탄광 천장이 무너지지는 않은 것으로 보인다고 밝혔다.그는 폭발 지점 근처에 나흘치 식량과 물, 공기를 갖춘 구조용 격실 2곳이 있으나 아직 이곳에 접근한 사람은 없는 것으로 추정된다고 덧붙였다.사고 소식을 접한 버락 오바마 대통령은 연방 정부가 구조작업에 필요한 무엇이든 지원하겠다고 5일 오후 조 맨친 웨스트버지니아 주지사에게 말했다.힐다 솔리스 노동부 장관은 현재 광부 2명이 병원으로 옮겨졌고, 현장에 구조요원 9개 팀이 급파됐다고 전했다.이번 사고는 27명이 사망한 1984년 유타주 오렌지빌의 탄광 화재 이후 미국에서 일어난 탄광 사고 가운데 최악의 참사로 기록될 전망이다.이 탄광은 지난해 120만t의 석탄 채굴 실적을 갖고 있으며, 지난 10년간 3차례의 인명피해 사고가 발생한 것으로 알려졌다.jh@yna.co.kpulse@yna.co.kr<뉴스의 새 시대, 연합뉴스 Live><모바일 애플리케이션><포토 매거진><저작권자(c)연합뉴스. 무단전재-재배포금지.>"
44,2010-04-06,스마트폰 보조금도 규제…값 오를듯,https://news.naver.com/main/read.nhn?mode=LSD&mid=shm&sid1=105&oid=031&aid=0000195760,아이뉴스24,"<아이뉴스24>방송통신위원회가 '마케팅비 22% 가이드라인'에 스마트폰 보조금을 포함해야 한다는 입장을 밝혀 주목된다.스마트폰 보조금이 시장에서 사라지지는 않겠지만, 통신사들의 보조금 올인 경쟁은 축소될 전망이다.6일 방송통신위원회와 통신업계에 따르면 방통위는 '마케팅비 22% 가이드라인'과 관련 세부 협의를 마치고 곧 공식발표한다.◆마케팅비 가이드라인 스마트폰은 포함, 광고비는 제외방통위가 마련중인 가이드라인에 따르면 이동통신 업체들의 마케팅 비용은 단말기를 제외한 서비스 매출 기준으로 22%로 제한된다.또한 마케팅 비용은 유선과 무선통신 서비스를 분리해 각각 22% 이내로 제한된다. TV 등에 하는 통신회사의 광고비는 규제 대상 마케팅 비용에 포함되지 않는다.방송통신위원회 고위 관계자는 ""스마트폰 보조금을 마케팅비 가이드라인에서 예외로 하자는 의견도 있었다""면서 ""하지만 그럴 경우 국내에서의 소모적인 가입자 유치 경쟁 대신 연구개발(R&D)과 투자에 나서 무선인터넷을 활성화하자던 당초의 정책 취지는 무색해진다""면서 반대 입장을 분명히 했다.그는 또 ""통신회사의 광고비를 22% 규제대상에서 제외한 것은 광고시장 확대를 통한 미디어 산업 발전이라는 방향에 맞지 않기 때문""이라고 설명했다.◆이통3사 희비 엇갈려…KT 난감, LGT 희색, SKT 긍정스마트폰 보조금을 자유롭게 쓰되 서비스 매출의 22% 내에서 쓰라는 방통위의 방침이 전해지면서, 이동통신 3사의 희비가 엇갈리고 있다.아이폰 개통 123일만에 개통 건수 50만대를 돌파한 KT는 스마트폰 가입자 확대를 통해 새로운 경쟁구도를 만드는 데 관심있다. 또한 2011년 말까지 2G망을 철거하려면 스마트폰을 통해 3G 가입자를 늘려야 하는 숙제도 있다.따라서 KT는 방통위에 서비스 매출의 22%내에서 써야 하는 마케팅 비용에서 스마트폰 보조금은 제외해 달라고 요구했지만, 받아들여지지 않아 난감한 상황이다.반면 3G가 없고 현금이 부족한 LG텔레콤은 스마트폰 보조금이 가이드라인에서 제외될 경우 심각한 가입자 이탈이 불가피할 것으로 우려하고 있다. 이에 따라 방송통신위원회의 스마트폰 보조금 포함 방침에 환영하고 있다.SK텔레콤 역시 방통위 방침에 만족하고 있다. 마케팅비 가이드라인을 받아들인 마당에 스마트폰 보조금만 예외로 할 경우 자사의 2G 가입자 이탈이 가속화될 수 있다는 판단에 따른 것이다.하지만 동시에 5월 안드로이드폰 출시를 계기로 대대적인 스마트폰 마케팅을 준비하던 터라, 스마트폰 보조금이 규제 대상에서 빠져도 그닥 문제될 게 없다는 생각도 하고 있다.◆스마트폰 보조금= 무선인터넷 활성화는 아냐이번 조치로 이동통신 회사들의 스마트폰 보조금 역시 일반폰처럼 마케팅비 가이드라인에 맞춰야 하기 때문에 일부 줄어들 전망이다. 지난 해 서비스 매출을 기준으로 했을 때 이통3사를 합쳐 1조원 정도의 마케팅 비용(광고비 제외)을 줄여야 하기 때문이다.방통위 고위 관계자는 ""단말기 매출을 포함한 매출액을 기준으로 했을 때 1조 9천억원까지 줄여야 했던 마케팅 비용이 서비스 매출을 기준으로 하고 광고비를 가이드라인 대상에서 빼면서 1조원 정도로 줄어들었다""면서 ""1조원 정도를 와이파이나 와이브로 같은 망 구축에 쓰면 데이터 통화료 부담을 줄일 수 있고 콘텐츠 R&D 개발 등에 쓴다면 당장 스마트폰 보조금을 얼마 더 주는 것보다 무선인터넷 활성화에 도움이 되는 측면이 있다""고 설명했다.정보통신정책연구원(KISDI) 강홍렬 박사는 ""이통3사의 상품이 크게 다르지 않으니 소비자들은 단말기 보조금을 많이 주는 통신사로 눈을 돌리게 됐다""면서 ""그러나 가격할인을 통한 가입자 유치 경쟁은 포화된 시장 환경과 맞물려 국내 정보통신 시장의 미래를 암담하게 만들고 있다""고 밝혔다.한편 KT 이석채 회장, SK텔레콤 정만원 사장, LG텔레콤 이상철 부회장은 지난 3월 최시중 위원장과 만난 자리에서 마케팅비를 20% 수준으로 제한하기로 합의했다. 다만, 올해는 스마트폰 활성화와 판매점·영업점 종사자들의 고용문제 등을 고려해 22%까지 허용하기로 한 바 있다.방통위는 '마케팅비 가이드라인'의 실효성을 확보할 수 있도록 투자와 마케팅비를 동시에 발표하면서 단속해 나간다는 방침이다./김현아기자chaos@inews24.com●줄어드는 단말 보조금, 어디로 가나"
45,2010-04-06,여성 두번 울리는 '짝퉁 1366',https://news.naver.com/main/read.nhn?mode=LSD&mid=shm&sid1=102&oid=079&aid=0002143331,노컷뉴스,"#사례1= 서울에 본부를 두고 전국에 지부를 두고 있는 A 법률 상담소는 산하 단체에 가정폭력ㆍ성폭력 상담소를 운영하고 있다. 가정폭력이나 성폭력을 당한 피해자들이 이곳의 상담소를 찾아 상담을 한 후 각종 법률 소송을 진행하게 되면 이곳에서 알선하는 변호사를 고용하거나 유료 상담을 받도록 권유했던 것. 이 곳에서 상담을 받았던 한 여성은 여성 긴급전화 1366에서는 무료 지원이 가능하다는 이야기를 전해듣고 다시 1366에 도움을 요청했다.#사례2= 가정 문제로 지역의 한 상담소를 찾은 한 부부는 상담소로부터 부부상담 프로그램에 참여하라는 제안을 받았다. 프로그램 참여비용은 20만원. 정부지원으로 운영되는 상담소가 프로그램 참가 비용을 요구해 알아봤더니 여성긴급전화 1366이 아닌 이와 비슷한 성격의 다른 상담소 였다.‘여성긴급전화 1366’을 도용해 활동하는 일명 ‘짝퉁 상담기관’이 피해자를 두번 울리고 있다.여성부와 대전시는 지난 1997년 12월부터 국번없이 ‘1366’을 위기 여성상담 특수전화번호로 지정해 전국 16개 자치단체에 상담소를 운영하고 있다.1366은 가정폭력이나 성폭력, 성매매, 미혼모, 가출소녀 등 도움이 필요한 여성들을 위해 24시간 상담을 실시하고 있으며, 도움이 필요한 여성들에게 긴급피난처를 제공하고 상담소, 쉼터, 병원, 법률기관등을 연계하는 역할을 하고 있다.하지만 최근들어 이 전화번호를 도용한 각종 상담기관이 우후죽순 생겨나고 있는가 하면 상담소 운영을 위한 각종 비용 청구 등의 사례도 이어지고 있어 주의가 요구된다.현재 대전지역에 사회복지 상담 기관은 25개 정도. 이 가운데 국번없이 1366을 사용하는 ‘여성긴급전화’외에 전화번호 뒷번호가 1366의 상담전화번호를 운영하는 기관이 6개 기관이나 된다.또 성폭력 상담소와 가정폭력 상담소, 성매매 여성지원센터 등 비슷한 업무를 하고 있는 단체가 16개 기관에 이르고 있다.일부 기관들은 상담자를 대상으로 유료 상담프로그램을 알선하는가 하면, 후원계좌 등록을 하도록 상담자에게 권유를 하는 경우도 있다.여성긴급전화 1366에서는 무료로 법률 상담을 받을 수 있는 것을 유료 상담으로 전문가를 연계하는 등 부작용도 나타나고 있다.상황이 이렇자 여성긴급전화 1366는 대전시에 1366 전화번호 도용을 막아달라는 요청을 하기도 했지만 전화번호에 대한 법적 통제가 사실상 불가능 하다.여성긴급전화 1366 관계자는 “일명 짝퉁 상담기관에 상담을 의뢰했다가 피해를 본 사례자들이 수소문끝에 다시 이곳을 찾아와 상담기관에 의한 피해까지 호소하는 경우가 상당수”라며 “자치단체에 통제를 요구했지만 사실상 이는 불가능한 것 같아 걱정”이라고 호소했다.대전시 관계자는 “비슷한 상담소가 10여개 이상 운영되다 보니 이같은 문제가 발생하고 있는 것 같다”며 “통합 시스템의 필요성에는 동의하지만 법적으로 전화번호 도용을 통제하거나 상담소 설립을 막을 수는 없다”고 말했다.※위 기사의 법적인 책임과 권한은 중도일보에 있습니다.노컷뉴스 제휴사/ 중도일보 김민영 기자(대한민국 중심언론 CBS  뉴스FM98.1 / 음악FM93.9 / TV CH 412)<저작권자 ⓒ CBS 노컷뉴스(www.nocutnews.co.kr) 무단전재 및 재배포 금지 >"
46,2010-04-06,김정일 방중 미뤄진 듯…18일 이후 가능,https://news.naver.com/main/read.nhn?mode=LSD&mid=shm&sid1=100&oid=003&aid=0003173537,뉴시스,"【서울=뉴시스】이현정 기자 = 이달 초 김정일 국방위원장의 중국 방문이 이뤄질 것이라는 관측과 달리 실제 중국 방문은 이달 말 이후에 가능할 것으로 보인다.외교가에서는 김 위원장이 적어도 5일 또는 6일 오전 중 특별열차를 타고 중국을 방문할 것이라고 예상했지만 열차가 지나갈 북-중 국경인근의 단둥(丹東)에는 현재까지 별다른 움직임이 포착되지 않고 있다.대북라디오방송인 '열린북한방송'도 6일 대북소식통의 말을 인용, 지난달 29일 김 위원장의 중국 방문이 연기됐고 실무그룹도 다음날 철수했다고 전했다.김 위원장이 3일 저녁까지 평양에 머물며 류훙차이(劉洪才) 북한주재 중국대사의 부임을 축하하는 연회에 참석했다는 중국 관영 신화통신과 북한 조선중앙통신의 보도 등을 봐도 4일까지 그는 북한에 머물렀을 가능성이 높아 보인다.김 위원장이 아직도 평양에 머물고 있다면 방중은 빨라야 18일 이후에 이뤄질 것으로 예상된다.오는 9일에는 김 위원장이 참석해야 하는 북한 최고인민회의 제12기 2차 회의가 열리며 15일에는 북한 최대 명절인 '태양절(김일성 출생일)'이 예정돼있기 때문이다.9일까지 김 위원장이 평양으로 돌아오려면 북한과 중국을 오가는 시간을 감안할 때 적어도 5일에는 출발해야 한다.중국 후진타오(胡錦濤) 국가주석도 12일부터 이틀간 미국 워싱턴에서 열리는 핵안보정상회의(NSS)에 참석하며 14∼17일 제2차 브릭스(BRICs) 정상회의를 위해 브라질로 향한다. 후 주석은 이어 17일~18일 베네수엘라와 칠레를 방문할 예정이다.따라서 북한과 중국의 정치 일정상 김 위원장의 방중이 가능한 시기는 9일 이전과 18일 이후다.김 위원장이 9일 열리는 최고인민회의 참석을 포기하고 중국으로 향할 가능성도 배제할 수 없지만 화폐개혁 실패에 따른 대책을 우선 논의해야 하는 상황에서 무리한 중국행을 택하지는 않을 것이라는게 전문가들의 전반적인 의견이다.한편 김 위원장의 방중 일정이 늦춰진 데 대해 양무진 북한대학원대학교 교수는 ""신의주와 단둥에 언론의 관심이 집중돼 동선 노출 가능성 때문에 일정을 미뤘을 수도 있다""고 말했다.hjlee@newsis.com"
47,2010-04-06,"복지부 허용 '시각장애인 침술행위'..법원 ""불법""",https://news.naver.com/main/read.nhn?mode=LSD&mid=shm&sid1=100&oid=001&aid=0003209463,연합뉴스,"대구지법, 시각장애 안마사에 징역 1년6월 선고(대구=연합뉴스) 박순기 기자 = 보건복지부가 시각장애 안마사의 가벼운 침술행위를 허용하고 있으나 법원이 불법이라는 판결을 내렸다.대구지법 형사2단독 한재봉 판사는 불법 침술행위를 한 혐의(보건범죄단속특별조치법.의료법 위반)로 기소된 시각장애 안마사 송모(46)씨에 대해 징역 1년 6월과 벌금 100만원을 선고했다고 6일 밝혔다.한 판사는 판결문에서 ""대법원은 '침술행위가 안마사의 업무범위에 속하지 않는다'고 판시했는데도 보건복지부가 '안마의 보조요법으로 3호침 이하의 침을 놓은 것은 안마행위'라는 유권해석을 해 시각장애인연합회와 안마사협회 등은 시각장애 안마사들을 대상으로 3호침 이하의 침술교육을 하고 교육 이수생들이 일반 환자에게 침술행위를 하고 있다""고 언급했다.한 판사는 ""그러나 현행 의료법 등을 종합해 보면 안마사의 업무 범위에는 침의 종류를 불문하고 침술행위는 포함되지 않는다""면서 ""송씨는 앞서 집행유예를 선고받아 이번에는 실형이 불가피하다""고 판시했다.송씨는 2007년 10월부터 작년 6월 사이 대구 남구에 무허가 안마소를 열어 환자에게 침을 놔주고 일정액을 받는 등 한방의료행위를 한 혐의로 기소됐다.대구지법 관계자는 ""대법원 판례에도 불구하고 보건복지부가 잘못된 유권해석을 해 논란을 빚어왔다""면서 ""이번 판결은 현행 의료법과 관련 법규의 체계적 해석을 통해 안마사의 침술행위는 불법이란 점을 분명히 했다""고 말했다.parksk@yna.co.kr[관련기사]▶ <母 수술비 필요 강도짓..대구 검찰.법원 '선처'>▶ 대구지법, 보조금 '꿀꺽' 울진군의원에 징역1년▶ 대구지법, 친딸 6년간 성폭행 父에 징역 10년▶ 대구지법 ""대여금고 함부로 연 은행 손배책임""▶ 대구지법 ""물품 무단반입 교도관 파면 적법""<뉴스의 새 시대, 연합뉴스 Live><모바일 애플리케이션><포토 매거진><저작권자(c)연합뉴스. 무단전재-재배포금지.>"
48,2010-04-06,"지경차관, ""전기-가스요금 인상계획 없다""",https://news.naver.com/main/read.nhn?mode=LSD&mid=shm&sid1=101&oid=008&aid=0002308558,머니투데이,"[머니투데이 임동욱 기자][""한전여건 그리 어렵지 않다. 당분간 인상압박 받지 않을 것""]""현재로서는 올해 전기ㆍ가스요금을 움직일 계획이 전혀 없다.""김영학 지식경제부 2차관은 6일 기자들과 만난 자리에서 ""지방선거가 끝나도 섣불리 공공요금을 움직일 수 없다""며 이 같이 말했다. 정부가 지방선거 후 공공요금을 줄줄이 올릴 것이라는 일부 관측에 대한 에너지 총괄 최고위 당국자의 반박이다.김 차관은 ""한 해 3조원 가량의 (영업)적자를 내던 한국전력이 지난해 적자폭을 6000억원 가량으로 줄였다""며 ""한전의 여건이 그리 어렵지 않다""고 밝혔다.김 차관은 ""전기요금 인상과 관련, 당분간 (인상) 압박을 받지 않을 것""이라고 말했다.가스요금 인상에 대해서도 유보적 입장을 보였다. 김 차관은 ""최근 가스회사들도 원가 연동제를 빨리 실시해 달라고 요구하지 않고 있다""고 말해 당분간 인상 계획이 없음을 재확인했다.전력산업 구조개편과 관련, 김 차관은 ""6월까지 용역보고서가 나오면 이해당사자들에 전혀 구애받지 않고 개선방안을 집중적으로 논의, 올해 중 최종 결과를 내놓을 것""이라며 ""그러나, 정부가 용역보고서 결과를 100% 따라야 하는 것은 아니다""고 말했다.지경부가 이달 국회 통과를 목표로 하는 '도시가스법'도 언급했다. 김 차관은 ""도시가스 산업에 경쟁을 도입하는 취지의 이 법이 통과될 수 있도록 최선의 노력을 다할 것""이라고 말했다.▶ (머니마켓) 성공투자의 지름길 '오늘의 추천주'▶ (머니마켓) 오늘의 증권정보 '재야고수 종목 엿보기'임동욱기자 dwlim@<저작권자 ⓒ '돈이 보이는 리얼타임 뉴스' 머니투데이, 무단전재 및 재배포 금지>"
49,2010-04-06,"軍 ""천안함內 무기 폭발위험 없다..그대로 인양""",https://news.naver.com/main/read.nhn?mode=LSD&mid=shm&sid1=100&oid=001&aid=0003209230,연합뉴스,"강풍.높은 파도로 천안함 인양작업 중단    (백령도=연합뉴스) 김주성 기자 = 천안함 침몰사고 12일째인 6일 백령도 앞 사고 해역에서는 강한 바람과 높은 파고 등 기상악화로 인양작업에 난항을 겪고 있다. 사진은 높은 파도 뒤로 보이는 함미 침몰 해역 2200t급 해상크레인. 2010.4.6    utzza@yna.co.kr탄약안전검사반 검토..무기 제거하지 않기로(서울=연합뉴스) 김귀근 이상헌 기자 = 군은 침몰한 천안함 내에 있는 어뢰와 폭뢰 등 각종 무기의 폭발 위험이 없는 것으로 최종 결론내린 것으로 6일 확인됐다.군 관계자는 이날 ""탄약 안전검사반 주관하에 천안함 내에 있는 각종 무기에 대한 안전성 여부를 검토한 결과 폭발 위험성이 없는 것으로 결론내렸다""고 말했다.초계함인 천안함에는 함미와 함수 부분에 76㎜ 주포와 40㎜ 부포가 각각 1문씩 설치되어 있으며 그 아래에 탄약고가 있다. 함미 부분의 갑판에는 어뢰 6발, 폭뢰 12발이 있으며, 함대함 유도탄인 하푼 미사일도 4기가 장착되어 있다.군이 천안함에 대한 본격적인 인양작전에 돌입함에 따라 인양 중 혹시 있을지 모를 충격으로 각종 무기가 폭발할 위험성이 제기되어 왔었다.이 관계자는 ""폭뢰와 어뢰는 기계적으로 작동시켜야 폭발하기 때문에 단순히 침수됐을 경우에는 기능을 상실해 폭발하지 않는다""며 ""포탄이나 미사일 역시 발사에 의한 회전력에 의해 폭발하기 때문에 현 상황에서는 폭발 위험성이 없다""고 말했다.그는 ""오히려 각종 무기를 수중에서 분리하는 작업을 하면 폭발 위험이 있을 수 있어 그대로 둔 채 인양하는 것이 가장 안전한 것으로 판단됐다""고 밝혔다.이에 따라 군은 함미와 함수 부분을 인양할 때 무기를 분리하지 않고 있는 그대로 인양하기로 방침을 정했다.군은 다만 천안함 침몰 시 갑판의 어뢰 등이 유실됐을 가능성이 있다고 보고 인양 준비작업 도중 함정 부근에서 이를 발견하면 현재 사고 해역에 비상대기 중인 해군 폭발물 처리반을 즉각 투입해 안전하게 건져 올릴 계획이다.아울러 군은 선체를 완전히 인양해 바지선에 안착시키는 대로 각종 무기를 제거한다는 방침이다.또 다른 폭발 위험 장소로 지목된 함수 부분의 연료탱크 역시 그 주변을 둘러싼 함정 외벽에 파괴된 흔적은 물론 유류가 밖으로 샌 흔적이 없어 폭발 위험성이 거의 없는 것으로 군은 보고 있다.threek@yna.co.krhoneybee@yna.co.kr[관련기사]▶ <""폭발단서 찾아라""..침몰함 인양 앞둔 軍>▶ ""생존장병 면담, 살아남은 자 고통도 생각해 달라""▶ 샤프 ""한미, 침몰함 사고원인 규명 확신""▶ <백령도 기상.조류 '엇박자'에 인양 지연>▶ <중앙119구조대 '함미 수색기'..얼음장 암흑천지><뉴스의 새 시대, 연합뉴스 Live><모바일 애플리케이션><포토 매거진><저작권자(c)연합뉴스. 무단전재-재배포금지.>"
