,날짜,기사 제목,기사 링크,기사 출처,기사 내용
137,2016-01-15,"""부족한 과목 보충""사교육시장 들썩들썩",https://news.naver.com/main/read.nhn?mode=LSD&mid=shm&sid1=102&oid=016&aid=0000970814,헤럴드경제,"자유학기제 3월부터 전면도입학부모 67% “개별 보충학습 필요”영어·수학등 학원수강 열올려학원들도 “한몫잡자” 유치 경쟁“자유학기제라 시험이 없다고 아무 것도 안시키면 큰일납니다. 선행, 하셔야 합니다.” (40대 돼지맘)학원들이 제안하는 ‘자유학기제 최상 활용방안’, ‘영어/수학 편차극복 보충 프로그램’전국 중학교 1~2학년을 대상으로 하는 자유학기제 전면 실시가 한달 반 앞으로 다가오면서 사교육 시장이 들썩이고 있다. 자녀의 학업성취도를 중시하는 국내 학부모들의 특성상 자유학기제를 ‘노는 학기’로 인식, 학교에서 충족되지 못한 욕구를 사교육을 통해 충족시키려는 움직임을 보이고 있기 때문이다. 학원가에선 자유학기제 마케팅이 열풍이다. 아울러 진로탐색을 할 곳이 마땅치 않다는 의견도 한몫하고 있다.교육 관련 블로그 등에서는 벌써부터 자유학기제 전면 실시에 대비해 좋은 학원을 추천해 달라는 내용과 구체적인 학원명을 거론하는 게시물들이 다수 발견되고 있다.중학교 1학년생을 자녀로 둔 강모(43ㆍ여ㆍ서울 노원구 거주)씨는 “엄마들 사이에서는 아이들에 대한 진로체험교육이나 토론형 수업 등을 실시하는 자유학기제의 취지는 너무나도 공감하지만, 그것보다는 내 아이가 부족한 학습량을 채울 수 있는 기회로 여기는 경우가 더 많다”며 “벌써부터 학원가 카페에서는 엄마들이 모여 자유학기제에 다닐 보습학원 정보를 주고 받는 것을 쉽게 볼 수 있다”고 말했다.실제 학부모를 대상으로 실시한 설문조사에서도 이 같은 분위기가 잘 드러나고 있다. 교육전문그룹 비상교육의 학부모 교육정보 커뮤니티 맘앤톡이 최근 초ㆍ중등생 자녀를 둔 학부모 회원 1088명을 대상으로 ‘자유학기제’를 주제로 설문을 실시한 결과, 응답자의 67.1%(730명)는 자유학기 동안에도 개별적인 ‘보충 학습이 필요하다’고 응답했다.자유학기제 실시에 따른 ‘타 학기 학습 비중 증가와 학습 부담’ 25.6%(279명), ‘학력 저하’ 25%(272명), ‘자유학기 이후 학습 부적응’ 22.6%(246명) 등의 학습 부진 현상이 나타날 것을 우려한 데 따른 것으로 분석된다.주요 학원가에서는 자유학기제와 관련된 광고를 앞다퉈 내고 있다. 사교육을 부추긴다는 논란이 커지자 지난해 9월 한국학원총연합회가 자유학기제 마케팅을 자제하기로 결의했지만 현장에서는 잘 지켜지지 않고 있다.서울 목동에서 영어 보습 학원을 운영하고 있는 A씨는 “시험을 안 보는 이 기간이 선행학습의 최적기라고 강조해 중등부 매출이 평소보다 크게 증가했다”며 “학부모들의 수요가 분명히 있는 상황에서 이를 눈감고 있을 수만은 없다는 것이 학원장들의 공통된 의견”이라고 말했다.하지만 교육부는 공교육을 정상화하고 학생들의 학업 부담을 줄여 진로 탐색의 기회를 가질 수 있도록 한 기존 취지를 살려나가기 위해 지속적으로 노력한다는 입장이다.교육부 공교육진흥과 관계자는 “학부모들의 불안감을 기반으로 한 학원들의 마케팅이 성공하고 있는 것은 자유학기제에 대한 이해가 제대로 이뤄지지 않은 이유가 크다고 판단한다”며 ”1월 말부터 2월까지 두 달간 교육부 장관 및 차관이 직접 학부모와 만나 대화하는 시간을 최대한 많이 가질 것”이라고 말했다. 이어 “과장된 마케팅을 하는 학원들에 대해서는 전국학원연합회 차원의 자정 노력을 권고할 것”이라며 “여기에 각 시도교육청이 수시로 점검에 나서도록 할 것”이라고 덧붙였다.신동윤기자/realbighead@heraldcorp.com[글로벌 인재들의 필수 역량, SKEC 영어글쓰기대회][주니어 영어 신문의 가장 효율적인 학습 서비스][헤럴드경제][SUPERICH][REAL FOODS][헤럴드증권방송][HOOC]- Copyrights ⓒ 헤럴드경제 & heraldbiz.com, 무단 전재 및 재배포 금지 -"
138,2016-01-15,"백인 경찰이 또…美 시카고, 흑인 총격살해 영상 공개",https://news.naver.com/main/read.nhn?mode=LSD&mid=shm&sid1=104&oid=001&aid=0008120113,연합뉴스,"지난 1월 1일 미국 시카고에서 경찰의 총기사용 관행과 인종차별에 항의하는 시위를 벌인 사람들(AP=연합뉴스 자료사진)(서울=연합뉴스) 김지헌 기자 = 백인 경찰의 흑인 총격 살해가 끊이지 않는 미국 시카고에서 또 같은 종류의 사건 영상이 공개됐다.시카고 시는 14일(현지시간) 연방법원의 명령에 따라 지난 2013년 1월 7일(이하 현지시간) 시카고에서 발생한 흑인 세드릭 채트먼의 사망 장면이 찍힌 폐쇄회로(CC)TV 영상을 공개했다고 뉴욕타임스, AFP 통신 등 외신이 보도했다 .이 영상은 다소 먼 거리에서 찍힌 것이기는 하나 당시 17세이던 채트먼이 대낮에 경찰을 피해 달아나다가 총에 맞아 길거리에 쓰러지는 모습이 생생히 담겼다.차량과 소지품을 도둑맞았다는 시민의 신고를 받고 출동해 현장에 있던 채트먼에게 총 4발을 발사해 2발을 맞힌 백인 경찰 케빈 프라이는 ""채트먼이 돌아서서 총을 꺼내는 것처럼 보여서 생명에 위협을 느꼈다""고 진술한 바 있다.그러나 당시 검은색 아이폰 상자 1개가 채트먼 근처에서 발견됐을 뿐이었다고 AFP통신이 전했다.채트먼 가족의 변호인은 ""채트먼이 최대한 빠른 속도로 달아나고 있었음이 명백하다""고 주장했다.시카고 독립경찰수사국(IPRA)의 전 직원인 로렌조 데이비스는 ""총을 쏴서 죽이는 것이 아닌 다른 방법으로 채트먼을 체포할 방법이 없었던 것으로 보이지 않는다""고 지적했다.IPRA는 시카고 경찰의 불법 행위를 조사하는 시청 산하 기관이다.이날 채트먼 사망 영상 공개와 함께 지난달 16일 백인 경찰의 총에 맞아 숨진 10대 흑인 청년의 부검 결과도 공개됨에 따라 시카고 경찰의 총기사용 관행과 인종차별이 다시 도마 위에 올랐다.앞서 시카고 쿡 카운티 검시소는 지난달 26일 서부 흑인 주택가 공동 주택 계단에서 야구방망이를 들고 난동을 부리다 경찰의 총에 맞아 숨진 퀸토니오 르그리어(19)의 부검 결과, 그가 경찰로부터 왼쪽 가슴 등 최소한 6발의 총탄에 맞아 숨졌다고 밝혔다.사건 현장에서 흑인 여성 베티 존스도 경찰의 오발로 가슴에 총상을 입었다.추가 비디오와 흑인 청년의 부검 결과 공개는 흑인 절도 용의자 라쿠안 맥도널드(17)가 백인 경관 제이슨 반다이크(37)로부터 16차례 총격을 받고 숨진 현장 동영상이 사건 발생 1년여 만에 공개돼 항의 시위를 촉발한 지 한 달여 만에 나왔다.jk@yna.co.kr▶ [현장영상] 김혜수 ""'시그널'은 안 할 이유 없는 작품""▶ [오늘의 핫 화보] '2016년 오스카의 주인공은?'…아카데미상 후보 선정"
139,2016-01-15,'포천 제초제 연쇄독살' 40대女에 2심도 무기징역,https://news.naver.com/main/read.nhn?mode=LSD&mid=shm&sid1=102&oid=421&aid=0001839250,뉴스1,"서울 서초동 서울고법. /뉴스1 © News1남편·시어머니등 가족 3명 살해하고 보험금 10억 챙겨…법원 ""1심 선고, 지나치게 무겁지 않다""(서울=뉴스1) 김수완 기자 = 남편과 시어머니 등 가족 3명을 맹독성 제초제인 '그라목손'으로 연쇄 살인해 보험금 10억여원을 챙긴 혐의로 기소된 40대 여성에게 항소심 재판부도 무기징역을 선고했다.서울고법 형사11부(부장판사 서태환)는 존속살해 등 혐의로 기소된 노모(46)씨에 대해 15일 ""무기징역을 선고한 원심이 지나치게 무겁거나 가볍지 않다""며 원심과 같이 무기징역을 선고하고 위치추적 전자장치(전자발찌) 부착 10년을 명령했다.재판부는 ""의심받는 것을 피하기 위해 범행 방법을 조금씩 변경하는 등 치밀한 계획 하에 범행을 저질렀고 수법이 비정하고 잔혹하며 결과도 매우 중하다""며 ""재산적 탐욕에 기인한 범행으로 동기에 참작할 점도 없다""고 설명했다.이어 ""수사기관, 법정에서도 진술 바꾸면서 일부 범행에 대한 책임을 부인했고 피해자나 지인에게 책임을 전가하려는 태도까지 보였으며 대부분 피해자들이 엄벌해줄 것을 원하고 있다""며 무기징역은 지나치게 무거운 형으로 보이지는 않는다고 판단했다.그러나 ""노씨를 사형에 처해 생명 자체를 박탈하는 것이 정당화될 만한 특별한 사정이 있다고 단정하기 어렵다""며 사형으로 형을 올리기도 어렵다고 덧붙였다.재판부는 ""사형이 확정된 사람은 (본인이) 노역을 신청하는 경우에 한해 교도관의 심의를 거쳐 노역을 부과하도록 돼 있는데 무기징역을 선고받은 사람은 원칙적으로 노역을 한다""며 ""언제든지 사형이 집행될 가능성이 있어도 현실적으로 20년 가까이 사형이 집행되지 않아 사형을 확정받은 사람들은 사실상 징역형을 복역하고 있는 것이 현실""이라고 강조했다.노씨는 지난 2011년 전 남편에게 맹독성 제초제를 먹여 살해한 뒤 '자살'로 위장해 보험금 4억5000만원을 타낸 혐의, 2013년 재혼한 남편과 시어머니에게 제초제를 먹여 살해한 뒤 역시 자살로 위장해 보험금 5억3000만원을 챙긴 혐의로 지난해 3월 기소됐다.또 친딸에게까지 제초제 섞인 밥을 먹여 입원시킨 뒤 보험금 700만원을 챙긴 혐의(살인미수)도 받았다.1심 재판부는 ""대부분의 혐의를 인정하고 벌금형으로 2회 처벌받은 것 외엔 전과가 없는 점 등을 참작했다""며 노씨에게 같은 해 8월 무기징역을 선고했다.abilitykl@▶ 뉴스1 100% 무료 만화 서비스 오픈!![© 뉴스1코리아(news1.kr), 무단 전재 및 재배포 금지]"
140,2016-01-15,보험금 노려 제초제로 가족 살해 40대女 2심도 무기징역,https://news.naver.com/main/read.nhn?mode=LSD&mid=shm&sid1=102&oid=001&aid=0008120053,연합뉴스,"보험금 노린 '농약 연쇄 살인' 브리핑       (의정부=연합뉴스) 임병식 기자 = 경기지방경찰청 제2청 광역수사대는 살인, 살인미수, 존속살해, 사기 혐의로 노모(44·여)씨를 구속했다고 3일 밝혔다. 노씨는 지난 3년 동안 보험금을 노리고 전 남편과 현 남편, 시어머니 등 3명을 독극물로 살해한 혐의를 받고 있다. 사진은 노씨가 경찰조사를 받는 모습. 2015.3.3    andphotodo@yna.co.kr(서울=연합뉴스) 임미나 기자 = 보험금을 노리고 음식에 제초제를 타 가족들을 살해하고 친딸의 목숨도 위태롭게 한 여성이 항소심에서도 무기징역을 선고받았다.서울고법 형사11부(서태환 부장판사)는 15일 살인·존속살해·살인미수 등 혐의로 구속기소된 노모(46·여)씨의 항소심에서 1심과 같이 무기징역을 선고하고 10년간 전자발찌 부착을 명령했다.재판부는 ""피고인은 의심받는 것을 피하려고 범행 방법을 조금씩 변경하는 등 치밀한 계획하에 범행을 저질러 수법이 극히 비정하고 잔혹하며 그 결과 역시 매우 중대하다""면서 ""피해 회복이 전혀 안 됐을 뿐 아니라 피해자 유족들이 엄벌을 탄원하고 있다""고 밝혔다.이어 ""재산적 탐욕에 기인한 것으로 동기에 참작할 만한 사정이 있다고 할 수 없고 피해자들의 생사가 오가는 순간에도 재산을 이전시키고 보험금 수령을 문의하거나 상조업체에 장례절차를 문의하기도 하는 등 범행 기간 내내 아무런 죄의식이 없는 태도로 일관했다""고 지적했다.다만, ""피고인의 딸이 선처를 탄원하고 있는 점은 유리한 정상이고 사형에 처해 생명을 박탈하는 것을 정당화할 만한 특별한 사정이 있다고 단정하기 어렵다""며 원심의 무기징역형이 부당하지 않다고 결론지었다.서울고등법원<<연합뉴스 자료사진>>노씨는 2011∼2013년 보험금 10억원가량을 노리고 음식에 제초제를 몰래 타 먹이는 수법으로 전 남편과 현 남편, 시어머니 등 3명을 살해하고 친딸에게도 먹여 폐쇄성 폐질환을 앓게 한 혐의로 구속기소됐다.시어머니의 재산을 가로채려고 문서를 위조하고 전 남편의 시어머니도 살해하려다 미수에 그친 혐의도 받았다.노씨는 보험금을 타 백화점에서 하루에 수백만 원을 쓰거나 2천만 원짜리 자전거를 사는 등 호화생활을 해온 것으로 조사됐다.mina@yna.co.kr▶ [현장영상] '해리포터' 스네이프 교수役 '앨런 릭먼' 별세…쏟아지는 추모열기▶ [오늘의 핫 화보] 미녀 농구 선수들, 치어리더로 '깜짝 변신'"
141,2016-01-15,"'구민주계' 정대철, 더민주 탈당…""이대로는 희망 없다""",https://news.naver.com/main/read.nhn?mode=LSD&mid=shm&sid1=100&oid=421&aid=0001839212,뉴스1,"정대철 전 더불어민주당 상임고문. © News1 황희규 기자""여러 갈래로 찢긴 야당을 하나로 대통합하는 데 역할 다할 것""(서울=뉴스1) 박승주 기자 = '구(舊)민주계' 정대철 더불어민주당 상임고문이 15일 탈당을 선언했다. 정 고문과 구민주계의 탈당은 '원로들의 탈당'이라는 점에서 다시 한 번 '더민주의 뿌리'가 흔들리는 일이 될 것으로 보인다.정 고문은 이날 오전 국회 정론관에서 기자회견을 열고 ""개인적으로 한국 야당사와 저의 가족사는 맥을 같이 해왔다""며 ""당을 떠나는 착잡함은 이루 말할 수 없고 가슴이 아프다""며 심경을 밝혔다.이어 정 고문은 ""더민주를 떠나는 이유는 총선승리와 정권교체의 희망이 없다는 이유 단 하나""라며 ""전체 국민의 60~70%는 당장 정권 교체를 갈망하는 것으로 조사되고, 국민은 야당에게 정권을 내줄 준비가 돼 있지만 야당이 수권할 준비가 안 돼 있다""고 비판했다.정 고문은 ""야당마저 희망을 주지 못하는 것에 국민의 분노는 하늘로 치솟고 야당은 심판 대상으로 전락했다""면서도 ""정권교체가 가능한 야당으로 거듭나는 유일한 길은 창조적 파괴를 통해 야권을 전면적으로 재구성하는 방법밖에 없다""고 강조했다.그러면서 ""여러 갈래로 나뉜 신당 추진 세력을 하나로 묶어내는 것이 급선무""라며 ""모든 신당 추진 지도자들이 모이는 통로와 대화 기구부터 조속히 만들자""고 호소했다.정 고문은 ""야당은 언제나 절망을 딛고 일어선 전통이 있다""며 ""더민주를 떠나서 여러 갈래로 찢긴 야당을 하나로 대통합하는 데 역할을 다하겠다""고 덧붙였다.정 고문은 기자회견 말미에 같이 더민주를 떠나는 '구민주계' 인사 총 43명의 이름을 차례로 나열했다.회견을 마친 뒤 정 고문은 기자들과 만나 앞으로 행보에 대해 ""(다른) 당에 금방 입당하지는 않을 것""이라고 말했고 아들 정호준 의원의 거취를 묻는 말에는 ""설득 중이지만 (아들도) 독립 정치인으로 결론을 내는 것은 그의 몫이다""라고 밝혔다.정호준 의원의 경우 현재까지 더민주에 잔류하겠다는 입장을 보이고 있지만 지역(서울 중구)주민들의 민심 등에 따라 거취가 바뀔 가능성도 큰 것으로 알려졌다.parksj@▶ 뉴스1 100% 무료 만화 서비스 오픈!![© 뉴스1코리아(news1.kr), 무단 전재 및 재배포 금지]"
142,2016-01-15,"""월수입 400만원 보장"" 미끼··· 화물차 기사 꿈꿨던 100여명..",https://news.naver.com/main/read.nhn?mode=LSD&mid=shm&sid1=102&oid=032&aid=0002668263,경향신문,"“월수입 400만원 이상 보장합니다.”적지 않은 액수를 벌 수 있다는 말에 ㄱ씨는 선뜻 선금 200만원을 내놨다. 그러나 화물차 기사로 채용해준다는 업체는 감감 무소식이었다. 급한 마음에 사무실을 찾아가니 이미 문을 닫고 도망간 뒤였다. ㄱ씨 같은 피해자는 100여명이나 됐다.서울 서초경찰서는 “화물차를 구입해 기사로 일하면 고수익을 올릴 수 있다”고 속여 차량 계약금 등 명목으로 돈을 받아 가로챈 혐의(특정경제범죄가중처벌법상 사기)로 김모씨(42) 등 2명을 구속했다고 15일 밝혔다.김씨 등은 ‘바지사장’을 앞세워 유령 물류회사를 차려놓고 2010년 1월부터 지난해 4월까지 총 98명으로부터 10억여원을 받아 가로챈 혐의를 받고 있다.김씨 등 일당 5명은 인터넷 생활정보지에 낸 화물기사 구인공고를 보고 찾아온 이들에게 1t 화물차를 구매하면 배송기사로 채용해주고, 400만∼600만원의 월수입과 4대 보험을 비롯해 상여·퇴직금, 유류비, 식대 등을 보장하겠다고 속인 것으로 조사됐다.이들은 구직자들에게 차량 계약 서류를 보여주며 신뢰를 얻었다. 해당 서류는 자동차 회사에 “앞으로 차량을 많이 주문하겠다”며 50여만원의 계약금만 내고 미리 받아놓은 것이었다.피해자들은 대부분 서민이었다. 고수익이 보장된다는 말에 덜컥 계약금 200만원을 건네거나 차량 대금으로 미리 2000여만원을 낸 피해자도 있었다.김씨 일당은 구직자들에게 차량을 인도하기로 한 날이 다가오면 잠적한 뒤 다른 곳에서 새 사무실을 여는 방식으로 모두 세 차례에 걸쳐 범행을 저질렀다. 주범 김씨는 이전에도 같은 수법의 범행으로 징역형을 살았던 것으로 확인됐다.<김형규 기자 fidelio@kyunghyang.com>모바일 경향 [경향 뉴스진|경향신문 앱|모바일웹] | 공식 SNS 계정[경향 트위터][페이스북][세상과 경향의 소통 커뮤니티]- ⓒ 경향신문(www.khan.co.kr), 무단전재 및 재배포 금지〈경향신문은 한국온라인신문협회(www.kona.or.kr)의 디지털뉴스이용규칙에 따른 저작권을 행사합니다.〉"
143,2016-01-15,청주 '물풍선 실험' 입건 초등생들 법원서 처분,https://news.naver.com/main/read.nhn?mode=LSD&mid=shm&sid1=102&oid=003&aid=0006986850,뉴시스,"【청주=뉴시스】박재원 기자 = 자칫 청주판 '캣맘' 사건이 될 뻔한 충북 청주 아파트 물풍선 투척 사건 어린이 용의자들에 대한 처분은 법원이 결정하게 됐다.용인 캣맘 사건과 청주 물풍선 사건 모두 초등학생이 가해자란 공통점이 있지만, 청주 물풍선 사건은 촉법소년에 해당돼 법원 판단을 받아야 한다.지난 14일 오후 1시께 충북 청주시 상당구 금천동의 한 아파트에서 초등학생 2명이 집에서 물풍선 10여개를 밖으로 던져 주차된 차량 2대가 파손됐다.물풍선 위력이 얼마나 컸던지 차량 유리창은 모두 깨지고, 트렁크도 심하게 찌그러졌다. 사람이 이곳을 지나가다 이 풍선에 맞았더라면 크게 다칠 수 있었던 위험 천만한 상황이었다.경찰은 탐문수사를 벌여 초등학생 2명이 낙하 속도를 측정한다며 물풍선을 던진 것으로 확인했다.재물손괴 등의 혐의를 적용할 수 있으나 만 14세 이하 형사미성년자여서 형사 입건할 수는 없다. 그러나 앞선 캣맘 사건과 달리 이 초등학생들은 '촉법소년'에 해당된다.만 10세 이상 14세 미만의 촉법소년은 범법행위에 대한 형사책임능력이 없어 처벌을 받지 않는 대신 법원 판단에 따라 감호위탁이나 사회봉사, 소년원 송치 등 보호처분을 할 수 있다.재물손괴는 반의사불벌죄가 아니어서 고소나 합의와 상관없이 처벌할 수도 있다고 경찰은 밝혔다.경찰은 이 초등학생들을 피의자가 아닌, 참고인 자격으로 조사하고 있다. 참고인 진술조서는 검찰을 거치지 않고 바로 법원 소년부로 송치될 예정이다.용인 아파트 벽돌 투척 사망사건 초등학생은 촉법소년에도 미치지 않은 만 9세여서 아무런 처벌을 받지 않았다.경찰 관계자는 ""통상 촉법소년은 참고인 조사를 거친 뒤 법원에서 처분 여부를 결정한다""며 ""물풍선을 던진 초등생들은 촉법소년에 해당돼 조사를 마치는 대로 사건을 법원으로 송치할 것""이라고 말했다.pjw@newsis.com★ 세상에 이런일이 -  월급 재촉하는 10대 알바에 야구배트 휘두른 사장★ 오늘의 핫 포토 -  서울서 발견된 북한군 대남전단★ 뉴시스 뉴스, 이젠 네이버 뉴스 스탠드에서도 만나세요★ 손 안에서 보는 세상, 모바일 뉴시스<저작권자ⓒ 공감언론 뉴시스통신사. 무단전재-재배포 금지.>"
144,2016-01-15,"""전국 공항에 폭발물 설치""..",https://news.naver.com/main/read.nhn?mode=LSD&mid=shm&sid1=102&oid=001&aid=0008119872,연합뉴스,"인천공항 경계 강화    (영종도=연합뉴스) 하사헌 기자 = 전국 공항에 폭발물을 설치했다는 외국인의 협박 전화로 전국 공항의 경계가 강화된 15일 오전 인천공항에서 공항경찰대 대원들이 순찰을 돌고 있다.(부산=연합뉴스) 차근호 기자 = 전국 공항터미널에 폭발물을 설치했다는 외국인의 협박전화가 걸려와 관계기관이 공항 일대 경계를 강화하고 있다.15일 오전 7시42분께 한국공항공사 콜센터로 아랍어를 쓰는 외국인 남성이 ""전국 공항에 폭발물을 설치했다""며 협박전화를 걸어왔다.국제전화로 협박한 이 남성은 ""당신들은 모두 죽을 것이다. 폭발물은 우리뿐 아니라 당신을 쏠 것이다""는 말을 한 뒤 전화를 끊었다.현재 전국 14개 공항의 공항경찰대와 기동타격대는 국제선과 국내선 일대 폭발물 수색에 나서는 등 경계를 강화하고 있다.ready@yna.co.kr▶ [현장영상] 김혜수 ""'시그널'은 안 할 이유 없는 작품""▶ [오늘의 핫 화보] 세계최대 37.2m 신종공룡 뼈 화석 공개…미국 자연사박물관"
145,2016-01-15,전북지역 돼지 타지역으로 반출 금지,https://news.naver.com/main/read.nhn?mode=LSD&mid=shm&sid1=101&oid=056&aid=0010273968,KBS,"구제역이 발생한 전북지역 내 돼지가 다른 지역으로 반출되는 것이  금지됩니다.농림축산식품부는 전북 김제와 고창에서 구제역이 잇따라 발병함에 따라 오늘 밤 0시부터 오는 23일까지 일주일 동안  전북 지역 돼지의 다른 지역 반출을 금지했습니다.이번 반출금지 명령은 가축전염병예방법 개정 이후  처음 발령되는 것으로,  전북 지역의 구제역이  다른 시·도로 확산되는 것을  막기 위한 것이라고 농식품부는 설명했습니다.반출금지 명령을 어길 경우, 1년 이하의 징역이나  천만 원 이하 벌금 처벌을 받게 됩니다.농식품부는 구제역 상황을 봐가면서 반출 금지 연장 여부를 결정하고 필요하면 충남과 전남지역에 대해서도 반출 금지 명령을 내릴지 검토하겠다고 밝혔습니다.한편 구제역이 발생한 농장 2곳의 돼지는 백신을 접종했지만, 충분한 항체가 형성되지는 않은 것으로 확인됐다고 농식품부는 밝혔습니다.농식품부는 전남과 충남 지역에  구제역이 확산할 우려가 있다고 보고  축산농가에 철저한 백신 접종과  신속한 신고를 당부했습니다.김정환기자 (kim7@kbs.co.kr)▶[취재후] 방송에서 못한 현장 이야기▶ KBS뉴스 SNS[트위터][페이스북][카카오][저작권자ⓒ KBS 무단복제-재배포 금지]"
