,날짜,기사 제목,기사 링크,기사 출처,기사 내용
0,2016-01-15,'감옥으로부터의 사색' 저자 신영복 교수 별세,https://news.naver.com/main/read.nhn?mode=LSD&mid=shm&sid1=103&oid=001&aid=0008121603,연합뉴스,"'감옥으로부터의 사색' 저자 신영복 교수 별세    (서울=연합뉴스) '감옥으로부터의 사색' 등으로 유명한 신영복 성공회대학교 석좌교수가 15일 별세했다. 향년 75세. 15일 출판업계에 따르면 신 교수는 2014년 희귀 피부암 진단을 받고 투병 중이었으며 암이 다른 장기로 전이되면서 끝내 숨졌다.  사진은 지난 2008년 '감옥으로부터의 사색' 출간 20주년을 맞아 열린 기자간담회에서 발언하는 신영복 교수. << 연합뉴스 DB >>      photo@yna.co.kr(서울=연합뉴스) 권혜진 한혜원 기자 = 감옥에서 20년을 보내면서 가진 생각과 소회를 담은 책 '감옥으로부터의 사색' 등으로 유명한 신영복 성공회대학교 석좌교수가 15일 오후 10시 10분께 별세했다. 향년 75세.출판업계에 따르면 신 교수는 2014년 희귀 피부암 진단을 받고 투병 중이었으며 암이 다른 장기로 전이되면서 끝내 숨졌다.'감옥으로부터의 사색' 저자 신영복 교수 별세    (서울=연합뉴스) '감옥으로부터의 사색' 등으로 유명한 신영복 성공회대학교 석좌교수가 15일 별세했다. 향년 75세. 15일 출판업계에 따르면 신 교수는 2014년 희귀 피부암 진단을 받고 투병 중이었으며 암이 다른 장기로 전이되면서 끝내 숨졌다. 2016.1.15 << 도서출판 돌베개 제공 >>      photo@yna.co.kr경제학자인 신 교수는 서울대 경제학과와 동 대학원을 졸업한 뒤 육사에서 경제학을 가르치는 교관으로 일하던 중 1968년 '통일혁명당' 사건으로 무기징역형을 선고받았다. 그는 20년 20일을 복역하다가 1988년 광복절 특별 가석방으로 출소했다.1989년부터 성공회대에서 정치경제학, 사회과학입문, 중국고전강독을 강의한 그는 1998년 사면복권됐다.그가 사면복권된 날 나온 책이 바로 통일혁명당 사건으로 구속된 뒤 특별석방되기까지 20년간 수감생활을 하며 느낀 한과 고뇌를 230여장의 편지와 글로 풀어낸 '감옥으로부터의 사색'이다.'감옥으로부터의 사색' 저자 신영복 교수 별세    (서울=연합뉴스) '감옥으로부터의 사색' 등으로 유명한 신영복 성공회대학교 석좌교수가 15일 별세했다. 향년 75세. 15일 출판업계에 따르면 신 교수는 2014년 희귀 피부암 진단을 받고 투병 중이었으며 암이 다른 장기로 전이되면서 끝내 숨졌다. 2016.1.15 << 도서출판 돌베개 제공 >>      photo@yna.co.kr이 책은 큰 인기를 얻으며 그의 이름을 대중에게 각인시키는 계기가 됐다.이후 출간한 '나무야 나무야', '더불어 숲 1·2', '강의-나의 동양고전독법', '처음처럼', '변방을 찾아서' 등도 베스트셀러 명단에 올랐다.신 교수는 학자이자 작가로서 뿐만 아니라 '신영복체'로 불리는 글씨체로도 유명했다. 소주 브랜드 '처음처럼'이 그의 글씨체를 사용해 높은 판매기록을 올리자 한동안 기업 광고나 건물 현판을 그의 글씨체로 제작하는 것이 유행했다.'감옥으로부터의 사색' 저자 신영복 교수 별세    (서울=연합뉴스) '감옥으로부터의 사색' 등으로 유명한 신영복 성공회대학교 석좌교수가 15일 별세했다. 향년 75세. 15일 출판업계에 따르면 신 교수는 2014년 희귀 피부암 진단을 받고 투병 중이었으며 암이 다른 장기로 전이되면서 끝내 숨졌다. 2016.1.15 << 도서출판 돌베개 제공 >>      photo@yna.co.kr신 교수는 2006년 성공회대에서 정년퇴직한 이후에도 석좌교수로 강의를 계속했으나 2014년 암 진단을 받으면서 그 해 겨울학기를 마지막으로 강단에서 내려왔다.지난해 4월 '신영복의 마지막 강의'라는 부제를 단 '담론'이 출간됐으며 이 책이 나오면서 신 교수의 투병 소식이 공개됐다.25년동안 성공회대에서 강의한 내용을 바탕으로 쓴 이 책은 그의 사상을 집대성했다는 평가를 받는다.'감옥으로부터의 사색' 저자 신영복 교수 별세    (서울=연합뉴스) '감옥으로부터의 사색' 등으로 유명한 신영복 성공회대학교 석좌교수가 15일 별세했다. 향년 75세. 15일 출판업계에 따르면 신 교수는 2014년 희귀 피부암 진단을 받고 투병 중이었으며 암이 다른 장기로 전이되면서 끝내 숨졌다. 2016.1.15 << 도서출판 돌베개 제공 >>      photo@yna.co.kr이 책은 동양고전의 명저인 '시경', '주역', '논어', '맹자', '한비자'를 바탕으로 현대사회를 읽어내는 제1부 '고전에서 읽는 세계 인식'과 20년의 수형생활에서 보고 느끼고 배우고 깨달은 바를 엮은 제2부 '인간 이해와 자기 성찰'로 구성돼 있다.그는 이 책에서 '감옥은 대학'이라며 교도소에서 보낸 20년 세월은 실수와 방황과 우여곡절의 연속이었으나 다른 한편으로 배움과 깨달음의 여정이기도 했다는 감회를 밝히기도 했다.장례는 성공회대 학교장으로 치러질 예정이다.유족으로는 부인 유영순(68)씨와 아들 지용(26)씨가 있다.lucid@yna.co.kr▶ [현장영상] '해리포터' 스네이프 교수役 '앨런 릭먼' 별세…쏟아지는 추모열기▶ [오늘의 핫 화보] 미녀 농구 선수들, 치어리더로 '깜짝 변신'"
1,2016-01-15,5000억원이 몰리는 돈의 축제 '슈퍼 선데이',https://news.naver.com/main/read.nhn?mode=LSD&mid=shm&sid1=104&oid=469&aid=0000122575,한국일보,"달라지는 올해 슈퍼볼 광고의 트렌드매년 2월 초 일요일에 진행되는 슈퍼볼 경기의 최대 볼거리는 다름아닌 50여분의 광고이다. 올해엔 대략 5,000억원이 슈퍼볼 광고에 몰릴 것으로 예상된다.  게티이미지 제공미국풋볼리그(NFL) 플레이오프 결승전, 이른바 ‘슈퍼볼(Super Bowl)’ 경기가 열리는 슈퍼 선데이(Super Sundayㆍ올해는 2월 7일)를 전후한 한 달여는 미국 TV방송 업계에 있어선 그야말로 1년 중 가장 뜨거운 ‘빅 시즌’이다. 매년 전 세계 2억 명 이상이 지켜보는, 단일 프로그램으로는 가장 많은 시청자가 몰리는 슈퍼볼 경기 동안 지난해 기준 무려 3억4,500만 달러(약 4,153억원)의 광고시장이 열리기 때문이다. 특히 50번째 슈퍼볼의 향방을 가리는 올해 슈퍼 선데이는 과거와 비교할 수 없을 정도로 시청자와 광고물량(업계 추산 5억 달러 이상)이 급증할 것으로 기대된다.미식축구의 전통적 강호인 샌프란시스코 49ers의 홈 구장 리바이스(Levi’s)스타디움에서 내달 7일 오후 6시 30분(미 동부시간) 킥오프 되는 슈퍼볼 게임의 진짜 승부는 그라운드가 아닌 광고가 등장하는 전광판과 TV화면에서 벌어질 것이란 말이 나올 정도다. 슈퍼 선데이를 가득 메울 올해 광고주들의 물량 공세와 광고기법의 최첨단을 경험하게 해줄 예상 트렌드를 미리 살펴봤다.맥주 브랜드 버드와이저 광고. 강아지와 말 등 전세대 친화적인 소재를 사용했지만 지난해 방송 후 반응이 그다지 좋지 않아 올해엔 다른 콘셉트의 광고가 제작중이다.“1분에 1,000만 달러라도 사겠다”슈퍼볼 경기는 총 4쿼터(1쿼터는 15분)와 하프타임 20분으로 이뤄지지만 워낙 몸싸움이 치열하고 작전타임이 많이 주어지기 때문에 3시간을 넘는 경우가 다반사이다. 광고에 통상 주어지는 시간은 이중 대략 50분 내외. 1사당 30~60초짜리 광고 1개를 집어넣는 게 일반적이어서 슈퍼볼에 ‘명함’을 내미는 기업들은 보통 50개 가량. 50번째 슈퍼볼이라는 상징성 때문에 올해 슈퍼볼 광고 경쟁은 어느 해보다 치열했던 것으로 전해진다.올해 슈퍼볼 방송을 주관하는 미 CBS에 따르면 지난달 초 기준으로 이미 예정된 광고 타임은 모두 팔려나갔다. 미국의 광고전문매체 애드에이지(AdAge)는 “마감 이후 한 영화제작사 측에서 개봉을 앞둔 대형 영화 홍보가 급하다며 CBS에 2타임(2분)을 살 수 없느냐고 긴급제안을 해왔다”라고 전했다. 이 영화제작사가 이른바 ‘마감 세일’의 기회를 잡았는지 알려지진 않고 있지만 제시된 광고 가격은 1,000만 달러를 크게 웃돌 것이라는 게 업계의 계산이다. 레슬리 문베스 CBS 최고경영자는 지난해 여름 한 매체와의 인터뷰에서 50번째 슈퍼볼 방송 광고 가격에 대해 “30초 기준으로 500만 달러 이상이 될 수 있다”고 말한 바 있다. 이에 따라 올해 슈퍼볼 광고 가격은 지난해(30초 당 약 450만 달러)보다 11% 정도 오를 것이라는 게 통상적인 예측이다. 2006년(30초 당 250만 달러)과 비교하면 올해 슈퍼볼 방송 광고 가격은 10년 새 100%나 치솟는 셈이다.미 언론들이 집계한 바에 따르면 올해 슈퍼볼 광고에는 뷰익, 콜게이트, 페이팔, 선트러스트, 그리고 LG전자가 데뷔한다. 올레드(OLED)TV를 광고하는 LG전자의 슈퍼볼 광고는 영화 ‘에일리언’, ‘마션’등을 감독한 리들리 스콧과 제이크 스콧 부자가 제작했다. 이들 부자는 애플, 버드와이저 등의 슈퍼볼 광고를 만들어 큰 인기를 얻은 바 있는 ‘베테랑’이다. 지지율이 하위권에서 벗어나지 못하고 있는 미 공화당 대선 경선 후보 젭 부시 전 플로리다 주지사도 슈퍼볼 광고주 리스트에 이름을 올릴 것으로 보인다. 이른바 슈퍼볼의 오랜 단골로 불리는 도리토스, 기아자동차, 펩시 등도 영상광고들을 작년에 이어 내놓는다.?코믹한 스토리로 꾸준히 슈퍼볼 광고에 등장하는 도리토스. 올해에도 비슷한 트렌드를 이어갈 전망이다.“감동적인 광고보다 웃기는 광고가 효과적”유에스에이(USA)투데이에 따르면 슈퍼볼 광고가 전파를 타는 슈퍼 선데이 다음 날 통상 광고주 홈페이지 방문자 수는 이전과 비교해 50%이상 늘어나는 것으로 알려져 있다. 눈에 확 띌 정도로 광고 효과가 나타난다는 얘기이다. 투자비용이 높지만 그만큼 큰 효과를 기대할 수 있으므로 광고주는 어떤 광고보다 슈퍼볼 광고의 트렌드에 민감할 수밖에 없다. 지난해까지 2년 동안 미국 소비자들의 가장 많은 관심을 끈 슈퍼볼 광고로 꼽히는 맥주 브랜드 버드와이저 광고에는 집 잃은 강아지 스토리가 등장했다. 맥주와는 동떨어져 보이는 콘셉트이지만 반려동물은 아기와 함께 성별ㆍ세대를 막론하고 가장 잘 소구하는 소재이기 때문이었다. 하지만 버드와이저는 올해 강아지를 광고에서 빼기로 결정했다. 이유는 ‘예상만큼 돈이 되지 않아서’이다.?네이션와이드의 슈퍼볼 광고. 등장하는 아이가 이미 죽었다는 내용을 드러내 그다지 인기를 얻지 못했다.최근 뉴욕타임스(NYT)는 이처럼 유행에 민감한 광고주들이 올해 슈퍼볼 광고에선 눈물샘을 자극하거나 감동을 자아내는 스토리보다는 코믹하고 웃음을 주는 이야기를 주로 선보일 것이라고 전망했다. 신문은 지난해 보험회사인 네이션와이드(Nationwide)가 선보였던 광고를 예로 들면서 “올해의 슈퍼볼 광고 50개는 대체로 지난해보다 가벼운 분위기를 띠게 될 것”이라고 내다봤다. 이 보험회사 광고는 사고로 사망한 아이의 이야기를 다뤄 방송 직후 논란이 된 바 있다. 지난해엔 이 밖에 코카콜라가 사이버 ‘왕따’를 광고에서 담아냈지만 반응은 신통치 않았다. 광고대행사인 SS&K의 브래들리 카이 대표이사는 “지난해 대부분 시청자가 네이션와이드 광고를 보고 불편한 심정을 느꼈을 것”이라며 “슬픈 광고를 선호하는 때가 있는가 하면 코미디가 인기를 얻는 때도 있어 이를 예측하기는 쉽지 않다”고 말했다.양홍주기자 yanghong@hankookilbo.com[아직 모르시나요? 반칙없는 뉴스 바로가기] [한국일보 페이스북] [신문에는 없는 뉴스] [꿀잼 동영상][ⓒ 한국일보(hankookilbo.com), 무단 전재 및 재배포 금지]"
2,2016-01-15,'낭패'는 다리 짧은 전설의 동물 '낭'과 '패',https://news.naver.com/main/read.nhn?mode=LSD&mid=shm&sid1=103&oid=005&aid=0000861348,국민일보,"일에 철저하지 못하거나 오판하여 ‘낭패’를 겪어본 적이 있을 것입니다. ‘낭패’는 ‘바라거나 계획한 일이 실패로 돌아가거나 기대에 어긋나 매우 딱하게 되다’라는 뜻입니다. 낭패는 뒷다리가 짧은 ‘낭(狼)’과 앞다리가 짧은 ‘패(狽)’라는 전설상의 동물 이야기에서 온 말입니다.낭과 패는 늑대(이리) 종류인데, 성격이 거칠고 급한 ‘낭’과 순하지만 지략을 갖춘 ‘패’를 일컫습니다. 이들이 어울려 나들이를 하거나 먹이사냥에 나서면 어떨까요. 걸음걸이가 부자연스러운 데다 성격이 판이해 충돌이 잦고 행동이 엉성해서 목적을 이루기 힘들겠지요. 여기에서 하려던 일이 뜻대로 되지 않고 곤란한 지경에 처하는 것을 ‘낭패’라고 하게 된 것입니다.狼은 ‘여기저기 흩어져 어지럽다(선혈이 낭자하다)’ ‘왁자지껄하고 시끄럽다(비명이 낭자하게 들리다)’는 의미의 ‘낭자하다’에 쓰이는 글자인데, 낭자(狼藉)는 ‘늑대의 잠자리’라는 뜻이지요. 사납고 거친 늑대들의 소굴이 매우 어지럽게 흩어져 있고 시끄러운 모양을 이르는 말입니다.어떤 일을 도모했을 때 잘 풀리지 않아 처지가 고약하게 꼬이는 경우가 낭패이니 지금 우리의 대내외 사정이 그렇지 않나요. 무지하거나 당황하여 상황들을 그르칠 경우 더욱 치명적인 낭패에 처하게 됩니다.서완식 어문팀장 suhws@kmib.co.kr[서완식의 우리말 새기기] 목록 보기GoodNews paper ⓒ 국민일보(www.kmib.co.kr), 무단전재 및 재배포금지[뉴스 미란다 원칙] 취재원과 독자에게는 국민일보에 자유로이 접근할 권리와 반론·정정·추후 보도를 청구할 권리가 있습니다. 고충처리인(gochung@kmib.co.kr)/전화:02-781-9711"
3,2016-01-15,후추는 1000년 이상 금보다 비싼 향신료…냉장·냉동 기술이 발달하면서 가격 추락,https://news.naver.com/main/read.nhn?mode=LSD&mid=shm&sid1=102&oid=015&aid=0003524610,한국경제,"장원재 박사의 '그것이 알고 싶지?' (4) 금이 부럽지 않았던 후추후추는 금(金)보다 비싼 물건이었습니다. 과장이 아닙니다. 비유도 아닙니다. 1000년이 넘도록, 같은 무게의 후추와 금 가운데 후추 가격이 더 높았습니다. 혹시 다른 물건이냐고요? 아닙니다. 우리가 지금 사용하는 후추, 우리가 아는 그 금이 맞습니다. 전통적으로 육류는 인류에게 중요한 영양 공급원이었습니다. 문제는 고기 보관이 쉽지 않다는 점이지요. 신선한 육류를 먹는다는 것은 그래서 과거 사람들에겐 평생 동안 몇 번 없는 호사였습니다. 아주 특별한 날에 집 바로 옆에서 도축을 해야만 비로소 가능한 일이었으니까요.고기를 맛있게 먹는 방법육류 부패를 막고 오래 보관하는 방법은 크게 두 가지였습니다. 소금에 절이거나 포로 만드는 것이지요. 당연히 싱싱한 경우보다 맛이 떨어집니다. 유럽에서는 10월쯤 가축을 도축하고, 말하자면 겨울나기 식품으로 저장육을 활용했습니다. 염장하거나 말려서 지하 창고에 보관한 것이지요. 당연히 맛도 밋밋했고 ‘약간의 부패’에 따른 좋지 않은 냄새도 따랐습니다.이 난점을 단칼에 해결한, 살짝만 첨가해도 저장육의 맛과 향을 몇 단계 업그레이드한 향신료가 후추였습니다. 워낙 비싼 물건이라 귀족들만 섭취할 수 있었고, 서민들은 후추 대신 아쉬운 대로 ‘허브 식물’을 활용했습니다. 금보다 비싸고 휴대가 편리하니, 유럽에서는 후추를 교환 매개로 쓰기도 했습니다. 세금을 낼 때 후추로 현물 납부를 하기도 했고 결혼 지참금, 집세, 무역 거래 결제수단으로도 후추가 널리 쓰였습니다.여담입니다만, 1990년대 초 동유럽에서도 비슷한 일이 있었지요. 각국의 지폐보다 ‘미국 담배’가 더 환영받는 결제수단이었습니다. 각국 정부의 신용도가 추락하고 인플레이션이 심해 지폐 가치는 예측 불가능이었지만 ‘현물인 담배’가 지니는 가치는 동유럽을 넘어서서 국제적으로 불변이었으니까요. 그 당시 동유럽에서 미국 담배를 피는 것은 그래서 지폐를 태우는 일과 동일한 행동이었습니다. 유럽에서만 후추가 인기였던 것은 아닙니다. 우리나라도 고려시대 문헌부터 후추에 대한 언급이 눈에 띕니다. 조선시대에는 ‘연회장에서 후추를 본 기생들이 다투어 달려들었다’는 기록도 보입니다. 그만큼 후추는 귀한 물건이었습니다. 동서양을 막론하고, 후추의 별명이 ‘검은 황금’인 이유입니다.후추 가치는 왜 떨어졌나그런데 왜 후추 가격이, 문명사적 중요성이 갑자기 떨어지고 줄어든 것일까요? 후추가 더 이상 생활에 필요한 절대적인 물건이 아니기 때문입니다. 대체작물이 나와서가 아닙니다. 과학기술의 발전이 후추 가치를 떨어뜨렸습니다. ‘냉동 기술’입니다. 식품의 냉장냉동 보관이 가능해지면서 후추의 효용은 빠르게 줄어들었습니다. 필수품이 아니라 기호품이 돼 버린 것이지요. 경기규칙이 바뀌거나 아예 경기종목 자체가 달라진 것입니다. 이런 경우를 ‘패러다임 체인지(paradigm change)’라고 표현하기도 합니다. 이 세상에 절대적이고 영원 불변인 것은 없습니다. 지금 우리가 당연하다고 생각하는 규칙이나 진리도 세월이 흐르면 얼마든지 달라질 수 있습니다.주산(珠算)에 대해 들어보신 적이 있나요? 지금은 ‘어린이 지능 개발에 도움이 되는 숫자 계산법’ 정도의 기술이지만, 1980년대 초중반까지만 해도 주산은 국가가 관리하는 주요 기능이었습니다. 각급 학교, 특히 상업학교의 필수 교과목이었고 문교부와 대한상공회의소가 공인하는 1~7급의 엄정한 검정시험이 치러졌습니다. 입사 시험 때 주산 자격증이 당락의 주요한 기준이었고, 주산 고수들은 직장에서 그에 상응하는 대우를 받았습니다.요즘 프로야구 투수처럼 팔을 보호하는 사람들도 많았습니다. ‘주산을 놓는 손’으로는 가방도 들지 않고, 손톱도 다듬이칼로 살짝살짝 섬세하게 문지르고 온갖 정성을 다했던 것이지요. 휴대용 전자계산기가 발명되면서 주산의 전성기는 급격하게 막을 내렸습니다. 사회적 중요도가 하락하기는 했어도 주산은 어쨌거나 살아남았습니다. 하지만, ‘필경사(筆耕士)’라는 직종과 그 분들이 사용하던 유인물(油印物) 제작기는 아예 자취를 감췄습니다.기술에 따라 사라지는 직업들1960년대 요코하마를 배경으로 펼쳐지는 일본 지브리 스튜디오의 애니메이션 ‘고쿠리코 언덕에서’(2011)를 보셨나요? 그 작품에서 고등학생들이 문예지를 만들 때 쓰는 기구가 유인물 제작기, 일명 ‘가리방’입니다. 철판 위에 기름 종이를 놓고 철필로 글자를 쓰거나 그림을 그리고, 완성 후 그 아래에 종이를 대고 잉크를 묻힌 롤러로 밀면 ‘철필로 긁어낸’ 곳에만 잉크가 묻는, 수작업 인쇄방식입니다. 초중고 학교마다 시험지, 가정 통신문을 인쇄하는 필경사가 꼭 있었고, 시중에 유인물 가게가 번성했지요. 나름대로 전문 인력으로 평가받던 필경사는 복사기의 보급과 발명으로 문서 작성의 패러다임이 바뀌면서 존재 의미를 잃었습니다.알아보기 어려운 육필원고 손글씨를 가독성(可讀性) 있게 바꿔주던 타이피스트도 예전에는 법원(法院)의 필수 정규인력이었습니다. 판사들이 판결문을 컴퓨터로 작성하면서 자연스레 사라진 직종입니다. 그렇다면 미래에는 어떤 직종이 살아남거나 생겨날까요? 변화의 방향을 예측하는 것이 가능하기는 한 일일까요? 다음 회에는 그 이야기를 한 번 해보겠습니다.[한경닷컴 바로가기] [스내커] [슈퍼개미] [한경+ 구독신청]ⓒ '성공을 부르는 습관' 한경닷컴, 무단 전재 및 재배포 금지"
