,날짜,기사 제목,기사 링크,기사 출처,기사 내용
78,2016-01-15,"朴대통령, 개각 후속인사 단행",https://news.naver.com/main/read.nhn?mode=LSD&mid=shm&sid1=100&oid=277&aid=0003667603,아시아경제,"[아시아경제 신범수 기자] 박근혜 대통령은 지난 13일 5개 부처 장관을 임명한 데 이어 공석 중인 국무조정실장과 차관급에 대한 후속인사를 15일 단행했다고 정연국 청와대 대변인이 이날 오후 밝혔다.장관급인 국무조정실장에는 이석준 미래창조과학부 1차관이 내정됐다. 이 차관은 기획재정부 2차관과 예산실장, 금융위원회 상임위원 등을 역임했으며 창조경제 및 국정전반에 대한 높은 이해를 바탕으로 각종 사회 현안을 조정해 나갈 적임자라고 정 대변인은 전했다.기재부 1차관과 미래부 1차관에는 각각 최상목 청와대 경제금융비서관과 홍남기 청와대 기획비서관이 발탁됐다.정 대변인은 ""최 비서관은 기재부의 주요 보직을 두루 역임한 경제금융 정책 전문가로 거시경제의 안정적 운영과 경제체질 개선을 위한 구조개혁에 큰 힘을 보탤 것""이라고 밝혔다.미래부 1차관에 내정된 홍 비서관은 기재부 정책조정국장과 대통령직 인수위 전문위원 등을 역임한 정책ㆍ기획통으로 박 대통령의 철학과 창조경제에 대한 이해가 깊고 정책 수립과 추진력을 겸비해 미래부의 주요 현안들을 추진할 적임자라는 게 청와대의 설명이다.박 대통령은 또 행정자치부 차관에 인사ㆍ조직 전문가인 김성렬 행자부 지방행정실장을 내정했다. 산업통상자원부 2차관에는 우태희 산업부 통상차관보, 금융위원회 부위원장에는 정은보 기재부 차관보를 각각 내정했다.청와대는 우 차관보에 대해 ""산업ㆍ통상 전문가로서 산업부 정책에 대한 전문성을 바탕으로 산업 부흥에 기여할 적임자""라고 평가했으며, 정 차관보는 ""경제ㆍ금융정책 전문가로, 금융자본 시장에 활력을 불러일으킬 것으로 기대된다""고 전했다.한편 중소기업청장에는 민간기업 CEO 출신인 주영섭 서울대 융합과학기술대학원 객원교수가 낙점을 받았다. 그는 중소기업의 어려움을 실질적으로 파악해 정부 정책에 반영함으로써 우리 경제 도약에 기여할 적임자라고 정 대변인은 설명했다.신범수 기자 answer@asiae.co.kr▶ 주요 이슈의 재구성, 촌철살인 이미지 파일 '카드뉴스'▶ 농업과 내:일의 만남, ""나우올제 크로스미디어""<ⓒ세계를 보는 창 경제를 보는 눈, 아시아경제 무단전재 배포금지>"
79,2016-01-15,"朴대통령 후속개각 단행, 국조실장..",https://news.naver.com/main/read.nhn?mode=LSD&mid=shm&sid1=100&oid=277&aid=0003667603,아시아경제,"[아시아경제 신범수 기자] 박근혜 대통령은 지난 13일 5개 부처 장관을 임명한 데 이어 공석 중인 국무조정실장과 차관급에 대한 후속인사를 15일 단행했다고 정연국 청와대 대변인이 이날 오후 밝혔다.장관급인 국무조정실장에는 이석준 미래창조과학부 1차관이 내정됐다. 이 차관은 기획재정부 2차관과 예산실장, 금융위원회 상임위원 등을 역임했으며 창조경제 및 국정전반에 대한 높은 이해를 바탕으로 각종 사회 현안을 조정해 나갈 적임자라고 정 대변인은 전했다.기재부 1차관과 미래부 1차관에는 각각 최상목 청와대 경제금융비서관과 홍남기 청와대 기획비서관이 발탁됐다.정 대변인은 ""최 비서관은 기재부의 주요 보직을 두루 역임한 경제금융 정책 전문가로 거시경제의 안정적 운영과 경제체질 개선을 위한 구조개혁에 큰 힘을 보탤 것""이라고 밝혔다.미래부 1차관에 내정된 홍 비서관은 기재부 정책조정국장과 대통령직 인수위 전문위원 등을 역임한 정책ㆍ기획통으로 박 대통령의 철학과 창조경제에 대한 이해가 깊고 정책 수립과 추진력을 겸비해 미래부의 주요 현안들을 추진할 적임자라는 게 청와대의 설명이다.박 대통령은 또 행정자치부 차관에 인사ㆍ조직 전문가인 김성렬 행자부 지방행정실장을 내정했다. 산업통상자원부 2차관에는 우태희 산업부 통상차관보, 금융위원회 부위원장에는 정은보 기재부 차관보를 각각 내정했다.청와대는 우 차관보에 대해 ""산업ㆍ통상 전문가로서 산업부 정책에 대한 전문성을 바탕으로 산업 부흥에 기여할 적임자""라고 평가했으며, 정 차관보는 ""경제ㆍ금융정책 전문가로, 금융자본 시장에 활력을 불러일으킬 것으로 기대된다""고 전했다.한편 중소기업청장에는 민간기업 CEO 출신인 주영섭 서울대 융합과학기술대학원 객원교수가 낙점을 받았다. 그는 중소기업의 어려움을 실질적으로 파악해 정부 정책에 반영함으로써 우리 경제 도약에 기여할 적임자라고 정 대변인은 설명했다.신범수 기자 answer@asiae.co.kr▶ 주요 이슈의 재구성, 촌철살인 이미지 파일 '카드뉴스'▶ 농업과 내:일의 만남, ""나우올제 크로스미디어""<ⓒ세계를 보는 창 경제를 보는 눈, 아시아경제 무단전재 배포금지>"
80,2016-01-15,창원中 학생 14명 결핵 집단감염…70명 균 노출,https://news.naver.com/main/read.nhn?mode=LSD&mid=shm&sid1=102&oid=421&aid=0001837620,뉴스1,"질병관리본부./© News1 장수영 기자최초 감염자 같은 반 11명 등 전파…당국, 학교·학원 역학조사(서울=뉴스1) 음상준 기자 = 경남 창원중학교에서 학생 14명이 결핵에 집단으로 감염됐다. 결핵균에 노출됐지만 전염력이 없는 잠복결핵감염자도 70명으로 확인됐다.14일 질병관리본부와 창원시에 따르면 지난해 창원중학교에서 발생한 결핵에 대해 역학조사를 시행한 결과, 첫 번째로 신고된 환자 1명 이외에 13명의 결핵환자를 발견했다. 현재까지 총 14명의 결핵 환자가 치료 중이다.보건당국은 첫 번째 결핵 환자가 신고된 후 접촉한 사람을 상대로 역학조사를 시작했으며, 학교 전체 학생 713명과 교직원 52명, 학원 등을 대상으로 결핵검사를 시행했다.결핵검사는 흉부 X(엑스)선 촬영이 기본 검사이며, 필요에 따라 객담(가래)검사, 흉부 CT(컴퓨터단층촬영) 촬영을 시행한다.역학조사를 통해 발견한 결핵 환자는 흉부 X선 검사만으로는 발견하기 어려운 초기 상태 결핵으로 정밀 검사인 흉부 CT 촬영을 통해 최종 진단을 내렸다.13명의 결핵 환자는 첫 번째로 신고된 학생과 같은 반 학생 11명, 같은 동아리반 학생 1명으로 밀접한 접촉에 의해 전염된 것으로 판단되며, 나머지 1명은 다른 학년 학생으로 감염경로를 조사 중이다.당국은 결핵균에 노출돼 감염됐으나 실제 결핵으로 발병하지 않은 상태로 전염력이 전혀 없는 잠복결핵감염 검사도 함께 시행했다. 현재까지 총 70명이 확인돼 치료를 받고 있다.잠복결핵감염자는 10% 정도가 결핵이 생기지만 적극적인 치료로 결핵으로 발병하는 것을 예방할 수 있다.현재 창원보건소는 '창원중 결핵 역학조사 TF'를 구성하고 질병관리본부, 창원교육지원청과 함께 창원지역 3개 의료기관과 협력체계를 구축했다.질본은 ""발견된 결핵 환자는 치료와 격리조치를 취해 추가적인 전파 위험은 없다""고 밝혔다.sj@▶ 뉴스1 100% 무료 만화 서비스 오픈!![© 뉴스1코리아(news1.kr), 무단 전재 및 재배포 금지]"
81,2016-01-15,"조석래 효성회장, 조세포탈 '유죄'로 실형…배임은 무죄",https://news.naver.com/main/read.nhn?mode=LSD&mid=shm&sid1=101&oid=421&aid=0001840002,뉴스1,"회사돈 수백억원대 횡령·배임 혐의, 분식회계를 통해 1000억원대 세금을 탈루한 혐의 등으로 기소된 조석래 효성그룹 회장이 15일 오후 선고공판을 받기 위해 서울 서초구 서울중앙지법에 들어서고 있다. 2016.1.15/뉴스1 © News1 구윤성 기자엄격한 배임기준 따라 기업 총수들 잇따라 무죄…검찰 반발도조세포탈은 유죄 인정 시 실형 못 면해…양형기준 최대 징역12년(서울=뉴스1) 김수완 기자 = 분식회계·차명주식을 통해 1000억원대 세금을 탈루한 혐의 등으로 기소된 조석래(81) 효성그룹 회장이 1심 재판에서 징역 3년의 '실형'을 선고받았다. 그러나 법원은 조 회장이 받고 있는 혐의 중 횡령·배임 등 혐의에 대해서는 무죄를 선고했다.최근 법원이 기업 총수들의 배임 혐의에 대해 엄격한 기준을 적용하면서 잇따라 무죄를 선고하자 서울중앙지검장이 직접 나서 법원 판결에 항의하는 등 반발이 거세지고 있다.반면 조 회장처럼 조세포탈 혐의로 기소된 기업 총수들에 대해서는 유죄가 인정될 경우 잇따라 '실형'을 선고하고 있다. 특히 이재현(56) CJ그룹 회장의 파기환송심 재판부는 대법원 양형기준상 조세포탈 혐의에 대한 선고형량이 상당히 높다는 점을 분명히 했다.◇엄격해진 '배임기준'…기업 총수들 잇따라 무죄서울중앙지법 형사합의28부(부장판사 최창영)는 15일 조 회장에 대해 실형을 선고하면서도 효성 싱가포르 법인이 조 회장 개인의 채무를 갚도록 해 회사에 234억원 상당의 손해를 끼쳤다는 혐의에 대해서는 무죄를 선고했다.다만 '경영상 판단'을 이유로 했던 다른 기업 총수들에 대한 판단과는 달리 조 회장의 경우 ""문제가 된 채무가 조 회장 개인의 채무가 아니라 효성 회사의 채무였다""는 것이 무죄의 주된 이유였다. 즉 회사가 자기의 채무를 갚았기 때문에 손해를 입었다고 볼 수 없다는 것이다.검찰이 이 채무에 대해 '효성 회사의 채무가 아니라 조 회장 개인의 채무'라는 점을 입증하지 못하면 항소심에서도 같은 결과를 받아들 것으로 보인다. 검찰 측은 판결문을 검토한 뒤 항소 여부를 결정하겠다는 입장으로 조만간 항소 의사를 밝힐 것으로 전망된다.이에 앞서 강영원(55) 전 한국석유공사 사장, 이석채(71) 전 KT 회장 등 배임 혐의를 받았던 기업 총수들에 대해 잇따라 무죄가 선고되면서 ""배임 기준이 지나치게 엄격하다""는 목소리가 각계각층에서 나오고 있다.이 전 회장은 회삿돈 27억5000만원을 횡령하고 103억5000만원 상당의 피해를 끼친 혐의로 재판에 넘겨졌지만 지난해 9월 1심 법원으로부터 무죄를 선고받았다. 당시 재판부가 이 전 회장 혐의를 무죄로 인정한 주된 이유는 ""합리적인 경영상 판단이었다""는 것이다.또 강 전 사장은 캐나다 자원개발업체 하베스트를 무리하게 인수해 수천억원의 국고 손실을 끼친 혐의로 기소됐지만 지난 1월 역시 1심 법원으로부터 무죄를 선고받았다. 당시 재판부는 ""판단 과정에서 과오가 있었다고 판단할 수 있지만 형법상 배임에 해당할 만큼은 아니다""고 판단했다.이렇게 기업 총수들에 대한 '배임 무죄' 판결이 잇따르면서 이영렬 서울중앙지검장이 직접 나서서 법원 판결을 비판하는 이례적인 풍경을 연출하기도 했다.이 지검장은 지난 11일 ""손실 발생 사실이 인정됐는데 형사책임을 물을 수 없다는 것을 이해할 수 없다""며 ""단호하게 항소해 판결의 부당성을 다투겠다""고 밝혔다.◇'조세포탈'은 엄벌 추세…기업 총수들도 실형 못 면했다반면 법원은 기업 총수들의 조세포탈에 대해서는 잇따라 실형을 선고하는 등 엄벌 추세를 유지하고 있다.조 회장의 경우에도 횡령·배임 등 혐의는 무죄를 선고받았지만 회계분식을 통한 조세포탈 혐의 대부분에 대해서는 유죄를 선고받았다.재판부 역시 ""효성의 회사 재산에 피해를 끼치지 않았다 해서 조세포탈은 정당화될 수 없다""고 지적했다. 또 조 회장이 조세포탈과 결부된 추가 범행을 저지르지 않았다 해도 회사의 회장이자 최대주주이기 때문에 이익을 직·간접으로 얻을 수 있었다고 강조했다.앞서 이재현 회장 역시 파기환송심에서 실형을 선고받았는데 당시 파기환송심 재판부는 약 251억원 상당의 조세포탈 혐의가 실형 선고의 주된 이유였음을 밝히기도 했다.즉 ""대법원 양형기준상으로도 조세포탈이 더 중요한 요소이며 업무상 배임은 큰 비중을 차지 않는다""고 설명한 것이다.현재 대법원 양형기준위원회의 양형기준에 따르면 5억~10억원 상당의 조세를 포탈한 경우 징역 1년6월~5년, 10억~200억원 상당의 조세를 포탈한 경우 징역 2년6월~8년, 200억원 이상의 조세를 포탈한 경우 징역 4~12년을 선고하도록 권고하고 있다.또 기업 총수들의 조세포탈 범행은 '계획적·조직적 범행', '하급자에 대한 범행교사' 등 형 가중요소가 적용될 여지도 매우 큰 편이다.앞서 같은 혐의를 적용받았던 박성철(76) 신원그룹 회장, 이혜경(64) 전 동양그룹 부회장 등도 모두 1심에서 실형을 선고받았다.다만 박 회장의 경우 법원에 사기회생을 신청한 혐의, 이 전 부회장의 경우 강제집행을 피하기 위해 재산을 빼돌린 혐의 등이 더 무겁게 평가받았다.abilitykl@▶ 뉴스1 100% 무료 만화 서비스 오픈!![© 뉴스1코리아(news1.kr), 무단 전재 및 재배포 금지]"
82,2016-01-15,내연녀 약혼자에게 성관계 사진 보낸 유부남 '집유',https://news.naver.com/main/read.nhn?mode=LSD&mid=shm&sid1=102&oid=003&aid=0006987543,뉴시스,"【수원=뉴시스】김도란 기자 = 내연녀가 다른 사람과 결혼하려 하자 몰래 찍은 성관계 사진을 약혼자에게 보내 파혼하게 한 유부남에게 집행유예가 선고됐다.수원지법 형사11단독 양진수 판사는 성폭력범죄의처벌등에관한특례법 위반 혐의로 기소된 자영업자 이모(44)씨에게 징역 2년 6월에 집행유예 4년, 사회봉사 200시간, 성폭력 치료강의 120시간 수강을 선고했다고 15일 밝혔다.양 판사는 ""피고인은 배우자와 아들이 있는 가장으로 피해자와 상당기간 동안 내연 관계를 유지하다 이를 계속하지 못하게 되자 이 같은 범행을 저질렀다""며 ""심부름센터를 시켜 피해자의 약혼자 주소와 연락처를 알아낸 범행 수법과 피고인의 신분을 감안하면 죄질이 상당히 불량하고 비난가능성 또한 크다""고 판시했다.이어 ""피고인의 범행으로 자신의 부적절한 과거를 청산하고 새로운 인생을 시작하려던 피해자는 회복하기 어려운 정신적 손해를 입게됐고, 성적 수치심의 정도 또한 큰 것으로 보인다""고 덧붙였다.양 판사는 ""다만 피고인이 범행 후 피해자와 합의한 점, 피고인의 처가 선처를 탄원하는 점, 동종 전과가 없는 점 등을 양형에 참작했다""고 했다.앞서 이씨는 3년 넘게 만난 내연녀 A(34·여)씨가 결혼을 이유로 헤어지자고 하자 앙심을 품고, 지난 해 3월 강릉의 한 리조트에서 몰래 찍은 성관계 동영상을 캡쳐해 A씨 약혼자에게 전송한 혐의로 기소됐다.이씨는 심부름센터 직원 민모(35)씨를 시켜 A씨와 약혼자를 미행하게 하고, 약혼자의 주소와 연락처를 알아낸 혐의도 받았다.한편 양 판사는 이씨 사주로 A씨 약혼자의 사생활을 조사한 혐의(신용정보의이용및보호에관한법률위반)로 기소된 민씨에게 벌금 300만원을 선고했다.dorankim@newsis.com★ 세상에 이런일이 -  월급 재촉하는 10대 알바에 야구배트 휘두른 사장★ 오늘의 핫 포토 -  서울서 발견된 북한군 대남전단★ 뉴시스 뉴스, 이젠 네이버 뉴스 스탠드에서도 만나세요★ 손 안에서 보는 세상, 모바일 뉴시스<저작권자ⓒ 공감언론 뉴시스통신사. 무단전재-재배포 금지.>"
83,2016-01-15,주택대출 금리 또 오를 듯…신규코픽스 석 달째 상승,https://news.naver.com/main/read.nhn?mode=LSD&mid=shm&sid1=101&oid=001&aid=0008120958,연합뉴스,"<<연합뉴스자료사진>>잔액코픽스는 48개월째 하락(서울=연합뉴스) 송광호 기자 = 주택담보대출의 기준금리로 이용되는 신규취급액 코픽스가 석 달 연속 상승했다.15일 전국은행연합회에 따르면 작년 12월 신규 취급액 기준 코픽스는 1.72%로, 전월인 11월(1.66%)보다 0.06%포인트 올랐다.신규 취급액 기준 코픽스는 월중 신규로 조달한 자금을 대상으로 산출돼 잔액기준 코픽스보다 시장금리 변동을 빠르게 반영한다.은행연합회는 시장금리 상승 등으로 신규취급액 코픽스가 올랐다고 밝혔다.신규취급액 코픽스의 상승으로 은행권의 주택담보대출 금리도 소폭 오를 가능성이 커졌다.실제로 일부 시중은행들은 지난달 코픽스가 발표된 후 코픽스 주택담보대출 변동금리 상품의 금리를 0.2%포인트가량 올린 바 있다.잔액기준 코픽스는 전월(1.90%)보다 0.02%포인트 떨어진 1.88%를 기록했다. 48개월 연속 하락이다.은행연합회는 ""시장 금리변동이 서서히 반영되는 잔액기준 코픽스는 과거 취급한 고금리 예금이 만기도래하고 상대적으로 저금리인 예금이 신규 반영됨에 따라 하락세가 지속됐다""고 설명했다.코픽스는 국내 9개 은행의 정기 예·적금, 상호부금, 주택부금, 양도성예금증서(CD) 등 수신금리를 잔액비중에 따라 가중평균해 산출한다.buff27@yna.co.kr▶ [현장영상] '해리포터' 스네이프 교수役 '앨런 릭먼' 별세…쏟아지는 추모열기▶ [오늘의 핫 화보] '고대에는 고래가 걸어 다녔다고?'…이집트 고래 화석"
84,2016-01-15,"""전북 구제역 때문에""…설 앞두고 돼지 반출금지 '비상'",https://news.naver.com/main/read.nhn?mode=LSD&mid=shm&sid1=102&oid=001&aid=0008120385,연합뉴스,"'방역 철저' 고창 구제역 발생 농가    (고창=연합뉴스) 김진방 기자 = 14일 오전 전북 고창군 무장면 구제역 발생 돼지 농가에서 방역요원들이 출입을 통제하고 방역을 하고 있다. 전북에서는 김제에 이어 고창에 두번째 구제역이 발생했다. 2016.1.14    chinakim@yna.co.kr(전주=연합뉴스) 백도인 기자 = 전북도는 잇따른 구제역 발생으로 다른 시·도로의 돼지 반출이 금지됨에 따라 도축장의 가동시간을 최대한 늘리기로 했다고 15일 밝혔다.설 명절을 앞두고 출하 물량이 가장 몰리는 시기에 반출금지 명령이 내려져 축산농가들이 돼지 출하에 어려움을 겪을 것으로 보이기 때문이다.이에 따라 도내 8개 돼지 도축장들은 평일 가동시간 연장과 휴일 근무로 출하 물량을 최대한 소화할 계획이다.""구제역 막아라"" 전북 특별방역대책회의    (전주=연합뉴스) 김제에 이어 고창에서 구제역이 발생하자 전북도와 일선 시군, 전북농협, 가축위생방역지원본부 등 관련 기관들이 15일 도청에서 구제역 확산방지를 위한 특별방역대책회의를 하고 있다. 2015.1.15 <전북도>    ichong@yna.co.kr살아있는 돼지는 반출하지 못하지만 도축된 돼지고기는 상관이 없다.반출금지 명령은 구제역 확산을 막기 위한 조치로 16일 0시부터 7일동안 적용된다.전북도 관계자는 ""도내에서 사육되는 돼지의 상당수가 타 시·도에서 도축되고 있다""며 ""반출 금지로 도내 도축장으로 물량이 몰릴 것에 대비한 조처""라고 말했다.한편 전북도는 고창지역의 돼지 11만4천마리 전체에 대해 이날까지 긴급 접종을 마치기로 했으며 구제역 발생농가의 돼지도 최대한 이른 시일 내에 매몰 처리하기로 했다.구제역 살처분 한창    (김제=연합뉴스) 백도인 기자 = 12일 구제역이 발생한 전북 김제시 용지면의 돼지농장에서 방역 관계자들이 트럭에서 방역물품을 내리고 있다. 검정색 천막으로 거려진 농장 안에서는 포크레인이 동원돼 살처분을 하고 있다. 2016.1.12    doin100@yna.co.kr전북도는 이날 긴급 방역대책회의를 열고 철저한 소독과 백신접종을 각 시군에 지시하고 농가에는 구제역이 의심되면 즉시 신고해달라고 당부했다.doin100@yna.co.kr▶ [현장영상] 김혜수 ""'시그널'은 안 할 이유 없는 작품""▶ [오늘의 핫 화보] 세계최대 37.2m 신종공룡 뼈 화석 공개…미국 자연사박물관"
