,날짜,기사 제목,기사 링크,기사 출처,기사 내용
86,2011-06-27,지방 지하철 요금 인상 도미노...수도권 요금도 오르나,https://news.naver.com/main/read.nhn?mode=LSD&mid=shm&sid1=103&oid=112&aid=0002206228,헤럴드POP,"오는 7월 1일부터 대구, 인천, 광주 등 지하철 요금 인상되고 부산 지하철도 인상을 적극 검토하고 있어 수도권 지하철요금 인상도 급물살을 탈것으로 보인다.대구지하철 요금은 교통카드 사용자의 경우 950원에서 1100원으로 15.8%가, 현금 승차의 경우 1100원에서 1200원으로 9.1%가 각각 오른다.대전도 기존 교통카드로 950원을 냈다면 1100원으로, 현금일 경우 1000원에서 1200원으로 인상된다. 여기에 현재 전국에서 가장 요금이 비싼 부산도 적자를 보전할 방법이 없다며 16% 정도 인상을 추진하고 있는 상황이다.지방 자치단체들의 잇단 지하철 요금 인상에 따라 현재 적자와 부채 늪에서 헤어나오지 못하고 있는 수도권 지하철 요금 인상 논의를 가속화 시킬것으로 예상된다.서울시 관계자에 따르면 경기도, 인천시 그리고 코레일과 지하철 기본요금을 100원에서 최대 400원까지 인상하는 방안을 실무적으로 협의하고 있다. 또 65세 이상 노인들과 국가유공자, 장애인들의 무임승차가 지하철 운송적자의 주요인으로 보고 정부에 지원을 요청할 방침이다 .서울 지하철 기본요금은 지난 2007년 800원에서 900원(교통카드 기준)으로 오른 이후 4년째 동결된 상태로, 서울메트로와 서울도시철도공사의 운영 손실이 올해에만 5700억 원, 2007년 이후 누적적자는 2조2000억 원이 넘는다고 추산했다.특히 서울메트로의 경우 지난 2000년대 초반부터 전동차 교체를 시작으로 막대한 재투자를 해왔다. 2010년까지 노후시설 개량, 전동차 교체 등 안전 투자비로 약 1조 6610억원을 사용했다. 부족재원 대부분을 도시철도공채 등 외부차입을 통해 충당했다. 이로 인해 2003년 6000여억원이던 운영부채는 2010년말 2조739억원으로 폭증했다.앞으로 서울메트로 부채상황은 더 심각해질 전망이다. 서울메트로의 차입부채는 지난해 말 2조 2201억원으로건설부채는 1462억원(3호선 연장선 포함), 운영부채가 2조 739억원에 달한다.여기에 무임수송 비용의 증가로 재정여건의 어려움을 가중되고 있다. 2005년 1041억원 이던 무임수송 운임손실 비용은 2010년 말에는 1390억원까지 늘어났다. 2010년 당기순손실의 54%에 달한다. 2018년에는 전체 인구의 14.3%가 65세 이상이 되는 고령사회로 진입할 것으로 예상되고 있어 제도적인 보완이 시급한 상황이다.서울메트로에 따르면 100원을 인상 했을 경우 786억원, 200원은 1572억원, 300원은 2358억원의 투자액이 확보된다고 밝히고 있다.문제는 인상폭이다. 현재 지하철 운영기관들의 적자가 심각한 상황에서 100원을 올려서 무슨 효과가 있겠느냐는 이야기다.서울시도 이런 점에서 심각하게 고민하고 있다. 일부에서는 어차피 매를 맞는 것은 불가피한 상황인데 이번 기회에 400원 정도 인상해 경영적자를 해소하고 시설 개선에 투자하자는 주장도 있다.서울시 관계자는 “지하철 요금을 올해도 인상하지 않을 경우 늘어가는 적자폭과 안전투자 재원을 마련할 수 없다”며 “공공기관이기 때문에 빚을 내서라도 해야하는 안전투자는 부채의 증가로 이어지고 결국 언젠가는 시민의 혈세로 메꾸어야 하는 상황이 오게 된다”고 했다. 이어 “지하철 요금을 인상하면 시민들에게 부담되는 것은 사실이나 환승서비스로 인해 체감을 줄일수 있을 것”이라며 “대중교통의 수혜자가 부담을 해야 한다는 ‘수익자 부담원칙’에 따라 최대폭을 인상해 쾌적한 지하철을 만드는 것이 시민들에게 더 좋지 않을까 생각 한다”고 말했다.<이진용 기자 @jycafe>jycafe@heraldm.com▶ 지하철 요금 100원 인상ㆍ무임연령 70세로 상향 추진▶ 서울 지하철 요금·무임연령 상향 추진▶ 서울시, 택시 요금 동결...버스ㆍ지하철은?▶ 서울 버스·지하철 올해 적자 1조 훌쩍…요금 인상되나▶ [오늘도 상한가]1천만원 계좌가 3억 된 사연은?▶ 차안에서 하루에 담배 3갑 피운 자동차 결국~- 헤럴드 생생뉴스 Copyrights ⓒ 헤럴드경제 & heraldbiz.com, 무단 전재 및 재배포 금지 -"
87,2011-06-27,'호국의 다리' 붕괴후 인명피해 막은 고교생,https://news.naver.com/main/read.nhn?mode=LSD&mid=shm&sid1=102&oid=001&aid=0005132832,연합뉴스,"다리 건너다 목격 휴대전화 신고..복구 수개월 소요(칠곡=연합뉴스) 홍창진 기자 = 지난 25일 새벽 경북 칠곡군 약목면에 위치한 '호국의 다리'(옛 왜관철교) 일부 구간이 무너졌을 때 인명피해가 없었던 것은 한 고교생의 빠른 신고 덕분으로 나타났다.27일 경북 칠곡경찰서에 따르면 25일 오전 4시께 이 다리 2번 교각과 상판이 붕괴하고 10분쯤 지나서 주민 하재의(17.고교2년)군이 ""다리가 무너졌다""며 최초로 112신고를 했다.경찰은 하군의 신고를 받고 약목파출소와 왜관파출소로 출동을 지시, 곧바로 다리 양쪽을 차단하고 주민 통행을 막아 인명피해를 막을 수 있었다.경찰에 따르면 하군은 친구를 만나기 위해 25일 오전 3시께 다리를 건너다가 교량 상판이 휘고 기울기 시작하는 것을 목격하고 놀라서 서둘러 다리를 빠져나왔다.하군은 친구집에 들러 정신을 추스른 뒤 다시 다리를 찾아가 교각과 상판, 다리 상부의 철골구조물(트러스트) 등이 무너져 강물에 잠긴 것을 확인한 뒤 오전 4시11분 휴대전화로 경찰에 신고했다.신고 뒤에도 하군은 바로 돌아가지 않고 경찰이 도착할 때까지 현장을 지키며 다른 주민이 다리를 이용하지 않도록 고함을 지르고 소지하고 있던 손전등으로 수신호를 보냈다.칠곡경찰서 관계자는 ""사고가 이른 새벽에 났고 다리 붕괴로 전기공급이 끊겨 가로등이 나간 상태였다""며 ""추가사고로 이어질 수 있었지만 하군의 신속한 신고 덕분에 인명피해가 전혀 없었다""고 했다.호국의 다리는 1905년 건립돼 1950년 8월 6.25전쟁 때 북한군 남하를 막으려던 미군에 의해 교량 일부가 폭파됐으며 파손구간을 연결해 1993년부터 보행 전용도로로 이용돼 하루 수백명이 이용하고 있다.한편, 호국의 다리가 복구되려면 앞으로 수개월이 소요될 것으로 보인다.칠곡군 건설과 관계자는 ""불어난 강물이 빠지고나면 안전진단 및 현장조사를 실시할 계획""이라면서 ""복구계획을 수립하고, 다리가 등록문화재이기 때문에 문화재청과 협의해야 하는 등 복구까지 적어도 몇달은 걸릴 것으로 전망된다""""고 밝혔다.realism@yna.co.kr<모바일 애플리케이션><포토 매거진><저작권자(c)연합뉴스. 무단전재-재배포금지.>"
88,2011-06-27,"여야, 직권상정 요건강화.필리버스터 합의(1보)",https://news.naver.com/main/read.nhn?mode=LSD&mid=shm&sid1=100&oid=001&aid=0005132941,연합뉴스,"국회선진화, 여야 `6인회의'서 본격 논의    (서울=연합뉴스) 전수영 기자 =  한나라당 이명규(왼쪽), 민주당 노영민 원내수석부대표가 지난 17일 오전 국회 정론관에서 국회폭력 방지와 원활한 의안처리를 위한 국회 선진화 방안 합의사항을 발표하고 있다.    양당은 이날 국회폭력 방지와 원활한 의안처리를 위한 국회 선진화 방안을 논의하는 `6인 회의'를 구성하고 본격적인 논의에 나설 것이라고 밝혔다. 2011.6.17         swimer@yna.co.kr (자료사진)`6인회의' 국회선진화 방안 잠정결론(서울=연합뉴스) 송수경 김범현 기자 = 한나라당과 민주당은 27일 국회의장의 직권상정 요건을 강화하고, 본회의에서의 필리버스터(합법적 의사진행방해) 제도를 도입하는 내용의 국회 선진화 방안에 합의했다.한나라당 이명규, 민주당 노영민 원내수석부대표를 비롯해 김세연ㆍ이두아(한나라당), 박우순ㆍ안규백(민주당) 의원 등 `여야 6인 회의'는 이날 오전 회동해 이같이 잠정 결론을 내렸다고 복수의 참석자가 전했다.또한 `6인 회의'는 상임위에서의 법안ㆍ안건 심사 완료시한을 정하는 `신속처리제'도 도입키로 했다.이와 함께 매년 9월1일부터 시작되는 정기국회 이전에 전년도 결산안과 국정감사를 종료토록 한다는 데도 합의했다.kbeomh@yna.co.kr[관련기사]▶ `국회자정'모임, 의안 자동상정제 최종 합의▶ 여야 `국회자정'모임, 본회의 필리버스터제 합의<모바일 애플리케이션><포토 매거진><저작권자(c)연합뉴스. 무단전재-재배포금지.>"
89,2011-06-27,"한진重, 노사협상 사실상 타결(종합)",https://news.naver.com/main/read.nhn?mode=LSD&mid=shm&sid1=101&oid=001&aid=0005132919,연합뉴스,"한진중공업 노사협상 최종 타결(부산=연합뉴스) = 한진중공업 노사협상이 27일 최종 타결됐다. 이재용 한진중공업 조선부문 대표이사(오른쪽)와 채길용 금속노조 부산양산지부 한진중공업 지회장이 노사협의 이행합의서에 서명한 뒤 손을 들고 기념촬영을 하고 있다. 2011.6.27osh9981@yna.co.kr노조 ""총파업 철회 업무 복귀"" 선언..총파업 190일만에 마침표사측 ""노조 결정 환영""..법원 강제퇴거집행 물리적 충돌 우려(부산=연합뉴스) 오수희 기자 = 대규모 정리해고 문제로 6개월 넘게 총파업과 직장폐쇄 등으로 갈등을 빚어온 한진중공업 노사가 27일 노사협상을 사실상 타결했다.한진중공업 노조는 이날 오전 기자회견을 열어 ""총파업을 철회하고 업무에 복귀하겠다""고 선언했다.노조 관계자는 ""3년간의 투쟁으로 조합원들의 생활이 피폐해졌고 죽음의 공장으로 변해가는 영도조선소를 방치할 수 없어 총파업 철회와 현장복귀를 선언한다""고 말했다.노조 측은 ""공권력 투입을 중단시키고 노조와 노조원들을 상대로 한 민.형사상 고소.고발을 취소하고 조합원 징계와 불이익 처분도 함께 취소해야 한다""고 밝혔다.이에대해 사측은 노조와 노사협의회를 열어 노조의 요구를 전향적으로 검토, 정리해고 문제 합의를 핵심으로 한 노사협상을 타결짓는다는 방침이다.이로써 정리해고를 둘러싼 한진중공업 사태는 노조가 총파업에 돌입한지 190일 만에 마침표를 찍었다.노사는 노조의 총파업 철회와 업무복귀 이외 ▲ 정리해고자 중 원하는 사람은 희망퇴직자로 전환 ▲노사 간 손배소 등 민.형사상 문제는 최소화 ▲ 기타 노조 요구사항은 전향적인 자세로 검토한다는데  합의했다.사측 관계자는 ""영도조선소를 정상화하기 위한 노조의 총파업 철회와 업무 복귀 선언을 적극 환영한다""며 ""이제 회사와 노조는 영도조선소를 정상화하기 위해 최선의 노력을 다할 것""이라고 말했다.대규모정리해고 문제로 6개월 넘게 총파업과 직장폐쇄 등으로 갈등을 빚어온 한진중공업 노사가 27일 노사협상을 사실상 타결했다. 사진은 최근 노사가 조업 재개 준비작업을 놓고 대치하고 있는 모습.노조 측은 총파업이 끝남에 따라 영도조선소 안에 있는 생활관에 머물던 노조원 모두 퇴거할 것이라고 밝혔다.그러나 일부 강성 노조원들이 정리해고 철회가 빠진 협상 결과를 받아들일 수 없다며 퇴거를 거부하거나 퇴거하려는 노조원들을 막고 있는 것으로 알려져 이날 오후로 예정된 법원의 강제퇴거집행 때 물리적 충돌이 우려된다.부산지법은 이날 오후 1시30분께 한진중공업 영도조선소에서 '퇴거 및 출입금지 가처분에 의한 강제퇴거집행'을 단행할 예정이다.이는 '한진중공업 노조원은 부산 영도구 봉래동 영도조선소에서 퇴거하라'는 부산지법의 결정을 어기고 있는 노조원들을 퇴거하기 위한 것이다.부산지법은 만약의 사태에 대비, 김진숙 민주노총 부산지역본부 지도위원이 고공시위를 벌이고 있는 85크레인 주변에 안전조치를 해줄 것과 외부 세력의 영도조선소 진입을 차단하기 위한 경찰력 배치, 수배돼 있는 노조원들을 검거해 달라고 경찰에 요구해 노사협상 타결 후에도 한진중공업 영도조선소의 긴장은 가시지 않고 있다osh9981@yna.co.kr[관련기사]▶ <한진重 노사협상, 극적 타결 배경은>▶ <한진重 '정리해고 갈등'..총파업서 타결까지>▶ <한진重 노사분규 사태 일지>▶ 한진重 노조, 총파업 철회ㆍ업무 복귀(2보)<모바일 애플리케이션><포토 매거진><저작권자(c)연합뉴스. 무단전재-재배포금지.>"
90,2011-06-27,"""너무 많이 와도 탈, 안와도 탈""…카카오톡 스트레스",https://news.naver.com/main/read.nhn?mode=LSD&mid=shm&sid1=105&oid=015&aid=0002489431,한국경제,"끝없이 오는 메시지에 '피곤'...아무도 말 거는 이 없어 '우울'직장인 신모씨(33살. 여)는 얼마 전 사내 팀 회의시간에 옆자리에 앉은 상사의 눈치가 보여 혼났다. 업무상 전화를 받아야 할 일이 많은 신씨는 회의시간에도 휴대폰을 꼭 들고 가는데 테이블 위에 올려두었던 스마트폰에서 계속 ""윙윙""대는 소리가 났기 때문이다. 출근부터 퇴근 때까지 늘 카카오톡을 끼고 사는 그녀의 친구들이 이날도 어김없이 '그룹 채팅방'을 만들어 메시지를 주고받은 것이다. 깜빡하고 '알림끄기' 기능을 설정해 놓지 않았던 신씨는 얼른 몸을 돌려 스마트폰을 아예 꺼버릴 수밖에 없었다.""차장님이 차가운 눈초리로 스마트폰과 저를 번갈아 쳐다보는데 정말 식은땀이 흐르더라고요. '얘들은 일도 안하고 무슨 수다를 이리 떨어대나' 잠깐이었지만 친구들이 원망스러웠답니다""신씨는 요새 일 때문에 30분 정도만 자리를 비우고 돌아와도 친구들이 주고받은 카카오톡 메시지가 최소 20개 이상은 쌓여있다고 한다.바빠서 무시하자니 무슨 얘기가 오고갔나 궁금하기도 하고, 자기만 답변을 안 하자니 소외되는 것 같아서 업무 중간 짬짬이 메시지를 보내고는 있는데 이게 보통 피곤한 일이 아니라고.◆'공짜' 이점에 쉴새없이 '윙윙' 업무 보기도 힘들어무료 모바일 메시지 서비스인 카카오톡 가입자가 1700만 명을 넘어서며 스마트폰에 없어서는 안 될 필수 애플리케이션(앱)으로 자리 잡았지만 한편에선 '카카오톡 스트레스'를 호소하는 사람 또한 늘고 있다.카카오톡은 건 당 돈을 내야하는 문자메시지와 달리 공짜로 사용한다는 점이 가장 큰 매력이지만 바로 이 점 때문에 굳이 보내지 않아도, 받지 않아도 될 메시지가 시도 때도 없이 들어와 스트레스라는 것이다.특히나 신씨와 같은 직장인들의 경우 업무에 방해가 될 정도로 메시지가 쏟아져 설치했던 카카오톡 앱을 삭제해야 하나 고민하는 사람들까지 생기고 있다. 실제 일부 스마트폰 업체도 이같은 이유로 카카오톡 푸쉬 시스템에 대한 지원을 망설였던 것으로 알려졌다.또 다른 직장인 김모씨(30, 남)는 ""예전 PC에서 주고받던 메시지와 달리 카카오톡은 휴대폰으로만 대화를 해야 하잖아요. 일하다 말고 수시로 스마트폰 자판을 두드려대자니 일을 안 하는 것처럼 비춰질 까 걱정이 되고 그렇다고 여자 친구가 보내는 메시지에 답변을 안 하자니 토라질까 두렵고...카카오톡 세계에 괜히 발을 들여놨나 싶어요""김씨는 고민 끝에 컴퓨터를 잘 다루는 친구의 도움을 받아 최근 카카오톡을 PC에서 사용할 수 있는 방법까지 알아냈다.헤어진 전 애인, 이전 직장에서 싫어했던 선배 등이 카카오톡으로 말을 걸어와 난감하다는 고민을 토로하는 사람도 있다.카카오톡은 사용자가 해당 앱을 스마트폰에 설치하면 자신의 전화번호부에 등록돼 있거나 상대방 전화번호부에 등록이 돼 있는 사람을 '친구추천'한다. 양쪽 모두 전화번호에 서로의 번호가 등록돼 있으면 자동으로 친구 등록이 된다.한 쪽 사용자의 번호에만 등록이 돼 있어도 말을 걸어올 수 있기 때문에 가끔 얘기하고 싶지 않은 사람들까지 메시지를 보내오면 무시하기도, 답하기도 애매한 상황이 연출된다.심지어 기혼여성들 사이에서는 카카오톡의 이런 친구추천 기능 때문에 남편 관리(?)가 더욱 힘들어졌다는 볼멘소리도 나온다.기혼여성들이 많이 가입하는 국내 최대의 여성 커뮤니티 '맘스홀릭' '레몬 테라스'등에는 ""남편이 카카오톡을 쓴 뒤로 여러 여자들과 대화를 나눈다""며 ""카카오톡을 삭제시켜버리라고 했지만 몰래몰래 계속하는 것 같아 걱정이다""는 글들이 심심치 않게 올라온다. ""카카오톡을 쓰지 말라"" ""쓰겠다"" 옥신각신하며 부부싸움을 했다는 사연도 상당 수다.<사진출처: 카카오톡 홈페이지>이렇다보니 남편들은 ""내 전화에서는 번호를 지웠지만 상대방이 내 번호를 저장해놓고 말을 거는 것까지 괜한 오해를 산다""며 ""메시지에 답변을 안했는데도 불구하고 뭔가 큰 잘못을 한 것처럼 아내가 야단이니 당황스럽다""고 불평하기도 한다.물론 카카오톡 이전에도 다양한 메신저 서비스들이 이같은 부작용을 낳았지만 대화를 하기 위해 인위적으로 '친구'로 등록을 해야하는 서비스와 달리 카카오톡은 자동으로 '친구' 등록이 돼 오해를 일으킬 소지가 더 높아졌다는 지적이다.카카오톡 관계자는 ""자동 친구 등록' 이나 '친구추천'을 원하지 않을 경우 '차단'설정을 내놓으면 전화번호 등 본인 정보가 뜨지 않는다""고 설명했다.◆""카카오톡은 먹는거야""…텅 빈 메시지 '소외감' 느끼기도일각에서는 정반대의 스트레스를 호소하는 사람들도 있다. 너나 할 것 없이 다 한다는 카카오톡을 다운로드받아 스마트폰에 설치했지만 하루가 지나고 이틀이 지나도 말을 걸어오는 사람이 없다는 것.대학원생 정모씨(28. 남)는 ""들어온 메시지가 없다는 걸 알면서도 괜히 카카오톡에 들어가 이것저것 만지작 거리고 제 프로필 정보도 둘러보고 합니다. 어쩔 땐 그런 제가 한심해 보이기도 해요""라고 푸념했다.정씨는 ""남들은 카카오톡 때문에 일도 제대로 못 한다고 불평하는데 저만 이런 분위기에서 소외된 것 같아서 제 대인관계에 대한 회의까지 들기도 합니다""고 말했다.정씨처럼 카카오톡을 쓰고 싶은데 대화를 나눌 친구가 없는 사람들 중에는 ""카카오톡은 먹는거야 ""카카오톡은 왕따 당하는 거야""라는 웃지못할 농담을 내뱉기도 한다. 그런가하면 ""카카오톡 친구 구해요""라는 요청글을 포털사이트에 올려 적극적으로 친구 찾기에 나서는 사람도 있다.카카오톡을 하려면 스마트폰을 사용해야 하는 것이 필수 조건인데 아직 피처폰(일반폰)을 쓰는 사람들은 주변 친구들이 온통 카카오톡으로만 얘기 해대는 통에 자신만 따돌림을 당하는 것 같은 기분마저 느낀다.전문가들은 ""카카오톡이 새로운 커뮤니케이션 도구로 부상하면서 이에 환호를 보내는 사람들이 있는 반면 자신은 트렌드에 끼지 못하는 것 같아 막연한 불안감을 느끼는 사람도 적지 않다""며 ""그러나 이것이 인간관계의 좋고 나쁨을 평가할 수 있는 척도는 아니다"" 고 강조한다.사회심리학자 최창호 박사는 ""(카카오톡, 페이스북, 트위터 등) 소셜네트워크 시대의 흐름에 따라가지 못한다고 초조해 할 필요는 없다""며 ""카카오톡으로 주고받는 메시지가 많다고, 트위터 팔로워 수가 많다고, 페이스북 친구들이 많다고 무조건 좋은 것은 아니다. 오히려 이런 것들이 생활 속의 강박증을 유발할 수 있다""고 충고했다.지난해 3월 서비스를 시작한 카카오톡은 출시 6개월 만에 100만명을 가입자 100만명을 넘어섰고, 지난 12월 500만명을 돌파했다. 올해 4월 1000만명의 가입자를 확보하고 두 달만인 이달 700만명이 더 늘어나 1700만명에 도달했다. 이런 추세라면 다음 달 가입자 2000만명이 넘을 것이라고 업계는 보고 있다. 아이폰과 안드로이드 스마트폰에서 모두 쓸 수 있고 조만간 블랙베리폰에서도 서비스가 가능해질 전망이다.한경닷컴 권민경 기자kyoung@hankyung.com▶ 휴대폰 보험 관련 이용약관 개선한다▶ ""휴대폰 보험 혜택 받아도 서비스 해지ㆍ이통사 변경 가능""▶ 삼성전자, 국내 기업고객용 웹사이트 공개▶ KT ""올레 캐치하고 선물 캐치하세요""▶ SKT, 대학생 50명 스마트폰 전도사로 키운다"
91,2011-06-27,"한진重 노조 ""전 조합원 업무 복귀""(1보)",https://news.naver.com/main/read.nhn?mode=LSD&mid=shm&sid1=101&oid=001&aid=0005132838,연합뉴스,"노사갈등 한진중공업, 노사협의회 개최(부산=연합뉴스) 오수희 기자 = 갈등을 겪고 있는 한진중공업 노사가 지난 24일 오후 부산 영도구 봉래동 영도조선소 신관에서 만나 노사협의회를 열고 있다.   2011.6.24osh9981@yna.co.kr(부산=연합뉴스) 오수희 기자 = 대규모 정리해고 문제로 6개월 넘게 사측과 갈등을 빚어온 한진중공업 노조가 27일 ""전 조합원은 업무에 복귀하겠다""고 선언했다.osh9981@yna.co.kr[관련기사]▶ 한진重 노사, 정리해고 협상 타결 못해(종합)▶ 한진重 노사, 파업사태 해결 '총력 협상'(종합)▶ <김형오 ""한진重 문제, 분명히 따져야>(종합)▶ 사회원로, 한진重 문제 해결 촉구 시국선언▶ 한진重 주변 외부 단체 천막 철거(종합)<모바일 애플리케이션><포토 매거진><저작권자(c)연합뉴스. 무단전재-재배포금지.>"
92,2011-06-27,"태풍 '메아리' 곧 소멸…""강력한 태풍 더 온다""",https://news.naver.com/main/read.nhn?mode=LSD&mid=shm&sid1=103&oid=055&aid=0000207773,SBS,"<앵커>태풍 메아리가 세력을 잃고 약화되면서 오늘(27일) 안에 소멸되겠지만 오전까지는 중부지방에 비가 더 온다는 예보입니다. 올 여름 내내 한반도로 강력한 태풍이 여러 개 상륙할 것으로 보여 앞으로도 주의가 필요합니다.이상엽 기자의 보도입니다.<기자>제5호 태풍 메아리는 현재 백령도 북서쪽 약 180km 해상을 지나고 있습니다.서해상을 지나는 과정에서 중심기압 990헥토파스칼의 약한 소형태풍으로 세력이 크게 약화됐고, 이동속도도 시속 10km 정도로 느려져 신의주 방면을 향해 북진하고 있습니다.태풍은 앞으로 12시간 안에 온대저기압으로 변질돼 중부지방에 오전까지 20mm 정도의 비를 더 뿌릴 것으로 예상됩니다.태풍 메아리는 우리나라에 영향을 준 6월 태풍 가운데 유일하게 북서진한 것으로 기록됐고, 속도도 최대 시속 80km까지 높아져 일반적인 태풍의 두세 배나 됐습니다.우리나라 동쪽에 남북으로 자리한 거대한 고기압에 가로막혀 태풍이 동진하지 못하고 북쪽으로만 계속 빠르게 이동했기 때문입니다.이같은 기압배치가 이어질 경우 올 여름 동안 한반도를 향하는 태풍의 수가 평년보다 더 늘어날 것으로 보여 큰 위협이 되고 있습니다.특히 앞으로 영향을 줄 태풍들은 더 강력한 위력으로 한반도에 상륙할 가능성도 있어 계속 철저한 대비가 필요합니다.이상엽narciso@sbs.co.kr관/련/정/보◆ '힘빠진' 메아리…전국 대부분 오전에 비 그쳐!◆ 백령도, 비바람 몰아쳐…높은 파도에 '초긴장'◆ 무너지고 뽑히고…초속 30m 강풍에 '속수무책'◆ 급류에 휩쓸려 일가족 '익사'…인명피해 속출☞[SBS기자들의 생생한 취재현장 뒷이야기 '취재파일']☞ SBS뉴스 공식 SNS [SBS8News 트위터] [페이스북] [미투데이] [요즘]저작권자 SBS&SBS콘텐츠허브 무단복제-재배포 금지"
