,날짜,기사 제목,기사 링크,기사 출처,기사 내용
53,2011-06-27,한진重 현장에 공권력 투입…노조원 곳곳서 농성,https://news.naver.com/main/read.nhn?mode=LSD&mid=shm&sid1=102&oid=003&aid=0003933285,뉴시스,"【부산=뉴시스】강재순 기자 = 대규모 정리해고 문제로 6개월 넘게 갈등을 빚었던 한진중공업 사태가 노조측의 파업철회 선언으로 일단락되는듯 했으나 27일 오후 법원이 한진중 현장에 대한 행정 대집행에 돌입, 다시 긴장감이 고조되고 있다.이날 오후 2시20분께 법원행정 대집행을 위해 용역직원 200여 명이 민노총 김진숙 지도위원장이 고공농성 중인 85호 크레인과 노조원들이 농성 중인 생활관에 투입되며 대치하는 상황이 벌어졌다.한시간여 후인 3시30분께 대집행을 본격 전개, 용역직원들이 크레인 아래서 농성 중이던 노조원 일부를 끌어내기 시작했으며, 노조원들은 크게 저항하지 않아 충돌이 벌어지지는 않는 가운데 크레인 난간에서 대치하던 30여 명의 노조원은 계속 저항하고 있는 상태다.한편 한진중 영도조선소를 점거 중인 노조원에 대한 강제퇴거 명령을 위해 공권력이 투입될 것이라는 소식이 알려지자 국회 환경노동위원회 소속 민주당 정동영, 홍영표, 이미경 의원과 민주노동당 홍희덕 의원이 이를 저지하기 위해 부산 현장에 도착했다.이에 앞서 한진중공업 사측은 부산지법에 노조원 290여 명을 상대로 퇴거 및 출입금지 가처분 신청을 냈고, 지난 13일 법원은 이를 받아들여 이날 공권력을 동원 강제집행에 돌입했다.kjs0105@newsis.com[뉴시스 이시간 핫 뉴스]ㆍ 황수정 피소… 뮤비 출연료 먹튀?ㆍ 법제처, 28일 MC몽 입영 가능 여부 심의ㆍ ´술먹었다면 너그러운 사회…´ 주취범죄 갈수록 심각ㆍ 주리아·엄다혜 ´여제자´ 과열경쟁, 관객도 후끈ㆍ 최초! 개인회생 파산면책자 대출!★ 손 안에서 보는 세상, 모바일 뉴시스<저작권자ⓒ '한국언론 뉴스허브' 뉴시스통신사. 무단전재-재배포 금지.>"
54,2011-06-27,[커버스토리 | 최초 공개-트위터 권력순위 01] [최초 공개] 알고리즘 창으로 분석한 트위터 …,https://news.naver.com/main/read.nhn?mode=LSD&mid=shm&sid1=102&oid=037&aid=0000012407,주간동아,"[주간동아]소셜미디어(Social Media) 시대다. 대중과 정치인이 쌍방향으로 소통한다. 트위터를 비롯한 소셜네트워크서비스(SNS)가 선거에 적지 않은 영향을 미치리라는 전망이 나온다.관련 업계는 국내 트위터 사용자가 400만 명을 넘어선 것으로 추산한다. 전문가들은 이용자 수가 앞으로도 빠르게 늘어나리라고 전망한다. 정치권도 총선, 대선에 대비하고자 SNS 대응책을 마련하고 있다.솔직하게 직접 글을 쓰는 의원들그렇다면 트위터 세상에서 영향력을 발휘하는 정치인은 누구일까. 정보기술(IT) 마케팅업체 미디컴(medicom)이 구축한 알고리즘(algorithm)을 활용해 트위터를 사용하는 국회의원, 광역자치단체장, 유력 대선후보 전수를 대상으로 트위터에서의 정치적 영향력을 분석했다. 컴퓨터 활용보도(CAR) 기법으로 소셜미디어상에서 정치인의 영향력이 어느 정도인지 살펴본 것은 이번이 처음이다.트위터에서 가장 영향력 있는 정치인은 민주노동당 이정희 대표로 나타났다. 이어 민주당 천정배 의원과 정동영 의원, 안희정 충남도지사, 국민참여당 유시민 대표, 민주당 박지원 의원이 뒤를 이었다.트위터에서의 영향력은 진보가 보수보다 강한 것으로 나타났다. 영향력 순위 상위 20명 가운데 14명이 야권 인사다. 여권에서는 홍정욱 의원이 근소한 차이로 박근혜 전 대표를 제치고 1위를 차지했다. 3위부터 6위까지는 정두언 의원, 이재오 특임장관, 김문수 경기지사, 정몽준 의원이다.여권 1위인 홍정욱 의원은 전체 순위에서 안희정 충남도지사 다음인 5위, 박근혜 전 대표는 유시민 대표에 앞선 6위다. 정두언 의원은 전체 순위 12위, 이재오 특임장관은 14위, 김문수 경기도지사는 16위, 정몽준 의원은 18위로 나타났다.야권에선 권영길 의원(9위), 강기갑 의원(10위), 원혜영 의원(11위), 최문순 강원도지사(15위), 송영길 인천시장(17위)이 전체 순위 20위 안에 들었다. 민주당 손학규 대표는 야권 10위, 전체 13위다.‘140자 우주’ 발 빠른 피드백분석에 사용한 알고리즘은 리트윗(RT)수, 멘션수, 멘션에 대한 답변수, 트윗수, 팔로어수 등 5개 변수를 포함한다. 5개 변수가 수학적으로 복잡한 짝을 이루면서 확산성, 관심도, 상호도, 활동성, 인지도를 계산해냈고 각각의 결과를 종합해 순위를 매겼다(팁 참조).상위권에 오른 정치인의 공통점은 일부를 제외하면 보좌진이 아닌 자신이 직접 글을 쓴다는 것이다. 이재오 특임장관은 “오죽하면 오타가 많다고 국어선생님 출신 맞느냐는 소리까지 듣겠나? 지하철이나 독도에서의 단상을 비롯해 일상 얘기, 가족 얘기도 한다. 개헌을 비롯해 현안 관련 의견을 표명하고 견해를 들으면서 생각도 정리한다. 글을 올릴 때 보좌진과 상의를 거의 안 한다. 글이 논란을 일으키면 오히려 보좌진이 진땀을 뺀다”고 말했다.정몽준 의원은 “처음 트위터에 입문할 때 다른 사람이 대신 해주면 큰일 난다는 얘기를 들었다. 그래서 직접 글을 올리는데, 처음에는 배우면서 하느라 멘션 하나 올리는 데도 많은 시간이 걸렸다”며 웃었다.이정희 대표는 “1위를 기록한 비결이 있다면 솔직하게 한마디로 쓴다는 점, 현장에서 곧바로 스마트폰으로 쓴다는 점”이라고 말했다. 그는 국회 본회의장이나 상임위원회 모습을 실시간으로 트위터리언에게 알린다. “무조건 짧게 쓰려고 노력한다. 말이 길어지면 RT를 할 때 글이 잘린다”고 덧붙였다.홍정욱 의원은 보좌진에게 글을 올리게 하면 트위터리언이 금방 알아채 외면당한다고 생각한다. 그는 정치뿐 아니라 문화, 예술, 유머 등 다양한 분야의 글을 올린다. 팔로어와 소통도 활발하다.박근혜 의원실 이춘상 보좌관도 “박근혜 전 대표가 모든 트윗을 직접 쓴다. 리트윗, 답글도 틈나는 대로 한다”고 말했다.김문수 경기도지사는 트위터를 하면서 보좌진의 도움을 받기도 한다. 대변인실에 소셜미디어 담당 직원을 5명 뒀다. 트위터, 페이스북을 맡은 공무원이 각각 있다. 그렇다 보니 피드백이 빠르다. “방역 좀 해주세요”라는 경기도민의 트윗이 날아오면 “주소가 어딘데요”라고 답하는 식이다.정동영 의원은 대선주자 가운데 트위터에서 영향력 1위다. 그는 트위터를 사용하는 정치인이 거의 없을 때인 2009년 6월 트위터를 시작했다.“쌍방향 소통에 중점을 둔다. 일방적으로 목소리를 내기보다 멘션에 일일이 답하는 등 쌍방향으로 소통하고자 노력한다. 정치적으로 곤란한 질문을 해도 피하지 않고 거의 대부분 피드백한다. 스마트폰을 들고 다니면서 수시로 트위터를 한다. 간혹 정동영 의원이 정말 맞느냐고 묻는 분도 있다. 트위터리언과 ‘냉면 번개’를 해보려 한다.”천정배 의원은 트위터를 더 열심히 하려고 아이패드를 샀다. 그는 트위터를 ‘140자의 우주’로 여긴다.“트위터는 우주다. 사람들의 거대한 삶이 그곳에 있다. 처음에는 글자 수 맞추는 일이 쉽지 않았지만, 그것도 매력인 것 같다. 맞춤형 매체다. 재미있게 쓰려고도 노력하는데 쉽지 않다.”정두언 의원은 늦깎이로 트위터에 입문했다. 올해 2월부터 글을 쓰고 소통하기 시작했으니 영향력을 빠른 속도로 키운 셈이다.“의외다. 트위터를 늦게 시작했는데…. 하고 싶은 얘기를 가감 없이, 숨김없이 한 덕분 아닐까?”그의 멘션은 선명하다. 그는 “보좌진이 항상 불안해한다”며 이렇게 덧붙였다.“물의를 빚을 만한 내용인지, 아닌지 자기 검열을 한다. 감정을 다스리지 못하거나, 마음에 없는 얘기를 하면 즉각 부정적인 반응이 온다.”그는 선거에서 소셜미디어의 영향력과 관련해 “총선에서 영향력이 커지긴 하겠지만 결정적 요소는 아니다. 하지만 대선에서는 굉장히 큰 영향력을 행사하리라 본다”고 말했다.다른 사람들도 총선, 대선 결과에 트위터가 적지 않은 변수로 작용할 것이라고 내다봤다. 정몽준 의원은 “지난 재·보궐선거 때 트위터가 선거 참여율을 높이는 데 큰 구실을 했는데, 내년 총선과 대선에서는 다양한 방식으로 파급력이 더 커질 것으로 전망한다. 특히 젊은 세대의 투표율이 올라가리라 생각한다”고 말했다.이재오 특임장관은 “소셜미디어가 선거에 미치는 영향이 지대하다고 본다. 정치적 여론을 즉시 다량으로 확산할 수 있다. 정치인도 여론에 민감하게 대응할 수 있다. 정치 여론을 유통하는 차원이 달라지는 것이다”라고 분석했다.내년 트위터에 정치 이슈 가득할 것이정희 대표는 “트위터처럼 변화하는 상황에 즉시 대처하고, 참여를 이끌어내는 수단은 없다”면서 “국민의 폭넓은 참여가 새로운 정치문화를 만들어낼 것이다. 총선, 대선에서 소셜미디어의 영향력은 폭발적일 것”이라고 내다봤다.천정배 의원은 북아프리카, 중동에서의 민주화운동을 예로 들면서 “사람들이 신문이나 TV 뉴스 대신 SNS에서 많은 정보를 얻고, 의견을 교환한다. 따라서 내년 총선과 대선에 큰 영향력을 미칠 것으로 본다”고 말했다.정동영 의원의 분석은 이렇다.“트위터로 정치 성향, 태도가 바뀌기는 쉽지 않을 테지만, 6·2지방선거와 4·27재·보궐선거에서 드러났듯 투표율을 높이는 데는 상당한 영향력을 끼칠 수 있다. 부동층을 투표장으로 끌고 나오고, 그들이 선택하는 데 영향력을 발휘할 수 있다고 생각한다. 결정이 아닌 행동, 실천에 영향을 미치므로 파괴력이 더 크다고 볼 수 있다.”특정 이슈가 트위터에서 리트윗을 통해 거의 모든 트위터리언에게 알려지는 데 걸리는 시간은 8분. 신문과 방송은 물론, 통신(연합뉴스)보다 전파 속도가 빠르다. 4·27재·보궐선거 직전 일주일 동안 유통된 선거 관련 트윗이 20만 건을 넘는다. 내년 대선 직전 트위터 세상이 정치 이슈로 가득하리라는 것은 자명하다.여권, 야권도 소셜미디어에서의 영향력을 확대하고자 노력한다. 현재까지 대응은 민주당이 한나라당보다 발 빠른 것으로 보인다. 민주당은 ‘아프리카 TV’로 유명한 나우콤 문용식 대표를 유비쿼터스위원회 위원장으로 영입했다. 한나라당 책임자는 ‘조선일보’ 기자 출신 진성호 의원.소셜미디어와 정치의 상관관계를 연구해온 서울대 사회학과 장덕진 교수의 설명이다.“소셜미디어의 힘은 갈수록 커질 것이다. 소셜미디어를 사용하는 이는 주로 고학력자로, 평균 이상 직업을 가진 사람이다. 이들이 SNS를 통해 여론을 주도하면 여권보다 야권에 유리하게 작용한다. 이것은 어쩔 수 없는 방향성이다. 투표하지 않는 유권자는 ‘내가 투표한다고 뭐가 달라지겠어’라고 생각한다. 그런데 트윗으로 연대하면 변화 가능성이 눈에 들어온다. 부동층이 투표장으로 향하게 되는 것이다.”송홍근 기자 carrot@donga.com"
55,2011-06-27,"김문수 ""춘향전 비하발언 죄송스럽다""",https://news.naver.com/main/read.nhn?mode=LSD&mid=shm&sid1=100&oid=001&aid=0005134105,연합뉴스,"(수원=연합뉴스) 김인유 기자 = 춘향전 비하 발언으로 물의를 빚은 김문수 경기지사가 ""적절하지 못한 표현을 했다""며 공식적으로 사과했다.김 지사는 27일 오후 도지사 취임 1주년을 맞아 YTN과 가진 인터뷰 도중 ""제가 춘향전에 나오는 변 사또의 포악한 학정에 대해 비판을 하면서 적절하지 못한 표현으로 여러 가지로 심려를 끼쳐 드렸다""며 춘향전 비하발언에 대해 사과했다.그는 이어 ""(춘향전 비하 발언으로) 비판을 받게 된 것에 대해 죄송스럽게 생각하며 앞으로 더욱 조심하도록 하겠다""고 말했다.김 지사는 지난 22일 한국표준협회 초청 최고경영자 조찬회에 참석해 '춘향전이 뭡니까. 변 사또가 춘향이 따먹으려고 하는 거 아닙니까'라고 발언을 해 물의를 빚었다.김 지사의 춘향전 비하 발언 이후 전북 남원시민과 사회.봉사.여성단체 등 100여개 단체가 '김문수 경기지사 춘향전 망언 비상대책위원회'를 구성하고 퇴진운동 등을 벌이기로 하는 등 사회단체와 정치권이 김 지사의 부적절한 발언을 비난해왔다.hedgehog@yna.co.kr<모바일 애플리케이션><포토 매거진><저작권자(c)연합뉴스. 무단전재-재배포금지.>"
56,2011-06-27,`사재기하면 퇴출`..주유소에 선전포고한 이유는,https://news.naver.com/main/read.nhn?mode=LSD&mid=shm&sid1=101&oid=018&aid=0002457884,이데일리,"- 주유소, 4월 조치 때 기름값 단계적 인하 주목- ""가격 환원시 동일한 방식으로 전개될 것"" 압박[이데일리 장순원 기자] 정부가 주유소 기름 사재기에 철퇴를 가하겠다고 경고한 것은 다음 달 `한시 인하조치`가 끝나도 기름값을 단계적으로 올려 충격을 최소화하겠다는 계산이 깔려있다.하지만 일선 주유소를 통제하기가 쉽지 않은데다, 가격 인하 종료시점이 다가올수록 사재기가 극성을 부릴 것으로 예상해 정부의 의도대로 진행될지는 지켜봐야 한다.◇ 주유소 사재기 걸리면 퇴출..강경조치 왜?정부가 걱정하는 것은 공급축소나 사재기 자체보다 기름값이 환원되면 한꺼번에 100원 올릴 수 있다는 기대심리다. 사재기나 공급축소 논란이 환원조치가 이뤄지면 바로 100원을 올려 수익을 극대화할 수 있다는 전제를 깔고 있다는 점에서다.정부로서는 기름값이 한번에 100원 오르는 상황이 부담스러울 수밖에 없다. 리터당 2000원이 넘어 소비자들이 느낄 충격이 만만치 않은데다, 물가에 미치는 영향도 적지않기 때문이다. 당장 정부로 화살이 돌아올 게 뻔하다.현재 정부는 단계적인 가격 인상을 유도하는데 전력을 집중하고 있다. 김정관 차관이 관치 논란에도 정유사가 단계적으로 가격을 올려달라 요청한 배경이기도 하다.문제는 일선 주유소다. 이들 주유소가 가격을 한번에 올리면 통제할 수단이 별로 없다. 이런 상황에서 정부가 주목하고 있는 것이 지난 4월 석유가격 인하조치가 나왔을 때 모습이다. 당시 정유사가 기름값을 리터당 100원 내렸지만, 주유소는 곧바로 기름값을 내리지 않았다. 일선 주유소에서는 인하 조치 전 이미 사들인 석유가격이 높다는 이유로 1~2주 동안 시차를 두고 기름값에 반영했다.지경부는 정유사가 석유 공급을 충분히 해 주고, 정상적인 유통과정이 이뤄진다면 인하조치가 끝나는 다음 달 7일에도 같은 모습이 연출되리라 기대하고 있다. 주유소가 기름가격을 100원 올리기 전에 사놓은 물량을 섞어서 팔면, 단계적으로 가격인상이 이뤄질 것이란 논리다.이는 환원 조치 이후 그나마 통제가 가능한 정유사 직영주유소를 압박할 명분이기도 하다. 거점 직영 주유소 휘발유나 경유 가격이 단계적으로 오른다면 치열한 경쟁구도상 다른 주유소도 가격을 단계적으로 올릴 가능성이 크다.◇ 정부 의도대로 될까?정부가 정유사를 압박해 석유를 정상적으로 공급하는 것은 상대적으로 수월하지만 일선 주유소의 사재기를 입증하거나 가격을 통제하기는 쉽지 않은 문제다.전국 1만2000여개 주유소 중 정유사가 가격을 통제할 수 있는 직영 주유소는 13% 정도다. 나머지는 개인사업자여서 정부나 정유사의 압박에 별다른 영향을 받지 않는다.지난 4월 정유사가 기름값을 100원 내렸지만, 일선 주유소에서 기름을 내리기까지 시차가 있었고 가격도 50원~60원만 내린 것도 통제가 쉽지 않다는 방증이다.월 말이나 다음 달 초로 넘어가면 사재기 현상이 소비자들로까지 확산할 가능성이 크다. 할인 종료 시점이 다가오면서 ""쌀 때 채워두자""는 소비심리를 자극할 공산이 크기 때문이다. 주유소에서 휘발유나 경유 가격을 올리는 방식으로 사실상 판매거부를 할 우려도 있다.도경환 지경부 에너지정책관은 ""정상적인 유통과정이 이루어질 수 있도록 지켜보고, 또 필요할 경우 조치를 취할 것""이라고 강조했다.▶ 이데일리ON, 무료로 이용하는 실시간 현재가 조회 1666-2200▶ 가장 빠른 글로벌 경제뉴스ㆍ금융정보 터미널,이데일리 MARKETPOINT＜ⓒ종합 경제정보 미디어 이데일리 - 무단전재&재배포 금지＞＜안방에서 만나는 가장 빠른 경제뉴스ㆍ돈이 되는 재테크정보 -이데일리TV＞장순원  (crew@)"
57,2011-06-27,"KT 통신비 못내리는 이유 ""외인 주주 때문""",https://news.naver.com/main/read.nhn?mode=LSD&mid=shm&sid1=105&oid=008&aid=0002563062,머니투데이,"[머니투데이 이학렬 기자][지배구조 때문…외국인에게 고배당·민영화에 따른 과도한 출혈경쟁]KT가 통신비를 내리지 못하는 이유가 지배구조 때문이라는 주장이 나왔다.백원우 민주당 의원실과 이정희 민주노동당 의원실 주관으로 27일 국회 의원회관에서 열린 'KT 민영화 폐해와 대안토론회'에서는 KT가 소유구조 때문에 통신비를 내리지 못하고 있다는 주장이 제기됐다.우선 높은 배당금이 통신비 인하를 가로막고 있다는 분석이다. 현재 외국인은 KT 지분 49%를 보유하고 있는데 자사주를 제외하면 사실상 50% 이상을 보유하고 있다.실제로 2000년부터 2010년까지의 배당총액 4조4087억원 중 외국인에게 돌아간 배당금은 절반이 넘는 2조3983억원에 달한다.권영국 변호사는 ""2002년초 정부가 KT의 완전민영화를 앞두고 미국에서 개최한 투자자설명회에서 2005년까지 인건비와 투자비용을 15% 줄여 투자자에게 최대한 높은 이윤을 보장하겠다고 약속했다""며 ""투자비용 축소는 저렴한 가격으로 제대로 된 통신서비스를 받을 수 있는 여건을 잃게 됨을 의미한다""고 말했다.민영화의 폐해는 과도한 출혈 경쟁으로 이어졌다. 2001년부터 2010년까지 10년간 KT가 마케팅에 쓴 돈이 10조231억원에 이른다. 특히 지난해에만 KT와 SK텔레콤이 마케팅에 쓴 비용이 5조8301억원에 달한다.정종남 투기자본감시센터 기획국장은 ""민영화하고 여러 통신사업자에게 사업권을 부여하다 보니 과도한 출혈 경쟁 때문에 마케팅 비용이 폭증하고 있다""며 ""마케팅비용 증가가 높은 통신요금을 인하하지 못하는 이유""라고 지적했다.통신요금을 인하하기 위한 해법으로는 재공공화가 제시됐다. 박주현 시민경제사회연구소장은 ""국민이 필수적으로 사용해야 하는 서비스는 공공화해서 공공서비스로 제공해야 한다""고 주장했다.특히 배당과 마케팅비용을 줄이고 중복투자를 줄이면 반값 통신요금도 가능하다는 주장까지 나왔다.조태욱 KT노동인권센터 집행위원장은 ""기본적인 시설투자비에 대한 회수는 이미 끝났기 때문에 더 이상의 가입비는 필요하지 않고 기본료도 3500원 인하할 수 있다""며 ""KT뿐만 아니라 SK텔레콤까지 공기업화하면 반값 통신비도 가능하다""고 주장했다.(증시파파라치)뉴스로 접할 수 없는 고급 증권정보 서비스[머니투데이 핫뉴스]☞SM7 후속모델의 양산형 실내, 고속도로에서 걸렸네☞'신라면 블랙' 공정위 결정타에 가격 내릴까☞나는 일당 8만원짜리 '바지 사장' 이다☞""내 새끼한테 손대지 마"" 지하철 할머니 폭행 논란☞나가라고 등떠미는 회사, 웃는 직원들- 급등이 임박한 종목 '오늘의 추천주'- 오늘의 증권정보 '상승포착! 특징주!'/실전대회 수상자 추천주- 전문가 강력추천 '상한가 임박! 더 늦기 전에 매수해라!'이학렬기자 tootsie@<저작권자 ⓒ '돈이 보이는 리얼타임 뉴스' 머니투데이, 무단전재 및 재배포 금지>"
58,2011-06-27,“치매 안 걸리려면 매일 원두커피 마셔라”,https://news.naver.com/main/read.nhn?mode=LSD&mid=shm&sid1=103&oid=081&aid=0002204528,서울신문,"[서울신문 나우뉴스]커피 애호가들에게 희소식이 날아왔다. 논란많은 기호식품인 커피가 유독 치매를 예방하는데 도움이 된다는 연구 결과가 나왔기 때문이다.미국 인터넷 매체 허핑턴포스트는 최근 사우스 플로리다 대학 연구팀이 생쥐 실험 결과를 토대로 중년 이후 매일 커피를 내려 마시면 노년에 알츠하이머 병에 걸릴 위험을 현저히 줄일 수 있다는 연구결과를 도출했다고 보도했다. 이같은 연구결과는 이번주 출판될 ‘알츠하이머 병 저널’에 자세히 소개된다.연구를 수행한 춘하이 카오 박사는 “생쥐 실험 결과 카페인을 함유한 커피가 알츠하이머 병을 이겨내도록 하는 혈중 과립구집락자극인자(GCSF) 증가를 가져오는 것으로 나타났다.”고 밝혔다. 특히 사우스 플로리다 대학 연구진은 이 GCSF는 골수 속 줄기세포들을 뇌속으로 유입시켜 알츠하이머 병과 관련있는 베타-아밀로이드 플라그를 제거하는 효과를 갖도록 하는 경향이 있다.”고 설명했다.그러나 연구진은 알츠하이머 병을 막는 GCSF의 증가는 카페인 그 자체만이 아니라 카페인과 커피 속의 규명 안된 다른 신비한 물질의 상호작용의 결과라고 주장했다. 다만 연구진은 원두 커피를 하루 4~5잔 내려 마시는 것은 치매 예방에 유용하지만, 갖가지 부작용 논란을 불러온 인스턴트 커피에 대해서는 같은 효과를 보증할 수 없다면서 여전히 부정적인 시선을 거두지 않았다.한편 커피는 지금까지 부작용이 적잖은 기호식품이라는 논란 속에 전립선암과 간암 등에 이롭다는 연구 결과가 나온 적도 있었다.서울신문 나우뉴스부nownews@seoul.co.kr나우뉴스 공식 SNS 계정: 트위터http://twitter.com/SEOUL_NOWNEWS▶2011 신묘년 토끼해 운세와 토정비결 미리미리 확인하세요▶관심종목에 대한 증권 전문가의 상세한 진단과 분석 서비스▶최신 속보와 뉴스 검색을 서울신문 모바일 웹에서m.seoul.co.kr별난 세상 별난 뉴스(nownews.seoul.co.kr) [신문 구독신청]- Copyrights ⓒ서울신문사. 무단 전재 및 재배포 금지 -"
59,2011-06-27,"대한통운 본 입찰, 포스코·CJ·롯데 모두 참여",https://news.naver.com/main/read.nhn?mode=LSD&mid=shm&sid1=101&oid=008&aid=0002563039,머니투데이,"[머니투데이 박종진 기자]매각주간사 현장. 대한통운 본 입찰, 포스코·CJ·롯데 모두 최종제안서 접수(증시파파라치)뉴스로 접할 수 없는 고급 증권정보 서비스[머니투데이 핫뉴스]☞SM7 후속모델의 양산형 실내, 고속도로에서 걸렸네☞'신라면 블랙' 공정위 결정타에 가격 내릴까☞나는 일당 8만원짜리 '바지 사장' 이다☞""내 새끼한테 손대지 마"" 지하철 할머니 폭행 논란☞나가라고 등떠미는 회사, 웃는 직원들- 급등이 임박한 종목 '오늘의 추천주'- 오늘의 증권정보 '상승포착! 특징주!'/실전대회 수상자 추천주- 전문가 강력추천 '상한가 임박! 더 늦기 전에 매수해라!'박종진기자 free21@<저작권자 ⓒ '돈이 보이는 리얼타임 뉴스' 머니투데이, 무단전재 및 재배포 금지>"
