,날짜,기사 제목,기사 링크,기사 출처,기사 내용
0,2011-06-27,"드라마, 악역이 좋다‥동정·공감하는 악역 '인기'",https://news.naver.com/main/read.nhn?mode=LSD&mid=shm&sid1=103&oid=214&aid=0000182294,MBC,"[뉴스데스크]◀ＡＮＣ▶예전 드라마에서는 한 번 나쁜 사람이면 끝까지 나쁜 사람으로 표현됐는데 요즘에는 그렇게 단순한 설정이 아닙니다.미워할 수 없는 악역, 오히려 동정하고 공감하는 악역배우들이 인기를 끌고 있는데요.김재용 기자가 그 이면을 들여다봤습니다.◀ＶＣＲ▶벼락부자가 된 여성이자신이 길러준 부모를 버리고상대를 병적으로 쫓아다니는'스토킹'까지 합니다.마치 악녀처럼 비쳐집니다.웃고 있는 이 선한 얼굴은가면입니다.뒤에선 상대방을 괴롭히고음해하면서 출세를 위해서라면물불을 가리지 않습니다.둘 다 이렇게반 인륜적이고 부도덕하지만일방적이지만은 않습니다.자라온 환경이나내면 세계가 드러나면서이 악역은 오히려시청자로부터 동정을 받고심지어 공감을 사기도 합니다.과거의 드라마가 주로등장인물 간의 뚜렷한 선과 악의대결 구도로 그려졌다면요즘은 그 경계가 분명히허물어졌습니다.실제 인간이라는 게각자의 성장 과정이나 환경이 달라단순하게 그리기 보다는복합적으로 표현하는 게 훨씬사실적입니다.또 인물을 이렇게 설정하면다양한 복선을 깔 수 있기 때문에뻔한 이야기 구도에서 벗어나더욱 탄탄하고 흥미롭게 이야기를이끌어갈 수 있습니다.◀ＩＮＴ▶ 윤석진 교수/충남대 국문학과""내가 저 입장이어도 어 그럴 수 밖에없을 것 같아 라고 하는 어떤 이런 공감,하지만 도덕적이고 윤리적인 부분으로생각을 한다면 아무리 그래도 저러면안되는데 하는 그런 거예요.""악역의 역할이나표현 방식이 달라지면서이젠 배우나 탤런트가 오히려악역을 선호하기도 합니다.◀ＩＮＴ▶ 남궁민/탤런트""굉장히 미움을 많이 받을 것이라고생각을 했었는데 이전과는 달리현실성이나 이런 부분에 대해서시청자분들이 많이 공감을해 주시는 것 같아서...""악역이 잘 해야그 작품이 빛난다는 말이새삼 실감나게 들립니다.MBC뉴스 김재용입니다.(김재용 기자 kjy2625@imbc.com)[저작권자(c) MBC (www.imnews.com) 무단복제-재배포 금지]"
1,2011-06-27,경포호에 열대성 조류 출현…태풍 타고 온 듯,https://news.naver.com/main/read.nhn?mode=LSD&mid=shm&sid1=103&oid=055&aid=0000207832,SBS,"<8뉴스><앵커>세상에서 가장 빠른 새로 알려져 있죠. 열대 바다새 '군함조'가 강릉 경포호에 나타났습니다. 아마도 태풍 '메아리'를 타고 온 것 같습니다. 보시죠.조재근 기자입니다.<기자>비가 그친 경포 호수 상공으로 검은 색의 커다란 새 한 마리가 날고 있습니다.유유히 상공을 돌다 갑자기 하강해 긴 부리로 먹이를 낚아챕니다.가슴에 '브이'자 모양의 흰 깃털과 제비를 닮은 꼬리, 가늘고 길게 이어지다 끝이 굽은 부리, 열대 해양성 조류인 '군함조' 입니다.다 자라면 1m가 넘고, 시속 400km 이상으로 날 수 있는 '세계에서 가장 빠른 새'로 알려져 있습니다.이틀 전 태풍 메아리가 한반도를 빗겨갈 무렵부터 이 열대 바다새가 경포호수에 나타난 겁니다.전문가들은 일단 태풍의 영향으로 동남아에서 한국까지 날아온 것으로 추정합니다.[김진한/국립생물자원관 연구관: 새끼 새 일 경우에는 태풍을 거슬러서 나는 비행능력도 좀 떨어지고, 태양 각도를 통해서 위치를 파악하거나 밤에 별자리를 볼 수 있는 그런 상황이 아니기 때문에….]군함조는 과거에도 몇 차례 발견된 적이 있는데 대부분 어린 새끼로 태풍이 지나간 뒤 발견되곤 했습니다.하지만 지구온난화로 열대어류가 속속 북상하고 있는 상황에서 열대 바다새의 출현은 색다른 관심을 모으고 있습니다.(영상취재: 허춘)조재근jkcho@sbs.co.kr관/련/정/보◆ [강원] 긴꼬리 투구새우 '대량 서식' 확인◆ 러시아에서 온 '백두산 호랑이' 공개◆ ""자연방사 기다려요""…따오기 복원 사업 진행◆ 작지만 화려한 자태…'노랑어리 연꽃'의 유혹☞[SBS기자들의 생생한 취재현장 뒷이야기 '취재파일']☞ SBS뉴스 공식 SNS [SBS8News 트위터] [페이스북] [미투데이] [요즘]저작권자 SBS&SBS콘텐츠허브 무단복제-재배포 금지"
2,2011-06-27,지하철서 노인 또 봉변…20대 남자 폭언 퍼부어,https://news.naver.com/main/read.nhn?mode=LSD&mid=shm&sid1=102&oid=055&aid=0000207840,SBS,"<8뉴스><앵커>윤리의 붕괴는 교실만의 문제가 아닙니다. 길 가다가 교복 입고 담배 피우는 아이들 봐도 모른체 지나치는 게 안전하다는 얘기까지 있죠. 이번에는 백발 어르신이 손자뻘 되는 청년에게 봉변 당한 얘기입니다.김아영 기자입니다.<기자>조용하던 지하철 안에서 갑자기 고성이 오갑니다.할아버지에게 폭언을 퍼붓는 20대 남자를 주변 사람들이 말려 보지만 소용이 없습니다.[승객: 너 지금 뭐하는 거야. 노인네한테!][청년: 놔둬! 잡지 마. 잡지 말라고, 잡지 말라고!]승객들이 남자를 전동차 안 반대쪽으로 데려가려 하지만, 다시 돌아와 폭언을 퍼붓습니다.[청년: 내가 뭘 잘못했어? 잘못했냐고! 왜 쳐. 내 다릴 왜 쳐?][노인: 누가 쳤어?][청년: 쳤잖아? 안쳤어? 웃긴 XX네. 경찰서 가?]다리를 꼬고 앉은 청년에게 백발의 할아버지가 다리를 풀라고 지적했다가 봉변을 당하고 있는 겁니다.[노인: 발 포개서는 안 된다고 그러잖아. 방송에서.][청년: 다리를 꼬지 말래? 방송에서?]남자의 폭언은 더 심해집니다.[청년: 서울역에서 안 내리면 죽여버린다. 끌고 간다. 알았냐? 어? 사람 잘못 건드렸어.][김남희/대학생: 어르신한테 심한 욕을 주위사람들이 말리는데도 하는 거는 못봤어요.]지난 금요일에는 지하철 전동차에서 유모차에 탄 아이를 귀엽다고 만진 한 할머니가 아이 엄마에게 폭행을 당하기도 했습니다.전문가들은 갈수록 개인화하는 사회 속에서 자신의 영역을 침해받지 않고 싶어하는 젊은층의 요구가 비뚤어지게 표출된 것이라고 지적합니다.[전상진/서강대학교 사회학과 교수: 공동체에 대한 인식이 저하되고 노인 공경과도 같은 전통사회의 핵심적인 규범들이 힘을 잃는 모습들을 보이고 있습니다.]각박해진 세태 속에서 노인들에 대한 존경과 배려까지 사라지는 것은 아닌지 씁쓸해하는 시민들이 많았습니다.(영상취재: 설민환, 영상편집: 채철호)김아영nina@sbs.co.kr관/련/정/보◆ '아기 만졌다고…' 지하철서 할머니 폭행 '충격'◆ ""형님, 반갑습니다"" 악수하는 척하며 반지 '슬쩍'◆ 서울 지하철역에 '범죄 안전지대' 설치☞[SBS기자들의 생생한 취재현장 뒷이야기 '취재파일']☞ SBS뉴스 공식 SNS [SBS8News 트위터] [페이스북] [미투데이] [요즘]저작권자 SBS&SBS콘텐츠허브 무단복제-재배포 금지"
3,2011-06-27,30일 `베이징~상하이` 고속철 1318㎞ 개통,https://news.naver.com/main/read.nhn?mode=LSD&mid=shm&sid1=104&oid=009&aid=0002492757,매일경제,"장종회 베이징 특파원이 27일 중국 베이징 남역을 출발해 상하이 홍차오역에 도착한 고속철 허셰호 앞에서 기념촬영을 하고 있다.27일 오전 8시 30분(현지시간) 베이징 남역 4번 플랫폼. 육중하면서도 매끄럽게 빠진 '징후고속열차' 허셰(和諧)호가 모습을 드러냈다. 현행 세계 최장 고속철도인 베이징~상하이 1318㎞를 달리는 열차다.중국 당국은 오는 30일 정식 개통을 앞두고 이날 내외신 기자들에게 시승용으로 이 열차를 공개했다. 1600여 년 전 베이징과 중국 동남부 항저우를 연결한 징항(京杭) 대운하를 뚫어 남북을 묶었던 중국이 이젠 고속철도로 베이징~상하이를 이어 다시 한 번 대륙의 정치ㆍ경제 통합을 모색하겠다는 의지를 드러냈다.징후고속열차는 당초 예정보다 20여 분 늦은 오전 8시 56분께 베이징 남역을 떠났다. 열차는 출발한 지 5분 만에 시속 180㎞를 넘어섰고 11분 만에 306㎞에 도달했다. 이곳저곳에서 '와'하는 탄성이 들렸다. 베이징 남역 부근 마천루가 보이는가 싶더니 열차는 어느새 허베이성 농촌을 지나쳤다. 달린 지 30분도 채 안 돼 중국 3대 경제권인 보하이만 개발구 중심도시 톈진을 지났다.열차는 시속 303~306㎞를 오가며 질주했다. 차창 너머 풍경은 시공을 초월한 파노라마를 보는 듯했다. 객차 흔들림은 그리 크지 않았다. 종이컵에 담긴 음료가 약간 요동칠 정도. 실내소음은 65데시벨가량으로 옆좌석 승객과 담소를 하는 데 지장이 없다. 열차 승무원은 ""최고 시속이 350㎞지만 안전을 위해 300㎞ 안팎에서 운행한다""고 말했다.중국 철도부는 속도ㆍ전압ㆍ온도ㆍ압력 등이 센서를 통해 실시간으로 파악돼 차체 결함까지 자동으로 감지하도록 설계돼 있다고 설명했다. 고속열차 운전석에도 안전설비가 다양하다. 운전실 앞유리는 새가 부딪히거나 돌멩이가 날아와도 깨지지 않도록 설계됐다.객차는 일등석ㆍ이등석ㆍ식당칸ㆍ비즈니스칸ㆍ관광객 VIP실로 구분돼 있다. 운전석 바로 뒤편에 있는 관광용 VIP실 좌석에 앉아봤다. 항공기 일등석과 마찬가지로 등받이가 180도 뒤로 젖혀진다. 비즈니스칸에도 360도 회전되는 소파형 가죽좌석에 영화 등을 보는 개인용 엔터테인먼트 설비가 갖춰져 있다. 열차 내 전역이 금연이다.각 좌석엔 전기콘센트가 한 개씩 달려 있다. 시속 300㎞로 달릴 때도 3세대(3G) 무선랜카드로 인터넷에 접속할 수 있다. 와이파이망도 잡히긴 하지만 아직 제대로 작동하진 않는다. 열차 속도가 빨라 휴대폰 신호도 잡혔다 사라졌다 한다.정상운행하는 징후고속철은 지난 서역, 쿤산 남역 등 6곳을 경유하지만 시승용 열차는 곧바로 난징 남역까지 달렸다. 상하이 훙차오역에 도착한 시간은 오후 1시 40분. 4시간44분 만에 1318㎞를 주파한 것. 40여분 정도 역에 머물다가 베이징으로 돌아온 시간은 저녁 7시44분께. 열차를 탄 시간은 10시간이 채 안 되는 셈이다.종전엔 열차로 베이징에서 상하이로 가자면 빨라도 10시간 이상이 걸렸다. 하지만 이젠 새벽에 고속열차에 올라 상하이에서 일을 보고 밤엔 베이징으로 돌아올 수 있어 두 도시가 일일생활권으로 묶였다. 천후이난 홍콩 현대중국연구소 박사는 ""수나라 때 베이징~항저우를 연결한 대운하가 건설돼 대륙 통치가 가능했다""며 ""징후고속철 개통으로 중국 권력ㆍ경제 중심지를 하루에 오갈 수 있게 돼 베이징~상하이 간 경계가 무너지게 됐다""고 진단했다.2008년 4월 착공한 징후고속철은 2012년 중순께 완공될 예정이었지만 오는 7월 1일 공산당 창당 90주년에 맞춰 공기를 앞당겼다. 이 고속철은 중국 공산당으로선 역사적 의미가 크다. 현재 수도인 베이징과 90년 전 1921년 마오쩌둥 전 주석이 동지들과 첫 공산당 회의를 열었던 상하이를 철길로 직접 연결하는 것이어서다.징후고속철은 톈진을 포함한 보하이만경제권과 상하이를 중심으로 한 창장경제권을 잇는다. 이 고속철이 지나는 3개 특별시와 7개 성ㆍ시는 중국 국토의 6.5%에 불과하다. 하지만 인구 측면에서는 25.5%를 차지하고 국내총생산(GDP)도 43.3%에 달한다.이젠 가히 베이징과 상하이를 잇는 중국의 경제산맥이 솟아오르게 된 것. 리쥔 철도부 운송국 주임은 ""징후고속철 개통으로 화물운송이 5000만ｔ 늘어날 것""이라며 연인원 8000만명, 화물 1억3000만ｔ을 이동시키는 경제 대동맥이 구축됐다""고 말했다.징후고속철 주변 집값은 이미 들썩이고 있다. 산둥성 지난시만 해도 2년 전 ㎡당 4000위안(66만원)이던 게 이젠 7000위안을 육박한다.징후고속철로 인해 항공업계는 초비상이다. 베이징~상하이 구간 표값은 300㎞짜리 열차가 550~1750위안이고, 가장 싼 시속 250㎞ 열차 2등석 가격은 410위안으로 1200위안 안팎인 항공편의 3분의 1에 불과하다. 고속철은 가격도 싸지만 연착ㆍ결항이 잦은 항공편보다 안전하고 대기시간도 짧아 편리하다. 핑안증권 분석으론 징후고속철 정식 개통 이후 베이징~상하이 구간 항공수요는 21%가량 잠식될 전망이다. 톈진공항에선 30분 걸리던 수속시간을 5분 안에 끝내는 운동도 벌이고 있지만 역부족이다. 중국 항공업계는 30%에 채 못 미치는 국제선 비중을 40%로 늘려 위기를 돌파한다는 계획이다.[베이징ㆍ상하이 = 장종회 특파원]▶[화보] 브라질 게이 퍼레이드 낯 뜨거운 애정표현▶""韓, 6년만에 첫 금융파업 직면""▶학비 없어 대학 자퇴한 20대女, '돌상' 차려 월 1000만원▶북한용 뽀로로(?)…내용 들여다 보니▶국과수, 대성 사건  ""이미 사망했을수도""▶황수정 피소, 뮤비 출연 무단 펑크후 계약금 '먹튀?'▶[아츠포토] 패셔니스타 장근석 '빛나는 공항패션~'[ⓒ 매일경제 & mk.co.kr, 무단전재 및 재배포 금지]MBA도 모바일로 공부한다."
4,2011-06-27,태풍에도 뒤집히지 않는 우산? ‘이색우산’ 모음,https://news.naver.com/main/read.nhn?mode=LSD&mid=shm&sid1=101&oid=014&aid=0002464156,파이낸셜뉴스,"비가 많이 오는 여름이면 반드시 챙기게 되는 우산. 하지만 가지고 다니다 보면 태풍에 뒤집히기도 하고 옆에 가는 사람에 찔릴까 조심스럽기도 해 아쉬운 점이 많다. 이 모든 에로사항을 해결한 반짝이는 아이디어를 담은 이색 우산 몇 가지를 살펴봤다.■ 다른 사람이 우산살에 찔리지 않도록 배려한 ‘매너 우산’사람들이 많은 길에서 우산을 쓰고 다니다 보면 흔히 옆 사람을 건드릴까 조심스럽다. 이런 걱정을 덜어주는 ‘매너 우산’도 있다. 혼잡한 곳을 지나갈 때 우산 손잡이 끝을 살짝 당겨주면 우산살 가장자리 부분이 안쪽으로 접혀 옆 사람을 찌르지 않도록 배려한 아이디어가 돋보인다.또 다른 매너우산도 우산살이 뾰족한 여느 우산과는 달리 우산 모양이 동그랗기 때문에 다른 사람을 다치게 할 염려가 없다.■ 비에 절대 맞지 않는 ‘안전 우산’바람이 조금만 세게 불면 “우산이 필요 없다”는 말이 절로 나올 정도로 발이며 바지 등에 비를 쫄딱 맞게 된다. 비에 절대 맞지 않도록 보호해 주는 우산도 있다.무릎에 이를 정도로 크고 폭이 긴 이 우산은 얼핏 눈으로 봐도 비를 맞을 염려가 없어 보인다. 삼각형의 우산 단면들이 모여 전후좌우 할 것 없이 막혀 있어 비에 맞지 않도록 보호해 준다.■ 태풍에도 뒤집히지 않는 강력 우산바람이 조금만 세게 불면 우산이 금세 뒤집혀 불편함을 겪었던 사람들을 위해 만든 우산도 있다. 네덜란드 회사인 센즈(SENZ)에서 개발한 ‘태풍에도 뒤집히지 않는 우산’이 바로 그것. 이 우산은 시속 70마일(약 113km)의 바람까지 견디며 절대 뒤집히는 일이 없는 구조로 돼 있다.■ 디자인이 돋보이는 예쁜 우산들실용성보다는 디자인이 돋보이는 예쁜 우산들도 있다. 공기를 집어 넣으면 구름 모양으로 펴져서 마치 구름을 쓰고 다니는 것 같은 ‘구름 우산’, 우산을 접으면 장미 모양이 됐다가 펴면 아름다운 무늬가 생기는 ‘장미 우산’ 등이다./onnews@fnnews.com 온라인뉴스팀※ 저작권자 ⓒ파이낸셜뉴스. 무단 전재-재배포 금지[☞ First-Class경제신문 파이낸셜뉴스 구독신청하기]■ 오늘의 핫뉴스▶ 李대통령“‘화장실 삼남매’보고 충격받아”▶ “오징어 보호 차량” 사진 누리꾼 ‘폭소’▶ “나 여기 있어요” 태아 발길질 사진‘화제’▶ 기본 6개월 대기…“돈 있어도 못 사겠네”▶ ‘묻지마 정책’ 국민은 피곤하다※ 저작권자 ⓒ파이낸셜뉴스. 무단 전재-재배포 금지"
5,2011-06-27,3회전 묘기·휴전선 순시 등 '별난 태풍' 백태,https://news.naver.com/main/read.nhn?mode=LSD&mid=shm&sid1=103&oid=079&aid=0002263358,노컷뉴스,"기상청, 특이한 진로 보인 과거 태풍 사례 소개[CBS사회부 이희진 기자]1986년 8월 발생한 태풍 '웨인'은 이동하는 동안 필리핀 부근에서 세 번이나 빙빙 돌아 태풍 이동 경로 파악에 촉각을 곤두세운 예보관들의 혼을 쏙 빼놓았다.기상청이 27일 예측불허의 이동 경로를 보이며 예보관들의 애를 태웠거나, 특이하고 흥미로운 진로를 기록한 '별난 태풍' 사례를 소개했다.1994년 8월 '엘리'는 만주를 지나 북극해까지 올라가 북위 70도 부근에서 소멸하면서 가장 높은 위도까지 북상한 태풍으로 기록됐다.엘리는 저위도의 엄청난 열과 수증기를 고위도에 전달함으로써 지구 에너지 평형을 맞추는 태풍 본연의 임무를 충실히 수행한 셈이다.일반적으로 한반도에 상륙하는 태풍은 서해안 및 남해안으로 올라온 후 동해안으로 빠져나간다.하지만 1972년 7월 '테스'는 일본을 지나 동해안(북한 원산 부근)으로 상륙했다.테스는 동해안으로 한반도에 상륙한 유일한 태풍이다.1998년 9월 '예니'는 무서운 기세로 한반도를 향해 북상하다 전남 여수 부근에 상륙해 전국을 긴장시켰지만, 더는 올라오지 않고 다시 남해상으로 되돌아갔다.1990년 6월 '오펠리아'는 중국 동부 해안을 따라 북상하다 서해안을 가로질러 경기만에 들어왔지만 '인천 상륙' 직전 세력이 약해지면서 끝내 상륙에 실패했다.2002년 6월 말에 발생한 '라마순'은 서해를 따라 북상하다 '금강(충남 금강)을 거쳐 금강(강원도 금강산)으로' 빠져나가는 특이한 진로를 밟았다.1990년 8월 '아베'는 순시하듯 휴전선을 따라 이동하며 남북 분단의 현장을 더욱 긴장시켰다.200년 7월 '카이탁'과 1985년 8월 '리', 1982년 8월 '세실'은 태풍으로서의 일생을 바다가 아닌 강(각각 두만강 하류, 헤이룽 강, 압록강 중류)에서 마감했다.기상청은 ""태풍은 피해만 주는 것으로 생각하기 쉽지만, 긍정적인 역할도 한다""고 강조했다.'적조현상을 해소하고 수자원을 공급하며, 저위도 에너지를 고위도로 이동시켜 지구 에너지 균형을 이루게 하는 등 순기능도 크다'는 것이다.heejjy@cbs.co.kr(대한민국 중심언론 CBS  뉴스FM98.1 / 음악FM93.9 / TV CH 412)<저작권자 ⓒ CBS 노컷뉴스(www.nocutnews.co.kr) 무단전재 및 재배포 금지 >"
6,2011-06-27,"37년産 벤츠 로드스터, 경매가 100억원 돌파?",https://news.naver.com/main/read.nhn?mode=LSD&mid=shm&sid1=103&oid=020&aid=0002255768,동아일보,"메르세데스 벤츠 540K 로드스터가 벤츠 경매 역사상 가장 비싼 값에 팔릴 것으로 기대되고 있다.미국 자동차 전문매체 지티스피릿은 1937년형 벤츠 540K 로드스터가 8월 캘리포니아 몬테레이에서 열리는 페블 비치 콩쿠르 디엘레강스(Pebble Beach Concours d’Elegance) 행사에서 경매로 나올 예정이라고 전했다.벤츠 540K 로드스터는 1936~1939년까지 총 406대가 생산됐으며, 현재는 단 세대만 남아있다. 이번 경매에 나온 차량은 그 중 한 대.긴 후드와 높은 벨트라인, 낮은 유리, 와이어 휠, 크롬 장식 등으로 전형적인 1930년대 클래식 로드스터 스타일을 자랑한다.직렬 8기통 엔진에 기어로 연결된 슈퍼차저를 통해 30년대 당시로서는 상당히 높은 수준인 180마력의 최고출력을 실현했다. 배기량은 5.4리터, 제로백(0→100km/h 도달시간)은 16.4초, 최고속도는 168km/h이다.한편 2007년 10월 포뮬러원의 대부인 버니 에클레스톤이 경매에서 같은 모델의 차량을 825만 달러(약 89억)에 낙찰 받은 바 있다. 현지에서는 이번 경매의 낙찰가를 100억 원대로 예상하고 있다.김진하 동아닷컴 인턴기자 jhjinha@naver.com[화제의 뉴스]- 나진항 관광뒤 北 어린이 외화벌이 공연 코스로- 무늬만 한식? 밥상에 ‘26개국’이 올랐다- 日외상 “A380 독도비행은 영공 침범” 항의- “굿바이, 내 생애 최고의 캐릭터 콜롬보”- “소비자 우롱 농심 신라면블랙 중징계를”- “네게 지식 주는데…뭘 줄래?” 후배 성폭행- [포토]사자 vs 인간, 목숨 건 한판승부- [화보] 세계 곳곳에서 열린 화련한 게이 퍼레이드"
