,날짜,기사 제목,기사 링크,기사 출처,기사 내용
22,2011-06-27,한강공원 야외수영장 내달 1일 개장,https://news.naver.com/main/read.nhn?mode=LSD&mid=shm&sid1=102&oid=018&aid=0002457347,이데일리,"[이데일리 이진철 기자] 한강공원 야외수영장과 물놀이장이 내달 1일부터 개장한다.서울시는 뚝섬·여의도·광나루·망원한강공원 야외수영장, 난지한강공원 강변물놀이장을 오는 7월1일 개장한다고 26일 밝혔다. 잠원·잠실한강공원 야외수영장은 7월 중순 개장할 예정이다.광나루·뚝섬·잠실·잠원·여의도·망원 한강공원 6개 야외수영장과 난지 물놀이장은 지난 3월부터 시설보완을 통해 수질정화를 위한 여과기 일체를 재정비했고, 노후된 수조도 보수했다.각 수영장별로 바닥, 배수로, 샤워기, 탈의실, 그늘막, 음수대, 화장실, 이용안내문 등 수영장 시설 전반에 대한 점검으로 수영장 이용에 따른 불편이 없도록 준비를 마쳤다. 또 가족단위로 음식을 준비해 즐길 수 있는 넉넉한 공간까지 갖춰 외식에 대한 비용부담 없이 나들이를 즐길수 있도록 했다.특히 뚝섬과 여의도 수영장은 유수풀, 아쿠아링, 스파이럴터널 등 대형 워터파크 못지않은 시설을 갖추고 있다.뚝섬수영장에는 물이 계속적으로 흐르는 유수풀과 그 위로 목교가 설치돼 있어 자녀들이 물위로 떠내려가며 노는 모습을 부모들이 목교위에서 함께 볼 수 있다. 뚝섬한강공원에는 수영장 내 선베드와는 별도로 전용 선탠장이 뚝섬한강공원 음악분수 옆 부지에 조성되며 100여개의 선베드와 함께 탈의실, 샤워장, 매점이 마련된다.옛날 강변의 정취와 추억을 느낄 수 있도록 설치된 난지한강공원 물놀이장은 물놀이 외에도 모래사장 주변에 목재데크가 있어 바닷가에 있는 것과 같은 휴식을 취할 수 있다.한강공원 6개 야외수영장 이용요금은 모두 동일하며, 어린이 3000원, 청소년 4000원, 어른 5000원에 하루종일 이용할 수 있다. 6세 미만은 무료다. 야외수영장 선베드 사용료는 1일 5000원이다. 이용시간은 오전 9시부터 오후 8시까지이며, 8월28일까지 휴일 없이 운영된다. 난지한강공원 물놀이장의 이용요금은 어른 3000원, 청소년 2000원, 어린이 1000원이며, 6세 미만은 수영장과 마찬가지로 무료다.▶ 이데일리ON, 무료로 이용하는 실시간 현재가 조회 1666-2200▶ 가장 빠른 글로벌 경제뉴스ㆍ금융정보 터미널,이데일리 MARKETPOINT＜ⓒ종합 경제정보 미디어 이데일리 - 무단전재&재배포 금지＞＜안방에서 만나는 가장 빠른 경제뉴스ㆍ돈이 되는 재테크정보 -이데일리TV＞이진철  (cheol@)"
23,2011-06-27,"매니큐어 속 손톱, 질병 정보 숨어있다… 색깔따라 모양따라 건강 신호등",https://news.naver.com/main/read.nhn?mode=LSD&mid=shm&sid1=103&oid=005&aid=0000466159,국민일보,"샌들의 계절, 여름을 맞아 ‘네일 숍’에서 손톱과 발톱 손질을 받는 여성들이 늘고 있다. 손발톱 가꾸기가 패션의 아이템이 되면서 의상 색깔에 맞춰 매니큐어를 바르고, 심지어 인조손톱을 붙이기까지 한다.하지만 일년 내내 손톱과 발톱을 매니큐어로 덧칠하는 것은 손발톱에 나타나는 이상 징후를 감추는 행위가 될 수 있다는 게 피부과 전문의들의 지적이다. 케라틴이라는 단백질로 구성돼 있는 손발톱은 사실 우리 몸 건강의 바로미터라고 할 수 있기 때문이다.가톨릭대 의대 여의도성모병원 피부과 조백기 교수는 “특히 손톱은 모양과 색깔의 변화를 통해 몸속에 병이 생겼음을 알리는 신호등 역할을 하는 경우가 많다”며 매니큐어 및 페디큐어 마니아들에게 주의를 당부했다.◇손발톱 색깔로 몸의 이상 짐작 가능=건강한 손발톱은 보통 0.5㎜ 두께로 단단하고 투명하면서도 분홍빛이 돈다. 보통 손발톱을 누르면 하얗게 변했다가 3초 이내에 원래의 분홍빛으로 돌아오게 마련. 따라서 이보다 오래 걸리는 사람들은 빈혈이나 호르몬 대사 이상, 생리통, 생리불순 등을 의심해야 한다.특히, 철 결핍성 빈혈의 경우에는 손톱이 창백한 색을 띠고 손발톱 끝이 얇아지면서 숟가락처럼 가운데가 움푹 들어간 모양이 되기도 한다. 이런 모양을 ‘숟가락 손발톱’이라고 하는데 갑상선질환, 관상동맥질환, 매독, 간 질환이 있을 때 이 같은 변화가 흔히 일어난다.만약 손발톱이 분홍빛을 띠지 않고 창백한 상태라면 영양결핍이나 결핵을 의심할 수 있다. 손발톱에 하얀 점이 생기면 외상이나 곰팡이 감염, 결핵, 간경화, 신장염 등에 의한 것은 아닌지 검사를 해봐야 한다.◇모양 변화로도 건강 적신호 포착=건강한 손발톱은 표면이 매끄럽고 윤기가 돌아야 정상이다. 그런데 손발톱에 세로 줄 모양의 고랑이 생기면 ‘원위 손발톱주름’(손톱이 자라나오는 경계선 피부)에 종양이 생겼기 때문일 수 있고, 이와 반대로 가로로 골이 패이면 폐렴과 홍역 등 발열성 질환에 의한 후유증일 수 있다.또 손발톱이 두꺼워지거나 끝 부위가 잘 부스러지면 무좀을 일으키는 곰팡이 균에 감염돼 있다는 신호다. 영양 부족이나 신경 계통에 이상이 있으면 손톱 끝이 얇고 하얀 달걀껍질처럼 변하기도 한다. 중심부가 함몰되는 양상의 오목형성 손발톱은 건선을 앓을 때 나타나는 한 증상이다.외상 등 특별한 외부 요인도 없는데, 손가락 끝이 점점 딱딱해지고 동그랗게 변형되면 만성 장염이나 폐기관지에 염증성 질환이 생겼다는 경고일 수 있다. 특히 장기간 흡연을 해온 사람이라면 폐, 기관지 등 호흡기 계통에 문제가 생긴 것은 아닌지 반드시 확인해 볼 필요가 있다.손가락 끝이 둥글게 곤봉 모양으로 부풀어 오르는 경우도 있다. 속칭 곤봉지 또는 곤봉형 손톱이다. 이 때는 심장병 등의 순환기 병이나 늑막염, 축농증 같은 만성 호흡기병이 우려된다.신사테마피부과 임이석 원장은 “손톱이 곤봉 모양이 될 때까지는 상당한 시간이 걸리기 때문에 이미 곤봉지 현상이 눈에 띄게 나타났다면 병이 꽤 진행된 상황이라고 볼 수 있다”고 말했다.◇건강하고 아름다운 손톱 가꾸기=평소 건강하고 윤기 있는 손발톱을 갖고 싶다면 무엇보다 균형 있는 식생활과 적절한 운동 습관을 통해 신체건강부터 관리하고 손발톱을 관리하는 것이 순서다.손발톱은 가급적 짧게 깎는 것이 좋다. 길게 손발톱을 기르고 매니큐어를 칠할 경우 보기엔 좋을지 몰라도 손발톱 밑에 각종 세균이 번성할 우려가 높다. 폐렴균, 혈액 감염을 일으키는 호모균, 황색포도상구균 등이 손발톱 밑에서 잘 자라는 균들이다.손발톱을 깎을 때는 손발톱 끝 하얀 부분이 1∼2㎜ 정도 남게 깎는 것이 좋다. 아울러 살 속으로 파고들지 않도록 끝 부위를 일자로 깎고, 깎는 동안 손발톱의 모양과 색을 살피는 습관을 가져야 한다. 조 교수는 “화학약품을 다루거나 먼지, 흙 등을 만질 때도 반드시 보호 장갑을 착용하는 것이 손톱 건강에 좋다”고 조언했다.이기수 의학전문기자 kslee@kmib.co.kr<GoodNews paper ⓒ국민일보. 무단전재 및 재배포금지>"
24,2011-06-27,'모기약' 알고 쓰세요!…오히려 건강 해칠 수도,https://news.naver.com/main/read.nhn?mode=LSD&mid=shm&sid1=103&oid=055&aid=0000207737,SBS,"<8뉴스><앵커>올 여름엔 유난히 모기가 극성일것이란 예상이 나오면서 모기 퇴치 상품들이 불티나게 팔리고 있습니다. 하지만 제대로 뿌리지 않으면, 오히려 건강을 해칠 수도 있습니다.김종원 기자가 올바른 모기약 사용법을 설명해 드립니다.<기자>한 여름밤, 귓가에 모기가 웽웽대면 대부분 이런 식으로 모기약을 뿌립니다.[이대숙/분무형 모기약 소비자 : 잘때 모기가 엥엥거리면 그때 뿌리는 것을 뿌리거나 그렇게 하고 있어요.  환기를 시키지는 못해요, 왜냐하면 새벽같은 때 많이 뿌리니까.]하지만 마구잡이로 모기약을 뿌리면 자칫 건강을 해칠 수 있습니다.시중에 유통되는 일부 제품엔 환경 호르몬인 '퍼메트린'이 들어 있기 때문입니다.얼마나 독성이 강한지 실험해 봤습니다.알콜에 녹인 퍼메트린을 모기 위에 한 방울 떨어뜨리자, 용액에 직접 닿은 모기는 물론 흐르는 용액에 살짝 닿은 모기까지 그 자리에서 죽어버립니다.액체를 증발시키는 훈증기에 퍼메트린 용액을 몇 방울 떨어트리자 불과 3분 만에 모기 50여 마리가 죽었습니다.[김동일/강북삼성병원 산업의학과 교수 : 퍼메트린은 발암성 의심물질로 분류하고 있고, 실험 동물에서 양성 종양을 발생시킨다는 것은 이미 증명이 되었죠.]이미 유럽에선 지난 2007년 퍼메트린 사용이 금지됐지만, 우리나라에선 일부 제품에 여전히 쓰이고 있습니다.[서강석/분무형 모기약 소비자 : 사람한테는 안 뿌리고요, 아무도 없는 공간이나 물건이 별로 없는 곳, 구석진 곳에 많이 뿌리죠.]사람을 피해서 뿌리면 안전할까?살충제에 형광물질을 섞은 뒤 분무기로 뿌려봤습니다.일부로 침대는 뿌려서 뿌린다고 했지만, 불을 끄고 살펴보니 바닥은 물론 침대 위 사람 머리맡까지 살충제가 예외 없이 묻었습니다.뿌리는 모기약을 안전하게 사용하려면 사람이 없는 방에 미리 모기약을 뿌려놓고, 1~20분이 지나 모기가 다 죽은 뒤엔 충분히 환기를 시켜야 합니다.바닥이나 몸에 묻은 모기약도 즉시 닦아내는게 좋습니다.야외 활동을 할 때 쓰는 바르는 모기약 역시 과다 사용하면 부작용을 일으킬 수 있습니다.주 성분인 디에칠톨루아미드, 줄여서 '디트'라 불리는 물질 때문입니다.[장규식/질병관리본부 연구사 : 걸프전 당시에 모기가 많고 전염병이 많이 도니까 미군들이 디트를  사용했는데 장시간 노출되다 보니까 정신착란  증세를 보였습니다.]대부분 제품이 식약청이 정한 디트 함유 허용량을 따르고 있지만, 전문가들은 화학적 모기약 보단 과일이나 식물을 이용한 천연 모기약를 추천합니다.편의점에서도 쉽게 구할 수 있는 이 토마토 쥬스로도 모기 퇴치 효과를 톡톡히 볼 수 있다고 합니다.얼마나 효과적인지 제 손에 바르고 실험해보겠습니다.아무것도 바르지 않은 손엔 모기들이 손등이며 손바닥이며 할 것 없이 새카맣게 달라붙어 피를 빠는 모습을 볼 수 있는데요, 반면에 토마토 쥬스를 바른쪽엔 모기가 한 마리도 다가오지를 않습니다.계피나 레몬 등을 피부에 발라줘도 모기의 공격을 피할 수 있습니다.전통적인 모기향의 경우도, 한 개를 다 태우면 담배 50개비를 피웠을 때와 비슷한 수치의 포름알데히드와 미세먼지가 발생한다는 연구 결과가 있습니다.전문가들은 외출 뒤 몸을 깨끗이 씻고 모기장을 치는 것이 모기에 물리지 않는 가장 싸고 안전한 방법이라고 조언했습니다.(영상취재 : 김학모, 김현상, 김세경, 주용진, VJ : 김애정, 영상편집 이정택)김종원terryable@sbs.co.kr관/련/정/보◆ [건강] 벌레 물린데 침 바르면…피부염 악화◆ ""벌레 물리면 물로 먼저 씻어야 2차 감염 예방""◆ 올여름 모기 물릴 확률 최대 2배로 높다…'왜?'◆ '모기와의 전쟁' 시작…방충용품 속속 등장☞[SBS기자들의 생생한 취재현장 뒷이야기 '취재파일']☞ SBS뉴스 공식 SNS [SBS8News 트위터] [페이스북] [미투데이] [요즘]저작권자 SBS&SBS콘텐츠허브 무단복제-재배포 금지"
25,2011-06-27,"군견도 '파병'‥""아프간 가요""",https://news.naver.com/main/read.nhn?mode=LSD&mid=shm&sid1=100&oid=214&aid=0000182189,MBC,"[뉴스데스크]◀ＡＮＣ▶폭탄이나 적군을 찾아내는 특수 군견이 있습니다.아프간에도 파병된다는데요.훈련이 혹독해서 탈락률이 30퍼센트나 된다는 군요.이정도면 '실미도 군견'이죠?이용주 기자입니다.◀ＶＣＲ▶맹렬히 돌진하는 '랩스'.적을 제압하기 전까지절대로 놓지 않습니다.공격 능력은, 정찰견에게 필수적입니다.명령이 떨어지자 추적견이숨어있는 적군을 신속히 찾아내고,전방에 움직이는 이상 물체를 발견하면조용히 앞발로 신호를 보냅니다.7살 된 '대덕산'은 곧아프간에 파병됩니다.9가지 화약 냄새를 구분하는 건 기본이고0.5g 미만의 폭약 가루까지 찾아낼 수있어 테러용 폭탄 수색에 베테랑입니다.군견은 생후 8개월에서 12개월이 되면정찰과 추적, 폭발물 탐지 등3가지 주특기 교육에 들어갑니다.군견들은 5개월 동안주특기 교육을 받아야 실전에 투입되며,혹독한 훈련 때문에 30% 정도는탈락합니다.◀ＩＮＴ▶ 송상헌 중령/군견훈련소 교육대장""시각이라든지 후각이 인간의1만 배 이상 탁월합니다. 그래서사람이 들어갈 수 없는 부분이라든지사람이 할 수 없는 부분에서군견의 역할은 더욱 증가되고 있는추세라고 볼 수 있겠습니다.""군견 한 마리를 교육시키는 데는연간 5천여만 원이 듭니다.레바논 동명 부대와아프간 오쉬노 부대에서파병 장병들과 함께 활약 중인 군견은현재 4마리입니다.MBC뉴스 이용주입니다.(이용주 기자 tallmoon@mbc.co.kr)[저작권자(c) MBC (www.imnews.com) 무단복제-재배포 금지]"
26,2011-06-27,[현장] '시간당 4320원' 노동자 삶 체험해보니,https://news.naver.com/main/read.nhn?mode=LSD&mid=shm&sid1=101&oid=055&aid=0000207732,SBS,"<8뉴스><앵커>우리나라의 최저임금이 얼마인지 아십니까? 시간당 4,320원. 좀 유명하다는 카페의 커피 한 잔 값 정도입니다. 커피 전문점이나 편의점에서 일하시는 분들, 또 청소나 경비 용역 등 우리나라에서 최저임금을 받고 있는 분들이 4백만 명이나 됩니다.내년도 최저임금 결정을 이틀 앞두고, 시간당 4,320원을 받는 노동자들의 삶을 조지현 기자가 들여다 봤습니다.<기자>서울의 한 대학을 찾아 청소부의 일상을 체험해보기로 했습니다.지금은 아침 7시입니다.유니폼으로 갈아입고, 청소를 시작하겠습니다.청소부 아주머니는 평소 사람들이 잘 다니지 않는 길로 안내합니다.[청소부만 다닐 수 있는 비상문이거든요. (학생들은 안 다니는 길인가요?) 예.]정해진 구역에 도착한 뒤 쓰레기를 치우는 일이 시작됩니다.청소부 한 명이 두 개 층을 맡아 쓰레기를 처리하는 데 한 시간 넘게 걸립니다.[(쓰레기가) 20배, 40배도 나오죠. 이거는 진짜 빙산의 일각이에요. 종강을 했잖아요.]곧바로 이어진 화장실 청소.저는 이 봉투를 그대로 빼서 버리면 되는 줄 알았는데, 이걸 손으로 다 꺼내는 거라고 합니다.세면대와 변기를 닦고, 물 청소를 마치자 이번엔 계단이 기다리고 있습니다.소화기에 거울까지 닦고 나서야 점심 시간이 찾아옵니다.[돈도 조금 받는데 밥까지 사먹으면 남는 것도 없다고.][(식대) 5만 원씩 나오는 걸 걷어서 쌀 사가지고 밥을 해먹는 거야.]식사 후 오후 1시부터 오전과 똑같은 과정이 반복됩니다.이렇게 하루 8시간 넘게 일한 대가로 한 달에 받는 돈은 세후 80~90만 원.커피 전문점이나 편의점, 주유소에서는 식사 시간도 없이 일하면서 시간당 최저임금  4,320원을 받습니다.[20대 근로자 : 저희 청년들한테는 최저임금이 아니라 최고임금인 거죠. 시급이 오르길 간절히 원하죠.]노동계는 우리나라 최저임금이 OECD 국가 중 16위에 불과하다며 인상을 요구하고 있습니다.그러나 재계는 영세업체가 고용을 꺼리게 될 것이라며 동결해야 한다는 입장입니다.[황인철/한국경영자총협회 홍보본부장 : 단신 근로자들에게는 현재 최저임금이 충분치는 않겠습니다만 그렇다고 해서 부족함이 없는 수준이라는 게 저희들의 입장이고요.][권순하/전국여성노조 인천지부 법원분회장 : 그 사람들이 이 돈으로 살아보라고 그랬으면 좋겠어요. 그러면 결코 이 돈이 많다고는 안 나올 겁니다.]우리 나라에서 최저임금을 받는 이들은 무려 4백만 명.이들은 오는 29일 결정되는 내년도 최저임금 수준에 누구보다 더 주목하고 있습니다.(영상취재 : 유동혁,  영상편집 : 최혜영, VJ : 조귀순)조지현fortuna@sbs.co.kr관/련/정/보◆ 노조 1천원 인상요구에 경영자는 30원◆ 서울 택시요금 오르나…업계 인상 요구◆ 민주노총, 최저임금 현실화 촉구◆ 민주 '3+1복지' 챙기기…무상의료 강조◆ 사업주 이익 내면 사내하청 근로자도 '혜택'☞[SBS기자들의 생생한 취재현장 뒷이야기 '취재파일']☞ SBS뉴스 공식 SNS [SBS8News 트위터] [페이스북] [미투데이] [요즘]저작권자 SBS&SBS콘텐츠허브 무단복제-재배포 금지"
27,2011-06-27,"당정청, 대학 구조조정 입법 신속 추진",https://news.naver.com/main/read.nhn?mode=LSD&mid=shm&sid1=100&oid=001&aid=0005134350,연합뉴스,"李대통령-손학규 대표 회담 성과는?    (서울=연합뉴스) 김병만 기자 = 이명박 대통령과 민주당 손학규 대표가 27일 오전 청와대에서 조찬회담을 열고 있다.                     2011.6.27    kimb01@yna.co.kr李대통령-孫대표 회담 결과 지원대책 논의(서울=연합뉴스) 김남권 안용수 장하나 기자 = 정부와 청와대, 한나라당은 27일 삼청동 총리공관에서 `당ㆍ정ㆍ청 9인 회의'를 열고 대학 등록금 부담 완화 문제와 관련, 대학 구조 조정을 병행하기 위해 국회에서 필요한 입법을 조속히 추진키로 했다.임채민 국무총리실장은 브리핑에서 ""이명박 대통령과 손학규 민주당 대표의 회담시 논의된 사항을 당정청이 공유하고 당정이 필요한 후속 조치를 추진하기로 했다""고 설명했다.당정청은 이에 따라 이 대통령과 손 대표의 회담시 공감대를 형성한 대학 등록금 부담 완화 문제에 대해 국가 백년 대계 차원에서 여야와 정부가 머리를 맞대고 대책을 마련키로 했다.이와 함께 사립학교법 개정안과 사립대학 구조조정특별법 등 대학 구조조정에 필요한 입법도 추진키로 했다고 복수의 참석자들은 전했다.이날 회의는 이 대통령과 손 대표의 회담 내용에 대한 후속 조치를 신속하게 추진해 회담 결과를 뒷받침하기 위해 마련됐다.당정청은 또 가계 부채, 일자리, 저축은행 등 민생 문제에 대해서는 당과 정부가 필요한 후속 대책을 추진해 나가기로 했다.다만 합의 도출에 실패하고 이견을 드러낸 한ㆍ미 자유무역협정(FTA) 비준에 대해서는 야당이 비준 필요성을 이해할 수 있도록 정부와 여당이 더욱 노력해 나가기로 했다고 임 총리실장은 전했다.당정청은 이와 함께 6월 임시국회 폐회를 앞두고 주요 입법의 원만한 처리를 위한 대책을 논의한 것으로 알려졌다.이날 회의는 1시간30분 가량 진행됐으며 정부에서 김황식 국무총리와 임 총리실장, 당에서 황우여 원내대표와 이주영 정책위의장, 청와대에서는 임태희 대통령실장과 백용호 정책실장, 김효재 정무수석이 참석했다. 이재오 특임장관과 정의화 비상대책위원장은 다른 일정이 겹쳐 불참했다.hanajjang@yna.co.kr[관련기사]▶ 여야정, 등록금 인하에 재정투입 합의▶ <`해묵은 숙제' 대학 구조조정 본격화되나>▶ <李대통령-손학규, 신뢰 구축 `첫걸음'>▶ 민주 ""영수회담, 정부정책 전환 계기 돼야""▶ 이대통령-손학규 내일 회담..`6대 민생현안' 논의<모바일 애플리케이션><포토 매거진><저작권자(c)연합뉴스. 무단전재-재배포금지.>"
28,2011-06-27,[단독] '학원법 개정' 누가 막나?‥로비 의혹,https://news.naver.com/main/read.nhn?mode=LSD&mid=shm&sid1=102&oid=214&aid=0000182274,MBC,"[뉴스데스크]◀ＡＮＣ▶사교육비를 줄이기 위해 학원의 영수증 발급을 의무화 하는 내용의 학원법 개정안이 마련됐는데 이상하게도 석 달이 넘도록 국회에서 잠자고 있습니다.정치인들이 학원측의 로비를 받고 있다는 의혹이 제기되고 있는데, 그런 정황을 뒷받침 해주는 자료를 현원섭 기자가 단독 입수했습니다.◀ＶＣＲ▶국회 교육과학기술위원회는지난 3월, 여야 만장일치로학원법 개정안을통과시켰습니다.학원의 영수증 발급을 의무화하는 등사교육비 부담을 줄이자는 게핵심 내용이었습니다.국민 95%가 찬성한다는 이법안은그러나 석달 넘게 국회 법사위에계류 중입니다지난 4월 15일성남시 학원연합회가 주최한'학원법 개정안 저지를 위한 긴급 총회'재보궐 선거에 출마한민주당 손학규 대표가학원법 개정 문제를 학원단체와 깊이협의하겠다고 약속했습니다.◀ＳＹＮ▶ 손학규/민주당 대표, 지난 4월 15일""우리 당에서 여러분과 긴밀히협의해 나가면서 해결해 나갈것입니다.""이후 법안 처리를 위한법사위 논의는 중단됐습니다.지난 16일학원 총연합회 경남 지회장이대의원들에게 보낸 내부 공문입니다.한나라당 이주영 정책위의장 면담 결과,'학원연합회의 입장을 충분히수용해 주겠다'는 답변이 있었다고돼 있습니다.한나라당 일부 법사위원들도'학파라치 제도에 문제가 있다'며법안 처리에 소극적이었습니다.◀ＩＮＴ▶ 윤지희 대표/사교육걱정없는세상""최소한의 거래 투명성을 확보하는법인데 그것조차 가로 막는다면국민과 학부모 바람을 저버리는 것이다.""정부는 이번 임시국회 안에학원법 개정안이 통과되지 못하면법안이 폐기될 수 있다고우려하고 있습니다. 학원법 개정안은내일 오전 10시 법사위에 상정됩니다.MBC뉴스 현원섭입니다.(현원섭 기자 hyunny@imbc.com)[저작권자(c) MBC (www.imnews.com) 무단복제-재배포 금지]"
