,날짜,기사 제목,기사 링크,기사 출처,기사 내용
194,2017-02-17,삼성 '비상대책회의'서 어떤 카드 내놓나…사장단회의 '미정',https://news.naver.com/main/read.nhn?mode=LSD&mid=shm&sid1=101&oid=421&aid=0002566109,뉴스1,"430억원대 뇌물공여와 횡령 등 혐의로 이재용 삼성전자 부회장이 구속된 17일 서울 서초구 삼성전자 사옥에 삼성 깃발이 바람에 나부끼고 있다. 2017.2.17/뉴스1 © News1 구윤성 기자구속적부심사·보석 등 논의될 듯… CEO 현장 지키기에 무게(서울=뉴스1) 서명훈 기자 = 삼성이 최지성 미래전략실장(부회장)을 중심으로 이재용 삼성전자 부회장(49) 구속에 따른 대책 마련에 착수했다. 하지만 당장 전체 사장단 회의는 소집하지 않을 것으로 전해졌다.최 부회장을 비롯한 삼성 미래전략실 주요 임직원들은 17일 새벽 이 부회장의 구속이 결정되자 곧바로 대책 회의에 돌입했다. 주요 임원들은 삼성 서초사옥에서 비상대기하면서 뜬눈으로 밤을 지새웠다.앞서 서울중앙지법 한정석 영장전담판사는 16일 이 부회장에 대한 구속 전 피의자심문(영장실질심사)을 진행한 뒤 ""새롭게 구성된 범죄혐의 사실과 추가로 수집된 증거자료 등을 종합할 때 구속의 사유와 필요성이 인정된다""며 17일 오전 5시36분쯤 구속영장을 발부했다.삼성은 미전실 법무팀 등과 구속 적부심사를 청구할 것인지, 보석 청구 여부 등을 논의하고 있는 것으로 전해졌다. 영장에 의해 구속되더라도 적부심사절차에 따라 다시 법원으로부터 구속 타당성 여부를 심사 받을 수 있다.재계 관계자는 “경영 공백을 최소화하기 위해서는 구속 적부심사나 보석 등을 통해 자유로운 활동이 가능하도록 해야 한다”며 “재판 준비와는 별도로 공백 최소화 방안도 함께 논의될 것”이라고 설명했다.삼성은 이날 이 부회장 구속과 관련 ""앞으로 재판에서 진실이 밝혀지도록 최선을 다하겠다""는 공식 입장을 내놨다.하지만 당장 전체 사장단 회의가 소집되지는 않을 전망이다. 법적인 문제에 대해 최고경영자(CEO)들이 해법을 제시하기도 어렵고 실익이 크지 않기 때문이다. 이보다는 CEO들이 현장을 지키면서 직원들의 동요를 막는 것이 더 중요한 상황이다. 삼성 관계자 역시 “전체 사장단 회의는 아직 결정되지 않았다”고 밝혔다.이 부회장의 구속으로 삼성은 비상경영체제에 돌입했다. 미래전략실이 그룹 차원의 의사결정이 필요한 사안을 조율하고 각 계열사 최고경영자(CEO)들의 책임경영이 강화되는 투트랙(Two-Track) 형태로 운영될 전망이다.이미 최고경영자(CEO)를 중심으로 하는 책임경영 체제가 확립돼 있는 만큼 일상적인 경영활동에는 큰 변화가 없을 것으로 예상된다. 하지만 미래 먹거리를 위한 대형 인수합병(M&A)과 지주회사 전환과 같은 지배구조 개선 작업은 모두 중단될 것으로 보인다.430억원대 뇌물공여와 횡령 등 혐의로 이재용 삼성전자 부회장이 구속된 17일 서울 서초구 삼성전자 사옥에서 직원들이 무거운 분위기에 출근하고 있다. 2017.2.17/뉴스1 © News1 구윤성 기자mhsuh@▶ 놓치면 후회! 최신 무료만화 보기/2017년 나의 운세 보기[© 뉴스1코리아(news1.kr), 무단 전재 및 재배포 금지]"
195,2017-02-17,청부암살단? 北공작원?…잠적 男용의자 4명 김정남암살..,https://news.naver.com/main/read.nhn?mode=LSD&mid=shm&sid1=100&oid=001&aid=0009041391,연합뉴스,"""40대 北정찰총국 소속 포함돼"" vs ""살인 청부 받아…모두 몰랐던 사이""(쿠알라룸푸르=연합뉴스) 김상훈 특파원 = 김정남 암살 사건을 수사하는 말레이시아 경찰이 사건 초기에 여성 용의자 2명을 검거했지만 이번 사건의 배후 규명은 여전히 오리무중이다.검거된 용의자들이 베트남과 인도네시아 등 제3국 국적자로 확인된데다, 김정남을 모른다거나 다른 사람의 지시로 범행에 나섰다는 등의 진술을 하고 있기 때문이다.이런 가운데 말레이시아 경찰의 용의 선상에 올랐으나 행적이 묘연한 4명의 남성 용의자들이 사건의 배후를 캐는 데 핵심 열쇠가 될지 주목된다.17일 현지 언론 등에 따르면 김정남 암살 사건의 용의자로 말레이시아 경찰이 검거한 2명의 여성 가운데 1명은 베트남 여권을 소지하고 있었고, 나머지 1명은 인도네시아 국적자로 확인됐다.그러나 체포된 여성 용의자들은 김정남의 존재 자체를 몰랐다거나 용의선상에 오른 다른 남성으로부터 승객을 상대로 '장난'을 치자는 제안을 받았다는 진술 등을 내놓았다.따라서 이들 여성 용의자들을 통해 북한의 개입 여부를 포함한 사건 배후 규명이 쉽지 않을 것으로 보인다.이에 따라 관심은 4명의 잠적한 남성 용의자들에게로 쏠리고 있다.말레이시아 경찰은 사건 당일 공항 폐쇄회로TV(CCTV)에 찍혔던 2명의 여성 용의자들 이외에 4명의 남성 용의자들이 더 있다고 보고 이들을 추적해왔다.그러나 여성 용의자들이 사건 현장인 쿠알라룸푸르 국제공항2 등에서 뜻밖에 쉽게 검거된 것과 달리, 4명의 남성 용의자들은 그동안 공개된 CCTV 영상에도 거의 등장하지 않았고 행방도 묘연한 상태다.또 이들 4명의 용의자에 대한 현지 언론 보도는 엇갈리고 있다.4명의 남성 가운데 북한 공작원 등이 끼어있을 가능성이 있다는 관측과 이들 역시 특정 국가 정보기관 요원이 아닌 살인 청부 업자에 불과하다는 설이 동시에 제기되고 있다.현지 일간 뉴스트레이츠타임스는 말레이시아 경찰이 4명의 남성 용의자 가운데 40대 남성이 북한 정찰총국 소속인 것으로 보고 추적 중이라고 전했다. 정찰총국은 북한의 대남·해외 공작업무를 총괄 지휘하는 기구다.반면, 현지 중국어 신문인 동방(東方)일보는 현지 고위 소식통을 인용해 4명의 남성이 모두 특정 국가 정보기관 소속이 아니라 살인 청부를 받은 암살단일 것이라는 관측을 제기했다.또한 영국 일간 텔레그래프도 말레이시아 보안당국 소식통을 인용해 현재 용의자로 지목된 2명의 여성과 도주중인 4명의 남성은 청부암살자들로서 범행을 공모하기 이전에는 서로 알지 못했던 사이라고 보도했다.이런 가운데 북한 배후설이 '추측'에 불과하다는 말레이시아 부총리의 발언까지 나오면서 배경에 관심이 쏠린다.베르나마 통신에 따르면 아흐마드 자히드 말레이시아 부총리는 전날 ""김정남의 사망 뒤에 북한이 있다는 건 현재 그저 추측""이라면서 ""말레이시아 땅에서 발생한 그의 죽음은 두 나라(말레이시아와 북한)의 현재 관계에 영향을 주지 않을 것""이라고 말했다.자히드 부총리의 이 발언은 북한과의 외교 관계를 고려한 것으로 추정된다.그러나 그동안 경찰 수사를 통해 드러난 용의자들의 면면 등을 고려하면, 자히드 총리의 발언이 단순한 '말치레' 차원을 넘어설 개연성도 배제할 수 없다.압송되는 김정남 암살 두번째 여성 용의자(쿠알라룸푸르 AP=연합뉴스) 김정남 암살에 가담한 혐의로 16일(현지시간) 체포된 인도네시아 여권 소지의 두번째 여성 용의자(왼쪽 세번째·노란 옷)가 말레이시아 쿠알라룸푸르에서 경찰 차량에 태워지고 있다.말레이 부총리 ""김정남 사망 北배후설은 추측일 뿐""(쿠알라룸푸르 AP=연합뉴스) 아흐마드 자히드 말레이시아 부총리는 16일(현지시간) ""김정남의 사망 뒤에 북한이 있다는 건 현재 추측일 뿐""이라며 말레이시아와 북한 간의 관계가 이번 사건으로 영향받지는 않을 것이라고 말했다. 사진은 이날 자히드 부총리(오른쪽)가 기자회견하는 모습.meolakim@yna.co.kr대박난 흥부가 즐겨찾는 #흥(클릭!)"
196,2017-02-17,"""집에선 TV가 '최고 미디어'""…매체 점유율 70.8%",https://news.naver.com/main/read.nhn?mode=LSD&mid=shm&sid1=102&oid=001&aid=0009041276,연합뉴스,"(서울=연합뉴스) 김인철 기자 = 컴퓨터와 스마트기기 보급이 크게 늘었지만 가정에서는 각종 매체 가운데 TV를 주로 이용하는 비율이 10명 중 7명꼴로 여전히 가장 많은 것으로 나타났다.17일 정보통신정책연구원(KISDI)이 매년 전국 5천여 가구를 대상으로 실시하는 '한국미디어패널' 조사 자료에 따르면 지난해 가정에서 주로 이용하는 미디어 매체로 TV를 꼽은 비율이 70.8%로 가장 높았다.이어 스마트폰을 비롯한 전화기 18.3%, 컴퓨터 7.4%, 신문·책 등 종이매체 2.9% 등의 순이다.2010년 같은 조사 때 매체별 이용 점유율이 TV 66.8%, 컴퓨터 15.0%, 전화기 10.4%, 종이매체 5.5%였던 것과 비교하면 TV와 전화기 이용이 늘어난 반면 컴퓨터와 종이매체 이용은 거의 반으로 줄어든 것이다.가정 내 미디어 이용 행위도 TV·라디오 프로그램 시청이 지난해 71.8%로 가장 많았다.다음으로 통화·문자·이메일·채팅 11.2%, 온라인 검색·소셜네트워크·상거래 5.0%, 신문·책·잡지 읽기 3.8%, 영화·동영상·UCC 등 관람 3.2% 등의 순이다.2010년에는 TV·라디오 시청 68.6%, 통화·문자·이메일·채팅 11.0%, 신문·책·잡지 읽기 6.5%, 온라인 검색·소셜네트워크·상거래 5.7%, 게임 4.7%, 영화·동영상·UCC 등 관람 2.2% 순으로 많았다.◇ 자택 내 이용 미디어매체 점유율(단위 : %)(정보통신정책연구원 '한국미디어패널' 자료)[게티이미지뱅크]aupfe@yna.co.kr대박난 흥부가 즐겨찾는 #흥(클릭!)"
197,2017-02-17,"공중전화의 무인은행 변신, 결국 실패로",https://news.naver.com/main/read.nhn?mode=LSD&mid=shm&sid1=101&oid=016&aid=0001199102,헤럴드경제,"MB정부 때 시작 한때 1481곳수천억 투입해 수익 거의 없어지난해 이어 올해도 대거 폐쇄[헤럴드경제=신소연 기자]IBK기업은행이 지난 2011년부터 야심차게 추진했던 길거리 무인점포가 결국 5년 만에 축소 수순에 들어갔다. 특히 고비용으로 고민해왔던 공중전화 결합부스 점포를 효율화 작업의 하나로 지목, 규모를 크게 줄인다.17일 금융권에 따르면, IBK기업은행은 지난해 말까지 길거리 무인점포 150대를 철수했다. 그중 121대는 공중전화 결합부스였다.공중전화 결합부스는 KT링커스에서 노후화한 공중전화 부스를 빌려 리모델링해 만든 무인점포다. 지점이 적은 기업은행의 단점을 극복하고자 지난 2011년 조준희 전 행장의 아이디어로 만들었다. 특히 유동인구가 많은 지역의 부스에는 자동심장충격기(AED)를 배치해 고객의 편의성 제고는 물론, 국책은행으로서 공익적 역할도 수행한다는 평가를 받았다.기업은행 길거리점포는 지난 2011년 9월 서울역에 첫선을 보인 후 2년 만인 2013년 2000호점(결합부스 1481대)까지 확대됐다. 하지만 이후 2014년 1992대(1475대), 2015년 1962대(1450대) 등을 소폭 줄어들다 지난해에는 1850대(1360대)로 축소폭이 커졌다. 정리된 150대 중 74.7%인 112대가 지난해에 철수가 이뤄졌다. 특히 공중전화 결합부스는 지난해에만 90대가 철수됐다. 지난해 없어진 길거리점포의 80% 이상이 결합부스 점포였던 셈이다.기업은행이 결합부스를 축소한 것은 높은 유지 비용 때문이다. 결합부스 1대당 운영비용은 KT링커스에 내는 임차료와 제작비, 광고비용 등 연간 2000만원 선이다. 기업은행은 길거리 점포 유지를 위해 매년 400억원 전후의 비용을 부담한 것으로 알려졌다. 은행 창구내 설치된 일반 현금자동입출금기(ATM)의 대당 운영비용이 약 500만원임을 고려하면 4배가량 비싼 셈이다.더 많은 비용이 투입된 결합부스지만 수익을 거의 내지 못했다. 이학영 더불어민주당 의원실에 따르면, 기업은행이 지난 2012년부터 지난해 6월까지 무인점포에 투자한 금액은 1684억원이었지만, 여기서 거둬들인 수수료 수익은 고작 22억원이다. 같은기간 기업은행이 운영 중인 3489대의 일반 ATM은 운영비로 총 920억원이 들었고, 723억원의 수익을 얻었다. 기업은행은 비용 절감 차원에서 효율이 적은 길거리점포를 중심으로 폐쇄한다는 방침이다.기업은행 관계자는 “길거리점포는 수수료 수익보다는 영업점 직원 대체에 따른 업무 경감과 대고객 서비스, 홍보 효과 등을 위해 만들었다”면서도 “저효율코너의 효율화 작업이 진행되는 만큼 일부 길거리점포가 추가로 폐쇄될 수 있다”고 말했다.carrier@heraldcorp.com▶초등영어 대세, 헤럴드 큐빅(Qbig)▶오늘의 띠별 운세▶나만의 변호사 찾기- Copyrights ⓒ 헤럴드경제 & heraldbiz.com, 무단 전재 및 재배포 금지 -"
198,2017-02-17,"손학규, 국민의당 입당…""패권교체 아닌 진짜 정권교체""",https://news.naver.com/main/read.nhn?mode=LSD&mid=shm&sid1=100&oid=001&aid=0009041759,연합뉴스,"""더 많은 개혁세력이 당과 함께하는 출발점 될 것""(서울=연합뉴스) 이광빈 박수윤 기자 = 손학규 국민주권개혁회의 의장이 17일 ""최초로 진정한 정권교체를 이룩한 새정치국민회의와 국민의정부를 계승한 국민의당이 진짜 정권교체의 주역이 돼야 한다""며 국민의당에 입당했다.손 의장은 이날 국회에서 최고위원-국회의원 연석회의에 앞서 열린 입당식에서 ""국민은 친박(친박근혜)패권에서 친문(친문재인)패권으로 바뀌는 패권교체가 아닌 나라의 근본을 바꾸고 나의 삶을 바꿔줄 진짜 정권교체를 원하고 있다""면서 이같이 말했다.특히 손 의장은 ""개혁공동정부를 세워 구체제의 적폐를 청산하고 개헌을 통해 제7공화국을 출범시켜야 한다""면서 ""제 입당은 더 많은 개혁세력이 국민의당과 함께하는 출발점이 될 것""이라고 강조했다.그러면서 ""이제 시민혁명을 완수하는 임무는 국민의당의 몫""이라며 ""국민의당은 부와 권력을 독점한 극소수의 특권세력, 기득권 세력의 탐욕으로부터 다수 국민을 지키고 영남패권, 강남패권, 친문패권 등 모든 형태의 특권과 패권주의에 맞서 싸우는 진정한 개혁정당으로 나가야 한다""고 말했다.이어 손 의장은 ""국민의당은 일자리 창출을 모든 경제정책의 최우선 목표로 삼아야 한다""면서 ""중소기업을 경제의 중심이 삼고 4차 산업혁명시대를 맞아 성장동력을 확보해 중산층이 튼튼해지고 청년들이 다시 희망을 품을 수 있게 하는 일자리 정당이 돼야 한다""고 주문했다.또한, ""북한의 핵무기와 미사일 개발을 저지하면서도 대화와 협력을 통해 한반도의 평화체제를 이뤄 비핵화를 담보하고 통일의 기반을 닦는 평화정당이 돼야 한다""면서 ""이렇게 개혁정당, 일자리 정당, 평화정당이 국민의당 당원동지들과 함께 이루고 싶은 소망""이라고 밝혔다.lkbin@yna.co.kr대박난 흥부가 즐겨찾는 #흥(클릭!)"
199,2017-02-17,"한미외교장관 '김정남 암살' 논의…""상황전개 예의주시""",https://news.naver.com/main/read.nhn?mode=LSD&mid=shm&sid1=100&oid=001&aid=0009041787,연합뉴스,"한미 외교장관 트럼프 행정부 출범후 첫 회담(본<독일>=연합뉴스) 공동취재단.조준형 기자= 한미 외교장관이 16일(현지시간) 독일 본의 월드콘퍼런스센터에서 양자회담을 개최했다.윤병세 외교부 장관(오른쪽)과 렉스 틸러슨 미국 국무장관이 대화하고 있다.jhcho@yna.co.kr=연합뉴스) 공동취재단.조준형 기자= 한미 외교장관이 16일(현지시간) 독일 본의 월드콘퍼런스센터에서 양자회담을 개최했다.     윤병세 외교부 장관(오른쪽)과 렉스 틸러슨 미국 국무장관이 대화하고 있다.   jhcho@yna.co.kr' />(본<독일>=연합뉴스) 조준형 기자 = 한미 외교장관은 16일(현지시간) 미국 트럼프 행정부 출범 후 처음 열린 양자 회담에서 북한 김정남 암살 사건에 대해 논의했다.윤병세 외교부 장관은 독일 본에서 개막한 주요 20개국(G20) 외교장관 회의(16∼17일)를 계기로 본의 월드콘퍼런스센터에서 렉스 틸러슨 미국 국무장관과 진행한 양자 회담에서 김정남 사건에 대해 의견을 교환했다고 정부 당국자가 전했다.당국자는 ""두 장관이 누가 먼저라고 할 것도 없이 '매우 비상한 사건이 있었다'며 김정남 사건에 대해 이야기했다""고 소개했다.외교부는 회담 내용을 소개한 보도자료에서 ""두 장관이 (김정남 피살과 관련한) 향후 상황전개를 예의주시하면서, 긴밀히 협의해 나가기로 했다""고 소개했다.jhcho@yna.co.kr대박난 흥부가 즐겨찾는 #흥(클릭!)"
200,2017-02-17,한진해운 파산 선고…창립 40년만에 역사 속으로,https://news.naver.com/main/read.nhn?mode=LSD&mid=shm&sid1=101&oid=008&aid=0003824004,머니투데이,"[머니투데이 황시영 기자] [파산채권 신고기간 2017년 5월 1일까지]서울중앙지방법원 제6파산부(재판장 정준영 파산수석부장판사)는 17일 오전 9시 40분 한진해운에 대해 파산선고를 했다.법원 측은 ""한진해운이 주요 영업을 양도함에 따라 계속기업가치의 산정이 사실상 불가능하고, 청산가치가 계속기업가치보다 높게 인정됨에 따라 지난 2일 회생절차 폐지결정을 했고, 2주의 항고기간 동안 적법한 항고가 제기되지 않아 17일 파산선고를 하게 됐다""고 밝혔다.법원은 앞으로 파산절차를 주관할 파산관재인으로 오랫동안 서울중앙지방법원 법인파산관재인으로 활동, 능력과 경험에서 높은 평가를 받고 있는 변호사 김진한을 선임했다.파산채권의 신고기간은 2017년 5월 1일까지다.제 1회 채권자집회와 채권조사의 기일 및 장소는 6월 1일 오후 2시 서울법원종합청사 3별관 1호 법정으로 정했다.법원은 ""파산절차를 통해 모든 채권자에게 공정하고 형평에 맞는 최대한의 채무변제가 이뤄지도록 노력하겠다""고 말했다.[▶이코노미스트들의 깊이있는 투자정보 'TOM칼럼'][▶하태핫태! '치어리더'][▶내 삶을 바꾸는 정치뉴스 'the 300'][▶트렌드 리더의 스타일 지침서 '스타일M'][▶빵빵한 차 & 레이싱걸]황시영 기자 apple1@mt.co.kr<저작권자 ⓒ '돈이 보이는 리얼타임 뉴스' 머니투데이, 무단전재 및 재배포 금지>"
201,2017-02-17,파키스탄 수피 성지서 IS 자폭테러…72명 사망·250명 부상,https://news.naver.com/main/read.nhn?mode=LSD&mid=shm&sid1=104&oid=001&aid=0009041192,연합뉴스,"희생자의 신발만…파키스탄 수피 성지 테러 현장(세완 AFP=연합뉴스) 파키스탄 남부 신드주(州) 세완에 있는 수피 성지 랄 샤바즈 칼란다르 사원에서 16일(현지시간) 괴한 한 명이 신도들에게 수류탄을 던지며 자폭, 최소 72명이 사망하고 250여명이 다쳤다. 수니파 극단주의 무장단체 이슬람국가(IS)는 이 테러가 자신들의 소행이라고 밝혔다. 사진은 사건 직후 희생자들의 신발 등이 널브러져 있는 처참한 현장의 모습.    ymarshal@yna.co.kr(뉴델리=연합뉴스) 나확진 특파원 = 파키스탄에서 이슬람 신비주의 종파인 '수피' 성지에서 16일(현지시간) 국제테러단체 이슬람국가(IS)의 자살 폭탄 테러가 일어나 최소 72명이 사망하고 250명이 다쳤다.16일 IS의 자폭테러로 72명이 숨지고 250명이 다친 파키스탄 남부 세완의 랄 샤바즈 칼란다르 사원의 2014년 모습[AFP=연합뉴스 자료사진]파키스탄 지오TV 등에 따르면 이날 오후 파키스탄 남부 신드 주 세완에 있는 수피 성지 랄 샤바즈 칼란다르 사원에 한 괴한이 수류탄을 던지며 들어오더니 신도들 사이에서 자폭했다.이날은 수피파에게 성스러운 날로 당시 사원에서는 많은 신자가 저녁 예배를 마치고 다말이라는 수피교 의식을 하느라 모여 있던 중이었다.이슬람 수니파 극단주의 무장단체인 IS는 이번 테러가 자신들의 소행이라고 밝혔다.IS는 지난해 11월에도 파키스탄 남부 발루치스탄 주에 있는 수피 성지에서 자폭테러를 벌여 52명이 숨지고 102명이 다치게 했다.파키스탄군은 테러 직후 해군 헬기와 C-130 공군 수송기까지 동원해 부상자 이송에 나섰다.파키스탄 군홍보기구(ISPR)의 아시프 가푸르 소장은 ""최근 테러는 이웃한 아프가니스탄에 은신한 적대세력의 지령에 따라 이뤄지고 있다""면서 ""즉시 보복할 것""이라고 말했다.나와즈 샤리프 총리는 ""수피 신도들은 파키스탄 건국 이전부터 있었고 파키스탄 독립 투쟁에도 중요한 역할을 했다""면서 ""이들에 대한 공격은 파키스탄에 대한 직접적 위협""이라고 이번 테러를 비난했다.파키스탄에서는 지난 13일 펀자브 주 라호르에서 약사법 개정에 반대하는 시위대를 겨냥해 파키스탄탈레반(TTP) 강경분파 자마툴 아흐랄의 자살폭탄 테러가 벌어져 13명이 숨지고 85명이 다치는 등 최근 치안이 급격히 악화하고 있다.이번 테러가 벌어진 16일에도 남부 발루치스탄 주에서 군용 차량을 겨냥한 폭탄테러로 군인 3명이 숨졌고 전날에는 북부 모만드에서 TTP의 자폭테러로 군인과 민간인 등 8명이 사망했다.16일 파키스탄 남부 세완의 수피 사원에서 벌어진 자폭테러로 다친 부상자가 병원에서 휴대전화로 통화하고 있다.[AFP=연합뉴스]rao@yna.co.kr대박난 흥부가 즐겨찾는 #흥(클릭!)"
202,2017-02-17,"포근한 아침, 낮부터 찬바람…서쪽 미세먼지↑",https://news.naver.com/main/read.nhn?mode=LSD&mid=shm&sid1=103&oid=437&aid=0000148346,JTBC,"밤사이 비가 내렸지만 기온은 오히려 올랐습니다.현재 서울의 기온 0.1도로, 어제보다 2도 정도 높은데요.그 밖의 지역에서는 10도 가까이 오른 곳들도 있습니다.다만 이렇게 바람이 불어오기 때문에 체감온도는 조금 낮은 편입니다. 옷차림 유의해서 신경쓰셔야겠습니다.낮부터는 찬바람이 불어오면서 기온이 큰 폭으로 떨어지는데요.아침 기온에 미치지 못하는 곳들도 있겠고요, 어제보다는 5도에서 10도 가량 낮겠습니다.서울은 7도 낮은 3도에 머물겠고, 대구는 11도가 예상됩니다.기온이 떨어지면서 내일 아침에는 아침 기온 영하 10도 이하로 내려가는 곳도 있겠습니다.오늘 아침 강원 남부와 전북, 경북 일부 지역에는 아직 비가 그치지 않았습니다.경북 김천에는 시간당 0.5mm로 약하게 내리고 있는데요.그 밖의 지역에서도 아침까지 빗방울이 떨어지는 곳이 있겠습니다.오늘 서쪽 지방은 미세먼지 농도가 다소 높은데요, 어제 중국에서 발원한 황사 때문입니다.공기 흐름은 유동적인 만큼 계속해서 기상정보 참고하시기 바랍니다.한편, 동쪽 지역을 중심으로 대기 상태가 굉장히 건조하겠고요. 또 강원 산간 지역을 비롯해 전국 곳곳에서 바람이 강하게 불어 올 것으로 전망됩니다.내일은 맑은 하늘 예상됩니다.일요일에는 점차 저기압의 영향을 받으면서 낮부터 흐려지겠는데요.수도권과 강원 영서에서 비가 시작 돼 밤에는 그 밖의 중부와 호남 지방까지 확대되겠습니다.이제 한 겨울도 거의 지나갔는데요. 기온이 조금 올랐다고 안심하시면 금세 감기 걸리기 쉽습니다.건강관리 끝까지 신경쓰시기 바랍니다.김민아▶ JTBC 뉴스 공식 SNS[트위터][페이스북][유튜브]Copyright by JTBC(http://jtbc.joins.com)and JTBC Content Hub Co., Ltd. All Rights Reserved. 무단 전재 및 재배포 금지"
