,날짜,기사 제목,기사 링크,기사 출처,기사 내용
0,2017-02-17,"""나무 아닌 숲 보다가""…장고 끝 이재용 구속 뒷이야기",https://news.naver.com/main/read.nhn?mode=LSD&mid=shm&sid1=100&oid=055&aid=0000505551,SBS,"<앵커>법조팀 정성엽 기자 나왔습니다. 정 기자, 지난번에는 기각됐었는데 이번엔 영장이 발부된 이유, 간단하게 요약하자면 뭐가 되겠습니까?<기자>나무만 보지 말고 숲을 보라. 이런 말이 있지 않습니까?그림을 크게 보라는 이야기인데요, 특검 입장에서는 이재용 부회장의 구속이 딱 거기에 맞는 사례가 아닌가 싶습니다.성이 최순실 씨 일가에 수백억 원을 지원했는데, 근데 그 대가로 삼성이 청와대로부터 무엇을 얻었느냐.이 문제를 풀기 위해 특검이 계속 애를 쓴 것 아니겠습니까? 지난번엔 그 대가로 삼성계열사 합병 과정에 국민연금을 동원했다고 이야기했는데 그게 시기적으로 어긋나고 결과적으로 안 먹힌 겁니다.그래서 눈을 크게 뜨고 큰 그림을 그린 건데, 단순히 삼성 계열사 합병 하나가 아니라 이재용 부회장의 그룹 경영권 강화를 위해서 필요한 여러 정부 부처의 석연찮은 조치들을 전부 다 삼성이 받은 대가로 범죄를 재구성했는데 바로 이게 먹힌 겁니다.<앵커>한마디로 이야기하자면 삼성물산 합병은 나무고 이재용 부회장의 경영권 승계 작업은 큰 숲이라고 말할 수 있겠네요. 그러면 이게 발목을 잡은 이유, 다시 말해 경영권 승계 작업이 발목을 잡은 이유를 좀 구체적으로 설명하면 어떻습니까?<기자>결과적으로 보면 경영권 승계 과정에 대해서 특검에서 전체적으로 삼성이 받은 대가관계라고 범죄를 구성한 것 아니겠습니까?그래서 이 문제에 대해서 조언한 숨은 조력자가 있었는데요, 바로 김상조 한성대 교수, 경제개혁연대 소장이죠. (삼성 문제를 아주 끈질기게 물고 늘어졌던 분이죠.)그렇습니다. 삼성 저격수로 알려진 김 교수는 사실 지난 일요일에 특검에 출석했었습니다.그래서 눈치 빠른 기자들은 특검이 부회장의 경영권 강화 쪽에 포커스를 맞추고 있구나 생각했었거든요.지난번 영장 기각 이후부터 김상조 교수는 계속 조언을 해왔다고 하더라고요.특검에게 나무가 아니라 숲을 보라고 조언한 장본인이라고 할 수 있겠습니다.<앵커>이재용 부회장 구속으로 어느 정도 큰 틀에서의 특검 수사가 완성 단계에 들어섰다고 볼 수 있는데 남은 건 시간 아닙니까? 대통령 조사도 했으면 좋겠고 여러 가지 남은 게 있는데, 기한 연장신청을 했잖아요? (그렇습니다.) 어떻게 될 것 같습니까?<기자>이재용 부회장 구속이라는 큰 산은 넘었습니다.그런데 지금 계산해보면 수사 기한은 열흘 남았습니다.사실 그 기간은 이 부회장 기소 준비하기에도 굉장히 빠듯한 시간이거든요.근데 말씀하셨다시피 대통령 대면조사도 해야 하고, SK·롯데 기업 수사도 해야 하고, 할 일이 많이 남았습니다.그런데 황교안 권한대행은 아직까지도 수사 기한 연장에 대해서 긍정적인 분위기는 아닙니다.또 정치권에서 특검법 연장안 얘기가 나오긴 하고 있습니다만, 현실적으론 쉽지 않은 얘기고요.그런데 이런 상황에서 오늘 이재용 부회장 구속은 특검 기간을 연장하는 데 명분을 크게 높인 거라고 볼 수 있지 않겠습니까?이제는 황 대행이 그런 점을 심각하게 고려할 때가 된 것 같습니다.<앵커>만약 수사 기간이 연장 안 된다면 남은 것 빨리 서둘러 해야 하는 것 중의 하나가 우병우 전 민정수석에 대한 수사 아닙니까?<기자>우병우 전 민정수석에 대해서는 내일 열 시에 특검에 소환하기로 했습니다.생각보다 좀 오래 걸리긴 했지만, 결국에는 우병우 전 수석 차례까지 오긴 왔습니다.특검은 그동안 검사들이 돌아가면서 우 전 수석에 대해서 준비를 굉장히 많이 했다고 합니다.우병우 전 수석은 직권남용과 직무유기의 피의자라고 이규철 특검보가 공개적으로 밝혔거든요. (피의자로 소환되는 거군요.) 그렇습니다.그래서 이런 경우에는, 관례에 따르면 내일 조사를 마치고 난 다음에 신병 처리 문제에 관해서도 특검이 이미 결정을 한 것으로 봐야 할 것 같습니다.<앵커>알겠습니다. 잘 들었습니다.▶ 이재용, 5가지 혐의 적용…재계 1위 총수 '첫 구속'▶ 명마 블라디미르·안종범 수첩, 삼성 '방패' 뚫었다정성엽 기자(jsy@sbs.co.kr)※ ⓒ SBS & SBS콘텐츠허브 : 무단복제 및 재배포 금지"
1,2017-02-17,"김치찌개 즐기던'비운의 왕자' 김정남 ""평범한 삶이 소원""",https://news.naver.com/main/read.nhn?mode=LSD&mid=shm&sid1=100&oid=448&aid=0000200608,TV조선,"[앵커]카지노 도박에 여성 편력, 고가 주택에서 왕족 같은 호화 생활을 해왔다던 김정남의 일상생활을 어땠을까요? 오랜 도피생활에 지쳐서였을까요? 김정남의 10년 지기 친구는 처자식과 평범하게 사는 게 김정남의 소원이었다고 했습니다.마카오 현지에서 이태형 특파원이 김정남의 친구를 인터뷰했습니다.[리포트]김정남이 2007년 거주했던 마카오 콜로안 섬 해변의 고급빌라. 셔터는 굳게 닫혔고, 유리문에는 나무판자를 넣어놨는데, 외부의 관심을 차단하려고 했던 노력이 보입니다.김정남은 장성택의 도움으로 호화생활을 누린 것으로 알려졌지만, 실제로는 자가용도 없이 소박했다고 전합니다.이동섭 / 김정남 친구""차도 없이 다녔고 항상 걸어 다니고. 집에 갈 때 택시타고 다니고.""지난 2005년, 미국이 북한 금융창구로 알려진 마카오 방코델타아시아 은행에 제재를 가하면서 북한 사람들이 대부분 떠나자 외로움에 한인 식당을 자주 찾았습니다.이동섭 / 김정남 친구“김치찌개랑 김치전이랑 불고기 시켜서 소주 한 잔 먹고 갔고 특히 사극을 좋아해서 나도 모르는 사극을 듣고.“유창한 서울말을 구사하던 김정남은 가족생계를 위해 무역 일을 하며 평범한 삶을 꿈꿨다고 말합니다.이동섭 / 김정남 친구“자기는 가족, 처자식과 아주 평범하고 편안하게 사는 게 소원이라는 거죠.”김정남은 카지노의 도시 마카오에 살았지만, 도박으로 돈을 탕진하는 경우는 없었다고 합니다.가족들과 평범한 삶을 꿈꿨던 ‘비운의 왕자’를 향한 현지인들의 동정어린 시선이 이어지고 있습니다.마카오 현지에서 TV조선 이태형입니다./ 고서정 기자 verygood@chosun.com* 뉴스제보 : 이메일(tvchosun@chosun.com), 카카오톡(tv조선제보), 전화(1661-0190)고서정 기자(verygood@chosun.com)- Copyrights ⓒ TV조선. 무단전재 및 재배포 금지 -"
2,2017-02-17,"김치찌개 즐기던 '비운의 왕자'…""평범한 삶이 소원""",https://news.naver.com/main/read.nhn?mode=LSD&mid=shm&sid1=100&oid=448&aid=0000200608,TV조선,"[앵커]카지노 도박에 여성 편력, 고가 주택에서 왕족 같은 호화 생활을 해왔다던 김정남의 일상생활을 어땠을까요? 오랜 도피생활에 지쳐서였을까요? 김정남의 10년 지기 친구는 처자식과 평범하게 사는 게 김정남의 소원이었다고 했습니다.마카오 현지에서 이태형 특파원이 김정남의 친구를 인터뷰했습니다.[리포트]김정남이 2007년 거주했던 마카오 콜로안 섬 해변의 고급빌라. 셔터는 굳게 닫혔고, 유리문에는 나무판자를 넣어놨는데, 외부의 관심을 차단하려고 했던 노력이 보입니다.김정남은 장성택의 도움으로 호화생활을 누린 것으로 알려졌지만, 실제로는 자가용도 없이 소박했다고 전합니다.이동섭 / 김정남 친구""차도 없이 다녔고 항상 걸어 다니고. 집에 갈 때 택시타고 다니고.""지난 2005년, 미국이 북한 금융창구로 알려진 마카오 방코델타아시아 은행에 제재를 가하면서 북한 사람들이 대부분 떠나자 외로움에 한인 식당을 자주 찾았습니다.이동섭 / 김정남 친구“김치찌개랑 김치전이랑 불고기 시켜서 소주 한 잔 먹고 갔고 특히 사극을 좋아해서 나도 모르는 사극을 듣고.“유창한 서울말을 구사하던 김정남은 가족생계를 위해 무역 일을 하며 평범한 삶을 꿈꿨다고 말합니다.이동섭 / 김정남 친구“자기는 가족, 처자식과 아주 평범하고 편안하게 사는 게 소원이라는 거죠.”김정남은 카지노의 도시 마카오에 살았지만, 도박으로 돈을 탕진하는 경우는 없었다고 합니다.가족들과 평범한 삶을 꿈꿨던 ‘비운의 왕자’를 향한 현지인들의 동정어린 시선이 이어지고 있습니다.마카오 현지에서 TV조선 이태형입니다./ 고서정 기자 verygood@chosun.com* 뉴스제보 : 이메일(tvchosun@chosun.com), 카카오톡(tv조선제보), 전화(1661-0190)고서정 기자(verygood@chosun.com)- Copyrights ⓒ TV조선. 무단전재 및 재배포 금지 -"
3,2017-02-17,"명마 블라디미르·안종범 수첩, 삼성 '방패' 뚫었다",https://news.naver.com/main/read.nhn?mode=LSD&mid=shm&sid1=100&oid=055&aid=0000505543,SBS,"<앵커>특검의 뇌물 공여 혐의에 맞선 삼성의 방어 논리는 크게 두 가지였습니다. '삼성물산 합병은 최순실 씨를 지원하기 이전에 성사됐기 때문에 대가성이 없다.', '다른 현안에 대해서도 부정한 청탁을 한 적이 없는 만큼 삼성은 대통령 강요의 피해자일 뿐이다.'라고 했습니다. 하지만, 이재용 부회장에 대한 두 번째 영장실질심사에서는 이런 삼성의 방패가 모두 뚫렸습니다. 명마 블라디미르와 안종범 전 수석의 수첩이 결정적인 창이 됐습니다.이한석 기자입니다.<기자>특검은 이재용 부회장에 대한 1차 구속영장 청구 당시 최순실 씨 측에 지원한 430억 원이 삼성물산 합병 대가라고 봤습니다.하지만 삼성물산 합병 시점이 최 씨 지원 이전의 일이라는 삼성 측 주장에 밀려 기각됐습니다.두 번째 구속영장에서, 특검은 삼성의 방어논리를 깨기 위해 삼성이 최순실을 지원한 2015년 8월 이후 특혜 혐의에 초점을 맞췄습니다.청와대가 공정위에 압력을 가해 삼성 계열사의 삼성물산 주식 매각 규모를 절반으로 줄여주고, 삼성생명을 금융지주회사로 만들기 위해 청와대에 청탁한 혐의를 추가한 것입니다.추가로 확보한 안종범 전 수석의 수첩 39건이 결정적 증거가 됐습니다.이 부회장이 박 대통령에게 금융지주회사를 도와달라고 청탁한 정황이 수첩에서 드러난 것으로 전해졌습니다.명마 블라디미르도 결정타가 됐습니다.특검은 삼성이 최 씨와 정유라 씨에게 블라디미르를 사주고 우회 지원을 은폐하기로 약속한 비밀 계약서와 합의서를 찾아냈습니다.이들 문서는 지난해 9월과 10월에 작성된 것이었습니다.국정농단 사건 이후에도 최순실 씨를 지원한 정황이 드러났다는 점에서 대통령 강요의 피해자라던 삼성의 논리는 허물어졌습니다.(영상취재 : 최준식, 영상편집 : 우기정)▶ ""나무 아닌 숲 보다가""…장고 끝 이재용 구속 뒷이야기▶ 이재용, 5가지 혐의 적용…재계 1위 총수 '첫 구속'이한석 기자(lucaside@sbs.co.kr)※ ⓒ SBS & SBS콘텐츠허브 : 무단복제 및 재배포 금지"
4,2017-02-17,결국 침몰한 한진해운… 1400명 직원 중 절반이 실직,https://news.naver.com/main/read.nhn?mode=LSD&mid=shm&sid1=101&oid=022&aid=0003147070,세계일보,"직원 1400명 중 절반이 실직/해상물류 주도권 글로벌 선사로/지난해 해상운송수지 첫 적자국적 1위 선사였던 한진해운이 17일 마침내 파산하면서 업계가 다시 한 번 충격에 휩싸였다. 세계 7위까지 몸집은 불렸지만 업황 불황 속에서 전개된 글로벌 선사와의 치열한 ‘치킨게임’에서 내실을 확보하지 못한 때문이다. 40년 역사의 대기업 해운사가 한순간에 침몰하면서 실직자 양산과 국가 해운물류 경쟁력 하락 등의 후폭풍이 우려된다.이날 서울중앙지법 파산6부는 한진해운에 파산선고를 내렸다. 앞서 법원은 한진해운의 영업 가능성 등을 따져본 뒤 지난해 12월 중순 청산절차를 밟는 게 기업을 계속 운영하는 것보다 이득이라는 결론을 내렸었다.텅 빈 한진해운 터미널서울중앙지방법원 파산6부(정준영 수석부장판사)가 한진해운에 대해 파산선고를 내린 17일 한진해운의 모항인 부산신항 한진해운 터미널의 야드가 텅 비어 있다.부산=연합뉴스한진해운은 1977년 고 조중훈 한진그룹 창업주가 국내 최초의 컨테이너 전용선사로 설립했다. 출범 이듬해인 1978년 중동항로를 개척한 데 이어 1979년 북미서안 항로, 1983년 북미동안항로 등을 연달아 개설하는 등 한국 컨테이너 해운업계의 새로운 역사를 섰다. 조중훈 회장이 2002년 11월 타계하자 셋째아들인 조수호 회장이 경영 전면에 나섰고, 해운업이 호황이던 2000년대 중반까지 순항했다.그러나 조수호 회장이 2006년 별세하고 이듬해 부인 최은영 전 회장이 일선에 나선 뒤로 최악의 위기를 맞았다. 한진해운은 고가용선 계약, 고원가 선박 구입 등으로 인한 선대의 취약성 때문에 배를 운항할수록 손해를 보는 구조로 전락했다. 2008년 리먼사태 이후 운임이 호황기의 절반 이하로 떨어진 것도 치명타였다. 최 전 회장은 결국 시숙인 조양호 한진그룹 회장에게 회사 지분과 경영권을 넘기고 완전히 손을 뗐다. 조 회장은 2014년부터 한진해운의 경영 정상화에 매진했으나 불황의 터널을 뚫진 못했다.충격파는 만만찮다. 1400여명에 달했던 직원 중 절반가량이 실직했다. 여전히 공적자금 지원을 받는 현대상선 하나만으로 한국 해운산업이 글로벌 경쟁력을 확보할지도 의문이다. 한진해운 사태 여파로 지난해 한국 해상운송 수지는 사상 첫 적자를 기록했다. 한국은행 국제수지의 서비스무역 통계를 보면 지난해 해상운송 수지는 5억3060만달러(잠정치·약 6000억원) 적자로 집계됐다. 한은이 2006년부터 관련 통계를 낸 후 연간 기준으로 적자가 나기는 처음이다.한국은 그동안 해상운송수지에서 늘 흑자였다. 그 규모가 2006년 17억60만달러에서 2012년 70억8170만달러까지 늘었다. 업계에서는 앞으로도 상당 기간 해운산업 불황과 대형 선사 주도의 출혈경쟁이 지속할 것으로 예상하고 있다.한편 한진해운은 오는 23일부터 7일간의 정리매매를 거쳐 내달 7일 최종 상장폐지된다. 정리매매는 상장폐지가 결정된 이후 투자자가 보유주식을 처분할 수 있도록 기간을 주는 제도다. 정리매매는 상·하한가 가격제한이 없어 30% 이상 급등락할 수 있다.나기천·염유섭 기자 na@segye.comⓒ 세상을 보는 눈, 글로벌 미디어세계일보"
5,2017-02-17,"김정일 가정교사 ""김정은 최고로 포악""",https://news.naver.com/main/read.nhn?mode=LSD&mid=shm&sid1=100&oid=449&aid=0000123982,채널A,"김정일의 어린시절 가정교사였던, 김현식 전 평양사범대 교수는 김정남 피살을 어떻게 보고 있을까요?김일성 가문 사람들을 두루 겪어 봤던 김 씨는 ""김정은처럼 포악한 사람은 없었다""고 단언했습니다.박정훈 워싱턴 특파원이 단독으로 만났습니다.[리포트]고등학교이었던 김정일에게 러시아어를 가르치다 1992년 망명한 김현식 전 교수.이후 미국으로 건너온 뒤 뇌졸중 치료까지 받고 있는 김 전 교수는 김정남 피살 소식을 듣고 큰 충격을 받았습니다.[김현식 / 김정일 가정교사·전 평양사범대 교수]""(김정남은) 수수하고 괜찮았어. (김정은 무리는) 인간들이 아니야.자기 혈육이고 친척이고 관계없어 자기 권력에 통치에 지장이 있으면 다 쏴 죽이는….""김 전 교수는 김정은의 포악함이 극에 달했다며,[김현식/김정일 가정교사·전 평양사범대 교수]""(김정은은) 최고로 포악해. 이 때까지 (김일성 가문에) 그런 사람이 없었어.""사람을 죽이지 말라는 김일성의 유훈에 따라 자신보다 뛰어났던 이복동생 김평일을 살려둔 김정일과 다르다고 강조했습니다.고모부인 장성택을 처형한 것도 위협감 때문이었을 거라며, 눈물을 보였습니다.[김현식/김정일 가정교사·전 평양사범대 교수]""장성택은 원래 정말 대단한 인물이었습니다. 남자답고 영향력이 컸어요. (그런데 김정은이) 자기를 어떻게 처단할까봐… (죽인 거지).""김 전 교수는 북한의 감시체제가 워낙 정교해 체제가 쉽게 흔들리지 않을 것이라면서도 후배 지식인들을 위해 평양을 해방 시켜야 한다는 말로 인터뷰를 마쳤습니다.버지니아주 페어팩스에서 채널A 뉴스 박정훈입니다.영상취재: 강율리(VJ)영상편집: 오성규9분기 연속 종편 1위! 채널A 시청자 만족도 A+ ⓒCHANNEL A(www.ichannela.com), 무단 전재 및 재배포 금지"
6,2017-02-17,"김정일 가정교사 ""김정은 최고로 포악""",https://news.naver.com/main/read.nhn?mode=LSD&mid=shm&sid1=100&oid=449&aid=0000123982,채널A,"김정일의 어린시절 가정교사였던, 김현식 전 평양사범대 교수는 김정남 피살을 어떻게 보고 있을까요?김일성 가문 사람들을 두루 겪어 봤던 김 씨는 ""김정은처럼 포악한 사람은 없었다""고 단언했습니다.박정훈 워싱턴 특파원이 단독으로 만났습니다.[리포트]고등학교이었던 김정일에게 러시아어를 가르치다 1992년 망명한 김현식 전 교수.이후 미국으로 건너온 뒤 뇌졸중 치료까지 받고 있는 김 전 교수는 김정남 피살 소식을 듣고 큰 충격을 받았습니다.[김현식 / 김정일 가정교사·전 평양사범대 교수]""(김정남은) 수수하고 괜찮았어. (김정은 무리는) 인간들이 아니야.자기 혈육이고 친척이고 관계없어 자기 권력에 통치에 지장이 있으면 다 쏴 죽이는….""김 전 교수는 김정은의 포악함이 극에 달했다며,[김현식/김정일 가정교사·전 평양사범대 교수]""(김정은은) 최고로 포악해. 이 때까지 (김일성 가문에) 그런 사람이 없었어.""사람을 죽이지 말라는 김일성의 유훈에 따라 자신보다 뛰어났던 이복동생 김평일을 살려둔 김정일과 다르다고 강조했습니다.고모부인 장성택을 처형한 것도 위협감 때문이었을 거라며, 눈물을 보였습니다.[김현식/김정일 가정교사·전 평양사범대 교수]""장성택은 원래 정말 대단한 인물이었습니다. 남자답고 영향력이 컸어요. (그런데 김정은이) 자기를 어떻게 처단할까봐… (죽인 거지).""김 전 교수는 북한의 감시체제가 워낙 정교해 체제가 쉽게 흔들리지 않을 것이라면서도 후배 지식인들을 위해 평양을 해방 시켜야 한다는 말로 인터뷰를 마쳤습니다.버지니아주 페어팩스에서 채널A 뉴스 박정훈입니다.영상취재: 강율리(VJ)영상편집: 오성규9분기 연속 종편 1위! 채널A 시청자 만족도 A+ ⓒCHANNEL A(www.ichannela.com), 무단 전재 및 재배포 금지"
7,2017-02-17,"""다중인격자 된 것 같다""… 취준생들은 그만큼 간절했다",https://news.naver.com/main/read.nhn?mode=LSD&mid=shm&sid1=102&oid=022&aid=0003147057,세계일보,"'자소설' 쓰는 취준생 늘어나…기업은 난감입사경쟁이 치열해지며 `자소설`을 쓰는 취준생이 늘고 있다""반은 사실, 반은 거짓이었어요.”취업준비생 이모(26·여)씨는 얼마 전 한 제약회사 채용에 지원하기 위해 친구의 자기소개서를 봐주다 깜짝 놀랐다. 친구의 자소서에 직접 경험하지 않은 활동이 담겨 있었기 때문이다. 서류에는 친구가 다녀온 적 없는 무전여행 이야기가 적혀 있었다. 이씨는 “친구에게 거짓으로 자소서를 작성한 연유를 물으니 ‘무전여행 경험은 무슨 일을 시켜도 버틸 것이라는 강인함을 보여주기 때문에 적었다’ 고 했다”고 말했다.기업 입사 경쟁률이 갈수록 치열해지면서 자기소개서에 거짓을 적거나 경험담을 과장하는 ‘자소설(자기소개서·소설의 합성어)’을 쓰는 취업준비생들이 늘고 있다. 자소서는 지원회사에 자신의 첫 인상을 드러내는 단계지만 스펙이나 경험 등이 합격 여부를 결정하는 것으로 여겨지며 이 같은 현상이 벌어지는 것이다.채용의 첫 관문인 자기소개서윤모(29)씨는 “상반기·하반기 기업 채용이 몰리는 시기가 있다”며 “이 때 몇 십 개의 자소서를 쓰다보면 나를 드러내기보다 기업 인재상 등에 나를 맞추게 된다”고 말했다. 윤씨는 지난해 하반기 20곳이 넘는 회사에 입사지원서를 냈다. 당시 그는 “다중인격자가 된 것 같다는 기분을 느끼며 자기소개서를 작성했다”고 했다. 어떤 기업에서는 활발하고 적극적인 성격으로, 또 다른 기업에서는 꼼꼼하고 신중한 성격으로 자신을 표현했다고 말했다. 그 과정에서 자신을 포장하고 필요한 경우 거짓말도 서슴지 않았다.취업준비생들의 이런 사실은 통계로도 드러난다. 취업포털 잡코리아가 알바몬과 함께 최근 취업준비생 1070명을 대상으로 ‘자소설 작성 경험’에 대해 묻는 설문조사를 실시한 결과 60.8%는 ‘자소설을 작성해 본 적이 있다’고 응답했다.과장해 작성하는 항목으로는 성격 및 장·단점이 41.5%로 가장 높았다. 이어 △입사 후 포부(39.6%)가 많았고, 3위는 △지원동기(29.8%)였다. 이어 △실무경험·경력(29.2%) △직무역량(27.5%) △성장배경·환경(24.0%) △가치관(21.0%) 등이 있었다.그러나 이들의 과장된 자기소개서가 항상 통하는 것은 아니다. 지난 13일 취업포털 사람인에이치알이 기업 인사담당자 645명을 대상으로 조사한 결과 72.1%가 “채용 과정 중 구직자가 거짓말을 한다고 판단한 경험이 있다”고 답했다. 거짓말을 한다고 느꼈던 전형단계 중 20.4%는 서류전형이었다.한 공기업 인사담당자는 “채용과정에서 취업 관련 캠프를 다녀온 것을 인턴으로 허위작성한 지원자가 적발된 사례가 있다”고 밝혔다. 또 가점을 받을 수 있는 항목들에도 거짓으로 체크한 경우도 있었다.문제는 이런 경우가 면접 전형이나최종 단계에서 발견된다는 사실이다. 서류 단계에서 수 천 명이 넘는 지원자의 기재된 사실을 확인하는 것이 물리적으로 어렵다 보니 최종 단계에서 증빙서류를 제출할 때 거짓으로 자기소개서를 쓴 사실이 드러나는 경우가 많다.A기업 채용관계자 역시 “자기소개서를 읽어 보면 성장과정이나 직무역량 항목에서 업무에 맞추려고 확대해서 이야기 한 것 같은 경우가 많다”고 말했다. “하지만 직접 검증하는 것이 불가능에 가깝기 때문에 면접에서 구체적으로 물어보는 방법 밖에 없다”고 난감함을 토로했다.이들은 “설사 서류전형을 통과한다고 하더라도 심층면접, 최종단계에서 거짓으로 작성한 내용은 사실이 아닌 것으로 대부분 드러난다”며 “취업준비생들의 절박함은 이해하지만 무작정 자소서를 작성하기보다 기업과 내가 얼마나 잘 맞고 고민하는 단계를 거쳐 진실하게 적었으면 좋겠다”고 바람을 전했다.김지현 기자becreative07@segye.comⓒ 세상을 보는 눈, 글로벌 미디어세계일보"
