,날짜,기사 제목,기사 링크,기사 출처,기사 내용
54,2017-02-17,밟고 차고 던지고…학대 일삼은 '공포의 어린이집',https://news.naver.com/main/read.nhn?mode=LSD&mid=shm&sid1=102&oid=055&aid=0000505558,SBS,"<앵커>친자매 3명이 운영하는 인천의 한 어린이집에서 아동학대가 의심된다고 지난해 9월 SBS가 보도해드렸습니다. 경찰이 수사하며 어린이집 CCTV를 모두 확인해보니 가혹 행위가 당초 알려진 것보다 더 심각한 것으로 드러났습니다. 세 살 배기 아이들을 밟고 차고, 내던지는 충격적인 모습이 담겨있습니다.김정우 기자입니다.<기자>어린이집 교사가 아이의 한쪽 팔을 번쩍 들어 올려 바닥에 내동댕이칩니다.놀란 아이는 곧바로 일어섰지만, 몸을 가눌 새도 없이 다시 한번 내던져집니다.앉아 있는 아이의 허벅지를 있는 힘껏 밟고, 그것도 부족한지 여러 차례 귀를 꼬집습니다.자는 아이의 머리를 발로 '툭' 걷어차기도 합니다.친자매 3명이 운영하는 청라 국제도시의 한 어린이집에서 벌어진 일입니다.밟고, 때리고, 꼬집고 세 살배기 아이들이 감당하기엔 어린이집 교사들의 폭력은 집요하고 악랄했습니다.경찰이 수사에 나선 뒤, CCTV를 확인하게 된 학부모들의 충격은 말할 수 없을 만큼 컸습니다.[임은정/피해 학부모 : 아이들이 CCTV에서 보인 것보다 훨씬 더 학대를 많이 당했을 거라고 생각은 해요. 이런 엽기적인 어린이집이 다시는 우리나라에 발 디딜 수 없게 (해야 합니다.)]경찰은 이들 세 자매가 2015년 12월부터 7개월 동안 한 살부터 3살짜리 어린이 11명을 적어도 40차례 이상 학대한 사실을 확인했습니다.인천지법은 피해 어린이들이 아직도 외상 후 스트레스 장애로 치료를 받는 등 극심한 정신적 고통을 겪고 있다며 친자매 사이인 어린이집 교사 2명에게 각각 징역 2년과 3년의 실형을 선고했습니다.(영상편집 : 김병직)김정우 기자(fact8@sbs.co.kr)※ ⓒ SBS & SBS콘텐츠허브 : 무단복제 및 재배포 금지"
55,2017-02-17,"안희정, 지지율 20% 돌파 '文 추격'…역선택 우려도",https://news.naver.com/main/read.nhn?mode=LSD&mid=shm&sid1=100&oid=055&aid=0000505557,SBS,"<앵커>안희정 충남지사가 지지율 20% 벽을 뚫으면서 문재인 전 대표를 추격의 고삐를 당겼습니다. 심심할 것 같았던 민주당 경선에 흥행 가능성이 커진 셈입니다. 하지만 이른바 '역선택'에 대한 우려도 나왔습니다.강청완 기자가 취재했습니다.<기자>이번 주, 한 여론조사에서 안희정 지사의 지지율은 22%로, 2주 전보다 12%P나 올랐습니다.중도층에서 14%P, 보수층에서 17%P 급등했는데, 최근 중도를 포함한 외연 확장 전략이 주효한 겁니다.[안희정/충남도지사 : 아주 무겁게 더 무거운 마음으로 여론의 흐름을 명심하겠다는 말씀 올립니다.]민주당은 문재인-안희정 양강구도에 한껏 고무돼 있습니다.본선 승리의 디딤돌인 당내 경선 흥행에 큰 도움이 되기 때문입니다.실제로 선거인단 규모는 모집 이틀 만에 30만 명을 넘었습니다.하지만 일반인의 선거인단 신청이 열기를 띠면서, 당내에선 이른바 역선택 신경전이 시작됐습니다.추미애 대표는 박사모가 문재인 전 대표의 당선을 막으려고, 민주당 경선에 참여해 조직적으로 다른 후보를 찍으려 한다고 주장했습니다.문 전 대표도 우려를 나타냈습니다.[문재인/더불어민주당 前 대표 : 조직적으로 역선택을 독려하는 그런 움직임이 있다면 처벌받아야 할 범죄라고 생각해요.]이에 대해 우상호 원내대표가 제동을 걸었습니다.역선택 가능성을 언급하는 건 과거 조직력이 센 사람이 민주적 경선을 막기 위해 말해 왔다고 반박했습니다.이런 가운데 원내정당으로는 처음으로 정의당이 대선 후보로 심상정 상임대표를 선출했습니다.심 대표는 1천만 촛불의 요구를 받들어 노동개혁 정부를 수립하겠다며 완주 의지를 다졌습니다.(영상취재 : 최호준·이재영, 영상편집 : 최은진)강청완 기자(blue@sbs.co.kr)※ ⓒ SBS & SBS콘텐츠허브 : 무단복제 및 재배포 금지"
56,2017-02-17,"말레이 경찰 ""체포 여성들 서로 아는 듯…속이기 능숙""",https://news.naver.com/main/read.nhn?mode=LSD&mid=shm&sid1=100&oid=437&aid=0000148374,JTBC,"[앵커]지금부터는 김정남 살해 사건 수사 속보입니다. 말레이시아 경찰이 여성 용의자 2명을 체포했지만, 사건은 여전히 오리무중입니다. 말레이시아 현지의 취재기자 연결합니다.유선의 기자! 지금 범행 배후에 대해서 현지 경찰이 새롭게 밝힌 게 있습니까?[기자]이곳 말레이시아 경찰은 아직까지 조심스러운 모습입니다. 조금 전 이 사건을 수사하고 있는 부킷아만 경찰청 고위급 간부를 취재했는데요.이 고위급 간부는 ""체포된 여성들이 외국 여권을 갖고 있다고 해서 외국 대리인 소행의 살인으로 단정짓기는 어렵다""고 말했습니다. 이 발언으로 볼 때, 북한과의 연관성에 대한 직접적인 증거 등은 현재 확보하지 못한 것으로 보입니다.이 고위 간부는 또 ""체포된 두 여성이 서로를 알고 있었던 것으로 보이고 누군가를 속이는데 능숙하다""고 말했습니다.[앵커]체포된 여성들은 장난인 줄 알았다, 김정남인 줄 몰랐다고 진술했던데요. 그 말은 믿을 수 없는 것이겠네요.[기자]여성 용의자들은 단순 여행객이라고 주장하지만 이 곳 경찰은 신빙성이 없다고 판단하고 있습니다. 처음 체포된 베트남 여권을 소지하고 있던 여성은 호텔에서 머리를 잘라 변장을 시도했고요, 또 가방에서 독극물 병이 나온 것으로 알려졌습니다.인도네시아 여권을 가진 여성도 체포됐을 때 가지고 있던 여권과 다른 사진과 생년월일이 다른 여권을 가지고 출입국한 기록이 확인돼 단순 여행객은 아닌 걸로 보고 있습니다.두 여성은 또 범행 전날인 12일 공항을 사전 답사했던 것으로 확인됐습니다.[앵커]그리고 오늘 현지 경찰이 여성 용의자 2명의 현장 검증을 실시했다면서요?[기자]네. 현지시간으로 오늘 새벽 1시부터 약 1시간 반 동안 현장검증이 이뤄졌습니다. 인적이 드문 시간에 무장경찰 100여명으로 공항 주변을 경계하면서 극비리에 진행됐는데요.김정남이 살해된 마카오행 발권기 앞과 도움을 청하러 갔던 안내데스크, 그리고 의무실 등에서 실시됐는데요. 말레이시아 경찰은 이 동선을 중심으로 남성 용의자 4명이 포착됐을만한 CCTV를 추려서 확인 작업을 진행하고 있습니다.[앵커]아직 못 잡은 남성 4명의 신원이나 행적에 대해선 좀 더 밝혀진 게 있습니까?[기자]남성 용의자들의 현재 행적에 대해선 드러난 것은 거의 없습니다. 다만 이곳 경찰은 공항 내부의 한 레스토랑에서 이 남성들이 범행 당시에 김정남을 지켜보고 있었다는 정황을 확인해 추적 중입니다.하지만 이후의 움직임은 아직까지 확인되지 않고 있습니다.[앵커]말레이시아에서 유선의 기자였습니다.유선의▶ JTBC 뉴스 공식 SNS[트위터][페이스북][유튜브]Copyright by JTBC(http://jtbc.joins.com)and JTBC Content Hub Co., Ltd. All Rights Reserved. 무단 전재 및 재배포 금지"
57,2017-02-17,"줄 잇는 '육아 박람회', '불황 무풍지대'",https://news.naver.com/main/read.nhn?mode=LSD&mid=shm&sid1=101&oid=214&aid=0000739874,MBC,"[뉴스데스크]◀ 앵커 ▶길게 늘어선 줄이 끝이 안 보일 정도죠?요즘 이만한 손님 끄는 행사가 또 있을까 싶은데, 바로 육아용품 박람회장입니다.방문객 수만 명에 참여 브랜드 수백 개, 불황에도 워낙 인기라 비슷한 박람회가 연간 수십 회씩 열린다는데요.조윤정 기자가 취재했습니다.◀ 리포트 ▶시작까지 30분도 더 남았지만 입구는 벌써 발들일 틈이 없습니다.아기를 안고 유모차를 끌고 만삭의 임산부들까지 1시간여 줄을 선 끝에 입장하자 기다리는 건 선착순 사은품.2천 개가 바로 동났습니다.""마지막입니다. 끝났습니다. 바로 들어가세요.""요즘 육아용품 박람회는 체험형이 대세입니다.아기 띠를 매보고 젖병도 닦아볼 수 있어 초보 부모들에게 인기입니다.[김태영/임산부]""이것저것 다 보고 비교해 볼 수가 있잖아요. 첫 애고 이러니까 괜히 조심스러워서….""수십 가지에 달하는 육아용품을 한 자리에서 비교하며 장만할 수 있다는 게 대형 박람회의 장점.[정선희/2살 아기 엄마]""전화기 장난감, '만원의 행복' 한다고 해서 그래서 구매했어요.""나흘 정도에 방문객 10만 명도 몰리다 보니 청소기 같은 일반 생활용품까지 덩달아 선을 보입니다.하지만, 꼭 알뜰한 것만은 아닙니다.일부 제품은 가격이나 마케팅이 백화점 뺨치는 수준.소량만 판다는 일명 '한정판'에, 박람회에서 처음 선보인다는 수입 유모차는 할인가도 2백만 원을 넘습니다.[유모차 업체 직원]""수석 디자이너가 같이 합작으로 해 가지고 기능은 다 똑같습니다. 디자인 차인데 100만 원 더 비싸고요.""앞다퉈 내미는 사은품에 육아 부담을 덜어준다는 이색 상품까지 눈을 돌리다 보면 충동구매도 예사입니다.[김고은/임산부]""인터넷으로만 봤었는데 직접 보니까는 더 사야겠다는, 구입해야 되겠다는 마음이 더 많이 생기는 것 같아요.""[소기연/임산부]""생각보다 많이 비쌌어요. 국내 제품들도 많이 비쌌고 해외 거는 진짜 100만 원이 넘어가는데….""최근 조사에 따르면 9살 이하 자녀의 월 육아비용은 평균 1백만 원을 넘습니다.한 달 생활비 3분의 1을 차지할 정도로 부담스러운 수준입니다.[윤구임/2개월 아기 엄마]""(비용이) 어른 들어가는 것만큼 이제 좀 들어간다고나 할까. 분유 값도 들어가고, 기저귀도 들어가고….""하지만, 저출산 시대에 내 아이 하나는 잘 키우겠다는 부모들의 바람에 육아용품 박람회는 불황 무풍지대.2000년 처음 등장해 이제는 베이비 페어'란 말이 굳어질 정도로 호황을 누리며 올 상반기에만 50차례 가까이 예정돼 있습니다.MBC뉴스 조윤정입니다.조윤정기자 (cyjung@imbc.com)[저작권자(c) MBC (www.imnews.com) 무단복제-재배포 금지]Copyright(c) Since 1996,MBC&iMBCAll rights reserved."
58,2017-02-17,"""한국인 싫어요"" 日 유치원, 학부모에 황당 편지",https://news.naver.com/main/read.nhn?mode=LSD&mid=shm&sid1=104&oid=214&aid=0000739877,MBC,"[뉴스데스크]◀ 앵커 ▶일본의 한 유치원이 한국과 한국인을 향한 혐오감을 여과 없이 담은 문서를 학부모들에게 배포했습니다.아베 총리의 부인이 명예 교장이라는 이 유치원에서 군국주의 교육도 이루어지고 있어 논란이 끊이지 않습니다.도쿄 전재호 특파원입니다.◀ 리포트 ▶호국신사 앞에서 2차 세계대전 당시 군가를 부르는 유치원생들.""애국의 혈기 속에 아직 남아있습니다.""일왕의 나라에 영광을 위하여 돌격했던 일본군대의 외침을 노래합니다.""황국이여 항상 영광이 있으라.""일본 오사카에 있는 이 유치원이 학부모들에게 보낸 편지에는 비뚤어진 사고방식을 가진 한국인이 싫다고 적혀 있었습니다.""한국인은 선동하는 사람들이고 금붕어 똥처럼 따라붙는 사람들""이라는 경멸적인 표현까지 담고 있습니다.아이들 앞에서도 혐한 발언을 늘어놨다고 일본 언론들은 보도했습니다.일왕의 초상화와 일장기 앞에서 일본 군가를 가르치는 등 군국주의 교육도 모자라, 혐한 정서까지 아이들에게 심고 있다는 비판이 쏟아지고 있습니다.운영재단이 발간한 책자에는 아베 총리의 부인 아키에 여사를 명예 교장으로 소개하고 있습니다.[학교 관계자]""아베 신조 총리가 생각하는 것과, 우리 학교가 생각하는 바는 똑같습니다.""오사카 총영사관은 강한 항의와 함께 시정조치를 요구했고 시당국은 헤이트 스피치, 즉 특정집단을 향한 혐오발언 금지 법률을 위반했는지 조사에 나섰습니다.도쿄에서 MBC뉴스 전재호입니다.전재호기자 (onyou@mbc.co.kr)[저작권자(c) MBC (www.imnews.com) 무단복제-재배포 금지]Copyright(c) Since 1996,MBC&iMBCAll rights reserved."
59,2017-02-17,반짝 추위 기승…일요일부터 풀려,https://news.naver.com/main/read.nhn?mode=LSD&mid=shm&sid1=103&oid=449&aid=0000124007,채널A,"이대로 끝날 것만 같았던 추위가 절기 '우수'를 앞두고 다시 강해졌습니다.오늘 밤 10시를 기준으로, 경기북부와 영서북부에 한파특보가 내려졌고요.내일 아침 전국이 일제히 영하로 내려갑니다.서울 -7도, 대관령 -14도까지 떨어지면서, 반짝 추위가 기승을 부리겠습니다.일요일은 기온이 점차 올라 추위가 금세 풀리겠습니다.오후부터는 점차 비나 눈이 시작되니까요.나들이 계획에 참고하셔야겠습니다.내일도 전국이 맑겠고, 대기 질도 양호하겠습니다.중부지방 아침 기온은 대부분 -5도 아래로 내려가겠고, 낮 기온은 서울이 3도 대전 5도 까지 오르겠습니다.남부지방도 전주 -5도, 안동 -7도 까지 떨어지면서 일교차가 크게 벌어지겠습니다.동해안과 일부 영남은 건조특보가 계속되고 있죠.주말 사이에도 산불 등 대형 화재 예방에 신경 쓰시기 바랍니다.내일 동해 먼바다를 중심으로 바람이 강하게 불겠고, 물결도 최고 4m 까지 높게 일겠습니다.월요일과 수요일은 전국에 비나 눈이 오겠고, 그사이 또 한 번 반짝 추위가 예보돼 있습니다.날씨였습니다.9분기 연속 종편 1위! 채널A 시청자 만족도 A+ ⓒCHANNEL A(www.ichannela.com), 무단 전재 및 재배포 금지"
60,2017-02-17,"문재인-안희정, '여론조사·역선택' 문제 놓고 신경전 가열 ",https://news.naver.com/main/read.nhn?mode=LSD&mid=shm&sid1=100&oid=421&aid=0002567674,뉴스1,"문재인 더불어민주당 전 대표(오른쪽)와 안희정 충남도지사가 15일 오후 서울 구로구 성공회대학교 성미가엘성당에서 열린 故 신영복 선생 1주기 추모식에서 대화를 나누고 있다.  2017.1.15/뉴스1 © News1 신웅수 기자文측 ""역선택 끼어든 왜곡된 조사""安측 ""통합 외치며 국민 피아로 구분""(서울=뉴스1) 김현 기자,조소영 기자,서미선 기자 = 더불어민주당의 대권주자인 안희정 충남도지사가 17일 '마의 20%'의 지지율을 돌파한 가운데, 각종 여론조사에서 1·2위를 달리고 있는 문재인 전 더불어민주당 대표와 안 지사 측간 신경전이 가열되고 있다.특히 안 지사의 지지율 상승을 중도·보수층에서 견인하고 있는 데다 박사모 등 일부 보수 진영에서 민주당 경선 선거인단 모집 참여 움직임을 보이면서 ‘역선택’ 가능성을 둘러싼 논란으로 확산되고 있는 흐름이다.여론조사 전문업체인 한국갤럽이 17일 발표한 2월 셋째주 대선 후보 지지도 자체 조사(표본오차 95% 신뢰수준에 ±3.1%포인트, 응답률 20%, 그 밖의 사항은 중앙선거여론조사심의위원회 홈페이지를 참조) 결과, 문 전 대표는 전주 대비 4%포인트가 상승한 33%를 얻으며 일주일만에 다시 30%대를 회복했다.안 지사는 지난주보다 3%포인트가 오른 22%를 얻으며, 처음으로 20%의 벽을 넘어섰다.일단 문 전 대표와 안 지사는 이번 여론조사 결과에 대해 모두 긍정적인 반응을 보였다.문 전 대표는 이날 서울의 한 재활병원을 방문한 뒤 기자들과 만나 ""저도 지지도가 오르고, 안 지사도 지지가 올라 정말 기쁘다. 두 사람 지지도만 합쳐도 50%를 넘고, 이재명 성남시장까지 합치면 50%를 더 훌쩍 넘는다""며 ""그만큼 우리 당의 외연이 넓어지고, 정권교체의 가능성을 키우는 것이다. 한편으론 경선이 좀 더 흥미진진해지면서 국민들의 관심을 더 크게 끌어 모을 수 있지 않겠느냐""고 밝혔다.안 지사는 충북 오송 첨단의료산업단지를 방문한 뒤 기자들과 만나 ""지난 몇 달 동안 낮은 지지율이 미동도 하지 않았을 때나 지금이나 마음은 같다. 아주 무겁게, 더 무거운 마음으로 여론의 흐름을 명심하겠다""면서 ""오로지 새로운 대한민국과 새로운 시대를 향해 온 국민의 힘을 모아서 도전할 것""이라고 말했다.다만, 양측간 물밑 신경전도 엿보인다. 문 전 대표측은 이날 뉴스1과 통화에서 ""안 지사의 상승세가 경선에 좀 더 관심을 갖게 할 것 같아 전체적인 틀에선 바람직하게 생각한다""면서도 ""당 지지율(44%)에 비해 우리당 후보의 합이 높은 이번 여론조사는 '샤이 보수' 문제와 역선택이 끼어든 상당히 왜곡된 조사로 보인다""고 주장했다.이에 대해 안 지사측의 한 관계자는 ""'국민통합 대통령'을 외치는 문 전 대표측이 역선택 가능성을 얘기하는 것은 국민을 피아로 구분하겠다는 것 아니냐""면서 ""문 전 대표측의 역선택 문제 이슈화는 완전국민경선제의 취지를 부정하는 것""이라고 지적했다.여기에 선거인단 모집을 두고도 '역선택' 논란이 커지고 있다. 지난 15일 박사모가 '문재인 후보가 되는 건 무조건 막아야 한다'는 내용과 함께 민주당 선거인단 참여를 독려하는 공지가 SNS 등에서 퍼진 게 발단이 돼 첫 경선지인 호남에서 특정후보 캠프측의 '위장전입 투표' 가능성까지 거론되고 있다.당장 추미애 대표는 이날 국회에서 열린 최고위원회의에서 역선택 가능성에 대한 우려를 표하면서 ""박사모 등 특정세력이 특정후보를 겨냥하면서 방해를 하려는 태세가 보인다. 특정후보를 떨어뜨리겠다는 말을 유포하면서 다른 당 선거를 훼방 놓는 것은 선거의 자유를 방해하는 중차대한 범죄행위""라고 법적조치 검토 방침을 밝혔다.문재인 전 대표 역시 이날 기자들과 만나 ""우리가 국민경선을 하는 이상 어느 정도 자연적인 역선택은 있을 수 있는 일이지만, 경쟁하는 정당에서 의도적·조직적으로 역선택을 독려하는 움직임이 있다면 그것은 대단히 비열한 행위이자 처벌받아야 할 범죄행위""라고 날을 세웠다.이와 달리 우상호 민주당 원내대표는 이날 기자들과 만나 ""정치권에서 많이 거론되지만 실체가 입증되지 않은 게 역선택이다. 늘 역선택의 여지가 있다고 하는데 한 번도 증명된 예가 없다""며 ""조직 강한 사람이 국민경선을 막기 위한 논리로 역선택 여지를 얘기해 왔다. 역선택을 얘기하는 사람은 조직이 센 사람""이라고 말했다.우 원내대표는 ""이번 경선은 국민경선이기 때문에 역선택이라는 용어는 실체도 없고 불가능하다""고 말했고, 첫 경선지인 호남에서 특정후보 캠프의 ‘위장전입 투표’ 가능성이 거론되는 데 대해 ""현실적으로 가능하다는 건 인정하지만 조직적으로 수 만명을 움직여서 하는 건 불가능하다. 어느 미친 후보자가 사무실 만들어 선관위 추적을 피해 사람을 고용해 일당을 줘가며 그런 짓을 하겠느냐. 일주일은 모르지만 열흘 이상이면 다 걸리게 돼 있다""고 일축했다.이와 관련, 양승조 당 선관위 부위원장은 기자간담회에서 ""어제 박사모가 실질적으로 선동을 하지 않았느냐. 한마디로 비열하고 야비한 짓이다. 이런 선동에 끌려 선거인단으로 신청하는 것을 법적으로 제재할 방법은 마땅치 않다""면서도 ""다만 선동하는 사람에 대해선 선거자유 방해죄나 업무방해죄로 규율할 수 있다는 법률검토가 있어 당에서 그렇게 조치할 것""이라고 밝혔다.양 부위원장은 다만 ""역선택이 현실화될 때는 정권교체를 갈망하는 국민이 역선택을 덮어버릴 정도로 더 많이 선거인단으로 참여해 이를 작동하지 못하게 할 것""이라며 ""역선택에 대한 일반적 우려는 있지만, 실제로 역선택이 벌어져 경선 결과를 좌지우지할 것인지는 아직 우려할만한 점이 드러나지 않았다""라고 말했다.gayunlove@news1.kr▶ 놓치면 후회! 최신 무료만화 보기/2017년 나의 운세 보기[© 뉴스1코리아(news1.kr), 무단 전재 및 재배포 금지]"
61,2017-02-17,"대통령 출석 언급에…""질문 다 받아야"" 못 박은 헌재",https://news.naver.com/main/read.nhn?mode=LSD&mid=shm&sid1=100&oid=055&aid=0000505549,SBS,"<앵커>어제(16일) 헌법재판소가 탄핵 심판 최종 변론을 오는 24일 하겠다고 밝히자, 대통령 측 대리인단은 박근혜 대통령이 직접 출석하는 카드를 언급했습니다. 시간을 좀 끌었으면 좋겠다는 건데요, 헌법재판소는 대통령이 나오는 건 좋은데 혼자 하고 싶은 말 하고 끝나는 건 안 되고 국회 측과 재판부의 질문을 모두 받아야 한다고 못 박았습니다.보도에 박하정 기자입니다.<기자>대통령 측은 어제 최종 변론 기일이 정해지자 대통령이 직접 헌재에 나올지를 논의해보겠다고 밝혔습니다.하지만, 이때 대통령이 따로 질문은 받지 않을 거라고 말했습니다.[이중환/변호사 (대통령 측 대리인) : 재판부도 물어볼 수 없습니다. 모든 변론이 종결되고 난 다음 최후진술은 상호 간에 자기 의견을 진술하는 것이기 때문에 (대통령에 대한) 신문 절차는 없습니다.]이에 대해 헌재는 대통령이 나올 경우 질문을 받아야 한다고 분명히 밝혔습니다.헌재법에 따라 대리인이 아닌 본인에게 소추위원 혹은 재판부가 질문할 수 있다는 겁니다.물론 질문에 대통령이 답을 하지 않을 수 있습니다.하지만, 재판부가 의혹을 풀지 못해 질문했는데도 답변하지 않는다면 오히려 불리한 심증만 남길 수 있습니다.헌재는 또, 다음 주 월요일에 신문이 예정된 증인 2명이 불출석 사유서를 제출했다고 밝혔습니다.이 가운데 1명은 불출석 이유가 '해외 출장'으로 근거가 있었지만, 헌재는 다시 부르지 않기로 했습니다.탄핵 소추 사유와 연관된 핵심 증인이 아니라는 판단입니다.대통령 출석과 증인 신문에 대한 오늘 헌재의 태도에선 8인 재판관 체제가 유지되는 3월 13일 이전 선고라는 로드맵을 무너뜨리지 않겠다는 의지가 보였습니다.(영상취재 : 최준식, 영상편집 : 조무환)박하정 기자(parkhj@sbs.co.kr)※ ⓒ SBS & SBS콘텐츠허브 : 무단복제 및 재배포 금지"
