,날짜,기사 제목,기사 링크,기사 출처,기사 내용
125,2017-02-17,궁지몰린 IS…무슬림國까지 막가파식 테러,https://news.naver.com/main/read.nhn?mode=LSD&mid=shm&sid1=104&oid=009&aid=0003890832,매일경제,"파키스탄·이라크서 동시다발…사망자 각각 최소 88명·45명동남亞로 타깃 넓히나…비상수니파 극단주의 무장단체 이슬람국가(IS)의 무차별적 테러가 종파를 가리지 않는 극악적인 형태로 벌어지고 있다.이라크, 시리아 등 주요 점령지에서 패퇴를 거듭하고 있는 상황을 테러로 모면하려 한다는 분석이다. 특히 파키스탄에서 발생한 테러는 IS의 영향력이 서남아시아와 동남아시아의 무슬림 국가로 확대될 가능성이 커진다는 점에서 우려가 증폭되고 있다. 파키스탄 쿠즈다르의 이슬람 신비주의 종파인 수피교 성지에서 16일(현지시간) IS의 자살 폭탄 테러로 최소 88명이 사망하고 250명이 다치는 참사가 벌어졌다. 올해 세계에서 발생한 테러 가운데 최악의 인명 피해다.이날 파키스탄 남부의 신드 주 관계자는 수피교 사원인 랄 샤바즈 칼란다르 사원에서 폭탄 테러가 일어나 이 같은 규모의 인명 피해가 발생했다고 밝혔다.익명을 요구한 현지 관리들은 사망자 가운데는 여성 20명과 어린아이 9명도 포함됐다고 전했다.이날은 수피파에 성스러운 날로 당시 사원에서는 많은 신자가 저녁 예배를 마치고 '다말'이라는 수피교 의식을 하느라 모여 있던 중이었다. 다말은 석양 무렵에 한자리에 서서 빙글빙글 돌며 춤을 추는 의식을 뜻한다.IS는 이번 테러가 자신들의 소행이라고 밝혔다. IS는 지난해 11월에도 파키스탄 남부 발루치스탄 주에 있는 수피교 성지에서 자폭 테러를 벌여 52명이 숨지고 102명이 다쳤다. 이날 IS는 쇼핑객들로 붐비던 이라크 바그다드의 한 상업지구에서 차량 폭탄 테러를 자행해 최소 45명이 사망하고 56명을 다치게 했다. 이날 테러는 지난해 7월 바그다드 상업지역 알카라다에서 벌어진 폭탄 테러(사망자 320여 명) 이후 이라크 내 최대 사상자를 낸 것으로 집계됐다.IS는 테러 직후 인터넷을 통해 시아파가 모인 곳을 겨냥해 벌인 자신들의 소행이라고 주장했다. IS는 근거지인 이라크 북부 모술에서 지난해 10월 개시된 이라크군의 군사작전에 압박받자 수도 바그다드에서 폭탄 테러로 반격해왔다. 특히 시아파 지역에서 폭탄 테러를 벌이면서 종파 간 갈등을 유발하고 있다.[장원주 기자][매일경제 공식 페이스북][오늘의 인기뉴스][매경 프리미엄][ⓒ 매일경제 & mk.co.kr, 무단전재 및 재배포 금지]"
126,2017-02-17,"코스피, 2080선 턱걸이…삼성그룹주 일제히 약세",https://news.naver.com/main/read.nhn?mode=LSD&mid=shm&sid1=101&oid=018&aid=0003752568,이데일리,"- 개인·외국인 순매도…금융투자·연기금 등 기관 '사자'- 이재용 부회장 구속 여파, 삼성물산 2% 하락[이데일리 박형수 기자] 코스피 지수가 이틀 연속 약세 흐름을 보였다. 이재용 삼성전자 부회장 구속 소식이 전해지며 삼성 그룹주가 일제히 하락한 여파가 지수에도 영향을 줬다.17일 마켓포인트에 따르면 코스피는 전 거래일보다 1.26포인트(-0.06%) 내린 2080.58을 기록했다. 이날 지수는 9.27포인트 내린 2072.57로 거래를 시작했다.간밤 뉴욕증시는 최근 급등에 따른 부담으로 혼조 마감했다. 16일(현지시간) 뉴욕증권거래소에서 다우존스 산업평균지수는 전날보다 7.91포인트(0.04%) 오른 2만619.77을 기록했다. 다우지수는 장 막판 상승 반전에 성공하며 가까스로 사상 최고치 행진을 이어갔다. 스탠다드앤드푸어스(S&P) 500 지수는 2.03포인트(0.09%) 내린 2347.22로 장을 마쳤고, 나스닥 지수 역시 4.54포인트(0.08%) 떨어진 5814.90를 나타냈다.수급에선 개인과 외국인이 각각 923억원, 655억원 순매도를 기록했다. 기관은 1136억원 매수 우위를 보였다. 기관 가운데 금융투자와 연기금이 각각 663억원, 461억원 순매수를 기록했다. 프로그램 매매에선 차익과 비차익을 합쳐 322억원 규모의 순매수 물량이 유입됐다.업종별로는 희비가 엇갈렸다. 유통업종이 2.4% 내리면서 가장 두드러진 하락세를 보였다. 뒤이어 보험(-0.58%) 기계(-0.46%) 서비스(-0.33%) 섬유·의복(-0.21%) 업종 등이 내렸다. 철강·금속(0.63%) 비금속광물(0.42%) 화학(0.33%) 운송장비(0.33%) 전기가스(0.28%) 업종 등은 올랐다.시가총액 상위 종목은 삼성 그룹주를 제외한 대다수 상장사가 올랐다. SK하이닉스(000660)가 1.61% 올랐고 현대모비스(012330) 포스코(005490) 등도 1% 이상 올랐다. 대장주 삼성전자(005930)는 전날보다 0.42% 내린 189만3000원으로 거래를 마쳤다. 삼성물산(028260) 삼성생명(032830)도 1% 이상 내렸다. 호텔신라우(008775)선주는 가격제한폭까지 올랐다.이날 거래량은 2억9587만주를 기록했고 거래대금은 4조2655억원으로 집계됐다. 상한가 종목 2개를 포함해 403개 종목이 올랐다. 하한가 종목은 없었고 389개 종목이 내렸다. 85개 종목은 보합으로 거래를 마쳤다.박형수 (parkhs@edaily.co.kr)＜ⓒ종합 경제정보 미디어 이데일리 - 무단전재 & 재배포 금지＞"
127,2017-02-17,"특검, 임의제출식 靑압수수색 안 해…'각하' 항고검토",https://news.naver.com/main/read.nhn?mode=LSD&mid=shm&sid1=100&oid=421&aid=0002567098,뉴스1,"(뉴스1 DB) /뉴스1 © News1 김명섭 기자강제집행여부 질문에 ""영장집행 기한 28일까지""(서울=뉴스1) 조재현 기자,최은지 기자 = 박영수 특별검사팀이 법원에 낸 청와대 압수수색 불승인 처분의 집행정지신청이 각하된 가운데, 특검이 청와대가 요구하는 임의제출 형식의 압수수색은 고려하지 않고 있다는 원칙을 재강조했다.특검대변인 이규철 특검보는 17일 오후 정례브리핑에서 '임의제출 형태로 청와대 자료를 받을 계획이 있느냐'는 질문에 이같이 밝혔다.특검은 법원의 집행정지 각하와 관련해 결정문에 나타난 법리를 다각도로 살펴 항고 여부 등을 검토, 7일 내 항고여부를 결정짓는다는 방침이다.서울행정법원 행정4부(부장판사 김국현)는 특검이 청와대 측 비서실장·경호실장을 상대로 낸 집행정지사건에서 ""행정소송법상 군사상·직무상 비밀의 압수를 승낙하지 않은 경우 소송을 허용하는 규정이 없어 다툴 수 없다""며 특검 측 신청을 각하했다.이 특검보는 '항고를 해도 기각, 각하 가능성이 있는데 압수수색영장 강제집행 가능성은 배제하고 있느냐'는 질문에 ""청와대 압수수색 영장은 집행기한이 28일까지다. 이에 항고 여부를 우선적으로 결정할 것""이라며 ""나머지 가능성도 열어뒀다""고 말했다.특검은 지난 3일 청와대에 대한 압수수색에 나섰으나 경내 진입을 허용하지 않은 청와대 측과 대치하다가 결국 5시간여만에 철수했다.이에 특검은 황교안 대통령 권한대행 겸 국무총리에게 청와대 압수수색을 할 수 있도록 협조요청 공문도 보냈으나 황 권한대행이 이를 거부했다.이후 특검은 지난 10일 서울행정법원에 압수수색영장 집행 불승인 처분에 관한 취소 소송과 함께 집행정지도 신청했다.특검은 현재 박근혜 대통령과 국정농단사건의 몸통 최순실씨가 두 대의 차명 휴대전화로 수백여차례 통화를 한 증거가 청와대 경내에 남아있다며 압수수색 필요성을 강조하고 있다.cho84@▶ 놓치면 후회! 최신 무료만화 보기/2017년 나의 운세 보기[© 뉴스1코리아(news1.kr), 무단 전재 및 재배포 금지]"
128,2017-02-17,"장시호 ""허승욱·이규혁, 영재센터 운영·출연금 사용 책임져야""",https://news.naver.com/main/read.nhn?mode=LSD&mid=shm&sid1=100&oid=421&aid=0002566978,뉴스1,"‘국정 농단' 사태의 핵심인 최순실 씨의 조카 장시호씨. 2017.2.17/뉴스1 © News1 이재명 기자張 ""모든 일을 내가 시켜서 했다는 주장은 변명""(서울=뉴스1) 문창석 기자,김일창 기자 = 최순실씨의 조카 장시호씨(38)가 자신이 사무총장으로 있던 한국동계스포츠영재센터(영재센터) 운영과 수십억원의 대기업 출연금 사용 등과 관련해 그 책임을 영재센터 전직 대표·임원들에게 돌렸다.서울중앙지법 형사합의22부(부장판사 김세윤) 심리로 17일 열린 장씨와 김종 전 문화체육관광부 2차관(56), 최순실씨(61)에 대한 3회 공판에서 재판부는 지난 16일 장씨 측이 이런 내용의 의견서를 제출했다고 밝혔다.재판부에 따르면 장씨 측은 삼성이 영재센터에 낸 후원금을 당시 영재센터의 회장과 전무이사이던 허승욱씨·이규혁씨가 스키·빙상캠프 전지훈련 비용 등으로 사용했다고 주장했다. 장씨 측은 코치 선임과 영재 선발도 모두 이들이 했다고 진술했다.장씨 측은 또 ""모든 일을 장씨가 시켜서 했다고 (허씨와 이씨가) 주장하는 건 해선 안 되는 변명이고, 자신들이 한 일에 대해서는 책임을 져야 한다고 진술했다""고 밝혔다.장씨 측은 지난 10일 공판에서 허씨가 한 증언도 반박했다. 당시 허씨는 증인으로 출석해 ""나는 영재센터 회의에 참석한 적이 한 번도 없고, 센터 운영에 직접 관여한 바도 없다""고 증언한 바 있다.재판부는 ""이에 대해서도 장씨 측이 의견서를 제출했다""며 ""장씨는 허씨의 증언을 자세하게 반박하는 내용으로 의견을 진술했다""고 설명했다.한편 이날 공판에선 장씨가 영재센터 운영과 관련해 책임이 있다고 지목한 이씨가 오후 2시30분 증인으로 출석했다. 이씨는 유명한 스피드스케이팅 국가대표 선수로 대중에게 알려졌다. 그는 영재센터 등 자신과 장씨를 둘러싼 각종 의혹에 대한 경위를 밝힐 예정이다.전 스피드스케이팅 국가대표 출신 이규혁씨가 17일 오후 서울 서초구 서울중앙지법에서 열린 최순실 국정농단 재판에 증인으로 출석하고 있다. 2017.2.17/뉴스1 © News1 신웅수 기자themoon@news1.kr▶ 놓치면 후회! 최신 무료만화 보기/2017년 나의 운세 보기[© 뉴스1코리아(news1.kr), 무단 전재 및 재배포 금지]"
129,2017-02-17,"재건축영향 가격 상승폭 커져, 서울 주간 0.06%↑",https://news.naver.com/main/read.nhn?mode=LSD&mid=shm&sid1=101&oid=011&aid=0002976429,서울경제,
130,2017-02-17,재건축 영향 가격 상승폭 커져…서울 주간 0.06%↑,https://news.naver.com/main/read.nhn?mode=LSD&mid=shm&sid1=101&oid=011&aid=0002976429,서울경제,
131,2017-02-17,낙마에 제안 거절까지…'사면초가' 트럼프,https://news.naver.com/main/read.nhn?mode=LSD&mid=shm&sid1=104&oid=008&aid=0003824147,머니투데이,"[머니투데이 김영선 기자]백악관에서 기자회견을 하는 도널드 트럼프 미 대통령.  &#169; AFP=뉴스1  <저작권자 &#169; 뉴스1코리아, 무단전재 및 재배포 금지>인사 조치를 놓고 도널드 트럼프 미국 대통령이 더욱 사면초가로 몰리는 모양새다. 잇단 지명자 낙마에 정권 초기임에도 제안을 거절하는 사태까지 발생하고 있다.16일(현지시간) 파이낸셜타임스(FT)는 복수의 관계자 발언을 인용, 마이클 플린 전 국가안보회의(NSC) 보좌관 후임으로 지명된 로버트 하워드 예비역 제독이 보좌관직 제안을 고사했다고 보도했다.한 관계자는 ""하워드가 군인으로서 사명감과 (보좌관직) 수락시 발생할 불가피한 부작용 사이에서 고민했다""고 말했다. 또 다른 관계자는 ""백악관이 하워드의 생각을 돌리기 위해 설득 중""이라고 전했다.제안을 받았을 당시 하워드는 ""며칠만 생각할 시간을 달라""고 했고 자신의 오랜 상사였던 제임스 매티스 국방장관으로부터 ""대통령의 제안을 받아들여라""고 조언까지 들었으나 끝내 거절한 것이다.닐 고서치 대법관 지명자에 대한 인준 여부도 여전히 미지수다. 미 상원 법사위원장인 척 그래슬리 의원은 오는 3월 20일 고서치 지명자에 대한 인준청문회를 시작할 것이라고 밝혔지만 전망은 밝지 않다.앞서 트럼프 대통령은 지난 1월 31일 고서치를 대법관으로 지명했으나 민주당은 고서치에 대한 인준 절차를 지연해왔다.현재 미 대법관은 앤터닌 스캘리아 대법관의 사망으로 1년간 공석 상태다. 지난해 버락 오바마 전 대통령이 메릭 갈랜드 판사를 후임으로 지명했지만 새로운 정권에서 임명해야 한다는 공화당의 반대로 청문회조차 열리지 못했다.월스트리트저널(WSJ)도 이 부분에 대한 민주당의 불만이 계속되고 있다고 진단했다.민주당은 최근 고서치에게 제기된 하버드대학 시절 봉사활동 이력 등에 대한 의혹을 철저히 검증하겠다는 태세다. 트럼프의 이른바 '사법부 공격'을 비난한 고서치의 발언이 민주당의 마음을 돌릴 수 있을지 변수다.한편 이날 트럼프 대통령은 불법 이민자 가정부 고용, 사내 성희롱, 가정폭력 등으로 자진사퇴 한 앤드루 퍼즈더 대신 새로운 노동장관으로 알렉산더 아코스타 전 플로리다주 연방검사를 지명했다.쿠바 태생인 아코스타는 트럼프 대통령이 내각 각료로 지명한 첫 히스패닉계 인사다. 미국 인구의 17%를 차지하는 히스패닉계를 내각에 단 한 명도 등용하지 않았다는 비판을 의식한 것으로 보인다.일각에선 아코스타가 퍼즈더에 비해 상대적으로 '주류'에 가까운 인물인 만큼 트럼프가 취임 한 달 만에 혼란에 휩싸인 백악관 상황을 해소해보려는 의도라고 분석했다.김영선 기자 ys8584@mt.co.kr<저작권자 ⓒ '돈이 보이는 리얼타임 뉴스' 머니투데이, 무단전재 및 재배포 금지>"
132,2017-02-17,사흘째 멈춰선 국회…與野 정상화 합의 또 무산,https://news.naver.com/main/read.nhn?mode=LSD&mid=shm&sid1=100&oid=014&aid=0003778328,파이낸셜뉴스,"여야 4당이 17일 2월 임시국회 정상화를 위해 논의했지만 또다시 결론을 내지 못했다. 이에 따라 당분간 국회 공전이 계속될 전망이다.자유한국당 김선동·국민의당 김관영·바른정당 정양석 원내수석부대표는 이날 국회에서 만나 협상에 나섰다. 한국당이 지난 14일 환경노동위원회가 야당 단독으로 삼성전자·MBC·이랜드 청문회를 통과시킨 데 대한 반발로 상임위를 보이콧한 가운데 이를 정상화하기 위해서다.더불어민주당 박완주 원내수석은 지역일정 때문에 참석하지 못했지만 전화상으로 의견을 나눴다.김선동 원내수석은 회동 직후 기자들과 만나 ""여전히 이견이 있어 합의하지 못했다""며 ""주말에 계속 대화를 해가면서 접점을 찾기 위해 노력해보겠다""고 밝혔다.김 원내수석은 ""환노위에서 발생한 일이지만 국회법상 소수자를 보호하는 규정을 다수당이 전용했기 때문에 국회운영에 있어 전례가 있어서는 안 된다는 입장""이라며 ""재발방지 문제, 환노위에서 이 문제를 어떻게 처리할 것인지 등을 결자해지 차원에서 해야 한다고 민주당 측에 요구했다""고 전했다.현재 한국당은 환노위에서 결정한 3개 청문회에서 MBC를 제외해줄 것을 요구하고 있다. 간사 간 합의 없이 결정된 문제인 만큼 원상회복 수준의 조치가 있어야 한다는 것이다. 다만 민주당은 이를 수용하지 않는 상황이다.김 원내수석은 ""큰 간극의 문제가 남아 있어 합치가 되지 않고 있다. 고민이 많지만 노력하겠다""며 ""유선상으로 연락하면서 조율하겠다""고 덧붙였다.ehkim@fnnews.com 김은희 기자▶ 세상의 모든 골 때리는 이야기 'fn파스'▶ 속보이는 연예뉴스 fn스타※ 저작권자 ⓒ파이낸셜뉴스. 무단 전재-재배포 금지"
133,2017-02-17,"특검 ""이재용 구속 '안종범 수첩' 결정적 역할""",https://news.naver.com/main/read.nhn?mode=LSD&mid=shm&sid1=100&oid=008&aid=0003824183,머니투데이,"[머니투데이 박보희 기자, 양성희 기자]뇌물공여 등의 혐의를 받고 있는 이재용 삼성전자 부회장이 지난 16일 오후 서초동 서울중앙지법에서 두번째 영장실질심사를 마친 뒤 구치소로 이동하고 있다.박영수 특별검사팀은 '안종범 수첩'이 이재용 삼성전자 부회장을 구속할 수 있었던 결정적 증거가 됐다고 밝혔다.특검 대변인 이규철 특검보는 17일 정례 브리핑에서 ""안종범 수첩에 있던 자료가 상당히 중요한 자료의 일부였다""고 밝혔다.특검은 이 부회장에 대한 1차 구속영장이 기각된 후, 보강 수사를 통해 안종범 전 청와대 정책수석의 39권의 업무 수첩을 추가로 확보했다.특검이 이 부회장 구속에 성공할 수 있었던 것은 삼성 측이 '비선실세' 최순실에게 제공한 금품을 이 부회장이 경영권을 승계받는 과정 전반에 도움을 받기 위한 것으로 확대해 분석한 것이 주요했다.이 특검보는 ""지난 번에는 뇌물죄 대가관계가 삼성물산과 제일모직 합병의 대가로 구성돼있었지만, 영장 기각 이후에 3주간 수사해본 결과 이것은 삼성물산과 제일모직 합병 만이 아니라 삼성 경영권 승계 과정 전반에 다 관련된 것으로 판단했다""고 설명했다.이어 ""그 과정 속에서 1,2,3차 독대가 이뤄졌고 그 과정에서 지속적으로 금원이 제공된 점을 파악했다""며 ""이 같은 취지로 피의사실을 변경해 청구한 것이 주효한 것으로 알고 있다""고 말했다.이 특검보는 ""추가적으로 그 과정에서 횡령 금액 늘어난 점, 허위 계약서라든지 이런 부분이 밝혀져서 혐의 추가된 것이 영장 발부 원인 아닌가 생각한다""고 덧붙였다.특검은 이 부회장을 추가 조사한 후 수사기간이 종료되기 전에 기소할 방침이다. 이 특검보는 ""수사기간 만료를 고려해서 추가 조사 후 기소할 예정""이라고 말했다.특검은 전일 구속영장이 기각된 박상진 삼성전자 대외협력담당 사장과 피의자로 입건한 최지성 미래전략실 실장(부회장),장충기 미래전략실 차장(사장), 황성수 삼성전자 전무 등의 신병처리 여부에 대해서는 향후 이 부회장 기소 시점에 결정할 예정이다.[▶이코노미스트들의 깊이있는 투자정보 'TOM칼럼'][▶하태핫태! '치어리더'][▶내 삶을 바꾸는 정치뉴스 'the 300'][▶트렌드 리더의 스타일 지침서 '스타일M'][▶빵빵한 차 & 레이싱걸]박보희 기자 tanbbang15@mt.co.kr, 양성희 기자 yang@mt.co.kr<저작권자 ⓒ '돈이 보이는 리얼타임 뉴스' 머니투데이, 무단전재 및 재배포 금지>"
134,2017-02-17,"헌재 ""대통령 최종변론 출석시 국회측·재판부서 질문 가능""",https://news.naver.com/main/read.nhn?mode=LSD&mid=shm&sid1=100&oid=001&aid=0009043019,연합뉴스,"대통령 측 ""최후진술만 들을 수 있고 신문은 안돼""박 대통령 헌재 최종변론 참석할까(CG)[연합뉴스TV 제공](서울=연합뉴스) 김태종 기자 = 박근혜 대통령의 출석 여부가 탄핵심판의 최대 관심사로 떠오른 가운데 대통령이 출석하면 신문을 받을 것으로 보인다.헌재 관계자는 17일 정례브리핑에서 ""대통령이 최종변론에 출석하는 경우 소추위원이나 재판부에서 질문을 할 수 있다""고 밝혔다.대통령이 자신의 방어권을 위해 최종변론에서 진술을 하는 만큼 상대 측이나 재판부에도 똑같이 신문의 기회가 주어져야 한다는 것이다.대통령 측은 지난 16일 탄핵심판 14차 변론이 끝난 뒤 ""최종변론에서는 양측의 최종 의견과 대통령의 최후진술만을 들을 수 있을 뿐 별도의 신문 절차가 진행될 수 없다""며 신문 가능성을 일축한 바 있다.헌재는 그러나 일반 재판의 경우에는 증거조사 방법으로 당사자 신문은 안되지만, 탄핵심판의 경우 소추위원은 물론 재판부도 질문을 할 수 있도록 관련법에서 규정하고 있다고 설명했다.단지, 신문을 받았을 때 답변을 하느냐, 하지 않느냐는 대통령이 알아서 판단할 문제라고 헌재는 설명했다.또 대통령이 최후진술만 하고난 뒤 질문을 받지 않고 그냥 나가겠다고 하는 경우에도 이를 제지할 방법은 없다고 덧붙였다.헌재 관계자는 ""탄핵심판 당사자가 자신의 진술을 하고 난 뒤 질문에 답을 해야 적절한 방어가 될 수있지 않겠느냐""고 말했다.taejong75@yna.co.kr대박난 흥부가 즐겨찾는 #흥(클릭!)"
