,날짜,기사 제목,기사 링크,기사 출처,기사 내용
0,2017-02-04,"암을 이긴 외국 청년 ""사장님 덕분에 구한 목숨""",https://news.naver.com/main/read.nhn?mode=LSD&mid=shm&sid1=102&oid=056&aid=0010415493,KBS,"<앵커 멘트>가족을 부양하기 위해 한국으로 일하러 왔다가 암에 걸린 사실을 알게 된 인도네시아 청년이 주변의 도움으로 새 인생을 살게 됐습니다.세상이 각박하다고들 하는데 마음이 따뜻해지는 이 사연 조혜진 기자가 취재했습니다.<리포트>한국 온 지 1년 3개월 된 27살 인도네시아 청년 아리핀씹니다.무거운 부품 상자도 번쩍 들어 옮길 만큼 건강해 보입니다.<녹취> ""몸무게 얼마나 나가?  62kg이요.""하지만 1년 전, 한국에 온 지 두 달 만에 임파선 암 진단을 받았고, 체중은 50kg까지 빠졌습니다.<인터뷰> 아리핀(외국인 노동자) : ""그때는 이렇게 일할 수 있을 거라고 생각도 못 했어요.""고국의 가족들  생계를 책임지는 처지에 수천만 원의 치료비는 감당하기 어려웠습니다.아리핀 씨가 모든 걸 포기했을 때 회사 대표가 손을 내밀었습니다.암 투병 경험이 있는 오일성 대표는 조건 없이 치료비를 부담하고 용기도 줬습니다.<인터뷰>  오일성(세운냉동종합주방 대표) : ""아픈 사람 마음은 아파 보지 않으면 모를 수 있습니다. 사람이기 때문에 일단은 고쳐야겠다고 생각했습니다.""1년간 6차례의 항암치료, 아리핀 씨는 건강을 되찾았습니다.<인터뷰> 이세련(고대안산병원 종양혈액내과) : ""몽우리가 거의 20cm 정도인 종괴가 있어 아주 위급한 상황이었습니다.""오 대표의 따뜻한 마음이 27살 청년 아리핀 씨에게 새로운 미래를 선사했습니다.<인터뷰> 아리핀(외국인 노동자) : ""사장님 고마워요.""<인터뷰> 오일성(세운냉동종합주방 대표) : ""'얘가 나으려고 (나한테) 왔구나'라고 믿었던 대로 잘 나았기 때문에 너무 감사합니다.""KBS 뉴스 조혜진입니다.조혜진▶ [저작권자ⓒ KBS 무단복제-재배포 금지]"
1,2017-02-04,"수입차 정비, 동네 카센터엔 '그림의 떡?'",https://news.naver.com/main/read.nhn?mode=LSD&mid=shm&sid1=103&oid=214&aid=0000733696,MBC,"[뉴스데스크]◀ 앵커 ▶수입차 타시는 분들 많이 늘었는데요.수리 한 번 받으려면 비싸고, 오래 걸리는 경우가 많습니다.작년, 정부가 경쟁을 통해 수리비를 낮추겠다며 동네 카센터에서도 수입차 정비를 할 수 있도록 했는데요.제대로 시행되고 있을까요?정준희 기자가 취재했습니다.◀ 리포트 ▶운전석 계기석 액정화면이 고장 나 카센터에 들어온 독일 브랜드 승용차. 하지만, 수리는 불가능합니다.부품을 교체한 뒤 관련 프로그램까지 설치해야 정상작동 되는데, 판매업체가 다운로드 서비스를 제공하지 않기 때문입니다.[이윤형/정비업체 반장]""프로그램 자체도 할 수가 없는 상황이고 이 차는 이제 (공식) 서비스센터로 갈 수밖에 없는 상황입니다.""정부는 지난해 3월부터 일반 카센터에서도 수입차를 정비할 수 있게 업체들이 프로그램과 안내서를 공개하도록 했습니다.일반 정비소와 경쟁을 통해 국산차의 두세 배에 이르는 공임, 평균 9일이 걸리는 수리기간 등 공식 서비스 센터의 고질적 문제를 해결하겠다는 취지입니다.실제 일반 정비소의 경우, 공식 서비스 센터보다 30%에서 50% 정도 수리비가 쌉니다.[김명환/정비업체 대표]""가격·서비스·고객 케어에서 (공식 센터에) 결코 뒤지지 않는다고 봅니다.""문제는 일부 판매업체의 비협조. 선두업체 벤츠 코리아는 정부 지침대로 프로그램과 안내서를 제공하고 있다지만 실제 다운로드 서비스도 안 되고 보통 시간당 2만 원 내외 사용료를 내는 정비교본 열람도 1년치 씩 사도록 사실상 강제하고 있다는 게 카센터 업주들의 주장입니다.[이석진/정비업체 대표]""170만 원을 정비 매뉴얼 비용으로, 한 대를 수리하더라도 1년치 라이센스를 모두 구매하라고 하고요. 이 나라 정책을 부정하는 겁니다.""브랜드 별로 사야 하는 정밀 진단기가 있으면 업체의 프로그램 다운로드를 받지 않아도 되지만, 가격이 한 대 2천만 원 정도에 업데이트 비용만 연간 수백만 원. 이렇다 보니 수입차를 취급하는 카센터의 80%가 불법복제 프로그램을 쓰는 게 현실입니다.[정비업체 사장]""중국이라든가 대만이라든가 카피 프로그램이 나오는데 그걸 사용하는 경우가 많습니다.""일반 정비소에서 한번이라도 수리를 하면 공식 센터에서 받아주지 않는 관행도 여전합니다.[공식 정비센터 관계자]""(회사 방침이) 외부에서 수리한 차량에 대해서 코딩이라든가 이런 건 절대 불가하다고 나왔어요. 안 해준다는 거죠.""수입차 시장의 대세인 독일 브랜드의 경우 정비로 얻는 영업이익은 통상 전체 영업이익의 60% 수준. 돈벌이가 되는 일감을 일반 정비소로 넘기는 게 달가울 리 없다는 게 전문가들의 얘기입니다.[하재기/경북보건대 자동차과 교수]""정비 매뉴얼이나 진단기를 원활하게 구입해서 사용할 수 없는 게 현실입니다. (일부 업체의) 독단적인 행동들이 개선돼야….""무상보증기간이 끝나면 급증하는 수리비 탓에 일반 정비소를 찾는 수요는 넘치지만 정부의 관리감독과 업체 협조 없이 수입차 정비 대중화는 요원해 보입니다.MBC뉴스 정준희입니다.정준희기자 (rosinante@imbc.com)[저작권자(c) MBC (www.imnews.com) 무단복제-재배포 금지]Copyright(c) Since 1996,MBC&iMBCAll rights reserved."
2,2017-02-04,"""가게 공짜로 빌려드려요""…미리 해보는 '창업'",https://news.naver.com/main/read.nhn?mode=LSD&mid=shm&sid1=101&oid=449&aid=0000122942,채널A,"창업은 하고 싶은데 덜컥 가게를 내자니 두려운 분들 많으시죠,이런 청년들에게 무료로 가게를 빌려줘 창업을 미리 경험할 수 있게 하는 제도가 있습니다.황규락 기자가 소개합니다.[리포트]넣고 끓이고.음식 만드는 손길이 바빠집니다.주방부터 계산대까지, 일하는 사람은 모두 외식 창업을 꿈꾸는 청년들입니다.한국농수산식품유통공사에서 청년들에게 음식점을 무료로 빌려주고 한 달씩 장사해볼 수 있게 한 겁니다.청년들은 메뉴선정부터 요리와 서빙까지 가게 운영의 모든 과정을 시행착오를 통해 배워갑니다.[조정화 / 대학생]""원래 회전율을 높이기 위해서 뚝배기에 끓여놨다가 나갔는데 한번 끓여서 나갈 때가 더 맛있어서 (바꾸게)…""드디어 시작된 점심시간.갖가지 반찬에 큼직한 쪽갈비까지 들어간 먹음직스러운 한 상이 금세 차려집니다.[허수민 / 대학생]""막연하게 '창업해봐야겠다, 하고 싶다'고 생각하는 것과 유통이라든지 선호도 등을 알고 나니까 창업이 정말 힘들구나…""조대희 씨는 이 음식점에서 일했던 경험이 창업에 큰 도움이 됐습니다.그래서 가게 메뉴도 적은 비용으로 이익을 남길 수 있는 수제 롤케이크로 정했습니다.[조대희 / 청년 창업가]""(그때) 실제로 해보니까 매출이 다 이익으로 남겨지는 것은 아니란 걸 깨달았거든요.""매년 수천 개의 청년 가게들이 생기지만 경험이 부족해 이 중 절반이 1년 만에 문을 닫는 상황.이 제도가 청년들에게 새로운 기회가 될 수 있을지 주목됩니다.채널A 뉴스 황규락입니다.영상취재 : 박찬기영상편집 : 조성빈9분기 연속 종편 1위! 채널A 시청자 만족도 A+ ⓒCHANNEL A(www.ichannela.com), 무단 전재 및 재배포 금지"
3,2017-02-04,"""3층서 뛰어내려"" 갑작스런 화재, 긴박했던 탈출",https://news.naver.com/main/read.nhn?mode=LSD&mid=shm&sid1=102&oid=214&aid=0000733676,MBC,"[뉴스데스크]◀ 앵커 ▶화재가 난 건물은 최고 66층짜리 주상복합건물 4개 동의 부속 상가입니다.상가 바로 옆, 이 초고층 건물엔 천 2백여 세대가 살고 있는데, 휴일 아침 집에서 쉬던 입주민들까지 놀라 대피하면서 주변은 그야말로 아수라장이 됐습니다.긴박했던 그 순간을 홍승욱 기자가 전해드립니다.◀ 리포트 ▶건물 3층 창문에 한 남성이 걸터앉아 있다가 1층 바닥에 있는 에어 매트로 뛰어내립니다.""아~ 어떡해!!""이윽고 또 다른 사람이 뛰어내립니다.앞이 보이지 않을 정도의 연기에 3층에 있던 상가 이용객들은 창문을 깨고 뛰어내렸습니다.3층에 고립돼 있다 에어 매트로 탈출한 인원은 16명. 비상계단으로도 13명이 빠져나왔습니다.[윤솔아]""2층 쪽에서 약간 회색이랑 검은색 연기가 엄청 내려오고 있고…. 진회색에서 검은색으로…. 연기가 그런데 순식간에 퍼져서 되게 당황스러웠어요.""불이 난 상가는 66층짜리 주거용 오피스텔과 연결돼 있습니다.자칫 불이 옮겨 붙었다면 대형 참사가 될 뻔한 아찔한 상황이었습니다.주말 오전 주거동에 있던 주민 1백여 명도 대피 방송을 듣고 급하게 몸을 피했습니다.이 과정에서 상가 이용객들과 뒤엉켜 메타폴리스 주변엔 큰 소동이 빚어졌습니다.[정요안/경기화성소방서장]""에어 매트로 구조를 하고 특별 피난 계단을 통해서 종업원들과 이용객들을 대피시킨 사안입니다.""다행히 동마다 배치된 엘리베이터 6개는 정상 작동해 주민들은 엘리베이터를 이용해 바깥으로 빠져나왔습니다.화재 이후 입주민들은 고층화재에 대한 불안감이 생겼다고 말했습니다.그런데 경기도 내 소방서가 보유하고 있는 진화용 고가사다리의 최고 접근 높이는 17층에 불과합니다.MBC뉴스 홍승욱입니다.홍승욱기자 (hongs@mbc.co.kr )[저작권자(c) MBC (www.imnews.com) 무단복제-재배포 금지]Copyright(c) Since 1996,MBC&iMBCAll rights reserved."
4,2017-02-04,不死의 유리병…땅에 묻어도 분해까지 100만년 걸린다,https://news.naver.com/main/read.nhn?mode=LSD&mid=shm&sid1=102&oid=022&aid=0003142538,세계일보,"[연중기획-지구의 미래] '유리병의 일생'유일하게 재사용이 가능한 포장 용기가 바로 유리병이다. 유리병은 금속캔, 종이팩, 페트병, 플라스틱(PVC) 등 다양한 포장재 중 유일하게 열 번이고 스무 번이고 씻어서 다시 쓸 수 있다. 환경에 부담을 가장 적게 주는 방법이다. 하지만 우리나라의 유리병 재사용률은 85%로, 95% 안팎의 재사용률을 보이는 유럽이나 일본, 캐나다에 훨씬 뒤진다. 그마저도 빈병 재사용 대상인 소주, 맥주병만 놓고 봤을 때 그렇고, 콜라병 같은 전체 유리병을 포함하면 재사용률은 훨씬 더 떨어진다. 환경부가 1994년 이후 고정불변이었던 빈병 반환 보증금을 올해부터 소주병 100원(기존 40원), 맥주병 130원(50원)으로 올린 데는 이런 배경이 있다. 환경은 실천이다. 세계일보는 2017년 환경 연중기획 ‘지구의 미래’의 첫 번째 주인공으로, 일상에서 간단하게 실천하는 환경보호의 중요성을 보여줄 수 있는 유리병을 골랐다. 유리병의 시각으로 재구성한 ‘유리병의 일생’을 들어보자.◆빈병은 죽지 않는다. 다만 사라질 뿐나의 고향은 저 바닷가 모래벌판이다. 사람들은 모래에서 이산화규소를 뽑아내 용광로에서 1200도로 펄펄 끓여 나를 만들었다.내 특징을 한 단어로 정리하자면 ‘불사(不死)’. 나는 죽지 않는다. 한 번 세상에 나오면 씻어 쓰든(재사용) 녹여서 다시 만들든(재생이용) 무한에 가깝게 다시 살아난다. 단 이런 ‘영생’을 누리려면 생산자↔도·소매상↔소비자, 혹은 생산자→소비자→공병수집업체→제병사→생산자→ … 로 이어지는 유통망 안에 꼭 붙어 있어야 한다. 우리나라 유리병 100개 중 70개는 이런 식으로 재활용(재사용+재생이용)된다.정부는 나 같은 포장재의 재활용률을 높이려고 ‘생산자책임재활용제도’(EPR)를 만들었다. 제품 생산·판매뿐 아니라 소비·폐기·포장재 재활용까지 생산자가 의무를 지게 하는 것이다. 올해 유리병의 재활용률은 76.3%로, 유리병을 사용하는 생산자는 전체 제품 중 이만큼을 재활용병으로 만들어야 한다.나를 재사용하든 재생이용하든 다루는 사람 마음이지만, 환경을 생각한다면 재사용하는 게 좋다.나를 가장 열심히 씻어 쓰는 곳은 소주·맥주공장이다. 지난달 24일 강원도 홍천의 하이트진로 공장. 축구장을 방불케 하는 넓은 공장의 절반이 유리병 재사용을 위한 공간이다. 누군가 먹고 버린 빈 맥주병을 술도매상이나 공병상이 모아 맥주제조사로 보내면 이곳에 모여 먼저 공병선별기를 거친다. 병 모양을 인식해 타사병과 해당 생산라인에 맞지 않는 병을 골라내는 기계다. 공병선별기를 지나면 세병기를 만나는데 바로 여기서 35분 동안 고온(80도)·고압의 물과 살균액(가성소다)을 맞으며 깨끗한 새 병이 된다. 이 공장에서만 하루 600만병 이상 이런 과정으로 생산된다.이렇게 병을 재사용하려면 병을 회수하는 물류체계와 거대한 기계설비를 갖춰야 한다. 한국순환자원유통지원센터의 조문기 팀장은 “세병기만 50억원 정도”라며 “유리병 재사용 기업은 막대한 투자비용과 엄격한 생산관리 등의 부담을 안고 있는 것”이라고 말한다.이런 부담에도 주류업체가 병을 재사용하는 것은 환경보호 의식이 남달리 투철해서라기보다는 ‘남는 장사’이기 때문이다. 소주병을 기준으로 새 병의 매입단가는 143원, 재사용 병은 이보다 80원가량 저렴하다. 소주 한 병의 제조원가가 476원인 점에 비춰보면 무시할 수 없는 차이다. 주류업체 관계자는 “주류업체끼리 재사용이 가능한 경쟁사의 사용된 병을 해당업체에 넘기지 않는 경우가 있는데 이는 (경쟁사가) 새 병을 사게 해서 비용부담을 가중시키려는 의도”라고 설명한다.물론 재사용은 환경에도 좋다. 권영식 수원과학대 교수(환경산업)는 소주병 97%는 재사용, 3%는 새로 만들어낸다고 가정하고 환경에 미치는 영향을 계산했다. 그 결과 지구온난화에 대한 기여도는 신병제조공정이 약 67%를 차지했고, 나머지 약 33%는 재사용을 위한 소주병 세척 및 약품사용(수산화나트륨 등) 등이 차지했다. 병을 씻어 재사용할 때보다 신병을 만들어낼 때 지구온난화에 미치는 영향이 훨씬 더 크다는 뜻이다. 환경부도 현재 85%인 유리병 재사용률을 선진국 수준인 95%까지 올리면 온실가스 배출량 20만t(소나무 3300만 그루의 연간 흡수량), 에너지소비량 26억MJ(연간 1만5000명 전력 소비량)가 줄어들 것으로 본다. 여러모로 재사용은 나에게 가장 행복한 삶이다.◆나를 묻지 말아요하지만 소매점에서 팔려나간 소주·맥주병은 분리수거돼 공병상을 거치다보니 흠집이 생기거나 깨지는 경우가 많다. 이런 병들은 일반 유리병과 함께 ‘백색-갈색-녹색’으로 나뉘어 컬릿(cullet)이라고 하는 부스러기로 파쇄된다. 컬릿은 다시 용광로를 거쳐 새 병이 되는데 재사용만큼은 아니지만 완전히 새 원료로 유리병을 만들 때보다 녹이는 온도도 낮고 자원소비량도 적어 환경 부담이 조금은 덜하다.문제는 재사용도 재생이용도 안 되는 친구들이다. 지난달 25일 경기도 화성의 한 유리 파쇄업체에서 이런 친구를 무더기로 만났다. 처음엔 거대한 모래언덕인가 싶었다. 자세히 보니 컬릿 상태의 백색 유리조각이었다. 백색 컬릿이 제병사에 납품이 안 돼 쌓여 있는 것이라고 공장 대표가 말했다. “1∼2년 전부터 제병사에서 유리병 대신 판유리(창문, 책상유리 등)로 유리병을 만들기 시작했어요. 유리병은 병 안에 찌꺼기도 있고, 라벨이랑 뚜껑을 완전히 분리하기 어려워 이물질이 많은데 판유리는 깨끗하잖아요. 원가도 판유리가 조금 저렴하고요.”대표는 “매달 전국에 이렇게 쌓이는 양이 3000t은 될 것”이라며 “지금 여기에 있는 것만 해도 1500t 정도”라고 한숨 쉬었다.백색 유리병 컬릿은 다시 병을 만드는 게 아니면 딱히 쓸데가 없다. 바닥재나 매립쓰레기를 덮는 용도로 쓸 수는 있지만 더 저렴한 원료가 많아 굳이 백색 컬릿을 쓰지 않는다. 수출도 단가가 안 맞는다. 최후의 방법은 땅에 묻는 것이다. 아까도 말했지만 나는 불사의 특징을 갖고 있다. 땅 속에서도 마찬가지다. 내가 땅에 묻혀 다시 흙으로 분해되려면 100만년이 걸린다. 100만년이란 호모에렉투스가 진화에 진화를 거듭해 오늘날 인간이 되기까지 걸리는 시간이다. 한마디로 안 썩는다는 얘기다.유리병을 깨끗이 씻어 라벨과 뚜껑을 분리해 버렸더라면 백색 컬릿이 이렇게까지 천덕꾸러기가 되지는 않았을 것이다. 유리병 속 이물질은 재사용과정에서도 문제다. 담뱃재나 기름이 묻은 소주·맥주병은 아예 재사용 공정에 발도 들일 수 없다.나를 일반 종량제봉투에 버리는 건 더 가슴 아픈 일이다. 종량제봉투에 들어가면 재활용 기회도 가져보지 못한 채 그대로 땅에 묻혀 100만년 동안 웅크리고 있어야 한다. 내가 재사용될지, 재활용될지 아니면 매립될지는 결국 당신 손에 달렸다.홍천·화성=윤지로 기자 kornyap@segye.comⓒ 세상을 보는 눈, 글로벌 미디어세계일보"
5,2017-02-04,성전환 소년은 '그'일까 '그녀'일까,https://news.naver.com/main/read.nhn?mode=LSD&mid=shm&sid1=110&oid=001&aid=0009007536,연합뉴스,"<<시각장애인 음성정보 지원을 위한 텍스트입니다>>'성별'의  정의가 바뀐다미국 보이스카우트, 성전환 소년 가입 허용미국 보이스카우트 연맹이 앞으로는 '성전환 소년'도 회원으로 받아들이기로 했습니다. 창설 107년 만의 일입니다.출생증명서에 적힌 성별이 아닌, 본인이나 부모가 신청서에 쓴 성별을 기준으로 삼겠다는 것입니다.지난해 성전환 소년의 회원 자격을 박탈했던 보이스카우트는 ""성별에 대한 정의가 변화했다""고 밝혔습니다. 미국 걸스카우트는 2015년부터 성전환 소녀를 받아들였습니다.성전환자, 동성애자, 양성애자 등 성소수자에게 이분법적인 성별을 강요하지 않으려는 움직임이 세계 곳곳에서 나타나고 있습니다.호주 빅토리아 주는 공무원에게 '남편'(husband)과 '아내'(wife)라는 표현 대신 남녀를 통칭하는 대명사 '지'(zie)나 '히어'(hir)를 쓰도록 공식 지시했습니다.영국의 초중고등학교는 성별을 '소년'(boys) '소녀'(girls) 두 개로 나누는 단어 사용을 줄이자는 지침서를 최근 교사와 학부모, 학생들에게 전달했습니다.지난해 미국 정부는 모든 공립학교에 학생의 성 정체성과 맞는 화장실과 라커룸 선택권을 보장하도록 지시하기도 했죠.""이번 지침은 동성애자나 양성애자, 성전환자에 대한 혐오증을 해소하려는 방안""(마틴 폴리, 호주 빅토리아주 평등부 장관) 일각에서는 성소수자를 배려하는 조치를 기업에도 적용해야 한다고 말합니다.""권위주의적인 지침이다. 이런 것에 기대지 않고 타인과 사생활을 존중하는 것이 가능하다."" (싱크탱크 독립연구센터의 제러미 사무트 연구원) 하지만 논란 많은 소수 의견을 전체에 강요하려 한다는 반발도 적지 않습니다.교육부 ""학교 성교육때 동성애는 NO…관련단체 반발 예상"" 한국은 아직 성소수자 대우를 언급하는 것조차 쉽지 않은 게 현실이죠.전 세계로 퍼져나가는 무지개색 깃발과 '성 정체성 인식 변화', 어떻게 생각하시나요?hye1@yna.co.kr#흥 이렇게 흥겨울 수가...클릭하면 요지경!"
6,2017-02-04,늘어만 가는 노동시간…'나쁜 아빠' 만드는 사회,https://news.naver.com/main/read.nhn?mode=LSD&mid=shm&sid1=102&oid=055&aid=0000501112,SBS,"한국의 야경을 보고 외국인들이 물었습니다. ""오 아름다워요! 이렇게 야경이 아름다운 이유가 뭐죠?"" 한국인이 답했습니다. ""야근입니다.""'세계 11위 경제대국'이라는 대한민국. 하지만 OECD가 분석한 삶의 질은 거꾸로 달리고 있습니다. 36개 국가 중 노동시간은 두 번째로 길고, '일과 삶의 균형 지수'는 끝에서 세 번째를 기록했습니다.■ 노동시간이 더 길어졌다!최근 한국노동사회연구소가 발표한 '노동시간 실태와 단축방안' 보고서에 따르면, 2015년 국내 취업자의 연평균 노동시간은 2,273시간입니다.경제협력개발기구(OECD) 회원국 중에서 멕시코에 이어 두 번째로 길었으며, 연간 노동시간이 2천 시간을 넘는 나라는 멕시코와 우리나라, 그리스뿐이었습니다.지난 2011년, 정부는 세계 최장 수준의 노동시간을 줄이겠다며, 연간 노동시간을 2020년까지 1천8백 시간으로 단축하겠다는 계획을 내놓은 바 있습니다.하지만 그 사이 우리 사회의 노동시간은 더 길어졌을 뿐입니다. 당시 2,100시간이던 연평균 노동시간에서 173시간, 일주일이 넘는 시간만큼 더 일하게 된 겁니다.■ 아빠들은 전쟁 같은 나날을 보내고 있다노동시간이 길어지는 사이, 직장인들의 시름은 더욱 깊어지고 있습니다. '워킹맘'은 물론이고 그동안 조명받지 못했던 '아빠'들의 삶에도 큰 변화가 필요하다는 목소리가 높습니다.지난 15일 방송돼 화제가 된 SBS 신년특집 다큐멘터리 <아빠의 전쟁 3부작>에서는  직장에서 고군분투하느라 정작 자식들에게 환대받지 못하는 아빠들의 모습이 적나라하게 드러났습니다.지난해 신년특집으로 방영됐던 <엄마의 전쟁>에서 여성이 직장과 육아를 병행하기 위해 남편의 도움이 절실하다는 점이 지적됐는데, 이번 <아빠의 전쟁>을 통해 아빠들 역시 직장에서 과도한 노동에 시달려 가정생활에 적극적으로 참여할 수 없는 현실이 드러난 겁니다.한 달간 온 가족이 저녁 식사를 함께하는 '디너테이블 프로젝트' 실험에서 아빠들이 약속을 지키기 위해 밥만 겨우 한술 뜨고 다시 직장으로 나서는 모습을 보며 시청자들은 서글프다는 반응을 보냈습니다.■ '좋은 아빠 DNA'는 없다…'나쁜 아빠' 만드는 사회가 문제방송에서는 흥미로운 실험을 해봤습니다. 한 중소기업에서 직원들이 '정시 퇴근'하겠다고 이야기할 때 나오는 상사들의 솔직한 반응을 살펴본 겁니다. 역시나 반응은 싸늘했죠.'정시 퇴근'이라는 말이 허무맹랑한 소리로 여겨지고, '칼퇴가 곧 민폐'가 되는 조직문화가 우리 사회에 굳건하게 자리 잡고 있는 겁니다.'좋은 아빠 DNA'는 따로 없다고 합니다. 좋은 아빠를 만드는 것도 나쁜 아빠를 만드는 것도 결국 '사회'인 거죠.전문가들은 노동시간은 단순하게 개인의 삶의 질만 높이는 것이 아니라고 말합니다. 대체 휴일을 하듯 여가 생활이 늘어나니 내수를 진작시킬 방안이기도 하고, 저성장 시대에 일자리를 늘릴 수 있는 방안이기도 하다는 겁니다.지금까지의 정책으로 실패했다면, 정부는 가능한 정책수단을 구체화해 강력하게 추진해야 할 겁니다.(기획, 구성 : 김도균, 정윤교 / 디자인 : 정혜연)김도균 기자(getset@sbs.co.kr)※ ⓒ SBS & SBS콘텐츠허브 : 무단복제 및 재배포 금지"
