,날짜,기사 제목,기사 링크,기사 출처,기사 내용
44,2017-02-04,"반기문 하차하자…새누리당 ""나도 출마""",https://news.naver.com/main/read.nhn?mode=LSD&mid=shm&sid1=100&oid=449&aid=0000122947,채널A,"탄핵 정국에서 숨 죽이던 새누리당에서 대선 출마 선언이 잇따르고 있습니다.그러나 황교안 대통령 권한대행 외에는 대부분 존재감이 떨어지는 후보들 뿐이란 지적입니다.최재원 기자가 보도합니다.[리포트][인명진 / 새누리당 비상대책위원장]우리 당이 대통령 후보를 내도 된다라는 국민의 허락을 받은 것이 아닌가...탄핵 정국에서 몸을 낮춰 왔던 새누리당이 출마 선언 자제령을 전격 해제했습니다.범여권의 유력후보였던 반기문 전 총장이 이탈하면서 분위기가 180도 달라진 겁니다.[정우택 / 새누리당 원내대표]우리 불임정당이라고 하다가 지금 다산체제로 들어간다니까. 다음 주부터 보세요. 거의 10명 가까이 나올 것 같아.이미 4번째 대선 출마의 뜻을 밝힌 이인제 전 최고위원에 더해 모레는 원유철, 안상수 의원이 대권 도전을 선언하고 김문수 전 경기지사와 조경태 의원 등도 출마 시점을 저울질하고 있습니다.문제는 후보들 모두 이렇다 할 존재감이 없다는 점.""국정농단의 책임을 져야 할 집권여당이 대통령 탄핵 여부가 결정되기도 전에 대선 주자들을 우후죽순 내보내는 것을 과연 국민들이 이해하겠느냐""는 비판도 나옵니다.새누리당은 황교안 권한대행에게도 적극 러브콜을 보내고 있지만 박근혜 정부 2인자란 비판과 권한대행 교체로 빚어질 국정혼란 등이 고민입니다.채널A 뉴스 최재원입니다.영상취재: 김준구 박희현영상편집: 오영롱9분기 연속 종편 1위! 채널A 시청자 만족도 A+ ⓒCHANNEL A(www.ichannela.com), 무단 전재 및 재배포 금지"
45,2017-02-04,"박채윤, 김진수 청와대 비서관에도 뇌물 시도",https://news.naver.com/main/read.nhn?mode=LSD&mid=shm&sid1=100&oid=057&aid=0001083116,MBN,"【 앵커논평 】구속된 박 채윤 씨는 안종범 전 청와대 수석에게 고가의 명품가방과 수천만 원의 현금을 건넨 혐의를 받고 있죠.그런데 박 씨가 안전 수석 외에도 청와대 관계자에게 뇌물을 주려 한 정황을 특검이 포착했습니다.강현석 기자가 단독 보도합니다.【 기자 】안종범 전 청와대 수석에게 고가의 명품가방과 현금 등을 건넨 혐의를 받는 의사 김영재 씨의 부인 박 채윤 씨.특검은 박 씨가 안전 수석 외에도 다른 청와대 관계자에게 금품을 건네려 한 정황을 포착했습니다.김진수 청와대 보건복지비서관은 최근 특검 조사에서 '뇌물 제공' 시도가 있었다고 진술했습니다.박 씨가 김 비서관을 만난 자리에서 2~3차례에 걸쳐 현금 200~300만 원을 주려 했다는 겁니다.박 씨는 또 김 비서관에게 고가의 명품 가방을 선물로 주려고 시도한 것으로 알려졌습니다.김 비서관은 돈 봉투에 대해 추후 문제 될 여지가 있어서 거절했고, 한 번은 다른 사람이 있는 자리에서 거절했다고 진술했습니다.박 씨의 회사 와이 제이콥스 의료는 지난 2015년 15억 규모의 정부 연구개발과제를 따냈습니다.김 비서관이 박 씨와 산업통상자원부 관계자를 연결해주고 나서 사업을 따낸 만큼, 관리 차원에서 금품을 제공하려 한 것으로 보입니다.특검은 박 씨를 상대로 김 비서관에게 뇌물을 제공하려 한 정황과 이유를 캐물을 방침입니다.MBN뉴스 강현석입니다.[wicked@mbn.co.kr]< Copyright ⓒ MBN(www.mbn.co.kr) 무단전재 및 재배포 금지 >"
46,2017-02-04,"복잡한 미로구조에 뒤늦은 경보, ""화 키웠다""",https://news.naver.com/main/read.nhn?mode=LSD&mid=shm&sid1=102&oid=214&aid=0000733682,MBC,"[뉴스데스크]◀ 앵커 ▶이번 화재는 불에 탄 면적에 비해서 피해가 컸습니다.건물이 미로 같은 복잡한 구조로 돼 있기 때문인데요.전재홍 기자가 취재했습니다.◀ 리포트 ▶상가동 내부는 유럽의 좁은 골목이 연상되는 미로 모양의 구조입니다.여기에 순식간에 번진 연기는 더욱 탈출구를 찾기 어렵게 만들었습니다.[대피자]""연기가 숨을 못 쉬겠더라고요. 호흡을 못해서 저쪽으로 저쪽으로 반대방향으로 갔죠.""불이 난 상가의 내부구조는 거미줄 같아서 긴급 상황 시 비상구를 찾기는 어려워 보입니다.숨진 4명 가운데 2명은 불이 난 놀이시설 맞은 편에서 발견됐는데, 어떤 이유에선지 화재가 난 사실을 미처 알지 못했던 것으로 추정됩니다.화재 대피방송이나 경보음이 제대로 작동했는지는 불분명합니다.[정요안/화성소방서장]""화재 발생 사실을 인지하지 못한 두피관리실에 있는 분들이 대피하다가 피해를 입으신 것으로….""상황실에선 화재 사실을 알았지만 확인이 필요하다며 5분 가까이 화재 경보를 울리지 않았다고 말합니다.[보안 요원]""여기 실내에선 (비상벨이) 안 울렸고 보안 상황실만 울리고 뒤늦게 울렸어요.""철거작업을 할 때 용접기와 절단기 같은 화재 발생 가능성이 있는 기계를 사용하지만 작업 편의상 소화 설비를 꺼놓은 경우가 있습니다.이 때문에 작업자 중 누군가가 임의로 자동소화감지장치를 조작했을 가능성도 제기되고 있습니다.실제로 3년 전, 69명의 사상자를 냈던 고양터미널 화재 때도 소방시설을 꺼놓고 지하에서 작업을 하다 참사가 발생했습니다.MBC뉴스 전재홍입니다.전재홍기자 (bobo@mbc.co.kr)[저작권자(c) MBC (www.imnews.com) 무단복제-재배포 금지]Copyright(c) Since 1996,MBC&iMBCAll rights reserved."
47,2017-02-04,불발된 청와대 압수수색…임의제출 놓고 '고심',https://news.naver.com/main/read.nhn?mode=LSD&mid=shm&sid1=100&oid=057&aid=0001083118,MBN,"【 앵커논평 】청와대가 압수수색을 완강하게 거부하면서 박영수 특검팀의 고민이 깊어지고 있습니다.다음 주 후반 대통령 대면조사를 위해서는 압수수색 문제를 매듭지어야 하는데 임의제출을 받는다면 기 싸움에서 밀렸다는 인상을 줄 수 있기 때문입니다.강호형 기자가 보도합니다.【 기자 】특검팀은 그동안 벼르던 청와대 압수수색을 시도했지만, 5시간 만에 빈손으로 돌아섰습니다.황교안 대통령 권한대행에 압수수색 집행관련 협조 공문까지 보냈지만, 아직 답변을 받지 못하고 있습니다.황 대행 측은 ""대통령비서실장, 경호실장이 관련 법령에 따라 압수수색에 응하지 못한 것으로 알고 있다.""라며 청와대 입장에 동조했습니다.특검팀은 오는 8일에서 10일 사이에 예정된 박근혜 대통령 대면조사를 위해서는 압수수색을 빨리 마무리해야 하지만, 뾰족한 수가 없어 답답해하고 있습니다.▶ 인터뷰 : 이규철 / 특별검사보(어제)- ""사실상 청와대가 형사소송법 110조 및 111조를 근거로 압수수색을 거부할 때는 실질적으로 압수수색을 강제할 방법은 없다는 결론에 이르렀습니다.""청와대는 특검이 2차 압수수색에 나설 경우 관련 법과 전례에 따라 임의제출 형식으로 협조하겠다는 뜻을 거듭 밝힙니다.특검 측은 청와대의 입맛에 맞는 자료만 제출받을 경우, 대면조사를 앞두고 기 싸움에서 밀릴 수 있다는 점에서 고심이 깊어지고 있습니다.MBN뉴스 강호형입니다.< Copyright ⓒ MBN(www.mbn.co.kr) 무단전재 및 재배포 금지 >"
48,2017-02-04,"""가게 공짜로 빌려드려요""…미리 해보는 '창업'",https://news.naver.com/main/read.nhn?mode=LSD&mid=shm&sid1=101&oid=449&aid=0000122942,채널A,"창업은 하고 싶은데 덜컥 가게를 내자니 두려운 분들 많으시죠,이런 청년들에게 무료로 가게를 빌려줘 창업을 미리 경험할 수 있게 하는 제도가 있습니다.황규락 기자가 소개합니다.[리포트]넣고 끓이고.음식 만드는 손길이 바빠집니다.주방부터 계산대까지, 일하는 사람은 모두 외식 창업을 꿈꾸는 청년들입니다.한국농수산식품유통공사에서 청년들에게 음식점을 무료로 빌려주고 한 달씩 장사해볼 수 있게 한 겁니다.청년들은 메뉴선정부터 요리와 서빙까지 가게 운영의 모든 과정을 시행착오를 통해 배워갑니다.[조정화 / 대학생]""원래 회전율을 높이기 위해서 뚝배기에 끓여놨다가 나갔는데 한번 끓여서 나갈 때가 더 맛있어서 (바꾸게)…""드디어 시작된 점심시간.갖가지 반찬에 큼직한 쪽갈비까지 들어간 먹음직스러운 한 상이 금세 차려집니다.[허수민 / 대학생]""막연하게 '창업해봐야겠다, 하고 싶다'고 생각하는 것과 유통이라든지 선호도 등을 알고 나니까 창업이 정말 힘들구나…""조대희 씨는 이 음식점에서 일했던 경험이 창업에 큰 도움이 됐습니다.그래서 가게 메뉴도 적은 비용으로 이익을 남길 수 있는 수제 롤케이크로 정했습니다.[조대희 / 청년 창업가]""(그때) 실제로 해보니까 매출이 다 이익으로 남겨지는 것은 아니란 걸 깨달았거든요.""매년 수천 개의 청년 가게들이 생기지만 경험이 부족해 이 중 절반이 1년 만에 문을 닫는 상황.이 제도가 청년들에게 새로운 기회가 될 수 있을지 주목됩니다.채널A 뉴스 황규락입니다.영상취재 : 박찬기영상편집 : 조성빈9분기 연속 종편 1위! 채널A 시청자 만족도 A+ ⓒCHANNEL A(www.ichannela.com), 무단 전재 및 재배포 금지"
49,2017-02-04,"우병우, 이우환 화백 그림 무슨 돈으로?…횡령·탈세 의혹 조사",https://news.naver.com/main/read.nhn?mode=LSD&mid=shm&sid1=100&oid=448&aid=0000198975,TV조선,"[앵커]이번엔 우수석이 구입한 고가의 그림의 자금출처가 궁금합니다. 우병우 전 수석의 가족회사 정강은 이우환 화백의 그림 등 작품 6점을 갤러리 학고재에서 구입한 걸로 알려졌습니다. 그림값으로 지불한 수 억원의 자금 출처에 따라 횡령이나 탈세 혐의가 적용될 수 있습니다.박경준 기자의 보도입니다.[리포트]우병우 전 수석의 가족회사 정강은 2014년 갤러리 학고재로부터 이우환 화백의 조응 1994와 1995를 3억1000만원에 구입합니다.정강은 다음해에 미술품 1억 3천만원 상당을 추가로 구입해 재무재표엔 2015년 기준 4억 4천여만원 상당의 서화가 재산으로 명시돼 있습니다.그런데 검찰이 지난해 정강 사무실을 압수수색했을 때엔 해당 그림들이 없었습니다. 우 전 수석은 이 미술품들을 학고재 수장고 등에 보관하고 있었던 것으로 알려졌습니다.이 때문에 우 전 수석이 회사 명의로 개인 미술품을 사들인 것 아니냐는 의혹이 나옵니다. 개인 미술품을 회삿돈을 이용해 샀다면 횡령 혐의가 적용될 수 있습니다.또 공직자 재산 신고 목록에도 누락됐던 만큼 탈세 가능성도 있습니다. 학고재 관계자는 지난해 검찰조사에서 그림을 우 전 수석의 집으로 배달했다고 진술한 것으로 알려졌습니다.하지만 참고인 신분으로 특검 조사에 출석한 우찬규 학고재 대표는 이 같은 의혹을 부인했습니다.우찬규 / 학고재 대표((그림 배달 간 게) 우병우 전 수석 자택 맞습니까?) ""아닙니다.""(처음에는 어디로 갔나요?) ""처음부터 창고에 있었습니다.""특검은 우 전 수석의 그림 취득 과정을 집중 조사하고 있습니다.TV조선 박경준입니다./ 박경준 기자 kjpark@chosun.com* 뉴스제보 : 이메일(tvchosun@chosun.com), 카카오톡(tv조선제보), 전화(1661-0190)박경준 기자(kjpark@chosun.com)- Copyrights ⓒ TV조선. 무단전재 및 재배포 금지 -"
50,2017-02-04,천국과 지옥 오간 한진해운…상장폐지 처지,https://news.naver.com/main/read.nhn?mode=LSD&mid=shm&sid1=101&oid=001&aid=0009008034,연합뉴스,"2일 고점에 매수한 개미들, 40% 이상 손실 추산(서울=연합뉴스) 유현민 기자 = 한국 원양 해운업의 시초인 한진해운이 설 연휴 이후 그야말로 천국과 지옥을 오갔다.이제 상장폐지를 기다리는 처지가 됐는데 회생을 기대하고 매집에 나선 개미(개인투자자)들만 된서리를 맞았다.하루 전만 해도 가격제한폭까지 올랐던 종목이 지난 2일 파산 절차에 들어가며 폭락한 채 거래가 정지됐기 때문이다.4일 한국거래소에 따르면 한진해운은 지난 1일 4거래일 만에 반등에 성공하며 전 거래일보다 29.92% 오른 상한가(951원)로 마감했다.거래소가 하루 전인 지난달 31일 장 종료 후 한진해운을 '투자위험 관리종목'에서 해제하고 '투자경고 관리종목'으로 지정하자 투자 심리가 일부 호전된 탓이다.시장경보제도에 따르면 주가가 일정기간 급등하는 등 투자 유의가 필요한 종목은투자주의종목→투자경고종목→투자위험종목 단계로 지정된다.이튿날인 2일에도 개장 직후 한진해운의 급등세는 이어졌다.개장 전 회생절차에 따라 미국 롱비치터미널 보유 지분 1억4천823만여주(1달러)와 주주대여금(7천249만9천999달러)을 처분했다는 공시가 호재로 작용했다.한진해운은 다른 미국 자회사이자 장비 임대 업체인 HTEC(HANJIN SHIPPING TEC.INC) 지분 100주(275만 달러)와 주주대여금(275만 달러)도 정리했다고 밝혔다.이에 장 초반 한때 24.08%까지 급등했던 한진해운은 파산 선고가 임박했다는 소식이 전해지면서 순식간에 급락세로 돌아서는 등 롤러코스터 장세를 펼쳤다.개인투자자들이 앞다퉈 주식을 내던지며 가격 하락을 부추기자 주가는 급전직하해 장 중 한때 -25.76%까지 폭락하기도 했다.결국 한진해운은 전날 종가보다 17.98% 떨어진 780원에 마지막 거래를 마치고서 오전 11시 24분부터 거래가 정지됐다.단기투자 차익을 노리며 오전 고점에 한진해운을 사고서 처분하지 못한 개미투자자의 경우 주가가 한순간에 반 토막이 나면서 40% 넘는 손실을 본 셈이다.상한가에 이어 이튿날 장 초반 24.08%까지 급등했던 한진해운은 결국 서울지방법원의 회생절차 폐지 결정으로 파산 절차를 기다리는 처량한 신세로 전락했다.한진해운 주식은 법원의 파산 선고 후 3거래일의 예고 기간 이후 거래가 재개된다. 이후 7거래일간 정리매매 기간을 거쳐 상장폐지 절차를 밟게 된다.법원은 오는 17일 한진해운에 파산(청산)을 선고할 예정이다.hyunmin623@yna.co.kr#흥 이렇게 흥겨울 수가...클릭하면 요지경!"
51,2017-02-04,"AI에 뚫린 서울, 생태공원 등 집중관찰…""조류 접촉 자제해야""",https://news.naver.com/main/read.nhn?mode=LSD&mid=shm&sid1=102&oid=001&aid=0009007694,연합뉴스,"반경 10㎞ 가금류 이동제한·분변채취…AI 확산 방지 안간힘(서울=연합뉴스) 김동규 기자 = 한강에서 발견된 뿔논병아리 폐사체에서 고병원성 조류인플루엔자(AI) 바이러스가 검출돼 서울도 AI 비상이 걸렸다.출입통제된 한강 성동지대 앞 도선장 일대 [연합뉴스 자료사진]4일 서울시에 따르면 서울에서 기르는 가금류는 총 1천66마리다. 농장에서 대량으로 닭이나 오리를 사육하는 곳은 거의 없고, 자가소비나 관상 목적으로 소규모로 사육하는 곳이 대부분이다. 동물원에서도 관람을 위해 각종 새를 기른다.시는 AI 확산을 막기 위해 이날부터 폐사체 발견 지점 반경 10㎞ 안에 있는 닭·오리 등 872마리의 이동을 제한했다. 서울의 5개 구를 제외한 19개 구가 모두 대상 지역에 포함됐다.가축 분뇨와 깔집, 알 등 이동도 함께 금지됐다.폐사체가 발견된 성동지대 앞 도선장 인근과 자전거도로를 폐쇄하고 물청소와 집중 소독 등 주말에도 총력 방역 태세를 갖추고 관리하고 있다.뿔논병아리 폐사체를 수거한 한강사업본부 직원 9명에게도 항바이러스 제제를 투여하고, 인플루엔자 예방접종을 하는 등 인체 감염을 막기 위한 조치도 했다. 시는 이들을 감염 조류 접촉 고위험군으로 분류해 앞으로 열흘간 몸 상태 등을 감시할 계획이다.한강과 지천 등 서울의 주요 야생 철새 도래지에 대한 관리도 격상됐다.특히 야생 철새 다수 개체가 모이는 강서습지생태공원과 성동살곶이공원 등은 이날 국립환경과학원 직원들이 나와 조류 분변을 채취해 AI 감염 여부를 검사했다.살곶이공원은 2015년 2월 채취한 야생조류 분변에서 고병원성 AI 바이러스가 검출된 적이 있어 특별히 면밀히 감시하고 있다.성동지대 도선장 주변은 철새가 자주 찾는 곳이 아니어서 폐사한 뿔논병아리는 한강 상류에서 죽은 뒤 강물에 떠내려왔을 가능성도 있다고 보고 상류 지역에 대한 감시도 강화했다.야생조류가 서식하는 강서·난지·암사·고덕 등 생태공원은 이미 작년 11월23일부터 폐쇄한 상태다. 이들 지역은 매일 소독과 예찰 활동을 하는 등 관리하고 있다.시는 지금까지 안양천, 도림천, 양재천, 중랑천 등 한강과 지천 등 야생조류 서식지 8곳에서 분변을 수거해 총 1천770점을 검사한 결과 고병원성 AI는 검출되지 않았다고 밝혔다.폐사체 발견지에서 3㎞ 떨어진 곳에 광진구 능동 어린이대공원이 있다.이곳에서도 조류 186마리를 관상용으로 기르고 있지만, 이미 작년 12월부터 AI 전파를 우려해 문을 닫아 확산 가능성은 작다.시 관계자는 ""어린이대공원은 수시로 사육 조류를 예찰하는 등 세심하게 별도로 관리하고 있다""며 ""아직 AI 양성 반응이나 특별한 징후는 없다""고 말했다.시는 서울의 경우 철새가 비교적 많지 않고 가금류 이동제한 조치 등 관리를 하고 있기 때문에 AI 추가 발생은 없을 것으로 기대하고 있다.관련 매뉴얼에 따라 폐사체 발견일 7일 이후 닭에 대한 임상검사 결과 이상이 없으면 닭 이동제한 조치를 해제하고, 오리와 기타 가금류는 14일 후 임상·혈청 검사를 해 이상이 없으면 이동제한을 풀 계획이다.시 관계자는 ""아직 국내에서 AI 인체 감염 사례는 보고된 바 없다""면서도 ""철저한 관리를 위해 예후를 관찰하고 방역 등에 만전을 기하고 있다""고 말했다.시는 야생조류 폐사체를 발견하면 절대 직접 만지지 말고 다산콜센터(☎ 120)나 서울시 AI 재난안전 대책본부(☎ 02-1588-4060)로 신고해 달라고 당부했다.야생조수류 예찰지역(발생지 반경 10km내) [서울시제공=연합뉴스]dkkim@yna.co.kr#흥 이렇게 흥겨울 수가...클릭하면 요지경!"
52,2017-02-04,"손학규 ""구구한 조건 내세우지 않을 것""..국민의당 합류 급물살",https://news.naver.com/main/read.nhn?mode=LSD&mid=shm&sid1=100&oid=008&aid=0003816571,머니투데이,"[머니투데이 정영일  기자] [[the300]'통합명분' 세우는 방안 국민의당이 제시할 듯…내주 구체화 전망]손학규 전 민주당 대표가 지난해 12월13일 오후 서울 용산구 효창로 백범기념관에서 열린 자신의 싱크탱크 동아시아미래포럼 창립 10주년 기념식에서 안철수 전 국민의당 대표와 악수하고 있다.  /사진=뉴스1손학규 국민주권개혁회의 의장의 국민의당 합류가 가시화되고 있다. 손 의장 측이 당내 지분이나 당명 변경 등을 요구하지 않는 대신 국민의당 측이 통합의 명분을 살릴 수 있는 방안을 제시하기로 한 것으로 알려졌다. 빠르면 내주 안에 통합의 구체적 움직임이 나올 것으로 보인다.4일 국민의당과 국민주권개혁회의 양측에 따르면 박지원 대표와 손학규 의장은 이날 오전 서울 모처에서 2시간 가량 조찬회동을 가졌다. 박 대표는 이날 오후 광화문에서 열린 당 국가대개혁위원회 출정식 참석 직후 기자들과 만나 ""구체적으로 (합류의) 조건이나 당명 개정이나 이러한 것은 얘기하지 않기로 했다""고 말했다.손 의장 역시 이날 회동 자리에서 ""모든 걸 내려놓고 정치를 다시 시작한 마당에 구구한 통합 조건을 내세우고 싶지 않다""고 말했다고 이찬열 국민주권개혁회의 공동집행위원장이 전했다. 손 의장은 또 최근 일부 언론에서 손 의장이 '국민주권당'으로 당명 변경을 요구했다고 보도가 나온 것 역시 잘못 알려진 것이라고 설명했다.손 의장은 다만 ""통합의 명분을 살리는 방안을 국민의당이 고민해 주길 바란다""고 당부했다. 이 위원장은 손 의장의 발언에 대해 ""다른 일체의 조건은 없지만 당명 개정 문제 등 통합 명분을 살리고 통합당의 외연을 넓히기 위한 최선의 방안을 고민해보자는 주문""이라고 해석했다.손 의장 주변에서는 그간 당내 지분을 요구하진 않더라도 당명에 '국민주권'이 포함되는 식의 변경은 필요하다는 주장이 제기돼 왔다. 박지원 대표는 ""손 의장께서 최근 우리당 지도부를 비롯한 몇몇 사람들이 찾아와서 얘기나눴다고 했다""며 ""좋은 방향으로 가기로 재확인했다""고 전했다.국민의당은 그간 손 의장 영입을 위해 지난 1월 있었던 당 전당대회에서 당헌당규 개정을 통해 손 의장 측이 주장해온 개헌 관련 내용을 당 강령 전문에 명시하고 정당명부식 비례대표제와 중대선거구제 개혁 적극 추진 등의 내용도 포함시켰다.국민의당은 손 의장과의 통합의 명분을 살리는 방안에 대한 당내 논의를 거쳐 늦어도 내주 후반에는 구체적인 움직임이 있을 것으로 예상된다. 박 대표는 ""월요일(6일) 최고위에서 논의하고 화요일(7일) 아침 일찍부터 그러한 문제에 대해 의원들 의견 들어보기로 했다""며 ""그 내용을 가지고 손 의장을 별도로 한 번 만나겠다""고 전했다.[이코노미스트들의 깊이있는 투자정보 'TOM칼럼'][부자들에게 배우는 성공 노하우 '줄리아 투자노트'  ][내 삶을 바꾸는 정치뉴스 'the 300']정영일  기자 bawu@mt.co.kr<저작권자 ⓒ '돈이 보이는 리얼타임 뉴스' 머니투데이, 무단전재 및 재배포 금지>"
