,날짜,기사 제목,기사 링크,기사 출처,기사 내용
144,2017-02-04,특검도 뚫지 못한 靑…압수수색 대치 장기화 우려,https://news.naver.com/main/read.nhn?mode=LSD&mid=shm&sid1=100&oid=421&aid=0002542838,뉴스1,"박근혜·최순실 국정농단 의혹사건을 수사 중인 박영수 특별검사팀이 3일 청와대 압수수색에 나섰다. 청와대 측은 3일 오후 2시쯤 특검의 압수수색에 대해 불승인사유서를 제출했고, 특검은 청와대에서 철수했다.2017.2.3/뉴스1 © News1 김명섭 기자'압수수색→자료분석→대면조사' 구상 흔들임의제출 가장 현실적…알맹이 쏙 뺀 자료만 넘길수도(서울=뉴스1) 심언기 기자 = 청와대가 박영수 특별검사팀의 경내진입 불가입장을 고수하며 압수수색 시간끌기에 나섰다.압수수색으로 확보한 자료를 분석해 박근혜 대통령 대면조사에서 활용하려던 특검 구상에 차질은 물론 압수수색 집행의 장기화까지 우려된다.특검은 3일 법원으로부터 발부받은 3개의 영장을 들고 청와대를 찾았지만 청와대는 형사소송법 110조(군사상 비밀과 압수)와 111조(공무상 비밀과 압수)를 근거로 압수수색 집행을 거부했다. 특검은 5시간여 만에 빈손으로 발길을 돌려야 했다.청와대의 버티기가 충분히 예견됐던 만큼 특검도 준비를 했다. 특검은 수사 초기부터 청와대 압수수색을 염두에 두고 법리검토를 해왔지만 청와대가 거부할 경우 강제집행이 사실상 어렵다는 결론을 내렸다. 결국 황교안 대통령권대행을 통한 우회로와 여론전으로 돌파구를 마련하기로 입장을 정리했다.통상 압수수색영장 기한은 일주일이지만 특검은 청와대를 대상으로는 이례적으로 한달짜리 영장을 끊었다. 특검 공식 활동기한인 28일까지로, 언제든 상황변화가 생기면 집행이 가능하도록 했다. 또 황 대행에게 청와대 압수수색의 협조를 요청하는 공문도 보냈다. 특검의 수사기한 연장권한도 쥐고 있는 황 대행의 결심에 따라 압수수색 길이 열리는 셈이다.하지만 황 대행 측은 ""대통령비서실장, 경호실장이 관련 법령에 따라 특검의 청와대 경내 압수수색에 응하지 못한 것으로 알고 있다""고 밝혔다. '관련 법령'을 내세워 사실상 협조 거부의사를 밝힌 것으로 풀이된다.청와대 역시 특검의 압수수색 집행 시도에 대해 ""무리한 수사를 실시하는 것은 헌법에 정면으로 위배되므로 심히 유감""이라며 ""불소추특권은 대통령이 재직 중 국가를 대표하면서 그 신분과 권위를 유지하기 위한 최소한의 헌법상 보호조치""라고 주장했다. 향후에도 특검의 경내진입 불가방침도 분명히 했다.청와대 압수수색이 난항을 겪으면서 남은 방법은 여론에 기댄 청와대 압박과 검찰과 마찬가지로 임의제출 형식으로 자료를 받는 방안이 거론된다.하지만 청와대는 촛불민심과 거센 하야 요구를 일축하며 비판여론에 덤덤한 반응을 보여왔다. 청와대가 여론을 의식해 압수수색에 응할 가능성은 낮아보인다. 청와대 경내진입을 시도했던 검찰 특별수사팀의 임의제출 선례가 가장 현실적이란 지적이 나온다.다만 임의제출의 경우에도 청와대의 비협조가 예상되는 만큼 얼마나 유의미한 자료를 확보할 수 있을지는 미지수다.청와대가 보안 등을 이유로 내세워 검찰 때와 마찬가지로 압수수색 영장에 적시된 자료들을 내주지 않을 가능성이 높다. 압수수색 대상장소가 10곳이 넘는 만큼 자료의 양도 방대한데다, 청와대가 이를 선별한다는 구실로 시간끌기에 나설 가능성도 있다.eonki@▶ 놓치면 후회! 최신 무료만화 보기/2017년 나의 운세 보기[© 뉴스1코리아(news1.kr), 무단 전재 및 재배포 금지]"
145,2017-02-04,"미국 가전공장 추진에 트럼프 ""생큐, 삼성""…현대차·LG도 고심",https://news.naver.com/main/read.nhn?mode=LSD&mid=shm&sid1=101&oid=015&aid=0003723044,한국경제,"커지는 미국 투자 압박공장 신설 보도에 트윗…긍정도 부정도 못해저울질 하던 공장 신설 확정…위치 등 미지수""멕시코보다 임금 8배 높아 지속 가능할지…""[ 뉴욕=이심기 / 김현석 기자  ]“생큐, 삼성.”“고마워요 삼성! 당신과 함께하고싶다”는 글을 올린 도널드 트럼프 미국 대통령의 트위터.삼성전자는 3일 새벽부터 바빴다. 도널드 트럼프 미국 대통령이 ‘삼성이 미국에 가전공장을 지을 것’이라는 보도를 보고 고맙다는 트윗을 날려서다. 미국 공장 신설을 신중히 검토해온 삼성은 “확정된 게 없다”면서도 트럼프의 트윗에 부인도, 긍정도 못하는 난감한 처지가 됐다.트럼프 대통령이 미국에 대한 투자, 일자리 창출 등을 강하게 밀어붙이면서 국내 기업들이 큰 압박감을 느끼고 있다. 삼성전자뿐 아니라 미국 사업 비중이 큰 현대·기아자동차, LG전자 등도 투자 확대 등을 추진 중이다. 하지만 멕시코 등에 비해 인건비가 6~8배 비싼 미국에 공장을 지을 경우 지속 가능할지 의문도 커지고 있다.◆삼성, 미국 가전공장 신설 확정트럼프 대통령은 3일 새벽(현지시간) 자신의 트위터 계정에 ‘고마워요 삼성! 당신과 함께하고 싶다(Thank you, @samsung! We would love to have you!)’라고 썼다. 삼성전자가 미국에 공장을 지을 수 있다는 미국 온라인 매체 악시오스(Axios)를 보고 트윗한 것이다. 이 매체는 전날 로이터가 쓴 기사를 전재했다. 삼성전자 관계자는 “로이터의 취재에 ‘공장 신설을 검토 중이나 결정된 게 없다’고 답했는데, 기사가 떴고 트럼프 대통령이 트윗까지 날렸다”고 난감해했다.트럼프는 작년 12월 구글 애플 등 정보기술(IT) 기업의 수장을 불러 연 테크서밋에 이재용 삼성전자 부회장도 초청하는 등 삼성에 큰 관심을 보여왔다. 미주 매출 비중이 32%(2016년 기준)에 달하는 삼성전자는 미국 내 가전공장 설립을 사실상 결정하고 부지를 물색하고 있다. 그동안 미국에 파는 TV는 멕시코 티후아나에서, 냉장고 등 가전은 멕시코 게레타로에서 생산해 트럼프 정부가 국경조정세를 매긴다면 타격을 받을 수밖에 없다. 삼성 관계자는 “공장 건설 시점, 부지 선정 등 아직 결정된 건 아무것도 없다”며 “노스캐롤라이나, 앨라배마 등 남부 지역이 유력하지만 중부 러스트벨트를 선택할 수도 있다”고 말했다.삼성은 인건비와 제조 여건, 물류비 등을 감안할 때 미국 남부가 유리하다고 판단하고 있다. 또 주정부에서 투자 인센티브를 받아내 원가 부담을 줄인다는 계획이다. 삼성은 텍사스 오스틴의 반도체 공장에 올 상반기까지 10억달러를 투자할 계획이고, 지난해 인수한 빌트인 가전업체 데이코의 로스앤젤레스(LA) 공장 증설도 추진 중이다.◆LG전자, 뉴저지 사옥 착공미국 투자 확대는 삼성만의 고민이 아니다. 현대·기아차는 향후 5년간 미국에 31억달러를 투자하겠다고 지난달 17일 발표했다. 지난 5년간 미국에 투자한 규모보다 10억달러가량 많은 액수다.하지만 여기엔 연구개발(R&D)과 기존 생산시설 개선 투자만 포함돼 있을 뿐 신규 공장 건립은 빠져 있다. 현재 이 회사는 연간 미국 판매량 140만대 중 절반은 현대차 앨라배마 공장(연산 37만대 규모)과 기아차 조지아 공장(연산 34만대)에서 생산해서 팔고, 절반은 국내에서 수출하고 있다.미국 시장 수요에 따라 공장 신설도 할 수 있다는 입장이다. 기아차는 또 작년 9월 멕시코에 신규 공장을 완공해 새 공장을 짓기 어렵다. 미국 시장은 장기적으로 볼 때 수요가 늘어나는 곳이 아니라는 점도 고민거리다.LG전자도 가전공장 신설을 추진 중이다. 조성진 LG전자 부회장은 지난달 초 “수입해 판매하는 사람은 불이익을 당할 수밖에 없는 상황에서 넋 놓고 있을 수 없다”며 “올 상반기 미국 내 생산공장 건설 여부를 결정할 것”이라고 말했다. 공장 후보지로는 테네시주 등 한두 곳을 검토하고 있는 것으로 알려졌다.LG전자는 또 미주 사옥을 뉴저지주 잉글우드클리프스에 짓기로 하고 오는 7일 착공식을 한다. 2019년 완공하는 새 사옥은 1만㎡ 부지에 북관(5층), 남관(3층), 아트리움(3층) 등 세 동의 빌딩으로 지어지며 1000명 이상이 일하게 된다.뉴욕=이심기 특파원/김현석 기자 realist@hankyung.com[한경닷컴 바로가기] [스내커] [모바일한경 구독신청]ⓒ 한국경제 &hankyung.com, 무단전재 및 재배포 금지"
146,2017-02-04,"학고재 대표, ""우병우 측에 투자 차원서 그림 사라 권했다""",https://news.naver.com/main/read.nhn?mode=LSD&mid=shm&sid1=100&oid=005&aid=0000969637,국민일보,"박영수 특별검사팀이 우병우 전 청와대 민정수석의 가족회사 ㈜정강이 사들인 미술품 관련 의혹을 본격 추적하고 있다. 특검 관계자는 “4일 우찬규(60) 학고재화랑 대표를 참고인 신분으로 소환조사할 예정”이라고 3일 밝혔다.우 대표는 국민일보와의 통화에서 “2014년 정강 측에 미술품 투자 차원에서 그림 2점을 사라고 권했고 정강이 이를 따랐다”고 말했다. “그림의 가격은 3억1000만원이었다”고 설명했다. 그림은 한국의 대표적 현대미술가 이우환 화백의 작품인 것으로 알려졌다.3억1000만원은 재무제표상 2014년 말까지 정강이 소장하고 있던 미술품의 금액과 정확히 일치한다. 정강은 이듬해 미술품 1억3160만원 어치를 추가로 매입해 2015년말 기준으로 총 4억4160만원 상당의 미술품을 보유하고 있었다.그러나 재무제표상 유형자산 목록에 올라있는 이 미술품들은 지난해 8월 검찰 특별수사팀의 서울 서초구 정강 사무실 압수수색 당시에는 발견되지 않았다. 미술품들은 우 전 수석의 집에 보관돼 있던 것으로 알려졌다. 특검은 우 전 수석 가족이 정강 회삿돈으로 미술품을 구입해 개인 소장했다면 횡령에 해당할 수 있다고 본다. 또 우 전 수석의 공직자 재산신고 목록에서 미술품 재산 내역이 빠져 있던 점도 수상하게 보고 있다.특검은 우 대표를 상대로 미술품 구입을 권하게 된 계기와 정강이 이를 구매한 배경, 미술품이 송달된 곳이 애초 정강 사무실이 아닌 우 전 대표의 집이었는지 여부 등을 조사할 예정이다.우 대표는 1998년 학고재라는 이름의 화랑을 설립했다. 검찰 특별수사팀의 우 전 수석 개인비리 수사 당시 압수수색을 당했으며, 우 대표도 두 차례 참고인 조사를 받았다. 그는 “우 전 수석과 단양 우씨 종친으로 20여년 정도 알고 지냈다”고 말했다.황인호 기자 inhovator@kmib.co.kr[국민일보 홈페이지][페이스북][트위터][국민일보 꿀잼영상 바로가기]GoodNews paper ⓒ국민일보(www.kmib.co.kr), 무단전재 및 재배포금지[뉴스 미란다 원칙] 취재원과 독자에게는 국민일보에 자유로이 접근할 권리와 반론·정정·추후 보도를 청구할 권리가 있습니다. 고충처리인(gochung@kmib.co.kr)/전화:02-781-9711"
147,2017-02-04,"'강남부터 광화문까지'…14차 촛불 ""2월 탄핵"" 외친다",https://news.naver.com/main/read.nhn?mode=LSD&mid=shm&sid1=100&oid=421&aid=0002542852,뉴스1,"21일 오후 서울 광화문광장에서 열린 제13차 촛불집회에 참가한 시민들이 박근혜 대통령 퇴진을 촉구하며 함성을 지르고 있다./뉴스1 © News1 민경석 기자대한문 앞에선 '맞불' 태극기 집회…충돌 우려 증가(서울=뉴스1) 정재민 기자 = 지난주 설연휴에 숨 고르기를 했던 촛불집회와 태극기집회 등 박근혜 대통령 탄핵 찬반단체의 집회·행진이 4일 재개된다.박근혜정권퇴진 비상국민행동(퇴진행동)은 4일 설연휴를 마치고 열리는 첫 촛불집회를 2월 탄핵을 요구하는 중요한 출발점으로 두고 Δ박근혜 즉각 퇴진과 탄핵 Δ황교안 대통령 권한대행 사퇴 Δ공범자 구속 등을 촉구할 예정이다.퇴진행동은 이날 14차 범국민행동의 날을 맞아 오후 2시 서울 종로구 헌법재판소와 삼성 본관, 서울중앙지법 앞 등에서 사전대회와 행진을 진행한다.오후 5시부터는 본집회, 7시30분부터 8시50분까지는 행진을 이어나간다. 행진은 청운동과 헌재, 총리공관 등 세 방향으로 진행된다.퇴진행동은 박 대통령을 대상으로 한 탄핵심리가 이미 충분히 이뤄졌다며 탄핵결정이 2월 이내에 내려져야 한다는 주장이다. 퇴진행동은 2월 안에 대통령에 대한 탄핵 인용이 이뤄지지 않는다면 오는 25일 박 대통령 취임 4주년을 맞아 대규모 집회를 연다는 방침이다.보수성향 시민단체들의 '맞불' 집회도 이어진다.대통령 탄핵 기각을 위한 국민총궐기 운동본부(탄기국)는 이날 오후 2시 서울시청 앞 대한문에서 제11차 탄핵무효 태극기 애국집회를 개최한다.탄기국은 ""사상 최대의 유모차 부대가 출동한다""며 대규모 집회를 예고했다.이에 경찰은 양 집회가 가까운 거리에서 이뤄지는 만큼 상호마찰을 자제해 줄 것을 당부하면서 ""각 단체의 집회·시위가 안정적으로 개최될 수 있도록 최선의 노력을 다할 것""이라면서도 ""기물파손과 상호 폭력 등 불법행위에 대해서는 엄정조치할 것""이라고 밝혔다.한편 서울시는 이번 집회와 관련해 지하철 등 대중교통을 증편 운영하고 막차시간을 연장하는 등 시민 지원대책을 마련했다.광화문광장 주변에는 총 4개 동의 이동화장실이 마련되고 210곳의 민간·공공건물 화장실이 개방된다. 서울시청 본관 1층 로비와 청계별관 1층 로비에는 미아보호와 분실물신고센터가 운영된다.박사모 등 보수단체 회원들이 31일 오후 서울 서초구 서울중앙지방검찰청 앞에서 박근혜 대통령 탁핵심판 및 김수남 검찰총장을 규탄하는 집회를 열고 있다./뉴스1 © News1 민경석 기자ddakbom@▶ 놓치면 후회! 최신 무료만화 보기/2017년 나의 운세 보기[© 뉴스1코리아(news1.kr), 무단 전재 및 재배포 금지]"
148,2017-02-04,"불황에도…작년 한국인 해외여행 지출 231억弗, 사상최대",https://news.naver.com/main/read.nhn?mode=LSD&mid=shm&sid1=103&oid=001&aid=0009007040,연합뉴스,"작년 내국인 출국자수 2천만명 돌파…전년보다 12% 늘어(서울=연합뉴스) 신호경 이도연 기자 = 전반적인 경기 불황과 소비 침체에도 지난해 우리나라 국민이 해외여행을 통해 지출한 비용은 '사상 최대를 기록했다.4일 문화관광부와 한국은행 국제수지 통계에 따르면 작년 일반 해외여행 지출액은 모두 231억2천만 달러로 2015년(215억3천만 달러)보다 7.4% 늘었다.이 증가율은 지난해 국내총생산(한은 2.7% 예상)이나 민간소비(2.8%) 증가율의 세 배 이상의 수준이다.국제수지 통계에서 일반여행 지급액은 유학·연수 등의 목적이 아닌 여행·출장 목적으로 외국에 체류하면서 숙식·물건 구매 등에 지출한 돈을 말한다.최근 연도별 일반여행 지급액은 ▲ 2011년 155억3천만 달러 ▲ 2012년 164억9천만 달러 ▲ 2013년 173억4천만 달러 ▲ 2014년 194억7천만 달러 ▲ 2015년 215억3천만 달러 ▲ 2016년 231억2천만 달러 등으로 해마다 사상 최대 기록을 경신하고 있다.이처럼 한국인의 해외여행 지출액이 눈덩이처럼 불어나는 것은 여름 휴가나 명절 연휴 등을 이용해 나라 밖으로 떠나는 일이 보편화하고 있기 때문이다.실제로 한국관광연구원 관광지식정보시스템를 보면, 지난해 내국인 출국자 수는 연인원 2천238만3천190명으로 2015년(1천931만430명)보다 11.6% 늘었다.한 대형 여행사 관계자는 ""아무리 불황이라고 해도, 전반적으로 국민 소득 수준이 높아지고 다양한 해외여행 상품도 쏟아지기 때문에 해외여행객은 갈수록 늘어날 수밖에 없다""며 ""올해 해외여행객과 지출액도 사상 최대 기록을 세울 가능성이 크다""고 전망했다.설연휴 첫날 인천공항 북적(영종도=연합뉴스) 서명곤 기자 = 설 연휴 첫날인 27일 오전 인천국제공항 출국장이 여행객들로 북적이고 있다. 인천국제공항공사에 따르면 27일 인천공항을 통해 출국하는 여행객은 8만 7천602명, 도착하는 여행객은 9만 4천636명으로 모두 18만 2천238명에 달할 것으로 추산됐다. 2017.1.27 seephoto@yna.co.kr지난해 외국인이 한국에 머물면서 지출한 '일반여행 수입'은 170억9천만 달러로 전년의 150억9천만 달러보다 13.3% 늘었다. 2015년 '메르스(중동 호흡기 증후군)' 사태로 주춤했던 유커(중국인 관광객) 등의 행렬이 다시 이어졌기 때문으로 분석된다.지난해 여행 수입은 사상 최대 기록인 2014년의 177억1천만 달러에 육박하는 수준이다.일반여행 수입은 2011년 123억5천만 달러, 2012년 133억6천만 달러, 2013년 145억2천만 달러를 거쳐 2014년 177억 달러까지 급증했지만 2015년 메르스 여파로 뒷걸음질했다.이처럼 지난해 일반여행 수입 증가율이 지급액 증가율보다 높았기 때문에, 일반여행 수지 적자 규모(60억4천만 달러)도 2015년(64억4천만 달러)보다 다소 줄었다.shk999@yna.co.kr, dylee@yna.co.kr#흥 이렇게 흥겨울 수가...클릭하면 요지경!"
149,2017-02-04,파리 루브르 흉기테러범은 29세 이집트인…관광비자로 입국,https://news.naver.com/main/read.nhn?mode=LSD&mid=shm&sid1=104&oid=001&aid=0009007048,연합뉴스,"지난주 입국해 흉기 구입…""철저히 결심하고 범행""루브르 박물관에서 경계근무 중인 무장경찰들[AP=연합뉴스 자료사진](서울=연합뉴스) 김경윤 기자 = 프랑스 파리 루브르박물관에서 3일(현지시간) 경계근무 중인 군인을 흉기로 공격한 테러범은 관광비자를 받아 입국한 이집트인으로 확인됐다.프랑스 수사당국은 루브르박물관 테러범이 아랍에미리트(UAE)에 거주하는 29세 이집트 남성이라고 밝혔다고 영국 BBC방송, AP통신 등이 이날 보도했다.이집트의 정보 소식통도 테러범이 카이로 북동부 다칼리야주(州) 출신인 압둘라 레다 알하마니라고 확인했다.이 테러범은 지난달 26일 관광비자를 받아 두바이에서 파리로 입국했으며 파리의 총포상에서 군용 마체테(날이 넓고 긴 칼) 두 자루를 구매한 것으로 드러났다.프랑수아 몰랭스 파리 검사장은 이날 기자회견에서 ""모든 면에서 흉기 공격범이 매우 철저히 결심하고 (테러를) 벌인 것으로 보인다""고 설명했다.프랑스 경찰은 테러범이 샹젤리제 고급 주택가에 임대한 아파트를 수색하며 이번 테러가 충동적으로 벌인 단독범행인지 아니면 누군가의 사주를 받은 것인지를 조사하고 있다.UAE 정부는 이번 테러에 대해 ""혐오스러운 범죄""라며 프랑스와 연대할 것이라고 강조했다.이 테러범은 3일 오전 루브르박물관 지하 쇼핑몰 연결 계단에서 경계근무를 서던 군인들에게 진입을 제지당하자 '알라후 아크바르'('신은 위대하다'는 아랍어 표현)라고 외치며 흉기를 휘둘렀다.군인들은 실탄 5발을 발사해 범인을 제압했으며 테러범은 현재 중태에 빠져 병원에 이송된 상태다.루브르박물관은 파리의 대표적인 관광지로 사건 당시에도 1천여 명의 방문객이 박물관을 찾은 상태였다.heeva@yna.co.kr#흥 이렇게 흥겨울 수가...클릭하면 요지경!"
