,날짜,기사 제목,기사 링크,기사 출처,기사 내용
97,2017-02-04,"4월 '동전없는 사회' 시범실시…""잔돈으로 교통카드 충전""",https://news.naver.com/main/read.nhn?mode=LSD&mid=shm&sid1=101&oid=277&aid=0003925271,아시아경제,"내주 편의점 '씨유' 등 시범사업자 최종선정 …자율사업자 공개모집 예정설명회에 네이버 ·카카오 등 55곳 몰리기도 …2020년 '동전없는 사회' 본격 시행사진=아시아경제 DB.[아시아경제 조은임 기자]오는 4월부터 일부 편의점에서 거스름돈을 교통카드에 충전할 수 있게 된다. 한국은행은 다음 주 초 '동전없는 사회' 시범사업자를 최종 확정한 후, 곧바로 자율사업자를 모집에 나설 예정이다.4일 한은에 따르면 '동전없는 사회' 시범사업이 오는 4월부터 시행된다. 이는 2020년까지 추진되는 '동전없는 사회'의 1단계 사업으로 편의점에서 거스름돈을 선불카드에 충전하는 방식이다. 이 시범사업에는 총 1억9000여만원의 예산이 투입된다.한은은 지난달 31일 '동전없는 사회' 총 6곳에서 입찰을 받았다. 현재 모든 평가를 끝내고 개별 협상을 진행 중이다. 입찰에 참여한 업체는 편의점업체로는 씨유(CU) 한 곳과 선불카드 업체로는 한국스마트카드, 캐시비, 한페이, DGB유페이, 레일플러스 등 5곳이 참여했다. 앞서 23일 열린 사업설명회에는 네이버, 카카오, SK플래닛 등 IT업체와 KEB하나은행, BC카드, IBK기업은행 등 금융사를 포함해 총 55개 업체가 대거 몰리기도 했다.한은은 다음 주 초 시범사업 참가자를 최종 확정할 예정이다. 이후 내달 시스템 정비작업을 거쳐 오는 4월이면 일부 지역을 우선으로 하나씩 시범사업을 진행하게 된다.자료:한국은행또 다음 주 중 다른 충전모델을 갖춘 자율사업자를 공개모집할 계획이다. 선불카드 충전이 아닌 방식으로 잔돈을 충전하는 방안을 모색하겠다는 취지다. 한은은 당초 시범사업의 효과가 입증되면 잔돈을 개인 계좌에 직접 입금하고, 편의점 외에 다양한 업종에서 사업을 추진하겠고 밝힌 바 있다. 약국, 대형마트 등에서 잔돈을 직접계좌로 입금받거나 애플리케이션(앱) 카드로 충전받는 방식도 논의되고 있다.한은은 동전의 발행 ·유통비용을 절감하기 위해 2020년까지 '동전없는 사회'를 단계적으로 확대할 계획이다. 작년 한 해 주화(동전) 발행하는 데 든 비용은 537억원으로 집계됐다. 전체 화폐제조비용(1503억원) 중 3분의1이상을 넘어선다. 하지만 환수율은 16.2%에 그쳤다.작년 6~9월 한은이 전국 성인 2500명을 대상으로 실시한 조사 결과 '잔돈으로 동전을 받더라도 사용하지 않겠다'는 답변이 46.9%에 달했고, 동전을 사용하지 않는 이유 중 62.7%가 '소지 불편'을 꼽았다.조은임 기자 goodnim@asiae.co.kr▶ 최강의 재미 [아시아경제 카드뉴스]▶ 맛있는 레시피▶ 양낙규의 [군사이야기]<ⓒ세계를 보는 창 경제를 보는 눈, 아시아경제 무단전재 배포금지>"
98,2017-02-04,초고층 동탄 메타폴리스 연결 상가 불…남녀 4명 숨져,https://news.naver.com/main/read.nhn?mode=LSD&mid=shm&sid1=102&oid=001&aid=0009007408,연합뉴스,"동탄 메타폴리스 상가 화재…3명 사망·1명 의식불명    (화성=연합뉴스) 홍기원 기자 = 4일 오전 11시께 경기도 화성시 동탄 메타폴리스 단지 내 상가 건물에서 불이 나 신고를 받고 출동한 소방대에 의해 약 1시간 만에 진압됐다. 사진은 소방대원들이 사상자를 이송하는 모습. 2017.2.4    xanadu@yna.co.kr상가 3층 어린이 놀이시설 불…거주민 수백명 대피(화성=연합뉴스) 류수현 기자 = 4일 오전 11시께 경기도 화성시 동탄 메타폴리스 단지 내 3층짜리 상가 건물 뽀로로파크에서 발생한 화재로 성인 남녀 4명이 숨졌다.화성 동탄 메타폴리스 단지내 상가서 불    (서울=연합뉴스) 4일 오전 11시께 경기도 화성시 동탄 메타폴리스 단지 내 상가 건물에서 불이 나 주민들이 대피했다. 소방당국은 펌프차 등 장비 30여대와 인원 100여명을 동원해 화재 진압에 나섰다. 경찰과 소방당국은 불길이 잡히는 대로 정확한 피해규모와 화재 원인을 조사할 계획이다. 2017.2.4 [독자 제공=연합뉴스]    photo@yna.co.kr소방당국은 불을 진압하고 나서 건물 안을 수색하던 중 의식을 잃고 쓰러진 이들을 발견했다고 전했다.동탄 메타폴리스 상가 화재…3명 사망·1명 의식불명    (화성=연합뉴스) 홍기원 기자 = 4일 오전 11시께 경기도 화성시 동탄 메타폴리스 단지 내 상가 건물에서 불이 나 신고를 받고 출동한 소방대에 의해 약 1시간 만에 진압됐다. 사진은 소방대원들이 사상자를 이송하는 모습. 2017.2.4    xanadu@yna.co.kr불이 치솟자 메타폴리스 본동에 거주하는 주민 100여명이 대피했으며, 이 중 10여명이 단순 연기 흡입으로 병원 치료를 받고 있다.you@yna.co.kr#흥 이렇게 흥겨울 수가...클릭하면 요지경!"
99,2017-02-04,트럼프는 왜 세계 제조업 강국에 화가 났나,https://news.naver.com/main/read.nhn?mode=LSD&mid=shm&sid1=101&oid=011&aid=0002968475,서울경제,"미국 경제 70% 내수·세계 수입액 13% 넘어한해 수입액만 2조달러·한국 수출액의 4배돈은 미국이 쓰고 일자리는 해외서 늘어빈곤·낮은 고용에 만성 재정적자는 지속“중국은 역사적으로 세계에서 가장 거대한 도둑이다. 중국이 미국을 자신들의 돼지저금통(piggy bank)으로 이용하고 있다”미국 대통령 선거 때 중국에 ‘강간(rape)’이라는 거친 말까지 던지며 보호무역을 강조했던 도널드 트럼프가 취임했다. 세계 최대 군사·경제 대국인 미국의 위상을 볼 때 취임 후 선거 때 걸었던 공약을 완화할 것이라는 예측이 우세했다. 하지만 꿈도 잠시. 트럼프는 지난 21일(현지시간) 취임사에 “우리 공장이 사라지는 등 미국인이 빈민가에 머무는 ‘대학살(carnage)’은 여기서 멈춰야 한다”며 한술 더 떴다. 이후 멕시코가 포함된 북미자유무역협정(NAFTA) 재협상을 선언했고 동시에 최대 우방이자 주요 수입국인 일본이 포함된 환태평양경제동반자협정(TPP) 폐기를 위한 행정명령에 서명했다. 이달에는 미국에서 막대한 무역흑자를 내는 중국과 독일, 일본을 콕 집어 ‘환율조작국’이라며 맹비난을 퍼부었다. 미국의 주요 적자국은 중국과 캐나다, 멕시코, 일본, 독일, 한국 등 제조업 강국.“미국에 투자하지 않으면 대신 무거운 세금을 내라”는 트럼프의 엄포에 멕시코 등 해외에 생산공장을 짓기로 했던 현대기아차·도요타·피아트크라이슬러·애플 등은 대규모 미국투자를 약속하며 백기 투항했다. 트럼프의 행보를 볼 때 선거 당시 ‘재앙’이라고 표현한 한미 자유무역협정(FTA) 재협상을 요구할 가능성이 커지며 한국도 경고등이 켜졌다.트럼프는 왜 제조업 강국에 화가 났을까. 미국은 내수(국내소비·투자) 위주 경제다. 전체 경제규모(GDP, 2016년 기준 18억5,619억달러)에서 내수가 차지하는 비중은 70%에 달한다. 이 때문에 미국은 엄청난 세계 상품을 빨아(수입)들인다. 한국무역협회에 따르면 2015년 기준 미국이 수입한 금액은 2조2,416억달러. 우리나라 수출액(2015년 기준·5,267억달러)의 네 배, 경제규모(2016년 기준·1조4,044억달러)보다도 크다.미국은 수입액 가운데 21.5%(4,818억달러)를 중국에서 들여오고 있다. NAFTA 회원국인 캐나다(13.2%)와 멕시코(13.1%)까지 합하면 중국·캐나다·멕시코에서만 전체의 절반(47.8%)을 수입하고 있다. 수입 4위국은 일본(5.8%), 5위는 독일(5.5%), 6위는 한국(3.2%)이다. 2015년 미국은 중국에서 3,656억달러, 독일(741억달러)과 일본(686억달러), 멕시코(483억달러), 한국(283억달러)에서도 큰 무역적자를 기록했다. 미국은 이 국가들에서 자동차(1위)와 전자기기(2위) 등을 주로 수입하고 있다.문제는 미국이 다른 나라의 물품을 사는데 엄청난 돈을 썼지만 정작 미국인의 일자리나 양극화는 해결되지 않았다는 점이다. 미국의 빈곤층 인구는 전체(약 3억2,400만명)의 13.5%에 달하는 4,300만명에 이르고 이 가운데 어린이 빈곤층만 1,400만명에 달한다. 세계은행에 따르면 미국의 상대적 빈곤율은 2013년 17.2%에서 2014년 17.5%로 더 악화됐다. 상대적빈곤율은 인구를 소득순으로 나열했을 때 정 가운데 있는 소득인 중위소득의 절반(50%)에 못 미치는 비율을 말한다. 상대적빈곤율이 17.5%라는 말은 중위소득이 2만 달러일 때 소득이 1만 달러 미만인 사람의 비율이 17.5%라는 얘기다.소득 양극화도 고착됐다. 미국 전체 소득에서 저소득층인 하위 20%가 가져간 비율은 2004년(5.15%), 2013년(5.1%)이나 나아지지 않았다. 상대적 고소득층인 상위 20%의 소득점유율도 2004년(46.01%)과 2013년(46.44%)이 거의 동일하다.양극화로 인한 사회보장성 지출이 늘어나며 미국정부의 채무는 급증하고 있다. 2008년 금융위기 이후 미국의 국가채무는 8년간 약 2배 증가해 GDP의 100%를 넘어선 19조 달러로 치솟았다. 미 재무부 금융관리국에 따르면 2015년 재정적자는 4,380억달러, 지난해는 1,485억달러(33.8%) 더 늘어난 5,874억달러를 기록했다.특히 미국은 전체 예산에서 사회보장 등 의무지출 비중이 크게 뛰는 추세다. 미국 의회예산국(CBO) 분석 결과 2015년 의무지출 비중은 2조3,000억달러에 육박한다. 이 가운데 사회보장 지출은 8,820억달러, 노인의료보험인 메디케어 지출은 6,340억달러를 기록했다. 특히 저소득층을 위한 영양보조프로그램 지출(SNAP)은 2007년 350억달러에서 지난해 750억달러, 65세 미만의 저소득층과 장애인을 위한 의료보조프로그램인 메디케이드는 지출이 2007년 1,900억달러선에서 지난해 3,940억달러까지 뛰었다. CBO는 2026년까지 미국의 의무지출이 연평균 5.5% 증가해 4조1,000억달러로 늘어날 것으로 내다봤다. 사회보장 지출은 현재보다 두 배 늘어난 1조6,000억달러, 메디케이드는 6,480억달러에 육박할 예정이다. 2027년에 미국은 재정 적자가 무려 10조달러(약 1경 1,695조 원)로 증가할 전망이다.트럼프는 이 문제의 원인을 ‘일자리’로 지목했다. 미국은 우리나라처럼 전 국민이 가입하는 국민건강보험이 없다. 대신 직장을 가지면 직장에서 의료보험을 들어준다. 직업이 없으면 소득이 사라지는 것은 물론 의료복지 혜택에서도 제외된다. 미국의 사회보장과 의료보험 지출이 늘어난 이유는 고용률만 봐도 나타난다. 2000년 미국의 고용률은 74%에 달했지만 2011년 66.6%까지 하락했고 현재는 68% 수준을 유지하고 있다. 트럼프는 취임 때 미국 백악관 홈페이지를 통해 2008년 금융위기 이후 미국의 제조업에서만 일자리 30만개가 사라졌고 각 사업장에서의 미국인 비율이 1970년대 이후 최저로 떨어졌으며 국가 부채는 2배가 됐다고 게시했다. 반면 미국에 수출을 많이 한 한국은 2004년 고용률이 61.5%에서 2015년 65.7%로 뛰었고 일본도 68.9%에서 73.3%로 늘었다. 캐나다도 67.5%에서 72.5%로 독일도 64.6%에서 74%로 증가했다.트럼프의 메시지는 간단하다. “이제 미국이 손해 보며 돈을 쓰는 시대는 끝났다”는 선언이다. 팔고 싶으면 미국에 들어와서 미국인을 고용해서 잘 살게 하고, 아니면 높은 세금을 내라는 요구다. 양준모 연세대 경제학과 교수는 “미국에서 생기는 일자리의 10%가 국가가 돈을 쓰는 공공일자리인데 국가 돈은 엄청 들어가지만 임금도 낮고 지속가능성도 적다”며 “재정적자가 심화되고 국내적 혼란을 해결할 기폭제로 트럼프는 ‘기업이 만드는 일자리’를 선택했다”고 설명했다./세종=구경우기자 bluesquare@sedaily.com[서울경제 바로가기]나와 찰떡 궁합인 대선 후보는?[설문 바로가기]서울경제와 친해지는 가장 확실한 방법[페이스북]저작권자 ⓒ 서울경제, 무단 전재 및 재배포 금지"
100,2017-02-04,"""법원→삼성→광화문"" 14차 촛불집회…대규모 맞불도",https://news.naver.com/main/read.nhn?mode=LSD&mid=shm&sid1=100&oid=079&aid=0002926097,노컷뉴스,"박종민 기자/자료사진박근혜 대통령 탄핵을 요구하는 14차 촛불집회가 4일 전국 곳곳에서 개최된다.전국 2100여 개 시민사회단체연합 박근혜대통령퇴진 비상국민행동(퇴진행동)은 이날 오후 5시부터 종로구 광화문광장에서 14차 촛불집회를 열겠다고 밝혔다.설 연휴 잠시 숨 고르기에 들어갔던 촛불 집회가 재개되면서 박 대통령 즉각 탄핵을 요구하는 목소리가 또다시 도심을 뒤덮을 것으로 보인다.이재용 삼성전자 부회장의 구속영장 기각에 이어 전날 특검의 청와대 압수수색까지 불발되자 권력을 규탄하는 목소리는 더욱 거세질 전망이다.이와 관련해 사전집회는 오후 2시 서초동 서울중앙지법 앞에서 열리고, 참가자들은 삼성 본관 앞으로 행진한 뒤 광화문 본집회로 합류하게 된다.본집회 이후 오후 7시 30분부터는 전과 마찬가지로 청와대, 헌재, 총리공관 등으로 행진할 예정이다.박종민 기자/자료사진퇴진행동 남정수 공동대변인은 ""박근혜 대통령을 2월 안에 탄핵하라는 것이 우리의 요구""라며 ""특히 이재용 부회장에 대한 구속영장 재청구와 재벌총수 등 공범자에 대한 제대로 된 처벌이 필요하다""고 말했다.이날 촛불집회는 서울, 부산, 대구 등 전국 60여 곳에서 열린다.한편 박 대통령 팬클럽 박사모 등 친박단체들의 맞불집회, 이른바 '태극기 집회'도 대규모로 열릴 예정이다.'대통령 탄핵 기각을 위한 국민총궐기 운동본부'(탄기국)는 이날 오후 2시부터 서울시청 앞 대한문에서 11차 탄핵 반대집회를 개최한다고 밝혔다.집회에는 특히 어머니들이 유모차에 아기를 태우고서 집회에 참가하는 '유모차 부대'도 등장할 것으로 예상된다.박사모 정광용 회장은 ""유모차부대는 15만 원씩 돈을 받고 나오는 것처럼 보도됐지만 이는 사실무근""이라면서 ""탄핵 기각이 반드시 이뤄져야 한다는 염원을 전달하기 위해 아마 어마어마하게 나올 것""이라고 내다봤다.경찰은 176개 중대 1만4천여 명을 동원해 만일의 사태에 대비하고 있다.ogeerap@cbs.co.kr저작권자 © CBS 노컷뉴스(www.nocutnews.co.kr) 무단전재 및 재배포 금지"
101,2017-02-04,66층 규모 동탄 메타폴리스 화재…3명 사망,https://news.naver.com/main/read.nhn?mode=LSD&mid=shm&sid1=102&oid=421&aid=0002543074,뉴스1,"대피 과정서 에어매트로 뛰어 내리기도(화성=뉴스1) 권혁민 기자,이윤희 기자 = 4일 오전 11시께 경기 화성시 반송동 동탄메타폴리스 내 3층 상가에서 불이 나 성인 남성 3명이 숨졌다.또 연기를 마신 시민 10명이 인근 병원으로 옮겨져 치료를 받고 있다. 상가 내부에 100여명은 긴급 대피했다.건물에 있던 일부 시민들은 대피 과정에서 신고를 받고 출동한 소방대가 지상 1층에 설치한 에어매트로 뛰어 내렸다.숨진 성인 남성 3명은 연기흡입으로 사망한 것으로 소방대는 보고 있다. 정확한 신원은 아직 확인되지 않고 있다.4일 오전 11시께 경기 화성시 반송동 동탄메타폴리스 건물에서 불이 나 성인 남성 3명이 숨졌다. (독자 제공) © News1소방당국에 따르면 불은 66층 규모 메타폴리스 건물 3층 뽀로로파크 철거현장에서 시작됐다.불은 1시간여가 지난 낮 12시 10분께 진화됐지만 화재현장에서 검회색 연기가 치솟고 있어 연기흡입에 의한 피해는 더 늘어날 것으로 예상된다.소방당국은 화성소방서 등 인근 5개 소방관서에서 펌프차 등 장비 30여대와 소방인력 100여명을 현장에 투입해 진화작업을 벌였다.경찰과 소방당국은 화재 원인 및 피해 규모를 조사할 방침이다.4일 오전 11시께 경기 화성시 반송동 동탄메타폴리스 건물에서 불이 나 소방당국이 진화작업을 벌이고 있다. 66층 규모 주상복합 건물 저층부위에서 검회색 연기가 치솟고 있다. (독자제공) 2017.2.4/뉴스1hm0712@▶ 놓치면 후회! 최신 무료만화 보기/2017년 나의 운세 보기[© 뉴스1코리아(news1.kr), 무단 전재 및 재배포 금지]"
102,2017-02-04,'대연정' 논란 하루만에 수면 아래로…文·安 서로 확전 자제,https://news.naver.com/main/read.nhn?mode=LSD&mid=shm&sid1=100&oid=001&aid=0009007318,연합뉴스,"安 ""협치 통한 개혁완성 방점"" 해명…文측 ""같은 맥락…함께하자"" 화답(서울=연합뉴스) 이상헌 서혜림 기자 = 안희정 충남지사의 발언으로 촉발된 '대연정'(大聯政) 논란이 하루 만에 수면 아래로 가라앉는 분위기다.여권과의 대연정도 가능하다는 안 지사의 3일 발언에 더불어민주당 문재인 전 대표가 ""동의할 수 없다""고 맞받아치면서 양측 사이에 긴장도가 치솟았지만, 안 지사가 이튿날인 4일 자신의 발언 취지를 적극 해명하고 문 전 대표 측도 이에 수긍하는 태도를 취한데 따른 것이다.안 지사는 이날 페이스북에 올린 글에서 자신의 대연정 언급에 대해 ""대화와 타협의 정치는 민주주의 의회정치의 움직일 수 없는 대원칙으로, 국민의 개혁 요구를 단 한 걸음이라도 실천하고자 하는 게 대연정 제안의 취지""라고 밝혔다.안 지사는 ""제가 노무현 정부의 대연정, 미완의 역사를 완성하겠다는 것은 대연정 자체가 목적이 아니라 민주주의 정치, 의회정치의 대화와 타협 구조를 정상화해 시대의 개혁 과제를 완성하기 위한 것""이라고 해명했다.과거 적폐 세력과 손을 잡자는 게 아니라 개혁의 완성을 위해서는 의회의 타협 정치가 기본이 되어야 한다는데 방점이 찍혀있는 것이다.안 지사의 이런 해명성 글에 문 전 대표 측도 즉각 화답을 보냈다.문 전 대표의 대변인 역할을 하는 민주당 김경수 의원은 이날 연합뉴스와의 통화에서 ""안 지사의 글은 어제 문 전 대표가 지적한 부분과 일정 부분 맥락을 같이 한다고 볼 수 있을 것 같다""고 말하며 전선 확대를 자제했다.김 의원은 ""문 전 대표는 국민이 요구하는 적폐 청산과 사회대개혁을 다음 정부에서 함께 할 수 있느냐가 연정과 협치의 기준이 될 것이라 했는데, 안 지사도 그런 국민의 개혁 요구를 협치를 통해 하겠다고 말한 것으로 이해한다""고 말했다.그러면서 ""안 지사도 그런 점에서 함께 해나갔으면 좋겠다""고 했다.문 전 대표가 전날 ""새누리당이나 바른정당은 이명박·박근혜 정권의 실패와 국정농단·헌정유린 사태에 제대로 반성·성찰하고 국민께 속죄하는 기간을 가져야 한다. 그게 되지 않은 상황에서 그 정당과 연정한다는 데 동의하기 어렵다""고 한 데 대해 안 지사도 ""박근혜·최순실을 용서하자는 것도, 과거의 적폐를 덮고 가자는 것도, 새누리당을 용서하자고 말하는 것도 아니다""라고 답한 것도 긴장의 수위를 낮추게 만든 대목이다.이처럼 안 지사가 문 전 대표의 반박에 대해 재반박이 아닌 해명성 글을 올리고, 문 전 대표 측도 수긍하는 모양새를 보이면서 논란이 더는 확산하지 않을 것이란 전망이다.대치 전선이 하루 만에 해소 국면으로 흐른 것은 연정을 위한 기본 원칙과 취지가 서로 다르지 않다는 공감대를 확인한 데 따른 것이지만, 두 주자가 당내 경선을 앞둔 시점에서 '노무현의 적통'으로서 갈등을 확산하는 모양새가 바람직하지 않다는 판단이 작용한 것으로 풀이된다.honeybee@yna.co.kr#흥 이렇게 흥겨울 수가...클릭하면 요지경!"
103,2017-02-04,"'부산소녀상 철거' 요구 부착물 뗀 40대…경찰 ""혐의 없다""",https://news.naver.com/main/read.nhn?mode=LSD&mid=shm&sid1=102&oid=001&aid=0009007370,연합뉴스,"(부산=연합뉴스) 조정호 기자 = 부산 일본영사관 앞 소녀상 주변에서 소녀상 철거를 요구하는 부착물을 떼어 낸 40대 남성에 대해 경찰이 ""혐의가 없다""며 입건하지 않았다.소녀상 철거 요구 부착물 뗀 남성    (부산=연합뉴스) 3일 부산 일본영사관 앞 소녀상 철거를 요구하는 불법 부착물을 떼어 낸 남성을 경찰이 조사하고 있다.  2017.2.3 [부산 동부경찰서 제공=연합뉴스]동부경찰서는 4일 소녀상 주변의 부착물을 떼어 낸 하모(41)씨를 입건하지 않기로 했다고 밝혔다.하씨는 3일 오전 11시 30분께 일본영사관 앞 소녀상 주변에 '일본인을 사랑하라', '반일감정 선동 그만' 등 소녀상 철거를 주장하는 종이 부착물을 뗐다가 경찰의 조사를 받았다.현장에서 경찰의 임의동행 요구를 거부한 하씨는 4일 오전 경찰에 출석해 ""'일본을 옹호하고 소녀상 철거를 주장하며 1인 시위 중'이라는 기사를 보고 화가 나 시위자를 만나러 갔다가 부착물을 떼어 냈다""고 진술했다.경찰은 훼손 대상이 불법 부착물이고, 정치적 의도가 없다는 것을 고려했다고 설명했다.다시 붙인 '소녀상 철거 요구' 부착물    (부산=연합뉴스) 김선호 기자 = 3일 오후 부산 일본영사관 앞 소녀상 주변에 다시 부착된 '소녀상 철거 요구' 유인물. 2017.2.3     wink@yna.co.kr당초 불법 부착물을 붙인 남성은 3일 오후 다시 소녀상에 나타나 '불법 설치물 동구청은 철거하라', '빈 협약 이행하라', '이제는 화해' 등이 적힌 종이를 다시 붙이고 사라졌다.ccho@yna.co.kr#흥 이렇게 흥겨울 수가...클릭하면 요지경!"
104,2017-02-04,"오늘 입춘, 봄 날씨…미세먼지 '나쁨'",https://news.naver.com/main/read.nhn?mode=LSD&mid=shm&sid1=103&oid=437&aid=0000146694,JTBC,"[앵커]오늘(4일)은 봄의 시작을 알리는 입춘입니다. 기온도 올라 나들이 하기에도 좋은데요. 하지만 미세먼지가 오늘 하루 종일 기승을 부린다고 합니다.윤정식 기자입니다.[기자]오늘 오전 남산에서 바라본 서울시내입니다.바로 앞 큰 건물들이 형체만 흐릿하게 보입니다.안개까지 겹치면서 한강은 전혀 보이질 않습니다.오늘 오전 10시 미세먼지 농도는 서울이 세제곱미터당 88, 경기는 105, 대구는 112 마이크로그램으로 '나쁨' 수준을 보이고 있습니다.전남과 제주를 제외한 전국에서 '나쁨' 상황이 오늘 하루 계속됩니다.어제까지 북서풍을 타고 중국에서 유입된 스모그의 영향입니다.날씨는 포근해졌습니다.오늘 낮 최고기온은 서울이 서울 7도, 대구 12도, 부산 13도까지 오릅니다.절기상 입춘임을 감안해도 평년보다 2~6도 가량 높은 3월 상순에 해당하는 기온입니다.오늘 저녁에는 비구름이 몰려옵니다.비는 제주를 비롯한 남해안 일대서 시작돼 새벽사이 전국으로 확대되고 서울에는 진눈깨비가 예상됩니다.기상청은 내일 아침 비구름이 중부지방으로 확대되면서 미세먼지가 걷힐 것으로 예상했습니다.윤정식▶ JTBC 뉴스 공식 SNS[트위터][페이스북][유튜브]Copyright by JTBC(http://jtbc.joins.com)and JTBC Content Hub Co., Ltd. All Rights Reserved. 무단 전재 및 재배포 금지"
