,날짜,기사 제목,기사 링크,기사 출처,기사 내용
121,2017-07-11,특혜비리 부른 면세점 '밀실심사'…기준·근거 불명확,https://news.naver.com/main/read.nhn?mode=LSD&mid=shm&sid1=101&oid=421&aid=0002833090,뉴스1,"9일 서울 시내 한 면세점이 중국정부의 사드보복조치로 중국 관광객이 급감해 한산한 모습을 보이고 있다. 2017.7.9/뉴스1 © News1 민경석 기자""소문인줄 알았는데""…위법·부당 건수만 13건심사 때마다 대폭 바뀌는 평가 '의문 투성이'(서울=뉴스1) 장도민 기자 = 2015년 진행된 2차례의 면세점 선정 과정에서 롯데그룹이 가장 높은 점수를 받고도 탈락한 것으로 드러나면서 심사 시스템 개선이 필요하다는 목소리가 나온다.감사원 감사결과 관세청은 롯데그룹에 대한 일부 수치를 다르게 산정해 탈락하는 결과를 만들었다.또 서울세관은 실무자가 현장을 방문해서 한화갤러리아의 매장 내에 공용 면적이 포함 된 것을 확인하고도 기재란을 삭제하고 공용면적(1416㎡)을 매장면적에 포함한 것으로 드러났다.이는 면세점 선정 과정이 '밀실'에서 비밀스럽게 이뤄진 영향이 크다는 게 업계의 중론이다.◇위법·부당 건수만 13건… 사실로 밝혀진 특혜심사 비리11일 감사원에 따르면 2015년 7월과 11월 진행된 면세점 후속 사업자 선정, 지난해 신규특허 추가발급 과정 등에서 13건의 위법 및 부당한 상황이 발생했다.이는 면세사업자 선정 과정에서 청와대가 개입해 특정 기업에게 사업권을 몰아줬다는 의혹이 제기된데 따른 감사다. 지난해 12월 국회가 감사원에 감사를 요구했다.감사할 범위가 넓은 영향인지, 각종 재판이 이뤄지고 있어서 시기가 적절하지 않았는지는 알려지지 않았지만 감사 결과 발표는 쉽지 않았다. 결국 지난해 12월 15일 국회 본회의를 통과한 감사원 감사 내용은 반년가량 시간이 지난 후 발표됐다.국회법상 감사요구 감사원 접수 후 3개월내에 감사보고서를 제출해야 하지만 2개월 연장할 수 있다. 이에 따라 지난 3월 말 제출해야 했고, 2개월 연장까지 한 법정 시한은 5월 말이었다. 그럼에도 6월 말을 지나 7월에야 발표됐다.최근에는 실무자의 증언도 나왔다. 박근혜 전 대통령과 최순실씨, 신동빈 롯데그룹 회장 등의 32차 공판에 관세청 면세점 관련 업무를 맡았던 공무원이 비리에 대해 증언했다.이 공무원은 법원에서 ""당시 청와대 지시를 받은 김낙회 전 관세청장 지시로 서울 시내 면세점 신규 특허 사업을 추진했다""고 밝혔다.당시 롯데와 SK는 2015년 11월 면세점 특허사업자 선정에 탈락한 상태였다. 탈락한 두 회사에 다시 기회를 주도록 특혜를 부여했다는 설명이다.그동안 업계에서 소문으로만 전해지던 내용이 대부분 사실인 것으로 밝혀지자 면세업계 역시 충격이 크다.면세점 관계자는 ""설마했던 소문이 들릴 때마다 충분히 가능성이 있겠다고 생각했지만 믿고싶지는 않았다""며 ""사실로 드러난 이상 놀라울 뿐""이라고 말했다.◇비리로 얼룩진 면세점 선정 과정…시스템 개선 요구 '빗발'면세점 사업자 선정 심사가 외부와 단절된 곳에서 은밀하게 이뤄지다보니 외압이나 비리에 취약할 수밖에 업다는 지적이 많다.지적이 잇따르자 관세청은 지난해 말 ""특허심사위원이 사업계획서 등을 토대로 공정하게 평가했다""고 강조하며 억울하다는 입장을 밝혔다.실제 면세사업자 선정 과정을 살펴보면 1차 심사에서 7개 업체 중 총점 762점을 받아 꼴찌를 했던 현대면세점은 3차 심사에서는 801점으로 5곳 중 1위를 차지했다.1차 때 압도적 1위(847점)였던 HDC신라면세점은 3차에서는 4위권 밖으로 밀려났다. 이를 두고 많은 의문의 목소리가 나왔지만 자세한 평가 내용이 공개되지 않아 의혹은 해소되지 못했다.추가 선정 근거 역시 부족하다. 정부는 중국 관광객들이 더 늘어날 것이라는 용역 자료를 근거로 추가 선정을 강행했는데 이때는 이미 사드배치가 결정된 상황이었다.중국인 관광객들의 수요가 일본으로 이동하고 있는 상황에서 장밋빛 전망만 내놓으며 면세점 '거품'을 키웠다는 지적이다.익명을 요구한 면세점 관계자는 ""지난 정권에서 이뤄진 면세점 선정 심사 과정은 의문 투성이""라며 ""모든 것이 감춰져 있다보니 선정된 업체도, 탈락한 업체도 이해하기 힘든 내용이 많다""고 말했다.이어 ""굳이 '방'으로 들어가야할 이유가 있나 싶다""며 ""투명한 시스템으로 개선돼야 비리가 사라질 것이라는 게 업계 관계자들의 공통된 의견""이라고 덧붙였다.jdm@▶ 놓치면 후회! 최신 만화 보기/2017년 나의 운세 보기▶ 생생한 Real-Time 영상뉴스, 눈TV(바로가기!)▶ 여러분의 제보를 기다립니다. 제보하기(클릭!)[© 뉴스1코리아(news1.kr), 무단 전재 및 재배포 금지]"
122,2017-07-11,"'햄버거병' 용혈성요독증후군 환자, 6년간 24명 발생..",https://news.naver.com/main/read.nhn?mode=LSD&mid=shm&sid1=102&oid=003&aid=0008061162,뉴시스,"【서울=뉴시스】고승민 기자 = 4살 여아가 햄버거를 먹은 후 용혈성요독증후군(HUS·Hemolytic Uremic Syndrome) 진단을 받아 신장의 90%를 잃었다는 소식이 알려지면서 소비자들의 '햄버거병' 공포가 일파만파 확산되고 있는 10일 오후 서울의 한 맥도날드 지점 앞으로 우산을 쓴 시민들이 지나고 있다. 2017.07.10. kkssmm99@newsis.com손씻기, 음식익혀먹기 등 식품매개 감염병 예방수칙 준수해야【세종=뉴시스】이인준 기자 = 국내에서 용혈성요독증후군(Hemolytic uremic syndrome·HUS) 환자가 최근 6년간 24명 발생한 것으로 확인됐다.11일 질병관리본부가 2011~2016년 장출혈성대장균감염증으로 보고된 환자 443명에 대해 역학조사를 실시한 결과 이 중 합병증 HUS으로 진행된 것은 5.4%(24명)으로 집계됐다.연령으로 보면 0~4세가 58.3%(14명)로 5세 미만 소아가 전체의 절반 이상을 차지하고 있으며 나머지도 12.5%(3명)는 5~9세로 분석돼 영유아와 소아 등의 발병이 많은 것으로 확인됐다. 10세 이상은 29.2%(7명)다.장출혈성대장균감염증은 제1군 법정감염병인 병원성대장균의 일종으로, 장출혈성대장균(Enterohemorrhagic Escherichia coli·EHEC)에 감염되어 발생하는 질환이다.잠복기는 2~10일(평균 3~4일)로 환자는 무증상부터 발열·설사·혈변·구토·심한 경련성 복통 등까지 다양한 증상을 보인다.환자의 10% 이하에서는 합병증인 HUS으로 인해 용혈성 빈혈, 혈소판감소증, 급성 신부전 등의 증세를 보이다 사망에 이르기도 한다. 이 병은 최근 4살(사고 당시) 소아가 햄버거를 먹은 뒤 신장장애가 생겨 법정소송을 벌이고 있는 가운데, 장애의 원인을 일으킨 질환으로 지목돼 '햄버거병'이라 불리고 있다.질병관리본부는 ""장출혈성대장균감염증을 예방하기 위해서는 손씻기, 음식 익혀먹기 등 수인성·식품매개 감염병 예방수칙을 지ㅣ는 것이 매우 중요하다""며 ""식사 전에 반드시 음식이 완전히 익었는지 확인하고 복통·설사 등의 증상이 발생하면 즉시 의료진에게 진료를 받아야 한다""고 당부했다.한편 장출혈성대장균감염증은 2011~2016년 연간 평균 74명 수준으로 발생했으며, 매년 5월부터 8월까지 주로 여름철에 많이 발생 중이다.지역별로는 광주 78명(17.6%), 서울 63명(14.2%), 대구 52명(11.7%), 경기 44명(9.9%)순으로 많았다.환자는 남성 236명(53.3%)이 여성(207명) 대비 많고, 연령별로는 0~4세 161명(36.3%), 5~9세 68명(15.3%)으로 전체 환자의 51.7%가 10세 미만 유·소아에서 발생한 것으로 나타났다.임상증상으로는 설사가 310명(70.0%)으로 가장 흔하고 복통 179명(40.4%), 발열 128명(28.9%), 구토 99명(22.3%), 오심 49명(11.1%)등의 증상을 보였다.설사 환자의 82.6%(229명)에서 수양성 또는 혈성 설사 증상이 있었다고 보건당국은 설명했다.ijoinon@newsis.com뉴시스 뉴스, 네이버 뉴스 스탠드에서도 만나세요뉴시스 SNS[페이스북][트위터]<저작권자ⓒ 공감언론 뉴시스통신사. 무단전재-재배포 금지.>"
123,2017-07-11,"文대통령 ""2% 성장률 탈출시킬 힘""…野에 '추경' 통과 호소",https://news.naver.com/main/read.nhn?mode=LSD&mid=shm&sid1=100&oid=018&aid=0003871107,이데일리,"- 文, 11일 靑서 국무회의 주재…""추경·인사 연계, 참 안타까워""- ""韓 대북정책 지지 얻어…외교 역량 키워야 하는 점 절실히 느껴""문재인 대통령이 11일 오전 청와대에서 국무회의를 주재하고 있다. (사진=연합뉴스)[이데일리 고준혁 기자] 문재인 대통령은 11일 개최한 국무회의에서 야당에 추경안과 정부조직개편의 조속한 통과를 호소했다. 문 대통령은 미국과 독일 방문을 통해 국제사회로부터 정부의 대북 정책에 대한 지지를 얻는 등 성과를 냈다고 자평하기도 했다.◇文 “귀국해보니 국회 ‘한 걸음’도 나가지 못해”문 대통령은 이날 오전 청와대에서 국무회의를 주재, 모두발언을 통해 야당에 추경안과 정부조직 개편안 통과에 대한 대승적 협조를 호소했다.문 대통령은 “그동안 외교 무대에서 워낙 많은 일이 있어서 많은 시간이 흘러간 느낌인데 막상 귀국해보니까 국회 상황은 한 걸음도 앞으로 나가지 못했다”고 말했다. 이어 “야당이 다른 것은 몰라도 추경과 정부조직 개편을 인사 문제나 또는 다른 정치 문제와 연계시키는 것은 참으로 안타까운 일”이라고 비판했다.문 대통령은 “이번 G20 회의에서 OECD를 비롯한 국제기구들은 한결같이 세계 경기가 회복세에 있다고 진단했다”며 “그러나 지금 보호주의 등을 비롯한 여러가지 불확실성이 있기 때문에 각국이 경기 상승세를 살려 나가는 데 총력을 다해야 한다”고 설명했다.그러면서 “그러기 위해서 무엇보다 재정의 역할이 중요하다”며 “우리의 추경은 그 방향에 정확하게 부합한다고 생각한다. 성장률 2% 대에서 탈출시킬 수 있는 힘이 될 것”이라고 강조했다. 이어 “정부조직 개편도 새 정부의 정책 기조를 살려나가기 위해서 필요한 일”이라며 “미국이 FTA 개정 요구를 하고 있는 마당에 그에 대응하는 통상교섭본부를 빨리 구축하기 위해서도 매우 시급한 과제”라고 전했다.◇“美·獨 방문 성과 적지 않은 성과 내”문 대통령은 이날 미국과 독일 방문에서 다자회의 및 단독회담을 통해 적지 않은 성과를 냈다고 했다.문 대통령은 “미국 방문에 이어 G20 회의와 함께 많은 단독 회담을 통해 적지 않은 성과를 얻었다고 자평하고 싶다”고 말했다. 이어 “북한의 핵과 미사일에 대한 우리 정부 입장을 모든 나라로부터 지지 받았다”며 “북핵 문제가 G20 의제가 아님에도 불구, 우리의 의제로 국제적인 공감대를 조성한 것이 성과라고 생각한다”고 했다. 또 “한미일 첫 정상회담에서 북핵과 미사일에 대한 공동 방안을 협의한 것도 성과”라며 “또 베를린 방문에서 우리 정부의 한반도 평화 구상을 밝힌 것도 큰 의미”라고 전했다.그러나 문 대통령은 G20에서 대북 제재와 자유 무역주의, 기후 변화 문제 등에서 합의를 보지 못한 점은 안타깝다고 했다.문 대통령은 “당장 북한이 탄도 미사일 도발에 대한 제재 방안에 대한 국제사회의 합의가 쉽지 않다는 사실을 우리는 엄중하게 받아 들여야 한다”며 “실적으로 우리에게 해결할 힘이 있지 않고 우리에게 합의를 이끌어낼 힘도 없다는 사실을 우리가 뼈저리게 느껴야 한다”고 했다.문 대통령은 또 “이번 G20 회의의 주요 의제인 자유 무역주의와 기후 변화 문제에 있어서도 G20은 합의하지 못했다”며 “우리 국익을 관철해 나갈 수 있도록 우리 외교를 다변화하고 외교 역량을 키워 나가야겠다고 절실하게 느꼈다”고 전했다.한편 이날 국무회의엔 장하성 정책실장과 이낙연 총리, 전병헌 정무수석, 박수현 대변인, 박원순 서울시장, 김부겸 행정자치부 장관, 김영춘 해양수산부장관, 도종환 문화체육부 장관, 김상곤 교육부총리, 강경화 외교부장관 등이 참석했다. 최근 임명된 정현백 여성가족부 장관과 유영민 미래창조과학부 장관은 이날 회의에 처음 참여했다.고준혁 (kotaeng@edaily.co.kr)▶심쿵유발 스타 화보 [핫포토]▶한 눈에 보는 이슈 트렌드 [카드뉴스]▶이데일리 [페이스북]|[카카오 친구 맺기~♥]＜ⓒ종합 경제정보 미디어 이데일리 - 무단전재 & 재배포 금지＞"
124,2017-07-11,'가상화폐 투자'? 일단 의심해야…사기 100여건 발생,https://news.naver.com/main/read.nhn?mode=LSD&mid=shm&sid1=101&oid=008&aid=0003901809,머니투데이,"[머니투데이 진달래 기자] [최근 다단계·유사수신 사건 10%가 가상화폐 악용…경찰 특별단속 돌입]가짜 가상화폐 투자설명회에 악용된 자료들/사진제공=경찰청# '비트코인을 보고 만든 00코인' 00코인을 만드는 데 투자하면 원금과 이익배당금을 주고 하위투자자 모집 수당도 있다는 설명회가 2015년 4월부터 지난해 6월까지 성행했다. 무려 800명이 총 126억원을 투자했지만 가짜 가상화폐를 악용한 불법 다단계로 적발돼 일당 8명 중 5명이 구속됐다.# 투자할 곳을 찼던 A씨는 2015년 서울 강남에서 열린 설명회에서 중국 국영은행이 발행한 전자화폐를 구입했다. 경제학 교수에 중국 공산당 간부까지 설명자로 참석해 믿었는데 알고 보니 사기였다. 전자화폐는 가짜였고 설명회를 연 일당은 불법 다단계 조직이었다. 이들은 전국 5100명에게 314억8000만원을 가로챘다.경찰청은 11일 이 같은 가상화폐 다단계·유사수신 사기가 지난해부터 6월 말 현재까지 총 103건 발생했다고 밝혔다. 같은 기간 전체 다단계 유사수신 사기 사건의 10% 이상 차지한다.비트코인, 이더리움 등 가상화폐 투자 바람이 불면서 전에 없던 수법이 빠른 속도로 퍼지고 있다. 실물이 없는 가상화폐가 900여종에 달하는 상황에서 인허가나 투자자 보호를 위한 장치가 미비해 각종 범죄에 악용된다고 경찰은 설명했다.경찰 관계자는 ""가상화폐 투자를 앞세운 다단계는 일종의 금융 다단계로 일반 다단계보다 위험하다""며 ""실물을 보여주거나 설명해야 할 필요가 없어서 더 빠르게 확산되고 피해 규모도 크다""고 설명했다.주로 가상화폐를 구입하거나 투자하면 단기간에 고수익을 낼 수 있다고 투자를 유도한다. 수급조절로 가격하락도 없다고 광고한다. 다른 투자자를 모집하면 그 실적에 따라 수당을 지급하기도 한다. 일명 돌려막기식으로 사람을 끌어모은다.최근에는 투자자들에게 웹·앱(애플리케이션)으로 코인 내역과 가격 등락을 표시한 전산시스템을 제공하기까지 한다. 해당 시스템은 수치를 조작해 가치가 상승하는 것처럼 보이게 한다.경찰청은 피해 확산을 막기 위해 12일부터 '가상화폐 투자사기 등 불법행위 특별단속'을 시작한다. 다단계 가상화폐 판매 사기, 가상화폐사업‧채굴사업 등을 빙자해 투자금을 모집하는 유사수신 투자사기가 단속 대상이다. 가상화폐 거래업체나 구매대행자 등 횡령‧사기 사건도 수사할 방침이다.원경환 경찰청 수사국장은 ""투자금 모집자나 상위 직급자들을 엄중 처벌해 재범을 차단할 것""이라며 ""수사 이후에 명칭·장소를 바꿔가며 범행을 하는 경우 전담팀을 편성해 추적‧검거하겠다""고 밝혔다.특히 제보자 등 범인 검거 공로자에 대한 신고보상금을 적극 지급할 계획이다.경찰은 범죄유형·금액에 따라 범인검거 공로자 보상금 1억원 이하를 지급하고 금융감독원도 최고 1000만원의 금융파파라치 포상금 제도를 운영한다.다단계 판매나 후원수당을 지급 권유받은 경우에는 공정거래위원회 홈페이지에서 다단계판매업 등록 여부를 확인하는 것이 좋다. 투자권유를 받은 경우에는 금감원 불법사금융신고센터(1332)에 상담하고 피해를 입은 경우 경찰에 신고해야 한다.[▶깊이있는 투자정보 'TOM칼럼'][▶트렌드 리더의 스타일 지침서 '스타일M'][▶빵빵한 차&레이싱걸]진달래 기자 aza@<저작권자 ⓒ '돈이 보이는 리얼타임 뉴스' 머니투데이, 무단전재 및 재배포 금지>"
125,2017-07-11,"상의 ""대통령·총수 회동 다음달로 늦춰질 수도…독대 없다""",https://news.naver.com/main/read.nhn?mode=LSD&mid=shm&sid1=101&oid=008&aid=0003901824,머니투데이,"[머니투데이 심재현 기자] [대기업 사회적 책임 강화 논의키로…투자·고용 계획 발표 안 하기로 해]이동근 대한상공회의소 상근부회장이 11일 서울 중구 대한상의 회관에서 열린 15대 그룹 대표단 간담회에서 인사말을 하고 있다. /사진제공=대한상의이르면 이달 말로 예상됐던 문재인 대통령과 주요 그룹 총수들의 첫 회동이 다음달 이후로 늦춰질 수 있다고 대한상공회의소가 11일 밝혔다.이동근 대한상의 상근부회장은 이날 서울 중구 상의회관에서 열린 15대 그룹 대표단 간담회 직후 기자들과 만나 ""구체적으로 일정을 협의하진 않았지만 7월 말에 기획재정부에서 발표할 새 정부의 경제정책 방향을 보고 대통령도 7월 말이나 8월 초에 여름 휴가를 간다고 했으니 그런 상황을 보면 좀 늦어질 가능성이 있다""고 말했다.이어 ""가급적 총수들이 참석하는 방향으로 할 것""이라며 ""삼성그룹은 예외가 되겠지만 가급적 회장들이 참석하는 방향으로 조율할 것""이라고 밝혔다.이 부회장은 문 대통령과 개별 그룹 총수와의 단독 면담 가능성에 대해서는 ""개별 면담은 없다""고 말했다.이날 간담회에선 문 대통령과 주요그룹 총수의 간담회에서 나눌 주제로 동반성장과 상생협력을 통한 사회적 책임 강화 방안을 논의하기로 의견을 모은 것으로 전해졌다.이 부회장은 ""대기업의 사회적 책임을 강화하는 문제가 주로 논의됐다""며 ""동반성장, 상생협력과 관련된 대기업 그룹별 사례를 홍보하고 전파하는 방안을 놓고 (대통령과의) 간담회를 준비하기로 했다""고 전했다.또 ""그룹사별, 계열사별로 형편에 맞게 자발적으로 계획을 세우고 솔선해 나가기로 했다""며 ""과거와 같이 투자·고용 관련 계획을 (그룹별로) 받아서 일괄적으로 발표하는 것은 하지 않기로 했다""고 밝혔다.이날 간담회에는 문 대통령의 미국 방문 당시 동행 경제인단에 포함되지 않았던 롯데, 포스코, KT 관계자들도 참석해 문 대통령과 주요 그룹 총수 간담회에는 이들 3개 대기업도 포함될 것으로 예상된다.간담회에는 삼성전자 주은기 부사장, 현대차 박광식 부사장, SK 박영춘 부사장, LG 조갑호 부사장, 롯데 오성엽 부사장, 포스코 유병옥 전무, GS 정찬수 부사장, 한화 여승주 부사장, 현대중공업 조영철 부사장, 신세계 양춘만 부사장, KT 최영익 전무, 두산 최성우 사장, 한진 석태수 사장, CJ 조영석 부사장, 부영 최양환 사장이 참석했다.[▶깊이있는 투자정보 'TOM칼럼'][▶트렌드 리더의 스타일 지침서 '스타일M'][▶빵빵한 차&레이싱걸]심재현 기자 urme@mt.co.kr<저작권자 ⓒ '돈이 보이는 리얼타임 뉴스' 머니투데이, 무단전재 및 재배포 금지>"
126,2017-07-11,"정현백 여가부 장관 ""여성혐오 문제, TF 만들어 대응""",https://news.naver.com/main/read.nhn?mode=LSD&mid=shm&sid1=102&oid=001&aid=0009398828,연합뉴스,"""청와대에 탁현민 해임 요청했다""""화해·치유재단 해산, 이사회서 결정할 일""정현백 여가부 장관 [연합뉴스 자료사진](서울=연합뉴스) 김계연 기자 = 정현백 여성가족부 장관은 심각한 사회갈등 요인으로 떠오른 여성혐오 문제에 태스크포스(TF)를 꾸려 대응하겠다고 11일 밝혔다.정 장관은 이날 취임 인사차 기자실을 방문한 자리에서 ""여성혐오에 소극적으로 대처하는 건 더이상 여가부의 역할이 아니다""라며 ""가능하면 TF를 구성해 국민이 대체로 납득할 수 있는 여성가족부의 역할, 성평등 관념을 만들고 확산하는 작업을 해야 한다""고 말했다.정 장관은 여성혐오에 대해 ""여성의 지위가 향상됐다기보다 다른 사회경제적 요인이 복합적으로 얽혀 있다. 여성혐오를 하는 분들도 견딜 수 없는 현실이 있다""며 ""쉽지는 않겠지만 함께 풀어가야 할 문제라는 걸 여가부가 담론을 통해서 설득해야 한다""고 강조했다.정 장관은 왜곡된 성의식으로 논란이 된 탁현민 청와대 행정관의 거취와 관련해 인사청문회에서 밝힌대로 의사를 전달했느냐는 질문에 ""했다""고 말했다.그는 지난 4일 국회 여성가족위원회 인사청문회에서 '문재인 대통령에게 해임을 촉구할 의향이 있느냐'는 자유한국당 윤종필 의원의 질의에 ""그렇다. 있다""라고 답했다.일본군 '위안부' 기록물의 유네스코 세계기록유산 등재 사업에 대해서는 ""일본 정부의 지원금이 유네스코 재정에서 중요한 비중을 차지하고 있고 그걸 무기로 쓰고 있어 쉽지 않다""면서 ""반대로 위안부 문제는 더이상 한일간 이슈가 아닌 국제화된 이슈이기 때문에 국제적인 지원을 받을 수 있다고 생각한다""고 말했다.정 장관은 전날도 위안부 피해자 거주시설인 '나눔의 집'을 방문해 유네스코 등재 문제를 서둘러 추진하겠다는 뜻을 내비쳤다. 기시다 후미오(岸田文雄) 일본 외무상은 이 발언에 대해 ""위안부 문제 관련 자료를 유네스코 세계 기록유산에 등록하려는 움직임을 지원하겠다는 한국 각료의 발언에 대해 항의했다""고 말했다.정 장관은 그러나 유네스코 등재와 위안부 박물관 건립 사업을 가리켜 ""한일합의를 다시 시작하고 논의하는 게 제대로 작동하지 않더라도 우리가 할 수 있는 다음 단계의 역사적 진전이 그 두 가지라고 생각한다""며 추진 의사를 재차 밝혔다.재작년 한일합의에 따라 출범한 화해·치유재단의 해산 문제는 ""이사회가 결정할 사안""이라고 선을 그었다.정 장관은 ""과거 정부에서는 부처가 해산하라면 해산했지만 절차적 민주주의를 지켜야 한다""며 ""지금은 재단에서 여가부 직원들이 철수했지만 작년에 예산을 지원한 입장에서 그간의 사업 점검은 필요하다""고 덧붙였다.그는 새 정부에서 대통령 직속으로 격상되는 성평등위원회를 통해 여가부 역할이 강화될 것으로 기대했다. 정 장관은 ""기획재정부가 성평등 예산을 늘려주지 않으면 우리가 제동을 걸 방법이 없다""며 ""위원회는 각 부처가 성평등 관련 문제를 진지하게 받아들이고 집행하는지 점검하는 역할을 하기 때문에 여가부를 강화하면서 성평등을 새 정부 정책의 핵심에 두기 위안 방법""이라고 설명했다.dada@yna.co.kr최신 유행 트렌드 총집결(클릭!)"
