,날짜,기사 제목,기사 링크,기사 출처,기사 내용
56,2017-07-11,정의당 이정미號 출범…'진보' 세대교체 바람 예고,https://news.naver.com/main/read.nhn?mode=LSD&mid=shm&sid1=100&oid=421&aid=0002834031,뉴스1,"이정미 정의당 의원이 5일 오전 서울 중구 환경재단 레이첼카슨홀에서 열린 '돌고래 바다쉼터 추진시민위원회' 발족식에 참석해 축사를 하고 있다.© News1정부여당과 협조·견제 속 노동 분야 목소리 높일 듯(서울=뉴스1) 박기호 기자,이정호  기자 = 정의당을 2년간 이끌 신임 당 대표로 이정미 후보가 11일 선출됐다.이정미 후보는 정의당 4기 전국동시당직선거에서 총 득표수 7172표(56.05%)를 얻어 5624표(43.95%)에 그친 박원석 후보를 제쳤다.정의당 당직선거는 사실 이정미 후보가 줄곧 우세한 분위기 속에서 진행됐다. 이 후보가 정의당 내 최대 정파인 인천연합 계열 당원의 지지를 받았기 때문이다.이정미 신임 당 대표가 선출됐지만 정부여당과는 현재와 같이 협력과 긴장 관계를 계속 유지할 것으로 보인다.다만 노동 분야에는 목소리를 더 낼 수도 있다. 해직 노동자 출신인 이 신임 대표는 노동운동을 했고 국회에서도 환경노동위원회에서 활동하고 있다.게다가 당선된 후에도 이랜드 그룹 계열사의 '임금 꺾기' 문제를 지적해 체불 임금 310억원의 지급을 약속 받아내는 등 노동 현장에서도 두각을 드러냈다.이에 정의당은 전략적으로 노동과 여성 분야에 더욱 당력을 집중할 것으로 보인다.이 신임 대표의 선출로 내년 6월 지방선거를 앞두고 정의당 내에서 세대교체 바람이 일 수도 있다.정의당의 한 관계자는 뉴스1과의 통화에서 ""이 후보의 역할에 따라 내년 지방선거에서 젊은 층이 더 많이 진출할 수도 있다""고 전했다.다만 전직 대표들에 비해 다소 정치적인 무게감이 떨어진다는 지적도 나온다. 비례대표 초선의원으로 아무래도 직전 대표였던 심상정 전 대표에 비해 대중적인 인지도나 무게감이 떨어질 수밖에 없다.이런 상황 속에 원내 5당의 위치를 확고히 하면서 내년 6월 지방선거에서 의미있는 결과물을 내야하는 과제를 안게 됐다.이 신임 대표는 당선 소감을 통해 ""정의당의 더 큰 도약을 위해 사력을 다하겠다""며 ""당원들과 주권자들을 향해 제 몸을 더 낮추겠다""고 강조했다.이어 ""2018년 지방선거 승리 토대 위에 2020년 제1야당을 향해 나아갈 것""이라며 ""상황을 주도하겠다는 용기와 '아래'로 향하겠다는 비전만 있으면 우리는 정치판을 뒤흔들게 될 것""이라고 자신했다.이정미 대표와 손발을 맞출 부대표에는 청년 및 여성할당 부문 정혜연 후보를 비롯해 강은미·한창민 후보가 당선됐다.정혜연 신임 부대표는 중앙보훈병원 야간약사 출신으로 정의당 청년모임진보너머의 대표를 맡고 있다.강은미 부대표는 전직 광주시의원으로 정의당 광주시당 서구위원장이며 한창민 부대표는 정의당 대변인직을 수행하며 당의 공식적인 입으로 활동해왔다.정의당 대표에 출마한 박원석·이정미 후보가 4일 오후 서울 마포구 상암동 MBC사옥에서 MBC 100분 토론 녹화 전 포즈를 취하고 있다. 2017.7.4/뉴스1 © News1 안은나 기자goodday@▶ 놓치면 후회! 최신 만화 보기/2017년 나의 운세 보기▶ 생생한 Real-Time 영상뉴스, 눈TV(바로가기!)▶ 여러분의 제보를 기다립니다. 제보하기(클릭!)[© 뉴스1코리아(news1.kr), 무단 전재 및 재배포 금지]"
57,2017-07-11,"인천공항 라운지서 '음식물 판매', KAL·아시아나 항공 입건",https://news.naver.com/main/read.nhn?mode=LSD&mid=shm&sid1=101&oid=421&aid=0002833985,뉴스1,"인천국제공항 내부 전경. 뉴스1 DB관할 지자체 허가 없이 음식·주류 등 팔아…식품위생법 위반(인천=뉴스1) 주영민 기자 = 대한항공과 아시아나항공이 승객들에게 휴식공간을 제공하기 위해 마련한 인천국제공항 내 항공사 라운지에서 허가 없이 음식물을 판매한 혐의로 경찰에 입건됐다.인천공항경찰대는 대한항공 상무 A씨(54)와 아시아나항공 상무 B씨(51)를 각각 식품위생법 위반 혐의로 불구속 입건했다고 11일 밝혔다.경찰은 대한항공과 아시아나항공의 법인도 양벌규정을 적용해 각각 입건했다.두 항공사는 2012년 4월부터 올해 3월까지 5년간 인천공항 여객터미널 내 자사 승객들을 위해 마련한 라운지에서 관할 지방자치단체의 '음식점 허가'를 받지 않고 음식과 주류 등을 판매한 혐의를 받고 있다.경찰은 두 항공사가 라운지 이용 승객들에게 음식물을 제공하면서 항공사 마일리지를 차감하거나 신용카드 결제한 점 등이 '음식점 영업'에 해당한다고 봤다.제휴 카드사의 우량고객이나 'PP(Priority Pass·공항 라운지 멤버십)카드'를 소지한 고객이 라운지에서 음식과 주류를 제공받은 것도 마찬가지로 불법 소지가 있다고 판단했다. PP카드를 발급받기 위해서는 연회비를 미리 내야하는 등 선입금 성격의 지출이 필요하기 때문이다.경찰은 두 항공사가 인천공항 개항 시점인 2001년부터 최근까지 라운지를 운영했지만 식품위생법 공소 시효에 따라 최근 5년에 대해서만 혐의를 적용했다.경찰은 두 항공사가 이 기간 동안 라운지 운영으로 거둬들인 매출액이 대한항공은 50억원, 아시아나항공은 100억원에 달하는 것으로 추정했다.경찰은 조만간 검찰에 두 항공사를 기소의견으로 송치할 예정이다.ymjoo@▶ 놓치면 후회! 최신 만화 보기/2017년 나의 운세 보기▶ 생생한 Real-Time 영상뉴스, 눈TV(바로가기!)▶ 여러분의 제보를 기다립니다. 제보하기(클릭!)[© 뉴스1코리아(news1.kr), 무단 전재 및 재배포 금지]"
58,2017-07-11,국정원 적폐청산TF의 조사대상 13개 적폐리스트 내용은,https://news.naver.com/main/read.nhn?mode=LSD&mid=shm&sid1=100&oid=001&aid=0009400060,연합뉴스,"지난2013년 7월 2일 열린 국회 본회의에서 재석의원 276명 가운데 찬성 257명, 반대 17명 기권 2명으로 2007년 제2차 남북정상회담 관련 회의록과 녹음기록물 등 자료 일체의 열람·공개를 국가기록원에 요구하는 자료제출요구안이 국회 본회의를 통과했다 [연합뉴스 자료사진](서울=연합뉴스) 임기창 임순현 방현덕 기자 = 국정원이 과거 그릇된 정치개입을 한 사건으로 지목해 다시 조사해 진상을 밝히겠다고 11일 제시한 사건은 모두 13개다.대부분 이명박·박근혜 정부 시절 발생해 검찰 수사가 이뤄졌거나 진행 중인 사건이지만, 국가정보원 개혁발전위원회 내의 적폐청산 태스크포스(TF)에서 재조사될 전망이다.다음은 13개 조사 항목 중 주요 항목 개요.서훈 국정원장, 국가정보원 개혁 (PG)[제작 조혜인]◇ NLL 정상회담 대화록 공개 수사서상기 새누리당 의원이 2013년 6월 20일 기자회견을 열고 ""2007년 남북정상회담 대화록 발췌본을 확인한 결과 노무현 전 대통령이 2007년 남북정상회담에서 서해 북방한계선(NLL)을 포기하는 발언을 한 것을 확인했다""고 주장하면서 시작된 사건이다.국회는 7월 2일 본회의 표결을 통해 국가기록원에 2007년 남북정상회담 관련기록의 열람·공개를 요구하는 자료제출 요구안을 통과시켰다. 7월 22일 여야 열람위원단이 검색했지만, 국가기록원에는 회의록 원본이 존재하지 않았다. 이에 새누리당은 7월 25일 '대통령기록물 관리에 관한 법률' 위반 혐의로 문재인 당시 의원 등을 서울중앙지검에 고발했다.검찰은 3차례 현장답사와 관련자 조사를 거쳐 11월 15일 수사결과를 발표했다. 노무현 전 대통령의 지시에 따라 참여정부에서 회의록을 고의적으로 폐기했다며 청와대 백종천 전 외교안보실장과 조명균 전 안보정책비서관 2명을 대통령기록물 관리에 관한 법률 위반 및 공용전자기록 등 손상 혐의로 불구속 기소했다. 이들의 재판은 현재 대법원에 계류 중이다. 문 의원은 불기소 처분됐다.지난2012년 12월 13일 서울 강남구 역삼동 자신의 오피스텔에서 경찰과 국정원, 선관위 관계자가 입회한 가운데 경찰의 증거자료 수집을 지켜보는 국정원 직원의 모습[연합뉴스 자료사진]◇ 국정원 댓글 사건18대 대통령 선거를 앞두고 국정원 심리전단 소속 직원들이 문재인 후보를 비방하고 박근혜 후보를 지지하는 취지의 글을 인터넷 사이트에 게시하고 있다는 의혹이 제기됐다. 이에 민주당은 12월 11일 국정원 직원이 은신하던 오피스텔을 급습했고, 다음날 이 직원을 경찰에 고발했다.하지만 경찰은 대선을 이틀 앞둔 12월 16일 밤 ""국정원 대선 관련 댓글 흔적을 발견하지 못했다""는 중간수사 결과를 발표하면서 봐주기식 수사가 아니냐는 비판을 받았다.이후 민주당이 이듬해 4월 1일 원세훈 전 원장을 서울중앙지검에 고발하자, 서울중앙지검은 4월 18일 특별수사팀을 구성해 수사에 착수했다.검찰은 두 달 간 수사해 원 전 원장을 공직선거법 및 국정원법 위반 혐의로 불구속 기소했지만, 이종명 3차장과 민병주 심리전단장 등은 기소유예 처분했다. 민주당이 불복해 법원에 재정신청을 냈고, 법원이 이를 받아들여 검찰을 결국 이들도 기소했다. 이들의 국정원법 위반에 대해서는 유죄가 확정됐지만, 공직선거법 위반 혐의 사건은 아직 재판 중이다.◇ 문화계 블랙리스트 개입 의혹국정농단 사태의 한 축인 '문화계 블랙리스트'의 탄생과 확대 배경에 국정원이 있었다는 의혹이다.지난1월 9일 국회에서 열린 박근혜 정부의 최순실 등 민간인에 의한 국정농단 의혹사건 진상규명을 위한 국정조사 7차 청문회에서 이른바 '문화계 블랙리스트' 의혹과 관련된 문건에 'B'와 'K'라는 알파벳이 있으며, 이는 각각 청와대와 국가정보원을 의미한다며 문화체육관광부의 '공모 사업별 검토 내용' 내부 문건을 공개한 더불어민주당 도종환 의원의 모습[연합뉴스 자료사진]국정농단 사건을 수사한 박영수 특별검사팀은 청와대 내부에서 박근혜 전 대통령이나 정부에 비판적인 문화예술인을 지원하는 것이 부적절하다는 기조가 확산한 계기 중 하나로 국정원이 작성한 정보보고서를 지목했다.특검에 따르면 국정원 문건이 청와대에 전달된 이후 김기춘 당시 대통령 비서실장은 정부에 비판적인 문화·예술인들을 '국론을 분열시키고 국정 흔들기를 시도하는 세력'으로 규정, 이들에 대한 정부 지원을 차단하라고 지시했다.이같은 문건이 누구의 지시로 작성됐고 어느 선까지 보고됐는지, 블랙리스트 명단 선정에 관여한 이가 누구인지 등이 주요 조사 대상이 될 전망이다.◇ 서울시 공무원 간첩조작 사건2004년 4월 탈북한 뒤 한국에 정착해 서울시 공무원이 된 화교 출신 유우성씨는 2013년 1월 200명이 넘는 탈북자 명단을 북한에 넘겼다는 '간첩' 혐의로 국가정보원에 체포됐다.검찰은 유씨를 넘겨받아 같은 해 2월 기소했지만 1심에서 국정원이 탈북자 임시 수용시설인 중앙합동신문센터에서 유씨 여동생 유가려씨를 협박·회유해 ""오빠가 간첩""이라는 허위 진술을 받아냈다는 사실이 드러나며 무죄가 선고됐다.이에 국정원은 유씨의 혐의를 입증하겠다며 중국 선양 주재 국정원 영사를 통해 중국 공안 명의로 된 유씨의 중국-북한 출입경 기록 서류를 조작했다. 서류는 검찰을 통해 2심 법정에 제출됐으나 조작 사실이 밝혀졌고, 이에 관여한 국정원 간부 4명과 협조자 2명이 기소됐다.  유씨는 같은 달 대법원에서 간첩 혐의에 최종 무죄 선고를 받았다.지난2014년 4월 서울 서초구 민주사회를 위한 변호사 모임 사무실에서 열린 '서울시 공무원 간첩 조작 사건 검찰 수사결과 발표에 대한 변호인단 입장발표 기자회견'에서 참석한 유우성씨의 모습 [연합뉴스 자료사진]◇ 박원순 제압문건 수사2013년 5월 15일과 19일 진선미 민주통합당 의원이 국가정보원이 작성한 것으로 보이는 '서울시장의 좌편향 시정운영 실태 및 대응방향'이라는 제목의 문서와 '좌파의 등록금 주장 허구성 전파로 파상 공세 차단'이라는 제목의 문서를 공개했다.이 문건으로 국정원이 박원순 서울시장의 정치적 영향력을 제압하거나 정부에 비판적인 성향의 시민사회단체들이 벌이던 '대학등록금 인하운동'을 방해하기 위해 우익단체와 관변단체 등을 동원하는 등 정치공작을 기획했다는 의혹이 제기됐다.민주통합당과 시민사회단체들이 국정원을 국정원법 위반 혐의로 5월 22일 검찰에 고발했지만, 검찰은 10월 7일 무혐의 처분을 내렸다.◇ 국정원 '좌익효수' 필명 사건18대 대선을 앞두고 국정원 대공수사국 직원 유모씨가 '좌익효수'라는 아이디로 인터넷에 5.18광주민주화 운동 왜곡과 호남지역, 야당 정치인, 여성을 폄하·비하하는 내용의 16개의 글과 3천450여개의 댓글을 올린 사실이 네티즌들에 의해 밝혀진 사건이다.통합진보당 오병윤 의원이 2013년 7월 10일 이 아이디 사용자를 명예훼손과 국정원법 위반 혐의로 검찰에 고발했다. 국정원 댓글 사건을 수사 중이던 서울중앙지검이 사건을 넘겨받아 수사를 시작했지만, 그 사이 '좌익효수'는 인터넷 커뮤니티를 탈퇴하고 게시글도 모두 삭제했다. 이후 좌익효수 아이디 사용자가 국정원 직원임을 확인한 검찰이 형법상 모욕죄 및 국가정보원법 위반 혐의로 유씨를 불구속 기소했다. 1, 2심은 모욕죄만 유죄로 인정하고, 국정원법 위반은 무죄로 판단해 징역 6월에 집행유예 1년을 선고했다. 검찰이 상고해 현재 대법원에 재판이 계류 중이다.채동욱전 검찰총장에게 혼외 아들이 있다는 의혹이 제기되자 일주일 만에 사의를 표명하고 대검찰청을 떠나고 있는 채동욱 전 검찰총장의 모습 [연합뉴스 자료사진]◇ 채동욱 검찰총장 혼외자 뒷조사 사건2013년 국가정보원의 18대 대선개입 사건 수사를 지휘하던 채동욱 검찰총장은 당시 '윗선'의 바람과는 달리 원세훈 전 국가정보원장과 김용판 전 서울지방경찰청장을 공직선거법 위반 등의 혐의로 기소했다.같은 해 9월 언론 보도를 통해 채 전 총장에게 혼외 아들이 있다는 의혹이 제기됐다. 당시 황교안 법무부 장관은 이를 근거로 감찰을 지시했고, 채 전 총장은 결국 중도 퇴진했다.검찰은 청와대와 국정원이 서초구청을 통해 채 전 총장의 혼외 아들과 어머니 임모씨와 관련한 개인 정보를 몰래 빼내는 등 뒷조사를 한 사실을 파악하고 조오영 전 청와대 총무비서관실 행정관, 국정원 송모 정보관, 조이제 서초구청 행정지원국장을 개인정보보호법 위반 등의 혐의로 불구속 기소했다.1심에서 조 전 행정관은 무죄, 송 정보관은 징역 8개월에 집행유예 2년, 조 국장은 징역 8개월을 받았으나 2심은 조 행정관을 벌금 700만원에 처하는 대신 송 정보관을 벌금 700만원, 조 국장을 벌금 1천만원으로 감형했다. 사건은 대법원이 심리 중이다.◇ 극우단체 지원 관여 의혹청와대가 대한민국어버이연합 등 극우단체를 '관제 시위'에 동원하고, 전국경제인연합회(전경련)가 이들 단체에 활동자금을 지원했다는 의혹에 국정원도 연루됐는지를 밝힌다.지난해4월 서울 종로구 인의동 어버이연합 사무실에서 열린 전경련의 예산지원과 청와대 개입 등의 논란에 해명하고 있는 어버이연합 추선희 사무총장의 모습 [연합뉴스 자료사진]국정원이 극우단체에 금품을 지원하고, 평소 이들을 관리하면서 청와대와 소통 창구 역할을 했는지 등이 관심사다. 일부 언론은 이병기 전 국정원장이 재직 당시 보수단체 대표들을 만나 '지원 창구 단일화'를 요청했다고 보도하기도 했다. 다만, 이 전 원장은 해당 보도가 사실무근이라며 부인하는 입장이다.◇ 세월호 참사 관련 의혹국정원이 세월호 운영과 관리 등에 깊숙이 개입했고, 세월호 참사 관련 여론조작에도 관여했다는 의혹이다.세월호 희생자 유족들은 세월호에서 발견된 노트북 PC를 복원한 결과 국정원이 세월호 구입부터 증·개축, 운항, 관리에 깊이 개입한 것으로 보이는 정황이 있다며 국정원이 세월호 실소유주일지 모른다는 의혹을 제기했다.국정원이 작성한 것으로 추정되는 문건에서 세월호 참사를 계기로 한 정부 비판세력의 투쟁 기도를 차단해야 한다는 제언과 함께, 보수단체를 활용한 '맞불집회' 등 여론조작 필요성을 강조했다는 의혹도 풀어야 할 대상이다.◇ 노무현 전 대통령 논두렁 시계 사건노무현 전 대통령의 오랜 후원자인 박연차 태광실업 회장을 수사하던 검찰은 박 회장이 노 전 대통령 측에 금품을 제공했다는 진술을 단서로 2008년 말 노 전 대통령에 대한 수사를 개시했다.지난2009년 6월 12일 당시 대검 중수부장이었던 이인규 대검 중수부장은 서울 서초구 대검찰청 기자실에서 박연차 전 태광실업 회장을 포함해 전체 21명을 기소하고 고(故) 노무현 전 대통령 뇌물수수 의혹 부분은 내사 종결했다는 내용의 수사결과를 발표했다. [연합뉴스 자료사진]수사 초점이 노 전 대통령의 부인 권양숙 여사로 옮겨가던 이듬해 4월 '박 회장이 2006년 8월 노 전 대통령 회갑 때 명품시계 2점을 선물했다는 단서를 잡고 검찰이 조사를 벌이고 있다', '권 여사가 시계를 논두렁에 버렸다'는 보도가 이어졌다.같은 달 30일 검찰은 노 전 대통령을 특정범죄 가중처벌법상 뇌물 혐의로 소환해 조사했고, 혐의점은 노 전 대통령의 딸 정연씨에게까지 확대됐으나 노 전 대통령이 5월 23일 갑작스레 서거하며 수사는 멈췄다.당시 수사를 지휘했던 이인규 전 대검찰청 중앙수사부장은 2015년 언론 인터뷰에서 ""권 여사가 박 전 회장에게 받은 명품시계를 논두렁에 버렸다는 언론 보도 등은 국정원 주도로 이뤄진 것""이라고 주장하며 큰 파문을 불렀지만 진상은 밝혀지지 않았다.◇ 이탈리아 해킹 프로그램 통한 민간인 사찰2015년 7월 9일 국정원이 이탈리아 소재 스파이웨어 업체 '해킹팀(Hacking Team)'으로부터 원격조정장치(RCS : Remote Control System) 해킹프로그램을 구입한 사실이 밝혀지면서 민간인 사찰 의혹이 제기됐다.국정원은 해킹팀에 국내 이동통신사에서 출시된 스마트폰 모델을 특정해 감청 가능 여부를 확인하고, 카카오톡 해킹방법, 서울대 공대 동문회 파일에 스파이웨어를 심는 작업 등을 문의·의뢰한 것으로 알려졌다.여야는 국회 차원의 진상조사 활동에 합의했지만, 국정원이 자료제출을 거부해 조사가 무산됐다. 이에 시민단체들이 모집한 4천명에 가까운 시민고발단이 7월 23일 해킹프로그램 구입 중개자 '나나테크' 직원과 원세훈 국정원장 등을 해킹 프로그램을 구입·유포해 정보를 불법으로 취득한 혐의(정보통신망법 위반)와 정부의 허가를 받지 않고 감청장비를 수입한 혐의(통신비밀보호법 위반)로 서울중앙지검에 고발했다. 이 사건은 현재까지 서울중앙지검 공안2부가 수사 중이다.banghd@yna.co.kr최신 유행 트렌드 총집결(클릭!)"
59,2017-07-11,"'제보 조작' 이준서 구속 여부, 오늘 밤늦게 결정",https://news.naver.com/main/read.nhn?mode=LSD&mid=shm&sid1=100&oid=214&aid=0000776374,MBC,"[뉴스데스크]◀ 앵커 ▶국민의당 제보 조작 사건에 관여한 혐의로 검찰의 수사를 받아온 이준서 전 최고위원의 구속 여부가 오늘 밤늦게 결정됩니다.서울 남부지법에 나가 있는 취재기자 연결해 보겠습니다.박준규 기자, 법원의 판단이 곧 나올 예정이죠.◀ 기자 ▶네, 그렇습니다.이준서 전 최고위원은 오늘 오전 영장실질심사를 마친 뒤 검찰청에 대기하며 법원의 결정을 기다리고 있습니다.이 전 최고위원은 오전 10시쯤 법원에 출석했는데요.검찰의 영장청구에 대해 이 전 최고위원은 당혹스럽다는 입장을 밝혔습니다.[이준서/전 국민의당 최고위원]""이유미 씨가 조작한 사실을 몰랐다는 것에 대해서 집중적으로 (법정에서) 이야기하고 싶습니다.""또 제보를 검증은 했지만 한계가 있었다고 강조했습니다.[이준서/전 국민의당 최고위원]""제 나름대로 검증을 최대한 했지만 제가 할 수 있는 한계가 있었기 때문에 그것에 대한 아쉬움은 있습니다.""검찰은 이 전 최고위원이 당의 사실 확인 요구에도 별다른 조치를 하지 않는 등 미필적 고의가 성립된다며 영장 발부에 자신하는 모습입니다.이와 함께 문준용 씨의 대학원 동료라며 거짓 제보를 녹음한 이유미 씨 남동생도 이 전 최고위원과 함께 구속 전 피의자 심문을 받았습니다.이 전 최고위원 등의 구속 여부는 이르면 오늘 밤늦게 결정됩니다.구속 영장이 발부되면 곧바로 구속돼 서울 남부구치소에 수감됩니다.지금까지 서울 남부지법에서 MBC뉴스 박준규입니다.박준규기자 (jpark@mbc.co.kr )[저작권자(c) MBC (www.imnews.com) 무단복제-재배포 금지]Copyright(c) Since 1996,MBC&iMBCAll rights reserved."
60,2017-07-11,"與 ""류석춘 '헌법부정' 위험한 발언…민의 짓밟아""",https://news.naver.com/main/read.nhn?mode=LSD&mid=shm&sid1=100&oid=001&aid=0009399650,연합뉴스,"""한국당, '도로 친박당' 되려는 것인지 입장 밝혀야""(서울=연합뉴스) 한지훈 기자 = 더불어민주당은 11일 박근혜 전 대통령을 두둔한 류석춘 자유한국당 혁신위원장 발언과 관련, ""대한민국의 헌법을 인정하지 않는 것으로 해석될 수 있는 매우 위험한 발언""이라고 비판했다.백혜련 대변인은 이날 서면 브리핑에서 ""박 전 대통령이 무슨 잘못을 했고, 어떤 실정법을 위반했는지는 이루 열거하기 힘들 정도로 많다""면서 이같이 말했다.앞서 류 위원장은 이날 취임 기자회견에서 ""박 전 대통령이 실제 저지른 잘못보다 과한 정치적 보복을 당한 게 아니냐는 생각을 하고 있다"", ""무슨 실정법을 위반했는지 이해가 안 된다""고 언급했다.백 대변인은 이에 대해 ""박 전 대통령이 이미 18개의 혐의로 재판을 받는 상황에서 류 위원장의 발언은 나라다운 나라를 원하는 민의를 처참히 짓밟은 것""이라고 지적했다.그러면서 ""한국당은 혁신을 하겠다는 것인지, 과거 박 전 대통령을 위시한 '도로 친박당'이 되기로 한 것인지 입장을 밝혀야 한다""며 ""혁신(革新)이란 낡은 것을 바꾸거나 고쳐서 새롭게 하다는 뜻으로, 한국당은 혁신과 회귀를 구분하라""고 촉구했다.더불어민주당 백혜련 대변인 [연합뉴스 자료사진]hanjh@yna.co.kr최신 유행 트렌드 총집결(클릭!)"
