,날짜,기사 제목,기사 링크,기사 출처,기사 내용
190,2017-07-11,지자체 머리 맞대 '저출산 걱정' 줄인다,https://news.naver.com/main/read.nhn?mode=LSD&mid=shm&sid1=102&oid=081&aid=0002836429,서울신문,"[서울신문]아동전문 보건소 등 9개 사업임신·출산·육아 원스톱 서비스부산 사상구에 전국에서 두 번째로 어린이를 전문적으로 돌보는 보건소가 생긴다. 옛 동사무소(주민센터)를 고친 건물에 들어선 ‘아이러브맘 원스톱 센터’에서 부모들은 임신·출산부터 모유수유와 같은 신생아 돌보기 교육을 받고, 아이들은 태어나서 건강한 성인으로 자랄 때까지 이유식, 이닦기, 식습관 등 다양한 보건 서비스를 받을 수 있다.행정자치부는 10일 전국 지방자치단체로부터 저출산 극복 사업 아이디어를 모아 이 가운데 전국으로 확산 가능성이 큰 9개 사업을 선정했다고 밝혔다.선정된 부산 사상구, 대구 남구, 광주 광산구, 세종시, 경기 오산시, 강원 삼척시, 충남 서천군, 전북 순창군, 경북 상주시 등 9개 지자체에는 평균 4억 5000만원씩 모두 39억원이 지원된다. 임신부터 출산, 육아까지 한곳에서 마음 놓고 이용할 수 있으며 지자체에서 지역색에 맞춰 특색 있게 개발한 사업이라 실효성도 크다.선정된 9개의 사업은 아동전문 보건소, 공동육아방, 원스톱 육아지원센터 등으로 대부분 기존 건물을 아이들을 위한 공간으로 고쳐 육아 프로그램을 운영하는 형식이다. 부산 사상구에 생기는 아동전문 보건지소는 지난 2월 문을 연 서울 성북구의 정릉아동보건지소를 본뜬 것이다. 아동전문 보건지소에서는 임신부터 출산, 육아까지 한꺼번에 관리하며 어린이 아토피 예방교실 등 아동 성장단계에 따라 건강관리 프로그램을 운영한다. 임신했을 때부터 아동전문 보건지소 ‘아이러브맘 원스톱 센터’를 방문하면 마치 친정을 찾은 것처럼 아이를 건강하게 키울 수 있는 모든 행정서비스를 지원받을 수 있다.광주 광산구에는 동 주민센터 공간을 활용한 공동육아방인 ‘맘스리 센터’가 20곳 새로 생긴다. 육아방에서는 광주여대 등 지역대학 및 병원과의 협력을 통해 각종 육아프로그램을 진행한다. ‘한 아이를 키우려면 온 마을이 필요하다’는 아프리카 속담을 현실화할 수 있도록 아동보호사를 육성하고, 보육교사 협동조합도 활성화한다.세종시에는 새롬동에 있는 종합복지센터 3층에 ‘행복맘 원스톱 통합지원센터’가 생긴다. 맞벌이 부부를 위해 보건지소 운영시간을 오전 7시~오후 8시로 확대하고, 임산부 진료소와 운동교실 등 출산과 육아를 지원하는 프로그램 31개를 운영한다. 강원 삼척시는 전통시장 안의 상가건물을 빌려 일자리지원 상담과 육아서비스를 제공하는 ‘통통센터’를 조성한다. 전통시장을 찾은 경력단절 여성들이 육아서비스를 받는 것은 물론 재취업 기회까지 얻을 수 있다. 아이를 받는 산부인과가 없던 경북 상주시에는 분만 산부인과가 생긴다.윤창수 기자 geo@seoul.co.kr▶  재미있는 세상[나우뉴스]▶ [인기 무료만화] [페이스북]ⓒ 서울신문(www.seoul.co.kr), 무단전재 및 재배포금지"
191,2017-07-11,"""서울·부산 아파트값 상승 원인은 투자수요 유입""",https://news.naver.com/main/read.nhn?mode=LSD&mid=shm&sid1=101&oid=001&aid=0009397565,연합뉴스,"[연합뉴스자료사진]국토연구원 보고서…청약제도 강화 등 수요관리 정책 필요(서울=연합뉴스) 서미숙 기자 = 서울과 부산 등은 주택 수요·공급이 균형을 이루고 있지만 투자수요 유입으로 집값이 오른 만큼 모니터링을 통해 청약제도 강화 등 수요관리 정책이 필요하다는 지적이 제기됐다.경기·울산·대구 등은 공급 초과가 예상돼 미분양 등 관리가 필요한 것으로 분석됐다.국토연구원은 11일 '지역별 주택수급 진단과 정책과제'라는 국토정책 보고서에서 이처럼 밝혔다.연구원은 연도별 주택 수요와 공급물량 추정치, 재고 주택 수 등을 활용해 전국 16개 광역시·도를 상대로 2016∼2018년 주택수급 상황을 분석했다.이 분석 결과를 토대로 주택시장을 수요 과다, 수요 초과, 수급 균형, 공급 초과, 공급 과다 등 5개 유형으로 구분했다.이 결과 서울과 부산, 인천 등은 수급 균형 예상 지역으로 분류됐다. 또 대전은 수요 초과 예상 지역, 경기도·울산·대구는 공급 초과 예상 지역으로 꼽혔다.충남(세종 포함)·경북·경남·제주도는 공급 과다 예상 지역으로 분류됐다.집값 상승 폭을 놓고 지역별로 시장 과열 위험성도 진단했다.올해 5월 대비 6월 주택 매매가격 상승률을 비교해 전국 평균(0.21%)보다 높은 세종(1.67%)·서울(0.66%)·부산(0.38%) 등을 시장 과열 지역으로 분류했다.연구원은 특히 서울, 부산의 경우 수급 균형이 맞는데도 불구하고 집값이 오른 것은 투자수요가 유입된 때문으로 분석했다.하지만 이런 예측에 대한 구체적인 통계는 제시하지 않아 '정부 보조 맞추기'라는 지적도 나온다.지난달 23일 김현미 국토교통부 장관은 취임사에서 ""올해 5월 무주택자나 1주택자가 집을 산 비율은 작년 동기와 비교하면 마이너스를 기록했으나 5주택 이상 보유자는 강남 4구에서만 무려 53% 증가했다""며 다주택자 등 투자수요를 집값 상승의 원인으로 지목한 바 있다.연구원은 지역 상황에 맞는 탄력적인 정책 추진이 필요하다고 주장했다.수급 균형 예상 지역임에도 매매가격이 뛰는 서울과 부산 등에 대해선 모니터링 후 분양주택 청약요건과 전매제한 강화, 투기지역·투기과열지구 지정 등의 수요관리 정책을 고려할 필요가 있다고 제안했다.반면 공급 과다 예상 지역인 경북·충남·울산 등은 공공부문 택지 공급 축소, 건설사 보증 한도 제한 및 심사 강화, 준공률 고려한 후분양제 탄력 도입, 매입형 임대사업 확대 등의 공급관리정책이 필요하다고 주장했다sms@yna.co.kr최신 유행 트렌드 총집결(클릭!)"
192,2017-07-11,"현대모비스, 물량 밀어내기 '갑질' 인정···공정위에 ""피해보상..""",https://news.naver.com/main/read.nhn?mode=LSD&mid=shm&sid1=101&oid=003&aid=0008060303,뉴시스,"현대모비스, 물량밀어내기 의혹 공정위에 '동의의결' 신청법적 공방 대신에 불공정 행위 피해 보상하겠다고 밝혀김상조 위원장, 4대 그룹 엄격한 잣대 적용 예고 효과【세종=뉴시스】박상영 기자 = 부품 대리점을 상대로 물량 밀어내기 의혹을 받고 있는 현대모비스가 공정거래위원회에 동의의결을 신청한 것으로 확인됐다. 공정위와의 법적 공방 대신에 불공정행위로 인해 발생한 피해를 스스로 보상하겠다는 것이다.11일 관련 업계에 따르면 시장지배적 지위 남용 혐의를 받고 있는 현대모비스가 최근 공정위에 동의의결을 신청했다.동의의결은 불공정 거래 혐의가 있는 사업자가 스스로 소비자 피해구제와 재발 방지 대책 등 시정 방안을 제시해 타당성을 인정받으면 위법 여부를 확정하지 않고 사건을 종결하는 제도다.현대모비스가 동의의결 카드를 꺼내든 것은 김상조 공정위원장의 행보에 대한 대응으로 풀이된다. 김 위원장은 취임 초부터 줄곧 4대 그룹에 보다 엄격한 잣대를 적용하겠다고 예고했다.김 위원장은 지난달 4대 그룹 경영진과 만난 자리에서 기업인들 스스로 선제적인 변화의 노력을 기울여달라고 강조하기도 했다.현대모비스는 전국 1600여개 부품 대리점을 대상으로 판매 목표를 강제하고 물량도 떠넘기는 등 이른바 물량 밀어내기를 벌인 것으로 알려졌다.이에 공정위는 2013년 11월에 1차 조사를 벌인 뒤 2015년 3월에 추가 조사를 진행한 후 최근 현대모비스에 심사보고서를 보냈다.앞서 공정위는 지난해 11월에도 같은 혐의로 심사보고서를 현대모비스에 발송했다. 그러나 공정위는 심사보고서에 추가로 보완할 내용이 있다고 판단, 최근 심사보고서를 재발송했다.공정위가 이처럼 심혈을 기울이고 있는 이유는 현대모비스가 물량 밀어내기를 한 것은 분명해 보이지만, 이로 인해 얻은 매출액 산정이 쉽지 않았기 때문으로 파악된다.앞서 공정위는 대리점을 상대로 물량 밀어내기를 한 남양유업에 5억원의 과징금을 부과하는 데 그쳤다.밀어내기 물량 규모를 파악하기 위해 전국 대리점의 컴퓨터를 뒤졌지만 일부 기록밖에 남지 않아 결국 파견된 판촉사원의 인건비를 떠넘기기에 대한 과징금 부과만 인정됐기 때문이다.동의의결 절차를 진행할지 여부를 결정하는 전원회의는 이르면 다음 주 열리게 된다.sypark@newsis.com뉴시스 뉴스, 네이버 뉴스 스탠드에서도 만나세요뉴시스 SNS[페이스북][트위터]<저작권자ⓒ 공감언론 뉴시스통신사. 무단전재-재배포 금지.>"
193,2017-07-11,"상의 ""보여주기식 투자·고용 아닌 자발적 노력해야""",https://news.naver.com/main/read.nhn?mode=LSD&mid=shm&sid1=101&oid=001&aid=0009397640,연합뉴스,"이동근대한상공회의소 상근부회장 [연합뉴스 자료사진](서울=연합뉴스) 정성호 기자 = 이동근 대한상공회의소 상근부회장은 11일 ""(기업들이) 과거의 '보여주기 식' 투자·고용 계획보다는 기업의 자발적 노력을 통해 사회와의 약속을 실천해 나가야 한다""고 말했다.이 부회장은 이날 서울 중구 세종대로 상공회의소회관에서 열린 대한상의와 대기업 그룹 간 간담회에서 인사말을 통해 ""정부의 정책 변화뿐 아니라 기업에 대한 사회적 요구도 많아지고 있다""며 이같이 말했다.그는 ""그룹별로, 계열사별로 형편에 맞게 어떤 일을 해야 하는지 계획을 세우고 솔선해 나가야 한다""고 강조했다.그러면서 ""특히 대기업은 우리 경제에서 중요한 역할을 맡고 있는 만큼 대기업이 먼저 움직이면 변화의 확산 속도도 더 빨라질 것으로 생각한다""고 말했다.이어 ""새로운 규제가 아닌 기업의 자발적 변신을 유도하는 포지티브 캠페인의 빠른 전파를 기대해본다""고 언급했다.포지티브 캠페인이란 김상조 공정거래위원장이 제안한 개념으로, 대·중소기업 간 상생협력과 같은 모범사례를 축적해나가자는 것이다.이 부회장은 또 ""대통령이 지난달 미국에서 열린 경제계와의 차담회에서 '주요 기업인을 만나 대화하고 소통하는 자리를 가지면 좋겠다'는 말을 했다""며 ""이에 상의는 대통령에게 공식적으로 만남의 자리를 요청할 계획""이라고 말했다.아울러 ""또 우리 상공업계의 상당수인 97%를 차지하는 중소·중견기업과의 간담회도 연이어 청와대에 요청할 계획""이라고 덧붙였다.그는 ""(최근 새 정부와) 소통의 과정에서 정부의 경제계와의 협력 의지도 느낄 수 있었고, 여러 현안에 대한 최적의 대안을 찾을 수 있을 것이란 생각도 했다""며 ""상의는 앞으로도 다양한 채널과 방식을 통해 민관 소통의 가교 역할을 하고, 동시에 경제계의 혁신을 이끌어내기 위해 노력할 것""이라고 말했다.sisyphe@yna.co.kr최신 유행 트렌드 총집결(클릭!)"
194,2017-07-11,"'15대 그룹' 회동 대한상의 ""청와대·기업 만남 일정 조율""",https://news.naver.com/main/read.nhn?mode=LSD&mid=shm&sid1=101&oid=003&aid=0008060382,뉴시스,"""청와대와의 만남 일정 얘기할 것···경제 현안도 논의""【서울=뉴시스】김지은 기자 = 15대 그룹 경영진이 문재인 대통령과의 첫 공식 회담에 앞서 경제 현안에 대해 논의하는 자리를 가졌다.대한상공회의소는 11일 오전 7시30분 삼성, 현대차, SK, LG, 롯데, 포스코, GS, 한화, 현대중공업, 신세계, KT, 두산, 한진, CJ, 부영 등 15대 그룹 경영진과 간담회를 개최했다. 15대 그룹에서는 주은기 삼성전자 부사장, 박광식 현대자동차 부사장, 박영춘 SK 부사장 등이 참석했다.대한상의는 이날 간담회를 통해 청와대와의 만남 일정을 조율하고 현안 논의 안건 등에 대해 미리 의견을 모을 것이라고 밝혔다.이날 이동근 대한상의 상근부회장은 인사말을 통해 ""최근 대한상의는 새 정부의 유관기관과 소통 기회를 여러번 가지며 경제계와의 협력 의지를 느낄 수 있었다""며 ""국민적, 사회적 요구도 많아진 만큼 기업들도 약속을 실천하고 계획을 세울 필요가 있다""고 밝혔다.이 부회장은 ""오늘은 대통령과 대기업과의 간담회에 대해서 논의를 했으면 한다""며 ""대통령께서 주요 기업인들을 만나 소통하는 자리를 갖길 바란다고 말씀하신 만큼 대한상의가 공식적인 청와대와의 만남 자리를 요청드릴 계획이다""라고 전했다.또 ""대기업 뿐 아니라 중견기업과 중소기업 간담회도 연이어 요청드릴 것""이라며 ""오늘은 새 정부의 경제 정책 동향에 대해 간략이 설명한 후 경제 현안과 업계 의견을 자유롭게 교환하는 시간을 갖겠다""고 말했다.최근 이용섭 일자리위원회 부회장은 일자리 창출 정책에 대해 3대 현안을 반드시 추진하겠다는 각오를 드러냈다. 이 부위원장은 ""경제계에서는 현재의 상황이 시장의 실패 혹은 무능이라고 얘기한다. 이런 때에는 정부가 나설 수밖에 없다""고 말한 바 있다.이에 따라 재계에서는 정부의 이같은 방침에 대한 대책을 논의하고 문 대통령과 회동 자리에서 전달할 의견을 토론할 것으로 보인다.이날 이 상근부회장은 ""대기업이 우리 경제에도 중요한 역할을 하는 만큼 대기업이 먼저 움직이면 변화의 확산 속도도 빨라질 것으로 본다""며 ""새로운 규제가 아닌 기업의 자발적인 변신을 유도하는 포지티브(Positive) 캠페인의 전파를 기대한다""고 강조했다.whynot82@newsis.com뉴시스 뉴스, 네이버 뉴스 스탠드에서도 만나세요뉴시스 SNS[페이스북][트위터]<저작권자ⓒ 공감언론 뉴시스통신사. 무단전재-재배포 금지.>"
195,2017-07-11,태국 계란 수입효과 '미미'…폭등한 계란값 '요지부동',https://news.naver.com/main/read.nhn?mode=LSD&mid=shm&sid1=101&oid=001&aid=0009397497,연합뉴스,"고민되는 계란값(서울=연합뉴스) 이상학 기자 = 폭등한 계란값은 이달 초 태국산 계란이 수입된 뒤에도 가격이 인하되지 않고 있다. AI 피해가 특히 컸던 서울·수도권 지역의 일부 슈퍼마켓에서는 30개들이 계란 한 판이 여전히 1만원 넘는 가격에 거래되고 있다. 11일 서울시내 한 대형마트에서 한 고객이 계란을 살펴보고 있다.     leesh@yna.co.kr수입 전 30개들이 7천965원에서 수입 후 7천969원으로 오히려 올라(서울=연합뉴스) 정열 기자 = 사상 최악의 고병원성 조류인플루엔자(AI) 창궐로 야기된 '계란 파동'을 진정시키고자 정부가 수입을 추진한 태국산 계란이 국내에 유통된지 1주일여가 됐지만 폭등한 계란값은 좀처럼 떨어지지 않고 있다.세관 도착한 태국산 계란 [연합뉴스 자료사진]11일 한국농수산식품유통공사(aT)에 따르면 10일 현재 계란 평균 소매가(30개들이 특란 기준)는 7천969원으로, 한 달 전보다 55원 올랐다.1년 전 가격인 5천380원보다는 2천500원 이상 급등한 것이다.폭등한 계란값은 이달 초 태국산 계란이 수입된 뒤에도 꿈쩍하지 않고 있다.AI 피해가 특히 컸던 서울·수도권 지역의 일부 슈퍼마켓에서는 30개들이 계란 한 판이 여전히 1만원 넘는 가격에 거래되고 있다.판매용 태국산 계란 초도물량 97만5천개는 지난 2∼3일 두 차례에 걸쳐 선박편으로 부산항과 인천항을 통해 반입됐다.지난달 21일 검역용 샘플 2천160개가 항공편으로 인천공항을 통해 들어온 지 열흘여만이다.수입가가 국산의 3분의 1 수준으로 알려진 태국산 계란은 마트나 슈퍼마켓 등을 통해 일반 소비자에게 판매되기보다는 주로 소규모 제빵업체나 식당 등에 납품되는 것으로 알려졌다.계란 10개 3천4백8십원, 30개 한판이면 1만4백4십원(서울=연합뉴스) 이상학 기자 = 폭등한 계란값이 이달 초 태국산 계란이 수입된 뒤에도 가격이 인하되지 않고 있다. AI 피해가 특히 컸던 서울·수도권 지역의 일부 슈퍼마켓에서는 30개들이 계란 한 판이 여전히 1만원 넘는 가격에 거래되고 있다. 11일 서울시내 한 대형마트에서 한 시민이 계란을 고르고 있다.     leesh@yna.co.kr유통마진을 포함한 최종 판매가는 30개들이 한 판에 4천500∼6천원 수준인 것으로 전해졌다.일선 소매점에서 한 판에 1만원 안팎까지 치솟은 국산 계란과 비교하면 절반 수준의 가격이다.정부와 업계 일각에서는 가격이 국산의 절반 수준인 태국산 계란이 수입되면 천정부지로 치솟은 국내 계란값이 내리지 않을까 기대했으나 아직까지 그런 징조는 보이지 않고 있다.판매용 태국산 계란이 수입되기 직전 7천965원이던 aT 기준 30개들이 계란 평균 소매가는 태국 계란이 수입된 뒤 소폭 등락을 거듭했지만 결국 일주일이 지난 10일 현재 7천969원으로 별다른 변동이 없는 상황이다.이달 초 대한양계협회가 산지 계란 출하 가격을 10원 내리기로 한 조치도 계란값 하락에 별다른 영향을 주지 못한 것으로 풀이된다.업계에서는 하루 평균 국내 계란 소비량이 3천만∼4천만개에 달한다는 점을 고려하면 일주일에 100만개에도 못 미치는 태국산 계란 수입량은 매우 미미한 수준이어서 계란값 안정에 미치는 영향이 매우 제한적일 것으로 분석했다.농림축산식품부 관계자는 ""민간업체에서 자율적으로 수입하고 있는 거라 정부가 개입할 여지는 거의 없는 상황""이라며 ""태국산 계란 수입이 전체 시장에 어떤 영향을 미칠지는 좀더 지켜봐야 할 것""이라고 말했다.세관 도착한 태국산 계란 [연합뉴스 자료사진]passion@yna.co.kr최신 유행 트렌드 총집결(클릭!)"
196,2017-07-11,"맥도날드 근무자들 ""패티 덜 익을 수 있다""…회사 해명 반박",https://news.naver.com/main/read.nhn?mode=LSD&mid=shm&sid1=102&oid=001&aid=0009397503,연합뉴스,"'햄버거 포비아' 확산 (PG)[제작 조혜인] 일러스트맥도날드 ""고객에게 전달될 확률 낮다"" 가능성 일축맥도날드 매장 [연합뉴스 자료사진. 본 사진은 기사 내용과 무관함](서울=연합뉴스) 최평천 기자 = 최근 4세 아동이 덜 익힌 고기 패티가 든 맥도날드 햄버거를 먹고 '햄버거병'에 걸렸다고 가족들이 주장하는 가운데 회사 해명과 달리 '패티가 덜 익을 수 있다'는 전·현직 직원들의 증언이 나왔다.전·현직 맥도날드 근무자들은 11일 연합뉴스와 통화에서 ""일할 때 종종 덜 익은 패티가 나왔다""며 ""체크리스트에 조리 상태가 정상으로 기록되고 수백개가 정상이더라도 일부 패티는 덜 익을 수 있다""고 주장했다.이는 체크리스트가 정상으로 기록됐기 때문에 덜 익은 패티가 나올 수 없다는 맥도날드의 해명과는 배치되는 증언이다.최근 맥도날드 버거를 먹고 HUS(용혈성요독증후군·일명 '햄버거병')에 걸렸다고 주장하는 어린이 가족이 검찰에 맥도날드를 고소하자, 맥도날드 측은 당일 해당 매장의 식품안전 체크리스트는 정상이었다고 해명한 바 있다.2004년 맥도날드에서 아르바이트를 시작해 부점장까지 10년간 근무한 전직 직원 박모(33·여)씨는 ""형식적 체크리스트만으로 패티가 덜 익지 않았음을 증명할 수 없다""며 맥도날드의 해명에 의문을 제기했다.그는 ""매일 아침 그릴과 패티의 온도를 측정하고 체크하지만, 온종일 그 온도가 유지되지 않을 수도 있다""며 ""일부 직원은 체크리스트를 대충 작성하는 경우도 있다""고 말했다.박씨는 또 근무 기간 덜 익은 패티 때문에 고객의 교환 요청을 받거나 제품을 폐기한 적이 여러 번 있었다고 증언했다.박씨는 ""고기 패티 속이 덜 익어 교환을 요청하는 고객이 있어 교환해준 적이 있다""며 ""아르바이트생들이 '패티가 덜 구워졌다'고 보고하는 경우도 적지 않았다""고 전했다.한산한 맥도날드 매장(서울=연합뉴스) 한종찬 기자 = 이른바 '햄버거병' 파문으로 인한 '햄버거 포비아'(햄버거 공포증)가 확산하면서 맥도날드를 비롯한 주요 햄버거 업체들의 매출 타격이 현실화되고 있다. 11일 서울의 한 시내 맥도날드 매장이 점심시간임에도 한산하다.     saba@yna.co.kr그는 ""조리기가 오류가 나거나 패티가 그릴 밖으로 삐져나올 수도 있고, 패티와 그릴 바닥 사이에 틈이 생기기도 한다""며 덜 익은 패티가 나오는 경위도 설명했다.서울의 한 맥도날드 직영점 직원인 A씨 역시 ""미숙한 아르바이트생이 패티를 넣다 보면 그릴 틀에서 벗어날 때가 있다""며 ""손님이 바쁜 시간에는 패티 일부가 안 구워질 수 있다""고 말했다.A씨는 ""매니저가 맨눈으로 패티를 확인하지만, 완벽할 수는 없다""며 ""체크리스트에 정상으로 표기됐다는 것이 패티가 덜 익을 가능성이 없음을 의미하지는 않는다""고 설명했다.11년간 맥도날드에서 일하며 지점 매니저까지 맡았던 B씨는 ""패티가 덜 익어서 폐기한 적이 여러 번 있었다""며 ""기계로 조리하다 보니 완벽하게 다 구워지는 것은 아니다""고 말했다.맥도날드 측은 패티가 덜 구워질 수 있는 가능성은 인정하면서도 덜 익은 패티가 고객에게 전달될 확률은 낮다고 주장했다.맥도날드 관계자는 ""패티가 안 익으면 맨눈으로 빨갛게 보이고, 패티가 덜 익혀졌을 경우 폐기하라는 교육도 한다""며 ""조리기의 열과 압력으로 굽다 보니 겉이 익었는데 속이 안 익을 가능성은 매우 작다""고 말했다.7월5일 맥도날드를 검찰에 고소하는 '햄버거병' 피해 엄마. [연합뉴스 자료사진]pc@yna.co.kr최신 유행 트렌드 총집결(클릭!)"
