,날짜,기사 제목,기사 링크,기사 출처,기사 내용
40,2015-03-24,"여야, 공무원연금·자원외교특위 등 기한내 처리 합의",https://news.naver.com/main/read.nhn?mode=LSD&mid=shm&sid1=100&oid=277&aid=0003461537,아시아경제,"박상옥 대법관 인사청문회 개최 …사회적경제기본법 4월 처리 합의공무원연금개혁·자원외교 특위, 각론서 이견 여전 …험로 예상[아시아경제 이민찬 기자, 김보경 기자] 여야는 24일 박상옥 대법관 후보자 인사청문회를 실시하기로 합의했다. 공무원연금 개혁안도 대타협기구의 활동시한인 이번 주 내로 마련하는 데 인식을 같이 했다. 또 사회적경제기본법을 4월 임시국회에서 합의 처리하기로 의견을 모았다.유승민 새누리당·우윤근 새정치민주연합 원내대표는 이날 오후 주례회동을 갖고 이 같은 내용을 포함한 합의문을 발표했다.우선 두 달 동안 공전하고 있는 박상옥 대법관 후보자 인사청문회 개최에 합의했다. 일정은 청문특위 여야 간사가 협의해서 결정하기로 했다. 이에 따라 대법관 공백으로 인한 재판 지연 등 우려도 가라앉을 전망이다.그러나 야당 일각에서 부정적 기류가 여전해 험로가 불가피해 보인다. 이 같은 점을 고려해 과반 정당인 새누리당이 야당의 반발을 무릅쓰고 본회의 표결로 박 후보자 인준안을 단독 처리할 가능성이 조심스럽게 점쳐진다.공무원연금개혁대타협기구 활동이 끝나는 이번 주 안에 개혁안을 마련하는 데 최대한 노력한다는 점도 밝혔다. 조해진 새누리당 원내수석부대표는 이날 브리핑에서 ""정부안이 뭐냐에 대해 의견이 분분한데, 사실상의 정부안은 이미 공개가 됐다""면서 ""합의문에 내용이 다 포함돼 있다""고 말했다.여야 원내대표는 또 사회적경제기본법을 4월 임시국회에서 합의 처리키로 했다. 안규백 새정치연합 원내수석부대표는 ""유승민 원내대표의 신념과도 같은 법안이고 우리 당에서 신계륜 의원이 공동  발의했다""면서 ""특위에서 깊은 논의해서 타결 볼 생각 갖고 있다""고 말했다. 조 원내수석부대표도 ""유승민 원내대표가 발의한 법안을 중심으로 조금 내용을 조정하면 될 것""이라고 말했다.여야 간 첨예한 갈등을 빚고 있는 해외자원개발 국정조사특위에 대해서는 원활하게 진행될 수 있도록 여야가 함께 노력한다는 데 인식을 같이 했다. 오는 4월7일 종료를 앞두고 있는 특위는 공천회 증인 채택을 두고 여야가 이견을 보이고 있다.그러나 여야 간 온도차가 여전하다. 조 수석부대표는 ""증인 채택 기준에 여야가 합의하면 그 기준에 따라 여야가 요구하는 증인의 범위도 크게 차이가 나지 않을 것""이라고 말했다. 반면 안 수석부대표는 ""정책결정권자와 정책입안자 부르지 않으면 앙꼬 없는 찐빵""이라고 말했다.정부·여당이 공을 들이고 있는 서비스산업발전기본법과 북한인권법은 소관 상임위 차원에서 논의를 집중할 예정이다. 조 원내수석부대표는 ""시행령에 보건·의료를 빼자는 게 야당의 주장""이라고 말했다. 안 원내수석부대표는 ""서비스산업을 발전시킬 수 있는 내용만 담아야 한다""면서 ""의료와 보건 분야는 의료민영화로 가기 위한 단계라는 게 우리 당의 일관된 생각""이라고 말했다.여야 합의문에는 빠졌지만 야당의 개헌특위 구성 요구도 있었다. 안 수석부대표는 ""우리 당에서 강력히 계속 주장해왔던 개헌특위에 대해서는 여당 원내지도부에서 상당히 고민을 많이 하고 있다""면서 ""국회의원 243명이 서명했기 때문에 국가적 중차대한 어젠다를 논의 안하는 것은 국회 책임 방기라는 게 일관된 생각""이라고 말했다.이민찬 기자 leemin@asiae.co.kr김보경 기자 bkly477@asiae.co.kr▶ 진정한 부의 위대함 ""버핏에게 묻다""[루머앤진실][네티즌핫이슈][골프뉴스][부동산소식][자동차정보]<ⓒ세계를 보는 창 경제를 보는 눈, 아시아경제 무단전재 배포금지>"
41,2015-03-24,결핵환자 한해 3만여 명 발생…줄지 않는 이유는?,https://news.naver.com/main/read.nhn?mode=LSD&mid=shm&sid1=102&oid=056&aid=0010146371,KBS,"<앵커 멘트>오늘이 세계 결핵의 날입니다.자칫 생명을 잃을 수도 있는 결핵 환자가 한 해 3만 명 이상 발생하고 있지만, 결핵에 대한 인식이 부족한 실정입니다.함영구 기자입니다.<리포트>감기 증세로 병원을 찾았다가  결핵 판정을 받은 70대 할아버지.벌써 보름째 입원 치료를 받고 있습니다.<녹취> 결핵환자(음성변조) : ""동네 병원에서 감기 증세로 해서 목에 염증이 있는 것 같다고..그래서 약주고 주사 맞고.""지난해 4월엔, 한 초등학교 교사가 결핵에 걸린 사실을 모른채 근무하다 동료 교직원과 학생 등 40여 명에게 결핵균을 전염시켰습니다.이렇게 특별한 증상이 없는 것이 후진국 병으로 알려진 결핵 환자가 해마다 3만 명 이상 발생하는 주된 이유입니다.노약자 등 질병에 취약한 고위험군들조차 결핵에 대한 인식이 부족합니다.<인터뷰> 윤기헌(82살) : ""(검진 받아 보셨어요?) 안 받아 봤어요. 다른 것은 없고 담배를 피워서 폐가 상했대요.""결핵 환자는 일찍 찾아내 조기 치료하는 것이 중요하지만 자치단체들이 보유한 검진 장비는 충분치 않습니다.<인터뷰> 홍왕기(결핵협회 충북본부장) : ""누워서 찍는 시설이 없습니다. 그런 장비를 갖춰주면 결핵 환자 발견과 치료하는데 많이 도움이 되겠습니다.""정부는 결핵 환자 수가 주춤하자 2천1년부터 실태 조사 조차 중단해 결핵 관리가 느슨해 졌다는 지적도 제기되고 있습니다.KBS 뉴스 함영구입니다.함영구기자 (newspower@kbs.co.kr)▶[취재후] 방송에서 못한 현장 이야기▶ KBS뉴스 SNS[트위터][페이스북][카카오][저작권자ⓒ KBS 무단복제-재배포 금지]"
42,2015-03-24,'40억 횡령' 前 포스코건설 상무 구속,https://news.naver.com/main/read.nhn?mode=LSD&mid=shm&sid1=101&oid=001&aid=0007484508,연합뉴스,"(서울=연합뉴스) 김계연 기자 = 포스코건설 비자금 사건을 수사하는 서울중앙지검 특수2부(조상준 부장검사)는 24일 이 회사에서 베트남법인장을 지낸 박모(52) 전 상무를 구속했다.검찰에 따르면 박 전 상무는 2009∼2012년 포스코건설의 베트남 고속도로 건설사업 과정에서 하청업체 흥우산업 등에 지급하는 공사대금을 부풀려 100억원대의 비자금을 조성하고 이 가운데 40억여원을 빼돌린 혐의(특정경제범죄가중처벌법상 횡령)를 받고 있다.서울중앙지법 이승규 영장전담 판사는 이날 구속전 피의자 심문(영장실질심사)을 한 뒤 ""구속 사유와 필요성이 충분히 소명됐다""며 구속영장을 발부했다.검찰은 박 전 상무가 마련한 비자금 가운데 상당 액수가 현지 발주처 상대 리베이트라는 본래 목적과 다르게 사용된 사실을 확인하고 지난 21일 밤 그를 긴급체포했다.박 전 상무가 구속됨에 따라 비자금 조성경위와 구체적 사용처에 대한 수사에 속도가 붙을 전망이다.검찰은 자금 흐름을 계속 추적하는 한편 박 전 상무를 상대로 정동화(64) 전 포스코건설 부회장과 정준양(67) 전 포스코 회장 등 '윗선'의 지시로 비자금을 조성했는지 집중 추궁할 방침이다.dada@yna.co.kr▶연합뉴스 앱 지금 바로 다운받기~▶ [오늘의 HOT] '꽃보다 할배' 제작발표회<저작권자(c) 연합뉴스, 무단 전재-재배포 금지>"
43,2015-03-24,정규직도 해고 몸서리…장년층 퇴출 후 임시·일용직 전전,https://news.naver.com/main/read.nhn?mode=LSD&mid=shm&sid1=102&oid=469&aid=0000054196,한국일보,"[임금 계급사회의 그늘] (3) 노동위기 보호막이 없다임금ㆍ근로시간 조정 등 노력 없이권고사직ㆍ명퇴 명분 '합법적 해고'中企-구직자 매칭 시스템 부족대부분이 단기ㆍ저임금 일자리재취업해도 임금 월 평균 184만원2008년까지 한 중견기업의 경영관리실장으로 일했던 문채식(53)씨는 회사 경영 사정 악화로 퇴직한 뒤 5~6년간 단기 기간제 일자리를 전전했다. 지난달 서울시청 청사의 정규직 시설청소원으로 취업한 그는 “중장년층이 안정적인 제2의 일자리를 찾는 건 하늘의 별 따기와 같다”고 말했다.정규직도 해고에서 안전하지 않다지방의 한 국립대 회계학과를 졸업한 문씨는 1989년부터 기업의 재무회계, 경영관리 부문에서 20년 간 경력을 쌓았다. 출판 기업에서 근무하던 문씨는 능력을 인정 받아 다른 회사로 스카우트됐고, 경영관리실장 자리에까지 올랐다.그런데 2008년 금융위기 때 회사가 운영하던 직업전문학교의 행정실장으로 파견 발령 받았던 문씨는 결국 원래 자리로 복귀하지 못했다. 문씨는 회사로부터 “앞으로는 대표이사가 경영실장까지 겸직하기로 했다”는 통보를 받았다. 회사가 문씨를 직접적으로 해고한 것은 아니었으나 원래 자리가 없어진 문씨는 회사를 그만둘 수밖에 없었다.이처럼 정규직 노동자 역시 고용 불안에 시달리고 있다. 회사가 합법적으로 근로자를 퇴사시킬 방법은 많기 때문이다. 희망퇴직과 권고사직은 근로자가 원한 것이 아니어도 자발적인 이직으로 간주된다. 고용노동부에 따르면 장년(50~64세) 남성의 경우 권고사직ㆍ명예퇴직으로 인한 조기퇴직 비율이 16.9%에 달한다.도재형 이화여대 법학과 교수는 “근로자가 사측의 희망퇴직ㆍ권고사직을 받아들이지 않으면 잘 모르는 부서로 배치되거나 급여가 깎여 결국 퇴사할 수밖에 없는 상황에 놓인다”며 “퇴직금을 받고 나가느냐, 불명예스럽게 해고당할 것이냐 둘 중 하나를 선택할 수밖에 없어 회사의 강요에 가깝지만 법적으로는 근로자 진의에 의한 퇴사가 된다”고 설명했다.이렇다 보니 한국은 정규직의 고용보호 수준도 낮다. 김유선 한국노동사회연구소 선임연구위원에 따르면 2013년 경제협력개발기구(OECD) 34개국을 대상으로 조사한 고용보호지수에서 한국의 ‘정규직 해고 제한’은 22위로 하위권이었다. 정규직 해고가 상대적으로 쉽다는 의미다.정년이 보장되는 정규직인 서울시청 시설청소원으로 채용된 직원들이 청사 화장실을 청소하고 있다. 이들 대부분은 대기업 근무 등의 경력을 갖고 있지만 퇴직 후 정규직 일자리를 구하는 데 어려움을 겪었다. 배우한기자 bwh3140@hk.co.kr제2의 기회 없는 현실문채식씨를 포함해 지난달 채용된 서울시청의 시설청소원 8명 모두가 50대다. 여전히 자녀의 등록금, 주택 대출 자금 등의 지출 때문에 재취업한 경우가 많다. 서울시의 일자리는 1,900만원의 연봉과 60세 정년을 보장한다.문씨는 퇴직 후 경력을 살려 중소기업에 재취업하려 했지만 실패했다. 퇴직 직전 연봉이 7,000만원이었던 그에게 면접관들은“중소기업에 만족하지 못할 것”이라는 평가를 내렸기 때문이다. 결국 문씨는 2011년부터는 경력에 대한 고려 없이 닥치는 대로 이력서를 넣어야 했다.퇴직 후 문씨가 처음으로 월급을 받은 자리는 고용노동부의 통계 조사원이었다. 오전 9시~오후 6시 전화 조사와 서류 정리를 하며 한달 꼬박 근무해 100만원가량 받았다. 이마저도 최장 6개월까지만 근무할 수 있었다. 고용인원을 늘리기 위해 한 사람당 3개월짜리 계약이 2회까지만 인정됐기 때문이다.이후 서울시 산하 기관인 품질 시험소에서 택시 미터기 품질 검사를 하며 6개월, 문화재 관리인으로 박정희 전 대통령의 가옥을 관리하며 11개월을 보냈다. 24시간 3교대 근무를 하면서 버텨낸 문화재 관리인 자리였지만 계약 연장은 불가능했다.이처럼 재취업을 원하는 장년층에게 열린 자리는 단기ㆍ저임금 일자리가 대부분이다. 통계청이 발표한 장년 재취업자 현황에 따르면 2013년 임시직으로 재취업한 사람이 58만명(29.1%), 일용직이 33만명(16.5%)으로 불안정한 일자리가 절반에 달했다. 재취업을 하더라도 이들의 임금은 월 평균 184만원으로 20년 이상 장기근속자가 받는 593만원의 31%에 불과하다.재취업 왜 어렵나서울시 정규직 시설청소원처럼 정년이 보장되는 제2의 일자리를 찾기란 쉽지 않다. 구직자들과 전문가들은 양질의 일자리가 적은데다 일자리 연결이 제대로 이뤄지지 않는다고 지적한다. 문채식씨는 “정부에서 운영하는 일자리 상담센터에 가면 자기소개서 작성법, 면접방법을 알려주는데 20년 경력의 퇴직자들에게 필요한 것은 그런 교육이 아니다”며 “구인에 애를 먹고 있는 중소기업과 구직자들을 직접 연결해주는 일자리 매칭이 필요하다”고 말했다.통계청이 2013년 구직을 원하는 장년층을 대상으로 조사한 결과에 따르면 구직 시 애로사항으로 느끼는 점은 ‘적합한 일자리 부족’이 52.6%로 가장 많았고, ‘취업 정보 부족’(39.3%), ‘고령에 따른 취업 곤란’(38.5%)이 뒤를 이었다.도재형 교수는 “일자리 질이 전체적으로 나빠지고 있어 결국 자영업을 하게 되지만 자영업도 망하기 쉽다”며 “좋은 일자리가 늘어나야 자영업이 살고, 내수 시장이 살아나면서 중소기업에도 좋은 일자리가 생기는 선순환이 이뤄질 것”이라고 말했다.양진하기자 realha@hk.co.kr[아직 모르시나요? 반칙없는 뉴스 바로가기] [한국일보 페이스북] [신문에는 없는 뉴스] [꿀잼 동영상][ⓒ 한국일보(hankookilbo.com), 무단 전재 및 재배포 금지]"
44,2015-03-24,"노사정 대타협, 시한넘기나…벽에 부딪친 대화 '입장차'",https://news.naver.com/main/read.nhn?mode=LSD&mid=shm&sid1=102&oid=214&aid=0000478035,MBC,"[뉴스데스크]◀ 앵커 ▶노동시장을 개선하기 위한 노, 사, 정간의 대화가 벽에 부딪혔습니다.◀ 앵커 ▶타협시한을 1주일 남기고 있는데, 입장 차이는 좁혀지지 않고 있습니다.장승철 기자입니다.◀ 리포트 ▶경제사회발전노사정위원회 김대환 위원장이 '노사정 대타협'을 놓고 사퇴의 배수진을 쳤습니다.합의시한까지 1주일 남짓 남은 상황에서 경제계와 노동계 대표들을 압박하고 나선 겁니다.[김대환/노사정위원장]""만약 합의 이르지 못한다면 저는 노사정위원장직에서 책임을 지고 물러나겠다는 말씀 드리고..""김위원장은 모레 각 대표들이 참석한 전체특위에서 합의를 시도하겠다고 밝혔지만 전망은 밝지 않습니다.정규직과 비정규직으로 양분된 노동시장의 이중 구조를 개선하는 문제에서, 경영계는 정규직의 임금과 복지를 줄이자는 입장이지만 노동계는 근로자들 전체에 대한 하향평준화라고 맞서고 있습니다.통상임금에 정기 상여를 넣을지를 놓고도, 근로시간을 8시간 단축하는 문제를 놓고도 양측은 평행선을 달리고 있습니다.노사정위의 협상은 청년실업과 비정규직문제 해결을 미룰 수 없다는 공감대에서 지난해 12월부터 계속돼 왔습니다.그러나 노동계의 한 축인 민주노총은 노사정위원회의 협상자체를 거부하고 있어 노동계도 양분된 상태입니다.오늘 고용부장관과 민주노총위원장이 만났지만 민주노총은 최저임금 인상이 우선이라며 다음달 총파업을 예고했습니다.MBC뉴스 장승철입니다. (장승철 기자)[저작권자(c) MBC (www.imnews.com) 무단복제-재배포 금지]"
45,2015-03-24,머리 밟고 테이저건 발사…경찰 무고한 시민 폭행,https://news.naver.com/main/read.nhn?mode=LSD&mid=shm&sid1=102&oid=214&aid=0000478039,MBC,"[뉴스데스크]◀ 앵커 ▶경찰이 무고한 시민들을 폭행해 논란이 일고 있습니다.한 남성을 범인으로 오인해 폭행하면서 시작된 일인데, 이를 항의하던 다른 시민들까지 거칠게 제압하고 전기총까지 쐈습니다.김태윤 기자입니다.◀ 리포트 ▶어제 오후 서울 중구의 한 도로입니다.경찰 세 명이 오토바이 주인에게 신분증을 요구합니다.잠시 뒤, 경찰이 제압을 하려하자 남성은 옷을 벗어 던지고 대결자세를 취합니다.그러자, 경찰들이 달려들어 남성을 쓰러뜨린 뒤, 머리를 수차례 밟습니다.[목격자]""너무 심한거 아니냐고 말했더니 미국 같으면 총 맞는다고 그러더라고요.""지나가던 사람들이 경찰의 과잉대처에 항의했고.""밟지 마세요!""한 남성이 휴대전화로 현장을 촬영하자, 전기총인 테이저건까지 발사했습니다.""지지직""""휴대전화를 빼앗으려고 해서 제가 피하니까 테이저건을 저에게 쐈어요 정조준해서.""경찰은 이 남성도 넘어뜨린 뒤, 머리를 밟았고, 옆에서 항의하던 아들까지 체포했습니다.""저 아무것도 안했는데 수갑 채우시는데요.""경찰은 현장에서 시민 3명을 공무집행방해 혐의로 체포해 경찰서로 데려간 뒤 8시간 넘게 조사를 벌였습니다.경찰은 오토바이 도난 사건을 수사하던 중에 범인을 착각해 벌어진 일로, 오토바이 주인이 경찰에게 위협적인 행동을 보여 진압을 할 수밖에 없었다고 해명했습니다.[최을천 을지지구대장]""권투 자세를 취하면서 결투할 태세를 보이는 등 두 사람 경찰관으로 제압이 안되는 상황에서 지원 요청을 해 제압하게 됐습니다.""경찰은 과잉 진압 여부를 가리기 위해 자체 감사에 착수했으며, 입건된 시민 3명에 대해서도 공무집행방해 혐의가 있는지 정확하게 판단하겠다고 밝혔습니다.MBC뉴스 김태윤입니다.(김태윤 기자 kktyboy@naver.com)[저작권자(c) MBC (www.imnews.com) 무단복제-재배포 금지]"
46,2015-03-24,"KTX, 운행 중에도 변압기 터져…국토부 '거짓 해명'",https://news.naver.com/main/read.nhn?mode=LSD&mid=shm&sid1=103&oid=056&aid=0010146356,KBS,"<앵커 멘트>신형 KTX에서 변압기가 세 차례나 터졌다는 사실 어제 보도해 드렸는데요.국토교통부의 해명과는 달리 최근 5년간 차량 기지뿐 아니라 운행 중인 KTX에서도 변압기가 터진 사실이 드러났습니다.정말 안전에는 문제가 없는 것일까요?보도에  박진영 기자입니다.<리포트>호남선 신형 KTX 변압기가 세 차례 터졌다는 KBS 보도에 대해, 국토교통부는 오늘 새벽  긴급 해명자료를 배포했습니다.변압기 결함은  모두 차량 기지 내 초기 기동과정에서 일어났고, 최근 5년간 실제 운행 중에는 발생하지 않았다는 설명입니다.<녹취> 국토부 산하기관 관계자 : ""기지에서 일부 결함 부분은 나타났지만  운행 중에는 그런 문제가 안 나타난 걸로  알고 있습니다.""최근 변압기 불량목록입니다.지난해 1월 14일 KTX-산천 열차가 대전 남구간에서 운행 중 변압기가 터진 것을 확인할 수 있습니다.달리던 KTX는 세천역 근처에서 멈춰서 1분 34초 뒤 운행을 재개했지만 결국, 변압기를 교체해야 했습니다.거짓 해명 논란이 일자 국토부 고위 관계자는 실무진의 착오로 운행 중 변압기 사고가 누락됐다고 해명했습니다.KTX가 달리는 중에도 변압기가 터질 수 있다는 점을 뒤늦게 인정한 겁니다.KTX에 탑재된 변압기 두 개 중 한쪽이 고장 날 경우 다른 한쪽의 전력으로 운행이 가능합니다.하지만 두 개의 변압기가 터진다면 상황은 달라질 수 있습니다.국책 철도 연구기관 관계자는 변압기 두 개가 모두 터질 경우 열차 통제가 안 될 수 있다고 경고했습니다.국토부는 산학연 공동 TF를 구성해 변압기 결함 원인을 조사하고 있습니다.호남선 KTX 개통은 이제 9일 남았습니다.KBS 뉴스 박진영입니다.[연관 기사]☞ [뉴스9] [단독] 호남선 신형 KTX 최근 변압기 3차례 터져☞ [뉴스9] 호남선 KTX 원인도 못 찾고 개통 강행…안전 우려박진영기자 (parkjy@kbs.co.kr)▶[취재후] 방송에서 못한 현장 이야기▶ KBS뉴스 SNS[트위터][페이스북][카카오][저작권자ⓒ KBS 무단복제-재배포 금지]"
47,2015-03-24,"분양가 상한제 철폐, 영향은…분양가 상승할까?",https://news.naver.com/main/read.nhn?mode=LSD&mid=shm&sid1=101&oid=214&aid=0000478032,MBC,"[뉴스데스크]◀ 앵커 ▶폭등하는 집값을 잡기 위해 지난 2007년 전면 도입했던 분양가 상한제가 다음 달부터 사라집니다.앞으로 석 달간 아파트값이 10% 넘게 오르거나 청약경쟁률이 20:1를 넘는 지역 등에 한해서만 분양가 상한제 적용을 검토하겠다는 건데, 그런데 이런 지역은 거의 없기 때문입니다.그렇다면 최근 뜨거워진 분양시장에는 어떤 영향이 있을까.김장훈 기자가 취재했습니다.◀ 리포트 ▶최근 문을 연 서울 강북의 아파트 모델하우스입니다.평균 분양가는 3.3제곱미터당 1천8백만원대.다음 달 입주를 앞둔 주변 아파트보다 1백만 원 정도 비쌉니다.[강승우/건설사 분양사무소장]""시세가 점점 오르고 있는 상황이고, (지하철)역과 연결돼 있는 단지이기 때문에..""지난달 말 기준 서울 민간아파트 평균 분양가는 3.3제곱미터당 2천67만원.1년 전에 비해 15% 넘게 올랐습니다.다음달 분양가 상한제까지 풀리면 상승세는 더 확산될 것으로 보입니다.작년 말 서울 반포동 한 아파트의 분양가는 3.3제곱미터당 평균 4천2백만 원. 분양가 상한제를 적용받지 않은 곳이었습니다.반면, 같은 시기에 분양한 대치동의 한 아파트는 분양가 상한제가 적용돼 3천2백만원이 책정됐습니다.[박합수 부동산팀장/국민은행]""청약 경쟁률이 높아지면서 그만큼 분양가에 대한 상승의 여지로 나타날 수 있는 시장 상황이라고 할 수 있습니다.""따라서 분양가는 강남 재건축을 중심으로 먼저 올라, 주변 아파트까지 전반적인 가격 상승을 주도할 가능성이 큽니다.[하태수/경기도 구리시]""가격이 오른 데 대해 부담스럽고요. 가격을 떨어뜨려주거나 지원을 많이 해주는 방향이 있으면...""때문에 주택가격 상승률이 물가상승률보다 현저하게 높다고 판단될 경우 해당지역에 한해 분양가 상한제는 다시 적용될 수 있습니다.MBC뉴스 김장훈입니다.(김장훈 기자)[저작권자(c) MBC (www.imnews.com) 무단복제-재배포 금지]"
