,날짜,기사 제목,기사 링크,기사 출처,기사 내용
0,2015-03-24,"하얗게 변한 한강 밤섬, 왜?",https://news.naver.com/main/read.nhn?mode=LSD&mid=shm&sid1=102&oid=028&aid=0002268324,한겨레,"[한겨레]서강대교 동쪽 ‘윗밤섬’ 백화현상철새 민물가마우지 흰 배설물 탓서울 여의도와 마포구 당인동을 잇는 서강대교 아래 작은 섬, 한강 밤섬이 하얗게 뒤덮였다.서울 여의도와 마포구 당인동을 잇는 서강대교 아래 작은 섬, 한강 밤섬이 하얗게 뒤덮였다. 봄철인데도 눈에 덮인 듯 버드나무 가지가 하얗게 변해 있다. 서강대교 동쪽의 ‘윗밤섬’에서 이런 백화 현상이 나타나고 있다.2011년 이후부터 겨울만 지나면 이런 현상이 나타났다. 서울시 한강사업본부 관계자는 “지금까지는 윗밤섬의 남쪽 부위에서만 백화 현상이 나타났는데, 올해는 섬 가장자리 전체가 하얗게 변했다”고 말했다.‘하얀 밤섬’이 된 것은 겨울 철새인 민물가마우지의 배설물 때문이다. 한강에 사는 붕어와 누치, 장어 등을 좋아하는 민물가마우지는 2010년에 427마리가 밤섬을 찾아 겨울을 났지만, 지난해에는 1399마리, 올해에는 1506마리가 찾아오는 등 급격하게 늘고 있다. 민물가마우지가 아예 이곳에 터를 잡아 텃새화하는 경향까지 나타나고 있다고 한강사업본부는 설명했다.민물가마우지의 흰 배설물은 버드나무 잎이 잘 자라지 못하게 방해하고, 심하면 말라죽게 만든다. 한강사업본부는 흰뺨검둥오리 등의 산란기(4~6월)에 앞서 밤섬을 찾는 조류에게 안락한 보금자리를 제공하고, 밤섬의 아름다운 경관을 유지하기 위해 25일부터 배설물 정화 작업을 한다고 24일 밝혔다. 2011년과 2012년 배설물 청소를 한 뒤 3년 만의 일이다. 버드나무에 물대포를 쏘아 씻어낸다.밤섬은 조류 77종을 비롯해 식물 46종, 어류 32종 등 다양한 생물이 서식하고 있다. 2012년 6월에는 람사르습지로 지정됐다.음성원 기자, 사진 서울시 제공공식 SNS[페이스북][트위터]|[인기화보][인기만화][핫이슈]Copyrights ⓒ 한겨레신문사, 무단전재 및 재배포 금지<한겨레는 한국온라인신문협회(www.kona.or.kr)의 디지털뉴스이용규칙에 따른 저작권을 행사합니다.>"
1,2015-03-24,"""9개월째 급수차 의존… 목욕 생각도 못해""",https://news.naver.com/main/read.nhn?mode=LSD&mid=shm&sid1=102&oid=022&aid=0002802638,세계일보,"봄가뭄 시달리는 강원 서오지리 마을 가보니“지난해 여름부터 급수차로 실어 온 식수를 먹고 있어요. 언제까지 먹는 물 걱정을 해야 하는지 답답합니다.”지난 23일 강원도 화천군 하남면 서오지리. 마을 경로당 마당에 설치된 5t 규모의 물탱크 앞에서 주민 최귀자(58·여)씨가 물통에 물을 받고 있었다. 최씨는 점심 때 식수로 쓸 물을 담는 중이라고 했다. 그는 하루 2차례 물통에다 물을 담아 간다. 집이 높은 곳에 위치해 설거지 물까지 모두 이곳에서 실어 나른다.23일 강원도 화천군 하남면 서오지리 경로당 앞 마당에 설치된 급수탱크에서 한 주민이 물통에 물을 담고 있다.화천=박연직 기자주민들은 가뭄이 시작되기 전에는 계곡물을 끌어다가 식수로 사용했다. 지난해 여름부터 이어진 가뭄 때문에 계곡물이 마르면서 식수공급이 9개월째 중단됐다. 임시방편으로 지하수를 끌어올렸지만 불소와 비소 성분이 검출되면서 식용이 불가능해 빨래나 설거지 등 허드렛물로만 사용하고 있다. 이마저도 수량이 적어 불편이 이만저만이 아니다.물 부족 현상이 1년 가까이 지속되면서 일부 주민들은 1주일에 한 번씩 빨래를 모아 춘천 등지에 살고 있는 자녀들 집에 가서 해결하고 있다. 목욕 또한 인근 지역의 목욕탕을 이용하고 있다.뭐니뭐니해도 먹는 물이 가장 큰 걱정이다. 지난해 여름부터 군에서 급수차를 이용해 물탱크에 물공급을 해주면서 식수난은 해결됐지만 매일 물을 받아 날라야 하는 불편은 계속되고 있다.영농철을 앞두고 본격 농사준비에 나선 주민들은 시간이 날 때마다 물을 실어 나르느라 이중고를 겪고 있다. 낮에 물을 담아오는 것을 깜빡한 주민들은 새벽은 물론 한밤중에도 경로당으로 물통을 들고 달려간다.무거운 물통을 운반할 힘이 없는 노인들은 2ℓ짜리 페트병에 물을 담아 가느라 하루 종일 집과 경로당을 왔다갔다하면서 ‘발품’을 팔고 있다.마을 이장 송순만(58)씨는 “마을이 70가구 정도 되는데 대부분 노인분들이어서 물 날라 먹는 것도 어려울 정도”라며 “큰 비가 내리도록 기우제라도 지내고 싶은 심정”이라고 한숨을 내쉬었다.현재 가뭄으로 식수난을 겪고 있는 지역은 인천·경기·강원의 7개 시·군·구 21개 마을이다. 춘천시 서면 덕두원리와 평창군 대화면 상안미2리 지역 등 618가구 1200여명은 운반급수를 받고 있다.지난해 마른장마와 올겨울 강설량 감소로 강원과 경기북부 등 중부지역이 극심한 가뭄에 시달리고 있다. 9일 강원도 인제군 남면 인근 소양호 상류가 가뭄의 영향으로 바닥을 드러냈다.이들 지역이 최악의 식수난을 겪고 있는 가운데 당국이 설상가상으로 이날 소양강댐과 충주댐 유역의 강우 부족으로 용수를 15%가량 줄여 공급하겠다고 밝히자 댐 주변 주민들은 더욱 죽을 맛이다.국토교통부는 일단 하천유지용수만 감축하고 생활·공업용수 및 농업용수는 정상 공급한다는 계획이다. 하지만 4월 이후 공급량은 댐 유입량과 생활·공업용수 계약량, 농업용수 계획량에 따라 변동된다. 소양강댐과 충주댐의 현재 저수율은 각각 30.6%, 28.0%로, 댐 운영 이래 3∼4번째로 낮은 상황이다.한편 오랜 가뭄으로 물부족 현상이 심화하자 강원도는 가뭄대비 강원도재난안전대책본부를 구성해 가뭄피해 최소화에 나섰다.화천·세종=박연직·나기천 기자▶향기있는 여자들의 스토리, 미즈리포트▶HOT포토▶대박 이벤트▶ 무료 만화ⓒ 세상을 보는 눈, 글로벌 미디어세계일보 & Segye.com"
2,2015-03-24,번호판 몰래 가리고꼼수 늘어가는 도로 위 난폭자들,https://news.naver.com/main/read.nhn?mode=LSD&mid=shm&sid1=102&oid=437&aid=0000072054,JTBC,"[앵커]운전자가 도로에 나서면 감시하는 눈이 참 많습니다. 구석구석에 설치된 CCTV에, 다른 차량의 블랙박스도 있죠. 그런데 감시의 눈을 피하기 위해 번호판을 가리는 운전자들의 꼼수도 그만큼 교묘해졌습니다.그 현장을 김혜미 기자가 취재했습니다.[기자]어젯밤 도로 위 차량들이 경쟁하듯 내달립니다.그런데 몇몇 택시의 번호판은 눈에 들어오지 않습니다. 번호판을 비추는 등이 꺼져있기 때문입니다.신호대기 중인 택시 뒤에서 라이트를 끄자 번호판이 어둠속으로 사라집니다.원래 자동차 번호판 등은 야간에 미등을 켜면 함께 불이 들어오게 돼 있습니다.이처럼 번호판 등을 끈 택시는 과속은 물론 난폭운전까지 서슴지 않습니다.바쁜 심야시간대 최대한 많은 손님을 태우기 위해서입니다.[택시 운전자 : 그렇게 탈법들이 있어요. 단속이나 카메라 같은 거 피하려고. 등을 꺼놓고.]일반 차량들도 이런 꼼수를 부립니다. 사고를 내고 도망간 현장이 블랙박스에 버젓이 담겨 있지만 추적할 방법이 없습니다.오늘 낮 서울 동대문종합시장입니다.길 위에 정차해 있는 차량 중 번호판을 가린 차량이 적지 않습니다.번호판 위에 종이나 테이프를 붙여 숫자 하나만을 교묘하게 가리거나 비닐로 덮었습니다.물건을 세워 가리기도 합니다.[트럭 운전자 : (사진) 찍기 때문에. 주정차위반 찍죠. 어떤 사람들은 테이프 붙이는데 그런 경우는 경찰한테 걸리면 (벌금을) 더 물어요.]단순 불법주정차나 과속 과태료는 10만원 정도입니다.하지만 이렇게 고의로 번호판을 숨기면 자동차관리법에 따라 300만원 이하 벌금이나 1년 이하 징역에 처해집니다.경찰은 심각성을 인식하지 못하고 있습니다.[교통 단속 경찰관 : 일부러 그거(번호판 등)까지 꺼놓고 다니는 그런 건 못 본 것 같은데요.]단속의 손길이 미치지 않으면서 도로 위의 꼼수는 활개를 치고 있습니다.김혜미▶ JTBC 뉴스 공식 SNS[트위터][페이스북][카카오스토리][유튜브]▶ JTBC 뉴스는 여러분의 생생한 제보를 기다립니다.Copyright by JTBC, DramaHouse & JcontentHub Co., Ltd. All Rights Reserved. 무단 전재 및 재배포 금지"
3,2015-03-24,불나자 27명 대피시킨 보육교사소방관도 놀랐다,https://news.naver.com/main/read.nhn?mode=LSD&mid=shm&sid1=102&oid=055&aid=0000309081,SBS,"<앵커>30명 가까운 아이들이 있던 어린이집에서 불이 났는데, 숨지거나 다친 아이가 단 1명도 없었습니다. 보육교사들의 침착한 대처가 돋보였습니다.UBC, 서윤덕 기자입니다.<기자>보육교사와 아이들이 놀고 있는 어린이집 교실 창문 너머로 불길이 치솟습니다.원생 27명이 있던 어린이집의 주방에서 불이 난 겁니다.어린이집은 곧바로 연기에 뒤덮였고 아직 걷지 못하는 아이들도 있었습니다.[정옥순/보육교사 : 불이 꺼졌어요. 교실 불이. 그래서 '무슨 상황인가'하고 나와봤더니 저기 주방에서 불이 나서…]하지만 밖으로 나가 상황을 확인한 보육교사가 재빨리 창문으로 아이들을 대피시킵니다.창문 밖에서는 보육교사가 놀란 아이들을 달래고, 다시 안전한 곳으로 데려갑니다.대피에 걸린 시간은 불과 1, 2분.소방관도 놀랄만 한 신속한 조치였습니다.[울산 동부소방서 관계자 : 선생님들이 아주 대피를 잘했습니다. 보통사람들이 생각하기에는 '에이 그걸 왜 누가 못해?' 하지만 실제로 화재가 나면 정말 당황스럽고…]소화기를 이용한 초기 진화도 빨라, 소방차가 도착하기 전에 불도 거의 꺼진 상태였습니다.잇단 어린이집 학대 사건에 보육교사들을 보는 시선이 곱지 않은 지금, 이들의 침착한 대처가 더 빛나는 이유입니다.(영상취재 : 주언태 UBC)UBC 서윤덕 기자☞[SBS기자들의 생생한 취재현장 뒷이야기 '취재파일']☞ SBS뉴스 공식 SNS [SBS 8News 트위터] [페이스북] [카카오스토리]저작권자 SBS&SBS콘텐츠허브 무단복제-재배포 금지"
4,2015-03-24,공중전화의 변신? 혈세 낭비 애물단지로,https://news.naver.com/main/read.nhn?mode=LSD&mid=shm&sid1=102&oid=437&aid=0000072051,JTBC,"[앵커]요즘 공중전화는 찾기도 힘들고, 찾는 사람도 거의 없습니다. 그러자 일부 지자체가 신개념 공중전화를 도입했는데, 이게 결국 세금 낭비라는 지적이 나오고 있습니다.왜 그럴까요. 밀착카메라 김관 기자가 다녀왔습니다.[기자]서울 신촌에 있는 한 공중전화 부스입니다. 불과 10년, 15년 전만 하더라도 이런 10원짜리 동전 두 개면 이런 공중전화를 약 3분 정도 쓸 수 있었습니다.그리고 전화를 쓰려는 사람들의 행렬이 쭉 길게 늘어서 있기도 했는데요.지금은 손 안의 스마트폰으로 인해서 공중전화를 쓰는 사람들은 거의 없고 그 자리는 이렇게 노점상의 좌판이 자리를 대신하고 있습니다. 그렇다면 그 많던 공중전화 부스들 지금은 어떤 모습일까요.지난 1999년, 15만3천여대에 달하던 공중전화는 이제 절반도 안 되는 7만여대만 남았습니다.그중 일부는 작은 변신을 시도했습니다.전기차 운전자와 스마트폰 이용자를 위해 충전 기능을 탑재했습니다.이쪽이 전기차 충전기고, 이쪽에는 스마트폰 충전기가 있습니다. 그런데 막상 현장에 와서 작동을 시켜 보려 했지만, 전기차 충전기는 아직까지도 계량기가 설치되어 있지 않아서 충전이 안된다고 하고요.스마트폰 충전기는 제 스마트폰을 꽂아서 충전을 해 보려고 했는데 특정 어플리케이션을 설치 해야지만 충전이 된다고 합니다.그런데 이쪽에서 설치해야 한다는 어플리케이션, 전혀 나오질 않습니다. 결국에는 양쪽에 설치된 충전기 모두 정작 제 구실을 못하고 있습니다.아예 새롭게 예산을 투입한 곳도 있습니다.최근 5, 6년 사이 정부와 지자체는 융복합 기술을 도입한 신개념 공중전화 부스를 만들기 시작했습니다.공중전화 기능과 지역정보 안내 기능을 한꺼번에 탑재한 U-스마트포스트입니다.터치스크린을 기반으로 운영이 되는데, 화면을 단번에 보더라도 뭔가 문제가 있다는게 제 눈에 보입니다. 오늘 현재 3월 22일 오후 2시쯤이 됐는데, 이 위에는 이틀 전인 3월 20일 오전 10시 18분에서 아예 시간이 멈춰 있습니다.그리고 터치스크린이기 때문에 제 손을 갖다 대면 지역검색 혹은 생활문화정보 등의 정보가 화면에 떠야 하는데, 전혀 작동을 하지 않습니다. 사실상 무용지물인 셈인데요.수십분째 지켜봤지만 터치스크린을 터치하는 사람은 아무도 없습니다.전화를 좀 사용해 보겠습니다. 전화걸기를 누르고, 번호를 눌러 보려고 해도 뭔가 문제가 있어서 설정을 다시 해야 한다는 에러 팝업창만 뜰 뿐, 전혀 신호음이 들리지 않습니다.정부의 시범 사업으로 서울 마포구에만 12개가 설치된 U-스마트 포스트.그런데 모두 찾아가본 결과, 제대로 작동하는 건 단 한 대도 없습니다.[경영인/서울 노고산동 : 제가 이 동네 살거든요. 이게 있긴 한데 정말 아무도 안 써서 왜 있나 싶기도 하고요. 말 그대로 아깝죠, 안 쓰는데…]주변 지역 정보를 얻으려는 관광객들도 당황스러워 합니다.[쇼리/일본인 관광객 : 왜 (작동이) 안 되는 겁니까?]유동인구가 많은 신촌역 앞입니다. 이곳에 있는 스마트포스트의 터치스크린 화면은 역시 광고게시판으로 전락한 모습입니다.콘서트 포스터가 이렇게 붙어 있고요. 이 아래에 있는 유리 보호판 한번 보시죠, 사선으로 금이 가서 금방이라도 깨질 것 같은 모습입니다. 안으로 들어가 보겠습니다.바깥이 광고게시판이었다면 여기는 청소도구함인 듯, 이렇게 누군가 쓰던 빗자루를 갖다가 방치해 놓았고요. 터치스크린 역시 작동하지 않은 채로 까맣게 꺼져 있습니다. 무엇보다 오랫동안 이렇게 방치가 되면서 사람의 귀와 입이 닿을 수 있는 수화기가 상당히 먼지가 많습니다.물론 이 카드리더기 부분도 만만치 않게 먼지가 많은데, 이 수화기 얼마나 더러운지 볼까요? 하얀색 장갑을 갖다대 보겠습니다. 이렇게 먼지가 까맣게 묻어 나옵니다.관할 지자체는 어쩔 수 없다는 입장입니다.[이웅기/마포구청 담당 팀장 : 실수는 저희가 사용이 안 된다고 안내문을 안 붙였고, 안내문을 계고를 안 했고요. 저희가 (부품을) 새로 갈아도 1주일이면 깨져요. 홍대 앞의 특성이 있습니다.]그나마 호평을 받는 곳도 있습니다.이렇게 어린 아이들이 자주 드나들고 있는 거리입니다. 지난해 바로 이곳에 신개념 공중전화 부스가 생겼는데 이름은 안전지대라고 되어 있습니다. 안으로 잠깐 들어가 보겠습니다.여기 달린 비상벨을 누르면 자동으로 유리문이 닫힙니다. 강화유리로 되어 있기 때문에 쉽게 깨지지 않습니다.위에 있는 비상벨과 사이렌이 울리는 걸 보고 계실 텐데요, 잠시 문을 열어 보겠습니다. 그러는 사이에 여기 달려있는 카메라가 위협을 가하고 있는 사람을 실시간으로 촬영해서 보안업체와 경찰에 전송하고 있고요, 그러면 이 안으로 들어온 시민은 전화기를 들고 112에 신고하면 됩니다.[박지수/중학생 : 의외로 누르면 소리도 크게 나고, 빨리 닫혀서 좋은 것 같아요. 애들한테도 알려주고 싶어요.]언제 없어질지 모른다는 게 문제입니다.관리 업체는 터치스크린에 지역 광고를 유치해 시설을 유지하려고 합니다.하지만 설치 이후 단 한 건도 광고가 들어오지 않자 운영에 어려움을 겪고 있습니다.불과 5년 전에 이런 신개념 공중전화 부스를 도입할 당시, 관할 지자체가 내놓았던 홍보 자료입니다. 확대해보니 당시에만 한 지자체에서 20억을 투입했다고 되어 있습니다. 정작 거리를 돌아다니는 시민들은 혈세 수십억이 쓰인 애물단지 같은 부스가 있는지조차 모르고 있습니다.결국 현실성 없는 반쪽자리 아이디어가 아니었냐 라는 지적 역시 끊이지 않고 있습니다.김관▶ JTBC 뉴스 공식 SNS[트위터][페이스북][카카오스토리][유튜브]▶ JTBC 뉴스는 여러분의 생생한 제보를 기다립니다.Copyright by JTBC, DramaHouse & JcontentHub Co., Ltd. All Rights Reserved. 무단 전재 및 재배포 금지"
5,2015-03-24,동대구~포항 35분…KTX 포항시대 '눈앞',https://news.naver.com/main/read.nhn?mode=LSD&mid=shm&sid1=103&oid=001&aid=0007483938,연합뉴스,"포항으로 가는 길    (포항=연합뉴스) 김준범 기자 = 24일 오후 대구 동구 동대구역에서 출발한 포항행 신형 KTX 열차에서 시설 점검단이 기념사진을 찍고 있다. 동해선(신경주∼포항) 신설노선은 오는 4월 2일부터 운행할 예정이다. 2015.3.24    psykims@yna.co.kr4월2일 개통 앞두고 승차 안전점검…서울∼포항 2시간 10분(대구=연합뉴스) 김선형 김준범 기자 = ""이 열차는 동대구역을 출발해 포항역으로 향하는 KTX입니다""KTX 포항시대를 앞두고 신경주∼포항간 신설노선에 대한 승차 안전점검을 위해 24일 오후 2시 28분 동대구역 9번 플랫폼에서 KTX 9111호 열차가 경북 포항으로 출발했다.진보라색 테를 두른 신형 KTX 열차는 기존 KTX·KTX산천 열차보다 소음·진동 없이 역사를 빠져 나갔다.포항으로 가는 길    (포항=연합뉴스) 김준범 기자 = 24일 오후 대구 동구 동대구역에서 출발한 포항행 신형 KTX 열차에서 시설 점검단이 기념사진을 찍고 있다. 동해선(신경주∼포항) 신설노선은 오는 4월 2일부터 운행할 예정이다. 2015.3.24    psykims@yna.co.kr300㎞에 가까운 속도로 쏜살같이 달리던 열차는 출발 15분 뒤 부산으로 갈라지는 경주 건천읍 모량신호점에서 속도를 줄였다.모량신호점에서 포항역까지 거리는 총 38.7㎞이고 최대 속도를 200㎞까지 낼 수 있다.열차는 단 한번의 정차 없이 연이은 터널을 지나 오후 3시께 포항역에 도착했다.시승에 나선 신희숙 국민행복 코레일 실천단원은 ""처음으로 운행하는 신형 열차에 탈 수 있어 영광이다""며 ""앞으로 열차를 이용해 포항에 자주 방문할 계획""이라고 말했다.신경주역∼포항역간의 공사는 2008년 시작됐고, 사업비는 1조2천126억원이 투입됐다.동대구역 들어오는 포항행 KTX    (대구=연합뉴스) 김준범 기자 = 24일 오후 대구 동구 동대구역에 포항행 신형 KTX 열차가 들어오고 있다. 동해선(신경주∼포항) 신설노선은 오는 4월 2일부터 운행할 예정이다. 2015.3.24    psykims@yna.co.kr동대구역∼포항역간 35분, 서울역∼포항역간 2시간 10분이 걸린다.포항∼서울을 오가는 KTX는 주중 왕복 16회, 주말 왕복 20회 운행한다.매일 인천국제공항까지 왕복 2회 운행하지만 포항∼동대구 구간만 별도로 다니지는 않는다.예상 이용객은 하루 3천200여명이다.오는 28일까지 영업시운전을 한 뒤 내달 2일부터 영업을 개시한다.준공 앞둔 포항역    (포항=연합뉴스) 경북 동해안 끝에서 수도권까지를 반나절 생활권으로 단축시키는 KTX 열차를 타고 내리는 포항역이 4월 개통을 앞두고 승객을 맞이할 마무리 준비에 한창이다. 2015.3.23    shlim@yna.co.krKTX 개통과 상관없이 기존 동대구∼포항간 무궁화호 열차는 계속 운행한다.신설한 KTX 포항역은 지상 3층·연면적 5천675㎡ 규모이고, 일대 역세권에는 20만㎡의 택지를 개발 중이다.푸드코트, 편의점, 수유방이 들어설 역 내부 공사는 마무리 단계에 접어들었다.역 앞에는 둥근 형태의 대형광장이 들어서 시민들을 위한 공간으로 이용될 예정이다.포항역에서 포항시청까지 승용차로 달릴 경우 약 15분이 소요된다.'포항으로 출발'    (대구=연합뉴스) 김준범 기자 = 24일 오후 대구 동구 동대구역에 포항행 신형 KTX 열차에 시설 점검단이 타고 있다. 동해선(신경주∼포항) 신설노선은 오는 4월 2일부터 운행할 예정이다. 2015.3.24    psykims@yna.co.kr포항시는 포항역을 지나는 시내버스를 증설했으며 영덕·울진 방면 시외 버스도 하루 8차례 운행한다.코레일 관계자는 ""이번 KTX 포항 개통으로 동해남부선, 영동선 등과의 수송체계가 원활해져 물류비를 절감하고 관광자원 등으로 지역개발을 촉진할 수 있을 것""이라고 기대했다.sunhyung@yna.co.kr▶연합뉴스 앱 지금 바로 다운받기~▶ [오늘의 HOT] '꽃보다 할배' 제작발표회<저작권자(c) 연합뉴스, 무단 전재-재배포 금지>"
