,날짜,기사 제목,기사 링크,기사 출처,기사 내용
149,2015-03-24,"韓, 갈등관리 능력 OECD 국가 34개국중 27위",https://news.naver.com/main/read.nhn?mode=LSD&mid=shm&sid1=102&oid=001&aid=0007482061,연합뉴스,"사회갈등 정도 조사대상 24개국 중 5번째로 높아한국보건사회연구원 보고서…""갈등 관리 잘될수록 1인당 GDP 증가""(서울=연합뉴스) 김병규 기자 = 한국의 사회적 갈등을 관리하는 능력이 경제협력개발기구(OECD) 국가 중 하위권 수준인 것으로 나타났다.24일 한국보건사회연구원의 보건복지포럼 최신호(3월호)에 발표된 '사회갈등지수 국제비교 및 경제성장에 미치는 영향'(정영호 보사연 연구위원·고숙자 보사연 부연구위원) 보고서에 따르면 2011년을 기준으로 한국의 '사회갈등관리지수'는 OECD 34개국 중 27위를 차지했다.사회갈등관리지수는 정부의 행정이나 제도가 갈등을 효과적으로 관리하는지를 나타내는 지수. 연구팀은 정부의 효과성, 규제의 질, 부패 통제, 정부소비자지출 비중 등에 대한 OECD 국가의 패널데이터를 활용해 회귀분석을 실시했다.분석 결과 사회갈등관리지수가 높은 국가는 덴마크(0.923), 스웨덴(0.866), 핀란드(0.859), 네덜란드(0.846) 등 북유럽 국가들이었다. 한국은 0.380으로 체코(0.429), 슬로베니아(0.408), 포르투갈(0.406)과 비슷한 수준이었으며, 영국(0.677), 프랑스(0.616), 일본(0.569), 미국(0.546)보다 낮았다.사회갈등관리지수가 높다는 것은 갈등을 효과적으로 관리하는 능력이 크다는 것을 뜻한다.한국보다 낮은 국가는 멕시코(0.068), 터키(0.151), 그리스(0.206), 헝가리(0.247), 이탈리아(0.281), 폴란드(0.340), 슬로바키아(0.354) 등 7개 국가뿐이었다.연구팀은 또 사회에 어떤 갈등 요인이 있는지를 따져 '사회갈등요인지수'를 산출했다.  지수 산출에는 정치(공공서비스의 정치적 비독립성, 정보접근 제한, 언론자유제한 등), 경제(소득불평등, 소득분포), 사회문화(인구 이질성, 인구구조적 스트레스) 등의 영역에서 관련 지표가 사용됐다.사회갈등요인지수가 높다는것은 갈등이 나타날 가능성이 크다는 것을 뜻하는데, 한국은 조사 대상 국가인 OECD 24개국 중 칠레, 이스라엘, 터키에 이어 4번째로 높았다.이처럼 갈등 관리 능력은 낮지만 갈등을 일으킬 요인이 큰 까닭에 실제 갈등의 크기를 나타내는 '사회갈등지수'에서 한국은 조사대상 24개국가 중 5위를 차지하는 불명예를 안았다.사회갈등지수는 '갈등요인지수'를 '갈등관리지수'로 나눠 계산한다. 한국보다  사회갈등지수가 높은 나라는 터키, 그리스, 칠레, 이탈리아 등 4곳 뿐이었다.연구팀은 2009~2011년 조사 대상 국가들의 사례를 종합해 사회갈등관리지수, 사회갈등요인지수, 사회갈등지수 등 각각의 3가지 지수와 1인당 국내총생산(GDP)의 상관관계를 따져봤다.그 결과 사회갈등관리지수가 높을수록(갈등관리 능력이 클수록), 사회갈등지수가 낮을수록(실제 갈등이 적을수록) 1인당 GDP는 증가했다. 갈등 관리를 10% 증가시킬 경우 1인당 GDP는 1.75~2.41% 늘어났다.다만 사회갈등요인지수(갈등을 일어날 가능성의 정도)와 1인당 GDP 사이에는 통계적으로 유의미한 관계는 없었다.보고서는 ""한국의 사회갈등 수준은 조사 대상 국가의 상위 20% 수준으로 높은 편""이라며 ""갈등관리가 경제성장에 긍정적인 영향을 미치는 만큼 갈등을 치유하고 관리하는 노력이 중요하다""고 강조했다.<세계 주요국가의 사회갈등관리지수·사회갈등요인지수·사회갈등지수>┌─────────┬─┬───────────┬─┬──────────┐│ 사회갈등관리지수 │  │   사회갈등요인지수   │  │    사회갈등지수    │├───┬─────┼─┼────┬──────┼─┼────┬─────┤│ 순위 │   국가   │  │  순위  │    국가    │  │  순위  │   국가   │├───┼─────┼─┼────┼──────┼─┼────┼─────┤│   1  │  덴마크  │  │   1    │    칠레    │  │   1    │   터키   │├───┼─────┼─┼────┼──────┼─┼────┼─────┤│   2  │  스웨덴  │  │   2    │  이스라엘  │  │   2    │  그리스  │├───┼─────┼─┼────┼──────┼─┼────┼─────┤│   3  │  핀란드  │  │   3    │    터키    │  │   3    │   칠레   │├───┼─────┼─┼────┼──────┼─┼────┼─────┤│   4  │ 네덜란드 │  │   4    │    한국    │  │   4    │ 이탈리아 │├───┼─────┼─┼────┼──────┼─┼────┼─────┤│  14  │  프랑스  │  │   5    │   스페인   │  │   5    │   한국   │├───┼─────┼─┼────┼──────┼─┼────┼─────┤│  18  │   일본   │  │   7    │   그리스   │  │   6    │ 포르투갈 │├───┼─────┼─┼────┼──────┼─┼────┼─────┤│  20  │   미국   │  │   8    │    영국    │  │   7    │ 이스라엘 │├───┼─────┼─┼────┼──────┼─┼────┼─────┤│  26  │ 포르투갈 │  │   9    │    미국    │  │   12   │   미국   │├───┼─────┼─┼────┼──────┼─┼────┼─────┤│  27  │   한국   │  │   10   │  이탈리아  │  │   13   │   영국   │├───┼─────┼─┼────┼──────┼─┼────┼─────┤│  28  │슬로바키아│  │   14   │   프랑스   │  │   15   │  프랑스  │├───┼─────┼─┼────┼──────┼─┼────┼─────┤│  30  │ 이탈리아 │  │   15   │   캐나다   │  │   17   │ 뉴질랜드 │├───┼─────┼─┼────┼──────┼─┼────┼─────┤│  31  │  헝가리  │  │   17   │    독일    │  │   18   │   독일   │├───┼─────┼─┼────┼──────┼─┼────┼─────┤│  32  │  그리스  │  │   22   │   덴마크   │  │   22   │  덴마크  │├───┼─────┼─┼────┼──────┼─┼────┼─────┤│  33  │   터키   │  │   23   │   핀란드   │  │   23   │  핀란드  │├───┼─────┼─┼────┼──────┼─┼────┼─────┤│  34  │  멕시코  │  │   24   │   스웨덴   │  │   24   │  스웨덴  │└───┴─────┴─┴────┴──────┴─┴────┴─────┘※ 사회갈등지수 = 사회갈등요인지수/사회갈등관리지수bkkim@yna.co.kr▶연합뉴스 앱 지금 바로 다운받기~▶ [오늘의 HOT] '개 코 이식 수술'<저작권자(c) 연합뉴스, 무단 전재-재배포 금지>"
150,2015-03-24,"경복궁, 4~10월 경회루 내부 특별관람 실시",https://news.naver.com/main/read.nhn?mode=LSD&mid=shm&sid1=103&oid=421&aid=0001328129,뉴스1,"경회루 전경. (문화재청 제공) © News126일부터 사전예약 운영…주중 3회·주말 4회, 회당 100명씩(서울=뉴스1) 박태정 기자 = 문화재청 경복궁관리소는 오는 4월 1일부터 10월 31일까지 7개월간 경복궁 경회루(국보 제224호)에 대한 특별관람을 실시한다고 24일 밝혔다.특별관람은 평소 접근이 제한되었던 경복궁 경회루에 올라 경회루의 뛰어난 건축미와 함께 수려한 주변 경관을 감상할 수 있는 기회다.경회루 특별관람은 문화재 보호와 관람질서 유지를 위해 해설사의 안내로 진행되며 경복궁 관람료 외에 추가 비용은 없다.관람 횟수는 주중 3회(오전 10시, 오후 2시·4시), 주말 4회(오전 10시·11시, 오후 2시·4시)이며 관람 소요시간은 30~40분이다. 1회당 최대 관람인원은 100명(내국인 80명·외국인 20명)이다.경회루 특별관람은 사전 예약제로 운영되며 내국인은 경복궁 누리집(www.royalpalace.go.kr)에서 1인당 최대 10명까지 예약할 수 있고 외국인은 전화(02-3700-3904, 3905)로 신청하면 된다.사전 예약은 관람 희망일 6일 전부터 1일 전까지 가능하며 첫 예약은 오는 26일부터 시작된다.문화재청 관계자는 ""경회루 특별관람을 통해 우리 문화유산의 우수성을 국내외에 널리 알리고 궁궐이 우리나라를 대표하는 문화유산 명품 브랜드로 자리매김할 것으로 기대한다""고 말했다.경회루 내부 관람 모습. (문화재청 제공) © News1ptj@[© 뉴스1코리아(news1.kr), 무단 전재 및 재배포 금지]"
151,2015-03-24,2m 도롱뇽…강력한 포식자였다,https://news.naver.com/main/read.nhn?mode=LSD&mid=shm&sid1=105&oid=277&aid=0003460694,아시아경제,"▲2m가 넘는 도롱뇽이 지구에 살았던 것으로 조사됐다.[사진제공=Joana Bruno/사이언스지]사이언스지, 관련 연구조사 결과 보도[아시아경제 정종오 기자]2m 넘는 도롱뇽2억년 전의 지구강력했던 포식자몸무게 100㎏, 길이 2m인 도롱뇽이 아주 오래 전 지구에 살았던 것으로 나타났다. 지금도 도롱뇽은 곳곳에서 볼 수 있는데 이렇게 큰 도롱뇽은 볼 수 없다.사이언스지는 23일(현지시간) '거대한 고대 도롱뇽은 인간보다 더 컸다(Giant ancient salamander was bigger than a human)'는 연구조사 결과를 게재했다. 에딘버러대학 등 공동 연구팀의 결과를 보면 고대 도롱뇽은 화장실 변기 모양의 넓은 머리를 가진 것으로 나타났다.이들 도롱뇽은 트라이아스기 후기에 살았다. 약 2억2000만~2억3000만년 전에 지구를 휘젓고 다녔던 이들  도롱뇽은 당시 양서류 중에서 가장 몸집이 컸다. 열대지방에 주로 거주하면서 가장 높은 단계의 포식자로 군림했다. 다행히 포르투갈 지역 등에는 이들 도롱뇽에 대한 화석이 잘 보관돼 있다.2m 길이와 100㎏의 거대한 몸집을 지탱하기에는 팔다리가 열악했기 때문에 이들 대부분은 수중에서 주로 생활했을 것으로 분석됐다. 물속에 있으면서 물고기나 혹은 근처에서 배회하고 있는 공룡의 조상과 다른 포유류들을 먹잇감으로 삼아 강력한 포식자로 자리 잡았을 것이라고 연구팀은 전했다.이번에 발견된 거대한 고대 도롱뇽은 공룡이 나타나기 전까지 자연계에서 가장 강력한 포식자였다고 연구팀은 덧붙였다. 연구결과는 고생물학 정보를 다루는 'Journal of Vertebrate Paleontology'에 발표됐다.정종오 기자 ikokid@asiae.co.kr▶ 진정한 부의 위대함 ""버핏에게 묻다""[루머앤진실][네티즌핫이슈][골프뉴스][부동산소식][자동차정보]<ⓒ세계를 보는 창 경제를 보는 눈, 아시아경제 무단전재 배포금지>"
152,2015-03-24,체중이 증가하는 뜻밖의 이유 5가지,https://news.naver.com/main/read.nhn?mode=LSD&mid=shm&sid1=103&oid=296&aid=0000022609,코메디닷컴,"우울증, 변비, 영양소 부족...살이 찌는 것은 당사자의 잘못된 생활방식 때문이라고 생각하는 사람이 많다. 하지만 조지타운 대학교 메디컬 센터 정신의학과의 로버트 히데이야 교수는 “실상 비만은 우리가 통제하기 어려운 요인들에 대한 신체의 반응일 수 있다”고 말한다.그는 “비만은 본인의 책임이 아니라 의사의 도움을 받아야 개선될 수 있는 상황인 경우가 있다”면서 “호르몬 불균형에서 비타민 결핍, 처방약의 부작용 등 많은 요인이 체중 증가에 작용한다”고 말했다. 미국의 폭스뉴스가 체중이 늘어나는 뜻밖의 이유 5가지와 그 대책을 소개했다.◆우울증이 있다=많은 항우울제가 체중 증가를 유발한다. 만일 당신이 우울하고 그 때문에 약을 복용하고 있다면 2.3kg~6.8kg이 늘어날 것으로 각오해야 한다. 히데이야 교수는 “몇 년에 걸쳐 차츰차츰 이정도 불어난다”고 말한다. 약을 먹지 않는다 해도 우울증 환자는 체중이 늘게 마련이라는 증거가 있다.2010년 미국 공중보건저널에 발표된 논문에 따르면 슬프고 외로운 사람들은 그렇지 않은 사람보다 체중이 빨리 증가한다. 앨라배마 대학교의 벨린다 니덤 교수는 “이런 사람들은 고지방, 고칼로리의, 마음을 편하게 만들어주는 전통음식을 더 많이 먹고 있을 가능성이 있다”고 말한다. 그는 “혹은 육체적 활동을 덜하고 있을 가능성도 있다”고 덧붙였다.노마린다 의과대학원의 도미니크 프라댕리드 교수는 “항우울제 탓에 체중이 늘어나고 있는 것으로 보이는 환자가 내게 오면 그 약을 서서히 끊으라고 말할 가능성이 있다”고 말한다. 그는 “나라면 기존 약을 끊고 체중을 줄이는 데 도움이 되는 웰뷰트린을 먹으라고 권할 가능성이 크다”고 덧붙였다. 만일 체중증가가 약 때문이 아니라면 운동을 권하고 부추기는 조언자나 동호인 지원 그룹을 찾아보는 것이 좋다.◆잘못된 처방약을 먹고 있다=체중 증가를 유발하는 약은 많고도 많다. 피임약, 호르몬 요법제, 스테로이드, 심장병과 고혈압에 먹는 베타차단제, 타목시펜 같은 유방암 약, 일부 류머티스성 관절염약, 일부 편두통 및 역류성 식도염약 등이 그런 예다.로체스타 대학교의 스티븐 위틀린 교수는 “이런 약들은 식욕을 증진시키는가 하면 신진대사에도 영향을 미친다”고 말했다. 약 때문에 체중이 느는 것이라고 의심한다면 의사가 그런 부작용이 없는 다른 약을 찾아줄 수 있다.◆소화가 느리다=변비를 포함한 소화 문제도 체중 증가의 원인이 될 수 있다. 히데이야 교수는 “이상적으로는, 음식을 먹고 난 지 한 시간 남짓 지나면 변을 보아야 한다”면서 “하지만 하루 한 두 차례 변을 보는 것까지는 건강한 범주에 속한다”고 말했다. 변을 규칙적으로 보지 못한다면 탈수, 약물, 섬유질 섭취 부족, 혹은 장내 박테리아의 생태계 이상 등이 원인일 수 있다.변비가 유일한 증상이라면 건강에 유익한 유산균이 들어있는 프로바이오틱스(생균제)를 먹으면 소화관이 제대로 작동하게 만들 수 있다. 섬유질이 많은 음식을 먹고 물을 충분히 마시는 것이 핵심이다. 메타무실 같은 식이섬유 보충제를 물에 타 먹는 것도 방법일 수 있다. 히데이야 교수는 “이런 제제는 장내 폐기물 뿐 아니라 지방 미립자를 흡수할 수도 있다”고 말했다. 그래도 해결되지 않으면 의사의 진단이 필요하다.◆특정 영양소가 부족하다=비타민D, 마그네슘, 철분 등이 부족하면 면역계가 손상된다. 또한 신체 에너지 수준이 떨어지고 신진대사 방식이 바뀐다. 그러면 건강한 생활양식을 선택하기 어려워진다. 히데이야 교수는 “이런 사람은 에너지 부족을 보충하기 위해 카페인, 단 것, 단당류를 섭취할 가능성이 커진다” 면서 “달리기나 운동을 하기에는 체력이 부족하다는 느낌을 갖게 될 수도 있다”고 말한다.대책으로는 붉은 살코기나 시금치를 먹어 철분 수준을 높이고 브라질 넛이나 아몬드를 통해 마그네슘 섭취를 늘리는 것이다. 다만 비타민D가 부족한 증상은 우유를 많이 먹거나 햇빛을 많이 쬐는 것으로는 회복이 거의 불가능하다.히데이야 교수는 “비타민D 보충제를 먹어야 하는데 복용량이 과다하면 콩팥 결석의 위험이 있”면서 “적정량을 가늠하려면 시간이 걸린다”고 말했다. 그는 “3개월마다 혈액검사를 받아야 의사가 적정량을 알아내서 처방해줄 수 있다”고 말한다.철분 보충제를 먹는 데도 약간의 주의가 필요하다. 갑상선 기능 부전증을 비롯해 인슐린 저항성을 유발할 위험이 있는 질병이 없는지를 의사가 먼저 체크해야 한다. 이것이 체중 증가의 원인일 수 있기 때문이다. 그런 뒤에 적절한 철분 보충제 섭취량을 의사가 정해줄 수 있다.◆늙어가는 중이다=이는 필연적인 현상이다. 프라댕리드 교수는 “우리는 40, 50대가 되면 20대 때만큼 칼로리를 연소하지 못한다”면서 “따라서 음식을 적게 먹고 운동을 더 많이 해야 한다”고 말했다. 이어 “체중을 장기적으로 유지하는 데는 다이어트보다 운동이 더 중요하다는 연구 결과가 있다”고 덧붙였다.프라댕리드 교수는 “살코기, 치즈, 콩 등 지방함량이 적은 단백질 식품을 먹으면 칼로리를 더 효과적으로 태울 수 있다”면서 “이에 비해 신체는 탄수화물을 더 늦게 연소하며 이를 저장하려는 경향이 있다”고 말했다. 지방이 적은 단백질을 먹고 탄수화물을 적게 먹는 것은 체중 증가를 막는 좋은 방법이다.권순일 기자  (kstt77@kormedi.com)[코메디닷컴][건강선물닷컴][코메디뉴스][이성주의 건강편지]저작권ⓒ  '건강을 위한 정직한 지식' 코메디닷컴 / 무단전재-재배포 금지"
153,2015-03-24,"특보단, 朴대통령 주재 수석비서관 회의 참석 안한다",https://news.naver.com/main/read.nhn?mode=LSD&mid=shm&sid1=100&oid=421&aid=0001328078,뉴스1,"청와대 전경. © News1별도 비공개 회의..‘3권 분립 훼손 논란’ 부담때문인 듯(서울=뉴스1) 윤태형 기자 = 청와대는 24일 중동 4개국 순방이후 처음으로 열리는 박근혜 대통령 주재 수석비서관 회의(대수비)에 대통령 특보들은 참석하지 않는다고 밝혔다.민경욱 청와대 대변인은 이날 오전 춘추관에서 특보들의 대수비 참석여부를 묻는 질문에 ""오늘 (특보단은) 참석하지 않을 것 같다""고 답했다.대신 특보단은 이날 오후 청와대에서 별도로 비공개 회의를 가질 것으로 알려졌다.특보단 회의 이후 브리핑 여부를 묻는 질문에 ""비공개 일정이기 때문에 드릴 말씀이 없고, 브리핑 여부도 확신할 수 없다""고 말했다.청와대가 특보단 회의를 비공개로 별도로 갖기로 결정한 것은 현역의원인 주호영·윤상현·김재원 정무특보들의 대수비 참석을 놓고 '3권분립 훼손' 논란 등이 제기되면서 이에 부담을 느끼고 있기 때문인 것으로 풀이된다.이날 대수비는 지난달 27일 이병기 비서실장과 정무특보단 인선 발표 이후 처음으로 열리는 회의로 상견례를 겸해 정무특보단도 참석할 것으로 예상됐었다.박 대통령은 지난 1월 26일 수석비서관 회의에서 당시 위촉됐던 신임 특보들에게 ""격주로 열리는 수석비서관회의에 가능한 참석해 국정 의견을 개진해 달라""고 당부한 바 있다. 이에 따라 이명재 민정특보, 임종인 안보특보, 신성호 홍보특보 등 3인은 대수비에 3차례 참석했다.하지만 현직의원인 주호영·윤상현·김재원 특보가 박 대통령이 주재하는 참모 회의에 참석하는 것 자체가 '3권 분립' 원칙의 훼손을 상징적으로 보여주는 장면이 될 것이라는 주장이 정치권 안팎에서 제기됐었다.독립적 헌법기관으로 행정부를 견제해야 할 국회의원이 감시의 대상인 대통령을 특별 보좌한다는 것은 민주주의의 근간인 삼권분립 정신을 훼손한다는 이유에서다.또한 현역 의원의 특보단 활동은 국회법의 '겸직불가' 규정에도 어긋난다는 논란을 낳고 있다.국회법에 따르면 현역 의원은 국무총리 및 국무위원 외 다른 직을 겸할 수 없다. 다만 공익목적의 명예직의 경우 국회의장이 국회 윤리심사자문위원회에 의견을 청취한 뒤 겸직을 허용할 수 있다.국회 윤리심사자문위원회는 정무특보들이 지난 주 정의화 국회의장에게 겸직신고서를 제출함에 따라 이번 주부터 1개월 간의 일정으로 심사에 들어갈 예정이다.한편, 이날 대수비에서는 박 대통령이 중동순방 성과 확산, 한-뉴질랜드 자유무역협정(FTA) 후속 조치, 부정부패 척결·노사대타협·공무원연금개혁 진행상황 등을 점검할 것으로 예상된다.birakoca@[© 뉴스1코리아(news1.kr), 무단 전재 및 재배포 금지]"
154,2015-03-24,"""떡잎부터… 이공계형 인재로"" 초등학생 과외",https://news.naver.com/main/read.nhn?mode=LSD&mid=shm&sid1=102&oid=005&aid=0000752517,국민일보,"컴퓨터 전공자나 배우는 것으로 여겼던 ‘코딩’이 초등학생 ‘과외 목록’에까지 등장했다. 인문계 취업난이 갈수록 심해지자 자녀를 어려서부터 이과형 인재로 키우려는 학부모가 크게 늘었다. 정부도 2018년부터 소프트웨어 과목을 초·중학교 정규교과에 포함시키려 한다.서울 서초구의 초등학교에 다니는 A군(10)은 매주 일요일 아침 동네 카페에서 한국과학기술원(KAIST) 학생에게 코딩 과외를 받는다. A군 학교는 지난해 교내 컴퓨터실에 애플의 매킨토시 컴퓨터 수십대를 설치하고 코딩 수업을 시작했다. 학교 수업에서는 미국 매사추세츠 공과대학(MIT) 미디어랩이 개발한 교육용 코딩 프로그램 ‘스크래치’를 쓴다. 이 수업을 따라가려면 과외가 필요했다. A군과 비슷한 처지의 초등학생이 많다보니 온라인에서는 “코딩 가르쳐줄 컴퓨터공학 전공자를 찾는다”는 학부모들의 글을 쉽게 찾을 수 있다.10년 전 초등학교에도 컴퓨터 교육은 있었다. 하지만 워드 프로세서 등 문서 작업을 위한 프로그램 ‘사용법’을 주로 가르쳤다. 요즘 초등학생들이 배우는 코딩은 훨씬 고차원적인 프로그램 ‘제작법’이다. C언어나 자바 등 대학교 과정에나 나왔을 컴퓨터언어를 이용해 직접 프로그램을 만든다.이런 현상은 요즘 세대의 성장 배경이 과거와 완전히 다른 데서 비롯됐다. 요즘 초등학생들은 어릴 때부터 스마트폰 태블릿PC 등 각종 전자기기에 둘러싸여 자랐다. 윗세대에 비해 컴퓨터 기술을 자연스럽게 습득하고 작동 원리를 쉽게 이해한다고 전문가들은 평가한다. 이런 세대를 가리켜 ‘테크 네이티브(Tech Native)’라는 단어까지 등장했다.코딩 교육 열풍은 세계적인 추세이기도 하다. 영국 정부는 지난해부터 모든 초·중·고교에서 코딩을 필수 교과목으로 가르치도록 했다. 김진형 미래창조과학부 소프트웨어정책연구소장은 “어린이들에게 코딩을 가르치는 건 미래사회에 대비하는 필수 단계”라며 “다른 나라에 비해 늦은 감은 있지만 지금부터라도 국가적 역량을 키워 나가야 한다”고 말했다.정부경 기자 vicky@kmib.co.krGoodNews paper ⓒ 국민일보(www.kmib.co.kr), 무단전재 및 재배포금지[뉴스 미란다 원칙] 취재원과 독자에게는 국민일보에 자유로이 접근할 권리와 반론·정정·추후 보도를 청구할 권리가 있습니다. 고충처리인(gochung@kmib.co.kr)/전화:02-781-9711"
