,날짜,기사 제목,기사 링크,기사 출처,기사 내용
96,2015-03-24,쓸쓸한 대한민국…고독사 처음으로 1000명 넘어,https://news.naver.com/main/read.nhn?mode=LSD&mid=shm&sid1=102&oid=421&aid=0001329055,뉴스1,"© News1작년 처음으로 1000명 넘어…남성이 여성 5배(세종=뉴스1) 음상준 기자 = 혼자 외롭게 죽음을 맞는 고독사가 지난해 사상 처음으로 1000명을 넘은 것으로 나타났다. 증가율은 40대 이하 젊은층이 가장 높아 고독사가 노인들에게만 나타나는 현상이 아님을 드러냈다.김춘진 국회 보건복지위원장은 보건복지부가 제출한 '2014 시도별·연령대별·성별 무연고 사망자 현황'을 분석한 결과 이같이 확인됐다고 24일 밝혔다.고독사(孤獨死)란 주로 혼자 사는 사람이 누구의 돌봄도 받지 못한 채 거주지 내에서 생활하다가 돌발적인 질병 등으로 인해 사망하는 것을 말한다.무연고 사망자는 지난해 1008명으로 집계돼 1000명을 넘어섰다. 2013년 878명에 비해 15% 증가했다. 무연고 사망자는 2011년 이후 매년 증가하는 추세다.시도별 현황은 서울 299명, 경기 197명, 인천 85명 등 수도권이 총 581명으로 전체 57.64%를 차지했다. 반면 사망자가 적은 지역은 세종 2명, 광주 5명, 울산 14명 순이었다.전년 대비 증가율이 가장 높은 지역은 전남으로 25명에서 49명으로 96%에 달했다. 경남과 제주도 각각 38명에서 58명으로 50%, 25명에서 49명으로 44% 늘었다.연령별로는 40대 이하 무연고 사망자 수가 2013년 117명에서 2014년 187명으로 59.82% 증가했다.이어 70대 153명에서 205명으로 35.95%, 60대 199명에서 247명으로 24.12%, 50대 253명에서 280명으로 10.67% 순이었다.지난해 집계된 무연고 사망자 중 65세 이상 노인계층 비율이 30%로 가장 높았다.성별로는 남성이 764명인 75.8%, 여성이 155명인 15.4%, 성별 확인 불가능 89명 8.8%로 남성이 여성보다 4.9배 가량 높은 것으로 조사됐다.김춘진 보건복지위원장은 ""무연고 사망자가 매년 늘고 있고 예상과 달리 40대 이하에서 가장 많이 증가했다""며 ""고독사 위험군에 대한 관심을 기울이고 국가 차원의 정책적 대안이 필요하다""고 지적했다.sj@[© 뉴스1코리아(news1.kr), 무단 전재 및 재배포 금지]"
97,2015-03-24,"캠핑장 발화점 ""냉장고 근처""..",https://news.naver.com/main/read.nhn?mode=LSD&mid=shm&sid1=102&oid=001&aid=0007483214,연합뉴스,"강화도 캠핑장서 불…어린이 3명 등 5명 사망 <<연합뉴스 DB>>압수물 분석 주력…펜션 인·허가 과정 집중 수사(인천=연합뉴스) 손현규 기자 = 7명의 사상자를 낸 인천 강화도 캠핑장(일명 글램핑장) 화재 사고를 수사 중인 경찰이 최초 발화지점을 텐트 내 냉장고와 텔레비전 주변으로 추정했다.경찰은 압수물 분석을 통해 펜션 측이 일부 시설물을 무단으로 증축해 건축법을 위반한 사실도 파악했다.인천 강화경찰서는 24일 브리핑을 열고 ""발화 지점은 텐트 입구 안쪽 좌측 냉장고와 텔레비전이 있던 곳으로 추정된다""고 밝혔다.조종림 강화서장은 ""전기적인 요인으로 보이고 정확한 감정을 위해 옆 텐트에 설치된 전기제품 일체를 수거해 정밀 감정 중""이라며 ""결과가 나오는 데까지 2∼3주가 걸릴 예정""이라고 말했다.'강화 캠핑장 화재' 브리핑하는 조종림 강화경찰서장    (인천=연합뉴스) 윤태현 기자 = 24일 오후 인천시 남동구 인천지방경찰청 브리핑실에서 조종림 강화경찰서장이 '강화 캠핑장 화재 사건'에 대한 수사 상황을 설명하고 있다.경찰은 주변 다른 텐트에 설치된 난방용 전기 패널, 소화기 5개, 텐트 내·외피 등을 전날 수거해 국립과학수사연구원에 비교 감식을 의뢰했다.경찰은 또 전날 펜션 압수수색을 통해 확보한 관리동 컴퓨터 하드디스크와 각종 인·허가 문서를 분석해 불법 증축된 시설물을 확인했다.펜션 측은 관리동의 샤워시설과 개수대를 증축하면서 지자체의 허가를 받지 않은 것으로 드러났다.경찰은 관리동 건물을 숙박시설로 사용한 부분에 대해서도 관련 법리를 검토하고 있다.경찰은 해당 펜션 부지의 토지 승인이나 건축 허가 과정 등을 확인하며 공무원들의 불법행위가 있었는지를 조사하고 있다. 불법성이 드러나면 강화군청 관계자도 조만간 소환해 조사할 계획이다.한편 법무부는 경찰이 전날 신청한 실소유주 유모(63)씨 등 펜션 관계자 4명에 대한 출국금지를 받아들였다.<그래픽> 강화도 캠핑장 화재 시간대별 상황    (서울=연합뉴스) 반종빈 기자 = 22일 새벽 인천시 강화군 동막해수욕장 인근 캠핑장에서 발생한 화재로 일가족을 포함해 5명이 사망하고 2명이 부상당하는 사고가 발생했다.    bjbin@yna.co.kr    페이스북 tuney.kr/LeYN1 트위터 @yonhap_graphics경찰은 조만간 유씨를 비롯해 펜션·캠핑장 임차업주 김모(52·여)씨와 관리인인 김씨 동생(46)을 피의자 신분으로 재소환해 조사할 예정이다.또 김씨와 함께 지분을 나눠 투자한 동업자인 이 펜션 법인 이사도 소환할 계획이다.조 서장은 ""수사는 화재원인, 안전시설 관리 책임, 공무원 묵인이나 방조 여부 등 3개 방향으로 진행하고 있다""고 말했다.한편 지난 22일 오전 강화도 동막해수욕장 인근 캠핑장에서 불이 나 이모(37)씨와 두 아들, 이씨의 중학교 동창 천모(36)씨와 아들 등 5명이 숨졌다.경찰조사 결과 천씨는 상체에 불이 붙은 채 텐트 밖에서 숨진 것으로 드러났다. 이씨의 둘째 아들은 옆 텐트에 있던 박모(43)씨가 구조해 2도 화상을 입었다.son@yna.co.kr▶연합뉴스 앱 지금 바로 다운받기~▶ [오늘의 HOT] '꽃보다 할배' 제작발표회<저작권자(c) 연합뉴스, 무단 전재-재배포 금지>"
98,2015-03-24,"복지사각지대 놓인 사회복지사 ""주말엔 투잡 뜁니다""",https://news.naver.com/main/read.nhn?mode=LSD&mid=shm&sid1=102&oid=277&aid=0003461067,아시아경제,"(사진 : 전국공무원노동조합)사회복지사에게 정작 '인권·복지'가 없다 <하># 서울의 한 지역아동센터에서 2년차 생활복지사로 근무하고 있는 김수지(46ㆍ여ㆍ가명)씨. 김씨는 평일 오전 11시 출근해 오후 8시까지 근무하고, 격주로 토요일 근무도 서지만 손에 쥐는 돈은 월평균 135만원 수준이다. 대학생ㆍ고등학생 자녀를 키우며 '싱글맘'으로 살아가고 있는 김씨에게 135만원은 생계를 유지하기에 턱없이 부족하다. 그런데도 다른 곳보다는 급여수준이 월등히 많은 편이라고 한다. 김씨는 생활이 어려워 격주로 쉬는 주말에는 뷔페에서 아르바이트를 12시간씩 하고 7만원을 번다.[아시아경제 유제훈 기자] 최근 우리 사회에 소외계층이 늘어나면서 복지수요가 양(量)적ㆍ질(質)적으로 빠르게 팽창하고 있다. 그러나 이같은 복지사각지대를 지키고 발굴해야 할 사회복지사들은 '저임금ㆍ고강도 노동이라는 사각지대에 놓여있는 경우가 적지 않다.민간 사회복지시설에서 근무하는 사회복지사들은 정도가 더욱 심하다. 전체 사회복지사의 85%(국가인권위원회, 2013년)가 민간 사회복시시설에 소속돼 있다. 그런데 민간 시설은 급여체계 가이드라인을 지키지 않는 경우가 적지 않다. 이에 비해 정부ㆍ지방자치단체가 직접 운영하는 극소수 기관의 경우 정부의 임금가이드 라인에 맞춰 임금을 지급하는 경우가 많은 편이다.국가인권위원회가 2013년 발표한 '사회복지사 인권상황 실태조사'에 따르면 사회복지사들의 평균 임금은 196만4000원이었다. 전체 임금노동자의 평균임금 243만원(2013년 기준)의 80%에도 미치지 못한다. 그러나 이중 협회ㆍ재단ㆍ단체 등의 위탁 운영기관에서 근무하는 사회복지사의 경우 월 평균 임금이 166만5000원으로 평균보다도 무려 30만원이나 낮은 것으로 조사됐다.김재훈 세상을바꾸는사회복지사 간사는 ""복지인프라가 갖춰져 있지 않은 상태에서 인프라를 갖춘 사회ㆍ종교단체들이 사회복지시설 운영에 나서고 있다""며 ""그런데 민간단체는 수익성 확보로 인해 임금수준이 낮아질 수밖에 없다""고 말했다.더욱이 이런 시스템은 더 열악한 처우에 내몰리는 비정규직을 양산하게 된다. 경상남도의 한 민간 사회복지시설에서 사회복지사로 근무하고 있는 박영아(28ㆍ여)씨의 사례가 대표적이다. 계약직으로 일을 시작한 그가 첫 달을 일하고 손에 쥘 수 있었던 실수령액은 90만원에 그쳤다. 박씨는 ""급여가 너무 적다보니 화장품 하나 살 돈이 없어 주말이면 아르바이트 등 투잡(Two-job)을 하는 사회복지사들이 많다""고 말했다. 또 ""아동ㆍ장애인들을 돌보다 보면 휴식시간도 전혀 없을 만큼 바쁜데, 주말 수당은 기대조차 하기 힘들다""고 털어놨다.전국에 산재한 '지역아동센터' 4000여곳 역시 숨겨진 복지 사각지대 중 하나다. 지역아동센터는 각 지역에서 부모가 일하는 동안 돌봐줄 곳이 없는 저소득층ㆍ차상위계층 어린이들을 돌보는 중요한 역할을 맡고 있는 곳으로, 1만명에 가까운 사회복지사들이 근무하고 있다. 지역아동센터 종사자의 월평균 임금은 시설장의 경우 124만3000원, 생활복지사(사회복지사 2급 상당)의 경우 113만9000원 수준에 불과했다. 실질적으로 최저임금 수준의 임금조차 보장받지 못하고 있는 셈이다.이처럼 지역아동센터가 열악한 상황에 빠져있는 것은 인건비조차 분리돼 있지 않은 비현실적 지원 때문이다. 전국지역아동센터협의회(전지협)에 따르면 저소득ㆍ차상위계층 어린이 19명 이상 30명 미만을 수용할 수 있는 표준형 지역아동센터에 교부되는 정부ㆍ지자체의 지원금은 약 432만원에 그친다. 그나마 이 지원금 중 15%는 의무적으로 교육프로그램을 마련하는데 사용해야 하기 때문에 실제 인건비 등으로 사용할 수 있는 금액은 360만원 가량에 불과하다. 공간대여료와 사무실 운영비, 식비 등 잡비용을 지출하고 나면 시설장 1명, 생활복지사 2명의 인건비를 충당하는 일조차 쉽지 않다.이 때문에 많은 지역아동센터에서는 센터장의 사비(私費)나 후원금을 통해 인건비를 간신히 맞추고 있는 것이 현실이다. 보건복지부가 올해 생활복지사들에게 권고한 임금액 147만1000원이 '공염불'에 그치고 있는 이유다.성태숙(50) 구로 파랑새나눔터지역아동센터장은 ""10년째 지역아동센터 생활복지사들의 권리보장을 위해 정부에 인건비라도 분리 지원해 달라고 요구하고 있지만 대부분의 시설이 개인 책임하에 운영되다보니 들은 체도 하지 않고 있다""며 ""이런 상황에서 정부가 '근로기준법'을 준수하라고 요구하는 것은 이중적인 것 아니냐""고 지적했다.유제훈 기자 kalamal@asiae.co.kr▶ 진정한 부의 위대함 ""버핏에게 묻다""[루머앤진실][네티즌핫이슈][골프뉴스][부동산소식][자동차정보]<ⓒ세계를 보는 창 경제를 보는 눈, 아시아경제 무단전재 배포금지>"
99,2015-03-24,코스피 6개월여만에 2040선 등정…外人 8거래일 연속 '사자',https://news.naver.com/main/read.nhn?mode=LSD&mid=shm&sid1=101&oid=015&aid=0003287681,한국경제,"[ 이민하 기자  ] 코스피지수가 외국인의 '사자'에 힘입어 반 년여 만에 2040선에서 거래를 마쳤다. 외국인은 8거래일째 순매수세를 지속했다. 코스닥도 종가 기준 최고 수준에 올랐다.24일 코스피지수는 전날보다 4.78포인트(0.23%) 오른 2041.37에 거래를 마감했다. 코스피가 2040선에서 장을 마친 것은 지난해 9월19일(종가 2053.82) 이후 6개월 만이다.이날 코스피는 2030선 약보합권에서 출발한 뒤 수급이 엇갈리면서 비슷한 수준에서 등락을 거듭했다.장 초반 '사자'세를 보이던 기관이 투신권 등을 중심으로 매도 전환했지만, 외국인은 반대로 장중 매수세로 돌아섰다.외국인은 8거래일째 연속 '사자'에 나서며 624억원 매수 우위를 보였다. 이달 들어 외국인은 지난 9일, 12일 이틀을 제외하고는 순매수세를 유지했다. 이달 중 순매수 규모는 2조7700억원이다. 개인은 389억원 순매수였다.반면 기관은 805억원 매도 우위였다. 장중 매도세로 전환한 기관은 투신권이 974억원, 금융투자가 592억원어치 주식을 순매도 했다. 그나마 연기금 등이 859억원 순매수에 나서며 전체 기관 매도 규모를 줄였다.프로그램은 2362억원 매수 우위였다. 차익 거래는 98억원, 비차익 거래가 2264억원 순매수를 기록했다.업종별로는 상승이 우세했다. 종이목재, 비금속광물이 각각 2.78%, 2.35% 상승했다. 의료정밀, 의약품, 화학, 운수창고 등도 1% 이상 뛰었다. 반면 은행과 기계, 운수장비 업종은 1% 이상 하락했다.시가총액 상위종목은 등락이 엇갈렸다. 대장주인 삼성전자는 강보합세를 보이며 147만6000원에 거래를 끝냈다. 현대차와 기아차는 각각 2.23%, 1.29% 빠졌다. 자동차 3인방 중 현대모비스만 0.20% 강보합세를 유지했다.시총 상위종목 중에는 한국전력 SK텔레콤 포스코 아모레퍼시픽 등이 상승세를 보였다.전날 불공정거래 소식에 급락했던 한미약품은 하루 만에 반등, 장 한 때 12%가량 올랐다가 차익 실현 매물에 상승폭을 되돌리며 2.73% 상승한 채로 마쳤다.호텔신라 역시 미국 면세기업 디패스 인수 소식에 4% 이상 올랐다가 차익 실현 매물에 상승폭을 상당 부분 반납했다. 1.84% 상승 마감했다.대우조선해양은 수익성 악화 우려에 2.87% 하락했다.코스닥지수도 종가 기준 최고점을 갈아치웠다. 코스닥은 전날보다 1.58포인트(0.25%) 상승한 641.87을 기록했다. 2008년 6월5일(종가 644.09) 이후 6년7개월여 만에 가장 높은 수준에서 장을 종료했다.외국인이 홀로 180억원 순매수를 보였으며 지수 상승을 이끌었다. 기관과 개인은 각각 62억원, 64억원 순매도를 나타냈다.에임하이는 화장품 사업 진출 기대감에 거래제한선(상한가)까지 치솟았다.바른손이앤에이도 신작 모바일게임을 출시 소식에 상한가로 뛰었다.서울외환시장에서 원·달러 환율은 10.00원(0.90%) 빠진 1104.60원에 장을 마쳤다.한경닷컴 이민하 기자minari@hankyung.com[한경+ 구독신청] [기사구매] [모바일앱] [기사보다 빠른 주식정보 , 슈퍼개미 APP] ⓒ '성공을 부르는 습관' 한경닷컴, 무단 전재 및 재배포 금지"
100,2015-03-24,"130개 공공기관, 스펙대신 직무능력으로 신입직원 채용",https://news.naver.com/main/read.nhn?mode=LSD&mid=shm&sid1=101&oid=366&aid=0000256082,조선비즈,"올해는 130개 기관의 서류, 면접전형만 NCS 적용내년부터 필기시험도 개편…4년뒤 전 기관에 도입300여개 공공기관 중 한국전력, 한국도로공사, 한국가스공사 등 130개 공공기관이 올해부터 국가직무능력표준(NCS)을 활용해 신입 직원을 채용한다. 획일화된 스펙(spec-각종 경력과 자격) 위주의 채용 방식에서 벗어나 직무능력을 중점적으로 평가하겠다는 취지다.2018년부터는 모든 공공기관이 NCS를 기반으로 신입 직원을 채용할 전망이다.기획재정부와 고용노동부, 교육부는 24일 130개 공공기관과 ‘직무능력중심 채용 MOU 체결식’을 갖고 이런 내용에 합의했다. 최경환 경제부총리 겸 기재부 장관은 “현재 고용시장은 천편일률적인 스펙 쌓기로 사회적 낭비가 심각한 상황”이라며 “우리 경제의 한 축을 담당하는 공공기관부터 선도적으로 채용 문화를 개선하면 우리 사회가 직무능력 중심으로 나가는데 의미 있는 기여를 할 것으로 기대한다”고 말했다.이번 협약에 참여한 130개 공공기관은 올해 서류와 면접전형에서 우선 NCS를 활용하고 NCS를 기반으로 한 필기 시험은 1년 간의 유예 기간을 거쳐 내년 하반기부터 순차적으로 시행할 계획이다.기재부 관계자는 “올해 공공기관은 총 1만7000명을 신규로 채용할 계획인데 이 중 3000명 정도가 직무중심 면접 등을 거쳐 채용될 전망”이라고 말했다.서류 전형과 면접 전형이 NCS 기반으로 바뀌면 취업 준비생은 입사 원서를 쓸 때 학력, 가족사항, 성장과정, 지원동기 등 직무 능력과 무관한 항목은 기입하지 않아도 되고 면접 시에도 직무와 관련된 질문을 주로 받게 된다.대한지적공사와 한국산업인력공단 등 일부 공공기관은 수년 전부터 NCS를 활용해 신입 직원을 채용하고 있다. 대한지적공사 관계자는 “직무능력 등을 고려하는 역량지원서를 도입한 결과 허수 지원자가 줄고 신입사원의 중도 퇴사율이 줄었다”고 말했다.대한지적공사의 서류전형 경쟁률은 기존에 170대 1 수준에서 70대 1 수준으로 줄었으나 필기시험 응시률은 오히려 30%에서 50%로 늘었다. 중도 퇴사율은 1.2% 수준에서 0%로 감소했다.한국산업인력공단은 2013년에 서류 없는 채용시스템을 도입했고 올해 필기시험 등에도 NCS를 적용했다. 공단이 필기시험(NCS 직업기초능력)에 합격한 면접시험 응시자 중 179명을 대상으로 설문조사를 한 결과 응답자의 89%가 NCS 기반 채용문화 확산에 긍정적으로 답했고 66%는 NCS 기반 면접시험이 직무내용과 연관성이 높다고 대답했다.정부는 박근혜 대통령의 중동 순방을 계기로 우리 기업의 중동 진출 가능성이 커진 가운데 한국전력공사와 한국수력원자력 등이 NCS를 기반으로 신입 직원을 채용하면 능력 있는 젊은이들의 취업 기회가 확대될 것으로 기대하고 있다.정부는 취업 준비생의 혼란을 막기 위해 필기시험을 NCS 기반으로 개편할 때 개편 내용을 시행 1년 전에 미리 공고할 계획이다. 또 취업준비 매뉴얼과 예상문제, 공공기관 채용 관련 공지내용 등을 NCS 홈페이지(ncs.go.kr)에 제공하고 3~4월 중 서울 경기권, 대전 충청권, 강원 경북권, 영남권, 호남권 등 권역별로 직무능력 중심 채용설명회를 개최할 예정이다.☞NCS(National Competency Standards)란개인이 산업현장에서 자신의 업무를 성공적으로 수행하기 위해 요구되는 직무능력을 과학적이고 체계적으로 도출해 표준화한 것.[세종=전재호 기자jeon@chosunbiz.com][세종=이종현 기자vitmania@chosun.com][조선비즈 바로가기] [위클리비즈] [페이스북] [카카오스토리]chosunbiz.com"
