,날짜,기사 제목,기사 링크,기사 출처,기사 내용
50,2009-11-21,유럽서 변종 신종플루 잇따라 출현(종합2보),https://news.naver.com/main/read.nhn?mode=LSD&mid=shm&sid1=102&oid=001&aid=0002986469,연합뉴스,"타미플루 내성 바이러스 인간 대 인간감염 가능성(AP=연합뉴스,자료사진)英.노르웨이 등..WHO, 위험성 평가 절하(런던.제네바=연합뉴스) 이성한 맹찬형 특파원 = 유럽에서 인플루엔자 A［H1N1］(신종플루) 바이러스의 변종이 발견됐다는 보고가 잇따라 각국 보건당국을 긴장시키고 있다.영국 웨일스의 한 병원에서는 항바이러스제 타미플루에 내성을 지난 변형 신종플루 바이러스의 인간 대 인간 감염 가능성이 제기됐고, 노르웨이에서는 신종플루 계열 바이러스 변종이 확인됐다.최근 우크라이나에서는 변종플루로 인해 수백명이 사망했다는 언론보도와 함께 대통령까지 나서서 국제사회의 구호를 요청, 세계보건기구(WHO)가 서둘러 진화에 나서기도 했다.영국 보건당국은 20일 ""타미플루에 내성을 지닌 신종플루 변형 바이러스의 인간 대 인간 감염 가능성에 대해 정밀 조사에 착수했다""고 밝혔다.이 변형 바이러스는 카디프의 웨일스대학병원에 입원 중인 5명의 환자에서 발견됐으며 이 가운데 2명은 회복됐고 1명은 중환자실에서, 2명은 입원 치료를 받고 있다.3명의 환자는 병원에서 감염된 것으로 추정되고 있다.이들의 감염 경로가 최종 확인될 경우 타미플루에 내성을 보이는 변형 바이러스가 인간 대 인간으로 감염된 첫 번째 사례라고 BBC는 보도했다.신종플루 치료제로 널리 쓰이는 타미플루에 내성을 보이는 변형 바이러스가 확산되면 신종플루에 대처하는데 심각한 문제를 일으킬 수 있다.또 노르웨이 보건당국은 이날 신종플루 계통 바이러스의 변종이 사망자 2명과 중증환자 1명에게서 확인됐으며, 변종이 감염자들의 증세를 악화시킨 원인이 됐을 가능성이 있다고 밝혔다.특히 노르웨이 공중보건국은 ""유전자 변이는 신종플루 바이러스가 인체 호흡기에 더 깊숙이 침투해 한층 심각한 질병을 유발하는 능력을 갖도록 하는 데 영향을 미쳤을 수 있다""고 말했다.이에 대해 WHO는 변종 바이러스가 사망 등 치명적인 상황을 유발했다는 증거는 아직 없다며 노르웨이 보건국이 제기한 위험성을 평가 절하했다.WHO는 전세계적으로 노르웨이뿐만 아니라 브라질, 중국, 일본, 멕시코, 우크라이나, 미국 등 일부 국가에서 유사한 변종 바이러스가 확인된 바 있다면서 ""변종 바이러스는 사망자에게서 나타나지만, 가벼운 증세의 환자한테도 나타난다""고 말했다.WHO는 ""수많은 사망자들이 변종이 아닌 신종플루 바이러스에 감염돼 사망했다""며 ""추가 조사가 진행 중이긴 하지만, 현재로선 변종 바이러스가 신종플루 감염과 증세 악화, 사망 등을 비정상적으로 증가시킨다는 증거는 없다""고 강조했다.다행히 노르웨이의 변종 바이러스가 현재 일반 대중 사이에서 전염되지는 않고 있다는 데는 WHO와 노르웨이 보건국이 모두 동의하고 있다.앞서 지난 15일 영국 일간 데일리 익스프레스는 신종플루보다 훨씬 치명적이고 확산 속도도 빠른 것으로 보이는 변종 바이러스가 우크라이나에서 발견돼 200명에 가까운 사망자가 발생했다고 보도했다.빅토르 유셴코 우크라이나 대통령은 TV 인터뷰에서 ""2가지의 계절성 인플루엔자와 캘리포니아 플루가 동시에 발생했다""며 이 3가지 바이러스의 조합이 훨씬 더 치명적인 새로운 변종 바이러스를 낳을 수 있다고 경고했다.그러나 WHO는 지난 17일 긴급 발표를 통해 ""우크라이나 환자들로부터 채취한 샘플에 대한 검사를 토대로 예비 실험을 실시한 결과 대유행 인플루엔자 바이러스(H1N1)에 중요한 변화가 나타나지 않았고,    현재 사용 중인 백신도 유효하다""며 논란 확산을 차단하는 데 주력했다.mangels@yna.co.kr[관련기사]▶ 英, 변형 신종플루 사람간 감염 확인중(종합)▶ WHO ""노르웨이서 신종플루 변종 확인""(종합)▶ WHO ""북반구 일부 신종플루 정점 지났다""▶ 현대重, 신종플루 확진땐 7일 유급휴가▶ 신종플루 정점 통과?…투약자 급감<뉴스의 새 시대, 연합뉴스 Live><연합뉴스폰><포토 매거진><저작권자(c)연합뉴스. 무단전재-재배포금지.>"
51,2009-11-21,"클린턴 ""北과 관계정상화, 평화협정 검토""",https://news.naver.com/main/read.nhn?mode=LSD&mid=shm&sid1=100&oid=001&aid=0002986444,연합뉴스,"힐러리 클린턴 미국 국무장관 (AP=연합뉴스, 자료사진)""보즈워스 분명한 비핵화 메시지 갖고 방북""(워싱턴=연합뉴스) 김재홍 특파원 = 힐러리 클린턴 미국 국무장관은 스티븐 보즈워스 대북정책 특별대표의 방북 메시지와 관련, 북한이 검증 가능한 방식으로 비핵화를 추진하면 북미관계 정상화와 정전협정을 대체할 평화협정 체결, 경제지원 등을 검토할 수 있다고 밝혔다.아프가니스탄을 방문 중인 클린턴 장관은 지난 19일 아프간 주재 미대사관에서 가진 미 언론과의 회견에서 ""우리는 북한이 검증 가능하고 되돌릴 수 없는 비핵화 약속을 이행한다면 북한에 큰 혜택이 있다는 분명한 메시지를 갖고 갈 것""이라고 말했다.그는 ""미국의 입장에서 그들이 수년 동안 계속 제기해온 몇 가지 문제들, 즉 관계정상화, 정전협정을 대체할 평화협정, 경제지원 등을 검토하게 될 것""이라며 ""이 모든 것에 대한 논의가 열려 있다""고 말했다.하지만, 클린턴 장관은 ""북한이 비핵화에 대한 다짐을 반드시 해야만 한다""면서 ""우리는 이를 6자회담 틀 내에서 하는 것이 중요하다고 생각한다""고 강조했다.보즈워스 특별대표는 버락 오바마 대통령의 특사자격으로 내달 8일 1박2일 일정으로 4∼5명으로 구성된 미국 대표단을 이끌고 평양을 방문할 예정이다.앞서 오바마 대통령은 이명박 대통령과 한미정상회담 후 공동기자회견에서 ""보즈워스 대표를 12월8일 북한에 보내 양자대화를 시작할 것""이라고 방북 시점을 발표했다.jaehong@yna.co.kr[관련기사]▶ 오바마, 보즈워스에 특별지침 하달""(종합)▶ <보즈워스 방북, 과거 비해 '축소형'>▶ <미.중, 6자회담 재개 시동>▶ <美 방북단 규모.일정 `협상 No' 의지 반영>▶ 보즈워스 1박2일 방북..""4∼5명 소규모 파견""<뉴스의 새 시대, 연합뉴스 Live><연합뉴스폰><포토 매거진><저작권자(c)연합뉴스. 무단전재-재배포금지.>"
52,2009-11-21,영화관 ‘팝콘’=’돼지갈비 450ｇ+아이스크림 1국자’,https://news.naver.com/main/read.nhn?mode=LSD&mid=shm&sid1=101&oid=112&aid=0002053170,헤럴드POP,"야심한 밤 스크린에 등장하는 살인마와 좀비는 잠시 잊자.영화관에서 우리를 위협하는 진짜 악당은 따로 있다. 미국 공익과학센터(CSPI)는 20일 미국 내 주요 영화관 체인점에서 판매되는 팝콘을 영양학적으로 분석한 결과 일반적인 예상을 훨씬 뛰어넘는 고열량 식품인 것으로 드러났다고 밝혔다.CSPI는 일부 체인점에서 판매중인 팝콘과 음료의 세트메뉴는 버터 12덩이를 올린 맥도날드의 ‘쿼터파운더(약 113g의 패티가 들어간 햄버거) 3개를 먹는 것과 같다고 말했다.예를 들어, 미국 최대 극장체인인 ‘리걸(Regal)’의 미디엄 사이즈 콤보세트는 1610칼로리와 60g의 포화 지방산을 함유하고 있다. 두번째로 큰 규모의 체인 AMC에서 판매 중인 라지 사이즈의 팝콘에는 1030칼로리와 57g의 포화 지방산이 들어 있으며, 이는 ‘베이비 스페어 백 립(baby spare back rib)’으로 알려진 돼지갈비 1파운드(약 453g)에 한 국자 분량의 아이스크림을 얹어 먹는 것과 같다.CSPI의 수석 영양학자 제인 헐리는 성명을 통해 “우리는 리걸과 AMC를 ‘비난 유행’이라는 영화의 최우수 조연상 후보로 지목했다”며 “콤보세트를 먹으면서 1500칼로리와 3일치 권장량에 달하는 지방을 섭취할 거라고 예상하는 사람은 없을 것”이라고비난했다.그는 이어 콤보세트를 가리켜 “포화지방 함유량은 스틱 버터 1개분에 달하고 열량은 스틱 2개와 맞먹는다”며 “(콤보세트를 먹는 이들은)사실상 고질라로 변하고 있는 것”이라 말했다.연구는 옥수수를 튀길 때 사용되는 야자유가 고열량의 원인일 수 있다며 카놀라유를 사용한 팝콘에는 포화지방산이 덜 들어 있다고 했지만, 열량과 나트륨 함유량 면에서는 둘 사이에 큰 차이가 없다고 지적했다.헤럴드 생생뉴스/online@heraldm.com[인기기사]▶임예진 “푼수연기,처음에만 어렵죠”▶이승민,19살많은 송병준대표와 열애?▶최정원, ‘시드니 인 러브’ 미공개 컷▶인순이, 30주년 마지막 콘서트 개최▶한강신도시는 중대형이 인기- 헤럴드 생생뉴스 Copyrights ⓒ 헤럴드경제 & heraldbiz.com, 무단 전재 및 재배포 금지 -"
53,2009-11-21,사이판서 총기난사..5명 사망.8명 부상(종합2보),https://news.naver.com/main/read.nhn?mode=LSD&mid=shm&sid1=100&oid=001&aid=0002986175,연합뉴스,"사이판 총기난사 사건    (서울=연합뉴스) 홍덕화 기자 = 미국령 사이판에서 20일 한국인을 포함한 다수의 관광객들에게 신원 미상의 괴한이 총기를 난사해 5명이 숨지고 8명이 부상했다.    현지 한인신문인 사이판 타임스는 연합뉴스에 ""범인은 30-40세의 동양인으로 경찰 브리핑에서 밝혀졌고, 한인 부상자 중에는 어린이 두 명이 포함돼 있다""는 내용의 기사를 보내왔다. 사진은 부상자를 옮기는 모습.  << 사이판 타임스 제공 >>. 2009.11.20    jihopark@yna.co.kr외교부 ""한국인 관광객.가이드 등 6명 부상""(서울 시드니=연합뉴스) 유현민 기자 이경욱 특파원 = 서태평양의 관광지로 유명한 미국령 사이판에서 20일 한국인을 포함한 다수의 관광객들에게 신원미상의 괴한이 총기를 난사해 모두 5명이 숨지고 8명이 부상하는 사건이 발생했다.우리 당국은 이 사고로 한국인 6명이 부상한 것으로 보고 정확한 사건경위와 피해상황을 확인 중이다.외교통상부 관계자는 연합뉴스와의 전화통화에서 ""오늘 현지시각으로 오전 11시께 사이판 시내 관광지 마르피 지역의 '만세절벽' 부근에서 신원미상의 괴한이 불특정 다수의 관광객들에게 총기 10여 발을 난사하고 도망쳤다""며 ""이로 인해 우리 관광객 5명과 한국인 가이드 1명이 중경상을 입었다""고 밝혔다.이 관계자는 이어 ""한국인 사망자는 없는 것으로 파악하고 있다""며 ""현재 부상자는 6명으로 보고 있으나 경미한 부상자는 카운트되지 않았을 수도 있어 현지 영사협력원을 통해 사상자 명단을 재확인하고 있다""고 덧붙였다.사건 직후 사이판 현지 주(洲) 보건장관은 범인을 포함해 5명이 숨지고 8명이 부상했다고 발표했다.사이판의 `만세절벽' (연합뉴스 자료사진)주 보건장관은 ""괴한은 마르피 지역에서 총기를 난사한 뒤 카나트 타블라라는 지역으로 이동해 똑같은 수법으로 범행을 저지르고 현장에서 자살했다""고 밝혔다. 카나트 타블라 지역에서는 한국인 추가 사상자가 나오지 않은 것으로 우리 당국은 보고 있다.현지 주정부 당국에 따르면 범인은 20대의 현지인인 것으로 추정되고 있다.외교부에 따르면 부상자 중 관광객 박모(39.경남 마산)씨는 등쪽에 총을 맞아 다리부분에 마비증상을 보이는 등 중상을 입었으나 생명에는 지장이 없으며 나머지 5명은 찰과상 등의 경상을 입은 것으로 알려졌다.이경구 사이판한인회 회장 겸 사이판 영사협력관은 이날 연합뉴스와 전화통화에서 ""박씨가 대장 부분에 총상을 입어 긴급수술을 받고 현재 중환자실에서 입원 치료를 받고 있다""며 ""생명에는 지장이 없지만 2~3일 정도 입원해 상태를 봐야 한다고 병원측이 말했다""고 밝혔다. 박씨는 현재 사이판 CHC병원에 입원 중이다.이 회장은 ""나머지 경상을 입은 5명의 한국인 관광객들 가운데 1명은 병원 치료를 받고 퇴원했으며 4명은 내일 중 퇴원할 예정""이라고 덧붙였다.외교부는 사건발생 직후 현지 공관인 주하갓냐 출장소의 주철완 영사를 현지로 급파해 주지사 및 경찰 당국을 상대로 정확한 범행 동기 및 사건 경위 파악에 나섰다. 또 사이판 영사협력원을 부상자가 옮겨진 병원으로 보내 사건 경위와 피해 현황을 확인 중이다.현지 경찰과 미국 연방수사국(FBI)은 아직 정확한 사건 경위 및 범행 동기를 공식 발표하지 않았다고 외교부는 전했다.<그래픽> 사이판 총기난사 사고    (서울=연합뉴스) 장성구 기자 = 20일 서태평양 노던마리아나제도 사이판섬 마르피지역에서 총기난동 사건이 발생해 한국인 5명이 부상을 입었다.    sunggu@yna.co.krhyunmin623@yna.co.kr[관련기사]▶ 사이판 총상 한국인 생명 지장없어▶ <사이판 관광지 '만세절벽'은 어떤 곳>▶ 사이판서 韓관광객 피격..6명 부상▶ ""사이판 총기난사 범인은 30∼40세 동양인""<뉴스의 새 시대, 연합뉴스 Live><연합뉴스폰><포토 매거진><저작권자(c)연합뉴스. 무단전재-재배포금지.>"
54,2009-11-21,'오프라 윈프리 쇼' 2011년 종료(종합),https://news.naver.com/main/read.nhn?mode=LSD&mid=shm&sid1=102&oid=001&aid=0002985536,연합뉴스,"'오프라 윈프리 쇼' 진행자 오프라 원프리(자료사진)(서울=연합뉴스) 토크쇼의 여왕으로 불리는 오프라 윈프리(55)가 자신의 대표적인 방송 프로그램인 `오프라 윈프리 쇼'를 2011년에 끝낼 예정이다.윈프리는 자신이 소유한 케이블 방송 출범 준비를 위해서 이런 결단을 내렸다고 뉴욕 타임스가 19일 보도했다.윈프리의 프로덕션사인 하포의 대변인은 윈프리가 20일 방영되는 자신의 프로그램에서 이런 내용을 발표할 것이라고 확인했다.'오프라 윈프리 쇼' 종료 방침은 ABC의 자회사인 WABC가 처음 보도했는데 WABC는 오는 2011년 9월 9일, 25번째 시즌이 막을 내릴 즈음 오프라 윈프리 쇼의 해가 질 것""이라고 전했다.이 프로그램은 현재 가장 잘 나가는 토크쇼로 하루 시청자가 700만 명에 이르고 있다. 이 토크쇼는 1986년 방송을 내보내기 시작한 ABC의 성공에 결정적인 기여를 했다는 평가도 받고 있다.윈프리는 앞으로 'OWN'(The Oprah Winfrey Nwtwork) 이란 이름의 케이블 채널에만 몰두한다는 계획이다. 이 채널은 오프라의 프로덕션 회사와 디스커버리 커뮤니케이션스가 합작해 만들었다.OWN은 애초 2009년 말이나 2010년 방송을 시작할 예정이었으나 경영진 교체와 광고시장의 불확실성 탓에 지연됐다.하포 측은 케이블 방송으로 '오프라 윈프리 쇼'를 옮기지 않는다고 전했지만 윈프리의 구체적인 활동 계획은 더 이상 밝히지 않았다.윈프리는 1986년 토크쇼를 시작한 뒤 20년 이상 최고 인기를 구가해왔다.최근 토크쇼 인터뷰에 등장한 인물은 전 헤비급 프로복싱 챔피언 마이크 타이슨과 에반더 홀리필드, 휘트니 휴스턴, 세라 페일린 전 알래스카 주지사 등 '거물급'이다.윈프리는 1998년 자서전 '저니 투 비러브드(Journey to beloved)'에서 ""나는 아무것도 없는 데서 출발했다""며 ""그러나 이제 매일 수백만 명에게 이야기할 수 있는 자유와 힘, 의지를 갖고 있다""고 말하기도 했다.윈프리는 지난 5월 경제전문지 포브스가 선정한 미국 흑인 중 최고 갑부(순자산 27억달러)에 꼽히는 등 재력가로도 성공했다.그는 각종 언론 발표에서 '세계에서 가장 영향력이 있는 인사'에 포함되고 있다.'오프라 윈프리 쇼'를 방송하고 있는 CBS 측은 토크쇼 종료 후에도 로스앤젤레스 스튜디오에서 새로운 쇼 프로그램을 제작하는 등 윈프리와 계속 일하기를 희망했다.CBS는 성명에서 ""우리는 윈프리를 존경하고 앞으로도 최고이기를 바란다""며 ""앞으로 몇 년뿐 아니라 그 이후에도 함께 일하기를 기대한다""고 밝혔다.윈프리의 하차는 타 방송국으로부터 고액의 수신료를 받고 있는 CBS로서는 큰 타격이 될 전망이다. CBS는 지난 1999년 '오프라 윈프리 쇼'를 제작, 공급해온 킹월드 프로덕션을 인수했다.<뉴스의 새 시대, 연합뉴스 Live><연합뉴스폰><포토 매거진><저작권자(c)연합뉴스. 무단전재-재배포금지.>"
55,2009-11-21,신종플루 정점 통과?…투약자 급감,https://news.naver.com/main/read.nhn?mode=LSD&mid=shm&sid1=140&oid=001&aid=0002986261,연합뉴스,"천막 속에서 타미플루 처방 대기(자료 사진)이달 9일 14만3천390명→18일 4만5천203명휴업학교도 11일 242곳→19일 60곳으로 감소(서울=연합뉴스) 문성규 기자 = 신종플루 감염자 증가세가 한풀 꺾여 정점을 통과한 것이 아니냐는 분석이 조심스레 나오고 있다.20일 중앙재난안전대책본부(중대본)에 따르면 타미플루 등 항바이러스제 투약 인원이 이달 9일 14만3천390명까지 치솟았다가 12일 9만474명으로 감소한 뒤 18일에는 4만5천203명으로 다시 줄었다.신종플루로 휴업한 학교도 지난달 30일 528개교에 달했으나 이달 11일 242개교, 16일 71개교, 19일 60개교로 급감한 것으로 집계됐다.중환자 수도 이달 9일 61명에 달했으나 12일 57명, 19일 46명으로 감소했다.사망자도 지난 8월15일 처음으로 발생한 이후 지난달 25~31일 주간에 24명으로 최고치를 기록하고 나서 이달 1~7일 19명, 8~14일 16명으로 감소세를 보이고 있다.표본감시의료기관 817개소의 외래환자 1천명당 인플루엔자 유사 증상자 수를 의미하는 의사환자(ILI) 분율도 10월 중순 이후 매주 100% 이상씩 증가했으나 이달에는 증가세가 둔화하고 있다.주간 증가율은 10월 18~24일 119.1%, 10월 25~31일 105.7%였으나 이달 1~7일에는 7.7%에 그쳤다.이처럼 신종플루 확산세가 멈춘 것은 지난달 28일 전국 2만여개의 약국에 50명분씩 총 100만명분의 타미플루를 푼 후 지속적으로 항바이러스제를 공급해 의심환자까지 선제적으로 항체를 형성한 데 따른 것으로 중대본은 분석했다.중대본은 신종플루 확산의 진원지 역할을 한 초ㆍ중ㆍ고교생들에 대한 백신 접종이 지난 11일부터 전국적으로 일제히 진행된 것도 확산 속도를 늦추고 있는 요인으로 풀이했다.초ㆍ중ㆍ고생들에 대한 백신 접종은 19일까지 전체대상 750만명의 22.3%가량인 167만명에 대해 이뤄졌다.아울러 단체 모임을 축소하고 개인위생을 철저히 하는 등 학습 효과가 위력을 발휘했고 바이러스 자체에 변종이 생기지 않는 등 기세를 부리지 않은 점도 신종플루 감염자를 감소시킨 주요인으로 중대본은 분석했다.중대본 관계자는 ""신종플루가 확실히 한풀 꺾이고 있는 추세""라며 ""하지만 확산 여부와 예방접종 상황 등을 시시각각 점검하면서 대응에 만전을 기하겠다""고 말했다.moonsk@yna.co.kr[관련기사]▶ 미취학아동 94만명 예방접종 예약▶ 신종플루 사망자 총 82명…증가세 둔화(종합2보)▶ '진료 빠르게'…중대본 100억 조기 집행▶ `품귀현상' 타미플루 허위처방 집중단속(종합)<뉴스의 새 시대, 연합뉴스 Live><연합뉴스폰><포토 매거진><저작권자(c)연합뉴스. 무단전재-재배포금지.>"
56,2009-11-21,오바마 '주한미군파병' 발언 논란,https://news.naver.com/main/read.nhn?mode=LSD&mid=shm&sid1=100&oid=001&aid=0002985992,연합뉴스,"美 대통령, 오산기지 연설(오산=연합뉴스) 한상균 기자 = 버락 오바마 미국 대통령이 19일 오후 오산 공군기지에서 출국 전 장병들에게 연설하고 있다. 2009.11.19    xyz@yna.co.kr""일부파병"" 발언..美측 ""재분류 언급..확대해석 말라""(서울=연합뉴스) 김귀근 기자 = 버락 오바마 미국 대통령이 지난 19일 오산기지에서 연설한 내용 가운데 일부 표현을 놓고 논란이 일고 있다.오바마 대통령은 오산 미 공군기지 635창고에 마련된 주한미군 격려행사장 연단에서 주한미군 장병들의 노고를 위로하고 한미동맹의 중요성을 강조한 내용으로 연설했다.그러나 연설 내용 가운데 ""여러분(주한미군) 중 일부는 아프간에서 근무했고, 여러분 일부는 다시 파병될 것이다""고 한 부분이 논란이 된 것이다.이는 주한미군 장병 중 일부가 아프간 등에 파병될 수도 있다는 식으로 해석될 만한 부분이기 때문이다.앞서 마이클 멀린 미국 합참의장도 지난달 22일 연합사에서 가진 미군 장병과 간담회에서 ""아시아 국가에 배치된 많은 미군 장병이 가족과 함께 장기 주둔함에 따라 앞으로 몇 년 내에 주한미군 병력을 중동으로 배치할 것인지를 논의하고 있다""고 밝혔다.하지만 주한미군 측은 오바마 대통령의 발언을 '해외 파병'으로 확대 해석해서는 안될 것이라고 강조했다.주한미군 관계자는 20일 ""오바마 대통령의 발언은 미군의 고정적인 배치 또는 분류시스템을 언급한 것""이라며 ""주한미군에서 근무를 마치면 본국으로 복귀해서 다시 다른 지역으로 분류되는 그런 시스템을 언급한 것""이라고 말했다.threek@yna.co.kr[관련기사]▶ <오바마 귀국後 숙제 산더미>▶ <李대통령-오바마 `전략동맹' 구체화>(종합)▶ 美-英, 아프간 '출구전략' 모색▶ ""美-아프간 핵심 채널은 클린턴 장관""<NYT>▶ <오바마, 한국말로 ""같이갑시다""><뉴스의 새 시대, 연합뉴스 Live><연합뉴스폰><포토 매거진><저작권자(c)연합뉴스. 무단전재-재배포금지.>"
