,날짜,기사 제목,기사 링크,기사 출처,기사 내용
35,2009-11-21,지역가입자 건보료 4천200원↑,https://news.naver.com/main/read.nhn?mode=LSD&mid=shm&sid1=100&oid=001&aid=0002986595,연합뉴스,"11월분부터 6.09% 증가(서울=연합뉴스) 김세영 기자 = 국민건강보험공단은 지역가입자의 건강보험료가 11월분부터 세대당 월평균 4천201원 높아진다고 21일 밝혔다.공단은 매년 11월 해당 연도의 재산자료와 전년도 종합소득금액에 근거해 지역가입자의 건강보험료를 새로 산정해 부과하고 있다.이에 따라 지역가입자 789만 세대 가운데 341만세대(43%)는 보험료가 증가하고 98만 세대(13%)는 하락, 350만 세대(44%)는 변동이 없는 것으로 결정됐다고 공단은 전했다.11월분 건보료는 내달 10일까지 납부하게 돼있다.전체 보험료의 증가율은 6.09%로 지난해(5.9%)보다 다소 올랐으나 2006년(6.2%), 2007년(6.1%)과 비교하면 비슷한 수준이다.지역별로는 공시지가 상승 폭이 큰 군산시(9.72%)와 인천 계양(9.78%), 주택가격 상승 폭이 큰 경기도 의정부(10.08%), 양주(9.1%) 등이 다른 지역보다 보험료 증가율이 높았다.전월 대비 보험료 증가액이 5천원 이하인 세대는 119만 세대(35%)이고 5천원 초과 2만원 이하 증가 세대는 153만 세대(45%)인 것으로 나타났다.또 전월 대비 보험료 감소액이 5천원 이하인 세대는 35만 세대, 5천원 초과 2만원 이하인 세대는 37만 세대로 집계됐다.보험료가 증가하는 세대는 전년도에 비해 높은 재산과표율을 적용받거나 재산 또는 소득이 증가한 때문이라고 공단은 분석했다.공단은 이번에 적용된 소득ㆍ재산자료와 관련해 폐업 등으로 소득이 줄었거나 재산을 매각해 보험료 감액사유가 발생한 세대는 이의신청을 제기하면 보험료를 조정받을 수 있다고 덧붙였다.thedopest@yna.co.kr[관련기사]▶ 지난해 체납보험료 3천800억원 결손처리(종합)▶ 1인당 월 건보료 7년새 두 배로▶ ""연금보험료 30만원, 건보료는 1만원?""▶ 잘못 거둔 건보료 3년간 7천억원<뉴스의 새 시대, 연합뉴스 Live><연합뉴스폰><포토 매거진><저작권자(c)연합뉴스. 무단전재-재배포금지.>"
36,2009-11-21,"돌아간다 때리고, 과속한다 또 때리고… 택시기사는 ‘동네북’",https://news.naver.com/main/read.nhn?mode=LSD&mid=shm&sid1=102&oid=021&aid=0002015979,문화일보,"‘담배 못 피우게 한다고, 과속한다고, 요금 많이 나왔다고….’택시 운전기사가 경기 불황과 실업 스트레스에 시달리는 취객들에게 갖가지 이유로 폭행을 당하는 사례가 속출하고 있다. 매일 일선 경찰서에 접수되는 택시기사 폭행사건들을 보면 마치 이들이 ‘동네북’ 취급을 당하고 있는 듯하다. 운전자 보호 장치가 미흡한 한국의 택시 실정상 택시기사에 대한 폭행은 대형 사고로도 이어질 수 있어 보다 강력한 처벌이 필요하다는 주장이 나온다.20일 오전 1시쯤 택시기사 김모(47)씨는 서울 관악구 신림역 인근에서 회식을 마치고 귀가하던 회사원 윤모(29)씨를 태우고 강남구 일원동으로 향했다. 술에 취해 잠든 것으로 보였던 윤씨는 어느새 깨어나 “왜 먼 길로 돌아가느냐”며 욕설을 하고 택시 안에 설치된 내비게이터와 요금계산기를 주먹으로 내리쳤다. 급한 마음에 김씨가 택시를 세우자 윤씨는 김씨를 폭행하기까지 했다.비슷한 시각 서울 마포구 동교동에서는 취객에게 택시기사와 승객이 동시에 폭행당하는 사건이 벌어졌다. 술이 취해 귀가하던 곽모(43)씨가 자신의 앞에 택시가 정차하자 “사고가 날 뻔했다”며 택시기사 윤모(57)씨의 뺨을 수차례 때리고 이를 말리던 승객 전모(28)씨까지 폭행했다.지난 19일에는 운행 속도가 너무 빠르다는 이유로 택시기사를 폭행한 유모(46)씨가 경찰에 불구속 입건됐다. 또 18일에는 뒷자석에 탑승한 두 명의 승객이 말싸움을 하자 이를 말리던 택시기자 안모(39)씨가 오히려 폭행을 당하기도 했고, 17일에는 택시기사 김모(40)씨가 택시 안에서 담배를 피우지 못하게 했다는 이유로 승객 안모(34)씨에게 폭행당하는 사건도 발생했다. 심지어 한 취객이 “아무 데나 갈 것이지 왜 자꾸 행선지를 묻느냐”며 택시기사를 폭행한 사례도 있었다.택시기사를 폭행하거나 난동을 부린 승객들은 대부분 폭행이나 재물손괴 등의 혐의를 받지만 택시가 이동 중인 상황에서 택시기사를 폭행했을 경우 특정범죄가중처벌법상 운전자폭행 혐의로 입건돼 엄한 처벌을 받을 수도 있다.이헌영 전국택시노조 서울본부 대책부장은 “한국의 택시는 운전석 격벽 장치 등 기사 보호 장치가 없어 술취한 승객의 폭력에 그대로 노출돼 있다”며 “택시기사들은 만취한 승객이 뒷자석에 앉아 갑자기 폭력적으로 돌변할 때를 가장 두려워 한다”며 고 말했다. 이 부장은 “한국의 택시에도 외국처럼 격벽을 설치할 필요가 있다”고 말했다.박준희기자 vinkey@munhwa.com[Copyrightⓒmunhwa.com '대한민국 오후를 여는 유일석간 문화일보' 무단 전재 및 재배포 금지(구독신청:02)3701-5555)]"
37,2009-11-21,올해 감사해야 할 일 5가지를 꼽는다면,https://news.naver.com/main/read.nhn?mode=LSD&mid=shm&sid1=104&oid=001&aid=0002986460,연합뉴스,"지난18일 자서전 사인회에 나온 세라 페일린 전 공화당 부통령후보(AFP=연합뉴스, 보도용)== FOR NEWSPAPERS, INTERNET, TELCOS & TELEVISION USE ONLY ==포린폴리시, 페일린 美부통령 안된 것 등 소개(로스앤젤레스=연합뉴스) 최재석 특파원 = 올해도 신문 지상에는 우울한 소식이 끊이지 않았다. 아프가니스탄의 혼란은 여전했고 세계의 화약고인 중동에서의 테러 공포는 가시지 않았다.그렇다고 어두운 뉴스만 있었을까. 미국의 외교전문지 포린폴리시(PF)는 20일 세계인들이 올해 감사하게 여겨야 할 일 5가지를 소개했다.△ 탄소가스 배출량 감소 = 지난 9월 국제에너지기구(IEA)는 올해 세계 탄산가스 배출량이 2.6% 감소했다고 발표했다. 이 잡지는 ""올해가 40년 만에 가장 큰 폭으로 탄산가스가 감소했으며 이는 지구에 일시적인 구원을 준 것""이라고 논평했다.IEA는 세계적인 경기침체로 산업 생산이 줄어든 것이 탄산가스 배출 감소의 주된 이유이지만 미국과 유럽, 중국에서 새 탄산가스 배출기준을 적용하고 에너지효율정책을 시행한 것도 긍정적인 영향을 미쳤다고 설명했다.△ 알 카에다 파산 직전 = 알 카에다의 3인자인 무스타파 아부 알-야지드는 지난 6월 공개한 비디오테이프를 통해 국제적으로 지하드를 감행하는 것보다 조직에 필요한 자금 모금에 더 치중하겠다는 뜻을 밝혔다. 그는 ""전쟁을 벌이는 아프간에서 많은 자금이 부족하고 이 때문에 작전을 제대로 하지 못하고 있다""고 말했다.이 잡지는 알 카에다의 자금줄을 차단하기 위한 당국의 노력이 뚜렷한 성과를 거두고 있다고 평가했다.△ 경기침체로 인한 대혼란 모면 = 경기침체가 각국의 정치불안을 가져와 극단주의 발호를 가져올 것이라는 우려가 있었으나 실제 그렇게 되지는 않았다.아이슬란드와 라트비아 등 일부 국가에서 경기침체의 영향으로 정부가 붕괴했으나 이들 국가의 민주주의 체제가 중대한 위협을 받지 않았고, 최근 유럽국가 선거에서도 중도파들이 승리했다.△ 신종플루도 정점 지나 = 최근 10년간 최악의 전염병으로 기록될 우려가 있었던 신종플루도 확산세가 주춤하고 있다. 세계보건기구(WHO)에 따르면 신종플루 사망자가 10월 마지막 주에 700명에 달했으나 11월 둘째 주에는 179명으로 줄었다.이 잡지는 신종플루 발생이 북미 지역에서는 정점을 지났고 서유럽에서도 정체상태라고 전했다.△ 페일린이 미국 부통령이 안 된 점 = 조 바이든 미국 부통령이 공식석상에서 하는 잦은 실수가 코미디언이나 블로거의 가십거리가 되고 있지만, 최근 출간된 세라 페일린 전 알래스카 주지사의 자서전을 보면 외교정책 초보자인 페일린이 미국 부통령이 안 된 것에 감사해야 한다.이 잡지는 페일린이 자서전에서 알래스카가 러시아와 가깝다는 점을 자신이 외교정책에 조예가 깊은 근거로 여전히 거론하고 있다고 지적했다.bondong@yna.co.kr[관련기사]▶ <페일린 자서전에 거센 역풍>▶ IEA ""불황에 각국 온실가스 배출량 급감""▶ WHO ""북반구 일부 신종플루 정점 지났다""<뉴스의 새 시대, 연합뉴스 Live><연합뉴스폰><포토 매거진><저작권자(c)연합뉴스. 무단전재-재배포금지.>"
38,2009-11-21,찬바람 불며 추워...대기 건조,https://news.naver.com/main/read.nhn?mode=LSD&mid=shm&sid1=103&oid=052&aid=0000274790,YTN,"현재, 전국적으로 찬바람이 강하게 불고 있습니다.이 때문에 체감온도가 실제보다 2~3도가량 더 떨어져 있고요.중부지방은 영하권을 맴돌고 있습니다.한낮에도 추운 날씨는 계속될 것으로 보입니다.또 대기가 건조하니까요, 주의하시기 바랍니다.구름 모습 보시겠습니다.현재 찬 대륙 고기압의 영향권에서 별다른 구름없이 전국적으로 맑은 하늘이 드러나 있습니다.종일 쾌청하겠는데요.다만, 바람이 강하게 불 것으로 보입니다.시설물과 건강관리 잘하시기 바랍니다.또,동해안에는 건조경보가, 영남에는 건조주의보가 발효중인데요.산불 등 화재가 발생하지 않도록 조심하셔야겠습니다.한낮기온은 어제와 비슷하겠습니다.일요일인 내일은, 대체로 맑다가 중부지방에는 낮 한때 빗방울이 떨어지는 곳이 있겠고요.기온은 오늘보다 오르겠지만 평년보다 낮아 쌀쌀하겠습니다.하지만 다음주부터는 기온이 높게 올라, 낮동안 포근하겠습니다.오늘 서해상에는 한때 비나 눈이 오겠고요.물결은 전해상에서 다소 높게 일겠습니다.날씨정보였습니다.[관련기사]▶ 미시령 옛길 이틀째 통제☞ [다운로드] 생방송과 뉴스속보를 한 눈에...YTN뉴스ON☞ YTN 긴급속보를 SMS로![저작권자(c) YTN & Digital YTN. 무단 전재-재배포 금지]"
39,2009-11-21,"美 ""北, 6자회담 복귀 암시 있었다""",https://news.naver.com/main/read.nhn?mode=LSD&mid=shm&sid1=100&oid=001&aid=0002986467,연합뉴스,"보즈워스 특별대표(왼쪽)와 성 김 북핵특사 (AP=연합뉴스, 자료사진)""성 김 특사, 보즈워스 동행할 것""(워싱턴=연합뉴스) 고승일 특파원 = 버락 오바마 미국 대통령이 스티븐 보즈워스 대북정책 특별대표를 평양에 보내 북.미 대화를 갖도록 결정한데는 북한이 6자회담에 복귀하겠다는 암시를 했기 때문인 것으로 알려졌다.미국 국무부의 고위 당국자는 20일 ""우리가 (북.미간) 만남을 갖기로 합의한 것은 `6자회담으로 돌아오겠다'는 북한의 암시가 분명히 있었기 때문""이라며 ""우리는 그런 암시를 간접적으로 전해들었다""고 밝혔다.이 당국자의 언급은 그동안 북한이 ""미국과의 양자회담 결과를 토대로 6자회담 혹은 다른 형태의 다자회담으로 돌아오겠다""고 한 입장과는 달리 이미 미국에 궁극적인 6자회담 복귀 의사를 간접적으로 전달했다는 뜻이어서 내달 8-9일 평양에서 열리는 북.미 대화의 결과가 주목된다.특히 이 같은 발언은 빌 리처드슨 뉴멕시코 주지사가 전날 CNN방송에서 ""보즈워스 대표가 방북하는 것은 아마도 `북한이 궁극적으로 6자회담에 복귀한다'는 비공식적인 양해가 이뤄졌기 때문일 수도 있다""고 한 분석과 궤를 같이 한다.그러나 이 국무부 당국자는 ""북한은 과거에도 많은 것을 말하고도 실제로는 합의를 이행하지 않은 경우가 많았기 때문에 6자회담 복귀 문제와 관련해 확실한 것은 아무 것도 없다""면서 ""문제는 북한이 `매우 변덕스럽다'는 것""이라고 말했다.한편 내달 8일로 예정된 보즈워스 대표의 방북에는 6자회담 수석대표인 성 김 북핵특사가 동행할 것이라고 국무부 당국자는 밝혔다.그는 보즈워스 대표의 방북일정은 한나절 반이라고 말하면서도 대화가 어떤 식으로 진행되느냐에 따라 일정이 변경될 수도 있다고 말했다.또 그는 ""아직까지 구체적으로 어떤 경로를 통해 보즈워스 대표가 북한에 들어가게 될지 등에 관한 계획이 확정되지 않았다""면서 ""언론의 동행취재 여부 가능성도 완전히 배제하지 않고 있다""고 말했다.ksi@yna.co.kr[관련기사]▶ 클린턴 ""北과 관계정상화, 평화협정 검토""▶ 오바마, 보즈워스에 특별지침 하달""(종합)▶ <보즈워스 방북, 과거 비해 '축소형'>▶ <美 방북단 규모.일정 `협상 No' 의지 반영>▶ 보즈워스 1박2일 방북..""4∼5명 소규모 파견""<뉴스의 새 시대, 연합뉴스 Live><연합뉴스폰><포토 매거진><저작권자(c)연합뉴스. 무단전재-재배포금지.>"
40,2009-11-21,웹브라우저 편식 한국 ‘우물 안 인터넷 강국’,https://news.naver.com/main/read.nhn?mode=LSD&mid=shm&sid1=105&oid=020&aid=0002094058,동아일보,"[동아일보]세계 누리꾼 4명 중 1명 ‘파이어폭스’ 사용하는데한국선 98%가 ‘익스플로러’… 웹 표준화 추세 못따라가세계 누리꾼 4명 가운데 1명은 ‘파이어폭스’란 웹브라우저를 쓴다. 5년 전 미국의 비영리법인 모질라재단과 세계의 자원봉사자들이 함께 만든 웹브라우저다. 시장조사업체 넷애플리케이션스에 따르면 파이어폭스의 점유율은 이달 초 25%를 넘어섰다. 2004년 11월 첫선을 보인 뒤 5년 만이다. 모질라재단에서조차 “점유율이 5%만 넘으면 다행”이라고 했던 이 제품은 5년 만에 세계 최대의 정보기술(IT) 기업인 마이크로소프트(MS)의 ‘인터넷익스플로러(IE)’에 대항하는 가장 강력한 경쟁자가 됐다.파이어폭스는 IE보다 웹페이지를 읽는 속도가 빠르고, 유튜브 동영상을 따로 저장하는 등 다양한 부가 기능이 있어 사용자들의 호평을 받고 있다. 하지만 한국에서 파이어폭스 사용자는 채 1%도 되지 않는다. 애플의 사파리, 구글 크롬과 같은 웹브라우저는 이름조차 낯설다.○ ‘우물 안 개구리’ 인터넷 강국시장조사업체 비즈스프링에 따르면 IE의 국내 시장점유율은 10월 말 현재 98.5%이다. 같은 시점 세계 시장점유율은 67.4%다. 한국에선 IE를 쓰지 않으면 인터넷뱅킹을 할 수 없고, 음악 내려받기도 불가능해 다른 웹브라우저를 쓰지 않는 것이다. 인터넷 서비스를 개발하는 업체가 IE가 아닌 다른 웹브라우저에서도 잘 작동하는 서비스를 만들면 되지만 업체들은 테스트를 여러 번 하기 번거롭다며 이를 무시했다.IE가 세계 시장을 사실상 독점했던 2000년대 초반에는 큰 문제가 없었다. 하지만 2004년 파이어폭스가 등장한 이후 해외에선 웹브라우저 경쟁이 벌어졌다. 사용자를 위한 편리한 기능을 다양하게 갖춘 웹브라우저들이 속속 등장했고, 보안 기능도 훨씬 강화됐다.한국은 이런 흐름에서 비켜 있었다. 올해 7월 있었던 ‘디도스(DDoS·분산서비스거부) 공격’은 이런 무관심을 노린 사례로 볼 수 있다. 당시 국내 약 2만 대의 컴퓨터가 컴퓨터 바이러스에 감염돼 다른 컴퓨터를 공격하는 이른바 ‘좀비 PC’로 변했다. 이때 감염경로로 지목된 것이 IE에 사용되는 ‘액티브X’라는 기술이다. 이 기술은 국내에서 전자결제 등의 프로그램을 설치하는 데 흔히 사용되기 때문에 사용자들이 컴퓨터 바이러스까지도 필요한 프로그램으로 인식해 무심결에 설치해 버리는 것이다.한국 인터넷 서비스의 해외 진출에도 어려움이 생겼다. 국내 인터넷 서비스를 해외에 수출하려면 서비스 개발 비용이 이중으로 들기 때문이다. SK커뮤니케이션즈 황용호 포털서비스개발팀장은 “국내 인터넷 서비스는 해외에 나갈 때 액티브X의 기능을 대체하기 위한 추가 개발을 하는 등 비용이 더 든다”고 말했다.○ ‘웹 표준’을 지키려는 노력해외에선 파이어폭스나 사파리처럼 액티브X를 사용하지 않는 웹브라우저 사용자가 30%가 넘으므로 액티브X 대신 모든 브라우저에서 쓸 수 있는 표준 기술을 사용한다. 이른바 ‘웹 표준’을 지키는 것이다. 웹 표준은 W3C라는 인터넷 관련 국제기구가 제시한 웹브라우저 기술 관련 가이드라인이다.최근 들어 국내 인터넷 기업들도 이런 흐름에 관심을 갖기 시작했다. NHN은 다양한 웹브라우저에서 작동하도록 ‘네이버’ 홈페이지를 개편하고, 최근에는 웹브라우저 부가기능인 ‘네이버 툴바’를 파이어폭스용으로 개발했다. 다음커뮤니케이션은 다음 메인 페이지에서 파이어폭스를 내려받도록 하고 있다. 대법원 등 공공기관 홈페이지도 웹 표준을 지키기 시작했다.NHN 이현규 선행프로젝트그룹장은 “세계적으로 브라우저 경쟁이 심화되면서 다양한 브라우저를 쓰는 사람들이 늘고 있어 앞으로도 웹 표준화에 힘쓸 예정”이라고 말했다.김상훈 기자 sanhkim@donga.com"
41,2009-11-21,‘12세’ 한나라가 역대 두번째 장수 정당?,https://news.naver.com/main/read.nhn?mode=LSD&mid=shm&sid1=100&oid=020&aid=0002094047,동아일보,"[동아일보]17년6개월 공화당 이어 2위1997년 대통령 선거때 급조잇단 패배에 차떼기당 오명도2007년 10년만에 재집권 성공“1997년 대통령 선거를 한달 앞두고 한나라당이 출범했을 때 웬만한 당직자들도 대선이 끝나면 사라질 당으로 생각했다.”한나라당 창당 12주년을 하루 앞둔 20일 한나라당 관계자는 창당 당시를 떠올리며 이같이 말했다. 1997년 신한국당 이회창 대통령 후보는 야권에서 ‘DJP(김대중+김종필) 후보단일화’가 성사되자 민주당 조순 총재와 전격 합당해 한나라당을 만들었다. 이때만 해도 한나라당의 등장은 선거 때마다 생기는 급조 정당이라는 관측이 우세했다.하지만 이 정당은 ‘차떼기당’의 오욕을 뒤집어쓰면서도 10년 만에 집권에 성공했다. 한나라당은 제3, 4공화국의 집권당이었던 민주공화당(17년 6개월)에 이어 한국 정당사에서 두 번째로 장수한 정당이 됐다.○ ‘생소한’ 당명한나라당이라는 당명은 한학에 밝은 조순 초대 총재가 지었다. 크다는 뜻과 ‘하나’라는 뜻을 가진 이름이다. 한글 이름 자체가 기존 당명과 달라 정치권에선 생소하게 비쳤다. 일부 당직자가 이 당명에 반대했으나 조 총재가 버텨 한나라당이란 이름이 태어났다고 한다. 이름이 생소한 탓에 ‘당나라당’ ‘딴나라당’이란 우스갯소리가 나돌기도 했다.한나라당의 ‘간판’을 내리자는 시도도 몇 차례 있었다. 검찰의 대선자금 수사가 한창인 2004년에 ‘차떼기당’의 부정적 이미지를 불식하기 위해 당명 개정 움직임이 본격화된 적이 있었다. 당시 박근혜 대표는 과거와 단절하고 당이 새롭게 태어나기 위한 조치로 당명 개정 카드를 꺼내들었다. 새로운 당명을 공모까지 했다. 하지만 당명 개정에 대해 “굳이 당명을 바꿔서 뭐 하느냐”는 반발이 거셌다. 결국 박 전 대표도 당명 개정 카드를 접어야 했다.○ 등 돌린 창당 주역들창당 주역인 조순, 이회창 전 총재는 차례로 당을 떠난 뒤 자신이 만든 당과 맞붙었다. 당명을 지은 조순 초대 총재는 1997년 대선에서 패배한 후 당권을 놓고 이회창 전 총재와 갈등을 빚다가 조기 퇴진했다. 2000년 총선을 앞두고 주류 측이 공천 물갈이에 나서자 탈당한 뒤 공천 탈락자들을 규합해 민주국민당을 만들어 한나라당에 도전했다. 하지만 결과는 참패였다.두 차례나 한나라당의 대선 후보로 나섰던 이회창 전 총재는 2002년 대선 패배 후 정계 은퇴를 선언했다. 하지만 그도 2007년 대선을 앞두고 정계에 복귀해 충청권을 기반으로 자유선진당을 만들어 이명박 한나라당 후보와 맞붙었지만 참패했다.○ 10년 야당 위기의 연속한나라당의 12년 역사는 영광보다는 오욕과 좌절로 이어진 세월이었다. 대선을 위해 당을 만들었지만 창당 한 달여 만에 치른 대선에서 패배했다. 김대중 정부 말기 원내 제1당으로 ‘사실상의 여당’ 행세를 하며 승리를 자신했던 2002년 대선에서도 잇달아 패배했다. 하지만 2007년 대선에서 압승하면서 10년 야당의 오랜 설움에서 벗어날 수 있었다.2002년 대선자금 수사 때 한나라당은 가장 큰 위기에 몰렸다. ‘차떼기당’이라는 오명을 쓰고 존폐의 기로에 섰다. 대선자금 수사에 곤욕을 치르던 당시 한나라당 지도부는 2004년 총선을 한 달여 앞두고 노무현 대통령에 대한 탄핵을 주도했다가 탄핵 역풍을 맞았다.한나라당은 박근혜 신임 대표를 내세워 위기를 돌파했다. 차떼기당의 이미지를 쇄신하기 위해 여의도 당사를 떠나 여의도공원 건너편 ‘천막 당사’로 옮겨야 했다.2005년엔 정당 당사 중 ‘아시아 최대 규모’라고 불렸던 10층짜리 여의도 당사를 팔았다. 대지만 39만7000m²(약 12만 평)에 이르렀던 충남 천안 연수원도 국가에 헌납했다. 사무처 당직자 퇴직금과 빚을 갚고 불법대선자금을 변제하기 위해서였다. 이런 덕분에 한나라당은 가까스로 2006년 지방선거에서 승리해 다음 해 대선 승리의 발판을 만들 수 있었다.한나라당은 그동안 몇 차례 탈당과 분당 위기 등을 겪었으나 매번 막판에 갈등을 봉합했다. 하지만 최근 세종시 문제로 당내 친이(친이명박) 친박(친박근혜)계 간 갈등이 증폭되면서 당 일각에선 “이러면 당을 깨야 하는 것 아니냐”는 우려의 목소리도 다시 흘러나온다. 한나라당이 역대 최장수 정당으로 거듭날 수 있을지 주목된다.김기현 기자 kimkihy@donga.com▼어제 창당 12주년 기념식▼한나라당은 20일 서울 여의도 당사에서 창당 12주년 기념식을 열었다. 조촐한 다과회 형식으로 진행된 이날 행사엔 정몽준 대표와 안상수 원내대표 등 주요 당직자와 박희태 전 대표, 박형준 대통령정무수석비서관, 주호영 특임장관, 오세훈 서울시장 등이 참석했다.정 대표는 기념사에서 “(지금 한나라당 앞에는) 세종시, 4대강, 지방선거 준비 등 발등에 떨어진 불만 해도 얼마나 많은가”라며 “창당 정신으로 열심히 일해야 하고, 매일매일 새로운 정당으로 태어나야 한다”고 강조했다. 안 원내대표도 “초심으로 돌아가 국민 앞에 겸손해야 한다. 앞으로도 당에서 최고 통치자를 만들어내 10년, 20년 집권하면서 우리나라를 굳건한 선진국 대열에 합류시켜야 한다”고 역설했다.박형준 정무수석은 “이명박 대통령은 ‘당에 대해 동지적 애정을 갖고 있고, 당에 대한 각별한 사랑의 마음을 전해 달라’고 했다”고 말했다. 박희태 전 대표는 “‘당화합 만사성’이다. 화합해야 난제를 풀어갈 수 있다”면서 ‘한나라당은 하나다’라는 건배사를 했다.정원수 기자 needjung@donga.com"
