,날짜,기사 제목,기사 링크,기사 출처,기사 내용
23,2018-07-29,인도네시아 롬복서 규모 6.4 강진…최소 3명 사망,https://news.naver.com/main/read.nhn?mode=LSD&mid=shm&sid1=104&oid=001&aid=0010239442,연합뉴스,"인도네시아 롬복서 규모 6.4 강진지진으로 무너진 롬복 섬의 한 주택(자카르타=연합뉴스) 황철환 특파원 = 29일 오전 인도네시아의 휴양지인 롬복 섬 북동쪽 린자니 화산 인근에서 발생한 규모 6.4의 강진으로 파괴된 주택. 2018.7.29 [인도네시아 국가재난방지청(BNPB) 트위터 캡처=연합뉴스](자카르타=연합뉴스) 황철환 특파원 = 29일(현지시간) 오전 6시 47분께 인도네시아의 휴양지인 롬복 섬 북동쪽 린자니 화산 인근에서 규모 6.4의 강진이 발생했다고 미국 지질조사국(USGS)이 밝혔다.진앙은 마타람 북동쪽 49.5㎞ 지점으로, 진원의 깊이는 7.5㎞로 추정됐다.현지 언론은 이웃 발리 섬의 중심지인 덴파사르 시내에서조차 진동이 느껴졌다고 전했다.린자니 화산 주변에선 19분 뒤인 오전 7시 6분께 규모 5.4의 지진이 발생하는 등 이후 40여분 동안 11차례의 여진이 뒤따랐다.인도네시아 국가재난방지청(BNPB)의 수토포 푸르워 누그로호 대변인은 ""건물이 여럿 무너져 일부 주민이 숨지거나 다쳤다""면서 ""정확한 피해 상황을 파악 중""이라고 전했다.현재까지 파악된 사망자는 3명이며, 이들은 섬 북동쪽에 거주하는 주민들로 알려졌다.외국인 관광객이 주로 머무는 섬 반대편에서는 아직 특별한 피해가 보고되지 않고 있다.인도네시아는 '불의 고리'로 불리는 환태평양 조산대에 있어 지진과 화산 분화가 빈번하게 발생한다.지진 발생 지점 [미국 지질조사국(USGS) 홈페이지 캡처]인도네시아 롬복서 6.4 강진…인명피해 속출hwangch@yna.co.kr▶놓치면 아쉬운 '핫뉴스'▶퀴즈풀고 상품받고! 뉴스퀴즈쇼 '뉴나'▶네이버 홈에서 [연합뉴스] 채널 구독하기"
24,2018-07-29,피서지 뒷모습,https://news.naver.com/main/read.nhn?oid=001&sid1=102&aid=0010239489&mid=shm&mode=LSD&nh=20180729123929,연합뉴스,(속초=연합뉴스) 이종건 기자 = 피서 절정기 해수욕장을 찾는 인파가 늘어나며 29일 새벽 속초해수욕장 무대 주변에 피서객들이 버린 쓰레기가 널려있다. 2018.7.29momo@yna.co.kr▶놓치면 아쉬운 '핫뉴스'▶퀴즈풀고 상품받고! 뉴스퀴즈쇼 '뉴나'▶네이버 홈에서 [연합뉴스] 채널 구독하기
25,2018-07-29,"""작년엔 비, 올핸 폭염"" 동해안 해수욕장 썰렁 상인들 '한숨'",https://news.naver.com/main/read.nhn?mode=LSD&mid=shm&sid1=103&oid=001&aid=0010239424,연합뉴스,"피서객 크게 줄어 ""백사장이 너무 뜨거워""…해 지고 나야 피서객 발길연일 기록적인 폭염으로 강원 강릉시 경포해수욕장의 낮과 밤이 대조적이다. 사진은 지난 23일 오후 폭염으로 한산한 해수욕장(위)과 22일 새벽 피서객으로 붐비는 해수욕장의 모습. [연합뉴스 자료사진](강릉=연합뉴스) 박영서 기자 = 비 한방울 내리지 않는 폭염이 연일 계속되자 강원 동해안 해수욕장을 찾는 피서객이 크게 줄어 상인들이 울상을 짓고 있다. 맑은 날을 손에 꼽을 정도로 비가 자주 내려 썰렁한 분위기를 연출했던 지난해에 이어 2년 연속 하늘만 바라보며 한숨을 내쉬는 형편이다.여름 특수를 기대했던 상인들은 ""더워서 견디기 힘든데 장사까지 되지 않는다""며 아우성이다.29일 강원도환동해본부에 따르면 지난 28일까지 동해안 93개 해수욕장을 찾은 피서객 수는 360만4천여명이었다.지난해 같은 기간 414만5천여명에 비해 13.1％(54만1천명)나 감소했다.시·군별로 살펴보면 피서객이 가장 많이 감소한 곳은 속초지역이다.지난해 103만4천여명이 찾았던 속초지역 해수욕장에는 올해 현재까지 46만8천여명만이 찾아 절반이 넘는 54.7％(56만6천여명)가 격감했다.양양도 70만7천여명에서 49만8천여명으로 29.6％(20만9천여명) 줄었고, 삼척도 49만6천명에서 46만1천명으로 7.1％(3만5천여명) 감소했다.본격적인 피서철에 접어들었음에도 해수욕장을 찾는 발길이 뜸한 이유는 꺾일 줄 모르는 폭염이 가장 큰 원인으로 꼽힌다.해수욕장 피서객 집계가 이뤄지는 오전 11시∼오후 3시에는 햇볕이 너무 뜨거워 텅텅 비고, 해가 지고 나서야 무더위를 식히러 나오는 피서객들로 붐빈다.비가 너무 많이 와서 피서객이 적었던 지난해와 대조적으로 올해는 비 한 방울 내리지 않는 폭염에 해수욕을 즐길 엄두를 내지 못하는 것이다.폭염이 기승을 부린 23일 오후 강원 강릉시 경포해수욕장이 한산하다. [연합뉴스 자료사진]해수욕장을 찾는 발길이 줄면서 식당이나 숙박업소를 운영하는 상인들은 그야말로 '죽을 맛'이다.강릉에서 호텔을 운영하는 손정호(70)씨는 ""말도 못할 정도로 손님이 없다. 이렇게 더운데 누가 오겠느냐""며 ""동해안 상인들은 사정이 비슷하다""고 하소연했다.속초에서 회를 파는 한 상인도 ""이맘때면 관광객들 차가 많이 들어오는데 어제도 낮에 반짝 들어오다 말더라""며 ""지금부터 여름 장사 시즌인데 올해도 손님이 너무 없어 걱정""이라고 말했다.지난해 동해안 해수욕장은 개장 기간 43일 동안 29일이나 비가 내렸다.3일 중 2일은 비가 내렸을 정도로 비가 온 날이 많았다.폐장일까지 비가 내리는 궂은 날씨 탓에 사람이 없어 썰렁하게 폐장해야 했다.2013년 2천567만명, 2014년 2천430만명, 2015년 2천579만명, 2016년 2천477만명 등 매년 2천500만명 안팎을 유지했던 피서객 수는 지난해 2천244만 명으로 크게 줄었다.도환동해본부는 서울양양고속도로와 KTX 개통으로 교통편이 크게 개선된 점을 고려해 올해 피서객 유치 목표를 지난해와 같은 2천500만 명으로 잡았다.하지만 캠핑이나 해외여행 선호도가 높아지는 등 휴가 트렌드 변화에 지금과 같은 폭염까지 이어진다면 목표 달성은 어려울 것으로 보인다.도환동해본부 관계자는 ""폭염 때문에 최근 피서객이 조금 주춤하지만, 비가 자주 내려 상황이 매우 나빴던 지난해보다는 전반적으로 나아질 것""이라고 내다봤다.conanys@yna.co.kr▶놓치면 아쉬운 '핫뉴스'▶퀴즈풀고 상품받고! 뉴스퀴즈쇼 '뉴나'▶네이버 홈에서 [연합뉴스] 채널 구독하기"
26,2018-07-29,북한 '깜짝 조치'…주중대사관에 문재인ㆍ트럼프 사진 내걸어,https://news.naver.com/main/read.nhn?mode=LSD&mid=shm&sid1=100&oid=001&aid=0010239395,연합뉴스,"주중 북한대사관 ""트럼프와 첫 악수ㆍ친교 두터이 해"" 등 북미 관계 강조문재인 대통령과 4ㆍ5월 회동 사진 모두 소개…러시아 사진도 게재북한, 주중대사관에 문재인, 트럼프 사진 내걸어(베이징=연합뉴스) 심재훈 특파원(베이징=연합뉴스) 심재훈 특파원 = 북한이 정전 협정 65주년을 즈음해 주중 북한대사관에 문재인 대통령과 도널드 트럼프 미국 대통령의 사진을 외부 게시판에 대문짝만하게 내걸어 주목을 받고 있다.주중 북한대사관 게시판은 외부에 북한 체제를 선전하는 유일한 공개의 장으로 한국과 미국 최고 지도자 사진이 게시된 것은 이번이 처음이다.29일 오전 베이징(北京) 차오양구(朝陽區) 북한대사관 정문 바로 옆에 있는 대형 게시판에는 지난 3월 김정은 북한 국무위원장과 시진핑(習近平) 중국 국가 주석의 베이징 정상회담 장면으로 도배하던 사진들이 사라지고 김정은 위원장이 문재인 대통령, 시진핑 주석, 도널드 트럼프 미국 대통령과 각각 만난 사진들로 전격 교체했다.이 게시판 왼쪽의 김정은 위원장과 문재인 대통령의 사진은 지난 4월 판문점 정상회담 당시 공동 성명에 서명하는 장면과 더불어 산책하는 장면, 부부 동반 기념사진이 게재됐으며 지난 5월 북측 통일각에서 전격적으로 열렸던 남북 정상회담 장면도 걸렸다.북한, 주중대사관에 문재인, 트럼프 사진 내걸어(베이징=연합뉴스) 심재훈 특파원아울러 김정은 위원장이 트럼프 대통령과 첫 악수를 하는 사진이 이 게시판 오른쪽 맨 위에 걸렸으며 단독 회담하는 장면, 북미 공동 성명 서명 장면, 산책하는 장면이 담겼다.주중 북한대사관은 트럼프 대통령과 산책하는 사진에 ""트럼프 대통령과 산책을 하며 친교를 두터이 하는 김정은 동지""라며 각별한 의미를 부여하기도 했다.김정은 위원장과 시 주석의 지난 3월, 5월, 6월의 세 차례 정상회담 사진은 게시판의 가운데를 차지했다.아울러 6자 회담 당사국 중의 하나인 러시아를 고려해 세르게이 라브로프 러시아 외무장관이 김정은 위원장을 예방한 사진도 게재했으며, 한반도 긴장 완화에 역할을 한 토마스 바흐 국제올림픽위원회(IOC) 위원장과 회동 사진도 포함됐다.이 게시판은 지난해까지만 해도 '광명성 4호 위성'과 잠수함 발사 탄도미사일(SLBM) 수중 시험 발사 등 각종 무기 사진이 도배돼 북한의 무력을 뽐내왔으나 평창 동계올림픽을 계기로 남북, 북미 대화 분위기가 무르익자 지난 4월 말 북중 정상회담 사진으로 바꾼 바 있다.북한, 주중대사관에 문재인, 트럼프 사진 내걸어(베이징=연합뉴스) 심재훈 특파원주목할 점은 김정은 북한 위원장이 지난달 20일 방중 당시 북한대사관을 찾았을 때도 이 게시판의 사진은 지난 3월 북중 정상회담 사진만 걸려있었다는 점이다. 김 위원장의 방문 시점이 싱가포르 북미 정상회담과 남북 정상회담 등이 모두 끝난 상황인데도 관련 사진을 내걸지 않았었다.이를 두고 일각에서는 최근 북한 비핵화를 두고 속도를 내지 못하고 있다는 대내외 비판 속에 북한이 북중, 남북, 북미 최고 지도자 간의 우호 관계를 강화하는 사진을 내걸어 북한이 나름대로 노력하고 있음을 보여주려는 것으로 보고 있다.베이징 소식통은 ""김정은 위원장이 북한대사관을 방문했을 때까지도 문재인 대통령과 트럼프 대통령의 사진을 그 어디에서도 찾아보기 어려웠다""면서 ""정전선언 65주년을 맞아 이들 지도자 사진이 갑자기 등장한 것은 정전 협정을 종전 선언으로 바꾸고 대북 제재 등 고립에서 빠져나오고자 하는 북한의 의도가 담겨있을 수도 있다""고 말했다.북한, 주중대사관에 문재인, 트럼프 사진 내걸어president21@yna.co.kr▶놓치면 아쉬운 '핫뉴스'▶퀴즈풀고 상품받고! 뉴스퀴즈쇼 '뉴나'▶네이버 홈에서 [연합뉴스] 채널 구독하기"
27,2018-07-29,라오스 수재민 돕기 한국정부 첫 구호품 현지 도착,https://news.naver.com/main/read.nhn?mode=LSD&mid=shm&sid1=104&oid=001&aid=0010239308,연합뉴스,"(참파삭[라오스]=연합뉴스) 민영규 특파원 = 지난 23일 라오스 남부 아타프 주에서 발생한 수력발전소 보조댐 사고로 홍수 피해를 본 이재민을 돕기 위한 한국 정부의 구호품이 28일 처음으로 현지에 도착했다.사고 발생 5일 만인 이날 오후 6시(이하 현지시간)께 아타프 주와 가장 가까운 참파삭 주 팍세공항에 우리나라 군 수송기가 도착했다.한국정부 첫 구호품 실은 군 수송기 라오스 도착담요 1천200여 장과 대한적십자사의 위생 키트 200여 점, 댐 시공사인 SK건설의 의류 등을 가득 실은 군용기는 이날 오전 8시 서울공항을 출발해 필리핀을 경유한 뒤 라오스로 들어왔다.이번 수송 작전을 지휘한 이유겸 대령은 ""연료 보급차 필리핀을 경유, 약 9시간의 비행 끝에 도착했다""면서 ""정부 차원에서 어려움에 부닥친 국가를 돕는 데 한몫했다는 것을 자랑스럽게 생각한다""고 말했다.한국정부 첫 구호품 라오스 현지 도착구호품은 29일 오후 2시 아타프 주 청사에서 신성순 주 라오스 대사와 렛 사이아폰 아타프주지사 등이 참석한 가운데 현지 재난 당국에 전달된다.우리 정부는 또 29일 의료인력 15명, 지원인력 5명으로 구성한 '대한민국 긴급구호대'(KDRT)를 현지로 파견할 계획이다.이날 오후 5시께 구호대와 함께 의료기기 등을 실은 군 수송기 2대가 팍세 공항에 내릴 것으로 알려졌다.구호대는 30일 수해현장으로 이동, 본격 구호활동에 나설 예정이다.이에 대해 라오스 참파삭 주 대외협력 부국장은 ""한국 정부가 이렇게 물품을 전달해준 데 대해 정말 감사하다""고 말했다.youngkyu@yna.co.kr▶놓치면 아쉬운 '핫뉴스'▶퀴즈풀고 상품받고! 뉴스퀴즈쇼 '뉴나'▶네이버 홈에서 [연합뉴스] 채널 구독하기"
28,2018-07-29,태풍 종다리 일본 상륙…항공기 결항·정전 피해 속출,https://news.naver.com/main/read.nhn?mode=LSD&mid=shm&sid1=104&oid=001&aid=0010239378,연합뉴스,"태풍 '종다리' 日상륙…항공기 결항·정전 피해 속출(나라<일본> AFP=연합뉴스) 제12호 태풍 종다리가 29일 새벽 일본 서남부 미에(三重)현 이세(伊勢)시에 상륙하면서 정전과 항공기 결항 등 피해가 잇따르고 있다.사진은 이날 중부 나라(奈良)에서 태풍 종다리의 강풍에 주택이 무너진 모습.bulls@yna.co.kr(도쿄=연합뉴스) 최이락 특파원 = 제12호 태풍 종다리가 29일 새벽 일본 서남부 미에(三重)현 이세(伊勢)시에 상륙하면서 정전과 항공기 결항 등 피해가 잇따르고 있다.일본 기상청에 따르면 태풍은 이날 오전 6시 현재 시속 35㎞의 속도로 서쪽으로 진행하고 있어서, 이날부터 30일까지 일본 서남부 지역에는 많은 양의 비가 예상된다.이 태풍은 중심 기압 980h㎩(헥토파스칼), 중심 부근 최대풍속(초속) 30ｍ, 최대 순간풍속 초속 40ｍ로 세력이 다소 약화됐지만 중심에서 반경 70㎞ 이내에서는 풍속 25ｍ 이상의 강풍이 불고 있다.기상청은 토사유출이나 하천 범람 등에 따른 피해가 우려되는 만큼 저지대 등 침수 우려 지역 주민들을 상대로 신속한 대피를 당부했다.무너져 내린 버스 정류장(미에 교도=연합뉴스) 일본 미에(三重)현 쓰(津)시에 있는 한 버스정류장 건물이 29일 새벽 상륙한 제12호 태풍 종다리의 영향으로 무너져내렸다. 2018.7.29    choinal@yna.co.kr태풍으로 인해 하네다(羽田), 나리타(成田)공항을 중심으로 28일 300편 이상의 항공기 운항이 중단됐다. 지연 운항된 항공편도 4만2천여편에 달했다.신칸센(新幹線) 등 철도편도 운행 중단이나 지연이 잇따랐다.또 아이치(愛知)·기후(岐阜)·미에·나가노(長野)현에서 5만6천여 가구가 정전되는 등 각지에서 정전 피해도 속출했다.태풍의 영향으로 이날 새벽 나라(奈良)현에서는 시간당 최고 93.5㎜의 비가 내렸다.기상청은 오는 30일 오전 6시 기준 일본 서남부 지역의 24시간 강수량이 지역에 따라 최고 250㎜에 이를 것으로 보고 주의를 당부했다.일본 정부와 지자체도 태풍과 폭우로 인한 피해를 막기 위해 오사카(大阪), 히로시마(廣島) 등을 포함해 폭넓은 지역 주민들에게 대피를 권고했다.비내리는 일본 도쿄[교도=연합뉴스 자료사진]choinal@yna.co.kr▶놓치면 아쉬운 '핫뉴스'▶퀴즈풀고 상품받고! 뉴스퀴즈쇼 '뉴나'▶네이버 홈에서 [연합뉴스] 채널 구독하기"
29,2018-07-29,누렇게 타들어간 녹색 들판…위성에서 본 유럽의 ‘불타는 여름’,https://news.naver.com/main/read.nhn?mode=LSD&mid=shm&sid1=105&oid=028&aid=0002419245,한겨레,"[한겨레]폭염에 가뭄에 산불까지20일새 녹색이 갈색으로덴마크 슬라겔세 지역의 올해 7월(왼쪽)과 지난해 7월 모습. ESA올 여름 유례없이 일찍 시작된 찜통더위는 한반도만의 일이 아니다. 이웃 일본은 말할 것도 없고 미국, 유럽 등 북반구 전체에서 벌어지고 있는 세계적인 현상이다. 특히 이번 찜통더위는 뜨거운 공기와 대기정체가 어우러지면서 비 소식까지 끊어버렸다. 설상가상으로 영국이나 스웨덴, 그리스 등에서는 사상 최악의 대형 산불까지 겹쳤다.유럽우주기구(ESA)가 올 여름의 `가뭄 폭염' 피해 상황을 극명히 보여주는 위성 영상들을 공개했다. 위의 사진은 코페르니쿠스 센티넬2(Copernicus Sentinel-2) 위성이 촬영한 덴마크 최대의 섬 질란드의 슬라겔세(Slagelse) 지역 농지의 지난해 7월과 올해 7월 모습이다. 들판이 녹색을 띠고 있는 사진이 지난해 7월 모습이고, 황토색 들판이 최근의 모습이다. 뜨거운 날씨에 비가 오지  않으면서 들판의 농작물들이 모두 누렇게 타들어갔음을 한눈에 알 수 있다.유럽우주기구는 이 사진을 공개하면서 ""유럽의 다른 많은 지역에서도 똑같은 일이 벌어지고 있다""고 밝혔다. 코페르니쿠스 센티넬2호 위성은 유럽의 경작 상황을 모니터링하기 위해 고해상도 사진을 실시간으로 보내오고 있다.6월30일의 유럽. 녹색이 땅을 뒤덮고 있다.7월19일의 유럽. 20일새 온통 갈색으로 변해버렸다.코페르니쿠스 센티넬3호 위성이 보내온 사진은 더욱 극적이다. 녹색 사진은 올 6월30일, 갈색 사진은 7월19일에 촬영한 것이다. 독일 북부와 덴마크, 스웨덴에 걸친 드넓은 지역이 불과 20일 사이에 풍요로운 녹색에서 메마른 갈색으로 완전히 탈바꿈했다.올 여름 지구촌 폭염의 직접적 원인은 정체된 북반구 대기가 만든 '열돔 현상'이다. 그러나 근본적으로는 온실가스 누적에 의한 지구온난화가 연출하는 다양한 지구 기후변화 양태의 하나일 것으로 많은 과학자들은 보고 있다.곽노필 선임기자 nopil@hani.co.kr, ▶곽노필의 미래창 바로가기▶ 한겨레 절친이 되어 주세요![오늘의 추천 뉴스][▶ 블록체인 미디어 : 코인데스크][신문구독][ⓒ한겨레신문 : 무단전재 및 재배포 금지]"
30,2018-07-29,'본격적인 여름 휴가철 시작',https://news.naver.com/main/read.nhn?oid=421&sid1=102&aid=0003507934&mid=shm&mode=LSD&nh=20180729095211,뉴스1,"(인천공항=뉴스1) 임세영 기자 = 본격적인 여름 휴가철을 맞아 29일 인천국제공항 제1여객터미널이 해외로 출국하려는 여행객들로 붐비고 있다. 인천국제공항공사는 이날 여름 성수기(7월 21일~8월 19일) 중 이용객이 가장 많은 날로 11만 5,746명이 이용할 것으로 예상된다고 밝혔다. 2018.7.29/뉴스1seiyu@news1.kr▶ [뉴스1] 채널설정하기▶ 제보하기▶ [페이스북] 바로가기![© 뉴스1코리아(news1.kr), 무단 전재 및 재배포 금지]"
31,2018-07-29,"태풍 종다리, 日미에현 상륙…16명 부상 속 많은 비",https://news.naver.com/main/read.nhn?mode=LSD&mid=shm&sid1=104&oid=003&aid=0008730772,뉴시스,"하천 범람 등 경계 속 30일 남해로 빠져나가【도쿄=AP/뉴시스】12호 태풍 종다리가 접근하고 있는 일본 도쿄 하네다(羽田)공항에서 18일 한 여성이 태풍으로 취소된 항공편 전광판과 태풍의 이동 경로를 지켜보고 있다. 종다리는 29일 미에(三重)현에 상륙한 후 긴키(近畿)에서 서진, 일본을 횡단하며 많은 비를 뿌린 후 30일 남해로 빠져나갈 것으로 보인다. 29일 6시 현재 5개 도현에서 최소 16명이 부상한 것으로 집계된 가운데 기상청은 토사 재해와 하천 범람 등에 대한 경계를 호소했다. 2018.7.29【서울=뉴시스】유세진 기자 = 12호 태풍 종다리가 29일 새벽 일본 미에(三重)현에 상륙한 뒤 긴키(近畿) 지방에서 시간당 35㎞의 느린 속도로 서진하고 있다고 일본 NHK 방송이 보도했다.종다리의 영향으로 지금까지 이날 오전 6시 현재 가나가와(神奈川)현과 시즈오카(静岡)현, 지바(千葉)현, 아이치(愛知)현, 도쿄도 등 5개 도현(都縣)에서 적어도 16명이 부상했다.종다리는 간헐적으로 폭우를 쏟아붓고 있어 서일본 호우 피해 지역을 포함한 주고쿠(中國) 지방과 시코쿠(四國)에서도 비와 바람이 강해지고 있다. 긴키와 주고쿠, 시코쿠는 국지적으로 시간당 80㎜ 이상 맹렬한 비가 쏟아질 우려가 있어 기상청은 토사 재해 나 하천의 범람, 폭풍 등에 엄중하게 경계하고 안전을 확보하도록 호소했다.종다리의 중심 기압은 980헥토파스칼, 최대 풍속은 초당 30m, 최대 순간 풍속은 40m이며 중심으로부터 반경 70㎞ 이내에는 풍속 25m가 넘는 강한 바람이 불고 있다.종다리로 나라(奈良)현 소니무라(曽爾村)에서는 새벽 2시께 시간당 114㎜의 강한 비가 내리는 등 곳곳에서 시간당 100∼120㎜의 많은 비가 내려 기상척은 ""기록적인 단시간 호우 경보""와 함께 토사재해 경계경보도 발령했다.12호 태풍 종다리는 30일까지 서일본 지역에 폭우를 쏟아부을 것으로 전망돼 30일 아침까지 24시간 동안 시코쿠와 규슈(九州) 북부 250㎜, 주고쿠와 규슈 남부 200㎜, 긴키와 도카이(東海) 150㎜, 간토(關東) 가츠노부(甲信)에 100㎜의 비가 내릴 것으로 예상되고 있다.또 30일 아침부터 31일 아침까지 24시간 동안에는 시코쿠와 규슈 북부 100∼200㎜, 동해와 규슈 남부 100∼150㎜㎜, 긴키 50∼100㎜의 비가 내릴 것으로 예상되고 있다.기상청은 토사 재해나 하천의 범람, 낮은 토지의 침수, 폭풍과 해일 해일에 엄중하게 경계하고 안전을 확보하도록 호소하고 있다.dbtpwls@newsis.com▶ 뉴시스 빅데이터 MSI 주가시세표 바로가기▶ 뉴시스 SNS[페이스북][트위터]<저작권자ⓒ 공감언론 뉴시스통신사. 무단전재-재배포 금지.>"
