,날짜,기사 제목,기사 링크,기사 출처,기사 내용
65,2018-07-29,"경제도 어려운데, 물가도 오르나",https://news.naver.com/main/read.nhn?mode=LSD&mid=shm&sid1=101&oid=005&aid=0001118311,국민일보,"한은 “정부 관리물가 제외하면 2분기 소비자물가 2.2% 상승”정부가 가격 결정에 관여하는 공공요금이나 교육비 등 이른바 ‘관리물가’를 제외하면 올해 2분기 소비자물가 상승률이 2%를 초과한다는 연구 결과가 나왔다. 정부의 복지정책 확대 등으로 소비자물가 상승률에 착시가 일어났다는 것이다.29일 한국은행이 내놓은 ‘우리나라의 관리물가 현황 및 거시경제적 파급영향 평가’ 보고서에 따르면 올 2분기 관리물가(-0.8%)를 제외한 소비자물가 상승률은 약 2.2%로 추정됐다. 통계청이 발표한 소비자물가 상승률은 1.5%였다.관리물가는 정부가 직·간접적으로 가격에 영향을 미치는 40개 품목의 가격지수다. 전기·수도료 등 공공요금과 의료·교육비 등이 해당된다. 정부의 가격 관리를 받는 통신요금 등도 포함된다. 전체 소비자물가 조사대상 품목(460개) 가운데 8.7% 정도다.2016년 이후 관리물가 상승률은 0% 안팎이었다. 2012년 이후 본격화한 보육료 지원 대상·지원금 확대와 중·고교 무상급식 실시, 건강보험 보장 강화 등이 상승률을 낮추는 데 영향을 미쳤다.한은 보고서 연구팀은 최근 관리물가가 물가흐름을 판단하는데 교란 요인으로 작용하고 있다고 지적했다. 관리물가가 낮은 상승률을 보이며 소비자물가의 오름세까지 낮추고 있다는 것이다. 올 상반기 소비자물가 상승률에 관리물가를 제외한 수치는 1.9%로, 한은의 올해 물가안정목표 수준(2%)에 근접한 것으로 나타났다.연구팀은 “소비자물가 오름세가 낮은 시기엔 관리물가가 전체 물가에 상당한 영향을 미칠 수 있다”며 “특히 관리물가가 경제활동과 다르게 움직일 경우엔 이를 제외한 물가흐름에 더 관심을 기울일 필요가 있다”고 밝혔다.양민철 기자 listen@kmib.co.kr[네이버 채널 친구맺기][페이스북][취재대행소 왱!(클릭)]GoodNews paper ⓒ국민일보(www.kmib.co.kr), 무단전재 및 재배포금지"
66,2018-07-29,내일도 폭염 계속…동해안은 더위 주춤,https://news.naver.com/main/read.nhn?mode=LSD&mid=shm&sid1=103&oid=052&aid=0001175129,YTN,"오늘 서쪽과 동쪽의 날씨가 확연히 달랐습니다.태풍 '종다리'에서 유입된 동풍이 태백산맥을 넘으면서 서쪽은 폭염이 강화됐고요.동해안은 더위가 쉬어갔습니다.내일도 서울과 대전 37도로 극심한 폭염이 맹위를 떨치겠지만, 강릉은 30도에 머무는 등 폭염이 주춤하겠습니다.동풍은 동해안에 단비를 내리기도 했는데요.오늘은 동해안에 이어 영남과 전남 지방에도 비가 내립니다.예상되는 비의 양은 동해안과 제주도에 최고 60mm, 영남과 전남에는 5~40mm가 되겠습니다.밤사이 곳곳에서 열대야가 나타나겠습니다.따라서 오늘 서울의 아침 기온은 27도, 청주와 대전은 26도로 출발하겠습니다.동해안에 이어 영남 내륙도 내일은 폭염이 다소 완화되겠습니다.대구의 낮 기온 34도로 예상됩니다.이번 주도 전국이 대체로 맑은 가운데, 열대야와 찜통더위가 기승을 부리겠습니다.지금까지 날씨정보였습니다.▶ 24시간 실시간 뉴스 생방송 보기▶ YTN이 백화점 상품권을 쏜다고?[저작권자(c) YTN & YTN PLUS 무단전재 및 재배포 금지]"
67,2018-07-29,"대법원의 거짓말…""특활비, 법관 개인에게 지급 안해요""",https://news.naver.com/main/read.nhn?mode=LSD&mid=shm&sid1=102&oid=056&aid=0010603660,KBS,"""법원의 특수활동비가 얼마에요""""금년도에 처음 3억 편성돼 있습니다.""""이걸 법관들한테 지급할 겁니까?""""그렇지 않습니다. 법원도 인원이 2만 명에 육박하고 직무감찰이나 이런 활동 때문에 기밀성 있는 활동이 필요합니다.""""1인당 얼마씩 지급할 계획입니까?""""1인당 지급하지 않습니다. 필요한 조사 활동을 할 때 수요에 맞춰서 집행합니다.""대법원 ""특수활동비, 법관들에게 개인 지급 안 해요""2015년 10월 28일, 국회 법제사법위원회 전체회의에서 김진태 당시 법사위원과 박병대 법원행정처장이 주고받은 대화입니다. 2016년도 대법원 예산안을 심사하기 위한 이 회의에서 김 위원은 대법원의 특수활동비 사용처를 따져 물었습니다. 그러자 사법행정을 총괄하는 당시 양승태 대법원장을 대신해 박 전 처장이 특활비는 법관들에게 1인당 지급하지 않는다고 항변합니다. 이 말은 사실일까요?대법원의 거짓말...특활비 9억 6천만원 대법원장·대법관 등에 개인지급KBS는 정보공개청구를 통해 특활비가 처음 예산으로 편성된 2015년 1월부터 올해 5월까지 대법원의 특활비 지급결의서를 입수했습니다. 분석 결과, 특활비는 3년 5개월 동안 모두 9백여 차례에 걸쳐 모두 9억 6천여만원이 지급됐습니다. 이 돈을 받은 사람들은 대법원장과 대법관, 법원행정처 간부 등 모두 31명이었습니다.박 전 처장이 국회에 출석해 법관 개인에게 지급하지 않는다고 했던 건 거짓말이었던 겁니다. 특수활동비는 전액 현금으로 인출돼, 법원행정처의 재무담당관을 통해 전달된다고 합니다. 대법원도 KBS의 질의에 ""특활비는 개인에게 현금으로 지급된다""면서도, ""특활비 수령자에게 영수 확인을 받지만, 사용처와 관련해 영수증을 제출할 의무는 없다""고 설명했습니다.양승태 전 대법원장 2억 2천만 원...'상고법원 로비용?'영수증 없이 아무데서나 누구에게 써도 되는 특활비를 가장 많이 받은 사람은 누구일까요? 사법행정권 남용 의혹의 중심에 서 있는 양승태 전 대법원장이었습니다. 양 전 원장은 2015년 1월부터 퇴임일인 2017년 9월 22일까지 총 2억 2천여만원을 받았습니다. 한 해에 7천~8천만원 가량을 받은 셈입니다. 2015년 내역을 살펴보니, 양 전 원장은 4월엔 적게는 70만원에서 많게는 140만원까지 총 4차례에 걸쳐 400만원을 수령한 것으로 확인됐습니다. 그런데 6월엔 천만원, 7월 880만원, 8월 천7만원, 9월엔 천285만원으로 수령 횟수도 10차례 안팎으로 늘어난 것은 물론 수령액도 급격히 증가합니다.2015년은 상고법원 도입을 위해 양승태 사법부가 홍보 활동을 본격적으로 시작한 해입니다. 특활비가 로비용으로 쓰였을 가능성도 배제할 수 없는 대목입니다. 특히, 2015년 8월은 양 전 원장이 상고법원 설치를 위해 박근혜 전 대통령과 독대를 한 때이기도 합니다. 이 시기를 전후해 양 전 원장의 특활비 수령액이 급증하는 것과 관련해, 참여연대는 오늘(29일) '대법원 특활비 지급내역 분석 보고서'를 통해 ""당시 지급된 특활비가 상고법원 설치를 위한 로비로 사용됐을 가능성이 있다""고  지적했습니다.다른 대법관들은?...법원행정처장 6천~9천여만원 수령양 전 원장에 이어 특활비를 많이 받은 사람은 고영한 대법관입니다. 지금까지 모두 9천여만원을 수령했습니다. 박병대 전 대법관과 김소영 대법관 등도 각각 6천여 만원을 수령한 것으로 확인됐습니다. 이들 모두 법원행정처장을 역임한 분들입니다. 이밖에 다른 대법관들은 한 달에 꼬박꼬박 100만원씩, 1년에 천200만원을 특활비로 고정적으로 받았습니다. 그 외에는 법원행정처의 기조실장이나 사법정책실장 등에게 이따금씩 수백만원이 지급됐습니다.'특활비는 기밀성 경비'...대법원에 특활비 필요할까?'기밀 유지가 요구되는 정보 및 사건 수사, 기타 이에 준하는 국정 수행 활동에 직접 소요되는 경비'기획재정부가 발간하는 예산 및 기금운용계획 지침상의 특수활동비 규정입니다. 대법원은 '헌법과 법률, 양심에 따라 독립해 심판하는' 법관들이 모여 공개재판을 하는 곳입니다. 대법원은 사법부도 윤리감사나 직무감찰 등을 위해 밀행성 있는 활동이 있다고 주장하지만, 특수활동비 지급 내역을 보면 여기에 고개를 끄덕일 사람은 그리 많지 않아 보입니다.'김명수 사법부'의 법원행정처는 박병대 전 법원행정처장의 거짓말에 대해서도 ""전임 법원행정처의 답변에 관해 구체적으로 확인하거나 설명드리기 적절하지 않은 점에 대해 양해를 바란다""면서도, 특수활동비 사용 내역은 ""정보공개청구의 대상이라 제공하기 어렵다""고 답했습니다.정성호기자 (andreas@kbs.co.kr)▶ 네이버 채널 KBS뉴스 구독! 시원하게 털어드립니다▶ ‘TV보다 리얼’한 색다른 뉴스![저작권자ⓒ KBS 무단복제-재배포 금지]"
68,2018-07-29,제주서 캠핑하던 30대女 실종 4일째…공개수사 전환,https://news.naver.com/main/read.nhn?mode=LSD&mid=shm&sid1=102&oid=421&aid=0003508692,뉴스1,"지난 26일 제주 세화항 해상에서 실종 여성의 것으로 추정되는 슬리퍼가 발견됐다. 위  사진은 실종된 최모씨(38). © News1(제주=뉴스1) 안서연 기자 = 제주에서 가족과 함께 캠핑을 하던 30대 여성이 실종돼 경찰과 해경이 나흘째 수색을 벌이고 있지만 아직까지 행방이 묘연하다.29일 제주해양경찰서와 제주동부경찰서에 따르면 지난 25일 밤 11시쯤 제주시 구좌읍 세화항 부근에서 최모씨(38·여·경기도 안산시)가 실종됐다.최씨의 남편(37)에 따르면 최씨는 딸, 아들과 함께 카라반에서 캠핑을 하다 음주 상태로 홀로 밖에 나간 뒤 돌아오지 않았다.주변 폐쇄회로(CC)TV를 탐색한 결과 최씨는 실종 당일 세화항 주변 편의점에 들렀던 것으로 확인됐다.이튿날인 26일 오후 3시쯤 세화항 방파제 인근 해상에서는 최씨의 휴대전화와 카드, 슬리퍼 한쪽이 발견됐다.해경과 경찰은 당시 음주상태였던 최씨가 바다에 빠졌을 가능성에 무게를 두고 주변 해역에 대한 수중 수색을 벌였다.하지만 28일까지 총 9차례에 걸쳐 수중 수색 작업을 벌였는데도 최씨의 흔적은 발견되지 않았다.경찰과 해경, 해군, 소방 등 현재까지 동원된 인력만 230여명이다.이에 경찰은 가족의 동의를 얻어 29일부터 공개수사로 전환, 최씨의 행방을 쫓고 있다.asy0104@news1.kr▶ [뉴스1] 채널설정하기▶ 제보하기▶ [페이스북] 바로가기![© 뉴스1코리아(news1.kr), 무단 전재 및 재배포 금지]"
69,2018-07-29,"""내가 대학 가나 싶을 정도로 고민했어요"" 시민참여단이 말하는 '대입개편 공론화'",https://news.naver.com/main/read.nhn?mode=LSD&mid=shm&sid1=102&oid=032&aid=0002884591,경향신문,"대입제도개편 공론화위원회 시민참여단이 29일 충남 천안 계성원에서 2박3일간의 합숙 토론을 마치고 소감을 말하고 있다.연합뉴스“이러다 제가 대학 가는 거 아닌가 싶을 정도로 엄청나게 공부했어요.”2022학년도 대입제도 개편을 위한 시민참여단이 2차 숙의토론회를 끝으로 2주간의 공론화 과정을 마친 29일 천안 계성원. 경기에서 4살, 5살인 두 딸을 키우고 있는 김태웅씨(39)가 시민참여단 합동인터뷰에서 말했다. 처음부터 적극적으로 참여한 건 아니다. 너무 먼 얘기처럼 느꼈기 때문이다. “딸들 대학 갈 땐 어차피 또 바뀔건데 참여해서 뭐하나 싶었죠. 들어나 보자며 1차 토론회에 갔는데, 입시제도가 너무 어렵게 돼 있더라고요. 대학에 갈 수 있게 만든 게 아니라 못 가게 하려고 만든 것 같았어요. 아이들이 좀 더 편하게 갈 수 있었으면 좋겠다 해서 여기까지 오게 됐어요.”김씨는 자신을 ‘보통사람’이라고 표현했다. 그는 “앞으로도 국가의 중요한 정책을 결정할 때 무지한 사람들도 숙의에 참여해 사안을 알게 되고, 고민하고, 심층적으로 생각하고, 소중한 한 표를 던질 수 있는 자리가 좀 더 많았으면 좋겠다”고 말했다.“학부모가 아닌 부모의 마음으로 참여했어요.” 충북에 사는 유진순(42)씨는 이번 대입제도 개편의 당사자인 중학교 3학년 자녀를 뒀다. 유씨는 “중3 엄마지만 입시를 잘 알지 못했다”면서 “1, 2차 숙의를 통해 아이들의 행복에 대해 다시 한 번 생각해보게 됐다”고 말했다.이번 공론화에서는 수능을 절대평가로 바꿀 것인가, 수능 위주의 정시전형과 학생부교과전형·학생부종합전형 등으로 뽑는 수시전형의 비율을 어떻게 조정할 것인가 등을 놓고 4가지 시나리오가 1~4번 의제로 안건에 올려졌다. 시민참여단 550명 중 490명이 이날 2차 토론회까지 전 과정에 참여했다. 이들은 권역별 1차 토론에서 현재의 대입제도와 4개 의제에 대한 기본 지식을 쌓았다. 2차 토론에서는 8~11명씩 50개 조로 나뉘어 의제들이 얼마나 타당한지, 실현이 가능한지를 토의했다.마지막날인 이날 오전에는 4가지 개편안 발표자가 사전에 시민참여단에게 받은 질문에 답했다. 수능 전형 비중을 현재의 25% 안팎에서 45% 이상으로 늘리는 ‘1안’의 발표자인 안선회 중부대 교수는 “수능전형도 한줄 세우기가 아니라 고교 학점제 등과 연계해 진로 맞춤형으로 갈 수 있다”고 말했다. 수능 전 과목 절대평가가 핵심인 ‘2안’의 발표자 이태경 전국혁신학교졸업생연대 대표는 “교육은 모두를 1등으로 만드는 것이 아니라 모두를 성장시키는 것이다. 상대평가로는 뒤쳐진 친구들에 관심을 갖기 어려운 구조”라고 말했다.‘3안’은 대학이 자율적으로 전형 비율을 정하자는 것이다. 정재찬 한양대 입학처장은 ‘현상유지안이 아니냐’는 지적을 두고 “안정된 상태에서 개선하고자 하는 것”이라고 답했다. 정시와 수시의 균형을 강조하는 ‘4안’ 발표자 이현 우리교육연구소 이사장은 “수능만으로 다 뽑자는 게 아니라 교과전형도, 학종도 유지하자는 것”이라며 “정시 비율을 높이는 것 자체가 대입을 획일화시키는 것은 아니다”라고 말했다.유진순씨는 “4가지 개편안 모두 장단점이 있다. 어떤 방향으로 결정되든 다른 의제에 담겼던 긍정적인 부분을 충분히 받아들일 수 있을 거라고 본다”고 했다. 유씨는 “작은 경품행사에도 당첨된 적 없어 시민참여단에 참여하라는 전화를 받았을 때 기뻐서 소리를 질렀다”며 “많이 배울 수 있는 계기가 돼서 감사하다”며 웃었다.강원에서 온 김용태씨(60)도 아이들의 ‘행복’을 기준으로 4가지 대입 개편안을 평가했다고 했다. “아날로그 세대와는 다르잖아요. 세상이 바뀐 만큼 학업환경도 따라가야죠. 우리 학생들이 공부가 하고 싶어야 공부가 되고, 즐겁고 행복한 거거든요. 억지로 시켜서 좋은 대학 가서 스펙 쌓고 좋은 회사 취직해서 성공한들, 내 나이가 됐을 때 ‘어린 시절 행복한 삶을 살았는가’ 반문한다면, ‘그렇다’고 말할 수 있겠어요?”29일 천안 계성원에서 진행중인 대입제도 개편 공론화 숙의 토론에 참여한 시민들이 4가지 의제 각각에 대한 질문의 답변을 듣고 있다. 연합뉴스이들은 정부가 큰 정책을 결정하는 데 자신들의 목소리를 반영한다는 점을 높이 샀다. 시각장애를 가진 손남숙씨(54)는 “사회의 모든 일을 힘 있는 사람들, 정치하는 사람들만 결정한다고 생각했는데 공론화를 통해 저처럼 아무 것도 모르는 사람들도 참여할 수 있다는 걸 알게 됐다”고 말했다. 고등학교 교사 나길우씨(46)는 “함께 모여 이야기해본다는 자체가 의미있다. 똑똑한 사람들이 만들어놓은 결과물이 좋지 못했으니 우리 시민들이 이 이야기를 하게 된 것”이라며 “민주주의에서는 (사안을) 잘 알지 못하는 사람들이 모여 얘기하는 것도 매우 중요하다”고 했다. 권지은씨(32)는 2차 토론회를 거치면서 생각이 달라졌다고 털어놨다. “처음에는 시험의 공정성 중심으로 생각했는데, 점점 평가방법을 논하기 이전에 어떤 목표를 가지고 어떤 방법으로 가르쳐야 하는지가 먼저이지 않을까 하는 생각이 들었다”고 했다.신고리 원전 5·6호기 공론화에 이어 두번째 ‘국민 토론’ 시도였는데 이번에도 아쉬움은 남았다. 김도혁씨(22)는 공론화가 끝날 때까지 복잡한 입시제도를 이해하지 못한 참가자들도 있었다면서 “합리적인 결과가 나올지 의문이 들기도 했다”고 했다. 김태웅씨는 “미리 교재가 배포되긴 했지만 낮시간 일을 하는 시민들이 주경야독을 하기는 쉽지 않다”면서 “다음에는 조금 더 충분한 시간을 줬으면 좋겠다”고 말했다.계성원 벽면 게시판인 ‘질문 주차장’에 시민참여단이 써붙인 포스트잇이 눈에 띄었다. “1.4% 정답자가 있는 수리 30번 문제, 영어 빈칸추론, 국어 아리스토텔레스 지문 같은 고난이도 문제가 왜 필요합니까?” “대학의 자율성이 정말 최선일까요?” “학종에 의한 고등학교 교실의 변화는 일부 혁신고만의 이야기는 아닌가요?” “수능은 진짜 공정한가요?”시민참여단은 1·2차 숙의토론 기간 동안 총 3차례 설문조사에서 4가지 안을 5점 척도로 평가했다. 공론화위원회는 시민참여단 의견을 분석한 뒤 그 결과를 다음달 3일 발표한다. 국가교육회의 대입제도 개편 특별위원회는 이를 바탕으로 권고안을 만든다. 교육부는 8월 말까지 이 권고안을 토대로 대입제도 개편안을 발표한다. 김영란 공론화위원장은 폐회사에서 “최종 참여율을 70%로 예상했는데 89%를 넘어섰다”며 “시민참여단의 의견이 조금도 훼손되지 않도록 신중하게 잘 정리하겠다”고 말했다.<노도현 기자 hyunee@kyunghyang.com>▶ 경향신문 SNS[트위터][페이스북]▶[인기 무료만화 보기]©경향신문(www.khan.co.kr), 무단전재 및 재배포 금지"
