,날짜,기사 제목,기사 링크,기사 출처,기사 내용
95,2018-07-29,태풍 종다리가 불러오는 폭염…서쪽은 ‘타들어가는’ 더위,https://news.naver.com/main/read.nhn?mode=LSD&mid=shm&sid1=103&oid=032&aid=0002884545,경향신문,"올여름 피서가 절정기에 접어든 28일 양양 낙산해수욕장이 모처럼 붐비고 있다. 올여름 동해안 해수욕장은 계속된 폭염 때문에 피서객이 지난해 같은 기간에 비해 다소 줄었다.   | 연합뉴스태풍이 오면 비바람이 불고 기온이 떨어질 줄 알았는데, ‘종다리’의 날개짓은 다르다. 이웃한 일본에는 비바람을 불러 재난을 일으켰지만 한반도 남쪽에선 기를 못 쓰고 오히려 덥고 건조한 바람을 부르게 생겼다.기상청은 12호 태풍 종다리가 29일 오후 3시 일본 오사카 서쪽에 도달한 뒤에 초속 17m 미만인 ‘열대저압부’로 약화돼 사실상 소멸했다고 밝혔다. 종다리의 영향으로 강원 영동과 경상도에는 비가 조금 오고 잠시나마 선선해지겠지만 태백산맥을 경계로 서쪽 지방은 다시 뜨거워진다. 동풍이 산을 넘어 내려올 때에 고온건조해지면서 산맥 서쪽에는 오히려 폭염이 기승을 부리게 되는 것이다. 일종의 푄 현상이다.이 때문에 월요일인 30일에는 강원영동과 동해안을 제외한 전국이 35도를 넘나든다. 서울 등 수도권과 충청도, 전라도는 8월1일까지 강한 햇빛에 동풍의 효과가 더해져 낮 최고기온이 37도 이상 올라간다. 낮 기온이 40도에 육박해 곳곳에서 최고기온을 경신할 것이라는 예상까지 나온다. 반면 경북내륙은 동풍의 영향을 직접 받지 않아 35도를 밑도는, 더위의 ‘동서 역전’이 일어난다. 다만 습도는 상대적으로 덜할 것으로 보인다. 뜨겁고 마른 바람인 탓에 ‘푹푹 찌는’ 더위보다는 ‘타들어가는’ 더위가 예상된다. 앞서 중국에서 소멸된 10호 태풍 암필은 한반도에 뜨거운 수증기를 불어넣어 무더위를 부추겼다.28일까지 기준으로 폭염일수는 14.7일로 1994년 17.6일에 이어 역대 두 번째다. 열대야 일수는 1994년 7.9일, 2018년 6.5일로 역시 두 번째다. 8월 초에도 더위가 꺾일 기미는 보이지 않는다. 서쪽에서 대륙 고기압이 강하게 확장하고 있어 8월에 극심한 폭염이 찾아온 2016년의 닮은꼴이 될 것이라는 전망이 나온다. 1994년에는 7월 말부터는 더위가 조금씩 누그러졌지만 2016년에는 8월이 유난히 더웠다. 윤기한 기상청 사무관은 “입추(8월7일)에는 더위가 살짝 꺾여야 하는데 현재로선 35도 안팎의 더위가 계속될 것으로 본다”고 말했다.폭염이 이어지면서 오존 걱정도 커졌다. 환경부 국립환경과학원이 2015년부터 올해 7월22일까지 통계를 조사해보니, 수도권과 부산·울산·경남에서 폭염 때 오존 농도가 두드러지게 높아졌다. 낮 최고기온이 33도 위로 올라간 ‘폭염일’에 오존 ‘나쁨’ 이상(0.091ppm 이상)을 기록하거나 오존주의보(1시간 평균 농도가 0.12ppm 이상)가 발령된 날이 많았던 것이다. 낮 기온이 25도 이상으로 올라갔지만 폭염에까지는 이르지 않은 날들과 비교해보면, 폭염일에 오존 상황이 나빠진 날이 2배~4.4배 많았다.올 7월 서울의 오존주의보 발령 일수는 최근 4년 중 가장 많은 5일이었다. 경기도는 지난 25일까지 7일 연속, 경남은 8일 연속 발령됐다. 호흡기질환 등을 부를 수 있는 오존은 햇빛이 강하고 공기 중에 휘발성유기화합물(VOCs)과 질소산화물(NOx)이 많을 때 농도가 짙어진다.푄 현상은 바람이 높은 산을 넘어오면서 온도가 올라가고 건조해지는 것을 가리킨다. 바람이 산맥 정상으로 향할 때에는 온도가 떨어지면서 수증기가 응결돼 비가 내리고, 산 정상을 지나 반대편으로 내려올 때에는 수분을 빼앗긴 상태여서 온도가 큰 폭으로 올라간다. 한국에선 태백산맥을 경계로 푄 현상이 자주 나타난다.■온열질환 사망 27명…“햇볕 피하고, 물 자주 드세요”올여름 무더위에 ‘온열질환’을 겪는 환자가 2000명을 넘어섰다. 사망자는 27명에 이르렀다. 질병관리본부는 이번 여름 519개 응급의료기관에서 보고된 온열질환자가 2042명으로 집계됐다고 29일 밝혔다. 이중 사망자는 27명으로, 온열질환 응급실 감시체계운영을 시작한 2011년 이후 가장 많았다.아직 7월이 다 가지도 않았지만 온열질환 발생 건수는 이미 지난해 여름 전체의 1574명을 넘어섰다. 지난해 사망자는 11명이었다. 1994년에 이어 ‘역대 두 번째 더위’로 꼽히는 2016년의 온열질환자 2125명(사망 17명)도 넘어설 것으로 보인다. 특히 더위가 극심했던 22~28일 동안 신고된 온열질환자가 907명, 사망자 13명으로 전체의 절반에 가까웠다. 연령대별로 온열질환이 발생한 장소를 보면 0~18세 어린이와 청소년은 공원·행락지가 65%로 가장 많았다. 야외작업장에서는 19~39세(38%)와 40~64세(43%)가 많았다. 65세 이상은 길가(32%)와 논·밭(25%) 같은 장소에서 많이 발생했다.온열질환은 일사병과 열사병, 열탈진 등을 말한다. 더운 곳에 오래 있거나 직사광선을 받아 체온이 제대로 조절되지 않으면 일사병에 걸린다. 열사병은 무덥고 밀폐된 공간에서 오래 일하거나 머물 때 생긴다. 예방을 하려면 물을 자주 마시고, 충분히 휴식을 취해야 한다. 폭염주의보나 경보가 내려졌을 때에는 뜨거운 오후 시간대에 외부활동을 줄이고, 술이나 카페인 음료도 피하는 것이 좋다고 전문가들은 말한다.온열질환자가 생기면 즉시 시원한 곳으로 옮기고 시원한 물수건 따위로 몸을 닦아줘 체온을 떨어뜨려야 한다. 환자가 의식을 잃었을 때에는 억지로 물을 먹이지 말고 119에 신고해야 한다. 질병관리본부는 “최근 5년간 온열질환 발생을 분석해보니 8월 초·중순에 약 50%가 집중적으로 나타났다”며 “햇빛을 피하고 물을 자주 마시며 건강관리에 유의해야 한다”고 당부했다..<배문규 기자 sobbell@kyunghyang.com>▶ 경향신문 SNS[트위터][페이스북]▶[인기 무료만화 보기]©경향신문(www.khan.co.kr), 무단전재 및 재배포 금지"
96,2018-07-29,"인권위, 北 여종업원 집단입국 직권조사…탈북경위 등 파악",https://news.naver.com/main/read.nhn?mode=LSD&mid=shm&sid1=102&oid=003&aid=0008731008,뉴시스,"자유의사 입국, 국가기관 개입 여부 등 조사민변 등 ""총선 승리 위한 朴정부 기획 탈북""북측 ""돌려보내지 않으면 남북관계에  장애""【서울=뉴시스】북한의 대남선전 매체인 우리민족끼리 TV는 지난 24일 홈페이지에 '집단탈북 사건의 비열한 음모를 까밝힌다' 라는 제목의 동영상을 게재했다. 이 영상에는 탈북한 중국 북한식당 종업원들과 함께 근무한 동료들의 인터뷰가 담겨있다. 이들은 ""남한과 결탁한 지배인의 꾀임에 동료들이 속아 넘어갔다""라며 주장했다. 사진은 탈북한 종업원들과 같은 식당에서 일했다는 여성들의 모습. 2016.04.25. (사진=우리민족끼리 TV 캡쳐) photo@newsis.com【서울=뉴시스】이예슬 기자 = 국가인권위가 2016년 총선을 앞두고 북한식당 여종업원들이 집단입국한 사건에 대해 직권조사를 하기로 했다.인권위는 지난 26일 침해구제제2위원회를 열어 지난 2016년 4월 북한식당 여종업원 12명이 본인들의 자유의사에 따라 한국에 입국했는지 여부 등에 대해 직권조사를 결정했다고 29일 밝혔다.당초 종업원들은 자유의사로 집단 탈북해 한국에 입국했다고 밝혔지만 최근 민주사회를위한변호사모임(민변) 등을 중심으로  총선 승리를 위한 박근혜 정부의 기획 탈북이었을 가능성이 제기되고 있다. 이들의 입국과정에 국가정보원 외 국군정보사령부 직원이 관여됐다는 의혹이다.국제연합(UN) 북한인권 특별보고관인 토마스 오헤아 퀸타나도 지난 10일 한국 방문결과 기자회견에서 이 사건과 관련해 ""철저하고 독립적인 진상규명 조사가 필요하다""는 입장을 밝혔다.이에 인권위는 이 사건의 진상과 인권침해 규명을 위한 적극적 대처가 필요하다고 보고 조사범위 확대 필요성과 사안의 중대성 등을 고려해 국가인권위원회법 제30조 제3항에 따라 직권조사를 결정했다.인권위는 민변 소속 변호사들이 국정원장 등을 피진정인으로 제기한 북한식당 여종업원 집단입국 진정사건 조사를 진행해 왔다.조사 과정에서 중국 류경식당 지배인이었던 허모씨는 ""국정원 직원의 협박과 회유에 따라 집단입국을 실행했다""고 주장했다.조사에 응한 일부 여종업원들 역시 ""주말레이시아대한민국대사관 앞에 도착할때까지 한국으로 입국한다는 사실을 몰랐다""며 ""대사관 앞에서 지배인 허씨가 협박해 강제적 상황에서 입국했다""고 주장하고 있다.다만 국가기관이 개입했는지 여부 등은 관계기관이 조사에 협조하지 않아 사실관계 파악에 한계가 있는 상황이다.인권위 관계자는 ""이들이 자유의사에 따라 한국에 입국했는지, 집단입국 과정에서 국가기관의 위법한 개입이 있었는지, 입국 다음날 진행된 관계기관의 언론 브리핑이 적정했는지 등에 대한 다각적 조사를 진행할 계획""이라고 밝혔다.한편 북측은 탈북 종업원 문제가 해결되지 않으면 이산가족 상봉 등 남북관계에 장애가 될 수 있다는 입장을 내놨다.북한 조국평화통일위원회(조평통) 선전매체 우리민족끼리는 지난 25일 ""우리 여성 공민들의 송환문제가 해결되지 않는다면 북남 사이의 흩어진 가족, 친척상봉은 물론 북남관계에도 장애가 조성될 수 있다는 것은 너무도 자명하다""며 ""판문점선언 이행 의지를 보여주기 위해서도 우리 여성공민들을 부모들의 품으로 시급히 돌려보내야 한다""고 강조했다.ashley85@newsis.com▶ 뉴시스 빅데이터 MSI 주가시세표 바로가기▶ 뉴시스 SNS[페이스북][트위터]<저작권자ⓒ 공감언론 뉴시스통신사. 무단전재-재배포 금지.>"
97,2018-07-29,"불공정거래 조사받는 고령자, 신뢰관계자 동석 가능",https://news.naver.com/main/read.nhn?mode=LSD&mid=shm&sid1=101&oid=003&aid=0008731024,뉴시스,"동석자수 1명 원칙, 사유 기재해야조사방해, 기밀누설 우려시 '신청 거부'【서울=뉴시스】이승주 기자 = 앞으로 고령자가 금융감독원 불공정거래 조사를 받을 때 신뢰할 수 있는 이를 동석할 수 있다.금감원은 다음달 1일부터 불공정거래 조사 시 고령자 등 배려가 필요한 피조사인 권익을 보호하기 위해 '신뢰관계자 동석제'를 도입한다고 29일 밝혔다.고령자 등이 질문에 답변하는 과정에서 심리적으로 불안해 사실관계를 충분히 소명하지 못하는 일이 없도록 하기 위해서다. 이는 지난 5월 발표한 '불공정거래 조사업무 혁신방안'에 따른 조치다.대상은 신체적 또는 정신적 장애로 사물을 변별하거나 의사를 결정·전달하는 능력이 미약해 배려가 필요한 피조사자다. 가령 65세 이상 고령자나 미성년자, 장애인복지법상 장애인 등이 해당된다.이들은 심리적 안정과 원활한 의사소통에 도움을 줄 수 있는 신뢰관계자와 동석할 수 있다. 신뢰관계자에는 피조사자의 직계친족이나 형제자매, 배우자, 가족, 동거인, 보호시설이나 교육시설 담당자 등이 포함된다.신뢰관계자 동석을 희망하는 자는 금감원 문답조사 전날까지 동석신청서와 관련 소명자료를 담당 조사원에게 제출하면 된다. 동석자 수는 원칙적으로 1명으로 제한한다. 신뢰관계자 인적사항과 동석이 필요한 사유 등을 기재해야 한다.단 신뢰관계자가 조사를 방해하거나 기밀을 누설해 조사에 지장을 초래할 우려가 있는 경우, 신청이 거부될 수 있다.금감원 관계자는 ""불공정거래 조사 시 불안해하지 않고 사실관계를 충분히 소명할 수 있을 것""이라며 ""절차적 정당성과 조사결과에 대한 국민 공감도가 높아질 것""으로 기대했다.joo47@newsis.com▶ 뉴시스 빅데이터 MSI 주가시세표 바로가기▶ 뉴시스 SNS[페이스북][트위터]<저작권자ⓒ 공감언론 뉴시스통신사. 무단전재-재배포 금지.>"
98,2018-07-29,"공정거래법 개편특위 ""벤처기업 M&A 확대…지주회사제 활성화""",https://news.naver.com/main/read.nhn?mode=LSD&mid=shm&sid1=101&oid=421&aid=0003508200,뉴스1,"공정거래법 전면개편 특별위원회 최종보고서유진수 공정거래법 전면개편 특별위원장(가운데)이 지난 27일 정부세종청사 공정거래위원회 기자실에서 특위 최종보고서를 발표하고 있다. 왼쪽부터 이봉의 특위 경쟁법제분과 위원장, 유진수 특별위원장, 이황 특위 절차법제 분과위원장. 장수영 기자(세종=뉴스1) 김현철 기자 = 벤처기업의 인수합병(M&A) 저변을 확대하기 위해 벤처지주회사 제도를 활성화할 필요가 있다는 공정거래법 전면개편 특별위원회의 권고가 나왔다. 상호출자제한집단 지정기준은 국내총생산(GDP)의 0.5%로 연동하자는 의견도 제시됐다.특위는 2차례의 전체회의와 21차례의 분과회의를 거쳐 이 같은 내용의 '공정거래법 전면개편 방안 최종보고서'를 확정, 공정거래위원회에 권고했다고 29일 밝혔다.기업집단법제 분과 주요 논의결과를 살펴보면 우선 벤처지주회사제도를 활성화할 필요가 있다는 다수 의견이 나왔다. 특위는 공정위가 업계 의견 등을 충분히 수렴해 추진할 것을 권고했다.이에 따라 공정위는 곧 대기업이 벤처기업을 인수할 경우 계열사 편입 유예기간을 늘리고 벤처지주회사 설립 자산요건 문턱을 낮추는 안을 발표할 것으로 보인다.상호출자제한집단 지정기준은 경제규모를 자동으로 반영하기 위해 GDP의 0.5%로 연동하는데 특위 의견이 수렴됐다. 단 GDP 0.5%가 10조원을 초과하는 해의 다음해부터 시행하도록 부칙을 개정하도록 권고했다.금융보험사 의결권은 현행 특수관계인 합산 15% 한도에 추가해 금융·보험사만의 의결권 행사한도를 5%로 제한하는데 의견이 모아졌다. 또 현행 15% 한도 내에서 예외적 의결권 행사가 허용되는 사유 중 계열사 간 합병, 영업양도는 제외해야 한다는 다수 의견이 나왔다. 계열사간 합병은 본래 예외 허용 목적인 적대적 M&A 방어 등과는 무관하며 총수일가를 위해 불리한 합병비율에 찬성하는 등 악용가능성이 있는 점을 고려한 것이다.또 상호출자제한집단 소속 공익법인(상증세법상 공익법인으로 한정)의 보유 계열사 주식 의결권 행사는 원칙적으로 금지하되 특수관계인과 합해 15%, 전체 공익법인 합산 5%내로 의결권 행사가 가능하도록 하는 방안에 공감대가 형성됐다. 공익법인의 내부거래와 계열사 주식거래(3자로부터의 취득·처분 포함) 시 이사회 의결·공시제도를 도입하라고도 권고했다.© News1 김일환 디자이너순환출자 금지제도 개편방안의 경우 향후 지정될 기업집단에 대해서는 주식처분보다는 의결권 제한방식이 최소 침해 원칙에 부합된다는 것이 다수 의견이었다. 의결권 제한 시 순환출자를 최종 완성한 출자회사의 의결권만 제한하는 방안에 의견이 모아졌다.사익편취규제 대상 기준의 경우 현행 상장사 30%, 비상장사 20%에서 모두 20%로 일원화하고 이들이 50% 초과 보유한 자회사도 포함시켜야 한다고 특위는 권고했다.해외계열사 공시 강화방안에 대해 논의한 결과 기업집단의 총수(동일인)에게 국내 계열사에 직·간접 출자한 해외계열사의 주식소유현황과 순환출자현황을 공시하도록 하는데 의견이 수렴됐다. 총수일가가 지분을 20%이상 보유한 해외계열사와 그 자회사의 현황에 대해서도 동일인이 공시해야 한다고 권고했다.지주회사 제도 개편방안과 관련, 자·손자회사 지분율 상향 필요성은 공감대가 형성됐으며, 신규 설립·전환 지주회사만 우선 적용하는 안에 다수 의견이 수렴됐다. 또한 공동손자회사 보유는 현행법의 규제사각지대로 지주회사 제도 취지에 반하는 만큼 금지하는데 의견이 일치됐다. 특위는 배당외수익 수취 등을 통한 사익편취를 막기 위해 지주회사의 내부거래 공시를 강화해야 한다고 지적했다.공정위는 특위 권고안과 최근 진행된 각계 토론회 논의 등을 토대로 공정거래법 전면개편안을 마련해 8월 중 입법예고하고, 규제심사 등을 거쳐 연내에 국회에 제출할 계획이다.honestly82@news1.kr▶ [뉴스1] 채널설정하기▶ 제보하기▶ [페이스북] 바로가기![© 뉴스1코리아(news1.kr), 무단 전재 및 재배포 금지]"
99,2018-07-29,도로에 누운 70대 치어 숨지게한 버스기사 '무죄',https://news.naver.com/main/read.nhn?mode=LSD&mid=shm&sid1=102&oid=001&aid=0010239391,연합뉴스,"(수원=연합뉴스) 강영훈 기자 = 중앙분리대에 다리를 걸친 채 도로에 누워있던 70대를 밟고 지나가 숨지게 한 혐의로 법정에 선 50대 버스 기사가 무죄를 선고받았다.수원지법 형사2단독 이성율 판사는 교통사고처리특례법 위반(치사) 혐의로 기소된 버스 기사 A(51) 씨에 대해 무죄를 선고했다고 29일 밝혔다.버스사고 PG [제작 최자윤] 일러스트A 씨는 지난해 12월 8일 오후 4시 20분께 수원시 장안구의 한 편도 2차로 도로에서 1차로를 따라 운전하던 중 중앙분리대에 다리를 걸치고 누워있던 B(76) 씨를 밟고 지나가는 사고를 내 B 씨를 숨지게 한 혐의로 기소됐다.고령인 B씨는 중앙분리대를 넘어가지는 못하고, 분리대에 가로로 나있는 공간을 통해 머리부터 빠져나오는 과정에서 다리가 걸리는 바람에 도로 쪽에 있던 상체 부분을 버스에 치였다.법원은 피고인이 사고 지점에 누워있던 피해자를 발견할 수 있었다고 단정하기에는 무리가 있다고 판단했다.이 판사는 판결문에서 ""사고가 난 도로 중앙선에는 보행자의 횡단을 방지하기 위한 울타리가 설치돼 있어 무단횡단하기에 용이하지 않다""라며 ""피고인으로서는 사고 지점에서 무단횡단하는 사람이 있으리라 예측하기 어려웠을 것으로 보인다""라고 설명했다.이어 ""피해자는 도로를 무단횡단하기 시작해 중앙선에 설치된 울타리에 다리를 걸친 채 그대로 누웠다""라며 ""피해자는 드러눕기 시작한 지 50초가량 별다른 움직임 없이 누워있었고, 당시 정면에서 햇빛이 강렬하게 비친 점은 피고인이 피해자를 발견하기 어렵게 하는 사정이었다고 보인다""라고 판시했다.kyh@yna.co.kr▶놓치면 아쉬운 '핫뉴스'▶퀴즈풀고 상품받고! 뉴스퀴즈쇼 '뉴나'▶네이버 홈에서 [연합뉴스] 채널 구독하기"
100,2018-07-29,"부실시공 건설업체, 저금리 공공대출 제한",https://news.naver.com/main/read.nhn?mode=LSD&mid=shm&sid1=101&oid=008&aid=0004084588,머니투데이,"[머니투데이 김사무엘 기자] [부실벌점·영업정지기간 따라 기금 신규·추가 대출 금지…""부실 건설사 시장 퇴출""]경기 화성시 동탄2신도시의 한 아파트 주차장에서 작업자들이 누수 보수공사를 하고 있다. /사진=뉴스1부실시공 등으로 벌점을 받은 건설사는 최대 2년 간 저리의 주택도시기금 대출이 제한된다. 정부는 기금 제한과 선분양 금지 조치 등으로 부실 건설사를 시장에서 퇴출시킨다는 계획이다.국토교통부는 부실벌점 정도와 영업정지 기간에 따라 건설사에 주택도시기금 대출을 제한하는 내용의 '주택도시기금법 시행규칙' 일부 개정안을 입법 예고한다고 29일 밝혔다.개정안에 따르면 누계평균벌점 1점 이상부터 1점당 1개월 간 기존에 약정이 완료된 융자금의 지급(분할실행)이 중단된다. 주택도시기금 사업자 융자는 통상 준공률에 따라 나눠서 대출이 이뤄지는데 제한 기간 동안에는 대출을 받을 수 없는 것이다.3점 이상 5점 미만은 분할실행 중단과 함께 6개월 동안 신규 대출도 불가하다. 5점 이상 10점 미만은 1년 간 신규 대출이 제한되고 10점 이상부터는 2년 동안 신규 대출을 받을 수 없다./자료제공=국토교통부영업정지 기간에 따라서도 기금 대출이 제한된다. 우선 영업정지 기간 중에는 분할실행이 중단된다. 영업정지 1개월 초과 3개월 이하는 영업정지 종료 후 6개월 동안 신규 대출을 제한하고 3~6개월 영업정지는 1년 동안 신규 대출을 금지한다. 6개월 이상은 2년 동안 신규 대출을 받지 못한다.동일업체가 영업정지를 반복해 받은 경우 각각의 처분을 합산해 제한한다. 영업정지 및 벌점 모두 받는 경우에는 각각의 제재 수준을 합산해 기금 융자를 가중 제한한다. 가령 영업정지 6개월과 벌점 10점을 받으면 2년 동안 신규 대출과 분할실행이 금지된다.후분양 활성화를 위한 대책도 마련됐다. 일정 공정률 이후 입주자를 모집하는 경우 기금 지원이 가능하도록 관련 근거를 개정안에 새로 추가했다.주택도시기금은 저리의 정책대출로 공공분양이나 임대사업을 하는 사업자가 이용할 수 있다. 임대주택을 짓는 경우 연 2.3~2.8%의 금리로 가구당 5500만~7500만원까지 대출을 받을 수 있다.앞서 지난달 국토부는 부실벌점이 높은 건설사의 선분양을 제한하는 '주택공급에 관한 규칙' 개정안 등을 입법예고했다. 이 개정안 역시 벌점 정도에 따라 분양 시기를 제한해 부실시공사의 선분양으로 인한 소비자 피해를 최소화하도록 했다.제도 개선으로 부실시공이 근절될 것이란 기대가 높지만 일각에서는 실효성이 떨어진다는 지적도 제기된다. 누계평균벌점을 기준으로 하면 벌점이 낮아 처분 강도가 약해지기 때문이다.건설산업지식정보시스템에 따르면 현재 벌점을 받은 업체 대부분은 누계평균벌점이 1 미만이고 가장 벌점이 높은 업체도 4점에 불과하다.국토부 관계자는 이 같은 지적에 대해 ""단 몇 개월이라도 기금 대출을 제한하면 사업에 어려움을 겪게 돼 경각심을 가질 수밖에 없다""며 ""결국 부실 건설사는 시장에서 퇴출될 것""이라고 말했다.▶더 많은 머니투데이 기사보기▶실시간 급상승 기사▶'MT리포트'가 새로 발행되었습니다김사무엘 기자 samuel@mt.co.kr<저작권자 ⓒ '돈이 보이는 리얼타임 뉴스' 머니투데이, 무단전재 및 재배포 금지>"
