,날짜,기사 제목,기사 링크,기사 출처,기사 내용
0,2018-07-29,"33년 권좌 훈센, 논란 속 총선 승리…'5년 더' 집권",https://news.naver.com/main/read.nhn?mode=LSD&mid=shm&sid1=104&oid=001&aid=0010240280,연합뉴스,"잠정집계, 125석 중 100석 휩쓸어…투표율 80.49%로 5년전보다 10%P↑투표 강요 및 매표 논란도 제기돼훈센 캄보디아 총리[AFP=연합뉴스](방콕=연합뉴스) 김상훈 특파원 = 33년간 캄보디아를 통치해온 훈 센(66) 총리가 제1야당을 해체하고 언론의 입을 틀어막은 채 치른 총선에서 승리해 5년 추가 집권의 길을 열었다.훈센 총리가 이끄는 여당인 캄보디아인민당(CPP)은 29일(이하 현지시간) 총선에서 전체 125석의 의석 가운데 100석 이상을 차지한 것으로 잠정 집계됐다고 밝혔다.선거관리위원회의 잠정 집계 결과에서도 CPP가 110∼115석을 차지할 것으로 예상됐다.속 이산 CPP 대변인은 ""총선 결과를 자체 집계한 결과 전체 유효투표의 80% 이상을 석권해 100개 이상의 의석을 차지한 것으로 보인다""며 ""엄청난 승리다""고 말했다.CPP의 강력한 라이벌이었던 제1야당인 캄보디아구국당(CNRP)이 강제 해산돼 총선을 치르지 못한 가운데, CPP에 도전장을 던졌던 군소 신생 정당들은 불과 20여석을 나눠 갖는데 그칠 것으로 보인다.투표율은 80.49%로 최종집계됐다. 이는 애초 선관위가 예측했던 60%보다 20%포인트, 5년 전 선거 당시의 69%보다 10%포인트 이상 높아진 수치다.이로써 야당 및 언론 탄압 논란 속에 재집권한 여당과 훈센 총리에게 더 큰 힘이 실리게 된 반면, 이번 총선을 '엉터리 선거'라고 규정하고 투표 거부 운동을 해온 정부 비판 세력의 노력은 허사가 됐다.훈센 캄보디아 총리[AFP=연합뉴스]훈센 총리는 페이스북 계정을 통해 ""동지들은 민주적인 길을 택했고 그들의 권리를 행사했다""고 의미를 부여했다.유권자 약 830만 명이 등록한 이번 총선에는 훈센이 이끄는 여당인 CPP와 19개의 군소·신생 야당 등 모두 20개 정당 후보들이 출사표를 던졌다.외형상 민주적인 총선이지만 실제로는 여당의 승리가 불을 보듯 뻔한 비민주적인 엉터리 선거라는 비판이 쏟아진다.1985년부터 33년간 캄보디아를 통치해온 훈센이 제1야당을 강제 해산하고 언론에 재갈을 물리면서 사실상 총선 승리 여건을 만들었기 때문이다.훈센은 강력한 라이벌인 CNPR이 외부 세력과 결탁해 정부 전복을 시도한다며 지난해 11월 당을 강제 해산하고 소속 의원들의 정치 참여를 금지했다.또 훈센은 정부에 비판적인 신문인 캄보디아 데일리와 프놈펜 포스트 등에 '세금 폭탄'을 던져 폐간 또는 매각을 유도했고, 총선을 하루 앞둔 28일부터 17개 독립 언론사의 웹사이트에 대한 접속도 차단했다.강력한 야당이 사라진 가운데 투표 강요행위나 금권 선거를 통한 매표(買票) 행위가 이뤄졌을 것이라는 의심의 목소리도 나온다.호주 그리피스 대학의 캄보디아 정치 연구자인 리 모겐베서 교수는 ""1당이 독주하는 총선에서는 유권자를 위협해 투표를 강요하거나 돈으로 표를 사는 행위를 통해 투표율이 부풀려질 수 있다""고 말했다.지난 2013년 총선에서 전체 123석의 의석 가운데 55석을 차지해 68석을 얻은 훈센의 CPP를 위협했던 CNRP 소속 정치인 등은 그동안 투표 보이콧 운동을 펼쳐왔다.이에 맞서 CPP는 투표 보이콧 행위를 '반역행위'로 간주하겠다며 투표 참여를 강요하는 분위기를 만들었다.캄보디아 총선 투표[로이터=연합뉴스]meolakim@yna.co.kr▶놓치면 아쉬운 '핫뉴스'▶퀴즈풀고 상품받고! 뉴스퀴즈쇼 '뉴나'▶네이버 홈에서 [연합뉴스] 채널 구독하기"
1,2018-07-29,111년 만의 미소…일본에서 백제 '금동관음' 첫 공개,https://news.naver.com/main/read.nhn?mode=LSD&mid=shm&sid1=104&oid=437&aid=0000187810,JTBC,"[앵커]금동관음보살입상, 7세기 백제의 가장 아름다운 보살상이 111년 만에 공개됐습니다. 흑백 사진으로만 전해져 왔는데, 알고 보니 일본 소장가가 갖고 있었습니다.윤설영 특파원입니다.[기자]미소를 머금은 자비로운 얼굴.어깨와 허리를 살짝 비틀어 선 자태가 당당합니다.흘러내릴 듯한 옷 주름과 섬세한 신체 곡선이 눈길을 빼앗습니다.7세기 백제에서 만들어진 것으로 추정되는 금동관음보살입상입니다.[이상근/문화유산회복재단 이사장 : (7세기 제작된) 금동대향로 장식 양식과 매우 흡사한 문양을 갖고 있고, 백제 문명이 가장 뛰어난 영향을 끼쳤던 시기라고 평가하고 있고요.]1907년 충남 부여군 규암리에서 출토됐으나 일본인 수집가 손에 넘어갔던 불상은 흑백사진 한장으로만 전해져왔습니다.최근 소장자가 공개를 결정해 111년 만에 언론에 모습을 드러낸 겁니다.지난해 말 도쿄에서 직접 불상을 본 학계 전문가들은 이 불상이 진품이라는 결론을 내렸습니다.[이상근/문화유산회복재단 이사장 : (일본 정부가 국보로 지정하면) 되돌려받기 위해 많은 노력과 절차가 필요한데 (금동관음보살입상은) 개인이 소장하고 있어 상대적으로 국내 반환이 쉬운 여건입니다.]충남도와 부여군은 조만간 정부의 도움을 받아 환수를 위한 본격적인 작업에 들어갈 계획입니다.윤설영(snow0@jtbc.co.kr) [영상취재: 김진광 / 영상편집: 박선호]▶ 라이브 시청은 유튜브로,제보는 뉴스룸으로!▶ 스토리, 라이브, 비하인드! JTBC 소셜스토리Copyright by JTBC(http://jtbc.joins.com)and JTBC Content Hub Co., Ltd. All Rights Reserved. 무단 전재 및 재배포 금지"
2,2018-07-29,"보험사 기다리다 2차 사고…""무료로 견인하세요""",https://news.naver.com/main/read.nhn?mode=LSD&mid=shm&sid1=101&oid=056&aid=0010603678,KBS,"[앵커]운전하다 사고나 고장 등 예기치 못한 상황을 마주했을 때, 보통은 보험회사를 가장 먼저 떠올리곤 하죠.그런데 보험사 차량을 기다리며 현장에서 시간을 지체하는 건 2차 사고의 주된 이유가 되기도 합니다.현명한 대처법을 김나나 기자가 알려드립니다.[리포트]도로 한가운데 멈춰버린 차량, 당황한 운전자가 수신호를 하지만  뒤따르던 트레일러가  그대로 들이받습니다.도로 한편으로 몸을 피하고 비상등을 켜도, 추가 사고를 막기 어렵습니다.사고 차량에 가로막혀 차량들이 줄줄이 멈춰서고, 처리에 시간을 끄는 사이 추가 추돌이 이어집니다.순찰차도 피해를 입고 맙니다.첫 사고는 미미해도 2차 사고는 훨씬 위험할 수 있습니다.고속도로 2차 사고의 경우 치사율이 50%를 넘습니다.사고가 났다면, 몸을 피하는 것 뿐 아니라  차를 안전지대로 옮기는 것도 급선무입니다.하지만 보험사의 안내 지침이  사고를 유발하는 이유가 된다는 지적도 잇따르고 있습니다.사고 현장을 떠나지 말고  보험사 견인차를 기다리라는 건 보험회사의 단골 주문입니다.[사고 신고 직후 OO화재 콜센터(음성변조)  : ""혹시 모르니 사설 견인차량은 이용하지 않도록 주의 부탁드립니다.""]이렇다보니  도로공사 차량이  견인을 해 주려고 해도 거부하는 경우가 많습니다.[유길상/한국도로공사 순찰반  : ""누가 봐도 위험한 지역에 있는데, 차량을 이동 안하고 보험사를 기다리겠다고 말씀만 하실 때는 답답할 때가 엄청 많죠.""]한국도로공사와 연계된  사설 견인차량은 1400여 대,  보험사 견인차량보다  평균적으로 더 빨리 현장에 도착합니다.휴게소나 졸음쉼터 등 안전지대까지 무료로 사고 차량을 견인해 줍니다.다만 일정 거리를 넘어서면  견인 요금을 청구할 수 있기 때문에  일단 가장 가까운 안전지대로 차를 옮겨 해당 보험사를 기다리는 게 좋습니다.KBS 뉴스 김나나입니다.김나나기자 (nana@kbs.co.kr)▶ 네이버 채널 KBS뉴스 구독! 시원하게 털어드립니다▶ ‘TV보다 리얼’한 색다른 뉴스![저작권자ⓒ KBS 무단복제-재배포 금지]"
3,2018-07-29,값비싼 해외 로밍 요금…통신사들 배짱?,https://news.naver.com/main/read.nhn?mode=LSD&mid=shm&sid1=105&oid=056&aid=0010603670,KBS,"[앵커]요즘같은 휴가철, 해외여행을 갈 때도 휴대전화는 필수품 중 하나죠.그런데 정작 휴대전화를 들고 가더라도 비싼 로밍 요금때문에 사용하기 망설여지는 경우가 많습니다.이동통신사들은 여러 이유를 들며 로밍 요금을 낮추기 어렵다고 하는데, 사실일까요?이재희 기자가 따져봤습니다.[리포트]본격적인 휴가철을 맞아 공항이 출국 인파로 북적입니다.해외 여행을 갈 때도 휴대 전화는 필수품이지만 정작 음성통화를 할 경우는 많지 않습니다.비싼 로밍 요금 때문입니다.[정명선/인천시 서구  : ""저희 언니가 푸껫으로 여행을 로밍을 해서 갔는데 30만원이 넘게 나온 거예요 요금이. 그래서 그 뒤로는 로밍을 하면 안 되겠다...""][박지훈/경기도 하남시  : ""빨리 끊습니다 최대한. 최대한 빨리 끊으려고 노력합니다. 요금이 비싸다는 것을 알기 때문에.""]한 통신사의 해외 로밍 요금.미국의 경우 국내 통화료보다 최대 20배 이상 비쌉니다.요금 인하 요구가 잇따랐지만 이통사들은 여러 이유를 대며 사실상 거부해 왔습니다.[윤상필/한국통신사업자연합회 대외협력실장(지난해 5월)  : ""사업자간 이용자수나 통화량이 서로 달라 로밍요금 변경시 국가 간 유불리가 달라질 수 있기 때문에...""]정부의 계속된 통신비 인하 정책에 KT는 지난 5월 12개 나라의 로밍 요금을 국내 통화료 수준으로 낮췄습니다.그런데 까다롭다던 절차는  두 달도 안돼 모두 끝났습니다.외국 사업자와의 협상에 4주, 전산 네트워크 준비에 3주밖에 걸리지 않았습니다.그동안 이통사들이 해온 주장이 무색해지는 대목입니다.하지만 SK텔레콤과 LG유플러스는 여전히 기존 입장만  반복하고 있습니다.[전성배/과학기술정보통신부 전파정책국장  : ""사업자들이 로밍 요금을 개선하기 위한 방안을 아직 신고나 인가 신청을 한 것은 없지만 데이터 요금이라든지 음성요금을 내리도록 지속적으로 희망합니다.""]이통사들이 로밍 사업으로  올리는 매출액은 한 해 3천억 원이 넘습니다.KBS 뉴스 이재희입니다.이재희기자 (leej@kbs.co.kr)▶ 네이버 채널 KBS뉴스 구독! 시원하게 털어드립니다▶ ‘TV보다 리얼’한 색다른 뉴스![저작권자ⓒ KBS 무단복제-재배포 금지]"
4,2018-07-29,늪이 된 마을 '복구 어떻게'…대피소는 환자들로 비명,https://news.naver.com/main/read.nhn?mode=LSD&mid=shm&sid1=104&oid=055&aid=0000662811,SBS,"<앵커>라오스 댐 사고 속보입니다. 저희 취재기자가 이번 사고로 피해를 본 사람들을 만나러 대피소로 찾아갔습니다. 집을 잃고 대피소에 몇 천 명이 모여 있는데 위생문제는 심각하고 치료할 약은 모자라서 사람들 건강이 걱정입니다. 우리 정부 구호대도 출발을 했습니다.현지에서 송인호 기자입니다.<기자>수몰 마을 이재민들이 머물고 있는 사남사이 지역 임시 대피소입니다.방이 부족해 앞마당까지 자리를 깔고 있습니다. 화장실과 목욕시설이 턱없이 부족해 불편이 이만저만이 아닙니다.이 지역 대피소에만 이재민 3천 명가량이 분산 수용돼 있습니다.[후사/수몰 마을 이재민(60) : 많이 불편해요. 물이 차면서 접시와 식기 등이 모두 떠내려가서 아무것도 없어요.]가장 열악한 건 의료환경입니다.고열과 설사 증세로 입원한 어린아이가 주사를 맞고 울음을 터뜨립니다.댐 사고 이재민들이 진료받고 있는 사남사이 구립병원입니다. 워낙 많은 이재민 환자들이 몰려들고 있어서 의약품과 입원실 등 의료관련 시설들이 턱없이 부족한 실정입니다.급성 열성 질환인 뎅기열과 말라리아 환자는 물론 집이 물에 잠긴 순간이 떠올라 악몽에 시달리는 환자도 많습니다.[시티 판/자원봉사 의료진 : 사고 후 정신적 충격을 겪는 환자가 많은데, 헤엄을 치다 나무에 맞아 다친 사람도 있습니다.]수몰 마을 복구는 물이 아직 다 안 빠져 시작도 못 했고 급류에 쓸려 내려온 토사가 곳곳에 늪을 만들어 중장비 반입도 어려운 상황입니다.[박동현/SK건설 라오스 안전부장 : 이쪽으로 진입할 수 있는 육로에 작은 교량들이 있는데, 그 교량을 통해서는 중장비들이 넘어올 수가 없습니다.]이런 가운데 우리 정부의 첫 구호 물품이 도착해 라오스 당국에 전달됐고 우리 의료진 15명으로 구성된 긴급 구호대도 파견돼 내일(30일)부터 활동을 시작할 예정입니다.(영상취재 : 배문산, 영상편집 : 김호진)송인호 기자(songster@sbs.co.kr)​☞ [친절한 경제] 전기료 누진제 걱정 없이 에어컨 '빵빵' 트는 팁!☞ [SDF X 김동식 콜라보] <고르고 고른 인재들> 단독 연재 소설 보러 가기※ ⓒ SBS & SBS Digital News Lab. : 무단복제 및 재배포 금지"
5,2018-07-29,인천공항 개항 이래 2번째 최다 출국…해운대 50만 인파,https://news.naver.com/main/read.nhn?mode=LSD&mid=shm&sid1=102&oid=214&aid=0000861472,MBC,"[뉴스데스크]◀ 앵 커 ▶더위를 식혀주길 기대했던 태풍은 비껴갔고 찌는 듯한 폭염은 보름째 기세가 여전합니다.오늘(29일) 하루 11만여 명이 인천공항을 통해 해외로 나갔고요.부산 해수욕장은 올 들어서 가장 많은 사람이 몰렸습니다.오늘 첫 소식, 이준희 기자입니다.◀ 리포트 ▶오늘 오후 인천 국제공항.넓디넓은 주차장이 차로 꽉 찼습니다.출국장도 인산인해.대기 승객이 꼬리에 꼬리를 물고 이어집니다.[안진수·안상규·안채빈·함미선]""여행을 가는 것만으로도 시원하고 기분이 굉장히 좋습니다.""[박애영·최근혜]""찜통 같은 더위 때문에 저희는 오키나와에 가서 시원한 스쿠버다이빙을 하면서 여름휴가를 보낼 계획입니다.""휴가철 여행객이 몰리면서, 오늘 인천공항을 통해 해외로 빠져나간 사람이 2001년 개항 이래 역대 두 번째로 많았습니다.[박종혁/인천공항공사 공항운영2팀장]""오늘은 출발 여객이 11만 5천여명으로 역대 최고치에 근접할 것으로 보입니다.""해수욕장도 피서객으로 가득 찼습니다.해운대 50만 명, 광안리 46만 명을 비롯해 부산 지역 해수욕장에만 214만 명이 몰렸습니다.[윤한빛·김윤정·김한솔·이규민]""방학이라 친구들이랑 오랜만에 모여서 물놀이 하니까 시원하고 좋은 것 같아요.""멀리 떠나지 못한 사람들은 빌딩 숲 아래에서 물놀이를 즐겼습니다.미끄럼틀에 몸을 맡기고 친구들과 함께 물속에 풍덩 빠집니다.카누에 탄 아이들은 노 젓는 건 아버지에게 맡기고 잠을 청합니다.여름마다 피서지로 각광받는 광명 동굴에도 올 들어 가장 많은 1만 8천여 명이 찾아왔습니다.바깥 기온은 38.2도인데, 동굴 안은 15.8도.입에서 김이 나올 정도입니다.[김영준·김예원·안윤정·김태겸]""밖에서는 엄청 더웠는데 들어와서는 벌벌 떨 정도로 계속 계속 추워져요.""[이재석/인천 계양구]""너무 덥고 애들도 지금 더워서 간지럽고 그러는데, 시원해가지고 좋습니다. 아주… 천국인 것 같습니다. 천국.""영동선을 중심으로 고속도로도 몸살을 앓았습니다.오늘 자정까지 전국의 고속도로를 이용할 걸로 예상되는 차량은 모두 408만 대로, 일요일로는 올 여름 들어 가장 많았습니다.MBC뉴스 이준희입니다.이준희 기자 (letswin@mbc.co.kr )[저작권자(c) MBC (http://imnews.imbc.com) 무단복제-재배포 금지]Copyright(c) Since 1996,MBC&iMBCAll rights reserved."
6,2018-07-29,폭염 속 '진땀' 쏟는 에어컨 수리기사들…처우는 여전,https://news.naver.com/main/read.nhn?mode=LSD&mid=shm&sid1=102&oid=437&aid=0000187799,JTBC,"[앵커]기록적인 무더위에 사람뿐만 아니라 에어컨도 더위를 먹고 있는 듯한 모습입니다. 여기저기서 고장 신고가 몰리면서, 에어컨 수리기사들은 매일 폭염 속, 고된 작업을 벌이고 있습니다.홍지용 기자가 취재했습니다.[기자]아파트 복도 안에 연기가 가득찼습니다.방독면을 쓴 소방관들이 집 안으로 들어갑니다.불이 난 곳은 에어컨 실외기였습니다.과열이 원인이었습니다.폭염이 계속되면서 실외기 고장과 화재도 이어지고 있습니다.실제 열화상 실험 장면을 봤더니 전선이 뜨거워지면서 금세 불이 붙습니다.32도였던 전선 온도는 100도까지 올라갑니다.이런 상황 속에 에어컨 실외기 수리 기사들은 매일 분주하게 작업에 나섭니다.에어컨과 실외기를 하나씩 빠짐없이 살펴보면서 전화까지 받습니다.[찬바람이 안 나오신다는 거예요 아니면…]수리가 끝났지만 점심식사도 미루고 잠시 한손으로 땀을 닦은 뒤 곧바로 다음 집으로 이동합니다.체감온도가 40도에 가까운 폭염 속에서 이동시간까지 합쳐 한 시간에 한대씩 에어컨을 고쳐야 하는 상황입니다.폭염 속 탈진을 피하기 위해 휴식시간을 갖기 쉽지 않다고 말합니다.[김해일/삼성전자서비스센터 수리기사 : 성수기이기 때문에 지금 2시간 더 연 상태거든요. 집에 들어가는 시간 같은 경우 (밤) 9시…]150만 원 정도의 기본급을 받고, 한달에 60건 이상 처리해야 수수료를 받는 구조는 바뀌지 않았다고 수리 기사들은 지적합니다.지난 4월 삼성전자서비스는 수리 기사 5400여 명을 포함한 하청업체 직원 8000명을 정규직으로 직접 고용하겠다고 발표했지만, 아직 결론이 나지 않았습니다.(화면제공 : 서울 광진소방서·구로소방서)홍지용(hong.jiyong@jtbc.co.kr) [영상취재: 김태헌 / 영상편집: 김영선]▶ 라이브 시청은 유튜브로,제보는 뉴스룸으로!▶ 스토리, 라이브, 비하인드! JTBC 소셜스토리Copyright by JTBC(http://jtbc.joins.com)and JTBC Content Hub Co., Ltd. All Rights Reserved. 무단 전재 및 재배포 금지"
