,날짜,기사 제목,기사 링크,기사 출처,기사 내용
30,2010-11-27,1억년 전 '롱다리' 악어 살았다…태국서 새로운 종(種) 확인,https://news.naver.com/main/read.nhn?mode=LSD&mid=shm&sid1=104&oid=003&aid=0003559278,뉴시스,"【서울=뉴시스】박준형 기자 = 태국에서 1억 년 전 긴 다리를 가진 악어가 살았던 것으로 나타났다.27일 미국 폭스뉴스에 따르면 태국 연구원들이 몇 년 전 발견된 악어 두개골 화석을 분석한 결과, 1억여 년 전 새로운 악어종이 살았던 것으로 확인됐다.이 악어는 현대의 악어보다 다리 길이가 길어 매우 빠르게 달릴 수 있었을 것으로 추정된다.또 이빨 형태로 미뤄 볼 때 물고기를 사냥했을 것으로 보인다.앞서 약 15㎝ 길이의 이 화석은 태국 북동부 나콘 라차시마주(州)에서 발견됐으며, 2006년 박물관에 보관됐다.새로운 악어종의 이름은 화석을 처음 발견한 프라틍 진타사쿨리의 성을 따서 '코라토수추스 진타사쿨리(Khoratosuchus jintasakuli)'로 붙여졌다.이번 새로운 악어종 발견은 런던 지질학회지에 게재됐다.jun@newsis.com[뉴시스 이시간 핫 뉴스]ㆍ 소설 대물<11>국소에 혈관주사, 불끈 달아오르게ㆍ ´상승세´ 박지성, 이적설 등장…이번에는 스페인ㆍ [연평도 피격]""폭탄주는 어떤 맛"" 누리꾼 송영길 시장 ´맹비난´ㆍ 뉴라이프론, 서민대출시장의 대안 될까ㆍ ""연평도 포격 배후는 중국…미국 압박용""ㆍ [연평도 피격]정부방식대로면 민간 사망자 위로금 사실상 ´0원´ㆍ ´정신장애인 가족에 이사 강요´ 이웃들 재판회부ㆍ ´슈퍼스타K2´ 참가 최은, 정말 에로배우였네★ 손 안에서 보는 세상, 모바일 뉴시스<저작권자ⓒ '한국언론 뉴스허브' 뉴시스통신사. 무단전재-재배포 금지.>"
31,2010-11-27,울산대왕암 '용의 여의주'에 日소행 추정 '혈침' 발견,https://news.naver.com/main/read.nhn?mode=LSD&mid=shm&sid1=102&oid=003&aid=0003559277,뉴시스,"【울산=뉴시스】고은희 기자 = 문무대왕과 관련된 전설 등이 전해오고 기암괴석과 수령 100년이 넘는 1만5000여 그루의 해송과 곰솔군락이 아름다운 해안 경관을 형성하고 있는 대왕암공원 대왕암에 일제 때 자행한 것으로 추정되는 나무뜸 '혈침'이 발견돼 비상한 관심을 모으고 있다.대왕암공원은 지난 3월 문화재청이 명승으로 지정 예고된데다 국토해양부 선정 '아름다운 해안누리길'(7월21일)로 선정된 바 있다.대왕암은 주변 바위들이 검은데 반해 황금색을 띤 용의 형태로 용추암, 용등, 용두목 등으로 구성돼 있다.대왕암을 비롯한 동구지역 문화재를 연구 보존하는 (사)울산동구향토사연구회(연구회)는 대왕암 구석구석을 뒤져 나무뜸 혈침을 발견했다. 혈침은 용의 주요 혈인 용의 입과 관자놀이, 여의주로 불린 3곳에 박혀 있었다.혈침에는 오래도록 썩지 않도록 콩기름을 부어 바른 듯 냄새를 맡으면 기름냄새가 났고, 이 사실은 지역의 등용사 본명스님과 백성스님의 확인 절차를 거쳤다고 연구회측은 전했다.연구회측은 20여 년간 전국에서 총 300여개의 쇠말뚝을 제거해온 민족정기선양위원회(소윤하 위원장)의 자문 결과, 일제가 용으로 상징되는 우리나라의 기를 꺾기 위해 혈침을 놓은 것으로 추정된다고 전했다.연구회가 혈침을 찾아 나서게 된 것은 최근 지역의 유명 풍수전문가로부터 '용의 형상을 한 대왕암의 여의주에 일제가 쇠말뚝을 박지 않았겠느냐는 의문이 제기되면서부터다.대왕암 인근에 사무국을 두고 대왕암을 조사해온 연구회는 예부터 용의 여의주로 불려온 부분을 집중적으로 살폈고, 지난 12일 혈침을 발견하기에 이르렀다.연구회는 공식적인 전문기관의 고증을 거쳐 지역문화단체 및 지자체와 협력해 민족정기 바로세우기를 진행해 나간다는 입장이며, 기순환이 되는 시점인 12월22일 동짓날 혈침을 뽑아낼 계획이다.gogo@newsis.com[뉴시스 이시간 핫 뉴스]ㆍ 소설 대물<11>국소에 혈관주사, 불끈 달아오르게ㆍ ´상승세´ 박지성, 이적설 등장…이번에는 스페인ㆍ [연평도 피격]""폭탄주는 어떤 맛"" 누리꾼 송영길 시장 ´맹비난´ㆍ 뉴라이프론, 서민대출시장의 대안 될까ㆍ ""연평도 포격 배후는 중국…미국 압박용""ㆍ [연평도 피격]정부방식대로면 민간 사망자 위로금 사실상 ´0원´ㆍ ´정신장애인 가족에 이사 강요´ 이웃들 재판회부ㆍ ´슈퍼스타K2´ 참가 최은, 정말 에로배우였네★ 손 안에서 보는 세상, 모바일 뉴시스<저작권자ⓒ '한국언론 뉴스허브' 뉴시스통신사. 무단전재-재배포 금지.>"
32,2010-11-27,"송영길 ""'폭탄주' 논란, 치졸한 말꼬리잡기""",https://news.naver.com/main/read.nhn?mode=LSD&mid=shm&sid1=100&oid=001&aid=0004790718,연합뉴스,"(인천=연합뉴스) 정묘정 기자 = 송영길 인천시장은 27일 자신의 '폭탄주' 발언을 둘러싼 한나라당의 비난에 대해 ""치졸한 말꼬리잡기""라고 반박했다.송 시장은 이날 오전 자신의 트위터에 올린 글에서 ""북의 도발에 의해 희생된 우리의 아들들과 민간인에 대한 안타까움을 가지고 사태 수습을 위해 동분서주하고 있는 피해 지역 책임자를 말꼬투리를 잡아 비난하기에 열중할 때가 아니라고 본다""면서 ""지금 즉시 희생자 김치백과 배복철씨에 대한 국가안보관리실패 책임을 지고 국가배상이 실시되어야 할 것""이라고 주장했다.이 같은 입장 표명은 한나라당이 북한의 포격을 당한 연평도 현장에서 송영길 시장이 '폭탄주' 발언을 했다는 논란과 관련, 송 시장의 사퇴를 요구하며 맹공을 가한 데 따른 것이다.윤관석 인천시 대변인도 ""송 시장이 현장에서 '폭탄주'라는 단어를 사용한 것은 사실이지만 해당 발언은 주택가마저 포격을 당한 데 대해 침통해하는 분위기 속에서 나온 것""이라면서 ""앞뒤 맥락은 모두 자르고 말꼬리를 잡아 공격하는 것은 치졸한 행동""이라고 말했다.윤 대변인은 또 한나라당의 비판에 대해 ""시간이 지날수록 우리군의 대응책 관련 문제점이 드러나니 국면을 호도하려는 정치 공세""라면서 ""연평도 주민이 진정으로 원하는 것은 이런 말장난이 아니라 한시라도 빨리 거주 및 안전 대책을 마련하는 것""이라고 강조했다.myo@yna.co.kr<뉴스의 새 시대, 연합뉴스 Live><모바일 애플리케이션><포토 매거진><저작권자(c)연합뉴스. 무단전재-재배포금지.>"
33,2010-11-27,부산서 중학생들 승용차로 광란의 질주,https://news.naver.com/main/read.nhn?mode=LSD&mid=shm&sid1=102&oid=001&aid=0004790648,연합뉴스,"(부산=연합뉴스) 민영규 기자 = 부산에서 중학교 3학년 학생이 친구들을 승용차에 태운 채 30분가량 광란의 질주를 하다 경찰에 붙잡혔다.27일 부산 남부경찰서에 따르면 운전면허가 없는 김모(14.중3)군은 26일 오후 9시10분께 부산 남구 용호동 백운포 고개에서 친구 4명을 태운 채 티코 승용차를 몰다 남부경찰서 용호지구대 소속 순찰차의 정지명령을 어기고, LG매트로시티 아파트까지 10여㎞를 질주했다.김군은 이어 아파트 단지 안을 맴돌다 오후 9시40분께 근처 용호부두 근처에 차를 세우고 나서 달아나다 출동한 경찰관들에게 붙잡혔다.김군은 도주과정에서 시속 100㎞에 가까운 속도로 차를 운전하면서 앞을 가로막는 순찰차를 피하려고 중앙선을 침범하는 등 아찔한 순간을 여러 번 연출해 순찰차 10여대가 추격에 동원됐다고 경찰은 밝혔다.경찰 조사 결과 김군은 지난 25일 오후 9시께 부산 남구 용호동 부산환경공단 남부사업소 주차장에서 친구가 들고 온 열쇠를 이용해 친구 외조부 소유의 티코 승용차를 몰고 나왔고, 이후 도난신고가 접수된 26일 오후 9시께까지 용호동 일대를 돌아다닌 것으로 밝혀졌다.경찰은 김군을 도로교통법 위반 혐의(무면허운전)로 입건할 예정이다.youngkyu@yna.co.kr[관련기사]▶ 부산서 역주행 택시-승용차 충돌..2명 부상▶ <스웨덴인 스위스서 시속 290km 과속하다 잡혀>▶ 무서운 10대들..경찰차 들이받고 '광란 질주'▶ <택시기사 5㎞ 추격전..음주뺑소니범 붙잡아><뉴스의 새 시대, 연합뉴스 Live><모바일 애플리케이션><포토 매거진><저작권자(c)연합뉴스. 무단전재-재배포금지.>"
34,2010-11-27,故 김치백씨 老母 뒤늦은 통곡,https://news.naver.com/main/read.nhn?mode=LSD&mid=shm&sid1=102&oid=001&aid=0004790735,연합뉴스,"연평도 희생자 故 김치백씨 老母 뒤늦은 통곡    (인천=연합뉴스) 이지헌 기자 = 27일 연평도 포격 민간인 희생자의 빈소가 차려진 인천 길병원 장례식장에서 故 김치백씨의 노모 황미녀(83)씨가 아들의 영정 앞에서 오열하고 있다. 2010.11.27    pan@yna.co.kr유족 ""충격받으실까 봐 늦게 알려""(인천=연합뉴스) 이지헌 기자 = 북한의 포격에 숨진 민간인 희생자 고(故) 김치백(61)씨의 노모가 뒤늦게 아들의 사망 소식을 접하고 충격을 받아 주변을 더욱 안타깝게 하고 있다.27일 오전 11시30분께 아들의 모습을 보고자 분향실에 다시 들어선 노모는 영정 사진을 부여잡고 통곡했다.""우리 아들 돌려놔. 아이고 아이고, 나는 아들만 보고 살았는데… 아이고 불쌍해, 어쩌고 산당가, 내 가슴을 누가 열어주나, 우리 아들 살려놓소 나는 못 살것어…""김씨의 누이와 부인도 ""어머님 진정하세요""하며 옆에서 같이 오열했다.김씨의 노모 황미녀(83.여)씨가 아들의 사망 사실을 처음 알게 된 것은 김씨의 사망 소식이 전해진 지 이틀이 지난 26일 저녁.유족 김영길(45)씨는 ""퇴원하신지 얼마 되지도 않은 상태에서 차마 자식의 소식을 전해 드릴 수 없었다. 장례를 마치고 나서 말씀드리려 했지만 장례 일정이 늦어질 수도 있어 어제 빈소로 모셔왔다""고 말했다.전남 영광에서 홀로 사는 노모는 노환으로 1주일간 입원해 있다가 21일 퇴원해 몸이 쇠약해졌던 상황이었다.막내딸과 사위는 26일 영광으로 가 ""인천 사는 형님네 갑시다""라고 말하며 노모를 모셔왔다.오후 8시께 인천 길병원에 도착한 노모는 그곳이 아들의 빈소임을 깨닫고 억장이 무너졌다.김영길씨는 ""유족들도 모두 눈물을 억지로 참고 있는데 노모가 저러시는 모습을 보니 견디기 어렵고 목이 멘다""고 말했다.고인의 시신은 훼손 상태가 심해 노모에게 차마 보여 드릴 수 없는 상황이라고 유족은 전했다. 확증을 얻고자 현재 DNA 검사 결과를 기다리는 중이다.한편 유족들은 유족 대표와 인천시 간 의사자 예우와 보상협의 문제로 고인의 장례 일정을 잡지 못하고 있다.pan@yna.co.kr[관련기사]▶ <김총리 ""이런일 생겨 죄송..대책 마련하겠다"">▶ ""팔순 노모는 아들 숨진지도 몰라""..고향마을 침통▶ 北도발 민간인 희생자 분향소 조문 발길 이어져▶ <北 포격 민간인 희생자 빈소…유족'오열'>(종합)▶ 민간 희생자 유족 ""군 초기대응 미흡 피해 키워""<뉴스의 새 시대, 연합뉴스 Live><모바일 애플리케이션><포토 매거진><저작권자(c)연합뉴스. 무단전재-재배포금지.>"
35,2010-11-27,강원 도로 '눈길' 교통대란..접촉사고 속출,https://news.naver.com/main/read.nhn?mode=LSD&mid=shm&sid1=102&oid=001&aid=0004790662,연합뉴스,"춘천시 제설행정 엉망..눈 1㎝에 도로마비    (춘천=연합뉴스) 이해용 기자 = 27일 오전 강원 춘천시 진입로에서 경찰이 눈길에 미끄러진 차량들을 밀며 교통정리하고 있다. 이날 내린 눈은 1.3㎝에 불과했으나 진입로와 고갯길에서 초동 제설작업이 제대로 이뤄지지 않아 시민과 운전자들의 원성을 샀다. 앞서 기상청은 지난 26일 도내에 눈이 내릴 것이라고 예보했다.2010.11.27    dmz@yna.co.kr영동고속도 지정체 극심..도심 차량도 '엉금엉금'당국 제설 늑장..운전자들 큰 불편(춘천=연합뉴스) 이상학 기자 = 27일 오전 강원 춘천과 횡성 등 영서지역을 중심으로 눈이 내리면서 강원도내 주요 고속도로와 국도에 접촉사고가 잇따라 큰 혼잡이 빚어졌다.강원지방기상청에 따르면 이날 오전 10시 현재 내린 눈의 양은 대관령 1.8cm, 춘천 1.3cm, 양구와 인제 각 2cm, 원주 1cm, 철원 0.2cm 등을 기록했다.이처럼 눈이 내려 고속도로와 도심 도로가 빙판길을 이루자 차량의 접촉사고가 속출, 시민들이 큰 불편을 겪었다.춘천시 제설행정 엉망..눈 1㎝에 도로마비    (춘천=연합뉴스) 이해용 기자 = 27일 오전 강원 춘천시 진입로에서 경찰이 눈길에 미끄러진 차량들을 밀며 교통정리하고 있다. 이날 내린 눈은 1.3㎝에 불과했으나 진입로와 고갯길에서 초동 제설작업이 제대로 이뤄지지 않아 시민과 운전자들의 원성을 샀다. 앞서 기상청은 지난 26일 도내에 눈이 내릴 것이라고 예보했다.2010.11.27    dmz@yna.co.kr특히 강원 횡성군 둔내면 삽교리 인근 영동고속도로 인천방면에는 눈이 쌓이면서 접촉사고가 잇따르자 차량이 뒤엉겨 극심한 지정체 현상이 빚어졌다.시민 김모(36.강릉)씨는 ""결혼식에 참석하려고 영동고속도로 서울 방향 둔내터널을 빠져나오다 2~3km 전방 내리막 도로가 빙판길로 변해 곳곳에 다중 추돌사고가 발생해 1시간가량 오가지 못하고 있다""며 ""도로당국의 늑장 대응에 분통이 터진다""라고 말했다.경찰과 도로공사는 제설작업과 함께 접촉사고 차량을 견인하는 한편 면온IC 방향으로 빠져나가 우회도로를 이용해 줄 것을 당부하고 있다.도심 도로도 상황은 마찬가지여서 춘천지역에서는 제설작업이 미처 이뤄지기도 전에 눈이 도로와 골목길에 쌓여 차량이 거북이 운행을 했다.호반순환도로 과선교나 온의동 닭갈비촌에서 칠전동 방향 오르막 도로에는 제설작업이 제때 이뤄지지 않아 차량의 접촉사고가 속출해 주차장을 방불케 했다.춘천시는 현재 70t의 염화칼슘과 7대의 제설차량을 동원해 도로 등에 뿌리고 있지만, 교통 혼잡을 막기에는 역부족이었다.눈 내리는 도로..차량들 '엉금엉금'    (춘천=연합뉴스) 이해용 기자 = 27일 오전 눈이 내리는 강원 춘천시내에서 차량들이 거북이 운행을 하고 있다. 2010.11.27    dmz@yna.co.kr    http://blog.yonhapnews.co.kr/dmzlife춘천시 관계자는 ""눈이 내리면서 시내 74개 노선에 대해 제설작업을 하는데 어려움이 많다""며 ""언덕길 등 차량 통행이 원활하지 않은 곳에 긴급 제설작업을 진행 중""이라고 말했다.기상청 관계자는 ""기압골의 영향으로 강원 영서와 산간지역을 중심으로 눈이 내렸다""며 ""눈은 오후 3시께 모두 그칠 것으로 예상되며 이후 날씨는 더 추워져 교통안전 등에 특히 주의해야 한다""라고 말했다.한편, 이날 최저기온은 대관령 영하 10도, 설악산 영하 8.6도, 인제 영하 6.6도, 홍천 영하 5.6도, 춘천 영하 5도 등을 기록했다.hak@yna.co.kr<뉴스의 새 시대, 연합뉴스 Live><모바일 애플리케이션><포토 매거진><저작권자(c)연합뉴스. 무단전재-재배포금지.>"
36,2010-11-27,"일본, 대북경계 태세 고조",https://news.naver.com/main/read.nhn?mode=LSD&mid=shm&sid1=104&oid=052&aid=0000326638,YTN,"[앵커멘트]한미 합동 군사훈련이 하루 앞으로 다가오면서 일본 열도가 대북 경계태세의 고삐를 바짝 죄고 있습니다.일본 국회는 대북 비난 결의안을 채택했고 정부는 모든 각료들에게 군사훈련이 끝나는 날까지 비상 대기령을 내렸습니다.일본 기업들의 한국행 출장 자제에 이어 한국행 수학여행의 취소도 잇따르고 있습니다.도쿄 김상우 특파원 연결해 자세히 알아봅니다.먼저 일본 국회가 대북 비난 결의안을 채택했다면서요?[중계 리포트]일본의 상하원격인 참의원과 중의원이 어제 본회의를 열어 북한의 연평도 포격을 강력하게 비난하는 결의안을 만장일치로 채택했습니다.일본 국회는 이번 결의에서 북한이 연평도 민간인 거주지에 ""무차별적이고 충격적인 폭력 행위""를 가했다며 ""일본은 민간인 피해까지 초래한 북한의 무력 도발을 용납할 수 없는 것으로 간주한다""고 선언했습니다.결의안에는 또 한국과 한국 국민에 대한 애도의 표현도 포함됐습니다.또 북한에 대해 도발 행위와 핵 야욕을 포기하고 해묵은 일본인 납치 문제를 해결할 것을 촉구했습니다.간 나오토 총리는 결의안 채택 후 관련 국가와 협력해 유엔 등의 여러 채널을 통해 ""이번 도발을 단호히 다룰 것""이라고 밝혔습니다[질문]일본 기업들의 한국행 출장 자제에 이어 이번에는 한국행 수학여행의 취소도 잇따르고 있나보죠?[답변]혹시나 하는 우려 때문에 그렇습니다.연일 연평도의 참혹한 모습이 일본 방송을 통해 나오니까 일본인의 입장에서는 걱정이 클 수밖에 없는 것입니다.구마모토현의 '도료 고교'가 다음달 2일에서 6일로 예정됐던 한국 수학여행 계획을 취소했고 니가타 지역의 니가타 공고와 무라마쓰 고교도 다음달초로 계획했던 한국 수학여행을 가지 않기로 했습니다.이 가운데 무라마쓰고는 통일전망대에 갈 예정이었습니다.학교 측의 설명을 직접 들어보시겠습니다.[녹취:야마모토 히사시, 무라마쓰 고교 교감]""귀중한 학생을 맡고 있기 대문에 학생의 안전을 최우선적으로 감안했습니다. 정말로 유감스럽지만 중지했습니다.""엔고로 줄을 잇던 일본인들의 한국행 여행도 다소 주춤 거리는 분위기입니다.전체적으로 볼 때는 큰 타격은 아니지만 일본인들의 한국행 여행 취소가 잇따르고 있습니다.한국 여행객의 말을 잠시 들어보시겠습니다.[인터뷰:도쿄 시민]""모처럼 (한국) 갑니다. 그렇지만 조금 무섭습니다. 걱정됩니다.""[인터뷰:도쿄 시민]""불안이 없지 않은 것은 아닙니다만 정말 (대북 공포) 실감이 안납니다.""[질문]한미 합동 군사훈련이 하루 앞으로 다가오면서 일본 정부가 대북 경계태세의 고삐를 바짝 죄고 있다면서요?[답변]정부의 초동 대응이 늦었다고 언론과 야당으로부터 집중포화를 받은 간 나오토 총리는 내일부터 실시되는 한미합동훈련기간 전 각료에 대기 지시를 내렸습니다다음달 1일까지 서해에서 실시되는 한미합동군사훈련 기간 중 모든 각료들은 도쿄를 떠나지 말고 긴급사태가 발생해 관방장관이 소집할 경우 1시간 내 담당 성청에 나오도록 지시했습니다.간 총리는 북한 도발 관련 보고를 일본내 보도가 나온 뒤에야  받은 것은 물론 보고 받은 뒤에도 관저에 바로 나오지 않는 등 사건 발생 이후 1시간 10분 가량 관저에서 상황을 파악하고 대책을 마련할 정치인이 아무도 없었다는 비판을 받고 있습니다.일본정부는 이같은 총리 지시를 긴급히 내리고 한국내 일본인의 신속한 피난을 확보하기 위해 자위대법 등의 개정도 적극 검토하기로 했습니다.또 북한 등의 군사적 동향에 대한 정보 수집도 대폭 강화하기로 했습니다.이를 위해 군사정보 수집 관련 인력을 대폭 증원하고,내년도 예산안에 정보수집위성을 개발하는 예산, 약 800억 원을 편성하는 등 방위력 재점검에 착수했습니다.지금까지 도쿄에서 YTN 김상우[kimsang@ytn.co.kr]입니다.[관련기사]▶ 유럽, 한미합동훈련에 촉각▶ ""중국, 한미 연합훈련 앞두고 진퇴양난""▶ 일 산케이, ""한국군 뜻밖에 약해""▶ 미 방송, ""한반도에 다시 긴장 고조""▶ ""미국인 2/3, 한반도서 곧 전쟁 발발 가능""☞ [다운로드] 생방송과 뉴스속보를 한 눈에...YTN뉴스ON☞ YTN 긴급속보를 SMS로!☞ 스마트폰으로 즐기는 24시간 뉴스의 세계...YTN 어플리케이션[저작권자(c) YTN & Digital YTN. 무단 전재-재배포 금지]"
37,2010-11-27,이건희 회장 ‘법원 기망’ 수사 본격화,https://news.naver.com/main/read.nhn?mode=LSD&mid=shm&sid1=101&oid=028&aid=0002070550,한겨레,"[한겨레]검찰 ‘SDS·에버랜드 이면약정서’ 관련 고발인 조사검찰이 이건희(68) 삼성전자 회장의 ‘법원 기망행위’에 대한 본격 수사에 들어갔다.서울중앙지검 형사7부(부장 김창희)는 26일 ‘법원에 거짓자료를 제출했다’며 이 회장을 고발한 경제개혁연대의 한 연구원을 고발인 자격으로 불러 조사했다.지난 2008년 삼성 에스디에스(SDS)와 에버랜드의 주식을 헐값으로 발행한 혐의(배임)로 기소된 이 회장은 1심 판결을 앞두고 “손해발생 여부를 떠나 공소장에 피해액으로 기재돼 있는 2509억원을 회사에 지급한다”는 ‘양형 참고자료’를 재판부에 냈다. 그러나 여러 차례 유·무죄가 엇갈리는 우여곡절 끝에 유죄 인정 금액이 227억원으로 줄어들자 이 회장은 차액인 2282억원을 두 회사에서 돌려받았다. 판결 결과에 상관없이 공소장에 기재된 액수를 변제하겠다는 애초 약속을 어긴 것이다.이에 경제개혁연대는 이 회장에게 2282억원을 돌려준 삼성 에스디에스와 에버랜드의 전·현직 사장을 배임 혐의로 고발했으나, 이들 회사는 “사후 정산 약정서에 따라 돈을 돌려받았다”고 주장했다. 이는 법원에 낸 양형 참고자료를 부정하는 ‘이면 약정서’가 있었다는 뜻이다.이와 관련해 지난 9월 서울중앙지검 금융조세조사1부(부장 이석환)는 “피해금의 지급과 사후 정산에 관해 별도로 이 회장 쪽과 두 회사가 작성한 세부약정서를 기초로 판단함이 상당하다”며 무혐의 처분했지만, 경제개혁연대는 이를 근거로 이 회장을 ‘위계에 의한 공무집행 방해’ 혐의로 검찰에 고발했다. 검찰은 고발인 조사와 관련자료를 검토한 뒤 이 회장을 조사할 방침인 것으로 알려졌다. 김태규 기자dokbul@hani.co.kr세상을 보는 정직한 눈 <한겨레>  [한겨레신문 구독|한겨레21 구독]공식 SNS 계정: 트위터www.twitter.com/hanitweet/ 미투데이http://me2day.net/hankyorehⓒ 한겨레신문사, 무단전재 및 재배포 금지<한겨레는 한국온라인신문협회(www.kona.or.kr)의 디지털뉴스이용규칙에 따른 저작권을 행사합니다.>"
