,날짜,기사 제목,기사 링크,기사 출처,기사 내용
19,2010-11-27,여기가 군대야? 다 큰 대학생한테 '점호'라니,https://news.naver.com/main/read.nhn?mode=LSD&mid=shm&sid1=102&oid=047&aid=0001974893,오마이뉴스,"[오마이뉴스 안미소 기자]'합격' 통보를 받고 미소가 번졌다. 회사 합격이냐고? 그게 아니고 기숙사 합격이다. 그게 뭐 그리 대단하냐고 할지도 모르겠다. 하지만 기숙사 입사 선발에서 탈락한 두 번의 쓰라린 경험이 있었던 나에겐 대단한 기쁨이다.이렇게 얘기하고 보니 기숙사가 무슨 굉장한 경쟁을 치르고 들어가는 곳 같다. 실로 대학생들에게 기숙사에 들어간다는 것은 치열한 경쟁에 통과하는 것과 같다.대학 1, 2학년 때 받은 매우 저렴(?)한 학점과 실 거주지가 인천이라는 수도권 소속 때문인지 기숙사는 나를 밀어내기만 했다. 그랬던 내가 졸업을 코앞에 두고 겨우겨우 기숙사에 들어가게 된 것이다. 그것도 여름방학 두 달간 말이다.헛웃음이 나왔다. ""에휴, 취업도 안 된 마당에 기숙사에 처박혀서 공부나 해야겠다."" 그렇게 대학 말년에 나의 기숙사 생활은 시작되었다.여기가 군대야? 다 큰 대학생한테 '점호'라니▲내가 두 달 동안 머물던 기숙사. 450여 명을 수용하고 있다.ⓒ 최선지'기숙사 창문을 열면 멋진 남자가 서 있고, 둘이 달빛 아래 밀담을 나눈다'는 나의 기숙사 로망은 입사한 바로 그날 밤 산산조각이 났다. 기숙사 창문을 여니 축산 농가가 있다는 뒷산 어딘가에서 구수한 소똥 냄새가 풍겼다. 술을 거하게 드신 것 같은 새내기들은 기숙사 앞마당에서 데시벨 측정 욕구를 불러일으키는 우렁찬 목소리로 떠들고 있었다.무엇보다 나를 '뜨악'하게 만든 것은 밤 12시에 난데없이 찾아온 사감 선생이었다. 자정이 되면 불시에 사생들이 방에 제대로 안착(?)해있는지 검사하는 '점호'였다. 중학교 때 극기훈련 가면 밤마다 교관들이 분위기 잡으면서 실시하던 그것을 성인이 돼서도 해야 한다니….한 달에 단 8회로 제한된 외박과 야간출입 허가증도 여간 귀찮은 것이 아니었다. 기숙사 홈페이지에 사유를 쓴 다음 출력해서 행정실에 제출해야 했기 때문이다. 제출해야 하는 시간도 오후 아홉 시까지라 시간을 놓치기라도 하면 영락없이 벌점이었다. 외박 한 번이면 벌점 1점이고, 8점이면 강제퇴사이기 때문에 학생들은 벌점에 벌벌 떨었다.나는 어차피 졸업이라 벌점이 그득해도 상관없다는 심정으로 외박과 야간출입을 자유롭게 남발하여 주었다. 그랬더니 어느 날부터 점호하러 들어오는 사감 선생은 내가 이름을 말하기 전에 이미 나의 이름을 알고 있었다.예전에 기숙사에 살던 한 독일 친구가 기숙사의 'curfew(통금시간)'를 자기는 도무지 이해할 수 없다고 불만을 토로하던 것이 생각났다. 강한 책임의식과 자기 신뢰를 가졌다는 독일인인데, 이런 기숙사 제도들이 오죽 답답했을까.▲ 기숙사 복도학생들이 사용하는 물건들이 신발장 위에 쌓여 있다. 신발장 정리정돈을 잘 하거나 남의 분실물을 찾아주는 등 모범적인 행위를 할 경우 상점으로 2점을 받는다.ⓒ 최선지그래도 고시원이나 원룸보다는 낫지그러나 이 모든 불평불만에도 기숙사는 참으로 고마운 존재다. 나뿐만 아니라 모든 학생들에게 그럴 것이다. 한 학기에 50만 원쯤(4인실)하는 저렴한 기숙사비는 자유의 속박에서 오는 불만을 상회하고도 남는다. 기숙사는 학교와의 접근성과 안전성이란 측면에서 주변의 원룸이나 고시텔보다 학생들이 더 선호하는 주거 공간이기도 하다.학교가 경기도로 이사 온 후 우리 학교 학생들에게 거주지 문제는 늘 골칫거리였다. 과거 한남동에 있을 땐 학교 주변에서 이태원 주변까지 싼 하숙집들이 많았고, 서울이라 통학하기도 비교적 쉬었다. 하지만 이전 후로는 통학이 어려워져 많은 학생들이 자취를 생각해야 했는데, 아파트 단지들이 즐비한 학교 앞은 초기에 원룸이나 고시원이 많지 않았고 가격도 한남동보다 비쌌다.다행히 지금은 고시원이나 원룸이 학교 주변에 많이 생겨서 그나마 학생들의 고민을 덜어주고 있기는 하다. 가격도 고시원 30만 원대, 원룸 40만 원대까지 낮아졌다고 한다. 하지만 원룸의 경우 방값이 40만 원이지 전깃세, 물세, 밥값 등 생활비를 고려하면 50만 원이 훌쩍 넘는다.고시원은 또 어떤가. 친구 고시원에 놀러 갔다가 대각선으로 누워 잠을 자야 했던 황당한 경험이 있다. 개미굴 같은 고시원에 불이라도 나서 모두 동시에 방문을 열면, 그 문들로 통로가 막혀 모두 사각의 틀 안에 갇히게 되는 끔찍한 상황을 상상하기도 했었다. 화재나 성폭행 등에 취약한 고시원의 안전문제는 언론에서 숱하게 지적됐지만 쉽게 변하지 않는다.학생 복지가 별건가... 기숙사는 복지다!▲민자 기숙사 전경. 지하 1층 지상 10층 건물의 이 기숙사는 학생 1천여 명을 수용하고 있다.ⓒ 최선지결국 대학 말년에 짧게나마 기숙사에서 생활해 본 내 경험에 따르면, 대학생들에게 기숙사만큼 좋은 곳이 없다.내가 다닌 학교에도 작년에 기숙사 수용 인원을 늘린다며 민자기숙사가 들어섰다. 하지만 형편이 어려운 학생들에겐 그림의 떡이다. 기존의 기숙사보다 가격이 두 배 이상 높기 때문이다.민간 자본으로 건설하고, 투자비를 회수할 때까지 학생들에게서 받은 기숙사비로 운영하는데, 빠른 기간에 투자비를 회수하기 위해 기숙사비는 높아질 수밖에 없다는 문제가 있다.실제로 우리 학교 민자기숙사는 한 학기 이용료가 194만 원(1인실)인데, 일부 언론에서 200만 원이 넘는다고 보도한 서울 K대 민자기숙사비보다는 낮지만 거의 비슷한 수준이다(물론 우리는 여기에 1식이 포함돼 있긴 하다). 1회 식사를 제외하면 한 달에 50만 원꼴인데, 이는 최신 시설로 꾸며진 원룸가격과 맞먹는 수준이다.사실 기숙사 가격은 학교 밖 원룸이나 고시원의 그것과 비교할 대상이 아니라고 생각한다. 학교 기숙사는 수익이 목적이 아니라 학생들이 학업에 전진할 수 있도록 주거 문제를 해결해주는 복지 차원의 서비스이기 때문이다.학생복지가 별건가. 학생들이 좋은 환경에서 공부하고 생활할 수 있도록 학교가 지원하는 것이다. 장학금도, 교환학생 혜택도 좋지만 저렴하고 안전한 기숙사에서 의식주 해결하는데 어려움 느끼지 않는 것만 한 복지가 대학생들에게 어딨겠는가.지금은 대부분의 대학 기숙사가 전교생 1만여 명 내외에서 1천 명 정도의 수용인원을 받고 있는 것으로 안다. 너무 적다. 이제라도 대학들과 정부 차원에서 학생들의 주거문제에 좀 더 책임있는 자세를 보였으면 한다.▲ 민자 기숙사 체력단련실민자 기숙사에는 일반 기숙사에 없는 체력단련실과, 세미나실, 식당 등이 있다. 학생들은 돈만 있으면 민자 기숙사에 들어가길 원한다.ⓒ 최선지[최근 주요기사]☞ '북한 응징! 전쟁 불사!'의원들이 참전할 건가☞ [아이폰 1년] ""열심히 쓴 제 기사 좀 봐주실래요?""☞ '깔세'도 못내면 움막행... 한겨울엔 물병 껴안고 덜덜☞ [유러피언드림] ""양육 내팽개친 정부, 생각 바꿔야""☞ [엄지뉴스] 메뉴판 쓰느라 고생 좀 했겠어요☞ 교과부와 검찰의 칼, 다시 김상곤 겨누나☞ [E노트]""전략적 인내의 파탄, 미 대북정책을 재고하라""[☞ 오마이 블로그][☞ 오마이뉴스E 바로가기]- Copyrights ⓒ 오마이뉴스, 무단 전재 및 재배포 금지 -"
20,2010-11-27,"""연평도 남은 아빠 무사하길"" 잠 못 이루는 아이들",https://news.naver.com/main/read.nhn?mode=LSD&mid=shm&sid1=102&oid=055&aid=0000193987,SBS,"<8뉴스><앵커>연평도에서 빠져나온 주민들의 고달픈 피난살이가 벌써 닷새째로 접어들고 있습니다. 당시의 충격 때문에 잠도 이루지 못하는 불안한 시간이 계속되고 있습니다.정 연 기자가 주민들과 함께 밤을 지새면서 그 심정을 담아왔습니다.<기자>연평도를 빠져 나온 주민들이 머물고 있는 인천의 한 찜질방.지난 25일까지만 해도, 이곳에 있던 주민들은 저처럼 이렇게 찜질복을 갈아입고 모여 있곤 했습니다.하지만 찜질하러 왔냐고 비꼬는 철없는 인터넷 댓글은 충격적이었습니다.[안세연/중학생 : 우리가 놀고 있는 줄 아니까 놀고 있지 않다는 것을 보여 주려고, 찜질복 안 입어요.]폭격 당시의 충격이 아직도 생생한 주민들, 대부분 불면증에 시달려 찜질방은 밤 늦도록 잠이 들지 못합니다.새벽 두시가 넘어서야 억지로 눈을 붙여봅니다.집으로 언제 돌아갈 수 있을지 기약없이 날은 또 밝았습니다.잠에서 깬 천진난만한 아이들이 피난 생활의 고단함을 잠시나마 달래줍니다.[(학교 안 가니까 기분이 어때?) 좋아요! (왜 좋아요?) 노니까 좋죠.]장난기 가득한 6살 재민이.일자로 자른 앞머리가 눈에 띱니다.폭격을 피해 방공호에 숨어있다가, 그만 머리카락을 태운 겁니다.[머리카락을 촛불에 갔다댔어?][재민이 할머니 : 촛불에 머리카락을 데어서 여기와서 잘라줬어. 미워도 어떡해 할 수 없지]연평도에 남아 있는 아빠, 딸은 자나깨나 아빠 걱정입니다.[건강한 모습으로 (국가를) 지켰으면 좋겠고 아무도 다치지 않고 무사히 훈련해서 끝났으면 좋겠다는 생각 밖에 안해요.](편집 : 최은진, vj : 강수진)정연cykite@sbs.co.kr관/련/정/보◆ 군 ""기계로만 글씨 새긴다는 북한 주장 거짓 입증""◆ 이번에도 손으로 쓴 ①…천안함 어뢰 1번과 유사?◆ 북 ""민간인 사망 유감, 인간방패 형성한 남측 책임""◆ ""북, 서해NLL 인근 8전대에 준전시상태 하달""[SBS기자들의 생생한 취재현장 뒷이야기 '취재파일']저작권자 SBS&SBS콘텐츠허브 무단복제-재배포 금지"
21,2010-11-27,로또 417회 1등 '4·5·14·20·22·43'···보너스 '44',https://news.naver.com/main/read.nhn?mode=LSD&mid=shm&sid1=102&oid=003&aid=0003559559,뉴시스,"【서울=뉴시스】정병준 기자 = 27일 제417회 나눔로또 추첨 결과 '4, 5,14, 20, 22, 43'이 1등 당첨번호로 결정됐다. 2등 보너스 번호는 '44'다.jbj@newsis.com[뉴시스 이시간 핫 뉴스]ㆍ 소설 대물<11>국소에 혈관주사, 불끈 달아오르게ㆍ [광저우AG][종합]지영준 남자마라톤 ´金빛 질주´, 한국 8년만에 정상 탈환ㆍ [연평도 피격]""폭탄주는 어떤 맛"" 누리꾼 송영길 시장 ´맹비난´ㆍ 뉴라이프론, 서민대출시장의 대안 될까ㆍ [연평도 피격]""이러다 전쟁?""…28일 서해훈련 앞두고 누리꾼 ´불안´ㆍ [연평도 피격]정부방식대로면 민간 사망자 위로금 사실상 ´0원´ㆍ [연평도 피격][종합]北 ""민간인 사망 사실이라면 유감""ㆍ ´슈퍼스타K2´ 참가 최은, 정말 에로배우였네★ 손 안에서 보는 세상, 모바일 뉴시스<저작권자ⓒ '한국언론 뉴스허브' 뉴시스통신사. 무단전재-재배포 금지.>"
22,2010-11-27,중부 황사 밤늦게 걷혀...내일 추워요,https://news.naver.com/main/read.nhn?mode=LSD&mid=shm&sid1=103&oid=052&aid=0000326688,YTN,"오늘 궂은 날씨가 이어졌습니다.비와 눈이 지나고 황사가 나타났는데요, 황사는 중부지방을 중심으로 약하게 영향을 주다가 밤 늦게 걷힐 것으로 보입니다.내일은 추위 대비를 하셔야겠습니다.서울의 기온이 영하 5도까지 떨어지면서 올해 가을 들어 가장 춥겠습니다.하늘은 대체로 맑겠지만 밤사이 중부지방을 중심으로 눈이나 비가 내리겠는데요, 눈은 대부분 쌓일 것으로 보여서 월요일 출근길 교통안전에 유의하셔야겠습니다.전국이 대체로 맑지만 밤사이 강원 산간과 경남 일부지방에는 눈이나 비가 조금 내리겠습니다.전국적으로 바람이 강하게 부는 가운데 영동과 영남 일부지역으로는 대기가 건조합니다.불조심 하시기 바랍니다.내일 전국이 대체로 맑겠지만 밤에는 중부를 중심으로 눈이 내려 쌓이겠습니다.강원 산간에는 2에서 5cm, 그밖의 지역은 1cm 안팎 정도가 예상됩니다.아침기온은 서울 영하 5도, 춘천 영하 7도까지 떨어지겠습니다.낮 기온은 서울 3도, 대전 7도, 전주와 대구 8도에 머물겠습니다.추위는 월요일 낮부터 풀리겠습니다.날씨정보였습니다.[관련기사]▶ 큰 일교차...난방기구 잘 팔려요!▶ 적은 눈에 영동고속도로 마비▶ 산골마을 겨울준비로 분주▶ 올 겨울 집 앞 눈 안치우면 과태료 최대 100만원▶ ""올해 겨울 기온 변동폭 크고 한파 잦을 듯""☞ [다운로드] 생방송과 뉴스속보를 한 눈에...YTN뉴스ON☞ YTN 긴급속보를 SMS로!☞ 스마트폰으로 즐기는 24시간 뉴스의 세계...YTN 어플리케이션[저작권자(c) YTN & Digital YTN. 무단 전재-재배포 금지]"
23,2010-11-27,한미연합훈련 D-1‥서해5도 긴장 고조,https://news.naver.com/main/read.nhn?mode=LSD&mid=shm&sid1=100&oid=001&aid=0004791078,연합뉴스,"K-9 자주포 경계태세     (연평도=연합뉴스) 박지호 기자 = 북한의 연평도에 대한 기습 포격 나흘째인 26일 오후 옹진군 연평면 연평리 해병대 K-9 자주포대에서 해병대원이 경계를 서고 있다. 2010.11.26    jihopark@yna.co.kr연평 주민, 대피소 정비..백령.대청 주민, 대피소에 쌀 등 준비(인천=연합뉴스) 황철환 송진원 기자 = 서해 한미연합훈련 시작을 하루 앞둔 27일 북한과 인접한 서해 최북단 지역에는 북한의 추가 도발 우려로 긴장이 높아지고 있다.북한의 직접적인 포 사격을 받아 마을이 폐허로 변한 연평도에서는 이날 면사무소와 발전소 등 주요 관공서를 중심으로 대피준비에 착수했다.면사무소는 대피소 19곳에 담요와 난방기구, 구급약품, 비상식량 등을 준비해 두는 등 대피소 정비 작업을 벌였다.최철영 연평면 상황실장은 ""대피소 내 전등 등 전기시설을 점검하고 가능하면 통신시설도 갖출 예정""이라고 말했다.한전 연평도발전소도 인근 대피소에 본부를 차리고 배전반 등 통제장치를 설치하기로 했다.북한의 포 사격을 직접 목격한 현지 주민들은 불안한 마음을 감추지 못했다.50대인 한 주민은 ""그날은 하늘을 못 쳐다보고 다들 고개를 숙이고 다녔다. 내일부터는 아침부터 무조건 대피소에 들어앉아 있어야겠다""라고 말했다.직접 포격을 받은 연평도만큼은 아니지만 서해 최북단에 있는 백령도와 대청도, 소청도에서도 만약의 사태에 대비한 준비작업에 만전을 기하고 있다.백령면사무소는 군부대와 협의해 대피소에 넣을 담요를 마련해뒀다. 비상식량으로 쓸 라면과 쌀 등은 이미 대피소에 준비해놨다.총 69곳의 대피소로 주민들을 신속하게 대피시키기 위해 면사무소 직원과 각 이장, 민방위 대원들과의 비상연락망도 다시 한번 점검했다.백령도의 유일한 중.고등학교인 백령중고는 지난 24일부터 휴업에 들어갔지만 교사들은 계속 학교에 나와 교대로 비상 대기상태다.주말인 이날도 원래 오후 4시20분이면 퇴근을 해야 하지만 오후 9시까지 대기하기로 했다.지난 23일 학교 내에 있는 대피소로 피신했다가 바닥에 습기가 많이 찬 걸 확인한 뒤라 학교 차원에서 스티로폼도 준비 중이다.이 학교 이희용 교감(55)은 ""주민들이 겉으로는 동요 없이 지내지만 마음이 편치는 않다""며 ""백령도의 초.중.고를 합쳐 약 10명가량의 학생이 최근 인천으로 나간 것으로 알고 있고 휴업은 12월 초까지 이어지지 않겠느냐""라고 말했다.백령도의 유일한 병원인 백령병원도 연평도 사태 이후 전 직원이 병원을 떠나지 않고 대기중이다.北 옹진반도 개머리 해안    (연평도=연합뉴스) 박지호 기자 = 북한의 연평도에 대한 기습 포격 나흘째인 26일 오전 옹진군 연평도 조기박물관 전망대에서 바라본 북한 황해남도 옹진군 옹진반도 개머리 해안 마을의 산 위로 선전 간판이 설치돼 있다. 2010.11.26    jihopark@yna.co.kr병원 관계자는 ""분위기가 그러니까 혹시 몰라서 대기하고 있지만 사실 우리보다는 군부대 안의 의무중대에서 더 신경을 쓰는 것 같다. 의무중대에서 최근 병원과 보건소에 전화해서 비상약 준비상태나 근무 인원 등을 확인했다""라고 밝혔다.현지 주민들은 한미연합훈련을 빌미로 한 북한의 추가 도발을 우려하면서도 대체로 평상심을 유지하려는 기색이 역력했다.대청도 어민 김능호(57)씨는 ""사실 한미연합훈련 중에야 항공모함까지 왔으니 북한이 사격은 못할 거라 믿고 있지만 훈련이 끝난 다음에는 보복이 있을까 봐 주민들이 술렁술렁하고 있다""며 현지 분위기를 설명했다.김씨는 ""연평도 일이 있고 나서 손자들을 맡아 키우던 할머니.할아버지가 애들을 데리고 육지로 나가는 등 소수 주민이 섬을 떠났다""며 ""하지만 아직은 대체로 정부에서 어떤 대책이 나올지를 기다리는 중""이라고 전했다.백령도에 사는 최홍일(74)씨는 ""연평도 사태로 좀 어수선했지만 크게 동요하거나 하는건 없다""며 ""다만 군인들이 초비상상태라 외출.외박을 아예 나오지 않고 있어 동네가 썰렁하다""라고 말했다.연평도 사건이 난 이후인 지난 25일과 26일 백령도에서는 총 441명이 여객선을 타고 인천으로 나왔고 이 중 실제 주민은 214명으로 집계됐다.대청도와 소청도에서는 2일간 각각 113명과 55명의 주민, 군인 등이 여객선을 타고 인천으로 온 것으로 확인됐다.그러나 이들 대부분은 병원 치료 등 개인업무를 보러 나온 것이라고 현지 관계자는 설명했다.인천해경 백령출장소 관계자는 ""여기 주민들은 이번 일과 관련해서 크게 동요하지 않고 있다. 이미 천안함 사건을 겪어서 놀랄 것도 없다""며 ""평상시에도 1일 평균 300명가량이 여객선을 타고 오간다""라고 밝혔다.한편 지난 10월 기준으로 백령도에는 주민등록상 총 5천78명, 대청도에는 1천270명, 소청도에는 282명이 거주하고 있다.san@yna.co.kr[관련기사]▶ 李대통령 ""北도발 한미공조로 완벽대비""(종합)▶ 조선신보 ""위기대처, 평화보장 대책 강구돼야""▶ 연평 전사 해병들 대전현충원 사병3묘역 안장▶ <한미연합훈련 앞둔 연평주민들 ""재도발 두려워"">▶ 해병대전우회 ""김정일 즉각 응징해야""<뉴스의 새 시대, 연합뉴스 Live><모바일 애플리케이션><포토 매거진><저작권자(c)연합뉴스. 무단전재-재배포금지.>"
24,2010-11-27,"""北, 서해NLL 인근 8전대에 준전시상태 하달""",https://news.naver.com/main/read.nhn?mode=LSD&mid=shm&sid1=100&oid=001&aid=0004791097,연합뉴스,"北 옹진반도 개머리 해안    (연평도=연합뉴스) 박지호 기자 = 북한의 연평도에 대한 기습 포격 나흘째인 26일 오전 옹진군 연평도 조기박물관 전망대에서 바라본 북한 황해남도 옹진군 옹진반도 개머리 해안 마을의 산 위로 선전 간판이 설치돼 있다. 2010.11.26    jihopark@yna.co.kr함정.병력 전투 및 비상출동 대기태세(서울=연합뉴스) 김귀근 김호준 기자 = 북한은 지난 23일 연평도로 해안포를 발사한 직후 서해 북방한계선(NLL) 인근 해군 8전대에 '준전시상태' 명령을 하달하고 전투태세를 강화한 것으로 알려졌다.정부의 한 소식통은 27일 ""북한이 서해함대사령부 예하 해군 8전대에 준전시상태 명령을 하달하고 전투태세를 강화했다""면서 ""현재 함정과 전 병력이 전투 및 비상출동 대기태세를 유지하고 있다"" 밝혔다.북한의 서해함대사령부 소속의 8전대는 NLL에서 불과 32㎞ 떨어진 황해도 옹진군 사곶에 있고 70여척 이상의 경비정과 고속정이 배치된 것으로 알려졌다.8전대의 상급부대인 서해함대사령부는 호위함과 유도탄정 등 420여척, 갯벌에서도 고속기동이 가능한 공기부양정 130척, 고속상륙정 90여척 등을 보유하고 있다.소식통은 ""북한은 사곶 8전대에 전투태세 강화 뿐 아니라 사곶과 옹진반도 일대 10여곳의 해안포 기지에서 발사 태세를 갖추고 있는 등 추가 도발 의지를 내비치고 있다""며 ""군당국이 북한군의 동향을 예의주시하고 있다""고 덧붙였다.threek@yna.co.kr포격한 북한의 동굴진지 1년전과 현재    (연평도=연합뉴스) 박지호 기자 = 지난 23일 포격을 맞은 연평도 연평리 마을 뒷산 건너편에 보이는 개머리반도 쪽 섬에 있는 북한의 해안포 동굴진지의 모습. 위 사진은 1년전인  2009년 11월 17일 촬영한 모습이며 아래 사진은  2010년 11월 25일 촬영한 모습이다. 가운데 원안의 동굴진지는 변화가 없지만 왼쪽 긴 원 부분을 비교하면 새로 동굴진지가 생기고 진지 아래  새로 닦인 길도 보인다. 아래 사진 오른편 원안의 초소도 1년전에는 없던 것이 새로 생겼으며 동굴진지는 연평도 포격후 원형 그대로이며  달라진 점이 없다. 2010.11.25jihopark@yna.co.krhojun@yna.co.kr[관련기사]▶ 北통신 ""南민간인 사망, 사실이라면 유감""(종합)▶ <한미연합훈련 D-1‥서해5도 긴장 고조>▶ 李대통령 ""北도발 한미공조로 완벽대비""(종합)▶ 조선신보 ""위기대처, 평화보장 대책 강구돼야""▶ 개성공단 체류 인원 400명대로 줄어<뉴스의 새 시대, 연합뉴스 Live><모바일 애플리케이션><포토 매거진><저작권자(c)연합뉴스. 무단전재-재배포금지.>"
25,2010-11-27,"北통신 ""南민간인 사망, 사실이라면 유감""(2보)",https://news.naver.com/main/read.nhn?mode=LSD&mid=shm&sid1=100&oid=001&aid=0004791088,연합뉴스,"K-9 자주포 경계태세     (연평도=연합뉴스) 박지호 기자 = 북한의 연평도에 대한 기습 포격 나흘째인 26일 오후 옹진군 연평면 연평리 해병대 K-9 자주포대에서 해병대원이 경계를 서고 있다. 2010.11.26    jihopark@yna.co.kr(평양 조선중앙통신=연합뉴스) 김두환 기자 = 북한의 조선중앙통신사는 27일 `논평'을 통해 ""연평도 포격에서 민간인 사상자가 발생한 것이 사실이라면 지극히 유감스러운 일이 아닐수 없다""고 밝혔다.중앙통신은 `군사적 충돌을 초래한 장본인은 누구인가'라는 제목의 논평에서 이처럼 `유감'을 나타내면서도 ""그 책임은 이번 도발을 준비하면서 포진지 주변과 군사시설안에 민간인들을 배치하여 `인간방패'를 형성한 적들의 비인간적인 처사에 있다""고 주장했다.북한 매체가 연평도 포격 도발과 관련해 민간인 사망 문제를 언급한 것은 처음이다.dhkim@yna.co.kr[관련기사]▶ <한미연합훈련 D-1‥서해5도 긴장 고조>▶ 李대통령 ""北도발 한미공조로 완벽대비""(종합)▶ 조선신보 ""위기대처, 평화보장 대책 강구돼야""▶ 연평 전사 해병들 대전현충원 사병3묘역 안장▶ <한미연합훈련 앞둔 연평주민들 ""재도발 두려워""><뉴스의 새 시대, 연합뉴스 Live><모바일 애플리케이션><포토 매거진><저작권자(c)연합뉴스. 무단전재-재배포금지.>"
