,날짜,기사 제목,기사 링크,기사 출처,기사 내용
0,2011-12-07,"[현장] 태안 기름유출 4년, 씻기지 않는 아픔",https://news.naver.com/main/read.nhn?mode=LSD&mid=shm&sid1=102&oid=055&aid=0000217943,SBS,"<8뉴스><앵커>충남 태안 앞바다에서 최악의 기름유출 사고가 난 지 꼭 4년이 됐습니다. 오염됐던 바다는 옛 모습을 거의 다 되찾았지만 그게 전부가 아닙니다. 주민들 가슴속에는 아직도 시커먼 기름때가 가시지 않고 있습니다.이용식 기자가 주민들 만나봤습니다.<기자>지난 2007년 12월, 유조선 허베이 스피리트호와 삼성중공업 크레인이 태안 만리포 앞바다에서 충돌했습니다.순식간에 검은 기름이 바다를 뒤덮으면서 푸른 청정해역은 검은 지옥으로 변해버리고 말았습니다.4년이 지난 지금, 태안 앞바다는 겉으로는 옛 모습을 되찾았습니다.하지만 주민들에게 사고의 후유증은 여전히 남아 있습니다.[국영호/태안 만리포 주민 : 우리가요 방 9칸 갖고 살았는데 지금 정신이 하나도 없어요, 손님이 와야 뭐를 하죠]민박으로 생계를 유지하던 주민들은 물론 상인들과 영세 어민들 대부분은 배상대상에서 제외됐습니다.영업허가증이나 매출기록이 없으면 배상을 받지 못한다는 까다로운 심사기준 때문입니다.[국희열/주민 : 증빙서류가 없다고 해서 이것을 돈을 하나도 안 주는 거에요, 그럼 우리들이 5천 원, 만 원에 파라솔을 빌려주고서 어디 가서 영수증을 합니까?]국제 유류오염배상기금을 상대로 한 피해배상 청구는 2만 8천여 건, 2조 6천억여 원에 이릅니다.이 가운데 피해를 인정받은 경우는 3천 6백여 건, 천 6백억여 원에 불과합니다.태안 주민 6천여 명은 오늘(7일) 정부 과천청사와 삼성 사옥 앞에서 배상을 촉구하는 대규모 궐기대회를 열었습니다.[문승일/태안 유류피해대책위 사무국장 : 국가의 선 보상을 요구했는데도 불구하고 정부는 피해어민의 의견을 반영을 안해준거죠.]국제기금에서 배상을 받지 못한 주민은 특별법에 따라 국내법원에서 피해를 인정받으면 정부 보상을 받게 되지만, 재판은 내년 하반기에나 시작될 것으로 보입니다.언제 배상을 받을지 기약 없는 상황속에 기름 유출 사고는 태안 주민들에게 아직도 지워지지 않는 상처로 남아 있습니다.(영상취재 : 강윤구, 양두원, 영상편집 : 설민환)이용식yslee@sbs.co.kr관/련/정/보◆ 태안 기름유출 피해자, 보상촉구 총궐기대회◆ 태안 침몰어선서 시신 1구 확인◆ 태안 기름피해 배상 지지부진◆ ""검은 물체가 허우적""…어선 침몰 생사의 순간☞[SBS기자들의 생생한 취재현장 뒷이야기 '취재파일']☞ SBS뉴스 공식 SNS [SBS8News 트위터] [페이스북] [미투데이] [요즘]저작권자 SBS&SBS콘텐츠허브 무단복제-재배포 금지"
1,2011-12-07,강산 두 번 변하도록 ‘위안부 사죄’ 외쳤지만… 日은 침묵,https://news.naver.com/main/read.nhn?mode=LSD&mid=shm&sid1=102&oid=022&aid=0002339745,세계일보,"위안부 할머니 20년 ‘눈물의 역사’[세계일보]일본군 위안부 문제에 대한 일본 정부의 공식 사과와 배상을 요구하며 수요일마다 서울 종로구 일본대사관 앞에서 열린 ‘수요시위’가 오는 14일로 1000회를 맞는다. “위안부 동원 사실을 인정하고 공식 사과하라”는 외침이 20년이나 이어진 셈이다.수요시위는 세계에서 유례없는 단일 주제의 장기 집회로 2002년 3월 500회 시위가 ‘세계에서 가장 오랫동안 이어진 집회’로 세계 기네스북에 등재된 뒤 매주 기록을 경신하고 있다. 일본의 공식 사과를 받아내기 위한 한국 정부의 좀 더 적극적이고 실질적인 조치가 뒤따라야 한다는 지적이다.◆1000회 시위 맞아 ‘평화비’ 제막식 거행정신대문제대책협의회(정대협)는 1000회 시위에 맞춰 일본에 끌려갔을 당시 피해자들을 형상화한 소녀 모양의 ‘평화비’ 제막식을 일본대사관 앞에서 갖는다. 또 이날은 일본 시민단체 회원들이 일본 외무성을 인간사슬로 에워싸고 문제 해결을 촉구하는 등 전 세계 9개국 37개 도시에서 연대시위가 진행된다.정대협은 지난달 25일부터 오는 14일까지를 ‘위안부 배움주간’으로 정하고 전국 초·중·고교에 수업교재 등을 나눠 주고, 일본 총리 공식 트위터에 문제 해결을 요구하는 메시지를 보내는 운동을 진행 중이다.첫 수요시위는 1992년 1월8일 미야자와 기이치 전 일본 총리의 방한을 앞두고 열렸다. 1995년 일본 고베 지진과 지난 3월 일본 대지진 당시 두 차례 희생자 추모 형식으로 진행된 것을 제외하고 위안부 할머니들은 20년 동안 같은 자리를 지키며 진상 규명과 피해자 명예회복을 요구해 왔다.수요시위는 위안부 문제를 넘어 여성 문제를 논의하는 장이 됐다. 2003년에는 “더 이상 전쟁 희생자를 만들어서는 안 된다”며 이라크 파병 반대 목소리를 내기도 했다. 매주 수요시위에는 쉼터와 전국 곳곳에서 올라온 위안부 할머니 6∼7명과 시민 50∼100여명이 꾸준히 참석하고 있다. 일본인 등 외국인의 참여도 높다.정대협은 “수요시위는 살아 있는 역사교육의 공간이자 피해자와 시민들이 연대하고 여성인권과 평화를 말하는 장”이라고 말했다.◆안타까운 죽음 잇따라… 정부가 적극 나서야지난 20년 동안 이어온 수요시위는 적잖은 성과를 거두기도 했다. 1993년 세계인권대회 결의문에 위안부 문제가 포함됐고, 1998년에는 유엔 인권소위원회가 일본 정부 배상을 요구한 ‘맥두걸 보고서’를 발표했다. 2000년에는 국제법정에서 전 일본 국왕 히로히토에게 유죄 판결이 내려졌다.그래도 일본 정부는 요지부동이다. 위안부 동원 사실 자체를 부인하는 데다 1965년 한·일협정으로 식민지배 피해자들에 대한 보상문제는 끝났다는 입장이다. 위안부 할머니들의 요구는 일본의 전쟁범죄 인정, 진상규명, 공식사죄, 법적 배상, 전범자 처벌, 역사교과서 기록, 추모비와 사료관 건립이지만 진전된 것은 없다.헌법재판소는 지난 8월 ‘위안부 배상 문제에 국가가 적극 나서지 않는 것은 피해자의 인권을 침해한 것”이라며 위헌 결정을 내렸다. 그러나 여전히 정부는 일본 정부에 공식 이의제기를 하지 않고 있다. 그 사이 많은 피해자가 사망했다. 정부에 등록된 234명의 위안부 할머니 중 현재 생존자는 65명. 올해에만 14명이 세상을 떠났다. 현재 8명이 거주하고 있는 나눔의 집 안신권 소장은 “20년간 위안부 문제 해결 운동은 철저히 민간 주도로 이뤄져 왔다. 국내 대기업조차 일본 기업과의 관계 때문에 선뜻 나서지 못한다”며 “정부의 역할이 중요한 때”라고 강조했다.성균관대 정현백 교수(역사학)는 “1000회가 된다는 건 전 세계 어느 여성운동이나 사회운동에서도 유례 없는, 세계사에 길이 남은 만한 대단한 일”이라며 “늦기 전에 일본의 사과를 받아낼 수 있도록 정부가 적극 나서야 한다”고 강조했다.김유나·김희원 기자[Segye.com 인기뉴스]◆ ""재학생 절반이나""…2년간 성폭행 사실에 교사들 '쉬쉬'◆ 박근혜 언제쯤 나서나…'결단의 시기는 다가오는데'◆ ""클릭 잘못해서 입대했다"" 절박한 글, 알고보니…◆ 도심 아침에 '묻지마 살인' 행인들은 지켜만 봐◆ '외제차 부수고 물에 빠뜨려' 보험금 수억 챙겨[ⓒ 세계일보 & Segye.com, 무단 전재 및 재배포 금지]세계일보[지면보기][스마트캠페인][트위터/페이스북/미투데이]<세계닷컴은 한국온라인신문협회(www.kona.or.kr)의 디지털뉴스이용규칙에 따른 저작권을 행사합니다.>"
2,2011-12-07,종이 책 없는 스마트교육 ...효과는?,https://news.naver.com/main/read.nhn?mode=LSD&mid=shm&sid1=102&oid=052&aid=0000384524,YTN,"[앵커멘트]종이교과서 대신 전자기기를 이용해 수업을 진행하는 스마트 교육, 학부모들께서는 대부분 들어보셨을텐데요.서울에서 스마트교육 시범실시 8개월 만에 첫 공개수업과 평가가 진행됐습니다.아이들은 어떻게 변했을까요?전준형 기자가 이태원초등학교를 다녀왔습니다.[리포트]교실 사방에 설치된 전자 칠판에 수업 자료들이 쉴새없이 등장했다 사라집니다.학생들은 태블릿PC와 전자펜으로 과제를 수행하고, 그 결과는 실시간으로 칠판에 나타납니다.지난 4월부터 8개월간 시범적으로 진행된 스마트교육.효과는 어땠을까?무엇보다 아이들이 수업에 흥미를 가지고 창의성이 증가했다는 점이 고무적입니다.[인터뷰:이지현, 초등학교 5학년]""확실히 전자기기가 많다보니까 수업 중간중간에 정보 찾을 수도 있고 좀 더 공부가 잘되는 것 같아요.""[인터뷰:강재훈, 초등학교 5학년]""여기서 계속 수업받으면 좋겠어요. 공부하는 게 새로우니까 애들하고 같이 집중이 잘 돼서 더 좋은 것 같아요.""교사와 학부모들은 아이들이 자기주도적으로 학습하는 능력이 좋아졌다고 평가했습니다.[인터뷰:손범석, 이태원초등학교 교사]""새로운 기기에 대한 흥미라든지 관심만으로도 아이들이 적극적으로 수업에 참여할 수 있고 그런 동기가 될 수 있다고 생각하고요.""하지만 기대에 미치지 못하는 한계점과 우려되는 역기능도 있습니다.우선 스마트 교육으로 학생들의 목표 설정이나 습관 형성에는 긍정적 변화가 있었지만, 학습 욕구나 자기 관리, 노력, 성찰 등에서는 별다른 변화가 없는 것으로 조사됐습니다.또 아이들이 스마트 기기를 이용하면서 불건전한 자료들에 노출되거나, 인터넷 중독 현상이 나타날 위험이 있다는 지적도 나왔습니다.특히 우리나라 교육 환경은 경쟁을 중요시하도록 구조화돼 있어 협동 작업을 핵심으로 여기는 스마트교육이 뿌리 내리기 쉽지 않다는 점도 풀어야 할 과제로 지적되고 있습니다.YTN 전준형입니다.[주요뉴스]▶ 아이패드2 매출 호조에 국내업체 부문별 표정 엇갈려▶ 성남 분당을 '빅매치' 성사▶ SK, 주유소 기름값 100원씩 전격 인하▶ 오염수와의 전쟁...도쿄전력 전원상실 대비 안해▶ 일본 대지진 쓰나미 최고 높이 37.9m☞ [다운로드] 생방송과 뉴스속보를 한 눈에...YTN뉴스ON☞ YTN 긴급속보를 SMS로!☞ 스마트폰으로 즐기는 24시간 뉴스의 세계...YTN 어플리케이션[저작권자(c) YTN & Digital YTN. 무단 전재-재배포 금지]"
3,2011-12-07,[대전] 간 해치는 음주?…허리에도 치명적,https://news.naver.com/main/read.nhn?mode=LSD&mid=shm&sid1=103&oid=055&aid=0000217917,SBS,"<앵커>지나친 음주는 간 뿐 아니라 허리 건강에도 치명적이라는 조사결과가 나왔습니다. 앞으로 송년모임 등 술자리 잦아지실 텐데요. 주의하셔야겠습니다.노동현 기자입니다.<기자>1년 전부터 허리 디스크를 앓아 온 조남산 씨.최근 허리 통증은 물론 앉기 조차 힘들어 병원을 찾았습니다.송년모임 등으로 술을 마시는 날이 잦았던 게 원인이었습니다.[조남산/대전시 만년동 : 술마실 때는 잘 모르구요. 다음날 일어났을때 걷기가 약간 불편하다고 볼 수가 있습니다.]한 한방병원이 척추통증으로 병원을 찾은 환자들을 조사한 결과 3명 가운데 2명 꼴로 매주 2차례 이상 술자리를 가진 것으로 나타났습니다.음주가 허리 건강을 해치는 이유는 알코올이 디스크에 혈액이 공급되는 것을 방해해 근육과 인대를 약화시키기 때문입니다.[배영춘/대전 자생한방병원 원장: 알콜을 분해하기 위해서 단백질이 소모되기 때문에 척추 주변의 근육과 인대를 약화시킬 우려가 있어서 척추질환 환자불들 같은 경우에는 연말에 음주를 자제하시는 것이 좋겠습니다.]따라서 금주가 가장 좋지만 불가피한 술자리라면 몇가지 수칙을 지키는 게 필요합니다.방바닥보다는 의자가 있는 곳이 허리에 부담이 적습니다.술자리가 길어질 경우는 한시간에 한번씩 허리돌리기 등 스트레칭을 해주는 것이 좋습니다.또 술자리에서 흡연은 되도록 삼가하고, 물을 자주 마시는 등 수분을 섭취해주는 것이 허리 건강에 좋다고 전문가들은 조언합니다.(TJB) 노동현 기자관/련/정/보◆ [대전]정부, 충남도 의회 의정비 인상에 제동◆ [대전]'헬기+비행기' 스마트 무인정찰기 개발◆ [대전] 충남도 농어업 피해예산액 1900억 원◆ [대전] 논산 훈련소 첫 영외면회 첫날 표정은☞[SBS기자들의 생생한 취재현장 뒷이야기 '취재파일']☞ SBS뉴스 공식 SNS [SBS8News 트위터] [페이스북] [미투데이] [요즘]저작권자 SBS&SBS콘텐츠허브 무단복제-재배포 금지"
4,2011-12-07,눈꽃 즈려밟고 선자령까지 5㎞ 고개 돌려보면 雪國天地非人間,https://news.naver.com/main/read.nhn?mode=LSD&mid=shm&sid1=103&oid=005&aid=0000491291,국민일보,"조선 후기 실학자 이중환은 택리지에서 “산수의 경치가 훌륭한 곳은 강원도 영동을 첫째로 꼽는 것이 마땅하다”며 “살고 있는 곳에 산수가 없으면 사람이 촌스러워진다”고 말했다. “산수는 정신을 즐겁게 하고 감정을 화창하게 한다”는 이중환은 영동에서도 경포호수가 위치한 강릉을 산수화의 으뜸으로 꼽았다. 지금은 7개의 터널과 최고 90m 높이의 교량 33개로 이루어진 새 영동고속도로를 타고 편안하게 서울과 강릉을 오갈 수 있다. 하지만 강릉 가는 길은 아무래도 아흔아홉 굽이 대관령을 겨울에 넘어야 제맛이다. 우리나라에서 눈이 가장 먼저 내리고 가장 많이 내리는 곳으로 유명한 대관령은 해발 832m. 지난주 내린 폭설로 백두대간 고갯길인 대관령은 은세계를 연출하고 있다.영동과 영서를 가르는 분기점인 대관령은 고갯길을 사이에 두고 강릉과 평창의 기후가 매우 대조적이다. 오죽했으면 “영서 날씨가 추워 옷을 껴입고 영동에 갔다가 쪄 죽고, 영동에서 덥다고 헐렁한 차림으로 영서에 갔다가는 얼어 죽기 십상이다”는 우스갯소리까지 나왔을까.겨울철 강릉 여행의 첫 번째 감동은 대관령에서 선자령(1157m)까지 이어지는 5㎞ 길이의 눈꽃 트레킹. 오르막과 내리막이 심하지 않은데다 무릎 깊이로 쌓인 눈과 눈꽃이 핀 크고 작은 전나무들이 크리스마스트리를 연출해 동화책 속으로 여행을 떠난 듯 황홀하다.옛 대관령휴게소에서 백두대간 마루금을 따라 KT통신중계소를 지나면 본격적인 산길이 시작된다. 늦봄부터 초가을까지 야생화가 만발하는 산길은 전나무를 비롯한 침엽수와 나목으로 변한 활엽수들이 서둘러 눈꽃을 활짝 피웠다. 반원형의 데크로 단장한 새봉 전망대는 설경이 멋스런 백두대간은 물론 강릉 시가지와 동해바다가 파노라마로 펼쳐지는 뷰 포인트.새봉에서 선자령까지 2.5㎞는 비교적 완만한 코스로 수십 기의 풍력발전기가 빙글빙글 돌아가는 은빛 설원은 계곡을 넘어 삼양대관령목장의 초지로 이어진다. 선자령의 거센 눈보라 사이로 언뜻언뜻 보이는 대관령목장의 축사는 달력에 나오는 알프스처럼 아름답고 평화롭다.대관령 옛길도 선자령 가는 길에 버금가는 눈꽃 트레킹 코스로 이름 높다. 옛 영동고속도로의 대관령 표석에서 강릉 방향으로 몇 굽이를 돌면 신사임당 사친시비가 나오고, 다시 몇 굽이를 더 내려가면 반정 전망대가 나온다. 반정(半程)은 대관령 옛길의 중간이라고 해서 붙여진 이름. 대관령 옛길은 모두 7.87㎞로 반정에서 대관령박물관까지 6.04㎞ 구간과 반정에서 선자령 아래에 위치한 국사성황당까지 1.83㎞ 구간이 있다.강릉 사람들은 대관령을 ‘대굴령’이라 부른다. 고개가 험해 오르내릴 때 ‘데굴데굴 구르는 고개’라는 뜻으로 ‘대굴령’을 한자로 적어 대관령(大關嶺)이 됐다고 한다. 반정에서 무릎 깊이로 쌓인 눈길을 헤치고 3㎞쯤 내려가면 주막이 나오고 다시 1.5㎞를 더 하산하면 하제민원터. 산적 때문에 통행객 10명이 넘어야 통과시켜 주던 일종의 검문소로 강릉의 해산물과 평창의 농산물을 교역하던 선질꾼은 이곳에서 무리를 이뤄 고개를 넘었다.하제민원터 아래에 위치한 원울이재는 울고 넘던 고갯길. 영동으로 발령받은 관원들이 멀리 푸른 바다가 보이자 세상 끝에 당도했다는 설움에 눈물을 흘리고, 떠날 때는 정 때문에 울며 넘었다는 고개다. 원울이재를 넘자 이 골 저 골을 수놓은 눈꽃이 거센 바람에 날려 구름처럼 피어오른다.눈꽃 트레킹이 끝나면 짙은 커피향이 그리워지는 법. 정동진에서부터 주문진까지 강릉의 바닷가에는 커피숍들이 즐비하다. 동전 몇 개 넣고 뽑아먹는 자판기를 비롯해 주인이 직접 원두를 갈아 뽑아내는 250여 개의 전문 커피숍에 이르기까지 강릉은 로맨틱 커피 순례지로 유명하다.강릉이 커피로 유명해지기 시작한 것은 10여 년 전. 우리나라 커피 1세대이자 일본식 핸드 드립의 최고수 커피장인으로 불리는 보헤미안의 박이추씨를 비롯해 대규모 커피공장을 운영하는 테라로사의 김용덕씨가 강릉 커피숍의 원조격. 여기에 박이추씨로부터 비법을 전수받은 제자들이 앞다퉈 전문 커피숍을 열면서 강릉은 커피축제까지 개최하게 됐다. 특히 강릉항은 횟집보다 커피숍이 많아 커피거리로 불리는 곳. 겨울바다가 보이는 창가에 앉아 짙은 커피향을 즐기는 연인들의 모습이 낭만적이다.강릉 여행의 대미는 300년 역사를 자랑하는 선교장에서의 고택체험. 선교장은 태종의 둘째 아들이자 세종대왕의 형인 효령대군의 11대손 이내번이 수대에 걸쳐 건축한 우리나라 유일의 장원. 102칸에 이르는 본채를 비롯해 부속건물과 가람집 초가까지 포함하면 300칸이 넘는 만석꾼의 살림집이다.경포호수가 지금보다 훨씬 넓었을 때 이 집 앞까지 배를 타고 건너다녔다고 해서 배다리집으로도 불리는 선교장(船橋壯)에 들어서면 맨 먼저 연못 위의 정자 활래정(活來亭)이 반긴다. 활래정은 선교장의 주인이 기거하던 공간으로 발갛게 말라붙은 연꽃과 연못가에 뿌리를 내린 배롱나무가 선교장의 역사를 말해준다.보호수로 지정된 10여 그루의 500∼600년생 소나무를 비롯해 수백 그루의 소나무에 둘러싸인 선교장에는 여성의 공간인 안채와 동별당, 남성의 공간인 사랑채와 열화당을 비롯해 우리나라 고택 가운데 가장 긴 23칸의 행랑채가 눈길을 끈다.눈 덮인 백두대간이 거울 같은 경포호수에 가라앉고 경포대에 다섯 개의 달이 뜨면 묵향 그윽한 선교장의 방들이 하나 둘 불을 밝힌다. 금강산과 관동팔경 유람길에 나섰던 수많은 시인묵객들이 머물며 시·서·화를 남겼던 방들로 솔향과 묵향, 그리고 커피향이 어우러져 강릉 겨울밤의 운치를 더한다.강릉=글·사진 박강섭 관광전문기자 kspark@kmib.co.kr<GoodNews paper ⓒ국민일보. 무단전재 및 재배포금지>"
5,2011-12-07,해외사이트 판매 건강식품 대부분 유해성분 함유,https://news.naver.com/main/read.nhn?mode=LSD&mid=shm&sid1=102&oid=001&aid=0005407233,연합뉴스,"(서울=연합뉴스) 이주연 기자 = 해외 인터넷사이트에서 판매되는 건강기능식품 대부분에서 유해성분이 검출됐다.식품의약품안전청은 국내·외 인터넷사이트에서 성기능 개선·다이어트·근육강화 등 효능을 강조하며 판매되는 37개 제품을 수거해 검사한 결과, 해외 사이트에서 판매된 14개 제품에서 식품에 사용이 금지된 성분이 검출됐다고 7일 밝혔다.성기능 개선 효과가 있다는 7개 제품에서는 실데나필·타다라필 성분이 검출됐다.실데나필이나 타다라필은 발기부전 치료에 쓰이는 성분으로 심장혈관질환자가 복용하면 심장마비를 일으킬 수 있어 용량을 제한하고 있다.또 일부 제품에서는 최음 등의 목적으로 불법 사용되는 이카린도 나왔다.다이어트 효과를 표방한 제품에는 데스메틸-시부트라민이 함유된 것으로 드러났다. 시부트라민은 비만치료제로 쓰였으나 고혈압·뇌졸중·가슴통증 등의 부작용 때문에 작년 10월부터 판매가 중단됐다.다이어트에 도움이 된다는 1개 제품에서는 장 무기력증을 일으키는 센노사이드A와 센노사이드B가 나왔다.근육강화 효과를 강조한 제품에서는 요힘빈이 검출됐다. 요힘빈은 주로 동물용 마취 회복제로 쓰이며 각성과 흥분 효과가 있어 사람에게는 투약이 금지된 성분이다.식약청은 방송통신위원회에 문제의 제품을 판매하는 인터넷사이트 접속 차단을, 관세청에는 국내 반입 차단을 요청했다.해외사이트를 통해 판매되는 부적합 제품은 해마다 늘어 2009년에는 55개 조사대상 제품 가운데 24%(13건), 올해는 117개 제품 중 55%(64개)가 부적합 판정을 받았다.식약청 측은 ""해외 인터넷사이트에서 판매되는 불법 제품은 안전성이 검증되지 않아 건강을 해칠 수 있는 만큼 구매해서는 안된다""고 말했다.gold@yna.co.kr<연합뉴스 모바일앱 다운받기><포토 매거진><저작권자(c)연합뉴스. 무단전재-재배포금지.>"
