,날짜,기사 제목,기사 링크,기사 출처,기사 내용
67,2011-12-07,"홍준표 ""`안된다' 하면 흔쾌히 나가겠다""(종합2보)",https://news.naver.com/main/read.nhn?mode=LSD&mid=shm&sid1=100&oid=001&aid=0005408398,연합뉴스,"유구무언    (서울=연합뉴스) 백승렬 기자 = 한나라당 홍준표 대표가 7일 오전 한나라당 최고위원 3명의 동반사퇴 표명 후 당사에서 자신의 거취를 표명하는 기자회견에서 굳은 표정으로 앉아 있다. 2011.12.7    srbaek@yna.co.kr의원 전원대상 재신임 물어..지난달 29일 이어 두 번째""애초 2월중순 재창당 계획..96년 신한국당 창당과정이 모델""(서울=연합뉴스) 심인성 김호준 황철환 기자 = 한나라당 홍준표 대표는 7일 자신의 거취에 대해 ""`대의원들이 직선으로 선출했기에 나가지 않겠다'는 그런 말을 하지 않겠다. 여러분이 `홍준표 안된다'고 하면 흔쾌히 나가겠다""고 말했다.홍 대표는 이날 국회에서 열린 의원총회 모두발언을 통해 ""여러분이 의논해 주면 여러분의 뜻에 따르겠다""면서 이같이 밝혔다.홍 대표는 ""지도부 퇴진 문제를 비롯해 모든 문제를 몇 사람의 목소리에 의존하지 말고 169명 전원이 의견을 표명하고 결정지어야 한다. 오늘 시간이 모자라면 내일과 모레도 의총을 해 결론을 내 달라""면서 ""어떤 말도 기쁜 마음으로 받아들일 것이며, `홍준표가 정치를 지저분하게 한다'는 소리를 듣지 않을 것""이라고 강조했다.그는 특히 ""`집권 여당 대표가 모욕감을 느낀다. 더 이상 하지 못하겠다'는 식으로 무책임하게 당의 혼란을 바라보는 그런 일은 하지 않겠다""면서 ""여러분이 혼란을 준비(대비)해 달라""고 당부했다.이는 유승민 원희룡 남경필 최고위원이 전격적으로 동반사퇴하면서 자신의 사퇴를 압박한 데 대한 거부의 뜻을 분명하게 표명한 것인 동시에 의원 전원을 대상으로 다시 한번 재신임을 묻겠다는 취지로 해석된다.홍준표 '사퇴거부'    (서울=연합뉴스) 전수영 기자 = 당 쇄신안 논란 과정에서 또 다시 `정면돌파' 승부수를 던진 한나라당 홍준표 대표가 7일 오후 국회 본관 246호에서 열린 정책의원총회에서 황우여 원내대표, 이주영 정책위의장과 이야기하며 뭔가를 생각하고 있다.    이날 유승민 원희룡 남경필 최고위원 등 지난 7ㆍ4 전당대회에서 선출된 최고위원 5명 중 3명이 최근의 `디도스 사태'를 계기로 전격 사퇴하면서 `홍준표 퇴진'을 요구했지만, 홍 대표는 기자회견을 통해 ""자리에 연연하지 않겠지만 책임감 있게 행동하겠다""며 즉각 사퇴 거부 의사를 분명히 했다.   2011.12.7         swimer@yna.co.kr홍 대표는 앞서 지난달 29일 쇄신연찬회에서 ""대다수가 원한다면 대표직에서 물러나겠다""는 승부수를 던져 재신임을 받은 바 있다.홍 대표는 ""지난 2007년 4월에도 재보선 참패로 최고위원 2명이 사퇴하고 당이 내홍에 휩싸인 적이 있다""면서 ""저는 자리에 연연하거나 집착하지 않는다. 이미 당 대표가 됐을 때 헌신하겠다는 각오를 했다""고 말했다.또 ""대표가 된 후 5개월 동안 빈 솥단지를 끌어안고 한숨을 쉬었고 이 빈 솥단지를 어떻게 채워야 할지 내내 고민해 왔다""면서 ""애초의 계획은 예산국회 마칠 때까지 정책쇄신에 전력을 다하고 그 이후에 시스템 공천을 통해 천하의 인재를 끌어모아 이기는 공천을 한 뒤 2월 중순경 재창당하는 것이었다""고 밝혔다.구체적인 재창당 프로그램에 대해선 지난 96년 신한국당 창당과정을 거론하면서 ""당시 15대 4ㆍ11 총선을 2개월여 앞둔 2월7일 공천자 대회 겸 민자당에서 신한국당으로 바꾸는 재창당 대회를 열었다""고 설명했다.홍 대표는 이어 ""재창당 때까지 대선후보들이 전면에 나올 수 있도록 당ㆍ대권 분리조항을 개정할 생각이었다""고 덧붙였다.그는 이날 ""개혁을 주장하는 분들이 과연 개혁정책을 내놓은 적이 있느냐"", ""입으로만 개혁하고 당에 문제가 있을 때 상처를 보듬을 생각은 하지 않고 소금만 뿌리고..."", ""문제가 있을 때마다 우리끼리 총질을 하고..."", ""한두 명이 개혁을 포장한다고 해서 본인들이 사는 것 아니다"", ""당이 어려우면 전체가 떠내려간다""는 등의 발언을 쏟아내며 사퇴한 최고위원들과 쇄신파들을 강도 높게 비판했다.홍 대표는 이날 발언 직후 ""내가 여기 있으면 여러분이 마음에 있는 소리를 잘 못할 것 같다""며 의총장을 떠났다.sims@yna.co.kr남경필, 유승민, 원희룡 與지도부 사퇴    (서울=연합뉴스) 전수영 기자 = 한나라당 남경필, 유승민, 원희룡 최고위원(왼쪽부터) 3인이 7일 오전 서울 여의도 당사에서 각각 사퇴 기자회견을 하고 있다.    이들 3인의 사퇴는 `홍준표 체제' 붕괴를 의미하며 특히 내년 4ㆍ11 총선을 4개월여 앞둔 시점에서 이명박 대통령의 국정운영은 물론 총ㆍ대선 판도에도 적지 않은 영향을 미칠 것으로 보인다.   2011.12.7         swimer@yna.co.kr[관련기사]▶ <與 의총, 지도부 사퇴놓고 `파열음'>-1▶ <靑, 한나라 사퇴 파문에 ""지켜보겠다"">▶ 김정권 ""한나라, 해산 후 재창당 할 수도""▶ <野, 與 지도부 사퇴 사태에 `촉각'>▶ <홍준표 `사퇴거부' 정면돌파..이번에도 통할까><연합뉴스 모바일앱 다운받기><포토 매거진><저작권자(c)연합뉴스. 무단전재-재배포금지.>"
68,2011-12-07,`인구정점 12년 지체' 연금ㆍ주택전망 바뀌나?,https://news.naver.com/main/read.nhn?mode=LSD&mid=shm&sid1=100&oid=001&aid=0005408298,연합뉴스,"<그래픽> 장래인구추계 주요 내용    (서울=연합뉴스) 이재윤 기자 = 통계청은 7일 발표한 `2010∼2060년 장래인구추계'에서 우리나라의 총인구가 저출산의 영향으로 2030년 5천200만명대에서 정점을 찍고 감소할 것으로 예상됐다.    yoon2@yna.co.kr    @yonhap_graphics(트위터)국민연금 소진 2년 단축…주택가격은 안정될 듯(서울=연합뉴스) 구정모 기자 = 출산율과 기대수명, 국제순이동 등 추계의 인구 추계의 전제가 5년 전과 달라져 인구가 정점에 도달하는 시기가 12년 밀렸다.이 때문에 주택경기, 에너지ㆍ전력 계획, 국민연금을 비롯한 각종 연기금, 건강보험, 국가 재정 등 통계청의 인구 추계를 바탕으로 한 장기전망치가 수정될 것으로 보인다.◇인구 정점 도달 2018년→2030년7일 통계청이 2010년 기준으로 작성한 인구 추계를 보면 우리나라 인구는 2030년 5천216만명까지 증가하다가 이후 감소세로 전환한다.5년 전에 2005년을 기준으로 한 추계보다 인구가 최대치에 도달하는 시기가 12년 늦춰졌다. 당시엔 인구가 2018년에 4천934만명을 기록하면서 정점을 찍고 이후 줄어들 것으로 예상했다.2050년 인구도 2005년 기준 4천234만명에서 2010년 기준 4천812만명으로 578만명 차이가 났다.5년 사이 장래 인구 추계가 큰 차이가 나는 것은 추계의 전제가 되는 출생률, 기대수명, 국제순이동 등이 변했기 때문이다. 인구 추계는 과거 추세가 앞으로 지속한다는 가정에 근거한다. 5년 사이 기준이 되는 과거 추세가 바뀌면 전제가 달라지고, 결국 전망치에 차이가 나게 된다.우선 출산율이 크게 달라졌다. 2006년 추계 당시 출산율이 하락하는 추세였다. 합계출산율이 2000년 1.47에서 2005년 1.08까지 떨어졌다. 역대 최저였다.이후 2006년 1.12, 2007년 1.25, 2008년 1.19, 2009년 1.15, 2010년 1.23으로 출산율이 개선됐다. 이른바 '쌍춘년'(2006년), '황금돼지띠'(2007년) 덕분이었다.이번 가정에서는 이전 추계보다 2040년 합계 출산율이 0.14명 정도 더 증가할 것으로 설정했다.기대수명 가정 역시 5년 전보다 늘었다. 이전 전망보다 실제 기대수명의 증가 속도가 더 빨랐고, 최근 남자의 기대수명이 지속적인 속도로 개선돼서다. 이번 가정에서 2050년 기대수명이 남자는 2.2세, 여자는 0.4세 더 늘었다.가장 큰 변화는 국제순이동이다. 이는 국내로 들어온 인구와 국외로 나간 인구 차이다. 5년 전 당시엔 국내 입국자보다 출국자가 더 많아 국제순이동은 출구 초과로 나타났다. 따라서 향후에도 국제이동은 순유출될 것으로 가정했다.하지만 이후 국제결혼이 증가하고 한국을 찾는 외국인이 늘어나면서 실제로는 유입 인구가 더 많았다. 이번 추계에서 순유입으로 전환을 반영해 국제순이동을 2020년 3만6천명, 2030년 3만명으로 가정했다. 5년 전엔 2020년 -2만7천명, 2030년 -2만4천명으로 추정했다.◇인구 추계 변경으로 각종 전망치 수정 불가피인구 추계가 달라짐에 따라 이를 바탕으로 하는 정부와 각종 기관의 장기전망치가 수정될 것으로 보인다.우선 국민연금의 장기전망이 직접적인 영향을 받을 것으로 보인다. 국민연금은 기대수명과 인구구조 변화에 크게 좌우되기 때문이다.2005년 기준 인구 추계를 바탕으로 2050년 남녀수명이 각 82.9세, 88.9세로 가정했을 때 2041년 국민연금 적립기금이 최고 987조원을 기록하고 나서 급속히 감소하기 시작해 2058년에 기금이 소진될 것으로 전망됐다.이번에 2050년 기대수명이 남성은 85.1세, 여성은 89.3세로 늘어나 국민연금의 적립기금 소진에 부정적인 영향을 미칠 것으로 보인다.보건사회연구원에선 2050년 남녀 평균 수명이 각 85.14세와 90.89세로 연장되면 연금 소진 시기가 2년 앞당겨질 것으로 전망하기도 했다.긍정적인 측면도 있다. 생산 가능 인구 100명당 65세 이상 고령인구인 노년부양비는 2050년 71.0명으로 5년 전 72.0명보다 낮아졌다. 돈 벌 능력이 있는 인구 대비 연금을 받는 고령 인구가 상대적으로 더 적어졌다는 뜻이다.국민연금과 비슷한 각종 연기금과 건강보험도 간접적인 영향을 받을 것으로 보인다. 특히 건강보험은 고령 인구 증가에 따른 진료비 증가가 예상돼 부정적인 영향을 미칠 것으로 우려된다.전력을 비롯한 에너지 계획, 국가 장기 재정 전망, 주택시장 등 인구를 바탕으로 한 각종 전망치도 변경이 불가피할 것으로 보인다.주택시장과 관련해서는 이번 인구 추계가 호재로 작용할 수도 있다. 인구 감소로 주택 수요가 줄어 주택가격이 장기적으로 떨어질 것이란 시나리오가 잘못됐기 때문이다. 이번 추계에서 인구 감소가 시작되는 시기가 12년 늦춰진 덕에 주택시장 수요가 당분간 크게 떨어지지 않을 것으로 기대된다.pseudojm@yna.co.kr[관련기사]▶ <한국 인구 2030년 5천200만명 `정점'>▶ 2060년에 10명중 4명이 고령자▶ 출산장려 위해 '출산친화지수' 개발▶ <경제불황으로 이민자들에게 엉뚱한 화살><연합뉴스 모바일앱 다운받기><포토 매거진><저작권자(c)연합뉴스. 무단전재-재배포금지.>"
69,2011-12-07,"""인권침해 집단은 경찰·군·검찰·언론""(종합)",https://news.naver.com/main/read.nhn?mode=LSD&mid=shm&sid1=102&oid=001&aid=0005408381,연합뉴스,"국민인권의식 실태조사…전문가 ""3년 전보다 인권 후퇴"" 43%(서울=연합뉴스) 이지헌 기자 = 일반인들은 경찰, 군대, 검찰, 언론 등을 '인권 침해를 가장 많이 하는 집단'으로 생각한다는 조사결과가 나왔다.7일 국가인권위원회가 공개한 '2011년 국민인권의식 실태조사 보고서'에 따르면 15세 이상 일반 시민들은 '가장 인권을 침해하는 사람(집단)'으로 예시로 든 10개 집단 가운데 경찰(16.9%)과 군대 상급자(16.3%), 검찰(15.1%), 언론인(10.2%)을 꼽았다.경찰을 지목한 응답자는 상대적으로 60대 이상 연령층과 군대·농촌지역 거주자, 가계 월소득 200만원 미만 계층에 많았다.검찰을 지목한 응답자는 40대 이상, 자영업·전문직·생산직·가정주부, 가계월소득 500만원 이상 계층에 많았다.인권 분야 전문가를 대상으로 한 같은 항목의 조사에서는 주요 인권침해 행위자가 검찰(50.4%), 군대 상급자(30.1%), 언론인(39.7%), 경찰(28.3%)로 나와 응답자의 절반이 검찰의 인권 침해 행위를 심각하게 생각하는 것으로 나타났다.'3년 전과 비교해 인권수준이 개선됐느냐'는 질문에 일반인은 40.1%가 '개선됐다', 44.7%가 '비슷한 수준이다'라고 답했고 '후퇴했다'라는 응답은 9.9%에 머물렀다.반면 전문가들은 같은 질문에서 43.6%가 '후퇴했다'고 답했으며 개선됐다거나 비슷하다고 답한 응답자는 각각 28.9%와 27.6%로 상대적으로 적었다.일반인이 가장 인권 침해가 심각하다고 인식하는 분야는 '개인정보 보호'가 부정적 응답 비율이 33.2%로 가장 높았고 '집회·결사의 자유'(21.2%), '인터넷에서의 표현의 자유'(19.7%) 등이 뒤를 따랐다.전문가들은 63.1%가 '개인정보의 보호'를 가장 심각한 인권침해로 지목했고, 차별 문제에서는 '비정규직 문제'(95.6%)를 가장 심각한 차별 이슈로 꼽았다.인권이 존중되지 않는 집단으로 일반인은 성매매 여성(84.7%), 전과자(80.3%), 노숙자(81.2%), 구금시설 수용자(76.7%) 등을 꼽았으며, 전문가는 여성(64%), 노인(58.2%), 군 복무자(51.1%) 등을 들었다.이번 실태조사 보고서는 서울대학교 사회발전연구소가 인권위 의뢰를 받아 5월부터 11월까지 전국에 사는 만 15세 이상 국민 1천500명과 인권 관련 전문가 225명을 대상으로 설문조사해 작성했다.pan@yna.co.kr[관련기사]▶ <절차 생략 '친북' 카페 폐쇄, 논란 끝 '정당'>▶ 인권단체 ""KT 산재 근로자 차별받았다""▶ 인권위, 장애아동 가혹행위 시설장 고발▶ 인권위 ""재소자 강제 이발은 인권침해""▶ 인권위 ""경찰, 수갑사용 규정 마련"" 권고<연합뉴스 모바일앱 다운받기><포토 매거진><저작권자(c)연합뉴스. 무단전재-재배포금지.>"
70,2011-12-07,<한나라 지도체제 붕괴>‘신당 창당’ 움직임 곳곳 포착… 與 쇄신 실패땐 급피치,https://news.naver.com/main/read.nhn?mode=LSD&mid=shm&sid1=100&oid=021&aid=0002095733,문화일보,"정치권이 신당창당론에 휩싸이고 있다. 한나라당 일각에서 당 쇄신론과 맞물려 거론되는 재창당론은 물론  박세일 한반도선진화재단 이사장이 주도하는 ‘대중도신당’, ‘반(反)이명박, 비(非)박근혜’를 내걸고 있는 중도신당 등 야권 통합 신당과는 별도의 신당 창당 논의가 곳곳에서 감지되고 있다.실제로 한나라당 일부 중진의원들은 외부 세력과 이같은 신당 창당 방안을 구체적으로 협의 중인 것으로 파악되고 있다.이같은 신당 움직임은 한나라당의 쇄신 여부와 밀접한 관계가 있어 향후 상황이 어떻게 전개될지 예단하기 힘든 정치권 빅뱅이 올 수도 있는 상황이다.다양한 신당론은 우선 한나라당이 주축이 돼 신장개업해 창당을 하는 보수대연합 신당론 또는 박근혜 전 대표 중심의 중도신당 재창당이 거론된다. 가장 구체적인 움직임을 보이는 것은 중도신당 구상이다.일부 한나라당 중진인사가 추진하는 이 신당론은 영·호남 화합으로 지역정치 청산을 내걸고 다양한 인사들을 접촉하고 있는 것으로 알려졌다.이 논의는 동서 화합 및 지역 정치 청산을 모토로 김영삼 전 대통령의 상도동계와 고(故) 김대중 전 대통령의 동교동계 세력의 참여가 거론되고 있다.여기에 박 이사장이 이끄는 대중도신당 추진파가 결합해 3대 축을 이룬다는 구상이다.이들은 세 확대를 위해 상도동·동교동계 인사를 비롯, 한나라당 중진 및 소장파들과도 다양한 접촉을 갖고 있는 것으로 확인됐다. 이들의 성격은 ‘반이명박, 비박근혜’가 될 가능성이 높다.특히 이같은 논의에는 영·호남 화합이라는 지역구도 타파가 고(故) 노무현 전 대통령이 내세운 가치란 점을 내세워 문재인 노무현재단 이사장도 참여시켜 합리적 보수와 온건 진보를 함께 아우른다는 구상이다.신선종기자 hanuli@munhwa.com▶최고위원 동반사퇴…한나라 ‘洪대표 체제’ 붕괴▶<한나라 지도체제 붕괴>격랑의 한나라… 洪, 일단 버티며 ‘재창당론’으로 맞불▶<한나라 지도체제 붕괴>중진 상당수 “홍준표 지금 사퇴 안된다”▶<한나라 지도체제 붕괴>쇄신파·수도권 소장파 ‘재창당’ 압박▶<한나라 지도체제 붕괴>洪 “디도스 국조·특검 野와 협의”[Copyrightⓒmunhwa.com '대한민국 오후를 여는 유일석간 문화일보' 무단 전재 및 재배포 금지(구독신청:02)3701-5555)]"
71,2011-12-07,"KT, 2G 폐지 집행정지될까…법원 오늘 결정",https://news.naver.com/main/read.nhn?mode=LSD&mid=shm&sid1=102&oid=001&aid=0005408273,연합뉴스,"(서울=연합뉴스) 나확진 기자 = KT의 2세대(2G) 이동통신(PCS) 서비스가 8일 0시 중단될 예정인 가운데 2G 가입자의 집행정지 신청에 대한 법원의 결정에 관심이 쏠리고 있다.서울행정법원 행정5부는 7일 KT 2G 가입자 900여명이 ""PCS 사업폐지 승인이 위법하다""며 방송통신위원회를 상대로 낸 집행정지신청 사건의 심문을 진행했다.재판부는 서비스 중단 예정 시간을 고려해 이날 안에 인용 여부를 결정할 방침이다.재판에서 가입자들은 ""사실상 서비스 종료를 통지받은 기간이 2주밖에 되지 않는다. 군대나 해외에 있는 가입자는 별다른 대비없이 전화가 끊기게 되는 등 회복할 수 없는 손해가 생길 수 있다""며 본안 판결 때까지 2G 서비스 폐지를 유보하라고 요구했다.또 ""집행정지가 되지 않으면 KT는 바로 내일부터 2G 서비스를 중단하고 4G 가입자를 받게 될 텐데, 이후 본안에서 부당하다고 판결이 나면 4G 가입자 보호문제까지 발생하게 돼 큰 혼란을 겪을 것""이라고 강조했다.방통위는 ""4월과 9월에 이미 2G 서비스가 폐지될 것이라고 KT가 예고했기에 기존 이용자 보호에 소홀했다고 보기 어렵다""며 ""폐지효력이 언제 발생하는지 반드시 명시해서 예고해야 하는 것은 아니다""고 반박했다.KT는 ""현재 2G 가입자는 전화 한 통 만으로 3G 전환이 가능하고, 바로 전환하지 못하는 경우에도 2년까지 번호를 저장해 두기로 했다""며 ""500만명이 쓸 수 있는 공공주파수를 10만명만 쓰는 건 공공의 이익에 부합하지 않는다""고 반박했다.rao@yna.co.kr<연합뉴스 모바일앱 다운받기><포토 매거진><저작권자(c)연합뉴스. 무단전재-재배포금지.>"
72,2011-12-07,겨울에 행복하게 지내는 방법 7가지,https://news.naver.com/main/read.nhn?mode=LSD&mid=shm&sid1=103&oid=296&aid=0000011100,코메디닷컴,"시간 들여 산책하고 피곤한 쇼핑 말도록해마다 이맘때면 다사다난했다는 말을 하곤 하지만, 거리 곳곳에 화려한 장식이  불을 밝히면 사람들 마음은 한결 푸근해진다. 그러나 모든 사람이 즐거울 것 같지만  실제로 연말연시는 많은 이들에게 스트레스가 쌓이는 시간이다. 일부 연구에 따르면  계절성 정서장애(SAD:Seasonal Affective Disorder)나 겨울 우울증을 앓게 되는 사람도  많다고 한다. 겨울이 오면 많은 사람들이 다소 힘이 빠지고 기분이 가라앉는 것을  분명히 느낀다. 여러 가지 마무리져야 할 일도 많기 때문이다.그렇다고 해서 맥 놓고 앉아있을 수만은 없다. 먼저 계획을 세워보자. 운동을  하고 건강한 먹을거리를 챙기고, 기분을 부추기는 각종 활동을 하다보면 행복하게  겨울을 날 수 있다. 미국 인터넷 매체 허핑턴포스트는 ‘행복한 식사(The Happiness  Diet)’의 저자인 드류 램지 콜롬비아 대학교 교수의 도움말을 얻어 겨울 동안 행복하게  지낼 수 있는 방법 7가지를 1일 소개했다.◆ 비타민 수치를 살펴라겨울이 오기 전에 비타민 수준을 체크해야 한다. 특히 우울증을 앓는 환자들의  경우 비타민D와 비타민B12를 살펴야 한다. 비타민D는 장기적이고 악성의 우울성향을  유발할 수 있다. 비타민 수치를 지켜야 건강하게 지낼 수 있고, 면역력도 강화된다.◆ 다소 긴 산책을 하라시간을 들여 오래하는 산책은 겨울에 누릴 수 있는 큰 즐거움 중 하나이다. 겨울  산책은 마법적인 효과를 지닌다. 당신에게 아침의 밝은 빛을 가져다주고, 여름과는  다른 자연의 풍경이 주는 아름다움에 감사하게 만들 것이다. 덧붙여 산책 시간을  좀 길게 하면 몸에 필요한 운동량도 채울 수 있다.◆ 쇼핑하느라 사람들에 부대끼지 마라연말연시에는 쇼핑해야 할 것이 많아 스트레스를 받기가 쉽다. 그냥 사람이 많이  몰리는 곳은 피하는 게 좋다. 사실 시즌이 끝난 뒤 더 좋은 물건을 싸게 살 수도  있다. 또한 백화점이나 쇼핑몰에서 사람들에게 부대끼는 것보다 인터넷을 이용하는  방법도 있다. 정신적으로도 덜 시달리고, 쇼핑도 편안하게 할 수 있다.◆ 뇌에 좋은 음식을 먹어라먹거나 마시는 것에 지나치게 탐닉하면 몸도 비틀거리고 나태해지면서 무거운  기분으로 지낼 수 있다. 따라서 뇌에 좋은 녹색 잎이 많은 야채들, 양배추, 고구마,  오메가3 지방산이 풍부한 음식들을 먹어야 한다. 오메가3 지방산은 자연에 있는 가장  강력한 항우울제의 하나이다. 특히 밤에 술을 많이 마시는 사람들은 달걀, 콩 등  영양소가 풍부한 음식을 먹어 뇌를 회복시켜야 한다. 이들 음식에는 엽산이 풍부해  신경전달물질을 보충해줄 수 있다.◆ 자원봉사를 하라다소 진부하지만 연말연시는 서로 나누는 때다. 그리고 베푸는 대상을 당신 가족뿐  아니라 그 밖의 사람들에게로 확대해야 한다. 당신보다 형편이 나쁜 소외된 이웃에  관심을 갖는 것은 균형감각을 회복하는데 가장 좋은 방법이다. 예로부터 자신이 가진  것을 소중하게 생각하고 다른 사람들에게 행운을 주고 돕는 것은 행복을 가져오는  두 가지 방법으로 꼽히고 있다.◆ 간식도 몸에 좋은 것으로 먹어라연말연시에는 모임이 잦다보니 칼로리를 너무 많이 섭취할 수 있다. 과식을 하게  되면 스스로에게 혐오감만 남는다. 간식으로 무엇을 먹을지 신경을 쓰는 것도 이  계절에 기분 좋게 지낼 수 있는 한 가지 방법이다. 간식으로는 볶은 땅콩이나 호두가  좋다. 치즈도 괜찮은데, 고트(염소) 치즈에는 공액리놀레산(CLA:conjugated linoleic  acid)이 많아 뇌의 건강을 지켜준다.◆ 술을 마실 땐 속도를 조절하라숱한 초대와 모임을 다 거절하지 못하다 보면 오랜 시간 술을 많이 마시고 취하게  된다. 전혀 입에 대지 않을 수 없다면 속도를 조절해라. 술을 마실 때는 물을 충분히  마셔라. 그러면 정신을 잃지 않을 수 있고, 다음날 숙취에서도 벗어날 수 있다.[관련기사]☞다른  사람 뒷담화하면 건강에 좋다고?☞잠꾸러기  만드는 유전자 발견됐다☞겨울  운동, ‘4H’에 신경 써라☞체중  감량 효과…수분 많은 음식 7가지☞일상에서  즐거움 찾는 6가지 방법남인복 기자  (nib503@kormedi.com)저작권ⓒ  '건강을 위한 정직한 지식' 코메디닷컴 / 무단전재-재배포 금지"
