,날짜,기사 제목,기사 링크,기사 출처,기사 내용
105,2011-12-07,[종합]與지도부 사실상 '붕괴'…유·원·남 사퇴,https://news.naver.com/main/read.nhn?mode=LSD&mid=shm&sid1=102&oid=003&aid=0004229393,뉴시스,"【서울=뉴시스】박주연· 김동현 기자 = 한나라당 유승민·원희룡·남경필 최고위원이 7일 당 최고위원직을 동반 사퇴했다.홍 대표를 제외한 사실상 모든 선출직 최고위원이 홍 대표를 비토하며 동반사퇴함에 따라 한나라당 지도부는 붕괴에 위기에 놓였다.또 다른 선출직인 나경원 최고위원은 의원직을 내놓고 도전했던 10·26 서울시장 선거에서 패배한 후 당 회의에 출석하지 않고 있다.친박(박근혜)계인 유 최고위원은 이날 오전 8시40분 ""당은 다시 태어나서 이 나라와 국민을 지켜야 한다""고 강조하며 사퇴를 선언했다.소장파인 원 최고위원도 뒤이어 8시55분 기자회견을 갖고 ""당을 해체하고 건강한 개혁적 보수정당을 만들어야 한다""며 사퇴했다.남 최고위원은 9시에 비공개로 열린 당 최고중진연석회의에 참석, 홍 대표의 동반사퇴를 설득하다 실패해 10시께 기자에서 당직사퇴를 밝혔다.유 최고위원과 원 최고위원은 사퇴 후의 당 운영 방향에 대해 이견을 보였다. 하지만 세 최고위원 모두 당의 10·26 재보궐선거 당일 중앙선거관리위원회의 디도스(DDoS·분산서비스거부) 공격에 대한 홍준표 대표의 대응과 당 운영방식 등이 사퇴의 원인이었다고 지적했다.홍 대표는 이들과 별도로 오전 11시 당사에서 기자회견을 갖고 세 최고위원의 사표를 수리하지 않겠다는 입장을 밝혔다.그는 예산 국회가 끝날 때까지 내년도 예산안 처리와 당 쇄신안을 추진하고 이후 자신의 거취를 정하겠다는 입장이다.◇유승민 ""당 다시 태어나 국민 지켜야""유승민 최고위원은 ""지도부의 한 사람으로서 존망의 위기에 처한 당을 구하지 못한 책임을 지고 물러난다""며 ""당은 다시 태어나서 이 나라와 국민을 지켜야 한다""고 강조했다.유 최고위원은 ""평당원으로 돌아가 떠나간 민심을 되찾기 위해 미력을 다하겠다""며 ""당에 마지막 기회를 허락해 주시기를 국민 여러분께 간곡히 호소한다""고 말했다.그는 최고위원직 사퇴 배경에 대해 ""서울시장 보궐선거 이후부터 고민해왔고 결정적인 것은 중앙선거관리위원회에 대한 디도스 공격건""이라며 ""당의 연루 부분은 전혀 밝혀진 바 없지만 사건이 터지고 당이 무기력하게 대처하는 것에 책임을 느껴 사퇴 결심을 굳혔다""고 밝혔다.이어 ""지금 경찰 수사가 진행되고 있지만 한나라당이 오히려 적극적으로 나서서 특별검사제(특검)를 도입해야 한다""며 ""그렇게 해야 혼란을 줄이고 진실을 규명할 수 있으며, 결과가 나오면 당이 응분의 책임을 져야 한다""고 강조했다.유 최고위원은 ""사퇴에 앞서 박 전 대표와 논의를 했느냐""는 기자들의 질문에 ""보고를 못했다""며 ""당이 어려운 상황이라 고민해 결심했고, 회견 직후에 보고를 할 것인데 이해해 줄 것으로 믿는다""고 밝혔다.그는 당의 향후 진로에 대해 ""당이 분열되지 않고 화합해 당원들이 나아가야 할 길을 모색해야 한다""고 말해 당 해체에 대한 반대 입장을 분명히 했다.◇원희룡 ""9급비서 단독범행 안 믿는다""원희룡 최고위원은 ""중앙선거관리위원회에 대한 디도스 공격이 (최구식 의원의) 9급 비서 단독 범행이라고 믿지 않는다""며 ""경찰이 단독범행이라고 결론을 지으면 더 문제가 될 것""이라고 강조했다.원 최고위원은 ""당 지도부가 디도스 사건에 대해 알려고 하지 않는다""며 ""이번주 내에 결과 발표를 할 것으로 보는데, 경찰이 단독범행이라고 결론을 내리면 국민들의 상식적 의문으로 의혹이 더 커지고 감당할 수 없는 상황으로 갈 것""이라고 강조했다.원 최고위원은 ""더한 말도 하고 싶지만 홍준표 체제와 박근혜 대세론으로는 안 된다""며 ""상황을 만든 당사자의 처절한 반성이 있어야 한다""고 주장했다.이어 ""건강한 개혁적 보수정당을 만들기 위해 당을 해체해야 한다""며 ""내가 아는 흐름만 해도 (해체 움직임이) 세 갈래""라며 ""어떤 그룹이 요청을 해와도 모두 돕겠다""고 말했다.그는 ""당내 의원들 사이의 체감 온도차가 다르다""며 ""영하라고 느끼는 사람이 있고, 봄날이라고 느끼는 사람이 있는데, 봄날이라고 느끼는 사람과 거기에 둘러싸인 사람들이 한나라당 위기의 주범""이라고 목소리를 높였다.그는 ""박근혜 전 대표도 쇄신대상인가""라는 기자들의 질문에 ""나 자신도 쇄신대상""이라며 ""지금처럼 폐쇄적이고 수동적인 모습으로는 박근혜가 아니라 박정희가 나와도 안 된다""고 답했다.◇남경필 ""지도부임에도 의견반영 안 돼""남경필 최고위원은 ""모든 기득권을 버리고 혁신을 이뤄내기 위해 최고위원직에서 사퇴한다""며 ""한 명의 국민, 당원의 마음으로 당의 혁신과 국민 신뢰회복을 위해 모든 것을 던지겠다""고 말했다.남 최고위원은 특히 ""반성부터 시작하자는 내 목소리는 지도부임에도 불구하고 (당 의사결정에) 반영되지 못했다""며 홍준표 대표에 대한 불만을 나타냈다.이어 ""국민의 경고에 대처하지 못한 당과 이명박 정부는 국민들로부터 회초리를 맞고 있다""며 ""혁명적인 혁신만이 유일한 길""이라고 강조했다.남 최고위원은 ""지도부가 동반 사퇴를 하는 것이 옳다고 판단했다""며 ""홍 대표에게 진심어린 제안을 했지만, 홍 대표는 동반사퇴를 하지 않는 것으로 결론을 내렸다""고 밝혔다.그는 사퇴를 결심하게된 계기에 대해 ""10·26 재·보선 패배 이후 항상 마음속에 맴돌았던 생각""이라며 ""실제 사퇴를 결심하게 된 것은 정치를 함께 해왔던 의원들이 당을 떠날지도 모른다는 고민을 나눈 이후""라고 밝혔다.이어 ""지도부가 물러나서 힘의 공백이 생겨야 새로운 질서가 생길 수 있는 공간이 열릴 수 있다""며 ""(오늘의 사퇴는) 공간을 열기 위해 하는 것""이라고 강조했다.pjy@newsis.comoj1001@newsis.com[뉴시스 이시간 핫 뉴스]ㆍ 안철수·박원순 비밀회동…향후 진로 논의배경은?ㆍ ´투캅스3´ 히로인 권민중 강남서 음주사고ㆍ 김무성 ""한나라당 망친 5명"" 발언 논란ㆍ 야전부대 새벽잠 설치게 한 ´진돗개 하나´ㆍ ""MB실정 두고 볼 수 없어 DJ, 노무현 정치 나서려했다""★ 손 안에서 보는 세상, 모바일 뉴시스<저작권자ⓒ 공감언론 뉴시스통신사. 무단전재-재배포 금지.>"
106,2011-12-07,고의추돌 억대 보험료 꿀꺽…보험사기단 덜미,https://news.naver.com/main/read.nhn?mode=LSD&mid=shm&sid1=102&oid=003&aid=0004229318,뉴시스,"【서울=뉴시스】홍세희 기자 = 생활고에 시달리던 전·현직 택시 기사와 불법게임장 종업원, 화물기사 등이 조직적으로 가담한 보험사기단이 경찰에 붙잡혔다.서울 방배경찰서는 7일 고의로 교통사고를 내고 수억원의 보험금을 받아 챙긴 김모(50)씨 등 일당 109명을 사기 혐의로 불구속 입건했다.김씨 등은 지난 2005년 11월부터 올해 5월까지 서울과 경기 부천 일대에서 고의로 교통사고를 내고 보험사로부터 58차례에 걸쳐 모두 5억여원을 받아 챙긴 혐의를 받고 있다.경찰 조사결과 브로커 김씨는 택시 운전을 해오면서 알게 된 동료 기사, 오락실 관계자, 화물기사, 택배기사, 대리운전사 등 생활형편이 어려운 사람들을 끌어모아 이같은 범행을 저지른 것으로 드러났다.또 김씨는 점차 가담자를 확대시키면서 보험사와 경찰에 적발되지 않기 위해 과거 위장 교통사고의 가해자와 피해자가 중복되지 않도록 나눠 탑승시키는 등 치밀하게 범행을 계획한 것으로 밝혀졌다.이들은 브로커 김씨가 차량 번호를 알려주면 가해차량과 피해차량에 나눠 탑승해 앞 차가 신호대기로 정지하면 가해차량이 고의로 뒤에서 추돌하는 수법으로 교통사고를 냈다.이들은 지난 5월 피해차량 탑승자와 가해차량 운전자가 과거에도 동일 수법으로 사고를 냈던 이력이 있는 것을 수상히 여긴 보험회사가 경찰에 신고에 결국 덜미를 잡혔다.경찰 관계자는 ""이들이 주로 입원한 강서구 일대의 병원 3곳에 대해서도 불법행위 여부를 수사하고 있다""며 ""범행에 가담된 사람이 더 있을 것으로 보고 수사를 확대해 나갈 예정""이라고 말했다.hong1987@newsis.com[뉴시스 이시간 핫 뉴스]ㆍ 안철수·박원순 비밀회동…향후 진로 논의배경은?ㆍ ´투캅스3´ 히로인 권민중 강남서 음주사고ㆍ 김무성 ""한나라당 망친 5명"" 발언 논란ㆍ 야전부대 새벽잠 설치게 한 ´진돗개 하나´ㆍ ""MB실정 두고 볼 수 없어 DJ, 노무현 정치 나서려했다""★ 손 안에서 보는 세상, 모바일 뉴시스<저작권자ⓒ 공감언론 뉴시스통신사. 무단전재-재배포 금지.>"
107,2011-12-07,"홍준표 즉각사퇴 거부..""책임감 있게 행동""(2보)",https://news.naver.com/main/read.nhn?mode=LSD&mid=shm&sid1=100&oid=001&aid=0005407460,연합뉴스,"한나라당홍준표 대표(자료사진)""자리 연연 안해""..사태수습 후 물러날 듯(서울=연합뉴스) 심인성 기자 = 한나라당 홍준표 대표는 7일 유승민ㆍ남경필ㆍ 원희룡 최고위원의 동반사태와 관련, 즉각사퇴를 거부하면서 ""책임감 있게 행동하겠다""고 밝혔다.그는 이날 여의도 당사에서 긴급 기자회견을 같고 이같이 말한 뒤 ""그러나 자리에 연연하지 않겠다""고 강조했다.이에 따라 홍 대표는 내년도 예산안 처리와 당 쇄신 방안을 마련한 후 물러날 것으로 관측된다.sims@yna.co.kr[관련기사]▶ 홍준표 즉각 사퇴 안할 듯▶ 홍준표 오후 입장표명..중진들 ""총사퇴 없을 듯""▶ <박근혜 당운영 전면 나설듯..비대위원장 유력>▶ <표류하는 한나라號 향방은..험로 예고>-1▶ <총선 4개월전 與지도부 사퇴..정국 파장><연합뉴스 모바일앱 다운받기><포토 매거진><저작권자(c)연합뉴스. 무단전재-재배포금지.>"
108,2011-12-07,"홍준표, 즉각사퇴 거부..""사태수습후 사퇴""",https://news.naver.com/main/read.nhn?mode=LSD&mid=shm&sid1=100&oid=001&aid=0005407430,연합뉴스,긴급 기자회견<연합뉴스 모바일앱 다운받기><포토 매거진><저작권자(c)연합뉴스. 무단전재-재배포금지.>
109,2011-12-07,"홍준표, 11시 기자회견...지도부 '줄사퇴' 입장",https://news.naver.com/main/read.nhn?mode=LSD&mid=shm&sid1=100&oid=008&aid=0002680740,머니투데이,"[머니투데이 변휘 기자]홍준표 한나라당 대표가 7일 오전 11시 여의도 당사에서 최고위원 3명의 '줄사퇴'에 대한 입장을 밝히는 기자회견을 가질 예정이다.이날 오전 유승민·원희룡·남경필 최고위원은 차례로 최고위원직 사퇴를 표명하는 기자회견을 갖고 홍 대표를 비롯한 당 지도부 동반사퇴를 촉구했다.그러나 기자회견 직전까지 홍 대표와 면담했던 남 최고위원은 ""홍 대표는 동반사퇴할 의사가 없다""고 전해 곧 열릴 기자회견에 관심이 집중되고 있다.[나도 부자가 될 수 있을까? 긴급 추천 스마트정보!][내손안의 스마트한 경제정보 머니투데이 모바일][관련 키워드]한나라당|민주당[머니투데이 핫뉴스]☞""내년 플렉서블 디스플레이, 혁신 가져온다""☞국내 '엔젤투자' 대박 성공사례 나왔다☞""집주인, 전세→월세 전환 이유있었네""☞""언제 복귀하나"" 디도스 사건에 고민 깊어지는 나경원☞""집부자만 신났네""…양도세 중과 폐지 효과는?변휘기자 hynews@<저작권자 ⓒ '돈이 보이는 리얼타임 뉴스' 머니투데이, 무단전재 및 재배포 금지>"
110,2011-12-07,檢 '벤츠 여검사' 진정인 절도 구속의견 묵살 의혹,https://news.naver.com/main/read.nhn?mode=LSD&mid=shm&sid1=102&oid=001&aid=0005407374,연합뉴스,"경찰의 2차례 구속의견에 보강수사 지휘후 무혐의로 처리당시 진정인 변호인은 문제의 최 변호사(부산=연합뉴스) 이종민 민영규 기자 = '벤츠 여검사' 의혹 사건을 진정한 이모(40.여)씨가 연루된 절도사건에 대해 검찰이 구속의견을 올린 경찰의 요구를 두 차례나 묵살했던 것으로 드러났다.절도 피의자 이씨의 당시 변호인은 '벤츠 여검사'사건의 핵심인물인 최모(49) 변호사였다.7일 부산 금정경찰서에 따르면 부산에서 사업을 하는 김모(56.여)씨는 자신의 집에서 명품 옷 34벌 등을 훔친 혐의로 진정인 이씨를 지난해 12월29일 경찰에 고소했다.김씨는 같은 교회를 다니던 이씨가 지난해 9월부터 자기 집에 놀러왔다 간 뒤부터 의류가 없어지자 이씨의 소행으로 보고 지난해 12월4일 친구와 함께 이씨의 절도현장을 잡았다.이씨는 당시 체크무늬 치마, 검정 자켓 등 의류 4점을 훔쳤고, 절도행각이 김씨에게 발각되자 김씨의 친구가 있는 자리에서 울면서 ""한번만 봐달라""고 사과했던 것으로 경찰조사에서 나타났다.그러나 이씨가 사과한 뒤에도 훔친 옷을 그대로 갖고 가 버리자 이에 김씨가 분노, 이씨를 절도 혐의로 경찰에 고소해 수사가 시작됐다.수사에 나선 경찰은 지난 3월 중순 이씨가 죄질이 안좋고 혐의를 부인해 증거인멸 우려가 있는데다 절도죄 집행유예기간이어서 검찰에 구속의견을 올렸으나 검찰은 보강수사 지휘를 내렸다.경찰은 검찰이 지휘한 내용대로 절도 물품의 가격, 종류를 분류하고 사진을 첨부해 지난 4월 중순께 다시 구속의견을 올렸으나 검찰은 같은 달 말 이씨에 대해 불구속 송치지휘를 내렸다.이 사건을 넘겨받은 검찰은 이씨가 혐의를 부인하고 목격자가 진술을 번복하자 지난 6월 아예 무혐의 처분결정을 내리고 오히려 김씨에 대해 무고혐의로 조사를 벌였다.당시 사건담당 경찰관은 ""구속요건을 모두 갖췄기 때문에 불구속송치 지휘가 내려질 것으로 예상하지 못했다""며 ""두차례나 보강수사 지휘 뒤 결국 불구속 송치되고 나중에 무혐의 처리된 것을 보고 당황스러웠다""고 말했다.이에 대해 검찰은 ""목격자가 처음에는 '이씨가 자기 가방에서 김씨 옷이 나오자 잘못했다며 반성하는 것을 봤다'고 진술했다가 검찰조사에서 '그런 일이 없다'고 번복해 무혐의 결정이 내려진 것으로 안다""고 해명했다.그러나 당시 이씨가 선임한 변호인이 자기와 깊은 친분관계에 있던 최 변호사로 드러나 당시 사건이 제대로 처리됐는지에 대해 의혹이 일고 있다.더구나 검찰은 최 변호사가 이 사건 해결을 위해 이씨에게 ""부산지검 검사 등 여러 명에게 로비를 해 무혐의가 나오도록 해주겠다""는 내용의 각서까지 써 준 것으로 전해져 의혹은 더욱 증폭되고 있다.특임검사팀은 이런 내용의 각서를 확보해 의혹을 확인하고 있는 것으로 알려졌다.한편 사건 의뢰인이었던 이씨는 이후 최 변호사가 벤츠 여검사로 알려진 이모(36) 전 검사 때문에 자신과 사이가 틀어지자 검찰에 최 변호사 로비 의혹을 진정했다.ljm703@yna.co.kr[관련기사]▶ '벤츠 女검사' 영장실질심사..오후 구속여부 결정▶ 벤츠 제공 변호사, 사건의뢰인 승소액 편취 논란▶ '벤츠 女검사' 알선수재 혐의 구속영장 청구(종합)▶ '벤츠 女검사' 변호사 법인카드 사용 일부 확인▶ <'벤츠 女검사' 어떤 조사받나><연합뉴스 모바일앱 다운받기><포토 매거진><저작권자(c)연합뉴스. 무단전재-재배포금지.>"
111,2011-12-07,"절차 생략 '친북' 카페 폐쇄, 논란 끝 '정당'",https://news.naver.com/main/read.nhn?mode=LSD&mid=shm&sid1=102&oid=001&aid=0005407054,연합뉴스,"폐쇄 조치 적법절차 안지켜 지적… 인권위 진정 기각(서울=연합뉴스) 이지헌 기자 = 친북 성향의 게시물을 담은 포털 카페가 적법한 절차 없이 부당하게 폐쇄 조치됐다는 진정에 대해 국가인권위원회가 기각 결정을 내렸다.7일 인권위에 따르면 국내 포털에 등록된 카페 2곳의 회원 단체는 최근 자신들이 운영하는 카페가 국가보안법을 위반하는 정보를 담았다는 이유로 정당한 절차를 거치지 않고 폐쇄조치된 것은 인권침해라며 진정을 냈다.해당 카페는 북한을 찬양하는 글을 게재한 혐의로 경찰 수사를 받던 중이었다.경찰은 포털업체에 해당 카페에 대한 접근제한 조치 협조요청을 했고 포털업체는 이를 받아들여 카페를 폐쇄했다.불법 정보를 유통한 인터넷 사이트를 제재할 때는 통상 방송통신심의위원회의 심의를 거쳐야 하지만 해당 카페는 이 같은 절차를 거치지 않았다.인권위는 5일 전원위원회를 열고 이와 관련한 진정 사건을 두고 논의를 벌였다.재적 위원 11명 중 8명이 참석한 이날 회의에서 위원들은 엇갈린 의견을 내놓았다.찬성 측 위원들은 '표현의 자유'와 같은 기본권의 제한은 법에 근거해 이뤄져야한다는 원칙에 따라 경찰의 협조요청만으로 카페 접근이 차단된 것은 인권침해라는 의견을 냈다.반대 측 위원들은 경찰의 협조요청에 강제성이 있다고 보기 어려우며 접근제한 조치는 포털업체의 자율적인 심의에 따른 것으로 봐야한다는 의견을 냈다.사건을 담당한 실무 부서는 게시 내용의 위법성 여부 판단을 떠나 카페 폐쇄 조치는 적법절차에 따라 이뤄져야 한다는 취지에 따라 인용 의견을 낸 상태였다.인권위의 진정 사건이 인용되려면 위원 6인 이상의 찬성이 있어야 하지만 찬성 위원 숫자가 미달돼 사건은 결국 기각됐다.인권위 관계자는 ""논의 과정에서 위원들의 의견이 팽팽히 맞섰다""라며 ""기각된 진정 사건은 일반적으로 결정문을 내지 않지만 이번 경우는 예외적으로 결정문을 작성해 다양한 의견을 담아내기로 했다""고 말했다.minor@yna.co.kr[관련기사]▶ `240명 회원' 종북카페 운영 前장교 구속(종합)▶ 해외친북사이트 급증…포털 카페 활개(종합)▶ <친북게시물 기장 ""월북 꿈에도 생각안해"">▶ 종북 혐의 공무원·변호사 등 70여명 수사(종합)▶ ""SNS 등 사이버공간서 친북선전물 폭증""(종합)<연합뉴스 모바일앱 다운받기><포토 매거진><저작권자(c)연합뉴스. 무단전재-재배포금지.>"
112,2011-12-07,강남3구 투기과열 해제…양도세 중과도 폐지,https://news.naver.com/main/read.nhn?mode=LSD&mid=shm&sid1=101&oid=008&aid=0002680651,머니투데이,"[머니투데이 전병윤 기자][정부, 주택시장 정상화 및 서민주거안정 지원방안…재건축 초과이익부담 2년간 유예]서울 강남3구(강남·서초·송파)의 투기과열지구 빗장이 풀린다. 다주택자에 대한 양도소득세 중과제도는 7년 만에 폐지되고 재건축 초과이익 부담금도 2년간 중지된다.정부는 7일 이같은 내용을 담은 '주택시장 정상화 및 서민주거안정 지원방안'을 발표했다. 우선 강남3구에 대해 투기과열지구가 해제된다. 투기과열지구에서 풀리면 분양권 전매 제한과 청약자격 제한 등이 완화되고 재건축 조합원이 보유한 아파트 매각도 자유로워진다.국토해양부는 이번 조치로 인해 조합설립인가된 26개 단지 1만9000명의 조합원 지위양도가 가능해지고 조합설립을 추진 중인 22개단지 2만2000명도 혜택을 볼 것으로 내다봤다.투기수요 억제를 위해 지난 2005년부터 시행중인 다주택자 양도세 중과제도 폐지도 추진하기로 했다. 3주택자 이상이 주택을 팔면 양도차익의 60% 세율을 적용했고 2007년부터 2주택자의 경우도 50% 세율을 적용한 바 있다. 그러나 이명박 정부 들어 내년 말까지 한시적으로 적용을 유예, 기본세율(6~35%)을 과세하고 있다.정부는 영구적으로 다주택자의 양도세 중과 폐지를 위해 내년 중 소득세법 개정안을 마련해 국회에 제출할 방침이다.재건축으로 얻은 초과이익에 대한 부담금 제도도 2년간 한시적으로 유예한다. 재건축 아파트 시장이 침체를 겪으며 사업 진행이 지지부진한데 따른 활성화 방안이다.국토부는 다만 재건축 초과이익 부담금은 개발이익 환수라는 제도 도입취지를 감안, 제도 자체를 유지하되 현재의 재건축 위축상황을 고려해 2년 동안만 한시적으로 중지한다고 설명했다.올해 말 종료 예정이던 생애최초 주택구입자금은 내년 말까지 연장하고 1조원을 추가 지원한다. 금리도 4.7%에서 4.2%로 낮추고 지원 대상을 부부합산 연소득 4000만원 이하에서 5000만원 이하로 확대했다. 근로자·서민 주택구입자금의 지원대상도 부부합산 연소득 2000만원에서 3000만원 이하 무주택자로 확대했다.보금자리주택(연 15만 가구 건설)은 지구여건에 따라 분양주택 용지 일부를 5년 임대 또는 10년 임대로 전환해 임대물량을 확대해 공급키로 했다. 다세대·연립·도시형생활주택 등에 대한 저리(연 2%) 건설자금 지원도 내년까지 연장하기로 했다.청약제도도 개선된다. 비수도권의 경우 시·군 단위로 제한된 청약가능 지역을 도 단위로 확대하고 미분양 우려 지역에 대해서는 1~2순위 순차분양을 1~2순위 동시분양으로 할 수 있도록 허용키로 했다.또한 땅값이 안정되고 투기우려가 낮은 지역에 대해서는 토지거래허가구역을 추가 해제할 방침이다.어려움을 겪고 있는 건설업계에 대한 지원 방안도 마련했다. 내년부터 공공공사 100억원 이상까지 확대할 예정이던 최저가낙찰제는 건설경기 침체와 저가 출혈경쟁에 따른 중소업체의 어려움을 고려해 2년간 유예하기로 했다.프로젝트파이낸싱(PF) 사업의 정상화를 돕고 부실 PF를 조기에 정리하기로 했다. 사업추진이 부진한 공모형 PF 정상화를 위해 정부 내 조정위원회를 설치해 사업조건을 조정하는 등의 방안을 마련할 계획이다. 부실 PF 사업장은 PF 정상화뱅크 등에서 인수해 최대한 정상화를 추진할 방침이다. 또 은행권의 부실 PF사업장 증가 등이 발생할 경우 내년에 제2차 PF 정상화뱅크 설립을 검토하기로 했다.정부는 자금난을 겪고 있는 건설업계에 유동성을 지원하기 위해 건설사 프라이머리-부채담보부증권(P-CBO)을 추가 발행해 신용이 낮은 건설사의 숨통을 틔우기로 했다.[나도 부자가 될 수 있을까? 긴급 추천 스마트정보!][내손안의 스마트한 경제정보 머니투데이 모바일][관련 키워드]재건축|서민주거안정|주택경기활성화|강남3구|투기과열지구|양도세[관련기사]☞""집부자만 신났네""…양도세 중과 폐지 효과는?☞""집주인, 전세→월세 전환 이유있었네""☞건설업계 ""알맹이 빠진 대책""…싸늘한 '시선'전병윤기자 byjeon@<저작권자 ⓒ '돈이 보이는 리얼타임 뉴스' 머니투데이, 무단전재 및 재배포 금지>"
