,날짜,기사 제목,기사 링크,기사 출처,기사 내용
28,2011-12-07,"빼앗긴 문화재 14만여 점, 여전히 남의 손에…",https://news.naver.com/main/read.nhn?mode=LSD&mid=shm&sid1=103&oid=055&aid=0000217884,SBS,"<8뉴스><앵커>안평대군이 꿈에 본 광경을 그리게 했다는 몽유도원도입니다. 조선시대 대표적인 산수화지요. 지금 일본에 있습니다. 직지심체요절 세계에서 가장 오래된 금속활자본입니다. 이건 프랑스에 있습니다. 프랑스에는 또 신라 승려 혜초가 쓴 왕오천축국전도 남아 있습니다. 이렇게 타향을 떠돌고있는 우리 중요 문화재가 하나 둘이 아닙니다. 해외 문화재 환수는 이제부터 시작인 겁니다.안정식 기자입니다.<기자>조선 전기 산수화의 대표적 명작으로 꼽히는 안견의 몽유도원도.임진왜란 당시 약탈된 이 작품은 현재 일본 나라현의 텐리대학교가 소장하고 있습니다.90년대부터 환수 노력이 시작됐지만, 텐리대학 측은 꿈쩍도 하지 않고 있습니다.[김진명/작가, '몽유도원도' 환수 운동 추진 : 자기네는 정식으로 돈을 주고 샀으니까 한국에 돌려줄 의무가 없다. 이게 텐리대학의 입장이에요.]이렇게 해외에서 환수되지 못하고 있는 우리 문화재는 20개국에 14만여 점, 약탈당했다는 추정은 가능하지만, 흘러나간 경로를 파악할 수 없어 환수가 쉽지 않습니다.국제적으로도 문화재를 원래의 생산국에 되돌려줘야 한다는 원칙이 확립돼 있지 않고, 특히 일본은 한일협정으로 모든 청구권이 소멸됐다고 주장하고 있습니다.우리 정부도 국제법과 외교 문제를 고려해 적극적으로 나서지 못하고 있습니다.[혜문 스님/문화재제자리찾기 사무총장 : 정부가 나서기보다 민간이 주도하고 국회에서 특위와 같은 것이 구성되서 정부와 국회가 보조를 맞춘다면, 더 좋은 결과를 내지 않을까 하는 생각을 하고 있습니다.]전문가들은 이번 왕실의궤 반환에서 보듯이 우리 문화재를 찾겠다는 국민적 관심과 함께 정부의 보다 적극적인 지원이 이뤄질 때, 해외에 있는 우리 문화재를 찾아올 수 있다고 강조합니다.[김진명 : 나라의 힘이라는게 비단 경제에만 있는 것은 아니거든요. 과거에 우리가 빼앗겼던 문화재를 기억하고, 그걸 찾으려고 하는 노력이...그거야말로 선진국에 이르는 첩경이고.](영상취재 : 김학모, 영상편집 : 위원양)안정식cs7922@sbs.co.kr관/련/정/보◆ 강제 반출 조선왕실의궤·도서 '100년만의 귀환'◆ 주일대사 ""일본 도서반환, 과거사 반성 성의 표시""◆ 일본 외상, 도서반환 양국 국민감정 개선 기대◆ [영상토크] 의궤에 든 '조선 역사' 돌아왔다☞[SBS기자들의 생생한 취재현장 뒷이야기 '취재파일']☞ SBS뉴스 공식 SNS [SBS8News 트위터] [페이스북] [미투데이] [요즘]저작권자 SBS&SBS콘텐츠허브 무단복제-재배포 금지"
29,2011-12-07,적벽대전처럼 떼로 저항…중국어선 횡포 심각,https://news.naver.com/main/read.nhn?mode=LSD&mid=shm&sid1=100&oid=055&aid=0000217877,SBS,"- 불법 어선 잡아도 풀려나기 일쑤 -<8뉴스><앵커>서해 바다가 무법천지로 변했습니다. 중국어선들 때문입니다. 단속하는 우리 해경을 만나면 겁먹고 달아나는게 아니라, 삼국지의 적벽대전처럼 떼로 몰려서 저항을 합니다. 그나마 잡아도 바다 위에서 풀려나기 일쑤입니다.이주형 기자가 상황 알아봤습니다.<기자>지난 달 16일 서해 한국 측 배타적경제수역.11척의 중국 어선이 일렬횡대로 뭉쳐 위력을 과시하고 있습니다.한국 해경의 단속에 대한 저항이자 위협입니다.사흘 뒤인 19일 제주 북서방 28km 지점 한국 영해상입니다.제주해경 고속단정이 악천후 속에서 위태롭게 나포 작전을 펼칩니다.[안동주/제주해경 특수기동대원 : 우리 영해 내에까지 와서 조업하기 때문에 이것은 우리 공권력에 대한 도전이고 하니까.]지난 주 서해상에서 불법조업하다 서해어업관리단에 나포된 중국 어선을 찾아가봤습니다.맨 먼저 눈에 띈 건 어선 양 옆으로 길게 두른 철조망.[정경빈/서해어업관리단 단속대원 : 승선을 못하게끔 차단을 해놓은 겁니다. 심지어 여기다 이렇게 창살까지 넣어가지고 사람들을 위협하기 위해서 꽂아놓기도 하거든요.]나포된 중국어선의 창고를 열어보니, 멸치가 십 톤 넘게 가득차 있습니다.무허가 중국 어선이 불법 어구를 사용해 잡아 올린 겁니다.[김성화/서해어업관리단 항해장 : 10mm이하의 아주 작은 그물을 사용해서 고기 씨를 말리고 있습니다.]그러나 이 배는 담보금 약 5천만 원을 내고 하루 만에 풀려났습니다.중국에서 미리 담보금을 준비하고 있다가 단속에 걸리면 한국에 있는 관계자를 통해 납부한 뒤 잡은 고기를 싣고 재빨리 떠나는게 요즘 추세입니다.그래도 불법 조업으로 남는 게 더 많기 때문입니다.[최재곤/목포해경 홍보실장 : 올해 같은 경우 지금 중국어선 124척을 나포했는데요, 그중 97척이 담보금을 하루 만에 납부하고 석방됐습니다.]어민들과 관련 전문가들은 담보금을 올리고 나포한 어선과 어획한 물고기는 압수하라고 주장합니다.하지만 중국이 적극적으로 자국 어선을 통제하지 않는 한 단속 수위를 높이는 것 만으로는 중국어선들의 인해전술식 불법조업을 해결하기에 한계가 있어 보입니다.오늘(6일) 밤 8시50분 방송되는 '기자가 만나는 세상- 현장21'에서는 중국 어선들의 불법 어로 실태를 자세히 전합니다.(영상취재 :  유동혁)이주형joolee@sbs.co.kr관/련/정/보◆ 검찰, EEZ 중국어선 불법조업 엄단…담보금 상향◆ 인천해경, 불법조업 중국어선 2척 나포◆ 영해 침범·집단행동 중국 어선 선장 등 9명 구속◆ 영화같은 추격전 끝에 '싹쓸이 어선' 26척 나포☞[SBS기자들의 생생한 취재현장 뒷이야기 '취재파일']☞ SBS뉴스 공식 SNS [SBS8News 트위터] [페이스북] [미투데이] [요즘]저작권자 SBS&SBS콘텐츠허브 무단복제-재배포 금지"
30,2011-12-07,국내 유통되는 일본 분유서 세슘 검출 '충격',https://news.naver.com/main/read.nhn?mode=LSD&mid=shm&sid1=104&oid=055&aid=0000217871,SBS,"- 메이지사, 40만 통 긴급 수거 -<8뉴스><앵커>일본의 유아용 분유에서 방사능 물질인 세슘이 검출됐습니다. 이게 우리나라에서도 인기가 높은 제품입니다.도쿄에서 김광현 특파원입니다.<기자>일본의 최대 식품회사인 메이지사는 자사가 제조, 판매한 분유 메이지 스텝에서 방사성 세슘이 검출됐다고 밝혔습니다.검출된 양은 1kg 당 최고 30.8 베크렐로, 분유에서 방사성 세슘이 검출된 것은 이번이 처음입니다.문제가 된 분유는 모두 사이타마현의 가스카베시 공장에서 만든 것으로 원료로 사용된 우유는 후쿠시마 원전 사고 이전에 생산된 것으로 알려졌습니다.[일 후생노동성 담당자 : 대기 중의 방사성 물질이 건조 시키는 제조 과정에서 들어간 것으로 보입니다.]메이지사는 현재 유통 중인 40만 통의 분유를 무상 교환 형태로 긴급 수거하기로 했습니다.하지만 지금까지 실제로 얼마가 소비됐는지는 파악되지 않았습니다.검출된 세슘의 양이 기준치인 1kg당 200베크렐 이하지만 방사능 물질에 취약한 유아용 분유인 만큼 일본 열도는 충격에 빠졌습니다.[도쿄 시민 : 생각하지 못했던 일이라 모두 걱정하고 있습니다.]메이지사 분유는 우리나라에도 인터넷 통신 판매 등를 통해 유통되고 있습니다.메이지사의 주가가 10% 가까이 폭락한 가운데 일본 정부는 긴급 조사에 착수했습니다.(영상취재 : 안병욱, 영상편집 : 김호진)김광현teddykim@sbs.co.kr관/련/정/보◆ 일본 유명 유아용 분유서 세슘 검출 파문◆ 후쿠시마 원전서 고농도 오염수 45톤 누수◆ 일본산 냉장명태 2건에서 방사성 세슘 또 검출◆ 안전하다더니…후쿠시마 '방사능 쌀' 첫 확인☞[SBS기자들의 생생한 취재현장 뒷이야기 '취재파일']☞ SBS뉴스 공식 SNS [SBS8News 트위터] [페이스북] [미투데이] [요즘]저작권자 SBS&SBS콘텐츠허브 무단복제-재배포 금지"
31,2011-12-07,애플 ‘디자인 가이드라인’ 논란.. 네티즌들 “말도 안돼”,https://news.naver.com/main/read.nhn?mode=LSD&mid=shm&sid1=105&oid=014&aid=0002559015,파이낸셜뉴스,"삼성전자와 특허 전쟁을 벌이고 있는 애플이 자사제품의 디자인 침해 방지를 위해 만든 ‘디자인 가이드라인’이 공개돼 논란이 일고 있다.5일(현지시간) IT 전문매체 아이티월드(ITWorld)에 따르면 애플은 최근 삼성전자에게 스마트폰과 태블릿PC의 의장특허를 침해하지 않을 수 있는 디자인 가이드라인을 제시했다.애플이 제시한 가이드라인은 크게 스마트폰과 태블릿PC에 대한 부분으로 나뉘어져 있다.먼저 스마트폰의 경우 ‘앞 화면 부분이 검은색이 아닐 것’, ‘전체 형상이 직육면체가 아니거나 모서리가 둥글지 않을 것’, ‘스크린이 전면 중간에 위치해서는 안되며 모서리 부분의 빈 영역은 상당한 크기를 유지할 것’, ‘전면에 대량의 장식물을 부착할 것’, ‘스피커 그릴을 수평 방향으로 배치하지 말 것’ 등의 항목이 포함되어 있다.태블릿PC의 경우 ‘전체적인 모양이 직사각형이 아니어야 하며, 혹은 모서리가 둥글어서는 안된다’, ‘얇게 만들어서는 안된다, ‘전면부 테두리를 두껍게 만들어야 한다’, ‘복잡하게 만들어야 한다’ 등의 내용이 제시되어 있다.이에 대해 아이티월드는 “가이드라인대로라면 디자인을 하기에 앞서 아예 아무것도 만들 것이 없을 정도”라며 너무나도 현실성이 떨어지는 제안이었다고 지적했다.이를 본 네티즌들 역시 “전체 모양이 사각형이 아닌데, 모서리가 둥글지 않은 물체가 이 세상에 어디 있냐”며 “너무나 터무니 없는, 애플답지 못한 가이드라인”이라고 비난했다.한편 2일(현지시간) 미국 캘리포니아 북부지방법원 루시 고 판사는 애플이 제기한 삼성전자 스마트폰과 태블릿PC 미국 내 판매 금지 가처분 신청을 기각했다. 이에 앞서 지난 달 30일 호주 연방법원도 “애플의 디자인 특허가 원천적으로 무효일 가능성이 있다”며 삼성전자의 손을 들어줬다./kjy1184@fnnews.com 김주연인턴기자■ 오늘의 핫뉴스▶ 이혼녀 40% 원하는 재혼 상대 알아보니..▶ “경유 1L로 111km” 달리는 車 내년 출시▶ [단독] 김연아 전 소속사, 트위터에 김연아 비방글 올려 ‘논란’▶ ‘발렌타인데이’에 이런 선물 받고 싶다▶ 내가 타던 차, 비싸게 파는 방법은?※ 저작권자 ⓒ파이낸셜뉴스. 무단 전재-재배포 금지"
32,2011-12-07,"'탄생 40주년' 이메일, 머지않아 죽을 운명?",https://news.naver.com/main/read.nhn?mode=LSD&mid=shm&sid1=104&oid=047&aid=0001990887,오마이뉴스,"[오마이뉴스 김덕련 기자]▲이메일의 미래를 진단한 <인디펜던트>.ⓒ <인디펜던트>'우리는 이메일의 죽음에 직면한 것일까?'영국 언론 <인디펜던트>가 던진 흥미로운 질문이다. <인디펜던트>는 7일(현지 시각), 단문 메시지 서비스(SMS)와 인스턴트 메시지 서비스가 빠르게 영역을 넓혀가는 상황에서 이메일의 미래가 어떠할지를 진단했다.<인디펜던트>는 먼저 영국의 IT 기업인 아토스(Atos)를 사례로 들었다. 티에리 브레튼(이하 브레튼)은 직원이 7만5000명인 아토스를 이끄는 CEO다. 브레튼은 이메일과 관련해 새로운 방침을 정했다. 18개월 안에 아토스 직원들끼리 업무 시간에 이메일을 주고받는 것을 금지하겠다는 것이다.브레튼은 사내에서 이메일로 소통하는 것이 시간 낭비일 뿐만 아니라 유행에 뒤떨어진 일이라고 불평했다. 또한 아토스 직원들이 하루에 받는 200건의 '전자 메시지' 중 쓸모 있는 것은 10퍼센트에 불과하다고 주장했다. ""정보 홍수는 회사가 (미래에) 맞닥뜨릴 가장 중요한 문제 중 하나일 것이다. (이 문제에 대해) 다르게 생각해야 할 때다.""브레튼은 사내 이메일을 금지하는 대신 직원들에게 인스턴트 메시지 서비스를 쓰게 할 계획이다. 지금은 직원들이 이메일을 처리하는 데 하루에 5~20시간을 쓰지만, 인스턴트 메시지 서비스로 대체하면 그 시간을 20퍼센트는 줄일 수 있을 것이라고 아토스 사측은 보고 있다.""업무 시간에 직원들끼리 이메일 주고받는 것 금지""<인디펜던트>는 브레튼의 이러한 결정이 우리를 미래로 인도하는 것으로 판명된다면, 이메일도 우리가 한때 사랑하다가 나중에 폐기한 커뮤니케이션 도구 목록에 이름을 올리게 될 것이라고 진단했다.또한 10대를 중심으로 한 젊은 층이 이미 브레튼과 같은 전략을 택했다고 보도했다. 윗세대보다 이메일을 덜 활용하고 있다는 말이다. ""올해 12~17세의 이메일 사용이 (지난해에 비해) 31퍼센트 줄었다. 18~24세 집단에서도 21퍼센트 감소했다.""젊은 층은 ""육중한 이메일"" 대신 블랙베리 메신저 같은 모바일 인스턴트 메시지 서비스를 선호하고 있다고 <인디펜던트>는 보도했다. 때때로 읽히지 않은 채 방치되는 이메일과 달리, 인스턴트 메시지 서비스는 직접적으로 그리고 신속하게 메시지를 전할 수 있다는 점이 그 이유로 거론된다. 전 세계의 모바일 인스턴트 메시지 서비스 이용자는 2016년에 13억 명을 넘어설 것으로 예상되고 있다.<인디펜던트>는 이 대목에서 페이스북 메시지를 주목했다. 페이스북 메시지는 페이스북 창립자인 마크 주커버그가 지난해 11월 공개한 새로운 서비스다. 이 서비스의 특징은 문자 메시지, 인스턴트 메시지, 이메일 서비스를 하나로 통합하는 것이다. 페이스북 안에서 이 모든 서비스를 이용할 수 있게 한다는 말이다.당시 주커버그는 이렇게 말했다. ""고등학생들은 이메일을 사용하지 않는다. SMS를 더 많이 사용한다. (……) 사람들은 SMS나 인스턴트 메시지처럼 더 가벼운 것을 원한다."" 그러면서도 주커버그는 페이스북 메시지가 ""이메일 킬러""는 아니라고 이야기했다. 그러나 많은 언론은 페이스북 메시지가 구글을 비롯한 기존 이메일 서비스 제공 회사들에 타격을 줄 것이라고 전망했다.또한 <인디펜던트>는 협업 도구(collaborative tool)로서 이메일을 대체할 가능성이 있는 것으로 야머(Yammer) 같은 기업용 소셜 네트워크 서비스를 꼽았다. 야머를 사용하는 기업은 8만 개가 넘는다.""이메일은 죽여야 할 야수가 아니다""<인디펜던트>는 젊은 층 사이에서 이메일의 인기가 떨어지긴 했지만, 젊은 층도 직장을 잡으면 ""이메일의 89퍼센트를 차지하는 것으로 추정되는 스팸메일""의 덫에 빠진 자신의 모습을 발견하게 될 것이라고 보도했다. 브레튼이 이끄는 아토스와 달리, 여전히 많은 기업에서 이메일을 축으로 업무가 진행되기 때문이라는 것이다. <인디펜던트>에 따르면, 이메일을매달 5만 통이상 보내는 기업의 비율은 40퍼센트(2007년)에서 60퍼센트(2011년)로 늘었다.IT 업계 분석가인 팀 월터스는 ""이메일은 많은 시간을 낭비하게 하며 협업 도구로서는 보잘것없지만, 여전히 노동자의 85퍼센트가 매일 사용하고 있다""고 말했다. 그러면서도 이메일이 ""때때로 가장 적절한 커뮤니케이션 도구""로 작용한다며, ""이메일은 죽여야 할 야수가 아니""라고 말했다.결론적으로, <인디펜던트>는 ""(사람들이) 올해 보낸 이메일이 107조 통 이상일 것""이라며 이메일이 당장 사라질 운명에 처한 것은 아니라고 진단했다. ""이메일이 죽어가고 있다면, 그 죽음은 오랫동안 버티다 종말을 맞이하는"" 형태일 것이라는 분석이다.그러면서도 인스턴트 메시지에 익숙한 세대는 직장에서도 이메일보다 자유롭게 쓸 수 있는 새 커뮤니케이션 도구를 요구할 공산이 크다고 지적했다. 이것이 의미 있는 변수가 될 수 있다는 뜻이다. 이와 관련, 팀 월터스는 사내 이메일을 금지하겠다는 브레튼의 결정은 아토스 노동자들이 젊다는 사실(평균 연령 35세)을 반영하고 있다고 분석했다.탄생 40주년에 죽음 이야기 나오는 이메일올해는 이메일 탄생 40주년이다. 1971년 7월, 아르파넷(미국 국방부가 1969년에 개발한 차세대 통신망으로 인터넷의 기원이다)에 온라인으로 편지를 주고받는 이메일 기능이 도입됐다. 이메일은 그렇게 세상에 첫선을 보였다.그 후 이메일은종이에 쓴 편지와 우체통을 역사의 뒤안길로 밀어냈다. 그러던 이메일이 탄생 40주년에 '죽음'의 가능성이 논의되는 상황을 맞이했다. 물론 '죽음'이라는 표현을, 이메일이 흔적도 없이 사라지는 것을 가리키는 것으로 보기는 어렵다. 이메일이 대세가 된 후에도 종이에 쓴 편지가사라지지 않은 것과 마찬가지다.분명한 건, 사람으로 치면 불혹이 된 이메일의 위상이 예전만 못하며 새롭게 나타난 젊은 서비스들이 치고 올라오고 있다는 것이다.[최근 주요기사]☞ ""디도스 전쟁 터졌는데장수가 뒤로 빠져?""☞ 에 역공 날린 개념판사 ""이젠 쫄지 않는다!""☞ MB 정부, 토건업자에게 다 줬다☞ ""너희가 쳐다보니 오줌을 눌 수가 없잖아""☞ 소개팅 천국...운명의 상대 소개해드립니다오마이뉴스 아이폰 앱 출시! 지금 다운받으세요."
33,2011-12-07,"경기불황에 점집 '북적'‥""불안심리 반영""",https://news.naver.com/main/read.nhn?mode=LSD&mid=shm&sid1=102&oid=214&aid=0000197365,MBC,"[뉴스데스크]◀ＡＮＣ▶경제불황 속 복권열풍 소식， 며칠 전 전해 드렸는데요.이에 못지않게 점집도 많아지고 있다고 합니다.사람들이 느끼는 불안감이 그 만큼 크단 얘기라는데.서하경 기자가 취재했습니다.◀ＶＣＲ▶울산 주택가. 몇 집 건너 꼴로 점집입니다.반경 50미터 안에 있는 점집이 10곳이 넘습니다.◀ＳＹＮ▶ 운세 보러 온 시민""애들 때문에 그렇죠. 아들 때문에... 결혼 문제 때문에...""시내 중심가에도 일명 타로점을 비롯해 각종 운세를 볼 수 있는 곳이 즐비합니다.각종 단체에 소속된 점집만 5백여곳.가입하지 않은 곳을 합하면 울산에서만 1천여곳에 이릅니다.젊은이들이 재미삼아 점을 보기도 하지만 요즘 중장년층의 발길이 이어지고 있습니다.◀ＳＹＮ▶ 운세 보러 온 시민""이 점집이 잘한다고, 그래서 처음 와봤어요. 이번에 새로 시작하는 게 있어서 그냥 한번 보러왔어요.""최근에는 경기불황에 따른 취업문제나 가정불화와 관련해 점을 보는 이들이 특히 많다고 합니다.◀ＩＮＴ▶ 김보살/역술인""가정이 원만 못하니까 모든 게 불안하잖아요. 가정이 화목하고 이러면...""점을 보려는 사람이 늘고 있는데다 원하면 누구나 열수 있기 때문에 전국적으로 우후죽순처럼 점집이 생기고 있습니다.◀ＩＮＴ▶ 박덕순 울산지부장/한국역술인협회""공부는 좀 어려워도 일찍부터 이런 쪽으로 전향하는 사람들이 많은 것 같아요. 남녀노소를 막론하고 누구나...""불확실한 미래를 알고 싶은 사람들 최첨단 시대를 살아가는 현대인의 또 다른 모습입니다.MBC뉴스 서하경입니다.(서하경 기자)[저작권자(c) MBC (www.imnews.com) 무단복제-재배포 금지]"
34,2011-12-07,[현장M출동] 쓰지도 않았는데 연체료? 웅진코웨이의 횡포,https://news.naver.com/main/read.nhn?mode=LSD&mid=shm&sid1=102&oid=214&aid=0000197367,MBC,"[뉴스데스크]◀ＡＮＣ▶한 번 써 본 적 없는 렌탈 제품을 사용했다며 멋대로 통장에서 돈을 빼가고, 심지어 거액의 연체료까지 물리는 황당한 사례가 속출하고 있습니다.국내 렌탈 판매 1위 업체인 웅진 코웨이에서 벌어진 일인데요.어떻게 된 건지 곽승규 기자가 보도합니다.◀ＶＣＲ▶웅진 코웨이가 렌탈, 판매하는 안마의자입니다.가격은 220만원.그런데 이 제품을 한 번 본 적도 없는 한 주부의 통장에서 렌탈비 14만원이 빠져나갔습니다.◀ＩＮＴ▶ 황은주/경기도 평택시""(제품을) 전혀 사지도 않고, 쓰지도 않고. 너무 황당하고 (회사에) 전화했더니 처리해준다고 하면서 전화도 한 번 안하고.""업체 측이 가짜 주소와 있지도 않은 오누이의 서명까지 만들어 계약서를 꾸민 겁니다.또 다른 피해자 이 모 씨.공기청정기를 렌탈하려다 연체료 2백만 원부터 갚으라는 황당한 소리를 들었습니다.◀ＩＮＴ▶ 이 모 씨(피해자)""너무 충격적이죠. 웅진코웨이라는 대기업에서 판매자 관리를 허술하게 해서 명의도용을 함부로...""이런 명의도용 사례는 지난 석 달 동안 150건이 넘습니다.피해자들은 대개 과거 웅진코웨이 제품을 사용했던 고객들.계약을 해지했는데도 회사 측이 고객정보를 계속 갖고 있다가 가짜 계약서를 만드는데 악용한 겁니다.◀ＳＹＮ▶ 웅진코웨이 전 직원""(개인정보를) 메모해놓은 걸 안 버리고 다이어리 같은데 메모해놔요. 개인 다이어리니까 누가 감사 나와도 보는 것도 아니고...""웅진코웨이 측은 일부 판매원들이 실적을 올리려고 이런 잘못을 저질렀다고 말합니다.◀ＩＮＴ▶ 박용호 팀장/웅진코웨이""저희도 이런 부분들이 재발되지 않도록 회사에도 최선을 노력을 다하고 있습니다. 우선적으로 피해자를 보신 고객분들께는 회사에서도 최선을 다해 해결하기 위해 노력하겠습니다.""그러나 내놓은 보상책은 피해를 먼저 확인한 소비자에 한해 원금을 돌려주는 게 전부.자신의 계좌에서 돈이 몰래 빠져나간다는 걸 모르는 사람들에 대해선 실태 파악조차 제대로 하지 않고 있습니다.MBC뉴스 곽승규입니다.(곽승규 기자 heartist@mbc.co.kr)[저작권자(c) MBC (www.imnews.com) 무단복제-재배포 금지]"
35,2011-12-07,"""디도스 공격, 수개월 전 문의""‥계획범죄 가능성",https://news.naver.com/main/read.nhn?mode=LSD&mid=shm&sid1=102&oid=214&aid=0000197360,MBC,"[뉴스데스크]◀ＡＮＣ▶선관위 홈페이지의 디도스 공격을 지시한 공 모씨가 수개월 전부터 디도스 공격에 대해 문의를 했다는 주장이 나왔습니다.경찰 발표와는 달리 계획된 범죄일 가능성이 제기된 겁니다.양효걸 기자가 취재했습니다.◀ＶＣＲ▶필리핀에 있는 강 모 씨가 선관위 홈페이지를 디도스 공격하기 전날 밤.강 씨는 최구식 의원의 비서 공 모 씨의 공격 지시를 받고 난 뒤에 ""알아 보겠다""고 대답한 것으로 알려졌습니다.이 날 전에는 디도스 공격과 관련한 사전 준비는 없었다는 게 경찰 발표.그러나 강 씨 측은 취재진에게 ""공 씨가 수개월 전부터 여러 차례 강 씨를 만나 디도스 공격에 대해 문의했다""고 새로 밝혔습니다.디도스 공격이 사전에 준비됐고 배후가 있을 가능성이 높아지는 대목입니다.이와 함께 경찰은 선거 전 날 공씨와 함께 술을 마신 국회의장 의전비서인 김 모 씨가 선거 당일 아침에만 5차례에 걸쳐 공 씨와 통화한 사실에 주목하고 있습니다.두 사람은 안부 전화였다고 주장합니다.◀ＳＹＮ▶ 국회의장 비서""어제 잘 끝났냐 정도...형님 잘 들어가셨습니까, 뭐 해장은 하셨어요 이런 (대화)...""하지만 전 날 밤 만난 두 사람이 아침에 전화를 5통이나 한 건 상식적으로 납득이 되지 않는다는 게 경찰의 입장,따라서 경찰은 국회의장 비서인 김 씨를 다시 소환해 조사하고 있습니다.한편 한나라당 정두언 의원의 비서 김 모 씨도 국회의장 비서 등과 선거 전날 밤 식사를 했다는 사실을 확인하고 김 씨도 참고인 신분으로 소환 조사할 방침입니다.MBC뉴스 양효걸입니다.(양효걸 기자 amadeus@mbc.co.kr)[저작권자(c) MBC (www.imnews.com) 무단복제-재배포 금지]"
