,날짜,기사 제목,기사 링크,기사 출처,기사 내용
65,2016-07-26,나무 뽑고 울타리 치고…'공원 훼손' 사장 구속,https://news.naver.com/main/read.nhn?mode=LSD&mid=shm&sid1=102&oid=055&aid=0000434260,SBS,"<앵커>자기 땅이라는 이유로 공원에 울타리를 쳐 시민들의 통행을 막고, 1백여 그루의 나무까지 뽑아버린 한 건설사 회장이 구속됐습니다. 공무원들이 아무리 제지를 해도 막무가내로 작업을 강행했다고 합니다.보도에 민경호 기자입니다.<기자>서울가정법원 뒤편에 있는 양재동 말죽거리 근린공원입니다.산비탈 옆으로 주민이 다닐 수 있도록 산책로도 나 있습니다.그런데 산비탈 아래 빌라 근처엔 이렇게 잔디밭이 펼쳐져 있습니다.잔디밭 한쪽엔 3층짜리 고급 빌라가 세워져 있습니다.[이웃 주민 : 개인 주택이야. 옛날에 있던, 옛날에 힘쓰던 사람. (안으로는) 양해를 얻어서 들어가야지.]모 건설사 회장인 A씨가 소유한 빌라와 개인 정원인데, 이 회장은 바로 옆에 있는 공원부지를 올해 초에 사들였습니다.그리고는 공원부지가 자기 땅이라는 이유로 주민이 이용하는 산책로 주변에 울타리를 쳐서 통행을 막고, 그 안에 있던 소나무와 잣나무 1백여 그루를 마음대로 뽑았습니다.정원 한쪽엔 텃밭도 있는데, 원래는 농경이 금지된 곳입니다.서초구청에서 작업 중단을 요구했음에도, 무단으로 경사지를 깎아 땅을 평평하게 하기도 했습니다.회장 측은 ""고사목을 정비하고 축대를 수리하는 과정에서 착오가 있었다""며, 구청과 협의해 원상 복귀할 계획이라고 해명했습니다.하지만 검찰은 관련 법령을 모를 리 없는 건설사 회장이 개발 허가를 받아 땅값을 오르게 하려는 목적으로 마음대로 땅의 형질을 바꾸려 했다며 회장을 구속했습니다.(영상취재 : 공진구, 영상편집 : 유미라)민경호 기자(ho@sbs.co.kr)※ ⓒ SBS & SBS콘텐츠허브 : 무단복제 및 재배포 금지"
66,2016-07-26,"""법에서 정한 대로""…'우병우 감찰' 어디까지 조사할까",https://news.naver.com/main/read.nhn?mode=LSD&mid=shm&sid1=100&oid=437&aid=0000126587,JTBC,"[앵커]시청자 여러분, JTBC 뉴스룸을 시작하겠습니다. 대통령 직속 특별감찰관이 우병우 청와대 민정수석 관련 의혹에 대해서 감찰에 들어갔습니다. 이석수 특별감찰관은 오늘(26일) 기자들과 만나 지난 주말부터 감찰을 시작했다면서 ""법에서 정한대로 조사하겠다""고 말했습니다.[이석수/특별감찰관 : 저에게 부여된 역할에 대해서는 최선을 다해서 일을 하도록 하겠습니다.]특별감찰관은 대통령의 4촌 이내 친족과 청와대 수석비서관 이상의 비위 감찰을 위해서 지난해 3월 임명됐으며 민정수석에 대한 감찰은 이번이 처음입니다.그러나 뒷북 감찰이라는 비판이 야권에서 나오고 있고, 특히 민정수석 임명 이전의 의혹은 법적 조사 대상이 아니라는 것이어서 실효성 논란도 일고 있습니다.[이석수/특별감찰관 : 그 전에 (민정수석 임명 전) 일어난 일이면, 그 전에 일어난 일이 명백하면 그건 감찰 대상이 아니죠.]바로 이런 점들 때문에 이른바 면죄부용 감찰이 아니냐는 비판이 나오고 있는데, 이 점은 잠시 후 상세히 들여다 보겠습니다 .그렇다면 ""법이 정한대로 하겠다""는 특별감찰관이 할 수 있는 일은 대체 어디까지인가, 안나경 앵커가 먼저 짚어주시죠.+++특별감찰관은 대통령과 특수 관계에 있는 사람의 비위 행위를 감찰합니다.이 제도는 지난 2012년 대선 당시 ""대통령 친인척과 측근 비리를 근절하겠다""는 박근혜 대통령의 공약이 모태가 됐습니다.관련 법에 따르면, 감찰 대상은 대통령의 배우자와 4촌 이내 친인척, 대통령비서실의 수석비서관 이상 공무원입니다.그런데 이들의 모든 비위 행위를 들여다 보는 건 아닙니다.친인척의 경우 대통령이 취임한 이후, 수석 비서관은 그 자리에 임명된 뒤에 저지른 비위 행위만 감찰 대상이 됩니다.감찰 기준이 되는 비위 행위는 다섯 가지입니다.먼저 차명으로 계약을 하거나 알선, 중개 등 개입하는 일입니다.공기업이나 공직 유관단체와 수의계약을 하는 경우도 해당됩니다.부정한 인사청탁, 금품·향응 수수, 공금 횡령이나 유용 등도 모두 감찰 대상입니다.감찰은 착수한 뒤 한 달 내에 마쳐야 하고, 필요한 경우 대통령의 허가를 받아서 1개월 단위로 기간을 연장할 수 있습니다.우병우 청와대 민정수석은 2014년 특별감찰관제가 도입된 이후 첫번째 특별감찰 대상이 됐습니다.핵심 쟁점들이 민정 수석 임명 전에 일어난 일들이어서 감찰 실효성을 둘러싸고논란이 일고 있습니다.손석희▶ JTBC 뉴스 공식 SNS[트위터][페이스북][유튜브]Copyright by JTBC(http://jtbc.joins.com)and JTBC Content Hub Co., Ltd. All Rights Reserved. 무단 전재 및 재배포 금지"
67,2016-07-26, 제약사·의사 리베이트 감싸려…사기꾼 된 '영업맨의 비애',https://news.naver.com/main/read.nhn?mode=LSD&mid=shm&sid1=102&oid=022&aid=0003080513,세계일보,"우여곡절 끝에 누명 벗은 40대 영업사원 / 2012년 검찰수사 본격화하자 회사 대표·병원장 피해 막으려 “준 돈 일부 개인 사용” 허위 자백'“피고인은 무죄.”지난달 30일 오전 10시 서울남부지법 306호 법정. 판사의 주문이 나오자 피고인석에 선 제약업체 영업사원 A(40)씨가 숙였던 고개를 들어 짧은 한숨을 뱉었다. 고객의 잘못을 감싸려고 허위자백을 해 형사처벌을 받은 A씨가 2년여 만에 열린 재심 재판에서 ‘스스로 쓴 누명’을 벗는 순간이었다.제약업계 매출 규모 10위권인 Y사 11년차 영업사원의 우여곡절은 2012년으로 거슬러 올라간다.제약업체와 의사 간 불법 리베이트에 대한 검찰 수사가 본격화한 시기다. 같은 해 7월 말 회사 대표 유모씨가 리베이트 명목으로 16억여원을 여러 병원에 지급한 혐의로 기소되면서 이 회사 영업사원들에 대한 검찰 수사가 광범위하게 진행됐다. 특히 회사에서 리베이트 명목으로 영업사원 측 계좌로 건너간 돈의 종착지가 최대 관심사였다.A씨는 회사가 자신의 누나와 지인 명의 통장으로 각각 1200만원과 500만원을 입금한 사실이 확인되자 검찰 조사에서 ‘모두 리베이트 목적으로 썼다’는 취지로 진술했다. 그러나 어찌된 영문인지 한 달이 채 안 돼 ‘전체 금액 중 300만원만 병원에 전달하고 나머지 1400만원은 개인 용도로 썼다’고 말을 바꿨다. 또 애초 회사에 보고했던 ‘서울 서초구 소재 여성전문 병원장 박모씨와 강남구 소재 비뇨기과 원장 정모씨에 돈을 건넸다’는 내용도 허위 보고라고 자백했다. 회사를 상대로 사기를 쳤다는 것이다.결국 사기 혐의로 기소된 A씨는 같은 해 10월 동료 영업사원 9명과 함께 벌금형의 약식명령을 받았다. 이에 참다 못한 A씨는 이듬해 ‘고객인 의사를 보호하기 위해 허위진술을 하고 처벌받은 게 억울하다’는 생각에 법원에 재심을 청구했다. 함께 형사처벌을 받은 동료 중 한 명이 약식명령에 대해 정식재판을 청구해 무죄를 받은 영향도 컸다.재심을 청구한 지 2년여가 지난 지난해 10월 법원은 재심 개시를 결정했다. 사기 혐의의 결정적 증거인 A씨 자백이 허위일 가능성이 받아들여진 결과다. 재심 재판에 증인으로 나온 Y사 B상무는 “매출액과 연동해 볼 때 (A씨가) 리베이트를 의사에 실제 지급했을 수 있다”고 증언했다. B상무가 다른 재판에서 “영업사원들이 편취 범행을 자발적으로 인정한 것은 ‘리베이트를 줬다’고 하면 거래처 원장이 조사를 받을 수 있기 때문이었다”고 한 증언도 법원의 무죄 선고에 결정적 역할을 했다.누명을 벗은 A씨는 홀가분할 법도 했지만 회사가 또다시 불법 리베이트 혐의로 된서리를 맞으면서 맘이 편치 못하다.클릭하면 큰 그림으로 볼 수 있습니다.최근 경찰 수사를 받은 Y사는 영업사원과 의사 간 극단적인 갑을관계를 보여주는 이른바 ‘감성영업’을 한 것으로 드러나 사회적 논란이 됐다.이 업체 직원은 거래 병원 의사를 상대로 빵 배달이나 고장 난 수도꼭지 수리, 형광등 갈기, 어항 관리, 의사 가족 픽업 등 마치 ‘머슴’처럼 온갖 허드렛일까지 도맡아 처리했다고 한다.제약업계의 한 관계자는 26일 “‘절대 갑’인 의사에 대한 굴종적 태도가 영업사원의 기본 자질로 요구되는 게 이 바닥의 현실”이라며 “오죽했으면 A씨가 죄까지 대신 짊어지려고 했겠느냐”고 지적했다.김승환 기자 hwan@segye.comⓒ 세상을 보는 눈, 글로벌 미디어세계일보"
68,2016-07-26,경찰 왜 이러나? 이번엔 범인에 '수사정보 유출',https://news.naver.com/main/read.nhn?mode=LSD&mid=shm&sid1=102&oid=214&aid=0000650754,MBC,"[뉴스데스크]◀ 앵커 ▶최근 경찰관들의 범죄소식이 잇따랐죠.몰카촬영에 성추행에 여고생과의 성관계까지.그런데 이번엔 보이스피싱 일당에게 미리 수사상황을 알려주고 돈과 성접대를 받은 경찰관들이 적발됐습니다.정동훈 기자가 취재했습니다.◀ 리포트 ▶서울경찰청 광역수사대 소속 경위는 올해 초 한 보이스피싱 조직원에게서 현금 5백만 원을 받았습니다.서초경찰서에 근무하는 다른 경위 역시 같은 조직원에게서 3백만 원 금품과 성접대를 받았습니다.조직 총책에 대한 수사상황과 수배 여부를 알려준 대가였습니다.[강종헌/수원지검 강력부장]""보이스피싱 수사상황이라든가 이 총책도 수사대상이 돼 있는지, 그런 것을 알아봐 달라 하니까 알아봐 준 겁니다.""뒷거래는 총책이 구속되면서 들통났습니다.총책이 자신을 면회 온 조직원에게 '돈까지 줬는데 왜 구속됐냐'고 따지자 조직원이 현직 경찰이름을 수차례 언급하는 걸 수상히 여긴 검찰에 꼬리가 잡힌 겁니다.[면회 당시 녹음내용/ 3월 12일](OO한테 (준 돈) 받아야 하는 거 아니냐…)""OO형 만나서 XXX을 했습니다. '형님. 이거 어떻게 된 거냐'고…""인천의 현직경찰이 불법오락실 업주에게 통째 넘긴 수사보고서입니다.단속된 불법오락실에 대한 수사 진행상황은 물론, 환전 영업장부, 압수물품 목록 등이 자세하게 기록돼 있습니다.인천경찰청 소속 경장이 자신이 작성한 23페이지 분량의 이 보고서를 불법오락실을 운영하는 고교 동창생에게 넘긴 겁니다.[구도훈/인천경찰청 수사2계장]""서류를 준 것은 인정했습니다. 그렇지만, '불법영업에 사용될 거라고 생각하지는 않았다'(고 진술했습니다.)""앞서 인천의 또 다른 경위는 불법오락실 업주에게 경찰 단속차량과 단속 직원들의 개인차량 번호를 알려줬다가 구속되기도 했습니다.MBC뉴스 정동훈입니다.정동훈기자 (jdh@mbc.co.kr)[저작권자(c) MBC (www.imnews.com) 무단복제-재배포 금지]Copyright(c) Since 1996,MBC&iMBCAll rights reserved."
69,2016-07-26,주요기업 2분기 실적 발표…영업이익 '우울',https://news.naver.com/main/read.nhn?mode=LSD&mid=shm&sid1=101&oid=056&aid=0010343827,KBS,"<앵커 멘트>주요 대기업들의 2분기 실적이 잇따라 발표되고 있습니다.현대차와 SK 하이닉스의 상반기 실적이 하락했고, 주력 산업 중에선 정유·석유화학 업체들은 좋은 실적을 기록했지만 조선 업계는 부진이 예상됩니다.보도에 지형철 기자입니다.<리포트>현대차의 올해 상반기 영업이익이 신흥시장의 수요 부진 등 영향으로 지난해보다 하락했습니다.현대차의 상반기 매출은 47조 273억 원으로 전년 동기와 비교해 7.5% 증가했으나 영업이익은 7.0% 감소했습니다.다만 2분기만 보면 영업 이익이 지난해보다 0.6% 늘어 9분기 만에 상승세로 전환했습니다.상반기 판매는 지난해와 비교해 국내는 4.4% 증가했지만  해외시장에서는 1.8% 감소해 전체적으론 0.9% 줄었습니다.현대차는 브렉시트가 가져온 불확실성으로 하반기도 어려움이 예상되지만 SUV와 대형세단, 각종 친환경 차를 내세워 대응하겠다고 밝혔습니다.<인터뷰> 김준명(현대·기아차 홍보실 차장) : ""전세계적으로 수요가 증가하고 있는 SUV차량들의 공급을 확대하고 고급 브랜드의 글로벌 시장 출시를 본격화해 새로운 성장동력을 확보하는...""SK하이닉스는  2분기 매출이  지난해보다 15%, 영업이익은 67%나 급락했습니다.D램 가격하락이 이어지며 영업이익이 줄어 분기 기준으로 2013년 1분기 이후 13분기만에 가장 적은 수준을 기록했습니다.반면  정유, 석유화학업체인 SK이노베이션과 에쓰오일 LG화학은 잇따라 좋은 실적을 내놓고 있습니다.그러나 실적 발표가 임박한 조선업계의 경우 구조조정과 수주절벽의 여파로 대형 3사 모두 2분기 영업이익이 기대를 밑돌 것으로 관측되고 있습니다.KBS 뉴스 지형철입니다.지형철기자 (ican@kbs.co.kr)▶ [저작권자ⓒ KBS 무단복제-재배포 금지]"
70,2016-07-26,ARF 외교장관회의 시작…의장성명 북핵·사드 포함 '촉각',https://news.naver.com/main/read.nhn?mode=LSD&mid=shm&sid1=100&oid=003&aid=0007372744,뉴시스,"【티엔티안=AP/뉴시스】기시다 후미오 일본 외상(왼쪽)과 왕이 중국 외교부장이 26일 라오스 비엔티안에서 열린 아세안 외교장관회의에서 나란히 앉아있다.  2016.07.26북핵 규탄 문안 채택 외교전 총력사드 우려 포함될 가능성 배제 못해【서울=뉴시스】김지훈 기자 = 북한이 참여하는 유일한 지역 다자안보협의체 아세안지역안보포럼(ARF) 외교장관회의가 26일 오후(현지시간) 라오스 비엔티안에서 시작됐다.이번 ARF 회의의 주요 의제는 북핵 문제와 남중국해 문제다. 여기에 최근 주한미군 사드(THAAD·고고도미사일방어체계) 배치 결정에 따른 중국과 러시아의 반발도 더해질 전망이다.【서울=뉴시스】윤병세 외교부 장관이 25일(현지시각) 라오스 비엔티안에서 존 케리 미 국무장관과 ARF 등 ASEAN 관련 외교장관회의 계기 회담을 한 뒤 악수하고 있다.   이날 회담에서는 북핵·북한 문제, 한·미 동맹 현안, 지역·글로벌 문제 등에 대해 논의됐다. 2016.07.26. (사진=외교부 제공)   photo@newsis.com이에 따라 북핵 6자회담 당사국인 한국, 미국, 일본, 중국, 러시아, 북한을 포함한 27개 참가국이 ARF 의장성명에 들어갈 문안을 놓고 막바지 치열한 신경전을 벌일 것으로 예상된다.현재 한국 측의 전망은 그리 밝지 않다. 기본적으로 ARF에서는 북한을 포함한 모든 나라에 발언권이 주어지고, 의장성명은 각국의 의견을 최대한 수용하는 방식이다. 한두 나라라도 반대를 하면 통과가 쉽지 않은 '합의'의 의사결정 시스템이다.예컨대 한국을 포함한 주요 회원국들이 북한의 핵실험과 연이은 탄도미사일 시험발사를 규탄하는 문안을 채택하자고 하더라도 북한이 강렬하게 반대하면 일방적으로 문안을 채택하기 쉽지 않다. 게다가 통상적으로 문안채택에 있어 의장국에 재량권이 주어지는데, 올해 의장국은 북한의 전통적 우방국인 라오스다.이번 회의에 앞서 ""라오스가 취하고있는 한반도 정책, 대외정책 등을 보면 의장성명에 북한 규탄 문안을 넣는 데 큰 어려움이 있을 것으로 예상된다""는 우려가 나왔던 것도 이러한 이유 때문이다.그럼에도 우리 정부는 지난 24일부터 시작된 아세안(ASEAN) 관련 연쇄 외교장관회의에서 북핵 문제에서만큼은 강력한 제재가 필요하다는 공감대를 확인, 이번 의장성명에 북핵 규탄 문안을 넣겠다는 전략을 세운 것으로 알려졌다.【비엔티안=AP/뉴시스】리용호 북한 외무상이 25일(현지시간) 라오스 비엔티안에서 열린 중국 왕이 외교부장과의 동남아시아국가연합 회의에 참석하기 위해 군인과 경호원에 둘러싸여 이동하고 있다. 2016.07.25.의장성명에 한반도 사드 배치에 대한 주변국들의 우려를 넣으려는 움직임이 있다는 관측에 관해서는 ""참가국간 협의 중인 사안인 만큼 언급하는 것이 적절하지 않다""며 말을 아끼고 있다.하지만 정부는 이번 ARF 회의에서 사드가 제3국을 겨냥하지 않고 오직 북한의 핵·미사일 위협을 방어하기 위해 사용될 거라는 점을 강조하며 주변국들의 이해를 구할 것으로 예상된다.남중국해 문제도 이번 의장성명 채택에 큰 변수로 작용할 전망이다. 중국이 남중국해 구단선에 대한 중재재판소의 무효 판결을 수용하지 않겠다고 밝힌 데 대해 미국, 일본 필리핀 등이 강경한 입장을 보이고 있어 이번 ARF 회의에서 이에 대한 공방도 치열할 것으로 예상된다.여러 현안이 복잡하게 얽혀 있는 만큼 올해 ARF 의장성명 채택에는 상당한 시간이 걸릴 거라는 전망이다. 문안 채택 여부를 놓고 의견이 첨예하게 대립될 경우 절충에 시간이 필요해 통상적으로 회의 당일에 채택되는 것은 불가능하다. 지난해에는 회의 종료 후 나흘 만에 의장 성명이 채택됐다. 다만 지난 2012년 때와 같이 의장성명 채택에 실패할 가능성은 크지 않을 거라는 전망이다.jikime@newsis.com뉴시스 뉴스, 네이버 뉴스 스탠드에서도 만나세요뉴시스 SNS[페이스북][트위터]<저작권자ⓒ 공감언론 뉴시스통신사. 무단전재-재배포 금지.>"
71,2016-07-26,"""포켓몬 고 캐릭터 무단사용했다간 민·형사 처벌""",https://news.naver.com/main/read.nhn?mode=LSD&mid=shm&sid1=105&oid=030&aid=0002507454,전자신문,"`포켓몬 고` 열풍이 불면서 포켓몬스터 캐릭터 무단사용 주의보가 내려졌다.한국저작권위원회는 26일 증강현실(AR) 기술을 활용한 `포켓몬 고` 게임이 인기를 끌면서 포켓몬스터 캐릭터를 마케팅 수단으로 이용하려는 지자체나 기업 등에 저작권 침해 주의를 당부했다.위원회는 지난 한 주 저작권상담센터에 △포켓몬 고 패러디 영상으로 기업을 홍보해도 되는지 △포켓볼 이미지만 이용하면 문제가 없는지 △지자체에서 홍보목적으로 캐릭터를 이용해도 되는지 △캐릭터를 매장에 부착하거나 피켓을 제작해 세워놓아도 되는지 등의 문의가 집중됐다고 밝혔다.위원회 관계자는 “상담자 대부분은 비영리 목적이면 문제되지 않는다거나 영세한 사업장에서 소규모로 이용하면 저작권자도 잘 모를 것이라는 인식을 갖고 있었다”며 “돈을 받고 물건을 판매하는 것이 아니더라도 기업을 홍보하는 행위 자체에는 영리 목적이 있고 영세한 사업장에서 소규모로 이용하더라도 발각될 위험은 항상 존재한다”고 강조했다.포켓몬스터는 휴대형 게임기용 게임·애니메이션·카드 게임 등 다양한 콘텐츠로 제작돼 권리관계가 다소 복잡하지만 기본적인 저작권은 닌텐도·크리쳐·게임프리크가 공동으로 소유하고 있는 것으로 알려졌다.외국 저작물은 172개 국가가 가입한 `문학 및 예술 저작물의 보호를 위한 베른협약` 등 각종 저작권 관련 국제협약에 따라 국내에서 보호되고 있다. 베른협약은 내국민 대우(모든 회원국은 다른 회원국 국민의 저작물을 자국민 저작물과 동일하게 보호해야 한다는 원칙)를 원칙으로 하고 있다. 우리나라와 일본은 1996년과 1899년 각각 베른협약에 가입했다. 일본 포켓몬스터 캐릭터를 홍보 등의 목적으로 무단 이용하면 저작권 침해에 따른 민·형사상 법적 책임을 져야한다.포켓몬고위원회 저작권상담센터 관계자는 “지자체·기업 등이 포켓몬스터 캐릭터를 홍보나 마케팅 등의 목적으로 이용할 때는 반드시 해당 저작권자의 사전 허락을 받는 것이 중요하며 비영리 목적으로 이용할 때도 공정 이용에서 벗어난 이용이 될 수 있으므로 신중해야 한다”고 밝혔다.주문정 산업경제(세종) 전문기자 mjjoo@etnews.com▶ 전자신문 공식 페이스북▶ 전자신문 바로가기[Copyright ⓒ 전자신문 & 전자신문인터넷, 무단전재 및 재배포 금지]"
72,2016-07-26,"여행, 짧게 여러 번 갔다 오는 게 더 행복?",https://news.naver.com/main/read.nhn?mode=LSD&mid=shm&sid1=103&oid=296&aid=0000028100,코메디닷컴,"아내와 아이들 등살에 휴가까지 내며 울며 겨자 먹기 식으로 여행을 다녀온 남편은 만족감을 전혀 느낄 수 없다는 연구결과가 있다. 휴가 때 '푹 쉬었다'는 느낌이 들 때에만 여행을 다녀온 후 행복감이 보름 정도 지속되는 것으로 나타났다.네덜란드 브레다대학교 제런 나빈 교수팀은 성인 1500여명을 대상으로 휴가 중 여행에서 느끼는 기분에 따라 휴가 뒤 행복감이 얼마나 지속되는지 조사했다. 이들 중 974명은 연구기간 32주 동안 휴가를 다녀왔다.연구결과, 여행을 가서 푹 쉬고 온 것으로 응답한 사람은 휴가를 다녀와서 얻은 행복감이 약 2주 동안 지속되는 것으로 드러났다. 반면 여행 중 '쉬다왔다', '그저 그랬다', '스트레스를 받았다'고 응답한 사람은 휴가를 다녀와도 전혀 행복해하지 않았다.휴가 중에 푹 쉬지 못한 이들의 행복지수는 아예 휴가를 다녀오지 않은 사람과 비교해도 전혀 오르지 않았다. 무리한 여행은 안 간 것보다 나을 것이 없는 것으로 나타난 셈이다.연구팀은 휴가를 다녀와도 행복감을 갖지 못하는 이유를 △파일이 산더미처럼 쌓여있는 직장으로 돌아가야 한다는 스트레스 △여행 자체가 스트레스인 사람 △전혀 동의하지 않고 가게 된 여행 △여행 중 아파서 △사전에 여행 계획을 충분히 수립하지 않았기 때문 등으로 분석했다.나빈 교수는 “휴가에 대한 기대는 행복감을 8주 간 상승시키는 효과가 있다”며 “여행 전 자신에게 맞는 계획을 세우고 휴가를 한 번에 오래 다녀오는 것보다 짧게 여러 번 다녀오는 게 행복감을 가장 높인다”고 밝혔다. 이런 내용은 영국 일간 텔레그래프 등에 실렸다.권순일 기자  (kstt77@kormedi.com)저작권ⓒ  '건강을 위한 정직한 지식' 코메디닷컴(kormedi.com) / 무단전재-재배포 금지"
