,날짜,기사 제목,기사 링크,기사 출처,기사 내용
136,2016-07-26,"코스피 2,027로 '연중 최고'…외인 14거래일째 '사자'",https://news.naver.com/main/read.nhn?mode=LSD&mid=shm&sid1=101&oid=001&aid=0008566697,연합뉴스,"코스피 상승세로 마감    (서울=연합뉴스) 정하종 기자 = 코스피가 15.02포인트 오른 2,027.34로 장을 마감해 종가 기준 연중 최고치를 기록한 26일 오후 서울 중구 KEB 하나은행 본점 딜링룸에서 딜러들이 업무를 보고 있다. 원·달러 환율은 2.1원 오른 1,134.9원으로 장을 종료했다. chc@yna.co.kr(서울=연합뉴스) 임수정 기자 = 코스피가 26일 종가 기준 연중 최고치를 경신했다.외국인 투자자의 14거래일 연속 순매수 행진 영향이 컸다.이날 코스피는 전날보다 15.02포인트(0.75%) 오른 2,027.34에 장을 마쳤다.종전 연중 최고치(종가 기준)는 지난 6월 8일의 2,027.08이었다.지수는 2.92포인트(0.15%) 내린 2,009.40으로 출발한 뒤 외국인의 '사자'와 기관의 '팔자'가 맞붙으며 보합 흐름을 보이는 듯했으나 외국인 매수세가 이어지면서 결국 2,020선을 뚫고 올랐다.코스피는 각국의 통화완화 정책 기대감 및 위험자산 선호 심리에 힘입어 지난 13일부터 2,000선 위에서 움직임을 이어가고 있다.김성환 부국증권 연구원은 ""주요국 중앙은행 간 정책 결속력이 강화되는 흐름""이라며 ""통화완화 기조에 따른 풍부한 유동성 환경을 바탕으로 위험 선호 국면이 이어질 것""이라고 말했다.다만, 높아진 지수 수준이 다소 부담이다.최근 코스피 랠리에 투신권을 중심으로 한 기관의 차익실현성 매도 강도가 강화되면서 코스피는 지난 19일부터 22일까지 약보합 흐름을 지속하기도 했다.미국 연방준비제도(Fed·연준)의 7월 연방공개시장위원회(FOMC), 일본은행(BOJ)의 금융정책결정회의 등 글로벌 빅 이벤트를 앞두고 시장 경계심리가 더 커질 수도 있다.고승희 미래에셋대우 연구원은 ""미국 금리인상 우려가 재차 부각되는 가운데 차익실현 매물이 출회할 수 있다""며 ""완만한 상승세는 이어지겠지만 속도 조절이 나타날 수 있음을 염두에 둬야 한다""고 지적했다.이날 유가증권시장에서 외국인은 1천889억원어치를 사들이며 14거래일째 순매수 행진을 이어나갔다.기관은 56억원어치를 팔았다. 금융투자에서 1천113억원어치를 사들이며 매도 규모를 제한했다.개인은 1천759억원어치를 순매도했다.프로그램매매를 통해서는 136억원어치가 순매수됐다.코스피 전체 거래대금은 3조9천264억원, 전체 거래량은 3억3천221만주로 집계됐다.업종별로는 기계(2.08%), 의료정밀(1.47%), 전기·전자(1.40%), 전기가스업(1.40%), 의약품(1.32%) 등 대체로 오름세를 보였다. 다만 운수창고(-0.26%), 보험(-0.23%), 종이·목재(-0.06%) 등은 소폭 내렸다.시가총액 상위주도 대부분 상승 마감했다.대장주 삼성전자는 전날보다 2만8천원(1.86%) 오른 153만원에 장을 마감하며 사흘 만에 상승 전환했다.시장 기대치를 웃도는 실적을 발표한 현대차가 0.37% 상승했고 한국전력(1.30%), 삼성물산(1.50%), 삼성생명(0.20%), 포스코(2.02%) 등도 강세였다.SK하이닉스는 올해 2분기 실적 부진 영향으로 1.38% 하락 마감했다.호텔신라(-0.80%)도 수익성 둔화로 장중 한때 52주 신저가(6만300원)까지 떨어졌다.이밖에 신세계인터내셔날은 하반기 턴어라운드가 기대된다는 분석에 힘입어 8.42% 급등했고 롯데하이마트도 저평가 분석에 6.09% 상승했다.코스닥지수는 전날보다 0.44포인트(0.06%) 오른 705.40에 장을 마치며 사흘 만에 상승했다.지수는 0.84포인트(0.12%) 오른 705.80으로 출발한 뒤 한동안 약보합권에 머무르다 오후 들어 방향을 바꿨다.코스닥시장에서는 개인과 외국인이 각각 504억원과 219억원어치를 사들였다. 기관만 506억원어치를 팔았다.코스닥 거래대금은 3조5천822억원이고 거래량은 9억9천488만주로 집계됐다.코스닥시장에서 인터파크는 해킹으로 고객정보가 대량 유출돼 경찰이 수사에 나섰다는 소식에 5.77% 하락했다. 장중 한때 1만4천600원까지 내려 52주 신저가를 새로 썼다.인터파크홀딩스는 0.83% 내렸다.세라믹 소재 전문기업 쎄노텍은 합병 상장 이틀째인 이날 11.82% 내려 전날의 급락세를 이어갔다.코넥스시장에서는 모두 101개 종목의 거래가 체결됐으며 거래대금은 총 36억원 수준이었다.서울 외환시장에서 원/달러 환율은 전날보다 달러당 2.1원 내린 1,134.9원에 장을 마쳤다.sj9974@yna.co.kr"
137,2016-07-26,IS 2년 29개국 테러·2043명 사망…'소프트타깃' 누구든 위험,https://news.naver.com/main/read.nhn?mode=LSD&mid=shm&sid1=104&oid=016&aid=0001089384,헤럴드경제,"2년간 143차례 테러 자행음악축제장·공항·음식점…장소 불문 테러의 희생자로외로운 늑대들 합류 줄이어지구촌 안전지대 갈수록 없어져지난 24일 밤(현지시간) 독일 바이에른주 안스바흐 야외 음악축제장을 노렸다가 입장이 불허돼 주변 와인바 밖에서 자폭 공격을 감행한 27세 시리아인은 범행 전 ‘이슬람국가’(IS) 앞에 충성을 맹세하며 보복공격의 실행을 다짐한 것으로 드러났다. 독일에서 IS와 직접 연결된 자폭테러가 일어나기는 이번이 처음이다. 유럽에서 그나마 유일하게 ‘테러 청정지역’으로 꼽혔던 독일 마저 테러가 일상이 될 수 있다는 것이다.IS가 2014년 6월 29일 국가 수립을 선포한 후 꼭 2년이 지났다. IS는 지난 2년간 활동 거점인 이라크와 시리아를 제외한 전 세계 29개 나라에서 총 143차례에 달하는 테러를 자행했다. 이 과정에서 살해 당한 시민만 2043명에 달한다. 그야말로 테러의 공포와 함께 먹고 자고 생활하는 ‘테러의 뉴노멀’에는 사실상 국경도 없어진 셈이다.25일 CNN에 따르면 테러의 화약고로 돌변한 유럽에선 총 18차례 테러가 발생했다.전날 밤 독일 바이에른주 안스바흐 야외 음악축제장에서의 자폭테러와 관련, 요하임 헤르만 독일 내무장관은 “영상에 나오는 아랍어를 번역한 결과 자폭범은 잘알려진 IS 리더에게 독일이 이슬람의 가는 길을 막아서고 있으므로 알라의 이름으로 독일에 대한 보복 행위를 다짐하는 것으로 돼 있다”면서 “이슬람 배경의 테러 공격임을 의심할 여지가 없다고 본다”고 말했다. 이번 테러가 IS와 연관이 있다는 것이다. 특히 독일에서 정치적 목적이나 신념을 주장하면서 IS와 직접 연결된 테러가 발생하기는 이번이 처음이어서 독일 사회에 큰 충격을 주고 있다.테러가 빈발한 프랑스와 국경을 맞대고도 그간 테러에서 벗어나 있었던 독일까지 공격 당하자 앞으로도 예기치 못한 곳에서 끊임없이 테러 희생자가 발생할 수 있다는 두려움이 일고 있다. IS 출현 이후 발생한 테러들도 재조명 받고 있다.프랑스가 최대 피해국이다. 지난해 11월에는 대량 살상무기와 폭탄 등으로 무장한 테러 집단이 축구장, 콘서트 홀 등 파리의 여섯 군데서 저지른 동시 다발 테러로 130명이 사망하고 350명이 다쳤다.휴양지 니스에선 이달 14일 프랑스와 튀니지 이중 국적자인 용의자가 트럭으로 해변 거리에서 질주해 84명의 목숨을 앗아갔다. 프랑스 당국은 몇 달간 치밀한 사전 조사 끝에 이뤄진 범행이라면서 IS의 영향을 받은 외로운 늑대의 테러로 보고 있다. IS 역시 “우리 병사의 소행”이라며 배후를 자처했다.지난 3월 벨기에 브뤼셀에서도 테러가 발생해 32명이 사망하고 300여명이 다쳤다.북미 지역에서는 스스로 급진화된 외로운 늑대들이 활개를 쳤다. 가장 치명적인 사건은 올해 6월 올랜도 참사와 지난해 12월 샌버너디노 총기 테러다. IS와 알카에다에 영향을 받은 용의자들은 각각 플로리다 주 올랜도의 게이 나이트클럽, 캘리포니아 주 샌버너디노 보건 시설에서 총기를 난사해 49명, 14명을 살해했다. 샌버너디노 총기 테러는 화기와 폭약 등을 활용해 알카에다나 IS에 경도된 능숙한 총기 사용자들이 미국 본토에서 자행한 첫 테러였다.아시아도 안전 지대는 아니었다. 이달 1∼2일 방글라데시 수도 다카의 외국공관 밀집지역 음식점에서는 무장괴한의 인질극으로 외국인 20명이 사망했다. IS는 이 사건의 배후를 자임했다. IS는 23일에도 아프가니스탄의 수도 카불에서 자폭테러를 감행해 80명을 살해했다.IS의 직접 테러에 가장 쉽게 노출되는 중동과 북아프리카 지역에서는 82건의 테러가 발생했다.테러 건수와 희생자의 수뿐만 아니라 IS의 세력 ‘확산 추세’에 대한 우려가 높다. CNN은 IS의 파급력이 진앙인 이라크와 시리아를 벗어나 전 세계로 확산하는 추세인 것만은 분명하다고 지적했다. 이는 IS 동조자가 세계 곳곳에서 늘어나고 있다는 의미인데다 현재까지 테러에 희생되지 않은 곳도 언제든 피해 지역이 될 수 있음을 시사한다. 한 지역에 집중돼 있지 않은 만큼 소탕도 갈수록 어려워진다.특히 무장하지 않은 일반 시민들을 노린 ‘소프트타깃’ 공격이 주를 이루면서 대테러 당국의 고심은 깊어지고 있다. 최근 주요 테러 들은 공연장이나 축제, 상업 중심지 등 일반인들이 대거 모이는 곳을 겨냥해 이뤄졌다. 테러범에게 대항할 수 있는 세력도 없고, 희생자 규모는 크고, 테러 이후 누구든 희생자가 될 수 있다는 두려움이 빠르게 확산되면서 테러범들이 원하는 결과를 모두 얻어갈 수 있는 수법이다.이에 따라 대응에 나서되 테러 위협을 뉴노멀로 받아들여야 한다는 목소리가 나온다. 니스 테러 후 마뉘엘 발스 프랑스 총리는 “프랑스는 테러리즘과 함께 살 수밖에 없다”고 말했다. 프랑스는 파리 테러 이후 국가 비상 사태 상황에서도 테러를 막는 데 실패했다. 프랑스 국민들 사이에서도 가능한 조치를 모두 취해도 테러를 완전히 막을 수 없다는 인식에 무게가 실리고 있다.이수민기자/smstory@heraldcorp.com- Copyrights ⓒ 헤럴드경제 & heraldbiz.com, 무단 전재 및 재배포 금지 -"
138,2016-07-26,"""北, 테러조 10여개 中·동남아에 파견…김정은 직접 지시""",https://news.naver.com/main/read.nhn?mode=LSD&mid=shm&sid1=100&oid=001&aid=0008566663,연합뉴스,"권총사격 지켜보는 北 김정은김정은 북한 국방위원회 제1위원장이 2013년 3월 23일 오중흡7련대칭호를 수여받은 조선인민군 제1973군부대관하 2대대를 시찰했다고 조선중앙통신이 같은 해 3월 24일 보도했다.     제1973군부대는 평안남도 지역에 있는 11군단(舊 경보교도지도국·일명 '폭풍군단') 산하 특수부대로 추정되며 이 부대는 서울 침투 등 후방교란 임무를 맡은 것으로 알려졌다.  사진은 김 제1위원장이 한 대대 지휘관의 권총 사격을 지켜보는 모습.  [조선중앙통신 = 연합뉴스 자료사진]대북소식통 ""중국내 북한식당 종업원 집단탈출 후 김정은 보복테러 명령""정찰총국, '명령시 즉시 실행할 준비' 지시…재외 한국공관ㆍ한인회도 대상외교부 ""中·동남아 재외공관에 우리국민 신변안전 강화 지시""…선교단체 대상 간담회(서울=연합뉴스) 이귀원 김호준 기자 = 북한의 정찰총국을 비롯한 대남 공작기관들이 해외를 방문하는 우리나라 국민을 상대로 한 테러를 준비하기 위해 중국과 동남아 등지에 10여 개 테러 실행조를 파견한 것으로 26일 알려졌다.북한 공작기관의 이 같은 테러조 파견은 중국내 북한 식당 종업원 13명의 집단탈출 이후 보복테러를 감행하라는 김정은 노동당 위원장의 지시에 따른 것으로 전해졌다.북한 사정에 밝은 대북 소식통은 ""김정은은 (북한식당 종업원) 집단탈북 사건과 관련 '백배천배의 보복'을 지시했고, 최근 미국의 인권제재 리스트에 자신이 등재된 것에 대해 노발대발했다""며 ""이에 따라 북한 공작기관들은 한국에 대한 보복 테러로 김정은에 대한 충성심을 보여주기 위해 구체적인 테러계획을 검토하고 있는 것으로 안다""고 밝혔다.이 소식통은 ""현재 북한 공작기관들은 10개 이상의 테러조를 중국 단둥ㆍ선양 등지에 파견해 테러활동을 경쟁적으로 독려하고 있다""며 ""지난 4월 말 중국 장백현에서 발생한 조선족 한충렬 목사 피살 사건은 보위부가 파견한 테러조의 소행""이라고 말했다.그는 또한 ""정찰총국은 캄보디아와 라오스 등지에 테러조를 파견해 해외거주 한국민을 대상으로 한 테러를 은밀히 모색하고 있는 것으로 알려졌다""며 ""사업추진을 미끼로 한국인을 유인해 납치하는 공작도 고려 중""이라고 전했다.정찰총국은 해외파견 요원들에게 재외 한국공관, 한인회 사무실 등 테러 목표를 개별적으로 할당했으며, '명령이 떨어지면 즉시 실행할 준비를 갖추라'는 지시도 하달한 것으로 알려졌다.중국 내 대북 소식통은 ""북·중 접경지역에서 탈북민 출신 한국민 4명이 북한 보위부에 의해 납치된 것으로 추정됐는데, 이중 고현철 씨는 지난 15일 평양에서 열린 기자회견에 등장해 유인납치가 사실로 확인됐다""며 ""또 다른 한 명의 탈북민도 양강도에 있는 구류소(유치장)에 갇혀있는 것으로 파악되고 있다""고 밝혔다.이 소식통은 ""최근 보위부는 반북 활동 탈북민 명단을 작성했고 이들을 대상으로 자진 입북을 권유하다가 거부하면 처단한다는 방침을 세웠다""고 말했다.이와 관련해 선남국 외교부 부대변인은 이날 정례브리핑에서 ""최근 중국 및 동남아지역 주재 재외공관에 공관 비상연락망 등을 통해 우리 국민의 신변안전에 특별히 유의할 것을 당부했다""면서 ""북측 인사 접촉 자제 계도, 주재국 치안 당국과의 긴밀한 네트워크 유지 등 우리 국민의 신변안전 강화조치를 취할 것을 지시했다""고 밝혔다.선 부대변인은 ""상대적으로 위해를 당할 가능성이 큰 관할지역 내 선교사, 특파원, 탈북민 출신 우리 국민을 대상으로 안전간담회를 개최하는 등 계도활동 강화와 북중 접경지역 방문 자제 요청 등을 지시했다""고 설명했다.외교부는 이날 오후 서울 세종로 외교부 청사에서 한동만 재외동포영사대사 주재로 선교단체들을 대상으로 한 안전간담회를 개최한다.선 부대변인은 간담회에 대해 ""국내 선교단체 대표들에게 해외에서 빈발하고 있는 '소프트타깃'을 대상으로 한 무차별적 테러 및 북한의 우리 국민 위해 가능성에 대비해 해외에서 체류 중인 선교사들의 안전에 각별히 유의할 것을 당부할 예정""이라고 덧붙였다.hojun@yna.co.kr"
139,2016-07-26,"정부 ""폭스바겐 명백한 서류조작, 소송해도 승소""",https://news.naver.com/main/read.nhn?mode=LSD&mid=shm&sid1=104&oid=008&aid=0003717361,머니투데이,"[머니투데이 세종=유영호 기자] [폭스바겐 행정처분 다음달 2일 확정… 운행중 차량에도 추가 행정조치 검토 ]서울의 한 중고차매장에 전시돼 있는 폭스바겐 중고차의 모습./사진제공=뉴스1정부가 아우디폭스바겐코리아의 소음·연비서류 조작, 무인증 차량 반입 등 혐의에 대해 다음달 2일쯤 인증취소·판매금지 등 행정처분을 확정할 예정이다.특히 운행 중인 차량을 대상으로 한 추가적 행정조치도 검토하고 있어 폭스바겐 소비자들의 피해가 예상된다.홍동곤 환경부 교통환경과장은 26일 정부세종청사에서 기자들과 만나 “청문회에서 나온 폭스바겐 측의 소명을 철저하게 검증하고 있다”며 “내일이나 모게까지 내부 입장을 결정할 계획”이라고 말했다.내부 지침이 확정되면 행정처분은 다음 달 2일쯤 공식 발표될 것으로 전망된다.환경부는 ‘단순 실수’라는 폭스바겐 측의 주장에 대해 원칙대로 대응하겠다는 입장을 거듭 확인했다.홍 과장은 “폭스바겐 측이 독일에서 판매하는 차량의 인증서류를 한국에 들여온 차종에 적용해 제출한 것으로  보인다”며 “독일과 한국에 판매하는 차종이 다르기 때문에 명백한 불법”이라고 강조했다.또 추가적으로 이미 판매돼 운행 중인 차량에 대한 행정조치도 검토하기로 했다. 1년에 50개 차종을 수시검사하는데 이를 활용해 결함 여부를 확인하고 리콜 등 필요한 조치를 내릴 계획이다.아울러 폭스바겐이 인증을 다시 신청할 경우에는 서류검사 외에 확인검사 등을 활용해 철저히 검증한다는 방침이다. 확인검사는 전체 인증 신청 차량의 3% 정도에만 적용된다.환경부는 폭스바겐과의 법적 분쟁 가능성에 대해서도 자신감을 나타냈다. 폭스바겐 측은 행정처분이 확정되면 행정소송과 더불어 환경부 행정처분에 대해 집행 정지 가처분 신청을 내는 방법을 검토 중인 것으로 알려졌다.법원이 이를 받아들이면 재판 결과가 나올 때까지 행정처분의 효력이 정지된다.홍 과장은 “서류조작은 내용적으로도 절차적으로도 명백한 불법”이라며 “서류조작은 승소 가능성이 높다고 본다”고 밝혔다.과장금의 경우 당초 예상보다 적을 것으로 전망된다. 오는 28일부터 대기환경보전법이 이 개정됨에 따라 배출가스 장치 조작과 관련한 과징금이 차종당 10억원에서 100억원으로 상향되지만 상한선이 ‘매출액의 3%’다.따라서 폴크스바겐의 경우 과징금 상한액이 약 1000억원이다. 하지만 폭스바겐이 25일부터 자발적으로 판매를 중단한 상황이어서 개정된 규정을 적용하기는 어려울 것으로 전망된다. 이 경우 과징금 최대 320억원대에 그치게 된다.홍 과장은 “폭스바겐이 행정처분에 대한 가처분 소송을 내고 이게 받아들여져 본소송 전까지 판매를 하게 되면 새로운 규정을 적용할 수 있다”며 “28일 이후에 판매한 것이기 때문에 과징금을 차종당 100억원으로 부여할 수 있다”고 말했다.[이코노미스트들의 깊이있는 투자정보 'TOM칼럼'][부자들에게 배우는 성공 노하우 '줄리아 투자노트'  ][내 삶을 바꾸는 정치뉴스 'the 300']세종=유영호 기자 yhryu@mt.co.kr<저작권자 ⓒ '돈이 보이는 리얼타임 뉴스' 머니투데이, 무단전재 및 재배포 금지>"
140,2016-07-26,"119구급대, 올해 상반기 하루평균 4755명 환자 이송",https://news.naver.com/main/read.nhn?mode=LSD&mid=shm&sid1=102&oid=008&aid=0003717302,머니투데이,"[머니투데이 김경환 기자] [이송환자 연령대 51~60세가 17.2%로 가장 많아…전체 이송환자수는 86만5360명, 주요 병력 고혈압, 당뇨 등]119구급대원들이 올해 상반기 매일 4755명의 환자를 응급처치 후 병원으로 이송한 것으로 나타났다.26일 국민안전처(장관 박인용)가 올해 상반기 119구급환자 이송현황을 분석한 결과, 전체 이송환자는 86만5360명으로 지난해 대비 8700명 증가한 것으로 나타났다. 하루 평균 4755명을 이송한 것으로 지난해 같은 기간(4733명)보다 하루 평균 22명의 환자를 더 이송했다.세부현황을 살펴보면 월별로는 가족단위 활동 빈도가 높은 가정의 달 5월(18.0%)이 가장 많았고, 그 다음으로 6월(17.3%), 4월(16.8%) 등의 순으로 나타났다. 이용시간대는 오전 9시~10시(5.8%), 10시~11시(5.4%), 8시~9시(5.2%), 13시 ~14시(5.1%) 순으로 나타났다.연령대는 51세~60세(17.2%)가 가장 많았으며, 그 다음으로 71세~80세 (15.6%), 41세~50세(13.3%) 순이었다. 장소는 집이 54.9%로 가장 많았고, 그 다음으로 일반도로(13.3%), 주택가(6.2%) 순으로 나타났다.환자의 주요 증상으로는 흉통, 복통 등의 통증을 호소하는 경우가 39.6%로 가장 많았고, 그 다음으로 외상(9.2%), 오심·구토(6.8%), 전신쇠약(6.8%), 출혈(5.0%) 및 고열(3.3%) 등의 순이었다. 주요 병력은 고혈압(28.6%), 당뇨(16.8%), 심장질환(6.9%) 등 순으로 지난해 대비 각각 3.8%, 1.6%, 0.5%씩 증가한 것으로 나타났다.질병으로 인한 환자가 52만909명으로 전체의 60.2%를 차지했고, 질병 외 환자는 39.8%(344,451명)이었다. 질병 외 환자를 세부적으로 분류하면 교통사고 환자는 운전자가 26.4%로 가장 많았고, 그 외 동승자(24.3%), 오토바이 탑승자(18.9%), 보행자(18.3%), 자전거 탑승자(9.5%) 순이었다.사고부상은 낙상환자(51.4%)가 가장 많았고, 다음으로 상해(8.2%), 열상(8%), 둔상(4.5%), 추락(4.1%) 순으로 나타났다. 또 비외상성 손상은 주취(24.2%), 중독(16.8%), 임산부(4.7%), 연기흡입(4.4%) 등의 순이었다.구급대원이 현장 등에서 시행한 처치는 총 206만140건으로 지난해 대비 6만410건이 증가했는데 주요 처치내용을 보면 보냉·보온(17.2%)이 가장 많고, 그 다음으로 기도확보(15.5%), 상처처치(10.6%), 척추 등 고정(9.5%), 산소투여(6.1%) 등의 순으로 나타났다.특히 의사의 의료 지도를 받아 시행해야 하는 전문응급처치는 지난해 대비, 약물투여 89.3%, 기도삽관 51.6%, 정맥로 확보 및 수액공급 36.3% 등 각각 큰 폭으로 증가했다. 이 같은 결과는 중증응급환자에 대한 발생 현장 및 병원에 도착하기 전까지 구급차 안에서 시행되는 구급서비스의 전문성이 날로 향상되고 있음을 알 수 있다.권대윤 119구급과장은 ""119구급대원들은 현장에서의 전문처치는 물론, 환자치료에 적합한 의료기관으로 신속하게 이송하여 생명을 살리거나 치명적인 장애를 줄일 수 있는 만큼 중증외상, 심정지, 급성심근경색, 뇌졸중 등 중증질환은 반드시 119로 신고해 도움을 받아야 한다""고 당부했다.[이코노미스트들의 깊이있는 투자정보 'TOM칼럼'][부자들에게 배우는 성공 노하우 '줄리아 투자노트'  ][내 삶을 바꾸는 정치뉴스 'the 300']김경환 기자 kennyb@<저작권자 ⓒ '돈이 보이는 리얼타임 뉴스' 머니투데이, 무단전재 및 재배포 금지>"
