,날짜,기사 제목,기사 링크,기사 출처,기사 내용
203,2016-07-26,"""평화롭던 산골마을 공포의 밤""…日장애인시설 살상극에..",https://news.naver.com/main/read.nhn?mode=LSD&mid=shm&sid1=104&oid=001&aid=0008565593,연합뉴스,"칼부림 사건 현장에 출동한 구급차(가나가와 교도=연합뉴스) 26일 새벽 일본 가나가와(神奈川)현 사가미하라(相模原)에 있는 장애인 시설에 20대 남자가 침입해 수용자들에게 흉기를 휘둘러 최소 15명이 숨지고 45명이 부상한 것으로 확인됐다고 NHK가 전했다.교도통신은 소방 당국을 인용해 19명이 사망했고 부상자 가운데 20명이 중상이라고 전해 인명 피해는 더 늘어날 것으로 보인다.사진은 사건이 발생한 '쓰구이(津久井)야마유리엔'에 출동한 구급차. 2016.7.2626세 전직 직원 장애인들에게 흉기 휘둘러…최소 19명 사망ㆍ26명 부상(도쿄=연합뉴스) 최이락 특파원 = ""조용하고 한적한 마을에서 어떻게 이런 끔찍한 일이 일어날 수 있습니까?""26일 오전 2시 30분이 조금 넘어선 새벽. 일본 도쿄(東京) 서부 가나가와(神奈川)현의 사가미하라(相模原)시 북부의 산 자락에 자리잡은 장애인 시설 '쓰구이(津久井)야마유리엔' 주변에 사는 주민들은 요란한 구급차 소리에 잠을 깼다.이어 경찰 순찰차들이 요란한 경적과 함께 이 마을로 몰려들었다. 마을 주민들은 깜짝 놀라 밖으로 나왔지만, 경찰은 ""위험하니 집 안에서 나오지 말라""는 말만 되풀이했다.주민들은 불안에 떨며 밤을 새워야 했다. 이들은 날이 밝아온 뒤 TV 긴급 속보를 보고 또 한 번 놀라야 했다. NHK 등 방송은 이 마을에 있는 장애인 시설에서 살상극이 벌어졌다고 전했다.칼부림 사건 발생한 일본 장애인 시설(가나가와 교도=연합뉴스) 26일 새벽 일본 가나가와(神奈川)현 사가미하라(相模原)에 있는 장애인 시설에 20대 남자가 침입해 수용자들에게 흉기를 휘둘러 최소 15명이 숨지고 45명이 부상한 것으로 확인됐다고 NHK가 전했다.교도통신은 소방 당국을 인용해 19명이 사망했고 부상자 가운데 20명이 중상이라고 전해 인명 피해는 더 늘어날 것으로 보인다.사진은 사건이 발생한 '쓰구이(津久井)야마유리엔' 주변 모습. 2016.7.26사상자도 많았다. NHK는 최소 15명이 숨지고 45명이 부상했다고 했고, 교도통신은 19명이 숨졌고 26명 부상했다고 전했다. 부상자 가운데 20명이 중상이고 이 가운데 4명은 의식불명 상태로 전해졌다.경찰 발표와 언론 보도에 따르면 이 사건의 용의자는 전직 쓰구아야마유리엔 직원인 우에마쓰 사토시(植松聖ㆍ26ㆍ무직)씨로 파악됐다.그는 이날 새벽 이 시설 창문을 깨고 들어가 장애인들에게 미리 준비한 흉기를 휘둘렀다. 시설에 있는 사람들이 대부분 거동조차 불편한 장애인들이어서 저항도 제대로 하지 못하고 목숨을 잃었다.현 시점에서 경찰과 소방 당국간에 인명피해 집계에서 다소 차이가 있지만 사상자는 60명 안팎인 것으로 파악된다.지난 4월말 현재 160명이 정원인 이 시설 입소자가 149명이었던 만큼 40% 가까운 사람들이 우에마쓰가 휘두른 흉기에 찔려 목숨을 잃거나 다친 것이다.살상극이 벌어지는 것을 파악한 이 시설 직원이 오전 2시 30분께 경찰에 신고했지만, 경찰이 긴급 출동했을 당시 상황은 이미 종료된 뒤였다.전직 직원 칼부림 사건 발생한 일본 장애인 시설(도쿄=연합뉴스) 최이락 특파원 = 26일 새벽 일본 가나가와(神奈川)현 사가미하라(相模原)에 있는 장애인 시설에 20대 남자가 침입해 수용자들에게 흉기를 휘둘러 최소 15명이 숨지고 45명이 부상한 것으로 확인됐다고 NHK가 전했다. 교도통신은 소방 당국을 인용해 19명이 사망했고 부상자 가운데 20명이 중상이라고 전해 인명 피해는 더 늘어날 것으로 보인다. 사진은 사건이 발생한 수용소를 촬영한 NHK 화면. 2016.7.26이 마을의 한 주민은 NHK와의 전화 인터뷰에서 ""새벽부터 구급차 경적소리가 요란해 잠에서 깬 뒤 밖을 보니 피범벅이 된 사람들이 구급차로 옮겨지고 있었다'며 ""도로에는 소방차들이 줄지어 대기하고 있었다""고 말했다.다른 주민은 ""이 시설 수용자들이 장애인인 데다, 몸을 제대로 움직이지 못하는 사람들이 많아 희생이 컸을 것""이라고 했다.우에마쓰는 이날 오전 3시께 쓰구이경찰서에 출두했다. 출두 당시 그가 소지한 가방에는 흉기류가 다수 들어 있었으며, 일부 흉기엔 피가 묻어 있었다.검은 티셔츠에 검은 바지 차림의 그는 경찰에서 ""내가 했다. 나는 전직 이 시설 직원이다""라고 말했다. 일부 언론은 우에마쓰가 ""그놈들을 해치웠다""고 말했다고 전했다.우에마쓰는 경찰에서 ""장애인들은 없어져야 한다""라는 취지의 진술도 했다고 교도통신은 전했다.경찰은 살인 혐의 현행범으로 체포한 우에마쓰를 상대로 범행 동기와 수법 등에 대해 수사를 하고 있다.아직 범행 동기는 밝혀지지 않았다. 경찰은 그가 전직 직원이었던 만큼 근무 당시 이 시설이나 입소인들과 갈등이 있었는지 등을 포함해 다각적으로 조사를 벌이고 있다. 또 우에마쓰가 정신질환이 있는지에 대해서도 조사하고 있다.choinal@yna.co.kr"
204,2016-07-26,소비·투자·수출 회복세 '미약'…굳어진 저성장,https://news.naver.com/main/read.nhn?mode=LSD&mid=shm&sid1=101&oid=001&aid=0008565254,연합뉴스,"임시공휴일 고속도로 통행료 면제[연합뉴스 자료사진]개소세 재인하 등 정부정책에도 2분기 0%대 성장 그쳐하반기에 구조조정·브렉시트 등 난제 산적(서울=연합뉴스) 노재현 기자 = 우리나라 경제가 올해 2분기에 다소 나아진 성적표를 손에 쥐었다.한국은행이 26일 발표한 2분기 실질 국내총생산(GDP)의 전기대비 성장률은 0.7%(속보치)로 1분기(0.5%)보다 0.2% 포인트 오른 것으로 나타났다.그러나 정부가 개별소비세 재인하 등 소비 진작책을 썼음에도 성장률이 소폭 상승에 그쳤다는 점에서 크게 웃기 어려운 상황이다.분기별 성장률이 작년 4분기(0.7%)부터 3개 분기 연속 0%대에 머물면서 저성장이 굳어진 현실을 그대로 보여준다.올해 2분기에는 2014년 세월호 참사, 지난해 메르스(중동호흡기증후군) 사태와 같은 대형 악재가 터지지 않았다.세계적인 교역량 둔화에 따른 수출 부진과 불확실한 경기 전망으로 인한 내수 위축 등으로 고성장을 기대하기 어려워진 셈이다.◇ 정책에 의존한 민간소비 증가율…기업투자는 여전히 저조올해 2분기 소비, 투자, 수출 등이 앞선 1분기에 비해 전반적으로 반등한 것은 긍정적이지만 회복세는 여전히 불안하다.민간소비 성장률은 0.9%로 올해 1분기 -0.2%에서 플러스로 전환됐다.작년 하반기 코리아 블랙프라이데이 등 정책 효과의 약화로 올해 1분기 '소비절벽'이 나타났던 것과 비교하면 다행스러운 일이다.민간소비 증가에는 이번에도 정부정책이 크게 기여한 것으로 평가된다.수출 기다리는 현대차[연합뉴스 자료사진]정부가 올해 2월 자동차 개별소비세 조치를 연장하고 신차가 잇따라 출시된 영향이다.자동차업계에 따르면 올해 상반기 국내 완성차 5사의 내수판매는 81만2천265대로 작년 동기보다 10.9% 증가했다.또 정부는 지난 5월6일을 임시 공휴일로 지정해 가계의 지갑을 여는 데 공을 들였다.문제는 민간소비가 정부 정책에 많이 의존하기 때문에 언제까지 지속할지 장담하기 어렵다는 점이다.급증하는 가계 부채와 높은 청년 실업률 등은 민간소비를 구조적으로 제약하는 요인이다.기업투자도 만족할만한 수준이 아니다.설비투자는 1분기에 7.4% 급감했다가 2분기에 운송장비 증가 등에 힘입어 2.9% 성장했지만, 작년 2분기와 비교하면 2.6% 감소한 것으로 나타났다.기업들이 불투명한 경기 전망과 대외적 불확실성의 영향으로 여전히 투자를 꺼리는 현상이 이어진 것으로 풀이된다.기업들의 국내 투자 감소는 경제의 성장 활력을 떨어뜨리고 신규 고용과 가계 소득 증가에 악영향을 줄 가능성이 있다.한국 경제를 이끌어온 수출 역시 회복세기 미약한 것으로 평가된다.2분기에 반도체, 석유 및 화학제품 등의 수출이 늘었지만 0.9% 성장하는 데 그쳤다.세계 교역량의 축소와 저유가 장기화, 최대 교역국인 중국의 소비중심 경제구조 추진 등으로 수출 전선에 빨간불이 켜진 지 오래됐다.◇ 하반기 추경에도 반등은 미지수…구조조정·브렉시트 악재한국 경제는 하반기에도 도약할 수 있는 돌파구를 찾기 쉽지 않다는 게 전문가들의 중론이다.한국은행, 2/4분기 GDP 설명회    (서울=연합뉴스) 최재구 기자 = 26일 서울 한국은행에서 열린 2016년 2/4분기 실질 국내총생산 기자설명회에서 김영태 국민계정부장이 질문에 답하고 있다. 2분기 실질 국내총생산의 전기대비 성장률은 0.7%로 1분기(0.5%)보다 0.2% 포인트 오른 것으로 나타났다. 2016.7.26    jjaeck9@yna.co.kr조선·해운업을 중심으로 한 기업 구조조정과 브렉시트(영국의 유럽연합 탈퇴) 등 대내외 여건의 불확실성이 커질 것이라는 우려가 크다.한은도 지난 14일 올해 성장률 전망치를 기존 2.8%에서 2.7%로 낮추면서 하반기에 하방위험이 커질 수 있다고 지적했다.앞으로 구조조정이 본격화되면 대량실업이 발생하고 은행 등 금융기관들이 대출을 꺼리면서 자칫 신용경색이 나타날 우려가 있다.브렉시트 결정으로 인한 국내 금융시장의 충격은 아직 크지 않지만, 장기간 불안요인으로 작용할 개연성이 있다.최근 국제통화기금(IMF)도 브렉시트 여파를 고려해 올해 세계경제의 성장률 전망치를 3.2%에서 3.1%로 하향 조정했다.정부는 하반기에 추가경정예산(추경) 등 확장적인 재정정책으로 경기 부양에 적극적으로 나설 계획이다.유일호 부총리 겸 기획재정부 장관은 지난 22일 ""추경 등 28조원 이상의 재정보강으로 올해 성장률이 0.2∼0.3% 포인트 높아지는 효과가 있을 것""이라고 말했다.11조원 규모의 추경은 6만8천개의 일자리가 창출할 것으로 기대됐다.그러나 지난 6월 한은의 기준금리 인하와 하반기 추경에도 한국 경제를 낙관하기 어렵다는 전망이 나온다.LG경제연구원은 지난 12일 내놓은 보고서에서 소비, 건설투자 등 내수 회복세가 하반기에 둔화될 것이라며 10조원 규모의 추경도 성장세의 하향 흐름을 바꾸기 어려울 것으로 내다봤다.이근태 LG경제연구원 수석연구위원은 ""하반기에는 세계 경제의 불안요인이 많은 만큼 수출 부진이 지속하고 민간소비, 설비투자의 힘이 약화할 것""이라고 말했다.정부는 올해 우리 경제의 성장률을 2.8%로 기대하고 있지만, 민간연구기관들은 대부분 2%대 초중반에 그칠 것으로 전망하고 있다.또 우리나라 잠재성장률이 지속해서 하락하고 있어 구조개혁과 신사업 육성 등에 힘써야 한다는 지적이 많다.이주열 한은 총재도 최근 ""저출산·고령화가 빠르게 진전되면서 생산가능인구가 감소하는 상황을 반영할 때 잠재성장률 하락 추세는 충분히 예견할 수 있다""고 말했다.한은은 올해 1월 2015∼2018년 잠재성장률을 연평균 3.0∼3.2%로 추산한다고 발표했다.nojae@yna.co.kr"
205,2016-07-26,"정부, '분양보증 거부'로 집값 조절 시도",https://news.naver.com/main/read.nhn?mode=LSD&mid=shm&sid1=101&oid=055&aid=0000434064,SBS,"<앵커>친절한 경제입니다. 얼마 전에 강남 재건축 분양가 계속 올라간다는 얘기 전해드렸었는데요, 이렇게 계속 재건축 아파트값의 분양가가 계속 올라가다 보니까 정부가 사실상의 단속에 나섰다고 하거든요. 이게 어떤 얘기인지 모르겠네요.<기자>작년부터 재건축 아파트 강남 쪽에 4천만 원은 기본이고 옛날식으로 치면 평당 4천5백까지도 가고 그래서강남구의 개포동에 새로 짓는 재건축 아파트도 ""이걸 우리도 올려받을까?"" 했는데, 정부가 작년에 분양가 상한제를 없앴거든요. 그래서 공식적으로는 할 수 없으니까 사실은 편법을 써서 이걸 지금 막고 있습니다.<앵커>편법이라는 게 어떤 건가요?<기자>아파트 분양을 받아서 내가 중도금, 잔금 이런 걸 냈는데 중간에 건설사가 문제가 생길 수도 있잖아요. 그러면 돈을 떼일 수도 있고 손해를 볼 수도 있으니까, 주택도시보증공사란 데가 있습니다. 여기가 문제가 생기면 ""그러면 우리가 책임져줄께."" 하고 보증을 서주는 데에요.대한민국에 이 회사 딱 하나 있습니다. 이 회사가 보증은 안 서주면 분양이 안 돼요. 그런데 아까 말씀드린 개포동의 주공 아파트 같은 경우는 처음에 평당 5천만 원 얘기를 했었거든요. 분양가를.그런데 계속 퇴짜를 계속 맞아서, 이번에 4천3백만 원에 신청을 했다가 ""그것도 안 돼."" 이렇게 채였어요. 지금까지 이걸 안 해준 경우가 없었습니다.대부분 그냥 해줬었는데, 갑자기 지금 동네 아파트값보다 분양가가 10% 이상 비싸면 앞으로 우린 못 해준다. 이렇게 갑자기 원칙을 처음 내세운 거예요.그동안은 강남 분양가 높은 거 사실 정부가 봐줬었는데, ""너무 간다. 이렇게 부담이 된다."" 하니까 이걸 조이는 방법으로 저 공사를 지금 활용해서 분양을 못 하게 하고 있는 거죠.얘기를 한 번 들어보시죠. 이유를 설명을 들어보시죠. 예고가 전혀 없었죠. 전에 그런 경우가 없었는데 올라가니까 갑자기 브레이크를 거는 거죠.[주택도시보증공사 관계자 : 고분양가가 강남 재건축이 먼저 고분양가를 하고 보통은 그게 선행을 해서 서울시 분양가에 영향을 미치고 전국으로 파급이 될 수 있는데요, 나중에 경제 쇼크가 왔을 때는 미입주, 미분양 증가가 있고 그런 리스크가 있기 때문에 그때는 공사에서 주택건설업체가 부실화되고 부도 가능성이 있지 않겠습니까.]원래대로 해줄 줄 알고 공사 준비를 해온 입장에서는 이렇게 일이 밀리면 돈이 더 들어가고, 계획도 꼬이고 이러니까 불만을 가질 수밖에 없습니다. 사실상 분양가 상한제 다시 하는 것 아니냐 이런 얘기가 나오죠.[건설업계 관계자 : 업계는 상당히 당황스럽고 업계에서 느끼는 것은 분양가 상한제가 실질적으로 시행되는 게 아닌가…]결과적으로 이렇게 되면서 지금 수도권 집값을 끌어올리고 있는 강남 재건축 쪽의 불은 좀 약해질 수밖에 없을 겁니다.이렇게 속도와 흐름을 조절하는 건 저도 전에 말씀드렸지만 필요한데, 문제는 정부가 이걸 법과 제도에 따라서 정식으로 해야지 갑자기 불쑥 공무원 마음대로 이랬다저랬다 이런 방법을 써서 하는 건 부적절하지 않냐는 생각이 든다는 거죠.<앵커>그렇긴 한데, 그동안 강남 워낙 비싸 왔으니까 ""이렇게라도 잘 막았다."" 하시는 분도 계실 것 같아요.<기자>있죠. 계실 텐데, 정부 정책이라는 게 신호등처럼 멀리서 보다가도 파란불에서 노란불 되면 ""곧 빨간불 들어오겠구나. 그럼 서야지."" 이렇게 해서 천천히 생각해서 자기가 서게 만들어줘야지 신호기를 자기 맘대로 '파란불 켰다. 빨간불 켰다.' 그러면 교차로 엉키고 사고 나거든요. 그런데 이런 일이 지금 강남뿐만 아니라 다른 데서 또 벌어지려고 하는 게 사실 더 큰 문제입니다.<앵커>또 있나요?<기자>일반 아파트 분양받으신 분들도 대출을 받잖아요. 중도금 대출을 받는데, 긴장을 하셔야 되는 게 이게 나중에 잔금 치를 때 잔금 대출로 바뀝니다.그런데 건설사 쪽에서 이걸 그냥 처리를 하는 데 정부가 얼마 전에 은행들한테, 이거 잔금 대출도 마찬가지로 빌려줄 때 빌리는 사람 직업하고 소득을 제대로 파악하라고 이렇게 지시를 내렸어요.지금까지는 이거 잘 파악 안 하고 사실 빌려줬었거든요. 그런데 분양은 이미 받아서 중도금까지 대출을 해서 내신 분들이 문제가 될 수 있는 게 마지막 들어가기 직전에 잔금대출을 새로 받아야 되는데, 은행들이 이 지시를 받아서 바짝 긴장해서 거기서 갑자기 막아버릴 수가 있습니다. 그러면 잔금을 못 내게 될 가능성이 있다는 거잖아요.정부가 부동산 불씨 살리기에 나섰다가 대출이 갑자기 너무 많이 느니까 삐그덕 거리니까 이제 조이기를 시작한 건데, 맞는 방향이더라도 방법을 변칙적으로 쓰면 안 된다는 거죠.분양받은 사람들이 손해를 볼 수 있는 거고, 정부 말을 믿고 사업을 하고 경제활동 하기가 어려워진 그런 문제가 되는 겁니다.김범주 기자(news4u@sbs.co.kr)※ ⓒ SBS & SBS콘텐츠허브 : 무단복제 및 재배포 금지☞ ""속옷까지 다 젖어""…소방관의 '지옥불' 사투"
206,2016-07-26,서울 닷새째 열대야…낮에는 폭염 계속,https://news.naver.com/main/read.nhn?mode=LSD&mid=shm&sid1=103&oid=052&aid=0000879595,YTN,"[앵커]서울에 닷새째 열대야가 나타난 가운데 낮 동안에는 폭염이 기승을 부리겠습니다.자세한 날씨, 야외 스튜디오 연결해 알아보겠습니다.박희원 캐스터, 전해주시죠.[기자]전국이 가마솥에 갇힌 듯 뜨거운 날씨가 이어지고 있습니다.밤사이에도 열기가 식지 않고 있는데요.수도권과 남부, 제주도에는 밤사이 기온이 25도를 웃돌며 열대야 현상이 나타났고요.서울은 오늘로 닷새째 열대야가 이어졌습니다.한낮에는 30도를 크게 웃돌며 폭염이 기승을 부리겠습니다.현재 서울 기온 28도인데, 낮 동안 32도까지 올라 무척 덥겠습니다.전국적으로 폭염특보가 계속되고 있습니다.수도권은 일주일 넘게 폭염주의보가 내려져 있고, 충북 남부와 남부 곳곳에는 폭염경보가 발효 중입니다.폭염 경보가 내려진 지역은 오늘도 낮 기온이 35도 안팎까지 오르겠습니다.대구가 35도, 광주 34도, 대전 33도, 서울 32도로 어제와 비슷하거나 조금 높겠습니다.오늘 대체로 구름만 많은 날씨가 이어지겠지만, 소나기가 내리는 지역이 있습니다.대기 불안정으로 오전에는 제주도에, 오후에는 영남 지방에 소나기가 내리겠습니다.내일부터 모레 오전 사이에는 중부지방에 막바지 장맛비가 내리겠습니다.비의 양은 5에서 40mm로 많지 않겠습니다.남부 지방은 당분간 대체로 맑은 가운데 폭염이 계속되겠고, 한때 소나기만 지날 것으로 전망됩니다.연일 예년보다 심한 폭염이 이어지고 있습니다.일사병과 열사병 등 온열 질환도 늘고 있으니까요, 충분한 휴식과 수분 섭취로 건강 지키시기 바랍니다.지금까지 YTN 뉴스퀘어에서 박희원입니다.▶ [원포인트생활상식] 생활 속 상식, 팁 등 알짜 정보를 제공합니다!▶ 뉴스 덕후들의 YTN페이스북▶ 내가 만드는 뉴스! YTN제보[저작권자(c) YTN(Yes! Top News) 무단전재 및 재배포 금지]"
207,2016-07-26,연구비 횡령·유용 연구자 및 대학에 '철퇴'..과징금 최대 300%,https://news.naver.com/main/read.nhn?mode=LSD&mid=shm&sid1=102&oid=003&aid=0007370854,뉴시스,"'학술진흥법 시행령 일부 개정안' 26일 국무회의 의결연구용도 외 지출 10억원 초과…과징금 최대 300%【서울=뉴시스】백영미 기자 = 앞으로 연구비를 횡령·유용하는 연구자와 대학 등은 부정하게 사용한 금액의 최대 300%를 과징금으로 물게된다.교육부는 이같은 내용을 담은 '학술진흥법 시행령 일부 개정안'이 26일 국무회의에서 의결됐다고 밝혔다.이번 개정안에는 연구비를 연구 외 다른 용도로 사용하면 부과되는 과징금인 '제재 부가금' 규정이 포함됐다. 그동안 연구비를 용도 외로 사용하면 해당 연구비를 반납하고 5년 내 새로운 연구사업에 참여할 수 없었지만 과징금은 부과되지 않았다.제재부가금은 부정하게 사용한 금액에 따라 달라진다. 부정하게 사용한 금액이 커질수록 제재 부과금 부과율이 늘어난다. 한 예로 부정하게 쓴 돈이 5000만원 이하면 사용금액의 50%를 과징금으로 내야 한다. 10억원을 초과하면 기본 부가금 20억2500만원에 10억원 초과 금액의 300%를 더한 금액을 과징금으로 물게된다.단순 과실이나 부정하게 사용한 금액이 100만원 미만일 경우 연구비를 연구 외 다른 용도로 사용했다고 하더라도 해당 금액을 원래대로 돌려놓으면 제재부과금이 면책된다. 다만 부정하게 사용한 금액이 100만원 미만이라도 학생인건비로 사용한 경우에는 제재부가금이 부과된다.개정안에 따르면 연구 부정 행위를 감추기 위해 조사를 거부하거나 조사에 협조하지 않으면 부과되는 과태료 기준도 세분화됐다.사업비 지원을 받은 연구자나 대학이 교육부 장관의 자료 보고 요구를 거부하거나 거짓 자료를 제출하면 100만~300만원의 과태료를 내야 한다. 현장실태조사를 거부·방해하면 1000만원이 부과된다.학술진흥법 시행령 일부 개정안은 8월4일부터 시행된다.positive100@newsis.com뉴시스 뉴스, 네이버 뉴스 스탠드에서도 만나세요뉴시스 SNS[페이스북][트위터]<저작권자ⓒ 공감언론 뉴시스통신사. 무단전재-재배포 금지.>"
208,2016-07-26,연구비 횡령·유용 연구자 및 대학에 '철퇴'…과징금 최대 300%,https://news.naver.com/main/read.nhn?mode=LSD&mid=shm&sid1=102&oid=003&aid=0007370854,뉴시스,"'학술진흥법 시행령 일부 개정안' 26일 국무회의 의결연구용도 외 지출 10억원 초과…과징금 최대 300%【서울=뉴시스】백영미 기자 = 앞으로 연구비를 횡령·유용하는 연구자와 대학 등은 부정하게 사용한 금액의 최대 300%를 과징금으로 물게된다.교육부는 이같은 내용을 담은 '학술진흥법 시행령 일부 개정안'이 26일 국무회의에서 의결됐다고 밝혔다.이번 개정안에는 연구비를 연구 외 다른 용도로 사용하면 부과되는 과징금인 '제재 부가금' 규정이 포함됐다. 그동안 연구비를 용도 외로 사용하면 해당 연구비를 반납하고 5년 내 새로운 연구사업에 참여할 수 없었지만 과징금은 부과되지 않았다.제재부가금은 부정하게 사용한 금액에 따라 달라진다. 부정하게 사용한 금액이 커질수록 제재 부과금 부과율이 늘어난다. 한 예로 부정하게 쓴 돈이 5000만원 이하면 사용금액의 50%를 과징금으로 내야 한다. 10억원을 초과하면 기본 부가금 20억2500만원에 10억원 초과 금액의 300%를 더한 금액을 과징금으로 물게된다.단순 과실이나 부정하게 사용한 금액이 100만원 미만일 경우 연구비를 연구 외 다른 용도로 사용했다고 하더라도 해당 금액을 원래대로 돌려놓으면 제재부과금이 면책된다. 다만 부정하게 사용한 금액이 100만원 미만이라도 학생인건비로 사용한 경우에는 제재부가금이 부과된다.개정안에 따르면 연구 부정 행위를 감추기 위해 조사를 거부하거나 조사에 협조하지 않으면 부과되는 과태료 기준도 세분화됐다.사업비 지원을 받은 연구자나 대학이 교육부 장관의 자료 보고 요구를 거부하거나 거짓 자료를 제출하면 100만~300만원의 과태료를 내야 한다. 현장실태조사를 거부·방해하면 1000만원이 부과된다.학술진흥법 시행령 일부 개정안은 8월4일부터 시행된다.positive100@newsis.com뉴시스 뉴스, 네이버 뉴스 스탠드에서도 만나세요뉴시스 SNS[페이스북][트위터]<저작권자ⓒ 공감언론 뉴시스통신사. 무단전재-재배포 금지.>"
