,날짜,기사 제목,기사 링크,기사 출처,기사 내용
43,2015-08-26,"이산가족 상봉 합의 ""이번엔 꼭"" 희망 찾는 사람들",https://news.naver.com/main/read.nhn?mode=LSD&mid=shm&sid1=102&oid=081&aid=0002598117,서울신문,"[서울신문]남북이 25일 추석 이산가족 상봉에 합의하면서 많은 이산가족들이 감격의 재회에 대한 희망을 갖게 됐다. 현재 정부에 등록된 이산가족 중 생존자는 6만 6000여명에 이른다. 64년 전 북에 두고 온 딸을 단 한시도 잊지 못했던 김윤희(90·여)씨와 조카를 만날 날을 손꼽아 기다려온 최은범(81)씨의 사연을 들어봤다.■두살배기 딸 두고 온 김윤희 할머니의 눈물“딸 생일 나만 아는데… 죽기 전 사랑 다 줬으면”“다시 그때로 돌아갈 수만 있다면…아무리 추워도 내가 너를 꽁꽁 싸서 꼭 안고 내려오는 건데….”25일 서울 용산구 자택에서 만난 김윤희(90) 할머니는 1·4 후퇴 때 두 살 난 어린 딸이 감기라도 걸릴까 집에 두고 남쪽으로 온 것이 평생 한으로 남았다고 했다. 6·25전쟁 전까지만 해도 할머니가 살던 개성은 남한 땅이었다. 그래서 곧 다시 돌아갈 수 있을 줄만 알았다. 칭얼대는 딸을 친정어머니 품에 안기고선 아들 손을 붙잡고 돌아선 게 긴 이별의 시작일 줄은 꿈에도 몰랐다.이날 아침 남북 협상 타결로 이산가족 상봉이 재개될 거란 소식을 듣자마자 할머니는 대한적십자사에 전화를 걸었다. 그토록 오랜 세월이 지난 후에야 결심한 첫 이산가족 상봉 신청이었다. 김 할머니는 “헛된 기대만 품다 실망하게 될 것 같아 그동안 시도조차 안 했다”고 말했다. 하지만 이번엔 정말 마지막 기회일지 모른다는 생각에 “안 될 걸 알면서도 용기를 냈다”고 했다.김 할머니에게 둘째 딸 최봉미씨는 늘 아픈 손가락이었다. 당시 초등학교 교사였던 김 할머니는 일 욕심이 많은 ‘커리어 우먼’이었다. 아이들에게 상대적으로 소홀할 수밖에 없었다. 남편과의 불화로 그 어린 딸에게 충분한 사랑도 주지 못한 것 같아 더욱 한스럽다고 했다. “임신했을 때 입덧이 너무 심해 음식을 거의 못 먹어서 그런지 봉미가 어릴 때부터 마르고 머리숱도 적었어요. 바쁘다고 제대로 젖도 못 먹인 게 이날까지 후회로 남아요.”김 할머니는 30여 년 전 주영숙 전 덕성여대 총장의 개인 작품전에 갔다가 딸을 똑 닮은 청동소녀상을 구입했다. 그 후로 동상을 볕 잘 드는 창가에 세워두고 ‘봉미’라고 부르며 지낸다. 그러나 소녀상 ‘봉미’를 볼 때마다 그처럼 포동포동하고 예쁘지 못했던 딸 봉미의 모습이 눈앞에 아른거려 외려 가슴이 아프다고 했다.김 할머니는 월남 후 서울 중앙여중에서 3년간 교편을 잡았다. 제자들 하나하나를 고향에 두고 온 딸이라 생각하고 가르쳤다. 그 진심이 닿았던 걸까. 머리가 하얗게 센 제자들이 아직도 은사님을 찾아온다. 그러나 김 할머니는 딸의 생사도 모른 채 자신만 편하게 지내는 것 같아 감사 인사를 받을 때마다 남모를 죄책감에 시달렸다.딸을 만나게 되면 전하고 싶은 말이 있느냐는 물음에 할머니는 “그냥 생사만 확인해도 더 바랄 게 없겠다”며 눈시울을 붉혔다. “2월 15일이 딸 생일인데 아는 사람이 나뿐이라 매년 기념하지도 않고 조용히 지나가요. 이제 나까지 저 세상 가면 누가 기억해 줄까요. 죽기 전에 만나 지금껏 주지 못한 사랑을 줄 수 있다면 이 한이 좀 덜어질까요.”김희리 기자hitit@seoul.co.kr■부모님과 이별한 최은범 할아버지의 슬픔“복권보다 힘든 만남… 실향민 목마름 못 채워”“이산가족 상봉이 재개된다니 기쁘지요. 그런데 마냥 반갑다가도 한숨이 나오는 건 어쩔 수가 없네요.”북에 남겨둔 조카를 만날 날을 손꼽아 기다려온 최은범(81)씨는 25일 남북 협상 타결 소식을 듣고도 그다지 들뜬 표정은 아니었다. 2000년부터 이뤄진 이산가족 상봉을 쭉 지켜봐 온 그는 남북 간 상봉 합의가 시작에 불과하다는 것을 경험으로 알고 있었다. “60년 넘게 흩어진 가족이 만나는 일은 실향민들에게는 가뭄에 단비처럼 아름다운 일입니다. 그런데 그 숫자가 너무나 미미해요.”지금까지 해온 상봉 방식대로 남북이 매년 100명씩 가족을 주고받는다고 해도 최씨에게 조카와의 만남은 여전히 먼일이다. “우리 사이에서 가족을 만나는 건 복권에 당첨되는 것보다 힘들다고 해요. 기왕에 서로 합의한 것 이번에는 판을 좀 더 키우면 좋겠네요.”최씨가 고향인 함경북도 성진을 떠나 남으로 내려온 것은 1948년 11월이었다. 먼저 남한에 내려가 있던 형수가 가족들을 데려가겠다며 칼바람을 뚫고 고향으로 찾아온 날이 70년 가까이 흐른 지금도 그렇게 생생할 수가 없다. “갓 돌이 지난 딸을 업고 제기동에서부터 그 먼 길을 왔어요. 기차를 타면 아직도 38선 건널 수 있다면서.”하지만 최씨의 부모는 선조들의 묘소를 지키겠다며 열네 살 아들과 막내딸만을 기차에 실어 보냈다. 이별의 시작이었지만 그게 영원할 줄은 아무도 몰랐다. “어머니가 12월에 서울에 한 번 오셨는데 북에 남겨놓은 외손녀가 불쌍하다며 다시 올라갔어요. 우리가 말릴까 봐 가족들이 자는 새벽에 몰래 가셨더라고. 이게 1949년 봄이에요.” 그로부터 1년 뒤 전쟁이 터졌다.최씨가 찾고 있는 가족은 어머니의 외손녀로, 자신의 조카인 최봉숙씨다. “만나게 되면 지금까지 살아줘서 고맙다며 꼭 안아줘야지. 그리고 물어봐야죠. 우리 아버지, 어머니 어떻게 지내셨는지… 고향 땅에 묻혀 계시다면 그래도 행복할 것 같아요.”그는 명절이 되면 고향 생각이 더 간절하다. “추석에 달밤을 맞으면 내 고향에서도 누군가 같은 달을 보겠지 생각합니다. 그럴 때 자식들한테 더 북쪽 얘기를 하지. 안 하면 까먹으니까.” 최씨는 자신이 태어난 집, 주변 텃밭을 거닐며 살아보는 것이 남은 소원이라고 했다.그는 이산가족 상봉의 남북 양측 실무자들에 진심을 담은 당부의 말을 남겼다. “이건 이념을 따질 일도 아니고 손익을 계산할 문제도 아니에요. 절박하고 아주 긴급한 문제라고요. 이점만 명심하고 일을 하면 좋을 거 같아요.”조용철 기자 cyc0305@seoul.co.kr▶ 부담없이 즐기는 서울신문 ‘최신만화’- 저작권자 ⓒ 서울신문사 -"
44,2015-08-26,미국서 드론 통해 총기·마약 교도소 반입 시도 적발,https://news.naver.com/main/read.nhn?mode=LSD&mid=shm&sid1=104&oid=001&aid=0007813345,연합뉴스,"미 메릴랜드 당국에 적발된 드론과 조종기(워싱턴=연합뉴스) 심인성 특파원 = 미국에서 드론(무인기)을 이용해 총기 등을 교도소로 불법으로 반입하려던 한 남성이 경찰에 체포됐다.25일(현지시간) 의회전문지 더 힐(The Hill) 등 미 언론에 따르면 메릴랜드 주(州) 치안교정국은 전날 메릴랜드 주 크레삽타운의 교도소 근처에서 드론과 함께 총기, 마약, 담배, 포르노 비디오 등 다른 금지품목이 실린 차량을 적발하고 해당 차량의 운전자를 체포했다.치안교정국 관리들은 이 남성이 드론을 이용해 총기 등을 경계가 삼엄한 교소도 안으로 반입하려고 했다면서 드론을 이용한 총기 교도소 반입 시도는 이번이 처음이라고 말했다.래리 호건 메릴랜드 주지사는 성명을 통해 총기 반입 시도를 미리 적발한 경찰과 교도소 직원들을 공개 칭찬하면서 ""교도소를 안전하게 유지하고 금지품목이 반입되지 않도록 하는 것이 주 정부의 최우선 과제""라고 밝혔다.드론을 이용한 금지품목 교도소 반입 시도는 이번이 처음이 아니다.일례로 앞서 지난달 29일에는 오하이오 주 맨즈필드의 한 교도소 상공에서 헤로인 7g, 마리화나 57ｇ, 담배 142ｇ이 담긴 '마약 꾸러미'가 떨어져 이를 차지하려는 재소자들 간에 일대 몸싸움이 벌어졌는데 조사 결과 이 꾸러미는 외부인이 한 재소자를 위해 드론에 실어보낸 것으로 밝혀졌다.sims@yna.co.kr▶ [현장영상] 넘어지며 18억 짜리 그림을…""헉! 어떡하죠?""▶ [오늘의 핫 화보] 머리에 공 맞은 나주환 '하마터면 큰일날 뻔'"
45,2015-08-26,'세렝게티'가 아프리카에만 있는 이유,https://news.naver.com/main/read.nhn?mode=LSD&mid=shm&sid1=105&oid=028&aid=0002286914,한겨레,"[한겨레]물바람숲그림 쇠렌 파우르뷔 제공‘동물의 왕국’으로 알려진 탄자니아의 세렝게티 국립공원 등 열대 아프리카에는 얼룩말부터 사자, 하마, 코끼리까지 대형 포유류가 구색을 갖춰 다양하게 산다. 아프리카를 벗어나 이런 다양성을 보이는 곳은 없다. 그곳의 기후와 환경이 특별한 것일까.사람에 의한 서식지 파괴와 사냥 등이 없었다면 대형 포유류의 낙원은 아프리카가 아니라 아메리카였을 것이란 연구 결과가 나왔다. 아프리카는 인간의 영향을 덜 받는 세계 최대의 피난처이며, 세계 곳곳의 산악지대도 그런 구실을 한다는 주장도 제기됐다.쇠렌 파우르뷔 덴마크 오르후스대 박사과정생 등 연구자들은 과학저널 <다양성 및 분포> 최근호에 실린 논문에서 인류가 지구의 생물다양성에 어떤 영향을 끼쳤는지 알아보기 위해 지난 13만년 동안 출현한 모든 포유류가 인간이 있을 때와 없을 때 분포지역이 어떻게 달라지는지를 조사했다.종마다 생태학과 생물지리학을 기초 분석한 결과를 세계지도에 표시했더니(그림) 놀랍게도 사람이 없었다면 포유류 종이 가장 다양했을 곳은 아메리카대륙이었다. 로키산 남부, 멕시코, 아르헨티나 북부가 최고의 다양성을 나타냈다. 미국과 유라시아 대부분은 열대 아프리카와 비슷한 수준이었다.연구책임자인 파우르뷔는 “아프리카에 대형 포유류가 다양한 까닭은 자연적인 이유가 아니라 오히려 인간활동이 대형 동물을 쓸어버리지 못한 유일한 곳이기 때문”이라고 이 대학 보도자료에서 말했다. 아프리카의 기후와 환경이 포유류가 살기에 적합했다기보다 오랜 기간 동안 인간과 함께 진화하면서 인류에 적응했고 또 토착 질병이 인류의 확산을 막았을 가능성이 있다는 것이다.산악지역은 다양한 환경과 고립으로 새로운 포유류가 진화한 곳이다. 그러나 이 연구에서 산악은 그런 진화의 요람일 뿐 아니라 인간의 영향에서 벗어나는 피난처 구실을 했음이 드러났다. 유럽 불곰은 애초 저지대에 주로 서식하지만 현재 사람이 없는 고산지대에만 분포하는 것은 그런 예이다.조홍섭 환경전문기자 ecothink@hani.co.kr 그림 쇠렌 파우르뷔 제공공식 SNS[페이스북][트위터]|[인기화보][인기만화][핫이슈]Copyrights ⓒ 한겨레신문사, 무단전재 및 재배포 금지<한겨레는 한국온라인신문협회(www.kona.or.kr)의 디지털뉴스이용규칙에 따른 저작권을 행사합니다.>"
46,2015-08-26,개강 앞둔 대학가는 지금'방 구하기' 전쟁중,https://news.naver.com/main/read.nhn?mode=LSD&mid=shm&sid1=102&oid=437&aid=0000089398,JTBC,"[앵커]최근 워싱턴포스트에 실린 사진입니다. 열차에 탄 독일 대학생 모습인데요. 여행을 가는 게 아닙니다. 월세가 비싸다 보니 철도 자유 이용권을 사서, 열차에서 먹고 자며 '내 집'처럼 이용한다는 얘기입니다. 그런데 이게 남의 얘기 같지 않죠. 우리나라 대학가에도 개강을 앞두고 '방 구하기 전쟁'이 벌어지고 있다고 합니다.조금이라도 싼값에 좋은 방을 구하려는 학생들의 고단한 하루를 김소현 기자가 따라가 봤습니다.[기자]학교 기숙사에 지원했다 탈락한 최수림 양은 요즘 하루 종일 방을 보러다니는 게 일입니다.다음주면 개강인데 걱정이 이만저만이 아닙니다.오늘은 무조건 계약을 하겠다고 마음먹고 나선 길, 학생회 자원봉사 상담원과 함께 학교 근처에 있는 여학생 전용 하숙집부터 찾았습니다.[(4명에 화장실 하나에요?) 5명. 옛날 집에서 다섯 식구 살았잖아. 화장실 하나였잖아.]월 45만원도 적잖은 부담인데, 화장실도 같이 써야 한다니 선뜻 내키지 않습니다.[최수림/연세대 2학년 : 6명이 (화장실) 1개인 데도 있고, 8명이 1개인 데도 있고…]월 40만원짜리 또다른 하숙집, 하지만 집은 생각했던 것과 너무 달랐습니다.[연세대 학생회 상담원 : 채광도 안 좋고, 계단도 너무 가파르고.]기찻길에 가까운 집은 소음이 크고,[햇빛 잘 들고 따뜻하고. (여긴 얼마에요?) 40만원.]전셋값이 오르면서 월세를 찾는 사람이 늘자 방 구하기는 더 어려워졌습니다.강영호 학생은 반지하 방만은 피해 보려고 결국 더 비싼 집을 구했습니다.모자란 돈은 아르바이트로 채울 생각입니다.[강영호/경희대 3학년 : 갔던 방이 반지하에다 시설도 많이 낙후돼서 원래 생각했던 것보다 가격을 좀 더 올려서…]현재 서울지역 대학생의 기숙사 수용률은 11%에 불과한 현실.대학가 자취방의 월세는 감당하기 힘든 수준까지 올랐습니다.[인근 공인중개사 : (월세는) 50만원이 보통이에요. 시세가 50만원인데 찾으러 오는 학생들은 싼 거 찾을 거 아니에요.]책값, 교통비 한푼 아껴야 하는 대학생들에게 방 구하기 전쟁은 부담스럽기만 합니다.김소현▶ JTBC 뉴스 공식 SNS[트위터][페이스북][카카오스토리][유튜브]▶ JTBC 뉴스는 여러분의 생생한 제보를 기다립니다.Copyright by JTBC, DramaHouse & JcontentHub Co., Ltd. All Rights Reserved. 무단 전재 및 재배포 금지"
47,2015-08-26,내전에 IS까지바람 앞 촛불 신세 시리아 유적들,https://news.naver.com/main/read.nhn?mode=LSD&mid=shm&sid1=104&oid=001&aid=0007813176,연합뉴스,"IS가 공개한 완전히 파괴된 팔미라 유적의 바알샤민 신전 사진(서울=연합뉴스)훼손·약탈 가속화…IS, 팔미라 유적지 중요정보 확보 가능성도(서울=연합뉴스) 백나리 기자 = ""저는 세상에서 가장 슬픈 문화재청장이 됐습니다. 매우 무력하고 비관적인 느낌이 듭니다.""마문 압둘카림 시리아 문화재청장의 말이다. 오랜 내전도 모자라 이슬람국가(IS)까지 설치는 바람에 수천 년의 비바람을 견뎌온 유적들이 손 쓸 새 없이 파괴되고 있기 때문이다.바알샤민 신전폭파를 위해 폭탄을 들고오는 IS 전사들(IS 공개 사진)미국 일간 뉴욕타임스(NYT)는 24일(현지시간) 내전으로 시작된 시리아의 유적 및 유물 파괴가 도를 넘는 수준에 이르렀다면서 IS의 만행으로 피해가 심화하고 있다고 지적했다.IS는 최근 '사막의 진주'라는 별칭으로 불리는 시리아 팔미라 고대유적지에서 2천 년 된 고대신전 바알 샤민 신전을 폭파하고 '팔미라 지킴이'였던 노학자를 잔인하게 참수하는 등 인류문화유산 파괴에 앞장서고 있다.바알 샤민 신전은 규모는 비교적 작은 편이지만 보존 상태가 좋아 팔미라 유적지의 핵심으로 꼽힌다.IS는 이날 바알 샤민 신전의 폭파 장면을 담은 사진을 공개했다. 사진에는 IS전사들이 신전에 폭탄을 배치하는 모습과 폭탄이 폭발해 신전위로 회색 연기기둥이 치솟는 모습, 폭파 이후 돌무더기로 변한 신전의 모습이 담겼다. IS는 사진설명을 ""바알 샤민 신전의 완전한 파괴""라고 달았다.IS가 바알샤민 신전에 폭탄을 배치한 모습(서울=연합뉴스 DB)지난 5월 팔미라를 장악한 IS는 2천 년 된 사자상도 하루아침에 날려버렸다. 내다팔 수 있는 유물은 약탈해 돈을 벌고 그렇지 않은 유물은 폭파시키며 선전전을 벌이는 것이다.시리아 문화재의 시련은 내전이 발발한 2011년부터 시작됐다. 유적 보호에 별 관심이 없었던 시리아 정부군과 반군이 중세의 성채나 좁은 골목을 적의 공격을 막는 데 활용하면서 파손을 방치했다.이 때문에 유네스코 지정 세계문화유산인 십자군 성채 크락데 슈발리에 등 시리아 전역의 유적이 훼손을 면치 못했다.문화재청 직원 2천500명과 민간 활동가 등이 정부군·반군·IS 점령지역에서 동시다발로 발생하는 유적 파괴를 막으려 애를 쓰고는 있지만 역부족이다.바알샤민 신전이 폭파돼 연기기둥이 치솟는 모습(서울=연합뉴스DB)압둘카림 문화재청장은 ""유물 30만 점은 구해냈지만 전국 유적지 1만 곳을 다 지켜낼 수는 없었다""면서 ""이 나라의 풍요로운 문화에 벌어지는 일들을 어떻게 납득할 수가 있겠나""라며 비통해했다.한편 IS가 팔미라의 발굴지도와 현재 진행 중인 발굴작업 등에 대한 상세한 자료를 확보했을 가능성이 있어 고대유적 훼손 및 유물 약탈에 대한 우려가 한층 고조되고 있다.영국 일간 더타임스는 최근 IS에 참수당한 고고학자 칼리드 아사드의 아들 왈리드가 해당 자료를 팔미라에 남겨둔 채 다른 지역으로 피신했다면서 이같이 보도했다.왈리드는 ""IS가 나를 나흘간 감금하고 금과 보석, 왕관 등의 유물이 어디 있느냐고 심문했다""면서 ""아버지도 나도 팔미라에서 수십 년간 금이 나오지 않았고 고고학자의 임무는 보물찾기가 아니라고 했는데도 IS는 고집스럽게 보물을 찾으려 했다""고 말했다.nari@yna.co.kr▶ [현장영상] 넘어지며 18억 짜리 그림을…""헉! 어떡하죠?""▶ [오늘의 핫 화보] 머리에 공 맞은 나주환 '하마터면 큰일날 뻔'"
48,2015-08-26,'준전시'서 '해빙'으로극적인 반전 드라마,https://news.naver.com/main/read.nhn?mode=LSD&mid=shm&sid1=100&oid=055&aid=0000330451,SBS,"<앵커>지난 4일, 북한의 목함지뢰 도발로 시작된 남북한의 군사적 대치는 물러설 수 없는 기 싸움 양상으로 전개돼 왔습니다. 하지만 고위급 접촉이 극적으로 타결되면서 위기 상황이 21일 만에 관계개선 국면으로 전환되는 반전 드라마가 만들어졌습니다.김수형 기자가 돌아봤습니다.<기자>지난 4일 서부전선 비무장지대에서 목함지뢰 3발이 터지면서 우리 부사관 2명이 중상을 입었습니다.[구홍모 소장/합동참모본부 작전부장 (지난 10일) : 우리 군은 수차례 경고한 대로 북한이 자신들의 도발에 응당 하는 혹독한 대가를 치르도록 할 것이다.]우리 군은 11년 만에 대북 확성기 방송을 재개했고, 북한은 날조라고 주장하며 포격 도발까지 감행했습니다.우리도 자주포로 맞대응했습니다.북한은 48시간을 시한으로 제시하며 22일 오후 5시까지 대북 방송을 중단하지 않으면 군사적 행동을 하겠다고 위협했습니다.[조선중앙TV/지난 21일 : 조선인민군 전선대연합부대들의 불의작전 진입이 가능한 완전무장한 전시상태로 이전하며, 전선 지대에 준전시상태를 선포….]박근혜 대통령은 3군 사령부를 방문해 단호한 대응을 지시했습니다.[또 상황이 발생했을 때는 선 조치 후보고 하기를 바랍니다. 평소에도 여러 차례 얘기했듯이 대통령은 군의 판단을 신뢰합니다.]북한의 최후통첩한 시한 2시간 전, 남북은 전격적으로 고위급 접촉 합의 사실을 발표했고, 잠을 잊은 마라톤협상 끝에 환한 얼굴로 다시 악수할 수 있었습니다.[김관진/청와대 국가안보실장 : 생활의 불편함을 감수하면서 정부를 신뢰하고 협조해주신 접경지역 주민을 비롯한 국민 여러분께 거듭 감사드립니다.]21일 전 지뢰도발로 촉발된 한반도의 군사적 긴장은 남북이 사흘 동안 마주앉아 대화하자 관계 개선의 전환점으로 바뀌었습니다.(영상편집 : 남 일)▶ 이산가족 추석 이후 상봉 유력…정례화 이뤄질까▶ [취재파일] 北 잠수함 탐지에서 美 전략무기 시위까지…""미군만 보였다""김수형 기자(sean@sbs.co.kr)☞[취재파일] 방송에선 못 다한 생생한 취재 뒷얘기☞[나도펀딩] 뉴스 보고 기부하는 새로운 크라우드 펀딩☞[비디오 머그] SBS 동영상 뉴스의 모든 것☞ SBS뉴스 공식 SNS [SBS 8News 트위터] [페이스북] [카카오스토리]저작권자 SBS&SBS콘텐츠허브 무단복제-재배포 금지"
