,날짜,기사 제목,기사 링크,기사 출처,기사 내용
99,2015-08-26,"한국군 대표단, 中 전승행사 첫 참석",https://news.naver.com/main/read.nhn?mode=LSD&mid=shm&sid1=100&oid=001&aid=0007815162,연합뉴스,"""공군중장 등 대표단 3명 규모…한중 직통전화 개통시기 협의 중""(서울=연합뉴스) 이영재 기자 = 국방부는 다음 달 3일 중국에서 열리는 '항일전쟁 및 세계 반(反)파시스트 전쟁 승리 70주년' 기념행사에 우리 군 대표단 3명을 파견할 것이라고 26일 밝혔다.중국의 전승 기념행사에 한국군 대표단이 참석하는 것은 이번이 처음인 것으로 알려졌다.국방부는 군 대표단을 파견하되 이번 기념행사의 열병식에 참가할 병력은 보내지 않는다는 방침이다.앞서 중국 정부는 25일 기자회견에서 이번 전승 기념행사에 군 참관단을 보내면서 열병식 참가 병력은 파견하지 않는 국가로 한국을 비롯한 14개국을 꼽은 바 있다.이번 행사에 참가하는 우리 군 대표단은 정경두 합동참모본부 전략기획본부장(공군 중장), 박철균 국방부 국제정책차장(육군 준장), 최석윤 합참 군사협력과장(해군 대령) 등 3명이다.국방부 관계자는 ""우리 군 대표단의 중국 전승 기념행사 참가는 중국측 요청에 따른 것""이라고 설명했다.박근혜 대통령도 다음 달 2일 중국을 방문해 전승 기념행사에 참석할 예정이다. 중국 정부는 박 대통령이 열병식에도 참석할 것이라고 밝힌 바 있다.국방부는 최근 한중 양국 정부간 관계가 어느 때보다도 우호적인 상황에 맞춰 이번 전승행사에 군 대표단을 파견하기로 한 것으로 알려졌다.북한의 경우 김정은 국방위원회 제1위원장 대신 최룡해 노동당 비서가 이번 행사에 참석한다. 북한은 이번 행사에 군 참관단도 파견하지 않는다.우리 군 대표단이 이번 전승 기념행사 열병식에 참석할지는 아직 미지수다. 국방부는 ""우리 군 대표단의 열병식 참석 여부는 검토하고 있다""고 설명했다.한편 이번 전승 기념행사 이후 한중 국방부간 핫라인이 개통될 것이라는 언론 보도와 관련해 국방부는 ""한중 국방부간 직통전화 개통 시기·방법은 현재 양국간 협의 중""이라고 밝혔다.ljglory@yna.co.kr▶ [현장영상] 소말리아 난민 목숨걸고 지중해 건너다 ""새 생명"" 출산▶ [오늘의 핫 화보] 라파엘 나달, '몸짱 몸매' 뽐내며 유쾌한 행사"
100,2015-08-26,"'세월호 불법집회' 박래군씨 첫 재판…""선동 안했다""",https://news.naver.com/main/read.nhn?mode=LSD&mid=shm&sid1=102&oid=056&aid=0010213269,KBS,"세월호 추모 집회 과정에서 불법 행위를 주도한 혐의로 구속기소된 박래군 4·16 연대 상임운영위원이  재판에서 혐의의 상당 부분을 부인했습니다.서울중앙지법 형사합의27부 심리로  오늘 열린 첫 공판준비기일에서  박 씨 측은 미신고 집회를 열고 해산명령에 불응한 점은 인정하지만, 헌법상 집회의 자유를 보장해야 한다고 주장했습니다.또, 박 씨의 지시와 선동 탓에 시위대가 경찰을 폭행했다는 검찰 주장에 대해선, 박 위원이 10일째 단식을 해 시위대를 지휘할 수 없었다고 말했습니다.앞서 검찰은  지난해 7월 세월호 100일 집회와 지난 4월 세월호 참사 1년 추모 집회 등에서 미신고 집회를 열고 경찰의 해산 명령에 불응한 혐의 등으로 박 씨를 구속기소했습니다.박 씨의 다음 공판준비기일은 다음달 10일에 열립니다.신선민기자 (freshmin@kbs.co.kr)▶[취재후] 방송에서 못한 현장 이야기▶ KBS뉴스 SNS[트위터][페이스북][카카오][저작권자ⓒ KBS 무단복제-재배포 금지]"
101,2015-08-26,21세기 난민의 필수품은 스마트폰,https://news.naver.com/main/read.nhn?mode=LSD&mid=shm&sid1=104&oid=001&aid=0007815118,연합뉴스,"세르비아 도착한 유럽행 난민(EPA=연합뉴스 DB)(서울=연합뉴스) 이 율 기자 = 유럽 국가들이 몰려드는 난민들로 인해 골머리를 앓고 있는 가운데 21세기 난민들에게는 음식과 피신처 외에 스마트폰과 충전기가 필수품이 됐다고 미국 뉴욕타임스(NYT)가 25일(현지시간) 보도했다.난민들은 탈출 루트와 체포, 국경수비대의 움직임, 교통수단, 머물기에 가장 좋은 곳과 가격 등을 실시간으로 업데이트하고, 가족및 친구들과 연락을 할 때 스마트폰에 절대적으로 의존한다.이에 따라 난민들의 피난 여정에 스마트폰의 지도와 위치추적 앱, 소셜미디어와 모바일 메신저는 필수적인 도구가 됐다.세르비아 베오그라드시내 공원 벤치에 앉아있던 시리아 음악교사 출신 난민 오사마 알자셈(32)은 ""다른 나라로 입국할 때마다 심카드를 사서 인터넷에 연결하고 지도를 내려받아 내가 어디에 있는지 위치파악을 한다""면서 스마트폰을 들여다보고 북유럽을 향한 다음 루트를 짰다.세르비아 도착한 유럽행 난민(EPA=연합뉴스 DB)그는 ""스마트폰이 없었다면 여기까지 못 왔을 것""이라며 ""배터리가 부족해지려는 기미만 보여도 스트레스를 받는다""고 말했다.피난 여정에서 스마트폰을 처음 쓰기 시작한 것은 5년째 계속되는 내전을 피해 탈출한 시리아의 중산층 난민들이었다. 하지만, 이제는 아프리카와 아프가니스탄에서 파키스탄까지 중동 난민들도 모두 스마트폰을 쓴다.난민들이 스마트폰을 사용하면서 피난을 위한 여정에 오르기가 더욱 쉬워진 것은 물론 발칸루트처럼 성공적인 루트에 대한 집중도가 심해졌다. 이에 따라 그리스에서 마케도니아, 세르비아, 헝가리에 이르는 발칸루트에 난민들이 일제히 몰리고 있다. 그리스에서 마케도니아 국경을 넘는 난민이 하루에만 3천명에 달할 정도다.브로커들은 난민들을 겨냥해 페이스북 그룹에 목적지가 될만한 유럽도시의 정경을 담은 역동적 사진을 올려놓고 광고를 하고, 가격할인을 제안하기도 한다.1천900유로(약 260만원)를 내면 자동차로 이스탄불에서 그리스 테살로니키까지 데려다주고 2시간 동안 걸어 국경을 넘을 수 있게 안내해준다는 식이다. 5세 미만의 어린이는 50% 할인을 해준다.세르비아행 난민들(EPA=연합뉴스 DB)'유럽으로 잠입하기'라는 페이스북 그룹에는 6천57명이, '유럽연합(EU)에 밀입국하기' 그룹에는 2만3천953명이, '유럽으로 이민가는 방법'이라는 그룹에는 3만9천304명이 각각 가입돼 있다.이들 그룹에 가입하려면 운영자의 초대가 필요하다. 난민들은 이들 그룹에서 공개적이거나 사적인 토론을 하며 유럽으로 가는 여정 내내 사진과 비디오를 올려 공유한다. 유럽에 이르는 루트의 정확한 GPS(위성위치확인시스템) 좌표도 공유대상이다.이같이 스마트폰을 통한 정보공유가 활성화되면서 난민 브로커들의 밀입국사업은 타격을 입고 있다. 실제로 시리아내전이 시작되던 당시와 비교해 브로커들에게 치르는 밀입국 비용은 절반으로 줄어들었다.전체루트 중 난민들이 브로커에게 의존하는 루트는 터키에서 그리스까지 밖에 없다. 나머지는 GPS장치를 이용해 스스로 찾아간다.세르비아 베오그라드의 가장 인기있는 난민피신처에서 일하는 시리아 출신 모하메드 하지알리(38)는 ""브로커들의 사업은 타격을 입고 있다""면서 ""페이스북 덕택에 사람들이 혼자 가고 있기 때문""이라고 말했다.스마트폰(AP=연합뉴스 DB)국제기구들도 난민들의 스마트폰 활용을 염두에 두고 구호활동에 나서기 시작했다. 유엔난민기구(UNHCR)는 요르단의 시리아 난민들에 3만3천개의 심카드와 스마트폰 충전기 8만5천704개를 나눠줬다.적십자는 시리아 제2의도시 알레포에서 상수도 본관이 파괴됐을 때 깨끗한 식수를 얻을 수 있는 곳을 지도에 표시해 페이스북에 게재, 13만3천187명의 조회수를 기록했다. 시리아에서는 박격포가 떨어진 곳을 실시간으로 표시하는 페이스북 페이지도 인기다.베오그라드의 한 신문가판대에서 스마트폰을 충전하고 있던 아프가니스탄 카불 출신 난민 모함메드 살모니(21)는 ""스마트폰 덕택에 아프가니스탄에서 이란으로 40시간 동안 걸어 넘어올 수 있었다""면서 ""정말 위험한 여정이었는데 스마트폰이 내 생명을 구했다""고 말했다.yulsid@yna.co.kr▶ [현장영상] 소말리아 난민 목숨걸고 지중해 건너다 ""새 생명"" 출산▶ [오늘의 핫 화보] 라파엘 나달, '몸짱 몸매' 뽐내며 유쾌한 행사"
102,2015-08-26,울진서 잠수함 오인신고로 군·경 비상 걸려,https://news.naver.com/main/read.nhn?mode=LSD&mid=shm&sid1=102&oid=003&aid=0006717963,뉴시스,"군당국, 화물선 장비 오인신고 결론【울진=뉴시스】성민규 기자 = 경북 울진 앞바다에서 잠수함으로 보이는 괴물체가 나타났다는 신고가 접수돼 군·경 등에 비상이 걸렸으나 오인신고로 밝혀졌다.26일 울진경찰서 등에 따르면 이날 오전 9시40분께 울진군 후포면 앞바다에 괴물체가 나타났다며 한 주민이 신고했다.군은 헬기 등을 투입해 수색작업을 펼쳤으나 잠수함으로 추정되는 물체를 발견하지 못했다.군 관계자는 ""신고 당시 인근 해상에는 1만t급 러시아 화물선이 항해중이었다""며 ""육안으로 관측할 수  있는 한계점을 넘는 거리에 있는 화물선 장비를 오인해 신고한 것으로 결론내렸다""고 설명했다.한편 신고 당시 해상에는 태풍경보가 발효돼 4∼5m의 높은 파도가 치고 있었다.smg511@newsis.com★ 세상에 이런일이 -  ´라오스서 동성 성매매´ 현직 공무원 자살★ 오늘의 핫 포토 -  ""여자도 가슴을 드러내자""<저작권자ⓒ 공감언론 뉴시스통신사. 무단전재-재배포 금지.>"
103,2015-08-26,"국내 스마트폰, 안드로이드 84%, 애플 IOS 16%",https://news.naver.com/main/read.nhn?mode=LSD&mid=shm&sid1=105&oid=016&aid=0000831451,헤럴드경제,"[헤럴드경제=이형석 기자]국내 PC의 운영체제(OS)와 웹브라우저 시장은 마이크로소프트가 사실상 ‘천하통일’한 것으로 나타났다. 스마트폰과 태블릿 등 모바일은 구글과 애플이 지배했다.한국인터넷진흥원이 26일 발표한 ‘2015년도 상반기 국내 인터넷 이용환경 현황 조사결과’에 따르면 국내 PC의 OS 시장에서는 MS의 윈도 점유율이 97.85%로 사실상 완전독점상태인 것으로 나타났다. 애플의 OS X(OS 텐)이 1.39%에 불과했다.PC 웹브라우저 역시 MS의 독주체제였다. 인터넷 익스플로러(IE)의 점유율이 87.64%로 구글의 크롬(8.82%)을 압도적인 차로 제쳤다.스마트폰 OS와 웹브라우저 시장은 구글의 OS를 채택한 안드로이드폰과 애플 아이폰의 시장 점유율이 갈랐다. 스마트폰 OS에선 구글의 안드로이드가 84.11%를 점유했고, 애플 IOS는 15.87%를 차지했다. 웹브라우저는 안드로이드 가 75.11%, 애플 사파리가 15.02%로 나타났다.‘아이패드’ 시리즈를 갖고 있는 애플은 태블릿 시장의 운영체제와 웹브라우저 시장을 지배했다. 애플의 운영체제 IOS와 웹브라우저 사파리의 점유율은 각각 77.68%와 73.41%로 나타났다. 태블릿 부문에서 안드로이드 OS와 웹브라우저 점유율은 각각 16.21%와 12.59%였다.2014년에 비해 구글은 스마트폰에서 OS 점유율이 1.71%p 감소한 반면, 태블릿 분야에서 0.95%p 증가했으며, 애플은 스마트폰에서 OS 점유율이 1.73% 증가했으나 태블릿에서 5.41% 감소했다.이번 조사는 한국인터넷진흥원이 국내 기업 및 정부의 인터넷 관련 사업·정책 전략 수립시 근간자료로 활용할 수 있는 정확한 웹브라우저 및 OS 등 통계를 산출하기 위해 진행됐다. 국내 100대 웹 사이트 중 이용자가 많은 쇼핑몰, 이동통신사, 금융사, 교육기관 등 11개사의 웹서비스에 접속한 이용자의 OS와 웹브라우저 정보를 지난 6월 한달간 페이지뷰 데이터를통해 수집ㆍ분석하는 방식으로 이뤄졌다.suk@heraldcorp.com이시영ㆍ배용준, 못참고 폭발…결정적 이유가?자전거용 물받이 머스가드, 아이디어 돋보여[헤럴드경제][SUPERICH][REAL FOODS][헤럴드증권방송][HOOC]- Copyrights ⓒ 헤럴드경제 & heraldbiz.com, 무단 전재 및 재배포 금지 -"
104,2015-08-26,"검찰 ""인질살해범 김상훈 무기징역 가볍다"" 항소",https://news.naver.com/main/read.nhn?mode=LSD&mid=shm&sid1=102&oid=421&aid=0001594898,뉴스1,"검찰이 아내의 전남편과 의붓딸을 살해하고 인질극을 벌여 1심 재판에서 무기징역을 선고받은 김상훈(46)씨에 대해 양형부당을 이유로 항소장을 제출했다.  © News1(안산=뉴스1) 최대호 기자,조정훈 기자 = 검찰이 아내의 전남편과 의붓딸을 살해하고 인질극을 벌여 1심 재판에서 무기징역을 선고받은 김상훈(46)씨에 대해 양형부당을 이유로 항소장을 제출했다.김씨를 구속기소했던 수원지검 안산지청은 25일 ""김씨의 죄책에 비해 가벼운 형이 선고됐다""는 취지의 항소장을 수원지법 안산지원에 제출했다.앞서 수원지법 안산지원 형사1부(부장판사 이영욱)는 지난 21일 이 사건 선고공판에서 인질살해죄 등 10가지 죄명으로 검찰이 제기한 김씨에 대한 공소사실을 모두 유죄로 인정했지만 무기징역을 선고했다.재판부는 판결 당시 ""강간 등 살인죄와 인질살해죄는 법정형이 사형 또는 무기징역으로만 돼 있어 김씨의 범행의 죄질 및 범정 등에 비춰볼 때 법정형을 감경할 만한 특별한 사정이 없어 사형 또는 무기징역을 피할 수 없다""면서도 사형을 선고하지는 않았다.재판부는 ""사형이 인간의 생명 자체를 영원히 박탈하는 궁극의 형벌이라는 점에서 이성적인 사법제도 상에서 극히 예외적인 형벌이라는 점을 감안했다""고 이유를 설명했다.그러나 검찰은 김씨의 죄질 및 범정을 볼 때 사형이 선고돼야 할 만한 객관적인 사정이 있다는 입장이다.1심 결심공판에서 이뤄진 검찰의 구형에서도 검찰의 단호한 입장을 확인할 수 있다.검찰은 구형 당시 ""김씨는 사전에 치밀하게 범행을 준비해 미성년자를 성폭행하고 아무런 관계가 없는 사람을 매우 잔인하게 살해했다""며 ""다시 사회에 나가면 피해자를 찾아가 복수하는 등 재범의 우려가 있다""고 밝혔다.또 ""김씨의 정신감정을 의뢰한 결과 심신장애가 아니라는 통보를 받았고 살아남은 피해자와 가족들은 상상할 수 없는 고통 속에 살고 있다""며 재판부에 사형 선고를 요청했었다.김씨는 26일 현재 항소장을 제출하지 않은 상태다.김씨는 올 1월12일 경기 안산시 본오동 아내 A(41)씨의 전 남편 B(49)씨 집에 침입해 B씨를 흉기로 찔러 살해하고 다음날 오전 A씨와 B씨 사이의 작은 딸(16)을 인질로 삼아 성폭행한 뒤 살해한 혐의로 구속기소 됐다.김씨는 지난 2008년부터 올 1월까지 4차례에 걸쳐 A씨를 흉기로 위협하고 때려 전치 3~4주의 상처를 입히고, 2012년 5월 A씨의 작은 딸(당시 13세)을 유사강간한 혐의도 받았다.sun0701@▶ 뉴스1 100% 무료 만화 서비스 오픈!![© 뉴스1코리아(news1.kr), 무단 전재 및 재배포 금지]"
105,2015-08-26,"정부, 南北 회담-교류 동시진행..",https://news.naver.com/main/read.nhn?mode=LSD&mid=shm&sid1=100&oid=421&aid=0001594722,뉴스1,"김관진 국가안보실장과 홍용표 통일부 장관이 25일 새벽 판문점 평화의 집에서 33시간만에 남북 고위급 2차 회담을 마친 후 황병서 북한 군 총정치국장, 김양건 조선노동당 비서와 악수하고 있다.  (통일부 제공) 2015.8.25/뉴스1 © News1서울-평양 간 '정치적 대화'와 민간 교류협력 확대 동시 추진교류협력 확대서 발생할 5·24조치 해제 문제 등 민감한 사안 대응력 높아질 듯(서울=뉴스1) 서재준 기자 = 남북이 고위 당국자 접촉을 통해 당국간 회담 개최와 교류협력 사업을 추진키로 합의함에 따라 이 두 가지가 '쌍끌이'로 동시에 본격 추진될지가 26일 주목된다.특히 정부 내에서는 이번 접촉을 계기로 향후 민간교류 확대를 통해 자연스럽게 제기될 5·24조치의 해제 문제나 금강산 관광 재개 문제를 '정치적 대화'로 풀어나가는 방안을 구상중인 것으로 알려졌다.따라서 남북간 두 채널이 동시에 가동되면서 상호 보완적 성격을 띠게 될 것으로 전망되기도 한다.◇당국회담은 '장관급 회담' 우선 추진 유력남북은 이번 접촉 '공동보도문'에서 1항으로 당국간 회담 추진을 명기했다.남북은 당국간 회담이 '서울 또는 평양'에서 이른 시일내 열릴 것이라고 밝히며 이 회담의 성격이 정치적인 성격이 될 것임을 시사했다.현재로서 가장 유력한 회담의 형태는 '남북 장관급 회담'이다. 이는 우리측의 통일부 장관이 회담대표로 나가는 김대중 정부 이후 익숙한 회담 형식이다.북측에선 과거 장관급 회담에 당 부부장급, 우리의 차관급으로 평가되는 '내각책임참사'를 내보냈다. 이에 우리 내부에서는 격(格) 논란이 있어왔다.정부는 2013년 현 정부들어 남북 장관급 회담이 처음 추진될 당시 양측의 대표를 우리측의 통일부 장관과 북측 노동당 통일전선부장으로 맞추기 위한 시도를 했으나 북측의 반발로 무위로 돌아갔다.그러나 이번 고위 당국자 접촉을 통해 남북간 '통통라인'은 통일부와 통일전선부 양측의 최고위급 인사들을 통해 가동될 수 있게 됐다.이번 접촉이 '2+2' 형태로 이뤄진 만큼 북측에서 홍용표·김양건간 1대1 회담에 순순히 응할지는 미지수나 현 국면서만 볼때 '통통라인' 가동 가능성은 높아 보인다.남북은 또 이번 국면이 비무장지대(DMZ) 일대에서의 군사적 긴장으로 인해 전개된 것인만큼 '장성급 회담' 등의 군사 당국간 회담도 추진해 군사 긴장 해제를 위한 조치도 협의하게 될 것으로 예상된다.이같은 대화 채널이 원활하게 가동돼 양측이 밀접한 협의가 가능해질 경우 향후 총리급 회담 등을 통해 총괄적인 의제를 다루는 회담도 열릴 가능성이 있다.일각에서는 현 정부 들어 새롭게 선보인 청와대와 평양간의 '핫라인'이 향후 남북간 총괄의제를 다루는 성격의 채널로 활용될 것이라고 전망하기도 한다.◇민간교류 확대 '산림협력'으로 시작남북이 역시 이번 접촉에서 합의한 '민간교류 확대'는 산림협력을 통해 전개될 가능성이 높아 보인다.현재 금강산 관광지구 지역에 소나무 병충해 피해로 인한 우리측의 약품지원이 사실상 결정돼 지원 시기가 결정되기만을 기다리고 있다.앞서 우리측 산림전문가의 파견을 통해 진행된 조사 결과 병충해 피해는 오는 9월 중순 경부터 방제가 시작돼야 최적의 효과를 낼 수 있다.우리측은 현재 이 문제에 대해 지난 1999년 처음 개시된 '산림 병해충 퇴치 협력사업' 형태의 공동사업을 북한에 제의하는 방안도 검토중이다.또 북한의 백두산 일대에도 나무들이 고사하는 피해가 발생한 것으로 알려져 백두산에 대한 산림협력 지원도 이뤄질지 여부가 관심사다.북한 김정은 노동당 제1비서가 지난해 말부터 산림녹화 사업을 강조하고 있어 협력사업 성사에 대한 전망이 나쁘지만은 않다.정부는 이로써 향후 민간을 통한 대북 비료지원 등 과거 진행돼온 교류협력 사업도 부활시킬 수 있을 것으로 전망하고 있다.또 스포츠 교류 등 사회문화 교류의 폭도 넓힘은 물론 개성공단 이외 지역에 대한 경제협력 복구 방안도 장기적인 관점에서 논의한다는 계획이다.◇5·24조치 해제 문제 직면 불가피…'정치적 대화'로 풀까문제는 이같은 교류협력 확대 구상은 결국 지난 2010년 천안함 사태로 인해 취해진 대북 5·24 제재조치 해제 문제와 맞닿을 수밖에 없게 된다는 점이다.정부는 5·24조치를 대북 금수조치의 성격으로 규정하며 개성공단 사업을 제외한 대북 민간 교류·경제협력 사업을 전면 중단시켰다.정부는 이번 접촉에서 북측과 5·24조치 해제 문제에 대해 어떤 논의도 일절 하지 않았다.5·24조치 해제 문제는 천안함 피격에 대한 북한의 명확한 사과가 전제돼야 한다는 정부 기조가 그대로 유지되고 있는 상황에서 북측이 제기한 5·24조치 해제 문제의 의제화 자체를 정부가 거부한 것이다.주목할 점은 역시 이번 접촉에서 우리측의 최대 성과로 평가되는 북한의 지뢰 도발에 대한 '유감' 표명이다.일각에서는 정부가 향후 제기될 5·24조치 해제 문제를 서울-평양의 당국간 회담을 통해 자연스럽게 논의하는 시나리오를 구상중이라는 분석을 제기한다.5·24조치 해제를 위한 별도의 회담을 열 경우 안게 될 여론의 부담 등을 고려해, 교류와 대화를 병행하는 과정에서 5·24조치 문제가 자연스럽게 양측의 대화 의제가 될 수 있는 환경을 조성할 수 있을 것이라는 복안이다.특히 5·24조치의 해제 문제가 북측의 주요 관심사인 만큼 교류 확대 과정에서 이번 지뢰 도발에 대한 유감 표명과 같이 천안함 피격에 대해서도 일정한 사과를 받아낼 수 있을 것이라는 기대감도 깔려있는 것으로 보인다.관건은 대화 추동력이 살아있는 올해 안으로 당국간 대화와 교류협력 사업 모두 얼마큼의 성과를 낼 수 있느냐다.seojiba@▶ 뉴스1 100% 무료 만화 서비스 오픈!![© 뉴스1코리아(news1.kr), 무단 전재 및 재배포 금지]"
106,2015-08-26,대구서 30대 성범죄자 전자발찌 끊고 도주…경찰 수사,https://news.naver.com/main/read.nhn?mode=LSD&mid=shm&sid1=102&oid=005&aid=0000812214,국민일보,"대구에서 30대 남자가 차고 있던 전자발찌를 훼손하고 달아나 경찰이 수사에 나섰다.26일 오전 3시 44분 대구시 중구 태평로에서 성범죄 전력이 있는 A(35)씨가 차고 있던 전자발찌를 훼손하고 도주했다며 보호관찰소 위치추적 관제센터가 경찰에 신고했다.A씨는 훼손한 전자발찌를 대구 동구지역에 버리고는 잠적했다.경찰은 “A씨는 대전에 살고 대구에는 별다른 연고가 없는 것으로 보인다”며 “휴대전화 통신수사, 동선과 주변 인물 조사 등으로 A씨를 찾고 있다”고 말했다.한편 도주 중인 A씨는 강도 및 강간 등 전과 3범인 것으로 알려졌다.천금주 기자 juju79@kmib.co.krGoodNews paper ⓒ 국민일보(www.kmib.co.kr), 무단전재 및 재배포금지[뉴스 미란다 원칙] 취재원과 독자에게는 국민일보에 자유로이 접근할 권리와 반론·정정·추후 보도를 청구할 권리가 있습니다. 고충처리인(gochung@kmib.co.kr)/전화:02-781-9711"
