,날짜,기사 제목,기사 링크,기사 출처,기사 내용
0,2015-08-26,발 헛디뎌 '푹'…18억 원 명화에 구멍 낸 소년,https://news.naver.com/main/read.nhn?mode=LSD&mid=shm&sid1=104&oid=055&aid=0000330602,SBS,"<앵커>전시회에 갔다가 수십억 원짜리 예술 작품을 망가뜨렸다면 어떨까요? 생각만 해도 아찔하죠, 타이완에서 한 소년이 발을 헛디뎠습니다. 그런데 하필이면 18억 원짜리 명화에 구멍을 내고 말았습니다.보도에 유덕기 기자입니다.<기자>타이완의 한 미술관입니다.한 손에 음료수를 든 소년이 갑자기 무게중심을 잃고 휘청이다 두 손으로 벽을 짚습니다.그 순간, 소년을 포함한 주변 사람들 모두 얼어붙은 듯 움직이지 못 합니다.전시된 그림을 짚어 직경 8~9센티미터 크기의 구멍을 낸 겁니다.훼손된 그림은 후기 바로크 시대의 화가 포르포라가 350년 전에 그린 정물화 '꽃'이었습니다.150만 달러, 우리 돈으로 약 18억 원을 호가하는 그림입니다.[전시회 관객 : 전시 작품들이 그대로 노출돼 있는 건 위험한 만큼 유리 뒤에 있어야 한다고 생각해요.]전시회 주최 측은 미술복원전문가에 의뢰해 찢어진 그림을 잇고 색을 칠해 하루 만에 했습니다.그림은 보험에 가입돼 있어 보험사가 작품의 소장자와 주최 측에 피해와 복구비용을 보상하게 됐습니다.[전시 주최 측 대표 : 이런 전시를 진행할 때 전시 주최자들은 관객들이 좀 더 가까이에서 진품을 감상하길 바랍니다.]해당 전시회는 레오나르도 다 빈치의 초상화를 포함한 희귀 서양화 55점을 선보이던 중이었습니다.(영상편집 : 유미라)유덕기 기자(dkyu@sbs.co.kr)☞[취재파일] 방송에선 못 다한 생생한 취재 뒷얘기☞[나도펀딩] 뉴스 보고 기부하는 새로운 크라우드 펀딩☞[비디오 머그] SBS 동영상 뉴스의 모든 것☞ SBS뉴스 공식 SNS [SBS 8News 트위터] [페이스북] [카카오스토리]저작권자 SBS&SBS콘텐츠허브 무단복제-재배포 금지"
1,2015-08-26,보행 중 스마트폰 '위태위태'지각 능력 저하된다,https://news.naver.com/main/read.nhn?mode=LSD&mid=shm&sid1=102&oid=214&aid=0000531352,MBC,"[뉴스데스크]◀ 앵커 ▶이렇게 걸어가면서도 휴대전화에서 눈을 떼지 못하는 모습.사실 남 얘기 아니라는 분 많으실 겁니다.이번에는 이런 습관이 사고위험을 얼마나 높일 수 있는지 실험으로 알아봤습니다.이어서 오현석 기자입니다.◀ 리포트 ▶늦은 밤, 교차로에서 좌회전을 하는 차량.보행자는 차가 달려오는데도 손에 쥔 스마트폰만 보고 있습니다.결국 사고로 이어집니다.도심의 횡단보도마다 고개를 숙인 채 스마트폰만 바라보고 걷는 사람들, 비틀비틀, 아슬아슬, 신호가 바뀌려는 걸 뒤늦게 알아채고 그제서야 달립니다.[전선구/택시기사]""요즘은 아이들이 스마트폰이나 그런 것에 정신이 팔려 있지 않습니까. 차량이 급정거를 잘해야죠.""스마트폰을 보며 길을 걸으면 당연히, 다가오는 물체에 대한 지각 능력이 떨어집니다.자동차가 주행할 때와 비슷한 소음 수준, 75데시벨 크기의 벨이 울리는 곳으로 한 걸음씩 걸어가게 했습니다.그냥 걷는 사람은 14.4미터 앞까지 접근하면 ""뭔가 조심할 것이 있다""는 걸 알아챘습니다.그러나 스마트폰으로 문자를 주고받거나 게임을 하던 사람은 7.2미터 앞까지 접근해서야 겨우 멈춰 설 수 있었습니다.차가 가까이 달려와도 이미 위험해진 다음에야 아는 겁니다.[이수일 박사/현대해상 교통기후환경연구소]""적어도 횡단보도나 이면도로를 지나실 때는 스마트폰 사용을 자제하시는 게 안전합니다.""해외에서는 지하철 승강장에 추락하고, 분수에 빠지는 사고들이 잇따르자 아예 법으로 스마트폰을 보며 걷는 행위를 금지한 곳도 있습니다.스마트폰으로 인한 교통사고는 빠르게 증가해 5년 전에 비해 2.5배 늘었습니다.MBC뉴스 오현석입니다.(오현석 ohs@mbc.co.kr)[저작권자(c) MBC (www.imnews.com) 무단복제-재배포 금지]"
2,2015-08-26,급식소로 길고양이 줄인다?오히려 느는 이유,https://news.naver.com/main/read.nhn?mode=LSD&mid=shm&sid1=102&oid=055&aid=0000330590,SBS,"<앵커>주인 잃은 길고양이들은 음식물쓰레기를 뒤지고 듣기 싫은 울음소리를 낸다고 해서 민원의 대상이 됩니다. 대안으로 서울 강동구가 길고양이들에게 먹이를 주고 급식소로 찾아온 고양이들을 중성화해서 번식을 막는 사업을 진행하고 있습니다. 과연 효과를 보고 있을까요?한세현 기자의 생생 리포트입니다.<기자>고양이 한 마리가 사료통으로 다가가 여유롭게 먹이를 먹습니다.지켜보던 다른 고양이들도 하나둘 모여듭니다.서울 강동구가 설치한 '길고양이 급식소' 풍경입니다.재작년 시작된 이 사업은 배고픈 고양이들한테 먹이를 줘서 음식물쓰레기를 뒤지는 걸 막고, 급식소로 온 고양이를 잡아 중성화수술을 해서 길고양이 개체 수를 줄이는 것을 목표로 합니다.23개였던 급식소는 60곳으로 늘어날 만큼 자리를 잡았습니다.하지만, 개체 수를 줄이는 중성화수술이 지지부진한 문제가 있습니다.여러 지자체들은 동물 보호 여론을 감안해 2006년 이후엔 안락사 대신 길고양이의 생식기를 없애 돌려보내는 'TNR 정책'을 시행하고 있습니다.서울의 자치구들이 올해 상반기 시행한 중성화수술은 평균 115건입니다.그런데 강동구는 고작 26건, 가장 저조합니다.수술 건수가 적은 것은 먹이를 주는 일부 자원봉사자들이 중성화수술에 부정적이어서, 고양이를 잡을 포획자들이 잘 나서지 않기 때문입니다.[강동구 관계자 : 먹이 주는 자원봉사자들의 요구사항이 너무 많아요. 이 고양이는 왜 잡느냐, 저 고양이 왜 안 잡느냐 피곤하게 하니까, 포획자들도 강동구에선 일 안 하려고 해요. 포획자가 일 안 한다고 동물병원 원장이 나가서 잡아올 수도 없는 거고요.]중성화수술로 이어지지 않는 급식 사업은 길고양이 문제를 오히려 악화시킵니다.[강영칠/길고양이 중성화수술 담당 수의사 : 길고양이 개체수를 줄이려면 길고양이를 포획하고 중성화수술 해야 하는데, 중성화수술을 하지 않고  안 하고 사료만 공급하면 영양학적으로 풍부해져서 개체수는 늘어날 수 밖에 없습니다.]실제로 강동구에선 길고양이 개체 수가 늘어나고 있습니다.[강동구 주민 : 고양이가 여기에 많아요. 고양이가 (놀이터에 분변을 땅에) 묻어놓는데, 아이들은 (놀이터)모래를 손으로 만지고 입에도 넣고 그렇게 하잖아요. 내가 화가 나서 급식소 치우겠다고 (구청에) 얘기했더니, 저거 잘못 치우면 다친다고 하더라고요.]강동구 길고양이 급식소 사업은 올해 기초자치단체 최우수 정책으로 선정됐으며, 전국 7개 지방자치단체가 벤치마킹해 운영하고 있습니다.(영상취재 : 주용진, 영상편집 : 윤선영, VJ : 이종현)▶ 잇따른 길고양이의 죽음…""독극물 먹이에 희생 추정""▶ 종로를 주름잡던 길고양이 '나비'를 찾습니다한세현 기자(vetman@sbs.co.kr)☞[취재파일] 방송에선 못 다한 생생한 취재 뒷얘기☞[나도펀딩] 뉴스 보고 기부하는 새로운 크라우드 펀딩☞[비디오 머그] SBS 동영상 뉴스의 모든 것☞ SBS뉴스 공식 SNS [SBS 8News 트위터] [페이스북] [카카오스토리]저작권자 SBS&SBS콘텐츠허브 무단복제-재배포 금지"
3,2015-08-26,"""부모 반대 때문에"" 임신10대, 차 훔쳐..",https://news.naver.com/main/read.nhn?mode=LSD&mid=shm&sid1=102&oid=437&aid=0000089519,JTBC,"[앵커]남의 차를 훔쳐 타고 달아난 10대가 경찰과 아찔한 추격전을 벌인 끝에 붙잡혔습니다. 부모가 자신의 임신을 반대하자 남자친구와 함께 차를 훔쳐 가출하려다 벌어진 일이었습니다.최규진 기자의 보도입니다.[기자]경기도 여주시 하동의 한 도로입니다.흰색 차량이 차선을 넘나들며 아슬아슬한 곡예운전을 펼칩니다.경찰차가 사이렌을 울리며 정지신호를 보내지만 멈추지 않습니다.신호를 무시하고 사거리를 건너다 좌회전하던 차량과 부딪히기도 합니다.차가 막혀 더이상 도주할 수 없게 되자, 도로 한복판에서 차를 버리고 달아나기 시작합니다.하지만 얼마 가지 못하고 모두 붙잡히고 맙니다.차를 훔쳐 도주한 이들은 17살 김모 양 등 10대 청소년 4명입니다.경찰 조사 결과, 김 양은 아이를 임신한 상태에서 부모가 만남을 반대하자 남자친구와 함께 범행을 저지른 것으로 드러났습니다.경찰은 김양과 남자친구 17살 문모 군 등을 특수절도 혐의로 구속했습니다.최규진▶ JTBC 뉴스 공식 SNS[트위터][페이스북][카카오스토리][유튜브]▶ JTBC 뉴스는 여러분의 생생한 제보를 기다립니다.Copyright by JTBC, DramaHouse & JcontentHub Co., Ltd. All Rights Reserved. 무단 전재 및 재배포 금지"
4,2015-08-26,애먼 사람까지 잡네…엉터리 '흡연부스',https://news.naver.com/main/read.nhn?mode=LSD&mid=shm&sid1=102&oid=437&aid=0000089521,JTBC,"[앵커]요즘처럼 흡연자들이 박대를 당하는 시절에 흡연부스는 이를 테면 흡연자들의 해방구입니다. 그러나 실상은 그렇지가 못해서 흡연자들도 괴롭고, 근처를 지나는 행인들도 괴로운 흡연부스가 많다고 합니다.밀착카메라 고석승 기자입니다.[기자]사람들이 자연스레 흡연부스 안으로 들어갑니다.금연 구역으로 지정된 거리이지만 부스 안에서만큼은 마음 놓고 흡연이 가능합니다.[안재현/서울 종로5·6가동 : 일단 저희가 담배를 피울 수 있는 공간이 있으니까 좋은데 없을 때는 길거리에서 피우게 되니까 눈치가 보이죠.]이곳은 지하철 건대입구역 옆에 마련된 흡연부스입니다.그나마 서울 시내의 흡연 부스 중에서 관리가 잘 되어 있는 곳으로 알려져 있는데요.안을 한번 살펴보면 이렇게 꽁초를 버릴 수 있도록 쓰레기통도 마련되어 있고요.위를 보시면 환기시설과 또 이쪽에는 에어컨까지 설치되어 있습니다.문제는 이 정도로 관리가 잘 되고 있는 흡연부스가 굉장히 드물다는 겁니다.인근 동서울터미널 흡연부스. 무용지물이 된 지 오래입니다.갑작스럽게 내리는 비에도 많은 사람들이 부스에 들어가지 않고 바깥에 서서 담배를 피웁니다.흡연부스 내부 환기가 제대로 안 되는 데다 유동인구에 비해 부스가 너무 좁기 때문입니다.[야외 흡연자 : 여름에는(흡연부스에) 들어가면 찜통 같고 (공기가) 탁해서 담배 피우기가 꺼려져요.]결국 부스 주변은 연일 쓰레기와 담배 연기로 몸살을 앓습니다.내부가 담배연기로 답답하다 보니 많은 사람들이 부스 바깥에서 흡연을 하게 되는데요.담배를 피운 사람들이 버리고 간 담배꽁초가 곳곳에 떨어져 있습니다.[서울 광진구청 관계자 : 사람이 너무 많다 보니 확장공사가 필요한 게 사실입니다. (시민) 의식이 약간 부족한 것도 사실이고요. 그래서 저희가 확장공사를 하려고 해요.]수원 종합버스터미널 앞에 마련된 흡연부스도 사정은 비슷합니다.지금 바로 이게 흡연부스의 환기시설인데요. 이렇게 먼지가 수북이 쌓여 있고요. 또 이쪽은 아예 환기구 자체가 고장이 나 있습니다.결국 이렇게 문을 활짝 열어놔야지만이 그나마 연기가 빠져나가는 상황입니다.연기가 고스란히 인도로 빠지다 보니 보행자들의 간접 흡연 피해는 여전합니다.[조숙희/경기 여주시 : 보기도 안 좋고 코나 목 등이 안 좋은 분들은 (지나가면서) 굉장히 불편을 많이 느끼거든요.]이곳은 서울역 흡연부스입니다.그런데 지금 보시는 것처럼 운영이 중단된 상태입니다.그래서 이렇게 옆에 야외에 흡연구역을 만들어 놨는데요.문제는 이곳이 뒤에 보시는 출입구와 너무 가까워서 지나다니는 사람들이 담배연기에 고통을 호소하고 있다는 겁니다.흡연권을 보호하면서 보행자들의 간접 흡연 피해를 막기 위해 도입된 흡연부스가 오히려 길거리 흡연을 부추기는 셈인 겁니다.정작 서울역 안내센터 직원들은 흡연부스가 없어진 것도 모르고 있었습니다.[반대편에 가시면 은행 환전소에 S라운지 (흡연부스) 있어요. (그 흡연부스도 폐쇄됐던데요?) 그러시면 저도 잘…저도 폐쇄된 지 오늘 알아서요. 죄송해요.][최비오 정책부장/한국담배소비자협회 : 일정한 규정도 없는 상태에서 흡연실을 설치하다 보니 관리나 유지가 안되고 있는 상황입니다. 흡연권을 최소한 보장해주고 비흡연자분들도 건강권을 보호할 수 있는 (제대로 된) 흡연실이 반드시 설치돼야 합니다.]금연구역이 점점 확대되면서 거리에 흡연부스도 그만큼 늘어나고 있는데요.제각각인 설치 기준과 엉터리 관리로 상당수 흡연부스가 흡연자들의 외면을 받으면서 애물단지로 전락하고 있습니다.고석승▶ JTBC 뉴스 공식 SNS[트위터][페이스북][카카오스토리][유튜브]▶ JTBC 뉴스는 여러분의 생생한 제보를 기다립니다.Copyright by JTBC, DramaHouse & JcontentHub Co., Ltd. All Rights Reserved. 무단 전재 및 재배포 금지"
5,2015-08-26,금값보다 비싼 1998년 500원 동전…8천개 생산,https://news.naver.com/main/read.nhn?mode=LSD&mid=shm&sid1=101&oid=088&aid=0000407881,매일신문,"'1998년산 500원짜리 동전을 찾아라!'최근 편의점과 동네 슈퍼 등에서 500원짜리 동전을 찾는 사람들이 늘고 있다. 일부 부모들은 아이들의 돼지저금통을 깨면서까지 500원짜리 동전 찾기에 나서고 있다. 1998년산 500원짜리 동전을 찾기 위해서다. 현재 이 동전은 '금보다 비싸게' 팔리고 있다.최근 한 경매 사이트에서는 이 동전이 무려 135만원에 팔렸다. 액면가의 2천700배. 최고 등급의 미사용분일 경우 1천만원까지 호가되고 있다.나이가 같은 100원짜리 동전도 덩달아 수만원대에 팔리고 있다. 카드 사용이 보편화하면서 많은 동전이 천덕꾸러기로 전락했지만 1998년산 동전들은 귀한 대접을 받는 셈이다.한국조폐공사 관계자는 ""IMF 구제금융 당시 한국은행에서 500원짜리 동전을 8천 개밖에 만들지 않았다. 지금까지 발행된 동전이 21억8천700만 개에 달하는 것을 감안하면 희소성이 대단히 높다. 조폐공사 내에도 1998년산 500원짜리는 한 개뿐""이라고 설명했다.최창희 기자 cchee@msnet.co.krⓒ매일신문 - www.imaeil.com"
6,2015-08-26,진지충…출근충…벌레먹은 사회,https://news.naver.com/main/read.nhn?mode=LSD&mid=shm&sid1=102&oid=022&aid=0002898881,세계일보,"기자가만난세상인터넷 서핑을 하다가 필자의 기사를 인용한 게시물을 발견했다. 기사의 내용과 아무런 관련이 없는 조롱과 비하의 댓글이 가득했다. 기사 작성자로서 ‘이건 너무 심하다’는 생각이 들어서 익명으로 “기사에 적힌 내용은 그런 뜻이 아니지 않느냐”는 댓글을 달았다. 그랬더니 그 밑에 ‘진지충 극혐’이라는 댓글이 달렸다. ‘진지충(蟲)’이란 ‘유머 코드 등의 분위기를 파악하지 못하고 혼자 진지하게 반응하는 사람’을 벌레에 빗대 비하하는 조어다. ‘극혐’은 말 그대로 ‘극도로 혐오한다’는 말을 줄인 것이다. 그리고 이렇게 별것 아닌 것을 두고 길게 설명을 늘어놓는 사람은 ‘설명충’이라고 부른다.그러고 보면 요즘 마음에 들지 않는 집단을 벌레로 부르는 표현이 부쩍 늘었다. 말끝마다 ‘충’을 붙이게 된 기원을 놓고는 일본의 인터넷 커뮤니티에서 유래했다는 설, ‘무뇌충’이 시작이라는 설 등이 있지만 정확한 기원은 확실치 않다. 어느 쪽이든 우리 사회에선 ‘충’이 벌레를 의미하는 것으로 이해된다.이 ‘벌레’는 점점 그 쓰임새가 넓어지더니 이제는 거의 전 국민을 한두 개 이상의 ‘충’으로 부를 수 있게 됐다. 학교에 다니며 급식을 먹는 ‘급식충’, 대학 입시와 관련된 ‘수시충’(수시전형으로 입학한 학생), ‘지균충’(지역균형 선발로 입학한 학생)이란 조어가 난무하더니 이제는 취업을 위해 토익 공부에 매달리는 ‘토익충’, 취업에 성공해서 직장을 다니는 ‘출근충’이 생겨났다.이뿐인가. 심지어는 탕수육을 먹을 때 소스를 부어 먹는지 소스에 찍어먹는지에 따라 ‘부먹충’, ‘찍먹충’으로 나누기도 한다. ‘떼빙’(떼+드라이빙)을 하는 ‘자전거충’, 아이의 민폐를 묵인하거나 옹호하는 ‘맘충’도 요즘 인터넷에 매일같이 보이는 단어다. 물론 ‘충’을 붙인 조어 중에는 농담처럼 가벼운 것도 있고 개념 없는 행동을 비판하기 위한 것도 있다. 하지만 대개는 비하의 뜻을 담고 있다. 처음 만들어져서 유통될 때는 혐오감을 야기해도 다수의 사람이 아무런 문제의식 없이 계속 사용하다 보면 일상 속에 시나브로 녹아들지 모를 일이다.국립국어원 표준국어사전에는 ‘벌레’를 ‘곤충을 비롯하여 기생충과 같은 하등 동물을 통틀어 이르는 말’, ‘어떤 일에 열중하는 사람을 비유적으로 이르는 말’이라고 정의하고 있다. 두 번째 뜻으로는 ‘공부벌레’, ‘일벌레’ 등이 주로 쓰인다. ‘공부벌레’나 ‘일벌레’도 긍정적 표현이라고는 할 수 없지만 그때 쓰인 ‘벌레’에서는 뭔가 생존을 위해 나뭇잎을 열심히 갉아먹고 있는 분투 정도는 느껴진다. 장차 나비로 화려하게 변신할 수 있다는 미래지향적인 벌레의 이미지다. 하지만 ‘토익충’이나 ‘출근충’에서는 뭔가 음습하고 퇴영적인 냄새가 난다.우리 사회에서 한때 ‘깜둥이’, ‘튀기’라는 비하적 표현이 사용되던 시절이 있었다. 지난해에는 국가인권위원회가 “언론매체들은 ‘장애자’, ‘벙어리’ 등 장애인 비하 표현을 삼가야 한다”는 의견을 표명한 바 있다. 기존에 존재하던 차별적, 비하적 표현도 줄여나가야 할 시점에 ‘충’을 접미사로 한 새로운 비하 표현들이 우후죽순격으로 생겨나는 현실은 우려스럽다.이우중 사회부 기자▶HOT포토▶향기있는 여자들의 스토리, 미즈리포트ⓒ 세상을 보는 눈, 글로벌 미디어세계일보 & Segye.com"
7,2015-08-26,급식소로 길고양이 줄인다?…오히려 느는 이유,https://news.naver.com/main/read.nhn?mode=LSD&mid=shm&sid1=102&oid=055&aid=0000330590,SBS,"<앵커>주인 잃은 길고양이들은 음식물쓰레기를 뒤지고 듣기 싫은 울음소리를 낸다고 해서 민원의 대상이 됩니다. 대안으로 서울 강동구가 길고양이들에게 먹이를 주고 급식소로 찾아온 고양이들을 중성화해서 번식을 막는 사업을 진행하고 있습니다. 과연 효과를 보고 있을까요?한세현 기자의 생생 리포트입니다.<기자>고양이 한 마리가 사료통으로 다가가 여유롭게 먹이를 먹습니다.지켜보던 다른 고양이들도 하나둘 모여듭니다.서울 강동구가 설치한 '길고양이 급식소' 풍경입니다.재작년 시작된 이 사업은 배고픈 고양이들한테 먹이를 줘서 음식물쓰레기를 뒤지는 걸 막고, 급식소로 온 고양이를 잡아 중성화수술을 해서 길고양이 개체 수를 줄이는 것을 목표로 합니다.23개였던 급식소는 60곳으로 늘어날 만큼 자리를 잡았습니다.하지만, 개체 수를 줄이는 중성화수술이 지지부진한 문제가 있습니다.여러 지자체들은 동물 보호 여론을 감안해 2006년 이후엔 안락사 대신 길고양이의 생식기를 없애 돌려보내는 'TNR 정책'을 시행하고 있습니다.서울의 자치구들이 올해 상반기 시행한 중성화수술은 평균 115건입니다.그런데 강동구는 고작 26건, 가장 저조합니다.수술 건수가 적은 것은 먹이를 주는 일부 자원봉사자들이 중성화수술에 부정적이어서, 고양이를 잡을 포획자들이 잘 나서지 않기 때문입니다.[강동구 관계자 : 먹이 주는 자원봉사자들의 요구사항이 너무 많아요. 이 고양이는 왜 잡느냐, 저 고양이 왜 안 잡느냐 피곤하게 하니까, 포획자들도 강동구에선 일 안 하려고 해요. 포획자가 일 안 한다고 동물병원 원장이 나가서 잡아올 수도 없는 거고요.]중성화수술로 이어지지 않는 급식 사업은 길고양이 문제를 오히려 악화시킵니다.[강영칠/길고양이 중성화수술 담당 수의사 : 길고양이 개체수를 줄이려면 길고양이를 포획하고 중성화수술 해야 하는데, 중성화수술을 하지 않고  안 하고 사료만 공급하면 영양학적으로 풍부해져서 개체수는 늘어날 수 밖에 없습니다.]실제로 강동구에선 길고양이 개체 수가 늘어나고 있습니다.[강동구 주민 : 고양이가 여기에 많아요. 고양이가 (놀이터에 분변을 땅에) 묻어놓는데, 아이들은 (놀이터)모래를 손으로 만지고 입에도 넣고 그렇게 하잖아요. 내가 화가 나서 급식소 치우겠다고 (구청에) 얘기했더니, 저거 잘못 치우면 다친다고 하더라고요.]강동구 길고양이 급식소 사업은 올해 기초자치단체 최우수 정책으로 선정됐으며, 전국 7개 지방자치단체가 벤치마킹해 운영하고 있습니다.(영상취재 : 주용진, 영상편집 : 윤선영, VJ : 이종현)▶ 잇따른 길고양이의 죽음…""독극물 먹이에 희생 추정""▶ 종로를 주름잡던 길고양이 '나비'를 찾습니다한세현 기자(vetman@sbs.co.kr)☞[취재파일] 방송에선 못 다한 생생한 취재 뒷얘기☞[나도펀딩] 뉴스 보고 기부하는 새로운 크라우드 펀딩☞[비디오 머그] SBS 동영상 뉴스의 모든 것☞ SBS뉴스 공식 SNS [SBS 8News 트위터] [페이스북] [카카오스토리]저작권자 SBS&SBS콘텐츠허브 무단복제-재배포 금지"
