,날짜,기사 제목,기사 링크,기사 출처,기사 내용
64,2012-05-15,‘주유소 나눠먹기’ 담합 과징금 갈등… 감사원 “부당감면” 공정위 “판단 차”,https://news.naver.com/main/read.nhn?mode=LSD&mid=shm&sid1=101&oid=032&aid=0002218380,경향신문,"정유사들의 ‘주유소 나눠먹기’ 담합 과징금 부과를 두고 감사원과 공정거래위원회가 충돌했다. 감사원이 “공정위가 매출액, 법 위반 횟수 등을 축소, 과징금 규모를 수백억원이나 줄였다”고 지적하자, 공정위는 “단순 매출액 계산 실수는 이미 시정했으며 법 위반 횟수 산정은 감사원과 판단상의 차이가 있는 부분이다”라고 반박했다. 감사원은 15일 공정위의 ‘2009~2011년 공정거래법 위반 사건 처리 실태’ 감사결과를 발표했다.■“법위반 횟수 등 축소” vs “판단 차이일 뿐”감사원은 “지난해 9월 공정위가 5대 정유사에 ‘원적관리 담합’을 이유로 모두 4326억3000만원의 과징금을 부과했지만, 산정 과정에서 과징금 가중기준인 정유사들의 과거 법 위반 횟수와 매출액 등을 축소해 전체 과징금 규모가 약 405억원 줄었다”고 지적했다. 원적관리 담합이란 정유사들이 각각 기존에 보유한 거래처 주유소를 서로 침범하지 않기로 암묵적 합의를 하는 행위를 말한다. 감사원은 5개 정유사 가운데 ㄱ정유사와 ㄴ정유사는 과거에 공정위로부터 5차례씩 시정 조치를 받아 과징금 가중치가 적용돼야 하는데도, 공정위가 ㄱ정유사는 3차례, ㄴ정유사는 4차례만 시정조치를 받은 것으로 계산해 각각 과징금이 약 202억원, 128억원 줄었다고 지적했다.공정위는 “이들 회사의 과거 석유화학제품 담합사건을 당시 세부품목별로 나눠 처리했는데 이것을 모두 하나의 위반행위로 볼 것인지 여러 개의 위반행위로 볼 것인지는 감사원과 공정위 간에 판단 차이가 있는 부분”이라며 “부당 감면이라는 것은 사실과 다르다”고 해명했다.■“매출액 축소” vs “단순 실수”감사원은 2010년 4월 7개 액화석유가스(LPG) 공급회사의 판매가격 담합에 대해 부과한 과징금 가운데 1곳의 과징금도 55억9000만원 적게 부과됐다고 지적했다. 과거에 받았던 시정 조치 4회를 공정위가 2회로 축소 해석했기 때문이라는 것이다. 공정위는 LPG 담합이 끝난 2007년 6월30일과 공정위 조치가 의결된 2010년 4월 사이에 발생한 2건의 담합은 과징금을 가중할 법 위반 횟수로 포함할 수 없다고 설명했다.감사원은 공정위 담당자 2명이 매출액을 계산하면서 3개 정유사의 신규 매출액을 누락해 3846억원이 축소된 매출액을 기준으로 과징금을 산정했고, 이에 따라 부과할 과징금도 약 19억원이 줄어들었다고 지적했다. 공정위는 이에 대해 “담당자가 단순 실수로 신규 주유소 매출을 누락했지만 지난해 12월 과소부과된 과징금 19억원 재부과를 의결했고 정유사들도 올해 3월 이미 완납했다”고 해명했다.<김다슬 기자 amorfati@kyunghyang.com>경향신문 ‘오늘의 핫뉴스’▶ [단독] 위안부 할머니들 “김구라, 자주 오니…”▶ 남자 대학생 50% ‘성경험’… 여대생은?▶ 고영욱 성폭행 의혹… “실은 내 친구가…”▶ 택시기사, 술 취한 女승객 데리고…▶ 출근길 여교사 성폭행… 범인은, 충격모바일 경향[New 아이폰 App 다운받기!]| 공식 SNS 계정[경향 트위터][미투데이][페이스북][세상과 경향의 소통 Khross]- ⓒ 경향신문(www.khan.co.kr), 무단전재 및 재배포 금지〈경향신문은 한국온라인신문협회(www.kona.or.kr)의 디지털뉴스이용규칙에 따른 저작권을 행사합니다.〉"
65,2012-05-15,가격 내리겠다더니..BBQ치킨 '깜깜이 인상' 논란,https://news.naver.com/main/read.nhn?mode=LSD&mid=shm&sid1=101&oid=008&aid=0002842147,머니투데이,"[머니투데이 장시복 기자]국내 최대 치킨브랜드 BBQ가 이달부터 치킨가격을 슬그머니 올려 논란이 되고 있다.15일 업계에 따르면 지난해 2월 치킨값을 평균 1000원씩 내렸던 BBQ가 이달부터 가격을 환원시켰다.예컨대 기본 메뉴인 '황금올리브치킨'은 지난해 1만6000원에서 1만5000원으로 1000원 내렸지만 다시 원래 가격을 회복하게 됐다. 사실상 가격 인상인 셈이다.BBQ는 언론에 알리지 않은 채 홈페이지 공지창을 통해서만 ""원가 상승 부담이 커졌다""며 이유를 설명했다.이에 인상 사실을 인지하지 못한 소비자들의 혼란이 일었고, 일각에선 '조삼모사 BBQ' 아니냐는 지적이 나오고 있다.앞서 지난해 2월 롯데마트 '통큰치킨' 열풍에 못이겨 BBQ가 가격 인하 조치를 내렸을 당시에도 '눈가리고 아웅'이라는 비판이 쏟아진 바 있다.치킨 가격은 1000원 인하했지만 대신 기존에 무료로 제공하던 소스를 1000원에 받아 실제 예전과 차이가 없었기 때문이다.한편 1위 치킨업체의 인상 조치로 다른 치킨브랜드들의 가격 인상이 뒤따를 것으로 보인다.[핫이슈]2011 상장사 영업실적[내손안의 스마트한 경제정보, 머니투데이 뉴스가판대][머니투데이 핫뉴스]☞여수엑스포 온 국빈들 ""자존심 상해"" 버럭!☞[박원순식 SNS소통③]""'맨홀 뚜껑' 고쳐달라"" 트윗 날리자…☞""서울버스기사 3호봉 연봉 4000만원대, 택시 2배""☞50대 명퇴男, 이'일' 시작 후…""월수 1500만""☞싼타페, ""3개월 기다려야..."" 광고가 현실로?장시복기자 sibokism@<저작권자 ⓒ '돈이 보이는 리얼타임 뉴스' 머니투데이, 무단전재 및 재배포 금지>"
66,2012-05-15,"[시황종합]""아, 그리스..."" 코스피 1900선 붕괴",https://news.naver.com/main/read.nhn?mode=LSD&mid=shm&sid1=101&oid=008&aid=0002842161,머니투데이,"[머니투데이 배준희 기자]코스피가 4개월여 만에 1900선을 내줬다. 코스피가 1900선을 밑돈 것은 지난 1월18일 이후 4개월 만이다. 그리스 정국이 악화일로를 걸으면서 투자심리가 급속히 냉각됐다.그리스는 연립정부 구성 실패로 2차 총선을 치를 가능성이 높은 상황이다. 그리스 정치권은 긴축정책 반대 기조를 고수하며 유럽 각국과 대립각을 세우고 있는 가운데 유로존 탈퇴 가능성까지 공공연히 거론돼 긴장감이 고조되고 있다.외국인의 이탈은 10일째다. 외국인은 이 기간 2조1726억원 어치의 주식을 팔아치웠다.전문가들은 정치 불확실성이 지배하는 현 시장상황에서는 코스피가 추가 하락할 가능성이 있다고 우려한다. 미국과 중국, G2 국가들의 정책공백이 이어지는 가운데 그리스 사태가 좀처럼 해법을 찾지 못하고 있어서다.이들 국가가 완만한 경기회복 흐름을 보이면서 추가 양적완화 시그널이 부각돼야 증시가 반등의 버팀목을 마련할 수 있다는 분석이다.◇코스피, 1900선 붕괴=이날 코스피 지수는 전일대비 14.77포인트(0.77%) 내린 1898.96포인트를 기록했다. 장 초반 매도우위를 보이던 기관은 순매수 전환, 182억원 매수우위를 보였으며 개인도 226억원 순매수했다.반면, 외국인은 1691억원 어치의 주식을 내던지며 지수 낙폭을 키웠다. 10일째 매도세다.프로그램 매매는 차익거래 751억원 매수우위, 비차익거래 220억원 매도우위 등 총 531억원 매수우위를 기록했다.업종별로는 하락세가 뚜렷했다. 의료정밀, 음식료품, 통신업종을 제외한 화학, 기계, 철강, 의약품, 운수창고, 금융업, 증권, 서비스, 비금속광물, 전기가스 업종 등은 일제히 하락 마감했다.시가총액 상위 종목도 하락종목이 다수였다. 삼성전자는 반등 하루 만에 약보합세에 거래를 마쳤고 SK하이닉스, LG전자, 삼성생명, LG화학, 한국전력, SK이노베이션, LG 등도 약세였다.반면, 기아차는 장 중 상승 반전해 강보합세로 거래를 마쳤고 현대차와 포스코는 보합세였다.이날 코스피 시장에서는 14개 상한가를 포함해 211개 종목이 올랐으며 하한가 종목 없이 616개 종목이 하락했다. 67개 종목은 보합세였다.환율은 상승했다. 서울외환시장에서 원/달러 환율은 전일대비 4.90원 오른 1154.10원을 기록했다. 코스피200지수선물은 전일대비 2.20포인트 내린 252.40포인트를 기록했다.◇코스닥, 3일째 하락..시총상위株 '혼조'=코스닥도 3일 연속 하락했다. 이날 코스닥 지수는 전날 대비 8.03포인트(1.64%) 내린 480.50포인트를 기록했다.개인과 기관은 각각 231억원과 16억원의 순매수를 기록, 하락장 속에서 버팀목이 돼 줬다. 반면, 외국인은 270억원의 순매도를 기록, 지수 하락을 부추겼다. 프로그램 매매는 비차익거래를 중심으로 총 50억원 매수우위를 보였다.업종별로는 하락업종이 다수였다. 디지털콘텐츠, 오락문화, 방송서비스만 오름세로 마감했을 뿐, 기타 제조, 제약, 종이목재, 금속, 통신서비스, 제조, 소프트웨어, 운송, 의료정밀기기 등 대부분 업종은 1~4% 하락했다.시가총액 상위종목은 혼조세였다. 파라다이스는 4%대 상승률을 기록한 가운데 CJ오쇼핑, 에스엠도 1%대 상승했다. 에스에프에이와 위메이드는 소폭 오름세를 보였다.반면, 셀트리온은 7% 가까이 낙폭을 키웠으며 안랩과 포스코 ICT, 젬백스, 서울반도체, SK브로드밴드, CJ E&M, 동서, 다음 등도 하락 마감했다.이날 코스닥시장에서는 상한가 11개 포함 249개 종목은 오름세를, 하한가 4개 등 708개 종목은 내림세였다. 41개 종목은 보합세로 거래를 마쳤다.[핫이슈]2011 상장사 영업실적[내손안의 스마트한 경제정보, 머니투데이 뉴스가판대][관련 키워드]파라다이스[머니투데이 핫뉴스]☞여수엑스포 온 국빈들 ""자존심 상해"" 버럭!☞[박원순식 SNS소통③]""'맨홀 뚜껑' 고쳐달라"" 트윗 날리자…☞""서울버스기사 3호봉 연봉 4000만원대, 택시 2배""☞50대 명퇴男, 이'일' 시작 후…""월수 1500만""☞싼타페, ""3개월 기다려야..."" 광고가 현실로?배준희기자 gatsby@<저작권자 ⓒ '돈이 보이는 리얼타임 뉴스' 머니투데이, 무단전재 및 재배포 금지>"
67,2012-05-15,"박근혜 ""나라 살릴 역사적 책무""..대선승리 다짐",https://news.naver.com/main/read.nhn?mode=LSD&mid=shm&sid1=100&oid=001&aid=0005614374,연합뉴스,"새누리당 제1차 전당대회 참석한 박근혜     (고양=연합뉴스) 유용석 기자 = 15일 오후 경기도 고양시 일산 킨텍스 에서 열린 새 당대표와 최고위원 선출을 위한 새누리당 제1차 전당대회에서 박근혜 비대위원장이 인사말을 하고 있다. 2012.5.15    yalbr@yna.co.kr全大 인사말..""국민 분노ㆍ경고 어물쩍 넘기면 다시는 기회 없어""(서울=연합뉴스) 신지홍 기자 = 새누리당 박근혜 비상대책위원장은 15일 ""우리에게는 나라를 살리고 국민의 미래를 책임져야 할 역사적 책무가 있다""며 대선 승리를 다짐했다.박 위원장은 경기도 일산 킨텍스에서 열린 새누리당 전당대회 인사말에서 ""이제 대선이 7개월 남았다""며 ""그 일을 이루기 위해 우리 다같이 손잡고 나아가자""고 말했다.그는 ""모든 것을 뛰어넘어 함께 힘을 모아 국민이 행복한 선진 대한민국을 만들고, 모두가 하나되는 100% 대한민국을 만들어 나가자""며 ""저 박근혜는 그 길에 여러분과 항상 함께하겠다""고 밝혔다.박 위원장은 ""우리가 총선에서 승리했지만 민심의 무서운 경고 또한 확인했다""며 ""국민이 새누리당의 변화에 신뢰를 보내줬지만 왜 마음을 다 주지 못했는지, 부족한 몇%의 의미가 뭔지 정확히 알고 해결해야 한다""고 지적했다.또 ""그 부족한 몇%는 과거 잘못된 문제들과 국민의 삶을 챙기지 못한 것에 대한 국민의 분노와 경고일 것""이라며 ""우리는 결코 그 분노와 경고를 잊어서는 안될 것""이라고 말했다.특히 박 위원장은 ""만약 이번에도 국민의 경고를 안일하게 생각하고 어물쩍 넘어갈 수 있다고 생각한다면 우리에게 다시는 기회가 주어지지 않을 것""이라고 강조했다.박 위원장은 ""새 지도부에 주어진 사명도 반드시 그것을 책임지고 해결하는 것""이라며 ""그럴 때만이 국민의 신뢰도 얻을 수 있고 국민의 삶도 책임질 수 있으며, 그 바탕 위에서만이 정권 재창출도 가능할 것""이라고 말했다.shin@yna.co.kr[이 시각 많이 본 기사]☞건동대 자진 폐교…현정부 3번째 퇴출대학☞6월 일본에서 '김남길 축제 2012'☞美정부 ""한반도 전술핵 불필요""☞PGA 플레이어스 우승 쿠차, 세계랭킹 5위로 도약☞새누리 오늘 全大..대선경선 관리 지도부 선출<연합뉴스 모바일앱 다운받기><포토 매거진><저작권자(c)연합뉴스. 무단전재-재배포금지.>"
68,2012-05-15,"21일 아침, 달이 해를 품는다",https://news.naver.com/main/read.nhn?mode=LSD&mid=shm&sid1=105&oid=008&aid=0002842106,머니투데이,"[머니투데이 백진엽 기자][전국에서 부분일식 관측 가능]오는 21일 아침 전국에서 부분일식을 볼 수 있을 전망이다.한국천문연구원(원장 박필호)은 21일 오전 6시23분부터 8시48분까지 우리나라 전역에서 부분일식을 관측할 수 있다고 밝혔다.21일 아침에는 달이 해를 가려 해의 일부분만 볼 수 있는 부분일식 현상이 일어난다. 이번 일식은 우리나라에 전 지역에서 관측이 가능하며 출근길 또는 등교길에 눈썹 모양으로 보이는 해의 모습을 볼 수 있다. 이날 가장 많이 가려지는 최대 부분식 시각은 서울기준 7시32분이며, 최대식분이 약 80%로 해의 대부분이 가려진다. 이후 8시48분까지 약 2시간25분 동안 일식이 진행된다. 이 날 해는 5시18분(서울기준)에 뜬다.우리나라에서 볼 수 있었던 일식은 지난 2010년 1월15일 부분일식이었으며 우리나라에서 관측이 가능한 다음 일식은 4년 후인 2016년 3월9일이다.이번 부분일식은 달이 해의 약 80% 정도가 가리는 일식으로 일본 남부지역과 북태평양, 그리고 미 서부 지역 일부 등지에서는 금환일식으로 관측될 예정이다.일식현상은 해가 가려지는 정도를 기준으로 부분일식, 개기일식, 금환일식으로 구분한다. 부분일식은 해의 일부가 가려지는 경우, 개기일식은 해의 전부가 가려지는 경우이다. 금환일식은 달의 공전 궤도상 지구와의 거리에 의해 해의 전부가 가려지지 않고 테두리가 남아 금반지처럼 보이는 경우를 말한다.일식 관측을 위해 태양을 장시간 맨눈으로 보면 눈이 상할 위험이 있다. 때문에 태양 필터나 여러 겹의 짙은 색 셀로판지 등을 이용하여 보아야 한다. 특히, 특수 필터를 사용하지 않은 망원경으로 태양을 보면 실명할 수 있으니 각별한 주의가 필요하다.[핫이슈]2011 상장사 영업실적[내손안의 스마트한 경제정보, 머니투데이 뉴스가판대][관련 키워드]일식|부분일식[머니투데이 핫뉴스]☞여수엑스포 온 국빈들 ""자존심 상해"" 버럭!☞[박원순식 SNS소통③]""'맨홀 뚜껑' 고쳐달라"" 트윗 날리자…☞""서울버스기사 3호봉 연봉 4000만원대, 택시 2배""☞싼타페, ""3개월 기다려야..."" 광고가 현실로?☞50대 명퇴男, 이'일' 시작 후…""월수 1500만""백진엽기자 jyback@<저작권자 ⓒ '돈이 보이는 리얼타임 뉴스' 머니투데이, 무단전재 및 재배포 금지>"
69,2012-05-15,"北, GPS 교란전파 16일만에 중단",https://news.naver.com/main/read.nhn?mode=LSD&mid=shm&sid1=100&oid=001&aid=0005614253,연합뉴스,"한ㆍ중 GPS 교란대책 논의 영향준 듯(서울=연합뉴스) 김귀근 기자 = 북한이 GPS(위성위치정보시스템) 교란전파를 남측으로 발사한지 16일 만에 중단한 것으로 확인됐다.정부의 한 고위 소식통은 15일 ""지난달 28일부터 시작된 북한의 GPS 교란전파가 14일부터 감지되지 않고 있다""면서 ""북측의 동향을 면밀히 주시하고 있다""고 밝혔다.북한은 개성지역에서 출력 100와트 규모의 GPS 교란전파를 남측을 향해 발사해왔다.소식통은 ""이틀째 GPS 교란전파가 감지되지 않고 있으나 다시 시작될 가능성을 염두에 두고 있다""면서 ""특히 GPS 교란에 이은 다른 도발 가능성에도 대비하고 있다""고 강조했다.GPS 교란 중단과 관련, 국책연구소의 한 전문가는 한국과 중국이 지난 14일 정상회담을 통해 북한의 GPS 교란에 대한 대책을 마련키로 한 것이 영향을 준 것 같다고 분석했다.이 전문가는 ""중국이 북한당국에 대해 GPS 교란 사실과 의도 등을 문의했을 가능성이 크다""면서 ""북한은 경제적인 후원자인 중국의 태도에 큰 부담을 느꼈을 것으로 본다""고 말했다.이명박 대통령과 후진타오(胡錦濤) 중국 국가주석은 전날 베이징(北京) 인민대회당에서 열린 정상회담을 통해 북한의 GPS 교란문제를 논의하고 정보를 교환하면서 대책을 마련하기로 했다.한편 군당국은 북한이 GPS를 교란한 의도를 정밀 분석 중인 것으로 알려졌다.군의 한 관계자는 ""북한군이 전자전 장비의 성능을 테스트했거나 북한내 소식을 외부에 알리지 못하도록 휴대전화를 통제하는 등의 의도를 예상해 볼 수 있다""면서 ""교란전파가 발사된 개성지역 등의 군부대 동향을 정밀 감시하고 있다""고 전했다.북한 개성지역서 발사된 GPS 교란전파는 지상과 해상은 60여㎞, 공중은 200여㎞까지 영향을 줄 수 있는 것으로 알려졌다.우리 군의 전투기와 수송기, 정밀유도폭탄 등 핵심 장비는 미국 군전용 코드(P코드) 수신기를 달고 있어 북한의 GPS 교란전파에 지장을 받지 않는다.threek@yna.co.kr[이 시각 많이 본 기사]☞<김두관 대선 행보에 경남 야권서도 잇따라 비판>☞6월 일본에서 '김남길 축제 2012'☞""지자체 건설비리 횡행..49건 무더기 적발""(종합)☞<축구소식> 옛골토성, 홍명보재단 장학생 초청행사☞특별활동비 등 비리 어린이집 180여곳 적발(종합)<연합뉴스 모바일앱 다운받기><포토 매거진><저작권자(c)연합뉴스. 무단전재-재배포금지.>"
70,2012-05-15,"박근혜, 구원투수 마무리..대선행보 본격화",https://news.naver.com/main/read.nhn?mode=LSD&mid=shm&sid1=100&oid=018&aid=0002601020,이데일리,"[이데일리 김성곤 기자] 박근혜 새누리당 비상대책위원장이 본격적인 대선행보에 나설 전망이다.박 위원장은 지난 연말 새누리당이 백척간두의 위기에 놓였을 때 구원 투수로 비상 대권을 행사하며 당의 위기 탈출을 성공적으로 이끌었다. 이제 남은 것은 대선이다. 박 위원장은 이르면 6월초 대선 출마를 공석 선언하고 대권을 향한 대장정에 나선다는 방침이다.◇‘선거의 여왕’, 휘파람 불다박 위원장은 ‘선거의 여왕’이라는 명성답게 4·11 총선을 승리로 이끌었다. 박 위원장이 지난 연말 당의 전면에 나서기 전까지 정치적 환경은 참담 그 자체였다.10·26 서울시장 보궐선거 참패 이후 당 내홍이 가속화된 것은 물론 중앙선관위 홈페이지 디도스 공격 연루 의혹, 전당대회 돈봉투 사건, 이명박 대통령 주변의 비리 의혹 등 악재가 끝도 없이 이어졌다.4·11 총선을 앞두고 위기감은 극에 달했다. 원내 제1당은 고사하고 100석도 힘들 것이라는 비관론이 대두됐다. 박 위원장은 당명, 사람, 정책을 바꾸는 과감한 쇄신을 선택했다. 15년 동안 사용해온 ‘한나라당’이라는 당명을 버리고 ‘새누리당’이라는 새 당명을 도입했다.이준석·손수조 등 20대 정치인을 깜짝 발탁하며 노쇠화된 공룡 이미지의 당을 변화시켰다. 총선 최대 아킬레스건이었던 이명박 정부와 관계 설정을 둘러싸고 김종인·이상돈 두 비대위원을 전면에 내세워 차별화에 성공했다. 결과는 대박이었다. 당초 예상을 뛰어넘는 152석의 과반 의석을 획득했다.박 위원장은 14일 트위터에 “비상대책위원장의 임무를 마감하게 된다. 지난 5개월 동안의 일을 생각하면 감회가 새롭다”며 소회를 밝혔다.◇“남은 7개월..더이상 기회 없을지도”박 위원장은 총선 이후 차기 지지율 여론조사에서 40% 안팎의 고공 지지율을 기록하며 대세론을 구가 중이다. 박 위원장이 처한 상황은 지난 2006년 5·31 지방선거 직후와 유사하다. 박 위원장은 당시 오세훈 서울시장 후보 지원 유세에서 괴한에게 테러를 당하는 아픔을 겪으며 지방선거 압승을 이끌었다.“대전은요”라는 한마디로 열세였던 대전시장 선거를 역전으로 이끈 것은 유명한 일화다. 이번 총선에서도 붕대 투혼을 선보이며 박근혜 파워를 유감없이 선보였다. 그때와 다른 점은 라이벌 후보의 무게감이다.당시 이명박 서울시장이라는 강력한 경쟁자가 있었다. 이번 대선후보 경선에서는 김문수 경기지사, 정몽준 전 대표, 이재오 전 장관, 임태희 전 대통령실장 등 비박 주자들이 나섰지만 새누리당 대선 후보 선출은 무난해 보인다.박 위원장은 15일 경기 고양 일산 킨텍스에서 열린 전당대회에서 “새누리당은 (17대 총선 직전) 탄핵 역풍 때와 마찬가지로 총선을 치르며 2번의 기회를 받았다”며 “기회를 살리지 못한다면 더이상 기회는 없을지 모른다”고 절박감을 드러냈다.그는 이어 “이제 대선이 7개월 남았다”며 “모두가 하나되는 선진 대한민국 만들어야 한다. 저 박근혜가 그 길에 항상 함께 하겠다”고 각오를 다졌다.배종찬 리서치앤리서치 정치사회조사본부장은 이데일리와 통화에서 “차기 대선은 박근혜 위원장에게 남은 마지막 대선”이라며 “당내 경선에서 선출될 가능성이 높아 보이지만 변수가 없는 것은 아니다”고 밝혔다.이어  “이회창 전 총재는 2002년 대선에서 97년 대세론 때와 달라지지 않은 모습을 선보여 패배했다”며 “중도층이 30%를 넘어가는 상황에서 박 위원장도 과거와 달라진 모습을 선보여야 한다. 이른바 뉴 박근혜 플랜을 고민해야 할 것”이라고 전망했다.김성곤 (skzero@edaily.co.kr)▶ 당신의 생활 속 언제 어디서나 이데일리 ‘신문 PDF바로보기‘▶ 스마트 경제종합방송이데일리 TV▶ 실시간 뉴스와 증권거래, 내 손안의 금융시장 ‘이데일리 모바일 서비스’▶ 전문가를 위한 국내 최상의 금융정보단말기 ‘이데일리 마켓포인트 2.0’▶ 국내 최고 증권 전문가 방송이데일리 ON, 고객상담센터 1666-2200＜ⓒ종합 경제정보 미디어 이데일리 - 무단전재 & 재배포 금지＞"
