,날짜,기사 제목,기사 링크,기사 출처,기사 내용
103,2012-05-15,직장인이 뽑은 가장 행복한 직업 1위는,https://news.naver.com/main/read.nhn?mode=LSD&mid=shm&sid1=102&oid=014&aid=0002648192,파이낸셜뉴스,"직장인들이 생각하는 가장 행복할 것 같은 직업으로 '예술가'를 꼽았다.15일 취업포털 잡코리아가 남녀직장인 1709명을 대상으로 '직업 만족도'에 대해 설문조사를 실시했다. '가장 행복 할 것 같은 직업'에 대해 질문한 결과, 시인과 화가 등 '예술가'라고 답한 응답자가 전체 18.7%비율로 가장 많았다.이어 △국회의원(11.4%) △연예인(10.5%) △요리사(10.2%) △의사,변호사 등 전문직(9.7%) △CEO(6.5%) △선생님, 교수(6.3%) △대통령(5.4%) △공무원(5.0%) △운동선수(3.7%) △직장인(3.6%) △농부, 어부(3.1%) △건축가(1.8%) △과학자, 연구원(1.6%) △군인(0.8%) 등의 순이었다.이들이 행복할 것이라 생각하는 이유(*복수응답)에 대해서는 '하고 싶은 일을 하는 것 같아서'란 답변이 응답률 64.4%로 가장 높았다. 이어 △돈을 잘 벌 것 같아서(32.7%) △여가 시간이 많을 것 같아서(26.2%) △권위와 사회적위치가 있어서(21.3%) △일이 편할 것 같아서(19.8%) △기타(1.7%) 순으로 조사됐다.행복하기 위해 필요한 것 중 가장 많은 답변을 차지한 3가지로는 '사랑하는 사람(87.4%)', '돈(82.6%)' '건강(68.8%)'으로 나타났다. 이어 △긍정적 마인드(33.4%) △꿈,목표(21.4%) △직업(18.0%) △배움, 지식(17.6%) △멋진 외모(14.0%) △열정(13.6%) △선한 마음(5.9%) △기타(0.4%) 순이었다.한편, '자신의 직업에 대해 만족하느냐'고 질문한 결과, 직장인 58.5%는 자신의 직업에 '만족하지 않는다'고 답했다. 나머지 41.5%는 '만족한다'고 응답했다.자신의 직업에 대한 만족비율은 '회사 형태별'로 차이를 보였다. '공기업'의 경우 '만족한다'가 '만족하지 않는다'는 비율보다 12.4%포인트 높았다. '외국계 기업'은 10.6%포인트, '대기업'이 1.3%포인트 높게 나타났다. 반면, '중소기업'은 유일하게 '만족한다'는 비율이 28.0%포인트 낮게 나타났다.자신의 직업에 '만족한다'고 답한 709명을 대상으로 만족하는 이유를 질문한 결과, '하는 일에 보람을 느낀다'가 38.4%비율로 가장 높았다. 이어 △같이 일하는 사람들이 좋다(28.5%) △일이 편하다(19.0%) △근무환경이 좋다(8.6%) △돈을 많이 준다(3.5%) △기타(2.0%) 순이었다.'만족하지 못한다'고 답한 1,000명의 직장인은 그 이유에 대해 '급여가 적다(40.8%)'라는 답변이 가장 많았다. 다음으로 △일에 만족도가 떨어진다(29.6%) △일이 힘들다(11.6%) △같이 일하는 사람들이 마음에 들지 않는다(9.6%) △근무환경이 열악하다(6.4%) △기타(2.0%) 순으로 나타났다.yccho@fnnews.com 조용철 기자■ 오늘의 핫뉴스▶ 운동해도 살이 안빠지는 당신, 혹시..▶ BMW4 시리즈 컨버터블 공개된 내부보니..▶ 스님이 진돗개 무참히 때려 죽인 이유가..▶ 소시 제시카 ‘시구’에 美 언론 비난 보도..왜?▶ 가수 김혜연이 추천하는 다이어트 인기 폭발..왜?※ 저작권자 ⓒ파이낸셜뉴스. 무단 전재-재배포 금지"
104,2012-05-15,"강기갑 ""폭력사태 당사자 처벌할 것""",https://news.naver.com/main/read.nhn?mode=LSD&mid=shm&sid1=100&oid=079&aid=0002358384,노컷뉴스,"[CBS 김효은 기자]통합진보당 강기갑 비상대책위원장은 지난 12일 중앙위원회가 열리던 날 폭력을 휘두른 당원들에 대해 ""당내에서 국민들이 납득할 수 있는 조사와 처벌을 하겠다""고 밝혔다.강 위원장은 15일 CBS라디오 '김현정의 뉴스쇼'에 출연해 ""대표단에서 비대위에 전권을 넘겼다. 비대위원을 구성한 뒤 이 부분까지 강도 높게 다루겠다""며 이 같이 말했다.당권파들의 중앙위 전자투표 무효화 주장에 대해서는 ""당헌에 나와 있는 사항에 따라 절차와 과정을 밟아서 진행한 것이기 때문에 무효라고 할 근거가 전혀 없다""고 반박했다.그러면서 ""운영위 때도 온라인 회의를 통해 전자투표를 했는데, 이정희 당시 의장이 그 결과를 인정하셨다""고 강조했다.당권파들이 법적 소송을 검토하고 있는 데 대해선 ""(전자투표의) 법적인 검토를 마쳤다""며 ""특히 비례후보로 나오신 서기호 전 판사도 전혀 문제가 없다는 입장을 밝히셨다""고 전자투표의 정당성을 주장했다.강 위원장은 사퇴를 거부하는 순위경선 비례대표에 대해 ""법적으로 본인들이 거부하면 다른 방법은 없다""면서도 ""당의 최고의결기구에서 결정을 내리고 요청을 하는 것이기 때문에 당사자들이 현명하게 잘 따르리라 기대한다""고 말했다.아울러 ""국민들에게 심려를 끼치고 좋지 않은 모습을 많이 보였는데 (비례후보 사퇴는) 응당한 조치가 될 것""이라며 ""최종적인 결정은 당사자에게 있다는 한계가 있지만, 그 한계까지는 가지 않을 것""이라고 덧붙였다.일각에서 제기되는 출당·제명설과 관련해서는 ""그런 좋지 않은 얘기는 하고 싶지 않다. 비례대표도 출당을 시키면 당적을 잃게 되지만 무소속으로 의원직을 계속 유지할 수 있다""며 가능성을 일축했다.그는 또 분당설과 관련해 ""분당이라는 이야기는 당내 양 진영에서 '분'자도 나온 적이 없다""며 ""너무 걱정을 하셔서 그런 것 같은데 저희들은 치열하게 대치하고 추한 모습은 보이지만 분당할 수 없고 분당해서도 안 된다""고 못 박았다.africa@cbs.co.kr[네티즌 많이 본 기사]●조카 데리고 영화보러 갔더니 8만5000원 ""헉~""●노회찬 ""의장단 습격, 용팔이 사건보다 저질""●강기갑 ""진보를 무덤으로 끌고갈 수는 없다""●조현오 ""노무현 전 대통령 차명계좌 2개에 모두 20억"" 주장●'디아블로3' 풀리자…왕십리가 '마비'됐다(대한민국 중심언론 CBS  뉴스FM98.1 / 음악FM93.9 / TV CH 412)<저작권자 ⓒ CBS 노컷뉴스(www.nocutnews.co.kr) 무단전재 및 재배포 금지>스마트 뉴스앱의 최강자! 노컷뉴스 APP 다운로드 받기↓"
105,2012-05-15,"KT스카이라이프, 3D방송 중단 검토",https://news.naver.com/main/read.nhn?mode=LSD&mid=shm&sid1=105&oid=092&aid=0002001018,ZDNet Korea,"KT스카이라이프가 세계 최초로 24시간 실시간 3D 방송을 시작한지 2년여 만에 방송 송출 여부를 전면 재검토한다.14일 업계에 따르면 KT스카이라이프는 실시간 3D 채널 '스카이3D'와 3D 페이퍼뷰(PPV·Pay Per View) 채널을 포함한 3D 방송 중단을 검토 중이다.지난 2년 동안 3D 채널을 주요 마케팅 전략으로 삼았던 KT스카이라이프가 3D 방송 포기를 고민하는 이유는 수익성이다. 3D 방송은 일반 HD방송에 비해 위성활용량이 2배 이상 들지만 투자하는 금액 대비 수익은 거의 나오지 않는게 문제다.KT스카이라이프 관계자는 “지난 2년 간 매년 100억원 이상의 제작비를 투자했지만 그에 비해 얻는 수익은 미미해 방송 중단을 심도있게 검토 중”이라고 설명했다.▲ KT스카이라이프가 세계 최초로 24시간 실시간 3D 방송을 시작한지 2년여 만에 방송 송출 여부를 전면 재검토한다. 자료 사진은 지난해 ‘MIPTV 2011’에 출품된 KT스카이라이프의 3D 콘텐츠.여기에 정부의 3D 방송 활성화 의지와 실질적인 지원이 미미하고 삼성전자와 LG전자 등 3DTV 제조사들 역시 콘텐츠 투자에 소극적인 것도 요인으로 작용했다. 3D 콘텐츠 보급을 방송사 혼자 책임져야 하는 상황에 대한 절박함의 표현이라는 설명이다.이번 결정이 실제 방송 중단으로 이어질 경우 3D 방송을 시청하기 위해 3DTV를 구입하거나 스카이라이프에 가입한 시청자들의 반발도 거셀 전망이다. 이용약관 변경신고 등 절차상 문제도 남아있다.KT스카이라이프 관계자는 “실제 중단했을 때 시장에 미칠 파장 등을 고려해 방송통신위원회와 협의를 진행 중”이라며 “이번주 예정된 문재철 신임 대표 간담회에서 구체적인 윤곽이 나올 것”이라고 밝혔다.[관련기사]☞폭우 폭설에도 끄떡없는 위성방송 나온다☞스카이라이프 ‘3D 초접사 다큐’ 봤더니…☞KT스카이라이프, 3D 한국국제영화제 출품☞KT스카이라이프, 3D콘텐츠 유럽 수출 쾌거정현정 기자 (iam@zdnet.co.kr)▶ IT 세상을 바꾸는 힘 <지디넷코리아>▶ IT뉴스는<지디넷코리아>, 게임트렌드는<게임스팟코리아>▶ 스마트폰으로 읽는 실시간 IT뉴스<모바일지디넷>[저작권자ⓒ메가뉴스 & ZDNet & CNET. 무단전재 및 재배포 금지]"
106,2012-05-15,이정희 서랍속 ‘당원명부’ 또다른 변수로,https://news.naver.com/main/read.nhn?mode=LSD&mid=shm&sid1=100&oid=081&aid=0002277144,서울신문,"[서울신문]통합진보당 4·11 총선 비례대표 부정선거 파문이 당권파와 비당권파 측의 법적 소송으로 비화될 조짐을 보이고 있는 가운데 부실·부정선거의 원천으로 지목된 당원 명부가 이번 사태를 일단락 지을 변수가 될 수 있을지 주목된다.유시민 전 공동대표가 지적했듯 당원 명부가 실제 신뢰성이 없는 것으로 확인될 경우 당권파의 반발에도 불구하고 비례대표 경선 자체를 무효화시킬 수 있는 근거가 될 수 있다는 게 비당권파 측의 판단이다. 특히 민주노동당뿐 아니라 국민참여당, 진보신당 탈당파로 나뉜 당원 명부 자체가 지난 3월 비례대표 경선 직전 통합된 것으로 알려져 당원 명부의 오류가 적지 않다는 주장이다.당 일각에서는 유 전 대표가 정당활동이 금지된 교사·공무원이 당원에 포함돼 어차피 당권파 측에서 당원 명부를 공개할 수 없을 것이라는 생각으로 명부 문제를 공개적으로 거론한 게 아니냐는 관측도 제기되고 있다.지난 7일 이정희 전 공동대표가 당 진상조사위원회의 조사 결과에 반발하며 공청회를 열자고 제안하자 유 전 대표는 “우리 당의 당원 명부를 신뢰할 수 없다는 것이 문제의 핵심”이라며 당원 명부를 공개하라고 맞불을 놨다.만약 당원 명부 자체가 부실로 드러날 경우 진상조사위 조사 결과의 신뢰성 여부를 떠나 비례대표 후보 경선의 정당성 자체가 상실될 수 있다.현재 통진당의 당원 명부는 이 전 대표를 비롯한 당권파 측이 독점 관리하는 것으로 알려져 있다. 비당권파는 당원 명부의 세부 정보를 이 전 대표만이 갖고 있는 것으로 보고 있다.당내에서는 옛 민주노동당 당원 중 정당 활동이 금지된 교사나 공무원 등이 상당수 포함돼 있다는 말이 흘러나오고 있다. 유 전 대표가 이를 알고 강공 모드를 취했을 것이라는 말도 나오고 있다.서울중앙지법은 지난 1월 민주노동당에 가입하고 당비를 낸 혐의로 기소된 240여명의 전국교직원노동조합 소속 교사와 공무원에 대해 정치자금법 위반으로 유죄를 선고한 바 있다.송수연기자 songsy@seoul.co.kr[ 관련기사 ]☞ 통진당 폭력사건 수사착수☞ 당권파 학생전위대는 ‘이석기 키즈’☞ 친노 미운 오리새끼서 진보개혁 선봉… 유시민 다시 뜬다☞ ‘진보의 붉은 장미’ 이정희 시들다☞ 버티는 이석기·김재연[서울신문 다른기사 보러가기]☞ 경찰이 고영욱 구속하려는 진짜 이유 알고보니…☞ 심상정, 기자회견 도중 울먹이면서…☞ 유산한 30대女, 남편이 의사와 관계 의심하자…☞ 폭력 진보 학생들, 바닥에 떨어진 학생증 보니…☞ 미남 천하장사 李모씨, 노인들에 가짜약 팔다…‘맛있는 정보! 신선한 뉴스!’ 서울신문(www.seoul.co.kr) [신문 구독신청]- Copyrights ⓒ서울신문사. 무단 전재 및 재배포 금지 -"
107,2012-05-15,"[단독]실질적 실업자 통계서 제외… 체감실업률, 정부 발표 2배",https://news.naver.com/main/read.nhn?mode=LSD&mid=shm&sid1=101&oid=032&aid=0002218232,경향신문,"ㆍ입법조사처 “통계와 현실 괴리로 정책 불신 키워” 지적국민이 체감하는 실업률이 정부가 발표하는 공식 실업률보다 2배 이상 높다는 국회 입법조사처 분석이 나왔다. 정부의 실업통계가 실질적으로 실업 상태인 사람들을 포함하지 않아 괴리가 발생하고, 이로 인해 정부 불신이 커지고 있다는 것이다.국회 입법조사처는 14일 ‘실업통계의 문제점과 개선과제’ 보고서에서 ‘불완전 취업자’나 ‘구직 단념자’ 등을 실업자로 간주해 통계를 뽑아본 결과 지난해 체감 실업률은 7.7%로 공식 실업률(3.4%)보다 2배 이상 높았다고 밝혔다. 정부 통계상 실업자로 분류되려면 일이 없고, 일을 할 수 있는 상태에 있으며, 적극적으로 구직활동을 해야 하는 등 3가지 엄격한 조건을 충족해야 한다. 이 때문에 일을 할 수 있지만 일자리를 찾다가 실패해 실망감으로 구직활동을 포기한 사람들은 ‘적극적으로 구직활동을 해야 하는’ 조건에 맞지 않아 ‘비경제활동인구’로 분류돼 정부의 실업통계에서 원천적으로 빠진다. 취업이나 공무원 시험을 준비하는 청년들도 ‘공부를 하는 것’이 구직활동으로 간주되지 않아 역시 비경제활동인구에 포함된다. 반면 1주일에 1시간만 일을 해도 그 사람은 ‘일이 있기’ 때문에 취업자로 분류된다.보고서는 “공식 실업률이 복잡한 노동시장의 양상을 제대로 반영하지 못할 경우 다양한 계층이 처해 있는 상황에 적합한 정책을 수립하기가 어려워지고, 공식 통계에 대한 불신을 조장해 정책 집행의 성과 향상을 저해하게 된다”고 지적했다.통계청도 국제노동기구(ILO)의 권고를 반영해 공식 실업률뿐만 아니라 불완전 취업자나 구직 단념자에 대한 정보를 매월 같이 발표하고 있다.미국 노동통계국이 발표하는 실업률지표는 6종으로 구성돼 있다. ‘15주 이상 실업 상태에 놓인 장기 실업자’(U-1), ‘실직자 및 임시 고용이 종료된 자’(U-2), ‘ILO 기준에 부합하는 공식 실업자’(U-3), ‘공식 실업자 및 구직 단념자’(U-4), ‘공식 실업자 및 한계근로자’(U-5), ‘공식 실업자, 한계근로자 및 불완전 취업자’(U-6) 등이다. 이 가운데 ‘U-3’는 한국의 공식 실업률, ‘U-6’는 체감 실업률에 속한다고 입법조사처는 설명했다.<오창민 기자 riski@kyunghyang.com>경향신문 ‘오늘의 핫뉴스’▶ [단독] 위안부 할머니들 “김구라, 자주 오니…”▶ 남자 대학생 50% ‘성경험’… 여대생은?▶ 고영욱 성폭행 의혹… “실은 내 친구가…”▶ 택시기사, 술 취한 女승객 데리고…▶ 출근길 여교사 성폭행… 범인은, 충격모바일 경향[New 아이폰 App 다운받기!]| 공식 SNS 계정[경향 트위터][미투데이][페이스북][세상과 경향의 소통 Khross]- ⓒ 경향신문(www.khan.co.kr), 무단전재 및 재배포 금지〈경향신문은 한국온라인신문협회(www.kona.or.kr)의 디지털뉴스이용규칙에 따른 저작권을 행사합니다.〉"
108,2012-05-15,서울버스노조 “18일부터 전면파업” 91% 가결,https://news.naver.com/main/read.nhn?mode=LSD&mid=shm&sid1=102&oid=020&aid=0002335269,동아일보,"9.5% 임금인상 요구… 내일 市와 최종 조정[동아일보]서울시버스노동조합이 총파업 찬반 투표를 압도적인 찬성으로 14일 가결해 15년 만의 총파업이 현실화할 가능성이 커지고 있다. 전국자동차노조연맹 서울시버스노조는 18일 오전 4시부터 전면 파업에 돌입하는 내용의 찬반 투표를 진행해 서울시내버스 62개 노조 재적 조합원 1만6379명 중 1만5482명의 투표로 찬성 91.4%(1만4974명)로 파업이 가결됐다고 이날 밝혔다. 버스노조에는 서울 버스 운전자 98%가 가입돼 있다.서울버스운송사업조합(사용자)과 임금 인상 협상 중인 버스노조는 16일로 예정된 서울지방노동위원회의 최종 조정협상이 결렬되면 1997년 이후 15년 만에 총파업에 돌입하게 된다. 버스노조는 2004년 버스 준공영제 도입 이후 2005, 2007, 2009년 세 차례 총파업 투표를 가결했지만 실제 파업에 돌입한 적은 없었다.버스노조는 올해 임금을 지난해 대비 9.5% 인상해야 한다고 주장하고 있는 반면 사업조합은 지난해 수준으로 동결해야 한다고 맞서고 있다. 이태주 버스노조 정책기획국장은 “최근 8년간 서울시 버스운전사의 임금 인상은 2%대에 불과했다”며 “올해 버스요금이 150원 오른 만큼 버스운전사들의 임금 인상도 이뤄져야 한다”고 주장했다. 사업조합은 “준공영제가 시행된 후 서울 시내버스 운전자 임금이 50% 이상 인상됐고 다른 지방자치단체 운전사에 비해 임금 수준이 월등히 높다”며 임금 인상에 부정적이다.서울시는 16일 조정협상이 결렬돼 벌어질 수 있는 교통대란에 대비해 이날부터 비상수송대책을 가동했다. 지하철과 마을버스 등 시내버스 외 모든 교통수단을 동원해 파업에 들어가더라도 시민 불편을 최소화한다는 계획이다. 자치구별로 전세버스 등을 빌려 출퇴근 시간에 지하철 연계 무료 셔틀버스를 운행하는 방안도 검토 중이다. 개인택시 3부제와 승용차 요일제 해제 또한 검토할 계획이다. 윤준병 서울시 도시교통본부장은 “최종 조정이 타결돼 파업에 이르지 않도록 노사 양측을 적극적으로 설득해 나가겠다”며 “만일의 사태에 대비해 비상수송대책본부를 24시간 가동하기로 했다”고 말했다.강경석 기자 coolup@donga.com권기범 기자     kaki@donga.com[화제의 뉴스]- 유시민 폭행 대학생들, 누군가 지휘…- 외제차서 발버둥치던 女, 알고보니…- 평균임금이 9780만원인 국내기업?- “盧 차명의심 계좌에 20억…퇴임때 인출”- [화보] 곽현화, 섹시 비키니로 올 여름 강타[☞오늘의 동아일보][☞동아닷컴 Top기사][☞채널A 인터넷 토픽!]ⓒ 동아일보 & donga.com, 무단 전재 및 재배포 금지"
109,2012-05-15,北인권운동 김영환씨 中서 체포… 47일째 구금,https://news.naver.com/main/read.nhn?mode=LSD&mid=shm&sid1=100&oid=020&aid=0002335371,동아일보,"80, 90년대 NL계 이끈 ‘종북 원조’ → 北실상 실망해 전향…통진당 당권파는 종북 매달려 폭력사태 벌여다른 한국인 3명도 붙잡혀… 中, 구금 이유도 설명 안해[동아일보]김영환 북한민주화네트워크 연구위원(49·사진)이 중국 다롄(大連)에서 체포돼 40여 일 동안 강제 구금돼 있는 것으로 뒤늦게 밝혀졌다.김 씨는 1980년대 이른바 ‘강철서신’을 통해 학생운동권에 김일성 주체사상을 퍼뜨린 인물로 NL(민족해방)계를 이끌며 1992년 민족민주혁명당(민혁당)을 결성했다. 그는 북한을 방문해 김일성 주석과 면담까지 했지만 북한의 실상에 실망했고 1990년대 후반 대규모 아사(餓死) 사태를 접한 뒤 1997년 민혁당을 해체했다. 이후 전향해 ‘시대정신’ 편집위원 등을 맡으며 북한 인권과 민주주의 개선에 전념해 왔다.그러나 민혁당 출신 이석기 국회의원 당선자를 핵심으로 한 통합진보당 당권파는 교조적인 종북에 매달린 채 비례대표 부정선거에 이어 중앙위원회 폭력사태를 벌여 ‘대한민국 진보를 죽인다’는 비판을 받고 있다.김영환석방대책위원회(이하 대책위)는 14일 “김 위원이 3월 23일 출국한 뒤 같은 달 29일 중국 국가안전부(한국의 국가정보원 격) 산하 랴오닝(遼寧) 성 국가안전청에 ‘국가안전위해죄’로 체포됐다는 것을 주선양(瀋陽) 총영사관을 통해 확인했다”고 밝혔다. 김 씨는 현재 국가안전청 단둥(丹東)수사국에 수감돼 있는 것으로 알려졌다. 김 씨 외에 유재길(44) 강신삼(42) 이상용 씨(32) 등 한국인 3명도 함께 체포돼 있으며 이들도 북한인권운동을 해온 것으로 알려졌다.정부도 김 씨가 체포돼 있다는 사실을 확인했다. 외교소식통은 “중국 국가안전청이 개입한 이상 사건이 훨씬 복잡한 양상을 띠고 전개될 가능성이 있다”며 “현재 기소단계 전으로 혐의가 확정된 것은 아니다”라고 말했다.주선양 총영사관은 지난달 26일 김 씨를 한 차례 영사 접견한 상태지만 중국 측은 다른 한국인 3명은 영사 접견조차 허용하지 않았으며 이들의 구금 이유도 설명하지 않았다고 대책위는 밝혔다. 정보당국도 김 씨 등에 대한 선처를 요청했던 것으로 알려졌다. 대책위는 “중국 정부가 국제법을 준수하고 강제구금 중인 한국인들에 대한 영사 접견과 가족 면회를 즉각 보장해야 한다”고 촉구했다.대책위 최홍재 대변인은 “김 위원이 중국에서 북한 인권사업을 한 것으로 추정된다”며 “그것이 국가안전위해죄와 어떤 연관이 있는지 납득하기 어렵다”고 말했다. 대책위는 그동안 이 문제를 외교적으로 해결하기 위해 노력해왔지만 더는 ‘조용한 해결’을 기대하기 어렵다는 판단에 따라 이들의 체포 및 구금 사실을 공개했다고 설명했다.장택동 기자 will71@donga.com[관련 뉴스]- [화보] 김정은, 만경대 유희장 관리부실 공개질타- [동영상] “中, 북송위기 탈북자 석방하라”- [화보] 곽현화, 섹시 비키니로 올 여름 강타- [화보] 라니아 파격 댄스 ‘관객들 놀라겠어’[☞오늘의 동아일보][☞동아닷컴 Top기사][☞채널A 인터넷 토픽!]ⓒ 동아일보 & donga.com, 무단 전재 및 재배포 금지"
