,날짜,기사 제목,기사 링크,기사 출처,기사 내용
33,2012-05-15,"그리스, 연정구성 실패…재선거 불가피",https://news.naver.com/main/read.nhn?mode=LSD&mid=shm&sid1=101&oid=366&aid=0000058796,조선비즈,"15일(현지시각) 연립정권 구성을 위해 다시 모였던 그리스 정당 지도자들이 합의에 실패했다고 로이터통신이 한 참석자를 인용해 보도했다. 총선이 치러진 지 9일이 지났지만 득표 순으로 제1당부터 제3당까지 모두 연정 구성에 실패하면서 재선거가 불가피해졌다. 연정 구성 실패 소식에 유럽 증시는 반락하며 올 들어 최저 수준으로 떨어졌다.카롤로스 파풀리아스 그리스 대통령은 2차 총선 및 국가 부도 상황을 막기 위해 정당 지도자들이 연정 구성에 합의할 것으로 촉구했지만 강력한 긴축을 전제로 한 구제금융에 반대 입장을 표명해온 급진좌파연합(시리자) 알렉시스 치프라스 대표 등이 재선거를 주장하며 반대한 것으로 알려졌다. 구제금융 반대론자들이 끝내 합의를 거부할 경우 파풀리아스는 오는 6월 재선거 실시를 요구할 것으로 예상된다. 이때까지 그리스는 110억유로(144억달러) 규모의 추가 긴축을 약속해야 부도를 막기 위한 구제금융을 받을 수 있다.앞서 장 클로드 융커 유로그룹(유로존 재무장관 회의체) 의장은 그리스의 유로존 탈퇴 문제에 대해 “선전이나 넌센스에 불과하다”며 일축했다. 하지만 적지 않은 수의 유로존 관료와 유럽중앙은행(ECB)은 그리스의 유로존 탈퇴를 공공연하게 드러내놓고 언급하고 있다. 그리스의 한 현지 보수언론도 정치적 교착 상태를 비난하며 “유로존에 남기 위한 연정 구성 합의를 하는 데 시간이 촉박하다”며 “천천히 위기 바깥으로 빠져나오기 위해 노력해야 한다”고 강조했다.[이새누리 기자newworld@chosun.com]조선비즈 핫 뉴스 Bestㆍ한국女 따라잡기 열풍… 중국을 뒤흔든다ㆍ삼성 주력 TV의 '굴욕'… LG TV가 이겼다ㆍ""맛 한번 볼래?"" 김치로 발칵 뒤집은 인기 개그맨?ㆍ독일 엄친車 '빅3' 모두 제친 현대차 비결은…ㆍ기막힌 카톡…삼성 '철통보안' 뚫고 기밀유출?chosunbiz.com"
34,2012-05-15,"숨겼던 사찰 문건엔 “잘라라, 옷 벗겨야, 날려야”",https://news.naver.com/main/read.nhn?mode=LSD&mid=shm&sid1=100&oid=028&aid=0002142038,한겨레,"[한겨레]검찰, 진경락(전 총리실 총괄기획과장) 외장 하드 입수이명박 대통령 비방 의원 뒷조사 지시했던 내용도 있어총리실 공직윤리지원관실(지원관실)의 민간인 사찰과 증거인멸 사건을 재수사중인 검찰이 수백건의 추가 사찰 자료를 확보한 사실이 15일 확인됐다. 진경락(45·구속기소) 전 총괄기획과장이 숨겨놓았던 이들 보고서에는 이명박 대통령을 비방했던 국회의원들에 대한 뒷조사를 지시한 내용이 담겨있어, 지원관실의 ‘정권 보위 기구’ 성격을 더욱 명확하게 설명해주고 있다. 검찰은 새롭게 드러난 사찰 사례의 불법성을 확인하기 위해 수사팀 보강도 검토하고 있다.서울중앙지검 특별수사팀(팀장 박윤해)은 지난달 14일, 대전 전민동의 진 전 과장 여동생 집을 압수수색 하면서 진 전 과장이 맡겨둔 외장하드디스크를 입수했다. 2010년 7월 초 검찰의 압수수색에 대비해 영구삭제한 하드디스크 외에 진 전 과장이 은밀히 보관해왔던 것인데, 검찰이 확보한 사찰 보고서는 총 400여건으로 앞서 공개된 김기현 경정의 이동식저장장치(USB)에서 나온 사찰 보고서와 겹치는 부분도 있다고 한다. 이 외장하드에는 2009년 9~10월 ‘해야 할 일’ 폴더 안에 “백원우·이석현 관련 후원회, 동향, 지원그룹이 실체가 드러나도록 보고”라는 문구가 들어있는 것으로 알려졌다. 행정부 공무원 감찰기구인 지원관실이 직무 범위를 넘어 야당 의원들에 대한 뒷조사를 강도높게 실행했음을 보여주는 대목이다. 그해 1월 ‘해야 할 일’ 폴더에는 “현기환(초선, 사하갑) 의원이 대통령 비방. 친박 쪽으로 9일 상경. 국회의원은 현 의원을, 산하단체는 광주은행 감사(정두언과 친함)를 타깃으로”라는 내용도 들어있는 것으로 전해졌다. 이명박 대통령을 비방하는 정치인이라면 여야를 가리지 않고 표적사찰을 통해 혼내주겠다는 의도가 보인다. 이밖에도 한국학중앙연구원장, 대덕연구개발특구 지원본부 이사장, 농업유통공사 사장 등 정부 산하기관장들의 문제 있는 행태를 거론하며 “따라붙어서 잘라라, 옷 벗겨야”라며 사찰을 통해 압력을 행사해야 한다는 내용도 있는 것으로 전해졌다. “날려야 한다”며 정부 부처 고위공무원의 이름도 적시한 것으로 알려졌다.지난 3월 법원 재판기록을 통해 공개된 김기현 경정의 이동식저장장치(USB)에서 나왔던 사찰 자료는 대부분 공직자 감찰 보고서였고 민간 부문으로 보이는 사찰 대상자도 이름과 소속 정도만 열거돼있는 정도였다. 이에 비해, 재수사팀이 추가로 입수한 사찰 자료는 정치인의 후원자 등 ‘배후세력’을 조사하라고 할 정도로 ‘작업’의 내용이 구체적이다. 또 친박 여당 의원이 이명박 대통령을 비방했기 때문에 사찰 대상에 올랐다는 점을 분명히하고 있다. 지원관실이 정권 초 이명박 대통령의 하야 요구로까지 번졌던 ‘촛불 잡도리’에서 시작해 ‘엠비 보위 기구’로서 역할을 충실히 한 셈이다.검찰은 새로 드러난 지원관실의 정치인·공직자 사찰의 불법성을 수사중이다. 검찰 관계자는 “(이런 사찰 활동이) 불법인지 아닌지, 직무범위인지 아닌지 이견이 있을 수 있다”며 “사찰 사례로 보이는 부분은 전부 스크린을 해서 불법성 여부를 판단할 예정”이라고 말했다.김태규 기자dokbul@hani.co.kr<한겨레 인기기사>■‘나경원 기소청탁’ 밝힌 박은정 대검서 감찰■‘성폭행 혐의’ 고영욱, 피해자 2명 더 있다■폭행당한 조준호 전 대표, 목 디스크 수술■‘빨래판 근육’ 자랑한 육상선수 기록도 좋을까?■임신한 아내를 위한 남편의 성 역할공식 SNS[통하니][트위터][미투데이]| 구독신청[한겨레신문][한겨레21]Copyrights ⓒ 한겨레신문사, 무단전재 및 재배포 금지<한겨레는 한국온라인신문협회(www.kona.or.kr)의 디지털뉴스이용규칙에 따른 저작권을 행사합니다.>"
35,2012-05-15,"美 포트리시 ""보행 중 문자, 범칙금 10만 원""",https://news.naver.com/main/read.nhn?mode=LSD&mid=shm&sid1=104&oid=055&aid=0000227795,SBS,"<앵커>걸어 다니면서 휴대전화로 문자메시지 보내기. 대부분의 사람들이 하고있는 행동이지만 생각보다 위험한 습관입니다. 미국의 한 도시에선 보행하면서 문자를 보내는 사람에게 범칙금 10만 원을 물리기로 했습니다.정유미 기자입니다.<기자>뉴스 생방송 도중 기자 뒤편에서 휴대전화로 문자를 보내며 걷던 여성이 발을 헛디디며 계단에서 굴러 떨어집니다.또 다른 여성은 문자를 보내는데 온 정신을 쏟다 분수대에 빠져 버렸습니다.[분수대에 빠졌던 여성 : 걸으면서 문자 보내지 마세요. 저는 버스나 차에 치였을 수도 있었어요. 사고는 어디서든 일어날 수 있습니다.]뉴욕 스토니 부룩대 연구팀은 문자를 보내며 걸을 경우 길에서 벗어날 가능성이 그냥 걸을 때보다 60% 더 높다는 연구 결과를 내 놓았습니다.그만큼 사고가 날 가능성이 커진다는 겁니다.자율적인 규제로 해결이 안 되자 미국 뉴저지주의 포트리시는 아예 보행중 문자 전송을 금지시켰습니다.적발될 경우 85달러, 우리돈 10만 원 정도의 범칙금까지 매기기로 했습니다.주민들은 지나친 규제라는 반응입니다.[로드리게스 : 걸으면서 문자 보냈다고 과태료를 물게 되면 정말 화가 날 것 같은데요.][에리카 : 걸으면서 문자를 보내도 앞에 뭐가 있는지 알 수 있어요. 또 소리는 들리잖아요.]시 당국은 그러나 주민의 안전을 위해 반드시 필요하다며 단속을 계속해 나가겠다고 밝혔습니다.(영상편집 : 염석근)정유미 기자yum4u@sbs.co.kr☞[SBS기자들의 생생한 취재현장 뒷이야기 '취재파일']☞ SBS뉴스 공식 SNS [SBS8News 트위터] [페이스북] [미투데이] [요즘]저작권자 SBS&SBS콘텐츠허브 무단복제-재배포 금지"
36,2012-05-15,때이른 더위에 배추 상품가치 하락…농가 울상,https://news.naver.com/main/read.nhn?mode=LSD&mid=shm&sid1=101&oid=055&aid=0000227799,SBS,"<앵커>초봄에는 추위 때문에 걱정이더니 요즘은 더위 때문에 배추 농사 짓는 농민분들 걱정이 많습니다. 벌써 배추 속에 꽃이 피어서 상품가치가 떨어지고 있습니다.정형택 기자가 취재했습니다.<기자>요즘 낮 기온은 한여름 기온인 섭씨 28도를 넘기기 일쑤입니다.하우스에서 재배하는 배추 잎은 바싹 말라갑니다.배추에 노란 꽃까지 피기 시작했습니다.보기엔 멀쩡한 배추처럼 보이지만, 속을 쪼개 들여다 보면 꽃대가 이미 5cm 넘게 자라 있습니다.불과 며칠 새 꽃이 피기 때문에 상품성이 급격히 떨어질 게 우려됩니다.이렇게 못 쓰게 된 배추, 수확해 봤자라며 통째로 하우스를 갈아엎는 농가가 속출하고 있습니다.[양삼석/배추 재배 농민 : 할아버지가 84살이거든. 할아버지랑 둘이 아주 힘들게 지은 거야, 이거. 그런데 이렇게 갈아엎게 되니 이걸 어떻게 하면 좋아.]지난달 말 하우스 봄배추는 도매가 기준으로 한 포기에 3500원을 웃돌면서 '금 배추'라는 얘기까지 나올 정도였습니다.하지만, 가격안정을 위해 정부가 비축분을 풀고 중국산 배추를 들여오면서 포기당 1700원까지 반토막 났습니다.폭락한 배춧값 때문에 수확을 미뤘다가 이른 더위에 해를 입은 겁니다.[구자건/배추 재배 농민 : 제 날짜에 작업을 못 하니까 가격이 폭락해 가지고. 이게 벌써 다 나갔어야 할 배추예요.]배추 대신 수박 같은 여름작물을 심으려 해도 갈아엎은 배추가 다 썩을 때까지 기다려야 합니다.[장완상/배추 재배 농민 : 배추를 갈아엎으면 후작을 못 들어가요. 한참을 못 들어가. 한 달은 못 들어가. 이게 썩어서, 발효돼서 가스가 나갈 때까지 기다려야하니까.]천정부지로 치솟던 배춧값이 안정돼 소비자 입장에선 다행이지만 봄 농사를 망친 배추 농가들은 시름이 깊어가고 있습니다.(영상취재 : 조춘동, 영상편집 : 이승열)정형택 기자goodi@sbs.co.kr관/련/정/보◆ 국내산 배추, 'Kimchi Cabbage'로 국제적 등재◆ 봄철 햇배추 가격 작년의 3배 이상 폭등◆ `배추 대란 막아라' 중국산 배추 수입◆ 대형마트, 월동 배추 도매가보다 싼 값에 '방출'☞[SBS기자들의 생생한 취재현장 뒷이야기 '취재파일']☞ SBS뉴스 공식 SNS [SBS8News 트위터] [페이스북] [미투데이] [요즘]저작권자 SBS&SBS콘텐츠허브 무단복제-재배포 금지"
37,2012-05-15,"여수 엑스포, 개장 후 최대 인파 몰려 '방긋'",https://news.naver.com/main/read.nhn?mode=LSD&mid=shm&sid1=102&oid=055&aid=0000227804,SBS,"<앵커>여수 엑스포가 개장 나흘째로 접어들었습니다. 그동안 관람객이 좀 적어서 조직위가 고민했는데 오늘(15일) 개장 이후 가장 많은 인파가 몰렸습니다.이호건 기자가 보도합니다.<기자>여수 엑스포장 앞 사거리가 관람객을 태운 버스들로 가득 찼습니다.한산했던 매표소는 인파로 북적이고, 검색대 앞에는 긴 줄이 생겼습니다.이른 아침부터 각 입구마다 엑스포장에 입장하려는 관람객들로 장사진을 이뤘습니다.[새치기하지 마시고요. 천천히 입장해주세요. 감사합니다.]아쿠아리움을 비롯한 인기 전시관들은 오후 1시가 되자 이미 야간 관람까지 예약이 끝나버렸습니다.[정아연/행사진행요원 : 예매 끝났는데 지금 키오스크도 예매 마감된 상태라서 모바일로 한 번 이용해보시고 운 좋으시면 5시쯤 있고.]어제 비로 취소됐던 야외공연들이 재개되면서 엑스포장은 모처럼 활기를 띠었습니다.인기 전시관은 물론 최첨단 디스플레이 기술을 선보이고 있는 국내 기업관들에도 관람객들의 발길이 하루종일 이어졌습니다.역동적인 영상이 압권인, 움직이는 벽면 디스플레이는 관람객들의 인기 1순위입니다.54개의 대형 LED로 구성된 미디어 샹들리에가 관람객들의 시선을 사로잡습니다.[김현욱/경기도 성남시 : 오늘 날씨도 좋고, 평일이라 사람들도 적을 것 같아서 왔는데 생각보다 사람들도 많아서 볼거리도 많고 정말 즐겁습니다.]오늘 엑스포장을 찾은 관람객은 4만 명에 육박해 개장 이후 최대 인파가 몰렸습니다.엑스포 조직위는 혼잡을 우려해 주말을 피했던 관람객들이 한산할 것으로 예상되는 평일에 몰리고 있는 것으로 분석했습니다.특히 단체 관람객들이 눈에 띄게 늘고 있는 만큼 시간이 지날수록 관람객이 더욱 늘어날 것으로 기대했습니다.(영상취재 : 김성일·설민환, 영상편집 : 염석근)이호건 기자hogeni@sbs.co.kr관/련/정/보◆ 여수 엑스포, '큰 손' 중국 관광객 유치 총력◆ 여수 엑스포, '노르웨이의 날' 행사…얄궂은 비 걱정◆ '아쿠아리움' 앞에 긴 줄…엑스포 최고 스타는?◆ 여수 엑스포 개막 이틀째…관람객 유치 비상☞[SBS기자들의 생생한 취재현장 뒷이야기 '취재파일']☞ SBS뉴스 공식 SNS [SBS8News 트위터] [페이스북] [미투데이] [요즘]저작권자 SBS&SBS콘텐츠허브 무단복제-재배포 금지"
38,2012-05-15,아파트 '구경하는 집' 놓고 이권 다툼·폭리 만연,https://news.naver.com/main/read.nhn?mode=LSD&mid=shm&sid1=102&oid=055&aid=0000227810,SBS,"<앵커>새 아파트에 입주하면 동마다 '구경하는 집'이 한 채씩 있지요. 여기 설치된 인테리어 제품들 보고 구입할지 말지를 결정하는 입주자들이 많습니다. 그런데 이 구경하는 집, 업체들끼리 이권다툼에 바가지 상혼까지 문제가 적지 않습니다.정경윤 기자가 현장 취재했습니다.<기자>입주를 앞둔 한 임대아파트 앞, 인테리어 업자들과 경호업체 직원들 사이에 격렬한 몸싸움이 벌어집니다.입주민들과 계약을 따내기 위해 아파트 단지에 들어가려는 업자들을 경호원들이 막아서는 겁니다.끌려나가지 않기 위해 주저앉거나 드러눕는 사람이 속출합니다.경호원들을 고용한 이들은 '전국구'란 이름의 연합회, 다름 아닌 같은 인테리어 업자들입니다.회원이 아닌 다른 인테리어 업자를 막아 아파트 동마다 들어서는 '구경하는 집'을 독점하는 게 목적입니다.결국 개인 인테리어 업자들은 아파트 입주민과의 계약을 한 건도 따내지 못하는 구조입니다.[피해 인테리어 업자 : 망신을 당하고 현장에 못 들어가고, 더 크게 싸우면 이 계통에서 영원히 왕따가 되니까 크게 싸우지도 못합니다.]횡포는 여기서 끝나지 않았습니다.전국구 연합이 책정한 가격표입니다.시중에 판매하는 인테리어 제품 원가의 2배가 넘는 가격으로 영업해 왔습니다.이들 연합회는 이 아파트 단지 13개 동 가운데 11개 동의 구경하는 집을 장악하고 가격을 담합했습니다.입주민들은 자신들의 인테리어 설치 비용이 비싸다는 사실을 모를 수 밖에 없었습니다.방범창은 15만 원, 전자 번호키 18만 원, 빨래 건조대 15만 원 등 3종류만 해도 45만 원이 넘습니다.[이경현/A 아파트 입주민 : 좀 비쌌습니다. 세 군데 다 돌아다녀봐도 거기서 거기고. 그래서 그 중에서 단 만 원이라도 싼 데 했는데 다 그게 그거더라고요.]전국구 업자들이 개입하지 않은 다른 아파트를 찾았습니다.빨래 건조대 설치 비용은 단 3만 원에 그쳤고, 전자 번호키도 15만 원을 넘지 않습니다.[백정아/B 아파트 입주민 : 전단지같은 경우 보고 여러군데를 보고 싸게 선택을 했죠. 전혀 불편한 거 못 느껴요. 그냥 잘 구했다고 생각을 하는데.]이권을 독점하는 과정에서 드는 비용을 입주민들에게 전가한 겁니다.경찰은 지난 2010년부터 30차례에 걸쳐 전국의 임대아파트를 돌며 인테리어 업자를 폭행하고 영업을 방해한 혐의로 전국구 연합 회원 손 모 씨를 구속하고 19명을 불구속 입건했습니다.(영상편집 : 김경연, VJ : 신소영, 화면제공 : 경기경찰청 광역수사대)정경윤 기자rousily@sbs.co.kr관/련/정/보◆ 아파트 일부 공간 임대 '멀티홈' 늘어난다◆ `수도권 아파트는 애물단지' 지방 오를 때 급락◆ '아파트 공사 소음피해 가구당 44만 원 배상'◆ 아파트 관리비 옆단지와 상세 비교 가능해☞[SBS기자들의 생생한 취재현장 뒷이야기 '취재파일']☞ SBS뉴스 공식 SNS [SBS8News 트위터] [페이스북] [미투데이] [요즘]저작권자 SBS&SBS콘텐츠허브 무단복제-재배포 금지"
39,2012-05-15,새누리당 대표에 황우여… ‘박근혜 친정체제’ 마무리,https://news.naver.com/main/read.nhn?mode=LSD&mid=shm&sid1=100&oid=032&aid=0002218544,경향신문,"15일 경기 고양시 킨텍스에서 열린 새누리당 첫 전당대회에서 1위로 당선된 황우여 대표가 박근혜 전 비상대책위원장으로부터 당기를 전달받고 있다. | 박민규 기자ㆍ원내 이어 당도 ‘친박’ 장악… 박근혜 “이제는 대선”새누리당을 이끌어갈 초대 당 대표로 친박계의 전폭적 지지를 받은 5선의 황우여 전 원내대표(65)가 선출됐다. 대표를 포함한 최고위원 5명 중 4명이 친박계로 채워졌다. 친이계로는 심재철 의원만 당선됐다.황 대표는 15일 경기 고양시 일산 킨텍스에서 열린 제1차 전당대회에서 선거인단 투표와 여론조사를 합친 총득표율 30.7%를 획득하면서 새누리당 초대 대표가 됐다.황 대표는 대표직 수락 연설에서 “당 화합을 제1의 과제로 삼겠다”며 “줄기찬 당 쇄신을 국민의 눈높이에 맞춰 꾸준히 힘차게 진행하겠다”고 말했다.이혜훈 의원은 14.8%로 2위를 차지했다. 당헌·당규에 따라 여성 배려 차원 최고위원으로 확정됐지만, 자력으로 2위에 오른 것이다.심재철(11.8%), 정우택(11.5%), 유기준(10.0%) 후보가 뒤를 이었다.새누리당은 이날 전대를 통해 5개월간의 비상대책위원회 체제를 마무리하고 명실상부한 ‘박근혜 친정체제’를 완결했다.지난 9일 치러진 원내대표 선거에서 이한구 원내대표-진영 정책위의장이 당선되며 ‘친박 원내사령탑’을 구축한 데 이어, 새 지도부 대부분이 친박근혜계 인사로 구성된 것이다. 황 대표는 특히 득표율에서 2위를 두 배가량 앞서는 압도적 1위를 차지하며, ‘친박 몰표’의 위력을 과시했다.친박의 친정체제는 더욱 강화될 것으로 보인다. 지명직 최고위원 2명에는 호남 몫으로 박근혜 전 비대위원장의 핵심 측근인 이정현 의원이 거론되고 있다.관행상 원내 다수당이 맡아온 국회의장 자리에는 6선의 친박계 중진인 강창희 당선자가 유력하게 검토되고 있다는 후문이다. 대표가 임명하는 사무총장에는 서병수, 최경환, 안홍준, 유정복 의원 등 친박계 의원들의 이름이 오르내린다.이제 당의 대주주인 박 전 위원장은 대선을 염두에 두고 있다. 박 전 위원장은 이날 연설에서 “대선이 7개월 남았다. 우리에게 나라를 살리고 국민의 미래를 책임져야 하는 역사적 책무가 있다”며 “저 박근혜, 그 길에 여러분과 항상 함께하겠다”고 말했다.이번 지도부의 최대 과제는 정권 재창출을 위한 발판을 마련하고, 8월 말~9월 초 대선 경선 준비 등 대선관리를 공정하면서도 유권자의 주목을 끌도록 하는 일이다.하지만 비박계를 중심으로 반발 기류가 강하게 형성되고 있다. 친박 일색의 지도부가 당내 대선후보 경선을 공정하게 관리할 수 있겠느냐는 의문도 나온다.한 친이계 인사는 “전대가 박근혜 경선캠프 뽑는 것과 다를 게 뭐가 있느냐”며 “어차피 한 사람이 들어간다고 해도 무슨 소리를 내며, 소리를 낸다고 해도 반향이 없을 것”이라고 말했다. 앞서 전대를 앞두고 친박계 핵심 인사들이 차기 지도부를 내정했다는 ‘전대 각본’ 논란도 빚어졌다. 비박계 대선주자들이 반발하자 박 전 위원장이 직접 나서 “당이 자멸할 수 있다”고 경고했다.당·청 관계는 사실상 단절 수준이 될 것이라는 관측이 높다.이한구 원내대표는 민주통합당 등 야당의 권력형 비리 특별검사제 요구에 “여당이라는 이유로 이명박 대통령 등 청와대를 보호할 필요가 없다”고 선을 그은 바 있다.<이용욱·이지선·강병한 기자 woody@kyunghyang.com>[관련기사]▶ ‘친박 대세론’에 새누리 첫 전대 밋밋▶ 황우여 “당 화합 최우선… 대선 경선 공정 관리”▶ 심재철 3위로 선전… ‘친이’ 영향력 확인모바일 경향[New 아이폰 App 다운받기!]| 공식 SNS 계정[경향 트위터][미투데이][페이스북][세상과 경향의 소통 Khross]- ⓒ 경향신문(www.khan.co.kr), 무단전재 및 재배포 금지〈경향신문은 한국온라인신문협회(www.kona.or.kr)의 디지털뉴스이용규칙에 따른 저작권을 행사합니다.〉"
