,날짜,기사 제목,기사 링크,기사 출처,기사 내용
0,2009-07-31,"상수도관 파열, '120톤 콸콸'‥주민 피해",https://news.naver.com/main/read.nhn?mode=LSD&mid=shm&sid1=102&oid=214&aid=0000112863,MBC,"[뉴스데스크]◀ＡＮＣ▶서울 도심에서 낡은 상수도관이 터지면서 난데없이 물난리가 났습니다.도로가 내려앉고 가로등이 뽑히는 등 일대가 아수라장이 됐습니다 .최훈 기자입니다.◀ＶＣＲ▶오늘 오후 서울 약수동.3차선 도로와 인도가완전히 물에 잠기면서,아예 도심 하천처럼 변해버렸습니다.한쪽 바닥에선아직도 물이 쏟아져 나옵니다.오후 4시 반쯤, 지하에 매설돼있던상수도관이 갑자기 터지면서,수돗물 120톤이 솟구쳐 흘러 나왔습니다.이 압력을 이기지 못하고가로 4미터 세로 5미터 넓이의 도로는깊이 1미터 아래로 아예 내려앉았고,가로등은 뽑혀 쓰러져있습니다.인근 상가의 지하 노래방은1시간 동안이나 허리 높이까지물에 잠겼습니다.◀ＩＮＴ▶ 선혜진(20살)/인근 편의점 점원""물소리가 나서 나가보니까계단으로 물이 계속 유입되고 있어서깜짝 놀라가지고...""상수도관이 터지면서인근 상가 10개 동에는30여 분간 수돗물 공급이 중단됐고,도로도 완전히 통제 되면서이 일대 교통은 극심한 혼잡을 빚었습니다.지금은 물이 빠지면서1개 차로를 제외한 2개 차로에서통행이 재개됐습니다.수도사업소와 경찰은상수도관이 낡아 한 쪽이 깨지면서물이 흘러나온 것으로 보고,복구공사를 벌이고 있습니다.MBC 뉴스 최훈입니다.(최훈 기자)[저작권자(c) MBC (www.imnews.com) 무단복제-재배포 금지]"
1,2009-07-31,발바닥이 '찌릿찌릿'…멋 부리려다 '발병' 난다,https://news.naver.com/main/read.nhn?mode=LSD&mid=shm&sid1=103&oid=055&aid=0000164229,SBS,"<8뉴스><앵커>미국의 시트콤에서 여주인공이 신고나와 세계적으로 유행을 시킨 여름 신발들이 있습니다. 그런데 이 신발들때문에 요즘 젊은 여성들 사이에 퇴행성 질환인 족저근막염 환자가 급증하고 있습니다.조동찬 의학전문기자가 취재했습니다.<기자>영화에 나온 전사들의 신발과 비슷해서 이름 붙여진 ""글라디에이터 샌들""과 일명 ""쪼리""라고 불리는 슬리퍼 입니다.이들 신발을 즐겨 신던 20대 여성은 족저근막염으로 병원을 찾았습니다.[송현경/족저근막염 환자 : 엄지발가락 쪽하고 뒤꿈치 쪽이 무뎌지면서 전기 오는 것처럼 찌릿찌릿 했고.]한 정형외과병원 조사결과 7월에서 9월사이에 족저근막염환자가 다른 달에 비해 두배 가량 증가했습니다.[김창우/정형외과 전문의 : 퇴행성 변화로 생기기 때문에 주로 장년층 이후에 많이 발생했는데요. 최근에는 젊은 여성들에서도 여름철에 특히 발생률이 높게 일어나고 있고요.]이들 신발이 발에 어떤 영향을 주는지 실험해봤습니다.운동화를 신었을 때는 압력이 발 전체에 골고루 퍼지나, 글라디에이터 샌들에서는 발바닥 가운데 집중되는 것을 볼수 있습니다.평편한 슬리퍼는 압력을 받는 중심선이 운동화 처럼 일정하지 않고 좌우로 변동이 심합니다.[문광섭/한국신발·피혁연구소 공학박사 : 슬리퍼의 경우는 보행시 압력의 중심이 좌우로 많이 흔들리는 경향이 보입니다. 무릎이나 발목에 어떤 이상을 줄 수 있는 부하를 많이 걸리게 하는 그런 원인이….]바닷가에서는 제법 잘 어울리는 신발이지만, 장시간 챡용했을 경우에는 발의 노화가 촉진됩니다.조동찬dongcharn@sbs.co.kr관/련/정/보◆ '터치폰' 인기에 손가락·손목은 괴롭다◆ '고3병' 실제로 있었네…10명 중 3명 치료 필요◆ [건강] 헬스기구도 잘 골라 사용해야  '효과적'◆ [건강] 휴가철 '퀵 성형', 이런 점을 주의하세요◆ 염색하고 병원신세…염색약 잘못쓰면 '위험'[SBS기자들의 생생한 취재현장 뒷이야기 '취재파일']저작권자 SBS&SBSi 무단복제-재배포 금지"
2,2009-07-31,삶의 향기 가득한 산나물 세상,https://news.naver.com/main/read.nhn?mode=LSD&mid=shm&sid1=103&oid=036&aid=0000020487,한겨레21,"[한겨레21]화순 백아산 ‘산채원’에 200여 종… 2년여 가꿔온 김규환씨 “귀향은 몸으로 살아가는 노동의 시작”전남 화순 백아산(810m) 대판골. 백아산 자락 5부 능선에서 정상 부근까지 30만 평의 땅에 200여 가지 산나물이 자라고 있다. 우리나라 최초의 산나물공원 ‘산채원’이다. 산나물공원에 오면 눈이 즐겁고 입이 즐겁다. 코끝을 간지럽게 하는 산나물 향기에 취해 하염없이 걷다 보니 가슴이 탁 트이고 머리가 맑아진다. 물론 농약은 한 방울도 치지 않는다.해발 800여m 숲 속이라 중복이 가까워오는데도 여기저기 봄나물이 자란다. 새로 난 잎을 따서 입에 넣고 맛을 보았다. 뱉고 싶을 정로로 쓴맛이더니 나중엔 오묘한 단맛으로 남았다. 그게 나물맛이라 했다. 쓴맛을 보고 나면 단맛이 온다. 그게 삶의 맛이라 했다.비닐하우스도 아니고 밭에서 기르는 것도 아니어서 수확은 적더라도, 최소한의 손길만 들여 키우니 자연상태에 가장 가깝다. 향이 그윽하고 부드럽기 그지없으며 각종 효능이 그대로 살아 있으니 진짜배기 명품이 아니겠는가.‘그 나물에 그 밥’이 아니다. 된장 덩어리에 밥만 싸가지고 골짜기로 들어가면 ‘산해진미’가 기다린다. 찾았다, 곰발바닥! ‘산나물의 제왕’ 곰취는 곰발바닥을 닮았는데, 곰이 겨울잠에서 깨어나 제일 먼저 맛보는 풀이어서 곰취라고 한단다. 야들야들한 것을 된장에 싸서 먹으면 이보다 더 향기로울 수 없다.김규환(43)씨가 산채원을 이루기 위해 고향인 백아산 골짜기로 들어온 데는 이유가 있다. 상수원 최상류라 오염도 되지 않았고 오염을 시켜서도 안 되는 곳에 청정 ‘산나물 천국’을 만들고 싶었다. 아내와 아들 해강, 딸 솔강이와 함께 2006년 11월 봇짐을 싸서 고향인 송단마을로 돌아왔다. 새벽 3시면 일어나 손이 부르트도록 괭이질과 낫질을 해가며 산나물밭을 만들었다. 강원도까지 가서 이곳저곳 산을 훑으며 산나물 씨앗을 구해다 이곳에 뿌렸다.산채원 일을 함께 하게 된 동네 할머니들의 삶에도 생기가 돈다. 산골짜기에서 평생 산나물을 조물조물 무쳐 밥상에 올리던 동네 할머니들은 누구보다 잘 알고 잘하는 일을 하게 됐으니 새삼 의욕이 솟는다.그러기를 2년여. 현재 화순 북면 산나물 농가는 8가구로 늘었고, 북면은 산나물 특화사업단지로 지정됐다. 김씨는 “산나물은 건강식품과 수출 품목으로 농가소득을 이뤄줄 대체 작목으로도 기대된다”며 “산나물로 농업소득을 창출해 젊은이들이 다시 농촌으로 돌아오도록 하고 싶다”고 포부를 밝혔다.냉이 씨앗을 털어내고, 파드득나물(반듸·가짜 참나물)을 낫으로 베고, 삼잎국화밭을 매고, 곤드레밭 풀을 뽑고, 곰취밭을 살피고, 누룩취을 옮겨 심고, 취나물을 삶아 널고…. 나물로 하루해가 진다. 김씨는 “내게 귀향은 대박을 꿈꾸는 환상이 아니다. 몸으로 살아가는 노동의 시작일 뿐”이라고 말했다.화순=사진·글 류우종 기자wjryu@hani.co.kr세상을 보는 정직한 눈 <한겨레>  [한겨레21 구독|한겨레신문 구독]ⓒ 한겨레신문사, 무단전재 및 재배포 금지<한겨레는 한국온라인신문협회(www.kona.or.kr)의 디지털뉴스이용규칙에 따른 저작권을 행사합니다.>"
3,2009-07-31,받자 버리는 '천덕꾸러기' 종이 영수증…낭비,https://news.naver.com/main/read.nhn?mode=LSD&mid=shm&sid1=102&oid=079&aid=0002079531,노컷뉴스,"필요 따라 선택 출력, 시스템 교체 어렵지 않아[노컷뉴스 이명주 기자]#.직장인 A(32) 씨는 회사 건물 내 편의점을 갈 때면 눈에 늘 밟히는 것이 있다.주로 아침용 샌드위치나 오후 간식 등 소액결제가 잦은 A 씨는 현금 영수증 발급 과정이 귀찮아 주로 카드를 사용하는데, 이 경우에도 매번 받아드는 종이 영수증이 여간 성가신게 아니다.그래서 점원에게 ""그냥 버려달라""기 일쑤. 그러나 계산대 안에 놓인 수북한 종이 영수증 쓰레기를 보면 '아깝다'는 생각이 든다.#.또다른 직장인 B(35) 씨는 출퇴근길 카드 택시를 종종 이용한다. 미처 현금을 준비해놓지 못했기 때문이다.그런데 가뜩이나 급하거나 피곤한데, 영수증이 필요치 않은데도 굳이 종이 영수증을 받기 위해 차 안에서 기다리는 것이 짜증스럽다.운전기사에게 미리 ""영수증 안 주셔도 되요""라고 말해봤지만, ""다 나오는 거니까 받아가요""라는 핀잔만 돌아왔다.◈손님 원치 않으면 전산 입력만물론 꼬박꼬박 영수증을 챙겨 가계부를 쓰고, 월말이나 연말 자신의 소비 내역을 짚어보는 것은 검소한 생활을 위한 중요한 습관!그러나 굳이 필요치 않은 경우에도 억지로 발급되는 종이 영수증이라면?목동의 G 편의점. 이 곳에서 아침 6시부터 밤 8시까지 근무하는 점원에 따르면, 하루에 꾹꾹 눌러담은 종이 영수증 쓰레기가 담배 박스로 매일 한 상자 이상 배출된다고 한다. 영수증이 필요한 손님에게만 선택 출력할 수 없냐고 묻자 ""일괄적으로 (영수증이) 나오기 때문에 낭비인 건 알지만 어쩔 수 없다""고 설명했다.그러나 바로 길 건너편 건물 내에 있는 H 편의점의 사정은 달랐다. 현금과 카드 결제 모두 영수증이 출력되는 G 편의점과 달리, 현금 결제시에는 영수증이 발급되지 않았고, 손님이 요청할 경우에만 출력 버튼을 눌러 영수증을 지급하고 있었다.H 편의점의 홍보팀 이 모 주임에 따르면, 일명 '차세대 포스'라고 불리는 이 새로운 소프트웨어는 ""불필요한 자원낭비를 막고, 발생비용을 줄이는 차원""에서 점주들이 먼저 제의를 해왔고, 새로 개발한 소프트웨어를 지난 5월 말부터 적용, 현재 전국 4400여 지점 중 95%에 시스템 구축이 완료됐다고 전했다.그 결과, 보통 하루 반에 1개 소모되던 감열지(영수증 용지)가 15일에 1개 정도 소모되고, 결과적으로 각 점포에서 영수증 발급이 필요한 경우에만 거래내역조회를 통해 영수증을 출력함으로써 22% 가량의 비용절약효과가 나타나고 있다. 현재는 카드 결제시에도 선택 출력할 수 있도록 해당 시스템을 확대 개발하고 있는 중이다.조사결과 1200개의 점포를 가진 M 편의점은 이러한 소프트웨어 전환을 논의한 바는 있으나 ""고객 알 권리를 중시하고, 환불이나 반품과 같은 경우를 대비해 일괄 영수증 지급 체계를 유지하고 있다""고 밝혔다.앞서 언급된 3500여 점포를 가진 G 편의점의 경우에는 각 지점의 경영주들이 포스 시스템을 결정할 수 있도록 해놓았지만, 손님들이 많을 때 일일이 영수증 필요 여부를 확인하는 것도 성가신데다, 아르바이트생들의 기기 조작 미숙 등을 이유로 선택 출력이 가능한 소프트웨어가 구비되어 있지만 대부분의 지점에서 사용하지 않는 것으로 드러났다.2000여 점포를 거느린 S 편의점의 경우에는 아예 이러한 논의 자체를 한 바 없으며, 이후에도 계속 영수증 일괄 지급 체계를 운영할 방침이라고 전했고, 1400점포를 둔 B 편의점은 2005년부터 전 지점에서 영수증 선택 출력 시스템을 운영해왔지만, 최근 오류 방치 차원에서나 현장 점원들의 편의를 위해 다시 일괄 지급 방식으로 전환하고 있다고 밝혔다.◈""단말기 시스템 교체, 어렵지 않다""택시의 경우는 어떨까?카드택시 서비스업체인 한국스마트카드에 따르면, 6월 기준 개인택시 3만 353대 중 60%, 법인택시 2만 797대 중 90% 이상이 카드 단말기를 사용하고 있다.손님이 현금결제를 할 경우만 제외, T머니는 한 장, 신용카드는 두 장의 종이 영수증이 자동 발급되고 있다.국내 은행 중 유일하게 3만 원 이하 무서명제도를 실시하고 있는 KB카드 홍보팀 관계자에게, 카드 결제시에도 승액이 원하는 경우 영수증을 발급하지 않는 것이 가능하냐고 물었다.김 모 관계자는 ""과거부터 카드를 쓰면 점표를 받는 것이 습관화 되어 있을 뿐, 이용자의 동의가 있다면 이를 생략하는 것은 결코 어려운 부분이 아니라""고 설명했다.한국스마트카드 전산 담당 관계자도 ""서울시에서 정책을 결정하면 그에 따르는 것이지만, 영수증을 선택 출력하는 단말기 프로그램을 적용하는 것은 가능하다""고 전했다.2004년 5월 버스 준공영제 시행 초기, 버스회사 수익 배분을 위해 현금 승차하는 승객들에게 영수증이 자동 발급되었다.그러나 굴비처럼 줄줄이 엮여 나오는 종이 영수증을 받아가는 이가 없어, 운전자가 단말기 아래에 휴지통을 놓아두는 진풍경이 연출되기도 했다. 이렇게 낭비된 용지가 한해에 2억 1천여만 원에 달했다.서울시 교통기획과는 이러한 오류를 바로 잡기 위해 현금 승차자 카운터 기능은 유지하고 영수증은 선택 출력하는 시스템을 2006년 말부터 적용, 현재는 손님이 요구할 경우에만 종이 영수증을 발급하고 있다고 했다.자동 출력에서 선택 출력으로 단말기 프로그램을 교체하는 데는 약 3개월, 추가비용은 들지 않은 것으로 나타났다.이처럼 업계 관계자들이 낭비를 줄이고 자원을 아끼려는 의식만 갖고 있다면, 충분히 현재의 영수증 체제에서 발급 횟수를 줄임으로써 비용 절감을 할 수 있다.ymj5757@cbs.co.kr[관련기사]●종이 세금고지서 사라진다●모든 민원발급 비용을 교통카드 하나로 터치!●카드결제 택시 6천대 더 늘린다..2011년에는 모든 택시로 확대●종이팩 분리수거함 설치 아파트 8% 불과(대한민국 중심언론 CBS  뉴스FM98.1 / 음악FM93.9 / TV CH 412)<저작권자 ⓒ CBS 노컷뉴스(www.nocutnews.co.kr) 무단전재 및 재배포 금지 >"
4,2009-07-31,제주 용천동굴 길이 3㎞ 넘어..바다와 연결,https://news.naver.com/main/read.nhn?mode=LSD&mid=shm&sid1=102&oid=001&aid=0002791246,연합뉴스,"제주 용천동굴 호수 탐사(제주=연합뉴스) 김승범 기자 = 제주도가 세계자연유산지구인 용천동굴에 대한 종합학술조사를 진행하며 호수를 탐사하고 있다.2009.7.31 ≪지방기사 참조≫    ksb@yna.co.kr도기.동물뼈 등 발견 ""사람 산 흔적""(제주=연합뉴스) 김승범 기자 = 유네스코 세계자연유산지구인 제주도 거문오름 용암동굴계의 용천동굴의 길이가 3천ｍ를 넘고, 끝 지점의 호수는 바다와 연결됐을 가능성이 매우 큰 것으로 나타났다.제주도 세계유산관리본부는 사단법인 한국동굴연구소(책임교수 우경식)에 의뢰해 지난해 7월부터 1년간 용천동굴에 대한 종합학술조사를 실시한 결과 길이는 2005년 발굴 당시 측정된 2천470ｍ보다 긴 2천960ｍ(주굴 2천590ｍ, 지굴은 370ｍ)로 확인됐다고 31일 밝혔다.용역팀은 그러나 동굴의 끝 지점에 있는 호숫가 200ｍ 정도 노출되다가 이후부터는 완전히 물에 잠겨 조사원이 접근할 수 없는 상태여서, 수중에 추가로 연장된 동굴을 감안하면 총 연장은 3천ｍ를 훨씬 넘을 것으로 추정했다.제주 용천동굴의 동굴팝콘(제주=연합뉴스) 김승범 기자 = 세계자연유산지구인 용천동굴의 동굴팝콘.2009.7.31 ≪지방기사 참조≫    ksb@yna.co.kr호수는 평균 수심이 8∼10ｍ로 지표수에 비해 염분 함량이 높았으며, 수위는 인근 바다의 조석 간만의 차에 의해 최고 175㎝까지 변동하는 것으로 나타났다.동굴 내부에는 다양한 형태의 용암동굴 생성물과 2차 탄산염 생성물이 조사됐는데, 특히 기형으로 성장하고 있는 석회 생성물의 종류가 많은 것은 동굴 내부로 유입된 식물뿌리의 영향을 받은 때문으로 분석됐다.또한 용천동굴 바닥 곳곳에서 숯, 도기, 철창, 돌탑, 전복 및 조개 껍데기를 비롯해 쥐, 사슴, 멧돼지, 족제비 등의 동물 뼈가 발견돼 과거 사람이 출입했던 것으로 확인됐다.이를 방사성 동위원소 분석법으로 절대연령을 측정한 결과 숯은 서기 420∼820년, 전복 및 조개 껍데기는 서기 240∼440년, 나무는 570∼780년의 범위를 보였다.이와 함께 대부장경병과 인화문원통형도기병 등 7세기 말에서 8세기 말 사이로 추정되는 도기들이 나타났으며, 특히 동굴의 호수바닥에는 상태가 양호한 10여개의 도기가 존재하는 것으로 조사됐다.제주 용천동굴 용암석순(제주=연합뉴스) 김승범 기자 = 세계자연유산지구인 용천동굴의 용암석순.2009.7.31 ≪지방기사 참조≫    ksb@yna.co.kr동굴 내부에 유입되는 유입수의 수질을 분석한 결과 비료에 포함된 질산염이 100ppm 이상으로 동굴 주변보다 10배 이상 높아 지표 위의 농업활동이 동굴 내부 수질에 일정 부분 영향을 주는 것으로 확인됐다.용역팀은 호수에 대한 연장성 조사와 동굴 및 호수 내 유물 등에 대한 부분적인 정밀조사가 필요하다고 제안했다.고상진 세계자연유산본부장은 ""문화재청과 협의 아래 기계장비를 이용해 호수의 연장성 조사를 추진하고 고고학적 유물에 대한 문화적, 역사적 의미 연구도 진행하겠다""고 밝혔다.ksb@yna.co.kr[관련기사]제주 용천동굴 학술조사(제주=연합뉴스) 김승범 기자 = 세계자연유산지구인 용천동굴 학술조사 장면.2009.7.31 ≪지방기사 참조≫    ksb@yna.co.kr▶ 제주는 용암동굴의 세계적 '보고' 재확인▶ 제주 세계유산지구서 용암동굴 또 발견(종합)▶ 제주 세계자연유산 '용천동굴' 정밀조사▶ <르포> 신이 빚은 환상의 세계..제주 '용천동굴'<실시간 뉴스가 당신의 손안으로..연합뉴스폰><포토 매거진><저작권자(c)연합뉴스. 무단전재-재배포금지.>"
5,2009-07-31,천재화가 탄생?…6세 소년이 그린 수채화,https://news.naver.com/main/read.nhn?mode=LSD&mid=shm&sid1=104&oid=081&aid=0002028424,서울신문,"[서울신문 나우뉴스]붓이 닿는 곳마다 아름다운 풍경화를 탄생시키는 6세 소년이 외신에 소개됐다.영국 노퍽 주에 사는 키에론 윌리엄슨은 미술 교육을 받은 지 1년 만에 성인 화가 못지 않은 미술 실력을 발휘했다.타고난 감각으로 조화로운 색감을 선택할 뿐 아니라 원근법과 그림자 등을 이용하는 표현력도 대단하다는 것이 전문가들의 평가다.윌리엄슨이 재능을 엿보인건 불과 1년 전이다. 이전까지는 그림을 그려본 적도 없었다.어머니인 미셸(36)은 “아들과 바다에 놀러를 갔는데 키에론이 영감이 떠오른 듯 그림이 그리고 싶다고 했다. 연필을 주자, 순식간에 주변 풍경을 종이에 담아냈다.”라고 말했다.아버지가 가장 먼저 윌리엄슨의 범상치 않은 재능을 알아봤다. 미술품 딜러인 케이스(43)는 아들에게 미술 교육을 시켜줬다.예상은 들어맞았다. 윌리엄슨의 실력은 하루가 다르게 성장했고 성인과 견줘도 밀리지 않을 정도로 수채화를 그려낼 수 있었다.소년이 그린 그림을 본 전문가들은 호평을 쏟아냈다. 전문가들은 윌리엄슨의 그림 실력이 또래에 훨씬 앞서는 것이라고 평가했다.캐논 갤러리의 제레미 그린은 “소년은 몇몇 작품에서 집을 일부러 굉장히 딱딱하게 표현하는데, 매우 재밌다. 어린이가 이렇게 표현한다는 것이 믿기지 않는다.”고 말했다.한편 일곱번 째 생일을 기념해 윌리엄슨은 다음 달 1일(현지시간)부터 이틀 간 노퍽 주에서 첫 번째 미술전을 열 계획이다.서울신문 나우뉴스 강경윤기자newsluv@seoul.co.kr나우뉴스 공식 SNS 계정: 트위터http://twitter.com/SEOUL_NOWNEWS[ 관련기사 ]☞ 16세 천재소년, 350년간 내려온 ‘뉴턴의 난제’ 풀었다☞ ‘14세 최연소 신동’ 오케스트라 지휘자 탄생☞ ‘IQ 135’ 두살 짜리 美최연소 멘사 회원 탄생☞ 스티븐 호킹·아인슈타인과 맞먹는 4세 천재소녀 등장☞ 한번 듣고 똑같이…천재 맹인 피아니스트 소년 화제별난 세상 별난 뉴스(nownews.seoul.co.kr) [서울신문 나우뉴스 통신원 모집] [신문 구독신청]- Copyrights ⓒ서울신문사. 무단 전재 및 재배포 금지 -"
6,2009-07-31,최초 국산헬기 수리온 출고,https://news.naver.com/main/read.nhn?mode=LSD&mid=shm&sid1=102&oid=001&aid=0002791158,연합뉴스,(사천=연합뉴스) 조보희 기자 = 국내 연구개발로 탄생한 최초의 국산헬기인 한국형기동헬기(KUH)의 `수리온(Surion)'이 31일 경남 사천 한국항공우주산업에서 열린  출고 기념식에서 모습을 드러내고 있다.  2009.7.31jobo@yna.co.kr<실시간 뉴스가 당신의 손안으로..연합뉴스폰><포토 매거진><저작권자(c)연합뉴스. 무단전재-재배포금지.>
