,날짜,기사 제목,기사 링크,기사 출처,기사 내용
44,2009-07-31,"""허준은 남다른 집념의 소유자""",https://news.naver.com/main/read.nhn?mode=LSD&mid=shm&sid1=102&oid=001&aid=0002791773,연합뉴스,"김쾌정 허준박물관장 (서울=연합뉴스) 김윤구 기자 = 김쾌정 허준박물관장이 31일 박물관에 전시한 동의보감에 대해 설명하고 있다. 김 관장은 동의보감이 유네스코 세계기록유산으로 등재된데 대해 ""세계가 허준의 업적을 인정했다""면서 기뻐했다. 2009. 7. 31 <<문화부 기사 참조>> kimyg@yna.co.kr김쾌정(62) 허준박물관장(서울=연합뉴스) 김윤구 기자 = ""오늘 아침 일찍부터 축하 전화가 계속 오네요. 제가 아니라 온 국민이 축하받을 경사입니다""동의보감이 유네스코 세계기록유산으로 등재된 31일 연합뉴스 기자와 만난 김쾌정(62) 허준박물관장은 수시로 걸려오는 축하 전화를 받느라 얼굴에서 웃음이 떠나질 않았다.동의보감을 편찬한 허준(1539-1615)의 업적을 기리려고 세워진 허준박물관은 서울 강서구 가양동에 있다.허준이 쓴 여러 의학서를 소장하고 있으며 허준의 생애와 동의보감을 소개하고 있는 곳으로 전국에서 허준을 주제로 한 유일한 박물관이다.이 지역은 허준이 태어난 곳으로 조선 시대에는 경기도 양천현 파릉리로 불렸다.김 관장은 2005년 3월 강서구가 허준박물관을 개관했을 때부터 관장을 맡고 있으며 그전에는 한독의학박물관에서 32년간 일하면서 관장까지 지냈다.한국사를 전공한 그는 평생을 박물관에서 일하면서 자연스럽게 의학사에 관심을 쏟게 됐다. 이런 그에게 동양의학을 집대성한 허준이 세계로부터 인정받은 것은 정말 기분 좋은 일이다.김 관장은 이은성의 소설 '동의보감'과 MBC 드라마 '허준' 덕분에 허준이 유명해지긴 했지만 ""소설이나 드라마에 잘못 나온 사실을 마치 진짜인 양 믿는 사람들이 있어 문제""라면서 유네스코 세계기록유산 등재를 계기로 허준이 제대로 알려지기를 바랐다.그는 드라마엔 허준이 평안도 용천에서 태어나 경남 산음(산청) 자란 것으로 돼 있지만, 실제론 경기도 양천에서 출생했다고 한다. 각종 기록에 '양천인(陽川人)'이라고 적혀 있으며 선조로부터 양평군(陽平君)이란 품계를 받은 것을 근거로 들었다.또 허준이 류의태라는 인물로부터 의술을 배웠다고 알려졌지만, 유이태란 이름의 의원이 허준보다 100년 이상 늦은 시기에 활동했을 뿐이며 허준과는 전혀 관계가 없다고 설명했다.김 관장은 허준이 태어난 시기도 현재 정설로 알려진 1539년이 아니라 1537년일 개연성이 더 크다고 주장했다.보물로 지정된 권응수장군 유물 가운데 태평회맹도병풍에 허준이 기해(己亥), 즉 1539년생이라고 쓰여있었던 것이 1539년생이란 근거로 활용됐지만 최근 서울대 규장각에서 발견한 내의원 명부에 정유(丁酉), 즉 1537년생이라고 돼 있고, 내의원 내부 자료가 더 신빙성이 있을 것이라는 견해다.김 관장은 허준은 집안에 의술이 뛰어난 사람이 많았고 서자였기에 동의보감과 같이 뛰어난 업적을 남길 수 있었을 것이라 말했다.""컴퓨터나 복사기 등이 없던 시대에 이렇게 방대하고 정밀한 책을 펴낸 건 보통 머리가 아니면 할 수 없는 일입니다. 세계인이 인정하는 업적을 이룬 것이죠. 허준은 서자라는 어려운 여건에서도 좌절하지 않은 남다른 집념이 있는 인물입니다""kimyg@yna.co.kr[관련기사]▶ <허준과 동의보감, 박물관에서 보세요>▶ ""동의보감 등재 추진에 中 민감 반응""▶ <코페르니쿠스 자서전에서 동의보감까지>▶ <醫聖 허준과 불멸의 의학서 동의보감>▶ 동의보감 세계기록유산 등재(종합2보)<실시간 뉴스가 당신의 손안으로..연합뉴스폰><포토 매거진><저작권자(c)연합뉴스. 무단전재-재배포금지.>"
45,2009-07-31,중등교사 임용시험서 영어가산점 폐지,https://news.naver.com/main/read.nhn?mode=LSD&mid=shm&sid1=102&oid=001&aid=0002791797,연합뉴스,"(서울=연합뉴스) 이준삼 기자 = 서울시교육청은 올해 공립 중등학교 교사 임용시험에서 토익, 토플 등 영어인증시험 관련 가산점제를 전면 폐지한다고 31일 밝혔다.작년까지 중등 영어과 임용시험에서는 토익(TOEIC), 토플(TOEFL), PELT(국가공인민간자격실용영어) 등의 영어인증시험 고득점에게는 성적에 따라 가산점이 차등 부여됐다.시교육청이 영어가산점을 폐지키로 한 것은 2007년 10월 개정된 `교육공무원 임용후보자 선정 경쟁시험 규칙'이 작년 9월부터 시행된 데 따른 것이다.이 개정규칙에 따라 시교육청은 작년 영어과 시험을 영어듣기 문제가 포함되고 영어로 진행되는 형태로 변경했고, 재작년까지 최고 4점까지 준 영어가산점을 최고 2점으로 축소했다.시교육청은 정보처리 및 사무분야 국가기술자격증 소지자에 대한 가산점제도 올해부터 전면 폐지한다고 밝혔다.시험시행공고는 10월7일 시교육청 홈페이지를 통해 게재되며, 1차 시험은 11월8일(공통, 전공), 2차 시험(논술)은 12월13일 치러진다.jslee@yna.co.kr[관련기사]▶ 전북 초등교사 임용 지역가산점 50% 상향▶ 경기 초등교사임용 지역가산점 50% 상향▶ 부산 중등교원 임용 때 영어가산점 폐지<실시간 뉴스가 당신의 손안으로..연합뉴스폰><포토 매거진><저작권자(c)연합뉴스. 무단전재-재배포금지.>"
46,2009-07-31,"코스피 연중최고, 환율은 연중최저",https://news.naver.com/main/read.nhn?mode=LSD&mid=shm&sid1=101&oid=001&aid=0002791772,연합뉴스,"<그래픽> 연중 코스피.환율 추이    (서울=연합뉴스) 전승엽 기자 = 31일 달러화에 대한 원화 환율은 전날보다 8.30원 내린 1,228.50원에 거래를 마쳐 연중 최저점을 기록했고, 코스피지수는 전날보다 22.55포인트(1.47%) 오른 연중 최고인 1,557.29에 거래를 마쳤다.     kirin@yna.co.kr1560선 턱밑까지, 시총 800조 돌파환율 1,220원대로 하락(서울=연합뉴스) 이귀원 기자 = 코스피지수는 31일 연중 최고치를 또다시 갈아치우며 7월 마지막 날을 기분 좋게 마무리했다. 원·달러 환율은 주가 상승 등으로 연중 최저 수준으로 내려앉았다.코스피지수는 전날보다 22.55포인트(1.47%) 오른 1,557.29를 기록했다.이날 코스피지수는 연중 최고치를 경신했으며, 종가기준으로 1,567.71로 마감했던 지난해 8월18일 이후 최고 수준을 기록했다. 특히 60주 이동평균선(1,564.43)에 바짝 접근해 추가 상승에 대한 기대를 높였다.유가증권시장의 시가총액도 전날보다 11조7천274억원 늘어난 807조9천442억원을 기록, 지난해 8월12일(802조2천억원) 이후 11개월여만에 처음으로 800조원을 돌파했다.코스피지수는 8.31포인트(0.54%) 오른 1,543.05으로 출발해 외국인의 순매수를 바탕으로 꾸준히 오르다 기관이 순매수로 전환하면서 상승폭이 커져 1,550선을 회복했다.코스닥지수도 1.45포인트(0.29%) 오른 504.35로 마감해 이틀째 상승행진을 이어갔다.국내 증시는 기업들의 실적개선과 경기 회복 기대 등에 따른 외국인의 매수세에 기관까지 합세한 데다 전날 미국 뉴욕증시 등 해외증시 훈풍으로 힘을 받았다.유가증권시장에서 외국인은 무려 5천367억원을 순매수하며 13거래일째 '바이 코리아'를 계속했다. 외국인들은 7월 한 달간 5조9천억여원을 순매수하며 1998년 기록 집계 이후 월간 기준으로 최대 순매수를 기록했다.기관은 333억원의 순매수를, 개인은 5천291억원의 순매도를 각각 기록했다.프로그램 매매는 한때 1천500억원대의 순매도를 보이기도 했지만 191억원의 순매수로 지수상승에 힘을 보탰다.아시아 주요 증시 가운데 도쿄 증시의 닛케이평균주가는 1.89% 올랐고, 중국 상하이종합지수와 홍콩 항셍지수도 1%대 후반의 상승세를 보이고 있다.원·달러 환율은 이틀째 내리며 1,220원대 후반으로 하락했다.서울 외환시장에서 달러화에 대한 원화 환율은 전날보다 8.3원 내린 1,228.5원에 거래를 마쳤다.이는 기존에 종가 기준으로 연중 저점인 1,233.20원(6월 3일)과 장중 연중 저점인 1,229.00원(5월 13일)을 모두 경신한 기록이다.전문가들은 달러화 약세와 외국인의 순매수를 바탕으로 한 주가 상승 등으로 환율이 하락한 것으로 분석했다.lkw777@yna.co.kr[관련기사]▶ <코스피시황>11개월만에 1,550선 상승(잠정)▶ 내주 회사채 6천335억원 어치 발행예정▶ 外人 13일째 주식순매수…""월별 사상최대""▶ ""펀드매니저 교체후 두세달 펀드 수익률↓""▶ 캠코, 내달부터 기업 자산 인수 착수<실시간 뉴스가 당신의 손안으로..연합뉴스폰><포토 매거진><저작권자(c)연합뉴스. 무단전재-재배포금지.>"
47,2009-07-31,첫 기동헬기 개발..난관 극복의 역사,https://news.naver.com/main/read.nhn?mode=LSD&mid=shm&sid1=100&oid=001&aid=0002791329,연합뉴스,"최초 국산헬기 수리온 출고    (사천=연합뉴스) 조보희 기자 = 국내 연구개발로 탄생한 최초의 국산헬기인 한국형기동헬기(KUH)의 `수리온(Surion)'이 31일 경남 사천 한국항공우주산업에서 열린  출고 기념식에서 모습을 드러내고 있다.  2009.7.31    jobo@yna.co.kr'붕어빵 기계'서 아이디어(서울=연합뉴스) 김귀근 기자 = 한국형 기동헬기(KUH)가 31일 출고되기까지 과정은 그리 순탄하지 않았다.세계 11번째의 헬기개발 국가로 자리매김하는 데 필요한 기술과 재료, 경험 등이 전무한 상태에서 도전했기 때문에 난관과 시행착오가 적지 않았던 것.먼저, 헬기가 비행할 수 있도록 양력을 발생시키는 구성품인 '로터 블레이드' 개발과정이 눈에 띈다.로터 블레이드는 전 세계적으로 기술 이전이나 공개가 극히 제한된 헬기의 핵심 부품이다.한국항공우주산업(KAI)에 기술을 제공하는 유로콥터사는 프랑스어 문서를 영어로 번역해야 한다는 등의 갖은 핑계로 기술 이전을 기피하고 심지어는 기술이전 협약에 나와있는 합의사항도 지키지 않았다.KAI의 문장수 책임연구원은 ""2007년 초 프랑스의 유로콥터 담당자에게 사정해 겨우 기술자료가 담긴 CD를 얻을 수 있었다""며 ""그러나 뒤늦게 유로콥터의 보안담당자가 공항까지 쫓아와 CD를 빼앗아 갔다""고 소개했다.블레이드를 개발하려면 몰드(일명 붕어빵틀)와 오토클레이브(붕어빵 기계) 제작이 필수적인데 유로콥터 기술자들의 비협조로 번번이 실패했다.문 책임연구원은 ""사천 버스터미널 앞을 지나다가 붕어빵 가게에 들른 적이 있는데 3개월 정도 숙련해야 제대로 된 붕어빵을 구울 수 있다는 이야기를 듣게 됐다""며 ""한 번의 실패로 좌절해서는 안 된다는 생각으로 용기를 내어 결국 개발하게 됐다""고 말했다.KAI는 길이 7m, 무게 90kg의 블레이드를 세계에서 10번째로 개발했다.또 헬기가 최상의 비행상태를 유지하고 있는지를 실시간 모니터링할 수 있는 장비인 '상태감시장치'(HUMS)를 개발, 프랑스의 기술자들을 놀라게 하기도 했다.이 장비는 프랑스의 GEA와 협력개발키로 약정이 되어 있으나 프랑스측이 역시 기술이전에 소극적이었다.KAI는 협력업체인 '위다스'와 손잡고 2년6개월 만에 이 장치를 개발, GEA사로부터 품질 인증을 받았다고 한다.KAI의 김외철 책임연구원은 ""원천기술 제공업체인 GEA사에서 우리나라가 독자 개발한 HUMS를 270여대 구매하겠다는 입장을 전달했다""며 ""현재 수출 협의가 진행 중""이라고 설명했다.군 관계자들은 연구원들의 이런 피땀 어린 노력과 도전정신이 있었기 때문에 개발에 착수한 지 38개월 만에 쾌거를 이룰 수 있었다고 평가하고 있다.출산 휴가를 마치고 복직 여부를 고민하다가 결국 KUH개발팀에 합류했다는 김세희 선임연구원은 ""20년 후 군대에 가게될 아들에게 엄마가 만든 헬리콥터라는 것을 자랑하고 싶다""며 ""헬리콥터를 만드는 엄마로 남게 되어 가슴 뿌듯하다""고 소감을 피력했다.threek@yna.co.kr[관련기사]▶ 한국형 첫 기동헬기 '수리온' 출고(종합)▶ <그래픽> 첫 한국형 기동헬기(KUH) '수리온' 제원▶ 李대통령 ""21세기 항공산업 선진국으로""<실시간 뉴스가 당신의 손안으로..연합뉴스폰><포토 매거진><저작권자(c)연합뉴스. 무단전재-재배포금지.>"
48,2009-07-31,공공기관 9곳 연내 매각-1,https://news.naver.com/main/read.nhn?mode=LSD&mid=shm&sid1=101&oid=001&aid=0002791664,연합뉴스,"8개기관 10년 이후 매각산은.기은은 시장상황 감안해 매각(서울=연합뉴스) 류지복 기자 = 한국지역난방공사, 한국전력기술 등 공공기관 9곳이 연내에 매각된다.다만 산업은행과 기업은행, 산하 5개 자회사는 법령 제.개정과 시장 상황을 감안해 매각 시기를 조정하기로 했다.기획재정부는 31일 공공기관 민영화 추진현황 자료를 통해 민영화 대상 24개 공공기관 중 올해 매각이 예정된 9개 기관에 대한 기관별 의사회 의결 및 매각심사위원회 구성을 마쳤고, 이중 8개 기관은 자산평가까지 완료했다고 밝혔다.자산평가를 완료한 8개 기관 중 한국자산신탁, 농지개량, 안산도시개발, 한국토지신탁 등 4개 기관은 이미 매각 공고를 냈으며, 안산도시개발과 농지개량은 지난 29일 우선협상대상자까지 선정했다.또 그랜드코리아레저, 한국지역난방공사, 한국전력기술 등 3개 기관은 상장예비심사를 통과했거나 심사를 받고 있는 단계로, 올해중 상장을 완료할 수 있을 것이라고 재정부는 설명했다.88관광개발은 자산 평가를 거쳐 9월중 매각공고를 할 계획이다.재정부는 또 대한주택보증 등 8개 기관은 2010년 이후 매각하기로 했다.이 중 한국건설관리공사, 경북관광개발공사, 한전KPS, 인천종합에너지, 한국기업데이터 등 5개 기관은 매각에 필요한 이사회 의결과 매각심사위원회 구성을 완료했고, 경북관광개발은 매각주간사까지 선정한 상태다.재정부는 ""8개 기관의 경우 연말까지 자산평가 등 사전준비절차를 마무리할 계획""이라며 ""추진과정에서 조기매각이 가능한 기관은 금년 중에도 매각할 수 있도록 시기를 조정하겠다""고 말했다.재정부는 산은과 기은, 5개 관련 자회사 등 민영화 대상 나머지 7개 기관의 경우 10월로 예정된 산은의 분할 과정을 지켜보고 정책금융 체계의 안정적 작동 여부 등을 감안한 뒤 구체적인 매각일정을 마련할 계획이다.재정부는 ""매월 점검회의를 개최해 추진상황을 점검하고 추진과정의 어려움을 해결하겠다""며 ""민영화가 당초 일정대로 원활하게 추진될 수 있도록 노력을 계속할 계획""이라고 말했다.jbryoo@yna.co.kr[관련기사]▶ <표> 공공기관 민영화 추진현황▶ 공공기관 9곳 연내 매각-1▶ <연합시론> 공공기관 개혁 속도내야 한다▶ <공기업 선진화 1년..보수체계도 고친다>▶ ""공기업 구조개혁 선택 아닌 필수""<실시간 뉴스가 당신의 손안으로..연합뉴스폰><포토 매거진><저작권자(c)연합뉴스. 무단전재-재배포금지.>"
49,2009-07-31,"""동료 구하다 숨진 공무원에 보상금 전액지급""",https://news.naver.com/main/read.nhn?mode=LSD&mid=shm&sid1=100&oid=001&aid=0002791692,연합뉴스,"(서울=연합뉴스) 강영두 기자 = 부하직원을 구하기 위해 안전장비 없이 맨홀에 들어갔다가 질식사한 공무원에게 국가가 중과실을 이유로 보상금을 감액한 것은 부당하다는 결정이 나왔다.국민권익위원회 소속 국무총리행정심판위원회는 공무원 A씨의 유족이 행정안전부를 상대로 낸 행정심판에 대해 이같이 결정했다고 31일 밝혔다.하수처리장에서 근무하던 A씨는 지난해 9월 하수처리장내 맨홀 인근에서 제초작업을 하던 중 맨홀 안에서 작업하던 동료가 실신했다는 말을 듣고 동료를 구조하기 위해 맨홀 안에 들어갔다가 유독가스에 질식해 숨졌다.고인의 유족은 행정안전부에 순직유족급여를 청구했으나 행정안전부는 방독면 등 안전장비를 착용하지 않은 중과실이 있다며 보상금을 절반만 지급키로 했다.현행 위험직무 관련 순직공무원 보상법과 공무원연금법 등은 중과실로 사망한 경우 순직유족보상금의 절반을 감액해 지급하도록 하고 있다.행안부는 A씨가 맨홀과 같이 밀폐된 공간에서 작업할 때 안전장비를 착용해야 한다는 것을 경험상 숙지하고 있었고, 하수처리장 청소작업과 관련한 자료에도 안전장비를 착용하지 않고 밀폐된 공간에 들어가지 말라고 경고하고 있는데도 이를 어긴 것은 인명구조활동의 기본수칙을 현저히 위반했다고 판단했다.그러나 이에 대해 국무총리행정심판위원회는 사고 발생일 당시 맨홀 작업은 사전에 계획된 것이 아니라 부하직원의 판단에 의해 우연히 진행됐고, 고인은 부하직원이 작업하던 곳으로부터 약 100ｍ 떨어진 곳에서 제초작업을 하고 있었다는 상황을 감안했다.행정심판위는 또 고인이 쓰러진 부하직원을 발견한 후 안전장비를 착용하기 위해서는 상당한 시간이 소요될 것으로 판단되는 점, 안전장비 없이 맨홀로 들어간 것은 부하직원의 생명이 경각에 달린 상황에서 불가피한 행동이었던 점 등을 고려할 때 중과실을 이유로 보상금을 감액한 것은 위법, 부당하다고 설명했다.k0279@yna.co.kr<실시간 뉴스가 당신의 손안으로..연합뉴스폰><포토 매거진><저작권자(c)연합뉴스. 무단전재-재배포금지.>"
50,2009-07-31,쌍용차 노사 본협상 개시…3대 쟁점 새벽까지 진통,https://news.naver.com/main/read.nhn?mode=LSD&mid=shm&sid1=101&oid=009&aid=0002137603,매일경제,"42일 만에 마침내 만난 쌍용차 노사가 협상을 시작한 지도 지난달 31일로 이미 만 이틀째가 되면서 희망이 보이고 있다.3시간 협상 후 3~4시간 쉬는 강행군을 하면서도 노사 양측 모두 흔들림이 없는 표정이었다. 이번이 마지막이라는 절박감 때문이다.30일 오전 9시쯤 시작한 협상은 1일 새벽까지 이어졌다. 40시간에 가까운 '마라톤 협상'의 연속이었다.31일 오후 9시 20분쯤 실무협의의 정회를 선언하고 박영태 공동관리인과 한상균 노조위원장이 등장하면서 협상타결이 임박했다는 분위기가 감지됐다. 본 협상은 다시 9시 50분쯤 재개됐다. 협상장 안팎에서는 노사가 실무적으로 의견접근을 이뤘다는 분석이 제기됐다.쌍용차 관계자는 ""실무협의가 생각보다 빠른 2시간 만에 정회됐다는 것은 어느 정도 합의를 이끌어낸 것으로 볼 수 있다""면서 ""본회의라는 것이 실무협의에서 합의점을 보지 않으면 시작하기 어려운 만큼 긍정적으로 바라보고 있다""고 설명했다.쟁점은 여전히 크게 세 가지로 나뉜다. △무급휴직 비율 △해고자 처우 △파업 과정 중 손ㆍ배소 등이다. 피를 말리는 마라톤 협상의 끝이 언제가 될지 온 평택이 피가 마르는 듯한 긴장 속에서 지켜보고 있다.◆ 무급휴직 비율 30% 안팎 될 듯= 최상진 쌍용차 기획재무담당 상무는 이날 오전 협상을 마친 후 브리핑을 통해 ""4차에 걸친 대화를 통해 무급휴직 확대 등 일부 진전된 안을 제시했다""며 ""협상에서 최대 걸림돌은 무급휴직을 얼마나 확대하느냐""라고 전했다. 사측은 현재 무급휴직자를 300명 미만으로 제시한 것으로 알려졌다.문제는 아직도 노측이 '무급휴직'이 아닌 '무급순환휴직'으로 해줄 것을 요구하고 있다는 것.무급순환휴직은 휴직자들이 회사가 정상화할 때까지 일정 기간씩 돌아가면서 휴직하는 것을 말한다. 무급순환휴직 대상자 역시 전체 정리해고자 976명 가운데 무려 3분의 2에 해당하는 600여 명을 요구했다. 이는 사측이 목표하는 희망퇴직 범위가 대폭 좁아지는 것을 의미해 사측은 ""이 부분만은 절대 양보할 수 없다""고 밝혔다.그러나 사측이 당초 450명을 대상으로 했던 희망퇴직자 수를 줄이고 무급휴직 숫자를 늘리며 한 발짝 양보했고 노조 역시 계속 수정안을 제시하고 있어 전체 해고자의 30% 안팎 선에서 무급휴직 처리로 타결될 공산이 커 보인다.◆ 해고자 처우에 노사 이견 커= 노조는 새벽 협상에서 영업직 전환 대상을 대폭 늘려줄 것을 요구한 것으로 전해졌다. 사측은 지난달 26일 정리해고자 976명 중 분사ㆍ영업직 전환 대상을 320명으로 제시했다.그러나 노조는 분사에 대해 강한 부정적 의견을 나타냈다. 완전 해고나 마찬가지라는 인식 때문이다.협력업체들이 제시한 '재고용' 제안에 대해서도 거부 의견을 보였다. 이에 대해 쌍용차 협동회채권단 측은 ""노조가 여전히 희생을 전제로 한 공생의 의미를 깨닫지 못한 채 귀족노조 행태를 보이고 있다""며 강한 불쾌감을 나타냈다.노조는 분사나 협력업체 재고용 대신 쌍용차에 '적'을 유지시킨 상태에서 파견을 하거나 영업직 전환을 하는 방식을 요구하고 있다. 최 상무는 ""다른 쟁점에 대해서는 그런대로 의견 접합점을 찾아가고 있지만 해고자 처우 부분이 가장 민감하고 절충을 하기 어려운 부분""이라고 설명했다.◆ 경찰, 형사책임은 계속 수사= 쌍용차는 6월 22일과 지난달 14일 노조 집행부 간부 190명과 외부세력 62명에 대해 각각 50억원씩 손해배상 청구소송을 제기한 바 있다. 사측이 2차 소송을 내게 되면 손배소를 당한 노조원은 535명, 배상청구액은 150억원으로 늘어날 것으로 보인다.노조는 타결 이후 노조원들을 손배책임에서 구제하기 위해 협상테이블에서 ""고소 취하 없이 합의는 없다""며 압박하고 있다. 쌍용차 협동회 측은 ""타결되면 취하할 것""이라는 뜻을 밝히고 있고 사측 역시 ""가급적 원만하게 해결한다""는 방침이다.그러나 이미 불법 폭력시위나 폭행 등으로 경찰에 입건되거나 구속된 노조원에 대해서는 사측에서 선처 호소 등을 하지 않으면 이들에 대한 사법처리는 불가피해 보인다.[평택 =  박인혜 기자 / 우제윤 기자][ⓒ 매일경제 & mk.co.kr, 무단전재 및 재배포 금지]모바일로 읽는 매일경제 '65+NATE/MagicN/Ez-I 버튼'"
