,날짜,기사 제목,기사 링크,기사 출처,기사 내용
25,2009-07-31,고용보험 들어야 실업급여? 황당한 지원센터,https://news.naver.com/main/read.nhn?mode=LSD&mid=shm&sid1=102&oid=028&aid=0002006774,한겨레,"[한겨레]현행법상 미가입 수급가능…노동부 보고서도 강조“사장에게 가입하라 해라” 담당자 무리한 요구도지난 6월 말 경영 사정으로 보험회사 대리점에서 해고된 장아무개(30)씨는 고용보험에 가입돼 있지 않더라도 실업급여를 받을 수 있다는 소식을 접하고 마음이 놓였다. 해고 뒤 취업이 안 돼 막막했던 장씨는 실업급여를 신청하기 위해 최근 노동부 고용지원센터에 전화를 했다. 하지만 고용지원센터 담당자는 “고용보험에 가입하지 않았으면 실업급여를 받을 수 없다”고 말했다. 장씨는 “언론에 보도된 기사까지 팩스로 보냈는데도 ‘기사 내용이 허황된 얘기’라는 소리를 들어 무척 황당했다”고 했다.현행 고용보험법은 장씨처럼 고용보험에 가입하지 않은 노동자도 일자리를 잃었을 때 실업급여를 받을 수 있도록 돼 있는데도, 실업급여를 담당하는 고용지원센터조차 이를 외면하고 있어 실업자들이 피해를 입고 있다. 실제로 서울남부고용지원센터 실업급여 담당자는 지난 27일 <한겨레> 기자가 전화를 걸어 “고용보험에 가입하지 않은 사업장에서 일했는데, 실업급여를 받을 수 있느냐”고 묻자, “받을 수 없다”고 잘라 말했다. 다른 방법이 없느냐고 다시 물었지만 “없다”는 답변만 되돌아왔다.고용보험법 13조를 보면 ‘이 법이 적용되는 사업에 고용된 날에 피보험자격을 취득한다’고 돼 있다. 사업주가 고용보험에 가입하지 않았더라도 고용보험 가입 사업장과 똑같이 180일 이상 임금근로자로 근무하다가 비자발적으로 일을 그만둔 사실이 인정되면 실업급여를 받을 수 있다. 노동부도 지난달 내놓은 ‘비정규직법 오해와 진실’이라는 보고서에서 “고용보험에 가입돼 있지 않아도 실업급여를 받을 수 있다”고 거듭 밝히고 있다.고용보험에 가입하지 않은 실업자의 실업급여 지급에 대한 고용지원센터의 서비스가 미흡하다는 지적도 나온다. 서울서부고용지원센터의 실업급여 담당자는 실업급여 지급 요구에 대해 “그만둔 회사 사장한테 찾아가서 고용보험에 가입하라고 말하라”며 실업자가 받아들이기 어려운 주문을 했다.인천에 사는 실직자 이아무개씨(34)는 “고용지원센터에 문의했더니, 어떻게 도움을 줄지 설명하기보다는 고용보험에 가입돼 있지 않은 사람이 실업급여를 받으려면 두 달 이상 걸리고 그동안 미납된 고용보험·국민연금·건강보험료도 다 내야 한다는 말을 하더라”라며 분통을 떠뜨렸다. 이씨는 “마치 실업급여를 받지 말라는 협박으로 들려 포기했다”고 말했다.이에 대해 권오일 노동부 홍보팀장은 “고용지원센터에서는 고용보험에 가입하지 않아도 실업급여를 받을 수 있다는 사실을 거의 다 알고 있을 것”이라며 “사실 여부를 확인해 보겠다”고 밝혔다.전국민주노동조합총연맹은 지난달부터 고용보험에 가입하지 않은 사람도 실업급여를 받을 수 있다는 사실 등을 알리기 위해 실업급여 상담(1577-2260)을 진행하고 있다.김소연 기자dandy@hani.co.kr세상을 보는 정직한 눈 <한겨레>  [한겨레신문 구독|한겨레21 구독]ⓒ 한겨레신문사, 무단전재 및 재배포 금지<한겨레는 한국온라인신문협회(www.kona.or.kr)의 디지털뉴스이용규칙에 따른 저작권을 행사합니다.>"
26,2009-07-31,김우룡 교수 등 방문진 이사 선임(종합2보),https://news.naver.com/main/read.nhn?mode=LSD&mid=shm&sid1=100&oid=001&aid=0002792212,연합뉴스,"여당측 6명, 야당측 3명..MBC민영화 논의 본격화할듯(서울=연합뉴스) 박대한 기자 = 방송통신위원회는 31일 제34차 회의에서  MBC 대주주인 방송문화진흥회 이사로 김우룡 한양대 석좌교수 등 9명을 선임하고 김 영 부경대 평생교육원 명예원장을 방문진 감사로 선임했다고 밝혔다.이사에는 김 석좌교수 외 고 진 방송영상산업진흥원 원장, 김광동 나라정책연구원 원장, 남찬순 고려대 초빙교수, 문재완 한국외대 법과대 부교수, 정상모 MBC 통일방송연구소 전문위원, 차기환 우정합동법률사무소 공동대표 변호사, 최홍재 시대정신 이사, 한상혁 법무법인 정세 변호사 등이 선임됐다.9명의 출신성분을 살펴보면 언론계 3명(고진, 남찬순, 정상모), 학계.연구계 3명(김광동, 김우룡, 문재완), 법조계 2명(차기환, 한상혁), 시민.사회단체 1명(최홍재) 등으로 구성됐다.미디어법안 논란과 함께 관심을 끌었던 성향별 분류로는 여당측 인사가 6명, 야당측 인사가 3명인 것으로 파악된다. 이로써 새 이사진 구성과 함께 정부.여당이 물밑에서 논의해왔던 MBC 민영화 논의가 본격화될 전망이다.최시중 방통위원장은 앞서 지난 26일 ""새로 구성되는 방문진 이사회가 MBC 측과 함께 (MBC 민영화 여부에 대해) 진지한 논의를 하게 될 것""이라며 ""확신할만한 답이 나오면 결정될 것""이라고 밝힌 바 있다.방통위는 지난 1일 전체회의에서 방문진 이사 후보자를 공개모집하기로 하고 3∼16일 공모한 결과 방문진 이사직에 총 119명의 후보자가 지원했다고 설명했다.방통위는 지난 24일 전체회의에서 59명으로 이사 후보자를 압축한 뒤 이날 열린 회의에서 9명의 이사를 선임하게 됐다.이기주 방통위 기획조정실장은 ""5명의 방통위원들이 2배수, 즉 18명씩을 투표해 다득표 순으로 이사를 선임했다""면서 ""동률일 경우 다시 결선투표를 진행했다""고 설명했다.방통위는 이번 이사 선임은 방송문화진흥회법에서 정한 '각 분야의 대표성'과 '방송에 관한 전문성'을 기본 원칙으로 고려하고 직능별, 지역별, 연령별, 성변 대표성 등을 반영했다고 설명했다.일부에서 제기된 사전 내정설에 대해 이 실장은 ""전혀 사실과 다르다""고 부인하면서 ""사전 내정이나 밀실 공모 주장은 타당치 않다""고 말했다.향후 이사회에서 호선으로 결정되는 방문진 이사장에는 국회 미디어발전국민위원회 여당측 위원장이었던 김우룡 교수가 유력시된다.방문진 이사들은 오는 8월 7일 임명장을 수여받은 뒤 9일부터 2012년 8월 8일까지 3년 간 직무를 수행하게 된다.한편 관심을 모았던 KBS 이사진 선임은 8월 중으로 연기됐다.이 실장은 ""KBS 이사진의 임기는 8월 31일까지이므로 아직 여유가 있다""면서 ""현재 검토를 진행하고 있으며 8월 중에는 의결이 있을 것""이라고 밝혔다.pdhis959@yna.co.kr[관련기사]▶ MBC 노조, 신임 방문진 이사진에 반발▶ <미디어법 통과로 `일복' 터진 방통위>▶ <미디어전쟁 후폭풍 `민영 미디어렙'>(종합)▶ 최시중 ""특정신문.기업에 특혜없다""(종합)<실시간 뉴스가 당신의 손안으로..연합뉴스폰><포토 매거진><저작권자(c)연합뉴스. 무단전재-재배포금지.>"
27,2009-07-31,쌍용차 노사 이틀째 협상 재개키로…밤샘 토론 이어질 듯,https://news.naver.com/main/read.nhn?mode=LSD&mid=shm&sid1=102&oid=003&aid=0002800988,뉴시스,"【평택=뉴시스】서정화 기자 =  쌍용자동차 노사가 전날에 이어 31일 오후 7시30분께 협상에 들어간다.노사 양측이 입장을 좁히지는 못했지만 결정을 계속 미룰 수만은 없는 입장이어서 이날 대화도 전날과 마찬가지로 밤새 이어질 전망이다.쌍용차 노사는 31일 오전 6시55분께 4차 대화를 마치고 정회에 들어간 뒤 12시간 이상 충분한 휴식과 내부 의견 조율을 갖고 이틀째 대화를 재개한다.협상은 전날과 같이 본관과 도장공장 사이에 컨테이너 2개에서 실무협의와 본협의로 나눠 동시에 진행된다.실무협의는 김선영 노조 수석부지부장과 최기민 정책실장, 박광열 전 A/S광주분회장과 류재완 인사노무담당상무, 고재용 노사협력팀장이 참석하고 본협의는 박영태 공동관리인과 한상균 노조 지부장이 독대해 실무협의에서 나온 쟁점사안을 논의한다.사측은 기존 100명에 그친 무급휴직 인원을 일부 늘리는 방안을 노조에 제시했고 노조도 분사 및 영업직 전환 일부 수용안을 내 놨다.양측이 좀처럼 입장을 좁히지 못하는 쟁점은 정리해고자 처우와 관련된 무급휴직자의 비율이다.사측은 무급휴직을 늘리되 일부 정리해고는 불가피하다는 입장인데 반해 노조는 분사나 희망퇴직 또한 사실상 정리해고로 보고 고용관계를 유지하는 방식으로 비상인력운영을 실시하자는 의견을 내놓고 있다.최상진 기획재무담당 상무는 ""4~5가지 쟁점 사항에 대해 아직 합의를 이룬 것은 없지만 어느 정도 의견 접근이 이뤄지고 있는데 반해 해고자 처우에 관한 문제에 대해서는 좀처럼 의견 접근이 이뤄지지 않고 있다""며 ""결론이 날 때까지 협상 기일을 정하지 않고 계속 대화할 것""이라고 말했다.노조 관계자도 ""노사 모두 평화적 대타결에 공감하면서 타결을 위해 노력을 기울이고 있으나 아직 입장차이가 커 더 많은 노력이 필요한 상황""이라며 협상의 어려움을 시사했다.양측은 정리해고 대상자 및 무급휴직자 비율과 사측이 제기한 손해배상청구소송, 형사고발 등을 논의 중인 것으로 알려졌다.입장차이로 좀처럼 합의가 이뤄지지 않고 있지만 쌍용차 협동회 채권단이 못 박은 마감시한이 31일까지여서 노사 모두 타결이든 결렬이든 이날 중 결론을 낼 것으로 전망된다.한편 파업에 동참했다가 가족의 사고 등으로 이탈한 노조원들도 이날 평택공장 앞을 방문, ""속이 시커멓게 타 들어가는 심정으로 밖에서 발만 동동 구르고 있다""며 ""동료들의 안전과 사태의 평화적 해결을 바란다""고 호소했다.인권단체연석회의 등 시민단체들은 국가인권위원회의 긴급구제조치 권고를 이행하라며 공장 내 물 반입을 시도해 사측과 마찰을 빚기도 했다.seo@newsis.com"
28,2009-07-31,"‘네이키드 뉴스 서비스중단’ 경찰, 수사착수",https://news.naver.com/main/read.nhn?mode=LSD&mid=shm&sid1=102&oid=014&aid=0002175215,파이낸셜뉴스,"경찰이 이른바 ‘벗는 뉴스’를 표방, 세간의 관심을 끌다가 한달여 만에 서비스를 중단한 네이키드 뉴스에 대해 수사에 착수했다.서울 수서경찰서는 31일 네이키드 뉴스 코리아가 회원들로부터 이용료만 챙긴 뒤 일부러 사업을 중단한 것으로 보고 네이키드 뉴스 코리아 한국인 부사장, 웹마스터를 참고인 신분으로 소환 조사했다고 밝혔다.경찰은 회사측 한국인 관계자들이 자신들도 사기 피해자라고 주장함에 따라 실질적으로 회사를 운영한 인물이 누구인지, 유료회원 규모가 어느 정도인지 우선 조사할 방침이다.아울러 지난 30일 서울 강남구 역삼동의 본사에서 기자회견을 열고 경찰수사를 의뢰하겠다고 밝힌 여성 엥커 4명도 이날 경찰서를 방문했지만 고소장을 접수하지는 않았다고 경찰 관계자는 설명했다.네이키드 뉴스 코리아는 이스라엘계인 요아브 시나이 대표, 뉴질랜드계 투자회사인 차우 그룹의 존 차우 회장이 합작해 설립했지만 현재 이들 모두 출국한 것으로 전해졌다./pio@fnnews.com 박인옥기자※ 저작권자 ⓒ파이낸셜뉴스. 무단 전재-재배포 금지[☞ First-Class경제신문 파이낸셜뉴스 구독신청하기]"
29,2009-07-31,"당정, 정기국회 앞두고 `엇박자' 조짐",https://news.naver.com/main/read.nhn?mode=LSD&mid=shm&sid1=100&oid=001&aid=0002791876,연합뉴스,"당정회의 모습(자료사진)(서울=연합뉴스) 김범현 기자 = 정부와 한나라당이 정기국회를 불과 한달 앞두고 `정책 잡음'을 내고 있다.당정간 소통 부재에 따른 혼선은 어제 오늘의 일이 아니다.지난 4월 다주택자 양도소득세 완화 문제, 비정규직 근로자 사용기간 문제 등을 놓고 갈등을 빚었고, 작년 정기국회를 앞두고도 정부의 핵심법안 제출 지연으로 당내 불만이 제기됐었다.이에 따라 당정간 사전 정책조율 필요성이 누차 강조됐지만 정책 엇박자는 어김없이 되풀이되고 있다.최근에는 인감제도 폐지시한을 둘러싸고 혼선이 빚어졌다.당정은 지난 27일 인감제도 폐지 관련 당정회의에서 인감폐지에 따른 대안을 마련한 뒤 폐지시한을 정하자는데 의견을 같이했지만 정부는 불과 사흘 뒤인 30일 `5년내 폐지'를 발표한 것.이와 관련, 조진형 국회 행정안전위원장은 31일 연합뉴스와의 통화에서 ""인감 폐지시한을 일률적으로 5년 이내로 하면 안된다""며 ""부동산 소유자 대부분은 나이든 사람들인데 젊은 사람들과 달리 이들은 인감의 대체수단을 금방 받아들일 수 없을 것""이라고 밝혔다.주성영 제1정조위원장은 ""지난 27일 당정회의에서는 인감제 폐지시한에 대해 결론을 내지 못했다""고 소개했다.당내 볼멘소리가 이어지자 이달곤 행정안전부 장관은 이날 진화에 나선 것으로 알려졌다.김성조 정책위의장은 ""이달곤 장관으로부터 인감 사용을 안하는 사회로 정착한 이후 5년 후에 폐지하겠다는 취지의 설명을 들었다""고 밝혔다. `현 시점 후 5년내 폐지'라는 기존 발표 내용을 부인한 셈이다.또한 이 장관은 조진형 위원장에게도 ""5년내 폐지하겠다는 것은 절대적인 시한을 의미하는 게 아니라, 강력한 의지를 갖고 국민생활 불편 해소정책을 시행하겠다는 뜻""이라고 설명한 것으로 전해졌다.아울러 4대강 살리기사업에 대해서도 당내 문제 제기가 잇따르고 있다. 4대강 살리기사업에 대한 예산편중 우려가 그것으로, 이명박 정부의 대표정책을 놓고도 혼선이 이어지고 있는 모양새다.허태열 최고위원은 30일 최고위원회의에서 ""4대강 살리기 사업 때문에 사회간접자본 사업 예산이 잘린다는 얘기가 있다""며 ""큰 괴담으로 작용하면 어떻게 할거냐""고 지적했다.지난 29일 최고위원.중진 연석회의에서도 이경재 의원은 ""4대강 살리기 사업에 올인, 민생현장에서 반드시 해야할 것들이 중단.취소되는 게 많다""고 밝혔고, 남경필, 김영선 의원도 이 사업에 대한 문제점을 제기했다.이에 따라 당정간 불협화음 최소화를 위한 시스템 정비가 수반돼야 한다는 목소리가 높아질 전망이다.당 쇄신특위는 정무장관의 당 주요회의.일부 청와대 회의.국무회의 참석, 정책결정 초기단계부터 협의를 의무화하는 당.정 조기협의제, 당정협의 완결 정책만 당이 지원하는 정책숙성제 도입 등의 당정 관계 쇄신안을 제시해놓은 상태다.kbeomh@yna.co.kr[관련기사]▶ <한, `민생'으로 지지율 만회 시도>▶ 당정, 재외동포 교육예산 2배 증액▶ 민주 ""한, 8월국회 제안은 꼼수""▶ 당정, 8월국회서 비정규직법 처리 제안▶ <안상수 ""비정규직법 8월에 결과도출 희망""><실시간 뉴스가 당신의 손안으로..연합뉴스폰><포토 매거진><저작권자(c)연합뉴스. 무단전재-재배포금지.>"
30,2009-07-31,동의보감 19세기 한글번역본 발견,https://news.naver.com/main/read.nhn?mode=LSD&mid=shm&sid1=102&oid=001&aid=0002792101,연합뉴스,"(서울=연합뉴스) 김윤구 기자 = 유네스코 세계기록유산으로 등재된 동의보감이 조선시대에 한글로 번역됐었다는 사실이 31일 확인됐다.이래호 전북대 쌀ㆍ삶ㆍ문명 연구원 HK 연구교수는 한국학중앙연구원이 발간한 반년간 학술지 '장서각' 21집에 게재한 논문에서 한글 필사본 동의보감의 서지적 특징과 국어학적 특징을 자세히 소개했다.이 필사본은 '내경편'의 1권, 3권, 5권 총 세 권만 전해지며 한국학중앙연구원 장서각이 소장한다.이 교수에 따르면 번역본 동의보감은 문법적 특징 등으로 볼 때 19세기 중반 정도에 언해(諺解)됐으며 어려운 한자어를 많이 쓰고 있어 전문 지식이 있는 사람들을 위해 언해됐을 가능성이 큰 것으로 추정된다.이 교수는 ""1970년대 이후 10여 종의 번역본이 나오긴 했지만, 조선시대의 한글 번역본이 발견되기는 처음""이라면서 ""한글 번역의 통일성을 기하는 데 중요한 기준이 되고 당시 언어의 쓰임과 어휘의 변천을 연구하는 자료로 이용할 수 있다""고 말했다.전북대 쌀ㆍ삶ㆍ문명 연구원은 한글본 '동의보감 내경편'을 현대어로 옮기고 자세한 주역을 덧붙여 출간할 계획이다.kimyg@yna.co.kr[관련기사]▶ <허준과 동의보감, 박물관에서 보세요>▶ ""허준은 남다른 집념의 소유자""▶ <연합시론> 동의보감의 세계기록유산 의미 살리자▶ ""동의보감 등재 추진에 中 민감 반응""▶ 동의보감 세계기록유산 등재(종합2보)<실시간 뉴스가 당신의 손안으로..연합뉴스폰><포토 매거진><저작권자(c)연합뉴스. 무단전재-재배포금지.>"
31,2009-07-31,헌재 `방송법 신속심리' 결정 배경은,https://news.naver.com/main/read.nhn?mode=LSD&mid=shm&sid1=100&oid=001&aid=0002792038,연합뉴스,"야3당, 방송법 효력정지가처분 신청                                  (서울=연합뉴스) 박지호 기자 = 백재현, 김종률, 김재윤 민주당 의원을 비롯한 야3당 의원들이 23일 오후 서울 가회동 헌법재판소 민원실을 찾아 방송법 효력정지 가처분 신청 및 권한쟁의심판청구 관련 서류를 제출하고 있다. 2009.7.23    jihopark@yna.co.kr(서울=연합뉴스) 백나리 기자 = 헌법재판소가 31일 국회에 방송법 개정안 통과 당시의 본회의장 폐쇄회로 TV 자료를 조속히 제출하라고 요구하는 등 `신속 심리'로 방향을 정한 배경에 관심이 쏠린다.야당 의원들이 방송법 개정안 통과에 대한 권한쟁의 심판 청구와 관련해 증거조사 신청을 한 지 하루만에 국회에 자료 제출 요구를 한 것은 미디어법 강행 처리로 인한 사회적 논란이 만만치 않은 현실을 감안한 것이라는 분석이다.민주당이 장외투쟁을 벌이는 등 미디어법을 둘러싸고 정치권의 파행이 이어지고 있다는 점 역시 헌재의 판단을 재촉하는 측면이 있다는 해석도 나온다.헌재는 국회 본회의장과 본관을 촬영한 영상물 전부와 본회의 회의록과 속기록 등 관련 자료를 조속히 제출하라고 요청하는 한편, 권한쟁의 심판의 피청구인인 김형오 국회의장 등에게도 사건 관련 답변서와 참고자료를 빠른 시일 내에 내달라고 요구해 신속하게 사건을 심리하겠다는 방침을 분명히 했다.권한쟁의 심판 사건이라면 반드시 열어야 하는 변론도 가급적 빨리 하겠다는 것이 헌재의 입장이다.올해초 `이명박특검법'에 대한 헌법소원 사건에 대해 헌재가 13일만에 `초고속' 결정을 내리기도 했지만 헌재에 접수된 사건이 처리되는 데 걸리는 기간이 평균 11개월이라는 점을 감안하면 상대적으로 속도감 있게 심리가 진행되는 셈이다.보통 한 사건은 연구관 1명이 맡아 검토하는데 비해 이번 권한쟁의 심판 사건을 처리하려고 헌재가 공동연구팀을 구성한 것도 같은 맥락이다.권한쟁의 심판 사건은 재투표의 적법성과 대리투표 여부가 쟁점이어서 증거조사는 사실상 필수적인 조치다. 대리투표의 유효성을 따지기 전에 대리투표가 실제로 있었는지부터 확인해야 하고 이를 위해서는 관련 영상자료 등의 확보가 필요하기 때문이다.헌재는 국회에서 제출받은 기록을 토대로 방송법 개정안 통과 당시의 상황을 재구성한 뒤 공개변론을 통해 쟁점을 심리할 방침이다.nari@yna.co.kr[관련기사]▶ 헌재, 국회에 방송법 자료 요구(종합)▶ <방송법 권한쟁의심판 쟁점과 절차는>▶ 민주, 헌재 심판청구..한 ""적법행위""(종합2보)<실시간 뉴스가 당신의 손안으로..연합뉴스폰><포토 매거진><저작권자(c)연합뉴스. 무단전재-재배포금지.>"
32,2009-07-31,"남북, 軍채널로 '연안호' 입장 교환(종합2보)",https://news.naver.com/main/read.nhn?mode=LSD&mid=shm&sid1=100&oid=001&aid=0002792095,연합뉴스,"연안호와 같은 선단이었던 금수호(고성=연합뉴스) 이종건 기자 = 북한 경비정에 예인된 '연안호'와 같은 선단을 이뤄 출어했던 것으로 알려진 오징어채낚기 어선인 금수호가 거진항에 정박해 있다. <<관련기사 있음>> 2009.7.31    momo@yna.co.kr北, 사건 하루만에 전통문 보내와..""연안호, 조사결과따라 처리""南 ""인도적 차원서 조속 석방""(서울=연합뉴스) 조준형 김승욱 기자 = 남북은 31일 동해 북방한계선(NLL)을 넘어 갔다가 북에 예인된 우리 어선 '800 연안호' 처리 문제와 관련, 군사 실무 책임자 라인을 통해 공식 소통을 시작했다.통일부에 따르면 북측은 사건 발생 하루만인 이날 오후 군 통신선을 통해 동해지구 군사실무 책임자 명의로 전통문을 보내 ""현재 연안호에 대해 해당기관에서 구체적인 조사를 진행하고 있다""며 ""조사결과에 따라 선원들과 연안호 문제가 처리될 것""이라고 밝혔다.이에 대해 우리 정부는 이날 오후 북측이 전통문을 보내온 것과 같은 경로로 선원들의 조기 송환을 재차 촉구했다.정부는 우리 측 동해지구 군사실무 책임자 명의로 북측에 보낸 전통문에서 ""7월30일 우리 측 어선 연안호의 북방 한계선 월선은 항로착오로 인한 것""이라며 ""따라서 인도주의적 차원에서 조속히 선박과 선원을 송환해 주기 바란다""고 촉구했다.이에 따라 남북은 향후 양측 군사실무책임자 채널을 통해 사건 처리 문제를 협의하게 될 전망이다.앞서 30일 연안호 월선 이후 이날 오전까지 남북은 해사 당국간 통신 채널을 활용, 초보적인 교신을 해왔다.현인택 통일부 장관은 이날 서울 양천구 신월동에 자리한 탈북 청소년 배움터인 `한누리학교'를 방문, 연합뉴스 기자와 만난 자리에서 북측이 전통문을 보내온데 대해 ""일단 상황에 대해 신속한 반응이 왔다는 것은 긍정적으로 보고 있다""며 ""하지만 앞으로 좀 더 두고 보겠다""고 말했다.현 장관은 이어 ""이 사안이 의도적인 것이 아니었기 때문에 북측이 인도주의적 차원에서 우리 선박을 조속히 돌려 보내 줬으면 좋겠다""고 말했다.천해성 통일부 대변인은 앞서 브리핑에서 ""우리 선박이 NLL을 월선한 것은 우발적인 사고인 것으로 생각하고 있고 이에 따라서 북측에 (30일) 인도적인 차원에서 조속히 송환해 줄 것을 촉구했다""며 ""선박의 표류나 사고에 의한 월선과 관련해서는 남북간에 그동안 처리했던 여러 선례들이 있으니 그에 따라서 북한이 인도적인 차원의 조치를 조속히 취해 줄 것을 기대하고 있다""고 말했다.29t급 오징어 채낚이 어선 '800 연안호'는 30일 오전 5시5분께 강원도 제진(옛 저진) 동북쪽 37km 상의 동해 NLL을 13km가량 넘어갔다가 북한 경비정 1척에 의해 장전항으로 예인됐다.jhcho@yna.co.krksw08@yna.co.kr[관련기사]▶ 정부, 선원 조기송환 촉구 대북전통문 발송▶ <'연안호 언제 돌아오나'..어민들 애간장>(종합)▶ 玄통일 ""北 연안호관련 조기 반응 긍정적""▶ <北 `연안호' 입장표명..어떻게 봐야하나>▶ 北 ""연안호, 조사결과따라 처리""(종합)<실시간 뉴스가 당신의 손안으로..연합뉴스폰><포토 매거진><저작권자(c)연합뉴스. 무단전재-재배포금지.>"
