,날짜,기사 제목,기사 링크,기사 출처,기사 내용
76,2009-07-31,“생애 마지막 도전” 4050 ‘老公族’ 열풍,https://news.naver.com/main/read.nhn?mode=LSD&mid=shm&sid1=102&oid=020&aid=0002065974,동아일보,"[동아일보]연령제한 폐지후 신풍속도학원가엔 특별반까지 개설“중년층이 이해력은 더 높아”“오전 4시 반에 일어났어요. 요즘은 방학이라 딸의 도시락을 싸지 않아 힘이 좀 덜 듭니다. 오전 7시 학원의 첫 수업을 400명이 듣는데 옆자리의 젊은이들을 보면 경쟁자라는 생각에 긴장감이 느껴집니다.”29일 서울 성동구 금호동 자택에서 만난 주부 박정선 씨(41)는 거실에서 두꺼운 ‘9급 공무원’ 교재와 씨름 중이었다. 박 씨는 올 초부터 내년 3월 9급 법원직 공무원을 목표로 공부를 시작했다. 다시 펜을 잡은 것은 15년 만이다. 박 씨는 “새롭게 도전하는 것 자체가 삶의 원동력이 돼 더 건강해졌다”며 웃었다.○ 중년의 마지막 희망?올해 공무원 채용시험 응시 연령제한(만 18∼32세)이 폐지되면서 40, 50대 중년들이 공무원 시험으로 몰리고 있다. 28일과 29일 기자가 찾은 서울 노량진, 신림동의 학원, 고시원 등에서는 수업을 마치고 학원을 나서는 중년 남성이나 주부들이 눈에 띄었다. 자습실에도 아저씨, 아줌마 9급 공무원 준비생들이 많았다.이들은 자신보다 열 살 넘게 어린 20, 30대 공무원 시험 수험생들에게 ‘노공족(老公族)’으로 불린다. 나이 든 공무원 시험 준비생이라는 고시계 신조어다. 올해 치러진 행정안전부의 국가직 공무원 시험 지원자 14만879명(9급, 4월), 4만7947명(7급, 7월) 중 40대 이상 지원자는 각각 2538명(1.8%), 1452명(3%)이었다. 행안부 관계자는 “연령제한 폐지 첫해 치고는 40대 이상이 예상외로 많았다”고 밝혔다. 노량진, 신림동의 공무원학원에는 이들을 위한 특별반까지 생겼다.○ 패자부활형, 생계형, 자아발전형…노공족은 △명퇴 후 재기형 △자아실현형 △패자부활자형 등으로 나뉜다. 경남 합천군에 사는 이수길 씨(47)는 23년간 경남 지역 KT에서 근무하다 2000년 초반 명퇴한 후 3년 계약을 조건으로 한 회사에 정착했지만 계약종료가 코앞인 데다 아이들이 커 가는 모습에 불안감을 느꼈다. 그는 올 초부터 매일 오전 4시에 일어나 3시간 공부한 후 출근하고 퇴근 후 오후 7시부터 밤 12시까지 공무원 시험 공부를 하고 있다.한림법학원 양정걸 부원장은 “40대 이상 응시자들은 젊은이들보다 암기력, 체력 등이 떨어지지만 이해력이 뛰어나고 ‘막다른 길, 인생의 마지막 도전’이라고 생각하기 때문에 젊은이들보다 절실하다”며 “공무원 시험은 머리보다는 엉덩이 무거운 사람이 이기는 만큼 노공족의 공무원 입성이 점점 늘어날 것”이라고 밝혔다.실제로 28일 발표된 충남도 9급 공무원 합격자 302명 중 50대가 1명, 17일 발표된 부산시 공무원 합격자 243명 중 40대가 2명 포함됐다. 경남도 9급 공무원 필기시험에 붙은 55세의 하석진 씨는 “새로운 도전은 나이와 상관없는 것”이라고 말했다.김윤종 기자 zozo@donga.com김현승 인턴기자 한동대 언론정보문화학부 4학년내 손안의 뉴스 동아 모바일 401 + 네이트, 매직n, ez-iⓒ 동아일보 & donga.com, 무단 전재 및 재배포 금지"
77,2009-07-31,[벌레들의 침공] 도심 습격 일어날까,https://news.naver.com/main/read.nhn?mode=LSD&mid=shm&sid1=102&oid=081&aid=0002028356,서울신문,"[서울신문]충남 천안시 신부동에 사는 주부 이은경(30)씨는 8월을 목전에 두고 맘이 그다지 편치 않다. 도심 한복판에 있는 그의 단독주택에 꽃매미가 수시로 출몰해 가족들이 불안에 떨었던 기억 탓이다. 이씨는 “지난해 8월 중순 갑자기 벌겋고 검은 몸통을 한 징그러운 꽃매미 무리가 집 안으로 쳐들어온 뒤 10월까지 두달간 시도때도 없이 나타나는 바람에 소스라치게 놀란 적이 한두번이 아니었다.”면서 “꽃매미를 집 밖으로 쫓아내느라 소동까지 벌어졌다.”고 말했다.최근들어 벌레들이 도심을 ‘침공’할 것이라는 우려가 현실화하고 있다. 농촌지역에 주로 서식하며 농작물에 피해를 줬던 벌레들이 밀도가 높아지면서 도시로 영역을 확장하고 있는 것이다.잠자리 떼가 고속도로를 습격하는 일도 다반사로 일어나고 있다. 최근 영동고속도로를 통해 피서길에 올랐던 김지영(30·서울)씨는 “잠자리 수십마리가 한꺼번에 앞 유리창으로 달려들어 사고가 날 뻔했다.”며 “영동고속도로를 수없이 다녀봤지만 이런 일은 처음 겪었다.”고 말했다.권용정 경북대 응용생명과학부 교수는 “‘미국흰불나방’과 바퀴벌레 등 각종 해충의 도심 침공은 한국전쟁 이후 산업화·도시화 과정에서 계속됐으나 피해는 그리 크지 않았다.”면서 “하지만 기후변화로 새로운 종(種)의 서식 범위가 넓어지면서 갈수록 도심 침공 및 피해 사례는 늘어날 것”이라고 내다봤다.특히 그는 떼지어 몰려 다니며 곡식은 물론 사람까지 무차별 공격, 목숨까지 앗아가는 ‘붉은 불개미(fire ant)’의 국내 공습을 크게 경계했다.미국과 중국 도시들을 공포의 도가니로 몰아 넣고 있는 불개미의 국내 유입이 사실상 초읽기에 들어간 것으로 보고 있다.권 교수는 “이들 국가와의 교역 확대와 여객·화물 수송의 증대 등으로 불개미의 국내 유입은 피할 수 없다.”며 “일단 유입되면 번식력이 왕성해 살충제로도 퇴치가 어려운 만큼 국가 차원의 비상 대책을 마련해야 한다.”고 주장했다.남미가 원산지인 불개미는 강한 독성을 지녀 한번 물리면 몸이 퉁퉁 붓고, 과민성 쇼크로 정신을 잃을 수 있다. 심하면 목숨까지 잃는 것으로 알려져 있다.대구 김상화기자 shkim@seoul.co.kr[ 관련기사 ]☞ [벌레들의 침공](하)해충 습격에 시달렸던 진해·울산 르포☞ [벌레들의 침공]“생태조사 선행해야 천적키우기도 도움”‘맛있는 정보! 신선한 뉴스!’ 서울신문(www.seoul.co.kr)[☞ 서울신문 구독신청] [☞ 나우뉴스 바로가기] [☞ 나우뉴스TV 바로가기]- Copyrights ⓒ서울신문사. 무단 전재 및 재배포 금지 -"
78,2009-07-31,"美 ""북미대화 6자틀내 원칙 변화없어""",https://news.naver.com/main/read.nhn?mode=LSD&mid=shm&sid1=100&oid=001&aid=0002790749,연합뉴스,"北 보즈워스 방북요청 확인 거부(워싱턴=연합뉴스) 김재홍 특파원 = 미국 국무부는 6자회담을 통한 다자틀안에서 북한과 양자 대화를 해야 한다는 원칙에 아무런 변화가 없다고 30일 밝혔다.이언 켈리 국무부 대변인은 정례브리핑에서 반기문 유엔사무총장이 북.미 직접 대화를 지지한다는 입장을 표명한 것과 관련, ""우리의 대북 접근은 6자회담을 통해 다자방식으로 접근해야만 한다는 것""이라면서 ""그것이 우리의 접근이고 북한을 제외한 나머지 5개 당사국의 입장이기도 하다""고 말했다.그는 또 ""우리는 양자 대화에 대해 매우 분명한 입장을 표명해왔고 그것은 6자회담과 다자회담의 맥락 속에서 이뤄져야 한다는 것이며 그러한 입장이 바뀌지 않았다""고 말했다.켈리 대변인은 이어 북한이 억류중인 미국 여기자 2명의 석방 문제 협의를 위해 스티븐 보즈워스 미국 대북정책 특별대표와 성 김 6자회담 미국측 수석대표의 방북을 타진했다는 일본 언론의 보도와 관련해 사실 여부에 대한 확인 요청을 거부했다.그는 ""북한과 여러 가지 다양한 방법으로 대화하는 수단이 있지만 이러한 대화들의 성격을 구체적으로 규정하는 일에 관여하지는 않는다""면서 ""보즈워스 특별대표, 성 김 수석대표의 북한측과의 만남은 6자회담의 틀안에서 이뤄지게 될 것""이라고 말했다.하지만 켈리 대변인은 억류 여기자들의 석방을 위해 가능한 모든 노력을 다하고 있다면서 보즈워스 특별대표와 성 김 수석대표가 이 문제 해결을 위해 북한 측과 접촉할 가능성을 전적으로 배제하는 것은 아니라고 말했다.이와 함께 켈리 대변인은 억류 여기자들과 개성공단에 억류중인 한국인 근로자 문제를 연계시킬 가능성에 대해서도 구체적인 언급을 하지 않았다.jaehong@yna.co.kr[관련기사]▶ <연합시론> 유엔총장의 북미대화 지지▶ <北, 북미대화 재개 신호 주목>▶ <북.미 기류변화 조짐..정부대응 주목><실시간 뉴스가 당신의 손안으로..연합뉴스폰><포토 매거진><저작권자(c)연합뉴스. 무단전재-재배포금지.>"
79,2009-07-31,"정부, 외화유동성 단계적 회수",https://news.naver.com/main/read.nhn?mode=LSD&mid=shm&sid1=101&oid=001&aid=0002790836,연합뉴스,"금융위기후 공급 유동성 77% 회수(서울=연합뉴스) 류지복 기자 = 정부는 지난해 글로벌 금융위기 이후 정부가 시장에 공급했던 외화 유동성을 원칙적으로 회수하되 한미 통화스와프 자금과 수출입금융 지원자금은 당분간 유지하기로 했다.은행이 스스로 외화를 조달하는데 별 무리가 없을 정도로 신용경색이 해소된 상태인 만큼 정부의 개입을 최소화하겠다는 것으로서, 위기대응 차원에서 도입된 한시 대책을 무리 없이 정상화하겠다는 원칙에 따라 미시적 조정에 나선 것으로 풀이된다.31일 기획재정부에 따르면 재정부와 한국은행은 작년 9월 글로벌 금융위기가 불거진 이후 국내 은행 등에 네 가지 방식을 통해 모두 565억 달러의 유동성을 공급했고 현재 77.2%인 436억 달러를 회수했다.유형별로 재정부가 수출입은행을 통해 공급한 외화 중 은행을 위한 일반유동성 지원규모는 최고 190억 달러에 달했지만 지난달까지 모두 회수했다.또 수출입은행이 수출환어음 매입 등 수출입기업을 위해 지원한 금액도 2월말 110억 달러까지 올라갔으나 현재 43억 달러만 남은 상태다.한국은행이 작년 10월부터 12월까지 7차례에 걸쳐 경쟁입찰방식 외환스와프 거래를 통해 자체적으로 국내은행에 공급한 102억 달러의 경우 96억 달러를 회수했다.한은이 한미 통화스와프 자금을 활용해 공급했던 163억 달러 역시 지난 3월부터 회수에 들어가 현재 80억 달러가 시장에 공급돼 있다.정부는 이 중 재정부의 일반유동성 지원과 한은의 외환스와프 경쟁입찰은 더 유지하지 않기로 했다. 일반유동성 지원은 이미 전액 회수했고, 한은이 자체적으로 공급한 외화 102억 달러의 잔액 6억 달러도 다음달 6일 만기가 돌아오면 거둬들일 계획이다.하지만 수출입은행을 통한 수출입금융과 한미 통화스와프 자금을 이용한 외화 공급은 수요 상황을 지켜보면서 점진적으로 거둬들이기로 했다.정부가 공급한 유동성은 줄여나간다는 원칙 하에 상대적으로 은행이나 기업 입장에서 이점이 남아있는 정책 수단은 수요가 있는 한 유지하겠다는 계획인 것이다.재정부 관계자는 ""한미 통화스와프 자금의 금리는 은행의 자체 조달금리보다 낮아 은행에도 메리트가 남아있고, 수출입금융 지원도 수출입기업을 위해 유지할 필요가 있다""며 ""다만 수요가 감소하고 있어 공급액도 점점 줄어들 것으로 본다""고 말했다.jbryoo@yna.co.kr[관련기사]▶ 재정부 ""확장적 거시정책 기조 견지""▶ ""환율하락 대비 은행.항공.유통주 확대""▶ 총액한도대출.지준율 조정도 검토대상(종합)▶ <출구전략 조기시행 논란 확산>▶ 은행권 외화자금 사정 호전<실시간 뉴스가 당신의 손안으로..연합뉴스폰><포토 매거진><저작권자(c)연합뉴스. 무단전재-재배포금지.>"
80,2009-07-31,쌍용차 노사 이틀째 대화..입장차 여전,https://news.naver.com/main/read.nhn?mode=LSD&mid=shm&sid1=102&oid=001&aid=0002790761,연합뉴스,"쌍용차 노사(자료사진)(평택=연합뉴스) 심언철 김동규 기자 = 쌍용자동차 노사가 30일 대화를 재개해 정리해고자 구제안 등을 놓고 밤을 새워가며 이틀째 교섭을 벌였으나 이견을 좁히지 못했다.쌍용차 노사는 세 차례 걸친 3시간 회의와 3시간 정회를 거듭하며 31일 오전 4시5분 회의를 속개했다.양측은 핵심 쟁점인 정리해고자 976명의 구제안을 포함해 노조원들에 대한 손해배상청구소송, 형사고발 취하 등의 문제에서 절충안 도출에 어려움을 겪고 있다.사측 최상진 재무기획 상무는 ""아직 의견 차이가 많다. 이견이 있지만 협상을 계속하는 것은 타결의 여지가 있기 때문이다. 더 지켜봐 달라""고 말했다.교섭에 참가한 노조측 관계자는 ""협상 분위기는 여전하다. 접점을 찾으려 노력하고 있지만 아직 합의에 이른 것은 없다""고 전했다.사측 3명과 노측 4명 등 노사 대표 7명은 30일 오전 9시10분부터 평택공장 본관과 도장공장 사이 '평화구역'에 설치된 컨테이너 2곳에서 본협의와 실무협의를 병행했다.3시간 회의를 갖고 3시간 동안의 정회시간에 각각 대응논리를 만들어 협상테이블에 다시 앉는 식으로 교섭을 이어갔다.양측 모두 교섭장의 분위기만 전할 뿐 핵심 안건이 무엇인지에 대해서는 함구하고 있지만 교섭 결렬이나 연기는 고려하지 않는 것으로 알려져 이날 중으로 어떤 식으로든 결론이 나올 것으로 예상된다.<그래픽> 쌍용차 노사 교섭 시간대별 상황    (서울=연합뉴스) 박영석 기자 = 쌍용자동차 노사가 사측 3명과 노측 4명 등 노사 대표 7명이 30일 오전 9시10분부터 평택공장 본관과 도장공장 사이 '평화구역'에 설치된 컨테이너 2곳에서 본협의와 실무협의를 병행했으나 31일 오전11시 현재 타협점을 찾지 못하고 있다.    zeroground@yna.co.krchan@yna.co.kr[관련기사]▶ <쌍용차 노사 철야교섭..공장안팎 긴장>▶ 쌍용차 노사 정회 거듭..밤샘 교섭(종합)▶ 쌍용차노사 마라톤교섭..'정리해고' 진통▶ 인권위, 경찰에 쌍용차 긴급구제 권고▶ 포럼아시아 ""쌍용차노조 탄압 중단해야""<실시간 뉴스가 당신의 손안으로..연합뉴스폰><포토 매거진><저작권자(c)연합뉴스. 무단전재-재배포금지.>"
81,2009-07-31,‘고딩’같은 대학생들…치마폭에 싸여 미성숙 ‘고교4년생’ 비아냥 받아,https://news.naver.com/main/read.nhn?mode=LSD&mid=shm&sid1=102&oid=032&aid=0002022468,경향신문,"ㆍ엄마가 수강신청·학점관리…승합차 통학까지서울 ㅇ대 경영학과 김모 교수는 지난 9일 연구실에서 뜻밖의 전화를 받았다. “우리 아이 학점이 C+가 나왔다. 출석도 다했고 기말고사도 나쁘지 않게 봤다는데, 어떤 근거에서 이런 성적을 준 거냐”는 수강생 어머니의 전화였다. 김 교수는 구체적으로 설명했지만, 막무가내로 B학점 이상을 달라고 요구하는 ‘엄마’의 성화에 전화를 쉽사리 끊지 못했다.지난 4월 서울의 한 법학전문대학원(로스쿨)의 입학설명회장에는 곳곳에 자리잡은 학부모들이 상세한 기초정보를 갖고 질문을 던졌다. 대학생 아들 대신 참석한 50대 주부는 “지난해 합격생들 가운데 외국 대학 출신들은 모두 미국 명문대 그룹인 아이비리그 애들이었다고 한다”며 “주눅들어 있는 우리 애는 어떻게 해야 하나”라고 물었다.학부모의 치맛바람과 깊어지는 취업난 속에 대학생들이 독립된 인격체로 성숙하는 시간이 더뎌지고 있다. 자녀의 학교 생활이나 진로 선택에 개입하는 부모들이 늘면서 대학가에서 양산되는 이른바 ‘나이 먹은 미성년자’ ‘고교 4학년생’들이다.핵가족화가 심화되며 교육 경쟁이 과열되고 취업난은 사회적 보호연령대를 점점 높이고 있다는 지적이다.2학기 수강신청을 하루 앞둔 지난 28일 서울대 자유전공학부 행정실에도 전화가 왔다. “‘인문사회계를 위한 생물학’ 강의가 왜 수강신청 사이트에 뜨지 않느냐”는 것. 학교 관계자는 “학생 대신 수강 과목 선정을 하려는 어머니였다”고 말했다.취업 포털 ‘인쿠르트’가 최근 신입사원(구직자) 부모 414명을 상대로 ‘자녀의 진로 선택에 자신이 얼마나 영향을 미쳤나’라고 설문한 결과 ‘다소 미쳤다’(53.1%), ‘매우 미쳤다’(15.5%)는 응답이 약 70%에 달했다.대학생들이 스스로 선택하는 중·고교 시절의 생활습관도 적잖다.지난 4월에는 서울대 학생들 스스로 조직한 통학버스가 등장했다. 잠실을 출발해 강남·서울대·신림동 고시촌까지 운행하는 이 25인승 버스의 별명은 일명 ‘시체버스’. 오전 6시50분에 첫 출발해 오후 11시쯤 하교하기 때문에 피곤해진 학생들이 차내에서 널브러져 자고 있기 때문이다.방학을 맞은 대학 도서관에서는 한자 노트의 네모 칸에 한자를 빼곡히 적고 있는 대학생들의 모습도 곳곳에서 눈에 띈다. 취업에 유리한 한자능력시험을 준비하는 것이지만, 어린 시절에 익숙했던 장면들이다.고려대 조대엽 교수(사회학)는 “핵가족화로 인한 부모들의 과잉보호 경향과 지나친 경쟁주의가 낳은 결과”라며 “대학이 서바이벌 시스템 속에 놓이면서 가능한 모든 자원들이 투입되고 있는 것”이라고 말했다.<정환보·김지환기자 botox@kyunghyang.com>- 대한민국 희망언론! 경향신문, 구독신청(http://smile.khan.co.kr) -ⓒ 경향신문 & 경향닷컴(www.khan.co.kr), 무단전재 및 재배포 금지〈경향닷컴은 한국온라인신문협회(www.kona.or.kr)의 디지털뉴스이용규칙에 따른 저작권을 행사합니다.〉"
82,2009-07-31,찬란한 유산? 쓰고 갈 재산!,https://news.naver.com/main/read.nhn?mode=LSD&mid=shm&sid1=101&oid=020&aid=0002065995,동아일보,"[동아일보]“불황엔 집이 효자”… 주택연금에 노인들 몰린다도입 초기엔 “내집을 왜…”자녀들이 계약서 찢기도“눈치 안보고 생활비 받자”최근 월 100건 이상씩 가입최모 씨(82)는 약 두 달 전 고민 끝에 전 재산인 경기 파주시 교하읍의 2억9000만 원짜리 아파트를 담보로 주택연금을 신청했다. 몇 년 전까지만 해도 노인 일자리사업에 참여해 용돈을 벌어 쓸 수 있었고 네 명의 자녀가 조금씩 보태주는 생활비도 있었다. 하지만 손자들의 교육비 부담이 늘어난 데다 경기도 나빠져 자녀들에게 손을 벌리기에는 낯이 안 섰다. 나이 팔십을 넘기면서 일감을 찾기도 힘들어졌다.몇몇 친구는 “그래도 하나밖에 없는 집은 자식들에게 물려줘야 하는 것 아니냐”며 최 씨를 말렸지만 그는 “집을 물려주는 조건으로 자식들에게 생활비를 부탁하기보다는 평생 모은 내 재산으로 마음 편하게 사는 것이 낫다”고 말했다.최 씨는 매달 주택연금으로 83만 원을 받게 됐다. 그는 “소득 없이 집 한 채만 갖고 있는 노인들은 사실 빈털터리나 마찬가지”라며 “고정적인 수입이 생기니 형편이 어려운 자식들에게 아쉬운 소리를 하지 않아도 돼 마음이 편하다”고 말했다.○ 도입 초기엔 부모 - 자녀 간 갈등역모기지론인 주택연금 가입자가 늘고 있다. 60세 이상 노인들이 주택을 담보로 매달 일정액의 연금을 받는 주택연금은 2007년에 도입됐지만 처음에는 큰 인기를 끌지 못했다. 집을 담보로 생활비를 지급받는 특성이 ‘집은 자녀에게 물려줄 유산’이라는 전통적인 사고방식과 맞지 않았기 때문이다.실제로 도입 초기 상담창구에서는 부모와 자녀 사이에 얼굴을 붉히는 일도 자주 벌어졌다. 주택금융공사 주택연금부 김형목 차장은 “노부부가 주택연금 계약을 하면 며칠 뒤 자녀들이 찾아와 ‘내 집을 왜 부모님이 마음대로 처분하느냐’며 계약서를 찢어버리고 가는 사례도 종종 있었다”고 전했다.최근 들어 상황이 달라졌다. 주택금융공사에 따르면 올해 초까지는 월평균 가입 건수가 50∼60건에 불과했지만 3월 이후 가입자가 급증하기 시작해 4개월 연속 100건 이상씩 접수됐다. 매달 1000억 원에도 못 미치던 보증금액도 4월부터 이전의 두 배 수준인 2000억 원대로 증가했다. 김 차장은 “전통적인 사고방식이 여전히 강한 지방보다 서울과 수도권을 중심으로 가입자가 크게 늘었다”고 말했다.○ 집은 ‘유산’이 아니라 ‘재산’외면 받던 역모기지론이 뒤늦게 관심을 끄는 것은 경기침체와 노인들의 인식 변화가 맞물린 결과다. 자녀들이 직장을 잃거나 소득이 줄면서 생활비를 의지할 데가 없게 되자 유일한 재산인 집을 담보로 한 주택연금에 눈을 돌리고 있는 것. 생활비 때문에 집을 팔아버리면 목돈이 생기는 대신 당장 살 곳이 없어지지만 주택연금에 가입하면 익숙한 집에서 계속 살 수 있는 데다 매달 일정한 연금을 받을 수 있어 안정적인 생활이 보장된다. 주택금융공사 강계중 상담사는 “서울 강북지역에 1억∼2억 원대 소형 주택을 소유한 노인들이 최근 형편이 어려워지면서 자녀들과 함께 상담하러 오는 경우가 부쩍 늘었다”고 말했다.집은 자녀에게 물려줄 ‘유산’이 아니라 자신이 처분할 수 있는 ‘재산’이라는 인식 변화도 점차 확산되고 있다. 경기 성남시 분당구 야탑동에 사는 공철규 씨(70)는 6월 말 주택연금을 신청해 매달 150만 원을 받게 됐다. 공 씨는 “자녀들에게 의지하기보다는 내가 평생 노력해 마련한 집으로 노후에 안정된 삶을 누리는 게 의미 있다고 생각해 1년 동안 자녀들을 설득했다”고 말했다.이화여대 경제학과 차은영 교수는 “지금까지는 ‘집은 상속의 수단’이라는 인식이 많았지만 고령화 속도가 빨라지면서 이런 개념도 변할 것”이라고 말했다.::역(逆)모기지론::고령자가 주택을 담보로 사망할 때까지 연금 형태로 노후생활비를 지급받는 금융상품. 연금 수혜자가 사망하면 금융회사가 주택을 처분해 대출금과 이자를 회수한다. 대출을 얻어 집을 산 뒤 장기간 원리금을 갚아나가는 모기지론과 반대되는 개념이다. 국내에서는 정부가 보증하는 역모기지론을 ‘주택연금’이라고 한다.이서현 기자 baltika7@donga.com내 손안의 뉴스 동아 모바일 401 + 네이트, 매직n, ez-iⓒ 동아일보 & donga.com, 무단 전재 및 재배포 금지"
