,날짜,기사 제목,기사 링크,기사 출처,기사 내용
0,2018-08-21,'함께 있다는 게 꿈같은 하루'…70년 만에 여동생 자랑에 신난 오빠,https://news.naver.com/main/read.nhn?mode=LSD&mid=shm&sid1=100&oid=056&aid=0010612148,KBS,"[앵커]처음의 어색함은 금세 사라지고 남북의 가족들은 만난 지 이틀만에, 떨어져지낸 몇십 년의 세월이 무색할 만큼 가까워졌습니다.역시 피는 물보다 진한가 봅니다.강푸른 기자입니다.[리포트]아직도 오빠 눈에는 단발머리 11살 여동생.손을 꼭 잡은 채 동생 자랑에 신이 났습니다.[김병오/88살/북측 여동생 만남 : ""얼마나 미인이지. 이쁘지? 이쁘대.  우리 여동생. 70년 됐어. 만난 지가.""]과자를 먹여줄 땐 함께한 어린 시절로 돌아간 듯 합니다.4살 때 헤어졌던 아들, 아흔이 넘은 어머니는 아들의 건강 걱정 뿐입니다.[이금섬/92살북측 아들 만남 : ""잤는가. 집, 거기 가서. 숙소에 가서 좀 자고 왔는가.""][""나의 살던 고향은 꽃피는 산골...""]스스럼 없이 남북 가족이 하나가 되어 노래를 부르고...사진을 남기는 표정들도 한층 밝아졌습니다.취재진 앞에서 익살스런 모습도 연출합니다.[정한철(남,84) 정용철(북,53) : ""왜 나를 봐, 저기 봐야지 (삼촌 보는 게 더 좋습니다.)""]간식도 사이 좋게 나눠 먹지만,[""맛있어. 이거 드세요.""]그래도 집에서 만든 밥을 함께 먹고 싶습니다.[""앞으로 있죠, 누님이 해준 밥을.. (그래 한번 해줄게...)""]내일(22일) 헤어질 일은 잊어버리고 그냥 함께 있다는 게 꿈같은 하루였습니다.[김혜자77살/북측 남동생 만남 : ""어유~ 사랑해! (하하, 누님 사랑해!)""]KBS 뉴스 강푸른입니다.강푸른▶ 네이버 채널 KBS뉴스 구독! 시원하게 털어드립니다▶ ‘TV보다 리얼’한 색다른 뉴스![저작권자ⓒ KBS 무단복제-재배포 금지]"
1,2018-08-21,국민들 '남미 집시' 처지에…석유 부국 베네수엘라의 추락,https://news.naver.com/main/read.nhn?mode=LSD&mid=shm&sid1=104&oid=437&aid=0000189616,JTBC,"위기의 베네수엘라…몸무게도 평균 11㎏ 빠져정치권 부패에 230만명 '해외로'…이웃국가와 마찰[앵커]남미에서 한때 가장 부자였던 '베네수엘라'. 석유 하나로 황홀한 부를 누렸지만, 이제는 딴 세상 얘기입니다. 산더미로 돈을 가져가야 생닭 1마리를 겨우 살 수 있고, 지폐는 종이 공예의 재료로 전락했습니다. 심각한 '식량난'으로 국민들의 평균 몸무게가 무려 11kg이나 줄었습니다. 잘 나가던 '베네수엘라'가 어쩌다가 이 지경이 됐을까요.석유에만 의존했던 경제정책은 국제유가가 하락하면서 대혼란에 빠졌습니다. 여기에 심각한 정치권의 부패와 혼란스러운 정책 대응이 더해져서 사실상 국가는 파산상태입니다. 이런 상황에서 베네수엘라 국민들은 국가를 등지기 시작했습니다. 3년 동안 230만 명이 떠났습니다. 그리고 이들은 이웃 나라들과의 '이민 문제'를 촉발하고 있습니다. 최근 브라질에서는 군대까지 투입하기로 결정했습니다.김준영 기자입니다.[기자]브라질 북부 호라이마주에서 베네수엘라 난민 1200명이 모국으로 향하고 있습니다.크고 작은 짐꾸러미를 챙겼습니다.최근 현지인들과 충돌로 소요사태가 일자 브라질 정부가 이주민들을 내쫓은 겁니다.브라질 당국은 이민자 단속을 위해 군병력 투입도 결정했습니다.베네수엘라 난민들이 갈등 요인이자 거부 대상으로 떠오른 것은 브라질 뿐이 아닙니다.국경을 맞닿지 않은 에콰도르와 페루에서는 난민 유입을 우려, 유효 여권 소지자에 한해서만 입국을 허용하는 방침을 세웠습니다.베네수엘라 난민 80만 명이 거주 중인 콜롬비아는 지난 2월부터 접경에 경찰을 배치해 단속을 강화하고 있습니다.베네수엘라발 난민 문제가 확산하고 있는 겁니다.[호르헤 엔리케 퀴노네스/유니세프 특별대표 : 남미 역사상 한 번도 경험해 보지 못한 이주 위기가 벌어지고 있습니다. 이 문제는 남미 전역으로도 확산될 우려가 있습니다.]유엔에 따르면 지난 3년간 베네수엘라를 떠난 국민은 인구의 약 7%인 230만 명이며, 올해 들어 하루평균 3000명이 국경을 넘고 있습니다.한때 남미에서 가장 부유했던 베네수엘라 국민들이 거처없이 떠도는 남미의 집시로 전락할 처지에 놓였습니다.(영상디자인 : 배장근)김준영(kim.junyoung@jtbc.co.kr) [영상편집: 이화영]▶ 라이브 시청은 유튜브로,제보는 뉴스룸으로!▶ 스토리, 라이브, 비하인드! JTBC 소셜스토리Copyright by JTBC(http://jtbc.joins.com)and JTBC Content Hub Co., Ltd. All Rights Reserved. 무단 전재 및 재배포 금지"
2,2018-08-21,"실향민 모인 아바이마을 ""상봉, 꿈에나 그릴까…""",https://news.naver.com/main/read.nhn?mode=LSD&mid=shm&sid1=102&oid=437&aid=0000189617,JTBC,"[앵커]이산가족 상봉이 이루어지고 있는 강원도 속초에는 실향민 마을인, '아바이 마을'이 있습니다. 전쟁을 피해서 잠시 내려왔다가 70년 가까이 정착한 주민들이 대부분입니다. 2년 10개월 만에 다시 열린 상봉을 바라보는 그 심정이 어떨까요.밀착카메라 손광균 기자입니다.[기자]관광객들이 단돈 500원을 내고 배에 올라탑니다.정원이 차면 두 남성이 밧줄을 잡고 한쪽으로 당기기 시작합니다.섬과 육지 사이의 수십 ｍ를 줄로 연결해 사람을 실어 나르는 이른바 '갯배'입니다.도로가 생기기 전까지 실향민 정착촌인 '아바이 마을'로 가는 유일한 교통수단이었습니다.지금은 관광 명소가 됐지만, 아직도 옛 모습을 간직한 곳도 있습니다.전쟁 직후의 아바이 마을 같은 피난민 동네를 그대로 재현한 곳입니다.가장 먼저 눈에 띄는 것은 이런 교실인데요.벽에 붙어 있는 것처럼 배움을 통해서 가난을 극복하려고 했습니다.실제로 당시에 이런 집들을 보면 겉에는 판자와 나무를 덧대서 만들 정도로 열악했는데요.내부는 더 좋지 않았습니다.온 가족들이 좁은 공간에서 먹고 자고 또 함께 생활해야 했습니다.전반적으로 물자가 부족했기 때문에 부엌에도 최소한의 식기만 두고 생활했습니다.6·25 전쟁, 그중에서도 1·4 후퇴 당시 함경도와 인근에 살던 주민들이 속초로 내려온 것이 아바이 마을의 시작이었습니다.실향민 박영도 씨는 3일만 머물다 고향으로 가려던 계획이 68년째 미뤄졌습니다.[박영도 (피란 당시 11살) : 3일만 좀 빠졌다가 돌아온다, 이렇게 됐었어요. 부모님도 아무것도 안 가지고 나온 거예요. 아무것도 안 가지고 홀몸으로 그냥.]외갓집에 두고 온 8살 여동생 영내가 아직도 살아있다면 올해 일흔 여섯의 할머니입니다.[박영도 (피란 당시 11살) : 너 아버지가 담배를 피우면서 '고거 예쁘다' 하다 불똥이 떨어지면서 데여서 (여동생 얼굴에) 점이 있다고 얘기해줬는데. 이제 만나기 어려울 거 같아요.]여동생을 만날 수 있다는 희망은 점점 사라지고 있지만, 상봉 가족들의 모습에서 눈을 떼지 못합니다.[박영도 (피란 당시 11살) : ('나도 저기에서 동생 만났으면 참 좋았을 텐데' 하는 아쉬움도 드세요?) 허허. 꿈에나, 꿈에나 그릴까…]이산가족 상봉은 20번 넘게 이루어졌지만, 한 번에 만나는 사람들은 100명에 불과합니다.이렇다 보니 오랜 시간 가족들을 만나지 못한 이산가족들은 아예 마음을 접기도 합니다.[박규순 (피란 당시 20살) : 지금은 갈 생각이 없어요. 왜냐? 부모님, 형님 (나이가) 한 120~130살, 그렇게 됐기 때문에 가봐야 만날 사람이 없어요.]아바이마을 실향민은 100여 명.대부분 80살이 넘은 고령으로, 거동이 가능한 사람은 절반에 불과합니다.그러나 이번 상봉을 포함해 21번 동안 선정된 사람은 단 1명 뿐입니다.[김순필 (피란 당시 19살) : 서로 생사를 모릅니다. 죽었는지 살았는지도 모르죠. 거기 어머니도 계시고 조카들도 있고. 형도 누나도 다 있었죠.]현재 이산가족 5만 6000여 명 중 80세 이상은 60%가 넘습니다.90세 이상도 5명 중 1명꼴입니다.죽기 전에는 만나고 싶다는 이들의 절실함을 노린 사기도 늘어나고 있습니다.[이산가족 말고 중국을 통해서 만나는 그 뭐 있잖아요. 거기 돈 줘서. 그래서 돈 잃어버렸어. 만나보지도 못하고.]이곳 실향민 한 분도 북측 친지들과 만날 날만 기다리다 최근 입원했는데요.이산가족들은 이번에 나온 상봉 확대 방안이 하루빨리 이뤄지기를 간절히 바라고 있습니다.손광균(sohn.kwanggyoun@jtbc.co.kr) [영상취재: 김진광 / 영상편집: 최다희]▶ 라이브 시청은 유튜브로,제보는 뉴스룸으로!▶ 스토리, 라이브, 비하인드! JTBC 소셜스토리Copyright by JTBC(http://jtbc.joins.com)and JTBC Content Hub Co., Ltd. All Rights Reserved. 무단 전재 및 재배포 금지"
3,2018-08-21,"태풍 솔릭, 곤파스와 닮았다…2010년 피해 상황 어땠나",https://news.naver.com/main/read.nhn?mode=LSD&mid=shm&sid1=103&oid=055&aid=0000668552,SBS,<앵커>지금까지 솔릭의 움직임을 보면 지난 2010년 한반도를 할퀴고 지나갔던 태풍 곤파스와 비슷합니다. 당시 초속 30미터가 넘는 바람에 6명이 숨지고 1천 7백억 원의 재산 피해가 났습니다. 상습 침수 지역이나 태풍이 지나가는 지역에 계신 분들 단단히 대비하시고 주변에 있는 시설물도 다시 한번 둘러보시기 바랍니다.김영아 기자입니다.<기자>철골 구조물이 엿가락처럼 휘어지고 부러졌습니다.초속 30미터가 넘는 강한 바람에 쓰러진 가설물이 지하철역 입구를 덮치고 서울 시내에서만 가로수 2천여 그루가 뿌리째 뽑히거나 부러졌습니다.지난 2010년 7호 태풍 '곤파스'가 불과 4시간 만에 수도권을 관통하며 남긴 상처입니다.제주도를 거쳐 충남 서쪽 해안을 지나 한반도에 상륙한 뒤 수도권을 훑고 동해로 빠져나간 곤파스의 경로는 솔릭의 예상 경로와 놀랄 만큼 흡사합니다.당시 곤파스의 최저 중심기압은 960헥토파스칼. 크기는 중형이지만 위력은 강했던 것도 솔릭과 꼭 닮았습니다.곤파스는 당시 세력이 비교적 약해진 상태에서 한반도에 상륙해 4시간 만에 빠져나갔습니다.그런데도 17명의 인명피해와 함께 1천7백억 원이 넘는 막대한 재산 피해를 냈습니다.인구와 자원이 집중된 수도권을 관통한 탓입니다.하지만 곤파스의 피해가 적었던 다른 지역도 방심은 금물입니다.[강남영/국가태풍센터 팀장 : 비슷한 경로라고 해도 태풍이 해상이나 육상을 지나면서 세력이 변할 수도 있고요. 이동속도에 따라서도 영향을 미치는 것이 달라지기 때문에 계속 상황을 지켜봐야겠습니다.]특히 한반도 동쪽의 북태평양 고기압이 더 확장하면 솔릭이 수도권에 직접 상륙할 가능성도 있어 각별한 대비가 필요합니다.(영상편집 : 김호진)김영아 기자(youngah@sbs.co.kr)☞ 내가 보낸 영상이 SBS 뉴스로! 제보하기 '클릭'☞ [아시안게임 특집 뉴스] 생생 경기 하이라이트 보러 가기!※ ⓒ SBS & SBS Digital News Lab. : 무단복제 및 재배포 금지
4,2018-08-21,"줄줄이 영장 기각, 법원의 제 식구 감싸기?",https://news.naver.com/main/read.nhn?mode=LSD&mid=shm&sid1=102&oid=308&aid=0000023522,시사IN,"‘사법 농단’의 핵심 인물에 대한 압수수색 영장이 법원에서 잇달아 기각됐다. 법원의 ‘제 식구 봐주기’라는 비판이 나온다. 기각 사유를 보면 법원이 수사를 막는다는 의심이 더욱 짙어진다.‘법의 심판자는 누가 심판할 것인가.’ 양승태 대법원의 재판 거래 의혹이 낳은 질문이다. 검찰이 강제 수사를 본격화하자 사법부가 제동을 건 모양새 때문이다. 법원은 검찰의 압수수색 영장 청구를 잇달아 기각했다(아래 <표> 참조). 8월1일 현재 수사 대상인 전·현직 법관 중에서는 임종헌 전 법원행정처 차장의 자택과 사무실에만 압수수색 영장이 발부됐다.법원이 ‘제 식구 봐주기’ 하는 게 아니냐는 비판이 나온다. 영장 평균 발부율과 비교해봐도 차이가 난다. <법원통계월보>에 따르면, 지난 1월부터 6월까지 전체 법원의 압수수색 영장 발부율은 87.85%다. 전체 11만9492건 중 발부 10만4981건, 일부 기각 1만3267건, 기각 1244건이다. 재판 거래 의혹 사건은 정반대다. 이번 사건의 영장 발부율이 9%대라고 검찰은 밝혔다.압수수색 영장 기각 사유를 보면 법원이 수사를 막는다는 의심이 더욱 짙어진다. 7월27일 법원행정처 윤리감사관실에 대한 압수수색 영장을 기각하며 허경호 부장판사는 “임의 제출 가능성을 배제할 수 없다”라고 밝혔다. 임의 제출은 압수수색 당사자가 스스로 자료를 내놓는다는 말이다. 검찰은 김명수 대법원장이 수사에 적극 협조하겠다고 밝혔음에도 법원이 임의 제출에 소극적이라는 불만을 감추지 않고 있다.8월1일 이언학 부장판사는 법원행정처 국제심의관실에 대한 압수수색 영장 발부를 기각하면서 “일개 심의관이 작성한 문건에 따라 대법관이 재판한다고 보기 어렵다”라고 선을 그었다. 그러면서 같은 날 외교부 청사에 대한 압수수색 영장은 발부했다. 이뿐만 아니라 법원은 전·현직 판사 30여 명에 대한 이메일 보전조치(훼손·변경·삭제 금지) 영장도 기각했다. 임종헌 전 차장 등 3명에 대해서만 이메일 압수수색 영장을 발부했다. 현재 재판 거래 의혹을 바라보는 법원의 시각이 반영된 게 아니냐는 우려가 나온다.더욱이 영장전담 판사들과 양승태 법원행정처의 인연이 입길에 올랐다. 이언학 부장판사는 혐의 선상에 오른 박병대 전 법원행정처 처장과 2010년 서울고등법원 재판부에서 함께 근무했다. 허경호 부장판사 또한 재판 거래 의혹으로 고발당한 강형주 전 법원행정처 차장과 2011년 서울고등법원에서 같은 재판부였다. 수사-기소-재판으로 이어지는 형사 절차에서 검찰 수사를 견제하는 역할(영장 심사 등)을 하는 법원이 ‘심판’이 아닌 ‘플레이어’라는 의심을 사는 셈이다.©연합뉴스 2017년 6월 박병대 대법관(가운데)의 퇴임식에서 배웅하는 양승태 대법원장(뒷줄 맨 왼쪽).이런 상황에서는 해당 수사의 유무죄를 판단(선고)하는 법원의 심판 역할조차 믿을 수 없다는 목소리도 힘을 얻고 있다. 문제는 현행법으로는 이를 제어할 방법이 없다는 점이다. 피의자나 피고인과 같은 재판부에 근무한 경험이 영장전담부 또는 배당 사건 재판부의 제척이나 회피 사유에 해당하지 않는다.국회에서는 특별법 제정이 논의되고 있다. 그동안 사법부 자체 조사에 힘을 실어줬던 입법부가 이제는 삼권분립보다 삼권 견제와 균형이라는 가치에 더 무게를 두겠다는 뜻이다. 박주민 더불어민주당 의원이 관련 특별법을 대표 발의할 예정이다.법안의 핵심은 수사·재판 과정의 공정성 추구다. 재판 배당을 기존 전자 시스템에 맡기지 않고, 독립적으로 구성하자는 내용이다. 형사합의부를 구성하는 판사 3명을, 특별재판부 후보 추천위원회를 만들어 거기서 추천받은 판사를 대법원장이 임명하도록 하자는 제안이다. 수사 단계에서도 이 위원회가 추천한 특별영장전담 법관을 둔다. 특별재판부 후보 추천위원회는 판사회의·대한변호사협회·시민사회에서 각각 3명씩 추천한 9명으로 구성한다. 1심은 국민참여 재판으로 진행한다.재판부 독립성 확보하는 ‘특별법’ 제정 움직임국회도 부응하는 분위기다. 잇단 영장 기각 소식이 전해진 8월1일 추미애 더불어민주당 대표는 “사법부가 스스로 자정 능력이 없다면 국민 재판부 구성 등을 통해 국민이 직접 나설 수밖에 없다”라고 말했다. 같은 날 김관영 바른미래당 원내대표도 “이 사건과 관련한 특별재판부 도입이 신속히 검토되어야 한다”라고 말했다.국회 법제사법위원회를 통과한 법안은 본회의에서 과반 이상 출석에 과반 이상 찬성으로 의결된다. 개혁입법연대 이야기가 나올 정도인 현재 국회의원 구성을 보면 특별법 통과도 점쳐볼 수 있다. 자유한국당(112명)을 제외하면 여야 4당(더불어민주당·바른미래당·민주평화당·정의당) 의원은 178명이다. 국회 법제사법위원회 한 의원은 “양승태 대법원이 개별 국회의원을 접촉해서 로비를 계획한 문건까지 나온다. 각 의원들이 대놓고 반대하기 어렵다”라고 말했다.다음 날인 8월2일 <조선일보>는 ‘반민특위 때처럼… 與, 특별재판부 요구’라는 제목으로 특별법이 사회적 혼란을 부추긴다는 취지로 보도했다. 특별재판부는 해방 직후처럼 예외적인 시기에 도입됐다고 주장했다. 박주민 의원은 이를 의도적 오독이라고 비판했다. 자신이 대표 발의할 특별법은 반민특위 때처럼 ‘법원 밖의 법원’을 신설하자는 게 아니라고 설명했다. 업무분장 시스템을 고쳐, 이미 법관인 사람 중 서울중앙지법 안에서 새롭게 재판부를 구성하자는 것이다. 또한 대법원장 자문기구인 ‘사법발전위원회’도 국민참여 재판을 더 늘려야 한다고 제안하는 상황에서 기본권 침해나 위헌 소지가 있다는 주장도 맞지 않다고 반박했다.법의 수호자를 자처하는 검찰 역시 특별검사제도를 두고 있다. 검찰에 대한 불신이 커지면서 국회가 만든 제도다. 특검법을 만들어 검찰 밖 인물을 검사로 임명할 수 있게 했다. 또한 검찰 스스로 내부 규칙(대검 훈령)을 수정해 특임검사 제도를 만들었다. 특임검사는 기존 검찰 지휘라인에서 벗어나 검찰총장에게만 직보한다. 이조차 한계가 있어서 고위공직자비리수사처를 따로 만들자는 주장이 계속 나온다.하지만 행정부 소속인 검찰과 달리 사법부인 법원에 대한 견제는 지금까지 전무하다시피 했다. 삼권분립을 존중하는 차원이었다. 재판 거래 의혹이라는 전례 없는 상황을 맞이해, 법원의 법관 심판에 대한 독립성이 의심받기 시작했다. 사법부의 신뢰도가 추락해서다. 재판부의 독립성을 확보하는 내용을 법제화한 특별법이 대안으로 부상 중이다.김은지 기자 smile@sisain.co.kr싱싱한 뉴스 생생한 분석 시사IN Live - [시사IN 구독]©시사IN, 무단전재 및 재배포 금지"
5,2018-08-21,서쪽 쏠린 태풍 '솔릭'… 달리는 차도 뒤집을 '슈퍼 파워',https://news.naver.com/main/read.nhn?mode=LSD&mid=shm&sid1=102&oid=081&aid=0002937598,서울신문,"폭우보다 강풍 영향… 최대 초속 40m[서울신문]‘17명 사상’ 2010년 곤파스와 경로 비슷육지로 옮기는 어선들  - 제19호 태풍 ‘솔릭’이 한반도를 향해 북상 중인 가운데 21일 오후 울산 북구 자항에서 어민들이 크레인을 동원해 어선을 육지로 옮기며 태풍에 대비하고 있다. 울산 연합뉴스2012년 9월 발생한 제16호 태풍 ‘산바’ 이후 6년 만에 한반도를 관통하는 전설의 족장 ‘솔릭’이 무서운 기세로 다가오고 있다. 특히 솔릭은 당초 예상 경로보다 서쪽으로 치우쳐 이동할 것으로 예상되면서 수도권을 비롯한 중부 지방에 엄청난 피해가 우려된다.기상청은 “북태평양고기압이 확장하면서 제19호 태풍 ‘솔릭’은 다소 느린 속도로 서쪽으로 이동하고 있으며 한반도는 폭우보다는 강풍의 영향이 더 클 것”이라고 21일 밝혔다.솔릭은 22일 오전 제주 서귀포 남쪽 약 340㎞ 해상을 지나 기존 예상과는 달리 전남 해안으로 상륙하지 않고 서해안을 따라 이동하다가 ‘중급’ 강도의 중형 태풍으로 23일 오후 충남 서해안 지역인 보령과 서천에 상륙할 것으로 예상된다. 이후 충남 지역을 훑은 뒤 경기 남부를 비롯한 수도권 지역을 관통해 오는 24일 오전 중에 동해안으로 빠져나갈 것으로 기상청은 내다보고 있다. 서울을 비롯한 수도권은 24일 새벽에 태풍과 가장 가까워질 것으로 예상된다.-태풍이 서쪽으로 치우치면서 태풍의 위험반원인 오른쪽에 우리나라가 위치해 강수량은 다소 줄겠지만 바람은 더 강해질 것으로 보인다. 기상청은 태풍이 상륙해 지나가는 23~24일에는 전국적으로 초속 24~32m의 강한 바람이 불고 일부 지역에서는 초속 40m에 가까운 바람이 불 수도 있을 것으로 보고 있다. 풍속이 초속 40m에 이르면 똑바로 서 있기도 힘들고 대형 차량은 주행 중 뒤집힐 가능성이 있으며 고층 아파트에서는 유리창이 깨질 수도 있는 위력이다.기상청 예보국 관계자는 “당초 2006년 7월에 발생한 3호 태풍 ‘에위니아’와 비슷한 경로로 이동할 것으로 예상됐지만 현재 상황으로는 2010년 8월에 발생한 제7호 태풍 ‘곤파스’에 더 가까울 것으로 예상된다”며 “북태평양고기압이 더 확장할 경우 태풍의 진로는 현재 예상보다 서쪽으로 더 편향될 것”이라고 밝혔다.국가재난정보센터에 따르면 당시 곤파스로 인한 인명 피해는 사망 6명, 부상 11명이었고 재산 피해는 1761억원에 달했다.유용하 기자 edmondy@seoul.co.kr▶  재미있는 세상[나우뉴스]▶ [인기 무료만화] [페이스북]ⓒ 서울신문(www.seoul.co.kr), 무단전재 및 재배포금지"
