,날짜,기사 제목,기사 링크,기사 출처,기사 내용
32,2018-08-21,백두산에서 끓여먹는 라면의 맛은?,https://news.naver.com/main/read.nhn?mode=LSD&mid=shm&sid1=104&oid=056&aid=0010611862,KBS,"""백두산에서 맛본 라면은 꿀맛""호주와 노르웨이에서 온 관광객 4명이 백두산에서 캠핑하며 라면을 끓여 먹었다. 이들에겐 다소 이색적인 경험이다. 북한 관광 안내원들은 큰 냄비에 족히 5개쯤 되는 라면을 끓였고, 맛을 본 관광객들은 감탄사를 연발했다.호주 여성 2명과 노르웨이 남성 2명으로 구성된 여행객들은 지난주 토요일 백두산 천지에 오르고, 고원을 하이킹했다. 그리고 백두산 중턱에서 텐트를 치고 첫날밤을 보냈다. 안내원들도 텐트를 치고 5일간의 여행에 함께했다.AP통신은 남한에 본사를 둔 한반도 등산여행사 '하이크 코리아'의 설립자인 뉴질랜드인 로저 셰퍼드가 북한 당국을 설득해 처음으로 백두산 '오프로드 트레킹'과 캠핑을 허가받았다고 보도했다. 백두산에서 외국인 관광객이 캠핑한 것은 이번이 처음이다. 이번 캠핑의 리더인 셰퍼드는 ""산과 자연이 그렇듯이 트레킹이 매우 비정치적이길 바란다""고 말했다.""진짜 북한 사람들을 만날 수 있다""셰퍼드의 말처럼 안내를 밭은 북한 안내원들은 관광객과 어우러져 라면을 먹고, 담근 술을 건네기도 했다. 이들은 북한 군인들의 사진도 자유롭게 찍으며 즐거운 여행을 보냈다. 셰퍼드는 백두산을 오르는 동안 정치를 초월하는 것이 자신의 의도라고 설명했다.여행 첫날 이후에는 참가자들이 동행했던 북한 측 안내자들과 유대감을 형성했다고 전했다. 이어 ""우리는 모두 같은 것을 하려 노력한다. 함께 텐트를 치고, 식사하고 걷는다""면서 ""경험상 이러한 방법은 여행객들이 북한의 진짜 인민들을 볼 수 있는 좋은 방법""이라고 덧붙였다.외신들은 관광산업 발전에 열을 올리고 있는 북한이 외국인 관광객들에게 백두산을 하이킹하며 야영할 수 있도록 허용한 것과 관련해 보도를 쏟아냈다. 특히 국제사회 제재로 인해 외화벌이가 어려워지자 북한이 다양한 방안을 세우고 있다고 점을 강조했다. 이런 관점에서 백두산 관광과 트레킹은 절실한 외화를 획득할 수 있는 데다 감시와 통제가 쉽기 때문에 이득이라고 분석했다.또, 외신들은 북한에서 백두산이 김일성의 항일 빨치산 활동은 물론 김정은 일가의 '백두혈통'과 관련된 영산이라는 점도 북한 당국이 이번 캠핑을 허용한 이유 중 하나로 평가했다.북한, 대규모 관광 인프라 개발사업 진행 중북한은 현재 백두산 인근 도시인 삼지연을 비롯해 동해안의 원산 및 금강산 등의 대규모 관광 인프라 개발사업을 진행하고 있다.로이터 통신은 북한이 핵무기 개발에서 경제 개혁으로 국가 발전의 초점을 바꾸면서 중국이 북한 관광 특수를 누리고 있다고 보도했다.실제, 북한과의 접경도시 단둥은 최근 관광 호황을 누리고 있다. 단둥의 많은 식당이 북한 연주자들을 고용해 중국과 북한 곡을 연주하며 호객을 하고 있다. 특히, 평양과 판문점을 묶은 나흘 일정의 여행 상품은 매진을 이룰 정도였다.또, 신의주 일대를 하루 반나절 여행하는 여행 상품도 개시 1시간 만에 다 팔리는 등 북한 관광은 인기가 높다. 단둥 여행사 가이드는 ""오랫동안 북한 사회를 궁금하게 생각했던 사람들이 지금은 안전하다고 생각해 많이 관광을 희망하고 있다""고 말했다.백두산에서 첫 트레킹과 캠핑을 마친 관광객들은 북한 백두산에서 안내원이 보여주는 정해진 코스에서 벗어나 자유롭게 캠핑을 즐길 수 있었다고 말했다. 이번 트래킹 임의 한명인 호주 관광객은 인생에서 가장 멋진 여행이었다며, 천지에서 발을 담그고 경치를 보는 것은 말로 표현할 수 없을 정도의 감동이었다고 전했다.이진연기자 (jinlee@kbs.co.kr)▶ 네이버 채널 KBS뉴스 구독! 시원하게 털어드립니다▶ ‘TV보다 리얼’한 색다른 뉴스![저작권자ⓒ KBS 무단복제-재배포 금지]"
33,2018-08-21,연기·냄새 적다며 사무실·열차서도 '뻐끔',https://news.naver.com/main/read.nhn?mode=LSD&mid=shm&sid1=103&oid=023&aid=0003393836,조선일보,"[건강을 태우시겠습니까?] [4]궐련형 전자담배 확산되면서 80년대式 공공장소 흡연 되살아나회사원 이모씨는 지난 6월 서울 도심의 한 영화관에서 영화를 보다 황당한 경험을 했다. 사람이 거의 없었던 상영관 안에서 이상한 냄새가 나서 주변을 둘러보니 한 남성이 궐련형 전자담배를 피우고 있었다. 이씨는 ""1980년대도 아니고 요즘 영화관에서 담배 피우는 사람을 만날 줄은 상상도 못했다""고 했다. 최근 일반 담배에 비해 연기와 악취가 덜한 궐련형 전자담배가 확산되면서 금연구역에서도 무분별하게 담배를 피우는 사례가 자주 발생하고 있다. 그동안 우리 사회에 정착됐다고 생각했던 실내나 공공장소에서의 금연 풍토가 궐련형 전자담배란 복병을 만나 흔들리고 있는 것이다.◇열차 내 흡연도 버젓이…단속도 어려워지난 6월 동대구행 SRT(수서발 고속철) 객차와 객차 사이 이동통로에서 한 승객이 궐련형 전자담배를 피우다 승무원에게 적발됐다. 작년 9월엔 역시 동대구행 SRT 열차 내 화장실에서 한 승객이 궐련형 전자담배를 피우다 화재 경보가 울리기도 했다. 사라진 비둘기호에서나 볼 법했던 열차 내 흡연 행태가 궐련형 전자담배 때문에 되살아난 것이다. 올해 상반기(1~6월) 열차 내 흡연 적발 건수는 83건으로 2016년 상반기(40건)의 2배가 넘는다.일부 흡연자는 전자담배가 일반 담배와 달리 연기나 냄새가 거의 나지 않기 때문에 공공장소에서 피워도 되는 것으로 잘못 생각하거나 문제가 없다고 주장한다. 한 국내 대형항공사 관계자는 ""최근 전자담배를 피우는 것이 항공보안법 위반임을 인지 못 하는 손님이 종종 있다""고 말했다. 기내 흡연 적발 건수 역시 지난 6월 47건으로 2016년 1월 이후 가장 많았다. 국내 저비용항공사 관계자도 ""올해 상반기 기내 흡연 적발 건수는 20건으로 작년 상반기의 3배 수준""이라며 ""적발이 어려워서 그렇지 실제 궐련형 전자담배 흡연은 더 많을 것""이라고 했다. 보건복지부 관계자는 ""궐련형 전자담배도 똑같은 담배이기 때문에 금연구역에서도 똑같은 규제를 받는다""고 말했다.음식점·화장실이나 회사 내 흡연도 늘어나고 있다. 작년 말부터 궐련형 전자담배를 피우는 회사원 이모(41)씨는 ""가끔 술집에 가면 (밖에 나가는 대신) 화장실에서 전자담배를 피우기도 한다""며 ""요즘엔 자리에서 그냥 피우는 사람들도 종종 볼 수 있다""고 말했다. 서울 여의도 증권사에서 근무하는 김모(39)씨는 ""가끔 회사에서 야근할 때면 종종 흡연을 하는 동료들과 회의실에 모여 궐련형 전자담배를 피우곤 한다""고 했다.◇일부 액상형 전자담배 단속 사각지대에일선 단속 현장에서는 애매한 법 규정 때문에 전자담배 단속이 어렵다는 지적도 나온다. 담배사업법에 따르면 담배는 연초(담배)의 잎을 원료로 제조한 것이다. 궐련형 전자담배를 포함한 대부분의 담배는 여기에 해당하지만 담뱃잎을 사용하지 않고 화학적으로 니코틴을 합성해 만든 일부 액상형 전자담배 등은 단속의 사각지대에 놓여 있다. 일부 흡연자는 이를 악용하기도 한다. 서울의 한 구청 건강증진과 관계자는 ""요즘 단속을 나가면 10명 중 1~2명은 전자담배를 피우다 적발된 경우""라며 ""하지만 전자담배 종류가 워낙 다양해 '내 건 단속 대상이 아니다'라고 우기면 이를 가려내기가 쉽지 않다""고 말했다.전문가들은 전자담배도 일반 담배와 마찬가지로 주변에 간접 흡연 피해를 끼친다고 말한다. 임민경 국립암센터 교수는 ""궐련형 전자담배도 담배를 피우면 일반 담배에서 나오는 것과 유사한 입자가 주변에 확 늘어난다""며 ""이미 전자담배 배출물에서 발암물질과 유해 화학물질이 발견되는 등 간접흡연의 영향도 마찬가지""라고 말했다.[홍준기 기자][조선닷컴 바로가기][조선일보 구독신청하기]- Copyrights ⓒ 조선일보 & chosun.com, 무단 전재 및 재배포 금지 -"
34,2018-08-21,"학교가 아이들을 버렸다… ""성폭력 피해학생 오면 골치 아파"" 전학 거부",https://news.naver.com/main/read.nhn?mode=LSD&mid=shm&sid1=102&oid=020&aid=0003164767,동아일보,"[동아일보]성폭력 피해 고교생 의무전학 예외… 보호제도 허점“선생님, 저 언제부터 학교에 가요?”올해 5월 성폭력 피해 청소년 쉼터에 들어온 소영(가명·16) 양은 두 달이 넘도록 ‘강제 결석’ 중이다. 이전처럼 학교에서 친구들과 지내고 싶지만 그럴 수가 없다. 학교들은 '성폭력 피해 청소년'인 소영이를 받아주지 않았다.5년 전 아빠의 '몹쓸 짓'이 시작됐다. 학교에서 시행한 심리상담에서 소영이가 ‘자살위험군’으로 분류되면서 피해 사실이 밝혀졌다. 학교는 아빠를 경찰에 신고했고 소영이는 쉼터로 보내졌다.가족들이 학교로 찾아올까 봐 소영이는 학교를 옮기고 싶었다. 하지만 흔쾌히 받아주는 학교가 없었다. 쉼터 인근 5개 특성화고에서는 “판결문이 있느냐” “학생 정원이 다 찼다”며 전학을 거부했다.3개월 만에 겨우 소영이를 받아주겠다는 학교가 나왔다. 쉼터에서 ‘교육청에 민원을 넣겠다’며 집요하게 매달린 결과다. 소영이는 다음 주부터 새 학교로 등교할 예정이다.성폭력을 당한 청소년 가운데 상당수가 전학을 갈 학교를 찾지 못해 이중고를 겪고 있다. 특히 고교생이 심각하다. 성폭력 피해를 당한 초중학생은 ‘의무 전학’이 가능하지만 성폭력 피해 고교생은 학교장 추천 및 재량으로 전학이 이뤄진다. 문제는 성폭력 피해 청소년을 ‘문제아’로 인식해 전학을 받지 않으려는 고교가 많다는 점이다. 학교가 떠밀어서 원치 않는 전학을 하는 경우도 있다. 전학이 늦어져 짧게는 한 달, 길게는 1년 가까이 학교에 다니지 못하는 학생이 생기고 있다.11세 때부터 아버지에게 성폭행을 당한 박모 양(18)은 피해 사실이 밝혀진 지 2주 만인 올해 4월 사실상 ‘강제 전학’을 했다. 박 양은 전학을 할 생각이 없었지만 학교 측은 “아이에게 새로운 환경이 필요하지 않겠냐”며 전학을 권유했고 결국 학교를 옮겼다.쉼터 관계자는 “심리상담 검사에서 박 양이 자살위험군으로 분류되자 부담을 느껴 다른 학교로 보내 버린 것”이라고 지적했다.특성화고와 실업계고의 상황은 일반고보다 더 열악하다. 일반고는 학교장 추천을 받은 뒤 교육감 권한으로 전학할 학교를 배정하는 반면 특성화고와 실업계고는 전학 과정 전체가 ‘학교장 재량’에 달려 있기 때문이다.경북 지역의 한 실업계고에 다니던 김모 양(18)은 이웃에게 성폭행을 당한 뒤 전학하려 했지만 인근 실업계고 두 곳에서 모두 거부당했다. “가해자가 학교를 찾아와서 난동을 부릴 수 있다”는 이유에서다. 김 양은 끝내 전학할 학교를 찾지 못해 대입 검정고시를 준비하고 있다.학교에서 성폭력 피해 청소년의 전학을 거부할 수 있는 이유는 성폭력피해자보호법에 의무 전학 조항이 없어서다. 가정폭력 피해 학생의 경우 초중고교생 모두 의무 전학 대상이다. 성폭력 피해 아동(초중학생)은 경찰 수사 자료 등 최소한의 피해 사실만 입증되면 각 학교에서 의무적으로 전학을 받게 돼 있다. 그런데 성폭력 피해 청소년(고교생)에 대해선 강제 조항이 없다. 대전의 쉼터 관계자는 “성폭력 피해를 입었다는 이유로 ‘학교 다닐 권리’를 박탈당하는 건 어불성설”이라고 지적했다. 법 개정 움직임도 없다. 서울시교육청 관계자는 “학교장 추천 과정을 교육청에서 확인하긴 어렵다”며 “민원이 많지 않아 법 개정 추진 계획은 없다”고 말했다.이지훈 기자 easyhoon@donga.com한유주 인턴기자 연세대 독어독문학과 졸업▶ 동아일보 단독/동아일보 공식 페이스북▶ 핫한 경제 이슈와 재테크 방법 총집결(클릭!)ⓒ 동아일보 & donga.com, 무단 전재 및 재배포 금지"
35,2018-08-21,퇴직연금 한번에 받아 쓰고 국민·기초연금도 쥐꼬리 '깜깜한 노후',https://news.naver.com/main/read.nhn?mode=LSD&mid=shm&sid1=102&oid=469&aid=0000322618,한국일보,"[연금개혁 지금이 골든타임] <중> 푼돈 연금도 못받는 사람들#무늬만 다층체계 연금국민연금 수급 가능자 53% 뿐기초연금, 감액 등으로 들쭉날쭉퇴직연금 98% 일시 수령 ‘막막’#종합적 논의기구 필요기초연금 조정해 소득대체율 보완퇴직연금 의무화 등 통해노후보장의 한축 담당해야서울 종로구 탑골공원에서 노인들이 모여 이야기를 나누고 있다. 배우한 기자이신창(78)씨는 외환위기가 닥친 1997년 20년 가까이 다닌 회사에서 명예퇴직을 했다. 당시 57세였던 이씨는 퇴직금(1억2,000만원)과 명예퇴직금(2억500만원)을 넉넉히 받았고 재취업도 할 계획이어서 노후에 대해 큰 신경을 쓰지 않았다. 하지만 친구 말에 속아 퇴직금 전액과 아파트 담보 대출금을 투자했다가 전부 사기를 당했고, 월셋집을 얻기 위해 3년 후 받을 수 있는 국민연금까지 해지해야 했다. 노후자금인 퇴직금과 국민연금을 한꺼번에 모두 잃을 뻔 한 이씨는 다행히 장인의 도움으로 국민연금에 재가입했다.현재 이씨(67만원)와 부인(76세ㆍ18만원)이 받는 국민연금 연금액은 85만원. 2008년부터 받게 된 기초연금(각각 13만원)까지 합하면 매달 총 111만원의 연금을 받는다. 만성신부전증과 심혈관질환을 앓고 있어 의료비가 많이 드는 이씨에게 두 연금은 큰 도움이 된다. 하지만 생활비가 부족해 때때로 자녀들의 도움도 받는다. 이씨가 경제활동을 할 때는 퇴직연금제도가 없었고, 노인이 된 지금도 다층노후보장체계가 충분히 성숙하지 않았기 때문이다.노후자금을 미리 안정적으로 준비해 놓을 수 있게 하기 위해 정부는 3가지 연금제도를 만들었다. 1988년 국민연금을 도입했고 2005년엔 한번에 목돈으로 가져가는 퇴직금 대신 다달이 받을 수 있는 퇴직연금 제도를 도입, 기업들이 선택할 수 있도록 했다. 또 2008년엔 국민연금의 낮은 연금액과 사각지대를 보완하기 위해 소득하위 70% 이하 65세 노인들에게 매월 10만원씩(현재 20만원) 주는 기초연금 제도를 시행했다. 앞으로 급격히 늘어날 노인들의 생활을 탄탄히 보장하기 위해 여러 층의 장치를 마련한 것이다.그래픽=신동준 기자겉으로만 다층체계, 속은 구멍 숭숭하지만 아직 갈 길이 멀다. 외형적으로는 다층체계가 완성됐지만 속을 들여다 보면 아직 구멍이 숭숭 뚫려있다. 다층노후보장체계의 중심축인 국민연금은 사각지대가 너무 넓은데다 연금액이 적다. 올해 국민연금 가입대상자는 총 3,099만명이지만 실제 가입자는 2,141만명(69%)이고, 가입자 중에서도 장기체납자 등을 빼면 노후에 실제로 연금을 받을 수 있는 사람은 1,671만명(53%) 정도다. 현재 수급자들은 가입기간도 짧아서 월 평균 연금액이 38만원에 그친다. 소득대체율 45%냐 40%냐가 논란이 되고 있지만 어떤 경우에도 그 자체만으로 노후를 버티기가 쉽지는 않다.기초연금 역시 각종 감액제도 등으로 월 평균 연금액은 18만4,000원이다. 또 모든 노인에게 보편적으로 지급할지, 저소득층엔 연금액을 올리지 등 장기 운영방안에 대한 사회적 합의가 없는 상태다. 국민연금액이 일정액(2017년 30만9,000원) 이상이면 기초연금을 깎는 제도로 인해 국민연금 가입자를 차별하고 가입 유인을 저해한다는 비판도 계속 나온다.퇴직연금은 아직 연금 기능이 미미하다. 기업들이 퇴직금과 퇴직연금 두 가지 중 선택할 수 있도록 돼 있어, 전체 상용근로자의 53.4%만 가입돼 있는데다 대부분 대기업 근로자들이다. 게다가 연금 수급 요건 갖춘 퇴직자 중 98.4%(2016년 상반기)가 일시금으로 급여를 받아갔다.그래픽=신동준 기자다층체계 안에서 국민연금 개혁방안 찾아야전문가들은 3개 연금의 ‘구멍’을 메우는 동시에 상호보완적인 다층체계를 만들어야 한다고 강조한다. 국민연금 개혁 방향 역시 이 안에서 찾을 수 있다는 것이다. 국민연금만 개혁한다고 전체 국민들의 노후가 보장되는 것도 아니고, 기초연금과 퇴직연금의 역할을 어떻게 설정하는지에 따라 국민연금 개혁방향에도 큰 영향을 주기 때문이다.우선 관건은 국민연금과 기초연금 중 어느 쪽의 역할을 좀더 강화할 것인지다. 석재은 한림대 사회복지학과 교수는 “국민연금 소득대체율을 40%로 하고 기초연금을 30만원 지급하면 노인들이 생애 평균 소득의 약 45%를 연금으로 받을 수 있게 된다”며 “선진국의 연금개혁 수준과도 비슷하다”고 말했다. 반면 김원섭 고려대 사회학과 교수는 “기초연금을 40만원으로 올리고 국민연금 소득대체율은 더 낮춰도 된다”고 말했다. 국민연금을 개혁하더라도 중상위층 50%가 20년 후에 혜택을 받지만, 기초연금은 현재 빈곤에 허덕이는 노인들에게 즉각 도움을 줄 수 있다는 것이지만, 미래세대 부담이 그만큼 커질 수밖에 없다. 퇴직연금은 국회에 장기 계류중인 의무화법이 통과돼야 노후 보장의 한 축으로 기능을 할 수 있을 전망이다. 일시금으로 받아가는 비율을 어떻게 줄이느냐도 관건이다.다층체계가 제대로 구축이 돼야 세대간 형평성도 어느 정도 맞출 수 있다. 기초연금은 오롯이 당해 세대의 세금으로 충당되기 때문에 노인비율이 높아지는 미래세대의 부담이 클 수밖에 없고, 퇴직연금은 본인 스스로 책임지는 구조다. 현재세대보다 미래세대 부담이 더 큰 국민연금도 이번 개혁을 통해 현재세대의 부담을 다소 늘리는 쪽으로 가닥을 잡는다면 세대간 갈등도 일부분 해소될 수 있을 전망이다.이를 위해서는 부처별로 쪼개져 있는 연금 제도를 종합적으로 논의할 기구가 필요하다는 지적이다. 국민연금 제도발전위원회에 위원으로 참여한 이상은 숭실대 사회복지학과 교수는 “특정 부처를 넘어 국민연금 기초연금 퇴직연금의 역할 조정 방안을 마련하기 위한 ‘노후소득보장위원회’(가칭) 등의 논의구조가 필요하다”고 제안했다.남보라 기자 rarara@hankookilbo.com김지현 기자 hyun1620@hankookilbo.com▶한국일보[페이스북][카카오 친구맺기]▶네이버 채널에서 한국일보를 구독하세요![ⓒ 한국일보(hankookilbo.com), 무단 전재 및 재배포 금지]"
36,2018-08-21,"처음 불러 본 ""아버지"" ""어머니""…만나자마자 오열",https://news.naver.com/main/read.nhn?mode=LSD&mid=shm&sid1=100&oid=056&aid=0010611749,KBS,"[앵커]오늘(20일) 이산가족들 만남 하나 하나가 모두 눈물겹지만 가장 애틋한 건 역시 부모 자식간의 만남이었습니다.70 년 가까운 세월을 한시도 잊지 못했던 혈육이라 말 그대로 눈물바다가 됐습니다.김수연 기자입니다.[리포트]피난 길에 4살 아들의 손을 놓친 어머니.오직 이 순간을 위해  68년간의 한맺힌 삶을 견뎌왔습니다.일흔이 넘은 노인으로 다시 만난 아들을,  어머니는 한 눈에 알아봤습니다.[이금섬/92살/북측 아들 만남 : ""상철이야! 상철이 맞어? 상철이 맞니….""]못 다한 모자의 정을 나누다 보니, 2시간 상봉 시간이 아쉽기만 합니다.[리상철/71살/이금섬 씨 북측 아들 : ""식사할 때 다시 만나요!""]60여 년 만에 엄마를 만난 두 딸이 하염없이 눈물을 흘립니다.복받치는 설움에 노모는 말을 잃었습니다.[한신자/89살/북측 두 딸 만남 : ""눈물도 안 나온다, 눈물도 안 나온다.""]엄마 없이 모진 세월을 견뎠을 두 딸들, 다시는 놓치지 않을 새라 딸들의 손을 꽉 잡았습니다.전쟁 통에 헤어진 아내가 자신의 딸을 낳았단 사실을 여든 아홉이 돼서야 알았습니다.처음 본 아버지에게 무슨 말을 해야 할까, 딸은 돌아가신 어머니 사진을 대신 건넵니다.[유연옥/67살/유관식 씨 북측 딸 : ""아버지, 우리 할머니. 할머니.""][유승원/53살/유관식 씨 남측 아들 : ""기억나세요? 어머니, 항상 아버지가 맨날 어머니 어머니, 어머니만 찾으셨어요.""]인민군에 끌려가지 않으려 가족과 생이별한 황우석 할아버지.세 살이었던 딸이 이제는 70대의 할머니가 되어 아버지 앞에 섰습니다.수십 년 기다림 끝에 불러보는 어머니, 아버지….만남의 시간은 짧기만 합니다.KBS 뉴스 김수연입니다.김수연▶ 네이버 채널 KBS뉴스 구독! 시원하게 털어드립니다▶ ‘TV보다 리얼’한 색다른 뉴스![저작권자ⓒ KBS 무단복제-재배포 금지]"
