,날짜,기사 제목,기사 링크,기사 출처,기사 내용
66,2018-08-21,"김현미 국토장관 ""자동차 사고전담 인력 부족…손발없는 상태""",https://news.naver.com/main/read.nhn?mode=LSD&mid=shm&sid1=101&oid=003&aid=0008766755,뉴시스,"【서울=뉴시스】박영태 기자 = 21일 오전 서울 영등포구 여의도 국회에서 진행된 국토교통위원회 전체회의에서 김현미 국토교통부 장관이 의원 질의에 답변하고 있다. 2018.08.21.since1999@newsis.com【서울=뉴시스】최희정 기자 = 김현미 국토교통부 장관이 BMW 차량의 잇단 화재사고와 관련해 국내 자동차 사고를 처리할 예산과 인력이 부족하다고 밝혔다.김 장관은 21일 국회 국토교통위원회 업무보고에 참석해 ""2300만대 자동차 결함을 조사할 연구원이 13명 밖에 안된다""면서 ""지금은 아무 손발 없는 상태에서 모든 것을 다하라고 하면 제도적 한계 때문에 돌파하기 힘들다""고 토로했다.그러면서 ""BMW 사태를 보면서 놀랐다""며 ""자동차 사고를 처리할 시스템이 사실상 부재한다는 느낌이 들었다""고 말했다.자동차 결함 관련 제보가 1달에 100만 여건에 달하는 데도 국토부 산하 교통안전공단 자동차안전연구원 소속 연구원 3명이 PDF 파일을 수작업으로 분류해 대처해야 하는 상황이라는 것이다.이와 함께 자동차 화재 사고가 발생할 경우 경찰과 소방청에 우선적인 조사 권한이 있어서 연구원이 자료를 확보하기 어렵다고 지적했다.김 장관은 ""BMW 잔해를 우리 연구원은 확보하기 어렵다""며 ""사고만 1년에 5000건 발생하는데 예산·인력·제도면에서 굉장히 후진적""이라고 강조했다.이어 ""징벌적 손해배상제도가 시행돼야 기업들이 정부를 무서워한다""며 ""국회에서 국토부와 교통안전공단이 사고문제 전담해서 처리할 수 있는 예산과 인력을 확보할 수 있도록 도와달라""고 요청했다.BMW 측이 자료 제출 등 국토부에 대해 협조적인지를 묻는 질문에 대해서는 ""아직 충분한 자료를 자료를 제출하지 않았다""며 ""자체 조사해서 제출하지 않은 자료에 대해 대응하겠다""고 답했다.김 장관은 ""BMW 본사와 BMW코리아 측이 일부 차량의 부품 결함 문제를 사전에 알고도 은폐했다는 점이 확인되면 정식 수사를 요구할 계획""이라고 밝혔다.dazzling@newsis.com▶ 뉴시스 빅데이터 MSI 주가시세표 바로가기▶ 뉴시스 SNS[페이스북][트위터]<저작권자ⓒ 공감언론 뉴시스통신사. 무단전재-재배포 금지.>"
67,2018-08-21,인천 전자제품 공장 화재…사망자 9명으로 늘어나,https://news.naver.com/main/read.nhn?mode=LSD&mid=shm&sid1=102&oid=421&aid=0003546327,뉴스1,"4층 화재 현장서 7명 숨진 채 발견21일 오후 3시43분께 인천시 남동구 논현동 세일전자에서 화재가 발생했다.신고를 받고 출동한 소방대원들이 진화 작업 및 구조활동을 벌이고 있다.(인천소방본부 제공)2018.8.21/뉴스1 © News1 박아론 기자© News1 김일환 디자이너(인천=뉴스1) 박아론 기자,정진욱 기자 = 인천 세일전자 화재로 소재 파악이 되지 않던 근로자 7명이 공장 내부에서 숨진 채 발견됐다.이로써 병원으로 이송돼 치료 도중 숨진 2명 등 모두 9명이 숨졌다.21일 오후 3시43분께 인천시 남동구 논현동 세일전자 공장 4층 전자제품 검사실에서 불이 났다.이 불로 당시 4층 내부에 있던 여성 근로자 4명이 창문 밖으로 뛰어 내렸으며, 2명은 소방대원에 의해 구조돼 인근 병원으로 이송됐다.병원으로 이송된 6명은 모두 중상으로 이중 2명이 치료중 숨졌다.소방은 화재 당시 4층 내부에서 근무한 근로자들중 소재가 확인되지 않은 근무자 확인에 나서 7명의 시신을 찾았다.소방은 신고를 받고 출동해 대응 1단계에서 2단계로 대응 단계를 높인 가운데 장비 36대, 인력 118명을 투입해 진화작업을 벌였다.소방은 오후 4시28분께 큰 불길을 잡아 대응 1단계로 하향해 대응하고 있다.소장은 진화가 끝나는대로 화인을 조사할 계획이다.aron0317@news1.kr▶ [뉴스1] 채널설정하기▶ 제보하기▶ 2018 아시안게임 기사보기[© 뉴스1코리아(news1.kr), 무단 전재 및 재배포 금지]"
68,2018-08-21,"남동공단 전자제품 공장 화재…""사망자 9명으로 늘어""",https://news.naver.com/main/read.nhn?mode=LSD&mid=shm&sid1=102&oid=001&aid=0010285320,연합뉴스,인천 남동구 전자제품 공장서 불(인천=연합뉴스) 윤태현 기자 = 21일 오후 3시 43분께 인천시 남동구 논현동 한 전자제품 제조공장에서 불이 나 소방당국이 진화하고 있다. 사진은 화재 현장 모습.     tomatoyoon@yna.co.kr(끝)▶뭐하고 놀까? '#흥'▶퀴즈풀고 상품받고! 뉴스퀴즈쇼 '뉴나'▶네이버 홈에서 [연합뉴스] 채널 구독하기
69,2018-08-21,"과천 토막살인 30대 용의자 검거…""내가 죽였다"" 시인",https://news.naver.com/main/read.nhn?mode=LSD&mid=shm&sid1=102&oid=001&aid=0010285296,연합뉴스,"서산휴게소서 시신 발견 이틀 만에 체포…""경찰서로 압송 중""서울대공원 주변 CCTV로 용의차량 특정…추적 끝 검거경찰서로 호송되는 서울대공원 토막살인 사건 용의자(과천=연합뉴스) 권준우 기자 = 21일 오후 '서울대공원 토막살인 사건'의 용의자 A(34)씨가 경기도 과천시 과천경찰서로 호송되고 있다.앞서 지난 19일 오전 9시 40분께 서울대공원 인근 등산로 수풀에서 B(51)씨의 시신이 토막나 비닐에 쌓인 채 발견됐다.이 사건을 수사 중인 경찰은 서울대공원 주변 CCTV 분석을 통해 A씨 차량을 용의차량으로 특정, 추적 끝에 이날 오후 서해안 고속도로 서산휴게소에서 A씨를 붙잡았다.   stop@yna.co.kr(끝)(과천=연합뉴스) 최종호 강영훈 기자 = 경기 과천 서울대공원 토막살인 사건을 수사 중인 경찰이 시신 발견 이틀 만인 21일 사건의 유력한 용의자인 30대 남성을 검거했다.경기 과천경찰서는 이날 오후 4시께 서해안 고속도로 서산휴게소에서 A(34) 씨를 살인 등 혐의로 붙잡아 과천으로 압송 중이다.A 씨는 검거 직후 ""내가 죽인 것을 인정한다. 자세한 것은 조사받으면서 얘기하겠다""고 말했다.현재까지 A 씨와 숨진 B(51) 씨와의 관계는 확인되지 않았다.다만, A 씨는 경기도 안양에서 노래방을 운영하는 것으로 조사됐으며 B 씨의 생전 거주지도 안양인 것으로 나타났다.A 씨는 B 씨 시신을 유기할 당시 자신의 소렌토 차를 타고 있었으며 검거 당시에도 이 차량을 몰고 있었던 것으로 전해졌다.'묵묵부답' 서울대공원 토막살인 사건 용의자 압송(과천=연합뉴스) 권준우 기자 = 21일 오후 '서울대공원 토막살인 사건'의 용의자 A(34)씨가 경기도 과천시 과천경찰서로 압송되고 있다.앞서 지난 19일 오전 9시 40분께 서울대공원 인근 등산로 수풀에서 B(51)씨의 시신이 토막나 비닐에 쌓인 채 발견됐다.이 사건을 수사 중인 경찰은 서울대공원 주변 CCTV 분석을 통해 A씨 차량을 용의차량으로 특정, 추적 끝에 이날 오후 서해안 고속도로 서산휴게소에서 A씨를 붙잡았다.   stop@yna.co.kr(끝)경찰은 서울대공원 주변 CCTV 분석을 통해 A 씨 차량을 용의차량으로 특정하고 추적해 검거한 것으로 알려졌다.경찰은 A 씨를 과천경찰서로 압송해 자세한 사건 경위를 조사할 예정이다.A 씨는 지난 10일을 전후해 B 씨를 살해한 뒤 사체를 과천시 소재 청계산 등산로에 유기한 혐의를 받고 있다.앞서 지난 19일 오전 9시 40분께 서울대공원 인근인 이 등산로 수풀에서 B 씨의 시신이 발견됐다.서울대공원 직원에 의해 발견된 B 씨의 시신은 머리와 몸, 다리 등이 분리된 채 검은색 비닐봉지 등에 감싸져 있었다.경찰은 주변 수색을 통해 시신을 모두 수습하고, 수사에 나섰다.아울러 B 씨가 지난 10일까지 휴대전화를 사용한 것으로 확인됨에 따라 이때쯤 사건이 발생한 것으로 추정하고, 주변 CCTV는 물론 통신, 금융 명세를 살펴보는 등 광범위한 수사를 펼쳤다.토막시신 발견된 서울대공원 주차장 인근 수풀(과천=연합뉴스) 지난 19일 오전 9시 40분께 경기도 과천시 과천동 서울대공원 장미의언덕 주차장 인근 도로 주변 수풀에서 남성으로 추정되는 시신이 머리와 몸통 부분이 분리된 채 발견돼 경찰이 수사에 나섰다. 사진은 시신이 발견된 현장.  [독자 제공]zorba@yna.co.kr(끝)zorba@yna.co.krkyh@yna.co.kr▶뭐하고 놀까? '#흥'▶퀴즈풀고 상품받고! 뉴스퀴즈쇼 '뉴나'▶네이버 홈에서 [연합뉴스] 채널 구독하기"
70,2018-08-21,전국 태풍예비특보…주변 점검 필수,https://news.naver.com/main/read.nhn?mode=LSD&mid=shm&sid1=103&oid=422&aid=0000334351,연합뉴스TV,"[날씨] 전국 태풍예비특보…주변 점검 필수서울을 포함한 중부지방은 오전까지 비가 내리면서 기온 오르는 속도가 평소보다는 더뎠습니다.반면 남부지방은 낮 동안 35도를 보이면서 폭염이 기승을 부렸는데요.특히 경북 의성은 38도를 넘어서면서 전국에서 가장 뜨거웠습니다.중부로는 오늘 더위가 주춤했지만 태풍의 뜨거운 수증기가 유입되면서 내일 기온이 큰 폭으로 오릅니다.서울은 낮기온 36도까지 올라서 오늘보다 무려 6도 가까이 껑충 높아지겠고요.그밖에 대전도 36도, 광주 35도로 막바지 폭염이 기승을 부리겠습니다.태풍 솔릭은 내일 제주 먼 바다까지 진입할 것으로 예상됩니다.이후 서해안을 따라 북상하면서 수요일 저녁에는 충남 서해안에 상륙하겠고요.수도권을 지나서 금요일에는 동해상으로 빠져나가겠습니다.제주도는 태풍의 영향으로 내일 오전부터 비가 내리기 시작합니다.밤에는 전남 해안으로 확대될 텐데요.내일 하루 동안에만 제주도에는 300mm가 넘는 폭우가 쏟아질 수 있어 주의하셔야겠습니다.이후 목요일에는 전국에 비바람이 치면서 고비를 맞이하겠고 중부지방은 금요일 오전까지도 비가 이어지겠습니다.오후 4시를 기해서 육상은 물론 전 해상까지 태풍 예비특보가 내려졌습니다.내륙에는 초속 40m가 넘는 돌풍을 동반하면서 비바람이 치겠고요.해상에도 폭풍해일이 일겠습니다.주변 점검을 꼼꼼하게 하시기 바랍니다.지금까지 날씨 전해 드렸습니다.연합뉴스TV : 02-398-4441(기사문의ㆍ제보) 카톡/라인 jebo23▶ 연합뉴스TV 네이버 채널 구독▶ 생방송 시청▶ 대한민국 뉴스의 시작, 연합뉴스TV 앱 다운받기"
71,2018-08-21,인천 남동공단 전자제품 공장 불…2명 사망 ,https://news.naver.com/main/read.nhn?mode=LSD&mid=shm&sid1=102&oid=003&aid=0008766764,뉴시스,"21일 오후 3시 43분께 발생한 인천시 남동구 논현동 남동공단의 전자제품 공장 화재 상황 보고 안내판. (사진= 인천소방본부 제공)【인천=뉴시스】함상환·이정용 기자 =21일 오후 3시 43분께 인천시 남동구 논현동 남동공단의 한 전자제품 공장 4층에서 원인이 밝혀지지 않은 불이 나 소방당국이 진화작업에 나섰다.이 불로 공장에서 근무하는 직원 50여 명이 긴급대피하고 30대 여성 A씨 등 직원 4명이 건물 4층 창문을 통해 뛰어 내리다 부상을 입고 병원으로 옮겨져 치료를 받던 여성 2명이 숨졌다.또 연기흡입 등 부상을 입고 2명도 인근병원으로 이송됐다.소방당국은 대응 2단계를 발령하고 장비 45대와 70여 명의 소방인력을 동원해 진화작업을 벌였고, 오후 4시28분께 큰 불길을 잡고 1단계를 발령하고 진화작업을 벌이고 있다.불이 난 공장 바닥면적은 4577㎡으로 옥내 위험 물질도 다량으로 저장돼 있는 것으로 전해졌다.【인천=뉴시스】 이정용 기자 = 21일 오후 3시 34분께 인천시 남동구 논현동 남동공단의 한 전자제품 공장에서 원인을 알수 없는 화재가 발생해 소방당국이 화재를 진압하고 있다. (2018.08.21)stay@newsis.com경찰과 소방당국은 추가 인명피해 여부와 정확한 피해 규모와 화재 원인을 조사 중이다.hsh3355@newsis.comstay@newsis.com▶ 뉴시스 빅데이터 MSI 주가시세표 바로가기▶ 뉴시스 SNS[페이스북][트위터]<저작권자ⓒ 공감언론 뉴시스통신사. 무단전재-재배포 금지.>"
72,2018-08-21,내일 작별상봉만 남았다…이산가족 둘째 날 단체상봉 종료,https://news.naver.com/main/read.nhn?mode=LSD&mid=shm&sid1=100&oid=001&aid=0010285220,연합뉴스,오후 3시께부터 2시간…南가족끼리 저녁 후 오늘 일정 마무리이야기꽃 피우는 이산가족(금강산=연합뉴스) 이지은 기자 = 제21차 이산가족 상봉행사 1회차 둘째날인 21일 오후 금강산호텔에서 열린 단체상봉에서 남측의 이금연(87.왼쪽 두번째) 할머니 가족 간식을 먹으며 대화를 나누고 있다.     jieunlee@yna.co.kr(끝)(금강산·서울=연합뉴스) 공동취재단 백나리 기자 = 남북 이산가족들이 상봉행사 이틀째인 21일 오후에 2시간 동안 단체상봉을 했다.이들은 오후 3시 3분부터 5시까지 금강산호텔 연회장에서 만나 가족별로 테이블에 모여 정담을 나눴다.앞서 오전 10시 10분부터 3시간 정도 객실에서 개별상봉을 통해 속 깊은 얘기를 나눈 터라 단체상봉은 좀 더 편안하고 즐거운 분위기에서 이뤄졌다.남북의 가족이 헤어지고도 간직할 사진을 찍는 것은 물론 어린 시절로 돌아간 것처럼 깔깔 웃으며 이야기꽃을 피우기도 했다.이들은 개별상봉 때 객실에서 오붓하게 가족만 모여 못다 한 이야기를 나누는 한편 객실로 배달된 도시락을 함께 먹었다. 이산가족들은 상봉행사마다 개별상봉 시간을 가졌으나 가족끼리만 식사한 것은 처음이다.이날 일정은 남측 가족끼리 저녁 식사를 하는 것으로 마무리된다.이들은 마지막 날인 22일 작별상봉만 남겨두고 있다. 사흘간 여섯 차례에 걸쳐 11시간을 상봉하기로 한 일정 중에 2시간의 작별상봉만 남은 것이다.작별상봉 및 공동중식은 22일 오전 11시부터 오후 1시까지 진행된다. 이어 남측 가족들은 오후 1시 45분께 버스로 금강산을 출발해 귀환할 예정이다.간식 받고 단체상봉장으로(속초=연합뉴스) 이지은 기자 = 제21차 이산가족 상봉행사 1회차 둘째날인 21일 오후 금강산호텔에서 열린 단체상봉에서 남측 가족들이 북측이 준비한 간식을 받고 상봉장으로 향하고 있다.jieunlee@yna.co.kr(끝)nari@yna.co.kr▶뭐하고 놀까? '#흥'▶퀴즈풀고 상품받고! 뉴스퀴즈쇼 '뉴나'▶네이버 홈에서 [연합뉴스] 채널 구독하기
73,2018-08-21,"트럼프·시진핑, 이번엔 한반도서 '각축'…잇단 '김정은 러브콜'",https://news.naver.com/main/read.nhn?mode=LSD&mid=shm&sid1=100&oid=001&aid=0010284806,연합뉴스,"미중 패권경쟁 '무역'에서 '한반도'로 이동…북한 비핵화 협상 등 셈법·영향 주목미국 중국 한반도 관심 집중 (PG)[제작 최자윤] 일러스트(서울=연합뉴스) 임주영 기자 = '무역'을 놓고 건곤일척의 대결을 벌이고 있는 미국과 중국이 전장(戰場)을 점차 '한반도'로 옮기고 있다.도널드 트럼프 대통령과 시진핑 중국 국가주석이 김정은 북한 국무위원장과 만나기 위한 '러브콜'을 잇따라 보내면서 한반도가 미국과 중국 사이의 본격적인 외교적 각축무대로 탈바꿈하는 양상이다.트럼프 대통령은 20일(현지시간) 로이터통신과의 인터뷰에서 ""나는 그를 좋아하고 그는 나를 좋아한다""며 김 위원장과의 '케미스트리'(궁합)를 자랑했다. 특히 트럼프 대통령은 '김정은 위원장과 추가 회담이 곧 이뤄질 것 같으냐'는 질문에 ""그럴 가능성이 크다""고 답했다.비록 질문에 답변하는 형식이고 시기와 장소 등 구체적 내용을 언급하지는 않았지만, 트럼프 대통령이 김 위원장을 향해 분명한 '러브콜'을 보내며  2차 북미정상회담 개최에 대한 강력한 의지를 표명한 것으로 해석되고 있다.앞서 트럼프 대통령은 지난 1일 트위터를 통해 김 위원장으로부터 친서를 받은 사실을 공개하며 ""곧 보게 되기를 희망한다""고 2차 북미정상회담 추진 의사를 시사한 바 있다. 일각에서는 트럼프 대통령이 회담 장소로 미국의 수도인 워싱턴 DC를 고집하기 보다는 시 주석, 문재인 대통령에 이어 평양을 방문하는 '파격'을 선보일 개연성도 제기된다.트럼프 대통령의 이런 움직임에 대응이라도 하듯, 시 주석은 북한 정권수립 70주년인 다음달 9일 '9·9절'에 맞춰 평양을 방문하려는 움직임을 서두르는 분위기다. 이와 관련, 중국 외교부의 부국장급 관리가 최근 평양을 방문해 북한 측 관리들과 접촉한 것으로 전해졌다. 이는 북중 정상회담을 '준비'하려는 행보가 아니냐는 관측을 낳고 있다.중국 외교부도 시 주석의 방북 가능성을 정면 부인하지 않으면서 북중간 우호관계를 강조하고 있다. 베이징 외교가에서는 시 주석이 다음달 3일부터 4일까지 베이징에서 열리는 '중국-아프리카 협력 포럼 정상회의'에 참석한 직후 북한을 방문할 것이라는 관측이 유력히 떠오른다.두 정상이 이처럼 김 위원장을 상대로 잇따라 '러브콜'을 보내는데에는 전략적 이해 못지 않게 개인적 정치적 이해도 걸려있다는 분석이 적지 않다.트럼프 대통령으로서는 국내 정치적으로 오는 11월 6일 중간선거를 앞두고 '외교적 성과'를 올려야 할 필요성이 크다는 관측이다. 취임 이후 안정적 경제성장률과 낮은 실업률 등 경제지표 측면에서 양호한 성적표를 받아들기는 했지만, 주요정책을 추진하는 과정에서 의회, 사법부, 언론 등과 갈등을 빚었고 국론 분열이 심화했다는 평가를 받고 있어서다.트럼프 대통령으로서는 국내 정치적 난국을 타개하고 2020년 재선 가능성을 높이기 위해 북한 비핵화와 같은 대외정책 이슈에 '올인'할 수밖에 없다는 분석이 나온다.시 주석은 미·중 무역전쟁에서 열세에 몰리면서 맞닥뜨린 리더십 위기를 돌파하기 위해 미국을 움직일 '지렛대'가 필요해 보인다. 미국의 막대한 '관세 폭탄' 투하로 열세에 봉착한 시 주석으로서는 상황을 타개할 카드로 북한 비핵화 문제 개입을 선택했다는 평가가 나온다.어찌 됐건 G2(주요 2개국)로 불리며 세계 경제와 동북아 안보에 커다란 영향력을 미치고 있는 미국과 중국이 무역전쟁의 와중에 북한문제에 '개입'함으로써 '한반도 방정식'은 더욱 복잡해질 가능성이 커졌다.양측의 수 싸움이 극한 대결을 벌이고 있는 무역전쟁에서 밀려나지 않기 위해 한반도 문제에 있어 논의의 주도권을 거머쥐고 이를 토대로 상대를 압박하려는 '패권싸움'으로 치달을 공산이 크다는 얘기다.특히 비핵화와 평화체제를 둘러싼 북미 간 협상에 중국이 '노골적으로' 개입할 경우 예기치 않은 난관이 생길 소지가 있다.다만 폼페이오 장관의 방북을 계기로 비핵화와 종전선언 협상에서 돌파구가 마련되고 시 주석의 방북과 제3차 남북 정상회담, 내달 18일부터 시작되는 국제적 다자 외교무대인 유엔 총회를 거치며 종전선언과 같은 '외교적 이벤트'가 만들어진다면 한반도 정세가 선순환 국면에 들어갈 수 있지 않겠느냐는 희망 섞인 관측이 고개를 들고 있다.물론 트럼프 대통령으로서는 중국의 이 같은 움직임에 대해 '배후론'을 제기하며 여전히 의구심을 거두지 않고 있다. 트럼프 대통령은 이날 인터뷰에서도 중국이 미국과의 무역전쟁으로 인해 과거만큼 북한 문제에 있어 돕지 않고 있다고 불만을 표출했다고 로이터통신은 전하기도 했다.하지만 미국과 중국이 무역전쟁의 협상결과 맞물려 한반도 문제를 놓고도 타협점을 모색할 가능성이 없지 않다는 분석이 나온다. 중국 왕셔우원(王受文) 상무무 부부장(차관) 겸 국제무역협상 부대표는 22~23일 워싱턴DC를 방문해 데이비드 멀패스 미국 재무부 차관과 협상할 예정이다. 양국은 오는 11월까지 무역전쟁 종식을 시도하기 위한 로드맵을 짜고 있다고 월스트리트저널이 17일 보도하기도 했다.그간 북한의 '뒷배'를 자처해온 중국이 한반도 문제를 고리로 대미 협상력을 높여 무역전쟁 속도와 강도를 완화하는 등 나름의 '출구전략'을 모색할 것이라는 분석도 나온다.zoo@yna.co.kr▶뭐하고 놀까? '#흥'▶퀴즈풀고 상품받고! 뉴스퀴즈쇼 '뉴나'▶네이버 홈에서 [연합뉴스] 채널 구독하기"
74,2018-08-21,"과천 토막살인 30대 용의자, 서산휴게소서 검거",https://news.naver.com/main/read.nhn?mode=LSD&mid=shm&sid1=102&oid=001&aid=0010285207,연합뉴스,"시신 발견 이틀만에 체포…경찰 ""경찰서로 압송 중""경찰서로 호송되는 서울대공원 토막살인 사건 용의자(과천=연합뉴스) 권준우 기자 = 21일 오후 '서울대공원 토막살인 사건'의 용의자 A(34)씨가 경기도 과천시 과천경찰서로 호송되고 있다.앞서 지난 19일 오전 9시 40분께 서울대공원 인근 등산로 수풀에서 B(51)씨의 시신이 토막나 비닐에 쌓인 채 발견됐다.이 사건을 수사 중인 경찰은 서울대공원 주변 CCTV 분석을 통해 A씨 차량을 용의차량으로 특정, 추적 끝에 이날 오후 서해안 고속도로 서산휴게소에서 A씨를 붙잡았다.    stop@yna.co.kr(끝)(과천=연합뉴스) 강영훈 기자 = 경기 과천 서울대공원 토막살인 사건을 수사 중인 경찰이 시신 발견 이틀 만인 21일 사건의 유력한 용의자인 30대 남성을 검거했다.경기 과천경찰서는 이날 오후 4시께 서해안 고속도로 서산휴게소에서 A(34)씨를 살인 등 혐의로 붙잡아 과천으로 압송 중이다.A씨는 혐의를 인정하는 것으로 전해졌다.경찰은 자세한 사건 경위를 조사하고 있다.A씨는 지난 10일을 전후해 B(51)씨를 살해한 뒤 사체를 과천시 소재 청계산 등산로에 유기한 혐의를 받고 있다.앞서 지난 19일 오전 9시 40분께 서울대공원 인근인 이 등산로 수풀에서 B씨의 시신이 발견됐다.서울대공원 직원에 의해 발견된 B씨의 시신은 머리와 몸, 다리 등이 토막이 나 분리된 채 검은색 비닐봉지 등에 감싸져 있었다.경찰은 주변 수색을 통해 시신을 모두 수습하고, 수사에 나섰다.아울러 B씨가 지난 10일까지 휴대전화를 사용한 것으로 확인됨에 따라 이때쯤 사건이 발생한 것으로 추정하고, 주변 CCTV는 물론 통신, 금융 내역을 살펴보는 등 광범위한 수사를 펼쳤다.토막시신 발견된 서울대공원 주차장 인근 수풀(과천=연합뉴스) 지난 19일 오전 9시 40분께 경기도 과천시 과천동 서울대공원 장미의언덕 주차장 인근 도로 주변 수풀에서 남성으로 추정되는 시신이 머리와 몸통 부분이 분리된 채 발견돼 경찰이 수사에 나섰다. 사진은 시신이 발견된 현장.  [독자 제공]zorba@yna.co.kr(끝)kyh@yna.co.kr▶뭐하고 놀까? '#흥'▶퀴즈풀고 상품받고! 뉴스퀴즈쇼 '뉴나'▶네이버 홈에서 [연합뉴스] 채널 구독하기"
75,2018-08-21,인천 남동공단 전자제품 공장 화재…중상자 중 2명 사망,https://news.naver.com/main/read.nhn?mode=LSD&mid=shm&sid1=102&oid=001&aid=0010285208,연합뉴스,인천 남동구 전자제품 공장서 불(인천=연합뉴스) 윤태현 기자 = 21일 오후 3시 43분께 인천시 남동구 논현동 한 전자제품 제조공장에서 불이 나 소방당국이 진화하고 있다. 사진은 화재 현장 모습.     tomatoyoon@yna.co.kr(끝)▶뭐하고 놀까? '#흥'▶퀴즈풀고 상품받고! 뉴스퀴즈쇼 '뉴나'▶네이버 홈에서 [연합뉴스] 채널 구독하기
