,날짜,기사 제목,기사 링크,기사 출처,기사 내용
78,2014-07-03,대기업 '버틸만' vs 中企 '발동동',https://news.naver.com/main/read.nhn?mode=LSD&mid=shm&sid1=101&oid=421&aid=0000904100,뉴스1,"원·달러 환율 1,010원선이 붕괴된 2일 서울 중구 외환은행 본점 딜링룸 전광판에 원ㆍ달러 환율이 전일 대비 2.50원 내린 1,009.20원, 코스피 지수가 16.28포인트 오른 2,015.28이 표시되고 있다. 2014.7.2/뉴스1 © News1   한재호 기자전자-자동차 수출 대기업, 해외생산 비중 60~70%로 '영향 미미'수출 중소기업, 마지노선 1010원 무너지면서 앉아서 수익 '뚝뚝'(서울=뉴스1)  산업부  = ""결제 환율을 다변화하고 헷지로 환변동 위험을 최소화하고 있다. 환율 변동에 따른 영향을 최소한으로 유지하고 있다.""원달러 환율이 1000원을 위협하며 급락하고 있다. 1년전만해도 1150원을 웃돌던 원달러 환율은 연초에 1080원을 오락가락하더니 3일 1008.5원에 장을 마감했다. 전일보다 0.7원이 또 내렸다. 불과 1년만에 15%, 반년사이에 7~8% 원화 가치가 절상됐다. 그만큼 한국 제품의 글로벌 시장경쟁력이 약화된 셈이다.연일 저점을 기록하는 원달러 환율로 인해 수출 기업들도 마음을 졸이고 있다. 환율 헷지로 환변동 위험을 방어해놓고 있는 대기업들은 담담한 반응이지만 아무 대책없이 추락하는 환율을 지켜봐야 하는 중소기업들은 발만 동동 구르고 있다.◇'세자리수 환율' 진입은 시간문제3일 서울 외환시장에서 원달러 환율은 당국의 개입으로 반등을 시도했지만 끝내 하락 마감하고 말았다. 원달러 환율은 전날 1010원 밑으로 내려온 뒤 이틀 연속 하락했다. 환율이 1010원 밑으로 내려온 것은 6년만으로, 지금 추세라면 '세자리수 환율' 진입은 시간문제다.환율은 그 나라의 경제력을 보여주는 지표 중 하나다. 적당한 수준으로 원화 강세를 유지하는 게 좋다는 경제학자들의 의견도 있다. 문제는 속도다. 반년 사이에 7~8%, 1년새 15% 이상 환율이 절상되는 것은 지나치게 가파른 속도다. 환율 변화에 미처 대비하지 못한 기업들은 그만큼 수익성이 급감할 수밖에 없다.◇결제환율 다변화한 대기업 ""버틸만하다""환율급락에 대한 대기업의 반응은 예년과 사뭇 다르다. 대표적인 수출기업인 전자, 자동차, 조선업체들은 한결같이 ""환율 영향을 최소한으로 유지하고 있다""고 입을 모았다.삼성전자는 ""환율이 하락하면 수출가격 경쟁력은 약화되지만 수입하는 부품, 설비, 원자재 등의 비용은 긍정적""이라며 ""삼성전자는 환율과 관련해 단기 대응보다 근본 경쟁력을 강화해 대외 변수에 흔들리지 않는 체질을 만들고자 노력하고 있다""고 설명했다. 삼성전자는 금융 거래를 통한 환율 헷지도 안한다. 원화절상에도 불구하고 제값을 받는 제품력을 강조하고 있다.LG전자도 ""환율의 단기적인 하락과 상승이 LG전자 실적에 미치는 영향은 크지 않다""며 ""결제 통화 다변화 및 외화 자산과 부채의 균형을 통해 환율 영향을 최소화하고 있다""고 설명했다.자동차 업계도 마찬가지다. 현대자동차는 ""환헷지는 물론 현지 통화 결제를 통해 큰 영향을 없을 것""이라며 ""하지만 올초 1050원을 예상 환율로 봤기 때문에 환율이 급격히 하락하면 매출 감소를 감수해야 하지 않겠느냐""고 했다.◇""삼성·현대차, 해외생산 비중 60~70%""대기업들이 환율급락에 둔감하게 반응하는 가장 큰 이유는 해외생산 비중이 그만큼 커졌기 때문이다.삼성전자와  LG전자는 중국 등 동남아시아를 비롯해 미주, 유럽 등 주요 국가에 해외 생산기지를 건설하고 현지 생산을 늘리고 있다. 삼성전자는 최근 시안에 반도체 공장을 준공해 가동했다. 미국 텍사스 오스틴 반도체 공장도 가동하는 등 미주 유럽 아시아 각지에 생산 시설을 갖추고 있다. 삼성전자는 해외 생산 비중을 정확히 밝히지 않았으나 약 60~70% 가량을 해외에서 생산하는 것으로 추산된다. 삼성전자 인력 중 해외 근무 인력 비중은 67%에 달한다.현대자동차는 올 상반기 해외에서 생산한 물량이 61%였다. 현대자동차가 올 상반기 판매한 자동차는 모두 249만6375대다. 이중 국내 생산 물량은 97만3069대, 해외 생산 물량은 152만3306대였다. 내수로 판매된 물량은 34만6434대, 국내생산 해외 수출은 62만6635대, 해외생산 해외 판매 물량은 152만3306대였다. 환율 하락에 영향을 받는 물량은 국내 생산 해외 수출 물량인 62만6635대에 불과하다. 전체 매출 대비 25% 수준이다.효성의 경우 스판덱스나 타이어보강재 글로벌 시장점유율 1위를 기록할 만큼 해외수출 비중이 높다. 그러나 효성도 해외생산 비중이 70%에 달해 환율 변동에 따른 영향이 극히 미미하다.밥캣 인수로 외화 부채가 많은 두산인프라코어는 환율하락으로 오히려 이자비용이 감소하는 등 수혜를 얻고 있다. 조선업계도 수출이 100%지만 사업 특성상 수주와 동시에 환율 헷지를 걸기 때문에 환율영향을 거의 받지 않는다.재계 한 관계자는 ""대기업들은 이미 국내 시장보다 해외 시장의 비중이 더 크고 해외생산 비중도 그만큼 커져 과거와 같이 환율에 크게 휘둘리지 않는다""며 ""장기적으로 수익성이나 수출 가격에서 영향을 받겠지만 과거보다 체질이 크게 달라졌다""고 설명했다. 이어 ""대기업들에게 과도한 규제를 가하기보다 글로벌 기업으로 인식하고 투자 유인을 제공하는 발상의 전환도 필요할 것""이라고 강조했다.◇환율하락에 수출 중소기업들 '초비상'문제는 중소기업이다. 중소기업들은 대기업만큼 환율 변동에 미리 대비하지 않았고 규모의 경제를 이루지 못했다. 해외생산 비중도 높지 않다.중소기업중앙회가 최근 수출 중소기업 100개사를 대상으로 실시한 '환율변동에 따른 중소기업 영향조사'에 따르면 환율 하락으로 수익성이 떨어진 곳은 91.5%에 달했다. 업종별로는 금속·철강(75.0%), 고무·화학(71.4%), 기계(68.8%), 음식료(66.7%) 등의 순으로 수익성이 악화될 것으로 조사됐다.미국에 정수기를 수출하는 중소기업인 G사는 ""연간 수출액이 2000만달러에 이르는데 환율이 1010원으로 하락하면 연간 16억원 가량 손실을 보게 된다""면서 ""연간 인건비가 24억원 정도인걸 감안하면 타격이 크다""고 말했다.G사 측은 ""1020원 환율에 맞춰 수출가격을 매겨놨는데 환율이 지속적으로 내려가면서 현재 손해보고 물건을 수출하고 있다""면서 ""미국 거래처에 단가 인상을 통보해두긴 했지만 이를 반영하기까지 5~6개월 가량 걸려 수주받은 물량은 손해보고 팔 수밖에 없다""고 말했다.일본에 기계 등을 수출하는 중소기업 N사도 사정은 마찬가지다. N사는 ""원화절상으로 인해 가격경쟁력이 상실돼 신규 수주가 힘들다""며 ""수출액의 70~80%까지 환변동보험에 가입할 수 있어, 환리스크가 커버되지 않은 부분에 대해서는 계약 추진에 어려움을 겪고 있다""고 하소연했다.중동에 세라믹을 수출하는 T사는 환율이 마지노선 이하로 하락했지만 단가를 조정할 수 없어 수주량이 급감했다고 울상을 지었다.중소기업중앙회 측은 ""최근 환율하락으로 수익성뿐 아니라 신규 수주가 감소하는 등 수출규모에도 부정적 영향을 미치고 있다""며 ""이런 상황이 지속될 경우 수출 중소기업의 경영사정이 더욱 어려워질 것으로 예상된다""고 말했다.xpert@news1.kr▶ 네이버 뉴스스탠드에서 NEWS1을 바로 만나보세요.내 손안의 모바일 뉴스, 함께하니 더 즐겁다 ☞ NEWS1 모바일 바로가기[ⓒ 뉴스1코리아(news1.kr), 무단 전재 및 재배포 금지]"
79,2014-07-03,미세먼지 예보 정확해질까…中 대기오염 정보 확보,https://news.naver.com/main/read.nhn?mode=LSD&mid=shm&sid1=103&oid=001&aid=0006995848,연합뉴스,"한·중 환경협력 양해각서 체결…AI 정보도 공유(세종=연합뉴스) 이광철 기자 = 중국 대도시의 실시간 대기오염 정보를 반영해 국내 미세먼지 예보의 정확도를 높일 수 있는 발판이 마련됐다.환경부는 중국 내 74개 도시의 대기오염 측정소 900곳에서 실시간으로 측정한 자료를 공유하는 내용을 담은 '한-중 환경협력에 관한 양해각서'를 중국 환경보호부와 체결했다고 3일 밝혔다.양국이 공유하는 대기오염 측정소 자료는 미세먼지(PM10), 초미세먼지(PM2.5), 오존(O3), 이산화질소(NO2), 이산화황(SO2), 일산화탄소(CO) 등 6개 오염물질을 다룬다.환경부는 ""중국의 고농도 미세먼지 발생을 지금보다 하루나 이틀 전에 알 수 있어 미세먼지 예보 정확도를 크게 높일 수 있을 것으로 기대하고 있다""고 말했다.양해각서는 이밖에 대기오염 예보 모형 개발과 대기오염물질 발생 원인 규명 연구를 함께 추진하는 공동연구단을 연내에 꾸리고, 내년부터 대기분야 과학기술 인력을 교류하는 내용도 담았다.중국과 환경산업 분야 협력을 강화하는 방안도 양해각서에 포함됐다.중국 정부는 미세먼지를 줄이는 사업에만 2017년까지 304조원을 투입할 예정인데, 우리나라는 중국 제철소에 집진, 탈황기술을 적용하는 대기오염 방지 실증사업을 공동 추진하게 된다.환경부는 또 중국 국가임업국과 '한-중 야생생물 및 자연생태계 보전 협력에 관한 양해각서'를 체결했다.양해각서를 바탕으로 양국은 조류인플루엔자(AI) 등 야생동물의 질병 감시, 사막화 지역의 생태계 복원 연구, 멸종위기 야생생물 보전, 보호지역 관리, 야생생물의 수출입 관리정책 공유와 공동연구 등을 추진한다.윤성규 환경부 장관은 ""이번 한-중 환경분야 양해각서 체결과 협력사업 추진 계획이 미세먼지 등 양국 환경현안을 실질적으로 해결하는 데 큰 도움이 될 것으로 본다""고 말했다.minor@yna.co.kr▶확 달라진 연합뉴스 앱 다운로드▶[월드컵] 축구협회 ""홍명보 대표팀 감독 유임""<저작권자(c) 연합뉴스, 무단 전재-재배포 금지>"
80,2014-07-03,4년새 30개 저축銀 간판 바뀌었으나 '적자' 찬바람은 여전,https://news.naver.com/main/read.nhn?mode=LSD&mid=shm&sid1=101&oid=421&aid=0000904097,뉴스1,"© News1   한재호 기자부실원인 PF대출 82% 정리...16분기 연속 적자 지속(서울=뉴스1) 이훈철 기자  = 4년에 걸쳐 추진됐던 30개 부실 저축은행에 대한 구조조정이 마무리됐다. 누적 부실을 털어내고, 대부업체가 저축은행을 인수하는 등 새로운 전기를 맞이 했다는 평가다. 하지만 16분기 연속 적자가 말해주듯 업계 영업전반에 대한 불황은 여전히 지속되고 있는 실정이다.금융당국은 앞으로도 구조조정을 상시화해 부실을 사전에 차단하고, 저축은행이 관계형 금융으로 성장할 수 있도록 규제를 완화하고 제도를 개선해 나갈 계획이다.금융위원회는 2일 러시앤캐시의 예주·예나래저축은행 주식취득으로 예금보험공사가 보유관리하던 10개 저축은행이 모두 매각·정리됨에 따라 총 30개 부실 저축은행에 대한 구조조정이 마무리됐다고 3일 밝혔다.부실저축은행에 대한 구조조정은 2011년 저축은행 사태 이후 추진됐다. 금융당국은 2011년 상반기 삼화저축은행을 시작으로 부산저축은행 계열사 등 9개 저축은행을 정리했다.그해 9월 실시된 모든 저축은행에 대해 경영진단 결과를 토대로 제일, 토마토 등 7개 저축은행이 추가로 정리대상에 올랐으며 2012년 5월 솔로몬 등 4개 저축은행에 경영개선명령이 부과됐다. 이어 2012년 하반기부터 올 상반기까지는 상시 구조조정을 통해 10개 저축은행에 대한 구조조정이 이뤄졌다.30개 저축은행이 구조조정되면서 저축은행 수는 2010년말 105개에서 현재 87개로 줄었다. 자산 기준으로 볼때 55%가 감소한 것이다.특히 저축은행 구조조정의 가장 큰 성과는 부실을 털어냈다는 데 있다. 금융당국은 구조조정을 통해 주요 부실 원인이었던 프로젝트파이낸싱(PF) 대출을 약 82% 정리하고, 자본확충을 통해 BIS비율을 11.2%까지 끌어올리는 등 자본적정성을 높였다.구조조정이 이뤄지면서 국내 저축은행업계에도 변화의 바람이 불었다. 대형 계열 저축은행들이 쓰러져 나간 자리에 일본계 자본이 흘러 들어와 자리를 채웠으며, 자본력 있는 대부업체가 저축은행을 인수했다.하지만 구조조정이 저축은행 업계의 불황까지 털어내지는 못했다.저축은행업계는 16분기 연속 적자가 지속되는 등 영업전반에 걸쳐 어려움을 겪고 있다. 부실 저축은행을 인수한 경우 막대한 투자에도 불구하고 여전히 당기 순손실을 기록 중이다. SBI저축은행은 모기업 SBI금융그룹의 지원을 통해 지난해부터 1조원이상의 자금을 투자하고 있지만 여전히 적자에서 벗어나지 못하고 있다.금융당국은 이에 따라 관계형, 지역밀착형 금융을 중장기 모델로 삼아 저축은행 업계의 불황을 탈피할 계획이다. 소상공인 대상 맞춤형 상품을 개발하고 채무조정제도를 확대하는 등 관계형 금융활성화 방안을 다음달까지 구체화한다는 계획이다.금융위는 또 지속적인 리스크 관리를 위해 올 3분기 중 NPL, 대부업체 대출 한도 관련 규제 신설, 자산건전성 분류기준 합리화, 지점설치 규제 합리화 등의 내용을 포함한 상호저축은행법 시행령과 감독규정을 개정할 예정이다.boazhoon@news1.kr▶ 네이버 뉴스스탠드에서 NEWS1을 바로 만나보세요.내 손안의 모바일 뉴스, 함께하니 더 즐겁다 ☞ NEWS1 모바일 바로가기[ⓒ 뉴스1코리아(news1.kr), 무단 전재 및 재배포 금지]"
81,2014-07-03,"정부, 전교조 검찰고발 초강수",https://news.naver.com/main/read.nhn?mode=LSD&mid=shm&sid1=102&oid=001&aid=0006995740,연합뉴스,"지난달 27일 서울 봉래동 서울역광장에서 열린 전교조 전국교사대회에서 참석 조합원들이 피켓을 든 채 구호를 외치고 있다. (연합뉴스 자료사진)법외노조 통보에 전교조 1만2천여명 '박근혜 퇴진' 선언교육부, 검찰 고발 이어 미복귀 전임자 처리 주목(세종=연합뉴스) 구정모 기자 = 교육부가 법외노조 처분에 대해 반발하고 있는 전국교직원노동조합(전교조)에 대해 검찰고발이란 '초강수'를 둠에 따라 양측간 갈등이 '강대강' 대결 구도로 치닫고 있다.교육부는 정부의 법외노조 처분에 반발해 지난달 27일 조퇴투쟁을 벌이고, 제2차 교사선언을 주도한 전교조 집행부를 비롯한 전임자 전원과 성명서 낭독 교사 4명을 검찰에 고발하기로 했다고 3일 밝혔다.정부의 엄정 대처 방침은 조퇴투쟁 전날인 지난달 26일 교육부, 고용노동부, 대검찰청, 경찰청 등이 '전교조 법외노조 관련 공안대책협의회'를 연 데에서 예고됐다.각 기관은 당시 협의회에서 전교조의 집단행동에 원칙대로 대응하겠다고 밝힌 바 있다.교육부는 이에 앞서 시·도교육청에서 전교조 조합원들의 조퇴투쟁 참여를 하지 못하도록 복무관리를 철저히 하라는 공문을 보낸 데 이어 조퇴투쟁 후에는 참석자 현황을 파악하는 등 강경 대응을 위한 수순을 밟아나갔다.특히 이날 조퇴투쟁 주동자에 대해서 형사고발한 것은 지난 2006년 조퇴·연가투쟁 참가자들에 대해 징계처분을 내린 것과 대조된다.국가공무원법상 공무 외 집단행위 금지를 위반하게 되면 1년 이하의 징역 또는 500만원 이하의 벌금을 받게 된다.교육부는 또 교사선언에 대해서도 1차 때와 다르게 2차 때에 강력한 조처를 했다.지난 5월 15일 1만5천여명이 참가한 1차 교사선언에 대해서는 세월호 참사 애도의 성격의 강한 것으로 보고 아직 징계나 고발을 염두에 두지 않고 있으나, 1만2천244명이 서명한 2차 교사선언은 교육의 정치적 중립을 위반한 것으로 보고 전교조 전임자 71명을 전원 고발했다.김정훈 전국교직원노동조합 위원장이 2일 서울 서대문구 전교조 사무실에서 열린 '세월호 참사 2차 교사선언 기자회견'에서 회견문을 읽고 있다. (연합뉴스 자료사진)물론 1차 교사선언에서는 전교조가 ""대통령은 자신의 책무 불이행을 뼈저리게 고백하고 합당한 책임을 져야 한다""고 에둘러 표현했다면 2차 교사선언에서는 ""대통령이 물러나는 것만이 더이상의 제자들과 동료들을 잃지 않는 길""이라고 대통령 퇴진을 명시적으로 밝힌 것이 강경조치의 배경이 된 것으로 보인다.정부가 검찰고발이라는 강경 카드를 꺼내고 전교조가 '대통령 퇴진'을 주장하며 강하게 반발하는 이상 양측의 정면 충돌은 불가피해 보인다.당장 미복귀 전교조 전임자에 대한 교육부의 조치가 주목된다.교육부는 4일까지 전교조 법외노조에 따른 후속조치 이행상황을 보고하도록 한 상태다.교육부는 전교조 미복귀 현황에 대한 공식적인 보고가 들어오는 대로 입장을 정할 계획이다. 현재 전임자 72명 중 1명이 복귀한 상태다.휴직 사유가 끝난 교원이 기간 내로 복귀하지 않으면 직권면직 내지 징계 대상이 돼 이들에 대한 징계를 두고 교육부와 시·도교육감 간 갈등이 벌어질 가능성이 농후하다.진보 교육감들은 이미 전임자의 복귀 시한을 3일이 아닌 18일 또는 19일로 연장해 통보했기 때문이다.교육감들이 미복귀 전임자에 대한 징계의결 요구를 이행하지 않을 경우 교육부는 교육감을 직무유기로 형사고발할 수 있다.오는 12일 예정된 전교조의 전국교사대회도 갈등의 불씨다.전교조 측이 교사대회에서 정부의 강경 대응 방침에 '대통령 퇴진'과 같은 정치성이 강한 주장을 한다면 이번처럼 또 검찰고발이 재연될 것으로 보인다.pseudojm@yna.co.kr▶확 달라진 연합뉴스 앱 다운로드▶[월드컵] 축구협회 ""홍명보 대표팀 감독 유임""<저작권자(c) 연합뉴스, 무단 전재-재배포 금지>"
82,2014-07-03,'인천 모자 살인사건' 피고인 2심서도 사형 구형,https://news.naver.com/main/read.nhn?mode=LSD&mid=shm&sid1=102&oid=001&aid=0006995844,연합뉴스,"(서울=연합뉴스) 서혜림 기자 = 검찰은 3일 '인천 모자 살인 사건' 피고인 정모(30)씨의 항소심에서 원심처럼 사형을 구형했다.서울고법 형사12부(민유숙 부장판사) 심리로 이날 열린 정씨의 결심 공판에서 검찰은 ""원심의 형이 가볍다고 할 수 없다""며 이같이 구형했다.정씨는 최후변론에서 ""죄송한 감정밖에 없다""며 ""평생을 반성하고 용서를 빌면서 살겠다""고 밝혔다.그는 ""제 인생이 짧게 남았든 길게 남았든 제가 저지른 행동이 얼마나 잘못됐는지 깨달았다""며 ""앞으로 재판 결과가 어떻게 나오든 받아들이겠다""고 말했다.이어 ""절 버리지 않고 끝까지 찾아와 주신 친척분들께 감사하다. 정말 죄송하다""며 말을 맺었다.정씨는 지난해 8월 13일 인천시 남구 용현동에 있는 어머니 김씨의 집에서 김씨와 형을 밧줄로 목을 졸라 숨지게 하고 시체를 훼손한 뒤 유기한 혐의로 구속기소됐다. 국민참여재판으로 진행된 1심에서 재판부는 배심원들의 유죄 평결을 받아들여 사형을 선고했다.공범으로 지목된 정씨의 아내 김씨는 수사 도중 스스로 목숨을 끊었다.선고기일은 오는 24일 오후 2시30분으로 예정됐다.hrseo@yna.co.kr▶확 달라진 연합뉴스 앱 다운로드▶[월드컵] 축구협회 ""홍명보 대표팀 감독 유임""<저작권자(c) 연합뉴스, 무단 전재-재배포 금지>"
83,2014-07-03,"軍, 임병장 상관살해 혐의 구속영장..",https://news.naver.com/main/read.nhn?mode=LSD&mid=shm&sid1=100&oid=421&aid=0000904323,뉴스1,"동부전선 GOP 총기 난사후 탈영해 자살을 시도했던 임모(23) 병장이 26일 강릉 아산병원에서 국군병원으로 이송되고 있다.강원도 고성 22사단 GOP에서 총기를 난사한 후 무장탈영한 임병장은 23일 오후 2시55분께 군 병력과 대치하던 중 자살을 시도했다. 2014.6.26/뉴스1 © News1   서근영 기자4일 영장실질심사...본격 강제 수사 예정(서울=뉴스1) 배상은 기자  = 군 당국이 강원도 동부전선 GOP(일반전초)에서 발생한 총기난사 사건의 피의자 임모 병장(22)에 대해 상관 살해 등의 혐의로 구속영장을 청구했다고 3일 밝혔다.국방부 관계자는 이날 ""8군단 검찰이 오전 8군단 보통군사법원에 임 병장에 대한 구속영장을 청구했다""며 ""4일 영장실질심사가 실시될 예정""이라고 말했다.군 당국은 영장 실질심사를 거쳐 구속 영장이 발부되면 임 병장에 대한 본격적인 강제수사에 돌입한다는 방침이다.임 병장은 국군강릉병원 일반병실에서 입원 치료를 받으며 현재까지 총 5차례 대면 조사를 받은 것으로 전해졌다.baebae@news1.kr▶ 네이버 뉴스스탠드에서 NEWS1을 바로 만나보세요.내 손안의 모바일 뉴스, 함께하니 더 즐겁다 ☞ NEWS1 모바일 바로가기[ⓒ 뉴스1코리아(news1.kr), 무단 전재 및 재배포 금지]"
84,2014-07-03,"시진핑 ""순풍에 돛단 듯, 힘차게 나아가자""",https://news.naver.com/main/read.nhn?mode=LSD&mid=shm&sid1=100&oid=001&aid=0006995566,연합뉴스,"밝은 표정의 한·중 정상     (서울=연합뉴스) 이정훈 기자 = 1박2일 일정으로 국빈 방한한 시진핑 중국 국가주석이 3일 오후 청와대 대정원에서 열린 공식 환영식에서 박근혜 대통령과 함께 의장단을 사열한 뒤 은평초등학교 어린이 환영단에게 손을 흔들고 있다.한국 국빈방문 앞서 일부 한국 신문에 기고문(베이징=연합뉴스) 홍제성 특파원 = 시진핑(習近平) 중국 국가주석은 3일 한국 국빈방문과 관련해 '순풍에 돛을 단다'(風好正揚帆)는 속담을 인용하며 ""중한 친선의 배가 돛을 높이 올리고 파도를 헤치며 힘차게 나아갈 수 있기를 바란다""고 말했다.중국 신화망(新華網)은 시 주석이 취임 후 처음으로 한국을 방문하면서 일부 한국 신문에 기고문을 보내 자신의 방한이 갖는 의미와 기대 등을 설명했다면서 기고문 전문을 실었다.신화망에 따르면 시 주석은 기고문에서 ""중한 양국은 명실상부한 이익공동체가 됐다""고 평가하면서 양국 관계 발전에 중요한 '4가지'를 견지해 나가자고 제안했다.시 주석은 우선 선린우호 견지 및 상호 신뢰 증진을 제안한 뒤 논어에 등장하는 '믿음이 없으면 설 수 없다'(無信不立)란 성어를 소개하며 '신뢰'의 중요성을 강조했다.그는 '호혜협력 견지 및 이익의 융합 강화'를 제안하면서 ""이익의 파이를 더 크게 만들고자 한다""고 강조한 뒤 '꽃 한 송이 피었다고 봄이 온 것이 아니라 온갖 꽃이 만발해야 비로소 봄이 온 것이다'(一花獨放不是春，百花齊放春滿園), '한배에 타고 강을 건너가고 있다'(同舟共濟)란 옛말을 소개했다.그는 '평화와 안정 견지 및 공동의 터전 수호'를 제안하면서는 ""일단 동란이 발생하면 역내 국가 중 그 누구도 혼자만 무사할 수 없고 지역 안정의 대국(大局)에 손해를 끼치는 어떠한 행동도 반대에 직면할 것""이라고 지적했다.시 주석은 이밖에 '인문 교류 견지 및 우정의 다리 건설'도 제안했다.'세 닢 주고 집을 사고 천냥 주고 이웃을 산다'는 한국 속담으로 기고문을 시작한 그는 현재의 양국 관계를 ""새로운 역사적 출발점에 서 있다""고 평가하며 자신의 방한이 ""양국관계 발전에 새로운 동력을 불어넣게 될 것으로 믿는다""고 기대감을 표시했다.jsa@yna.co.kr▶확 달라진 연합뉴스 앱 다운로드▶[월드컵] 축구협회 ""홍명보 대표팀 감독 유임""<저작권자(c) 연합뉴스, 무단 전재-재배포 금지>"
