,날짜,기사 제목,기사 링크,기사 출처,기사 내용
109,2014-04-24,"[세월호 참사]""절박한 현장, 자원봉사 입수 제한 불가피""",https://news.naver.com/main/read.nhn?mode=LSD&mid=shm&sid1=102&oid=003&aid=0005811230,뉴시스,"현장 방문 343명중 16명 입수…구조 실적 '0'【진도=뉴시스】구용희 기자 = 세월호 침몰 현장 민간인 자원봉사자 참여 제한을 놓고 일고 있는 논란에 대해 사고대책본부가 공식 입장을 밝혔다.범정부 사고대책본부는 24일 ""먼저 사고 발생 뒤 수색구조 작업에 도움을 주기 위해 많은 사람들이 생업을 제쳐두고 현장을 찾았으나 참여의 기회를 제대로 드리지 못해 송구스럽다""고 밝혔다.사고대책본부 고명석 대변인은 이날 오전 전남 진도군청 2층 대회의실에서 브리핑을 갖고 ""그 동안 많은 논란에도 불구, 순수한 열정으로 참여한 자원봉사자들께 혹시라도 마음의 상처를 드릴까 봐 구체적 사실을 적시하지 못한 부분이 있었다""고 말했다.고 대변인은 ""논란이 확산되고 국민 의혹을 증폭시키는 보도가 계속됨에 따라 불가피하게 설명을 드린다""며 ""지금 구조현장에는 UDT·SSU·특전사·해경·소방·민간업체 잠수부 등 총 700여명의 정예 잠수요원들이 헌신적으로 구조작업에 임하고 있다""고 설명했다.또 ""자원봉사자들은 현재까지 총 34개 단체 343명이 현장에 방문했으며 이중 16명이 실제 입수했다""고 덧붙였다.이어 ""일단 자원봉사자들이 현장을 찾으면 기존 작업을 중단하고 이들에게 입수의 기회를 줬다""며 ""대부분 거센 물살과 제한된 시야로 채 10분도 안돼 물 밖으로 나오거나 심지어 입수도 안 한 채 사진만 찍고 돌아가는 자원봉사자도 있었다""고 말했다.고 대변인은 ""현재까지 자원봉사자들의 구조 실적은 없다""며 ""결과적으로 자원봉사자들의 뜻과 달리 기존 작업에 많은 지장이 초래되고 제한된 시간 내 최대한의 성과를 내야 하는 절박한 작업 현실을 고려, 불가피하게 이들의 참여를 제한하게 됐다""고 밝혔다.또 ""이 같은 결정에는 현지 작업을 참관하고 있는 희생자 가족 대표들의 간절한 요청도 반영됐다""며 ""자원봉사단의 참여 제한 결정을 미리 설명하지 못한 점에 대해서는 죄송스럽게 생각한다""고 말했다.persevere9@newsis.com★ 뉴시스 뉴스, 이젠 네이버 뉴스 스탠드에서도 만나세요★ 손 안에서 보는 세상, 모바일 뉴시스<저작권자ⓒ 공감언론 뉴시스통신사. 무단전재-재배포 금지.>"
110,2014-04-24,"LG유플, 30~40만 원대 '베가시크릿업' 판매중단..소비자 혼란",https://news.naver.com/main/read.nhn?mode=LSD&mid=shm&sid1=105&oid=018&aid=0002975224,이데일리,"[이데일리 김현아 기자] LG유플러스(032640)가 결국 출고가 인하와 보조금을 얹어 30~40만 원대로 팔던 팬택의 ‘베가시크릿업’ 판매를 중단했다.제조사와 합의 없이 출고가를 39만원 가량 인하(95만 4800원에서 59만 9500원으로 인하)한다고 발표하고서, 팬택과 합의가 안 되자 애꿎은 고객 피해로 이어진 셈이다.LG유플러스는 24일 “팬택이 일방적으로 협상 결렬을 선언함에 따라 당사는 팬택과의 최종 협상이 마무리 되기 전까지 단말 가격책정을 할 수 없어 ‘베가 시크릿업’에 대해 판매를 잠정 중단한다”고 밝혔다.이어 “지속적으로 협상을 시도해 문제를 해결하겠다”고 밝혔지만, 어제(24일) 협상결렬이후 양측의 감정이 많이 상해 계약(약정)이 이뤄질지는 미지수다.이 회사는 또 “지난주 금요일부터 어제까지 베가 시크릿업을 구매한 고객에게 지급된 출고가 인하 금액이 불법 보조금에 해당하는지 여부에 대해서는 팬택이 출고가 인하와 재고보상 방안에 대해 이미 구두 합의를 한 이후 판매했기 때문에 문제가 없다”고 주장했다.지금까지 업계에서 출고가 인하와 선구매 조건을 함께 협상한 사례가 단 한번도 없었던 데다, 통상 구두합의를 통해 출고가 인하가 진행돼 왔다는 설명이다.LG유플러스가 유통망에 어제 보낸 문자"
111,2014-04-24,"與, 서울시장 경선 내달 12일 실시",https://news.naver.com/main/read.nhn?mode=LSD&mid=shm&sid1=100&oid=018&aid=0002975210,이데일리,"[이데일리 박수익 김정남 기자] 새누리당이 6.4지방선거 광역단체장 후보경선을 다음달 12일까지 마무리하기로 했다. 충남·부산·대구·대전·강원 도지사 경선은 중앙선거관리위원회 위탁 경선이 가능한 시한인 오는 30일 일괄적으로 진행한다. 수도권 경선은 5월로 연기해 인천(9일), 경기(10일), 서울(12일) 순으로 진행한다.새누리당 공천관리위원회 부위원장인 김재원 의원은 24일 국회 브리핑을 갖고 이같은 내용의 경선 일정을 발표했다. 김 의원은 “기초단체장 이하 광역의원·기초의원 경선은 중앙선거관리위 위탁이 절실한 지역은 4월 30일까지 위탁해서 실시할 방침”이라고 밝혔다.박수익 (park22@edaily.co.kr)[종합 경제 뉴스 이데일리 모바일 웹][이데일리 TV][이데일리 ON][MP트래블러][마켓포인트]＜ⓒ종합 경제정보 미디어 이데일리 - 무단전재 & 재배포 금지＞"
112,2014-04-24,"새정치聯, 현역 기초단체장 8명 공천 탈락",https://news.naver.com/main/read.nhn?mode=LSD&mid=shm&sid1=100&oid=015&aid=0003072693,한국경제,"[ 이호기 / 이정호 기자 ] 새정치민주연합은 6·4 지방선거 기초단체장 공천신청자 470명 중 현역 시장·군수·구청장 8명을 포함해 모두 34명을 ‘부적격자’로 분류, 공천 배제를 확정한 것으로 23일 알려졌다. 새정치연합은 이날 시·도당위원장회의를 열어 기초단체장 후보자 자격심사위원회의 심사 결과를 의결하고 각 시·도당에 2차 공천심사대상자 명단을 전달했다.1차 심사에서 배제된 현역 단체장은 문충실 서울 동작구청장과 조병돈 이천시장, 고석용 강원 횡성군수, 김종식 광주 서구청장, 임정엽 전북 완주군수, 송영선 전북 진안군수, 임성훈 전남 나주시장, 허남석 전남 곡성군수 등 8명이다. 텃밭인 호남지역에서 5명의 현역 기초단체장을 걸러냈다.여기에 현재 재판이 진행 중인 김호수 부안군수는 일단 조건부로 2차 공천심사 대상자에 포함됐으나 다음달 2일 재판 결과에 따라 공천에서 탈락할 가능성도 배제할 수 없다. 이 경우 전체 현역 단체장 탈락자는 9명(호남 6명)으로 늘어난다.새정치연합은 시·도당별로 2차 공천심사를 실시해 기초단체장 경선 후보를 확정할 계획이어서 현역 단체장 가운데 공천 탈락자는 더 늘어날 것으로 예상된다.한편 새누리당은 서울(내달 9일)과 경기(10일)를 제외하고 그동안 연기했던 나머지 광역단체장 후보 경선을 이달 내에 마무리하는 방안을 추진 중이다. 새누리당은 현재 17개 광역단체장 후보 중 9개 지역의 후보를 확정했다. 경선을 치르지 않은 나머지 8개 지역은 서울 인천 경기 부산 대구 대전 강원 충남이다.이호기/이정호  기자   hglee@hankyung.com[한경+ 구독신청] [기사구매] [모바일앱]  ⓒ '성공을 부르는 습관' 한경닷컴, 무단 전재 및 재배포 금지"
113,2014-04-24,"與 서울시장 5월12일, 인천 5월9일…경선일정 확정",https://news.naver.com/main/read.nhn?mode=LSD&mid=shm&sid1=100&oid=421&aid=0000793344,뉴스1,"2014.4.21/뉴스1 © News1 박철중 기자충남 부산 대구 대전 강원은 이달 30일, 경기는 5월 10일(서울=뉴스1) 김유대 기자  = 새누리당은 24일 세월호 침몰 사고로 연기된 서울시장 경선을 다음달 12일 실시키로 확정했다.새누리당 중앙당 공천관리위원회 부위원장인 김재원 의원은 전날 밤 공천위 회의와 이날 오전 최고위원회의 논의를 거쳐 이같이 확정했다고 밝혔다.새누리당은 앞서 서울시장 경선을 이달 30일에서 다음달 9일로 한 차례 연기했고, 사고 여파가 커지면서 일정을 잠정 보류한 바 있다.충남·부산·대구·대전·강원 광역단체장 후보 경선은 이달 30일에 동시 실시키로 일정을 변경했고, 인천시장과 경기지사 후보자 선출대회는 각각 다음달 9일과 10일로 연기했다.새누리당은 기초단체장과 지방 의원 경선의 경우 선관위의 위탁 관리가 필요한 지역은 위탁 마감 시한인 오는 30일까지 최대한 공천 작업을 마무리한다는 방침이다.▶ 네이버 뉴스스탠드에서 NEWS1을 바로 만나보세요.내 손안의 모바일 뉴스, 함께하니 더 즐겁다 ☞ NEWS1 모바일 바로가기미리 보는 6ㆍ4 지방선거 ☞ 제 6회 전국동시지방선거는 news1과 함께하세요.[ⓒ 뉴스1코리아(news1.kr), 무단 전재 및 재배포 금지]"
114,2014-04-24,'소조기' 마지막 날…세월호 침몰 9일째 '입체수색',https://news.naver.com/main/read.nhn?mode=LSD&mid=shm&sid1=102&oid=001&aid=0006877423,연합뉴스,"구조팀 현장 수색    (진도=연합뉴스) 특별취재팀 = 민관합동구조팀이 24일 오전 전남 진도군 병풍도 세월호 침몰 해상에서 수색 활동을 벌이고 있다.문화재청 해저발굴단 수색 지원…선체 4층 중앙 집중수색(진도=연합뉴스) 특별취재팀 = 세월호 침몰 사고 발생 9일째인 24일 수상·수중 수색작업이 이어지고 있다.민관군 합동구조팀은 이날 물 흐름이 느려지는 소조기가 끝나는 점을 감안해 1명의 생존자, 1구의 시신이라도 찾기 위해 필사의 노력을 하고 있다.함정 261척, 항공기 35대, 구조대원 726명이 투입돼 입체적 수색활동을 벌이고 있다.◇ 인원·장비 총동원…4층 중앙 객실 수색 첫 시도기존 해경·해군·소방·민간 잠수사에 문화재청 해저발굴단까지 합류해 지금까지 가장 많은 수중 수색 인력이 투입된다.구조팀은 3~4층 선수와 선미 부분의 다인실을 집중적으로 수색하고 있다.4층 중앙 객실 수색도 처음으로 시도된다. 4층에서는 그동안 100구의 시신이 수습됐다.해군은 4층 선미 부분, 해경과 구난업체는 4층 중앙, 잠수기 어선은 4층 선수와 중앙, 소방은 4층 중앙 부분을 전담해 수색하며 문화재청 해저발굴단은 기술 지원을 맡았다.오전 9시 30분 현재 사망자는 모두 159명으로 시신 119구는 선체에서 발견됐으며 40구는 물에 떠올랐다.영장실질심사 후 기관사·조기수     (목포=연합뉴스) 특별취재팀 = '세월호' 침몰 사고 기관사와 조기수들이 24일 오후 광주지방법원 목포지원에서 유기치사 및 수난구호법 위반 혐의로 영장실질심사를 받고 나오고 있다. 맨 오른쪽부터 1등 기관사 손모(57·오른쪽)씨, 3등 기관사 이모(25·여)씨, 조기수 이모(55)씨·박모(58)씨.미국 해군 구조함인 세이프 가드호는 25일 도착할 예정이다.3천300여t급인 이 함은 수심 58ｍ까지 공기 잠수를 지원할 수 있다.◇ 승무원 4명 영장심사…사고상황 재구성도 '박차'1·2등 기관사 각 1명, 조기수 2명 등 4명에 대해 청구된 구속영장 실질심사가 이날 오전 열린다.모두 발부되면 구속된 승무원은 모두 11명으로 늘어난다.운항에 직·간접으로 관여하고도 승객들을 두고 탈출한 승무원은 모두 15명으로 나머지 4명은 입원 치료 중이다.수사본부는 압수수색으로 확보한 승무원, 승객들의 카카오톡 메시지와 사진 등을 토대로 사고 상황을 재구성하고 있다.수사본부는 선박 개조에서 점검·운항까지 모든 관리과정을 파악해 불법행위가 있었는지도 조사하고 있다.급격한 변침, 선박 구조 변경, 선박의 평형유지 문제 등이 주요 규명대상이다.수사본부는 부장검사, 평검사 각각 2명, 검찰과 해경 수사관들은 시신을 검시해 신원 확인과 사인 조사를 하고 있다.sangwon700@yna.co.kr▶연합뉴스앱▶궁금한배틀Y▶화보▶포토무비<저작권자(c) 연합뉴스, 무단 전재-재배포 금지>"
115,2014-04-24,경기직행좌석버스 24일 입석 임시허용…출근혼란 없어,https://news.naver.com/main/read.nhn?mode=LSD&mid=shm&sid1=103&oid=001&aid=0006877464,연합뉴스,"(의정부=연합뉴스) 김도윤 기자 = KD운송그룹이 24일 직행좌석형(빨간색) 광역버스의 입석을 임시로 허용, 평소대로 운행해 출근길 혼란은 없었다.경기∼서울 직행좌석버스는 23일 첫차부터 예고 없는 입석 금지 조치에 많은 출근길 이용객들이 타지 못해 지각하는 등 큰 혼란을 빚었다.KD운송그룹은 지난 22일 국토교통부가 버스 운행 관련 안전 대책을 논의하자며 직접 전화하자 부랴부랴 이 같은 지침을 마련, 직행좌석버스를 운행하는 7개 계열사에 지시했다.62개 노선 800여 대가 입석을 금지했다.이 버스는 대부분 경기남부와 서울을 오가는 데 고속도로와 자동차전용도로를 거쳐 입석으로 탈 수 없다. 도로교통법상 고속도로와 자동차전용도로에서는 좌석에 앉아 안전벨트를 착용해야 하기 때문이다.그러나 그동안 출퇴근시간대 혼잡한 일반 버스의 승객을 분산하기 위해 직행좌석형 광역버스의 입석 탑승을 묵인했다.여객선 '세월호' 참사로 정부가 각 분야 안전규정 준수에 대한 관리감독을 강화할 움직임을 보이자 해당 업체가 갑자기 원칙을 내세웠다.23일 승객들의 항의가 빗발쳤고 결국 국토부는 한발 물러서 대책이 마련될 때까지 입석 단속을 보류하겠다고 밝혔다.고속도로 이용 때는 안전속도를 지키도록 당부했다.이 같은 국토부 방침에 KD운송그룹은 지난 23일 밤 입석 금지 조치를 풀었다.국토부는 이날 수도권교통본부에서 버스운송업체 등 관계 기관이 참석한 가운데 대책 회의를 열고 전세버스 투입, 광역급행버스(M-버스) 증차 등을 검토할 예정이다.kyoon@yna.co.kr▶연합뉴스앱▶궁금한배틀Y▶화보▶포토무비<저작권자(c) 연합뉴스, 무단 전재-재배포 금지>"
116,2014-04-24,1분기 GDP 작년比 3.9% 성장…3년만에 최고(종합2보),https://news.naver.com/main/read.nhn?mode=LSD&mid=shm&sid1=101&oid=001&aid=0006877360,연합뉴스,"전기대비 성장률 0.9%…건설투자 늘고 설비투자 감소민간소비 증가는 둔화 …""연말정산 환급액 감소 영향""(서울=연합뉴스) 경수현 고유선 기자 = 올해 1분기 경제 성장률이 전기 대비 0.9%를 기록했다. 전년 동기 대비로는 3.9% 성장해 3년 만에 가장 높은 증가율을 보였다.한국은행이 24일 집계한 '실질 국내총생산(GDP) 속보치'에 따르면 1분기 실질 국내총생산(GDP)은 직전 분기보다 0.9% 늘어나 작년 4분기와 같은 수준의 증가율을 유지했다.앞서 분기 성장률은 8분기 연속 0%대에서 움직이다가 작년 2분기와 3분기에 각각 1.0%와 1.1%로 올라섰다.올해 1분기 실질 GDP는 작년 동기 대비로는 3.9% 늘었다. 이 증가율은 2011년 1분기(4.9%) 이후 3년 만에 가장 높은 수준이다.실질 국내총소득(GDI)은 교역조건의 소폭 악화로 작년 4분기 0.8%에서 올해 1분기 0.7%로 둔화됐다.1분기 성장률은 민간소비 증가는 둔화하고 설비투자는 감소했지만 수출 증가세가 지속한데다 건설투자와 지식재산생산물투자가 큰 폭으로 늘어난 데에 힘입었다.건설투자는 주거용 건물 건설의 호조로 4.8%나 늘어 작년 4분기의 감소세(-5.2%)에서 벗어났다.지식재산생산물투자도 민간부문의 연구개발(R&D) 투자를 중심으로 7.5% 늘었다. 수출은 전기 및 전자기기, 석유제품 등을 중심으로 1.7% 증가했다.그러나 수입은 기계류, 화학제품 등이 줄면서 0.5% 감소했다.민간소비는 자동차 등 내구재와 서비스 소비가 늘었지만 전분기보다 0.3% 늘어나는 데 그쳐 작년 4분기(0.6%)보다 둔화했다.정영택 한은 경제통계국장은 ""연말정산 환급액이 줄고 오히려 추가납부가 발생해 약 5천800억원의 가계소득 감소가 있는 것으로 추정된다""며 ""이에 따른 소비 위축이 0.2%포인트 있고 따뜻한 날씨로 난방수요가 준 영향도 있다""고 설명했다 .설비투자는 기계류의 부진으로 1.3% 줄어 5분기만에 감소세로 돌아섰다.경제활동 별로는 제조업이 2.1% 증가했고 건설업도 1.4% 늘었다.서비스업은 음식숙박은 부진했지만 보건 및 사회복지, 운수 및 보관 등이 늘어 0.6% 증가했다.이에 비해 전기가스수도업은 난방수요 감소로 4.5% 줄었고 농림어업(-4.3%)도 감소세를 보였다.한국은행은 1분기 성장률이 대체로 성장 전망 경로 범위에 있는 수준이라고 평가했다.정 국장은 ""재고를 제외한 내수의 성장기여도는 1.1%, 수출은 0.9%여서 내수와 수출이 거의 비슷한 수준으로 성장을 동반 견인했다""며 ""4월에 발표한 경제전망이 유효하다""고 말했다.한은은 최근 경제 전망에서 작년 동기 대비 GDP 성장률이 올해 상반기 3.9%, 하반기 4.0%를 기록할 것으로 내다봤다.evan@yna.co.kr▶연합뉴스앱▶궁금한배틀Y▶화보▶포토무비<저작권자(c) 연합뉴스, 무단 전재-재배포 금지>"
117,2014-04-24,5월부터 대장암환자 배변주머니도 건강보험 혜택,https://news.naver.com/main/read.nhn?mode=LSD&mid=shm&sid1=102&oid=001&aid=0006877313,연합뉴스,"뇌혈관색전술에 필요한  디테이쳐블 코일도 적용(서울=연합뉴스) 신호경 기자 = 다음 달부터 대장암 환자 등이 수술 후 사용하는 배변주머니에도 건강보험이 적용돼 환자의 경제적 부담이 크게 줄어든다.보건복지부는 5월 10일부터 장루·요루 환자가 사용하는 치료 재료 가운데 '피부부착판과 주머니(플랜지 앤 백)'를 건강보험 대상에 추가한다고 24일 밝혔다.장루와 요루는 각각 대장·소장 질환, 방광·요도 질환 때문에 환자가 대변, 소변을 보기 어려운 경우 배설 통로로서 배에 인공적으로 만든 구멍을 말한다. 이를 통한 배변에 사용되는 것이 부착판(Flange)과 배변 주머니(Bag)인데, 주기적 교체가 필요한 재료들이다.현재 환자 상태와 입원 여부 등에 따라 1주일에 2~4개만 건강보험이 적용되지만, 앞으로 입원 기간에는 개수 상관없이 모든 '플랜지 앤 백'에 건강보험 급여가 지급된다. 통원 치료의 경우 1주당 4개까지 건강보험 급여가 인정된다. 특히 자기 조절이 어려운 3세미만 환자, 치매 환자나 소요량이 많은 피부합병증 발생 환자, 수술·퇴원후 2개원 이내 환자 등에는 하루 1개까지 건강보험이 적용된다.복지부는 이번 급여 확대로 장루·요루 환자 등 약 1만8천여명이 혜택을 받을 것으로 추산하고 있다. 예를 들어 '플랜지 앤 백'을 한달에 16개씩 사용해온 대장암 환자의 경우, 본인부담 비용이 연간 66만원에서 6만원으로 약 10분의 1수준까지 줄어든다는 설명이다.뇌혈관색전술 등에 필요한 '디테이쳐블 코일(detachable coil)'의 건강보험 급여도 확대된다. 혈관색전술은 혈관성 질환에 따른 출혈을 예방하거나 치료하기 위해 질환 부위의 혈류를 완전히 차단하는 시술로, 혈류를 막는데 디테이쳐블 코일이 쓰인다. 다음달 10일부터는 '선천성 관상동맥의 동정맥루' 치료를 위해 사용된 디테이쳐블 코일에도 건강보험이 적용된다. 해당 질환 환자는 지금까지 혈관색전술을 받으면서 사용한 10개 코일에 585만원을 부담했지만, 앞으로는 29만원 정도만 내면 된다.복지부 관계자는 ""이번 급여 확대에 연간 약 74억원의 건강보험 재정이 추가로 쓰일 것""이라고 예상했다.shk999@yna.co.kr▶연합뉴스앱▶궁금한배틀Y▶화보▶포토무비<저작권자(c) 연합뉴스, 무단 전재-재배포 금지>"
118,2014-04-24,"""호주 해안서 발견된 물체, 실종기 잔해 아니다""",https://news.naver.com/main/read.nhn?mode=LSD&mid=shm&sid1=104&oid=001&aid=0006877305,연합뉴스,"실종기 수색작업 하는 미군 항공기 (AP=연합뉴스DB)(시드니=연합뉴스) 정열 특파원 = 호주 서남부 해안에서 발견돼 실종된 말레이시아 항공기(MH370) 잔해일지 모른다는 관측을 낳았던 금속판이 실종 여객기의 것이 아닌 것으로 판명됐다.호주교통안전국(ATSB)은 조사 결과 23일(현지시간) 서호주(WA)주 남부도시 오거스타 동쪽 10㎞ 해안가에서 발견된 금속판이 말레이시아 실종기의 것이 아닌 것으로 확인됐다고 24일 밝혔다.마틴 돌란 ATSB 대변인은 ""경찰이 우리에게 가져온 상세 사진들을 주의깊게 조사했지만 (해당 물체가) 실종된 MH370기 수색과 연관된 단서는 아니라고 믿는다""며 ""지금 단계에서 우리는 (해당 물체가) 실종기에서 나왔을 가능성을 배제하고 있다""고 말했다.돌란 대변인은 전날 CNN과의 인터뷰에서 ""사진을 살펴볼만한 이유가 상당하다""며 ""모든 단서를 진지하게 조사하고 있다""고 밝힌 바 있다.수색을 총괄하는 호주 합동수색조정센터(JACC)는 23일 한 주민이 오거스타 동쪽 해안가에서 한쪽에 둥근 못이 달린 높이 2.4ｍ 넓이 50㎝의 얇은 금속판을 발견해 서호주 경찰에 전달했다며 이 물체가 실종기에서 나온 것인지를 ATSB가 조사 중이라고 밝혔다.국제수색팀은 그간 위성사진·항공수색 등으로 실종기 잔해 추정 물체를 수차례 포착했으나 현재까지 실제 잔해로 밝혀진 것은 없다.passion@yna.co.kr▶연합뉴스앱▶궁금한배틀Y▶화보▶포토무비<저작권자(c) 연합뉴스, 무단 전재-재배포 금지>"
