,날짜,기사 제목,기사 링크,기사 출처,기사 내용
19,2014-04-24,"[세월호 참사] ""미안해요"" 임시분향소 찾은 1만명의 시민들",https://news.naver.com/main/read.nhn?mode=LSD&mid=shm&sid1=102&oid=079&aid=0002589226,노컷뉴스,"여객선 세월호 침몰 8일째인 23일 오후 경기도 안산 올림픽기념관에 마련된 단원고 희생자 임시 합동 분향소를 찾은 조문객들이 헌화하고 있다. (황진환 기자/자료사진)세월호 사고 희생자들의 영정이 모셔진 안산 올림픽기념관 실내체육관에는 어제에 이어 오늘도 시민들의 발길이 끊이지 않고 있다.24일 오전 8시 현재 분향소를 찾은 조문객은 모두 1만 3,700명.시민들은 바쁜 퇴근에 짬을 내어 아이들의 영정에 꽃 한 송이를 바쳤다.초등학교 3학년, 1학년 두 아들을 데리고 분향소를 찾은 정낙일(42) 씨는 ""저도 똑같은 부모 입장에서 이런 일이 일어나면 안 될 것 같아서 아이들한테 보여주러 왔다""고 말했다.분향소엔 모두 48명의 학생과 교사의 영정이 모셔졌다.경기도교육청 측은 장례식을 마치고 추가로 들어오는 영정을 모시기 위해 오전 시간 조문을 잠시 중단하고 분향소 제단을 정리했다.분향소 입구 한켠에 마련된 추모 메시지판은 조문객이 남긴 색색의 메시지로 가득찼다.서툰 글씨로 언니, 오빠들의 무사를 기원하는 초등학생의 글부터, 모든 것이 어른들의 책임이라는 자책의 글까지 다양했다.서울디지털대학교 교수이자 시인인 이재무 씨도 희생자 아이들을 별에 비유한 시를 메시지판에 남겨 눈길을 끌었다.24일에도 단원고 학생 14명의 발인식이 고대 안산병원 등 안산 곳곳에서 예정돼 있다.tooderigirl@cbs.co.kr(대한민국 중심언론 CBS 뉴스FM98.1 / 음악FM93.9 / TV CH 412)저작권자 ⓒ CBS 노컷뉴스 (www.nocutnews.co.kr) 무단전재 및 재배포 금지 Copyright © Since 2003 by CBSi, 노컷뉴스. All rights reserved"
20,2014-04-24,中서부 올 최악의 황사…둔황석굴도 폐쇄,https://news.naver.com/main/read.nhn?mode=LSD&mid=shm&sid1=104&oid=421&aid=0000793324,뉴스1,"23일 중국 신장위구르자치구 바저우 지역. 사진 출처 중국신문망. © 뉴스1(서울=뉴스1) 정은지 기자  = 23일 중국 간쑤, 신장위구르자치구 일부 지역에서 올 들어 가장 강력한 황사가 발생했다.현지 언론에 따르면 심한 황사와 강풍이 섞이며 불과 5m 앞 시야도 확보되지 않았다고 전했다.이로인해 이날 오전 신장위구르자치구 바저우 룬타이현 고속도로에서 트레일러 차량 5대와 대형 고속버스 1대가 추돌하며 1명이 사망하고 30명이 부상했다.사고가 발생한 바저우 지역은 황사 황색 경보를 홍색 경보로 격상시켰다.또 신장으로 진입하는 고속도로 일부의 운행이 제한됐다.서부 간쑤성에서는 올 들어 첫 황사가 발생하며 일부 지역에서 황사 주황경보가 발령됐다.간쑤성 성도인 란저우기상대는 이 날 황사로 주황경보가 발령됐다고 밝히며 인근 둔황, 마종산 등에서 심각한 황사 현상을 나타냈다고 발표했다.간쑤성을 지나는 열차 최소 10대도 황사의 영향을 받아 운영이 중단됐다.신장지역의 차가운 공기와 지면의 한랭전선의 영향으로 둔황 지역의 경우 가시거리는 20m에 불과했다.특히 세계 문화유산으로 등재된 둔황석굴은 황사로 인해 폐쇄됐다.▶ 네이버 뉴스스탠드에서 NEWS1을 바로 만나보세요.내 손안의 모바일 뉴스, 함께하니 더 즐겁다 ☞ NEWS1 모바일 바로가기미리 보는 6ㆍ4 지방선거 ☞ 제 6회 전국동시지방선거는 news1과 함께하세요.[ⓒ 뉴스1코리아(news1.kr), 무단 전재 및 재배포 금지]"
21,2014-04-24,"페루, 하늘에 ‘사람이름’ 붙이다…법안 통과",https://news.naver.com/main/read.nhn?mode=LSD&mid=shm&sid1=104&oid=081&aid=0002419169,서울신문,"[서울신문 나우뉴스]하늘을 하늘이라고 부를 수 없는(?) 국가가 등장했다.하늘에 이름을 공식 명칭을 붙인다는 법안이 최근 페루 의회를 통과했다.법이 공포되면 앞으로 페루에선 하늘이 ‘하늘’이 아니라 ‘캡틴 호세 아벨라르도 키뇨네스’라고 불리게 된다.캡틴 호세 아벨라르도 키뇨네스는 페루와 에콰도르가 전쟁을 벌이던 1941년 전사한 페루공군의 영웅이다.그는 전투 중 에콰도르 전투기의 공격을 받았다. 전투기에 불이 붙어 추락할 위기였지만 탈출하지 않고 적진으로 전투기를 몰았다.전투기를 타고 지상 적진으로 돌격해 그대로 자폭 충돌했다.법안은 이렇게 전사한 전쟁영웅 캡틴 호세 아벨라르도 키뇨네스를 기린다는 취지로 페루 의회에 발의됐다. 의회는 만장일치로 법안을 통과시켰다.길에 이름을 붙이듯 하늘에 이름을 붙이자는 법안이 발의되자 일각에선 비아냥도 나왔다. “하늘에 이름을 붙이다니 의회가 웃기는 일만 하고 있다.”는 질타도 있었다.하지만 페루 여야는 법안에 대해 전폭적인 지지를 보냈다.법안을 발의한 페루 여당의 호수에 구티에레스 의원은 “일견 허황된 것처럼 보일 수도 있지만 애국적인 시각에서 보면 웃긴다는 반응을 보일 수 있을지 모르겠다.”고 말했다.페루에서 자연에 특정인의 이름을 붙이는 건 처음이 아니다.페루는 1879년 칠레와의 전쟁 때 전사한 미겔 가르우 제독을 기념한다며 바다에 ‘미겔 그라우’라는 이름을 붙인 바 있다.사진=자료사진손영식 해외통신원voniss@naver.com별난 세상 별난 뉴스(nownews.seoul.co.kr)★ MLB,IT등 나우뉴스 통신원 모집합니다. ★- Copyrights ⓒ서울신문사. 무단 전재 및 재배포 금지 -"
22,2014-04-24,스테이크 썰다 ‘관세’ 불거질라… ‘미슐랭 별 셋’ 스시 만찬,https://news.naver.com/main/read.nhn?mode=LSD&mid=shm&sid1=104&oid=020&aid=0002566276,동아일보,"[동아일보]아베, 오바마 스시집 초대 속사정23일 오후 8시경 일본 도쿄(東京)의 번화가 긴자(銀座). 일본 경찰들이 친 바리케이드 너머에서 갑자기 ‘와∼’ 하는 함성과 함께 카메라 플래시가 터졌다.이날 일본을 국빈방문한 버락 오바마 미국 대통령이 아베 신조(安倍晋三) 총리와 만찬을 하기 위해 차량에서 내려 손을 흔들었기 때문이다.오바마 대통령이 들어간 곳은 빌딩 지하 1층에 있는 초밥집 ‘스키야바시 지로’. 기다리고 있던 아베 총리와 악수를 했다. 오바마 대통령은 “신조”라며 아베 총리의 이름을 불렀고, 아베 총리는 “How are you(안녕하세요)”라고 영어로 답했다. 이날 만찬은 오후 8시 반부터 10시경까지 약 1시간 반 동안 진행됐다.아베 총리는 오바마 대통령과 사적인 친밀감을 쌓으려 공동의 취미인 골프 이야기부터 꺼낸 뒤 중국의 패권 확대 및 미일 동맹 강화 등에 대해 이야기를 나눈 것으로 전해졌다.스키야바시 지로는 세계적 레스토랑 평가전문매체인 미슐랭가이드로부터 최고 등급인 별 세 개를 7년 연속 받은 곳. 1인당 최하 3만 엔(약 30만4000원)부터 요리사의 선택에 맡기는 코스 요리를 제공하고 있다. 아사히신문은 만찬 장소로 초밥집을 정한 것이 ‘식탁 외교’의 일환이라고 이날 전했다.애초 일본 정부는 2009년 오바마 대통령이 일본을 방문했을 때 사전에 “고베(神戶)산 쇠고기를 먹고 싶다”고 말했던 점을 감안해 쇠고기 레스토랑을 검토했다. 하지만 미일 간 환태평양경제동반자협정(TPP) 논의 중 쇠고기와 돼지고기의 관세 인하가 껄끄러운 문제여서 쇠고기 메뉴를 제외한 것으로 알려졌다. 그 후 일본 정부는 오바마 대통령이 초밥을 즐긴다는 정보를 입수해 곧바로 초밥집을 만찬장으로 결정했다.정상회담장에서 때론 격론이 오가기도 하지만 초청국이 만찬장에서 따뜻한 배려를 보여주면 회담 분위기가 부드러워진다. 이른바 식탁 외교 효과다. 오바마 대통령이 미국 대통령으로는 18년 만에 일본을 국빈방문한 자리에서도 일본은 교섭을 유리하게 이끌고자 식탁 외교에 중점을 뒀다.지난해 오바마 대통령과 정상회담을 한 아베 총리는 상대방에 대해 “곧바로 업무 이야기로 들어가는 타입”이라고 평했다. 하지만 “점심식사 때는 농담도 하고 꽤 부드러운 면을 보였다”고 덧붙였다.하토야마 유키오(鳩山由紀夫) 전 총리는 2009년 오바마 대통령을 식탁 외교로 사로잡은 적이 있다. 오바마 대통령이 어릴 때 모친과 일본 가마쿠라(鎌倉)를 방문했을 때 말차(末茶·가루차) 아이스크림을 맛있게 먹었다는 사실을 알고 만찬 디저트로 이 아이스크림을 대접했다. 당시 오바마 대통령은 크게 감동했던 것으로 전해졌다.오바마 대통령 역시 식탁 외교로 상대 정상을 사로잡는 데 능하다. 2011년 10월 이명박 전 대통령을 국빈으로 초청한 오바마 대통령은 워싱턴 인근 한식당 ‘우래옥’에서 불고기 만찬을 대접하며 파격 의전을 선보였다.일본 외교사에서 널리 회자되는 식탁 외교 일화는 1991년 포울 쉴테르 덴마크 총리와 가이후 도시키(海部俊樹) 일본 총리의 만찬이다. 당시 메인 요리는 닭고기였지만 가이후 총리는 급히 돼지고기로 바꾸도록 지시했다. 덴마크 돼지고기의 대(對)일본 수출 점유율이 2위로 떨어지자 덴마크를 응원하기 위해 돼지고기로 바꾼 것이다. 쉴테르 총리는 일본의 배려에 감동했고 정상회담도 부드럽게 이어진 것으로 전해진다.도쿄=박형준 특파원 lovesong@donga.com[☞오늘의 동아일보][☞동아닷컴 Top기사][☞채널A 종합뉴스]"
23,2014-04-24,"갤럭시S5, 美 컨슈머리포트 ‘스마트폰 1위’",https://news.naver.com/main/read.nhn?mode=LSD&mid=shm&sid1=105&oid=014&aid=0003147122,파이낸셜뉴스,"삼성전자 갤럭시S5삼성전자의 갤럭시S5가 미국 최고 권위의 소비자 잡지인 컨슈머리포트에서 최고의 스마트폰으로 등극했다. 화질, 배터리수명, 사용성 등 전부문에 걸쳐 최고점을 받았다.24일 컨슈머리포트에 따르면 갤럭시S5는 미국 4대 이동통신사인 버라이즌, AT&T, T모바일, 스프린트용으로 구분된 스마트폰 평가 순위에서 각각 80∼81점을 얻어 모두 1위에 올랐다.컨슈머리포트는 미국의 비영리단체인 소비자연맹이 발간하는 미국의 최대 소비재 전문 월간지로 매달 거의 전 소비재에 대해 업체별 성능과 가격 등을 비교해 소비자에게 제공한다. 회비와 기부, 잡지판매수입 만으로 운영되기 때문에 소비자들의 잡지에 대한 신뢰도가 높다.삼성전자 갤럭시S5는 미국 통신 시장에서 상위 5개 통신사업자를 통해 같은 모델명과 디자인으로 동시에 출시됐다. 이번 조사에서 AT&T와 T모바일로 출시한 갤럭시S5는 81점을, 버라이즌과 스프린트로 출시한 제품은 80점을 각각 받았다.갤럭시S5는 사용성, 메시징, 웹브라우징, 화질, 전화, 배터리 수명에서 모두 최고점인 '탁월(Excellent)'을 받았고, 카메라와 휴대성 평가에서도 '매우 우수(Very Good)'를 받았다.특히 AT & T의 스마트폰 평가에서는 갤럭시S5에 이어 갤럭시S4(16GB 모델), 갤럭시S4(32GB 모델), 갤럭시S4 액티브가 나란히 1∼4위를 차지했다. 또 스프린트와 티모바일의 평가에서도 갤럭시S5에 이어 갤럭시S4가 상위권에 랭크됐다. LG G2의 경우 버라이즌 4위(78점), AT & T 5위(79점), T모바일 3위(79점), 스프린트 4위(79점)를 기록했다.반면 애플의 아이폰5s는 버라이즌·AT & T 각 11위(각 76점·78점), T모바일 8위(78점), 스프린트 9위(76점)를 기록해 모두 5위권 바깥으로 밀려났다.컨슈머리포트는 ""갤럭시S5는 사용하기 쉽고 방수·방진 기능을 제공하는 등 견고한 제품으로 1600만 화소의 고성능 카메라와 '울트라 파워 세이빙 모드' 등 배터리 수명이 크게 향상됐고 지문인식 기능으로 보안 문제도 개선됐다""고 밝혔다.yccho@fnnews.com 조용철 기자※ 저작권자 ⓒ파이낸셜뉴스. 무단 전재-재배포 금지"
24,2014-04-24,빈병 95% 회수되는데…재사용은 日의 3분의1,https://news.naver.com/main/read.nhn?mode=LSD&mid=shm&sid1=102&oid=015&aid=0003072680,한국경제,"이슈 & 분석환불 보증금 유명무실반납 거부하는 가게 많아…수거 과정에서 많이 깨져내열유리의 역습녹는 온도 높아 폐유리 재활용 걸림돌[ 추가영 기자 ] 유리병 재활용이 제대로 안되고 있다. 유리병 분리 배출은 연간 출고량의 95%에 이를 정도로 많지만 빈병 재사용률은 85%에 그치고 있다. 수거 과정에서 파쇄되는 비율이 10%포인트에 달한다는 얘기다. 이 때문에 빈병 재사용 횟수는 평균 8회로 일본(28회)의 3분의 1 수준에 그치고 있다.폐유리를 녹여 쓰는 재활용은 내열유리가 등장하면서 생산 효율이 크게 떨어졌다.○유리병 파쇄율 10%빈병을 재활용하는 가장 좋은 방법은 ‘수거해 세척한 뒤 재사용’하는 것이다. 맥주병이나 소주병을 수거해 세척한 뒤 다시 사용하면 병당 평균 50원의 비용이 들어간다. 하지만 폐유리를 녹여 새 병으로 만들면 평균 160원이 투입된다. 여기에다 해외자원 수입 절약, 이산화탄소 배출감소 효과 등을 감안하면 빈병을 수거해 재사용하는 것이 훨씬 낫다는 게 전문가들의 의견이다.정부는 1985년부터 빈병 재사용률을 높이기 위해 소비자에게 반환보증금(맥주병 50원, 소주병 40원)을 부과해왔다. ‘자원의 절약과 재활용 촉진법’에서 빈용기보증금 대상 유리병으로 정한 주류, 청량음료 등의 유리용기가 적용 대상이다. 제품 판매가격에 반환보증금을 포함하는 방식으로 징수해왔다.김영춘 한국용기순환협회 제도개선팀장은 “빈용기보증금은 파손되지 않은 빈병을 판매처에 돌려주고 보증금을 돌려받는 제도”라며 “하지만 회수 과정의 부주의로 인해 발생하는 유리병 파쇄율은 10%로 일본, 독일 등 선진국에 비해 높은 편”이라고 말했다.빈병을 수거하는 도·소매업자가 받는 취급수수료(맥주병 19원, 소주병 16원)가 적은 것도 수거가 방치되는 이유 중 하나다. 빈병을 받아주는 동네 가게가 요즘은 거의 사라졌다.자원순환사회연대가 최근 실시한 소비자 인식조사에 따르면 서울 부산 광주 등에 사는 20대 소비자들의 95%가 빈용기 반환보증금 제도에 대해 ‘모른다’고 응답했다.○내열용기 분리배출 어려워환경부가 발표한 올해 유리병 재활용 의무율은 76%다. 전체 원료의 76% 이상을 깨진 유리나 폐유리 등으로 써야 한다. 이를 달성하지 못하면 유리병 생산자는 별도의 부과금을 내야 한다.문제는 2011년부터 본격적으로 국내에 보급되기 시작한 내열유리 폐용기다. 내열유리는 일반 유리에 붕산을 첨가해 내열성을 높인 제품이다. 용해점이 1700도 이상으로 일반유리(1450도)보다 높다. 용해로에 내열유리 폐용기가 들어가면 완전히 녹지 않고 덩어리가 지거나 기포가 생겨 제품 불량률이 높아진다. 내열유리를 완전히 녹이려면 용해로의 온도를 더 높여야 한다. 비용이 그만큼 더 들어간다.내열유리 폐용기는 일반 유리쓰레기에 섞여 버려지는 경우가 많다. 대부분 사람은 깨진 내열유리 용기를 재활용이 가능한 유리쓰레기로 잘못 알고 재활용 쓰레기로 버리고 있다. 재활용 사업자들이 육안으로 내열유리를 식별해 재분리하기가 매우 어렵다. 국내 유리병 제조공장의 지난해 불량률(8.5%)의 4분의 1 정도는 내열유리 때문에 생긴 것으로 추산되고 있다.한 재활용사업자는 “유리병 생산자가 분리배출 표시를 하고 있지만 이를 일일이 확인하고 쓰레기를 분리 수거하는 사람은 거의 없다”고 말했다.○“재활용 지원금 적다” 지적도유리병 생산업체는 재활용 의무비율(올해 76%)을 지키지 못하는 만큼 생산자분담금을 더 내야 한다. 분담금은 지난해 ㎏당 26.5원이었다. 이 돈을 받은 공제조합은 폐유리 재활용 비용으로 ㎏당 22원을 재활용 사업자에게 지난해 지급했다.방정훈 한국유리공업협동조합 부장은 “공제조합이 받은 생산자분담금보다   17%   적은 돈을 지원금으로 지급했다”고 지적했다. 유리병 생산업체들로부터 받은 생산자분담금 전액을 재활용 업체들에 지원금으로 나눠줘야 한다는 것이다.이에 대해 김홍석 한국순환자원유통지원센터 대외협력팀장은 “분담금에는 재활용사업자 지원금뿐만 아니라 공제조합 한국순환자원유통지원센터 운영비가 포함돼 있다”고 해명했다. 김 팀장은 또 “소주병 등 녹색병의 파유리 중국수출 방안연구 등 재활용 방법 연구와 기술개발에 필요한 비용도 운영비 명목 중 하나”라고 설명했다.추가영 기자  gychu@hankyung.com[한경+ 구독신청] [기사구매] [모바일앱]  ⓒ '성공을 부르는 습관' 한경닷컴, 무단 전재 및 재배포 금지"
25,2014-04-24,"스노든, 화상강연으로 英대학 학생총장 활동 나서",https://news.naver.com/main/read.nhn?mode=LSD&mid=shm&sid1=104&oid=001&aid=0006877109,연합뉴스,"3월10일(현지시간) 텍사스주 오스틴에서 열린 '사우스바이사우스웨스트'(SXSW) 인터랙티브 행사 인터뷰에 출연한 에드워드 스노든. (AP=연합뉴스)(런던=연합뉴스) 김태한 특파원 = 미국 정보기관의 대규모 개인정보 수집 활동을 폭로하고서 러시아에 임시망명한 에드워드 스노든이 온라인 강연으로 영국 글래스고 대학의 학생 총장으로서 공식 활동에 나섰다.지난 2월 글래스고 대학 학생 총장에 선출된 스노든은 23일(현지시간) 이 대학 강당에서 학생과 교직원 200명이 참석한 가운데 화상 중계 연설로 취임의 변을 밝혔다고 BBC가 보도했다.스노든은 이날 연설에서 ""학생 총장으로 선출된 것을 영광스럽게 생각한다""며 ""학생들의 지지와 대학과 대중을 위해 봉사할 기회를 받은 데 감사한다""고 밝혔다.그는 ""실제로 참석하지 못해 실망스럽고 죄송하다""며 자신이 공익에 반하는 위험인물로 지정돼 영국 입국이 허락되지 않는 사실을 최근에야 알았다고 밝혔다.그는 감청활동 폭로 파문과 관련 ""국민은 정부의 정책을 알 권리가 있다""며 ""모든 감시활동을 낱낱이 알지는 못해도 우리 이름과 우리 자신을 겨냥한 감시행위의 큰 틀은 파악해야 한다""고 말했다.스노든은 ""믿고 지지하는 것을 위해 행동해야 한다는 소신에 따라 소임을 다하겠다""며 학생 총장으로서의 포부도 밝혔다.3년 임기의 글래스고대 학생 총장은 행정을 책임지는 총장과 함께 학교를 이끄는 최고위직으로 학생들의 추천과 투표를 통해 선출된다.실질적인 업무보다는 명예직의 성격이 강해 그동안 넬슨 만델라의 전 부인 위니 만델라, 이스라엘의 핵개발을 폭로한 모르데차이 바누누 등이 이 자리를 거쳤다.thkim@yna.co.kr▶연합뉴스앱▶궁금한배틀Y▶화보▶포토무비<저작권자(c) 연합뉴스, 무단 전재-재배포 금지>"
26,2014-04-24,“출석부 사진이 영정사진 될 줄은…” “다 우리 손주 같은 애들인데…”,https://news.naver.com/main/read.nhn?mode=LSD&mid=shm&sid1=102&oid=081&aid=0002419034,서울신문,"[서울신문]“5살 때부터 엄마 없이 할머니, 고모 손에 자랐어도 착하게 잘 자라준 아들인데…. 미안해서 죽겠어요.”23일 경기 안산시 단원구 올림픽기념관에 마련된 진도 여객선 침몰 참사 임시분향소. ‘대한민국 미워요, 사랑하는 아들, 딸 미안해’, ‘하늘에선 별과 같이 빛나길’ 등 추모글이 쓰인 조화들이 먼저 눈에 띄었다. 지난 15일 설레는 마음으로 수학여행 길에 올랐다가 차가운 주검으로 돌아온 단원고 학생 43명과 이들을 살리려고 마지막까지 안간힘을 썼던 강모(52) 교감 등 교사 3명의 영정은 아무 일도 없었다는 듯 조문객을 맞이했다.연고는 없지만, 숨진 학생들에게 미안해 분향소를 찾았다는 시민들이 체육관 밖 인도까지 줄지어 이어졌다. 해가 진 뒤에는 퇴근길에 들른 직장인들까지 가세해 조문 행렬은 밤늦도록 끊이지 않았다. 조문객이 몰려들자 밤부터는 100명씩 한꺼번에 분향소에 들어가기도 했다. 합동분향소가 차려진 지 하루도 채 안 돼 황망하게 세상과 작별한 학생들의 넋을 기리는 조문객 숫자는 1만명을 넘어섰다.오전 8시 분향소가 공식적으로 문을 열기 전부터 숨진 학생과 교사 등의 유족들이 분향소를 찾았다. 하염없이 눈물만 흘리며 사진을 뚫어져라 쳐다보던 황모씨는 “내가 이혼하는 바람에 우리 아들이 외롭게 컸는데 미안해 죽겠다”면서 “비통한 심정이 1주일이 지났지만, 도저히 나아지지 않는다”고 털어놨다. 황씨는 아들에게 엄마의 빈자리를 채워 주지 못한 게 모두 자신의 탓인 양 자책했다. 황군의 할머니도 눈물 젖은 국화꽃을 놓으면서 감정이 격해졌는지 울음을 멈추지 못했다.황군과 함께 전날 발인을 마친 김모(17)양의 어머니는 딸이 좋아하던 초콜릿 한 상자와 강아지를 데려와 들여보내 달라며 오열했다. 김양의 어머니는 “우리 애가 강아지에게 ‘빛’이라는 뜻의 루시라는 이름을 지어주며 그렇게 예뻐했다”면서 “구조만 조금 빨리 됐어도 살릴 수 있었는데…. 발견 당시 안경까지 쓰고 있었다”며 한없이 울었다.직장인 김선영(31·여·시흥시 정왕동)씨는 “아이들의 출석부 사진이 영정 사진이 되리라고 누가 상상이나 했겠나”면서 “두 번 다시 이런 비극이 안 일어나길…”이라며 말끝을 흐렸다. 이성호(22·수원 권선구)씨는 “아이들을 지켜주지 못한 게 미안해서 왔다”고 말했다. 안산시게이트볼연합회 회원 50명과 단체로 분향소를 찾은 김문재(79)씨는 “다 우리 손주 같은 애들인데 안타깝고 너무 비참하다”고 전했다.분향소 곳곳에서는 부둥켜안고 오열하는 사람들도 속출했다. 자신을 숨진 학생의 이웃이라고 밝힌 한 여성은 “우리 같은 늙은 사람들이 먼저 가야 하는데 저 어린 애들이 무슨 죄가 있다고 이런 일이…”라며 울음을 터뜨렸다. 휠체어를 타고 조문을 온 한 할머니는 영정 안치를 위해 한동안 분향소 입장이 제한되자 “휠체어를 밀어주는 봉사자가 (낮) 12시에는 가야 해 조문할 수 없게 됐다”며 아쉽게 발걸음을 돌렸다.안산에 있는 태국 사원 스님 6명은 승려복을 입고 조문을 와 방명록에 태국어로 “이번 사고로 숨진 이들을 애도한다”는 내용의 글을 남기기도 했다. 배우 차인표·신애라 부부와 안철수·김한길 새정치민주연합 공동대표, 이정희 통합진보당 대표 등 정치인들도 분향소를 찾았다.최훈진 기자 choigiza@seoul.co.kr‘맛있는 정보! 신선한 뉴스!’ 서울신문(www.seoul.co.kr) [신문 구독신청]- Copyrights ⓒ서울신문사. 무단 전재 및 재배포 금지 -"
