,날짜,기사 제목,기사 링크,기사 출처,기사 내용
62,2014-04-24,"<세월호참사> 수사본부, 해경 등 공무원 수사 시사",https://news.naver.com/main/read.nhn?mode=LSD&mid=shm&sid1=102&oid=001&aid=0006878466,연합뉴스,"16일오전 세월호가 침몰하는 사고 현장(진도=연합뉴스) 특별취재팀 = 세월호 참사 원인 등을 수사 중인 검경 합동수사본부가 해경 등 공무원에 대한 수사에도 착수할 것으로 보인다.수사본부 총괄책임자인 안상돈 광주고검 차장검사는 24일 기자간담회에서 세월호 침몰 후 초기 대응 등과 관련해 공무원들을 수사할 뜻을 내비쳤다.안 차장검사는 수사대상에 대한 질문을 받고 ""지난 17일 수사본부 출범 당시 국민에게 사고 원인과 사고 발생 후 구조 상황을 제대로 조사하겠다고 밝힌 바 있다""고 말했다.""공무원도 수사대상이냐"", ""해경 관계자도 포함되느냐""고 기자들이 재차 묻자 ""방금 말씀(제대로 조사하겠다)으로 대체하겠다""고 답변했다.이는 초기 대응의 문제점이 없었는지 해경을 상대로 수사한다는 방침을 간접적으로 시인한 것으로 여겨진다.그동안 300명 이상의 승객을 구조하지 못한 해경 등의 책임론이 대두했지만 수사본부의 검찰 고위 관계자들은 합동 수사본부에서 함께 수사하는 주체를 당장 수사하는 데 난색을 표해왔다.sangwon700@yna.co.kr▶연합뉴스앱▶궁금한배틀Y▶화보▶포토무비<저작권자(c) 연합뉴스, 무단 전재-재배포 금지>"
63,2014-04-24,[세월호 참사]수업·장례·사고수습…교사들은 괜찮은가?,https://news.naver.com/main/read.nhn?mode=LSD&mid=shm&sid1=102&oid=003&aid=0005812349,뉴시스,"【안산=뉴시스】김도란 기자 = 세월호 침몰사고 후 사고 현장에 투입됐던 경기 안산단원고등학교 교사들이 극심한 정신적 고통과 업무압박에 시달리고 있다.24일 도교육청에 따르면 세월호 침몰사고가 발생한 뒤 단원고 교사들은 실종자 가족이 모여있는 진도실내체육관과 구조활동이 이뤄지는 팽목항, 안산 지역 장례식장 등으로 파견돼 근무했다.진도실내체육관에 파견된 교사들은 실종자 가족을 보살피며 사망자들의 장례절차 지원업무를 담당했다.사고 직후 실종자 가족들은 매우 격앙돼 있었고, 현장에 있는 교사들은 학부모들의 비난과 원성을 들어야 했다.사고 이튿날엔 학교측 책임을 주장하는 일부 학부모들의 요구로 교사들이 무릎 꿇고 사죄하는 일도 있었다.팽목항에 파견됐던 교사들의 고충은 더했다.남교사는 수습된 학생 시신을 직접보고, 여교사는 시신 사진을 본 뒤 학생의 신원을 구별하느라 하루에도 여러 차례 제자들의 시신을 봐야 했다.동료와 학생을 잃은 슬픔에 원초적인 공포까지 더해져 이 업무를 맡았던 교사들은 지금도 고통을 호소하고 있다.장례식장에서 유족들을 보살피는 업무를 맡았던 교사들도 사정은 마찬가지. 감정이 격해진 유족들에게 교사들은 '죄인'이었다.앞서 23일 안산의 한 장례식장에선 유족들이 시신 운구과정에서 이동 카트에 실린 관을 보고 '시신을 바닥에 방치했다'고 오해하는 일이 발생, 교사 등 공무원 여러명이 무릎꿇고 사죄하는 일도 발생했다.도교육청은 24일부터 학교 정상화를 위해 필수인력을 제외한 교사들을 모두 학교로 복귀시켰지만, 인력부족 등으로 단원고 교사들의 업무는 과중한 상태다.단원고 교원 정원은 교장과 교감을 포함해 80명이지만 사고로 교원 13명의 결원이 발생한데다 아직 8명의 교원이 진도현장에 남아 인력이 부족하기 때문이다.경기도교육청 단원고 회복지원단 관계자는 ""현재 선생님들 중에는 '거울을 못 보겠다' '닫힌 공간에 있기 무섭다'는 등 정신과 치료가 필요할 정도의 심적고통을 호소하는 분이 많다""며 ""학생들과 함께 심리치료 프로그램에 참여하곤 있지만 걱정스러운 것이 사실""이라고 말했다.정운선 교육부 학생정신건강지원센터장은 ""진도 실종자의 부모, 생존자와 그 가족, 희생자의 가족 등 너무 많은 곳에서 교사들을 필요로 하고 있다""며 ""단원고의 정상화를 위해선 남아있는 교사와 학생들이 신체·정신적 건강을 회복하는 일이 시급하다""고 했다.dorankim@newsis.com★ 뉴시스 뉴스, 이젠 네이버 뉴스 스탠드에서도 만나세요★ 손 안에서 보는 세상, 모바일 뉴시스<저작권자ⓒ 공감언론 뉴시스통신사. 무단전재-재배포 금지.>"
64,2014-04-24,"삼성카드, 화재에 따른 고객피해 모두 보상",https://news.naver.com/main/read.nhn?mode=LSD&mid=shm&sid1=101&oid=003&aid=0005812358,뉴시스,"【서울=뉴시스】박기주 기자 =삼성카드가  'ATM으로 현금서비스를 받아 부담하게 된 추가 수수료' 등 카드 결제 관련 피해에 대해 고객에게 금전적 보상을 제공하기로 했다.24일 금융감독원에 따르면 지난 20일 삼성SDS 전산센터 화재로 중단됐던 삼성카드 결제관련 서비스는 현재 대부분 정상화 됐다.다만 스마트폰을 이용해 30만원 이상을 결제하는 경우와 홈페이지나 앱카드를 이용한 서비스는 여전히 복구작업을 진행 중이다.금감원은 삼성카드가 고객 피해에 대해 합리적인 보상기준을 수립하고 상담기능을 강화해 고객불만을 최소화하도록 지도했다.이에 따라 화재사고로 인한 고객의 금전적인 피해는 전액 보상된다.예를 들어 홈페이지에서 현금서비스를 신청하지 못한 고객이 불가피하게 ATM·CD기를 활용함으로써 추가로 부담한 수수료 등 소액피해 등은 모두 보상받을 수 있다.또한 삼성카드를 사용하지 못해 삼성카드가 제공하는 할인이나 포인트 혜택 등을 못 받은 경우, 승인거절내역 등을 확인한 후 보상할 방침이다.사용내역 문자알림서비스를 이용하는 모든 고객에게는 1개월간 알림서비스가 무료로 제공된다.아울러 금감원은 이번 사고로 인해 삼성카드와 고객 간 분쟁이 발생할 경우 분쟁조정절차를 거쳐 원만히 해결될 수 있도록 지원할 예정이다.kjpark@newsis.com★ 뉴시스 뉴스, 이젠 네이버 뉴스 스탠드에서도 만나세요★ 손 안에서 보는 세상, 모바일 뉴시스<저작권자ⓒ 공감언론 뉴시스통신사. 무단전재-재배포 금지.>"
65,2014-04-24,"'세월호' 유병언 前 회장 측 ""책임통감, 전재산 100억원 내 놓겠다""",https://news.naver.com/main/read.nhn?mode=LSD&mid=shm&sid1=102&oid=022&aid=0002660486,세계일보,"세월호 선사인 청해진해운의 실질적 오너로 지목된 유병언(73) 전 세모그룹 회장 측은 ""전 재산은 100억원 정도이며 책임을 통감하고 모두 내놓을 생각이다""고 밝혔다.24일 유 전 회장 측 손병기 변호사는 '유 전 회장 일가가 수천억원대의 재산을 갖고 있다'는 언론보도에 대해 ""100억원 정도에 불과하다""면서 ""서울 염곡동의 자택 인근을 비롯한 전국 곳곳 부동산을 남의 명의로 숨겨놨다는 의혹은 사실과 다르다""고 주장했다.손 변호사는 ""유 전 회장이 세월호 침몰 사고에 대해 책임을 통감하고 있으며 피해가 얼마든 가진 재산을 전부 다 위로금을 지급하는 계획을 갖고 있다""고 했다.이어 ""공탁금을 내는 방안도 고려했으나 '돈으로 해결하려 한다'는 오해를 부를 수 있고 조사를 성실히 받는 게 우선이라고 생각해 보류했다""고 덧붙였다손 변호사는 횡령·배임 등과 관련해 제기된 의혹들에 대해 ""계열사 천해지가 지난해 조선사업 부문에서 적자를 봤지만 유 전 회장 작품을 비롯한 문화사업을 하면서 16억원 흑자를 냈다""며 깅하게 부인했다.즉 ""사진을 판매하는 문화사업으로 계열사 매출에 오히려 기여했다""는 것.청해진해운의 대주주인 천해지는 지난해 11월 유 전 회장의 사진작품 판매를 주로 하는 헤마토센트릭라이프연구소의 문화사업 부문을 분할합병했다.인수한 자산 159억7000여만원 가운데 126억원이 유 전 회장의 사진작품으로 추정되는 '상품'이어서 천해지가 작품 가치를 부풀려 사들여 유 전 회장을 부당지원했다는 의혹이 제기됐다.이에 대해 손 변호사는 지난해 작품 판매 등을 통해 18억원을 벌어들인 연구소의 문화사업 부문이 합병되면서 천해지는 조선업 부문의 적자 2억원을 만회했다고 설명했다.손 변호사는 ""연구소를 통해 주로 주위사람과 계열사에서 작품을 샀다""면서도 ""그 밖에 해외 콜렉터들에게도 작품이 판매됐다""고 말했다.그는 ""(유병언 전 회장이) 강압적으로 시킨 것이 아니라 각 계열사의 경영 판단으로 한 것이다""며 ""계열사가 유 회장에게 보고하거나 사전에 자문을 구했을 수는 있지만 이래라 저래라 간섭은 하지 않는다""고 말했다.손 변호사는 회사나 교회 자금을 빼돌려 비자금을 조성했다는 의혹과 관련해선 ""계열사와 고객에 대해 잘 알고 있기 때문에 자문료를 받은 적은 있다""면서도 ""비자금은 금시초문""이라고 반박했다.또 유 전 회장이 작품활동을 위해 회사 경영에서 완전히 손을 뗐다고 강조했다.손 변호사는 유 전 회장이 기독교복음침례회 종교시설인 경기 안성시 '금수원'의 작업실에서 대부분 시간을 보냈다고 전했다.박태훈 기자buckbak@segye.com▶오늘은?▶HOT포토▶지면보기ⓒ 세상을 보는 눈,세계일보 & Segye.com"
66,2014-04-24,"美 FDA ""미성년자에게 전자담배 못판다""",https://news.naver.com/main/read.nhn?mode=LSD&mid=shm&sid1=104&oid=096&aid=0000304509,SBS(text),미국 식품의약국 FDA가 처음으로 전자담배에 대한 규제에 나섰습니다.FDA는 현지시간으로 어제(23일) 18세 미만 미성년자에게 전자담배 판매를 금지하는 내용의 규제안을 제시했습니다.FDA의 조치는 수년간 정부 당국의 규제를 받지 않으면서 시장규모가 20억 달러에 달할 정도로 성장해온 전자담배의 남용을 더이상 방치하지 않겠다는 의지로 해석되고 있습니다.75일간의 공청회 기간을 거쳐 FDA 규제안이 확정되면 전자담배 제조업체는 미성년자에게 제품을 판매할 수 없습니다.또 무료 샘플 배포와 성인 전용이 아닌 장소에서의 자판기 판매도 금지됩니다.2년 내에 니코틴의 중독성을 경고하는 표지도 부착해야 합니다.그러나 온라인 판매나 TV 광고는 제한받지 않을 것으로 알려졌습니다.이 규정은 파이프 담배와 물담배에도 적용될 예정입니다.FDA는 지난 2009년 의회로부터 담배산업 감독권한을 부여받았으나 전자담배와 시가는 FDA의 관리 감독 항목에서 제외됐었습니다.유덕기 기자dkyu@sbs.co.kr☞새로운 인터렉티브 뉴스 [SBS 스마트리포트]☞[SBS기자들의 생생한 취재현장 뒷이야기 '취재파일']☞ SBS뉴스 공식 SNS [SBS8News 트위터] [페이스북]저작권자 SBS&SBS콘텐츠허브 무단복제-재배포 금지
67,2014-04-24,<세월호참사> 43억짜리 해양긴급전화 '122' 효용성↓,https://news.naver.com/main/read.nhn?mode=LSD&mid=shm&sid1=102&oid=001&aid=0006878434,연합뉴스,"(인천=연합뉴스) 특별취재팀 = 해양경찰청이 해양사고 긴급신고전화 '122'를 운영한 지 7년이 지났지만 여전히 낮은 인지도 탓에 효용성이 떨어진다는 지적을 받고 있다.24일 해경청에 따르면 해경은 해양사고 발생 때 신고자 위치를 신속하게 파악, 적절한 초동조치를 취하기 위해 2007년 7월 해양사고 긴급전화 122 서비스를 시작했다.122 개통에 따라 해경은 신고를 접수한 뒤 재난사고일 경우 이동통신사에 휴대전화 위치정보 확인을 의뢰, 곧바로 신고자의 조난 위치를 정확히 파악할 수 있게 됐다. 즉각적인 신고자 위치정보 확인은 기존에는 119만 가능했다.육상과는 달리 주변에 지형지물이 없는 바다에서 122 신고전화는 위력을 발휘할 것으로 기대됐다.해경은 '범죄신고는 112, 화재신고는 119, 해양사고는 122'라는 표어를 만들고 적극적인 홍보활동을 벌였다.그러나 도입한 지 7년이 지났어도 여전히 낮은 인지도 때문에 122 신고전화는 국민에게 외면받고 있다.이번 세월호 침몰 사건 때도 최초 신고자인 단원고 학생은 119를 먼저 찾았다.16일 오전 8시 52분 전남소방본부로 접수된 119신고는 목포해경 122상황실에 연결됐고 학생-소방-해경 간 3자 대화가 4분가량이나 이어지면서 아까운 시간이 허비됐다.이후 계속된 다른 승객들의 신고전화 10여 통도 모두 119에 접수됐을 뿐 122에 직접 접수된 승객의 신고 전화는 없는 것으로 알려졌다.122 운영에 대한 문제는 국정감사에서 매년 빠지지 않고 지적됐다.작년 해경청 국감에서는 최근 5년간 122 신고전화 20만7천건 중 유효 전화는 26%에 불과하고 나머지 59% 장난전화·오인·중복전화, 11%는 소방·경찰 등 타 기관으로 이첩된 신고였다는 점을 지적받았다.새정치민주연합 박민수 의원은 지난해 국감 당시 ""122 운용 사업비로 최근 5년간 43억원을 투입했지만 비용 대비 효과 측면에서 실효성이 있는지 의문""이라고 질타하기도 했다.inyon@yna.co.kr▶연합뉴스앱▶궁금한배틀Y▶화보▶포토무비<저작권자(c) 연합뉴스, 무단 전재-재배포 금지>"
68,2014-04-24,'물살 거세지기 전에…' 사상 최대 규모 수색 총력,https://news.naver.com/main/read.nhn?mode=LSD&mid=shm&sid1=102&oid=001&aid=0006878416,연합뉴스,"구조팀 현장 수색    (진도=연합뉴스) 특별취재팀 = 민관군 합동구조팀이 24일 오전 전남 진도군 병풍도 세월호 침몰 해상에서 수색 활동을 벌이고 있다.검찰 실소유주 일가 관계회사 자금 흐름 추적단원고 사고 후 첫 수업…임시분향소 수만명 조문 행렬(서울·진도=연합뉴스) 특별취재팀 = 세월호 참사가 발생한지 9일째인 24일 민·관·군 합동구조팀은 바다 위와 수중에서 사상 최대 규모의 수색 작업을 벌였다.물살이 평소보다 크게 약한 소조기가 이날로 끝남에 해군과 해군구조대, 소방 잠수요원, 민간 잠수사, 문화재청 해저발굴단 등 구조대원 726명이 동원됐고 함정 261척, 항공기 35대 등의 장비가 집중 투입됐다.합동구조팀은 물 속에 잠긴 선체 3~4층 선수와 선미 부분의 다인실을 집중 수색한 끝에 이날 12구의 시신을 추가로 수습했다. 이로써 오후 4시 현재 사망자수는 171명으로 늘어났다.구조팀이 집중 수색에 나선 4층 선미와 중앙 부분은 안산 단원고 학생 325명이 30여 개의 객실에 분산 수용됐던 곳이다.공기호스 문 민간잠수사     (진도=연합뉴스) 특별취재팀 = 공기공급호스를 문 민간잠수사(머구리)가 24일 오전 전남 진도군 병풍도 세월호 침몰 해상을 수색하기 위해 바다로 뛰어들고 있다.이날 오전 목포지원에서는 검·경합동수사본부(이하 수사본부)가 구속영장을 청구한 1·2등 기관사 각 1명, 조기수 2명 등 선박직원(고급 승무원) 4명에 대한 영장실질심사가 열렸다.이미 구속된 7명이외에 이들 4명에 대한 영장이 발부되면 구속된 승무원은 모두 11명으로 늘어난다.운항에 직·간접으로 관여하고도 승객들을 두고 탈출한 승무원은 모두 15명으로 나머지 4명은 입원 치료 중이다.수사본부는 압수수색으로 확보한 승무원과 승객들의 카카오톡 메시지와 사진 등을 토대로 사고 상황을 재구성하고 있다.수사본부는 선박 개조에서 점검·운항까지 모든 관리과정을 파악해 불법행위가 있었는지도 조사 중이다.급격한 변침, 선박 구조 변경, 선박의 평형유지 문제 등이 주요 규명대상이다.그러나 승객들을 구조하지 않고 먼저 탈출해 공분을 사고 있는 세월호 승무원 일부는 ""배를 끝까지 지키다가 침몰 직전 탈출했다"", ""구조에 애썼다""며 변명에 급급한 태도를 보였다.기관사 둘·조기수 둘 영장실질심사    (목포=연합뉴스) 특별취재팀 = '세월호' 침몰 사고와 관련해 유기치사와 수난구호법 위반 혐의로 구속영장이 청구된 기관사 손모(57)·이모(25·여)씨, 조기수 이모(55)·박모(58)씨 등 4명이 24일 오전 광주지방법원 목포지원에서 열린 영장실질심사를 받고자 법원에 들어서고 있다.이들에게는 구조가 필요한 사람을 유기해 숨지게 한 혐의로 유기치사죄가 적용됐다.세월호 실소유주 비리 의혹을 수사 중인 인천지검 세월호 선사 특별수사팀(팀장 김회종 2차장검사)은 이날 기독교복음침례회(일명 구원파)와 청해진해운 관계사 간 자금 흐름을 추적하는데 주력했다.검찰은 교회 헌금과 신도들의 사채가 유병언(73) 전 세모그룹 회장 일가와 측근들이 소유한 청해진해운 관계사들의 사업 자금으로 쓰였을 가능성을 두고 수사하고 있다.검찰은 전날 기독교복음침례회와 관련된 서울 용산 소재 한 종교단체 사무실을 압수수색해 확보한 종교단체 회계자료와 헌금 명부 등을 분석하는 것으로 알려졌다.이 종교단체는 유 전 회장 일가 소유의 한 관계사와 사무실을 함께 사용하고 있었다고 검찰 측은 밝혔다.기독교복음침례회는 그러나 이날 오후 기자회견에서 ""세월호 선장은 교인이 아닌 것으로 확인됐다""면서 검찰 수사 과정에서 제기된 의혹을 전면 부인했다.이와 별도로 부산지검은 선박 검사와 인증을 담당하는 사단법인 한국선급의 전현직 임직원이 회삿돈을 빼돌린 정황을 포착하고 이날 부산 강서구 한국선급 본사에 대해 전격 압수수색을 벌였다.답변하는 기독교복음침례회     (서울=연합뉴스) 안정원 기자 =  이용화 기독교복음침례회 안성교회 대표가 24일 오후 긴급 기자회견을 마치고 기자들의 질문에 답하고 있다.사고 발생 9일째인 이날 임시분향소가 마련된 경기도 안산올림픽기념관 실내체육관에는 이른 아침부터 조문행렬이 끊임없이 이어졌다.전날 분향소 개소 이후 이날 오후 조문객은 2만5천명을 넘어선 것으로 잠정 집계됐다.임시 휴교에 들어갔던 단원고는 이날 3학년 수업을 재개했다.안산 사랑의병원(2명)과 산재병원(1명), 온누리병원(1명), 한도병원(1명), 동안산병원(1명), 안산장례식장(1명), 안양장례식장(1명), 군자장례식장(1명) 등 모두 9곳에서 는 단원고 학생 13명의 장례식이 치러졌다.realism@yna.co.krhttp://blog.yonhapnews.co.kr/realism▶연합뉴스앱▶궁금한배틀Y▶화보▶포토무비<저작권자(c) 연합뉴스, 무단 전재-재배포 금지>"
69,2014-04-24,게임 셧다운제 합헌으로 여가부-게임업계 희비교차,https://news.naver.com/main/read.nhn?mode=LSD&mid=shm&sid1=105&oid=001&aid=0006878382,연합뉴스,"헌재, 심야시간 인터넷 게임 '강제 셧다운제' 합헌    (서울=연합뉴스) 이지은 기자 = 심야시간대에 16세 미만 청소년들의 '인터넷 게임' 접속을 막는 '셧다운제'에 대해 헌법재판소가 합헌 결정했다. 사진은 서울 종로구 한 PC방의 모습.(서울=연합뉴스) 권영전 기자 = 헌법재판소가 24일 심야시간 16세 미만 청소년의 인터넷 게임 접속을 막는 이른바 '강제적 셧다운제'(청소년 인터넷게임 건전이용제도)에 대해 합헌 결정을 내림에 따라 여성가족부와 게임업계의 희비가 엇갈렸다.여가부는 헌재 결정이 나온 직후 이를 환영하는 보도자료를 통해 ""최근 청소년의 인터넷게임과 스마트폰 과다 이용으로 인한 피해에 대해 국민적 우려가 심각하다""면서 ""(헌재 결정은) 이를 고려해 청소년의 건강한 성장과 보호를 지향하는 헌법 이념과 공공의 가치를 재차 확인한 것으로 사료된다""고 환영했다.여가부는 이어 부모 교육과 캠페인 등을 통해 셧다운제의 실질적 효과가 더욱 증대할 수 있도록 노력할 것이라고 강조했다.그러나 게임업체들의 모임인 한국인터넷디지털엔터테인먼트협회(K-IDEA, 옛 게임산업협회)는 이번 헌재 결정이 게임 관련 규제 개선 논의에 찬물을 붓는 결과가 될 것을 우려했다.서울종로구 한 PC방의 모습.K-IDEA는 이날 공식 입장을 통해 ""정부의 규제개혁과 셧다운제 규제 개선을 위한 논의가 진행되는 시점에서 이번 헌재 결정에 아쉬움을 많이 느낀다""며 ""이번 헌재 결정으로 게임산업이 너무 위축되지 않을까 우려스럽다""는 입장을 밝혔다.특히 게임업계는 최근 박근혜 대통령이 ""게임산업은 글로벌 경쟁력이 큰 산업이니 종합적으로 검토해서 합리적인 규제가 나오도록 노력해 달라""고 언급하는 등 규제 개혁을 위한 분위기가 조성된 상황에서 이번 결정이 나와 실망감을 감추지 못하고 있다.한 게임업계 관계자는 ""강제적 셧다운제는 학부모조차 자녀의 게임 시간을 자유롭게 설정하지 못하도록 하는 모순성이 있다""며 ""여가부도 강제적 셧다운제 시행 이후 심야시간 게임 이용자가 0.5%에서 0.2%로 불과 0.3%포인트 줄어드는 데 그쳤다고 발표하는 등 실효성도 없는 법""이라고 지적했다.실제 2012년 문화체육관광부 산하 게임물등급위원회가 청소년 게임 이용자 1천200명을 대상으로 조사한 결과에서도 조사 대상의 27.4%가 '게임물의 연령별 이용등급 구분이 유용하지 않다'고, 이 중 59.9%는 그 이유로 '부모의 주민등록번호로 인증을 받을 수 있기 때문'이라고 답한 바 있다.comma@yna.co.kr▶연합뉴스앱▶궁금한배틀Y▶화보▶포토무비<저작권자(c) 연합뉴스, 무단 전재-재배포 금지>"
70,2014-04-24,‘수학여행 안전대책 의무화법’ 국회 교문위 통과,https://news.naver.com/main/read.nhn?mode=LSD&mid=shm&sid1=100&oid=014&aid=0003147495,파이낸셜뉴스,"국회 교육문화체육관광위원회가 학생들의 단체 활동 시 안전대책 수립을 의무화하는 법안에을 심의·의결했다.24일 교문위는 전체 회의를 열어 수학여행이나 수련활동과 같은 체험 위주 교육을 할 경우 학교장이 안전대책을 마련하고, 위탁기관이 운영하는 프로그램은 '청소년활동진흥법'에 따른 인증된 프로그램인지를 확인토록 하는 내용의 '학교 안전사고 예방 및 보상법' 개정안을 통과시켰다.당초 이 개정안은 지난해 사설 해병대 캠프의 청소년 사망 사건으로 인해 제출된 것이다. 이에 따라 해병대 캠프 사고가 발생한 7월18일을 '학생안전의 날'(가칭)로 지정키로 했으나 이번 세월호 참사가 터지면서 날짜를 조정할 필요성이 제기돼 이날 통과된 법안을 추후 재개정하기로 했다.이어 교문위는 학자금 대출 이자를 7%에서 2.9%로 낮추고 대출이자에 단리(單利)를 적용하는 것을 골자로 하는 '취업후 학자금 상환특별법' 개정안에도 합의했다.또 학자금 대출을 받고 미납한 대출 원리금에 대한 지연배상금의 이자율 상한을 기존 20%에서 12%로 낮추는 '한국장학재단 설립법' 개정안도 처리했다.wonder@fnnews.com 정상희 기자※ 저작권자 ⓒ파이낸셜뉴스. 무단 전재-재배포 금지"
