,날짜,기사 제목,기사 링크,기사 출처,기사 내용
93,2018-03-21,"코스피, FOMC 눈치보기 '약보합'… 코스닥 890선 하회 ",https://news.naver.com/main/read.nhn?mode=LSD&mid=shm&sid1=101&oid=008&aid=0004026268,머니투데이,"[머니투데이 송선옥 기자] [[시황종합]외인, 코스피서 사흘째 '팔자'… 네이처셀 또 하한가 ]코스피 시장이 21일 FOMC(연방공개시장위원회) 경계감으로 약보합 마감했다. 미국 뉴욕증시 반등 소식에 오름세로 출발한 코스피는 보합권에서 내내 등락을 반복했다.코스닥은 상승 개장했으나 외국인 매도로 하락 전환해 890대 안착에 실패했다.◇외인 사흘째 ‘팔자’=코스피 지수는 전일대비 0.55포인트(0.02%) 내린 2484.97로 마감했다.코스피 시장에서는 외국인이 사흘째 ‘팔자’를 이어가며 685억원 순매도했다. 개인이 639억원 순매도인 반면 기관이 1307억원 순매수다.프로그램 매매는 차익거래 26억원 순매수, 비차익거래 205억원 순매수 등 전체 232억원 매수 우위다.지수선물 시장에서는 외국인이 1950계약 순매수다. 개인과 기관이 각각 888계약, 1155계약 순매도다.업종별로는 등락이 엇갈렸다. 철강금속 기계 운송장비 운수창고 은행 보험 등이 상승인 반면 섬유의복 비금속광물 의약품 전기전자 의료정밀 건설업 통신업 증권 등이 내렸다.시가총액 상위종목 중에서는 삼성전자가 외국인 매도로 0.27% 하락, 255만3000원으로 마감했다. SK하이닉스가 1.34% 내렸다.셀트리온이 3.41% 내려 31만1500원으로 장을 마쳤다.현대차가 수소차 넥소에 대한 긍정적인 평가로 1.31% 상승했다. 현대모비스도 1.28% 올랐다.LG화학은 폭스바겐 공급업체로 선정됐다는 소식에 0.86% 상승마감했다.POSCO 삼성생명 신한지주 등이 오른 반면 KB금융 NAVER 삼성물산 SK 등이 하락했다.삼양식품이 오너 일가의 경영비리 의혹과 검찰 조사 소식에 5.40% 내렸다. 서울북부지검 형사6부(부장검사 이동수)는 최근 김정수 삼양식품 사장과 전인장 회장을 피의자 신분으로 소환해 조사했다고 전일 밝혔다.파미셀이 29.13% 급등했다. 10거래일 연속 상승이다. 파미셀은 이 기간 2배 이상 급등한 상태다. 파미셀은 전일 벨기에 제약사 UCB 파마와 4억원 규모의 의약중간체 공급계약을 체결했다고 밝혔다.필룩스 평화산업 등 2개 종목이 상한가다. 328개 종목이 상승, 477개 종목이 하락했다.◇네이처셀 또 하한가=코스닥 지수는 전일대비 4.85포인트(0.54%) 하락한 885.55로 마감했다.코스닥 시장에서는 외국인이 532억원 순매도다. 개인과 기관이 각각 631억원, 123억원 순매수다.업종중에서는 인터넷 디지털컨텐츠 제약 종이목재 등이 올랐으나 IT종합 오락문화 통신서비스 방송서비스 소프트웨어 통신장비 IT부품 등이 하락했다. 네이처셀이 포함된 음식료담배가 10.96% 급락했다.시가총액 상위종목 중에서는 셀트리온헬스케어와 셀트리온제약이 각각 3.10%, 1.47% 밀렸다.신라젠이 3.46% 올랐으며 티슈진이 4.91% 상승했다. 바이로메드 스튜디오드래곤 휴젤 등이 상승마감했다. 전일 70만원을 돌파했던 메디톡스가 차익실현 매물로 3.79% 내린 68만2200원으로 장을 마쳤다.로엔 펄어비스 컴투스 코미팜 등이 하락이다.네이처셀이 식약처의 조인트스템 조건부 품목허가 반려 처분 여파로 하한가를 기록했다.메디포스트는 장중 신고가를 경신한 뒤 10.81% 올라 16만5000원으로 마감했다.에이치엘비가 영업이익 증가 분석에 2.06% 상승했다.삼아제약 와이오엠 등 2개 종목이 가격제한폭까지 올랐다. 네이처셀을 비롯해 KJ프리텍 씨그널엔터테인먼트 등 3개 종목이 하한가다. 상승, 하락 종목은 각각 428개, 748개다.한편 원/달러 환율은 서울 외국환 시장에서 전일대비 3.70원(0.35%) 오른 1072.30원을 기록했다. 코스피200 지수선물 6월물은 0.30포인트(0.09%) 오른 322.75로 마감했다.▶'현대家 며느리' 노현정, 단아한 실크 원피스 패션유학파, 마약 8억원 밀반입해 '비트코인' 받고 거래▶만화 보고 선물도 받고~송선옥 기자 oops@mt.co.kr<저작권자 ⓒ '돈이 보이는 리얼타임 뉴스' 머니투데이, 무단전재 및 재배포 금지>"
94,2018-03-21,"文, 5월 이후 '남북미 회담'도 구상…경제-평화 로드맵 박차",https://news.naver.com/main/read.nhn?mode=LSD&mid=shm&sid1=100&oid=008&aid=0004026257,머니투데이,"[머니투데이 최경민  기자] [[the300](종합)연속성 위해 비준도 준비…내일 北에 29일 고위급회담 제안]【서울=뉴시스】전진환 기자 = 문재인 대통령. 2018.03.20.    amin2@newsis.com  <저작권자ⓒ 공감언론 뉴시스통신사. 무단전재-재배포 금지.>문재인 대통령이 4월 남·북정상회담, 5월 북·미정상회담 이후 남·북·미정상회담을 언급했다. '경제'를 키워드로 한반도 평화체제를 반드시 구축하겠다는 구상이다. 정책의 연속성을 위해 남북정상회담 합의문의 국회 비준도 추진하라고 지시했다.문 대통령은 21일 청와대에서 진행된 남북정상회담준비위원회의 두 번째 전체회의에 참석해 ""남북정상회담에 이어서 열릴 북미정상회담은 회담 자체가 세계사적인 일이다. 장소에 따라서는 더욱 극적인 모습이 될 수도 있다""며 ""그리고 진전 상항에 따라서는 남·북·미 3국 정상회담으로 이어질 수 있을 것""이라고 밝혔다.이어 ""이번 회담들과 앞으로 이어질 회담들을 통해 우리는 한반도의 핵과 평화 문제를 완전히 끝내야 한다""며 ""남북이 함께 살든 따로 살든, 서로 간섭하지 않고 서로 피해주지 않고, 함께 번영하며 평화롭게 살 수 있게 만들어야 한다""고 강조했다.문 대통령은 ""남·북·미 정상 간의 합의를 통해 이루고자 하는 분명한 목표와 비전을 가지고 있다""며 한반도 비핵화, 항구적 평화체제와 함께 '남·북·미 간 경제협력'을 언급했다. 남북정상회담준비위가 이같은 목표까지 갖고 준비하라는 것이다.문 대통령은 ""한반도 평화 정착은 남북 사이에 합의 만으로 이뤄지는 게 아니다 미국의 보장이 있어야 한다""며 ""그러려면 북미관계가 정상화 되어야 한다. 더 나아가 북미 사이의 경제 협력까지 진전되어야 한다""고 당부했다.또 ""남북정상회담에서 합의한 내용을 제도화 해야 한다""며 ""남북정상회담 합의문에는 지난 두 차례의 남북정상회담에서 합의한 기본 사항을 다 담아서 국회 비준을 받도록 준비하길 바란다. 그래야 정치 상황이 바뀌더라도 합의 내용이 영속적으로 추진된다""고 말했다.2000년, 2007년 두 번의 남북정상회담 결과가 정권교체로 힘을 잃었던 것을 다시 반복해서는 안 된다는 뜻이다. 문 대통령은 ""남북정상회담의 합의 내용을 이행하자면 국가의 재정도 투입되는 만큼, 반드시 국회 동의를 얻을 필요가 있다""고 밝혔다.남북-북미 정상회담을 일회적 이벤트로 마무리하지 않고, 필요하면 남·북·미 3국이 만나는 것을 추진해서라도 대화기조를 끌고 가겠다는 의미다. 최종 목표는 비핵화 이후 경제적 협력을 통한 한반도 평화체제임을 분명히했다. 이 로드맵의 실현이 장기전이 될 수 있으므로 연속성을 담보할 수 있는 국회비준을 추진한다는 방침이다.청와대 관계자는 ""남북과 북미가 만난 후 결과가 순조로우면 3자가 모두 만나서 합의한 내용을 좀 더 분명히 하고, 실천적 약속을 완성하자는 취지다. 문 대통령이 처음으로 제안한 것""이라며 ""북미대화에서 성과가 있다고 해도, 선언적 의미가 될 가능성이 크다. 경제협력을 위해서는 그 단위에서 맞는 합의가 이뤄져야 한다""고 말했다.한편 다음날 청와대는 남북 고위급 대표단 회담을 오는 29일 판문점의 북측인 통일각에서 진행하자고 제안할 예정이다. 고위급 대표단은 조명균 통일부 장관을 수석대표로, 청와대와 국정원에서 1명씩 모두 3명이 나선다. 남북정상회담의 구체적인 날짜 등 일정과 의제를 북측과 논의할 것으로 보인다.▶'현대家 며느리' 노현정, 단아한 실크 원피스 패션유학파, 마약 8억원 밀반입해 '비트코인' 받고 거래▶만화 보고 선물도 받고~최경민  기자 brown@mt.co.kr<저작권자 ⓒ '돈이 보이는 리얼타임 뉴스' 머니투데이, 무단전재 및 재배포 금지>"
95,2018-03-21,"개인·외국인 동반 매도에…코스피, 소폭 하락 마감",https://news.naver.com/main/read.nhn?mode=LSD&mid=shm&sid1=101&oid=014&aid=0003986731,파이낸셜뉴스,"코스피지수가 개인과 외국인의 동반 매도에 따라 소폭 하락 마감했다.21일 코스피지수는 전 거래일보다 0.55포인트 떨어진 2484.97로 거래를 마쳤다. 이날 코스피지수는 전 거래일보다 2.70포인트 상승한 2488.22로 출발한 뒤 줄곧 보합권에 머물다 오후 3시께부터 떨어지기 시작해 끝내 하락 마감했다.지수 하락은 개인과 외국인이 이끌었다. 개인과 외국인은 각각 636억원, 687억원 순매도했다. 기관은 1307억원 사들였다.시가총액 상위 종목은 혼조세를 보였다. 삼성전자(-0.27%), SK하이닉스(-1.34%), 셀트리온(-3.41%), 삼성바이오로직스(-0.32%), KB금융(-0.94%), NAVER(-0.13%), 삼성물산(-0.37%)은 떨어졌다. 현대차(1.31%), POSCO(1.47%), LG화학(0.86%)은 올랐다.코스피의 대형주는 떨어진 가운데 중형주와 소형주는 상승했다. 업종별로는 운송장비(1.52%), 철강·금속(0.97%) 등은 올랐으나, 섬유·의복(-1.29%), 비금속광물(-1.03%) 등은 하락했다.한편 코스닥지수는 전 거래일보다 4.85포인트 떨어진 885.55로 장을 마감했다.ethica@fnnews.com 남건우 기자▶ 세상의 모든 골 때리는 이야기 'fn파스'▶ 속보이는 연예뉴스 fn스타※ 저작권자 ⓒ파이낸셜뉴스. 무단 전재-재배포 금지"
96,2018-03-21,"지방을 '정부'로, 경제는 '상생'으로…2차 文개헌안 키워드는 '균형'",https://news.naver.com/main/read.nhn?mode=LSD&mid=shm&sid1=100&oid=079&aid=0003081108,노컷뉴스,"균형발전, 상생, 불균형·양극화 해소"
97,2018-03-21,"이주열 ""가계부채 유념할 수준…추후 방향은 금리 인상""",https://news.naver.com/main/read.nhn?mode=LSD&mid=shm&sid1=101&oid=018&aid=0004061255,이데일리,"이주열 한국은행 총재 후보자 인사청문회이주열 한국은행 총재가 21일 오전 국회 기획재정위원회에서 열린 인사청문회에서 인사말을 하고 있다. 사진=연합뉴스[이데일리 김정남 김정현 기자] 이주열 한국은행 총재 후보자는 21일 “경기가 예상대로 간다면 방향은 기준금리 인상”이라고 밝혔다.이 후보자는 이날 국회 기획재정위원회에서 열린 인사청문회에서 ‘현재 추세라면 인상 쪽으로 갈 수밖에 없지 않느냐’는 심재철 자유한국당 의원의 질문에 “견실한 성장세가 회복된다면 현재 완화 기조를 줄여나갈 것”이라며 이렇게 말했다.이 후보자는 ‘미국의 기준금리 인상이 예상되는데 한은도 준비해야 하는 것 아니냐’는 질문에는 “미국의 인상이 한은 정책 결정에 중요한 고려 요인이 되고 있다”고 말했다.이 후보자는 가계부채 급증 문제에 대해서는 “철저히 관리할 필요가 있다”며 “유념할 수준까지 와 있다”고 분석했다.그는 ‘통화정책 담당자로서 (기준금리를 5차례나 인하해서) 잘못했다는 점검의 계기는 안 되나’는 지적에는 “가계부채에 대한 비판을 잘 알고 있다”고 말했다.그는 다만 “당시 상황에 비춰봤을 때 통화 완화 기조, 기준금리 인하가 불가피했다”며 “그래서 가계부채가 늘어날 수밖에 없다는 것을 이해한다”고 덧붙였다.김정남 (jungkim@edaily.co.kr)▶ 꿀잼 공짜 웹툰... 이데일리 '웹툰'~♥▶ 네이버 메인에서 ‘이데일리’ 구독하기▶ '이데일리' 페이스북 친구맺기＜ⓒ종합 경제정보 미디어 이데일리 - 무단전재 & 재배포 금지＞"
98,2018-03-21,'돈봉투 만찬 무죄' 이영렬에 2심서 벌금 500만원 구형,https://news.naver.com/main/read.nhn?mode=LSD&mid=shm&sid1=102&oid=421&aid=0003270789,뉴스1,"檢 ""청탁금지법 예외사유 해당하지 않아""李 ""수고비는 관례…격려할 이유도 있어""이영렬 전 서울중앙지검장  © News1 임세영 기자(서울=뉴스1) 문창석 기자 = '돈봉투 만찬' 사건에 연루돼 재판에 넘겨졌지만 1심에서 무죄가 선고된 이영렬 전 서울중앙지검장(60·사법연수원 18기)에게 검찰이 벌금형을 구형했다. 이 전 지검장은 하급자에 대한 상급자의 격려금이었다며 무죄를 강조했다.서울고법 형사9부(부장판사 김우수) 심리로 21일 열린 공판에서 검찰 측은 ""이 전 지검장에게 무죄를 선고한 원심 판결은 사실을 오인하고 법리를 오해했다""며 이를 파기하고 원심에서 구형한 벌금 500만원을 선고해달라고 밝혔다.검찰은 ""이 전 지검장이 제공한 식사비와 격려비는 구분하는 게 아니라 함께 판단돼야 한다""며 ""동일한 목적으로 같은 장소에서 제공됐기에 일체로 봐야한다""고 주장했다.청탁금지법은 제공한 액수가 100만원을 초과하면 형사처벌 대상에 해당한다. 하지만 1심은 이 전 지검장이 제공한 격려비(100만원)와 1인당 식사비(9만5000원)의 자금 원천과 예산 지침상의 적용범위가 다르다고 보고, 총액이 100만원을 초과하지 않는다고 판단한 바 있다.검찰은 또 ""검찰과 법무부는 별개의 공공기관이라 이 전 지검장은 당시 식사자리에 있던 법무부 과장 2명의 상급자에 해당하지 않는다""며 ""하지만 원심은 하급자에 대한 상급자의 위로 목적으로 식사가 제공됐으니 청탁금지법의 예외 사유에 해당한다고 본 잘못이 있다""고 강조했다.이에 대해 이 전 지검장은 ""당시 안태근 법무부 검찰국장이 검찰 수사팀 관계자에게 비용 보전 명목으로 70만원을 주기도 했다""며 ""큰 수사의 전후 무렵이나 많이 수고했을 경우 해당 팀에 수사비 보전 명목으로 50만~300만원을 지급하는 경우는 종종 있다""고 설명했다.이어 ""당시 법무부는 특별수사본부의 인원 추천과 구성, 파견 등에도 도움을 줬고 국회 대정부 질문과 관련해서도 많은 고생을 했다""며 ""특별히 격려할 이유가 있다고 봤다""고 강조했다.재판부는 이날 변론을 종결하고 4월20일 오전 10시 이 전 지검장에 대해 선고하겠다고 밝혔다.이 전 지검장은 '최순실 게이트' 수사 종료 나흘만인 지난해 4월21일 서울 서초동의 한 식당에서 저녁을 함께한 법무부 과장 2명에게 각각 100만원씩을 건네고 1인당 9만5000원의 식사비를 지불한 혐의(청탁금지법 위반)로 재판에 넘겨졌다.1심은 이 전 지검장이 제공한 만찬을 상급 공직자가 하급 공직자에게 격려·위로 등의 목적으로 제공하는 금품으로 판단하고 그에게 무죄를 선고했다.themoon@news1.kr▶ [뉴스1] 채널설정하기▶ 제보하기▶ [페이스북] 바로가기![© 뉴스1코리아(news1.kr), 무단 전재 및 재배포 금지]"
99,2018-03-21,틴 초 미얀마 대통령 사임…건강때문일수도,https://news.naver.com/main/read.nhn?mode=LSD&mid=shm&sid1=104&oid=421&aid=0003270877,뉴스1,"사의를 밝힌 틴 토 미얀마 대통령(왼쪽)과 사실상의 국가 수반이랄 수 있는 아웅산 수지 여사(오른쪽). © AFP=뉴스1(서울=뉴스1) 김윤경 기자 = 틴 초(U.Ttin Kyaw) 미얀마 대통령이 21일(현지시간) 사임한다고 공식 페이스북 페이지를 통해 밝혔다.1962년 이후 최초의 민간인 대통령으로 지난 2016년 3월 취임했던 틴 초 대통령은 ""단지 현재 직무에서 벗어나 휴식을 취하고 싶다""고만 했을 뿐 더 이상의 구체적인 사의 배경을 밝히지 않았다. 만 2년을 채우지 못하고 물러나게 됐다.파이낸셜타임스(FT)는 최근 틴 초 대통령이 최근 여러 차례 치료를 위해 해외로 나갔고 이 때문에 건강이 좋지 않다는 관측이 나오고 있다고 전했다.미얀마 헌법에 따라 부통령이 임무를 대신하게 되며 의회가 후임자를 뽑는다. 틴 초 대통령 측은 ""(업무일 기준) 7일 이내에 선출될 것""이라고 밝혔다.미얀마에서 대통령은 국가 수반이지만, 중대한 권력은 국정 고문과 외무장관 직책을 맡고 있는 앙웅산 수지 여사에게 있다.틴 초 대통령은 그동안 수지 여사에서 전적으로 충성스러운 모습을 보여 왔다. 특히 최근 국제사회에서 수지 여사가 로힝야족 사태를 방관하고 있는데 대해 온갖 비난이 쏟아지고 있는 가운데에서도 그의 편을 들어 왔다.AFP통신에 따르면 시인의 아들인 틴 초는 1971~1972년 런던대(University College London:UCL)에서 컴퓨터 공학을 전공했으며 대학 교수를 지낸 이후 1970년대 후반~1980년대 정부 내 재무, 국가계획, 외교 등의 분야에서 경력을 쌓았다. 수지 여사의 자선단체 운영을 돕기도 했다.s914@▶ [뉴스1] 채널설정하기▶ 제보하기▶ [페이스북] 바로가기![© 뉴스1코리아(news1.kr), 무단 전재 및 재배포 금지]"
100,2018-03-21,"틴 초 미얀마 대통령, 취임 2년만 사임…""쉬고싶다""",https://news.naver.com/main/read.nhn?mode=LSD&mid=shm&sid1=104&oid=421&aid=0003270502,뉴스1,"대통령실 공식 페이스북 통해 21일 사임 발표틴 초 미얀마 대통령. <자료사진> © AFP=뉴스1(서울=뉴스1) 박승희 기자 = 아웅산 수지 여사의 '오른팔'이자 미얀마 첫 문민 대통령 틴 초(71)가 21일 대통령에 취임한 지 2년만에 사임했다.AFP통신에 따르면 대통령실은 이날 공식 페이스북 계정을 통해 ""틴 초 대통령이 2018년 3월21일 사임했다""고 발표했다. 틴 초 대통령은 ""쉬고 싶다""며 사임 의사를 밝힌 것으로 알려졌다.후임 지도자는 휴일을 제외하고 7일 이내로 선출될 것으로 알려졌다.미얀마 민주화의 상징인 수지 여사의 최측근인 틴 초는 지난 2016년 대통령으로 선출됐다. 군부가 정권을 잡았던 1962년 이후 첫 문민 대통령이다.수지 여사는 외국인 배우자나 자식을 둔 사람은 대통령 후보가 되지 못하도록 규정한 군부 헌법에 따라 대통령이 되지 못했지만 자신을 오랫동안 보좌했던 측근 틴 초를 대통령으로 세워 막후 실권자로 국정을 주도했다는 평을 받는다.seunghee@▶ [뉴스1] 채널설정하기▶ 제보하기▶ [페이스북] 바로가기![© 뉴스1코리아(news1.kr), 무단 전재 및 재배포 금지]"
101,2018-03-21,"여야, 개헌 갈등 지속…'개헌안 국회 협의체' 구성 이견",https://news.naver.com/main/read.nhn?mode=LSD&mid=shm&sid1=100&oid=001&aid=0009972040,연합뉴스,"여야, 대통령의 정부 개헌안 발의에 이견을 보여(CG)[연합뉴스TV 제공]민주 ""모든 정당 포함"", 한국 ""여당 뺀 야4당 협의체 제안""바른미래 ""여야대표 모임 제안"", 평화-정의 ""5당이 논의해야""(서울=연합뉴스) 김동호 기자 = 여야는 21일 문재인 대통령의 정부 개헌안 발의를 앞두고 국회 내 개헌안 합의를 도출하기 위한 협의체 구성 방안을 놓고 여전히 이견을 보였다.자유한국당이 이날 청와대 주도 개헌안에 반대하는 야4당이 공동대응에 나설 것을 제안하고 나섰지만 더불어민주당과 다른 야당은 여야 5당이 모두 논의에 참여해야 한다고 맞섰다.여당인 민주당과 제1야당인 한국당이 국회의 개헌 논의를 주도하기 위해 기싸움을 벌이는 형국인 셈이다.일단 민주당은 그동안 교섭단체 원내대표와 헌정특위 간사로 구성된 '2+2+2' 협의체 가동을 주장해왔지만, 민주평화당과 정의당이 공동교섭단체 구성을 마치면 이들도 함께 참여하는 개헌 테이블을 만들어야 한다는 입장이다.우원식 원내대표는 전날 원내대책회의에서 ""평화당과 정의당의 공동교섭단체 구성이 예정된 만큼 오늘부터라도 당장 여야 원내대표와 헌정특위 간사가 함께 하는 '국민개헌 8인 협의체'를 가동시킬 것을 촉구한다""고 밝혔다.우원식 ""개헌투표 참여하면 제명..공개처형 연상..""(서울=연합뉴스) 백승렬 기자 = 더불어민주당 우원식 원내대표가 21일 국회에서 열린 최고위원회의에서 ""홍준표 대표가 개헌투표 참여하면 제명한다고 한 것은 공산당식 공개처형을 연상하게 한다""고 주장하고 있다.     srbaek@yna.co.kr이에 대해 원내 핵심관계자는 이날 연합뉴스와의 통화에서 ""한국당이 협의 주체를 교섭단체로 한정하자고 주장해 먼저 '2+2+2'를 얘기하긴 했지만, 평화당과 정의당도 논의에서 배제할 이유는 없다""고 말했다.반면 한국당은 '분권형 대통령제' 취지에 공감하는 야4당이 문 대통령의 정부 개헌안 발의에 맞서 공동전선을 구축해야 한다는 입장이다.김성태 원내대표는 이날 중진·상임위원장 연석회의에서 ""한국당의 개헌에 대한 기본 입장에 대해 다른 야당이 동조할 수 있다는 입장을 보인 만큼 '야4당 개헌정책 협의체'를 만들어 '문재인 관제개헌'에 공동 대응하자""고 제안했다.한국당은 물론 바른미래당과 평화당, 정의당이 모두 국회 총리 선출제 내지 추천제를 통해 제왕적 대통령제를 종식해야 한다는 점에서 인식을 같이하는 만큼 이를 고리로 야권 공조를 형성해 여권의 일방적 개헌 드라이브에 제동을 걸겠다는 구상이다.그러나 정작 다른 야당에서는 민주당을 협의체에서 제외하는 방안에 부정적인 반응을 보였다.발언하는 김성태 원내대표(서울=연합뉴스) 김현태 기자 = 자유한국당 김성태 원내대표가 21일 오전 국회에서 열린 원내전략 수립을 위한 중진의원-상임ㆍ특위위원장 연석회의에서 발언하고 있다.mtkht@yna.co.kr바른미래당 박주선 공동대표는 최고위원·중진의원 연석회의에서 ""개헌안 마련을 위한 여야대표 모임을 제안한다""고 밝혔다.박 공동대표는 ""여야대표가 직접 만나 각 당의 입장을 절충하면서 개헌안을 빨리 합의해야 하고, 언제 처리할지를 국민 앞에 확실하게 약속하는 절차를 만들어야 한다""며 ""선거구제 개편까지 포함해 각 당이 허심탄회하게 논의하자""고 요구했다.평화당 장병완 원내대표도 국회에서 기자들과 만나 ""개헌안은 발의가 목표가 아니고 통과시키는 것이 목표인데 현실적으로는 한국당이 빠져도 부결되고 민주당이 빠져도 부결된다""고 지적했다.그러면서 ""한국당의 제안처럼 4당 중심이면 민주당도 반대할 수밖에 없다""면서 ""이제라도 각 당의 공통 사안을 최대로 논의해 6월 지방선거에서 (개헌 동시투표를) 실시할 수 있도록 5당 협의체에서 진지하게 논의하는 것이 정답""이라고 말했다.정의당 최석 대변인은 통화에서 ""민주당을 빼고 개헌을 논의하자는 한국당의 제안은 이해되지 않는다""며 ""청와대는 청와대고, 국회에서는 5당이 모두 모여 얘기해야 한다""고 주장했다.dk@yna.co.kr▶연합뉴스 채널 구독 500분께 스타벅스 커피 쏩니다▶기사제보 및 문의▶내 생활에 흥이나는 최신 트렌드"
