,날짜,기사 제목,기사 링크,기사 출처,기사 내용
135,2018-03-21,양회 끝난 중국…후속 지방인사에도 '시진핑 측근' 전진배치,https://news.naver.com/main/read.nhn?mode=LSD&mid=shm&sid1=104&oid=001&aid=0009971469,연합뉴스,"'충성서약' 펑칭화·천이신 등 쓰촨성·광시자치구서기 예정(상하이=연합뉴스) 정주호 특파원 = 중국 양회(兩會·전국인민대표대회와 전국인민정치협상회의) 폐막과 함께 이어진 후속 인사에서 시진핑(習近平) 친위세력의 전진 배치가 시작됐다.홍콩 성도(星島)일보는 중국 내부소식통을 인용해 펑칭화(彭淸華·61) 광시(廣西)장족자치구 서기가 쓰촨(四川)성 서기로 내정돼 금명간 이동할 예정이라고 21일 보도했다.펑 서기의 이동은 왕둥밍(王東明) 쓰촨성 서기가 이번 양회에서 전인대 부위원장으로 옮긴데 따른 것이다. 서부 내륙에서 가장 크고 일대일로(一帶一路:육상·해상 실크로드) 교차점으로 중시되는 지역으로 이동은 사실상 승진 인사라고 할 수 있다.특히 펑 서기가 현 최고지도부와 깊은 인연을 갖고 일찌감치 시 주석 충성을 서약했던 인물이라는 점에서 주목을 받는다.펑 서기는 중앙조직부장을 지낸 자오러지(趙樂際) 중앙기율검사위원회 서기의 베이징(北京)대 철학과의 2년 후배로 졸업후 중앙조직부에서 20년을 일했다. 이 기간 1980년대 중앙조직부장을 지낸 원로 쑹핑(宋平·101)의 비서를 지냈는데 당시 쑹핑은 시 주석의 부친 시중쉰(習仲勳)과 깊은 친분으로 교류가 잦았다.2003년 홍콩 중앙연락판공실로 옮겨 2012년까지 부주임과 주임을 지낸 다음 광시자치구 서기로 활동하면서 2014년 다른 성 서기들와 함께 '시진핑 핵심'을 확립해야 한다는 연명 제안을 올렸다.2016년 10월 18기 6중전회에서 '시진핑 동지를 핵심으로 한 당 중앙'이 확정되기 9개월전 ""시진핑 핵심을 굳건히 옹위해야 한다""는 주장을 펴기도 했다.펑칭화의 현재 광시자치구 서기 자리에는 루신서(鹿心社) 장시(江西)성 서기가 수평 이동해오거나 천이신(陳一新·58) 후베이(湖北)성 우한(武漢)시 서기가 승진해 오는 방안이 유력한 것으로 알려졌다.천이신 서기 역시 시진핑(習近平) 주석의 친위세력인 시자쥔(習家軍)의 일원이다. 시 주석이 저장성 서기를 지내는 동안 천 서기는 저장성 당위원회 부비서장과 정책연구실 주임을 맡고 있었으며 이후 진화(金華)시, 원저우(溫州)시 서기와 중앙심화개혁영도소조 판공실 전임부주임을 거쳤다.펑 서기 인사 외에도 셰푸잔(謝伏瞻) 허난(河南)성 서기가 전국인민정치협상회의(정협·政協) 상무위원, 루하오(陸昊) 헤이룽장(黑龍江)성장이 자연자원부 부장으로 이동함에 따라 연쇄 후속인사가 이어질 전망이다.펑칭화 광시자치구 서기［바이두 캡처］jooho@yna.co.kr▶연합뉴스 채널 구독 500분께 스타벅스 커피 쏩니다▶기사제보 및 문의▶내 생활에 흥이나는 최신 트렌드"
136,2018-03-21,개헌안에 '토지공개념' 담기나 '촉각'…부동산투기과세 힘 실리나,https://news.naver.com/main/read.nhn?mode=LSD&mid=shm&sid1=100&oid=421&aid=0003269379,뉴스1,"택지소유상한제 등 부활 가능성…보유세 강화도 탄력조국 청와대 민정수석이 20일 서울 청와대 춘추관에서 김형연 법무비서관, 진성준 정무기획비서관과 함께 대통령 개헌안 중 헌법 전문과 기본권 부분의 내용과 조문 배경 등을 발표 하고 있다. 2018.3.20/뉴스1 © News1 송원영 기자(세종=뉴스1) 김희준 기자 = 정부가 26일 발의할 개헌안에 토지공개념이 포함될 것으로 알려지면서 관심이 모아지고 있다. 토지공개념이 포함될 경우 부동산 투기를 막기 위한 과세도 강화될 것으로 예상된다. 또한 택지소유상한제가 부활하거나 보유세 강화도 한층 탄력을 받을 것으로 전망된다.토지공개념이란 공공 이익을 위해 토지 소유와 처분을 국가가 제한할 수 있도록 하는 것이다. 토지가 공공재라는 생각에 바탕을 두고 있으며 그 동안 독점적인 토지소유가 유발하는 투기현상을 막기 위한 대안으로 제시됐다.21일 정부 관계자 등에 따르면 청와대는 이날 경제조항과 분권 분야 개헌안을 설명할 예정이다. 정부 안팎에서는 '토지공개념'이 헌법 개정안에 보다 구체화될 것으로 전망하고 있다.앞서 국민헌법자문특별위원회는 문재인 대통령에게 개헌 자문안 등을 통해 헌법에 명시된 토지공개념 조항을 구체화해 국가가 토지 재산권에 대한 의무를 부과하거나, 권리의 제한을 부분적으로 가능하게 하는 조항을 마련해야 한다고 제안한 것으로 알려졌다.실제 현행 헌법 제122조는 '국가는 토지소유권에 대해 법률이 정하는 바에 따라 제한과 의무를 부과할 수 있다'고 규정하고 있다. 뿐만 아니라 민법 제2조는 '개인의 소유권리라도 권리는 남용하지 못한다'고 규정하고 있으며 동법 제212조에서는 '개인의 소유권이라도 정당한 이익이 있는 범위 내에서만 행사하여야 한다'고 규정하고 있다.이에 따라 일각에선 이번 개헌안에 부동산 투기 등에 의한 불로소득에 대한 과세 강화를 골자로 한 징벌적인 규제 개념이 포함될 가능성이 크다고 보고 있다. 이 경우 1987년 민주화 이후 도입된 토지공개념 3법 가운데 각각 위헌과 헌법불합치 판결을 받은 택지소유상한제와 토지초과이득세법도 부활할 가능성이 높아진다. 위헌 시비에 직면한 개발이익환수법에도 힘이 실릴 공산이 크다.이를 위해 개헌안에선 토지공개념을 바탕으로 사회·경제적 정의를 위해 정부 과세를 명문화하는 조항이 들어갈 것이란 전망도 나온다.또 개헌안을 통해 토지공개념이 구체화될 경우 보유세 강화 등을 담은 올해 세제 개편 논의도 탄력을 받게 될 것이라고 보고 있다. 재건축, 재개발 등 부동산 과열과 투기수요 증가 가능성이 높은 사업의 경우 공공성 확보의 비중도 커질 것이란 전망이다.h9913@▶ [뉴스1] 채널설정하기▶ 제보하기▶ [페이스북] 바로가기![© 뉴스1코리아(news1.kr), 무단 전재 및 재배포 금지]"
137,2018-03-21,"與 ""洪 개헌 투표 제명처리,공산당식 공개처형·파시스트적 협박""",https://news.naver.com/main/read.nhn?mode=LSD&mid=shm&sid1=100&oid=008&aid=0004025975,머니투데이,"[머니투데이 이재원  기자] [[the300] 홍준표 ""개헌투표 참여 의원에 제명처리"" 발언에 맹폭]추미애 더불어민주당 대표와 우원식 원내대표가 21일 서울 여의도 국회 본청에서 열린 최고위원회의에서 대화 나누고 있다. /사진=뉴스1더불어민주당은 홍준표 자유한국당 대표가 개헌안 국회 의결에 참여하는 의원에 대해 '제명처리' 하기로 한 것에 대해 ""제왕적 대표""라고 비판했다.추미애 민주당 대표는 21일 국회에서 열린 최고위원회의에서 ""홍대표는 표결에 참여하는 의원을 제명하겠다는 협박도 서슴치 않고 있는 역대 듣도보도 못한 제왕적 대표""라며 이같이 말했다.그는 ""제1야당의 거대 의석을 방패 삼아 의회 민주주의를 정면으로 부정하는 파시스트적인 협박""이라며 ""야당이 자신들의 존재감을 위해 개헌 보이콧에만 열중한다면 민심과 더욱 멀어진다는 점을 깊이 새겨야 할 것""이라고 말했다.추 대표는 ""어제 정부 개헌안의 내용이 1차로 공개됐다""며 ""국민들이 던진 '이게 나라냐', '국가란 무엇인가'라는 질문에 우린 개헌으로 답해야 할 의무가 있다""고도 했다.우원식 원내대표도 ""홍 대표의 선언은 공산당식 공개처형을 연상케 한다""며 ""지선에 불리하다고 개헌논의 자체를 거부하고 질질 끌고 있는 것은 민심을 등지는 처사""라고 지적했다.그러면서 ""한국당 등 야당은 국회에 주어진 많은 시간동안 국회 개헌안 발의를 하지 못한 것을 반성부터 해야 한다""며 ""국회가 제안하지 못한 발의안을 대통령이 발의한다고 비난하는 것은 시험일자 잡아두고 공부하지 않는 수험생과 마찬가지""라고 했다.또 우 원내대표는 ""앞으로 5일이라는 시간이 있는 만큼 국회의 시간표는 남아있다""며 ""오늘 당장이라도 개헌 협상을 하자는 제안을 하기 위해 김성태 한국당 원내대표 등에 전화했지만 만나지 못해 안타깝다""고 말했다.▶한 은행서 주담대와 신용대출 동시에 받기 어려워진다'춘분에 때 아닌 눈'…대구·부산 강설에 교통통제▶만화 보고 선물도 받고~이재원  기자 jaygoo@mt.co.kr<저작권자 ⓒ '돈이 보이는 리얼타임 뉴스' 머니투데이, 무단전재 및 재배포 금지>"
138,2018-03-21,"문 대통령 ""한-베트남 '전략적 협력동반자 관계'서 격상 희망""",https://news.naver.com/main/read.nhn?mode=LSD&mid=shm&sid1=100&oid=001&aid=0009971392,연합뉴스,"문재인 대통령, 베트남 국빈방문ㆍ쩐 다이 꽝 주석과 정상회담 (PG)[제작 최자윤] 사진 합성, 일러스트""한-베트남 관계 통해 '한-아세안 미래공동체' 청사진 보여줄 것""한-베트남 경제협력의 두 가지 키워드는 '상생협력'과 '미래성장협력'""한국 내 베트남계 다문화 가정은 양국민을 '사돈에서 한 가족'으로 연결해""""박항서 감독이 이끈 축구팀 준우승 축하…'한-베트남 매직' 보여줘""(서울=연합뉴스) 김승욱 기자 = 문재인 대통령은 21일 베트남 국빈방문과 관련해 ""베트남의 지도자들과 정상 차원의 우의와 신뢰를 더욱 다지고자 하며, 이를 기반으로 양국 간 '전략적 협력 동반자 관계'를 한 단계 더 높은 수준으로 격상시켜 나가기를 희망한다""고 말했다.문 대통령은 이날 베트남 인민일보와의 인터뷰에서 이같이 말하고 ""양국이 전 세계적으로 화두가 되는 4차 산업혁명에 효율적으로 대응하면서 미래성장 동력을 함께 창출함으로써, 상호 보완적이고 미래지향적인 협력 관계를 구축하기 위한 기반을 탄탄하게 닦기를 바란다""고 밝혔다.아울러 ""이번 방문을 통해 베트남 기업인과 한-베트남 다문화 가정들, 그리고 일반 시민들과도 만나 양 국민 간의 공감대를 확산하고 우정을 더욱 돈독하게 만들고자 한다""고 덧붙였다.문 대통령은 ""지난해 11월 한-아세안 정상회의 계기에 아세안 국가들과의 협력을 포괄적으로 격상시켜 나가겠다는 의지를 표명했다""며 ""모든 측면에서 모범적으로 발전 중인 한-베트남 양국 관계를 통해 '한-아세안 미래공동체'의 미래 발전을 위한 청사진을 보여주고자 한다""고 밝혔다.그러면서 문 대통령은 한-베트남 경제협력의 두 가지 키워드로 '상생 협력'과 '미래성장 협력'을 제시했다.문 대통령은 ""국가 간 경제협력은 그 혜택을 양쪽이 함께 누려야 지속 가능하다고 확신한다""며 ""한국과 베트남 간의 경제협력도 양국의 상생번영에 기여하는 호혜적인 방식으로 발전시켜 나가고자 한다""고 강조했다.그러면서 ""상호호혜적인 산업역량 강화 차원에서 추진코자 하는 소재부품·자동차 분야 산업협력, 베트남의 농수산물 수출역량 강화를 위한 다양한 협력사업을 통해 양국 간 무역 불균형 문제도 해소해 나가고자 한다""고 덧붙였다.미래성장 협력과 관련해서는 ""4차 산업혁명 시대에 함께 대응하고, 미래 성장 동력을 창출하기 위한 공동 노력을 기울여 나가는 것이 중요하다""며 ""스마트시티, 정보 통신 기술 등 신산업 분야에서의 협력을 통해 양국 간 경제협력이 미래 지향적인 방향으로 발전해 나갈 수 있는 기반이 강화되길 기대한다""고 말했다.이어 ""이번 방문 기간 '한-베 과학기술연구원'(VKIST) 착공식에 참석할 예정인데, VKIST는 상생협력과 미래성장 협력 두 가지 키워드를 모두 담고 있는 모범 사례""라고 강조했다.문 대통령은 ""이번 VKIST 착공이 훗날 베트남이 '산업화한 현대국가'로 발전해 나가는 데 중요한 획을 긋는 역사적인 계기로 기억되기를 바란다""며 ""대한민국은 베트남이 '2020년까지 산업화한 현대국가'를 구축하는 데 기여할 수 있는 호혜적인 협력 증진 방안을 지속해서 모색해 나갈 것""이라고 덧붙였다.문 대통령은 양국 간 인적 교류와 관련해 ""무엇보다 한국 내 약 7만의 베트남계 다문화 가정은 혈연을 통해 양 국민을 '사돈에서 한 가족으로' 연결하고 있다""며 ""나아가 미래 양국 관계 발전을 이끌어갈 소중한 자산""이라고 강조했다.그러면서 ""미래 세대의 주역인 양국의 젊은 세대가 한류 문화와 베트남 문화를 주고받으며 서로에 대한 이해를 높이고, 공감대를 키우며, 우정을 두텁게 하는 것이 정말 흐뭇하고 든든하다""고 말했다.또 ""한국 내에서 공부하는 베트남 유학생의 수와 이들이 공부하는 분야가 날로 늘어나고 있는 것을 흐뭇하게 생각한다""며 ""이들이 앞으로 양국 간 미래지향적 동반자 관계 발전의 버팀목으로 커 나갈 수 있도록 관심을 가지고 필요한 지원을 계속해 나가겠다""고 덧붙였다.문 대통령은 베트남의 교육열과 관련해 ""후대의 교육에 큰 관심을 가지고 아낌없이 투자하는 교육열은 한국과 베트남 양국이 전통적으로 유지하고 발전시켜온 미덕""이라며 ""오늘날 양국의 공동 번영과 발전을 견인하며 양 국민을 더욱 가깝게 만드는 가교 역할도 한다""고 평가했다.아울러, 문 대통령은 ""지난 1월 말 베트남 U-23(23세 이하) 축구대표팀이 박항서 감독의 지도 아래 아시아축구연맹 챔피언십에서 준우승이라는 쾌거를 거둔 것을 진심으로 축하한다""고 말했다.문 대통령은 ""스포츠를 통해 '베트남과 한국이 힘을 합치면 무엇이든 이룰 수 있다'는 '한-베트남 매직' 현상을 상징적으로 보여주어 기쁘게 생각한다""며 ""스포츠를 매개로 베트남과 한국이 하나 되는 또 한 번의 '한-베트남 매직'이 실현되도록, 우리 정부는 양국 간 스포츠 협력을 지속 확대해 나갈 예정""이라고 밝혔다.이어 ""베트남 국민께서도 스포츠를 통해 나날이 돈독해져 가는 한국과 베트남 양국 간의 우정을 듬뿍 느끼기 바란다""고 덧붙였다.문 대통령은 22일부터 24일까지 베트남을 국빈방문할 예정이다. 베트남 방문 기간 문 대통령은 쩐 다이 꽝 베트남 국가주석과 정상회담을 개최하고, '베트남의 히딩크'로 불리는 박항서 감독을 만날 예정이다.또 숙소 인근 서민식당에서 하노이 시민들과 아침 식사를 함께하며 양국 국민 간 정서적 유대감을 강화하는 데도 힘쓸 예정이다.kind3@yna.co.kr▶연합뉴스 채널 구독 500분께 스타벅스 커피 쏩니다▶기사제보 및 문의▶내 생활에 흥이나는 최신 트렌드"
139,2018-03-21,"""부르는게 값""…학부모 불안심리 파고드는 학종",https://news.naver.com/main/read.nhn?mode=LSD&mid=shm&sid1=102&oid=008&aid=0004025842,머니투데이,"[머니투데이 오세중 기자] [편집자주] 교육 정책은 경제성장의 출발점이다. 문재인 정부가 추진 중인 소득주도성장의 핵심은 가계의 가처분소득을 올려 경제에 활력을 불어넣겠다는 거다. 치솟고 있는 사교육비가 큰 걸림돌이다. 사교육의 진원지는 학생부종합전형(학종)이다. 학생들의 잠재력을 끌어내기 위해 도입됐지만, ‘금수저 전형’ 등 공정성 시비가 여전하다. 입시제도 개혁이 절실한 이유다. 학종 문제 해결은 곧 경제 살리기다.[[학종! 이대론 안된다]②학부모엔 '깜깜이' 전형…전문가 상담 몇번에 수백만원 훌쩍]지난해 8월 서울 강남구 대치동 학원밀집지역 앞에서 학생들이 오가고 있다. 교육부가 '2021학년도 수능 개편 시안'을 발표한 이후 학원가 모습.학원사진은 관련 기사에 나오는 입시업체와 무관함./사진=뉴스1 DB고등학생 자녀를 둔 학부모 A씨(46). 이른바 '학력고사 세대'다. 그는 최근 지인으로부터 학생부종합전형(학종) 등 대입 전형이 870개가 넘는다는 말을 듣고 덜컥 겁부터 났다. 과거 자신의 수험생 시절만 생각했던 무지함에 부끄럽기까지 했다.고민 끝에 서울 대치동의 한 입시업체 전화를 했다. 하지만 이번엔 좌절감을 느꼈다. '학종 관리 비용'이 적지 않았기 때문이다. 그나마 홈페이지에 게재된 가격만 받는다는 한 입시컨설팅 업체에서도 학종 관리에 수백만 원이 든다는 답변만 돌아왔다.이처럼 학종에 대해 꼼꼼한 전형준비가 필요하다는 입소문이 퍼지면서 학부모들의 불안 심리가 커지고 있다. 일각에서는 사교육업체만 배를 불리고 있다는 비판도 나온다. 성적 위주의 입시 병폐를 근절하겠다는 학종의 본질은 이미 퇴색했다는 지적이다.대치동 입시 컨설팅 업체 중에는 투명하게 비용을 홈페이지에 적시한 경우도 있지만 가격은 천차만별이다. 돈이 없으면 학종은 꿈을 꿀 수도 없다는 얘기다.대치동 C업체는 정시와 수시, 학생부 전형 맞춤 등 다양한 서비스를 제공하면서 한 차례 상담료만 한 시간에 20만원을 받는다. 이같은 유료컨설팅은 한 번으로 끝나지 않고 계속 이어진다. 여러 번 받을 경우 순식간에 200만~300만원에 달할 수 있다.D업체는 학종에 중요하게 작용하는 '학교생활기록부(학생부)'를 한번 첨삭하는데만 50만원의 비용이 든다. 첨삭을 통해 원하는 생기부 완성본을 만들다고 할 때 4차례만 추가로 받아도 200만원을 내야 한다.학종을 전문적으로 컨설팅하는 E 업체 관계자는 머니투데이와의 통화에서 ""학생들이 성적으로만 대학을 가는 시대는 지났고, 기본적으로 학종을 미리 준비하지 않으면 원서를 쓸 때 당황할 수 있다""며 ""체육과 봉사활동 등 비교과 활동에 대해 컨설팅을 통해 원하는 학교와 학과에 맞게 준비를 해야 한다""고 말했다.이 관계자는 ""독서와 봉사활동 등도 원하는 학과(진로)나 인성 등의 면을 부각시키기 위해 활동전략을 짜 해야할 목록에 집어넣게 되는 것""이라며 ""전문가들이 실제 학생들의 수준에 맞춰 대입에서 입학의 당락을 결정 짓는 확률을 높이는 만큼 전문성 차원에서 비용이 책정된 것""이라고 설명했다.결국 과거 점수를 올리기 위한 쪽집게 과외처럼 학생들이 원하는 학과 진학을 위한 전략과 가이드라인 제공해 합격 성공률를 높이려면 학부모들의 금전적 지출은 불가피하다는 것이다. 학종은 선택이 아닌 필수라는 게 업체들의 주장이다.학종이 시작된 '성적으로 줄세우기' 방지 차원의 의도는 온데간데 없고, 사설 업체만 배불리는 셈이다. 봉사활동 역시 순수한 의도보다는 인성 평가에서 좋은 영향을 주기 위한 칸(이력)채우기식 행사로 전락할 우려도 제기되는 대목이다.한 사립고의 교사인 D(38)씨는 학종의 취지에는 동의하면서도 ""학종의 문제는 학교 교육과정의 모든 평가가 생기부라는 문서 하나로 평가 받는데 있다""며 ""학교에서도 생기부에 좋은 평가가 될만한 각종 페이퍼 행사를 만들어낸다""고 꼬집었다.그는 이어 ""우스게로 '이런 행사는 좋은 생기부 감이다'라고 할 정도""라면서 ""담임교사의 필력이나 정성에 따라 같은 학교에서 같은 교육을 받아도 달리 평가될 수 있다""고 지적했다.또 다른 교사는 ""강남에서는 컨설팅이라고 해서 몇백에서 천 만원 가까이 든다는 얘기도 들었다""면서 ""학종의 대대적인 개편이 뒤따라야 '금수저 전형'이라는 비판에서 벗어날 수 있을 것""이라고 강조했다.☞읽어주는 MT리포트▶현대차 '넥쏘' 돌풍, 예약판매 하루만에 700대▶女아이돌 '페미니스트 논란'… 도대체 뭘 잘못했을까▶만화 보고 선물도 받고~오세중 기자 danoh@mt.co.kr<저작권자 ⓒ '돈이 보이는 리얼타임 뉴스' 머니투데이, 무단전재 및 재배포 금지>"
140,2018-03-21,"절기 춘분, 종일 쌀쌀…충청이남 대설주의보",https://news.naver.com/main/read.nhn?mode=LSD&mid=shm&sid1=103&oid=422&aid=0000308839,연합뉴스TV,"[날씨] 절기 춘분, 종일 쌀쌀…충청이남 대설주의보[앵커]절기상 춘분인 오늘 꽃샘추위가 절정을 보이겠습니다.내일 새벽까지 곳곳으로 많은 눈도 쏟아지겠는데요.자세한 날씨는 야외에 나가있는 기상캐스터 연결해 알아보겠습니다.구본아 캐스터.[캐스터]네, 확실히 지난 주와 비교하면 공기가 부쩍 더 차가워졌는데요.게다가 여기에, 바람까지 강하게 불어서 더욱 쌀쌀하게 느껴집니다.오늘도 얇은 봄옷은 피하셔야겠습니다.현재 지금 이시각 서울이 1.4도, 체감온도는 영하권까지 내려가 있고요.남부지방 역시 기온이 많이 떨어져 있습니다.한낮에도 전국 5도 안팎에 그치는 등 종일 쌀쌀하겠습니다.게다가 눈과 비소식까지 있는데요.현재 수도권을 제외한 전국 곳곳으로 눈비가 이어지고 있습니다.낮 무렵이면 전국 대부분 지역으로 확대가 되겠고 특히나 대설특보가 발효 중인 강원산지과 경북산지, 남부내륙 곳곳으로 많은 눈이 쌓일텐데요.우선 강원산지에 최고 20cm, 경북과 강원동해안으로도 최고 10cm의 큰 눈이 예상이되고요.전북과 충청에는 1~5cm 가량의 눈이, 또 수도권에는 5mm안팎의 비가 조금 내리겠습니다.내일 새벽에는 대부분 그치겠지만 봄에 내리는 눈의 특성 상, 평소 내리는 눈보다 습기를 가득 머금고 있기 때문에 더 무겁습니다.각종 시설물피해 없도록 점검을 잘 해주셔야 겠습니다.지금까지 날씨 전해드렸습니다.(구본아 기상캐스터)연합뉴스TV : 02-398-4441(기사문의ㆍ제보) 카톡/라인 jebo23▶ 연합뉴스TV 네이버 채널 구독▶ 생방송 시청▶ 대한민국 뉴스의 시작, 연합뉴스TV 앱 다운받기"
