,날짜,기사 제목,기사 링크,기사 출처,기사 내용
45,2018-03-21,양자 넘어 '3자 담판' 큰 그림…최종적 '합의 보증' 취지 관측,https://news.naver.com/main/read.nhn?mode=LSD&mid=shm&sid1=100&oid=032&aid=0002859221,경향신문,"ㆍ문 대통령, 남·북·미 3국 정상회담 첫 언급ㆍ‘종전’보다 ‘평화선언’ 염두…‘한반도 비핵화’ 구축 의지ㆍ한발 앞서 ‘북·미 경협’까지 거론, 양측 대화 촉구 의미도ㆍ미완의 10·4 선언 의식 ‘불가역적 합의’ 위한 제도화 강조문재인 대통령이 21일 청와대 여민관에서 개최된 남북정상회담 준비위원회 2차 회의에서 발언하고 있다. 문 대통령은 남·북·미 3국 정상회담 가능성을 언급하며 “한반도 핵과 평화 문제를 완전히 끝내야 한다”고 말했다. 청와대사진기자단문재인 대통령은 21일 남북정상회담 준비위원회 회의에서 4~5월 남북정상회담, 북·미 정상회담의 진전 상황에 따라 남·북·미 3국 정상회담이 열릴 수 있다고 밝혔다.남북에 이은 북·미 정상회담을 통해 한반도 비핵화와 평화체제 구축 합의를 도출하고, 최종적으로 남·북·미 정상이 마주앉아 이 합의를 보증하고 이행해 나가자는 구상으로 보인다.문 대통령은 임종석 대통령비서실장이 주재하는 이 회의에 참석해 이 같은 생각을 밝혔다. 한반도 문제의 직접 당사자 격인 3국의 정상, 문 대통령과 김정은 북한 국무위원장, 도널드 트럼프 미국 대통령이 한자리에 모여 담판을 지어보자고 한 것이다. 2006~2007년 APEC 정상회의 때 한·미 정상이 논의하고 10·4 남북정상선언 때 추진하기로 합의했지만 이행되지 않았던 남·북·미 정상회담을 11년 만에 복원하려는 것이다.청와대 관계자는 “남북에 이어 북·미가 만난 결과가 순조로우면 3자가 모두 만나 그 합의 내용을 좀 더 분명히 하고 실천적 약속을 완성하자는 취지”라고 설명했다. 이 관계자는 “아직 (회담에) 중국이 참여할 단계는 아닌 것 같다”고 했다. 정전협정 당사자인 중국을 제외하고, 남·북·미 정상이 만나서 할 수 있는 것은 ‘종전선언’보다는 ‘평화선언’ 성격일 것으로 보인다.문 대통령은 “한반도 평화정착은 남북 사이의 합의만으로 이뤄지는 게 아니다. 미국의 보장이 있어야 한다. 그러려면 북·미관계가 정상화되어야 한다. 더 나아가 북·미 사이의 경제협력으로까지 진전돼야 한다”고 말했다. 미국의 제재를 의식해 남북정상회담에서 남북 경협 얘기조차 꺼내지 않으려는 조심스러운 분위기 속에서, 현재로선 요원해 보이는 북·미 경협을 거론한 것이다. 청와대 고위 관계자는 “북한에 대해 정상회담들이 잘 진행될 경우 미국과의 경협도 가능하다는 비전을 제시한 것”이라고 말했다.청와대는 문 대통령의 이 발언이 미국이나 북한과 사전에 협의한 것은 아니라고 밝혔다. 아직 북한과 미국 사이에 정상회담 논의가 본격화되지 않고 있는 상황에서 북·미 정상회담 이후에 있을 일을 미리 크게 던짐으로써, 양측의 대화를 촉구한 것이라는 해석이 가능하다.문 대통령은 중국과 고고도미사일방어체계 배치 문제를 풀 때와 같이 ‘역지사지’를 염두에 두고 북·미 양측에 접근하는 것으로 보인다. 문 대통령은 “회담 자료를 준비할 때 우리 입장이 아니라 중립적 입장에서 각각의 제안 사항들이 남북과 미국에 어떤 이익이 되는지, 우리에게는 어떤 이익이 있고 북한에는 어떤 이익이 있고 또 미국의 이익은 무엇인지, 그리고 그 이익들을 서로 어떻게 주고받게 되는 것인지 설명하고 설득할 수 있도록 그렇게 준비를 해달라”고 당부했다.문 대통령은 10·4 선언이 국내적 논란 속에 좌초됐던 경험을 의식한 듯 남북정상회담의 합의 내용을 제도화해 국회 비준을 받아야 한다고 말했다. 2000·2007년 정상회담 합의 등 중요 합의 내용과 이번에 새로 합의한 것을 추려 ‘남북 기본협정’을 추진하겠다는 대선 공약을 꺼낸 것으로 보인다. 합의가 불가역적일 것임을 강조하기 위해 한국부터 솔선수범하겠다는 것이다.조성렬 국가안보전략연구소 선임연구원은 “북한에 비핵화의 진정성을 묻기 전에 우리는 북한의 체제 안정성을 보장할 준비가 돼있는지 자문해봐야 한다”며 “CVID(완전하고 검증가능하며 되돌릴 수 없는 비핵화)와 더불어 CVIG(완전하고 검증가능하며 되돌릴 수 없는 체제안정 보장)를 준비해놓고 있어야 한다”고 말했다.<손제민 기자 jeje17@kyunghyang.com>▶ 경향신문 SNS[트위터][페이스북]▶[인기 무료만화 보기]©경향신문(www.khan.co.kr), 무단전재 및 재배포 금지"
46,2018-03-21,토지공개념·수도조항 명문화… 개헌안 '뜨거운 감자',https://news.naver.com/main/read.nhn?mode=LSD&mid=shm&sid1=100&oid=005&aid=0001082546,국민일보,"靑 ‘대통령 개헌안’ 2차 공개지방분권 확대 구체 방안 명시경제민주화도 실질적 내용 담아野 “자유시장경제 포기 선언”대통령 개헌안에 토지 공개념과 지방분권 강화 방안이 명시됐다. 수도 조항을 신설해 행정수도 이전을 추진할 수 있는 근거도 마련됐다.청와대는 20일에 이어 21일 두 번째 대통령 개헌안 요지를 공개했다. 헌법 총강·경제·지방분권 관련 조항이다. 사회적 불평등 심화를 해소한다는 차원에서 ‘토지의 공공성과 합리적 사용을 위해 필요한 경우에 한해 특별한 제한을 하거나 의무를 부과할 수 있다’는 내용의 토지 공개념 내용이 포함됐다. 조국 청와대 민정수석은 “이번 개헌을 통해 경제 민주화와 토지 공개념을 강화하고 실질화하려 한다”며 “이제 한정된 자원인 토지에 대한 투기로 말미암은 사회적 불평등 심화 문제를 해소해야 한다”고 강조했다.개헌안은 ‘대한민국은 지방분권국가를 지향한다’는 내용을  1조 3항으로 추가했다. 자치행정·입법·재정권도 대폭 강화됐다. 특히 누리과정(만 3∼5세 무상보육) 사태와 같은 정책·재정 불일치를 막기 위해 자치사무 경비는 지방정부가, 국가사무 집행 비용은 국가가 부담하는 조항이 신설됐다. 또 ‘지방세 조례주의’를 도입해 지방정부가 자치세 종목, 세율, 징수 방법에 관한 조례를 정할 수 있게 했다.주민이 지방정부의 독주와 부패를 막도록 주민발안·주민투표·주민소환 제도도 헌법에 규정됐다. 문재인 대통령의 대선 공약이던 ‘제2국무회의’ 성격의 국가자치분권회의도 신설된다.수도 조항과 함께 총강에는 공무원의 전관예우 방지 근거 조항도 마련됐다. 김형연 청와대 법무비서관은 “지금까지는 전직 공무원에게 경제적 규제를 하면 재산권 침해 문제 등으로 위헌 결정을 받기 쉬웠지만 이 규정으로 상당 부분 위헌성을 피해갈 수 있을 것”이라고 설명했다.하지만 토지 공개념, 수도 이전, 지방분권 강화 방안 모두 사회적·정치적 논란이 많았던 주제다. 국회 논의가 시작되더라도 여야 간 합의가 쉽지 않을 것이라는 지적이 나온다. 자유한국당은 논평에서 “오늘 발표된 내용은 자유시장경제 포기 선언과 다름없다”고 비판했다.강준구 기자 eyes@kmib.co.kr[카카오 친구맺기][페이스북][취재대행소 왱!(클릭)]GoodNews paper ⓒ국민일보(www.kmib.co.kr), 무단전재 및 재배포금지"
47,2018-03-21,"리비아 검은돈 수뢰 혐의 사르코지, 이틀째 심문받아",https://news.naver.com/main/read.nhn?mode=LSD&mid=shm&sid1=104&oid=001&aid=0009973378,연합뉴스,"전날 자정 잠시 귀가했다가 21일 아침 다시 경찰 출두2012년 대선자금건 기소명령한 수사판사가 구금연장 등 결정…'악연'경찰 출석 위해 자택 나서는 사르코지 전 프랑스 대통령 (파리 로이터=연합뉴스)(파리=연합뉴스) 김용래 특파원 = 프랑스 경찰이 리비아 독재정권으로부터 거액의 불법 대선자금을 수수한 혐의를 받는 니콜라 사르코지(63) 전 대통령을 상대로 21일(현지시간) 이틀째 심문을 이어가고 있다.전날 아침 파리 근교 낭테르의 부패범죄수사대(OCLCIFF)에 출석해 자정까지 조사를 받은 사르코지는 잠시 귀가했다가 이날 아침 다시 경찰에 출석했다.프랑스 경찰은 형사소송법상 사르코지의 출두 시점부터 그의 신병을 48시간 확보해 심문할 수 있다.사르코지는 지난 2007년 프랑스 대선 직전에 리비아의 독재자 무아마르 카다피(2011년 사망) 측으로부터 최대 5천만 유로(660억원 상당)의 불법 정치자금을 받은 혐의를 받고 있다.프랑스 사정당국은 2012년을 전후로 탐사보도 매체가 관련 의혹을 보도하기 시작하자 그해 4월 내사를 시작했고, 올해 1월 수사망을 대폭 확대했다.그에 앞서 2011년 나토(NATO·북대서양조약기구)의 주도로 카다피를 축출하기 위한 공습이 시작됐을 때 카다피의 아들 사이프 알-이슬람은 유로뉴스 채널과 인터뷰에서 ""사르코지가 대선 자금으로 쓰려고 리비아에서 가져간 돈을 되돌려 줘야 한다""고 주장한 바 있다.2007년 12월 회동한 사르코지와 카다피(파리 AP=연합뉴스) 지난 2007년 12월 10일 파리 엘리제궁을 방문한 카다피(오른쪽)와 악수하는 사르코지 당시 프랑스 대통령.이런 내용이 단초가 돼 프랑스 탐사보도 전문매체 메디아파르(Mediapart)가 집중취재를 시작했고, 2013년 5월부터 관련 보도가 쏟아지기 시작했다.언론 보도들을 바탕으로 내사를 벌여온 사정당국은 2016년 11월 '지아드 타키딘'이라는 인물로부터 자신이 현금으로 500만 유로(66억원 상당) 상당을 리비아 측에서 조달해 2006년 말∼2007년 초께 사르코지의 최측근 클로드 게앙 당시 내무장관에게 건넸다는 증언을 확보했다.프랑스 언론 보도들을 종합하면 사르코지는 리비아 측으로부터 최소 500만 유로(66억원)에서 최대 5천만 유로(660억원) 상당을 받은 것으로 추정된다.경찰은 이외에도 카다피 정권의 핵심관계자들로부터 다량의 증언과 증거물을 수집한 것으로 알려졌다.경찰이 21일 자정께 심문을 일시중단하고 사르코지의 귀가를 허용한 것은 도주와 증거인멸의 우려가 크지 않다고 본데다, 이미 충분한 증언과 증거물을 확보했기 때문으로 풀이된다.심문 개시 48시간이 지난 뒤에는 수사판사가 구금 연장이나 예심 개시 결정을 할 수 있다. 이 사건을 감독하는 수사판사 세르주 투르네르는 이미 2012년 불법 대선자금 스캔들인 비그말리옹 사건에 대해 사르코지의 기소를 명령한 '악연'이 있다.사르코지는 예심판사들의 기소 결정에 불복해 이의를 제기한 상태다. 비그말리옹 스캔들만으로도 사르코지는 1년의 징역형을 선고받을 수 있다.yonglae@yna.co.kr경찰 출석 위해 자택 나서는 사르코지 전 프랑스 대통령 (파리 로이터=연합뉴스)▶연합뉴스 채널 구독 500분께 스타벅스 커피 쏩니다▶기사제보 및 문의▶내 생활에 흥이나는 최신 트렌드"
48,2018-03-21,돌연 취소된 MB 영장심사…핵심 쟁점은 '변호인단 출석',https://news.naver.com/main/read.nhn?mode=LSD&mid=shm&sid1=100&oid=056&aid=0010557483,KBS,"[앵커]내일(22일)로 예정됐던 이명박 전 대통령의 구속영장 심사가 돌연 취소됐습니다.법원에 제출한 검찰과 변호인단의  의견서 내용이 달라서인데요.법원은 내일(22일) 오전 중으로  심문방식과 시기 등을 결정할 방침입니다.오현태 기자가 보도합니다.[리포트]서울중앙지법이 이명박 전 대통령에 대한 구속영장 심사를 전격 취소했습니다.내일(22일) 오전 10시 반에  시작할 예정이던 심문도  열리지 않습니다.검찰과 변호인단 의견서 내용이 달라 심사를 취소했다는 게 법원 측 설명입니다.검찰은  이 전 대통령과 변호인단 모두  출석하지 않는다고 밝혔고, 변호인단은 이 전 대통령만 출석하지 않는다는 의견서를 냈습니다.심사 일정이 취소된 직후 이 전 대통령 측은 새로운 의견서를  법원에 제출했습니다.이 전 대통령과 변호인  모두 출석해야 하는 심문 일정이라면 변호인단도 출석을 거부하겠지만 변호인만 나가도 된다면 심문에 응하겠다는 겁니다.변론을 통한 방어권 보장을 법원에 압박한 것으로 풀이됩니다.구속 시기를 최대한 늦추려는 전략이기도 합니다.법원은 검찰과 변호인단 의견을 수렴해 내일(22일) 오전 중에 방침을 정하겠다고 밝혔습니다.어떤 방식이든 이 전 대통령은  자택에서 심사 결과를 기다리게 됩니다.법원이  심문 없이  서류심사만 한다면  구속 여부는 내일(22일) 자정 전후에  결정될 수 있습니다.심문 일정을 다시 잡는다면  구속 여부는 빨라야 모레(23일) 이후에 결정됩니다.KBS 뉴스 오현태입니다.오현태기자 (highfive@kbs.co.kr)[저작권자ⓒ KBS 무단복제-재배포 금지]"
49,2018-03-21,새벽까지 눈·비…찬 바람에 계속 쌀쌀,https://news.naver.com/main/read.nhn?mode=LSD&mid=shm&sid1=103&oid=422&aid=0000309003,연합뉴스TV,"[날씨] 새벽까지 눈ㆍ비…찬 바람에 계속 쌀쌀밤 사이에도 눈이 오락가락 하고있습니다.앞으로도 강원산지와 경북북부산지에는 3~8cm의 많은 눈이 더 오겠고요.영동과 충청, 남부곳곳에도 1~5cm, 수도권에는 1cm 안팎이 내리겠습니다.눈은 늦은 밤에 수도권부터 그치기 시작해서 내일 새벽이면 대부분 개겠습니다.추위는 계속됩니다.아침에 서울이 1도로 오늘 만큼 춥겠는데요.낮에는 12도까지 크게 올라가긴 합니다만 평년보다는 낮은 수준인 데다 바람도 불어 쌀쌀하겠습니다.주말부터 예년수준을 웃돌면서 포근해질 전망입니다.서해를 제외한 대부분 바다에 풍랑특보가 지속 중입니다.내일도 모든 해상의 물결이 최고 5m 안팎까지 거세게 일겠고 동해안으로는 너울 파도도 들어오겠습니다.내일은 가끔 구름만 많겠고요.영남해안에는 강풍특보가 내려지는 등 바람이 강하게 불겠습니다.대기질은 오전까지 좋지만 국외 오염물질이 들어오면서 수도권 등 중서부 지역 오후부터 다소 나빠지겠습니다.아침 기온은 서울과 강릉이 1도, 대전과 전주 0도, 창원 3도 등으로 오늘 만큼이나 춥겠습니다.한낮 기온은 서울과 대전 12도, 전주와 대구 11도까지 올라가면서 오늘과 비교해서는 7도 이상 높지만 포근하다 말할 수준은 아니겠습니다.날씨 전해드렸습니다.(김도연 기상캐스터)연합뉴스TV : 02-398-4441(기사문의ㆍ제보) 카톡/라인 jebo23▶ 연합뉴스TV 네이버 채널 구독▶ 생방송 시청▶ 대한민국 뉴스의 시작, 연합뉴스TV 앱 다운받기"
50,2018-03-21,"디에이치자이 '금수저' 청약…국토부 ""자금조달 계획서 집중 분석""",https://news.naver.com/main/read.nhn?mode=LSD&mid=shm&sid1=101&oid=421&aid=0003271681,뉴스1,"""자금조달 집중분석후 증여세 탈루 의심, 국세청 통보할 것""디에이치 자이 개포 모델하우스에 몰려든 방문객의 모습.(뉴스1 자료사진)© News1 이재명 기자(서울=뉴스1) 이동희 기자 = 국토교통부가 '로또 분양'으로 불린 디에이치자이 개포 청약 당첨자에 대해 자금조달 계획서는 물론 증여세 탈루 여부를 집중 분석할 계획이다.국토부는 ""디에이치자이 특별공급 당첨자를 포함한 해당 단지 당첨자의 자금조달 계획서를 집중 분석해 증여세 탈루가 의심되면 국세청에 통보할 것""이라고 21일 밝혔다.지난 19일 디에이치자이 개포 특별공급 청약 결과 444명이 당첨됐고 이 가운데 만 20대 이하는 14명(3.2%)로 나타났다.특히 분양가 14억여원에 달하는 아파트에 1999년생(만 19세) 김모씨 등 만 19세에서부터 20대까지 14명이 당첨되면서 '금수저' 논란이 제기됐다.이와 관련, 국토부는 고강도의 조사에 나설 계획이다. 국토부 관계자는 ""23일부터 지자체와 협력해 특별공급 당첨자에 대한 서류분석에 착수할 것""이라며 ""위장전입 등 부정 당첨 여부도 철저하게 조사하는 한편 증여세 탈루가 의심되는 사례는 국세청에 통보할 것""이라고 말했다.한편 디에이치자이 개포는 특별공급 평균 2.16대 1, 일반공급 평균 25대 1을 기록했다.yagoojoa@▶ [뉴스1] 채널설정하기▶ 제보하기▶ [페이스북] 바로가기![© 뉴스1코리아(news1.kr), 무단 전재 및 재배포 금지]"
51,2018-03-21,엘리트 총경의 두 얼굴…'해외도박장 운영' 의혹,https://news.naver.com/main/read.nhn?mode=LSD&mid=shm&sid1=102&oid=437&aid=0000177653,JTBC,"[앵커]경찰서장까지 지낸 현직 경찰 총경이 해외 불법 사설 도박장 운영에 연루된 의혹으로 지금 검찰 수사를 받고 있습니다. 마카오 사설 도박장을 '삼성보다 나은 가족 사업'이라면서 투자자를 유치한 정황도 포착됐습니다.엘리트 경찰로 촉망받았던 정모 총경의 두 얼굴, 먼저 정해성 기자입니다.[기자]경찰청 홍보계장, 경찰서장, 서울지방경찰청 기동대장까지.경찰 내 주요 직책을 거친 정모 총경이 가족 등 명의로 마카오에 불법 사설 도박장을 운영했다는 의혹이 제기된 것은 지난해 8월입니다.프로골퍼 김모 씨가 빌려준 돈 수억 원을 받지 못했다며 정 총경을 고소하면서입니다.[김모 씨/프로골퍼 : (카지노 사업은) 이자 많이 주는 사업이고 절대 안전하다고 그랬죠.]김씨가 경찰에 제출한 자료를 보면 마카오 한 호텔의 사설 도박장 운영자로 정 총경의 친누나가, 채권자는 정 총경 이름이 쓰여 있습니다.또 다른 카지노 도박장은 정 총경의 측근 조모 씨가 운영자로 돼 있습니다.정 총경이 도박장 수익이 매월 수천만 원에 달한다고 강조했던 정황도 포착됐습니다.[정모 씨/서울지방경찰청 소속 총경 (2016년 8월) : 3천, 2천, 천 벌다가 좀 버는 대로 이자 쭉쭉, 원금 쭉쭉 해서 남의 것 빚 갚고 나면 1년 있으면서 넣은 거 다 갚으면 그러면 사업 성공한 거지. 왜 그러냐면 정킷에서 나온 돈이 있거든.]대기업보다 수익구조가 좋다며 가족 사업으로 최적이라고도 말합니다.[정모 씨/서울지방경찰청 소속 총경 (2016년 8월) : 현재 상태가 삼성보다 더 좋아 재무구조가. 이 사업이 50, 60, 70대까지 하더라도 가족들끼리 잘 버는 사업 아니야? 가족들끼리 좋게 먹고사는 거지.]당시 경찰서장이었던 정 총경이 천안의 고급 아파트로 투자자를 불러 자신의 지위를 내세웠다는 주장도 제기됩니다.[김모 씨/프로골퍼 : 경찰 대학교 나온 사진과 더불어 동문들끼리 청와대에서 찍은 사진도 자랑하듯 걸어놨더라고요. 사고 나면 공무원인데 내 돈 떼어먹겠냐…]경찰은 피해자가 김씨 만이 아니고, 피해액도 수십억 원으로 보고 검찰에 정 총경을 기소 의견으로 송치했습니다.정 총경은 녹음 파일에 대해서 ""의도된 답을 유도한 것""이라 주장했고, ""검찰에 소명하겠다""고 취재진에게 밝혔습니다.(영상디자인 : 박성현)+++※ 경찰대총동문회에서 정 총경은 경찰대학 출신이 아니라고 알려왔습니다.정해성(jung.haesung@jtbc.co.kr) [영상취재: 김장헌,이승창 / 영상편집: 박수민]▶ 라이브 시청은 유튜브로,제보는 뉴스룸으로!▶ 스토리, 라이브, 비하인드! JTBC 소셜스토리Copyright by JTBC(http://jtbc.joins.com)and JTBC Content Hub Co., Ltd. All Rights Reserved. 무단 전재 및 재배포 금지"
