,날짜,기사 제목,기사 링크,기사 출처,기사 내용
58,2009-06-26,<경상수지 흑자지속..내수침체 영향>(종합),https://news.naver.com/main/read.nhn?mode=LSD&mid=shm&sid1=101&oid=001&aid=0002734391,연합뉴스,"<그래픽> 경상수지 추이    (서울=연합뉴스) 전승엽 기자 = 한국은행이 26일 발표한 `5월 중 국제수지 동향(잠정)'에 따르면 지난달 경상수지는 36억3천만달러 흑자를 기록했다.    kirin@yna.co.kr(서울=연합뉴스) 윤근영 홍정규 기자=5월 경상수지가 4개월째 흑자를 유지한 것은 외환시장에 긍정적인 신호다. 하지만 여전히 불황형 구조를 벗어나지 못해 내수가 살아나지 않고 있음을 거듭 확인해 주었다.경제 전문가들은 경상수지 흑자기조가 연말까지 지속할 것으로 내다봤다.◇ 상품수지 큰폭의 흑자 유지한국은행이 26일 발표한 `5월중 국제수지 동향'에 따르면 상품수지는 50억2천만달러로 비교적 큰 폭의 흑자를 유지했다. 지난 2월 31억1천만달러, 3월의 69억8천만달러, 4월의 61억3천만달러에 이어 4개월째 흑자다.상품수지가 큰 폭의 흑자를 유지하고 있는 것은 내수부진으로 수입이 위축됐기 때문이다.5월의 수입총액은 230억9천만달러로 작년 같은 달의 387억달러에 비해 40.3%가 줄었다. 수송장비는 29.8%가 감소했고 기계류와 정밀기기는 26.6%, 전기.전자기기는 22.7%의 비율로 각각 줄었다.또 내구소비재는 32.8%, 직접소비재는 23.6%, 비내구소비재는 28.4%의 감소율을 각각 나타냈다.반면, 수출은 281억5천만달러로 지난해 같은 달의 393억8천만달러에 비해 28.5% 감소하는데 머물렀다. 수입 감소폭보다는 상대적으로 작았다.여행수지는 적자가 4월 2억5천만달러에서 5월 3억9천만 달러로 확대돼 경상수지 흑자폭을 줄였다. 특히 일반여행 수입액이 4월 7억7천만달러에서 5월 6억3천만달러로 감소했다. 원.달러 환율이 하락한데다 신종 인플루엔자로 일본관광객이 줄었기 때문이라고 한은은 설명했다.◇ 자본수지 유입초과 확대자본수지 유입초과는 크게 확대됐다.5월의 자본수지 유입초과액은 67억2천만 달러로 전월의 21억6천만 달러에 비해 45억6천만 달러가 늘었다. 이 액수는 2004년 11월의 76억7천만 달러 이후 가장 많은 액수다.분야별로는 증권투자수지의 유입초과액이 42억7천만 달러로 전월의 71억3천만 달러에 비해 줄었다. 그러나 파생금융상품수지는 6억8천만달러 유출초과에서 13억4천만달러 유입초과로 전환했다.특히 기타투자수지는 국내 금융기관의 차입금이 증가하면서 45억3천만달러 유출초과에서 12억7천만달러의 유입초과로 바뀌었다.자본수지의 유입초과 확대는 경제위기가 진정되면서  한국으로 자본이 유입되기 시작했다는 의미다.따라서 긍정적인 신호로 해석할 수 있다. 그러나 자본이 국내로 지나치게 많이 들어올 경우, 일시적으로 빠져나가면서 시장에 충격을 줄 수 있다.◇ 전문가들 ""연말까지 계속 흑자""전문가들은 연말까지 경상수지 흑자기조가 이어지겠지만 흑자폭은 줄어들 것으로 전망했다.권순우 삼성경제연구소 거시경제실장은 ""하반기에는 상반기보다 흑자폭이 줄겠지만 내수가 당분간 침체를 벗어나지 못하고 유가 인상폭도 크지 않을 것으로 보인다""며 85억 달러 규모의 흑자를 예상했다.유병규 현대경제연구원 경제연구본부장도 ""적어도 3분기까지는 흑자기조가 유지될 것""이라며 ""다만, 국내 경제가 세계 경제보다 회복속도가 빨라지면서 수입이 크게 늘어난다면 연말께 적자기조로 전환될 가능성도 있다""고 말했다.이지평 LG경제연구원 수석연구위원은 ""하반기부터는 세계 경제가 회복되면서 수출보다 수입이 더 크게 감소해 생겼던 `불황형 흑자'는 조금씩 퇴조할 것""이라고 내다봤다.경상수지 흑자가 연말 또는 내년까지 이어질 것으로 점쳐지면서 원화 가치는 더욱 높아질 것으로 전망됐다.장 민 한국금융연구원 거시경제연구실장은 ""흑자가 계속돼 달러 공급이 많아지면서 환율 하락 압력으로 작용한다""며 ""늘어난 외화유동성과 원화유동성을 적절히 관리하기 위한 당국의 유동성 관리 정책이 중요해질 것""이라고 말했다.이 연구위원은 ""하반기 원화 강세가 이어지는 가운데 주요국 중 상반기에 유일한 플러스 성장을 보인 한국으로 외국인 투자자금이 돌아오면서 환율이 달러 당 1천100원대로 내려갈 것""이라고 예상했다.keunyoung@yna.co.kr<긴급속보 SMS 신청><포토 매거진>< M-SPORTS ><저작권자(c)연합뉴스. 무단전재-재배포금지.>"
59,2009-06-26,"""北억류 美여기자들 건강 악화""<VOA>",https://news.naver.com/main/read.nhn?mode=LSD&mid=shm&sid1=100&oid=001&aid=0002734382,연합뉴스,"북한에 억류된 미국 커런트TV 소속 여기자들(자료사진) 사진 왼쪽이 미국 국적의 여기자 한국계인 유나 리(Euna Lee)와 중국계인 로라 링(Laura Ling)美정부에 '더 적극적 교섭' 심리적 압박될 듯(서울=연합뉴스) 임주영 기자 = 북한에 억류된 미국 커런트TV 소속 여기자들인 한국계 유나 리와 중국계 로라 링의 건강이 악화되고 있다고 로라 링 기자의 남편 아이언 클레이튼씨가 밝혔다고 미국의 소리(VOA) 방송이 26일 전했다.클레이튼씨는 25일 미국 샌프란시스코에서 열린 여기자들 석방 촉구 집회에서 로라 링 기자가 지난 21일 밤 전화를 걸어와 자신의 건강 상태가 악화되고 있으며 유나 리 기자에게도 건강상 문제가 발생했다고 말했다.유나 리 기자도 같은 날 남편 마이클 샐데이트씨에게 전화를 걸어왔다고 샐데이트씨는 밝혔다.두 여기자 모두 겁에 질린 목소리였지만, 로라 링 기자는 현재의 구금상태에 대해 ""견딜 만 하다""고 말했다고 VOA는 전했다.북한이 두 여기자에게 미국에 있는 남편들에게 전화를 걸도록 허용한 것은 국제사회의 비판 여론을 의식한 것으로 보인다.특히 두 여기자의 건강이 악화되고 있다는 말은 실제 건강이 악화되고 있는 것과 별개로, 두 여기자의 석방을 위해 더 적극적으로 대북 접근을 하도록 미 정부를 압박하는 심리효과를 북한 당국이 기대하고 있다는 관측도 나온다.두 여기자가 노동교화형에 처해졌지만 통화에서 노역을 하고 있다는 말이 없는 점도 주목된다.이와 관련, 이언 켈리 미 국무부측은 북한 당국이 두 여기자들에 대해 노동교화형을 집행하는 어떤 법적 절차도 진행하지 않았다고 말했다고 미국의 자유아시아방송(RFA)이 이날 전했다.국무부측은 북한주재 스웨덴 대사가 지난 23일 두 여기자를 초대소에서 각각 따로 면담했지만 같은 장소에서 볼 수 있었기 때문에 두 여기자가 같은 곳에 머물고 있다고 추정했다고 RFA는 덧붙였다.zoo@yna.co.kr[관련기사]▶ <美여기자들 北억류 100일..돌파구 없나>▶ 스웨덴대사, 北억류 美여기자 면담▶ <美, 전방위 대북 압박..北 대응은>▶ <美 여기자 억류..커런트TV 앞날에 그늘>▶ 억류여기자 가족 ""北 관용"" 거듭 호소<긴급속보 SMS 신청><포토 매거진>< M-SPORTS ><저작권자(c)연합뉴스. 무단전재-재배포금지.>"
60,2009-06-26,시국선언 교사 88명 해임ㆍ정직…고발 병행,https://news.naver.com/main/read.nhn?mode=LSD&mid=shm&sid1=102&oid=001&aid=0002734346,연합뉴스,"전교조 시국선언 (자료사진)교과부, 시도 부교육감 회의서 결정(서울=연합뉴스) 이윤영 기자 = 교육과학기술부는 26일 최근 `시국선언'에 참여한 전국교직원노동조합 소속 교사 88명을 중징계하고 검찰에 고발하기로 했다고 밝혔다.교과부는 이날 오전 서울 세종로 정부 종합청사에서 긴급 시.도 부교육감 회의를 소집해 시국선언에 참여한 교사들 징계 방안으로 이같이 결정했다.교과부는 시국선언에 서명한 전교조 소속 교사 총 1만7천여명 가운데 선언을 주동하거나 적극 가담한 교사 88명을 선별했으며, 이들에 대해 해임, 정직 등 중징계하고 검찰에 고발하기로 했다.교과부 장기원 기획조정실장은 ""신성한 교육현장이 정치 이념으로 물들도록 한 것은 용납할 수 없는 행위""라며 ""법과 원칙에 따라 엄정 대응이 필요하다는 판단에 단호한 결정을 내렸다""고 말했다.yy@yna.co.kr[관련기사]▶ 보수단체 `시국선언 교사' 42명 고발▶ <공무원 시국선언…무더기 징계 불가피>▶ 전교조, 시국선언 교사 명단 공개▶ 경남교육청 `시국선언'징계방침..전교조 반발▶ 교과부, 시국선언 주동 교사 고발방침<긴급속보 SMS 신청><포토 매거진>< M-SPORTS ><저작권자(c)연합뉴스. 무단전재-재배포금지.>"
61,2009-06-26,봉화산 정토원서 盧전대통령 오재 거행,https://news.naver.com/main/read.nhn?mode=LSD&mid=shm&sid1=100&oid=001&aid=0002734363,연합뉴스,"합장한 권양숙 여사와 노건호씨 (자료사진)합장한 권양숙 여사와 노건호씨 (김해=연합뉴스) 최병길 기자 = 故 노무현 전 대통령 부인 권양숙 여사와 아들 건호씨가 5일 경남 김해 봉화산 정토원에서 열린 노 전 대통령의 49재 중 이재에 참석해 합장한채 기도를 올리고 있다.2009.6.5  choi21@yna.co.kr(김해=연합뉴스) 황봉규 기자 = 고(故) 노무현 전 대통령의 49재 중 다섯번째 재인 오재(五齋)가 26일 오전 10시 김해시 봉화산 정토원에서 거행됐다.오재에는 권양숙 여사 등 유족과 유시민 전 보건복지부 장관, 안희정 민주당 최고위원 등 참여정부 인사, 일반 신도 등 500여명이 참석했다.이들은 두 손을 합장하고 경건한 표정으로 절을 올리며 노 전 대통령의 명복을 빌었다.이날 오재는 지난주 사재와 마찬가지로 천수경과 지장경 독송, 거불, 유치, 청사, 헌좌제 등의 의식으로 진행됐다.한편 노 전 대통령의 아들 건호 씨는 이날 오후 서울 조계사에서 거행되는 오재 행사에 참석하기 위해 상경했다.노 전 대통령측은 고인의 서거 이후 불교계가 전국 주요 사찰에서 고인의 49재 행사를 매주 봉행하는 등 지원을 보내고 있는 점에 대해 건호 씨가 유족 대표로서 감사의 뜻을 전하기 위해 상경했다고 밝혔다.bong@yna.co.kr[관련기사]▶ 노건호씨, 26일 조계사 五齋 행사 참석▶ <盧전대통령 장지 어떻게 정해졌나?>▶ 노前대통령 비석 봉화산 사자바위 서쪽 건립▶ <盧서거 한달> 봉하마을 `추모 발길' 이어져<긴급속보 SMS 신청><포토 매거진>< M-SPORTS ><저작권자(c)연합뉴스. 무단전재-재배포금지.>"
62,2009-06-26,"남포동 여인숙 화재, 사망 5명·중상 1명(4보)",https://news.naver.com/main/read.nhn?mode=LSD&mid=shm&sid1=102&oid=079&aid=0002069748,노컷뉴스,"""술 마시며 싸우는 소리 났다"" 업주 진술, 사건경위 조사[부산CBS 장규석 기자]26일 오전 7시50분쯤 부산 중구 남포동 모 여인숙에서 화재가 발생해 5명이 사망하고 1명이 중상을 입었다.사망자 5명은 모두 불에 타 신원이 확인되지 않고 있으며 부상자 박 모(38) 씨는 인근병원으로 옮겨져 치료를 받고 있다.부산시 소방본부는 ""여관 입구에 불이 났고, 2층에서 사람이 뛰어내렸다""는 신고가 접수됐으며, 화재현장에 출동해 건물 내부를 수색하던 중 사망자들을 발견했다고 말했다.화재는 오전 8시47분 쯤 진화됐으며, 정확한 화재원인은 아직 밝혀지지 않았다.불이 난 여인숙은 3층 건물에 객실 17개를 갖춘 노후건물로 대부분 무직이거나 일용직인 사람들이 생활하고 있는 숙박시설인 것으로 알려졌으며, 모두 자신의 방에서 잠을 자다 대피하지 못한 채 변을 당한 것으로 드러났다.여인숙은 객실이 있는 2,3층으로 올라가는 계단이 나무로 돼 있어 불이 나자 비상구가 차단됐으며, 객실 내에 있던 휴대용 가스렌지에서 부탄이 연쇄 폭발하면서 피해가 커진 것으로 추정됐다.경찰은 새벽에 여인숙에서 사람들이 안에서 휴대용 가스렌지로 취사를 하면서 술을 마셨으며, 싸우는 소리가 났다는 업주의 말을 토대로 정확한 화재원인을 조사하고 있다.<사망자 - 5명>김한수 (60대, 정확한 나이 미상), 김종달 (50대), 김성갑 (64), 정세철 (45), 신원 미상 60대<부상자 - 1명> 박모(39)씨 부산대병원 치료중hahoi@cbs.co.kr(대한민국 중심언론 CBS  뉴스FM98.1 / 음악FM93.9 / TV CH 412)<저작권자 ⓒ CBS 노컷뉴스(www.nocutnews.co.kr) 무단전재 및 재배포 금지 >"
63,2009-06-26,"한나라, `비정규직법 양보안' 제시",https://news.naver.com/main/read.nhn?mode=LSD&mid=shm&sid1=100&oid=001&aid=0002734235,연합뉴스,"한나라당 비정규직법 논의(자료사진)유예기간 2년, 전환지원금 1조원(서울=연합뉴스) 김범현 장하나 기자 = 한나라당이 비정규직법 개정안의 이달말 처리를 위해 당론에서 한걸음 물러선 양보안을 내놓았다.한나라당은 `비정규직 2년 사용기간' 시행의 유예기간을 기존 3년에서 2년으로 줄이고, 내년도 정규직 전환지원금을 5천억원에서 1조원으로 늘리는 양보안을 야당측에 제시한 것으로 26일 알려졌다.한 핵심관계자는 이날 연합뉴스와의 통화에서 ""어제(25일) 5인 연석회의에서 한나라당이 제시할 안은 모두 제시했다""며 ""2년 유예, 내년 1조원 지원금 편성 등이 그 골자""라고 말했다.따라서 이날 오후 열릴 5인 연석회의에서 막판 타결이 이뤄질지 주목된다.5인 연석회의에서 비정규직법 쟁점에 대한 합의가 극적으로 이뤄질 경우 여야는 29일, 늦어도 30일 이른바 `원-포인트 본회의'를 통해 비정규직법 개정안을 처리하게 된다.이와 관련, 민주당은 `유예기간 1년 미만, 정규직 전환지원 예산 향후 3년간 3조6천억원'을 주장해왔다.안상수 원내대표는 ""모든 전권을 환경노동위 간사인 조원진 의원에게 위임한 상태""라며 ""서로 한걸음씩 양보하는 정신을 살리면 우리도 그에 응하라고 조언을 한 상태며, 상임위 차원의 합의를 존중할 것""이라고 말했다.안 원내대표는 또한 비정규직법 합의 불발시 이달말 강행처리 가능성에 대해서는 ""국회의장이 직권상정을 해주겠느냐""며 ""합의가 안될 경우 처리돼야 한다는 당위는 갖고 있지만 현실적으로 처리되기 어렵다""고 말했다.한 관계자는 ""이제는 민주당이 새로운 안을 가져와야 할 때""라고 밝혔다.kbeomh@yna.co.kr[관련기사]▶ 6월국회, 임시회 회기 시작..입법 대치▶ <정세균, 노동장관과 `비정규직법' 설전>▶ <비정규직법, 극적 타결될까>(종합)▶ 여야, 비정규직법 합의처리 진통(종합)▶ <민주, 비정규직법 `출구찾기'..변화 모색><긴급속보 SMS 신청><포토 매거진>< M-SPORTS ><저작권자(c)연합뉴스. 무단전재-재배포금지.>"
64,2009-06-26,"[단독]경찰 ""공안사범 검거 100일 작전중""",https://news.naver.com/main/read.nhn?mode=LSD&mid=shm&sid1=102&oid=022&aid=0002054520,세계일보,"姜청장 취임후 비공개로… 30여명 검거연말까지 보안경찰 100% 전문인력으로경찰이 국내 간첩 및 안보위해 사범 검거를 위한 ‘100일 작전’에 나선 사실이 확인됐다. 길게는 수년이 걸리는 대공수사에서 단기간의 집중수사는 이례적인 일이다. 경찰은 김대중·노무현 정부를 거치면서 위축된 대공수사 역량을 강화하고 보안수사 위상을 재정립할 방침이다.25일 경찰청에 따르면 강희락 경찰청장 취임 직후인 4월2일 경찰청 보안국은 ‘안보위해 사범 100일 수사계획’을 수립해 전국 지방경찰청과 경찰서 등에 하달했다.경찰청 고위 관계자는 “국민의 정부와 참여정부 10년 동안 반드시 필요한데도 하지 못한 것들을 다시 하겠다는 차원”이라며 “일각에서 오해할 수 있어 비공개로 추진하고 있다”고 밝혔다.이번 집중수사는 인터넷상 친북 게시물 게재와 이적단체 구성, 간첩 행위에 이르기까지 국가보안법을 적용할 수 있는 모든 안보위해 사범을 대상으로 다음달 10일까지 진행된다. 경찰은 이날까지 국가보안법 위반 사범 30여명을 검거해 지난해 같은 기간 대비 2배 이상의 실적을 거뒀다.경찰청은 또 7월 초에 보안수사만을 전문으로 하는 ‘보안경과자’를 1차로 선발하는 한편 앞으로 이들이 보안부서에만 근무하도록 하는 ‘보안경과제’를 새로 시행키로 했다. 지금도 보안인력풀(pool) 제도를 시행하고 있으나 잦은 교체로 대공수사 역량이 떨어지고 있다는 판단에 따른 것이다.경찰청은 오는 12월까지 보안경찰 정원의 100%에 달하는 인원을 보안경과자로 선발할 방침이다.참여연대 사법감시센터 박근용 팀장은 “보수 성향의 정권 교체 후 검찰 공안3과 부활 등 공안기능을 되살리는 조치가 있었다”며 “경찰도 이 같은 분위기에 편승해 대공수사를 강화하는 것이 아닌지 우려된다”고 말했다.김재홍 기자[ 관련기사 ]경찰 '대공수사' 고삐 죄나…""공안정국 조성용""[Segye.com 인기뉴스]◆ '팝의 황제' 마이클 잭슨 돌연사망…전설속으로◆ [단독]경찰 ""공안사범 검거 100일 작전중""◆ 김동길 명예교수 ""DJ 투신자살해야"" 막말 파문◆ 옥상서… 숲속에서… 바닷가서… 야외 바비큐 100% 즐기는 법◆ 자연이 집 안으로… “나는 한옥에 산다”◆ ‘미셸표’ 민소매 원피스, 국내서도 인기 모을까[ⓒ 세계일보 & Segye.com, 무단 전재 및 재배포 금지][☞공짜로 연극ㆍ뮤지컬보기][☞세계일보 지면보기]<세계닷컴은 한국온라인신문협회(www.kona.or.kr)의 디지털뉴스이용규칙에 따른 저작권을 행사합니다.>"
65,2009-06-26,"공공기관, 시위대 상대 손배訴 증가",https://news.naver.com/main/read.nhn?mode=LSD&mid=shm&sid1=102&oid=001&aid=0002734161,연합뉴스,"(서울=연합뉴스) 이웅 기자 = 시위 주최 측이나 참가자를 상대로 형사처벌과 별도로 민사소송을 통해 손해배상 책임을 물으려는 공공기관들의 움직임이 점차 늘어나고 있다.26일 법원 등에 따르면 서울시는 지난달 초 하이서울페스티벌 봄축제의 개막 행사가 시위대의 무대 점거로 중단된 것과 관련해 시위 참가자 9명을 상대로 2억3천500만원의 손해배상 청구 소송을 제기했다.서울지방경찰청은 지난해 5월 정부의 미국산 쇠고기 수입에 반대해 촛불집회를 주도한 광우병국민대책회의 등을 상대로 ""경찰에 폭력을 휘둘러 인적ㆍ물적 피해를 입혔다""며 3억원의 손해배상 청구 소송을 내 현재 재판이 진행 중이다.경찰은 2007년 6월 민주노총이 여의도에서 주최한 특수고용 노동자 집회에서 경찰버스와 진압장비를 파손한 일부 참가자를 상대로 소송을 제기해 지난 2월 2천430만원의 배상 판결을 받았으며 2007년 홈에버 상암점 집회와 관련해 민주노총을 상대로 2천500만원의 배상 판결을 받았다.시위 관련 민사소송은 시위 진압 도중 입은 부상이나 피해에 대해 시위 참가자가 국가를 상대로 손해배상을 청구하는 것이 일반적이고 시위진압 도중 부상한 경찰관이 시위대를 상대로 소송을 제기하는 경우도 종종 있었다.하지만 경찰이나 지방자치단체 등 공공기관이 시위대를 상대로 형사처벌 외에 손해배상 소송을 제기해 민사적 책임을 묻기 시작한 것은 비교적 최근 일로, 2006년 한미 자유무역협정(FTA)에 반대한 전국적인 시위에 대해 일부 시도 지방자치단체와 경찰청이 손해배상 청구 소송을 제기하면서 본격화됐다.당시 광주시는 시위를 주도한 민주노총, 전농, YMCA, 경실련 등 시민단체를 상대로 시청사 파손 등에 대해 2억원의 배상을 청구하는 소송을 제기, 최근 법원 화해권고 결정이 내려지면서 일단락됐다.시위대에 대한 손해배상 청구는 실제 배상보다는 시위가 과격해지거나 불법으로 흐르는 것을 억제하기 위한 법적 수단으로도 해석된다.실제로 수백만원에서 수천만원에 이르는 배상 판결은 시위 참가자에게 형사처벌 못지않은 부담으로 작용할 것이란 게 당국자들의 판단이라는 것이다.법무부와 경찰청은 최근 폭력시위가 우려되는 도심의 대규모 집회에 대한 불허 방침을 밝히면서 시위과정에서 발생한 경찰 피해 등에 대해선 적극적으로 손해배상을 청구키로 했다.손해배상 청구 소송도 형사소송과 마찬가지로 시위 자체의 위법성에 대한 판단이 판결을 가르는 가장 중요한 잣대가 된다는 게 전문가들의 분석이다.실제로 지난해 경찰 측이 낸 촛불집회 관련 손해배상 청구 소송은 법원이 관련 형사소송 결과를 지켜보겠다며 재판을 연기한 상태다.불법ㆍ폭력시위는 엄단하겠다는 정부ㆍ공공기관과 시위를 통한 의사 표현을 포기하지 않겠다는 시민ㆍ노동단체의 공방은 민사 법정에서도 치열하게 전개될 것으로 전망된다.abullapia@yna.co.kr<긴급속보 SMS 신청><포토 매거진>< M-SPORTS ><저작권자(c)연합뉴스. 무단전재-재배포금지.>"
