,날짜,기사 제목,기사 링크,기사 출처,기사 내용
16,2009-06-26,‘인권침해’ 가르치는 초·중·고 교과서,https://news.naver.com/main/read.nhn?mode=LSD&mid=shm&sid1=102&oid=032&aid=0002017032,경향신문,"초등 6학년 영어 7단원 ‘직업카드’ = 의사·조종사·경찰은 남성, 교사·간호사는 여성ㆍ‘장애인·결손가정은 불행’ 편견 조장ㆍ직업 고정관념 여성 차별 내용 수두룩초등학교 6학년 도덕 교과서(163쪽) ‘세계의 불행한 어린이를 돕자’는 ‘불행한 어린이’에 소녀가장·장애아·고아를 열거해놓고 있다. ‘장애, 고아=불행’이라는 편견을 불러일으키는 내용이다.중등 2학년 도덕 61~62쪽 = 한쪽 집단을 일방적인 가해자나 문제 유발자로 서술현행 초·중·고 교과서에 사회적 약자에 대한 편견을 조장하는 차별적 내용들이 수두룩한 것으로 나타났다.국가인권위원회는 25일 초·중·고교 교과서 집필자·편집자들과 ‘인권 친화적 교과서 도입을 위한 간담회’를 개최하고 교과서의 인권침해 사례를 소개했다.중학교 3학년 도덕 교과서(151쪽)는 명절문화 개선을 소개하면서 “음식준비, 손님맞이 등으로 고생하는 여자들을 배려하여 역할을 나누고 협력하는 자세를 가져야 하겠다”고 서술하고 있다. 명절 음식준비는 여성의 역할임을 전제하는 성차별적 서술이다.초등학교 6학년 영어 7단원 직업카드에는 의사·조종사·경찰은 남성, 교사·간호사는 여성으로 그려져 있다. 또한 고등학교 사회 교과서(ㄱ 출판사, 108쪽)에는 국제협약 관련 각국 대표를 모두 남성으로 그려놓았다.고등 도덕  80쪽 = 장애인과 봉사자들의 모습을 ‘도덕공동체’로 서술가정에 대한 편견을 조장하는 대목도 많다. 교육과학기술부 검인정을 받은 고등학교 사회 교과서(ㅈ 출판사 249쪽)에는 ‘결손가정’이 ‘정상가정’의 반대 용어로 제시돼 있다. 같은 교과서 267쪽에는 ‘장애인’이 ‘정상인’과 대비되는 개념으로 서술돼 있다.사회적 갈등 사건의 경우 대립 집단을 대등하게 다루지 않은 사례도 지적됐다. 중학교 2학년 도덕 교과서(61~62쪽)는 그린벨트 조정안에 대한 지역주민의 입장을 소개하면서 이들의 주장과 논리는 제시하지 않고 “그린벨트 지역주민들이…공청회를 저지하는 등 소란을 피웠다”고 서술돼 있다. 중학교 3학년 사회 교과서(ㄱ 출판사 105쪽)는 서울 동대문구 이문동 주민들의 철도 차량기지 건설 반대운동을 서술하면서 철도청의 노력은 부각시킨 반면 주민들에 대해서는 “많은 보상을 들이고서야 반대운동은 잠잠해졌다”고 서술하고 있다.중학교 3학년 도덕 교과서(143쪽)는 가족 건강지수를 점검하는 내용에서 ‘부부는 서로에게 자신감·자존감·행복감을 느끼도록 도와준다’는 항목을 삽입했다. 인권위 인권교육과 김철홍 과장은 “ ‘한 부모 가정=건강하지 못한 가정’으로 받아들여질 소지가 높다”고 말했다.인권위는 “새로운 교과서는 집필단계에서부터 인권적 관점에서 쓰일 수 있도록 해야 할 것”이라고 밝혔다.<강병한기자 silverman@kyunghyang.com>- 대한민국 희망언론! 경향신문, 구독신청(http://smile.khan.co.kr) -ⓒ 경향신문 & 경향닷컴(www.khan.co.kr), 무단전재 및 재배포 금지〈경향닷컴은 한국온라인신문협회(www.kona.or.kr)의 디지털뉴스이용규칙에 따른 저작권을 행사합니다.〉"
17,2009-06-26,"부모와 떨어져 지낸 아이, 어떤 문제 일으키나?",https://news.naver.com/main/read.nhn?mode=LSD&mid=shm&sid1=102&oid=055&aid=0000161927,SBS,"<8뉴스><앵커>SBS 연중기획 '가족이 희망이다'. 오늘(25일)은 부모와 자녀 간의 교감 단절이 어떤 문제를 일으키는지, 또 그 문제를 어떻게 해결해야 하는지 살펴봅니다.박상진 기자입니다.<기자>4살배기 A군이 가방이나 장난감으로 친구들을 때립니다.부모가 맞벌이하면서 돌 때부터 놀이방에 맡겨진 뒤 공격적인 성향을 보였습니다.그러나 엄마가 휴직하고 함께 지내면서부터 달라졌습니다.[A군 어머니 : 많이 변한 것 같아요. 어린이집에서도 산만했던 것도 많이 좀 좋아지고…]32살 김 모 씨는 어렸을때부터 대부분의 시간을 교사이던 어머니와 떨어져 보내야 했습니다.생일이나 소풍 때도 어머니는 곁에 없었습니다.[김모 씨/딸 : 저는 어렸을 때 떨어지기가 싫으니까 막 울면 혼나거나 굉장히 많이 맞거나 그래서 할머니 집에 떨어뜨려 놓으면 거기서 많이 울거나 하는 경험이 많았는데요.]어렸을 때 분리 불안이 대학생때는 우울증으로 변해 7년 남짓 병원 치료까지 받았습니다.[한 모씨/엄마 : 아이를 어떻게 그 심성을 어루만져 줘야 하고 어떻게 보듬어 줘야겠다는 것을 몰랐거든요.]미국에서는 등교를 거부하는 아동의 80%가 유아기 때 분리불안 증세를 보였고, 이런 아이의 60%가 성인이 되서도 우울증과 공황장애 등을 일으켰다는 연구가 나왔습니다.전문가들은 단절된 관계를 회복하기 위해 '감정코칭'을 제안합니다.먼저 자녀가 어떤 감정을 갖고 있는 지 파악한 뒤, 친근하게 대화를 시작해 아이와 감정을 공유함으로써, 솔직하게 감정을 표현하도록 도와줘 스스로 문제를 해결하도록 이끄는 방법입니다.[최성애/가족관계 전문가 : 아이와 충분히 질 높은 시간을 갖는 것이 굉장히 필요하죠. 자기한테 많은 관심을 보여주면 애들도 그 시간을 기다릴 수 있거든요.]전문가들은 무엇보다 자녀가 표현한 감정을 무시하거나 윽박지르지 말고, 대화를 통해 부모가 자기 편이라는 믿음을 심어줘야한다고 조언합니다.박상진njin@sbs.co.kr관/련/정/보◆ 첫 2년 '엄마 사랑' 중요한데…우리 아기들은..?◆ ""믿고 맡길 곳 없어""…어쩔 수 없는 선택 '보모'◆ '부부 행복'까지 관리하는 선진국, 그 이유는?◆ ""하루 30분만 투자해도..""…부부관계 리모델링◆ '부모 이혼' 후유증은?…3대까지 영향 미친다[SBS기자들의 생생한 취재현장 뒷이야기 '취재파일']저작권자 SBS&SBSi 무단복제-재배포 금지"
18,2009-06-26,신종플루 환자 19명 추가..총 181명,https://news.naver.com/main/read.nhn?mode=LSD&mid=shm&sid1=100&oid=001&aid=0002735549,연합뉴스,"<그래픽> 국내 신종 플루 확진환자 일별 누계    (서울=연합뉴스) 김토일 기자 = 국내에서 50여일만에 감염환자 수가 100명을 넘어서면서 신종인플루엔자 확산추세에 대한 우려가 커지고 있다.    하지만 보건당국은 아직 환자와 접촉하지 않고 공기 중의 바이러스를 통한 2차 감염자가 아직 나타나지 않음에 따라 국내 위기 경보를 현행과 같은 '주의'(Yellow)를 유지한채 환자 발생 추이를 예의주시하면서 만일의 사태에 대비, 백신의 자체 생산 및 조기확보에 총력을 기울인다는 방침이다.    kmtoil@yna.co.kr    http://blog.yonhapnews.co.kr/toto4이번 주말 환자 200명 넘을 듯(서울=연합뉴스) 유경수 기자 = 신종인플루엔자 감염자 19명이 추가돼 지금까지 환자 수가 181명으로 늘었다.보건복지가족부 중앙인플루엔자대책본부는 지난 24일 미국에서 입국한 34세 여성의 2살 난 아들을 포함해 확진환자의 접촉자 4명이 인플루엔자A(H1N1) 양성으로 확인돼 국가지정격리병상에서 치료를 받고 있다고 25일 밝혔다.또 19일 미국에서 온 유학생 13살 남자 등 미국 입국자 6명과 호주에서 공부하다 온 21살 남자 등 호주 입국자 5명, 필리핀 입국자 2명, 과테말라와 홍콩 입국자 1명 등도 입국 직후 발열 등 감염증세가 나타나 정밀 역학조사결과 확진환자 판정을 받았다.이날 국적별 감염자는 한국인 13명, 미국인 3명, 과테말라 및 필리핀 국적 각 1명이다.이로써 지금까지 신종플루 환자 수는 확진 181명, 격리치료 환자 60명으로 증가했다.보건당국은 이들이 타고온 항공기에 승무원 및 탑승객, 주변 인물 등을 상대로 추적조사를 벌이고 있다.질병관리본부는 이번 주 들어 외국에서 온 유학생과 국내 긴밀접촉자를 중심으로 감염자가 급증함에 따라 주말께 환자 수가 200명을 넘어설 것으로 내다봤다.yks@yna.co.kr[관련기사]▶ ""신종플루 지역사회 유행은 시간문제""▶ 사노피, 신종플루 백신 대량 생산 착수▶ <신종플루> WHO사무총장 ""변이 징후 없어""▶ ""美 신종플루 감염자 100만명까지 추정""▶ <AI.신종플루에 이어 '염소독감'까지?><긴급속보 SMS 신청><포토 매거진>< M-SPORTS ><저작권자(c)연합뉴스. 무단전재-재배포금지.>"
19,2009-06-26,"남부지방, 사흘째 불볕더위‥'장마전선'에 누그러질 듯",https://news.naver.com/main/read.nhn?mode=LSD&mid=shm&sid1=102&oid=214&aid=0000109385,MBC,"[뉴스데스크]◀ＡＮＣ▶경북 영덕의 기온이 체온을 웃도는 36.9도까지 치솟는 등 남부지방에서는 사흘째 불볕더위가 계속됐습니다.이번 더위는 내일 장마전선이 북상하면서 누그러지겠습니다.김철승 기자입니다.◀ＶＣＲ▶따가운 햇살을 피하는 데는분수가 그만입니다.어른, 아이 할 것 없이더위를 참지 못하고연신 물줄기 속으로 들어갑니다.◀ＩＮＴ▶ 김태규/포항시 우현동""너무 더위서 바람 쐬러 나왔는데아이랑 같이 분수에 뛰어드니정말 시원하네요.""바다에서는제트스키가 빠른 속도로 물살을 가르자바나나 보트에 탄 어린이들은마냥 신이 났습니다.◀ＩＮＴ▶ 배지환/포항동부초등학교 4학년""햇볕에 있었는데 좀 더웠지만바다에 나와서 바나나 보트를 타니시원했어요.""남부지방에 내려진 폭염주의보는오후 5시에 해제됐지만경북 영덕의 낮 최고기온은체온보다 높은 36.9도까지 올라이틀째 전국 최고를 기록했습니다.또 경주가 36.4도, 포항과 대구가 35.3도,광주가 33.3도로 남부지방 대부분이30도를 훌쩍 넘었습니다.동해안 지역에는밤에도 기온이 떨어지지 않아열대야에 가까운 24도 안팎을 보이자,더위에 지친 시민들이해변으로 몰려나오고 있습니다.이번 불볕더위는장마전선이 북상하는 내일 오후남부지방부터 누그러지겠습니다.기상청은 장마전선의 영향으로 내일제주도와 남부지방에서 흐리고비가 오겠으며, 모레 밤에는 전국이장마전선의 영향권에 들겠다고 밝혔습니다.MBC 뉴스 김철승입니다.(김철승 기자)[저작권자(c) MBC (www.imnews.com) 무단복제-재배포 금지]"
20,2009-06-26,직장母 험난한 육아‥일과 육아 사이,https://news.naver.com/main/read.nhn?mode=LSD&mid=shm&sid1=102&oid=214&aid=0000109398,MBC,"[뉴스데스크]◀ＡＮＣ▶우리 사회 저출산 문제를 집중적으로 고민해보는 두 번째 시간입니다.오늘은 일과 육아를 함께 해내야 하는 여성들의 어려움을 짚어봅니다.김수진 기자가 취재했습니다.◀ＶＣＲ▶아침 6시 반, 금융업계에서 일하는허진영 씨의 하루는시작된 지 이미 1시간이 지났습니다.정신없이 우유를 먹이고옷을 갈아입히고, 뒷정리를 하고.출근 준비를 하는 시간은항상 전쟁입니다.근처에 사는 시어머니에게아이를 맡기고 출근하는 길,마음은 무겁고 발걸음은 급합니다.석 달의 출산휴가를 쓰고다시 복직한 지는 1년.전부터 해오던 업무라 힘들진 않은데,밤늦게 퇴근해서 아이가 잠든 모습만 보는바쁜 엄마라는 미안함이 점점 커집니다.◀ＳＹＮ▶ 허진영/출산휴가 뒤 복직""외국 사례를 보면 회사에 있는 보육시설에맡기고 점심 때 잠깐씩 볼 수 있고,그런 일들이 있다고 하는데 사실 그런 건영화에서나 나오는 얘기고요.""아이를 낳고 복직하지 못하는 경우도적지 않습니다.특히 비정규직 여성들은임신과 동시에 계약이 해지되는 게현실입니다.유통업체에서 5년 동안 일했던박진영 씨도 그랬습니다.육아휴직이 끝나갈 무렵 계약해지를통보받았고, 1년이 넘는 소송 끝에돌아온 건 위로금 6백만 원.그토록 원하던 복직은 결국 못했습니다.◀ＳＹＮ▶ 박진영/육아휴직 중 계약해지""판사가 그러더라고요.아이 키워야 되는 거 아니냐고.합의를 할 수밖에 없었어요.""실제로 통계청 자료를 보면여성의 경제활동 참가율은20대와 40대에 60%를 넘지만,임신과 출산이 집중되는 30대에는떨어집니다.◀ＳＹＮ▶ 황현숙 소장/여성노동자회 평등의 전화""낳아라, 낳아라 이렇게 얘기는 하지만막상 임신했다고 하면 결코 환영받지 못하는일이 되는 거죠. 불이익을 당하지 않을까,계약직 같은 경우는 또 재계약을 할 수 있을까.""임신과 출산, 그리고여전히 여성들의 몫인 육아로 인한직장에서의 불이익은 여성들이 아이를 낳고직장생활을 병행하기 어렵게 하고,결국 일을 계속 원하는 여성들은출산을 기피하게 됩니다.◀ＳＹＮ▶ 박은주/결혼 3년째, 직장인""남편한테 물어본 적 있거든요.아이 없는 삶을 생각해본 적은 없냐고.아이는 있어야 된다는 생각은 들어요.그런데 이제 현실적으로나 감정적으로부담이 되니까 좀 미루고 있는데요.""낳기만 하면 국가가 길러준다는 건우리나라에선 너무 먼 이야기일까요.아이를 낳자고 캠페인을 벌이기에 앞서출산 기피의 원인을 파악하고실효성 있는 대책을 마련하는 일이더 중요해 보입니다.MBC 뉴스 김수진입니다.(김수진 기자 sj@imbc.com)[저작권자(c) MBC (www.imnews.com) 무단복제-재배포 금지]"
21,2009-06-26,"쌍용차 노·노 충돌사태, 밤샘 대치 돌입",https://news.naver.com/main/read.nhn?mode=LSD&mid=shm&sid1=101&oid=008&aid=0002167954,머니투데이,"[머니투데이 박종진·평택(경기)=김보형 기자][사측 공장 일부 점거, 팽팽한 긴장]↑ 파업에 참가하지 않은 쌍용차 직원들이 26일 오후 평택공장 정문 옆 쪽문으로 진입해 이를 막아서는 노조원들과 충돌을 빚고 있다. ⓒ임성균 기자옥쇄파업 36일째를 넘기고 있는 쌍용자동차 사태가 본격 충돌 국면으로 돌입한 가운데 '노·노 대치'가 일촉즉발의 상황으로 치닫고 있다.사측과 파업에 참여하지 않은 직원들이 공장 일부를 점거한데다 충돌을 막기 위한 경찰 공권력까지 투입돼 평택공장은 '노·노·사·경'이 어지럽게 뒤엉킨 형국이다.특히 쌍용차 노조를 지원하기 위해 수도권 일대 금속노조 소속 조합원들이 속속 현지로 모여들고 있고 민주노동당 의원 등 정치권도 가세해 상황은 다급히 돌아가고 있다.쌍용차 사측에 동조하는 직원들은 26일 오후 2시부터 공장 정문 옆 철조망 등을 뚫고 진입을 시도해 5시쯤 본관을 장악했다. 파업 중인 노조원 900여 명은 본관 뒤 도장 공장으로 집결해 전열을 가다듬고 있다. 이 과정에서 격렬한 충돌이 이어져 10여 명 이상이 다쳤다.경찰은 양측의 충돌을 막기 위해 5개 중대 500여 명을 본관과 도장 공장 사이에 배치했다.밤 9시가 가까워지자 사측 직원 1500여 명은 본관 일대에 노조원들이 사용하던 침구류를 가져다 취침  준비를 하는 등 '상주태세'에 들어갔다. 하루 새 본관의 주인이 바뀐 셈이다.오후 8시50분쯤에는 본관 뒤편 도로 위에 쌓아둔 타이어 더미에서 불길이 치솟았다. 사측과 노조는 서로 상대방이 불을 지른 것이라 주장했다.공장 밖도 긴장감이 감돈다. 정문 주위로는 사측의 용역직원들이 출입을 철저히 통제하고 있다. 사측과 면담을 요구하며 공장에 들어오려던 민주노동당 소속 권영길, 홍희덕, 이정희 의원도 정문 앞에서 막혔다.이들은 밤 9시 현재 정문 앞에서 쌍용차 가족대책위, 금속노조 소속 조합원 등 100여 명과 함께 집회를 진행하고 있다. 소방차와 구급차도 현장에 대기 중이며 평택경찰서장은 이들의 해산을 종용하고 나섰다.급박한 상황이지만 당장 추가적인 대규모 충돌이 일어나기는 힘들 것으로 보인다. 노조가 거점으로 삼고 있는 도장 공장은 시너나 페인트 등 각종 인화물질이 대규모로 쌓여 있어 경찰과 사측 모두 쉽게 진입하기 어렵다.업계 전문가는 ""팽팽한 대치와 크고 작은 충돌이 이어지겠지만 노사 양쪽이 '최후의 카드'를 뽑아들 내주 초가 고비가 될 것""이라고 내다봤다.앞서 쌍용차 사측은 이날 오전 정리해고 인원을 줄이는 내용을 골자로 한 최종 입장을 내놓았으나 노조가 기존 안과 다를 게 없다며 거부했다.사측은 이날 정리해고자 976명에 대해 분사 및 영업직 전환을 통한 일자리 제공 320명, 협력사와 연계 한 재취업 기회 제공 450명, 2012년까지 무급휴직 100명 등 총 870명의 일자리를 보장하겠다고 밝혔다. 나머지 100여 명에 대해서도 우선적으로 재고용을 추진한다는 입장이다.인력 감축 자체는 피할 수 없지만 부품사와 도급 등을 연계해 일자리는 마련해 주겠다는 방안이다. 3년간 월급을 받을 수는 없지만 고용을 유지하는 무급휴직과 정리해고자·희망퇴직자에 대한 재고용 방침도 제시했다.하지만 노조는 사측의 협의안을 거부했다. 분사나 협력사 취업 등으로 고용을 보장한다지만 회사를 떠난다는 맥락에서는 기존과 다르지 않다는 입장이다. 희망퇴직 역시 강제 퇴직의 성격을 띠고 있는 만큼 사실상의 정리해고 강행 방침은 변하지 않아 이를 받아들일 수 없다고 밝혔다.금속노조 쌍용차지부 관계자는 ""대주주 상하이차와 경영진의 책임문제는 건드리지 않고 노동자의 희생만 강요하는 방식은 여전하다""며 ""정부가 나서 문제를 해결해야 한다""고 주장했다.[관련기사]☞금속노조 평택으로 집결 중...심야 충돌 우려☞쌍용차, ""공장 상주하며 도장공장 진입""☞쌍용차 최후협상안 노조 거부, 노·노 충돌☞[슬라이드] ""정상조업""vs""함께살자"" 쌍용차 노노충돌모바일로 보는 머니투데이 ""5200 누르고 NATE/magicⓝ/ez-i""박종진·평택(경기)=김보형기자<저작권자 ⓒ '돈이 보이는 리얼타임 뉴스' 머니투데이, 무단전재 및 재배포 금지>"
22,2009-06-26,당·청 ‘사교육’ 질책에 교과부 ‘당혹’,https://news.naver.com/main/read.nhn?mode=LSD&mid=shm&sid1=100&oid=032&aid=0002017240,경향신문,"ㆍ“파격보다 신중으로 부작용 최소화해야”사교육 대책 마련의 주도권이 청와대와 한나라당으로 넘어가면서 교육과학기술부는 ‘꿔다 놓은 보릿자루’ 신세가 됐다. 미적지근한 교과부 사교육비 경감대책에 대해 ‘무사안일한 관료주의가 아니냐’는 질책과 비판이 이어지고 있어서다. 특히 사교육 대책의 총대를 새로 멘 곽승준 미래기획위원장과 정두언 한나라당 의원은 교과부를 직접 겨냥하며 비판하고 있다. 정 의원은 26일 토론회에 참석한 교과부의 한 간부에게 “심야학원 단속도 대통령 지적 이후에야 부랴부랴 나가지 않았느냐”고 쏘아붙였다.교과부는 당혹해하는 기색이 역력하다. 이달 초 이미 사교육비 경감대책을 발표한 뒤라 새로 정책을 마련할 시간과 기회를 모두 놓쳤다는 분위기다. 교과부 한 관계자는 “이미 우리로서는 내놓을 안을 다 내놨기 때문에 새로 발표할 계획은 없다”면서 “정책 추진에 있어 학생·학부모들에게 미칠 부작용을 최소화해야 하는 만큼 파격보다는 신중을 기해야 하지 않겠느냐”고 말했다. 또 다른 관계자는 “학교자율화 정책에 따라 권한 대부분을 이양받은 각 시·도교육청이 이행하는 것이 더 중요하다”며 “교과부는 팔다리가 없는데 몸통더러 달리기를 하라는 거나 마찬가지”라고 불만을 털어놨다.정치권에서 주도하는 사교육 대책에 대한 문제점도 제기되는 등 볼멘소리도 나오고 있다. 교과부 관계자는 “정 의원 안은 학교내신을 현행 상대평가에서 절대평가로 바꾸자는 것인데 그러면 내신 대비 사교육비는 줄어들지 몰라도 결국 공교육의 붕괴라는 엄청난 결과로 이어질 수 있다”고 말했다.교육계에서는 당·청의 극심한 불신이 향후 개각에 반영되지 않겠느냐는 얘기도 나오고 있다.<최민영기자 min@kyunghyang.com>[관련기사]▶ 다시 힘받는 곽승준·정두언案… MB 보조 맞추기▶ ‘사교육 경감’ 7대 긴급대책 핵심내용- 대한민국 희망언론! 경향신문, 구독신청(http://smile.khan.co.kr) -ⓒ 경향신문 & 경향닷컴(www.khan.co.kr), 무단전재 및 재배포 금지〈경향닷컴은 한국온라인신문협회(www.kona.or.kr)의 디지털뉴스이용규칙에 따른 저작권을 행사합니다.〉"
