,날짜,기사 제목,기사 링크,기사 출처,기사 내용
32,2009-06-26,수수료 비싼 인덱스펀드의 ‘굴욕’,https://news.naver.com/main/read.nhn?mode=LSD&mid=shm&sid1=101&oid=032&aid=0002017233,경향신문,"ㆍ수수료율 상위 10개 상품 수익률 ‘하위 10개’보다 낮아수수료율이 높은 인덱스 펀드가 수수료율이 낮은 인덱스펀드보다 오히려 수익률이 나쁜 것으로 나타났다.26일 펀드평가사 제로인에 따르면 지난 23일 현재 설정액이 10억원을 넘고, 코스피200지수를 추종하는 인덱스 펀드(102개)의 수수료율(선취·후취수수료 제외)과 수익률을 분석한 결과 수수료율 상위 10개 펀드의 수익률이 하위 10개 펀드보다 나쁜 것으로 집계됐다.상위 10개 펀드의 평균 수수료율은 2.18%로 연초이후 수익률은 21.23%, 1년 수익률은 마이너스 18.21%인 반면 하위 10개 펀드의 수수료율은 평균 0.19%로 연초이후 수익률은 22.40%, 1년 수익률은 마이너스 15.75%였다.코스피200 지수를 추종하는 인덱스 펀드 중 수수료율이 3.04%로 가장 높은 ‘하나USB엄브렐러뉴인덱스증권투자신탁K-1(주식-파생형)클래스C’의 연초이후 수익률은 20.28%, 1년 수익률은 마이너스 17.90%를 기록했다. 3년 수익률과 5년 수익률은 각각 10.91%와 84.39%였다. 반면 인덱스 펀드 중 수수료율이 0.12%로 가장 낮은 ‘한국투자크루즈F2.8인덱스증권투자신탁(주식-파생형)(A)’의 연초이후 수익률은 22.14%, 1년 수익률은 마이너스 15.75%로 집계됐다. 3년과 5년 수익률은 20.37%와 110.66%였다.자산운용업계에서는 수수료율이 높은 인덱스 펀드의 수익률이 낮은 것에 대해 “일반적으로 코스피200지수를 추종하는 인덱스 펀드는 수수료율이 높을수록 수익률에서 수수료율이 차지하는 비중이 커 수익률이 나빠질 수밖에 없다”고 지적하고 있다.자산운용업계 관계자는 “대부분의 인덱스 펀드는 코스피200지수보다 높은 수익률을 올리기 위해 주식매매나 차익거래를 더 많이 한다”며 “수익률을 높이려고 무리하게 주식매매를 하다보면 비용이 더 많이 들어 수익률이 떨어질 수 있다”고 말했다.<김주현기자 amicus@kyunghyang.com>- 대한민국 희망언론! 경향신문, 구독신청(http://smile.khan.co.kr) -ⓒ 경향신문 & 경향닷컴(www.khan.co.kr), 무단전재 및 재배포 금지〈경향닷컴은 한국온라인신문협회(www.kona.or.kr)의 디지털뉴스이용규칙에 따른 저작권을 행사합니다.〉"
33,2009-06-26,"軍, 北핵.미사일기지 정밀타격 능력구비-1",https://news.naver.com/main/read.nhn?mode=LSD&mid=shm&sid1=100&oid=001&aid=0002735440,연합뉴스,"<그래픽> 국방개혁안 원안과 수정안 비교    (서울=연합뉴스) 반종빈 기자 = 군당국은 26일 북한의 핵과 미사일을 최대한 차단, 억제한다는 계획에 따라 감시, 정찰, 정밀타격, 요격무기를 집중적으로 도입하기로 했다.    또 3천명 규모의 해외파병 상비부대를 편성하고 사이버공격과 방어임무가 가능한 정보보호사령부를 창설할 계획이다.    이상희 국방장관과 김태영 합참의장은 이날 오후 이런 내용을 골자로 한 '국방개혁기본계획' 수정안을 공식 발표했다. 이 안은 2020년을 목표로 2005년 수립된 '국방개혁기본계획'을 다듬은 것으로, 이명박 대통령의 재가를 거쳤다.    bjbin@yna.co.kr육.해.공, 발사징후 포착되면 北발사대.기지 타격부대 1천800개소→850개소 축소..국방개혁 수정안(서울=연합뉴스) 김귀근 이상헌 기자 = 군당국은 26일 북한의 핵과 미사일을 최대한 차단, 억제한다는 계획에 따라 감시, 정찰, 정밀타격, 요격무기를 집중적으로 도입하기로 했다.또 3천명 규모의 해외파병 상비부대를 편성하고 사이버공격과 방어임무가 가능한 정보보호사령부를 창설할 계획이다.이상희 국방장관과 김태영 합참의장은 이날 오후 이런 내용을 골자로 한 '국방개혁기본계획' 수정안을 공식 발표했다. 이 안은 2020년을 목표로 2005년 수립된 '국방개혁기본계획'을 다듬은 것으로, 이명박 대통령의 재가를 거쳤다.수정안은 ""북한의 비대칭(핵과 미사일) 위협을 적(북한) 지역에서 최대한 차단 및 제거하도록 감시.정찰, 정밀타격, 요격 능력을 확충하기로 했다""고 밝혔다.北핵.지하시설 파괴용 GBU-28 도입北핵.지하시설 파괴용 GBU-28 수십 발 도입    (서울=연합뉴스) 유사시 북한의 핵시설과 동굴 속 장사정포 등 지하군사시설을 뚫고 들어가 폭파시키는 레이저유도폭탄(GBU-28) 수십 발이 도입된다. 군 소식통은 2일 ""미국은 그간 전략무기로 분류해 국외 수출을 엄격히 통제했던 GBU-28 폭탄을 한국에 판매키로 최근 승인했다""면서 ""우리 군은 '2010~2014년 국방 중기계획'에 이 폭탄 구매계획을 반영했다""고 밝혔다. 사진은 공군이 지난 2003년 3월 `현대전의 항공무기 체계'란 책자를 통해 게재한 GBU-28. 2009.6.2이는 북한이 남한을 향해 핵무기와 미사일을 발사할 징후가 포착되면 선제타격도 가능하다는 개념으로, 이런 개념이 국방개혁안에 명시되기는 이번이 처음이다.군은 이와 관련, 보통 핵무기와 미사일은 발사준비→발사→피폭 등의 단계로 상대를 위협하기 때문에 감시.정찰→정밀타격→요격→방호 단계로 구분해 대응능력을 구비하기로 했다.즉 다목적 실용위성(아리랑2호 등)과 고(高)고도 무인정찰기 '글로벌호크', 금강(영상).백두(통신) 정찰기, 탄도탄 조기경보레이더 등으로 발사 징후를 탐지한 뒤 F-15K 전투기의 합동원거리공격탄(JASSM), 이지스함의 해상요격유도탄(SM-6), 지상의 패트리엇(PAC-2/3) 미사일 등을 이용해 발사대와 발사기지를 타격하고 날아오는 핵.탄도미사일을 요격한다는 것이다.또 군사분계선(MDL) 인근에 밀집배치된 북한의 170mm 자주포와 240mm 방사포 위협에 대응해서도 표적탐지→결심→타격 능력을 확충하기로 했다.무인정찰기(UAV)와 대포병탐지레이더, 차기탐지레이더, 특전팀 등을 통해 장사정포 발사 징후를 탐지하고 F-15K에 장착된 공대지미사일과 K-9 자주포, 차기다연장로켓, GPS 유도폭탄(JDAM), GBU-24(벙커버스터) 등으로 정밀타격한다는 것이다.(계속)<긴급속보 SMS 신청><포토 매거진>< M-SPORTS ><저작권자(c)연합뉴스. 무단전재-재배포금지.>"
34,2009-06-26,“죽을 자신 있나” 30대 남자 2명 목숨 건 내기,https://news.naver.com/main/read.nhn?mode=LSD&mid=shm&sid1=102&oid=028&aid=0002002312,한겨레,"[한겨레]15m 아래로 뛰어내려 한명 숨지고 한명 부상26일 새벽 0시30분께 경남 진주시 칠암동 진양교에서 동네 선후배 사이인 황아무개(38)씨와 박아무개(32)씨가 “죽을 자신이 있느냐”는 내기를 걸고 15m 아래 남강으로 뛰어내려, 황씨가 숨지고 박씨는 얼굴 등을 크게 다쳤다.현장을 목격하고 경찰에 신고한 최아무개씨는 “두 사람이 진양교 다리난간을 잡고 웃으면서 이야기하고 있어 대수롭지 않게 생각했는데, 갑자기 한 남자가 남강으로 뛰어내리자 3m 정도 옆에 있던 다른 남자가 잇따라 뛰어내렸다”고 밝혔다. 현재 진양교 부근 남강의 수심은 1m~50㎝에 불과해 비교적 얕은 곳에 떨어진 박씨는 목숨을 건질 수 있었다.박씨는 “전날 저녁부터 함께 술을 마신 뒤 진양교에 왔는데, 내가 황씨에게 ‘형님이 죽으면 나도 같이 죽을 자신이 있다’고 말하자, 황씨가 ‘나도 자신있다’라며 갑자기 뛰어내려 나도 따라서 뛰어내렸다”고 경찰에 진술했다. 경찰은 박씨와 목격자 등을 상대로 황씨가 다리에서 뛰어내린 정확한 이유를 조사하고 있다.창원/최상원 기자 csw@hani.co.kr세상을 보는 정직한 눈 <한겨레>  [한겨레신문 구독|한겨레21 구독]ⓒ 한겨레신문사, 무단전재 및 재배포 금지<한겨레는 한국온라인신문협회(www.kona.or.kr)의 디지털뉴스이용규칙에 따른 저작권을 행사합니다.>"
35,2009-06-26,쌍용차 평택공장 공권력 투입(1보),https://news.naver.com/main/read.nhn?mode=LSD&mid=shm&sid1=101&oid=001&aid=0002735380,연합뉴스,gaonnuri@yna.co.kr<긴급속보 SMS 신청><포토 매거진>< M-SPORTS ><저작권자(c)연합뉴스. 무단전재-재배포금지.>
36,2009-06-26,[경제안테나] 돈처럼 쓰는 '탄소캐쉬백' 일석이조,https://news.naver.com/main/read.nhn?mode=LSD&mid=shm&sid1=101&oid=055&aid=0000161965,SBS,"당산동에 사는 주부 안미선 씨.요즘 장을 보러가서 상품을 고를 때 탄소 캐쉬백 마크가 붙어있는 지를 꼭 확인합니다.[안미선/서울 당산동 : 포인트가 적립되니깐 좋은 거 같고 환경운동에도 참여할 수 있다고 하더라고요. 이왕이면 이런 제품 사보려고 해요.]이처럼 저 탄소배출 제품이나 친환경 제품을 구입하면, 현금처럼 사용할 수 있는 탄소 포인트가 주어지는데요.이른바 탄소 캐쉬백 제도입니다.온실가스를 줄이고 저 탄소문화를 확산하기 위해 도입한 이 제도는 지난달부터 시범운영에 들어갔습니다.[전호근/탄소캐쉬백 카드 관계자 : 탄소 캐쉬백 서비스는 소비자 입장에서 현금처럼 쓸 수 있는 경제적 혜택 부분과 손쉽게 참여할 할 수 있다는 감성적인 혜택부분이 있습니다. 소비자의 이런 움직임이 기업체로 하여금 온실가스 감축제품을  많이 생산하게끔 하는 유발 효과가 있을 것이라고 생각합니다.]포인트 금액은 판매가격의 일정비율로 정해지고 누적된 포인트는 전국 5만여 개 가맹점에서 현금처럼 사용할 수 있습니다.[남정현/경기도 과천 : 제가 탄소 캐쉬백 포인트를 5,000점을 모아서, 제가 좋아하는커피제품을 공짜로 사게 되니깐 기분도 좋고요. 현금대신 포인트를 쓰니까 당연히 경제적으로 도움이 된 거 같고요.]탄소캐쉬백 제도는 내년 초부터 본격적으로 시행되면서, 혜택이 더욱 늘어나게 되는데요.적립된 포인트로 지하철을 타거나, 영화 등 문화시설도 이용할 수 있게 됩니다.이산화 탄소는 줄이고 현금은 쌓이는 일석이조의 효과! 탄소캐쉬백!기존의 캐쉬백카드나 탄소캐쉬백 전용 카드만 있으면 누구나 포인트를 받아 사용할 수 있는데요.탄소캐쉬백 카드는 탄소캐쉬백 사이트(www.co2cashbag.com)나 국민은행에서 발급받을 수 있습니다.관/련/정/보◆ [경제안테나] 가짜 유기농 유아용품 '조심하세요!'◆ [경제안테나] ""우리집 관리비가 새고 있어요""◆ [경제안테나] 5만원권 유통, 우리 생활이 변한다◆ [경제안테나] 강북지역 집값 '나도 오른다' 들썩◆ [경제안테나] 보험 사기로 할증된 보험료 환급[SBS기자들의 생생한 취재현장 뒷이야기 '취재파일']저작권자 SBS&SBSi 무단복제-재배포 금지"
37,2009-06-26,폭염특보 사흘째 계속…대구 35.3도,https://news.naver.com/main/read.nhn?mode=LSD&mid=shm&sid1=102&oid=001&aid=0002735346,연합뉴스,"""앗! 차가워""(대구=연합뉴스) 이재혁 기자 = 연일 계속되는 폭염으로 26일 대구지역의 낮 최고기온이 섭씨 35.3도까지 올라간 가운데 엄마와 함께 2.28운동기념공원에 산책나온 어린이들이 분수의 물방울을 맞으며 더위를 식히고 있다. 2009.6.26yij@yna.co.kr장마 28∼30일 이어질 듯(서울=연합뉴스) 국기헌 기자 = 고기압의 영향으로 남부지방을 중심으로 사흘째 폭염특보가 내려졌다.26일 기상청에 따르면 전국이 고기압의 가장자리에 들면서 대부분 지역의 낮 최고 기온이 30도를 웃돌았다.이날 대구의 낮 최고기온이 35.3도까지 올랐으며 울산 34.2도, 상주 34.2도, 강릉 34도, 원주 31.6도, 영월 32.2도, 동해 34.5도, 청주 32.1도, 전주 33.3도, 광주 33.3도를 기록했다.오후 4시 현재 전라남도와 경상남북도 일부 지역, 대구ㆍ울산광역시에 폭염주의보가 발효 중이다.기상청은 북상하는 장마전선의 영향으로 27일 남부지방에 흐리고서 비가 오겠고, 중부지방은 고기압의 가장자리에 들면서 대기 불안정으로 소나기가 오는 곳도 있을 것으로 전망했다.기상청은 현재 발효 중인 폭염특보는 이날 오후 늦게 모두 해제되겠지만, 폭염주의보가 해제되더라도 고기압의 영향권에 있는 27일까지는 낮에 내륙과 동해안 지방에서 30도 내외의 무더운 날씨가 이어지는 곳도 있겠으니 건강관리에 유의해 달라고 당부했다.기상청은 장마전선이 27일 제주도 부근 해상까지 북상해 제주도와 남부지방에 영향을 주기 시작해 28일 밤 전국으로 확대되고 30일까지 이어질 것으로 예보했다.penpia21@yna.co.kr[관련기사]▶ 울산 34.2도..최고기온 경신(종합)▶ <""덥다 더워!""..대구.경북 폭염 사흘째>▶ `더 뜨거워진 경남'..사흘째 폭염주의보▶ <내일날씨> 장마전선 북상…제주.남부 비▶ <주말날씨> 장마 북상…남부지방부터 비<긴급속보 SMS 신청><포토 매거진>< M-SPORTS ><저작권자(c)연합뉴스. 무단전재-재배포금지.>"
38,2009-06-26,3초만에 차 문 ‘톡’… 내비게이터 200개 슬쩍,https://news.naver.com/main/read.nhn?mode=LSD&mid=shm&sid1=102&oid=021&aid=0001997723,문화일보,"전국을 무대로 차량용 내비게이터와 현금 등을 훔쳐 온 차량털이 일당이 경찰에 붙잡혔다.서울지방경찰청 광역수사대는 26일 서울, 대전 등 전국을 돌아다니며 200여차례에 걸쳐 차량용 내비게이터와 노트북컴퓨터, 현금 등을 훔쳐 온 혐의(특정범죄가중처벌법상 절도)로 정모(30)씨 등 3명과 이들로부터 내비게이터 등을 헐값에 매입해 유통시켜 온 혐의(장물취득)로 김모(30)씨 등 7명을 붙잡아 정씨와 김씨 등 4명을 구속하고 6명을 불구속 입건했다.동네 선후배 사이로 이뤄진 정씨 일당은 지난 1월부터 플라스틱 자로 주차돼 있는 차량의 문을 여는 수법을 통해, 200여대의 차량에서 1억2000만원 상당의 금품을 훔쳐 온 혐의를 받고 있다. 서울의 유명 전자상가 중도매상인 김씨 등은 정씨 일당이 훔친 내비게이터와 노트북컴퓨터 등 200여점의 장물을 시가의 10% 수준에 매입한 뒤 되팔아 6000만원 상당의 부당이득을 챙겨 온 혐의를 받고 있다.경찰은 정씨가 지난 2005년 카센터 직원으로 일하면서 50㎝ 길이 플라스틱 자를 이용해 단시간 안에 흔적 없이 차량 문을 따는 방법을 배운 뒤 전문 차량절도범으로 나섰다고 전했다. 중도매상 김씨는 정씨 일당에게 “I사의 내비게이터가 고가이며 고객들에게 인기가 좋다”고 말해 정씨 등이 이를 집중적으로 훔치도록 한 것으로 전해졌다.채현식기자 hschae@munhwa.com[Copyrightⓒmunhwa.com '대한민국 오후를 여는 유일석간 문화일보' 무단 전재 및 재배포 금지(구독신청:02)3701-5555)]"
39,2009-06-26,"쌍용차 평택공장 勞-勞 충돌, 부상자 계속 늘어(4보)",https://news.naver.com/main/read.nhn?mode=LSD&mid=shm&sid1=102&oid=079&aid=0002069886,노컷뉴스,"임직원 3천여 명 진입, 쇠파이프 등에 맞아 노조원 6명 병원행[CBS사회부 최선욱 기자]출근투쟁을 벌이고 있는 쌍용차 임직원 3천여 명이 공장에 진입해 점거 파업 중인 노조원들과 충돌했다.진입하는 과정에 점거 농성 중인 노조원들이 휘두르는 쇠파이프에 맞아 직원 6명이 부상을 입어 119구급차에 실려 병원으로 후송됐다.쌍용차 직원 3천여 명은 26일 오후 1시40분쯤  평택공장 정문 인근 기숙사 옆 쪽문을 통해 공장안으로 진입해 이 시간 현재(오후 3시50분)공장 내 본과 건물 앞에서 점거파업 중인 노조원들과 대치하고 있다.직원들은 지게차 4대를 동원에 정문에 쳐져있던 바리케이트를 철거하고 있으며, 굳게 잠겨있던 자물쇠를 제거하고 있다.쌍용차 직원들은 '옥쇄파업철회' '정상화 촉구'등을 외치고 있으며 본관 앞에는 점거 농성을 벌였던 노조원들이 봉고차와 승용차등 차량을 이용해 임시 바리케이트를 치고 대치를 벌이고 있다.경찰은 21개 중대는 평택공장 기숙사 부근에 일제히 집결해 있으며, 아직은 사태를 관망하고 있다.쌍용차 관계자는 ""정문 옆 주차장 쪽문을 통해 직원들이 공장안으로 서로 팔을 끼고 '비폭력'을 외치며 진입하는 과정에서 점거 농성중인 노조원들과 충돌이 빚어져 부상자가 발생했다""고 말했다.swc5864@cbs.co.kr[관련기사]●쌍용차노조 ""결국 다 나가라는 것""…최종안 수용 거부●쌍용차 대책위 ""노조원끼리 싸우지 말자""●쌍용차 비해고 노동자 공장진입 잠정유보●민노총, '노동계 하투 동력 상실' 일부 전망 정면 반박●쌍용차노조, 법정관리인 2명 '살인 혐의'로 고발키로(대한민국 중심언론 CBS  뉴스FM98.1 / 음악FM93.9 / TV CH 412)<저작권자 ⓒ CBS 노컷뉴스(www.nocutnews.co.kr) 무단전재 및 재배포 금지 >"
40,2009-06-26,비정규직법 막판 진통..노동계  법 유예  강력 반대,https://news.naver.com/main/read.nhn?mode=LSD&mid=shm&sid1=100&oid=014&aid=0002159219,파이낸셜뉴스,"비정규직법 개정을 둘러싸고 여야간, 노정(勞政)간 의견차가 여전해 법 적용을 불과 5일을 앞두고 있는 26일까지 진통을 거듭하고 있다.국회 환경노동위원회 간사 3명과 양대 노총 대표 등 ‘5인 연석회의’는 이날 오후 비정규직법 개정을 놓고 일괄타결을 시도했으나 난항을 겪었다.여야는 법 시행 유예 기간과 정규직 지원 예산 규모를 연계, 주고 받는 방식의 협상안이 나온 상태다. 그러나 노동계는 법 시행 유보 자체를 반대하고 있어 뚜렷한 입장차를 보이고 있다.한나라당은 현재 ‘비정규직 사용기간 2년’ 규정을 3년 유예하는 법안을 제출해 놓은 상태다. 그러나 5인 연석회의가 진행되면서 유예기간을 2년으로 줄이고, 내년도 정규직 전환지원금을 5000억원에서 1조원으로 늘리는 협상안을 제시한 것으로 알려졌다.반면 민주당은 유예기간 6개월, 정규직 전환지원 예산 향후 3년간 3조000억원을 주장하고 있고 선진과창조모임은 1년 6개월의 유예기간을 제시한 것으로 전해졌다.비정규직 개정 논의가 금명간 합의에 이르지 못할 경우 오는 29일로 예정된 본회의에서 법안 처리를 둘러싼 여야간 긴장이 극도로 높아질 것으로 보인다.한나라당 안상수 원내대표는 단독 강행처리 가능성과 관련, “이달 내에 처리돼야 한다는 당위는 갖고 있지만 현실적으로 처리되기 어렵다”고 말했다.개정안이 상임위 논의를 거치기 어려운 현실에서 7월1일 이전에 개정안을 통과시키려면 국회의장의 직권상정과 한나라당의 단독 표결처리라는 초강수를 동원해야 하기 때문이다.민주당 정세균 대표는 이날 확대간부회의에서 “비정규직의 정규직 전환을 도우면서 현행법을 이행하는 것이 답”이라면서도 “5인 연석회의에서 합의가 이뤄진다면 기존방침이 있지만 그 합의를 존중할 것”이라고 강조했다.양대노총은 정치권이 유예 기간을 놓고 협상을 벌이는 것에 대해 강력 반발했다.민주노총과 한국노총은 이날 국회 환경노동위원회 소회의실에서 비정규직법 유예 시도 규탄 공동기자회견을 갖고 추미애 환경위원장을 면담, 법 시행 유예에 대해 반대의 뜻을 전달했다.양대 노총은 “비정규직법과 미디어법 등에 대한 정치적 거래를 위해 ‘5인 연석회의’와 노동계를 활용하려는 일각의 움직임을 강력하게 규탄한다”면서 “5인 연석회의 차원의 합의를 거부하고 법개정을 강행한다면 이는 온전히 여야 3당의 책임이 될 것”이라고 강조했다.이어 “‘시행유예’와 ‘정규직화 전환 기금 지원’은 동시에 실현될 수 없는 모순된 내용”이라면서 “비정규직에게 아무런 도움이 되지 못하는 최악의 결정이 될 것”이라고 밝혔다.또 장석춘 한국노총 위원장과 민주노총 임성규 위원장은 추미애 위원장에게 비정규직법 시행유예 시도 규탄 및 올바른 비정규직법 개정을 위한 한국노총-민주노총 공동서한을 전달했다./khchoi@fnnews.com최경환기자※ 저작권자 ⓒ파이낸셜뉴스. 무단 전재-재배포 금지[☞ First-Class경제신문 파이낸셜뉴스 구독신청하기]"
41,2009-06-26,"한, `6월국회 미디어법'처리 당론확정",https://news.naver.com/main/read.nhn?mode=LSD&mid=shm&sid1=100&oid=001&aid=0002735244,연합뉴스,"29일 미디어법 최종안 결정..`5대 서민법안' 선정(서울=연합뉴스) 김종우 기자 = 한나라당은 26일 최대 쟁점인 미디어 관련법을 이번 임시국회에 처리키로 당론을 확정했다.한나라당은 이날 오후 국회에서 열린 의원총회에서 이같이 방침을 정하고 미디어법을 어떤 내용으로 처리할지에 대해서는 해당 상임위인 문화체육관광방송통신위에 일임하기로 했다고 조윤선 대변인이 전했다.조 대변인은 ""오는 29일(월) 한나라당 문방위 위원들이 회의를 열어 한나라당 개정안과 자유선진당 개정안, 미디어발전위원회가 제안한 사항 등을 검토, 최종안을 확정할 것""이라고 말했다.문방위 간사인 나경원 의원은 보고에서 ""현재 지상파방송 3사의 보도는 최대 점유율이 68%""라며 ""5공화국 시절 강제적 언론사 통폐합으로 이런 독과점 체제가 탄생했으며, 낙후성을 개선하기 위한 게 미디어 관련법""이라고 설명했다.한나라당은 또 이번 임시국회에서 처리할 `서민살리기 5대 법안'으로 재래시장 및 상점가 육성을 위한 특별법, 여신전문금융업법, 전기통신사업법, 할부거래에 관한 법률, 대부업 등의 등록 및 금융이용자 보호법 등을 선정했다.조 대변인은 ""서민살리기 5대 법안은 도.소매점포 밀집지역을 `상권활성화 지역'으로 지정하고 중소가맹점 수수료 상한제 도입, 통신요금 인하 유인책 제공, 불법 대부업자에 대한 제재 강화 등이 포함됐다""고 말했다.jongwoo@yna.co.kr[관련기사]▶ 6월국회, 임시회 회기 시작..입법 대치▶ <진보정당, `6월국회 대치' 입지 고심>▶ <전직 국회의장들 `6월국회 공전' 질타>▶ <6월국회 정상화 불투명..핵심 쟁점은>-1▶ <6월국회 정상화 불투명..핵심 쟁점은>-2<긴급속보 SMS 신청><포토 매거진>< M-SPORTS ><저작권자(c)연합뉴스. 무단전재-재배포금지.>"
