,날짜,기사 제목,기사 링크,기사 출처,기사 내용
0,2009-06-26,연기 뒤덮인 쌍용자동차 평택공장,https://news.naver.com/main/read.nhn?mode=LSD&mid=shm&sid1=101&oid=001&aid=0002735661,연합뉴스,(평택=연합뉴스) 신영근 기자 = 26일 밤 비해고 직원과 파업 노조원이 대치하고 있는 경기도 평택 쌍용자동차 평택공장 야외 타이어에 불이 붙어 공장 전체가 시꺼먼 연기에 휩싸여 있다. 2009.6.26drops@yna.co.krhttp://blog.yonhapnews.co.kr/geenang<긴급속보 SMS 신청><포토 매거진>< M-SPORTS ><사진구매><저작권자(c)연합뉴스. 무단전재-재배포금지.>
1,2009-06-26,차 문 여는데 10초…순식간에 내비게이션 '슬쩍',https://news.naver.com/main/read.nhn?mode=LSD&mid=shm&sid1=102&oid=055&aid=0000161988,SBS,"<8뉴스><앵커>차량용 내비게이션을 전문적으로 털어온 일당이 경찰에 붙잡혔습니다. 차문을 여는데 10초면 충분했습니다.김수영 기자입니다.<기자>경기도 광주의 한 주택가입니다.주차된 차량들 사이로 남자 2명이  두리번거리며 돌아다닙니다.이들은 잠시 뒤 손에 무언가를 든 채 황급히 달아납니다.경찰이 붙잡고 보니 손에 든 것은 차량용 내비게이션.이날 불과 2시간동안에 10여 대를 훔친 것으로 조사됐습니다.간단한 도구 하나로 문을 여는데 10초도 채 걸리지 않았습니다.경보장치가 없고,  특정 업체의 내비게이션을 단 차량이 범행 표적이 됐습니다.이 제품의 경우 업그레이드가 비교적 쉬워 중고 시장에서 인기가 높기 때문입니다.[내비게이션 판매업자 : 아이디가 하나 있으면 일종의 피라미드식으로 다 업그레이드가 가능하죠.]지난 다섯달 동안 전국에서 훔친 내비게이션이 200여 대, 시가로 1억 원 어치나 됩니다.[정 모 씨/절도 피의자 : 카센터에서 일을 배워서 이렇게 일할 수 있게 됐습니다.]경찰은 내비게이션을 훔쳐온 혐의로 정 모 씨 등 4명을 구속하고 이들로부터 제품을 구입해  되팔아온 혐의로 6명을 입건했습니다.김수영swim@sbs.co.kr관/련/정/보◆ 여인숙 화재로 5명 사망…목조건물로 피해 커져◆ '벼룩의 간을…' 극빈층 울린 건강식품◆ 스크린도어와 열차 사이에 끼어 숨지는 '참변'◆ ""어! 사람이 탔네"" 남의 차 긁다 붙잡혀◆ 고교 담임이 여학생 성희롱 의혹…'징계'[SBS기자들의 생생한 취재현장 뒷이야기 '취재파일']저작권자 SBS&SBSi 무단복제-재배포 금지"
2,2009-06-26,"내 아이와 함께하는 시간, 선택과 집중이 중요",https://news.naver.com/main/read.nhn?mode=LSD&mid=shm&sid1=103&oid=055&aid=0000161996,SBS,"<8뉴스><앵커>연중 기획 시리즈 '가족이 희망이다.' 오늘(26일)은 비록 많은 시간을 아이와 함께 보내지 않더라도 선택과 집중을 통해 친밀감을 높일 수 있는 방법을 소개합니다.심우섭 기자입니다.<기자>태어난지 6주된 갓난 아기입니다.엄마가 눈 앞에서 웃어보이자 금방 반응을 보이지만 엄마가 조금만 멀리 떨어져도 눈을 맞추지 못합니다.생후 3개월 이전의 아기는 시력이 완전하지 않아 25~30cm밖에 볼 수 없습니다.이 때문에 갓 태어난 아기일수록 엄마 품에서 자라야 정서적인 교감을 나눌 수 있게 됩니다.[윤승백/내과전문의 : 아이의 시력은 만 1세에 0.2 정도, 만 4~6세가 되서야 정상성인의 시력에 도달하게 됩니다. 그러므로 아이의 시력발달 과정을 감안해서 의사소통을 하는 것이 좋습니다.]시력이 완성된 뒤에도 아이와 함께 지내는 것이 좋지만 그럴 수 없는 맞벌이 엄마들은 짧으면서도 질높은 교감의 시간을 갖는 것이 중요합니다.화장품 회사에 다니는 맞벌이 주부 이선필 씨는 네살배기 딸 유진이 얼굴을 밤 늦게서야 봅니다.몸은 피곤하지만 이때부터가 모녀간의 본격적인 놀이 시간입니다.하루 한두시간에 불과하지만 이 시간만은 전적으로 아이에게 집중합니다.[이선필/맞벌이 주부 : 어떻게 하면 더 아빠, 엄마와 더 친해질 수 있을지에 대한 친밀도 같은 것을 요즘 생각을 많이 하고, 고민을 많이 하고 있죠.]미 하버드 의대 블레이 즐튼 교수는 영·유아들이 하루 24시간 가운데 고작 두어시간 동안만 또렷한 정신 상태를 보인다는 연구 결과를 내놨습니다.이 시간이 이른바 골든 타임입니다.대부분의 아이들은 골든 타임을 부모와 함께하는 시간에 맞추고, 또 기다린다는 사실도 밝혀졌습니다.[조 벽/동국대 교수 : 아이가 기다리지 않는 것처럼 보이더라도 사실상 그걸 바라요. 어느 때 오면 부모가 온다, 이런 기대감을 느끼게 해주고, 실망하지 않도록 해주고… ]결국 부모가 자녀와의 정서적 교감을 높이기위해선 아이들과 함께 하는 시간도 선택과 집중이 필요하다고 전문가들은 조언합니다.심우섭shimmy@sbs.co.kr관/련/정/보◆ 부모와 떨어져 지낸 아이, 어떤 문제 일으키나?◆ 첫 2년 '엄마 사랑' 중요한데…우리 아기들은..?◆ ""믿고 맡길 곳 없어""…어쩔 수 없는 선택 '보모'◆ ""하루 30분만 투자해도..""…부부관계 리모델링◆ '부모 이혼' 후유증은?…3대까지 영향 미친다[SBS기자들의 생생한 취재현장 뒷이야기 '취재파일']저작권자 SBS&SBSi 무단복제-재배포 금지"
3,2009-06-26,4세용 휴대폰 출시…英서 위해성 논란,https://news.naver.com/main/read.nhn?mode=LSD&mid=shm&sid1=104&oid=081&aid=0002022176,서울신문,"[서울신문 나우뉴스]4세 어린이를 위한 휴대전화기가 출시됐지만 일각에서는 어린이들의 건강과 동심을 위협한다며 판매 금지를 주장하고 나섰다.영국의 휴대전화기 제조사는 최근 어린이들이 사용할 수 있는 휴대전화기 파이어플라이(Firefly)를 개발해 아일랜드에서 먼저 출시했다.어린 아이들이 쓰는 만큼 전화기에는 엄마(Mom), 아빠(Dad) 등 버튼이 5개만 있을 정도로 조작이 간편할 뿐만 아니라 장난감처럼 아기자기한 디자인을 자랑한다.17만원이 넘는 가격이지만 출시되자마자 7000대가 넘게 팔리고 문의전화가 쇄도했다. 제조사는 이 분위기를 몰아 연말에는 아일랜드 보다 더 큰 시장인 영국에 진출하겠다는 계획을 밝혔다.이에 일부 영국인들은 휴대전화기에서 나오는 전자파가 어린이들 건강에 악영향을 미치며 어렸을 때부터 전자기기를 사용하는 것은 동심을 파괴한다며 휴대전화 판매를 반대했다.로리 챌리스 아동학 교수는 “겉으로는 아이들을 위하는 것이지만 휴대전화기로 통화를 할 때 전자파가 나와 위험하다. 또 어린 아이들이 불법 음란전화에 피해를 입을 위험성도 있다.”고 우려했다.이에 대해 제조사는 “부모가 모르는 번호의 수신을 차단하는 기능이 있기 때문에 걱정할 필요가 없으며 아이들이 위급할 때 전화로 도움을 요청할 수 있어 유용하다.”고 안심시켰지만 비판 여론은 가라앉지 않고 있다.한편 한 리서치 회사에 따르면 영국에서 6~9세 어린이가 휴대전화를 사용하는 비율이 절반이 넘고 휴대전화를 사용하는 10~14세 어린이 비율은 85%에 이를 정도로 어린이 휴대전화 사용은 이미 심각한 수준이다.프랑스 의회는 어린이들이 무분별하게 휴대전화를 사용하는 것을 막고자 6세 이하의 어린이에게 휴대전화기 판매를 금지하고 12세 어린이들에게 휴대전화기 광고를 하지 못하게 하는 법안을 제출했다.서울신문 나우뉴스 강경윤기자newsluv@seoul.co.kr나우뉴스 공식 SNS 계정: 트위터http://twitter.com/SEOUL_NOWNEWS별난 세상 별난 뉴스(nownews.seoul.co.kr) [서울신문 나우뉴스 통신원 모집] [신문 구독신청]- Copyrights ⓒ서울신문사. 무단 전재 및 재배포 금지 -"
