,날짜,기사 제목,기사 링크,기사 출처,기사 내용
0,2012-03-28,4대강 달성·고령보 ‘뚝 부러질듯’ 위태,https://news.naver.com/main/read.nhn?mode=LSD&mid=shm&sid1=101&oid=028&aid=0002135877,한겨레,"[한겨레]국토부 보강 단면도 보니 ‘콘크리트 채움’ 언급4대강조사위 ““4곳 침하…주저앉을 가능성”정부, 16개 보 특별 점검뒤 “문제없다” 말만4대강 16개 보에 대한 특별점검을 해온 정부가 28일 “안전에 전혀 문제가 없다”는 결론을 내렸다. 그러나 보 본체의 안전에 직접적인 영향을 끼칠 수 있는 ‘물받이공’의 침하 우려가 제기되고, 수문 이상과 균열이 추가로 발견되는 등 안전성 논란은 그치지 않고 있다.환경단체와 학계로 구성된 4대강조사위원회는 이날 국회 의원회관에서 기자회견을 열어 지난 1일부터 26일까지 벌인 제5차 4대강 전수조사 결과를 발표했다. 이들은 기자회견에서 “달성·칠곡·강정고령·구미보 등 4개 보에서 물받이공이 침하 또는 하부 세굴이 됐고, 합천·함안보 등 2개 보에서는 침하가 의심된다”고 밝혔다.물받이공은 보의 본체와 연결된 구조물로, 물받이공의 구조에 이상이 생기면 최악의 경우 보 본체가 넘어질 수 있다. 박창근 관동대 교수(토목공학)는 “최근 국토해양부가 내놓은 달성보와 강정고령보의 보완공사 설명자료를 보면 물받이공 아래를 콘크리트로 채워놓는 보강공사를 한다고 돼 있다”며 “보가 주저앉을 수도 있는 치명적인 구조적 결함이 발생했다고 볼 수 있다”고 주장했다.조사위는 4대강 보에 이미 안전성 우려가 현실화하고 있다고 지적한다. 지난해 낙동강의 대부분 보에서 균열과 누수가 발견된 데 이어 이번 조사에서는 영산강 승촌보에서도 발견됐다. 조사위는 “승촌보 수문 하단의 콘크리트 블록이 가라앉고 수직이음새가 어긋나거나 벌어지는 현상이 발견됐다”고 밝혔다. 4대강조사위는 “한겨울 영하 날씨에 공사를 강행하고 작업자의 집중도가 떨어지는 야간공사까지 했기 때문”이라며 “콘크리트 파손과 누수는 16개 보 가운데 12개 보에서 확인됐다”고 말했다.환경단체는 이러한 보의 문제를 안전성에 영향을 끼치는 ‘중대 결함’으로 보고 있다. ‘시설물 안전관리에 관한 특별법’은 △콘크리트 파손 및 누수 △기초 지반 누수 및 세굴 △수문 작동 불량 등을 댐 시설의 중대 결함으로 규정하고 있다. 4대강조사위가 시설물안전관리법에 근거해 매긴 16개 보의 안전등급을 보면, 상주·낙단·세종·백제보 등 4개 보는 D등급(미흡)이고 구미·칠곡·강정·달성·합천·함안·승촌보 등 7개 보는 E등급(불량)에 해당된다. 조사위는 “수평 방향의 보 누수는 간과할 문제가 아니며 이를 고려해 설계했는지를 확인해야 한다”고 강조했다.그러나 국토부는 “별문제가 없다”는 태도다. 국토부 4대강 특별점검단은 이날 기자회견에서 “4대강 현장을 집중 점검한 결과 16개 보의 구조적 안전에는 전혀 문제가 없으나 하상 세굴, 지천 합류부 하상변동, 어도 등에서 일부 보완이 필요한 것으로 나타났다”고 발표했다. 국토부는 “그동안 반대단체에서 의혹을 제기했던 사항들에 대해 철저히 검증했다”며 “불필요한 논란이 해소될 것으로 기대한다”고 덧붙였다. 4대강 특별점검단은 결성 당시 4대강 찬성인사 위주로 구성돼 민관 합동이라는 취지를 살리지 못했다는 비판을 받았다.물받이공 침하 문제에 대해 국토부 4대강추진본부의 안시권 기획국장은 “낙동강 일부 보에서 침하 우려가 있어 보완공사를 했지만 지금은 아무 문제가 없다”고 말했다. 윤세의 4대강특별점검단장(경기대 교수)은 “이번 점검에서 물받이공 침하를 발견하지 못했다”며 “만약 많이 침하가 됐다면 보 구조물 안전성과 직접 연결되는 심각한 문제로 추가 조사가 필요하다”고 말했다. 윤 단장은 보 누수에 대해서는 “이음부 누수는 있을 수 있는 일로 보 안전성에는 아무 문제가 없다”고 주장했다. 남종영 박영률 기자ylpak@hani.co.kr<한겨레 인기기사>■4대강 달성·고령보 위태…“주저앉을 가능성”■방문진, 김재철 해임안 부결…노조 “청와대 거수기”■라면 좋아하는 남자는 섹스도 좋아해?■삼성가 상속분쟁 이창희쪽도 가세■4.19kg 셋째딸, 쳐다보기 싫었다공식 SNS[통하니][트위터][미투데이]| 구독신청[한겨레신문][한겨레21]Copyrights ⓒ 한겨레신문사, 무단전재 및 재배포 금지<한겨레는 한국온라인신문협회(www.kona.or.kr)의 디지털뉴스이용규칙에 따른 저작권을 행사합니다.>"
1,2012-03-28,"""점장과 잘 아는데…"" 꽃미남 편의점 털이 황당",https://news.naver.com/main/read.nhn?mode=LSD&mid=shm&sid1=102&oid=055&aid=0000224855,SBS,"<앵커>편의점 아르바이트생을 속여서 편의점 금고에서 돈을 빼 간 20대 남성이 경찰에 붙잡혔습니다. 준수한 외모에 고급 차를 타고 다니면서 편의점 사장과 잘 아는 사이라는 말로 의심을 피했습니다.장훈경 기자입니다.<기자>고급 승용차를 타고 온 남성이 편의점에  들어옵니다.큰 목소리로 점장과 통화하는 시늉 끝에 돈을 빌려 가라는 허락을 받았다며 아르바이트생을 속였습니다.받아간 돈은 76만 원, 실은 점장과는 일면식도 없는 사이였습니다.[피해 아르바이트생 : 사장이랑 잘 아는 사이라고 (전화)번호도 알고…그 당시에는 막상 당하니까 잘 몰랐어요. 너무 자연스럽게 행동하니까.]남성은 시가 1억 원에 가까운 고급 승용차만 빌려 탔는데 범행을 할 때면 늘 편의점 바로 앞에 차를 두고 들어와 아르바이트생의 의심을 피했습니다.경찰에 붙잡힌 25살 안 모 씨는 이런 수법으로 재작년 7월부터 최근까지 수도권 일대 편의점 30여 곳에서 천 200여만 원의 돈을 받아 챙겼습니다.[안모 씨/피의자 : (아르바이트생들이) 의심을 하면서도 점장님과 통화됐다고 생각해서 준 것 같습니다.]경찰은 공채 탤런트 시험 최종면접까지 올라갔을 정도로 준수한 외모의 안씨가 여성 3명으로부터 결혼을 빙자해 수천만 원을 받아 가로챈 혐의도 포착하고 여죄를 추궁하고 있습니다.(영상취재 : 홍종수, 영상편집 : 주용진)장훈경rock@sbs.co.kr관/련/정/보◆ 퍽치기, 날치기, 절도가 생활…상습범 입건◆ 경찰, 훔친 차량으로 편의점 상습 절도 20대 검거◆ 출소 후 범행지역 찾아 절도 행각 벌인 50대 검거◆ '3남매 치사' 범행 방법 알려준 40대 여성 영장 신청☞[SBS기자들의 생생한 취재현장 뒷이야기 '취재파일']☞ SBS뉴스 공식 SNS [SBS8News 트위터] [페이스북] [미투데이] [요즘]저작권자 SBS&SBS콘텐츠허브 무단복제-재배포 금지"
2,2012-03-28,‘염산 테러’ 파키스탄 여성 끝내 자살,https://news.naver.com/main/read.nhn?mode=LSD&mid=shm&sid1=104&oid=032&aid=0002205463,경향신문,"염산테러 전후의 파크라 요누스10여년 전 남편에게 염산 테러를 당한 뒤 수십번 수술을 받으며 삶의 의지를 불태워온 파키스탄 여성 파크라 요누스(33)가 끝내 목숨을 끊었다. 지난 17일 이탈리아 로마에서 투신 자살한 요누스의 시신이 파키스탄으로 옮겨지면서 격렬한 논쟁을 불러일으키고 있다고 AP통신이 28일 보도했다.요누스가 남편 빌랄 카르를 처음 만난 곳은 파키스탄 남부 카라치의 홍등가였다. 요누스는 그곳에서 무희로 일했다. 카르는 30대 중반으로, 아버지는 파키스탄에서 가장 큰 펀자브주 지사였다. 요누스는 10대 후반이었지만 가족의 가장이었다. 그는 부유한 카르의 4번째 부인이 되기로 결심했다.이들의 결혼생활은 3년밖에 지속되지 못했다. 남편의 폭력과 욕설을 견디지 못한 요누스는 친정집으로 도망쳤다. 2000년 5월, 남편은 한밤중 요누스를 찾아와 자고 있는 그의 몸에 염산을 부었다.요누스의 지옥 같은 투쟁이 시작됐다. 그는 남편과의 법정투쟁뿐만 아니라 자신과도 싸워야 했다. 얼굴 전체가 녹아내려 숨 쉴 코도 사라졌다. 일부만 남은 입에 꽂힌 빨대가 유일한 숨구멍이었다. 다행히 국제사회의 관심이 집중되면서 남편을 비난하는 목소리는 커져갔다. 남편은 이름이 같은 다른 남성이 요누스를 공격했다고 주장했다. 명망가의 자제인 카르는 무죄 선고를 받았고, 파키스탄 정부는 요누스를 이탈리아로 보냈다. 그곳에서 요누스는 이탈리아 정부의 도움으로 39차례 수술을 받았다.올해 2월, 요누스는 행복했다. 아카데미상 시상식에서 염산 테러를 당한 파키스탄 여성들의 삶을 다룬 파키스탄 영화 <세이빙 페이스>가 단편 다큐멘터리상을 탔기 때문이다. 그러나 영화 속에서 자신이 언급되지 않자 잊혀진 것이 아닐까 두려움에 떨기 시작했다.지난 17일, 요누스는 치료를 받던 6층 건물에서 뛰어내려 목숨을 끊었다. 그를 도운 여성운동가는 “요누스는 의지할 정의가 없다는 데 절망했다”고 말했다.남편 카르는 요누스의 자살 이후 TV 방송 인터뷰에서 그가 부상 때문이 아니라 생활고 때문에 죽은 것이라고 주장하며 자신을 그만 괴롭히라고 말했다.파키스탄 여성인권단체 아우라트재단은 지난해 파키스탄에서 자행된 염산 테러를 포함해 여성에 대한 인권침해 행위는 8500건이 넘었다고 밝혔다. 이 통계는 언론 보도를 토대로 추정한 것이어서 실제로는 더 많을 것으로 보인다.<배문규 기자 sobbell@kyunghyang.com>경향신문 ‘오늘의 핫뉴스’▶ “너무 예뻐…” 女교사, 학부모들에 왕따당해▶ “우리 누나 왜 때려” 매형 찾아간 처남… 결국▶ 차인표 방송 직후, 울면서 전화해…▶ 납치된 아들, 8년만에 되찾아… 범인은 ‘헉’▶ 온몸에 ‘용’ 그린 조폭, 사우나 갔다가…모바일 경향[New 아이폰 App 다운받기!]| 공식 SNS 계정[경향 트위터][미투데이][페이스북][세상과 경향의 소통 Khross]- ⓒ 경향신문 & 경향닷컴(www.khan.co.kr), 무단전재 및 재배포 금지〈경향닷컴은 한국온라인신문협회(www.kona.or.kr)의 디지털뉴스이용규칙에 따른 저작권을 행사합니다.〉"
3,2012-03-28,"4.11 총선, 새누리 108·민주 109 우세 '박빙'",https://news.naver.com/main/read.nhn?mode=LSD&mid=shm&sid1=100&oid=022&aid=0002378942,세계일보,"‘새누리당 108곳 대 민주통합당 109곳(비례대표 제외).’세계일보가 28일 새누리당과 민주당이 자체 분석한 4·11총선 판세와 각종 여론조사를 종합한 결과다. 민주당이 다소 앞서고 있기는 하지만 박빙, 초박빙 지역이 많아 제1당의 주인공은 여전히 오리무중이다.수도권과 충청권에서 새누리당과 민주당의 후보가 대부분 막상막하의 접전을 벌이고 있다.여당 텃밭인 부산·경남(PK)에선 새누리당 후보가 민주당과 통합진보당 후보의 거센 도전을 받아 고전하는 곳도 있다.대구·경북(TK)에선 새누리당이 압도적 우세를 보이는 가운데 무소속 돌풍 가능성도 점쳐진다. 여당 불모지인 호남에선 민주당 독주가 이어지는 가운데 새누리당 이정현 의원만 광주 서을에서 분전하고 있다.새누리당은 전국 246개 지역구 가운데 수도권 40곳, 부산 15곳, 대구 10곳, 울산 6곳, 경남 13곳, 경북 14곳, 충청·대전 7곳, 강원 3곳에서 우세한 것으로 나타났다. 민주당은 수도권 60석, 충청 7곳, 강원 4곳, 부산 3곳, 경남 2곳, 전남 11곳, 전북 11곳, 광주 7곳, 제주 3곳, 세종특별자치시 1곳에서 앞서는 것으로 파악됐다.그러나 전국의 절반 가까이(45.5%)를 차지하는 수도권(112석=서울 48, 경기 52, 인천 12곳)은 여전히 다수가 경합지역으로 분류된다. 새누리당은 서울에서 강남3구와 동작을, 서대문을 등을 우세지역으로 꼽았다.대권 후보인 정몽준 후보는 동작을에서 민주당 이계안 후보에, 소장파 리더인 정두언 의원은 민주당 김영호 후보에 각각 앞서는 것으로 분석됐다. 민주당에선 박영선(구로을), 인재근(도봉갑), 신계륜(성북을) 후보가 새누리당 후보를 리드 중인 것으로 평가됐다.‘정치 1번지’ 종로에선 새누리당 홍사덕, 민주당 정세균 후보가 초접전을 펼치고 있다. 친이(친이명박계) 좌장인 이재오 후보는 은평을에서 통합진보당 천호선 후보에게, 친박(친박근혜)계 권영세 후보는 영등포을에서 민주당 신경민 후보에게 거센 추격을 받으며 경합 중이다.경기도 접전지가 수두룩하다. 대표적으로 부천소사에서 새누리당 차명진, 민주당 김상희 후보가, 의왕·과천에선 새누리당 박요찬, 민주당 송호창 후보가 용호상박의 대결을 펼치고 있다.충청·강원 지역도 대체로 혼전양상이다. 대전·충청에선 새누리당, 민주당, 자유선진당이 3자구도를 형성하고 있다.강원에선 새누리당과 민주당이 2강구도를 구축했다. 대전 동에선 새누리당 이장우, 민주당 강래구, 선진당 임영호 후보가 엎치락뒤치락하고 있다. 충남 보령·서천에선 새누리당 김태흠, 선진당 류근찬 후보의 각축전이 뜨겁다.강원에선 춘천(새누리당 김진태, 민주당 안봉진 후보), 태백·영월·평창·정선(새누리당 염동열, 민주당 김원창 후보) 등이 초박빙 지역이다. PK에선 민주당 문재인, 문성근, 김경수 후보가 새누리당의 독식체제를 깰 기세다.남상훈·박성준 기자 nsh21@segye.com[Segye.com 인기뉴스]◆ 남녀 3000명 단체미팅 日 '마치콘' 대유행◆ 대학교수, 여제자에게 ""모텔 예약하라"" 충격◆ 강용석 '슈스케4' 1차합격…""사실 표 욕심에…""◆ ""여성은 결혼해도 언제나 혼외정사"" 충격 발언◆ 환절기 스트레스 2위 감기, 1위는?[ⓒ 세계일보 & Segye.com, 무단 전재 및 재배포 금지][금융전문뉴스 세계파이낸스][모바일로 만나는 세계닷컴]<세계닷컴은 한국온라인신문협회(www.kona.or.kr)의 디지털뉴스이용규칙에 따른 저작권을 행사합니다.>"
4,2012-03-28,'독도 한국 땅 입증' 日 고지도 나왔다,https://news.naver.com/main/read.nhn?mode=LSD&mid=shm&sid1=001&oid=015&aid=0002665091,한국경제,"18세기 말~20세기 초 제작…동북아역사재단, 3점 공개일본 정부의 독도 영유권 주장을 정면으로 뒤집는 일본 고지도가 공개됐다. 독도를 일본 고유 영토에 포함시킨 일본 고교 사회과 교과서가 27일 문부과학성의 검정을 통과한 시점에 나온 것이어서 주목된다.동북아역사재단은 28일 독도와 관련해 18세기 말~20세기 초에 제작된 일본 고지도 중 독도가 한국 땅임을 증명하는 일본의 고지도 3점을 국내 처음으로 공개했다.이날 공개된 일본 고지도 중 고토 쓰네타로의 ‘대일본분현지도’(大日本分縣地圖, 1895년)는 시마네현 관내의 위치와 거리 등을 매우 정확하게 나타내고 있는데 독도는 포함돼 있지 않았다. 현재 일본에서 발간되는 시마네현 지도나 일부 교과서의 지도에 독도가 포함돼 있는 것과 대비된다.하마모토 이사오(濱本伊三郞)의 ‘극동일로청한사국대지도’(極東日露淸韓四國大地圖, 1904년)는 우측 아래쪽에 조선신지도(朝鮮新地圖)를 부록으로 제시해 조선을 더 자세하게 나타냈는데, 울릉도와 독도를 강원도와 동일하게 연한 보라색으로 채색했다.또 오노에이노스케(小野英之助)의 ‘대일본제국지도’(大日本國地圖, 1892년·사진)는 보통학전서 제16편《만국신지도(萬國新地圖)》에 수록된 일본전도다. 일본 본토는 황색을 입혔지만 울릉도와 독도는 조선처럼 채색하지 않아, 일본은 이 시기까지 독도를 시마네현과 무관한 섬으로 인식하고 있었음을 알 수 있다.동북아역사재단 독도연구소의 남상구 팀장은 “독도가 한국 땅임을 증명하는 고지도는 독도를 일본 영토 밖의 섬으로 인식했거나 조선과 동일하게 채색하는 등 여러 유형으로 구분할 수 있다”며 “이번에 공개한 고지도는 일본 교과서의 독도 기술을 학술적으로 반박할 수 있는 중요한 자료”라고 말했다.김재일 기자kjil@hankyung.com▶성형수술 법으로 금지하고픈 스타 'BEST 3'▶지나, 분홍 원피스 사이로 드러난 속옷…'아찔해'▶이민정, 알몸에 기타만?…'채널 돌리다 깜짝'▶'현진영 아내' 친언니, 역삼동 화재사고로 사망▶김태희 닮은 김정일 '소품조' 출신 탈북女 '눈길'[한국경제 구독신청] [온라인 기사구매] [한국경제 모바일 서비스]ⓒ <성공을 부르는 습관> 한국경제신문, 무단 전재 및 재배포 금지<한국온라인신문협회의 디지털뉴스이용규칙에 따른 저작권을 행사합니다>"
5,2012-03-28,봄 맵시 돋우는 트렌치코트+α,https://news.naver.com/main/read.nhn?mode=LSD&mid=shm&sid1=103&oid=028&aid=0002135825,한겨레,"[한겨레][매거진 esc]유행 탄듯 안탄듯 세련된 트렌치코트 고르기·소품 이용한 다양한 스타일 연출법트렌치코트의 낭만은 가을에만 누릴 수 있는 것은 아니다. 아침저녁으로는 찬 바람이, 낮 동안에는 따뜻한 바람이 불어오는 오락가락한 날씨의 봄이면 사랑받는 트렌치코트다. 트렌치코트의 원형은 1차 세계대전 시기 군복으로 입던 개버딘코트다. 그 뒤 100년 가까운 세월 동안 변함없이 사랑받고 있다. 그동안 스타일과 색깔 등에서 작은 변화가 시기마다 있었지만, 기본적인 옷 모양은 크게 바뀌지 않았다. 그만큼 유행에 민감하지 않아, 산 지 몇 년 지난 트렌치코트라도 멋스럽게 입을 수 있다는 점에서 경제적이기도 하다. 격식있는 정장 차림부터, 가벼운 나들이 길의 캐주얼 차림까지 소화 가능하다. 트렌치코트를 일주일에 사흘 입어도 지루하지 않게 입을 수 있다.직장인 겨냥 남성 코트상의 아래 10㎝까지 짧아져몸에 달라붙게 입는 게 예뻐트렌치코트 자체의 형태가 유행에 따라 크게 바뀌지는 않지만, 몇부분에 걸쳐 세부적인 변화가 일고 있다. 트렌치코트를 새롭게 마련할 계획이라면 최근의 트렌드를 놓치지 말자. 남성과 여성 트렌치코트의 전체적인 변화로는 ‘짧아지는 길이’를 꼽을 수 있다. 전통적인 트렌치코트는 밑단이 무릎 밑까지 내려온다. 그러나 최근에는 점점 길이가 짧아지고 있다. 이러한 변화는 남성 트렌치코트에서 더욱 극적이다. 직장인을 겨냥한 브랜드는 특히나 엉덩이 중간까지 오는 짧은 트렌치코트에 주력하고 있다. 양복 상의보다 10㎝ 정도 내려오는 길이다. “남성 트렌치코트를 고를 때는 무엇보다 자체의 형태가 중요하죠. 짧은 길이에, 몸에 좀 달라붙도록 입는 것이 좋아요. 여기에 허리 여밈 부분이 허리보다 좀 위에 잡혀 있는 형태가 다리를 좀더 길어 보이게 합니다.” 스타일 멘토로 활동하고 있는 피현정 브레인파이 대표는 남성 트렌치코트 형태의 중요성을 강조한다.여성 트렌치코트는 남성 것보다 여러 부분에 변화가 있다. 우선은 색깔. 주황색이나 초록, 분홍색 등 다소 부담스러울 법한 색깔도 여럿이다. 올해 유행색을 반영해서다. 유행을 따라가기보다 수년간 꾸준히 입을 생각이라면 베이지색이나 남색이 무난하다. 지루할 것 같다는 걱정은 떨쳐라. 손목이나 목 부분 깃, 밑단 등 코트의 끈 부분 색을 달리한 이중배색 스타일의 트렌치코트가 많이 나오고 있다. 한발 더 나아가 팔 부분의 색이 완전히 다른 트렌치코트도 있다. 이런 이중배색을 한 트렌치코트는 정장뿐 아니라 캐주얼에도 잘 어울려 ‘멀티유스’가 가능하다. 움츠러든 경기가 패션 스타일에 반영된 결과다.트렌치코트 스타일링은 그 자체로 재미있다. 안에 어떤 옷을 입고, 어떤 소품을 걸쳤느냐에 따라 분위기 반전이 있어서다.프티스카프, 비니모자9부 길이 컬러팬츠로경쾌한 분위기 연출가장 간단하게 활용할 수 있는 것은 스카프. 여성 것만을 떠올리지 말자. 엘지(LG)패션의 비즈니스캐주얼 브랜드 티엔지티(TNGT)는 올해 액세서리 라인을 처음으로 내놓았는데, 남성용 스카프만 해도 7~8가지나 된다. 리넨(마 직물)이나 얇은 면으로 만들어 가볍게 두를 수 있는 스카프는 가벼운 차림에 한 점 멋을 더한다. 색깔은 코트와 비슷한 계열이 좋다. 너무 다른 색은 오히려 키가 작아 보이게 할 수 있다. 여성은 정장 차림일 때 큰 사각형 스카프를 반으로 접어 어깨 위에 걸치거나 목에 둘러 보자. 캐주얼 차림에는 프티(작은) 스카프를 목에 살짝 매주면 귀여운 분위기를 연출할 수 있다. 머리를 뒤로 올려 묶었다면 목에 두르는 대신 머리끈을 감싸 튀지 않게 멋부릴 수 있다.바지 한 벌의 역할도 크다. 남성과 여성 구분 없는 스타일링 방법이다. 같은 트렌치코트와 하얀 셔츠나 블라우스에 하의를 바꿔보자. 여성은 정장 차림을 해야 할 때는 검정 에이치라인의 스커트를, 나들이를 갈 때는 발목이 살짝 드러나는 9부 청바지나 컬러팬츠를 입는 식이다. 꼭 9부 길이를 살 필요 없이 있던 스키니진의 밑단을 말아 올리기만 해도 된다.남성 역시 같은 연출 방법을 선택할 수 있다. 다만, 화려한 색깔의 컬러팬츠는 다소 부담스러울 수 있다. 이럴 때는 짙은 색 면바지라도 살짝 말아 올려 입자. 여기에 색깔에 살짝 힘을 준 양말을 신고, 스니커 운동화나 굽이 낮은 로퍼를 더하면 된다. 피현정 대표는 “너무 정색하게 멋부린 느낌보다는 팔끝이나 발끝처럼 가장자리에 포인트를 주는 게 더 멋스럽다”고 말했다.모자나 안경테, 가방을 바꿔 들어도 큰 변화를 느낄 수 있다. 페도라 같은 중절모 스타일의 모자보다는 캐주얼 차림에 니트로 된 비니모자를 쓰면 ‘믹스매치’의 효과를 극대화할 수 있다. 색깔로 힘을 준 큰 가방을 어깨에 둘러메는 것도 하나의 방법이다. 크기는 작지만 어깨에 멜 수도 있고 끈을 가방 안으로 넣은 뒤 접어 들면 되는 가방은 그 자체로 하나의 액세서리가 될 수 있다.style tip트렌치코트 이렇게 골라봐▣벨트 있는 것, 없는 것?통통하고 체격이 큰 사람은 벨트가 없는 것이, 마른 사람은 벨트가 있는 것이 잘 어울린다. 몸집이 있는데 억지로 허리를 여미면 허리가 더욱 도드라져 보이기 때문이다. 남성이 정장에 트렌치코트를 입을 때 같은 이치로 단추를 여미지 않고 열어 입는 게 활동하기에도 보기에도 편해 보인다. 다만, 안에 입는 정장 상의의 단추는 단정하게 잠그자.▣무조건 베이지색?얼굴에 노란 기가 많은 사람은 남색과 같은 어두운 색이 낫다. 반대로 피부가 검은 사람은 남색보다는 베이지색 등 밝은 색을 입는 게 낫다.▣곧 여름이 올까 걱정된다면?최근에는 조끼형 트렌치코트도 나오고 있다. 트렌치코트인데, 팔 부분만 없앤 것이다. 일반 코트에 덧입다가, 날씨가 따뜻해지면 긴팔이나 반팔 셔츠만 입고 걸치면 된다.글 이정연 기자xingxing@hani.co.kr<한겨레 인기기사>■안철수 “지금 대선 출마한다는 분 없잖아요”■MBC·KBS 박근혜 띄우기?■자동차는 □□□ 로 달린다■300만원으로 100억번 슈퍼개미의 ‘색다른 투자’■4.19kg 셋째딸, 쳐다보기 싫었다공식 SNS[통하니][트위터][미투데이]| 구독신청[한겨레신문][한겨레21]Copyrights ⓒ 한겨레신문사, 무단전재 및 재배포 금지<한겨레는 한국온라인신문협회(www.kona.or.kr)의 디지털뉴스이용규칙에 따른 저작권을 행사합니다.>"
