,날짜,기사 제목,기사 링크,기사 출처,기사 내용
26,2012-03-28,[4·11 총선 판세 분석] (1) 서울 중앙·동부,https://news.naver.com/main/read.nhn?mode=LSD&mid=shm&sid1=100&oid=011&aid=0002227839,서울경제,"엎치락 뒤치락… 박빙지역 많아 예측불허정치 1번지 종로 혼전·중구 오차범위내 野 앞서광진을 '추다르크' 인기 여전… 동대문을 안갯속4ㆍ11 19대 총선이 2주 앞으로 다가왔지만 선거판은 여전히 안갯속이다. 서울경제신문은 서울을 비롯해 경기ㆍ인천, 부산ㆍ울산ㆍ경남, 충청권, 대구ㆍ경북ㆍ강원, 호남ㆍ제주 판세를 시리즈로 긴급 점검한다. /편집자 주서울 종로ㆍ중구ㆍ용산ㆍ성동ㆍ광진ㆍ동대문ㆍ중랑구 등 서울의 중앙과 동쪽의 11개 지역구에서는 야당이 다소 앞선 가운데 적지 않은 지역에서 박빙의 경합 양상을 보여 귀추가 주목된다.우선 민주통합당은 유권자에 내재된 정권심판론과 야권연대를 바탕으로 다소 유리한 형국이나 한미자유무역협정(FTA)과 제주해군기지 강경대처에 따른 중도층의 일부 이탈과 공천파동, 야권연대 과정의 잡음으로 지지율을 조금 까먹은 게 단점이다. 새누리당은 정권 5년 차에 치러지는 총선에도 불구하고 정권심판론을 나름대로 잘 방어하고 있는데다 쇄신 이미지 구축과 야권 공천 잡음에 따른 반사이익을 바탕으로 박빙구도를 만드는 데 성공했다.전문가들은 27일 이번 총선 판세는 ▦정권심판론 ▦색깔론 등 네거티브 흑색선전 ▦정권비리 이슈화 ▦야권연대 ▦돌발적 실언 ▦세대 간 투표율 등의 변수에 따라 30∼40%로 추산되는 부동층의 향배가 선거판을 좌우할 것으로 내다봤다.우선 정치1번지로 10명이 출사표를 던진 종로에서는 6선의 친박근혜계의 핵심 홍사덕 의원과 정세균 전 민주당 대표가 각각 '민주당 불가론'과 '정권심판론'을 앞세워 혼전을 거듭하고 있으나 정권심판론 쪽에 미세하나마 무게가 실리는 형국이다.나경원 전 의원이 물러난 중구에서는 새누리당의 구원투수로 투입된 정진석 전 청와대 정무수석이 정대철 전 민주당 대표의 아들인 정호준 후보에 오차범위 내에서 박빙의 차이이나 열세 국면이다. 조순형 자유선진당 의원이 사퇴하며 정호준 후보에게 애정을 표한 것이 판세 변화에 영향을 미쳤다. 다만 이날 나 전 의원의 남편인 김재호 부장판사의 기소청탁 의혹에 대해 경찰이 무혐의 처분을 한 것이 어떻게 작용할지 주목된다. 국민생각의 장준영 민생경제연대 대표도 열심히 뛰고 있다.용산은 진영 새누리당 의원이 KBS 앵커 출신의 조순용 민주통합당 후보에게 소폭 밀리는 형국이지만 지난해 10ㆍ26 서울시장선거에서 여당이 이겼던 지역이라는 점에서 예측불허라는 분석이다. 오히려 여당의 결집이 이뤄질 수도 있다는 지적이다.새누리당의 김태기 전 단국대 경제학과 교수와 민주통합당의 최재천 전 의원이 맞붙은 성동갑은 지역을 계속 관리해온 최 전 의원이 약간 리드하는 형국이다. 성동을에서는 김동성 새누리당 의원이 나름대로 탄탄한 기반을 다져놓은 가운데 민주통합당에서 북한 전문가인 홍익표 북한대학원대학교 겸임교수가 임종석 전 사무총장의 조직을 물려받아 강력한 도전장을 내밀고 있다.광진갑은 새누리당의 정송학 전 광진구청장에 맞서 민주통합당이 조직을 관리해온 전혜숙 의원 대신 김한길 전 의원을 전략공천해 잡음이 예상됐으나 전 의원의 대승적 수용으로 김 전 의원이 다소 앞서는 형국이다. 광진을에서는 '추다르크'로 불리는 추미애 민주통합당 의원이 '희망의 정치'를 내세우며 새누리당의 정준길 전 대검 중수부 검사를 리드하는 분위기다. 정 전 검사가 '새 정치'를 내걸며 일부 어필하고 있으나 공천을 다퉜던 길기연 한양대 겸임교수의 무소속 출마로 보수표가 분산된데다 4선을 바라보는 추 의원의 인기가 만만찮아 이변 확률은 높지 않다는 분석이다.동대문은 을에서 홍준표 전 한나라당 대표와 민병두 전 열린우리당 의원 간의 리턴매치가 불을 뿜고 있는데 홍 전 대표가 소폭 리드하는 형국에서 최근 중앙선관위의 홍 전 대표 검찰 수사 의뢰가 변수가 될 것으로 전망된다. 홍 전 대표의 측근인 허용범 전 국회 대변인과 야당의 국방통인 안규백 민주통합당 의원 간의 대결인 동대문갑은 안 의원이 당내 공천 후유증을 수습하고 야권연대를 바탕으로 힘을 받는 형국이다.중랑구는 여야 후보와 공천경쟁에서 뒤진 전ㆍ현직 의원이 어우러져 격전 중이다. 중랑갑은 김정 새누리당 의원(비례대표)과 민주통합당의 서영교 동국대 교수가 여여 대결을 벌이는 가운데 여야에서 각각 공천을 다퉜던 유정현 의원과 이상수 전 의원이 무소속으로 나왔다. 중랑을은 새누리당의 강동호 서울외국어대학원대학교 총장과 민주당의 박홍근 전 경희대 총학생회장 외에도 진성호 의원(새누리 탈당)과 5선의 김덕규 전 국회 부의장(정통민주당)이 혼전을 벌이고 있다. 다만 16대 총선 이래 무소속 당선자가 서울에서 없었다는 점에서 민주후보가 미세하게나마 우위라는 분석이다.여론조사기관인 리얼미터의 이택수 대표는 ""지난 18대 총선 투표율이 46.1%였는데 투표율이 55% 가까이 되면 야권이 유리하다""며 ""11석 중 민주통합당이 7석, 새누리당이 4석가량을 차지할 것""이라고 분석했다.고광본기자 kbgo@sed.co.kr[한국아이닷컴 인기기사]☞콧대 높던 한국차, 강력한 천적에 '당혹'☞""상반기중 곳간 바닥난다"" 충격 전망☞한국 덮치는 '죽음의 그림자' 심상찮다☞한국서 자동차 1대 만드는데… 충격 실태☞앉아서 일하는 사람들에 충격적인 소식[ⓒ 인터넷한국일보(www.hankooki.com), 무단 전재 및 재배포 금지]"
27,2012-03-28,[사진]'굿바이 코리아',https://news.naver.com/main/read.nhn?mode=LSD&mid=shm&sid1=100&oid=008&aid=0002807155,머니투데이,"[ 뉴스1 제공 ](오산=뉴스1) 한재호 기자=버락 오바마 미국 대통령이 서울 핵안보정상회의 참석을 비롯한 2박3일 간의 방한 일정을 마치고 27일 오후 경기도 오산 공군기지에서 출국하기 위해 헬기에서 내려 전용기 '에어포스 원'으로 향하며 손을 흔들어 인사하고 있다.정치와 눈을 맞추다 - 눈TV<저작권자 뉴스1 코리아, 무단전재 및 재배포 금지>☞ 뉴스1 바로가기[주총현장] 주총 시즌 개막, 핫이슈는?[내손안의 스마트한 경제정보 머니투데이 모바일][머니투데이 핫뉴스]☞문두께만 20㎝… 오바마 의전차 '야수'는?☞손수조 집 알고보니 '반'전세, 현장 가보니…☞정상들이 탄 車, 일반인에 할인판매… 얼마나?☞""점심은 어디서 사먹나"" 삼성동 직장인 '분통'☞기아차의 파격? 4000만원대 K9 나온다뉴스1 제공<저작권자 ⓒ '돈이 보이는 리얼타임 뉴스' 머니투데이, 무단전재 및 재배포 금지>"
28,2012-03-28,"'창덕궁, 야경에 물들다'",https://news.naver.com/main/read.nhn?mode=LSD&mid=shm&sid1=102&oid=003&aid=0004411122,뉴시스,"【서울=뉴시스】강진형 기자 = 27일 오후 서울 종로구 와룡동 창덕궁에서 열린 '핵안보정상회의 기념 창덕궁 달빛기행'에서 참가자들이 야간 개방된 인정전을 둘러보고 있다. 창덕궁 달빛기행은 오는 4월부터 10월까지 총 20회 진행되며, 인터파크를 통해 사전 예약 후 관람이 가능하다.marrymero@newsis.com★ 손 안에서 보는 세상, 모바일 뉴시스<저작권자ⓒ 공감언론 뉴시스통신사. 무단전재-재배포 금지.>"
29,2012-03-28,'유기견의 역습' 북한산 점령한 야생 들개,https://news.naver.com/main/read.nhn?mode=LSD&mid=shm&sid1=102&oid=055&aid=0000224773,SBS,"- 번식 속도 빨라…생태계 위협 -<앵커>북한산에 들개 떼가 몰려다니고 있습니다. 주변 재개발 단지에서 버려진 개들이 산까지 쫓겨와서 번식까지 하면서 야생견으로 변한 겁니다. 등산객은 물론이고 생태계에 위협이 되고 있습니다.정형택 기자가 취재했습니다.<기자>북한산 대남문 부근의 가파른 산 길 사이로 야생개 세 마리가 쏜살같이 지나갑니다.또 다른 능선에선 예닐곱 마리가 떼 지어 다니고 있습니다.[보상 스님 : 큰 개들 끼리만 모여 다녀요. 보통 4마리 내지 5마리가 이렇게 모여 다녀요.]버려진 개들이 산으로 들어와 다람쥐 같은 작은 동물을 잡아먹는 야생 들개가 돼 버린겁니다.떼를 지어 다니는 들개들은 등산객에겐 공포의 대상입니다.[박순영/서울 공덕동 : 겁나지, 무섭죠. 깨물까 봐 그러지. 그리고 막 따라오면, 막 어떻게 할 줄 모르고.]국립공원 관리공단이 야생 들개 소탕에 나섰습니다.마취총을 맞은 들개가 숲 속으로 달아나지만 끝내 쓰러집니다.먹이를 놓아 야생 들개를 유인해 잡기위한 덫도 곳곳에 설치해놨습니다.이미 60여 마리를 잡았지만 문제는 버려지는 개들이 줄지않고 있다는 겁니다.게다가 번식 속도도 예상을 뛰어넘고 있습니다.야생 들개 사이에서 태어난 강아지입니다.이렇게 번식까지 하면서 최근 북한산 야생 들개는 50여 마리에 이르는 것으로 추산됩니다.[양기식/국립공원관리공단 환경관리부장 : 정기적으로 포획을 해서 결국은 RM 생태계를 교란시키는 들개를 완전히 박멸시킬 그럴 계획을 하고있습니다.]주인에게 버림받은 개들이 난폭한 야생 들개로 변하면서 등산객들의 안전을 위협하는 골칫거리가 되고있습니다.(영상취재 : 김태훈, 영상편집  : 홍종수)정형택goodi@sbs.co.kr관/련/정/보◆ 서산시, 방치된 농지는 야생동물 피해 보상안해◆ 작은 섬 점령한 '야생염소'…생태교란 골칫거리◆ 유기동물 비극 '도심 로드킬'…운전자들 악몽◆ 개발사업 때 야생동물 옮겨 살 곳 만든다☞[SBS기자들의 생생한 취재현장 뒷이야기 '취재파일']☞ SBS뉴스 공식 SNS [SBS8News 트위터] [페이스북] [미투데이] [요즘]저작권자 SBS&SBS콘텐츠허브 무단복제-재배포 금지"
30,2012-03-28,외국인 감동시킨 한옥 민박…비결은 '정(情)',https://news.naver.com/main/read.nhn?mode=LSD&mid=shm&sid1=103&oid=055&aid=0000224763,SBS,"<앵커>우리나라를 찾아오는 외국인은 크게 늘었지만, 숙박 시설이 부족해서 그게 늘 고민이었습니다. 그런데 요즘호텔 대신에 일반 가정집에 머무는 홈스테이가 좋은 반응을 얻으면서 대안으로 떠오르고 있습니다.류란 기자입니다.<기자>미국인 윌리엄 씨는 우리나라를 방문할 때마다 한옥 민박집에 짐을 풉니다.전통 한옥의 매력을 느낄 수 있고 가격도 1박에 3만 원으로 저렴하기 때문입니다.[윌리엄 유밴/미시건 대학 교수 : 평화롭고, 독특합니다. 누구라도 한국에 오는 사람이라면 한옥 민박을 추천하고 싶어요.]지난해 한국 여행 때 묵었던 민박집 가족이 보고 싶어 친구들까지 데리고 다시 서울을 찾은 쇼우타 군.일본에 계신 어머니는 중학생 아들을 믿고 맡길 수 있어 좋고, 민박집에선 외국인 친구가 생겨 즐겁습니다.[최병금/홈스테이 참여자 : 부담 가지면 이거 못해요. 그냥 저희 저녁 먹는 거 그대로 하고 그 다음에 밥은 양만 조금 많이 했을 뿐이지…]눈에 띄게 늘고 있는 해외 관광객 수에 비해 국내 숙박시설은 턱없이 부족해 당장 올해 1만 6천 개의 객실이 추가로 필요합니다.정부는 이를 위해 그동안 민간 자율로 운영되던 외국인 민박 가정들을 체계적으로 모아 민박 알선과 교육을 지원하기 시작했습니다.소정의 심사를 통과한 코리아 스테이 공식 민박집들이 유치할 수 있는 관광객 규모는 100실짜리 대형 호텔 2개와 맞먹을 것으로 추정됩니다.[김진활/한국관광공사 직원 : 호스트하고 게스트가 서로를 선택하게끔 하는 매칭 사이트를 저희들이 운영을 하고 있습니다. 간단하게 기초 회화 정도만 되는 수준이면 누구든지 호스트로…]외국인 관광객 1천만 명 시대, 믿을 수 있는 중저가의 홈스테이가 새로운 대안으로 떠오르고 있습니다.(영상취재 : 서진호, 영상편집 : 배문산, VJ : 오세관)류란peacemaker@sbs.co.kr관/련/정/보◆ 제주 관광객 1000만 명 시대…숙박시설 모자라◆ '외국 관광객 대상 바가지 요금 잡는다'◆ [부산] 경남도,외국인 관광객 100만 명 유치◆ `웰컴 투 코리아' 외국인 관광객 소비 37% 급증☞[SBS기자들의 생생한 취재현장 뒷이야기 '취재파일']☞ SBS뉴스 공식 SNS [SBS8News 트위터] [페이스북] [미투데이] [요즘]저작권자 SBS&SBS콘텐츠허브 무단복제-재배포 금지"
31,2012-03-28,"유시민 ""손수조, 정치할 준비 전혀 안돼 있어""",https://news.naver.com/main/read.nhn?mode=LSD&mid=shm&sid1=100&oid=031&aid=0000254103,아이뉴스24,"<아이뉴스24>[채송무기자] 최근 '거짓말' 논란에 휩싸인 새누리당 손수조 후보에 대해 통합민주당 유시민 공동 대표가 '정치에 나설 준비가 전혀 돼 있지 않은 사람'이라고 혹평했다.유 대표는 27일 평화방송 라디오 프로그램에 출연해 손 후보 논란에 대해 ""새누리당이 국민을 상대로 장난스럽게 했다""며 ""나이가 젊다고 국회의원 출마를 할 수 없는 것은 아니지만 국회의원 후보로서 자질을 입증할 수 있을 정도의 활동 업적이 있는 사람을 공천해야 했다""고 말했다.유 대표는 ""야권의 대선후보 지지율 1위 후보에 이런 후보를 낸다는 것은 국민을 상대로 장난을 치는 것""이라며 ""새누리당이 처음부터 유권자에 대한 예의를 안 지켰다""고 맹비난했다.유 대표는 '순수해서 그랬다'는 새누리당의 해명에 대해서는 ""열심히 직장생활 하거나 그렇게 살아야 한다""고 대꾸했다. 그는 ""정치에 나설 준비가 전혀 돼 있지 않은 사람으로 문재인 후보에 대한 견제심리 때문에 부산 사상구 선거를 웃음거리로 만들자는 전략을 새누리당이 쓴 것""이라고 맹비난했다.자신의 전세자금 3천만원으로 선거를 치르겠다는 공약을 통해 주목받았던 손수조 후보는 지난 23일 이 공약을 사실상 포기했고, 후원금으로 모인 8천만원을 사용하겠다고 시사하면서 비판 여론에 휩싸였다.더욱이 선거기탁금 1천500만원을 선거비용에 포함시킨 손 후보의 말과는 달리 이 자금을 중앙당이 지원한 것으로 확인되면서 거짓말 논란이 커졌다.최근에는 박근혜 비대위원장이 27일 부산을 방문하면서 별도로 손 후보를 만나는 일정을 잡지 않아 새누리당이 손 후보를 포기했다는 말까지 나오고 있다.박 위원장은 지난 13일 부산 방문에서는 손씨와 함께 차량을 타고 이동하면서 썬루프를 통해 상체를 내어놓고 시민들에게 인사를 해 불법 선거운동이라는 말까지 나왔었다./채송무기자dedanhi@inews24.com[관련기사]▶""방 뺐다"" 손수조, '전세금 말 바꾸기' 일파만파"
32,2012-03-28,"""얌체 주유소 더 있다"" 시민들 분노 폭발",https://news.naver.com/main/read.nhn?mode=LSD&mid=shm&sid1=102&oid=055&aid=0000224854,SBS,"- 기름양 속인 주유소 제보 쇄도…합동 단속 나서 -<앵커>기름 양을 속이는 주유소에 대해서 어제(27일) 저희가 단독 보도해 드린 뒤에 시민들의 분노가 폭발했습니다. 그런 주유소가 더 있다는 제보가 쇄도해서 관련 기관들이 합동 단속에 나섰습니다.보도에 최재영 기자입니다.<기자>주유량을 속이다 적발된 주유소에 경찰이 다시 방문했습니다.관련 서류부터 주변 CCTV까지 꼼꼼히 챙깁니다.수사의 초점은 주유량을 속일 수 있도록 설치된 프로그램.[주유소 직원 : 두 명이 왔어요. 업그레이드 한다고 해서… 열고 그냥 했던 것밖에 기억이 안 나요.]설치방법은 간단했습니다.[강성기/경기군포경찰서 지능범죄수사팀 : 위조된 프로그램을 노트북에 넣어가지고 주유기에 있는 메인 보드판에 있는 프로그램에다가 연결해가지고 사용하게 하였습니다.]주유기 제조업체에서도 조작된 프로그램를 확인했습니다.[최기헌/주유기 제조업체 상무 : 우리가 애당초 처음에 출고할 때의 제품은 아니에요. 나름대로 책을 보고 공부해서 프로그램을 짠 것 같은데…]얌체 주유소 보도 이후 시민들의 의심 신고가 SBS와 관할 당국에 쇄도했습니다 .[김모 씨 : 눈금이 보통 때보다 많이 안 올라갔고요.]주유량을 속인다는 신고가 잇따르자 관할구청도 적극적인 단속에 나섰습니다.서울 시내의 한 주유소에 관할 구청 직원이 점검에 나섰습니다.[구청 단속 직원 : 오차범위인데… 약간의 오차만 있어요.]석유관리원도 주유량을 속이는 주유소에 대한 집중 단속을 시작하고 지식경제부 기술표준원은 주유기에 대한 전반적인 실태점검에 착수했습니다.(영상취재 : 전경배, 이용한, 영상편집 : 김경연)최재영@관/련/정/보◆ 비싼데 줄이기까지…'양심불량' 주유소 포착◆ 주유소에 깔린 수상한 프로그램, 기름양 속였다◆ 주유량 속이는 '양심불량' 주유소 현장 적발◆ 얌체주유소, '가득 넣어달라' 주문 허점 노렸다☞[SBS기자들의 생생한 취재현장 뒷이야기 '취재파일']☞ SBS뉴스 공식 SNS [SBS8News 트위터] [페이스북] [미투데이] [요즘]저작권자 SBS&SBS콘텐츠허브 무단복제-재배포 금지"
33,2012-03-28,"아이사랑카드, '정부 시책' 핑계대며 카드 영업",https://news.naver.com/main/read.nhn?mode=LSD&mid=shm&sid1=101&oid=055&aid=0000224849,SBS,"<앵커>올해부터 확대된 보육비 지원을 받으려면 만 5세 이하 영유아를 둔 부모님들은 아이사랑 카드라는 걸 발급받아야 합니다. 이 카드로 보육비를 결제하면 정부가 지원금을 입금해 주는 형식입니다. 올 들어 50만 장이 신청돼서 지난해 카드 발급 건수 59만 장에 벌써 육박하고 있습니다.그런데 이 카드 사업자로 선정된 은행들이 이걸 빌미로 속 보이는 상술을 벌이고 있습니다.먼저 정명원 기자입니다.<기자>아이사랑 카드 발급 창구입니다.신용카드 대신에 체크카드를 발급해달라고 했더니 창구 직원이 말립니다.[A은행 직원 : 체크는 보통 바우처라고 해서 신용도 안 좋으신 분들이 하는 것이고요.]신용카드 발급을 권하면서 엉뚱하게 정부시책을 들먹이기도 합니다.[A은행 직원 : 이 카드 자체가 나라에서 해 주는 거라서요. 그냥 추가로 (신용카드) 하나 더 만드셔서쓰시면 돼요.]정부가 가계 빚 문제 때문에 신용카드 대신 체크카드 사용을 장려하고 있지만 금융기관들은 나 몰라라 하는 겁니다.이런 신용카드 발급 유도 탓에 올해 만들어진 아이사랑 카드 10장 가운데 8장 가까이가 신용카드입니다.카드사의 장삿속은 여기서 그치지 않습니다.개인정보 제공에 동의할 것을 강요하기도 합니다.[최모 씨/아이사랑카드 고객 : 복지부와 연계됐기 때문에 뭐 하나라도 안 된다는 표시가 있으면 발급할 수 없다. 이렇게 말해서 더 황당했습니다.]고객을 확보하고 개인정보까지 활용할 욕심에 유치경쟁을 벌이느라 불법 경품제공까지 서슴지 않습니다.[오홍석/금감원 여신전문감독국 팀장 : 카드 모집 과정에서 불법 행위가 늘어나고 있습니다. 관련 금융기관에 엄중 경고 조치하였습니다.]카드사들의 장삿속에 고객들은 원치 않는 신용카드를 발급받고 개인정보까지 내주고 있습니다.(영상취재 : 장운석, 영상편집 : 조문환, VJ : 정민구)정명원cooldude@sbs.co.kr관/련/정/보◆ 지난해 신용카드사 순익 반토막◆ 카드 종류만 1만개…70%는 '무용지물'◆ 지난해 고객 불만이 가장 많은 카드사는?◆ 카드업계 부가서비스 대거 없애거나 줄인다☞[SBS기자들의 생생한 취재현장 뒷이야기 '취재파일']☞ SBS뉴스 공식 SNS [SBS8News 트위터] [페이스북] [미투데이] [요즘]저작권자 SBS&SBS콘텐츠허브 무단복제-재배포 금지"
34,2012-03-28,107개국 '우리 국민' 사상 첫 투표…분위기는,https://news.naver.com/main/read.nhn?mode=LSD&mid=shm&sid1=104&oid=055&aid=0000224860,SBS,"- 재외국민 투표 5일간 실시…첫날 투표소 한산 -<앵커>헌정 사상 처음 실시되는 총선 재외국민 투표는 이미 시작됐습니다. 전세계 107개 나라 158개 공관에서 우리 국민들의 투표가 진행됐습니다. 첫날이어서 좀 한산하긴 했습니다.베이징 윤영현 특파원이 보도합니다.<기자>베이징 주중 한국대사관에 마련된 투표소, 소중한 한 표를 행사하기 위한 발걸음이 이어졌습니다.이웃 도시 텐진에서 버스를 빌려 단체로 투표장을 찾기도 했습니다.[김선혜/유학생 : 중국 땅에서 멀리 떨어져있지만 중국 땅에서 제 의사를 표현할 수 있어서 참 좋았던 것 같습니다.]일본 도쿄의 한국문화원에도 오늘(28일) 하룻동안 350여 명이 소중한 한 표를 행사했습니다.등록이 제대로 되지 않아 투표를 하지 못하고 되돌아가는 사례도 있었습니다.[이희팔/재일동포 : 정확한 수속을 했는데도 불구하고 왜 이렇게 말썽이 많은가 생각이 돼요.]사상 첫 재외국민투표는 다음달 2일까지 6일 동안 실시됩니다.한국 국적을 갖고 있는 해외 체류 국민들을 뜻하는 재외국민들 가운데 등록 절차를 마쳐 투표권을 갖게된 사람은 12만 3천 여 명.그러나 투표를 위해선 직접 공관을 찾아야 하는 번거로움 등 때문에 호주 등 7개 지역의 오늘 평균 투표율은 10%에도 미치지 못했습니다.이 때문에 참정권 확대라는 당초의 취지를 살리기 위해선 우편 등록을 도입하고 투표소를 증설하는 등 제도를 개선해야 한다는 목소리가 커지고 있습니다.윤영현yoon@sbs.co.kr관/련/정/보◆ 4.11 총선 재외투표 시작됐는데…분위기 '썰렁'◆ '킹메이커', 총선 맞아 투표 독려 캠페인◆ 여야, 총선 텃밭 다지기…재외국민 투표 실시◆ 조계종, 종교시설내 투표소 설치 금지 요청☞[SBS기자들의 생생한 취재현장 뒷이야기 '취재파일']☞ SBS뉴스 공식 SNS [SBS8News 트위터] [페이스북] [미투데이] [요즘]저작권자 SBS&SBS콘텐츠허브 무단복제-재배포 금지"
