,날짜,기사 제목,기사 링크,기사 출처,기사 내용
63,2012-03-28,"檢, 민주당 행사장 통화기록 무더기 조회 논란",https://news.naver.com/main/read.nhn?mode=LSD&mid=shm&sid1=100&oid=001&aid=0005568590,연합뉴스,"서초동대검찰청에 검찰 깃발이 펄럭이고 있는 모습.(자료사진)10분간 통화자 659명 상대..""수사권 남용"" vs ""법적 문제없어""(서울=연합뉴스) 최이락 기자 = 검찰이 지난해 12월 26일 민주통합당 대표 선출을 위한 예비경선 당시 무혐의로 끝난 금품살포 의혹을 수사하며 행사장에 있던 659명의 통화기록과 인적사항을 조사한 것으로 드러나 논란이 되고 있다.민주당은 28일 ""사생활 침해이자 수사권 남용""이라고 비판했으나 검찰측은 ""법적으로 문제가 없다""고 밝힌 것으로 전해졌다.이런 사실은 서울중앙지검에서 지난 20일 조회 대상자들에게 보낸 '통신사실 확인자료제공 요청 집행사실통지서'를 통해 밝혀졌다.조사는 당시 폐쇄회로TV에 찍힌 김경협 부천원미갑 예비후보의 신원 확인을 위해 오후 5시~5시10분 사이 행사장인 서울교육문화회관 주변의 기지국을 거친 통화자 659명을 대상으로 이뤄졌다.김유정 대변인은 브리핑에서 ""통지서를 받아 본 기자, 보좌진, 중앙위원들은 자신도 모르는 사이 무차별 조사가 된데 대해 경악을 금치 못하고 있다""며 ""검찰이 일반 국민에 대해서는 어떻게 할지 가히 상상할 수 있는 대목""이라고 지적했다.그는 ""이는 명백한 사생활 침해이자 인권침해이고 수사상 재량권의 범위를 넘어선 수사권 남용""이라며 ""무차별 표적수사로 일단 털고 보자는 검찰의 잘못된 태도는 지탄받아 마땅하다""고 말했다.이에 대해 검찰 측은 ""이렇게 많을 줄 몰랐다. 특이한 케이스""라면서도 ""법적으로는 문제가 없다""는 입장을 밝힌 것으로 전해졌다.김 대변인은 ""특히 이 사건 담당 부서장인 이상호 공안1부장은 박희태 전 국회의장을 공관으로 방문해 수사했던 '친절한 검사님'""이라며 ""야당과 시민에 대해 속도전으로 과잉수사를 하는 검찰이 각종 비리 혐의의 중심에 서 있는 대통령의 형 이상득 의원에 대해서는 왜 조사를 하지 않느냐""고 반문했다.또 ""청와대가 연루된 불법사찰과 은폐에 대해서는 왜 똑같이 적극적으로 나서지 못하느냐""며 ""검찰이 정권의 심부름센터가 아니라면 이럴 수 없다""고 강조한 뒤 이상득 의원과 임태희 전 대통령실장의 소환조사를 촉구했다.choinal@yna.co.kr[이 시각 많이 본 기사]☞美경찰관, 거짓말했다가 3억5천만원 배상☞'디워' 심형래 감독 제작비 대출금 소송 패소 확정☞손학규 ""돈봉투 의혹 사실이면 정계은퇴""(종합)☞-챔스리그- '후반 3골' 마드리드, 아포엘 제압☞日언론 ""핵안보회의 北 미사일이 큰 비중""<연합뉴스 모바일앱 다운받기><포토 매거진><저작권자(c)연합뉴스. 무단전재-재배포금지.>"
64,2012-03-28,동안 원한다면 채소·과일보다 ‘팝콘’…반전 연구결과,https://news.naver.com/main/read.nhn?mode=LSD&mid=shm&sid1=105&oid=081&aid=0002268995,서울신문,"[서울신문 나우뉴스]팝콘이 비만을 돕는다는 부정적인 연구결과는 익히 알려져 있지만, 최근 이를 반박하는 새로운 주장이 제기돼 눈길을 모으고 있다.미국 펜실베이니아대학 연구팀은 최근 열린 미국화학협회에서 플레인 팝콘이 다이어트에 도움을 주며, 특히 항산화제를 다량 함유하고 있어 채소나 과일보다 젊음을 유지하는데 더 효과적이라고 주장했다.연구팀에 따르면 팝콘이 함유한 폴리페놀(polyphenol)이라는 항산화제는 건강에 유익할 뿐 아니라 세포가 파괴되는 것을 막아줌으로서 동안을 유지하는데도 효과적이다.또 채소나 과일 내 수분 함량이 일반적으로 90% 가까이 되는데 반해, 팝콘은 단 4%에 불과해 항산화제의 농도가 더욱 짙은 것으로 나타났다.팝콘 1인분에는 평균 300㎎ 정도의 항산화제가 들어있으며, 이는 모든 과일 1인분의 평균 항산화제 함량인 160㎎의 2배 가까운 수치다.게다가 바삭바삭한 팝콘의 껍질은 항산화제와 섬유소의 집결체인 까닭에 건강에 더욱 좋다고 연구팀은 주장했다.연구를 이끈 조 빈슨 박사는 “팝콘의 아삭한 껍질은 영양학적으로 매우 가치가 있다.”면서 “하지만 팝콘이 채소나 과일이 함유하는 모든 영양소를 가진 것은 아니기 때문에 팝콘에만 건강을 의지하는 것은 옳지 않다.”고 설명했다.이어 “팝콘은 가공하지 않은 100% 곡물 간식이기 때문에 ‘완벽한 스낵’이라고 부를 만 하다.”면서 “전자레인지에 돌린 팝콘은 열만 가하여 만든 팝콘보다 칼로리가 2배 가까이 되니 피하는 것이 좋다.”고 덧붙였다.송혜민기자huimin0217@seoul.co.kr나우뉴스 공식 SNS 계정: 트위터http://twitter.com/SEOUL_NOWNEWS[ 관련기사 ]☞ “뚱보가 날씬한 사람보다 건강할 수 있다” 이색 연구결과☞ 하루 한 잔, 살 안찌게 도와주는 ‘착한 술’ 있다?☞ ‘날씬 몸매’ 위한 하루 최소 수면 시간은?☞ ‘유체이탈’ 후 ‘사후 세계’ 경험 사실은…☞ 술 마시면 ‘필름 끊기는’ 원인 밝혀졌다별난 세상 별난 뉴스(nownews.seoul.co.kr) [서울신문 나우뉴스 통신원 모집] [신문 구독신청]- Copyrights ⓒ서울신문사. 무단 전재 및 재배포 금지 -"
65,2012-03-28,'뛰어내려요?!' 마포대교 전화가 특별한 이유,https://news.naver.com/main/read.nhn?mode=LSD&mid=shm&sid1=102&oid=008&aid=0002808541,머니투데이,"[머니투데이 배성민 기자]""나 죽으려고 해요. 월세낼 돈이 없어 집에서도 쫓겨났고 일거리도 없고.""""그러시면 안돼요. 방법이 있을테고 여러 사람들이 찾아볼테니 같이 해결해 봐요.""지난 24일 마포대교 생명의 전화를 통해 오간 대화다. 건조한 대화지만 이 전화로 죽음을 택하려던 한 사람이 삶과 죽음의 경계선에서 삶으로 어려운 발걸음을 뗐다.우울증에 경제적 어려움까지 겹치며 자포자기하던 허모씨는 그날 마포대교를 찾았다. 두번째였다. 그는 다리에서 뛰어내리기 직전 난간에 설치된 ‘긴급상담전화기(이하 생명의전화기)’를 발견했고 '혹시나' 하며 수화기를 들었다.하소연할 곳 없던 그는 자살예방전문가와 상담을 통해 속내에 있는 얘기를 털어놨고 그 사이 119의 출동이 신속하게 이루어져 자살을 막았다.그는 인근 병원의 응급실로 이송되었으며 한국생명의전화로 연계되어 상담서비스, 생활비 및 의료비를 지원받을 예정이다.생명의전화기는 자살을 시도하려는 사람에게 마지막 전화통화를 유도해 마음을 돌리도록 하거나 자살시도 광경을 목격한 사람이 신속하게 신고할 수 있도록 하는 기능을 하고 있다.전화기를 설치한 생명보험사회공헌재단은 지난해 마포대교, 한남대교에 이어 올해는 원효대교, 한강대교, 부산 광안대교 등 전국 자살다발지로 설치를 확대할 예정이라고 28일 밝혔다.설치 뒤 지난 9일까지 한강다리 2곳에 설치된 생명의전화기에는 60여건의 자살상담 및 신고전화가 왔다. 실제 자살시도자를 구조한 경우도 작년 8월과 올 3월 두차례 있었다.실제로 지난 5년(2008~2011)간 한강다리에서 투신 자살하는 사람은 458명으로 사흘에 한명 꼴이다. 특히 2010년부터 지하철역에 스크린도어가 설치되면서 자살시도가 불가능해지자 한강다리에서 투신하는 사례가 늘고 있다.생명보험사회공헌재단 이시형 이사장은 “앞으로도 생명의전화기가 자살기도자들의 마음을 돌리는데 큰 역할을 할 수 있기를 바란다”라고 말했다.생명보험재단은 청소년 자살을 줄이기 위한 인성교육, 미술치료 및 한국형 자살예방 교육과정을 개발 등 2008년부터 4년간 자살예방사업에 총 24억을 투입하고 있다.[주총현장] 주총 시즌 개막, 핫이슈는?[내손안의 스마트한 경제정보 머니투데이 모바일][관련 키워드]생명의전화|마포대교[머니투데이 핫뉴스]☞눈물흘린 손수조 ""이렇게 자객 많은 줄…""☞정상들이 탄 車, 일반인에 할인판매… 얼마나?☞신형 '싼타페' 실내도 노출, ""핸들이 웃네~""☞189만원짜리 '스토케 유모차', 알고보니 한국만…☞성시경·JYJ… 각국 영부인들 '한류'에 흠뻑배성민기자 baesm@<저작권자 ⓒ '돈이 보이는 리얼타임 뉴스' 머니투데이, 무단전재 및 재배포 금지>"
66,2012-03-28,삼성家 차남 일가 중 일부 소송 제기,https://news.naver.com/main/read.nhn?mode=LSD&mid=shm&sid1=101&oid=277&aid=0002762358,아시아경제,"[아시아경제 박지성 기자]상속권을 둘러싼 삼성가의 소송전이 또다시 확대됐다. 故이병철 삼성 창업주의 장남, 차녀에 이어 차남 일가도 소송에 동참했다. 이번에 합류한 故이재찬 전 새한미디어 사장 유가족은 상속권을 가진 이병철 회장 차남의 4남매 중 한명에 불과해 소송 규모 추가 확대 가능성도 열려있다.법무법인 화우는 28일 이재찬 사장의 유가족을 대리해 이건희 회장을 상대로 1000억원대 주식인도 등 청구소송을 제기한다고 밝혔다. 이재찬 사장은 이병철 창업주의 차남인 故이창희 새한미디어 회장의 둘째 아들이다.화우에 따르면 이재찬 사장의 부인 최선희 씨는 이건희 회장 명의 삼성생명 주식 45만4872주(452억원 상당)와 삼성전자 보통주식과 우선주식 각 10주, 삼성에버랜드가 보유한 삼성생명 주식 100주와 현금 1억원 등을 청구했다. 최씨의  아들 준호, 성호군은 삼성생명 주식 30만231주(301억원 상당)와 삼성전자 보통주 및 우선주 각 10주, 삼성에버랜드 명의의 삼성생명 주식 100주, 현금 1억원을 각각 청구했다.화우는 ""이씨 유가족이 최근 소송전을 계기로 상속권 침해를 알게 돼 정당한 상속권 회복을 위해 소송을 냈다""며 ""이미 소송이 진행 중인 이맹희, 이숙희씨의 주식인도 등 청구소송과 병합을 신청할 예정""이라고 설명했다.이재찬 사장 유가족의 소송 동참은 어느 정도 예상된 상황이다. 이병철 창업주의 장녀인 이인희 한솔그룹 고문과 3녀인 이순희 씨는 사업적으로 삼성과 얽혀 있기 때문에 섣불리 소송에 나서기 힘들다고 평가돼왔다. 하지만 이창희 회장의 새한 일가는 특별히 삼성과 연관된 영역이 없어 소송 전 합류가 유력하게 관측됐다. 이재찬 사장은 이창희 회장의 차남으로 상속을 주장할 권리는 남은 자녀들인 이재관 전 새한그룹 부회장, 이재원 전 새한상무보, 이혜진 씨도 가지고 있다.이재찬 사장 유가족의 법률대리인인 정진수 화우 변호사는 ""4남매 모두 상속권을 가지고 있어 이들이 소송에 합류할 경우 소송액은 더 확대될 수 있다""며 ""다만 이번 소송의 이재찬 사장의 유가족이 자발적으로 의뢰한 건으로 남은 자녀들이 추가로 소송에 합류할 의사가 있는지는 알 수 없다""고 언급했다.이건희 회장 측 소송 관련 대변인인 윤재윤 변호사는 ""청구 원인이 같기 때문에 추가로 동참한다고 해도 달라질 것은 없다""며 ""기존의 법률적 대응 방향은 변화가 없을 것""이라고 말했다.[모바일] 언제어디서나 만날 수 있는 내 손안의 아시아경제[증권방송] 2012년 투자 종목의 핵심은 바로...박지성 기자 jiseong@<ⓒ세계를 보는 창 경제를 보는 눈, 아시아경제(www.asiae.co.kr) 무단전재 배포금지>[관련기사]▶ 다리 3개 주는 치킨집 참 좋았는데…'충격'▶ '월급 떼먹은' 심형래 이번엔 또 어쩌다가…▶ ""박상아, 전두환 아들과 공식결혼 전 이미…""▶ ‘세계최초’ 인삼다당체 발견으로 ‘암 극복’ 새 바람▶ 야구장서 '치킨·맥주' 먹었는데 ""이럴수가"""
67,2012-03-28,일자리 1곳에 실업자 11명 경쟁,https://news.naver.com/main/read.nhn?mode=LSD&mid=shm&sid1=102&oid=003&aid=0004411905,뉴시스,"【서울=뉴시스】류난영 기자 = 일자리 한 곳을 놓고 경쟁하는 실업자 수가 11명을 넘어서는 등 구직 환경이 열악한 것으로 나타났다.고용노동부는 농림업과 어업을 제외한 분야의 근로자 1인 이상 사업체 2만8000개를 대상으로 사업체노동력조사를 벌인 결과 이같이 나타났다고 28일 밝혔다.조사 결과 2월 기준 빈 일자리 1개당 실업자수는 11.7명으로 전월보다 1.5명 늘어 늘었다.이는 빈 일자리 한 곳을 놓고 취업을 위해 실업자 11명 이상이 경쟁해야 한다는 의미로 이 숫자가 증가했다는 것은 경기침체 등으로 실업자가 늘었음을 보여준다.이 수치는 지난해 3월 12.0명으로 정점을 찍은 뒤 4월부터 8월까지 8~9명 수준으로 감소세를 지속하다 9월 9.5명 10월 8.2명, 11월 8.3명, 12월 8.9명 올 1월 10.2명 2월 11.7명 등으로 6개월째 증가하고 있다.현재 비어 있거나 1개월 안에 새로 채용될 수 있는 일자리를 의미하는 빈 일자리 수는 8만6000개로 전년동월 보다 13.4%나 줄었다.전체 근로자 수와 빈 일자리수를 합해 빈 일자리 수로 나눈 수치인 빈 일자리율은 전년동월대비 0.1% 감소한 0.7%였다.종사자 지위별로 보면 상용직의 빈 일자리수는 7만2461개로 전년동월대비 8.2% 감소했고, 빈 일자리율은 0.7%로 전년동월대비 0.1%포인트 줄었다.임시 및 일용직의 빈 일자리수는 1만3794개, 빈 일자리율은 0.8%로 젼년동월보다 각각 33.2%, 0.4%포인트 감소했다.빈 일자리수는 제조업(2만3558개), 보건복지(1만1255개), 운수업(8294개), 도매및소매(7226개) 등의 순으로 많았다.빈 일자리율은 운수업(1.4%), 보건복지(1.3%), 숙박및음식업(1.0%) 등의 산업이 높았다.올해 1월 말 기준 사업체 총 종사자수는 1360만명으로 전년동월(1345만6000명) 대비 14만4000명(1.1%) 증가했다.상용근로자는 1.2% 증가한 1094만6000명, 임시·일용근로자는 0.1% 감소한 162만4000명으로 나타났다.일정한 급여 없이 봉사료 또는 판매실적에 따라 수수료만 받는 기타종사자는 103만명으로 3.0%(3만명) 증가했다.전년 동월 대비 종사자수가 가장 많이 증가한 산업은 건설업(6만8000명)이었으며 가장 많이 감소한 산업은 교육서비스업(2만6000명 감소)으로 분석됐다.1월 기준 5인이상 사업체의 근로자 1인당 월평균 총근로시간은 170.3시간으로 전년 동월(178.6시간) 대비 4.6% 감소했다.상용근로자는 전년동월(183.9시간) 대비 5.3% 감소해 174.2시간 이었고 임시·일용근로자는 전년동월(122.8시간)대비 4.5% 증가한 128.3시간으로 집계됐다.전년 동월 대비 월평균 근로시간은 상용근로자의 경우 지난해 2월부터 전반적으로 감소하고 있고 임시·일용근로자는 2010년 12월부터 증가세를 유지하고 있다.산업별로는 부동산업 및 임대업이 월 평균 192.4시간으로 가장 길었으며 교육서비스업이 월 평균 147.5시간으로 가장 짧았다.상용근로자 5인 이상 300인미만 사업체의 총근로시간은 171.1시간으로 전년동월대비 4.6% 감소했으며 300인 이상 사업체는 167.3시간으로 전년동월대비 4.7% 감소했다.상용근로자 5인 이상 사업체의 근로자 1인당 월평균 임금총액은 339만원으로 전년동월(299만1000원) 대비 13.3% 상승했다.you@newsis.com[뉴시스 이시간 핫 뉴스]ㆍ 이건희 회장 조카 이재찬씨 유가족, 1000억대 소송ㆍ 안철수, ´정치´ 발언에 정계도 촉각…지각변동 오나ㆍ [초점①] 퇴직금 VS  퇴직연금…""이르면 2016년부터 ´퇴직연금´ 의무가입 해야""ㆍ 원전사고 ´또´?...신월성 1호기 시험가동중 정지ㆍ 오바마 경고에도 北 미사일 발사 계획 강행★ 손 안에서 보는 세상, 모바일 뉴시스<저작권자ⓒ 공감언론 뉴시스통신사. 무단전재-재배포 금지.>"
68,2012-03-28,경찰 '기소청탁' 관련 전원 불기소 의견 검찰송치,https://news.naver.com/main/read.nhn?mode=LSD&mid=shm&sid1=001&oid=001&aid=0005568577,연합뉴스,"""김재호 판사가 박은정 검사에게 청탁은 한 것으로 판단""(서울=연합뉴스) 김지헌 기자 = 새누리당 나경원 전 의원의 남편 김재호 서울동부지법 부장판사의 '기소청탁 의혹' 사건 관련 당사자들을 경찰이 모두 불기소 의견으로 검찰에 송치했다.서울지방경찰청은 지난해 10월 서울시장 보궐선거를 앞두고 나경원 당시 한나라당 후보측이 시사인 주진우 기자를 명예훼손으로 고발한 사건을 증거불충분에 따른 불기소 의견으로 검찰에 송치했다고 28일 밝혔다.또 지난 1월 시사인 주진우 기자가 나 전 의원과 남편 김 판사 등에 대해 같은 혐의로 고소한 사건 역시 증거불충분에 따른 불기소 의견으로 송치했다.경찰은 김 판사와 주 기자 및 김 판사로부터 기소청탁을 받았다는 박은정 검사 등 핵심 관련자들이 출석을 거부했지만 지금까지의 수사만으로도 결론 도출에 지장이 없고 공소시효도 얼마 남지 않아 수사를 마무리한다고 설명했다.경찰은 그러나 수사 결과 박 검사와 김 판사의 진술서 및 나 전 의원의 진술 등을 종합하면 김 판사가 박 검사에게 사건과 관련된 청탁을 한 것으로 판단된다고 밝혔다.경찰은 김 판사와 나 전 의원의 경우 허위사실임을 알면서도 허위 내용의 논평 자료를 작성ㆍ배포했다는 증거가 부족해 혐의를 인정하기 어렵고, 주 기자의 경우 박 검사와 김 판사의 진술서 내용 및 발언의 전체적 취지로 볼 때 명예훼손의 고의를 인정할 증거가 부족해 불기소 의견을 냈다고 설명했다.경찰은 공직선거법 250조가 당선되게 하거나 당선되지 못하게 할 목적으로 후보자 또는 그의 배우자에 관해 허위사실을 유포하는 행위를 금지하고 있지만 이 사건에서는 양측이 허위사실을 명백히 인지했다거나 뚜렷한 목적성이 있었다는 증거가 부족하다고 밝혔다.valelapena@yna.co.kr[이 시각 많이 본 기사]☞美경찰관, 거짓말했다가 3억5천만원 배상☞'디워' 심형래 감독 제작비 대출금 소송 패소 확정☞손학규 ""돈봉투 의혹 사실이면 정계은퇴""(종합)☞-챔스리그- '후반 3골' 마드리드, 아포엘 제압☞日언론 ""핵안보회의 北 미사일이 큰 비중""<연합뉴스 모바일앱 다운받기><포토 매거진><저작권자(c)연합뉴스. 무단전재-재배포금지.>"
