,날짜,기사 제목,기사 링크,기사 출처,기사 내용
0,2014-08-15,징용 포로들 조국애…'자유한인보' 공개,https://news.naver.com/main/read.nhn?mode=LSD&mid=shm&sid1=102&oid=437&aid=0000049183,JTBC,"[앵커]2차 대전 당시 일제에 강제 징용됐다가 하와이 포로수용소에 갇혔던 한인들 얘기 들어보셨는지요. 이들이 절절한 조국애를 담아 발간한 소식지 '자유한인보'를 JTBC가 단독 취재했습니다.부소현 특파원입니다.[기자]총 7차례 발간된 자유한인보 중 이번에 발견된 건 4호와 5호.독립기념관이 소장 중인 7호를 빼고 진본이 공개된 건 처음입니다.자유한인보는 1945년 10월 하와이에서 최초로 발간된 한인 징용자들의 소식지로, 밀랍지에 손으로 글씨를 쓴 뒤 롤러식 등사기로 인쇄해 제작했습니다.이번에 JTBC 취재진에 공개된 4호와 5호는 오키나와 전투에서 미군에게 포로로 잡혀 하와이에 수용됐던 고 권임준 씨의 유품입니다.[권용섭/고 권임준씨 아들 : (어릴 땐) 잘 몰랐는데 커서 독도 운동도 하고 한일 관계를 알게 되면서 자료가 귀한 것이다 싶어 미국에 가져왔습니다.]5호엔 제대로 된 나라를 세우지 않으면 후손들이 같은 일을 당하게 된다는 뼈아픈 결의와, 4호엔 조국에 돌아갈 수 있게 됐다는 기쁨이 담겼습니다.[김도형/독립기념관 한국독립운동사연구소 책임연구위원 : 독립운동에 관한 내용도 많이 보충이 될 거 같아요. 단순히 하와이 한인 포로의 생활을 기록한 것에서 더 나아가 역사적 의미가 있습니다.]유족들은 한국에서 요청하면 기증하겠다는 의사도 밝혔습니다.고단한 포로 생활 중에서도 조국을 잊지 않았던 당시의 생생한 기록은 일제 강제 징용사 연구에 귀중한 자료가 될 전망입니다.부소현▶ JTBC 뉴스 공식 SNS[트위터][페이스북][카카오스토리][유튜브]▶ JTBC 뉴스는 여러분의 생생한 제보를 기다립니다.Copyright by JTBC, DramaHouse & JcontentHub Co., Ltd. All Rights Reserved. 무단 전재 및 재배포 금지"
1,2014-08-15,청소할 때 세제 대신 쓸 수 있는 식품 6가지,https://news.naver.com/main/read.nhn?mode=LSD&mid=shm&sid1=103&oid=081&aid=0002451999,서울신문,"[서울신문 나우뉴스]집안에 녹이나 물때, 얼룩이 묻어 있는 것을 보면 신경 쓰이기 마련이다. 이때 각각의 용도에 맞는 전용 세제를 쓰는 것이 좋지만 만일 그런 세제가 없다면 같은 효과를 지닌 대용품을 사용하는 것도 현명한 방법이 될 수 있다.다음은 최근 영국 일간 데일리메일이 청소대행업체를 운영하고 있는 청소 전문가의 조언을 빌어 세제 대신 쓸 수 있는 식품들을 소개했다. 이미 알고 있는 것도 있을 수도 있지만 확인하고 필요할 때 실생활에 활용해보자.1. 감자=베이킹소다를 섞으면 옥살산이 발생한다. 이는 녹을 분해하는 효과를 지니고 있다. 식초나 콜라, 레몬주스에도 녹을 제거하는 효과가 있다고 한다.2. 김빠진 콜라=탄산음료를 그냥 버리기보다는 변기에 붓고 잠시 내버려둔 다음 화장실 솔로 문지르면 찌든 때도 쉽게 닦아낼 수 있다. 식초 역시 같은 효과를 볼 수 있다.3. 토마토케첩=놋쇠(황동)나 구리, 은과 같은 금속을 닦을 때 좋다고 한다. 필요한 부분을 케첩으로 문지르고 젖은 수건으로 잔여물을 닦아내면 이런 금속으로 만든 제품이 깨끗해진 것을 확인할 수 있을 것이다.4. 마요네즈=목재로 된 벽이나 문, 바닥 등에 붙은 오염물을 제거하고 싶을 때 마요네즈로 문질러 준 뒤 마른 수건으로 닦으면 좋다. 마요네즈에 포함된 유분이 얼룩 제거제 효과를 갖고 있다고 한다. 브라질 너트 역시 비슷한 효과를 지니고 있는 데 반으로 잘라 문지르면 된다.5. 자몽=스펀지로 닦아도 좀처럼 지워지지 않는 물때는 반으로 자른 자몽에 소금을 뿌려 문지른 뒤 다시 스펀지로 닦아내면 쉽게 지울 수 있다. 자몽은 다른 식품보다 가격이 비싸니 상해서 먹지 못하는 것으로 활용하는 것이 좋을 듯하다.6. 바나나 껍질=먹고 남은 껍질은 가죽 제품을 닦을 때 유용하게 쓸 수 있다. 껍질 안쪽으로 문지른 뒤 젖은 수건으로 닦아내면 된다고 한다. 바나나에 포함된 칼륨이 가죽 표면에 긁힌 자국을 보이지 않게 해준다. 칼륨은 구두 광택제에도 포함된 성분이다. 단 일부 가죽 제품 중에는 특수한 방식으로 가공된 것도 있으니 사용 시 잘 보이지 않는 부분에 먼저 시험해보고 사용하고 만일 고가의 제품이라면 전용 클리너를 사용하는 것이 좋다.사진=ⓒ포토리아윤태희 기자 th20022@seoul.co.kr별난 세상 별난 뉴스(nownews.seoul.co.kr)★★ 각 부문 나우뉴스 통신원 大모집합니다 ★★- Copyrights ⓒ서울신문사. 무단 전재 및 재배포 금지 -"
2,2014-08-15,우리 문화재가 日 호텔 장식품으로…갈수록 배짱,https://news.naver.com/main/read.nhn?mode=LSD&mid=shm&sid1=102&oid=055&aid=0000284696,SBS,"<앵커>아직도 일본 속에 있는 한국 문화재, 한 두 점이 아니죠. 하나하나가 기구한 사연을 간직하고 있습니다. 심지어는 남의 땅에서 호텔 장식품이나 관광지 창고처럼 쓰이기도 합니다. 반환 운동이 거세질수록 일본은 이것들을 숨기거나 배짱을 부리고 있습니다.도쿄 최선호 특파원입니다.<기자>일본 유명 관광지, 가마쿠라 대불입니다.대불 뒤쪽의 작은 건물 한 채, 우리 경복궁의 일부였던 관월당입니다.조선 왕실이 진 빚을 갚지 못하자, 일제는 빚 담보라며 건물을 해체해 이곳으로 옮겼습니다.지금은 문화재를 보관하는 법당으로 쓰이고 있습니다.고려말 제작된 이천 5층 석탑은 도쿄 오쿠라 호텔의 장식품으로 전락했습니다.호텔 창업주격인 오쿠라 기하치로가 1918년 일본으로 반출했습니다.당시 조선 총독과 주고받은 서신을 보면, 평양 칠층석탑을 달라는 오쿠라에게, 조선 총독은 사람들 눈에 띌 수 있으니 이천 석탑을 대신 가져가라고 말합니다.약탈 문화재라는 명백한 증거입니다.그런데도 오쿠라 측은, 우리가 소장하고 있는 일본 문화재와 맞교환을 요구하고 있습니다.[이가라시/게이오대학 고고학 비상근 교수 : 약탈 문화재를, 약탈이 아닌 정상적인 물건과 교환하자는 이야기는 있을 수 없습니다.]신라 3대 범종으로 꼽히는 진주 연지사 종은 일본 후쿠이 현 한 신사에 보관돼 있습니다.한국에서 반환 운동이 일자, 아예 창고 속에 감춰버렸습니다.[이양수/문화재반환문제 연락회의 간사 : (한일)문화재협정에는 '완전해결'이라는 말, 한마디도 없습니다.스스로 한국에 선물로 주는 것은 국가적으로 권장한다고(정했습니다.)]여론몰이식 반환 요구보다는 약탈 과정에 대한 철저한 조사와 끈질긴 협상이 중요하다는 지적입니다.(영상취재 : 안병욱)최선호 기자choish@sbs.co.kr☞[SBS기자들의 생생한 취재현장 뒷이야기 '취재파일']☞ SBS뉴스 공식 SNS [SBS8News 트위터] [페이스북]저작권자 SBS&SBS콘텐츠허브 무단복제-재배포 금지"
3,2014-08-15,"프란치스코 교황, 솔뫼성지 김대건 신부 앞에서 고개 숙이다",https://news.naver.com/main/read.nhn?mode=LSD&mid=shm&sid1=103&oid=003&aid=0006018249,뉴시스,"【당진=뉴시스】사진공동취재단 = 방한 이틀째인 프란치스코 교황이 15일 충남 당진 솔뫼성지에 있는 김대건 신부의 생가를 방문해 헌화를 한 뒤 기도를 하고 있다. 2014.08.15.    photo@newsis.com【당진=뉴시스】유상우 기자·공동취재단 = 프란치스코(78) 교황이 15일 김대건 신부의 생가인 솔뫼성지를 찾았다. 솔뫼 성지는 한국 최초의 천주교 사제 김대건(1822~1846) 신부가 태어난 곳으로 한국 천주교의 모태가 된 장소다.프란치스코 교황은 이날 오전 대전 월드컵경기장에서 열린 ‘성모 승천 대축일 미사’를 마치고 아시아 청년들과 오찬을 한 뒤 헬기를 타고 이곳으로 왔다. 오후 4시35분 당진 우강초등학교에 도착한 프란치스코 교황은 승용차에 올라 900m쯤 떨어진 솔뫼성지로 이동했다. 도로변 시민들은 교황이 보이자 환호했다.【당진=뉴시스】사진공동취재단 = 프란치스코 교황이 15일 오후 아시아청년대회가 열리고 있는 충남 당진시 솔뫼성지를 방문, 이동하면서 신도들을 만나고 있다. 2014.08.15.    photo@newsis.com프란치스코 교황은 성지 입구에서 무개차로 갈아타고 유흥식 대전교구장과 함께 김대건 신부 생가로 갔다. 입구부터 걸어서 성지를 둘러볼 예정이었으나 시간상 무개차에 올랐다.성지로 들어서자 아시아청년대회 참가자들, 바리케이드 밖 주민들과 신자 등 5만여명이 손뼉을 치며 ‘비바 파파’를 연호했다.프란치스코 교황은 환한 미소와 함께 손을 흔들며 화답했다. 출입을 허가받지 못한 사람들은 성지 잔디밭 중간쯤에 설치한 바리케이드 밖에서 프란치스코 교황을 지켜봤다. 프란치스코 교황은 무개차 타고 200m쯤 가다가 김대건 신부 생가 전방 30m에서 내린 뒤 유 주교와 함께 걸었다.【당진=뉴시스】사진공동취재단 = 프란치스코 교황이 15일 충남 당진시 솔뫼성지 김대건 신부 생가에서 기도를 하고 있다. 2014.08.15.    photo@newsis.com프란치스코 교황은 자신을 마중 나온 이용호 솔뫼성지 신부의 안내로 ‘ㄱ’ 자형 기와집으로 만들어진 생가 마루로 향했다. 이후 꽃단지를 놓고 마루 앞에 놓인 의자에 앉아 마루 뒷벽에 걸린 김대건 신부 초상화를 한참 동안 바라보다가 3분 정도 기도했다.기도 후 가슴에 성호를 긋고 자리에서 일어나 김대건 신부 초상화를 향해 고개를 숙였다. 그리고 생가 앞마당에 설치된 방명록에 안경을 끼고 서명했다. 이어 어린이가 은으로 만든 무궁화 꽃을 선물하자, 교황은 이 어린이를 들어 올린 뒤 껴안고 미소를 지으며 볼을 비볐다.김대건 신부 생가 마당에 성수를 뿌린 뒤 경호용 바리케이드 밖에 늘어선 사람들과 손을 잡고 입을 맞추며 위로했다.【당진=뉴시스】사진공동취재단 = 15일 프란치스코 교황이 한국인 최초의 사제인 김대건신부의 생가가 있는 충남 당진시 솔뫼성지를 방문해 기도를 올리고 있다. 2014.08.15.    photo@newsis.com박소연(42·충남 계룡시)씨는 “나라가 힘든 상황에 와서 평화의 메시지를 전해 줘 좋았다. 일곱살 딸과 함께 왔다. 건강하게 있다가 갔으면 좋겠다”고 말했다. 조호정(20·대전)씨는 “교황이 가난한 이들의 어려움을 강조하는 게 늘 마음에 와 닿았다. 직접 교황을 본다는 생각에 무척 설레고 기뻤다”고 전했다.학생 40명과 함께 이곳을 찾은 이현선 마리로비나 수녀(노틀담수녀회·대철중학교 교사)는 “교황은 가난한 사람들에 대한 애정이 깊다. 특히 신자유주의로 인한 여러 사회 부조리가 만연한 가운데 교황은 희망을 준다. 특히 교황이 최초 신부인 김대건 신부의 탄생지인 솔뫼에 온 것은 우리나라의 역사를 깊이 생각한 것”이라고 말했다.프란치스코 교황은 김대건 신부 생가 앞에서 17분 정도 머문 뒤 다시 무개차를 타고 아시아청년대회가 열리는 솔뫼성지 주차장 옆 대형 천막으로 이동했다. 이곳에서 아시아 청년들을 만났다.【당진=뉴시스】사진공동취재단 = 프란치스코 교황이 15일 오후 아시아청년대회가 열리고 있는 충남 당진시 솔뫼성지를 방문, 이동하면서 신도들을 만나고 있다. 2014.08.15.    photo@newsis.comswryu@newsis.com★ 뉴시스 뉴스, 이젠 네이버 뉴스 스탠드에서도 만나세요★ 손 안에서 보는 세상, 모바일 뉴시스<저작권자ⓒ 공감언론 뉴시스통신사. 무단전재-재배포 금지.>"
4,2014-08-15,"카메라 되고픈 스마트폰, 누구?",https://news.naver.com/main/read.nhn?mode=LSD&mid=shm&sid1=105&oid=028&aid=0002242850,한겨레,"왼쪽부터 삼성 갤럭시S5, 소니 엑스페리아 Z2, LG G3. 스마트폰을 들고 있는 이는 왼쪽부터 김명진·정용일·박승화 기자.[한겨레][카트21]<한겨레21> 사진기자가 살펴본 2014년 상반기 출시된스마트폰 삼성 갤럭시S5, LG G3, 소니 엑스페리아 Z2[쇼핑 주문서]고성능 스마트폰 카메라 경쟁시대, 어떤 제품이 더 좋을까.[주문 내역]100만 화소, 200만 화소…. 계절이 바뀔 때마다 휴대전화 카메라의 화소 수가 불어나던 시절이 있었다. 스마트폰 시대로 넘어오면서 카메라의 진화에도 가속도가 붙었다. 1천만 화소를 훌쩍 넘어선 스마트폰 카메라는 이른바 ‘똑딱이’라 불리는 일반 디지털카메라의 성능도 뛰어넘은 지 오래다. 스마트폰 업계는 이제 화소 경쟁을 넘어, 다양한 기능과 화질 경쟁으로 옮겨붙고 있는 분위기다. 스마트폰 업계의 ‘카메라 전쟁’은 올해 상반기 국내 시장에 나온 스마트폰 제품의 기능에서도 확인할 수 있다. ‘사진기’의 정체성을 좀더 강화하고 있는 스마트폰의 변화는 올해 하반기에 출시될 애플의 아이폰6, 삼성 갤럭시노트4 등에서도 점점 확대될 것으로 보인다. 이에 단순 비교만으로는 구분이 어려워진 고성능 스마트폰 카메라를 전문가의 관점에서 하나씩 살펴보기로 했다.[구매 목록]2014년 상반기 국내 시장에 선보인 스마트폰인 삼성 갤럭시S5, LG G3, 소니 엑스페리아 Z2 등 3종사진기자라고 늘 묵직한 카메라만 쓰라는 법은 없다. 전문가용  디지털일안반사식(DSLR) 카메라와 스마트폰을 번갈아가며 만지는 2014년 사진기자들이야말로 스마트폰이 가진 카메라로서의 ‘정체성’을 가장 잘 이해하는 이들이다. <한겨레21> 지면에서 활약 중인 사진기자 3인방, 박승화·정용일·김명진 기자가 삼성 갤럭시S5, LG G3, 소니 엑스페리아 Z2 등 3종을 지난 8월1일부터 7일까지 사용한 뒤 ‘평가단’으로 나섰다. 스마트폰을 전화기가 아닌, 순수하게 카메라로서 바라본 일주일이었다. 사용 후기를 옮기기에 앞서, 평가단에게 평소 얼마나 스마트폰 카메라를 쓰는지 물었다. 당신에게 스마트폰이란?호불호 갈리지만, 색감 차이 의미 없어박승화(이하 박)- 스마트폰 사진을 많이 찍는 편이다. 평소 소셜네트워크서비스(SNS)에 올리는 사진은 대부분 스마트폰으로만 찍는다. 풍경이나 특별한 장면 같은 경우가 많다.정용일(이하 정)- 내 스마트폰은 인물을 찍는 용도가 대부분이다. 휴일 가족사진이나, 모임에 갔을 때, 그리고 음식 사진 같은 것이 전부.김명진(이하 김)- ‘사진용’으로는 스마트폰 카메라를 거의 안 쓴다. 메모를 하거나 자료를 남길 때나 꺼내 쓴다. 사진은 웬만하면 DSLR로.박- 어느 순간부터 스마트폰 카메라의 품질이 일반 카메라를 따라잡았다. 예전에 아이폰4를 쓸 때, 어느 정도 해상도가 나오는지 궁금해 사진을 찍어서 프린트한 적이 있다. 예전 필름카메라와 비견될 만한 수준이었다. 그 뒤로 가끔 지면용 사진을 스마트폰으로 찍어 내보낸 적도 있다. (사진기자라서) 카메라를 보면 거부반응을 보이는 현장에서 스마트폰을 쓰기도 했다.DSLR의 경우, 브랜드마다 색감 등에 대한 차이가 존재한다. 사진기자 사이에서도 색감에 대한 호불호가 있다. 그저 개인적인 취향이다. 과연 스마트폰 카메라에서도 이런 색감의 차이가 나타날까. 그러나 평가단은 색감 등의 차이는 거의 느끼지 못했으며, 스마트폰 디스플레이에 따른 차이 정도를 알 수 있었다고 답했다.김- 큰 차이를 느낄 만한 정도가 아니었다. 실제 사진을 찍어 컴퓨터에서 확인해보면 세 제품 모두 큰 차이는 없었다. 결국 색감은 각 회사의 디스플레이 구현 능력 등에 따른 차이인 셈이다. 삼성의 경우, S-AMOLED(능동형 유기발광다이오드)를 쓰기 때문에 피사체가 좀더 날카롭게 보이는 경향이 있었지만, 큰 차이는 아니었다.정- 색 제어력을 봤을 때도 대동소이했다. 그중에서도 소니는 실물의 색과 카메라에 찍힌 색을 비교했을 때, 색 재현력이 뛰어났다. 일반 카메라와 같다고 느껴졌다.박- 사실 차이를 찾는 게 의미가 없다. 대부분 스마트폰 안에 사진을 넣고 보기 때문에 직접 인화를 하거나 다른 기기에서 출력을 하지 않는 한, 디스플레이에서 보이는 부분이 중요한 것일 테니 말이다.김- 디스플레이에서 볼 때도 차이는 좀 있다. 삼성은 좀더 누런 느낌이 있었다. DSLR도 ‘화이트 밸런스’를 어떻게 맞추느냐에 따라 차이가 나는데, 삼성 카메라의 기본적인 설정이 다른 것 같다. 소니는 좀더 붉은 색감이 강했고, LG가 가장 뉴트럴(중성색) 느낌이 들었다.기능적인 부분에서 평가단은 애초에 소니의 다양한 카메라 기능에 관심을 보였다. 일반 카메라 수준의 고속촬영 기능과 다양한 설정 등이 눈에 띄었기 때문이다. 그러나 실제 사용한 뒤에는 의견이 갈렸다.박- 기능적인 부분에서 LG와 소니 모두 훌륭했다. LG의 경우, 측거점(카메라의 거리·빛 등을 계산하는 초점)이 9개나 나온다. 측거점이 많다는 건, 카메라가 좀더 세부적으로 피사체를 측정해서 찍는다는 뜻이다.정- 소니는 사진을 많이 찍어서 어느 정도 과열이 되자 카메라 기능이 갑작스레 꺼지고 멈추는 일이 있었다. 동영상 기능이 아닌 사진 기능을 쓰는 상황이었다. 오래 켜둔 것도 아니었는데, 불편했다.카메라 되고픈 스마트폰셔터스피드·그립감 따라 천차만별‘카메라’에 정체성을 두고 스마트폰을 바라보면 그립감도 빼놓을 수 없는 요소다. 이와 함께 스마트폰 자체가 손쉽게 촬영할 수 있는 구조인지도 평가단의 관심을 끌었다. 그 점에서 LG에 있는 화면에서 손가락을 갖다 대면 초점을 맞추는 것과 동시에 촬영을 할 수 있는 ‘레이저 오토포커스’ 기능은 실제 활용 가치가 높다는 평가를 받았다. 그 밖에 외부 버튼으로 카메라를 실행하고 촬영도 할 수 있는지, 그리고 셔터 스피드 등에 대한 평가가 이어졌다.정- 사진을 재빠르게 찍는 속사성 측면에서 화면 터치로 초점을 맞춰 찍는 게 훨씬 빠르다. 자기가 원하는 부분을 정확히 맞출 수 있기 때문이다. 물론 찍으면 다 맞는지는 모르겠지만, 정확히 맞춘다면 LG가 편하다.박- 셔터 스피드도 LG가 가장 빨랐다. 소니는 고속 연사 기능이 있긴 한데, 간극이 느렸다. 우리가 쓰는 DSLR는 이른바 ‘리얼타임’으로 찍힌다. 순간포착을 한다고 생각하면, 셔터 스피드도 빠르고 촬영이 간편한 게 훨씬 유리하다. 예를 들어 아이를 찍는상황이라면 아주 활용도가 높을 것이다.김- 삼성 갤럭시S5는 터치 반응은 빨랐다. 카메라 초점도 잘 맞춰졌다. 결국 LG는 한 번에 편하게 눌러도 찍히는 것이고, 삼성은 초점은 잘 맞지만 한 번 더 눌러야 하는 차이다.많은 기능보다 필요한 기능이 있는지정- 소니·삼성도 옆면에 카메라 버튼이 있다. 이 버튼을 누르면 바로 카메라 기능이 켜져 사진을 찍을 수 있다. 문제는 그립이다. 사진 버튼을 특화한 것은 좋은데, 디스플레이 바깥 모서리가 거의 없어 화면을 터치하지 않고는 스마트폰을 좀처럼 쥐기 어렵다. 오작동의 가능성도 있다. 그나마 뒷면을 둥글게 처리하고 앞면 아랫부분에 공간이 있는 LG가 총체적으로 그립감은 낫다.박- 스마트폰을 들고 가다가 ‘앗, 저거 찍어야지’ 했을 때 LG가 빠르고 편했다. 소니는 예비 동작이 필요했다.정- 기본적으로 좋아진 건 외부에 카메라 촬영을 위한 버튼이 있는 것이다. 그만큼 카메라 기능에 특화를 시켰다는 것 아니겠나. 세 제품 모두 화면을 누르지 않고 찍을 수 있다는 점은 좋다. LG는 주먹을 쥐면 사진이 찍히는 기능이 있는데, 음성 지원은 따로 안 돼서 아쉬웠다.김- 소니는 사람을 지정하면 얼굴을 따라가며 초점을 맞추는 기능이 있다. 과거 소니 카메라에 있던 기능이 들어왔다. 잘 활용하면 유용한 기능이다.박- 카메라 기능이 과도하게 많긴 하지만, 그중에서 하나라도 내가 잘 활용할 수 있고 나한테 필요한 게 있으면 좋은 것이다.김- 삼성은 반응 속도도 빠르고 연사도 빠르긴 한데, 특별하게 여길 장점은 없었다. 카메라로 치면 그냥 ‘똑딱이’ 같은, 본래 기능에 충실한 카메라처럼 느껴졌다. 스마트폰 뒤쪽도 미끄럽지 않게 설계해놔서 좋다. 그런데 소니는 미끌미끌하다.평가단은 삼성과 소니에만 있는 방진·방수 기능이 카메라로서도 가장 큰 매력이라고 지적했다. 실제 카메라 사용이 잦다면 이런 기능이 활용도를 충분히 높이기 때문이다.박- 스마트폰 카메라의 줌은 광학 줌이 아니기 때문에 별 가치가 없다. 큰 사진에서 일부분을 잘라내는 거나 마찬가지이기 때문이다. 소니는 스티커 사진을 찍는 기능도 있다. 아이들이 좋아할 만하다.정- 소니는 공간을 인식해 스티커 효과를 내기도 하더라.김- 다양한 기능이 있긴 한데, 나 같으면 한두 번 쓰고 안 쓸 것 같다. 평소 생활 방수는 큰 장점이다. 사진을 찍을 때도 중요하다. 우리가 사진을 찍을 때 비가 오면 스마트폰을 보호하려 들지 않나. 그런 점에서 비 올 때 막아주는 기능은 좋다. 그런데 삼성은 정작 물속에 넣어두고 찍을 때는 초점이 잘 안 맞더라. 물속에서 찍는 건 쉽지 않을 듯하다.사진 찍고 싶은 카메라, LG G3색감·기능·보호 등 다양한 평가를 거쳐 평가단에게 들고 나가서 사진 찍고 싶은 스마트폰 카메라가 뭔지 물었다. 평가단 모두 LG G3를 뽑았다. “화면 터치로 초점을 맞출 수 있고, 측거점도 많아 쉽게 찍을 수 있다.”(정용일) “밝고 어두운 공간에서 기본적인 기능의 한도로 일정하게 품질이 유지됐다. 다른 제품들은 사진 품질의 난조가 심했다.”(박승화) “솔직히 화질·기능에서 큰 차이는 없었다. 디스플레이에 표시되는 기본적인 색감이 가장 맘에 들었다.”(김명진)글·사진 김성환 기자 hwany@hani.co.kr공식 SNS[페이스북][트위터]|[인기화보][인기만화][핫이슈]Copyrights ⓒ 한겨레신문사, 무단전재 및 재배포 금지<한겨레는 한국온라인신문협회(www.kona.or.kr)의 디지털뉴스이용규칙에 따른 저작권을 행사합니다.>"
