,날짜,기사 제목,기사 링크,기사 출처,기사 내용
62,2014-08-15,공주 수양관에 승용차 돌진…1명 사망·50여명 부상,https://news.naver.com/main/read.nhn?mode=LSD&mid=shm&sid1=102&oid=001&aid=0007070004,연합뉴스,"공주 수양관 사고 현장     (공주=연합뉴스) 한종구 기자 = 15일 오후 1시 5분께 충남 공주시 정안면 갈릴리수양관에서 김모(53·여)씨가 몰던 SM7 승용차가 수양관의 한 건물 '필로티'로 돌진해 1명이 숨지고 50여명이 다쳤다. 사진은 사고 현장.2014.8.15    jkhan@yna.co.kr부상자 어린이 다수 껴 있어…운전자 '급발진' 주장(공주=연합뉴스) 이재림 기자 = 15일 충남 공주 한 수양관에서 승용차가 건물 안으로 돌진해 1명이 숨지고 50여명이 중경상을 입었다.이날 오후 1시 5분께 충남 공주시 정안면 갈릴리수양관 안 도로에서 김모(53·여)씨가 몰던 SM7 승용차가 수양관 건물 '필로티'로 돌진했다. 필로티는 지상 1층이 기둥으로 이뤄져 주차장 등으로 활용하는 개방된 공간을 뜻한다.이 사고로 최모(10)양이 크게 다쳐 병원으로 옮겨졌으나 숨졌다.다른 12명은 큰 상처를 입었다. 이 중에는 어린이도 다수 껴 있는 것으로 전해졌다.공주 수양관 사고 현장     (공주=연합뉴스) 한종구 기자 = 15일 오후 1시 5분께 충남 공주시 정안면 갈릴리수양관에서 김모(53·여)씨가 몰던 SM7 승용차가 수양관의 한 건물 '필로티'로 돌진해 1명이 숨지고 50여명이 다쳤다. 사진은 사고 현장.2014.8.15    jkhan@yna.co.kr일부 중상자는 현재 위독한 상태인 것으로 알려졌다. 또 다른 38명도 경상을 입었다.이들은 치료를 위해 공주의료원, 공주현대병원, 천안단국대병원, 천안순천향병원 등으로 각각 옮겨졌다. 일부 피해자는 상처가 크지 않아 병원에서 치료를 마친 뒤 귀가했다.해당 수양관에서는 전국 50여개 교회에서 가족 단위 신자들이 모여 여름 성경세미나(하계수양회)를 진행 중이었다.사고 당시 참석자들은 점심을 하고 현장에 모여 휴식을 취하고 있던 것으로 파악됐다.김씨 차량은 필로티 안쪽 20여ｍ를 그대로 직진해 완전히 통과한 뒤에야 멈춰선 것으로 확인됐다.수양관 관계자는 ""안전을 위해 현장에 상주하던 의사 4명이 환자 상태를 파악해 가장 응급한 아이부터 후송조처했다""며 ""앰뷸런스 10여대가 들어와서 병원으로 분산 이송했다""고 설명했다.그러면서 ""경찰이 사고 원인을 조사 중인 것으로 안다""며 ""현재로서는 부상자 치료를 최우선 순위로 두고 있다""고 덧붙였다.운전자 김씨는 '급발진 사고'를 주장하는 것으로 알려졌다.김씨는 경찰에서 ""주차장에 주차하던 중 건물 통로로 차량이 갑자기 진행했다""며 ""차를 멈추려고 브레이크를 밟았는데도 계속 직진했다""고 진술했다.해당 차량에 블랙박스는 설치돼 있지 않은 것으로 전해졌다.경찰은 김씨를 상대로 정확한 사고 경위를 조사하고 있다.walden@yna.co.kr▶교황 방한 특집페이지 바로가기▶확 달라진 연합뉴스 앱 다운로드<저작권자(c) 연합뉴스, 무단 전재-재배포 금지><그래픽> 공주 수양관 승용차 돌진 사고     (서울=연합뉴스) 장예진 기자 = 15일 충남 공주 한 수양관에서 승용차가 건물 안으로 돌진해 1명이 숨지고 51명이 중경상을 입었다.    jin34@yna.co.kr    @yonhap_graphics(트위터)"
63,2014-08-15,공주 교회수양관에 승용차 돌진…50여명 중경상,https://news.naver.com/main/read.nhn?mode=LSD&mid=shm&sid1=102&oid=001&aid=0007069875,연합뉴스,"(공주=연합뉴스) 이재림 기자 = 15일 충남 공주의 한 수양관에 승용차가 돌진해 50여명이 중경상을 입었다.이날 오후 1시 5분께 충남 공주시 정안면 한 수양관에서 김모(53·여)씨가 몰던 SM5 승용차가 건물로 돌진했다.이 사고로 건물 안에 있던 13명이 큰 상처를 입어 인근 병원으로 옮겨져 치료를 받고 있다. 이 중에는 어린아이도 껴 있는 것으로 전해졌다.일부 중상자는 현재 위독한 상태인 것으로 알려졌다. 또 다른 38명도 경상을 입어 인근 병원으로 옮겨졌다.해당 수양관에서는 교회 여름성경학교가 진행 중이었던 것으로 알려졌다.경찰은 정확한 사고 원인을 조사하고 있다.walden@yna.co.kr▶교황 방한 특집페이지 바로가기▶확 달라진 연합뉴스 앱 다운로드<저작권자(c) 연합뉴스, 무단 전재-재배포 금지>"
64,2014-08-15,"중국 ""日 야스쿠니 참배에 결연히 반대""",https://news.naver.com/main/read.nhn?mode=LSD&mid=shm&sid1=104&oid=001&aid=0007069847,연합뉴스,"""역사 직시하고 깊이 반성해야""(베이징=연합뉴스) 홍제성 특파원 = 중국 정부는 일본의 패전일인 15일 아베 신조(安倍 晋三) 일본 총리가 야스쿠니(靖國) 신사에 공물료를 납부하고 일부 각료 등이 야스쿠니 신사 참배를 강행한 데 대해 ""결연히 반대한다""며 비판했다.중국 외교부는 이날 화춘잉(華春瑩) 대변인 명의로 '기자와의 문답' 형태의 논평을 통해 일본 지도자들의 이런 행위에 대해 ""역사 문제를 대하는 일본 정부의 잘못된 태도를 재차 드러낸 것""이라면서 단호한 반대 입장을 표명했다.화 대변인은 ""야스쿠니 신사는 일본 군국주의가 대외적인 침략 전쟁에 시동을 건 정신적 도구이자 상징""이라면서 야스쿠니 신사 문제의 본질에 대해 ▲ 일본 정부가 과거 침략 역사를 정확히 인식하는지 ▲ 아시아 피해국 인민의 감정을 존중하는지 ▲지금까지 역사문제에 대해 밝혀온 입장과 약속을 준수하는지에 있다고 규정했다.그는 ""일본이 과거 침략의 역사를 직시하고 깊이 반성하고 군국주의와의 경계를 철저하고 분명하게 그을 때만이 비로소 중일 관계는 건강하고 안정된 발전이 가능하다""고 강조했다.그는 이어 ""우리는 일본 측에 책임 있는 태도로서 관련 문제를 적절하게 처리할 것을 거듭 엄중하게 촉구한다""면서 ""또 실제 행동으로서 아시아 이웃국가와 국제사회의 신임을 얻을 것을 촉구한다""고 말했다.아베 총리는 이날 오전 대리인인 하기우다 고이치(萩生田光一) 자민당 총재 특별보좌관을 통해 '자민당 총재' 명의로 사비로 공물료를 야스쿠니 신사에 봉납했다.또 후루야 게이지(古屋圭司) 국가공안위원장 겸 납치문제 담당상과 신도 요시타카(新藤義孝) 총무상은 이날 오전 야스쿠니 신사를 참배했으며 80여명의 국회의원들도 집단 참배했다.jsa@yna.co.kr▶교황 방한 특집페이지 바로가기▶확 달라진 연합뉴스 앱 다운로드<저작권자(c) 연합뉴스, 무단 전재-재배포 금지>"
65,2014-08-15,'광복절 황금연휴' 첫날 고속도로 곳곳 정체,https://news.naver.com/main/read.nhn?mode=LSD&mid=shm&sid1=103&oid=096&aid=0000326144,SBS(text),"광복절에서 주말로 이어지는 사흘 연휴 첫날인 오늘 나들이 차량이 몰리면서 전국 주요 고속도로 곳곳에서 정체가 일어나고 있습니다.오늘 낮 1시 기준으로 서울서 출발하는 차량은 부산까지 6시간 10분, 대전 3시간 26분, 광주 5시 47분, 강릉 5시간 53분, 목포 6시간 39분 걸릴 것으로 추산됩니다.정체구간이 가장 긴 곳은 영동고속도로 강릉 방향으로 낮 1시 현재 모두 108킬로미터 구간에서 차량이 제 속도를 못 내고 있습니다.경부고속도로 부산 방향은 45㎞ 구간, 서해안고속도로 목포 방향 역시 43㎞ 구간에서 차량이 가다 서기를 반복하고 있습니다.한국도로공사는 낮 1시 기준으로 차량 24만 대가 서울을 빠져나갔고 오늘 하루 총 42만 대가 서울 밖으로 이동할 것으로 예상했습니다.도로공사는 ""낮 1시 정체가 정점을 이뤘다""면서 ""조금씩 차량 수가 줄고 있지만 정체는 밤 9시에서 10시까지 이어질 것으로 보인다""고 밝혔습니다.심영구 기자so5what@sbs.co.kr☞[SBS기자들의 생생한 취재현장 뒷이야기 '취재파일']☞ SBS뉴스 공식 SNS [SBS8News 트위터] [페이스북]저작권자 SBS&SBS콘텐츠허브 무단복제-재배포 금지"
66,2014-08-15,"한국군 병사 월급, 태국군의 절반 이하",https://news.naver.com/main/read.nhn?mode=LSD&mid=shm&sid1=100&oid=011&aid=0002560293,서울경제,"한국군 병사가 받는 월급이 징병제를 운용하는 외국군에 비해 턱없이 낮은 수준인 것으로 드러났다.28사단 윤모 일병 폭행 사망사건을 계기로 드러난 우리 병사들의 열악한 근무여건을 고려할 때 병사에게 제공되는 봉급과 복지혜택을 획기적으로 개선해야 한다는 목소리가 커지고 있다.15일 병무청의 ‘외국 주요국가의 병역제도’ 자료에 따르면 한국군 병사들의 급여는 태국군 병사의 절반에도 못미치는 것으로 조사됐다. 병무청이 의무복무 병사의 봉급을 파악한 국가로는 싱가포르·태국·이집트·멕시코·콜롬비아 등 5개국으로 싱가포르 병사의 월급은 이등병 480싱가포르달러(39만3천원), 일병 500싱가포르달러(40만9천원), 상병 550싱가포르달러(45만원), 병장이 590싱가포르달러(48만3천원)를 받고 있는 것으로 파악됐다.태국 의무복무 병사의 월급은 9천바트(28만8천원) 수준이다. 올해 기준 한국군 상병의 월급이 13만4천600원인 점을 고려할 때 태국과 싱가포르의 병사 봉급이 한국보다 2∼3배 이상 많은 셈이다. 이집트는 의무복무 병사에게 최저임금 수준의 봉급을 지급하는 것으로 파악됐다. 우리나라가 병사에게 최저임금을 보장하려면 월 108만8천890원(2014년 최저임금 기준) 이상을 지급해야 한다.콜롬비아 병사의 월급은 7만페소(약 3만5천원) 수준으로 우리 병사의 월급보다 낮았다. 멕시코는 병사에게 봉급을 지급하지 않는데 의무복무 병사라도 일주일 중 하루만 군 시설에서 복무하고 다른 날에는 생업에 종사할 수 있기 때문이다.국방부는 우리 병사의 봉급을 매년 15%씩 인상해 2017년까지 상병 월급을 19만5천원으로 끌어올린다는 계획이나 턱없이 낮은 병사 월급을 정상화하기에는 역부족이라는 지적을 받고 있다.권홍우기자 hongw@sed.co.kr[ⓒ 인터넷한국일보, 무단 전재 및 재배포 금지]"
67,2014-08-15,교황 노란 리본 달고 미사집전..,https://news.naver.com/main/read.nhn?mode=LSD&mid=shm&sid1=103&oid=001&aid=0007069731,연합뉴스,"세월호 노란 리본 달고 미사 집전하는 프란치스코 교황(EPA=연합뉴스)(대전=연합뉴스) 박성진 특파원 양영석 기자 = 프란치스코 교황이 세월호 참사 유가족이 준 노란 리본을 달고 15일(현지시간) 대전에서 열린 '성모승천대축일 미사'를 집전했다.또 교황은 미사 직전 세월호 유가족과 생존 학생을 10여 분간 만나 위로했다고 교황을 면담한 세월호 유가족 측이 전했다.세월호 대책위원회 김병권 위원장은 이날 미사 뒤 기자회견에서 ""세월호 참사 유가족과 생존 학생 36명이 오늘 미사에 참석했고 이 중 10명이 교황님을 기다리고 있다가 미사 직전 제의실(祭衣室)에서 만났다""고 밝혔다.김 위원장은 ""세월호 유가족의 아픔이 치유되도록 특별법 제정에 정부와 의회가 나설 수 있도록 해 달라고 말씀드렸고 단식 중인 세월호 희생 학생의 아버지를 광화문 미사 때 안아달라고 했다""고 전했다.그러자 프란치스코 교황은 말없이 고개를 끄떡였다고 한다.안산에서 대전까지 900㎞가량 십자가를 메고 걸어온 희생자 아버지 김학일 씨도 ""제의실에 300명의 억울하게 죽은 영혼이 십자가와 함께 있다. 억울하게 죽은 영혼과 함께 미사를 집전해 달라""고 교황에게 부탁했다.그러자 ""'교황이 그렇게 하겠다'고 말씀하셨다""고 김씨는 전했다.또 김씨가 희생자들의 억울함을 풀어주려면 철저한 진상 규명이 필요하다고 강조하자 교황은 고개를 끄덕이면서 '기억하겠다'고 말했다고 한다.유가족 측은 교황에게 안산 단원고 학생과 교사, 유가족의 사진이 든 앨범과 함께 세월호 희생자를 기억해 달라고 부탁하는 영문 편지를 전달했다.유가족과 함께 교황을 면담한 세월호 참사 생존 학생 2명도 영어와 스페인어로 쓴 편지를 전했다.유가족은 또 세월호 참사를 기억해 달라는 뜻에서 교황에게 노란 리본을 선물했다.교황은 면담 이후 진행된 미사에 유가족이 준 노란 리본을 왼쪽 가슴에 달고 나왔다.세월호 대책위 김형기 수석부위원장은 ""간접적으로 우리의 뜻을 피력하긴 하지만 매우 만족스럽다""면서 ""미사 때 교황님이 리본을 달고 나와 깜짝 놀랐다""고 말했다.교황은 이날 미사 삼종기도에서 ""세월호 침몰 사건으로 생명을 잃은 모든 이들, 이 국가적인 대재앙의 결과로 지금도 여전히 고통받는 이들을 성모님께 의탁합니다""면서 ""모든 한국인을 고통받게 한 비극적인 이 사건이 공동선을 위해 함께 협력하는 모든 이들의 책임과 연대성을 확인시켜 주었기를 기원합니다""라고 말했다.sungjinpark@yna.co.kr▶교황 방한 특집페이지 바로가기▶확 달라진 연합뉴스 앱 다운로드<저작권자(c) 연합뉴스, 무단 전재-재배포 금지>"
68,2014-08-15,서울 주차 단속 독한 곳?‥강남·중구·서초 순,https://news.naver.com/main/read.nhn?mode=LSD&mid=shm&sid1=103&oid=277&aid=0003311894,아시아경제,"지난 25년간 주정차위반 과태료 부과·징수 실적 압도적 1위...중구·서초구 현저히 뒤진 2·3위...도봉구·강북구·금천구 등은 강남구에 비해 '새 발의 피'[아시아경제 김봉수 기자]언제부턴가 서울 시내에 근무하는 직장인들의 자가용 출퇴근은 '꿈같은' 일이 됐다. 숨 막히는 교통 체증을 뚫고 제 시간에 출근하더라도 엄청난 주차비를 감당하기 힘들어졌다. 그렇다고 불법 주차를 해놨다가는 하루 종일 단속 걱정에 스트레스를 받았다. 보관료, 견인비, 택시비 등 한 번 걸렸다 하면 기본적으로 수십만원 이상을 지출해야 하는 데다 견인 과정에서 '애마'가 상처를 입는 일도 잦았기 때문이다.그렇다면 지난 1991년 주정차 위반 단속이 시작된 후 서울시 내 자치구들 중 가장 주차 위반 단속을 많이 해 자가용족들에게 눈물을 흘리게 한 곳은 어디일까? 바로 강남구ㆍ중구ㆍ서초구 등이었다. 반면 이에 비해 도봉구·강북구·금천구 등은 주차 위반에 상대적으로 관대했던 지역으로 나타났다.15일 서울시 및 자치구들에 따르면 1991년부터 2014년 7월 말 현재까지 약 25년간 서울 지역 자치구들의 주정차 위반 과태료 부과 및 징수 현황을 살펴본 결과 가장 '가혹하게' 주정차 위반 과태료를 부과·징수한 자치구는 강남구며, 이어 중구, 서초구 등의 순인 것으로 나타났다.특히 강남구는 타의 추종을 불허했다. 이 기간 동안 621만340건의 주정차위반을 접발, 2548억여원의 과태료를 부과해 2, 3위를 차지한 중구 서초구를 압도했다. 이중 502만5187건을 실제 징수해 1993억2100여만원의 세입을 올렸다. 체납건 118만5000여건ㆍ체납액은 554억8900여만원으로 약 80.91%의 징수율을 기록했다.2ㆍ3위를 중구ㆍ서초구도 타 자치구에 비해 많긴 했지만 강남구에 비해 현저히 적었다. 중구는 이 기간 동안 440만222건ㆍ1815억여원을 부과해 이중 322만3000여건ㆍ1297억3000여만원을 징수했다. 강남구의 약 65%에 수준에 그치는 실적이었다. 3위인 서초구도 부과건수 392만9000여건, 부과금액 1610억여원, 징수건수 320만8000여건, 징수금액 1273억여원 등으로 강남구의 약 63%에 불과했다.반면 하위 3위권에 속하는 도봉구ㆍ강북구ㆍ금천구 등의 자치구들은 이보다 훨씬 실적이 적었다.최하위인 도봉구의 경우 83만7000여건ㆍ345억8000여만원을 부과해 이중 68만7000여건ㆍ276억5000여만원을 징수하는데 그쳤다. 이는 강남구 대비 약 13% 수준에 그치는 실적이다.꼴찌에서 두번째인 강북구도 크게 다르지 않아 이 기간 동안 84만7000여건ㆍ354억9000여만원의 주정차위반 과태료를 부과해 이중 68만5000여건ㆍ278억여원을 징수했다. 강남구 대비 약 14%에 그치는 실적이었다.한편 이기간 동안 서울시 내 25개 자치구가 부과한 주정차위반 과태료는 총 5090만6845건ㆍ2조1029억여원이었고, 이중 4038만여건ㆍ1조6160억여원이 징수됐다. 체납은 1052만여건ㆍ4869억여원으로 징수율은 79.33%에 달했다.김봉수 기자 bskim@asiae.co.kr<ⓒ세계를 보는 창 경제를 보는 눈, 아시아경제(www.asiae.co.kr) 무단전재 배포금지>"
69,2014-08-15,서울 주차 단속 독한 곳?‥강남·중구·서초 順,https://news.naver.com/main/read.nhn?mode=LSD&mid=shm&sid1=103&oid=277&aid=0003311894,아시아경제,"지난 25년간 주정차위반 과태료 부과·징수 실적 압도적 1위...중구·서초구 현저히 뒤진 2·3위...도봉구·강북구·금천구 등은 강남구에 비해 '새 발의 피'[아시아경제 김봉수 기자]언제부턴가 서울 시내에 근무하는 직장인들의 자가용 출퇴근은 '꿈같은' 일이 됐다. 숨 막히는 교통 체증을 뚫고 제 시간에 출근하더라도 엄청난 주차비를 감당하기 힘들어졌다. 그렇다고 불법 주차를 해놨다가는 하루 종일 단속 걱정에 스트레스를 받았다. 보관료, 견인비, 택시비 등 한 번 걸렸다 하면 기본적으로 수십만원 이상을 지출해야 하는 데다 견인 과정에서 '애마'가 상처를 입는 일도 잦았기 때문이다.그렇다면 지난 1991년 주정차 위반 단속이 시작된 후 서울시 내 자치구들 중 가장 주차 위반 단속을 많이 해 자가용족들에게 눈물을 흘리게 한 곳은 어디일까? 바로 강남구ㆍ중구ㆍ서초구 등이었다. 반면 이에 비해 도봉구·강북구·금천구 등은 주차 위반에 상대적으로 관대했던 지역으로 나타났다.15일 서울시 및 자치구들에 따르면 1991년부터 2014년 7월 말 현재까지 약 25년간 서울 지역 자치구들의 주정차 위반 과태료 부과 및 징수 현황을 살펴본 결과 가장 '가혹하게' 주정차 위반 과태료를 부과·징수한 자치구는 강남구며, 이어 중구, 서초구 등의 순인 것으로 나타났다.특히 강남구는 타의 추종을 불허했다. 이 기간 동안 621만340건의 주정차위반을 접발, 2548억여원의 과태료를 부과해 2, 3위를 차지한 중구 서초구를 압도했다. 이중 502만5187건을 실제 징수해 1993억2100여만원의 세입을 올렸다. 체납건 118만5000여건ㆍ체납액은 554억8900여만원으로 약 80.91%의 징수율을 기록했다.2ㆍ3위를 중구ㆍ서초구도 타 자치구에 비해 많긴 했지만 강남구에 비해 현저히 적었다. 중구는 이 기간 동안 440만222건ㆍ1815억여원을 부과해 이중 322만3000여건ㆍ1297억3000여만원을 징수했다. 강남구의 약 65%에 수준에 그치는 실적이었다. 3위인 서초구도 부과건수 392만9000여건, 부과금액 1610억여원, 징수건수 320만8000여건, 징수금액 1273억여원 등으로 강남구의 약 63%에 불과했다.반면 하위 3위권에 속하는 도봉구ㆍ강북구ㆍ금천구 등의 자치구들은 이보다 훨씬 실적이 적었다.최하위인 도봉구의 경우 83만7000여건ㆍ345억8000여만원을 부과해 이중 68만7000여건ㆍ276억5000여만원을 징수하는데 그쳤다. 이는 강남구 대비 약 13% 수준에 그치는 실적이다.꼴찌에서 두번째인 강북구도 크게 다르지 않아 이 기간 동안 84만7000여건ㆍ354억9000여만원의 주정차위반 과태료를 부과해 이중 68만5000여건ㆍ278억여원을 징수했다. 강남구 대비 약 14%에 그치는 실적이었다.한편 이기간 동안 서울시 내 25개 자치구가 부과한 주정차위반 과태료는 총 5090만6845건ㆍ2조1029억여원이었고, 이중 4038만여건ㆍ1조6160억여원이 징수됐다. 체납은 1052만여건ㆍ4869억여원으로 징수율은 79.33%에 달했다.김봉수 기자 bskim@asiae.co.kr<ⓒ세계를 보는 창 경제를 보는 눈, 아시아경제(www.asiae.co.kr) 무단전재 배포금지>"
70,2014-08-15,"北 ""발사체 발사 교황 방한과 무관…관심도 없어""",https://news.naver.com/main/read.nhn?mode=LSD&mid=shm&sid1=100&oid=001&aid=0007069655,연합뉴스,"北 김정은, 전술로켓탄 시험발사 지도     (서울=연합뉴스) 북한이 교황 방한일인 14일 단행한 단거리 발사체 발사는 김정은 국방위원회 제1위원장의 참관 하에 이뤄진 것으로 확인됐다. 노동신문은 15일 ""조국해방 69돌을 맞으며 김정은 동지의 직접적인 발기와 세심한 지도 속에 개발·완성된 초정밀화된 우리식의 위력한 전술로켓탄 시험발사가 진행됐다""며 김 제1위원장이 시험발사를 지도했다고 보도했다.로켓탄연구실장 ""사전계획 따른 것…시험발사 계속할 것""(서울=연합뉴스) 이영재 기자 = 북한은 15일 전날의 단거리 발사체 발사가 프란시스코 교황 방한에 맞춘 무력시위라는 지적에 대해 관련 과학자를 내세워 '궤변'이라고 반박하며 교황에 대해서는 관심도 없다고 밝혔다.북한 국방과학을 담당하는 제2자연과학원의 김인용 로켓탄연구실장은 이날 조선중앙통신에 기고한 글에서 ""남조선 괴뢰들은 우리의 이번 전술로켓탄 발사가 나라의 평화와 화합에 장애가 되고 그 무슨 로마 교황의 서울 행각에 그늘을 던지는 도발적인 무력시위라고 온당치 못한 발언들을 함부로 내뱉고 있다""며 ""한마디로 황당무계한 궤변""이라고 비난했다.김 실장은 ""초정밀화된 전술로켓탄의 이번 시험발사는 나라의 자위적 국방력을 강화하기 위해 이미 세워진 우리의 계획에 따라 정해진 날짜와 시간에 진행된 것""이라며 ""남조선 괴뢰들은 우리의 전술로켓탄 발사를 헐뜯어대는 데 환장이 되다 못해 나중에는 그 무슨 로마 교황의 남조선 행각과 연계시키는 해괴한 짓도 서슴지 않고 있다""고 지적했다.그는 ""우리 과학자들은 로마 교황이 도대체 어떤 위치에서 세상 사람들을 위해, 더욱이 우리 민족과 겨레를 위해 무슨 일을 해왔는지 알지도 못하고 또 알 필요도 느끼지 않고 있다""며 ""그가 이번에 무슨 목적으로 남조선을 행각하며 괴뢰들과 마주앉아 어떤 문제를 모의하려고 하는지 알지도 못하며 또 그에 아무런 관심도 두지 않고 있다""고 비꼬기도 했다.이어 ""생각되는 것은 로마 교황이 하필이면 일년 열두달 소털 같이 하도 많은 날들 중에 굳이 골라골라 우리의 정상적인 계획에 따라 진행된 최신 전술로켓 시험발사 날에 남조선 행각 길에 올랐는가 하는 것""이라며 ""잘못에 대해 말한다면 애매한(아무런 잘못이나 관련이 없다는 뜻) 로마 교황을 반공화국 대결의 무대에까지 내세우려고 남조선에 끌어들인 괴뢰패당에게 물어야 할 것""이라고 주장했다.프란치스코 교황의 방한에 대해 침묵하던 북한이 과학자를 내세워 우회적으로 비꼰 것은 교황의 방한과 그를 맞이하는 남한 사회의 분위기에 대해 불편한 심기를 드러낸 것으로 풀이된다.김 실장은 또 김정은 국방위원회 제1위원장이 '새 전투 명령'을 내렸다며 ""이제 곧 보다 새로운 초정밀화된 최신 로켓탄 시험발사가 연이어 단행될 것""이라고 예고했다.그는 ""이번 시험발사로 첨단전술로켓의 사거리가 최종 확정되고 발사의 정확성과 로켓탄의 조종성이 완전무결하다는 것이 다시 검증됐다""고 덧붙였다.북한은 교황이 한국을 방문한 14일 김 제1위원장의 참관 하에 강원도 원산 일대에서 300㎜ 방사포로 추정되는 단거리 발사체 5발을 동해로 발사했다.ljglory@yna.co.kr▶교황 방한 특집페이지 바로가기▶확 달라진 연합뉴스 앱 다운로드<저작권자(c) 연합뉴스, 무단 전재-재배포 금지>"
