,날짜,기사 제목,기사 링크,기사 출처,기사 내용
90,2014-08-15,15일 오후 7시부터 광화문 전면 통제,https://news.naver.com/main/read.nhn?mode=LSD&mid=shm&sid1=103&oid=421&aid=0000965631,뉴스1,"프란치스코 교황이 현지시간 13일 오후 4시(한국 시각 밤 11시)에 4박5일간의 한국 방문을 위해 바티칸을 출발하는 항공기에 탑승하기에 앞서 손을 흔들며 인사하고 있다. 교황의 방한 길에는 추기경과 주교, 주치의, 교황청 직원 등 28명이 동행한다. 사전에 신청을 받은 내외신 교황수행기자단 66명도 함께 비행기에 탑승한다. © News1=AFP © News1 김정한 기자시복식 당일 지하철 4:30부터 운행, 광화문·시청역 등 13:30분까지 무정차(서울=뉴스1) 차윤주 기자 = 프란치스코 교황 시복 미사를 하루 앞둔 15일부터 광화문 일대 차량 진입이 전면 통제된다.서울시는 15일부터 이틀간 이 일대를 방문할 계획이 있는 시민은 사전에 우회도로 등 교통정보를 확인할 것을 당부했다.서울시는 16일 광화문~서울시청 광장 일대에서 열리는 교황 시복 미사를 위해 특별교통대책을 시행한다.우선 광화문을 기점으로 15일 오후 7시부터 16일 오후 6시까지 서대문역, 남대문, 을지로 입구, 안국동 인근의 차량 출입이 전면 통제된다.이날 시복 미사엔 공식 초청된 17만명 외에도 시민 30만~50만명이 찾을 것으로 예상된다. 미사에 초청받은 신자들은 새벽 4시부터 3시간 동안 입장한다.따라서 이날 일산·고양에서 도심 방면으로 이동할 차량은 ▲강변북로 ▲올림픽대로 등을, 미아리·의정부→도심 방면으로 이동하려면 ▲동부간선도로 ▲내부순환로를 이용하는 게 좋다.도심에 진입해야 하는 차량은 ▲통일로 ▲충정로 ▲퇴계로 ▲돈화문로 등으로 접근한 뒤 가까운 곳에 주차하고 걸어서 이동해야 한다. 주차장 정보는 ‘서울주차정보’ 앱(parking.seoul.go.kr/mobile)을 이용하면 현재위치에서 가장 가까운 주차장 위치와 주차가능 면수, 요금, 운영시간 등을 손쉽게 확인할 수 있다.차량 진입 통제 및 우회도로 정보는 서울시 교통정보센터(TOPIS) 홈페이지(topis.seoul.go.kr), 모바일 앱 ‘서울교통포털’에서 확인할 수 있다.행사 당일 지하철 운행은 새벽 4시부터 시작된다. 이날 오후 1시30분까지 ▲3호선 경복궁역 ▲5호선 광화문역 ▲1·2호선 시청역에서 열차가 무정차 통과한다. 시는 지방에서 출발하는 신자를 위해 지하철 첫차 운행시각을 한시간 앞당기고, 행사 시작 전 4시간(6~10시), 종료 후 2시간(12~14시) 동안 지하철 운행을 평일 출퇴근 시간대 수준으로 늘리기로 했다.통제 구간을 오가던 버스 101개 노선은 15일 오후 7시부터 우회 운행한다. 사직로~율곡로를 다니는 버스는 경복궁역과 안국동 사거리에서 각각 회차하고, 새문안로~종로 구간의 버스는 칠패로와 남대문로로 우회한다.   16일 하루 동안 개인택시 부제는 해제된다.서울시는 전세버스를 타고 오는 지방 신자를 위해 시내 22개소, 1690면의 관광버스 주차공간을 확보했다. 학교 운동장 13개소 412면, 공원 주차장 2개소 161면, 도로상 임시 주차허용구간 7개소 1117면 등이다.또한 도로표지전광판, 버스도착안내단말기를 통해 실시간 도로 통제 상황과 지하철 역사 폐쇄, 버스 우회운행 등 교통 정보를 안내하고 인력을 총 동원해 불법 주정차도 집중 단속한다.김경호 시 도시교통본부장은 “도심으로 방문할 계획이 있는 시민들은 이동에 불편이 없도록 교통정보를 사전에 확인하고 가급적 대중교통을 이용해달라”고 당부했다."
91,2014-08-15,"日아베내각 각료들, 야스쿠니 참배",https://news.naver.com/main/read.nhn?mode=LSD&mid=shm&sid1=104&oid=001&aid=0007069241,연합뉴스,"야스쿠니 참배한 신도 일본 총무담당상     (도쿄 교도=연합뉴스) 일본 아베 내각 각료들이 한국의 광복절이자 일본 패전일인 15일 과거 군국주의의 상징적 시설인 야스쿠니(靖國) 신사에 참배했다.   신도 요시타카(新藤義孝) 총무상이 이날 오전 참배를 위해 도쿄 지요다(千代田)구 소재 야스쿠니 신사를 방문한 모습.후루야 납치문제담당상·신도 총무상 잇달아 참배(도쿄=연합뉴스) 조준형 특파원 = 일본 아베 내각 각료들이 한국의 광복절이자 일본 패전일인 15일 과거 군국주의의 상징적 시설인 야스쿠니(靖國) 신사에 참배했다.후루야 게이지(古屋圭司) 국가공안위원장 겸 납치문제 담당상과 신도 요시타카(新藤義孝) 총무상은 이날 오전 도쿄 지요다(千代田)구 소재 야스쿠니 신사에 잇달아 참배했다.두 사람은 작년 8·15때도 야스쿠니 신사에 참배한 바 있다.아베 신조(安倍晋三) 총리는 이날 참배하지 않을 예정이며, 대신 공물료를 봉납할 것으로 알려졌다.또 이날 중 '다함께 야스쿠니신사를 참배하는 국회의원 모임'(이하 모임) 소속 중·참의원들이 야스쿠니에 집단 참배할 예정이다.야스쿠니 신사는 근대 일본이 일으킨 크고 작은 전쟁에서 숨진 사람들의 영령을 떠받드는 시설로 태평양전쟁 A급 전범 14명을 포함해 246만 6천여 명이 합사된 곳이다.jhcho@yna.co.kr▶교황 방한 특집페이지 바로가기▶확 달라진 연합뉴스 앱 다운로드<저작권자(c) 연합뉴스, 무단 전재-재배포 금지>야스쿠니 참배한 후루야 일본 납치문제담당상    (도쿄 교도=연합뉴스) 후루야 게이지(古屋圭司) 국가공안위원장 겸 납치문제 담당상이 15일 오전 참배를 위해 도쿄 지요다(千代田)구 소재 야스쿠니 신사에 도착하고 있다."
92,2014-08-15,"취임 100일…이완구 ""하루가 삼년"" 박영선 ""폭풍같은 100일""",https://news.naver.com/main/read.nhn?mode=LSD&mid=shm&sid1=100&oid=421&aid=0000965582,뉴스1,"이완구 새누리당 원내대표와 박영선 새정치민주연합 원내대표가 7일 오전 서울 여의도 국회 귀빈식당에서 가진 주례회동에서 설전을 벌이다(사진 아래) 비공개 회동에서 세월호 청문회 실시 등에 대해 합의한뒤 오후에 합의사항을 발표하며 밝은표정으로 악수하고 있다. 2014.8.7/뉴스1 © News1 이광호 기자, 송원영 기자지난 5월8일 취임 이후 100일 맞아 소회 털어놔세월호특별법으로 꼬인 정국 푸는게 급선무(서울=뉴스1) 김현 기자,김영신 기자 = 이완구 새누리당 원내대표와 박영선 새정치민주연합 국민공감혁신위원장 겸 원내대표가 15일 나란히 취임 100일을 맞았다.세월호 참사의 후폭풍이 정치권에 몰아치던 지난 5월8일 선출된 이·박 원내대표는 지난 100일간 세월호 참사 수습은 물론 두 차례의 굵직한 선거까지 치르면서 쉽지 않은 시간을 보내왔다.'도지사 출신'인 이 원내대표와 '헌정사상 첫 여성 원내대표'인 박 원내대표가 함께 격동의 시기를 지내왔다고 해도 과언이 아닐 정도다.이 원내대표는 뉴스1과 만나 ""지난 100일간 세월가는 것을 잊고 살았다""며 ""하루가 여삼추라는 말을 실감할 정도로 오래오래 (원내대표를) 한 것 같다. 그만큼 (지난 100일이) 너무나 길게 느껴진다""고 소회했다.박 원내대표는 취임 100일 메시지를 통해 ""단 하루도 바람 잘 날 없던 폭풍 같은 100일을 걸어왔다""면서 ""때로는 세찬 비바람을 뚫고 가야 했고 잠시의 평온도 내일을 위한 준비의 시간이었다""고 밝혔다.당초 정치권에선 '강한 뚝심'을 앞세운 이 원내대표와 '소장·강경' 성향의 박 원내대표가 세월호 정국과 6·4 지방선거, 7·30 재·보궐 선거 등 정치 이벤트와 맞물려 '강(强) 대 강(强)'의 대결로 치달을 것이라는 관측이 대체적이었지만 100일간 보여준 두 사람간 호흡은 '나쁘지 않았다'는 평가를 받고 있다.두 사람은 취임 일주일 만에 '세월호 국회' 소집과 국정조사에 합의했고 19대 국회 후반기 임기 개시 전인 지난 5월29일 15대 국회 이후 처음으로 입법부 수장 공백사태 없이 국회의장단 선출을 마무리했다.또 지난 5월20일 국회내 '팥빙수 회동'이라는 다소 파격을 보여준 두 원내대표는 6월9일부터 주례회동을 갖고 여야간 소통을 강화한 것은 물론 지난달 11일 박근혜 대통령과 양당 원내대표간 회동을 개최하는 등 '대화의 정치' 복원을 꾀했다. 비록 번복되긴 했지만 지난 8월7일 세월호특별법 합의를 도출하기도 했다.두 사람은 모두 당 비상대책위원장을 겸하는 공통의 경험을 갖기도 했다. 이 원내대표는 황우여 전 대표의 임기 만료로 지난 5월13일 7·14 전당대회 전까지 당을 이끄는 비대위원장을 맡았었다. 박 원내대표는 7월 재보선 참패로 '김한길·안철수 공동대표 체제'가 붕괴되면서 지난 8월4일부터 비대위원장직을 수행하고 있다.하지만 100일간 두 사람의 신경전 상황도 적지 않았다. 원(院) 구성 협상은 국회의장단 선출 후 한 달여 가까이 대치국면이 지속되다 6월23일에서야 합의됐다. 지난 6월16일 원구성 협상 당시 이 원내대표가 ""내가 할 만큼 했어. 왜 이래""라고 호통치자 박 원내대표가 ""지금까지 양보하신 게 뭐가 있어요""라고 받아치는 소리가 협상장 밖까지 들리기도 했다.세월호 정국과 두 차례의 대형 선거는 이·박 원내대표간 치열한 기싸움의 요인으로 작용했다. 세월호 국정조사 특위는 기관보고, 청문회 증인채택 등 협상 과정마다 날선 설전으로 이어졌다. 7월 재보선을 앞두고서는 주례회동이 두 차례나 열리지 못했고 세월호특별법을 둘러싼 여야간 대치는 현재의 꽉 막힌 정국을 초래했다.이런 상황은 법안 처리에 바로 영향을 미쳤다. 두 원내대표는 지난 100일간 단 한건의 법안도 처리하지 못했다는 비판론에 직면해 있다.취임 100일을 맞은 두 사람은 '세월호특별법'으로 실타래처럼 꼬인 정국을 어떻게 풀어낼 것인가라는 어려운 과제를 눈앞에 두고 있다.이·박 원내대표는 지난 7일 재보선 후 첫 주례회동을 갖고 세월호특별법에 따라 구성될 진상조사위원회 조사가 미진할 경우 상설특검법에 따라 특별검사를 추천하되 진상조사위 구성에 있어서는 유가족 추천 몫을 3명(새누리당안은 2명)으로 늘리는 내용의 세월호특별법 단일안에 합의했다.그러나 세월호유가족과 시민단체, 새정치연합내 강경파들이 특검 추천권 확보를 요구하며 반발하고 나서면서 박 원내대표가 지난 11일 '8·7 합의안'을 물리고 특별검사추천위 구성에 있어 국회 추천 몫 중 3명을 야당에게 배정하는 내용으로 사실상 재협상을 요구했다.이로 인해 당초 합의했던 세월호특별법의 13일 본회의 처리는 무산됐고 새누리당이 새정치연합의 재협상 요구를 거부하면서 여야간 모든 협상도 중단된 상태다. 지난 11일 이후 두 사람간 접촉도 끊겼다.다만 15일 8·15 광복절 행사에 두 사람 모두 참석해 조우할 예정이어서 세월호특별법 협상 파행 사태의 돌파구를 마련할 수 있을지 주목된다. 이 원내대표도 ""(행사장에서) 만나게 되면 아무래도 자연스럽게 만날 수 있는 기회가 되지 않겠느냐""라고 기대감을 표했다.일단 두 사람은 모두 세월호특별법으로 막힌 정국을 뚫겠다는 각오를 밝히고 있다.이 원내대표는 ""박 원내대표에 대한 (안 좋은) 생각은 전혀 없고 외려 안쓰럽다. 우리 둘은 최선을 다했고 그것을 갖고 가서 자당에서 추인을 못 받아오는 그 심정이 어떻겠느냐""면서 ""여기서 시시비비를 가리는 것은 너무나 소아적""이라고 말했다.이 원내대표는 ""야당을 비판만 하고 있기엔 너무나 엄중한 상황이기 때문에 이 난국은 어떤 형태로든 뚫어야 한다. 양당의 입장은 완고하지만 그렇다고 해서 우리를 쳐다보는 국민이 있는데 주저앉을 순 없는 것 아니냐""면서 ""다시 한 번 유가족이 돼 보는 것이 우선 전제다. 또 대승적 차원에서 집권여당이라는 생각을 해야 한다""고 밝혔다.박 원내대표도 ""지금까지도 세월호 참사의 철저한 진상규명을 위한 특별법 합의과정에서 진통이 계속되고 있어 가슴 아프지만 저에게 쏟아진 강한 비판이 역설적으로 세월호특별법에 대한 사라져가던 관심을 다시 깨웠다는 점에서 감사하며 언젠가는 국민들께서 이해해 주실거라고 생각한다""고 말했다.박 원내대표는 ""지금 폭풍의 언덕 위에 선 심정이지만 폭풍을 뚫고 나가면 언젠간 무지개가 뜬다는 믿음으로 이 시련을 헤쳐 나가겠다""면서 ""지금은 인내가 필요할 때라고 생각한다. 인내는 쓰지만 그 열매는 달다는 말을 되새겨본다""고 밝혔다."
93,2014-08-15,커지는 '씽크홀 공포'…콘트롤타워가 없다,https://news.naver.com/main/read.nhn?mode=LSD&mid=shm&sid1=102&oid=003&aid=0006017110,뉴시스,"지난 2012년 4월 과테말라 도심 한복판에 발생한 싱크홀, 넓이가 자그마치 30m에 깊이는 100m다. 당시 구멍을 메우는데만 약 3년을 예상했다고 한다.매뉴얼도 없어 ‘싱크홀 無대책’ 논란중앙부처는 “지자체 관할 관여 못해”책임 떠넘기다 ‘육상 세월호 참사’우려【서울=뉴시스】시사할 취재팀 = ""바다도 모자라 국민들이 땅속으로 가라앉아야 사후약방문식으로 대책을 마련할 겁니까?"" ""세월호하고 뭐가 다릅니까. 명백한 인재입니다. 통합관리시스템은커녕 땅을 들여다볼 지도도 없어요"" 일부 지질 전문가들의 성난 목소리다.지난 몇 해 동안 서울시뿐 아니라 전국 곳곳에서 갈수록 자주 발생하고 있는 한국형 싱크홀(sink hole)때문에 지질학자들은 걱정이 태산이다. 게다가 정부는 팔짱만 끼고 있어 답답하다는 것이다.8월5일 서울 석촌지하차도에서 폭 2.5m, 길이 8m, 깊이 약 5m의 싱크홀이 생겼다. 이에 앞서 7월엔 인천 영종도에서 폭 6m 대형 싱크홀이, 6~7월엔 국회의사당 앞에 깊이 각각 3m, 5m 싱크홀이 연이어 발생하는 등 올해만 해도 전국에서 10여 개의 크고 작은 싱크홀이 발생하고 있다.지난 2010년 충북 청원의 한 마을에서 너비 20m 깊이 30m의 대형 싱크홀이 발생한 바 있고 같은 해 9월 영등포 노들길에선 폭 3m, 길이 2m 싱크홀이, 2008년 5월 충북 음성에선 대형 싱크홀 발생으로 건물이 붕괴되기도 했다.지난 2000년 1월엔 대구 지하철 공사장에서 싱크홀이 발생해 정차 중이던 버스를 삼켜 승객 3명이 숨지는 사고가 발생했고 이어 같은 해 전남 무안에서 발생한 직경 8m, 깊이 13m의 싱크홀로 창고 하나가 흔적도 없이 사라졌다.싱크홀은 일반적으로 지하수의 이동과 그에 따른 지하수량 변화 때문에 발생한다. 지하수와 흙이 섞여 일정한 부피를 유지하던 땅에서 어떤 이유로든 지하수가 빠져나가면 흙 사이에 빈 공간이 생기면서 지층이 엷어져 그 공간으로 표층이 꺼지면서 싱크홀이 발생한다.문제는 도심의 경우 지하수 이동을 예측하기 어렵고 싱크홀이 어디에서 발생할지 예측하기 힘들다는 점이다. 도심의 지하는 지하철, 상하수도, 대형 건물 지하층 등이 뒤얽혀 지하 구조물의 깊이가 제각각 다른 복잡한 구조를 이루고 있기 때문이다. 일부 전문가들은 지난 1970~1980년대 대거 시행된 도심 하천 직선화 사업이 싱크홀 발생에 직접적인 영향을 주고 있다는 분석을 내놓고 있다.올해 들어 서울 송파구 석촌역 인근 6차선 도로에는 가로 1m, 세로 1.5m 너비에 깊이는 3m 규모의 구덩이가 생기는 등 5차례에 걸친 싱크홀이 발생했다. 다행히 인명피해는 없었지만 언제 어디서 싱크홀이 나타나 대형사고로 이어질지 안심할 수 없는 상황이다.더 큰 문제는 싱크홀에 대한 이렇다 할 대책 매뉴얼이 없다는 것이다.서울시에 따르면 도로침식의 가장 큰 원인으로 지목되고 있는 노후 하수관로(30년 이상)만 전체 하수관로의 48.4%(5030km)에 달해 추가적인 침식이 예상되고 있는데다 정부는 도로 아래 지반상황, 상하수도 위치 등에 대한 상세한 지하구조물 지도조차 없어 대책마련에 곤란을 겪고 있는 것으로 확인되고 있다.18일 오후 인천 왕길동에서 발생한 지반 침하 사고로 인해 도로 한복판에 거대한 싱크홀이 생겼다. (사진제공, 인천서부소방서)전문가들은 정부의 도심 난개발과 행정편의주의식 업무처리 때문에 국민들이 위험에 노출된 꼴이라며 우려를 감추지 못하고 있다.해당 지자체 공무원들은 취재진의 질문에 답변을 둘러댔다.서울시 싱크홀 담당자라는 한 관계자는 “싱크홀은 상하수도 공사와 지하철 공사로 일어난 침식문제가 가장 크다”며 “언론에서 크게 이슈화가 됐기 때문에 현재 상수도본부나 하수도과에서 대책을 세워 피해가 발생하지 않도록 대책을 수립하는 중”이라고 말했다.또 싱크홀로 인한 피해보상에 대해 “원인을 알게 되면 관련 과에서 손해배상 청구를 처리하는 것으로 알고 있다. 대책을 수립 중”이라며 뾰족한 대책이 없다는 걸 은연 중에 드러냈다.게다가 각 정부부처는 서로 책임을 떠넘기기에 급급했다.한 부처의 관계자는 뉴시스와의 통화에서 “우리도 (싱크홀)조사 관련 별도로 준비를 하고 있지만 쉽지 않다. 예를 들어 도로에 상하수도 누수로 싱크홀이 발생했다고 하면 난감한 상황이 발생한다""며 ""안전을 총괄하는 것은 안행부지만 도로를 관리하는 것은 국토교통부고 또 상하수도를 관리하는 것은 환경부다. 이런 상황이라 싱크홀이 발생해도 부처들은 어찌할 바를 모르는 것”이라고 말했다.또 다른 부처 관계자는 “언론이나 국민은 중앙부처가 나서서 조사를 하지 않는다고 비난하지만 현재 싱크홀 등의 사고관리책임은 각 지자체에 있기 때문에 우리가 지자체의 권한을 침해하면서까지 무작정 나설 수는 없는 일”이라며 “지금 관련 중앙 부처들도 관심을 갖고 각자 대응책을 마련 중인 것으로 안다. 하지만 부서 하나만 관심을 갖는다고 해결될 일이 아니다”고 말했다.그러나 전문가들은 싱크홀을 이렇게 방치하다 ‘육상 세월호사건’이 발생하지나 않을지 우려가 된다며 ""큰 인명피해가 발생해야만 대책마련에 나서는 악습을 끊어야 한다""고 지적했다.서울시립대 토목공학과 이수곤 교수는 “땅을 파려면 지하구조를 알아야 하는데 관련 자료가 없이 공사했다. 98년도에 내가 직접 지질지도를 서울시에 만들어 줬는데 쓰이지 않았다""라며 ""세월호 사건과 유사한 사건이 언제 또 터질지 모를 일이다. 우면산 산사태 사고가 터진 것도 당연하다고 본다. 산을 무작위로 개발하면 산사태가 나는 것이고 하천을 메우고 개발하면 침식이 일어나는 것이다. 서울뿐 아니라 모든 도시가 마찬가지다”라고 설명했다.이 교수는 “지금 통합관리시스템이 없다. 토목공사를 하려면 지반과 상하수도 자료 등 통합적인 로드맵이 있어야 한다. 즉 지반구조도가 있어야 땅 속을 들여다 볼 수 있는데 자료는 고사하고 각 부처가 따로 놀고 있어 통합재난지반관리시스템이 없는 상황이다”고 지적했다. <계속>■ '시사 할(喝)'은 = 사회 전 분야에 걸쳐 잘못된 제도나 문화 등을 비판하고 우리 사회가 공공성을 회복하는 데 이바지하기 위해 다양한 정보를 제공하려고 신설한 기획이다. 할(喝)이란 주로 선승(禪僧)들 사이에서 행해지는 말로, 사람들의 어리석음을 꾸짖는 소리다.sisahal@newsis.com★ 뉴시스 뉴스, 이젠 네이버 뉴스 스탠드에서도 만나세요★ 손 안에서 보는 세상, 모바일 뉴시스<저작권자ⓒ 공감언론 뉴시스통신사. 무단전재-재배포 금지.>"
94,2014-08-15,겉도는 장애인 의무고용제… 정부도 못지키면서 수치만..,https://news.naver.com/main/read.nhn?mode=LSD&mid=shm&sid1=102&oid=005&aid=0000684053,국민일보,"정부가 장애인 의무고용률을 높이는 내용을 골자로 하는 장애인고용촉진법·시행령 개정안을 입법예고했다. 그러나 대기업들은 여전히 장애인을 고용하는 대신 부담금으로 때우고 있다. 솔선수범해야 할 공공부문조차 의무고용률을 지키지 않아 빈축을 산 지 오래다. 고용 의무를 높게 잡는 것보다 실효성 있는 장애인 고용 정책을 펼치는 것이 우선이라는 지적이 나온다.고용노동부가 14일 입법예고한 장애인고용촉진 및 직업재활법과 시행령 개정안에 따르면 상시근로자 50명 이상 민간기업에 적용되는 장애인 의무고용률은 2014년 2.7%(2013년 2.5%)에서 단계적으로 올라 2019년에는 3.1%로 상향 조정된다. 국가기관·지방자치단체 공무원과 공공기관은 3.0%에서 3.4%로 높인다. 노동부는 “의무고용률이 상승하면 민간기업의 의무고용 일자리가 올해 14만9200개에서 2019년엔 18만7796개로 늘어나 장애인들에게 새로운 일자리가 생길 것”이라고 기대했다.그러나 현행 법령과 개정 법령안 모두 의무고용률을 채우지 못하더라도 부담금만 내면 별다른 처벌을 받지 않는다. 대기업들은 이를 악용해 장애인을 고용하기보다는 돈으로 때우는 경우가 허다하다. 지난해 30대 그룹의 평균 장애인 고용률은 1.9%에 불과하다. 1000인 이상 기업은 1.97%였다. 2.5%인 민간부문 의무고용률에 턱없이 모자란 수치다.반면 100∼299인 규모의 기업들은 지난해 장애인 고용률 2.84%를 기록해 의무고용비율을 초과했다. 가장 형편이 어려운 100인 미만 기업들도 2.43%로 대기업을 훌쩍 뛰어넘는다. 기업들은 장애인을 고용하면 각종 편의시설을 갖춰야 하고 건물도 장애인 기준에 맞춰 고쳐야 하는 등 추가 비용이 든다며 난색을 표한다. 장애인과 일반 직원이 무리 없이 융화할 수 있는지에도 의문을 보낸다. 불확실성과 비용 증가를 감내하느니 차라리 돈으로 때우는 것이 경제적이라는 판단을 하고 있는 것이다.의무고용률을 지키지 않는 것은 정부도 마찬가지다. 지난해 국가·지자체(공무원 부문)는 장애인 고용률 3%를 달성해야 했지만 2.63%에 그쳤다. 공공기관도 2.81%로 의무를 다하지 못했다. 시·도교육청과 국회 등은 매년 장애인 저조 기관 명단 공표 대상에서 빠지지 않는 단골손님이다. 그러나 교육청들은 “장애인들의 교대·사대 진학률이 낮아 의무고용비율을 지키기 어려운 구조”라고 항변한다. 국회 관계자는 “국회의원 1인당 5∼6명으로 꾸려지는 보좌진에 장애인을 포함시키긴 힘들다”고 말한다.때문에 각계는 무턱대고 의무비율을 높이기보다 실효성 있는 장애인 고용 대책이 우선돼야 한다고 지적한다. 교대·사대 학생을 선발할 때 장애인을 일정 비율 이상 의무적으로 뽑도록 하고, 국회에는 당 차원이나 여러 의원실이 공동 운영하는 장애인 보좌진 직제를 만드는 방안이 대안으로 제시된다. 명단 공개와 부담금 부과에도 꿈쩍 않는 대기업들을 움직일 확실한 채찍과 당근이 필요하다는 지적도 설득력을 얻고 있다.선정수 기자 jsun@kmib.co.krGoodNews paper ⓒ 국민일보(www.kmib.co.kr), 무단전재 및 재배포금지[뉴스 미란다 원칙] 취재원과 독자에게는 국민일보에 자유로이 접근할 권리와 반론·정정·추후 보도를 청구할 권리가 있습니다. 고충처리인(gochung@kmib.co.kr)/전화:02-781-9711"
