,날짜,기사 제목,기사 링크,기사 출처,기사 내용
66,2017-05-27,"靑, 인선기준 고심 ""여야 협상 주시"" 후속 인선 지연?",https://news.naver.com/main/read.nhn?mode=LSD&mid=shm&sid1=100&oid=214&aid=0000768495,MBC,"[뉴스데스크]◀ 앵커 ▶일부 공직 후보자들의 위장전입 등 잇단 의혹에 대해 사과했던 청와대는 오늘은 말을 아꼈습니다.◀ 앵커 ▶검증 기준 마련에 고심이 깊어지면서 후속 인선 작업이 늦어질 수 있다는 관측도 나옵니다.이재민 기자입니다.◀ 리포트 ▶청와대는 어제 임종석 대통령비서실장의 유감 표명 이후 추가 언급을 자제하고 여야 협상 상황을 지켜본다는 입장입니다.앞서 천명한 인사 원칙을 다시 검토하면서 국민이 수용할 수 있는 기준을 고려할 것으로 보입니다.[임종석/대통령 비서실장 (26일)]""심각성, 의도성, 반복성, 그리고 시점에 대해서 종합적으로 검토하지 않을 수가 없습니다.""청와대 고위 관계자는 ""높은 도덕적 기준을 갖고"" 있지만, ""기계적 기준으로 정하기는 어렵다""며 인사 기준 마련의 어려움을 토로했습니다.따라서 직접 새 기준을 만들기보다는 국민 여론을 수렴하는 국정기획자문위원회와 협의할 계획입니다.각계 의견을 모아 인사 기준을 정하면, 자의적으로 기준을 정한다는 지적에 대한 부담도 덜 수 있다는 판단으로 보입니다.그러나 당장 내각 구성이 문제입니다.애초 이번 주 차관급 인사를 발표하기로 했지만 인선 기준 논란에 공개를 미뤘고, 장관급 인선은 더 늦어지고 있습니다.대상자의 인사 검증 결과를 다시 살펴보며 논란이 될 소지를 줄이겠다는 것입니다.청와대는 오늘부터 소통 일환으로 광장에서 새 정부에게 바라는 점을 수렴하는 '국민 마이크' 행사를 시작했습니다.MBC뉴스 이재민입니다.이재민기자 (epic@mbc.co.kr )[저작권자(c) MBC (www.imnews.com) 무단복제-재배포 금지]Copyright(c) Since 1996,MBC&iMBCAll rights reserved."
67,2017-05-27,"일자리 만드는 중소기업, 세무조사 안 받는다",https://news.naver.com/main/read.nhn?mode=LSD&mid=shm&sid1=101&oid=018&aid=0003835447,이데일리,"[이데일리 박종오 기자] 정부가 일자리를 만드는 중소기업에 세무조사를 면제·유예하는 등 세금 혜택을 강화하기로 했다.새 정부 대통령직 인수위원회를 대신하는 기구인 국정기획자문위원회는 27일 국세청 업무 보고를 받고 이같은 방안을 확정해 추진한다고 밝혔다. 국정기획위는 “새 정부 핵심 과제인 일자리 창출을 세정 차원에서 적극적으로 뒷받침하고, 영세·중소 납세자가 경영상 어려움이 없도록 세정 지원을 최대한 강화하기로 했다”고 설명했다.이에 따르면 앞으로 국세청은 전년 대비 상시 근로자 수를 2% 이상 늘릴 계획이 있는 중소기업은 세무조사를 제외 또는 유예하기로 했다. 유예 대상 기업도 현행 제조업 등 일부 업종에서 대다수 업종으로 확대할 계획이다.국세청은 일자리 창출 중소기업이 세금 납기 연장, 징수 유예 등을 신청할 경우 납세 담보 면제 요건(최대 1억원)도 완화해 적용하기로 했다. 영세 사업자가 재창업·취업하면 세금 체납액 납부 의무를 소멸하는 제도도 새로 도입한다는 방침이다.국정기획위는 이날 업무 보고에서 문재인 대통령 대선 공약인 조세 정의 실천 방안을 주로 논했다고 전했다. 권력 기관이 아닌 서민을 보호하는 서비스 기관으로의 기관 개선 방안, 빅데이터 분석을 활용해 공정 세정을 확립하는 방안 등이 주로 논의됐다.박종오 (pjo22@edaily.co.kr)▶심쿵유발 스타 화보 [핫포토]▶이데일리 [페이스북]|[포스트]▶한 눈에 보는 이슈 트렌드 [카드뉴스]＜ⓒ종합 경제정보 미디어 이데일리 - 무단전재 & 재배포 금지＞"
68,2017-05-27,"만원행동 ""최저임금 만원-비정규직 철폐 '지금 당장'""",https://news.naver.com/main/read.nhn?mode=LSD&mid=shm&sid1=102&oid=421&aid=0002755425,뉴스1,"최저임금만원비정규직철폐공동행동(만원행동) 회원들이 27일 오후 서울 청계광장에서 열린 '지금 당장 촛불행동' 집회에서 손팻말을 들고 구호를 외치고 있다. 이날 회원들은 최저임금 1만원, 비정규직철폐, 노조할 권리를 요구하고 오는 6월 30일 총파업을 예고했다. 2017.5.27/뉴스1 © News1 황기선 기자청계광장에 6000여명 모여…6월 30일 총파업 전개(서울=뉴스1) 이후민 기자 = 노동계 시민사회단체 등이 주말 도심에서 집회를 열고 정부를 향해 즉각적인 최저임금 1만원 인상과 비정규직 철폐, 노조할 권리 보장 등을 촉구했다.시민사회단체로 구성된 '최저임금 1만원·비정규직 철폐 만원행동'(만원행동)은 27일 오후 5시30분쯤 서울 종로구 청계광장에서 '최저임금 1만원, 비정규직 철폐, 노조할 권리 지금당장 촛불행동'을 열었다.최종진 민주노총 위원장 직무대행은 ""문재인 정부는 촛불항쟁의 결과물로 탄생한 정부이기에 과감하게 적폐를 청산하고 나라를 나라답게 만들라는 요구를 실천해야 할 책무를 지고 있다""며 ""그러나 세상은 대통령 한 명에 의해 바뀌지 않고 또 그렇게 될 수도 없다. 우리가 가만히 있으면 또다시 아무것도 변하지 않기 때문에 이렇게 모였다""고 밝혔다.이어 ""최저임금 1만원은 되면 좋고 안 되면 할 수 없는 그런 문제가 아니다""며 ""적폐청산과 개혁과제를 추진하는데 90%에 가까운 국민들이 지지를 보일 때 국민과 노동자, 청년을 믿고 최저임금 만원을 추진해야 한다. 소득주도 경제성장을 이야기하는 정부라면 지금당장 최저임금 만원 과감하게 추진해야 한다""고 촉구했다.또 비정규직 문제와 관련해 ""비정상적인 고용구조를 정상으로 되돌리는 것이고, 나라를 나라답게 만들기 위해 더 이상 늦출 수 없는 요구""라며 ""자유롭게 노동조합 가입하고 노동조합 해도 걱정없는 그런 세상 만들어야 한다""고 강조했다.발언자로 나선 박태현 전교조 경기지부 조합원은 ""문재인 대통령은 후보 시절 교원과 공무원의 정치적 자유를 약속했다""며 ""전교조 뿐만 아니라 공무원이나 공공운수 노동자들도 노동권과 정치적 자유에 제약을 받고 있다. 노동자들은 노동3권과 정치적 자유를 누려야 한다""고 목소리를 높였다.안명자 공공운수노조 전국교육공무직본부 본부장은 ""우리는 정규직이라는 이름의 '무기계약직'을 원하는 것이 아니라 실질적으로 처우개선이 된 정규직을 원하는 것""이라며 ""문 대통령의 행보를 보면 조금 더 기다려야 하는 것 아니냐고들 하지만, 그보다 우리의 실상을 더 잘 알수 있도록 목소리를 높이는 것이 우선이 되어야 한다고 본다""고 말했다.세종대왕 복장에 1만원권 지폐모양의 탈을 쓰고 발언에 나선 김재근 청년전태일 운영위원은 ""최저임금 1만원 주장이 처음 나온 것이 2014년인데 지금부터 3년 뒤에 하겠다는 것은 저임금 청년 노동자의 현실을 방치하겠다는 것""이라며 ""즉각실현을 이야기하는 것은 지금같은 삶을 이어갈 수 없기 때문이다""고 강조했다.이날 집회에 참가한 참가자 약 6000명(주최측 추산)은 본집회를 마친 뒤 오후 7시쯤 청계광장을 출발해 을지로를 지나 종로1가로 향하는 도심 행진을 벌였다.민주노총은 이날 집회에 이어 최저임금 1만원 인상과 비정규직 철폐, 노조할 권리 보장 등을 촉구하는 총파업을 다음달 30일 전개할 계획이라고 밝혔다.이날 집회는 지난 26일 경찰청이 집회·시위의 자유를 최대한 보장하기 위해 집회현장에 경력은 최소한 배치하고, 차벽·살수차를 원칙적으로 배치하지 않겠다고 밝힌 뒤 열린 첫 대형 집회였다.서울 종로경찰서 관계자는 ""집회 장소 일대에 교통만 따로 관리하고 경비 인력은 없다""고 설명했다. 이날 경찰은 도심 혼잡 등에 대비해 집회가 열리는 청계광장과 행진이 이어지는 을지로, 종로1가 등 주변 일대에 교통경찰 5개 중대 약 400명을 배치했다고 밝혔다.최저임금만원비정규직철폐공동행동(만원행동) 회원들이 27일 오후 서울 청계광장에서 열린 '지금 당장 촛불행동' 집회에서 최저임금 1만원 퍼포먼스를 하고 있다. 이날 회원들은 최저임금 1만원, 비정규직철폐, 노조할 권리를 요구하고 오는 6월 30일 총파업을 예고했다. 2017.5.27/뉴스1 © News1 황기선 기자hm3346@▶ 놓치면 후회! 최신 만화 보기/2017년 나의 운세 보기▶ 여러분의 제보를 기다립니다. 제보하기(클릭!)[© 뉴스1코리아(news1.kr), 무단 전재 및 재배포 금지]"
69,2017-05-27,"인간 최고수의 눈물…""알파고 상대하기 고통스러웠다""",https://news.naver.com/main/read.nhn?mode=LSD&mid=shm&sid1=105&oid=018&aid=0003835456,이데일리,"- 커제, 알파고와 최종국 패배 후 ""극도로 냉정한 상대..고통 그 자체""바둑 세계랭킹 1위 커제 9단.[베이징= 이데일리 김대웅 특파원] 세계 바둑랭킹 1위인 중국 커제 9단은 27일 구글 딥마인드가 개발한 인공지능(AI) 알파고와의 대국 후 “바둑두는 것이 고통스러웠다”고 소감을 밝혔다.커제 9단은 27일 중국 저장성 우전 인터넷 국제컨벤션센터에서 열린 알파고와의 3국에서 패배한 뒤 기자회견을 갖고 “알파고가 극도로 냉정한 모습을 보여 함께 바둑두는 것이 고통 그 자체였다”고 말했다.그는 “알파고와 바둑을 둘 때는 이길 수 있다는 조금의 희망도 갖기 어려웠다”며 기자회견 중 울먹이는 모습을 보였다. 그러면서 “칭찬을 받을 자격이 없고 져서 죄송하다”고 말했다.이날 패인에 대해서는 “오늘 대국은 부족한 점이 많이 있었고 포석 단계에서 내가 생각해도 참기 힘든 악수를 뒀다”면서 “출발부터 손해를 봐서 이후 바둑을 어렵게 풀어갔다”고 분석했다.커제 9단은 앞서 이날 대국중에도 압박감을 참지 못하고 눈물을 흘린 것으로 알려졌다. 그는 제한시간 1시간여를 남긴 시점에 돌연 자리를 벗어났다가 10여분만에 돌아와 눈가를 닦으며 울먹거리는 모습을 보이기도 했다.한편 구글 딥마인드는 이날 커제 9단과의 대국을 끝으로 알파고가 바둑계에서 은퇴한다고 밝혔다. 데미스 허사비스 구글 딥마인드 최고경영자(CEO)는 이날 ‘바둑의 미래 포럼’ 폐막 기자회견에서 “이번 행사가 알파고가 참가하는 마지막 바둑 대국”이라고 말했다.그는 “바둑의 발상지에서 최고수 기사들이 참여한 가운데 열린 이번주 바둑의 미래 포럼 행사는 알파고가 대국 시스템에서 최고 프로기사들과 대결할 수 있는지를 측정하기 위한 것이었다”며 이같이 말했다. 이로써 알파고의 전적은 이세돌 9단과 5번기, 연초 인터넷 대국, 커제 9단과 3번기, 단체 상담기까지 합쳐 모두 68승 1패로 남게 됐다.허사비스 CEO는 “이번의 바둑 대국은 인공지능의 최고수준을 체현함으로써 인류가 인공지능을 도구로 삼을 수 있다는 잠재력을 확인한 것”이라며 “앞으로 인공지능은 인류가 새로운 지식영역을 개척하고 진리를 발견할 수 있도록 돕게 될 것”이라고 말했다.김대웅 (daxiong@edaily.co.kr)▶심쿵유발 스타 화보 [핫포토]▶이데일리 [페이스북]|[포스트]▶한 눈에 보는 이슈 트렌드 [카드뉴스]＜ⓒ종합 경제정보 미디어 이데일리 - 무단전재 & 재배포 금지＞"
70,2017-05-27,공급 느는데도 오징어는 금값…정부 사재기 주시 ,https://news.naver.com/main/read.nhn?mode=LSD&mid=shm&sid1=101&oid=448&aid=0000211566,TV조선,"[앵커]요즘 가격이 폭등하는게 한두가지 아니라는 이야기 많이 합니다. 이번에는 오징어 가격이 금값입니다. 그런데 사실 오징어 어획량은 늘고 있는데도 가격이 급등하고 있는 상황입니다. 정부는 사재기 여부를 주시하고 있습니다황민지 기자입니다.[리포트]찬거리를 준비하려는 주부들로 분주한 마트. 오징어를 잡았던 손이 들었다 놓았다를 반복할 뿐, 장바구니에 담지 못합니다.박정자 / 서울 옥인동""애들이 좋아하니까 자주 먹는데 오징어같은 경우는 싼 반찬인데도 1000원 이상 오르면 부담스럽거던요. ""생물 오징어 가격은 가파르게 상승해 1년전보다 70%넘게 올랐습니다. 오징어를 파는 식당에도 비상이 걸렸습니다.구승모 / 오징어전문식당 직원""아무래도 오징어 값은 오르는데 저희가 손님한테 제공되는 값은 올리기가 쉽지는 않으니까.""수온 상승과 중국 어선 등의 영향으로 지난해 어획량이 준 것이 가격 상승의 1차 원인입니다.얼마 전 오징어 6천 톤을 싣고 오던 운반선이 토클랜드 수역에서 침몰한 것도 악재였습니다.문제는 올들어 원양 어획량이 확연히 늘고 있는데도, 가격이 요지부동이란 점 사재기가 의심됩니다.그래서 정부는 며칠 안에 사흘치 물량인 3천 3백 톤을 시장에 풀어 가격 동향을 보기로 했습니다.시장 반응이 비정상적이라고 판단되면 사재기 조사에 들어갑니다. 규모가 큰 유통업체가 우선 조사 대상이라고 정부 관계자는 밝혔습니다.TV조선 황민지입니다. / 황민지 기자 sming@chosun.com* 뉴스제보 : 이메일(tvchosun@chosun.com), 카카오톡(tv조선제보), 전화(1661-0190)황민지 기자(sming@chosun.com)- Copyrights ⓒ TV조선. 무단전재 및 재배포 금지 -"
71,2017-05-27,G7 정상회의 이틀째…기후협정·자유무역에서 여전한 이견,https://news.naver.com/main/read.nhn?mode=LSD&mid=shm&sid1=104&oid=001&aid=0009296025,연합뉴스,"회의 첫날 테러·극단주의 저지 공동 성명 발표(로마=연합뉴스) 현윤경 특파원 = 미국, 독일, 영국, 프랑스, 이탈리아, 일본, 캐나다로 구성된 주요 7개국(G7) 정상회의가 27일 이탈리아 시칠리아 섬 타오르미나에서 이틀 째 일정에 돌입했다.회의 첫날 테러리즘 규탄하는 공동 성명을 발표한 정상들은 폐막일인 이날은 기후변화와 세계 무역, 난민 문제 등 나머지 주요 의제에서 공통의 입장을 도출하기 위해 논의를 이어간다.이탈리아 G7 정상회의에서 기념촬영을 하는 정상들 (타오르미나<이탈리아> AFP=연합뉴스) 주요 7개국(G7) 정상들이 26일(현지시간) 이탈리아 시칠리아 섬 타오르미나에서 개막한 G7 정상회의에 참석, 단체 기념촬영을 하고 있다. 왼쪽부터 쥐스탱 트뤼도 캐나다 총리, 앙겔라 메르켈 독일 총리, 도널드 트럼프 미국 대통령, 파올로 젠틸로니 이탈리아 총리, 에마뉘엘 마크롱 프랑스 대통령, 아베 신조 일본 총리, 테리사 메이 영국 총리.lkm@yna.co.kr미국을 제외한 나머지 6개국 정상들은 온실가스 배출을 억제하는 파리기후협정 탈퇴를 공언하고, 미국 우선주의를 내세우며 자유무역 중심의 기존 세계 질서에서 이탈 조짐을 보이고 있는 도널드 트럼프 미국 대통령을 설득하기 위해 전방위적인 압박에 나설 전망이다.하지만, 트럼프 대통령은 기후협정 등에 대해 올바른 결정을 내리기 위해서는 시간을 갖고 더 숙고해보겠다는 입장인 것으로 알려져 공동 성명 채택에 난항이 예상된다.G7 회의장에 도착한 도널드 트럼프 미국 대통령 [AFP=연합뉴스]일본에서 개최된 작년 G7 정상회의에서는 G7이 파리기후협정을 준수하고, 모든 형태의 보호무역 저지를 위해 공동 노력한다는 문구가 들어간 공동 성명에 회원국 모두가 서명했다.올해 G7 의장국인 이탈리아의 파올로 젠틸로니 총리는 이와 관련, 첫날 회의가 끝난 뒤 연 기자회견에서 ""통상 문제와 관련해서는 절충에 다가서고 있다""며 회원국 간 이견이 좁혀지고 있음을 시사했다. 그러나, 기후 변화 문제에 대한 결론은 여전히 보류 중이라고 말했다.G7 정상들은 이날 난민 문제의 근본적인 해결을 위해서는 아프리카의 혁신과 개발이 필수적이라는 인식 아래 튀니지, 에티오피아, 케냐, 니제르, 나이지리아 등 아프리카 5개국 지도자들이 참가한 가운데 아프리카 지원 방안을 모색하는 별도의 논의도 진행한다.또한, 아베 신조 일본 총리의 주도로 북핵·미사일 위협과 북한 제재 등에 대한 논의도 이뤄질 것으로 보인다. 이밖에 대(對)러시아 제재 유지, 시리아 사태 해결 방안 등도 의제로 다뤄진다.한편, 정상들은 회의 첫날에는 대(對)테러 공조 강화를 골자로 한 테러 반대 성명을 공동 발표했다.정상들은 성명에서 지난 22일 맨체스터 콘서트장에서 발생한 자살 폭탄 테러로 22명이 목숨을 잃은 영국에 지지와 연대를 표명하는 한편 테러 자금원을 차단하고, 인터넷 공간에서 이슬람국가(IS) 등 극단주의 테러조직의 게시물이 노출되지 않도록 인터넷 기업들에 압박을 가하는 등 테러 방지를 위해 모든 노력을 다할 것이라고 밝혔다.ykhyun14@yna.co.kr최신 유행 트렌드 총집결 #흥(클릭!)"
72,2017-05-27,"정부 ""연락두절 韓선원과 통화…기상악화로 통신 끊겨""",https://news.naver.com/main/read.nhn?mode=LSD&mid=shm&sid1=102&oid=421&aid=0002755430,뉴스1,"인천연안부두 인근 해상에서 인천해경이 서북도서 운항 여객선 피랍 모의 훈련을 진행, 경찰특공대 대원들이 여객선으로 접근하고 있다./뉴스1 © News1외교부 ""해적선 의심 선박에 쫓긴 건 사실""관계국 협조 요청 해제, 사건 종결 예정(서울=뉴스1) 양은하 기자,서미선 기자 = 소말리아 해상에서 피랍된 것으로 추정됐던 어선과 통신이 재개됐다. 어선에 탑승한 한국인 선원 3명도 안전한 것으로 파악됐다.외교부 당국자는 27일 ""이날 0시20분쯤 인도양 항해중 연락두절됐던 우리 탑승선원 3명 관련, 이날 오후 5시23분쯤 선사 국내 협력자와 선박 선장 간 통화가 성사됐다""고 밝혔다.이어 ""선원 3명의 안전을 확인했다""며 ""주남아공대사관도 남아공 소재 선사와 연락해 선원 안전을 재차 확인했다""고 덧붙였다.앞서 우리 정부와 군은 몽골 국적의 어선이 이날 0시20분(한국시간)쯤 인도양(오만 살랄라 남동방 약 1400㎞)에서 통신이 두절됐다고 밝혔다.당시 해적선으로 의심되는 선박이 뒤따라오고 있다는 연락 후 통신이 두절돼 해적에 피랍된 것으로 추정됐다.이에 문재인 대통령은 이날 오전 8시 관련 상황을 보고받고 외교부와 합동참모본부에 '전원 잘 구출할 수 있도록 상황파악을 하고 합당한 조치를 하라'고 즉각 지시를 내렸다.우리 군도 청해부대를 현장 인근해역으로 급파했고 인도, 독일, 일본 등도 해상 초계기를 투입해 통신이 두절된 어선 추적에 나섰다.외교부는 당시 사항을 파악한 결과 해당 어선이 해적으로 의심되는 선박에 쫓겼던 것으로 확인됐다고 전했다.다른 외교부 관계자는 ""인도양은 해적선이 많이 출몰하는 곳으로 당시 어선이 해적선 의심 선박에 쫓겼던 것은 사실""이라며 ""이를 계속 피하면서 선박을 따돌렸고 다행히 피해사항은 없었다""고 설명했다.해당 어선이 17시간가량 통신이 끊긴 것은 기기 이상 때문인 것으로 파악됐다. 청와대 고위 관계자는 통화에서 ""기상 악화로 기기가 잘못돼 통신이 안 됐던 것""이라며 ""조금 전 복구가 됐다""고 말했다.해당 어선이 피랍되지 않은 사실이 확인됨에 따라 정부는 관계국 협조 요청을 해제하고 사건을 종결할 예정이다.외교부 당국자는 ""우리 정부는 소말리아 해적이 활동중인 해역을 운항하는 우리 선박들에게 각별히 안전에 유의할 것을 지속 계도할 예정""이라고 말했다.한편 이 어선은 234톤, 길이 38m 규모의 오징어잡이 '서현389호'로 당시 어선에는 선장, 기관장, 갑판장 등 한국인 선원 3명과 인도네시아인 18명 등이 탑승한 것으로 파악됐다.letit25@▶ 놓치면 후회! 최신 만화 보기/2017년 나의 운세 보기▶ 여러분의 제보를 기다립니다. 제보하기(클릭!)[© 뉴스1코리아(news1.kr), 무단 전재 및 재배포 금지]"
73,2017-05-27,휴일 전국 불볕더위…자외선지수 '매우 높음',https://news.naver.com/main/read.nhn?mode=LSD&mid=shm&sid1=103&oid=422&aid=0000258334,연합뉴스TV,"[날씨] 휴일 전국 불볕더위…자외선지수 '매우 높음'오늘도 근래와 비교해 다소 더워졌다 싶었는데요.내일은 기온 더 올라갑니다.내리쬐는 불볕에 서울 28도, 대구 31도 등 한낮 더위가 기승을 부리겠습니다.자외선지수도 전국적으로 '매우 높음'이 예보됐습니다.볕이 가장 뜨거운 10시에서 3시 사이 외출하신다면 모자나 선글라스 등으로 자외선 차단 잘 해주셔야겠습니다.날이 더워지면서 서쪽 전역에서 오존도 짙을 가능성이 크겠습니다.당분간 더위는 더 심해집니다.새로운 주 초반에는 서울도 30도까지 올라가는 등 내륙지역을 중심으로 한여름 더위가 예상되고 있는데요.수요일 전국에 비소식 들어있기는 하지만 양이 워낙 적어서 더위를 해소하는 데 큰 도움이 되지는 못할 전망입니다.내일 하늘 맑겠고, 미세먼지도 '보통' 수준 되겠습니다.다만 밤부터는 중국 스모그가 유입되면서 중서부를 중심으로 공기가 다소 탁해지겠습니다.내일 아침 기온은 서울 15도, 대전 13도, 전주와 창원 14도에서 출발하겠습니다.낮 최고 기온 서울 28도, 대전과 청주 30도, 대구 31도까지 올라가겠습니다.지구와 달이 가까워지면서 당분간 바닷물 높이가 높습니다.서해안과 남해안 저지대에서는 침수 피해 없도록 주의하셔야겠습니다.날씨 전해드렸습니다.(김도연 기상캐스터)연합뉴스TV : 02-398-4441(기사문의) 4409(제보), 카톡/라인 jebo23▶ 연합뉴스TV 생방송 시청▶ 뉴스스탠드 구독▶ 대한민국 뉴스의 시작, 연합뉴스TV 앱 다운받기"
74,2017-05-27,광주서 메르스 의심 증상…이스라엘 다녀온 60대 여성,https://news.naver.com/main/read.nhn?mode=LSD&mid=shm&sid1=102&oid=001&aid=0009295999,연합뉴스,(광주=연합뉴스) 정회성 기자 = 광주서 60대 여성이 메르스(중동호흡기증후군) 의심 증상을 보여 보건 당국이 역학 조사에 나섰다.27일 광주 서구보건소에 따르면 이날 오후 2시 30분께 광주 서구의 한 병원에 메르스 감염 여부를 검사해달라며 A(60·여) 씨가 찾아왔다.A씨는 이스라엘을 방문했다가 전날 귀국했다. 고열 증상 등을 호소한 것으로 전해졌다.해당 병원에서 진행한 1차 검사 결과 A씨 몸에서는 독감으로 알려진 A형 인플루엔자 바이러스 양성 반응이 나왔다.보건 당국은 매뉴얼에 따라 음압 격리병상이 마련된 광주 한 대학병원으로 A씨를 이송해 추가 검사를 진행하고 있다.hs@yna.co.kr최신 유행 트렌드 총집결 #흥(클릭!)
