,날짜,기사 제목,기사 링크,기사 출처,기사 내용
117,2017-05-27,"北 ""韓 무인정찰기 영공침범"" 주장…軍 ""사실 아니다"" ",https://news.naver.com/main/read.nhn?mode=LSD&mid=shm&sid1=100&oid=421&aid=0002755034,뉴스1,"이라크 상공을 날고 있는 미 육군 스캔이글 정찰기. © AFP=뉴스1합참 ""그 시각에 MDL 이남 5㎞ 상공에서 작전""(서울=뉴스1) 양은하 기자 = 북한이 27일 한국의 무인정찰기(UAV)가 자신들의 영공에 침범해 군사적 도발을 감행했다고 주장했다.북한 조선중앙통신은 27일 ""5월26일 7시46분부터 20시40분 사이에 남조선 괴뢰 군부 호전광들은 무인정찰기 '헤론' 1대를 서해 열점 수역과 그 주변 지역 상공에서 행동시키면서 무려 4차에 걸쳐 우리측 영공에 깊숙이 침범시키는 엄중한 군사적 도발 행위를 감행했다""고 보도했다.이어 ""이러한 군사적 도발 행위는 미제가 괌도에 배치되어있던 대형 무인정찰기 '글로벌호크' 4대와 조종사 등 100여명을 태풍을 피한다는 미명 아래 우리나라와 가까운 일본 가로다 기지에 전진 배치한 것과 같이하고 있다는 데 엄중성이 있다""고 강변했다.통신은 이어 ""이번에 무인정찰기를 최대로 예민한 서해 열점 수역과 그 주변 지역의 우리측 영공에 깊숙이 들이미는 모험적인 군사적 도발을 감행한 것은 남조선에서 날로 높아가는 북남관계 개선요구를 차단하고 미국 상전의 대조선 침략책동에 편승해 북침 도화선에 불을 달아보려는 간악한 흉계로부터 출발한 것""이라고 억지 주장을 펼쳤다.그러면서 ""우리의 거듭되는 경고에도 불구하고 조선반도정세의 긴장을 계단식으로 격화시키고 있는 괴뢰군부 호전광들의 군사적 도발은 우리 군대의 무자비한 보복대응만을 초래하게 될 것""이라고 위협했다.이에 대해 합동참모본부는 ""그 시각에 군사분계선(MDL) 이남 5㎞ 상공에서 작전한 것은 맞지만 넘어가지는 않았다""며 북한의 주장은 사실이 아니라고 밝혔다. 이어 ""훈련의 일환으로 정기적으로 하는 작전활동이었고 (26일에도) 원래 계획대로 작전을 시행했다""고 덧붙였다.letit25@▶ 놓치면 후회! 최신 만화 보기/2017년 나의 운세 보기▶ 여러분의 제보를 기다립니다. 제보하기(클릭!)[© 뉴스1코리아(news1.kr), 무단 전재 및 재배포 금지]"
118,2017-05-27,이낙연 경과보고서 채택 놓고 與野 팽팽한 기싸움,https://news.naver.com/main/read.nhn?mode=LSD&mid=shm&sid1=100&oid=008&aid=0003878989,머니투데이,"[머니투데이 정영일  기자] [[the300]野 ""양보하면 앞으로 계속 밀려"" 與 ""이미 사과했다""]이낙연 국무총리 후보자가 26일 오전 서울 종로구 금융감독원 연수원에 마련된 사무실로 출근하며 기자들 질문에 답변하고 있다.  2017.5.26/사진=뉴스1문재인 정부 초대 국무총리 인준절차가 난항을 겪고 있는 가운데 여야가 해법을 놓고 팽팽한 기싸움을 하고 있다. 야당에서는 ""대통령이 해법을 제시해야한다""고 주장하고 있는 반면 여당에서는 ""전날 임종석 비서실장의 사과로 충분하다""는 입장이다. 인사청문회가 잇따라 예정돼 있어 서로 한치의 양보도 없는 힘겨루기로 들어가는 모양새다.정용기 자유한국당 원내수석대변인은 27일 구두 논평을 통해 ""(이낙연 총리의 위장전입 문제와 관련) 임종석 청와대 비서실장이 대신 변명을 해 한국당 내에서 부정적 기류가 강해졌다""며 ""이 문제가 풀리기 위해서는 문 대통령이 스스로 입장을 분명히 밝혀줘야 한다""고 말했다.김유정 국민의당 대변인도 이날 서면논평을 통해 ""대통령이 강조했던 인사원칙이 무너지는 이유를 비서실장을 통해 들어야 하는 상황은 납득하기 어려운 일""이라며 ""고위 공직 후보자에게 이의가 있다고 손드는 야당과 국민에게 솔직하게 문제를 설명하고 해명하는 것도 대통령의 몫""이라고 했다.여당 측은 대통령의 사과를 요구하는 야당 측의 요구가 무리하다고 반박하고 있다. 강훈식 더불어민주당 원내대변인은 ""지난 9년간 한 번도 비서실장의 사과는 없었다""며 ""원활한 국정운영을 위해 청와대가 이렇게 노력을 하는데도 대통령의 사과를 요구하는 것은 과도하다""고 말했다.야당 측은 내주 인사청문회가 잇따라 예정돼 있는만큼 쉽게 물러날 수 없다는 입장이다.정용기 대변인은 ""앞으로 청문회가 계속되는데 이 총리 후보자를 인준해준다면 다른 후보자들도 모두 인준해줘야 하는 문제가 있다""고 했다. 박지원 전 국민의당 대표 역시 페이스북 게시글을 통해 ""만약 총리를 인준한다고 하면 5대 원칙을 위반한 또다른 외교부장관과 공정거래위원장은 어떻게 해야 하나""라고 꼬집었다.여당 측은 임종석 실장의 사과에 이낙연 후보자 외에 강경화 김상조 후보자의 위장전입 문제까지 포함된 것이라고 해명했다. 강훈식 대변인은 ""임 실장의 사과가 이 후보자에 한정된 것이 아니라 지금까지 제기된 문제 전반에 대한 것이었다""라며 ""이와 함께 향후 인사에 대한 검증은 좀더 꼼꼼히 하겠다는 약속도 포함돼 있던 것""이라고 강조했다.[▶깊이있는 투자정보 'TOM칼럼'][▶트렌드 리더의 스타일 지침서 '스타일M'][▶빵빵한 차&레이싱걸]정영일  기자 bawu@mt.co.kr<저작권자 ⓒ '돈이 보이는 리얼타임 뉴스' 머니투데이, 무단전재 및 재배포 금지>"
119,2017-05-27,"與野, 내각인선 샅바싸움…""정치공세"" vs ""5대 비리 불가""",https://news.naver.com/main/read.nhn?mode=LSD&mid=shm&sid1=100&oid=421&aid=0002755038,뉴스1,"이낙연 국무총리 후보자. © News1 김명섭 기자(서울=뉴스1) 김정률 기자,이정호  기자,한재준 기자 = 여야는 27일 이낙연 국무총리 후보자의 위장전입 문제와 관련해 상반된 입장을 내놨다.집권여당인 더불어민주당은 ""정치공세로는 협치를 이뤄낼 수 없다""며 야당의 태도 변화를 촉구했다.강훈식 민주당 원내대변인은 이날 구두논평을 통해 ""꼬투리 잡는 태도는 바람직하지 않다""며 ""26일 임종석 비서실장이 (이낙연 국무총리 후보자의 위장전입 논란에) 사과를 한 것은 큰 의미가 있다""며 ""이것은 사과이자 고백""이라고 진단했다.이어 ""협치의 의미 되살리는 것이 성숙한 민주주의의 자세""라며 ""무조건 끌어내리겠다는 식은 향후 여야 관계에도 도움이 되지 않는다""고 주장했다.반면 야당은 이 후보자의 위장전입은 문재인 대통령이 강조했던 '5대 비리'에 해당된다는 입장이다.정용기 자유한국당 원내수석대변인은 ""(이낙연 총리의 위장전입 문제와 관련) 임종석 청와대 비서실장이 대신 변명을 해 한국당 내에서 부정적 기류가 강해졌다""며 ""앞으로 청문회가 계속되는데 이 총리 후보자를 인준해준다면 다른 후보자들도 모두 인준해줘야 하는 문제가 있다""고 말했다.그러면서 ""문 대통령이 내걸었던 원칙을 스스로 어기고 있는 상황에서 야당으로서 이들을 전부 인준을 해줘야 하는 딜레마에 빠졌다""고 설명했다.특히 ""이 문제가 풀리기 위해서는 문 대통령이 스스로 입장을 분명히 밝혀줘야 한다""며 ""그래야 야당도 진전된 모습을 보일 수 있다""고 부연했다.박지원 전 국민의당 대표는 ""문 대통령은 초심으로 돌아가 꼬여만 가는 인사문제에 대해 공명정대하게 대응해야 한다""는 입장을 내놨다.박 전 대표는 이날 자신의 페이스북을 통해 ""5대 비리와 관련한 인물을 등용하지 않겠다는 원칙이 깨져가는 작금의 상황을 대통령이 직접 해결해야한다""며 ""만약 총리를 인준한다고 하면 5대 원칙을 위반한 외교부 장관과 공정거래위원장 후보자는 어떻게 해야 하나. 문 대통령이 해법을 내야 한다""고 강조했다.또 ""모든 문제를 직접 소탈하게 하던 대통령이 아니냐. 국민은 그런 모습에 감동했던 것""이라고 했다.조영희 바른정당 대변인 역시 ""청와대는 추상적 반성이 아니라 세부적 인선 기준을 밝혀야 한다""고 지적했다.조 대변인은 ""국정수습이 시급한 상황에서 내각 인선과 관련해 무조건 반대를 하는 입장은 아니지만 그냥 넘어갈 경우 굉장히 부정적 선례를 만들 수 있다""며 ""어제 청와대 발표도 너무 추상적이라서 실망스럽다""고 꼬집었다.그러면서 ""서훈 국정원장 후보자의 자문료 문제 역시 항상 문제가 되는 것""이라며 ""청와대에서 인선기준을 제시했으면서도 자꾸 논란이 불거지는 것은 유감""이라고 밝혔다.jh.lee@▶ 놓치면 후회! 최신 만화 보기/2017년 나의 운세 보기▶ 여러분의 제보를 기다립니다. 제보하기(클릭!)[© 뉴스1코리아(news1.kr), 무단 전재 및 재배포 금지]"
120,2017-05-27,세월호 선체 수색 이틀간 중단…수습인력 피로 누적,https://news.naver.com/main/read.nhn?mode=LSD&mid=shm&sid1=102&oid=421&aid=0002754990,뉴스1,"코리아 쌀베지 작업자들이 26일 오후 전남 목포신항에 거치된 세월호에서 나온 펄을 나르고 있다. 2017.5.26/뉴스1 © News1 남성진 기자29일 재개…진흙 분리·수중수색은 지속(목포=뉴스1) 전원 기자 = 세월호 선체 수색이 수습인력의 피로도 등으로 인해 이틀 간 중단된다.침몰해역에 대한 수색과 선체에서 발견된 지장물의 진흙 분리 작업은 계속 이어진다.세월호 현장수습본부는 27일 선체 수색작업을 벌이는 인력들의 피로도 등의 문제로 이틀간 선체 수색을 중단하기로 했다고 밝혔다.선체 수색작업은 오는 29일 재개될 예정이다. 선체 수색은 지난달 18일부터 지난 26일까지 대선일을 제외하고 계속 진행돼 왔다.이로인해 선체 내부에서 지장물을 제거하거나 수습작업을 벌이는 인력의 피로도가 누적돼 휴식이 필요한 상황이라고 수습본부는 설명했다.다만 세월호 선체에서 수습한 진흙을 분리하는 작업과 수중수색은 계속 진행된다.지난 26일 오전 3시20분께 세월호 침몰해역에 대한 소나탐색이 완료됐다. 그 결과 3개 구역에서 지장물이 발견돼 잠수사의 확인이 필요한 상태였다.수습본부는 27일 오전 2시10분부터 2시44분까지 잠수사를 투입해 이중 한 구역에 대한 수색을 벌여 동물의 것으로 추정되는 뼈조각 1점을 발견했다.수습본부는 오후 2시쯤 뼛조각이 발견된 구역에 대한 수색을 재개할 방침이다.수습본부 관계자는 ""수습인력의 피로도를 감안해 이번 주말에는 선체 수색을 중단하기로 했다""며 ""다만 세월호서 수습된 진흙에 대한 분리작업과 수중수색은 계속 이어질 것""이라고 말했다.junwon@▶ 놓치면 후회! 최신 만화 보기/2017년 나의 운세 보기▶ 여러분의 제보를 기다립니다. 제보하기(클릭!)[© 뉴스1코리아(news1.kr), 무단 전재 및 재배포 금지]"
121,2017-05-27,"""푸른 하늘 오랜만!""…서울 미세먼지 최근 한달새 최저치",https://news.naver.com/main/read.nhn?mode=LSD&mid=shm&sid1=103&oid=001&aid=0009295623,연합뉴스,"북풍 등으로 한기 내려와 청정공기 유입…당분간 좋은 날씨 이어질 듯(서울=연합뉴스) 이태수 기자 = '하늘은 푸르고 공기는 맑다.'전국이 미세먼지로 몸살을 앓던 올봄 이례적으로 최근 맑고 깨끗한 날이 이어지고 있다. 앞으로도 당분간 이처럼 야외로 나들이 가기 좋은 날씨가 이어질 것으로 보인다.27일 한국환경공단 에어코리아와 국립환경과학원 등에 따르면 전날 서울의 일평균 미세먼지(PM10) 수치는 24㎍/㎥로 나타났다. 이는 지난달 28일부터 최근 한 달간 데이터를 살펴봤을 때 가장 낮은 수치다.다른 지역 역시 부산 39㎍/㎥, 대구 30㎍/㎥, 인천 29㎍/㎥, 광주 28㎍/㎥, 대전 28㎍/㎥, 제주 30㎍/㎥ 등 '좋음' 혹은 '보통' 수준에 머물렀다.이는 이달 초 중국발 황사로 전국이 몸살을 앓았을 때 서울 기준 6일 195㎍/㎥, 8일 174㎍/㎥, 9일 125㎍/㎥를 각각 기록한 것과 비교하면 최대 8분의 1 수준으로 '뚝' 떨어진 것이다.토요일인 27일도 전국의 미세먼지는 좋음∼보통 수준을 유지하고 있다.오전 10시 현재 서울 35㎍/㎥, 인천 34㎍/㎥, 부산 43㎍/㎥, 광주 33㎍/㎥, 제주 25㎍/㎥, 대구 43㎍/㎥ 등을 나타내고 있다.이를 두고 국립환경과학원 관계자는 ""북태평양에 자리한 고기압의 영향으로 남풍에 의해 깨끗한 공기가 들어오거나, 북풍에 의해 한기가 내려오면서 청정한 공기가 유입됐기 때문""이라고 분석했다.날씨 역시 전국이 맑고 한낮에는 30도 안팎의 높은 기온이 이어지면서 나들이객의 발길도 분주해질 것으로 예상된다.다음 주 역시 목요일인 6월 1일 서울, 경기도, 강원영서에 비 소식이 있는 것을 빼고는 대체로 맑고 가끔 구름만 많을 것으로 예보됐다.미세먼지도 여름이 찾아오면서 점차 좋아질 것이라는 관측이 나온다.국립환경과학원은 우선 28∼29일은 미세먼지 수치가 이날과 '보통' 수준으로 비슷할 것이라고 내다봤다.국립환경과학원 관계자는 ""여름에 점차 접어들고 있기 때문에 북태평양에서 들어오는 남풍 계열의 따뜻한 공기가 들어오면 미세먼지 수치도 점차 좋아질 것""이라면서도 ""대기가 정체된다면 조금씩 농도가 높아질 수는 있다""고 말했다.하늘 좋은 날!(서울=연합뉴스) 김주형 기자 = 26일 오전 서울 경복궁에서 바라본 하늘이 파랗다. 오늘은 미세먼지 농도도 '좋음'을 나타내고 있다. 2017.5.26kjhpress@yna.co.kr푸르러 좋은 하늘 (서울=연합뉴스) 서명곤 기자 = 26일 서울 한강에서 바라본 하늘이 파랗다. 미세먼지농도는 '좋음'. 2017.5.26tsl@yna.co.kr최신 유행 트렌드 총집결 #흥(클릭!)"
122,2017-05-27,"국정기획위 ""경찰, 인권 옹호기관으로 거듭나야""",https://news.naver.com/main/read.nhn?mode=LSD&mid=shm&sid1=100&oid=001&aid=0009295642,연합뉴스,"박범계 분과위원장, '수사권 조정 필수 전제조건' 文대통령 입장 재확인""경찰이 수사권 받았을 때 권한남용 통제는 중요 과제""(서울=연합뉴스) 임기창 기자 = 문재인 정부에서 사실상 인수위원회 역할을 하는 국정기획자문위원회가 27일 경찰청 업무보고에서 경찰이 검찰-경찰 수사권 조정을 위해 인권보호 문제를 개선해야 한다는 문 대통령 입장을 재확인했다.박범계 국정기획위 정치·행정분과 위원장은 이날 오전 서울 종로구 통의동 국정기획위 사무실에서 열린 경찰청 업무보고에서 모두발언을 통해 ""수사권 조정을 통해 경찰이 수사권을 가져간다고 한다면, 인권 옹호기관으로 거듭나지 않으면 안 된다는 지적은 매우 일리 있고 적절하고 촌철살인""이라며 이같이 말했다.조국 청와대 민정수석은 앞서 25일 청와대 브리핑에서 국가인권위원회 위상 강화 등을 거론하면서 검-경 수사권 조정의 필수 전제조건으로 경찰의 인권보호 문제를 개선해야 한다는 문 대통령 입장을 전달했다.박 위원장은 검찰이 수사권·기소권·영장청구권·공소유지권·형 집행권 등 권한을 장악하고, 검찰을 지휘·감독할 법무부가 검사들에 장악된 현실을 지적하며 검-경 수사권 조정 등으로 검찰 권한을 분산할 필요성을 강조했다.그러나 ""11만명의 경력과 정보, 대테러, 외사, 경비, 경호 등 권한을 가진 경찰이 수사권을 받았을 때 검찰에게 우려했던 권한 남용은 어떻게 통제할 것인가, 견제와 균형 원리를 어떻게 찾아갈 것인가는 굉장히 중요한 과제""라고 말했다.이어 ""이것에 대한 국민 우려를 불식하지 못한다면 권한의 수평적 이동을 통해 또 다른 하나의 권력기관을 만들겠다는 것과 진배없다""고 밝혔다.박 위원장은 또 ""경찰은 경비국, 수사국, 정보국, 외사국, 생활안전국 등 물적 토대를 갖고 있다. 정보와 수사를 할 수 있는 기능이 있다""면서도 ""아무리 살펴봐도 수사 관련 세부 규정들이 제대로 정비됐는지 의문이 크다""고 지적했다.그는 2012년 대선을 앞두고 불거진 국가정보원 대선개입 사건 수사에 김용판 당시 서울지방경찰청장이 개입했다는 의혹, 경찰 진압작전의 적절성 논란을 불러일으킨 2009년 용산참사, 백남기 농민이 2015년 11월 민중총궐기 집회에서 경찰 물대포에 맞아 쓰러진 뒤 사망한 사건 등을 따로 언급하기도 했다.다만 박 위원장은 ""우리 경찰은 거대한 조직에 걸맞은 위상이 제고돼 있지 않은 것이 현실""이라며 ""여론조사상 우리 국민들이 검찰보다는 경찰을 더 믿을 수 있는 기관으로 생각한다""고 덧붙였다.(서울=연합뉴스) 김현태 기자 = 박범계 정치행정분과위원장이 27일 오전 서울 종로구 통의동 금융감독원 연수원에 마련된 국정기획자문위원회 경찰청 업무보고에 참석, 발언하고 있다. 2017.5.27pulse@yna.co.kr최신 유행 트렌드 총집결 #흥(클릭!)"
123,2017-05-27,"김기춘 ""불구속으로 재판받고 싶다""…법원에 보석 신청",https://news.naver.com/main/read.nhn?mode=LSD&mid=shm&sid1=100&oid=421&aid=0002755007,뉴스1,"김기춘 전 청와대 비서실장이 24일 오전 서울 서초구 서울중앙지방법원에서 열린 직권남용 권리행사방해 등 '문화계 블랙리스트'사건 관련 17회 공판에 출석하고 있다. 2017.5.24/뉴스1 © News1 민경석 기자고령에 심장 등 건강상 이유…法, 내용 검토후 결정(서울=뉴스1) 성도현 기자 = 문화예술계 지원배제 명단인 '블랙리스트' 작성 지시 등 혐의로 구속기소된 김기춘 전 대통령 비서실장(78)이 불구속 상태로 재판을 받게 해 달라고 법원에 요청했다. 그는 약 4개월 동안 수감생활 중이다.27일 법조계에 따르면 김 전 실장 측 변호인은 전날 1심 재판부인 서울중앙지법 형사합의30부(부장판사 황병헌)에 보석 신청서를 냈다.김 전 실장은 지난해 12월 국회 국정조사 청문회에서 ""심장에 스탠트(그물망으로 된 튜브)도 7개 박혀 있고 어젯밤에도 통증이 와서 입원할까 했다""며 고령으로 심장 등 건강이 좋지 않다고 강조한 바 있다.재판부는 이 사건의 공소유지를 맡고 있는 박영수 특별검사팀과 김 전 실장 측 의견을 검토한 뒤 결정을 내릴 방침이다.김 전 실장은 박근혜 전 대통령(65), 조윤선 전 문화체육관광부 장관(51) 등과 공모해 블랙리스트 작성·활용에 소극적인 문체부 실장 3명에게 사직을 강요하고 국회 국정조사 청문회에서 거짓 증언을 한 혐의(직권남용권리행사방해·위증) 등으로 구속기소됐다.dhspeople@news1.kr▶ 놓치면 후회! 최신 만화 보기/2017년 나의 운세 보기▶ 여러분의 제보를 기다립니다. 제보하기(클릭!)[© 뉴스1코리아(news1.kr), 무단 전재 및 재배포 금지]"
124,2017-05-27,과천봉담간 고속화도로 쇳조각 떨어져 차량 17대 '펑크',https://news.naver.com/main/read.nhn?mode=LSD&mid=shm&sid1=102&oid=001&aid=0009295570,연합뉴스,"(의왕=연합뉴스) 최해민 기자 = 과천봉담간 고속화도로에서 차량 10여 대가 도로에 떨어진 쇳조각 때문에 타이어 등이 훼손되는 사고가 발생, 경찰이 용의 차량을 추적하고 있다.수거된 쇳조각[의왕서 제공=연합뉴스]26일 오후 8시께 경기도 의왕시 과천봉담간 고속화도로 의왕방면 과천터널에서 300m 지점에서 차량 17대가 도로에 떨어진 쇳조각에 타이어가 파손되는 등의 사고가 일어났다.일부 차량은 휠까지 훼손됐으며, 하마터면 인명사고도 날 뻔했다.도로에서는 찌그러진 쇠파이프로 추정되는 쇳조각(길이 34㎝, 넓이 5㎝)이 2점 발견됐다.출동한 경찰은 차량을 통제하고 도로에 떨어진 쇳조각을 수거하는 한편 적재 불량 화물차에서 쇳조각이 떨어졌을 가능성이 크다고 보고 용의차량을 쫓고 있다.경찰 관계자는 ""누군가 도로에 실수로 쇳조각을 떨어뜨린 거라면 형법상 재물손괴죄는 성립하지 않기 때문에 도로교통법상 적재 불량으로 처분하게 된다""라며 ""이 경우 적재물에 따라 범칙금 4만∼5만원이 부과된다""라고 설명했다.goals@yna.co.kr최신 유행 트렌드 총집결 #흥(클릭!)"
125,2017-05-27,주말 맑고 기온 올라…자외선·오존 주의,https://news.naver.com/main/read.nhn?mode=LSD&mid=shm&sid1=103&oid=422&aid=0000258247,연합뉴스TV,"[날씨] 주말 맑고 기온 올라…자외선ㆍ오존 주의어제 유독 파랬던 하늘 올려다보셨죠.오늘도 어제 만큼 맑은 날씨 속에 활동하기 좋겠습니다.앞으로 기온도 점점 더 오르겠는데요.우선, 현재 서울 19.1도, 광주가 17.3도 보이고 있고요.낮 동안에는 서울이 25도, 광주가 27도까지 올라 딱 예년 이맘 때의 날씨를 보이겠습니다.앞으로 남서쪽에서 따뜻한 공기가 유입되면서 기온은 점점 더 오르겠습니다.일요일인 내일도 전국이 맑은 가운데, 서울의 낮 기온 27도까지 오르겠고요.남부지방은 30도를 넘나드는 더위가 예상됩니다.더운 날씨 속에 건강관리도 잘 해주셔야겠습니다.이렇게 또다시 날이 더워지는 만큼, 볕도 더 강해집니다.낮 동안에는 자외선과 오존에 철저히 대비를 해주셔야겠습니다.한편, 오늘 미세먼지 농도는 '보통' 수준으로 먼지 걱정 없겠습니다.현재 위성 영상 보시면, 전국 하늘 맑은 가운데 낮 동안에도 화창한 날씨가 이어지겠습니다.오늘 동해상으로는 바람이 강하고 물결도 높게 일겠습니다.현재 시각 기온은 서울이 19.1도, 대전이 18.3도, 창원이 19.5도 나타내고 있습니다.낮 동안에는 서울이 25도, 청주 26도, 대구가 27도까지 올라서 어제보다 2~6도 가량 높겠습니다.지금까지 날씨 전해드렸습니다.(구본아 기상캐스터)연합뉴스TV : 02-398-4441(기사문의) 4409(제보), 카톡/라인 jebo23▶ 연합뉴스TV 생방송 시청▶ 뉴스스탠드 구독▶ 대한민국 뉴스의 시작, 연합뉴스TV 앱 다운받기"
126,2017-05-27,"""쿠슈너, 러시아 대사 만나 비밀 대화 채널 구축 제안""",https://news.naver.com/main/read.nhn?mode=LSD&mid=shm&sid1=104&oid=421&aid=0002754940,뉴스1,"도널드 트럼프 대통령 맏사위인 재러드 쿠슈너 백악관 선임고문© AFP=뉴스1지난해 12월 트럼프타워서 키슬략 대사와 회동(서울=뉴스1) 윤지원 기자 = 특별검사 수사가 결정된 '러시아 내통 스캔들'이 확산하고 있다. 최근 수사 선상에 오른 도널드 트럼프 대통령 사위 재러드 쿠슈너 백악관 선임고문이 주미국 러시아 대사와 만나 양자간 비밀 대화 채널을 구축하려 했다는 증언이 나왔다.26일(현지시간) 워싱턴포스트(WP)는 미국 정보국 관료를 인용해 지난해 12월 초 뉴욕 소재 트럼프타워에서 세르게이 키슬략 주미 러시아 대사와 쿠슈너가 만났으며, 여기서 쿠슈너가 트럼프 인수위와 러시아 정부간 비밀 대화 채널을 구축하자는 제안을 했다는 사실을 보도했다.쿠슈너는 미국내에 있는 대(對)러시아 외교 관련 시설을 미-러 비밀 대화를 위한 장소로 사용하자고 제안했고 이 같은 대화 내용은 키슬라크를 통해 러시아 정부측에 전달됐다.쿠슈너-키슬략 회동에는 지난 2월 러시아 내통 의혹으로 경질된 마이클 플린 전 백악관 국가안보회의(NSC) 보좌관도 동석했다.쿠슈너와 키슬략 대사 만남은 이미 지난 3월 알려진 사실. 당시 백악관은 ""크게 중요하지 않은 만남""이었다고 했지만 미 연방수사국(FBI)은 최근 쿠슈너를 '러시아 스캔들' 수사 대상으로 지목하고 여기에 수사를 집중하고 있는 것으로 알려졌다.쿠슈너는 러시아 국영 브네시코놈뱅크(VEB) 세르게이 고르코프 은행장과도 만난 것으로 확인됐다.yjw@▶ 놓치면 후회! 최신 만화 보기/2017년 나의 운세 보기▶ 여러분의 제보를 기다립니다. 제보하기(클릭!)[© 뉴스1코리아(news1.kr), 무단 전재 및 재배포 금지]"
