,날짜,기사 제목,기사 링크,기사 출처,기사 내용
0,2017-05-27,"""쫓기듯이 일해""…구의역 사고 1년, 여전히 살인적 격무",https://news.naver.com/main/read.nhn?mode=LSD&mid=shm&sid1=102&oid=055&aid=0000534309,SBS,"<앵커>서울 구의역 9-4번 승강장 앞에 놓인 국화와 추모시입니다. 꼭 1년 전에 혼자서 스크린도어를 수리하다 전동차에 치여 숨진 10대 용역 직원을 추모하기 위한 거죠, 당시에 비정규직 처우를 개선해야 한다는 목소리가 높았는데, 사정은 나아졌을까요?이호건 기자가 짚어봤습니다.<기자>지난해 5월 28일, 박봉에 시달리며 끼니도 거르고 혼자 근무하다 불의의 사고를 당한 19살 김 모군. 이 사고를 계기로 서울시는 스크린도어 정비업무를 용역에서 정규직으로 바꾸겠다고 약속했습니다.열차 운행이 끝난 새벽 1시 반. 오세균 씨는 오늘도 지하철 스크린도어 정비를 위해 선로로 내려갑니다. 지하철 운행 전 새벽 4시 반까지 6개 역의 정비업무를 마쳐야 합니다.[오세균/'스크린도어 정비' 무기계약직 : 시간 여유가 없다고 해야되나, 아직도 쫓기는 느낌으로 일하고 있습니다. 오랜 시간 잘 못 자더라고요.]1년 전 그 사고 이후, 외주업체에서 서울메트로로 소속은 바뀌었지만, 정규직이 아닌 '무기계약직'입니다.오 씨를 더 힘 빠지게 하는 건 정규직과의 차별입니다. 스크린도어를 정비하는 오 씨는 3조 2교대기 때문에 격일로 밤샘 야근을 하지만 전동차와 선로 등을 정비하는 정규직은 4조 2교대 근무로, 야근 횟수가 적습니다.월급도 비슷한 연차 정규직보다 50여만 원 적은데, 그 차이는 점점 더 벌어집니다.[윤영태/서울지하철노조 지회장 : '중규직'이라고 표현을 많이 하는 것 같아요. 완전한 정규직을 만드는 게 핵심이라고 봅니다.]오늘(27일) 구의역에선 1년 전 사고의 희생자 김군을 애도하는 추모제가 열렸습니다. 김군이 숨진 승강장 앞에는 국화꽃과 함께 추모시와 편지가 붙었습니다.하지만 김군 같은 정비 계약직에 대한 근본적인 처우 개선은 아직 이뤄지지 않고 있습니다.(영상취재 : 장운석·김명구·이찬수, 영상편집: 하성원)이호건 기자(hogeni@sbs.co.kr)☞ '열정을 깨워라!' SBS U20월드컵 영상 하이라이트※ ⓒ SBS & SBS콘텐츠허브 : 무단복제 및 재배포 금지"
1,2017-05-27,광화문 광장의 '국민마이크'…정책에 반영,https://news.naver.com/main/read.nhn?mode=LSD&mid=shm&sid1=100&oid=056&aid=0010461062,KBS,"<앵커 멘트>새 정부가 서울 광화문 광장에서 시민들의 목소리를 직접 듣기 시작했습니다.시민들의 제안을 정부 정책에  반영하기 위한 절차도 병행해 나갈 계획입니다.보도에 김기현 기자입니다.<리포트>새 정부의 국민참여기구인 국민인수위원회가 광화문 광장에 마이크를 설치했습니다.시민들이 바라는 바를 새 정부가 직접 경청하겠다는 취지입니다.첫 주제는 문재인 정부 탄생의 동력이 됐던 '촛불'로 정해졌습니다.발언에 나선 시민들은 '국민 인수위원'을 자처했습니다.<녹취> 박경범(경북 김천시/첫 발언자) : ""지금부터 새 정부가 사드문제를 결정하기 전까지 어떠한 사드와 관련된 행위도 진행돼서는 안 된다고 생각합니다.""<녹취>  김형남(군 인권센터 활동가) :  ""군사법원은 일반 법원과는 다르게 군인들의 통제를 받습니다. 사실상 행정부에 소속된 군인들, 장군들이 제도적으로 판결에 개입할 수 있기 때문입니다.""국민인수위는 오는 7월 초까지 매주 토요일마다 모두 7차례에 걸쳐 광화문에  국민 마이크를 켜놓겠다고 밝혔습니다.<녹취>  김성예(서울시 종로구) :   ""자기가 억울한 게 있어도 어디 가서 억울하다는 표현도 못 하고... 이것이 너무 안타까웠어요.""시민들의 발언은  녹취록으로 만들어져   국정기획자문위와 각 정부 부처에 전달돼 정책 반영 여부에 대한 검토 작업을 거치게 됩니다.청와대는 새 정부 출범 100일을 맞게 될 8월 중순쯤,  문재인 대통령이 직접  시민들의 제안에 답하는 '국민과의 대화'도 준비하고 있습니다.KBS 뉴스 김기현입니다.김기현기자 (kimkh@kbs.co.kr)▶ [저작권자ⓒ KBS 무단복제-재배포 금지]"
2,2017-05-27,야구 입장권 다 어디로? 암표상 잡는 '시민의 눈',https://news.naver.com/main/read.nhn?mode=LSD&mid=shm&sid1=102&oid=214&aid=0000768503,MBC,"[뉴스데스크]◀ 앵커 ▶야구 경기장을 찾을 때마다 눈살을 찌푸리게 하는 게 바로 암표상이죠.경찰이 시민들의 힘을 빌려 암표상 소탕에 나섰습니다.이문현 기자가 현장 취재했습니다.◀ 리포트 ▶지난 주말, 서울 잠실야구장.암표상이 매표소 주변을 어슬렁거리며, 호객 행위를 합니다.""표 있어요. 표.""표를 받은 사람들은 바로 옆 현금인출기에서 돈을 뽑아 건넵니다.또 다른 암표상, 줄이 길게 늘어선 매표소 앞에서 버젓이 입장권을 팝니다.흥정 장면을 지켜보던 경찰이 단속에 나서자 당장 오리발을 내밉니다.""원가에 파는 거예요. 2만 4천 원.""입장권을 대량으로 확보해 2~3배로 되파는 암표상들이 기승이다 보니 입장권 구하기는 하늘의 별따기입니다.[김수연/야구 관람객]""땡 하자마자 저희가 클릭을 하는데. 평소처럼 창구가 잘 열리지 않아요.""[남원준/야구 관람객]""오픈되자마자 접속을 해서 들어가도 이미 좋은 자리는 예매가 됐고. 어려움이 많더라고요.""아무리 단속을 해도 암표 판매가 근절되지 않자 경찰이 시민의 힘을 빌리기로 했습니다.이곳에 설치된 신고센터에 시민들이 직접 제보를 하면 순찰하던 사복경찰이 곧바로 단속에 나섭니다.시민 참여를 높이기 위해 제보자에게 무료입장권을 제공합니다.[정준석/서울 송파경찰서 생활안전과]""시민 여러분 한 사람 한 사람이 경찰관이라고 생각합니다. 그러다 보니 암표상들도 줄어들고, 자체 단속도 더 효율적으로 이뤄지게 됐습니다.""경찰은 지난 한 달 동안 시민제보로 잠실야구장에서만 6명의 암표상을 적발해 즉결심판에 넘겼습니다.MBC뉴스 이문현입니다.이문현기자[저작권자(c) MBC (www.imnews.com) 무단복제-재배포 금지]Copyright(c) Since 1996,MBC&iMBCAll rights reserved."
3,2017-05-27,광화문에 등장한 마이크…새 정부에 바라는 점 말하세요,https://news.naver.com/main/read.nhn?mode=LSD&mid=shm&sid1=100&oid=055&aid=0000534311,SBS,"<앵커>촛불이 모여들었던 광화문 광장에 오늘(27일)은 마이크가 한대 생겼습니다. 이 마아크에 대고 새 정부에 바라는 점 얘기할 수 있습니다.정유미 기자가 취재했습니다.<기자>대통령 탄핵을 이끌었던 촛불집회의 중심, 그 광화문에서 오늘은 시민들이 마이크를 들었습니다. 새 정부에 바라는 점을 직접 얘기할 수 있는 '국민 마이크' 입니다.첫 번째 주제는 '촛불이 말합니다', '촛불 혁명'으로 탄생한 정부인 만큼 촛불 민심을 경청하고 국정운영에 적극 반영하겠다는 의지가 담겨 있습니다.[박경범/경북 김천 주민 (첫 번째 참가자) : 지금부터 새 정부가 사드 문제를 결정하기 전까지 어떠한 사드와 관련된 행위도 진행되어선 안된다고 생각합니다.]행사는 다음 달 말까지 매주 토요일마다 열리고, 현장의 목소리는 국정기획자문위 내부 국민참여기구인 국민인수위원회에 전달됩니다.청와대 분수대 광장에서는 군악 의장대 행사가 열렸습니다. 지난해 국정농단 사건으로 중단됐다가 7달 만에 재개된 겁니다. 경쾌한 음악과 군인들의 퍼레이드, 눈을 떼기 힘든 무예 시범까지, 볼거리가 이어졌습니다.[이명권/관람객 : 교육적인 면에서 아주 훌륭한 프로그램이고 나중에 우리 아이들도 한번 해봤으면 좋겠고요.]청와대는 상반기 행사가 다음 달 3일과 10일 두 차례 더 열린다고 밝혔습니다.(영상취재 : 김흥기·서진호, 영상편집 : 박정삼)정유미 기자(yum4u@sbs.co.kr)☞ '열정을 깨워라!' SBS U20월드컵 영상 하이라이트※ ⓒ SBS & SBS콘텐츠허브 : 무단복제 및 재배포 금지"
4,2017-05-27,"美, '北 ICBM 요격' 첫 훈련…트럼프 ""북핵 해결될 것""",https://news.naver.com/main/read.nhn?mode=LSD&mid=shm&sid1=100&oid=214&aid=0000768499,MBC,"[뉴스데스크]◀ 앵커 ▶미국이 다음 주 미사일 요격 훈련을 실시합니다.태평양 상공을 날아가는 미사일을 실제로 격추하는 건데, 북한의 대륙간탄도탄 발사를 가정한 훈련입니다.워싱턴 박승진 특파원입니다.◀ 리포트 ▶미 서부 반덴버그 공군기지 지하에서 탄도미사일 요격 미사일이 솟구칩니다.미군은 이 방어시스템으로 오는 30일 대륙간 탄도미사일 격추 훈련을 벌인다고 밝혔습니다.태평양의 한 지점에서 미국 본토를 향해 탄도미사일이 발사되면, 밴던버그 공군기지에서 요격미사일을 발사해 태평양 상공에서 격추하는 훈련입니다.북한이 ICBM으로 미국 본토를 공격하는 상황을 가정한 것입니다.이번 시험에는 ICBM 모형 대신 기존 미사일에 속도를 더 높인 맞춤형 미사일이 사용됩니다.[빈센트 스튜어트/美 국방정보국장 (23일 청문회)]""현재 궤도라면 북한은 미국 본토를 위협할 핵 미사일 배치에 결국 성공할 것입니다.""미군은 미사일 요격 시험을 17번 실시해 9번 성공했으며, ICBM급 미사일 요격 시험은 이번이 처음입니다.G7 정상회의에 참석한 도널드 트럼프 대통령은 아베 신조 일본 총리를 만나 북핵문제는 해결될 것이라며 내기를 걸어도 좋다고 자신했습니다.[도널드 트럼프/미국 대통령]""북한은 국제적으로 큰 문제입니다. 그래도 적절한 시점에 해결될 겁니다. 내기해도 좋습니다.""두 정상은 북한 도발을 지원하는 세력들을 찾아내 제재하는 등 북한 제재를 확대하는데 합의했다고 백악관이 밝혔습니다.워싱턴에서 MBC뉴스 박승진입니다.박승진기자 (sjpark@imbc.com)[저작권자(c) MBC (www.imnews.com) 무단복제-재배포 금지]Copyright(c) Since 1996,MBC&iMBCAll rights reserved."
5,2017-05-27,"구의역 청년노동자 죽음 1년…시민들 ""이젠 달라질 때""",https://news.naver.com/main/read.nhn?mode=LSD&mid=shm&sid1=102&oid=437&aid=0000155118,JTBC,"[앵커]'컵라면, 숟가락, 그리고 공구… .'  지하철 2호선 구의역에서 승강장 안전문을 수리하다 숨진 19살 김군의 유류품 기억하시지요. 끼니도 못 챙기고 하루종일 일에만 매달렸던 김군이 매달 손에 쥐는 돈은 140만 원이 채 안됐습니다. 김군이 떠난지 꼭 1년이 됐습니다. 하지만 지금도 위험의 외주화 비정규직화는 여전히 달라진 게 없습니다. 오늘(27일) 구의역에 시민들이 다시 모였습니다. 이제는 달라져야 한다 목소리를 높였습니다.채승기 기자가 취재했습니다.[기자][김 군 어머니 (지난해 5월) : 왜 거기에 사발면이 들어 있어요. 하루 종일 끼니를 굶어가며 일했다고 솔직히 얘기했다면 정말 저희는 당장 그만두라고 했을 겁니다.]구의역 희생자 김 군은 그렇게 시간에 쫓기며 일하다 숨졌습니다.1년이 지났지만 또 다른 김 군은 한둘이 아닙니다.대기업 협력업체의 해외 공장에서 일했던 임혁진 군은 당시 김 군 가방에서 나온 컵라면을 보고 울컥했다고 합니다.[임혁진 : 컵라면 있는 거 보고서 나도 이렇게 밥을 라면으로 먹고 했는데…얘도 나랑 같이 이랬구나…]수당도 제대로 못 받는 야근을 밥 먹듯 했던 임 군이 그린 공장의 그림 속에서는 시계 바늘이 새벽 2시를 가리키고 있습니다.[임혁진 : 일이 많을 때는 새벽 2시 넘어서까지 일하고…거의 30시간 정도 일을 해봤어요. 하루에 거의 30시간?]새로운 일을 찾고 있지만 임 군이 선택할 수 있는 일들은 많지 않습니다.[임혁진 : 8시간은 너무 꿈인 거 같고, 하루 12시간 이상은 일을 안 했으면 좋겠어요.]공업고등학교에서 용접을 배운 전모 군은 현장 실습을 나간 공장에서 무거운 부품만 날라야 했습니다.[전모 군 : 용접 시켜달라는 이야기를 했는데…자기가 회사에서 제일 독하다고 하면서 웃으면서 사람 자른다고…]매일 같이 이어지는 해고 협박에 입을 다물었지만 몸과 마음만 다친 뒤 퇴사해야 했습니다.고강도, 저임금 노동을 참아 내면서 같은 직장에 계속 다니는 것도 쉽지 않습니다.중증 환자의 재활 치료를 돕는 작업치료사들은 스스로를 '난민'이라 부릅니다.[천은혜/작업 치료사 : 소모품이라고 이야기하는 것만큼이나 퇴사를 권유하는 분위기들이…][박선향/물리 치료사 : 대학교에서 이미 쏟아져 나온 신입들이 있는데 얘네는 돈을 싸게 주고 일을 고용하면 되잖아요.]'갑'의 위치에 있는 병원 측이 꺼리기 때문에 환자를 돌보다 몸이 망가져도 산재 신청조차 쉽게 하지 못합니다.50일 동안 이틀 쉬는 등 열악한 노동 환경을 못 견디다 지난해 10월 이한빛 PD가 스스로 목숨을 끊기도 했습니다.이PD 역시 구의역 희생자 김군을 안타까워 했다고 합니다.[이용관/고 이한빛 PD 아버지 : 비정규직 문제라든가, 노동착취의 문제라든가 안타까워하면서 굉장히 마음 아파했죠.]이씨의 부친은 이제 청년 노동 문제 고발에 앞장서고 있습니다.[이용관/고 이한빛 PD 아버지 : 사회적으로 공론화해서 또 다른 이한빛, 제2의 이한빛 이런 희생들이 없어야 되겠다는 생각으로…]이씨와 같은 마음으로 오늘 구의역에 다시 시민들이 모였습니다.시민들은 김 군을 추모하며 청년 노동 문제가 해결될 때까지 서로의 곁에서 힘을 나누겠다고 약속했습니다.채승기▶ JTBC 뉴스 공식 SNS[트위터][페이스북][유튜브]Copyright by JTBC(http://jtbc.joins.com)and JTBC Content Hub Co., Ltd. All Rights Reserved. 무단 전재 및 재배포 금지"
6,2017-05-27,3천명이 짜낸 미세먼지 해법은 '사대문 내 노후차량 제한',https://news.naver.com/main/read.nhn?mode=LSD&mid=shm&sid1=102&oid=001&aid=0009296103,연합뉴스,"광화문광장서 대규모 야외 토론회…'식물 열기구 띄우자' 어린이 의견도사대문 안 차량 제한 79.3% 찬성…봄 화력발전소 일시 가동 중단 88.9% 찬성(서울=연합뉴스) 이태수 기자 = 날로 심각해지는 미세먼지 문제를 해결하고자 서울시민이 짜낸 혜안은 '사대문 내 노후 차량 진입 제한'이었다.토요일인 27일 오후 서울 도심 광화문광장에서 3천 명에 달하는 시민이 2시간에 걸쳐 토론한 뒤 투표한 결과 참가자 79.3%가 이에 찬성한 것이다.이날 행사는 서울시가 야심 차게 마련한 '미세먼지 대토론회'다. 야외에서 이 정도 인파가 한꺼번에 머리를 맞댄 것은 국내에서는 최초다.광화문광장에는 일찌감치 검은 천을 덮은 테이블 250여 개가 늘어섰고, 자리마다 파란 선캡을 쓴 시민이 빼곡히 앉았다.오후 5시부터 원탁별로 진행된 토론에서는 '미세먼지 문제에 대한 진단과 해결방안'과 '도심 내 미세먼지 배출원에 대한 대응방안'을 주제로 의견을 나눴다.주요 의제로는 ▲ 차량 제한 ▲ 도심 미세먼지 배출시설 점검 ▲ 석탄화력발전소 중단 ▲ 국가 간 다각적 기후 대화 채널 확보 등이 올라왔다.3천 명의 시민이 쏟아내는 의견이 카테고리에 따라 실시간으로 집계되는 가운데, '차량 운행 제한과 친환경 이동수단 이용률 높이기'가 30%를 웃돌 정도로 가장 많이 언급됐다.시민이 가장 주목한 미세먼지 해법이 바로 도심 차량 운행 줄이기라는 뜻으로 해석할 수 있다.'광장, 정치에서 정책으로'(서울=연합뉴스) 김도훈 기자 = 27일 오후 서울 광화문광장에서 열린 '서울시민 미세먼지 대토론회'에서 참석자들이 의견을 나누고 있다.서울시가 마련한 이번 대토론회에는 주부, 어린이, 전문가, 환경단체 활동가 등 다양한 시민 3천여명이 모여 미세먼지 정책 우선순위와 구체적 대안을 놓고 의견을 나눴다. 2017.5.27superdoo82@yna.co.kr한 시민은 ""서울 시내에서 미세먼지를 낮추려면 교통량 문제를 해결해야 한다. 자동차가 다니기 불편한 도시가 돼야 한다""며 ""서울 인구는 줄어들고 있는데 등록된 자동차 수는 늘어나고 있지 않느냐""고 목소리를 높였다.다른 시민도 ""서울에서는 지하철을 편리하게 이용할 수 있는 만큼, 각자가 자가용 운전을 줄일 수 있지 않겠느냐""며 ""노후 경유차도 대체해야 한다""고 말했다.행사 말미 주요 의제를 찬반 투표에 부친 결과도 맥락을 같이했다.'도심 사대문 안 공행차량 운행 제한'을 두고 참가자의 47.7%가 '매우 찬성', 31.6%가 '찬성'이라고 답해 찬성이 79.3%에 이르렀다.'미세먼지 고농도 발생 시 차량 2부제 실시'를 두고도 '매우 찬성'과 '찬성'을 합한 비율이 80.1%에 달했고, '봄철 노후 석탄화력발전소 일시적 가동 중단' 역시 찬성이 88.9%로 집계됐다.이 같은 결과는 시가 이미 시가 이미 한양도성 내부 16.7㎢를 '녹색교통진흥지역'으로 지정하고 비슷한 내용의 정책을 저울질하고 있다는 점에서 귀추가 주목된다.심각한 문제로 떠오른 미세먼지 문제를 해결하고자 노후 경유차나 관광버스 외에도 일반 승용차까지 한양도성 내 진·출입을 관리하고, 필요하면 통행을 제한한다는 것이다.이날 박원순 서울시장도 무대 앞쪽 테이블에 앉아 참가자들의 이야기에 귀를 기울였다.박 시장은 ""시민이 힙을 합쳐 과제를 해결해야 한다. 그 가운데 하나가 대기 질 문제, 맑은 공기를 가지는 문제가 아닌가 한다""며 ""여러분의 열정을 목격하면서 이제 광장의 민주주의가 또 다른 형태로 진행되고 있다는 확신을 가지게 됐다. 그야말로 광장의 민주주의는 계속된다""고 말했다.조희연 서울시교육감도 참석해 ""서울에서 생태 공간이 될 수 있는 마지막 공간이 학교""라며 ""서울 시내 1천300개 학교 모두가 옥상에 생태 정원을 꾸미면 대단한 효과가 있을 것""이라고 말했다.토론에는 관련 학회·시민단체·자치구·교육청 등에서 온 각양각색의 시민이 참여했다. 어린 자녀의 손을 잡고 자리를 잡은 부모도 곳곳에서 눈에 띄었다.서울 강서구에서 13살 난 아들과 함께 온 최양희(41·여)씨는 ""아이들은 밖에서 뛰어놀아야 하는데 요즘은 봄에 아이들이 미세먼지 때문에 나갈 수가 없다""며 ""아이가 아토피를 앓고 있기도 해서 국가나 시 차원에서 관련 대책이 꼭 필요하다고 생각했다. 이 문제에 대해 의견을 밝히고 다른 이들이 어떻게 생각하는지 듣고 싶어서 나왔다""고 말했다.'광장, 이제 환경을 논하다'(서울=연합뉴스) 김도훈 기자 = 27일 오후 서울 광화문광장에서 열린 '서울시민 미세먼지 대토론회'에서 참석자들이 의견을 나누고 있다.서울시가 마련한 이번 대토론회에는 주부, 어린이, 전문가, 환경단체 활동가 등 다양한 시민 3천여명이 모여 미세먼지 정책 우선순위와 구체적 대안을 놓고 의견을 나눴다. 2017.5.27superdoo82@yna.co.kr한 어린이 참가자는 ""미세먼지가 심한 날은 서해안에 공기 정화 식물을 심은 열기구를 띄우자""며 통통 튀는 의견을 내놔 박수갈채를 받았다.어린이집을 운영하는 박명하 씨는 ""미세먼지 필터 창을 달았는데도 실내 공기 질이 똑같이 나쁘더라""며 ""주변국과의 외교적 고려를 하는 큰 그림의 정책이 필요하다""고 호소했다.시는 사전에 안전을 위해 세종로 세종문화회관 방향 교통을 전면 차단했고, '미세먼지를 마시며 미세먼지를 토론하는' 일이 없도록 마스크를 참가자들에게 나눠줬다.참가자들의 의견을 실시간으로 따져보고 정리하는 '팩트체크팀'과 '분석팀' 50여 명도 투입됐다. 이들은 시민 의견을 재빠르게 정리해 스크린에 띄워, 참가자들이 다시 이를 보고 이야기를 이어나갈 수 있게 도왔다.한편, 시가 토론회를 앞두고 10∼25일 사전 신청자 1천59명을 대상으로 시민 아이디어를 모집한 결과, 1천272건의 아이디어가 쏟아져 나왔다.분야별로 살펴보면 교통 분야가 268건으로 가장 많았고, 시민 건강 179건·제도 개선 175건·소통 홍보 124건·산업 108건·외교 100건·생활 환경 84건 등으로 각각 집계됐다.시는 '미세먼지 대토론회 추진 태스크포스(TF)'를 꾸리고 이 가운데 제안 빈도, 추진 가능성 등을 따져 우수 아이디어 100가지를 선정했다.여기에는 ▲ 차량 부제·사대문 안 차량 진입 금지·통학버스 경유 차종 제한 등 교통 분야 ▲ 취약계층 마스크 지원·녹지 대폭 확충·공공장소 황사용 마스크 비치 등 시민 건강 분야 ▲ 중국과 한국 기업이 미세먼지 감축 공동 개발·충남과 수도권 공동대응 모색 등 외부협력 분야 ▲ '쿨 루프' 시공 확대 등 산업 분야 등이 포함됐다.시민과 시장이 함께서울=연합뉴스) 김도훈 기자 = 27일 오후 서울 광화문광장에서 열린 '서울시민 미세먼지 대토론회'에서 참석자와 박원순 시장이 함께 의견을 나누고 있다.서울시가 마련한 이번 대토론회에는 주부, 어린이, 전문가, 환경단체 활동가 등 다양한 시민 3천여명이 모여 미세먼지 정책 우선순위와 구체적 대안을 놓고 의견을 나눴다. 2017.5.27superdoo82@yna.co.krtsl@yna.co.kr최신 유행 트렌드 총집결 #흥(클릭!)"
