,날짜,기사 제목,기사 링크,기사 출처,기사 내용
128,2015-05-18,"일본, NPT회의·세계유산등재에 외교력 집중…'과거사 덧칠'",https://news.naver.com/main/read.nhn?mode=LSD&mid=shm&sid1=104&oid=001&aid=0007600688,연합뉴스,"기시다 후미오 일본 외무상이 2015년 4월 27일 미국 뉴욕 유엔본부에서 열린 NPT 평가회의에서 연설하고 있다. (AP=연합뉴스 자료사진)(도쿄=연합뉴스) 이세원 특파원 = 일본 정부가 역사인식 논쟁의 연장선 위에 놓인 핵확산금지조약(NPT) 평가회의와 유네스코 세계문화유산 등재에 외교력을 집중하고 있다.18일 니혼게이자이(日本經濟)신문(닛케이)에 따르면 일본 정부는 전날 스기야마 신스케(杉山晋輔) 일본 외무성 심의관을 NPT 평가회의가 열리는 미국 뉴욕으로 파견했다.NPT 평가회의에 외무성 심의관을 보내는 것은 이례적인 일이며 이는 세계 각국의 지도자가 원폭 투하지인 히로시마(廣島)시와 나가사키(長崎)를 방문하도록 하자는 제언을 NPT 평가회의 최종 문서에 싣도록 설득하기 위한 것으로 보인다.기시다 후미오(岸田文雄) 일본 외무상은 이에 관해 ""현지 교섭 체제를 강화해야 한다""며 ""우리나라의 제안이 최종 문서에 반영되도록 외교적 노력을 계속할 생각""이라고 15일 회견에서 언급했다.히로시마·나가사키 방문은 NPT 재평가 회의 첫날 연설에서 기시다 외무상이 제안한 것으로 최종문서 검토 본에 실렸다가 나중에 삭제됐다.푸충(傅聰) 중국 군축대사가 일본 정부가 자국을 제2차대전의 가해국이 아니라 피해국으로서 부각하기 위해 이런 제안을 한 것이라고 공개적으로 반대하면서 이번 사안이 과거사 논쟁으로 번지고 있다.닛케이는 기시다 외무상이 '중국이 반대한다고 이대로 물러서면 앞으로 아무것도 할 수 없다'는 취지로 주변에 얘기하며 정면 돌파를 추진하고 있지만, 만장일치가 원칙이라서 삭제된 문안을 다시 집어넣기는 쉽지 않아 보인다고 전망했다.일본 정부는 조선인 노동자가 강제 노동에 시달린 탄광을 포함해 일본 내 23개 산업 시설의 유네스코 세계문화등록을 확실하게 하려고 결정권을 지닌 유네스코 세계유산위원회 위원국을 상대로 한 로비도 강화하고 있다.미쓰비시 해저 탄광이 있던 하시마(端島, 일명 '군함도') (교도=연합뉴스 자료사진)이달 8일 이후 내각부, 외무성, 문부과학성 등이 정무관과 부대신 6명을 10개국에 파견했으며 17일에는 나카야마 야스히데(中山泰秀) 일본 외무 부(副)대신이 위원회의 부의장국인 자메이카로 출발했다.앞서 일본 정부 대변인인 스가 요시히데(菅義偉) 관방장관은 세계유산 등록 추진에 대한 한국의 비판이 정치적이라고 주장했다.한국 정부는 '강제 노동이 자행됐다는 역사적 사실을 외면한 채 산업혁명 시설로만 미화해 세계 유산으로 등재한다는 것에 반대한다'는 원칙에 따라 등재 여부보다는 한국의 견해를 반영할 수 있는 방안을 마련하는데 외교력을 집중하고 있다.하시마(端島, 일명 '군함도') 탄광 등 이번에 세계 유산 등재가 유력시되는 시설 중 7곳에서는 일제 강점기에 한반도 출신 노동자 수만 명 외에 중국인 노동자도 강제 노동을 한 것으로 알려졌으며 최근 화춘잉(華春瑩) 중국 외교부 대변인도 유산 등록에 반대 의견을 표명했다.아베 신조(安倍晋三) 일본 총리는 최근 미국 상·하원 합동 연설에서 식민지배와 침략에 관해 사죄하지 않고 모호한 형태로 후회를 언급하는 등 일본 정부는 과거 제국주의 시대에 저지른 비인도적 행위와 침탈에 덧칠하려는 움직임을 보이고 있다.NPT 평가회의 문서와 세계유산 등록 문제 역시 같은 맥락의 행위로 간주되는 분위기이며 한국·중국 등과 일본의 역사 논쟁이 다시 달아오르고 있다.sewonlee@yna.co.kr▶ [현장영상] 고속도로를 즐겨 찾는 낙타▶ [오늘의 핫 화보]  '무뢰한' 전도연, 칸 4번째 초청서 매력과시<저작권자(c) 연합뉴스, 무단 전재-재배포 금지>"
129,2015-05-18,"北, 남측 개성공단 공동위원회 개최..",https://news.naver.com/main/read.nhn?mode=LSD&mid=shm&sid1=100&oid=421&aid=0001421609,뉴스1,"임병철 통일부 대변인 2015.5.13/뉴스1 © News1 양동욱 기자특별한 설명 없이 우리 측 통지문 수령도 안해(서울=뉴스1) 서재준 기자 = 북한이 개성공단 임금인상 문제를 당국 차원에서 공식적으로 논의하자는 우리 측 제안을 거부했다고 18일 통일부가 밝혔다.임병철 통일부 대변인은 이날 정례 브리핑에서 ""지난 15일 공동위원회 사무처를 통해 20일 회의 개최를 요청했다""며 ""북측은 우리 측의 통지문 수령 자체를 거부했다""고 말했다.개성공단 공동위원회는 지난 2013년 개성공단 가동중단 사태를 계기로 남북의 합의로 탄생한 당국 차원의 공동운영 기구다.정부는 궁극적으로 이번 개성공단 사태가 북측의 일방적인 노동규정 개정에 따른 것으로 당국 차원의 논의가 필요하다는 입장에 따라 이번 공동위 회의를 제의했다.임 대변인은 ""북측이 통지문 수령을 거부하며 별다른 특별한 이유를 표명하진 않았다""며 ""정부는 조속히 공동위가 개최돼 개성공단의 안정적 운영을 위한 관심사안을 협의해야 한다는 입장""이라고 말했다.seojiba@[© 뉴스1코리아(news1.kr), 무단 전재 및 재배포 금지]"
130,2015-05-18,"""뉴스테이, 전세난 분산될 것"" vs ""고소득층 위한 것""",https://news.naver.com/main/read.nhn?mode=LSD&mid=shm&sid1=101&oid=079&aid=0002710735,노컷뉴스,"김재정 (국토부 주택정책관 국장)- 뉴스테이는 중산층 대책, 서민 주거대책은 따로 있어- 중산층 월세 전환하면서 전세 수요 분산되면 전세난 해소 기여- 민간건설사 임대료 수입 크지 않아, 특혜 아니다최승섭 (경실련 부동산 국책사업감시팀 부장)- 서민도 중산층도 아닌, 고소득층 위한 고급 월세일 뿐- 민간건설사 통해 경기부양 실적 올리려는 정책- 서민 안정 대책 따로 있다? 서민 주거대책 턱없이 부족■ 방송 : CBS 라디오 <박재홍의 뉴스쇼> FM 98.1 (07:30~09:00)■ 진행 : 박재홍 앵커■ 대담 : 김재정 (국토부 주택정책관 국장), 최승섭 (경실련 부동산 국책사업감시팀 부장)정부가 전월세 시장 안정을 위해서 기업형 임대주택 사업인 이른바 뉴스테이 정책을 내놨습니다. 많은 분들이 관심 있게 보고 계실 텐데. 하지만 월세가 서민이 감당할 수준을 넘어서서, 뉴스테이 정책이 과연 누구를 위한 것이냐를 놓고 논란이 일고 있습니다. 오늘 이를 두고 양쪽 입장을 짚어봅니다. 먼저 국토교통부의 주택정책관인 김재정 국장을 연결합니다. 국장님, 안녕하세요.◆ 김재정> 안녕하십니까?◇ 박재홍> 정부가 서울, 인천, 수원 등지에 모두 5500여 가구의 기업형 임대주택을 공급한다고 발표했습니다. 이번 정책을 통해 기대하는 효과는요?◆ 김재정> 이번 뉴스테이 정책은 중산층 주거 안정에 초점을 맞추고 있습니다. 그동안 중산층들이 민간임대 시장에서 주거 불안과 주거 불편 문제가 많았었는데요. 이러한 문제를 상당 해소할 수 있는 새로운 계기가 될 것으로 기대를 하고 있습니다. 뉴스테이 임대주택은 특징이 8년간 안정적으로 거주할 수 있고, 임대료 인상도 연간 5%로 제한됐기 때문에, 잦은 이사라든지 임대보증금을 한꺼번에 많이 올려달라고 하는 그런 불편으로부터 자유로울 수 있고요. 임대주택의 품질도 기존하고 달리 분양주택과 유사한 수준이고, 또 육아라든지 청소, 세탁과 같은 기존에 없었던 주거 서비스도 제공받을 수 있는 장점이 있습니다.◇ 박재홍> 그렇군요. 구체적으로 보증금이나 임대료를 얼마 정도를 예상하십니까?◆ 김재정> 그건 지역이라든지 평수에 따라 달라지게 되는데, 40만원에서 100만원 안팎이 될 것 같습니다.◇ 박재홍> 40만원에서 100만원. 그러면 이게 현 시세보다 어떤 건가요?◆ 김재정> 현 시세와 유사하든지 다소 싼 것으로 분석이 되고 있습니다.◇ 박재홍> 그러면 현 시세보다 유사하거나 다소 싸면, 많이 싸지는 않다는 얘기 아닌가요?◆ 김재정> 그렇습니다. 왜냐하면 이건 서민을 위한 주택이 아니고 중산층을 위한 주택이기 때문에, 뉴스테이 주택이 새로운 집이고 또 2년 내지, 3년 안에 입주한다는 그런 측면을 봤을 때, 기존에 임대료보다 어느 정도는 싸다고 할 수 있습니다.◇ 박재홍> 하지만 이게, 정책 대상이 전월세난의 피해당사자인 서민이 아니라 고가의 월세부담이 가능한 중산층을 대상으로 했다, 지금 국장님도 중산층 대상으로 한다고 말씀을 하셨습니다마는, 그래서 정책의 대상 혹은 전제가 잘못됐다, 이런 비판도 있는데요.◆ 김재정> 서민을 위한 주거안정정책은 정부의 최종 과제입니다. 그래서 그러한 것들은 뉴스테이 정책과 관련 없이 별도로 추진해 나가는데요. 예를 들어서 금년에 서민을 위한 공공임대주택 인출 물량이 사상 초유인 12만호가 되고요. 그 다음에 금년 7월부터는 저소득층을 위해서 주거급여가 실시가 되는데, 97만 저소득 가구에 대해서 월 평균 12만원의 주거급여가 지급이 됩니다.◇ 박재홍> 그런데 이제 민간사업자들 입장에서는 8년간 임대료 수익을 챙길 수 있는 거 아닙니까? 분양 전환을 하면 목돈까지 챙길 수 있다, 그래서 민간 기업들에게 너무 특혜를 주는 것 아니냐 이런 얘기도 있습니다.◆ 김재정> 그런데 임대료 수입 자체가 그렇게 충분하지는 않습니다. 저희가 임대사업을 하기 위해서는 투자비 대비 5~6%의 수익이 있어야 되는데. 저희가 여러 가지 혜택을 준다고 하더라도 임대 기간 동안의 수익률은 그렇게 높지 않을 걸로 예상이 됩니다. 그래서 나중에 결국은 분양을 해서 수익을 어느 정도 보전해야 되기 때문에, 민간임대사업자가 우리 사회자님이 말씀하신 대로 분양수익을 많이 얻고 임대 수익도 얻고 그런 게 아니라, 임대해서 어느 정도 비용이 많이 발생하는 건 분양수익을 통해서 일부 회수한다는 그런 측면으로 보면 될 것 같습니다.◇ 박재홍> 하지만 정부에서는 공적자금인 국민주택기금을 투자하기로 했지 않습니까? 또 세입자들에게는 임대료, 분양가 부담을 안기고 있다, 이런 비판이 있고 그래서 결국은 본질적으로 전월세난을 위한 대책이 아니라 건설경기부양정책이다, 이런 지적도 있는데요. 반론하신다면?◆ 김재정> 국민주택기금에서 뉴스테이 임대주택을 지원하는데요. 주택기금의 주요 재원이 청약종합저축과 주택채권입니다. 그러면 여기에서는 서민층도 기여를 하지만 오히려 중산층이 많은 기여를 하고 있습니다. 그래서 이런 재원을 서민층을 위해서 쓰는 걸 원칙으로 하고 있고. 다만 재원에 약간 여유가 있기 때문에 여유자금을 중산층 주거안정을 위해서 일부 지원하는 것은 이 기금의 설립 목적에도 부합한다고 할 수 있습니다.◇ 박재홍> 하지만 무엇보다 전세난 등을 우선 해결해야 하고 서민들의 주거안정에 집중해야 하는 시기인데, 정부가 중산층 대상으로 임대주택 공급정책을 펼치고 있는 것이 잘못된 것이다, 장기적으로 전월세 안정에 도움이 될 것이냐 이런 시각도 있습니다.◆ 김재정> 현재 전세가격이 올라가는 것은 구조적인 측면이 큽니다. 집에 대한 인식이 소유에서 거주로 변하고 있고, 그 다음에 저금리 상태가 계속되고 있고, 또 집값 상승 기대감도 상당히 낮기 때문에, 임대차 시장이 전세나 월세로 지금 빠르게 전환을 하고 있습니다. 다만 이제 저희가 이러한 뉴스테이 임대 주택, 양질의 임대주택을 공급을 활발히 하게 될 경우에는 상대적으로 자금 여유가 있는 전세 거주자가 기존의 전세에서 이런 뉴스테이 임대주택으로 이동할 것으로 기대가 되고, 이렇게 되면 전세 압력이 분산되어서 중장기적으로는 전월세 시장 안정에 많은 도움이 될 것으로 기대를 하고 있습니다.◇ 박재홍> 그렇군요. 말씀 고맙습니다.◆ 김재정> 네, 감사합니다.자료사진◇ 박재홍> 국토교통부 주택정책관 김재정 국장이었습니다. 이번에는 이 정책을 비판하는 목소리를 들어보겠습니다. 경실련 부동산 국책사업감시팀의 최승섭 부장입니다. 부장님, 안녕하세요.◆ 최승섭> 안녕하십니까?◇ 박재홍> 정부가 전월세 시장 안정을 위해서 내놓은 기업형 임대주택 사업인 뉴스테이 정책, 문제점은 뭔가요?◆ 최승섭> 우선 정부가 정책적으로 주거안정을 위해서 시행하는 지침이라면 주변 시세에 비슷한 것이 아니라 주변 시세보다 상당 부분 낮아야 한다고 생각합니다. 왜냐하면 지금 전셋값 등 임대료 시세가 서민들이 부담할 수 있는 수준이 아니고요. 연봉 인상으로 전세값 인상을 따라갈 수 없고, 월소득으로는 월세를 내기에도 급급한 상황에서, 정부가 지금 뉴스테이 정책이 주변 시세보다 비싸지 않다, 비슷한 수준이다라고 얘기하는 것 자체가 지금 서민들의 주거 불안이 어떤 상황인지 전혀 고민이 없다, 그런 정책이라고 생각합니다.◇ 박재홍> 그런데 조금 전 말씀을 들어보면 이게 이제 서민들을 위한 것이 아니라 중산층을 위한 것이다, 이렇게 정책 대상을 정하고 있는데요?◆ 최승섭> 그렇다면 과연 이게 중산층에게 적절한 정책인가 그것이 또 그렇지 않습니다. 경실련이 서울과 수도권의 전세가격을 기준으로 뉴스테이 예상 임대료를 비교해 봤는데요. 가구소득 월 500만원 버는 가구의 경우에도 서울의 경우에는 소득대비 임대율 비중이 26%입니다. OECD에서는 20%를 적당한 기준으로 정해놓고 있는데요. 특히나 이분들이 기존에 저축했던 금액과 주거비로 사용할 수 있는 부분을 비교해 보면 서울은 91%, 수도권도 70% 이상이 나오면서, 과연 이분들을 위한 이러한 정책이 가능한 것인지 저는 굉장히 큰 의문이 있고요. 왜냐하면 이게 기업들의 참여를 유도하기 위해서 월세로 공급을 한다는 것인데. 월세의 주거비 부담은 곧 서민분들뿐만이 아니라 중산층분들에게도 전세부담의 2배 이상 높다는 결과가 나와서, 이것은 과연 중산층들을 위한 것보다는 고소득층을 위한 고급 월세가 아닌가 이렇게 생각이 됩니다.◇ 박재홍> 중산층을 위한 것도 아닌 것 같다, 중산층에도 버겁다는 주장이시네요.◆ 최승섭> 그렇습니다.◇ 박재홍> 하지만 뉴스테이의 경우에는 최장 8년, 그리고 서울과 수원 일부 지역은 10년간 거주할 수 있기 때문에 긴 임대기간으로 주거 안정을 노릴 수 있는 그런 효과도 있다. 따라서 그 기간 동안 내 집 마련을 위한 기회를 제공할 수도 있다, 이런 반론도 있습니다마는.◆ 최승섭> 주거 기간이 장기적인 것으로는 상당히 긍정적이라고는 생각을 하는데요. 뉴스테이 같은 경우에는 초기 임대료 제한을 받지 않기 때문에, 아까 말씀드린 것처럼 초기에 고가로 정해질 우려가 높고, 그것이 고가월세가 되면서 한 달에 저축할 수 있는 금액 자체가 줄어들고, 오히려 그 저축할 수 있는 금액 자체를 넘어설 수 있는 위험성이 있기 때문에, 아까 말씀하신 것처럼 소득을 모아서 집을 살 수 있는 디딤돌 역할을 하기에는 굉장히 부족한 정책이다, 그렇게 생각됩니다.◇ 박재홍> 하지만 이제 정부의 얘기를 들어보면, 서민을 위한 정책은 따로 있는 것이고, 이렇게 임대주택을 장기간 8년 동안 제공을 하면 이들이 이제 전세에서 월세로 많이 돌아서면서 전세수요가 분산이 되면서 수요가 줄면 결국 전세가도 낮아지는 효과도 있기 때문에 결국 전세난은 해소될 것이다, 이런 얘기가 정부 입장이 아닌가요?◆ 최승섭> 그렇지만 정부에서 말씀하신 것처럼, 중산층이 빠져나간 자리에 서민들이 들어갈 수 있는 물량이 생긴다는 주장인 것인데. 수요가 분산된다고 해도 그 기존에 있던 (고가의) 전세집에 서민분들이 들어갈 수 있을까 저희는 불가능하다고 보고 있고요. 그렇기 때문에 이것이 오히려 주거의 양극화를 더 심화시키고, 기존에 있던 서민분 주택들도 월세전환이라든가 전셋값 상승 등 부작용을 불러올 것이라고 우려하고 있습니다.◇ 박재홍> 그런데 정부 얘기는 여유자금이 있다고 하는데요. 여유자금이 있어서 서민을 위한 정책을 따로 하면 되고, 중산층을 위한 자금이 있어서 이런 정책을 하고 있다, 이렇게 반론을 하고 있습니다마는.◆ 최승섭> 과연 정부에서 어느 정도의 재원을 서민들을 위해서 풀지는 모르겠는데, 푼다고 하더라도 지금 수혜 대상이 100여만 가구에 불과합니다. 우리나라에서는 적어도 경실련이 주장하는 건 300만 가구 정도는 주택바우처가 지원이 되어야 실질적인 도움이 될 수 있다고 보는 거고요. 금액적으로도 지금 주택바우처 같은 경우에는 10만원 정도가 되고 있는데, 10만원으로는 저희는 주거 안정을 이루기에는 굉장히 적은 수준이라고 보고 있습니다. 정부에서 항상 하는 주장이 ‘우리는 돈이 없어서 못하고, 주택바우처 같은 경우도 예산 문제가 있다’ 항상 그런 주장을 하고 있는데, 이 뉴스테이 정책에 대해서는 다른 돈이 있기 때문에 그 돈으로는 서민으로 지원을 하면 된다고 주장하는 건 기존의 자신들이 해 왔던 한계에 대해서 스스로 부정하고 있다고 보고 있고요. 정부가 뉴스테이 정책을 이렇게 계속 강행하려고 하는 이유는 저희는 오히려 건설사들에게 특혜를 주기 위한 것이 아닌가 그런 우려를 하고 있는 것이거든요.◇ 박재홍> 한마디로 정책우선 순위가 잘못됐다 이런 말씀이시죠. 올바른 주택정책은 아니었다, 이런 비판이세요. 고맙습니다.◆ 최승섭> 감사합니다.◇ 박재홍> 경실련 부동산 국책사업감시팀의 최승섭 부장이었습니다. 전월세 시장 안정을 위해서 정부가 내놓은 기업형 임대주택 사업, 이른바 뉴스테이 정책, 여러분은 어떻게 생각하십니까?[박재홍의 뉴스쇼 프로그램 홈 바로가기]저작권자 © CBS 노컷뉴스(www.nocutnews.co.kr) 무단전재 및 재배포 금지"
131,2015-05-18,'스타킹·스키니진' 여성 다리 촬영한 20대 무죄,https://news.naver.com/main/read.nhn?mode=LSD&mid=shm&sid1=102&oid=421&aid=0001421520,뉴스1,"© News1엘리베이터 안에서 여성 가슴 등 상반신 촬영하다 덜미(서울=뉴스1) 박응진 기자 = 스타킹이나 스키니진을 입은 여성들의 다리를 수십 차례 촬영한 남성이 무죄를 선고받았다.서울북부지법 형사9단독 박재경 판사는 스타킹이나 스키니진을 입은 여성의 다리 등을 촬영한 혐의(성폭력범죄의 처벌 등에 관한 특례법 위반)로 기소된 A씨에게 무죄를 선고했다고 18일 밝혔다.A씨는 2013년 11월19일부터 지난해 5월27일까지 서울 시내 지하철, 길거리 등지에서 49차례에 걸쳐 스타킹이나 스키니진을 입은 여성들의 다리 부분, 가슴 등 상반신을 스마트폰 카메라로 촬영한 혐의로 기소됐다.A씨는 주로 스타킹, 스키니진 등을 입어 비교적 노출정도가 약한 여성들의 다리를 촬영하다가 하루는 엘리베이터 안에서 한 여성의 가슴 등 상반신 부분을 촬영하는 바람에 덜미가 잡혔다.박 판사는 ""피고인이 비록 여성의 동의 없이 주로 다리를 촬영한 사실은 인정되지만 모두 개방된 장소에서 촬영된 것으로 촬영부위도 성적욕망 또는 수치심을 유발할 수 있는 신체에 해당한다고 보기 어렵다""고 판시했다.이어 ""피고인이 운동화, 구두 등 패션스타일에 관심이 많아서 촬영한 것이라는 등 쉽사리 믿기 어려운 변명을 하고 있기는 하나 엘리베이터 안 피해자가 '수치심을 느꼈다'는 주관적 감정만으로는 유죄를 인정하기 어렵다""고 덧붙였다.pej86@[© 뉴스1코리아(news1.kr), 무단 전재 및 재배포 금지]"
132,2015-05-18,"檢, 유디치과 압수수색…'1인 1개소' 위반 혐의",https://news.naver.com/main/read.nhn?mode=LSD&mid=shm&sid1=102&oid=003&aid=0006526406,뉴시스,"【서울=뉴시스】김지훈 기자 = 서울중앙지검 형사2부(부장검사 양요안)는 지난 14일 네트워크 치과 병원 유디치과의 본사와 계열사 등 3~4곳을 압수수색했다고 18일 밝혔다.유디치과는 치과의사 개인이 각자 명의로 병원을 개설하고 하나의 브랜드를 사용하는 형태로 운영되고 있다.검찰은 유디치과가 '의료인은 둘 이상의 의료기관을 개설·운영할 수 없다'고 규정한 의료법 33조 8항을 위반했다는 고발장이 접수됨에 따라 압수수색을 진행, 경영 관련 자료를 확보했다.검찰은 압수물 분석을 마치는 대로 관련자들을 불러 이들의 경영형태가 의료법에 저촉되는지 등을 조사할 계획이다.jikime@newsis.com★ 뉴시스 뉴스, 이젠 네이버 뉴스 스탠드에서도 만나세요★ 손 안에서 보는 세상, 모바일 뉴시스<저작권자ⓒ 공감언론 뉴시스통신사. 무단전재-재배포 금지.>"
133,2015-05-18,"정부, 개성공단 공동위 개최 촉구",https://news.naver.com/main/read.nhn?mode=LSD&mid=shm&sid1=100&oid=277&aid=0003500521,아시아경제,"[아시아경제 김동선 기자]정부는 18일 남북 당국간 개성공단 공동위 개최를 촉구했다.임병철 통일부 대변인은 이날 정례브리핑에서 ""정부는 개성공단 공동위원회가 조속히 개최돼 임금문제를 비롯하여 개성공단의 안정적인 운영과 발전을 위한 쌍방의 관심사안을 협의 해결해 나가야 한다""고 밝혔다.이와 관련 정부는 지난주 공동위 개최를 북측에 제안했으나 북측이 이를 거부한 것으로 알려졌다.임 대변인은 ""정부는 지난 금요일(15일) 개성공단 남북공동위원회 사무처를 통해 오는 20일 공동위원회 제6차 회의개최를 제안했으나 북측이 통지문 접수를 거부해 구두로 전달했다""고 덧붙였다.김동선 기자 matthew@asiae.co.kr▶ 네티즌 수사대의 진화, 궁금증 제로 ""짜장뉴스""▶ 재미있는 동영상이 모두 모였다 ""펀캐스트""<ⓒ세계를 보는 창 경제를 보는 눈, 아시아경제 무단전재 배포금지>"
