,날짜,기사 제목,기사 링크,기사 출처,기사 내용
0,2015-05-18,뭔가에 걸린 듯 전복된 車…사고 유발 '교통섬',https://news.naver.com/main/read.nhn?mode=LSD&mid=shm&sid1=103&oid=055&aid=0000317030,SBS,"<앵커>보행자들이 안전하게 길을 건널 수 있도록 대형교차로에 만든 이런 섬 모양의 시설을 교통섬이라고 합니다. 그런데 일부 교통섬은 주변 교통환경들을 제대로 고려하지 않고 만들어져서 오히려 사고를 유발한다고 합니다. 그래서 만들었다가 철거하는 경우가 잇따르고 이 과정에서 세금이 낭비되고 있습니다.기동취재, 엄민재 기자입니다.<기자>차량 한 대가 빠르게 달리더니, 앞선 차를 추월하자마자 뭔가에 걸린 듯 뒤집혀 버립니다.이 사고로 차에 타고 있던 남성이 숨졌습니다.서울 상암동 사고 현장에 가 보니 왕복 9차선 도로 맨 왼쪽 차선에서 교통섬 개선 공사가 한창입니다.사고 차량은 이 교통섬에 걸려 전복된 겁니다.[공사 관계자 : (왜 공사하고 있는 거예요?) 여기 차선이 넓다 보니까 아마 이쪽에 사고가 많이 나는 모양이에요.]위에서 내려다보니 맨 왼쪽 차로가 다른 차로에 비해 유난히 넓습니다.넓은 차로를 빠르게 달리는 자동차들이 많은데 교통섬 때문에 갑자기 도로 폭이 좁아져 사고가 일어나는 겁니다.[서울시 관계자 : 충돌사고도 있고 그런 걸로 알고 있어서 현장조사를 해보니 너무 넓어서 공사할 때 약간 설계가 잘못된 부분이 있지 않았을까.]서울 구로구에 있는 이 교통섬은 아예 철거될 예정입니다.오르막인데다 급격하게 우회전하는 차로에 교통섬이 설치돼 있어서 운전자가 교통섬으로 가는 보행자를 발견하기 어렵습니다.교통섬의 한 모서리엔 사고의 흔적으로, 이렇게 차도와 맞닿아 있는 돌이 부서지거나 까만 바퀴자국이 그대로 남아 있습니다.사고가 잇따르자 주민들은 아예 교통섬을 없애달라고 서울시에 요청했습니다.[김상옥/삼성교통안전문화연구소 연구원 : 밤이 돼서 조금 더 빨리 달리거나 하면 (교통섬) 왼쪽에 부딪힐 수밖에 없는 그런 환경이 구축돼 있는 거죠.]최근 3년 동안 전국에 교통섬 126곳이 만들어졌는데, 13%가 넘는 17곳이 벌써 철거됐습니다.교통 환경을 제대로 고려하지 않고 만든 일부 교통섬들이 오히려 사고를 유발하고, 만들었다 철거하느라 세금만 낭비하고 있습니다.(영상편집 : 우기정, VJ : 유경하)엄민재 기자 happymj@sbs.co.kr☞네팔 대지진 긴급구호 후원하러 가기☞[SBS기자들의 생생한 취재현장 뒷이야기 '취재파일']☞ SBS뉴스 공식 SNS [SBS 8News 트위터] [페이스북] [카카오스토리]저작권자 SBS&SBS콘텐츠허브 무단복제-재배포 금지"
1,2015-05-18,국내 첫 여성 400회 헌혈 천사 탄생,https://news.naver.com/main/read.nhn?mode=LSD&mid=shm&sid1=102&oid=001&aid=0007602637,연합뉴스,"국내 첫 여성 400회 헌혈 유배형씨    (부산=연합뉴스) 18일 부산혈액원 내 헌혈의 집에서 유배형씨가 우리나라 여성으로는 처음으로 400회 헌혈을 하고 환하게 웃고 있다. 2015.5.18 << 대한적십자사 부산지사 제공 >>   youngkyu@yna.co.kr(부산=연합뉴스) 민영규 기자 = 부산에서 국내 처음으로 400차례 헌혈을 달성한 여성이 탄생했다.대한적십자사 부산지사는 부산혈액원 헌혈봉사회원인 유배형(60·여)씨가 18일 오전 11시 부산혈액원 내 헌혈의 집에서 우리나라 여성으로는 처음으로 400번째 헌혈을 했다고 밝혔다.경북 봉화군에서 태어난 유 씨는 19세이던 1974년 12월 서울에 볼일이 있어 올라갔다가 청량리역 앞에 서 있는 헌혈차에서 생애 첫 헌혈을 했다.당시 고향으로 돌아가는 기차를 기다리다가 시간이 좀 남아 시작했다.유 씨가 본격적으로 헌혈의 묘미를 찾게 된 것은 1980년대 중반 부산으로 이사를 와서다.적십자 회원들과 활발하게 교류하면서 헌혈이 다른 사람의 목숨을 구할 수 있을 뿐만 아니라 건강에도 도움이 된다는 것을 깨달았기 때문이다.국내 첫 여성 400회 헌혈 유배형씨    (부산=연합뉴스) 18일 부산혈액원 내 헌혈의 집에서 유배형씨가 우리나라 여성으로는 처음으로 400회 헌혈을 하고 있다. 2015.5.18 << 대한적십자사 부산지사 제공 >>   youngkyu@yna.co.kr1990년부터는 매월 2~3차례 헌혈하는 유 씨는 2009년 보건복지부 장관 표창을 받았고 적십자 혈액관리본부 '명예의 전당'에 등재돼 있다.이런 유 씨에게도 고비는 있었다. 1998년 불의의 교통사고로 지체장애 5급 판정을 받는 바람에 거동이 불편해졌고, 건강을 걱정하는 가족의 만류가 대단했다.당시 남편과 사별하고 혼자 힘으로 가정을 꾸려야 했던 유 씨도 '몸도 성하지 않은데 헌혈을 계속해야 하느냐'는 회의에 빠지기도 했다.그러나 유 씨는 ""내 피가 죽어가는 사람의 목숨을 구할 수도 있다""는 생각에 마음을 다잡았다고 한다.적십자사 부산지사는 18일 이런 유 씨에게 꽃다발과 기념패를 전달하고 감사의 뜻을 전했다.youngkyu@yna.co.kr▶ [현장영상] 코스타리카에서 귀뚜라미 쿠키를 만드는 이유▶ [카드뉴스] 커피 중독에서 벗어나는 9가지 방법"
2,2015-05-18,한라산 산림 생태계 급변자생식물 사라질 위기,https://news.naver.com/main/read.nhn?mode=LSD&mid=shm&sid1=102&oid=056&aid=0010170944,KBS,"<앵커 멘트>식물의 보물 창고인 한라산 산림 생태계가 급격히 변하고 있습니다.기후변화 여파 때문이긴 하지만, 당국의 허술한 보전관리 체계도 문제로 지적됩니다.보도에 조강섭 기자입니다.<리포트>10년 전까지도 1900여 종의 다양한 식물이 관찰됐던 제주도 한라산.하지만 지금은 조릿대 천지로 변했습니다.제주조릿대가 백록담 턱밑까지 확산되면서 한라산 특산식물 20여 종이  말라 죽었습니다.이곳 어리목코스를 비롯해서 영실과 성판악, 그리고 웬만한 등반로 주변 숲 속에는 보시는 것처럼 조릿대가 이미 자리를 점령한 지 오래입니다.30년 전 산철쭉과 털진달래로  장관을 이루던 모습이 제주조릿대와 참억새로 뒤덮인 현재와 큰 대조를 이룹니다.세계 최대규모의 구상나무 숲도 기온상승으로 빠르게 북상하는 소나무에 밀려  절반 가량은 사라졌습니다.하지만 제주도는 제대로 대처하지 못하고 있습니다.<인터뷰> 강시철(한라산공원관리사무소장) : ""5개 탐방로(개·보수), 조난 구조, 고지대 근무...이런 여건을 중점 관리하고 있어서 (생태 복원까지는 힘듭니다.)""한라산에만 자생하는 시로미와 한라구절초를 비롯해 고산식물 140여 종 대부분이 사라질 위기에 놓여 있습니다.<인터뷰> 김찬수(박사/국립난대아열대산림연구소장) : ""한라산 생명 자원들의 변화, 쇠퇴에 대비해 보전, 증식, 미래를 대비한 연구에 착수해야 됩니다.""급속한 기후변화에 제대로 대응하지 못하면서 생태계 보고인 한라산 식생이 위협받고 있습니다.KBS 뉴스 조강섭입니다.조강섭▶[취재후] 방송에서 못한 현장 이야기▶ KBS뉴스 SNS[트위터][페이스북][카카오][저작권자ⓒ KBS 무단복제-재배포 금지]"
3,2015-05-18,"학교에 그려진 '동화 그림'""교내폭력 줄었다""",https://news.naver.com/main/read.nhn?mode=LSD&mid=shm&sid1=102&oid=055&aid=0000316897,SBS,"<앵커>학교하면 어떤 색이 떠오르시나요? 잿빛이나 단조로운 색채를 떠올리는 분들 많으실 텐데요. 이런 계단이나 복도를 밝은색으로 바꾸거나 동화를 그려 넣었더니, 큰 변화가 생겼습니다. 학생들의 집중력이 크게 올랐고요, 수업 분위기가 좋아지고, 친구나 선후배 간의 싸움은 줄었다는 답변이 많았습니다.연속 기획 '색깔이 바뀌면 사회가 바뀐다', 오늘(18일) 첫 순서로 환하게 달라진 학교를 정혜진 기자가 다녀왔습니다.<기자>[우장 초등학교 땅속에는 씨앗 왕자와 씨앗 공주가 살았어요. 새싹이 되려면 하늘에서 내리는 비가 필요했어요.]학교 복도와 계단에 예쁜 동화 그림이 그려졌습니다.[유영숙/서울 우장초등학교 교감 : 하늘까지 몸을 뻗어서, 드디어 하늘에 있는 비의 왕자에게 '제발 비 좀 내려주세요'하고 말을 하게 된 거예요.]옛날, 기우제를 지냈던 학교 근처 우장산과 새싹, 햇살은 학생들 그림에서 따온 이미지입니다.[오승연/우장초 6학년 : 학교가 회색이었는데 갑자기 그림이 생기니까 학교 오는 게 더 좋아지고 기대되고 그래요.]잿빛이었던 학교는 환하고 생기있게 탈바꿈했습니다.뇌파를 측정해 학생들의 변화를 살펴봤습니다.색과 디자인을 바꾼 곳에서 학생들의 주의력은 40%, 집중력도 27% 높아졌습니다.[김선현 교수/차의과대학 임상미술치료대학원장 : 학교의 특징에 맞는 디자인이 도입됐을 경우에 정서적으로 더 안정이 되는걸 볼 수 있고요, 집중력도 훨씬 더 향상된다는.]과목마다 교실을 옮겨가며 수업하는 이 중학교는 과목 특성에 맞게 교실을 꾸몄습니다.예체능 교실엔 감각적인 붉은색, 인문사회 과목 교실엔 차분한 녹색, 자연과학 교실엔 창의력을 자극하는 파란색을 입혔습니다.집중력이 높아지고 공격적인 성향이나 싸움이 줄어드는 효과도 나타났습니다.학생들은 하루 3분의 1을 학교에서 보냅니다.학교의 색깔은 학생의 행동이나 정서에 큰 영향을 미칠 수 있습니다.(영상취재 : 최호준, 영상편집 : 최은진)정혜진 기자 hjin@sbs.co.kr☞네팔 대지진 긴급구호 후원하러 가기☞[SBS기자들의 생생한 취재현장 뒷이야기 '취재파일']☞ SBS뉴스 공식 SNS [SBS 8News 트위터] [페이스북] [카카오스토리]저작권자 SBS&SBS콘텐츠허브 무단복제-재배포 금지"
4,2015-05-18,"학교에 그려진 '동화 그림'""교내폭력 줄었다""",https://news.naver.com/main/read.nhn?mode=LSD&mid=shm&sid1=102&oid=055&aid=0000316897,SBS,"<앵커>학교하면 어떤 색이 떠오르시나요? 잿빛이나 단조로운 색채를 떠올리는 분들 많으실 텐데요. 이런 계단이나 복도를 밝은색으로 바꾸거나 동화를 그려 넣었더니, 큰 변화가 생겼습니다. 학생들의 집중력이 크게 올랐고요, 수업 분위기가 좋아지고, 친구나 선후배 간의 싸움은 줄었다는 답변이 많았습니다.연속 기획 '색깔이 바뀌면 사회가 바뀐다', 오늘(18일) 첫 순서로 환하게 달라진 학교를 정혜진 기자가 다녀왔습니다.<기자>[우장 초등학교 땅속에는 씨앗 왕자와 씨앗 공주가 살았어요. 새싹이 되려면 하늘에서 내리는 비가 필요했어요.]학교 복도와 계단에 예쁜 동화 그림이 그려졌습니다.[유영숙/서울 우장초등학교 교감 : 하늘까지 몸을 뻗어서, 드디어 하늘에 있는 비의 왕자에게 '제발 비 좀 내려주세요'하고 말을 하게 된 거예요.]옛날, 기우제를 지냈던 학교 근처 우장산과 새싹, 햇살은 학생들 그림에서 따온 이미지입니다.[오승연/우장초 6학년 : 학교가 회색이었는데 갑자기 그림이 생기니까 학교 오는 게 더 좋아지고 기대되고 그래요.]잿빛이었던 학교는 환하고 생기있게 탈바꿈했습니다.뇌파를 측정해 학생들의 변화를 살펴봤습니다.색과 디자인을 바꾼 곳에서 학생들의 주의력은 40%, 집중력도 27% 높아졌습니다.[김선현 교수/차의과대학 임상미술치료대학원장 : 학교의 특징에 맞는 디자인이 도입됐을 경우에 정서적으로 더 안정이 되는걸 볼 수 있고요, 집중력도 훨씬 더 향상된다는.]과목마다 교실을 옮겨가며 수업하는 이 중학교는 과목 특성에 맞게 교실을 꾸몄습니다.예체능 교실엔 감각적인 붉은색, 인문사회 과목 교실엔 차분한 녹색, 자연과학 교실엔 창의력을 자극하는 파란색을 입혔습니다.집중력이 높아지고 공격적인 성향이나 싸움이 줄어드는 효과도 나타났습니다.학생들은 하루 3분의 1을 학교에서 보냅니다.학교의 색깔은 학생의 행동이나 정서에 큰 영향을 미칠 수 있습니다.(영상취재 : 최호준, 영상편집 : 최은진)정혜진 기자 hjin@sbs.co.kr☞네팔 대지진 긴급구호 후원하러 가기☞[SBS기자들의 생생한 취재현장 뒷이야기 '취재파일']☞ SBS뉴스 공식 SNS [SBS 8News 트위터] [페이스북] [카카오스토리]저작권자 SBS&SBS콘텐츠허브 무단복제-재배포 금지"
5,2015-05-18,낚시꾼들 지나간 자리마다 '쓰레기 강',https://news.naver.com/main/read.nhn?mode=LSD&mid=shm&sid1=102&oid=437&aid=0000078313,JTBC,"[앵커]우리가 옆나라 일본과 가장 비교되는 것이 바로 쓰레기라고 하지요. 전국 어딜가나 깨끗한 일본과 전국 어딜가나 크고 작은 쓰레기로 넘쳐나는 걸 비교하기 싫어도 비교하게 됩니다. 주말마다 낚시꾼들이 강이나 호수로 몰리는데, 여기도 예외 없습니다. 낚시꾼들이 지나간 자리마다 쓰레기로 몸살을 앓고 있습니다.안지현 기자가 밀착카메라입니다.[기자]중부 지역의 최대 식수원인 대청호.멀리선 아름답기만 한 호수지만 가까이 가보니 낚시꾼들이 버린 쓰레기가 군데군데 쌓여있습니다.여기는 대청호 상류에 위치한 안터마을입니다.이 주변에서 낚시를 많이 한다고 하는데요. 이렇게 군데군데 쓰레기 더미가 몰려있습니다. 어떤 쓰레기인지 자세히 볼까요?부탄가스가 있고요, 소주와 맥주캔. 그리고 낚시꾼들이 버린 것으로 보이는 낚시대 보관함이 이렇게 타다만 채 있습니다.보다 못한 주민들이 직접 쓰레기를 치우기도 합니다.[신동석/안터마을 주민 : 8시에서 한 11시 반까지 주웠는데 그 때 한 60포대 나왔습니다.]쓰레기가 점차 늘어나자 수자원공사의 대청댐 관리단은 지자체와 함께 직접 쓰레기 수거에 나섰는데요. 지난 3월부터 두 달간 거둔 쓰레기양이 11톤에 달합니다. 지난해 같은 기간에 비해서도 22% 증가한 수치입니다.지자체는 쓰레기를 수거하는 것 외엔 손 쓰지 못하고 있습니다.[옥천군청 관계자 : 쓰레기 투기는 법으로 제재할 수 있는데 버리고 가는 것을 잡기는 힘들죠.]금강의 경우는 상황이 더 심각합니다.낚시 금지구역에서도 아랑곳하지 않고 낚시를 합니다.[낚시꾼 : (낚시 금지 구역인데 들어오셔도 괜찮아요?) 모르겠어요, 그건.]낚시터에서 흔히 볼수 있는 풍경을 한번 살펴볼까요?낚시 도구들이 보이는데요. 일회용품이 많기 때문에 쉽게 버려지기도 합니다. 낚시터 근처엔 항상 이렇게 쓰레기를 태운 흔적도 볼 수 있습니다.여기에도 플라스틱과 비닐 등이 타다 만 채 있습니다. 또 낚시줄들도 버려진 채 있습니다.낚시꾼들은 음식을 해 먹는 것은 물론, 담배 피우거나, 심지어는 대소변까지 낚시터에서 해결합니다. 먹다 남은 배달 음식도 그대로 버려져 있습니다.낚시꾼들 사이에선 자조 섞인 목소리가 나옵니다.[박형구/전북 군산 : 보면서 심란하다고 생각하고 이건 아니다(고 생각해요). 그게 하나의 습관이 된 것 같아요, 습관이.][낚시꾼 : (왜 그런 거죠?) 갈 때는 줍기가 싫은 거지.]오염된 건 강 주변 뿐만이 아닙니다.낚시꾼들이 떠난 자리입니다.한쪽에는 낚시도구들과 함께 쓰레기가 그대로 버려져 있습니다.강 위에도 이렇게 널브러져 있는데요. 보시면 고기를 구워먹는 석쇠도 강에 버려져 있습니다. 그러면 강 안은 얼마나 깨끗한지 한번 촬영해보겠습니다.물 속엔 쓰다버린 미끼 통은 물론, 각종 음료수 캔과 함께, 달걀 껍질까지 그대로 가라앉아 있습니다.차량이 들어가지 못하도록 길을 폐쇄하고, 바위까지 가져다 놓았지만 소용이 없습니다.과태료를 물리는 것도 잘 이뤄지지 않고 있습니다.[공주시청 관계자 : 과태료는 웬만하면 잘 안 물리는 것으로 알고 있거든요. 금액이 비싸요. 300만원이거든요.]그러는 사이 주민들의 불편만 커집니다.[이종낭 이장/충남 보령 유곡2리 : 낚싯밥이 엄청 오염돼요. 그런데 이 물로 갖고 농사 짓는다고요.]가져온 쓰레기는 되가져가야 한다는 것, 상식이지만 현실은 그렇지 못했는데요.일부 낚시꾼들의 몰지각한 행동으로 환경뿐 아니라 식수원마저 위협받고 있습니다.안지현▶ JTBC 뉴스 공식 SNS[트위터][페이스북][카카오스토리][유튜브]▶ JTBC 뉴스는 여러분의 생생한 제보를 기다립니다.Copyright by JTBC, DramaHouse & JcontentHub Co., Ltd. All Rights Reserved. 무단 전재 및 재배포 금지"
6,2015-05-18,"트램펄린 즐기며 기부를?뛰고 먹고 ""기부도 재미있게""",https://news.naver.com/main/read.nhn?mode=LSD&mid=shm&sid1=102&oid=214&aid=0000498267,MBC,"[뉴스데스크]◀ 앵커 ▶어려운 사람들을 위한 기부.필요하다고 생각은 해도 선뜻 행동으로 옮기지 못하는 경우가 많지 않습니까?◀ 앵커 ▶그래서 기부하는 사람 스스로 즐겁게 참여할 수 있도록 다양한 아이디어가 나오고 있습니다.조재영 기자입니다.◀ 리포트 ▶어린이 놀이기구가 대학교 캠퍼스에 설치됐습니다.공중 회전 묘기를 구경하던 학생들이 하나 둘 올라가 뛰기 시작합니다.[박가영/대학생]""이거 타고 싶어서 왔어요, 하하~""점잖은 교수들도 예외가 아닙니다.[이승윤/이화여대 교수]""어렸을 때 많이 했는데 아주 오랜만이라서..제가 이렇게 못할 줄 몰랐네요.""뛸 때마다 쏟아지는 동전들, 이 트램펄린은 한 어린이재단이 만든 모금함, 원하는 액수를 동전으로 바꾸고 뛰어서 떨어뜨린 만큼 기부하는 방식입니다.[임신혁/초록우산어린이재단 실장]""(기부는) 내가 즐거워야 된다, 그리고 내가 즐겁다는 것을 많은 사람들에게 알리기 위해서 이런 행사를 가지게 됐습니다.""팬들이 경매로 낙찰받은 아이돌 그룹과의 저녁식사.모금액은 모두 미혼모 지원 사업에 쓰입니다.[공윤정/위제너레이션 팀장]""목표 모금액의 120퍼센트가 달성됐는데요. 그만큼 많은 팬 분들이 호응을 해주셔서..""한 칸 밟을 때마다 돈이 적립되는 기부 계단도 있고, 게임에서 나무를 심으면 실제 숲을 만들어 주는 기부도 있습니다.우리나라의 기부 지수는 전 세계 135개 국가 중 중간 수준, 왜 기부하냐고 물어보면 '동정심' 때문이라는 대답이 가장 많습니다.'스스로 행복해지는 기부' '재미있는 기부'가 더 많아져야 하는 이유입니다.MBC뉴스 조재영입니다.(조재영 jojae@mbc.co.kr)[저작권자(c) MBC (www.imnews.com) 무단복제-재배포 금지]"
7,2015-05-18,물수능의 그늘…'반수생' 무려 6만6천여명,https://news.naver.com/main/read.nhn?mode=LSD&mid=shm&sid1=102&oid=009&aid=0003486213,매일경제,"올해 서울 한 대학에 입학한 김 모씨는 고등학교 시절 자신보다 성적이 나빴던 친구가 유명 사립대에 다닌다는 사실에 충격을 받고 재수를 준비 중이다. 김씨는 일단 한 학기 등록금만 내고 대학생 신분을 유지하면서 대학수학능력시험에 도전하는 전형적인 '반수생'이다. 400만원이 넘는 등록금에 매달 과외비까지 합하면 올해 들어 700만원이 넘는 돈을 썼다. 특히 김씨가 다니는 대학은 '입학 후 1년 내 휴학 금지'라는 학교 규칙을 내세워 김씨 같은 반수생도 꼼짝없이 2학기 등록금을 내도록 강제하고 있다. 김씨는 ""작년 수능이 너무 쉽게 나와 몇 문제 실수로 대학 간판이 달라져 나처럼 '반수'를 결심한 친구가 많다""며 ""올해 수능을 준비하기 위해 2학기 때 휴학하려 했더니 학교 측에서 안된다고 해 올해만 2000만원 넘게 쓰게 됐다""고 울먹였다.18일 매일경제가 종로학원하늘교육과 공동 분석한 결과, 김씨 같은 '반수생'들로 인한 사회적 기회비용이 작년에 2200억원에 달하는 것으로 나타났다.반수생은 그해 수능에 응시한 재수생 숫자에서 6월 한국교육과정평가원 모의고사 재수생 응시자 수를 뺀 숫자로 추정 가능하다. 대부분의 반수생은 6월 모의고사는 대학 첫 기말고사 일정 탓에 응시하지 않고 9월 평가원 모의고사를 통해 '평가전'을 치른 후 11월 실제 수능에 응시한다.이 같은 반수생은 2012학년도 7만2336명에 달했다가 대학들이 학생부 위주의 수시 선발 비중을 늘리면서 2013학년도 6만9364명, 2014학년도 6만1991명으로 감소 추세였다. 반수생들은 수능 위주 정시에 주로 도전하는데 이 숫자가 2015학년도에 6만6440명으로 전년 대비 4449명 늘었다. 같은 기간 수능 전체 응시 인원이 1만2000명가량 줄어든 것을 감안하면 이례적 현상으로 그만큼 사회적 손실이 증가했다는 뜻이다.교육부 발표 기준 지난해 한 학기 대학 등록금 평균이 333만원인 것을 감안하면 반수생 등록금 비용은 2212억4520만원에 달한다. 이들이 모두 다른 대학으로 진학하면 그야말로 허공에 뜬 돈이 된다. 임성호 종로학원하늘교육 대표는 ""원하지 않는 대학 학생 신분을 유지하느라 쓸데없는 등록금 비용이 발생하고 있다""며 ""최근 수능이 쉬워지고 이공계 선호 현상으로 반수생이 늘고 있어 올해 또다시 반수생이 늘어날 가능성이 높다""고 분석했다.전문가들은 최근 반수생 증가 원인으로 '물수능'으로 불릴 정도로 쉬워진 수능, 문과에서 이과로의 전환 수요, 의대 정원 증가 등을 꼽고 있다.한 사립대 관계자는 ""취업난 때문에 인문계열에 입학한 후 이과로 재수하길 원하는 학생이 많다""며 ""이과 교육 과정이 그리 어렵지 않아 상위권 학생들은 적응하기 쉬운 편""이라고 말했다.2017학년도까지 의대 정원이 늘면서 반수를 하려는 수요도 증가하고 있다. 올해 고등학교 2학년생이 치르는 2017학년도 대입에서 의대 정원은 최소 205명, 최대 278명이 증가할 것으로 예상된다. 이 같은 반수생 증가는 최근 학생과 대학 간의 갈등으로 번지고 있어 교육계 혼란을 가중시키고 있다.반수생들이 늘어나자 대학들은 휴학 규정을 까다롭게 고치는 추세다.서울에만 10개 대학이 1년 내 휴학을 금지하고 있다. 한 학생은 ""어차피 떠날 학생 등록금만 더 내게 하는 장삿속 아니냐""며 ""이 같은 규정이 상위법에 부합하는지 법률적 검토를 요청할 생각""이라고 말했다. 이에 대해 사립대 관계자는 ""반수생들이 증가하면서 아무 때나 휴학이 가능하도록 허용하면 정상적인 학교 운영이 불가능하다""고 답했다.[문일호 기자][ⓒ 매일경제 & mk.co.kr, 무단전재 및 재배포 금지]"
