,날짜,기사 제목,기사 링크,기사 출처,기사 내용
106,2013-01-25,"LG U+, 월 5만5천원부터 LTE 데이터 사실상 무제한",https://news.naver.com/main/read.nhn?mode=LSD&mid=shm&sid1=105&oid=018&aid=0002720333,이데일리,"[이데일리 정병묵 기자] LG유플러스(032640)는 ‘LTE 데이터 무한자유 95·110·130’ 요금제 3종을 오는 31일부터 3개월 간 운영한다고 25일 밝혔다.이 요금제는 기본 제공량을 초과하더라도 LTE의 빠른 속도로 데이터를 무제한 사용할 수 있다. 월 24GB의 기본을 제공하고 이를 초과하면 매일 3GB 이내에서 속도제한 없이 LTE 서비스를 누릴 수 있다. 일 3GB를 넘더라도  2Mbps의 속도로 LTE 데이터를 무제한으로 사용할 수 있다.사실상 속도제한 없이 데이터를 사용할 수 있을 뿐만 아니라 일 3GB를 초과하더라도 U+HDTV, 고화질 동영상 등 현재 LTE 기반의 모든 서비스를 자유롭게 이용할 수 있다는 것이 회사 측의 설명이다.현재 해외 일부 사업자가 LTE 무제한 데이터 상품을 제공하고 있으나 대부분의 경우 기본 데이터 제공량 초과시 2G 서비스 수준(128Kbps)으로 속도를 제어하고 있다.지난 12월 출시한 ‘LTE 데이터 쉐어링’을 무제한 요금제와 함께 이용할 수 있게 해 무제한 요금제 가입자가 월 7000원만 추가하면 무제한 요금제의 기본제공 데이터를 태블릿PC 등 데이터 전용 단말기로도 자유롭게 공유할 수 있다.‘LTE 데이터 안심 55·65·75’ 요금제도 출시했다. 기존 ‘LTE 52·62·72’ 요금제와 데이터 안심옵션(월 9000원)을 6000원 할인해 결합한 상품으로 각각 월 2.5GB·6GB·10GB의 데이터를 기본으로 제공하고 기본 용량 초과 시 400Kbps의 속도로 데이터를 무제한으로 제공한다.400kbps는 일부 고화질 동영상 및 클라우드 게임을 제외하고 U+ BOX, 이메일, 인터넷, 채팅, 게임 등의 서비스를 무리없이 이용할 수 있는 수준이다.LG유플러스는 네트워크 서비스 품질 유지를 위해 출시일인 1월 31일부터 4월말까지 3개월 동안 한시적으로 가입자를 모집하고 추후 네트워크 환경 및 요금제 가입자 추이 등을 감안하여 가입기간 연장여부를 결정할 방침이다.LG유플러스 LTE 데이터 무한자유/안심 요금제."
107,2013-01-25,새 총리 역할은..갈등조정ㆍ복지정책 총괄 가능성,https://news.naver.com/main/read.nhn?mode=LSD&mid=shm&sid1=100&oid=001&aid=0006058780,연합뉴스,"김용준 총리 지명자 출근    (서울=연합뉴스) 진성철 기자 = 새 정부의 첫 국무총리 후보자로 지명된 김용준 대통령직 인수위원장이 25일 서울 통의동 금융감독원 연수원 내 집무실로 출근하고 있다.    2013.1.25    zjin@yna.co.kr법치확립ㆍ공약이행 점검에서도 역할할 듯(서울=연합뉴스) 김화영 기자 = 김용준 대통령직인수위원장이 새 국무총리 후보자로 지명되면서 `박근혜 정부'의 총리실 위상도 윤곽이 잡히고 있다.정치적 색깔이 두드러지지 않은 김 후보자의 스타일상 그가 국무총리가 돼 장관 후보자를 제청하더라도 `책임총리제'와는 일단 거리가 생겼으며 활동범위도 과거의 틀을 크게 벗어나지 않을 것이라는 관측이 지배적이다.김 후보자는 총리 지명 기자회견에서 ""최선을 다해 헌법에 따라 대통령을 보좌하며 행정에 관해 대통령의 명을 받아 행정 각부를 통할하겠다""고 말했다.이를 놓고 `외치(外治)는 대통령, 내치(內治)는 국무총리'식의 동등한 수위의 업무분할보다는 대통령의 지시를 바탕으로 하는 수직 관계에 초점이 맞춰졌다는 해석이 나온다.김 후보자가 인수위원장으로 존재감을 드러내지 않은채 박 당선인을 조용하게 보좌해온 관계가 앞으로 내각에서도 이어질 것이라는 전망이 우세하다.김 후보자가 자신의 `색깔'을 크게 드러내지는 않을 것이라는 시각이다.다만 총리의 각료제청권 보장은 박 당선인의 대선공약인만큼 김 후보자가 분명하게 행사할 가능성이 크다.서면제청 등 대외적으로 입증할 방법을 모색할 수도 있다.그러나 헌법에 규정된 총리권한은 제87조 국무위원 제청권과 해임건의권 외에는 모호하고, 결국 박 당선인이 총리에게 어떤 업무를 맡기느냐가 총리의 `파워'를 좌우할 것이라는 지적이다.일단 총리실 관계자들은 박 당선인이 김 후보자를 공동선대위원장, 인수위원장에 이어 총리로 기용한 것은 신뢰관계를 입증하는 것이라는 데 기대를 걸고 있다.한 관계자는 25일 연합뉴스와의 통화에서 ""대통령이 자신이 잘 모르는 사람을 총리로 쓰는 것과, 신뢰하는 사람을 총리로 쓰는 것의 차이는 엄청나다""고 말했다.지난24일 박근혜 당선인에 의해 총리로 지명된 김용준 총리후보자가 서울 삼청동 인수위에서 기자회견을 마친 후 밝으 표정으로 브리핑 룸을 나서고 있다.(자료사진)관가에서는 행정부 경험이 없는 판사 출신의 김 후보자에게는 주도적 정책 입안 보다는 `법과 원칙'에 따라 정부를 운용하는 능력이 더 부각될 것이라는데 시각이 일치하고 있다.한 예로 `춘투(春鬪)'로 노동문제가 쟁점화될 때마다 총리실이 나서 정부의 대응방향을 잡았던 것처럼, 해법이 보이지 않는 난제를 풀어나갈 때 `법과 원칙' 기조가 부상할 수 있다는 것이다.정부부처간, 이해단체간 충돌로 진전되지 못하고 있는 각종 갈등현안을 풀어나 가는데서 김 지명자의 조정 능력이 발휘될 수도 있다는 기대도 있다.김 후보자 스스로도 인수위원장 임명후 기자회견에서 ""재판장으로서 합의체의 합의를 이끌고 결론을 내는게 저에게는 생래적으로 훈련이 돼있다""며 ""인수위에서도 위원들의 의견을 종합해 한가지 결론이 나도록 유도할 것""이라고 말한 바 있다.박 당선인이 중시하는 총ㆍ대선공약 이행을 총리실이 직접 나서 챙길 가능성도 제기된다. 박 당선인의 한 측근은 최근 ""총리가 정책 점검을 도맡도록 하는 방안도 생각하고 있다""고 말했다.`박근혜 정부'의 소수자ㆍ약자보호의 상징성을 지니게된 김 지명자가 총리실에 설치되는 사회보장위원회를 중심으로 박 당선인의 복지정책이행을 총괄할 것이라는 전망도 나온다.quintet@yna.co.kr[이 시각 많이 본 기사]☞인수위 현장방문 둘째날 감사원 현장센터 방문☞<주말영화> '7번방의 선물' 예매율 1위☞<김용준 지명자 누구..헌재소장 출신 `장애인 신화'>(종합3보)☞""사회변화의 기적을 꿈꾼다""…스페셜올림픽 29일 개막☞<택시법 대체입법 '속전속결'…정부 총력전><연합뉴스 모바일앱 다운받기><포토 매거진><저작권자(c)연합뉴스. 무단전재-재배포금지.>"
108,2013-01-25,대학들 올해 학부 등록금 소폭인하ㆍ동결,https://news.naver.com/main/read.nhn?mode=LSD&mid=shm&sid1=102&oid=001&aid=0006058785,연합뉴스,"지난24일 서울 종로구 삼청동 대통령직인수위원회 앞에서 열린 반값등록금 시행 촉구 기자회견에서 참가자들이 구호를 외치고 있다.(자료사진)서울지역 서울대ㆍ이화여대ㆍ동국대 등 인하…대학원은 동결추세(서울=연합뉴스) 조민정 기자 = 대학들이 올해 학부 등록금을 작년보다 조금 내리거나 동결하고 있다. 대학들은 대학원 등록금은 대부분 동결하는 등 올해 등록금 인하폭을 작년보다 줄이는 추세다.동국대는 2013학년도 학부 명목 등록금을 지난해보다 0.2％ 인하하기로 등록금심의위원회에서 잠정 합의했다고 25일 밝혔다.올해 적용되는 문예창작과의 소속 단과대학 변경 등 학문구조조정에 따른 인하분을 제외하면 학부 등록금은 사실상 동결됐다. 동국대는 일반대학원 등록금은 3.1％ 인상했고, 특수·전문대학원 등록금은 동결했다.학교 측은 ""지난 2009년과 2010년 등록금을 동결했고 2011년 2.8％인 상 후 2012년도에는 2.2％ 인하하면서 실질 등록금은 5년 전인 2008년도 수준""이라며 ""물가상승률을 감안하면 체감 인하율은 0.2％보다 높을 것""이라고 설명했다.이화여대는 올해 학부 등록금을 지난해보다 1.5％ 인하하고 일반대학원 등록금을 동결하기로 했다고 지난 24일 밝혔다. 이화여대는 2012학년도에는 등록금을 3.5% 인하했으나 올해는 인하폭을 조금 줄였다.앞서 서울대도 지난 23일 등심위에서 올해 학부와 대학원 등록금을 0.25% 인하하기로 잠정 합의했다.지역대학들도 올해는 등록금 동결이 대세다.부산지역 부경대와 동의대는 지난 23일 등심위에서 등록금을 동결하기로 했다. 이들 대학은 지난해에는 등록금 인하율이 5.1%, 6.2% 였다.부산가톨릭대, 동의과학대, 한국해양대, 부산과학기술대는 각각 등록금 동결을 선언했고 부산대는 0.3% 내리기로 했다.강원도의 춘천교대는 지난 24일 등심위 1차 회의에서 올해 등록금을 동결하기로 했고, 지난해 등록금을 5.2% 인하한 한림대도 올해는 동결하기로 했다.chomj@yna.co.kr[이 시각 많이 본 기사]☞인수위 현장방문 둘째날 감사원 현장센터 방문☞<주말영화> '7번방의 선물' 예매율 1위☞<김용준 지명자 누구..헌재소장 출신 `장애인 신화'>(종합3보)☞""사회변화의 기적을 꿈꾼다""…스페셜올림픽 29일 개막☞<택시법 대체입법 '속전속결'…정부 총력전><연합뉴스 모바일앱 다운받기><포토 매거진><저작권자(c)연합뉴스. 무단전재-재배포금지.>"
109,2013-01-25,"여야, 김 총리 지명자 놓고 '시각차'",https://news.naver.com/main/read.nhn?mode=LSD&mid=shm&sid1=100&oid=003&aid=0004945861,뉴시스,"【서울=뉴시스】강세훈 기자 = 여야가 25일 김용준 대통령직인수위원장을 국무총리 후보자로 지명한 것과 관련해 상반된 입장을 보이고 있다.새누리당은 김 후보자가 총리 적임자라며 기대감을 나타내고 있지만 야권은 역사관에 문제를 제기하며 인사청문회를 통해 적격 여부를 검증하겠다는 의지를 재차 강조하고 있다.이철우 새누리당 대변인은 이날 KBS라디오 '안녕하십니까 홍지명입니다'에 출연해 ""당의 공약을 개발했을 뿐 아니라 대통령 선거준비를 했고, 정부 인수 작업을 했기 때문에 준비된 총리""라고 말했다.또한 ""김 지명자가 지금까지 살아온 내력을 봤을 때 책임총리 역할을 충분히 할 것""이라고 내다봤다.반면 이언주 민주통합당 대변인은 ""김 지명자는 인수위원장 직을 맡으며 소통이 부족하고, 대통령을 단순 보좌하는 이상의 역할을 보여주지 못했다""고 지적했다.이어 ""대통령 권한이 더 막강해진 게 아닌지 걱정을 하고 있다""며 ""대통령에게 직언을 하고 잘못된 판단을 바로잡을 의지가 있는 사람인지 중점적으로 검증할 예정""이라고 밝혔다.또 인사청문회에서 집중 거론될 것으로 예상되는 김 지명자의 역사관에 대해서도 전초전을 벌였다.김 지명자는 쿠데타와 광주학살범죄의 책임자인 전두환, 노태우 전 대통령을 처벌하기 위한 법안이었던 5.18 특별법에 대해 한정 위헌의견을 냈었던 것과 관련해 역사관 논란이 다시 불거지고 있는 상황이다.이철우 대변인은 ""형벌 불소급 원칙에 위반된다고 한정 위헌 의견을 냈던 것""이라며 ""본인의 소신과 원칙, 양심에 따라 판단을 내린 것 같다""고 말했다.반면 이언주 대변인은 ""5.18특별법에 대해 한정 위헌 의견을 낸 것과 관련해 김 지명자가 헌법적 질서를 유지하는데 적임자인지 의문이 든다""며 ""이 부분을 검증해야 할 것""이라고 말했다.kangse@newsis.com[뉴시스 이시간 핫 뉴스]ㆍ 3차 핵실험 북한, 핵능력은 어느 정도?ㆍ ´여의도 칼부림´ 범인에 징역 14년 선고ㆍ 70대 노부부, 점퍼도 없이 눈보라속 산 오르다…ㆍ 교수가 수업 중 욕설 논란…음성 파일 유포ㆍ 이외수, 교수들 잇단 비판에 ""그러시라지 뭐""★ 손 안에서 보는 세상, 모바일 뉴시스★ “우리 결혼합니다” 뉴시스 웨딩알리미 ‘두리’<저작권자ⓒ 공감언론 뉴시스통신사. 무단전재-재배포 금지.>"
110,2013-01-25,선자령 실종 70대 남편도 숨진 채 발견(종합),https://news.naver.com/main/read.nhn?mode=LSD&mid=shm&sid1=102&oid=001&aid=0006058766,연합뉴스,"'선자령'서 구조작업 벌이는 119대원들    (평창=연합뉴스) 24일 오후 강원 대관령 '선자령(仙子嶺)' 정상 부근에서 강원도소방본부 평창소방서 119대원들이 탈진한 등산객들을 구조하고 있다. 이날 선자령에서는 강풍과 한파에 등산객 정모(72·여)씨와 남편 홍모(75)씨가 탈진해 저체온증으로 숨졌고, 일행 3명이 구조됐다. <<강원도소방본부>> 2013.1.24     rae@yna.co.kr(평창=연합뉴스) 이재현 기자 = 지난 24일 강원 대관령 선자령(仙子嶺) 정상 부근에서 등반 중 실종됐던 70대가 끝내 숨진 채 발견됐다.평창소방서는 25일 오전 10시께 평창군 대관령면 횡계리 선자령 정상서 0.8㎞ 떨어진 지점에서 눈 속에 묻혀 있는 홍모(72)씨의 시신을 발견했다고 밝혔다.홍씨는 지난 24일 오후 2시21분께 아내 정모(72·여·경기 시흥시)씨와 함께 선자령 정상에서 내려오다가 갑작스런 눈보라와 한파 등으로 조난당했다.홍씨의 아내는 사고 발생 1시간20분 만에 선자령 정상 부근에서 저체온증으로 숨진 채 발견됐다.경기 시흥의 산악회원 36명과 함께 선자령을 등반 중이던 홍씨 부부는 방한 파커를 산악회 전세버스에 두고 정상에 오르다 악기상을 만나 변을 당한 것으로 알려졌다.사고 당시 홍씨는 선자령 정상에서 하산 중 탈진증세를 보여 먼저 낙오됐고, 눈보라가 몰아쳐 한 치 앞도 내다볼 수 없는 기상악화까지 겹치면서 아내인 정씨 등 일행과도 떨어진 것으로 알려졌다.산악회의 한 일행은 ""10년간 한 번도 빠짐없이 산악회 등반에 참여해온 부부였다""며 ""젊은 회원보다 더 건강했는데 하산 중 갑작스런 기상악화 때문에 변을 당했다""며 안타까워 했다.눈 쌓인 백두대간 오른 등산객들(자료사진)눈 쌓인 백두대간 오른 등산객들    (강릉=연합뉴스) 유형재 기자 = 23일 많은 등산객이 최근 내린 폭설로 설경이 장관인 백두대간의 대관령∼선자령 구간을 오르고 있다. 2013.1.23    yoo21@yna.co.kr    http://blog.yonhapnews.co.kr/yoo21/한편 사고 직후 구조에 나섰던 119구조대는 선자령 정상 부근에 초속 20.6m의 강풍과 한파가 몰아쳐 현장 접근에 어려움을 겪자 오후 9시30분께 철수했다가 이날 재투입됐다.jlee@yna.co.kr[이 시각 많이 본 기사]☞인수위 현장방문 둘째날 감사원 현장센터 방문☞<주말영화> '7번방의 선물' 예매율 1위☞<김용준 지명자 누구..헌재소장 출신 `장애인 신화'>(종합3보)☞""사회변화의 기적을 꿈꾼다""…스페셜올림픽 29일 개막☞<택시법 대체입법 '속전속결'…정부 총력전><연합뉴스 모바일앱 다운받기><포토 매거진><저작권자(c)연합뉴스. 무단전재-재배포금지.>"
111,2013-01-25,"경찰, 국정원 여직원 3차 소환…대선 개입 의혹 추궁",https://news.naver.com/main/read.nhn?mode=LSD&mid=shm&sid1=100&oid=001&aid=0006058716,연합뉴스,"불법선거운동 의혹을 받고 있는 국정원 여직원 김 모 씨(자료사진)(서울=연합뉴스) 고상민 기자 = 국가정보원 여직원 김모(29)씨의 대선개입 의혹을 수사하는 경찰이 25일 김씨를 다시 불러 조사하고 있다.김씨는 이날 오전 9시30분께 변호사와 함께 서울 수서경찰서에 출석했다.지난 4일 2차 소환 조사 이후 21일 만이다. 경찰은 지난달 15일 김씨를 1차 조사했다.권은희 수사과장은 ""2차 조사 이후 많은 준비를 해온 만큼 관련 혐의에 대해 충실히 물을 예정""이라며 ""조사는 오후까지 계속될 것""이라고 말했다.경찰은 김씨를 2차 소환 때 12시간 넘게 조사했지만 김씨가 밤샘조사를 거부해 돌려보냈다.경찰 관계자는 ""2차 소환때 확인하지 못 한 사항은 총 조사할 내용의 30% 정도""라며 ""이번 조사가 사실상 마지막이 될 것으로 본다""고 말했다.경찰은 지난해 8월말부터 대선 직전까지 김씨가 웹사이트 대선 관련 게시물에 99개의 '찬반 표시'를 남긴 것을 확인, 공직선거법을 위반한 것으로 보고 수사하고 있다.gorious@yna.co.kr[이 시각 많이 본 기사]☞인수위 현장방문 둘째날 감사원 현장센터 방문☞오지은 ""성민아처럼 작품에 이득되는 배우 되고파""☞<김용준 지명자 누구..헌재소장 출신 `장애인 신화'>(종합3보)☞이상화, 스프린트선수권대회서 '신기록 다시 한번'☞<택시법 대체입법 '속전속결'…정부 총력전><연합뉴스 모바일앱 다운받기><포토 매거진><저작권자(c)연합뉴스. 무단전재-재배포금지.>"
112,2013-01-25,"朴당선인, 이한구 등 정책협의대표단 美파견(종합)",https://news.naver.com/main/read.nhn?mode=LSD&mid=shm&sid1=100&oid=001&aid=0006058698,연합뉴스,"새누리당이한구 원내대표.(자료사진)상반기 한미 정상회담ㆍ북핵대응ㆍ한미FTA 사전 조율할듯朴당선인 친서 오바마 대통령에 전달 관측도(서울=연합뉴스) 김남권 기자 = 박근혜 대통령 당선인은 새누리당 이한구 원내대표를 단장으로 하는 정책협의대표단을 미국에 파견하기로 했다.박선규 당선인 대변인은 25일 인수위 브리핑을 통해 ""박 당선인이 정책협의대표단을 조만간 미국에 파견할 예정""이라면서 ""양측은 시기와 일정을 협의하고 있으며 미측은 우리 대표단의 방문을 환영한다고 전했다""고 말했다. 구체적 방미 시기와 일정은 최종 확정되지 않았다.정책협의대표단은 이한구 원내대표가 단장이고 같은 당 나성린 의원과 인수위 외교국방통일분과 이정민 홍용표 전문위원 등 4명으로 구성됐다. 정부에서도 외교부 차관보 등 관계자들이 동행한다.박 대변인은 ""이 원내대표가 당선인의 외교철학을 잘 알고 새누리당의 대선 공약도 잘 이해하고 있다""면서 ""동행하는 이정민 홍용표 인수위 전문위원도 외교안보 공약 작성에 깊이 관여했던 분이고, 새정부 정책에 대해 미국과 문제를 논의할 적임자로 당선인이 판단하지 않았겠느냐""고 설명했다.그러면서 ""양국 모두 새 정부가 출범한 상태이기에 새 정부의 정책 방향과 양국간 관계강화 방안, 양국간 공동 관심사 등에 대해 논의를 할 것으로 예상된다""고 덧붙였다.대표단은 방미 기간 박근혜 당선인과 버락 오바마 미국 대통령의 상반기내 한미 정상회담 개최 문제와 북한 핵실험에 대한 한미 공조 등 대북협력 그리고 한미 자유무역협정(FTA) 논의 등 굵직굵직한 사안들에 대해 미국 정부와 사전 조율을 할 것으로 보인다.이와 함께 원자력 협정 개정 문제, 방위비 분담금 협상에 대해서도 대표단은 미 정부측과 사전 논의를 진행할 것으로 예상된다.비록 정식명칭이 특사는 아니더라도 이한구 원내대표가 박 당선인의 친서를 가지고 가 오바마 대통령에게 전달하고 양측이 편리한 시기에 한미 정상회담을 추진할 것을 제안할 가능성도 거론된다.박근혜대통령 당선인.(자료사진)박 대변인은 대표단의 오바마 대통령 면담 여부에 대해 ""일정을 논의 중""이라면서 가능성을 열어놓았다.한편 박 당선인은 대표단 성격에 대해 ""특사와는 용어를 구분해주면 좋겠다. 특사와 정책협의대표단은 몇 가지 차이가 있을 수 있다""면서 ""나중에 협의가 다 완료되면 설명하겠다""고 말했다.중국을 제외한 다른 국가에 특사를 파견할 지 여부에 대해 ""일방적으로 우리가 파견하는 모습을 갖지는 않을 것이며, 요청이 있고 필요성이 있을 때 파견할 것""이라고 밝혔다.south@yna.co.kr[이 시각 많이 본 기사]☞인수위 현장방문 둘째날 감사원 현장센터 방문☞오지은 ""성민아처럼 작품에 이득되는 배우 되고파""☞<김용준 지명자 누구..헌재소장 출신 `장애인 신화'>(종합3보)☞이상화, 스프린트선수권대회서 '신기록 다시 한번'☞<택시법 대체입법 '속전속결'…정부 총력전><연합뉴스 모바일앱 다운받기><포토 매거진><저작권자(c)연합뉴스. 무단전재-재배포금지.>"
113,2013-01-25,[날씨] 다시 '한파 특보'‥낮에도 영하권 지속,https://news.naver.com/main/read.nhn?mode=LSD&mid=shm&sid1=103&oid=214&aid=0000228330,MBC,"[뉴스투데이]오늘 아침 어제와는 확연히 다릅니다.야외에 잠깐 서 있는데도 손끝이 다 시릴 정도인데요.어제 같은 시각 서울의 기온 영상 1도였는데 지금은 약 10도가량 뚝 떨어져서 영하 9.5도 나타내고 있습니다.여기에 찬바람까지 더해지면서 체감온도는 더 낮으니까요，대비 단단히 하고 나오셔야겠습니다.오늘은 오랜만에 대체로 맑은 날씨가 되겠습니다.다만 충청 이남 서해안에서는 종일 눈이 날리거나 빗방울이 떨어지는 곳이 있겠습니다.특보상황입니다.강원 영서지방에는 한파경보가 서울, 경기와 충청 경북지방에는 한파주의보가 내려져 있습니다.수도관 등 동파사고 없도록 주의하셔야겠습니다.현재 기온 보시면 서울 영하 9.5도, 철원 영하 12.2도 등 어제보다 10도 정도 떨어져 있고요.남부지방도 광주 영하 3.3도 등 어제보다 춥습니다.한낮에도 서울 영하 6도에 머무는 등 종일 강추위가 이어지겠고 주말인 내일은 서울의 아침 기온이 영하 13도까지 떨어지는 등 이번 추위가 절정에 달하겠습니다.날씨였습니다.(임현진 캐스터)[저작권자(c) MBC (www.imnews.com) 무단복제-재배포 금지]"
114,2013-01-25,‘LTE 무제한 요금’ LG U+ 전격 출시,https://news.naver.com/main/read.nhn?mode=LSD&mid=shm&sid1=105&oid=014&aid=0002802650,파이낸셜뉴스,"LTE도 ‘무제한 요금’..LG U+ 전격 출시LG U+, 31일 LTE 무제한 무선인터넷 요금제 3종 출시롱텀에볼루션(LTE)에도 무제한 무선인터넷 요금제가 나온다.LG U+는 오는 31일 LTE 스마트폰용 무제한 무선인터넷 요금제를 출시한다고 25일 밝혔다.무제한 무선인터넷 요금제는 총 3가지다. 기본료가 9만5000원, 11만원, 13만원이며 각각 음성통화는 750분, 1200분, 1500분 제공한다.한편 무제한 무선인터넷 요금제는 기존 3세대(3G) 요금제에만 있었는데, 과도하게 많이 사용하는 일부 이용자들 때문에 네트워크에 부담이 된다는 지적이 있었다.ronia@fnnews.com 이설영 기자☞ 파이낸셜뉴스[모바일웹]| 패밀리사이트[부산파이낸셜뉴스][fn아이포커스][fn아트]| 공식 SNS계정[트위터][페이스북][미투데이]■ 오늘의 핫뉴스▶ 수입 소형차의 유혹..무슨 차 고를까?▶ SKT 꼼수(?), LTE라고 말하더니 결국..▶ 차 밖으로 튕겨진 아기 앞에 트럭이..‘기적’▶ 싸이 팔찌, 실로 만들었는데 29만원? ‘오빤 명품스타일’▶ 이승연·장미인애 ‘프로포폴’ 투약 혐의 검찰 소환 조사※ 저작권자 ⓒ파이낸셜뉴스. 무단 전재-재배포 금지"
