,날짜,기사 제목,기사 링크,기사 출처,기사 내용
25,2013-01-25,인간의 뇌를 조종하는 기생충이 있다?,https://news.naver.com/main/read.nhn?mode=LSD&mid=shm&sid1=105&oid=081&aid=0002318279,서울신문,"[서울신문 나우뉴스]기생충의 한 종류인 톡소포자충(톡소플라즈마)이 인간의 뇌를 조종하는 방법이 22일(현지시간) 미국 내셔널지오그래픽뉴스를 통해 공개됐다.유명 기생충학자이자 진화생물학자인 야로슬라프 플레그르(Jaroslav Flegr) 체코 프라하대학 교수는 “톡소포자충이 우리 뇌를 조종할 수 있다.”는 대담한 주장을 펼쳐 최근 1년 정도 언론의 주목을 받고 있다.플레그르 교수에 따르면 톡소포자충은 일반적으로 쥐를 사냥하는 고양이에 기생한다.교묘한 전략을 취하는 것으로 알려진 이 기생충은 쥐의 행동을 변화시켜 고양이에게 잡아먹힘으로써 새로운 숙주로 이동한다.이 기생충은 고양이에 침투하기 위해 쥐의 행동이 변화하도록 유도하는데, 감염된 쥐는 반응시간이 느려지고 무기력해지며 위험을 두려워하지 않는다고 한다.톡소포자충에 감염된 인간에게서도 이런 증상이 나타난다는 것을 플레그르 교수는 발견했다.하지만 톡소포자충이 어떤 방법으로 인간의 행동에 변화를 주는지는 최근까지 알려지지 않았다.2개월 전, 스웨덴 카롤린스카연구소 감염학센터 소속 안토니오 바라간 연구원이 이끈 연구진이 톡소포자충의 수수께끼를 푸는 중요한 열쇠를 발견했다. 이는 이 기생충이 숙주로 이동하고 중요한 뇌에 도달하기 위해 백혈구를 ‘납치’한다는 것이다. 참고로 백혈구는 원래 이런 침입자를 공격하는 세포다.톡소포자충은 마치 백혈구를 납치한 버스처럼 사용할 뿐만 아니라 그곳(백혈구)을 작은 화학공장으로 개조해 우리 인간의 공포심이나 불안감을 둔하게 하는 신경전달물질을 생성하게 한다.톡소포자충은 주로 쥐를 잡아먹은 길고양이를 숙주로 하며 배설물을 통해 감염될 수 있다. 여기서 배설물로 배출된 충란은 1~5일이 지나야 감염력이 생기는데 그전에 하루 두세 번 이상 배설물을 치워준다면 감염위험성을 크게 줄일 수 있다. 또한 기생충에 감염됐던 고양이도 2주가 지나면 더는 충란이 든 배변을 하지 않는다고 한다.따라서 고양이의 배변과 직접 접촉하지 않으면 감염될 가능성은 거의 없다. 오히려 휴지통, 오염된 물, 덜 익은 육류 등을 통해서도 감염될 수 있다고 알려졌기 때문에 주의가 필요하다.또한 일반적으로 증상이 심각하지 않아 큰 문제로 나타나지는 않지만 임산부는 주의가 필요하다. 미국 질병통제예방센터(CDC)는 톡소포자충에 임산부가 감염되면 유산이나 선천성 기형의 위험률이 높아진다고 주의하고 있다.프레그르 교수는 지난 1990년 우연히 자신이 톡소포자충에 감염된 사실을 알았다. 이는 동료 연구원이 새로운 진단 테스트를 개발하여 이를 그가 시도해 봤던 것이다.감염을 알게 된 그는 자신의 경험을 떠올렸다고 한다. 톡소포자충이 쥐의 공포심을 저하시켜 고양이에게 잡아먹힌다는 사실을 알고 있었기 때문에 그는 자신도 얼마 전부터 공포심이 둔해진 것을 느끼고 있었다.이는 길을 건너던 도중 차가 경적을 울려도 피할 생각을 못했고 그 원인이 톡소포자충 때문이 아니겠느냐고 생각했다고 한다.프레그르 교수는 지난 15년간 공중보건 자료에 의한 실험과 분석을 시행한 결과 톡소포자충과 인간의 행동에 관한 몇 가지 놀라운 연관성을 밝혀냈다.즉 톡소포자충에 감염된 사람은 교통사고를 당할 확률이 일반인보다 2배 이상 높았다. 이에 대해 그는 이 기생충이 반응 시간을 늦게 했기 때문이라고 추측했다. 이 밖에도 감염자는 조현병(정신분열증) 발병 확률도 높은 것으로 나타났다.아울러 톡소포자충에 감염된 사람은 자살률이 상승한다는 다른 연구진의 보고도 있다고 프레그르 교수는 설명한다.톡소포자충이 이런 변화를 일으키는 메커니즘은 그동안 수수께끼였지만 2009년 영국 연구진이 톡소포자충은 도파민의 전구물질인 엘도파(L-dopa)를 생성하는 2개의 유전자를 갖고 있다는 것을 발견했다.도파민 증가는 조현병의 발병과 연관된다. 하지만 이 발견만으로 모든 것을 설명할 수 없으며 여전히 많은 수수께끼가 남아 있다고 그는 설명한다.안토니오 바라간 연구진은 실험용 쥐의 혈액 속에 있는 톡소포자충을 연구해 그들이 의외의 장소에 숨어있다는 것을 발견했다.기생충 등 인체에 비정상적인 세포가 침투하거나 생겼을 때 이를 죽이는 세포가 있다. 정확히 말하면 T 세포를 자극하는 백혈구의 일종인 수지상세포(나뭇가지 세포)가 있는데 이는 “인간의 면역체계의 문지기”라고 바라간 연구원은 설명했다.연구진은 톡소포자충이 이 수지상세포를 이동 수단으로 사용한다고 추정했다. 마치 트로이의 목마처럼 이 세포를 사용하는 게 아니냐는 게 이들의 생각이다.그들의 생각은 실험 결과 옳았다. 톡소포자충은 수지상세포를 통해 체내를 이동해 숙주의 뇌에 도달했다.그렇다면 수지상세포가 어떻게 이동한 것일까. 면역세포는 바이러스 침투 등의 자극이 없으면 움직이지 않는다. 그렇다고 톡소포자충이 직접 움직이는 것도 아니다. 수지상세포는 자신이 감염된 것조차 인식하지 않는 모습이라고 연구진은 전했다.그렇다면 무엇이 수지상세포를 움직이게 한 것일까? 대답은 신경전달물질인 감마아미노낙산(감마 아미노뷰티르산·GABA)이다. 이에 대해 바라간 연구원은 “이상한 일”이라고 말했다.GABA는 뇌에서 작용하지만 분명히 백혈구 면역체계에 존재했다. 연구진은 지금까지 아무도 본 적 없는 것을 목격했다고 밝혔다.따라서 연구진은 톡소포자충이 수지상세포 내부에서 GABA를 생산하고 같은 세포의 외부에 있는 GABA 수용체를 자극해 이를 통해 세포로 몸을 옮겨 뇌에 도달한다고 추정했다.또한 여기에는 중요한 점이 있다. 조현병 등 많은 정신장애는 일반적으로 GABA의 기능의 혼란이 관찰됐다고 한다. 따라서 GABA양이 증가가 “두려움과 불안감의 저하와 연관된다.”고 연구진은 설명한다.하지만 이번 발견으로 모든 수수께끼를 설명할 수 있는 것은 아니라고 프레그르 교수는 지적했다.그는 “여전히 가장 중요한 물질은 도파민이라고 생각하고 있다. 하지만 이 GABA의 메커니즘은 참신하고 매우 흥미롭다.”고 말했다.끝으로 그는 “톡소포자충에 관해 지금까지 알게 된 사실로 볼 때 그들은 매우 영리한 생물”이라고 말했다.윤태희 기자 th20022@seoul.co.kr나우뉴스 공식 SNS 계정: 트위터http://twitter.com/SEOUL_NOWNEWS[ 관련기사 ]☞  겁도 없이 외줄타는 고릴라, 이유는?☞ 잠자리, 사냥할 땐 인간 수준 집중력 지녔다☞ 티렉스보다 쎄…사상 최강 턱힘 가진 어류☞ ‘분신술’ 쓰는 신종거미, 아마존서 최초 발견☞ 산타 썰매 끄는 ‘루돌프 코’가 빨간 이유는?별난 세상 별난 뉴스(nownews.seoul.co.kr) [서울신문 나우뉴스 통신원 모집] [신문 구독신청]- Copyrights ⓒ서울신문사. 무단 전재 및 재배포 금지 -"
26,2013-01-25,"日·대만, 센카쿠 해역서 또 '물대포 충돌'(종합2보)",https://news.naver.com/main/read.nhn?mode=LSD&mid=shm&sid1=104&oid=001&aid=0006058000,연합뉴스,"센카쿠 접근하는 대만 어선(AP/일본해안경비대=연합뉴스) 대만 어선 '취안자푸(全家福)'가 24일(현지시간) 센카쿠 열도(중국명 댜오위다오)의 우오츠리섬 인근을 지나고 있다. 취안자푸가 센카쿠로 접근하자 일본 순시선들이 저지하며 물대포를 쏘았으며 이에 어선보호를 위해 현장에 급파됐던 대만 해안순방서(해경) 소속 경비선도 일본측과 경고 방송을 주고 받으며 대치했다. 취안자푸호는 대치 1시간 20여분만에 되돌아갔다.    marshal@yna.co.kr中 해감선도 등장…양안 공동 행보(타이베이·도쿄=연합뉴스) 류성무 이충원 특파원 = 일본 순시선과 대만 경비선이 24일 센카쿠(중국명 댜오위다오) 해역에서 서로 물대포를 쏘며 대치하는 상황이 다시 발생했다.대만 중화댜오위다오보호협회와 홍콩을 거점으로 활동하는 세계중국인댜오위다오보호연맹 회원 4명, 승조원 등 모두 7명이 탄 대만 어선 '취안자푸(全家福)'호가 센카쿠 상륙을 위해 이날 오전 10시5분(현지 시간)께 이 섬 전방 28해리 지점을 지나던 중 일본 순시선 8척의 저지를 받았다고 대만 중앙통신사(CNA) 등이 전했다.이 과정에서 일본 순시선은 물러갈 것을 요구하는 경고 방송을 한 뒤 대만 어선을 향해 물대포를 쐈다.이에 어선 보호를 위해 현장에 급파된 대만 경비선들도 물대포로 응사했다고 대만 해안순방서(해경)가 밝혔다.양측은 지난해 9월에도 일본의 센카쿠 국유화 조치에 반발한 대만 어선 60여 척이 일본이 주장하는 센카쿠 영해에 진입하면서 물대포로 맞서는 충돌 상황을 빚은 바 있다.이날 활동가들을 태운 취안자푸호가 일본 순시선의 저지선을 뚫고 10여 해리를 더 나아가는 과정에서 추격전 상황도 연출됐다.이 어선은 추격과 대치 1시간 20여 분만인 오전 11시30분께 귀항을 위해 뱃머리를 돌렸다.NHK 등 일본 언론은 대만 경비선 6척이 현장에 나타났다고 보도했으나, 대만 당국은 경비선 4척이 파견됐으며 사전에 계획된 조치가 아니라고 설명했다.대만 해안순방서는 만일의 사태 등에 대비해 비상 상황실을 꾸려 가동했다.일본 측도 정부 내에 임시 위기관리센터를 가동해 양측의 접촉 상황 등을 주시하는 등 긴박하게 움직였다.일본 당국은 특히 이날 오전 센카쿠 근해에 중국 해감선(海監船·해양감시선) 3척이 순찰 활동을 위해 모습을 드러내자 대만과 중국 양안 선박이 동시에 센카쿠 해역에 진입해 주권 주장을 하는 상황이 발생할 것을 우려해 바짝 긴장한 것으로 전해졌다.일본은 이번 사태와 관련, 일본 대사관 격인 일본교류협회 타이베이사무소를 통해 양국 간 어업회담 재개를 위해 준비 중인 예비접촉 일정이 연기되는 등 양국 현안 문제에 영향을 미칠 수 있다는 뜻을 밝힌 것으로 알려졌다.대만 외교부는 ""일본 측이 이성적으로 이 문제에 접근할 것으로 희망하며, 양국 간 어업회담 논의에 영향을 주지 않기를 바란다""고 논평했다.취안자푸호는 이날 오전 1시45분 대만 북부 신베이(新北)시 루이팡(瑞芳)구 선아오(深澳)항을 출발했다.이 어선은 출발 당시 대만에서 해양 수호신의 의미가 있는 '마쭈 여신상'을 센카쿠에 설치해 어민의 안전을 기원하겠다는 명분을 제시해 당국으로부터 출항 허가를 받았다.센카쿠 일대는 최근 중국과 일본 전투기들이 상공에서 한때 대치하는 상황이 벌어진 데 이어 일본이 중국 군용기의 센카쿠 접근을 저지하기 위해 경고사격을 검토하고 있다는 소식이 전해지면서 중국이 강하게 반발하는 등 연초부터 긴장이 고조되고 있다.센카쿠는 대만 북단에서 북동쪽으로 170㎞ 떨어진 섬으로 중국, 일본과 함께 대만도 영유권을 주장하고 있다.tjdan@yna.co.krchungwon@yna.co.kr[이 시각 많이 본 기사]☞이동흡 청문보고서 채택 무산..자진사퇴 관측(종합)☞보아, 콘서트서 자작곡 '그건 너' 첫 공개☞박근혜 정부 첫 총리지명자 오후 2시 발표(종합2보)☞""투게더 위캔!"" 스페셜올림픽 한국 선수단 출정(종합)☞전남도의회 '물컵 투척 의원' 징계 절차 착수<연합뉴스 모바일앱 다운받기><포토 매거진><저작권자(c)연합뉴스. 무단전재-재배포금지.>"
27,2013-01-25,'육아 휴직' 썼다간 해고? 출산율 어떻게 올리나,https://news.naver.com/main/read.nhn?mode=LSD&mid=shm&sid1=102&oid=214&aid=0000228375,MBC,"[뉴스데스크]◀ＡＮＣ▶오늘 뉴스 첫머리에 출산율이 조금 높아졌다는 소식 전했는데요.하지만 직장여성들은 여전히 출산과 육아휴직조차 마음 편하게 쓸 수 없는 현실입니다.◀ＡＮＣ▶많은 임산부들이 과도한 업무와 무언의 압박을 견디지 못하고 회사를 그만두고 있습니다.김진희 기자가 취재했습니다.◀ＶＣＲ▶중견기업 영업부 직원이던 30살 이수지씨는 첫 아이를 돌보기 위해 2년 전 육아 휴직을 신청했습니다.직원 3백명 가운데 육아 휴직 신청자 1호.회사측의 달갑지 않은 반응에 휴직기간 동안 자신의 업무를 대신할 사람도 직접 구했습니다.◀ＳＹＮ▶ 이수지/작년 5월 퇴사""(인사과 얘기로는 육아휴직을) 주긴 주는데 회사에서 그리 달가워하지는 않는다고..(그래서) 눈치를 많이 보고 늦게 임신 사실도 알리고..""복직하기 3일 전 원래 자리였던 영업부 대신 고객 지원팀 발령이 나자, 이씨는 압박감에 결국 4년 간의 직장생활을 끝냈습니다.출산 전후 휴가 90일과 육아휴직 1년은 법으로 정해져 있지만, 회사나 주변 사람들의 도움없인 법대로 쓸 수 없는게 현실입니다.한국여성정책연구원 조사결과, 출산 휴가나 육아 휴직을 쓴뒤 복귀해 회사에서 6개월 이상 근무하는 임산부는 10명 중 1명에 불과한 것으로 집계됐습니다.◀ＳＹＮ▶ 김영옥 박사/한국여성정책연구원""90일 출산휴가, 1년 육아휴직 제도는 고용보험 가입 근로자에 한해서 (혜택을 받습니다.)""특히 전체 직장여성 760만명 가운데 2백만명은 고용보험조차 가입되지 않은 영세 업체에서 일하고 있어 임신은 곧 해고나 퇴직을 의미합니다.고용의 연속성이 보장되는 질 좋은 일자리가 늘어나고, 당당하게 아이 낳고 키울 수 있는 기업 문화가 확산되지 않으면, 세계 최저 수준의 출산율을 끌어올리는 덴 한계가 있어 보입니다.MBC뉴스 김진희입니다. (김진희 기자 lamp@mbc.co.kr)[저작권자(c) MBC (www.imnews.com) 무단복제-재배포 금지]"
28,2013-01-25,[단독] 버스기사 폭행범 풀어 준 경찰 '황당',https://news.naver.com/main/read.nhn?mode=LSD&mid=shm&sid1=102&oid=055&aid=0000244080,SBS,"- ""정차 중 폭행…민원실 가서 고소하라""…논란 예상 -<앵커>경찰이 버스 운전기사를 폭행한 현행범을 그 자리에서 풀어주는 황당한 일이 발생했습니다. 신고를 받고 출동한 경찰은 엉뚱하게도 폭행 당할 당시 주행 중이었는지 아니었는지만 따지다가 돌아갔습니다.김학휘 기자의 단독 보도입니다.<기자>시내버스 블랙박스 영상입니다.술 취한 승객이 버스 기사에게 시비를 걸더니 욕설을 퍼붓습니다.다른 승객이 말려도 소용없습니다.[버스 승객 : 조용히 좀 합시다. 그만 해요, 그만 해요.]기사는 버스를 세우고 경찰에 신고합니다.[버스 기사 : 시내버스 기사인데요. 손님 한 분이 타서 자꾸만 운행을 방해하고 계시거든요.]승객은 기사의 멱살을 잡아 마구 흔듭니다.잠시 뒤 도착한 경찰.폭행이 운전 중에 일어났는지, 정차된 다음에 일어났는지만 따집니다.[경찰 : 기사님 운전하는데 폭행을 가했거나 하려고 했죠?]결국 경찰관은 그냥 가버립니다.[버스 기사 : 정차 중에 일어났기 때문에 이건 일반 폭행으로 들어간다 하면서 저보고 처벌을 원하시느냐 해서 원한다 해서 강서경찰서 민원실에 고소장을 접수하셔야 한다고 (했어요.)]경찰이 그냥 돌아가자 버스기사를 폭행한 승객은 차고지까지 쫓아와 행패를 부렸습니다.출동 경찰관은 정차 상태에서 일어난 폭행으론 연행할 수 없단 입장을 고수합니다.[당시 출동 경찰 : 운행 중에 폭행을 했었더라면 저희가 특가법으로 현행범 체포를 하면 되는데 가해자 쪽에서 완강히 부인을 했고.]특정범죄가중처벌법 상 폭행죄 성립 요건인 '운행 중 운전자 폭행'에서 '운행'을 '운전 중'으로 한정해서 판단한 겁니다.[곽대경/동국대 경찰행정학과 교수 : 법 조항을 소극적으로 해석해서 그런 측면이 있습니다. 보다 적극적인 조치를 취했다면 많은 승객들의 안전을 확보할 수 있었을 것으로 기대를 합니다.]경찰은 단순 폭행 고소사건으로 처리하겠다고 밝혔습니다.경찰이 다중의 안전보다 법 형식논리에 치우친 것 아니냐는 논란이 예상됩니다.(영상취재 : 김태훈, 영상편집 : 이승열)관/련/정/보◆ 10년간 회삿돈 250억 원 곶감 빼먹듯 '야금'◆ '대관령서 실종' 70대 남편 뒤늦게 눈 속에서…◆ 울산 자매살인범 김홍일에 사형 선고◆ 강남서 큰불…소방차 36대·소방관 120명 출동◆ 北 ""남한 유엔 제재 동참시 물리적 대응 조치""☞[SBS기자들의 생생한 취재현장 뒷이야기 '취재파일']☞ SBS뉴스 공식 SNS [SBS8News 트위터] [페이스북] [미투데이] [요즘]저작권자 SBS&SBS콘텐츠허브 무단복제-재배포 금지"
29,2013-01-25,"진열대엔 한우, 팔 땐 수입육…못 믿을 직판장",https://news.naver.com/main/read.nhn?mode=LSD&mid=shm&sid1=101&oid=055&aid=0000244077,SBS,"<앵커>요즘 동네마다 한우 직판장들이 많이 생겨나고 있습니다. 다른 곳보다 가격도 싸서 소비자들에게 인기인데요. 한우라고 표시는 돼 있는데 과연 다 믿을 수 있는 걸까요?채희선 기자가 현장 취재했습니다.<기자>인천에 있는 한 한우직판장입니다.600g에 1만 원 안팎으로 시중가의 절반에 팔고 있습니다.진열대에는 한우라고 표기된 쇠고기들이 놓여 있습니다.[(한우 불고기 주세요. 뭐뭐 있어요?) 지금은 다릿살 불고기 9천900원 짜리도 있고, 등심불고기 1만 5천 원 짜리도 있어요.]한우 등심을 달라고 하자, 냉동고에서 고기를 꺼내 옵니다.[(한우 맞죠?) 네.]대기하고 있던 농산물 품질관리원 단속반원에게 사 들고 온 쇠고기를 보여줬습니다.[안동윤/국립농산물품질관리원 단속팀장 : 이것도 수입산으로 의심이 됩니다. 가서 조사를 해보죠.]단속반과 함께 다시 찾아갔습니다.가짜 한우를 판 적이 절대 없다며 딱 잡아 땝니다.[단속반 : 수입 소고기를 한우불고기로 판매한 사실이 없죠?][점원 : 예, 없어요.][단속반 : 없어요? 만약에 있으면 어떻게 할거에요?][점원 : 그럼 구속이죠. (교도소에) 들어가야죠.]냉동고에 있던 쇠고기 덩어리를 꺼내서,[단속반 : 이게 한우에요? 수입육이에요?][점원 : 수입육이니까 수입육 상자에 올려놨잖아요.]조금 전에 사온 쇠고기와 이 수입 쇠고기를 대조하며 추궁하자 그제 서야 잘못을 시인합니다.[단속반 : 그러면 인정하는 거죠?][점원 : 에휴… 예, 죄송합니다.]냉동고 안에는 수입 냉동육 상자가 잔뜩 들어 있습니다.조금 전 제가 한우로 속아서 산 소고기입니다.하지만 냉장고 안을 살펴보니 이렇게 미국산 소고기만 가득합니다.진열대엔 진짜 한우, 팔 때는 냉동고에서 꺼낸 수입육.이런 위장 판매가 최근 늘고 만큼 진열대 쇠고기를 사는 게 그나마 가짜 한우를 피하는 방법이라고 전문가들은 말합니다.(영상취재 : 김태훈, 영상편집 : 이재성)채희선 기자hschae@sbs.co.kr관/련/정/보◆ 10년간 회삿돈 250억 원 곶감 빼먹듯 '야금'◆ '대관령서 실종' 70대 남편 뒤늦게 눈 속에서…◆ 울산 자매살인범 김홍일에 사형 선고◆ 강남서 큰불…소방차 36대·소방관 120명 출동◆ 北 ""남한 유엔 제재 동참시 물리적 대응 조치""☞[SBS기자들의 생생한 취재현장 뒷이야기 '취재파일']☞ SBS뉴스 공식 SNS [SBS8News 트위터] [페이스북] [미투데이] [요즘]저작권자 SBS&SBS콘텐츠허브 무단복제-재배포 금지"
30,2013-01-25,"인수위, 경호처 경호실로 격상 배경은",https://news.naver.com/main/read.nhn?mode=LSD&mid=shm&sid1=100&oid=001&aid=0006059970,연합뉴스,"(서울=연합뉴스) 이세원 기자 = 대통령직인수위원회가 25일 청와대 경호처를 경호실로 격상하기로 한 배경에 관심이 쏠린다.인수위가 `작은 청와대'를 표방하며 조직을 줄인 것과 비교할 때 차관급인 경호처장을 장관급인 경호실장으로 한 단계 올린 것은 의외로 받아들여질 수 있기 때문이다.인수위가 밝힌 승격 배경은 경호처의 독립성 확보, 과중한 업무부담 완화, 사기 진작이다.유민봉 국정기획조정분과위 간사는 이날 언론 브리핑에서 ""경호처는 상당한 독립성이 있다""며 ""경호처의 업무 과중에 대한 요구 사항을 당선인이 수용한 것으로 이해한다""고 말했다.유 간사는 업무 과중을 이유로 들었지만, 경호실 인력을 늘리진 않을 것이라고 밝혔다.그는 ""기관의 장이 차관일 때와 장관일 때 그 구성원이 가지는 사기라든지 이런 것이 있다""며 ""충분히 실질적인 인원이 보강되지 않더라도 상당히 중요한 의미가 있다""고 설명했다.경호실 격상에는 박 당선인이 평소 강조해온 안전의 중요성이 배경이 됐을 것이라는 해석이 나온다.박 당선인은 국민안전을 경제부흥과 함께 정부조직의 양대 축으로 제시했고, 실제 국민의 안전이 중요하다며 행정안전부의 이름을 안전행정부로 바꾸기도 했다.뼈아픈 기억이 영향을 미치지 않았겠느냐는 관측도 있다.박 당선인은 2006년 5월 지방선거 유세 도중 면도칼로 안면을 공격당해 생명이 위태로울 뻔한 `테러'를 겪었다.부친인 박정희 전 대통령이 1979년 차지철 경호실장과 동석한 자리에서 김재규 중앙정보부장의 총에 맞아 서거하고, 모친인 육영수 여사도 1974년 광복절 기념식 도중 조총련계 문세광의 저격을 당하는 비운을 겪었다.`경호 공백'으로 부모를 잃고 본인도 위기를 겪은 박 당선인이 누구보다 뼈저리게 경호의 중요성을 체감한 것이 경호실의 위상을 올려 더 많은 책임감을 부여하는 쪽으로 결정한 이유가 됐다는 시각인 셈이다.그러나 야당은 경호실이 권력으로 행세하던 군사정권 시절이 떠오른다며 비판적 입장을 취했다.민주통합당 김현 대변인은 논평에서 ""청와대의 비대화와 또 다른 권력화를 가져오는 것은 아닌지 우려스럽다""고 밝혔다.sewonlee@yna.co.kr[이 시각 많이 본 기사]☞울산 자매살인범 김홍일에 사형 선고(종합)☞'도둑들' 중국서도 흥행 몰이☞北 ""南 유엔제재 동참시 물리적 대응조치""(종합)☞기보배 ""나중에 장애인양궁 지도자 될래요""☞선자령 기상악화로 실종 70대 노인 이틀째 수색<연합뉴스 모바일앱 다운받기><포토 매거진><저작권자(c)연합뉴스. 무단전재-재배포금지.>"
