,날짜,기사 제목,기사 링크,기사 출처,기사 내용
63,2013-01-25,"박근혜 당선인, 하우스푸어 대책 논의(1보)",https://news.naver.com/main/read.nhn?mode=LSD&mid=shm&sid1=100&oid=008&aid=0002985667,머니투데이,"[머니투데이 이상배 기자]- 윤창중 대통령직 인수위원회 대변인, 25일 오후 서울 삼청동 금융연수원 '인수위 공동기자회견장' 국정과제 토론회 결과 브리핑박근혜 대통령 당선인이 주재한 경제1분과 국정과제 토론회가 끝났다. 오후 2시30분부터 2시간 동안 토론회를 가졌다.박 당선인, 인수위원, 전문위원 간 형식과 내용에 있어 완전한 자유 토론으로 진행됐다. 분위기는 시종 진지한 가운데 이뤄졌다.박 당선인은 보고 중간 중간 사실 관계 등을 확인하고 질문하며 세부적인 내용까지 철처히 점검했다. 인수위원, 전문위원들은 즉석에서 박 당선인에게 답변하며 견해를 피력했다.류성걸 간사는 경제1분과가 그동안 부처 업무보고와 전문가 간담회, 내부 토론 등을 거쳐 정리한 공약과 국정과제 수립·이행 계획, 핵심 현안에 대해 30분간 보고했다.주요 보고 내용에는 경제민주화, 가계부채와 하우스푸어 대책, 조세정의 확립 등 주요 공약의 세부실천 방안과 물가안정, 경기동향, 중소기업 지원 방안, 중산층 70% 달성 방안, 창조경제 구현 방안 등 핵심 현안 상황과 함께 공약 이행을 위한 재원조달 방안 등이 포함됐다.오늘 토론회에서는 가계부채와 하우스푸어 대책에 대한 종합적 대응 방안, 경제민주화 세부 추진계획, 실효성 있는 중기 지원 방안, 패자부활과 청년 도전 뒷받침 등 중산층 복원 방안에 대해 집중 토론했다.박 당선인은 국정운영 패러다임 전환의 큰 시각을 놓치지 말고 개별 공약 이행 방안을 잘 챙겨달라 당부했다. 인수위에서 만든 로드맵을 갖고 새 정부가 잘 실천하게 마지막까지 최선을 다해달라고 했다.[머니투데이 핫뉴스]☞""너희는 노점상 안해봤냐"" 컵밥 내던지며 울분☞장우혁 '300억 빌딩갑부' 비결 ""전화번호부에...""☞[단독]출근길 만원 지하철, '앗 엉덩이에 칼이…'☞'돌연사 논란' 서초구 ""오리털 파카도 사줬다""☞""강남 반값"" 타이어 가격차 왜 심한가 했더니이상배기자 ppark@<저작권자 ⓒ '돈이 보이는 리얼타임 뉴스' 머니투데이, 무단전재 및 재배포 금지>"
64,2013-01-25,"中, 1만t급 어정선 건조 착수…센카쿠 상주",https://news.naver.com/main/read.nhn?mode=LSD&mid=shm&sid1=104&oid=001&aid=0006059716,연합뉴스,"(베이징=연합뉴스) 신삼호 특파원 = 중국이 센카쿠(중국명 댜오위다오) 분쟁에서 일본에 우위를 점하고자 대형 어정선 건조에 들어갔다.중국 조선분야 전문매체 중국선박재선은 25일 내부 관계자의 말을 인용, 중국 최대 규모인 1만t급 어정선이 최근 남부지역의 한 조선소에서 건조에 들어갔다고 밝혔다.이 어정선은 길이 156ｍ, 높이 13.85ｍ, 너비 17.8ｍ의 크기로 최고 항속은 18노트, 지속 항행거리는 1만2천 해리에 이른다. 설계는 중국선박 및 해양공정설계연구소가 실시했다.중국은 이 어정선을 센카쿠 해역에 상주시켜 중국 어선의 어로활동을 보호하는 한편 일본 어선의 활동을 단속한다는 계획이다.1만t급의 대형 어정선 상주를 통해 센카쿠에 대한 주권주장을 강화하는 한편 비군사 분야에서 일본을 압도하겠다는 의도다.하지만 일본이 중국 대형 어정선의 센카쿠 해역 상주를 저지할 것으로 예상돼 양국간 갈등이 더욱 고조될 것으로 예상된다.중국은 해양분쟁 지역에서 상대국을 압도하고자 어정선과 해양감시선 선대 확충과 대형화를 추진하고 있다.중국은 오는 2015년까지 또 다른 1만t급 어정선을 건조, 남중국해에 투입한다는 계획이다.중국은 또 지금까지 퇴역군함 11척을 해양감시선으로 개조, 센카쿠 등의 유사시에 대비한 공격능력을 확충했다.ssh@yna.co.kr[이 시각 많이 본 기사]☞인수위 현장방문 둘째날 감사원 현장센터 방문☞<주말영화> '7번방의 선물' 예매율 1위☞北 ""南 유엔제재 동참시 물리적 대응조치""(종합)☞""사회변화의 기적을 꿈꾼다""…스페셜올림픽 29일 개막☞선자령 기상악화로 실종 70대 노인 이틀째 수색<연합뉴스 모바일앱 다운받기><포토 매거진><저작권자(c)연합뉴스. 무단전재-재배포금지.>"
65,2013-01-25,"서울시의회 교육委 ""학생인권조례 수정·보완 없다""",https://news.naver.com/main/read.nhn?mode=LSD&mid=shm&sid1=102&oid=003&aid=0004946085,뉴시스,"""조례, 학생도 인간임을, 존엄성이 있음을 약속한 것""【서울=뉴시스】김지훈 기자 = 서울시의회가 학생인권조례를 수정·보완할 수 없다는 입장을 분명히 했다.시의회 교육위원회는 25일 오전 기자회견을 열어 ""국제사회의 귀감이 되는 학생인권조례가 일부 정치집단의 왜곡된 시선과 공격을 받고 있다""며 ""시민의 자발적 서명을 통해 만들어낸 조례인 만큼 굳건히 지켜나가겠다""는 입장을 명확히 했다.서울시의회 김형태 교육의원은 ""논란이 되고 있는 소지품 검사 금지 부분 등은 학칙 등을 통해 현장의 상황에 맞게 탄력적으로 운영할 수 있도록 여지를 남겨뒀다""며 ""학생인권조례 때문에 현장에서 지도할 수 없다는 건 사실과 다르다""고 반박했다.학생인권위원회의 위원장을 맡은 한상희 건국대 교수 또한 ""학교 운영에 방해되는 부분이 어디인지 묻고 싶다""며 ""이 조례는 학생을 방조하는 게 아니라 학생들 스스로 자기 생각을 꾸려나갈 수 있게 도와주기 위한 것""이라고 강조했다.한 위원장은 이어 ""인권이 보장될 때 자율적이면서도 평화로운 학교가 만들어질 것""이라며 ""학생인권조례를 굳건히 지켜나가겠다""고 재차 확인했다.학생인권조례를 수정하겠다는 입장을 밝혀온 문용린 신임 서울시교육청 교육감에 대한 불만도 터져 나왔다.윤명화 서울시의회 교육위원회 부위원장은 ""조례를 발의한 의회와 논의도 없이 일방적으로 수정을 추진하겠다는 문용린 신임 교육감의 행태가 우려스럽다""며 ""조례에 대한 일부 정보만을 가지고 전체를 문제시하며 수정을 하겠다고 한다""며 질타했다.이날 기자회견에 참석한 윤명화 의원과 김형태 의원을 비롯해 한만희 위원장 등의 관계자들은 과도기적 혼란이 있을 수는 있지만 이를 침소봉대해서는 안 된다고 입을 모았다.김 의원은 ""진행 과정상 나타나게 되는 착오를 함께 풀어나가려 하지 않고 교과부가 대법원에 제소하는 등 지나친 소모전을 벌여 왔다""고 아쉬워했다.한 위원장은 ""교육청과 의회, 위원회 등이 함께 모여 각론에 대한 이견을 좁혀가는 노력과 더불어 이 조례에 대한 교육과 홍보가 이뤄져야 한다""며 시교육청의 협조를 촉구했다.한편 26일 오후 2시 서울교육청에서는 '서울시 학생인권조례 1주년 기념식과 토론회'가 개최된다. 이날 토론회에는 학생인권위원회 관계자들과 교사, 학부모 등이 참석해 학생인권조례의 성공적인 안착방안을 모색할 예정이다.jikime@newsis.com[뉴시스 이시간 핫 뉴스]ㆍ 3차 핵실험 북한, 핵능력은 어느 정도?ㆍ ´여의도 칼부림´ 범인에 징역 14년 선고ㆍ 70대 노부부, 점퍼도 없이 눈보라속 산 오르다…ㆍ 교수가 수업 중 욕설 논란…음성 파일 유포ㆍ 이외수, 교수들 잇단 비판에 ""그러시라지 뭐""★ 손 안에서 보는 세상, 모바일 뉴시스★ “우리 결혼합니다” 뉴시스 웨딩알리미 ‘두리’<저작권자ⓒ 공감언론 뉴시스통신사. 무단전재-재배포 금지.>"
66,2013-01-25,[종합]'수천억 불법대출' 김찬경 징역 9년 중형 선고,https://news.naver.com/main/read.nhn?mode=LSD&mid=shm&sid1=102&oid=003&aid=0004946779,뉴시스,"법원 ""공소사실 대부분 유죄, 엄한 처벌 불가피""【서울=뉴시스】조현아 기자 = 은행 돈을 횡령하고 수천억원대의 불법대출을 벌인 김찬경(57) 미래저축은행 회장이 중형을 선고받았다.서울중앙지법 형사24부(부장판사 염기창)는 25일 특정경제범죄가중처벌법상 횡령·배임 혐의로 기소된 김 회장에게 징역 9년을 선고했다.재판부는 ""피고인은 예금자의 재산을 보호하고 신용질서 유지를 담당하는 저축은행 본연의 임무를 망각한 채 사실상 은행을 개인의 '사금고화'했다""며 ""상호저축은행법의 각종 규제를 회피하고 부실대출을 통해 수익을 창출했다""며 김 회장의 공소사실 대부분을 유죄로 인정했다.이어 ""배임 대출액이 3028억원, 횡령액이 571억원, 개별차주 신용공여액이 5268억원에 달하는 등 금융시장의 공공성과 안정성을 침해하고 사회 전체에 해악을 입힌 점을 볼 때 엄한 처벌이 불가피하다""고 밝혔다.또 재판부는 김 회장이 지난해 9월 은행이 소유한 앤디워홀의 작품 '플라워(구입가 25억원 상당)' 등 수십억원 상당의 그림을 담보로 제공하고 개인적으로 처분한 혐의에 대해서도 ""은행 소유의 재물을 유상증자에 납입한다는 명목으로 임의처분하는 것은 불법영득의사의 발현""이라며 유죄로 판단했다.김 회장은 충남 아산 골프장 '아름다운CC'의 인수자금 등으로 사용하기 위해 차명으로 된 25명의 차주 명의로 ㈜고월에 3800억원 규모를 불법 대출해주고 은행에 1700억원대의 손해를 입힌 혐의 등으로 구속 기소됐다.아울러 2005년 6월부터 올 3월까지 930억여원을 불법대출하는 등 모두 4300억원대의 불법 대출을 지시한 혐의로도 추가 기소됐다.김 회장은 지난해 5월 금융당국의 영업정지 조치를 앞두고 우리은행 수시입출금계좌(MMDA)에 넣어둔 법인자금 203억여원을 임의로 빼돌린 뒤 경기 화성시 궁평항 선착장을 통해 중국으로 밀항하려다 해경에 체포, 검찰 조사를 받게 됐다.검찰 조사가 진행되는 과정에서 김 회장의 최측근이자 미래저축은행 여신담당인 김모(50·여) 상무와 김 회장의 6촌인 미래저축은행 천안지점장 김모(53)씨가 스스로 목숨을 끊는 사건이 벌어지기도 했다.김 회장은 20대 중반이던 1970년대에는 가짜 서울대 법대생인 것처럼 행세하다가 언론에 보도돼 세상을 떠들썩하게 만든 인물이기도 하다.한편 재판부는 김 회장의 불법대출을 돕고 고객 예금을 빼돌린 혐의(상호저축법 위반)로 기소된 문모 경영기획본부장과 김 회장의 중국 밀항을 도운 혐의(밀항단속법 위반)로 기소된 운전기사 최모씨에게 각각 징역 3년에 집행유예 5년, 사회봉사 200시간과 징역 2년6월에 집행유예 4년, 사회봉사 160시간을 선고했다.hacho@newsis.com[뉴시스 이시간 핫 뉴스]ㆍ 북한 ""남한 유엔제재 가담하면 물리적 대응""ㆍ 이상득 前의원 항소…특별사면 어려울 듯ㆍ 울산 자매 살인범 김홍일, 1심 사형 선고ㆍ [단독]태안서 남학생 7명이 여고생 집단 성폭행ㆍ 앤절리나 졸리, 브래드 피트 아이 임신?★ 손 안에서 보는 세상, 모바일 뉴시스★ “우리 결혼합니다” 뉴시스 웨딩알리미 ‘두리’<저작권자ⓒ 공감언론 뉴시스통신사. 무단전재-재배포 금지.>"
67,2013-01-25,총리 비서실 신설··靑 경호실 승격,https://news.naver.com/main/read.nhn?mode=LSD&mid=shm&sid1=100&oid=008&aid=0002985616,머니투데이,"[머니투데이 이상배,이미호 기자][(상보) ""실효성 있는 대통령 직속 위원회는 총리실로 이관""]국무총리를 보좌하는 차관급 총리 비서실장이 신설되고, 청와대 경호처장은 장관급 경호실장으로 승격된다.윤창중 대통령직 인수위원회 대변인은 25일 오후 서울 삼청동 금융연수원 '인수위 공동기자회견장'에서 브리핑을 갖고 ""총리를 보좌할 수 있게 차관급 총리 비서실장을 둘 계획""이라며 ""현재 있는 국무총리실은 국무조정실로 명칭을 변경한다""고 밝혔다.윤 대변인은 또 ""대통령실을 비서실로 개편하면서 경호실을 비서실에서 분리해 실장을 장관급으로 높인다""고 말했다.청와대 외교안보수석과 국가안보실의 역할 분담 방안도 소개됐다. 외교안보수석은 외교 국방 통일 문제 현안 업무를 중심으로 대통령의 지시 사항을 점검하는 등 대통령의 국가안보 정책을 보좌하며 다른 수석실과의 업무협조를 하게 된다. 반면 국가안보실은 중장기적 안보전략 수립함과 동시에 국가 위기 상황에 신속히 대응하기 위한 위기관리기능을 수행하게 된다. 국가안보실은 대통령을 직접 보좌하고, 국가안보실장은 장관급이 된다.이와 관련, 유민봉 인수위 국정기획조정분과 간사는 ""대통령 직속 위원회는 국민대통합위원회, 청년위원회, 지역발전위원회를 신설 및 유지하고, 나머지는 폐지를 원칙으로 한다""면서도 ""실효성 있는 위원회의 경우에는 일부 총리실로 이관될 가능성이 있다""고 밝혔다.이어 유 간사는 ""총리실 직속 위원회와 각 부처 위원회도 실효성을 근거로 폐지와 존치를 결정하게 된다""고 덧붙였다.[머니투데이 핫뉴스]☞""너희는 노점상 안해봤냐"" 컵밥 내던지며 울분☞장우혁 '300억 빌딩갑부' 비결 ""전화번호부에...""☞'돌연사 논란' 서초구 ""오리털 파카도 사줬다""☞""강남 반값"" 타이어 가격차 왜 심한가 했더니☞[단독]출근길 만원 지하철, '앗 엉덩이에 칼이…'이상배,이미호기자 ppark@,best@<저작권자 ⓒ '돈이 보이는 리얼타임 뉴스' 머니투데이, 무단전재 및 재배포 금지>"
68,2013-01-25,16억원 횡령 혐의 새마을금고 여직원 붙잡혀,https://news.naver.com/main/read.nhn?mode=LSD&mid=shm&sid1=102&oid=001&aid=0006059590,연합뉴스,"(대구=연합뉴스) 김선형 기자 = 새마을금고에서 16억원을 횡령한 뒤 잠적한 여직원이 경찰에 붙잡혔다.대구 동부경찰서는 25일 고객 명의를 도용해 대출을 받아 16억여원을 챙긴 혐의(횡령)로 대구시내 모 새마을금고 직원 권모(40·여)씨를 붙잡아 조사를 하고 있다.권씨의 횡령은 정기예금 기간이 끝난 한 고객이 권씨가 일하는 곳이 아닌 다른 지점에서 인출을 하다가 맡긴 금액이 사라진 것을 확인해 들통났다.횡령 사실이 드러나자 권씨는 16억원을 가로챘다고 동료 직원들에게 말하고 지난 22일 자취를 감췄다.새마을금고중앙회 대구지점은 예금주들에게 입금 상황을 통지하는 등 자체 감사를 벌이고 있다.sunhyung@yna.co.kr[이 시각 많이 본 기사]☞인수위 현장방문 둘째날 감사원 현장센터 방문☞<주말영화> '7번방의 선물' 예매율 1위☞北 ""南 유엔제재 동참시 물리적 대응조치""(종합)☞""사회변화의 기적을 꿈꾼다""…스페셜올림픽 29일 개막☞선자령 기상악화로 실종 70대 노인 이틀째 수색<연합뉴스 모바일앱 다운받기><포토 매거진><저작권자(c)연합뉴스. 무단전재-재배포금지.>"
69,2013-01-25,"인수위, 대통령 경호실 비서실서 분리..실장 장관급 격상",https://news.naver.com/main/read.nhn?mode=LSD&mid=shm&sid1=100&oid=018&aid=0002720487,이데일리,"[이데일리 박원익 기자] 윤창중 인수위 대변인은 25일 서울 삼청동 인수위 공동기자회견장 브리핑을 통해 “대통령실을 비서실로 개편함에 따라 경호실을 비서실로부터 분리하고 실장을 장관급으로 보하고자 한다”고 밝혔다.박원익 (wipark@edaily.co.kr)[관련기사]☞ 애플, 목표가 곤두박질..주가폭락에 거래중단까지☞ [손톱 밑 가시]④'대기업이 꼭 이런 사업까지 해야 하나요'☞ 기아차, 새로운 콘셉트카 공개.. '닛산 쥬크 닮은 꼴'☞ LTE 데이터 무제한에 경쟁사들 긴장..초고속인터넷 대체는?☞ 채용공고에는 없지만 꼭 갖춰야 할 필수조건은?▶ 당신의 생활 속 언제 어디서나 이데일리 ‘신문 PDF바로보기‘▶ 스마트 경제종합방송이데일리 TV▶ 실시간 뉴스와 증권거래, 내 손안의 금융시장 ‘이데일리 모바일 서비스’＜ⓒ종합 경제정보 미디어 이데일리 - 무단전재 & 재배포 금지＞"
70,2013-01-25,설 앞두고 비축 농수산물 최대 46% 싸게 판다,https://news.naver.com/main/read.nhn?mode=LSD&mid=shm&sid1=101&oid=001&aid=0006059508,연합뉴스,"(세종=연합뉴스) 박수윤 기자 = 설 물가 안정을 위해 정부가 비축 농수산물을 도매가격보다 최대 46% 싸게 판다.정부는 25일 서울 미래기획위원회에서 주형환 기획재정부 차관보 주재로 물가안정책임관회의를 열어 이런 내용의 물가안정 대책을 마련했다.우선 오는 28일부터 다음 달 8일까지 정부가 비축한 농수산물 6종을 전국 30개 전통시장에 저렴한 값에 공급한다.상자당 가격은 냉동 명태 2만6천원, 냉동 고등어 2만200원, 냉동 오징어 2만6천~4만2천원, 냉동 조기 10만6천원, 냉동 갈치 11만5천원, 전남 해남산 월동배추 4천800원 등이다. 도매가에 비해 수산물은 8~30%, 월동배추는 46% 싸다.전통시장 활성화를 위해 정부와 기업이 함께 나선다.공공기관과 대기업에선 전통시장에서 사용할 수 있는 '온누리상품권'을 650억원 어치 구입하기로 했다.정부는 91개 전통시장에서 설 선물용ㆍ제수용 우수상품을 골라 정부 부처와 지방자치단체, 공공기관, 대기업에 추천하기로 했다.전통시장에선 주말과 공휴일에 253곳, 평일에 98곳 등 시장 주변의 주ㆍ정차를 허용하기로 했다.오는 31일 의무화하는 '옥외가격표시제'의 정착 방안도 마련했다.당분간 옥외가격표시제를 150㎡ 이상 음식점과 66㎡ 이상 이ㆍ미용업에만 적용하는 만큼, 의무 대상이 아닌 업소도 자율적으로 참여하도록 유도하기로 했다.상반기에 관계부처 합동 점검을 하면서 학원ㆍ교습소, 체육시설업, 세탁업, 목욕장업 등으로 의무실시 대상을 늘릴 방침이다.이밖에 정부는 '공공부문 유류 공동구매 제도'를 점검한 뒤 다음 달 6일 물가관계장관회의에서 다시 논의하기로 했다.clap@yna.co.kr[이 시각 많이 본 기사]☞인수위 현장방문 둘째날 감사원 현장센터 방문☞<주말영화> '7번방의 선물' 예매율 1위☞선자령 기상악화로 실종 70대 노인 이틀째 수색☞""사회변화의 기적을 꿈꾼다""…스페셜올림픽 29일 개막☞<택시법 대체입법 '속전속결'…정부 총력전><연합뉴스 모바일앱 다운받기><포토 매거진><저작권자(c)연합뉴스. 무단전재-재배포금지.>"
71,2013-01-25,"대통령 경호실, 장관급으로 격상(1보)",https://news.naver.com/main/read.nhn?mode=LSD&mid=shm&sid1=100&oid=008&aid=0002985602,머니투데이,"[머니투데이 이상배 기자]- 윤창중 대통령직 인수위원회 대변인, 25일 오후 서울 삼청동 금융연수원 '인수위 공동기자회견장' 국무총리실 조직 개편 등 관련 브리핑박근혜 대통령 당선인이 참석한 가운데 진행되고 있는 국정과제 토론회 중간에 나왔다.그동안 3차례 정부조직 개편안, 비서실 개편안 발표한 데 이어 비서실 및 국무총리실 개편안에 대해 발표하겠다.총리를 보좌할 수 있게 차관급 총리 비서실장을 둘 계획이다.국무총리실은 국무조정실로 명칭을 변경한다.대통령실을 비서실로 개편하면서 경호처를 비서실에서 분리해 실장을 장관급으로 높인다.[머니투데이 핫뉴스]☞""너희는 노점상 안해봤냐"" 컵밥 내던지며 울분☞장우혁 '300억 빌딩갑부' 비결 ""전화번호부에...""☞'돌연사 논란' 서초구 ""오리털 파카도 사줬다""☞""강남 반값"" 타이어 가격차 왜 심한가 했더니☞[단독]출근길 만원 지하철, '앗 엉덩이에 칼이…'이상배기자 ppark@<저작권자 ⓒ '돈이 보이는 리얼타임 뉴스' 머니투데이, 무단전재 및 재배포 금지>"
