,날짜,기사 제목,기사 링크,기사 출처,기사 내용
0,2013-01-25,[탐사보도 ‘세상 속으로’]섬뜩하게 닮은 ‘욕망의 눈빛’들 우르르… 주차장엔 먼지 앉은 외제차,https://news.naver.com/main/read.nhn?mode=LSD&mid=shm&sid1=102&oid=032&aid=0002298727,경향신문,"강원랜드 인근의 한 전당포 주차장에 저당잡힌 차들이 뽀얀 먼지에 뒤덮인 채 주차돼 있다.  정선 | 류형열 기자 rhy@kyunghyang.comㆍ강원랜드 르포후줄근한 옷차림에 무표정한 얼굴. 어떤 희로애락의 감정도 없는 듯했다. 오직 하나 눈빛만 희번덕거렸다. 욕망에 깊숙이 사로잡혀 있는 눈이었다. 사람마다 옷차림이나 생김새는 다 달랐지만 분위기는 섬뜩할 만큼 비슷했다.지난 12일 강원도 정선 강원랜드. 개장 시간인 오전 10시가 아직 한참 남았는데도 강원랜드 출입구 주위에는 벌써부터 입장을 기다리는 사람들로 넘쳐났다. 서울서 카지노를 즐기러 종종 온다는 이모씨는 “주변 사람들을 보면 ‘나도 저런 얼굴일까’라는 생각이 들어 섬뜩할 때가 많다”고 말했다.오전 10시. 욕망의 문이 마침내 열렸다. “1번부터 10번까지 들어오세요”라는 안내방송에 맞춰 사람들이 속속 대박의 꿈을 안고 카지노로 빨려들어갔다. 자리를 차지하려는 전쟁이 채 끝나기도 전에 게임은 시작된다. 블랙잭과 바카라, 룰렛, 다이사이까지 순식간에 빈자리를 찾아볼 수 없다. 자리에 앉은 사람은 보통 운이 좋은 게 아니다. 나머지는 하루종일 서서 게임을 해야 한다.갑자기 블랙잭이 열리는 한 테이블에서 사람들의 환성이 터져나왔다. 딜러가 버스트(딜러 카드가 21을 초과한 것)되며 자리에 앉은 모든 사람들이 돈을 딴 것이다. 사람들의 얼굴에 웃음이 번지고, 공치사가 오가고, 좋은 흐름에 대한 기대가 넘친다. 하지만 흐름은 곧 바뀐다. 한 사람의 잘못된 플레이로 판을 지기라도 하는 순간에는 욕설과 빈정이 오가기도 한다.“내가 블랙잭만 12년 했다. 딜러가 로 바닥(낮은 숫자)인데 12에서 받으면 안돼. 확률적으로 그렇다구. 괜히 받아서 다 죽었잖아. 그걸 왜 받아.”60대의 한 여성이 분을 참지 못하고 계속 지근거린다. 한 중년남자가 받는다. “담배 한 대 빨고 합시다.”카지노는 잔인하다. 절박한 사정을 봐주지도 않고, 마지막 희망을 너무도 무심하게 산산조각낸다. 돈을 다 잃은 사람이 얼굴이 벌개져 슬그머니 자리를 뜬다.로비에는 이런 사람을 겨냥한 삐끼들이 서성거리고 있다. “200만~300만원에서 많게는 2000만원까지 차를 담보로 맡겨 놓고 돈을 빌려간다. 많으면 하루에 3대 정도 된다”는 게 한 삐끼의 말이었다.인근 전당포 주차장에 가보니 그 말이 실감났다. 거의 빈자리가 없을 정도로 차들이 빼곡히 들어차 있었다. BMW와 렉서스 등 고급 외제차들도 많이 눈에 띄었고, 트럭과 택시도 보였다. 지하 1층 주차장엔 BMW 한대가 뽀얗게 먼지가 쌓인 채 주차돼 있었다.다방에서 만난 한 50대 주민은 “9억5000만원 정도 날렸다. 강원랜드는 쳐다보지도 않는다”고 말했다. 또다른 주민은 “강원랜드 개장 뒤 주변 사람들 다 망했다. 호텔, 모텔 주인들 다 서울 사람들로 바뀌었다”고 말했다.“사북 주민 중 홀딱 망하지 않은 사람은 열손가락에 꼽을 정도야. 돈을 다 날리고도 못 끊어. 월셋집에 살면서 카지노 앵벌이하는 사람도 많다니까.”그의 마지막 말은 도박공화국에 던지는 경고처럼 들렸다.“인천에 내국인 카지노가 생길지도 모른다구? 강원도 산골도 이 모양인데 수도권에 내국인 카지노가 들어서면 온 나라가 거덜날 거야. 나라 망해.”<류형열 기자 rhy@kyunghyang.com>[관련기사]▶ [탐사보도 ‘세상 속으로’]카지노, 외국인 전용으로 시작했다가 내국인 출입 허용까지 갈까▶ [탐사보도 ‘세상 속으로’]일본 업체에 영종하늘도시 165만㎡를 평당 150만원에 매각 예정▶ [탐사보도 ‘세상 속으로’]카지노 ‘큰손 잡아라’ 사활▶ [탐사보도 ‘세상 속으로’]카지노 ‘독배일까 성배일까’모바일 경향[종이신문 그대로 안드로이드폰에서 보자!]| 공식 SNS 계정[경향 트위터][미투데이][페이스북][세상과 경향의 소통 Khross]- ⓒ 경향신문(www.khan.co.kr), 무단전재 및 재배포 금지〈경향신문은 한국온라인신문협회(www.kona.or.kr)의 디지털뉴스이용규칙에 따른 저작권을 행사합니다.〉"
1,2013-01-25,이 아이는 누구랑 살고 싶을까?,https://news.naver.com/main/read.nhn?mode=LSD&mid=shm&sid1=102&oid=036&aid=0000028661,한겨레21,"[한겨레21][이슈추적]생후 18일 만에 미국으로 불법 입양되어 ‘난민’ 상황에 처한 아이… 정부 “한국인 양부모가 데려올 준비”*미국 언론에서는 불법 입양이 시도된 한국 국적 아이의 실명과 사진을 공개했습니다. <한겨레21>은 아이의 신변을 보호하고자 ‘지영’이라는 가명을 사용합니다. _편집자2012년 6월28일. 태어난 지 18일밖에 되지 않은 한국인 영아 지영이는 미국 국적의 한국계 여성 ㄷ(49)씨 품에 안겨 미국 일리노이주 시카고 오하라 국제공항에 도착했다. 그로부터 6개월 뒤, 12월10일 미국 일리노이주 쿡 카운티 법원에서는 유례를 찾아보기 힘든 재판이 시작됐다. 보건복지부는 미국인 ㄷ씨 부부(남편은 백인으로 55살)가 한국의 ‘입양 촉진 및 절차에 관한 특례법’(입양특례법)에 저촉되는 불법 입양을 시도했다며 이들에게 후견권을 부여한 결정을 무효화해달라는 소송을 냈다. 새해 1월9일, 주법원은 지난해 11월 내린 후견권 부여 결정을 무효화한다고 판결했다. 한국 국민인 지영이를 입양하면서 해당국 법원이나 관청에서 어떤 증빙서류도 발급받지 않은 것은 문제가 있어 보인다는 것이다. 아이를 데려오는 과정에서 불거진 한국법 및 미국 이민법 위반 문제를 재판부에 제대로 알리지 않은 채 후견권을 취득했기 때문에, 이 부부가 후견권을 가지는 것은 아이에게 최선의 이익이 되지 못한다는 판단도 있었다. 1월14일 연방법원 일리노이 북부지원은 이들이 미 국토안보부(DHS)를 상대로 제기한 지영이 인신인도 신청을 기각하고, 아이의 거취는 미 연방정부 난민재정착센터(ORR)에서 결정하라고 판결했다. 아이의 인신인도 소송은 불법 입양으로 봐야 한다는 한국 보건복지부의 통보에 따라 지난해 11월9일 국토안보부가 아이를 부부와 격리시키는 조처를 취하자 제기된 소송으로, 재판 과정에서 법원은 주법원이 부여한 후견권에 따라 지영이를 부부가 돌보도록 했다.ㄷ씨 부부, 법상 입양 가능 조건 안 돼현재 법적으로 ㄷ씨 부부는 지영이에 대한 후견권이 없다. 그러나 아이는 미국 시카고 근교 에번스턴에 위치한 ㄷ씨 부부네 집에 있다. 1월11일치 <시카고트리뷴>을 보면 이 부부는 자신들이 지영이를 돌봐야 한다고 주장한다. 이들은 한국 정부가 아이를 정치적 인질로 이용하고 있다며 지영이가 한국에 돌아가게 되면 고아원으로 보내지리라 우려한다고 신문은 전했다. 미국 언론들은 ‘아이가 한국으로 송환되는 것이 최선이냐’는 질문을 던지기도 한다. 씁쓸한 질문에 대한 답을 찾으려면, 핏덩이 지영이가 어떻게 미국까지 가게 됐는지 따져볼 필요가 있다. 지난 7개월 동안 지영이에겐 무슨 일이 벌어진 걸까.지영이는 2012년 6월10일 경남 통영의 한 병원에서 태어났다. 당시 아이의 엄마(1992년생)·아빠(1994년생)는 만 20살이 되지 않은 미성년자였다. 엄마 김아무개씨는 지영이를 출산하기 4개월 전, 통영에 위치한 사회복지법인 부설 미혼모자공동생활가정 시설에 들어간다. 자녀를 양육하는 미혼모의 자립을 도우려고 설립돼 국가 지원을 받는 시설이다. 시설에 들어올 당시, 김씨는 생후 6개월 된 첫아이를 기르고 있었다. 두 아이의 양육은 어린 엄마에겐 큰 부담이었을 터이다. 아이가 한국을 떠나기 이틀 전인 6월26일자로 미국 입양 동의서 및 친권 포기 각서가 작성된다. 이 문서엔 지영이 부모, 외조부모, 친조부 등의 이름이 쓰여 있다. ㄷ씨 부부는 친부모 각서만 있으면 아이를 미국으로 데려오는 데 문제가 없다는 법률 자문을 받았다고 주장한다. 보건복지부는 지영이를 ‘요보호아동’(부모 보호와 양육을 받지 못하는 18살 미만 아동)으로 봐야 한다며, 민법상 사적 입양 대상이 될 수 없고 당시 입양특례법 적용을 받아 입양기관을 통해서만 입양이 가능하다고 판단했다. 한국 정부는 이들이 한국 입양법에 대해 잘 알고 있었을 것이라고 의심한다. ㄷ씨 부부는 2002년 입양특례법에 따라 한국인 아이를 입양한 경험이 있다. 지영이를 데려갈 당시 부부는 한국법이 요구하는 입양 가능 부모 조건을 갖추지 못했다. 한국 국민이 아니라면, 25살 이상 45살 미만만 양친이 될 수 있기 때문이다.지난해 6월 초, 아내 ㄷ씨는 지영이를 미국으로 데려가려고 10살짜리 딸과 함께 한국에 입국한다. 지영이가 태어나기 전이다. 통영에 있는 임산부와 미국 시카고에 사는 부부의 연결고리가 된 이들은 서아무개 목사와 아이 엄마가 머무는 시설의 이아무개 원장이다. 서 목사는 <한겨레21>과의 통화에서 “아는 교회 집사를 통해 미국인 부부를 소개받았고, 통영 시설은 우리 교회를 통해서 알게 된 것”이라고 말했다.한국 국적의 아이를 미국으로 데려가려면 미국 입국을 위한 비자가 필요했다. 만약 ㄷ씨 부부가 시간이 걸리더라도 적법한 입양 신청 절차를 진행했다면, 아이에겐 입양비자(IR3 또는 IR4)가 발급됐을 것이다. 그러나 지영이 여권으로 미국 비자면제프로그램(VWP)이 신청됐다. 비자면제프로그램은 여행 및 상용 목적으로만 사용할 수 있다. ㄷ씨 부부에게 의뢰를 받은 국내 로펌 소속의 한국인 미국변호사는 아이를 비자면제프로그램으로 데려간 뒤 미국에서 입양 신청을 하라는 의견서를 써주었다. 2012년 6월28일 인천공항에서 미국 국적의 여성이 한국 국적의 핏덩이를 데리고 출국 심사를 마쳤지만 이를 미심쩍게 여기는 사람은 없었다. 한국은 출입국 심사 과정에서 아동 탈취를 막는 제도가 갖춰져 있지 않다. 미국 공항에 도착하자, 지영이의 적법하지 못한 비자 문제가 드러났다. 공항에 억류돼 조사를 받던 ㄷ씨는 친부모가 작성한 각서 등을 제출해 입양하려는 아이임을 주장했고, 미 당국은 지영이를 입국시킨다. 11월8일 미국 국토안보부는 부부가 입양 합법성을 증명하는 서류를 가져오지 못하자, 주한 미국대사관을 통해 ‘의심스러운 사건’ 검토를 한국의 보건복지부에 요청한다. 이로 인해 한국 정부에 지영이 문제가 알려지게 된다.당시 외교통상부나 법무부 등은 사건 대응에 미온적인 태도였다고 한다. 여전히 많은 한국인들이 국외 입양을 ‘불쌍한 아이들이 선진국 부자 부모를 만나 새로운 인생을 살 수 있는 길’로 생각한다. 한국은 경제협력개발기구(OECD) 회원국 가운데 국외 입양을 보내는 유일한 나라다. 2011년 국외로 입양된 아이 수는 916명. 이 가운데 88%는 미혼모 자녀다. 미혼모 시설 원장과 목사는 기자에게 억울함을 토로했다. 가엾은 아이와 미혼모를 위해 좋은 부모를 빨리 찾아주려다 생각지도 못한 곤경에 처했다는 하소연이었다.OECD 국가 중에 해외 입양 허용 유일이들의 말은 진심일지 모른다. 그러나 좋은 의도가 곧 아이의 행복으로 연결되진 않는다. 2008년 발행된 보건복지부 연구용역 보고서 ‘국외 입양인 실태 조사 및 효율적 입양 사후 서비스 제공 방안’을 보면, 1970~80년대 미국·유럽 등지로 입양된 한국인 277명 가운데 약 80%가 삶에서 정체성 위기를 경험했다. 인종을 넘어선 입양은 아이에게 문화·사회적 충격을 유발할 수 있다는 분석이다. 미국으로 입양된 한국인이자 진실화해를위한해외입양인모임(TRACK) 대표인 제인 정 트렌카는 국외 입양에 대해 더욱 냉정한 진단을 내놓는다. “미국 내에서도 입양을 기다리는 유색 인종 아이는 많다. 국외 아동보다 미국 내 아동을 입양하는 비용이 더 적게 든다. 그러나 자국 아동을 입양할 경우 친모와 아이를 만나게 해줘야 하고, 친모의 요구를 들어줘야 한다. 인권 후진국에서 아이를 입양하면 이런 간섭을 받지 않아도 된다. 더구나 한국 아이들은 동유럽이나 중국 아이들보다 건강 상태가 좋다.” 아동권리 전문가들은 국가가 미혼모 등이 친자녀를 양육할 수 있는 환경을 조성해줘야 하며, 국외 입양보다 국내 입양을 우선적으로 고려해야 한다고 강조한다.불법 국외 입양 시도와 계속되는 송사로 가장 큰 피해를 입는 건 지영이다. 이런 피해를 유발한 책임 소재의 규명은 지지부진한 상태다. 지난해 11월 보건복지부는 미혼모 시설 원장, 미국인 부부, 목사 등을 형법 및 아동복지법 위반 혐의로 서울중앙지검에 고발했다. 현재 이 사건을 수사 중인 경남지방경찰청 관계자는 “최근에야 우리 쪽으로 사건이 넘어와 아직 수사 초기 단계”라며 “미국인 수사와 관련해서는 외교적 문제가 있어 구체적 내용을 밝히기가 곤란하다”고 말했다. ㄷ씨 부부는 지영이를 미국으로 데려가려고 적지 않은 돈을 쓴 것으로 알려졌다. 1월11일치 <시카고트리뷴>을 보면, 아내 ㄷ씨는 미혼모 시설 원장에게 일종의 후원금으로 4800달러를 건넸고, 그 외에 아이의 친모·변호사·목사 등에게 현금을 지급했다고 법정에서 진술했다. 이런 비용이 아이를 데려오는 대가가 아니냐는 지적에 대해서는 부인했다. 미혼모 시설 원장은 “ㄷ씨가 불쌍한 엄마들을 위해 쓰라며 간곡히 부탁해 돈을 받은 것”이라며 “개인적으로 돈을 썼다면 문제가 되겠지만 후원금 통장에 입금했다”고 해명했다.지영이의 삶 위한 최선의 선택은지영이가 한국으로 돌아올지, 계속 미국에 머물지는 아직 확정되지 않았다. ㄷ씨 부부는 1월10일 주법원에 새로운 입양 신청을 제기했고, 1월16일 연방법원에 국토안보부를 상대로 지영이의 인신보호 신청을 냈다. 아이를 포기할 수 없다는 움직임이다. 한국 정부는 최대한 이른 시일 안에 한국 송환이 이루어져야 아이가 입을 피해를 최소화할 수 있다는 태도다. 보건복지부 이경은 아동복지정책과장은 “아이의 법적 후견인이 정해졌고, 공개 입양 경험이 있는 한국인 부부가 지영이 입양을 신청해 양부모 후보로 선정된 상황”이라며 “한국인 부부가 직접 미국으로 가 아이를 데려올 준비가 돼 있고, 아이가 한국으로 돌아오는 즉시 해당 가정에서 위탁보호될 수 있게 관련 절차도 마무리한 상태”라고 밝혔다.복잡하게 얽힌 상황에서, 지영이의 삶을 위한 최선의 선택이 무엇인지 단언하기는 어렵다. 그러나 아이는 한국에서 함께 살 수 있는 방법을 찾을 만큼 충분한 시간적 여유도 없이 미국으로 보내졌다. ㄷ씨 부부가 양부모로서 자격이 적합한지 알 수도 없다. 이런 상황을 묵인하고, 미국 땅에서 그저 잘 자라기만 바라는 것은 이미 한 번 한국 사회가 안전하게 보호하지 못했던 아이를 두 번 버리는 일이 되는 건 아닐까.박현정 기자saram@hani.co.kr공식 SNS[통하니][트위터][미투데이]| 구독신청[한겨레21][한겨레신문]Copyrights ⓒ 한겨레신문사, 무단전재 및 재배포 금지<한겨레는 한국온라인신문협회(www.kona.or.kr)의 디지털뉴스이용규칙에 따른 저작권을 행사합니다.>"
2,2013-01-25,[집중취재] 2만원대 '알뜰폰' 전쟁‥편의점폰까지 등장,https://news.naver.com/main/read.nhn?mode=LSD&mid=shm&sid1=105&oid=214&aid=0000228382,MBC,"[뉴스데스크]◀ＡＮＣ▶요즘 동네 편의점에서도 휴대전화를 팔고 있는데 혹시 알고 계신가요?통화요금이 워낙 저렴해서 이른바 알뜰폰으로 불리는데요.바로 이 제품들입니다.기본요금도 통신 3사의 3분의 1 수준이어서 4500원 정도만 내도 사용할 수 있습니다.게다가 알뜰폰의 기기값이 갈수록 낮아지면서 최근 2만원대 제품까지 출시가 됐다고 합니다.편의점뿐만이 아닙니다.대형마트들도 이런 저가형 휴대전화 시장에 뛰어들고 있는데요.이렇게 유통업계가 알뜰폰 시장에 주목하는 까닭이 뭘까요?송양환 기자가 취재했습니다.◀ＶＣＲ▶편의점 입구에 자리잡은 휴대전화 코너.규모는 작아도 웬만한 통신사 대리점 못지 않습니다.깔끔하게 포장 진열된 휴대전화는 3만 원도 채 안 되는 가격.중고폰이지만 겉보기에 새 제품과 다를 게 없고 품질 보증서까지 갖췄습니다.개통도 간편합니다.계산대에서 바코드를 찍고 구입한 뒤 칩만 꽂으면 바로 쓸 수 있습니다.◀ＩＮＴ▶ 김정윤 주임/BGF리테일""이동통신사 대리점을 통해서 구입해야 한다는 고정관념을 고객들이 가지고 있는데요, 단말기 선택의 폭을 넓히면서도 부담없이 누구나 구매할 수 있는..""일명 편의점폰의 가격 대는 3만 원에서 비싸야 7만 원대.얼마 동안 써야 한다는 약정도 없고 저렴한 요금제에 통신사를 마음대로 고를 수 있는 것도 장점입니다.◀ＩＮＴ▶ 김원식/편의점폰 이용자""기존에는 월 9만원 정도가 나왔었는데 지금은 스마트폰 요금제를 5만원 정도로 낮췄고요.""편의점폰은 가격은 저렴하지만 기존 통신사망을 그대로 사용하기 때문에 통화 품질이나 서비스는 전혀 손색이 없습니다.기존 점포를 그대로 활용해 상품 구색을 갖출 수 있는 만큼, 편의점 업계는 휴대전화 판매를 더 늘릴 태셉니다.◀ＩＮＴ▶ 박종서 대리/GS리테일""편의점에서 개통도 손쉽게 할 수 있고 최신 단말기도 판매할 수 있는 그런 시장을 만들어 나갈 것으로 예상합니다.""서비스는 비슷하게, 가격은 훨씬 싸게, 탄탄한 유통망을 무기로 한 편의점폰 확산에 기존 통신사도 긴장하고 있어 통신시장 판도 변화와 요금인하 효과까지 기대됩니다.MBC뉴스 송양환입니다.(송양환 기자 rainbow@mbc.co.kr)[저작권자(c) MBC (www.imnews.com) 무단복제-재배포 금지]"
