,날짜,기사 제목,기사 링크,기사 출처,기사 내용
38,2016-05-25,탈출 여종업원 체류설 태국 뒤숭숭북한식당은 내부수리중,https://news.naver.com/main/read.nhn?mode=LSD&mid=shm&sid1=100&oid=001&aid=0008424764,연합뉴스,"방콕 시내 북한식당인 평양아리랑관이 문앞에 내건 휴업 안내문방콕 평양옥류식당 휴업기간 석달로 연장…""관리자·종업원은 아직 태국에""(방콕=연합뉴스) 김상훈 특파원 = 중국 내 북한식당에서 2차로 탈출한 종업원들이 태국에 머물고 있다는 소식이 전해진 24일 오전 11시 45분(현지시간).태국의 수도 방콕 중심가인 수쿰윗 26번가 큰길 가에는 점심을 해결하기 위해 쌀국수 노점을 찾은 사람들이 긴 줄을 이뤘다.그러나 이들이 줄을 선 보도 넘어 '평양 아리랑관'의 문은 굳게 닫혀 있었다.식당으로 들어가는 길목 오른쪽 담장에는 개보수 작업을 위해 가게 문을 닫는다는 안내문이 내걸렸다.눈에 띄는 건 휴업 안내문의 휴업 기간 표시다. 처음 써놓았던 문구 위에 흰색 칠을 한 뒤 추가로 연장된 기간을 표시한 흔적이 보였다.방콕 시내 북한식당 평양아리랑관의 휴업 안내 표시문. 기존에 표시됐던 날짜 위에 새로 연장된 휴업기간을 표시한 흔적이 보인다.방콕 시내에 있는 2개의 북한식당 가운데 한 곳인 평양 아리랑관은 지난 3월 초 유엔 안전보장이사회가 북한에 대한 제재 결의 2270호를 채택한 이후 얼마 지나지 않아 문을 닫았다.처음에는 3월 20일부터 4월 20일까지 한 달간 휴업을 알렸다. 그러나 이후 다시 5월 20일까지로 휴업 기간을 연장했고, 이번에 또 다시 한 달간 추가 휴업을 알렸다.중국 닝보(寧波)의 류경식당 종업원 집단 탈북의 여파가 한창이던 지난달 21일 식당 영업 여부를 확인하러 기자가 방문했을 당시 자신을 식당 직원이라고 소개한 태국 중년 남성은 ""내부 수리 중이다. 식당은 아무런 문제가 없고 조만간 다시 영업할 것""이라며 ""종업원들은 잠시 북한에 돌아갔다""고 말했다.그로부터 한 달 뒤. 중국 북한식당의 종업원 2차 집단 탈출 소식이 들려온 가운데, 평양 아리랑관은 휴업 기간을 한 달 더 연장한다는 안내문을 내 건 채 침묵에 휩싸여 있다. 현지 직원의 모습도 보이지 않았다.그동안 이 식당은 인근에 거주하는 일본인들과 한국인 관광객을 주요 고객으로 삼아왔으며, 비교적 장사가 잘 됐었다는 게 주변 상인들의 전언이다.그러나 북한에 대한 새로운 대북제재 후 일본인과 한인 커뮤니티 등에서 북한식당을 꺼리는 분위기가 확산하고, 중국 내 종업원 집단 탈출 사건까지 터지면서 내부 수리를 이유로 문을 닫은 것으로 추정된다.한 현지 소식통은 ""새로운 대북제재 이후 평양 아리랑관 관리자가 장사가 안돼 죽을 맛이라는 하소연을 하고 다닌다는 말을 전해 들은 적이 있다""며 ""아직 식당 관리자들과 종업원들은 북한에 돌아가지 않고 방콕에 체류 중인 것으로 안다""고 말했다.석 달간 내부 수리를 이유로 문을 걸어 잠근 방콕 시내 북한식당 평양아리랑관평양 아리랑관에서 차로 10여 분 거리의 에까마이 4번가에 있는 또 다른 북한식당인 '평양옥류식당'은 잇따른 북한식당 여직원 탈출이후에도 계속 영업을 하고 있기는 하다. 그러나 장사가 안되기는 매한가지다.최근 기자가 점심시간 식당을 방문했을 당시 식당에는 아무도 없었고, 식사를 거의 마쳤을 즈음 2명의 태국인 여성이 들어와 테이블 1개를 차지했다.24일 영업 여부를 확인하기 위해 기자가 전화를 걸자 여성 종업원은 ""우리는 계속 영업을 하고 있다""고 답했고, 이어 언제쯤 몇 명이 올 거냐고 물은 뒤 ""기다리고 있을 테니 꼭 방문해달라""고 말했다.meolakim@yna.co.kr▶ [핫클릭] 이공계생 80% ""병역특례제도 폐지되면 국내 박사 안해""▶ [핫클릭] 가족여행 출국하던 현직 경찰 부인 손가방서 실탄 발견▶ [통통영상] 브레이크 대신 과속 페달…중국서 식당 날벼락<저작권자(c) 연합뉴스, 무단 전재-재배포 금지>"
39,2016-05-25,'지퍼락'서 플라스틱 조각 '툭툭'판매 중단,https://news.naver.com/main/read.nhn?mode=LSD&mid=shm&sid1=101&oid=055&aid=0000411667,SBS,"<앵커>음식물이나 식재료를 냉장고에 보관할 때 많이 쓰는 지퍼백, 한 수입제품에서 치명적인 결함이 발견됐습니다.식약처가 즉각 판매 중단을 명령했는데, 어떤 문제가 있는지, 송인호 기자의 단독 보도입니다.<기자>음식 재료 사이사이에 좁쌀만한 알갱이들이 들어 있습니다.아이를 둔 주부가 지퍼백 안에 음식 재료를 넣어 냉동실에 보관하다가 우연히 발견했습니다.[강 모 씨/주부 : 설마 지퍼락 안에서 나온 거라고 생각을 못 한 거죠. 아기 고구마랑 감을 꺼내서 줄 때도 바닥에 이렇게 깔려 있었거든요. 바닥에 이만큼씩….]주부의 신고를 받은 식약처가 분석했더니 수입 지퍼백의 지퍼 부분 플라스틱 알갱이로 나타났습니다.같은 제품 190개를 실험한 결과 10개에서 같은 결함이 발견됐습니다.영하 20도가량의 냉동실에서 꺼내 여러 번 여닫으면서 지퍼 부분 플라스틱이 부스러진 걸로 식약처는 판단했습니다.알갱이가 작아 유심히 보지 않으면 발견하기 어렵습니다.문제의 지퍼백은 다국적 기업인 SC 존슨 코리아가 수입하고 지퍼락이라는 이름으로 팔리고 있습니다.식약처는 SC 존슨 코리아에 제품 판매를 중지하고 회수하라고 명령했습니다.[한상배/식약처 식품관리총괄과장 : 플라스틱 조각이기 때문에 식품에 들어가서는 안 되는 성분이라 판단되기 때문에 저희가 잠정 판매중단 조치를 하고요.]소비자들은 구입처 등에서 반품할 수 있습니다.지난해 SC 존슨 코리아가 수입한 지퍼백은 냉동용과 냉장용 합쳐 790톤, 40억 원어치에 달합니다.(영상취재 : 신동환, 영상편집 : 김호진, VJ : 신소영)송인호 기자(songster@sbs.co.kr)※ ⓒ SBS & SBS콘텐츠허브 : 무단복제 및 재배포 금지"
40,2016-05-25,"반기문, 대선 출마 시사",https://news.naver.com/main/read.nhn?mode=LSD&mid=shm&sid1=100&oid=052&aid=0000845781,YTN,"[앵커]잠재적 대선 주자로 꼽히는 반기문 유엔 사무총장이 사실상 내년 대선 출마의 뜻을 밝혔습니다.반 총장은 올해 말 총장 임기가 끝난 뒤 국민으로서의 역할을 생각하고 결심하겠다고 말했습니다.또 북한과 고위급 간에 대화채널 열고 있다며 자신의 장점을 드러냈다고 평가됩니다.보도에 김세호 기자입니다.[기자]1년 만에 제주 공항으로 입국한 반기문 유엔 사무총장은 곧바로 중견언론인 모임인 관훈클럽 기자간담회에 참석했습니다.반 총장은 이 자리에서 초미의 관심사인 대선 출마 여부와 관련해 이례적으로 전향적인 입장을 밝혔습니다.지금은 유엔 사무총장의 역할에 전념하겠다면서도 임기를 마친 뒤 내년에 귀국하면 한국 시민으로서 어떤 역할을 할지 생각하고 결심할 것이라고 말했습니다.내년 대선 출마 가능성을 강력히 시사한 것으로 풀이됩니다.[반기문 / 유엔 사무총장 : 저는 어디까지나 유엔 사무총장이다, 물론 제가 돌아오면 대한민국 국민으로서 여러가지 역할에 대해서는 그때 생각해 보겠습니다.]국내 정치와 관련해서도 국가가 너무 분열돼 있다며 정치 지도자들이 국가 통합을 위해 계파와 지역 파벌을 없애야 한다는 게 지론이라고 밝혔습니다.대북 메시지도 내놓았습니다.북한과 고위급 간 언제든 대화의 문을 열어 두고 있다며 기회가 되면 북한을 방문하겠다는 뜻을 내비쳤습니다.남은 임기 동안 남북관계 개선을 위해 힘쓰겠다면서 인도적 차원의 남북교류가 필요하다고 조언했습니다.[반기문 / 유엔 사무총장 : 인도적인 문제를 통해 물꼬를 터 가면서 대화를 하고 긴장을 완화시키려는 노력이 필요하지 않은 가 생각합니다.]특히 70세가 넘는 나이가 대통령직 수행에 걸림돌이 되지 않겠느냐는 질문에는 반 총장은 체력 하나는 자신 있다고 강조했습니다.김대중, 이승만 전 대통령이 고령에도 불구하고 임기를 이어갔다는 점을 언급하며, 자신도 100m 달리기 속도로 마라톤을 하듯 유엔 사무총장 역할을 이어왔다고 말했습니다.1년 만에 방한한 반 총장이 대선 출마 의지를 내비치면서 오는 30일 출국할 때까지 일거수일투족에 정치권 안팎의 이목이 쏠릴 전망입니다.YTN 김세호입니다.▶ [단독] 국정원, 한밤 중 체포작전…PC방 男 순식간에 제압▶ '손녀뻘 추행' SKT 명예회장, 도망쳤던 女 끌려가자 또...[저작권자(c) YTN(Yes! Top News) 무단전재 및 재배포 금지]"
41,2016-05-25,"한진해운, 용선료 연체로 벌크선 억류당해",https://news.naver.com/main/read.nhn?mode=LSD&mid=shm&sid1=101&oid=421&aid=0002074802,뉴스1,"서울 여의도에 위치한 한진해운 본사. 2016.5.11/뉴스1 © News1 최현규 기자(서울=뉴스1) 심언기 기자 = 한진해운 벌크선이 용선료 연체로 억류되는 일이 발생했다.25일 해운업계에 따르면, 한진해운의 8만2158DWT급 벌크선인 한진패라딥(HANJIN PARADIP)호가 지난 24일 남아프리카공화국에 억류됐다.한진해운이 수 개월간 용선료를 지급하지 못하자 참다못한 벌크선 선주가 실력행사에 나선 것. 컨테이너선에 비해 상대적으로 금액이 적은 벌크선 용선료조차 지불하지 못하는 등 유동성 위기가 심각한 것으로 드러나며 회생 가능성에 대한 우려가 더욱 증폭되고 있다.조양호 회장이 경영에서 손을 떼면서 대한항공 등 계열사 자금지원도 불가능한 상황이어서 용선료 협상을 마칠때까지 버틸 수 있을지조차 불투명하게 됐다.한진해운 관계자는 ""일부 유동성 문제 때문에 분쟁이 생겨 벌어진 일""이라며 ""원만히 해결하기 위해 선주 측과 협상을 하고 있는 중""이라고 말했다.eonki@▶ 매일 업데이트 최신 만화 100% 무료[© 뉴스1코리아(news1.kr), 무단 전재 및 재배포 금지]"
42,2016-05-25,"검찰, '전관비리·탈세' 홍만표 변호사 27일 소환",https://news.naver.com/main/read.nhn?mode=LSD&mid=shm&sid1=102&oid=008&aid=0003685486,머니투데이,"[머니투데이 양성희 기자]서울 서초동 소재 홍만표 변호사 사무실/사진=뉴스1'정운호 게이트'에 연루된 검사장 출신 홍만표 변호사(57)가 오는 27일 피의자 신분으로 검찰에 출석한다.서울중앙지검 특수1부(부장검사 이원석)는 이날 오전 10시 홍 변호사를 불러 부당 수임과 탈세 등 제기된 의혹 전반을 확인한다고 25일 밝혔다.대표적인 특수통 검사로 꼽히던 홍 변호사가 후배 검사에게 수사를 받는 처지에 놓이게 된 것은 정운호 네이처리퍼블릭 대표(51)를 둘러싼 구명 로비 의혹이 불거지면서다.홍 변호사는 정 대표의 도박사건을 맡아 거액의 수임료를 챙겼다는 의혹을 받는다. 고등학교 1년 후배인 브로커 이민희씨(56·구속)가 사건 수임과정에서 다리 역할을 했다고 전해진다.홍 변호사는 1억5000만원을 수수했다는 입장이지만 정 대표는 이 금액의 2~3배에 해당하는 돈을 건넸다고 진술하는 것으로 알려졌다.정 대표는 홍 변호사가 사건을 맡아 처리했던 2014년 경찰에서 한 차례, 검찰에서 두 차례 무혐의 처분을 받았다. 이를 두고 홍 변호사가 수사기관에 전관(前官)으로서 영향력을 행사한 것 아니냐는 얘기가 나왔다.검찰은 홍 변호사가 이 외에도 △유력인들의 형사사건을 맡으면서 선임계를 내지 않고 '전화 변론' 등으로 막후에서 활동한 것은 아닌지 △부당하게 챙긴 거액의 수임료를 자신이 운영하는 부동산 관련업체 A사로 빼돌리고 세금을 탈루한 것은 아닌지 의심하고 있다.홍 변호사는 현재현 전 동양그룹 회장과 그의 부인인 이혜경 전 동양 부회장, 이규태 일광공영 회장, 강덕수 전 STX 회장, 김광진 현대스위스저축은행(현 SBI저축은행) 회장 등의 사건을 정식으로 수임하지 않고 막후에서 맡아 처리했다는 의혹이 제기된 상태다.검찰은 현 전 회장 등 홍 변호사에게 사건을 의뢰했던 이들을 줄소환해 조사했다.검찰은 홍 변호사가 후배 변호사의 이름으로 사건을 편법 수임한 정황도 포착했다. 홍 변호사는 임석 솔로몬금융그룹 회장 사건을 후배인 유모 변호사 이름으로 맡아 수임료 7억원 중 절반을 챙겼다는 의혹을 받는다. 검찰은 유 변호사를 소환해 사실관계를 확인했다.홍 변호사는 법복을 벗고 나간 뒤 서초동 일대의 형사사건을 '싹쓸이' 하다시피 활발히 활동했다고 한다. 2013년엔 91억여원의 소득 신고를 했다. 개업한 2011년 9월부터 최근까지 400여건을 수임했다고 전해지는데 관련 의혹은 계속해서 불어날 수 있는 상황이다.검찰은 홍 변호사가 사실상 운영한 A사 역시 주목하고 있다. A사가 자금 은닉과 탈세 창구로 쓰인 것은 아닌지 들여다보는 것이다.이 회사에는 홍 변호사의 부인 유모씨와 사무장 전모씨가 각각 이사와 감사로 등재돼있다. 홍 변호사 부부 명의의 오피스텔은 50채에 달한다고 알려져있는데 A사가 위탁관리했다고 전해진다. 검찰은 홍 변호사의 사무실, 자택과 함께 A사도 압수수색해 회계장부 등을 확보한 뒤 자금 흐름을 분석해왔다.[이코노미스트들의 깊이있는 투자정보 'TOM칼럼'][부자들에게 배우는 성공 노하우 '줄리아 투자노트'  ][내 삶을 바꾸는 정치뉴스 'the 300'][오늘 나의 운세는? '머니투데이운세' ][아찔한 girl~ 레이싱모델 핫포토 ]양성희 기자 yang@mt.co.kr<저작권자 ⓒ '돈이 보이는 리얼타임 뉴스' 머니투데이, 무단전재 및 재배포 금지>"
43,2016-05-25,한국애보트 항생제서 금속 이물질 발견…사용중지,https://news.naver.com/main/read.nhn?mode=LSD&mid=shm&sid1=102&oid=001&aid=0008427514,연합뉴스,"[연합뉴스자료사진](서울=연합뉴스) 전명훈 기자 = 수입 항생제에서 금속 이물질이 검출돼 식품의약품안전처가 해당 제품을 회수하고 사용을 중지했다.식약처는 한국애보트가 수입한 항생제 '클래리시드건조시럽 250㎎/5㎖'(사용기한 2017년12월31일·제조번호 6057795)에 대한 사용 중지 조치를 내렸다고 25일 밝혔다.제조번호가 다른 동일 제품에 대해서도 잠정적으로 판매금지·사용중지 조치했다.해당 제품은 어린이에게 자주 처방되는 항생제다. 같은 성분(클래리트로마이신) 건조시럽 시장의 3%를 점유하고 있다.식약처는 한 약사가 약을 짓던 중 이 의약품에서 금속 이물질을 발견, 제약사에 신고했다고 설명했다.이 약사의 민원을 조사하면서 동일 제조번호의 다른 제품을 시험·검사한 결과에서도 금속이 발견돼 회수 등의 조치를 취하게 됐다.식약처는 한국애보트를 대상으로 이물질이 섞인 원인을 조사하는 한편 의사·약사·소비자에게 해당 의약품을 다른 대체치료제로 전환하고 제품 회수에 협조해달라고 당부했다.또한 이 제품과 관련해 부작용 등 이상 징후가 있을 경우, 한국의약품안전관리원(☎ 1644-6233, www.drugsafe.or.kr)에 즉시 신고해 달라고 강조했다.junmk@yna.co.kr▶ [핫클릭] STX로 쓴 강덕수 샐러리맨 신화 끝났다▶ [핫클릭] 김영삼 前대통령 혼외자, 3억대 유산 소송 제기▶ [통통영상] '악마는 프라다를 입는다'? 반나체 시위<저작권자(c) 연합뉴스, 무단 전재-재배포 금지>"
44,2016-05-25,3자 회동 하루 만에..여당 계파 갈등 키운 '밀실합의설',https://news.naver.com/main/read.nhn?mode=LSD&mid=shm&sid1=100&oid=437&aid=0000119716,JTBC,"[앵커]어제(24일) 새누리당의 계파 간 화합 조짐이 있다는 소식을 속보로 전해드렸는데, 하루도 지나지 않아 ""밀실 합의""라는 당내 비판이 쏟아져 나왔습니다. 합의 당사자인 김무성 전 대표와 최경환 의원도 합의한 게 아니었다면서 발을 뺐습니다. 계파 갈등 해법이 오히려 갈등을 키우는 악순환이 벌어지는 모양새입니다.송지혜 기자입니다[기자]정진석 원내대표가 친박계와 비박계 좌장격인 최경환 의원, 김무성 전 대표와 만났다는 소식은 당내 반발로 이어졌습니다.혁신비대위 구성과 지도부 체제 변경 등에 합의했다는 소식에 ""밀실 합의""라는 비판이 나왔습니다.[하태경 의원/새누리당 : 새누리당의 진로가 계파 보스 간 타협에 의해 결정되는 것처럼 비춰진 것은 매우 유감입니다.]새누리당 의원들은 '3김 시대'에나 있을 일이라거나, 계파 청산을 주장 해놓고 기득권을 인정해 준 모습이라고 지적하기도 했습니다.비판의 목소리가 높아지자 김 전 대표는 보도자료까지 내면서 수습에 나섰습니다.양측은 모두 자신들은 ""합의할 위치에 있지 않고, 정 원내대표의 요청에 의견 교환을 했을 뿐""이라고 주장했습니다.친박과 비박 양 계파가 김 전 대표에게는 대선 후보, 최 의원에게는 당권을 보장해주려는 것 아니냐는 추측성 분석까지 나오자, 서둘러 진화에 나선 것으로 풀이됩니다.당초 합의 내용을 인정했던 정진석 원내대표는 ""당 수습 방안에 3명이 공감한 건 사실이지만, 당선자 총회와 전국위 추인 등 공식 절차를 밟아야 최종 결과가 된다""고 발언 수위를 낮췄습니다.정 원내대표는 ""다음 주 초 의원총회를 열어 당 수습 방안에 대한 결론을 낼 방침""이라고 말했습니다.송지혜▶ JTBC 뉴스 공식 SNS[트위터][페이스북][카카오스토리][유튜브]▶ JTBC 뉴스는 여러분의 생생한 제보를 기다립니다.Copyright by JTBC, DramaHouse & JcontentHub Co., Ltd. All Rights Reserved. 무단 전재 및 재배포 금지"
45,2016-05-25,큰 병원 고집하다가…골든타임 놓쳐 '사지마비',https://news.naver.com/main/read.nhn?mode=LSD&mid=shm&sid1=102&oid=055&aid=0000411942,SBS,"<앵커>한 응급 환자가 서울의 대형 병원으로 옮겨서 치료받으려다 치료 시기를 놓쳐서 팔다리를 못 쓰게 됐습니다. 처음 찾아간 병원의 책임을 묻기 위해서 소송을 제기했지만, 법원은 병원의 잘못이 없다고 판결했습니다.윤나라 기자입니다.<기자>2년 전, 경기도의 한 지하철역 계단에서 50대 여성이 넘어져 목과 머리를 다쳤습니다.가까운 대형병원 응급실로 옮겨져 간단한 처치를 받았지만, 서울의 집 근처 큰 병원으로 보내달라며 더 이상의 치료는 받지 않았습니다.[병원 관계자 : (서울) 집 근처에 큰 병원으로 데려가 달라면서 여기서는 (치료를) 안 받겠다고 하더라고요. 1시간이 더 걸리는 거리인데.]여성이 희망한 집 근처 병원은 국내에서 가장 큰 병원들이었습니다.빈 병상이 바로 나오지 않아 16시간 만에야 그중 한 곳에 간신히 옮겼습니다.시간을 허비하는 사이 척수가 손상돼 팔다리가 마비됐습니다.여성은 경기도의 병원이 제때 치료하지 않았다면서 소송을 냈지만 법원은 받아들이지 않았습니다.응급실에 왔다가 환자 스스로 다른 병원으로 옮긴 경우는 갈수록 늘고 있는데 상당수는 더 큰 병원에 간 것으로 의료계는 추정하고 있습니다.[김근수/김포우리병원 응급의료센터 과장 : 대형병원으로 환자가 몰리게 되면 대형병원에 환자가 집중화·과밀화되기 때문에 환자 진료가 지연되는 문제가 있습니다.]응급환자가 병원을 옮겨 다니느라 치료시기, 이른바 골든 타임을 놓치게 되면 치명적인 결과를 초래할 위험이 큽니다.응급할수록 유명 대형병원을 찾는 것보다 초기에 적절한 치료를 받는 게 무엇보다 중요합니다.(영상취재 : 장운석, 영상편집 : 최진화)윤나라 기자(invictus@sbs.co.kr)※ ⓒ SBS & SBS콘텐츠허브 : 무단복제 및 재배포 금지"
46,2016-05-25,대기질 더 나빠진다,https://news.naver.com/main/read.nhn?mode=LSD&mid=shm&sid1=103&oid=214&aid=0000621959,MBC,"[뉴스데스크]◀ 앵커 ▶오늘 바깥공기 어떠셨습니까?중국발 초미세먼지가 수도권에 갑자기 유입돼 예보와는 달리 하루 종일 탁했는데요.오늘 밤 초미세먼지가 추가로 유입돼 내일 더 심해진다고 하니 주의하시기 바랍니다.정진욱 기자가 보도합니다.◀ 리포트 ▶환경과학원이 미세먼지 '보통' 수준으로 예보했던 오늘 서울의 모습입니다.뿌옇고 탁해서, 건물들 윤곽만 흐릿하게 보입니다.평소 두세 배 수준까지 급증한 초미세먼지 탓에 시민들은 불편을 호소할 정도입니다.[허대우]""공기가 굉장히 좋지도 않고, 목도 많이 아프고…""중국 초미세먼지가 어제 오후 서해를 건너 오늘 새벽부터 수도권에 유입된 겁니다.서울 초미세먼지 농도는 새벽 4시부터 일 기준치를 넘어 나쁨 수준을 보이다 오후엔 평소 3배 수준까지 치솟았습니다.환경과학원은 오늘 오후 5시에야 사후분석 같은 '나쁨' 예보를 내놨습니다.[허국영/국립환경과학원 연구관]""안개와 대기 정체 효과가 조금 더 커지면서, 저희가 예측했던 것보다 초미세먼지가 해소되는 시점이 조금 늦어졌습니다.""내일 공기는 더 나빠질 전망입니다.오늘 밤부터 서해상 중국 초미세먼지가 추가로 유입되고 국내 발생도 높아질 걸로 예상되기 때문입니다.내일 초미세먼지 예보 등급은 제주를 제외한 전국이 '나쁨' 수준이 되겠고, 대기도 정체돼 모레까지는 공기가 탁할 걸로 환경당국은 내다보고 있습니다.MBC뉴스 정진욱입니다.정진욱기자 ()[저작권자(c) MBC (www.imnews.com) 무단복제-재배포 금지]▶ MBC뉴스 SNS[페이스북][트위터][카카오스토리]▶ 중국발 초미세먼지 공습, 대기질 더 나빠진다▶ 대낮 백화점 지하주차장 강도, 여성운전자 흉기위협Copyright(c) Since 1996,MBC&iMBCAll rights reserved."
47,2016-05-25,"靑, 거부권 곧 결정…공동 대응 나선 두 야당",https://news.naver.com/main/read.nhn?mode=LSD&mid=shm&sid1=100&oid=055&aid=0000411943,SBS,"<앵커>이렇게 박 대통령이 해외 순방에 나선 가운데 청와대가 이르면 다음 주 초, 상시 청문회법에 대한 대통령의 거부권 행사 여부를 결정할 것으로 보입니다. 두 야당은 공조 선언을 하고 공동 대응에 나섰습니다.정유미 기자입니다.<기자>청와대는 상시 청문회법에 대한 법제처의 검토 결과를 받는 대로 국무회의에서 거부권 행사 여부를 결론 내는 방안을 검토하고 있습니다.박근혜 대통령이 해외 순방 중이지만, 전자 서명을 받으면 문제 될 게 없다는 판단입니다.청와대 관계자는 ""법제처의 검토 의견이 위헌으로 나온다면, 거부권 행사를 늦출 이유가 없다""며 속전속결 가능성을 내비쳤습니다.더불어민주당과 국민의당은 원내대표 긴급회동을 열어 공동 대응하기로 합의했습니다.청와대와 여당이 야당에게 덫을 놓고 극한대결로 몰고 있다고 주장했습니다.[우상호/더불어민주당 원내대표 : 이 법 자체 문제점보다는 뭔가 다른 정치적 의도 갖고 거부권 행사하는 것 아닌가.][박지원/국민의당 원내대표 : 자꾸 강경으로 몰아넣으면 우리가 어디로 가겠어요.]공방이 계속되자 정의화 국회의장은 퇴임 회견에서 국정감사 폐지라는 중재안을 제시했습니다.[정의화/국회의장 : 국정감사를 없애고 이 청문회를 활성화하는 것이 국익에 훨씬 도움될 것이다.]새누리당은 헌법에 명시된 국정감사를 마음대로 없앨 순 없다고 일축했습니다.[김도읍/새누리당 원내수석부대표 : 본인(정의화 의장)이 말씀하시는 의회주의 정신에 맞는 것인지 묻지 않을 수가 없습니다.]새누리당은 또 상시 청문회는 개인의 사생활도 침해할 수 있다며 여론전을 펼쳤습니다.(영상취재 : 최호준, 영상편집 : 김진원)정유미 기자(yum4u@sbs.co.kr)※ ⓒ SBS & SBS콘텐츠허브 : 무단복제 및 재배포 금지"
