,날짜,기사 제목,기사 링크,기사 출처,기사 내용
132,2016-05-22,조선 빅3 '6조여원 규모' 자구안…초긴축 경영,https://news.naver.com/main/read.nhn?mode=LSD&mid=shm&sid1=101&oid=001&aid=0008418262,연합뉴스,"거제 대우조선소대우조선 2조5천억·현대중 2조·삼성중 1조5천억원구조조정 2라운드 돌입…본격 감원·시설 축소·매각 단행(서울=연합뉴스) 심재훈 기자 = 사상 최악의 경영 위기에 처한 국내 대형 조선 3사가 총 6조여원에 달하는 자구안을 내놓은 것으로 확인됐다.이들 빅3는 이 자구안을 토대로 내주부터 본격적인 조선업 구조조정 2라운드에 돌입할 예정이라 이들 조선소가 포진한 거제와 울산 지역에 전운이 감돌고 있다.전 직급을 대상으로 추가 감원, 자산 매각, 인건비 삭감, 시설 투자 축소 등을 통해 조선 사업 핵심 분야만 남기고 모두 털어내는 강도 높은 수순을 밟을 예정이기 때문이다.그러나 이럴 경우 대량 해고와 더불어 사세 축소로 조선 세계 1~3위를 지키던 이들 업체의 위상이 급격히 흔들릴 것으로 보인다.22일 업계에 따르면 현대중공업, 삼성중공업, 대우조선해양 등 조선 빅3는 경영 정상화를 위해 총 6조원 규모의 긴축 경영을 하겠다는 내용의 자구안을 최근 주채권은행에 제출했다.대우조선이 2조5천여억원으로 가장 많고 현대중공업 2조여원, 삼성중공업 1조5천여억원으로 추산된다.이는 정부가 조선업 구조조정을 공개적으로 발표하면서 이들 업체를 압박한 결과다.울산 현대중공업조선업계 관계자는 ""조선 빅3가 정부의 구조조정 요구에 부응하기 위해 팔 수 있는 모든 자산과 전 직급으로 확대한 인원 감축안을 주채권은행에 제출했다""면서 ""총 자구안 규모가 6조여원 수준으로 국내 제조업 구조조정 사상 최대 액수다""고 말했다.채권단의 4조원대 지원을 받는 대우조선은 이미 지난해 1조8천500억원 규모의 1차 자구안을 낸 바 있다. 지난 20일에는 7천여억원 정도 추가된 2차 자구안이 제출된 것으로 보인다.1차 자구안에는 부동산 등 비핵심 자산을 전량 매각해 7천500억원을 조달하고 향후 3년간 인적 쇄신, 직접경비 및 자재비 절감, 공정 준수를 통한 지연배상금 축소 등으로 1조1천억원 이상의 손익 개선을 달성한다는 계획을 세웠다. 이를 위해 연수원과 골프장 용도로 활용하던 비핵심 자회사 에프엘씨(FLC)를 매각했다.지난해 8월 이후 본사 임원을 55명에서 42명으로 30% 줄였으며 임원들 임금에서 기본급의 10∼20%씩을 반납하도록 했다. 희망퇴직과 권고사직 등을 통해 부장급 이상 고직급자 1천300명 중 300명을 감축했다.대우조선은 지난 20일 낸 2차 자구안에서는 사무직과 생산직 등 추가 인력 감축, 중국 선박블록 공장 매각, 방산 부분 자회사 전환 후 상장 등을 통해 자구안 규모를 7천여억원 더 늘린 것으로 알려졌다.대우조선 측은 ""추가 자구안 제출로 기존 시행 중인 자산 매각을 강화하고 일부 매각 또는 사업 재편 대상을 확대해 자구안 규모가 커졌다""고 말했다.현대중공업그룹도 지난 12일 제출한 자구안에서 2조원 규모의 긴축 계획을 세웠다.현대중공업그룹은 최근 전 계열사 비상 경영을 선언한 상태다. 현대미포조선, 현대삼호중공업 등을 포함한 전 계열사 임원의 급여 반납 등 인건비와 각종 경비 절약, 시설 투자 축소 등을 통해 5천억원 이상을 절감할 계획이다. 현대중공업 자체의 절감액만 3천500여억원에 달한다.현대중공업 그룹은 계열사 전 사장단이 급여 전액을 반납하고 임원들도 직급에 따라 최대 50%까지 급여를 반납하기로 했다. 현대중공업 등 조선 관련 계열사에서는 부서장까지도 급여의 10%를 반납하기로 했다. 최근 사무직 과장급 이상을 대상으로 희망퇴직을 받은 데 이어 생산직까지 확대해 2천여명 이상 정리할 것으로 보인다.아울러 비핵심 사업인 금융 계열사, 호텔 사업 등도 지분 매각을 통해 정리하는 방안이 검토되고 있으며 건장, 로봇 기계 등의 분야를 분사하는 방안도 추진되고 있다.지난 17일 삼성중공업은 1조5천억원 규모의 자구안을 냈다. 그러나 주채권은행인 산업은행이 부족하다고 여기고 있어 향후 더 늘어날 수도 있다.삼성중공업의 자구안에는 임원진 및 조직 추가 축소 개편, 희망퇴직을 통한 추가 인력 감축, 임금 동결 및 삭감, 순차적 독(선박 건조대)의 잠정 폐쇄, 비핵심자산 매각 강화 등이 포함된 것으로 알려졌다.이에 따라 삼성중공업은 최근 두산엔진 지분을 처분하는 등 현금 유동성 확보에 나섰으며 거제삼성호텔을 포함해 각종 설비를 매각할 방침이다.문제는 수주 가뭄 현상이 올해 하반기에도 지속할 예정이라 자구안 규모가 더 커질 수 있다는 점이다.대우조선의 경우 이미 지난해 채권단의 지원을 받으면서 1차 자구안을 내놨는데 이번에 정부의 압박 속에 또다시 대규모 추가 자구안을 내놨기 때문이다.정부는 조선 빅3가 경영 정상화를 위한 자구안을 제출함에 따라 타당성 검토와 더불어 외부 기관을 통한 스트레스 테스트 등을 종합해 내주부터 본격적인 구조조정을 단행할 것으로 보인다.조선업계 관계자는 ""지금까지 조선 빅3로부터 자구안을 받는 게 조선업 구조조정 1라운드였다면 내주부터는 자구안을 직접 실행에 옮기는 2라운드 무대가 시작될 것""이라면서 ""이 과정에서 실업 문제와 더불어 노사 갈등, 자산 매각 난항, 수주 가뭄 현상 지속 등 난관이 예상된다""고 말했다.president21@yna.co.kr▶ [핫클릭] ""어머니,조선업 괜찮으니 걱정마세요"" 전화끊고 고개떨군 용접공▶ [핫클릭] 낙선한 정치인들, 방송인 변신하며 '종편 스타' 도전▶ [통통영상] ""영어로만 주문받아요"" 미국 아이스크림 가게 논란<저작권자(c) 연합뉴스, 무단 전재-재배포 금지>"
133,2016-05-22,2020년 이후엔 90% 이상 현역판정…병역자원 절벽'..,https://news.naver.com/main/read.nhn?mode=LSD&mid=shm&sid1=100&oid=001&aid=0008418556,연합뉴스,"훈련병 구보 장면여군 모집 늘리고 군내 '잡일' 민간 아웃소싱도 확대…예산 관건병역자원 감소 대책 국무조정실 차원서 범정부적 논의 착수(서울=연합뉴스) 이영재 기자 = 우리 군이 '병역자원 절벽' 대책으로 징병검사에서 현역 판정 비율을 90% 이상으로 끌어올리는 새로운 신검 기준을 마련하는 방안을 검토하고 있다.남성 자원 공백을 메우도록 여군 모집을 늘리고, 현역병은 오로지 전투에 대비한 교육훈련에 매진하도록 소위 '군대에서 잡일'을 민간에 아웃소싱하는 분야도 더욱 확대할 계획이다.군의 한 고위 관계자는 22일 ""2020년 이후 일정 수준의 현역병 규모를 유지하기 위해서는 징병 신체검사의 현역 판정 기준을 다시 완화할 수밖에 없다""면서 ""2020년 이후 징병검사에서 현역 판정 비율을 90% 이상으로 높이는 방안을 검토하고 있다""고 밝혔다.그는 ""한국의 인구 구조를 볼 때 2020년대에 들어서면 병역자원의 급격한 감소가 불가피하다""면서 ""현역 자원 확보를 위해 징병 신체검사의 현역 판정 기준도 완화할 수밖에 없다""고 말했다.여군 특전부사관국방부는 작년 10월부터 입영 적체 문제를 해소하고자 징병 신체검사의 현역 판정 기준을 강화했다. 현역인 1∼3급 판정 기준을 높여 정예 자원을 현역으로 받아들이는 한편, 보충역인 4급 판정 기준을 낮춰 사회복무요원을 늘리는 방식으로 입영 적체 현상 해소에 나섰다.징병 신체검사에서 현역 판정 비율은 평균 90%에 가까웠으나 이 조치가 시행된 작년 10월 이후부터 1∼2%포인트가량 떨어진 것으로 알려졌다.그러나 2020년대부터는 병역자원 감소로 현역병 확보에 비상이 걸린 만큼, 징병 신체검사에서 높여놓은 현역 판정 기준을 낮춰 현역 입영 규모를 조금이라도 늘린다는 것이 구상이라고 이 관계자는 설명했다.국방부는 전환·대체복무요원을 단계적으로 줄이는 첫해인 2020년부터 징병 신체검사에서 현역 판정 기준을 작년 8월 이전 수준으로 되돌리는 방안을 고려 중인 것으로 알려졌다.국방부는 닥쳐올 병역자원 부족 현상에 따라 2020년부터 2022년까지 3개년에 걸쳐 전환·대체복무요원을 단계적으로 줄이고 2023년부터 이들을 한 명도 뽑지 않는다는 계획을 마련해 부처간 협의를 진행 중이다. 2023년부터 해마다 2만∼3만명의 병력이 부족할 것으로 예상하기 때문이다.또 병역자원 공백을 메우기 위해 여군 모집 규모를 더 확대하는 방안도 검토하는 것으로 알려졌다.국방부는 2020년까지 장교와 부사관의 여군 비율을 각각 7%, 5%로 늘릴 계획이다. 여군 장교를 양성하는 여자대학 학군단(ROTC)이 올해 3곳으로 늘어나는 등 여군 장교 '관문'은 계속 확대되고 있다.청소하는 장병들병역자원 감소 문제가 불거질 때마다 여군 확대 방안이 우선적으로 거론되고 있지만, 여군이 모두 간부로 뽑히기 때문에 예산을 확보하는 것이 걸림돌로 작용하고 있다.'병역자원 절벽' 시대가 도래하는 상황에서 입영하는 현역병의 정예화를 위해 교육훈련 외에 일체의 '잡일'은 시키지 않을 방침이다. 이에 따라 부대 시설 관리, 청소, 제초를 포함한 전투근무지원 업무를 민간업체에 더욱 아웃소싱하는 방안도 검토 중이다.군의 임무를 전투 업무에 집중함으로써 병역자원 감소 현상에 대한 대책으로 삼을 수 있지만, 예산 문제가 걸려 있어 부처간 긴밀한 협의가 필요한 사안이다.정부는 전환·대체복무요원 폐지 계획에 대한 논란이 불거지자 국무조정실 차원에서 병역자원 감소 현상에 대한 범정부적인 대책 마련에 착수한 것으로 알려졌다.국방부 관계자는 ""예산 제약이 따르는 현실에서 병역자원 감소 문제를 해결할 수 있는 묘수를 찾기 힘든 게 사실""이라며 ""유관 부처와 긴밀히 협의해 최선의 방안을 찾도록 노력할 것""이라고 말했다.ljglory@yna.co.kr▶ [핫클릭] ""어머니,조선업 괜찮으니 걱정마세요"" 전화끊고 고개떨군 용접공▶ [핫클릭] 2020년 이후엔 90%이상 현역판정…'병역자원 절벽'에 기준 완화▶ [통통영상] ""영어로만 주문받아요"" 미국 아이스크림 가게 논란<저작권자(c) 연합뉴스, 무단 전재-재배포 금지>"
134,2016-05-22,"경찰 심리분석 발표..""전형적인..""",https://news.naver.com/main/read.nhn?mode=LSD&mid=shm&sid1=102&oid=421&aid=0002067144,뉴스1,"지난 19일 서울 서초경찰서에서 영장실질심사를 위해 경찰서를 나서고 있는 '강남역 묻지마, 살인 사건' 피의자 김모씨. /뉴스1 © News1 황기선 기자""범행동기나 피해자 관계 없이 범행…정신분열 유형 해당""""가족과 단절된 생활…청소년기부터 정신이상 증세""(서울=뉴스1) 윤수희 기자 = '강남역 노래방 살인사건' 피의자에 대해 심리분석을 실시한 경찰이 이 사건을 정신질환(조현병)에 따른 '묻지마 범죄'로 규정했다.서울지방경찰청은 22일 오전 서초경찰서에서 브리핑을 열고 강남역 인근 노래방 건물 화장실에서 여성을 흉기로 찔러 살해한 혐의로 검거된 피의자 김씨에 대해 실시한 심리분석 결과를 발표했다.경찰은 앞선 19일과 20일 2차례에 걸쳐 김씨에 대해 심리분석을 진행했다. 2차 심리면담에서는 서울경찰청 프로파일러와 함께 한국 최초의 프로파일러인 경찰청 과학수사센터 권일용 경감을 투입하기도 했다.이날 브리핑에서 경찰은 ""피의자가 망상적 사고를 갖고 표면적 범행동기나 피해자와의 직접적인 관계가 없이 범행을 저지른 점 등을 볼 때 이 사건은 '묻지마 범죄' 중 조현병(정신분열증) 유형에 해당한다""고 밝혔다.경찰은 ""김씨가 피해자를 보자마자 바로 공격한 것은 목적에 비해 계획이 체계적이지 않은 전형적인 정신질환 범죄의 특성""이라며 ""김씨는 2년 전부터 정신질환을 겪었는데 올해 1월 초 병원 퇴원 후 약물복용을 중단해 망상이 심화된 상태였다""고 설명했다.이어 ""김씨가 지난 5일 서빙업무를 하던 식당에서 위생이 불결하다는 지적을 받고 7일부터 식당 주방보조로 옮겼는데, 이를 여성이 자신을 음해했기 때문이라고 생각했던 것이 범행을 일으킨 배경으로 보인다""고 말했다.경찰에 따르면 김씨는 2003년부터 2007년 사이에 성별과 관계없이 누군가 자신을 욕하는 것이 들린다고 호소하는 등의 피해망상 증세를 보였다. 그러다 2년 전부터 여성들이 자신을 견제하고 괴롭힌다고 생각하기 시작했다.경찰은 ""김씨가 외아들로서 부모와 거의 대화가 없는 등 가족과 단절된 생활을 했다""며 ""청소년기부터 대인관계 기피 등의 이상 증상을 보이고 2008년 이후부터는 1년 이상 씻지 않거나 노숙생활을 하는 등 기본적인 자기 관리 기능이 손상된 상태였다""고 밝혔다.ysh@▶ 매일 업데이트 최신 만화 100% 무료[© 뉴스1코리아(news1.kr), 무단 전재 및 재배포 금지]"
135,2016-05-22,반환점 돈 '가습기 수사'…옥시 영국본사 개입 규명 관건,https://news.naver.com/main/read.nhn?mode=LSD&mid=shm&sid1=102&oid=001&aid=0008418426,연합뉴스,"'가습기 가해자' 첫 구속    (서울=연합뉴스) 박동주 기자 = 서울중앙지검 특별수사팀은 안전성 검사 없이 유해 제품을 제조·판매해 사람을 숨지거나 다치게 한 혐의(업무상 과실치사 및 과실치상)로 옥시레킷벤키저(옥시) 신현우 전 대표와 전 연구소장 김모씨, 선임연구원 최모씨를 14일 구속했다.     이날 신 전 대표가 서초구 서울중앙지검을 나서고 있다. 2016.5.14    pdj6635@yna.co.kr옥시 의견서에 英·美 폐질환 전문가 대거 등장해 '본사 개입 의혹' 증폭검사 11명 배치 총력전…신현우 前대표 등 4명 구속(서울=연합뉴스) 전성훈 기자 = 올 1월 시작해 4개월간 숨 가쁘게 진행된 가습기 살균제 피해에 대한 검찰 수사가 반환점을 돌았다. 검찰은 이르면 7월 말까지 수사를 끝내겠다는 목표로 속도를 내고 있다.22일 법조계에 따르면 검찰은 그동안 피해자 전수조사 등을 통해 살균제와 폐손상 사망 간의 인과관계를 확인했고, 가해업체의 과실 책임도 상당 부분 규명하는 데 성공했다는 평가를 받는다.향후 수사의 핵심은 가장 많은 피해자를 낸 옥시레킷벤키저(옥시)의 영국 본사가 제품 유해성 검사 생략과 증거은폐 등 각종 의혹에 어느 정도까지 관여했는지 밝혀내는 일이 될 전망이다.하지만 옥시 영국 본사가 개입했다는 구체적인 단서가 확보될 경우 수사 기간이 더 늘어날 수 있다는 관측도 나온다.◇ 사태 발생 5년 만의 검찰 수사…'속전속결' 행보서울중앙지검은 가습기 살균제 사망 관련 수사를 최우선 해결과제로 꼽고 올 1월 특별수사팀(팀장 이철희 형사2부장)을 꾸려 본격 수사에 착수했다. 검사 11명이 투입됐다.신현우 후임, 존 리 전 대표 소환 예정(CG)[연합뉴스TV 제공]각종 고발 사건을 수사한 경찰이 작년 9월 제품 제조·판매업체 8곳을 기소 의견으로 송치한 지 4개월 만이다.검찰은 우선 살균제가 실제 폐 손상을 초래했는지 확인하고자 질병관리본부(질본)의 역학조사 결과와 국내외 관련 논문 등 방대한 자료를 검토했다.옥시 등을 압수수색해 한국건설생활환경시험연구원(KCL)·서울대·호서대 등 업체가 별도로 발주한 유해성 연구 자료도 확보했다. 200명에 가까운 피해자 전수조사도 병행했다.검찰은 이를 통해 실제 폐 손상 사망 사고를 낸 가해업체를 옥시(제품명: 옥시싹싹 뉴가습기당번), 롯데마트(와이즐렉 가습기 살균제), 홈플러스(홈플러스 가습기 세정제), 버터플라이이펙트(세퓨) 등 4개사로 압축했다.검찰은 이들 업체가 제품 출시 전 반드시 거쳐야 할 안전성 검사를 생략하는 등 과실이 있었다는 사실도 확인했다.업체 관계자 소환조사는 옥시를 시작으로 지난달 19일부터 시작됐다. 안전성 검사의 필요성을 알고도 이를 무시하고 판매를 강행했는지가 핵심이었다.검찰은 옥시가 제품을 제조·시판하기 전 인체 유해 가능성을 사전에 인지했다는 다수의 증거를 확보해 당시 최고경영자였던 신현우(68)씨와 연구소장·선임연구원 등 3명을 업무상 과실치사 및 과실치상 등 혐의로 구속했다.가습기 살균제를 폐 손상 원인으로 지목한 질본 역학조사 결과를 반박하고자 옥시가 서울대 수의대 조모(56) 교수팀에 의뢰한 독성실험 보고서가 사측에 유리하게 조작된 흔적도 포착했다. 돈을 받고 보고서를 써 준 혐의로 조 교수도 구속됐다.세퓨를 출시한 오모 전 대표 역시 유해 제품을 제조·판매해 다수의 피해자를 낸 혐의가 인정돼 구속됐다. 그는 인터넷 등에서 떠도는 정보로 콩나물 공장에서 제품을 만든 것으로 드러나 논란이 됐다. 세퓨는 독성물질을 인체 무해 수준보다 160배 이상 함유한 것으로 드러났다.'가습기 사태' 옥시 현직 외국인 임원 첫 검찰 출석    (서울=연합뉴스) 한종찬 기자 = 19일 오후 서울 서초구 중앙지검에서 옥시의 재무담당 이사 울리히 호스터바흐(49·독일)씨가 참고인 신분으로 검찰 조사를 받기위해 안으로 들어서고 있다. 2016.5.19    saba@yna.co.kr마지막 남은 롯데마트와 홈플러스도 조만간 처벌 수위 및 범위 등이 결정될 전망이다. 피해 정도·규모 등에 비춰 이들 업체도 혐의를 벗기는 어려울 것이라는 게 대체적인 관측이다.◇ 옥시 외국인 임원 줄소환…영국 본사 겨냥검찰은 지난주 옥시의 전·현직 외국인 임원들에 대한 소환조사에 착수했다.신 전 대표가 최고경영자에서 물러난 후인 2005년부터 제품 판매가 중단된 2011년까지의 책임 소재와 증거은폐 책임자를 가리는 데 초점이 맞춰졌다.재무담당 이사인 울리히 호스터바흐(49·독일)씨가 이달 19일 참고인으로 출석해 조사를 받은 데 이어 23일에는 존 리(48·미국) 전 대표가 피의자 신분으로 소환된다.존 리 전 대표는 2005∼2010년 5년간 최고경영자를 지냈다. 이 시기는 제품 판매량이 가장 많았던 때다.검찰은 존 리 전 대표가 가슴 통증·호흡곤란 등 제품 부작용을 호소하는 민원을 접수하고도 이를 무시하고 판매를 강행한 단서를 확보한 것으로 전해졌다.2010∼2012년 옥시 경영을 책임진 거라브 제인(47·인도) 전 대표 역시 수사선상에 올라 있다. 증거은폐 의혹의 핵심 인물인 그는 현재 싱가포르 지사장으로 재직 중이다.검찰은 그의 변호인과 소환일정을 조율 중이다. 당사자가 응하면 이번 달 내로도 조사가 가능하다. 거부할 경우 당사국에 범죄인 인도를 요청하는 단계까지 가야 해 조사가 많이 미뤄질 수 있다.<그래픽> 숫자로 본 가습기살균제 참사    (서울=연합뉴스) 이재윤 기자 = 검찰이 수사 중인 '살인' 가습기 살균제 사건의 피해자들이 집단 민사 손해배상 소송을 추진한다.    환경보건시민센터는 ""24일 가습기살균제피해자와가족모임 총회를 열어 집단 손해배상 소송에 대해 논의하고 소송인단을 꾸릴 계획""이라고 21일 밝혔다. 현재까지 센터가 파악한 가습기 살균제 피해자는 1천528명이다.    yoon2@yna.co.kr    페이스북 tuney.kr/LeYN1 트위터 @yonhap_graphics검찰 관계자는 ""범죄인 인도까지 가지 않도록 적극적으로 당사자를 설득할 방침""이라고 말했다.검찰은 이외에 10명 안팎의 외국인 전·현직 임원을 소환 대상에 올려놓은 것으로 전해졌다.검찰 주변에선 결국 영국 본사를 둘러싼 의혹 규명까지 나아갈 것으로 보는 시각이 많다. 이들이 주요 의사결정 사항을 놓고 직·간접적으로 본사와 소통했을 것이라는 판단에서다.본사가 이번 사태에 깊이 개입한 정황은 곳곳에서 드러났다.옥시가 김앤장을 통해 검찰에 제출한 의견서 중에는 국내외 전문가들이 작성한 '공동전문가 보고서'라는 게 있다. 질본의 역학조사 과정과 결과가 과학적이지도, 합리적이지도 않다는 게 핵심 내용이다.보고서 작성에는 영국 간질성 폐 질환 전문의인 T 박사 주도로 영국 폐병리학자 A 박사, 폐영상 전문가 D 교수, 미국 폐병리학자 T 박사, 싱가포르 폐 질환 전문의 P 박사, 국내 유명 병원의 김모 교수 등이 참여했다.영국·미국·싱가포르·한국 등의 다국적 폐 질환 전문가가 참여한 반박 보고서를 만든 작업을 한국법인 홀로 기획했다고 보기는 어렵다.본사 임원들이 대부분 화학 분야 전문가로 채워진 점도 '본사 개입설'에 무게를 실어준다는 점에서 향후 검찰 수사가 어떻게 진행될지 관심이 모아진다.lucho@yna.co.kr▶ [핫클릭] ""어머니,조선업 괜찮으니 걱정마세요"" 전화끊고 고개떨군 용접공▶ [핫클릭] 맥주값, 3년만에 인상 '초읽기'…오비맥주 ""검토중""▶ [통통영상] ""영어로만 주문받아요"" 미국 아이스크림 가게 논란<저작권자(c) 연합뉴스, 무단 전재-재배포 금지>"
136,2016-05-22,"법원 ""동료에게 모함받아 생긴 스트레스 장애는 업무상 재해""",https://news.naver.com/main/read.nhn?mode=LSD&mid=shm&sid1=102&oid=008&aid=0003683246,머니투데이,"[머니투데이 이경은 기자]서울행정법원/사진=뉴스1동료로부터 모함을 당해 스트레스 장애가 발생했다면 업무상 재해로 인정해야 한다는 법원 판단이 나왔다.서울행정법원 행정1단독 이규훈 판사는 김모씨가 ""요양급여 신청을 받아들여달라""며 근로복지공단을 상대로 낸 소송에서 원고승소로 판결했다고 22일 밝혔다.김씨는 2002년부터 지적장애인시설 사회복지법인 W재단에서 생활재활교사로 근무했다. 그러던 중 내부서류 도난사건이 발생하자 함께 근무하던 교사 A씨는 김씨를 범인으로 몰아세우고 김씨가 마치 정신적 문제가 있는 것처럼 폭언과 욕설을 했다. 또 다른 동료 교사들에게 수차례 '김씨가 소지품과 서류 등을 훔치는 행동을 하니 물건 간수 잘하라'며 거짓 소문을 퍼뜨렸다.김씨는 재단 고충처리위원회에 이 사건 관련 모함과 오해를 풀어줄 것을 요청했지만 재단 측은 오히려 김씨를 문제 있는 사람으로 취급했다. 김씨는 ""이로 인한 정신적 스트레스때문에 스트레스 장애가 발병됐다""고 주장하면서 요양급여 신청을 했지만 받아들여지지 않자 소송을 냈다.이 판사는 ""김씨가 이 사건을 겪기 전에는 동료들과 친분관계를 유지하며 정상적으로 직장생활을 해왔다""며 ""이 사건을 계기로 자신에 대한 좋지 않은 소문을 알게 돼 대인관계에 대한 신뢰감을 잃고, 사업주의 미온적 대처까지 겹쳐 발병·악화된 것으로 보인다""고 판단했다.아울러 ""김씨가 A씨로부터 모욕적인 말과 폭언을 듣게 된 계기는 내부서류 작성 및 관리 등 업무와 밀접한 관련이 있어 업무상재해로 인정해야 한다""고 밝혔다.[이코노미스트들의 깊이있는 투자정보 'TOM칼럼'][부자들에게 배우는 성공 노하우 '줄리아 투자노트'  ][내 삶을 바꾸는 정치뉴스 'the 300'][오늘 나의 운세는? '머니투데이운세' ][아찔한 girl~ 레이싱모델 핫포토 ]이경은 기자 kelee@mt.co.kr<저작권자 ⓒ '돈이 보이는 리얼타임 뉴스' 머니투데이, 무단전재 및 재배포 금지>"
