,날짜,기사 제목,기사 링크,기사 출처,기사 내용
51,2016-05-22,세 살배기 목 조르고 팽개치고…또 어린이집 학대,https://news.naver.com/main/read.nhn?mode=LSD&mid=shm&sid1=102&oid=055&aid=0000411009,SBS,"<앵커>세 살배기 어린 아이의 목을 조르는 등 원생들을 상습적으로 폭행한 혐의로 인천의 한 어린이집 원장이 구속됐습니다. 피해 학부모들은 아직도 근절되지 않은 아동학대에 대해 사회의 경각심을 일깨워 달라며 CCTV를 공개했습니다.보도에 손형안 기자입니다.<기자>어린이집 원장이 세 살배기 아이를 가로로 뉘어 무릎에 앉힙니다.허리가 꺾인 아이는 버둥거리며 고통스러워 합니다.아이의 목을 졸라 바닥에 내팽개치기도 하고 엉덩이를 세차게 후려치기도 합니다.지난달에 녹화된 인천의 한 어린이집 CCTV 화면입니다.참담한 광경을 목격한 학부모들의 입에서 외마디 안타까운 탄식이 흘러나옵니다.[피해 학부모 : 아…진짜.]30대 직장인 여성은 지난달 27일 아이를 씻기면서 몸 여기저기에 난 멍 자국을 발견했습니다.[피해 학부모 : 말 못하는 아이를 이런 지옥 같은 곳에 보냈다는 게 아이한테 미안한 마음이 더 커요.]문제의 어린이집 원장은 아동 학대 혐의로 구속됐습니다.경찰 수사 과정에서 아이 4명이 학대를 당한 것으로 드러났고 해당 어린이집은 문을 닫았습니다.이 지역 주민들이 주로 활동하는 인터넷 카페에서는 어린이집 원장을 상대로 한 민·형사 소송 비용을 모금하는 운동이 벌어지고 있습니다.잊을 만하면 터져 나오는 어린이집 아동 학대를 더는 두고 보지 않겠다는 공감대 속에 지역민들도 모금에 적극 참여하고 있습니다.(영상취재 : 홍종수, 영상편집 : 김지웅)▶ [카드뉴스] 11살 맨발 소녀 근황…씁쓸한 '학대의 굴레'손형안 기자(sha@sbs.co.kr)※ ⓒ SBS & SBS콘텐츠허브 : 무단복제 및 재배포 금지"
52,2016-05-22,군 통신선 재가동한 北 '평화공세'…정부 '일축',https://news.naver.com/main/read.nhn?mode=LSD&mid=shm&sid1=100&oid=055&aid=0000411010,SBS,"<앵커>북한이 7차 당 대회 이후 평화공세가 계속되고 있습니다. 군사회담을 갖자는 제안까지 나왔는데, 우리 정부는 비핵화가 우선이라며 일축했습니다.안정식 기자가 보도합니다.<기자>김정은 노동당 위원장이 7차 당 대회에서 군사회담 필요성을 언급한 이후 북한이 구체적인 회담 제안을 해 왔습니다.[북한 인민무력부 통지문, 어제(21일) : 북남 군사 당국회담 개최를 위한 실무접촉을 5월 말 또는 6월 초에 편리한 날짜와 장소에서 가지자는 것을 제의한다.]북한은 특히 이같은 통지문을 서해지구 군 통신선을 통해 우리 측에 전달했습니다.서해 군 통신선은 지난 2월 북한이 우리 정부의 개성공단 가동중단 조치에 반발해 폐쇄를 선언한 상태였는데, 통지문 전달을 위해 군 통신선까지 재가동한 것입니다.북한의 평화공세는 최근 집중적으로 진행되고 있습니다.[북한 정부정당단체 공동성명(지난 16일) : 북남관계를 개선하고 조국통일을 앞당겨나가려는 우리의 의지와 노력을 똑바로 보고.][북한 국방위원회 공개서한(지난 20일) : 쌍방 군부 대화를 조속히 개최하자는 우리의 제안에 적극 호응해 나와야 할 것이다.]정부는 북한의 대남 평화공세를 국제사회의 대북제재에 균열을 가하려는 것으로 보고 있습니다.[정준희/통일부 대변인(지난 18일) : 핵 포기와 관련된 여하한 언급도 없이 그런 주장을 하는 것 자체가 모순이다, 그렇기 때문에 그것은 선전선동의 일환이다라고 판단을 하고 있습니다.]정부는 북한의 군사회담 제안을 일축하면서, 비핵화가 최우선이라는 입장에 변화가 없다고 강조했습니다.(영상편집 : 이승열)안정식 기자(cs7922@sbs.co.kr)※ ⓒ SBS & SBS콘텐츠허브 : 무단복제 및 재배포 금지"
53,2016-05-22,하루 주차 요금이 43만 원?…공영주차장 '400%' 연체료,https://news.naver.com/main/read.nhn?mode=LSD&mid=shm&sid1=103&oid=437&aid=0000119384,JTBC,"[앵커]공영 주차장에 주차한 뒤 제때 주차 요금을 내지 않으면 최대 4배의 연체료를 물 수도 있다고 합니다. 몇만 원이던 요금이 자신도 모르는 사이 수십만원으로 늘어나는 경우도 있습니다.박현주 기자입니다.[기자]직장인 류모 씨는 지난해 7월 서울 강남의 한 공영주차장에 아침 8시에 차를 세웠습니다.밤 10시에 돌아왔지만 직원들은 퇴근한 뒤였습니다.하루 요금이 8만 6천 4백원이라는 고지서만 창문에 꽂혀 있었습니다.이후 류 씨는 고지서를 잊고 있었고 한 달이 넘도록 돈을 내지 않았습니다.그러자 4배 가산금이 붙어 43만 2천원을 내라는 통지가 왔습니다.[류모 씨 : (구청에서 말하길) 조례에 의하면 400%라고 돼있고 강남구는 그렇게 받기로 했다. 재론의 여지가 없다. 안 내면 차량 압류 들어가겠다.]주차장법에 따르면 주차 요금 미납시 원금의 4배 범위까지 가산금이 붙을 수 있습니다.하지만 실제 부과율은 자치구마다 다릅니다.서울 강남구와 영등포구는 보름 간격으로 두 차례 고지한 뒤 4배의 연체료를 부과하지만 반면 경기 성남시는 최대 2배까지만 부과하고, 서울 중구와 경기 수원시, 용인시 등은 연체료를 매기지 않습니다.[중구청 관계자 : 저희는 그런 경우는 없어요, 현실적으로. 4배까지라고 조례로는 돼있는데 실질적으로는 사문화됐어요.]각 지자체 주차관리 담당자들은 이용자들이 적어도 보름 안에는 미납 요금을 납부해야 연체료 폭탄을 피할 수 있다고 말합니다.박현주▶ JTBC 뉴스 공식 SNS[트위터][페이스북][카카오스토리][유튜브]▶ JTBC 뉴스는 여러분의 생생한 제보를 기다립니다.Copyright by JTBC, DramaHouse & JcontentHub Co., Ltd. All Rights Reserved. 무단 전재 및 재배포 금지"
54,2016-05-22,한 치 앞 내다볼 수 없는 '국회법',https://news.naver.com/main/read.nhn?mode=LSD&mid=shm&sid1=100&oid=469&aid=0000144289,한국일보,"개정 국회법 23일 송부, 법리적 해석 분분정의화 국회의장이 지난 19일 19대 국회 마지막 본회의에서 의사봉을 두드리고 있다. 고영권 기자 youngkoh@hankookilbo.com상임위 차원에서 수시로 청문회를 열 수 있도록 하는 ‘상시 청문회법’(개정 국회법)이 23일 정부로 이송되지만 한 치 앞을 내다볼 수 없는 운명에 놓였다. 국회법이 19대 국회 임기 종료(29일)를 불과 열흘 앞둔 19일 통과되는 바람에 법리적 해석 문제가 얽혀 있어서다. 더구나 정진석 새누리당 원내대표가 22일 “박근혜 대통령의 법안 거부권 행사가 금기(禁忌)일 수 없다”고 국회법에 대한 거부권 행사 필요성을 제기해 거부권 논란이 다시 가열됐다.문제는 19대 국회에서 개정된 국회법에 대한 박 대통령의 공포나 거부권 행사 시점이 20대 국회가 시작하는 30일 이후가 될 경우다. 국회법이 자동 폐기되는지, 재의결 등의 절차가 20대 국회로 이월되는 지 여부를 두고 해석이 엇갈린다. 헌법 53조에 따르면 국회에서 의결돼 정부로 이송된 법안은 정부가 15일 안에 공포해야 하는데, 박 대통령이 19대 국회 임기 중에 공포하지 않으면 회기 종료와 더불어 자동 폐기되는 것 아니냐는 것이다. 이 경우 박 대통령은 굳이 거부권을 행사할 필요가 없어 부담을 덜 수 있다.이에 대해 법제처는 “법안 공포는 19대 국회 회기와 상관 없이 15일 이내에 공포하거나 재의를 요구하면 된다”며 문제가 없다는 입장이다. 그러나 국회 관계자는 “회기 불계속의 원칙(회기 중에 처리되지 않은 법안은 다음 회기까지 계속되지 않는다는 원칙)이 명시된 미국과 달리 우리 국회는 이 부분이 불명확하다”며 “때문에 29일 이후 국회법을 공포하면 자동 폐기되는 것이라는 견해도 있어 논란이 있을 수 있다”고 밝혔다.한국일보 자료사진박 대통령이 거부권을 행사하면 상황은 더 복잡해진다. 19대 국회 임기 중에 거부권을 행사한다 해도 남은 회기 내에 개정 국회법 재의결을 위한 ‘원포인트 본회의’를 열 수 없다. 또 재의결 절차가 20대 국회로 넘어간다면, 20대 국회의원들이 19대 국회에서 통과시킨 법안을 재의결할 수 있는지를 두고 논란이 커질 것이다. 국회 의안과는 여러 가능성을 놓고 검토 중이다.23일 정부로 이송되는 국회법이 24일 열리는 국무회의에서 의결돼 공포되면 논란은 자연스럽게 해소된다. 그러나 정부는 검토 시간이 필요하다는 이유로 24일엔 국회법을 의제로 올리지 않을 예정이다. 정진석 원내대표는 본보 통화에서 “거부권은 대통령이 가진 의회에 대한 견제수단으로 행사하는 것은 당연한 권리”라며 “상시 청문회를 가능케 하는 국회법은 정부의 국정운영을 마비시키는 제2의 국회선진화법이기 때문에 반드시 무효화해야 한다”고 말했다. 청와대는 22일 거부권 행사와 관련해 언급을 자제한 채 여론을 주시했다.정승임 기자 choni@hankookilbo.com[아직 모르시나요? 반칙없는 뉴스 바로가기] [한국일보 페이스북] [신문에는 없는 뉴스] [꿀잼 동영상][ⓒ 한국일보(hankookilbo.com), 무단 전재 및 재배포 금지]"
55,2016-05-22,자동차 3ㆍ9ㆍ12월에 잘 팔리는 이유는,https://news.naver.com/main/read.nhn?mode=LSD&mid=shm&sid1=101&oid=469&aid=0000144245,한국일보,"현대경제硏 ‘월별 소비’ 보고서첫차ㆍ신차ㆍ재고 마케팅 호응 때문컴퓨터ㆍ스마트폰은 5ㆍ12월 호조주머니 사정은 비슷해도 개인들의 소비 패턴은 매년 특정 월이나 계절에 따라 크게 달라진다는 분석이 나왔다. 자동차는 3, 9, 12월에 많이 팔렸고, 컴퓨터는 어린이날과 크리스마스가 낀 5, 12월에 판매량이 늘었다.22일 현대경제연구원의 ‘월별 소비변동과 시사점’ 보고서에 따르면 최근 10년간 평균적으로 전달에 비해 소비가 가장 많이 늘어난 달은 3월(8.4%)과 9월(6%), 5월(4.8%)이었다. 반대로 소비가 전달보다 가장 많이 줄어든 달은 겨울철인 1월(-6.7%)과 2월(-6.4%), 여름철인 6월(-3.6%), 8월(-2.8%)로 집계됐다.품목별로는 승용차가 3월과 9월, 12월에 특히 많이 팔렸다. 3월은 생애 첫차 구매 수요가 몰린 덕분에, 9월은 신규 모델 출시 영향으로, 12월은 연말 재고물량 소진 등 기업의 경영 전략에 따라 판매량이 늘었다고 보고서는 분석했다. 음식료품 소비는 설과 추석이 있는 1월과 9월엔 많이 늘고, 다음 달인 2월과 10월에는 큰 폭으로 줄어드는 모습을 보였다. 통신기기ㆍ컴퓨터 등은 가정의 달인 5월과 크리스마스가 있는 12월에 판매량이 가장 많이 늘었다. 신학기가 시작되는 3월엔 서적ㆍ문구처럼 학업과 관련된 소비가 많았다.가전제품 소비는 이사ㆍ결혼이 많은 3월과 여름이 본격 시작되는 5월부터 7월까지 증가율이 높았다. 가구 역시 결혼과 이사가 겹치는 3월과 10월에 판매량이 급증했다. 김천구 연구위원은 “정부가 소비 진작 대책과 경제 정책을 세울 때 이 같은 소비의 계절적 변동을 고려할 필요가 있다”고 말했다.김동욱 기자 kdw1280@hankookilbo.com게티이미지뱅크[아직 모르시나요? 반칙없는 뉴스 바로가기] [한국일보 페이스북] [신문에는 없는 뉴스] [꿀잼 동영상][ⓒ 한국일보(hankookilbo.com), 무단 전재 및 재배포 금지]"
56,2016-05-22,'상시 청문회법' 23일 송부..,https://news.naver.com/main/read.nhn?mode=LSD&mid=shm&sid1=100&oid=469&aid=0000144289,한국일보,"개정 국회법 23일 송부, 법리적 해석 분분정의화 국회의장이 지난 19일 19대 국회 마지막 본회의에서 의사봉을 두드리고 있다. 고영권 기자 youngkoh@hankookilbo.com상임위 차원에서 수시로 청문회를 열 수 있도록 하는 ‘상시 청문회법’(개정 국회법)이 23일 정부로 이송되지만 한 치 앞을 내다볼 수 없는 운명에 놓였다. 국회법이 19대 국회 임기 종료(29일)를 불과 열흘 앞둔 19일 통과되는 바람에 법리적 해석 문제가 얽혀 있어서다. 더구나 정진석 새누리당 원내대표가 22일 “박근혜 대통령의 법안 거부권 행사가 금기(禁忌)일 수 없다”고 국회법에 대한 거부권 행사 필요성을 제기해 거부권 논란이 다시 가열됐다.문제는 19대 국회에서 개정된 국회법에 대한 박 대통령의 공포나 거부권 행사 시점이 20대 국회가 시작하는 30일 이후가 될 경우다. 국회법이 자동 폐기되는지, 재의결 등의 절차가 20대 국회로 이월되는 지 여부를 두고 해석이 엇갈린다. 헌법 53조에 따르면 국회에서 의결돼 정부로 이송된 법안은 정부가 15일 안에 공포해야 하는데, 박 대통령이 19대 국회 임기 중에 공포하지 않으면 회기 종료와 더불어 자동 폐기되는 것 아니냐는 것이다. 이 경우 박 대통령은 굳이 거부권을 행사할 필요가 없어 부담을 덜 수 있다.이에 대해 법제처는 “법안 공포는 19대 국회 회기와 상관 없이 15일 이내에 공포하거나 재의를 요구하면 된다”며 문제가 없다는 입장이다. 그러나 국회 관계자는 “회기 불계속의 원칙(회기 중에 처리되지 않은 법안은 다음 회기까지 계속되지 않는다는 원칙)이 명시된 미국과 달리 우리 국회는 이 부분이 불명확하다”며 “때문에 29일 이후 국회법을 공포하면 자동 폐기되는 것이라는 견해도 있어 논란이 있을 수 있다”고 밝혔다.한국일보 자료사진박 대통령이 거부권을 행사하면 상황은 더 복잡해진다. 19대 국회 임기 중에 거부권을 행사한다 해도 남은 회기 내에 개정 국회법 재의결을 위한 ‘원포인트 본회의’를 열 수 없다. 또 재의결 절차가 20대 국회로 넘어간다면, 20대 국회의원들이 19대 국회에서 통과시킨 법안을 재의결할 수 있는지를 두고 논란이 커질 것이다. 국회 의안과는 여러 가능성을 놓고 검토 중이다.23일 정부로 이송되는 국회법이 24일 열리는 국무회의에서 의결돼 공포되면 논란은 자연스럽게 해소된다. 그러나 정부는 검토 시간이 필요하다는 이유로 24일엔 국회법을 의제로 올리지 않을 예정이다. 정진석 원내대표는 본보 통화에서 “거부권은 대통령이 가진 의회에 대한 견제수단으로 행사하는 것은 당연한 권리”라며 “상시 청문회를 가능케 하는 국회법은 정부의 국정운영을 마비시키는 제2의 국회선진화법이기 때문에 반드시 무효화해야 한다”고 말했다. 청와대는 22일 거부권 행사와 관련해 언급을 자제한 채 여론을 주시했다.정승임 기자 choni@hankookilbo.com[아직 모르시나요? 반칙없는 뉴스 바로가기] [한국일보 페이스북] [신문에는 없는 뉴스] [꿀잼 동영상][ⓒ 한국일보(hankookilbo.com), 무단 전재 및 재배포 금지]"
57,2016-05-22,때 이른 무더위 속 잇단 식중독..,https://news.naver.com/main/read.nhn?mode=LSD&mid=shm&sid1=103&oid=214&aid=0000620870,MBC,"[뉴스데스크]◀ 앵커 ▶이렇게 때 이른 더위가 전국을 덮치면서 식중독 증상을 호소하는 사람들도 많았습니다.이럴 때 어떻게 건강관리를 해야 할지 김미희 기자가 전해 드리겠습니다.◀ 리포트 ▶제주도 서귀포시 성산읍의 한 식당.어젯밤 이곳에서 음식을 먹은 주민 80여 명이 갑자기 설사와 복통 증세를 호소하며 병원을 찾았습니다.식중독 의심 증상으로, 결혼식 피로연에서 회무침 등을 먹고 탈이 난 겁니다.[주민/식중독 증상]""설사하고, 구토 나오고, 몸에 열 좀 나고요.""오늘 새벽 강원도 강릉시에서도 생선회를 먹은 4명이 치료를 받는가 하면, 강원도 고성군에서는 관광객 12명이 집단 식중독 증세를 보였습니다.이렇게 식중독으로 병원을 찾은 환자 수는 지난 5년 동안 3만여 명.기온이 올라가는 4월에서 6월, 그리고 7월에서 9월 사이 환자가 집중됐습니다.[김상일/순천향대 서울병원 응급의학과 교수]""세균의 증식이 있기 때문에 음식물들을 상온에 보관하지 않고요. 그 외 음식물 등을 섭취할 때 깨끗이 씻고요.""해수 온도도 높아져 구토와 설사 등을 유발하는 비브리오 패혈증균이 활발히 번식하는 만큼 어패류는 익혀 먹는 것이 좋습니다.또, 손을 자주 씻고 식기류를 소독하는 등 위생에도 각별히 신경 써야 합니다.보건당국은 때 이른 더위가 기승을 부리면서 어지럼증이나 탈수 등 온열 질환에도 쉽게 노출될 수 있다며 무리한 야외 활동을 피할 것을 당부했습니다.MBC뉴스 김미희입니다.(김미희)[저작권자(c) MBC (www.imnews.com) 무단복제-재배포 금지]▶ MBC뉴스 SNS[페이스북][트위터][카카오스토리]▶ 나흘째 폭염 특보, 불볕더위 계속 ""내일도 더워요""▶ ""강남 화장실 살인은 정신질환자의 '묻지마 범죄'""Copyright(c) Since 1996,MBC&iMBCAll rights reserved."
58,2016-05-22,"""야근수당 달라"" 요구했더니…해고에 협박까지",https://news.naver.com/main/read.nhn?mode=LSD&mid=shm&sid1=102&oid=055&aid=0000411011,SBS,"<앵커>정부가 얼마 전 '열정 페이' 즉 열정을 빌미로 한 저임금 노동을 뿌리 뽑겠다고 공언했는데, 일부 고용주들의 태도는 여전히 안하무인입니다. 한 유명 커피숍에서는 아르바이트생이 야근수당을 요구하자 해고에 협박까지 서슴지 않았습니다.김종원 기자의 생생리포트입니다.<기자>강남 한복판에 있는 대형 프랜차이즈 커피숍.24시간 영업인데, 근로기준법대로라면 밤에 일하는 근무자들은 분명히 시급을 주간보다 더 받아야 합니다.지금 시간이 밤 9시 59분, 그리고 이제 밤 10시가 됐습니다.밤 10시부터는 일을 하고 있는 근로자들의 수당을 평소보다 1.5배 이상 더 줘야 합니다.야간근로수당을 지급해야 하기 때문입니다.그런데 이 커피숍에서 일했던 이 아르바이트생은 밤에 일하고도 야근수당을 한 푼도 받지 못했습니다.[이 모 씨/유명 프랜차이즈 커피숍 아르바이트생 : 오후 5시부터 11시 반까지 했어요. (밤 10시부터가 야근이니까) 1시간 반 동안 야간 근무를 한 거죠. 그런데 실제 월급은 그냥 (주간 시급으로) 6,100원 받았어요.]일 한 지 4개월이 지나서야 사장에게 야근수당을 요구해봤지만, 돌아온 건 '해고 통지'였습니다.[커피숍 사장 실제 통화 내용 : (야근수당 미지급건에 대해서는) 알아서 고소하실 건 고소하시고요. 저희 쪽에선 CCTV 다 돌려서 혹시라도 음료를 드셨거나 이런 거는 (월급에서) 다 제해가지고 처리 하겠습니다. 그리고 이번 주부터는 나오지 마십쇼.]해고가 끝이 아니었습니다.며칠 뒤 다시 걸려온 사장의 전화.[커피숍 사장 실제 통화 내용 : 저희 쪽에서 지금 CCTV 다 체크를 했는데, 이XX 씨가 음료 마시고 이런 절도 부분이 있어요. 이런 부분 알아서 저희가 소송을 넣겠습니다.][저는 진짜 빨대 한 개 가져온 게 없거든요, 정말로. CCTV 얘기를 하면 (아르바이트 생들이) 되게 압박을 받는다고 생각을 하나 봐요. 일종의 협박처럼.]이 씨는 노동청에 진정을 넣었고, 사장은 그제서야 밀린 야근수당을 지급했습니다.사장이 떼먹으려 했던 야근수당은 겨우 13만 원.[제가 재수 없었다 생각하고 안 받으면 되는 돈이지만, 아르바이트생으로서 권리를 찾아야 할 거 같아서 진정을 넣었습니다. 아르바이트라고 너무 무시 받았던 것 같아요.]청년단체인 알바 노조가 지난달 서울과 경기도의 아르바이트생 야근수당 실태를 조사한 결과, 제대로 지급하는 업소는 절반밖에 되지 않았습니다.[최기원/'알바노조' 대변인 : (임금을 체납해도) 처벌받지 않는다는 게 중요한 것 같아요. 국가가 (아르바이트생을) 보호해 주지 않기 때문에, (체납 업주들은) 이 정도 금액을 주어도 특별한 문제 제기를 받은 적이 없었던 것이죠.]정부가 열정페이를 근절하겠다고 발표했지만, 아직 갈 길은 멀어보입니다.(영상편집 : 박정삼, VJ : 김준호, 이준영)▶ [1컷 카드뉴스] 최저임금보다 못한 내 열정김종원 기자(terryable@sbs.co.kr)※ ⓒ SBS & SBS콘텐츠허브 : 무단복제 및 재배포 금지"
