,날짜,기사 제목,기사 링크,기사 출처,기사 내용
98,2016-05-22,"""셀카 자주찍는 사람, 자기 자신 과대 평가""",https://news.naver.com/main/read.nhn?mode=LSD&mid=shm&sid1=103&oid=014&aid=0003651744,파이낸셜뉴스,"셀카 사진을 자주 찍는 사람은 본인의 매력을 과대평가 하는 경향이 있다는 연구결과가 나왔다.20일(현지시간) 영국일간지 텔레그래프는 토론토 대학 연구결과 셀카를 많이 찍는 사람은 타인들의 평가보다 스스로를 더 매력적으로 평가하는 것으로 나타났다고 보도했다.연구팀은 셀프 카메라를 자주 찍는 100명이 포함된 198명의 학생들을 대상으로 실험했다. 각 참가자들은 스마트폰 카메라를 이용해 셀카를 찍었고 서로 사진을 찍어주기도 했다.그리고 난 뒤 연구자들은 각각의 사진을 친구들이 얼마나 매력적으로 생각할 것 같은지 점수를 매기도록 했다. 사진은 178명의 또다른 사람들에게 사진의 주인공이 얼마나 매력적으로 보이는지, 또 얼마나 자아도취에 빠져 있는 것 같은 지를 묻고 이를 점수화 해 측정했다.실험결과 셀프 사진 찍기를 좋아하는 쪽이나 그렇지 않은 쪽이나 모두 객관적인 평가자들보다 더 자신들을 매력적으로 평가했다. 그러나 셀프 사진 찍기를 좋아하는 집단의 점수가 눈에 띄게 높았다. 또 이들은 다른 사람이 찍어준 사진보다 셀카가 더 잘 나왔다고 답했다.연구자들은” 셀프 사진을 자주 찍는 사람들은 자신을 과도하게 긍정적으로 평가하는 것으로 나타났다”며 “현실에서 객관적인 평가자들은 실험대상의 셀카 사진이 덜 매력적이라고 평가한 것으로 평가했다. 이러한 편향성은 셀프 카메라를 잘 찍지 않는 사람에게는 나타나지 않았다”고 설명했다.토론토 대학 심리학과의 다니엘 레 교수가 주도한 이번 연구는 학술지 '사회과학과 인지심리학'에 실렸다.(사진=게티이미지뱅크)djkim@fnnews.com 김동진 기자※ 저작권자 ⓒ파이낸셜뉴스. 무단 전재-재배포 금지"
99,2016-05-22,"무디스,경제-정치 예측모델 돌려보니…""올 대선, 힐러리..""",https://news.naver.com/main/read.nhn?mode=LSD&mid=shm&sid1=104&oid=014&aid=0003651753,파이낸셜뉴스,"【 뉴욕=정지원 특파원】국제신용평가사인 무디스가 운영하는 '무디스 애널리틱스'가 올 가을 미국 대선에서 사실상 민주당 대선후보인 힐러리 클린턴 전 국무장관의 승리를 점쳤다.미 의회 전문지인 '더 힐'에 따르면 무디스 애널리틱스는 오는 11월 대선에서 민주당의 클린턴이 전체 선거인단 538명 중 332명을 확보하며 공화당 후보인 부동산재벌 도널드 트럼프를 누르고 차기 대통령으로 선출될 것이라고 예상했다.이와 같은 예측은 대선 직전까지 미국 각 주의 임금과 일자리 수 변동 등 각종 경제적 및 정치적 변수를 감안한 것이라고 무디스는 전했다. 클린턴은 대선 역사를 볼 때 중요한 경합주로 꼽히는 오하이오와 플로리다, 버지니아, 펜실베이니아, 네바다 주에서 근소한 차로 트럼프를 제압할 것으로 보인다고 무디스 애널리틱스는 내다봤다.1980년 만들어진 무디스 애널리틱스의 선거예측모델은 지금까지 대선의 승자를 모두 정확히 맞췄다.더 힐에 따르면 무디스 애널리틱스는 올해 대선과 관련, 지난해 7월부터 민주당 후보가 대선에서 승리할 것으로 계속 예측해왔다.특히 이번 대선에서 버락 오바마 대통령의 지지율이 상승세를 타고 있는 사실이 클린턴의 승리 가능성에 힘을 실어줄 것이라고 분석했다. 여론조사기관인 갤럽이 최근 실시한 오바마 대통령의 업무 수행 지지율 여론조사에서 51%가 긍정적인 평가를 내렸다.이코노미스트인 댄 화이트는 ""오바마 대통령이 약 4년 만에 처음으로 지지율에서 50%선을 돌파했다""고 지적했다.클린턴 당선 가능성은 높게 보는 곳은 산업계와 월가 등이 우선적으로 꼽힌다. 실제 CNBC가 최근 미 기업 최고재무책임자(CFO)를 대상으로 실시한 대선 관련 설문조사에서 무려 83%의 응답자가 클린턴이 차기 대통령으로 당선될 것이라고 대답했다. 트럼프를 꼽은 사람은 13%에 불과했다. 또한 펀드매니저나 애널리스트 등 금융업계 종사자들을 상대로 실시한 설문조사에서도 80%의 응답자가 클린턴을 대선 승자로 예상했다.이는 최근 트럼프가 지지율에서 클린턴을 넘어섰다는 일부 여론조사 결과와는 상반된 것이다. 여론조사기관 라스무센이 지난 19일 발표한 설문조사 결과에 따르면 트럼프에 대한 지지율이 클린턴에 비해 각각 5%포인트 앞선 것으로 나타난 바 있으며 폭스뉴스 여론조사에서도 트럼프가 클린턴을 3%포인트 앞선 것으로 나타났다.한편 미국 최대 로비단체인 전미총기협회(NRA)는 트럼프를 지지하겠다고 공개적으로 밝혔다. 영국 일간 가디언은 이와관련 ""트럼프가 한때 총기 규제를 옹호하는 발언을 하기 했지만 NRA는 (경선 내내 총기 규제에 반대한) 트럼프가 클린턴보다는 나은 대안이라고 여기는 것 같다""고 설명했다. jjung72@fnnews.com※ 저작권자 ⓒ파이낸셜뉴스. 무단 전재-재배포 금지"
100,2016-05-22,"강남 묻지마 살인,정신질환자 전형적 범죄..'女가 괴롭혀'망상",https://news.naver.com/main/read.nhn?mode=LSD&mid=shm&sid1=102&oid=001&aid=0008419001,연합뉴스,"경찰 심리 분석 결과 발표…'여성들이 견제·괴롭혀' 피해 망상서빙하던 식당서 불결함 지적…'女음해' 망상이 범행 촉발(서울=연합뉴스) 설승은 기자 = 서울 강남역 인근 주점 건물 화장실 살인사건을 수사 중인 경찰이 이번 사건을 정신질환자의 묻지마 범죄라고 결론 내렸다.서울지방경찰청은 프로파일러를 투입해 피의자 김모(34·구속)씨를 19일과 20일 두 차례 심리면담해 종합 분석한 결과 전형적인 피해망상 조현병(정신분열증)에 의한 묻지마 범죄 유형에 부합했다고 22일 밝혔다.김씨는 2003∼2007년 ""누군가 나를 욕하는 것이 들린다""고 자주 호소하며 피해망상 증세를 보였다.   이 증세는 2년 전 김씨가 특정 집단에서 소속되면서 '여성들이 자신을 견제하고 괴롭힌다'는 피해망상으로 변화됐다.김씨는 서빙 일을 하던 식당에서 이달 5일 위생 상태가 불결하다는 지적을 받고 이틀 뒤 주방 보조로 옮겼는데, 이 일이 여성 음해 때문이라는 생각을 한 것이 범행을 촉발한 요인이 됐다고 경찰은 분석했다.경찰은 범행 당시 김씨의 망상 증세가 심화한 상태였고 표면적인 동기가 없다는 점, 피해자와의 관계에서 직접적인 범죄 촉발 요인이 없다는 점 등을 들어 이번 사건이 묻지마 범죄 중 정신질환 유형에 해당한다고 설명했다.또 김씨가 화장실에 들어온 여성을 보자마자 바로 공격한 점으로 미루어 범행 목적성에 비해 범행 계획이 체계적이지 않아 전형적인 정신질환 범죄의 특성을 보이고 있다고 설명했다.서울청 프로파일러는 ""김씨가 2년 전 소속됐던 특정 집단의 여성들로부터 사소하지만 기분 나쁜 일들을 겪었다고 얘기했다""며 ""그러나 이미 그전부터 피해 망상 증상이 나타났었고, 명확한 근거도 없어 이 또한 피해 망상으로 왜곡해 인지한 것일 가능성이 있다""고 설명했다.그는 ""김씨가 여성들이 자신을 싫어한다는 근거로 든 내용에 '여성들이 자기가 일하러 갈 때 의도적으로 지하철에서 천천히 걸어 자기를 지각하게 한다'는 등 일반적으로 받아들이기 어려운 내용도 포함돼 있다""고 말했다.그러면서 ""김씨가 '내가 여성들로부터 여러 피해를 당했지만 참았는데 최근에는 일까지 못하게 되는 등 직업적으로 피해를 입어 더이상은 못참겠다고 느꼈다. 이렇게 있다가는 내가 죽을 거 같으니 내가 먼저 죽여야겠다'고 진술했다""고 전했다.외아들인 김씨는 부모와 거의 대화 없이 지내는 등 가족과 단절된 생활을 해왔고, 청소년 때부터 앉고 서기를 반복하는 특이 행동을 보이거나 대인관계를 꺼려왔다고 경찰은 전했다.체포된 '묻지마 살인' 피의자    (서울=연합뉴스) 서명곤 기자 =  17일 새벽 서울 서초구의 한 주점 화장실에서 여성을  마구 찔러 살해한 혐의를 받고 있는 김모씨가 19일 오후 서울 서초구 서초경찰서에서 영장실질심사를 받기 위해 서울중앙지법으로 향하고 있다.    2016.5.19    seephoto@yna.co.kr아울러 김씨가 2008년부터는 1년 이상 씻지 않는다거나 노숙을 하는 등 일상생활에서 기본적인 자기 관리 기능을 잃었다고 분석했다. 자신의 정신질환에 대한 인식도 거의 없던 것으로 파악됐다.앞서 경찰은 김씨가 중학교 때부터 비공격적인 분열증세를 보였고, 2008년 조현병 진단 후 6차례 19개월 2주 가량 입원치료를 받았지만 올 1월 마지막 퇴원 후 약을 끊어 증세가 악화해 범행했다고 밝힌 바 있다.서울청 프로파일러는 ""혐오(증오)범죄와 정신질환 범죄는 구분해 정의를 내려야 하는데 이 경우는정신질환 범죄""라며 ""혐오범죄는 특정 집단에 대한 편견에 기인한 것이고, 정신질환 범죄는 정신질환 때문에 생긴 특정 집단에 대한 피해망상과 환청 등 때문에 일어나는 것""이라고 설명했다.그러면서 ""피해망상 때문에 반감을 가지는 것은 혐오범죄에 속하지 않는다""며 ""지난해 특정 민족이 한국에 와서 한국을 망친다는 망상을 지닌 환자가 해당 민족 사람 3명을 살해했는데 이는 환자의 피해망상에 의한 정신질환 범죄이지 인종혐오 범죄라고 보기 어렵다""고 설명했다.경찰은 정확한 범행 동기를 밝히려고 19일 프로파일러 3명을 투입해 약 1시간 30분 김씨를 1차 면담하고, 다음날 경찰청 범죄행동분석팀장 권일용 경감 등 프로파일러 2명을 추가 투입해 4시간 동안 2차 면담을 해 심리 검사를 했다.김씨는 17일 0시 33분 주점 건물 남녀공용 화장실에 들어가 있다가 남성 6명이 들고 난 후인 같은 날 오전 1시 7분 화장실에 들어온 첫 여성인 A(23)씨를 흉기로 살해했다.사건 당일 경찰은 ""평소 여성에게 무시당해 범행했다""는 김씨 진술을 언론에 밝혔고, 여성혐오 범죄라는 분석이 제기돼 전국에 피해 여성의 추모열기가 확산했다.한편 김씨는 경찰 조사에서 ""일반 여성들에 대한 반감은 전혀 없고, 여성혐오 때문이 아니라 여성들로부터 실제 피해를 당했기 때문에 범행을 저지른 것""이라고 진술했다.또 인터넷 상 여성혐오에 대해서는 ""어린 사람들의 치기 어린 행동인 것 같고, 나는 그런 이들과 다르다""고 말한 것으로 전해졌다.ses@yna.co.kr▶ [핫클릭] 엄마 ""놀이공원서 시간가는줄 몰라""…집에 재운 2개월 아들 숨져▶ [핫클릭] 5월 폭염. 몽골 더운 바람이 한반도에 갇힌 탓▶ [통통영상] ""영어로만 주문받아요"" 미국 아이스크림 가게 논란<저작권자(c) 연합뉴스, 무단 전재-재배포 금지>"
101,2016-05-22,"강남 묻지마 살인, 정신질환자 전형적 범죄..'女가 괴롭혀' 망상",https://news.naver.com/main/read.nhn?mode=LSD&mid=shm&sid1=102&oid=001&aid=0008419001,연합뉴스,"경찰 심리 분석 결과 발표…'여성들이 견제·괴롭혀' 피해 망상서빙하던 식당서 불결함 지적…'女음해' 망상이 범행 촉발(서울=연합뉴스) 설승은 기자 = 서울 강남역 인근 주점 건물 화장실 살인사건을 수사 중인 경찰이 이번 사건을 정신질환자의 묻지마 범죄라고 결론 내렸다.서울지방경찰청은 프로파일러를 투입해 피의자 김모(34·구속)씨를 19일과 20일 두 차례 심리면담해 종합 분석한 결과 전형적인 피해망상 조현병(정신분열증)에 의한 묻지마 범죄 유형에 부합했다고 22일 밝혔다.김씨는 2003∼2007년 ""누군가 나를 욕하는 것이 들린다""고 자주 호소하며 피해망상 증세를 보였다.   이 증세는 2년 전 김씨가 특정 집단에서 소속되면서 '여성들이 자신을 견제하고 괴롭힌다'는 피해망상으로 변화됐다.김씨는 서빙 일을 하던 식당에서 이달 5일 위생 상태가 불결하다는 지적을 받고 이틀 뒤 주방 보조로 옮겼는데, 이 일이 여성 음해 때문이라는 생각을 한 것이 범행을 촉발한 요인이 됐다고 경찰은 분석했다.경찰은 범행 당시 김씨의 망상 증세가 심화한 상태였고 표면적인 동기가 없다는 점, 피해자와의 관계에서 직접적인 범죄 촉발 요인이 없다는 점 등을 들어 이번 사건이 묻지마 범죄 중 정신질환 유형에 해당한다고 설명했다.또 김씨가 화장실에 들어온 여성을 보자마자 바로 공격한 점으로 미루어 범행 목적성에 비해 범행 계획이 체계적이지 않아 전형적인 정신질환 범죄의 특성을 보이고 있다고 설명했다.서울청 프로파일러는 ""김씨가 2년 전 소속됐던 특정 집단의 여성들로부터 사소하지만 기분 나쁜 일들을 겪었다고 얘기했다""며 ""그러나 이미 그전부터 피해 망상 증상이 나타났었고, 명확한 근거도 없어 이 또한 피해 망상으로 왜곡해 인지한 것일 가능성이 있다""고 설명했다.그는 ""김씨가 여성들이 자신을 싫어한다는 근거로 든 내용에 '여성들이 자기가 일하러 갈 때 의도적으로 지하철에서 천천히 걸어 자기를 지각하게 한다'는 등 일반적으로 받아들이기 어려운 내용도 포함돼 있다""고 말했다.그러면서 ""김씨가 '내가 여성들로부터 여러 피해를 당했지만 참았는데 최근에는 일까지 못하게 되는 등 직업적으로 피해를 입어 더이상은 못참겠다고 느꼈다. 이렇게 있다가는 내가 죽을 거 같으니 내가 먼저 죽여야겠다'고 진술했다""고 전했다.외아들인 김씨는 부모와 거의 대화 없이 지내는 등 가족과 단절된 생활을 해왔고, 청소년 때부터 앉고 서기를 반복하는 특이 행동을 보이거나 대인관계를 꺼려왔다고 경찰은 전했다.체포된 '묻지마 살인' 피의자    (서울=연합뉴스) 서명곤 기자 =  17일 새벽 서울 서초구의 한 주점 화장실에서 여성을  마구 찔러 살해한 혐의를 받고 있는 김모씨가 19일 오후 서울 서초구 서초경찰서에서 영장실질심사를 받기 위해 서울중앙지법으로 향하고 있다.    2016.5.19    seephoto@yna.co.kr아울러 김씨가 2008년부터는 1년 이상 씻지 않는다거나 노숙을 하는 등 일상생활에서 기본적인 자기 관리 기능을 잃었다고 분석했다. 자신의 정신질환에 대한 인식도 거의 없던 것으로 파악됐다.앞서 경찰은 김씨가 중학교 때부터 비공격적인 분열증세를 보였고, 2008년 조현병 진단 후 6차례 19개월 2주 가량 입원치료를 받았지만 올 1월 마지막 퇴원 후 약을 끊어 증세가 악화해 범행했다고 밝힌 바 있다.서울청 프로파일러는 ""혐오(증오)범죄와 정신질환 범죄는 구분해 정의를 내려야 하는데 이 경우는정신질환 범죄""라며 ""혐오범죄는 특정 집단에 대한 편견에 기인한 것이고, 정신질환 범죄는 정신질환 때문에 생긴 특정 집단에 대한 피해망상과 환청 등 때문에 일어나는 것""이라고 설명했다.그러면서 ""피해망상 때문에 반감을 가지는 것은 혐오범죄에 속하지 않는다""며 ""지난해 특정 민족이 한국에 와서 한국을 망친다는 망상을 지닌 환자가 해당 민족 사람 3명을 살해했는데 이는 환자의 피해망상에 의한 정신질환 범죄이지 인종혐오 범죄라고 보기 어렵다""고 설명했다.경찰은 정확한 범행 동기를 밝히려고 19일 프로파일러 3명을 투입해 약 1시간 30분 김씨를 1차 면담하고, 다음날 경찰청 범죄행동분석팀장 권일용 경감 등 프로파일러 2명을 추가 투입해 4시간 동안 2차 면담을 해 심리 검사를 했다.김씨는 17일 0시 33분 주점 건물 남녀공용 화장실에 들어가 있다가 남성 6명이 들고 난 후인 같은 날 오전 1시 7분 화장실에 들어온 첫 여성인 A(23)씨를 흉기로 살해했다.사건 당일 경찰은 ""평소 여성에게 무시당해 범행했다""는 김씨 진술을 언론에 밝혔고, 여성혐오 범죄라는 분석이 제기돼 전국에 피해 여성의 추모열기가 확산했다.한편 김씨는 경찰 조사에서 ""일반 여성들에 대한 반감은 전혀 없고, 여성혐오 때문이 아니라 여성들로부터 실제 피해를 당했기 때문에 범행을 저지른 것""이라고 진술했다.또 인터넷 상 여성혐오에 대해서는 ""어린 사람들의 치기 어린 행동인 것 같고, 나는 그런 이들과 다르다""고 말한 것으로 전해졌다.ses@yna.co.kr▶ [핫클릭] 엄마 ""놀이공원서 시간가는줄 몰라""…집에 재운 2개월 아들 숨져▶ [핫클릭] 5월 폭염. 몽골 더운 바람이 한반도에 갇힌 탓▶ [통통영상] ""영어로만 주문받아요"" 미국 아이스크림 가게 논란<저작권자(c) 연합뉴스, 무단 전재-재배포 금지>"
102,2016-05-22,지뢰 '펑'…DMZ 주변서 산나물 뜯다 40대 중상,https://news.naver.com/main/read.nhn?mode=LSD&mid=shm&sid1=102&oid=001&aid=0008419072,연합뉴스,"(양구=연합뉴스) 이해용 기자 = 산나물 채취 시기 등을 맞아 휴전선 주변에서 지뢰 폭발사고가 잇따르고 있다.22일 낮 12시 47분께 강원 양구군 해안면 현리의 한 야산에서 김모(42·양구읍)씨가 발목 지뢰로 추정되는 폭발물이 터져 왼쪽 발을 다쳤다.산나물을 뜯으러 왔다가 지뢰를 밟은 김 씨는 헬기로 서울의 한 병원으로 긴급 이송됐다.비무장지대(DMZ) 주변은 외지인의 출입이 적어 고사리 등 산나물이 풍부하지만 곳곳에 지뢰와 폭발물이 도사리고 있어 위험하다.경찰 관계자는 ""김 씨가 고사리를 뜯고자 혼자 산으로 들어가다가 산나물도 뜯지 못하고 지뢰를 밟았다""며서 ""철조망이 있었던 것 같은데 출입을 금지하는 지뢰 표지판은 없었다""고 설명했다.양구 발목지뢰 피해자 긴급 이송    (양구=연합뉴스) 22일 119구조대가 강원 양구군 해안면 현리의 한 야산에서 산나물을 채취하다가    발목 지뢰가 폭발해 부상한 김 모 씨를 이송하기에 앞서 응급처치를 하고 있다. 2016.5.22 [강원도 소방본부]    dmz@yna.co.kr양구 해안면에서는 지난달 4일 낮 12시 54분께도 지뢰가 폭발해 50대 외국인 근로자 A씨가 크게 다쳤다.농장에서 돈을 벌고자 낯선 땅에 왔던 카자흐스탄 국적의 근로자 A(54)씨는 농장 앞 개울에 들어갔다가 지뢰가 폭발해 오른쪽 발가락 등이 절단됐다.DMZ@yna.co.kr▶ [핫클릭] 엄마 ""놀이공원서 시간가는줄 몰라""…집에 재운 2개월 아들 숨져▶ [핫클릭] 가수 크러쉬 '내가 멍때리기 챔피언'…외국인 등 70명 출전▶ [현장영상] ""아내와 딸 데려와""…30대 투신 소동<저작권자(c) 연합뉴스, 무단 전재-재배포 금지>"
103,2016-05-22,"강남 묻지마 살인,정신질환자 전형적 범죄..'女가 괴롭혀' 망상",https://news.naver.com/main/read.nhn?mode=LSD&mid=shm&sid1=102&oid=001&aid=0008418584,연합뉴스,"경찰 심리 분석 결과 발표…'여성들이 견제·괴롭혀' 피해 망상서빙하던 식당서 불결함 지적…'女음해' 망상이 범행 촉발(서울=연합뉴스) 설승은 기자 = 서울 강남역 인근 주점 건물 화장실 살인사건을 수사 중인 경찰이 이번 사건을 정신질환자의 묻지마 범죄라고 결론 내렸다.서울지방경찰청은 프로파일러를 투입해 피의자 김모(34·구속)씨를 19일과 20일 두 차례 심리면담해 종합 분석한 결과 전형적인 피해망상 조현병(정신분열증)에 의한 묻지마 범죄 유형에 부합했다고 22일 밝혔다.김씨는 2003∼2007년 ""누군가 나를 욕하는 것이 들린다""고 자주 호소하며 피해망상 증세를 보였다.이 증세는 2년 전 김씨가 특정 집단에서 소속되면서 '여성들이 자신을 견제하고 괴롭힌다'는 피해망상으로 변화됐다.김씨는 서빙 일을 하던 식당에서 이달 5일 위생 상태가 불결하다는 지적을 받고 이틀 뒤 주방 보조로 옮겼는데, 이 일이 여성 음해 때문이라는 생각을 한 것이 범행을 촉발한 요인이 됐다고 경찰은 분석했다.경찰은 범행 당시 김씨의 망상 증세가 심화한 상태였고 표면적인 동기가 없다는 점, 피해자와의 관계에서 직접적인 범죄 촉발 요인이 없다는 점 등을 들어 이번 사건이 묻지마 범죄 중 정신질환 유형에 해당한다고 설명했다.또 김씨가 화장실에 들어온 여성을 보자마자 바로 공격한 점으로 미루어 범행 목적성에 비해 범행 계획이 체계적이지 않아 전형적인 정신질환 범죄의 특성을 보이고 있다고 설명했다.서울청 프로파일러는 ""김씨가 2년 전 소속됐던 특정 집단의 여성들로부터 사소하지만 기분 나쁜 일들을 겪었다고 얘기했다""며 ""그러나 이미 그전부터 피해 망상 증상이 나타났었고, 명확한 근거도 없어 이 또한 피해 망상으로 왜곡해 인지한 것일 가능성이 있다""고 설명했다.그는 ""김씨가 여성들이 자신을 싫어한다는 근거로 든 내용에 '여성들이 자기가 일하러 갈 때 의도적으로 지하철에서 천천히 걸어 자기를 지각하게 한다'는 등 일반적으로 받아들이기 어려운 내용도 포함돼 있다""고 말했다.체포된 '묻지마 살인' 피의자    (서울=연합뉴스) 서명곤 기자 =  17일 새벽 서울 서초구의 한 주점 화장실에서 여성을  마구 찔러 살해한 혐의를 받고 있는 김모씨가 19일 오후 서울 서초구 서초경찰서에서 영장실질심사를 받기 위해 서울중앙지법으로 향하고 있다.    2016.5.19    seephoto@yna.co.kr외아들인 김씨는 부모와 거의 대화 없이 지내는 등 가족과 단절된 생활을 해왔고, 청소년 때부터 앉고 서기를 반복하는 특이 행동을 보이거나 대인관계를 꺼려왔다고 경찰은 전했다.아울러 김씨가 2008년부터는 1년 이상 씻지 않는다거나 노숙을 하는 등 일상생활에서 기본적인 자기 관리 기능을 잃었다고 분석했다. 자신의 정신질환에 대한 인식도 거의 없던 것으로 파악됐다.앞서 경찰은 김씨가 중학교 때부터 비공격적인 분열증세를 보였고, 2008년 조현병 진단 후 4차례 입원치료를 받았지만 올 1월 마지막 퇴원 후 약을 끊어 증세가 악화해 범행했다고 밝힌 바 있다.서울청 프로파일러는 ""혐오범죄와 정신질환 범죄는 구분해 정의를 내려야 하는데 이 경우는 정신질환 범죄""라며 ""지난해 특정 민족이 한국에 와서 한국을 망친다는 망상을 지닌 환자가 해당 민족 사람 3명을 살해했는데 이는 환자의 피해망상에 의한 정신질환 범죄이지 인종혐오 범죄라고 보기 어렵다""고 설명했다.경찰은 정확한 범행 동기를 밝히려고 19일 프로파일러 3명을 투입해 약 1시간 30분 김씨를 1차 면담하고, 다음날 경찰청 범죄행동분석팀장 권일용 경감 등 프로파일러 2명을 추가 투입해 4시간 동안 2차 면담을 해 심리 검사를 했다.김씨는 17일 0시 33분 주점 건물 남녀공용 화장실에 들어가 있다가 남성 6명이 들고 난 후인 같은 날 오전 1시 7분 화장실에 들어온 첫 여성인 A(23)씨를 흉기로 살해했다.사건 당일 경찰은 ""평소 여성에게 무시당해 범행했다""는 김씨 진술을 언론에 밝혔고, 여성혐오 범죄라는 분석이 제기돼 전국에 피해 여성의 추모열기가 확산했다.ses@yna.co.kr▶ [핫클릭] 5월 폭염. 몽골 더운 바람이 한반도에 갇힌 탓▶ [핫클릭] ""시간가는 줄 모르고 놀다보니…"" 철부지 엄마의 뒤늦은 후회▶ [통통영상] ""영어로만 주문받아요"" 미국 아이스크림 가게 논란<저작권자(c) 연합뉴스, 무단 전재-재배포 금지>"
