,날짜,기사 제목,기사 링크,기사 출처,기사 내용
94,2016-05-25,같은 듯 다른 애플과 화웨이의 특허소송,https://news.naver.com/main/read.nhn?mode=LSD&mid=shm&sid1=105&oid=092&aid=0002097081,ZDNet Korea,"애플 ""안드로이드 말살"" vs 화웨이 ""특허 공유?""(지디넷코리아=김익현 기자)화웨이는 ‘제2의 삼성’으로 떠오를까요? 아니면 과한 욕심으로 ‘애플의 실패’를 되풀이할까요?중국 스마트폰 대표주자 화웨이가 삼성을 전격 제소하면서 향후 추이에 관심이 쏠리고 있습니다. 일부 언론들이 ‘성장을 위한 삼성 발목잡기’란 분석을 내놓고 있습니다.스마트폰 시장 후발주자였던 삼성이 최고 기업 애플과 소송을 통해 성장한 걸 그대로 답습하려는 전략이란 분석입니다.과연 그럴까요? 전 그 부분은 쉽게 단정할 수 없다고 생각합니다. ‘짝퉁’ 어쩌고 하는 것도 화웨이를 잘 모를 때 내놓을 수 있는 분석이구요. 화웨이가 그리 만만한 기업은 아니란 겁니다.(사진=화웨이)한 가지 예를 들어볼까요? 톰슨 로이터는 이달 중순 세계 통신시장에서 가장 혁신적인 10대 기업이란 자료를 발표했습니다. 그 자료에 보면 1위가 삼성이고, 2위가 화웨이입니다. 퀄컴, 에릭슨, 소니 같은 내로라하는 기업들도 전부 화웨이 밑에 자리잡고 있습니다.화웨이의 연구개발(R&D) 능력도 만만치 않습니다. 일단 지난 해 R&D 투자 비용은 91억8천만 달러에 이릅니다. 전체 매출의 15.1%수준입니다. 화웨이가 소장에서 밝힌 내용이니까 그대로 믿어도 될 것 같습니다.R&D 관련 인력이 총 7만9천명으로 글로벌 인력의 45%에 이른다고 주장하고 있습니다. 단순히 ‘짝퉁 기업’이라고 폄하할 수준이 아니란 겁니다.■ 애플, '안드로이드 말살' 의도로 출발자, 이런 배경을 깔고 화웨이와 애플의 소송을 한번 비교해볼까요?일단 삼성과 애플 간의 길고도 지리한 특허 소송 얘기부터 시작하죠. 그러기 위해선 시간을 5년 전으로 되돌려야 합니다.때는 2011년 4월 15일. 당대 최고 기업 애플이 삼성을 전격 제소했습니다. 원래 애플이 염두에 둔 건 삼성이 아니었습니다. 안드로이드 맹주였던 구글이었지요. 실제로 그 무렵 스티브 잡스는 구글을 강도 높게 비판했습니다.하지만 애플은 결국 삼성을 택했습니다. 여러 가지 전략적인 고려를 한 끝에 나온 조치였습니다. 구글을 제소할 경우엔 기술 논쟁을 해야 했습니다. 1심부터 쉽지 않을 가능성이 많습니다. 그보단 삼성 단말기를 배심원들 앞에서 흔드는 게 훨씬 효과적이지요.물론 삼성이 갤럭시 개발 과정에서 애플을 강하게 벤치마킹한 부분도 고려했을 겁니다.(사진=씨넷)한번 시작된 애플의 공세는 멈추지 않았습니다. 1년 뒤인 2012년 초 또 다시 삼성에 소장을 보냈습니다. 디자인 특허가 중심이던 1차 소송과 달리 2차 소송은 ‘데이터 태핑’ 같은 기술에 초점을 맞췄습니다.초기엔 소기의 성과를 거뒀습니다. 갤럭시 개발 과정을 담은 삼성 내부 문건이 공개되면서 “카피캣”이란 비난을 받도록 만들었습니다. 배심원들 역시 10억 달러란 천문학적 배상금을 부과했습니다. 고의로 애플 특허를 침해했다면서 징벌적 제재에 가까운 평결을 내놨습니다.하지만 이후 상황은 애플 생각과 다르게 흘렀습니다. 오히려 삼성에 날개를 달아주는 결과로 이어졌습니다. 게다가 삼성은 특유의 ‘패스트 팔로워 전략’으로 시장에서도 성공을 거뒀습니다. 2013년 무렵부터 스마트폰 시장 1위로 올라서는 데 성공했습니다.고 스티브 잡스. 그는 '안드로이드와 핵전쟁도 불사하겠다'고 선언할 정도로 강경했다.재판 흐름도 바뀌었습니다. 밀어서 잠금 해제, 둥근 모서리 디자인을 비롯한 애플 특허권들이 연이어 무효 판결을 받으면서 삼성은 절대 불리할 것 없는 상황으로 만드는 데 성공했습니다. 특히 상용 특허가 중심이 된 2차 소송 항소심에선 아예 승부를 뒤집어버렸습니다.■ 화웨이, 표준특허가 주무기…말살 운운 불가이제 시간을 훌쩍 건너뛰어 봅시다. 화웨이는 24일(현지 시각) 삼성을 제소했습니다. 4G 관련 표준 특허 11개(+a)를 침해했다는 혐의입니다. 미국 샌프란시스코 지역법원과 중국 선전 인민법원에 동시에 소장을 접수시켰습니다.일단 모양새만 놓고 보면 “화웨이가 제2의 삼성을 노린다”는 주장은 설득력을 갖기 쉽지 않습니다. 삼성이 애플과 소송을 통해 강자로 부상한 건 맞지만, 그건 어디까지나 결과론입니다.전 오히려 애플에게 삼성과 특허 소송은 베트남전과 비슷하다고 생각하는 편입니다. 무차별 폭격으로 간단하게 승부 끝내려다가 오히려 미궁에 빠져버린 전쟁. 이젠 적당한 출구를 모색해야 하는 상황.그런 면에서 화웨이는 조금 다릅니다. 소송을 통해 삼성의 싹을 자르겠다고 나설 정도는 못 됩니다.(사진=화웨이 소송 문건)더 큰 차이는 따로 있습니다. 화웨이가 삼성을 제소할 때 사용한 무기는 주로 필수표준특허입니다. 화웨이는 “LTE 기능을 쓸 때마다 우리 특허를 피해갈 수 없다”고 주장하고 있습니다.실제로 화웨이 특허들 만만치 않습니다. 사진이나 영상 다운받거나 업로드 할 때마다 적용되는 기술이라고 할 정도니까요? 고속도로 톨게이트 비슷하다고 보시면 됩니다.문제는 바로 거기에 있습니다. 톨게이트 운영자는 상대를 ‘배척할 권리’가 없습니다. 그건 부당 행위이기 때문입니다.무슨 얘기일까요? 디자인과 상용 특허가 중심 무기였던 애플과 달리 필수 표준 특허를 갖고 있는 화웨이가 소송에서 이기는 건 더 어려울 수도 있다는 겁니다. 그만큼 특허권 남용에 대한 견제가 더 강하기 때문입니다.그런데 왜 이런 전방위 특허 소송을 제기했을까요? 사실 저도 이 대목이 쉽게 납득이 되지 않았습니다. 중국 인민법원에 제소하는 거야 간단하지만 미국은 그렇지 않기 때문입니다. 지금까지 필수표준특허 소송으로 확실하게 이긴 기업이 많지 않습니다.■ 오히려 크로스 라이선스 쪽에 더 관심 있는 것 아닐까?이런 의문을 품고 있던 차에 BBC 기사를 보게 됐습니다. 그 기사엔 화웨이 지적재산권 책임자인 딩 지안싱이란 분이 인터뷰한 내용이 담겨 있었습니다.BBC에 따르면 그는 “배상보다는 삼성의 일부 기술에 대한 사용 허가를 받고 싶다”는 취지의 발언을 했습니다. 물론 그는 “무단 도용 그만두고 필요한 라이선스를 받아서 쓰라”는 경고 메시지도 빼놓진 않았습니다. 하지만 전 앞쪽 발언이 더 강하게 와 닿았습니다.그래서 이런 생각도 해봤습니다. 혹시 화웨이의 소송은 크로스 라이선스를 노린 초강수는 아닐까요? 중국이야 자기네 텃밭이니까 그렇다치고, 미국을 비롯한 서방 시장을 본격 공략하기 위해 걸림돌이 될 것들을 미리 정리하려는 복안은 아닐까요?화웨이와 애플의 소송은 언뜻 보기엔 비슷해보일수도 있습니다. 하지만 전 둘은 달라도 한참 다르다고 생각하는 편입니다. 화웨이는 배상보다는 삼성이 갖고 있는 방대한 특허망에 더 관심이 있을 수도 있다고 보기 때문입니다. 그렇기 때문에 겉보기엔 더 강력한 제스처를 취하고 있는 건지도 모른다고 생각합니다.참고로 화웨이는 약 5만300건의 특허를 갖고 있다고 밝혔습니다. 로이터통신에 따르면 지난 해 말 현재 삼성이 보유한 특허는 11만145건입니다.김익현 기자(sini@zdnet.co.kr)"
95,2016-05-25,"화내는 사람, 참는 사람…걸리는 병이 다르다",https://news.naver.com/main/read.nhn?mode=LSD&mid=shm&sid1=103&oid=022&aid=0003058389,세계일보,"화가 났을 때 곧장 흥분해 자기주장을 하는 편인가? 아니면 꾹 참고 화를 삭이는 편인가? 어떤 유형인지에 따라 미래에 앓게 될 병이 달라진다. 해외 매체 데일리메일이 24일(현지 시간) 전한 내용이다.캘리포니아 대학 소속의 심리학자 로버트 레빈슨 박사는 “일반적으로 화를 내는 것이 건강에 좋지 않다고 여겨졌다. 이번 연구를 통해 우리는 분노나 감내 같은 특정한 감정 표현이 특정 건강 문제와 관련 있음을 알아냈다”고 말했다. 결과적으로 분노하며 화를 표출하는 사람은 고혈압 위험이, 말없이 혼자 참는 사람은 요통을 겪을 위험이 높았다.레빈슨 박사 연구팀은 샌프란시스코에 거주 중인 중년 부부 156쌍을 약 20년간 관찰했다. 이들의 현재 나이는 60~90세이며 변수는 나이, 교육 수준, 운동, 흡연 여부, 알코올 및 카페인 섭취량 등이었다.참가자들은 5년마다 인터뷰를 통해 최근 있었던 일, 즐거웠던 일, 힘들었던 일 등을 이야기했다. 또한 건강 상태에 대한 세세한 질문에도 답했다. 행동 전문가는 부부의 말투, 행동, 표정 등 상호작용 등을 분석해 기록했다.인터뷰 영상을 판독해보니 분노하는 참가자는 입술을 앙다물고, 얼굴을 찡그렸으며 평소보다 목소리 톤이 올라가거나 내려갔고 턱이 긴장돼 있었다. 반면, 화를 참는 참가자는 무표정에 목 근육이 경직되어 있었으며 거의 눈을 맞추지 않았다.최근 연구팀은 참가자들이 화를 내는 방식과 최근의 건강 상태를 분석한 결과 유의미한 관계를 발견했다. 대화 도중 쉽게 화를 내는 참가자는 추후에 가슴 통증, 고혈압, 심혈관계 질환을 경험할 확률이 높았다. 반면, 화가 나도 거의 말을 하지 않고 눈을 맞추지 않은 참가자는 요통, 뻣뻣한 목, 관절염, 근육통 등을 많이 앓았다. 이는 특히 남성에게 두드러졌으며 여성에게도 어느 정도 연관이 있었다.연구진은 “15분 이상 지속되는 싸움에서 남성이 어떤 방식으로 화를 내는지를 보면 앞으로 20년 이후 겪게 될 건강상의 문제를 예측할 수 있다”고 밝혔다.나진희 기자 najin@segye.com[심층]""헬조선 못 살겠다""… 고국 등지는 청년들[핫]120번 출산… 인간의 욕심이 만든 '강아지 공장'ⓒ 세상을 보는 눈, 글로벌 미디어세계일보"
96,2016-05-25,이지스함 3척 건조 탐색개발 협상업체 현대중공업 선정,https://news.naver.com/main/read.nhn?mode=LSD&mid=shm&sid1=100&oid=001&aid=0008427082,연합뉴스,"울산현대조선소 [연합뉴스 자료사진]척당 수직발사대 10개 갖춘 3천t급 잠수함건조 협상업체는 대우조선해양해병대 상륙기동헬기 2023년까지 20여대 양산…여단급 항공단 창설(서울=연합뉴스) 김귀근 기자 = 현재 운용 중인 세종대왕함보다 성능이 향상된 이지스 구축함(광개토-Ⅲ Batch-2) 3척 추가건조를 위한 탐색개발 우선협상 대상 업체로 현대중공업이 선정됐다.1척당 탄도미사일 발사용 수직발사대 10개를 갖춘 3천t급 잠수함(장보고-Ⅲ Batch-2) 건조를 맡게 될 1순위 협상대상 업체로 대우조선해양이 선정됐으며, 2023년까지 해병대 상륙기동헬기 20여 대를 양산할 계획이다.방위사업청은 25일 한민구 국방부 장관 주재로 제95회 방위사업추진위원회를 개최해 ▲'장보고-Ⅲ Batch-2' 및 '광개토-Ⅲ Batch-2' 탐색개발 협상대상업체 선정안 ▲상륙기동헬기 양산계획안 ▲한국형 기동헬기 3차 양산계획안을 각각 의결했다고 밝혔다.'광개토-Ⅲ Batch-2'는 1번 이지스함인 세종대왕함보다 북한의 탄도탄 대응 및 대잠수함 작전 능력이 크게 향상된 이지스함 3척을 추가 건조하는 사업이다.방위사업추진위원회[연합뉴스 자료사진]2016년부터 2018년까지 181억원을 투입해 국내 업체주관 연구로 탐색개발에 나선다. 제안서를 접수해 평가한 결과, 현대중공업이 1순위 협상대상 업체로 선정됐다. 앞으로 기술과 조건 등의 협상을 통해 다음 달 말까지 계약할 예정이다.방사청은 ""광개토-Ⅲ Batch-2가 전력화되면 북한의 핵과 미사일, 잠수함 등 비대칭 위협과 주변국과의 해양 분쟁에 대한 대응능력을 강화하고, 조국 해양수호의 주력함정으로서 핵심적인 역할을 수행할 예정""이라고 설명했다.'장보고-Ⅲ Batch-2'는 수중작전과 무장능력이 우수한 잠수함을 국내 연구개발을 통해 확보하는 사업이다.지난 3월 탐색개발 수행업체 선정을 위한 사업설명회에 이어 4월에 업체로부터 제안서를 받아 평가한 결과 대우조선해양이 1순위 협상대상 업체로 선정됐다. 앞으로 기술과 비용 등 협상 단계를 거쳐 7월부터 사업에 착수한다.이 잠수함은 탄도미사일 발사용 수직발사관을 1척당 10개씩 탑재할 것으로 알려졌다. 4~6번함이 건조될 예정이다. 2014년 11월부터 건조에 들어간 '장보고-Ⅲ Batch-1'(1~3번함)은 수직발사대가 1척당 5개씩 탑재될 것으로 전해졌다.방사청은 ""이 잠수함은 북한의 위협과 잠재적 위협에 효과적으로 대응할 수 있는 핵심전력이 될 것""이라고 강조했다.또 올해부터 2023년까지 9천600억원을 투자해 해병대의 입체고속상륙작전 수행을 위한 상륙기동헬기 20여 대를 확보할 계획이다.수리온[연합뉴스 자료사진]2013년 7월부터 지난 1월까지 한국형 기동헬기 '수리온'을 상륙작전에 적합하도록 개조해 운용시험 평가한 결과, 전투용 적합 판정을 받았다.해병대는 2021년~2023년 사이 이들 헬기를 운용할 여단급 항공단을 창설할 계획이다. 기동헬기 1개 대대와 상륙공격헬기 2대를 항공단에 편성할 방침이다. 현재까지 헬기 조종사 40여 명을 양성했다.이밖에 한국형 기동헬기 3차 양산사업은 2022년까지 2조3천억원을 투입해 수리온을 확보하는 사업이다.수리온은 방사청과 산업통상자원부 주관으로 한국항공우주산업, 국방과학연구소, 한국항공우주연구원이 6년간 공동으로 개발해 2013년 3월 개발을 완료했으며 현재 2차 양산사업이 진행 중이다.양산 과정에서 드러난 '윈드실드(조종석 앞유리창) 파손', '프레임 균열' 등의 문제는 개선 방안을 마련했으며 이미 전력화된 수리온을 보완하고 3차 양산 물량에도 개선 사항을 반영할 것이라고 방사청은 설명했다.threek@yna.co.kr▶ [핫클릭] '별그대 악역' 신성록 내달 결혼…""신부는 회사원""▶ [핫클릭] 김영삼 前대통령 혼외자, 3억대 유산 소송 제기▶ [통통영상] '골초' 김정은 담배 끊었나?… 北 대대적 금연 홍보<저작권자(c) 연합뉴스, 무단 전재-재배포 금지>"
97,2016-05-25,"모나코, 안보리 대북결의 이행보고서 제출…회원국 첫 사례",https://news.naver.com/main/read.nhn?mode=LSD&mid=shm&sid1=100&oid=001&aid=0008426313,연합뉴스,"유엔안보리 [ EPA=연합뉴스 자료사진 ]다음달 2일 보고서 제출 시한…우리 정부도 곧 제출(서울=연합뉴스) 이귀원 김효정 기자 = 유엔 안보리의 대북제재 결의 2270호에 따른 회원국의 이행보고서 제출 시한을 한주 가량 앞둔 시점에서 유럽의 모나코가 회원국 가운데 처음으로 이행보고서(Implementation Report)를 제출한 것으로 확인됐다.25일 유엔 안보리 산하 대북제재위원회에 따르면 모나코는 최근 안보리 결의 2770호에 따라 결의 채택 90일 이내에 제출하게 돼 있는 이행보고서를 제출했다.그러나 이행보고서의 구체적 내용은 공개되지 않았으며, 이는 유엔 공용어로 번역하는데 시간이 걸리기 때문으로 전해졌다.대북제재위는 유엔 공용어로 번역을 거쳐 이행보고서를 공개할 것으로 알려졌다.안보리 결의 2270호에 따라 유엔 회원국은 결의 이행을 위해 국내에서 취한 조치와 이행 현황, 향후 계획 등을 담은 이행보고서를 결의 채택 90일 이내에 제출해야 한다.안보리 결의 2270호는 현지시간으로 3월2일 채택돼 단순 날짜계산으로 '결의 채택 90일' 시한이 이달 말이지만 우리 정부가 안보리 측에 파악한 결과, 안보리는 다음 달 2일을 시한으로 잡는 것으로 전해졌다.우리 정부도 이달 말쯤 이행보고서를 제출할 예정이다.유엔 회원국의 이행보고서 제출은 대북제재의 의지를 가늠할 수 있는 1차 관문으로 해석할 수 있다.과거 안보리 결의 2094호 등의 전례에 비춰 주요국 가운데서도 이행보고서 지각 제출이 이번에도 재연될 가능성을 배제할 수 없다.그러나 시한내 제출 여부를 떠나 대북제재에서 핵심 열쇠를 쥔 중국과 러시아가 적극적인 이행 의지를 공개적으로 표명해온 만큼 중·러를 포함해 한국, 미국, 일본, 유럽연합(EU) 소속 국가 등 핵심 당사국들은 적극적인 실천 의지를 보여줄 것으로 보인다.lkw777@yna.co.kr▶ [핫클릭] STX로 쓴 강덕수 샐러리맨 신화 끝났다▶ [핫클릭] 김영삼 前대통령 혼외자, 3억대 유산 소송 제기▶ [통통영상] '악마는 프라다를 입는다'? 반나체 시위<저작권자(c) 연합뉴스, 무단 전재-재배포 금지>"
98,2016-05-25,"검찰, 신현우 옥시 전 대표 등..",https://news.naver.com/main/read.nhn?mode=LSD&mid=shm&sid1=102&oid=421&aid=0002074140,뉴스1,"'가습기살균제 사망사건' 당시 옥시 레킷벤키저 대표이사를 맡고 있던 신현우 전 대표가 13일 오후 서울 서초동 서울중앙지방법원에서 영장실질심사를 받은 뒤 밖으로 나와 취재진의 질문공세를 받고 있다. 2016.5.16/뉴스1 © News1 박정호 기자'아이에게도 안심' 광고 사기로 판단…참사 이유는 ""무사안일이 빚은 참극""(서울=뉴스1) 김수완 기자,구교운 기자 = 검찰이 신현우 전 옥시 레킷벤키저 대표(68)에게 '사기' 혐의를 추가해 기소할 예정이다. 검찰은 신 전 대표에게 그 동안 업무상 과실치사상, 표시·광고의 공정화에 관한 법률(표시광고법) 위반 혐의만 적용하는 방안을 검토해왔다.서울중앙지검 가습기살균제 피해사건 특별수사팀(팀장 이철희 부장검사)은 신 전 대표와 옥시에서 마케팅을 담당했던 직원 등에게 사기 혐의를 추가해 사법처리할 방침이라고 25일 밝혔다.현재까지 검찰이 신 전 대표 등에게 적용을 검토해온 혐의는 업무상 과실치사상, 표시광고법 위반 등 2가지다.검찰은 이에 더해 옥시 제품의 광고문구가 표시광고법 위반을 넘어 사기에 해당한다고 판단했다. '옥시싹싹 가습기당번' 제품의 겉면에는 ""살균 99.9%-아이에게도 안심""이라는 문구가 기재돼 있다.현재 대법원은 ""거래에 있어 중요한 사항에 관해 구체적인 사실을 신의성실 의무에 비춰 비난받을 정도의 방법으로 허위로 고지한 경우 과장, 허위광고를 넘어 사기죄의 '기망행위(속이는 행위)'에 해당한다""고 일관된 판결을 내려오고 있다. 이런 대법원 판결에 따르면 옥시 제품 광고 문구에도 사기 혐의가 인정될 여지가 높다는 것이 검찰의 설명이다.또 검찰은 옥시의 지난 10여년간 제품 판매량이 50억원 가까이 되는 만큼 특정경제범죄가중처벌법상의 가중처벌 규정도 적용이 가능하다고 보고 있다. 현재 특경법상 사기 혐의는 사기로 얻은 이득액이 5억원 이상일 때 적용된다.검찰은 신 전 대표 등 옥시 전현직 임직원들이 흡입독성 실험 필요성을 알고도 하지 않은 이유에 대해 ""무사안일이 빚은 참극""이라고 설명했다.2001년 영국 레킷벤키저 사에 회사가 흡수되면서 다소 혼란스러운 상황이 이어졌고 이 과정에서 담당 직원들이 실험 필요성을 간과하고 지나친 것 같다는 것이 검찰의 설명이다. 즉 이미 5~6개월 간 판매가 됐고 별달리 문제가 발생하지 않았던 제품을 '이제 와서 굳이' 실험할 생각을 하지 않았다는 것이다.앞서 검찰은 옥시 제품의 초기 제조·판매 과정에 문제가 있었다는 점을 확인하고 이에 관여한 신 전 대표 등 한국계 임원들을 업무상 과실치사상 혐의로 지난 13일 구속했다.또 지난 23일에는 가습기 살균제가 한창 판매되던 시기인 2005년 6월~2010년 5월 사이 대표직을 맡았던 존 리 전 옥시 레킷벤키저 코리아 대표를 피의자 신분으로 불러 조사하는 등 외국계 임원 수사에도 속도를 내고 있다.abilitykl@▶ 매일 업데이트 최신 만화 100% 무료[© 뉴스1코리아(news1.kr), 무단 전재 및 재배포 금지]"
99,2016-05-25,졸릴 때마다 '한 캔'… 카페인중독 위험도 한 뼘 '쑥',https://news.naver.com/main/read.nhn?mode=LSD&mid=shm&sid1=103&oid=032&aid=0002701758,경향신문,"ㆍ에너지음료 평균 카페인 60㎎ㆍ청소년 1일 섭취량 125㎎ 절반시험준비를 위해 많은 학생들이 고카페인함유 에너지음료를 찾곤 한다. 공부의 능률을 올리려는 것이 목적이지만 되레 몸을 해칠 수 있다는 지적이 나온다. 보통 내용물 1㎎당 카페인 0.15㎎이 함유된 제품을 고카페인음료라고 부른다.카페인이 인체에 흡수되면 중추신경계를 활성화시켜 정신각성이나 피로감소효과가 나타난다. 단기집중력을 향상시키거나 밤샘공부를 하려는 학생들이 이런 음료를 찾는 이유다. 지난해 9월 계명대학교 간호학과 박정숙 교수가 대학생 270명을 대상으로 설문조사를 실시한 결과 응답자의 86.7%가 고카페인 에너지음료를 섭취한 바 있다고 대답했다. 전체 응답자의 42.7%는 ‘공부할 때 잠에서 깨기 위해서’라고 답했다.이들 에너지음료에 함유된 카페인은 평균 60㎎이다. 식품의약품안전처가 지정한 성인 1일 카페인섭취량이 400㎎인 것을 고려하면 결코 적은 양이 아니다. 체중 50kg인 청소년의 하루섭취량 125㎎의 절반 수준이다. 심지어 지난해에는 카페인 237㎎이 함유된 500㎖ 우유가 출시된 적도 있다.카페인을 과잉섭취할 경우 가슴 두근거림, 불안증세, 과도한 긴장감, 두통 등 부작용이 일어나 집중력이 오히려 흐트러질 수도 있다. 카페인은 내성이 생기기 쉬워 이전과 동일한 각성효과를 내기 위해서는 섭취량을 계속 늘려야하며 이로 인해 중독가능성도 커진다. 특히 지난해 12월 일본에서는 오랜 시간 고카페인 에너지음료를 일상처럼 섭취한 20대 남성의 사망사건이 알려져 이목이 쏠린 바 있다.박 교수는 “학생들이 고카페인 에너지음료를 마시는 이유는 학업에 대한 스트레스 때문에 부담감을 느끼기 때문”이라며 “커피를 비롯해 에너지음료를 즐겨 마실 경우 카페인과잉섭취로 이어질 가능성이 크다”고 지적했다.<헬스경향 신민우 기자 smw@k-health.com>▶뉴스랑 놀자! 향이네 페이스북 바로가기▶ 경향신문 SNS[트위터][페이스북]▶[경향신문 바로가기][인기 무료만화 보기][©경향신문(www.khan.co.kr), 무단전재 및 재배포 금지]"
