,날짜,기사 제목,기사 링크,기사 출처,기사 내용
0,2016-05-25,고준위 폐기물인데 처리시설 입지선정 잘 될까?,https://news.naver.com/main/read.nhn?mode=LSD&mid=shm&sid1=101&oid=214&aid=0000621986,MBC,"[뉴스데스크]◀ 앵커 ▶정부가 이번에 건설 추진에 들어간 방사성 폐기물 처리장은 사용이 끝난 핵연료처럼 위험도가 큰 '고준위 폐기물'을 처리하기 위한 시설입니다.작업복이나 장갑 같은 중·저준위 폐기물 처리장은 지난해 문을 열었는데요.상대적으로 덜 위험한 폐기물인데도 부지 선정에만 19년이 걸리는 등 갈등이 컸습니다.정부는 소통을 강화할 예정인데 만만치 않은 과정이 예상됩니다.김성민 기자입니다.◀ 리포트 ▶2003년, 전북 부안은 극심한 갈등에 휩싸였습니다.방사성 폐기물 처리장 유치를 추진하던 군수는 반대하는 주민들에게 폭행까지 당했고, 결국 방폐장 건설은 무산됐습니다.이렇게 반대가 극심할 경우 12년 만에 폐기장 부지가 결정될지는 아무도 장담할 수 없습니다.[양이원영/환경운동연합 처장]""(부지를) 선정하는 과정에서 문제가 생겼을 때 그 전단계로 언제든지 되돌아갈 수 있고, 핵폐기물 보관하는 장소에 문제가 생기면 언제든지 회수할 수 있는…""사용 후 핵연료 같은 고준위 폐기물은 중저준위 폐기물보다 훨씬 위험합니다.중저준위 처리장의 폐기물은 300년이 지나면 자연 상태가 되지만, 사용 후 핵연료는 30만 년이 걸립니다.전신 노출되면 사망할 수 있을 정도로 방사선량도 치명적입니다.그만큼 후보지로 꼽히는 지역 주민들의 반발이 클 수밖에 없습니다.[김경수/한국원자력연구원 연구부장]""수만 년 이상 안전성이 보장돼야 되고요. 암반이 균질해야 되고, 지하수 흐름이 굉장히 느려야 되는 조건, 이런 지질학적 안전성이 확보되는 지역을 골라내게 될 겁니다.""안전하게 건설할 기술이 있느냐도 문제입니다.전 세계적으로도 선례가 없는데다 우리 지질 상태에 맞춘 기술을 확보해야 하기 때문입니다.[심은정/원자력안전위원회]""사용 후 핵연료 중간 저장에 대한 안전규제 기준은 모두 마련이 됐으며, 영구처분에 대해서는 일반 기준은 완료됐고, 세부 분야별 보완 작업을 진행 중입니다.""또, 고준위 처리장이 완공될 때까지 원전 내 임시 보관소를 추가로 건설해야 하는데 이에 대한 지역 주민들의 반발이 극심해 또 다른 갈등이 이어질 수도 있습니다.MBC뉴스 김성민입니다.김성민기자 (smile21@mbc.co.kr)[저작권자(c) MBC (www.imnews.com) 무단복제-재배포 금지]▶ MBC뉴스 SNS[페이스북][트위터][카카오스토리]▶ 중국발 초미세먼지 공습, 대기질 더 나빠진다▶ 대낮 백화점 지하주차장 강도, 여성운전자 흉기위협Copyright(c) Since 1996,MBC&iMBCAll rights reserved."
1,2016-05-25,아이 찾아 40여 년…길거리 헤매는 부모,https://news.naver.com/main/read.nhn?mode=LSD&mid=shm&sid1=102&oid=056&aid=0010321138,KBS,"<앵커 멘트>오늘(25일)은 '세계 실종 아동의 날' 입니다.아이가 실종되면, 부모는, 수십 년이 지나도,  애타게 찾고 있습니다.애끓는 혈육의 정을 돕기 위해, 올해부터 아이가 성장해 달라졌을 모습을 추정해 보는 몽타주 기법이 도입됩니다.김민지 기자입니다.<리포트>오늘(25일)도 길거리로 나섰습니다.33년 째입니다.<녹취> ""이것 한 번 읽어 봐주세요.""지난 1984년 당시 13살이었던 아들은  자전거를 찾으러 간 뒤 사라졌습니다.<인터뷰> 염남이(실종아동 이훈식 군 어머니) : ""힘들어도 내 새끼라서 어쩔 수 없고, 나 혼자 울다가 웃다가 남몰래 나혼자 말할 수 없을 만큼 울어.""실종 4년 뒤 거제도의 한 보호시설에 있다는 것을 확인한 뒤 찾아갔지만 그 사이 또 어디론가 사라졌습니다.43년 전  집 앞에서 놀고 있던 4살배기 정훈이도  거짓말처럼 사라졌습니다.올해 47살이 됐을 아들을 찾겠다며  어머니는  세 번의 암 투병을 버텨왔습니다.<인터뷰> 전길자(실종아동 이정훈 군 어머니) : ""당시 모습이 지금도 제 마음 속에는 그게 남아있기 때문에 너무 안쓰럽고...""이같은 장기실종 아동을 찾기 위해 경찰이 올해부터 실종 아동의 현재 모습을 예측하는  몽타주 기법을 도입했습니다.이렇게 만들어진  12명의 모습이 실종아동의 날을 맞아 가족들에게 전달됐습니다.어른이 됐을 자식 모습을  처음 본 부모들은  눈물이 먼저 쏟아집니다.<인터뷰> 염남이(실종아동 이훈식 군 어머니) : ""처음엔 이거 볼 때 아주 깜짝 놀라겠더라고요. 어찌나 눈물이 나는지, 슬퍼서.""경찰은 이런 장기 실종 아동을 찾는데 몽타주를 적극 제공하기로 했습니다.<인터뷰> 이상숙(경찰청 과학수사관리 범죄분석담당 행정관) : ""스케치하고 보정하는 작업이 꼭 필요하거든요. 그 과정을 다 거치게 되면 한 3주 정도 소요가 됩니다.""무엇보다도 중요한 건 주변의 적극적인 관심입니다.<인터뷰> 김진(초록우산어린이재단 소장) : ""조금 더 관심을 갖고 한번 더 봐주시고 부모님들이 아이를 빨리 찾으실 수 있도록 도와주셨으면 좋겠습니다.""10년 이상 장기 실종 아동은 2백 40여 명.사랑하는 가족들은 이들이 돌아오기를 간절히 기다리고 있습니다.KBS 뉴스 김민지입니다.김민지기자 (ming@kbs.co.kr)▶ [저작권자ⓒ KBS 무단복제-재배포 금지]"
2,2016-05-25,"대낮 백화점 지하주차장 강도, 여성운전자 흉기위협",https://news.naver.com/main/read.nhn?mode=LSD&mid=shm&sid1=102&oid=214&aid=0000621970,MBC,"[뉴스데스크]◀ 앵커 ▶서울의 한 백화점 지하주차장에 흉기를 든 강도가 여성운전자를 위협하는 일이 또 발생했습니다.끔찍한 사건으로 이어질 수도 있었지만 현장에 있던 주차 요원과 시민들에게 곧바로 제압됐습니다.김민혁 기자입니다.◀ 리포트 ▶마스크를 쓴 남성이 백화점 지하주차장을 서성입니다.흰색 수입차량 안에 누가 타고 있는지를 확인하더니 출구로 향하는 이 승용차 조수석에 갑자기 올라탑니다.잠시 뒤 차량 주인인 여성이 놀라 뛰쳐나오고 백화점 주차 요원들이 남성이 사라진 쪽을 뒤쫓습니다.43살 김 모 씨가 여성이 혼자 타고 있는 고급 승용차를 노려 흉기로 강도짓을 시도했지만, 주차요금을 정산하는 차량이 밀려있는 틈을 타 피해자가 빠져나왔고, 곧바로 주차장 안에 비상벨이 울렸습니다.[00백화점 직원]""정산소 직원이 비상벨을 누르고, 저희 주차 요원이 와서 (피의자가) 이리로 도망가는 걸 날아서 잡은 거죠.""김 씨는 차에서 빠져나와 도망쳤지만 10미터도 가지 못한 채 현장에 있던 주차 요원과 시민들에게 제압당했습니다.피해 여성은 얼굴과 손에 상처를 입고 병원에서 치료를 받았습니다.경찰로 넘겨진 김 씨는 생활고 때문에 이 같은 일을 저질렀다고 진술했습니다.[경찰]""'대출금이 좀 있다', 그래서 (범행을) 계획한 것 같습니다.""경찰은 검거에 도움을 준 백화점 주차장 직원들에게 감사장을 수여하고, 김 씨에 대해서는 구속영장을 신청할 방침입니다.MBC뉴스 김민혁입니다.김민혁기자[저작권자(c) MBC (www.imnews.com) 무단복제-재배포 금지]▶ MBC뉴스 SNS[페이스북][트위터][카카오스토리]▶ 중국발 초미세먼지 공습, 대기질 더 나빠진다▶ 대낮 백화점 지하주차장 강도, 여성운전자 흉기위협Copyright(c) Since 1996,MBC&iMBCAll rights reserved."
3,2016-05-25,"""보육교사 CCTV 등지고 학대, 거울에 비쳐 알았다""",https://news.naver.com/main/read.nhn?mode=LSD&mid=shm&sid1=102&oid=214&aid=0000621969,MBC,"[뉴스데스크]◀ 앵커 ▶3살배기 아이를 학대한 어린이집 교사가 경찰에 입건됐습니다.본인은 훈육이라고 해명했지만 아이에게 손을 대는 모습이 거울에 반사되면서 CCTV에 찍혀 증거를 잡을 수 있었습니다.전재홍 기자입니다.◀ 리포트 ▶3살 여자아이가 잠자리에서 뒤척이자 보육교사가 CCTV를 등지고 앉아 아이를 일으켜 앉힙니다.단순한 훈육인지 분간이 잘 안 되는 상황입니다.그런데 거울을 보니 교사가 눈물을 닦으려는 아이의 손을 때리고 얼굴을 강하게 미는 장면이 비칩니다.[어린이집 학부모]""어머, 어…. 이것도 거울 없었으면 또 증거 없다고 달래주는 거라고 얘기했을 텐데.""소변을 제대로 가리지 못했다는 이유로 아이를 불 꺼진 방에 남겨두기도 하고, 밥을 늦게 먹는다고 식판을 낚아채고, 청소하는 척 책상으로 밀기도 합니다.[어린이집 학부모]""아…애 지금 울어…저런 미친X이 저거.""학부모들은 교사가 CCTV를 의식해 교묘하게 학대를 해왔을 것이라고 주장합니다.[피해 어린이 아버지]""일부러 CCTV를 등지고 앉아있는 거죠. CCTV 사각지대에 애를 세우고 때리거나 벌을 세우고 한 것이 살짝 비춰지는 것 같습니다.""어린이집은 훈육이었을 뿐 학대는 아니었다고 해명했습니다.[어린이집 원장]""학대라고 볼 수 있을까요. 지도차원에서 했지, 방임차원은 있을 수도 없다고 저는 생각하고…""경찰은 화면 속 보육교사 27살 민 모 씨를 불구속 입건하고 2달치 CCTV 영상을 분석해 구속영장 신청 여부를 결정하기로 했습니다.MBC뉴스 전재홍입니다.전재홍기자 (bobo@mbc.co.kr)[저작권자(c) MBC (www.imnews.com) 무단복제-재배포 금지]▶ MBC뉴스 SNS[페이스북][트위터][카카오스토리]▶ 중국발 초미세먼지 공습, 대기질 더 나빠진다▶ 대낮 백화점 지하주차장 강도, 여성운전자 흉기위협Copyright(c) Since 1996,MBC&iMBCAll rights reserved."
4,2016-05-25,고준위 폐기물인데 처리시설 입지선정 잘 될까?,https://news.naver.com/main/read.nhn?mode=LSD&mid=shm&sid1=101&oid=214&aid=0000621986,MBC,"[뉴스데스크]◀ 앵커 ▶정부가 이번에 건설 추진에 들어간 방사성 폐기물 처리장은 사용이 끝난 핵연료처럼 위험도가 큰 '고준위 폐기물'을 처리하기 위한 시설입니다.작업복이나 장갑 같은 중·저준위 폐기물 처리장은 지난해 문을 열었는데요.상대적으로 덜 위험한 폐기물인데도 부지 선정에만 19년이 걸리는 등 갈등이 컸습니다.정부는 소통을 강화할 예정인데 만만치 않은 과정이 예상됩니다.김성민 기자입니다.◀ 리포트 ▶2003년, 전북 부안은 극심한 갈등에 휩싸였습니다.방사성 폐기물 처리장 유치를 추진하던 군수는 반대하는 주민들에게 폭행까지 당했고, 결국 방폐장 건설은 무산됐습니다.이렇게 반대가 극심할 경우 12년 만에 폐기장 부지가 결정될지는 아무도 장담할 수 없습니다.[양이원영/환경운동연합 처장]""(부지를) 선정하는 과정에서 문제가 생겼을 때 그 전단계로 언제든지 되돌아갈 수 있고, 핵폐기물 보관하는 장소에 문제가 생기면 언제든지 회수할 수 있는…""사용 후 핵연료 같은 고준위 폐기물은 중저준위 폐기물보다 훨씬 위험합니다.중저준위 처리장의 폐기물은 300년이 지나면 자연 상태가 되지만, 사용 후 핵연료는 30만 년이 걸립니다.전신 노출되면 사망할 수 있을 정도로 방사선량도 치명적입니다.그만큼 후보지로 꼽히는 지역 주민들의 반발이 클 수밖에 없습니다.[김경수/한국원자력연구원 연구부장]""수만 년 이상 안전성이 보장돼야 되고요. 암반이 균질해야 되고, 지하수 흐름이 굉장히 느려야 되는 조건, 이런 지질학적 안전성이 확보되는 지역을 골라내게 될 겁니다.""안전하게 건설할 기술이 있느냐도 문제입니다.전 세계적으로도 선례가 없는데다 우리 지질 상태에 맞춘 기술을 확보해야 하기 때문입니다.[심은정/원자력안전위원회]""사용 후 핵연료 중간 저장에 대한 안전규제 기준은 모두 마련이 됐으며, 영구처분에 대해서는 일반 기준은 완료됐고, 세부 분야별 보완 작업을 진행 중입니다.""또, 고준위 처리장이 완공될 때까지 원전 내 임시 보관소를 추가로 건설해야 하는데 이에 대한 지역 주민들의 반발이 극심해 또 다른 갈등이 이어질 수도 있습니다.MBC뉴스 김성민입니다.김성민기자 (smile21@mbc.co.kr)[저작권자(c) MBC (www.imnews.com) 무단복제-재배포 금지]▶ MBC뉴스 SNS[페이스북][트위터][카카오스토리]▶ 중국발 초미세먼지 공습, 대기질 더 나빠진다▶ 대낮 백화점 지하주차장 강도, 여성운전자 흉기위협Copyright(c) Since 1996,MBC&iMBCAll rights reserved."
5,2016-05-25,'CCTV 등지고' 아동학대한 보육교사 입건,https://news.naver.com/main/read.nhn?mode=LSD&mid=shm&sid1=102&oid=214&aid=0000621969,MBC,"[뉴스데스크]◀ 앵커 ▶3살배기 아이를 학대한 어린이집 교사가 경찰에 입건됐습니다.본인은 훈육이라고 해명했지만 아이에게 손을 대는 모습이 거울에 반사되면서 CCTV에 찍혀 증거를 잡을 수 있었습니다.전재홍 기자입니다.◀ 리포트 ▶3살 여자아이가 잠자리에서 뒤척이자 보육교사가 CCTV를 등지고 앉아 아이를 일으켜 앉힙니다.단순한 훈육인지 분간이 잘 안 되는 상황입니다.그런데 거울을 보니 교사가 눈물을 닦으려는 아이의 손을 때리고 얼굴을 강하게 미는 장면이 비칩니다.[어린이집 학부모]""어머, 어…. 이것도 거울 없었으면 또 증거 없다고 달래주는 거라고 얘기했을 텐데.""소변을 제대로 가리지 못했다는 이유로 아이를 불 꺼진 방에 남겨두기도 하고, 밥을 늦게 먹는다고 식판을 낚아채고, 청소하는 척 책상으로 밀기도 합니다.[어린이집 학부모]""아…애 지금 울어…저런 미친X이 저거.""학부모들은 교사가 CCTV를 의식해 교묘하게 학대를 해왔을 것이라고 주장합니다.[피해 어린이 아버지]""일부러 CCTV를 등지고 앉아있는 거죠. CCTV 사각지대에 애를 세우고 때리거나 벌을 세우고 한 것이 살짝 비춰지는 것 같습니다.""어린이집은 훈육이었을 뿐 학대는 아니었다고 해명했습니다.[어린이집 원장]""학대라고 볼 수 있을까요. 지도차원에서 했지, 방임차원은 있을 수도 없다고 저는 생각하고…""경찰은 화면 속 보육교사 27살 민 모 씨를 불구속 입건하고 2달치 CCTV 영상을 분석해 구속영장 신청 여부를 결정하기로 했습니다.MBC뉴스 전재홍입니다.전재홍기자 (bobo@mbc.co.kr)[저작권자(c) MBC (www.imnews.com) 무단복제-재배포 금지]▶ MBC뉴스 SNS[페이스북][트위터][카카오스토리]▶ 중국발 초미세먼지 공습, 대기질 더 나빠진다▶ 대낮 백화점 지하주차장 강도, 여성운전자 흉기위협Copyright(c) Since 1996,MBC&iMBCAll rights reserved."
6,2016-05-25,"30년 전 잃은 아이, '현재 모습' 몽타주로 찾는다",https://news.naver.com/main/read.nhn?mode=LSD&mid=shm&sid1=102&oid=055&aid=0000411935,SBS,"<앵커>이 그림은 저희 권란 기자가 5살 때 찍은 사진을 바탕으로 30년이 지난 모습을 추정한 몽타주입니다. 실제 사진과 비교해 보면 비슷한 느낌이 들죠? 이런 성장 예측 몽타주가 2천 명이 넘는 실종 아동을 찾는 데 활용되기 시작했습니다. 아이를 찾지 못해 애타는 가족들은 이런 사진이나 전단을 그냥 지나치지 말고 관심을 기울여 달라고 호소하고 있습니다.실종 아동의 날을 맞아서 권란 기자가 취재했습니다.<기자>금쪽같은 아들을 잃어버린 지 30년째.김기석 씨는 요즘도 하루도 거르지 않고 거리에 나가 전단지를 돌립니다.놀러 나갔다 사라진 3살배기 아들, 사진을 볼 때면 지금도 가슴이 미어집니다.[김기석/'실종아동 김호' 아버지 : 힘들죠, 사실…어떻게 변했을지 아무도 모르잖아요. 다른 건 찾을 수가 없잖아요. 호적이나 이런 건 다 바뀌어 있으니까….]어떻게 변했을까, 그동안 막막했던 부모들에게 한 가닥 희망이 생겼습니다.경찰이 예측 몽타주 프로그램을 이용해 30년 전 사라진 아들의 현재 모습 몽타주를 제공한 겁니다.아버지는 사진에서 눈을 떼지 못 합니다.[김홍문/'실종아동 김태희' 아버지 : 이거 보니까 마음이 울적해져서 그냥 눈물이 나네요. 이런 머리도 했었어요, 옛날에…입 있는 데는 비슷한 것 같고….]실종 아동 부모와 무연고 아동의 유전자를 등록해 대조하는 유전자 대조 기법도 활용도가 높아지고 있습니다.[김진/초록우산어린이재단 소장 : 저희 기관에 접수된 유전자가 2만 7천여 건 정도 되고요, 그중에서 341건이 지난해까지 찾았고, 올해는 지금 11건이 (부모를 찾았습니다.)]실종기간 1년이 넘는 장기 실종아동은 모두 2천여 명, 생업도 포기한 채 아이 찾기에 매달린 부모들에게 가장 절실한 건 주변의 관심입니다.[저희들이 전단지를 돌리잖아요. 안 받는 부모들도 많고, 받았다가도 금방 확 버리고, 심지어 발로 밟고 갑니다. 그러면 저희들이 얼마나 가슴이 터지겠어요.](영상취재 : 정성화·이용한, 영상편집 : 위원양)▶ '우리아이를 찾아주세요' 나도펀딩 바로가기권란 기자(jiin@sbs.co.kr)※ ⓒ SBS & SBS콘텐츠허브 : 무단복제 및 재배포 금지"
7,2016-05-25,클린턴·트럼프 '진흙탕 싸움' 본격화,https://news.naver.com/main/read.nhn?mode=LSD&mid=shm&sid1=104&oid=022&aid=0003058511,세계일보,"클린턴,“트럼프는 경제도 모르면서 경제위기 이용 돈 버는 인물” / 트럼프, 23년전 백악관 법률고문 자살…클린턴 부부 연루 의혹 제기네거티브 공세 시작민주당 대선주자인 힐러리 클린턴 전 국무장관(왼쪽)과 공화당 대선주자 도널드 트럼프 후보가 최근 미국 캘리포니아주에서 각각 유세 연설을 하고 있다. 워싱턴포스트 등 미국 언론은 24일(현지시간) 전당대회를 2개월 앞두고 양측이 서로의 과거를 들추는 네거티브 공세를 본격화하고 있다고 우려했다.커머스·코스타메사=AP연합뉴스미국 민주당과 공화당의 전당대회를 2개월가량 앞두고 사실상 양당의 대선주자인 민주당 힐러리 클린턴 전 국무장관과 공화당 도널드 트럼프 후보가 진흙탕 싸움을 시작했다. 상대방의 과거를 들추는 네거티브 공세에 나섰다. 워싱턴포스트(WP) 등 미 언론은 대선 레이스가 국가미래에 대한 비전보다 양측 후보의 과거에 대한 심판으로 시작됐다고 우려했다.클린턴 전 장관 캠프는 24일(현지시간) 트럼프 후보를 ‘경제도 모르면서 경제위기를 이용해 돈을 버는 비정한 인물’이라고 비판했다. 클린턴 전 장관은 캘리포니아주 유세에서 “‘트럼프 경제’는 낮은 임금과 적은 일자리, 많은 빚을 말한다”며 “경제위기에서 돈을 번 트럼프는 열심히 일하는 가정들이 소유한 주택을 잃는 것을 원한다”고 비난했다.민주당의 밥 벅혼 플로리다주 탬파시장은 “트럼프가 2006년 주택시장 거품 붕괴, 2008년 글로벌 금융위기를 이용해 돈을 벌었을 것”이라며 “트럼프는 미 전역에서 노동자 가족을 희생양으로 삼아 돈을 번, 자신만을 위하는 그런 인물”이라고 주장했다.트럼프 후보가 세금내역을 공개하지 않고 있는 점은 단골 비판 대상이다. 같은 당 팀 라이언 하원의원은 “트럼프가 세금 내역을 공개하지 않고 있다”며 “(뉴욕의) 트럼프 타워 꼭대기층(트럼프 자택)에서 내려다보면 금융위기 희생자들이 이름도 없고 얼굴도 없는 것처럼 보일 수 있지만, 이들도 똑같은 인간”이라고 밝혔다. 그는 “이들은 자신들을 이용하는 게 아니라 자신들을 지지하는 그런 대통령이 필요하다”고 강조했다.트럼프 후보는 1993년 6월 ‘화이트워터 게이트’ 업무를 처리하던 빈센트 포스트 백악관 법률부담당관의 권총 자살 사건을 23년 만에 끄집어냈다. 화이트워터 게이트는 빌 클린턴 전 대통령이 아칸소 주지사 시절 아내 클린턴 전 장관의 친구인 제임스 맥두걸 부부와 함께 설립한 부동산개발회사 ‘화이트워터’의 휴양단지 개발을 둘러싼 사기 및 직권남용 등 의혹을 말한다. 1978년 시작된 이 사업은 1990년대 분양 저조로 중단됐다. 당시 맥두걸 부부가 연방정부에서 거액을 대출받았는데 클린턴 전 대통령이 주지사 시절 직권을 남용했다는 의혹이 제기됐다. 나중에 무혐의 처리됐지만, 클린턴 전 장관은 백악관 안주인 시절 자살한 포스트 담당관에게 서류파기를 지시했다는 의혹을 받았다.트럼프는 “포스터는 조사 중 갑자기 자살했다”며 “그 사건을 (자살이 아닌) 살인이라고 생각하는 사람들이 문제를 계속 제기할 것”이라고 주장했다. 이어 “그의 죽음을 둘러싼 환경에 수상한 냄새가 난다”고도 했다.트럼프는 클린턴 전 대통령으로부터 ‘성폭행을 당했다’고 주장한 여성 2명의 육성이 담긴 동영상도 전날 공개했다. 클린턴 전 대통령은 이 주장을 부인했고, 언론도 여성들의 주장이 일관성이 없다는 이유로 크게 무게를 두지 않고 있다.WP는 “트럼프가 빌 클린턴 개인을 공격하기 위해 1990년대 가장 추했던 정치적 장면을 부활시키고 있다”고 우려했다.워싱턴=박종현 특파원 bali@segye.com[심층]""헬조선 못 살겠다""… 고국 등지는 청년들[핫]20대에 하지 않으면 반드시 후회하는 12가지ⓒ 세상을 보는 눈, 글로벌 미디어세계일보"
