,날짜,기사 제목,기사 링크,기사 출처,기사 내용
133,2016-05-25,"이주열 ""GDP통계 신뢰 떨어져..""",https://news.naver.com/main/read.nhn?mode=LSD&mid=shm&sid1=101&oid=001&aid=0008425110,연합뉴스,"모두발언하는 이주열 총재     (서울=연합뉴스) 박동주 기자 = 이주열 한국은행 총재가 25일 오전 서울 중구 한국은행에서 열린 경제동향간담회에서 모두발언하고 있다.     pdj6635@yna.co.kr""GDP 추정방법 개선하고 새로운 지표 개발""(서울=연합뉴스) 노재현 기자 = 이주열 한국은행 총재는 25일 디지털 경제가 확산하면서 국내총생산(GDP) 통계의 신뢰도가 떨어지고 있다면서 새 지표 개발을 통해 한계를 보완하겠다고 밝혔다.이 총재는 이날 오전 서울시 중구 한국은행 본관에서 경제동향간담회를 주재한 자리에서 GDP 통계의 한계점을 언급하며 이같이 말했다.이 총재는 ""GDP가 일국의 경제 규모와 성장 속도, 물질적 번영의 정도를 나타내는 대표적인 지표인 것이 사실이지만 근래 품질 차별화가 가능한 서비스업 비중의 증가, 디지털 경제 확대 등으로 그 신뢰성이 점차 하락하는 것 같다""고 지적했다.이어 최근 경제주간지 '이코노미스트'의 특집 기사를 인용해 학원에 가지 않고 유튜브를 통해 무료로 강좌를 들으면 효용성이 높아지지만, GDP는 오히려 감소한다고 소개했다.또 온라인 쇼핑, 인터넷뱅킹 서비스 등이 소비자의 후생을 증진하지만 이로 인한 시설투자의 감소로 GDP가 하락한다고 설명했다.이 총재는 프랑스 정부가 2008년 조지프 스티글리츠 교수를 주축으로 위원회를 구성해 GDP의 대안을 마련하는 작업을 진행한 사실도 언급했다.이들은 보고서에서 양보다 질적인 개념으로의 전환을 강조하고 경제 성장에 환경을 반영해야 한다고 주장했다.이 총재는 ""최근 GDP 전망이 새로 발표될 때마다 관심이 매우 높은데 GDP 0.1∼0.2% 포인트의 차이가 과연 어느 정도의 의미가 있는 것인지 생각해볼 필요가 있다""며 GDP 통계 이면의 의미를 읽어내는 역량을 키워야 한다고 강조했다.이 총재는 ""GDP 통계가 가진 한계점들은 4차 산업혁명의 도래와 함께 더 확대될 것""이라며 ""한국은행은 앞으로 GDP 통계의 한계점을 보완하고 신뢰성을 제고하는 데 부단히 노력해나갈 계획""이라고 밝혔다.이어 ""인터넷 빅데이터 활용 등을 통해 GDP 통계의 추정방법을 개선하는 한편, 생활 수준을 보다 정확하게 측정할 수 있는 새로인 지표를 개발하겠다""고 말했다.앞서 국책 연구기관인 한국개발연구원(KDI)은 전날 올해 우리나라의 GDP 성장률 전망치를 지난해 12월 제시한 3.0%에서 2.6%로 0.4% 포인트 하향 조정했다.nojae@yna.co.kr▶ [핫클릭] ""실험중 손가락 잘렸는데 산재 안된데요""…학생연구생의 눈물▶ [핫클릭] 판다 2세는 언제?…에버랜드 판다커플 아직은 '어린이'▶ [영상] 슈퍼주니어 강인 또 음주사고…""연예활동 중단""<저작권자(c) 연합뉴스, 무단 전재-재배포 금지>"
134,2016-05-25,"정의장 ""청문회 활성화 국회법 반발은 민주주의 원칙 훼손""",https://news.naver.com/main/read.nhn?mode=LSD&mid=shm&sid1=100&oid=001&aid=0008425460,연합뉴스,"""20대 국회 출범 직후 개헌·선거제도 개편 논의해야""퇴임 회견 ""협치·연대를 기반으로 한 새 정치 필요""(서울=연합뉴스) 배영경 기자 = 정의화 국회의장은 25일 국회법 개정안 논란과 관련, ""상임위 청문회 활성화 부분을 두고 일부에서 '행정부 마비법'이라는 비판이 있다고 들었는데 그것이 사실이 아니기를 바란다""고 말했다.정의화 국회의장, '퇴임하면서'    (서울=연합뉴스) 배재만 기자 = 정의화 국회의장이 25일 오전 국회 접견실에서 퇴임 기자회견을 열고 있다.     scoop@yna.co.kr정 의장은 이날 오전 국회 집무실에서 한 퇴임 기자회견에서 ""국민을 대신해 국정을 감시하고 특정한 국정 사안을 조사하는 것은 헌법 61조에 규정돼 있는 국회의 당연한 책무""라면서 이같이 밝혔다.특히 ""지금 우리 국민은 일 잘하는 국회, 정부를 제대로 감독하고 견제하는 국회를 원하고 있다""면서 ""행정부가 국민의 편에 서서 올바르게 일하라고 만든 법을 '귀찮다' '바쁘다'는 이유로 반발하는 것이야말로 민주주의의 원칙을 훼손하는 일이 아닐 수 없다""고 비판했다.그러면서 ""과거 일부 청문회에서 나타났던 부정적 측면만 강조해 정책 청문회 활성화 자체에 반대하는 것 또한 '구더기 무서워 장 못 담그겠다'는 식의 회피성 주장일 뿐""이라고 주장했다.이어 정 의장은 20대 국회 출범 직후 개헌과 선거제도 개편에 대한 논의가 즉시 이뤄져야 한다고 밝혔다.정 의장은 ""새로운 정치질서 '협치의 플랫폼'이 필요하다""며 ""지금은 '87년 체제'를 극복해야 할 구조적 전환기로, 역사가 바뀌고 시대의 요구가 바뀌면 헌법을 그에 맞게 바꿔내는 것이 우리의 의무""라고 지적했다.또 ""현행 소선거구 제도는 다수의 사표가 발생할 수밖에 없고 고질적인 지역구도를 깨기 어려운 심각한 단점이 있다""며 ""국회가 민의를 제대로 반영하고, 사회적 합의와 생산적 타협의 정치를 이루기 위해 지역패권주의와 승자독식의 선거제도를 혁파해야 한다""고 역설했다.정 의장은 현 정치권에 대해 ""지역과 이념의 기득권 질서에 안주하며 해결책을 제시하지 못하는 무능과 나태 속에 빠져 있다""며 ""날이 갈수록 국민이 아니라 권력자를 바라보는 정치, 국익과 민생이 아니라 당리당략과 사리사욕에 사로잡힌 정치가 되어 가는 것 같다""고 비판했다.그러면서 ""우리 정치 이제는 정말 달라져야 한다""며 ""협치와 연대를 기반으로 한 새로운 정치가 필요하다""고 강조했다.오는 26일 자신이 이사장을 맡은 사단법인 '새한국의 비전' 출범을 하루 앞둔 정 의장은 ""저는 이제 국회를 떠나지만 낡은 정치질서를 타파하고 새로운 정치질서를 열어나가는 길에 작은 밀알이 되고자 한다""고 덧붙였다.humane@yna.co.kr▶ [핫클릭] '일왕에게 폭탄' 이봉창 의사 도쿄 순국지 쓰레기에 '포위'▶ [핫클릭] 스킨십의 순간, 내 몸에 생기는 변화 '8'▶ [영상] 충전 20분 이내 '펑'…중국산 불량 전자담배<저작권자(c) 연합뉴스, 무단 전재-재배포 금지>"
135,2016-05-25,중국 위안화 0.34% 절하…고시 위안값 5년여만에 최저로,https://news.naver.com/main/read.nhn?mode=LSD&mid=shm&sid1=101&oid=001&aid=0008425557,연합뉴스,"[EPA=연합뉴스 자료사진](서울=연합뉴스) 김경윤 기자 = 중국 당국이 위안화 가치를 대폭 절하하면서 고시 위안값이 5년여 만에 최저 수준으로 떨어졌다.중국 인민은행 산하 외환교역센터는 25일(이하 현지시간) 달러 대비 위안화 기준환율을 전날보다 0.34% 오른 달러당 6.5693위안으로 고시했다.위안화 기준환율이 올랐다는 것은 위안화 가치가 그만큼 내렸다는 의미다.이번 대폭 절하 결정은 지난 19일 위안화 가치를 0.48% 대폭 절하한 이래 엿새 만에 나왔다.최근 미국의 기준금리 인상 가능성이 고조되면서 달러화 가치가 두 달 만에 가장 높은 수준으로 오르자 중국 당국이 이를 반영한 것으로 풀이된다.이에 따라 위안화 가치는 2011년 3월 16일 달러당 6.5718위안이 고시된 이래 5년 2개월 만에 가장 낮은 수준으로 떨어졌다.[연합뉴스TV제공]기준환율 고시 직후인 이날 오전 9시 16분 역외시장에서는 위안화 환율이 달러당 6.5694위안까지 치솟았다.역내시장 위안화 환율도 9시 35분 현재 전날보다 0.07% 오른 달러당 6.5619위안에 거래되고 있다.한편 인민은행은 이날 7일짜리 역레포(환매조건부채권) 거래로 시중에 700억 위안(약 12조7천억원)의 유동성을 공급했다.heeva@yna.co.kr▶ [핫클릭] 스킨십의 순간, 내 몸에 생기는 변화 '8'▶ [핫클릭] '일왕에게 폭탄' 이봉창 의사 도쿄 순국지 쓰레기에 '포위'▶ [영상] 충전 20분 이내 '펑'…중국산 불량 전자담배<저작권자(c) 연합뉴스, 무단 전재-재배포 금지>"
136,2016-05-25,SNS는 지금 '혐오의 바다' 죄를 처벌할 수 없는 현실,https://news.naver.com/main/read.nhn?mode=LSD&mid=shm&sid1=102&oid=016&aid=0001055884,헤럴드경제,"관련법안 도입 번번이 무산불특정 다수엔 적용 힘들어독일·미국선 형사처벌 강화‘한남충, 김치녀, 씹치남, 삼일한, 한남또, 성괴….’최근 몇년 새 주요 온라인 커뮤니티에서 부쩍 늘어난 남혐(남성 혐오), 여혐(여성 혐오) 관련 국적불명의 신조어들이다. 인터넷을 중심으로 자신과 생각이 다른 집단에 무조건적인 적대감을 드러내는 문화가 확산하는 상황에서, 남녀 간 성대결이 별다른 통제없이 극한 양상으로 치닫고 있다는 지적이 적지 않다. 이에 따라 온라인상 혐오발언에 대한 형사처벌 등 제재가 필요하다는 목소리도 높아지고 있다.대표적인 이성 혐오 커뮤니티로는 ‘일베’(일간베스트 저장소)와 ‘메갈리아’(메르스+이갈리아 딸들)가 꼽힌다. 지난 2010년 무렵 형성된 일베는 여성 혐오 표현들을 노골적으로 표출해 논란이 일었다. 이러한 움직임에 반발해 작년 만들어진 메갈리아는 ‘미러링’(반대로 따라하기) 전략을 내세우며 맞불을 놓고 있다.신조어 언급 횟수만 비교해 보면 ‘여혐’ 관련 글이 압도적으로 많다. 빅데이터 분석업체인 다음소프트에 따르면 지난해 1월부터 11월까지 블로그ㆍ트위터 등에서 여성 혐오가 언급된 횟수는 월평균 8만회에 달했다. 하지만 메갈리아의 활동이 본격화한 이후 남혐 관련 신조어 언급 횟수도 부쩍 늘어나는 추세다. 지난해 5월 2건에 불과했던 남성 혐오 글은 6월에 7596건으로 급증하기도 했다.특히 스마트폰과 SNS(소셜네트워크서비스) 보급 등으로 불특정 다수를 비하하는 혐오발언이 여과없이 노출되면서 오프라인 문제로까지 번지는 사례도 늘어나고 있다. 방송통신심의위원회가 온라인상의 차별ㆍ비하 정보에 대한 시정요구를 집계한 결과 2012년 149건에서 2015년 891건으로 3년 동안 5배 이상 급증한 것으로 조사됐다.하지만 무분별하게 퍼지는 혐오 발언을 근절할 수 있는 뚜렷한 대안은 사실상 없는 상황이다.법조계에 따르면 특정인에게 직접적인 피해를 주는 사적인 혐오발언은 형법에서 명예훼손죄와 모욕죄로 얼마든지 처벌이 가능하다. 그러나 특정인을 지목하지 않고 특정 집단이나 불특정 다수에 대해 이뤄지는 혐오발언은 처벌이 쉽지 않다. 피해자를 특정하기가 어렵기 때문이다. 이 상황에서는 민사상 손해배상을 청구하는 것도 사실상 불가능하다.반면 한국과 달리 유럽 등 주요 선진국에서는 혐오발언에 대한 형사처벌을 강화하는 추세다.독일의 경우 형법에 ‘특정 인구 집단을 모욕하거나 악의적으로 비방해 타인의 인간적 존엄성을 침해하는 행위’ 등에 대해 최대 징역 3년에 처할 수 있도록 명시하고 있다. 영국 역시 피부색과 인종ㆍ국적ㆍ출신국에 대한 혐오발언을 한 사람에게 2년 이하의 징역을 부과한다. 미국의 ‘혐오범죄방지법’, 스웨덴의 ‘증오언론금지법’ 등도 비슷한 내용을 담고 있다최근 들어 우리나라에서도 국회를 중심으로 성별이나 종교, 특정지역 등을 비하하는 모욕적ㆍ위협적 발언에 대한 처벌을 강화하는 입법 추진이 이뤄졌지만 번번이 무산돼 왔다. 19대 국회에서도 이종걸 더불어민주당 의원과 안효대 새누리당 의원이 혐오범죄 가중처벌과 혐오죄 신설 등의 법안을 발의했지만 오는 30일 국회 임기만료로 자동폐기될 운명에 놓였다.박기령 한국법제연구원 부연구위원은 “혐오발언을 광범위하고 직접적으로 처벌하는 유럽국가들의 사례를 검토할 때 (혐오발언 제재안이) 불필요하거나 과잉규제라고 볼 수는 없다”며 “다만 우리나라의 정치지형상 표현의 자유를 침해할 수 있는 개연성이 내포돼 있기 때문에 규제에 대한 접근은 간접적이고 최소한 방식에서 시작될 필요가 있다”고 했다.양대근 기자/bigroot@heraldcorp.com▶ ‘리얼극장’ 정정아, 연예인 낙인의 고통…‘아나콘다 사건' 뭐길래?▶ 강인, 음주교통사고 CCTV 보니…들이받고, 바로 도주▶ [속보] 정의화 “20대 국회 출범 직후 개헌 논의 시작해야”[국내최대 SKEC영어글쓰기대회][청소년 영어신문 활용법][외교관의 꿈,청소년 외교아카데미][헤럴드경제][SUPERICH][REAL FOODS][헤럴드증권방송][HOOC]- Copyrights ⓒ 헤럴드경제 & heraldbiz.com, 무단 전재 및 재배포 금지 -"
137,2016-05-25,"朴대통령, 아프리카·佛 순방 출발",https://news.naver.com/main/read.nhn?mode=LSD&mid=shm&sid1=100&oid=008&aid=0003685002,머니투데이,"[머니투데이 이상배  기자] [[the300] 에티오피아·우간다·케냐·프랑스 순 방문…역대 두번째 경제사절단 동행]박근혜 대통령/ 사지=뉴시스박근혜 대통령이 '아프리카의 날'(Afria Day)인 25일 오전 경기도 성남 서울공항에서 전용기 편으로 10박12일간의 아프리카 3개국·프랑스 순방 길에 올랐다.△에티오피아(5월25~28일) △우간다(5월28~30일) △케냐(5월30일~6월1일) △프랑스(6월1~4일)로 이어지는 강행군이다. 이로써 아시아·유럽·북아메리카·남아메리카·오세아니아에 이어 박 대통령의 '6대주' 외교가 완성된다.지구의 마지막 '블루오션' 아프리카에서 박 대통령은 하일레마리암 데살렌 에티오피아 총리, 요웨리 무세베니 우간다 대통령, 우후루 케냐타 케냐 대통령과 차례로 정상회담을 열고 경제협력 확대 방안을 논의한다. 우리나라 대통령의 우간다 방문은 최초다. 에티오피아 방문은 2011년 이명박 전 대통령 이후, 케냐 방문은 1982년 전두환 전 대통령 이후 처음이다.우리 정상으로는 2000년 김대중 전 대통령 이후 16년 만에 처음 프랑스를 국빈방문하는 박 대통령은 프랑수아 올랑드 프랑스 대통령과 정상회담을 열고 수소차 기술 협력 등에 대해 논의한다. 또 파리6대학(피에르와 마리 퀴리 대학)으로부터 명예 이학박사 학위를 받고, 영애 시절인 1974년 유학 생활을 했던 그르노블도 방문할 예정이다.◇역대 두번째 규모 경제사절단청와대에 따르면 박 대통령의 이번 아프리카 3개국·프랑스 순방에는 166개사, 169명의 경제사절단이 동행한다. 박근혜정부 들어 최대 규모였던 이달초 이란 방문 당시 236개사에 이어 두번째다.지역별로는 아프리카 111개사, 프랑스 101개사, 두 지역 모두 동행하는 기업이 46개사다. 아프리카 국가 별로는 에티오피아 78개사, 우간다 72개사, 케냐 91개사 등이다. 1대1 상담회에는 아프리카 3국의 경우 국가별로 각각 40~50여명의 기업인 참가할 것으로 예상된다. 프랑스 1대1 상담회에는 100여명이 참가할 전망이다.특히 아프리카 경제사절단 규모에 대해 안종범 청와대 정책조정수석은 ""아프리카 3국의 경제규모에 비춰 이례적인 수준""이라며 ""현지 1대1 비즈니스 상담회가 중소기업의 수출플랫폼으로 자리 잡아가고 있는 데 따른 것""이라고 말했다.이번 아프리카 방문을 통해 박 대통령은 △교역·투자 확대기반 마련 △우리 기업의 인프라 구축 참여 △에너지·산업 투자 확대기반 마련 △보건·의료, ICT(정보통신기술), 과학기술 등 고부가가치 분야 협력 다각화 △개발협력 강화 및 우호적 경제협력 관계 구축 등의 경제적 성과를 거둔다는 계획이다.박 대통령은 아프리카 방문국마다 비즈니스포럼과 동포대표 간담회, 문화공연 등에도 참석할 예정이다. 또 각 국가별로 '코리아 에이드'(Korea Aid) 사업 출범식에도 참석, 관계자들을 격려한다. 코리아 에이드는 봉사단이 이동검진차량과 앰뷸런스, 푸드트럭, 문화영상트럭과 함께 직접 주민들을 찾아가 보건·음식·문화 서비스를 제공하는 새로운 개념의 이동형 ODA(공적개발원조) 프로젝트다.박 대통령은 25일(이하 현지시간) 저녁 첫번째 방문지인 에티오피아 아디스아바바에 도착, 이튿날 공식 환영식에 이어 하일레마리암 총리와의 정상회담, 국빈만찬 등의 일정을 소화한다. 물라투 테쇼메 대통령과도 별도 면담도 예정돼 있다.박 대통령은 에티오피아 방문을 계기로 27일 우리나라 정상으로는 처음 에티오피아 아디스아바바 소재 아프리카연합(AU) 본부를 방문, 특별연설을 통해 우리의 대 아프리카 정책비전을 제시할 예정이다. 연설 직전에는 은코사자나 들라미니 주마 AU 집행위원장, 집행위원들과 면담을 갖고 한･AU 간 파트너십 강화방안에 대해 의견을 교환한다. AU는 아프리카 국가들의 단결과 협력 증진을 위해 2002년 결성된 정부 간 기구로 모로코를 제외한 54개 아프리카 국가가 참여하고 있다.이후 박 대통령은 에티오피아에서 한빛 부대원 격려, 한국전 참전 기념행사 등의 일정을 가진 뒤 28일 우간다로 이동한다.◇韓·佛 수소차 기술 협력우간다에서 박 대통령은 29일 오전 공식 환영식에 이어 무세베니 대통령과의 정상회담, 국빈오찬 등을 갖는다. 새마을운동에 대해 높은 관심을 갖고 있는 무세베니 대통령은 박 대통령의 이번 방문을 계기로 양국 간 새마을운동 관련 협력 강화를 기대하고 있다. 우간다는 북한의 동아프리카 거점 국가라는 점에서 박 대통령의 이번 방문은 북핵 문제 해결을 위한 대북 고립 전략에도 중요한 계기가 될 것으로 청와대는 기대하고 있다.이후 케냐로 이동하는 박 대통령은 31일 오전 공식 환영식에 이어 케냐타 대통령과의 정상회담, 국빈오찬 등의 일정을 소화한다. 한·케냐 정상회담은 대를 이은 정상외교라는 점에서 눈길을 끈다. 양국은 1964년 두 정상의 선친인 박정희 전 대통령, 조모 케냐타 대통령의 재임 시절 수교했다. 두 선친이 수교한 이후 52년 만에 그 딸과 아들이 각각 정상으로서 직접 만나는 셈이다. 또 케냐에서 박 대통령은 유엔 3대 지역사무소 가운데 하나인 유엔 나이로비 사무소도 방문, 기념식수 등을 할 예정이다.이어 박 대통령은 다음달 1일 프랑스로 이동한다. 4일 한·불 수교 130주년 기념일을 맞아 한·불간 연대를 재확인하고 '21세기 포괄적 동반자 관계'의 내실을 강화하기 위한 방문이다. 경제적으로는 △교역·투자 확대기반 마련 △ICT, 바이오, 수소차 등 신산업 R&D(연구개발) 협력 확대 △창업협력 등 창조경제 생태계 조성 등의 성과가 기대된다.박 대통령은 2일 한·불 비즈니스포럼과 한·불 1대1 상담회 행사에 참석한 뒤 문화행사 일정을 가질 예정이다. 3일 오전에는 프랑스 이공계 명문대학인 파리6대학으로부터 명예 이학박사 학위를 받는다. 이 대학의 명예 이학박사 학위는 외국 정상에게는 처음으로 수여된다. 박 대통령은 수락연설을 통해 창조경제, 문화융성 정책에 대해 설명하고 이를 위한 한·불간 협력강화 필요성을 강조할 계획이다. 박 대통령은 그동안 △드레스덴공대 법학 명예박사 △서강대 정치학 명예박사 △부경대 정치학 명예박사 △카이스트 이학 명예박사 △중국문화대 문학 명예박사 등의 학위를 받은 바 있다. 박 대통령은 이날 오후에는 개선문 무명용사의 묘에 헌화한다.같은 날 박 대통령은 올랑드 대통령과 4번째 한·불 정상회담을 갖는다. △협정서명식 △ 공동기자회견 △프랑스 하원의장 면담 △국빈만찬 등 일정도 이어진다. 이번 회담에서 양 정상은 수교 130주년을 맞아 '수교 130주년 공동선언'을 채택할 예정이다. 공동선언은 지난해 11월 올랑드 대통령 국빈방한 당시 채택된 '21세기 포괄적 동반자 관계 강화를 위한 행동계획'에 이어 양국 협력을 견인할 이정표라는 의미를 갖는다.또 양국은 창조경제와 문화융성의 파트너로서 분야별 협력 MOU(양해각서) 체결 등을 통해 미래 신성장 동력을 공동으로 창출하기 위한 협력을 구체화하고, 유엔 안전보장이사회의 대북제재 결의(2270호) 이행 등 북핵 문제에 대한 긴밀한 공조체제를 구축하게 될 전망이다.박 대통령은 4일 프랑스 남동부 그르노블 시에서의 창조경제 협력 관련 행사 참석을 끝으로 아프리카·프랑스 순방의 모든 일정을 마치고 5일 귀국한다.[이코노미스트들의 깊이있는 투자정보 'TOM칼럼'][부자들에게 배우는 성공 노하우 '줄리아 투자노트'  ][내 삶을 바꾸는 정치뉴스 'the 300'][오늘 나의 운세는? '머니투데이운세' ][아찔한 girl~ 레이싱모델 핫포토 ]이상배  기자 ppark140@gmail.com<저작권자 ⓒ '돈이 보이는 리얼타임 뉴스' 머니투데이, 무단전재 및 재배포 금지>"
