,날짜,기사 제목,기사 링크,기사 출처,기사 내용
0,2012-10-12,더워진 바다 '생태계 급변'‥열대어류 한반도로,https://news.naver.com/main/read.nhn?mode=LSD&mid=shm&sid1=102&oid=214&aid=0000219012,MBC,"[뉴스데스크]◀ＡＮＣ▶지난 40여년동안 한반도 주변의 바닷물 온도가 약 1.3도 정도 올랐다고 합니다.별것 아닌데 하시겠지만 수온이 1도 오르면, 물고기들의 체감 온도는 8도가 오른다고 합니다.따져보면 11정도 오른 셈이니 물고기들에게는 열탕이 되고 있는 거겠죠.이때문에 한반도 연안에 전엔 볼 수 없던 열대 어종들이 몰려들고 있습니다.서하경 기자가 보도합니다.◀ＶＣＲ▶제주 해역에서나 볼 수 있던 파랑돔 무리가 이곳까지 올라왔습니다.산란이 한창인 아열대 어종 자리돔은 이제 독도 바다에 정착했습니다.국립수산과학원의 협조를 얻어 남해안에서 트롤조사를 실시했습니다.미기록 꽃게종인 호뮬라가 처음 발견됐고 열대바다에 서식하는 꼬리치가 무더기로 관측됐습니다.◀ＩＮＴ▶ 최정화 박사/국립수산과학원""먹이도 어느 정도 북상해 있는 상태이고 새끼들이 클 수 있는 수온이 또 자기가 기존에 서식하던 해역과 유사해졌다고...""제주도의 밤바다.따뜻한 오키나와에서 주로 잡히는 점고등어는 이제 제주바다까지 진출했습니다.◀ＩＮＴ▶ 김춘경/어민""옛날에는 점고등어가 많이 안 잡혔어요. 많이 안 잡혔는데 지금은 한 70%가 점고등어예요.""대만이 고향인 고래상어도 해류를 따라 이동하는 먹이를 쫓아 한반도까지 올라왔습니다.남해바다는 연중 멸치 풍년을 맞고 있습니다.난류성 플랑크톤이 늘자 멸치 어획량이 급증하고 있습니다.지난 40년 동안 한반도 주변해역의 표층수온은 연평균 0.03℃ 증가해 40년 동안1.31℃ 증가했습니다.◀ＩＮＴ▶ 안두해/고래연구소장""난류수를 따라서 열대성 및 아열대성 어종도 우리나라로 많이 들어오고, 현재 정착하고 있는 연안 정착성 어류들의 북방한계선은 어느정도 북쪽으로...""여름철 한반도에 잠시 들렀다가 따뜻한 바다로 떠나던 해파리가   10월인 지금도 우리바다 속을 떠다닙니다.또 수온이 상승하면서 찬물을 좋아하는 해조류가 사라지는 갯녹음현상이 독도까지 북상해 연안어장의 23%가 피해를 입고 있습니다.지구온난화로 열대어종의 대이동이 시작되면서 한반도 주변바다 생태계가 바뀌고 있습니다.MBC뉴스 서하경입니다.(서하경 기자)[저작권자(c) MBC (www.imnews.com) 무단복제-재배포 금지]"
1,2012-10-12,2012 경회루 연향(宴享),https://news.naver.com/main/read.nhn?mode=LSD&mid=shm&sid1=103&oid=001&aid=0005869528,연합뉴스,"(서울=연합뉴스) 12일 밤 서울 종로구 세종로 경복궁 경회루에서 열린 야간 전통 공연 '2012 경회루 연향(宴享)'에서 오고무 공연이 펼쳐지고 있다. 2012.10.12photo@yna.co.kr[이 시각 많이 본 기사]☞<국감현장> 울먹인 1군사령관..""부하들에게 미안""☞임형주, 한국 YWCA연합회 첫 홍보대사☞문재인 ""정문헌 발언 사실이면 책임지겠다""(종합)☞< F1코리아> '황제' 슈마허 ""날 보러 와요""☞`노크 귀순' 현장국감 실시..軍, 재발방지 다짐<연합뉴스 모바일앱 다운받기><포토 매거진><저작권자(c)연합뉴스. 무단전재-재배포금지.>"
2,2012-10-12,로스쿨 1기생들 지금 어디서 뭐하나,https://news.naver.com/main/read.nhn?mode=LSD&mid=shm&sid1=102&oid=032&aid=0002260974,경향신문,"로스쿨 출신 변호사인 임규선씨(오른쪽에서 세번째)가 11일 법률자문을 하고 있는 서울 영등포노인종합복지관 앞뜰에서 복지관을 찾은 노인들과 붕어빵을 함께 먹으며 정담을 나누고 있다. | 정지윤 기자  color@kyunghyang.comㆍ‘DNA가 다른 법조인’ 평가 속 이달부터 법률시장 본격 진출지난 10일 오전 10시 임규선 변호사(36)는 서울 영등포노인복지관을 찾았다. 할머니 두 분, 할아버지 한 분이 상담을 기다렸다. 카드 연체와 파산, 상속재산 등기, 임대차 계약, 유언장…. 원탁테이블에서 마주한 대화는 30분씩 진행됐다.“대개는 ‘또 와달라’며 만족해하세요. 상담 끝나고 음료수 사다놓고 가는 분도 있고요. 5분 보기도 힘든 변호사와 이렇게 길게 얘기해본 게 처음이라고 하죠.”임씨는 “카드 빚을 짚다 보면 채무발생 과정, 가족상황도 다 듣게 되요. 설명도 대개 장황하시잖아요”라며 “30분도 짧게 느껴질 때가 많다”고 말했다. 공공 임대아파트에서 퇴거될 할머니를 사회복지사에게 연결해 줘 다른 집을 찾아준 적도 있고, 발달장애아 아들이 당한 언어폭력을 토로하는 주부와 대화하며 상담이 일정 부분 치유도 된다는 것을 느꼈다고 했다.올 3월 서울대 로스쿨을 나온 임씨는 정부가 5월부터 개설한 ‘법률홈닥터’에 들어갔다. 무료로 법률서비스를 하는 공공기관이다. 현재 기초지방자치단체 11곳과 사회복지협회 9곳에 배치된 변호사 20명은 모두 로스쿨 출신이다. 그는 사회복지사 자격증도 갖고 있다. 로스쿨 1기인 임씨는 홈닥터에서의 의무연수 6개월이 끝나는 이달 자신의 이름으로 사건을 다룰 수 있는 정식 변호사가 된다.“대학에서 사회복지를 공부했고, 로스쿨 입학 전부터 법률과 사회복지가 연계된 일을 찾고 싶었어요.”그는 “변호사가 많이 배출되면서 큰돈 번다는 환상은 깨졌고, 나처럼 다양한 일에 관심 있는 사람이 많아질 것”이라며 “홈닥터 동료들의 전공도 경제·경영·인문계열까지 넓다”고 말했다. 그는 여느 변호사보다 적은 월급을 받고 있다. 오후에 경기도 산본의 사회복지관으로 향하는 그는 걷기 편한 단화를 신고 있었다.포항공대에서 컴퓨터공학을 공부하고 올해 성균관대 로스쿨을 졸업한 신용우씨(37)는 국회 문화체육관광방송통신위 국정감사장을 뛰고 있다. 3개월 전 민주통합당 최재천 의원 보좌관으로 채용된 것이다. 그는 로스쿨 입학 전 대기업에서 프로그램 엔지니어로 일했다. “로스쿨 동기 120명 중에 나이가 7~8번째로 많았죠.” 2학년 때 일찌감치 로펌 입사가 확정된 사람도 있지만, 컴퓨터공학 석사에 대기업 차장을 거친 늦깎이 로스쿨 변호사가 부딪친 건 취업난이었다. 그는 4월부터 개인변호사 사무실에서 연수를 시작했다. 실무를 배운 시간이다. 그러다가 방송통신 전문 보좌관을 원하던 최 의원 보좌관 면접을 보게 됐다.“현실적으로 엔지니어 경험을 살리기가 쉽지 않았고, 지금은 로스쿨 입학 때 예상치 못했던 길을 걷고 있지요.”올해 로스쿨을 나와 민주통합당 최재천 의원 보좌관으로 일하는 신용우 변호사가 지난 9일 국정감사가 열리고 있는 국회의사당 앞을 걸어가고 있다. | 강윤중 기자  yaja@kyunghyang.com그는 “보좌관으로 변호사를 마치진 않겠지만 기술과 법률을 접목한 전문변호사가 되겠다는 목표는 더 구체화됐다”며 “저는 법률가로 계속 성장 중”이라고 말했다.올 1월 변호사시험에 합격한 전국 25개 로스쿨의 1기 졸업생 1368명이 이달부터 법률시장에 발을 디딘다. 3월에 로스쿨을 나와 6개월의 의무연수를 한 사람들이다. 60~70%가 판검사와 로펌에서 일하는 사법연수원생과 달리 로펌에서 일하는 로스쿨 출신은 41%선. 전공과 사회경력, 진출 분야가 더 다양하다. 로스쿨 1기생들은 시장에서 ‘DNA가 다른 법조인’으로 불린다.경향신문이 직접 만나본 그들도 과거보다 변호사의 눈높이를 낮추고 특정 분야의 ‘스페셜리스트’가 되려는 사람이 많았다. ‘실력이 있느냐’ ‘비싼 학교를 다녔느냐’는 논란과 편견은 진행형이다. 법률시장이 넓지 않은 지방 로스쿨 졸업자들의 취업·개업 고민은 더 컸다. 어느 조직이나 그렇듯 로스쿨의 품평과 시행착오, 운명을 어깨에 진 1기생들의 세상 걸음마가 막 시작됐다.<이범준·이성희·김한솔 기자 seirots@kyunghyang.com>[관련기사]▶ “로스쿨, 시행착오 있어도 방향은 맞아” “합격률 높아 43점 맞은 변호사도 배출하는 건 문제”▶ 올 변호사 된 1기생 3명 중 2명 비법대 출신…로펌 취업 가장 많아▶ 신림동 고시촌에 남은 사람들 “기왕 시작한 사법시험, 끝 봐야”▶ 로스쿨 1기생들은 지금… “실력은 개인차일 뿐, 특수분야 사회 경력 있다면 더 강점”모바일 경향[경향 뉴스진(News Zine) 출시!]| 공식 SNS 계정[경향 트위터][미투데이][페이스북][세상과 경향의 소통 Khross]- ⓒ 경향신문(www.khan.co.kr), 무단전재 및 재배포 금지〈경향신문은 한국온라인신문협회(www.kona.or.kr)의 디지털뉴스이용규칙에 따른 저작권을 행사합니다.〉"
3,2012-10-12,[포토]황금빛 억새를 카메라에 담다!,https://news.naver.com/main/read.nhn?mode=LSD&mid=shm&sid1=103&oid=018&aid=0002670739,이데일리,[이데일리 한대욱 기자] 12일 오후 서울 마포구 상암동 하늘공원에서 열린 '제11회 서울억새축제'에서 시민들이 억새를 구경하며 가을의 정취를 만끽하고 있다.한대욱 (doorim@edaily.co.kr)[관련기사]☞[포토]황금빛으로 물든 억새
4,2012-10-12,'무한 질주' F1 스타트!…머신 굉음에 흥분,https://news.naver.com/main/read.nhn?mode=LSD&mid=shm&sid1=103&oid=055&aid=0000237250,SBS,"<앵커>꿈의 질주, F1 코리아 그랑프리가 개막했습니다. F1 경주차를 머신이라고 부르죠. 오늘(12일)은 연습주행만 했는데도 머신들이 내뿜는 굉음이 관객들을 흥분시켰습니다.김형열 기자입니다.<기자>시속 300km를 넘나드는 F1 머신들의 쾌속 질주에 탄성이 쏟아집니다.듣는 재미도 보는 재미 못지않습니다.심장을 두드리는 엔진 소리는 F1의 빼놓을 수 없는 매력입니다.비행기가 이착륙할 때 나는 소음 100데시벨에 가까운 굉음이 경기장을 뒤흔들었습니다.[원중식/코리아그랑프리 관객 : TV로만 봤는데 현장에서 직접 느껴보니까 심장 뛰는 것도 한 번 느낄 수 있고, 진동을 느끼니까 더 박진감 넘치는 경기인 것 같습니다.]선수들은 연습주행을 통해 머신의 성능과 코스 상태를 점검했습니다.때로는 속도를 이기지 못하고 코스를 이탈하기도 하고, 머신끼리 충돌할 뻔한 아찔한 장면이 나오기도 했습니다.두 차례 연습 주행에서 지난해 챔피언 페텔이 가장 좋은 기록을 냈습니다.[세바스티안 페텔/F1 드라이버, 레드불팀 : 영암에서는 항상 빠른 기록을 냈습니다. 결승에서 다시 한 번 재현해 보겠습니다.]올 시즌을 끝으로 은퇴하는 슈마허는 한국팬들에게 마지막 투혼의 레이스를 약속했습니다.[슈마허/F1 드라이버, 메르세데스팀 : 결선에서 좋은 성적을 내겠습니다. 저를 보러 이곳으로 오세요.]내일은 예선이 열리는데 예선 성적에 따라 모레 결승 레이스의 출발 순서가 정해집니다.(영상취재 : 오영춘, 영상편집 : 위원양)김형열 기자henry13@sbs.co.kr관/련/정/보◆ 군대 가기 싫어 급기야…'선후배 영상' 충격◆ '모텔 화장실서 발견' 캐디 살인범 알고보니◆ ""성 상담 해줄게"" 초등생 집 찾아가 성폭행◆ 병원들 도 넘은 서류 장사…이상한 꼼수를◆ 북한군 백기투항에도 ""장병, 총 무서워 숨어""☞[SBS기자들의 생생한 취재현장 뒷이야기 '취재파일']☞ SBS뉴스 공식 SNS [SBS8News 트위터] [페이스북] [미투데이] [요즘]저작권자 SBS&SBS콘텐츠허브 무단복제-재배포 금지"
5,2012-10-12,[영상] 집수리하려고 벽 허물었더니···300년 전 벽화가?,https://news.naver.com/main/read.nhn?mode=LSD&mid=shm&sid1=115&oid=055&aid=0000237236,SBS,"과테말라의 한 시골 마을에서 집을 리모델링을 하려고 벽을 허물다 마야인이 그린 벽화가 발견됐습니다.벽화가 발견된 곳은 과테말라시티에서 350km 떨어진 시골마을 차훌(Chajul)이라는 곳인데요, 마야인의 후손들이 이곳에 터를 잡고 대대손손 살고 있습니다.벽화가 발견된 집에도 5명의 자녀를 포함한 이 지역 원주민 7식구가 살고 있는데요, 오래되어 낡은 집을 고치려고 벽을 허무는 과정에서 칠에 가려져 있던 벽화가 발견됐습니다.이 벽화에는 유럽인들이 남미 지역을 정복하러 왔던 당시, 양복을 입고 모자를 쓴 유럽인과 마야인이 만나는 장면이 담겨있습니다.전문가들은 이 벽화가 적어도 300년 전 유럽의 정복에 맞서던 마야인의 모습을 보여준다며, 역사적으로 중요한 가치를 지닌다고 말했습니다.이 지역 주민과 전문가들은 벽화의 보존을 위해 당국의 지원을 요청할 계획입니다.(SBS 뉴미디어부)관/련/정/보◆ 울먹인 육군 대장 ""부하들에게 미안해서…""◆ 내 컴퓨터 음란물을…밖에서 30초 만에 포착◆ 갓난아기 안은 女, 빌라 들어가…CCTV 포착◆ 고득점 꼼수·주먹질까지…'애니팡 스트레스'◆ 안 먹어도 살찌는 男 '20일 만에 +30kg' 병명은?☞[SBS기자들의 생생한 취재현장 뒷이야기 '취재파일']☞ SBS뉴스 공식 SNS [SBS8News 트위터] [페이스북] [미투데이] [요즘]저작권자 SBS&SBS콘텐츠허브 무단복제-재배포 금지"
6,2012-10-12,박원순 시장실에 놓인 사연있는 ‘12개 의자’,https://news.naver.com/main/read.nhn?mode=LSD&mid=shm&sid1=102&oid=028&aid=0002160406,한겨레,"[한겨레]젓갈통 의자, 고 조영래 변호사 의자 등개청식때 공개…회의용으로 활용 예정서울시는 새 청사 시장 집무실내 회의용 탁자를 재활용 가구로 제작·배치한데 이어, 회의용 의자들도 순직 소방관이 공부했던 의자, 고 조용래 변호사의 의자 등 다양한 사연이 있는 것으로 12개를 마련했다.서울시 관계자는 12일 “다양한 토론과 정책결정이 이루어지는 시장 집무실에 사연이 담긴 의자들을 배치해서 공직자들이 항상 ‘서울시민과 시민들의 삶이 어우러지는 서울’을 먼저 생각하고 의사결정 할 수 있게 하는 상징적인 의미를 갖는다”고 말했다.의자들 중에는 지난 2008년 8월 은평구 대조동 화재진압 및 인명 수색 과정에서 순직한 고 변재우 소방관이 쓰던 의자가 있다. 고인이 소방 공무원이 되기 위해 공부할 때 사용하였던 의자를 고인의 어머니가 “내가 죽으면 누가 아들을 기억해 주겠느냐”며 선뜻 기증했다.대표적인 인권 변호사인 고 조영래 변호사의 배우자 이옥경씨가 기증한 의자도 있다. 조 변호사는 80년대 서민과 사회적 약자, 민주화 관련 시국 사범 등을 변론하며 인권의 변호에 힘썼다. ‘한 나라의 인권 상황은 인권을 지키고 증진시키려는 그 나라 시민의 노력과 결의에 달려있다’는 고인의 인권에 대한 생각을 기증 의자에 문구로 담았다.32년간 달동네를 지키며 가난한 사람들을 위해 헌신한 공로로 2012년 서울시 복지상 대상을 수상한 브레넌 로버트 존 신부가 사용한 의자, 서울의 마지막 달동네인 노원구 백사마을의 주민이 사용한 의자를 재활용한 의자, 서초구 내곡동 능안마을에서 400여 년간 20여대에 걸쳐 서울 토박이로 살아온 김학진씨 가족이 약 30여 년 동안 사용한 의자, 37년 동안 노량진 수산시장에서 젓갈장사를 하며 모은 23억원의 재산을 기증한 류양선 할머니가 가게에서 의자 대용으로 쓰던 젓갈통을 활용해 만든 의자,  2012년 8월 44년만에 역사속으로 사라진 대림시장의 상인이 사용하던 플라스틱 의자를 회의용으로 개조한 의자, 중증장애인 직업재활시설을 일궈 장애인들에게 일자리 제공에 힘쓴  에덴복지재단 정덕환 이사장이 사용했던 휠체어를 활용한 의자, 옛 서울역의 폐목재를 재활용하여 만든 의자 등이 있다.수집된 의자는 13일 새청사 개청식 때 시민들에게 공개되고 15일부터 실제 회의용 의자로 활용될 예정이다.권혁철 기자nura@hani.co.kr<한겨레 인기기사>■동료들의 현수막, 그날부터 공장은 지옥이 되었다■공지영, ‘운명에 대한 질투’는 내가 안고 갈 십자가■어머니와 아내 사이, 한 남자의 생존기■국감 증인 ‘SK는 OK’ ‘삼성은 NO’■“내 딸이 성적·학교폭력에 이렇게 고통받는 줄 몰라”■KBS, 이 대통령 주례연설 100회 TV 중계…새노조 “대선 코앞 편들기”■[화보]손연재, 나비처럼공식 SNS[통하니][트위터][미투데이]| 구독신청[한겨레신문][한겨레21]Copyrights ⓒ 한겨레신문사, 무단전재 및 재배포 금지<한겨레는 한국온라인신문협회(www.kona.or.kr)의 디지털뉴스이용규칙에 따른 저작권을 행사합니다.>"
7,2012-10-12,'이렇게 문을 두드렸지만..',https://news.naver.com/main/read.nhn?mode=LSD&mid=shm&sid1=100&oid=001&aid=0005869186,연합뉴스,"(고성 사진공동취재단=연합뉴스) 12일 북한군이 귀순한 강원도 고성군 최전방관측소 부대에서 육군 제22사단 조성직 사단장이 당시 귀순군이 생활관 문을 두드리는 상황을 국방위원들에게 설명을 하고 있다. 2012.10.12photo@yna.co.kr[이 시각 많이 본 기사]☞문재인 ""정문헌 발언 사실이면 책임지겠다""(종합)☞케이윌 '이러지마 제발' 음원차트 석권☞<문재인 국방 5대 구상..`유능한 안보' 초점>(종합)☞<프로야구> '어게인 2010'…두산 ""있다"" vs 롯데 ""없다""☞국회 국정감사 계속..최필립 증인채택 공방<연합뉴스 모바일앱 다운받기><포토 매거진><저작권자(c)연합뉴스. 무단전재-재배포금지.>"
