,날짜,기사 제목,기사 링크,기사 출처,기사 내용
37,2012-10-12,두개골 골절·한 눈 실명·140바늘 봉합 “새 꿈이 생겼어요”,https://news.naver.com/main/read.nhn?mode=LSD&mid=shm&sid1=104&oid=005&aid=0000528781,국민일보,"‘F1 테스트 드라이버’ 비요타의 휴먼 드라마“사고를 당한 후 처음으로 거울을 봤어요. 얼굴이 검은 실로 140바늘이나 꿰매져 있더군요. 오른쪽 눈은 없어졌고요. 정말 끔찍했습니다.”지난 7월 3일(현지시간) 영국 런던 북부의 덕스포드 에어필드에서 열린 연습 주행에서 팀 지원 트럭을 들이받아 오른쪽 눈을 실명한 미모의 포뮬러1(F1) 여성 테스트 드라이버 마리아 데 비요타(32·스페인). 테스트 드라이버는 F1 본선에 출전할 수 있는 드라이버 바로 아래 단계에 속한 선수들이다.F1 드라이버는 현재 전 세계에서 24명에 불과하고 모두 남성이다. 12일 전남 영암에서 개막되는 F1코리아는 이들이 펼치는 지구촌 스피드 축제이다.여성은 역대 5명이 있었지만 지금은 한 명도 없다. 여성 테스트 드라이버도 비요타를 포함해 단 2명뿐이다. 특히 비요타는 1992년 이후 20년 만의 첫 F1 여성 드라이버가 유력했던 터라 그의 사고는 충격 그 자체였다. 비요타는 1976년부터 1982년까지 활약한 전설적인 F1 드라이버 에밀리오 데 비요타의 딸이기도 하다.그런 그가 11일 출간된 스페인 잡지 ‘HOLA’와의 인터뷰에서 사고 당시와 이후의 삶에 대해 처음으로 입을 열었다. 당시 비요타가 탄 MR01은 팀의 지원 트럭을 들이받았고, 비요타의 헬멧에 시속 50∼60㎞의 충격이 가해졌다. 이 사고로 두개골이 골절되고 얼굴을 심하게 다친 비요타는 한때 생명이 위독했으나 오른쪽 안구 적출을 포함한 대수술을 받은 끝에 겨우 위기를 넘겼다.사고가 일어난 순간이 생생히 기억난다는 비요타는 절망 대신 긍정적인 면을 들여다보았다. “사람들은 나의 당시 사고로부터 교훈을 얻겠지요. 그래서 앞으로 이런 사고를 미연에 방지할 수 있을 거예요.”비요타의 가족은 MR01에 아무 이상이 없었다고 주장하는 마루시아 팀에 화가 나 있지만 비요타는 현재 팀과 좋은 관계를 유지하고 있다. “나는 내 동료들과 모터스포츠계에 종사하는 사람들로부터 많은 사랑과 존경을 받고 있다고 느껴요.”곧 추가 수술을 받을 예정인 비요타는 심한 후유증에 시달리고 있다. 언제까지 계속될지 모르는 두통에 시달리고 있으며 후각과 미각도 잃어 버렸다. 그러나 비요타는 절망하지 않았다. 오히려 내일을 위한 또 다른 질주를 준비하고 있다.“그 사고로 인생에 대한 새로운 꿈을 가지게 됐고, 무엇이 정말 중요한 것인지 알게 됐어요. 이제 난 눈이 하나밖에 없지만 이전보다 주위의 것들을 더 잘 볼 수 있어요. 예전에 내 인생은 시간과의 싸움이었죠. 급하게 달리지만 말고 멈춰 서서 다른 방식으로 주변을 살펴봐야 한다는 걸 깨달았어요.”김태현 기자 taehyun@kmib.co.kr<GoodNews paper ⓒ국민일보. 무단전재 및 재배포금지>"
38,2012-10-12,핑크빛 반포대교,https://news.naver.com/main/read.nhn?mode=LSD&mid=shm&sid1=102&oid=001&aid=0005867256,연합뉴스,"(서울=연합뉴스) 박동주 기자 = 에스티 로더 컴퍼니즈 코리아는 유방암 의식 향상 캠페인의 일환으로 10월 한 달 동안 서울 및 전국 주요 도시의 랜드마크에서 핑크색 점등식을 진행한다. 사진은 11일 밤 서울 반포대교 달빛 무지개 분수에서 핑크빛 조명이 점등된 모습. 2012.10.11pdj6635@yna.co.kr[이 시각 많이 본 기사]☞日법원 ""한일조약 日측 문서 공개하라""(종합)☞조장혁 싱글 발표..4년만에 컴백☞iPS세포로 만든 심근, 美서 사람에 첫 이식(종합)☞국제배구연맹 ""김연경은 흥국생명 선수""(종합2보)☞<동부전선 북한군 귀순 일자ㆍ시간대별 상황><연합뉴스 모바일앱 다운받기><포토 매거진><저작권자(c)연합뉴스. 무단전재-재배포금지.>"
39,2012-10-12,"'유명무실' 불량 소화전, 전국 3400여 개 방치",https://news.naver.com/main/read.nhn?mode=LSD&mid=shm&sid1=102&oid=055&aid=0000237179,SBS,"<앵커>평소에는 있으나 마나 해도 괜찮은데 일단 불이 나면 반드시 필요한 게 소화전입니다. 그런데 불이 나도 있으나 마나 한 소화전이 전국에 3400개나 되는 것으로 드러났습니다.이호건 기자가 현장 취재했습니다.<기자>서울 관악구의 한 소화전입니다.소화전과 소방호스를 연결하려면 파이프를 끼워야 합니다.하지만 소화전이 낡으면서 구멍이 느슨해지는 바람에 파이프를 제대로 끼울 수 없습니다.급수 밸브가 휘면서 물을 틀기 어려운 소화전도 있습니다.[소방대원 : 지금 수리 대상에 잡혀 있습니다. 이게 지금 휘어가지고 그런 것 같아요. 원래는 괜찮았는데…]급수 밸브가 고장 난 소화전입니다.물이 나오는지 밸브를 돌려보겠습니다.아무리 돌려도 계속 헛돌기만 할 뿐 물이 전혀 나오지 않습니다.땅속에 설치한 소화전은 내벽이 무너져 흙더미에 묻혔습니다.[소방대원 : 이게 흙이 좀 차 있어서. (흙이 왜 이렇게 차 있는 건가요? 여기는?) 옆에서 밀려 들어와서 그렇죠.]배수가 제대로 이뤄지지 않는 바람에 이 소화전은 아예 물에 잠겨 버렸습니다.있으나 마나 한 이런 소화전이 소방방재청 조사결과 전국적으로 3400여 개에 이르는 것으로 집계됐습니다.문제는 수리가 된 게 2천100여 개에 불과해 정비율이 60%밖에 되지 않는다는 겁니다.소화전 설치와 수리는 자치단체의 수도사업본부가, 관리는 소방서로 이원화돼있습니다.소방서가 고장 난 소화전을 발견하더라도 수리는 수도 사업본부 책임이다 보니 관리가 잘 안 되는 겁니다.예산도 문제입니다.올해 소화전 보강에 필요한 예산은 79억여 원이지만 실제 배정된 예산은 54억 원에 불과합니다.[소방방재청 관계자 : (예산이) 당연히 모자라죠. 항상 예산에 있어서 조직 차원에서 후순위로 밀려 있다 보니까 보수할 수 있는 충분한 여건이 안되는 게 많아요.][고희선/국회 행정안전위원회 의원 : 고장난 소화전에 대한 관리를 일원화해 화재 진압에 차질이 없도록 해야 되겠습니다.]언제 어떤 상황에서도 소화전이 작동할 수 있도록 철저한 사전 점검과 신속한 정비가 병행돼야 한다는 지적입니다.(영상취재 : 정상보·주용진, 영상편집 : 김경연)이호건 기자hogeni@sbs.co.kr관/련/정/보◆ 운전대 에어백이 '펑!' 불꽃 활활…충격 영상◆ 훔친 카드 비밀번호 '척척'…기막힌 수법◆ 대구 여고생 투신 자살, 남긴 유서 내용은◆ 명품이라던 K-21 장갑차, 누더기 장비로…◆ 바다 위 구름 기둥…울릉도 용오름 2개 포착☞[SBS기자들의 생생한 취재현장 뒷이야기 '취재파일']☞ SBS뉴스 공식 SNS [SBS8News 트위터] [페이스북] [미투데이] [요즘]저작권자 SBS&SBS콘텐츠허브 무단복제-재배포 금지"
40,2012-10-12,힐링 열풍에 생태길 인기…새 레저문화로 각광,https://news.naver.com/main/read.nhn?mode=LSD&mid=shm&sid1=103&oid=055&aid=0000237174,SBS,"<앵커>요즘 힐링 열풍 타고 둘레길이나 올레길 같은 이른바 '생태길' 찾는 분들 많습니다. 국립공원 방문객이 2010년 기준으로 보니까 4천만 명을 넘어섰습니다.우리 레저문화의 대세로 자리 잡아가고 있는 생태길에 실태를 송성준 기자가 보도합니다.<기자>80년 만에 일반에 공개된 경남 양산의 한 수원지입니다.수령이 100년 안팎의 히말리야 시다와 편백 나무 숲이 탐방객을 맞습니다.피톤치드 가득한 숲길을 걷는 탐방객의 얼굴에는 편안한 미소가 번집니다.수원지 제방 위에는 희귀 반송나무가 아름다운 자태를 뽐내고 있습니다.[구은희/부산시 온천동 : 나무의 향 냄새 이런 게 모두 외국에 관광 온 그런 기분이 드네요.]전망대나 의자 같은 인공 시설물은 최소화하고 자연 원형을 그대로 보존하고 있습니다.[김혜경/부산시 낙민동 : 몸의 건강도 그렇고 마음의 건강도 치유가 될 것 같은 느낌 너무 좋아요.]작년 7월 개방 이후 입소문이 나면서 주말에는 하루 3천여 명이 찾을 정도로 명소가 됐습니다.아름다운 해안선을 끼고 있는 남해 연안 자치단체들은 앞다퉈 해안 생태길을 조성하고 있습니다.한려해상 국립공원의 쪽빛 바다가 한눈에 펼쳐지는 무지개길.은빛 바다 위에 크고 작은 섬들이 파노라마처럼 펼쳐집니다.부산 이기대 공원 해안 산책로는 기암괴석이 절경을 이루고 오륙도가 손에 잡힐 듯 다가옵니다.2년 전 산책길이 조성된 후 이전보다 관광객이 수십 배나 늘 정도로 명소가 됐습니다.부산 영도 절영 해안길도 갈매기와 해녀들의 물질을 가까이서 체험할 수 있는 아름다운 산책길입니다.[이영자/부산 봉래동 : 여기에 오면 모든 시야가 다 있잖아요. 다 보이잖아요. 부산 시내가. 그래서 좋습니다.]아름다운 숲과 산책길이 명소로 주목받는 데는 일상에서 지치 심신을 치유하려는 사람들이 늘었기 때문입니다.멋진 경치도 보고 마음의 안식도 찾는 걷기 좋은 생태길 탐방이 레저문화의 대세로 자리 잡았습니다.(영상취재 : 정경문)송성준 기자sjsong@sbs.co.kr관/련/정/보◆ 운전대 에어백이 '펑!' 불꽃 활활…충격 영상◆ 훔친 카드 비밀번호 '척척'…기막힌 수법◆ 대구 여고생 투신 자살, 남긴 유서 내용은◆ 명품이라던 K-21 장갑차, 누더기 장비로…◆ 바다 위 구름 기둥…울릉도 용오름 2개 포착☞[SBS기자들의 생생한 취재현장 뒷이야기 '취재파일']☞ SBS뉴스 공식 SNS [SBS8News 트위터] [페이스북] [미투데이] [요즘]저작권자 SBS&SBS콘텐츠허브 무단복제-재배포 금지"
41,2012-10-12,4대강 공사 선박 177척 방치… 기름 줄줄,https://news.naver.com/main/read.nhn?mode=LSD&mid=shm&sid1=102&oid=005&aid=0000528719,국민일보,"4대강 공사에 사용됐던 선박 170여척이 하천에 그대로 방치돼 있자 정부가 500억원의 혈세를 들여 사들인 뒤 폐기처분하는 방안을 검토 중인 것으로 확인됐다. 방치된 선박들에서 수차례 기름이 유출되는 등 심각한 하천 오염도 우려된다.국토부와 환경부가 11일 최봉홍 의원에게 제출한 자료에 따르면 4대강 공사에 사용됐던 준설선 골재채취선 예인선 등 선박 177척이 기약 없이 정박·방치돼 있는 것으로 나타났다. 준설선은 부식되거나 녹이 슨 상태로 강 유역에 그대로 남겨져 있는 것으로 파악됐다. 낙동강 유역에 155척이 방치돼 있고 금강 18척, 영산강 3척, 한강에 1척이 남아 있다.방치된 선박에서 흘러나온 기름이 강 유역을 뒤덮는 사고도 잇따르고 있다. 지난 8월 영산강 하구에 방치돼 있던 준설선이 태풍에 의해 쓸려내려가면서 선체 안에 있던 벙커A유와 기름 찌꺼기가 영산호로 유출됐다. 지난해 2월에도 영산강 인근에 사업자 부도로 방치된 준설선과 예인선이 침몰해 연료통에 있던 기름 400ℓ가 한꺼번에 유출되기도 했다. 특히 지난해 금강에 있던 준설선에서 벙커C유 등 기름이 유출됐으나 시공업체가 이를 숨겨 24시간 넘게 계속 유출된 사례도 발생했다. 최근 2년간 7건의 방치선박 관련 수질오염 사고가 발생했다.방치된 선박으로부터 하천 오염을 막기 위해서는 선박 내 유류를 제거하고 주위에 오일펜스를 설치해야 하지만 정부는 이 역시 주먹구구로 대응하고 있다. 현재 낙동강 유역에 방치된 선박 100척 중 여전히 기름이 담긴 선박이 75척에 달했고 오일펜스 미설치 선박은 60척이나 됐다.선박들은 4대강 지역에서 골재채취업을 하던 업체들이 사용하던 것이다. 4대강 사업 당시에는 준설 작업에 투입됐다가 사업이 완료되자 일거리를 잃은 업체들은 “4대강 사업으로 생업을 잃었기 때문에 정부가 보상해야 한다”며 선박을 방치해 두고 있다. 정부는 지난 5월부터 이들에게 선박 철수를 수차례 요청했지만 해결이 안 됐다. 결국 보상 차원에서 선박을 사들이기로 하고 관련 예산 420억원을 책정했다. 177척의 선박을 사들이는 데는 400억∼500억원이 필요할 것으로 국토부는 예상하고 있다. 현재 가장 많은 시설·장비가 방치돼 있는 낙동강 유역에만 320억원의 보상비가 책정돼 있다.최 의원은 “현 상태라면 방치된 준설선 철거 작업을 최대한 빨리 시작해도 내년 3월이 지나야 할 것으로 보인다”며 “기름 유출로 인한 하천 오염이 우려되는 만큼 시급한 처리가 요구된다”고 말했다.이용상 기자 sotong203@kmib.co.kr<GoodNews paper ⓒ국민일보. 무단전재 및 재배포금지>"
42,2012-10-12,보약 부럽지 않은 제철 버섯 요리,https://news.naver.com/main/read.nhn?mode=LSD&mid=shm&sid1=103&oid=145&aid=0000010105,레이디경향,"흔히 제철 재료가 최고의 보약이라 말하지만 그중 버섯만 한 게 또 있을까. 1년 중 가장 맛이 좋고 영양이 풍부한 가을 버섯으로 가족을 위한 보양 식탁을 차려보자.새송이버섯쫄깃한 식감과 담백한 맛으로 사랑받는 새송이버섯은 피를 맑게 해주는 것은 물론 혈액 속 콜레스테롤과 체내 노폐물을 줄여주는 효과가 있다. 식이섬유가 풍부해 장운동을 활발하게 하며 비타민과 무기질이 많아 피부 미용에도 도움이 된다. 구입할 때는 육질이 부드럽고 단단하며 탄력 있는 것을 고른다.양송이버섯다른 채소는 물론 고기보다도 필수아미노산 함량이 높은 웰빙 식재료. 항암과 항균 효과가 있다고 알려졌으며, 특히 육류와 함께 섭취하면 인체에 축적되기 쉬운 각종 유해물질을 제거하는 효과가 있다. 모양이 둥글고 기둥이 굵으며 갓과 기둥을 연결하는 곳이 터지지 않은 것이 좋은 상품이다.느타리버섯혈액순환을 도와 피로 해소와 고혈압 예방은 물론 항암 효과가 있는 것으로 알려졌다. 장내에 지방이 흡수되지 않도록 하는 다이어트 식품으로도 손꼽힌다. 갓 표면에 회색빛이 돌며 갓 뒷면은 선명하고 흰 것이 신선하다.표고버섯특유의 향과 쫄깃한 식감이 살아 있는 표고버섯은 콜레스테롤 수치와 혈압을 낮추는 효과가 있어 육류 요리나 기름을 사용하는 요리에 곁들이기 좋다. 빈혈 예방에 좋은 비타민 B가 많으며 특히 말린 표고버섯은 ‘비타민 D의 보고’라 불릴 정도로 비타민 D가 풍부하다. 갓이 너무 피지 않고 색이 선명하며 주름지지 않은 것이 좋은 상품.송이버섯향이 풍부하고 쫄깃한 송이버섯은 값이 비싸고 귀한 고단백·저칼로리 식품으로 꼽힌다. 콜레스테롤을 억제하고 혈액순환을 촉진하며 비타민 D가 풍부하다. 특히 버섯 중 항암 효과가 가장 좋은 것으로 알려졌다. 갓이 많이 피지 않고 두껍고 단단하며 기둥이 너무 길지 않은 것이 좋다.목이버섯생김새뿐 아니라 식감과 맛 역시 독특한 버섯으로 혈액을 맑게 하고 고혈압과 동맥경화 예방에 도움이 된다고 알려졌다. 특히 골다공증 예방 효과가 좋으며 식이섬유 함량이 높아 다이어트와 피부 미용에도 도움이 된다.표고버섯 떡갈비재료표고버섯 4개, 다진 쇠고기 400g, 다진 호두 1큰술, 올리브유 약간, 양념(생강즙·간장·소금 1큰술씩)만들기1 표고버섯은 붓으로 이물질을 털어낸 뒤 잘게 다진다. 2 볼에 ①의 표고버섯과 다진 쇠고기, 다진 호두, 분량의 양념 재료를 넣어 고루 섞는다. 3 ②의 반죽을 갈라지지 않게 치댄 다음 동그랗고 납작하게 모양을 만든다. 4 팬에 올리브유를 두르고 ③의 반죽을 올려 앞뒤로 뒤집어가며 노릇하게 굽는다.목이버섯 굴탕면재료말린 목이버섯 15g, 샬롯 8개, 쪽파 80g, 아스파라거스 6대, 굴 240g, 새우 8마리, 에그면 320g, 다시마(5×5cm) 1장, 녹말물 4큰술, 굴소스 1작은술, 물 6컵, 참기름·후춧가루 약간씩, 소금 적당량만들기1 말린 목이버섯은 1시간 정도 미리 물에 불려두고 아스파라거스는 깨끗이 씻어 3등분한다. 2 샬롯은 껍질을 벗겨 반으로 썰고 쪽파는 깨끗이 씻어 5~6cm 길이로 썬다. 3 굴과 새우는 소금을 푼 물에 살살 흔들어 씻는다. 4 냄비에 물을 붓고 다시마를 넣어 한소끔 끓인 다음 다시마는 건져내고 ②의 샬롯을 넣어 좀 더 끓인다. 5 ④의 냄비에 ①과 ③의 재료를 넣고 어느 정도 끓으면 에그면을 넣는다. 6 ⑤의 냄비에 ②의 쪽파와 굴소스, 참기름, 소금, 후춧가루를 넣은 뒤 녹말물로 농도를 조절한다.구운 송이버섯 꽁치튀김재료송이버섯 8개, 꽁치 3마리, 레몬즙 1큰술, 소금·후춧가루 약간씩, 녹말가루·식용유 적당량, 소스(검은깨 3큰술, 마요네즈 2큰술, 참기름 1큰술, 미소된장 1작은술, 소금·후춧가루 약간씩)만들기1 송이버섯은 붓으로 이물질을 털어내고 반으로 가른다. 2 꽁치는 깨끗이 씻어 내장을 제거하고 3등분으로 썬 뒤 레몬즙과 소금을 뿌려 재운다. 3 팬에 식용유를 약간 두르고 ①의 송이버섯을 넣은 다음 소금, 후춧가루로 간해 살짝 굽는다. 4 ②의 꽁치에 녹말가루를 묻힌 다음 식용유를 넉넉하게 두른 팬에 넣어 노릇하게 튀긴다. 5 볼에 분량의 소스 재료를 넣어 고루 섞는다. 6 접시에 ③과 ④를 담고 ⑤의 소스를 곁들인다.모둠 버섯 골동반재료밥 4공기, 송이버섯·표고버섯 4개씩, 백만송이버섯 80g, 당근·애호박 1/2개씩, 달걀 2개, 들기름·소금·간장·설탕·검은깨 약간씩, 식용유 적당량, 고추장양념(고추장 4큰술, 참기름 2큰술, 참깨·매실청 1큰술씩, 다진 마늘 1/2작은술)만들기1 송이버섯은 손으로 얇게 찢고 백만송이버섯은 먹기 좋게 줄기를 살려 뜯은 뒤 두 버섯을 볼에 담고 들기름과 소금을 넣어 재운다. 2 표고버섯은 기둥을 썰어내고 납작하게 썬 다음 볼에 담고 간장, 설탕, 들기름을 넣어 재운다. 3 당근과 애호박은 손질한 뒤 얇게 채썰어 식용유를 두른 팬에 각각 따로 볶는다. 4 달걀은 흰자와 노른자를 분리해 식용유를 살짝 두른 팬에 지단을 부친 다음 얇게 채썬다. 5 팬에 식용유를 두르고 ①과 ②의 버섯을 각각 따로 볶는다. 6 볼에 분량의 고추장양념 재료를 넣고 골고루 섞는다. 7 그릇에 밥을 담고 ③, ④, ⑤의 재료를 각각 가지런히 올린 뒤 검은깨를 뿌리고 ⑥의 고추장소스를 곁들인다.양송이버섯 매콤 강정재료양송이버섯 20개, 달걀 1개, 튀김가루 1컵, 물 1/4컵, 식용유 적당량, 파슬리가루 약간, 소스(토마토케첩 4큰술, 고추장·맛술 1큰술씩, 다진 마늘 1/2작은술, 후춧가루 약간)만들기1 양송이버섯은 붓으로 먼지와 이물질을 털어내고 껍질을 벗긴다. 2 볼에 달걀을 풀어 넣고 튀김가루와 물을 넣어 섞은 뒤 ①의 양송이버섯에 반죽을 입힌다. 3 팬에 식용유를 붓고 끓으면 ②를 넣어 노릇하게 튀긴다. 4 볼에 분량의 소스 재료를 넣어 골고루 섞는다. 5 팬에 ④의 소스를 넣고 끓이다 어느 정도 졸아들면 ③의 튀긴 양송이버섯을 넣고 고루 버무린 다음 파슬리가루를 뿌린다.모둠 버섯 베이컨프리타타재료표고버섯 6개, 양송이버섯 12개, 백만송이버섯 120g, 베이컨 4줄, 달걀 6개, 생크림 1/2컵, 파르메산 치즈가루 2큰술, 설탕·소금·후춧가루 약간씩, 버터 적당량만들기1 볼에 달걀을 풀고 생크림과 설탕, 소금, 후춧가루를 넣어 고루 섞는다. 2 각종 버섯은 붓으로 이물질을 제거하고 먹기 좋은 크기로 썬 다음 버터를 녹인 팬에 넣고 소금, 후춧가루로 간한 뒤 살짝 볶는다. 3 오븐용 팬에 버터를 고루 바르고 ①을 부은 다음 ②의 버섯과 베이컨을 가지런히 올리고 파르메산 치즈가루를 뿌린다. 4 ③을 200℃로 예열한 오븐에 넣어 15분간 굽는다.백만송이버섯 크림소스차우더재료백만송이버섯 240g, 양파 1개, 생크림 2컵, 밀가루 4큰술, 버터 2큰술, 우유 4컵, 소금·후춧가루·식빵 부스러기 약간씩만들기1 백만송이버섯은 먹기 좋게 줄기를 살려 뜯고 양파는 껍질을 벗기고 얇게 채썬다. 2 냄비에 버터를 녹인 다음 ①의 양파를 넣어 볶다가 백만송이버섯을 넣어 좀 더 볶는다. 3 ②의 냄비의 불을 약하게 줄이고 밀가루를 넣어 타지 않게 볶은 다음 우유와 생크림을 부어 푹 끓인다. 4 ③에 소금, 후춧가루로 간한 뒤 그릇에 담고 식빵 부스러기를 뿌린다.느타리버섯 미트볼 샌드위치재료식빵 8장, 다진 쇠고기·다진 돼지고기 200g씩, 느타리버섯 120g, 달걀 1개, 빵가루 1컵, 토마토케첩 1/2컵, 우스터소스 1큰술, 버터 2큰술, 소금·후춧가루·식용유 약간씩, 소스(머스터드소스·레몬즙 1큰술씩, 마요네즈 3큰술, 올리고당·발사믹소스 1작은술씩, 소금·후춧가루 약간씩)만들기1 볼에 다진 쇠고기, 다진 돼지고기, 달걀, 빵가루, 토마토케첩, 우스터소스를 넣고 고루 섞은 다음 소금, 후춧가루로 간한다. 2 ①의 반죽을 떼어 지름 3cm 크기로 동그랗게 빚은 다음 식용유를 두른 팬에 올려 노릇하게 굽는다. 3 느타리버섯은 붓으로 이물질을 털어내고 손으로 길게 찢은 다음 버터를 녹인 팬에 넣고 소금, 후춧가루로 간해 살짝 볶는다. 4 볼에 분량의 소스 재료를 넣고 고루 섞는다. 5 식빵에 ④의 소스를 바르고 ②의 미트볼과 ③의 느타리버섯을 올린 다음 그 위에 소스를 다시 한번 바르고 식빵으로 샌드한다.＜■진행 / 이은선 기자 ■사진 / 이주석 ■요리&스타일링 / 박용일(YONG STYLE), 남경현·조아정(어시스트)＞"
43,2012-10-12,"""생쥐도 노래할 줄 안다""",https://news.naver.com/main/read.nhn?mode=LSD&mid=shm&sid1=105&oid=008&aid=0002927218,머니투데이,"[머니투데이 이슈팀 정소라 기자]'쥐도 노래 할 수 있다' ⓒ텔레그래프인간과 일부 조류 등에게만 있는 것으로 알려진 두뇌의 음성 조절 능력이 생쥐에게도 일부 있다는 연구 결과가 나왔다.미 뉴올리언스툴레인대학 에리히 자비스 박사 연구팀이 종류가 다른 수컷 생쥐 2마리를 함께 지내게 한 결과, 서로 음높이를 천천히 조절해 맞추기 시작하는 것을 알 수 있었다면서 이는 음성 흉내의 기본적 형태라고 밝혔다고 영국 텔레그래프가 10일(현지시간) 보도했다.이같은 결과는 생쥐가 인간이나 박쥐, 일부 조류, 대형 포유류에게만 있는 음성 조절 능력이 없다는 오랜 추정과는 배치되는 것이다.생쥐가 짝짓기 상대를 유혹하기 위해 일종의 '노래'인 초음파 소음을 내는 것으로 알려져 왔지만 음높이를 조절할 수 있다는 주장이 제기된 것은 이번이 처음이다.[머니투데이 핫뉴스]☞시아버지, 며느리 이름으로 3억 집 사줬더니☞""애니팡 바뀐다, 친구에게 하트 대신…""☞""싼타페, 빨리 사라"" 딜러들, 깜짝 놀라…☞고속도로휴게소 '5000원 우동' 비밀 ""실제론...""☞'천재소년' 송유근 폭풍성장 ""훈남 과학자 포스"" 깜짝이슈팀 정소라기자<저작권자 ⓒ '돈이 보이는 리얼타임 뉴스' 머니투데이, 무단전재 및 재배포 금지>"
