,날짜,기사 제목,기사 링크,기사 출처,기사 내용
118,2012-10-12,"삼성, 갤럭시 넥서스 항소심 이긴 비결은?",https://news.naver.com/main/read.nhn?mode=LSD&mid=shm&sid1=105&oid=031&aid=0000273906,아이뉴스24,"<아이뉴스24>[김익현기자] ""갤럭시 넥서스가 잘 팔린 것이 애플 특허권을 침해한 때문이라는 증거가 부족하다.""삼성이 갤럭시 탭에 이어 갤럭시 넥서스 판매금지 항소심에서 승리했다. 미국 연방순회 항소법원은 11일(현지 시간) 삼성전자의 갤럭시 넥서스 판매를 금지한 원심 판결을 뒤집고 새너제이에 있는 캘리포니아 북부 지역법원으로 해당 사건을 환송했다.항소법원은 이날 18쪽 분량의 판결문을 통해 ""새너제이 지역법원의 루시 고 판사가 갤럭시 넥서스 판매금지 판결을 내린 것은 재량권 남용""이라고 지적했다.◆""애플, 갤럭시 넥서스 구매 통합검색 때문이란 입증 못해""항소법원이 갤럭시 넥서스 판매금지 판결을 뒤집은 것은 특허 침해와 판매 금지 간의 상관 관계를 엄격하게 적용한 때문으로 풀이된다.일반적으로 특정 제품의 판매금지를 이끌어내려면 ▲판금 조치가 없을 경우 회복하기 힘든 피해를 입게 되며 ▲자신들이 입게 되는 피해가 특허 침해와 강한 연관 관계가 있다는 점을 입증해야만 한다.항소법원이 문제 삼은 부분은 애플의 피해와 특허 침해 간의 강한 연관 관계 부족이다. 이날 항소 재판부는 ""애플이 입은 피해가 특허 침해와 직접적인 연관이 있다는 점을 입증해야 한다""고 지적했다. 하지만 애플은 그렇게 하지 못했다는 것이 재판부의 판단이다.항소 재판부는 판결문을 통해 루시 고 판사가 삼성이 특허 침해로 수혜를 봤다는 결론을 너무 안이하게 이끌어냈다는 점을 지적했다.1심 재판을 담당한 루시 고 판사는 ""소비자들이 갤럭시 넥서스를 구매하는 데는 통합 검색 기능이 중요한 역할을 했다""는 애플의 주장을 받아들였다.하지만 항소 재판부는 이 정도 근거만으로 판매금지 조치를 내리는 것은 성급하다고 판단했다. ""피해와 특허 침해 간의 상관 관계는 이분법적인 문제가 아니다""는 것이다. 따라서 단순히 상관 관계가 있느냐 차원이 아니라 어느 정도나 영향을 미쳤냐는 것도 고려해야 한다는 것이 항소 재판부의 주장이다.이런 근거를 토대로 항소 재판부는 ""특허 침해 당한 기능 때문에 소비자들이 해당 제품을 구매하려는 욕구를 갖게 된다""는 점을 입증할 필요가 있다고 요구했다.하지만 애플은 소비자들이 갤럭시 넥서스를 구매한 것이 애플 특허를 침해해서 만든 기능 때문이란 증거를 제대로 내놓지 못했다는 것이 항소법원의 판단이다.◆""통합 검색 기능 있다는 점만으로 판금한 건 성급""갤럭시 넥서스 판매금지 조치를 내리는 데 결정적인 역할을 한 애플의 특허는 '8,086,604 특허권'(이하 604 특허권)이다.애플 특허 소송의 단골 메뉴인 '604 특허권'은 바로 시리(Siri)를 활용한 통합 검색을 규정하고 있다. 통합 검색이란 스마트폰 단말기 뿐 아니라 인터넷 등 다양한 플랫폼에 있는 내용을 동시에 검색할 수 있도록 해 주는 기능이다.1심 판결 당시 루시 고 판사는 ""통합 검색 기능이 (갤럭시 넥서스에 대한) 소비자들의 수요를 진작하는 데 긍정적인 역할을 했다""고 판단했다. 고 판사는 또 해당 기능을 제거할 경우 갤럭시 넥서스의 가치가 감소된다는 점 역시 특허 침해와 '회복할 수 없는 피해' 간의 상관 관계가 있는 근거로 봤다.이에 대해 항소법원은 단순히 특정 기능을 제거할 경우 그 제품의 가치가 떨어진다는 점만으로는 특허 침해와 피해 간에 상관 관계가 있다고 판단할 근거가 없다고 지적했다.항소법원은 구체적인 예를 들어 설명했다. 즉 노트북PC에서 배터리나 냉각 팬을 제거할 경우 가치가 크게 떨어진다. 하지만 그렇다고 배터리 같은 부품이 노트북PC의 핵심은 아니란 것이다.따라서 애플이 판매금지를 이끌어내려면 문제가 된 604 특허권에서 주장한 기능 때문에 소비자들이 갤럭시 넥서스를 구매했다는 점을 입증해야 한다는 게 항소법원의 판결이다. 단순히 통합 검색 기능을 갖고 있다는 점만으론 상관 관계가 있다고 보기 힘들다는 것이다.◆항소법원, 본안 소송서 애플 승소 가능성도 낮게 본 듯미국에서는 판매금지 처분을 내릴 때 크게 네 가지 요건을 요구한다. 우선 ▲특허 소송 자체에서 승소할 가능성이 많으며 ▲판금 조치를 하지 않을 경우 회복하기 힘든 피해를 입을 가능성이 크고 ▲형평성 판단이 필요하며 ▲판금 조치가 공공의 이익에 부합해야 한다.앞에서 지적한 대로 항소법원은 판금 조치를 하지 않을 경우 회복하기 힘든 피해를 입을 것이란 애플의 주장을 받아들이지 않았다. 특히 특허 침해와 애플의 피해 간의 상관 관계가 그다지 크지 않다고 판단했다.하지만 항소법원의 이번 판결에서 관심을 끄는 것은 다른 부분이다. 특허 침해 소송 자체에서 애플이 승소할 가능성이 높지 않다고 판단한 것이다. 본안 소송을 앞둔 삼성 입장에선 상당히 고무적인 부분이 아닐 수 없다.이와 관련 특허 전문가인 플로리언 뮐러는 ""애플이 앞으로 시리 관련 604 특허권을 소송 대상에서 제외할 가능성도 있다""고 평가했다./김익현기자sini@inews24.com[관련기사]▶삼성, 갤럭시 넥서스 판금 항소심 이겼다"
119,2012-10-12,"""입영 피하자""…고의교통사고 신체손상(종합)",https://news.naver.com/main/read.nhn?mode=LSD&mid=shm&sid1=102&oid=001&aid=0005867863,연합뉴스,"'군입대 기피' 고의 교통사고 장면    (부산=연합뉴스) 부산 연제경찰서는 12일 고의 교통사고로 군입대를 기피한 혐의(병역법 위반)로 이모(22)씨와 고모(26)씨를 입건했다. 경찰은 이들이 교통사고 연습을 하며 촬영한 영상을 증거물로 확보했다. 영상을 캡처한 아래사진은 이씨가 연습을 끝내고 시속 50km 속도로 달려오는 차량에 실제로 부딪히는 장면이다.<<연제경찰서 제공>> 2012.10.12    ready@yna.co.kr부산경찰 2명 검거, 사고장면 촬영까지…충격 장면 '섬뜩'(부산=연합뉴스) 이종민 기자 = 현역입영을 기피할 목적으로 고의 교통사고를 내 신체를 손상한 2명이 경찰에 적발됐다.부산 연제경찰서는 12일 고의로 교통사고를 내 신체를 손상한 뒤 진단서를 병무청에 제출, 입대를 기피한 혐의(병역법 위반)로 이모(22)씨를 구속하고 공범 고모(26·다른 사건으로 구속중)씨를 입건했다.사회 선후배 사이인 이들은 이씨에게 현역 입영통지서가 나오자 입대를 기피할 목적으로 지난해 11월28일 오후 2시 부산 부산진구 전포동 공원길에서 고씨가 모는 검은색 SM5 차량에 이씨가 받히는 고의 교통사고를 냈다.이씨는 당시 사고로 좌측무릎관절염좌 등으로 치료가 필요하다는 진단서를 발급받아 같은달 30일 부산지방병무청에 제출, 공무를 방해하고 병역의무를 기피한 혐의를 받고 있다.경찰 조사결과 그동안 4차례 병역연기를 한 이씨는 더 이상 입영을 연기할 방법이 없자 고씨와 공모, 고의로 교통사고를 낸 것으로 드러났다.이들은 고의 교통사고를 내기 전에 사고를 연습하는 등 치밀하게 준비한 것으로 경찰조사에서 밝혀졌다.경찰은 이들이 교통사고를 연습한 뒤 당시 실제 사고를 내는 장면을 촬영한 영상을 증거물로 확보했다.이 영상은 사람의 눈에 잘 띄지 않는 도로에서 이씨가 시속 약 50km 속도로 달려오는 차량에 부딪혀 공중으로 떠올라 한바퀴 돈 뒤 땅바닥에 떨어지는 섬뜩한 장면을 담고 있다.'군입대 기피' 고의 교통사고 장면    (부산=연합뉴스) 부산 연제경찰서는 12일 고의 교통사고로 군입대를 기피한 혐의(병역법 위반)로 이모(22)씨와 고모(26)씨를 입건했다. 경찰은 이들이 교통사고 연습을 하며 촬영한 영상을 증거물로 확보했다. 영상을 캡처한 아래사진은 이씨가 연습을 끝내고 시속 50km 속도로 달려오는 차량에 실제로 부딪히는 장면이다.<<연제경찰서 제공>> 2012.10.12    ready@yna.co.kr이씨는 당시 고의로 낸 교통사고를 통해 병원에서 발급받은 진단서로 실제 입영연기 혜택을 받았다.그러나 묻힐뻔한 이 사건은 교통사고 장면을 촬영할 당시 옆에 있었던 친구들끼리 여자 문제가 불거지면서 앙심을 품은 한명이 영상을 병무청 게시판에 올리면서 꼬리가 잡혔다.ljm703@yna.co.kr[이 시각 많이 본 기사]☞국회 국정감사 계속..최필립 증인채택 공방☞김기덕 ""내 상의 51%는 김동호 명예위원장 것""☞대출 기준금리 오류에 무방비…""잘못돼도 안고쳐""(종합)☞<프로야구> '어게인 2010'…두산 ""있다"" vs 롯데 ""없다""☞美항소법원,삼성 갤럭시 넥서스 판금 원심파기(종합)<연합뉴스 모바일앱 다운받기><포토 매거진><저작권자(c)연합뉴스. 무단전재-재배포금지.>"
120,2012-10-12,"정부, 내년 세계지도 동해ㆍ독도표기 전수조사",https://news.naver.com/main/read.nhn?mode=LSD&mid=shm&sid1=100&oid=001&aid=0005867831,연합뉴스,"동해를'East Sea'로 표기한 이탈리아 지도제작사 'Zoffoli Geographia'의 지구본.(자료사진)(서울=연합뉴스) 강병철 기자 = 정부가 내년에 전 세계 주요 지도의 동해ㆍ독도 표기 현황을 전수조사한다.동해 표기에 대한 정부의 공식적인 전수조사는 2009년 이후 처음이다.정부 관계자는 12일 ""동해와 독도에 대한 정부 정책의 성과를 점검하고 앞으로의 대응 전략을 짜기 위해 전세계 지도에서의 표기 현황을 내년 중 전수조사할 예정""이라고 밝혔다.전수조사는 외교통상부가 재외공관을 통해 주요국의 지도를 입수해 분석하는 방식으로 진행된다.현재도 각 공관에서 주재국 지도의 표기 현황을 수시로 보고하고 있지만, 전수조사는 조사 대상과 기간을 특정해 집중적으로 이뤄지는 공식적인 조사라는 점에서 공관의 일상적인 점검과는 차이가 있다.전수조사의 주요 관심 대상은 개발도상국의 지도 제작에 직접적인 영향을 주는 미국, 영국, 프랑스, 이탈리아, 스페인 등에 소재한 지도제작사가 만든 지도다.동해와 독도를 한 번에 조사할지 별도로 조사할지는 아직 정해지지 않았다. 동해와 달리 독도는 섬 규모상 지명 자체가 표기가 안 된 지도가 많다는 이유에서다.정부는 동해의 경우에는 2007년과 2009년에 각각 전수조사를 한 바 있다.2009년 72개국 944건의 지도를 대상으로 한 조사에서는 동해를 단독 표기하거나 병기한 사례가 전체의 28.7%를 차지했다. 이는 75개국 353개 지도를 대상으로 한 2007년 조사(23.8%)보다 다소 증가한 수치다.일본 외무성이 2000년 실시한 조사에서 동해가 표기된 경우는 2.8%에 그쳤다.동해와 달리 독도는 이번이 첫 공식적인 조사다.정부는 2008년 미국 지명위원회의 독도 표기 파문시 전 세계 지도의 독도 표기 현황을 조사하고 오류를 시정하는 활동을 전개했다. 그러나 이는 각 공관이 자체적으로 주재국의 현황을 파악하고 대응하는 방식으로 이뤄졌다.내년 조사는 정부의 독도대책반이 중심이 돼 진행된다. 조사를 위한 별도 예산도 편성된 것으로 전해졌다.soleco@yna.co.kr[이 시각 많이 본 기사]☞국회 국정감사 계속..최필립 증인채택 공방☞김기덕 ""내 상의 51%는 김동호 명예위원장 것""☞대출 기준금리 오류에 무방비…""잘못돼도 안고쳐""(종합)☞<프로야구> '어게인 2010'…두산 ""있다"" vs 롯데 ""없다""☞美항소법원,삼성 갤럭시 넥서스 판금 원심파기(종합)<연합뉴스 모바일앱 다운받기><포토 매거진><저작권자(c)연합뉴스. 무단전재-재배포금지.>"
121,2012-10-12,대구 11번째 비극…‘학교폭력’에 고교생 또 자살,https://news.naver.com/main/read.nhn?mode=LSD&mid=shm&sid1=102&oid=028&aid=0002160376,한겨레,"[한겨레]여고생 투신…가해자 지목 ‘유서’하루전 시험성적 떨어져 고민도10달간 11명 자살에 교육청 곤혹“입시위주 경쟁교육 정책 바꿔야”대구에서 고교 1학년 여학생이 학교폭력과 성적 하락을 고민하다 아파트에서 뛰어내려 스스로 목숨을 끊었다. 지난해 12월 이후 성적 비관, 학교폭력, 가정 불화 등으로 고민하다 자살한 중고생은 대구에서만 11명째다.11일 새벽 4시43분께 대구 동구 아파트 앞 화단에 ㅇ(16)양이 숨져 있는 것을 경찰이 발견했다. ㅇ양은 숨지기 전 친구 이아무개(16)양에게 ‘꿋꿋하게 잘해라. 나는 간다’는 문자를 보냈다. 당시 경찰은 ㅇ양이 자살을 암시하는 문자를 보냈다는 신고를 받고 ㅇ양이 사는 아파트 주변을 수색하고 있었다.발견 당시 ㅇ양이 사는 아파트 7층 집의 방 창문은 열려 있었고, 방에서는 경찰과 부모, 여동생에게 보내는 유서 3통이 발견됐다. 공무원인 아버지는 <한겨레>와의 통화에서 “딸이 경찰 앞으로 남긴 유서에 같은 반 학생의 실명을 언급하며, ‘이것은 분명한 학교폭력이다. 내 앞에 꼭 무릎 꿇게 해달라’고 썼다”고 밝혔다. 유서에 구체적인 학교폭력 피해 내용을 담았는지는 아직 확인되지 않았다. ㅇ양은 목숨을 끊기 전 친구들에게 이별을 알리는 예약 문자도 보냈다.자율형 공립고인 ㄱ고교에 다녔던 ㅇ양은 자살하기 전날인 10일 시작된 중간고사를 치고 난 뒤 수학시험을 망쳐 많이 고민했다고 경찰은 밝혔다. ㅇ양은 수학시험을 친 뒤 “시험을 망쳤다”며 담임교사에게 하소연했고, 담임교사는 “내일 시험 과목을 잘 치면 된다”고 위로했다고 학교 관계자는 말했다.ㅇ양의 아버지는 “성적 말고도 학교폭력이 딸의 자살 이유라고 생각한다”고 말했다.경찰은 공무원 부모를 둔 ㅇ양이 아파트 자신의 방 창문 밖으로 몸을 던져 목숨을 끊은 것으로 보고 있다. 경찰은 ㅇ양의 학교폭력 언급이 단순한 교우관계에서 비롯된 것인지, 아니면 학교에서 실제로 괴롭힘이나 폭력을 당했는지 확인하기 위해 관련자들을 불러 수사할 방침이다.대구에서 학생이 또 스스로 목숨을 끊자, 학생 자살 재발 방지 대책을 강구해온 대구시교육청은 곤혹스러워했다. 학생 자살이 잇따르자 지난 6월 말 전국교직원노동조합과 학부모단체, 시민단체 등은 우동기 대구시교육감에게 입시 위주의 경쟁교육 정책을 바꿀 것을 요구하며 시위를 벌였다. 교육계에서는 경쟁적이고 억압적인 교육 풍토를 학생들의 잇따른 자살 원인 중 하나로 꼽고 있다.전형권 전교조 대구지부장은 “대구시교육청은 경기·전북·서울·강원 등과 달리 교육과학기술부의 경쟁교육 정책을 가장 충실히 따르는 곳”이라며 “기숙사를 건립해 공부 잘하는 애들을 학교에 묶어두고 좋은 대학 보내겠다는 식의 경쟁교육 정책으로는 이런 일이 반복될 수밖에 없다”고 말했다.   대구/김일우 기자cooly@hani.co.kr<한겨레 인기기사>■안철수 탐구…‘약자 배려’ 강조하면서도 늘 ‘성공’했다■돌아온 김무성, “부유세 신설” 외치며 복지확대 비난■회장 딸들 손 떼도…‘재벌 빵집’ 영업은 계속된다■주폭도 ‘무전유죄 유전무죄’■2년전 ‘의경 사망’ 충남기동대서 또 물의■올랑드 “초등학생 숙제 없앤다”■[화보]손연재, 나비처럼공식 SNS[통하니][트위터][미투데이]| 구독신청[한겨레신문][한겨레21]Copyrights ⓒ 한겨레신문사, 무단전재 및 재배포 금지<한겨레는 한국온라인신문협회(www.kona.or.kr)의 디지털뉴스이용규칙에 따른 저작권을 행사합니다.>"
122,2012-10-12,여야 `노무현-김정일 대화록' 국조충돌..안보공방,https://news.naver.com/main/read.nhn?mode=LSD&mid=shm&sid1=100&oid=001&aid=0005867804,연합뉴스,"노무현대통령과 김정일 국방위원장이 지난 2007년 평양 백화원 영빈관에서 열린 남북정상회담에 앞서 악수하고 있다.(자료사진)與 ""영토주권 포기의혹 밝혀야"" 野 ""명백한 허위사실 유포""전방위 검증공방속 朴-文 안보행보..安 재외국민과 대화(서울=연합뉴스) 심인성 박경준 기자 = 12월 대선이 68일 앞으로 다가온 가운데 지난 2007년 남북정상회담 당시의 이른바 `노무현-김정일 비공개 대화록'을 놓고 여야가 정면으로 충돌하고 있다.새누리당은 12일 고(故) 노무현 전 대통령이 북방한계선(NLL)을 주장하지 않겠다는 취지의 `영토주권 포기' 발언을 했다며 국정조사를 압박했고, 민주통합당은 새누리당의 의혹 제기를 `신(新)북풍공작'으로 규정하는 것은 물론 실정법 위반까지 거론하며 강력 반발했다.특히 여당의 이번 의혹 제기는 당시 청와대 비서실장이었던 민주당 문재인 후보를 정조준한 것이어서 여야간 공방은 상대 대선후보에 대한 전방위 검증과 맞물려 갈수록 격화될 전망이다.새누리당은 이날 비공개 대화록의 내용과 작성 경위, 당시 노 전 대통령의 `NLL 무효화 구두약속' 의혹 등에 대한 국회 차원의 진상조사를 요구하는 국조요구서를 공식 제출했다.이철우 원내대변인은 국회 브리핑에서 ""민주당은 대화록을 허위날조라고 뒤집어씌우지 말고 당당히 국조에 응하라""면서 ""문재인 후보는 영토주권에 대해 왜 꿀 먹은 벙어리인가. 국정조사 요구를 받아들이라는 지침을 내려야 한다""고 요구했다.그는 무소속 안철수 후보에 대해서도 ""NLL 논란과 노 전 대통령의 발언에 대한 입장을 밝혀야 한다""고 압박했다.이에 대해 민주당 박용진 대변인은 연합뉴스와의 통화에서 ""국조 요구에 대응할 것은 없다""고 일축한 뒤 ""있지도 않은 것을 있는 것처럼 얘기한 것은 심각한 허위사실 유포이고 더욱이 정상회담의 대화록을 유출했다는 것은 대통령기록물 관리법 위반이라 검찰수사를 촉구해야 할 상황""이라고 말했다.그는 특히 ""처음 의혹을 제기한 새누리당 정문헌 의원의 경우 형사처벌 대상""이라고 강조했다.새누리, 대북문제 관련 국정조사요구서 제출    (서울=연합뉴스) 백승렬 기자 = 새누리당 이철우 정문헌 김기현 신의진 의원이 12일 국회 의안과서 남북 비밀정상회담 등에 대한 `민주당 정부의 영토주권 포기 등 진사규명을 위한 국정조사 요구서'를 제출하고 있다. 2012. 10. 12    srbaek@yna.co.kr여야의 이 같은 날선 공방 속에 새누리당 박근혜 후보와 민주당 문재인 후보는 `안보행보'를 보였다.박 후보는 이날 오후 잠실 올림픽공원에서 열리는 월남전 참전 제48주년 기념식에 참석하며, 문 후보는 오전 평택 해군 2함대를 방문해 부대현황을 청취한 뒤 제2연평해전 전적비로 이동, 참배한다.안 후보는 오전 공평동 선거캠프에서 재외국민과의 화상 타운홀 미팅 행사를 갖는다.sims@yna.co.krkjpark@yna.co.kr[이 시각 많이 본 기사]☞국회 국정감사 계속..최필립 증인채택 공방☞김기덕 ""내 상의 51%는 김동호 명예위원장 것""☞대출 기준금리 오류에 무방비…""잘못돼도 안고쳐""(종합)☞<프로야구> '어게인 2010'…두산 ""있다"" vs 롯데 ""없다""☞美항소법원,삼성 갤럭시 넥서스 판금 원심파기(종합)<연합뉴스 모바일앱 다운받기><포토 매거진><저작권자(c)연합뉴스. 무단전재-재배포금지.>"
123,2012-10-12,"롯데제과, 비스킷·초콜릿 가격 9.4% 인상",https://news.naver.com/main/read.nhn?mode=LSD&mid=shm&sid1=101&oid=031&aid=0000273897,아이뉴스24,"<아이뉴스24>[정은미기자] 롯데제과는 이달 중으로 14개 제품의 출고가격과 중량을 조정한다고 12일 밝혔다.출고가격을 인상하는 제품은 카스타드(7.1%), 마가렛트(2.9%) 등 11개이며, 쌀로별(3.2%) 등 3개 제품은 중량을 줄여 중량당 가격이 인상된다.평균 인상률은 대형마트 기준으로 9.4%다.가격인상 품목은 비스킷, 초콜릿 등 원가압박이 심한 품목을 중심으로 진행되며, 거래처와의 협의를 통해 이달 중으로 인상할 계획이라고 회사측은 설명했다.롯데제과 관계자는 ""이번 인상은 각종 원부자재 가격과 판매관리비 급등으로 올해 상반기 영업이익이 전년대비 28.1% 떨어지는 등 그 동안 누적되어온 원가상승 압박을 더 이상 견디기 힘들다는 판단에서 내린 결정""이라면서 ""이들 제품이 전체 제품에서 차지하는 매출 비중을 고려했을 때 가격 인상효과는 2.4% 수준""이라고 설명했다./정은미기자indiun@inews24.com[관련기사]▶위스키 윈저, 5.5% 가격인상"
