,날짜,기사 제목,기사 링크,기사 출처,기사 내용
84,2012-10-12,'NLL 대화록' 대선변수 부상...정책경쟁 본격화,https://news.naver.com/main/read.nhn?mode=LSD&mid=shm&sid1=100&oid=052&aid=0000427850,YTN,"[앵커멘트]대선이 60여일 앞으로 다가온 가운데 지난 2007년 남북 정상회담에서 비공개 대화의 내용을 놓고 여야의 공방이 거세지고 있습니다.새누리당은 국정조사 요구서를 제출했고, 민주통합당 문재인 대선 후보는 비밀 회담이 사실이라면 자신이 책임을 지겠다고 밝혔습니다.대선후보들은 오늘도 활발한 민생과 정책 행보를 이어가고 있습니다.국회 취재 기자 연결합니다.  박홍구 기자!먼저, 비밀 회의록 관련해 여야의 공방이 뜨거운데, 새누리당이 국정조사 요구서를 제출했죠?[중계 리포트]새누리당은 지난 2007년 남북 정상회담에서 고 노무현 전 대통령이 북방한계선, NLL 포기 발언을 했다는 논란과 관련해 국정조사요구서를 국회에 제출했습니다.새누리당은 대화록 내용과 작성 경위, 당시 노 전 대통령의 'NLL 무효화 구두 약속' 의혹 등에 대한 국회 차원의 조사를 요구했습니다.이철우 원내대변인은 브리핑을 통해 민주통합당은 이번 사안을 허위날조라고 뒤집어 씌울게 아니라 당당하게 국정조사를 받아들여 의혹을 규명하라고 압박했습니다.이에 대해 민주당은 새누리당의 국정조사 요구 주장을 수준낮은 색깔론이라고 일축하며 거부 의사를 분명히 했습니다.민주당 박용진 대변인은 브리핑에서 있지도 않은 것을 있는 것처럼 얘기한 것은 허위사실 유포이고 정상회담의 대화록을 유출했다는 것은 대통령기록물 관리법 위반이라고 주장했습니다.박 대변인은 특히 의혹을 처음 제기한 정문헌 의원에 대해 면책 특권 뒤에 숨어 비겁한 정치적 태도를 보이고 있다고 비판했습니다.[질문]민주통합당이 당 차원의 대응을 하고 있지만 문재인 대선 후보도 입장을 밝혔죠?[답변]지난 2007년 당시 대통령 비서실장이었던 문재인 후보는 비밀 대화록 의혹은 전혀 사실이 아니라며, 사실이라면 자신이 책임을 지겠다고 밝혔습니다.문재인 후보는 오늘 오전 경기도 평택 해군 제2함대를 방문한 자리에서 기자들과 만나 이같이 말했습니다.문 후보는 당시 발언 내용이 사실이라면 자신이 고 노무현 전 대통령을 대신해 사과하고 그 토대 위에서 국민들에게 평가받겠다고 말했습니다.하지만 사실이 아니라면 정문헌 의원과 새누리당, 그리고 박근혜 대선후보가 책임을 져야 할 것이라고 지적했습니다.문 후보는 두 정상만의 비밀회담이 없었기 때문에 녹취록이나 비밀대화록도 존재하지 않는다고 강조했습니다.문재인 후보는 오후엔 윤광웅 전 국방장관 등이 참석한 가운데 국방안보 간담회를 열어 국방정책 구상을 발표했습니다.문 후보는 이 자리에서 군 복무 기간을 18개월로 단축하고 2015년 전시작전통제권 전환을 차질 없이 추진하겠다고 약속했습니다.문 후보의 발언 잠시 들어보시겠습니다.[녹취:문재인, 민주당 대선후보]""안보 없이는 나라도 존재할 수 없습니다. 특히 북한의 군사적 위협과 주변 강대국들의 치열한 경쟁의 틈바구니에서 국익을 보호하고...""[질문]새누리당 박근혜 대선후보는 오전에 중앙선대위 회의를 열었죠?[답변]새누리당 중앙선거대책위원회는 오늘 오전 당사에서 첫 회의를 열고 대선 체제를 본격적으로 가동했습니다.박근혜 후보는 오늘 회의에서 갈등을 넘어 화합하는 선대위를 만들어 대선에서 승리하고, 100% 대한민국을 건설하는데 혼신의 힘을 다하자고 말했습니다.박근혜 후보의 말입니다.[녹취:박근혜, 새누리당 대선후보]""이젠 더 이상의 어떤 갈등을 넘어서 화합된 모습으로 국민을 위한 아름다운 선대위의 모습으로 이번 선거를 꼭 승리하도록 모두 힘을 모아주시길 바랍니다.""중앙선대위가 본격 가동됨에 따라 새누리당은 12월 대선까지 선대위 중심으로 운영되고, 선대위는 각종 공약과 선거 전략 개발, 후보 일정 등 대선 캠페인 전반을 총괄하게 됩니다.이런 가운데 박근혜 대선후보는 노무현 전 대통령의 NLL 발언 논란에 대해 관계자들이 관련된 사항에 사항을 명백하게 밝힐 필요가 있다고 말했습니다.[질문]무소속 안철수 후보 캠프는 경제민주화 정책을 발표했다고요?[답변]안철수 후보 캠프는 대기업 개혁 정책과 관련해 대통령 직속의 재벌개혁위원회를 설치하겠다고 밝혔습니다.안 후보 캠프에서 경제민주화 분야를 맡고 있는 홍익대 전성인 교수는 오늘 서울 공평동 캠프 사무실에서 브리핑을 열어 재벌의 영향력이 심화되고 있으나, 재벌정책을 총괄하는 사령탑이 없어 효과적인 대응이 미흡하다며 이같은 방안을 제시했습니다.이 재벌개혁위원회를 통해 종합적이고 체계적인 재벌개혁을 추진하겠다는 계획입니다.안철수 후보도 오전에 있었던 타운홀 미팅에서 대기업의 책임과 처벌을 강조하는 발언을 했습니다.안 후보의 말입니다.[녹취:안철수, 무소속 대선후보]""대기업 스스로도 사회적 책임 의식을 갖고 책임을 다하는 기업집단으로 거듭 나야된다고 생각하고, 인센티브라든지 또는 그것을 어겼을 때 법률적으로 제재를 가하는 문제 등 종합적으로 검토돼야 하는게 큰 방향이라고 생각합니다.""안철수 후보는 어전엔 캠프 사무실에서 타운홀 미팅을 열어 인터넷으로 미국과 노르웨이, 말레이시아 등에 살고 있는 재외동포들과 만났습니다.안 후보는 격의없는 대화를 통해 현지생활의 어려움을 듣기도 하고, 정책 관련 토론도 벌이며 지지세 확산에 주력했습니다.지금까지 국회에서 YTN 박홍구입니다.[관련기사]▶ 'NLL 대화록' 대선변수 부상...정책경쟁 본격화▶ 김용준 전 헌재소장 영입...'무소속 대통령' 논쟁 가열▶ 선대위 인선 발표·독자 경제행보 이어가 [이종훈, 정치평론가]▶ 문재인 후보 ""민주당 후보로 단일화해야 승리 보장""▶ 안철수 후보, ""무소속 대통령, 국회 존중하며 설득 가능""☞ [다운로드] 생방송과 뉴스속보를 한 눈에...YTN뉴스ON☞ YTN 긴급속보를 SMS로!☞ 스마트폰으로 즐기는 24시간 뉴스의 세계...YTN 어플리케이션[저작권자(c) YTN & Digital YTN. 무단 전재-재배포 금지]"
85,2012-10-12,‘하루에 한 달 요금’…아이폰 사용자들이 화났다,https://news.naver.com/main/read.nhn?mode=LSD&mid=shm&sid1=105&oid=032&aid=0002260811,경향신문,"‘데이터 사용 현황’ 메시지.아이폰 사용자 한모씨(31·회사원)는 며칠 전 통신사 고객센터로부터 황당한 문자메시지를 받았다. ‘11일 09시부터 12일 02시까지 3만원어치의 데이터를 초과 사용했다’는 내용이었다. 이뿐만이 아니었다. 이튿날엔 또다시 ‘1만원의 데이터를 초과 사용했다’는 문자메시지를 받았다. 2년 넘게 i-라이트 요금제(4만5000원)를 사용 중인 한씨는 “하루 사이에 한 달 정액요금에 맞먹는 사용료가 나온 셈”이라며 “요금도 불만이지만, 데이터를 과도하게 사용한 적이 없을 뿐더러 그 내역을 확인할 수도 없어 답답할 뿐”이라고 말했다.최근 iOS6으로 업그레이드한 아이폰과 아이패드 사용자들 중 ‘요금 폭탄’을 맞는 사례가 잇따르고 있다. 12일 KT와 SKT 측에 따르면 최근 데이터 요금을 부과 받은 아이폰과 아이패드 사용자들의 항의전화가 급증하고 있다. 이들은 iOS6로 업그레이드한 애플 기기 사용자로, 데이터 무제한 요금제에는 가입하지 않은 고객들이다.이들에게는 한씨의 사례처럼 시간당 평균 1만원씩 데이터 요금이 부과되고 있다. 적절한 조치를 취하지 않을 경우 많게는 하루 이틀 사이에 10만원 이상이 청구되기도 한다. 문제의 원인으로는 애플의 ‘팟캐스트’ 앱이 지목되고 있다. 음악 앱의 기능이었던 팟캐스트는 iOS6로 업그레이드되면서 서비스 방법이 바뀌었다.데이터 사용은 새 팟캐스트에서 스트리밍이나 다운로드 방송을 들을 때 발생한다. 팟캐스트 앱을 사용할 경우 처음엔 와이파이로 접속하다 30분이 경과하면 자동으로 3G 데이터망으로 접속하게 된다. 사용자들은 와이파이 상태로 접속한 것으로 알지만 실제로는 3G망을 사용하게 되면서 추가로 요금이 청구되는 것이다.문제를 해결하기 위해서는 팟캐스트 설정에서 자동 다운로드 항목을 해제해야 한다. 예컨대 ‘설정’ 내 ‘일반’에서 셀룰러 데이터 사용을 차단하거나 팟캐스트 앱을 삭제하는 것이다.이처럼 사전에 요금 폭탄을 피할 방법이 있는데도 통신사와 애플코리아 측은 정보 제공에 미온적이다. 과도한 데이터 요금에 대한 문의전화가 잇따르고 있지만 제대로 된 해결방법을 설명해주지 않는 것이다. 아이폰 사용자 변모씨(43)는 “KT 상담원에게 ‘도대체 시간당 1만원의 이용료가 나온 이유가 뭐냐’고 묻자 그저 ‘사용자가 모르는 앱이 작동 중일 수 있다’고만 답했다”며 “셀룰러 데이터 사용을 ‘켬’에서 ‘꺼짐’으로 바꿔야 한다는 등의 기본적인 정보는 알려주지 않았다”고 불만을 터뜨렸다.<디지털뉴스팀>경향신문 ‘오늘의 핫뉴스’▶ [단독]“性상납하면 정규직” 女주차단속원을 울린 공무원들▶ “정수장학회 언론사 주식 비밀 매각 계획”▶ B형에게 A형 피를… 황당한 적십자 혈액원▶ ‘하루에 한 달 요금’…아이폰 사용자들이 화났다, 왜▶ 가족과 떠난 여행, 물속에 200만원짜리 금이…모바일 경향[경향 뉴스진(News Zine) 출시!]| 공식 SNS 계정[경향 트위터][미투데이][페이스북][세상과 경향의 소통 Khross]- ⓒ 경향신문(www.khan.co.kr), 무단전재 및 재배포 금지〈경향신문은 한국온라인신문협회(www.kona.or.kr)의 디지털뉴스이용규칙에 따른 저작권을 행사합니다.〉"
86,2012-10-12,김장비용 아끼려면 '金배추' 기간을 피해라,https://news.naver.com/main/read.nhn?mode=LSD&mid=shm&sid1=101&oid=008&aid=0002927835,머니투데이,"[머니투데이 배소진 기자][가을배추 본격출하되는 11월하순 이후 배추값 안정세 전망…""김장 1~2주 미뤄라""]벌써부터 김장비용이 들썩이는 가운데 조금이나마 저렴하게 김장을 하려면 11월 말 이후가 적절할 것으로 보인다. 본격적인 김장시기보다 10~15일 가량 늦게 배추 값이 안정세에 접어들 것으로 전망됐기 때문이다.우리나라 1년 배추소비량은 평균 220만톤 가량이다. 이 중 김장철에 소비되는 양이 130만톤에 이를 만큼 김장배추 수급은 정부도 촉각을 곤두세우는 민감한 문제다.보통 김장용 가을배추는 전남 해남, 충남 당진 등 중부지방에서 재배하는 물량이 주가 되며, 김장철을 앞둔 11월 초 출하되기 시작한다.하지만 올해 이 지역은 태풍피해로 인해 배추 정식(파종)시기가 예년보다 1~2주가량 미뤄졌다. 생육도 예년보다 늦어져 본격적인 출하는 11월 하순 이후가 될 것으로 예측되고 있다.일반적으로 김장철이 11월 초순 시작돼 중순에 가장 몰리는 것을 감안하면 약 10~15일의 '금(金)배추' 기간이 발생하는 것이다.특히 올해는 배추값 오름세가 꾸준히 예견돼 왔다. 지난여름 폭염과 태풍피해를 번갈아 입으면서 고랭지배추가격이 폭등했기 때문. 게다가 지난해 김장시기에 배추가격 폭락으로 '성난' 농민들이 재배면적을 줄이는 바람에 가을겨울 배추생산량은 평년에 미치지 못할 것으로 예상되고 있다.실제로 충남 당진의 경우, 올해 배추 재배면적은 410헥타르(ha)로 지난해 517ha에 비해 80% 수준이다. 생산량 역시 지난해 5만6595톤에 비해 올해는 3만9421여톤에 그치는 것으로 추정되고 있다.이에 따라 이미 유통가 등을 중심으로 김장비용 우려도 나타나고 있는 상황이다.지난 9일 이마트는 매장 소매가 기준으로 4인 가족 평균 김장규모인 배추 20포기로 김장을 할 경우 총 비용은 30만5690원으로, 지난해 같은 기간보다 20.6%나 오를 것이라고 집계했다.배추가격의 경우에는 20포기 7만5600원으로 지난해 2배가 넘을 것으로 보인다는 것. 무 10개 가격 역시 지난해 비해 50%넘게 상승한 것으로 나타났다.이에 대해 재정부 고위 관계자는 ""전체적으로 김장시기를 1~2주가량 미루기만 하면 11월 말 이후에는 배추공급이 본격적으로 이뤄진다""며 ""그 때부터는 배추 값이 지금보다 상당히 떨어질 것""이라고 설명했다.김장용 배추를 선주문 받는 대형유통마트 측이 '11월 하순 이후로 김장시기를 잡으면 지금보다 배추값이 떨어진다'는 점을 소비자들에게 전달할 필요가 있다는 점도 당부했다.이 외에도 정부는 단기적인 공급부족에 대비해 다각도로 대응방안을 마련하겠다는 입장이다.우선 농협 계약재배물량을 적극 활용하면서 이달 말쯤 강원도 지역 준고랭지 배추를 비축했다가 김장철에 내놓는 방안을 검토하고 있다. 농촌진흥청에서는 27개 주산지에 '현장기술지원단'을 운영하며 생육촉진 등 재배기술 지도에 힘을 쏟는다.또 오는 15일 물가관계장관회의에 '김장채소 수급안정 방안'을 상정해 물가안정정책에 적극 반영할 계획이다.신제윤 기획재정부 제1차관은 이날 충남 당진 김장채소 재배지를 방문한 자리에서 ""(출하기시와 김장시기가) 미스매치 되면서 가격급등이 우려된다""며 ""김장에 차질이 없도록 하면서도 농가손해가 없도록 양쪽을 잘 조율해야 할 것""이라고 말했다.[머니투데이 핫뉴스]☞""애니팡 바뀐다, 친구에게 하트 대신…""☞""10년 동거했는데…"" 사실혼 부인 '충격!'☞싸이, 라면CF 영상 제안… 농심 ""감동, OK""☞박찬호 '신사동' 빌딩 임대수입, 연봉보다 ""헉!""☞확바뀐 '뉴SM5' 내달 출시, ""누구냐 넌?""배소진기자 sojinb@<저작권자 ⓒ '돈이 보이는 리얼타임 뉴스' 머니투데이, 무단전재 및 재배포 금지>"
87,2012-10-12,내곡동 특검팀 구성 완료..다음주부터 본격 수사,https://news.naver.com/main/read.nhn?mode=LSD&mid=shm&sid1=100&oid=018&aid=0002670633,이데일리,"[이데일리 피용익 기자] 이명박 대통령 가족의 내곡동 사저부지 매입 의혹을 수사할 특별검사팀 구성이 완료돼 오는 16일부터 본격 수사에 나선다.이 대통령은 12일 이광범 특별검사가 요청한 특별검사보 후보자 6명 가운데 판사 출신 이창훈(사법연수원 16기) 변호사와 검찰 출신 이석수(18기) 변호사를 임명했다.이창훈 특검보는 1960년생으로 고려대 법대를 나와 서울남부지법·서울민사지법 판사를 거쳐 법무법인 산지에서 변호사로 일하고 있다. 이 특검보는 참여정부 시절 철도공사의 러시아 유전 개발 투자의혹 사건의 특검보를 맡은 경력이 있다.이석수 특검보는 1963년에 태어나 서울대 법대를 졸업했다. 대검 검찰연구관, 대검 감찰과장, 통영지청장, 춘천지검 차장, 전주지검 차장검사 등을 지냈다. 현재는 법무법인 승재에 속해 있다. 2008년 새누리당(당시 한나라당) 전당대회 당시 돈봉투를 고승덕 의원에게 전달한 혐의로 기소돼 1심에서 집행유예를 선고받은 김효재 전 청와대 정무수석비서관을 최근 변호했다.내곡동 특검팀에는 검찰에서도 이헌상 서울중앙지검 조사부장과 강지성, 고형곤, 서인선, 최지석 검사 등이 파견된 것으로 알려졌다. 특히 여성인 서 검사가 포함된 것은 이 대통령의 부인 김윤옥 여사 소환 가능성을 배제할 수 없다는 뜻으로 해석돼 주목된다.특검의 수사 대상은 내곡동 사저 부지를 매입하는 과정에서 불거진 배임과 부동산 관련법 위반 의혹이다.이 대통령의 아들 시형 씨와 청와대 경호처는 사저 부지 463m²와 경호건물 터 2143m²를 54억원에 매입하는 과정에서 시형 씨에게는 시세보다 적은 땅값을 내게 하고 경호건물 땅값은 비싸게 치러 국가에 손해를 끼쳤다는 의혹을 받고 있다. 특검은 시형씨 명의로 된 지분에 비해 국가 소유 지분을 비싸게 사들였다는 배임 의혹을 파헤칠 예정이다. 또 사저 부지를 시형씨 명의로 사들여 부동산 실명제법을 어겼다는 혐의도 수사한다.특검은 수사 개시일로부터 30일 이내에 수사를 마치고 공소 제기 여부를 결정해야 한다. 1회에 한해 15일 연장도 가능하다. 대선을 한 달여 앞둔 11월 중순에는 특검 수사 결과가 나올 수 있다는 의미다.특검팀 사무실은 서울 서초동 법원청사 인근에 마련됐으며 오는 15일 공식 개청 행사를 갖는다.피용익 (yoniki@edaily.co.kr)"
88,2012-10-12,"안철수 ""대통령직속 재벌개혁위 설치""(종합2보)",https://news.naver.com/main/read.nhn?mode=LSD&mid=shm&sid1=100&oid=001&aid=0005868845,연합뉴스,"안철수와 함께하는 미래비전    (서울=연합뉴스) 이정훈 기자 = 무소속 안철수 대선 후보가 12일 오전 서울 공평빌딩 선거캠프에서 열린 재외국민과의 타운홀 미팅에서 국외거주 국민들과 화상대화를 하며 정책과 비전을 제시하고 있다.  2012.10.12    uwg806@yna.co.kr집권 1년 내 재벌개혁법령 정비..매년 국민보고회(서울=연합뉴스) 강영두 이광빈 기자 = 무소속 안철수 대선 후보는 12일 재벌 개혁을 위해 대통령 직속 재벌개혁위원회를 설치해 추진력을 담보하기로 했다.안 후보 측 `경제민주화포럼' 간사인 전성인 홍익대 교수는 12일 공평동 선거캠프에서 가진 정책발표회에서 ""재벌의 영향력이 심화되고 있으나 재벌정책을 총괄하는 사령탑이 없어 효과적인 대응이 미흡하다고 판단했다""며 이같이 밝혔다.재벌개혁위원회는 각 부처에 산재된 재벌 관련 정책을 총괄ㆍ조정하고, 관련 부처에 정책 집행을 요청하며 입법을 권고하는 `컨트롤 타워' 역할을 맡도록 했다.안 후보는 특히 개별 기업의 행위 규제 외에 필요한 경우 기업집단의 구조개혁도 검토키로 했다.위원회는 기획재정부 장관, 지식경제부 장관, 공정거래위원장, 금융위원장 등 정부위원과 대통령이 위촉하는 전문가인 민간위원들로 구성하고, 위원장은 독립성 확보를 위해 민간인으로 위촉키로 했다.안 후보는 집권 1년 내에 재벌개혁 관련 법령을 정비하고 매년 국민보고회를 갖기로 했다.전 교수는 ""재벌 개혁의 성공을 위해서는 `무엇을 할 것인가'보다 `진정으로 추진할 것인가'가 중요하다""며 ""위원회를 청와대에 두고 대통령이 수시로 점검하겠다""고 말했다.유민영 대변인은 논평에서 4대강 사업 담합 사건에 대한 공정위의 `솜방망이' 처벌에 언급, ""4대강 사업 담합 비리로 재벌 개혁이라는 막중한 책임을 맡고 있는 공정위의 한계가 명백히 드러났다""며 종합적인 대응을 위한 재벌개혁위 설치 필요성을 강조했다.안 후보는 오는 14일 대선 쟁점인 경제민주화 정책 공약을 발표한다.k0279@yna.co.krlkbin@yna.co.kr[이 시각 많이 본 기사]☞문재인 ""정문헌 발언 사실이면 책임지겠다""(종합)☞케이윌 '이러지마 제발' 음원차트 석권☞국회 국정감사 계속..최필립 증인채택 공방☞<프로야구> '어게인 2010'…두산 ""있다"" vs 롯데 ""없다""☞`노크 귀순' 현장국감 실시..軍, 재발방지 다짐<연합뉴스 모바일앱 다운받기><포토 매거진><저작권자(c)연합뉴스. 무단전재-재배포금지.>"
89,2012-10-12,`의무휴업 취소하라' 항소심도 대형마트 승소(종합),https://news.naver.com/main/read.nhn?mode=LSD&mid=shm&sid1=102&oid=001&aid=0005868632,연합뉴스,"행정1부(고의영부장판사)는 12일 롯데쇼핑, 이마트, 에브리데이리테일, GS리테일, 홈플러스가 ""지자체 조례로 정한 영업시간 제한 등 처분을 취소하라""며 서울 강동구를 상대로 낸 소송의 항소심에서 1심과 같이 원고 승소 판결했다. 사진은 주말에 영업하는 한 대형마트 모습.(자료사진)(서울=연합뉴스) 이상현 기자 = 서울고법 행정1부(고의영 부장판사)는 12일 롯데쇼핑, 이마트, 에브리데이리테일, GS리테일, 홈플러스가 ""지자체 조례로 정한 영업시간 제한 등 처분을 취소하라""며 서울 강동구를 상대로 낸 소송의 항소심에서 1심과 같이 원고 승소 판결했다.재판부는 ""유통산업발전법은 영업시간 제한이나 의무휴업일 지정의 시행여부, 방법에 대한 재량권을 지방자치단체장에게 부여하고 있다""고 전제했다.재판부는 이어 ""지방의회는 법이 정한 기준에 따라 조례로 영업 제한과 관련한 세부적인 절차와 방법, 기준을 정함으로써 지자체장의 권한 행사를 견제할 수는 있지만 재량권 행사 자체를 차단할 수는 없다""며 ""조례가 위법한 만큼 이를 근거로 하는 구청의 처분 또한 위법하다""고 판단했다.앞서 강동구 의회는 지난 3월6일 관내 대형마트·기업형슈퍼마켓(SSM)의 영업시간을 제한하고 매달 둘째·넷째 주 일요일을 의무휴업일로 지정하는 내용의 조례를 의결했으며, 구청은 같은 달 26일 이를 공포했다.이후 구청이 관내 4개 대형마트와 16개 기업형슈퍼마켓에 조례 규정 사항의 준수에 차질이 없도록 해달라는 공문을 보내자 이에 불복한 대형마트 등이 소송을 냈다.1심 재판부는 지난 6월 ""해당 조례는 지자체장의 판단 재량을 박탈해 위법하다""며 원고 승소 판결했다.hapyry@yna.co.kr[이 시각 많이 본 기사]☞`노크 귀순' 현장국감 실시..軍, 재발방지 다짐☞케이윌 '이러지마 제발' 음원차트 석권☞국회 국정감사 계속..최필립 증인채택 공방☞<프로야구> '어게인 2010'…두산 ""있다"" vs 롯데 ""없다""☞대출 기준금리 오류에 무방비…""잘못돼도 안고쳐""(종합)<연합뉴스 모바일앱 다운받기><포토 매거진><저작권자(c)연합뉴스. 무단전재-재배포금지.>"
