,날짜,기사 제목,기사 링크,기사 출처,기사 내용
27,2013-04-12,살아있었구나! 한국표범 ‘발도장 쾅’,https://news.naver.com/main/read.nhn?mode=LSD&mid=shm&sid1=102&oid=028&aid=0002183574,한겨레,"[한겨레]원주 섬강변서 발자국 발견국립 생물자원관 전문가“표범 발자국 100% 확실”1962년 이후 첫 생존 증거“국내 5마리 이상 있을 것”수십년 전 남한에서 사라진 것으로 알려진 한국 표범이 살아있음을 보여주는 유력한 발자국 증거가 발견됐다. 야생동물 전문조사원 김대호(40)씨는 “10일 오전 강원도 원주의 한 습지에서 양서·파충류 조사를 하던 중 대형 포유동물이 남긴 것으로 보이는 발자국 30여개를 발견했다. 환경부 국립생물자원관에 감식을 의뢰한 결과 표범의 발자국으로 확인됐다”고 11일 말했다.학술적으로 극동표범(아무르표범)에 속하는 한국 표범은 1900년대 초반까지는 남한에서 한 해 100여마리가 포획될 정도로 많이 서식했으나, 일제강점기에 일제가 유해동물 퇴치를 명분으로 집중 사냥에 나선 것을 계기로 개체수가 크게 줄어 남한에서는 멸종된 것으로 알려져 있다.이 발자국들을 감식한 대형 포유동물 전문가 한상훈 국립생물자원관 동물자원과장은 “보폭 50㎝, 발자국 너비 8㎝에 발가락이 방사 형태로 나 있고, 모래에 체중이 실려 깊게 파였는데도 발톱 흔적이 전혀 없는 등 대형 고양이과 동물 발자국의 전형적인 특징을 보이고 있다. 크기와 보폭으로 보아 표범 발자국이 100% 확실하다”고 말했다. 그는 “고양이과의 야생동물 중 흔히 발견되는 삵은 아무리 커도 발자국 너비는 4㎝, 체중은 5㎏을 넘지 않는다. 이런 족적을 남길 수 있는 고양이과 야생동물은 표범밖에 없다”고 덧붙였다.국립생물자원관은 이번에 발견된 발자국의 크기와 깊이, 상태 등으로 미뤄 발자국의 주인공은 체중 50㎏ 안팎의 표범 성체이며, 9일 심야에서 10일 새벽 사이 섬강 강변을 따라 북쪽에서 동쪽 치악산 방향으로 이동한 것으로 추정했다.야생 한국 표범은 1962년 경남 합천 오도산에서 생포된 개체를 마지막으로 현재까지 실체가 확인되지는 않고 있다. 그 뒤로 최근까지 강원도 비무장지대와 백두대간, 지리산, 가야산 주변에서 표범을 봤다는 주민과 등반객의 목격담은 더러 있으나, 표범과 비슷하게 생긴 삵을 잘못 본 것일 수도 있어 크게 신뢰하기는 어려운 상태다.한상훈 과장은 “지금까지 나온 표범 목격담 가운데 신뢰성이 높은 것들로 미뤄볼 때, 우리나라의 자연에는 아직 다섯마리 이상의 표범이 생존해 있는 것으로 추정되지만, 그 실체가 확인되지는 않고 있다. 이번 발자국 발견을 계기로 특히 주민들의 표범 목격담이 많은 가야산 일대에 야생동물 무인카메라를 확충해 실체를 촬영할 수 있도록 하겠다”고 말했다.김정수 선임기자jsk21@hani.co.kr<한겨레 인기기사>■국정원 취재 100일 ‘보이지 않는 손’ 내내 발목 잡다■서울 한복판서 60대 남성 권총 자살■‘1등 남편’ 칭찬 말고 집안일 좀 나눠 하자■‘꽃샘추위’ 지나간 주말, ‘벚꽃라이딩’ 이곳으로■미 신문, 한국식 양념치킨 소개 “묘한 중독성”공식 SNS[통하니][트위터][미투데이]| 구독신청[한겨레신문][한겨레21]Copyrights ⓒ 한겨레신문사, 무단전재 및 재배포 금지<한겨레는 한국온라인신문협회(www.kona.or.kr)의 디지털뉴스이용규칙에 따른 저작권을 행사합니다.>"
28,2013-04-12,사상 최대규모 태양 폭발의 순간,https://news.naver.com/main/read.nhn?mode=LSD&mid=shm&sid1=105&oid=092&aid=0002020910,ZDNet Korea,"역대 최대 규모의 태양 폭발 순간이 포착돼 공개됐다.씨넷은 11일(현지시간) 미국 동부기준 오후 3시경 일어난 사상 최대 규모의 태양 폭발 순간 사진을 공개했다. 당시 초당 600마일(965킬로미터) 규모로 수십억개 태양 입자가 뿜어져나왔다.NASA는 최대 태양 분화로 인해 지구에 대규모 태양복사열 폭풍이 전망된다고 경고했다. 태양폭풍이 지구로 불어올 경우 순간적으로 전면적인 통신장애가 일어날 수 있다.▲ 지난 11일 일어난 태양 흑점 폭발 순간태양 흑점이 폭발하면 X선, 고에너지 입자(양성자), 코로나물질 등이 방출돼 지구에 수분에서 수일 후에 도달하게 되는데, 이때 지구의 전리층 교란으로 단파방송이나 통신이 일시적으로 두절될 수 있다.또한 지구자기장이 교란돼 순간적으로 전력망의 변압기·송전선 등에 유도전류가 발생해 변압기가 파손되면 지역적인 정전 등도 발생 가능하다. 북극항로를 운항하는 항공기 승객들의 방사선 노출 등의 문제가 발생해 항로를 우회해야 하는 경우가 발생할 수 있다.올해는 태양이 가장 활발히 폭발을 일으키는 한해일 것으로 보인다. 천문학자들은 태양의 11년 활동주기와 연관돼 있고, 더 심한 태양 폭발이 올해말 예상된다고 전망했다.[이 시각 주요기사]☞삼성 갤럭시 메가 6.3인치·5.8인치 전격 공개☞홈쇼핑 이용하면 금융사에서 전화오는 이유☞무제한 통화 3사 비교…유리한 곳은?☞LG 스마트TV, 삼성 잡을 비장의 무기는?☞애플, 팜 특허 무시하더니..1천만불 물어야김우용 기자 (yong2@zdnet.co.kr)▶ IT 세상을 바꾸는 힘 <지디넷코리아>▶ IT뉴스는<지디넷코리아>, 게임트렌드는<게임스팟코리아>▶ 스마트폰으로 읽는 실시간 IT뉴스<모바일지디넷>[저작권자ⓒ메가뉴스 & ZDNet & CNET. 무단전재 및 재배포 금지]"
29,2013-04-12,갤럭시S4에 무선충전 기능…자기유도 방식,https://news.naver.com/main/read.nhn?mode=LSD&mid=shm&sid1=105&oid=001&aid=0006200110,연합뉴스,"독자추진 공진방식은 상용화 이르다고 판단한 듯(서울=연합뉴스) 권영전 기자 = 삼성전자가 이달 하순 출시할 전략 스마트폰 갤럭시S4에 '무선충전' 기능을 넣기로 한 것으로 확인됐다.삼성전자 관계자는 12일 연합뉴스와 통화에서 이렇게 밝히고 ""스마트폰 덮개(커버) 등 별도 액세서리를 이용하는 방식이 될 것""이라고 설명했다.삼성전자는 무선충전 기능을 제공하는 제품과 액세서리 등을 세계 각국 시장에 내놓기 위해 우리나라 국립전파연구원, 미국 연방통신위원회(FCC) 등의 인증을 받기 위한 준비를 진행중이다.삼성전자가 제품에 무선충전 기능을 탑재키로 한 것은 이번이 처음이다. 이 회사는 지난달 중순 미국 뉴욕에서 열린 갤럭시S4 공개 행사 당시에는 무선충전 기능을 언급하지 않았다.업계는 삼성전자가 갤럭시S4를 출시한 후 이동통신사와 함께 진행하는 판촉행사 등을 통해 고객들에게 무선충전용 액세서리를 지급할 것으로 보고 있다.갤럭시S4에 쓰일 무선충전 방식은 '자기유도' 방식으로, LG전자가 옵티머스G 프로 등 최신 스마트폰에 도입한 방식과 같아 업계에서는 'LG방식'이라고 불리기도 한다.그간 LG전자는 자기유도방식, 삼성전자는 공진방식의 무선충전 기능을 각각 추진해 왔다. 자기유도 방식은 단말기가 충전기에 근접해야 하지만 공진 방식을 이용하면 충전기에서 4∼5m 떨어져도 충전이 가능하다.갤럭시S4.(자료사진)삼성전자는 지난해 갤럭시S3를 발표하면서 향후 공진 방식의 무선충전을 제공할 것이라고 밝힌 바 있지만 아직 상용화할 수준의 개발 단계에 이르지는 못한 것으로 알려졌다.이에 따라 삼성전자는 공진 방식 채택이 현 단계로는 무리라고 판단하고  세계무선충전협회(WPC)로부터 자기유도 방식 무선충전의 표준인 '치(Qi) 인증'을 받기 위한 절차를 진행중인 것으로 알려졌다.comma@yna.co.kr[이 시각 많이 본 기사]☞""일본서 한국인 관광버스끼리 충돌…27명 병원행""(종합2보)☞<라임은 딱맞게, 발음은 쉽게…베일 벗은 '젠틀맨'>☞北 ""단추만 누르면 발사…전쟁은 시간문제"" 위협(종합)☞<프로야구> NC 김경문 감독 ""가슴이 뭉클하네요""☞朴대통령 ""北과 대화할 것""…대북대화 제의(종합)<연합뉴스 모바일앱 다운받기><포토 매거진><저작권자(c)연합뉴스. 무단전재-재배포금지.>"
30,2013-04-12,"삼성, 6.3인치 갤럭시 메가 공개…국내 출시계획 없어",https://news.naver.com/main/read.nhn?mode=LSD&mid=shm&sid1=105&oid=001&aid=0006200181,연합뉴스,"(서울=연합뉴스) 권영전 기자 = 삼성전자가 6.3인치 스마트폰 갤럭시 메가를 공개했다.삼성전자는 11일(현지시간) 미국 언론에 배포한 보도자료를 통해 롱텀에볼루션(LTE)를 지원하는 갤럭시 메가 6.3을 내놓는다고 밝혔다.갤럭시 메가 6.3은 지금까지 삼성전자가 낸 스마트폰 가운데 가장 큰 화면을 가진 기기다.이 제품이 출시되면 삼성전자는 9인치대 제품을 제외하고 화면 크기별로 4∼10인치대 스마트기기 진용을 모두 갖추게 된다.갤럭시S 시리즈가 4인치대, 갤럭시 노트와 갤럭시 노트2가 5인치대, 갤럭시 메가가 6인치대가 되며 태블릿PC 갤럭시 노트와 갤럭시탭 제품군들이 각각 7·8·10인치대에 포진했다.갤럭시 메가는 아몰레드(AM OLED, 능동형유기발광다이오드)가 아니라 액정화면(LCD)을 장착했고, 스마트폰의 두뇌에 해당하는 애플리케이션프로세서(AP)로는 1.7㎓ 듀얼코어 부품을 달았다. 두께는 8㎜, 무게는 199g이다.삼성은 5.8인치 제품인 갤럭시 메가 5.8도 함께 내놨다. 이 제품은 1.4㎓ 듀얼코어 AP를 장착했고 두께 9㎜, 무게 182g이다.신종균 삼성전자 IM(IT·모바일) 담당 사장은 ""대화면 제품을 이용하면 더 방대한 멀티미디어 감상과 웹서핑을 할 수 있다""며 ""갤럭시 시리즈의 최고급 기능을 유지하면서 소비자의 다양한 생활방식에 맞춘 제품을 제공할 수 있게 됐다""고 강조했다.그러나 삼성전자 관계자는 현재로선 이 제품의 국내 출시 계획은 없다고 말했다.comma@yna.co.kr[이 시각 많이 본 기사]☞""일본서 한국인 관광버스끼리 충돌…27명 병원행""(종합2보)☞<라임은 딱맞게, 발음은 쉽게…베일 벗은 '젠틀맨'>☞北 ""단추만 누르면 발사…전쟁은 시간문제"" 위협(종합)☞<프로야구> NC 김경문 감독 ""가슴이 뭉클하네요""☞<朴대통령 대북 대화제의…대치국면 숨통 트나>(종합2보)<연합뉴스 모바일앱 다운받기><포토 매거진><저작권자(c)연합뉴스. 무단전재-재배포금지.>"
31,2013-04-12,"파스텔톤 이건희, 화려한 넥타이 정몽구…재계 패셔니스타는?",https://news.naver.com/main/read.nhn?mode=LSD&mid=shm&sid1=101&oid=112&aid=0002415138,헤럴드POP,"［헤럴드경제=도현정 기자］패션이 곧 이미지가 되고, 능력을 돋보이게 해주는 시대다. 재계를 대표하는 국내 굴지 기업의 오너들은 어떤 스타일로 자신을 대변할까. 홈쇼핑 채널 GS샵과 손잡고 독창성과 대중성, 두 마리 토끼를 다 잡고 있는 디자이너 3인의 의견을 빌어 국내 대표 기업 오너들의 패션 스타일을 분석해봤다.이건희 삼성전자 회장은 디자이너들 사이에서도 감각이 남다른 멋쟁이라 정평이 났다. 컬러 감각이나 액세서리를 활용하는 방식 등에서 부인 홍라희 여사와 더불어 센스가 넘친다는 평이었다.김서룡 디자이너는 “그 나이에 보통 잘 안 입는 파스텔톤이나 과감한 체크, 아웃포켓 등 디테일의 활용이 눈에 띈다”라며 “더 젊어보이고, 패션에 대한 감각이 돋보이는 느낌”이라고 전했다.구본무 LG그룹 회장과 정몽구 현대자동차그룹 회장은 넥타이로 감각을 뽐내는 대표적인 이들로 꼽혔다. 구 회장은 부드러운 느낌을 주는 색상의 넥타이를 많이 매, 점잖은 인상을 준다는 의견이 대부분이었다. 김 디자이너는 “셔츠도 엔틱한 느낌을 준다”라며 셔츠와 넥타이의 배치가 차분하다고 전했다. 홍혜진 디자이너는 “보수적인 소재와 색상, 실루엣, 디테일을 선택해 가장 전형적인 ‘총수룩’을 보여준다”라고 평했다.정 회장은 구 회장과 달리 화려한 색상의 넥타이를 자주 매, 의상에 포인트를 주는 게 특징이다. 김 디자이너는 “풍채 좋은 인상과 어두운 피부톤, 화려한 넥타이가 어울리면서 더욱 힘이 있어 보인다”고 밝혔다. 홍 디자이너는 “진한 그레이 등 어두운 톤의 수트에 화이트셔츠와 강렬한 색상의 타이로 생동감을 표현한다”라고 전했다.전반적으로, 역동적인 자동차 기업을 이끄는 오너라는 인상에 부합하다는 평이었다.최태원 SK 회장은 다른 오너들에 비해 젊은 나이이지만, 의상에서는 다소 보수적이었다. 싱글 수트와 핀스트라이프 셔츠 등 여느 회장님이나 고를법한 옷들을 많이 입었다. 그러나 홍 디자이너는 “브라운 수트와 오랜지색 넥타이 등은 젊은 총수다운 선택”이라며 후한 점수를 줬다.허창수 GS그룹 회장은 ‘재계의 신사’라는 별명답게 ‘수트의 정석’을 보여준다는 평이었다. 홍 디자이너는 “부드러운 어깨선을 가진 슬림한 실루엣의 수트와 조화가 잘 되는 셔츠, 타이 색상의 선택이 고급스럽고 세련된 느낌”이라고 전했다.신동빈 롯데그룹 회장은 진한 톤의 수트와 모노톤의 타이를 즐겨 매치하는 것이 특징으로 꼽혔다. 전체적으로 지적이고 모던한 이미지가 돋보인다는 게 전문가들의 평이었다. 이석태 디자이너는 “재킷 핏 등이 전반적이고 편안한 스타일링이다”라고 말했다.현정은 현대그룹 회장은 대북사업 등 리스크를 감당해야 하는 사업을 총 지휘하는 총수답게, 신뢰감을 주는 패션을 보여줬다. 홍 디자이너는 “어두운 톤의 스커트 정장과 간결한 차림새가 신뢰감을 준다”고 전했다. 현 회장은 가방이나 신발 등에서도 화려한 디테일이 좀처럼 보이지 않고, 액세서리도 절제하는 스타일이 많았다. 진주 등 고급스런 인상을 주는 목걸이나 귀걸이가 간혹 보이는 정도였다.의외로(?) 패셔니스타 기질을 발견하게 된 인물은 김승연 한화그룹 회장이었다. 젊은 나이부터 그룹을 이끌어온 총수로서 보수적인 느낌이 강했지만, 홍 디자이너는 “보수적인 느낌에 이탈리안 분위기의 트렌디한 스타일을 가미하는 감각이 탁월하다”라며 숨은 고수(?)를 집어냈다. 이 디자이너 역시 “전반적으로 패션에 관심이 많으신 것은 분명한 것 같다”라며 “안경, 넥타이 등에서의 포인트가 리더로서의 에너지를 느끼게 한다”라고 전했다.재계 젊은 리더들은 패션에서도 1세대보다 한 단계 업그레이드 된 감각을 뽐냈다. 이웅렬 코오롱그룹 회장은 짧은 바지와 슬림한 실루엣의 수트 등 트렌드에 민감한 모습을 보여줬다. 홍 디자이너는 “포켓스퀘어 등 적절한 액세서리의 활용으로 패션너블한 감각을 보여 준다”라고 평가했다.이재용 삼성전자 부회장은 모던한 룩이 인상적이라고 꼽혔다. 하얀 피부톤에 어울리는 모노톤의 수트와 타이, 슬림한 실루엣 등이 세련된 감각을 보여준다는 평이었다.이부진 호텔신라 사장은 여성스러운 실루엣의 의상이 외모를 더욱 돋보이게 해준다는 평을 받았다. 홍 디자이너는 “모노톤의 색상과 고급스러운 소재를 선호하는 것 같다”라며 “과하지 않은 세련된 룩을 보여준다”라고 전했다.이서현 제일모직 부사장은 패션 기업을 이끄는 리더답게 재기발랄한 트렌드를 반영하는 패션부터 고급스러운 느낌까지 폭 넓은 영역을 오가며 다양한 분위기를 조화시킨다고 호평받았다. 홍 디자이너는 “트렌드를 반영한 세련된 룩과 고급스러운 느낌을 조화시키는 능력이 뛰어나다”라며 “슈즈, 가방, 액세서리 등을 스타일링 하는 센스가 훌륭하다”라고 극찬했다.이 디자이너는 “패턴이 예사롭지 않고 허리 절개 등이 대기업의 리더로서는 다소 파격적인 디자인이 많은데, 차분한 모노톤 색상이 이를 과하지 않게 받쳐준다”라며 “전문가적 안목으로 옷을 고른 티가 난다”라고 말했다.그러나 국내 재계 리더들 중 많은 이들에게서 무난하고 튀지 않으려는 인상이 보인다는 점이 아쉽다는 지적도 있었다. 이 디자이너는 “의상은 오너의 리더십이나 에너지를 외부로 보여주는 역할을 한다”라며 “모노톤 등 튀지 않는 의상을 주로 고집하는 분들이 많은데, 액세서리 등으로 포인트를 준다던지 역동감을 보여주는 것이 더 신뢰감을 줄 것 같다”라고 지적했다.도현정 기자/kate01@heraldcorp.com[오늘의 인기기사]◆“야한데 괜찮아요?” 강예빈 의상 어떻길래…◆김정은 1년, 변화 기대주→가장 위험인물◆일반車가 하이브리드 연비 ""이럴수가!""◆일본 살인 진드기 “한국에도 있다…공포”◆성동일 아내 공개 “가녀린 몸매 깜짝”- 헤럴드 생생뉴스 Copyrights ⓒ 헤럴드경제 & heraldbiz.com, 무단 전재 및 재배포 금지 -[바로가기]▶ 헤럴드경제 모바일 웹 바로가기▶ 모바일앱 다운로드- [아이폰 용] | [안드로이드 폰 용]"
32,2013-04-12,‘사람 vs 말 vs 차’ 누가 빠를까?,https://news.naver.com/main/read.nhn?mode=LSD&mid=shm&sid1=103&oid=382&aid=0000099378,스포츠동아,"한국 육상의 기대주 이재하(왼쪽)가 경주마 ‘블레시드’(가운데), SUV와 스피드 대결을 벌인다. 21일 서울경마공원을 찾는 경마팬은 이 특별한 레이스의 승자를 확인할 수 있다. 사진제공｜한국마사회[스포츠동아]■ 21일 서울경마공원서 이색대결이재하 선수, 韓 육상 단거리 기대주경주마 ‘블레시드’ SUV 차량은 미정사람 200m 말·차 400m 핸디캡 경주‘무모한 도전? 무한도전!’ 사람, 경주마, SUV 승용차 중 가장 빠른 쪽은 어디일까. 21일 경기도 과천 서울경마공원에서는 이 궁금증의 답을 확인할 수 있다.한국마사회는 이날 제21회 서울마주협회장배 대상경주를 기념하기 위해 사람과 경주마, 자동차 간에 벌어지는 이색 대결 이벤트를 마련했다.경주에 나선 주인공은 2012년 전국체전 남자 대학부 100m(10초68)와 200m(21초06)를 석권한 이재하(22·경북대 체육교육과) 선수. 1m92의 큰 키와 레이스 중후반의 폭발적인 가속력이 우사인 볼트(26ㆍ자메이카)를 연상시켜 ‘국산 볼트’ ‘토종 번개’로 불리는 한국 육상 단거리의 기대주다.이재하 선수와 경쟁을 펼치는 상대는 국산 1군 최정상급 경주마였던 블레시드(8세·암말)와 프리미엄 SUV 승용차. 물론 일반적인 대결에서 경주마와 자동차와 겨뤄 사람이 이기기는 불가능하다. 지구에서 가장 빠른 사람으로 꼽히는 우사인 볼트의 최고 속도는 시속 42km 정도. 자동차(200∼300km)나 말(60∼70km)과는 비교가 되지 않는다.이번 이벤트를 마련한 한국 마사회는 이런 점을 고려해 ‘핸디캡 경주’로 진행한다. 우선 경주 거리에 차이를 두어 말과 SUV 자동차는 400m를 달리는데 비해, 이재하 선수는 절반인 200m만 달린다. 또한 경주가 열리는 장소는 일반 도로가 아닌 8cm 두께로 모래가 쌓인 서울경마공원의 트랙이다.이색 대결에 나선 이재하 선수는 “세계 수준은 저만치 앞서가는데 한국은 제자리 걸음이어서 육상 같은 기초종목의 중요성을 알리기 위해 출전을 결심했다”고 참가 이유를 밝혔다. 그는 또  “힘든 승부가 예상되지만 컨디션 조절을 잘해 호락호락하게 물러서지는 않겠다”고 투지를 불태웠다.한국마사회는 온·오프라인 투표를 통해 승자를 맞힌 경마팬에게 추첨을 통해 푸짐한 경품을 선물할 예정이다. 온라인 투표는 한국마사회 경마공원 홈페이지 내(http://park.kra.co.kr)에서, 오프라인 투표는 경주 당일 과천 서울경마공원 현장에서 참여가 가능하다.김재학 기자 ajapto@donga.com 트위터@ajapto[관련 뉴스]- 침대 위 섹시한 그녀들! 눕자마자 섹시함 업↑- 소희, 과감한 자태… 섹시＋도도한 매력 ‘男心 흔들’- 인치환, 1분기 MVP 영예…경륜계 판도 바꾸다- 김자영 81타 멘붕 “아직 끝난 건 아냐”- 김호철, V리그 7구단 러시앤캐시 감독 거절스포츠동아, 무단 전재 및 재배포 금지스포츠동아가 만드는 모바일 연예/스포츠세상 -http://m.sports.donga.com"
