,날짜,기사 제목,기사 링크,기사 출처,기사 내용
0,2013-04-12,2층에서 점프하고 허공에 '붕'…멧돼지 활극,https://news.naver.com/main/read.nhn?mode=LSD&mid=shm&sid1=102&oid=055&aid=0000249452,SBS,"<앵커>출근 시간, 분당 야탑역 근처에 멧돼지 한 마리가 나타났습니다. 2층에서 뛰어내리고 차량과 부딪치고도 추격을 피해 달아났습니다.강청완 기자가 취재했습니다.<기자>백화점 주차장 건물 2층에서 시커먼 물체 하나가 땅으로 뚝 떨어집니다.멧돼지입니다.잠시 버둥거리는가 싶더니 벌떡 일어서 건너편 건물로 돌진합니다.놀란 경비원이 급히 몸을 피하고 멧돼지는 다시 다시 뛰쳐나옵니다.여기저기 마구 뛰어다니다가 달려오던 차량에 부딪혀 허공에 붕 떠오릅니다.하지만 금세 일어나 다시 달아납니다.출근 시간대 도심을 30분 넘게 배회하던 멧돼지는 구조대가 쏜 마취총을 세 발이나 맞았지만 그대로 달아났습니다.[최초 목격자/경비원 : 나한테 달려들려고 해서 옆으로 피했지. (크기가) 이 정도 되죠. 완전히 어른 멧돼지예요.]멧돼지가 뛰어내렸던 백화점 2층 주차장 창문에는 발자국이 어지럽게 찍혀 있습니다.멧돼지는 경찰과 119구조대에 쫓기다, 근처 군부대 울타리를 뚫고 사라졌습니다.[출동 소방관 : 군부대 안을 수색해봤는데 철망을 넘어간 흔적이 있대요. 산속으로 가버린 거죠.]건물에서 떨어지고, 차에 치이고, 마취총을 맞고도 멧돼지는 처음 발견된 야탑역에서 2km 떨어진 야산으로 도망갔습니다.경찰은 분당지역에 멧돼지 사육장이 없는 점으로 미뤄 달아난 멧돼지가 야생일 것으로 추정했습니다.(영상취재 : 하 륭, 영상편집 : 오광하)강청완 기자blue@sbs.co.kr관/련/정/보◆ ""알랑가몰라 젠틀맨"" 싸이 신곡, 외신 반응은?◆ [단독] 이상한 문자?…알고 보니 군 작전 내용◆ 서울 도심서 민간인 권총 자살…어디서 유입?◆ 한 번뿐인 결혼식을 공사판서? 예비부부 '황당'◆ ""두고 간 물건 주세요"" 신종 가로채기 수법이…☞[SBS기자들의 생생한 취재현장 뒷이야기 '취재파일']☞ SBS뉴스 공식 SNS [SBS8News 트위터] [페이스북] [미투데이] [요즘]저작권자 SBS&SBS콘텐츠허브 무단복제-재배포 금지"
1,2013-04-12,"[정글]박보영, 초췌한 모습에 스스로 한탄 “거지가 따로 없군”",https://news.naver.com/main/read.nhn?mode=LSD&mid=shm&sid1=115&oid=416&aid=0000019729,SBS funE,"[SBS E! 연예뉴스 l 조성필 기자]박보영이 자신의 꾀죄죄한 모습에 한탄했다.12일 밤 방송된 SBS ‘정글의 법칙 in 뉴질랜드’에서 석기생존 5일차를 보낸 박보영이 자신의 꾀죄죄한 모습에 놀라는 모습이 전파를 탔다.박보영은 셀프 카메라로 ‘보영 모닝 와이드’를 진행했다. 박보영은 모자를 만들고 있는 이필모와 불씨를 피우고 있는 리키 김을 영상에 담은 것.이어 박보영은 카메라로 자신을 찍기 시작했지만 “이런 거지가 따로 없군. 진짜 거지네”라며 자신이 초췌한 모습을 한탄했고 “정수리가 너무 따가워요”라며 고통을 호소했다. 그리고 리키 김은 박보영에게 자신이 만든 모자를 씌어주며 시골 아줌마 같다고 했고, 이에 박보영이 시골 아가씨라고 불러달라고 해 웃음을 자아냈다.한편 병만족은 석기생존을 통해 깨달은 점을 개개인의 인터뷰를 통해 밝혔다.[관련기사]▶ 싸이 양현석 함박웃음 '싸이 젠틀맨 뮤비'성공 예감?▶ 심은하 16년 전 미모 '원조 국민 첫사랑'의 위엄 ""그립다 그리워~""▶ 뱀파이어 고양이, '입이 찢어져 이빨이 밖으로 드러나…'▶ 110년 전 말벌 허리 미녀 ""진정한 한줌 허리! 근데 무서워...""▶ 전효성 결혼 계획 ""32살에 하고 싶다, 선예 덕에 가능할 듯""저작권자 SBS E! & SBS콘텐츠허브 무단복제-재배포 금지"
2,2013-04-12,무라카미 하루키 신작 읽자…책 사려고 밤샘,https://news.naver.com/main/read.nhn?mode=LSD&mid=shm&sid1=103&oid=055&aid=0000249441,SBS,"<앵커>세계적인 소설가 무라카미 하루키가 3년 만에 신작과 함께 돌아왔습니다. 이걸 먼저 사려고 밤새 서점 앞에 구매 대기 행렬이 이어졌습니다.도쿄 김승필 특파원입니다.<기자>오늘(12일) 새벽 0시.한밤중 도쿄의 한 서점 앞에 긴 줄이 늘어서 있습니다.[3, 2, 1, 0, 지금 오전 0시 판매가 시작됐습니다.]무라카미 하루키의 새 소설 판매 시간에 맞춰 몰려든 행렬입니다.일본 TV들은 뉴스로 생중계까지 했습니다.책 제목과 내용까지 비밀에 부쳤던 수수께끼 마케팅이 독자들의 관심을 더 키웠습니다.[독자 : 정말 기쁘고 빨리 읽고 싶습니다. 다 읽을 때까지는 못 잘 것 같습니다.]무라카미의 다른 소설과 마찬가지로 이번 소설도 제목이 조금 어렵습니다.'색채가 없는 다사끼 츠쿠루와 그의 순례의 해'라는 긴 제목입니다.마음에 큰 상처를 입은 철도회사 직원이 고통에서 회복해 가는 과정을 담고 있습니다.사전 예약이 몰려 초판만 50만 부 찍었습니다.일본에서 770만 부, 한국에서 200만 부가량 팔린 전작 '1Q84'의 열풍과 비슷한 수준입니다.[마쓰시타/산세이도 서점 : 3시간 일찍 서점 문을 열었는데, 지금까지 300권 이상 팔았습니다.]상실의 시대, 해변의 카프카, 1Q84 등 하루키의 작품은 한국에서도 모두 베스트셀러가 됐습니다.한국 출판사들의 판권 경쟁이 치열할 수밖에 없는데 한국어 번역본 출간은 대략 7월쯤이 될 것으로 예상됩니다.(영상취재 : 안병욱·한철민)김승필 기자kimsp@sbs.co.kr관/련/정/보◆ ""알랑가몰라 젠틀맨"" 싸이 신곡, 외신 반응은?◆ [단독] 이상한 문자?…알고 보니 군 작전 내용◆ 서울 도심서 민간인 권총 자살…어디서 유입?◆ 한 번뿐인 결혼식을 공사판서? 예비부부 '황당'◆ ""두고 간 물건 주세요"" 신종 가로채기 수법이…☞[SBS기자들의 생생한 취재현장 뒷이야기 '취재파일']☞ SBS뉴스 공식 SNS [SBS8News 트위터] [페이스북] [미투데이] [요즘]저작권자 SBS&SBS콘텐츠허브 무단복제-재배포 금지"
3,2013-04-12,“가습기 살균제의 진실 왜 덮으려고만 하나요”,https://news.naver.com/main/read.nhn?mode=LSD&mid=shm&sid1=102&oid=032&aid=0002326266,경향신문,"경기 파주에 사는 고모씨가 12일 CMIT와 MIT 성분의 가습기 살균제를 쓰다 2년 전 생후 8개월 만에 사망한 둘째 아이의 동영상을 보고 있다.ㆍ8개월 된 둘째 딸 잃은 고씨 부부 “정부, 어떻게 유독물 지정 감추나”“어! 얘 목에 빨간 점이 있네?”아내는 갓 태어난 둘째 딸아이를 목욕시키고 옷을 입혔다. 지금은 여섯 살이 된 큰아들은 동생을 어른처럼 안아보려 하다가 배시시 웃으면서 몸을 꼬았다. 고모씨(41)는 12일 지은이가 태어났을 적 찍은 동영상을 말없이 바라보았다.“거의 다 지우고 (동영상) 남은 게 별로 없어요.” 안경 너머의 눈물을 닦으며 고씨가 말했다.고씨 부부가 지은이를 낳은 것은 2년 전 이맘때였다. 아기는 24주 만에 태어나 8개월 동안 병원 인큐베이터에 머물렀다. 지은이는 일찍 태어난 것 같지 않게 튼튼하게 자라줬다. 병원생활이 끝나고 딸아이를 품에 안고 집으로 오던 날, 지은이를 안아키우다시피 했던 여의사는 “다른 애들보다 건강하니 걱정하지 말라”고 말했다.비극이 시작된 것은 외려 경기 파주의 집으로 온 뒤부터였다. 부부는 예민한 아기를 위해 가습기를 설치했고 24시간 틀어줬다. 아내 이연주씨(36)는 가습기 살균제를 사던 자신의 모습이 일종의 영상처럼 머릿속에서 반복재생된다고 했다.“그 물건이 있던 자리까지 다 기억나요. 지은이가 집에 오기로 해서 너무 기뻐서 가습기 살균제 쓰면 더 청결해진다고 하니까…. 제가 그 물건을 직접 집어왔거든요. 그런데 그것 때문에….”2년 동안 어렵게 눌러왔던 감정들이 다시 뜨거운 눈물로 흘러내렸다. 지은이는 집에 와서 17일을 머물렀다. 2주가 조금 넘자 갑자기 열나고 숨이 가빠지는 증상이 생기더니 점차 심해졌다. 고씨가 아이를 업고 병원 응급실로 달려갔다. 병원에서는 아무 이상도 발견할 수 없다고 했다. 그러다 5일 만에 지은이의 숨소리가 달라지면서 상태가 악화되기 시작했다. 이때서야 지은이의 폐가 굳어가고 있었음을 병원조차 뒤늦게 알았다.“마지막에 심폐소생술을 하는데 제가 ‘지은아 일어나. 엄마야 지은아’ 그랬더니 제 목소리를 들었는지 눈을 떠서 저와 눈을 딱 마주치는 거예요. 그러고는 눈을 감고 다시 못 떴어요.” 생후 8개월 만이었다. 베란다 너머 하늘을 바라보는 이씨의 목소리는 계속 떨렸다.고씨 부부가 딸의 죽음이 자신들만의 문제가 아니라는 사실을 알게 된 것은 그로부터 수주 후였다. 2011년 초 우연히 접한 TV프로그램을 통해서였다. 질병관리본부에 전화해 조사를 의뢰했다. 한 달이 넘어도 연락이 오지 않았다. 재차 전화했다. 담당자가 없다고 했다. 4개월 후 다시 전화했더니 “곧 방송에 나올 테니 기다리라”는 답변만 돌아왔다. 그해 8월 김씨는 방송을 봤지만 “원인미상 폐손상의 위험요인으로 가습기 살균제로 추정되는” 사례에 자신의 딸이 포함되는지는 알 길이 없었다. 해를 넘겨 2012년 2월 동물실험(독성실험) 최종 결과가 나왔고 ‘CMIT/MIT’ 성분의 제품에선 폐섬유화 소견이 발견되지 않았다는 얘기가 나왔다. ‘CMIT/MIT’ 성분이 든 ‘가습기 메이트’만 사용했던 고씨 부부는 어안이 벙벙했다. 딸이 겪은 일은 다른 피해자들과 너무도 유사했기 때문이다.“당연히 의심이 들었죠. 이 성분의 가습기 살균제로 인한 사망률이 두 번째로 높다고 들었는데 아무 문제 없다고 하니까.”고씨가 12일 아침 ‘CMIT/MIT’ 성분을 환경부가 지난해 9월 독성물질로 지정했었다는 경향신문 보도를 접하고 갑자기 머리카락이 쭈뼛 선 이유다.“정부가 이제는제발 정확히 조사를 했으면 좋겠어요. 지금은 덮으려고만 하는 것 같아요. 수면 위로 떠올랐다가 묻혔다만 하잖아요. 그 사이 피해자 가족들은 서로 얘기조차 편하게 할 수 없었어요.”일주일 뒤는 지은이의 생일이다. 아이를 잃은 부부가 바라는 것은 거창한 게 아니었다. “정확한 조사와 책임있는 사람에게 마땅한 벌을 묻는 것, 그것뿐”이라고 했다.<글·사진 | 송윤경 기자 kyung@kyunghyang.com>경향신문 [오늘의 인기뉴스]▶ “오세훈은 안됩니다”▶ “카톡 클릭해 누드사진을…5초 만에…”▶ 아들 잃은 목사, 스티브 잡스의 부인…▶ LA다저스, 집단 몸싸움…류현진은?▶ 싸이 젠틀맨, 가사·뮤비부터 해외반응까지…모바일 경향 [경향 뉴스진|경향신문 앱|모바일웹] | 공식 SNS 계정[경향 트위터][미투데이][페이스북][세상과 경향의 소통 Khross]- ⓒ 경향신문(www.khan.co.kr), 무단전재 및 재배포 금지〈경향신문은 한국온라인신문협회(www.kona.or.kr)의 디지털뉴스이용규칙에 따른 저작권을 행사합니다.〉"
4,2013-04-12,‘차베스 후광’ 붉게 물든 카라카스,https://news.naver.com/main/read.nhn?mode=LSD&mid=shm&sid1=104&oid=028&aid=0002183656,한겨레,"[한겨레]브리핑우고 차베스 전 대통령의 빈자리를 채우게 될 베네수엘라 대선이 14일(현지시각) 치러진다. 차베스가 생전에 지명한 후계자 니콜라스 마두로(51) 임시 대통령이 당선돼 차베스의 좌파 정책을 이어갈 가능성이 높다.<에이피>(AP) 통신 등 외신은 11일 베네수엘라 대통령 재선거의 공식 선거운동이 끝났다고 보도했다. 이날 수도 카라카스는 차베스를 상징하는 ‘붉은 티셔츠’를 입은 수십만명의 마두로 지지자들로 붉게 물들었다. 이들은 맥주를 마시고 춤을 추고 불꽃놀이를 하며 새 대통령 탄생의 순간을 기다렸다.지난달 5일 숨진 차베스에 대한 뜨거운 추모 열기는 후계자인 마두로의 지지율로 이어졌다. 현지 여론조사 기관 다타날리시스가 1일부터 닷새간 조사한 결과를 보면, 전직 버스 운전기사 마두로의 지지율이 55%로 변호사 출신 야권 통합후보인 엔리케 카프릴레스(41)를 약 10% 포인트 차로 앞서고 있다. 차베스 사망 직후 같은 기관에서 조사한 14% 포인트보다는 격차가 줄었다. <에이피> 통신은 카프릴레스가 남미 최악의 살인율과 식량 부족, 두자릿수 인플레이션, 잦은 정전사태 등의 사회 문제를 이슈화해 지지율 격차가 줄고 있다고 분석했다. 카프릴레스는 지난해 10월 대선에서도 차베스와 맞붙어 45% 가까이 득표하는 저력을 과시한 바 있다.마두로는 카라카스 유세에 앞서 국영 텔레비전 인터뷰에서 “나도 여러 구역에서 (범죄 피해를) 경험한 적이 있기 때문에 치안 부재 문제를 바로잡고 싶다. 경제도 성장시키고 싶다”며 야권이 제기한 문제들에 대한 해결 의지를 강조했다. 반면 카프릴레스는 마지막 유세에서 “1년 안에 경제를 되살리겠다. 기회를 달라”고 호소했다. 카프릴레스는 친기업 정책을 도입하겠다면서도, 라이벌이던 차베스의 복지정책을 유지하겠다며 유권자들을 설득하고 있다. 하지만 <로이터> 통신은 전세를 뒤집기엔 시간이 너무 부족하다고 지적했다.전정윤 기자ggum@hani.co.kr<한겨레 인기기사>■국정원 취재 100일 ‘보이지 않는 손’ 내내 발목 잡다■전쟁 나면, 어디로 대피해야 할까?■‘1등 남편’ 칭찬 말고 집안일 좀 나눠 하자■초등학교 1학년 앞에서 교사 머리채 잡은 학부모■빌보드, 싸이 ‘젠틀맨’은 ‘강남스타일’ 답습? 혹평공식 SNS[통하니][트위터][미투데이]| 구독신청[한겨레신문][한겨레21]Copyrights ⓒ 한겨레신문사, 무단전재 및 재배포 금지<한겨레는 한국온라인신문협회(www.kona.or.kr)의 디지털뉴스이용규칙에 따른 저작권을 행사합니다.>"
