,날짜,기사 제목,기사 링크,기사 출처,기사 내용
40,2013-04-25,'자산 100조원' 새마을금고 회장 세무조사 착수,https://news.naver.com/main/read.nhn?mode=LSD&mid=shm&sid1=101&oid=214&aid=0000236596,MBC,"[뉴스데스크]◀ＡＮＣ▶자산 100조원에 전국에 지점 1천4백 곳이 넘는 새마을금고 중앙회의 현직 회장에 대해 국세청이 세무조사에 착수했습니다.박종욱 기자가 보도합니다.◀ＶＣＲ▶중부지방국세청이 신종백 현 새마을금고 중앙회 회장에 대해 전격 세무조사에 착수했습니다.신 회장이 춘천중부새마을금고 이사장으로 재직했던 지난 2004년부터 2009년까지, 사채업자 최 모 씨의 자금을 관리해 주고받은 돈 수십억 원에 대해 세금을 탈루한 정황을 포착한 것입니다.◀ＳＹＮ▶ 중부지방국세청 관계자""통장 관계라든지 직접 춘천 쪽으로 출장 가서 확인하고 있어요. 5월 중에 끝나요.""국세청은 신 회장이 사채 자금을 관리를 위해 이용한 차명계좌를 확인하고 있습니다.사채업자의 '전주' 역할을 했다는 진술도 확보했습니다.◀ＳＹＮ▶ 최 모 씨/사채업자""시간이 없다, 계좌로 좀 빨리 보내달라고 하면 계좌번호 불러달라고 해서 바로 보내줍니다. 이자만은 현금으로 꼭 원하더라고요.""국세청은 신 회장이 이렇게 받은 돈으로 춘천에 10억 원대 건물을 부인 명의로 사들이는 등 재산을 증식한 것은 아닌지 살펴보고 있습니다.이에 대해 신 회장 측은 ""자금 관리해 준 건 맞지만 수익을 탈루한 적은 없다""고 밝혔습니다.국세청은 신 회장과 주변 인물들에 대한 계좌추적 등을 거쳐 혐의가 확정되면 검찰 고발 여부를 결정할 방침입니다.MBC뉴스 박종욱입니다.(박종욱 기자 parkgija@mbc.co.kr)[저작권자(c) MBC (www.imnews.com) 무단복제-재배포 금지]"
41,2013-04-25,"[단독] ""잠든 사이 천만 원 털렸다""…의문의 인출",https://news.naver.com/main/read.nhn?mode=LSD&mid=shm&sid1=101&oid=055&aid=0000250327,SBS,"<앵커>한밤 중 주인이 잠든 사이 은행 계좌에서 1천만 원 넘는 돈이 빠져나갔습니다. 누가 어떻게 그런 건지 알 수 없는 일이 잇따라 벌어졌습니다.채희선 기자가 단독 보도합니다.<기자>직장인 정진욱 씨는 지난 21일 아침, 휴대전화 문자 메시지를 보고 깜짝 놀랐습니다.밤사이 계좌에서 1천 200만 원이 빠져나간 겁니다.[정진욱/피해자 : 공인인증서가 재발급됐다는 문자가 있고, 돈이 200만 원씩 해서 7번에 걸쳐서 1천 200만 원이 빠져나간 거예요.]아침에 급히 은행에 연락했지만 돈은 이미 인출된 뒤였습니다.정 씨는 인터넷 뱅킹과 모바일 뱅킹을 둘 다 사용하는데, 돈은 모바일 뱅킹으로 빠져나갔습니다.은행에 함께 찾아가 봤습니다.인터넷 뱅킹이든, 모바일 뱅킹이든, 계좌번호와 비밀번호, 보안카드가 없이는 계좌이체와 인출이 불가능하다고 말합니다.[00은행 직원 : 보안카드번호 35개 숫자는 반드시 들어가야 되는거고. 그 다음에 통장번호, 통장비밀번호 이런 것이 다 있어야 인증서가 발급이 되고…]정 씨는 계좌번호나 보안카드를 분실한 적도, 컴퓨터에도 저장한 적도 없다며 억울한 심정을 밝혔습니다.[정진욱/피해자 : 인증서는 항상 제가 소지하고 있어요. 공인인증서는 분실된 적도 없고, 그리고 파밍 사이트에서 입력한 적도 없고.]이 은행에 계좌를 가지고 있는 정상국 씨도 지난 10일 유사한 수법으로 1천 400만 원을 누군가 빼 갔습니다.돈은 현금출납기로 인출됐고 역시 피해 보상이 어려운 상황.경찰은 개인정보 유출이나 해킹, 혹은 피해자들이 피싱이나 파밍에 걸렸을 모든 가능성을 열어 놓고 수사하고 있습니다.(영상취재 : 김학모·유동혁·설치환, 영상편집 : 김종우)채희선 기자hschae@sbs.co.kr관/련/정/보◆ 교사가 17개월 된 아이 던지다시피…CCTV 포착◆ 아베, 끝없는 망언 도발…가문 내력과 관련?◆ [단독] ""잠든 사이 천만 원 털렸다""…의문의 인출◆ 연예인이라 봐줬다?…이시영 편파 판정 논란◆ ""개성공단 근로자 철수 검토""…정부 초강수☞[SBS기자들의 생생한 취재현장 뒷이야기 '취재파일']☞ SBS뉴스 공식 SNS [SBS8News 트위터] [페이스북] [미투데이] [요즘]저작권자 SBS&SBS콘텐츠허브 무단복제-재배포 금지"
42,2013-04-25,고가의 스마트폰을 지켜라…'기발한 앱' 등장,https://news.naver.com/main/read.nhn?mode=LSD&mid=shm&sid1=105&oid=214&aid=0000236588,MBC,"[뉴스데스크]◀ＡＮＣ▶요즘 스마트폰은 값도 값이지만 개인정보도 많이 들어있다 보니 잃어버리면 피해가 크죠.이렇게 분실이나 도난된 휴대전화를 되찾을 수 있게 도와주거나 개인정보 유출을 막아주는 기발한 앱들이 등장하고 있습니다.정진욱 기자가 보도합니다.◀ＶＣＲ▶스마트폰을 어디에 뒀는지 기억이 나지 않는 김씨.동료 폰으로 문자 신호를 보내자 위치가 지도에 표시됩니다.표시된 장소에서 벨소리까지 요청해 즉시 찾았습니다.국내 스마트폰 이용자 수는 3500만 명 10명 중 1명은 스마트폰을 잃어버린 경험이 있는데요.평균 가격 100만원.귀중품 수준인 고가폰을 되찾게 도와주는 앱, 즉 프로그램이 속속 등장하고 있습니다.다른 사람의 휴대전화로 자신에게 문자 메시지를 보내 원격 조종하는 방식입니다.누군가 비밀번호를 풀려고 할 때 위치정보와 함께 얼굴을 몰래 사진 찍어 보내주는 앱도 있습니다.주소록과 문자 같은 개인 정보 역시 원격으로 모조리 지울 수 있도록 도와줍니다.◀ＩＮＴ▶ 임종인/고려대정보보호대학원 교수""분실된 폰을 신속하게 회수하는데 큰 도움을 주고 있습니다. 그러나.. 이런 정보를 안전하게 보관하는지 우려스럽습니다.""분실 방지 앱도 자칫 관리 소홀로 비밀번호가 유출되면 오히려 악용될 수 있어 주의가 필요합니다.또 분실폰 대부분이 중국이나 동남아로 밀수출되므로 해외에서 재개통이 안되도록 제도를 바꿔 분실폰 유용을 원천적으로 막아야 한다고 전문가들은 지적합니다.MBC뉴스 정진욱입니다.(정진욱 기자)[저작권자(c) MBC (www.imnews.com) 무단복제-재배포 금지]"
43,2013-04-25,스마트앱 불법 1천774억원..전체 23.1% 불법앱 이용,https://news.naver.com/main/read.nhn?mode=LSD&mid=shm&sid1=105&oid=001&aid=0006226403,연합뉴스,"다양한스마트폰을 사용해 보고 있는 사람들 (자료사진)한국저작권위원회 분석 자료..스마트 기기 통한 불법 유통 증가(서울=연합뉴스) 김영현 기자 = 지난해 국내 스마트 앱 불법 시장의 규모가 1천774억원에 달하는 등 스마트 기기를 통한 불법저작물 유통이 느는 것으로 드러났다.한국저작권위원회는 26일 이같은 내용을 담은 보고서 '2012년 스마트 기기를 통한 저작권 침해 실태 및 경로 조사' 결과를 발표했다.지난 2011년 첫 보고서를 낸 저작권위원회는 한국무선인터넷산업연합회에 의뢰해 지난해 9월 스마트 기기 이용자 1천500명을 대상으로 조사해 이번 보고서를 만들었다.보고서에 따르면 2012년 스마트 앱 불법 시장 규모는 1천774억원으로 전체 스마트 앱 시장의 약 44%에 달했다.또 스마트 기기 이용자 중 23.1%가 불법 스마트 앱을 이용했으며, 20.3%는 스마트 기기를 통해 불법 복제된 콘텐츠를 이용한 것으로 조사됐다. 지난 2011년 불법 앱 이용률 11.5%, 불법 콘텐츠 이용률 14.9%와 비교하면 수치가 많이 늘어났다.저작권위원회는 이에 대해 ""2012년 스마트폰 사용자가 큰 폭으로 증가했고 아이폰에 비해 개방성이 강해 상대적으로 불법 앱 이용이 쉬운 안드로이드용 스마트폰이 널리 보급, 확산됐기 때문""이라고 분석했다.불법 앱의 다운로드 경로(중복 응답)는 스마트폰 관련 커뮤니티가 38.4%로 가장 많았다. 블랙마켓(앱 암시장)과 포털 블로그가 각각 36.7%와 34.7%로 뒤를 이었다.장르별(중복 응답)로는 게임이 81.8%로 압도적이었다. 영화·음악·TV는 34.7%, 유틸리티는 27.7%였다.스마트 앱 개발사를 대상으로 한 설문 조사에서는 31.6%가 저작권 침해 경험이 있었다. 78.2%는 앞으로 불법 복제 등 저작권 침해 문제가 심각해질 것으로 내다봤다.업체들은 저작권 보호를 위해 정부 차원에서 시급히 다뤄야 할 분야(복수 응답)로 '기술발전 속도에 걸맞은 법·제도 정비'(46.8%)를 가장 많이 꼽았다. '저작권 보호를 위한 연구 개발 지원'(45.6%), '저작권 보호를 위한 홍보와 교육'(38.0%), '불법복제물에 대한 철저한 단속'(31.6%) 등도 병행해야 한다고 강조했다.이와 관련해 저작권위원회는 불법 스마트 앱 전용 모니터링 시스템을 갖추는 등 저작권 침해 방지 체계를 갖추고 있다. 지난해 불법 스마트 앱과 관련해 1만7천513건의 행정 조처를 내렸다.이번 조사에서 카페, 블로그 등 포털에서의 불법복제물 유통이 늘어난 것으로 밝혀짐에 따라 올해는 이에 대한 모니터링과 행정조치를 강화할 계획이다. 폐쇄형 카페나 커뮤니티에 대해서는 국민오픈모니터링 신고제를 시행하고, 해외 저작권 침해 사이트에 대해서는 방송통신위원회를 통해 접속 차단을 요청해 나갈 방침이다.유병한 저작권위원회 위원장은 ""최근 스마트 기기를 통한 저작권 침해가 확산함에 따라 시정권고 등 행정조치를 강화해 나갈 것""이라며 ""갈등 없는 저작권 생태환경 조성을 위해 관련 기관·단체와 협업체계 구축할 것""이라고 밝혔다.cool@yna.co.kr[이 시각 많이 본 기사]☞부산서 어린이집 여교사들, 17개월짜리 여아 폭행☞'아이리스 2' 신예 고윤, 김무성 당선자 아들☞개성공단 남북실무회담 제의…정부 ""거부시 중대조치""(종합)☞이시영 상대 체육관 ""패배 인정못해…연맹 항의검토""☞朴대통령 ""유전무죄·무전유죄 상용않도록 해달라""▶ 연합뉴스 모바일앱 다운받기▶ 포토 매거진<저작권자(c)연합뉴스. 무단전재-재배포금지.>"
44,2013-04-25,"北, 軍창건일에 약식 열병행사·3代 김씨 띄우기(종합2보)",https://news.naver.com/main/read.nhn?mode=LSD&mid=shm&sid1=100&oid=001&aid=0006226410,연합뉴스,"북한은25일 인민군 창건 81주년을 맞아 김정은 국방위원회 제1위원장이 참석한 '약식 열병행사'를 하고 각종 매체를 통해 김일성·김정일·김정은 3대 김씨의 군 업적을 부각했다. 사진은 지난해 4월 열린 북한 김일성 100회 생일 대규모 군 열병식에 참석한 김정은 국방위원회 제1위원장(AP=연합뉴스, 자료사진)노동신문 ""핵무력 위에 평화와 번영 있어""…TV도 군 관련 일색(서울=연합뉴스) 노재현 윤일건 기자 = 북한은 25일 인민군 창건 81주년을 맞아 김정은 국방위원회 제1위원장이 참석한 '약식 열병행사'를 하고 각종 매체를 통해 김일성·김정일·김정은 3대 김씨의 군 업적을 부각했다.북한군은 김일성 주석과 김정일 국방위원장의 시신이 안치된 금수산태양궁전의 광장에서 분열행진을 하며 김 제1위원장에 대한 충성을 다짐했다.조선중앙TV도 이날 저녁 1시간가량 이 행사를 녹화중계했다.또 최룡해 군 총정치국장과 김명식 해군사령관, 리병철 항공 및 반항공군사령관, 김락겸 전략로켓 사령관 등 군 지도부가 남한과 미국을 겨냥해 ""남해를 놈들의 최후멸망의 무덤으로 만들겠다"" ""미제는 진짜 핵전쟁 맛이 어떤 것인지 느끼게 될것"" 등의 발언으로 위협했다.당초 올해 군 창건일은 꺾어지는 해(매 5주년과 10주년)가 아니어서 차분하게 넘어갈 것으로 보였지만 한반도 긴장 국면에서 군대의 사기를 높이고 내부결속을 다지려고 열병행사를 가진 것으로 보인다.특히 노동당 기관지 노동신문은 이날 6면 전체를 김씨 일가 3대를 찬양하는 기사와 군 관련 기사로 채웠다.노동신문은 1면에 '위대한 선군 영장을 높이 모신 백두산 혁명강군은 필승불패다' 제목의 사설을 싣고 ""김일성 동지께서 1932년 4월 25일 조선인민혁명군을 창건함으로써 선군혁명의 역사가 시작됐다""고 주장했다.사설은 또 ""김정은 동지는 오늘의 첨예한 반미대결전, 21세기의 핵 대결전을 승리로 이끄는 희세의 선군 영장, 천재적 군사전략가, 백전백승의 강철의 영장""이라며 김정은 국방위원회 제1위원장을 내세웠다.또 신문은 이날 2면의 '핵과 평화'란 제목의 정론에선 ""강위력한 핵무력 위에 평화도 있고 부강번영도 있으며 인민의 행복한 삶도 있다""라는 김정은 제1위원장의 말을 인용하며 핵무력 건설 의지를 재차 드러냈다.신문은 1면에 김정일·김정은 부자가 군부대를 시찰하는 사진을 배치했으며 6면에서는 북한의 핵무력이 김일성·김정일의 '애국유산'이라고 주장했다.이날 오전 9시부터 방송을 시작한 조선중앙TV의 프로그램도 대부분 군 관련 일색이었다.중앙TV는 첫 프로그램으로 김일성 주석의 빨치산부대 창설을 내용으로 하는 '기록영화(다큐멘터리)'로 내보냈으며 이어 방영한 영화와 기록영화, 만화영화 모두 군·전쟁 관련 내용으로 일관했다.nojae@yna.co.kryoonik@yna.co.kr[이 시각 많이 본 기사]☞부산서 어린이집 여교사들, 17개월짜리 여아 폭행☞'아이리스 2' 신예 고윤, 김무성 당선자 아들☞개성공단 남북실무회담 제의…정부 ""거부시 중대조치""(종합)☞이시영 상대 체육관 ""패배 인정못해…연맹 항의검토""☞朴대통령 ""유전무죄·무전유죄 상용않도록 해달라""▶ 연합뉴스 모바일앱 다운받기▶ 포토 매거진<저작권자(c)연합뉴스. 무단전재-재배포금지.>"
45,2013-04-25,"""대포차 유지비 내놔"" 돈 뜯은 10대 집유",https://news.naver.com/main/read.nhn?mode=LSD&mid=shm&sid1=102&oid=001&aid=0006226401,연합뉴스,"(서울=연합뉴스) 김지헌 기자 = 서울동부지법 형사1단독 이정권 판사는 후배에게서 금품을 갈취한 혐의(상습공갈)로 기소된 고등학생 이모(19)군에게 징역 1년6월과 집행유예 3년을 선고했다고 25일 밝혔다.아울러 보호관찰 2년과 사회봉사 120시간을 명령했다.고급 대포차를 몰고 다니던 이군은 지난 1월21일 욕을 하면서 ""기름값이 필요하니 돈을 보내라""고 협박해 23만원을 받는 등 동네 후배 류모(17)군으로부터 지난해 12월3일부터 올해 2월18일까지 16회에 걸쳐 1천100만원 상당의 금품을 뜯어낸 혐의로 기소됐다.대포차 유지비와 유흥비가 필요했던 이군은 갖가지 방법으로 돈을 뜯어냈다. 류군에게 겁을 줘 시가 250만원 상당의 오토바이를 받아내는가 하면 오토바이 수리비가 필요하다며 75만원을 받아챙겼다.80만원 상당의 패딩 점퍼도 뜯어냈고 오토바이와 패딩 점퍼 값으로 300만원을 요구해 받아내기도 했다.이군은 지금까지 공갈죄 등으로 4차례에 걸쳐 검찰에서 소년보호사건 송치 처분을 받았다.이 판사는 ""그간 동종 범죄를 수회 반복하고도 선처를 받은 만큼 자중했어야 함에도 피해액이 1천100여만원에 이르는 등 죄질이 나쁘지만 아직 고등학생이고 피해자와 합의를 한 점을 고려한다""고 양형 이유를 설명했다.jk@yna.co.kr[이 시각 많이 본 기사]☞부산서 어린이집 여교사들, 17개월짜리 여아 폭행☞'아이리스 2' 신예 고윤, 김무성 당선자 아들☞개성공단 남북실무회담 제의…정부 ""거부시 중대조치""(종합)☞이시영 상대 체육관 ""패배 인정못해…연맹 항의검토""☞朴대통령 ""유전무죄·무전유죄 상용않도록 해달라""▶ 연합뉴스 모바일앱 다운받기▶ 포토 매거진<저작권자(c)연합뉴스. 무단전재-재배포금지.>"
46,2013-04-25,"北, 軍창건일에 '약식 열병행사'…김정은 참석(종합)",https://news.naver.com/main/read.nhn?mode=LSD&mid=shm&sid1=100&oid=001&aid=0006226397,연합뉴스,"긴장상황에서 軍격려…군사무기는 등장하지 않아(서울=연합뉴스) 노재현 정빛나 기자 = 북한은 25일 인민군 창건 81주년을 맞아 김정은 국방위원회 제1위원장이 참석한 가운데 '약식 열병행사'를 개최했다.조선중앙통신은 이날 ""인민군 창건 81돌에 즈음한 인민군 예식이 25일 금수산태양궁전에서 거행됐다""며 김 제1위원장을 비롯한 지도부와 평양시의 군 및 인민내무군 장병들, 당과 근로단체 간부, 근로자들이 지켜보는 가운데 군대의 분열 행진이 진행됐다고 전했다.조선중앙TV도 이날 오후 8시께 이 행사를 녹화중계했다.북한이 올해가 꺾어지는 해(매 5주년과 10주년)가 아니지만, 대규모 행사를 연 것은 한반도 긴장 국면에서 군대의 사기를 높이고 내부결속을 다지려는 의도가 담긴 것으로 보인다.북한은 작년 4월 김일성 주석의 100회 생일을 맞아 김일성 광장에서 미사일 등 최신 무기를 선보이는 대규모 군 열병식을 가졌지만 금수산태양궁전 광장에서 열린 이번 행사에는 군사무기가 등장하지 않았다.북한 매체는 일반적인 열병식은 '열병식'이라고 표현해왔지만, 이번 행사는 규모가 작은 의미로 '예식'이라고 칭했다.최룡해 군 총정치국장은 연설에서 ""인민군이 걸어온 80여 성상의 역사는 백두산절세위인의 품속에서 주체혁명위업완성의 주력군으로 끊임없이 장성강화되어온 영광의 역사""라며 김 제1위원장에 대한 장병의 충성 결의를 다졌다.김명식 해군사령관, 리병철 항공 및 반항공군사령관, 김락겸 전략로켓 사령관도 각각 연설을 통해 미국을 대한 '핵폭탄 공격' '핵참화' 등을 언급하며 위협적 발언을 쏟아냈다.김 제1위원장은 군 장병들이 주석단 앞을 행진할 때 거수경례로 답례했고 비행기들은 금수산태양궁전 상공에서 저공으로 날면서 '시위비행'을 했다.김 제1위원장이 공개석상에 등장하기는 지난 15일 군사학교 간 교직원 체육경기를 관람하고 열흘 만이다.이날 행사에서 최룡해 정치국장, 장성택 국방위원회 부위원장, 현영철 군 총참모장, 김격식 인민무력부, 박도춘 당비서, 김영춘 국방위 부위원장 등은 주석단에 흰색의 예복(행사용 군복) 차림으로 등장했고 김영남 최고인민회의 상임위원회 위원장, 박봉주 내각 총리, 김경희·김기남 당비서, 강석주 내각 부총리 등의 고위간부도 초대석에 자리했다.한편 일본 교도통신은 소식통을 인용해 북한이 이날 금수산태양궁전에서 비공개로 열병식을 했고 김 제1위원장이 사열했다고 전했다.nojae@yna.co.krshine@yna.co.kr[이 시각 많이 본 기사]☞부산서 어린이집 여교사들, 17개월짜리 여아 폭행☞'아이리스 2' 신예 고윤, 김무성 당선자 아들☞개성공단 남북실무회담 제의…정부 ""거부시 중대조치""(종합)☞이시영 상대 체육관 ""패배 인정못해…연맹 항의검토""☞朴대통령 ""유전무죄·무전유죄 상용않도록 해달라""▶ 연합뉴스 모바일앱 다운받기▶ 포토 매거진<저작권자(c)연합뉴스. 무단전재-재배포금지.>"
