,날짜,기사 제목,기사 링크,기사 출처,기사 내용
120,2013-04-25,"정부, 개성공단 실무회담 제의…""거부시 중대조치""(2보)",https://news.naver.com/main/read.nhn?mode=LSD&mid=shm&sid1=100&oid=001&aid=0006224354,연합뉴스,"김형석통일부 대변인.(자료사진)내일 오전까지 北의 답변 요구(서울=연합뉴스) 홍제성 홍지인 기자 = 정부는 25일 개성공단 사태의 해결을 위해 남북 당국간 개성공단 실무회담 개최를 공식 제의했다.김형석 통일부 대변인은 이날 긴급 브리핑을 갖고 ""개성공단 근무자의 인도적 문제 해결과 개성공단 정상화를 위한 책임있는 남북 당국간 실무 회담 개최를 북한 당국에 공식 제의한다""라고 밝혔다.김 대변인은 ""북한 당국이 내일 오전까지 당국간 실무회담 제의에 대한 입장을 회신할 것을 요구한다""면서 ""북이 우리측이 제의한 당국간 회담마저 거부한다면 우리로선 중대한 조치를 취하지 않을 수 없다는 점을 밝혀둔다""고 경고했다.이날 당국간 실무회담 제의는 류길재 통일부 장관이 지난 11일 북한에 대화를 제의한 뒤 2주만에 나온 것이다.jsa@yna.co.kr[이 시각 많이 본 기사]☞방글라데시 8층 건물 붕괴로 최소 124명 사망(종합3보)☞싸이 '젠틀맨' 빌보드 핫100에서 5위로 상승(종합)☞안철수·김무성·이완구 당선…정치지형 급변(종합2보)☞-美야구- 추신수 4타수 2안타…연속출루기록 '34'(종합)☞<4·24 재·보선> '거물급 트리오' 입성…정계개편 신호탄▶ 연합뉴스 모바일앱 다운받기▶ 포토 매거진<저작권자(c)연합뉴스. 무단전재-재배포금지.>"
121,2013-04-25,"갤럭시S4, 단일제품 1억대 판매로 아이폰 넘어설까",https://news.naver.com/main/read.nhn?mode=LSD&mid=shm&sid1=105&oid=001&aid=0006224200,연합뉴스,"'갤럭시 S4' 26일 국내출시    (서울=연합뉴스) 박지호 기자 = 삼성전자는 오는 26일 이동통신 3사를 통해 '갤럭시 S4'를 세계최초로 출시한다.    '갤럭시 S4'는 5인치 대화면 풀HD 슈퍼아몰레드 디스플레이와 옥타코어 프로세서 등을 채용해 대폭향상된 성능을 제공한다고 삼성전자 측은 밝혔다.    25일 오전 열린 '갤럭시 S4 월드투어 2013 서울' 행사에서 모델들이 제품을 선보이고 있다. 2013.4.25    jihopark@yna.co.kr역대 최고 사양-155개국 327개 이통사 출시, 국내는 보조금이 변수(서울=연합뉴스) 김병규 기자 = 삼성전자가 26일 한국을 시작으로 전세계에서 야심작 갤럭시S4의 판매를 시작한다.애플의 새 아이폰 출시가 예정보다 늦춰질 가능성이 높은 가운데 갤럭시S4는 올해 상반기 출시되는 스마트 기기 중 가장 많은 주목을 받고 있다.세계 최초로 옥타코어칩과 4인치급 풀HD 아몰레드(AM OLED; 능동형 유기발광다이오드) 화면을 탑재했으며 스마트 포즈(Eye Pause)나 스마트 스크롤(Eye Scroll), 에어 뷰(Air View) 등 눈에 띄는 새로운 기능도 갖췄다.업계는 갤럭시S4가 소비자들의 높은 기대감을 바탕으로 판매량을 늘려나간다면 세계 최초로 판매량 1억대를 넘어서는 스마트폰이 될 수 있을 것으로 기대하고 있다.◇ 전세계 10개국서 동시 출시, 초반 바람몰이갤럭시S4는 26일 한국을 시작으로 27일까지 영국, 미국, 호주, 뉴질랜드, 중국, 러시아, 아랍에미리트(UAE)를 포함한 전세계 10개국에서 첫선을 보인다. 전체 출시 국가는 155개국이며 이동통신사는 327개나 된다.삼성전자는 제품에 대한 관심이 최고조에 이르는 출시 초반 주요국에서 활발한 마케팅을 펼치며 초반 바람몰이에 나서고 있다.지난 16일 영국을 시작으로 유럽, 아시아, 오세아니아, 아프리카, 남아메리카의 5개대륙 10개 주요국에서 월드투어 행사를 개최중이며 한국에서는 출시 하루 전인 25일 행사를 열었다.삼성전자가 제품 출시와 함께 전세계에서 활발한 마케팅을 펼치고 있는 만큼 업계는 갤럭시S4의 초도물량이 갤럭시S3의 600만대보다 많은 800만대 수준인 것으로 보고 있다.삼성전자는 작년 아이폰5 출시 당시 공급 부족으로 어려움을 겪었던 애플의 사례를 피하고자 원활한 물량 공급을 위해 공장을 풀가동하고 있다. 애플의 안방인 미국에서는 최대 전자제품 유통업체인 베스트바이에 전용 매장을 대거 개설하며 공격적인 마케팅에 나서고 있다. '매장 내 매장' 1천400개가 마련돼 갤럭시S4의 미국 영업망이 이전 모델 판매 때보다 대폭 강화됐다.◇ 단일제품 첫 1억대 도전삼성전자, '갤럭시 S4' 출시    (서울=연합뉴스) 박지호 기자 = 삼성전자는 오는 26일 이동통신 3사를 통해 '갤럭시 S4'를 세계최초로 출시한다.    '갤럭시 S4'는 5인치 대화면 풀HD 슈퍼아몰레드 디스플레이와 옥타코어 프로세서 등을 채용해 대폭향상된 성능을 제공한다고 삼성전자 측은 밝혔다.    25일 오전 열린 '갤럭시 S4 월드투어 2013 서울' 행사에서 모델들이 제품을 선보이고 있다. 2013.4.25    jihopark@yna.co.kr삼성전자는 갤럭시S4의 전세계 판매량 목표를 1억대로 잡고 있는 것으로 알려졌다. 이는 지금까지 출시된 갤럭시S 시리즈의 전체 판매량과 비슷한 수준이다. 삼성전자는 지난 1월 갤럭시S가 2천500만대, 갤럭시S2가 4천만대, 갤럭시S3가 4천100만대 팔려 세 제품을 합해 1억600만대 판매했다고 밝혔다.갤럭시S4의 판매량이 1억대를 넘어서면 단일 제품 사상 첫 사례가 된다. 애플의    아이폰을 넘어서는 것은 물론이다. 애플이 개별 제품의 판매량을 공개하지 않고 있지만 1억대 이상 판매한 모델은 아직 없는 것으로 보인다.갤럭시S 시리즈는 새 제품이 나올 때마다 이전 제품을 훌쩍 뛰어넘는 판매량을 기록해왔다. 판매량 1천만대를 넘는 시점만 봐도 갤럭시S의 경우 8개월 걸렸던 것이 갤럭시S2는 5개월로 단축됐고 갤럭시S3는 다시 2개월로 줄었다. 전작 갤럭시S3는 전세계적으로 6천만대 가량 판매된 것으로 알려졌다.애널리스트들은 갤럭시S4의 1억대 판매량 달성에 긍정적인 관측을 내 놓고 있다. 말레이시아 증권사인 CIMB는 ""갤럭시S4가 최소 7천만대 이상 판매될 것으로 보이며 1억대 이상 판매도 가능할 것""이라고 예상한 바 있다.◇ 국내 시장선 이통사 보조금이 변수업계는 갤럭시S4의 국내 판매고가 이통시장의 보조금 경쟁 수준과 밀접한 관련이 있을 것으로 예상하고 있다.이통사들 간의 고객 유치 경쟁이 뜨거워지면 갤럭시S4의 초반 판매가 힘을 받겠지만 반대로 빙하기가 계속 유지돼 제품에 대한 소비자들의 기대감이 실제 구매로 이어지지 못한다면 의외로 국내 시장 공략에서 고전할 수 있다는 것이다.작년 여름 갤럭시3의 국내 시장 선전의 배경에는 당시의 보조금 대란이 큰 동력이 됐을 정도로 보조금 상황은 제품의 판매고에 결정적인 영향을 미친다. 작년 연말 출시 당시 비교적 호평을 받았던 아이폰5의 경우 보조금 시장이 잠잠한 상황에서 출시돼 국내 시장에서 참패한 바 있다.일각에서는 보조금 대란 중에 '17만원 갤럭시S3'나 '11만원 아이폰5'를 경험한 소비자들이 제값을 내고 갤럭시S4를 구입하는 데 부담이 있을 것이라는 분석도 있다. 작년 하반기부터 지난달까지 장기간 이어진 보조금 출혈 경쟁에서 꽤 많은 수의 소비자들이 이미 새 단말기를 구입해 단말기 교체 수요가 크지 않은 것도 삼성전자에게 불리한 점이다.반면 제품에 대한 국내 소비자들의 높은 충성심과 사상 최고인 제품 사양은 국내 시장 공략에 긍정적인 요소다. 갤럭시S4의 출고가를 낮춰 이전 모델인 갤럭시S3의 99만4천원보다 10만원 가량 저렴한 89만9천원으로 책정한 것도 국내 소비자들에게 매력적이다.예약 가입을 받고 있는 시장의 분위기는 나쁘지 않다. SK텔레콤이 지난 19일 0시부터 시작한 예약 판매는 개시 50분만에 한정수량 1만대가 모두 찼다.bkkim@yna.co.kr[이 시각 많이 본 기사]☞방글라데시 8층 건물 붕괴로 최소 124명 사망(종합3보)☞싸이 '젠틀맨' 빌보드 핫100에서 5위로 상승(종합)☞안철수·김무성·이완구 당선…정치지형 급변(종합2보)☞-美야구- 추신수 4타수 2안타…연속출루기록 '34'(종합)☞<4·24 재·보선> '거물급 트리오' 입성…정계개편 신호탄▶ 연합뉴스 모바일앱 다운받기▶ 포토 매거진<저작권자(c)연합뉴스. 무단전재-재배포금지.>"
122,2013-04-25,"[1보]통일부, 남북 당국간 실무회담 개최 제의",https://news.naver.com/main/read.nhn?mode=LSD&mid=shm&sid1=100&oid=003&aid=0005109795,뉴시스,"【서울=뉴시스】강수윤 기자 = 통일부는 24일 ""개성공단 근무자들의 인도적 문제 해결과 개성공단 정상화를 위한 책임있는 남북당국간 실무회담 개최 북한당국에 공식 제의한다""고 밝혔다.김형석 통일부 대변인은 이날 오전 정부서울청사 합동브리핑실에서 성명을 발표하고 북한의 일방적인 조치로 개성공단 가동이 중단되고 우리 입주기업들이 피해를 겪고 있는 것과 관련해 이같은 입장을 밝혔다.shoon@newsis.com[뉴시스 이시간 핫 뉴스]ㆍ 싸이 ´젠틀맨´ 2주 만에 빌보드 5위 올라ㆍ 대법 ""약혼녀 집서 돌연사 검사, 과로사 아니야""ㆍ 기초단체장조차…민주 ´전패´ 제1야당의 수모ㆍ 40대男, 내연녀 딸 모텔로 불러내서…ㆍ 성매매 미끼 유인해 강도짓…무서운 10대들★ 뉴시스 뉴스, 이젠 네이버 뉴스 스탠드에서도 만나세요★ 손 안에서 보는 세상, 모바일 뉴시스<저작권자ⓒ 공감언론 뉴시스통신사. 무단전재-재배포 금지.>"
123,2013-04-25,'진선미 의원실 해킹 의혹' 직원 오인으로 확인,https://news.naver.com/main/read.nhn?mode=LSD&mid=shm&sid1=100&oid=001&aid=0006224254,연합뉴스,"진선미민주통합당 의원(자료사진)(서울=연합뉴스) 윤보람 기자 = 민주통합당 진선미 의원이 지난달 제기한 '의원실 이메일 해킹 의혹'은 의원실 직원의 오인으로 확인됐다.서울 영등포경찰서는 진 의원실 비서 김모씨의 이메일 계정 해킹 의혹에 대해 ""김씨가 페이스북을 이용하면서 본인 이메일 계정에 스스로 접속했다가 발생한 일로 해킹은 없었다""고 25일 밝혔다.경찰에 따르면 김씨는 지난달 20일 페이스북에 로그인해 '친구 찾기' 기능을 쓰려고 자신의 네이버 이메일 아이디와 비밀번호를 입력했다가 네이버로부터 싱가포르에서의 접속이 인지됐다는 경고 문구를 받았다.김씨는 이를 보고 제삼자가 싱가포르 서버를 거쳐 자신의 이메일을 해킹한 것으로 여겼으나 사실은 페이스북의 접속 시스템에 따라 김씨 본인이 싱가포르 서버를 이용해 이메일에 접속한 것이었다고 경찰은 전했다.페이스북은 사용자가 계정에 접속할 때 접속이 가장 원활한 인근 국가의 서버를 이용하도록 하고 있다.경찰 관계자는 ""지난주 이러한 수사 결과를 확인해 진 의원실에 우편으로 통보했다""며 ""추가 조사 계획은 없다""고 밝혔다.앞서 진 의원은 지난달 27일 국회 안전행정위원회의 이성한 경찰청장 내정자 인사청문회를 앞두고 신상발언을 통해 ""의원실 이메일이 해킹당했다""며 ""용의자는 휴대전화로 계정에 접속했고 접속 IP는 싱가포르지만 국내에서 우회 접속했을 가능성도 있다""고 주장했다.bryoon@yna.co.kr[이 시각 많이 본 기사]☞방글라데시 8층 건물 붕괴로 최소 124명 사망(종합3보)☞싸이 '젠틀맨' 빌보드 핫100에서 5위로 상승(종합)☞안철수·김무성·이완구 당선…정치지형 급변(종합2보)☞-美야구- 추신수 4타수 2안타…연속출루기록 '34'(종합)☞<4·24 재·보선> '거물급 트리오' 입성…정계개편 신호탄▶ 연합뉴스 모바일앱 다운받기▶ 포토 매거진<저작권자(c)연합뉴스. 무단전재-재배포금지.>"
124,2013-04-25,"통일부, 오전 10시 개성공단 관련 성명 발표",https://news.naver.com/main/read.nhn?mode=LSD&mid=shm&sid1=100&oid=001&aid=0006224207,연합뉴스,"(자료사진)(서울=연합뉴스) 홍지인 기자 = 통일부는 25일 오전 10시 개성공단 문제와 관련한 대변인 성명을 발표한다고 밝혔다.통일부의 한 당국자는 ""개성공단을 이루는 두 축 중에서 북한 측에 대한 성명""이라며 구체적인 문안은 현재 조율 중이라고 밝혔다.북측의 개성공단 통행제한 조치는 이날로 23일째를 맞았다.ljungberg@yna.co.kr[이 시각 많이 본 기사]☞방글라데시 8층 건물 붕괴로 최소 124명 사망(종합3보)☞싸이 '젠틀맨' 빌보드 핫100에서 5위로 상승(종합)☞안철수·김무성·이완구 당선…정치지형 급변(종합2보)☞도르트문트, 레알 마드리드 4-1 완파☞<4·24 재·보선> '거물급 트리오' 입성…정계개편 신호탄▶ 연합뉴스 모바일앱 다운받기▶ 포토 매거진<저작권자(c)연합뉴스. 무단전재-재배포금지.>"
125,2013-04-25,"현오석 ""당장 조치없으면 경제 성장엔진 꺼진다""(종합)",https://news.naver.com/main/read.nhn?mode=LSD&mid=shm&sid1=101&oid=001&aid=0006224094,연합뉴스,"모두발언하는 현오석 부총리    (서울=연합뉴스) 배정현 기자 = 현오석 경제부총리가 25일 오전 서울 여의도 한국수출입은행에서 열린 대외경제장관회의에서 모두발언을 하고 있다. 2013.4.25    doobigi@yna.co.kr대외경제장관회의서 ""신흥경제권 새 성장동력 원천 될 수 있어""(서울=연합뉴스) 차지연 기자 = 현오석 경제부총리 겸 기획재정부 장관은 25일 현재 정부가 빠르게 조치하지 않으면 한국 경제의 성장엔진이 꺼질 수도 있다고 경고했다.현 부총리는 이날 수출입회관에서 열린 대외경제장관회의에서 ""정부가 당장 조처를 하지 않으면 자칫 우리 경제의 성장엔진이 꺼질 수도 있다는 절박한 심정으로 추가경정예산안과 부동산 대책 등을 마련했다""고 말했다.그는 ""최근 IMF에서 세계 경제와 한국 경제의 성장률 전망치를 지난 1월에 이어 잇달아 하향 조정했다""면서 중국 경제 상황의 악화, 엔저 현상, 유로존 채무위기와 미국의 재정절벽을 둘러싼 불확실성 등 어려운 세계 경제 여건을 설명했다.이어 ""한국 경제 역시 고용 없는 성장과 저출산·고령화로 '한강의 기적'이 '멈춰버린 기적'으로 추락하고 있다는 대외 언론의 지적도 있다""고 덧붙였다.현 부총리는 ""선진경제권이 저성장에 직면하면서 성장의 축이 신흥경제권으로 이동 중""이라며 ""대외의존도가 높은 우리에게 신흥경제권이 새 성장동력의 원천, 위기의 돌파구가 될 수 있다""고 언급했다.중국과 브라질 등 브릭스(BRICs) 국가 외에도 중동과 중앙아시아, 중남미, 아프리카 등 유망 신흥시장으로 활동 무대를 다변화하겠다는 뜻을 피력하기도 했다.모두발언하는 현오석 부총리    (서울=연합뉴스) 배정현 기자 = 현오석 경제부총리(오른쪽 두번째)가 25일 오전 서울 여의도 한국수출입은행에서 열린 대외경제장관회의에서 모두발언을 하고 있다. 2013.4.25    doobigi@yna.co.kr그는 지역과 국가별로 다양한 정치·경제 리스크가 있는 신흥경제권 상황에 맞는 '맞춤형 경제협력 전략'을 추진하고, 신흥국 경제성장과 한국경제의 발전에 모두 도움이 되는 '윈-윈 관점'을 견지하겠다고 밝혔다.현 부총리는 해외건설산업에 대해 ""해외 시장을 적극적으로 개척해 위기 때마다 '구원투수' 역할을 충실히 해줬다""면서도 ""수주가 일부 지역에 편중돼 있고, 부가가치가 낮은 도급사업 위주라는 취약점이 있다""고 지적했다.한국 기업 간 '저가·덤핑 수주' 경쟁이 해외 건설 발전을 저해할 수 있다고 우려를 표했다.그는 ""국토부가 마련해 오늘 논의하게 될 '2013년 해외건설 추진계획'은 이런 문제를 해결하고 경쟁력을 끌어올릴 계획이 담긴 매우 시의적절한 것""이라고 평가했다.이어 ""한국 건설사들은 수자원·신도시 건설 등 고부가가치 공사에 주력하고, 신시장을 개척해 수주 포트폴리오를 조정해 나갈 필요가 있다""면서 ""기획과 설계, 공사까지 패키지형으로 진출할 수 있도록 수출입은행과 무역보험공사 등 정책금융의 역할도 강화해야 할 것""이라고 주문했다.charge@yna.co.kr[이 시각 많이 본 기사]☞방글라데시 8층 건물 붕괴로 최소 124명 사망(종합3보)☞싸이 '젠틀맨' 빌보드 핫100에서 5위로 상승(종합)☞朴대통령 ""방미때 '동북아평화협력구상' 논의""(종합2보)☞-프로야구- 나이트 쾌투…넥센 6연승 신바람(종합)☞안철수·김무성·이완구 당선…정치지형 급변(종합2보)▶ 연합뉴스 모바일앱 다운받기▶ 포토 매거진<저작권자(c)연합뉴스. 무단전재-재배포금지.>"
126,2013-04-25,[1보]경찰 테이저건에 맞아 30대 여성 실명 위기,https://news.naver.com/main/read.nhn?mode=LSD&mid=shm&sid1=102&oid=003&aid=0005109647,뉴시스,"【대구=뉴시스】김재욱 기자 = 경찰이 체포과정에서 전기충격기(테이저건)를 사용해 30대 여성이 눈을 맞아 실명될 위기인 것이 뒤늦게 알려졌다.25일 대구경찰청 등에 따르면 24일 새벽 2시30분께 대구 달서구 월성동 한 찜질방 앞 도로에서 인근 지구대 소속 경찰이 출동해 전기충격기를 휘둘러 강모(35·여)씨의 왼쪽 눈이 다쳤다.강씨는 119에 의해 대학병원으로 이송됐지만 실명위기 상태인 것으로 전해졌다.jukim@newsis.com[뉴시스 이시간 핫 뉴스]ㆍ 싸이 ´젠틀맨´ 2주 만에 빌보드 5위 올라ㆍ 대법 ""약혼녀 집서 돌연사 검사, 과로사 아니야""ㆍ 기초단체장조차…민주 ´전패´ 제1야당의 수모ㆍ 40대男, 내연녀 딸 모텔로 불러내서…ㆍ 성매매 미끼 유인해 강도짓…무서운 10대들★ 뉴시스 뉴스, 이젠 네이버 뉴스 스탠드에서도 만나세요★ 손 안에서 보는 세상, 모바일 뉴시스<저작권자ⓒ 공감언론 뉴시스통신사. 무단전재-재배포 금지.>"
127,2013-04-25,"[종합]1분기 GDP성장률 0.9%, 2년來 최고치",https://news.naver.com/main/read.nhn?mode=LSD&mid=shm&sid1=101&oid=003&aid=0005109560,뉴시스,"【서울=뉴시스】정일환 기자 = 우리나라의 1분기 실질 국내총생산(GDP) 성장률이 0.9%를 기록했다. 지난 2011년 1분기 1.3% 이후 2년여만에 가장 높은 수치다.25일 한국은행이 발표한 '2013년 1/4분기 실질 국내총생산(속보)'에 따르면 GDP는 전기대비 0.9% 성장했다. 실질 국내총소득(GDI)도 교역조건 개선에 힘입어 전기대비 1.0% 증가했다.GDP의 경우 일각에서 예상했던 0.5%는 물론 김중수 한은 총재가 지난 11일 금융통화위원회 직후 내놨던 예상치 0.8%도 웃도는 수치다. 특히 지난해 3분기 0.0%, 4분기 0.3%였던 점을 감안하면 경기가 지난해 3분기를 저점으로 완만하게 개선되고 있다는 신호로 해석할 수 있다.예상을 뛰어넘는 성장률을 기록한 것은 민간소비 감소에도 불구하고 건설 및 설비투자, 수출이 증가세로 전환한 덕이 컸던 것으로 분석된다. 민간소비는 내구재와 준내구재 등이 줄면서 0.3% 감소했다. 반면 건설투자는 주거용 건물건설 및 토목건설을 중심으로 2.5%, 설비투자는 기계류와 운송장비가 모두 늘면서 3.0% 늘었다.수출은 석유화학제품을 중심으로 3.2% 증가했고, 수입은 전기기계 및 석유화학제품 등의 수입이 확대되며 2.5% 늘었다.경제활동별로는 농림어업이 감소한 반면 제조업과 건설업, 서비스업은 모두 증가했다.제조업의 경우 석유화학제품과 선박 등이 늘어나면서 1.4%가 증가했고, 건설업은 주거용 건물건설과 토목건설을 중심으로 3.7% 늘었다. 서비스업은 금융보험은 감소한 반면 운수보관, 정보통신, 보건·사회복지가 증가하면서 0.7% 성장했다.whan@newsis.com[뉴시스 이시간 핫 뉴스]ㆍ ""니가 나 대신해!"" 지적장애女 성폭행한 불륜커플ㆍ 정부 ""개성공단 실무회담 거부시 중대조치""ㆍ 신분 속이고 여중생 만난 40대 공무원 ""사랑했다""ㆍ ""몸 치수 재보자""…10대女 상습 성추행 대학생 구속ㆍ ´갤럭시S4´ 오늘 출시…애플 뛰어 넘나★ 뉴시스 뉴스, 이젠 네이버 뉴스 스탠드에서도 만나세요★ 손 안에서 보는 세상, 모바일 뉴시스<저작권자ⓒ 공감언론 뉴시스통신사. 무단전재-재배포 금지.>"
128,2013-04-25,"외교부, 日대사 불러 아베 발언 엄중항의",https://news.naver.com/main/read.nhn?mode=LSD&mid=shm&sid1=100&oid=001&aid=0006224073,연합뉴스,"외교부 청사로 들어서는 벳쇼 日대사    (서울=연합뉴스) 백승렬 기자 = 침략의 역사를 부인하고 야스쿠니(靖國) 신사참배까지 정당화한 아베 신조(安倍晋三) 일본 총리의 발언과 관련해 외교부가 벳쇼 고로(別所浩郞) 주한 일본대사를 초치, 25일 오전 벳쇼 대사가 서울 세종로 외교부청사에 들어서고 있다. 2013.4.25    srbaek@yna.co.kr(서울=연합뉴스) 강병철 기자 = 침략의 역사를 부인하고 야스쿠니(靖國) 신사참배까지 정당화한 아베 신조(安倍晋三) 일본 총리의 발언과 관련해 외교부가 벳쇼 고로(別所浩郞) 주한 일본대사를 조치해 엄중 항의할 예정이다.정부 고위당국자는 25일 ""일본은 과거 오랜 기간 인접국에 피해를 입한 역사가 있고 이 역사는 쉽게 잊힐 수 있는 것이 아니다""면서 ""그럼에도 그것을 바꾸려는 듯한 과격한 동향을 하는 것은 민주진영의 책임있는 국가가 할 태도는 아니다""고 밝혔다.김규현 외교부 1차관은 이날 오전 9시 30분 벳쇼 대사를 외교부청사로 불러 아베 총리의 발언 등 일본의 잘못된 역사인식 문제에 대해 엄중하게 항의하고 우리 정부의 입장을 전달할 예정이다.아베 총리는 전날 일본 국회에서 일부 각료의 야스쿠니 신사참배를 정당화하는 등 과거사를 부정하는 발언을 했다.박근혜 대통령은 일본의 극우화 움직임과 관련, ""역사 인식을 바르게 하는 것을 전제하지 않은 채 미래지향적 관계로 개선하기는 어렵다""면서 ""이것이 원칙""이라고 강조한 바 있다.soleco@yna.co.kr[이 시각 많이 본 기사]☞방글라데시 8층 건물 붕괴로 최소 124명 사망(종합3보)☞싸이 '젠틀맨' 빌보드 핫100에서 5위로 상승(종합)☞안철수·김무성·이완구 당선…정치지형 급변(종합2보)☞-美야구- 추신수 4타수 2안타…연속출루기록 '34'(종합)☞<4·24 재·보선> '거물급 트리오' 입성…정계개편 신호탄▶ 연합뉴스 모바일앱 다운받기▶ 포토 매거진<저작권자(c)연합뉴스. 무단전재-재배포금지.>"
