,날짜,기사 제목,기사 링크,기사 출처,기사 내용
80,2013-04-25,용감한 공무원…새벽 편의점 강도 몸싸움 끝에 검거,https://news.naver.com/main/read.nhn?mode=LSD&mid=shm&sid1=102&oid=001&aid=0006225445,연합뉴스,"편의점 강도 검거한 윤봉규씨    (의정부=연합뉴스) 권숙희 기자 = 25일 새벽 경기도 의정부시에서 편의점 강도를 검거한 윤봉규(35·집배원)씨의 모습. <<지방기사 참조>>    suki@yna.co.kr윤봉규씨 ""공무원으로서 그냥 지나칠 수 없었다""(의정부=연합뉴스) 권숙희 기자 = 30대 우체국 직원이 새벽시간 편의점 두 곳을 돌며 강도짓 한 20대를 추격해 몸싸움 끝에 붙잡았다.광화문 우정사업본부 직원 윤봉규(35)씨는 25일 새벽 일행 3명과 함께 경기도 의정부시의 한 편의점에 들렀다.잠시 뒤 검은색 복면을 쓴 남성이 편의점에 들어왔다.윤씨와 잠깐 눈이 마주친 사이 20대 남성은 재빠르게 흉기로 아르바이트생을 위협, 12만원을 빼앗아 순식간에 달아났다.한눈에도 앳돼 보이는 여성 아르바이트생은 '강도를 당했다'며 울먹였다.윤씨는 곧바로 편의점을 나가 강도를 쫓기 시작했다. 한치의 고민도 없었다고 했다. 윤씨의 지인 3명도 윤씨를 뒤따라 뛰었다.이때부터 추격전이 벌어졌다.코너를 몇 군데 돌자 강도는 흉기를 꺼내 들었다.그러나 윤씨는 강도와 일 대 일 몸싸움을 마다하지 않았다. 윤씨는 흉기를 놓친 강도를 곧 제압했다.출동한 경찰들이 현장에 도착했을 때 이미 강도는 바닥에 엎드려 윤씨에게 손목을 잡힌 채 완전히 붙잡혀 있었다.경찰 조사결과 이 남성은 직전에 인근 편의점에서도 여종업원을 위협, 강도짓을 하려다가 미수에 그친 것으로 드러났다.의정부경찰서는 체포 과정에서 부상을 당한 정모(22·지적장애 2급)씨를 우선 병원에서 치료받게 한 뒤 특수강도 혐의로 입건할 예정이다.윤씨는 최근 디스크 증상으로 휴직계를 내고 물리치료를 받아왔다. 이날도 몸싸움 중에 무리가 와 바로 병원으로 향했다.윤씨는 이날 연합뉴스와의 통화에서 ""공무원으로 근무하면서 자연스레 불의를 그냥 지나치지 말아야 한다는 사명감이 생겼던 것 같다""며 ""당시에는 당연히 쫓아가야 된다고 생각했을 뿐 다른 생각은 하지 못했다""고 소감을 전했다.그는 또 ""운동이라곤 해본 적도 없는데 어디서 힘이 생겼는지 모르겠다""며 ""나쁜 짓을 하긴 했어도 (피의자가) 많이 다치지 않았으면 하는 바람""이라고 덧붙였다.의정부경찰서는 윤씨에게 감사장을 수여할 계획이다.suki@yna.co.kr[이 시각 많이 본 기사]☞방글라데시 8층 건물 붕괴로 최소 124명 사망(종합3보)☞'아이리스 2' 신예 고윤, 김무성 당선자 아들☞개성공단 남북실무회담 제의…정부 ""거부시 중대조치""(종합)☞-美야구- 추신수 4타수 2안타…연속출루기록 '34'(종합)☞朴대통령 ""유전무죄·무전유죄 상용않도록 해달라""▶ 연합뉴스 모바일앱 다운받기▶ 포토 매거진<저작권자(c)연합뉴스. 무단전재-재배포금지.>"
81,2013-04-25,‘입이 고급이라서…’ 고급양주만 훔친 사나이,https://news.naver.com/main/read.nhn?mode=LSD&mid=shm&sid1=102&oid=021&aid=0002152968,문화일보,"비싼 술이 마시고 싶어 대형마트에서 고급양주만을 훔친 30대 남성이 경찰에 붙잡혔다.서울 강서경찰서는 대형마트에서 고급양주를 상습적으로 훔친 혐의(상습절도)로 강모(34) 씨를 구속했다고 25일 밝혔다. 경찰에 따르면 강 씨는 지난 1일부터 18일까지 서울과 경기도 일대 대형마트 8곳에서 623만 원 상당의 양주 24병을 훔친 혐의를 받고 있다.경찰 조사 결과 강 씨는 마트에서 양주를 챙겨 의상 매장 탈의실에 들어간 뒤 양주병에 부착된 도난방지 태그를 제거하고 배낭에 숨겨 마트를 빠져나오는 수법을 썼다. 절도 등 전과 13범인 강 씨는 같은 혐의로 기소돼 징역 1년 6개월을 살다 2년 전 출소한 뒤 일정한 직업 없이 생활한 것으로 드러났다.강 씨는 발렌타인 21년산 등 대형마트 기준으로 한 병당 25만 원 상당의 고급양주들만 골라 훔쳤으며 챙긴 양주 중 일부는 직접 마시고 나머지는 인터넷 중고 사이트에서 판매한 것으로 조사됐다. 또 빈손으로 마트를 빠져나오면 직원의 의심을 받을까 봐 양말 등 저렴한 가격의 상품을 소량 구매하는 치밀함을 보였다고 경찰은 전했다.강 씨는 경찰 조사에서 “양주를 좋아해 마시고 싶었고 남은 건 팔아서 생활비를 벌고 싶었다”고 진술했다.김대종기자 bigpaper@munhwa.com▶<세상 만사-나라 안>중3 소녀 “49세 오빠와 결혼하고 싶어요”▶독일車 ‘단단’, 일본車  ‘안락’… 한국車 하면?▶막장 교도소…女간수 넷, 수감자 자녀 5명 낳아▶<인터넷 유머>야한 낱말 풀이▶전원주 “남편 임종 못지켜 한이 된다”[Copyrightⓒmunhwa.com '대한민국 오후를 여는 유일석간 문화일보' 무단 전재 및 재배포 금지(구독신청:02)3701-5555/모바일 웹:m.munhwa.com)]"
82,2013-04-25,"대법, 통영 女초등생 살해범 사건 파기환송",https://news.naver.com/main/read.nhn?mode=LSD&mid=shm&sid1=102&oid=001&aid=0006225213,연합뉴스,"지난해7월 경남 통영 한아름양의 살해 용의자 김모(44)씨가 통영경찰서로 들어서고 있다. (자료사진)(서울=연합뉴스) 박대한 이신영 기자 = 대법원 3부(주심 박보영 대법관)는 25일 경남 통영에서 등교 중이던 여자 초등학생을 살해한 혐의(강간살인)로 기소된 김모(45)씨에 대한 상고심에서 무기징역에 정보공개 10년, 전자발찌 부착 30년을 선고한 원심을 파기하고 사건을 부산고법으로 돌려보냈다.김씨는 지난해 7월 통영시 산양읍 한 마을에서 등교하던 이웃집 초등생 한모(10)양을 자신의 트럭에 태워 납치한 뒤 집으로 데려가 성폭행을 시도했다.김씨는 한양이 반항하자 노끈으로 목을 졸라 살해한 뒤 시신을 인근 야산에 몰래 묻은 혐의로 구속기소됐다.pdhis959@yna.co.kreshiny@yna.co.kr[이 시각 많이 본 기사]☞개성공단 남북실무회담 제의…정부 ""거부시 중대조치""(종합)☞'아이리스 2' 신예 고윤, 김무성 당선자 아들☞朴대통령 ""유전무죄·무전유죄 상용않도록 해달라""☞-美야구- 추신수 4타수 2안타…연속출루기록 '34'(종합)☞정부, 日대사 초치…""일그러진 역사인식 강력유감""(종합)▶ 연합뉴스 모바일앱 다운받기▶ 포토 매거진<저작권자(c)연합뉴스. 무단전재-재배포금지.>"
83,2013-04-25,대학등록금 평균 667만8천원…3만1천원 '찔끔' 인하(종합),https://news.naver.com/main/read.nhn?mode=LSD&mid=shm&sid1=100&oid=001&aid=0006225327,연합뉴스,"너무 비싼 등록금 '한숨만 가득'    (서울=연합뉴스) 안정원 기자 = 한국대학생연합 소속 대학생들이 지난 14일 서울 종로구 청운동사무소 앞에서 기자회견을 열고 박근혜 대통령에게 반값 등록금 공약이행을 촉구하고 있다. (자료사진)    jeong@yna.co.kr전년 인하율의 10분의 1수준(서울=연합뉴스) 구정모 기자 = 전국 4년제 대학의 2013학년도 등록금이 평균 0.46% 내렸다. 전년도 인하율의 10분의 1 수준이다. 수도권 대학의 등록금은 평균 750만원을 넘어 학부모들의 부담이 여전하다.25일 교육부와 한국대학교육협의회가 전국 4년제 일반대학 173개교의 주요 공시내용을 분석한 결과를 보면 173개 4년제 일반대학의 2013학년도 연간 평균 등록금은 667만8천원으로 전년(670만9천원)보다 3만1천원(0.46%) 인하됐다.2012학년도 등록금 인하율은 4.3%였다. 2년 연속 대학의 등록금 인하가 이어졌으나 이번 학년도 인하율은 전년의 10분의 1 수준으로 떨어졌다.사립대 등록금의 인하율이 0.47%로 국·공립대의 인하율 0.19%보다 컸다. 하지만 절대 액수에서 사립대는 733만9천원으로 국·공립대 409만6천원의 1.8배나 됐다.지역별로 수도권 대학 등록금은 평균 759만3천원, 비(非)수도권은 621만9천원으로 전년보다 각각 0.73%, 0.30% 내렸다.대학별로는 을지대의 평균 등록금이 852만1천원으로 가장 비쌌다. 이어 연세대(850만7천원), 한국항공대(847만6천원), 이화여대(840만6천원), 추계예술대(838만7천원) 순이었다.가장 싼 대학은 중앙승가대로 168만원에 불과했다. 을지대의 5분의 1 밖에 되지 않았다.국·공립대 가운데 한밭대(445만4천원), 경북대(428만9천원), 강릉원주대(426만5천원) 등이 등록금이 비쌌다. '반값 등록금'이 도입된 서울시립대는 238만6천원이었다.이번 학년도에 등록금 인하율이 가장 높은 대학은 칼빈대였다. 전년 700만2천원에서 이번에 664만1천원으로 5.2%나 내렸다. 안양대(-4.9%), 총신대(-4.7%), 성신여대(-4.6%), 대진대(-3.0%) 등도 등록금 인하 노력을 많이 했다.이들 대학을 비롯해 135개교가 등록금을 인하했고, 19개교가 동결했다. 9개교는 명목 등록금이 동결됐으나 평균 등록금 산출공식에 따라 0∼1% 가량 인상된 것으로 나타났다.<그래픽> 2013년 대학 등록금 현황    (서울=연합뉴스) 이재윤 기자 = 25일 교육부와 한국대학교육협의회가 전국 4년제 일반대학 173개교의 주요 공시내용을 분석한 결과를 보면 173개 4년제 일반대학의 2013학년도 연간 평균 등록금은 667만8천원으로 전년(670만9천원)보다 3만1천원(0.46%) 인하됐다.    yoon2@yna.co.kr    @yonhap_graphics(트위터)이른바 '학점 인플레' 현상은 약간이나마 개선됐다.지난해 8월과 올해 2월에 졸업한 학생들의 성적분포를 보면 A학점 33.2%, B학점 56.8%으로 B학점 이상 받은 이들의 비율이 90.0%에 달했다. 전년과 비교하면 0.3%포인트 감소했다. A학점 비율은 0.7%포인트 줄었으나 B학점 비율은 0.4% 포인트 늘었다.학점 인플레는 사립대보다 국·공립대가 더 심했다. 국·공립대 졸업생의 B학점 이상 취득비율은 94.2%로 전년보다 0.3% 포인트 늘었다. 사립대는 88.8%로 국·공립대보다 비율이 낮을 뿐 아니라 전년과 비교해서도 0.4% 포인트 감소했다.대학별로 보면 금강대, 차의과학대, 영산선학대 졸업생은 모두 B학점 이상 학점을 받았다. 한국교원대(99.5%), 서울신학대(99.4%), 한동대(99.3%), 목포가톨릭대(99.3%), 한국외국어대(99.2%) 등도 B학점 이상 비율이 100%에 가까웠다.2012학년도 재학생이 B학점 이상 받은 비율은 71.9%로 전년보다 1.1% 포인트 감소했다. 국·공립대 73.3%, 사립대는 71.6%로 모두 1.2% 포인트, 1.0%포인트 줄었다.올해 1학기 개설된 총 강좌수는 29만3천342건으로 지난해보다 1.8% 늘었다.특히 20명 이하 소규모 강좌비율이 37.6%로 1.7%포인트 증가했다. 이 비율은 2010년 30.4%에서 2011년 30.6%, 지난해 35.9%로 최근 늘어나는 추세다.이와 달리 51명 이상 대규모 강좌는 이번 1학기에 16.8%로 전년보다 1.2%포인트 감소했다. 교육부는 대학 강의의 질 개선 노력이 지속됨에 따라 소규모 강좌가 증가하고 중대규모 강좌가 감소하고 있다고 설명했다.전임교원의 강의담당 비율은 58.4%로, 전년보다 3.1% 포인트 증가했다. 국·공립대는 56.3%, 사립대 58.9%로, 전임교원 비율은 국·공립대가 사립대보다 낮았다.자세한 공시내용은 '대학알리미(www.academyinfo.go.kr)에서 확인할 수 있다.pseudojm@yna.co.kr[이 시각 많이 본 기사]☞방글라데시 8층 건물 붕괴로 최소 124명 사망(종합3보)☞'아이리스 2' 신예 고윤, 김무성 당선자 아들☞개성공단 남북실무회담 제의…정부 ""거부시 중대조치""(종합)☞-美야구- 추신수 4타수 2안타…연속출루기록 '34'(종합)☞朴대통령 ""유전무죄·무전유죄 상용않도록 해달라""▶ 연합뉴스 모바일앱 다운받기▶ 포토 매거진<저작권자(c)연합뉴스. 무단전재-재배포금지.>"
84,2013-04-25,"일본 ""역사인식 문제 외교·정치 쟁점화 원치 않아""",https://news.naver.com/main/read.nhn?mode=LSD&mid=shm&sid1=104&oid=001&aid=0006225184,연합뉴스,"일본 ""역사인식 문제 외교·정치 쟁점화 원치 않아""    (교도=연합뉴스) 일본 정부 대변인격인 스가 요시히데(菅義偉) 관방장관은 25일 정례 회견에서 ""단편적인 발언이 아니라 전체적인 톤을 보고 우리의 역사 인식을 평가해달라""며 역사갈등 진화를 시도했다. 사진은 지난 11일 기자회견 모습. 2013.4.25 <<국제뉴스부 기사 참조>>    chungwon@yna.co.kr관방장관 회견…""전체 톤 보고 역사인식 평가해달라""(도쿄=연합뉴스) 이충원 특파원 = 일본 아베 신조(安倍晋三) 총리의 침략 부인 발언 등으로 외교 갈등이 불거지자 일본 정부 대변인격인 관방장관이 ""단편적인 발언이 아니라 전체적인 톤을 보고 우리의 역사 인식을 평가해달라""며 진화를 시도했다.스가 요시히데(菅義偉) 관방장관은 25일 오전 정례 회견에서 ""야스쿠니 신사 참배 문제가 일본의 중요한 인접국인 한국·중국과의 관계 전체에 영향을 주는 것은 원하지 않는다""며 ""역사 인식 문제를 외교·정치 쟁점화하는 것은 바라지 않고 있다""고 밝혔다.스가 장관은 아소 다로(麻生太郞) 부총리 등의 야스쿠니 신사 참배에 대해 ""어느 나라든 국가를 위해서 목숨을 바친 분들에게 존경의 뜻을 표시하는 것은 당연한 일""이라고 옹호한 뒤 곧바로 ""대국적인 관점에 따라 한국, 중국과의 관계를 강화하겠다""고 덧붙였다.역사 인식과 관련해서는 ""'우리나라가 아시아 국가에 큰 손해와 고통을 줬고, 국내외의 모든 희생자에게 애도의 뜻을 표시한다는 입장은 이전 내각과 마찬가지""라며 ""단편적인 발언이 아니라 전체적인 톤을 보고 우리의 역사 인식을 판단하길 바란다""고 설명했다.스가 장관은 또 5월로 예정된 한·중·일 정상회담에 대해 ""아직 (회담이) 정식으로 연기됐다는 보고는 받지 못했다""며 ""의장국인 한국이 조정하고 있을 것""이라고 말했다.chungwon@yna.co.kr[이 시각 많이 본 기사]☞개성공단 남북실무회담 제의…정부 ""거부시 중대조치""(종합)☞'아이리스 2' 신예 고윤, 김무성 당선자 아들☞朴대통령 ""유전무죄·무전유죄 상용않도록 해달라""☞이시영 상대 체육관 ""패배 인정못해…연맹 항의검토""☞<2주만에 다시 대화제의…北거부시 강경대응 예고>▶ 연합뉴스 모바일앱 다운받기▶ 포토 매거진<저작권자(c)연합뉴스. 무단전재-재배포금지.>"
85,2013-04-25,'도가니' 인화학교 前행정실장 징역 8년 확정,https://news.naver.com/main/read.nhn?mode=LSD&mid=shm&sid1=102&oid=001&aid=0006225244,연합뉴스,"광주시광산구 삼거동 인화학교 정문(자료사진)(서울=연합뉴스) 박대한 이신영 기자 = 영화 '도가니'에 등장하는 성폭행 장면의 실제 인물인 인화학교 전 행정실장이 상고심에서 징역 8년이 확정됐다.대법원 3부(주심 박보영 대법관)는 25일 장애학생을 성폭행하고 이를 목격한 다른 학생을 폭행한 혐의(강간치상, 집단·흉기 등 상해)로 기소된 인화학교 전 행정실장 김모(65)씨에 대한 상고심에서 상고를 기각하고 징역 8년에 전자발찌 부착 10년, 정보공개 10년을 선고한 원심을 확정했다.김씨는 2005년 4월께 인화학교 행정실에서 언어장애와 정신지체 장애가 있는 A(당시 18세)씨의 손발을 끈으로 묶고 성폭행한 혐의로 기소됐다.김씨는 이 장면을 목격한 B(당시 17세)씨를 사무실로 끌고 가 깨진 음료수 병과 둔기로 폭행한 혐의도 추가됐다.1심은 김씨에게 징역 12년을 선고했지만 2심은 징역 8년으로 형량을 낮췄다.pdhis959@yna.co.kreshiny@yna.co.kr[이 시각 많이 본 기사]☞개성공단 남북실무회담 제의…정부 ""거부시 중대조치""(종합)☞'아이리스 2' 신예 고윤, 김무성 당선자 아들☞朴대통령 ""유전무죄·무전유죄 상용않도록 해달라""☞-美야구- 추신수 4타수 2안타…연속출루기록 '34'(종합)☞정부, 日대사 초치…""일그러진 역사인식 강력유감""(종합)▶ 연합뉴스 모바일앱 다운받기▶ 포토 매거진<저작권자(c)연합뉴스. 무단전재-재배포금지.>"
86,2013-04-25,"대법, 통영 女초등생 살해범 사건 파기환송",https://news.naver.com/main/read.nhn?mode=LSD&mid=shm&sid1=102&oid=008&aid=0003037182,머니투데이,"[머니투데이 이태성 기자]대법원 3부(주심 박보영 대법관)는 25일 경남 통영에서 여자 초등학생을 성폭행하려다 살해한 혐의(강간등살인)로 기소된 김모씨(46)에게 무기징역을 선고한 원심을 파기했다.김씨는 지난해 7월 통영 산양읍에서 등교하던 A양(당시 10세)을 트럭에 태워 납치한 후 성폭행하려다 A양이 반항하자 살해하고 시신을 암매장한 혐의로 구속기소됐다.1·2심 재판부는 ""이웃집 소녀를 성폭행하려다가 목 졸라 죽이는 등 죄질이 극히 불량한데다 돌이킬 수 없는 결과를 초래했다""며 김씨에게 무기징역을 선고했다.[머니투데이 핫뉴스]☞고두림, 교복셀카 ""단추 잠그기 너무 힘들어""☞美 '테러범 형제' 만든건 엄마? 드러난 가정사☞2PM측 ""도쿄돔 공연사진논란 사과, 관객수는 맞다""☞'올해만 몇 쌍이야?' 조인성·김민희, ★커플 합류☞전주 공장폭발, 누리꾼 제보로 심각성 알려▶ 핫포토 갤러리이태성기자 lts320@<저작권자 ⓒ '돈이 보이는 리얼타임 뉴스' 머니투데이, 무단전재 및 재배포 금지>"
87,2013-04-25,"현대차, 더 팔고도 못벌었다…1Q 영업익 10% 줄어(상보)",https://news.naver.com/main/read.nhn?mode=LSD&mid=shm&sid1=101&oid=277&aid=0002986466,아시아경제,"매출액 21조3671억, 영업익 1조8685억전년 대비 매출 6.0%↑, 영업익 10.7%↓[아시아경제 조슬기나 기자]엔저 쇼크, 내수부진, 생산차질 등 삼중고가 현대자동차의 발목을 잡았다. 올 1분기 현대자동차가 글로벌 시장에서 작년 같은 기간보다 더 많은 차를 판매해 매출을 늘리고도 정작 수익은 벌어들이지 못했다.현대차는 25일 서울 양재동 본사에서 열린 2013년 1분기 경영실적 컨퍼런스콜을 통해 ▲판매 117만1804대 ▲매출 21조3671억원(자동차 17조6631억원, 금융 및 기타 3조 7040억원) ▲영업이익 1조8685억원 ▲경상이익 2조7441억원 ▲당기순이익 2조878억원(비지배지분 포함)을 기록했다고 밝혔다.지난해 같은 기간보다 판매와 매출은 각각 9.2%, 6% 늘었지만, 영업이익과 당기순이익은 각각 10.7%, 14.9% 줄었다. 현대차의 1분기 영업이익은 증권업계의 평균추정치(컨센서스)인 1조9000억원대를 소폭 하회하는 수준이다.영업이익률 또한 8.7%로 작년 동기(10.4%)대비 1.7% 포인트 떨어졌다. 현대차의 분기 영업이익률은 작년 2분기에 11.6%로 사상 최고치를 기록한 이후 내리막길을 걸으며, 4분기부터 한 자릿수로 떨어진 상태다.노동조합의 특근 거부에 따른 생산차질, 미국 시장 리콜 등 여러 악재가 겹쳤지만, 1분기 성적표의 주요 부진 이유는 바로 환율 영향으로 풀이된다. 1분기 원ㆍ달러 평균 환율은 1085원으로 작년 연간 평균치(1172원)를 밑돌았다. 또한 지난해 미국 시장에서의 리콜 사태가 정리되지 않은 상태에서 엔저를 앞세운 일본차 업체의 약진은 글로벌 시장에서 현대차의 부진으로 연결되고 있다.현대차 관계자는 ""매출은 늘었지만, 휴일 특근 감소 등에 따른 국내공장 생산 감소로 가동률이 하락하고 원화약세로 인한 판매관련 비용이 늘어난 영향으로 영업이익은 감소했다""고 설명했다.현대차는 올해 1분기 글로벌 시장에서 117만1804대를 판매했다. 국내 시장에서는 소비심리 위축에 따른 수요 부진으로 전년 동기대비 0.7% 줄어든 15만3728대를 판매했지만, 해외 시장에서 10.9% 늘어난 101만8076대를 팔며 국내 감소분을 만회했다. 국내 공장의 휴일 특근감소로 인한 국내 공장 생산량 감소분 또한 해외공장에서의 생산 증량이 만회했다.매출원가율은 플랫폼 통합 효과에도 불구하고, 생산차질에 따른 국내공장 가동률 저하로 작년보다 1.0% 포인트 증가한 78.0%를 기록했다.영업부문 비용은 2조8358억원으로 작년 말 대비 원화약세(기말기준) 영향과 일회성 충당금 발생 등에 따라 판매보증충당금이 늘어나며 작년 동기 대비 11.3% 증가했다. 매출액 대비 영업비용 비중도 작년 동기대비 0.7% 포인트 증가한 13.3%를 기록했다.현대차 관계자는 ""계속된 내수 부진 속에서 휴일 특근 감소로 국내공장 생산량까지 감소하며 고정비 비중이 증가했다""며 ""다만 중국, 브라질 등 주요 시장에서 판매 호조를 바탕으로 국내공장 생산판매 회복과 원달러 환율 안정이 이뤄질 경우, 향후 실적 개선을 기대할 수 있을 것""이라고 설명했다.현대차는 미국 등 선진국의 경기회복세 지연으로 향후 수요 성장세가 올 초 예상치보다 둔화될 것으로 내다봤다. 유럽 등 주요 자동차 시장의 수요가 감소세를 보이고 있는데다, 자동차 산업의 성장 동력으로 주목 받던 신흥 시장의 수요마저 위축되고 있기 때문이다.특히 엔화 약세를 활용한 일본 경쟁사들의 공격적인 시장 확대 정책으로 자동차산업을 둘러싼 불확실성이 장기화 될 전망이다.현대차 관계자는 ""특화된 현지 전략차종의 출시, 딜러 및 서비스 네트워크 강화, 적극적인 현지 마케팅 등을 통한 질적 성장에 주력할 방침""이라며 ""향후에도 무리한 외형 확장보다 수익성위주의 경영을 추진할 것""이라고 강조했다.[모바일] 더욱 빠르고 편리하게 만나는 실시간 모바일 뉴스[루머&진실] 증권시장에서 떠도는 루머를 파헤쳐드립니다조슬기나 기자 seul@<ⓒ세계를 보는 창 경제를 보는 눈, 아시아경제(www.asiae.co.kr) 무단전재 배포금지>[관련기사]재벌가 며느리 '노현정' 잘 사나했더니…'충격'""돌연 결혼한다는 '장윤정' 이상하다 했더니만""'한혜진-기성용' 열애 터지더니 한달만에 '이럴수가'갑부와 결혼했단 '한현정' 정말 이상하더니…'충격'""사귄다는 '조인성-김민희' 어쩐지 이상하더니"""
88,2013-04-25,사당동서 수학여행 버스 추돌…학생 26명 경상,https://news.naver.com/main/read.nhn?mode=LSD&mid=shm&sid1=102&oid=001&aid=0006225155,연합뉴스,"(서울=연합뉴스) 김아람 기자 = 25일 오전 10시4분께 서울 동작구 사당동 남부순환로에서 부산 부흥중학교 2학년 수학여행단을 태운 관광버스 2대가 추돌하는 사고가 났다.이 사고로 학생 26명이 가벼운 상처를 입고 인근 병원에서 치료를 받고 있다.사고 버스 두 대에는 학생과 인솔교사 등 총 74명이 타고 있었다. 버스는 서울대로 가는 길이었다.경찰은 앞서가던 버스가 건널목에서 속도를 줄이자 뒤따르던 버스가 들이받은 것으로 보고 정확한 사고 원인을 조사하고 있다.rice@yna.co.kr[이 시각 많이 본 기사]☞방글라데시 8층 건물 붕괴로 최소 124명 사망(종합3보)☞싸이 '젠틀맨' 빌보드 핫100에서 5위로 상승(종합)☞개성공단 남북실무회담 제의…정부 ""거부시 중대조치""(종합)☞-美야구- 추신수 4타수 2안타…연속출루기록 '34'(종합)☞개성공단 실무회담 제의…정부 ""거부시 중대조치""(3보)▶ 연합뉴스 모바일앱 다운받기▶ 포토 매거진<저작권자(c)연합뉴스. 무단전재-재배포금지.>"
