,날짜,기사 제목,기사 링크,기사 출처,기사 내용
118,2013-04-12,'성추문 검사' 징역 2년 법정구속(1보),https://news.naver.com/main/read.nhn?mode=LSD&mid=shm&sid1=102&oid=001&aid=0006200886,연합뉴스,"여성피의자와 부적절한 성관계를 가진 혐의(뇌물수수 및 직권남용권리행사방해)로 불구속 기소된 전모(32) 전 검사(자료사진)(서울=연합뉴스) 이상현 기자 = 여성 피의자와 부적절한 성관계를 가진 혐의(뇌물수수 및 직권남용권리행사방해)로 불구속 기소된 전모(32) 전 검사에게 법원이 징역 2년의 실형을 선고하고 법정구속했다.[이 시각 많이 본 기사]☞""북한 미사일 발사는 시간문제""<접경지역 소식통>☞싸이 신곡 '젠틀맨', 나오자마자 1위 석권☞<'인천 길고양이들의 참변' 목격자를 찾습니다>☞-마스터스골프- 최경주, 1라운드 순조로운 출발(종합)☞삼성, 6.3인치 갤럭시 메가 공개…국내 출시계획 없어<연합뉴스 모바일앱 다운받기><포토 매거진><저작권자(c)연합뉴스. 무단전재-재배포금지.>"
119,2013-04-12,"여야, '제왕적 대통령제' 개헌 논의한다",https://news.naver.com/main/read.nhn?mode=LSD&mid=shm&sid1=100&oid=008&aid=0003029169,머니투데이,"[머니투데이 김성휘 기자][(종합)""산발적 논의 부담, 개헌특위는 나중에""..공약입법 6월 마무리 짓기로]새누리당과 민주통합당이 국회에 개헌 논의기구를 구성하기로 12일 합의했다. 대통령 4년 중임제를 비롯, 대통령 권한을 분산·조정하는 방향의 개헌 논의가 각 당 내부 논의를 넘어 국회 차원에서 속도를 낼지 주목된다.양당은 이날 오전 국회에서 양당 대표와 원내대표, 정책위의장이 참석하는 '6인 정책협의체' 첫 회의를 열고 이같이 합의했다. 변재일 민주통합당 정책위의장과 나성린 새누리당 정책위의장은 회의 후 브리핑을 통해 ""개헌 필요성에 공감하고 산발적 논의의 부작용을 막기 위해 개헌 기구를 여야 원내대표간 논의를 통해 구성키로 했다""고 밝혔다.양 정책위의장은 그러나 이 논의기구가 개헌특위는 아니라고 선을 그었다. 특위 설치여부는 개헌 논의기구의 진전 상황에 따른 이후 과제로 남겼다. 양측이 비교적 쉽게 개헌논의에 합의한 것은 각 당과 의원별로 서로 다른 개헌논의가 불거질 경우 오히려 개헌 공론을 모으기 어려울 수 있다는 지적 때문으로 보인다. 19대 국회 내 대표적 개헌론자인 우윤근 민주당 의원은 이미 여야 의원 서명을 받고 토론회를 개최하는 등 개헌 공론화에 적극적이다.한편 6인 협의체는 양당의 대선공약 관련 83개 법안들은 오는 6월 말까지 처리키로 합의했다. 이를 위해 관련 법안들은 4월 임시국회에서 우선 심의키로 했다.현재 정부가 추진 중인 부동산과 추가경정예산 논의를 위해서는 여·야·정 3각 협의체를 구성하여 다음 주부터 논의를 갖는다. 당장 월요일인 15일 오전엔 부동산정책, 17일엔 추경 관련 여야정 협의체가 열릴 예정이다.국민연금 및 비정규직 관련 법안은 그 특성상 여러 상임위에 분산돼 있으므로 양당 정책위의장이 각각 지명하는 2명으로 태스크포스(TF)를 만들어서 합의를 추진하기로 했다. 정책정당 기반을 확충하겠다며 정당연구소의 합리적 발전방안에 대해서도 관련 법안을 마련하기로 했다.이밖에 정부조직법 개편 과정서 여야가 합의한 검찰개혁 등 사법개혁 과제는 국회 법제사법위와 사법개혁특위에서 각각 논의하기로 했다. 사법개혁 논의를 이처럼 병행하는 이유는 사개특위를 주장하는 새누리당과 법사위를 요구하는 민주당의 입장이 충돌한 끝에 제시된 절충방안이다.협의체는 6인 구성으로 월 1회 정례회의를 열되 필요한 경우 수시로 회의를 열기로 했다. 양당은 추가경정예산안 편성 필요성에는 공감한다면서도 세입결손에 대해서는 이견이 있는 만큼 구체적 내용을 검토하기로 했다.부동산대책 관련, 부동산 거래위축으로 인한 서민경제 어려움에 공감하고 구체적 대책마련에 들어가기로 합의했다. 정부조직법 통과 과정의 여야 합의사항은 이행상황을 점검하고 미진한 부분을 협의체에서 논의하기로 했다.이렇게 협의체에서 합의된 정책의제는 소관 상임위로 옮겨 논의하도록 했다. 단 상임위에서 이견이 있거나 합의가 어려운 경우 정책위의장 논의를 거쳐서 6인 협의체에서 협의하기로 했다.황우여 새누리당 대표는 인삿말에서 ""공약을 중심으로 잘 검점해서 양당이 일치되는 것부터 발맞춰 조속히 입법하고, 어려움이 있으면 계속 노력해서 간극을 좁혀 합의되는 국회를 만들었으면 한다""고 말했다.문희상 민주당 비대위원장은 ""국회 선진화법에 따라 모든 법안의 통과를 밟으려면 어차피 여야 합의하는 순서가 필수""라며 ""첫술에 배부를 리 없지만 시작이 반이라는 속담도 있다""고 말했다.[머니투데이 핫뉴스]☞""전쟁 나면… 은행에 맡긴 돈 어쩌지?""☞내년 출시 'LF쏘나타', YF처럼 파격디자인?☞남자3호 ""연봉 8000만원, 6개월 일하고 2달 휴가""☞'피소'이영애측 ""법적대응 고민中""☞GS건설 어닝쇼크… 증권업계 ""신뢰는 없다""▶ 핫포토 갤러리김성휘기자 sunnykim@<저작권자 ⓒ '돈이 보이는 리얼타임 뉴스' 머니투데이, 무단전재 및 재배포 금지>"
120,2013-04-12,학교 옥상서 고3 '투신하겠다' 소동(종합),https://news.naver.com/main/read.nhn?mode=LSD&mid=shm&sid1=102&oid=001&aid=0006200838,연합뉴스,"모의고사 성적 때문인듯…1시간 대치하다 내려와(서울=연합뉴스) 고상민 기자 = 12일 오전 10시 40분께 서울 강남구에 있는 한 고등학교에서 고3 수험생이 1시간 가량 투신 소동을 벌였다.경찰에 따르면 이 학교에 재학하는 김모(18)군은 이날 학교 건물 6층 옥상에 올라가 뛰어내리겠다며 소동을 벌였다.학교 측은 즉시 소방당국에 신고했고 출동한 119구조대는 지면에 매트리스를 깔고 만약의 사태에 대비했다.김군은 경찰, 소방당국, 학교 관계자들과 1시간 정도 대치하다 안전하게 건물 아래로 내려왔다.김군은 이날 아침 부모에게 `평소와 달리' ""안녕히 계십시오""라는 인사를 하고 등교했고 이를 이상히 여긴 김군의 아버지가 오전에 학교를 찾아와 담임교사를 만난 것으로 전해졌다.김군은 교사와 상담을 하던 중 좁은 창문을 통해 옥상으로 올라간 것으로 알려졌다.학교 관계자는 ""김군이 전날 치른 모의고사 성적 때문에 비관한 것으로 보인다""며 ""학교 폭력과는 전혀 상관없는 일""이라고 말했다.현장에 있던 경찰 관계자는 ""상담교사와 아버지의 설득 끝에 김군이 무사히 내려왔다""고 말했다.gorious@yna.co.kr[이 시각 많이 본 기사]☞""북한 미사일 발사는 시간문제""<접경지역 소식통>☞싸이 신곡 '젠틀맨', 나오자마자 1위 석권☞<'인천 길고양이들의 참변' 목격자를 찾습니다>☞-마스터스골프- 최경주, 1라운드 순조로운 출발(종합)☞미국 ""북한, 미사일 탑재 가능 핵무기 보유 가능성""<연합뉴스 모바일앱 다운받기><포토 매거진><저작권자(c)연합뉴스. 무단전재-재배포금지.>"
121,2013-04-12,기업 10곳 중 7곳 대체휴일 도입 ‘찬성’,https://news.naver.com/main/read.nhn?mode=LSD&mid=shm&sid1=102&oid=018&aid=0002761173,이데일리,"- 64.4% “제도 도입 시 즉시 시행”- 사람인 1101개 기업 설문조사[이데일리 김정민 기자] 정부가 공휴일과 주말이 겹칠 경우 월요일 휴무를 의무화하는 ‘대체휴일제’ 도입을 추진 중이다. 롯데백화점이 연차를 활용한 대체휴일제를 시행하기로 하는 등 산업계에도 대체휴일제 도입 움직임이 가시화되고 있다. 실제 기업 10곳 중 7곳은 제도 도입에 긍정적인 것으로 나타났다.온라인 취업포털 사람인이 1101개 기업을 대상으로  대체휴일제 도입에 대한 의견을 조사한 결과, 70.8%가 ‘찬성한다’고 답했다. 기업 규모별로는 ‘대기업’(96.7%), 업종별로는 ‘금융·보험’(94.4%)에서 찬성 비율이 가장 높았다. 반면 ‘중소기업’(68.3%)과 ‘자동차·운수’(53.9%), ‘기계·철강’(55.9%), ‘제조’(62.3%)업의 찬성 비율은 상대적으로 낮았다.찬성하는 이유로는 ‘직원들의 삶의 질을 높일 수 있어서’(66.2%, 복수응답)를 첫 번째로 꼽았다. 이어 ‘직원들의 사기를 진작시킬 수 있어서’(56.7%), ‘업무 분위기가 개선될 수 있어서’(30.4%), ‘과도한 근로시간을 줄여줄 수 있어서’(29.6%), ‘노동 생산성이 높아질 수 있어서’’(21.8%), ‘직원들이 원하고 있어서’(21.8%) 순으로 나타났다.도입을 반대하는 기업 321개사는 ‘업무에 차질이 생길 수 있어서’(64.5%, 복수응답)를 1순위로 선택했다. 다음으로 ‘현실성이 떨어지는 제도라서’(34.9%), ‘인건비가 상승할 수 있어서’(27.7%), ‘휴일 근무 수당이 증가할 수 있어서’(24.6%) 등을 반대 이유로 들었다.실제 도입 여부에 대해서는 ‘정부에서 시행하면 바로 도입할 계획’이라는 응답이 64.4%로 가장 많았다. ‘정부에서 시행하더라도 최대한 미룰 계획’이라는 답변이 31.1%를 차지했다. 반면 ‘정부에서 시행 전 미리 도입할 계획’이라는 응답(4.5%)도 있었다.김정민 (jmkim@edaily.co.kr)[관련기사]☞ 98%가 틀리는 문제, 어려워 보이지만 막상 풀어 보면...☞ '北미사일 공격용 아니다'…무수단은 요격 불가☞ `박 대통령 개성공단 영원히 폐쇄 해야`-WSJ☞ 北 미사일 쏜다면 '오전 중'일 가능성 높아☞ [알아두세요]“회사서 짤렸다”..믿을 건 실업급여 뿐▶ 당신의 생활 속 언제 어디서나 이데일리 ‘신문 PDF바로보기‘▶ 스마트 경제종합방송이데일리 TV▶ 실시간 뉴스와 속보 ‘모바일 뉴스 앱’ | 모바일 주식 매매 ‘MP트래블러Ⅱ’▶ 전문가를 위한 국내 최상의 금융정보단말기 ‘이데일리 마켓포인트 2.0’▶ 증권전문가방송 '이데일리 ON', 고객상담센터 1666-2200 |종목진단/추천 신규오픈＜ⓒ종합 경제정보 미디어 이데일리 - 무단전재 & 재배포 금지＞"
122,2013-04-12,'맥주 맛' 둘러싼 주세법 개정 논란..업체간 공방 '치열',https://news.naver.com/main/read.nhn?mode=LSD&mid=shm&sid1=101&oid=018&aid=0002761209,이데일리,"- 홍종학 의원 주최 '주세법 개정 간담회'- 하우스맥주 업체 ""다양한 맥주 맛 위해 법개정 필수""- 대형 맥주업체 ""조세정책 일관성 유지해야""[이데일리 정재웅 기자] “국민들이 다양한 맛의 맥주를 즐기기 위해서는 현행 주세법이 개정돼야 한다”“중소기업 육성이라는 명목하에 일관된 조세정책이 훼손돼서는 안된다”작년 말 영국 이코노미스트誌에서 촉발된 국내 ‘맥주 맛’ 논란이 여전히 뜨겁다.일각에서는 오비맥주와 하이트진로(000080)가 국내 맥주 시장을 사실상 과점하고 있는 상황에서 중소 하우스맥주 업체들을 집중 육성, 국민들에게 다양한 맥주 맛을 선보여야 한다고 주장하고 있다. 반면, 다른 한쪽에서는 대규모 장치 산업인 맥주산업에 중소업체들이 무분별하게 뛰어들어 실패를 거듭한다면 국가적인 손실이라고 반박하고 있다.홍종학 민주통합당 의원은 12일 서울 여의도 국회의원회관에서 ‘대-중소기업 상생과 맥주산업 발전을 위한 주세법 개정 간담회’를 개최했다. 이 자리에서 대형 맥주업체와 중소형 하우스맥주 업체들은 주세법 개안을 둘러싸고치열한 공방을 벌였다.우선 중소형 하우스맥주 업체들은 현재의 주세율을 인하해야 한다는 입장이다. 가뜩이나 각종 시설비용 부담 등으로 어려운 상황에서 대형 맥주업체들과 동일한 주세율을 부과하는 것은 하우스맥주 업체들을 고사시키는 것이라는 주장이다. 이는 결국 다양한 맥주 맛을 원하는 소비자들의 요구를 충족시키지 못하는 결과를 초래한다는 의견이다.차보윤 한국마이크로브루어리협회 대표는 “현재 소규모 제조 맥주에 적용되는 주세율은 대형 맥주 제조업체와 동일한 종가세 형태”라며 “대형 맥주 회사와 달리, 소규모 맥주 제조업체의 경우 연간 한정된 생산량 때문에 리터당 주세는 대형 맥주 제조업체에 비해 약 200~최고 350% 이상 납부하고 있는 실정”이라고 밝혔다.이어 “이를 해소하기 위해서는 생산량 혹은 용기규정에 따른 합리적인 주세율의 차등적용이 필요하다”면서 “독일의 경우도 생산량에 따른 차등 세율을 적용하고 있고 일본도 대규모 생산 공장이나 소규모 제조 맥주업체나 공히 리터당 220엔으로 과세의 형평성을 실현하고 있다”고 강조했다.반면, 대형 맥주업체들의 의견은 다르다. 국내 맥주 시장에 대한 정확한 정보와 분석없이 중소형 하우스 맥주업체들이 무분별하게 난립할 경우, 여러가지 부작용이 발생할 수 있다며 주세법 개정에 대한 반대입장을 명확히 했다.서정록 한국주류산업협회 이사는 “시설 기준 완화가 반드시 중소업체 활성화로 이어지는 것은 아니다”면서 “소비자의 인지도를 확보하지 못한 중소업체의 제품 판매가 부진할 경우 유통기간이 장기화된 제품 처리를 위한 염가판매 등으로 불공정 거래 행위가 나타날 수 있다”고 지적했다.또 “조세정책은 일관성과 형평성을 갖추어야 함에도 불구, 중소기업 육성이라는 명분으로 조세를 차별화 하는 것은 바람직하지 않다”고 덧붙였다.아울러 맥주 맛에 대해서는 “맥아 함량이 맥주 맛을 결정하는 것은 아니다”라며 “국내에서 인기를 끌고 있는 아사히와 하이네캔, 버드와이저, 호가든도 맥아 100%는 아니다”라고 강조했다.한편, 이날 간담회에는 주세법 개정안 발의를 준비중인 홍종학 의원을 비롯, 정철 서울벤처정보대학원대학교 교수, 안덕수 기획재정부 교통·환경·에너지세제과 과장, 김강삼 세븐브로이 대표, 차보윤 한국마이크로브루어리 협회 대표, 방인호 오비맥주 주식회사 대외정책팀장, 서정록 한국주류산업협회 기획조사팀 이사 등이 참석했다.정재웅 (esperanz@edaily.co.kr)[관련기사]☞하이트진로, 맥주 시장점유율 오른다..‘매수’-유진☞경찰 ""'경유 검출' 참이슬, 제조 공정 문제 없다""☞[주간추천주]대우증권▶ 당신의 생활 속 언제 어디서나 이데일리 ‘신문 PDF바로보기‘▶ 스마트 경제종합방송이데일리 TV▶ 실시간 뉴스와 속보 ‘모바일 뉴스 앱’ | 모바일 주식 매매 ‘MP트래블러Ⅱ’▶ 전문가를 위한 국내 최상의 금융정보단말기 ‘이데일리 마켓포인트 2.0’▶ 증권전문가방송 '이데일리 ON', 고객상담센터 1666-2200 |종목진단/추천 신규오픈＜ⓒ종합 경제정보 미디어 이데일리 - 무단전재 & 재배포 금지＞"
123,2013-04-12,'진주의료원 폐업 조례' 상임위 심의 무산,https://news.naver.com/main/read.nhn?mode=LSD&mid=shm&sid1=102&oid=001&aid=0006200673,연합뉴스,"자리 좀 비켜주시죠    (창원=연합뉴스) 이정훈 기자 = 경남도의회 야당의원 모임인 민주개혁연대 소속 김경숙 도의원이 진주의료원 해산을 명시한 조례 개정안을 처리하는 문화복지위원회 회의 운영을 저지하기 위해 위원장석을 점거한 가운데 새누리당 소속인 성계관 도의원이 회의진행을 위해 자리를 비켜줄 것을 요구하고 있다.  2013.4.12    seaman@yna.co.kr(창원=연합뉴스) 정학구 기자 = '진주의료원 폐업 조례' 심의를 위한 경남도의회 문화복지위원회 오전 회의가 야권 의원들의 저지로 무산됐다.이날 오전 11시 25분께 임경숙 위원장 등 문화복지위 새누리당 소속 의원 6명은 오전 회의를 포기하고 회의장을 나섰다.임 위원장은 기자들에게 ""위원장석을 점거하고 있는 야당 의원들을 설득하는 데 실패했다""며 ""오후에 계속 설득해보겠다""고 밝혔다.그는 ""도민들이 맡긴 대의정치의 의무를 다해야 한다""며 ""상임위 심의를 하지 않는 것은 직무유기""라고 덧붙였다.위원장석을 점거한 김경숙·강성훈 의원은 ""여기서 조례안이 가결되면 진주의료원 폐업은 되돌릴 수 없고 전국 공공의료는 무너진다""며 ""병원 노사가 이틀째 경영정상화를 논의하고 있고 국회도 관련 법률을 심의하는데 도의회에서 심의를 강행하는 것은 있을 수 없다""고 주장했다.의원들의 의견 개진 자체를 막는다는 비난에 대해 두 의원은 ""소수파로서 최소한의 의사표현이자 저항""이라고 주장했다.이에 앞서 임 위원장 등은 이날 오전 10시30분께부터 회의를 시작하려 했으나 미리 위원장석을 점거한 민주개혁연대 소속 두 의원들의 저지로 개회하지 못했다.새누리당 의원들은 일단 회의는 시작해야 한다며 자리를 비키라고 요구했고 두 의원은 간담회나 진행하자며 맞섰다.임 위원장이 기자들과 공무원들 모두 내보내고 비공개로 개혁연대 소속 의원들과 협의를 진행했지만 실패했다.비켜주셔야 회의 진행을 하죠    (창원=연합뉴스) 이정훈 기자 = 경남도의회 야당의원 모임인 민주개혁연대 소속 김경숙, 강성훈 도의원이 12일 오전 진주의료원 해산을 명시한 조례 개정안을 처리하는 문화복지위원회 회의 운영을 저지하기 위해 위원장석을 점거한 가운데 임경숙 위원장이 회의진행을 위해 자리를 비켜줄 것을 요구하고 있다.  2013.4.12    seaman@yna.co.kr문화복지위는 이날 진주의료원 해산을 가능하게 할 조항이 명시된 경남도 의료원 관련 조례 개정안을 심의, 18일 본회의에 상정할 것인지 논의할 예정이다.민주개혁연대는 이날 국회 보건복지위에서 지방의료원 폐업 시 장관 승인을 받도록 하는 내용의 지방의료원법 개정안을 심의하는 등 외부 요인 변화가 많은 만큼 조례 안건 심의 보류를 요구하고 있다.b940512@yna.co.kr[이 시각 많이 본 기사]☞""북한 미사일 발사는 시간문제""<접경지역 소식통>☞싸이 신곡 '젠틀맨', 나오자마자 1위 석권☞<'인천 길고양이들의 참변' 목격자를 찾습니다>☞-마스터스골프- 최경주, 1라운드 순조로운 출발(종합)☞미국 ""북한, 미사일 탑재 가능 핵무기 보유 가능성""<연합뉴스 모바일앱 다운받기><포토 매거진><저작권자(c)연합뉴스. 무단전재-재배포금지.>"
124,2013-04-12,서기석·조용호 인사청문보고서 채택 사실상 무산(종합),https://news.naver.com/main/read.nhn?mode=LSD&mid=shm&sid1=100&oid=001&aid=0006200675,연합뉴스,"서기석헌재 재판관 후보자(자료사진)(서울=연합뉴스) 송수경 홍지인 기자 = 서기석, 조용호 헌법재판관 후보자에 대한 국회 인사청문 경과보고서 채택이 12일 불발됐다.국회 법제사법위원회는 이날 전체회의를 열어 두 후보자의 경과보고서를 처리할 예정이었으나 민주통합당 등 야당이 두 후보자에 대한 청와대의 '부실검증' 사과 등을 요구하며 보고서 채택을 거부해 회의가 열리지 못했다.야당 법사위원들은 이날 국회에서 가진 기자회견에서 전날 조 후보자에 대한 인사청문회와 관련, ""청와대의 부실검증이 확인된 만큼 청와대에 인사검증 내규 제출과 두 후보자에 대한 인사검증 경과 소명을 요구했으나 답변이 없다""며 청와대의 입장표명, 부실검증 사과, 재발방지 약속을 요구했다.이들은 청와대의 태도를 지켜보고 채택 여부를 결정하겠다고 밝혔다.그러나 인사청문회법상 경과보고서는 인사청문회를 마친 날부터 사흘 안에 국회의장에게 제출돼야 하는데다, 청와대가 야당의 요구를 수용할 가능성이 낮아 보여 보고서 채택은 사실상 무산된 것으로 보인다.민주당 간사인 이춘석 의원은 기자들에게 ""오는 16일 전체회의가 잡혀 있는 만큼 3일이 지났더라도 청와대의 태도에 따라 그 때 채택 여부를 다시 논의할 수 있다""고 말했다.그러나 새누리당 간사인 권성동 의원은 ""청와대가 민주당의 무리한 요구를 받아들이기는 어려울 것""이라며 ""민주당이 정치공세를 벌이고 있다. 검증상의 문제를 들어 채택이 안된 것은 전례가 없다""고 비난했다. 민주당의 '부실검증' 주장도 사실과 다르다고 그는 반박했다.조용호헌법재판관 후보자(자료사진)지난 10일 서 후보자에 대한 청문회에서는 서 후보자와 삼성과의 유착 의혹이, 11일 조 후보자 청문회에서는 부동산 투기와 증여세 탈루 의혹 등이 쟁점화 됐다.hanksong@yna.co.kr[이 시각 많이 본 기사]☞""북한 미사일 발사는 시간문제""<접경지역 소식통>☞<라임은 딱맞게, 발음은 쉽게…베일 벗은 '젠틀맨'>☞G8 외무장관 ""北미사일 발사시 추가 제재""(종합2보)☞-마스터스골프- 최경주, 1라운드 순조로운 출발☞<'인천 길고양이들의 참변' 목격자를 찾습니다><연합뉴스 모바일앱 다운받기><포토 매거진><저작권자(c)연합뉴스. 무단전재-재배포금지.>"
