,날짜,기사 제목,기사 링크,기사 출처,기사 내용
0,2014-01-26,"“운이 좋았다, 엎드려 잠자는 두루미떼를 만나다니”",https://news.naver.com/main/read.nhn?mode=LSD&mid=shm&sid1=102&oid=032&aid=0002435479,경향신문,"지난 13일 오후 경기 연천군 횡산리 민통선 안쪽을 흐르는 임진강 빙애여울에서 두루미 10여마리가 먹이를 잡아먹으며 노닐고 있다. 수자원공사가 최근 임진강 하류의 군남댐 담수량을 늘리면서 여울들이 깊어지고 얼자 두루미들이 상류쪽 빙애여울로 날아와 서식하고 있다. 연천 | 홍도은 기자ㆍ철원·연천 두루미의 겨울나기 현장 르포두루미들은 얼어붙은 저수지 위에서 서로 꼭 몸을 붙이고 추위를 이겨내고 있었다.수은주가 영하 15도까지 떨어진 지난 14일 아침 8시. 민통선 이북의 강원 철원군 양지리 토교저수지에서는 두루미 수백마리가 얼음 위에 엎드려 웅크린 채 잠자고 있었다. 칼바람 소리가 저수지를 휘감았다. 해가 뜬 직후여서 서서히 몸을 움직여보는 두루미가 있었고, 먹이 활동을 하러 날아가는 새도 보였지만 대부분은 자던 모습 그대로였다. 알려진 것처럼 외다리로 자는 게 아니었다.1990년대부터 ‘두루미 지킴이’ 활동을 하며 사진을 찍어온 주민 심상국씨는 “두루미들이 한쪽 다리를 감추고 외다리로 서서 자는 것으로만 알려져 있는데 오래 지켜보니 아주 추울 때는 웅크리고 얼음 위에서 자는 경우가 많다”고 말했다. 너무 춥다보니 고고한 학 같은 모습을 버리고 얼음에 엎드려 서로의 체온으로 한밤 추위를 이겨낸다는 것이다. 심씨는 “덩치 큰 두루미들이 바람이 불어오는 방향에 모여 잠을 자면서 바람막이 역할을 한다”고 전했다. 함께 두루미 서식지를 둘러본 국립생물자원관 강승구 박사는 “오랫동안 지켜본 주민들이 전문가들도 모르는 두루미 습성을 알고 있는 경우가 많다”고 말했다.두루미 관찰은 아직 잠에서 덜 깬 두루미들이 놀라지 않도록 멀리 1~2㎞ 이상 떨어진 곳에서 망원경으로 이뤄졌다. 심씨는 “주민들도 수백마리의 두루미가 한데 모여 잠자는 걸 보는 일은 드물다”며 “오늘은 운이 아주 좋은 것”이라며 활짝 웃었다.<여기를 누르시면 크게 보실 수 있습니다>▲ 외다리로 서서 자는 두루미도 겨울 밤 칼바람 앞에서는그 고고함을 버리고 웅크린다▲ 수십, 수백마리가 날아가는 장관은 볼 수가 없었다.임진강 하류 댐 담수로 강물이 얼어붙었기 때문에두루미 수백마리가 2012년 12월 강원 철원군 양지리의 한 저수지에서 잠에서 깨어나고 있다. 해가 막 떠올랐지만 아직 두루미 중 일부는 체온 유지를 위해 얼음 위에 엎드린 채 잠들어 있다. | 철원군 주민 심상국씨 제공.경기도 연천과 강원도 철원은 국내 최대의 두루미 도래지다. 휴전선과 가까워 오랫동안 민간인 출입이 통제된 덕분에 두루미가 좋아하는 습지가 잘 보전된 곳이 많고, 먹이가 될 만한 것들도 여기저기 남아 있기 때문이다.연천 횡산리에서는 13일 오후 도로를 따라 둘러본 율무밭마다 두세 마리씩 두루미가 내려앉아 있었다. 두루미 서식지를 함께 둘러본 한탄강지키기운동본부 이석우 대표는 “율무는 수확 후 밭에 남아 있는 비율이 다른 곡식보다 높은 편이어서 두루미에게 좋은 겨울철 먹이가 되고 있다”고 말했다. 도로 주변 밭에는 고라니들도 멀뚱히 서서 지나가는 취재차량을 지켜봤고, 하늘에는 독수리·말똥가리 같은 맹금류들이 날아다녔다.철원·연천의 두루미 서식지는 조류인플루엔자(AI)로부터도 안전한 청정지역에 가깝다. 이석우 대표는 “민통선 안쪽은 다행히 사람들 출입이 적고, 다른 철새도 별로 없어서 조류인플루엔자 관련 문제는 걱정하지 않아도 된다”고 말했다. 다만 청정지역이라고 하더라도 주민들과 조류 전문가들은 전국적으로 번지는 고병원성 AI 발생으로 인해 철새를 백안시하는 사람들이 늘어날까 걱정하고 있다. 농림축산식품부가 AI 확산 원인을 섣불리 겨울철새인 가창오리로 지목했기 때문이다. 안 그래도 곱지 않은 시선을 보내던 농민들이 수확 후에 철새가 찾아오지 않도록 논밭에서 먹잇감이 될 만한 볏짚이나 낙곡을 모두 치워버리게 될 수도 있다.애초 가졌던 기대와 달리 연천에서는 수십, 수백마리의 두루미가 날아다니는 장관이나 한데 모여 먹이활동을 하는 장면은 찾아볼 수 없었다. 이유를 묻자 이 대표는 “최근 수자원공사가 임진강 하류 군남댐의 물을 담수하면서 물이 깊어지고 여울이 얼어붙어 두루미들이 다른 쪽으로 이동한 것”이라고 설명했다. 물살이 빨라 한겨울에도 얼어붙지 않던 수심 20~30㎝의 장군여울이 수심이 깊어지면서 여울로서 기능을 못하자 두루미들이 없어졌다는 것이다.실제 얼어붙은 장군여울에는 두루미가 한 마리도 안 보였지만, 상류 쪽으로 1㎞도 떨어져 있지 않은 빙애여울에는 두루미들이 군데군데 내려앉아 휴식을 취하거나 먹이활동을 하고 있었다. 이 대표는 “수자원공사가 가능한 한 빨리 두루미들을 위해서라도 아무 이유 없는 담수를 그만둬야 한다”고 말했다.<여기를 누르시면 크게 보실 수 있습니다>담수 외에도 인간의 활동은 여러 방식으로 두루미에게 위협이 된다. 두세 마리, 또는 십수마리씩 날아다니는 다른 두루미들과 달리 혼자 하늘을 날아다니다 밭에 내려앉은 두루미가 눈에 띄었다. 이 대표는 “배우자를 잃은 두루미로 보인다”고 말했다. 그는 “지난달 전선에 부딪혀 날개를 다친 두루미를 구조했는데 결국 죽었다는 소식을 들었다”며 “아마 그 배우자인 두루미가 짝을 잃은지도 모르고 찾아 헤매는 것으로 보인다”고 말했다. 이 대표의 말처럼 두루미는 일부일처로 평생을 해로하는 대표적인 조류다. 짝을 잃으면 다른 짝을 찾기는 하지만 사고가 없는 한 평생을 첫 배우자와 함께 산다.현재 철원에서는 농민들이 수익용 작물을 재배하는 하우스를 늘리면서 자연 그대로의 논밭이 줄어 두루미 먹이도 감소하고 있다. 북한에서도 식량 부족을 겪는 주민들이 가을걷이가 끝난 논밭에 두루미의 먹잇감을 남겨놓지 않는 바람에 배고픈 두루미들이 ‘탈북’하는 일이 생기고 있다. 연구자들 사이에선 철원 지역에서 급속도로 증가한 두루미들이 함경남도 안변에서 넘어온 두루미라는 의견이 지배적으로 받아들여지고 있다.자태가 아름다워 프로와 아마추어를 가리지 않고 사진애호가들의 표적이 되는 것도 두루미들을 괴롭히고 있다. 이 대표는 “일부 몰상식한 이들은 두루미가 날아가는 모습을 찍으려고 멀쩡히 먹이활동 중인 두루미 근처에서 소리를 질러 두루미들을 놀라게 한다”고 말했다.생물자원관 강 박사와 함께 이틀간 두루미와 재두루미의 개체수를 세어봤다. 14일 연천에서는 두루미 113마리, 재두루미 103마리가 확인됐다. 15일 철원에서는 두루미 179마리, 재두루미 615마리가 파악됐다. 새들은 빠른 속도로 멀리 이동할 수 있어 한 지역에서만 모니터링하는 것은 한계가 있다. 매년 1월 동시 조사를 실시하고 있는 생물자원관은 올해도 지난 24~26일 국내 180여곳에서 새들의 숫자를 헤아렸다. 특히 올해는 AI로 인해 철새 개체 수에 대한 정밀 조사를 실시했다.한국을 찾는 두루미는 6종이다. 개체수가 많은 두루미·재두루미·흑두루미 중에 몸집이 가장 큰 것은 138~152㎝에 달하는 두루미다. 학이나 단정학이라 불리며 머리에 붉게 살이 드러나 있는 게 두루미다. 재두루미는 두루미보다는 조금 작은 120~150㎝ 정도이며 91~100㎝ 크기의 흑두루미가 가장 작다.(왼쪽 위부터 시계방향으로) 두루미·황새·중대백로·왜가리■ 어떻게 다를까…두루미, 가장 크고황새, 높은 나무에 둥지 틀고왜가리, 회색빛이고흔히 ‘학(鶴)’으로 불리는 두루미 외에도 한국에는 두루미와 비슷한 외양의 새들이 여러 종 서식하고 있다. 황새·백로·왜가리가 대표적이다. 이 중에 몸길이가 두루미 다음으로 크고, 겉모습도 비슷한 황새는 학이라고 잘못 불리는 경우가 가장 많다.전국 곳곳에 살고 있는 왜가리와 백로는 여름철새인 탓에 겨울철새인 두루미와 같은 시기에 볼 일이 없었지만, 일부가 국내에서 월동하면서 텃새화돼 역시 학으로 혼동하는 경우가 많다.두루미와 다른 새들의 가장 큰 차이점은 몸길이다. 두루미는 몸길이가 1.4m가량이며 편 날개의 길이는 2.4m에 달한다. 황새는 몸길이가 1m, 왜가리는 97㎝가량이고 백로 중에 중대백로는 87㎝ 정도, 쇠백로·황로·해오라기는 55~65㎝ 사이다. 유심히 보면 크기만으로도 두루미를 구분해내는 것이 가능하다.황새는 몸 빛깔이 두루미와 가장 비슷하나 높은 나무 위에 둥지를 트는 습성이 있다. 두루미는 주로 습지와 밭에서 먹이 활동을 하고, 습지 주변의 물이나 땅 위에 마른 갈대나 풀줄기를 이용해 둥지를 만든다. 학처럼 보이는 새가 높은 나무 위에 있다면 두루미가 아닌 황새라고 생각하면 된다.백로와 왜가리 역시 나무 위에 둥지를 만든다. 백로류 중 중대백로·중백로·쇠백로·노랑부리백로 등 4종은 몸 빛깔이 하얗고, 왜가리는 회색 빛깔이다. 국립환경과학원 자료를 보면 일반적으로 왜가리와 중대백로는 6~10m 이상의 높은 곳에 둥지를 틀고, 쇠백로·황로·중백로는 이보다 낮은 나무에 둥지를 만든다. 해오라기는 3.7~9.7m 사이 다양한 높이에 둥지를 트는 습성이 있다.<김기범 기자 holjjak@kyunghyang.com>모바일 경향 [경향 뉴스진|경향신문 앱|모바일웹] | 공식 SNS 계정[경향 트위터][미투데이][페이스북][세상과 경향의 소통 커뮤니티]- ⓒ 경향신문(www.khan.co.kr), 무단전재 및 재배포 금지〈경향신문은 한국온라인신문협회(www.kona.or.kr)의 디지털뉴스이용규칙에 따른 저작권을 행사합니다.〉"
1,2014-01-26,수심 30m서 펼쳐지는 군무…말미잘 눈꽃 장관,https://news.naver.com/main/read.nhn?mode=LSD&mid=shm&sid1=102&oid=055&aid=0000271189,SBS,"<앵커>동해안 바닷속에서는 수온이 낮아지면 눈꽃이 핀 것 같은 장관이 펼쳐집니다. 말미잘이 촉수를 활짝 펴는 것인데요.말미잘이 보여주는 바닷속의 설경, G1 홍서표 기자가 담아왔습니다.<기자>수온 5~6도의 차가운 강릉 앞바다 속.갈색 나무 기둥에 흰색 눈꽃이 피었습니다.물의 흐름에 따라, 흐늘흐늘 춤을 추는 모습은 마치 나무가 바람에 흔들리는 것 같습니다.인공 어초에 붙어 촉수를 한껏 펼친 섬유세닐 말미잘 군락이 수심 30m 수중에서 군무를 펼쳐 보입니다.바로 옆 부채 뿔 산호에는 어미 도루묵이 마지막 힘을 다해 알을 쏟아내고, 산호마다 주렁주렁 도루묵 알이 포도송이처럼 달렸습니다.[홍진호/다이버 : 설원에 있는 하얀 스키장처럼 햐얀색이어초마다 말미잘이 너무 많이 분포돼 있어서 너무 좋았고요.]섬유세닐 말미잘은 수온이 10도 이하로 내려가는 추운 겨울에만 촉수를 펼치는 것으로 알려져 있습니다.수온이 높으면 몸을 움츠린 채 암석에 붙어 있어 눈에 잘 띄지 않으며, 주로 수십 개의 개체가 무리를 지어 출현하는 경우가 많습니다.섬유세닐 말미잘은 촉수로 물 속에 떠다니는 연체동물의 유생이나 작은 동물성 플랑크톤을 잡아 먹는데, 수온이 낮은 겨울철에 촉수 활동이 왕성해 집니다.[조대연/다이빙 업체 대표 : 밖에도 춥고 그렇지만 물속 안에도 추운 시기에만 볼 수 있는 게 바로 말미잘이거든요. 그래서 많은 다이버들이, 마니아들이 찾고 있습니다.]동해안 연안에서 광범위하게 분포하는 섬유세닐 말미잘이 바닷속을 겨울 풍광으로 물들이고 있습니다.(영상취재 : G1 류세진)☞[2014 소치 동계올림픽] 열정의 소치 꿈꾸는 평창☞[SBS기자들의 생생한 취재현장 뒷이야기 '취재파일']☞ SBS뉴스 공식 SNS [SBS8News 트위터] [페이스북]저작권자 SBS&SBS콘텐츠허브 무단복제-재배포 금지"
2,2014-01-26,눈·비 뚫고 고향간다…中 오토바이 귀성 봇물,https://news.naver.com/main/read.nhn?mode=LSD&mid=shm&sid1=104&oid=055&aid=0000271192,SBS,"<앵커>중국 본토의 '춘제'하면 귀성전쟁이 가장 먼저 떠오릅니다. 농민공들은 오토바이로 이동하기도 하는데, 눈·비를 뚫고 가족을 태운 채 수천 km를 달리는 오토바이 귀성객이 40만 명입니다.베이징, 우상욱 특파원입니다.<기자>고속도로 입구에 마련된 휴게소를 오토바이 수천 대가 가득 메웠습니다.가족과 짐을 가득 싣고 귀향길에 나서기 전에 차와 먹을거리 등을 무료로 받을 수 있기 때문입니다.오토바이 수리나 정비도 받습니다.[오토바이 귀성객 : 휴게소가 있는 것을 보고 들어왔어요. 집에 도착한 느낌이에요. 마음이 따뜻해져요.]올 춘제 기간 동안 연인원 40만 명이 오토바이로 이동할 것으로 전망됩니다.모두 차표를 구할 처지가 못 되는 농민공들입니다.눈과 비, 추위와 피로를 무릅쓰고 고향까지 수천 킬로미터를 가는 말 그대로 고생길입니다.그래서 자원봉사에 나선 대학생들과 지역 주민 등이 길 곳곳에 휴게소를 차린 겁니다.[자원봉사자 : (오토바이 귀성객들) 손이 너무 차가울 수 있어서 손 방한대를 사서 나눠주고 있어요.]올해부터는 석유 회사들이 기름도 무료로 넣어줍니다.논란도 불거집니다.[지역 방송사 앵커 : 오토바이는 장거리 여행에는 적합하지 않습니다. 반드시 안전문제에 더 주의를 기울여야 합니다.]대중교통 요금도 비싸고 그나마 표를 구하기도 힘든 게 농민공들이 오토바이 귀성에 나서는 이유인 만큼, 이들도 대중교통을 이용할 수 있도록 여건을 마련해 주는 게 필요하다는 얘기입니다.(영상취재 : 이관일)우상욱 기자woosu@sbs.co.kr☞[2014 소치 동계올림픽] 열정의 소치 꿈꾸는 평창☞[SBS기자들의 생생한 취재현장 뒷이야기 '취재파일']☞ SBS뉴스 공식 SNS [SBS8News 트위터] [페이스북]저작권자 SBS&SBS콘텐츠허브 무단복제-재배포 금지"
3,2014-01-26,털린 건 나의 ‘정보 인권’이다,https://news.naver.com/main/read.nhn?mode=LSD&mid=shm&sid1=102&oid=028&aid=0002218864,한겨레,"국민은행 휴일 영업 카드사 개인정보유출 사태로 휴일인데도 26일 오후 서울 중구 명동 국민은행에서 한 카드 가입자가 해지 및 재발급을 받기 위해 상담을 기다리고 있다. 박종식 기자 anaki@hani.co.kr[한겨레][개인 정보도 인권이다](상) 소 잃고도 외양간 안고쳐주인인 난 동의한 적 없는데기업 마케팅에 활용·금융사기 노출내가 쓴 ‘익명글’마저 공개돼양심의 자유 침해받기도20년 전에도 개인정보는 샜다. 1994년 한 정보대행업체가 전·현직 공무원과 기업 직원 등으로부터 일반 시민들의 신상정보 290만건을 넘겨받았다가 적발됐다. 국세청 소득과세자료와 비씨(BC)카드 가입자 신상명세, 국민연금 가입자료 등이었다. 이 업체는 전국의 자가용 승용차 소지자 110만명과 유권자 1600만명의 개인정보도 갖고 있었다. 사회적 충격이 대단했으나 입수 경로는 끝내 다 밝혀지지 못했다.수요는 명확했다. 백화점·카드회사·자동차회사·은행 등이 불법 개인정보를 판촉자료로 활용했다. 집 앞에 쌓인 광고 우편물 대부분이 불법 유출된 개인정보로 우송되고 있다는 사실이 드러났다. 정치인들이 해당 업체의 보유 정보를 선거활동에 쓴 일이 밝혀지기도 했다. 정보의 주인도 모르게 개인정보가 특정 목적에 이용된 것이다.같은 일은 규모가 커지며 반복됐다. 2008년 인터넷쇼핑몰 옥션에서 1800만명, 2011년 포털사이트 네이트에서 3500만명, 게임회사 넥슨에서 1320만명의 정보가 유출된 데 이어 올해 금융권에서는 역대 최대인 1억건 이상의 개인정보가 새나갔다. 금융당국과 수사기관은 ‘2차 피해’가 없을 것이라고 강조하지만, 이미 오래전부터 스팸메일·문자·전화의 홍수 속에 살아온 시민들은 불안하다.시민단체·전문가들은 재산 피해에 앞서 ‘정보인권’ 침해가 가장 큰 피해라고 입을 모은다. 유출된 개인정보로 카드결제가 이뤄지거나 예금이 빠져나가는 것도 문제지만, 누군가 이 개인정보를 이용해 내 카드사용 목록이나 금융거래 내역을 훔쳐보는 게 더 끔찍한 일이라는 것이다. 이처럼 자신의 의사와 무관하게 신용카드 이용 목록이 특정 유통업체의 마케팅에 활용되고, 익명으로 인터넷에 쓴 글이 공개돼 양심의 자유를 침해받고, 재산 규모가 금융기관에 공개돼 금융상품 판촉 대상이 되는 것 등은 모두 정보인권 침해다. 자신에 대한 정보가 수집·이용 및 제3자에게 제공되는 과정에 의미있게 참여할 권리를 말하는 정보인권은 정보통신 기술이 발달하고 정부·기업이 개인정보를 손쉽게 축적·이용할 수 있게 되면서 중요성이 커지고 있다.‘SNS정보’ 무차별 수집 허용…‘정보인권 침해’ 부추기는 정부정보 ‘상품화’ 되는 한 사고나는데정부, 정보관리 민간에 맡기고보호커녕 기업에 빗장 풀어내정보 발가벗긴 악법 ‘인터넷실명제’네이트 3500만명 털리고서야 “위헌”개인정보보호법은 제역할 못해그런데도 개인정보 유출 사고가 끊이지 않는 배경에는, 애초 개인정보 수집·이용을 쉽게 만든 정부 정책과 이로 인한 심각한 정보인권 침해에 무감각한 사회분위기가 자리잡고 있다는 지적이다. 한상희 건국대 법학전문대학원 교수는 “개인정보가 상품화되고 이윤추구의 수단이 되는 한 유출 사고 발생은 충분히 예견 가능하다. 우리나라는 개인정보관리 시스템이 전적으로 기업에 맡겨져 있어서 개인정보를 불법으로라도 사고팔거나 공유하는 행태가 멈추지 않고 있다”고 말했다. ‘함께하는 시민행동’의 김영홍 정보인권국장은 “소는 진작에 잃었다. 그런데도 우리 정부는 외양간조차 제대로 고친 적이 한 번도 없다”고 비판했다.※ 클릭하면 이미지가 크게 보입니다.정부는 정보인권 강화보다 국민 감시·통제를 우선시해 왔다. 혜택은 주로 기업들이 누렸다. 2007년부터 시행된 ‘인터넷 실명제’(제한적 본인확인제)는 민간에 개인정보 수집의 빌미를 제공해 유출 위험성을 높인 대표적 정책으로 꼽힌다. 2012년 헌법재판소가 “인터넷 실명제는 표현의 자유, 개인정보 자기결정권 등 기본권을 침해한다”는 이유로 위헌 결정을 내릴 때까지, 하루 평균 이용자 수 10만명 이상인 정보통신 서비스 제공자들은 실명제를 의무적으로 실시했다. 온갖 누리집에서 시민들의 주민번호 등 개인정보를 무차별적으로 수집·이용할 수 있었던 것이다. 2011년 국회입법조사처는 인터넷 실명제를 네이트 3500만명 개인정보 유출 사고의 주요 원인 중 하나로 지목하기도 했다.‘진보네트워크센터’ 장여경 정책활동가는 “인터넷 실명제가 수면 위로 떠오른 2004년 ‘개인정보의 마구잡이 수집, 누가 책임질 것인가’란 성명서를 냈다. 당시 이미 금융감독원이나 경찰 통계를 보면 개인정보·프라이버시 침해가 심각한 수준이었는데도 정부·국회는 정보사회의 인권을 위험에 빠뜨리는 일은 안중에도 없었다”고 말했다.인터넷 실명제는 공직선거법과 청소년보호법, 게임산업진흥법에 여전히 남아 있다. 불법 선거운동과 청소년의 게임 중독 및 유해매체물 접촉을 막는다는 명분에서다.인터넷 실명제 위헌 결정 뒤 정부가 이용을 장려한 ‘아이핀’ 역시 주민번호 수집을 전제한다는 점에서 근본 대안은 아니다. 이번 금융권 개인정보 유출 사고가 시작된 신용정보업체 ‘코리아크레딧뷰로’(KCB)는 아이핀 발급을 위해 정부가 지정한 본인확인기관이다. 장여경 활동가는 “정부는 민간업체가 시민들의 정보를 어떻게 수집·이용하는지는 묻지도 따지지도 않고, ‘너희가 이미 정보를 수집했으니 그걸로 우리 일을 대신해 달라’며 책임을 떠넘기고 있다”고 말했다.시민단체들이 줄기차게 요구한 ‘개인정보보호법’은 2011년 제정·시행에 들어갔지만, 곳곳에 다른 개별법 적용을 우선시하는 분야가 많아 무력하다는 비판을 받고 있다. 이번 금융권 개인정보 유출 사고의 경우에도 해당 업체들은 개인정보보호법이 아닌 신용정보법 등의 적용이 우선시되고 금융위원회의 규제를 받는다. 함께하는 시민행동의 김영홍 국장은 “업종별 규제기관의 권한이 크다 보니 개인정보보호법·개인정보보호위원회가 정보인권 보호의 사령탑 역할을 못 한다. 업종별 규제기관은 중앙부처와 업체 압력에 따라 ‘제 잇속 챙기기’에 바쁘니, 그 속에 개인정보 담당 부서나 직원이 있어도 눈치가 보여 제 역할을 하기 어렵다”고 말했다.특히 박근혜 정부 들어서는 ‘창조경제’를 활성화한다는 명분 아래 정보인권을 더욱 후퇴시키는 정책을 쏟아낼 것이란 우려가 나온다. 지난해 미래창조과학부는 위치기반 광고에 대한 개인의 사전동의 의무 완화 검토 등을 위해 ‘인터넷 규제개선 평가단’을 구성했다. 한국인터넷기업협회가 후원하는 ‘프라이버시 정책 연구 포럼’에서는 ‘개인정보보호 법제 개선을 위한 정책제안서’를 발간했다. “민간 영역에서 개인정보를 이용한 사업을 활발히 펼치기 위해서는 규제가 완화될 필요가 있다”는 주장이 담겼다.지난해 말 방송통신위원회는 이 보고서와 유사한 내용의 ‘빅데이터 개인정보보호 가이드라인(안)’을 발표했다. 블로그·소셜네트워크서비스(SNS) 등에 공개된 정보는 해당 시민의 동의 없이 수집·가공해 제3자에게 제공할 수 있다는 내용이었다. 장여경 활동가는 “시민들은 페이스북, 블로그 등의 해당 서비스를 이용하려는 목적으로 정보를 올리는 것이지, 기업이 이를 수집해서 거래하라고 자기 정보를 올리는 게 아니다. 현 정부의 정보인권 의식 수준을 적나라하게 보여준 사건”이라고 말했다.정부가 유출 사고 대책으로 ‘징벌적 과징금’을 내놓은 데 대해서도 비판이 쏟아진다. “피해는 시민들이 봤는데, 왜 국가가 과징금을 챙기나.” 한상희 교수의 지적이다. “집단소송과 징벌적 손해배상제도야말로 현재로서 가장 경제적인 개인정보보호 수단이다. 징벌적 손해배상으로 기업 하나가 파산할 때 소요되는 경제·사회적 비용이 수천억원이더라도 이후 동일한 대규모 유출 사건이 발생하지 않음으로써 절약되는 경제·사회적 비용보다 비쌀 순 없다. 지난날 대규모 유출 사건이 터졌을 때 이런 제도라도 일찌감치 도입했다면 이번 같은 규모의 사건이 반복되지는 않았을 것이다.”김효실 기자 trans@hani.co.kr     공식 SNS[통하니][트위터][미투데이]| 구독신청[한겨레신문][한겨레21]Copyrights ⓒ 한겨레신문사, 무단전재 및 재배포 금지<한겨레는 한국온라인신문협회(www.kona.or.kr)의 디지털뉴스이용규칙에 따른 저작권을 행사합니다.>"
