,날짜,기사 제목,기사 링크,기사 출처,기사 내용
87,2014-01-26,부여 종계장·시화호 AI…고병원성으로 확인,https://news.naver.com/main/read.nhn?mode=LSD&mid=shm&sid1=102&oid=001&aid=0006720921,연합뉴스,"AI 살처분…장병 투입    (부여=연합뉴스) 양영석 기자 = 육군 32사단 장병들이 26일 고병원성 조류인플루엔자(AI)에 감염된 것으로 확정된 충남 부여의 한 종계장 안으로 들어가고 있다. 2014.1.26    youngs@yna.co.kr(세종=연합뉴스) 김승욱 기자 = 농림축산식품부는 24일 감염의심 신고가 들어온 충남 부여군 홍산면의 종계장에서 채취한 시료를 정밀분석한 결과 고병원성 H5N8형 조류인플루엔자(AI) 바이러스가 검출됐다고 26일 밝혔다.또 경기 화성 시화호 주변에서 채취한 철새 분변에서도 고병원성 H5N8형 AI 바이러스가 검출됐다.24일 감염의심신고가 들어온 전남 해남군 송지면 씨오리 농가에서 채취한 시료에서도 H5N8형 AI바이러스가 검출됐으나 고병원성인지는 확인되지 않았다.이로써 H5N8형 AI 바이러스에 오염된 닭·오리 농장은 모두 18곳으로 늘었으며, 18곳은 AI 오염 여부를 조사 중이다.26일 오전 기준 살처분 대상은 39개 농가에서 사육 중인 닭·오리 53만1천여 마리로 집계됐다.kind3@yna.co.kr▶연합뉴스앱▶궁금한배틀Y<저작권자(c)연합뉴스 무단전재-재배포금지>부여 종계장 AI 고병원성 확진    (부여=연합뉴스) 양영석 기자 = 충남 부여군청 공무원들이 26일 고병원성 조류인플루엔자(AI)에 감염된 것으로 확진된 종계장에서 키우던 닭들을 살처분하기 위해 농가로 걸어 들어가고 있다. 2014.1.26    youngs@yna.co.kr시화호 주변 AI 방역 작업    (화성=연합뉴스) 신영근 기자 = 경기도 화성시 시화호 일대 철새 분변에서도 조류인플루엔자(AI) 바이러스가 검출된 가운데 26일 오전 시화호 주변에서 방역작업이 진행되고 있다. 2014.1.26 << 지방기사 참조 >>    drops@yna.co.kr    http://blog.yonhapnews.co.kr/geenang"
88,2014-01-26,위안부 피해 황금자 할머니 별세…생존자 55명,https://news.naver.com/main/read.nhn?mode=LSD&mid=shm&sid1=102&oid=001&aid=0006720907,연합뉴스,"'편히 쉬소서'    (서울=연합뉴스) 이정훈 기자 = 26일 오후 서울 목동 이대병원 장례식장에 마련된 일본군 위안부 피해자 황금자 할머니의 빈소를 찾은 한 조문객이 분향 및 헌화를 하고 있다.  2014.1.26    uwg806@yna.co.kr생전 빈병·폐지 팔아 1억 장학금 기탁…전재산 사회환원(서울=연합뉴스) 정빛나 기자 = 일본군 위안부 피해자 황금자 할머니가 26일 세상을 떠났다. 향년 90세.한국정신대문제대책협의회(정대협)는 황 할머니가 이날 오전 1시30분께 서울 강서구의 한 병원에서 노환으로 운명했다고 전했다.1924년 함경도에서 태어난 황 할머니는 13살 때 길을 가다 일본 순사에게 붙잡혀 흥남의 한 유리공장으로 끌려갔다. 3년 뒤에는 간도 지방으로 옮겨져 일본군 성노예 생활을 했다.광복 후 고국으로 돌아오고 나서도 황 할머니는 가정을 꾸리지 못하고 평생을 홀로 살아왔다.여의치 않은 형편에도 황 할머니는 정부에서 지원하는 임대아파트에 살면서 빈병과 폐지를 주워 팔았으며 생활지원금도 쓰지 않고 전부 모았다.황 할머니는 이렇게 모은 돈을 2006년과 2008년, 2010년 세 차례에 걸쳐 4천만원, 3천만원, 3천만원씩 총 1억원을 장학금으로 강서구에 기탁했다.이러한 선행이 세간의 화제가 돼 2011년 7월 정부로부터 국민훈장 동백장을 받았다.같은 해 12월 할머니는 사후 전 재산을 사회에 환원하기로 한 유언장을 작성했다. 당시 할머니는 사후 임차보증금, 은행예금 등을 포함한 재산 3000여만원을 재단법인 강서구 장학회에 기탁하기로 했다.고인의 빈소는 서울 목동이대병원 장례식장에 마련됐으며 영결식은 28일 강서구민장(葬)으로 엄수된다.황 할머니의 별세로 정부에 등록된 위안부 피해자 237명 중 생존자는 55명으로 줄었다.정대협 관계자는 ""위안부 피해 할머니들이 하루하루 시간과 싸우고 계시지만 지금 이 순간에도 일본 정부는 역사에 대한 책임을 인정하지 않고 있다""며 ""하루속히 위안부 피해 문제가 해결돼 할머니들이 조금이라도 더 편안하게 노년의 생을 보내실 수 있으시도록 함께 해달라""고 말했다.shine@yna.co.kr▶연합뉴스앱▶궁금한배틀Y<저작권자(c)연합뉴스 무단전재-재배포금지>"
89,2014-01-26,성폭력피해자 진술 녹화대상 16→19세로 상향,https://news.naver.com/main/read.nhn?mode=LSD&mid=shm&sid1=102&oid=001&aid=0006720851,연합뉴스,"(서울=연합뉴스) 오예진 기자 = 성폭력을 당한 피해자의 진술과 조사과정을 영상으로 녹화하는 연령기준이 현행 16세 미만에서 19세 미만으로 높아진다.국민권익위원회와 대검찰청은 지난해 6월 양해각서(MOU) 체결에 따른 후속 작업의 일환으로 이 같은 내용을 포함하는 검찰청 청렴도 제고 및 빈발민원 해소를 위한 제도개선안 9개를 마련했다고 26일 밝혔다.검찰은 우선 대검찰청 예규 중 영상녹화업무처리지침을 개정해 기존 16세 미만의 성폭력 피해자 수사에만 적용되던 진술과 조사과정의 영상녹화를 19세 미만의 청소년에게까지 확대 적용키로 했다.검찰은 또 정해진 시간이나 횟수제한 없이 발송돼 민원이 잦았던 벌과금 납부정보 문자서비스도 세부 전송기준을 마련, 일선 검찰청에 일괄 시달키로 했다.아울러 청각장애인에 대한 출석요구 통지방식도 변경키로 했다.그동안은 검찰이 일반 전화번호로 출석요구 문자를 발송하는 바람에 청각장애인들이 관련 문의를 하는 것이 불가능했으나 앞으로는 문자서비스 안에 전자우편 주소와 공용 휴대전화 번호도 함께 제공해 문자로 문의가 가능하다록 한다는 방침이다.검찰은 이밖에 형사사법포털의 증명서 발급서비스 개선, 벌과금관련 압류금지재산에 장애인용 보조기구 포함, 사건기록에 대한 열람·등사 범위 확대, 피내사자에게 내사·진정사건의 불기소처분 결과 통지 포함 등 민원서비스 개선안도 마련했다.ohyes@yna.co.kr▶연합뉴스앱▶궁금한배틀Y<저작권자(c)연합뉴스 무단전재-재배포금지>"
90,2014-01-26,"""위안부 어느 나라에도 있었다""…NHK회장 발언 파문(종합)",https://news.naver.com/main/read.nhn?mode=LSD&mid=shm&sid1=104&oid=001&aid=0006720866,연합뉴스,"""위안부는 어느 나라에도 있었다""    (도쿄=연합뉴스) 모미이 가쓰토 일본 NHK 신임회장. 2014.1.26 <<국제뉴스부 기사 참조>    yskim@yna.co.kr모미이 회장 취임회견서 배상요구 한국 비판…""끝난 문제""""독도·센카쿠 일본정부 영유권 입장 방송서 대변할 것""(도쿄=연합뉴스) 김용수 특파원 =  일본 공영방송 NHK의 모미이 가쓰토(70) 신임회장이 25일 일본군위안부와 관련, ""전쟁을 했던 어떤 나라에도 위안부는 있었다""면서 배상을 요구하는 한국을 비판해 파문이 일고 있다.일본 언론에 따르면 모미이 회장은 이날 NHK 회장 취임 기자회견에서 위안부 문제에 대해  ""한국뿐만 아니라 전쟁지역에는 (위안부가) 있었으며 독일, 프랑스 등에도 있었다""면서 ""한국이 일본만 강제연행했다고 주장하니까 이야기가 복잡한 것""이라고 강변했다.그는 또 ""(한국이) 보상하라고 하지만 이미 일한조약으로 해결된 것으로 (해결된) 이야기를 다시 꺼내는 것은 이상하다""고 주장, 강제 징용 보상문제 등이 한일청구권협정으로 이미 해결됐다는 일본정부의 입장을 그대로 대변했다.모미이 회장은 이와 함께  외국 시청자 등을 대상으로 한 국제방송에서 NHK가 독도, 센카쿠(尖閣.중국명 댜오위다오<釣魚島>)열도 등 영토문제에 대한 일본의 입장을 명확히 주장하는 것은 당연한 것이라는   입장도 밝혔다.그는 이와 관련, ""정부가 '오른쪽'이라고 하는 것을 (NHK가) '왼쪽'이라고 말할 수는 없다""면서 NHK 보도가 정부 입장과 동떨어질 수는 없다고 주장했다.그동안 모미이 회장의 인선에는 아베 신조(安倍晋三) 총리의 입김이 크게 작용했다는 관측이 무성했는데 이같은 발언 등은 '아베 코드'와 일치하는 것이라는 점에서 주목된다.아울러 모미이 회장은 아베 총리의 야스쿠니(靖國) 신사 참배에 대해서는 ""총리가 자신의 신념에 따라 참배했기 때문에 '좋다 나쁘다' 말할 입장이 아니다""면서 ""다만 (앞으로) '참배했다'고 담담하게 보도할 뿐""이라고 덧붙였다.모미이 회장은 규슈(九州)대학 경제학부를 졸업하고 미쓰이(三井) 물산에 입사해 부사장 등을 역임하고서 2005년부터 정보기술서비스업체인 일본 유니시스의 사장, 상담역, 고문을 지냈다.jianwai@yna.co.kr▶연합뉴스앱▶궁금한배틀Y<저작권자(c)연합뉴스 무단전재-재배포금지>"
91,2014-01-26,"美, 'NSA 도청서 한국 대통령 제외' 확인",https://news.naver.com/main/read.nhn?mode=LSD&mid=shm&sid1=100&oid=001&aid=0006720820,연합뉴스,"미국이무차별적인 도청 논란을 빚은 국가안보국(NSA)에 대한 개혁과 관련해 우리나라 대통령도 NSA 도청에서 제외된다는 점을 사실상 확인했다. 사진은 국가안보국(NSA).(AP=연합뉴스 DB)""한국, 미국의 가까운 동맹에 해당"" 입장 전해와(서울=연합뉴스) 강병철 기자 = 미국이 무차별적인 도청 논란을 빚은 국가안보국(NSA)에 대한 개혁과 관련해 우리나라 대통령도 NSA 도청에서 제외된다는 점을 사실상 확인했다.미국은 '가까운 동맹국 정상에 대한 도청을 하지 않겠다'는 내용을 포함해 발표한 NSA 개혁안에 대한 우리측의 문의에 대해 외교채널을 통해 ""한국은 미국의 가까운 동맹에 해당한다""고 확인했다고 정부 소식통이 26일 전했다.한국이 미국의 가까운 동맹국이라는 점을 확인함으로써 우리나라 정상도 도청 대상에서 제외된다는 점을 밝힌 셈이다.정부 소식통은 ""가까운 동맹국 정상에 대해서는 도청을 하지 않겠다는 미측의 입장 발표를 문맥 그대로 이해하면 될 것 같다""고 말했다.미국은 곧 NSA 개혁안 내용을 우리측에 공식 설명할 예정인 것으로 알려졌다. 그러나 버락 오바마 대통령이 지난 17일 발표한 내용 수준에서 설명이 이뤄질 것이란 관측이 많다.특히 미국은 NSA 개혁으로 도청에서 제외되는 동맹국 정상이 어디인지는 아직 구체적으로 특정하지 않고 있다.우리 정부는 지난해 7월 NSA가 우리나라를 포함해 38개국의 주미대사관을 도청했다는 의혹이 제기된 데 이어 10월에는 35개국 정상을 도청했다는 언론 보도가 나오자 외교채널을 통해 미국에 수차례 사실 관계 확인을 요구했다.이에 대해 미국은 사실 여부를 확인하지 않으면서 일반적인 차원에서의 정보활동에 대한 설명을 그동안 한 것으로 전해졌다. 양국 정보당국은 이 사항과 관련해 지속적으로 의견교환을 하는 것으로 알려졌다.soleco@yna.co.kr▶연합뉴스앱▶궁금한배틀Y<저작권자(c)연합뉴스 무단전재-재배포금지>"
92,2014-01-26,노숙인 급식 보조금 빼돌린 쉼터 대표 입건,https://news.naver.com/main/read.nhn?mode=LSD&mid=shm&sid1=102&oid=008&aid=0003195318,머니투데이,"[머니투데이 정영일 기자]서울지방경찰청은 직불카드 '카드깡'을 통해 서울시의 노숙인 쉼터 급식 보조금 1억여원을 횡령한 혐의(업무상 횡령)로 쉼터 대표 김모씨(54·여)와 식자재 납품업자 심모씨(51)를 불구속 입건했다고 26일 밝혔다.경찰은 또 심씨가 위장거래를 할 수 있도록 신용카드 가맹점 명의를 대여해준 혐의(여신전문금융업법 위반)를 받고 있는 노모씨(33·여)와 쉼터 노숙인들이 맡겨놓은 보관금 700만원을 가로챈 혐의(횡령 등)로 회계담당자 이모씨(34)도 불구속 입건했다.경찰에 따르면, 김씨는 2009년 3월부터 지난해 10월까지 4년7개월간 납품업자 심씨와 물품거래 없는 직불카드 가장거래를 통해 매달 175만~195만원씩 총 75차례 1억2390만원을 빼돌려 개인채무변제 생활비 등으로 사용한 혐의를 받고 있다.경찰조사결과 당초 심씨는 노숙인 쉼터에 쌀을 납품해왔지만 거래관계를 유지하기 위해 '카드깡'을 해달라는 김씨의 요구를 거절하지 못했던 것으로 알려졌다. 심씨는 이 과정에서 일종의 '카드깡' 수수료도 챙겨온 것으로 전해졌다.서울시는 보조금의 투명한 집행을 위해 직불카드 사용을 의무화하고 분기 1회의 정산보고와 연 1회 감사를 실시했지만 김씨 등은 매출전표와 거래명세서 등 증빙서류를 허위로 위조해 서울시의 눈을 속여 온 것으로 전해졌다.김씨는 2000년쯤 경기도 양평에 노숙인 쉼터를 설립해 2003년쯤 서울시에 매각한 뒤 서울시와 '관리·운영 위탁계약'을 체결하고 매년 3억원 가량의 급식비를 지원받아왔다. 서울시는 보조금의 투명한 집행을 위해 직불카드 사용을 의무화한 바 있다.김씨는 경찰조사에서 ""직불카드로 들어온 보조금을 현금화하긴 했지만 개인적으로 횡령하지는 않았고 찾은 현금은 모두 노숙인 급식비로 사용했다""고 주장한 것으로 전해졌다.경찰 관계자는 ""앞으로 유사한 사례가 발생하지 않도록 감독기관의 현장실사 및 서류 심사 강화 등 철저한 검증·관리시스템 도입이 필요하다""고 말했다.[오늘의 HOT포토][스페셜 포토][손안의 경제뉴스 머니투데이 모바일웹]정영일기자 bawu@<저작권자 ⓒ '돈이 보이는 리얼타임 뉴스' 머니투데이, 무단전재 및 재배포 금지>"
