,날짜,기사 제목,기사 링크,기사 출처,기사 내용
39,2014-01-27,유아용 전동차로 속도 경쟁?…위험천만 튜닝,https://news.naver.com/main/read.nhn?mode=LSD&mid=shm&sid1=103&oid=055&aid=0000271195,SBS,"<앵커>비싼 외제차를 축소해 놓은 듯한, 유아용 전동차가 인기입니다. 3~40만 원씩 하는 완구용 전동차에 추가로 몇십만 원을 들여 튜닝도 하는데, 아이 재미있게 해주기 전에 사고를 부를 수 있습니다.김아영 기자가 취재했습니다.<기자>엔진 소리를 내며 달려오던 전동차가 180도 완전히 회전합니다.밤이 되면, LED 조명까지 번쩍이며 주행합니다.급정거, 급회전은 기본이고, 360도 회전까지, 헬멧도 쓰지 않은 아이가 전동차로 요리조리 운전기술을 뽐냅니다.[정 모 씨/온라인 영상 게시자 : 전동차 드리프트(미끄러지기)하는 것하고 스핀턴(급회전)하는 것이 이렇게 올려져 있죠. (그런 차량들은 대부분 튜닝한 거죠?) 배터리를 추가한 거죠. 네.]아이들 전동차 튜닝에 관심 있는 부모들이 늘면서 온라인 동호인만도 1만 명에 육박합니다.[이천호/전동차 튜닝 동호회 운영진 : 모이면 애들 튜닝 얘기를 많이 하는데요. LED나 속도, 브레이크 제어 이런 거 많이 하는데요.]하지만, 유아용 전동차라고 해서 튜닝하는 걸 쉽게만 생각해선 안 됩니다.과도하게 성능을 조작할 경우 안전사고의 우려가 있습니다.실제로 한 튜닝 전동차의 속도를 측정해 봤더니 시속 16km가 나옵니다.전동 완구 제품 안전 기준인 시속 8km의 2배까지 속도를 높여놓은 겁니다.[최 모 씨/전동차 업체 관계자 : 애들 무릎 위치입니다. 범퍼가. 시속 20km(까지 올린) 전동차가 아이들과 부딪히면 그 부분에 골절상이 올 수 있어요.]튜닝한 전동차를 충전하다가 불이 난 사례도 있습니다.[노 모 씨/전동차 튜닝 동호회원 : 과전류 차단기를 달았어야 하는 부분을 그냥 처치했는데, 차에서 충전을 시키는 도중에 합선이 되면서 (불이 난 것 같아요.) 전혀 예상을 못 했습니다.]소음을 줄이겠다고 플라스틱 바퀴에 우레탄을 감기도 하는데 이 또한 위험할 수 있습니다.플라스틱 바퀴는 제동 시 어느 정도 미끄러진 뒤 서지만 우레탄으로 바퀴를 감은 전동차는 갑자기 서면서 옆으로 넘어갑니다.[구연범/전동차 튜닝 동호회원 : 저희 딸 아이 2살때 타이어 튜닝을 하고 공원 가는 길에 내리막에서 전복되는 사고가 있었습니다. 그 일이 있고 나서 응급실도 갔었고….]이런 위험 때문에 제조사들은 튜닝을 자제하라고 하지만 판매장에선 공공연하게 튜닝이 이뤄지는 실정입니다.[전동차 매장 직원 : 15만 원, 20만 원 (튜닝 가격은) 선택하시는 것 따라 달라요. (속도 튜닝은) 충분히 가능하십니다. 모터 변경하시고 하면.]유아용 전동차는 완구로 분류되기 때문에 출시 이후엔 특별히 규제할 방법도 없습니다.큰돈 들여 튜닝했다가 두고두고 후회할 안전사고를 자초하지 않는 것은 온전히 부모의 몫입니다.(영상취재 : 제 일·하 륭, 영상편집 : 김경연, VJ : 김종갑)김아영 기자nina@sbs.co.kr☞[2014 소치 동계올림픽] 열정의 소치 꿈꾸는 평창☞[SBS기자들의 생생한 취재현장 뒷이야기 '취재파일']☞ SBS뉴스 공식 SNS [SBS8News 트위터] [페이스북]저작권자 SBS&SBS콘텐츠허브 무단복제-재배포 금지"
40,2014-01-27,"'파이터 근성 배운다'…군, 훈련에 격투기 도입",https://news.naver.com/main/read.nhn?mode=LSD&mid=shm&sid1=100&oid=055&aid=0000271188,SBS,"<앵커>군이 올해부터 부사관 교육 과정에 격투기를 도입했습니다.장훈경 기자입니다.<기자>육군부사관학교 연병장에서 격투기 대결이 한창입니다.격투봉을 들고 매서운 공격을 주고 받는 파이터들은 20대 초반의 여군 부사관들입니다.올해부터 도입된 격투기 교육에는 여군도 예외가 없습니다.[유호연/하사 : 전투현장에서는 여군이라고 절대 봐주지 않습니다. 싸우면 이기는 방법을 배울 수 있는 좋은 기회였습니다.]지난 1995년 미군이 고안한 프로그램을 우리 군 실정에 맞게 부사관 교육에 도입한 겁니다.맨손 겨루기에서 킥복싱, 봉술까지 실제 백병전과 유사한, 실전을 방불케 하는 강도 높은 훈련이 진행됩니다.[유인수/하사 후보생 : 실제 상대방을 때리고 맞아보니까 정신을 똑바로 차려야 되겠고, 백병전에서 적을 단번에 제압할 수 있다는 강한 자신감을 얻게 됐습니다.]격투기 훈련을 받은 미군의 경우, 백병전 때 적을 제압할 확률이 75%까지 높아졌다는 미군 보고도 있다고 군 당국은 밝혔습니다.군 당국은 이에 따라 '격투기 교육'을 부사관 교육의 핵심과정으로 운영할 방침입니다.(영상취재 : 박진호)장훈경 기자rock@sbs.co.kr☞[2014 소치 동계올림픽] 열정의 소치 꿈꾸는 평창☞[SBS기자들의 생생한 취재현장 뒷이야기 '취재파일']☞ SBS뉴스 공식 SNS [SBS8News 트위터] [페이스북]저작권자 SBS&SBS콘텐츠허브 무단복제-재배포 금지"
41,2014-01-27,눈·비 뚫고 고향간다…中 오토바이 귀성 봇물,https://news.naver.com/main/read.nhn?mode=LSD&mid=shm&sid1=104&oid=055&aid=0000271192,SBS,"<앵커>중국 본토의 '춘제'하면 귀성전쟁이 가장 먼저 떠오릅니다. 농민공들은 오토바이로 이동하기도 하는데, 눈·비를 뚫고 가족을 태운 채 수천 km를 달리는 오토바이 귀성객이 40만 명입니다.베이징, 우상욱 특파원입니다.<기자>고속도로 입구에 마련된 휴게소를 오토바이 수천 대가 가득 메웠습니다.가족과 짐을 가득 싣고 귀향길에 나서기 전에 차와 먹을거리 등을 무료로 받을 수 있기 때문입니다.오토바이 수리나 정비도 받습니다.[오토바이 귀성객 : 휴게소가 있는 것을 보고 들어왔어요. 집에 도착한 느낌이에요. 마음이 따뜻해져요.]올 춘제 기간 동안 연인원 40만 명이 오토바이로 이동할 것으로 전망됩니다.모두 차표를 구할 처지가 못 되는 농민공들입니다.눈과 비, 추위와 피로를 무릅쓰고 고향까지 수천 킬로미터를 가는 말 그대로 고생길입니다.그래서 자원봉사에 나선 대학생들과 지역 주민 등이 길 곳곳에 휴게소를 차린 겁니다.[자원봉사자 : (오토바이 귀성객들) 손이 너무 차가울 수 있어서 손 방한대를 사서 나눠주고 있어요.]올해부터는 석유 회사들이 기름도 무료로 넣어줍니다.논란도 불거집니다.[지역 방송사 앵커 : 오토바이는 장거리 여행에는 적합하지 않습니다. 반드시 안전문제에 더 주의를 기울여야 합니다.]대중교통 요금도 비싸고 그나마 표를 구하기도 힘든 게 농민공들이 오토바이 귀성에 나서는 이유인 만큼, 이들도 대중교통을 이용할 수 있도록 여건을 마련해 주는 게 필요하다는 얘기입니다.(영상취재 : 이관일)우상욱 기자woosu@sbs.co.kr☞[2014 소치 동계올림픽] 열정의 소치 꿈꾸는 평창☞[SBS기자들의 생생한 취재현장 뒷이야기 '취재파일']☞ SBS뉴스 공식 SNS [SBS8News 트위터] [페이스북]저작권자 SBS&SBS콘텐츠허브 무단복제-재배포 금지"
42,2014-01-27,수심 30m서 펼쳐지는 군무…말미잘 눈꽃 장관,https://news.naver.com/main/read.nhn?mode=LSD&mid=shm&sid1=102&oid=055&aid=0000271189,SBS,"<앵커>동해안 바닷속에서는 수온이 낮아지면 눈꽃이 핀 것 같은 장관이 펼쳐집니다. 말미잘이 촉수를 활짝 펴는 것인데요.말미잘이 보여주는 바닷속의 설경, G1 홍서표 기자가 담아왔습니다.<기자>수온 5~6도의 차가운 강릉 앞바다 속.갈색 나무 기둥에 흰색 눈꽃이 피었습니다.물의 흐름에 따라, 흐늘흐늘 춤을 추는 모습은 마치 나무가 바람에 흔들리는 것 같습니다.인공 어초에 붙어 촉수를 한껏 펼친 섬유세닐 말미잘 군락이 수심 30m 수중에서 군무를 펼쳐 보입니다.바로 옆 부채 뿔 산호에는 어미 도루묵이 마지막 힘을 다해 알을 쏟아내고, 산호마다 주렁주렁 도루묵 알이 포도송이처럼 달렸습니다.[홍진호/다이버 : 설원에 있는 하얀 스키장처럼 햐얀색이어초마다 말미잘이 너무 많이 분포돼 있어서 너무 좋았고요.]섬유세닐 말미잘은 수온이 10도 이하로 내려가는 추운 겨울에만 촉수를 펼치는 것으로 알려져 있습니다.수온이 높으면 몸을 움츠린 채 암석에 붙어 있어 눈에 잘 띄지 않으며, 주로 수십 개의 개체가 무리를 지어 출현하는 경우가 많습니다.섬유세닐 말미잘은 촉수로 물 속에 떠다니는 연체동물의 유생이나 작은 동물성 플랑크톤을 잡아 먹는데, 수온이 낮은 겨울철에 촉수 활동이 왕성해 집니다.[조대연/다이빙 업체 대표 : 밖에도 춥고 그렇지만 물속 안에도 추운 시기에만 볼 수 있는 게 바로 말미잘이거든요. 그래서 많은 다이버들이, 마니아들이 찾고 있습니다.]동해안 연안에서 광범위하게 분포하는 섬유세닐 말미잘이 바닷속을 겨울 풍광으로 물들이고 있습니다.(영상취재 : G1 류세진)☞[2014 소치 동계올림픽] 열정의 소치 꿈꾸는 평창☞[SBS기자들의 생생한 취재현장 뒷이야기 '취재파일']☞ SBS뉴스 공식 SNS [SBS8News 트위터] [페이스북]저작권자 SBS&SBS콘텐츠허브 무단복제-재배포 금지"
43,2014-01-27,"소니, TV·PC 집착.. 옛 명성에 취해 ‘혁신’ 외면",https://news.naver.com/main/read.nhn?mode=LSD&mid=shm&sid1=101&oid=014&aid=0003081151,파이낸셜뉴스,"소니 신용등급 ‘정크’ 추락 배경일본 가전제품 제조업계의 간판급 업체인 소니의 신용등급이 투자부적격(정크)으로 추락한 것은 대중의 새로운 취향을 외면하고 구조조정에 지지부진했기 때문으로 풀이됐다.애플 및 삼성전자 등 글로벌 경쟁업체들이 모바일 기기로 옮겨간 대중의 취향을 따라잡을 동안 소니는 TV 및 개인용 컴퓨터(PC) 등을 주력 상품으로 고집, 글로벌 시장에서 도태돼 버렸다는 분석이다. 대중의 취향을 외면한 결과, 만성적인 수익부진을 앓게 됐으며, TV 등 전통적인 사업부문으로 글로벌 가전제품 업계 우위를 선점했던 옛 영화를 잊지 못한 나머지 과감한 구조조정도 없었다는 지적이다.이 같은 분석은 소니의 사업 부진이 비단 어제 오늘 일이 아닌 데다, 지난 수년간 수익성 부진을 이유로 신용등급 강등을 경고한 신평사가 여러 차례 등장했다는 점에서 힘을 얻는다.소니는 지난해 반기 결산(4~9월)에서 TV 사업 부진 등으로 158억엔(약 1668억원) 적자를 기록했다. 반기 결산으로는 3개 분기 연속 적자가 이어졌다.앞서 국제 신용평가사 피치도 2012년 11월 소니 신용등급을 정크 수준인 'BB-'로 세 단계 낮췄고 등급 전망도 '부정적'으로 제시했다. 무디스의 강등에 앞서 소니의 부도 위험에 대한 시장 우려가 커지면서 지난 23일 소니의 신용부도스와프(CDS) 프리미엄이 급등한 바 있다.과감한 구조조정이 결여된 게 소니 추락의 결정적 배경이란 지적도 나온다. 블룸버그 등 외신들은 특히 엔저를 골자로 하는 '아베노믹스 효과'로도 상쇄할 수 없는 소니의 대차대조표를 언급, 소니 수뇌부의 무기력함을 지적했다. 아베노믹스는 무제한 엔화 살포를 골자로 하는 아베 신조 일본 총리 내각의 대대적인 경기부양패키지를 일컫는다.지난 2012년 소니는 아베노믹스 반짝 효과에 힘입어 2007년래 5년 만에 흑전을 이뤘으나 TV와 PC에서의 부진으로 전자분야에서 1344억엔(1조4195억원)의 적자를 기록했다. 2012년도까지 9년 연속 적자를 기록한 TV 사업은 2013년도 1·4분기(2013년 4∼6월)에 '반짝 흑자'를 기록했지만 2·4분기(2013년 7∼9월)에 다시 93억엔(982억원)의 영업적자를 기록했다.블룸버그통신은 그러나 최근 히라이 가즈오 소니 사장이 야심 차게 추진한 엔터테인먼트 사업과 가전사업의 융합 '원 소니(One Sony)'의 성과 역시 시원찮다는 게 업계의 중론이라고 전했다.이외에도 소니의 지나친 '자사 표준' 고집 및 '관료주의' 문화도 오늘날 소니의 신용등급 강등을 초래한 배경으로 꼽혔다. 기술독점을 위해 자사 기술 방식만을 고집하면서 기술 세계에서 스스로 고립되길 자처했다는 지적이다. 또 새로운 연구개발에 대한 투자 없이 기존의 기술로만 수익을 내려는 관료주의는 창의적이고 혁신적인 의사결정을 내리는 데 걸림돌이 됐다는 평가도 나오고 있다.앞서 국제 신용평가기관 무디스는 28일 '대차대조표 개선이 필요하다'며 'Baa3'였던 소니의 신용 등급을 투자부적격 등급인 'Ba1'으로 한 단계 낮췄다. 무디스는 ""디지털 카메라, TV사업, 개인용 컴퓨터(PC), 휴대폰 등 개인용 가전제품 사업부문에서의 소비가 부진하다""며 ""소니의 수익성이 여전히 취약하고 자금 유동성도 아슬아슬한 상태""라고 지적했다. 이어 ""TV사업 등 주력부문에서의 사업 부진이 좀처럼 호전되지 않을 것으로 보인다""며 ""소니는 수익성 악화 압박을 지속적으로 받게될 것""이라고 전망했다.nol317@fnnews.com 김유진 기자※ 저작권자 ⓒ파이낸셜뉴스. 무단 전재-재배포 금지"
44,2014-01-27,[앵커&리포트] 경기·충청 ‘12시간만 이동중지’…왜?,https://news.naver.com/main/read.nhn?mode=LSD&mid=shm&sid1=102&oid=056&aid=0000040976,KBS,"<앵커 멘트>정부가 오늘 또 이동중지 명령을 내렸습니다.경기도와 충청권 등 모두 5개 지역이 그 대상입니다.이동중지 명령은 말 그대로 이동을 제한하는 조칩니다.가축 전염병이 발생했을 때 발생 지역의 가축은 물론, 축산 종사자, 축산 차량의 이동을 제한해 바이러스 확산을 막겠다는 겁니다.처음 호남에 발령할 때는 48시간 동안 이동중지를 시켰지만, 이번엔 12시간만 제한했습니다.그 이유는 뭐고 어떤 의미인지 이용순 기자가 취재했습니다.<리포트>시.도 경계를 넘나들며 AI가 급속히 확산되자 농식품부가 내린 두 번째 이동 중지 명령은 오늘 오전 6시부터 오후 6시까지.경기와 충청권 5개 시.도에 발령돼 축산인과 관련 종사자 23만여 명, 차량 2만5천여 대가 발이 묶였습니다.<인터뷰> 안창우(양계농민) : ""하루 정도야 출하가 안돼 어려움을 크게 겪지는 않습니다. 그러나 소비가 안돼 양계농민들이 아주 어렵습니다.""이동 중지에는 사료 운반 차량도 포함됐고 도축장 운영도 중단됐습니다.<인터뷰> 문순화(도계장 책임수의사) : ""오늘 저희 물량은 4만 수 정도 예정이었는데 반입이 들어오지 않아 오늘은 대청소와 소독으로 대체하고 있습니다.""이렇게 이동 중지 명령을 내린 것은 가금류 관련 모든 것의 발을 묶어 두고 가용 인력과 장비를 총동원해 일제 방역소독을 하기 위해섭니다.이번은 12시간 동안.지난 19일 호남에 48시간 동안 실시했던 1차 발령 때 출하가 지연돼 농가 부담이 커 시간을 줄인 것입니다.<인터뷰> 여인홍(농림축산식품부 차관) : ""길게 갔을 경우에는 아마 경제적인 손실이 클 수 있습니다. 그래서 최단시간 내에 일시에 한번 소독하자는 쪽으로...""이번 2차 이동 중지 명령으로 AI 확산세를 잡을 수 있을 지 주목됩니다.KBS 뉴스 이용순입니다.이용순▶  KBS뉴스 SNS -[트위터][페이스북][미투데이][저작권자ⓒ KBS(www.kbsnews.com) 무단복제-재배포 금지]"
45,2014-01-27,‘전통시장 상품권’ 천덕꾸러기?,https://news.naver.com/main/read.nhn?mode=LSD&mid=shm&sid1=101&oid=028&aid=0002219000,한겨레,"[한겨레]사용 꺼리고 잔액환불 거부도상인들은 “가입 번거롭다”지역사랑상품권도 마찬가지충남발전연 이민정 연구원“가맹점 늘리고 서비스 제고를”전통시장과 지역경제 활성화를 위해 도입된 상품권이 더 잘 쓰이기 위해서는 가맹점 수를 늘리고 가맹 점포들의 서비스 질도 끌어올려야 한다는 연구 결과가 나왔다.충남발전연구원 산업경제연구부 이민정 초빙책임연구원은 27일 낸 자료에서 “상품권 홍보와 보급을 위해서는 다양한 가맹점 확보와 가맹 점포의 서비스 질 제고를 통해 재이용률을 끌어올리려는 노력이 필요하다”고 밝혔다.현재 전통시장과 지역경제를 살리기 위해 발행되는 상품권에는 온누리상품권과 지역사랑상품권이 있다.2009년 7월 중소기업청·시장경영진흥원에서 첫선을 보인 온누리상품권은 2009년 200억원어치가 발행돼 104억6000만원어치가 구입된 뒤 해마다 크게 늘어 2012년에는 발행액 4000억원, 구매액이 4257억7000만원에 이른다.(그래픽) 전통시장 상인과 소비자 사이에 수수료가 필요 없고 온라인·오프라인 모두 사용할 수 있다는 장점이 있다. 하지만 상품권 구매처나 가맹점에 대한 홍보·안내가 부족하고 일부 점포에서는 사용을 꺼리는데다 잔액 환불을 거부당하는 경우도 있다. 상인들은 가맹점 가입하기가 번거롭고 일부 은행에서만 환전이 가능하다는 지적을 받고 있다. 발행 규모가 크다 보니 전체 상품권 회수액의 4분의 1가량이 불법으로 현금화되는 폐단도 적지 않다.온누리상품권과 달리 지역사랑상품권은 지방자치단체에서 발행하는 상품권이다. 충남에서는 보령시가 1999년 처음 선보였다. 온누리상품권은 전통시장에서만 사용하지만 지역사랑상품권은 해당 지자체 안의 외식업소나 편의점·주유소 등 다양한 곳에서 쓸 수 있는 게 장점이다. 현재 전국 지자체 50곳에서 발행하고 있다. 그러나 온누리상품권과 마찬가지로 홍보가 부족하고 가맹 점포가 많지 않으니 상인들한테서 외면받는 사례가 적지 않다. 이 때문에 상품권 회수율이 20%에 미치지 못할 만큼 저조하다.이민정 연구원은 이런 현황 조사를 바탕으로 두 상품권이 경쟁이 아닌 보완관계 형태로 쓰여야 한다고 제안했다. 또 지역사랑상품권의 경우 공무원들 사이에만 유통되는 사례가 많기 때문에 주민 홍보가 절실하다고 봤다. 특히 두 상품권의 홍보·보급에는 지자체 정책뿐 아니라 지역 기관·단체·기업·주민들 사이의 협조가 필수적이라고 분석했다. ‘전통시장 가는 날’을 지정하거나 ‘1기관-1시장 자매결연’ 등 적극적인 협력을 예로 들었다. 이 연구원은 “시·군별로 소규모·산발적으로 유통중인 지역사랑상품권을 통합해 도 차원의 상품권으로 추진하는 것도 고려할 필요가 있다”고 제안했다. 전진식 기자 seek16@hani.co.kr   공식 SNS[통하니][트위터][미투데이]| 구독신청[한겨레신문][한겨레21]Copyrights ⓒ 한겨레신문사, 무단전재 및 재배포 금지<한겨레는 한국온라인신문협회(www.kona.or.kr)의 디지털뉴스이용규칙에 따른 저작권을 행사합니다.>"
46,2014-01-27,[9 확대경] ‘13월의 월급’ 무색…직장인들 한숨,https://news.naver.com/main/read.nhn?mode=LSD&mid=shm&sid1=101&oid=056&aid=0000040973,KBS,"<앵커 멘트>요즘 회사마다 연말정산이 한창일 텐데요.예년과 달리 돌려받는 액수가 적어서 13월의 월급이라는 말이 무색할 정도라고 합니다.환급액이 줄거나 오히려 세금을 더 내야하는 경우도 적지 않다는데요.왜 그런건지 조빛나 기자가 취재했습니다.<리포트>요즘 연말정산을 하고 있는 한 기업 직원들에게 예상 환급액을 물어봤습니다.<녹취> ""환급액이 작년보다 줄어든 분 손들어  주세요. 그럼 작년보다 늘어난 분  손들어 주세요.""지난해보다 줄었다는 직원이 11명 중 8명입니다.이 가운데 김동준 과장의 연말정산을 살펴봤습니다.지난해에는 110만 원을 돌려받았지만 올해는 오히려 만원을 더 내야 합니다.<인터뷰> 김동준(35살/과장) : ""보통 70만 원에서 100만 원씩 환급받았는데  올해는 오히려 토해내는 구조가 돼서  처음에 계산할 때 황당했었고...""재작년 9월에 간이세액표가 바뀌면서 미리 내는 세금이 줄어든 대신 환급금도 줄게 됐는데, 많은 기업이 연간으로는 지난해 처음 적용해 올해 연말정산에서 이렇게 차이가 나는 겁니다.여기에 신용카드 소득공제율이 20%에서 15%로 축소되고, 일부 공제항목이 없어지고, 한도가 신설된 것도 영향을 미쳤습니다.<인터뷰> 김영림(세무사) : ""장기주택마련공제가 종료됐고, 의료비와  교육비 등 소득공제 종합한도 2,500만  원이 신설됐습니다.""정부는 올해 주요 연말정산 공제금액이 지난해보다 3%가량 줄어들 것으로 예상하고 있어, 13월의 월급을 기대하던 직장인들의 한숨이 커지고 있습니다.<기자 멘트>내년에는 연말정산이 더 팍팍해집니다.가장 큰 이유는 소득공제가 세액공제로 바뀌기 때문인데요.본인과 부양가족에 대한 기본공제, 공적연금과 건강보험료 공제, 근로소득공제 이 3가지를 뺀 나머지 공제항목들이 대부분 세액공제로 바뀝니다.여기에 신용카드 소득공제율도 15%에서 10%로 더 낮아집니다.정부가 이런 걸 다 감안해서 올해 세금을 계산해 봤더니, 4인 가구 기준으로 연소득 7천2백만 원은 36만 원, 8천4백만 원은 72만 원, 1억 8백만 원은 108만 원, 이만큼 세금이 늘어날 전망인데요.연말정산이 13월의 월급이 아닌 13월의 세금이 되지 않으려면 어떻게 해야 할까요?우선, 체크카드와 현금영수증을 잘 활용해야 하는데요.소득공제율이 30%로 유지되기 때문입니다.특히 전통시장이나 대중교통을 이용하면 한도보다 100만 원씩 추가로 공제해주니 잘 활용해야겠죠.총급여 5천만 원 이하라면 올 3월에 출시되는 소득공제 장기펀드 가입도 고려할 만합니다.한도가 연 600만 원으로 40%를 소득공제 받을 수 있으니까 최대 240만 원까지 공제받을 수 있는데 5년 이상 가입해야 합니다.KBS 뉴스 임승창입니다.임승창,조빛나▶  KBS뉴스 SNS -[트위터][페이스북][미투데이][저작권자ⓒ KBS(www.kbsnews.com) 무단복제-재배포 금지]"
