,날짜,기사 제목,기사 링크,기사 출처,기사 내용
0,2014-01-27,"홍광호, 웨스트엔드 진출 쾌거…한국인 첫 주역 '미스사이공'",https://news.naver.com/main/read.nhn?mode=LSD&mid=shm&sid1=103&oid=003&aid=0005642609,뉴시스,"【서울=뉴시스】이재훈 기자 = 뮤지컬스타 홍광호(32)가 뮤지컬 '미스 사이공'의 '투이' 역으로 영국 런던 웨스트엔드에 진출한다.미스사이공 제작사인 카메론 매킨토시는 5월 웨스트엔드 프린스 에드워드 극장에서 개막하는 '미스사이공' 25주년 기념 뉴 프로덕션 공연에 홍광호를 캐스팅했다고 27일 발표했다.웨스트엔드는 미국 뉴욕 브로드웨이와 함께 세계 양대 연극·뮤지컬의 명소다. 세계 4대 뮤지컬로 꼽히는 '미스사이공' '캣츠' '레 미제라블' '오페라의 유령'이 모두 이 지역에서 탄생했다. 웨스트엔드에 한국에서 활동하는 배우가 주역으로 캐스팅 된 건 홍광호가 처음이다.홍광호는 '미스사이공'에서 어린 시절 부모들과 약속으로 정혼한 '킴'과 인연을 지키기 위해 애쓰지만 끝내 거절당하고 비극적인 죽음을 맞는 투이를 연기한다. 진성으로 3옥타브 이상을 자유로이 넘나들 수 있는 뛰어난 가창력을 필요로 하는 배역이다.홍광호의 영국 오디션을 진행한 미스사이공 한국 제작사 KCMI는 ""오디션 당시 홍광호는 모든 음을 정확히 짚어내며 완벽하게 투이의 넘버를 소화해 내 영국 스태프들을 놀라게 했다""고 전했다.세계 4대 뮤지컬을 모두 탄생시킨 제작자 카메론 매킨토시는 배우 캐스팅에 철저하고 까다롭기로 명성이 높다.홍광호의 매니지먼트사 PL엔터테인먼트는 ""그런 카메론이 영어가 모국어가 아닌 배우를 주역으로 발탁한 것은 이례적""이라면서 ""그의 작품 중 최고라 손꼽히는 미스사이공에 한국의 배우가 당당히 주역으로 캐스팅된 점은 의미가 크다""고 자랑했다.홍광호는 지난해 11월 뮤지컬 '노트르담 드 파리'에 출연할 당시 오디션 영상을 영국으로 보냈다. 이 영상을 본 매킨토시는 단 번에 홍광호를 선택했다.KCMI 관계자는 ""카메론이 해외에 체류 중인 배우들의 오디션을 볼 때는 보통 1차 영상을 통한 오디션이 통과된 후 영국으로 배우를 불러 직접 배우들의 오디션을 진행하는 것이 순서인데, 홍광호의 경우 영상만을 보고 캐스팅을 결정했다. 이는 전례 없는 일""이라고 알렸다. 홍광호는 2006년 '미스사이공' 한국 초연 당시 주인공 '크리스'의 커버, 투이 커버를 맡은 바 있다.'미스사이공'은 푸치니의 오페라 '나비부인'을 모티브로 삼은 작품이다. 월남전에 파병된 미국인 병사와 현지 여인이 사랑에 빠지면서 벌어지는 이야기다. 1989년 런던 초연 이후 15개 언어로 28개국, 300개 이상의 도시에서 공연했다.특히 올해 런던에서 개막하는 공연은 '미스사이공' 25주년 기념 뉴 프로덕션이다. '레미제라블' 25주년 기념 뉴 프로덕션과 '오페라의 유령' 25주년 기념 공연 등을 총 연출한 연출가 로렌스 코너가 지휘한다.지난해 9월에 공연 티켓을 오픈하자마자 웨스트엔드, 브로드웨이 박스오피스 역사상 가장 많은 티켓을 판매하는 기록을 세웠다. 한국과 영국 뿐 아니라 호주, 네덜란드, 필리핀, 싱가포르, 태국, 미국 배우들이 출연한다.한편, 계원예술고등학교 연극영화과와 중앙대 연극학과를 나온 홍광호는 2002년 '명성황후'로 뮤지컬 프로 무대에 데뷔했다. 호소력 짙은 가창력과 안정된 연기력을 통해 뮤지컬스타로 자리매김했다. '오페라의 유령' '지킬 앤 하이드' '노트르담 드 파리' '닥터 지바고' '맨 오브 라만차' 등에 출연했다. 지난해 7월에는 뮤지컬 배우로는 처음으로 올림픽홀에서 단독 콘서트 '홍서트'를 열어 2회 공연 약 7000석을 티켓 오픈 하루 만에 모두 팔아치우기도 했다.한편, '미스사이공' 25주년 기념 뉴 프로덕션은 2015년 4월 서울 한남동 블루스퀘어 삼성전자홀 무대에도 오른다.realpaper7@newsis.com★ 뉴시스 뉴스, 이젠 네이버 뉴스 스탠드에서도 만나세요★ 손 안에서 보는 세상, 모바일 뉴시스<저작권자ⓒ 공감언론 뉴시스통신사. 무단전재-재배포 금지.>"
1,2014-01-27,"중국서 안중근 바람…""항일 의사"" 재조명",https://news.naver.com/main/read.nhn?mode=LSD&mid=shm&sid1=104&oid=055&aid=0000271271,SBS,"<앵커>하얼빈역에 안중근 의사 기념관이 들어선 것을 비롯해서 요즘 중국에선 안중근 재조명 바람이 불고 있습니다. 안 의사를 통해서 일본 제국주의에 각을 세우려는 의도로 보입니다.베이징에서 우상욱 특파원입니다.<기자>CCTV의 인기 시사물 '세계주간'입니다.일주일 동안 중국에서 화제가 된 3~4개의 외신을 심층 분석하는데, 어제(26일) 방영된 주제 가운데 하나가 '다시 본 안중근'입니다.[캉후이/진행자 : 오늘 우리는 안중근 의사에 대해 새로 조명해보고 다시 읽어보겠습니다.]안중근 의사의 약력과 사상, 의거 당시 동아시아 상황 등을 소개했습니다.특히 안 의사가 항일 의병장으로 활약했고 따라서 당시 이토 히로부미 저격이 교전규칙에 의한 전쟁행위 차원이었음을 강조했습니다.[(안 의사는) 이토 히로부미를 동아시아의 평화와 화합을 파괴한 원흉이라고 강조했습니다.]중국 언론은 물론 정부 당국자들도 연일 안 의사를 부각하며 일본 제국주의의 침략성과 비도덕성을 강조하고 있습니다.[친강/중국 외교부 대변인 : 안중근은 역사상 저명한 항일의사입니다. 만약 안중근이 테러리스트라면 일본 야스쿠니에 합사된 1급 전범자들은 도대체 무엇입니까?]중국은 소수민족의 테러 위험이 상존하는 만큼 저격이나 폭파와 같은 행위에 대해 체질적인 거부 반응을 보여 왔습니다.따라서 이례적인 안 의사 재조명 바람은 일본의 잘못된 역사 인식을 공격해 중-일간에 세력균형에서 우리의 위치를 좀 더 중국 쪽으로 끌어들이려는 의도로 분석됩니다.(영상취재 : 이관일)우상욱 기자woosu@sbs.co.kr☞[2014 소치 동계올림픽] 열정의 소치 꿈꾸는 평창☞[SBS기자들의 생생한 취재현장 뒷이야기 '취재파일']☞ SBS뉴스 공식 SNS [SBS8News 트위터] [페이스북]저작권자 SBS&SBS콘텐츠허브 무단복제-재배포 금지"
2,2014-01-27,"""최대 50만 원"" '영국산 원단' 어린이 한복 열풍",https://news.naver.com/main/read.nhn?mode=LSD&mid=shm&sid1=101&oid=055&aid=0000271263,SBS,"<앵커>설을 앞두고 영국산 원단으로 만든 어린이용 한복이 인기를 끌고 있습니다. 이색적이라서 눈에 띄긴 하는데 너무 비싼 것 아니냐 또는 오히려 실용적이다, 의견이 분분합니다.김아영 기자가 취재했습니다.<기자>아동용 한복 전문 판매점입니다.저고리에 영국의 유명 꽃무늬 원단을 쓰는데 한 벌에 최대 50만 원이나 합니다.부담스런 가격인데, 인기는 열풍 수준입니다.[윤민지/영국 원단 한복 구매자 : 매번 똑같은 것 좀 진부하니까 알록달록해서 꽃문양 같은 것들이 많아서 여자 애들이 많이 좋아하더라고요.]아예, 영국산 원단으로 만든 한복만 취급하는 곳도 있습니다.세 살배기 한복 한 벌이 30만 원, 2박 3일 대여해도 10만 원입니다.설을 앞두고 엄마들 문의가 끊이질 않습니다.[박기숙/영국 원단 한복 구매자 : 요즘에 약간 유럽스타일도 굉장히 인기가 많고 그리고 애들이 아무래도 어른들 입장에서는 애들이 예뻐 보이는 걸 원하잖아요. 그래서 남들보다 조금 더 독특하게 보이고 싶기도 하고.]영국의 한 유명 백화점에서 판매한다는 고급 원단입니다.해외 명품 아동복 업체들이 이 원단으로 제품을 제작한 사실이 알려지면서 이렇게 한복용으로도 인기를 끌었다는 설명입니다.[이민서/영국 원단 한복 제작 업체 디자이너 : 인기 있는 천들이 있거든요. 그중에. 그런 천들은 서두르시지 않으면 품절이 되는 품귀 현상까지 일으킬 정도로 문의가 굉장히 많으시고요.]서울의 한 전통시장을 찾아가봤습니다.영국산 원단이 워낙 비싸다 보니 꽃무늬만 비슷한 유사 원단도 불티나게 팔립니다.[한복 매장 직원 : 젊은 엄마들이 (영국 원단 스타일 한복을) 굉장히 좋아하는데요. 사이즈가 없어서 못 팔아요.]근처 전통 한복 판매점은 손님을 빼앗겨 울상입니다.[전통한복 매장 사장 : 영국 원단은 다 거품이에요. 전통한복, 이거 10만 원 넘게 팔았는데 반 값에 드릴게요. (안팔리고) 힘들고 해서.]아이 한복도 고급화하고 실용적으로 진화한다는 긍정적 반응도 있지만, 명절 때 한번 입고 마는 아이 한복에 거품이 낀 게 아니냐는 비판도 나오고 있습니다.(영상취재 : 김흥기·제 일, 영상편집 : 조무환, VJ : 김종갑)김아영 기자nina@sbs.co.kr☞[2014 소치 동계올림픽] 열정의 소치 꿈꾸는 평창☞[SBS기자들의 생생한 취재현장 뒷이야기 '취재파일']☞ SBS뉴스 공식 SNS [SBS8News 트위터] [페이스북]저작권자 SBS&SBS콘텐츠허브 무단복제-재배포 금지"
3,2014-01-27,'알록달록' 어린이 시설서 유해물질…8만 곳 기준 초과,https://news.naver.com/main/read.nhn?mode=LSD&mid=shm&sid1=102&oid=055&aid=0000271261,SBS,"<앵커>어린이집이나 유치원에 가보면 알록달록 놀이기구나 벽지가 흔합니다. 이걸 마감하는 과정이나 페인트 하는 과정에서 중금속 같은 유해물질이 발생합니다. 문제는 유해물질이 기준치를 넘어서더라도 제재할 근거가 없는 시설이 전체의 66%, 8만 곳이나 된다는 겁니다. 뒤늦게 관련 법령이 정비됩니다.조기호 기자입니다.<기자>아이들이 머물렀던 곳에서 중금속 농도를 재 봤습니다.운동기구 페인트에서 납 성분이 기준치의 40배를 넘었습니다.마루에 칠한 페인트에서도 수은과 비소가 초과 검출됐습니다.서울의 이 어린이집은 지난해 실태 조사 때 철제 손잡이에서 기준치의 5배가 넘는 중금속이 나왔습니다.나무로 된 놀이기구에서도 기준치를 초과하는 중금속이 검출됐습니다.[박옥영/어린이집 원장 : 벽지나 페인트 또는 바닥재 이런 것들을 아이들 눈에 좋은 것을 선택했거든요. 그런데 그것이 오히려 아이들에게 유해한 환경을 제공했더라고요. ]이 유치원은 환경 개선 작업을 거쳐 중금속 농도를 기준치 이하로 낮췄습니다.하지만, 전국 어린이 시설의 60%가 넘는 8만 곳은 여전히 기준치를 초과한 상태이고, 신규시설 역시 별다른 규제를 받지 않습니다.[이호중/환경부 환경보건정책과장 : 놀이터나 어린이집, 교실 등에는 눈에 보이지 않지만 여러 가지 환경 유해인자들이 많이 있습니다. 이런 것들에 대해서 진단을 통해서 하나하나 개선해 나가는 것이.]이에 따라 환경부는 명확한 유해물질 기준을 마련해 오는 3월부터 신규시설에 적용하고, 기존 시설도 문제를 개선하도록 계도하기로 했습니다.(영상취재 : 강동철, 영상편집 : 장현기)조기호 기자cjkh@sbs.co.kr☞[2014 소치 동계올림픽] 열정의 소치 꿈꾸는 평창☞[SBS기자들의 생생한 취재현장 뒷이야기 '취재파일']☞ SBS뉴스 공식 SNS [SBS8News 트위터] [페이스북]저작권자 SBS&SBS콘텐츠허브 무단복제-재배포 금지"
4,2014-01-27,"""택배 반송"" 명절 노린 스미싱…앱 바꿔치기까지",https://news.naver.com/main/read.nhn?mode=LSD&mid=shm&sid1=102&oid=055&aid=0000271274,SBS,"<앵커>정보유출 사태에 대한 불안감에 편승하고 설 연휴까지 노린 스미싱이 기승을 부리고 있습니다. 휴대전화 소액결제 정도가 아니라 아예 스마트폰 뱅킹 앱을 통째로 노리는 경우도 새로 발견됐습니다.정영태 기자가 취재했습니다.<기자>지난 주말 사이 쏟아져 들어온 스팸 문자들입니다.대부분 인터넷 도박 사이트를 안내하는 문자들이지만, 개중에는 문자 사기, 즉 스미싱도 있습니다.신년 인사 메시지를 확인하라거나, 명절 선물이 많이 오가는 때 전달하지 못한 택배나 우편물이 있다는 식입니다.그런데, 과거와는 양상이 다릅니다.문자에 포함된 인터넷 주소를 무심코 누르면 악성코드가 설치되는 점은 같지만, 개인정보만 빼가는 게 아니라, 스마트폰에 깔린 금융거래용 은행 앱을 바꿔치기합니다.이용자가 정상적으로 설치해둔 은행 앱과 거의 똑같은 디자인의 가짜 앱을 설치하고 진짜는 삭제하는 겁니다.아이디나 비밀번호, 계좌번호, 계좌비밀번호, 공인인증서 비밀번호 등을 입력하면 고스란히 해커의 손에 넘어갈 수 있습니다.실수로 스미싱 문자를 눌러도 일정 시간이 지난 뒤에 감염시키는 변종도 나타났습니다.[문종현/보안전문기업 잉카인터넷 팀장 : 잠복기를 거친 다음에 설치를 하게 되면 이용자들은 정상적인 업데이트 앱이라고 볼 수 있겠죠.]스마트폰 뱅킹이 늘어나자 이를 노린 악성 앱이 급증하고 있는 겁니다.만약 이미 유출된 금융권 개인 정보까지 결합되면 해킹은 보다 손쉽게 이뤄질 수 있습니다.이용자 입장에서는 문자 메시지에 포함된 인터넷 주소는 가급적 누르지 않는 건 물론이고, 스마트폰 환경설정에서 '알 수 없는 출처'의 앱 설치를 막아두고 함부로 허용하지 않는 게 기본적인 방어책이 될 수 있습니다.(영상취재 : 김현상, 영상편집 : 김선탁)정영태 기자jytae@sbs.co.kr☞[2014 소치 동계올림픽] 열정의 소치 꿈꾸는 평창☞[SBS기자들의 생생한 취재현장 뒷이야기 '취재파일']☞ SBS뉴스 공식 SNS [SBS8News 트위터] [페이스북]저작권자 SBS&SBS콘텐츠허브 무단복제-재배포 금지"
5,2014-01-27,과거 지우개족부터 견우와 직녀까지…올해의 블루슈머는?,https://news.naver.com/main/read.nhn?mode=LSD&mid=shm&sid1=101&oid=214&aid=0000337804,MBC,"[뉴스데스크]◀ 앵커 ▶'블루슈머'는 '블루오션'과 '컨슈머', 즉 소비자의 합성어로, 경쟁자가 없는 시장의 소비자, 즉 유망산업을 말합니다.통계청이 올해의 '블루슈머' 6개 분야를 선정했는데요.'과거 지우개족', '스몰웨딩족', '꽃보다 누나', '견우와 직녀', '반려족', '배려 소비자' 이렇게 6개 분야라고 합니다.남상호 기자가 올해의 블루슈머를 소개합니다.◀ 리포트 ▶10초 뒤 자동으로 사라지는 사진.이 메신저를 통해 오고가는 사진은 하루 4억장에 이릅니다.온라인에 흔적을 남기길 꺼려하는 이른바 '과거 지우개족'이 새로운 소비자층으로 떠오르면서, 흔적을 샅샅이 지워주는 IT업체에도 쉴 새 없이 상담이 몰려들고 있습니다.◀ 김호진 대표/디지털 흔적 관리업체 ▶""이 모든 기록이 그대로 있잖아요 인터넷 속에. 이런 것들이 사람들을 만날 때 계속 끄집어져서 자기를 판단해서 이 사람을 만나거든요. 그게 진짜 심각한 문제라는 거죠.""백화점 여성 의류 매장에 뜬금없이 등장한 유기농 베이커리.옷을 사러 왔다 들르는 주부들로 붐빕니다.2~30대보다 훨씬 지갑에 여유가 있고 가치 소비에 투자하는 4~50대 여성, 이른바 '꽃보다 누나'족을 노린 것입니다.◀ 기경용 대리/백화점 의류패션팀 ▶""4,50대 여성들은 건강한 먹거리에도 관심이 많습니다. 그래서 의류매장층에 베이커리 매장을 놓은 전략이 성공하고 있습니다.""평균 1억원이 넘는 결혼 비용에 지쳐 아담하고 독특한 결혼을 추구하는 '스몰웨딩족'.배우자와 떨어져 두집 살림을 하는 '견우와 직녀'.개나 고양이 같은 반려동물에 많은 지출을 하는 '반려족'.공정무역이나 착한 소비를 지향하는 '배려소비자' 등도 올해 새로운 시장을 창출하기 위해 눈여겨 봐야 하는 소비자들로 등장했습니다.MBC뉴스 남상호입니다.(남상호 기자 fatshady@imbc.com)[저작권자(c) MBC (www.imnews.com) 무단복제-재배포 금지]"
6,2014-01-27,그리스 서부 섬 규모 5.9 지진…비상사태 선포,https://news.naver.com/main/read.nhn?mode=LSD&mid=shm&sid1=104&oid=001&aid=0006723973,연합뉴스,"규모5.9의 지진으로 피해가 발생한 이오니아해의 케팔로니아 섬 모습 (AP=연합뉴스)(이스탄불=연합뉴스) 김준억 특파원 = 그리스 정부가 규모 5.9의 지진으로 일부 피해가 발생한 이오니아해의 케팔로니아 섬에 비상사태를 선포했다고 현지 일간지 카티메리니가 27일(현지시간) 보도했다.그리스 지질조사국에 따르면 26일 오후 4시께 그리스 서부 케팔로니아 섬에서 규모 5.9의 지진이 발생했으며 최고 규모 5.2의 여진이 3차례 뒤따랐다.이아니스 미켈라키스 내무장관은 전날 오후 현장을 방문하고 ""인명피해는 가벼운 부상자 7명이고 건물들은 지진에도 잘 견뎠다""며 ""심각한 피해는 아직 없다""고 말했다.당국은 기술진이 학교 등 공공건물의 안전을 진단하고 있으며 진단이 끝날 때까지 휴교한다고 밝혔다.이 지진으로 도로와 건물 등이 일부 손상됐으며 집 밖으로 피신한 주민 수백명은 붕괴 우려로 귀가하지 않고 승용차 등에서 노숙했다.규모5.9의 지진으로 피해가 발생한 이오니아해 케팔로니아 섬에 있는 한 슈퍼마켓의 처참한 모습 (AP=연합뉴스)공항 직원들도 청사 안에서 근무하는 것을 거부해 아테네행 항공편을 이용한 승객들은 청사 밖에서 탑승 수속을 밟았다.미켈라키스 내무장관은 주민에게 임시 거처를 제공하고자 2천명을 수용할 수 있는 선박 2척을 보냈다고 밝혔다.케팔로니아 섬은 지난 1953년에 규모 7.2의 강진으로 막대한 피해가 발생한 바 있다.그리스는 지진이 자주 발생하는 지역으로 지난 1999년 9월 5.9 규모의 강진이 발생해 143명이 숨졌다.justdust@yna.co.kr▶연합뉴스앱▶궁금한배틀Y<저작권자(c)연합뉴스 무단전재-재배포금지>"
7,2014-01-27,[뉴스플러스] 체내 독소 제거 '해독주스' 인기…디톡스 효과는?,https://news.naver.com/main/read.nhn?mode=LSD&mid=shm&sid1=103&oid=214&aid=0000337805,MBC,"[뉴스데스크]◀ 앵커 ▶대기중 미세먼지며, 각종 화학 물질로 인한 환경호르몬.이런 유해물질이 우리 몸 속 만병의 원인이 된다는 진단에서 이른바 '디톡스', 해독 요법이 요즘 인기입니다.그 방법도 다양한데요.오늘 뉴스플러스에선 해독요법의 효과를 살펴보겠습니다.먼저 신지영 기자입니다.◀ 리포트 ▶브로콜리와 양배추, 토마토, 당근을 삶아 사과, 바나나와 함께 갈아냅니다.52살 조정희 씨는 이 주스를 마신지 6개월 만에, 어떤 약을 먹어도 낫지 않던 음식 알레르기가 다 나았다고 말합니다.◀ 조정희/해독주스로 알레르기 치료 ▶""가려운 것 때문에 우울증도 동반이 됐었다 가려운게 다 들어가니까 자신감이라고나 할까요. 몸도 편하고 스트레스도 안받아요.""채소를 삶으면 흡수율이 90%까지 높아지는데, 이를 유산균과 함께 매일 마시면 체내 독성물질이 빠지고 유익균의 활동을 돕는다는 원리입니다.◀ 서재걸/전문의 ▶""항산화물질 가운데 가열했을 때 더 많이 흡수되는 것들이 있어 그런 걸 많이 먹을 수 있다는 게 큰 장점""1박 2일에 걸쳐 간을 청소한다는 해독요법도 있습니다.첫날 저녁과 둘째날 아침을 굶고 대신 담관을 넓히는 약을 먹습니다.그러면 모아둔 담즙이 한꺼번에 나오면서 담관에 쌓인 노폐물도 같이 빠진다는 겁니다.◀ 1박 2일 '해독요법' 경험자 ▶""좋더라고요. 일단 매번 (간수치가) 몇 배 높게 나오다가 이번에는 (정상범위 기준의) 근사치로 나왔어요.""◀ 박준상/한의사 ▶""오일성분이 십이지장 점막을 통과할 때 호르몬 분비를 도와 모아둔 담즙을 쏟아내게 하는거죠.""사람들의 관심을 말해주듯, 대형서점 건강코너에는 다양한 해독법을 담은 책들이 경쟁적으로 쏟아져 나와 있고, 채소와 과일을 갈아 만든 해독주스 전문점도 인기를 끌고 있습니다.◀ 박미산/주스전문점 직원 ▶""밀싹은 몸속의 독소를 제거하는 디톡스라는 성분이 있는데요. 디톡스를 원하시는 고객분들이 많이 찾으십니다.""◀ 신지영 기자 ▶채소나 과일에 함유된 식이섬유를 충분히 먹는다거나 물을 많이 마시는 건 건강상식에서 크게 벗어나지 않아 잘 지킨다면 몸에 좋은 것들입니다.하지만 잘못된 해독요법은 오히려 몸을 상하게 할 수도 있습니다.나윤숙 기자, 어떤 점을 주의해야 할까요?◀ 나윤숙 기자 ▶해독요법의 기본은 금식과 절식입니다.채식을 많이 하는 대신 지방 탄수화물 섭취는 줄이거나 길게는 2주 정도 아예 굶어서 외부에서 들어오는 독소의 양을 줄이는 동시에 해독을 담당하는 장기들을 쉬게 하는 겁니다.해독의 70%를 담당하는 간도 이 때 쉽니다.하지만 잠시 쉰다고 해서 그 기능이 더 향상되는 건 아닙니다.개인의 건강상태에 따라선 오히려 영양소가 부족해져 간 자체의 기능을 유지하는데 문제가 생기기도 합니다.◀ 심경원/이대목동병원 가정의학과 교수 ▶""굶다보면 지방산 대사에 이상이 생겨서 오히려 지방간염이 악화돼 간수치가 올라가는 경우도 있고요.""특히 다이어트 목적의 해독요법은 한계가 있습니다.한동안 식사량이 줄면 뇌에서 식욕을 돋구는 호르몬을 분비하게 해 이전보다 살이 더 찔 수도 있고, 살이 빠졌더라도 유지하는데는 해독요법 보다 운동이 훨씬 중요합니다.◀ 유덕주/해독요법으로 감량 ▶""운동을 여행 관련해서 한 일주일 정도 못했던 적이 있었는데, 한 1.5kg 정도 증가된...""단기간 굶다 더 큰 병을 얻는 사람도 생깁니다.당뇨 환자는 저혈당이 오면 쇼크나 혼수 상태에 빠질 수 있고, 단백질 대사에 문제가 있는 통풍 환자의 경우 통풍 발작이 급격하게 일어날 수 있습니다.또 심혈관 질환이 있다면 탈수가 되면서 심장발작이나 뇌졸중 위험도 높아집니다.◀ 정원석/경희대 한방병원 교수 ▶""혈류량이 줄어들면서 경색의 위험성이 높아집니다. 그래서 심장에 경색이 생기면 심근경색으로 급사하실 수가 있고, 뇌경색이 진행이 되면 뇌졸중과 같은 (병에 걸립니다.)""때문에 해독요법을 시도할 땐 하루 섭취 권장량의 4분의 3정도는 반드시 먹고 간 활동에 꼭 필요한 무기질과 수분을 적절히 공급해 주는게 중요합니다.MBC뉴스 나윤숙입니다.(신지영 기자 shinji@imbc.com)[저작권자(c) MBC (www.imnews.com) 무단복제-재배포 금지]"
