,날짜,기사 제목,기사 링크,기사 출처,기사 내용
23,2014-01-26,파리서 일본군 위안부 해결 서명운동,https://news.naver.com/main/read.nhn?mode=LSD&mid=shm&sid1=102&oid=001&aid=0006720608,연합뉴스,"파리서일본군 위안부 해결 서명운동     (파리=연합뉴스) 박성진 특파원 = 한국정신대문제대책협의회와 위안부 문제 해결 모임인 희망나비가 25일(현지시간) 프랑스 파리 에펠탑 부근 샤이오궁 광장에서 일본군 위안부 문제 해결을 위한 서명 운동을 벌였다. 한 프랑스인이 일본 정부의 위안부 문제 해결을 촉구하는 서명 운동에 참가하고 있다. 2013.1.26    sungjinpark@yna.co.kr(파리=연합뉴스) 박성진 특파원 = 프랑스 파리에서 25일(현지시간) 일본군 위안부 문제 해결을 위한 서명 운동이 벌어졌다.한국정신대문제대책협의회와 위안부 문제 해결 모임인 희망나비는 이날 오후 파리 에펠탑 부근 샤이오궁 광장에서 프랑스인과 관광객들을 대상으로 일본의 위안부 문제 해결을 촉구하는 '세계 1억인 서명 운동'을 진행했다.한국인 유학생과 교포들은 2차 세계대전 당시 일본군에 강제로 끌려간 위안부의 고통을 알리면서 프랑스인들에게 서명 참가를 요청했다.파리에서는 작년 9월 위안부 피해자 김복동 할머니가 참석한 가운데 일본군 위안부 문제 해결을 촉구하는 수요집회가 개최됐다.파리서일본군 위안부 해결 서명운동     (파리=연합뉴스) 박성진 특파원 = 한국정신대문제대책협의회와 위안부 문제 해결 모임인 희망나비가 25일(현지시간) 프랑스 파리 에펠탑 부근 샤이오궁 광장에서 일본군 위안부 문제 해결을 위한 서명 운동을 벌였다. 한 프랑스인이 일본 정부의 위안부 문제 해결을 촉구하는 서명 운동에 참가하고 있다. 2013.1.26    sungjinpark@yna.co.kr이날 행사를 진행한 정새날 씨는 ""김복동 할머니의 파리 방문이 일회성 행사로 그쳐서는 안 된다는 생각에 서명 운동을 추진하게 됐다""고 말했다.정씨는 ""김 할머니가 수요집회에 참석한 파리를 시작으로 다음 달에는 베를린에서 서명 운동이 진행되는 등 유럽 차원의 캠페인으로 확대될 것""이라고 덧붙였다.이날 행사에는 홀로코스트(유대인 대학살) 공부를 위해 독일과 프랑스를 방문 중인 창원대 사학과 신동규 교수와 학생도 참가해 서명 운동을 도왔다.sungjinpark@yna.co.kr▶연합뉴스앱▶궁금한배틀Y<저작권자(c)연합뉴스 무단전재-재배포금지>"
24,2014-01-26,설 연휴 공연장 나들이 어때요,https://news.naver.com/main/read.nhn?mode=LSD&mid=shm&sid1=103&oid=001&aid=0006720703,연합뉴스,"뮤지컬 '맘마미아' (사진제공=신시컴퍼니)(서울=연합뉴스) 임수정 기자 = 몸도 마음도 여유로워지는 설 연휴다. 이번 연휴에는 오랜만에 둘러앉은 가족, 친구, 연인과 평소 보고 싶었던 공연 한 편쯤을 보는 것이 어떨까. 공연계는 이미 다양한 할인 혜택과 이벤트로 관객을 맞을 준비를 마쳤다. 설 연휴에 볼만한 공연을 소개한다.◇ 뮤지컬·연극평소 보고 싶었지만 비싼 티켓 가격 때문에 망설였던 대형 뮤지컬이 있다면 이번 연휴 기간 일정을 한 번 확인해보자. 인기리에 공연 중인 뮤지컬 대부분은 설맞이 할인 혜택을 제공한다.뮤지컬 '위키드' (사진제공=설앤컴퍼니)세계적인 팝그룹 아바의 히트곡을 엮어 만든 '맘마미아'는 전 세대에 걸쳐 두루 사랑받는 뮤지컬계 스테디셀러다. 올해로 한국 공연 10주년을 맞아 영국 오리지널팀의 내한 공연을 선보이고 있다. 연휴 기간인 1월 28일부터 2월 2일까지 공연 예매자에게 10~15%의 할인 혜택을 준다. ☎1544-1555.뮤지컬 '저지 보이스'도 가족 관객이 함께 보기 좋은 작품. '캔트 테이크 마이 아이즈 오프 유'(Can't Take My Eyes off You), '쉐리'(Sherry) 등 히트곡을 남긴 '포시즌스'를 노래로 만든 작품이라 젊은 뮤지컬 관객부터 중장년층까지 함께 즐길 만하다. 가족 관객을 겨냥해 1월 30일부터 2월 2일까지 30% 할인된 가격의 4인 패키지를 마련했다. ☎02-541-3184.화려한 볼거리로 가득한 브로드웨이 인기 뮤지컬 '위키드'는 현재 옥주현, 정선아 등의 '디바'들을 앞세워 한국어 공연을 선보이고 있다. 동화 '오즈의 마법사'를 유쾌하게 뒤집어 초록 마녀 엘파바와 금발 마녀 글린다의 우정과 성장 이야기를 그린다. 전석 30% 할인된 가격으로 관람할 수 있다. ☎1577-3363.설 연휴에도 떨어져 있기 싫은 연인들에게는 로맨틱코미디 공연이 제격이다.뮤지컬 '김종욱 찾기' (사진제공=씨제이 이엔엠)뮤지컬 '웨딩 싱어'는 아담 샌들러와 드류 베리모어가 출연해 큰 흥행을 기록한 동명의 영화(1998)를 무대로 옮긴 작품. 1월 30일과 2월 1·2일 공연에 한해 60% 할인 혜택을 준다. ☎02-744-4033.첫사랑을 찾는 여자와 그를 찾아주는 남자의 운명 같은 사랑을 노래하는 뮤지컬 '김종욱 찾기'와 아홉 커플의 사랑 이야기를 옴니버스 형식으로 묶은 연극 '올모스트 메인'은 반값에, 젊은이들의 꿈과 사랑을 경쾌한 음악과 춤에 녹여낸 스테디셀러 뮤지컬 '그리스'는 30% 할인된 가격으로 연휴 기간 관람할 수 있다. 각각 ☎02-744-4033, ☎1600-8523, ☎02-552-2035.◇ 전통공연명절 분위기를 만끽할 수 있는 다양한 전통 공연도 잇달아 열린다.국립국악원 민속악단 연희부 (사진제공=국립국악원)국립국악원은 1월 29·30일, 2월 1일 3일간 기획 공연 '청마의 울림'을 예악당 무대에 올린다. 창작악단의 국악관현악 연주부터 민속악단의 민요·동요 메들리, 풍물놀이, 접시 돌리기 등의 연희까지 이어진다. ☎02-580-3300.서울남산국악당은 1월 31일부터 2월 2일까지 마당극 '허생전'을 앙코르 공연으로 선보인다. 작년 12월 공연된 작품으로, 백면서생 허생이 처의 구박에 못 이겨 글공부를 접고 장사에 나서면서 벌어지는 사건을 그린다. 가족 관객, 10인 이상 단체 관객에게 최대 30%까지 할인 혜택이 제공된다. ☎02-3676-3676.가족 단위 시민들이 함께 즐길 수 있는 전통 놀이 행사도 다채롭다.북서울 꿈의숲아트센터에서는 2월 1일 전통연 만들기 등을 체험할 수 있으며, 세종문화회관 상설전시관인 '세종이야기'에서는 새해맞이 복주머니와 복조리를 만들어볼 수 있다. 각각 ☎02-2289-5401, ☎02-399-1177~8.sj9974@yna.co.kr▶연합뉴스앱▶궁금한배틀Y<저작권자(c)연합뉴스 무단전재-재배포금지>"
25,2014-01-26,"올랑드 프랑스 대통령 ""동거녀와 헤어졌다""(종합)",https://news.naver.com/main/read.nhn?mode=LSD&mid=shm&sid1=104&oid=001&aid=0006720626,연합뉴스,"올랑드 ""트리에르바일레와 헤어졌다""(AP=연합뉴스) 최근 여배우 쥘리 가예와의 스캔들로 구설수에 올랐던 프랑수아 올랑드 프랑스 대통령이 동거녀 발레리 트리에르바일레와 헤어졌다. 올랑드 대통령은 트리에르바일레가 퍼스트 레이디 자격으로 초청받은 인도 자선행사에 참석하기 위해 출국하기 하루전인 25일(현지시간) 결별 사실을 공식적으로 밝혔다. 사진은 2012년 5월 6일 당시 사회당 대통령 후보이던 올랑드가 고향 튈에서 트리에르바일레와 함께 대선 결선투표를 마치고 투표소를 떠나고 있는 모습.    marshal@yna.co.kr(파리=연합뉴스) 박성진 특파원 = 최근 여배우와 스캔들을 일으킨 프랑수아 올랑드 프랑스 대통령이 동거녀 발레리 트리에르바일레와 결국 헤어졌다.올랑드 대통령은 25일 오후(현지시간) AFP통신과 전화 인터뷰에서 개인 자격으로 밝히는 것이라며 ""트리에르바일레와 파트너 관계를 이제 끝냈다고 알린다""라고 말했다.지난 10일 연예주간지 클로저가 올랑드 대통령이 여배우 쥘리 가예와 사귀고 있다고 최초로 보도한지 약 2주만이다.올랑드 대통령은 2007년 첫 동거녀인 세골렌 루아얄 전 사회당 대표와 헤어지고 나서 '파리 마치' 기자 출신인 트리에르바일레와 결혼하지 않고 7년간 함께 살아왔다.2012년 올랑드가 대통령에 당선된 후로는 동거녀 트리에르바일레가 사실상 퍼스트 레이디로 활동해 왔다.트리에르바일레는 올랑드와 동거하기 전에 다른 남자들과 결혼·이혼한 경력이 2차례 있으며, 예전 결혼에서 얻은 아들 3명이 있다.올랑드는 루아얄과 사이에 4명의 자녀를 두었으나 트리에르바일레와는 자식이 없다.올랑드 대통령은 트리에르바일레가 인도에서 열리는 자선 행사에 참석하기 위해 26일 출국하기 하루 전인 이날 결별을 공식적으로 밝혔다.다정했던 한때(AP=연합뉴스) 최근 여배우 쥘리 가예와의 스캔들로 구설수에 올랐던 프랑수아 올랑드 프랑스 대통령이 동거녀 발레리 트리에르바일레와 헤어졌다. 올랑드 대통령은 트리에르바일레가 퍼스트 레이디 자격으로 초청받은 인도 자선행사에 참석하기 위해 출국하기 하루 전인 25일(현지시간) 결별 사실을 공식적으로 밝혔다. 사진은 2012년 5월 6일 올랑드가 대통령으로 당선된 후 파리에서 트리에르바일레와 포옹하고 있는 모습.    marshal@yna.co.kr올랑드의 외도설 충격으로 일주일 넘게 병원에 입원했던 트리에르바일레는 프랑스 원조단체인 '기아대책활동'(ACF)으로부터 퍼스트 레이디 자격으로 초청을 받아 오는 27∼28일 이틀 동안 인도에서 열리는 자선 행사에 참석할 예정이다.이 때문에 트리에르바일레의 인도 방문 전에 동거녀와 관계를 확실히 해야 한다는 여론이 확산했다.올랑드 대통령은 지난 14일 신년 기자회견에서 ""다음 달 11일 미국 공식 방문 전에 동거녀와 관계를 명확하게 밝힐 것""이라고 말한 바 있다.트리에르바일레와 헤어진 올랑드 대통령이 당장 여배우 가예를 퍼스트레이디로 받아들일 가능성은 현재로는 낮아 보인다.올랑드 대통령은 최근 기자들과 대화에서 ""미래에는 엘리제궁에 '퍼스트레이디'가 없었으면 한다""는 발언을 한 것으로 알려졌기 때문이다.올랑드 대통령의 고문들도 당분간은 '독신남 대통령'으로 남아야 한다는 조언을 했다는 보도도 나왔다.가예와 스캔들이 터진 이후 올랑드 대통령은 네덜란드와 바티칸을 동거녀 없이 혼자 방문했다.다음 달 11일 미국 공식 방문 때도 퍼스트 레이디 없이 혼자 미국에 갈 것으로 보인다.sungjinpark@yna.co.kr▶연합뉴스앱▶궁금한배틀Y<저작권자(c)연합뉴스 무단전재-재배포금지>"
26,2014-01-26,'유혈사태' 우크라이나서 시위대 1명 추가 사망,https://news.naver.com/main/read.nhn?mode=LSD&mid=shm&sid1=104&oid=001&aid=0006720593,연합뉴스,"빨리 더 큰 진전을...    (AP=연합뉴스) 우크라이나 반정부 시위로 사망자가 속출한 가운데 24일(현지시간) 수도 키예프 중심부에서 정교회 사제들이 시위대와 경찰 저지선 사이에 서서 기도를 올리고 있다.    최대 야당 '바티키프쉬나'(조국당) 당수 아르세니 야체뉵 등 야권 지도자 3명은 전날 빅토르 야누코비치 대통령과 4시간여에 걸친 협상을 갖고 양측이 유혈 충돌을 자제하기로 하는 등 일부 진전을 이뤄냈다.    bulls@yna.co.krOrthodox priests pray as they stand between pro-European Union activists and police lines in central Kiev, Ukraine, early Friday, Jan. 24, 2014. A top Ukrainian opposition leader on Thursday urged protesters to maintain a shaky cease-fire with police after at least two demonstrators were killed in clashes this week, but some in the crowd appeared defiant, jeering and chanting ""revolution"" and ""shame."" (AP Photo/Sergei Grits)야권, 정부청사 점거…반정부 시위 격화(알마티=연합뉴스) 김현태 특파원 = 우크라이나 야권 시위대와 경찰 간 무력 충돌이 시위 참가자 사망 사태로까지 악화한 가운데 병원에서 치료를 받던 시위대 1명이 추가로 숨진 것으로 알려졌다.AFP 통신 등 외신은 25일(현지시간) 키예프 의료당국의 발표를 인용, 이같이 보도했다.소식에 따르면 숨진 40대 남성은 지난 22일 새벽 키예프 시내 그루셰프스키 거리 시위 현장에서 크게 다쳐 병원에서 치료를 받아오던 중 숨진 것으로 전해졌다.당국은 이 남성이 병원으로 올 때부터 폐를 비롯해 온몸에 심각한 부상을 입은 상태였으며 치료에 전력을 기울였지만, 사망했다고 밝혔다.이로써 최근 우크라이나 유혈사태에 따른 사망자는 당국의 공식집계상 3명으로 늘었으며 야권집계로는 6명이 됐다.불타는 키예프(AP=연합뉴스) 우크라이나 수도 키예프에서 22일(현지시간) 반정부 시위자가 경찰쪽을 향해 화염병을 던지고 있다. 시위대와 진압경찰 사이에 첩첩히 쌓여있는 타이어에 불이 붙어 거리는 온통 불바다로 변했다. 시 관계자와 경찰은 이날 양측의 무력충돌 과정에서 총격이 발생해 2명이 숨졌다고 밝혔으나 야권은 사망자가 5명에 이르고 부상자는 300여명에 달한다고 주장했다.    marshal@yna.co.krA protester throws a Molotov cocktail during clashes with police in central Kiev, Ukraine, Wednesday, Jan. 22, 2014. City health officials and police said that two people died of gunshot wounds during the clashes Wednesday morning. But the opposition charges that as many as five people have died. The mass protests in the capital of Kiev erupted after Ukrainian President Viktor Yanukovych spurned a pact with the European Union in favor of close ties with Russia, which offered him a $15 billion bailout. (AP Photo/Efrem Lukatsky)앞서 야권 저항운동본부는 경찰과의 이번 무력충돌로 5명이 사망하고 300여명이 다쳤다고 밝혔다. 그러나 우크라이나 내무부는 23일 야권의 주장을 부인하며 시위대와 경찰의 충돌로 2명이 사망했다고 발표했다.현재 우크라이나 당국과 야권은 시위 사망자수뿐만이 아니라 사망 원인에 대해서도 엇갈린 주장을 펴고 있다.야권은 희생자들이 시위 현장 주변 건물 지붕에 배치된 진압부대 저격수의 총에 맞아 숨졌다고 주장하고 있다. 하지만 경찰은 진압 부대원들이 총기를 보유하고 있지 않았다며 강하게 부인하고 있다.한편 야권은 24일 농업정책부 청사를 점거한 데 이어 이날 에너지부 청사까지 난입하는 등 반정부 시위사태는 더욱 악화하고 있다.우크라이나 야권은 지난해 11월부터 2개월 이상 유럽연합(EU)과의 협력협정 체결중단에 항의하며 시위를 벌여오고 있다. 시위는 한때 소강상태였으나, 지난 16일 여당이 주도하는 의회가 집회와 시위에 대한 통제를 강화하는 법안을 통과시키며 다시 격화했다.mtkht@yna.co.kr▶연합뉴스앱▶궁금한배틀Y<저작권자(c)연합뉴스 무단전재-재배포금지>"
27,2014-01-26,"세계 각국의 '올해의 차', 어떤 차가 있나?",https://news.naver.com/main/read.nhn?mode=LSD&mid=shm&sid1=103&oid=008&aid=0003195152,머니투데이,"[머니투데이 김남이 기자][[Car&Life]'북미 올해의 차', 쉐보레 '콜펫 스팅레이' ...'한국 올해의 차'는 '제네시스']본문 이미지 영역쉐보레 콜벳 스팅레이' /사진제공=한국GM세계 각국에서 ‘올해의 차’ 선정 소식이 들리고 있다. 수 많은 ‘올해의 차’ 중 가장 관심이 쏠리는 건 자동차의 본 고장인 ‘북미 올해의 차’와 ‘유럽 올해의 차’다. GM, 포드, 크라이슬러(이상 미국)와 메르세데스-벤츠, BMW, 폭스바겐(이상 유럽) 등 세계 유수의 자동차 브랜드들이 올해의 차로 뽑히기 위해 경쟁을 벌인다.‘북미 올해의 차’는 미국과 캐나다 지역의 신문, 잡지, 온라인 등에서 자동차담당 기자 48명이 심사위원으로 참여한다. 선정위원회는 해마다 그래 왔듯이 지난 13일(현지시간) 미국 디트로이트에서 열린 북미국제오토쇼 현장에서 발표를 했다.'2014 북미 올해의 차'에는 GM의 고급 스포츠카 쉐보레 ‘콜벳 스팅레이’가 뽑혔다. GM은 지난해 고급 세단인 캐딜락 ‘ATS’가 선정된 데 이어 2년 연속 ‘북미 올해의 차’에 오르는 영예를 안았다. GM의 2년 연속 ‘북미 올해의 차’ 수상을 두고 업계에서는 미국 자동차 업계의 부활로 분석하고 있다.'2014 북미 올해의차' 자리에 오른 쉐보레 ‘콜벳’은 1953년 첫 선을 보인 이후 7세대인 현재 모델까지 모터스포츠를 통해 기술과 스타일에서의 혁신을 거듭했다는 평가를 받고 있다.스팅레이(Stingray :가시가오리)’라는 별명을 얻었던 1963년형 ‘스팅레이’ 모델을 계승해 탄생한 새 모델은 6.2리터 V8 LT1 엔진을 장착해 최고 출력이 450마력에 이르고, 정지상태에서 100km/h에 도달 시간이 4초 이하로 역대 콜벳 중 가장 빠르다.현대기아차는 ‘2012 북미 올해의 차’에현대차의 ‘아반떼’(현지명 엘란트라)가 이름을 올렸지만 올해는 최종 후보에 오르지 못했다.본문 이미지 영역폭스바겐 골프 7세대‘2014 유럽 올해의 차’는 선정 절차가 진행중이다. 유럽의 기자단과 자동차 전문가 59명이 심사를 해 오는 3월 제네바모터쇼에서 발표한다. 지난해 12월 유럽 올해의 차 위원회(COTY)는 ‘2014 유럽 올해의 차’ 최종 후보를 발표했다.BMW ‘i3’, 메르세데스-벤츠 ‘S-클래스’, 푸조 ‘308’, 시트로엥 ‘C4 피카소’, ‘마쯔다3’, 스코다 ‘옥타비아’, 테슬라 ‘모델S’ 등 7개의 모델이 최종 후보에 올랐다. ‘i3’와 ‘모델S’와 같은 전기차 모델이 2종이나 있는 것이 특징이다. 지난해에는 폭스바겐 ‘골프’가 ‘2013 유럽 올해의 차’를 수상했다.7세대 ‘골프’는 지난해 11월 도쿄모터쇼에서 발표한 '2013-14 일본 올해의 차‘에도 선정됐다. 일본에서 수입차 최초로 상을 받았다.일본 자동차평론가, 기자, 학계 관계자 등은 결선에 오른 10개의 모델 중 ‘골프’에 가장 높은 점수를 줬다. 업계에서는 ‘골프’와 혼다의 ‘피트’가 치열한 경합을 벌일 것으로 예상했으나 큰 점수 차이로 ‘골프’가 1위를 차지했다.‘2014 한국 올해의 차’는 지난 21일 가려졌다. 한국자동차기자협회는 현대차의 ‘제네시스’를 대상으로 뽑았다. 특별상에는  BMW의 ‘뉴 5시리즈, 벤츠의 ‘S-클래스’가 이름을 올렸다.‘제네시스’는 가격대비 가치, 성능, 편의성 및 편의사양, 디자인 및 감성, 안전 등 부문에서 고르게 높은 점수를 받아 1위에 올랐다. 현대차가 2009년부터 총 5000억원을 투자해 개발한 2세대 '제네시스'는 올 상반기 중으로 미국을 비롯해 유럽 등으로 본격 진출할 예정이다.한편 ‘한국 올해의 차’는 올해가 4회째로 연륜이 짧다. 1회에는 기아차의 ‘K5’, 2회에는 현대차의 ‘I40’, 3회에는 토요타의 ‘캠리’가 대상을 받았다.본문 이미지 영역현대차 제네시스 /사진제공=현대자동차[오늘의 HOT포토][스페셜 포토][손안의 경제뉴스 머니투데이 모바일웹]김남이기자 kimnami@<저작권자 ⓒ '돈이 보이는 리얼타임 뉴스' 머니투데이, 무단전재 및 재배포 금지>"
28,2014-01-26,살처분 작업 투입되는 장병,https://news.naver.com/main/read.nhn?mode=LSD&mid=shm&sid1=102&oid=001&aid=0006720432,연합뉴스,(부여=연합뉴스) 이재림 기자 = 오리에 이어 닭에서도 조류인플루엔자(AI) 감염이 처음으로 확인된 25일 충남 부여군 홍산면 한 종계장에 육군 장병이 살처분 작업을 위해 줄지어 계사로 들어서고 있다. 이곳에서 사육하던 종계는 1만6천여마리다. 2014.1.25walden@yna.co.kr▶연합뉴스앱▶궁금한배틀Y<저작권자(c)연합뉴스 무단전재-재배포금지>
