,날짜,기사 제목,기사 링크,기사 출처,기사 내용
127,2014-01-27,"삼성전자-구글, 특허 서로 공유한다(종합)",https://news.naver.com/main/read.nhn?mode=LSD&mid=shm&sid1=105&oid=001&aid=0006721990,연합뉴스,"기존 특허는 물론 앞으로 10년간 출원하는 특허까지(서울=연합뉴스) 권영전 기자 = 삼성전자와 구글이 서로의 특허를 공유하기로 결정했다.삼성전자는 구글과 상호 호혜 원칙에 따라 광범위한 기술·사업 영역에 걸쳐 특허 크로스라이선스 계약을 맺는다고 27일 밝혔다.(AP=연합뉴스DB)이번 계약을 통해 양사는 기존에 가지고 있던 특허는 물론이고 앞으로 10년간 출원하는 특허까지 공유한다.이에 따라 삼성전자와 구글은 세계 정보기술(IT) 업계를 선도하는 서로의 특허를 마음껏 활용할 수 있게 돼 현재뿐 아니라 미래의 제품·기술 개발 분야에서 협력을 더욱 강화하는 토대를 마련하게 됐다.특히 애플과 기나긴 법정 특허분쟁을 벌이고 있는 삼성전자는 이번 협력을 통해 든든한 우군을 확보하게 됐다.삼성전자는 미국 법원의 명령에 따라 애플과 다음 달까지 최고경영자(CEO)급 협상에 나서야 하지만 양사가 실제 합의에 도달할 수 있을지는 미지수다.애플은 삼성이 '앞으로 제품을 베끼지 않겠다'는 선언을 해야 합의를 해주겠다고 나서는 등 오히려 대립각을 세우고 있는 분위기다.삼성전자는 이번 협력으로 안드로이드 스마트폰 판매량뿐 아니라 지적재산권 등 다른 측면에서도 확실한 우위를 차지하게 돼 시장에서의 경쟁력 강화에도 도움이 될 것으로 보인다.삼성전자 지적재산권(IP)센터장 안승호 부사장은 ""구글과의 이번 계약 체결은 불필요한 경쟁보다 협력을 통해 더 발전할 수 있음을 보여 주는 것""이라며 ""IT 업계에 매우 의미 있는 일""이라고 자평했다.앨런 로(Allen Lo) 구글 특허 담당 고문은 ""삼성전자와 크로스라이선스를 맺어 기쁘다""며 ""이러한 협력을 통해 잠재적인 소송 위험을 줄이고 혁신에 집중할 수 있을 것""이라고 분석했다.comma@yna.co.kr▶연합뉴스앱▶궁금한배틀Y<저작권자(c)연합뉴스 무단전재-재배포금지>"
128,2014-01-27,"'안철수신당' 가칭, '새정치신당'으로 결정",https://news.naver.com/main/read.nhn?mode=LSD&mid=shm&sid1=100&oid=001&aid=0006722174,연합뉴스,"새정추, 청년위원회 출범    (서울=연합뉴스) 최재구 기자 = 안철수 무소속 의원이 27일 국회에서 열린 '새정치추진위원회 청년위원회 해오름식'에 참석해 있다. 2014.1.27    jjaeck9@yna.co.kr安 ""고정번호 받고자 의원영입 무리 안해""(서울=연합뉴스) 송진원 기자 = 무소속 안철수 의원측의 신당 창당 준비기구인 '새정치추진위원회(새정추)'는 27일 신당의 임시 명칭(가칭)을 '새정치신당'으로 결정했다.새정추는 이날 여의도 신동해빌딩 사무실에서 회의를 열고 이같이 결정했다고 새정추측이 밝혔다.새정추측은 ""신당의 가칭을 '새정치신당'으로 정해 일단 창당준비위원회를 구성한 뒤 중앙선관위에 신고할 방침""이라면서 ""창당 때까지 이 이름을 사용하고 최종 당명은 국민공모를 통해 확정할 것""이라고 말했다.한편, 안 의원은 이날 기자들과 만나 ""(지방선거에서 출마 후보자들이) 고정번호를 받고자 (현역 의원 영입을) 무리할 생각은 없다""라고 말했다.현행 공직선거법에 따르면 국회의원 의석수가 5석 이상이어야 신당의 공천 후보들이 지방선거에서 통일된 기호를 부여받게 된다.안 의원은 ""어차피 다들 정당들이 후보를 내면 자동으로 5번이 된다""며 ""그걸 꼭 무리해서 뭘 맞추려고 할 생각은 없다""라고 말했다.무소속 박주선·강동원 의원의 영입설이 의석수 확보를 위한 것 아니냐는 물음에도 ""고정번호를 받고자 하는 목적을 갖고 무리할 생각은 전혀 없다""며 ""오히려 좋은 분들 함께하는 게 중요하다""라고 거듭 강조했다.현역 의원들의 합류 시점에 대해선 ""모든 분이 사정들이 있으셔서…""라며 확답을 피했다.창당실무준비단장인 김성식 공동위원장은 이날 MBC 라디오 '신동호의 시선 집중'과의 인터뷰에서 기성 정치인 영입이 새 정치와 맞지 않는다는 비판에 대해 ""기성 정치권에 있었다 해도 개혁적이고 정치 변화를 위해 노력해 오신 분들은 새 정치의 소중한 자원""이라면서 ""이분들과 그동안 정치권에 몸담지 않았던, 전문성을 갖고 계신 분들이 서로 힘을 합쳐야 한다""라고  말했다.san@yna.co.kr▶연합뉴스앱▶궁금한배틀Y<저작권자(c)연합뉴스 무단전재-재배포금지>"
129,2014-01-27,서울 지하철역 30곳 라돈 기준초과…중점관리후 개선,https://news.naver.com/main/read.nhn?mode=LSD&mid=shm&sid1=102&oid=001&aid=0006722107,연합뉴스,"(서울=연합뉴스) 하채림 기자 = 서울 지하철역 30곳에서 '1급 발암물질'인 라돈 농도가 기준치를 초과했던 것으로 조사됐다.서울시는 지난해 시내 지하철 역사를 대상으로 벌인 라돈 농도 검사에서 기준치인 4pCi(피코큐리)를 한 번 이상 초과한 역사는 2호선 4곳, 3호선 5곳, 4호선 4곳, 5호선 8곳, 6호선 3곳, 7호선 5곳 등 총 30곳이었다고 27일 밝혔다.이들 역사는 대부분 깊은 지하에 건설된 곳이거나 화강암 지반을 지나 라돈 방출이 우려되는 곳으로 조사됐다.30곳 중 28곳은 서울시가 지난 2012년 10월 라돈 농도 저감대책 발표 당시 지하철 역사 깊이와 지질을 고려해 '특별관리구역'으로 정한 37곳에도 포함됐던 것으로 확인됐다.서울시는 기준을 넘지는 않았으나 근접한 역은 2호선 3곳, 3호선 2곳, 4호선 4곳, 5호선 5곳, 6호선 9곳, 7호선 1곳 등 24곳으로 파악됐다고 덧붙였다.이에따라 서울시는 라돈 기준치를 넘은 지하철 역사 30곳을 중점 관리 대상으로 정하고 라돈이 새나올 우려가 있는 배수로·맨홀 등을 밀폐하는 한편 라돈 전용 송풍기도 설치해 지금은 30곳 모두 라돈 농도가 기준치 아래로 떨어졌다고 확인했다.시는 30곳에 대해 매분기 라돈 농도 모니터링을 실시하고 있다.시는 기준치에 근접한 지하철 역사 24곳에 대해선 '격년관리역사'로 지정해 관리하고 있다.서울시는 시내 어린이집 120곳에 대해서도 라돈 농도를 조사하고 있다고 밝히고 현재까지 검사가 완료된 83곳 가운데 기준치를 초과한 곳은 없다고 전했다.라돈은 물리·화학적으로 제거할 수 없기 때문에 실내로 유입을 차단하고 환기로 제거하는 것이 피해를 줄이는 방법이다.자연에 존재하는 방사성 물질인 라돈은 폐암을 일으키는 것으로 알려졌다.국제암연구소(IARC)는 라돈을 석면 등과 함께 '인간에게 암을 일으키는' 1그룹(Group 1) 발암물질로 분류한다.<표> 서울시 지하철역사 라돈 관리 현황┌────┬────────────────┬───────────────┐│        │ 라돈 기준초과 '중점관리역사'   │ 라돈 기준근접 '격년관리역사' │├────┼────────────────┼───────────────┤│2호선   │동대문운동장, 을지로4가, 아현,  │시청, 영등포구청, 역삼        ││        │이화여대, 잠실                  │                              │├────┼────────────────┼───────────────┤│3호선   │교대, 충무로, 종로3가, 안국, 경 │독립문, 홍제                  ││        │복궁                            │                              │├────┼────────────────┼───────────────┤│4호선   │남태령, 삼각지, 회현, 충무로    │명동, 동대문운동장, 동대문, 미││        │                                │아삼거리                      │├────┼────────────────┼───────────────┤│5호선   │충정로, 서대문, 광화문, 종로3가,│왕십리, 마장, 답십리, 장안평, ││        │을지로4가, 동대문운동장, 청구,  │천호                          ││        │군자                            │                              │├────┼────────────────┼───────────────┤│6호선   │역촌, 고려대, 월곡              │응암, 불광, 독바위, 연신내, 구││        │                                │산, 광흥창, 신당, 동묘, 안암  │├────┼────────────────┼───────────────┤│7호선   │마들, 노원, 중계, 하계, 공릉    │온수                          │└────┴────────────────┴───────────────┘※ 중점관리역사는 라돈 검사에서 1회 이상 기준을 초과한 역사이며, 집중 관리 후 라돈 농도는 기준치 이하를 유지하고 있음.<서울시 자료 제공>tree@yna.co.kr▶연합뉴스앱▶궁금한배틀Y<저작권자(c)연합뉴스 무단전재-재배포금지>"
130,2014-01-27,"코스피, 신흥국 금융위기 우려에 장중 1,900선 붕괴(종합)",https://news.naver.com/main/read.nhn?mode=LSD&mid=shm&sid1=101&oid=001&aid=0006722092,연합뉴스,"코스피, 신흥국 금융위기 우려에 장중 1,900선 붕괴    (서울=연합뉴스) 임헌정 기자 = 27일 오전 서울 중구 을지로 외환은행 본점 딜링룸으로 코스피 지수가 전 거래일보다 35.98포인트(1.85%) 하락한 1,904.58을 나타내고 있다. 2014.1.27    kane@yna.co.kr(서울=연합뉴스) 김남권 기자 = 코스피가 아르헨티나 등 신흥국 금융위기 우려가 높아지면서 2% 가까이 떨어져 장중 1,900선마저 무너졌다.27일 코스피는 전 거래일보다 34.65포인트(1.79%) 하락한 1,905.91로 장을 시작했다.지수는 이후 하락 폭을 키워 1,899.76까지 내려가 장중 1,900선이 무너졌다. 코스피 1,900선이 무너진 것은 올들어 처음이다.지난 주말 아르헨티나 금융위기 우려로 뉴욕 증시가 급락한 것이 국내 증시에도 영향을 미치고 있는 것으로 분석된다.코스피는 이후 소폭 올라 1,900선 초반에서 보합권을 형성하고 있다. 오전 9시 26분 현재 전 거래일보다 1.90% 내린 1,903.62를 나타냈다.외국인과 개인이 매도세를 보이며 지수 하락을 이끌었다.현재 유가증권시장에서 외국인은 733억원 어치를 순매도했고 개인도 10억원 매도 우위를 보였다. 기관 홀로 769억원 어치 순매수했다.kong79@yna.co.kr▶연합뉴스앱▶궁금한배틀Y<저작권자(c)연합뉴스 무단전재-재배포금지>"
131,2014-01-27,"軍 장병 급식, 천연조미료 사용·과일 공급 확대",https://news.naver.com/main/read.nhn?mode=LSD&mid=shm&sid1=100&oid=001&aid=0006722083,연합뉴스,"국방부 장병 기본급식비 인상    (파주=연합뉴스) 임병식 기자 = 27일 경기도 파주시 육군 28사단 신병교육대대 병영식당에서 훈련병들이 배식하는 모습. 2014.1.27    andphotodo@yna.co.kr장병 1인당 기본급식비 작년 대비 6.5% 인상(서울=연합뉴스) 김호준 기자 = 국방부는 올해 장병 기본급식비 인상에 따라 병사들에게 제공되는 식단이 크게 개선된다고 27일 밝혔다.장병 1인당 하루 기본급식비는 지난해 6천432원에서 올해 6천848원으로 6.5% 인상됐다.인상된 급식비는 일반인(2천500㎉)보다 높은 장병 하루 권장열량(3천100㎉) 기준에 맞게 급식의 질을 개선하는데 사용된다고 국방부는 설명했다.국방부는 소금과 인공조미료, 고추장 등의 사용을 줄이고 천연조미료의 사용을 확대하기로 했다. 장병 하루 섭취량 기준으로 소금은 6ｇ에서 5ｇ으로 줄어들고 천연조미료는 0.3ｇ에서 0.7ｇ로 늘어난다.'훈련병도 부식 보급 확대'    (파주=연합뉴스) 임병식 기자 = 27일 경기도 파주시 육군 28사단 신병교육대대 병영식당에서 훈련병들이 배식하는 모습. 2014.1.27    andphotodo@yna.co.kr또 장병 후식품목 중 가공식품인 주스류를 감량하고 신선한 제철과일 급식을 확대하기로 했다. 오렌지주스 등 주스류 7종의 급식 일수는 지난해 143일에서 132일로 줄어들고 사과 등 과일류 17종의 급식 일수는 지난해 222일에서 233일로 늘어난다.기초군사훈련을 받는 훈련병의 하루 증식비도 지난해 하루 500원에서 올해 1천원으로 증액됨에 따라 빵과 에너지바 등의 보급이 확대된다.국방부는 격오지와 전방의 소규모 취사장까지 민간조리원 채용을 확대해 급식의 '맛'을 개선하고 식품 안전성 확보를 위해 HACCP(식품위해요소중점관리기준) 인증 식품 조달도 확대키로 했다.국방부의 한 관계자는 ""앞으로도 장병의 급식 만족도 향상 및 급식의 질 개선을 위해 급식비 인상은 물론 조리병 교육 강화, 취사기구 현대화 등을 적극 추진할 계획""이라고 밝혔다.hojun@yna.co.kr▶연합뉴스앱▶궁금한배틀Y<저작권자(c)연합뉴스 무단전재-재배포금지>"
132,2014-01-27,"법원 ""무단횡단하다 사고당한 보행자 책임 50%""",https://news.naver.com/main/read.nhn?mode=LSD&mid=shm&sid1=102&oid=001&aid=0006722019,연합뉴스,"(울산=연합뉴스) 장영은 기자 = 울산지법은 무단횡단 하다 교통사고로 다친 A씨와 가족이 보험회사를 상대로 제기한 손해배상 청구소송에서 피고 보험회사는 (피해액의 50%인) 6천600만원 상당을 지급하라고 판결했다고 27일 밝혔다.A씨는 2010년 무단횡단하다가 승합차에 치여 뇌지주막하 출혈 등의 상해를 입었지만 승합차 운전자는 구조조치 없이 도주했다.운전자는 이 사고로 항소심서 징역 1년 6월에 집행유예 2년을 선고받았다.재판부는 ""보험회사는 A씨가 무단횡단했기 때문에 책임이 없다고 주장하지만 이 사고는 운전자의 과실과 A씨 과실이 더해져 발생한 것""이라고 지적했다.이어 ""A씨는 70ｍ 떨어진 곳에 횡단보도가 있고 도로에 중앙분리대가 설치돼 있는데도 차량 진행상황을 살피지 않고 무단횡단하다가 사고를 당한 잘못이 있기 때문에 운전자(보험사)의 책임을 50%로 제한한다""고 밝혔다.young@yna.co.kr▶연합뉴스앱▶궁금한배틀Y<저작권자(c)연합뉴스 무단전재-재배포금지>"
133,2014-01-27,美 증시 급락에 외국인 '팔자'...코스피 급락 출발,https://news.naver.com/main/read.nhn?mode=LSD&mid=shm&sid1=101&oid=008&aid=0003195746,머니투데이,"[머니투데이 오정은 기자]뉴욕 증시가 큰 폭으로 하락하며 코스피가 급락 출발했다. 장중 일시적으로 1900선을 하회하는 등 외국인 매도에 약세를 나타내고 있다.27일 오전 9시12분 현재 코스피 지수는 전일대비 35.66포인트(1.84%) 내린 1904.90을 나타내고 있다.외국인이 469억원 매도 우위를 보이고 있다. 기관은 478억원 매수 우위다. 개인은 4억원 매수 우위를 보이고 있다.장 초반 프로그램은 매수 우위다. 차익이 3000만원 매도 우위, 비차익이 73억원 매수 우위로 총 73억원 순매수를 나타내고 있다.업종별로는 모든 업종이 약세를 보이고 있다. 종이목재, 화학, 의료정밀, 운송장비, 건설, 서비스가 2%대 약세를 보이고 있다. 음식료, 섬유의복, 종이목재, 의약품, 비금속광물, 철강금속, 기계, 전기전자, 유통, 전기가스, 운수창고, 통신, 금융, 증권, 보험, 제조가 1%대 약세다.은행만 약보합세를 보이고 있다.시가총액 상위 종목이 줄줄이 급락하고 있다. NAVER,  신한지주, 현대중공업이 3%대 약세르 보이고 있다. LG화학, SK이노베이션, 하나금융지주가 2%대 약세를 보이고 있다. 삼성전자, 현대차, 현대모비스, POSCO,  SK하이닉스, 한국전력, 기아차, 삼성생명, SK텔레콤이 1%대 약세를 보이고 있다.시가총액 20위권 내에는 상승 종목이 하나도 없다.코스피 시장에서는 상한가 없이 63개 종목이 오르고 있다. 25개 종목은 보합이며 663개 종목은 주가가 하락 중이다. 하한가 종목은 2개다. 상승 상위에는 조류독감 여파에 동원수산, 사조오양, 한성기업 등이 강세를 보이고 있다.선물은 하락 중이다. 코스피200지수선물 3월물은 전일대비 4.80포인트 내린 248.65를 기록 중이다. 서울 외국환 시장에서 원/달러 환율은 전일대비 6.30원 오른 1086.70원에 거래되고 있다[오늘의 HOT포토][스페셜 포토][손안의 경제뉴스 머니투데이 모바일웹]오정은기자 agentlittle@<저작권자 ⓒ '돈이 보이는 리얼타임 뉴스' 머니투데이, 무단전재 및 재배포 금지>"
134,2014-01-27,"아베 ""1차 대전 발언 문제없다""…국내외 빈축",https://news.naver.com/main/read.nhn?mode=LSD&mid=shm&sid1=104&oid=001&aid=0006722056,연합뉴스,"지난22일(현지시간) 스위스 다보스의 제44차 세계경제포럼(WEF, 일명 다보스포럼) 연차총회 개막식에서 아베 신조(安倍晋三) 일본 총리가 연설하고 있다. (AP=연합뉴스DB)'수용자가 오해' 입장 고수, 야스쿠니 해명과 닮은꼴(도쿄=연합뉴스) 이세원 특파원 = 스위스 다보스 세계경제포럼(WEF)에서 중국과 일본의 관계를 제1차 대전 직전의 영국과 독일에 비유해 논란을 불러온 아베 신조(安倍晋三) 일본 총리가 자신의 발언에 문제가 없다는 입장을 밝혔다.27일 일본 언론에 따르면 인도를 방문 중인 아베 총리는 26일 동행한 기자들에게 다보스포럼 발언에 대해  ""동석한 분들에게 들어보면 전혀 어떤 문제도 없다는 것을 알 것이라고 생각한다""고 말했다.이는 아베 총리가 다보스 포럼에서 중국과 일본의 현 긴장 상태를 1차 세계대전이 발발하기 전 영국과 독일의 상황과 비교하면서 '우발적 충돌' 가능성을 언급했다고 영국 일간 파이낸셜타임스(FT) 등이 보도한 것에 대한 해명이다.앞서 일본 정부 대변인인 스가 요시히데(菅義偉) 관방장관은 아베 총리가 ""당시 영국과 독일은 큰 경제관계가 있었음에도 제1차대전에 이른 역사적 경위가 있다. 질문한 것과 같은 것이 일어나는 것이 일·중 양쪽에 있어서 큰 손실일뿐 아니라 세계에 있어서도 큰 손실이 된다. 그렇게 되지 않도록 하지 않으면 안 된다""라고 말했다고 발언 내용을 전한 바 있다.이를 모두 고려하면 아베 총리의 인도 발언은 내용상 자신이 현재의 일본과 중국의 관계가 제1차 대전 직전의 독일과 영국의 관계와 같다고 평가한 것이 아니고 그런 상황을 막고 싶다는 취지였다고 강조하는 것이다.아베 총리는 자신의 발언의 순수성을 강조하려는 듯 지난 25일 만모한 싱 총리와의 회담에서 ""중국에는 '커뮤니케이션 채널을 열고 싶다'는 신청을 하고 싶다. 일본의 대화의 문은 항상 열려 있다""는 발언을 했다고 기자들에게 밝히기도 했다.일각에서는 이런 해명에 수긍하기도 하지만 대체로 냉소적인 반응을 보이고 있다.이와 관련, 요미우리(讀賣)신문은 27일 '1차 대전 발언' 당시 현장에 있었던 기자의 기사에서 아베 총리의 일본어로 발언에 ""같은(비슷한) 상황""이라는 표현은 없었고 있는 그대로 들으면 ""영국·독일처럼 되지 않도록""이라는 것에 역점을 뒀다는 게 틀림없다고 평가했다. 그러면서 현장의 동시통역 과정에서 거칠게 의역(意譯)됐을 가능성도 거론했다.그러나 이 신문은 ""1차 대전이 엄청난 희생자를 낸 비참한 역사라는 점에서 유럽 국제회의에서 예로 꺼내 든 것은 아무리 생각해도 배려 부족""이라고 지적했다.실제로 다보스 포럼에 참석한 한 독일인 대학원장은 ""전쟁을 경솔하게 비교하는 데 사용하는 것은 위험하다""고 평가했다.다보스 포럼의 공동 의장 가운데 1명인 장젠칭(姜建淸) 중국 공상은행 이사장은 아사히(朝日)신문과의 인터뷰에서 ""무력충돌이 일어날지는 모두 일본에 달려 있다""며 ""(제1차 대전이 개전한)1914년에 이르기까지 일본은 중국을 침략했고, 대전 후에는 중국 영토까지 빼앗았다. 2차 대전에서 일본은 아시아의 나치였다""고 혹평했다.국제사회의 논란과 비판을 일으키고 난 뒤 자신의 행위에 문제가 있다고 인정하기보다는 아무 문제가 없는데 이를 수용하는 쪽이 오해했다는 것이 아베 총리의 주장이며 이 때문에 논란은 계속 이어지고 있다.최초의 언행은 물론 사후 대응까지 야스쿠니(靖國)신사 참배를 둘러싼 논란과 마찬가지로 해명이 그다지 공감을 얻지 못하고 있으며 아베 총리에게 소통 능력이 부족하다는 이미지만 강화하는 것으로 보인다.sewonlee@yna.co.kr▶연합뉴스앱▶궁금한배틀Y<저작권자(c)연합뉴스 무단전재-재배포금지>"
