,날짜,기사 제목,기사 링크,기사 출처,기사 내용
85,2014-01-27,"LG전자 무선사업 또 '적자'-TV·가전 '선방'…""올해 62조 매출 목표""(종합)",https://news.naver.com/main/read.nhn?mode=LSD&mid=shm&sid1=101&oid=015&aid=0003023045,한국경제,"<표> LG전자 지난해 4분기 실적 전체표.[ 김민성 기자 ] LG전자가 지난해 4분기 매출 14조 9153억원, 영업이익 2381억 원을 기록했다고 27일 밝혔다. 생활 가전 부분이 견조한 수익성을 나타낸 반면 스마트폰 등 휴대전화 사업은 다시 영업적자를 냈다.27일 LG전자는 지난해 4분기 실적발표를 통해 지난해 4분기 영업이익이 전년 동기 대비 2배(103.8%) 성장했다고 밝혔다.생활가전 부문 수익성이 강화됐다. 가격대가 높은 프리미엄 제품군 비중 확대 및 원가 절감 등 요인이 컸다. 에어컨 부문 역시 가을 겨울 날씨인 4분기가 최고 비수기임에도 불구하고 제품 포트폴리오 개선으로 영업 흑자를 달성했다.이로써 지난해 최종 영업이익은 2012년보다 6% 성장한 1조 2847억원을 기록했다. 연간 매출액은 58조 1404억원으로 전년 대비 5% 증가했다. 4분기 매출액은 전 분기 대비 7%, 전년 동기 대비 1% 증가했다.◆ 휴대전화 또 '적자'…TV·가전 '선방'…에어컨 '흑자전환'사진= LG전자 스마트폰 'G프로'사업별로는 휴대전화 사업 분야가 다시 적자를 냈지만 전분기보다 적자폭은 360억 가량 줄었다.MC사업본부는 지난해 3분기에에 이어 4분기에도 434억원의 영업적자를 냈다. 매출은 3조 5915억원 규모였다. 마케팅 투자 비용 증가 및 가격 경쟁 심화 이유가 컸다. 반면 4분기 스마트폰 판매량이 사상 처음으로 1300만대를 돌파하는 등 성과도 냈다. 이는 전 분기(1200만대) 대비 약 10% 늘어난 규모다.판매량이 늘면서 MC사업본부 매출액도 전년 동기 대비 28%, 전 분기 대비 18% 증가했다. 4분기 연속 3조원대 매출 기록이다. 특히 G2 글로벌 판매량이 본격적으로 늘면서 LTE폰 매출은 전년 동기 대비 110%, 전 분기 대비 61% 증가했다고 LG전자는 설명했다.HE(Home Entertainment)사업본부는 매출액 5조 9275억원, 영업이익 1743억원을 기록했다. TV시장 수요 정체로 전년 대비 매출 및 영업이익이 소폭 하락했다. 하지만 전 분기와 비교하면 매출액은 18%, 영업이익은  40% 증가했다. 연말 선물 시즌 등 계절적 성수기를 맞아 선진 시장을 중심으로 LCD TV 판매가 증가한 영향이 컸다. 또 올레드TV 및 울트라HD TV 등 프리미엄 신제품 비중이 확대되면서 실적이 개선됐다.냉장고, 세탁기 등 가전을 담당하는 HA(Home Appliance)사업본부는 매출액 2조 8393억원, 영업이익 834억원을 나타냈다. 특히 영업이익은 대용량 고효율 프리미엄 제품 위주로 매출구조가 되면서 전년 동기 대비 4% 올랐다. 북미 및 한국, 중국 등 매출 성장세도 견조했다. 반면 중남미, 인도 등 주요 성장시장에서는 수요 정체 및 업체간 경쟁 심화로 전년 동기 대비 매출이 소폭 하락했다.에어컨을 만드는 AE(Air-Conditioning & Energy Solution)사업본부는 시스템 에어컨 해외판매 호조 등으로 전년 대비 매출과 영업이익 모두 성장세를 보였다. 4분기 매출액은 7197억원, 영업이익 73억원이었다. 매출은 전년 동기 대비 8% 성장했다. 특히 4분기가 계절적으로 가장 비수기임에 2010년 4분기 이후 3년 만에 영업흑자로 돌아섰다.◆ 올해 매출 목표 62조 3000억…3조원대 시설 투자 지속한편 LG전자는 올해 경영 실적 목표로 매출 62조 3000억원을 제시했다.LG전자는 스마트 TV 등 신제품군 글로벌 판매를 적극 확대한다는 계획이다. 올레드TV 및 울트라 HD TV, 웹OS 탑재 스마트 TV 등 시장선도 형 제품 라인업을 확대하고  지속적인 원가 개선에도 나선다.휴대폰 시장은 시장 선도 제품을 지속적으로 출시해 라인업을 확대하겠다고 밝혔다. 시장 전망은 ""LTE 시장을 주축으로 스마트폰 시장이 지속 성장하지만 제조사간 경쟁은 더욱 심화될 것으로 예상된다""고 설명했다.생활가전 및 에어컨 시장은 ▲스마트 및 고효율 제품 라인업 강화 ▲유통채널 다변화 ▲ 현지 적합형 상품 개발 등으로 매출을 확대할 방침이다.LG전자 관계자는 ""어려운 경영환경에서도 3조원대 시설 투자를 단행할 예정""이라며 ""올해 시장 선도를 통해 성과를 창출할 수 있도록 초석을 견고히 할 계획""이라고 덧붙였다.한경닷컴 김민성 기자mean@hankyung.com트위터 @mean_Ray[한경+ 구독신청] [기사구매] [모바일앱]  ⓒ '성공을 부르는 습관' 한경닷컴, 무단 전재 및 재배포 금지"
86,2014-01-27,"朴대통령 ""하루속히 日정치권 바른길로 돌아왔으면""",https://news.naver.com/main/read.nhn?mode=LSD&mid=shm&sid1=100&oid=001&aid=0006723345,연합뉴스,"재일 대한민국 부인회 초청 다과회     (서울=연합뉴스) 도광환 기자 = 박근혜 대통령이 27일 오후 청와대 영빈관에서 열린 재일 대한민국 부인회 초청 다과회에서 인사말을 하고 있다. 2014.1.27    dohh@yna.co.kr재일 대한민국부인회장 면담…""민간교류 협력영향은 최소화""(서울=연합뉴스) 김남권 기자 = 박근혜 대통령은 27일 한일 관계에 대해 ""내년이면 양국이 국교를 정상화 한지 50주년을 맞게 되는데 하루속히 일본 정치권이 바른길로 돌아왔으면 하는 바람""이라고 밝혔다.박 대통령은 이날 오후 청와대에서 재일 대한민국 부인회장 초청 다과회를 하고 ""요즘 한ㆍ일 관계가 많은 어려움을 겪고 있어서 여러분의 걱정이 크시리라 생각한다""며 이같이 말했다.그러면서 ""저는 대다수 일본 국민들은 일부 정치인들과 다른 생각을 갖고 있다고 생각한다. 양국 국민은 서로의 문화를 공유하면서 마음을 나누고 있다""고 언급했다.박 대통령은 이어 ""비록 한ㆍ일 정부 사이에는 어려움이 있지만 양국간 민간교류와 협력에 미치는 영향을 최소화하도록 하고 경제협력과 문화교류, 인적교류는 계속 발전시켜 나가겠다""고 강조했다.박 대통령은 또 ""재일 부인회 여러분께서도 이런 정부의 노력에 힘을 보태주시고, 일본사회 내에 바른 목소리를 전달해 주시기를 부탁드린다""고 덧붙였다.재일 대한민국 부인회는 1949년 6월 15일 민족적 권리와 동포사회 생활안정ㆍ여성복지 향상을 위해 결성됐으며 현재 전국적으로 약 16만명의 회원이 있다.south@yna.co.kr▶연합뉴스앱▶궁금한배틀Y<저작권자(c)연합뉴스 무단전재-재배포금지>"
87,2014-01-27,"""결국 뚫리나"" 충북서 AI 첫 의심신고 '초긴장'",https://news.naver.com/main/read.nhn?mode=LSD&mid=shm&sid1=102&oid=003&aid=0005641461,뉴시스,"충북도 ""감염 확인되면 예방적 살처분 나설수도""【청주=뉴시스】연종영 기자 = 고병원성 조류인플루엔자(AI) 전국 확산을 막으려고 정부가 경기·대전·세종·충남북에 일시적 이동제한(스탠드 스틸·Stand Still) 조치를 내린 상황에서 충북에서도 처음으로 AI 의심신고가 나왔다.열흘 이상 견고히 유지하던 AI 방역망이 결국 뚫리는 것 아니냐는 불안감이 커지고 가금류 사육농가와 방역당국은 초긴장하고 있다.충북도 AI방역대책본부는 27일 ""진천군 이월면 씨오리 농장에서 오전 10시께 AI 의심축이 신고됐다""며 ""평소 70%였던 산란율이 20%로 떨어졌다는 신고를 받고 현장에 조사반을 긴급투입, 폐사한 오리의 분변과 혈청을 수거해 농림축산검역검사본부에 정밀검사를 의뢰했다""고 밝혔다.오리알을 부화해 새끼 오리를 분양하는 이 농가에선 지난 26일 9마리, 이날 5마리 등 14마리가 폐사했다.이 농가는 5000마리를 사육하고 있는 것으로 알려졌다. 고병원성 감염 여부에 관한 검사결과는 29일 오후에 나온다.방역본부 관계자는 ""축산위생연구소 현지조사반이 현지 확인을 했는데 출혈성 병변 등 AI 의심증상이 있는 것으로 확인됐다""며 ""확진이 아니라도 확인단계 정도만 되면 예방적 살처분을 단행할 예정""이라고 말했다.도는 AI 확진 전 단계인 '확인' 단계에 이르면 이 농장의 반경 500m 안에 있는 3개 농장(오리 4만5000마리)에 대한 예방적 살처분에 나서기로 했고 진천군은 살처분에 대비한 인력을 확보 중이다.발생농장 반경 10㎞를 이동제한 구역으로 설정한 도는 통제초소 8개를 긴급 설치한데 이어 차단방역활동을 벌이고 있다.앞서 정부는 이날 오전 6시부터 충북을 포함한 충청·경기도 전역에 일시 이동중지 명령을 내렸다.정부는 오후 6시까지 12시간에 걸쳐 축산농가와 작업장에 대한 축산 종사자와 차량의 이동을 일시 제한한다.사료운반차, 도축차량, 퇴비·왕겨운반차 등 가금류 농장을 출입하는 모든 차량과 수의사·동물 약품상·도축장 직원 등이 이동제한 대상이다.AI가 수도권으로 확산하지 않도록 하기 위한 조처인데, 이동제한 기간에 집중적인 소독작업이 이뤄진다.오전 6시 전에 도축장에 들어간 농민이나 차량운전자도 오후 6시까지는 도축장에서 나올 수 없다.충북에선 2003년 12월 AI가 발생한 이후 지난해까지 10년 동안 AI가 발생하지 않았다. 당시 진천·음성 지역에서 고병원성 AI가 6건 발견돼 가금류 67만 마리가 살처분됐다.충북에는 닭·오리 등 가금류를 키우는 5262개 농가와 8개 도축장이 있고 가금류 사육규모는 2053만 마리에 이른다.jyy@newsis.com★ 뉴시스 뉴스, 이젠 네이버 뉴스 스탠드에서도 만나세요★ 손 안에서 보는 세상, 모바일 뉴시스<저작권자ⓒ 공감언론 뉴시스통신사. 무단전재-재배포 금지.>"
88,2014-01-27,청소년들이 차량 보험사기 주도…85명 검거,https://news.naver.com/main/read.nhn?mode=LSD&mid=shm&sid1=102&oid=001&aid=0006723308,연합뉴스,"(광주=연합뉴스) 장아름 기자 = 고등학생이나 자퇴생 등 10대들이 차량 보험사기를 주도했다가 경찰에 검거됐다.광주 광산경찰서는 26일 고의 사고를 내 2억원 상당의 보험금을 편취한 혐의(사기)로 홍모(20)씨와 위모(19)군 등 85명을 붙잡아 조사 중이다.홍씨 등은 렌터카를 이용해 고의 사고를 낸 뒤 의료비 수가가 높은 한방병원에 입원하겠다며 보험사 직원을 협박해 2012년 8월부터 최근까지 63차례에 걸쳐 2억원 상당을 편취한 혐의로 받고 있다.홍씨 등은 사고 유형 등 전체를 설계하는 총책과 모집책, 합의책, 탑승자 등으로 역할을 분담했고 합의금을 많이 받아내기 위해 주로 승용차량 최대 탑승 인원인 5명이 승차해 범행을 저지른 것으로 조사됐다.이들은 대부분 18∼20세로 승차 정원을 채우기 위해 서로의 친구나 PC방에서 인원을 모집했다.한 사람당 1년여간 최대 17차례에 걸쳐 범행을 한 이들 일당은 잦은 사고로 인한 보험사의 의심을 피하고자 운전자 명의를 도용하기도 한 것으로 확인됐다.이들은 부당 수령한 보험금을 유흥비로 탕진해온 것으로 알려졌다.경찰은 이들의 여죄를 조사 중이다.areum@yna.co.kr▶연합뉴스앱▶궁금한배틀Y<저작권자(c)연합뉴스 무단전재-재배포금지>"
89,2014-01-27,LG전자 작년 영업이익 1조2천847억원…5.6%↑(종합),https://news.naver.com/main/read.nhn?mode=LSD&mid=shm&sid1=101&oid=001&aid=0006723173,연합뉴스,"(AP=연합뉴스DB)4분기 영업익 2천381억원…전기대비 9.3% 증가MC 연간 실적개선 주도…분기 스마트폰 판매 1천300만대 돌파올해 매출 목표 62조3천억원…시설투자 3조(서울=연합뉴스) 이웅 기자 = LG전자가 가전 분야의 수익성 강화와 스마트폰 경쟁력 회복에 힘입어 2년 연속 1조원대 연간 영업이익을 유지했다.LG전자는 지난해 4분기 영업이익이 2천381억원으로 전분기보다 9.3%, 전년 동기 대비 103.8% 증가했다고 27일 공시했다.4분기 매출액은 14조9천153억원으로 전분기보다 7.4%, 전년 동기 대비 0.8% 늘었다.지난해 연간 매출액은 58조1천404억원으로 2012년보다 5.5% 증가했으며, 영업이익은 1조2천847억원으로 5.6% 늘었다.연간 실적 개선은 휴대전화 사업을 담당하는 MC(모바일커뮤니케이션)사업본부가 주도했다.MC사업본부는 스마트폰 시장에서의 경쟁력 회복에 힘입어 지난해 매출액이 2012년 29%, 영업이익은 20% 증가했다.반면 HE(홈엔터테인먼트)사업본부는 TV시장 수요 정체로 연간 매출과 영업이익이 소폭 후퇴했으며, 생활가전을 담당하는 HA(홈어플라이언스)사업본부는 매출이 5% 늘었으나 환율 영향 등으로 영업이익은 줄었다. AE(에어컨·에너지솔루션)는 연간 매출과 영업이익 모두 견조한 성장을 보였다.4분기 실적만 보면 MC사업본부는 스마트폰 판매 호조에 힘입어 4분기 매출액이 3조5천915억원으로 전년 동기보다 28%, 전 분기 대비 18% 늘면서 두자릿수 성장을 나타냈다.4분기 스마트폰 판매량은 처음으로 1천300만대를 돌파했다.하지만 MC사업본부는 마케팅비용 증가로 434억원의 분기 영업손실을 기록했다. 다만 797억원의 영업손실을 냈던 전 분기에 비해 적자폭을 절반으로 줄였다.HE사업본부는 4분기 계절적인 성수기를 맞아 선진시장을 중심으로 한 LCD TV 판매 호조로 매출액이 전 분기보다 18% 늘면서 선전했다. 4분기 매출액은 5조9천275억원, 영업이익은 1천743억원을 기록했다.HA사업본부는 매출액 2조8천393억원, 영업이익 834억원을 기록했다. 시장 경쟁 심화로 매출이 전년 동기보다 소폭 감소했으나, 영업이익은 4% 늘었다.AE사업본부는 에어컨 시장 호조 매출이 전년 동기보다 8% 늘면서 2010년 4분기 이후 3년만에 영업흑자로 돌아섰다. 매출액 7천197억원, 영업이익 73억원을 기록했다.LG전자는 올해 불투명한 세계 경기 회복 전망과 격화되는 시장 경쟁 속에서도 스마트폰 경쟁력 강화와 프리미엄 TV 판매 확대를 통해 실적 성장을 이어간다는 전략이다.LG전자는 올해 매출액 목표를 62조3천원으로 제시했다. 이와 함께 시장 선도를 위해 3조원의 시설투자를 할 계획이라고 밝혔다.abullapia@yna.co.kr▶연합뉴스앱▶궁금한배틀Y<저작권자(c)연합뉴스 무단전재-재배포금지>"
90,2014-01-27,3달간 억대 스마트폰 훔친 범인들이 노린 매장은?,https://news.naver.com/main/read.nhn?mode=LSD&mid=shm&sid1=102&oid=052&aid=0000501012,YTN,"[앵커]휴대전화 매장에 침입해 석 달 동안 스마트폰 1억 7천만 원어치를 훔친 일당이 경찰에 붙잡혔습니다.잠금장치가 중간이 아닌 위나 아래에 있으면 출입문을 쉽게 부술 수 있다는 점을 노렸습니다.이광연 기자가 보도합니다.[기자]모자에 목도리를 두른 젊은 남성들이 매장 출입문을 강하게 흔듭니다.두 번 만에 문이 뜯겨지고, 유리도 깨져 쏟아집니다.휴대전화 매장에 들어선 남성들!곧바로 안쪽 보관함에서, 새 스마트폰이 들어 있는 상자들을 순식간에 쓸어담습니다.그리고 황급히 매장을 빠져 나갑니다.매장 침입에서 절도, 도주까지 걸린 시간은 불과 30초!순식간에 스마트폰 25대, 천9백만 원어치가 털린 겁니다.22살 고 모 씨 등 4명은 인적이 드문 새벽 시간에 휴대전화 매장을 털어왔습니다.잠금장치가 중간에 있으면 출입문이 잘 열리지 않는 반면, 위·아래는 쉽게 뜯긴다는 점을 노렸습니다.[인터뷰:김성순, 중랑경찰서 강력 5팀장]""(출입문) 위나 아래에 잠금장치가 있는 거는 하나 정도의 걸고리가 있기 때문에 흔들었을 때 휘청 거리면서 잘 흔들리는 특성이 있어서.""동네 친구 사이인 이들은 지난해 10월부터 최근까지 매장 9곳에서 스마트폰 200여 대, 1억 7천만 원어치를 훔쳤습니다.훔친 스마트폰은 1대에 30만 원을 받고 장물업자에게 팔아 넘겼고, 주로 유흥비나 형사 합의금 등으로 썼습니다.경찰은 고 씨 등 2명을 구속하고 공범 2명을 불구속 입건했습니다.특히 매장 안이 잘 보이도록 불을 켜고 유리 출입문만을 사용하는 매장은 각별히 주의할 것을 당부했습니다.YTN 이광연입니다.[저작권자(c) YTN & Digital YTN. 무단 전재-재배포 금지]"
91,2014-01-27,남북 이산가족 상봉 절차 어떻게 될까,https://news.naver.com/main/read.nhn?mode=LSD&mid=shm&sid1=100&oid=001&aid=0006722779,연합뉴스,"분주한 이산가족 접수처    (서울=연합뉴스) 이상학 기자 = 북한이 이산가족 상봉 행사를 전격 제의한 가운데 휴일인 지난 26일 서울시 중구 대한적십자사 이산가족 접수처에서 관계자들이 관련 업무를 보고 있다.     leesh@yna.co.kr(서울=연합뉴스) 김정은 기자 = 정부가 27일 이산가족 상봉 행사를 다음 달 17∼22일 금강산에서 열고 이를 위한 적십자 실무접촉을 이달 29일 개최하자고 북한에 공식 제의했다.이에 따라 향후 이산가족 상봉이 최종 합의될 경우 실제 행사가 어떤 식으로 진행될지 새삼 관심을 끌고 있다.아직 일정이 확정되지는 않았지만, 그동안의 관례로 볼 때 시기가 언제가 되든 상봉 행사는 총 6일간 2박3일씩 1, 2차로 나뉘어 금강산에서 진행될 가능성이 크다.지난해 9월 상봉이 확정된 남측 이산가족 96명이 북한에 사는 가족을 1차로 먼저 만나고, 이어 북측 이산가족 100명이 2차로 남한에 사는 가족과 상봉하게 된다.<그래픽> 남북 이산가족 상봉 예상 절차    (서울=연합뉴스) 반종빈 기자 = 정부는 북한이 동의한 이산가족 상봉 행사를 다음달 17∼22일 금강산에서 갖자고 북한에 공식 제의했다.    정부는 27일 오전 판문점 연락관 채널을 통해 이 같은 내용의 전화통지문을 북측에 보냈다고 김의도 통일부 대변인이 전했다.    bjbin@yna.co.kr    @yonhap_graphics(트위터)다만, 이산가족들이 고령임을 감안할 때 건강상의 문제 등으로 최종 상봉 인원이 조정될 가능성이 있다. 정부는 향후 상봉 대상자들을 대상으로 상봉 의사와 건강 문제를 다시 확인할 계획이다.1, 2차 상봉에 참가하는 남측 이산가족들은 각각 상봉 전날 강원도 속초 숙소에 집결해 방북교육을 받고 이튿날 오전 8시30분 속초를 출발, 금강산으로 들어가게 된다.이전의 상봉 사례들을 볼 때 상봉 첫날에는 이산가족 면회소에서 단체상봉을 하게 되며 이튿날에는 개별상봉, 공동중식, 야외상봉, 개별석식, 마지막 날에는 개별조식, 작별상봉, 개별중식을 한 후 오후 1시께 귀환하게 된다.kje@yna.co.kr▶연합뉴스앱▶궁금한배틀Y<저작권자(c)연합뉴스 무단전재-재배포금지>"
92,2014-01-27,경고성 재신임받은 현오석…사태수습에 집중할듯,https://news.naver.com/main/read.nhn?mode=LSD&mid=shm&sid1=100&oid=001&aid=0006722726,연합뉴스,"(세종=연합뉴스) 유경수 기자 = 금융사의 개인정보 유출로 흔들거리던 현오석 경제팀이 경고성 재신임을 받았다.정치권에서 카드사태에 따른 쇄신 인사요구가 거센 가운데 박근혜 대통령이 27일 수석비서관회의에서 '재발시 엄중 문책'이라는 인사 가이드라인을 제시함으로써 경제팀의 교체론은 일단 수면 아래로 내려갈 전망이다.그러나 민주당이 카드사태에 대한 국정조사를 요구하는 등 2월 임시국회에서 정치 쟁점화할 움직임이어서 개인정보 유출에 이은 2차 피해, 정보 추가 유출 등 카드사태가 악화하면 경제팀 문책론은 다시 불거질 가능성이 있다.기획재정부 관계자는 ""일단 대통령의 언급은 경제팀이 흔들리지 말고 사태를 수습하고 매듭지으라는 뜻으로 해석된다""면서 ""전쟁중에 장수를 바꿀 수는 없지 않느냐""고 말했다.다만 박 대통령이 '적절치 못한 발언으로 국민에게 상처를 주는 행위'를 직접 언급하면서 지난주 현 부총리의 말실수를 공식 거론한 점은 사실상 경제팀에게 준 '마지막 경고'라는 풀이가 나온다. 추가 피해없이 카드사태가 진정될 수 있도록 총력을 기울여야 한다는 숙제도 재신임의 부가조건으로 달려 있다.현 부총리는 지난주 '어리석은 사람이 무슨 일이 터지면 책임을 따진다', '우리가 다 정보제공에 동의해줬지 않느냐'는 발언을 했고 이는 개인정보 유출의 책임을 금융소비자에게 떠넘기는 것이라는 여론의 지적을 받았다.현 부총리는 이로인해 두 차례의 공식 사과를 했다. 이후 25일 부처내 친목모임 참석일정을 취소하고 26일 예정됐던 관광산업 활성화 관련 현장 방문을 이틀전에 연기하는 등 대외활동을 자제해 왔다.일단 현 부총리는 대통령의 신임을 다시 확인함으로써 개인적 발언을 조심하면서 내달말 나올 경제혁신 3개년 계획의 구체화에 집중할 것으로 보인다.또 신제윤 금융위원장, 최수현 금융감독원장 등 이번 사태의 중심에 선 각료와 함께 전면에서 사태수습을 진두지휘할 전망이다.기재부의 또다른 관계자는 ""카드사태로 인한 국민의 상처가 깊은 만큼 근본적인 처방과 추가 피해가 발생하지 않도록 세심한 노력을 기울이겠다""며 ""비정상의 정상화와 기초 튼튼 경제의 핵심 의제로 개인정보 보안을 다룰 것""이라고 말했다.yks@yna.co.kr▶연합뉴스앱▶궁금한배틀Y<저작권자(c)연합뉴스 무단전재-재배포금지>"
