,날짜,기사 제목,기사 링크,기사 출처,기사 내용
48,2014-01-26,"AI 확산, 서울 턱밑…'일시 이동중지' 전국발동 검토",https://news.naver.com/main/read.nhn?mode=LSD&mid=shm&sid1=102&oid=214&aid=0000337466,MBC,"[뉴스데스크]◀ 앵커 ▶조류인플루엔자, 즉 AI가 서해안 벨트를 타고 서울의 턱밑까지 북상한 것으로 보입니다.◀ 앵커 ▶초비상이 걸린 방역당국은 이동중지 명령을 전국 축산농가에 내리는 방안을 검토하고 있습니다.정동욱 기자가 보도합니다.◀ 리포트 ▶충남 부여를 중심으로 방역초소 47곳이 추가로 설치됐습니다.종계장에서 폐사한 닭이 고병원성 AI에 감염된 것으로 최종 확인됨에 따라 반경 3KM 안에 사육중인 닭 11만8천 마리에 대한 살처분도 시작됐습니다.방역당국은 면역력이 약한 닭으로 AI가 확산되자 앞으로는 발병농가를 중심으로 3KM내의 닭도 모두 살처분하기로 했습니다.특히 전국 양계장의 30%가 밀집된 경기지역에 AI가 유입되는 것을 막는데 총력을 기울이고 있습니다.◀ 인터뷰 ▶ 이준원/농림축산식품부 차관보""닭의 고병원성 AI는 전파가 매우 빠르기 때문에 산발적 추가 발생을 막기 위해서는 예방적 살처분이 필요하다는...""전남 해남의 종오리 농장에서 일어난 집단 폐사도 고병원성 AI감염이 원인으로 최종 확인됐습니다.지난 16일 전북 고창에서 첫 신고된 AI는 전남과 충남까지 철새 이동경로를 따라 남북으로 퍼지고 있는 양상입니다.정부는 관계장관회의를 열고 AI바이러스 차단을 위한 집중 방역을 지시했습니다.◀ 인터뷰 ▶ 정홍원/국무총리""AI대책상황실을 보강하고 장관이 직접 주재하여 원스톱 비상체제를 가동해 주시기 바랍니다.""방역당국은 내일과 모레가 AI 확산의 최대 고비가 될 것으로 보고 전국 축산 농가에 이동 중지 명령을 발동할지를 검토하고 있습니다.MBC뉴스 정동욱입니다.(정동욱 기자)[저작권자(c) MBC (www.imnews.com) 무단복제-재배포 금지]"
49,2014-01-26,"[단독] 병무청 소속 의사, 왜 개인병원에서 근무?",https://news.naver.com/main/read.nhn?mode=LSD&mid=shm&sid1=100&oid=214&aid=0000337467,MBC,"[뉴스데스크]◀ 앵커 ▶군복무를 대신해 병무청에서 소속돼 신체검사만 전담하는 의사들이 있습니다.대위급 월급을 받는 계약직 공무원들입니다.그런데 신체검사가 없는 겨울 동안에는 이 의사들이 개인병원에서 일을 하고 있습니다.병역법에 있는 등이라는 글자 때문이라고 하는데 어찌된 사연인지 김민욱 기자가 취재했습니다.◀ 리포트 ▶수도권의 한 개인의원.두달 동안 원장이 자리를 비워 부원장이 진료한다는 안내문이 붙어 있습니다.부원장을 만나봤습니다.◀ 인터뷰 ▶ 부원장""(원장님이) 갑자기 (외국에) 가시게 됐어요. 그래서 부득이하게 저 혼자 진료를 보고 있는 중이에요.""이 부원장은 병무청 징병검사전담의사.그런데 개인의원에서 환자를 보는 겁니다.""돈을 받으신 적은 없다는 거죠?""""네. 네.""또 다른 개인의원.이곳에서도 병무청 소속 의사가 2달 동안 진료를 했습니다.""선생님 계시죠? 겨울에만 잠깐 일하시는...""""네. 네.""병무청 소속 의사가 어떻게 개인의원에서 일을 할까?근거는 병역법 34조, '신체검사가 없는 겨울에 3개월 이내로, 군 병원 등에서 수련을 할 수 있다'는 규정입니다.'군 병원 등에서'라고 했지만 지난 4년간 수련허가 신청서를 분석한 결과 군 병원에서 수련한 사람은 단 한명도 없습니다.병무청 내부 훈령에는 아예 '군 병원'이란 단어조차 빠져 있습니다.◀ 인터뷰 ▶ 이석현 의원/국회 국방위""원칙과 예외가 뒤바뀌어 있어요. 그래서 90% 이상이 사립병원에 가서 수련하고 있습니다. 이면에 문제가 있을 수 있습니다""징병검사전담의사에게는 대위에 준하는 연간 3천여 만원의 봉급에 숙소까지 제공됩니다.군 병원도 의사가 부족한데 병무청 소속 의사가 개인 의원을 위해 일한다는 지적이 나오는 이유입니다.◀ 인터뷰 ▶ 이성수 병무청 병역자원국장""(앞으로) 군 병원에서 수련할 수 있도록 하고 남은 인원에 대해서는 국공립 종합병원 중심으로...""병무청은 ""환자를 진료해야 전문성이 향상되는 의사의 특성상 사립병원 수련을 허가해 왔다""면서도 ""수련 제도 개선을 검토 중""이라고 밝혔습니다.MBC뉴스 김민욱입니다.(김민욱 기자 wook@mbc.co.kr)[저작권자(c) MBC (www.imnews.com) 무단복제-재배포 금지]"
50,2014-01-26,[단독] 시간제 근로 권장해놓고…정작 퇴직금은?,https://news.naver.com/main/read.nhn?mode=LSD&mid=shm&sid1=102&oid=055&aid=0000271187,SBS,"<앵커>정부는 시간제 근로의 확대를 추진하고 있습니다. 그런데 정규직에서 시간제 근로로 전환한 근로자들은 퇴직금 받을 때 예상치 못한 손해를 볼 수 있습니다.한정원 기자의 단독 보도입니다.<기자>김 모 씨는 정부 산하 연구원에서 정규직 근로자로 일하면서, 동시에 치매를 앓는 시어머니와 두 아이도 돌봐온 워킹맘입니다.지난해 2월, 김 씨는 시간제 근로로 전환해보라는 회사 권유를 받았습니다.11년 넘게 전일 근무하던 김 씨는 일주일에 이틀만 일하는 시간제 근로로 전환했습니다.9달이 지난 지난해 11월, 퇴직을 결정한 김 씨는 퇴직금을 통보받고 깜짝 놀랐습니다.6년 전 한 차례 정산받은 걸 감안하더라도 퇴직금이 2천 400만 원 정도는 될 것으로 예상했지만 최종 통보받은 금액은 600만 원에 불과했습니다.현행 근로기준법상 퇴직금은 퇴직 직전 3개월 간의 평균 임금만으로 산정하도록 돼 있습니다.때문에 정규직 근무 당시 월 400만 원 임금 대신 퇴직직전 시간제 근로 임금인 월 100만 원을 기준으로 퇴직금이 산정된 겁니다.[김 모 씨 : 경력 단절을 막기 위해 도입하는 제도라고 했기 때문에 퇴직금에 문제가 생길 거라는 생각은 전혀 안 했었죠. 진짜 모르면 약자들은 정말 많이 당하고 살겠구나….]이런 문제를 미리 알고 시간제로 전환할 때 정규직 근로기간만큼 별도의 퇴직금 정산을 하지 못한 입장에선 법적 해결 말고는 대안이 딱히 없습니다.[정부 관계자 : (법 만들 때) 당시에 이런 걸 고려하지 못했는지…. (소송 외엔) 현재로선 (구제가) 힘들지 않겠나….]민주당 문재인 의원은 여성 경력 단절을 막기 위해 도입한 시간제 근로제의 헛점 보완을 위한 법 개정을 추진하기로 했습니다.대선 이후 첫 입법활동에 나선 문 의원은 시간제 근로로 전환하는 근로자가 합리적인 퇴직금을 보장받도록 관련 법 개정안을 만들어 다음 달 국회에 제출할 예정입니다.(영상취재 : 임우식·제 일, 영상편집 : 최진화)한정원 기자one@sbs.co.kr☞[2014 소치 동계올림픽] 열정의 소치 꿈꾸는 평창☞[SBS기자들의 생생한 취재현장 뒷이야기 '취재파일']☞ SBS뉴스 공식 SNS [SBS8News 트위터] [페이스북]저작권자 SBS&SBS콘텐츠허브 무단복제-재배포 금지"
51,2014-01-26,스마트폰 사용자 불만 1위 '액정'…작은 충격에도 '퍽',https://news.naver.com/main/read.nhn?mode=LSD&mid=shm&sid1=105&oid=437&aid=0000025497,JTBC,"[앵커]살짝 떨어뜨렸는데 액정이 깨졌다, 스마트폰 쓰는 사람들이라면 한번 정도 경험해봤을 텐데요. 고치는 비용이 만만치 않습니다.유한울 기자입니다.[기자][박정재/서울 상계동 : 말 그대로 설탕폰입니다. 제가 볼 때는 심하게 던진 것도 아닌데 바로바로 훼손되고요.]작은 충격에도 깨지는 액정 유리, 스마트폰 사용자들의 단골 불만거리입니다.실제 지난해 한 소비자 단체에 접수된 스마트폰 관련 피해에서 액정 파손이 1위를 차지했습니다.비싼 액정 교체 비용도 소비자들의 원성을 사고 있습니다.출시된 지 1년이 넘은 한 스마트폰은 액정 교체 비용이 기기값의 최대 50%에 육박합니다.[박미화/경기 광명시 광명7동 : 실수로 떨어뜨린 건데 너무 비싸니까 바꾸지도 못하고 그냥 지금 쓰고 있거든요.]그러다 보니 수리비가 싼 사설 업체에서 액정을 바꾸거나 깨진 액정을 업자에게 되파는 사람도 늘고 있습니다.[박진/깨진 액정 매입 업체 직원 : 처음에 시작했을 때는 몇십 개 소량이었는데 지금은 하루에 200~300개 정도 들어오고 있어요.]이를 의식해 일부 제조사는 깨진 액정을 전면 회수하는 정책을 내놨지만 반발에 부딪혀 지난해 말 백지화했습니다.하지만 이들 액정은 중국 등지로 넘어가 짝퉁폰을 만드는 데 사용될 가능성이 있어 근본 대책 마련이 필요해 보입니다.유한울Copyright by JTBC & Jcube Interactive. All Rights Reserved."
52,2014-01-26,임금체불 근로자들의 ‘우울한 세밑’,https://news.naver.com/main/read.nhn?mode=LSD&mid=shm&sid1=102&oid=022&aid=0002626290,세계일보,"2013년 26만6506명이 1조1929억 못받아“밀린 임금을 받으려고 회사에 100통 넘게 전화를 했지만 한 번도 담당자와 통화하지 못했습니다. 명절도 다가오는데 생활비가 없어 막막합니다.”건설 현장에서 미장일을 하는 홍모(56)씨는 지난해 2월부터 8월까지 서울 종로구 구기동의 한 건설현장에서 일했다. 하지만 일이 끝난 뒤에도 3개월치 임금 780만원을 받지 못했다. 담당자는 전화를 받지 않았고, 사무실 직원은 “담당자가 자리에 없다”는 말만 되풀이했다. 참다 못해 홍씨가 서울고용노동청에 진정을 내자 업체는 300만원만 지급했다. 나머지 480만원은 최대한 빨리 주겠다는 말만 반복할 뿐 5개월째 깜깜무소식이다. 홍씨는 최근 다시 서울고용노동청을 찾아가 고소장을 제출했다. 홍씨는 “한 달 벌어서 한 달 먹고사는데, 밀린 임금을 주지 않아 너무 힘들다”고 말했다.설을 일주일 앞둔 24일 서울 중구 장교동 서울고용노동청 민원인 대기실에는 밀린 임금을 받기 위해 찾아온 근로자들의 발길이 줄을 이었다. 이들은 한결같이 지치고 초조한 모습이었다. 대기실 벽 한쪽에는 임금체불 사업주 명단이 붙어 있었다.고용노동부는 9일부터 29일까지를 ‘설 대비 체불임금 청산집중 지도기간’으로 정하고 전국 47개 고용노동관서에 평일 근무를 오후 9시까지 연장하고, 휴일에도 상담을 진행하고 있다. 고용부는 체불임금과 퇴직금 미지급 등에 대해 진정을 접수하면 사실관계를 조사해 체불임금을 확정하고 사업주에게 지급지시를 하는 절차를 거친다.최근 아파트 관리소장으로 일하다 해고된 김모(57)씨도 이날 고용청을 찾았다. 관리업체는 아파트와의 재계약에 실패하자 김씨를 해고하고 월급과 퇴직금을 주지 않았다. 김씨는 업주와 드잡이하기도 했다. 그는 3개월 전 진정을 접수해 이날 결과를 통보받았다. 고용청은 업주에게 김씨의 밀린 임금 199만원과 퇴직금 410만원, 해직예고수당 260만원을 31일까지 지급하라고 시정지시했다. 김씨는 “이제 시작”이라며 입술을 깨물었다. 그는 “업주가 기간 내에 돈을 안 줄 것이 뻔하다”면서 “업주 측에서 내가 지쳐 떨어져 나갈 때까지 기다리는 것 같다”고 설명했다.26일 고용노동부에 따르면 지난 한 해 동안 임금을 받지 못해 진정을 낸 근로자가 무려 26만6506명에 달했다. 체불액은 1조1929억7900만원이다. 이를 업종별로 보면 제조업이 3904억원으로 체불임금이 가장 많았고, 건설업이 2605억으로 그 뒤를 이었다. 업체 규모별로는 5∼30인 미만 사업장이 5049억원으로 전체의 42.3%를 차지했다.고용부는 일시적인 경영난을 겪는 사업장의 경우 재직중 근로자에게 생계비를 빌려주고 사업주를 대상으로 융자금을 지원한다.서울고용노동청 관계자는 “최근 임금체불 사업자의 경우 악덕업주보다는 임금을 줄 수 없는 상황인 경우가 대부분”이라며 “고의적이고 상습적인 체불 사업자에 대해서는 검찰과 협의해 사법처리하고 있다”고 설명했다.글·사진=박영준 기자 yjp@segye.com▶오늘은?▶HOT포토▶지면보기ⓒ 세상을 보는 눈,세계일보 & Segye.com"
53,2014-01-26,"방역당국, 이동중지명령 발동 고심 ""검토할수 있어""(종합)",https://news.naver.com/main/read.nhn?mode=LSD&mid=shm&sid1=102&oid=001&aid=0006721456,연합뉴스,"(세종=연합뉴스) 김승욱 기자 = 방역당국은 전북에서 발병한 조류인플루엔자(AI)가 전남·충남 등으로 확산됨에 따라 '일시 이동중지 명령'(Standstill)을 전국적으로 발동하는 방안을 신중 검토하고 있는 것으로 26일 알려졌다.'일시 이동중지 명령'은 가축전염병의 확산을 막기 위해 가축과 축산 관계자, 축산 차량의 이동을 일시 정지하는 조치다.이준원 농식품부 차관보는 이날 정부세종청사 농식품부 기자실에서 브리핑을 통해 ""전북에 이어 전남·충남에서도 AI가 발생했기 때문에 스탠드스틸이든 다른 조치든 추가적인 조치를 할 것이 있다면 하겠다""고 말했다.권재한 농식품부 축산정책국장도 ""전국 단위 스탠드스틸은 상황에 따라 충분히 검토할 수 있고 필요하다면 할 수도 있지만 현 단계에서는 결정한 것이 없다""고 말했다.전날 열린 가축방역협의회에서도 전국 단위 이동제한 명령 발동을 놓고 논의했으나 현 단계에서 큰 효과를 기대하기 어렵다는 의견이 적지 않았던 것으로 알려졌다.방역당국은 지난 17일 전북 고창에서 AI가 처음 발병한 이후 전북 부안 등으로 확산하는 조짐을 보이자 19일 오전 0시부터 20일 자정까지 48시간 동안 전라·광주광역시의 가금류·축산 종사자·축산 차량을 대상으로 이동정지 명령을 내린 적이 있다.당시 축산 종사자와 가족 14만여 명이 이동중지 명령 대상이 됐으며 축산 차량 2만여 대도 발이 묶였다.이 기간 방역당국은 전라·광주광역시의 모든 가금류 사육 농장과 축산 차량을 소독하는 등 강도 높은 방역조치를 했다.원칙적으로 일시 이동중지 명령은 48시간 이상 지속할 수 없지만, 필요한 경우 농식품부 장관이 48시간 범위에서 한 차례 연장할 수 있다.kind3@yna.co.kr▶연합뉴스앱▶궁금한배틀Y<저작권자(c)연합뉴스 무단전재-재배포금지>"
54,2014-01-26,'패블릿' 전성시대 … 시장 쟁탈전 불꽃,https://news.naver.com/main/read.nhn?mode=LSD&mid=shm&sid1=105&oid=011&aid=0002458027,서울경제,"작년 국내 판매량 1,520만대 … 스마트폰 시장 41% 차지삼성·LG·팬택 ""올 신제품 60% 패블릿에 포진"" 승부수스마트폰 화면이 점점 커지면서 틈새시장용 제품으로 여겨졌던 '패블릿(phablet)'의 인기가 심상치 않다. 지난해 국내 소비자 10명 중 4명이 선택할 만큼 패블릿 제품군은 인기 모델로 급부상하며 '패블릿 전성시대'를 열었다. 전 세계 스마트폰 시장에 패블릿 비중은 7%에 불과하지만, 한국에서는 패블릿 비중이 41%에 달할 정도로 선호도가 높다. 올해는 국내 제조사들이 패블릿 시장을 겨냥한 전략 제품을 잇따라 출시할 예정이어서 패블릿폰 경쟁이 더욱 뜨거워질 전망이다.26일 관련 업계에 따르면 스마트폰 시장 경쟁에서 화면 크기가 강조되면서 대화면 스마트폰인 패블릿 제품군이 핫 이슈로 떠오르고 있다.지난해 국내 스마트폰시장 규모는 2,650만대로 2012년도 3,070만대 보다 줄어드는 역성장을 기록했지만, 5인치 이상 대화면 스마트폰은 전년도 1,200만대에서 2013년에 1,480만대로 23% 이상 늘어났다.6인치대 화면까지 포함하면 1,520만대가 넘어 26% 이상 증가하며 인기 제품으로 부상했다. 무엇보다 삼성전자와 LG전자, 팬택 등 국내 스마트폰 제조3사가 올해 출시하는 스마트폰의 60% 이상을 패블릿 제품군으로 포진시킬 계획인 만큼 시장 쟁탈전이 치열해질 것으로 보인다.삼성전자는 더 가볍고 얇은 디스플레이를 장착, 선점 효과를 이어간다는 전략이다. 삼성전자는 패블릿의 원조격인 전략폰 '갤럭시노트'를 내놓은 이후 '갤럭시노트2'(5.55인치)와 '갤럭시노트3'(5.7인치)를 지속적으로 출시하며 화면 크기를 키워왔다.LG전자는 패블릿 제품군의 라인업 확대로 삼성전자에 맞대응할 계획이다. 지난해에 이어 2014년형 신제품인 'G프로2','뷰4' 등 후속 시리즈군을 각각 상·하반기에 연이어 출시해 시장공략을 강화한다. 팬택도 고성능 프리미엄 패블릿 제품군으로 승부를 걸 예정이다. 지문인식 기능폰을 대거 늘리고 디자인이 특화된 모델로 삼성전자와 LG전자에게 도전장을 내밀기로 했다.특히 정전식 펜 'V펜'이 장착된 5인치급 대화면폰에 사용환경이 한층 강화된 고성능 제품군을 선보여 브랜드 인지도를 강화할 방침이다.업계 관계자는 ""스마트폰 보편화에 따라 소비자들은 가벼우면서도 화면이 크고 휴대하기 편한 태블릿을 계속해 찾을 것""이라며 ""이럴 경우 패블릿은 스마트폰의 새로운 표준으로  최고 인기 제품군이 될 것""이라고 전망했다.다음달 말 스페인 바르셀로나에서 열리는 세계 최대 이동통신 전시회 모바일월드콩그레스(MWC)를 앞두고 주요 글로벌 제조사들의 발걸음도 빨라지면서 패블릿 시장 선점을 위한 각축전이 본격화될 전망이다.지난 1월 미국 라스베이거스에서 열린 CES 2014에서는 화웨이와 아수스가 각각 6.1인치, 6인치 패블릿 제품을 선보이며 스마트폰 대형화에 뛰어들었다. 애플의 후속 스마트폰인 아이폰6 역시 화면 크기가 커질 것이란 전망이 힘을 얻고 있다. 지난해 말에는 HTC, 노키아 등이 6인치 패블릿을 선보인 바 있다.시장조사기관 IHS아이서플라이에 따르면 지난해 패블릿 출하량은 6,040만대로 2012년 2,056만대보다 2배 이상(136%) 성장했다. 올해는 9,400만대,  2015년에 1억2,000만대, 2016년에 1억4,600만대로 꾸준히 확대될 전망이다.◇ 패블릿(phablet)=스마트폰(Smartphone)과 태블릿PC(tablet)의 합성어로 5~6.9인치 사이의 화면이 탑재된 '대화면 스마트폰'으로, 손가락 또는 전자펜을 이용하는 태블릿PC(소형PC급)에 준한 성능을 가진 모바일 기기를 말한다.이현호기자 hhlee@sed.co.kr[ⓒ 인터넷한국일보, 무단 전재 및 재배포 금지]"
55,2014-01-26,"정보유출 카드사, 탈회시 포인트 현금으로 돌려준다",https://news.naver.com/main/read.nhn?mode=LSD&mid=shm&sid1=101&oid=008&aid=0003195547,머니투데이,"[머니투데이 권다희 기자]정보유출로 해지와 탈회(회원탈퇴)가 잇따르고 있는 카드 3사가 탈회 회원의 마일리지를 현금으로 환급하거나 상품권으로 교체해 주는 방안을 내놨다.26일 여신금융협회에 따르면 이번에 정보가 유출된 KB국민, 롯데, NH 농협카드는 신용카드를 탈회할 경우 회원들이 손해를 보지 않도록 다음과 같은 조치를 시행 중이다.국민카드는 탈회한 회원의 카드 잔여 포인트를 현금으로 환급해준다. 롯데카드는 롯데멤버스 회원일 경우 롯데멤버스로 포인트를 전환하고 비회원일 경우 롯데백화점 상품권을 지급한다.또 농협카드는 BC계열 타 카드로 포인트를 사용할 수 있도록 하거나 캐쉬백으로 전환해준다.한편 회원 탈퇴가 아닌 해지(회원자격 유지)의 경우 이미 적립된 포인트는 포인트 소멸시효 동안 유지된다. 소멸시효는 통상 적립시점 후 5년이다.[오늘의 HOT포토][스페셜 포토][손안의 경제뉴스 머니투데이 모바일웹]권다희기자 dawn27@<저작권자 ⓒ '돈이 보이는 리얼타임 뉴스' 머니투데이, 무단전재 및 재배포 금지>"
56,2014-01-26,"여신協 ""카드3사서 탈회해도..포인트 손해 안 본다""",https://news.naver.com/main/read.nhn?mode=LSD&mid=shm&sid1=101&oid=018&aid=0002920378,이데일리,"[이데일리 김보리 기자] 여신금융협회는 개인정보 유출 파문이 발생한 KB국민, 롯데, NH농협 등 카드 3사에서 탈회한 회원이 손해를 입지 않도록 이미 적립한 포인트를 환급해주고 있다고 26일 밝혔다.여신금융협회에 따르면 KB국민카드는 탈회한 회원의 카드 잔여 포인트는 현금으로 환급해주고 있다. 롯데카드는 롯데멤버스 회원에게는 포인트로 전환해주고, 비회원에게는 롯데백화점 상품권을 지급해주고 있다. NH농협카드의 경우 BC 계열의 다른 카드로 포인트 사용을 허가해주거나 현금으로 환급해주고 있다. 회원이 카드를 해지하더라도 이미 적립된 포인트는 통상 5년간 쓸 수 있다.앞서 민주당 ‘신용정보대량유출 대책특위’ 위원장인 강기정 의원은 이날 기자간담회를 열고 “정보유출 피해자들이 카드를 해지하면 이미 적립된 포인트를 받지 못한다”며 금융감독원의 자료를 근거로 “개인당 3000~4000 포인트가 사라질 위기이고 총액으로 환산하면 68억원”이라고 말했다.김보리 (boris@edaily.co.kr)[이데일리 뉴스 앱][이데일리 TV][이데일리 ON][MP트래블러][마켓포인트]＜ⓒ종합 경제정보 미디어 이데일리 - 무단전재 & 재배포 금지＞"
57,2014-01-26,"美 러셀 ""한일간 심각한 긴장 두고보기 어렵다""",https://news.naver.com/main/read.nhn?mode=LSD&mid=shm&sid1=100&oid=421&aid=0000657499,뉴스1,"대니얼 러셀 미국 국무부 차관보가 26일 오후 서울 도렴동 외교부에서 이경수 외교부 차관보와의 면담을 마치고 청사를 나서면서 기자간담회를 갖고 있다. 윌리엄 번스 국무부 부장관의 중국, 일본 방문을 수행한 러셀 차관보는 우리나라 당국에 중국, 일본 방문 결과를 설명하고 북한 정세에 대해서도 논의한 것으로 알려졌다. 2014.1.26/뉴스1 © News1 박철중 기자""한일, 동북아에서 각자의 역할 있다""(서울=뉴스1) 조영빈 기자  = 대니얼 러셀 미국 국무부 동아태 차관보가 26일 방한해 이날 오후 이경수 차관보와 면담했다. 양측은 이날 최근 악화되고 있는 한일관계와 더불어 북핵문제와 관련한 양국 간 의견을 교환했다.러셀 차관보는 이날 이경수 차관보와의 면담 직후 가진 약식 기자회견에서 최근 한일관계와 관련 ""역사문제와 영토문제 등 많은 이슈들이 (동아시아 지역에) 있다""며 ""그러나 (관련국) 모두 좋은 관계와 긍정적인 외교 과정, 긍정적인 순환에 있어서 각자 해야 할 역할이 있다""고 밝혔다.러셀 차관보는 또 ""세계 경제나 동북아시아 지역에서의 안보가 중요하기 때문에 아시아 민주주의의 두 선두주자인 한일 간 심각한 긴장을 그대로 두고 보기 어렵다""며 최근 악화되고 있는 한일관계와 관련한 미국의 입장을 설명했다.이는 최근 아베 신조 총리의 야스쿠니 신사참배 등 일본 정부의 우경화 행보로 불거진 동북아 지역의 갈등과 관련해 미국이 이 문제에 상당한 관심을 두고 있는 흐름이 이어지고 있는 것으로 풀이된다.앞서 24일 일본을 방문했던 윌리엄 번즈 미국 국무부 부장관은 오노데라 이쓰노리(小野寺五典) 일본 방위상을 만난 자리에서 ""미국이 야스쿠니 문제를 언급한 것은 지역관계를 좋게 하려는 것""이라며 한국과 중국 등 주변국과의 관계 개선 필요성을 강조한 바 있다.러셀 차관보는 또 북핵문제와 관련 ""북한문제를 최우선순위에 두고 한미 간 대화를 진행했다""고 밝혔다.양측은 북한이 핵과 미사일 관련 활동들을 중단하도록 계속해서 설득해야 한다는 기존의 입장을 재차 확인하고, 한미 양국 간 협의를 지속해가기로 했다.bin1981@저작권자  뉴스1코리아, 무단전재 및 재배포 금지저작권자  뉴스1코리아, 무단전재 및 재배포 금지"
