,날짜,기사 제목,기사 링크,기사 출처,기사 내용
91,2017-11-11,"손잡은 푸틴·두테르테…""필리핀 대테러지원""·""러 무기 사겠다""",https://news.naver.com/main/read.nhn?mode=LSD&mid=shm&sid1=104&oid=001&aid=0009676700,연합뉴스,"(하노이=연합뉴스) 김문성 특파원 = 러시아와 필리핀이 미국 보란 듯이 군사협력을 강화하고 있다.11일 일간 마닐라불러틴 등 필리핀 언론에 따르면 아시아태평양경제협력체(APEC) 정상회의 참석차 베트남을 방문 중인 블라디미르 푸틴 러시아 대통령과 로드리고 두테르테 필리핀 대통령은 전날 오후 양자회담을 하고 양국 방위협력 확대에 의견을 모았다.두테르테 대통령은 최근 러시아의 무기 원조에 고마움을 표시하며 미국산 중고 무기의 구매를 중단하고 러시아제 무기를 사고 싶다는 입장을 밝혔다.그는 과거 미국제 중고 헬리콥터 3대 가운데 2대가 추락한 '매우 나쁜 경험'이 있다고 푸틴 대통령에게 토로했다.푸틴 러시아 대통령(오른쪽)과 두테르테 필리핀 대통령이 11일 APEC 정상회의가 열리는 베트남 다낭에서 양자회담을 하는 모습[AFP=연합뉴스]해리 로케 필리핀 대통령 대변인은 ""두테르테 대통령이 더는 나쁜 조건의 군사장비를 사지 않기로 했다""며 ""필리핀은 매우 좋은 기계·장비를 제작하는 러시아로부터 군사무기를 구매할 것""이라고 말했다.앞서 러시아는 10월 필리핀의 극단주의 무장단체 '이슬람국가'(IS) 토벌작전을 지원하기 위해 군용 소총 5천 정과 탄약 100만 발, 군용트럭 20대를 기부했다. 이는 필리핀에 대한 러시아의 첫 군사원조다.푸틴 대통령은 두테르테 대통령에게 ""테러는 공동의 문제로, 필리핀과 군사협력을 비롯해 관계를 증진할 준비가 돼 있다""며 헬리콥터와 고속정을 비롯한 러시아제 무기 구매를 제안했다.또 필리핀군의 대테러 훈련을 지원하고 필리핀 근해를 통과하는 러시아 선박의 수리 시설을 필리핀에 설치하겠다는 의사를 전달했다.두테르테 대통령은 작년 6월 말 취임 이후 친미 일변도의 기존 필리핀 외교노선을 버리고 중국, 러시아와의 경제·방위협력에 박차를 가하고 있다. 중국과 러시아도 미국 견제를 위해 필리핀과의 관계 개선에 적극적이다.kms1234@yna.co.kr▶기사제보 및 문의(클릭!)▶최신 유행 트렌드 총집결(클릭!)"
92,2017-11-11,중국발 황사 덮친 주말…기온 떨어져 건강 주의,https://news.naver.com/main/read.nhn?mode=LSD&mid=shm&sid1=103&oid=422&aid=0000286863,연합뉴스TV,"[날씨] 중국발 황사 덮친 주말…기온 떨어져 건강 주의비구름이 물러간 대신 추위와 황사가 찾아왔습니다.지금 하늘은 맑지만 공기와 바람이 차고요.중국발 황사도 날아들어 전국 대부분 지역의 미세먼지 농도가 나쁨수준을 보이고 있습니다.주말인 오늘 추위와 황사가 내내 영향을 주겠습니다.바깥 활동하실 때 꼭 참고하셔야겠습니다.지금 전국적으로 별다른 구름과 안개 없이 하늘은 맑은데요.영서, 일부 서해안에 황사가 관측되고 있습니다.오늘 고기압 영향으로 하늘은 맑아도 종일 대부분 지역의 공기가 탁하겠습니다.또 동해안지역은 바람이 강한데 대기가 건조하기까지 해 화재사고 없도록 유의하셔야겠습니다.현재 기온 서울 7도, 전주 8.9도로 일부 해안을 제외하고는 10도 선을 밑돌고 있습니다.오늘 한낮 최고 기온은 서울과 춘천 11도, 전주 12도, 대구 13도로 많은 지역이 15도를 밑돌겠고요.찬 바람도 불어 체감 온도는 더 낮겠습니다.물결은 대부분 해상으로 높게 일겠고 동해안지역은 너울성 파도도 밀려들 수 있겠습니다.일요일인 내일 아침은 서울 기온이 1도까지 내려가 오늘보다 더 춥겠고요.수능일이 껴 있는 다음 주는 영하권의 강추위가 찾아올 것으로 보입니다.날씨 전해드렸습니다.(김조현 기상캐스터)연합뉴스TV : 02-398-4441(기사문의·제보) 카톡/라인 jebo23▶ 연합뉴스TV 네이버 채널 구독▶ 생방송 시청▶ 대한민국 뉴스의 시작, 연합뉴스TV 앱 다운받기"
93,2017-11-11,세수풍년에 작년 국세수입 11% 급증…경상성장률의 2.4배,https://news.naver.com/main/read.nhn?mode=LSD&mid=shm&sid1=101&oid=001&aid=0009676826,연합뉴스,"금융위기 이후 세수탄성치 가장 높아내년에도 견조한 세수 증가세…""세입예산안 과소 편성 가능성""(세종=연합뉴스) 박대한 기자 = 지난해 세수가 전년 대비 24조원 이상 더 걷히는 '역대급 풍년'을 기록하면서 세수탄성치가 금융위기 이후 가장 높은 수준을 나타냈다.세수탄성치란 세수증가율을 경상성장률(물가 상승률을 고려한 경제성장률)로 나눈 수치다.세수탄성치가 1이면 경제가 성장한 만큼 세수가 늘었다는 뜻이고 1보다 높으면 경제가 성장하는 이상으로 세수가 더 걷혔다는 의미다.그만큼 국민 주머니 사정은 홀쭉해진 대신 정부 곳간이 채워진 셈이다.11일 국회 기획재정위원회의 '2018년 예산안 검토보고서'에 따르면 지난해 국세수입은 242조6천억원으로 전년 대비 11.3% 늘어났다.지난해 경상성장률(실질성장률+ GDP디플레이터)이 4.7%라는 점을 감안하면 세수탄성치는 2.42로 집계됐다.이는 최근 10년간 가장 높은 수준이다.세수탄성치는 글로벌 금융위기 직전인 2007년 2.12로 2를 넘었지만 2008년 0.62로 떨어진 뒤 2009년에는 마이너스(-0.39)를 기록했다.이어 2010년 0.81, 2011년 1.55, 2012년 1.65 등으로 높아지다가 2013년 다시 마이너스(-0.14)를 거쳐 2014년 0.45를 나타냈다.세수 호황기조가 나타나면서 세수탄성치는 2015년 1.15에서 2016년 2.42까지 높아졌다.지난해 기록적인 조세탄성치 수치를 기록한 것은 국세수입이 전년 대비 24조7천억원, 지난해 추가경정예산안 대비 9조7천억원이 더 걷혔기 때문이다.정부는 법인실적 개선, 소비 증가, 부동산 시장 호조 등의 요인으로 세수가 호조세를 나타냈다고 설명했다.세수 호황기조는 올해는 물론 내년까지 이어질 것으로 전망된다.정부가 국회에 제출한 세입예산안에 따르면 내년도 국세수입은 268조2천억원으로 올해 추가경정예산안 기준 국세수입(251조1천억원) 대비 6.8% 늘어날 것으로 전망됐다.내년 정부의 경상성장률 전망치가 4.5%라는 점을 감안하면 세수탄성치는 1.5로 최근 2년간 세수탄성치의 중간 수준으로 예상된다.기재위는 그러나 올해 최종 세수 실적이 추경예산안 기준보다 많은 260조 원에 달할 것으로 보이는 만큼 내년 세입예산안(268조2천억원)은 과소편성됐을 가능성이 크다고 지적했다.올해 세수입을 260조원으로 가정하면 내년 국세 세입예산안 증가율은 3%에 그치게 돼 세수 탄성치는 0.67 정도에 불과하게 된다.기재위는 ""내년 경상성장률 전망치가 4.5%이고 최근 2년간 세수탄성치가 1을 초과하고 있다는 점에서 2018년도 국세 세입예산안은 다소 과소편성됐을 가능성이 존재한다""면서 ""내년에도지난해나 올해만큼은 아니더라도 견조한 세수 증가세가 이어질 것으로 기대된다""고 밝혔다.pdhis959@yna.co.kr▶기사제보 및 문의(클릭!)▶최신 유행 트렌드 총집결(클릭!)"
94,2017-11-11,동네 휘발윳값 4개월째 급등세 이유 있었네,https://news.naver.com/main/read.nhn?mode=LSD&mid=shm&sid1=101&oid=018&aid=0003967890,이데일리,"- 중동 정치 불안 탓…두바이유 가격 계속 상승세- 휘발윳값도 4개월째 급등…어느덧 1500원 넘어- 서울 일부서 ℓ당 2000원 이상 초고가 주유소도국내 기름값이 국제유가 상승에 따라 계속 오르고 있다. 사진은 서울 시내의 한 주유소. 사진=연합뉴스[이데일리 김정남 기자] 우리나라 수입 원유의 대부분을 차지하는 두바이유 가격이 고공행진을 지속하고 있다. 어느새 배럴당 62달러를 넘어섰다.이 때문에 동네 주유소의 휘발윳값도 4개월째 급등하고 있다.◇동네 휘발윳값 4개월째 상승세11일 마켓포인트에 따르면 지난 10일(현지시간) 아랍에미리트(UAE) 두바이상업거래소에서 두바이유 현물은 전거래일 대비 0.73% 상승한 배럴당 62.06달러에 거래를 마쳤다. 지난 7일(62.39달러)에 이어 또다시 62달러를 넘었다.이 정도 수준은 지난 2015년 6월 말 이후 거의 2년5개월 만에 최고치다.우리나라는 중동에서 원유의 상당부분을 수입하고 있다. 한국석유공사에 따르면 지난해 기준 중동지역 수입 비중은 85.9%. 중동의 유가 지표인 두바이유의 변동이 우리 경제에 가장 큰 영향을 미치는 것이다.이를테면 주유소 기름값이 거침없이 오르는 것도 두바이유와 그 흐름을 같이 하고 있다.한국석유공사의 유가정보서비스 오피넷 자료를 보면, 이번달(11월) 둘째주 주유소 휘발유 가격은 전주 대비 4.1원 오른 ℓ(리터)당 1512.1원을 기록했다. 15주 연속 상승세다.특히 서울 지역은 ℓ당 1614.8원으로 전국 평균보다 무려 100원 이상 높았다. 서울 중구 용산구 강남구 서초구 등에서는 2000원 이상 초고가 주유소도 심심치 않게 볼 수 있을 정도다.같은 기간 경유 가격도 4.5원 오른 ℓ당 1304.1원으로 집계됐다. 16주 연속 오름세다.각각 뉴욕상업거래소와 런던ICE선물거래소에서 거래되는 서부텍사스산원유(WTI)와 브렌트유의 국내 영향력은 상대적으로 미미하다.두바이유는 지난 6~7월 배럴당 40달러대에서 움직이다가 지난달 말부터 50달러 후반대로 급등했다. 이후 이번달 초부터 60달러를 넘더니 조금씩 레벨을 높이고 있다.이는 최대 산유국인 사우디아라비아의 정치적 혼란 탓이다. 사우디아라비아 왕실의 ‘피의 숙청’은 시장의 불확실성을 높이고 있다.◇“유가 추가 상승시 경제에 부담”지난밤 WTI(올해 12월 인도분·56.74달러)와 브렌트유(내년 1월 인도분·63.52달러) 선물은 소폭 내렸다. 각각 0.75%, 0.64% 하락했다.이는 미국의 원유 공급이 늘어날 수 있다는 전망 때문이다.원유정보기업 베이커휴에 따르면 미국의 주간 원유 시추공 수는 738개로, 전주보다 9개 증가했다. 원유 시추공은 향후 산유량을 가늠할 수 있는 선행지표다. 1년 전 가동 중인 원유 시추공 수(452개)와 비교하면 큰 폭 늘었다.다만 WTI와 브렌트유의 레벨 자체는 두바이유와 마찬가지로 거의 2년반 만에 최고치다.배럴당 60달러대 국제유가는 인플레이션을 자극하지 않으면서 경기에도 긍정적인 ‘적정 수준’이라는 평가가 많다. 세계 경기 호황의 방증이라는 것이다. 원유가 많이 쓰인다는 것은 그만큼 경제 활동이 활발하다는 뜻이다.그러나 만에 하나 70달러대 이상 추가 상승한다면 기업과 가계 경제에 부담이 될 수 있다는 우려도 나온다.김정남 (jungkim@edaily.co.kr)▶네이버 채널에서 ‘이데일리’를 구독해주세요▶개편 이벤트 '갤노트8 쏜다~'▶카톡 플친 맺으면 스타벅스 쿠폰~♥＜ⓒ종합 경제정보 미디어 이데일리 - 무단전재 & 재배포 금지＞"
95,2017-11-11,"""농업은 레드라인""…한미FTA 개정협상 '아킬레스건'될 수도",https://news.naver.com/main/read.nhn?mode=LSD&mid=shm&sid1=101&oid=001&aid=0009676809,연합뉴스,"미국이 역이용해 타 분야 과도한 요구할 가능성(서울=연합뉴스) 김영현 기자 = 한미자유무역협정(FTA) 개정협상을 앞둔 우리 정부가 ""농업 분야는 레드라인""이라고 확고한 입장을 보이고 있지만 이 같은 태도가 오히려 '아킬레스건'이 될 수 있다는 우려가 나오고 있다.국내 농축산업계를 안심시키기 위해 단호한 메시지를 낼 수 밖에 없는 우리측 입장을 미국이 교묘하게 역이용할 수 있다는 점 때문이다.정부는 농축산 단체의 반발로 사실상 무산된 지난 10일 한미FTA 공청회에서도 ""농축산물 시장 추가 개방은 없다""고 거듭 강조했다.강성천 통상차관보는 이날 단상을 점거한 농축산업계 관계자들에게 이같은 정부 입장을 재차 설명했다.그럼에도 농축산업계 관계자들은 ""한미FTA를 폐기하라""고 촉구하며 물러서지 않았고 이날 공청회는 파행으로 끝났다.이에 정부는 통상절차법에 규정된 공청회 개최 의무를 다했다는 판단에 따라 향후 국회 보고 등 한미FTA 개정을 위한 후속 절차를 예정대로 진행하기로 했다.하지만 이 같은 농축산업계 반발 움직임은 앞으로 이어질 한미FTA 개정협상에서 우리 정부에 상당한 부담이 될 전망이다.통상 관계자는 11일 ""미국은 우리가 농업 분야를 사수해야 한다는 상황에 대해 너무나 잘 알고 있다""며 ""이 같은 점을 집요하게 공략하며 다른 제조업 분야 협상에서 원하는 목적을 달성하려 할 것""이라고 내다봤다.미국이 한국의 가장 아픈 부분인 농업을 건드리면서 자동차나 서비스 등의 분야에서 과도한 요구를 할 수 있다는 것이다.실제로 미국은 지난 9월 열린 한미FTA 공동위에서 한국의 미국산 농산물에 대한 관세를 즉시 철폐하라고 요구한 것으로 알려졌다.한국 정부는 한미FTA 체결 당시 쌀을 비롯한 민감 품목은 양허 대상에서 제외하고 고추, 마늘, 양파 등 118개 품목에 대해서는 15년 이상 장기 철폐 기간을 확보했다.미국은 한미FTA 발효 이후 15년에 걸쳐 철폐하기로 한 농산물 관세를 당장 없애달라고 하는 동시에 한국산 농산물에 대해서는 관세를 5~10년 더 부과하겠다고 주장한 것으로 전해졌다.이와 관련해 김현종 통상교섭본부장은 최근 국회 국정감사에서 ""농업은 우리에 매우 어려운 것이고 농업을 건드리는 순간 우리는 미국의 제일 민감한 것을 건드릴 수밖에 없다고 미국 측에 이야기했다""고 밝혔다.하지만 농업 부문을 지켜야하는 우리 측 상황이 더 절실하기 때문에 결국 협상 과정에서 '농업을 사수하고 다른 것을 더 내주는' 결과를 맞을 가능성이 크다고 통상업계는 우려하고 있다.이와 관련해 김영록 농림축산식품부 장관은 지난 8일 국회 예산결산특별위원회 경제부처 예산심사에서 ""농업 부문에 대해 미국의 추가 요구가 있으면 어떻게 하겠다는 대응 시나리오를 전략적으로 마련해 적극적으로 대응할 계획""이라고 답했다.한편, 정부는 이달 내로 국회 보고 등 개정협상 절차 관련 준비를 마무리할 방침인 것으로 알려졌다.미국이 전면 개정 대신 일부 개정 쪽으로 방향을 잡으면 까다로운 절차를 거칠 필요가 없기 때문에 양측은 이르면 다음 달부터 한미FTA 개정협상을 시작할 수 있다.cool@yna.co.kr▶기사제보 및 문의(클릭!)▶최신 유행 트렌드 총집결(클릭!)"
96,2017-11-11,주말 서울 도심 노동자대회 등 집회…교통혼잡 예상,https://news.naver.com/main/read.nhn?mode=LSD&mid=shm&sid1=102&oid=003&aid=0008281230,뉴시스,"【서울=뉴시스】 <서울경찰청, 11일 집회·행진 교통 요도>【서울=뉴시스】채윤태 기자 = 주말인 11일 서울 도심에서 노동자대회 등 집회가 잇따라 열린다.전국공무원노동조합(전공노)은 이날 오후 2시 서울역 광장에서 '공무원노동자총궐기대회'를 열고 공무원노조 설립신고 쟁취, 해직자 원직복직 등을 정부에 요구한다.전공노는 집회를 마친 뒤 세종대로(숭례문→시청→광화문)를 따라 청와대 사랑채까지 행진할 예정이다.전국 특성화고, 마이스터고 학생, 현장실습생으로 구성된 특성화고등학생권리연합회는 같은 시간 중구 평화시장에서 창립대회 및 출범식을 개최한다. 이들은 이후 동대문역사공원을 거쳐 성동공고앞까지 행진할 계획이다.이들은 ""전태일 열사 47주기 기일(13일)을 맞아 창립대회를 연다""며 ""직업계고 학생들에 대한 차별을 바꾸고 권리를 찾기 위한 첫 출발의 장소로 전태일 열사가 분신했던 장소인 평화시장을 선정했다""고 설명했다.민주노총은 오후 6시 여의도 문화마당에서 '87년 노동자투쟁 30주년 한마당'을 연다.태극기운동본부, 구명총연맹 등 4개 보수단체도 이날 오후 2시부터 동아일보 사옥 앞 등 도심 곳곳에서 각각 집회를 진행한 뒤 행진을 이어간다.통일의병은 오후 4시께 '전쟁반대 평화협상 촉구시민대회'를 열고 서울역사박물관에서 서대문역, S타워 등을 거친 뒤 서울역사박물관으로 돌아오는 행진을 벌인다.경찰 관계자는 ""새종대로, 을지로, 삼일대로, 종로 등 도심 대부분의 주요도로에서 극심한 교통 체증과 불편이 예상된다""며 ""지하철 등 대중교통을 이용하고 부득이 차량 운행 시 해당시간대 통일로·퇴계로·장충단로 등으로 우회해 주길 바란다""고 말했다.서울시에서는 통제구간 내 버스 노선을 임시로 조정할 예정이다. 버스노선 문의는 서울시 다산콜센터 120번으로 하면 된다.집회와 행진 시간대 자세한 교통상황은 서울경찰청 교통정보 안내전화(02-700-5000), 교통정보센터 홈페이지(www.spatic.go.kr), 스마트폰 앱(서울교통상황)을 통해 확인할 수 있다.chaideseul@newsis.com▶ 뉴시스 빅데이터 MSI 주가시세표 바로가기▶ 네이버 채널에서 뉴시스를 구독해주세요<저작권자ⓒ 공감언론 뉴시스통신사. 무단전재-재배포 금지.>"
97,2017-11-11,"韓-베트남 정상, 2020년까지 교역 1천억弗 가속화 합의",https://news.naver.com/main/read.nhn?mode=LSD&mid=shm&sid1=100&oid=421&aid=0003041613,뉴스1,"문재인 대통령과 김정숙 여사가 아시아태평양경제협력체(APEC) 정상회의에 참석하기 위해 10일 베트남 다낭 국제공항에 도착했다. © AFP=뉴스1文 ""한국산 자동차부품 무관세 적용 요청""…쩐 주석 ""적극 검토""북핵문제 해결에도 공감대(다낭·서울=뉴스1) 김현 기자,서미선 기자 = 동남아시아를 순방 중인 문재인 대통령은 11일(현지시간) 쩐 다이 꽝(Tran Dai Quang) 베트남 국가주석과 정상회담을 하고 양국이 합의한 '2020년까지 교역 1000억불 목표' 달성을 위한 노력에 속도를 내기로 했다.두 정상은 이날 오전 8시부터 40분간 베트남 다낭시 정부청사에서 정상회담을 갖고 한-베트남 관계발전 방향을 비롯한 상호 관심사에 대해 논의하면서 이같이 뜻을 모았다.문 대통령은 회담에서 '한-아세안(ASEAN) 미래공동체 구상' 등 한국정부의 아세안 관계강화 방침을 설명하며 올해 수교 25주년을 맞는 베트남과의 관계를 한층 더 강화해 나가길 희망했다.쩐 주석은 지난 5월 아세안 특사 파견 등 한국정부의 아세안 중시 입장을 높이 평가하며 ""한국의 '미래공동체 구상' 실현을 위해 적극 협력하겠다""고 화답했다.두 정상은 그동안 양국이 모범적 양국관계를 발전시켜 온 것을 평가하고, 2019년 전략적 협력 동반자관계 수립 10주년을 앞두고 양국관계를 한층 더 심화하기 위해 함께 노력해 나가기로 했다.또한 문 대통령은 한국기업의 대(對)베트남 투자 확대를 위해 한국산 자동차 부품에 대한 무관세 적용, 사회보장협정의 조속한 체결 등에 대한 지원을 요청했다.쩐 주석은 이에 ""베트남은 한국기업의 투자확대를 환영한다는 입장""이라고 강조하며 한국측 요청을 적극 검토하겠다고 밝혔다.북한 문제와 관련해선 문 대통령이 쩐 주석에게 그동안 북핵·북한 문제에 있어 우리 입장을 적극 지지해준 것을 평가하며 ""앞으로도 긴밀히 협력해달라""고 요청했다.쩐 주석은 ""북핵문제 해결을 위한 한국과 국제사회 노력을 계속 지지할 것""이라고 답했다.이와 함께 문 대통령은 기존의 '다낭 한-베트남 IT(정보기술) 친선대학, '한-베트남 기술교류센터'와 이번 주 하노이에 개소 예정인 '글로벌 기후변화 허브센터' 'IT지원센터', 내년 초 착공 예정인 '한-베 과학기술연구원' 등이 중소기업 지원, 과학기술·정보통신기술 등 각 분야에서 양국 간 협력에 기여하길 기대한다고 말했다.쩐 주석은 한-베트남 간 다양한 분야에서 활발한 협력이 이뤄지는데 만족을 표하며, 앞으로도 개발협력과 경제발전을 위해 한국 측과 적극 협력하겠다고 밝혔다.청와대는 ""이번 정상회담을 통해 한-베트남 양국은 정상 차원 신뢰와 우호협력 관계를 구축했으며, 이를 토대로 양국관계를 한 차원 더 높은 수준으로 발전시켜 나갈 기반을 마련했다""고 자평했다.smith@▶ '평창2018' 관련 뉴스·포토 보기▶ 여러분의 제보를 기다립니다.제보하기![© 뉴스1코리아(news1.kr), 무단 전재 및 재배포 금지]"
