,날짜,기사 제목,기사 링크,기사 출처,기사 내용
45,2017-11-11,"文대통령-시진핑, 2번째 정상회담 43분만에 종료",https://news.naver.com/main/read.nhn?mode=LSD&mid=shm&sid1=100&oid=421&aid=0003041892,뉴스1,"(청와대 페이스북) 2017.7.6/뉴스1(다낭·서울=뉴스1) 김현 기자,서미선 기자 = 아시아태평양경제협력체(APEC) 정상회의 참석을 계기로 베트남 다낭에서 이뤄진 문재인 대통령과 시진핑 중국 국가주석 간 정상회담이 11일(현지시간) 43분만에 종료됐다.문 대통령과 시 주석은 이날 오후 5시37분부터 6시20분께까지 베트남 다낭 중국 측 숙소인 크라운플라자 호텔에서 정상회담을 했다.당초 한중 정상회담은 이날 오후 5시부터 시작될 예정이었지만 이날 폐막한 APEC 정상회의 일정이 지연되며 정상회담 시간도 순연됐다.두 정상은 지난 7월 주요20개국(G20) 정상회의 참석 계기에 한 첫 번째 정상회담 뒤 이번에 넉달여만에 대좌한 것이다.문 대통령은 회담 모두발언에서 ""한중간 잃어버린 시간을 만회할 수 있도록 양측이 함께 노력하길 바라마지 않는다""고 말했다.또 '매화는 겨울 추위를 이겨낸다'는 뜻의 중국 사자성어인 매경한고(梅經寒苦)와 '비온 뒤 땅이 굳는다'는 한국 속담을 인용하며 ""한중관계가 일시적으로는 어려웠지만 한편으로는 서로의 소중함을 재확인하는 시간이었다""고 강조했다.시 주석은 이에 ""오늘 우리 회동은 앞으로 양국관계 발전과 한반도 문제에 있어 양측의 협력, 리더십 발휘에 있어 중대한 계기가 될 것으로 믿는다""고 말했다.이어 ""중한 양국은 각자 경제사회 발전, 양자관계의 발전적 추진, 세계평화의 발전에 있어 광범위한 공동의 이익을 갖고 있다""며 ""중한관계와 한반도 정세는 관건적 시기(중요한 시기)에 있다""고 언급했다.두 정상은 지난 7월 독일 베를린 주요20개국(G20) 정상회의 계기에 한 첫 번째 정상회담 이후 처음으로 만난 데 대해서도 ""다시 만나게 돼 기쁘다""고 입을 모았다.이에 이 자리에서 양국 정상은 사드(THAAD) 한반도 배치로 얼어붙은 한중관계를 본격적으로 정상화하는데 의견을 모으고, 전략적 동반자 관계를 굳건히 하는데 의견을 모았을 것으로 예상된다.북핵과 관련해 '평화적 해결' 원칙에 공감한 바 있는 문 대통령과 시 주석이 어떤 접점을 찾았을지에도 관심이 모아진다.문 대통령의 연내 방중(訪中) 및 시 주석의 내년 2월 평창동계올림픽 참석 관련 논의도 이뤄졌을 가능성이 있다.smith@▶ '평창2018' 관련 뉴스·포토 보기▶ 여러분의 제보를 기다립니다.제보하기![© 뉴스1코리아(news1.kr), 무단 전재 및 재배포 금지]"
46,2017-11-11,'최저임금' 범위 어디까지?…노사 '팽팽',https://news.naver.com/main/read.nhn?mode=LSD&mid=shm&sid1=102&oid=214&aid=0000790751,MBC,"[뉴스데스크]◀ 앵커 ▶최저임금 인상 폭을 놓고 대립했던 재계와 노동계가 이번에는 최저임금의 범위를 어디까지 할 것인지를 놓고 다시 충돌하는 분위기입니다.정기 상여금과 교통비, 식대 등이 쟁점인데 팽팽한 줄다리기가 예상됩니다.박성원 기자입니다.◀ 리포트 ▶현행법상 최저임금은 근로자들이 매달 정기적으로 받는 기본급에 직무와 관련된 고정수당으로 구성돼 있습니다.각종 상여금과 야간·휴일 수당, 식비나 교통비 같은 복리후생비는 제외돼 있습니다.내년 최저임금 7,530원 도입을 앞두고 이 기준을 개편하는 작업이 진행 중인데, 노사 양측이 첨예하게 대립하고 있습니다.우선 사용자 측은 최저임금의 산입범위에 상여금 등을 포함시켜야 한다고 주장합니다.근로자들의 실질적인 소득인 상여금 등을 제외한 채, 과거 기준대로 기본급과 고정수당 명목으로만 최저임금을 지급하려면 인건비 부담이 너무 커진다는 겁니다.[김동욱/한국경영자총협회 본부장]""받을 시기라든지 금액이 결정돼있는 상여금이라든지 교통비, 식대는 최저임금에 포함돼야 한다는 것이(사용자 측 입장입니다.)""이와 관련해 어수봉 최저임금위원회 위원장은 최근 국정감사에서 ""정기상여와 고정적인 교통비, 중식비 등은 최저임금 산입범위에 들어가야 한다""며 확대 쪽에 무게를 실었습니다.노동계는 강하게 반발하고 있습니다.최저임금보다 20~30% 높은 이른바 '생활임금' 수준으로 기본급이 오른 뒤에야 산입범위 확대 여부를 논의할 수 있다는 입장입니다.[이성경/한국노총 사무총장]""(최저임금) 산입범위에 상여금과 식대를 포함하면 실질적으로 (근로자 입장에서는) 최저임금이 올라가는 느낌이 없습니다.""최저임금위원회는 전문가와 노사 양측 간의 의견을 수렴한 뒤 다음 달쯤 정부에 개편안을 보고할 예정입니다.MBC뉴스 박성원입니다.박성원기자 (want@mbc.co.kr)[저작권자(c) MBC (www.imnews.com) 무단복제-재배포 금지]Copyright(c) Since 1996,MBC&iMBCAll rights reserved."
47,2017-11-11,국정원·군의 동시 '윗선'…이명박 소환 초읽기,https://news.naver.com/main/read.nhn?mode=LSD&mid=shm&sid1=100&oid=055&aid=0000584858,SBS,"<앵커>이명박 정부에서 국정원장을 지낸 원세훈 씨에 이어 김관진 당시 국방장관마저 구속되면서 이제 수사는 정점으로 치닫고 있습니다. 두 사람의 유일한 윗선, 이명박 전 대통령 소환 조사가 임박했다는 전망이 나오고 있습니다.계속해서 임찬종 기자입니다.<기자>검찰은 군 사이버 사령부의 정치 개입 수사를 통해 이명박 전 대통령의 관여 정황이 물증에서 드러났다고 보고 있습니다.2012년 총선과 대선을 앞두고 이 전 대통령이 사이버사 증원을 위한 예산 확보를 요구하고, ""우리 사람을 철저하게 가려 뽑아야 한다""고 지시한 사실이 기록된 문건들이 대표적입니다.김관진 전 장관도 검찰 조사에서 문건에 적힌 대통령 지시에 대해선 부인하지 못한 것으로 전해졌습니다.검찰은 따라서 이 전 대통령을 군 사이버사령부의 정치 개입을 지시한 혐의로 조사하는 것이 불가피하다고 보고 있습니다.다만, 이에 앞서 김 전 장관의 대통령 보고에 배석했던 김태효 전 대외전략기획관을 소환해 조사할 방침입니다.검찰은 국정원의 정치 개입과 관련해서도 이 전 대통령을 조사하는 방안을 검토하고 있습니다.당시 국정원이 SNS 장악 문건과 방송 장악 문건 등 정치 개입 공작을 청와대에 보고했던 것으로 드러났기 때문입니다.이와 관련해 이 전 대통령은 내일(12일) 바레인으로 출국하면서 군과 정보기관에 대한 수사 때문에 안보에 어려움이 올 수 있다는 입장을 밝힐 것으로 전해졌습니다.(영상편집 : 이승진)▶ '군 댓글 공작' 김관진 구속…무너진 '무인 신화'임찬종 기자(cjyim@sbs.co.kr)☞[나도펀딩] 연탄기부 참여하기☞[마부작침] 청와대에 침투한 공포의 존재…그의 이름 '꽃매미'※ © SBS & SBS I&M. : 무단복제 및 재배포 금지"
48,2017-11-11,세월호서 유품 189점 수습..미수습자 5명 남아,https://news.naver.com/main/read.nhn?mode=LSD&mid=shm&sid1=102&oid=018&aid=0003968076,이데일리,"- 현장수습본부, 선체서 핸드폰 등 수습- 기관실 수색중, 연말까지 추가수색- 미수습자 5명 뼛조각 아직 못 찾아- 11~13일 고창석 교사 3년 만에 장례식김상곤 사회부총리 겸 교육부 장관이 11일 오후 서울 강남구 서울삼성병원 장례식장에 마련된 세월호 희생자 고 고창석 단원고 교사의 빈소를 찾아 조문하고 있다.[사진=뉴시스][세종=이데일리 최훈길 기자] 세월호에서 승객들의 유류품이 무더기로 발견됐다. 미수습자 5명의 뼛조각은 여전히 발견되지 않고 있다. 정부는 조만간 기술검토를 마무리 하고 추가수색 범위를 발표하기로 했다.11일 해양수산부에 따르면 세월호 현장수습본부는 세월호 선체 수색 과정에서 유류품 189점을 수습했다고 이날 발표했다. 이는 의류(131점), 신발(25점), 가방(15점), 안경(4점), 핸드폰(1점) 등이다.최근 2주간 선체에서 꺼낸 잔존물을 모아 이날 한꺼번에 정리하면서 유류품 숫자가 대폭 늘어났다. 화물칸(C 데크)에서 발견된 모토로라 폴더폰은 세월호 선체조사위원회에 인계돼 복원 여부가 결정된다. 이날 유류품까지 포함해 현재까지 총 6716점이 수습됐다. 이 중 545점은 유가족에게 전달됐다.현장수습본부는 현재 기관실 수색을 진행 중이다. 선체 선미 쪽 기관실 수색이 11일까지 90% 완료된 상태다. 선체 밖으로 진흙 등을 꺼내 폐기물, 유류품을 분류하는 작업도 진행 중이다. 앞서 지난 4월 인양 이후 진행됐던 선체 객실·화물칸 및 침몰 해역에 대한 수중수색이 6개월 만에 종료됐다.그동안 수색팀은 미수습자 유해를 잇따라 수습했다. 이 결과 고창석·이영숙 씨·허다윤 양·조은화 양 등 4명의 유해는 국립과학수사연구원에서 신원이 확인됐다. 조은화·허다윤 양의 유해는 지난 9월23~24일 이별식 이후 25일 화성시 효원납골공원에, 이영숙 씨는 지난달 13~15일 장례식 이후인 15일 인천가족공원의 세월호 일반인희생자추모관에 봉안됐다.고창석 교사의 장례식은 11일 오후 3시부터 13일 오전 6시까지 서울 강남구 일원동 삼성서울병원 장례식장 지하 2층 20호실에서 진행 중이다. 장례식이 끝나면 13일 수원시 연화장에서 화장을 한 뒤 국립대전현충원에 안장된다.하지만 남현철·박영인 군, 양승진 교사, 권재근·권혁규 부자 등 5명의 미수습자는 뼛조각도 찾지 못한 상황이다. 이들 미수습자 가족들은 지난달 26일 목포신항에서 기자회견을 열고 “영원히 못 찾는 미수습자 가족이 될까 두렵고 무섭다”며 정부에 수색 연장을 요청했다.이후 정부는 연말까지 추가수색을 진행하기로 했다. 정부는 지난달 31일 이낙연 국무총리 주재로 열린 국무회의에서 세월호 미수습자 수습 지원경비로 117억원을 편성한 ‘2017 일반회계 예비비 지출안’을 상정·처리했다. 지원경비에는 △선체정리업체 코리아쌀베지에 추가로 지급할 63억원 △10월까지 진행한 세월호 침몰해역에 대한 2~3차 수중수색 비용(52억원)이 포함됐다.다만 추가수색 범위·대상은 현재 확정·발표되지 않았다. 수색종료 최종 시한도 확정되지 않았다. 이는 기술 검토 후 결정될 예정이다. 장기욱 해수부 선체수습과장은 “정부는 세월호 미수습자 수습에 대한 종료 시점을 미리 정하고 있지 않다”고 밝혔다. 이철조 현장수습본부장은 11일 통화에서 “기술 검토 결과가 조만간 나올 예정”이라며 “향후 수색은 기술 검토를 토대로 검토할 것”이라고 말했다.김영춘 해수부 장관은 이데일리와 만나 “미수습자를 다 찾는 것이 세월호의 첫 번째 과제다. 그 목표를 보고 최선을 다해 수색하고 있다”고 말했다. 진상조사 등 향후 일정에 대해선 “다섯 분을 아직 못 찾았다. 수색 이후 일정을 지금 말하는 건 섣부르다”며 말을 아꼈다.문재인 대통령은 지난 8월 16일 청와대 영빈관에서 세월호 유가족 200여명과 만나 “선체 수색이 많이 진행됐는데도 아직도 다섯 분이 소식이 없어서 정부도 애가 탄다”며 “아직 돌아오지 못한 미수습자들이 모두 가족 품으로 돌아올 수 있기를 간절히 기도하고 있다. 정부는 가족들의 여한이 없도록 마지막 한 분을 찾아낼 때까지 최선을 다하겠다”고 말했다.최훈길 (choigiga@edaily.co.kr)▶네이버 채널에서 ‘이데일리’를 구독해주세요▶개편 이벤트 '갤노트8 쏜다~'▶카톡 플친 맺으면 스타벅스 쿠폰~♥＜ⓒ종합 경제정보 미디어 이데일리 - 무단전재 & 재배포 금지＞"
49,2017-11-11,"文대통령 ""비온 뒤에 땅이 굳는다""…시진핑 ""한중, 광범위한 공동 이익 가져""",https://news.naver.com/main/read.nhn?mode=LSD&mid=shm&sid1=100&oid=018&aid=0003968077,이데일리,"- 11일 베트남 다낭서 APEC정상회의 참석 계기 2차 정상회담APEC 정상회의 참석 중인 문재인 대통령과 시진핑 중국 국가주석이 11일 오후(현지시간) 베트남 다낭 크라운플라자 호텔에서 열린 정상회담에서 반갑게 미소지으며 악수하고 있다. (사진=연합뉴스)[다낭(베트남)=이데일리 김성곤 기자] 문재인 대통령은 현지시간 11일 아시아태평양경제협력체(APEC) 정상회의 참석을 계기로 베트남 다낭에서 시진핑 중국 국가주석과 한중 정상회담을 가졌다. 지난 7월 독일 베를린에서의 만남 이후 4개월 만이다.문 대통령은 이날 오후 베트남 다낭 크라운플라자 호텔에서 열린 두 번째 정상회담에서 “19차 당대회를 성공적으로 치르고 시 주석께서 당 총서기에 연임한 것을 다시 축하드린다”며 “한중 외교당국간 협의를 통해 두 나라 사이에서 모든 분야의 교류와 협력을 정상적으로 회복시키기로 한 것을 기쁘게 생각한다”고 말했다.특히 “비온 뒤에 땅이 굳는다는 한국 속담이 있다”며 “한중 관계가 일시적으로 어려웠지만 한편으로는 서로의 소중함을 재확인하는 시간이었다. 한중관계에서도 진정한 실질적인 전략적 협력 동반자관계로 거듭나고 한중관계의 새 시대를 열어나갔으면 한다”고 희망했다.시 주석은 “7월 베를린에서 문 대통령과 첫 만남을 가졌다. 그 때 공통 관심사에 대한 의견을 교환했고, 적지 않은 중요한 합의를 했다”며 “얼마 전 문 대통령께서 19차 공산당 전국대표대회의 성공적인 개최와 저의 총서기 연임을 축하하는 축전을 보내주셨다. 이에 감사를 드린다”고 말했다.시 주석은 특히 “한중 양국은 각자 경제사회 발전, 양자관계의 발전적인 추진, 세계 평화의 발전에 있어서 광범위한 공동의 이익을 갖고 있다”며 “한중 관계와 한반도 정세는 관건적 시기에 있다”고 강조했다.김성곤 (skzero@edaily.co.kr)▶네이버 채널에서 ‘이데일리’를 구독해주세요▶개편 이벤트 '갤노트8 쏜다~'▶카톡 플친 맺으면 스타벅스 쿠폰~♥＜ⓒ종합 경제정보 미디어 이데일리 - 무단전재 & 재배포 금지＞"
50,2017-11-11,내일 아침 곳곳 영하권…찬바람에 체감온도 '뚝',https://news.naver.com/main/read.nhn?mode=LSD&mid=shm&sid1=103&oid=001&aid=0009677274,연합뉴스,"겨울 속 가을 담기(서울=연합뉴스) 신준희 기자 = 추운 초겨울 날씨가 찾아온 11일 서울 남산을 찾은 관광객이 두꺼운 겉옷을 입고 꽃 사진을 찍고 있다. 2017.11.11hama@yna.co.kr(서울=연합뉴스) 안홍석 기자 = 일요일인 12일 전국이 대체로 맑은 가운데 북쪽에서 찬 공기가 내려오면서 평년보다 낮은 기온을 보이겠다.아침 최저기온은 영하 6도에서 영상 7도, 낮 최고기온은 11도에서 15도의 분포를 보이겠다.바람도 강하게 불어 체감온도는 더 낮을 전망이어서 건강관리에 유의해야 한다고 기상청은 당부했다.새벽부터 아침 사이에는 일부 내륙지역을 중심으로 안개가 낄 것으로 보여 교통안전에 유의해야 한다.건조주의보가 발효된 강원 동해안과 제주 산지에서는 산불 등 화재 예방에 유의해야 한다.동해안은 높은 파도가 해안도로나 방파제를 넘을 수 있어 안전사고에 유의해야 한다.바다의 물결은 서해 먼바다에서 0.5∼1.5ｍ, 남해 먼바다 0.5∼2.5ｍ, 동해 먼바다에서 1.0∼3.5ｍ 높이로 일겠다.다음은 12일 지역별 날씨 전망. [오전, 오후] (최저∼최고기온) <오전, 오후 강수 확률>▲ 서울 : [맑음, 구름많음] (2∼13) <0, 20>▲ 인천 : [맑음, 구름많음] (3∼11) <0, 20>▲ 수원 : [맑음, 구름많음] (-1∼13) <0, 20>▲ 춘천 : [맑음, 구름많음] (-4∼11) <0, 20>▲ 강릉 : [맑음, 구름조금] (5∼15) <0, 10>▲ 청주 : [맑음, 구름조금] (1∼12) <0, 10>▲ 대전 : [맑음, 구름조금] (0∼13) <0, 10>▲ 세종 : [맑음, 구름조금] (-2∼12) <0, 10>▲ 전주 : [맑음, 구름조금] (2∼13) <0, 10>▲ 광주 : [맑음, 구름조금] (3∼15) <0, 10>▲ 대구 : [맑음, 맑음] (0∼14) <0, 0>▲ 부산 : [맑음, 맑음] (6∼16) <0, 0>▲ 울산 : [맑음, 맑음] (2∼15) <0, 0>▲ 창원 : [맑음, 맑음] (4∼15) <0, 0>▲ 제주 : [구름많음, 구름조금] (8∼15) <20, 10>ahs@yna.co.kr▶기사제보 및 문의(클릭!)▶최신 유행 트렌드 총집결(클릭!)"
51,2017-11-11,"文대통령-시진핑, 2번째 정상회담 돌입…관계복원·북핵 논의",https://news.naver.com/main/read.nhn?mode=LSD&mid=shm&sid1=100&oid=421&aid=0003041865,뉴스1,"문재인 대통령이 지난 7월6일 (현지시간) 독일 베를린 인터콘티넨탈 호텔에서 열린 한-중 정상회담에서 시진핑 중국 국가주석과 대화를 나누고 있다. (청와대 페이스북) 2017.7.6/뉴스1APEC 정상회의 일정 순연으로 37분 늦게 시작文대통령, 연내 방중 관련 논의 가능성(다낭=뉴스1) 김현 기자 = APEC(아시아태평양경제협의체) 정상회의에 참석 중인 문재인 대통령과 시진핑(習近平) 중국 국가주석간 정상회담이 11일 오후 5시37분(현지시간)에 시작됐다.문 대통령과 시 주석은 이날 오후 5시37분부터 중국측 숙소인 크라운플라자 호텔에서 정상회담에 돌입했다. 예정된 정상회담 시간은 30분이다. 당초 오후 5시부터 시작될 예정이었지만, 이날 폐막된 APEC 정상회의 일정이 지연되면서 정상회담도 순연됐다.지난 7월 G20(주요 20개국) 정상회의 참석 계기에 가졌던 정상회담 이후 넉 달여 만에 만나는 두 정상이 이번 정상회담을 통해 사드(THAAD·고고도미사일방어체계) 한반도 배치로 경색됐던 한중관계를 본격적으로 정상화하는 계기로 만들어낼지 주목된다.청와대는 ""양 정상은 이번 회담을 통해 전략적 동반자 관계를 더욱 굳건히 하고, 미래지향적 협력 방안을 논의할 계획""이라고 밝혔다.무엇보다 관심은 사드 배치로 얼어붙었다 지난 10월 중국 공산당대회를 기점으로 해빙무드에 접어든 한중관계가 이번 정상회담을 계기로 정상화의 본궤도에 오를 수 있을지 여부다.일단 양국은 껄끄러운 문제였던 사드 갈등 문제는 정상회담에 올리지 않는 쪽으로 가닥을 잡았다.앞서 한중 양국은 지난달 31일 그간 사드 문제로 얼어붙었던 관계를 정상화하기로 합의했고, 이 과정에서 우리 정부는 Δ사드 추가배치를 검토하지 않고 Δ미국이 구축 중인 미사일방어(MD)체계에 참여하지 않으며 Δ한미일 안보협력이 군사동맹으로 발전하지 않을 것이란 '3불 원칙'을 천명했다.일각에선 회담에서 양국간 다소간 해석차를 보였던 '3불 원칙'에 대한 논의가 있지 않겠느냐는 관측이 제기됐지만, 청와대측은 ""(사드나 3불 원칙) 문제는 양국 간의 합의에 의해 다 풀렸기 때문에 오늘 자리에서 그 문제가 논의될 이유가 없다""고 일축했다.이와 함께 이번 회담에서 북핵 문제와 관련한 논의도 이뤄질 것으로 보인다.현재 양 정상은 북핵 문제의 '평화적 해결'이라는 원칙에 공감하고 있지만, 북핵 도발에 대한 대응과 북한을 대화의 테이블로 끌어내는 방안 등 구체적인 접근법에 있어선 간극을 보이고 있다.문 대통령은 북한의 도발에 대해선 최고도의 제재와 압박이라는 단호한 대응으로 북한을 대화의 테이블로 이끌어낸다는 대북 기조를 토대로, 북한이 추가 도발을 하지 않고 핵동결을 하면 그것이 대화의 입구가 될 것이고, 그 대화의 출구는 '완전한 핵폐기'라는 단계적 접근법을 주장하고 있다.반면 시 주석은 '쌍궤병행'(雙軌竝行·비핵화 프로세스와 평화협정 동시진행)과 '쌍중단'(雙中斷·북핵·미사일 도발 중단과 한미연합훈련 중단)을 강조하고 있다.이에 대해 문 대통령은 ""북한의 핵동결과 한미간 군사훈련은 연계될 수 없다""는 점을 분명히 하고 있어 접점을 찾긴 힘든 상태다.다만, 문 대통령이 지난 9일 방송된 채널뉴스아시아와의 인터뷰에서 ""지금 북한의 핵과 미사일 도발이 갈수록 고도화되고 있는 이 시점에서 우리가 한미 연합훈련 중단을 말할 수는 없다고 생각한다""면서도 ""북한이 핵·미사일 도발을 중단하고 대화의 장으로 나온다면 1단계로 핵 동결을 위해서, 다음 단계로는 북핵의 완전한 폐기를 위해 한미를 비롯한 국제사회가 상응한 조치를 협의할 수 있을 것""이라고 상황에 따라 논의 가능성을 열어뒀다.이와 함께 회담에선 그간의 회담이 다자회의 계기에 열려 논의 시간이 충분하지 못했던 만큼 한중관계를 보다 미래지향적으로 발전시키기 위해 문 대통령의 연내 방중 문제가 논의될 것으로 보인다.만약 시 주석이 문 대통령의 연내 중국 방문을 제안한다면, 문 대통령은 지난 7월 정상회담에 이어 다시 한 번 시 주석이 내년 2월 평창동계올림픽에 참석해 줄 것을 요청할 가능성이 높아 보인다.gayunlove@news1.kr▶ '평창2018' 관련 뉴스·포토 보기▶ 여러분의 제보를 기다립니다.제보하기![© 뉴스1코리아(news1.kr), 무단 전재 및 재배포 금지]"
52,2017-11-11,"文대통령·시주석, 정상회담 시작…예정보다 37분 늦어져",https://news.naver.com/main/read.nhn?mode=LSD&mid=shm&sid1=100&oid=001&aid=0009677251,연합뉴스,▶기사제보 및 문의(클릭!)▶최신 유행 트렌드 총집결(클릭!)
53,2017-11-11,보은서 40대 여성 훼손 시신 발견… 용의자 숨져,https://news.naver.com/main/read.nhn?mode=LSD&mid=shm&sid1=102&oid=421&aid=0003041846,뉴스1,"© News1 방은영 디자이너(충북·세종=뉴스1) 송근섭 기자,박태성 기자,김용빈 기자 = 충북 보은군의 한 동굴에서 훼손된 40대 여성 시신이 발견돼 경찰이 수사에 나섰다.11일 오후 3시쯤 충북 보은군 내북면의 한 동굴에서 A씨(47·여)의 시신이 발견됐다.발견 당시 시신은 심각하게 훼손되고 일부 부패가 진행된 상태로 이달 2일쯤 사망한 것으로 추정되고 있다.경찰은 이 여성과 내연 관계에 있던 남성 B씨(65)가 금전 문제로 A씨를 살해한 뒤 유기한 것으로 보고 정확한 경위를 조사 중이다.경찰은 지난 5일 A씨가 운영하는 음식점 관계자의 실종 신고로 수사에 착수했다.충북 청주의 A씨 집 인근 CCTV에서는 지난 2일 둘이 함께 나간 뒤 B씨 혼자 돌아온 장면이 포착됐다.A씨 실종 신고를 접수한 청주상당경찰서는 지난 6일 B씨에 대한 참고인 조사를 진행했다.B씨는 참고인 조사에서 “A씨와 다투고 나서 어디로 갔는지는 잘 모른다”고 진술한 것으로 알려졌다.유력한 용의자로 추정되는 이 남성은 경찰에서 참고인 조사를 받고 귀가한 뒤 7일 약물을 먹고 자살을 시도, 지난 10일 병원에서 결국 숨졌다.경찰은 7일 조사를 받기로 한 B씨가 연락 두절되자 청주시 상당구 수동 집을 찾았다 음독한 A씨를 발견한 것으로 전해졌다.B씨가 남긴 것으로 추정되는 유서에 A씨도 언급됐으나 이번 사건에 대한 직접적인 내용은 없는 것으로 알려졌다.songks8585@news1.kr▶ '평창2018' 관련 뉴스·포토 보기▶ 여러분의 제보를 기다립니다.제보하기![© 뉴스1코리아(news1.kr), 무단 전재 및 재배포 금지]"
