,날짜,기사 제목,기사 링크,기사 출처,기사 내용
19,2011-05-26,"주검조차 없지만, 역사에 이름 남았으면…",https://news.naver.com/main/read.nhn?mode=LSD&mid=shm&sid1=102&oid=028&aid=0002095240,한겨레,"[한겨레]‘민주화운동중 실종’ 안치웅씨…23년만에 장례80년대 학생운동 ‘옥고’출소뒤 감시받다 사라져작년 ‘민주화 행불자’ 인정개입 공권력은 안 밝혀져어머니 “죽어서야 만날까…”“어떻게 이럴 수가 있어. 어떻게…. 아까운 내 아들 송두리째 없어졌네. 대한민국 땅에 사람들 다 있는데 왜 너만 없는겨…. 입을 사람도 없는데 이건 뭣이냐고.”지난 23일 서울 종로구 창신동 전국민족민주유가족협의회 사무실 방 한켠에 앉은 백옥심(71)씨는 손수 마련한 수의를 바라보며 굵은 눈물 줄기를 하염없이 쏟아냈다. 23년간 울고 또 울어 이젠 눈물이 말라버렸다던 백씨였다. 1988년 5월26일 아침 아들 안치웅(당시 25살)씨는 아는 목사를 만나러 간다며 서울 강동구 암사동 집을 나섰다. 아들의 마지막 모습이었다. 처음엔 지방에 내려가 위장취업이라도 했을까 싶어 실종 신고도 못 했다. 몇몇 친구들을 통해 백방으로 수소문했지만 아들의 행적을 알 길이 없었다. 혹시나 해서 용하다는 점집을 수없이 찾았다. 2년 뒤엔 속을 끓이던 안씨의 아버지가 피를 토하며 응급실로 실려갔다. 백씨는 이러다 남편마저 세상을 뜨는 게 아닌가 싶어 <한겨레>에 ‘사람을 찾는다’는 광고를 내기도 했다.전라도 광주에서 나고 자란 안씨는 1982년 서울대 입학 뒤 운동권 학생이 됐다. 1985년 구로공단 대우어패럴 파업 사건으로 구속돼 1년간 옥살이를 하기도 했다. 실종 당시 아들은 기관원들의 감시와 미행에 시달리고 있었다. 어머니에게도 낯선 이가 찾아와 아들에 대해 캐물었다. “집 나가고 며칠 안 돼 꿈을 꿍게 치웅이 머리 뒤꼭지에 이렇게 구멍이 나 있더라고. 그걸 보고 누가 죽였는갑다 했지요.” 그땐 아들이 서울대 학생운동 지도조직 ‘민주화추진위원회’ 핵심 구성원이었다는 사실을 알지 못했다.안씨가 실종된 지 23년 만인 오는 29일 어머니는 시신도 없이 아들 장례를 치른다. 지난해 7월 민주화운동관련자 명예회복 및 보상심의위원회(민주화보상심의위) 재심의에서 ‘안치웅을 민주화운동 관련 행방불명자로 인정한다’는 결정이 나왔기 때문이다. 이마저도 ‘민주화운동과 관련성 정도는 50%’라는 단서가 붙었다. 아들의 묘지는 민주열사 영혼들이 쉬고 있는 경기도 마석모란공원에 마련할 예정이다. 어머니는 아들의 시신을 거두진 못하지만 이름이라도 역사에 남겨주고 싶었다. “추모제 한번 지내보는 게 내 원이었어.” 어머니는 재심을 앞두고 민주화보상심의위에서 2주간 농성도 했다. “1심에서 기각이 돼갖고 애아부지하고 의견서 써가지고 갔어. 이거 안 해주믄 요 자리서 못 나간다고 주저앉아 부렀어.”23년 만에 장례를 치르지만 안씨 실종에 개입됐다는 공권력의 실체는 아직 밝혀지지 않았다. 1기·2기 의문사진상규명위원회(의문사위)는 이 사건에 대해 ‘진상규명 불능’ 결정을 내렸다. 의문사위를 잇는 진실과 화해를 위한 과거사정리위원회(진실화해위)에도 진정을 냈지만 유가족은 2009년 취하 결정을 내렸다. 국가정보원·경찰·기무사령부 등을 조사하지 않고 내놓는 결과를 인정할 수 없었기 때문이다.그래서일까, 어머니의 고통은 여전히 현재진행형이다. 매도 한번 안 들고 키운 유난히 순하고 착한 아들이었다. “보고 싶고 그런 고통은 말로 할 수 없어. 지금도 가슴이 답답하고 잠을 잘 못 자요. 신이 있다면, 죽어서는 야를 만나야 돼. 만나면 꽉 끌어안겄지, 뭐 할 말이 있겄어.”  박현정 기자saram@hani.co.kr공식 SNS[통하니][트위터][미투데이]| 구독신청[한겨레신문][한겨레21]Copyrights ⓒ 한겨레신문사, 무단전재 및 재배포 금지<한겨레는 한국온라인신문협회(www.kona.or.kr)의 디지털뉴스이용규칙에 따른 저작권을 행사합니다.>"
20,2011-05-26,서규용 내정자 `장관 명의 화환' 논란,https://news.naver.com/main/read.nhn?mode=LSD&mid=shm&sid1=100&oid=001&aid=0005081253,연합뉴스,"농촌진흥청이 25일 과천 마사회 본관에서 개최한 버섯강소농육성방안 심포지엄 행사장에 세워져 있는 화환. 명의가 `서규용 농림수산식품부 장관'으로 적혀 있다.민주 ""장관 행세"" vs 서 내정자 ""화환 보낸 적 없다""(서울=연합뉴스) 안 희 기자 = 서규용 농림수산식품부 장관 내정자가 25일 정부기관이 주최한 행사에 자신의 직함을 `장관'으로 적은 화환을 보냈다는 의혹이 제기돼 논란이 일고 있다.민주당 홍영표 원내대변인은 이날 국회에서 긴급브리핑을 열고 ""농촌진흥청이 과천 마사회 본관 대강당에서 개최한 심포지엄 행사장에 `농림수산식품부 장관 서규용'이라는 명의의 축하 화환이 세워져 있다""면서 관련 사진을 공개했다.홍 원내대변인은 ""이틀 전 인사청문회에서 도덕성과 업무수행 능력에서 낙제점을 받아 아직 청문보고서조차 채택되지 않은 서 내정자가 벌써부터 장관 행세를 하며 화환을 보낸 것""이라고 주장했다.이에 대해 서 내정자는 ""해당 심포지엄에 화환을 보낸 적이 없으며 지시한 적도 없다""고 부인하면서 ""화환이 전달된 경위에 대해서는 사실을 확인하고 있다""고 밝혔다.국회 농림수산식품위원회는 24일 전체회의를 열고 서 내정자에 대한 인사청문 경과보고서를 채택할 예정이었지만 여야간 이견으로 보고서 채택이 유보됐다.민주당은 쌀소득보전직불금 부당수령 의혹 등에 휩싸인 서 내정자의 자진 사퇴를 촉구하고 있는 반면 한나라당은 의혹의 상당수가 해소된 만큼 청문보고서를 채택하자는 입장이다.최인기 농림수산식품위원장(민주당)은 전체회의를 다시 열어 청문보고서 채택 여부를 정할지에 대해 ""여야 입장이 다른 만큼 농업 관련 단체 등의 의견을 수렴하며 고민하고 있다""고 말했다.prayerahn@yna.co.kr<뉴스의 새 시대, 연합뉴스 Live><모바일 애플리케이션><포토 매거진><저작권자(c)연합뉴스. 무단전재-재배포금지.>"
21,2011-05-26,“난 트위터·페이스북 등 SNS 모두 끊었다”,https://news.naver.com/main/read.nhn?mode=LSD&mid=shm&sid1=105&oid=028&aid=0002095190,한겨레,"[한겨레]`IT 악영향 경고’ 니컬러스 카‘생각하지 않는 사람들’ 저자디지털포럼 참석차 방한 인터뷰“인간, 단말기 유혹에 빠져 익사”“인간은 지속적으로 다양한 정보단말기를 통한 유혹에 빠져 익사하고 있다.”정보기술이 인간 사고에 되레 부정적 영향을 끼치고 있다는 주장을 펼쳐온 미국의 저명한 정보기술 전문가 니컬러스 카(52)를 <한겨레>가 25일 서울 쉐라톤 그랜드 워커힐 호텔에서 만났다. 카는 26일 <에스비에스>(SBS)가 주최하는 ‘서울디지털포럼’에서 기조연설을 하기 위해 방한했다.카는 “인터넷은 손쉽게 많은 정보를 얻을 수 있게 해주지만, 인터넷이 밀어내는 방대한 정보는 인간이 생각하는 방식을 매우 피상적이게 만들었다”며 “중요한 일과 사소한 것을 식별하기 어렵게 해 주의력을 분산시켰고 중요한 정보에 관심을 덜 갖도록 만들었다”고 말했다.정보사회의 특성을 날카롭게 분석한 베스트셀러 <빅 스위치>의 저자인 카는 지난해 <생각하지 않는 사람들>(원제 The Shallows)을 펴내 디지털 기술에 대한 인류의 맹목적 찬사에 경종을 울리며 정보기술이 사회와 인간 사고에 끼치는 해악에 대한 논쟁을 불러온 주인공이다. 이 책엔 멀티태스킹과 같은 정보기술이 한 업무에 집중할 때보다 효율성이 떨어지는 사례 등 정보기술이 실제로는 인지능력과 판단력을 퇴보시키는 다양한 연구사례가 담겨 있다.카는 정보기술 전문가답게 얼리어답터였지만 이 책을 쓰면서 몇가지 변화를 경험했다. 먼저 보스턴 인근에 살다가 이동전화가 되지 않는 콜로라도의 산악지대로 이주했다. 책을 쓰기 위한 자료를 찾기 위해 인터넷에 접속했지만, 전자우편 확인 등 종전에 비해 인터넷 사용을 크게 줄였다.특히 카는 “책을 쓰기 시작하면서 트위터·페이스북 등 사회관계망 서비스를 모두 끊었다”며 “앞으로도 사회관계망 서비스는 쓰지 않을 것”이라고 말했다. 카는 “비록 사회관계망 서비스가 정보를 빨리 전달해주고 사람들을 연결해주는 가치를 주지만 무엇보다 주의를 분산시킨다”며 “지나치게 사소한 정보가 끊임없이 오가는 사회관계망 서비스로 인한 혜택이 사고력에 끼치는 악영향보다 결코 크지 않다”고 말했다.어떻게 정보기술을 수용하는 게 현명한 것일까? 카는 “최선은 의심을 품는 것”이라며 “기술이 사회에서 점점 더 중요해지고 그 혜택이 커질수록 비판적이어야 한다”고 강조했다. 찬사를 받는 신기술로 인해 우리가 잃어버리는 것이 무엇인지, 어떤 비용을 치르고 있는지를 따져봐야 한다는 얘기다.구본권 기자starry9@hani.co.kr공식 SNS[통하니][트위터][미투데이]| 구독신청[한겨레신문][한겨레21]Copyrights ⓒ 한겨레신문사, 무단전재 및 재배포 금지<한겨레는 한국온라인신문협회(www.kona.or.kr)의 디지털뉴스이용규칙에 따른 저작권을 행사합니다.>"
22,2011-05-26,싸움터로 변한 인사동…'노점상 철거' 또 충돌,https://news.naver.com/main/read.nhn?mode=LSD&mid=shm&sid1=102&oid=055&aid=0000205810,SBS,"<8뉴스><앵커>인사동 거리 노점상 철거를 둘러싼 충돌이 오늘(25일) 또 벌어졌습니다. 2달째 20번을 넘었습니다. 이만하면 원칙보다 대안을 찾을 때도 된 것 같습니다.유덕기 기자입니다.<기자>구청 단속반과 용역업체 직원 120여명이 20여개 노점을 에워쌉니다.어떻게든 철거를 막아 보려는 상인들과 격렬한 몸싸움이 벌어집니다.손수레와 함께 팔던 물건들이 바닥으로 쏟아지고, 항의하던 한 70대 노점상인은 단속반에 밀려 넘어집니다.인사동에 차 없는 거리를 조성하기로 한 종로구청이 보행자들의 편의를 위한다는 명분으로 노점상 이전을 추진하면서 충돌이 반복되고 있는 겁니다.[임현빈/인사동 노점상인: 다 장사 안 되는 쪽으로, 사람들이 다니지 않는 쪽으로 자꾸 가라는데 거기 가면 다 죽는 거에요. 그게 불 보듯 뻔한데 거길 우리가 어떻게 들어가냐고요.]노점의 반발은 계속되고 있지만 종로구청은 6월15일까지 철거완료를 계획하고 있어 이 같은 충돌은 계속될 전망입니다.[김오현/종로구청 건설관리과 팀장: 인사동에 76개의 노점이 있었는데 그 노점을 전체 이전하기란 노점도 너무 강하게 반발하기 때문에 24개 정도를 특화거리로 이전할 계획을 가지고 있습니다.]싸움터로 변한 인사동을 지켜보는 시민들과 외국인 관광객들은 눈살을 찌푸립니다.구청과 노점상 측은 사나흘간 협의 기간을 갖기로 했지만, 입장 차를 좁힐 수 있을지는 미지수입니다.(영상취재: 설민환, 영상편집: 김성일)유덕기dkyu@sbs.co.kr관/련/정/보◆ 싸움터 된 인사동 거리…연일 살벌한 '몸싸움'◆ 청와대 ""노점상 관련 좋은 방안 찾아보라""◆ ""대통령도 풀빵 팔았다는데""…노점상의 탄원◆ 노점상인 1천명 강압적 노점 단속 규탄◆ 중랑구서 철거 항의하던 노점상 숨져☞[SBS기자들의 생생한 취재현장 뒷이야기 '취재파일']☞ SBS뉴스 공식 SNS [SBS8News 트위터] [페이스북] [미투데이] [요즘]저작권자 SBS&SBS콘텐츠허브 무단복제-재배포 금지"
23,2011-05-26,"김정일 ""6자회담 재개"" 강조...구체방안은 없어",https://news.naver.com/main/read.nhn?mode=LSD&mid=shm&sid1=104&oid=079&aid=0002254374,노컷뉴스,"[베이징=CBS 성기명 특파원]김정일 북한 국방위원장이 후진타오(胡錦濤) 중국 국가주석과의 정상회담에서 북핵 6자회담의 조기  재개를 주장했다.중국 관영 신화통신은 26일 김위원장과 후주석 간의 정상회담 내용을 전하는 보도를 통해  “(김위원장이) 한반도 정세의 완화를 희망하고 한반도 비핵화 목표를 견지해 갈 것이며, 6자회담의 조기재개를 주장한다”면서 ""우리는 남북관계 개선을 위해 줄곧 성의를  보여왔다""고 밝혔다고 전했다.김 위원장은 이어 ""북한은 현재 경제건설에 집중하고 있으며 매우 안정된 주변 환경을 필요로 하고 있다""면서 ""중국이 6자회담 재개와 한반도 평화와 안정을 위해 노력해온 점에 감사를 표시한다""고 언급했다.이에 후진타오 국가주석은 ""북한이 한반도 정세를 완화하고 외부와의  관계를 개선하기 위해 노력하고 있는 점을 높이 평가한다""며 ""관련국들이 한반도의 평화와 안정, 비핵화의 기치를 들고 냉정과 절제를 유지하며 서로 관계를 개선해야 한다고 주장한다""고 말했다.후 주석은 이를 위해 김 위원장에게 양국 고위층간 교류 강화와 당.국가간 관리 경험 교류,  상호 이익이 되는 협력 확대, 문화.교육.체육 교류 심화, 국제 및 지역 정세와 중대 문제에 있어서 소통.협조 강화 등 5가지 방안을 제시했다.김 위원장과 후주석은 이번 회담에서도 대를 있는 우의를 강조했다.후 주석은  ""중국은 시종 북중우의를 굳게 지키고 발전시켜나가는 것을  결코 변치않는 방침으로 삼고 있다""고 말했고 김 위원장은 ""북한과 중국은 우의 관계를 한 세대 한 세대 전해 가야 한다""면서 “(이것이) 우리의 역사적인 사명""이라고 화답했다.김 위원장은 또 ""중국 각지를 방문하면서 경제사회 발전이 이뤄지는 모습을 보고 놀랄 만한 변화들이 나를 감탄하게 한다""고 말했다.김 위원장은 후 주석에게 다시 한 번 북한을 방문해 줄 것을 요청했으며 후  주석은 이를 흔쾌히 수락했다고 통신은 전했다.통신은 김 위원장이 후진타오 중국 공산당 총서기 겸 국가주석의 초청으로 20일부터 26일까지 중국을 비공식 방문했다고 전했다.북한과 중국은 그동안 김 위원장이 북한으로 귀국한 직후 조선중앙통신과 중국 신화통신.CCTV 를 통해 방문사실과 회담 내용을 공개해왔지만 이번에는 김 위원장이 귀국하지 않은 상태에서 이례적으로 동시 공개했다.신화통신은 김위원장이 방중기간동안 후진타오(胡錦濤) 주석 및 원자바오(溫家寶) 총리와 회담을 가졌으며 자칭린(賈慶林)、리창춘(李長春、시진핑(習近平)、리커창(李克强)、허궈창((賀國强)、저우융캉(周永康) 등 공산당 정치국 상무위원들과 시설 참관 등을 같이 했다고 전했다.이로써 김 위원장은 이번 방중에서도  최고 지도부인 중국 공산당 정치국 상무위원 9명중 아시아.아프리카 4개국을 순방 중인 우방궈(吳邦國) 전국인민대표대회 상무위원장을 제외한 8명과 회담이나 접견을 가진 것으로 확인됐다.신화통신은 김위원장의 이번 방중에는 조선노동당 비서인 김기남.최태복, 강석주 내각부총리, 장성택 국방위  부위원장, 김영일. 박도춘ㆍ태종수ㆍ문경덕 비서 등이 수행했다고 전했다.이밖에 김 위원장의 4번째 부인으로 알려진 김옥으로 추정되는 인물이 몇차례 카메라에 포착된 바 있어 이번 방중에 동행한 것으로 보인다.후계자인 김정은 중앙군사위 부주석은 수행자 명단에 포함되지 않았다.kmsung@cbs.co.kr(대한민국 중심언론 CBS  뉴스FM98.1 / 음악FM93.9 / TV CH 412)<저작권자 ⓒ CBS 노컷뉴스(www.nocutnews.co.kr) 무단전재 및 재배포 금지 >"
24,2011-05-26,정유사 상습 담합 왜 못 끊나… 독과점에 ‘짬짜미로 수익창출’ 되풀이,https://news.naver.com/main/read.nhn?mode=LSD&mid=shm&sid1=101&oid=032&aid=0002137617,경향신문,"국내 정유사들이 26일 ‘주유소 나눠먹기’ 의혹으로 거액의 과징금을 부과받아 정유사들의 상습적인 담합 행태가 여론의 도마에 올랐다.정유업계가 정부의 잇단 단속에도 불구하고 고질적인 담합 유혹을 뿌리치지 못하는 것은 국내 기름시장의 독과점 구조와 무관치 않다. 품질 및 서비스 경쟁보다는 ‘그들만의 리그’를 통해 안정적인 수입을 보장받겠다는 발상이다.정유사들은 “담합 사실을 인정할 수 없다”며 반발하고 있다.◇ 끊이지 않는 상습 담합 = 공정거래위원회의 담합 조사가 있을 때면 정유사들은 거의 단골손님이다.1986년 12월 공정거래법 개정으로 부당한 공동행위(카르텔)에 대한 과징금 부과 규정이 도입된 뒤 최초로 과징금을 부과받은 것도 정유업계다. 2년 뒤인 88년 21억원의 과징금을 부과받았다. 최고액의 과징금을 물게 된 것도 정유업체다. 2009년에는 SK에너지, GS칼텍스, 에쓰오일, 현대오일뱅크 등 정유 4개사와 SK가스, E1 등 액화석유가스(LPG) 수입·판매사는 LPG 판매가격을 담합했다는 혐의로 6689억원을 부과받았다.이처럼 담합이 반복되는 것은 SK와 GS칼텍스, 에쓰오일, 현대오일뱅크 4개 정유사가 국내 정유시장을 지배하고 있기 때문이다.공정위 노상섭 시장감시총괄과장은 “정유 4개사의 시장점유율이 98%에 이른다”며 “수입사들의 역할이 미미해 정유사들이 담합의 유혹을 느낄 수밖에 없는 실정”이라고 말했다.정유업은 막대한 시설투자 때문에 신규 시장진입의 벽이 높다. 정유 4개사가 시장을 장악한 과점체제이다 보니 다른 업체나 외국기업의 정유시장 진입은 사실상 불가능하다. 또 전국적인 주유소망을 장악하고 있기 때문에 신규 업체가 막대한 돈을 들여 신규 유통망을 개설하는 것도 쉽지 않다.치열한 경쟁보다는 담합을 통해 수익을 보장받으려는 유혹에 빠질 수밖에 없다는 얘기다.석유제품은 각 정유사별로 품질에 큰 차이가 없다는 점도 잦은 담합의 이유로 꼽힌다.정유업계 관계자는 “휘발유든 경유든 석유제품은 전화기나 냉장고 등과 달리 제품 간에 차이가 별로 없다 보니 담합 유혹이 크지 않겠느냐”고 말했다.여기에 정유사들의 낮은 소비자 보호 의식과 도덕성도 담합이 자주 일어나는 원인이라는 지적이다.◇ 정유사 강력 반발 = 정유업체들은 공정위의 과징금 부과에 강력 반발했다.SK 측은 “담합한 사실이 없다”며 “공정위의 심사보고서를 검토한 뒤 대응절차를 결정하겠다”고 말했다. SK는 내부적으로 법적 대응 방침을 정한 것으로 알려졌다.현대오일뱅크도 “사회정의 실현 차원에서 모든 법적 수단을 강구하겠다”고 밝혔다. 현대오일뱅크 관계자는 “법정에서 시시비비를 가릴 것”이라며 “공정위가 특정 정유사 전 영업직원의 개인진술에만 의존해 과징금을 부과한 것은 납득하기 어렵다”고 밝혔다. 그는 “이번에 빌미가 된 특정 정유사 전 영업직원에 대해서도 민·형사상 책임을 물을 것”이라고 덧붙였다. 452억원의 과징금을 부과받은 에쓰오일도 “담합한 사실이 없다”고 밝혔다.GS칼텍스는 “공정위의 관련 자료를 검토한 뒤 입장을 밝히겠다”고 했다. 정유업계에서는 2009년 LPG 판매가격 담합 적발 당시 SK가 리니언시(자진신고자 감면제) 제도를 이용한 것에 대한 보복으로 GS칼텍스가 이번 공정위 조사에 협조했다는 얘기가 나오고 있다. 이 경우 GS칼텍스는 과징금을 전액 면제받을 수 있다.<도재기 기자 jaekee@kyunghyang.com>[관련기사]▶ 정유사 ‘주유소 묶어두기 ’10년 담합 기름값 바가지경향신문 ‘오늘의 핫뉴스’▶ 연봉 7천 받고 파업한다는데… 최중경 장관 유성기업 노조 공격 ‘갸웃’▶ 여직원 16억 횡령해 명품 구입…회사는 부도▶ “십자가로 소모되는 전기 줄여라”…이색 캠페인 시작▶ 아내 살해 대학교수, ‘카카오톡’ 메시지 삭제했지만…▶ 윤송이, 게임으로 번 돈 부동산에?▶ “5월 27일 아이폰5GS 발매” 美서 피싱 메일 기승공식 SNS 계정[경향 트위터][미투데이][페이스북][세상과 경향의 소통 Khross]- ⓒ 경향신문 & 경향닷컴(www.khan.co.kr), 무단전재 및 재배포 금지〈경향닷컴은 한국온라인신문협회(www.kona.or.kr)의 디지털뉴스이용규칙에 따른 저작권을 행사합니다.〉"
25,2011-05-26,10집 중 1집은 '기준 미달'‥최저 주거 기준 높인다,https://news.naver.com/main/read.nhn?mode=LSD&mid=shm&sid1=101&oid=214&aid=0000179342,MBC,"[뉴스데스크]◀ＡＮＣ▶정부가 주택건설의 기준으로 잡은 최저 주거공간이라는 게 있습니다.예를 들면 2인 가족일 경우 방 한 칸에 부엌, 화장실을 다 합쳐서 20제곱미터가 돼야 한다는 건데요.정부가 주거여건을 개선하기 위해 7년 만에 기준을 높이기로 했습니다.고현승 기자입니다.◀ＶＣＲ▶서울 중계동 백사마을,산자락을 따라 40년 넘은 낡은 집들이100가구 넘게 모여 있습니다.84살 박효순 할머니가 아들과 함께 사는집은 10㎡ 남짓, 방 한 칸에 작은 부엌하나입니다.건물 바깥에 있는 재래식 화장실은여섯 집이 함께 씁니다.정부가 정한 최저 주거 기준에한참 못 미치는데,벌써 15년째 이 집에 살고 있습니다.◀ＳＹＮ▶ 박효순/서울 중계동""뭐 하나 들여놓을 데도 없고 이렇네요.돈이 없으니까 이런 집을 얻어갖고..""서울에만 3천4백 개, 11만 명이 사는고시원도 모두 최저 주거기준에못 미칩니다.전국적으로는 10집 중 한 집 꼴로기준 미달인데, 정부는 7년 만에이 기준을 높이기로 했습니다.1인 가구는 12에서 14㎡로,2인 가구는 20에서 26㎡ 등으로 높이고,최저 주거 기주엔 부엌과 화장실 외에하수도 시설도 반드시 갖추도록했습니다.일본 등 선진국 기준에는 비하면여전히 비좁지만 이를 개선할 대책은딱히 없습니다.◀ＳＹＮ▶ 김수현 교수/세종대 부동산학과""공공임대주택을 최저주거 기준 이상구비되는 주택을 공급한다든가 아니면민간주택에 살더라도 임대를 보조해서조금 더 나은 주택으로 이사 갈 수있도록 지원해 준다든가...""또 높아진 기준에 따라 정부는임대주택을 더 크고 좋게 지어야하는데,건축비가 더 드는 만큼 임대주택공급량이 줄어들까 우려됩니다.MBC뉴스 고현승입니다.(고현승 기자 countach22@hanmail.net)[저작권자(c) MBC (www.imnews.com) 무단복제-재배포 금지]"
