,날짜,기사 제목,기사 링크,기사 출처,기사 내용
0,2011-05-26,"""내 그림이에요""…명함같은 단골 캐릭터 화제",https://news.naver.com/main/read.nhn?mode=LSD&mid=shm&sid1=103&oid=055&aid=0000205870,SBS,"<8뉴스><앵커>미술작품에 마치 캐릭터 같은 재미있는 이미지를 반복해서 등장시키는 작가들이 늘고 있습니다.한주한 기자가 소개합니다.<기자>화난 듯 애완견을 끌고 어딘가로 향하는 아줌마.이마에 핏발이 잔뜩 섰습니다.생리현상을 처리하는 우스꽝스런 작품에서도, 소주병에 올라탄 조각에도 핏대 세운 아줌마가 주인공입니다.재미있는 캐릭터의 작품에 알아보는 팬들도 부쩍 늘었습니다.[송진화/조각가: 내 얘기니까 하다보니까 이런 얼굴이 만들어지게 된거고. 어디 가는데 그 눈 퉁퉁부은 여자 너무 어땠어요. 자기 같았어요. 그런 말씀 해주시는 분들도 있고.]푸른 들과 바다로 짐을 잔뜩 싣고 여행을 떠나는 자동차.단골로 등장하는 캐릭터 덕에 전영근은 '자동차 작가'라는 별명을 얻었습니다.유선태의 그림에선 작가의 분신인 자전거가 빠짐없이 등장하고, 정은향의 그림에선 '악어 백'에서 영감을 얻은 '녹색 악어'가 현대인의 상징이 됩니다.[홍경한/미술평론가: 자기의 작품세계를 보다 확실하게 대중에게 각인시킬 수 있는 중요한 요소가 되기 때문이고요. 마케팅에 중요한 수단이고 효과적입니다.]반복해서 등장하는 캐릭터가 작품의 이해를 도우면서 작가와 관람객 사이의 간극을 좁힌다는 분석입니다.(영상취재: 공진구)한주한jhaan@sbs.co.kr관/련/정/보◆ [대구] 지역 미술계 숙원 '대구미술관' 개관◆ [취재파일] 나도 '예술 후원자' 돼 볼까?◆ 화가가 남긴 그림 속 '다빈치코드' 어떤 의미?◆ [영상토크] 사진 같은 그림 vs 그림 같은 사진☞[SBS기자들의 생생한 취재현장 뒷이야기 '취재파일']☞ SBS뉴스 공식 SNS [SBS8News 트위터] [페이스북] [미투데이] [요즘]저작권자 SBS&SBS콘텐츠허브 무단복제-재배포 금지"
1,2011-05-26,'월 500만원씩 20년' 연금식 복권 내달 1일 판매,https://news.naver.com/main/read.nhn?mode=LSD&mid=shm&sid1=101&oid=055&aid=0000205888,SBS,"<8뉴스><앵커>다음 달부터 다달이 500만원씩 20년간 지급받는 연금식 복권이 나옵니다. 한 번에 거액의 돈을 받은 당첨자들이 흔히 겪는 부작용을 피해보자는 겁니다.권애리 기자입니다.<기자>지난 해 상금 15억원의 로또 1등에 당첨됐던 50대 김 모 씨.아내와 잦은 불화로 이혼소송 중인 가운데 그제(24일) 동서와 말다툼을 하다 끝내 살해됐습니다.2년 전엔 남편의 로또당첨금을 가로채고 돌려주지 않은 아내가 징역 1년6개월을 선고받기도 했습니다.복권 당첨은 이렇게 인생역전이 아니라 패가망신할 수도 있는 양날의 칼입니다.[최승민/과천시 별양동: 요즘 복권의 문제가 그거지, 뭐. 너무 큰 돈이 나오니까. 그거 맞은 사람 잘 사는 사람 하나도 없잖아, 지금.]당첨금을 일시불이 아닌 매달 나눠 지급하는 연금식 복권이 다음 달 1일부터 판매됩니다.첫 추첨일은 7월6일, 이후 매주 수요일 추첨을 통해 1등 2명에겐 월 500만원씩 20년 동안 지급합니다.복권위원회는 연금식 지급의 취지를 살리기 위해 수령자가 복권을 제 3자에 양도하거나 담보로 사용하는 것은 금지하기로 했습니다.수령자가 사망할 경우 남은 당첨금은 지정된 상속인이 계속 받을 수 있도록 했습니다.현재 복권 시장의 98%를 독식하고 있는 것은 추첨식 로또.고령화 시대를 겨냥한 연금식 복권이 시장 판도를 얼마나 바꿀 수 있을 지 주목됩니다.(영상취재: 김현상, 영상편집: 김흥기)권애리ailee17@sbs.co.kr관/련/정/보◆ 로또 ""1등 당첨금 찾아가세요""◆ 로또 1등 9명…14억원씩◆ 성인 10명 중 1명 ""매주 로또 구입""◆ 로또 1등 4명…31억7천만원씩☞[SBS기자들의 생생한 취재현장 뒷이야기 '취재파일']☞ SBS뉴스 공식 SNS [SBS8News 트위터] [페이스북] [미투데이] [요즘]저작권자 SBS&SBS콘텐츠허브 무단복제-재배포 금지"
2,2011-05-26,"""참지 못해 후회된다"" 교수부인 살인사건 현장검증",https://news.naver.com/main/read.nhn?mode=LSD&mid=shm&sid1=102&oid=079&aid=0002254330,노컷뉴스,"피의자 강 씨 ""괴롭혀서 참지 못하고 살해"" …시민 ""지식인이라는 사람이 끔찍한 범죄""[부산CBS 박중석 기자]아내를 목졸라 살해하고 낙동강에 던져버린 '교수부인 살인사건'의 현장검증이 24일 실시됐다.  피의자인 남편 강 모(53)씨는 현장검증 내내 태연한 모습으로 범행 상황을 재연했다.이날 오후 1시 30분부터 시작된 현장검증은  강 씨가 아내를 살해한 해운대 모 호텔 인근 공영주차장과 시신을 유기한 을숙도 대교, 범행 물품을 구입한 북구 만덕동 등지에서 순차적으로 진행됐다.비가 내리는 가운데 노란색 우의를 입고  마스크와 모자를 눌러쓴 채 수갑과 포승줄에  묶인 강 씨는 담담한 모습으로 범행을 재연했다. 또 시종일관 무표정한 얼굴로 경찰의 질문에도 막힘없이 대답하는 모습이었다.강 씨는 아내가 자신을 괴롭혀 살해했다며  자신의 범행을 후회한다고 말했다.강 씨는 ""끝까지 참고 양보했어야 했는데 결국 참지 못했다""며 ""괴롭힘을 견디지 못해 범행을 저질렀으며 지금은 후회가 된다""고 말했다.한편 시민들은 굵은 빗줄기가 내리는 가운데서도  현장검증 장소에 모여 강 씨의 범행 재연을 지켜보며 지식인이 저지른 참혹한 범행에 비난의 목소리를 쏟아냈다.범행이 이뤄진 해당 공영주차장 관리인인 박 모(64)씨는 ""매일 같이 근무하는 곳에서 끔찍한 살인사건이 발생했다는 것이 놀랍고 겁이난다""며 ""지식인이라고 불리는 대학교수가 자신의 아내를 살해했다는 사실에 한탄밖에 나오지 않는다""고 말했다.길을 가다 현장검증 모습을 바라보던 주부 이미영(53)씨는 ""사회의 도덕을 이끌어 가야할 대학교수가 폐륜적인 범죄를 저질렀다""며 ""치밀한 계획을 세우고 부인을 살해했다고 하는데, 완전범죄는 없으며 응당 그 죄값을 치러야 한다""고 목소리를 높였다.강 씨의 내연녀로 범행에 가담한 최 모(50)여인은 지난 3일 해외로 출국한뒤 유럽을 거쳐 현재 호주에 머물고 있으며,  경찰에 곧 입국할 뜻을 밝힌것으로 전해졌다.현장검증을 마친 경찰은 강 씨에 대한 추가조사를 통해 정확한 범행 동기를 밝혀낸 뒤 오는 30일 사건을 검찰에 송치할 계획이다.jspark@cbs.co.kr[관련기사]●'완전범죄' 꿈꿨던 교수와 내연녀●실종 50대 대학교수 부인 50일만에 숨진채 발견●부산 을숙도서 가방안에 여성 숨진채 발견(대한민국 중심언론 CBS  뉴스FM98.1 / 음악FM93.9 / TV CH 412)<저작권자 ⓒ CBS 노컷뉴스(www.nocutnews.co.kr) 무단전재 및 재배포 금지 >"
3,2011-05-26,화장품 한류의 주인공 ‘비비크림’,https://news.naver.com/main/read.nhn?mode=LSD&mid=shm&sid1=103&oid=032&aid=0002137583,경향신문,"ㆍ‘Made in Korea’ 세계 여심 사로잡아ㆍ토종 브랜드 이어 해외 브랜드도 가세ㆍ수분크림 바른 뒤 사용하는 게 좋아비비크림 열풍이 뜨겁다. 솜털이 뽀송뽀송한 10대 소녀부터 할머니들까지 연령층도 다양하다. 한국을 찾은 중국·일본 관광객의 쇼핑 필수 리스트에 오른 지는 이미 오래다. 토종브랜드에 이어 콧대 높은 해외 화장품사들도 비비크림을 출시해 화장품의 한류시대를 열고 있다.‘블레미시 밤(Blemish Balm)’의 약자인 ‘BB크림’은 독일 피부과에서 시술 후 염증을 완화하고 붉은기를 가리기 위해 쓰던 기능성 화장품이 시초. 국내엔 2007년 무렵, 여배우들이 마치 ‘생얼’인 듯 보이기 위해 민낯에 바르던 ‘비밀 무기’가 비비크림이란 것이 밝혀지자마자 불티나게 팔리기 시작했다.비비크림은 메이크업베이스보다 탁월한 커버력, 파운데이션보다 산뜻한 발림성, 자외선 차단, 주름 개선에 이르기까지 다양한 기능성을 제공해 복잡한 화장 단계를 한 개의 제품으로 간편하게 해결해주는 팔방미인으로 통한다. 이러한 장점 때문에 아시아는 물론 한류 바람을 타고 전 세계 여심을 사로잡는 데 성공했다. 이제는 ‘Made in Korea 한국 비비크림’은 또다른 한류 열풍의 주인공으로 부상했다. 2010년 2월 랑콤을 시작으로 지난 4월까지 크리스찬디올, 크리니크, 에스티로더, 바비브라운 등 각종 유명 수입 브랜드의 비비크림이 한국판 ‘비비로드(BB road)’를 이어가며 자존심 대결을 펼치고 있다.‘피부 보호’ 본래의 기능에서 전 세계적으로 ‘생얼 메이크업’의 필수품으로 자리잡은 비비크림에 가장 기대하는 기능은 울긋불긋한 피부톤을 자연스럽게 보정해주는 것과 잡티 감추기다. 또한 미백, 자외선 차단, 주름 개선 등의 기능성이 더해지며 바쁜 일상에 메이크업 시간을 단축해주는 간편함이 가장 큰 장점으로 꼽힌다. 최근 가장 주목받는 비비크림은 뜻밖에도 중저가의 미샤 제품이다. 최단 기간 100만개 판매 돌파라는 신기록을 세운 미샤의 ‘M 시그너처 리얼 컴플릿 비비크림’은 관광객들이 대량 구매해 ‘한류 비비’라는 신조어까지 탄생시켰다. 최근에는 효과적인 주름 개선을 위한 링클필러와 결합한 ‘시그너처 링클필러 비비크림’을 출시했다.비비크림을 사용하기 전에는 피부타입과 무관하게 수분크림을 충분하게 발라 피부 베이스를 촉촉하고 탄력 있게 정리해두는 것이 좋다. 손가락으로 살짝 눌렀을 때 탄력이 느껴지는 정도로 기초 손질을 해야 베이스 제품을 덧발라도 자연스럽고 맑은 느낌을 유지할 수 있다.피부 스킨케어가 마무리된 뒤에는 자신의 피부 색과 맞는 제품을 골라 피부가 투영될 정도로 가볍게 발라주는 것이 좋다. 넓은 볼부터 이마에서 콧등, 턱까지 좁은 부위를 커버하고 손에 남아있는 비비크림을 미세한 부분에 가볍게 터치하듯 발라준다. 콧방울과 콧등은 입체감을 살리기 위해 최대한 얇게 바른다. 가볍게 잘 펴 바른 비비크림 위에 스펀지로 피부 표면을 두드려주면 스펀지가 비비크림의 촉촉한 느낌을 적당히 빨아들여 커버력을 높여주고 밀착감을 상승시키는 효과가 있다.<유인경 선임기자>경향신문 ‘오늘의 핫뉴스’▶ 연봉 7천 받고 파업한다는데… 최중경 장관 유성기업 노조 공격 ‘갸웃’▶ 여직원 16억 횡령해 명품 구입…회사는 부도▶ “십자가로 소모되는 전기 줄여라”…이색 캠페인 시작▶ 아내 살해 대학교수, ‘카카오톡’ 메시지 삭제했지만…▶ 윤송이, 게임으로 번 돈 부동산에?▶ “5월 27일 아이폰5GS 발매” 美서 피싱 메일 기승공식 SNS 계정[경향 트위터][미투데이][페이스북][세상과 경향의 소통 Khross]- ⓒ 경향신문 & 경향닷컴(www.khan.co.kr), 무단전재 및 재배포 금지〈경향닷컴은 한국온라인신문협회(www.kona.or.kr)의 디지털뉴스이용규칙에 따른 저작권을 행사합니다.〉"
4,2011-05-26,빅맥보다 더한 샐러드? 이렇게 먹으면 건강!,https://news.naver.com/main/read.nhn?mode=LSD&mid=shm&sid1=103&oid=112&aid=0002198152,헤럴드POP,"식음료계에 불고 있는 웰빙 열풍으로 샐러드가 각광을 받고 있다. 야채와 과일에 마요네즈를 버무려 먹던 ‘사라다’ 수준에서 탈피해 닭가슴살, 아보카도, 말린 과일과 견과류 등이 듬뿍 들어간 샐러드는 메인디시로도 손색이 없을 만큼 화려하게 발전했다.그러나 샐러드는 주 재료와 소스에 따라 건강음식이 되기도 하고 정크푸드의 대표주자 햄버거보다 더 해로운 음식으로 전락하기도 한다. 특히 바삭한 식감과 푸짐한 양을 위해 ‘살짝’ 뿌려주는 베이컨 조각과 또띠야칩은 샐러드의 열량을 단숨에 올려놓는다.미국의 유명 식음료 저널인 ‘네이션스 레스토랑 뉴스’에 따르면, 아웃백 스테이크하우스의 퀸즐랜드 샐러드는 1410칼로리(포화지방 30.5g)이고 칠리스의 퀘사디아 샐러드도 1400칼로리(포화지방 28g)에 육박한다. 총 열량이 540 칼로리인 맥도널드의 대표메뉴 빅맥(포화지방 10g) 햄버거보다 훨씬 열량이 높은 것이다.미국영양학협회의 토비 스미스슨 박사는 “샐러드를 선택할 때는 주 재료를 먼저 확인해야 한다“고 조언했다. 스미스슨 박사가 추천하는 ‘샐러드 건강하게 먹기’ 비법은 다음과 같다. 먼저 새싹 채소가 주 재료인 샐러드를 선택한다. 무, 유채, 메밀, 알팔파 등의 씨앗을 틔워 키운 새싹 채소는 비타민과 항산화제의 보고다.상추와 파프리카, 토마토 등으로 이루어진 야채 샐러드를 고를 때는 베이컨, 닭튀김, 스테이크 등 칼로리가 많이 나가는 재료는 빼는 것이 좋다. 샐러드 위에 뿌리는 베이컨과 또띠야칩은 물론 콩도 조심해야 한다. 콩을 동물성 기름에 볶거나 저며 내는 경우가 많기 때문이다.스미스슨 박사는 “칼로리 측면에서 보자면 통조림 콩보다는 일반 견과류가, 말린 과일보다는 생과일 먹는 것이 좋다”고 설명했다. 부드럽고 달콤한 소스에는 십중팔구 동물성 포화지방이 들어가 있기 때문에 식물성 기름과 식초로 만든 비네그레트 소스가 바람직하다.소스를 먹는 방법도 중요하다. 티스푼 하나 가득 담은 올리브유 소스가 45칼로리나 나갈 만큼 의외로 열량이 높다. 스미스슨 박사는 올리브유가 아무리 건강에 좋다 해도 한 병을 그대로 쏟아붓는다면 얘기는 달라진다”라면서 포크를 소스 그릇에 담갔다가 야채를 찍어 먹는 방법을 추천했다.당연히 칼로리를 생각한다면 소스 그릇을 들어 샐러드에 통째로 들이붓는 것은 삼가하는 것이 좋다. 물론 아보카도나 견과류에 포함된 지방은 건강에 이롭기 때문에 충분히 섭취하는 것이 좋다. 스미스슨 박사는 “샐러드의 총 열량보다는 포화지방 함류량을 더 유심히 봐야 한다”고 충고했다.유지현 기자/prodigy@heraldm.com▶ ‘나가수’ 스포일러는 스포로도 막는다▶ 해초와 접착제로 만든 ‘짝퉁 해삼’ 등장▶ [단독] 양현석, '한국판 구글' YG...성공 신화를 쓰다▶ 독립문-서대문 로터리 무성하던 가로수 어디로 갔을까?▶ 18K 도금에 고급 가죽...노키아, 럭셔리 스마트폰 내놨다▶ [오늘도 상한가]1천만원 계좌가 3억 된 사연은?▶ 차안에서 하루에 담배 3갑 피운 자동차 결국~- 헤럴드 생생뉴스 Copyrights ⓒ 헤럴드경제 & heraldbiz.com, 무단 전재 및 재배포 금지 -"
5,2011-05-26,'43년 출입금지' 한강 밤섬 직접 가보니…,https://news.naver.com/main/read.nhn?mode=LSD&mid=shm&sid1=102&oid=008&aid=0002544882,머니투데이,"[머니투데이 송충현 기자][조류·식물의 천국, 영화 '김씨표류기' 배경-구본무 LG회장 관찰 장소로 유명]↑밤섬의 모습서울시 서강대교 아래엔 도심에 어울리지 않는 거대한 섬이 하나 있다.주인공은 최근 화제가 됐던 영화 '김씨표류기'의 배경으로 나왔던 '밤섬'. 조류 애호가로 알려진 구본무 LG그룹 회장이 각별하게 애정을 갖고 있는 곳으로도 유명하다. 구 회장은 과거 여의도에 위치한 LG트윈타워 30층 집무실에 망원경을 설치해놓고, 밤섬의 철새를 관찰한 것으로 전해졌다.지난 1999년 생태경관보전지역으로 지정, 일반인의 출입이 금지된 밤섬이 26일 언론에 공개됐다.밤섬의 땅을 밟는 과정은 쉽지 않았다. 자연 경관을 그대로 보존하기 위해 별도로 배를 대는 접안 시설을 만들지 않아 대형 선박을 이용할 수 없기 때문이다.실제 이날 밤섬을 찾은 오세훈 서울시장과 김영걸 서울시 행정2부시장, 조은희 서울시 정무부시장, 출입기자단 등은 여의도 선착장에서 한강 홍보선인 '한강르네상스호'를 이용해 밤섬 근처로 간 뒤 소형 순찰선으로 갈아타야만 했다.오 시장은 소형 순찰선에 탑승하며 ""밤섬 생태계를 지키려면 접안시설이 없는 편이 낫다""고 말했다.밤섬에 도착하니 세계에서 손꼽히는 거대 도시인 서울의 한복판이라곤 믿기지 않을 정도로 고요했다. 불청객을 경계하는 철새의 울음만이 27만㎡ 규모의 '무인도'를 조용히 채웠다.비가 오락가락하는 등 날씨도 흐려 영화 '쥬라기공원'에서 그랜트 박사 일행이 공원에 처음 발을 디뎠을 때의 적막함을 떠올리게 했다. 류경기 한강사업본부장은 밤섬에 들어선 기자들에게 ""지나가다 물뱀을 볼 수도 있지만 독은 없으니 너무 걱정하지 않아도 된다""고 경고(?)하기도 했다.↑ 밤섬 내부. 갈대와 물쑥 등이 허리 높이로 자라 있다.밤섬은 식물과 조류의 천국이다. 사람의 손이 닿지 않아 섬 전체엔 갈대와 물쑥, 애기똥풀 등이 허리 높이까지 자라 있다. 민물가마우지와 청둥오리, 왜가리 등 짝짓기와 산란의 장소로 밤섬을 이용하는 새도 많다.포유류는 홍수 때 떠내려 온 것으로 추정되는 애꿎은 너구리 한 마리가 유일하다. 그나마 발자국만 발견됐다.밤섬은 영등포구 여의도동에 위치한 윗밤섬과 마포구 당인동의 아랫밤섬으로 나누어져 있다. 윗밤섬과 아랫밤섬은 한강 수위에 따라 붙고 떨어짐을 반복한다.↑철새의 낙원 답게 밤섬 곳곳에선 새알을 쉽게 찾아볼 수 있다.대규모 버드나무 군락지로 많은 조류가 발견되는 아랫밤섬엔 민물가마우지, 왜가리, 중대백로, 검은댕기해오라기 등이 서식하며 윗밤섬에선 해오라기, 청둥오리, 흰뺨검둥오리, 꿩 등을 찾아볼 수 있다.서울시 관계자는 ""개발 시대를 거치며 파괴됐던 밤섬이 동식물의 낙원으로 재탄생하고 있다""며 ""앞으로도 밤섬의 생태계를 잘 보존해 서울시의 자랑거리로 만들겠다""고 말했다.(증시파파라치)뉴스로 접할 수 없는 고급 증권정보 서비스- 급등이 임박한 종목 '오늘의 추천주'/대세는 중소형주다!- 오늘의 증권정보 '상승포착! 특징주!'/실전대회 수상자 추천주송충현기자 balgun@<저작권자 ⓒ '돈이 보이는 리얼타임 뉴스' 머니투데이, 무단전재 및 재배포 금지>"
6,2011-05-26,"트위터와 투표의 상관관계, 그래픽 자료 첫 공개",https://news.naver.com/main/read.nhn?mode=LSD&mid=shm&sid1=105&oid=028&aid=0002095365,한겨레,"[한겨레]이용자들 멘션 많이 남길수록, 손후보 득표율 증가야권 후보 승리에 ‘트위터가 결정적 구실’ 보여줘트위터와 투표의 상관관계를 직접적으로 보여주는 그래픽 자료가 처음 공개됐다.장덕진 서울대 사회학과 교수는 26일 지난 4·27 재보선에서 트위터 멘션(말·mention)·알티(퍼나르기·RT)와 득표율과의 관계를 분석한 그래픽 자료 원본을 <한겨레>에 공개했다. 이는 장 교수가 지난 19일 국회의원들의 연구단체인 ‘소셜미디어포럼’에서 발표한 ‘4·27 재보선을 통해 본 소셜 선거의 특징과 전략’의 일부인데, 그래픽 자료가 공개된 것은 이번이 처음이다. 이 자료들은 지난 4·27 재보선에서 야권 후보의 승리에 트위터가 결정적인 구실을 했다는 사실을 보여준다.먼저 ‘4월27일 시간대별 트윗 추이와 분당을 득표율 변화’(그래픽 1)를 보면, 손학규 민주당 후보의 시간대별 득표율은 트위터 이용자들이 멘션을 많이 남길수록 증가하고 멘션을 적게 남길 수록 득표율이 떨어지는 경향을 보였다.반면, 강재섭 후보의 시간대별 득표수 증감율은 트위터 멘션 수 변화와 별 상관관계가 없었다. (장 교수가 연구에서 밝힌 손학규-강재섭 후보의 시간대별 득표수는 4월27일 와이티엔(YTN)이 발표한 출구조사를 기초로 했다. 그러나 와이티엔의 조사결과에 오차가 커 선거관리위원회가 발표한 최종 결과를 활용해 보정작업을 거쳤다.)장 교수는 “손 후보가 득표율에서 앞섰을 때는 출근 전, 점심시간, 퇴근 후인데 이때는 지지자들이 투표를 하러 갔기 때문에 멘션 수가 준 반면, 손 후보의 득표율이 떨어지는 업무시간대에는 투표 관련 멘션이 많아졌다”고 밝혔다. 장 교수는 “특히 손 후보가 결정적으로 차이를 벌린 저녁 7~8시는 멘션 수가 득표율과 함께 급격하게 올라갔다”며 “투표하러 가면서 투표를 독려하는 멘션도 집중적으로 올린 것 같다”고 분석했다.다음은 트위터상에서 한나라당과 민주당의 영향력을 보여주는 ‘4·27 재보선 분당을/강원 리트윗 네트워크 맵’(그래픽2). 빨간 점은 각 후보의 멘션을 퍼나른 사람들을 가리킨다. 민주당 후보들이 한나라당 후보들보다 덩어리가 훨씬 크다. 민주당 후보들의 멘션이 한나라당 후보에 비해 압도적으로 많이 알티되었다는 뜻이다.또 하나 흥미로운 건 실선이다. 이 선은 퍼나르기 선인데, 손학규 후보와 최문순 후보 멘션의 알티가 서로 연결되어 있는 것을 볼 수 있다. 이는 손 후보의 멘션과 최 후보의 멘션이 동일 이용자들에 의해 함께 알티되었다는 것을 의미한다. 서로 다른 지역에서 선거를 치렀지만 두 후보의 지지자들은 같은 공간에서 선거를 치르는 유권자처럼 두 후보의 정보를 이슈화했다는 것이다. 반면, 한나라당 강재섭 후보와 엄기영 후보의 멘션은 서로 별 다른 영향을 미치지 못했다. 민주당을 지지하는 트위터 이용자들은 4·27 재보선을 지역 선거가 아닌 전국선거처럼 느꼈고 한나라당을 지지한 트위터 이용자들은 대체로 지역에 국한된 선거처럼 느꼈을 가능성이 높다.장 교수는  “민주당 팔로어들 중에는 한나라당 후보들까지 팔로잉하며 부정적 이슈가 터졌을 때 일파만파로 커지게 만드는 역할을 하는 경우도 있었다”며 “(강원도에서 불법 전화홍보 사건에 연루된) 엄 후보가 (분당을의) 손 후보 승리를 도왔다”고 설명했다.장 교수는  “(4·27 재보선에서) 득표율 기준 8~12%의 표가 트위터에 의해 좌우되었다”며 “기존 선거가 익명의 고립된 유권자를 통해 치러졌다면 이제 트위터를 통해 연결된 유권자들에 의해 선거가 치러지고 있다”고 말했다. 트위터가 여론 형성 공간을 넘어 실제 투표에까지 영향을 미치고 있다는 분석이다.4·27 재보선을 치른 선거구에서 모두 3~5%의 근소한 표 차로 승부가 갈렸다는 점에서 비추어봤을 때 장 교수의 연구결과는 더욱 의미가 크다. 장 교수는 소셜네트워크 분석과 관련해 학계의 권위자로서, 최근 ‘한국인 트위터 네트워크의 구조와 동학’(2011) 논문을 발표했다. 이번 연구는 장 교수와 네트워크분석 전문기업인 (주)사이람(대표이사 김기훈)이 전체 트위터 멘션에 대해 공동 분석한 결과다.허재현 기자catalunia@hani.co.kr공식 SNS[통하니][트위터][미투데이]| 구독신청[한겨레신문][한겨레21]Copyrights ⓒ 한겨레신문사, 무단전재 및 재배포 금지<한겨레는 한국온라인신문협회(www.kona.or.kr)의 디지털뉴스이용규칙에 따른 저작권을 행사합니다.>"
