,날짜,기사 제목,기사 링크,기사 출처,기사 내용
50,2011-05-26,['과징금 깎자' 정유사 행정소송 줄 이을 듯],https://news.naver.com/main/read.nhn?mode=LSD&mid=shm&sid1=101&oid=013&aid=0002032469,연합인포맥스,"(서울=연합인포맥스) 최환웅 정서연 기자 = '주유소 나눠먹기' 담합으로 4천348억원의 과징금을 부과받은 정유사들이 줄줄이 행정소송에 나설 태세다.SK와 현대오일뱅크, 그리고 S-Oil은 공정거래위원회의 심의결과에도 '담합 사실이 없다'는 기존 입장을 유지하고 있다.SK이노베이션과 SK㈜, SK에너지 등 SK계열사는 ""우리는 담합 사실이 없는 만큼,과징금 규모에 대해서 말할 필요도 없다""며 ""의결서가 나오고 행정소송 등의 대응  절차를 마련하겠다""고 밝혔다.S-Oil도 ""담합에 가담하지 않았다""며 ""행정소송과 이의신청 가운데 어떤 방향으로 갈 것이냐는 마지막에 선택할 것""이라고 언급했고, 현대오일뱅크도 ""담합한 적 없다""고 말했다.심의 과정에서 담합 사실을 인정한 GS칼텍스 역시 ""의결서를 검토한 다음 행정소송을 포함한 대응절차를 마련하겠다""고 밝혔다. 담합은 인정하지만 1천772억원이라는과징금을 받아들일 수는 없다는 뜻으로 풀이된다.이에 따라 과징금을 부과받은 정유 4사 모두 이의신청이나 행정소송을 제기할 것으로 예상된다.공정위 관계자는 ""과징금 액수가 큰 경우 대부분 이의 제기가 뒤따른다""며 ""해당업체들은 일단 부과받은 대로 과징금을 내야 하고, 법적 절차를 거치면서  과징금이줄어들면 그 차액을 환급받을 수 있다""고 말했다.공정위에 따르면 지난 2010년까지 제기된 870건의 소송 가운데 원고인 업체 측이승소한 경우가 12.1%인 105건, 일부 승소한 경우가 13.1%인 114건이다. 과징금 등  행정처분에 대한 소제기율도 2006년 4.1%에서 2010년 9.3%로 꾸준히 높아졌다.지난 2009년 LPG업체 담합 사건에서도 S-Oil과 현대오일뱅크는 행정소송을, GS칼텍스는 이의신청을 제기해 현재 심사가 진행 중이다. 자진신고자 감면제도에 따라 과징금 1천987억원의 50%를 감경받은 SK가스 역시 과징금을 더 줄이려고 이의신청을 제기했다.SK와 현대오일뱅크, S-Oil이 담합 사실을 부인하고 있지만 '정유사 나눠먹기' 식의 행태는 개선될 것으로 전망된다. 과징금과 함께 시정명령이 내려진 만큼, 담합행위를 중단하지 않으면 시정명령 불이행을 이유로 가중 처벌을 받기 때문이다.정유업계 관계자는 ""소송을 앞둔 업체들 입장에서 담합을 시인할 수는 없지만, 공정위 명령을 무시하고 과거 담합행위를 지속할 수는 없을 것""이라고 말했다.공정위의 한 관계자는 이에 대해 ""시정명령이 제대로 이행되는지 감시할 것""이라며 ""정유사들이 시정명령을 어길 경우 심각한 상황이 발생할 것""이라고 경고했다.      wwchoi@yna.co.kr    sychung@yna.co.kr(끝)<저작권자(C)연합인포맥스뉴스. 무단 전재-재배포 금지.>"
51,2011-05-26,`식품값 올릴때 내릴때 달라`..기름값 데자뷰?,https://news.naver.com/main/read.nhn?mode=LSD&mid=shm&sid1=101&oid=018&aid=0002443695,이데일리,"- 李대통령 ""제품가격 투명해야"" 쓴소리[이데일리 문영재 기자] 이명박 대통령이 정유업체에 이어 식품업체들에게 비판의 화살을 돌려 배경에 관심이 쏠리고 있다.이 대통령은 26일 ""국내 기업들이 제품가격을 올릴 때와 내릴 때 (가격) 반영 기간이 다르다""며 ""무엇보다 투명하게 해야 한다고 지적했다. 제87차 국민경제대책회의에서다.대통령의 이런 발언은 국제 곡물가격이 떨어지고 있는 상황에서 국내 식품업체들이 오히려 제품값을 올려 물가상승을 부채질하고 있다는 지적에 따른 것으로 풀이된다.전문가들은 정유업체를 상대로 한 `기름 값이 묘하다`라는 발언을 상기시키며 식품업체들에 대한 일종의 `경고메시지` 성격이 강하다고 평가했다.◇ 李대통령 ""독과점 위치의 식품업체, 공익적 생각해야""대통령은 이날 국제 곡물가격이 수개월의 시차를 두고 국내 물가에 반영된다는 보고를 받고 ""기업의 이윤 추구도 중요하지만 공익적 관점에서 생각해야 한다""고 강조했다.대통령은 특히 ""과점·독점적 위치에 있는 기업들이 공익적 생각들을 하면 우리사회가 훨씬 좋아지지 않겠나""라고 말했다고 김희정 청와대 대변인이 전했다.실제로 최근 밀과 옥수수, 대두, 원당 등 주요 국제 곡물가격은 지난 4월 초를 정점으로 일제히 하락반전했다. 유로존 재정위기 문제와 미 달러화 강세가 곡물가격 하락을 이끌었다.지난 4월초 설탕의 원재료인 국제 원당가격은 1파운드당 25.9센트에서 지난 23일 21.5센트를 기록, 17%나 떨어졌다. 밀가루원료 소맥가격은 부셀당 8.26달러에서 8.03달러로 2.8% 하락했고 콩기름 원료인 대두도 부셀당 13.95달러에서 13.73달러로 1.6% 떨어졌다. 전분의 원료 옥수수는 부셀당 7.67달러에서 7.54달러로 1.7% 내렸다. 또 원유와 금·은의 원자재값도 급락하고 있다.◇ ""안 오르는게 없다""..릴레이 가격인상 나선 식품업체이 처럼 국제 원자재 가격이 떨어지는데도 불구하고 식품업체들은 제품가격을 잇따라 인상하고 있다. CJ제일제당(097950)은 캔햄 제품 `스팸`의 소매가격을 평균 9.3% 인상했다.가장 많이 팔리는 스팸 클래(340g) 제품은 대형마트 기준으로 4600원에서 4980원으로 8.3% 올랐다. 대상(001680) 청정원도 최근 캔햄 2개제품 가격을 9.5% 올렸다.유제품 중에서는 빙그레(005180)가 지난달 말 주요 대형마트 공급가를 올린데 이어 최근 주요 편의점에서 가공우유 `바나나맛 우유(240㎖)`의 값을 1000원에서 1100원으로, `요플레(100㎖)` 가격을 750원에서 800원으로 인상했다. 사조산업(007160)도 다음 달 10일부터 참치캔 15개 품목의 소매가격을 10% 인상키로 했다.이달 초에는 과자와 제빵, 음료 등 2차 식품 가공업체들이 일제히 가격 인상에 동참했다. 농심(004370)을 비롯해 오리온(001800), 롯데제과(004990) 등 제과류업체들은 주요 제품의 가격을 평균 10% 내외로 올렸다.지난 3월과 4월에는 CJ제일제당과 삼양사(000070), 동아원(008040) 등 제분과 제당 업계가 국제 원자재가격 상승을 이유로 밀가루와 설탕 가격을 올린 바 있다. 업계 한 관계자는 ""식품업체들이 한 번 올린 가격은 좀처럼 떨어지지 않는다""며 ""이를 감안하면 이들 업체들의 이익규모도 커질 것""이라고 말했다.◇ `기름값 논란` 결국 4대정유사에 과징금 4348억대통령은 올 1월에도 국민경제대책회의에서 천정부지로 치솟던 기름값에 대해 `묘하다`는 표현을 써가며 적정 수준인지 검토할 것을 주문했다. 당시 대통령이 직접 기름값에 대해 언급하자 정유업계 안팎에서는 `가격인하` 압박으로 해석했다.대통령 발언 이후 지식경제부와 공정거래위원회 등 정부는 호들값을 떨며 기름값 잡기에 나섰다. 지경부는 석유가격 점검반을 구성하고 국제유가와 국내 유가간 비대칭성을 점검한다고 밝혔으며 공정위도 정유사-주유소 간 수직계열화된 유통구조를 개선키 위한 불공정관행 조사에 나섰다.공정위는 결국 26일 SK(003600)와 GS(078930)칼텍스, 현대오일뱅크, S-Oil(010950) 등 정유사들이 담함해 기름값 인하를 막아온 사실을 적발, 이들 정유4사에 총 4348억원의 과징금을 부과했다. 이는 지난 2009년 12월 공정위가 6개 액화천연가스(LPG) 회사의 판매가격담합 의혹에 대해 과징금 6689억원을 부과한 데 이어 역대 2번째 규모다.이에 대해 정유사들이 담합하지 않았다며 법적 대응 방침을 밝히고 있어 치열한 법정 공방이 예상된다.▶ 관련기사 ◀☞SK, 사회적기업 지원펀드에 5억원 출자☞소셜 커머스로 중고차 `반값`에 구매[TV]☞[특징주]SK 이틀째 하락..`오를만큼 올랐다`▶ 찌라시는 가라!..스마트브리프하루 두번 무료로 만나보세요.▶ 이데일리ON, 무료로 이용하는 실시간 현재가 조회 1666-2200▶ 이데일리 모바일ㆍ실시간 해외지수/SMS<3993+show/nate/ez-i>▶ 가장 빠른 글로벌 경제뉴스ㆍ금융정보 터미널,이데일리 MARKETPOINT＜ⓒ종합 경제정보 미디어 이데일리 - 무단전재&재배포 금지＞＜안방에서 만나는 가장 빠른 경제뉴스ㆍ돈이 되는 재테크정보 -이데일리TV＞문영재  (jtopia@)"
52,2011-05-26,`경산시 공무원 자살' 담당검사 징계.입건(종합),https://news.naver.com/main/read.nhn?mode=LSD&mid=shm&sid1=102&oid=001&aid=0005083002,연합뉴스,"대검 감찰본부 폭행혐의 인정…당사자는 부인(서울=연합뉴스) 나확진 기자 = 대검찰청 감찰본부(본부장 홍지욱)는 검찰수사를 받던 중 자살한 경산시 공무원 사건과 관련, 이 사건을 담당한 대구지검 최모(35) 검사를 폭행혐의로 입건해 수사에 착수했다고 26일 밝혔다.대검은 또 감찰위원회 심의를 거쳐 법무부 검사징계위원회에 징계를 청구할 방침이다.홍지욱 대검 감찰본부장은 이날 감찰결과 브리핑에서 ""두 달에 가까운 기간 고인의 당시 행적과 여러 정황을 조사한 결과 최 검사의 폭언과 폭행사실을 기록한 유서가 신빙성이 있다고 결론 내렸다""고 밝혔다.이에 따라 감찰본부는 김준규 검찰총장에게 최 검사에 대해 징계청구와 함께 수사 필요성이 있다고 건의했으며, 김 총장은 이를 수용해 김승식 감찰1과장을 주임검사로 지정해 수사에 착수했다.검찰은 고인이 남긴 유서 진본을 압수해 재검토하는 등 강제수사를 통해 최 검사의 혐의를 확인할 방침이다.한편 최 검사는 언론에 배포한 문서를 통해 ""고인에게 자백을 강요하거나 폭행·협박 등을 한 사실이 없다. 고인이 수사과정에서 치부가 드러나자 수사가 더 이상 진행되지 않게 하기 위해 그러한 내용의 유서를 남긴 것으로 보인다""며 혐의를 부인했다.또 ""고인이 조사받을 때 직접 써 온 진술서와 같은 내용을 조서에 적었으며, 객관적인 증거가 모두 확보된 상황이어서 진술의 허위성이 드러날수록 구속영장이 발부될 가능성이 높았기에 강압적으로 자백을 받을 이유는 전혀 없었다""고 덧붙였다.경북 경산시청 공무원 김모(54.5급)씨는 공직비리 문제로 검찰의 수사를 받아오다 지난 4월4일 목을 매 숨진 채 발견됐다.김씨가 남긴 유서에는 `수사과정에서 검사가 폭행, 협박 등을 해 허위진술을 했다'는 내용이 발견돼 대검 감찰본부에서 감찰을 벌였다.유서에는 수사관들한테서 술 냄새가 났다는 내용도 있었으나 감찰본부는 이에 대해 `연락 없이 조사에 불응하던 고인이 조사받기 전날 밤 10시에 갑자기 출석하겠다고 연락해와 예정에 없던 조사 일정이 잡혔기에 벌어진 일'이라며 특별히 문제 삼기 어렵다고 설명했다.rao@yna.co.kr<뉴스의 새 시대, 연합뉴스 Live><모바일 애플리케이션><포토 매거진><저작권자(c)연합뉴스. 무단전재-재배포금지.>"
53,2011-05-26,"이석채 ""요금인하 요구는 투자의욕 꺾어""",https://news.naver.com/main/read.nhn?mode=LSD&mid=shm&sid1=101&oid=001&aid=0005082972,연합뉴스,"KT그룹 합병 2주년 기자간담회        (서울=연합뉴스)  최재구 기자 = 26일 서울 광화문 올레스퀘어에서 열린 KT그룹 합병 2주년 기자간담회에서 이석채 회장이 인사말을 하고 있다.  2011.5.26    jjaeck9@yna.co.krKT-KTF 합병 2주년 간담회…""지금은 투자가 중요한 시점""(서울=연합뉴스) 최인영 기자 = 이석채 KT 회장은 26일 스마트 시대를 맞이해 통신사업자들의 적극적인 투자가 중요한 시점에 무조건 통신요금 인하를 요구하면 사업자의 투자 의욕이 꺾이게 된다고 밝혔다.이 회장은 이날 KT-KTF 합병 2주년 기자간담회에서 통신요금 인하 요구에 대한 의견을 묻는 기자의 질문에 ""기업이 물고기라면 국민은 물이다. 국민이 싫다고 하면 물고기인 우리는 어쩔 수 없이 꿈을 깎아내려야 한다""고 답했다.이 회장은 스마트 시대에 통신사업자들이 새로운 사업을 창출하고 국민에게 편익을 주려면 투자가 불가피하다는 점을 이해해야 한다면서 ""KT가 열심히 한다면 더 나은 일거리와 산업을 만들 수 있다""고 호소했다.그는 또 요금 인하 문제를 논의하기 전에 두 가지 전제에 대한 공감대를 먼저 형성해야 한다고 주장했다.하나는 네트워크 자원은 수돗물과 전기처럼 유한하다는 것이고, 다른 하나는 통신사의 역할이 투자를 해서 새로운 산업을 완성해야 한다는 것이다. 그는 ""이 두 가지 전제를 놓고 논의를 전개하면 조화점을 찾을 수 있다""고 말했다.이 회장은 특히 ""유한한 자원은 공급 관리도 중요하지만 수요 관리도 중요하다""며 ""한 사람이 수돗물을 마음 놓고 쓰면 남에게 피해가 돌아가게 된다""고 덧붙였다.이는 통신사업자들이 직면한 문제를 해결하려면 가입자들의 노력도 필요하다는 점을 강조하면서 최근 논란이 되고 있는 데이터 무제한 요금제에 대한 부정적 시각을 우회적으로 밝힌 것으로 해석된다.표현명 KT 개인고객부문 사장도 ""통신사들은 스마트 혁명 시대를 맞아 클라우드 컴퓨팅과 애플리케이션, 콘텐츠에 투자해야 한다""며 이 회장의 주장을 뒷받침했다.표 사장은 합리적인 요금을 내놓으려고 자체적으로 노력하고 있다면서 ""KT는 이미 데이터 요금을 내렸고 조절형 요금제를 출시했으며, 앞으로 청소년과 노인, 서민을 위한 요금제를 하나하나 소개할 예정""이라고 말했다.또 최근 방송통신위원회가 마련한 통신요금 인하 방안에 '기본료·가입비 인하'가 제외돼 실효성이 없다는 지적이 나온 것에 대해서도 표 사장은 ""기본료는 미래 투자를 고려해서 신중하게 접근해야 하며, KT의 가입비는 통신 3사 중 가장 저렴하다""고 강조했다.한편, 이날 KT는 합병 2주년을 계기로 31개 자회사·계열사와 함께하는 그룹경영을 본격적으로 시작해 IT융합 서비스를 선도하겠다고 밝혔다.이 회장은 그룹경영 방침에 대해 ""우리는 재벌이 아니기 때문에 무조건적인 몸집 불리기는 안 할 것""이라며 ""계열사가 클 수 있도록 훌륭한 인재를 영입하고 자율적으로 경영하게 돕는 등 재벌기업과 다른 경영 시스템을 구현하겠다""고 약속했다.서유열 KT 홈고객 부문 사장은 IPTV인 올레tv와 디지털위성방송인 KT스카이라이프를 결합한 'OTS'를 두고 케이블TV사업자가 반발하는 등 외부에서 파열음이 심하다는 지적이 나오자 ""OTS는 100만 가입자 돌파를 앞두며 국민의 인정을 받았다. 기존 사업자들은 불만을 느낄 수 있지만 융합의 물결을 거스를 수는 없다""고 반박했다.abbie@yna.co.kr[관련기사]▶ <연합시론> 통신요금인하 생색내기로 그쳐선 안돼▶ <방통위, 통신비 인하안 막판 손질 '진땀'>▶ <정부, 통신비 인하방안 발표 또 연기…왜?>▶ ""통신비 인하방안 오늘 발표 안해…추가 조정""<뉴스의 새 시대, 연합뉴스 Live><모바일 애플리케이션><포토 매거진><저작권자(c)연합뉴스. 무단전재-재배포금지.>"
54,2011-05-26,문법ㆍ'아륀지' 제외 영어능력시험 내용은,https://news.naver.com/main/read.nhn?mode=LSD&mid=shm&sid1=102&oid=001&aid=0005082206,연합뉴스,"지난해 열린 '국가영어능력평가시험'의 1차 예비시험에 참가한 수험생들이 긴장된 표정으로 시험을 준비하고 있다. (자료사진)읽기에서 문법문제 제외, 원어민 발음 중요치 않아고 3때 두번 응시가능…A,B,C,F 4등급 절대평가(서울=연합뉴스) 조채희 기자 = 교육과학기술부가 3년의 준비 끝에 26일 공개한 고교생용 국가영어능력평가시험의 평가틀과 예시문항은 학생이 각자의 전공과 직업 분야에서 필요한 의사소통을 할 수 있는 능력을 갖췄는지를 측정하는데 초점이 맞춰졌다.이는 대학입시를 위해 모든 학생이 문법과 독해 위주의 어려운 영어를 일제히 공부하던 부담을 줄이고 영어 교육을 실용영어 중심으로 전환하겠다는 정부의 의지가 반영된 결과다.◇2급ㆍ3급으로 구분..고3때 두번 응시 가능 = 고교생이 대학에 진학해 공부할 때 필요한 기초 학문 영어사용 능력을 평가하는 2급, 일상에서 실제로 쓰이는 실용 영어 능력을 평가하는 3급으로 구분된다.2급과 3급 구분은 수준 차이라기보다는 중점 평가 항목에 따라 구분한 것이라는 것이 교과부 설명이다.시험 수준은 현행 수능 영어보다 조금 더 쉽게 출제된다. 2급 시험은 어휘 수에서 현행 수능보다 1천단어 이상 적고, 2급 시험 읽기 영역의 예상 정답률은 수능보다 5∼10% 정도 높다.2급과 3급 모두 듣기ㆍ읽기ㆍ말하기ㆍ쓰기 4개 영역으로 시행되며 문항수는 듣기와 읽기가 각각 32문항이다.말하기는 2급, 3급 모두 4문항씩이며 쓰기의 경우 2급은 2문항, 3급은 4문항이 출제된다.시험시간은 듣기 35분, 읽기 50분, 말하기 15분, 쓰기 35분 등 4개영역 총 135분간이다.객관식은 수능처럼 5지 선다형이 아니라 4지 선다형으로 출제된다.고교생용인 2급ㆍ3급 시험은 고 3 때 또는 대입 희망자가 2차례 응시해 학생들이 좋은 성적을 고를 수 있게 한다. 2급이나 3급을 두번 칠 수도 있고, 2급과 3급을 1번씩 칠 수도 있다.평가는 절대평가로 A, B, C 등 패스(Pass)등급 3등급과 평가 불가인 F(Fail) 등 4등급으로 나눈다. 상대평가 방식으로 표준점수와 9등급을 나누는 수능의 외국어(영어)영역 평가와는 다르다.◇어떤 문제로 어떻게 평가하나 = 듣기와 읽기는 인터넷으로 보는 시험의 특성을 활용해 위치찾기, 도표 정보 찾기 등 클릭형 문항이 출제된다.특히 읽기에서는 문법 지식을 묻는 문항은 뺀다. 예를 들어 지문을 주고 to부정사, 동명사, 전치사 등에 밑줄을 친 뒤 ""어법상 틀린 것을 고르라""는 식의 문제는 수능에는 출제되고 있지만 국가영어능력평가시험에는 출제되지 않는다.문법 위주 출제와 수업이 입시 변별력을 높이는 도구가 되지만 학교현장에서 일찌감치 영어를 포기하는 학생을 낳는 원인이고, 영어점수는 높지만 의사소통 능력이 떨어지는 '벙어리 영어실력자'만 길렀다는 지적에 따라 ""문법은 가르치되 평가하지는 않는다""는 원칙을 지킨다.대신 인터넷쇼핑몰의 환불 안내문을 제시한 후 ""빈칸에 들어갈 말이 무엇이냐, 글 내용과 일치하지 않는 정보는 무엇이냐""(읽기 3급), 약 처방전을 제시한 후 ""맞는 복용법은 무엇이냐""(읽기 2급)고 묻는 형식의 문제를 낸다.수능과는 달리 국가영어능력평가시험 영역에 포함된 말하기, 쓰기 문항도 평가기준이 분명하다.현정부 초반 원어민을 만나 의사소통을 하려면 '오렌지'를 '아륀쥐'로 발음해야 한다는 주장이 나와 혼란이 컸지만 교과부는 원어민에 가까운 발음이나 특정국가의 발음은 중요하지 않고 의사소통력, 유창성(Fluency)이 중요하다고 분명히 했다.말하기에서 발음을 평가의 항목에서 최소화하고 이해 가능한 수준의 발음인지 정도만 평가한다는 것이다.2급에서는 대학에서 공부할 때 필요한 발표하기(프레젠테이션) 문항이 포함되고 3급에서는 일상생활에서 자주 접할 수 있는 소재의 문항이 들어간다.선로에 떨어진 사람을 용기있게 구출한 학생의 모습을 그림으로 보여준 후 1분간 준비시간을 주고 1분 동안 장면을 영어로 묘사해 말하도록 하는 예시 문항이 제시됐다.(말하기 2급)쓰기에서는 에세이 쓰기처럼 자유 작문 수준의 문항은 넣지 않고 교과서에 근거해 특정 정보를 주고 약간의 의견을 추가해 글을 쓰는 정도의 문항만 출제한다.예시 문항을 보면 ""그림을 보고 버스정류장에 있는 인물들의 행동을 묘사한 글을 20-30단어를 사용해 완성하라"", ""강원도 홍천에서 농민들을 돕고 아이들을 방과 후에 가르치는 봉사활동에 친구들이 함께할 것을 권유하는 이메일을 40-50단어를 사용해 쓰시오""(이상 쓰기 3급), ""자신이 여행했던 장소 중 가장 기억에 남는 곳에 대해 장소이름, 방문시간, 그곳을 택한 이유 등을 60-80단어를 사용해 써보라""(쓰기 2급)는 유형들이다.chaehee@yna.co.kr[관련기사]▶ 수능대체 유력 영어능력시험 4영역ㆍ4등급제▶ <수능ㆍ영어능력시험 준비에 사교육 '들썩'>▶ <변별력 부족ㆍ잇단 수능영어 개편에 대입혼란>▶ <의사소통능력 강조한 영어교육과정 개편안>▶ <수능과 뭐가 다르죠? 영어능력시험 문답풀이><뉴스의 새 시대, 연합뉴스 Live><모바일 애플리케이션><포토 매거진><저작권자(c)연합뉴스. 무단전재-재배포금지.>"
55,2011-05-26,"권도엽 ""다운계약서 유감이다"" 사과",https://news.naver.com/main/read.nhn?mode=LSD&mid=shm&sid1=100&oid=079&aid=0002254262,노컷뉴스,"""바람직한 것은 아니지만 위법은 아니었다"" 해명[CBS정치부 정영철 기자]권도엽 국토해양부 장관 후보자가 주택을 거래하면서 다운계약서를 작성해 세금을 적게 낸 것에 대해 사과했다.권 후보자는 26일 ""법무사가 대행해서 계약서를 작성했어도 결국에는 잘못된게 아니냐""는 한나라당 이학재 의원의 질의에 ""아주 바람직한것은 아니지만 나중에 보니까 위법한것은 아니었다""고 해명했다.이에 이 의원이 ""다운계약서 등을 막기 위해 실거래가 신고제를 도입했는데 잘못된 것에 대해 시간이 지났지만 사과하고 유감이라고 해야하지 않느냐""고 질책하자 ""유감스럽게 생각한다""고 말했다.권 후보자는 국토부(당시 건설교통부) 주택국장 시절인 지난 2005년 5월 경기도 분당구 소재 연립주택을 매입하면서 실거래가가 아닌 기준시가로 신고해 800만원의 취.등록세를 탈세했다는 의혹을 샀다.steel@cbs.co.kr(대한민국 중심언론 CBS  뉴스FM98.1 / 음악FM93.9 / TV CH 412)<저작권자 ⓒ CBS 노컷뉴스(www.nocutnews.co.kr) 무단전재 및 재배포 금지 >"
56,2011-05-26,"저축銀 비리 의혹, 은진수 감사원 감사위원 사의",https://news.naver.com/main/read.nhn?mode=LSD&mid=shm&sid1=101&oid=008&aid=0002544652,머니투데이,"[머니투데이 진상현 기자]부산저축은행 정관계 로비의혹과 관련이 됐다는 의혹을 받고 있는 은진수 감사원 감사위원의 감사원에 사의를 표면해서, 사직 절차가 진행되고 있는 것으로 확인됐다.정부 관계자는 26일 ""사의 표명을 해 감사원장이 재가했고, 행정안전부에서 절차를 밝고 있는 것으로 안다""며 ""행안부 절차가 끝나면 대통령이 최종 사직을 처리하게 될 것""이라고 말했다.은 위원은 부산저축은행그룹의 청탁을 받고 부당한 영향력을 행사했다는 의혹을 받고 있는 것으로 전해졌다.검사 출신인 은 위원은 한나라당 수석부대변인을 거쳐 2007년 대통령선거 당시 이명박 후보 캠프에서 법률지원단장을 지냈다. `BBK 사건'에서 이 대통령의 변호인으로 활동하기도 했다. 이후 대통령직인수위원회에서는 법무행정분과 자문위원을 맡았다.(증시파파라치)뉴스로 접할 수 없는 고급 증권정보 서비스[머니투데이 핫뉴스]☞부산 아내 살인사건 '카카오톡은 알고 있었다'☞음주운전 사고로 군용차 출신 '허머' 박살☞족쇄풀린 모바일게임 '앵그리버드 T스토어에'☞반월세 고민도 '월지급식'투자에서 해답 찾는다☞유네스코 등재 '5.18 여고생일기' 주인공 현재는?- 급등이 임박한 종목 '오늘의 추천주'/대세는 중소형주다!- 오늘의 증권정보 '상승포착! 특징주!'/실전대회 수상자 추천주진상현기자 jisa@<저작권자 ⓒ '돈이 보이는 리얼타임 뉴스' 머니투데이, 무단전재 및 재배포 금지>"
