,날짜,기사 제목,기사 링크,기사 출처,기사 내용
73,2011-05-26,"""한국인, 은퇴 후 경제 걱정 최고 수준""",https://news.naver.com/main/read.nhn?mode=LSD&mid=shm&sid1=101&oid=001&aid=0005082333,연합뉴스,"(서울=연합뉴스) 박상돈 기자 = 한국인의 은퇴 후 경제에 대한 걱정이 세계 주요국 중 최고 수준이라는 조사 결과가 나왔다.26일 하나HSBC생명에 따르면 작년 하반기 한국과 미국, 중국 등 세계 17개 주요국의 30~60세 경제활동인구 1만7천명을 대상으로 은퇴계획에 대한 설문조사를 한 결과 은퇴라는 단어에 대해 `경제적 어려움'을 가장 먼저 떠올린다는 응답이 한국(1천96명)의 경우 55%로 가장 많았다.뒤이어 아르헨티나(52%), 폴란드(45%), 프랑스(42%), 캐나다(39%), 영국(38%), 미국(35%), 대만(31%), 사우디아라비아(31%), 홍콩(30%), 싱가포르(26%), 말레이시아(25%), 인도(22%), 아랍에미리트(20%), 멕시코(18%), 중국(17%), 브라질(17%) 순이었다.반면 은퇴에 대해 `자유'라는 단어를 떠올린다는 응답은 34%로 세계 평균(48%)에 크게 미치지 못했다. 말레이시아, 중국, 싱가포르, 영국, 미국, 프랑스 등은 응답자의 50% 이상이 은퇴에 대해 자유와 행복을 연관 단어로 꼽아 대조적인 모습을 보였다. 말레이시아, 중국 등은 빠른 경제 성장과 가계 수입 증가의 영향 때문으로 분석된다.한국의 경우 은퇴 후 재정상태를 걱정한다는 응답이 79%에 달해 세계 평균(64%)보다 크게 높았고 그 이유는 저축 금액이 충분하지 않아서(47%), 건강유지 비용에 대한 걱정이 높아서(36%) 등이었다.퇴직을 위한 평소 저축 상태에 대해서는 `더 많이 필요하다'는 응답이 54%로 절반을 넘었다. 현재 수립한 재무계획 종류(중복 응답)는 생명보험(57%), 퇴직연금(50%), 단기저축(45%) 순으로 꼽았다.부모세대와 비교해 은퇴 후 가계경제 수준을 묻는 질문에는 부모보다 조금 더 잘 살 것(38%)이라는 응답이 가장 많았지만 비슷한 수준(27%), 조금 더 못살 것(16%)이라는 응답도 적지 않았다.은퇴 후 노부모 부양비를 걱정하는 응답은 13%로 세계평균(17%)보다 오히려 낮았다.하상기 하나HSBC생명 사장은 ""은퇴 후 재정적 문제를 해결하고 풍요로운 은퇴를 맞이하려면 전문가와의 상담을 통해 전문적이고 체계적인 준비를 미리 시작하는 것이 중요하다""고 말했다.kaka@yna.co.kr<뉴스의 새 시대, 연합뉴스 Live><모바일 애플리케이션><포토 매거진><저작권자(c)연합뉴스. 무단전재-재배포금지.>"
74,2011-05-26,"농협, 전산 장애 등으로 두 달치 한꺼번에 '청구'",https://news.naver.com/main/read.nhn?mode=LSD&mid=shm&sid1=101&oid=079&aid=0002254088,노컷뉴스,"고객 부담 '가중'박 모(38·전주시 덕진동)씨는 이달 농협 신용 카드 고지서를 받아 보고 ‘화들짝’ 놀랐다. 카드 대금 고지서에 4, 5월 두 달분이 한 번에 청구됐기 때문이다.더욱이 카드 고지서도 평소보다 이틀 정도 늦게 도착한데다 두 달분이 같이 기재돼 있다 보니 금액이 ‘배’로 느껴졌다. 농협에서는 10일간 연체 유예 조치를 취해준다고 했지만 한 번에 큰돈을 지불해야 하기 때문에 부담이 느껴지는 건 어쩔 수 없었다.지난달 전산장애로 불편을 겪었던 농협 신용카드 고객들이 이달에 두 달치 이용대금을 한꺼번에 납부하게 되면서 불만의 목소리가 높다. 특히 고객들의 부주의나 실수가 아닌 농협의 전산장애로 인해 발생된 사건의 피해가 고객들에게 전가되면서 비난이 쏟아지고 있다.25일 농협 신용카드 고객들에 따르면 5월 분 고지서에 4, 5월 분 카드 요금이 함께 청구됐다. 더욱이 고지서에 두 달분이 합산돼 기재됐기 때문에 고객들은 혼란에 빠질 수밖에 없었다.이와 관련해 농협측은 4월에 발생한 전산 장애로 인해 4월 분 이용대금명세서 작성이 불가, 부득이 이달에 합산 청구한 것이라는 설명이다. 사태가 발생하기 전인 지난달 21일까지는 이용대금명세서가 정상 발송됐고, 22일부터 청구 유예를 할 수밖에 없었다는 것.다만 두 달분을 한꺼번에 청구함에 따라 고객들의 부담을 덜어주기 위해 일시불로 결재한 금액을 할부로 나눠 내는 방안을 안내문에 고지했다. 또 결제일 이후 10일간 연체 유예 조치를 통해 고객들의 부담을 최소화시킨다는 방침이다.농협 전북본부 관계자는 “결제일자 연기에 따른 추가적인 수수료 부담은 없고 고객이 분할상환을 요구할 때는 일시불의 할부 전환을 실시할 계획이다”며 “청구서 지연 도달 안내 및 사과 SMS도 발송한 상태”라고 전했다.그러나 상당수의 고객들이 이같은 사실을 사전에 충분히 고지받지 못한 것으로 드러나 농협 측의 대응이 허술했다는 지적이다. 김 모(54·전주시 효자동)씨는 “내가 사용한 금액이니 지불해야 하긴 하지만 두 달치를 한꺼번에 청구해 부담이 크다”며 “농협 측의 전산 장애 등으로 인해 청구가 늦어진 건데 고작 10일 유예 기간으로 마무리 한다니 사용자 입장에서는 불만스럽다”고 말했다.전라일보 박세린 기자/노컷제휴사(대한민국 중심언론 CBS  뉴스FM98.1 / 음악FM93.9 / TV CH 412)<저작권자 ⓒ CBS 노컷뉴스(www.nocutnews.co.kr) 무단전재 및 재배포 금지 >"
75,2011-05-26,수능대체 유력 영어능력시험 4영역ㆍ4등급제,https://news.naver.com/main/read.nhn?mode=LSD&mid=shm&sid1=102&oid=001&aid=0005082205,연합뉴스,"지난 1월 열린 국가영어능력평가시험 모의평가에서 수험자들이 시험을 준비하고 있다. (자료사진)말하기.쓰기도 평가..내년 수시모집부터 일부 시범활용빠르면 2016학년도부터 수능영어 대체(서울=연합뉴스) 이준삼 기자 = 고등학생 대상 국가영어능력평가시험이 듣기ㆍ읽기ㆍ말하기ㆍ쓰기 4개 영역에 대한 4등급 절대평가로 운영된다.이 시험은 내년부터 일부대학 수시모집에 시범 활용되고, 빠르면 2016학년도 수능부터 외국어(영어) 영역을 대체한다.교육과학기술부는 26일 서울고에서 '국가영어능력평가시험 및 영어과 교육과정 개정방향'에 대한 공개토론회를 열고 고교생용 국가영어능력평가시험의 평가기준과 예시문항 등 시행방안을 공개했다.이번 안에 따르면 고교생용 국가영어능력평가(성인용은 1급)는 대학공부에 필요한 기초학술영어사용 능력을 평가하는 2급 시험과 일상생활에서 실질적으로 쓰이는 실용영어능력을 평가하는 3급 시험으로 구분된다.인터넷으로 보는 시험은 읽기ㆍ듣기ㆍ말하기ㆍ쓰기 등 4개 영역을 절대평가 방식으로 평가하며 A,B,C(Pass), F(Fail) 등 4단계로 등급이 매겨진다. 시험 난이도는 수능 영어보다 조금 더 쉬운 수준이다.말하기와 쓰기 영역은 수능과 달리 직접 영어로 말하거나 서술해 답해야 하며 고3 때 두 번 응시해 좋은 성적을 택할 수 있다.이 시험은 일부 대학 학과에서 2012년에 치르는 2013학년도 수시모집부터 시범적으로 활용된다.2009년부터 3년째 시범평가가 계속된 가운데 올해도 이달 26∼27일 전국 80개 고교 재학생 1만2천명을 대상으로 시범평가가 시행된다.교과부는 2012년 하반기에 국가영어능력평가시험의 공신력 등에 대한 의견을 수렴해 수능 대체 여부를 확정한다. 수능 대체가 결정되면 현재 중학교 2학년이 수능을 보는 2015년 실시 2016학년도 대입부터 적용될 가능성이 크다.<그래픽> 현행 수능과 국가영어능력평가시험 비교    (서울=연합뉴스) 박영석 기자 = 고등학생 대상 국가영어능력평가시험이 듣기ㆍ읽기ㆍ말하기ㆍ쓰기 4개 영역에 대한 4등급 절대평가로 운영된다.    이 시험은 내년부터 일부대학 수시모집에 시범 활용되고, 빠르면 2016학년도 수능부터 외국어(영어) 영역을 대체한다.    zeroground@yna.co.kr    @yonhap_graphics(트위터)국가영어능력평가시험 도입과 함께 초ㆍ중ㆍ고교 영어 교육과정도 의사소통 능력을 강조하는 쪽으로 개정돼 올해 8월 고시된다.이에 따라 초등학교 3∼4학년군, 5∼6학년군, 중학교 1∼3학년군 등으로 초ㆍ중학교에 학년군이 도입된다.고등학교에 기본-일반-심화과정이 도입되는 가운데 일반과정은 '영어과목군'과 '실용영어과목군'으로 구분되고 이는 각각 국가영어능력평가시험 2급, 3급과 연계된다. 수업을 못 따라가는 학생을 위한 '기초영어' 과목도 기본과정에 신설된다.새 영어 교육과정은 중ㆍ고등학교의 경우 2013학년도부터, 초등학교는 2014학년도 3∼4학년부터 적용받는다.성인이 산업현장에서 사용하기 위해 도입되는 국가영어능력평가시험 1급은 올해 추가 시범운영을 거쳐 내년부터 실시된다.jslee@yna.co.kr[관련기사]▶ <수능ㆍ영어능력시험 준비에 사교육 '들썩'>▶ <문법ㆍ'아륀지' 제외 영어능력시험 내용은>▶ <수능과 뭐가 다르죠? 영어능력시험 문답풀이><뉴스의 새 시대, 연합뉴스 Live><모바일 애플리케이션><포토 매거진><저작권자(c)연합뉴스. 무단전재-재배포금지.>"
76,2011-05-26,"""종합소득세 신고시 건강보험료 주의해야""",https://news.naver.com/main/read.nhn?mode=LSD&mid=shm&sid1=101&oid=001&aid=0005082058,연합뉴스,"영세사업자-금융고소득자 제도적 모순 해결해야(서울=연합뉴스) 안승섭 기자 = 매년 5월 종합소득세 신고 후 직장건강보험 피부양자 자격이 박탈되는 경우가 적지 않아 납세자들의 주의가 필요한 것으로 나타났다.26일 한국납세자연맹에 따르면 현행 건강보험 규정상 사업자등록을 한 후 사업소득이 단 1원이라도 있거나, 등록하지 않더라도 사업소득이 500만원을 넘으면 직장건강보험 피부양자 자격이 상실된다.사업소득은 사업자의 총 수입금액에서 필요경비를 뺀 금액을 말한다.납세자가 국세청에 이 같은 내역의 소득세 신고를 하면 국세청은 이를 건강보험관리공단에 통보한다. 공단은 곧바로 해당 납세자를 지역건강보험 가입자로 분류하게 된다.영세사업자인 K씨는 지난해 5월 처음으로 종합소득세 확정신고를 한 후 남편의 직장건강보험 피부양자 자격이 박탈돼 지역건강보험에 편입됐다. K씨는 이에 따라 매월 10만원 가량의 건강보험료를 내고 있다.납세자연맹 김선택 회장은 ""어려워진 살림에 조금이라도 보탬이 되려고 맞벌이에 나선 서민들이 지역가입자로 편입돼 높은 보험료를 내는 경우가 적지 않다""며 ""반면 금융 고소득자는 직장건강보험 피부양자 자격이 유지되는 제도적 모순이 있다""고 지적했다.금융 고소득자는 가족 구성원 각자의 배당, 이자소득 등을 합쳐 연간 4천만원을 넘지 않으면 직장건강보험 피부양자에서 제외되지 않는다.납세자연맹은 경기가 나빠 지난해 적자를 본 사업소득자는 간편장부나 복식부기장부를 이용해 소득금액을 마이너스로 신고해야 직장건강보험 피부양자 자격을 유지할 수 있다고 조언했다.또 운동선수, 작가, 연예보조출연자 등의 사업자 중 소득이 낮은 사람은 올해 소득이 500만원을 넘지 않음을 건강보험공단에 입증해야 피부양자 자격이 유지된다고 밝혔다.납세자연맹 서여정 팀장은 ""종합소득세 신고를 회피하면 높은 가산세가 부과되므로 반드시 신고해야 한다""며 ""하지만 제도적 모순을 해결하기 위해 영세사업자의 직장건강보험 피부양자 자격요건은 완화시키고 금융 고소득자는 엄격하게 적용할 필요가 있다""고 말했다.ssahn@yna.co.kr<뉴스의 새 시대, 연합뉴스 Live><모바일 애플리케이션><포토 매거진><저작권자(c)연합뉴스. 무단전재-재배포금지.>"
77,2011-05-26,"軍, 부천 옛 美기지 공동조사단 구성키로",https://news.naver.com/main/read.nhn?mode=LSD&mid=shm&sid1=100&oid=001&aid=0005082189,연합뉴스,"옛 '캠프 머서' 부지 조사    (부천 사진공동취재단=연합뉴스) '화학물질 매립' 의혹이 제기된 경기도 부천시 오정동 일대 옛 미군부대 '캠프 머서' 부지의 부대에 25일 군 관계자들이 방문, 부대 내를 둘러보고 있다. 캠프 머서는 1992년 철수하고 그 자리에는 현재 한국군 공병단이 들어서 있다. 부대에 농지와 학교가 인접해 있어 유독화학물질이 매립된 것으로 확인 될 경우 파문이 예상된다 2011.5.2국방부, 환경부, 육군, 부천시, 환경단체 참여(서울=연합뉴스) 김귀근 기자 = 국방부는 26일 '화학물질 매몰' 의혹이 제기된 부천시 오정동의 옛 미군부대 '캠프 머서'에 대해 민ㆍ관ㆍ군 공동조사단을 구성할 예정이라고 밝혔다.공동조사단에는 환경부와 육군, 부천시, 환경단체 전문가들이 참여한다.국방부는 ""공동조사단이 구성되면 화학물질 매몰 예상지역을 대상으로 조사할 예정""이라고 설명했다.국방부는 전날 오전 10시부터 2시간가량 진행한 현장답사를 통해 가로 20m×세로 20m 정도의 매몰예상지역을 확인했으며 당시 부대 배치도 등을 미측에 요청하기로 의견을 모았다.미 공병단 44공병대대 547중대원으로 캠프 머서에서 근무했다는 레이 바우스 씨는 지난 2004년 5월 미국인이 운영하는 `한국전 프로젝트' 홈페이지에 올린 글을 통해 ""근무 당시 불도저를 통해 구덩이를 파서 고무 옷과 가스 마스크를 착용하고 모든 상상 가능한 화학물질 등 수백 갤런을 버렸다""고 밝혔다.threek@yna.co.kr[관련기사]▶ <'오염 범벅' 반환美기지 정화작업..미흡, 부진>▶ <美기지 환경오염치유 비용 누가 부담하나>▶ 부천시, 화학물질 매립 확인작업 참여 추진(종합)▶ 軍ㆍ환경부, 부천 옛 美기지 현장 답사(종합)▶ <軍 과거 고엽제 어떻게 처리했나><뉴스의 새 시대, 연합뉴스 Live><모바일 애플리케이션><포토 매거진><저작권자(c)연합뉴스. 무단전재-재배포금지.>"
78,2011-05-26,"울산지법 ""자택서 숨진 소방관이라도 유공자""",https://news.naver.com/main/read.nhn?mode=LSD&mid=shm&sid1=102&oid=001&aid=0005082175,연합뉴스,"공무.질병 인과관계 받아들여 순직으로 인정(울산=연합뉴스) 장영은 기자 = 자택에서 쓰러져 숨진 소방공무원이라도 비위생적인 화재현장에 자주 출동하거나 과로나 스트레스 등으로 인해 뇌염 바이러스에 걸려 숨졌을 것으로 보고 법원이 공무와 질병의 인과관계를 받아들여 국가유공자 인정 판결을 내렸다.울산지법 행정부(재판장 홍성주 수석부장판사)는 26일 소방공무원 김모씨의 가족이 울산보훈지청을 상대로 제기한 국가유공자 유족 요건 비해당결정 처분 취소소송에서 원고 승소 판결을 내렸다고 밝혔다.재판부는 판결문에서 ""평소 정상적인 근무가 가능한 기초질병이나 기존질병이 과중한 공무 등이 원인이 돼 자연적인 진행속도 이상으로 급격하게 악화된 때에도 공무와 질병에 인과관계가 있다고 봐야 한다""고 밝혔다.재판부는 ""망인이 업무상 과로로 인한 신체의 저항력과 면역기능이 악화된 상태에서 비위생적인 화재 현장에 잦은 출동을 하면서 뇌염 원인이 된 바이러스에 감염됐거나, 이미 감염돼 체내에 잠복하고 있던 단순포진 또는 대상포진 바이러스 등이 과로 또는 스트레스 등에 의해 면역기능이 저하된 상태에서 뇌염이 발병된 것으로 보인다""며 ""따라서 공무와 질병 사이에 상당한 인과관계가 인정되므로 국가유공자법상 순직공무원에 해당된다""고 판시했다.1996년 임용된 김씨는 2007년 10월 자택에서 갑자기 쓰러져 치료받다 같은 달 바이러스성 뇌염으로 숨지자 김씨 가족이 공무원연금관리공단을 상대로 유족보상금 지급청구소송을 내 항소심까지 가서 공무상 사망을 인정받고 보상금을 받을 수 있게 됐다.김씨 가족은 이어 공무상 질병으로 인한 사망이기 때문에 국가유공자 유족 요건 확인신청을 했으나 울산보훈지청은 ""공무원연금법과 달리 국가유공자법은 엄격한 인정요건을 따지는 만큼 공무와 질병에 인과관계가 없어 순직공무원에 해당하지 않는다""며 유족 요건 확인신청을 받아들이지 않았다.young@yna.co.kr<뉴스의 새 시대, 연합뉴스 Live><모바일 애플리케이션><포토 매거진><저작권자(c)연합뉴스. 무단전재-재배포금지.>"
79,2011-05-26,"""금감원 고위간부 삼화저축銀서 1천만원 수수""",https://news.naver.com/main/read.nhn?mode=LSD&mid=shm&sid1=101&oid=001&aid=0005082202,연합뉴스,"檢 신삼길 명예회장 진술 확보…소환 검토(서울=연합뉴스) 임주영 전성훈 기자 = 삼화저축은행 불법대출 사건을 수사하는 서울중앙지검 금융조세조사1부(이석환 부장검사)는 금융감독원 고위 간부 김모씨가 신삼길(구속기소) 명예회장한테서 금품을 받은 의혹을 수사 중이다.26일 검찰과 금융권 등에 따르면 중앙지검은 신 회장을 조사하는 과정에서 2005년께 삼화저축은행 검사(檢査)를 담당하던 김씨에게 검사 무마 등의 청탁과 함께 1천여만원 상당의 금품을 건넸다는 진술을 확보, 사실 관계를 확인 중인 것으로 전해졌다.검찰은 아울러 김씨가 골프 및 향응 접대를 받았다는 의혹도 조사 중이다.검찰은 구체적인 물증을 확보하는 대로 김씨를 소환 조사하는 방안을 검토하고 있다.신 회장은 수백억원대의 불법·부실 대출 혐의로 지난달 18일 구속 기소됐다.한편, 검찰은 삼화저축은행 불법대출 사건으로 수사를 받다가 잠적한 이 은행 대주주 이모씨의 소재 파악에 주력하고 있다.이씨는 신 회장과 공모해 불법·부실 대출을 해준 혐의를 받고 있으며 정관계 로비 의혹의 실마리를 쥔 핵심 인물로 알려졌다.그는 보해저축은행에서 불법대출 받은 돈과 자신이 실소유주로 있는 코스닥업체에서 빼돌린 회삿돈을 밑천으로 삼화저축은행 인수를 시도한 의혹도 받고 있다.zoo@yna.co.krcielo78@yna.co.kr<뉴스의 새 시대, 연합뉴스 Live><모바일 애플리케이션><포토 매거진><저작권자(c)연합뉴스. 무단전재-재배포금지.>"
80,2011-05-26,직업운전자 음주운전 3번 적발되면 취업제한,https://news.naver.com/main/read.nhn?mode=LSD&mid=shm&sid1=101&oid=008&aid=0002544410,머니투데이,"[머니투데이 김지산 기자][국토부, 교통사고 사망자 줄이기 계획 마련]버스운전사 등 직업운전자가 3회 이상 상습음주 운전을 하다 적발되면 취업이 제한되는 등 규제가 강화된다.국토해양부는 26일 교통사고 사망자를 전년대비 700명 감축하는 내용의 '2011년도 국가교통안전시행계획'을 국가교통안전실무위원회 심의를 거쳐 확정했다고 밝혔다.정부는 도로교통 사망자 수를 지난해 5505명에서 올해 4800명으로 감소시킨다는 목표다. 이를 위해 지금껏 차량소통 중심의 교통안전대책에서 벗어나 보행자 안전과 편의를 최우선하는 패러다임을 제시했다.우선 보행우선구역 지정·개선 사업 등을 지속적으로 추진하고 이면도로 불법 주정차 단속을 강화하는 한편 생활도로의 일방통행을 확대하기로 했다.또 어린이 통학버스 사고가 빈번하게 발생하는 점을 착안해 통학버스 차량에 어린이 승하차를 확인할 수 있는 광각 후사경 장착을 의무화하기로 했다.교통사고를 유발하는 운전자의 운전 행태 개선을 위한 규제는 강화된다. 3회 이상 상습음주 직업운전자에 대한 취업을 제한하고 시속 60km를 초과하는 과속운전 범칙금을 신설해 과속 운전자 처벌 수위를 높인다. 또 버스운수종사자 자격제를 도입해 운전미숙의 의한 대형 사고를 방지하기로 했다.국민들의 교통안전 의식을 높이기 위해 교통안전 관련 시범도시를 선정, 지원한다. 반대로 교통안전이 취약한 시군에는 원인조사 및 개선을 실시하는 등 지역별 맞춤형 대책을 마련키로 했다.잦은 KTX 차량 고장을 최소화하기 위해 KTX 주요 부품의 교체 주기를 단축하기로 했다. 또 기관사 승무적합성 검사를 내실화 하고 검사장비를 운영해 인적요인에 의한 사고율을 낮추기로 했다.항공분야에선 승무원 피로관리 기준을 높이고 레이더 등 항행안전시설을 현대화 하는 한편 항공안전 인프라인 제2항공교통센터를 구축한다.외국적 선박에 대한 항만국 통제(PSC)를 강화하고 선박모니터링시스템(VMS)과 선박장거리위치추적시스템을 설치한다.국토부 관계자는 ""관계기관 합동으로 시행계획을 차질 없이 추진해 국정과제인 교통사고 사상자 절반 줄이기 목표를 달성할 것""이라고 말했다.(증시파파라치)뉴스로 접할 수 없는 고급 증권정보 서비스[머니투데이 핫뉴스]☞부산 아내 살인사건 '카카오톡은 알고 있었다'☞음주운전 사고로 군용차 출신 '허머' 박살☞반월세 고민도 '월지급식'투자에서 해답 찾는다☞유네스코 등재 '5.18 여고생일기' 주인공 현재는?☞심태윤-송은이 결혼을 약속한 사이, '1년 남았어요~'- 급등이 임박한 종목 '오늘의 추천주'/대세는 중소형주다!- 오늘의 증권정보 '상승포착! 특징주!'/실전대회 수상자 추천주김지산기자 san@<저작권자 ⓒ '돈이 보이는 리얼타임 뉴스' 머니투데이, 무단전재 및 재배포 금지>"
