,날짜,기사 제목,기사 링크,기사 출처,기사 내용
0,2011-10-13,부탄의 신데렐라…국왕과 평민 신부 결혼 화제,https://news.naver.com/main/read.nhn?mode=LSD&mid=shm&sid1=104&oid=055&aid=0000214555,SBS,"<8뉴스><앵커>히말라야 산맥의 작은나라 부탄에서 오늘(13일) 국왕과 평범한 여성의 결혼식이 열렸습니다. 소박하지만 행복한 결혼식 보시면서 무엇이 행복일까 한 번 생각해 보시죠.김아영 기자입니다.<기자>왕실의 상징인 노란 띠를 두른 국왕이 미소를 지으며 걸어갑니다.승려들의 뒤를 따라 붉은 소매가 달린 황금색 예복을 입고 나온 신부는 조심조심 발걸음을 옮깁니다.히말라야 동부에 위치한 작은 불교 왕국, 부탄의 옛 수도 푸나카에서 치러진 5대 국왕 왕추크의 결혼식입니다.[푼초 도지/결혼식 참가자 : 정말 기쁩니다. 온 나라가 기쁜 일입니다. 부탄 모든 국민이 결혼식을 축하할 것입니다.]불멸을 상장하는 성배에 담긴 신의 음료를 신부 페마와 함께 마신 국왕은 비단으로 짠 왕관을 씌워줍니다.신부는 왕관이 떨어지진 않을까 머리에서 손을 떼지 못하고 모든 게 낯선 듯 긴장한 모습입니다.준수한 외모에 입헌 군주제등 개혁 정치를 추진해 인기를 누리고 있는 31살의 국왕은 배필로 11살 어린 평민의 딸을 선택했습니다.[트셰링 유덴/부탄 국민 : 국왕은 이제 페마 왕비와 새로운 인생을 시작하실텐데, 그것은 부탄에도 아주 좋은 일이라고 생각해요.]결혼식은 검소한 국왕의 뜻대로 외빈도 없이 소박하게 치러졌습니다.4명의 왕비를 둔 아버지와는 달리 왕추크 국왕은 페마 왕비와만 백년해로하겠다고 약속했습니다.10여 년 전에서야 텔레비전 방송을 허락했을 정도로 폐쇄적인 국가이던 부탄은 오늘 텔레비전을 통해 결혼식을 생중계 했습니다.(영상편집 : 조무환)김아영nina@sbs.co.kr관/련/정/보◆ 미국서 흑인-백인 결혼 증가세◆ 사르코지 각료와 염문설 또 모락모락◆ 모나코 왕가 결혼식 뒷말 무성…신부 눈물, 왜◆ '돈 되면 뭐든지'…중국 짝퉁 '왕실결혼' 화제☞[SBS기자들의 생생한 취재현장 뒷이야기 '취재파일']☞ SBS뉴스 공식 SNS [SBS8News 트위터] [페이스북] [미투데이] [요즘]저작권자 SBS&SBS콘텐츠허브 무단복제-재배포 금지"
1,2011-10-13,마을 뒷산에 57년째 포탄이 떨어지고 있어요,https://news.naver.com/main/read.nhn?mode=LSD&mid=shm&sid1=102&oid=001&aid=0005316887,연합뉴스,"57년째 포성 끊이지 않는 철원 최전방 마을    (철원=연합뉴스) 이해용 기자 = 13일 강원 철원군 갈말읍 신철원3리 '용화동' 마을 뒷산에 자리잡은 피탄지에 포탄이 떨어지면서 하얀 먼지가 일고 있다. 철원과 경기북부 군 사격장에서 쏜 포탄이 떨어지는 이곳 피탄지는 수복 직후인 1954년부터 운영됐다.<<지방기사 참조>>  2011.10.13    dmz@yna.co.kr    http://blog.yonhapnews.co.kr/dmzlife주민 ""인명피해에 지역발전 장애물""‥軍 ""이전할 데 없다""(철원=연합뉴스) 이해용 기자 = 13일 낮 12시께 조선시대 겸재 정선이 진경산수화를 그렸던 철원군의 평화로운 삼부연 폭포를 지나자 1.4㎞가량 떨어진 속칭 `가클봉'에서 하얀 먼지가 피어올랐다.이어서 하늘을 가르는 소리와 함께 포성이 귓가를 때렸다.산속에 포근하게 안긴 형태로 일견 평화로와 보이는 강원 철원군 갈말읍 신철원3리 용화동 마을에 전쟁터를 방불케 하는 포성이 들리기 시작한 것은 올해로 57년째.6ㆍ25전쟁이 끝난 직후인 1954년부터 철원이 수복되면서 주민이 입주한 뒤 마을 입구의 포사격장 피탄지는 현재의 마을 뒷산으로 이전했지만 주말을 제외한 평일에 계속 포탄이 떨어지고 있다.주민은 그동안 포탄 파편이 날아들어 지붕의 슬레이트가 깨지고 천장이 뚫리는 등 피해가 속출했다며 불편을 호소했다.특히 지난 1967년 7월에는 산에 땔감을 구하러 갔던 주민 2명이 포탄 파편에 맞아 숨지는 등 그동안 4명이 숨지고, 10여 명이 부상하는 인명사고도 발생했다고 마을 사람들은 탄원했다.주민 인장환(67) 씨는 ""19살 때인 1964년 7월 산에 올랐다가 `쿵'하는 소리를 들은 뒤 정신을 잃었다. 정신을 차려보니 오른팔이 절단돼 너덜거리고 복부의 장기 일부가 밖으로 나와 움직일 수 없었다""고 끔찍했던 상황을 회상했다.그는 현재까지 밥조차 스스로 먹기 어려워 아내가 수저로 떠먹여 줘야 할 정도로 힘든 생활을 하고 있다.요즘 주민은 포탄 소리에 놀란 관광객이 돌아가는 등 지역발전에 장애가 되고 있다며 이전을 요구하고 있다.주민 남택선(63) 씨는 ""포사격을 하면 굉음에 가슴이 떨릴 정도여서 어린 손녀는 방안을 왔다갔다하며 어쩔줄 모른다""며 ""포사격 소리를 듣고 민박을 왔던 관광객이 놀라서 짐을 싸가지고 가는 경우도 있다""고 말했다.철원 용화동 피탄지 피해 주민    (철원=연합뉴스) 이해용 기자 = 13일 강원 철원군 갈말읍 신철원3리 '용화동'의 한 주민이 포탄 파편에 맞아 잃어버린 오른팔과 다친 배 부위를 보여주고 있다. 강원 철원과 경기북부의 군 사격장에서 쏜 포탄이 떨어지는 이곳 피탄지는 수복 직후인 1954년부터 운영됐다.<<지방기사 참조>>  2011.10.13    dmz@yna.co.kr    http://blog.yonhapnews.co.kr/dmzlife견디다 못한 주민들은 이날 사격장 이전을 국가에 요구하기 위한 자료를 확보하기 위해 마을회관 옥상에서 자체적으로 소음 측정을 시도했다.군 당국이 K9 자주포를 쏜 뒤 주민들이 측정을 시작하자 40~50데시벨 수준이던 수치는 갑자기 66~74데시벨로 올라갔다.하지만 주민들은 마을에서 무려 22㎞ 떨어진 경기도의 한 사격장에서 쏜 포탄이 떨어지는 소리는 일상 생활에 불편을 주는 수준을 반영하지 못한다며 별다른 의미를 두지 않고 포성이 심한 날짜를 잡아 다시 측정할 계획이다.포탄의 종류나 거리, 날씨 등에 따라 소음 정도가 다르다는 것이다.이광춘(60) 신철원3리 이장은 ""철원과 경기 북부지역의 여러 군부대 사격장에서 이 곳을 향해 집중사격을 실시하다보니 소음과 진동으로 집에 균열이 생기는 등 피해가 상대적으로 더 크다""며 ""마을의 미래를 위해서는 사격장이 이전돼야 한다""고 강조했다.그러나 군 당국은 사격을 실시하는 날이면 안내방송과 함께 사격장 주변에 병력을 배치, 주민들이 접근하지 못하도록 하는 등 조치를 취해 최근에는 더 이상 피해가 발생하지 않고 있다는 입장이다.아울러 새로운 부지를 마련해 피탄지를 옮기는 것은 현실적으로 어렵기 때문에 장기적으로는 피탄지 주변을 매입하는 방안을 검토하기로 했다.군 당국의 한 관계자는 ""주민들이 국가 안보의 중요성을 몰라주는 것 같아 아쉽다""면서 ""피탄지를 이전하려도 해도 이전할 수 있는 곳이 없지 않느냐""고 반문했다.dmz@yna.co.krhttp://blog.yonhapnews.co.kr/dmzlife<연합뉴스 모바일앱 다운받기><포토 매거진><저작권자(c)연합뉴스. 무단전재-재배포금지.>"
2,2011-10-13,"맵시가 달라, 새내기 믿을맨",https://news.naver.com/main/read.nhn?mode=LSD&mid=shm&sid1=103&oid=016&aid=0000399046,헤럴드경제,"검은색 정장에 검은색 구두, 튀지 않는 넥타이, 단정하게 빗은 머리, 급하게 들고나온 아버지 서류가방.수년 전만 해도 면접장에서 보게 되는 남성 취업준비생들의 모습은 이를 크게 벗어나지 않았다. 그게 금융권이든, 교육계 혹은 광고 분야이건 마찬가지였다. 업계와 직종을 불문하고 언제 어디서나 별 탈 없이 섞이는 ‘무난한’ 옷차림의 정석이다. 자주 입는 것도 아니고, 합격하면 좋은 것 사야지 하고 훗날을 기약하며 넥타이도 가방도 고민하지 않는 것.대부분 겉모습보다는 내용물(?)이 중요하다며 합리화하지만 실제 면접에서 외모가 차지하는 비중은 상당하다. 한국경영자총협회의 ‘2011년 대졸 신입사원 채용 동향 및 특징’에 따르면 채용과정에서 면접 비중은 56.3%로 가장 높았는데, 그 중 외모 비중은 무려 6.7%를 차지하는 것으로 나타났다. 물론 여기서 말하는 외모란 눈의 크기나 다리의 길고 짧음이 아니라 상황에 맞는 적절한 의상. 다시 말해 지원하고자 하는 회사의 스타일을 파악해 면접룩에서도 ‘성의’를 보여야 한다는 뜻이다.바야흐로 취업시즌이다. 치열한 경쟁 속 차별화된 전략은 필수. 내용물을 돋보이게 하는 데는 포장(?)도 무시할 수 없다. 미래 ‘믿을맨’으로 낙점되기 위한 필승 면접룩을 살펴보자.블랙 혹은 짙은 네이비 컬러의 정형화된 면접룩에서 벗어나 그레이나 브라운 슈트를 활용하면 진취적인 이미지를 전달할 수 있다. 상의는 행커치프로 유연하게, 하의는 체크패턴으로 여유 있게 매치하자.#짙은 네이비, ‘믿을맨’의 정석=패턴 없는 솔리드 계열의 짙은 감색 슈트는 정장의 기본 컬러. 누가 입더라도 깔끔하고 스마트한 인상을 심어준다. 여기에 감색 슈트와 대비되는 새하얀 셔츠를 입는다. 이때 타이는 슈트와 동일한 색상으로 매치하면 안정감을 높일 수 있다.여전히 피트감 있는 타이트한 정장이 트렌드지만, 면접에서는 자칫 단정해 보이지 않을 수 있으니 자연스럽게 떨어지는 실루엣을 추천한다. 더 클래스의 ‘뉴 슬림 슈트 라인’ 등 브랜드마다 취업준비생과 신입사원만을 위한 정장을 선보이고 있어 잘 활용하면 유행에 발맞추면서도 예의를 갖춘 면접룩을 손쉽게 완성할 수 있다. 대부분 네이비와 블랙 컬러로 이뤄진 심플한 클래식룩으로 정장이 아직 어색한 사회 초년생의 마음을 편안하게 해준다.또 본인의 매력과 개성을 좀 더 나타내고 싶다면 슈트보다는 안경을 활용하는 것도 센스. 얼굴형에 잘 맞춘 안경테는 날카로운 인상을 부드럽게 만들거나 좀 더 지적인 느낌도 전달할 수 있다.#그레이 컬러, ‘발로 뛰겠소’맨=까무잡잡한 피부나 하얀 피부나 어떤 피부 톤에도 잘 어울리는 그레이 컬러 슈트는 좀 더 적극적인 느낌이다. 따라서 전자, IT, 건설, 건축업계 등에 지원하는 취업준비생들에게 적합하다. 이들 업계는 일반 기업보다 덜 보수적이기 때문에 어느 정도 의상을 통해 자신을 표현할 수 있다.그레이 컬러의 슈트에 행커치프를 활용하면 여유로운 정통 클래식 룩을 완성할 수 있다. 아주 튀지 않으면서 도시적인 남성상을 보여줄 수 있으니 응용해보는 것도 좋다. 이때 벨트와 신발 컬러는 동일하게 맞추는 게 포인트. 또 전체 슈트 색상에서 크게 벗어나지 않아야 키도 커 보인다. 비즈니스 캐주얼 브랜드 마인드브릿지의 그레이 슈트는 부드러운 체크 패턴이 들어가 있는데 블루 및 브라운과 조화를 이뤄 활동적이면서도 깔끔한 인상을 준다.#믹스매치룩, 영리한 남자=영업, 디자인, 광고, 홍보 계열은 믹스매치룩으로 센스 있는 감성을 보여주는 게 관건. 보다 과감한 스타일링으로 재치 넘치고 당당한 자신을 표현하자. 이들 업계에서는 면접에서의 의상이 또 하나의 프레젠테이션이다.믹스매치 스타일을 연출할 때 주의할 점은 재질, 패턴, 컬러, 액세서리 등 여러 가지 요소 중 딱 한 가지에만 포인트를 두고 변화를 주어야 하는 것. 자칫 시선이 분산되고 산만해지는 것을 막기 위해서다. 탁월한 감각의 소유자라고 해도 믹스매치룩은 만만치 않은 스타일링이다. 이때 중요한 것은 자신의 스타일링에 확신을 갖고 자신 있게 대응하는 것. 마인드브릿지 디자인팀 김지용 실장은 “상황에 맞는 맵시 있는 드레스 코드는 5초 안에 판가름 나는 첫인상에 영향을 미치는 중요한 요인”이라며 “기업체가 선호하는 의상을 준비한다면 자신감을 갖고 면접관의 마음을 사로잡을 수 있을 것”이라고 조언한다.<박동미 기자@Michan0821>/ pdm@heraldm.com［사진제공=더클래스ㆍ마인드브릿지］▶ 영문 속보·살아있는 e스터디…당신의 손끝에서 만난다▶ '양용은' 골프 스윙기 하루 1억 판매- 헤럴드 생생뉴스 Copyrights ⓒ 헤럴드경제 & heraldbiz.com, 무단 전재 및 재배포 금지 -"
3,2011-10-13,"두 여자, 바람에 맞서다…서울시장 보선 첫 거리유세",https://news.naver.com/main/read.nhn?mode=LSD&mid=shm&sid1=100&oid=015&aid=0002558434,한국경제,"< ""우리 羅후보"" >  박근혜 전 한나라당 대표(왼쪽)와 나경원 서울시장 후보가 공식선거운동 시작 첫날인 13일 서울 관악고용지원센터를 방문해 시민들에게 손을 흔들며 인사하고 있다. /허문찬 기자 sweat@hankyung.com나경원-박근혜 첫 동반 유세7시간 강행군…적극 지원'선거의 여인'으로 통하는 박근혜 전 한나라당 대표가 13일 2007년 대선 이후 4년 만에 나경원 서울시장 후보 선거 지원에 나섰다. 박 전 대표는 수차례 '우리 나경원 후보'라는 호칭을 사용하는 등 예상보다 적극적인 모습이었다.박 전 대표는 이날 구로구에 위치한 서울관악고용지원센터를 방문한 자리에서 구직상담센터 직원과 대화하면서 ""우리 나경원 후보와 함께 왔는데 같이 고민을 많이 해서 서울시의 고용과 복지에 도움이 되도록 하겠다""고 말했다. 그는 또 60대로 보이는 구직 남성을 만나던 중 곁에 서있던 나 후보를 손짓으로 소개하며 '우리 나경원 후보'라고 지칭해 화기애애한 모습을 연출했다.박 전 대표는 이날 첫 유세 장소에 나 후보보다 먼저 도착해 지원센터 근무자들과 담소를 나누는 등 자발적이고 적극적인 지원의 모습을 보였다. 박 전 대표는 유세 장소를 이동하면서도 나 후보에게 손짓하며 앞장서기를 권했고 수시로 웃고 대화하면서 친근한 모습을 연출하는 등 '나경원 서울시장 후보' 띄우기에 신경쓰는 모습이 역력했다.박 전 대표는 ""나 후보의 경쟁력을 어떻게 평가하느냐""는 기자들의 질문에 ""그동안 장애아동에 대해 힘썼던 따뜻한 마음에 감동했다""며 ""서울시정도 그런 따뜻한 마음으로 이끌 것으로 본다""고 나 후보를 치켜세웠다.나 후보에 대한 박 전 대표의 '확실한' 지원유세가 이뤄짐에 따라 향후 서울시장 선거 지원에 박 전 대표의 역할이 더욱 커질 것이라는 분석이 나오고 있다. 당 핵심관계자는 ""박 전 대표가 당 지도부와의 통화에서 지원 형식과 방법에 상관없이 최선을 다해 나 후보를 지원하겠다는 뜻을 수차례 밝혔다""며 ""서울시장 보궐선거의 정치적 상징성이 큰 만큼 향후 몇 차례 정도 추가로 지원유세가 이뤄질 수 있도록 협조를 구하고 있다""고 밝혔다.박 전 대표는 지원센터 방문 이후에도 나 후보와 함께 구직자들과 이야기를 나누고 벤처기업 관계자와 오찬을 하는 등 7시간이 넘는 강행군을 소화했다.구동회 기자kugija@hankyung.com▶ 두 남자, 탈환을 꿈꾸다…서울시장 보선 첫 거리유세▶ 투표율 50% 넘길까…안철수 막판 지원 '변수'▶ 10ㆍ26 재보선 선거운동 돌입…여야 총력전▶ [취재여록] '난장판 '서울시장 선거戰▶ 홍준표 ""나경원, 1%P 앞선 것으로 조사돼""<성공을 부르는 습관>ⓒ 한국경제신문, 무단 전재 및 재배포 금지<한국온라인신문협회의 디지털뉴스이용규칙에 따른 저작권을 행사합니다>"
