,날짜,기사 제목,기사 링크,기사 출처,기사 내용
97,2011-10-13,“아이폰4S를 손에 쥔 기분?”…iOS5 새 기능 뭐길래,https://news.naver.com/main/read.nhn?mode=LSD&mid=shm&sid1=105&oid=112&aid=0002234468,헤럴드POP,"열혈 아이폰 사용자들이 또 한번 밤잠을 설쳤다. 애플의 새 모바일 운영체제(OS) iOS5의 정식 버전이 13일 새벽 2시경(한국시각) 공개된 것.iOS5에는 200개가 넘는 새로운 기능들이 추가됐다. 아이폰 및 아이패드에서 무료 문자메시지 송수신이 가능한 ‘아이메시지’를 비롯해 애플의 클라우드 서비스(데이터를 가상의 공간에 저장)인 ‘아이클라우드’, 뉴스 구독 서비스인 ‘뉴스 가판대’ 등이 주요 기능이다.‘아이메시지’는 애플판 ‘카카오톡’이다. 이제 아이팟터치, 아이폰, 아이패드 등 iOS 기기 사이에서 무료로 문자 메시지를 주고 받을 수 있다. 물론 사진이나 영상 메시지 등도 가능하다.‘아이클라우드’의 경우 아이폰으로 사진을 찍으면 바로 애플 서버에 저장되며 미리 지정한 애플 기기에도 자동으로 저장된다. 즉, 기존에 사진, 음악, 동영상 등을 옮기려면 케이블을 연결해야 했던 수고를 덜어준 셈이다.또 사용자가 지정한 신문과 잡지 등을 구독할 수 있는 ‘뉴스 가판대’ 서비스도 눈에 띄는 기능이다. 구독 매체의 최신 발행물이 등록되면 자동으로 알림 서비스를 받을 수 있고 업데이트가 가능하다.이 외에도 문자 메시지, SNS, 이메일 등을 통합 관리할 수 있는 ‘알림센터’, 카메라, 사진, 지도, 사파리, 유튜브 등에서 곧바로 트윗을 전송할 수 있는 ‘트위터 지원 내장’ 기능, 홈 버튼을 더블 클릭하면 촬영 모드로 바로 이동하고 볼륨 조절 버튼으로 사진을 찍을 수 있는 ‘카메라 개선’ 기능 등도 추가됐다.iOS5 업데이트 방법은 다음과 같다. 우선 애플 기기 관리 프로그램인 아이튠즈를 10.5 버전으로 업데이트 한다. 아이튠즈를 실행시켜 아이폰 또는 아이패드를 연결, 저장된 데이터를 백업(보관)해둔다. 이후 프로그램 내 iOS5 업데이트 설명 창을 클릭해 업데이트를 실시한다.iOS 배포를 손꼽아 기다렸던 누리꾼들은 이른 새벽부터 업데이트 후기를 공유하고 있다. 다수의 누리꾼들이 “iOS 5로 업글하고 가장 좋아진 점은 아이폰이 더 빨라졌다는 것! 3Gs도 물론! 어느 핸드폰 회사에서 몇년씩이나 이렇게 충실하게 업그레이드 해 줄까?”(gol***), “iOS5, 마치 안드로이드의 장점을 따서 적용한듯! 어플 사용중에 메세지 팝업 안뜨는게 맘에 든다.”(hae***) “iOS5 업글완료! 마치 아이폰4S 쓰는 기분!”(ha*****)이라고 호평을 남겼다.한편, 일부 누리꾼들은 “이런! iOS 5로 판올림하다가 아이폰 벽돌됐다. 복원하려니 자꾸 오류도 생기고...노트북도 맛이 가 재설치 중. 험난한 길이군.”(pleia******), “ios5 업그레이드 몇일 후에 하세요. 지금 오류와 씨름 중”(vas****)이라며 주의를 당부하기도 했다.iOS5 업데이트 대상 기종은 아이폰3GS, 아이폰4, 아이패드, 아이패드2, 아이팟터치(3, 4세대)이다. 자세한 내용은 애플 홈페이지(apple.com)를 통해 확인할 수 있다.<이혜미 기자 @blue_knights>ham@heraldm.com▶ 호주서 갤럭시탭 판매될까?…삼성-애플소송 13일 판결▶ 머리에 '애플' 새겼던 광팬, 그에게 잡스는?…▶ 런던 최대 애플상점서 ‘심야 떼도둑’▶ 삼성전자 주가상승률 애플 추월...올 최후 승자는 누구?▶ 애플 “삼성 특허 제소는 무효” 소송▶ 영문 속보·살아있는 e스터디…당신의 손끝에서 만난다▶ '양용은' 골프 스윙기 하루 1억 판매- 헤럴드 생생뉴스 Copyrights ⓒ 헤럴드경제 & heraldbiz.com, 무단 전재 및 재배포 금지 -"
98,2011-10-13,"월가 분노 부른 양극화, 한국도 이미 위험수위",https://news.naver.com/main/read.nhn?mode=LSD&mid=shm&sid1=101&oid=020&aid=0002283552,동아일보,"[동아일보]‘월가를 점령하라(Occupy Wall street)’는 구호는 사회구조가 갈수록 미국과 비슷해지는 한국에서도 공감대를 폭넓게 형성할 가능성이 크다. 1997년 외환위기 이후 2000년 닷컴 버블 붕괴, 2003년 카드대란, 2007년 부동산 거품 붕괴, 2008년 글로벌 금융위기, 올해 유럽 재정위기 등 반복되는 경제위기에 한국의 중산층이 무너지면서 양극화의 골이 깊어지고 있기 때문이다. 편법을 동원해 세금을 거의 내지 않고 자식들에게 부(富)를 대물림하는 일부 기업 오너의 일탈적 행태 등에 국민적 공분(公憤)이 일면서 ‘1%와 99%’로 상징되는 불공정성은 한국이 미국보다 심각한 것 아니냐는 주장도 일각에서 나온다.○ 소득 격차 확대 갈수록 심화통계청에 따르면 우리나라 2인 이상 도시가구 평균 소득은 외환위기 때인 1998년 98만4169원에서 지난해 189만4988원으로 92.5% 증가했다. 하지만 커진 파이는 잘사는 계층에 집중됐다. 소득별로 10등분해 가장 소득이 낮은 1분위(하위 10%) 계층의 평균 소득은 같은 기간 38만2662원에서 59만9981원으로 56.8% 늘어나는 데 그쳤다. 반면 소득 수준이 가장 높은 10분위(상위 10%) 계층은 165만8007원에서 328만9915원으로 98.42% 증가했다. ‘빈익빈 부익부’는 중산층이 무너진 결과다. 2, 3년 주기로 위기를 겪으면서 우리나라 경제의 중추를 이뤘던 중산층 중 극소수만 상층부로 올라갔고 대부분은 하위계층으로 떨어졌다는 것이 지배적인 분석이다.소득 분배의 불균형 수준을 보여주는 지니계수도 점점 악화되고 있다. 1997년 0.264였던 지니계수는 2009년 0.320까지 올랐다가 지난해 0.315로 주춤했다. 지니계수는 0과 1 사이 숫자로 표현되는데 1에 가까울수록 불평등이 심하다는 뜻이다. 보통 0.4를 넘기면 불평등도가 매우 심각한 것으로 해석된다. 한가운데 소득(중위소득)의 50% 미만을 버는 인구 비중을 보여주는 상대적 빈곤율은 1997년 8.7%에서 2010년 14.9%까지 높아졌다.현대경제연구원에 따르면 올 1∼8월 우리나라의 경제고통지수는 평균 8.1%로 글로벌 금융위기 때인 7.8%보다도 높아졌다. 경제고통지수는 소비자물가 상승률에 실업률을 더한 값으로 국민이 체감하는 경제적 삶의 어려움을 계량화해 수치로 나타낸 것이다. 주원 현대경제연구원 연구위원은 “대외적으로는 세계경제의 회복세가 미흡한 데 따른 고용불안과 국제 원자재 가격 상승에 의한 글로벌 인플레이션, 대내적으로는 농산물 가격 급등 때문에 경제고통지수가 높아졌다”고 설명했다.○ 국제 기준으로도 심각한 양극화위기를 겪으며 악화된 소득 불평등도는 국제 기준으로 봐도 위험한 수준이다. 유럽연합(EU)은 탄탄한 복지시스템에 금이 가면서 빈부격차가 확대되고 있지만 EU 회원국의 평균 지니계수는 0.310으로 한국(지난해 0.315)보다 낮다.경제협력개발기구(OECD)에 따르면 2000년대 중반 기준 한국의 상대적 빈곤율은 14.6%로 OECD 회원국 30개국 가운데 일곱 번째로 높다. 재정위기를 겪고 있는 스페인(14.1%) 그리스(12.6%) 이탈리아(11.4%)는 오히려 우리보다 낮았으며 미국(17.1%) 일본(14.9%) 아일랜드(14.8%) 정도가 한국보다 높았다. 외환위기 직전인 1997년만 해도 우리나라의 상대적 빈곤율(8.7%)은 뉴질랜드(8.4%) 독일(8.5%)과 맞먹는 세계 최저 수준이었는데 위기를 겪으면서 빈부격차가 큰 나라로 전락했다.한국의 소득 불평등도가 악화된 결과 미국 월가 시위대의 일부 구호는 우리나라 상황에도 적용할 수 있다는 지적이 많다. 시카고 시위대의 12가지 요구 중 부자감세 철폐, 금융감독기관 종사자의 이전 직장 재취업 금지, 기업수익이 결국 국민 수익이라는 논리 거부, 학자금 대출에 쪼들리는 학생 구제 등은 마치 우리나라 시위 구호를 연상케 한다. 국제통화기금(IMF)의 구제금융을 받으면서 본격적으로 상륙한 신자유주의가 10년 넘게 우리 경제의 주류가 되면서 소득불평등, 경제 양극화 같은 신자유주의의 병폐마저 선진국과 닮아가고 있다는 주장도 나온다. 강석훈 성신여대 교수(경제학)는 “기업의 이익 창출이 고용과 연결되는 선순환이 깨지고 중소기업 중심의 내수 부문과 대기업 중심의 수출 부문 격차가 확대되면서 소득분배가 악화됐다”며 “복지 시스템 효율화, 고용창출 확대, 재기를 위한 기회를 확대하기 위해 정부와 기업이 함께 노력해야 한다”고 말했다.이상훈 기자 january@donga.com[관련 뉴스]- [화보] ‘월가를 점령하라’ 시위, 미국 전역으로 확산- [화보] “월가를 점령하라”…맨해튼 ‘좀비’ 시위- [화보] 틈만 나면 ‘훌렁덩~’ 여성인권단체 ‘누드 시위’- [화보] 과감히 벗어 던진 美 팝가수 리한나 ‘아찔 포즈’[☞모바일서비스 바로가기][☞오늘의 동아일보][☞동아닷컴 Top기사]ⓒ 동아일보 & donga.com, 무단 전재 및 재배포 금지"
99,2011-10-13,北 “평양서 고구려 첨성대 터 발굴”,https://news.naver.com/main/read.nhn?mode=LSD&mid=shm&sid1=103&oid=022&aid=0002318988,세계일보,"경주 첨성대 보다 200년 앞서[세계일보]북한 김일성종합대학 역사학부 연구집단이 고구려 때 첨성대 터(사진)를 발굴했으며, 이에 관한 고증자료가 최근 국제학술토론회에서 커다란 반향을 불러일으켰다고 북한 조선중앙통신이 12일 보도했다.중앙통신은 평양시 대성구역 안학동에 있는 평양민속공원 건설장에서 발굴된 이 유적터에서 나온 숯의 연대측정 결과 고구려 첨성대가 5세기 초에 지어진 것으로 드러났다고 전했다. 이는 신라 27대 선덕여왕(재위 632∼647년) 때 건립된 것으로 추정되는 경주 첨성대보다 200년가량 앞선 것이다.통신에 따르면 평양 첨성대 터 유적은 안학궁성 서문에서 서쪽으로 약 250m 떨어진 곳에 있으며, 4각으로 된 중심시설과 그 밖으로 7각으로 된 시설로 구성됐다. 유적의 4각 기초는 띠 모양으로 연결돼 있으며, 비교적 큰 강돌을 석회와 섞어 축조했다. 기초시설 깊이는 1.3m로, 지금까지 발굴된 삼국시대 건축물 가운데 기초가 가장 깊다.이번 유적 발굴에 대해 통신은 “고구려가 삼국시대 천문학 발전에서도 주도적 역할을 했다는 것을 말해 준다”고 의미를 부여했다.김보은 기자 spice7@segye.com[Segye.com 인기뉴스]◆ '이태원 살인' 용의자 도피 중에도 갱단활동 버젓이…◆ MB, 이번엔 선영가는 길까지…IC신설 의혹◆ ""민망한 신체 가려라"" 목욕탕서 폭행◆ 발목에 멍 자국…7개월 영아 안방서 숨진채 발견◆ 박원순, 자택 내부 공개 '책 욕심 부리다가…'[ⓒ 세계일보 & Segye.com, 무단 전재 및 재배포 금지]세계일보[모바일][지면보기][공식SNS-트위터/페이스북/미투데이]<세계닷컴은 한국온라인신문협회(www.kona.or.kr)의 디지털뉴스이용규칙에 따른 저작권을 행사합니다.>"
100,2011-10-13,"론스타, 외환카드 주가조작 유죄판결 '상고 포기'",https://news.naver.com/main/read.nhn?mode=LSD&mid=shm&sid1=101&oid=366&aid=0000018482,조선비즈,"한국외환은행(004940)의 대주주인 미국계 사모펀드 론스타(지분율 51.02%)가 외환카드 주가조작 의혹사건 관련 서울고등법원 파기환송심 유죄판결에 대해 대법원 상고를 전격 포기키로 결정했다.이에 따라 최근 선고대로 론스타에 대한 법원의 250억원 벌금형은 확정되게 됐고 지난 8년간 끌어 온 론스타의 외환은행 지분 처리(매각) 문제는 한층 속도를 낼 전망이다. 론스타는 지난 2003년 외환은행을 인수한 후 계열사인 외환카드를 흡수합병할 때 허위 감자(減資·자본금을 줄이는 것) 설을 퍼뜨려 이득을 봤다는 주가조작 의혹 사건 재판에서 지난 6일 패소했다.론스타측 관계자는 13일 론스타 수뇌부가 상고 시한인 이날 새벽 대법원 상고를 포기하겠다는 의사를 국내 법률대리인측에 알려왔다고 확인했다.론스타가 이번 파기환송심 유죄판결을 받아들이기로 한 것은 이미 대법원이 유죄 취지로 고등법원에 사건을 돌려보내 고법에서 그 취지대로 유죄를 선고한 이상 상고를 해도 결과를 뒤집기 어렵다고 본 것으로 보인다. 또 일각의 관측대로 재상고로 시간을 일부 벌더라도 그 시간이 한 두달 남짓으로 길지 않아 하나금융과의 협상이나 금융당국과의 관계에서 큰 실익이 없다고 판단한 것으로 분석된다.론스타의 상고 포기로 외환은행 매각 문제는 속도를 내게 됐다.금융위원회는 곧 회의를 거쳐 론스타에게 대주주 적격성 요건을 충족할 것과 10%이상 한도초과 지분(41%)에 대한 의결권 정지 조치를 내릴 예정이다. 금융위원회는 오는 19일 정례회의에서 이 문제에 대해 결론을 내릴 가능성이 높다. 법원의 유죄판결이 확정되게 된 이상 론스타가 대주주 적격성 요건을 충족하고 한도초과 보유지분 의결권 정지를 피할 수 있는 방법은 사실상 없다. 김석동 금융위원장은 론스타가 이 충족명령을 이행하지 못하면 6개월 이내의 기간을 정해 론스타 한도초과 보유주식의 처분을 명령할 예정이다.금융권 관계자들은 론스타와하나금융지주(086790)가 금융위원회의 주식매각명령이 내려지면 기존에 맺은 계약을 근거로 하되 추가 가격 협상을 벌여 최종 지분매매를 마무리지을 것으로 보고 있다. 론스타와 하나금융은 지난 7월 론스타의 외환은행 지분 51%를 주(株)당 1만3390원(약 4조4059억원)에 사고 팔기로 계약을 연장하고 금융당국의 승인을 기다려왔다. 김승유 회장은 작년 11월 론스타와의 계약 당시 주당 1만3000원 안팎이던 외환은행 주가가 7000원대로 40%이상 내려온 이상 가격인하를 추진할 전망이다.[백종훈 기자iam100@chosun.com]조선비즈 핫 뉴스 Bestㆍ""기대된다"" 애플 마니아 밤새게 생겼네…ㆍ카카오톡 확 바뀌었네숨겨둔 무기 보니ㆍ현금 찾을때 수수료 한푼이라도 아끼려면ㆍℓ당 최고 18.92km 기록…최고 연비왕은?ㆍ관리비도 비싸고…시들해진 주상복합chosunbiz.com"
101,2011-10-13,등록금 감면 인색 `짠돌이 대학'에 불이익,https://news.naver.com/main/read.nhn?mode=LSD&mid=shm&sid1=100&oid=001&aid=0005314908,연합뉴스,"9월29일 오후 서울 청계광장에서 열린 '반값 등록금 실현 및 교육공공성 강화를 위한 국민 촛불대회'에서 참석자들이 구호가 적힌 팻말을 들고 앉아있다.(자료사진)감면 여부, 재정지원과 연계ㆍ정보공시 추진(서울=연합뉴스) 임주영 기자 = 대학생들이 낸 등록금을 쌓기만 하고 학비 감면에는 인색한 대학에 불이익을 주는 방안이 추진된다.교육과학기술부는 저소득층 학생에게 등록금을 감면해 주도록 한 `대학 등록금에 관한 규칙'을 각 대학이 준수했는지 파악해 내년부터 각종 평가에 반영하는 방안을 추진할 계획이라고 13일 밝혔다.규칙에 따르면 대학은 해당 학년도에 전체 학생이 내야 할 등록금 총액의 10% 이상에 해당하는 등록금을 학생에게 면제 또는 감액해야 한다. 이 경우 경제적 사정이 곤란한 학생에 대한 감면액은 총 감면액의 30% 이상이 돼야 한다.그러나 교과부가 최근 2년간 사립대(2009년 305개, 2010년 310개)의 학비감면 실태를 파악한 결과 `총 학비감면 비율'(10%)을 지키지 않은 대학은 2009년 31.5%(96개), 지난해 26.8%(83개)였다. `저소득층 학비감면 비율'(30%)의 미준수 대학은 2009년 80.3%(245개), 작년 77.7%(241개)였다.교과부는 내년부터 대학별로 감면 조항의 준수 여부를 파악해 교육역량 강화사업, 재정지원 제한, 대출제한 평가 등 각종 정책 결정에 반영할 방침이다.또 대학이 정보공시 사이트에 학비감면 현황을 상세히 공개하도록 할 계획이다.현재 전체 학비감면 금액만 공시하지만 연내에 규정을 고쳐 내년부터 저소득층(경제적 사정 곤란자)에 대한 학비감면 현황도 공시하는 방향으로 바뀐다.아울러 대학들이 저소득층을 쉽고 정확히 파악해 등록금 감면 대상을 선정할 수 있도록 각 대학에 학생의 소득분위 정보를 제공한다. 교과부는 늦어도 내년 초까지 준비를 끝낼 계획이다.교과부는 한국장학재단, 건강보험공단과 함께 학생의 경제 수준 정보를 파악해 제공한다. 단, 개인정보 보호를 위해 학생과 학부모가 동의해야 정보 제공이 가능하다.zoo@yna.co.kr[관련기사]▶ 숙명여대 근로장학사업 일시 중단▶ 월가 시위, 세대·지역 구분없이 확산▶ 대학들 ""등록금 감사, 대학 자율성 존중해야""▶ 교육과학 예산 53조…대학생 맞춤형 장학금(종합)▶ 교육과학 예산 53조…대학생에 맞춤형 국가장학금<연합뉴스 모바일앱 다운받기><포토 매거진><저작권자(c)연합뉴스. 무단전재-재배포금지.>"
102,2011-10-13,[단독] 수업료 동결 유치원에 학급당 60만원 준다,https://news.naver.com/main/read.nhn?mode=LSD&mid=shm&sid1=102&oid=022&aid=0002318987,세계일보,"서울시교육청, 추경예산 편성… 月10만원씩 6개월치 소급지원[세계일보]서울 사립 유치원 가운데 수업료를 지난해 수준으로 동결한 유치원에 대해 학급당 월 10만원씩 지원된다.서울시교육청은 지난 3월 이후 수업료를 동결한 사립 유치원에 대해 학급당 월 10만원씩 지원하기로 했다고 12일 밝혔다. 시교육청은 우선 지난 3월부터 6개월치의 운영비를 소급, 학급당 60만원씩 지원한다.시교육청에 따르면 올 들어 서울의 사립 유치원 총 699곳 가운데 56%인 393곳이 유치원 수업료를 동결했다. 이를 학급수로 환산하면 총 3229개 학급 중 1831개 학급이 동결한 셈이다.시교육청은 최근 이 같은 내용을 골자로 한 2011년도 제1회 추가경정 예산안을 편성해 시의회에 제출했고, 시의회는 심의·의결을 거쳐 추경 예산을 확정했다.시교육청은 사립 유치원들의 수업료 동결 실태를 한 번 더 점검한 뒤 이달 중에 운영비를 지원할 예정이다. 시교육청의 이 같은 조치는 올해 초 정부가 서민 물가 안정대책의 하나로 대학 등록금 못지않게 가계에 부담이 되는 사립 유치원비의 동결을 추진한 데 따른 것이다.실제 2009년 시교육청 국정감사 자료에 따르면 서울 유치원의 월평균 종일반 비는 41만5730원으로, 국·공립대 등록금(연평균 416만5000원)보다 더 많았다.이에 교육과학기술부는 한국유치원총연합회를 상대로 유치원비 동결을 요구했고, 유치원총연합회 측은 정부의 지원을 전제로 사립 유치원의 입학금 및 수업료 인상을 자제하는 데 협력하기로 했다. 교과부는 지난 2월 공문에서 시·도 교육청별로 유치원비 동결 실태를 파악하고 교사 인건비 상승분 등 운영비 증액분을 고려, 예산의 범위 내에서 지원 계획을 수립하도록 했다.일각에선 유치원들이 수업료를 동결하더라도 다른 방식으로 학부모들에게 부담을 전가할 수 있는데 수업료를 동결한 유치원을 일괄 지원하는 것은 문제라는 지적도 나온다.교과부 관계자는 “단지 수업료뿐 아니라 유치원 비용 전반에 대한 판단을 거쳐 지원하도록 했다”며 “수업료만 동결하고 부수적인 비용을 학부모에게 전가한 뒤 운영비를 지원해달라는 편법적인 사례가 발견되면 지원을 중단할 것”이라고 말했다.이태영 기자 wooahan@segye.com[Segye.com 인기뉴스]◆ '이태원 살인' 용의자 도피 중에도 갱단활동 버젓이…◆ MB, 이번엔 선영가는 길까지…IC신설 의혹◆ ""민망한 신체 가려라"" 목욕탕서 폭행◆ 발목에 멍 자국…7개월 영아 안방서 숨진채 발견◆ 박원순, 자택 내부 공개 '책 욕심 부리다가…'[ⓒ 세계일보 & Segye.com, 무단 전재 및 재배포 금지]세계일보[모바일][지면보기][공식SNS-트위터/페이스북/미투데이]<세계닷컴은 한국온라인신문협회(www.kona.or.kr)의 디지털뉴스이용규칙에 따른 저작권을 행사합니다.>"
103,2011-10-13,"이태원 살인사건 패터슨, 범행 시인했었다",https://news.naver.com/main/read.nhn?mode=LSD&mid=shm&sid1=102&oid=032&aid=0002169568,경향신문,"ㆍ목격자 리의 친구 “미국 술집서 들어… 갱스터 자랑도”‘이태원 살인사건’의 범인으로 지목돼 미국에서 송환 재판을 받고 있는 아서 패터슨(32)이 동료들에게 범행을 시인했다는 주장이 나왔다.1997년 이태원 햄버거집 살인 현장에 함께 있었던 에드워드 리(32)의 친구 최모씨는 12일 경향신문 기자와 만나 “2007년 미국 로스앤젤레스의 한 바에서 리, 패터슨과 만났다. 패터슨은 그 자리에서 ‘내가 조중필을 죽였다’고 얘기했다. 칼을 들고 흔들면서 자신이 갱스터라고 자랑했다”고 밝혔다. 최씨는 “그 이후로도 패터슨은 스무 차례 이상 조씨를 죽였다는 말을 하고 다녔다”고 덧붙였다.당시 최씨가 ‘한국 법정에 설 수 있다는 생각을 해보지 않았느냐’고 묻자 패터슨은 ‘그들은(한국인들은) 어떻게 할 수 없다’면서 한국을 조롱했다고 최씨는 전했다. 최씨는 “당시 패터슨의 대답을 메모도 하고 녹취도 했다”며 “메모는 지금 없고, 녹취파일은 일부 손상됐지만 미국에서 복원해 17일쯤 서울로 가져올 수 있을 것”이라고 말했다.최씨가 패터슨을 찾아간 것은 범행 현장에 있다가 살인범으로 몰린 리가 절친한 친구여서라고 말했다. 리는 범인으로 기소돼 3년간 옥살이를 하다 대법원에서 무죄 확정 판결을 받고 석방됐다. 최씨는 친구가 억울하게 누명을 쓴 것을 보고 진실을 밝히기 위해 사설탐정을 고용해서 패터슨을 찾아냈다고 했다.그는 또 리가 숨진 조중필씨(당시 23세)의 어머니를 만나고 싶어한다고 전했다. 리는 살인범은 아니지만 당시 패터슨의 친구였던 만큼, 피해자 가족에게 미안한 마음을 가지고 있다는 것이다. 리는 한국에 거주하며 결혼해서 자식까지 두고 있으나 현재 사업 때문에 미국에 머물고 있다.최근 패터슨이 미국에서 재판을 받고 있다는 소식이 전해지자 리는 숨진 조씨의 어머니에게 편지를 쓰기도 했다.최씨가 받아 적은 편지에서 리는 “그동안 철도 없고 무섭기도 하여 이렇게 시간이 지나게 된 시점에서야 편지를 쓰고 친구를 통해 전달하게 된 점을 사과한다”고 말문을 열었다. 이어 “자식을 낳아 길러보니 어머니의 마음을 조금이나마 알 것 같다. 살인 사건의 진실을 그대로 밝혀 유족들의 한을 풀 수 있도록 최선의 노력을 다할 것을 약속드린다”고 썼다.숨진 조씨의 가족들은 그러나 “아직도 리가 공범이라고 생각하고 있기 때문에 편지를 받을 수 없다”고 밝혔다. 패터슨은 현재 한국 송환 여부에 대한 미국 법원의 결정을 기다리고 있다.<정희완 기자 roses@kyunghyang.com>[관련기사]▶ 권재진 법무, 12년 전 악연 풀까… 패터슨 한국 송환 주목공식 SNS 계정[경향 트위터][미투데이][페이스북][세상과 경향의 소통 Khross]- ⓒ 경향신문 & 경향닷컴(www.khan.co.kr), 무단전재 및 재배포 금지〈경향닷컴은 한국온라인신문협회(www.kona.or.kr)의 디지털뉴스이용규칙에 따른 저작권을 행사합니다.〉"
