,날짜,기사 제목,기사 링크,기사 출처,기사 내용
61,2011-10-13,"“자극적인게 좋다”…관세청, 여직원에 치어리더 강요 물의",https://news.naver.com/main/read.nhn?mode=LSD&mid=shm&sid1=100&oid=032&aid=0002169632,경향신문,"관세청이 지난 8월말 관세청 개청기념 직원체육대회에서 사실상 강제적으로 10여명의 여직원에게 치어리더 의상을 입히고 선정적인 춤을 추게 해 물의를 빚고 있다. 동원된 여직원들은 지난 8월27일 충남 천안시 관세국경관리연수원 대운동장에서 1000여명의 관세청 직원들이 참가한 가운데 열린 체육대회 당일 하루종일 짧은 치마의 치어리더 의상을 입고 경기를 응원했다고 13일 헤럴드경제가 보도했다.관세청 여직원 ㄱ씨(25) 등은 지난 8월 해당 부서장에게 불려가 “개청기념 체육대회를 하려 하니 치어리더 의상을 입고 자극적인 춤을 추라”는 말을 들었다. 부서장은 “잘하면 좋은 데로 보내주겠다”는 말까지 덧붙였다. ㄱ씨는 “수년간 공부해서 꿈에 그리던 공무원이 됐는데 짧은 치마를 입고 선정적인 춤을 추게 될지는 꿈에도 몰랐다”며 “허벅지가 다 드러나는 치마를 입고 남자 직원들 앞에서 엉덩이를 흔드는 춤을 추며 심한 수치심을 느꼈다”고 말했다.ㄱ씨를 비롯한 근무경력이 짧은 여직원들은 행사 준비를 위해 퇴근 후, 심지어 업무시간에도 불려다니며 일주일에 많게는 5차례씩이나 춤 연습을 해야만 했다. 행사 담당자는 “자극적인 게 좋다”는 말과 함께 맞춰 쓸 음악까지 골라 연습시켰고 여직원들은 치어리더 의상을 체육대회 며칠 전부터 입기 시작했다.관세청 관계자는 “체육대회 때 치어리딩을 하는 건 사실이지만 직원들이 자발적으로 나서서 한 것”이라며 “문제가 될 게 없다”고 말했다.<디지털뉴스팀>경향신문 ‘오늘의 핫뉴스’▶ 여성들 ‘악몽같은 연애 상대’… 1위는?▶ 술먹는데 전화 “오빠, 뭐해”… 알고보니▶ 감독 “13세 소녀와 성관계, 33년동안 후회…”▶ 슈퍼주니어 1회 TV출연료가… 황당▶ ‘돼지’ 놀림받던 女… ‘화장술’로 인생역전공식 SNS 계정[경향 트위터][미투데이][페이스북][세상과 경향의 소통 Khross]- ⓒ 경향신문 & 경향닷컴(www.khan.co.kr), 무단전재 및 재배포 금지〈경향닷컴은 한국온라인신문협회(www.kona.or.kr)의 디지털뉴스이용규칙에 따른 저작권을 행사합니다.〉"
62,2011-10-13,"IMF ""유럽위기 확산시 亞 직격탄…성장률 하향""",https://news.naver.com/main/read.nhn?mode=LSD&mid=shm&sid1=101&oid=001&aid=0005316084,연합뉴스,"(서울=연합뉴스) 이 율 기자 = 국제통화기금(IMF)이 유럽 위기가 확산되면 아시아지역에 심각한 위협이 된다며 올해 아시아지역 경제성장률 전망치를 6.8%에서 6.3%로, 내년 전망치는 6.9%에서 6.7%로 각각 하향조정했다.13일 블룸버그통신에 따르면 IMF는 이날 보고서에서 ""유럽 부채위기의 확산은 아시아 자산을 싸게 팔아치우는 방아쇠가 될 수 있다. 외국계 은행은 아시아지역에 대한 대출을 중단해 이 지역 외환시장에 타격을 입힐 수 있다""고 진단했다.IMF는 아시아지역 경제성장이 올해 2분기부터 둔화해 성장률 전망치를 하향조정했다고 덧붙였다. 아시아 지역의 물가압력은 여전히 높은 수준이라고 IMF는 분석했다.yulsid@yna.co.kr<연합뉴스 모바일앱 다운받기><포토 매거진><저작권자(c)연합뉴스. 무단전재-재배포금지.>"
63,2011-10-13,"<美, 한·미FTA 비준 완료>진전없는 與野政… 한국은 ‘비준 험로’",https://news.naver.com/main/read.nhn?mode=LSD&mid=shm&sid1=100&oid=021&aid=0002089777,문화일보,"미국 의회가 12일(현지시간) 한·미 자유무역협정(FTA) 이행법안 처리 절차를 마무리한 반면 국내 정치권에서는 여야 간 의견대립만 계속되고 있다.여야 원내대표까지 참석한 가운데 13일 오전 국회에서 열린 한·미 FTA 여·야·정 협의체 7차 회의에서도 여야는 의견차를 좁히지 못했다. 국회 외교통상통일위원회가 이날 전체회의와 법안심사소위원회를 잇달아 열고 한·미 FTA 비준동의안 논의에 들어가는 등 일단 공은 상임위로 넘어가지만, 야당이 ‘10+2 재재협상안’ 주장을 굽히지 않고 있어 비준동의안 처리에 난항이 예상된다.야당은 이날 여·야·정 회의에서 정부 측이 통상절차법 제정에 동의했음에도 “야당 요구를 거의 수용하지 않았고 그나마 수용한 내용도 미흡하기 짝이 없다”고 주장했다.남경필(한나라당) 국회 외통위원장은 이날 여·야·정 회의에서 “피해가 예상됐던 부분의 대책을 공고히 세우고 되도록 빠른 시간 내에 여야 합의로 비준동의안을 통과시킬 수 있게 최선을 다하겠다”고 말했다.유기준 한나라당 외통위 간사는 “그동안 여·야·정 협의체에서 농·수·축산업 대책에 대해 많은 협의를 했고 야당의 ‘10+2 협상안’에 대해서도 여러 분야에 대해 머리를 맞대고 의논하면 좋은 해결책이 나올 것”이라며 “빠른 시일 내에 비준동의안이 처리돼야 한다”고 강조했다.한나라당은 오는 18일까지 외통위 절차를 마무리한 뒤 28일 본회의에서 처리를 시도한다는 구상이다.그러나 김동철 민주당 외통위 간사는 “국익에 도움되는 ‘좋은 FTA’는 찬성하지만 국익에 손상이 가는 ‘나쁜 FTA’까지 찬성할 수는 없다”며 “초강대국 미국과의 FTA는 국가 백년대계를 좌우할지도 모르기 때문에 신중하게 접근해야 한다”고 맞섰다.민주당은 현 시점에서 재재협상은 현실적으로 어렵다는 판단을 하면서도 중소상인과 농·수·축산업자 보호장치 확보 및 예산 반영, 개성공단 생산제품의 한국산 원산지 인정을 위한 미국의 양해조치 마련 등이 충족되지 않는 한 비준동의안 처리에 협조할 수 없다는 입장이다.게다가 정부·여당이 민주당 요구를 상당 부분 수용하더라도 남은 변수들이 있다. 원천적으로 한·미 FTA를 반대하는 민주노동당 등은 물리적 저지에 나설 가능성이 높다. 또 민주당 내에서 야권 연대를 이유로 비준동의안 처리를 반대하는 강경론이 힘을 얻을 가능성도 있다.김성훈기자 tarant@munhwa.com[Copyrightⓒmunhwa.com '대한민국 오후를 여는 유일석간 문화일보' 무단 전재 및 재배포 금지(구독신청:02)3701-5555)]"
64,2011-10-13,"[단독]롯데제과 100% 성분 자일리톨껌 인증받고,</br>시중엔 60~80% 함유 제품 팔아",https://news.naver.com/main/read.nhn?mode=LSD&mid=shm&sid1=101&oid=008&aid=0002630609,머니투데이,"[머니투데이 김정태 기자]-2009년 식약청 건강기능 인증 자일리톨껌은 미출시-60~80%성분 제품 유통시키고 대대적 '과장'홍보대형 제과업체들의 자일리톨 껌 과대·과장광고에 대한 네티즌의 비난이 빗발치는 가운데, 롯데제과가 2009년 당시 자일리톨 100% 성분의 츄잉 껌으로 건강기능식품 인증을 받아 놓고서도 정작 시장에는 자일리톨 성분이 60~80%에 불과한 제품을 유통시켰던 것으로 드러났다.롯데제과는 식품의약품안전청에서 인증 받은 제품과 시중에 판매하는 제품의 자일리톨 함량이 엄연히 다른데도, 인증 받았다는 사실 자체만을 대대적으로 홍보해 소비자들로 하여금 마치 인증된 제품이 판매되는 것처럼 여기도록 현혹시켰다는 게 관계당국의 설명이다.13일 머니투데이가 국회 보건복지위원회 소속 이낙연(민주당) 의원을 통해 입수한 자료에 따르면 롯데제과는 2009년 3월 식약청으로부터 자일리톨 성분의 츄잉 껌으로 건강기능식품 인증을 받았다. 인증 당시 제품명은 '품목 신고 또는 수입 신고 시' 정하도록 돼 있었지만 롯데제과는 인증만 받아 놓고 정작 제품 출시는 하지 않은 것으로 확인됐다.자일리톨은 천연소재 비발효성 5탄당 알코올 감미료로 단맛이 설탕의 4배에 달하기 때문에 가격도 설탕보다 10배 비싸다. 이 때문에 롯데제과가 원가가 비싼 100% 자일리톨이 함유된 제품 대신 함유량이 낮은 제품으로 생산 단가를 낮춘 것이 아니냐는 지적을 받고 있다.롯데제과는 식약청으로부터 자일리톨 껌이 제품의 효능을 과대광고했다는 이유로 적발당해 현재 관할 지방자치단체인 영등포구청의 조사를 받고 있다. 롯데제과 관계자는 이에 대해 ""제품 표시나 광고에 건강기능식품이라고 표시한 적이 없고 다만 홈페이지에  '건강기능식품'이라고 소개했으나 결국 삭제했다""며 억울하다는 입장이다.하지만 식약청은 롯데제과가 정부기관을 '상술의 수단'으로 이용해 소비자들을 호도시켰다고 지적했다. 식약청 관계자는 ""일반인들에게 알리는 홈페이지도 허위사실을 알릴 경우 과대·과장광고로 간주하고 있다""면서 ""롯데제과의 경우 식약청 인증을 다르게 이용한 사실을 왜 인정하지 않느냐""며 불쾌한 기색을 감추지 않았다.앞서 롯데제과는 2009년 많은 매체을 통해 자일리톨 껌을 홍보하면서 건강기능식품 인증을 받았다는 사실도 널리 알렸다. 롯데제과는 자일리톨 껌으로 연간 매출 1000억원을 돌파하며 전체 자일리톨 껌시장(1200억원)을 독식하다시피 했다. 올해로 출시 11년째 맞은 롯데 자일리톨 껌은 지난해 말까지 거둔 총매출액이 1조3000억원으로 단일 껌 제품 가운데 최대 히트제품이다.[오늘의 핫이슈] 돈이되는 증권정보, 당신의 투자파트너![머니투데이 핫뉴스]☞""스무살에 '잡스'라는 분 알았다면, 안 썼을 것""☞현대차 '정가판매' 해보니…소비자가 더 좋아해?☞김포-제주 항공료 7년째 왜 안오를까☞외국계 인수 12년 매물로 나온 딤채 '먹튀논란'☞'페이스북' 한판 붙자…카카오톡 '메신저'→'플랫폼' 진화김정태기자 dbman7@<저작권자 ⓒ '돈이 보이는 리얼타임 뉴스' 머니투데이, 무단전재 및 재배포 금지>"
65,2011-10-13,여성 총인구 늘었지만 가임인구는 줄어,https://news.naver.com/main/read.nhn?mode=LSD&mid=shm&sid1=101&oid=001&aid=0005315664,연합뉴스,"사진은 지난해 열린 '뮤즈맘 콘서트' 행사 모습. (자료사진)60세이상 고령자의 35% 생활비 직접 마련친목·동호회 활동비율 학력에 비례(서울=연합뉴스) 김준억 구정모 김용래 기자 = 여성 인구가 늘었지만, 가임연령 여성은 감소했으며 여성의 모든 연령층에서 미혼 비율이 늘어난 것으로 나타났다.초등학생의 절반가량은 학원이 보육기능을 담당하고 있었으며, 60세 이상 고령자의 3분의 1 이상이 생활비를 본인이 직접 마련하는 것으로 나타났다.이런 내용을 담아 통계청은 13일 `2010년 인구주택총조사 표본집계결과' 가운데 여성·아동·고령자·활동제약·사회활동 부문 자료를 발표했다.◇가임연령 여성 5년간 2.8% 줄어‥미혼율 강남구 최고여성인구의 고령화로 가임연령(15~49세) 여성이 줄면서 출산력 기반이 약해졌다. 지난해 11월 현재 여성인구는 2천415만명으로 2005년보다 2.4% 증가했으나 가임연령 여성은 1천273만5천명으로 2005년보다 2.8% 감소했다.연령대별로는 2005년 조사에서 30대(17.3%)의 비중이 가장 높았지만, 지난해는 60세 이상(18.0%)이 가장 주된 연령층으로 떠올랐다. 여성의 중위연령도 39.3세로 5년 전보다 3.3세 높아졌다.교육정도를 보면 25세 이상 여성인구 가운데 대학 이상은 570만8천명(32.9%)으로 2005년의 429만7천명(26.7%)보다 141만1천명 늘었다.15세 이상 여성 가운데 배우자가 있는 여성은 1천160만8천명(56.9%)이며 미혼 527만1천명(25.8%), 사별 263만6천명(12.9%), 이혼 88만9천명(4.4%) 등이었다.지난 5년 동안 모든 연령층에서 미혼 비율이 증가했으며 주 혼인연령층(25~34세)의 증가세가 두드러졌다. 25~29세 여성의 미혼율은 10.2%포인트(59.1%→69.3%), 30~34세는 10.1%포인트(19.0%→29.1%) 증가했다. 생애독신율로 볼 수 있는 45~49세 여성의 비혼비율도 2005년 2.4%에서 지난해 3.3%로 높아졌다.25~29세 여성의 미혼율이 가장 높은 지역은 서울 강남구(86.1%)였으며 관악구(85.4%), 종로구(84.6%) 등의 순이었다. 반면 군부대가 많은 강원 지역은 낮았다. 화천군이 29.0%로 가장 낮았고 양구군(35.2%), 인제군(35.3%) 등이 뒤를 이었다.15세 이상 기혼여성의 평균 출생아 수는 2.38명으로 2005년(2.43명)보다 0.05명 줄었다. 기혼여성의 교육정도별 평균 출생아 수는 초등학교 이하가 3.64명, 중학교 2.43명, 고등학교 1.99명, 대학 이상 1.69명으로 학력이 높아질수록 출생아 수는 적었다.다만 가임 기혼여성(15~49세)의 평균 기대자녀수(출생아수＋추가계획자녀수)는 1.96명으로 2005년(1.91명)보다 0.05명 늘었다.◇초등생 절반 학원이 돌봐줘…60세 이상 3명중 1명 생활비는 스스로초등학생의 절반가량이 학원에서 보육을 맡고 있는 것으로 나타났다.초등학교 재학 이하(0~12세) 아동 626만4천명의 주간 보육상태를 조사한 결과(단일응답+복수응답) 자녀의 부모가 일부라도 돌보는 경우는 48.0%로 나타났다.이어 학원(26.4%), 어린이집ㆍ놀이방(16.9%), 조부모(10.2%) 등의 순이었다. 혼자, 아동끼리 있는 경우도 4.4%나 됐다.아동의 연령이 낮을수록 부모가 돌보는 비율이 올라가 0세에선 81.1%로 가장 높았다.미취학 연령인 0~6세의 경우 유치원과 어린이집ㆍ놀이방에서 돌보는 비율이 51.2%로, 부모가 돌보는 비율(52.2%) 다음으로 높았다.초등학생인 7~12세는 49.0%가 학원에 갔다. 또 방과후 학교에 있다는 이들도 16.3%에 달했다. 이 연령대에선 학원은 연령이 높을수록, 방과후 학교는 연령이 낮을수록 높았다.아동이 1명일 때 45.6%, 2명 49.0%, 3명 이상 51.4% 등 아동 수가 많을수록 부모가 돌보는 비율이 높았다.또 세대구성별로 3세대 이상 가구에선 조부모가 아동을 돌보는 비율이 30.7%로 높은 것으로 조사됐다.60세 이상 인구의 34.7%는 생활비를 본인 스스로 마련하고 있었다. 본인 스스로 마련한다는 응답엔 본인 또는 배우자의 일 및 직업, 예ㆍ적금, 공적연금, 개인연금, 부동산, 주식ㆍ펀드ㆍ채권 등이 포함된다.스스로 마련한다는 비율은 2005년 조사 때의 31.8%보다 2.9%포인트 증가했다.생활비 원천으로 '함께 사는 자녀'에 기댄다는 응답은 2005년보다 6.2%포인트, '따로 사는 자녀'는 4.7%포인트 각각 감소해 자녀에 대한 의존이 낮아진 것으로 나타났다.특히 생활비를 스스로 마련하는 비율은 대학 이상이 51.7%, 고등학교 46.1%, 중학교 40.6%로 학력이 높을수록 자립하는 이들의 비율이 높았다.65세 이상 고령자는 2010년 현재 542만5천명으로 2005년 436만5천명보다 105만9천명(24.3%)이 증가했다.지역별로 동지역이 361만8천명(66.7%), 읍면지역은 180만6천명(33.3%)이었고, 동지역의 고령인구 증가가 읍면지역보다 높았다.65세 이상 고령자가 거주하는 가구는 407만4천가구로, 전체 가구의 23.5%를 차지했다.고령자 1인가구는 106만6천가구로 전체 1인가구(414만2천가구)의 25.7%에 달했다.고령자 가구의 자기집 거주비율은 73.8%로 2005년 때보다 1.8%포인트 감소했고, 전세 거주비율은 13.2%로 5년 전보다 1.0%포인트 증가했다.◇학력 높을수록 동호회나 친목단체 참여도 늘어15세 이상 인구 중 사회단체나 동호회에서 활동하는 인구를 일컫는 사회활동 참여인구는 총 1천272만5천명으로 전체의 32.1%로 나타났다. 남자의 사회참여율은 33.8%로, 여자(30.5%)보다 비율이 3.3%포인트 높았다.사회활동은 단체 또는 동호회에 가입해 활동하고 있는 경우를 뜻하며, 회비만 납부하는 활동은 조사에서 제외됐다.사회활동 참여분야는 친목단체가 16.6%로 가장 높고, 종교분야 10.3%, 문화분야 5.6% 순으로 나타났다. 연령이 높을수록 사회활동 참여율은 늘어 50~54세에서 가장 높은 41.4%의 비율을 보였으며 그 이후에는 감소했다.분야별 주된 참여연령을 보면, 사회와 경제 분야는 45~49세, 문화분야는 40~44세, 종교분야는 65세 이상, 교육단체는 35~39세로 나타났다.사회활동 참여율이 가장 높은 지역은 강원(36.0%), 제주(35.4%), 충남(35.1%) 순이며, 낮은 지역은 대구(29.2%), 인천(29.7%), 경기(30.6%) 순으로 나타났다.사회활동 참여율은 고학력일수록 높아져 대학원 이상이 55.7%로 가장 높았다. 학력별 사회활동 참여율은 대학교 37.6%, 고등학교 29.8%, 중학교 29.1%, 초등학교 26.3% 등의 순으로 나타났다.5세 이상 인구 중 활동에 제약을 받는 사람은 344만5천명(7.6%)이었다. 유형별로는 걷기 등 이동제약이 5세이상 인구의 5.1%를 차지해 가장 많았고, 시·청각·언어장애 2.0%, 장보기와 병원가기 등 일상생활 제약이 1.6% 순으로 나타났다.연령별 활동제약률은 70세 이상이 44.5%로 가장 높았고 29세 이하는 1.5%였다.지역별 활동제약률은 65세 이상 인구 비율과 높은 상관관계를 보여 전남이 12.8%로 가장 높고, 울산이 5.4%로 가장 낮았다.활동 제약자가 있는 가구는 전체가구의 15.1%인 261만 가구였으며 활동 제약자가 있는 가구의 63.4%는 자가주택에 거주하는 것으로 나타나 일반가구의 자가거주율(54.1%)보다 높았다.justdust@yna.co.krpseudojm@yna.co.kryonglae@yna.co.kr[관련기사]▶ 최근 5년간 주택증가율이 인구증가율 5배▶ 서울 평균 통근·통학시간 41.2분▶ 서울 `전통핵가족' 줄고 `소핵가족' 늘었다(종합)▶ 서울 인구밀도 20년간 하락..경기는 2배▶ '2인 가구'가 우리나라 대표적 가구구성<연합뉴스 모바일앱 다운받기><포토 매거진><저작권자(c)연합뉴스. 무단전재-재배포금지.>"
66,2011-10-13,기준금리 넉달째 제자리.. 물가는 어쩌나 (상보),https://news.naver.com/main/read.nhn?mode=LSD&mid=shm&sid1=101&oid=277&aid=0002680667,아시아경제,"[아시아경제 채지용 기자] 김중수 한국은행 총재가 금리정상화를 꾸준히 주장하고 있는데도 불구하고 글로벌 금융위기가 장기화되면서 기준금리는 4개월째 제자리를 맴돌고 있다. 대외불확실성에 따른 경기 하방위험을 견제하는 게 중요하다는 판단이다. 상황이 호전되지 않는다면 내년에는 금리인하 가능성까지도 점쳐지고 있는 가운데 물가가 걱정이다.최근 다소 완화됐다고는 하지만 미국의 경기둔화, 유럽 재정위기 우려에 따른 글로벌 경기침체 가능성은 여전히 우리경제에 암울한 그림자를 드리우고 있다. 대외의존도가 높은 특성상 세계경제 둔화는 수출부진 등을 야기하며 우리경제에 큰 타격을 준다. 지난달 무역수지는 아시아권 국가에 대한 수출이 증가하면서 두 자릿수 흑자를 기록했지만 앞으로 흑자폭이 더 늘어나기를 기대하기란 힘들 것으로 전망된다. 미국, 유럽발 위기는 이미 세계적인 경기둔화를 가속화시키고 있다.이에 따라 세계 각국에서는 경기부양을 위한 금리인하 정책이 잇따르고 있다. 지난 8월 금리를 전격 인하한 브라질 중앙은행은 추가 금리인하를 검토 중이며 이스라엘과 인도네시아도 물가안정 보다는 경기부양을 택했다. 대외 정세가 호전되지 않는 다면 우리나라도 내년에도 금리를 인하할 수 있다는 주장에 힘을 보태는 대목이다.물가상승률이 다소 꺾였다는 점도 금리동결에 따른 부담감을 덜어줬다. 지난달 소비자물가상승률과 생산자물가지수는 모두 전달에 비해 둔화됐다.하지만 소비자물가상승률은 여전히 4%를 웃도는 고공행진을 지속하고 있다. 설상가상으로 최근 환율이 급등하면서 앞으로 물가압력이 가중될 수 있다는 우려의 목소리도 나오고 있다.김의찬 대신증권 이코노미스트는 “국내물가 상황은 안정세로 들어섰지만 환율 복병이 물가를 위협하는 ‘산 넘어 산’의 형국을 보이고 있다”며 “최근 원달러 환율의 급격한 상승은 수입물가지수 상승으로 이어질 가능성이 높아졌다”고 분석했다. 이어 그는 “인플레이션 압력을 방치할 경우 만성화돼 내년에도 한국 경제에 부담으로 작용할 것”이라고 덧붙였다.이정준 HMC투자증권 이코노미스트도 “수요 인플레이션 압력을 의미하는 근원인플레이션이 4%대까지 상승하는 가운데 소비자들의 인플레이션 기대심리가 확대되고 있는 점이 부담스러운 상황”이라며 “수요와 기대 인플레이션을 적절히 통제하지 못하면 공급충격의 2차 효과가 본격화돼 한 단계 높은 인플레이션이 고착화될 가능성이 크다”고 밝혔다.아울러 최악의 상황에 대비해야 한다는 지적도 있다. 유럽 위기가 장기화되고 있는 가운데 급격한 신용경색을 불어올 수 있는 돌발사태에 대비해 금리를 어느 정도 높은 수준으로 유지할 필요가 있다는 것이다.[모바일] 언제어디서나 만날 수 있는 내 손안의 아시아경제[아시아경제 SNS] 부자되는 뉴스~ 친구와 공유하세요!채지용 기자 jiyongchae@<ⓒ세계를 보는 창 경제를 보는 눈, 아시아경제(www.asiae.co.kr) 무단전재 배포금지>[관련기사]▶ ""이승기가 떠난 강호동한테 던진 한 마디""▶ '하유미팩' 팔아 '떼돈' 벌더니 이럴 줄은…▶ ""강호동 힘내라"" 설마했는데 이런 식으로…▶ '석선장' 총 쐈던 해적들 요즘 무기에 ""경악""▶ 스티브 잡스 '사망진단서' 살짝 엿봤더니 ""헉"""
