,날짜,기사 제목,기사 링크,기사 출처,기사 내용
26,2011-10-13,성장판 시술 미끼로…학생정보 수집 허위 청구,https://news.naver.com/main/read.nhn?mode=LSD&mid=shm&sid1=102&oid=055&aid=0000214562,SBS,"<8뉴스><앵커>'우리 아이는 앞으로 얼마나 클까?' 부모님 아이들 성장판 검사 많이 하실텐데, 무료 성장판 검사를 미끼로 학생들의 신상정보를 수집해 허위 보험급여를 타낸 의사들이 경찰에 적발됐습니다.장훈경 기자입니다.<기자>서울의 한 빌딩.지난 2008년 4월 이 건물 2층에 있는 영어학원에, 4층에서 병원을 운영하는 원장이 찾아왔습니다.원장은 성장판 검사와 시술을 무료로 해 줄테니 학생들을 데려오라고 권유했습니다.[영어학원 관계자 : 아이들 성장판을 자극해서 키 크는 체조를 한다고 했어요.]호르몬 주사, 약물 요법 등을 1주일에 1~2회씩 주기적으로 하는 일반적인 성장판 시술과 달리, 이 병원은 한 달에 한 번 몇몇 아이들에게만 체조를 시키고 침을 놓았습니다.병원 측이 효과도 없는 무료 성장판 시술을 미끼로 학원가나 스포츠센터에 접근한 건 초등학생이나 중학생의 인적사항을 확보하기 위해서였습니다.이런 방식으로 학생 130명의 인적사항을 확보한 병원장은 실제로는 치료하지도 않은 감기나 발목 통증으로 진료를 했다고 기록을 위조해 보험급여를 청구했습니다.청구 건수는 3800건을 웃돌고 부당 지급받은 보험급여는 5400만 원에 이릅니다.[김영오/국민건강보험공단 송파지부 과장 : 성장판 검사는 국민 보험에 적용되지 않는 비급여 항목입니다. 그 비급여 항목을 건강보험이 적용이 되는 다른 병명으로 허위 부당청구를 한 것으로 여겨집니다.]경찰은 병원장 41살 김모 씨와 성장판 검사와 시술을 도운 한의사 40살 배모 씨 등 2명을 불구속 입건했습니다.(영상취재 : 설민환, 영상편집 : 채철호)장훈경rock@sbs.co.kr관/련/정/보◆ 의사가 성장판 검사 후 허위기록해 보험금 타내◆ 보험금 타내려 살해시도한 보험설계사 구속◆ '접촉사고에 드러누운' 택시기사 24명 입건◆ 마술사가 교통사고 가장해 보험금 '꿀꺽'☞[SBS기자들의 생생한 취재현장 뒷이야기 '취재파일']☞ SBS뉴스 공식 SNS [SBS8News 트위터] [페이스북] [미투데이] [요즘]저작권자 SBS&SBS콘텐츠허브 무단복제-재배포 금지"
27,2011-10-13,은행，20년 단골은 뒷전 고액 손님이 최고,https://news.naver.com/main/read.nhn?mode=LSD&mid=shm&sid1=101&oid=014&aid=0002527043,파이낸셜뉴스,"#. 서울 여의도에 위치한 한 사회적 기업에 근무하는 L씨(47)는 최근 전세가격을 올려달라는 집주인의 요구에 이사를 결심했다. 부족한 전세자금 1억원은 대출을 받기로 했다. 가장 먼저 달려간 곳은 20년 동안 주거래은행으로 거래해온 농협. L씨는 농협에 급여이체통장은 물론 적금과 보험도 가입해 있다. 기본으로 사용하는 신용카드도 농협카드다. 상담 결과 1억원 빌리는 데 대출이자는 5.8%가 적용됐다. L씨는 '혹시' 하는 생각에 옆에 있던 우리은행 창구를 찾았다. 아무런 거래가 없어 상담이나 한번 받아보자고 생각한 것. 1억원 대출받는 데 금리는 5.5%였다. 오랜 기간 믿고 거래하던 주거래은행보다 대출금리가 낮았던 것.'이 은행 저 은행 거래하지 말고 한 은행과 거래하라'는 말은 요즘 금융비용을 절약하기 위한 필수전략으로 자리 잡았다. 재테크 전문가들이 입에 달고 사는 말이라 이젠 이 말을 모르는 사람이 없을 정도다. 그러나 실제로 은행이 주거래고객에게 주는 혜택은 극히 미미한 것으로 드러나 소비자들에게 충격을 주고 있다.■천대받는 '주거래고객'13일 은행권에 따르면 시중은행들은 고객등급을 은행실적에 기여한 정도에 따라 분류하고 있다. 등급이 높을수록 각종 수수료 면제 등 혜택이 넓어진다. 오랜 기간 거래해 온 '주거래고객'이라 할지라도 실적이 좋지 않으면, 즉 '우수고객'에 들지 않으면 혜택은 거의 없다는 얘기다. 심지어 시중은행들은 직전 3개월간 거래실적을 평가해 분기별로 주거래 고객등급을 새롭게 선정하고 있는 형편이다. 이런 판에 오랜 기간 거래가 의미 있을 리 없다.국민, 우리, 신한, 하나 등 4대 시중은행 중 '주거래고객 등급제'를 유지하고 있는 곳은 신한은행이 그나마 유일한 형편이다. 신한은행은 탑스클럽(Tops Club)제도를 통해 주거래고객을 4단계로 분류한다. 거래 기간을 비롯해 예금과 대출금 등 실적을 기초로 약 207만명을 '주거래고객(탑스클럽)'으로 분류하고 있다.국민은행은 4단계, 우리·하나은행도 5단계로 고객등급을 분류한다. 그러나 이들 은행은 주거래고객을 별도로 분류하지는 않는다. 전체 고객을 대상으로 단순히 거래실적에 따라 고객등급을 차등화해 혜택을 주는 개념이다. 오랫동안 거래한 '소액단골' 고객은 전혀 혜택을 받지 못할 수도 있다는 얘기다. 주거래고객이 아니라도 거래규모만 크면 최우수등급으로 분류돼 칙사 대접을 받을 수 있다. 한마디로 소액 단골고객은 안중에 없는 셈.신한은행 관계자는 ""보통 분기별로 우수고객에 대한 등급을 조정하는데 일부 은행들은 전월 실적을 기준으로 매월 등급을 분류하는 곳도 있다""며 ""수익을 내야 하는 은행 입장에선 오랜 기간 거래를 해왔다고 해서 거래규모가 작은데도 무조건 우수고객으로 분류하지 않는 것이 현실""이라고 말했다.■우수고객 혜택의 핵심은 '수수료 면제'그렇다면 우수고객이 되면 혜택은 얼마나 클까. 느낄 수 있는 혜택은 수수료 면제 정도다. 대부분 은행들은 창구수수료, 현금자동화기기(CD/ATM), 전자금융(인터넷, 폰뱅킹) 자기앞수표 발행, 제증명 발급, 대여금고, 납부자동이체 등 고객등급에 따라 각종 수수료를 면제해 준다.하지만 거래실적을 점수로 환산해 3개월마다 등급을 정하기 때문에 단기간 높은 점수를 적립하기가 쉽지 않다. 신한은행의 경우 최상위등급인 '프리미어 고객'이 되려면 2000점이 필요하다. 입출식 수신은 10만원당 3점, 가계대출은 100만원당 7점을 주는 식이다.대부분 대출이 많은 고객일수록 높은 등급을 받게 되지만 혹여 상환을 하게 되면 점수는 사라진다. 특히 최근에는 가입조건에 따라 수수료 혜택을 주는 상품도 많아 굳이 점수를 따지 않더라도 상품만 잘 고르면 각종 수수료 면제가 가능하다. 예금이나 대출에서는 더욱 혜택이 적다. 경기상황에 따라 금리수준이 결정되는 데다 대출의 경우 신용도에 대한 평가가 많이 반영되기 때문에 주거래고객이라고 낮은 금리를 주지는 않는 구조다.전직 은행원인 K씨는 ""주거래고객이라고 해도 거래규모가 크지 않으면 혜택이 없는 것이 현실""이라며 ""특히 요즘에는 상품에 따라 다양한 수수료 혜택을 주기 때문에 상품만 잘 고르면 우수고객들과 동일한 혜택을 누릴 수 있다""고 밝혔다./toadk@fnnews.com김주형기자■ 오늘의 핫뉴스▶ “한 달에 수천만원 벌었는데..” 무너지는 꿈▶ 하이브리드 중고차, 2개월만에 ‘X값’▶ 20년 단골 손님보다.. 고액 대출고객이 왕▶ 아이폰4S 시리(Siri)에게 ‘사랑해’…답변 ‘시크하네’▶ 안산 막말 교장, 女교사에 ‘니 속옷 안이나..’※ 저작권자 ⓒ파이낸셜뉴스. 무단 전재-재배포 금지[☞ First-Class경제신문 파이낸셜뉴스 구독신청하기]"
28,2011-10-13,[단독] 인터넷 '매너남' 알고보니 전과 5범,https://news.naver.com/main/read.nhn?mode=LSD&mid=shm&sid1=102&oid=055&aid=0000214563,SBS,"<8뉴스><앵커>인터넷 사이트에서 만난 여성을 농락한 절도범이 붙잡혔습니다. 온라인에선 다정다감하던 사람이었는데 만나보니 사기와 절도, 전과 5범이였습니다.박원경 기자의 단독 보도입니다.<기자>공연 감상 동호인들이 많이 모이는 인터넷 사이트입니다.A 씨는 몇 달 전, 한 남자가 함께 공연을 보자고 올린 글을 보고 별다른 의심없이 같이 공연을 보기로 했습니다.공짜로 공연을 보여준 이 남자는 자신이 유명 사립대학교에 교환학생으로 온 프랑스인이라고 소개했습니다.그런데 이 남자는 공연이 끝나고 장소를 옮긴 뒤 A 씨가 잠시 자리를 비운 사이 가방을 훔쳐 사라졌습니다.사라진 남자는 28살 정모 씨.자신을 외국인으로 소개했지만 실제로는 이국적인 외모를 가진 전과 5범의 한국인이었습니다.정 씨는 자신의 블로그에 공연과 영화, 사진과 그림 등 온갖 문화 정보들을 올려놓고 세련된 사람처럼 행세했으며, 다른 사람들의 글에 일일이 댓글을 다는 친절함을 보였습니다.정 씨는 또 인터넷을 통해 만난 여성들에게 ""자신은 외국인이라 휴대전화를 개통할 수 없으니 여성 명의로 전화를 개통해달라""고 부탁하고는 전화를 넘겨받아 사라지기도 했습니다.전화기 값과 통화료는 여성들이 물어야 했습니다.이런 식으로 피해를 입은 여성은 지금까지 확인된 사람만 6명.경찰은 절도와 사기혐의로 정 씨를 구속하고 여죄를 추궁하고 있습니다.(영상취재 : 설민환, 영상편집 : 김경연)박원경seagull@sbs.co.kr관/련/정/보◆ 인터넷 증권방송 시세조종 적발◆ 채팅사이트서 만난 여중생 성폭행 40대 영장◆ 여자 행세 '채팅성매매' 사기범 징역1년◆ 대학생 인터넷매매 사기 '어머니 도우려고'☞[SBS기자들의 생생한 취재현장 뒷이야기 '취재파일']☞ SBS뉴스 공식 SNS [SBS8News 트위터] [페이스북] [미투데이] [요즘]저작권자 SBS&SBS콘텐츠허브 무단복제-재배포 금지"
29,2011-10-13,"`블랙베리 불통` RIM, 대규모 손해배상 위기",https://news.naver.com/main/read.nhn?mode=LSD&mid=shm&sid1=105&oid=018&aid=0002505702,이데일리,"- 보다폰-텔레포니카 등 `손배 제기` 시사[뉴욕= 이데일리 이정훈 특파원] 유럽 등지를 중심으로 사흘째 계속되고 있는 블랙베리의 불통사태로 리서치인모션(RIM)이 대규모 손해배상 청구에 휘말릴 위험에 처했다.현재 영국에서는 이번주 블랙베리 사용자들이 네트워크 불능으로 메시지와 웹브라우징 서비스를 이용하지 못하고 있고, 다른 유럽과 중동국가들에서는 데이터 서비스가 이뤄지지 않고 있다.13일(현지시간) 블룸버그에 따르면 세계 최대 이동통신업체인 보다폰그룹 등 유럽 통신사들이 블랙베리 제조사인 RIM을 상대로 손해배상 소송을 제기할 움직임을 보이고 있다.보다폰의 사이먼 고든 대변인은 이날 ""하나의 옵션으로서 손해배상 청구소송을 검토하고 있다""고 확인했다.스페인 최대 통신사인 텔레포니카 역시 ""계속된 서비스 장애로 인해 가입자들에게 피해보상을 해야할 지 모른다""며 상황에 따라 RIM을 상대로 소송을 제기할 수 있음을 시사했다.또 중동의 아랍에미리트 최대 이동통신사인 에미리츠 텔레커뮤니케이션즈는 ""모든 블랙베리 고객들에게 피해를 보상하겠다""고 밝혔다.RIM측은 이들 통신사들로부터 실제 손해보상 청구가 있었는지에 대해서는 확답을 피하고 있는 상태다.CCS인사이트의 벤 우드 애널리스트는 ""이번 사태는 아주 수위가 높은 통화불능 사태로, 누구나가 이동통신사들의 잘못이 아니라 RIM의 잘못이라는 걸 알고 있다""고 지적했다.실제 이번 서비스 장애 원인에 대해 RIM측은 ""시스템이 고장 났을 때 작동하는 백업 스위치에 문제가 생겼다""고 밝히고 있다.▶ 당신의 생활 속 Anytime Anywhere이데일리 모바일 http://m.edaily.co.kr▶ 경제중심 종합일간지 `이데일리신문`구독신청 02-3772-9488▶ 독자와 소통하는 이데일리 SNS 서비스트위터/페이스북＜ⓒ종합 경제정보 미디어 이데일리 - 무단전재&재배포 금지＞＜스마트 경제방송채널 -이데일리TV＞"
30,2011-10-13,[단독] 어린이 젤리에 '금속 실'…전량 회수,https://news.naver.com/main/read.nhn?mode=LSD&mid=shm&sid1=102&oid=055&aid=0000214564,SBS,"<8뉴스><앵커>아이들이 먹는 간식용 젤리에서 금속성 실로 보이는 이물질이 나왔습니다. 이 제품을 수입한 한국 암웨이는 제품 전량 회수에 나섰습니다.최재영 기자의 단독 보도입니다.<기자>최근 아이들 고급 영양 간식으로 주부들 사이에서 인기가 있는 암웨이산 뉴트리 키즈 오메가 젤리입니다.주부 김모 씨는 어제(12일) 한국 암웨이로부터, '뉴트리 키즈 오메가 젤리'에서 이물질이 나왔으니 물건을 반품해 달라는 전화를 받았습니다.[김모 씨 : 구입해서 1년 넘게 먹이고 있었는데, 제가 먹었으면 괜찮은데 아이가 먹었으니까 화가 났어요.]한국 암웨이는 지난 8월 1일부터 이달 4일까지 판매된 제품 가운데 일부에서 금속실로 보이는 이물질이 나왔다는 소비자 신고가 접수돼, 전량 회수에 들어갔다고 밝혔습니다.[진정아/한국암웨이 홍보실 차장 : 현재 미국 본사와 공조해서 해당된 제품에 이것들이 어떻게 유입이 됐는지를 확인하고 있습니다.]암웨이는 이물질이 나온 제품의 유통기한은 2012년 6월2일로 돼 있으며, 식약청에도 자진신고했다고 밝혔습니다.[식약청 관계자 : (암웨이 제품 이물질 관련해서)신고된 거는 맞습니다. 조사 중에 있습니다.]이 기간 동안 만들어진 제품 1만9000개 중 1만4000개는 이미 아이들이 있는 가정으로 유통됐습니다.제품 회수에 별 문제가 없다는 암웨이 측의 설명에도 불구하고, 실제 회수율이 매우 낮은 수준입니다.암웨이가 그제(11일)부터 제품 회수에 들어갔지만, 사흘 간 회수된 제품은 220개로 회수율은 1.5%에 그치고 있습니다.한국 암웨이는 회수된 제품에 대해서는 소비자들에게 전량 환불해주고, 해외공장에서 제품 생산도 일시 중단했다고 밝혔습니다.(영상취재 : 이원식, 영상편집 : 박선수)최재영@관/련/정/보◆ 통조림에서 내분비계 교란 '환경호르몬' 검출◆ 상반기 이물 신고 3천여건…절반은 원인 몰라◆ 이물질 사고 절반이 ""어떻게 들어갔는지 몰라""◆ 식품 이물질 절반은 유입 원인 못밝혀☞[SBS기자들의 생생한 취재현장 뒷이야기 '취재파일']☞ SBS뉴스 공식 SNS [SBS8News 트위터] [페이스북] [미투데이] [요즘]저작권자 SBS&SBS콘텐츠허브 무단복제-재배포 금지"
31,2011-10-13,체감물가 양극화…저소득층이 고통 더 컸다,https://news.naver.com/main/read.nhn?mode=LSD&mid=shm&sid1=101&oid=028&aid=0002114160,한겨레,"[한겨레]소득계층별 물가상승률 비교하위10% 상승률, 상위10%보다 최대 1.1%p↑저소득층이 식료품·주거비용 비중 높은 탓“양극화 고착 우려…서민부담 줄일 정책 필요”지난해 하반기부터 이어진 고물가의 고통은 특히 저소득층에 컸던 것으로 나타났다. 저소득층의 물가상승률이 고소득층의 물가상승률을 크게 웃돌고 있기 때문이다. 문제는 이런 소득계층별 ‘물가 양극화’가 고착될 우려가 있다는 점이다. 저소득층의 물가안정에 우선순위를 둔 정부정책이 필요하다는 지적이 나오는 이유다.<한겨레>가 12일 민간경제연구소 두 곳과 함께 ‘소득계층별 물가상승률’을 분석한 결과, 2010년 하반기 이후 저소득층과 고소득층의 물가상승률 격차가 최대 1%포인트 안팎까지 벌어진 것으로 조사됐다. 최근 물가상승률이 가장 높았던 지난 8월 저소득층(소득하위 10%)의 체감물가는 5.9%까지 치솟았다. 반면 고소득층(소득상위 10%)의 물가는 평균 물가상승률(5.3%)을 밑돈 5.2%에 그쳤다.지난해 10월과 올해 2~3월에도 저소득층의 체감물가는 통계청이 발표한 물가지수를 한참 웃도는 5%대를 기록했다. 같은 기간 고소득층의 체감물가는 3~4%대에 머물렀다. 특히 지난해 10월엔 저소득층과 고소득층의 체감물가 격차가 1.1%포인트까지 벌어진 것으로 나타났다. 이런 불균등한 물가상승은 1년가량 지속돼다 채소류 등 농산물가격이 안정된 올해 9월에야 다소 완화됐다. 소득 역진적 물가상승은 저소득층에 더 많은 물가 부담을 안기는 것으로 소득양극화 심화와 함께 서민 가계의 소비를 위축시키는 요인이다.물가지수와 체감물가 사이에 차이가 나는 이유는 계층별로 주로 소비하는 품목과 구입 양이 다르기 때문이다. 저소득층은 의식주 같은 생필품과 주거·수도 비중이 고소득층에 견줘 월등히 높지만, 고소득층은 교육·교통비, 외식·숙박비 등의 소비품목 지출 비중이 높다. 통계청 조사를 보면, 지난해 저소득층은 전체 소비의 20.46%를 식료품에, 15.96%를 주거·수도비용에 쓰지만 고소득층의 이들 품목에 대한 소비 비중은 각각 11.40%, 8.16%에 불과하다. 최근 저소득층의 소비가 많은 농수축산물 가격 등 식료품과 전셋값 같은 주거비가 가파르게 오른데다 저소득층일수록 이들 생필품 지출 비중이 높아 이들 계층의 물가상승률이 높게 나타난 것이다.이런 양상은 지난 2008년 고물가 시기와 확연히 다른 모습이다. 당시엔 식료품 등 생필품 가격은 안정된 반면, 고소득층 지출 비중이 높은 교육·유류비 상승률이 더 높아 고소득층의 체감물가 상승률이 더 높았다.계층간 불균등한 물가상승은 앞으로도 이어질 것으로 전망된다. 임희정 현대경제연구원 연구위원은 “하반기에도 대중교통요금, 전기·가스료 같은 공공요금 인상이 이어지고 있고 전셋값 오름세도 계속돼고 있어 서민들의 부담은 더 커질 것”이라고 말했다. 송태정 우리금융 수석연구위원도 “의식주와 관련된 생필품의 물가안정은 일자리 확대와 함께 민생복지 차원에서 접근할 필요가 있다”며 “생필품의 유통, 수급 등과 관련한 구조적인 개선과 다양한 정책 마련이 시급하다”고 지적했다. 또 “정부가 소득계층의 구매 특성을 반영한 물가지수를 조사·발표해야 정책 효과를 더 높일 수 있다”고 덧붙였다.   이재명 기자miso@hani.co.kr공식 SNS[통하니][트위터][미투데이]| 구독신청[한겨레신문][한겨레21]Copyrights ⓒ 한겨레신문사, 무단전재 및 재배포 금지<한겨레는 한국온라인신문협회(www.kona.or.kr)의 디지털뉴스이용규칙에 따른 저작권을 행사합니다.>"
32,2011-10-13,허위 진료로 보험급여 청구...수천만 원 '꿀꺽',https://news.naver.com/main/read.nhn?mode=LSD&mid=shm&sid1=102&oid=052&aid=0000376428,YTN,"[앵커멘트]개인정보를 도용해 허위 진료기록을 만든 뒤 보험급여 수천만 원을 타낸 의사들이 적발됐습니다.진료 기록과 치료 사실을 일일이 확인하지 않는다는 허점 때문에 가능했습니다.홍석근 기자가 취재했습니다.[리포트]키가 작아 고민인 초등 5학년 이 모 양이 받은 성장판 검사 기록입니다.이 양은 검사는 물론  키 크는 데 도움을 주는 전기자극 시술도 무료로 해준다는 병원 측의 말을 믿고 검사에 응했습니다.하지만, 병원은 이 양이 별도의 물리치료까지 받았다며 허위 진료기록을 만들었습니다.재활치료 전문 개인병원의 원장인 김 씨 등은 이처럼 진료기록을 허위로 작성해 최근 3년 동안 건강보험급여를 부당 청구했습니다.모두 4,200여 차례, 액수만 5,800만 원에 이릅니다.허위 청구에 필요한 환자 개인정보는 병원 인근 학원에서 아이들을 소개받아 입수한 것으로 조사됐습니다.[인터뷰:학원 원장]""무료로 성장치료 해주면서 더 많은 치료받길 원하는 아이들이 있으면 그 아이들을 고객으로 유치하려는 목적이라고. 서로 윈윈할 수 있는 거라고 얘기를 하더라고요.""심사 기관이 진료기록과 실제 치료 여부를 일일이 확인하지 않기 때문에 건강보험 급여를 타내는 일은 어렵지 않았습니다.[인터뷰:국민건강보험공단 관계자]""청구한 내역이 실제 진료했다고 전제하는 거죠.왜냐하면 의사가 청구를 했는데 건건마다 진짜 진료를 했냐, 안 했냐 환자들에게 확인할 수 있는 방법이 없기 때문에...""하지만, 병원장 김 씨는 실제 진료한 기록을 가지고 보험급여를 신청했다며 부당 청구 혐의를 부인했습니다.[인터뷰:김 모 씨, 피의자]""없는 환자를 부당 청구했다는 말인데 저는 그런 적이 없고 실제로 진료를 다 했고 거기에 추가로 성장에 대한 진료를 해준 것에 불과하기 때문에...""경찰은 김 씨 등 병원 의사 3명을 불구속 입건했습니다.YTN 홍석근[hsk8027@ytn.co.kr]입니다.[관련기사]▶ 치과의사가 매형 시켜 영어 대리시험▶ 무도장 돌며 여성 상대 사기 일당 구속▶ 교통사고 보험 사기 30여 명 검거▶ 교통사고 가장 보험금 받아낸 마술사 입건▶ '팔목치기' 보험 사기범 구속☞ [다운로드] 생방송과 뉴스속보를 한 눈에...YTN뉴스ON☞ YTN 긴급속보를 SMS로!☞ 스마트폰으로 즐기는 24시간 뉴스의 세계...YTN 어플리케이션[저작권자(c) YTN & Digital YTN. 무단 전재-재배포 금지]"
33,2011-10-13,"공정위, 삼성전자·LG전자 담합조사",https://news.naver.com/main/read.nhn?mode=LSD&mid=shm&sid1=101&oid=277&aid=0002681063,아시아경제,"[아시아경제 박현준 기자] 공정거래위원회가 삼성전자와 LG전자의 노트북 PC, 평판TV 가격담합 조사에 들어갔다.공정위는 최근 LG전자에 조사관을 보내 관련 의혹을 캐물었다. 다만 삼성전자에도 조사관을 보냈는지는 확인되지 않고있다.앞서 공정위는 양사의 불공정거래 의혹에 대해 조사를 하고 지난 8월24일 전원회의 안건에 올렸지만, 결론을 내리지 못하고 재조사 결정을 내렸다.[모바일] 언제어디서나 만날 수 있는 내 손안의 아시아경제26일 CEO 조찬포럼.. '잡스 이후 IT산업의 변화' 주제박현준 기자 hjunpark@<ⓒ세계를 보는 창 경제를 보는 눈, 아시아경제(www.asiae.co.kr) 무단전재 배포금지>[관련기사]▶ ""이승기가 떠난 강호동한테 던진 한 마디""▶ '하유미팩' 팔아 '떼돈' 벌더니 이럴 줄은…▶ ""강호동 힘내라"" 설마했는데 이런 식으로…▶ '석선장' 총 쐈던 해적들 요즘 무기에 ""경악""▶ ""쏘나타도 못 굴리는 남자랑 연애는 무슨…"""
