,날짜,기사 제목,기사 링크,기사 출처,기사 내용
22,2010-07-21,"""100조 부채 지방정부, 이대로 가면 줄도산""",https://news.naver.com/main/read.nhn?mode=LSD&mid=shm&sid1=100&oid=002&aid=0001963484,프레시안,"토목 개발은 '유바리시 악몽'으로 가는 지름길[프레시안 이대희 기자]지방정부의 부채 규모가 100조 원을 넘을 것으로 추정된다. 올해 국가예산(292조8000억 원)의 3분의 1이 넘을 정도로 크다. 특히 최근 들어 분야별로는 건설에서, 지역별로는 수도권에서 부채가 급증하는 것으로 파악됐다.최근 성남시가 모라토리엄을 선언하고, 인천시의 재정 상태가 기존 예상보다 더 취약한 것으로 드러나면서 지방자치단체의 재정건전성에 대한 경각심이 커진 상황이라 보다 철저한 재정 감시가 필요할 것으로 보인다.특히 낭비성 투자로 몰락한 도시의 상징이 돼 버린 일본 유바리시보다 재정 상황이 더 취약한 기초자치단체가 국내에도 매우 많은 것으로 드러나, 지방재정을 키우고 전시성 투자를 자제할 방안을 찾아야 할 것으로 보인다.21일 오후 참여자치지역운동연대 주최로 참여연대 느티나무홀에서 열린 토론회 '지방정부 재정위기 진단과 대안 모색'에서 정창수 좋은예산센터 부소장은 ""지방정부의 부채는 논쟁적 사안""이라고 전제하면서도 ""연기금 등을 제외하고 현재 정부 통계를 기준으로 증가 추세를 보수적으로 계산하더라도 올해 지방자치단체의 부채는 100조 원을 넘을 것""이라고 말했다.▲빠른 속도로 늘어나는 지방부채(단위 억원).. ⓒ프레시안좋은예산센터가 추산한 지자체들의 부채 합계액은 지난 2007년 말만 해도 59조5000억 원대였으나 이후 매년 큰 폭으로 증가, 작년에는 85조 원을 넘었고 올해는 102조 원가량에 달할 것으로 예상된다. 불과 3년 만에 두 배 가까이 빚이 늘어난 셈이다. 이는 지방채잔액과 지방공기업 부채, 보증채무와 임대형민자사업(BTL) 부채 등을 모두 합산한 수치다.정 부소장은 또 ""작년 재정위기로 인해 본예산 부채가 종전보다 32퍼센트 늘어났다""며 ""실질적으로는 (100조 원보다) 많은 부채 증가가 예상되고, 특히 올해는 지방선거로 인한 선심성 재정지출이 증가해 그 규모가 더욱 확대될 것""으로 전망했다.무분별 토목사업으로 재정 취약해져지자체 적자가 대폭 증가하는 주된 이유로 건설ㆍ토목 분야에 이어진 방만한 투자가 꼽혔다. 정 부소장은 ""도로건설을 위한 지방채 발행액이 6조7800억여 원으로 전년보다 26.5퍼센트 늘어났고 지하철 건설을 위한 지방채 발행액도 2조7900억여 원으로 10.9퍼센트 증가했다""고 지적했다.이와 관련, 서울시의 경우 도심개발 공사를 전담하는 SH공사의 부채가 급증한 게 사실이다. 지난 2005배만 해도 3조3000억 원에 불과했던 SH공사 부채는 작년말 현재 16조3500억 원으로 무려 다섯 배가량 증가했다.지자체 중 재정적자 상태가 가장 심각한 곳으로 알려진 인천시도 전임 시장 재적시절 무분별한 투자로 시 재정이 뒤흔들렸다.박준복 인천참여예산네트워크 정책위원장은 ""문화체육관광부가 '문학경기장을 증축해 2014 아시안게임 주경기장으로 활용하라'고 했으나 (안상수 전임 시장 당시) 시에서 주경기장을 새로 짓기로 해 건설비 5600억 원이 늘어났다""며 ""지하철 2호선도 개통시기를 아시안게임에 맞춰 앞당기는 바람에 6000억 원의 재원을 마련할 길이 없어진 상황""이라고 지적했다.인천도시개발공사도 2007년부터 영종하늘도시를 분양했으나 경제 위기로 분양 해약률이 39퍼센트에 달해 재정 악화가 심각한 상황이다. 박 위원장은 ""올해 인천시의 자체 수입은 2조9730억 원으로 작년보다 1117억 원 줄어들었다""며 ""기존 사업의 축소와 수정이 불가피하다""고 말했다. 인천시의 빚은 올해 말 기준으로 3조1000억 원대에 달할 것으로 전망된다.정 부소장은 ""지자체 적자가 늘어나는 이유는 수입이 적어서가 아니라 많이 쓰기 때문""이라며 ""2009년 이후로 지자체 재정 악화가 심각해졌다""고 말했다.▲토론회 참가자들은 전시성 투자를 줄이고 지방정부에 대한 감시력을 강화해야 한다고 강조했다. ⓒ참여연대 제공재정적자, 결국 복지 해체로 이어져지자체가 재정적자에 시달리다 보면 결국 주민 복지에 심각한 타격이 온다. 금홍섭 대전참여자치시민연대 사무처장은 ""대전의 경우 사회복지분야 예산이 2008년부터 감소하기 시작했다""며 ""올해도 복지부문 61개 사업에서 152억 원의 예산이 삭감됐다""고 말했다.금 사무처장은 또 ""무리한 투자로 재정 적자가 심각해져 공무원들의 급여도 마련하지 못할 정도""라며 ""예산이 부족해 지방채 발행액이 지속적으로 늘어나고 있다""고 설명했다.지자체 재정 악화가 전국적으로 이어질 경우, 최악의 경우 도시 살림이 파탄날 수도 있다. 이에 따른 후유증은 심각하다. 한 때 도심 재개발의 모범사례로 꼽혔던 일본 유바리(夕張)시의 사례가 이를 극명히 보여준다.1만여 명 남짓의 고령자들이 주로 모여 살던 유바리시는 대규모 예산을 쏟아부어 폐광촌에서 관광도시로 변신, 한 때 일본 지자체 경영대상까지 수상한 성공 모델로 꼽혔다. 그러나 관광객 유인책이 점차 줄어들면서 채무적자가 심각해져, 2006년 6월 재정재건단체 신청을 해야 했다. 파산한 것이다.홍헌호 시민경제사회연구소 연구위원은 ""파산 후 4년 간 유바리시는 공무원 61퍼센트(166명)를 감축했고, 파산 이듬해 시장은 75퍼센트, 간부는 70퍼센트, 일반직원은 50퍼센트의 급여를 삭감했다""며 ""무엇보다 시민부담이 크게 늘어나 복지가 사라져버렸다""고 지적했다.홍 연구위원에 따르면 파산 후 유바리시의 주민세는 3000엔에서 3500엔으로 16퍼센트 증가했고 경자동차세도 50퍼센트 올랐다. 하수도 사용료는 무려 66퍼센트 급등했고 각종 시설 사용료도 크게 올랐다.무엇보다 가장 기본적인 복지가 망가졌다. 7개이던 초등학교는 1개로 통폐합됐고, 중학교 역시 4개교가 1개교로 폐합됐다. 시립병원 의사 4명 중 3명이 해고됐고, 시립도서관은 폐관했다. 대중교통에서 경로우대제도가 사라졌고, 고령자와 장애인, 어린이에 대한 시의 보조금도 폐지됐다.""한국 지자체, 일본보다 심각""홍 연구위원은 ""시가 관광시설 건립과 매입으로 지속적인 투자 확대에 나섰으나 채산성 악화로 무너진 것""이라며 ""단체장에 대한 통제가 이뤄지지 않았고 시의 분식회계를 아무도 잡아내지 못했다. 시의 돌려막기로 일시차입금이 눈덩이처럼 불어나, 파산 당시 전체 채무액은 시 재정(45억 엔)의 열여섯배에 달하는 632억 엔이었다""고 설명했다.홍 연구위원은 ""행정안전부는 한국의 지자체 재정이 상대적으로 양호하다고 주장하지만 비판적으로 들여다볼 필요가 있다""며 ""최근 감사원과 행안부 자료를 보면, 일본 유바리시보다 재정력지수가 낮은 기초자치단체가 무려 47퍼센트에 달한다""고 주장했다. 재정력지수는 재정수요 대비 재정수입을 나타내는 지표로, 수치가 높을수록 재정력이 높다.이와 관련, 홍 연구위원은 ""감사원이 2007년 발표한 '일본의 지방재정개혁 및 재정분석ㆍ평가에 관한 연구'를 보면 당시 유바리시의 재정력지수는 0.23""이라며 ""행정안전부 발표 자료를 보면 우리나라 160개 기초자치단체 중 재정력지수가 0.23 미만인 지자체는 76곳에 달한다""고 강조했다.행안부 자료를 보면 수도권은 상대적으로 고소득자가 많아 재정력도 탄탄했다. 그러나 다른 지역은 사정이 달랐다. 태백(0.229), 삼척(0.127), 홍천(0.199) 등 강원도 내 기초자치단체 대부분이 유바리시보다 재정 상황이 나빴다. 전라북도에서도 정읍(0.163), 남원(0.146), 진안(0.121) 등 상당수 도시의 재정력이 취약했고 경북 역시 공업도시를 제외한 나머지는 사정이 나빴다(영주 0.193, 상주 0.15, 영양 0.096).홍 연구위원은 ""재정력지수 하나만으로 지자체 재정건전성의 모든 것을 설명할 수는 없다""면서도 ""유바리시와 같은 비극이 우리나라에도 재현될 가능성을 배제할 수는 없다""고 지적했다.▲ ⓒ프레시안이대희 기자 (eday@pressian.com)- Copyrights ©PRESSian.com 무단전재 및 재배포금지 -"
23,2010-07-21,"[단독] ""총리실, 현직 국회의원도 은밀히 사찰""",https://news.naver.com/main/read.nhn?mode=LSD&mid=shm&sid1=100&oid=055&aid=0000185888,SBS,"<8뉴스><앵커>이어서 총리실 불법 사찰 파문 수사 속보전하겠습니다. 문제의 공직윤리지원관실이 민간인 뿐 아니라 현직 국회의원까지 사찰한 사실이 검찰 수사에서 드러났습니다.김요한 기자의 단독보도입니다.<기자>민간인 김종익 씨를 불법 사찰했던 총리실 산하 공직윤리지원관실의 점검1팀이 지난 2008년 현직 국회의원을 은밀히 사찰한 것으로 밝혀졌습니다.당시 점검1팀에 근무하며 김종익 씨 사찰에도 관여했던 한 직원은 최근 검찰에 참고인으로 출석해 김 모 팀장의 지시로 현역 의원을 내사했다고 진술했습니다.사찰대상이 된 정치인은 수도권에 지역구를 둔 여당 중진의원입니다.이 직원은 사찰을 한 뒤 내사 결과 보고서를 작성해 이인규 지원관의 결재를 거쳐 지원관실 기획총괄과에 넘겼다고 말했습니다.이 직원은 사찰배경에 대해 청와대로부터 내사 지시를 종종 받았기 때문에 이 경우도 청와대의 하명사건일 것으로 짐작했다고 덧붙였습니다.검찰은 해당 의원에 대한 사찰 문건을 확보한 것으로 전해졌습니다.행정부처 공무원이나 산하 기관 직원을 감찰하는 공직윤리지원관실이 입법부의 구성주체인 현직 국회의원까지 내사하는 것은 엄연한 불법입니다.검찰은 공직윤리지원관실이 정치인까지 사찰한 사실이 드러남에 따라 지원관실 감찰활동 전반에 대한 수사가 불가피할 것으로 보고 있습니다.(영상취재 : 박진호, 영상편집 : 위원양)김요한yohani@sbs.co.kr관/련/정/보◆ '민간인 사찰' 이인규 등 3명 사전구속영장 청구◆ [단독] 총리실 직원 ""사찰, 윗선의 지시 있었다""◆ 검찰, 총리실 직원에 '증거인멸죄' 적용 검토◆ 검찰, '민간사찰' 엇갈린 진술에 현장조사◆ [단독] 사찰 피해자 ""주식 매각도 강요 당했다""[SBS기자들의 생생한 취재현장 뒷이야기 '취재파일']저작권자 SBS&SBS콘텐츠허브 무단복제-재배포 금지"
24,2010-07-21,"<李대통령 ""한미, 대북 긴밀공조 계속해야"">(종합)",https://news.naver.com/main/read.nhn?mode=LSD&mid=shm&sid1=100&oid=001&aid=0003486811,연합뉴스,"이 대통령 한미 외교.국방장관 접견    (서울=연합뉴스) 조보희 기자 = 이명박 대통령이 21일 오후 청와대에서 한미 외교.국방장관 회의에 참석중인  미국 로버트 게이츠(왼쪽부터) 국방장관, 힐러리 클린턴 국무장관과 유명환 외교통상부장관, 김태영 국방장관을 면담하기 위해 행사장으로 함께 이동하고 있다. 2010.7.21            jobo@yna.co.kr클린턴 美국무.게이츠 국방 접견..""다 오면 태평양은 누가 지키나""(서울=연합뉴스) 이승우 안용수 기자 = 이명박 대통령은 21일 청와대에서 한미 외교.국방장관(2+2) 회의 참석차 방한한 힐러리 클린턴 국무장관, 로버트 게이츠 국방장관 등 미 외교안보 라인 각료들을 접견하고 만찬을 함께했다.이 대통령은 이 자리에서 ""오늘 판문점과 전쟁기념관을 방문해 천안함 사태 희생자, 6.25 전쟁 희생자를 직접 참배한 것은 정말 큰 의미가 있다""며 ""한.미 60년 동맹 관계에 정말 마음이 든든하다""고 감회를 밝혔다.이어 ""금번 (2+2)회의가 한미 동맹의 성숙한 발전과 공고한 안보 공약을 재확인하는 계기가 됐을뿐 아니라 전략 동맹의 미래발전을 위한 협력을 더욱 강화하는 데 기여하게 될 것""이라고 말했다고 김희정 청와대 대변인이 전했다.특히 이 대통령은 ""천안함 사태 및 북핵 문제 등의 대응에 있어 북한이 책임있는 자세를 보이도록 한미 양국이 계속 긴밀히 공조해 나가는 것이 필요하다""고 강조했다.아울러 ""버락 오바마 미 대통령과의 긴밀한 신뢰관계를 통해 동맹미래 비전을 바탕으로 한미동맹을 보다 굳건하게 발전시켜 나갈 것""이라며 한미 자유무역협정(FTA)의 조속한 비준을 비롯한 양국 협력 방안에 협조와 지원을 당부했다.이에 대해 클린턴 장관도 ""문제를 회담을 통해 해결하려 노력하는 이 대통령의 리더십에 감사드린다""며 ""역사상 어느 때보다도 한.미 관계의 폭과 깊이, 힘이 강하다""고 화답했다.이 대통령 한미 외교.국방장관 접견    (서울=연합뉴스) 조보희 기자 = 이명박 대통령이 21일 오후 청와대에서 한미 외교.국방장관 회의에 참석중인  유명환 외교통상부장관, 김태영 국방장관과 미국 힐러리 클린턴 국무장관과 로버트 게이츠 국방장관을 접견하고 있다. 2010.7.21            jobo@yna.co.kr그는 이어 ""인적 교류가 중요하다""면서 ""오늘 판문점 공동경비구역 방문에서 미국뿐 아니라 다른 나라 참전용사의 손자 손녀를 만났는데, 국가간 관계의 핵심이 사람 대 사람이라는 것을 다시 한번 느낄 수 있었다""고 말했다.그는 또 ""앞으로도 양국 관계가 더욱 많이 깊어질 것""이라며 ""곧 서울 G20(주요 20개국) 회의가 열리는데 한국의 리더십에 기대를 하고 있다""고 말했다.게이츠 장관은 ""내가 청와대에 처음 왔던 게 25년 전인데 이후로 지금의 한미동맹이 제일 공고하고 협력할 기회도 많아졌다""며 ""지난 몇달 동안 상당히 좋은 성과를 얻었고 앞으로 더 많이 달성할 준비가 돼 있다""고 강조했다.이밖에 이 대통령은 ""이 자리에 (한미) 합참의장과 다른 분들이 다 오셨는데, 태평양은 누가 지키느냐""고 농담을 해 폭소가 터지기도 했다.또 오는 31일로 예정된 클린턴 장관의 딸 첼시의 결혼을 언급, ""부모로서 정말 기쁜 일""이라고 축하했다.이날 행사에는 미국 측에서 클린턴, 게이츠 장관 외에도 마이크 뮬렌 합참의장, 로버트 윌라드 태평양함대 사령관, 월터 샤프 주한미군사령관, 국방장관 군사보좌관인 조지프 케난 제독, 웰레스 그렉슨 국방부 아태차관보 등이 참석했다.우리 측에서는 유명환 외교통상부장관, 김태영 국방부 장관과 한덕수 주미대사, 한민구 합참의장, 김성환 청와대 외교안보수석 등이 배석했다.leslie@yna.co.kr이 대통령 한미 외교.국방장관 접견    (서울=연합뉴스) 조보희 기자 = 이명박 대통령이 21일 오후 청와대에서 한미 외교.국방장관 회의에 참석중인 유명환 외교통상부장관, 김태영 국방장관과 미국 힐러리 클린턴 국무장관, 로버트 게이츠 국방장관을 면담하고 있다. 2010.7.21            jobo@yna.co.kr[관련기사]▶ <한미 '대북 제재' 강화..北대응 주목>(종합)▶ <한미 외교.국방 4인의 동행..동맹 과시>(종합)▶ 美 추가 대북 금융제재..한.미 '2+2' 회의(종합)▶ <한.미, `2+2'공동성명에 '대북 억지력' 강조>▶ <한미 외교.국방장관 DMZ 동시방문 안팎>(종합)<뉴스의 새 시대, 연합뉴스 Live><모바일 애플리케이션><포토 매거진><저작권자(c)연합뉴스. 무단전재-재배포금지.>"
25,2010-07-21,다롄 공장가동 중단위기…수출입 막혀 '발동동',https://news.naver.com/main/read.nhn?mode=LSD&mid=shm&sid1=104&oid=055&aid=0000185902,SBS,"<8뉴스><앵커>송유관 폭발사고로 중국 다롄의 항구 기능이 마비되면서 현지 진출한 한국 업체들의 피해가 갈수록 커지고 있습니다. 항구가 정상화됐다는 중국 당국의 발표에도 불구하고 수출길은 물론이고 원자재 수입도 어려운 실정입니다.다롄 현지에서 표언구 특파원이 취재했습니다.<기자>방재작업 중이던 소방대원 한 명이 기름 바다에 빠져 허우적거립니다.구조대원들이 기름 바다에 빠진 대원을 육지로 끌고 나옵니다.소방대원의 몸은 온통 시커먼 기름으로 뒤덮여 있습니다.중국 정부는 방재작업이 순조롭게 진행돼 오늘(21일)부터 다롄 항을 정상화한다고 밝혔습니다.하지만 밀려있는 화물이 워낙 많고 처리도 중국의 대형 화물 우선이라 우리 기업들의 피해는 줄어들지 않고 있습니다.직원 700여 명이 일하는 이 업체는 수출길이 막히면서 완제품을 창고에 쌓아놓고 있습니다.[김동식/콜텍 중국 법인장 : 지금 지연되고 있어서 제품 1천여 대가 밀려있습니다. 이 것들이 다 나가야 하는데, 못 나가고 있는 상태입니다.]산더미처럼 쌓여가는 재고도 문제지만 원자재 수입이 안 되는 것도 큰 문제입니다.완제품 운동화를 만들어 수출하는 이 공장은 앞으로 하루 이틀 안에 원자재가 들어오지 않을 경우에는 공장 가동마저 중단해야될 위기에 처했습니다.[황준연/성원통상 관리부장 : 이틀 이내로 자재가 안 들어오게 되면 향후 3~4일 이상은 공장을 계속 쉬어야 되는 상태가 되고 있습니다.]지난주 금요일 송유관 폭발사고 이후 항구가 마비되면서 다롄의 우리 기업 800여 곳 가운데 100여 곳이 직접적인 피해를 입고 있습니다.다롄항이 완전히 정상화되려면 일주일 이상 더 걸릴 것으로 보여 우리 기업들의 피해도 커질 전망입니다.(영상취재 : 김연철, 영상편집 : 염석근)표언구eungoo@sbs.co.kr관/련/정/보◆ 송유관 폭발로 다롄항 폐쇄…한국기업 피해 확산[SBS기자들의 생생한 취재현장 뒷이야기 '취재파일']저작권자 SBS&SBS콘텐츠허브 무단복제-재배포 금지"
26,2010-07-21,"클린턴 ""대북 추가제재""…북 지도부 '돈줄' 죈다",https://news.naver.com/main/read.nhn?mode=LSD&mid=shm&sid1=100&oid=055&aid=0000185883,SBS,"<8뉴스><앵커>여러분 안녕하십니까? 사상 처음으로 열린 한미 외교·국방장관 합동회의에서 클린턴 미 국무장관이 북한에 대한 추가제재를 언급했습니다. 북한 지도부로 들어가는 돈줄을 죄어 제재의 실효성을 높이겠다는 겁니다.먼저, 유성재 기자가 보도합니다.<기자>클린턴 미 국무장관은 천안함 사태에 대한 후속 대책으로 대북 추가제재 의사를 밝혔습니다.[클린턴/미 국무장관 : 새로운 대북 제재는 북한의 무기 판매와 관련 물자의 조달을 제한하고, 사치품의 수입과 그 외의 다른 불법 활동을 금지하기 위한 것이다.]북한의 핵 확산 관련자들을 추가로 지정해 이들의 자산을 동결하고, 자금 거래와 해외 여행을 중단시키겠다고 말했습니다.이를 위해 지난 달 아인혼 대북제재조정관을 임명해 동맹국과 새로운 제재조치를 협의하고 있다고 덧붙였습니다.[북한의 지도부와 자산에 초점을 맞춘 조치를 고려하고 있다. 이미 몇 년 전에 이런 방식으로 북한의 행동 변화를 이끌어 낸 바 있다.]유엔 안보리 결의안 1718호와 1874호가 대량살상무기와 관련된 금융제재였다면 클린턴 장관의 추가제재조치는 마약, 돈세탁, 위조지폐와 같은 불법행위를 모두 포괄하는 내용이 될 것이라고 정부 관계자는 설명했습니다.클린턴 장관은 또 6자회담 재개는 아직 추진하지 않고 있다고 말해 천안함 사태의 매듭을 전제로 하는 이른바 천안함 출구전략은 시기상조라는 뜻을 내비쳤습니다.(영상취재 : 최남일, 영상편집 : 최진화)유성재venia@sbs.co.kr관/련/정/보◆ 한미 장관 JSA 동반 방문, '굳건한 동맹' 과시◆ 한미 공동성명 발표…""북한 위협에 강력 대처""◆ 클린턴 ""유엔 대북제재 1874호 더욱 엄격 시행""◆ 한·미 ""북한, 무책임한 행동시 심각한 결과 따를 것""◆ ""북한 도발, 직접 공격 가하는 '위험시대'로 변화""[SBS기자들의 생생한 취재현장 뒷이야기 '취재파일']저작권자 SBS&SBS콘텐츠허브 무단복제-재배포 금지"
27,2010-07-21,[날씨] 오늘밤에도 열대야…찜통더위 계속된다,https://news.naver.com/main/read.nhn?mode=LSD&mid=shm&sid1=103&oid=055&aid=0000185909,SBS,"<8뉴스>삼복더위가 기승을 부리고 있습니다.오늘(21일) 강릉의 낮기온이 36도까지 오르면서 올들어 최고치를 기록했는데요.특히 오늘은 많은 양의 수증기가 우리나라로 들어오면서 습도가 올라가고 더욱 더 후텁지근하게 느껴지는 날씨였습니다.가만 있어도 몸에서 땀이 배어나올 정도의 날씨인데요.역시나 오늘 밤에도 25도선을 웃돌면서 열대야가 이어지겠고요.낮동안에는 삼복더위가 기승을 부릴 것으로 예상됩니다.내일도 서울의 낮기온은 30도, 강릉과 대구가 35도까지 오르면서 찜통더위가 계속되겠습니다.너무 더워서 견디기 힘드시다면, 경로당이나 주민센터 등에 마련된 '무더위 쉼터'를 이용해 보시는 것도 좋겠고요.119 '폭염구급대'에서는 거동이 어려우신 분들에게 도움이 될 수 있습니다.오늘 밤에는 경기도의 북쪽이라든지, 영서지방 북쪽으로 중심으로 소나기 가능성이 있고요.내일도 중북부의 북부라든지, 남해안쪽에서는 비나 소나기가 지나가겠습니다.금요일과 토요일 사이에는 장맛비 소식이 있는데요.금요일에는 수도권 일대에, 토요일에는 전국 대부분 지방에서 비가 내리겠습니다.(홍서연 기상캐스터)[SBS기자들의 생생한 취재현장 뒷이야기 '취재파일']저작권자 SBS&SBS콘텐츠허브 무단복제-재배포 금지"
28,2010-07-21,"""대기업 횡포 강력제재""…불공정거래 조사 착수",https://news.naver.com/main/read.nhn?mode=LSD&mid=shm&sid1=101&oid=055&aid=0000185906,SBS,"<8뉴스><앵커>경기가 많이 나아진 덕에 대기업은 호황이라지만, 중소기업들은 여전히 어려움을 호소하고 있습니다. 정부는 그  배경에 대기들업의 부당행위가 있다고 보고 대대적인 실태조사에 착수했습니다.김형주 기자입니다.<기자>경기도 평택의 한 주물 가공업체.납품 단가를 깎아 달라는 대기업들의 요구에, 울며 겨자먹기로 2년째 출혈 공급을 해오고 있습니다.싼 가격에 납품 받은 대기업들은 연일 흑자 행진을 이어가고 있지만, 이 업체는 적자만 쌓여갑니다.[최용섭/중소기업 사장 : 대기업이 요구하는대로 납품을 하면 저희들 중소기업은 영원한 적자로 납품하는 실정에 있습니다.]이 뿐만이 아닙니다.대기업들은 우월적 지휘를 이용해 중소기업의 기술을 빼앗거나, 일방적인 거래 중단 통보, 거래 대금 지급 지연같은 잘못된 관행도 비일비재합니다.정부는 이런 폐단이 최근 경기 회복세에도 불구하고 온기가 경제 전반으로 퍼지지 못하는 한 요인이라고 판단하고, 단속에 나섰습니다.[윤증현/기획재정부 장관 : 대기업과 중소기업간 상생협력의 노력을 기울여왔습니다만 아직도 많이 부족하다고 생각합니다.]먼저, 다음달 주요 대기업을 상대로 불공정 거래 여부에 대한 직권 현장 조사를 실시한 뒤, 이런 행위를 반복하는 기업은 정부관련 사업의 입찰제한이나 영업정지 등 강력한 제재를 가할 계획입니다.대기업과 중소기업간 납품단가 조정이 공정하게 진행되도록 제도를 개선하고, 중소기업의 핵심 기술을 법으로 보호하는 방안도 마련하기로 했습니다.(영상취재 : 전경배, 영상편집 : 오노영)김형주kimmyworld@sbs.co.kr관/련/정/보◆ [부동산따라잡기] 하도급 횡포, 건설사 불치병?◆ 대형 유통업체 '횡포' 여전…방법도 '가지가지'◆ 최저 납품단가 깎고 또 깎고…대기업 횡포 여전◆ '깎고 빼앗고'…대기업 횡포에 중소기업 못살겠네[SBS기자들의 생생한 취재현장 뒷이야기 '취재파일']저작권자 SBS&SBS콘텐츠허브 무단복제-재배포 금지"
