,날짜,기사 제목,기사 링크,기사 출처,기사 내용
52,2010-07-21,"""행복한 나라? 1위 덴마크, 한국 56위""<갤럽>",https://news.naver.com/main/read.nhn?mode=LSD&mid=shm&sid1=104&oid=001&aid=0003477394,연합뉴스,"덴마크 코펜하겐(자료사진)(서울=연합뉴스) 하채림 기자 = 지구상에서 가장 행복한 나라는 어디일까.미국의 경제 전문지 포브스 최근호는 갤럽이 지난 2005~2009년 사이 전세계 155개국의 수천명을 대상으로 설문을 실시한 결과 덴마크가 가장 행복한 나라로 조사됐다고 보도했다. 한국은 56위를 기록했다.포브스에 따르면 갤럽 세계조사팀의 연구진들은 이들 나라 국민들의 전반적인 삶의 만족도를 나타내는 '인생 평가'와 조사 전 하루 동안의 행복도를 묻는 '일상 경험'의 두 가지를 항목을 조사하는 방법으로 각국의 행복 정도를 수치화했다.점수가 높게 나올수록 행복 순위가 높고 삶을 즐기는 것으로 평가됐다.합산 결과 155개국 중 덴마크의 행복순위가 가장 높은 것으로 나타났으며 핀란드와 노르웨이 스웨덴, 네덜란드가 뒤를 이었다. 경제적으로 번영을 이룬 북유럽 국가들이 상위를 차지했다.1위에 오른 덴마크는 지난해 1인당 국내총생산(GDP)은 3만6천달러로 미국 중앙정보국(CIA)이 통계를 보유한 227개국 가운데 31번째로 높다.이어 코스타리카와 뉴질랜드, 캐나다, 이스라엘, 호주, 스위스가 6~10위권에 포진했다.반면 아프리카의 부룬디와 토고가 가장 순위가 낮았으며 캄보디아, 시에라리온, 부르키나파소, 르완다, 니제르 국민들의 행복도도 매우 낮은 것으로 조사됐다.강대국 미국은 14위에 올라 상대적으로 행복한 편에 속한 반면 중국과 러시아는 각각 125위와 73위에 그쳤다.우리나라는 경제위기를 겪는 그리스(50위)나 내전을 겪은 코소보(54위)보다 낮은 56위를 기록했다.갤럽은 이번 조사와 관련 '돈으로 행복을 살 수 있다'는 말이 어느 정도 일리가 있음을 보여주는 것이라고 해석했다.연구진은 GDP 높은 국가가 행복한 이유를 분석한 결과 삶의 만족도와 소득 간에 상관관계가 있는 것을 확인했다.연구진은 ""수많은 또는 대부분의 사람이 갈망하는 대상이 돈이며, 일하는 시간 대부분도 거기에 할애한다""며 ""사람들이 자신의 인생을 평가할 때 금전적 성공이 아무런 영향을 미치지 않는다면 그것이 오히려 놀라운 일""이라고 설명했다.그러나 행복에는 경제적 부 이상의 것이 필요하다고 포브스는 지적했다.조사 항목 중 일상의 행복도는 개인의 심리적 및 사회적 욕구가 얼마나 잘 충족되는지에 더 많이 영향을 받는다고 갤럽은 설명했다.이런 것들은 급여로는 채우기 어려운 부분이다.예를 들어 6위에 오른 코스타리카의 경우 미국이나 캐나다를 제치고 아메리카대륙에서 가장 행복한 것으로 조사됐다.갤럽은 이에 대해 코스타리카의 사회적 네트워크가 더 탄탄해 경제적인 성공 여부에 무관하게 일상의 행복을 느낄 수 있기 때문이라고 분석했다.코스타리카는 사람들이 인간관계에 더 많은 가치를 부여하고 있으며 서로 좋은 관계를 형성할 수 있도록 사회가 조직돼 있어 일상생활의 행복도가 매우 높게 나온 것으로 파악됐다.tree@yna.co.kr[관련기사]▶ <국민소득 높다고 행복할까?>▶ ""행복은 나이들면서 찾아온다""<갤럽><뉴스의 새 시대, 연합뉴스 Live><모바일 애플리케이션><포토 매거진><저작권자(c)연합뉴스. 무단전재-재배포금지.>"
53,2010-07-21,"독일·스웨덴, 유급 육아휴가 47주 ‘최고’",https://news.naver.com/main/read.nhn?mode=LSD&mid=shm&sid1=104&oid=022&aid=0002163000,세계일보,"가장 긴 육아휴직을 보장하는 나라는 어디일까.미국 경제정책연구소(CEPR)가 조사한 결과 유급 육아휴직 기간은 독일과 스웨덴이 47주로 가장 갈었다. 이어 노르웨이(44주), 그리스(34주), 핀란드(32주), 캐나다(29주) 순이며, 미국과 호주는 유급 육아휴직이 없어 가장 인색한 것으로 드러났다.유·무급을 합친 총 육아휴직 일수 면에선 프랑스와 스페인이 300주를 보장함으로써 가장 긴 반면 스위스와 미국은 24주와 14주로 꼴찌였다. 호주와 스위스는 유급 육아휴직과 성평등 면에서 가장 낮았다. 성평등은 아버지에 대한 육아휴가 허용 여부 등을 반영해 조사했다.미국은 유급 육아휴직 면에서 꼴찌였지만 성평등 지수에선 21개국 중 11위에 올랐다. 일본은 성평등 면에서 19위에 머물렀으나 유급 육아휴직을 26주 보장하는 등 전반적인 면에서 7위를 기록했다.연구진은 “육아휴직은 어린이와 부모의 건강과 복지를 증진하고, 유급 휴가는 육아 시기에 결정적인 경제적 지원을 하는 것이기 때문에 이런 정책이 미비하면 사회적 대가를 치르게 된다”고 경고했다.이 조사 결과는 유럽사회정책저널(Journal of European Social Policy) 최신호에 실렸다.윤지로 기자kornyap@segye.com[Segye.com 인기뉴스]◆ ""게임에 빠져 딸 굶겨죽인 父, 태어날 둘째에게…""◆ `할리우드 말썽꾼' 린제이 로한, 교도소 수감◆ 中 '얼짱거지' 패션모델 변신…영화도 제작◆ '여아 가슴 한번 만졌다가' 40대 남성 징역 4년◆ 40대 女약사 숨진채 발견…납치·살해추정 수사◆ '미녀 스파이' 채프먼, 포르노업계서 '러브콜'◆ 친구 폭행 후 암매장각서 받은 무서운 20대 여성들[ⓒ 세계일보 & Segye.com, 무단 전재 및 재배포 금지][☞공짜로 연극ㆍ뮤지컬보기][우리 아이 시력 회복 캠페인]<세계닷컴은 한국온라인신문협회(www.kona.or.kr)의 디지털뉴스이용규칙에 따른 저작권을 행사합니다.>"
54,2010-07-21,`민간인 사찰' 이인규 오늘 구속영장 청구,https://news.naver.com/main/read.nhn?mode=LSD&mid=shm&sid1=100&oid=001&aid=0003477414,연합뉴스,"고개숙인 이인규 전 지원관(자료사진)고개숙인 이인규 전 지원관    (서울=연합뉴스) 이정훈 기자 = 민간인 불법사찰 의혹을 조사받기 위해 검찰에 소환된 이인규 전 공직윤리지원관이 19일 오전 서초동 서울중앙지검으로 들어서며 취재진의 질문세례를 받고 있다.     uwg806@yna.co.kr(서울=연합뉴스) 임주영 강건택 전성훈 기자 = 국무총리실 산하 공직윤리지원관실의 `민간인 불법사찰' 의혹을 수사 중인 서울중앙지검 특별수사팀(팀장 오정돈 부장검사)이 21일 김종익(56) 전 NS한마음 대표를 불법 사찰한 혐의로 이인규(54) 전 지원관을 포함한 2∼3명에 대해 구속영장을 청구키로 방침을 정한 것으로 알려졌다.영장을 청구하는 피의자는 사찰의 공식적 책임자로 지목된 이 전 지원관과 사찰 과정에 깊숙이 관여한 김모 점검1팀장, 원모 사무관 등인 것으로 전해졌다.검찰은 이 전 지원관을 19일 소환 조사하고 김 팀장, 원 조사관 등도 수 차례 조사했으며 최근 며칠간 피의자 신문조서와 증거물, 참고인 진술조서 등을 정리하면서 법리 검토를 해왔다.공직윤리지원관실은 2008년 9월부터 `대통령 비방 동영상'을 자신의 블로그에 올렸다는 등의 이유로 김씨를 불법 사찰하고 부당한 영향력을 행사한 혐의를 받고 있으며, 총리실은 자체 조사를 거쳐 5일 검찰에 이 지원관 등에 대한 수사를 의뢰했다.zoo@yna.co.krfirstcircle@yna.co.krcielo78@yna.co.kr[관련기사]▶ `민간인 사찰' 이인규씨 구속영장 적극 검토▶ `민간인 사찰' 사법처리 여부 금명 결정키로▶ `민간인 사찰' 이인규씨 고강도 조사(종합3보)▶ 참여연대, 조홍희 서울국세청장-이인규씨 고발<뉴스의 새 시대, 연합뉴스 Live><모바일 애플리케이션><포토 매거진><저작권자(c)연합뉴스. 무단전재-재배포금지.>"
55,2010-07-21,"한.미 ""北 무책임한 행동시 심각한 결과 따를 것""",https://news.naver.com/main/read.nhn?mode=LSD&mid=shm&sid1=100&oid=001&aid=0003477349,연합뉴스,"한미 2+2 회담(서울 사진공동취재단 = 연합뉴스) 사상 첫 한.미 외교.국방장관('2+2') 회담이 21일 세종로 정부중앙청사에서 열렸다. 힐러리 미 국무장관과 유명환 외교통상부 장관 등 한미 관계자들이 회의에 참석하고 있다. 2010.7.21    photo@yna.co.kr서울서 사상 첫 외교+국방장관회의""천안함 공격 책임질 것"" 촉구..""추가공격.적대행위 삼가라""""어떤 위협도 억지.격퇴"" 공고한 한.미 연합방위태세 확인'전략동맹 2015' 올해 SCM서 완성..차관보급 '2+2' 정례화(서울=연합뉴스) 노효동 기자 = 한.미 양국은 21일 북한에 대해 ""대한민국에 대한 추가적인 공격이나 적대행위를 삼가라""며 ""그와 같은 어떠한 무책임한 행동에 대해서도 심각한 결과가 따를 것""이라고 경고했다.양국은 또 천안함 공격사건에 대한 책임을 질 것을 촉구했다.한.미 양국은 이날 오후 서울 세종로 종합청사에서 유명환 외교통상부 장관과 김태영 국방부 장관, 힐러리 클린턴 미 국무장관과 로버트 게이츠 국방장관이 참석한 가운데 사상 첫 외교.국방장관(2+2) 회의를 열어 이 같은 내용을 담은 공동성명을 발표했다.양국 장관들은 성명에서 지난 9일 천안함 사건에 대한 유엔 안전보장이사회의 의장성명을 환영하고 이 같은 무책임한 군사적 도발은 한반도는 물론 역내 평화.안정에 중대한 위협이 된다는데 의견을 같이했다""며 ""천안함 공격에 대한 책임을 질 것을 촉구한다""고 밝혔다.양국 장관들은 또 천안함 후속대응의 일환으로 동해와 서해에서 연합 군사훈련을 실시한다는 계획을 언급하고 ""북한의 어떠한 모든 위협도 억지.격퇴할 수 있는 공고한 연합방위태세를 유지해 나가기로 했다""고 강조했다.양국 장관들은 이와함께 지난달 양국 정상이 전시작전통제권 전환시기를 2015년 12월로 연기하기로 합의한 것과 관련, 새로운 계획인 '전략동맹 2015'를 올해 10월 안보협의회의(SCM)까지 완성하기로 했다.성명은 특히 ""전시작전통제권의 전환은 양국간 긴밀한 공조 하에 동맹의 연합방위태세와 역량을 유지.제고할 수 있도록 추진될 것""이라고 강조했다.6자회담을 포함한 북핵 문제와 관련, 양국 장관들은 ""북한이 완전하고 검증가능하게 모든 핵프로그램과 핵무기 추구를 포기하고 비핵화를 위한 진정한 의지를 구체적인 행동으로 보여주라""고 촉구했다.양국 장관들은 특히 ""북한이 국제사회와 협력해 북한주민들의 인권상황과 생활수준을 개선시킬 것을 촉구한다""며 북한 인권문제를 거론했다.한미 2+2 회담(서울 사진공동취재단 = 연합뉴스) 사상 첫 한.미 외교.국방장관('2+2') 회담이 21일 힐러리 미 국무장관과 유명환 외교통상부 장관 등이 참석한 가운데 세종로 정부중앙청사에서 열렸다. 사진은 회담장 미국측 모습. 2010.7.21    photo@yna.co.kr한.미동맹 강화와 관련, 양국 장관들은 지난해 6월 정상간에 합의된 '동맹미래비전'의 역사적 의의를 평가하고 동맹협력을 양자적.지역적.범세계적으로 계속 발전시켜나감으로써 동맹 협력의 폭과 깊이를 확대해나가는 의지를 재확인했다.양국 장관들은 한.미 자유무역협정(FTA)이 갖는 최상의 중요성을 재확인하고 지난달 캐나다 토론토에서 양국 정상들이 논의한 바에 따라 비준을 위해 노력해나가기로 했다.양국 장관들은 또 미래 기후변화와 에너지 안보의 도전에 대처하기 위해 호혜적으로 새로운 한.미 원자력협정을 위해 노력하기로 의견을 모았다.양국 장관들은 이와함께 아프가니스탄 안정 및 재건 문제를 거론, ""6.25 전쟁의 폐허로부터 몇십년내 이루어진 대한민국의 재건을 교훈으로 삼아나가자는데 의견을 같이했다""며 ""미국측은 한국측의 아프가니스탄 지방재건팀(PRT) 파견을 환영하였으며, 한국측은 아프가니스탄의 치안.거버넌스.개발에 대한 지원 의지를 재확인했다""고 밝혔다.양측 장관들은 이밖에 테러리즘.대량파괴무기 확산.금융위기.초국가적 범죄.기후변화.전염병.에너지안보.녹색성장 촉진 등 범세계적 도전들에 대한 대처방안에 관해 의견을 교환하고 공동의 노력을 계속해 나가기로 했다.양국은 앞으로 외교.국방당국간 차관보급 '2+2' 회의를 정례화해나기로 했다.장관급 2+2회의의 경우 양국간 전략대화(SCAP) 및 안보협의회의(SCM) 등 기존의 장관급 협의를 계속 발전시키되, 향후 필요에 따라 개최를 검토키로 했다.rhd@yna.co.kr[관련기사]▶ <한미 `2+2'회의 공동성명 전문>▶ <한.미 `2+2' 공동성명 의미와 내용>▶ <주한미군, 확성기로 北에 훈련계획 통보>▶ <한미 외교.국방장관 DMZ 동시방문 안팎>▶ 한미 외교.국방장관 최전방 동시 방문(종합)<뉴스의 새 시대, 연합뉴스 Live><모바일 애플리케이션><포토 매거진><저작권자(c)연합뉴스. 무단전재-재배포금지.>"
56,2010-07-21,한나라당 의원 `전교조 명단' 완전삭제,https://news.naver.com/main/read.nhn?mode=LSD&mid=shm&sid1=100&oid=001&aid=0003477279,연합뉴스,"전교조 ""법적 책임은 끝까지 묻겠다""(서울=연합뉴스) 이준삼 기자 = 전국교직원노동조합은 ""조전혁 의원 등 전교조 조합원 명단을 공개했던 한나라당 의원들이 최근 명단을 완전히 삭제한 것을 확인했다""고 21일 밝혔다.조 의원은 `교원단체 명단은 학부모의 알권리에 해당한다'며 지난 4월29일부터전교조를 비롯한 국내 교원단체 회원들의 명단을 공개했으며 같은 당 의원 8명이 공개에 동참한 바 있다.전교조는 이에 조 의원을 상대로 명단공개 금지 가처분 신청 등을 제기하고 홈페이지 업체를 통해 명단삭제 작업을 벌여왔지만, 일부 의원들은 최근까지 삭제 요청을 거부해왔다.전교조는 ""정두언 의원과 김효재 의원이 끝까지 명단을 삭제하지 않다가 최근 전교조가 방송통신심의위에 제기한 불법 게시물 삭제 청구에서 삭제 결정이 나오자 지난 19일 명단을 자진 삭제했다""고 말했다.전교조는 명단 삭제와는 별개로 해당 의원들을 상대로 한 법적 대응은 계속 진행할 방침이다.한편, 전교조가 지난 5월19일 `조합원의 사생활을 침해했다'며 명단을 공개한 의원 6명을 상대로 방송통신심의위에 낸 손해배상 요구 안건은 처리기한 60일이 넘어 자동 유보됐다.jslee@yna.co.kr[관련기사]▶ 조전혁, 전교조에 강제이행금 481만원 전달(종합)▶ <돼지저금통 깬 조전혁…발끈한 전교조>▶ 조전혁 ""전교조에 강제이행금 납부""▶ 법원 ""전교조 명단 공개 금지"" 재확인<뉴스의 새 시대, 연합뉴스 Live><모바일 애플리케이션><포토 매거진><저작권자(c)연합뉴스. 무단전재-재배포금지.>"
57,2010-07-21,재구성해본 강용석 의원 `성희롱 발언' 현장,https://news.naver.com/main/read.nhn?mode=LSD&mid=shm&sid1=100&oid=001&aid=0003477292,연합뉴스,"강용석, '여성비하' 발언 진위여부 해명(자료사진)강용석, '여성비하' 발언 진위여부 해명     (서울=연합뉴스) 김병만 기자 = 한나라당 강용석 의원이 20일 오후 국회 정론관에서 모 조간신문의 '여성비하' 발언과 관련, 진위여부를 조목조목 설명하고 있다.kimb01@yna.co.kr여학생들 ""말이 너무 심해 불쾌했다"" 토로""사태 커져 피해 당사자도 매우 놀란 상황""(서울=연합뉴스) 김태균 김효정 김동호 기자 = 강용석 의원의 성희롱 발언 파문의 진원지는 서울 마포구 홍익대 앞의 한 고깃집이다.21일 연세대 언론홍보영상학부 토론 동아리인 YDT(Yonsei Debate Team) 회원 등에 따르면 강의원은 지난 16일 오후 6시께 이곳에서 YDT 회원 20여명과 소주를 곁들여 저녁을 먹었다.강 의원이 심사의원으로 참여한 '제2회 국회의장배 전국대학생 토론대회'의 뒤풀이 자리였다.그는 평소 잘 알던 YDT 회원들이 대회에서 최우수상과 우수상을 받자 '대상은 못 받았지만 수고했다'며 격려 취지로 식사를 제안해 그날 모임이 성사됐다.폭탄주를 돌리거나 술을 강요하는 분위기는 아니었고 강 의원이 술잔을 들고 테이블을 돌며 심사 소회를 밝히고 자유롭게 학생들과 대화를 나눴다.이때만 해도 별문제가 없었으나 아나운서를 지망한다는 한 여학생과 대화하면서 사달이 났다.이 여학생에게 ""아나운서는 몽땅 줘야 하는데 할 수 있겠느냐. ○○여대 이상 학생들은 자존심 때문에 (그렇게) 못한다고 하더라""는 등의 말을 한 것으로 알려졌다.강 의원은 이어 ""여자는 차(車)처럼 시간이 지나면 가치가 떨어진다. 남자는 반대로 집처럼 계속 가치가 오르니 연애에서 남성이 더 유리하다""는 발언도 했다고  했다.또 ""토론대회 심사위원은 외모가 뛰어난 학생에게 관심을 둔다"", ""대통령도 예쁜 여학생의 연락처를 알려고 했을 것이다"", ""나경원 의원은 예쁘지만 키가 작다"" 등의 말을 했다는 소문도 있다.당시 참석자들은 강 의원의 발언에 항의하지 않았으나, 직접 대화한 여학생들은 식사가 끝나자 '말이 너무 심했다'며 심한 불쾌감을 드러냈다고 YDT 회원들이 전했다.저녁식사는 오후 8시께 끝났고 강 의원은 학생들과 2차 술자리를 하지 않고 귀가했다.강 의원은 작년 YDT에서 특강을 했고 한나라당 청년 토론대회에도 이 동아리를 초청하는 등 YDT 회원들과 수차례 만난 적이 있다.YDT의 한 학생은 ""강 의원이 예전부터 여학생을 불쾌하게 하는 언행을 자주 했다. 이번에 피해를 본 학생들이 '불쾌했지만, 사태가 이렇게 커질 줄 몰랐다'며 매우 놀란 상황이다""고 말했다.저녁모임에 참석한 학생들은 20일 강 의원의 성희롱 발언이 언론에 보도된 이후 대외 접촉을 최대한 자제하는 것으로 알려졌다.하지만, YDT의 지도교수인 김주환 교수(언론홍보영상학부)는 ""학생들에게 사실을 말하고 의연하게 대처하라고 말했다. 학생들은 아무런 잘못도 없는 만큼 이번 일로 피해를 보지 않았으면 좋겠다""고 말했다.한나라당은 파문이 커지자 20일 윤리위원회 회의를 소집해 강 의원에게 최고 수준의 징계인 '제명' 결정을 내렸다.강 의원은 ""성희롱 발언을 한 적이 없다""며 윤리위 결정에 불복해 재심을 신청한 상태다.tae@yna.co.kr[관련기사]▶ 아나운서연합회 `여성비하' 강용석 고소(종합)▶ 마포 여성단체, 강용석의원 규탄 기자회견▶ <여야 `여성비하 파문' 대응 입장차>▶ 한, 성희롱 논란 강용석 의원 제명 처분(종합)▶ 안상수 ""`성희롱 발언' 죄송..기강확립할 것""<뉴스의 새 시대, 연합뉴스 Live><모바일 애플리케이션><포토 매거진><저작권자(c)연합뉴스. 무단전재-재배포금지.>"
58,2010-07-21,"클린턴 ""北 변하기 전까지 강건한 방위력 제공""",https://news.naver.com/main/read.nhn?mode=LSD&mid=shm&sid1=100&oid=079&aid=0002170450,노컷뉴스,"한미 외교·국방장관, 비무장지대와 판문점 JSA 동반 방문[CBS정치부 김주명 기자]사상 처음 열리는 한미 외교·국방장관회의에 앞서 양국 외교·국방장관이 21일 오전 비무장지대와 판문점 공동경비구역(JSA)를 동반 방문했다.유명환 외교장관과 김태영 국방장관, 미국의 힐러리 클린턴 국무장관과 로버트 게이츠 국 국방장관은 이날 오전 판문점 자유의 집, 공동경비구역(JSA) 등을 차례로 방문하고 장병들을 격려했다.클린턴 장관과 게이츠 장관은 판문점 방문에 앞서 먼저 비무장지대(DMZ) 내 '오울렛' 초소(Observation Point Ouellette /일명 241 초소)를 방문했다. 오울렛 초소는 군사분계선에서 남쪽으로 25m 떨어진 북한쪽에 가장 가까운 초소로 17년 전 당시 클린턴 미 대통령이 방문했던 곳이기도 하다.이어 판문점 자유의 집으로 이동한 4명의 장관들은 도열해 있던 45명의 한국군·미군·다국적 연합군 장병들과 악수하며 격려했다.장관들이 판문점 군사정전위 회의실(T2)에 머무는 동안 창문 밖에서는 북한 병사들이 호기심 가득한 눈길을 지켜보기도 했다.장관들이 군사분계선 가까이에서 기념촬영을 하는 동안 북측 군사분계선에서는 병사 2명이 손으로 장관들 쪽을 가리키며 얘기를 나누는 모습이 눈에 띄었다.미국측 두 장관은 남북분단의 현장을 둘러본 소감을 밝히면서 한미동맹을 지지하고 북측의 변화를 촉구했다.클린턴 장관은 ""한국은 성장하고 일자리와 기회를 만들어내는 경제를 갖고 있고 민주주의와 자유라는 가치가 있지만 북측은 고립속에 침체돼있고 북한 주민들은 오랫동안 고통을 겪어왔다""고 말했다.그녀는 이어 ""북측의 주민들에게 이득이 되는 길이 있다""면서 ""그들이 방향을 바꾸기 전까지 미국은 대한민국의 국민과 정부 편에 굳건히 서있을 것이며 강건한 방위력을 제공할 것""이라고 말했다.게이츠 장관도 이번이 자신의 세번째 DMZ 방문이라고 소개한 뒤 20년 전과 비교할 때 남북의 달라진 모습을 보고 크게 놀랐다고 말했다.그는 ""북한은 고립과 박탈이 지속되고 있으며 천안함 사건에서처럼 예상치 못한 도발적인 행동의 역사를 이어가고 있다""면서 이 곳을 방문한 것은 ""북한과 세계에 한국의 안보에 대한 우리의 약속은 굳건하다는 강한 신호를 보내기 위한 것이며 우리의 군사동맹은 지금보다 더 강한 적이 없다.""고 강조했다.미국의 외교안보를 책임지는 국무장관과 국방장관이 함께 DMZ를 찾은 것은 처음이라고 국방부는 밝혔다.정부 당국자는 ""비무장지대내 공동경비구역 방문 자체가 한미동맹 위상이나 미국의 한반도 안보공약을 보여주는 것이며 북한에도 충분한 메시지를 전달하는 효과가 있을 것""이라고 말했다.jmkim@cbs.co.kr[관련기사]●'떠다니는 군사기지' 항공모함 조지워싱턴호 부산입항●한미 외교·국방장관 첫 공동일정…JSA 방문●오늘 '2+2회의'…""굳건한 한미동맹 보여주며 대북압박""●동해 'F-22 랩터·핵항모' 뜬다…최대규모 한미연합훈련 실시(종합)(대한민국 중심언론 CBS  뉴스FM98.1 / 음악FM93.9 / TV CH 412)<저작권자 ⓒ CBS 노컷뉴스(www.nocutnews.co.kr) 무단전재 및 재배포 금지 >"
