,날짜,기사 제목,기사 링크,기사 출처,기사 내용
0,2010-07-21,`원형 복원' 광화문 모습 드러냈다,https://news.naver.com/main/read.nhn?mode=LSD&mid=shm&sid1=102&oid=001&aid=0003477875,연합뉴스,"광화문 가림막 지붕 열렸다    (서울=연합뉴스) 복원 공사의 마무리가 한창인 서울 광화문에서 21일 인부들이 철제 가림막의 지붕을 완전히 철거했다. 제 모습을 찾은 광화문은 4년에 걸친 공사를 끝내고 광복절에 공개될 예정이다. 2010.7.21    photo@yna.co.kr가설 철제 지붕 오늘 제거…내달 15일 일반 공개(서울=연합뉴스) 이상현 기자 = 복원공사 중인 광화문이 21일 모습을 드러냈다.서울시와 문화재청 등에 따르면 문화재청은 광화문 복원공사를 위해 바깥 부분에 둘러쌌던 가설 덧집 가운데 마지막 남아 있던 철제 지붕 부분을 이날 오후 제거했다.문화재청은 현판 설치 등 복원공사를 마무리하고서 한일강제병합 100년이자 제65주년 광복절인 내달 15일 광화문을 일반에 공개할 예정이다.또 용성문(用成門), 협생문(協生門), 동ㆍ서수문장청(守門將廳), 영군직소(營軍直所) 등 건물 7동과 광화문 좌ㆍ우의 궁장(宮墻. 궁궐을 둘러싼 성벽) 일부, 광화문에서 흥례문으로 연결되는 어도(御道)도 함께 공개된다.광화문 가림막 지붕 열렸다    (서울=연합뉴스) 윤종석 기자 = 복원 공사의 마무리가 한창인 서울 광화문에서 21일 인부들이 철제 가림막의 지붕을 완전히 철거했다. 제 모습을 찾은 광화문은 4년에 걸친 공사를 끝내고 광복절에 공개될 예정이다. 2010.7.21    banana@yna.co.kr광화문은 일제강점기와 한국전쟁을 거치며 훼손 또는 일부 소실돼 1968년 철근콘크리트 구조로 보수됐는데, 이번에 사료와 사진 등을 토대로 고종2년(1865) 중건(重建) 때의 목조 구조 모습으로 복원된다.또 북쪽으로 11.2ｍ, 동쪽으로 13.5ｍ, 경복궁 중심축에서 3.75도 틀어졌던 것도 바로잡아 광화문과 그 뒤의 흥예문, 근정문이 나란히 배치된다.광화문에는 복원공사 이전까지 박정희 전 대통령의 한글 친필 현판이 있었으나 고종 중건 당시 공사책임자인 영건도감제조 임태영(任泰瑛)의 글씨를 디지털 복원을 통해 제작한 현판으로 교체 설치된다.서울시 관계자는 ""광화문 복원은 지난 20년간 이어져온 사업을 마무리짓는 큰 의미를 지닌다""고 말했다.hapyry@yna.co.kr<뉴스의 새 시대, 연합뉴스 Live><모바일 애플리케이션><포토 매거진><저작권자(c)연합뉴스. 무단전재-재배포금지.>"
1,2010-07-21,해녀는 있는데 왜 ‘해남’은 없을까,https://news.naver.com/main/read.nhn?mode=LSD&mid=shm&sid1=103&oid=028&aid=0002052942,한겨레,"[한겨레][매거진 esc]강제윤의 섬에서 만나다제주의 87살 최고령 고인호 해녀에게 듣는 ‘해녀의 삶’바다에서 해산물 채취하는 일을 직업으로 가진 여자를 해녀라 한다. 그런데 해녀는 있는데 ‘해남’은 왜 없을까. 제주를 여행해 본 사람이면 한번쯤 품어봤을 의문이다. 해녀는 일본식 표현이고 원래는 잠수 또는 잠녀라 했다. 본디 잠수는 남녀 구분이 없었다. ‘해남’도 있었던 것이다. 전복을 따서 공물로 바치는 남자 잠수는 포작이라 했다.제주 사람들은 대체로 어부나 잠수로 생을 이어 갔다. 잠수에 대한 관의 수탈이 극심했다. 16세기 후반에는 공납과 부역, 가혹한 세금 등쌀에 수많은 제주 남자들이 육지로 탈출했다. 그에 대응해 조선왕조는 200년 동안이나 출륙금지령을 내려 제주 사람 전체를 유배 죄인으로 만들기도 했다. 뭍으로 탈출하고, 바다에서 죽고, 남자들 수는 급격히 줄었다. 그때부터 잠수 일은 여자가 도맡아 했다. 제주가 ‘여다’의 섬이 된 이면에는 그토록 아픈 수탈의 역사가 있었다. 삼다도는 낭만의 삼다도가 아니라 고통의 삼다도였던 것이다. 생사의 경계를 넘나드는 까닭에 지금도 해녀들은 위계가 엄격하고, 최고 지도자인 상군의 풍모는 늠름하다. 구십을 바라보는 상군 해녀가 20㎏ 가까운 등짐을 지고 걸어오신다. 중문 바다에서 물질한 해산물. 제 한 몸 건사하기도 쉽지 않은 나이지만 노해녀는 짐을 지고도 당당하다.고인호(87) 할머니는 중문해수욕장 옆 ‘색달 해녀의 집’의 상군 해녀, 해녀 대장이다. 아마 현역으로는 세계 최고령 해녀이지 싶다. 이곳에서는 해녀들이 개인 좌판을 펴고 물질해온 해산물을 판다. 이 바다에서 나지 않는 멍게는 외부 유입이 허락되지만 소라·전복·성게·해삼 등은 본인이 물질한 것만 팔 수 있다. 다른 데서 사다 팔면 퇴출이다. 고 할머니는 중문에서 태어나 15살부터 해녀가 됐으니 벌써 72년째 현역 해녀다. 여전히 피부도 좋고 고우시다.“미인이셨겠어요.” 할머니는 손사래를 치면서도 한마디 하신다. “나 젊었을 때는 고왔지. 키도 크고.” “인기 좋으셨죠?” “남자는 필요 없었어. 이녁 눈에도 들지 않고.” 눈이 높아 웬만한 남자는 눈에 차지 않으셨던 게다. 할머니는 17살에 결혼해서 딸 하나를 뒀지만 23살 때 청상이 됐다. 한국전쟁 중에 남편은 폭사했다. 28살 때 재혼해 딸 하나 아들 하나를 낳았다. 아이를 더 낳고 싶은 맘이 없었다. “자식만 많이 낳아서 뭐해. 사람 못 만들면 소용없지.” 아이를 더 낳지 않으려고 멀리하다 보니 정이 없어져 갔다. 그 끝에 남편은 “다시 마누라를 정해” 갔다. 그 후 할머니는 내내 혼자 살며 물질해서 자식들을 키웠다.“혼자가 좋아. 누구 비위 맞출 일 없고. 이녁 자유로 살아.” 지금도 혼자다. “자식들하고 음식도 맞지 않고 같이 못 살아. 혼자가 편해.” 할머니는 “집에서는 답답한데 바닷속에 들어가면 시원”하다. 죽는 날까지 내내 그러하실 게다.강제윤 시인·<올레, 사랑을 만나다> 저자bogilnara@hanmail.net세상을 보는 정직한 눈 <한겨레>  [한겨레신문 구독|한겨레21 구독]공식 SNS 계정: 트위터www.twitter.com/hanitweet/ 미투데이http://me2day.net/hankyorehⓒ 한겨레신문사, 무단전재 및 재배포 금지<한겨레는 한국온라인신문협회(www.kona.or.kr)의 디지털뉴스이용규칙에 따른 저작권을 행사합니다.>"
2,2010-07-21,150년 이상 된 대형 산삼 발견,https://news.naver.com/main/read.nhn?mode=LSD&mid=shm&sid1=102&oid=003&aid=0003352245,뉴시스,"【하동=뉴시스】최관호 기자 = 경남 하동군에 사는 곽모씨(62)가 20일 오전 8시께 덕유산 자락 850m 고지에서 수령 150년 이상으로 추정되는 산삼을 캐 화제가 되고 있다.21일 산삼 전문가들에 따르면 일반적으로 발견되는 사지오엽, 오지오엽을 가진 산삼이 수령을 80여 년으로 추정되는 것으로 판단할 때 이번에 곽씨가 발견한 산삼은 육지오엽에 뿌리길이 70㎝, 둘레길이 9㎝에 줄기를 뺀 무게가 150g에 달해 그 수령이 150년 이상으로 추정하고 있다.또 줄기가 6개 이상인 산삼은 '지'자 대신해 '구'자를 사용해 '육구오엽'이라고 하며 전문가들이 일명 움직일 '동'자를 넣은 동삼으로 칭하는데 곽씨가 발견한 산삼은 육구오엽으로 그 가격 추정을 불허할 정도로 매우 귀한 산삼이다.곽씨는 ""이 산삼을 캐기 전날 매우 크고 흰색의 구렁이가 또아리를 틀고 있는 꿈을 꿨다""며 ""산을 탄 지 45년만에 이같이 큰 산삼을 캔 것은 처음이다""고 말했다.ckh@newsis.com"
3,2010-07-21,"파업중인 정세진, ""아나운서는 앵무새 아닌 언론인이다""",https://news.naver.com/main/read.nhn?mode=LSD&mid=shm&sid1=102&oid=308&aid=0000002706,시사IN,"ⓒ뉴시스 ""KBS를 살리기 위해 파업에 나섰다""라는 정세진 아나운서는 파업 시작 이래 하루도 빠짐없이 신관 ‘개념광장’에서 열리는 집회에 참여하고 있다.새벽 6시면 습관처럼 저절로 눈이 떠졌다. 그러나 KBS 정세진 아나운서는 여느 때처럼 출근 준비를 하지 않았다. 어머니는 딸이 6시30분이 넘도록 출근하지 않자 방으로 뛰어 올라와 ""회사에 늦었다""라고 채근했다. 정 아나운서는 어머니에게 담담하게 ""파업 한다""라고 말했다. 뭐라고 한다고 해서 말을 듣지 않는 딸을 잘 아는 어머니는 그저 ""몇 명이나 파업에 참여하고 있느냐""라고만 물었다고 한다.여성 더블 앵커 체제를 선보인 '8시 뉴스타임'을 1년 6개월 간 진행한 그녀는 지난 봄 개편 때 프로그램이 사라지면서 지난 6월부터 KBS 라디오 <출발 FM과 함께>의 진행을 맡고 있다. 그런 정 아나운서는 7월15일부로 마이크를 내려놓았다. 그녀를 포함해 전국언론노조 KBS본부(새 노조) 아나운서 조합원 17명은 7월1일부터 시작된 총파업에도 아나운서실의 상황을 고려해 전담 프로그램을 진행해 왔다. 그러나 이들은 ""새 노조를 대하는 회사의 협상 태도는 우리의 기대를 실망과 분노로 되돌려 주었다""라며 7월15일 마이크를 내려놓았다.파업으로 하루 일과는 단출해졌다. 그녀는 파업 시작 이래 하루도 빠짐없이 신관 '개념광장'에서 열리는 집회에 참여하고 있다. ""KBS를 살리겠습니다""라는 내용의 파업 지지 호소 전단지를 들고 시민들을 만나러 길거리를 나서기도 했다. 정 아나운서는 파업 21일차인 7월21일에도 맨 얼굴에 뿔테 안경을 낀 수수한 모습으로 파업 집회 자리를 지켰다. 다음은 정 아나운서와 일문일답이다.아나운서가 파업에 참여하기로 결정한 것은 쉽지 않았을텐데이상호 아나운서가 ""아나운서는 얼굴 드러내는 직업이기 때문에 버릴 것은 나 자신 뿐이다""라는 말을 했더라. 우리는 얼굴을 내건 직업을 가졌기 때문에 그럴 수밖에 없다. 아나운서는 파업을 하면 가장 많이 티가 난다. 그러나 그런 부담을 가졌다면 애초에 새 노조에 가입하지 않았을 것이다. 새 노조 아나운서 조합원 17명 모두 같은 마음이다.아나운서 조합원들의 성명서에서 ""아나운서는 결코 영혼 없는 방송기능인이 아니다""라고 했는데'강용석 의원 사태'도 있지 않았나. 아나운서를 나쁘게 보면 앵무새로, 잘 차려진 밥상에 숟가락만 얹는 얼굴 반반한 사람으로 볼 수 있다는 것도 잘 알고 있다. 그러나 아나운서는 뉴스를 얼마나 의미 있게 전달하느냐를 고민하는 사람이고 언론인이다. 그런 의미를 담았다.방송을 못하는 부담은 없나현재 대체 인력이 방송을 하고 있다. 후배들이긴 한데… 휴가 같은 이유로 대타를 맡기는 것과는 다른 느낌이다. 시청자들에게는 미안하고 죄송한 마음이다.직접 길거리로 나서 시민들에게 파업 지지를 호소하기도 했는데예상보다 좋은 반응이었다. 전단지도 잘 읽어주셨고, ""왜 파업하느냐""라고 물으시는 분도 많았다. ""좋은 KBS를 만들려고 파업하고 있다""라고 설명 드리면 외면하지 않고 잘 받아주셨다.어느덧 파업 21일차다.어제 조합원 회의를 가졌다. 20일차에 접어들면서 피로도 쌓이고, 그냥 잘 마무리되기를 바라는 마음들이 왜 없겠는가. 그렇지만 파업 대오가 흐트러지지 않는 이유는 조합원들이 공영방송 KBS를 지키겠다는 순수한 믿음과 집행부에 대한 믿음이 있기 때문이라고 생각한다. 회사가 잘못된 방향으로 가고 있는데 이번에도 침묵하면 앞으로도 계속 그래야 할 것 같았다. 언론의 역할은 권력을 감시하고 견제하는 장치 아닌가. 그런 의미에서 단체협약체결과 공정방송협의회는 꼭 필요한 일이다. 대내외적으로 어려운 상황이지만 목소리를 냈고, 선후배가 서로 믿고 따르고 있다. 파업이 장기화 되더라도 한 단계, 한 단계 앞으로 나아가는 것이 의미 있는 일이라고 생각한다.7월21일 파업 집회는 조합원 300여 명이 참여한 가운데 예능PD들이 준비한 '파업 복불복'이 한창이었다. KBS 새노조 조합원들 사이에서는 박수소리와 웃음소리가 끊이지 않았다. 파업 21일차를 맞고 있는 KBS 새노조의 엄경철 위원장은 ""웃고는 있지만 회사의 대응에 화가 나서 잠을 이루지 못한다. 21일이 아니라 200일도 각오하고 있다. 이제는 되돌아갈 길이 없다""라고 말했다.한편 39일 동안 MBC 파업을 이끌다가 해고당한 이근행 MBC 노조 위원장 역시 ""무엇을 얻고 잃는 싸움이 아닌, 해야만 하는 당위의 싸움을 하고 있다. 역사를 쓸 기회는 아무에게 주어지지 않는다""라며 KBS 새 노조 조합원들을 격려했다. KBS 새 노조 조합원들은 7월22일 지방 총국을 방문하는 '답방투쟁'을 이어갈 예정이다.장일호 ilhostyle@sisain.co.kr싱싱한 뉴스 생생한 분석 시사IN Live - [시사IN 구독]ⓒ시사IN, 무단전재 및 재배포 금지"
4,2010-07-21,“1시간이나 떠있다니” 中 충칭 밤하늘에 UFO편대 출몰,https://news.naver.com/main/read.nhn?mode=LSD&mid=shm&sid1=104&oid=143&aid=0002015726,쿠키뉴스,"[쿠키 지구촌] 중국에서 미확인비행물체(UFO)가 1시간 동안이나 상공에 머물다 사라졌다는 주장이 제기됐다.충칭상바오(重慶商報)는 지난 14일 오후 8시쯤 충칭시의 한 고층 주택 상공에서 다수의 주민들이 UFO를 목격했다고 20일 보도했다.목격자들은 UFO는 모두 4개였으며 이 중 3개는 각각 십자형으로 새하얀 빛을 발산했고 삼각형 대열을 이룬 채 움직이지 않았다고 전했다. 나머지 1개는 노란색이었으며 3개의 UFO편대와 조금 떨어진 곳에서 역시 정지한 채 빛을 발산했다.UFO가 포착됐다는 소식이 전해지자 지역 주민들은 집 근처로 나와 사진을 찍는 등 부산을 떨었다. 이들 UFO는 1시간 동안이나 상공에 머물렀다 홀연히 자취를 감췄으며, 이같은 일은 이례적이라고 신문은 설명했다.일부 시민들은 UFO가 야경을 촬영하던 헬리콥터에서 나온 불빛일 가능성을 제기했지만 헬리콥터가 1시간 동안 소리 없이 움직이지 않고 정지비행하기는 어렵다는 반론이 이어졌다.중국에서의 UFO 소동은 처음이 아니다. 지난 7일에는 항저우 소산공항 상공에 UFO가 출현해 항공기 이착륙을 방해하는 사태가 발생했다. 항저우 공항측은 공항을 1시간동안 긴급 폐쇄했고, 일부 항공기들은 다른 공항으로 비상 착륙하기도 했다. 국민일보 쿠키뉴스 김상기 기자 kitting@kmib.co.kr<갓 구워낸 바삭바삭한 뉴스 ⓒ 국민일보 쿠키뉴스(www.kukinews.com), 무단전재 및 재배포금지>"
