,날짜,기사 제목,기사 링크,기사 출처,기사 내용
76,2010-07-21,"한.미 ""동맹이 전쟁억제.평화유지 역할""",https://news.naver.com/main/read.nhn?mode=LSD&mid=shm&sid1=100&oid=001&aid=0003471252,연합뉴스,"한,미 국방장관의 대화(자료사진)한,미 국방장관의 대화     (사진공동취재단 서울=연합뉴스)  김태영 국방장관과 로버트 게이츠 미국 국방장관이 20일 오후 서울 국방부에서 만나 동해상에서 실시하는 양국 연합훈련 일정과 참가전력 규모 확정 등 주요 현안에 대한 의견을 나누고 있다.      photo@yna.co.kr공동성명서 강조..""천안함 이후 더욱 중요""(서울=연합뉴스) 노효동 기자 = 한.미 양국은 21일 오후 열리는 사상 첫 외교.국방장관('2+2') 회의에서 한미동맹이 전쟁억제와 평화유지의 핵심역할을 하고 있다고 평가하고 작년 양국 정상이 합의한 '동맹미래비전'을 토대로 양국간 동맹을 가일층 강화.발전시켜 나가기로 의견을 모을 것으로 알려졌다.정부 고위소식통은 이날 연합뉴스 기자와 만나 ""한미동맹이 지난 60년간 전쟁을 억제하고 평화를 유지하는데 핵심역할을 해왔으며 천안함 사건 이후에는 이 같은 역할이 더욱 중요해지고 있다는데 양국이 인식을 같이했다""며 ""앞으로 21세기 전략동맹을 담은 동맹비래비전을 더욱 발전시켜 나갈 것""이라고 말했다.양국은 이 같은 내용을 '2+2' 회의 직후 발표될 공동성명에 반영할 것으로 알려졌다.양국은 지난해 6월 정상회담을 통해 대북 확장억지력(Extended Deterrence)를 제공하고 양국이 기존 군사.안보 분야는 물론 정치, 경제, 사회,문화 등 모든 분야에서 범세계적이고 포괄적인 관계를 구축하자는 취지의 동맹미래비전을 채택한 바 있다.양국은 그러나 6자회담을 비롯한 북핵 문제에 대해서는 북한이 비핵화 의지와 약속을 먼저 이행해야 한다는 점을 강조하는 선에서 간단히 언급할 가능성이 높은 것으로 전해졌다.양국은 또 천안함 사건과 관련, 유엔 안전보장이사회 의장성명의 취지에 따라 북한이 '책임있는 자세'를 취하도록 촉구할 방침이다.공동성명은 ▲한미동맹 60주년 평가와 미래비전 ▲안보협력과 동맹강화 ▲천안함 사태 등 대북정책 기조 ▲지역 및 범세계적 협력방안 등 4개 부분으로 구성될 것으로 알려졌다.rhd@yna.co.kr[관련기사]▶ 한.미, 오늘 '2+2회의' 개최..공동성명 발표▶ <한미 '2+2' 회의..`대북 메시지' 주목>▶ ""한미 연합훈련은 방어적 성격""(종합2보)▶ <한미 국방장관 `공동성명' 전문>▶ 한.미 국방장관 ""연합 훈련은 방어적 성격""(종합)<뉴스의 새 시대, 연합뉴스 Live><모바일 애플리케이션><포토 매거진><저작권자(c)연합뉴스. 무단전재-재배포금지.>"
77,2010-07-21,DTI·LTV 규제 완화 진통 예상…결론 도출 어려울 듯,https://news.naver.com/main/read.nhn?mode=LSD&mid=shm&sid1=101&oid=003&aid=0003350561,뉴시스,"국토부 ""부동산대출 규제완화 안되면 계속 요구하겠다""【서울=뉴시스】류난영 기자 = 정부가 오는 22일 '주택거래 정상화 방안'을 발표할 예정인 가운데 주택담보대출인 총부채상환비율(DTI)과 주택담보인정비율(LTV) 규제를 놓고 정부 부처간 이견을 보이고 있는 것으로 나타났다.이에 따라 이명박 주재로 열리는 비상경제대책회의에서도 부동산시장에 대한 규제 완화에 대해 결론이 도출되지 못할 가능성이 높아지고 있다.정부 과천청사에서 21일 열린 위기관리대책회의에 앞서 각 부처 고위 관계자들은 부동산시장에 대한 규제 완화와 관련해 입장을 묻는 기자들의 질문에 조심스러운 반응을 보였다.최장현 국토해양부 제 2차관은 ""실제와 오가는 얘기(언론보도 내용)와는 온도차가 있고 아직 구체적으로 정해진 것은 없다""며 ""여권과 정치권의 완화 요구가 있었는데 여러가지 의견을 종합적으로 검토해 방안을 고려중이다""고 말했다.그는 ""국토부는 안되도 계속 요구하겠다는 입장""이라며 ""내일 열리는 비상경제대책회의에서 결론이 날 수 있을지는 미지수""라고 말해 규제 완화가 필요다는 입장을 고수했다.반면 진동수 금융위원장은 ""어제 회의에서 여전히 합의하지 못했고 더 이상 할말이 없다""며 확답을 회피했다.진 위원장은 그러나 앞서 대한상공회의소 초청 조찬 강연에 참석해 ""DTI와 LTV 완화 등 여러 논의가 많지만 금융사의 건전성 문제와 연결돼 있어 여러 제도를 과감하게 완화하는 것은 어렵다""고 말해 주택담보대출 비율 조정에 부정적인 입장을 보였다.이에 따라 비상경제대책회의에서도 이번 부동산 완화대책의 핵심인 DTI 비율의 상향조정 여부가 결론을 내리지 못할 가능성이 높아졌다.한편 현재 시행중인 DTI 규제에 따르면 대출 규모가 5000만 원 이상일 경우 투기지역인 강남 3구(강남·서초·송파)는 매년 상환하는 원리금이 연소득의 40%를 넘지 못하게 대출을 제한하고 있으며 강남 3구 이외의 서울지역에는 50%, 인천과 경기지역에는 60%를 적용하고 있다.you@newsis.com"
78,2010-07-21,열대야 기승…오늘 소나기로 더위 한풀 꺾일 듯,https://news.naver.com/main/read.nhn?mode=LSD&mid=shm&sid1=102&oid=096&aid=0000113945,SBS(text),"<앵커>어젯밤(20일)도 만만치 않게 더웠죠. 오늘은 비가 내리면서 더위가 한풀 꺾일 것 같습니다.장선이 기자입니다.<기자>낮부터 이어진 찜통더위의 기세는 밤에도 누그러들지 않았습니다.어제 낮 최고기온 32.3도를 기록했던 서울의 수은주는 자정이 넘어서도 28도를 웃돌았습니다.폭염에 지친 피로를 풀기엔 시원한 강바람이 제격.가족끼리 잔디에 텐트를 치고 강바람을 쐬는가 하면, 아예 노트북까지 들고 나와 데이트를 즐기는 커플들도 눈에 띕니다.[이시욱/서울 이문동 : 오늘 여자친구랑 데이트하려고 나왔는데, 날씨가 덥다 보니까 열기 식히려고 같이 한강에 나와서 바람쐬면서 동영상을 같이 보게 됐습니다.]냉방이 잘되는 대형 마트에는 야간 손님이 부쩍 늘었습니다.더위를 잊는데 수박만 한 게 있을까.잘 익은 수박을 바구니에 골라 담습니다.여름 가전제품과 피서용품을 파는 매장에는 자정이 가까운 시각에도 손님들이 몰렸습니다.더위를 땀으로 씻어버리려는 사람들의 열대야 대처법은 이열치열.숨이 턱턱 막히고 땀이 비오듯 흐르지만, 기분은 상쾌합니다.[김사영/서울 성산동 : 오늘 찜통더위였는데, 이럴 때일수록 이열치열이라고, 열심히 해서 더위를 잊기 위해 왔습니다.]기상청은 오늘도 서울의 낮 최고기온이 30도를 웃도는 등 어제와 비슷하겠지만 서울 등 중서부와 호남지방에서는 한때 강한 비가 내리면서 더위를 잠시 식혀줄 것으로 내다봤습니다.장선이sun@sbs.co.kr관/련/정/보◆ [날씨] 내일도 찜통…곳곳 더위 식혀줄 비소식◆ 쪽방 노인 보호 비상…'폭염 쉼터·구급대' 가동◆ ""아이고 죽겠네"" 비지땀 '줄줄'…더위와의 전쟁◆ 30도 웃도는 폭염에 땀 뻘뻘…잠 못드는 여름 밤[SBS기자들의 생생한 취재현장 뒷이야기 '취재파일']저작권자 SBS&SBS콘텐츠허브 무단복제-재배포 금지"
79,2010-07-21,40대 재력가 ‘女약사 살인사건’ …실종4일만에 숨진채 발견,https://news.naver.com/main/read.nhn?mode=LSD&mid=shm&sid1=102&oid=081&aid=0002100353,서울신문,"[서울신문]상당한 재력가로 알려진 40대 여약사가 납치·살해돼 경찰이 수사본부를 구성하는 등 본격적인 수사에 나섰다. 20일 오후 3시쯤 서해안고속도로 경기 광명역IC 부근 배수로에서 약사 한모(48·여)씨가 숨진 채 발견됐다. 발견 당시 한씨는 특별한 외상은 없었으나 하의가 벗겨진 상태였다. 경찰은 검찰의 지휘를 받아 이르면 21일 한씨의 시신을 부검키로 했다.앞서 지난 17일 서울 성북구 길음동에서 한씨의 빈 라세티 승용차가 불에 타고 있다는 신고가 경찰에 접수됐다. 출동한 경찰은 승용차 안에 운전자가 없자 차적조회를 거쳐 한씨의 신원을 확인, 가족들에게 연락했으나 한씨는 실종된 상태였다. 경찰은 이후 누군가가 한씨의 신용카드로 주유소에서 2만 9000원을 사용한 단서를 포착, 한씨의 납치 가능성을 염두에 두고 대대적인 수색을 펴 한씨의 시신을 발견했다. 경찰은 한씨가 17일 서울 양천구 목동의 한 대형마트에서 물건을 산 뒤 밖으로 나간 것과 폐쇄회로(CC)TV 등을 통해 한씨의 차량이 성북구까지 간 동선을 파악했다.경찰은 불에 탄 차량이 발견된 주변 지역의 CCTV를 조사해 남성 2명이 신용카드를 사용한 것으로 보고 행적을 추적하고 있다. 경찰은 한씨가 대형 약국을 운영하는 등 상당한 재력가인 점을 미뤄 재산을 노린 계획된 범행에 무게를 두고 있지만 단순 강도와 치정에 얽힌 원한 살해 가능성도 배제하지 않고 수사 중이다. 경찰 관계자는 “한씨를 납치한 것으로 추정되는 용의자들이 유가족에게 금품을 요구하는 연락을 취하지는 않은 것으로 안다.”고 말했다.정현용기자 junghy77@seoul.co.kr[서울신문 다른기사 보러가기]☞ 프로복서 경기후 의식불명…배기석 KO패 후 뇌출혈 증세☞ 재정위기 ‘심각’땐 공무원 인건비 감축☞ 10조 서민대출 ‘햇살론’ 10~13%금리 26일 첫선☞ 9급 공무원 고졸자만 응시?☞ 한약        너의 정체성은 약 ? 식품?☞ 日 눈과 귀가 김현희에 꽂혔다☞ 女약사 살인사건 40대 재력가 실종4일만에 숨진채 발견☞ “왜들 이러세요” 교육위 관련 2제☞ 부도 토종브랜드 톰보이·쌈지의 항변☞ [모닝 브리핑] 靑 비서관 인사… 정무1 김연광·정책홍보 박흥신☞ “아나운서 되려면 다 줄 생각해야”  與, 성희롱 발언 강용석의원 제명☞ ‘시간의 마술사’ 코젤렉의 개념사 역작 나왔다‘맛있는 정보! 신선한 뉴스!’ 서울신문(www.seoul.co.kr)[☞ 서울신문 구독신청] [☞ 서울신문 뉴스, 이제 아이폰에서 보세요]- Copyrights ⓒ서울신문사. 무단 전재 및 재배포 금지 -"
80,2010-07-21,"아우슈비츠, 죽음도 갈라놓지 못한 66년간의 사랑!",https://news.naver.com/main/read.nhn?mode=LSD&mid=shm&sid1=104&oid=005&aid=0000419906,국민일보,"1983년 5월말 어느날 폴란드 크라코프市 공항 입국장 앞, 흰머리의 60대 노인이 터질 듯 붉은 색의 장미 39송이를 들고 누군가를 기다리고 있었다.“실라? 진짜 실라야?”세련된 옷차림의 50대 후반 여인이 그에게 달려와 안겼다. 두 사람은 헤어진 지 39년만에 만났다. 이 남자 유라세크 빌레키의 손에 들린 장미의 개수는 그들이 헤어져있던 년수 만큼이었다.1944년 7월 21일 23살 청년이던 폴란드인 빌레키는 나치 친위대 장교 복장을 한 채 유태인 죄수복 차림의 19살 처녀 실라 시불스카를 데리고 아우슈비츠 수용소 정문을 막 통과하고 있었다.유태인 수만명이 학살당한 아우슈비츠에서 유라세크는 나치군복생산 공장 인부로 일하고 있었다. 폴란드 태생 유태인 실라는 가족과 함께 끌려와 하루하루 죽음의 문턱을 넘기고 있었다.두 사람의 첫 만남은 실라가 끌려온 첫째 날이었다. 수용소 입구에서 유라세크가 막 잡혀온 유태인무리중에서 실라를 발견한 것이다. 두 사람은 첫눈에 사랑에 빠졌다.실라의 가족은 그날 바로 “깨끗이 씻어야 한다”며 나치가 끌고간 ‘샤워실’에서 가스 샤워를 맞고 숨졌다.실라는 유라세크가 일하던 공장에 배치돼 일하게 됐다. 유라세크는 언제 죽을지 모르는 실라를 살리기 위해 탈출계획을 짰다. 공장에서 생산되는 친위대 장교복을 훔쳐 입고 실라를 죄수처럼 끌고 수용소 정문을 걸어 나가겠다는 것이었다.탈출은 성공했다. 9일을 걸어 크라코프의 유라세크 부모집을 찾아갔다. 실라는 안전한 이웃집 농장 지하창고에 숨겨졌다. 둘은 약속했다, “전쟁이 끝나면 꼭 만나 결혼하자”고.유라세크는 바르샤바로 가서 레지스탕스가 됐다. 1945년 여름 소련군이 바르샤바를 점령하며 2차대전은 끝났다. 바로 그날 유라세크는 크라코프로 달려갔다. 하지만 실라는 없었다.불과 한달전 이 도시가 소련군에 의해 해방되자 실라는 유라세크를 찾아 헤맸다. 전쟁이 완전히 끝났다고 여긴 실라는 그가 오지 않자 죽었다고 여겼다. 절망한 실라는 생존 유태인들과 함께 미국으로 이민했다.두 사람은 각자 다른 사람과 결혼했다. 실라는 유라세크를 죽었다고 여겼고, 유라세크는 그녀의 행방을 전혀 알 수 없었다.1982년 실라가 처음으로 폴란드를 찾았다. 묵었던 호텔에서 누군가에게 오래된 사랑 이야기를 했다. 듣고 있던 사람이 “그 스토리 나도 아는데”라고 했다. 유라세크는 매년 바르샤바에서 크라코프로 찾아와 실라를 수소문했던 것이다.1년뒤 공항에서 만난 두 사람의 눈은 뜨여지지가 않았다. 흐르는 눈물이 전혀 멈춰지지가 않았다.실라가 말했다, “우리 서로 이혼하고 같이 삽시다”. 유라세크가 말했다, “당신만을 사랑해. 그렇지만 아무 것도 몰랐던 자식과 손자들을 버릴 수는 없어”.실라는 “우린 다시 만날 수 없을 것 같다”며 미국으로 돌아갔다. 그녀는 2002년 뉴욕에서 노환으로 숨졌다.AP통신은 두 사람이 아우슈비츠 수용소를 탈출한 지 정확히 66년이 되는 21일 “유라세크 빌레키와 실라 시불라스카의 가슴 아픈 러브스토리가 이스라엘 야드바셈재단에 의해 공개됐다”고 보도했다.사진=AP통신통신과의 인터뷰에 나선 유라세크의 손에는 젊은 남녀의 흑백사진이 들려 있었다. 바로 20대 초반의 자신과 10대 후반의 실라였다.“우리는 서로 운명이었습니다. 그때가 다시 돌아온다면 똑같이 그녀를 사랑하고 함께 탈출했을 겁니다”유라세크 빌레키의 목소리는 89세 노인의 목소리가 아니었다고 AP통신은 전했다.신창호 기자 procol@kmib.co.kr<GoodNews paper ⓒ국민일보. 무단전재 및 재배포금지>"
81,2010-07-21,"靑, DTI규제 현상유지에 무게",https://news.naver.com/main/read.nhn?mode=LSD&mid=shm&sid1=101&oid=081&aid=0002100246,서울신문,"[서울신문]당·정·청이 부동산 거래 활성화 대책을 놓고 합의점 도출에 난항을 겪고 있는 가운데 현행 대출 규제 방안에 크게 손을 대지 않는 쪽으로 의견조율을 해 가고 있는 것으로 알려졌다.20일 오후 청와대 서별관에서는 부동산 활성화 대책을 논의하기 위해 관계부처 장관과 청와대 관계자가 모인 가운데 경제금융점검회의가 열렸다. 회의에는 윤증현 기획재정부 장관, 정종환 국토해양부장관, 진동수 금융위원회 위원장, 백용호 청와대 정책실장, 최중경 경제수석 등이 참석했다.‘4·23 대책’의 후속조치로 총부채상환비율(DTI) 규제 완화 문제가 핵심 사안이다. 청와대, 당, 부처별로 이를 둘러싼 의견은 제각각 다르다.국토해양부는 DTI 자체를 일정 수준 올리자고 주장하고 있다. 부동산 경기를 살리고, 침체에 빠진 건설업체의 입장을 고려할 수밖에 없기 때문이다. 반면 기획재정부와 금융위원회는 투기심리 재발과 금융 건전성 저해 등의 이유를 들어 현상유지를 고수하고 있다. 재정부는 DTI와 주택담보인정비율(LTV)에 손대지 않겠다는 기본 입장에 큰 변화가 없다. 당에서는 찬반 양론이 동시에 제기되면서 일치된 의견이 나오지 않고 있다. 때문에 이날 회의에서도 결론을 내지 못하고, 21일 한 번 더 회의를 갖고 22일로 예정된 비상경제대책회의에서 대책을 발표하기로 했다고 김희정 청와대 대변인은 밝혔다.앞서 이명박 대통령도 오전 국무회의가 열리기 직전 임태희 대통령실장으로부터 부동산 거래 활성화 대책과 관련한 보고를 받고 “부처 간에 아직 의견차이가 있는 것 같다. 충분히 논의하라.”고 지시했다.서울과 수도권에만 적용되는 DTI 규제완화에 대해서는 얼마나 상향 조정할지가 관심사인데 이날 회의에서는 이견을 좁히지 못했다.청와대는 원칙적으로 현상 유지 쪽이다. 집권 후반기 친서민 정책을 주요 국정지표로 제시하고, 3기 참모진이 새로 출범한 상황에서 대출규제를 풀어주면 아파트값 상승으로 이어지고 결국 서민들에게 직접적인 피해가 갈 수 있는 만큼 부동산 규제완화 대책의 시행을 내켜 하지 않고 있다.청와대 핵심관계자는 “기존 DTI 규제 등에 크게 손을 대지 않는 쪽에서 의견조율을 하고 있는 것은 맞지만 여전히 검토 중이라고 보면 된다.”면서 “22일 어떤 식으로든 대책이 발표될 것이며, 21일 논의결과에 따라 DTI 규제 비율을 일정 정도 높이는 등 상황이 바뀔 여지도 남아 있다.”고 말했다. 청와대의 다른 관계자는 “오늘 회의에서는 구체적으로 결정된 것은 없으며, 더 논의를 해 봐야 합의를 도출할 수 있을 것”이라고 전했다.그러나 현재까지는 DTI에 크게 손을 대지 않으면서 실수요자를 중심으로 한 별도의 보완대책을 마련하는 쪽으로 논의가 이뤄지는 것으로 알려졌다. LTV도 지금과 크게 달라지지는 않을 가능성이 높다.김성수·임일영기자 sskim@seoul.co.kr[서울신문 다른기사 보러가기]☞ 프로복서 경기후 의식불명…배기석 KO패 후 뇌출혈 증세☞ 재정위기 ‘심각’땐 공무원 인건비 감축☞ 10조 서민대출 ‘햇살론’ 10~13%금리 26일 첫선☞ 9급 공무원 고졸자만 응시?☞ 한약        너의 정체성은 약 ? 식품?☞ 日 눈과 귀가 김현희에 꽂혔다☞ 女약사 살인사건 40대 재력가 실종4일만에 숨진채 발견☞ “왜들 이러세요” 교육위 관련 2제☞ 부도 토종브랜드 톰보이·쌈지의 항변☞ [모닝 브리핑] 靑 비서관 인사… 정무1 김연광·정책홍보 박흥신☞ “아나운서 되려면 다 줄 생각해야”  與, 성희롱 발언 강용석의원 제명☞ ‘시간의 마술사’ 코젤렉의 개념사 역작 나왔다[ 관련기사 ]☞ 가계빚 증가 억제하려 금융규제… 완화땐 효과 상쇄☞ “양도세감면이 파급력 훨씬 클 것”☞ DTI 등 규제 풀면 가계부채 늘어 …금융기관 건전성 타격 줄까 우려☞ “LTV 완화·양도세 인하 반대”‘맛있는 정보! 신선한 뉴스!’ 서울신문(www.seoul.co.kr)[☞ 서울신문 구독신청] [☞ 서울신문 뉴스, 이제 아이폰에서 보세요]- Copyrights ⓒ서울신문사. 무단 전재 및 재배포 금지 -"
82,2010-07-21,한약        너의 정체성은 약 ? 식품?,https://news.naver.com/main/read.nhn?mode=LSD&mid=shm&sid1=102&oid=081&aid=0002100293,서울신문,"[서울신문]항공사 승무원 시험을 준비하는 나주희(25·여·가명)씨는 지난 4월 모 항공사 면접에서 황당한 경험을 했다. 무슨 까닭인지 머릿속이 하얘지고 말문이 막혀 ‘경례’라는 단어가 떠오르지 않았다. 정신이 몽롱했고, 마치 구름 위를 걷는 기분이었다. 면접에서 ‘멍 때리고’ 나온 나씨는 시험을 망친 사실을 자책할 겨를도 없이 깊은 잠에 빠져들었다. 그녀는 면접 전에 ‘면접 울렁증’ 방지에 특효라는 ‘상명탕’이라는 한약을 먹었다. 뒤늦게 후회했지만 뾰족한 구제책이 없었다.현행법상 상명탕과 같은 ‘한약’을 먹고 부작용이 발생해도 한약사에게 책임을 묻기가 쉽지 않다. 한약을 규제하는 법령이 허술하기 때문이다. 약사법에는 ‘한방원리에 따라 제조된 한약제제는 의약품’이라고 규정돼 있다. 보건복지부 관계자도 20일 “한약은 틀림없이 약”이라고 규정했다.그러나 법원의 판례는 다르다. 한약재를 불법 판매한 업자들을 무면허 의료행위로 적발, 기소해도 법원이 잇따라 무죄판결을 내리는 등 한약을 식품으로 보는 시각이 상존하고 있다. 같은 한약이라도 질병 치료 목적이면 약사법 적용을 받는 의약품이, 건강증진 목적이면 건강식품이 된다. 그야말로 ‘혼란의 대상’인 셈이다.때문에 나씨처럼 한약 부작용을 겪더라도 한약을 ‘식품’으로 정의해버리면 부작용도 ‘식품 알레르기’ 정도에 지나지 않는다.더구나 한약은 성분표시 의무규정이 없어 소비자들은 무슨 약재를 넣었는지도 모르고 복용하는 경우가 대부분이다. 한의사의 말만 믿을 수밖에 없다. 보건당국 및 한약사회 관계자들도 “한약을 탕약으로 만들고 나면 실제로 무슨 약재가 들어갔는지 확인하기 힘들다.”고 말했다. 한약의 부작용에 속수무책일 수밖에 없는 이유다.이 같은 한약의 ‘정체성’ 문제를 해결하기 위한 대안으로 전문가들은 ‘한방 의약분업’을 꼽는다. 병원과 약국처럼 한의원과 한약방이 역할을 구분하면 자연히 한약은 의약품의 범주로 들어오게 돼 한약의 분류기준 등 법적인 규제도 뒤따르게 된다는 것이다.이성영 한약조제약사회 부회장은 “그동안 한약 처방기록이 없다보니 3만원어치 약재에 30만원을 지불하고도 무슨 약재를 썼는지 확인할 방법이 없다.”면서 “한의사가 진찰·처방하고 한약사가 조제해야 처방이 투명해지고, 부작용 대응도 용이해질 것”이라고 주장했다.복지부 관계자는 “현행 법령상 한약이 약인지, 식품인지를 따지기가 어려운 게 사실”이라면서 “현재 한방 의약분업 건을 두고 관련 부처에서 논의를 거듭하고 있지만 일부 관련 단체의 반대로 추진이 쉽지 않다.”고 전했다. 이와 관련, 대한한의사협회는 한방 의약분업에 반대하고 있다. 한약은 ‘침과 함께 가야하기 때문에 시기상조’라는 이유에서다.이영준기자 apple@seoul.co.kr[서울신문 다른기사 보러가기]☞ 프로복서 경기후 의식불명…배기석 KO패 후 뇌출혈 증세☞ 재정위기 ‘심각’땐 공무원 인건비 감축☞ 10조 서민대출 ‘햇살론’ 10~13%금리 26일 첫선☞ 9급 공무원 고졸자만 응시?☞ 한약        너의 정체성은 약 ? 식품?☞ 日 눈과 귀가 김현희에 꽂혔다☞ 女약사 살인사건 40대 재력가 실종4일만에 숨진채 발견☞ “왜들 이러세요” 교육위 관련 2제☞ 부도 토종브랜드 톰보이·쌈지의 항변☞ [모닝 브리핑] 靑 비서관 인사… 정무1 김연광·정책홍보 박흥신☞ “아나운서 되려면 다 줄 생각해야”  與, 성희롱 발언 강용석의원 제명☞ ‘시간의 마술사’ 코젤렉의 개념사 역작 나왔다‘맛있는 정보! 신선한 뉴스!’ 서울신문(www.seoul.co.kr)[☞ 서울신문 구독신청] [☞ 서울신문 뉴스, 이제 아이폰에서 보세요]- Copyrights ⓒ서울신문사. 무단 전재 및 재배포 금지 -"
