,날짜,기사 제목,기사 링크,기사 출처,기사 내용
161,2015-09-24,"조경태 ""野사당화…문재인, 나를 제명하라""",https://news.naver.com/main/read.nhn?mode=LSD&mid=shm&sid1=100&oid=003&aid=0006777837,뉴시스,"【서울=뉴시스】조수정 기자 = 16일 오후 서울 여의도 국회 의원회관에서 열린 새정치민주연합 중앙위원회의에서 공개 회의를 요청했던 조경태 의원이 회의장을 나서고 있다. 2015.09.16.    chocrystal@newsis.com""반대 있는데 박수 만장일치…집단광기 아니면 뭔가""【서울=뉴시스】박주연 김태규 기자 = 새정치민주연합 조경태 의원은 김상곤 당 혁신위원장이 자신을 해당행위자로 지목하며 강력한 조치를 요구한 것과 관련, 24일 ""문재인 대표와 혁신위, 윤리심판원은 당원과 국민을 기만하는 행위를 중단하고 나를 제명시켜라""고 강력 반발했다.조 의원은 이날 국회 정론관에서 기자회견을 갖고 ""혁신위의 기자회견은 김 위원장과 혁신위가 문 대표의 전위부대임을 다시 한 번 강력하게 시사하고 있다""며 이같이 말했다.그는 ""새정치연합은 정통 야당의 맥을 이은 대한민국의 정당이지, 문 대표와 그 계파의 사당이 아니다""라며 ""작금의 위기 상황이 과연 어디에서 비롯됐는지 잘 살펴보라""고 성토했다.조 의원은 ""나는 당원을 모독한 적이 없고, 오직 당의 미래를 위해 고언을 한 것""이라며 ""중앙위에서 반대자가 있음에도 만장일치라며 박수를 치고 (혁신안을) 통과시킨 것이 '집단적 광기'가 아니면 무엇인가""라고 질타했다.그는 ""민주주의 체제에서 모든 당원들과 국민들은 자신의 이견을 자유로이 발표할 권리가 있다""며 ""반대나 비판에 대해 신중하게 검토하고 대안을 제시하면 되지 징계하거나 입을 틀어막으려고 하는 것은 반민주주의적인 발상""이라고 비판했다.조 의원은 ""당의 분열과 갈등은 선거 패배에 대한 책임을 지지 않고 독선적으로 당을 운영했기 때문에 비롯된 것""이라며 ""누가 해당행위자인지 당원과 국민들에게 공개투표로 물어볼 것을 제안한다""고 목소리를 높였다.그는 문 대표가 22일 최고위원들과 자택에서 만찬회동을 하며 통합을 강조한 것을 언급하며 ""하루도 지나지 않아 본 의원을 지목하며 해당 행위자로 모든 것이 통합의 길인가""라며 ""마음에 안 드는 사람은 쫓아내고 마음 맞는 자신들의 패거리들과만 당을 함께 하겠다는 것인가""라고 목소리를 높였다.그는 혁신위와 관련해서도 ""혁신안이라고 내놓은 것마다 당원들의 반발을 사고 분열을 초래했다""며 ""무능하다고 해야할 지, 후안무치하다고 해야 할 지 도저히 분간이 안 간다""고 지적했다.김상곤 혁신위원장은 23일 기자회견에서 ""정권과 싸우지 않고, 당의 정체성을 흔들고, 당원을 모독하며, 분열과 갈등을 조장한 조경태 의원을 비롯한 해당 행위자에 대한 강력한 조치를 당에 요구한다""고 밝혔다. 당 윤리심판원도 문재인 대표와 대립각을 세워온 조 의원에 대해 ""징계 필요성이 있다""는 입장을 내놨다.pjy@newsis.com★ 세상에 이런일이 -  ""같이 자고싶다"" 딸 친구에게 카톡 했다…★ 오늘의 핫 포토 -  할리우드의 엉덩이<저작권자ⓒ 공감언론 뉴시스통신사. 무단전재-재배포 금지.>"
162,2015-09-24,"여야 대표, 이르면 오후 회동..",https://news.naver.com/main/read.nhn?mode=LSD&mid=shm&sid1=100&oid=096&aid=0000402592,SBS(text),"새누리당 김무성 대표와 새정치민주연합 문재인 대표가 이르면 오늘(24일) 오후 회동해 내년 총선에 적용될 정치관계법 문제를 비롯한 정국 현안을 논의할 것으로 알려졌습니다.회동은 김 대표 측에서 먼저 제안했으며, 오늘 일정이 안 맞으면 늦어도 내일 회동이 성사될 것이라고 복수의 여야 관계자들이 전했습니다.김 대표는 회동에서 문 대표에게 야당의 오픈 프라이머리 도입 여부에 대한 확답을 듣고서, 만약 야당이 거부 의사를 확실히 밝힌다면 제2의 대안을 찾을 계획인 것으로 전해졌습니다.새누리당 관계자는 ""김 대표가 추석 연휴가 시작하기 전에 문 대표를 만나 오픈 프라이머리 수용 가부를 확인할 것""이라고 말했습니다.조성현 기자(eyebrow@sbs.co.kr)저작권자 SBS&SBS콘텐츠허브"
163,2015-09-24,미·중 정상회담 앞두고 9개 인권단체 백악관 앞 시위 '예약',https://news.naver.com/main/read.nhn?mode=LSD&mid=shm&sid1=104&oid=003&aid=0006777847,뉴시스,"【시애틀=AP/뉴시스】미국 내 인권단체들이 미국을 국빈 방문하는 시진핑(習近平) 중국 국가주석 일행을 따라다니며 시위를 벌일 것이라고 시사한 데 이어 9개 인권 비정부기구(NGO)가 25일 미중 정상회담이 열리는 백악관 인근에서 시위를 준비 중인 것으로 전해졌다. 미국의 본부를 둔 중국과 연관된 인권단체에는 '차이나 에드', '공민역량'(公民力量)',  대만인공공사무소(FAPA), 국제사면위원회, 국제티베트지원운동, 자유티베트학생운동, 미국위구르협회, 남몽골인권정보센터, 공산주의피해자기념기금회가 등이 포함됐다. 지난 22일  파룬궁(法輪功) 지지 시위자가 시 주석이 머무는 웨스틴 호텔 앞에서 시위를 벌이는 모습. 2015.09.24【서울=뉴시스】문예성 기자 = 미국 내 인권단체들이 미국을 국빈 방문하는 시진핑(習近平) 중국 국가주석 일행을 따라다니며 시위를 벌일 것이라고 시사한 가운데 9개 인권 비정부기구(NGO)가 25일 미·중 정상회담이 열리는 백악관 인근에서 시위를 준비 중인 것으로 전해졌다.미국의 본부를 둔 중국과 연관된 인권단체에는 '차이나 에이드', '공민역량'(公民力量)',  대만인공공사무소(FAPA), 국제사면위원회, 국제티베트지원운동, 자유티베트학생운동, 미국위구르협회, 남몽골인권정보센터, 공산주의피해자기념기금회가 등이 포함됐다고 자유아시아방송이 23일 전했다.이들 단체는 시진핑 정부가 출범한 이후 티베트족 등 소수민족 주민, 인권변호사나 작가, 기독교를 포함한 종교인들이 당국으로부터 가혹한 인권 탄압을 받아왔다고 주장했다.이런 가운데 단체들은 공동 성명에서 ""버락 오바마 미국 대통령이 인권탄압 등 행위에 관련해 시 주석에게 강력한 메시지를 전달할 것""을 촉구했다.백악관 앞 시위는 25일 오전 11시에서 오후 1시까지 열릴 예정이고, 수백명이 참석할 것으로 전망된다.이에 앞서 공민역량 등 여러 인권단체는 장쩌민(江澤民) 전 주석과 후진타오(胡錦濤) 전 주석의 미국 방문 때처럼 시 주석이 가는 곳을 따라다니며 시위를 벌이는 것이라고 밝힌 바 있다. 지난 2006년에는 후 주석을 환영하기 위해 열린 백악관 잔디밭 행사 도중 한 여성이 중국 정부의 파룬궁 탄압을 항의하는 소동이 벌인 적도 있다.한편 시 주석의 방문일정에서 중국의 인권 상황을 비판하고 이의 개선을 촉구하는 소리가 잇따르고 있다.노벨 평화상 수상자 12명은 오바마 대통령에게 지난 2일 연명으로 공개 서한을 보내 시 주석과의 회담에서 복역 중인 류샤오보(劉曉波)의 석방을 정식 요구하라고 촉구했다.수전 라이스 미국 백악관 국가안보보좌관은 23일 ""중국이 정치적으로 민감하게 느끼는 인권문제와 관련해 오바마 대통령이 솔직하게 문제를 제기할 것이라고 언급했다.sophis731@newsis.com★ 세상에 이런일이 -  ""같이 자고싶다"" 딸 친구에게 카톡 했다…★ 오늘의 핫 포토 -  할리우드의 엉덩이<저작권자ⓒ 공감언론 뉴시스통신사. 무단전재-재배포 금지.>"
164,2015-09-24,"김무성 ""전략공천 단 1명도 하지 않겠다""",https://news.naver.com/main/read.nhn?mode=LSD&mid=shm&sid1=100&oid=001&aid=0007877582,연합뉴스,"""사람 바꾸는 개혁은 반대편 숙청에 악용""(서울=연합뉴스) 안용수 배영경 기자 = 새누리당 김무성 대표는 24일 새정치민주연합 혁신위원회가 당 중진의 용퇴를 포함한 공천 혁신안을 발표한 데 대해 ""사람을 바꾸는 것은 개혁이라고 볼 수 없고, 제도를 바꿔야 진정한 개혁이 된다""고 말했다.김 대표는 이날 연합뉴스와의 통화에서 ""소위 사람을 바꾼다는 개혁은 권력의 힘으로 반대편을 숙청하는 데 악용될 수밖에 없는 도구로 전락한 지 오래됐다""면서 이같이 밝혔다.이는 국회의원 후보를 국민이 직접 뽑을 수 있도록 한 '국민공천제'(오픈 프라이머리)의 도입을 다시 한번 촉구한 것으로서, 새누리당은 앞서 지난 4월 국민공천제를 당론으로 채택한 바 있다.김 대표는 ""항상 선거 때마다 사람을 많이 바꿨지만 정치 발전은 오히려 퇴보했다""면서 ""개혁이라는 칼날로 사람을 정리하는 것은 오로지 국민의 힘으로만 가능하며, 모든 판단은 국민이 해야 한다""고 강조했다.이어 김 대표는 당 최고위원회의 직후 기자들과 만나 ""당 대표인 제 입장에서 전략 공천은 단 1명도 하지 않겠다""면서 ""의원들에게 여러번에 걸쳐서 국민공천제에 대한 의사를 확인했는데 그 취지에 반하는 의사는 전혀 없었다""고 말했다.그는 다만 새정치민주연합 문재인 대표가 김 대표의 지역구인 부산 영도 출마 가능성이 거론되는 데 대해서는 ""소이부답""이라며 언급을 삼갔다.앞서 김 대표는 당 '국민공천 TF' 회의에서도 ""국민에게 공천을 돌려주는 게 정치 개혁이며, 비민주적인 공천을 막는 게 우리 당이 가야 할 길""이라고 말한 것으로 전해졌다.aayyss@yna.co.kr▶ [현장영상] 프란치스코 교황, 포프모빌서 소녀와 '깜짝 키스'▶ [오늘의 핫 화보] 사우디 이슬람 성지순례서 대형 압사사고"
165,2015-09-24,'커플 묻지마 폭행' 가해자에 여고생 포함…2명 영장,https://news.naver.com/main/read.nhn?mode=LSD&mid=shm&sid1=102&oid=001&aid=0007877552,연합뉴스,"경찰 ""이유없이 욕설하고 택시에서 내려 집단 폭행""(인천=연합뉴스) 손현규 기자 = 남녀 커플이 길거리에서 일면식도 없던 이들에게 집단 폭행을 당하는 영상이 인터넷에 공개돼 공분을 산 일명 '부평 커플폭행 사건'의 가해자 가운데 여고생도 포함된 것으로 확인됐다.인천 부평경찰서는 23일 폭력행위 등 처벌에 관한 법률 위반 혐의로 여고생 A(18)양에 대해 구속 영장을 신청했다고 24일 밝혔다.경찰은 또 A양과 함께 폭행에 가담한 B(23)씨를 같은 혐의로 불구속 입건했다.A양 등 2명은 출석 요구를 받고 전날 자진해서 경찰서에 나와 밤늦게까지 조사를 받았다.이들은 12일 오전 5시께 술을 마신 뒤 택시를 타고 귀가하던 중 인천시 부평구의 한 도로에서 길을 가던 C(25)씨와 C씨의 여자친구(21)에게 욕설을 한 뒤 택시에서 내려 수차례 폭행한 혐의를 받고 있다.집단폭행을 당한 C씨와 여자친구는 갈비뼈와 코뼈가 부러지는 중상을 입고 병원 치료를 받고 있으며 각각 전치 5주와 3주의 진단이 내려졌다.경찰 관계자는 ""술에 취해 택시를 탄 피의자들이 아무런 이유없이 먼저 욕설을 했고 C씨가 '나이도 어린 것 같은데 그냥 가라'고 하자 택시에서 내려 폭행한 것으로 조사됐다""고 말했다.A양 등은 폭행 혐의는 인정했지만 휴대전화를 파손하고 명품시계를 빼앗은 부분에 대해서는 부인했다.앞서 경찰은 A양의 남자친구인 D(22)씨를 22일 검거해 구속영장을 신청했다.A양을 제외한 B씨 등 20대 남성 3명은 모두 친구 사이로 확인됐다.경찰은 피의자 4명 중 출석에 불응하고 도주한 나머지 피의자 한 명에 대해 체포영장을 발부받아 뒤를 쫓고 있다.son@yna.co.kr▶ [현장영상] 자동차보다 빠른 자전거 탄생?…시속 138km▶ [오늘의 핫 화보] 프랑스 '스파이더맨', 맨손으로 고층 빌딩 등반 '아찔'"
166,2015-09-24,'함바비리' 허대영 前 부산환경공단 이사장 기소,https://news.naver.com/main/read.nhn?mode=LSD&mid=shm&sid1=102&oid=421&aid=0001646728,뉴스1,"© News1상품권, 양주 등 9000만원치 수수 혐의…전직 총경도 구속기소(서울=뉴스1) 홍우람 기자 = '함바(건설현장 식당) 브로커' 유상봉(69)씨에게서 거액의 뇌물을 받은 혐의로 허대영(58) 전 부산환경공단 이사장이 재판에 넘겨졌다.서울중앙지검 강력부(부장검사 심재철)는 특정범죄가중처벌법상 뇌물, 알선뇌물 수수 혐의로 허 전 이사장을 불구속기소했다고 24일 밝혔다.사기와 뇌물공여 혐의로 구속돼 부산지법에서 1심 재판을 받고 있는 유씨도 뇌물공여 혐의로 추가 기소됐다. 유씨는 강희락 전 경찰청장 등 유력 인사들에게 금품을 건넨 혐의 등으로 재판을 받으며 수감생활과 석방을 반복하고 있다.허 전 이사장은 부산시청 도시개발본부장으로 근무하던 지난해 2~5월 20차례에 걸쳐 유씨로부터 300만원치 백화점 상품권과 몽블랑 볼펜, 양주, 현금 등 9000만원 상당의 금품을 받은 혐의를 받고 있다.유씨는 허 전 이사장이 도시개발본부장 지위를 이용해 건설공사 인허가, 민원처리에 힘을 써주고 관할 구·군청 공무원 등에게 영향력을 행사해 자신이 건설현장 함바 운영권을 따낼 수 있도록 청탁한 것으로 조사됐다.검찰은 앞서 허 전 이사장에 대해 두 차례 구속영장을 청구했으나 법원이 기각함에 따라 불구속 상태로 그를 재판에 넘겼다. 허 전 이사장은 검찰 수사를 받게되자 지난달 사임했다.검찰은 경찰 간부들에게 로비를 해 관할 건설현장 함바 운영권 수주를 돕는 명목으로 유씨에게서 5000여만원을 받은 혐의로 전직 경찰 총경 성모(64)씨도 구속기소했다. 성씨와 범행을 공모한 건설회사 대표 이모(53)씨도 재판에 넘겨졌다.hong87@▶ 뉴스1 100% 무료 만화 서비스 오픈!![© 뉴스1코리아(news1.kr), 무단 전재 및 재배포 금지]"
167,2015-09-24,8월 주택 인·허가 6.9만호…전년비 41.2% 증가,https://news.naver.com/main/read.nhn?mode=LSD&mid=shm&sid1=101&oid=366&aid=0000291923,조선비즈,"8월 주택 인·허가 물량이 6만9269호로 지난해보다 41.2% 증가한 것으로 나타났다. 주택시장 회복 영향으로 올해 1월부터 전년 대비 증가세가 계속되고 있다.24일 국토교통부에 따르면 1~8월 주택 인허가 실적은 45만2185호로 지난해 같은 기간보다 44.2% 늘었다. 수도권이 3만8031호로 162.9% 증가했다. 서울과 인천, 경기가 각각 217.9%, 1122.7%, 88.4% 늘었다. 지방 인허가 물량은 9.7% 감소한 3만1238호를 기록했다. 부산, 충북, 전북은 증가했지만 강원, 경북, 경남에서 인허가 물량이 감소했다.유형별로는 아파트가 4만9076호로 지난해보다 36.1% 증가했다. 아파트 외 주택은 55.4% 늘어난 2만193호를 기록했다.8월 주택 착공실적은 전국 6만8609호로 지난해보다 117.3% 증가했다. 수도권이 161.6% 증가한 4만962호, 지방이 73.7% 늘어난 2만7647호가 착공했다. 아파트가 4만9063호, 아파트 외 주택이 1만9546호로 각각 173.3%, 43.4% 증가했다.공동주택 분양물량은 전국 4만5224호로 지난해보다 97.8% 늘었다. 누계 기준으로는 58.3% 증가한 29만7318호를 기록했다. 청약시장 호조로 3월 이후 전년 대비 증가세가 계속되고 있으며 증가폭은 7월(90.2%)보다 확대됐다.수도권은 149.2% 증가한 2만2057호, 지방은 대구, 세종, 충남을 중심으로 65.4% 늘어난 2만3167호를 기록했다. 분양주택과 임대주택은 각각 101.9%, 47.6% 증가해 2만9543호, 1만1400호가 분양됐다.주택 준공실적은 전국 3만7974호로 지난해보다 6.8% 감소했다. 수도권에서는 인천, 경기를 중심으로 53.9% 증가해 2만266호를 기록했으나 지방은 35.7% 감소한 1만7708호였다. 지방에서는 울산, 경북, 제주를 제외한 모든 지역에서 지난해보다 감소한 것으로 나타났다.8월 주택 인·허가, 착공, 분양, 준공 실적 / 국토교통부 제공[세종=이현승 기자nalhs@chosunbiz.com][조선비즈 바로가기] [위클리비즈] [페이스북] [카카오스토리]chosunbiz.com"
168,2015-09-24,"북한, 당창건 70주년 앞두고..",https://news.naver.com/main/read.nhn?mode=LSD&mid=shm&sid1=100&oid=001&aid=0007877804,연합뉴스,"지난해12월12일 평안북도 철산군 동창리 서해위성발사장에서 '은하 3호' 로켓이 발사되는 모습. (AP/조선중앙통신=연합뉴스 자료사진)국제기구에 시기·낙하지점 통보할 듯…남측에도 통보 가능성""아직 발사 징후 없어…준비 미비 땐 발사 시기 늦출 수도""(서울=연합뉴스) 최선영 기자 = 북한이 다음 달 10일 노동당 창건 70주년 기념일을 앞두고 장거리 로켓 발사를 위한 수순을 차곡차곡 밟는 모양새다.특히 장거리 로켓 발사로 인한 국제사회의 반발과 제재를 우려한 듯 새로 건설한 위성관제종합지휘소(이하 관제소)의 외부를 외국 언론에 공개하며 군사용이 아닌 순수 과학기술 차원임을 주장하고 있다.북한은 지난 14일 국가우주개발국(NADA) 국장을 내세워 장거리 로켓 발사를 시사한데 이어 23일에는 외국 언론 가운데 처음으로 미국 CNN방송의 취재를 허용하며 발사가 임박했음을 노골적으로 드러냈다.북한 관제소 관계자들은 CNN방송 취재진에 ""위성을 우주로 내보낼 통제 체계를 완성했다""며 ""곧 쏘아 올릴 위성은 지구 관측용""이라고 강조했다.당 창건 기념일을 앞두고 위성으로 주장하는 장거리 로켓을 발사할 것이라는 입장을 더 이상 머뭇거리지도, 숨기지도 않고 공개적으로 언급한 셈이다.앞서 북한 NADA 국장은 당 창건 기념일을 앞두고 새로운 지구관측 위성 개발이 마감단계에 있고 새로운 높은 단계인 정지위성에 대한 연구와 발사장 확장사업 개건 확장 사업 진척 등을 이례적으로 소개했다.그러면서도 그는 과거 발사 때와 달리 구체적인 시험 발사 계획과 날짜를 못박지는 않은 채 ""당 중앙이 결심한 시간과 장소""라고만 언급했다.장거리 로켓 발사 시사로 인한 국제사회의 여론을 떠보는 듯한 행보였다.그러나 미국은 물론 중국까지 유엔 안보리 결의 위반이라고 강력 반발하는 등 국제사회의 반응은 예상보다 더 혹독했다.북한은 이를 의식한 듯 이번에 CNN방송을 초청해 ""우리가 무엇 때문에 미국을 포함한 다른 나라에 핵폭탄을 떨어뜨리겠느냐""며 국제사회의 반발을 누그러뜨리려고 안간힘을 썼다.더욱이 평화적 과학기술을 강조하기 위해 그 어느 나라에서든 당연한, 관제소에 대한 기본적인 경비인력조차 배치하지 않는 '꼼수'를 연출하기도 했다.앞서 2012년 4월에도 북한은 평화적 위성발사를 강조하기 위해 장거리 로켓 발사에 앞서 AP통신, CNN 등 외국 기자들을 초청해 '은하-3호' 로켓과 '광명성-3호' 인공위성을 보여줬다.북한 노동당 창건 70돌 기념 포스터가 지난 15일 평양 거리에 내걸려 있다. (AP=연합뉴스 자료사진)사실 북한 지도부 입장에서 장거리 로켓 발사는 국제사회의 반발과 아랑곳없이 당 창건 70주년을 대축제로 기념할 수 있는 가장 중요한 정치행사라고 할 수 있다.이에 따라 북한은 이번 당 창건 기념일을 앞두고 관련 기관과 매체를 통해 장거리 로켓 발사 계획을 구체적으로 밝히며 수순을 계속 밟아 나갈 것으로 보인다.특히 국제민간항공기구(ICAO)와 국제해사기구(IMO)에 발사 예정기간과 낙하지점 등을 통보하고 남한과 중국, 일본 등 주변 국가의 항공당국 등에도 경로 등을 통보할 것으로 예상된다.북한은 김정은 체제 들어 장거리 로켓 발사와 핵실험 과정에서 국제기구나 주변 국에 사전 통보하는 등 절차를 나름 중시하고 있다.더욱이 '8·25합의'로 남북관계가 화해 분위기로 간신히 전환된 이후 북한은 남북관계의 판을 먼저 깨지 않으려는 모습을 보이고 있어 이번 발사를 앞두고 남측에 통보할 가능성을 배제할 수 없어 보인다.장용석 서울대 통일평화연구원 선임연구원은 ""북한이 당 창건 기념일을 앞두고 장거리 로켓 발사의 운을 떼고 분위기를 착착 만들어가고 있다""며 ""기술적 문제만 없다면 무조건 내달 당 창건 기념일을 앞둔 시점에서 발사 가능성이 높아 보인다""고 말했다.장 선임연구원은 ""그럼에도 불구하고 장거리 로켓 발사 준비가 완벽하지 않으면 당 창건 기념일 뒤로 미룰 수도 있다""고 관측했다.북한이 '말'로는 발사 임박을 주장하고 있지만 실제 위성 등으로 포착되는 발사 움직임은 거의 없다는 점에서 기술적 문제나 준비 미비 등으로 인해 당 창건 기념일을 넘겨 발사할 수도 있다는 것이다.정부의 한 고위 소식통은 24일 ""동창리 미사일 발사장에서 장거리 미사일 발사를 실제 준비하거나 발사가 임박했다는 징후는 아직 없다""면서 ""사람과 장비 움직임도 예전보다 늘어난 수준은 아니다""고 밝혔다.북한 현광일 NADA 과학개발국장도 CNN방송에 ""더 미더운 기반에서 더 나은 위성을 운반하기 위해 발사 장소를 고르고 있다""며 여전히 준비단계에 있음을 밝혔다.정부 당국은 북한이 이번에 로켓을 발사한다면 2012년 발사한 '은하 3호' 로켓의 엔진을 개량해 만든 새로운 크기의 로켓을 쏠 것으로 관측하고 있다.북한은 앞서 2012년에도 4월5일 '광명성 3호' 1호기 위성을 탑재한 은하 3호를 쏘아 올렸으나 실패하면서 같은 해 12월12일 다시 2호기를 발사해 성공한 전례가 있다.chsy@yna.co.kr▶ [현장영상] 자동차보다 빠른 자전거 탄생?…시속 138km▶ [오늘의 핫 화보] 프랑스 '스파이더맨', 맨손으로 고층 빌딩 등반 '아찔'"
