,날짜,기사 제목,기사 링크,기사 출처,기사 내용
100,2015-09-24,'전략공천·물갈이' 쟁점 부상..,https://news.naver.com/main/read.nhn?mode=LSD&mid=shm&sid1=100&oid=008&aid=0003549858,머니투데이,"[머니투데이 이하늘 김태은 김승미  기자] [[the300]새누리, 전략공천 여부로 전선 이동…새정치, 쇄신안에 비주류 중진 반발]내년 총선을 6개월여 앞두고 여야의 공천갈등이 임계점을 향하고 있다. 김무성 새누리당 대표는 ""전략공천은 1석도 안할 것""이라며 친박(친 박근혜)계를 중심으로 한 '국민공천' 흔들기에 대한 본격적인 방어에 나섰다. 새정치민주연합은 혁신위원회가 전날 제안한 인적 쇄신안의 직격탄을 맡게 될 비주류 중진들의 반발이 거세지면서 공천 내홍이 심화되고 있다.김무성 새누리당 대표와 윤상현 청와대 정무특보가 24일 오후 서울 올림픽공원 핸드볼경기장에서 열린 월남전 참전 51주년 기념식에서 어깨동무를 하고 있다. /사진= 뉴스1◇김무성 ""전략공천 1명도 안해""…공천 갈등 전선 이동=김 대표는 이날 오전 국민공천제TF(태스크포스) 회의와 당 최고위원회에 잇따라 참석한 뒤 기자들과 만나 ""최근 다른 주장(오픈프라이머리 불가론)이 나오기 시작하는 만큼 의원총회에서 결론을 내겠다. 아마 흔들림이 없을 것""이라고 말했다. 특히 ""내년 총선에서 단 한명도 전략공천을 하지 않겠다""며 특정 인사나 계파에 의한 공천을 배제하겠다는 의지를 분명히 했다.김 대표의 이같은 '전략공천 제로' 선언은 친박계의 오픈프라이머리 불가론과 TK(대구·경북) 지역을 중심으로 한 물갈이 가능성이 함께 제기되면서 전략공천을 배제하는 '국민공천제'에 대한 회의론이 확산되는 것을 차단하기 위한 것으로 풀이된다. 국민공천의 핵심은 '전략공천 배제'인데 최근 친박계에서 오픈프라이머리 회의론을 내세워 이같은 본질마저 흔들려 한다고 본 것이다. 공천 갈등의 핵심이 '전략공천 여부'에 있다는 점을 분명히 함으로써 '물갈이'에 민감한 현역의원들의 지지를 공고히 하는 의도도 담긴 것으로 보인다.친박계와 청와대는 박근혜 대통령의 텃밭인 TK 지역 등을 중심으로 현역 물갈이가 필요하고 이를 위해선 일부 '전략 공천'이 필요하다는 입장으로 알려져 있다. 이날 국민공천제 TF 회의에 참석한 한 재선 의원은 ""국민공천제 원칙을 살리더라도 일부 수정을 가해야 한다는 목소리 하나와 전략공천을 하자는 주장 또하나가 당내에 있는데 이 둘은 완전히 다른 이야기""라고 말했다.이에 따라 오는 30일로 예정된 새누리당 의원총회에서는 '전략공천' 여부를 두고 '친박'대 '비박(비 박근혜)'계 간의 본격적인 충돌이 전개될 가능성도 배제할 수 없다. 추석연휴 이틀 뒤 열리는 의총을 앞두고 양측은 지역구 지지자들의 여론규합에도 적극적으로 나설 전망이다. 이에 앞서 김 대표는 문재인 새정치연합 대표와 연휴기간 중 만나 여야 동시 오픈프라이머리 시행을 관철시키기 위한 협상에 나선다.문재인 새정치민주연합 대표가 23일 서울 여의도 국회에서 열린 당무위원회의에서 김상곤 당권재민혁신위원장과 인사하고 있다. /사진= 뉴스1◇野 혁신위 인적쇄신안, 비주류 중진들 거센 반발 =새정치연합은 당 혁신위원회의 인적쇄신안 발표 이후 공천 갈등이 수면 위로 전면 부상했다. 쇄신안이 전직 대표 등 비주류 중진들의 희생을 강요하는 것으로 해석되고 있기 때문이다. 혁신위는 전날 하급심 유죄판결을 받은 후보자도 공천에서 배제하기로 하는 등의 내용을 발표했다. 전직 대표와 중진들을 향해서는 '선당후사'를 해달라며 열세지역 출마를 촉구하기도 했다.김한길 ·정세균 ·안철수 전 대표는 침묵했지만 박지원 전 원내대표는 공개적으로 혁신안에 대해 반발했다. 박 전 원내대표는 이날 한 라디오 방송에 출연해 ""본인이 동이하지 않는다면 어디로 가라는 것은 옳지 않다""며 ""지역구 선택은 본인의 자유""라고 반박했다. 박 전 원내대표는 하급심 유죄판결자에 대한 공천 배제안에 대해서도 ""제1야당이 공천권을 검찰에 반납했다""며 ""과연 우리 당을 위해서 누가 앞장서서 싸웠냐""며 수용 불가 입장을 밝혔다. 자신의 거취에 대해서도 ""당에서 어떻게 저에게 하느냐에 따라 결정하겠다""며 여지를 남겼다. 전날 혁신위원회로부터 '해당행위자'로 지목받은 조경태 의원도 기자회견을 열고 ""징계 운운하지 말고 나를 제명하라""며 반박했다.새정치연합이 혁신안 후폭풍으로 뒤숭숭하자 신당 창당을 선언한 천정배 무소속 의원은 새정치연합의 원심력이 거세질 것이라는 기대감을 드러냈다. 천 의원은 라디오 방송에 출연해 ""안철수 전 대표가 (아무 일도) 없었던 것처럼 그대로 머무르기 어렵지 않겠냐""고 했다.한편 혁신위로부터 부산 출마를 권유받은 문 대표는 김무성 대표의 지역구인 영도구 출마 가능성에 대해 ""조금 더 시간을 달라""며 유보적인 입장을 보였다. 김 대표는 맞대결에 대한 질문에 ""소이부답(笑而不答, 웃기만 할 뿐 대답을 하지 않는다)""이라고 짧게 답했다.['생존 재테크' 백과사전 ""재테크를 부탁해"" ][부자들에게 배우는 성공 노하우 '줄리아 투자노트'  ][내 삶을 바꾸는 정치뉴스 'the 300'][CEO의 삶을 바꾼 '내 인생 최고의 조언' ][아찔한 girl~ 레이싱모델 핫포토 ]이하늘 김태은 김승미  기자 iskra@mt.co.kr<저작권자 ⓒ '돈이 보이는 리얼타임 뉴스' 머니투데이, 무단전재 및 재배포 금지>"
101,2015-09-24,사우디 이슬람 하지 행사서 최소 100명 압사·390명 부상,https://news.naver.com/main/read.nhn?mode=LSD&mid=shm&sid1=104&oid=001&aid=0007879032,연합뉴스,"인산인해 사우디 하지 순례자들 (AP=연합뉴스 자료사진)(메카 AFP·dpa=연합뉴스) 사우디아라비아 성지 메카 외곽의 미나에서 24일 열린 이슬람 성지순례(하지) 행사에서 사고가 발생해 최소 100명이 압사하고, 390명이 부상했다고 사우디 국영 TV가 보도했다.mihye@yna.co.kr▶ [현장영상] 프란치스코 교황, 포프모빌서 소녀와 '깜짝 키스'▶ [오늘의 핫 화보] 바다로 향하는 사원…오하라 알몸 축제"
102,2015-09-24,"'이태원 살인사건' 패터슨 측, 재판..",https://news.naver.com/main/read.nhn?mode=LSD&mid=shm&sid1=102&oid=032&aid=0002637105,경향신문,"‘이태원 살인사건’의 진범으로 지목된 미국인 아서 패터슨(36)의 변호인이 첫 재판을 연기해달라고 재판부에 신청했다. 앞서 사건을 맡은 서울중앙지법 형사합의27부는 다음달 2일 첫 공판준비기일을 진행하기로 한 바 있다.패터슨 측 변호인인 오병주 변호사는 24일 경향신문과의 인터뷰에서 “아직 예전 재판의 기록열람도 못한 상태라 변론을 준비하기에 날짜가 너무 촉박하다”며 “다른 재판과도 겹치는 만큼, 재판부에 연기신청을 한 것”이라고 밝혔다.앞서 패터슨 측은 송환되기 전인 지난 6월 미국에서 재판을 받을 당시 오 변호사를 선임한 바 있다. 패터슨은 송환 직후 구치소에서 변호인을 접견했으며, “에드워드 리가 마약을 복용하고 범행한 것”이라며 자신의 입장을 간단히 밝힌 것으로 전해졌다. 오 변호사는 “향후 검찰 기소의 문제점을 중심으로 사건을 살펴볼 것”이라며 “하지만 구체적인 내용에 있어서는 재판 기록 등을 충분히 확인해봐야 정해나갈 수 있을 것”이라고 말했다.패터슨은 1997년 서울 이태원의 한 패스트푸드점 화장실에서 조중필씨(당시22세)를 흉기로 살해한 혐의를 받고 있다. 미국으로 도주했던 패터슨은 지난 23일 국내로 송환됐다."
103,2015-09-24,"日 '가미카제 유서', 세계기록유산 후보 탈락",https://news.naver.com/main/read.nhn?mode=LSD&mid=shm&sid1=104&oid=022&aid=0002919652,세계일보,"비행기에 오르기 전 술을 마시는 병사.'가미카제 자살특공대'의 유서가 유네스코 세계기록유산 선정에서 탈락했다.일본 유네스코 위원회는 외교관이었던 스기하라 지우네 관련 자료와 군마현 다카사키시에 있는 고대 비석을 2017년 등재 목표로 일본 후보로 선정했다고 NHK가 24일 보도했다.미나미큐슈시가 신청한 자살특공대 유서 등 관련 기록은 후보에 오르지 못했다.스기하라는 제2차 세계대전 중 유대인들이 동유럽을 침공한 나치 독일의 박해를 피해 리투아니아의 일본 영사관에 쇄도했을 때 정부의 훈령을 어기며 수천 명에게 일본 비자를 발급해 '일본의 쉰들러'로 불리는 인물이다.일본 정부가 2차대전 중 박애적인 행동을 한 자국민 관련 자료를 세계 유산에 등재하려는 것은 한국과 중국의 '역사 공세'에 대항하는 의도로 해석된다.또 다른 등재 후보인 고대 비석 '고즈케산피'는 한반도 비석 문화의 영향을 받은 3개의 석비로 7~8세기 각각 다른 인물이 건립했다.이동준 기자 blondie@segye.comⓒ 세상을 보는 눈, 글로벌 미디어세계일보"
104,2015-09-24,추석 갓길 주행 꼼짝 마…경찰 헬기 '독수리눈' 단속,https://news.naver.com/main/read.nhn?mode=LSD&mid=shm&sid1=103&oid=052&aid=0000718020,YTN,"[앵커]추석 연휴 기간 고속도로 갓길 주행과 버스 전용차로 위반 등에 대한 집중 단속이 실시됩니다.적발되면 최대 10만 원의 과태료 등이 부과됩니다.강진원 기자의 보도입니다.[기자]경찰이 갓길 주행과 버스전용차로 위반 등 '얌체운전'을 집중단속합니다.추석 연휴 기간 원활한 교통 소통을 위해서입니다.경부와 호남, 서해안 등 귀성과 귀경 차량이 몰리는 주요 고속도로와 국도가 대상입니다.이를 위해 고성능 항공 카메라가 장착된 경찰 헬기 12대가 투입됩니다.600m 상공에서도 자동차 번호판을 식별할 수 있습니다.[윤충한, 경찰청 항공담당관]""추석 연휴 기간에 원활한 교통 흐름을 유지하고 국민의 생명을 보호하기 위해서 이른바 얌체운전을 집중단속할 예정입니다.""갓길을 주행하거나 버스 전용차로제를 위반하다 적발되면 차량 소유주는 최대 10만 원의 과태료를 내야 합니다.하지만 운전자가 확인될 경우 벌점 30점과 최대 7만 원의 범칙금이 부과됩니다.위반 정도가 심한 자동차가 공중에서 포착되면 현장에 직접 경찰을 출동시킬 방침입니다.경찰은 이 밖에 헬기를 통해 수집한 실시간 병목구간 정보를 교통방송과 인터넷 등을 통해 제공합니다.또 정체된 도로에서 응급환자가 발생하면 인근에 있는 헬기로 신속히 이송할 계획입니다.YTN 강진원[jinwon@ytn.co.kr]입니다.[저작권자(c) YTN & YTN PLUS. 무단 전재-재배포 금지]"
105,2015-09-24,폴크스바겐 조작 의심 차량 국내 15만대 추산 ,https://news.naver.com/main/read.nhn?mode=LSD&mid=shm&sid1=103&oid=001&aid=0007878906,연합뉴스,"폴크스바겐 배출가스 조작 파문 확산    (서울=연합뉴스) 김주성 기자 = 독일 폴크스바겐 그룹이 전세계적으로 1천100만대의 자사 디젤차량에서 배출가스 차단장치가 조작됐을 가능성을 인정함에 따라 국내 대상 차량도 수만대에 이를 것이라는 전망이 나오면서 파문이 확산되고 있다. 23일 오후 서울의 한 폴크스바겐 서비스센터. 2015.9.23    utzza@yna.co.kr폴크스바겐 8종 11만대·아우디 6종 3만5천대리콜 시 수입차로는 최대 규모(서울=연합뉴스) 김윤구 기자 = 독일 폴크스바겐그룹의 배출가스 조작 의심 차량이 국내에 15만대 가까이 있는 것으로 추산된다.아우디폭스바겐코리아 관계자는 24일 ""본사에서 EA 189 엔진이 탑재된 1천100만대에 문제가 있을 수 있다고 발표했는데 유로 5 환경기준의 1.6L와 2.0L 디젤차가 해당하는 것으로 파악됐다""고 말했다.유로 5 환경기준의 디젤차는 2009년부터 팔리고 있는데 일부 차종은 올해 9월부터 확대 적용되는 유로 6 모델로 최근 교체됐다.한국수입차협회 통계를 보면 폴크스바겐 브랜드는 조작 의심 차량이 이번에 미국에서 문제 차종으로 꼽힌 골프와 제타, 비틀, 파사트 외에도 티구안을 비롯해 폴로, CC, 시로코까지 8개 차종 약 11만대에 이르는 것으로 나타났다.아우디 브랜드 역시 미국에서 적발된 A3를 포함해 A4, A5, A6, Q3, Q5 등 6개 차종 약 3만5천대가 해당하는 것으로 나왔다.폴크스바겐과 아우디는 2009년부터 올해 8월까지 각각 11만4천337대와 4만1천850대의 2천㏄ 이하 디젤차를 팔았다. 합치면 15만6천187대다.폴크스바겐은 골프 3만4천320대, 티구안 2만6천602대, 파사트 1만8천1대, CC 1만4천289대, 제타 1만3천931대 등이 팔렸다. 아우디는 A4 1만2천473대, A6 1만4천대 등이 판매됐다.이 가운데 최근 유로 6 기준에 맞춰 출시된 골프, 제타, A3, A4, A5, A6 등 몇몇 차종의 일부 판매량은 제외된다는 것이 아우디폭스바겐코리아의 설명이다. 아우디에서는 유로 5 모델 판매량은 3만5천173대로 집계됐으며 폴크스바겐에서는 골프, 제타 등 3천313대를 제외하면 유로 5 차량이 11만1천대 가량 있는 것으로 파악됐다.조작 차량으로 의심되는 유로 5 차량은 약 14만6천대에 이르는 것으로 환경부와 아우디폭스바겐코리아는 추산하고 있다.아우디폭스바겐코리아 관계자는 ""EA 189 엔진에 출력과 배기가스를 제어하는 소프트웨어가 수십종에 다르므로 같은 엔진이라도 개별적인 조사가 필요하다""면서 ""폴크스바겐그룹과 독일 교통부가 이를 조사중""이라고 말했다.다음달부터 진행될 환경부의 배출가스 조사에서 폴크스바겐 측이 부정한 방법으로 인증을 받은 것이 입증돼 리콜이 이뤄질 경우     수입차 배출가스 관련 리콜로는 역대 최대 규모가 될 것으로 보인다.국산차로는 현대·기아차가 2011년 투싼, 싼타페, 스포티지 등 12개 차종에서 에어컨 가동 시 질소산화물 저감장치인 배출가스 재순환장치의 작동을 축소해 질소산화물을 과다배출한 일로 87만대를 리콜한 사례가 있다.한편 환경부는 이날 평택항에 입고한 폴크스바겐 골프 등 4개 차종을 1대씩 봉인조치했으며 이후 국립환경과학원에서 이들 차량의 배출가스를 조사할 예정이다.kimyg@yna.co.kr▶ [현장영상] 프란치스코 교황, 포프모빌서 소녀와 '깜짝 키스'▶ [오늘의 핫 화보] 사우디 이슬람 성지순례서 대형 압사사고"
106,2015-09-24,'이태원 살인사건' 패터슨 첫 재판..,https://news.naver.com/main/read.nhn?mode=LSD&mid=shm&sid1=102&oid=421&aid=0001647902,뉴스1,"'이태원 살인사건' 피고인 아더 존 패터슨. © News1 이광호 기자패터슨 측, 변호사 3명 선임…기일변경 요청검찰, 수사검사 투입하고 준비…치열한 공방 예상(서울=뉴스1) 성도현 기자 = 18년전 이태원의 햄버거가게에서 한국 대학생을 살해한 진범으로 지목된 미국인 아더 존 패터슨(35)에 대한 첫 재판이 10월2일 열린다.검찰이 패터슨을 지난 2011년 12월 살인 혐의로 기소한 이후 약 4년 만이다.24일 법원에 따르면 패터슨에 대한 첫 재판은 서울중앙지법 형사합의27부(부장판사 심규홍) 심리로 2일 오후 2시 311호 법정에서 열린다.공판준비기일인 이날 재판은 본격적인 심리에 앞서 쟁점을 정리하고 입증계획을 세우는 내용으로 진행될 예정이다.패터슨은 1997년 4월3일 밤 서울 이태원의 한 패스트푸드점 화장실에서 조중필(당시 22세 대학생)씨를 흉기로 수차례 찔러 숨지게 한 혐의를 받고 있다.패터슨은 미국으로 도주한지 16년 만인 지난 23일 새벽 인천국제공항을 통해 국내로 송환돼 서울구치소에 수감됐다.패터슨은 자신의 혐의에 대해 줄곧 무죄를 주장하고 있으며 범행 현장에 함께 있었던 친구 에드워드 리가 범인이라는 입장이다.패터슨은 한국인 친모를 통해 최근 오병주(59·사법연수원 14기) 변호사를 선임했다. 오 변호사는 전날에는 서울구치소에서 변호인 접견을 통해 패터슨을 면담했다.또 오 변호사 이외에 이래영(44)·이기윤(32) 변호사 역시 패터슨의 변호를 맡게 된다. 오 변호사 등 3명은 이날 법원에 정식으로 변호인 선임계를 냈다.검찰 역시 당시 사건 수사 및 기소를 담당했던 검사를 재판에 투입하는 등 철저한 공판 전략을 세우고 있어 치열한 법정 공방이 예상된다.오 변호사는 ""6월에 패터슨 어머니의 전화를 받고 패터슨이 국내 송환되는 과정부터 도왔다""며 ""사건 기록 등을 받아 검토한 뒤 무죄를 입증하기 위해 노력할 것""이라고 밝혔다.그러면서 ""생각보다 공판준비기일 날짜가 일찍 잡혔다""면서 ""기일변경 신청도 검토하고 있다""이라고 덧붙였다.오 변호사는 고(故) 성완종 전 경남기업 회장의 스스로 목숨을 끊기 전 수사를 받는 과정에서 성 전 회장의 변호를 맡기도 했다.한편 검찰은 이 사건 공소유지를 서울중앙지검 형사3부(부장검사 이철희)에 맡기는 동시에 기소 당시 수사검사였던 박철완(43·사법연수원 27기) 부산고검 부장검사를 투입하기로 했다.검찰은 박 부장검사를 서울중앙지검에 파견하지는 않고 검사직무대리 발령을 내 공판 전후로 참여하도록 할 계획이다.검찰은 18년 전 발생 사건에 대한 재판이라 보강증거 확보가 어렵다는 지적에 대해 당시 재수사를 하면서 증거를 많이 확보한 상태라며 자신감을 내비치고 있다.검찰 관계자는 ""법리적으로 혐의 입증에 자신이 있기 때문에 기소한 것""이라며 ""패터슨은 리가 범인이라고 주장하지만 우리는 패터슨이 범인이라고 확신한다""고 강조했다.dhspeople@news1.kr▶ 뉴스1 100% 무료 만화 서비스 오픈!![© 뉴스1코리아(news1.kr), 무단 전재 및 재배포 금지]"
107,2015-09-24,檢 '통진당 불법자금 조성 의혹' 김재연 前의원 소환,https://news.naver.com/main/read.nhn?mode=LSD&mid=shm&sid1=100&oid=001&aid=0007878924,연합뉴스,"김재연 전 의원(연합뉴스 자료사진)(서울=연합뉴스) 전성훈 기자 = 서울중앙지검 공안2부(김신 부장검사)는 통합진보당의 불법 정치자금 조성 의혹과 관련해 24일 김재연(35) 전 의원을 피의자 신분으로 소환해 조사했다.검찰은 압수수색을 통해 확보한 증거물과 관련자 진술을 통해 김 전 의원이 불법 자금 조성을 인지했거나 부분적으로 관여한 사실을 파악했다.검찰은 이날 김 전 의원에게 사실 관계를 추궁했으나 김 전 의원은 묵비권을 행사하며 진술을 거부한 것으로 전해졌다.김 전 의원은 그동안 거듭된 검찰의 소환 요청에 불응하다 이날 변호인 없이 혼자 검찰에 출석했다.검찰은 통진당이 2013∼2014년 시·도당과 소속 국회의원 후원회를 통해 6억7천여만원의 불법자금을 조성했다는 내용의 고발을 중앙선거관리위부터 접수해 수사 중이다.선관위는 당시 김선동·김미희·오병윤·이상규·김재연·이석기 등 전직 의원 6명이 공모한 것으로 의심된다며 검찰에 수사의뢰했다.lucho@yna.co.kr▶ [현장영상] 프란치스코 교황, 포프모빌서 소녀와 '깜짝 키스'▶ [오늘의 핫 화보] 바다로 향하는 사원…오하라 알몸 축제"
108,2015-09-24,"지난해 60~64세 고용률, 20대..",https://news.naver.com/main/read.nhn?mode=LSD&mid=shm&sid1=102&oid=003&aid=0006778123,뉴시스,"60~64세 고용률 58.3%로 2013년 57.2%보다 1.1%포인트 상승20대 고용률은 전년비 0.6% 상승한 57.4%에 그쳐 상황 역전지난해 65세 이상 고용률도 31.3%로 전년比 0.4%포인트 상승올해 55~79세 고령자 중 무려 61.0%가 취업 희망65세이상 남성 이혼은 전년比 8.2%, 여성은 17.4% 증가【세종=뉴시스】안호균 기자 = 지난해 베이비부머 세대들의 고용시장 진입으로 60~64세 고용률이 20대 고용률을 추월한 것으로 나타났다.24일 통계청이 발표한 '2015 고령자통계'에 따르면 지난해 60~64세 인구 고용률은 58.3%로 2013년(57.2%)에 비해 1.1%포인트 상승했다.반면 20대 고용률은 2013년 56.8%에서 2014년 57.4%로 0.6%포인트 상승하는 데 그쳐 60~64세와 20대의 고용률이 역전됐다.65세 이상 고령자의 고용률은 2013년 30.9%에서 2014년 31.3%로 0.4%포인트 상승했다.60세 이상 고용률 상승은 지난해 베이비부머 세대들이 생계 불안으로 고용 시장에 적극적으로 참여했기 때문이다.고령자들의 근속 기간은 점차 짧아지는 추세다.통계청이 55~64세 취업 경험자를 대상으로 '가장 오래 근무한 일자리에서의 평균 근속기간'을 조사한 결과 올해 평균 근속 기간은 14년9개월로 지난해(15년4개월)에 비해 7개월 단축됐다.일자리를 그만둔 이유로는 사업부진·조업중단·휴폐업(34.1%), 권고사직·명에퇴직·정리해고(10.5%) 등 직장 사정에 의한 경우가 44.6%를 차지했다.건강이 좋지 않아서(19.6%),가족을 돌보기 위해(16.0%), 일을 그만둘 나이가 됐다고 생각해서(2.6%) 등 개인적인 사정에 의한 퇴직은 상대적으로 비율이 낮았다.고령자들 중 60% 이상은 취업을 원하는 것으로 나타났다.올해 55~79세 고령자 중 장래에 일하기 원하는 비율은 61.0%에 달했다. 근로 희망 사유는 '생활비에 보탬(57.0%)'이 가장 많았고 '일하는 즐거움(35.9%)', '무료해서(3.6%)', '사회가 필요로 함(1.7%)', '건강 유지(1.6%)' 등이 그 뒤를 이었다.고령자가 생계를 가족에게 의지하지 않고 스스로 해결해야 한다는 인식도 점차 높아지고 있는 것으로 조사됐다.65세 이상 인구를 대상으로 부양 의무에 대한 견해를 조사한 결과 '노후 생계를 부모 스스로 해결해야 한다'고 생각하는 응답자는 2012년 22.3%에서 2014년 23.8%로 증가했다.'가족과 정부, 사회가 부모 부양을 함께 책임져야 한다'는 의견도 2012년 34.6%에서 2014년 35.7%로 늘어났다. 반면 '가족이 부모를 돌봐야 한다'는 견해는 36.6%에서 34.1%로 감소했다.결혼과 이혼에 대한 인식이 변화하면서 황혼이혼도 크게 늘었다.지난해 65세 이상 남성 고령자의 이혼은 5914건, 여성 고령자의 이혼은 2721건으로 각각 전년 대비 8.2%와 17.4%씩 증가했다. 남자 고령자와 여자 고령자의 이혼은 총 이혼건수(11만6000건)의 5.1%와 2.4%를 차지했다.65세 이상 고령자 중 '이유가 있으면 이혼을 하는 것이 좋다'고 답한 응답자는 2012년 5.6%에서 2014년 7.7%로 증가했다.배우자에 대한 만족도는 남자가(63.6%) 여자(52.2%)에 비해 높았다. 자녀와의 관계에 대한 만족도는 남자(66.7%)와 여자(66.5%)가 비슷한 수준이었다.ahk@newsis.com★ 세상에 이런일이 -  ""같이 자고싶다"" 딸 친구에게 카톡 했다…★ 오늘의 핫 포토 -  할리우드의 엉덩이<저작권자ⓒ 공감언론 뉴시스통신사. 무단전재-재배포 금지.>"
109,2015-09-24,철원서 훈련 중 병사 K-2 소총 갖고 종적 감춰,https://news.naver.com/main/read.nhn?mode=LSD&mid=shm&sid1=100&oid=001&aid=0007878842,연합뉴스,"<< 연합뉴스 자료사진 >>군 당국 ""실탄은 휴대하지 않아""…민통선 검문검색 강화(철원=연합뉴스) 이재현 기자 = 24일 오후 1시 30분께 강원 철원군 근남면 마현리 인근 민간인출입통제구역(민통선) 이북에서 육군 모 부대 소속 A 일병이 부대 훈련 중 종적을 감춰 군·경이 수색을 벌이고 있다.당시 A 일병은 K-2 소총을 가지고 있었으나 실탄은 휴대하지 않은 것으로 알려졌다.A 일병은 이날 민통선 이북에서 소속 부대 훈련 중이었다.군 당국은 훈련 장소 인근과 민통선 지역을 중심으로 수색 작업을 벌이고 있다.또 경찰은 민통선 이남 지역과 주요 지점에서 검문검색을 강화하고 있다.jlee@yna.co.kr▶ [현장영상] 프란치스코 교황, 포프모빌서 소녀와 '깜짝 키스'▶ [오늘의 핫 화보] 사우디 이슬람 성지순례서 대형 압사사고"
