,날짜,기사 제목,기사 링크,기사 출처,기사 내용
87,2015-09-12,서울 1인가구 절반은 월평균소득 93만원 미만,https://news.naver.com/main/read.nhn?mode=LSD&mid=shm&sid1=101&oid=421&aid=0001624551,뉴스1,"""청년층 비중 가장 높아""…51.7%1인가구 가운데 81.8%가 전세와 월세, 사글세(서울=뉴스1) 정혜아 기자 = 서울시에 거주하는 1인가구 가운데 절반 가량의 월평균소득이 93만원에도 못 미치는 것으로 조사됐다.서울시의회가 12일 열린 '서울에서 혼자 사는 사람들의 이야기'에서 내놓은 자료 '서울특별시 1인가구 대책 정책연구 최종보고서'에 따르면 서울 1인가구 49.9%는 월평균소득이 93만원 이하로 조사됐다.반면 월평균소득이 250만원을 넘는 경우는 4.6%에 불과해 서울 1인가구에는 경제적으로 취약한 계층이 다수 포함된 것으로 분석됐다.서울 1인가구 가운데 청년층(19~39세)의 비중은 51.7%로 절반을 넘는 것으로 조사됐다. 30대 미만 비중이 26.7%로 가장 높고 30~39세가 24.8%, 40~49세가 14.8% 순으로 나타났다.성별로 살펴보면 남성 가구주의 경우 25~29세의 분포가 가장 높고 이는 나이가 많아질수록 낮아졌다.여성 가구주 역시 25~29세의 1인가구 비중이 가장 컸다. 다만 나이가 많아질수록 비중이 줄다가 중년을 지나면 다시 증가하는 것으로 나타났다. 70세 이상이 여성 1인가구 중 16.8%나 차지했다.거주형태별로 살펴보면 다가구주택을 포함한 단독주택이 54.9%를 차지했다. 아파트는 19.9%이고 고시원, 오피스켈을 비롯한 주택 이외는 11.2%, 다세대주택은 9.7%였다.그러나 81.8%가 전세와 월세, 사글세로 살고 있어 임차비중이 압도적인 것으로 나타났다. 자가는 16.4%에 불과했다.이에 보고서는 서울의 1인가구 대다수가 경제적 빈곤과 주거에 대한 불안을 겪고 있다며 이에 대한 지원 정책과 제도가 필요하다고 제언했다.통계청 추계 자료에 따르면 서울 전체 가구 중 1인가구는 2015년 현재 27%를 차지하고 있다. 또한 2030년에는 서울의 1인가구가 30.76%가 될 전망이다.wit4@▶ 뉴스1 100% 무료 만화 서비스 오픈!![© 뉴스1코리아(news1.kr), 무단 전재 및 재배포 금지]"
88,2015-09-12,일본 도쿄에 규모 5.3 강진…지하철 일부 중단,https://news.naver.com/main/read.nhn?mode=LSD&mid=shm&sid1=104&oid=056&aid=0010220796,KBS,"오늘 오전 5시49분 일본 도쿄만에서 규모 5.2의 지진이 발생했습니다.이 지진으로  도쿄도 조후 시에서  진도 5 수준의 흔들림이 감지됐고  도쿄도 주변 지역에서는 진도 3∼4가 관측됐습니다.진원의 위치는  북위 35.5도, 동경 139.8도며,  진원의 깊이는 57km입니다.일본 언론에 따르면  이번 지진으로 도쿄도 나가노 구에서  83세 여성이 침대에서 떨어져 골절상을 입는 등 모두 15명이 다쳤습니다.또 엘리베이터가 멈춰서  사람들이 갇히고, 도쿄 지하철 일부 노선의  운행이 일시 중단되기도 했습니다.일본 기상청은 이번 지진으로 인한 쓰나미 위험은 없다고 밝혔습니다.그러면서  2∼3일 안에 최대 진도 4의 여진이 일어날 가능성이 있다며 주의를 당부했습니다.우정화기자 (jhw01@kbs.co.kr)▶[취재후] 방송에서 못한 현장 이야기▶ KBS뉴스 SNS[트위터][페이스북][카카오][저작권자ⓒ KBS 무단복제-재배포 금지]"
89,2015-09-12,노사정 오늘 협상 재개…주말 타결 어려울 듯,https://news.naver.com/main/read.nhn?mode=LSD&mid=shm&sid1=102&oid=052&aid=0000714864,YTN,"[앵커]노사정 대표자들이 오늘 오후 다시 만나 핵심 쟁점 조정안 도출을 시도합니다.정부는 다음 주 노동개혁 관련 법안을 입법하겠다며 주말 대타협을 압박하고 있지만 협상 타결은 쉽지 않을 전망입니다.홍상희 기자의 보도입니다.[기자]정부가 제시했던 논의 시한인 지난 10일, 노사정이 대타협 도출에 실패하자 최경환 경제부총리는 다음 주 노동개혁을 위한 정부 입법 절차에 착수하겠다고 말했습니다.[최경환, 부총리 겸 기획재정부 장관(어제)]""내주 초에는 입법 절차에 들어갈 수밖에 없다... 이번 주말이든, 언제든 합의를 해주면 그 내용은 정부 입법 과정에 충분히 반영을 해 나가겠다...""새누리당도 14일 당·정 협의를 열고 노동개혁 5개 법안을 자체적으로 마련하기로 했습니다.이번 주말 대타협을 모색해야 한다는 무언의 압박입니다.노사정 4자 대표는 오늘 오후 다시 만나 취업규칙 변경과 일반해고 지침에 대한 조정문 조율을 다시 시도하기로 했습니다.그러나 전망은 어둡습니다.두 가지 핵심 쟁점 외에도 아직 논의조차 시작하지 못한 의제가 쌓여 있기 때문입니다.비정규직 고용 기간을 지금의 2년에서 4년으로 연장하는 것과 현재 32개 업종으로 제한된 파견 허용 대상에 55세 이상 고령자와 고소득 전문직을 추가하는 문제도 민감한 사안입니다.절차상 장애물도 있습니다.노사정 대표자들이 노동개혁 대타협에 잠정 합의 하더라도 한국노총은 중앙집행위원회를 열어 합의 내용에 동의를 받아야 합니다.그러면 다시 노사정 위원과 공익위원이 참석하는 본위원회를 열어 대타협 합의문을 최종 체결하는 절차가 남아 있습니다.김대환 노사정위원장은 지난 10일 노사정은 논의 시한을 정한 적이 없다며 협상을 계속해 나가겠다는 의지를 분명히 했습니다.[김대환, 노사정위원장(지난 10일)]""대타협을 통해서 노동시장 구조개혁의 이 발판을 마련하는 데 가치를 둘 것인지, 아니면 일정 지키는 데 가치를 둘 것인지 정부가 선택해야 합니다.""노사정이 두 가지 쟁점에서 합의를 이룬다 해도, 다른 논의과제와 절차가 남아있어 주말 대타협은 어려워 보입니다.YTN 홍상희[san@ytn.co.kr]입니다.▶ [원 포인트 생활상식] 멀리서 걸어오시는 사장님, 인사 타이밍은 언제?▶ [블랙박스TV] 잘 달리던 차가 갑자기 전복된 이유[저작권자(c) YTN & YTN PLUS. 무단 전재-재배포 금지]"
90,2015-09-12, '9월 금리인상 전망' 많이 약해져,https://news.naver.com/main/read.nhn?mode=LSD&mid=shm&sid1=101&oid=001&aid=0007850363,연합뉴스,"미국 기준금리 인상시점은 9월? (워싱턴 AP=연합뉴스) 재닛 옐런 미국 연방준비제도 의장이 7월 16일 상원 은행위원회에서 발언 자료를 준비하고 있다. 7월 고용지표로 볼 때 연준이 9월에 금리를 인상할 것이라는 예측이 나오고 있다.WSJ 8월조사땐 82% '9월 인상'→ 최근에는 46%로 '뚝'(뉴욕=연합뉴스) 이강원 특파원 = 미국 중앙은행인 연방준비제도(연준)가 다가오는 '9월 금리·통화 정책 결정회의'에서 기준금리를 인상할 것이라는 전망이 크게 낮아졌다.불과 한 달전까지만 해도 경제전문가들의 80% 이상이 9월에 기준금리가 오를 것이라고 봤으나, 미국 중앙은행의 회의가 내주로 임박하자 이 비율이 절반 이하로 뚝 떨어진 것이다.미국 중앙은행은 16일부터 이틀간 금리·통화 정책 결정기구인 연방공개시장위원회 회의를 열어 기준금리 인상 여부를 결정한다.미국의 경제일간지 월스트리트저널(WSJ)은 11일(현지시간) 미국의 경제 전문가 64명을 대상으로 미국 중앙은행이 언제 기준금리를 올릴 것으로 보느냐고 물은 결과, 응답자의 46%가 ""이번 9월 회의에서 올릴 것으로 본다""고 답했다고 전했다.이어 '올해 12월 인상' 답변이 35%로 2번째로 많았다. 이어 '올해 10월 인상' 답변은 9.5%에 그쳤다.中증시, 폭락의 끝은 어디?(베이징 AP=연합뉴스) 중국 상하이증시가 8월 26일(현지시간) 인민은행의 금리 인하에도 1.27% 하락했다. 이날 상하이종합지수는 전날보다 1.27%(37.68포인트) 하락한 2,927.29로 마감했다. 이날 폭락으로 지난 닷새간 낙폭은 23.1%로 커졌다. 사진은 이날 베이징의 한 증권사 객장에서 주식 시세판을 바라보는 중국인 투자자.또 기준금리 인상 시기가 2016년으로 넘어갈 것으로 전망한 답변 역시 9.5%에 달했다.이번 조사에서 '9월 인상 전망' 답변이 가장 많았지만 바로 앞선 8월초 같은 조사에서는 '9월 인상'을 점친 응답이 무려 82%에 달한 것에 비하면 9월 인상 전망의 강도는 크게 낮아졌다.아울러 당시 조사에서는 10월 인상 답변은 3%, 12월 인상은 13%, 2016년 인상은 2%의 분포를 보였다.8월 조사와 달리 이번 조사에서 9월 인상 답변이 크게 줄어든 데 대해 한 전문가는 ""미국 중앙은행이 기준금리 인상 시기를 결정할 중요한 변수는 미국 경제의 상황이 아니다""면서 ""중국발(發) 경기 부진이 궁극적으로 미국 경제에 어떤 영향을 미칠 수 있느냐가 중대 고려 요인이 될 것""이라고 말했다.gija007@yna.co.kr▶ [현장영상] 우리와 '흡사한' 300만년 전 새 인류 발견▶ [오늘의 핫 화보] 오늘의 메이저리그 명장면"
91,2015-09-12,세월호 참사로 고아된 7·9살 아동에 건보료 부과 논란,https://news.naver.com/main/read.nhn?mode=LSD&mid=shm&sid1=102&oid=001&aid=0007850366,연합뉴스,"복지부, 비판 일자 건강보험법 시행령 개정부모없는 미성년자 소득없으면 건보료 부과 않기로(서울=연합뉴스) 서한기 기자 = 건강보험 당국이 세월호 참사로 부모를 잃고 고아가 된 아동에게 건강보험료를 부과했다가 불합리하다는 지적을 받고 관련법을 고쳐 보험료를 매기지 않기로 했다.12일 보건복지부에 따르면 건강보험공단은 최근 세월호 사고로 부모가 희생되고 홀로 남은 7살 여자 아이 A양과 9살 남자 아이 B군에게 건강보험료를 거뒀다.현재 부모 없이 미성년자로만 구성된 단독가구라도 소득과 재산이 있으면 건강보험법 시행령에서 정한 '지역가입자 보험료 연대 납부의무 대상자'로 건보료를 내야 한다.이 조항에 근거해 건보공단은 세월호 희생자 A양과 B군이 비록 소득은 없지만, 재산은 있는 것으로 나타나 보험료를 부과했다.A양과 B군은 숨진 부모가 유산으로 남긴 집 등 재산은 있지만 소득이 전혀 없어 보험료를 낼 수 없는 처지였다.이처럼 참사로 부모를 잃고 보험료를 낼 능력이 없는 아동들에게 건보료를 매긴 데 대한 비판의 목소리가 나오자, 복지부는 즉각 이런 일이 발생하지 않도록 건강보험법 시행령을 고쳐 입법예고하고, 공포하는 대로 시행하기로 했다.개정안은 부모가 없는 미성년자가 비록 재산이 있더라도 소득이 없으면 보험료를 내지 않도록 하는 단서 조항을 뒀다.건보공단은 직장가입자에는 근로소득으로만 보험료를 부과한다. 반면 자영업자와 일용직 근로자 같은 지역가입자는 종합소득과 재산, 자동차, 가구원수, 생활수준 등을 따져 건보료를 매긴다. 직장가입자는 보험료의 절반은 자신이, 나머지 절반은 사업자가 부담하지만, 지역가입자는 보험료를 온전히 자신이 내야 한다.shg@yna.co.kr▶ [자막영상] ""다른 남자 만나?""…살해 후 옷 벗겨 장롱 속에▶ [오늘의 핫 화보] 9·11 테러 14주년…미국 전역 추모 물결"
92,2015-09-12,워터파크서 몰카 찍으면 잠복 여경에 딱 걸린다,https://news.naver.com/main/read.nhn?mode=LSD&mid=shm&sid1=102&oid=001&aid=0007850387,연합뉴스,"전국을 떠들썩하게 했던 '워터파크 몰카'사건의 촬영자인 최모(27.여.구속)씨가 자신이 찍은 동영상에 찍혀 경찰에 덜미를 잡혔다.(수원=연합뉴스) 최해민 기자 = '워터파크 몰카' 사건으로 다중이용시설을 방문하는 여성들이 불안에 떨고 있는 가운데 경찰이 경기지역 주요 워터파크에 잠복 경찰관을 배치하는 등 특단의 대책을 내놨다.12일 경기지방경찰청에 따르면 경찰은 이달부터 주말마다 주요 워터파크와 대형 찜질방 등에 잠복 경찰관을 배치, 몰래카메라나 강제추행 등 성범죄 특별단속을 하고 있다.지난 5일과 6일 경기청은 27개 경찰서 관할 40여곳에 여성 경찰관 40여명을 포함, 경찰관 총 100여명을 투입해 단속에 나섰다.단속 장소에는 용인 캐리비안베이, 부천 웅진플레이도시와 같은 도내 주요 워터파크, 300명 이상 동시 이용이 가능한 대형 찜질방, 수원역사 및 백화점 등 쇼핑센터, 지하철 역사 등이 포함됐다.워터파크에 투입되는 여경들은 2인 1조로, 일부는 해당 시설 근무자 복장으로 단속을 벌였다.경찰은 이번 주말인 12일과 13일 도내 70개소에 여경 70여명을 포함, 150여명을 투입해 특별 단속에 나선다.경기경찰청 관계자는 ""몰카 범죄가 사회적인 문제로 대두되면서 범죄 행위 적발은 물론, 범죄발생을 억제하는 효과를 위해 여성 운집 장소에 잠복 경찰관을 배치하기로 한 것""이라고 설명했다.경찰은 한 달간 특별단속을 한 뒤 잠복근무를 확대할지를 결정할 방침이다.goals@yna.co.kr▶ [현장영상] 우리와 '흡사한' 300만년 전 새 인류 발견▶ [오늘의 핫 화보] 오늘의 메이저리그 명장면"
93,2015-09-12,'혼돈'의 새정치聯 어디로…'재신임 정국' 수습될까?,https://news.naver.com/main/read.nhn?mode=LSD&mid=shm&sid1=100&oid=421&aid=0001624540,뉴스1,"새정치민주연합 문재인 대표가 11일 오후 서울 중구 플라자호텔에서 이석현 국회 부의장, 박병석 전 국회 부의장 등 야당 중진 의원들과 비공개 회동을 마친 후 밖으로 향하고 있다. 2015.9.11/뉴스1 © News1 안은나 기자주류-비주류간 갈등 골 깊고, 이해관계 맞물려 있어 쉽지 않아내주께 신당론 가시화될 경우 혼란 극심 관측…극적 중재 가능성도(서울=뉴스1) 김현 기자,서미선 기자 = 새정치민주연합이 지난 9일 문재인 대표의 '재신임'과 관련한 기자회견 이후 '재신임 정국'이라는 혼돈의 소용돌이에 빠져들어 좀처럼 헤어나오지 못하고 있다.문 대표를 중심으로 한 당내 친노(친노무현)·주류와 안철수 전 공동대표 등 비노(비노무현)·비주류는 재신임 정국이 조성된 이후 상대에게 반격에 재반격을 가하며 치킨게임식의 극심한 분열상을 보이고 있다.당내 중진들이 이같은 분열상을 해소하기 위해 중재를 시도하고 있지만, 양측간 갈등의 골이 이미 깊어질 대로 깊어진 데다 오는 16일 혁신안 처리를 두고 한 치의 물러섬 없는 일전을 불사하겠다는 입장이어서 설(說)만 무성하던 분당이 현실화되는 게 아니냐는 관측마저 나오고 있다.여기에 천정배 무소속 의원을 중심으로 한 신당론도 중앙위를 전후해 가시화될 것으로 보여 당내 원심력은 더욱 커질 것으로 예상된다.문 대표는 9일 혁신안 중앙위 통과와 연계한 재신임 카드를 꺼낸 데 이어 11일엔 재신임투표를 13~15일 사흘간 전(全)당원투표와 국민여론조사를 각각 실시해 하나라도 불신임을 당하면 대표직에서 사퇴하겠다고 밝혔다.문 대표의 이같은 행보는 최근 안 전 대표를 필두로 한 비주류가 혁신안에 대해 강도 높게 반발하고, 자신의 거취를 압박하고 있는 상황에서 '재신임' 카드로 정면 돌파를 시도한 것으로 풀이된다.게다가 문 대표는 비주류가 자신의 재신임 카드에 '조기 전당대회 개최'로 맞불을 놓자, 11일 당내 반대에도 불구하고 재신임 투표시기를 예상(16일 중앙위 이후)보다 앞당겼고, 투표방식도 당초 거론했던 '전당원투표 50%+국민여론조사 50%' 안(案)에서 이를 각각 실시한 뒤 하나라도 과반을 넘지 못할 경우 사퇴하는 안으로 속도와 강도를 끌어올렸다.이와는 별도로 부산지역 친노 그룹의 핵심인사로 꼽히는 최인호 혁신위원은 지난 10일 개인 자격으로 기자회견을 갖고 '이해찬 용퇴론'을 촉구, 주류발(發) 인적쇄신론의 불씨를 던지며 비주류를 겨냥했다.비주류도 문 대표의 일격에 허를 찔리긴 했지만, 가만히 있진 않았다. 그동안 '혁신 실패'를 앞세워 문 대표의 대승적 결단을 촉구해온 기세를 늦추지 않고 문 대표의 사퇴 및 조기 전당대회 개최 요구로 공세를 이어갔다.비주류는 또 문 대표가 전날(11일) 다수의 최고위원들이 반대했음에도 의결을 거치지 않은 채 재신임 투표시기와 방법을 일방적으로 발표한 데 대해 개별 또는 그룹별 성명을 내고 ""독선"", ""정당민주주의 위배""라고 하는 등 날선 비판을 쏟아 부었다.양측간 갈등이 격화되고 있는 가운데, 정세균 상임고문을 중심으로 한 범주류는 문 대표의 전격적인 재신임안을 강도 높게 비판하고 나선 것을 넘어 문 대표의 결단까지 촉구해 눈길을 끌고 있다.이는 지난 2·8 전당대회때 문 대표의 손을 들어줬던 범주류가 사실상 문 대표의 사퇴에 방점을 찍은 것으로 해석되면서 당내 역학구도마저 복잡하게 얽히고설키는 흐름이다.새정치민주연합 이석현 국회부의장과 이종걸 원내대표 등 중진의원들이 11일 오후 서울 여의도 국회에서 문재인 대표의 재신임 문제와 당내 현안을 논의하기 위해 긴급 회동을 갖고 있다. 2015.9.11/뉴스1 © News1 양동욱 기자당내 제세력간 긴장감이 급격히 상승함에 따라 당내 중진들은 전날(11일) 긴급 회동을 갖고 '중앙위 소집과 재신임투표 등 당내 문제는 국정감사 이후 본격 논의하자'는 중재안을 제시하며 가열된 양측의 분위기를 가라앉히는 데 주력했다.중진들은 '재보선 정국'을 주도하고 있는 문 대표와 전날 심야회동을 갖고 중재를 시도했지만, 문 대표가 재신임투표는 추석 전까지 연기가 가능하되 중앙위 소집은 연기가 불가능하다는 입장을 꺾지 않으면서 합의점을 도출하는 데는 실패했다.이로 인해 정치권에선 당내 제세력간 이해관계가 첨예하게 맞물리고 있는 만큼 이번 ‘재신임 정국’이 해소되긴 쉽지 않을 것이라는 관측이 제기된다. 특히 이르면 내주중, 늦어도 내주 주말께 가시화될 신당론과 겹치면서 양측간 갈등의 수위는 최고조로 상승할 것이라는 분석도 나온다.중립 성향으로 분류되는 한 3선 의원은 12일 뉴스1과 통화에서 ""이미 서로가 어떤 말을 해도 신뢰하지 못하고 있는 데다 이번 갈등은 사실상 내년 총선 공천권이라는 민감한 이해관계와 맞물려 있어 어느 한쪽이 물러서긴 쉽지 않은 상황""이라며 ""더욱이 혁신안이 통과되든 부결되든, 문 대표 재신임안이 통과되든 부결되든 당은 구심력보단 원심력이 크게 작용할 것""이라고 전망했다.당내 신당파로 분류되는 한 인사는 ""'재신임 정국'으로 인해 비주류는 사실상 (분당의) 명분을 상당히 축적한 셈""이라며 ""문 대표가 안 전 대표와 천 의원이 9일 오전 회동하고 난 뒤 오후에 곧바로 재신임 카드를 꺼낸 것은 뭔가 분위기가 심상치 않다는 것을 느꼈기 때문이 아니겠느냐""고 말했다다만, 문 대표가 전날 중진들과의 회동에서 재신임투표 연기 가능성을 열어둔 것을 감안하면 추가 논의를 거쳐 이날중 극적인 합의를 도출할 경우, '재신임 정국'이 해소되는 방향으로 가닥이 잡힐 가능성도 배제할 수 없다.박병석 전 국회부의장은 전날 회동 직후 기자들과 만나 ""구체적인 문제는 오늘(11일) 의견을 충분히 교환했기 때문에 더 논의해보겠다. (중진회동을 다시 개최하는 것을) 검토해보겠다""고 말했다.김성수 당 대변인도 ""문 대표가 (회동에서) 역제안한 것으로 보면 된다""고 밝혔고, 중앙위 소집 연기를 거부한 배경에 대해 ""중진 의원들이 애초 '혁신안에 이의가 있어 중앙위를 미뤄야 한다'고 제안했기 때문""이라고 설명했다.gayunlove@▶ 뉴스1 100% 무료 만화 서비스 오픈!![© 뉴스1코리아(news1.kr), 무단 전재 및 재배포 금지]"
