,날짜,기사 제목,기사 링크,기사 출처,기사 내용
0,2015-09-24,"배 나온 당신, 일단 걸으세요",https://news.naver.com/main/read.nhn?mode=LSD&mid=shm&sid1=103&oid=032&aid=0002637171,경향신문,"ㆍ식후 남은 에너지 ‘지방으로 축적’ㆍ야식·음주 후 자면 뱃살만 늘어나ㆍ1시간 정도 걸으면 체중 유지 도움충분한 식사를 하고 소화가 잘되면 일단 에너지(칼로리)가 넘치는 상태가 된다. 신체가 계속 움직이고 있으면 영양분이 근육이나 뇌의 에너지로 쓰이기 때문에 신체에 저장되는 부분이 적어진다. 쓰고 남은 에너지는 결국 지방(체지방)으로 바뀌어 주로 피부 아래(피하지방)나 내장(내장지방)에 축적된다. 결국 비만은 에너지 균형의 문제다.전문의들에 따르면 지방이 잘 축적되는 순간이 있다고 한다. 우선 부교감신경계의 활성화, 즉 긴장이 풀어지면 근육이나 뇌의 기능이 저하되어 지방 축적이 잘 된다. 단순당 섭취가 지나쳐 인슐린이 과다하게 분비될 때도 마찬가지다. 인슐린 저항성이 생겨 비만을 초래한다.결식과 과식이 불규칙하게 ‘롤러코스터’를 타면 지방 축적이 급격히 늘어난다. 식사를 제대로 안 하다 과식을 하면 그걸 소화하느라 몸이 이완되고 움직임이 둔화되기 때문이다. 특히 음주 후에는 내장지방뿐 아니라 간 지방(지방간) 축적이 증가한다. 저녁에 과식과 음주를 같이하는 경우가 대표적인 예다. 식사와 음주를 같이할 경우, 체내에서는 알코올을 태우느라 섭취한 음식 칼로리를 태우지 못해 고스란히 체지방으로 쌓이게 된다.스트레스는 단 음식이나 기름진 음식을 선호하게 만든다. 게다가 과식을 초래해 에너지 섭취가 늘고, 의욕이 없어질 때 지방축적이 늘어난다. 식사를 지나치게 많이 하지 않아도 신체 활동이 적은 경우도 문제다. 식사를 하고 바로 앉거나 누워있을 때도 에너지 소비가 줄어 지방이 쌓이기 쉽다. 식후에 바로 잘 경우, 몸의 에너지 소비가 가장 적기 때문에 야식은 지방축적의 준비단계나 마찬가지다.그렇다면 뱃살(내장지방)은 언제 효과적으로 빠질까. 우선 천천히 걷는다. 걷기는 달리기를 비롯한 다른 고강도 운동에 비해 오래 지속할 수 있다는 장점이 있다. 걷기는 유산소 운동 중에서도 체지방 분해 효율이 높다. 천천히 걸으면 20~30분 후 몸이 주로 지방을 사용한다. 걸으면서 약간 숨찰 정도로 1시간쯤 걸어도 일반적으로 일정한 체중을 유지할 수 있는 신체활동량이 된다.왕성한 두뇌 활동도 필요하다. 뇌는 중량 대비 에너지 소비가 특히 많은 장기이다. 하지만 뇌는 당분만을 에너지로 쓰기 때문에 머리 쓰기를 지나치게 하면 결국 몸 쓰기, 즉 지방을 이용하는 활동을 하기 어려워질 수 있다.노래방에서 열창을 하거나 춤과 노래를 같이할 경우, 웬만한 유산소운동 이상의 칼로리를 소비할 수 있다. 감정적으로 즐거워지면 혈액 흐름이 빨라져 에너지 소모가 늘어난다. 탄수화물과 지방 섭취를 줄이고, 채소와 단백질 식품 섭취를 늘리는 것도 좋은 방법이다. 단백질 식품은 포만감을 많이 주고, 그 자체가 소화될 때 탄수화물이나 지방에 비해 훨씬 더 많은 에너지를 소비한다. 채소는 열량이 매우 낮고 식이섬유가 많아 섭취열량을 효과적으로 줄여준다.중년 이후가 되면 평상시 규칙적으로 식사를 하는데, 뱃살이 늘어나는 경우가 상당하다. 인체의 근육이나 뇌기능 활동이 점점 떨어지는 탓이다. 식사량을 지나치게 줄이기보다는 매일 걷기 등의 운동을 추가하는 것이 바람직하다. 근육을 키우면 기초대사량을 늘려 체지방 축적을 줄이는 데 도움이 된다.■도움말=서울대병원 박민선 교수인제대 서울백병원 강재헌 교수<박효순 기자 anytoc@kyunghyang.com>모바일 경향 [경향 뉴스진|경향신문 앱|모바일웹] | 공식 SNS 계정[경향 트위터][페이스북][세상과 경향의 소통 커뮤니티]- ⓒ 경향신문(www.khan.co.kr), 무단전재 및 재배포 금지〈경향신문은 한국온라인신문협회(www.kona.or.kr)의 디지털뉴스이용규칙에 따른 저작권을 행사합니다.〉"
1,2015-09-24,'점·점' 빠져드는 청춘들…대학가에 우후죽순,https://news.naver.com/main/read.nhn?mode=LSD&mid=shm&sid1=102&oid=437&aid=0000092867,JTBC,"[앵커]미래가 불안할수록 점이나 미신에 기대는 경향이 있다곤 하지만 이번엔 도가 지나칩니다. 대학가 주변에 점집이 우후죽순으로 생기고 있는데요. 문제는 상술이 대부분이란 겁니다.밀착카메라 안지현 기자가 현장을 다녀왔습니다.[기자]홍대 어울마당로입니다.홍대 주변 가운데서도 유동인구가 많은 곳인데요.옷 가게가 즐비한 가운데 자세히 보시면 사주와 타로를 보는 점집이 곳곳에 들어서 있습니다.세어보니 300m 정도 거리에 15개나 됩니다. 대부분 접근하기 쉬운 1층에 있습니다[공인중개사 : (타로 가게 권리금이) 작은 가게는 1억~2억 원이요.]저마다 방송 출연 또는 연예인이 다녀간 곳이라고 광고합니다.찾는 사람은 대부분 젊은이들입니다.[김현경/서울 이태원동 : 그냥 무슨 일 있을 때마다 보는 편이에요. 고민이 있을 때 마음의 위안을 얻고 싶을 때요.][이가현/서울 보문동 : 연애운 같은 거요? 그냥 뜬구름 잡는 이야기에 내는 돈 치고 많지는 않나 생각했었어요.]상담은 빠르게 진행됩니다.[타로 점술가 : 일단 4장 꺼내보세요. 4장. 4장 더요.]상담 시간은 단 5분, 가격은 만 원입니다.대학가뿐 아니라 젊은이들이 많이 모이는 거리에서도 타로점집들이 보입니다.강남역입니다. 이곳에선 동양 점술인 관상과 사주 그리고 서양 점술인 타로를 한 곳에서 보는 곳이 많은데요.모두 타로보다는 가격이 비싼 사주를 권합니다.[타로 점술가 : 그럼 사주를 봐야 해요. 타로는 일시적이고, (예측 시기는) 3개월이에요.][타로 점술가 : 사주를 보면 알지. 타로는 덜 정확하지.]같은 질문에 모두 다른 대답을 합니다.[타로 점술가 : 내년부터 결혼 운이 있다.][타로 점술가 : 후년이라고 나오네. 올해는 쉬고, 2017년이 좋다.][타로 점술가 : 올해 가능성이 있어.]이야기의 흐름도 명확하지 않습니다.[타로 점술가 : 자네 양반이다. 돈 잘 쓰는데. 결혼운 있다.]타로 상담을 할 수 있는 공인 자격증은 따로 없습니다.[타로 점술가 : 국가에서 인정하는 자격증은 없어요. 대신 학교 자체에서 수료증이 나오는 거죠.]이 때문에 오랜 시간을 투자해 교육받은 사람은 많지 않다고 말합니다.[최정안 타로마스터/타로 상담 경력 18년 : 지금 타로 보시는 분들이 대체로 사주를 먼저 하시고 사주를 상담하다가 영업적인 타격이 있으니깐 타로를 곁다리로 배워서 하는 분들이 되게 많아요.]무엇을 배웠는지도 명확하지 않습니다.[타로 점술가 : (어디서 배우는 거예요?) 그냥 인터넷 들어가서 알아보세요. 나는 그런 것 모르니까. (선생님은 어디서 배우셨어요?) 지금은 안 하지.]이번에는 건국대 주변입니다.이곳은 보시다시피 사주와 타로 점집들이 노점상 형태로 줄지어 들어서 있는데요.인도의 상당 부분을 차지하고 있어서 매우 좁은 길로 사람들이 지나다니고 있습니다.[김은빈/서울 화양동 : 제가 항상 여기 지나다니는데요. (복잡해서) 일부러 통행로 아닌 데로 돌아서 다니곤 했어요.]도로를 무단 점용한 불법 노점상입니다.[광진구청 관계자 : 도로점용 허가를 받지 않은 불법입니다. (타로) 장사가 잘되니깐 그쪽으로 바꾼 거죠.]상담은 3분 만에 끝났지만 가격은 금세 올라갑니다.[타로 점술가 : 이게 만원이야. (그렇게 비싸요?) 타로는 한 질문당 5천원인데 솔직히 보면 이게 1만5천원도 돼.]이런 가운데 한 타로 점집 앞에서 청년들이 줄지어 순서를 기다립니다.[홍윤주/경기 창우동 : 친구들이랑 여기 놀러 오면 코스처럼 와서 한번 심심하면 보고 그런 것 같아요.]청년들이 많은 대학가에도 점집이 많은 것은 그들의 불안한 미래와 무관치 않아 보입니다.그러나 흥미거리 이상의 의미를 두기에는 지나치게 허술해 보입니다.안지현▶ JTBC 뉴스 공식 SNS[트위터][페이스북][카카오스토리][유튜브]▶ JTBC 뉴스는 여러분의 생생한 제보를 기다립니다.Copyright by JTBC, DramaHouse & JcontentHub Co., Ltd. All Rights Reserved. 무단 전재 및 재배포 금지"
2,2015-09-24,'금융사기 통로' 전락한 체크카드…발급절차 강화,https://news.naver.com/main/read.nhn?mode=LSD&mid=shm&sid1=101&oid=022&aid=0002919783,세계일보,"대포통장 억제하자 ‘풍선효과’달콤한 조건으로 유혹 돈 빼가국민銀, 증빙자료 제출 의무화#50대 이모(여)씨는 지난달 중순 ○○은행 김모 팀장이 보낸 대출안내 문자메시지를 받고 혹시나 하는 마음에 전화를 걸어봤다. 그러나 “신용등급이 낮고 대출건수가 많아 추가 대출이 곤란하다”는 답이 돌아왔다. 이씨가 실망하자 김 팀장은 “금융거래를 많이 하면 신용등급이 좋아지니 체크카드를 발급받아 오면 금융거래 실적을 쌓아 대출이 가능하도록 해주겠다”고 제안했다. 이씨가 체크카드를 건네자마자 450만원이 순식간에 빠져나갔다.#일자리를 찾던 최모씨는 직업소개소 광고를 보고 전화했다가 “○○건설사에 일자리가 있는데 건설사에서 일당을 통장으로 보내주기 때문에 거기서 중개수수료를 떼려면 체크카드가 필요하다”는 안내를 받았다. 일자리를 준다는 말에 현혹된 최씨가 건넨 체크카드와 비밀번호는 대포통장에 이용됐다.합리적인 소비를 위해 정부가 세제혜택까지 주며 적극 장려한 체크카드가 최근 금융사기로 탈취한 범죄자금을 빼내는 통로로 전락하고 있다. 금융감독원과 시중은행들이 대포통장을 억제하기 위해 신규통장과 장기미사용 계좌 관리를 잇달아 강화하자 그 풍선효과가 체크카드로 옮겨간 것이다.24일 금감원에 따르면 전체 대포통장에서 개설한 지 5일 이내인 신규통장(4개 은행 기준)의 비중은 2013년 50.9%에서 2014년 6월에는 24.3%로 절반 수준으로 줄었다. 지난 7월 초부터 이달 18일까지 금감원이 전체 은행을 대상으로 조사한 결과에서는 신규통장의 비중이 7.5%까지 떨어졌다. 신규통장을 개설할 때 은행들이 ‘거래목적확인서’ 등 통장 발급절차를 강화했기 때문이다.반면 통장 개설 1년이 넘은 계좌의 비중은 63.7%에 달했다. 신규통장을 이용하기 어려워진 금융사기범들이 장기 미사용계좌로 눈을 돌렸기 때문이다. 이에 은행들은 다시 1년간 사용하지 않은 계좌의 현금자동입출금기(ATM)·현금자동인출기(CD) 하루 인출한도를 기존 600만원에서 70만원으로 대폭 줄였다. 그러자 사기범들은 까다로운 은행창구를 거칠 필요 없는 체크카드에 손을 뻗기 시작했다.KB국민은행이 자체 분석한 결과에 따르면 체크카드를 이용한 금융사기 비중은 올 6월 14%에서 8월 20%로 높아졌다. 이에 따라 국민은행은 현금카드와 체크카드 발급 시에도 신규계좌를 개설할 때처럼 금융거래목적확인서와 증빙자료를 받고, 이상거래 모니터링 전담인력을 기존보다 4배 이상 증원하기로 했다.금감원은 은행연합회와 함께 체크카드 발급절차 강화를 전 은행권으로 확대하는 방안을 논의 중이다. 금감원 관계자는 “금융지주사는 계열사인 은행과 카드사 간 정보공유가 가능하기 때문에 은행에서 카드사로 의심거래자 정보를 넘겨주면 되는데 비은행 계열 카드사들은 정보를 공유할 방법이 없는 것이 고민”이라며 “우선 지주사들을 중심으로 체크카드 발급절차를 강화할 것”이라고 말했다.김수미 기자 leolo@segye.comⓒ 세상을 보는 눈, 글로벌 미디어세계일보"
3,2015-09-24,"나의 일상을 기록으로, '인증샷' 열풍",https://news.naver.com/main/read.nhn?mode=LSD&mid=shm&sid1=102&oid=214&aid=0000540523,MBC,"[뉴스데스크]◀ 앵커 ▶셀카와 떼려야 뗄 수 없는 단어하면 바로 인증샷 아닐까요.제가 오늘 찍은 스튜디오 인증샷인데요.이렇게 하루 종일 뭘 먹고 뭘 보고 또 어디를 갔는지 일일이 찍어서 SNS에 공개하는 분들 많습니다.그리고 이 해시 태그라는 걸 붙이면 전혀 모르는 사람들에게까지 나의 사진을 노출 시킬 수가 있습니다.우리는 왜 이 시시콜콜한 일상들까지 인증이라는 이름으로 공유하고 싶어하는 걸까요.먼저 이경미 기자가 인증샷 열풍을 살펴봤습니다.◀ 리포트 ▶광고회사에 다니는 변유진 씨는 인터넷 블로거는 아니지만 하루 일상을 휴대전화로 찍어 SNS에 올리는 게 취미입니다.도시락 점심을 먹을 때도 사내 탁구대회도, 가리지 않습니다.[변유진/회사원]""댓글 달아주고 이런 것 매우 좋아해요. 다른 사람들하고 소통하기도 좋고…""동양화를 전공한 김현주 씨에게 인증샷은 작품 홍보 수단입니다.자신의 그림을 올리고, 반응을 지켜보는 재미가 쏠쏠합니다.[김현주]""아직도 그림 하는구나. 너 전시하는구나. 연락 안 했던 친구들이 와서 만남이 이어지더라고요.""윤홍길 씨 역시 주말이면 한강에서 수상스키를 타고 즐기는 자신의 취미 생활을 SNS 올려 공유합니다.스마트폰이 보편화 되면서 내가 어디서 무엇을 보고 먹고 있는지, 그래서 내 느낌과 감상은 어떤지를 '인증'하는 사진을 찍어 남기는 일은 이제 생활 일부가 됐습니다.빅데이터 분석 결과 '인증샷'이라는 단어는 2011년부터 해마다 100만 번 이상 언급될 정도로 흔하게 접할 수 있는 단어가 됐습니다.그중에서도 가장 많은 건 '여행' 과 '음식' 내용으로 나타났습니다.[최재원/다음소프트 이사]""사람들은 직접 체험하는 걸 좋아해요. 플레이슈머라고 하는데, 너 해봤니, 먹어봤니, 가봤니 이런 거에 대한 답을 직접 증거로 남기려고 하는 욕망이 있습니다.""화제의 인증샷은 우리 사회를 뜨겁게 달궜던 이슈들을 반영합니다.총선과 대선을 모두 치른 2012년에는 '투표 인증샷'이, 지난해는 루게릭병 환자를 돕는 '아이스버킷 챌린지' 인증샷이 대세였습니다.올해는 품귀현상을 빚었던 '낮은 도수 과일소주'와 광복 70주년 기념 '태극기' 인증샷, 북한 포격 도발에 따른 '군복 인증샷'이 눈에 띄었습니다.◀ 기자 ▶인증샷은 자신의 삶을 '자랑'하고 싶은 심리가 담겨 있다는 게 심리학계 분석인데요, 실제로 '인증샷'이라는 단어를 분석한 결과 '긍정' 감성이 83%로 압도적으로 많고, '좋은', '멋진', 예쁜'과 같은 형용사가 자주 등장하는 것으로 나타났습니다.◀ 리포트 ▶[강하나]""놀러가면 찍어서 올리고 친구들한테 자랑하기도 해요.""[윤성이]""일상을 공유하는 것이라고 생각해요.""'인증샷'은 다른 사람의 반응으로 나의 존재를 확인한다는 '타아도취' 개념으로도 해석됩니다.이런 타아도취에 가장 많이 이용되는 게 이른바 '셀피'라고 불리는 '셀카'인데 전 세계적으로 하루 3억 5천만 장 이상이 인터넷에 올라오고 있습니다.'보여주기 때문에 존재한다'는 건데, 이면에는 어두운 점도 있습니다.'남에게 보여지는 나'를 의식할수록 자존감이 떨어질 수 있다거나 SNS를 많이 할수록 우울하다는 연구 결과도 있습니다.아무리 예쁘고 좋은 것을 보고 먹더라도 '더' 예쁘고 좋은 것은 반드시 있기 때문입니다.[채규만 교수/성신여대 심리학과]""인증샷을 통해서 자신을 너무 과시하는 사람들은 심리적으로 자존감이 약한 사람이라고 볼 수 있습니다.""결국 인터넷 SNS 공간이 남에게 자신을 인정받기 위해서나 나와 남을 비교하기 위한 것이 아닌, 서로의 삶을 '공유'할 수 있는 공간이 될 때 건강한 '인증' 사회가 형성될 수 있습니다.MBC뉴스 김나리입니다.(이경미 김나리)[저작권자(c) MBC (www.imnews.com) 무단복제-재배포 금지]"
4,2015-09-24,"일상화 된 '인증샷' 열풍, 이유는?",https://news.naver.com/main/read.nhn?mode=LSD&mid=shm&sid1=102&oid=214&aid=0000540523,MBC,"[뉴스데스크]◀ 앵커 ▶셀카와 떼려야 뗄 수 없는 단어하면 바로 인증샷 아닐까요.제가 오늘 찍은 스튜디오 인증샷인데요.이렇게 하루 종일 뭘 먹고 뭘 보고 또 어디를 갔는지 일일이 찍어서 SNS에 공개하는 분들 많습니다.그리고 이 해시 태그라는 걸 붙이면 전혀 모르는 사람들에게까지 나의 사진을 노출 시킬 수가 있습니다.우리는 왜 이 시시콜콜한 일상들까지 인증이라는 이름으로 공유하고 싶어하는 걸까요.먼저 이경미 기자가 인증샷 열풍을 살펴봤습니다.◀ 리포트 ▶광고회사에 다니는 변유진 씨는 인터넷 블로거는 아니지만 하루 일상을 휴대전화로 찍어 SNS에 올리는 게 취미입니다.도시락 점심을 먹을 때도 사내 탁구대회도, 가리지 않습니다.[변유진/회사원]""댓글 달아주고 이런 것 매우 좋아해요. 다른 사람들하고 소통하기도 좋고…""동양화를 전공한 김현주 씨에게 인증샷은 작품 홍보 수단입니다.자신의 그림을 올리고, 반응을 지켜보는 재미가 쏠쏠합니다.[김현주]""아직도 그림 하는구나. 너 전시하는구나. 연락 안 했던 친구들이 와서 만남이 이어지더라고요.""윤홍길 씨 역시 주말이면 한강에서 수상스키를 타고 즐기는 자신의 취미 생활을 SNS 올려 공유합니다.스마트폰이 보편화 되면서 내가 어디서 무엇을 보고 먹고 있는지, 그래서 내 느낌과 감상은 어떤지를 '인증'하는 사진을 찍어 남기는 일은 이제 생활 일부가 됐습니다.빅데이터 분석 결과 '인증샷'이라는 단어는 2011년부터 해마다 100만 번 이상 언급될 정도로 흔하게 접할 수 있는 단어가 됐습니다.그중에서도 가장 많은 건 '여행' 과 '음식' 내용으로 나타났습니다.[최재원/다음소프트 이사]""사람들은 직접 체험하는 걸 좋아해요. 플레이슈머라고 하는데, 너 해봤니, 먹어봤니, 가봤니 이런 거에 대한 답을 직접 증거로 남기려고 하는 욕망이 있습니다.""화제의 인증샷은 우리 사회를 뜨겁게 달궜던 이슈들을 반영합니다.총선과 대선을 모두 치른 2012년에는 '투표 인증샷'이, 지난해는 루게릭병 환자를 돕는 '아이스버킷 챌린지' 인증샷이 대세였습니다.올해는 품귀현상을 빚었던 '낮은 도수 과일소주'와 광복 70주년 기념 '태극기' 인증샷, 북한 포격 도발에 따른 '군복 인증샷'이 눈에 띄었습니다.◀ 기자 ▶인증샷은 자신의 삶을 '자랑'하고 싶은 심리가 담겨 있다는 게 심리학계 분석인데요, 실제로 '인증샷'이라는 단어를 분석한 결과 '긍정' 감성이 83%로 압도적으로 많고, '좋은', '멋진', 예쁜'과 같은 형용사가 자주 등장하는 것으로 나타났습니다.◀ 리포트 ▶[강하나]""놀러가면 찍어서 올리고 친구들한테 자랑하기도 해요.""[윤성이]""일상을 공유하는 것이라고 생각해요.""'인증샷'은 다른 사람의 반응으로 나의 존재를 확인한다는 '타아도취' 개념으로도 해석됩니다.이런 타아도취에 가장 많이 이용되는 게 이른바 '셀피'라고 불리는 '셀카'인데 전 세계적으로 하루 3억 5천만 장 이상이 인터넷에 올라오고 있습니다.'보여주기 때문에 존재한다'는 건데, 이면에는 어두운 점도 있습니다.'남에게 보여지는 나'를 의식할수록 자존감이 떨어질 수 있다거나 SNS를 많이 할수록 우울하다는 연구 결과도 있습니다.아무리 예쁘고 좋은 것을 보고 먹더라도 '더' 예쁘고 좋은 것은 반드시 있기 때문입니다.[채규만 교수/성신여대 심리학과]""인증샷을 통해서 자신을 너무 과시하는 사람들은 심리적으로 자존감이 약한 사람이라고 볼 수 있습니다.""결국 인터넷 SNS 공간이 남에게 자신을 인정받기 위해서나 나와 남을 비교하기 위한 것이 아닌, 서로의 삶을 '공유'할 수 있는 공간이 될 때 건강한 '인증' 사회가 형성될 수 있습니다.MBC뉴스 김나리입니다.(이경미 김나리)[저작권자(c) MBC (www.imnews.com) 무단복제-재배포 금지]"
5,2015-09-24,"""조카 때문에 집안 싸움""…얼굴 붉히는 명절",https://news.naver.com/main/read.nhn?mode=LSD&mid=shm&sid1=103&oid=055&aid=0000335015,SBS,"<앵커>'조카몬'이라는 말 들어보셨습니까? 조카와 괴물을 뜻하는 영어 몬스터을 합해서 만든 신조어인데요, 주로 명절 때 부모를 따라 놀러 온 조카가 아끼는 물건에 손을 대거나 달라고 떼를 쓰다보니 생겨난 말입니다. SBS 연중 캠페인 배려, 대한민국을 바꿉니다.명절 때 이렇게 친척 간에 필요한 배려를 박아름 기자가 짚어봤습니다.<기자>해마다 명절이 끝나면 인터넷 게시판에 올라오는 글 가운데 빠지지 않는 게 조카 얘기입니다.아끼는 물건을 망가뜨리고, 컴퓨터에 온갖 프로그램을 설치하는가 하면, 수십만 원짜리 게임기를 달라고 조르는 조카 때문에 집안싸움이 났다는 하소연도 있습니다.[조카 피해 경험자 : 게임기부터 시작해서 컴퓨터를 점령해버리고 옷도 훔쳐 가고 하니까 아예 문을 잠가버려요.]특히 조립식 로봇이나 피규어처럼 아이들이 탐낼만한 어른들의 수집품은 명절 때마다 멀쩡히 남아나질 않습니다.[조병욱/조립식 로봇 매장 직원 : 명절 끝나면 항상 듣는 것 같아요. 한번 왔다 가면 없어지거나 파손되는 게 많아서 동일 제품 재고 문의가 엄청 많죠.]집안 어른들 눈치 탓에 어영부영 넘어가기 일쑨데, 당사자 입장에선 결코 사소한 일이 아닙니다.[한승찬/경기도 수원 : 어른인데 애한테 장난감 갖고 놀았다고 화낸다고 (주변에서) 뭐라고 하시니까 (조카한테) 화도 못 내고 정말 속 많이 탔죠.]아끼는 고가의 물건을 조카가 달라고 하면 줄 것인지 시민 200명에게 물어봤습니다.명절 선물이라고 생각하고 기꺼이 주겠다는 사람은 23%에 불과하고, 10명 중 7명은 거절하겠다고 답했습니다.[박소라/광주광역시 : (조카를) 자주 보면 줄 수 있을 것 같기도 한데 어차피 명절에만 볼 거니까 안 줄 거예요.]모든 가족이 그런 건 아니지만 가족 간의 관계가 이전과는 확연히 달라지고 있다는 겁니다.[현택수 교수/한국사회문제연구원장 : (친척이래도) 1년에 한두 번씩 만나는 사이이기 때문에 친근감도 들지 않고 유대관계도 없죠. 남 같은 사람으로 느껴지기 때문에 자신의 이익이 침해받는 것에 대해 굉장히 민감하게 반응합니다.]친척 방문 시, 아이들이 함부로 남의 물건을 만지지 않도록 미리 주의를 주고, 손님을 맞는 쪽에서도 아이들이 손을 댈 수 있는 물건은 미리 치워두는 것이 불필요한 분쟁을 막는 방법입니다.(영상취재 : 박진호·홍종수, 영상편집 : 윤선영)박아름 기자(arm@sbs.co.kr)저작권자 SBS&SBS콘텐츠허브"
