,날짜,기사 제목,기사 링크,기사 출처,기사 내용
66,2012-07-02,"머독, ""사이언톨로지, 사악하고 괴상한 컬트""",https://news.naver.com/main/read.nhn?mode=LSD&mid=shm&sid1=104&oid=001&aid=0005674325,연합뉴스,"톰 크루즈 부부 파경 소식 트위트로 언급(서울=연합뉴스) 류미나 기자 = 할리우드 톱스타 부부의 파경 소식은 세계 굴지의 언론재벌 루퍼트 머독에게도 꽤 관심 가는 뉴스였던 것으로 보인다.머독이 1일 자신의 트위터에서 톰 크루즈의 종교로 알려진 '사이언톨로지' 교회를 ""사악하고 괴상한 숭배문화(cult)""라며 조롱했다.영국의 일간지 가디언에 따르면 머독은 이날 여러건의 트위터 메시지에서 톰 크루즈와 케이티 홈스 부부의 이혼 소식을 언급하며 이같이 말했다.머독은 ""사이언톨로지교는 매우 괴상한 이단이지만 교단내 2-3번째 서열쯤 되는 크루즈 덕에 돈이 엄청나게 많다""면서 ""이들에겐 소름끼치고 사악한 무언가가 있다""고 주장했다.홈스는 지난주 크루즈를 상대로 이혼 소송을 제기했다.사이언톨로지교에 대한 남편의 과도한 집착이 이혼사유인 것으로 전해졌다.아울러 머독은 유난히 사회 전반에 대한 호전적인 발언을 쏟아냈다고 신문이 전했다.특히 미 공화당 대선주자 미트 롬니가 집중공격을 받았다.머독은 롬니 후보의 선거운동본부에 대해 ""옛 친구들을 털어내고 진짜 전문가들과 함께 캠프를 재정비하지 않는 한 승리는 어려울 것""이라고 지적했다.머독이 롬니 후보의 대권 가능성에 의구심을 제기한 것은 이번이 처음이 아니다.그는 지난주에도 ""롬니가 하는 일이라곤 히스패닉계(유권자)를 열광케 하는 일밖에 없다""면서 ""대체 언제쯤 도전자로서의 면모를 갖출 예정인지 의문""이라고 비꼬았다.그러나 롬니의 종교인 모르몬교에 대해 묻는 한 팔로워의 질문에는 ""내겐 잘 이해가 되지 않는 미스터리이지만 그래도 결코 사악하진 않다""고 답해 눈길을 끌었다.머독은 이 외에도 ""뉴욕타임스는 따분하고 영국 정부는 허약하다""는 등의 거침없는 발언을 이어갔다고 가디언이 보도했다.minaryo@yna.co.kr[이 시각 많이 본 기사]☞새누리, 차기전투기 등 현정부 강행사업 `제동'☞김연자 ""결혼 30년만에 이혼""☞""정치부 기자들이 꼽은 차기대통령감은 문재인""☞-유로2012- 스페인, 사상 첫 2연패 달성(종합2보)☞강기갑 ""이석기ㆍ김재연 자격심사 중단해야""<연합뉴스 모바일앱 다운받기><포토 매거진><저작권자(c)연합뉴스. 무단전재-재배포금지.>"
67,2012-07-02,만기출산 아이도 1-2주 늦을수록 유리,https://news.naver.com/main/read.nhn?mode=LSD&mid=shm&sid1=103&oid=001&aid=0005674149,연합뉴스,"(시카고 AP=연합뉴스) 만기출산 아이들조차도 어머니 자궁에 오래 있었던 아이일수록 학업 성적이 유리할 가능성이 있다는 연구 결과가 나왔다.임신 37주에서 41주 사이에 태어나는 만기 출산 아이에 비해 조산아들이 건강이나 발달 문제를 일으킬 위험성이 더 높다는 사실은 알려져 있지만 이 연구는 만기출산아 사이에도 모태에 있었던 기간에 따라 차이가 생길 수 있음을 시사했다.이 연구에서 만기 출산 아이들은 초등학교 3학년 산수와 읽기 시험에서 전반적으로 대다수가 잘했지만 이들 중에서도 임신 37주나 38주에 태어난 아이들은 불과 1-2주 늦게 태어난 아이들에 비해 큰 차이는 아니지만 시험 결과가 저조했다.37주에 태어난 아이들은 읽기에서 매우 낮은 점수를 받은 비율이 2.3%, 산수에서 다소 문제를 보인 경우가 1.1%에 달했지만 41주 출생아들은 각기 1.8%와 0.9%에 그쳤다.또 38주에 태어난 아이들도 37주 출생아들보다는 이 비율이 약간 낮았다.37주 출생아들은 41주 출생아들보다 초등 3학년 읽기에서 심각한 문제를 보일 가능성이 33% 높았고 산수에서 어느 정도 문제가 있을 가능성은 19% 컸다.이 연구는 12만8천명에 달하는 뉴욕시 공립학교 학생들을 대상으로 실시한 것으로 이들 중에는 불우한 가정의 학생들도 상당수 포함돼 있다.연구진과 여타 관련 분야 전문가들은 이번 연구 결과는 조산에 대한 개념을 재고해야 할 필요성을 보여준다고 말했다.연구진은 특히 여성들이 임신 피로를 느끼거나 의사가 바쁘다는 등 의학 외적인 편의를 이유로 서둘러 제왕절개 출산 일정을 잡는 것이 문제가 있을 수 있다는 것이 드러났다고 밝혔다.연구결과를 저술한 컬럼비아대학 의대병원의 킴벌리 노블 교수는 ""여성들이 조기 출산을 선택하기 전에 숙고해야 한다""고 강조했다.이 연구는 2일 전문지 소아과학(Pediatrics) 온라인 판에 발표됐다.maroonje@yna.co.kr[이 시각 많이 본 기사]☞이한구 ""野 총리해임 요구 말도 안 돼""(종합)☞<박스오피스> '어메이징 스파이더맨' 점령☞정몽준 ""김문수, 약속 지킬 것으로 기대""(종합2보)☞-유로2012- 스페인, 사상 첫 2연패 달성(종합2보)☞새누리, 차기전투기 등 현정부 강행사업 `제동'<연합뉴스 모바일앱 다운받기><포토 매거진><저작권자(c)연합뉴스. 무단전재-재배포금지.>"
68,2012-07-02,어린시절 학대악몽 정신질환·약물중독 만든다,https://news.naver.com/main/read.nhn?mode=LSD&mid=shm&sid1=103&oid=021&aid=0002118135,문화일보,"어린시절 체벌을 당한 경험이 있는 사람들은 성인이 됐을 때 심각한 정신질환과 우울증, 약물 중독 등에 빠지기 쉽다는 연구결과가 나왔다.2일 AFP통신은 캐나다 연구팀의 연구결과를 인용해 어린 시절 체벌과 심리적인 문제 사이에 상관관계가 있다고 보도했다. 연구를 진행한 캐나다 매니토바주의 위니펙대 연구팀은 653명의 미국 성인들을 대상으로 정신질환을 앓고있는지의 여부와 그 원인을 조사했다. 그 결과 7.2%의 성인이 체벌에 대한 기억 때문에 강박증, 과대망상, 지적장애 등 심각한 정신적 문제를 앓고 있으며, 5%는 우울증, 식욕감퇴 혹은 폭식증, 여러 중독증에 시달리는 것으로 나타났다. 이들은 어린 시절의 가혹한 체벌에 대한 기억을 자주 회상한다고 답변했다.미국 뉴욕 햄스테드 소재 유대의과대 아동청소년 정신의학 전문의 빅터 포너리는 “이 연구는 양육 방법에 대한 논의의 필요성을 느끼게 한다”면서 “체벌이 성장과정에서 정신적인 혼란을 야기시키는 위험요인이 될 수 있다는 것을 보여준다”고 밝혔다. 지금까지 여러 연구에서 어린시절 체벌을 경험한 사람은 성인이 되어서 공격적인 성향을 나타낼 확률이 높다는 결과들이 나왔다.뉴욕 코헨 아동 의학 센터의 소아과전문의 로라 사무엘스는 “상처받기 쉬운 아동기의 체벌 경험이 평생을 좌우할 수 있다는 것을 보여주는 또 하나의 연구결과”라면서 “아동에 대한 체벌을 최소화하고 아동 폭력을 근절해야 한다”고 밝혔다.현재 전 세계의 32개국은 가정과 학교에서 아동에 대한 체벌을 전면적으로 금지하고 있지만, 한국과 미국은 부분적인 금지안을 시행하고 있다.유현진기자 cworange@▶김연아, 긴급 기자회견… 거취 표명▶‘술 취하면 개?’ 경찰 허벅지 깨문 女 입건▶[속보]김연아 현역 연장…“2014소치서 은퇴”▶스페인, 伊 4-0 대파… 사상 첫 유로 2연패▶오달수 국적 변경? 중국팀 도둑으로…[Copyrightⓒmunhwa.com '대한민국 오후를 여는 유일석간 문화일보' 무단 전재 및 재배포 금지(구독신청:02)3701-5555/모바일 웹:m.munhwa.com)]"
69,2012-07-02,강력범죄전력 외국인 근로자 입국 막는다,https://news.naver.com/main/read.nhn?mode=LSD&mid=shm&sid1=102&oid=001&aid=0005674129,연합뉴스,"비자신청때 증명서 제출 의무화…질병 확인도 강화(서울=연합뉴스) 김승욱 기자 = 법무부는 외국인 노동자에 대한 해외 범죄경력 및 건강상태 확인을 강화한다고 2일 밝혔다.법무부는 다음 달 1일부터 비전문취업(E-9), 선원취업(E-10), 방문취업(H-2) 비자 신청자 등 단순노무에 종사하는 외국인 노동자에게 비자를 신청할 때 해외범죄경력증명서를 제출하게 할 방침이다.이는 최근 외국인 범죄의 조직화·흉포화에 대한 대응책이다.현재는 미성년자를 교육하는 회화지도 강사와 위장·사기결혼 사례가 많은 일부 국가 출신의 결혼이민자만 해외범죄경력증명서 제출이 의무화돼 있다.또 기존에는 외국인이 영주권을 신청할 때 범죄경력을 파악하지 않았으나 앞으로는 고액투자자·우수인재·특별공로자 등을 제외한 영주권 신청자의 해외 범죄경력을 확인하기로 했다.법무부는 범죄경력 확인 결과 살인·강도 등 강력범죄 전과가 있거나 금고 이상의 형을 선고받은 경우 비자를 발급하지 않을 방침이다.외국인 노동자의 건강상태 확인도 강화된다.외국인 단순노무종사자는 재외공관에 비자를 신청할 때 자필로 작성한 건강상태확인서를 제출해야 하며 국내 입국 후 법무부가 지정한 병원에서 발급한 건강진단서를 제출해야 한다.법무부는 건강상태 확인서를 사실과 달리 작성했거나 전염성 질병에 감염된 외국인 노동자에 대해 원칙적으로 출국명령을 내릴 방침이다.법무부 관계자는 ""이번 조치가 범법 외국인의 입국을 차단하고 외국에서 유입된 감염성 질병의 확산을 방지하는 데 도움이 될 것으로 기대한다""고 밝혔다.kind3@yna.co.kr[이 시각 많이 본 기사]☞이한구 ""野 총리해임 요구 말도 안 돼""(종합)☞<박스오피스> '어메이징 스파이더맨' 점령☞정몽준 ""김문수, 약속 지킬 것으로 기대""(종합2보)☞-유로2012- 스페인, 사상 첫 2연패 달성(종합2보)☞새누리, 차기전투기 등 현정부 강행사업 `제동'<연합뉴스 모바일앱 다운받기><포토 매거진><저작권자(c)연합뉴스. 무단전재-재배포금지.>"
70,2012-07-02,"李대통령 ""정부ㆍ국회, 엄중한 상황에 협력해야""",https://news.naver.com/main/read.nhn?mode=LSD&mid=shm&sid1=100&oid=001&aid=0005673390,연합뉴스,"李대통령, 제19대 국회 개원연설    (서울=연합뉴스) 진성철 기자 = 이명박 대통령이 2일 국회에서 열린 제19대 국회 개원식에서 개원연설하고 있다.    2012.7.2    zjin@yna.co.kr국회 개원연설..""국회, 통일재원 마련에 관심 가져달라""""일자리 창출ㆍ물가안정 역점""..""대선, 공정하게 관리""(서울=연합뉴스) 김종우 기자 = 이명박 대통령은 2일 ""정부와 국회는 엄중한 상황에서 국민을 안심시키고 당면 문제를 해결하면서 미래를 향해 나라를 발전시켜가야 할 책무를 안고 있다""면서 행정부-입법부 간 긴밀한 협력을 주문했다.이 대통령은 이날 제19대 국회 개원식에 참석, 연설을 통해 세계 경제위기와 급변하는 국제정세를 거론하며 ""우리는 미증유의 혼란에 수반되는 위기를 직시해야 하며 그 도전에 민활하게 대처하고 능동적으로 극복해야 한다""면서 이같이 밝혔다.이 대통령은 ""이런 인식 하에서 저는 국정을 함께 이끌어 가는 입법ㆍ사법ㆍ행정의 3부가 상호 견제와 균형을 유지하되, 국익을 위해 대승적인 관점에서 더욱 협력해나가야 한다고 생각한다""고 강조했다.이 대통령은 또 ""우리의 마지막 남은 과제는 평화통일로, 이는 우리 세대의 역사적 사명이자 이제 서둘러 준비해야 할 단계에 왔다""면서 ""통일 준비의 핵심 사업 중 하나가 `통일재원'을 마련하는 일""이라며 국회의 관심을 당부했다.그러면서 ""지금 북한 인권문제는 핵문제와 더불어 매우 시급하고 중대한 과제로 세계 모든 나라가 큰 관심과 안타까움을 표하고 있다. 마땅히 우리도 관심을 갖고 협력해나갈 것""이라고 했다.향후 경제정책 기조와 관련, ""오늘날 유럽 위기에서 보듯이 재정은 국가 경제의 최후 보루""라며 ""우리가 경제위기를 성공적으로 극복할 수 있었던 것도 튼튼한 국가재정이 뒷받침됐기 때문""이라고 설명했다.이어 ""정부는 당장 어려움을 모면하고자 우리 후손에게 무거운 짐을 떠넘기는 일은 결코 하지 않을 것""이라며 ""정부는 재정건전성을 지키는 범위 내에서 서민경제의 토대를 지키고 활성화하기 위해 최선의 노력을 기울일 것""이라고 역설했다.이 대통령은 ""자유무역협정(FTA)은 국가생존 전략""이라고 전제한 뒤 ""자원도 없고 내수시장이 좁은 우리나라가 일자리를 늘리고 성장을 지속하자면 해외로 진출하고 관계를 넓히는 길밖에 없다""면서 FTA 비준에 대한 협조를 당부했다.특히 이 대통령은 올해 국정의 최우선 과제로 `일자리 창출과 물가안정'을 꼽으며 ""정부는 올해 일자리 40여만 개를 창출하고 물가는 반드시 2%대로 안정시키겠다""고 약속했다.제19대 국회 개원연설하는 이 대통령    (서울=연합뉴스) 진성철 기자 = 이명박 대통령이 2일 국회에서 열린 제19대 국회 개원식에서 개원연설하고 있다.    2012.7.2    zjin@yna.co.kr이 대통령은 그러나 ""하반기 경제전망이 그리 밝지 않다""면서 ""정부는 이에 대비해 비상체제를 가동하고 있다""고 밝혔다.이 대통령은 이어 ""올해 12월 대통령 선거를 앞두고 정부는 역사적 책임을 갖고 공정하게 관리할 것""이라며 ""그간의 공과를 겸허히 돌아보면서 남은 임기동안 국민의 뜻을 성실히 받들고 최선을 다해 국정을 추진해나갈 것""이라고 강조했다.jongwoo@yna.co.krtwitter: @newswoo[이 시각 많이 본 기사]☞""北, 7.4성명 통해 朴정권 기반 흔들려했다""(종합)☞고소영, '힐링캠프' 출연..결혼 후 첫 토크쇼☞<""어린이집에 맡겼다가 2살 아기 끔찍한 화상"">☞-여자주니어핸드볼- 한국, 카자흐스탄 완파☞<통합진보, `제명 의총' 시기 놓고 신경전>(종합)<연합뉴스 모바일앱 다운받기><포토 매거진><저작권자(c)연합뉴스. 무단전재-재배포금지.>"
71,2012-07-02,"""차량 3대 중 1대만 빗길 전조등 점등""",https://news.naver.com/main/read.nhn?mode=LSD&mid=shm&sid1=103&oid=001&aid=0005673831,연합뉴스,"서울궁내동 톨게이트를 향하는 차량들이 전조등을 켜고 있는 모습.(자료사진)교통안전공단 조사..""검은색 차가 불도 잘 안켜""(서울=연합뉴스) 현윤경 기자 = 국내 차량 가운데 빗길에 전조등을 켜고 운행하는 차량은 3대 가운데 1대꼴에 불과한 것으로 나타났다.교통안전공단은 장마철 교통안전에 대비해 비가 내린 지난 5월14일 39번 국도에서 오후 3시부터 2시간 동안 조사한 결과 통과 차량 총 3천708대 가운데 34.7%에 불과한 1천403대만 전조등을 켠 것으로 집계됐다고 2일 밝혔다.차종별로는 버스가 62.9%로 최고의 점등률을 보였고, 승합차는 29.2%로 전조등을 켜는 비율이 가장 낮았다.색상별로는 흰색 자동차가 41.7%를 기록한 반면 빗길에서 상대적으로 잘 안보이는 검은색 자동차의 점등률은 오히려 29.2%로 낮았다.교통안전공단에 따르면 작년 전체 교통사고 사망자수 가운데 빗길 교통사고 사망자수가 차지하는 비율은 작년 11.7%에 달한다.교통안전공단은 ""특히 최근 5년간 빗길 교통사고 사망자 가운데 41%가 장마철인 7~9월에 발생하는 것으로 집계됐다""며 ""과속금지, 전조등 점등, 중앙차로 이용 등 장마철 교통안전 수칙을 지켜달라""고 당부했다.ykhyun14@yna.co.kr[이 시각 많이 본 기사]☞새누리, 차기전투기 등 현정부 강행사업 `제동'☞김연자 ""결혼 30년만에 이혼""☞""정치부 기자들이 꼽은 차기대통령감은 문재인""☞<프로야구 전망대> 위기의 롯데, SK·삼성과 6연전☞<통합진보, `제명 의총' 시기 놓고 신경전>(종합)<연합뉴스 모바일앱 다운받기><포토 매거진><저작권자(c)연합뉴스. 무단전재-재배포금지.>"
72,2012-07-02,대형마트 보안요원이 물건 억대 훔쳐,https://news.naver.com/main/read.nhn?mode=LSD&mid=shm&sid1=102&oid=001&aid=0005673807,연합뉴스,"(서울=연합뉴스) 김동호 기자 = 서울 서초경찰서는 2일 대형마트에서 억대의 물건을 훔쳐 내다판 혐의(상습절도)로 마트 보안요원 박모(48)씨 등 2명을 구속하고 장모(43ㆍ무직)씨 등 2명을 불구속 입건했다.경찰에 따르면 모 경비용역업체 소속 박씨는 지난해 7월부터 최근까지 서초구 양재동 A마트 보안요원으로 일하면서 지인 박모(30ㆍ구속)씨 등과 함께 102차례에 걸쳐 1억2천만원 상당의 상품을 훔친 혐의를 받고 있다.박씨는 자신이 근무하는 시간대를 골라 매장에서 공범들에게 술이나 분유 등 식료품을 카트에 실어 몰래 가져나가도록 했으며, 이런 물건 일부는 주차장에 세워진 박씨의 차량 트렁크에 두고 나오는 수법으로 빼돌린 것으로 조사됐다.박씨는 지난해 A마트에 정문을 통제하는 보안요원으로 파견근무를 시작하게 되자 범행을 계획하고, 2009년 송파구의 한 아파트단지 경비반장으로 근무하던 당시 부하직원으로 일하던 이들을 중심으로 공범을 모은 것으로 드러났다.경찰은 일부 상품이 인터넷을 통해 판매된 정황을 포착하고 이들의 여죄를 캐고 있다.dk@yna.co.kr[이 시각 많이 본 기사]☞이한구 ""野 총리해임 요구 말도 안 돼""(종합)☞<박스오피스> '어메이징 스파이더맨' 점령☞정몽준 ""김문수, 약속 지킬 것으로 기대""(종합2보)☞-유로2012- 스페인, 사상 첫 2연패 달성(종합2보)☞새누리, 차기전투기 등 현정부 강행사업 `제동'<연합뉴스 모바일앱 다운받기><포토 매거진><저작권자(c)연합뉴스. 무단전재-재배포금지.>"
73,2012-07-02,정부 재추진 한다는데..한일 정보협정 앞날은,https://news.naver.com/main/read.nhn?mode=LSD&mid=shm&sid1=100&oid=018&aid=0002622359,이데일리,"[이데일리 이민정 기자]국무회의 밀실 처리 논란이 불거지면서 지난달 29일 서명 1시간여를 남겨놓고 전격 체결이 연기된 한일 군사정보포괄보호협정(GSOMIA)의 앞날에 관심이 쏠리고 있다.비밀리에 협정을 통과시킨 책임을 놓고 청와대와 총리실, 외교부가 볼썽사납게 주고받던 공방은 외교부가 책임을 뒤집어쓰는 모양새로 일단락 됐다. 김성환 외교부 장관은 책임 떠넘기기 행태에 대한 여론의 질타가 이어지자 2일 기자들과 만나 “정부가 방침을 정하면 실무는 부처가 맡아서 마무리 한다”며 “외교부가 책임을 떠넘기려 한 것은 아니다”라고 해명했다.청와대와 외교부는 국회 협의와 동의 절차를 거쳐 체결을 재추진한다는 방침이다. 김 장관은 “체결 직전에 연기가 된 것은 국회와 더 많은 협의를 해야 한다는 지적이 있었고 절차적으로 필요하다고 생각해서 받아들인 것”이라며 “앞으로 국회에 가서 설명을 하고 국민의 이해와 지지를 얻는 노력을 하겠다”고 말했다.이명박 대통령도 이날 수석비서관회의에서 한일 군사정보협정 연기와 여론 동향에 대한 보고를 받고 오해가 없도록 추진하라고 지시했다.이 대통령은 “이 협정은 이미 러시아를 비롯한 24개국과 체결했고 앞으로 중국과도 체결이 필요한 국가적으로 도움이 되는 협정”이라며 “국회와 국민들에게 협정 내용을 소상하게 공개하고 설명해 오해가 없도록 조치하라”고 당부했다.그러나 민주통합당 등 야당은 협정 폐기를 요구하는 등 강경한 입장을 취하고 있어 정부의 바람대로 협정이 재추진될 수 있을지 의문이다. 이해찬 민주통합당 대표는 이날 오전 최고위원회의에서 “21세기 들어와 한일 군사정보협정을 맺는다는 것은 역사에 역행하는 일”이라며 “협정을 폐기해야 한다”고 주장했다.여당은 협정으로 인한 국익 등을 따져 추진 여부를 검토하겠다는 입장이지만 한일 협정에 대한 국민적 반감이 거세지는 가운데 자칫 협정 체결에 힘을 보태는 꼴은 ‘친일’로 비춰질 수 있어 섣불리 목소리를 높이지 못하고 있다.정부 당국자는 “국회에서 이해를 해주고 국민이 지지하면 협정 체결을 추진하겠다는 입장이지만 국민과 야권의 반발이 심하면 현 정부에서의 재추진은 어려울 수도 있다”고 말했다.한편 민주당은 협정 폐기와 더불어 협정 처리를 주도한 김황식 국무총리, 김성환 외교부 장관, 김관진 국방부 장관 등의 경질도 요구하고 있어 한일 정보협정 관련 후폭풍은 쉽게 가라앉지 않을 것으로 보인다.이해찬 민주당 대표는 1일 “이명박 대통령이 김황식 국무총리를 해임시키지 않으면 국회에서 불신임 결의안이 나갈 수밖에 없다“며 “국무총리 이하 김성환 장관, 김관진 장관의 책임도 물어야 한다”고 주장했다.이민정 (benoit@edaily.co.kr)▶ 당신의 생활 속 언제 어디서나 이데일리 ‘신문 PDF바로보기‘▶ 스마트 경제종합방송이데일리 TV▶ 실시간 뉴스와 증권거래, 내 손안의 금융시장 ‘이데일리 모바일 서비스’▶ 전문가를 위한 국내 최상의 금융정보단말기 ‘이데일리 마켓포인트 2.0’▶ 증권전문가방송 '이데일리 ON', 고객상담센터 1666-2200 |종목진단/추천 신규오픈＜ⓒ종합 경제정보 미디어 이데일리 - 무단전재 & 재배포 금지＞"
