,날짜,기사 제목,기사 링크,기사 출처,기사 내용
38,2012-07-02,오대산 국립공원 ‘6번 국도의 저주’,https://news.naver.com/main/read.nhn?mode=LSD&mid=shm&sid1=102&oid=028&aid=0002148287,한겨레,"[한겨레]작년 동물 98마리 ‘로드킬’446번 지방도에서도 63마리전체 국립공원중 35% 차지국립공원은 우리나라 생태계나 자연·문화 경관을 대표할 만한 지역으로 특별한 법적 보호를 받는 곳이다. 따라서 야생동물들에게도 다른 어떤 곳보다 인간의 간섭 없이 제 습성대로 살아갈 수 있는 공간이어야 하지만 현실은 다르다. 국립공원도 서식지를 가로지른 도로와 그 위를 달리는 차량들에 치여 죽는 이른바 ‘로드킬’의 위협으로부터 야생동물들을 제대로 보호해주지는 못하고 있다.국립공원 가운데 야생동물 찻길사고가 가장 많이 발생하는 곳은 오대산국립공원이다. 오대산국립공원을 남북으로 가로지르는 6번 국도와 공원 진입도로인 446번 지방도에서는 지난해 평균 이틀에 한 건꼴로 사고가 나, 국립공원에서 가장 큰 야생동물의 무덤이라는 불명예를 안게 됐다.국립공원관리공단 국립공원연구원이 지난 1년 동안 찻길동물사고 취약지역인 16개 국립공원 안의 도로 41개 노선 297.35㎞ 구간에서 포유류·조류·양서류·파충류의 사고 실태를 집계한 결과를 보면, 전체 희생 동물 464마리 가운데 98마리가 오대산국립공원 안 6번 국도에서 희생당한 것으로 나타났다. 공원 안 6번 국도의 총길이가 17.5㎞이므로 전체 구간의 5.9%에 불과한 도로가 야생동물 찻길사고의 21.1%를 차지한 것이다.희생된 동물도 다양하다. 다람쥐, 고라니, 너구리, 삵, 비단털들쥐 등 포유류가 8종에 41마리나 됐고, 조류 12마리, 양서류 33마리, 파충류 12마리 등이었다. 같은 기간 월정초등학교에서 월정사를 지나 상원사통제소까지 이어지는 446번 지방도 11.3㎞ 구간에서 희생당한 야생동물도 63마리로, 전국 국립공원 안 조사 대상 41개 노선 가운데 둘째로 많았다. 결국 오대산국립공원 안 2개 도로 28.8㎞ 구간에서 희생당한 동물이 16개 국립공원 안의 조사 대상 도로 전 구간에서 희생당한 동물의 34.7%를 차지한 것이다.오대산국립공원에서 이처럼 야생동물 찻길사고가 잦은 것은, 도로의 굴곡이 완만해 차량들이 속도를 크게 줄이지 않고 통행하고 있는데다, 야생동물이 안전하게 도로를 횡단하는 것을 돕는 시설이 제대로 설치되지 않았기 때문으로 분석됐다. 오대산국립공원 안 국도 6호선에는 모두 8개의 생태통로가 만들어져 있으나, 찻길사고 실태를 반영하지 않은 채 설치돼 사고를 줄이는 데 큰 도움이 되지 않고 있다는 것이다.김의경 국립공원연구원 연구원은 “오대산국립공원에서 희생된 포유류의 절반 이상이 5월께 태어나 7~8월께 독립하기 위해 이동하는 다람쥐들”이라며 “지리정보시스템(GIS)을 이용한 공간분석을 통해 로드킬이 집중적으로 발생한 것으로 확인된 지역에 로드킬 방지 시설을 추가 설치하는 방안을 관계 기관과 협의할 계획”이라고 말했다. 김정수 선임기자jsk21@hani.co.kr<한겨레 인기기사>■올림픽 성화봉송 문대성, ‘태권왕’ 아닌 ‘철판왕’■“서울대 없어지면 연·고대등 사립대만 더 뜰것”■한-일 군사협정 꼭 막아야할 3가지 이유■[화보] 울음 참는 피겨여왕 김연아■‘MB의 굴욕’…국회 개원 연설 도중 박수 한번 못 받아공식 SNS[통하니][트위터][미투데이]| 구독신청[한겨레신문][한겨레21]Copyrights ⓒ 한겨레신문사, 무단전재 및 재배포 금지<한겨레는 한국온라인신문협회(www.kona.or.kr)의 디지털뉴스이용규칙에 따른 저작권을 행사합니다.>"
39,2012-07-02,"檢, 이상득 前의원 사전영장 청구 방침",https://news.naver.com/main/read.nhn?mode=LSD&mid=shm&sid1=100&oid=022&aid=0002413504,세계일보,"[세계일보]이명박 대통령의 친형인 이상득(77·사진) 전 새누리당 의원이 3일 검찰에 출두한다. 저축은행 퇴출저지 청탁과 금품수수 의혹에 대한 조사 차원의 피내사자 신분이다. 하지만 그의 신분은 조사 당일 피의자로 바뀔 가능성도 있다.검찰 안팎에서는 시간문제일 뿐 ‘대통령 측근 3인방’으로 불렸던 최시중(74) 전 방송통신위원장과 박영준(52) 전 지식경제부 차관에 이어 이 전 의원도 권력형 비리 혐의로 기소될 가능성이 높다고 보고 있다. ‘권력 3인방’의 몰락이 기정사실화하는 분위기다.검찰은 이 전 의원의 금품수수 시점이 17대 대통령 선거 전후라는 점에 주목하고 있다. 검찰 의지와 관계없이 불법 대선자금 문제로 튈 수밖에 없다는 전망이 나오는 이유다.2일 대검찰청 산하 저축은행비리합동수사단(단장 최운식 부장검사)에 따르면 검찰은 이 전 의원 소환에 앞서 지난 1월과 5월 두 차례에 걸쳐 서면조사를 진행했다.검찰은 17대 대선 직전인 2007년부터 2010년까지 이 전 의원이 임석(50·구속기소) 솔로몬저축은행 회장으로부터 억대의 돈을 받았는지와 코오롱그룹이 고문활동비 명목으로 제공한 1억5000만원의 ‘불법성’도 따져볼 계획이다.검찰은 제기된 의혹을 조사하고 이 전 의원을 일단 돌려보낸 뒤 정치자금법 위반 또는 특정범죄가중처벌법상 알선수재 등의 혐의로 사전구속영장을 청구할 방침이다.이 전 의원에게 집중된 검찰 수사가 박지원(70) 민주통합당 원내대표와 정두언(55) 새누리당 의원까지 확대되는 것도 시간문제로 보인다.검찰은 이날 정 의원과 임 회장의 만남을 주선한 것으로 알려진 국무총리실 이모 실장을 참고인 자격으로 불러 조사했다. 검찰은 이 실장을 상대로 정 의원을 임 회장에게 소개해준 경위와 임 회장이 정 의원에게 금품을 전달했는지 등을 캐물은 것으로 알려졌다. 이 실장은 임 회장과 같은 아파트에 살면서 친분을 쌓은 것으로 전해졌다.이희경 기자hjhk38@segye.com[Segye.com 인기뉴스]◆ 지적장애 10대女, 아이 출산…애 아빠 '경악'◆ 한국인 30대女, 상의 벗겨진 채 숨져…무슨 일◆ 화성 실족사 20대男, 죽기 전 마지막 지점 '충격'◆ 술 취해 난동부린 女, 경찰 허벅지 깨문 후◆ 아무리 먹어도 날씬한 그녀, 비결은 ‘OO’[ⓒ 세계일보 & Segye.com, 무단 전재 및 재배포 금지][금융전문뉴스 세계파이낸스][모바일로 만나는 세계닷컴]<세계닷컴은 한국온라인신문협회(www.kona.or.kr)의 디지털뉴스이용규칙에 따른 저작권을 행사합니다.>"
40,2012-07-02,"日 도쿄지사 ""수도 기능 일부 오사카로 옮기자""",https://news.naver.com/main/read.nhn?mode=LSD&mid=shm&sid1=104&oid=001&aid=0005674535,연합뉴스,"(도쿄 교도=연합뉴스) 이시하라 신타로(石原愼太郞) 일본 도쿄도 지사는 2일(현지시간) 수도의 기능 일부를 일본에서 두 번째로 큰 비즈니스 중심지인 오사카로 옮기자고 제안했다.이시하라 지사는 이날 싱가포르에서 열린 세계도시정상회의의 시장 포럼에서 (기능 이전을 통해) 두 도시가 '거대 도시'의 역할을 공동으로 수행할 수 있을 것이라며 이 같이 주장했다.그는 포럼에서 ""도쿄에는 너무 많은 도시 기능이 집중돼 있다""며 ""이를 합리적으로 분산시키는 일에 대해 고민할 때""라고 말했다.그는 특히 미래에 초고속 자기부상열차가 도쿄와 오사카를 연결함에 따라 두 도시가 효과적으로 일을 분담하게 될 것이라고 내다봤다.일본의 고속열차인 도카이도 신칸센의 운영사인 JR도카이는 2014년부터 새 자기부상열차를 건설해 2045년 도쿄와 오사카를 잇는 열차 운행을 시작할 계획이다.이 열차는 최고 시속 505㎞로 두 도시를 67분만에 연결한다.한편 100개 도시의 정상이 한 자리에 모이는 세계도시정상회의는 올해 '살기에 적합하고 지속 가능한 도시:대도시 문제의 해결책'이라는 주제로 진행됐다.yuni@yna.co.kr[이 시각 많이 본 기사]☞새누리, 차기전투기 등 현정부 강행사업 `제동'☞김연자 ""결혼 30년만에 이혼""☞""정치부 기자들이 꼽은 차기대통령감은 문재인""☞-유로2012- 스페인, 사상 첫 2연패 달성(종합2보)☞<통합진보, `제명 의총' 시기 놓고 신경전>(종합)<연합뉴스 모바일앱 다운받기><포토 매거진><저작권자(c)연합뉴스. 무단전재-재배포금지.>"
41,2012-07-02,퍼붓는 비처럼 술 퍼붓다간 심장에 ‘빨간불’,https://news.naver.com/main/read.nhn?mode=LSD&mid=shm&sid1=103&oid=028&aid=0002148290,한겨레,"[한겨레]장마철 건강관리 하려면고온다습 날씨 불쾌지수 높아흥분할 때 과음, 심장에 무리에어컨 직접 닿지 않도록 하고식중독 피하려면 찬 음식 자제장마철이 시작됐다. 우리나라 장마철에는 고온다습한 특징이 있어 불쾌지수가 크게 높아지고 면역력이 떨어지는 현상이 나타난다. 또 음식도 빨리 상하게 만들어 식중독에 시달리기 쉽고, 지나친 냉방 등으로 냉방병이나 여름 감기에도 흔하게 걸릴 수 있다. 아울러 장마철의 우울함을 달래기 위해 과도하게 술을 마셔 건강을 해치기도 쉽다. 장마철 건강관리 요령에 대해 알아본다.■고온다습할 때 과도한 음주는 심장 등에 무리 줘고온다습한 장마철에는 불쾌지수가 높아져 누구나 쉽게 짜증이 난다. 또 햇빛을 쬐는 시간이 줄어들면서 침울한 기분에 빠지기도 한다. 이런 환경 탓에 많은 사람들이 술을 찾곤 한다. 비 오는 날이면 ‘파전에 막걸리 한잔’으로 시작한 술이 과도한 음주로 이어지는 현상도 쉽게 찾아볼 수 있다.하지만 짜증나거나 우울한 기분, 또는 흥분 상태에서 술을 마시면, 평소 때보다 심장 박동수가 크게 늘어나는 등 심장 및 혈관 계통에 무리가 갈 수 있다. 특히 과도한 음주는 알코올성 심근증, 부정맥을 일으킬 수 있으며, 심장의 기능을 떨어뜨릴 수 있다. 이 때문에 당뇨, 고혈압, 심장 및 혈관질환이 있는 사람은 물론 평소 건강한 사람이라도 고온다습한 환경에서 과음하지 않도록 주의해야 한다. 직장인들의 경우 비 오는 날 꼭 떠오르는 술집이나 안주가 있다면, 이를 피하기 위해 애초부터 다른 길로 돌아가는 것도 절주의 요령이다.■냉기가 직접 닿으면 냉방병 더 잘 걸려고온다습한 환경은 피부에서 느끼는 불쾌감을 크게 하기 때문에 에어컨 등 냉방장치를 쉽게 찾게 만든다. 하지만 과도한 냉방은 오히려 몸의 피로나 감기 등을 부른다. 냉방병은 실내와 외부 온도가 5도 이상 차이가 날 때 생긴다. 특히 에어컨에서 나오는 냉기가 몸의 일부에 직접 닿으면 냉방병에 더 잘 걸린다. 즉, 가정용 또는 소형 점포용 냉방기가 중앙집중 방식보다 냉방병을 일으키기가 쉽다. 이 때문에 에어컨 등을 쓸 때에는 냉방보다는 환기에 중점을 두고 찬바람이 직접 몸에 닿지 않도록 해야 한다. 냉기가 나오는 방향을 사람이 모여 있지 않은 쪽으로 하고, 한참 더울 때만 잠시 강하게 사용하는 것보다는 약하게 여러 시간을 틀어놓는 것이 좋다. 실내외 온도차는 5도 이상 나지 않게 하고 실내 온도를 25도 이하로는 낮추지 않는 것이 권고된다.냉방을 하는 사무실에서는 지나치게 체온이 떨어지는 것을 막기 위해 긴소매 옷이나 덧옷을 입도록 하고, 특히 관절염이 있다면 무릎 덮개로 관절을 덮어 냉기에 관절이 직접 노출되는 것을 막아야 한다.■세균 번식 왕성해져 식중독 주의해야고온다습한 날씨에서는 식중독을 일으킬 수 있는 세균의 번식이 활발해진다. 또 사람들이 찬 음료수나 식품을 찾기 때문에 식중독에 더 쉽게 걸릴 수 있다.이 때문에 날 음식이나 소독이 되지 않은 물을 마시지 않도록 해야 한다. 특히 식중독을 일으키는 세균 가운데는 독소를 분비하는 것도 있는데, 이 독소가 끓여도 없어지지 않기 때문에 음식물 관리나 보관에 각별한 주의가 필요하다. 되도록 음식은 깨끗한 손으로 신선한 재료를 이용해 바로 요리해서 곧바로 먹는 것이 가장 안전하다. 음식을 냉장고에 넣어 두면 무조건 괜찮다고 생각하는 사람들도 있는데, 냉장 보관을 하면 세균 증식이 느려지기는 하지만 완전히 멈추지는 않는다는 점에 유의해야 한다.다행히 식중독은 대부분 특별한 치료 없이 자연 치유된다. 하지만 유아나 노인 등 노약자는 설사, 구토 때문에 탈수에 빠질 수 있으므로 주의가 필요하다. 또 설사가 사흘 이상 계속되거나, 고열이 있거나, 변에 혈액이 섞여 나오는 경우에는 즉시 병원을 찾아야 한다.식중독으로 설사를 할 때 자가진단만으로 지사제 등을 함부로 먹는 경우가 있는데, 억지로 설사를 멈추면 오히려 장염이 악화될 수 있으므로 사용을 자제하는 것이 좋다. 설사는 몸속의 세균이나 독소를 장에서 흡수되지 않도록 빨리 배출해 내는 인체의 방어작용이기 때문이다.김양중 의료전문기자himtrain@hani.co.kr도움말: 최민규 한림대의료원 강남성심병원 가정의학과 교수, 전용준 다사랑중앙병원 원장<한겨레 인기기사>■올림픽 성화봉송 문대성, ‘태권왕’ 아닌 ‘철판왕’■“서울대 없어지면 연·고대등 사립대만 더 뜰것”■한-일 군사협정 꼭 막아야할 3가지 이유■[화보] 울음 참는 피겨여왕 김연아■‘MB의 굴욕’…국회 개원 연설 도중 박수 한번 못 받아공식 SNS[통하니][트위터][미투데이]| 구독신청[한겨레신문][한겨레21]Copyrights ⓒ 한겨레신문사, 무단전재 및 재배포 금지<한겨레는 한국온라인신문협회(www.kona.or.kr)의 디지털뉴스이용규칙에 따른 저작권을 행사합니다.>"
42,2012-07-02,"""어린이집에 맡겼다가 2살 아기 끔찍한 화상""",https://news.naver.com/main/read.nhn?mode=LSD&mid=shm&sid1=102&oid=001&aid=0005674522,연합뉴스,"어린이집서 끔찍한 화상 입은 2살 아기    (인천=연합뉴스) 인천의 한 어린이집에 맡겨진 2살된 아기가 심한 화상을 입었는데도 해당 어린이집이 사고 직후 적절한 조치를 취하지 않았다는 고발 글이 인터넷에 올라와 누리꾼들의 공분을 사고 있다.    사고 경위에 대해 계속 말을 바꾸던 해당 어린이집은 사고가 발생한 지 1주일이 지나서야 관할 구청에 사고 사실을 신고했다.    인터넷 포털사이티의 한 커뮤니티에 글쓴이가 올린 화상을 입은 아기 사진. 2012.7.2 <<인터넷 화면, 지방기사 참고>>    son@yna.co.kr어린이집 측 사고 직후 조치 미흡..1주일후 구청에 신고(인천=연합뉴스) 손현규 기자 = 인천의 한 어린이집에 맡겨진 2살된 아기가 심한 화상을 입었는데도 해당 어린이집이 사고 직후 적절한 조치를 취하지 않았다는 고발 글이 인터넷에 올라와 누리꾼들의 공분을 사고 있다.사고 경위에 대해 계속 말을 바꾸던 해당 어린이집은 사고가 발생한 지 1주일이 지나 관할 구청에 사고 사실을 신고했다.2일 이 아기의 가족으로 보이는 A씨가 인터넷 포털사이트의 한 커뮤니티에 쓴 글에 따르면 지난달 25일 인천시 남동구의 한 어린이집에서 16개월 된 남자 아기가 화상을 입었다.회사에 있다가 아기의 할머니에게서 연락을 받은 A씨는 급히 병원으로 달려갔다.A씨는 어린이집의 한 선생님에게서 ""응가가 묻어서 씻기려고 욕조에 둔 뒤, 샤워기를 튼 상태에서 잠깐 자리를 비운 사이 뜨거운 물이 나와 아기가 데였다""는 말을 들었다.아기는 현재 화상 전문 병원으로 옮겨졌으며 2도 화상이라는 진단을 받았다.문제는 어린이집 측이 실수를 인정하지 않고 계속 말을 바꾸며 관할 구청에 늑장 보고를 한 것.A씨는 글에서 ""어린이집 측에서는 '고무장갑을 끼고 있어서 온도를 몰랐다'거나 '다 씻기고 옷 가지러 간 사이 화장실에 있던 다른 아기가 물을 틀었다'는 둥 말이 계속 바뀌고 있습니다""라고 주장했다.그는 또 ""어린이집 측에서는 사건 다음날 구청에 신고할거고 구청쪽에서 조사차 병원에 나올거라고 했는데 아직도 구청쪽에선 안나왔습니다""라고 울분을 토했다.A씨는 사고 직후 어린이집 측의 조치도 문제 삼았다.그는 ""사고 당시 보호자에게 연락이 없었고 마침 아기의 할머니가 데리러 갔을 시간에 한 선생님이 화장실에서 아기의 엉덩이에 찬물을 뿌리고 있었다""고 주장했다.하지만 아파트 단지 1층에 있는 있는 어린이집이라 CCTV가 없어 정확한 사고 경위는 현재 알 수 없는 상태다.A씨는 또 ""어린이집 쪽에서는 입에 발린 사과의 말만 할뿐 계속해서 사고 경위를 바꿔 말하는 등 거짓말만 늘어놓고 있습니다""라며 분통을 터뜨렸다.해당 글과 사진을 본 네티즌들은 어린이집의 처사에 분노하며 비난 댓글을 달았다.한 누리꾼은 댓글에서 ""아기 키우는 엄마로써 너무 안타깝고 눈물이 나려고해요. 저 어린 아가가 얼마나 아프고 힘들까요""고 썼다.또 다른 누리꾼은 ""행여 흉터가 지거나 아이가 커서 트라우마라도 생기면 어쩌나 싶네요""라며 안타까워 했다.A씨는 글에서 ""계속 고통스러워 '아아아아' 하는데 말도 못하는 아기가 '아프다 아프다' 소리치는것 같이 들려 눈물만 납니다""며 글을 마쳤다.이 어린이집을 관할하고 있는 인천시 남동구의 한 관계자는 ""오늘 신고가 들어와 보육행정팀 관계자들이 아기의 상태를 확인하러 갔다""며 ""어린이집 안전공제회를 통해 의료비는 지급받게 된다""고 밝혔다.해당 어린이집은 기자와의 통화에서 ""그런 사실이 없다""며 사실 관계 확인을 거부한 뒤 일방적으로 전화를 끊었다.son@yna.co.kr[이 시각 많이 본 기사]☞새누리, 차기전투기 등 현정부 강행사업 `제동'☞김연자 ""결혼 30년만에 이혼""☞""정치부 기자들이 꼽은 차기대통령감은 문재인""☞-유로2012- 스페인, 사상 첫 2연패 달성(종합2보)☞<통합진보, `제명 의총' 시기 놓고 신경전>(종합)<연합뉴스 모바일앱 다운받기><포토 매거진><저작권자(c)연합뉴스. 무단전재-재배포금지.>"
43,2012-07-02,"왜? 6월 물가상승률 2.2%…작년 반토막인데, 3명중 1명 물가불안",https://news.naver.com/main/read.nhn?mode=LSD&mid=shm&sid1=101&oid=028&aid=0002148252,한겨레,"[한겨레]① 작년 이미 크게 올라② 채소·과일쪽은 10%대③ 무상급식 등 체감 한계‘2.2%.’ 통계청이 2일 밝힌 6월 소비자물가 상승률이다. 2009년 10월(2.0%) 이후 32개월 만에 최저 수준이다. 소비자물가 상승률은 최근 넉달 연속 2%대를 유지하고 있다. 지난해 연평균 상승률이 4%였던 점을 고려하면 거의 반토막에 가깝다.‘32.5%.’ 최근 정부가 진행한 설문조사에서 하반기 경제정책방향으로 ‘물가 안정’을 최우선 과제로 꼽은 응답자 비율이다. 3명 가운데 1명꼴이다. 기획재정부와 한국개발연구원(KDI)은 지난달 4~22일 일반인 1000명과 전문가 281명을 대상으로 ‘2012년 하반기 경제정책방향 설문조사’를 진행했다. 국민들은 일자리 창출(14.7%)이나 민생안정·복지확충(27.3%)보다 물가안정을 더 바라고 있었다.수치상 물가는 어느 때보다 안정적인데, 국민들은 여전히 물가안정을 가장 시급한 과제로 여기고 있다. 이런 괴리감은 어디에서 비롯되는 것일까?우선 ‘상승률’ 자체는 낮더라도 절대적인 물가수준 자체는 매우 높다는 점을 들 수 있다. 안형준 통계청 물가동향과장은 “전년과 비교한 물가상승률은 비교적 낮지만, (2010년 물가를 100으로 놓고 계산한) 물가지수로 보면 1년 반 만에 6% 이상 올랐다”며 “사람들이 체감하는 물가가 전반적으로 높다”고 말했다. 예컨대 2010년에 100만원 하던 냉장고가 2011년 6월에는 103만8000원으로 오르고, 올해 6월에는 106만1000원으로 뛴 셈이다. 지난해 물가상승률이 4%로 높았던 탓에 올해는 상대적으로 상승률이 낮아지는 ‘기저효과’도 발생하고 있다.일상생활과 밀접한 의식주 관련 물품의 물가상승률이 다른 품목에 비해 상대적으로 높은 점도 영향을 끼친 것으로 보인다. 지난달 농축수산물의 전년 동월 대비 상승률은 5.8%로, 평균 물가상승률(2.2%)의 2.6배나 됐다. 특히 신선 채소와 과일의 경우 가뭄의 영향으로 각각 19.8%, 11.0%나 올랐다. 가뭄의 영향이 홍수보다도 서서히 나타나는 점을 고려하면 앞으로도 채소·과일값은 더 오를 전망이다. 교통비와 의류비, 연료비 등도 전년 동월 대비 4.2~5.6% 올라 평균 이상의 상승률을 기록했다. 임희정 현대경제연구원 연구위원은 “장바구니, 식탁 물가가 상대적으로 높게 형성돼 있다”며 “경기가 좋지 않아 임금이 잘 오르지 않은 상황에서 서민들이 물가 부담을 크게 느끼고 있다”고 말했다.이밖에 올해 본격화된 무상보육·급식·대학등록금 지원 등 이른바 ‘무상정책 3총사’에 의한 물가인하 효과가 특정 가구에만 집중돼 나타나는 점도 원인으로 꼽힌다. 통계청은 이 3가지 무상정책으로 인해 0.5%포인트의 물가인하 효과가 있는 것으로 보고 있다. 하지만 이들 정책으로 인한 효과는 아동·중고생·대학생 자녀를 둔 가정만 제한적으로 체감할 수 있다. 성창훈 재정부 물가정책과장은 “교육비 측면에서 무상정책의 효과가 한정돼 나타나는 부분이 있다”고 말했다. 엘지(LG)경제연구원도 지난 4월 물가 관련 보고서를 통해 “무상보육 등 인위적 정책 효과로 (정부가) 물가 흐름을 너무 낙관적으로 판단할 수 있다”고 지적했다.최현준 기자haojune@hani.co.kr[화보]김연아 “2014 소치올림픽서 은퇴”<한겨레 인기기사>■올림픽 성화봉송 문대성, ‘태권왕’ 아닌 ‘철판왕’■“서울대 없어지면 연·고대등 사립대만 더 뜰것”■한-일 군사협정 꼭 막아야할 3가지 이유■[화보] 울음 참는 피겨여왕 김연아■‘MB의 굴욕’…국회 개원 연설 도중 박수 한번 못 받아공식 SNS[통하니][트위터][미투데이]| 구독신청[한겨레신문][한겨레21]Copyrights ⓒ 한겨레신문사, 무단전재 및 재배포 금지<한겨레는 한국온라인신문협회(www.kona.or.kr)의 디지털뉴스이용규칙에 따른 저작권을 행사합니다.>"
