,날짜,기사 제목,기사 링크,기사 출처,기사 내용
95,2012-07-02,경제 곤란 대졸자 2년간 학자금 상환유예,https://news.naver.com/main/read.nhn?mode=LSD&mid=shm&sid1=102&oid=001&aid=0005672833,연합뉴스,"(서울=연합뉴스) 임주영 기자 = 교육과학기술부와 한국장학재단은 학자금을 대출받은 대학생 졸업자 중 경제적 곤란자에 대해 원리금 상환을 최대 2년간 유예하는 `일반학자금 특별상환유예 제도'를 시행한다고 2일 밝혔다.이는 대학 졸업 후에도 취업이 안 되거나 경제 사정이 곤란해진 학생들의 대출 상환 부담을 줄이고, 장기간 연체로 인해 신용유의자로 등록되는 부작용을 예방하기 위한 것이다.신청 대상자는 대학 졸업생으로, 신청자의 부모가 사망, 파산ㆍ면책, 개인회생 결정을 받았거나 본인이 기초생활수급권자 또는 장애인인 경우, 부모 또는 본인이 중증 질병(암ㆍ심근경색ㆍ뇌질환)을 앓고 있는 경우 중 하나에 해당하면 된다.유예 대상은 2009년 2학기 이후 지급된 일반 상환 학자금이다.준비서류나 상세 요건 등 자세한 내용은 장학재단 홈페이지(www.kosaf.go.kr)나 콜센터(☎1666-5114)에서 확인할 수 있다.zoo@yna.co.kr[이 시각 많이 본 기사]☞이한구 ""野 총리해임 요구 말도 안 돼""(종합)☞보이프렌드, 日 부도칸 쇼케이스 4만팬 열광☞정몽준 ""김문수, 약속 지킬 것으로 기대""(종합2보)☞-유로2012- 스페인, 사상 첫 2연패 달성(종합2보)☞새누리, 차기전투기 등 현정부 강행사업 `제동'<연합뉴스 모바일앱 다운받기><포토 매거진><저작권자(c)연합뉴스. 무단전재-재배포금지.>"
96,2012-07-02,"유아, 받기보다 주는데 행복 느껴",https://news.naver.com/main/read.nhn?mode=LSD&mid=shm&sid1=103&oid=001&aid=0005672852,연합뉴스,"(서울=연합뉴스) 유아는 받기보다 주는 데 더 행복을 느낀다는 연구결과가 나왔다.캐나다 브리티시 칼럼비아 대학의 라라 애크닌(Lara Aknin) 심리학교수는 2세 미만 유아들을 대상으로 실시한 실험에서 이러한 사실을 발견했다고 헬스데이 뉴스가 30일 보도했다.애크닌 교수는 유아들에 좋아하는 것을 몇 가지 주고 몇 분 후 그 중 하나를 인형에게 주라고 했다. 이어서 좋아하는 것을 하나 더 주고 그것도 인형에 주라고 했다.연구팀은 아기들의 반응을 비디오테이프에 담아 분석했다. 그 결과 아기들은 자신이 가지고 있던 것을 줄 때에 나중에 추가로 하나 더 받을 것을 줄 때보다 더 기쁨을 느끼는 것으로 나타났다.유아는 이기적인 천성을 가지고 태어나는 것으로 알려져 있다. 그러나 유아는 받는 것보다 주는 것을 더 좋아한다는 것을 이 실험은 보여주고 있다.이 연구결과는 온라인 과학전문지 '공중과학도서관(PLoS One)'에 실렸다.skhan@yna.co.kr[이 시각 많이 본 기사]☞이한구 ""野 총리해임 요구 말도 안 돼""(종합)☞보이프렌드, 日 부도칸 쇼케이스 4만팬 열광☞정몽준 ""김문수, 약속 지킬 것으로 기대""(종합2보)☞-유로2012- 스페인, 사상 첫 2연패 달성(종합2보)☞새누리, 차기전투기 등 현정부 강행사업 `제동'<연합뉴스 모바일앱 다운받기><포토 매거진><저작권자(c)연합뉴스. 무단전재-재배포금지.>"
97,2012-07-02,"물의 암반 침투속도, 생각보다 훨씬 빨라",https://news.naver.com/main/read.nhn?mode=LSD&mid=shm&sid1=105&oid=001&aid=0005672819,연합뉴스,"(서울=연합뉴스) 깊은 땅 속의 뜨거운 지하수가 바위를 뚫는데 걸리는 시간이 지금까지 학자들이 생각했던 것보다 수백배나 빠른 것으로 밝혀졌다고 라이브사이언스 닷컴이 2일 보도했다.독일 뮌스터 대학 과학자들은 중국 톈산 산맥에서 약 3억1천500만년 전 지하 70㎞에서 액체가 뚫고 지나가면서 만든 `혈관' 모양의 화석화된 광물질 구조를 분석한 결과 초고온수가 바위를 뚫는데 걸린 시간이 200년에 불과하다는 사실을 밝혀냈다고 네이처 지오사이언스지에 발표했다.이들은 ""액체가 저장 공간에 축적됐다가 제트류처럼 방출돼 단단한 바위를 뚫고 지나간다""면서 이처럼 빠른 지하수의 맥동적인 움직임은 지진이나 화산활동과 관련 있는 것으로 장차 지진과 화산 폭발 같은 현상을 이해하고 나아가 예고하는데도 도움이 될 것이라고 말했다.두 개의 판이 충돌해 하나가 다른 판의 밑으로 파고 들어가는 `섭입' 현상이 일어날 때 매우 높은 열과 압력으로 인해 마치 스펀지에 스며들었던 것처럼 암석 속에 들어 있던 물이 맨틀층으로 솟아 올라 마그마를 형성하는 역할을 하게 된다.녹은 암석은 이른바 `불의 고리'로 불리는 환태평양 화산대가 폭발하는 연료 역할을 한다. 즉 수분이 초고온의 수증기 형태로 이들 지역에 대규모 폭발력을 공급하는 것이다.지금까지 과학자들은 섭입판의 액체가 마치 젖은 스펀지의 물이 종이를 서서히 적시는 것처럼 스며 나오는 것으로 생각해 왔다. 그러나 이번 연구는 암석층의 물이 스펀지를 꽉 쥐어 짤 때처럼 솟구친다는 것을 보여주고 있다.이 연구는 마그마가 아주 먼 거리를 수백년 안에 이동한다는 것을 보여준 다른 화산 연구들과도 일치하는 것이다.youngnim@yna.co.kr[이 시각 많이 본 기사]☞이한구 ""野 총리해임 요구 말도 안 돼""(종합)☞보이프렌드, 日 부도칸 쇼케이스 4만팬 열광☞정몽준 ""김문수, 약속 지킬 것으로 기대""(종합2보)☞-유로2012- 스페인, 사상 첫 2연패 달성(종합2보)☞새누리, 차기전투기 등 현정부 강행사업 `제동'<연합뉴스 모바일앱 다운받기><포토 매거진><저작권자(c)연합뉴스. 무단전재-재배포금지.>"
98,2012-07-02,부자들이 꼽은 1순위 투자대상은 부동산,https://news.naver.com/main/read.nhn?mode=LSD&mid=shm&sid1=101&oid=001&aid=0005672861,연합뉴스,"지난해 부자 증가율 8.9%…금융위기 이후 최소폭(서울=연합뉴스) 고유선 기자 = 얼어붙은 부동산 시장 상황에도 우리나라 부자 3명 가운데 1명은 부동산을 가장 유망한 투자 대상으로 꼽았다.KB금융지주 경영연구소는 2일 금융자산 10억원 이상 보유자 400명을 대상으로 조사한 `2012 한국 부자 보고서'를 발표했다.보고서에 따르면 우리나라 부자들의 평균 총자산은 144억원인 것으로 나타났다. 이 중 부동산이 58.0%로 가장 많았고 금융자산이 35.2%, 기타자산(예술품, 회원권 등)이 6.8%인 것으로 집계됐다.부동산 시장이 침체기에 있지만 부자들의 30%는 유망한 투자 대상 1순위로 부동산을 꼽았다. 그러나 지난해(45%)보다는 하락한 수치다.특히 집값 하락이 두드러진 서울과 수도권 부자들이 부동산 투자 의향이 상대적으로 낮았다.부동산 다음으로는 국내주식(19.8%), 예ㆍ적금(12.3%) 순이었다.소득과 지출을 보면 부자가구(2인 이상)의 평균 연소득은 4억1천200만원으로 통계청 가계동향조사에서 나타난 2011년 일반 도시가구 평균 연소득 4천700만원의 8.8배에 달했다.또한 부자들은 소득의 37%가 이자ㆍ배당ㆍ임대수익 등 보유자산을 통한 재산소득으로 나타나 근로소득 비중이 87.1%인 일반가구와 뚜렷한 차이를 보였다.지출 면에서 눈에 띄는 것은 자녀교육비로, 부자가구는 월평균 소비지출 1천51만원 중 24.5%를 교육비로 지출할 만큼 자녀 교육에 대한 열의가 높았다.한편 연구소가 한국은행과 통계청, 국민은행 자료 등을 토대로 살펴본 결과 전국의 부자 수는 2010년 13만명에서 2011년 14만2천명으로 8.9% 증가했다.이는 2008년 글로벌 금융위기 이후 2년 연속 20%대 증가율을 보인 것에 비해 크게 둔화된 수치다.지역별로는 서울 부자가 6만8천명으로 전국 부자 수의 47.9%를 차지했다. 하지만 최근 전국 부자 중 서울 부자의 비중은 2009년에서 2011년 사이 49.6%에서 47.9%로 1.7%포인트 하락한 것에 비해 부산ㆍ울산ㆍ경남권 등 다른 도시의 부자 비중은 최고 0.9% 상승했다.cindy@yna.co.kr[이 시각 많이 본 기사]☞이한구 ""野 총리해임 요구 말도 안 돼""(종합)☞보이프렌드, 日 부도칸 쇼케이스 4만팬 열광☞정몽준 ""김문수, 약속 지킬 것으로 기대""(종합2보)☞-유로2012- 스페인, 사상 첫 2연패 달성(종합2보)☞새누리, 차기전투기 등 현정부 강행사업 `제동'<연합뉴스 모바일앱 다운받기><포토 매거진><저작권자(c)연합뉴스. 무단전재-재배포금지.>"
99,2012-07-02,"李대통령, 한일정보협정 `절차 잘못' 질타(종합)",https://news.naver.com/main/read.nhn?mode=LSD&mid=shm&sid1=100&oid=001&aid=0005672868,연합뉴스,"이명박대통령(자료사진)수석비서관회의..""여론수렴없이 처리할 일 아니었다""""국회ㆍ국민에 소상히 공개하고 설명하라"" 지시(서울=연합뉴스) 김종우 기자 = 이명박 대통령은 2일 `밀실 처리' 논란을 낳고 있는 한-일 군사정보보호협정(GSOMIAㆍ이하 군사정보협정) 체결 추진 과정에서의 절차상 잘못에 대해 강하게 질타했다.이 대통령은 이날 청와대에서 수석비서관회의를 주재하면서 ""`즉석 안건'으로 국무회의에 상정하는 등 충분한 여론수렴 과정 없이 처리할 일이 아니었다""고 지적했다고 박정하 청와대 대변인이 지적했다.특히 이 대통령은 ""이 협정은 이미 러시아를 비롯한 24개국과도 체결했고, 앞으로도 중국과의 체결이 필요한 국가적으로 도움이 되는 협정""이라고 강조했다.이 대통령은 이어 ""국회와 국민에게 협정 내용을 소상하게 공개하고 설명해 오해가 없도록 조치하라""고 지시했다.실제로 이 대통령은 한일 군사정보협정과 관련, 그 추진 배경과 의미 등 큰 틀에 대해서는 보고를 받았으나, 국무회의에서의 비공개 처리 과정과 그 이유에 대해서는 사전에 자세한 보고를 받지 못한 것으로 알려졌다.박 대변인은 ""이 대통령은 국무회의에서 이 협정이 즉석 안건으로 올라간 데 대해 자세히 알지 못한 것으로 안다""면서 ""군사정보협정이 (국무회의에서) 통과될지도 보고를 못 받은 것으로 알고 있다""고 전했다.그는 그러나 절차상 잘못에 따른 `인책론'에 대해 ""그런 논의는 없었다""면서 ""총리가 이미 유감을 표명을 했고 국회에 가서 설명하기로 한 만큼 인책 단계는 아니라고 본다""고 강조했다.박 대변인은 이어 `국회 설명 뒤 예정대로 서명 절차를 밟느냐'는 질문에 ""이 협정이 필요하다는 생각은 변함이 없다""면서 ""현재로선 국회에서 충분히 논의돼 좋은 방향으로 결론이 나기를 기대한다""고 덧붙였다.jongwoo@yna.co.krtwitter: @newswoo[이 시각 많이 본 기사]☞이한구 ""野 총리해임 요구 말도 안 돼""(종합)☞보이프렌드, 日 부도칸 쇼케이스 4만팬 열광☞정몽준 ""김문수, 약속 지킬 것으로 기대""(종합2보)☞-유로2012- 스페인, 사상 첫 2연패 달성(종합2보)☞새누리, 차기전투기 등 현정부 강행사업 `제동'<연합뉴스 모바일앱 다운받기><포토 매거진><저작권자(c)연합뉴스. 무단전재-재배포금지.>"
100,2012-07-02,19대 국회 전반기 강창희 국회의장 선출,https://news.naver.com/main/read.nhn?mode=LSD&mid=shm&sid1=100&oid=001&aid=0005672822,연합뉴스,"강창희 국회의장 선출    (서울=연합뉴스) 백승렬 기자 = 새누리당 강창희 의원이 2일 본회의에서 국회의장으로 선출되고 나서 사회를 보고 있다. 2012. 7. 2    srbaek@yna.co.kr국회부의장엔 이병석ㆍ박병석(서울=연합뉴스) 김범현 기자 = 국회는 2일 오전 19대 국회 첫 본회의를 열고 앞으로 2년간 입법부를 이끌 신임 국회의장으로 6선의 새누리당 강창희 의원을 선출했다.강 신임 의장은 이날 국회 최다선(7선) 의원인 새누리당 정몽준 의원의 사회로 진행된 무기명 비밀투표에서 전체 283표 중 195표를 획득했다.강 신임 의장은 육사 출신으로 육군대 교수로 있다가 1980년 신군부 집권 후 중령으로 예편, 민정당 조직국장으로 정계에 입문했다.이어 11∼12대, 14∼16대에 국회의원을 지냈고 8년의 정치적 휴지기를 거쳐 이번 4ㆍ11 총선에서 대전 중구에 출마, 6선에 성공했다. 국민의 정부 초반 과학기술부 장관을 지내기도 했다.강 의장은 새누리당 박근혜 전 비상대책위원장의 원로 자문단으로 불리는 '7인회'에 참여하는 친박(친박근혜)계 핵심의원으로도 꼽힌다.국회의장은 당적을 이탈하도록 한다는 현행 국회법 규정에 따라 새누리당의 의석은 149석으로 1석 줄었다.이와 함께 국회는 강 신임의장의 사회로 19대 전반기 국회의장단을 꾸릴 국회부의장 2명을 선출한다.국회부의장으로는 여당 몫인 4선의 새누리당 이병석(경북 포항북) 의원과 야당 몫인 4선의 민주통합당 박병석(대전 서갑) 의원이 사실상 확정된 상태다.kbeomh@yna.co.kr[이 시각 많이 본 기사]☞""北, 7.4성명 통해 朴정권 기반 흔들려했다""(종합)☞고소영, '힐링캠프' 출연..결혼 후 첫 토크쇼☞<""어린이집에 맡겼다가 2살 아기 끔찍한 화상"">☞-여자주니어핸드볼- 한국, 카자흐스탄 완파☞<통합진보, `제명 의총' 시기 놓고 신경전>(종합)<연합뉴스 모바일앱 다운받기><포토 매거진><저작권자(c)연합뉴스. 무단전재-재배포금지.>"
101,2012-07-02,"부산서 운동부 성추행, 학생ㆍ코치 검거",https://news.naver.com/main/read.nhn?mode=LSD&mid=shm&sid1=102&oid=001&aid=0005672418,연합뉴스,"(부산=연합뉴스) 차근호 기자 = 부산의 한 학교에서 동성의 운동부 후배들을 상습적으로 성추행한 선배 학생과 그 선배 학생을 다시 성추행한 코치가 나란히 경찰에 붙잡혔다.부산 서부경찰서는 2일 운동부 후배 3명을 몇 년 동안 상습적으로 강제추행한 혐의(성폭력범죄의 처벌 등에 관한 특례법 위반)로 A고 1학년 B(16)군을 구속했다.경찰은 또 B군의 범행 사실을 알고 이를 약점으로 B군을 되레 성추행한 혐의(아동ㆍ청소년 성보호에 관한 법률 위반)로 운동부 코치 C(25)씨에 대해 구속영장을 신청했다.B군은 지난 2009년 5월부터 최근까지 운동부 남자 후배 D(13)군 등 3명을 합숙소나 교내로 불러 수십 차례에 걸쳐 성추행한 혐의를 받고 있다.운동부 코치 C씨는 D군 등이 B군에게 성추행당했다는 사실을 알고 이를 약점 잡아 B군을 다섯 차례에 걸쳐 강제 추행한 혐의를 받고 있다.경찰은 또 자신의 학교 운동부에서 이런 일이 발생하자 사건을 은폐하려 한 혐의(증거인멸)로 사무국장 박모(36)씨를 불구속 입건했다.경찰조사 결과 피해학생들이 보복 등 후환이 두려워 폭력 사실 등을 제때 알리지 못했던 것으로 드러났다.ready@yna.co.kr[이 시각 많이 본 기사]☞이한구 ""野 총리해임 요구 말도 안 돼""(종합)☞보이프렌드, 日 부도칸 쇼케이스 4만팬 열광☞정몽준 ""김문수, 약속 지킬 것으로 기대""(종합2보)☞-美야구- 추신수, 홈런 포함 4안타 3타점 폭발☞이해찬 ""총리 해임 않으면 불신임 결의""(종합)<연합뉴스 모바일앱 다운받기><포토 매거진><저작권자(c)연합뉴스. 무단전재-재배포금지.>"
102,2012-07-02,"李대통령, 한일정보협정 `절차상 잘못' 질타",https://news.naver.com/main/read.nhn?mode=LSD&mid=shm&sid1=100&oid=001&aid=0005672762,연합뉴스,"이명박대통령(자료사진)수석비서관회의..""국회ㆍ국민에 소상히 공개ㆍ설명""(서울=연합뉴스) 김종우 기자 = 이명박 대통령은 2일 `밀실 처리' 논란을 낳고 있는 한-일 군사정보보호협정(GSOMIAㆍ이하 군사정보협정) 체결 추진 과정에서 발생한 절차상 잘못에 대해 강하게 질타했다.이 대통령은 이날 청와대에서 수석비서관회의를 주재하면서 ""이 협정은 이미 러시아를 비롯한 24개국과도 체결했고, 앞으로 중국과도 체결이 필요한 국가적으로 도움이 되는 협정""이라며 이같이 지적했다고 박정하 청와대 대변인이 전했다.특히 이 대통령은 ""`즉석 안건'으로 국무회의에 상정하는 등 충분한 여론 수렴 과정 없이 처리할 일이 아니었다""면서 매끄럽지 못한 절차를 강하게 질책했다.이 대통령은 이어 ""국회와 국민에게 협정 내용을 소상하게 공개하고 설명해 오해가 없도록 조치하라""고 지시했다.jongwoo@yna.co.krtwitter: @newswoo[이 시각 많이 본 기사]☞이한구 ""野 총리해임 요구 말도 안 돼""(종합)☞보이프렌드, 日 부도칸 쇼케이스 4만팬 열광☞정몽준 ""김문수, 약속 지킬 것으로 기대""(종합2보)☞-유로2012- 스페인, 사상 첫 2연패 달성(종합2보)☞새누리, 차기전투기 등 현정부 강행사업 `제동'<연합뉴스 모바일앱 다운받기><포토 매거진><저작권자(c)연합뉴스. 무단전재-재배포금지.>"
103,2012-07-02,카드빚 못 갚아 경매 내몰린 아파트 증가세,https://news.naver.com/main/read.nhn?mode=LSD&mid=shm&sid1=101&oid=001&aid=0005672712,연합뉴스,"""집 팔아도 빚을 다 못 갚는 채무자 상당수""(서울=연합뉴스) 이유진 기자 = 신용카드 빚을 못 갚아 집까지 경매에 넘어가는 사례가 급증하고 있다.부동산경매전문업체 지지옥션은 2009년부터 현재까지 수도권(서울·경기·인천) 부동산경매시장에 나온 매물을 분석한 결과 신용카드 회사가 경매 신청한 물건이 증가세를 보였다고 2일 밝혔다. 카드대금을 연체해 경매당하는 집이 늘었다는 뜻이다.2009년 486건이었던 카드사의 경매신청 건수는 2010년 522건, 2011년 553건으로 증가했다. 올해는 상반기에 벌써 328건을 기록해 연말께 작년 전체 경매신청 건수를 웃돌 것으로 보인다.카드사가 경매 신청한 물건은 채권자가 경매를 통해 회수하고자 하는 경매 청구금액이 다른 물건보다 적은 게 특징이다. 감정가 11억원인 양천구 목동 목동신시가지 아파트 전용면적 98㎡의 청구액은 밀린 카드빚 880만원에 불과하다.그러나 이미 다른 금융건에 의해 중복 경매가 신청된 물건이 대다수라 청구액을 회수하기는 쉽지 않다.경기도 성남시 분당구 정자동 전용면적 129.7㎡ 우성아파트의 경우 집주인이 2001년 소유권을 취득한 뒤 주택담보대출로 은행에서 6억6천500만원을 빌렸다. 이후 카드값 1천400여만원을 못 갚자 카드사가 집을 강제경매 신청했고 한달 뒤 대출받은 은행도 중복 경매를 신청했다.올해 카드사 경매신청 물건 328건 중 152건은 은행과 저축은행 등 중복으로 경매를 신청한 건이라고 업체는 전했다.지지옥션 하유정 연구원은 ""무리한 대출을 받은 집주인이 이자와 생활비 부담으로 카드빚을 지고 아파트를 경매당하는 사례가 늘고 있다""면서 ""집을 처분해도 빚은 다 갚지 못할 가능성이 높다""고 말했다.eugenie@yna.co.kr[이 시각 많이 본 기사]☞이한구 ""野 총리해임 요구 말도 안 돼""(종합)☞보이프렌드, 日 부도칸 쇼케이스 4만팬 열광☞정몽준 ""김문수, 약속 지킬 것으로 기대""(종합2보)☞-유로2012- 스페인, 사상 첫 2연패 달성(종합2보)☞새누리, 차기전투기 등 현정부 강행사업 `제동'<연합뉴스 모바일앱 다운받기><포토 매거진><저작권자(c)연합뉴스. 무단전재-재배포금지.>"
104,2012-07-02,한일 군사정보협정 놓고 정부내 강온 기류,https://news.naver.com/main/read.nhn?mode=LSD&mid=shm&sid1=100&oid=001&aid=0005672707,연합뉴스,"靑 ""국회 보고 뒤 서명""..외교부 ""처리 어려울 듯""(서울=연합뉴스) 안용수 기자 = 한ㆍ일 군사정보보호협정(GSOMIAㆍ이하 군사정보협정) 추진을 놓고 정부 안에서 강온 기류가 감지되고 있다.일단 북한의 탄도 미사일 발사와 테러 위협 등 최근 잇단 도발 조짐 이후 북한의 동태를 살피려면 일본과의 군사정보협정이 필요하다는 데는 이견이 없는 것으로 보인다.문제는 일본과 서명식 직전에 보류한 협정을 둘러싸고 `졸속 추진'이라는 여론이 팽배해지면서 과연 재추진이 가능하겠느냐는 것이다.게다가 이해찬 민주통합당 대표는 김황식 국무총리의 해임과 함께 협정 폐기를 들고 나와 앞으로 추진 과정에서 험로가 예상된다.청와대는 국회에 충분히 설명을 하고 나면 분위기가 `반전'되지 않겠느냐는 희망 섞인 전망을 내놓고 있다.청와대 고위 관계자는 2일 연합뉴스와의 통화에서 ""국회 보고를 마치면 예정대로 서명 절차에 들어갈 예정""이라고 밝혔다.또 다른 핵심 참모는 ""아직 야당도 협정에 대해 오해를 하고 있는 부분이 있다""면서 ""양국에 필요한 내용을 담고 있어 설명을 하면 분위기가 달라질 것""이라고 말했다.반면 이번 협상 주무부처인 외교통상부 등에서는 온도차를 보이고 있다.정부의 한 당국자는 ""협정 내용 자체에는 문제가 없는데 처리 방식의 문제였다""면서 ""이번 정부 임기 내 처리는 어렵지 않을까 싶다""고 비관적인 전망을 했다.또 다른 정부 관계자도 체결 가능성에 대해 `반반'이라고 확신을 못하는 분위기다. 국회에서 충분히 설명을 한다고 해도 부정적 여론을 넘어서기는 어려울 것이라는 논거다.이 같은 과정에서 정부는 이번 사태의 책임을 서로 떠넘기는 행태를 보이고 있어 비판을 자초하고 있다.경위야 어찌 됐건 국익을 위해 협정 자체가 필요하다면 어떻게든 국민을 설득하려는 노력이 우선이지만 청와대ㆍ외교부ㆍ국방부가 서로 `손가락질'하는 형국이기 때문이다.외교부 고위 당국자는 전날(1일) 기자들과 만나 ""국무회의 비공개 안건 처리 방식이 잘못됐다는 점을 여러 번 지적했다""면서 ""의결 당시 알리지 않은 것은 청와대의 의중""이라고 말했다.자신들은 `핸들'만 잡았을 뿐 지시한 사람은 따로 있는데 억울하다는 것이다.특히 외교부 당국자들이 비공식적으로 내놓는 불만들은 김태효 청와대 대외전략기획관을 겨냥하고 있다. 김 기획관이 이명박 대통령의 중남미 순방에 따라 가지 않고 국내에 남아 체결을 주도했다는 이유를 들고 있다.하지만 절차상 문제가 그렇게 심각해 보였다면 더욱 적극적으로 의견을 개진해야 할 텐데 수석급 비서관 한 사람에게 휘둘린 듯이 볼멘 소리를 하는 것은 `최고 엘리트'라고 자칭하는 조직의 `무능'을 스스로 자인한 격이라는 비판의 목소리도 터져나오고 있다.국방부도 책임에서 회피하려 하기는 마찬가지다.지난해 1월부터 1년 반 가까이 실무 협상을 주도했지만, `밀실 추진' 파문이 일자 외교부가 협정 당사자라는 점을 앞세우고 뒤로 빠지는 듯한 모습을 보이고 있다.협정 체결을 총괄 지휘한 청와대도 사안이 터진 지 일주일이 되도록 별다른 입장을 내놓지 않고 있다. 오히려 일부 참모진은 ""실무 총괄은 외교부가 했다""고 한 발 빼려는 듯한 모습을 보이고 있다.이렇게 누구 하나 나서지 않고 서로에게 책임을 떠넘기려는 행태를 두고 임기 말의 전형적 모습이라는 평가도 나오고 있다.aayyss@yna.co.kr[이 시각 많이 본 기사]☞이한구 ""野 총리해임 요구 말도 안 돼""(종합)☞보이프렌드, 日 부도칸 쇼케이스 4만팬 열광☞정몽준 ""김문수, 약속 지킬 것으로 기대""(종합2보)☞-유로2012- 스페인, 사상 첫 2연패 달성(종합2보)☞새누리, 차기전투기 등 현정부 강행사업 `제동'<연합뉴스 모바일앱 다운받기><포토 매거진><저작권자(c)연합뉴스. 무단전재-재배포금지.>"
